[I 2025-08-07 20:06:13,582] Trial 915 finished with value: 0.46887614727020266 and parameters: {'fp_type': 'morgan_rdkit', 'combined_morgan_radius': 3, 'combined_morgan_nBits': 1024, 'combined_rdkit_maxPath': 7, 'combined_rdkit_nBits': 1024, 'num_hidden_layers': 3, 'hidden_dim_0': 256, 'hidden_dim_1': 1024, 'hidden_dim_2': 64, 'kl_weight': 0.00029619609027749385, 'lr': 0.008426402877098657, 'batch_size': 128, 'dropout_rate': 0.1395019818161477, 'prior_mu': -0.03034059787978749, 'prior_sigma': 0.11919510832423251, 'normalization': 'layer'}. Best is trial 896 with value: 0.4533553242683411.
Generating morgan_rdkit fingerprints...
Generated fingerprints with 2048 features for 841 molecules
Trial 918: 5-fold CV loss = 0.4741
[I 2025-08-07 20:06:39,733] Trial 918 finished with value: 0.4741160452365875 and parameters: {'fp_type': 'morgan_rdkit', 'combined_morgan_radius': 3, 'combined_morgan_nBits': 1024, 'combined_rdkit_maxPath': 7, 'combined_rdkit_nBits': 1024, 'num_hidden_layers': 3, 'hidden_dim_0': 256, 'hidden_dim_1': 1024, 'hidden_dim_2': 64, 'kl_weight': 0.000272901651243791, 'lr': 0.005387998529368489, 'batch_size': 128, 'dropout_rate': 0.13764384655683826, 'prior_mu': -0.020808732455004558, 'prior_sigma': 0.1146104166276959, 'normalization': 'layer'}. Best is trial 896 with value: 0.4533553242683411.
Generating morgan_rdkit fingerprints...
Generated fingerprints with 2048 features for 841 molecules
Trial 916: 5-fold CV loss = 0.4789
[I 2025-08-07 20:06:43,092] Trial 916 finished with value: 0.4788978934288025 and parameters: {'fp_type': 'morgan_rdkit', 'combined_morgan_radius': 3, 'combined_morgan_nBits': 1024, 'combined_rdkit_maxPath': 7, 'combined_rdkit_nBits': 1024, 'num_hidden_layers': 3, 'hidden_dim_0': 256, 'hidden_dim_1': 1024, 'hidden_dim_2': 64, 'kl_weight': 0.0002949587449221548, 'lr': 0.005406803226176676, 'batch_size': 128, 'dropout_rate': 0.1421650813212785, 'prior_mu': -0.03304979459953379, 'prior_sigma': 0.11762271094153527, 'normalization': 'layer'}. Best is trial 896 with value: 0.4533553242683411.
Generating morgan_rdkit fingerprints...
Generated fingerprints with 2048 features for 841 molecules
Trial 917: 5-fold CV loss = 0.9355
[I 2025-08-07 20:06:47,658] Trial 917 finished with value: 0.9354862451553345 and parameters: {'fp_type': 'morgan_rdkit', 'combined_morgan_radius': 3, 'combined_morgan_nBits': 1024, 'combined_rdkit_maxPath': 7, 'combined_rdkit_nBits': 1024, 'num_hidden_layers': 3, 'hidden_dim_0': 256, 'hidden_dim_1': 1024, 'hidden_dim_2': 64, 'kl_weight': 0.00028721089896137836, 'lr': 0.00018646013619783838, 'batch_size': 128, 'dropout_rate': 0.13644240130034901, 'prior_mu': -0.032287651166336605, 'prior_sigma': 0.1183202980832381, 'normalization': 'layer'}. Best is trial 896 with value: 0.4533553242683411.
Generating morgan_rdkit fingerprints...
Generated fingerprints with 2048 features for 841 molecules
Trial 919: 5-fold CV loss = 0.5409
[I 2025-08-07 20:06:53,069] Trial 919 finished with value: 0.5408799767494201 and parameters: {'fp_type': 'morgan_rdkit', 'combined_morgan_radius': 3, 'combined_morgan_nBits': 1024, 'combined_rdkit_maxPath': 7, 'combined_rdkit_nBits': 1024, 'num_hidden_layers': 3, 'hidden_dim_0': 256, 'hidden_dim_1': 1024, 'hidden_dim_2': 64, 'kl_weight': 0.0002542371812533787, 'lr': 0.005305178219836217, 'batch_size': 128, 'dropout_rate': 0.3815091712934477, 'prior_mu': -0.02040575179382873, 'prior_sigma': 0.10494392855885992, 'normalization': 'layer'}. Best is trial 896 with value: 0.4533553242683411.
Generating morgan_rdkit fingerprints...
Generated fingerprints with 2048 features for 841 molecules
Trial 920: 5-fold CV loss = 0.5356
[I 2025-08-07 20:07:25,737] Trial 920 finished with value: 0.5355708777904511 and parameters: {'fp_type': 'morgan_rdkit', 'combined_morgan_radius': 3, 'combined_morgan_nBits': 1024, 'combined_rdkit_maxPath': 7, 'combined_rdkit_nBits': 1024, 'num_hidden_layers': 3, 'hidden_dim_0': 256, 'hidden_dim_1': 128, 'hidden_dim_2': 64, 'kl_weight': 0.0003356091691925921, 'lr': 0.006826302251744186, 'batch_size': 128, 'dropout_rate': 0.12301315772603137, 'prior_mu': -0.038432803861083026, 'prior_sigma': 0.12379507031777792, 'normalization': 'layer'}. Best is trial 896 with value: 0.4533553242683411.
Generating morgan_rdkit fingerprints...
Generated fingerprints with 2048 features for 841 molecules
Trial 923: 5-fold CV loss = 0.5641
[I 2025-08-07 20:07:31,392] Trial 923 finished with value: 0.5640734612941742 and parameters: {'fp_type': 'morgan_rdkit', 'combined_morgan_radius': 3, 'combined_morgan_nBits': 1024, 'combined_rdkit_maxPath': 7, 'combined_rdkit_nBits': 1024, 'num_hidden_layers': 3, 'hidden_dim_0': 256, 'hidden_dim_1': 128, 'hidden_dim_2': 64, 'kl_weight': 0.0003280635298776914, 'lr': 0.007064685394171291, 'batch_size': 128, 'dropout_rate': 0.12354879624425057, 'prior_mu': -0.0403535832768184, 'prior_sigma': 0.12377640088419868, 'normalization': 'layer'}. Best is trial 896 with value: 0.4533553242683411.
Generating morgan fingerprints...
Generated fingerprints with 1024 features for 841 molecules
Trial 921: 5-fold CV loss = 0.5602
[I 2025-08-07 20:07:43,520] Trial 921 finished with value: 0.5601926207542419 and parameters: {'fp_type': 'morgan_rdkit', 'combined_morgan_radius': 3, 'combined_morgan_nBits': 1024, 'combined_rdkit_maxPath': 7, 'combined_rdkit_nBits': 1024, 'num_hidden_layers': 3, 'hidden_dim_0': 256, 'hidden_dim_1': 128, 'hidden_dim_2': 64, 'kl_weight': 0.0002555121305144697, 'lr': 0.006854057423734025, 'batch_size': 128, 'dropout_rate': 0.09890090071396498, 'prior_mu': 0.0009139117145912194, 'prior_sigma': 0.10600554026457115, 'normalization': 'layer'}. Best is trial 896 with value: 0.4533553242683411.
Generating morgan fingerprints...
Generated fingerprints with 1024 features for 841 molecules
Trial 925: 5-fold CV loss = 0.5341
[I 2025-08-07 20:07:53,248] Trial 925 finished with value: 0.5340749263763428 and parameters: {'fp_type': 'morgan', 'morgan_only_radius': 3, 'morgan_only_nBits': 1024, 'num_hidden_layers': 3, 'hidden_dim_0': 256, 'hidden_dim_1': 1024, 'hidden_dim_2': 64, 'kl_weight': 0.0003487984439394637, 'lr': 0.006348291789795984, 'batch_size': 128, 'dropout_rate': 0.09795498576539975, 'prior_mu': -0.0031987400498743775, 'prior_sigma': 0.1077707838436849, 'normalization': 'layer'}. Best is trial 896 with value: 0.4533553242683411.
Generating morgan_rdkit fingerprints...
Generated fingerprints with 1280 features for 841 molecules
Trial 924: 5-fold CV loss = 0.5637
[I 2025-08-07 20:08:02,506] Trial 924 finished with value: 0.5636842668056488 and parameters: {'fp_type': 'morgan_rdkit', 'combined_morgan_radius': 3, 'combined_morgan_nBits': 1024, 'combined_rdkit_maxPath': 7, 'combined_rdkit_nBits': 1024, 'num_hidden_layers': 3, 'hidden_dim_0': 256, 'hidden_dim_1': 1024, 'hidden_dim_2': 64, 'kl_weight': 0.0003507300302159647, 'lr': 0.0063677462934409795, 'batch_size': 128, 'dropout_rate': 0.09691494783693488, 'prior_mu': 0.0026357935261847043, 'prior_sigma': 0.10476834764745618, 'normalization': 'layer'}. Best is trial 896 with value: 0.4533553242683411.
Generating morgan_rdkit fingerprints...
Generated fingerprints with 2048 features for 841 molecules
Trial 922: 5-fold CV loss = 0.4677
[I 2025-08-07 20:08:25,666] Trial 922 finished with value: 0.46766942739486694 and parameters: {'fp_type': 'morgan_rdkit', 'combined_morgan_radius': 3, 'combined_morgan_nBits': 1024, 'combined_rdkit_maxPath': 7, 'combined_rdkit_nBits': 1024, 'num_hidden_layers': 3, 'hidden_dim_0': 256, 'hidden_dim_1': 1024, 'hidden_dim_2': 64, 'kl_weight': 0.00034201360173822783, 'lr': 0.006844327726755583, 'batch_size': 128, 'dropout_rate': 0.12256489638657397, 'prior_mu': 0.00011835367807240191, 'prior_sigma': 0.10593288751203848, 'normalization': 'layer'}. Best is trial 896 with value: 0.4533553242683411.
Generating morgan_rdkit fingerprints...
Generated fingerprints with 1280 features for 841 molecules
Trial 927: 5-fold CV loss = 0.5870
[I 2025-08-07 20:08:29,212] Trial 927 finished with value: 0.5870497345924377 and parameters: {'fp_type': 'morgan_rdkit', 'combined_morgan_radius': 3, 'combined_morgan_nBits': 1024, 'combined_rdkit_maxPath': 7, 'combined_rdkit_nBits': 256, 'num_hidden_layers': 3, 'hidden_dim_0': 256, 'hidden_dim_1': 1024, 'hidden_dim_2': 64, 'kl_weight': 0.000240236202655477, 'lr': 0.00834019969548624, 'batch_size': 64, 'dropout_rate': 0.1470169479391344, 'prior_mu': -0.022903428138556628, 'prior_sigma': 0.10253348935621684, 'normalization': 'layer'}. Best is trial 896 with value: 0.4533553242683411.
Generating morgan_rdkit fingerprints...
Generated fingerprints with 2048 features for 841 molecules
Trial 926: 5-fold CV loss = 0.5371
[I 2025-08-07 20:08:30,663] Trial 926 finished with value: 0.5371021926403046 and parameters: {'fp_type': 'morgan', 'morgan_only_radius': 3, 'morgan_only_nBits': 1024, 'num_hidden_layers': 3, 'hidden_dim_0': 256, 'hidden_dim_1': 1024, 'hidden_dim_2': 64, 'kl_weight': 0.00034776092450926186, 'lr': 0.008410183954691772, 'batch_size': 64, 'dropout_rate': 0.09315596999559157, 'prior_mu': -0.023503180850564694, 'prior_sigma': 0.10578257037419224, 'normalization': 'layer'}. Best is trial 896 with value: 0.4533553242683411.
Generating morgan_rdkit fingerprints...
Generated fingerprints with 2048 features for 841 molecules
Trial 928: 5-fold CV loss = 0.5592
[I 2025-08-07 20:08:49,393] Trial 928 finished with value: 0.5591764450073242 and parameters: {'fp_type': 'morgan_rdkit', 'combined_morgan_radius': 3, 'combined_morgan_nBits': 1024, 'combined_rdkit_maxPath': 7, 'combined_rdkit_nBits': 1024, 'num_hidden_layers': 3, 'hidden_dim_0': 256, 'hidden_dim_1': 1024, 'hidden_dim_2': 64, 'kl_weight': 0.0002493244782197113, 'lr': 0.008458645459906745, 'batch_size': 64, 'dropout_rate': 0.1317756992127388, 'prior_mu': -0.04766010926683456, 'prior_sigma': 0.11403520245232412, 'normalization': 'layer'}. Best is trial 896 with value: 0.4533553242683411.
Generating morgan_rdkit fingerprints...
Generated fingerprints with 2048 features for 841 molecules
Trial 930: 5-fold CV loss = 0.4706
[I 2025-08-07 20:09:04,354] Trial 930 finished with value: 0.47060996294021606 and parameters: {'fp_type': 'morgan_rdkit', 'combined_morgan_radius': 3, 'combined_morgan_nBits': 1024, 'combined_rdkit_maxPath': 7, 'combined_rdkit_nBits': 1024, 'num_hidden_layers': 3, 'hidden_dim_0': 512, 'hidden_dim_1': 1024, 'hidden_dim_2': 64, 'kl_weight': 0.000239371480656611, 'lr': 0.007582516348437647, 'batch_size': 128, 'dropout_rate': 0.12920110811108548, 'prior_mu': -0.049076967930187274, 'prior_sigma': 0.0989525008403776, 'normalization': 'layer'}. Best is trial 896 with value: 0.4533553242683411.
Generating morgan_rdkit fingerprints...
Generated fingerprints with 2048 features for 841 molecules
Trial 931: 5-fold CV loss = 0.6481
[I 2025-08-07 20:09:13,309] Trial 931 finished with value: 0.648104339838028 and parameters: {'fp_type': 'morgan_rdkit', 'combined_morgan_radius': 3, 'combined_morgan_nBits': 1024, 'combined_rdkit_maxPath': 7, 'combined_rdkit_nBits': 1024, 'num_hidden_layers': 3, 'hidden_dim_0': 256, 'hidden_dim_1': 1024, 'hidden_dim_2': 64, 'kl_weight': 0.00024008599803987824, 'lr': 0.00759137134490195, 'batch_size': 128, 'dropout_rate': 0.1325921687754655, 'prior_mu': -0.04662250741284166, 'prior_sigma': 0.11379435198096428, 'normalization': 'layer'}. Best is trial 896 with value: 0.4533553242683411.
Generating rdkit fingerprints...
Generated fingerprints with 512 features for 841 molecules
Trial 932: 5-fold CV loss = 0.8109
[I 2025-08-07 20:09:14,176] Trial 932 finished with value: 0.8109272956848145 and parameters: {'fp_type': 'morgan_rdkit', 'combined_morgan_radius': 3, 'combined_morgan_nBits': 1024, 'combined_rdkit_maxPath': 7, 'combined_rdkit_nBits': 1024, 'num_hidden_layers': 3, 'hidden_dim_0': 256, 'hidden_dim_1': 1024, 'hidden_dim_2': 512, 'kl_weight': 0.0002876279683925213, 'lr': 0.007492666031294799, 'batch_size': 128, 'dropout_rate': 0.1438794412607835, 'prior_mu': -0.015707738117129694, 'prior_sigma': 0.100620687147986, 'normalization': 'layer'}. Best is trial 896 with value: 0.4533553242683411.
Generating morgan_rdkit fingerprints...
Generated fingerprints with 2048 features for 841 molecules
Trial 933: 5-fold CV loss = 0.6507
[I 2025-08-07 20:09:37,904] Trial 933 finished with value: 0.6506694495677948 and parameters: {'fp_type': 'morgan_rdkit', 'combined_morgan_radius': 3, 'combined_morgan_nBits': 1024, 'combined_rdkit_maxPath': 5, 'combined_rdkit_nBits': 1024, 'num_hidden_layers': 3, 'hidden_dim_0': 256, 'hidden_dim_1': 1024, 'hidden_dim_2': 512, 'kl_weight': 0.0002896889299150835, 'lr': 0.005867006431506354, 'batch_size': 128, 'dropout_rate': 0.11268383989705637, 'prior_mu': -0.01514103396678136, 'prior_sigma': 0.10138052243055823, 'normalization': 'layer'}. Best is trial 896 with value: 0.4533553242683411.
Generating rdkit fingerprints...
Generated fingerprints with 512 features for 841 molecules
Trial 935: 5-fold CV loss = 0.4822
[I 2025-08-07 20:09:50,000] Trial 935 finished with value: 0.4822014033794403 and parameters: {'fp_type': 'morgan_rdkit', 'combined_morgan_radius': 3, 'combined_morgan_nBits': 1024, 'combined_rdkit_maxPath': 5, 'combined_rdkit_nBits': 1024, 'num_hidden_layers': 3, 'hidden_dim_0': 256, 'hidden_dim_1': 1024, 'hidden_dim_2': 64, 'kl_weight': 0.00037248410263326763, 'lr': 0.005753644684296819, 'batch_size': 128, 'dropout_rate': 0.11293739497433797, 'prior_mu': -0.008028478802696979, 'prior_sigma': 0.11120664920130144, 'normalization': 'layer'}. Best is trial 896 with value: 0.4533553242683411.
Generating rdkit fingerprints...
Generated fingerprints with 512 features for 841 molecules
Trial 936: 5-fold CV loss = 0.7339
[I 2025-08-07 20:10:08,954] Trial 936 finished with value: 0.7338512063026428 and parameters: {'fp_type': 'rdkit', 'rdkit_only_maxPath': 6, 'rdkit_only_nBits': 512, 'num_hidden_layers': 3, 'hidden_dim_0': 256, 'hidden_dim_1': 256, 'hidden_dim_2': 64, 'kl_weight': 0.0003638845673407762, 'lr': 0.004640916349382986, 'batch_size': 128, 'dropout_rate': 0.08413647231740533, 'prior_mu': -0.037531175132837165, 'prior_sigma': 0.10798754544620343, 'normalization': 'layer'}. Best is trial 896 with value: 0.4533553242683411.
Generating morgan_rdkit fingerprints...
Generated fingerprints with 2048 features for 841 molecules
Trial 937: 5-fold CV loss = 0.7492
[I 2025-08-07 20:10:10,992] Trial 937 finished with value: 0.7492262601852417 and parameters: {'fp_type': 'rdkit', 'rdkit_only_maxPath': 6, 'rdkit_only_nBits': 512, 'num_hidden_layers': 3, 'hidden_dim_0': 256, 'hidden_dim_1': 256, 'hidden_dim_2': 64, 'kl_weight': 0.0003815810196960823, 'lr': 0.0047036047105970405, 'batch_size': 128, 'dropout_rate': 0.14607096471787498, 'prior_mu': -0.036637899364192525, 'prior_sigma': 0.09656702223304188, 'normalization': 'none'}. Best is trial 896 with value: 0.4533553242683411.
Generating morgan_rdkit fingerprints...
Generated fingerprints with 2048 features for 841 molecules
Trial 934: 5-fold CV loss = 0.6715
[I 2025-08-07 20:10:12,078] Trial 934 finished with value: 0.6714903891086579 and parameters: {'fp_type': 'rdkit', 'rdkit_only_maxPath': 6, 'rdkit_only_nBits': 512, 'num_hidden_layers': 3, 'hidden_dim_0': 256, 'hidden_dim_1': 1024, 'hidden_dim_2': 64, 'kl_weight': 0.0001962828905312942, 'lr': 0.005844079379928241, 'batch_size': 128, 'dropout_rate': 0.1464028232094376, 'prior_mu': -0.012217355479756978, 'prior_sigma': 0.10030021995371191, 'normalization': 'layer'}. Best is trial 896 with value: 0.4533553242683411.
Generating morgan_rdkit fingerprints...
Generated fingerprints with 2048 features for 841 molecules
Trial 929: 5-fold CV loss = 0.4990
[I 2025-08-07 20:10:15,903] Trial 929 finished with value: 0.4989734888076782 and parameters: {'fp_type': 'morgan_rdkit', 'combined_morgan_radius': 3, 'combined_morgan_nBits': 1024, 'combined_rdkit_maxPath': 7, 'combined_rdkit_nBits': 256, 'num_hidden_layers': 3, 'hidden_dim_0': 512, 'hidden_dim_1': 1024, 'hidden_dim_2': 64, 'kl_weight': 0.0002442649051654996, 'lr': 0.00845450447851748, 'batch_size': 64, 'dropout_rate': 0.14573549514502937, 'prior_mu': -0.022597316763597084, 'prior_sigma': 0.10116321534827695, 'normalization': 'layer'}. Best is trial 896 with value: 0.4533553242683411.
Generating morgan_rdkit fingerprints...
Generated fingerprints with 2048 features for 841 molecules
Trial 938: 5-fold CV loss = 0.6486
[I 2025-08-07 20:10:40,488] Trial 938 finished with value: 0.6486031293869019 and parameters: {'fp_type': 'morgan_rdkit', 'combined_morgan_radius': 3, 'combined_morgan_nBits': 1024, 'combined_rdkit_maxPath': 7, 'combined_rdkit_nBits': 1024, 'num_hidden_layers': 3, 'hidden_dim_0': 256, 'hidden_dim_1': 1024, 'hidden_dim_2': 64, 'kl_weight': 0.000320634135824719, 'lr': 0.006273657785134165, 'batch_size': 128, 'dropout_rate': 0.14687002812800332, 'prior_mu': -0.026327220910593974, 'prior_sigma': 0.09710916270205468, 'normalization': 'none'}. Best is trial 896 with value: 0.4533553242683411.
Generating morgan_rdkit fingerprints...
Generated fingerprints with 2048 features for 841 molecules
Trial 939: 5-fold CV loss = 0.4688
[I 2025-08-07 20:10:51,022] Trial 939 finished with value: 0.46880161166191103 and parameters: {'fp_type': 'morgan_rdkit', 'combined_morgan_radius': 3, 'combined_morgan_nBits': 1024, 'combined_rdkit_maxPath': 7, 'combined_rdkit_nBits': 1024, 'num_hidden_layers': 3, 'hidden_dim_0': 128, 'hidden_dim_1': 1024, 'hidden_dim_2': 64, 'kl_weight': 0.0002042662912457059, 'lr': 0.006336632768542561, 'batch_size': 128, 'dropout_rate': 0.14601600548904828, 'prior_mu': -0.02534602116991712, 'prior_sigma': 0.07944478029356825, 'normalization': 'layer'}. Best is trial 896 with value: 0.4533553242683411.
Generating morgan_rdkit fingerprints...
Generated fingerprints with 2048 features for 841 molecules
Trial 940: 5-fold CV loss = 0.4666
[I 2025-08-07 20:11:16,742] Trial 940 finished with value: 0.4666173458099365 and parameters: {'fp_type': 'morgan_rdkit', 'combined_morgan_radius': 3, 'combined_morgan_nBits': 1024, 'combined_rdkit_maxPath': 7, 'combined_rdkit_nBits': 1024, 'num_hidden_layers': 3, 'hidden_dim_0': 128, 'hidden_dim_1': 1024, 'hidden_dim_2': 64, 'kl_weight': 0.00030476016637109084, 'lr': 0.006439069332498583, 'batch_size': 128, 'dropout_rate': 0.13514004390755707, 'prior_mu': -0.025647214154558718, 'prior_sigma': 0.07799318459706697, 'normalization': 'layer'}. Best is trial 896 with value: 0.4533553242683411.
Generating morgan_rdkit fingerprints...
Generated fingerprints with 2048 features for 841 molecules
Trial 942: 5-fold CV loss = 0.4894
[I 2025-08-07 20:11:20,097] Trial 942 finished with value: 0.4893662750720978 and parameters: {'fp_type': 'morgan_rdkit', 'combined_morgan_radius': 3, 'combined_morgan_nBits': 1024, 'combined_rdkit_maxPath': 7, 'combined_rdkit_nBits': 1024, 'num_hidden_layers': 3, 'hidden_dim_0': 128, 'hidden_dim_1': 1024, 'hidden_dim_2': 64, 'kl_weight': 0.04110404011222917, 'lr': 0.007028773379410511, 'batch_size': 128, 'dropout_rate': 0.12045356690213001, 'prior_mu': 0.01176143106670156, 'prior_sigma': 0.0774076681562732, 'normalization': 'layer'}. Best is trial 896 with value: 0.4533553242683411.
Generating morgan_rdkit fingerprints...
Generated fingerprints with 2048 features for 841 molecules
Trial 943: 5-fold CV loss = 0.4703
[I 2025-08-07 20:11:36,652] Trial 943 finished with value: 0.47030132412910464 and parameters: {'fp_type': 'morgan_rdkit', 'combined_morgan_radius': 3, 'combined_morgan_nBits': 1024, 'combined_rdkit_maxPath': 7, 'combined_rdkit_nBits': 1024, 'num_hidden_layers': 3, 'hidden_dim_0': 256, 'hidden_dim_1': 1024, 'hidden_dim_2': 64, 'kl_weight': 0.00027841557521822864, 'lr': 0.0071956691852134115, 'batch_size': 128, 'dropout_rate': 0.11951648017919583, 'prior_mu': 0.01152122853837885, 'prior_sigma': 0.11565562385175021, 'normalization': 'layer'}. Best is trial 896 with value: 0.4533553242683411.
Generating morgan_rdkit fingerprints...
Generated fingerprints with 2048 features for 841 molecules
Trial 941: 5-fold CV loss = 0.4646
[I 2025-08-07 20:11:47,751] Trial 941 finished with value: 0.46457968950271605 and parameters: {'fp_type': 'morgan_rdkit', 'combined_morgan_radius': 3, 'combined_morgan_nBits': 1024, 'combined_rdkit_maxPath': 7, 'combined_rdkit_nBits': 1024, 'num_hidden_layers': 3, 'hidden_dim_0': 256, 'hidden_dim_1': 1024, 'hidden_dim_2': 64, 'kl_weight': 0.00031356620280701417, 'lr': 0.007122533148905875, 'batch_size': 128, 'dropout_rate': 0.13289432047850397, 'prior_mu': -0.028912653355194436, 'prior_sigma': 0.07825332396178533, 'normalization': 'layer'}. Best is trial 896 with value: 0.4533553242683411.
Generating morgan_rdkit fingerprints...
Generated fingerprints with 2048 features for 841 molecules
Trial 946: 5-fold CV loss = 0.8892
[I 2025-08-07 20:11:54,299] Trial 946 finished with value: 0.8892368078231812 and parameters: {'fp_type': 'morgan_rdkit', 'combined_morgan_radius': 3, 'combined_morgan_nBits': 1024, 'combined_rdkit_maxPath': 7, 'combined_rdkit_nBits': 1024, 'num_hidden_layers': 3, 'hidden_dim_0': 256, 'hidden_dim_1': 1024, 'hidden_dim_2': 1024, 'kl_weight': 0.0003794720652885324, 'lr': 0.007760379077239346, 'batch_size': 128, 'dropout_rate': 0.1044164757839166, 'prior_mu': -0.006779027897195038, 'prior_sigma': 0.1111900502417191, 'normalization': 'layer'}. Best is trial 896 with value: 0.4533553242683411.
Generating morgan_rdkit fingerprints...
Generated fingerprints with 2048 features for 841 molecules
Trial 945: 5-fold CV loss = 0.4684
