[I 2025-08-08 01:20:58,923] Trial 2507 finished with value: 0.465205705165863 and parameters: {'fp_type': 'morgan_rdkit', 'combined_morgan_radius': 3, 'combined_morgan_nBits': 1024, 'combined_rdkit_maxPath': 7, 'combined_rdkit_nBits': 1024, 'num_hidden_layers': 3, 'hidden_dim_0': 256, 'hidden_dim_1': 256, 'hidden_dim_2': 64, 'kl_weight': 0.00024039937673672745, 'lr': 0.006516144139277242, 'batch_size': 128, 'dropout_rate': 0.12065417527335676, 'prior_mu': -0.019291514923956296, 'prior_sigma': 0.08399942225697482, 'normalization': 'layer'}. Best is trial 896 with value: 0.4533553242683411.
Generating morgan_rdkit fingerprints...
Generated fingerprints with 2048 features for 841 molecules
Trial 2508: 5-fold CV loss = 0.4668
[I 2025-08-08 01:21:13,898] Trial 2508 finished with value: 0.4667565762996674 and parameters: {'fp_type': 'morgan_rdkit', 'combined_morgan_radius': 3, 'combined_morgan_nBits': 1024, 'combined_rdkit_maxPath': 7, 'combined_rdkit_nBits': 1024, 'num_hidden_layers': 3, 'hidden_dim_0': 256, 'hidden_dim_1': 256, 'hidden_dim_2': 64, 'kl_weight': 0.0002423904111523506, 'lr': 0.006502957624303559, 'batch_size': 128, 'dropout_rate': 0.10073210413464737, 'prior_mu': -0.021888413852153125, 'prior_sigma': 0.07619087113598833, 'normalization': 'layer'}. Best is trial 896 with value: 0.4533553242683411.
Generating morgan_rdkit fingerprints...
Generated fingerprints with 2048 features for 841 molecules
Trial 2503: 5-fold CV loss = 0.5026
[I 2025-08-08 01:21:25,711] Trial 2503 finished with value: 0.5025609970092774 and parameters: {'fp_type': 'rdkit', 'rdkit_only_maxPath': 8, 'rdkit_only_nBits': 1024, 'num_hidden_layers': 3, 'hidden_dim_0': 256, 'hidden_dim_1': 1024, 'hidden_dim_2': 64, 'kl_weight': 0.00024952731187371645, 'lr': 0.006706969976360291, 'batch_size': 32, 'dropout_rate': 0.11644386175162949, 'prior_mu': -0.08380878855161543, 'prior_sigma': 0.07729527913581914, 'normalization': 'layer'}. Best is trial 896 with value: 0.4533553242683411.
Generating morgan_rdkit fingerprints...
Generated fingerprints with 2048 features for 841 molecules
Trial 2509: 5-fold CV loss = 0.4676
[I 2025-08-08 01:21:28,652] Trial 2509 finished with value: 0.4676247775554657 and parameters: {'fp_type': 'morgan_rdkit', 'combined_morgan_radius': 3, 'combined_morgan_nBits': 1024, 'combined_rdkit_maxPath': 7, 'combined_rdkit_nBits': 1024, 'num_hidden_layers': 3, 'hidden_dim_0': 512, 'hidden_dim_1': 1024, 'hidden_dim_2': 64, 'kl_weight': 0.000194342373448068, 'lr': 0.007338121158750381, 'batch_size': 128, 'dropout_rate': 0.09955209017820127, 'prior_mu': -0.09832409053146209, 'prior_sigma': 0.07667865460025852, 'normalization': 'layer'}. Best is trial 896 with value: 0.4533553242683411.
Generating morgan_rdkit fingerprints...
Generated fingerprints with 2048 features for 841 molecules
Trial 2512: 5-fold CV loss = 1.4348
[I 2025-08-08 01:21:35,117] Trial 2512 finished with value: 1.4348477363586425 and parameters: {'fp_type': 'morgan_rdkit', 'combined_morgan_radius': 3, 'combined_morgan_nBits': 1024, 'combined_rdkit_maxPath': 7, 'combined_rdkit_nBits': 1024, 'num_hidden_layers': 0, 'kl_weight': 0.03555545917061122, 'lr': 0.007367885162730924, 'batch_size': 128, 'dropout_rate': 0.09519144268569017, 'prior_mu': -0.09169728278304176, 'prior_sigma': 0.10346467041591127, 'normalization': 'layer'}. Best is trial 896 with value: 0.4533553242683411.
Generating morgan_rdkit fingerprints...
Generated fingerprints with 2048 features for 841 molecules
Trial 2505: 5-fold CV loss = 0.8639
[I 2025-08-08 01:21:55,627] Trial 2505 finished with value: 0.8638865947723389 and parameters: {'fp_type': 'morgan_rdkit', 'combined_morgan_radius': 3, 'combined_morgan_nBits': 1024, 'combined_rdkit_maxPath': 7, 'combined_rdkit_nBits': 1024, 'num_hidden_layers': 3, 'hidden_dim_0': 256, 'hidden_dim_1': 256, 'hidden_dim_2': 64, 'kl_weight': 0.0002512188487567768, 'lr': 0.0001369788526767894, 'batch_size': 32, 'dropout_rate': 0.10102475583899907, 'prior_mu': -0.02006799050442676, 'prior_sigma': 0.07743534201472271, 'normalization': 'layer'}. Best is trial 896 with value: 0.4533553242683411.
Generating morgan_rdkit fingerprints...
Generated fingerprints with 2048 features for 841 molecules
Trial 2510: 5-fold CV loss = 0.4648
[I 2025-08-08 01:21:59,415] Trial 2510 finished with value: 0.46481204628944395 and parameters: {'fp_type': 'morgan_rdkit', 'combined_morgan_radius': 3, 'combined_morgan_nBits': 1024, 'combined_rdkit_maxPath': 7, 'combined_rdkit_nBits': 1024, 'num_hidden_layers': 3, 'hidden_dim_0': 512, 'hidden_dim_1': 1024, 'hidden_dim_2': 64, 'kl_weight': 0.00024536222720201263, 'lr': 0.00729868906924184, 'batch_size': 128, 'dropout_rate': 0.09428679811364366, 'prior_mu': 0.012820352894356716, 'prior_sigma': 0.08794927687191514, 'normalization': 'layer'}. Best is trial 896 with value: 0.4533553242683411.
Generating morgan_rdkit fingerprints...
Generated fingerprints with 1280 features for 841 molecules
Trial 2513: 5-fold CV loss = 0.7870
[I 2025-08-08 01:22:01,159] Trial 2513 finished with value: 0.7869978845119476 and parameters: {'fp_type': 'morgan_rdkit', 'combined_morgan_radius': 3, 'combined_morgan_nBits': 1024, 'combined_rdkit_maxPath': 7, 'combined_rdkit_nBits': 1024, 'num_hidden_layers': 3, 'hidden_dim_0': 256, 'hidden_dim_1': 1024, 'hidden_dim_2': 64, 'kl_weight': 0.0002038811568031581, 'lr': 0.007504333856253602, 'batch_size': 128, 'dropout_rate': 0.10458018398599678, 'prior_mu': -0.005435387085235721, 'prior_sigma': 0.08650059554731149, 'normalization': 'none'}. Best is trial 896 with value: 0.4533553242683411.
Generating morgan_rdkit fingerprints...
Generated fingerprints with 1280 features for 841 molecules
Trial 2511: 5-fold CV loss = 0.8705
[I 2025-08-08 01:22:14,738] Trial 2511 finished with value: 0.8705237865447998 and parameters: {'fp_type': 'morgan_rdkit', 'combined_morgan_radius': 3, 'combined_morgan_nBits': 1024, 'combined_rdkit_maxPath': 7, 'combined_rdkit_nBits': 1024, 'num_hidden_layers': 3, 'hidden_dim_0': 512, 'hidden_dim_1': 1024, 'hidden_dim_2': 64, 'kl_weight': 0.00020282846319182328, 'lr': 0.00014729482556686773, 'batch_size': 128, 'dropout_rate': 0.09269742518326828, 'prior_mu': 0.013527264164651807, 'prior_sigma': 0.10437721789130534, 'normalization': 'layer'}. Best is trial 896 with value: 0.4533553242683411.
Generating morgan_rdkit fingerprints...
Generated fingerprints with 2048 features for 841 molecules
Trial 2516: 5-fold CV loss = 0.6070
[I 2025-08-08 01:22:26,787] Trial 2516 finished with value: 0.6070161402225495 and parameters: {'fp_type': 'morgan_rdkit', 'combined_morgan_radius': 3, 'combined_morgan_nBits': 1024, 'combined_rdkit_maxPath': 8, 'combined_rdkit_nBits': 256, 'num_hidden_layers': 3, 'hidden_dim_0': 256, 'hidden_dim_1': 64, 'hidden_dim_2': 64, 'kl_weight': 0.00019734966215404515, 'lr': 0.006278277990224161, 'batch_size': 128, 'dropout_rate': 0.0901857059763278, 'prior_mu': -0.0373060670574283, 'prior_sigma': 0.08133593457908565, 'normalization': 'layer'}. Best is trial 896 with value: 0.4533553242683411.
Generating morgan_rdkit fingerprints...
Generated fingerprints with 2048 features for 841 molecules
Trial 2515: 5-fold CV loss = 0.5653
[I 2025-08-08 01:22:32,299] Trial 2515 finished with value: 0.5652739346027374 and parameters: {'fp_type': 'morgan_rdkit', 'combined_morgan_radius': 3, 'combined_morgan_nBits': 1024, 'combined_rdkit_maxPath': 7, 'combined_rdkit_nBits': 256, 'num_hidden_layers': 3, 'hidden_dim_0': 256, 'hidden_dim_1': 64, 'hidden_dim_2': 64, 'kl_weight': 0.0002021446426983665, 'lr': 0.007508298142530168, 'batch_size': 128, 'dropout_rate': 0.08882641059080458, 'prior_mu': -0.00764775613325973, 'prior_sigma': 0.0856364989261828, 'normalization': 'none'}. Best is trial 896 with value: 0.4533553242683411.
Generating morgan_rdkit fingerprints...
Generated fingerprints with 2048 features for 841 molecules
Trial 2517: 5-fold CV loss = 0.8879
[I 2025-08-08 01:22:39,719] Trial 2517 finished with value: 0.8878994345664978 and parameters: {'fp_type': 'morgan_rdkit', 'combined_morgan_radius': 3, 'combined_morgan_nBits': 1024, 'combined_rdkit_maxPath': 8, 'combined_rdkit_nBits': 1024, 'num_hidden_layers': 3, 'hidden_dim_0': 256, 'hidden_dim_1': 64, 'hidden_dim_2': 1024, 'kl_weight': 0.00021844548136008745, 'lr': 0.006339422186473771, 'batch_size': 128, 'dropout_rate': 0.08741860326751727, 'prior_mu': -0.037815905062098615, 'prior_sigma': 0.08107069273550892, 'normalization': 'layer'}. Best is trial 896 with value: 0.4533553242683411.
Generating morgan_rdkit fingerprints...
Generated fingerprints with 2048 features for 841 molecules
Trial 2514: 5-fold CV loss = 0.6788
[I 2025-08-08 01:23:01,904] Trial 2514 finished with value: 0.6788469910621643 and parameters: {'fp_type': 'morgan_rdkit', 'combined_morgan_radius': 3, 'combined_morgan_nBits': 1024, 'combined_rdkit_maxPath': 7, 'combined_rdkit_nBits': 1024, 'num_hidden_layers': 3, 'hidden_dim_0': 256, 'hidden_dim_1': 1024, 'hidden_dim_2': 128, 'kl_weight': 0.00018512752723389586, 'lr': 0.007381976613368789, 'batch_size': 128, 'dropout_rate': 0.08757273537623161, 'prior_mu': 0.01573745385232293, 'prior_sigma': 0.08711334157725771, 'normalization': 'none'}. Best is trial 896 with value: 0.4533553242683411.
Generating morgan_rdkit fingerprints...
Generated fingerprints with 2048 features for 841 molecules
Trial 2518: 5-fold CV loss = 0.4745
[I 2025-08-08 01:23:07,854] Trial 2518 finished with value: 0.4745169460773468 and parameters: {'fp_type': 'morgan_rdkit', 'combined_morgan_radius': 3, 'combined_morgan_nBits': 1024, 'combined_rdkit_maxPath': 7, 'combined_rdkit_nBits': 1024, 'num_hidden_layers': 3, 'hidden_dim_0': 256, 'hidden_dim_1': 1024, 'hidden_dim_2': 128, 'kl_weight': 0.00023131192920273962, 'lr': 0.007139611517726287, 'batch_size': 128, 'dropout_rate': 0.08558396676459845, 'prior_mu': 0.0024609528530546883, 'prior_sigma': 0.09397510570766773, 'normalization': 'layer'}. Best is trial 896 with value: 0.4533553242683411.
Generating morgan_rdkit fingerprints...
Generated fingerprints with 2048 features for 841 molecules
Trial 2519: 5-fold CV loss = 0.4706
[I 2025-08-08 01:23:24,470] Trial 2519 finished with value: 0.4706287980079651 and parameters: {'fp_type': 'morgan_rdkit', 'combined_morgan_radius': 3, 'combined_morgan_nBits': 1024, 'combined_rdkit_maxPath': 7, 'combined_rdkit_nBits': 1024, 'num_hidden_layers': 3, 'hidden_dim_0': 256, 'hidden_dim_1': 1024, 'hidden_dim_2': 64, 'kl_weight': 0.0002212963108531332, 'lr': 0.006495059686565033, 'batch_size': 64, 'dropout_rate': 0.1081541276791125, 'prior_mu': -0.08913909924751452, 'prior_sigma': 0.09023342612401122, 'normalization': 'layer'}. Best is trial 896 with value: 0.4533553242683411.
Generating morgan_rdkit fingerprints...
Generated fingerprints with 2048 features for 841 molecules
Trial 2522: 5-fold CV loss = 0.4615
[I 2025-08-08 01:23:50,393] Trial 2522 finished with value: 0.46153560280799866 and parameters: {'fp_type': 'morgan_rdkit', 'combined_morgan_radius': 3, 'combined_morgan_nBits': 1024, 'combined_rdkit_maxPath': 7, 'combined_rdkit_nBits': 1024, 'num_hidden_layers': 3, 'hidden_dim_0': 256, 'hidden_dim_1': 1024, 'hidden_dim_2': 64, 'kl_weight': 0.00025505776875791425, 'lr': 0.0066609848768267735, 'batch_size': 64, 'dropout_rate': 0.10466495792147862, 'prior_mu': -0.02521211165045941, 'prior_sigma': 0.09089803980066921, 'normalization': 'layer'}. Best is trial 896 with value: 0.4533553242683411.
Generating morgan fingerprints...
Generated fingerprints with 2048 features for 841 molecules
Trial 2520: 5-fold CV loss = 0.4591
[I 2025-08-08 01:23:53,077] Trial 2520 finished with value: 0.45907129645347594 and parameters: {'fp_type': 'morgan_rdkit', 'combined_morgan_radius': 3, 'combined_morgan_nBits': 1024, 'combined_rdkit_maxPath': 7, 'combined_rdkit_nBits': 1024, 'num_hidden_layers': 3, 'hidden_dim_0': 128, 'hidden_dim_1': 1024, 'hidden_dim_2': 64, 'kl_weight': 0.00025181213685533313, 'lr': 0.006915551860686195, 'batch_size': 64, 'dropout_rate': 0.10851009395344584, 'prior_mu': 0.0035323873011771367, 'prior_sigma': 0.09422896437391688, 'normalization': 'layer'}. Best is trial 896 with value: 0.4533553242683411.
Generating morgan fingerprints...
Generated fingerprints with 2048 features for 841 molecules
Trial 2523: 5-fold CV loss = 0.4624
[I 2025-08-08 01:24:04,279] Trial 2523 finished with value: 0.4623820662498474 and parameters: {'fp_type': 'morgan_rdkit', 'combined_morgan_radius': 3, 'combined_morgan_nBits': 1024, 'combined_rdkit_maxPath': 7, 'combined_rdkit_nBits': 1024, 'num_hidden_layers': 3, 'hidden_dim_0': 128, 'hidden_dim_1': 1024, 'hidden_dim_2': 64, 'kl_weight': 0.00025694835958967467, 'lr': 0.008089325988074608, 'batch_size': 128, 'dropout_rate': 0.12613837975790115, 'prior_mu': -0.026612637065625774, 'prior_sigma': 0.09702495867511847, 'normalization': 'layer'}. Best is trial 896 with value: 0.4533553242683411.
Generating morgan fingerprints...
Generated fingerprints with 2048 features for 841 molecules
Trial 2524: 5-fold CV loss = 0.5295
[I 2025-08-08 01:24:11,287] Trial 2524 finished with value: 0.5294691324234009 and parameters: {'fp_type': 'morgan', 'morgan_only_radius': 3, 'morgan_only_nBits': 2048, 'num_hidden_layers': 3, 'hidden_dim_0': 128, 'hidden_dim_1': 1024, 'hidden_dim_2': 64, 'kl_weight': 0.0002631890639910857, 'lr': 0.007945838467393766, 'batch_size': 128, 'dropout_rate': 0.12350747077417976, 'prior_mu': -0.0950083937399425, 'prior_sigma': 0.10032432044314761, 'normalization': 'layer'}. Best is trial 896 with value: 0.4533553242683411.
Generating morgan_rdkit fingerprints...
Generated fingerprints with 1536 features for 841 molecules
Trial 2525: 5-fold CV loss = 0.5248
[I 2025-08-08 01:24:26,330] Trial 2525 finished with value: 0.5248486161231994 and parameters: {'fp_type': 'morgan', 'morgan_only_radius': 3, 'morgan_only_nBits': 2048, 'num_hidden_layers': 3, 'hidden_dim_0': 256, 'hidden_dim_1': 1024, 'hidden_dim_2': 64, 'kl_weight': 0.002153689378375874, 'lr': 0.0077190372455717806, 'batch_size': 128, 'dropout_rate': 0.11212319958134069, 'prior_mu': -0.10233457958864461, 'prior_sigma': 0.09874192461521754, 'normalization': 'layer'}. Best is trial 896 with value: 0.4533553242683411.
Generating morgan_rdkit fingerprints...
Generated fingerprints with 1536 features for 841 molecules
Trial 2526: 5-fold CV loss = 0.5313
[I 2025-08-08 01:24:29,483] Trial 2526 finished with value: 0.5313278555870056 and parameters: {'fp_type': 'morgan', 'morgan_only_radius': 3, 'morgan_only_nBits': 2048, 'num_hidden_layers': 3, 'hidden_dim_0': 256, 'hidden_dim_1': 1024, 'hidden_dim_2': 64, 'kl_weight': 0.006194295126024607, 'lr': 0.007959608115303269, 'batch_size': 128, 'dropout_rate': 0.12025531936973623, 'prior_mu': -0.010095029898631754, 'prior_sigma': 0.10253751569656142, 'normalization': 'layer'}. Best is trial 896 with value: 0.4533553242683411.
Generating morgan_rdkit fingerprints...
Generated fingerprints with 1536 features for 841 molecules
Trial 2527: 5-fold CV loss = 0.4820
[I 2025-08-08 01:24:39,732] Trial 2527 finished with value: 0.48195889592170715 and parameters: {'fp_type': 'morgan_rdkit', 'combined_morgan_radius': 3, 'combined_morgan_nBits': 512, 'combined_rdkit_maxPath': 5, 'combined_rdkit_nBits': 1024, 'num_hidden_layers': 3, 'hidden_dim_0': 256, 'hidden_dim_1': 1024, 'hidden_dim_2': 64, 'kl_weight': 0.000463775222132179, 'lr': 0.007733960233064787, 'batch_size': 128, 'dropout_rate': 0.12200013226288144, 'prior_mu': -0.09664423994892138, 'prior_sigma': 0.08100203148617112, 'normalization': 'layer'}. Best is trial 896 with value: 0.4533553242683411.
Generating morgan_rdkit fingerprints...
Generated fingerprints with 2048 features for 841 molecules
Trial 2521: 5-fold CV loss = 0.4590
[I 2025-08-08 01:24:44,399] Trial 2521 finished with value: 0.4590493440628052 and parameters: {'fp_type': 'morgan_rdkit', 'combined_morgan_radius': 3, 'combined_morgan_nBits': 1024, 'combined_rdkit_maxPath': 7, 'combined_rdkit_nBits': 1024, 'num_hidden_layers': 3, 'hidden_dim_0': 128, 'hidden_dim_1': 1024, 'hidden_dim_2': 64, 'kl_weight': 0.0002531722983173146, 'lr': 0.006557068328846214, 'batch_size': 128, 'dropout_rate': 0.12198962960025655, 'prior_mu': 0.002506420744758644, 'prior_sigma': 0.0925491444776923, 'normalization': 'layer'}. Best is trial 896 with value: 0.4533553242683411.
Generating morgan_rdkit fingerprints...
Generated fingerprints with 2048 features for 841 molecules
Trial 2529: 5-fold CV loss = 0.4752
[I 2025-08-08 01:25:11,860] Trial 2529 finished with value: 0.47523645758628846 and parameters: {'fp_type': 'morgan_rdkit', 'combined_morgan_radius': 3, 'combined_morgan_nBits': 512, 'combined_rdkit_maxPath': 7, 'combined_rdkit_nBits': 1024, 'num_hidden_layers': 3, 'hidden_dim_0': 256, 'hidden_dim_1': 1024, 'hidden_dim_2': 64, 'kl_weight': 0.00018197610653532476, 'lr': 0.00616645193724209, 'batch_size': 128, 'dropout_rate': 0.07874166160998401, 'prior_mu': -0.01446740775370108, 'prior_sigma': 0.08314179483230921, 'normalization': 'layer'}. Best is trial 896 with value: 0.4533553242683411.
Generating morgan_rdkit fingerprints...
Generated fingerprints with 2048 features for 841 molecules
Trial 2528: 5-fold CV loss = 0.4911
[I 2025-08-08 01:25:16,259] Trial 2528 finished with value: 0.4911327362060547 and parameters: {'fp_type': 'morgan_rdkit', 'combined_morgan_radius': 3, 'combined_morgan_nBits': 512, 'combined_rdkit_maxPath': 5, 'combined_rdkit_nBits': 1024, 'num_hidden_layers': 3, 'hidden_dim_0': 256, 'hidden_dim_1': 1024, 'hidden_dim_2': 64, 'kl_weight': 0.00017557351943116298, 'lr': 0.006288671706550846, 'batch_size': 128, 'dropout_rate': 0.12187920301887567, 'prior_mu': -0.012905839511684416, 'prior_sigma': 0.10338494247036518, 'normalization': 'layer'}. Best is trial 896 with value: 0.4533553242683411.
Generating morgan_rdkit fingerprints...
Generated fingerprints with 2048 features for 841 molecules
Trial 2530: 5-fold CV loss = 0.4622
[I 2025-08-08 01:25:19,412] Trial 2530 finished with value: 0.46219414472579956 and parameters: {'fp_type': 'morgan_rdkit', 'combined_morgan_radius': 3, 'combined_morgan_nBits': 1024, 'combined_rdkit_maxPath': 7, 'combined_rdkit_nBits': 1024, 'num_hidden_layers': 3, 'hidden_dim_0': 256, 'hidden_dim_1': 128, 'hidden_dim_2': 64, 'kl_weight': 0.00019107652734413368, 'lr': 0.006879409451904143, 'batch_size': 128, 'dropout_rate': 0.07774896257899581, 'prior_mu': 0.04421106923768967, 'prior_sigma': 0.0749178406419808, 'normalization': 'layer'}. Best is trial 896 with value: 0.4533553242683411.
Generating morgan_rdkit fingerprints...
Generated fingerprints with 2048 features for 841 molecules
Trial 2533: 5-fold CV loss = 0.8719
[I 2025-08-08 01:25:48,660] Trial 2533 finished with value: 0.8718594074249267 and parameters: {'fp_type': 'morgan_rdkit', 'combined_morgan_radius': 3, 'combined_morgan_nBits': 1024, 'combined_rdkit_maxPath': 7, 'combined_rdkit_nBits': 1024, 'num_hidden_layers': 3, 'hidden_dim_0': 1024, 'hidden_dim_1': 1024, 'hidden_dim_2': 64, 'kl_weight': 0.0004596526773217797, 'lr': 0.00021710431318266603, 'batch_size': 128, 'dropout_rate': 0.10094330526021146, 'prior_mu': -0.034664809099922395, 'prior_sigma': 0.08535395063036609, 'normalization': 'layer'}. Best is trial 896 with value: 0.4533553242683411.
Generating morgan_rdkit fingerprints...
Generated fingerprints with 1536 features for 841 molecules
Trial 2532: 5-fold CV loss = 0.4633
[I 2025-08-08 01:25:52,434] Trial 2532 finished with value: 0.4632723927497864 and parameters: {'fp_type': 'morgan_rdkit', 'combined_morgan_radius': 3, 'combined_morgan_nBits': 1024, 'combined_rdkit_maxPath': 7, 'combined_rdkit_nBits': 1024, 'num_hidden_layers': 3, 'hidden_dim_0': 256, 'hidden_dim_1': 1024, 'hidden_dim_2': 64, 'kl_weight': 0.0001818142603325836, 'lr': 0.007059116687238759, 'batch_size': 128, 'dropout_rate': 0.10235308374970406, 'prior_mu': -0.0343465951175769, 'prior_sigma': 0.0747568013263612, 'normalization': 'layer'}. Best is trial 896 with value: 0.4533553242683411.
Generating morgan_rdkit fingerprints...
Generated fingerprints with 1536 features for 841 molecules
Trial 2534: 5-fold CV loss = 0.4722
[I 2025-08-08 01:26:03,309] Trial 2534 finished with value: 0.4722005546092987 and parameters: {'fp_type': 'morgan_rdkit', 'combined_morgan_radius': 3, 'combined_morgan_nBits': 1024, 'combined_rdkit_maxPath': 7, 'combined_rdkit_nBits': 1024, 'num_hidden_layers': 3, 'hidden_dim_0': 1024, 'hidden_dim_1': 1024, 'hidden_dim_2': 64, 'kl_weight': 0.00045142689864520875, 'lr': 0.007113087469452182, 'batch_size': 128, 'dropout_rate': 0.09483469386157617, 'prior_mu': -0.03439305687297311, 'prior_sigma': 0.11173653475628488, 'normalization': 'layer'}. Best is trial 896 with value: 0.4533553242683411.
Generating morgan_rdkit fingerprints...
Generated fingerprints with 1536 features for 841 molecules
Trial 2531: 5-fold CV loss = 0.5516
[I 2025-08-08 01:26:20,048] Trial 2531 finished with value: 0.5515715777873993 and parameters: {'fp_type': 'morgan_rdkit', 'combined_morgan_radius': 3, 'combined_morgan_nBits': 1024, 'combined_rdkit_maxPath': 7, 'combined_rdkit_nBits': 1024, 'num_hidden_layers': 3, 'hidden_dim_0': 256, 'hidden_dim_1': 128, 'hidden_dim_2': 64, 'kl_weight': 0.0009470219808207529, 'lr': 0.006239939711371699, 'batch_size': 128, 'dropout_rate': 0.07678414823191042, 'prior_mu': -0.03307827385956646, 'prior_sigma': 0.11447677906033037, 'normalization': 'layer'}. Best is trial 896 with value: 0.4533553242683411.
Generating morgan_rdkit fingerprints...
Generated fingerprints with 2048 features for 841 molecules
Trial 2537: 5-fold CV loss = 0.7351
