[I 2025-08-07 18:11:21,095] Trial 407 finished with value: 0.4830303430557251 and parameters: {'fp_type': 'morgan_rdkit', 'combined_morgan_radius': 2, 'combined_morgan_nBits': 512, 'combined_rdkit_maxPath': 7, 'combined_rdkit_nBits': 1024, 'num_hidden_layers': 2, 'hidden_dim_0': 64, 'hidden_dim_1': 512, 'kl_weight': 0.00020873869269708625, 'lr': 0.0016467842686216892, 'batch_size': 32, 'dropout_rate': 0.19657700862994223, 'prior_mu': 0.08221563668989552, 'prior_sigma': 0.024022179944099407, 'normalization': 'layer'}. Best is trial 179 with value: 0.4671938598155975.
Generating morgan_rdkit fingerprints...
Generated fingerprints with 1536 features for 841 molecules
Trial 405: 5-fold CV loss = 0.4806
[I 2025-08-07 18:11:33,975] Trial 405 finished with value: 0.4805923819541931 and parameters: {'fp_type': 'morgan_rdkit', 'combined_morgan_radius': 2, 'combined_morgan_nBits': 512, 'combined_rdkit_maxPath': 7, 'combined_rdkit_nBits': 1024, 'num_hidden_layers': 2, 'hidden_dim_0': 64, 'hidden_dim_1': 512, 'kl_weight': 0.00012398358750934825, 'lr': 0.002357388118860622, 'batch_size': 32, 'dropout_rate': 0.20414839667047324, 'prior_mu': 0.09486902022470016, 'prior_sigma': 0.037209818651512946, 'normalization': 'layer'}. Best is trial 179 with value: 0.4671938598155975.
Generating morgan_rdkit fingerprints...
Generated fingerprints with 1536 features for 841 molecules
Trial 406: 5-fold CV loss = 0.4769
[I 2025-08-07 18:12:15,871] Trial 406 finished with value: 0.47691711187362673 and parameters: {'fp_type': 'morgan_rdkit', 'combined_morgan_radius': 2, 'combined_morgan_nBits': 512, 'combined_rdkit_maxPath': 7, 'combined_rdkit_nBits': 1024, 'num_hidden_layers': 2, 'hidden_dim_0': 64, 'hidden_dim_1': 512, 'kl_weight': 0.00021605989774734922, 'lr': 0.0012793951497076692, 'batch_size': 32, 'dropout_rate': 0.20747027402580875, 'prior_mu': 0.07695460583442224, 'prior_sigma': 0.03772369349374376, 'normalization': 'layer'}. Best is trial 179 with value: 0.4671938598155975.
Generating morgan_rdkit fingerprints...
Generated fingerprints with 1536 features for 841 molecules
Trial 404: 5-fold CV loss = 0.4845
[I 2025-08-07 18:12:18,360] Trial 404 finished with value: 0.4845156013965607 and parameters: {'fp_type': 'morgan_rdkit', 'combined_morgan_radius': 2, 'combined_morgan_nBits': 512, 'combined_rdkit_maxPath': 7, 'combined_rdkit_nBits': 1024, 'num_hidden_layers': 2, 'hidden_dim_0': 64, 'hidden_dim_1': 512, 'kl_weight': 0.0002146510588531718, 'lr': 0.0012930196537406405, 'batch_size': 32, 'dropout_rate': 0.20126219443543047, 'prior_mu': 0.09255111062806118, 'prior_sigma': 0.026441124107982314, 'normalization': 'layer'}. Best is trial 179 with value: 0.4671938598155975.
Generating morgan_rdkit fingerprints...
Generated fingerprints with 1536 features for 841 molecules
Trial 409: 5-fold CV loss = 0.4760
[I 2025-08-07 18:12:38,626] Trial 409 finished with value: 0.4759784936904907 and parameters: {'fp_type': 'morgan_rdkit', 'combined_morgan_radius': 2, 'combined_morgan_nBits': 512, 'combined_rdkit_maxPath': 7, 'combined_rdkit_nBits': 1024, 'num_hidden_layers': 2, 'hidden_dim_0': 64, 'hidden_dim_1': 512, 'kl_weight': 0.00018038886541267614, 'lr': 0.0018146120157619165, 'batch_size': 32, 'dropout_rate': 0.20017317699973133, 'prior_mu': 0.07237117650035853, 'prior_sigma': 0.02588460155730979, 'normalization': 'layer'}. Best is trial 179 with value: 0.4671938598155975.
Generating morgan_rdkit fingerprints...
Generated fingerprints with 1536 features for 841 molecules
Trial 408: 5-fold CV loss = 0.4775
[I 2025-08-07 18:12:43,121] Trial 408 finished with value: 0.4774909734725952 and parameters: {'fp_type': 'morgan_rdkit', 'combined_morgan_radius': 2, 'combined_morgan_nBits': 512, 'combined_rdkit_maxPath': 7, 'combined_rdkit_nBits': 1024, 'num_hidden_layers': 2, 'hidden_dim_0': 64, 'hidden_dim_1': 512, 'kl_weight': 0.00017835912079002135, 'lr': 0.0012578214583779002, 'batch_size': 32, 'dropout_rate': 0.19385805678628099, 'prior_mu': 0.07346330104974966, 'prior_sigma': 0.03640607363628459, 'normalization': 'layer'}. Best is trial 179 with value: 0.4671938598155975.
Generating morgan_rdkit fingerprints...
Generated fingerprints with 1536 features for 841 molecules
Trial 410: 5-fold CV loss = 0.4771
[I 2025-08-07 18:13:01,788] Trial 410 finished with value: 0.4770746946334839 and parameters: {'fp_type': 'morgan_rdkit', 'combined_morgan_radius': 2, 'combined_morgan_nBits': 512, 'combined_rdkit_maxPath': 7, 'combined_rdkit_nBits': 1024, 'num_hidden_layers': 2, 'hidden_dim_0': 64, 'hidden_dim_1': 512, 'kl_weight': 0.00018042643810188994, 'lr': 0.0015062600830722866, 'batch_size': 128, 'dropout_rate': 0.18149159696884326, 'prior_mu': 0.07340386901219959, 'prior_sigma': 0.021335568194905237, 'normalization': 'layer'}. Best is trial 179 with value: 0.4671938598155975.
Generating morgan_rdkit fingerprints...
Generated fingerprints with 2048 features for 841 molecules
Trial 413: 5-fold CV loss = 0.4823
[I 2025-08-07 18:13:09,121] Trial 413 finished with value: 0.4823038160800934 and parameters: {'fp_type': 'morgan_rdkit', 'combined_morgan_radius': 2, 'combined_morgan_nBits': 512, 'combined_rdkit_maxPath': 7, 'combined_rdkit_nBits': 1024, 'num_hidden_layers': 2, 'hidden_dim_0': 64, 'hidden_dim_1': 512, 'kl_weight': 0.00012922226739555773, 'lr': 0.0015266019984556216, 'batch_size': 128, 'dropout_rate': 0.18178386994800305, 'prior_mu': 0.07799350619041205, 'prior_sigma': 0.020993978153177856, 'normalization': 'layer'}. Best is trial 179 with value: 0.4671938598155975.
Generating morgan_rdkit fingerprints...
Generated fingerprints with 2048 features for 841 molecules
Trial 414: 5-fold CV loss = 0.6443
[I 2025-08-07 18:13:31,467] Trial 414 finished with value: 0.6442894697189331 and parameters: {'fp_type': 'morgan_rdkit', 'combined_morgan_radius': 2, 'combined_morgan_nBits': 1024, 'combined_rdkit_maxPath': 7, 'combined_rdkit_nBits': 1024, 'num_hidden_layers': 0, 'kl_weight': 0.00012740153435305895, 'lr': 0.003433365593219946, 'batch_size': 32, 'dropout_rate': 0.24077680631653225, 'prior_mu': 0.08083636060778335, 'prior_sigma': 0.032561755808577966, 'normalization': 'layer'}. Best is trial 179 with value: 0.4671938598155975.
Generating morgan_rdkit fingerprints...
Generated fingerprints with 1536 features for 841 molecules
Trial 412: 5-fold CV loss = 0.4710
[I 2025-08-07 18:14:03,566] Trial 412 finished with value: 0.4710147142410278 and parameters: {'fp_type': 'morgan_rdkit', 'combined_morgan_radius': 2, 'combined_morgan_nBits': 512, 'combined_rdkit_maxPath': 7, 'combined_rdkit_nBits': 1024, 'num_hidden_layers': 3, 'hidden_dim_0': 64, 'hidden_dim_1': 512, 'hidden_dim_2': 1024, 'kl_weight': 0.00013785624753820557, 'lr': 0.002333104294109347, 'batch_size': 32, 'dropout_rate': 0.1778025077531894, 'prior_mu': 0.07209499630627034, 'prior_sigma': 0.020699171433546607, 'normalization': 'layer'}. Best is trial 179 with value: 0.4671938598155975.
Generating morgan_rdkit fingerprints...
Generated fingerprints with 1536 features for 841 molecules
Trial 415: 5-fold CV loss = 0.4754
[I 2025-08-07 18:14:30,624] Trial 415 finished with value: 0.47544129490852355 and parameters: {'fp_type': 'morgan_rdkit', 'combined_morgan_radius': 2, 'combined_morgan_nBits': 1024, 'combined_rdkit_maxPath': 7, 'combined_rdkit_nBits': 1024, 'num_hidden_layers': 3, 'hidden_dim_0': 256, 'hidden_dim_1': 64, 'hidden_dim_2': 1024, 'kl_weight': 0.00011662873878499859, 'lr': 0.0033507472252467495, 'batch_size': 32, 'dropout_rate': 0.2349779448072194, 'prior_mu': 0.1068626032374552, 'prior_sigma': 0.03326615884152989, 'normalization': 'layer'}. Best is trial 179 with value: 0.4671938598155975.
Generating morgan_rdkit fingerprints...
Generated fingerprints with 1536 features for 841 molecules
Trial 416: 5-fold CV loss = 0.4827
[I 2025-08-07 18:14:32,694] Trial 416 finished with value: 0.4826754808425903 and parameters: {'fp_type': 'morgan_rdkit', 'combined_morgan_radius': 2, 'combined_morgan_nBits': 512, 'combined_rdkit_maxPath': 7, 'combined_rdkit_nBits': 1024, 'num_hidden_layers': 2, 'hidden_dim_0': 64, 'hidden_dim_1': 64, 'kl_weight': 0.0001133011875365824, 'lr': 0.0014468636561509362, 'batch_size': 64, 'dropout_rate': 0.2184885488098777, 'prior_mu': 0.06877281734452556, 'prior_sigma': 0.018079292684879095, 'normalization': 'layer'}. Best is trial 179 with value: 0.4671938598155975.
Generating morgan_rdkit fingerprints...
Generated fingerprints with 1536 features for 841 molecules
Trial 411: 5-fold CV loss = 0.4794
[I 2025-08-07 18:14:44,549] Trial 411 finished with value: 0.4794100821018219 and parameters: {'fp_type': 'morgan_rdkit', 'combined_morgan_radius': 2, 'combined_morgan_nBits': 512, 'combined_rdkit_maxPath': 7, 'combined_rdkit_nBits': 1024, 'num_hidden_layers': 2, 'hidden_dim_0': 64, 'hidden_dim_1': 512, 'kl_weight': 0.00017751383690512514, 'lr': 0.0015244234016608864, 'batch_size': 32, 'dropout_rate': 0.18179251173047545, 'prior_mu': 0.07224834326772271, 'prior_sigma': 0.032164505419500576, 'normalization': 'layer'}. Best is trial 179 with value: 0.4671938598155975.
Generating morgan_rdkit fingerprints...
Generated fingerprints with 1536 features for 841 molecules
Trial 418: 5-fold CV loss = 0.5129
[I 2025-08-07 18:15:19,200] Trial 418 finished with value: 0.5129392862319946 and parameters: {'fp_type': 'morgan_rdkit', 'combined_morgan_radius': 2, 'combined_morgan_nBits': 512, 'combined_rdkit_maxPath': 7, 'combined_rdkit_nBits': 1024, 'num_hidden_layers': 2, 'hidden_dim_0': 64, 'hidden_dim_1': 512, 'kl_weight': 0.0001403083774072564, 'lr': 0.00023540059753561707, 'batch_size': 64, 'dropout_rate': 0.21201952980138936, 'prior_mu': 0.08552149908160828, 'prior_sigma': 0.029679679260857864, 'normalization': 'layer'}. Best is trial 179 with value: 0.4671938598155975.
Generating morgan_rdkit fingerprints...
Generated fingerprints with 1536 features for 841 molecules
Trial 417: 5-fold CV loss = 0.4765
[I 2025-08-07 18:15:28,103] Trial 417 finished with value: 0.4764620840549469 and parameters: {'fp_type': 'morgan_rdkit', 'combined_morgan_radius': 2, 'combined_morgan_nBits': 512, 'combined_rdkit_maxPath': 7, 'combined_rdkit_nBits': 1024, 'num_hidden_layers': 2, 'hidden_dim_0': 256, 'hidden_dim_1': 512, 'kl_weight': 0.00011346331934141085, 'lr': 0.0018331920011591119, 'batch_size': 32, 'dropout_rate': 0.1766849341642592, 'prior_mu': 0.1058338098303427, 'prior_sigma': 0.03272391674463059, 'normalization': 'layer'}. Best is trial 179 with value: 0.4671938598155975.
Generating morgan_rdkit fingerprints...
Generated fingerprints with 1536 features for 841 molecules
Trial 419: 5-fold CV loss = 0.5088
[I 2025-08-07 18:15:42,478] Trial 419 finished with value: 0.5087523102760315 and parameters: {'fp_type': 'morgan_rdkit', 'combined_morgan_radius': 2, 'combined_morgan_nBits': 512, 'combined_rdkit_maxPath': 7, 'combined_rdkit_nBits': 1024, 'num_hidden_layers': 1, 'hidden_dim_0': 64, 'kl_weight': 0.00013760796618752589, 'lr': 0.0015654176710383466, 'batch_size': 32, 'dropout_rate': 0.1734219925817205, 'prior_mu': 0.08730744505935792, 'prior_sigma': 0.03027703834871387, 'normalization': 'none'}. Best is trial 179 with value: 0.4671938598155975.
Generating rdkit fingerprints...
Generated fingerprints with 512 features for 841 molecules
Trial 421: 5-fold CV loss = 0.5025
[I 2025-08-07 18:16:25,581] Trial 421 finished with value: 0.5024988055229187 and parameters: {'fp_type': 'morgan_rdkit', 'combined_morgan_radius': 2, 'combined_morgan_nBits': 512, 'combined_rdkit_maxPath': 7, 'combined_rdkit_nBits': 1024, 'num_hidden_layers': 3, 'hidden_dim_0': 64, 'hidden_dim_1': 512, 'hidden_dim_2': 1024, 'kl_weight': 0.00011418490269732423, 'lr': 0.001794622803814683, 'batch_size': 32, 'dropout_rate': 0.16085477225419595, 'prior_mu': 0.055388435930526905, 'prior_sigma': 0.025007693358048786, 'normalization': 'none'}. Best is trial 179 with value: 0.4671938598155975.
Generating morgan_rdkit fingerprints...
Generated fingerprints with 1536 features for 841 molecules
Trial 422: 5-fold CV loss = 0.4741
[I 2025-08-07 18:17:14,012] Trial 422 finished with value: 0.4740752398967743 and parameters: {'fp_type': 'morgan_rdkit', 'combined_morgan_radius': 2, 'combined_morgan_nBits': 512, 'combined_rdkit_maxPath': 7, 'combined_rdkit_nBits': 1024, 'num_hidden_layers': 3, 'hidden_dim_0': 64, 'hidden_dim_1': 512, 'hidden_dim_2': 1024, 'kl_weight': 0.0001001174990087906, 'lr': 0.0022600534765784353, 'batch_size': 32, 'dropout_rate': 0.18876930925599678, 'prior_mu': 0.0585601235573483, 'prior_sigma': 0.04894343360238239, 'normalization': 'layer'}. Best is trial 179 with value: 0.4671938598155975.
Generating rdkit fingerprints...
Generated fingerprints with 512 features for 841 molecules
Trial 424: 5-fold CV loss = 0.4736
[I 2025-08-07 18:18:01,419] Trial 424 finished with value: 0.47364206314086915 and parameters: {'fp_type': 'morgan_rdkit', 'combined_morgan_radius': 2, 'combined_morgan_nBits': 512, 'combined_rdkit_maxPath': 7, 'combined_rdkit_nBits': 1024, 'num_hidden_layers': 3, 'hidden_dim_0': 64, 'hidden_dim_1': 256, 'hidden_dim_2': 1024, 'kl_weight': 0.00010059808210294677, 'lr': 0.0028248371533980813, 'batch_size': 32, 'dropout_rate': 0.22291970695453847, 'prior_mu': 0.0451998643477424, 'prior_sigma': 0.04842325614253769, 'normalization': 'layer'}. Best is trial 179 with value: 0.4671938598155975.
Generating rdkit fingerprints...
Generated fingerprints with 512 features for 841 molecules
Trial 420: 5-fold CV loss = 0.5085
[I 2025-08-07 18:18:30,435] Trial 420 finished with value: 0.5085382640361786 and parameters: {'fp_type': 'morgan_rdkit', 'combined_morgan_radius': 2, 'combined_morgan_nBits': 512, 'combined_rdkit_maxPath': 7, 'combined_rdkit_nBits': 1024, 'num_hidden_layers': 3, 'hidden_dim_0': 64, 'hidden_dim_1': 512, 'hidden_dim_2': 1024, 'kl_weight': 0.00014070230365371758, 'lr': 0.0018195574664733706, 'batch_size': 32, 'dropout_rate': 0.16060531089840172, 'prior_mu': 0.05553918286354315, 'prior_sigma': 0.027207476321451315, 'normalization': 'none'}. Best is trial 179 with value: 0.4671938598155975.
Generating rdkit fingerprints...
Generated fingerprints with 512 features for 841 molecules
Trial 425: 5-fold CV loss = 0.6135
[I 2025-08-07 18:19:01,410] Trial 425 finished with value: 0.6134580492973327 and parameters: {'fp_type': 'rdkit', 'rdkit_only_maxPath': 7, 'rdkit_only_nBits': 512, 'num_hidden_layers': 3, 'hidden_dim_0': 64, 'hidden_dim_1': 256, 'hidden_dim_2': 1024, 'kl_weight': 0.0005755267599263864, 'lr': 0.0022631936361583987, 'batch_size': 32, 'dropout_rate': 0.15512093441271707, 'prior_mu': 0.06152995420082201, 'prior_sigma': 0.04747277884418469, 'normalization': 'layer'}. Best is trial 179 with value: 0.4671938598155975.
Generating morgan_rdkit fingerprints...
Generated fingerprints with 1536 features for 841 molecules
Trial 423: 5-fold CV loss = 0.5304
[I 2025-08-07 18:19:24,140] Trial 423 finished with value: 0.5303629457950592 and parameters: {'fp_type': 'rdkit', 'rdkit_only_maxPath': 7, 'rdkit_only_nBits': 512, 'num_hidden_layers': 3, 'hidden_dim_0': 64, 'hidden_dim_1': 512, 'hidden_dim_2': 1024, 'kl_weight': 0.00011350597190734008, 'lr': 0.002781879760397061, 'batch_size': 32, 'dropout_rate': 0.15942735455247536, 'prior_mu': 0.05495705167476356, 'prior_sigma': 0.024294739388572358, 'normalization': 'layer'}. Best is trial 179 with value: 0.4671938598155975.
Generating morgan_rdkit fingerprints...
Generated fingerprints with 1536 features for 841 molecules
Trial 426: 5-fold CV loss = 0.5750
[I 2025-08-07 18:20:21,523] Trial 426 finished with value: 0.5750180304050445 and parameters: {'fp_type': 'rdkit', 'rdkit_only_maxPath': 7, 'rdkit_only_nBits': 512, 'num_hidden_layers': 3, 'hidden_dim_0': 64, 'hidden_dim_1': 256, 'hidden_dim_2': 1024, 'kl_weight': 0.00011169188714265847, 'lr': 0.0022610494532542846, 'batch_size': 32, 'dropout_rate': 0.22451070840983553, 'prior_mu': 0.04745064090117672, 'prior_sigma': 0.05032986000484414, 'normalization': 'layer'}. Best is trial 179 with value: 0.4671938598155975.
Generating morgan_rdkit fingerprints...
Generated fingerprints with 1536 features for 841 molecules
Trial 428: 5-fold CV loss = 0.4918
[I 2025-08-07 18:20:51,721] Trial 428 finished with value: 0.49179633855819704 and parameters: {'fp_type': 'morgan_rdkit', 'combined_morgan_radius': 2, 'combined_morgan_nBits': 512, 'combined_rdkit_maxPath': 7, 'combined_rdkit_nBits': 1024, 'num_hidden_layers': 3, 'hidden_dim_0': 64, 'hidden_dim_1': 256, 'hidden_dim_2': 1024, 'kl_weight': 0.00010186164703499438, 'lr': 0.0023242574128121665, 'batch_size': 32, 'dropout_rate': 0.22125106395294536, 'prior_mu': 0.04689651719015433, 'prior_sigma': 0.055941052129934055, 'normalization': 'layer'}. Best is trial 179 with value: 0.4671938598155975.
Generating morgan_rdkit fingerprints...
Generated fingerprints with 1536 features for 841 molecules
Trial 429: 5-fold CV loss = 0.4850
[I 2025-08-07 18:21:46,957] Trial 429 finished with value: 0.48504583835601806 and parameters: {'fp_type': 'morgan_rdkit', 'combined_morgan_radius': 2, 'combined_morgan_nBits': 512, 'combined_rdkit_maxPath': 6, 'combined_rdkit_nBits': 1024, 'num_hidden_layers': 3, 'hidden_dim_0': 64, 'hidden_dim_1': 256, 'hidden_dim_2': 1024, 'kl_weight': 0.00010005778976892042, 'lr': 0.0023374232039318154, 'batch_size': 32, 'dropout_rate': 0.2212561924753855, 'prior_mu': 0.04846227942314102, 'prior_sigma': 0.055074603007015235, 'normalization': 'layer'}. Best is trial 179 with value: 0.4671938598155975.
Generating morgan_rdkit fingerprints...
Generated fingerprints with 1536 features for 841 molecules
Trial 430: 5-fold CV loss = 0.4782
[I 2025-08-07 18:21:55,425] Trial 430 finished with value: 0.47821725606918336 and parameters: {'fp_type': 'morgan_rdkit', 'combined_morgan_radius': 2, 'combined_morgan_nBits': 512, 'combined_rdkit_maxPath': 6, 'combined_rdkit_nBits': 1024, 'num_hidden_layers': 3, 'hidden_dim_0': 64, 'hidden_dim_1': 256, 'hidden_dim_2': 1024, 'kl_weight': 0.00010355028896066241, 'lr': 0.002078480073487707, 'batch_size': 32, 'dropout_rate': 0.20641717759581835, 'prior_mu': 0.045686612157985536, 'prior_sigma': 0.05674557534298993, 'normalization': 'layer'}. Best is trial 179 with value: 0.4671938598155975.
Generating morgan fingerprints...
Generated fingerprints with 1024 features for 841 molecules
Trial 431: 5-fold CV loss = 0.4764
[I 2025-08-07 18:22:09,182] Trial 431 finished with value: 0.47644383907318116 and parameters: {'fp_type': 'morgan_rdkit', 'combined_morgan_radius': 2, 'combined_morgan_nBits': 512, 'combined_rdkit_maxPath': 6, 'combined_rdkit_nBits': 1024, 'num_hidden_layers': 3, 'hidden_dim_0': 64, 'hidden_dim_1': 256, 'hidden_dim_2': 512, 'kl_weight': 0.00010177667314126542, 'lr': 0.002066105284693048, 'batch_size': 32, 'dropout_rate': 0.19336670106095474, 'prior_mu': 0.06206060120884974, 'prior_sigma': 0.04951340521607431, 'normalization': 'layer'}. Best is trial 179 with value: 0.4671938598155975.
Generating morgan_rdkit fingerprints...
Generated fingerprints with 2048 features for 841 molecules
Trial 433: 5-fold CV loss = 0.5330
[I 2025-08-07 18:22:35,883] Trial 433 finished with value: 0.5329590559005737 and parameters: {'fp_type': 'morgan', 'morgan_only_radius': 3, 'morgan_only_nBits': 1024, 'num_hidden_layers': 3, 'hidden_dim_0': 64, 'hidden_dim_1': 256, 'hidden_dim_2': 512, 'kl_weight': 0.001985230693824061, 'lr': 0.002803263931073973, 'batch_size': 32, 'dropout_rate': 0.1870424982348774, 'prior_mu': 0.06534597952947496, 'prior_sigma': 0.041558297031604234, 'normalization': 'layer'}. Best is trial 179 with value: 0.4671938598155975.
Generating morgan_rdkit fingerprints...
Generated fingerprints with 1536 features for 841 molecules
Trial 434: 5-fold CV loss = 0.4755
[I 2025-08-07 18:23:41,340] Trial 434 finished with value: 0.4754570066928864 and parameters: {'fp_type': 'morgan_rdkit', 'combined_morgan_radius': 2, 'combined_morgan_nBits': 1024, 'combined_rdkit_maxPath': 7, 'combined_rdkit_nBits': 1024, 'num_hidden_layers': 3, 'hidden_dim_0': 64, 'hidden_dim_1': 256, 'hidden_dim_2': 1024, 'kl_weight': 0.00012527574643016466, 'lr': 0.0028806004730411766, 'batch_size': 32, 'dropout_rate': 0.21331216550268428, 'prior_mu': 0.06315764078061006, 'prior_sigma': 0.04681689766785836, 'normalization': 'layer'}. Best is trial 179 with value: 0.4671938598155975.
Generating morgan_rdkit fingerprints...
Generated fingerprints with 1024 features for 841 molecules
Trial 435: 5-fold CV loss = 0.4933
[I 2025-08-07 18:24:00,112] Trial 435 finished with value: 0.49326363801956175 and parameters: {'fp_type': 'morgan_rdkit', 'combined_morgan_radius': 2, 'combined_morgan_nBits': 1024, 'combined_rdkit_maxPath': 7, 'combined_rdkit_nBits': 512, 'num_hidden_layers': 3, 'hidden_dim_0': 64, 'hidden_dim_1': 256, 'hidden_dim_2': 1024, 'kl_weight': 0.00012258214131483645, 'lr': 0.003119531695102498, 'batch_size': 32, 'dropout_rate': 0.3527147751057642, 'prior_mu': 0.053867523310622716, 'prior_sigma': 0.04531479961879281, 'normalization': 'layer'}. Best is trial 179 with value: 0.4671938598155975.
Generating morgan_rdkit fingerprints...
Generated fingerprints with 1536 features for 841 molecules
Trial 432: 5-fold CV loss = 0.4774
[I 2025-08-07 18:24:12,794] Trial 432 finished with value: 0.4774393022060394 and parameters: {'fp_type': 'morgan_rdkit', 'combined_morgan_radius': 2, 'combined_morgan_nBits': 512, 'combined_rdkit_maxPath': 7, 'combined_rdkit_nBits': 1024, 'num_hidden_layers': 3, 'hidden_dim_0': 64, 'hidden_dim_1': 256, 'hidden_dim_2': 512, 'kl_weight': 0.0001011313751470823, 'lr': 0.002072117737777259, 'batch_size': 32, 'dropout_rate': 0.23512096995428053, 'prior_mu': 0.05710835640788665, 'prior_sigma': 0.04841689937127674, 'normalization': 'layer'}. Best is trial 179 with value: 0.4671938598155975.
Generating morgan_rdkit fingerprints...
Generated fingerprints with 768 features for 841 molecules
Trial 437: 5-fold CV loss = 0.4763
