[I 2025-08-07 19:17:23,945] Trial 675 finished with value: 0.5432722508907318 and parameters: {'fp_type': 'morgan_rdkit', 'combined_morgan_radius': 3, 'combined_morgan_nBits': 1024, 'combined_rdkit_maxPath': 7, 'combined_rdkit_nBits': 1024, 'num_hidden_layers': 3, 'hidden_dim_0': 256, 'hidden_dim_1': 1024, 'hidden_dim_2': 64, 'kl_weight': 0.0006260137264779581, 'lr': 0.007141616721734057, 'batch_size': 128, 'dropout_rate': 0.1343625591981465, 'prior_mu': -0.05832555939180828, 'prior_sigma': 0.08964250513206087, 'normalization': 'layer'}. Best is trial 587 with value: 0.4552353322505951.
Generating morgan_rdkit fingerprints...
Generated fingerprints with 2048 features for 841 molecules
Trial 677: 5-fold CV loss = 0.5392
[I 2025-08-07 19:17:46,924] Trial 677 finished with value: 0.5392270386219025 and parameters: {'fp_type': 'morgan_rdkit', 'combined_morgan_radius': 3, 'combined_morgan_nBits': 1024, 'combined_rdkit_maxPath': 7, 'combined_rdkit_nBits': 1024, 'num_hidden_layers': 3, 'hidden_dim_0': 256, 'hidden_dim_1': 1024, 'hidden_dim_2': 64, 'kl_weight': 0.0005853824452113707, 'lr': 0.006250204531355942, 'batch_size': 128, 'dropout_rate': 0.1349149375848781, 'prior_mu': -0.05692167798754912, 'prior_sigma': 0.0899266694733989, 'normalization': 'layer'}. Best is trial 587 with value: 0.4552353322505951.
Generating morgan_rdkit fingerprints...
Generated fingerprints with 2048 features for 841 molecules
Trial 678: 5-fold CV loss = 0.4615
[I 2025-08-07 19:17:56,849] Trial 678 finished with value: 0.4614826500415802 and parameters: {'fp_type': 'morgan_rdkit', 'combined_morgan_radius': 3, 'combined_morgan_nBits': 1024, 'combined_rdkit_maxPath': 7, 'combined_rdkit_nBits': 1024, 'num_hidden_layers': 3, 'hidden_dim_0': 256, 'hidden_dim_1': 1024, 'hidden_dim_2': 64, 'kl_weight': 0.0006465021840731199, 'lr': 0.005540683257167491, 'batch_size': 128, 'dropout_rate': 0.15315231079141423, 'prior_mu': -0.07142186624181028, 'prior_sigma': 0.08947794122711329, 'normalization': 'layer'}. Best is trial 587 with value: 0.4552353322505951.
Generating morgan_rdkit fingerprints...
Generated fingerprints with 2048 features for 841 molecules
Trial 679: 5-fold CV loss = 0.5779
[I 2025-08-07 19:18:04,568] Trial 679 finished with value: 0.5778978049755097 and parameters: {'fp_type': 'morgan_rdkit', 'combined_morgan_radius': 3, 'combined_morgan_nBits': 1024, 'combined_rdkit_maxPath': 7, 'combined_rdkit_nBits': 1024, 'num_hidden_layers': 3, 'hidden_dim_0': 256, 'hidden_dim_1': 64, 'hidden_dim_2': 64, 'kl_weight': 0.0007155353970790744, 'lr': 0.006401173329885117, 'batch_size': 128, 'dropout_rate': 0.15253983435046806, 'prior_mu': -0.060713978500705784, 'prior_sigma': 0.09116713283719184, 'normalization': 'layer'}. Best is trial 587 with value: 0.4552353322505951.
Generating morgan_rdkit fingerprints...
Generated fingerprints with 2048 features for 841 molecules
Trial 681: 5-fold CV loss = 0.8852
[I 2025-08-07 19:18:13,320] Trial 681 finished with value: 0.8851876139640809 and parameters: {'fp_type': 'morgan_rdkit', 'combined_morgan_radius': 3, 'combined_morgan_nBits': 1024, 'combined_rdkit_maxPath': 7, 'combined_rdkit_nBits': 1024, 'num_hidden_layers': 3, 'hidden_dim_0': 256, 'hidden_dim_1': 64, 'hidden_dim_2': 1024, 'kl_weight': 0.000604528001906907, 'lr': 0.00854159873624317, 'batch_size': 128, 'dropout_rate': 0.1502712599841515, 'prior_mu': -0.07433643866570797, 'prior_sigma': 0.08868804235636463, 'normalization': 'layer'}. Best is trial 587 with value: 0.4552353322505951.
Generating morgan_rdkit fingerprints...
Generated fingerprints with 2048 features for 841 molecules
Trial 676: 5-fold CV loss = 0.4718
[I 2025-08-07 19:18:20,448] Trial 676 finished with value: 0.4717905163764954 and parameters: {'fp_type': 'morgan_rdkit', 'combined_morgan_radius': 3, 'combined_morgan_nBits': 1024, 'combined_rdkit_maxPath': 7, 'combined_rdkit_nBits': 1024, 'num_hidden_layers': 3, 'hidden_dim_0': 256, 'hidden_dim_1': 1024, 'hidden_dim_2': 64, 'kl_weight': 0.0007493054917991351, 'lr': 0.007391094895665573, 'batch_size': 128, 'dropout_rate': 0.13359602597089962, 'prior_mu': -0.07479144601610943, 'prior_sigma': 0.0902270382189908, 'normalization': 'layer'}. Best is trial 587 with value: 0.4552353322505951.
Generating morgan_rdkit fingerprints...
Generated fingerprints with 2048 features for 841 molecules
Trial 683: 5-fold CV loss = 1.1981
[I 2025-08-07 19:18:21,740] Trial 683 finished with value: 1.1981270551681518 and parameters: {'fp_type': 'morgan_rdkit', 'combined_morgan_radius': 3, 'combined_morgan_nBits': 1024, 'combined_rdkit_maxPath': 7, 'combined_rdkit_nBits': 1024, 'num_hidden_layers': 0, 'kl_weight': 0.0005168158390396521, 'lr': 0.005481625687739129, 'batch_size': 128, 'dropout_rate': 0.12640033444841295, 'prior_mu': -0.08914674610368253, 'prior_sigma': 0.09443805862999936, 'normalization': 'layer'}. Best is trial 587 with value: 0.4552353322505951.
Generating morgan fingerprints...
Generated fingerprints with 1024 features for 841 molecules
Trial 680: 5-fold CV loss = 0.8022
[I 2025-08-07 19:18:30,142] Trial 680 finished with value: 0.8021696090698243 and parameters: {'fp_type': 'morgan_rdkit', 'combined_morgan_radius': 3, 'combined_morgan_nBits': 1024, 'combined_rdkit_maxPath': 7, 'combined_rdkit_nBits': 1024, 'num_hidden_layers': 3, 'hidden_dim_0': 256, 'hidden_dim_1': 1024, 'hidden_dim_2': 1024, 'kl_weight': 0.000727123950506699, 'lr': 0.008624890195704636, 'batch_size': 128, 'dropout_rate': 0.15534371613477183, 'prior_mu': -0.03672379378261896, 'prior_sigma': 0.09508936834898746, 'normalization': 'layer'}. Best is trial 587 with value: 0.4552353322505951.
Generating morgan fingerprints...
Generated fingerprints with 1024 features for 841 molecules
Trial 682: 5-fold CV loss = 0.8094
[I 2025-08-07 19:18:37,146] Trial 682 finished with value: 0.8094329476356507 and parameters: {'fp_type': 'morgan_rdkit', 'combined_morgan_radius': 3, 'combined_morgan_nBits': 1024, 'combined_rdkit_maxPath': 7, 'combined_rdkit_nBits': 1024, 'num_hidden_layers': 3, 'hidden_dim_0': 256, 'hidden_dim_1': 1024, 'hidden_dim_2': 1024, 'kl_weight': 0.0005709504876138947, 'lr': 0.008415503846462134, 'batch_size': 128, 'dropout_rate': 0.12437903866323655, 'prior_mu': -0.07793320909986017, 'prior_sigma': 0.08797722401139862, 'normalization': 'layer'}. Best is trial 587 with value: 0.4552353322505951.
Generating morgan fingerprints...
Generated fingerprints with 1024 features for 841 molecules
Trial 685: 5-fold CV loss = 0.5316
[I 2025-08-07 19:18:43,218] Trial 685 finished with value: 0.5316211163997651 and parameters: {'fp_type': 'morgan', 'morgan_only_radius': 3, 'morgan_only_nBits': 1024, 'num_hidden_layers': 3, 'hidden_dim_0': 256, 'hidden_dim_1': 1024, 'hidden_dim_2': 256, 'kl_weight': 0.000450065066309848, 'lr': 0.009069810801423063, 'batch_size': 128, 'dropout_rate': 0.1117927544517907, 'prior_mu': -0.0337589906541528, 'prior_sigma': 0.08429079174616594, 'normalization': 'layer'}. Best is trial 587 with value: 0.4552353322505951.
Generating morgan_rdkit fingerprints...
Generated fingerprints with 1536 features for 841 molecules
Trial 686: 5-fold CV loss = 0.5369
[I 2025-08-07 19:19:03,478] Trial 686 finished with value: 0.5369312226772308 and parameters: {'fp_type': 'morgan', 'morgan_only_radius': 3, 'morgan_only_nBits': 1024, 'num_hidden_layers': 3, 'hidden_dim_0': 256, 'hidden_dim_1': 1024, 'hidden_dim_2': 256, 'kl_weight': 0.0004481182116653855, 'lr': 0.009930870486707185, 'batch_size': 128, 'dropout_rate': 0.11720949926920707, 'prior_mu': -0.06841627287361401, 'prior_sigma': 0.08688449475042351, 'normalization': 'layer'}. Best is trial 587 with value: 0.4552353322505951.
Generating morgan_rdkit fingerprints...
Generated fingerprints with 1536 features for 841 molecules
Trial 688: 5-fold CV loss = 0.6552
[I 2025-08-07 19:19:08,056] Trial 688 finished with value: 0.6551531076431274 and parameters: {'fp_type': 'morgan_rdkit', 'combined_morgan_radius': 3, 'combined_morgan_nBits': 1024, 'combined_rdkit_maxPath': 7, 'combined_rdkit_nBits': 512, 'num_hidden_layers': 3, 'hidden_dim_0': 128, 'hidden_dim_1': 1024, 'hidden_dim_2': 64, 'kl_weight': 0.00039817747157420194, 'lr': 0.007785253083523526, 'batch_size': 128, 'dropout_rate': 0.14409872051187272, 'prior_mu': -0.09474693893482969, 'prior_sigma': 0.10296092222886136, 'normalization': 'layer'}. Best is trial 587 with value: 0.4552353322505951.
Generating morgan_rdkit fingerprints...
Generated fingerprints with 2048 features for 841 molecules
Trial 687: 5-fold CV loss = 0.5276
[I 2025-08-07 19:19:09,099] Trial 687 finished with value: 0.5276472091674804 and parameters: {'fp_type': 'morgan', 'morgan_only_radius': 3, 'morgan_only_nBits': 1024, 'num_hidden_layers': 3, 'hidden_dim_0': 128, 'hidden_dim_1': 1024, 'hidden_dim_2': 256, 'kl_weight': 0.00044928200986114577, 'lr': 0.007682153391221671, 'batch_size': 128, 'dropout_rate': 0.1137229595265647, 'prior_mu': -0.11092881048261902, 'prior_sigma': 0.0844594574882988, 'normalization': 'layer'}. Best is trial 587 with value: 0.4552353322505951.
Generating morgan_rdkit fingerprints...
Generated fingerprints with 2048 features for 841 molecules
Trial 689: 5-fold CV loss = 0.8897
[I 2025-08-07 19:19:28,492] Trial 689 finished with value: 0.8896793603897095 and parameters: {'fp_type': 'morgan_rdkit', 'combined_morgan_radius': 3, 'combined_morgan_nBits': 1024, 'combined_rdkit_maxPath': 7, 'combined_rdkit_nBits': 512, 'num_hidden_layers': 3, 'hidden_dim_0': 128, 'hidden_dim_1': 1024, 'hidden_dim_2': 512, 'kl_weight': 0.00274573667486297, 'lr': 0.007926748532972988, 'batch_size': 128, 'dropout_rate': 0.16270020171310243, 'prior_mu': -0.08938672690030486, 'prior_sigma': 0.0924876445157102, 'normalization': 'layer'}. Best is trial 587 with value: 0.4552353322505951.
Generating morgan_rdkit fingerprints...
Generated fingerprints with 2048 features for 841 molecules
Trial 691: 5-fold CV loss = 0.8169
[I 2025-08-07 19:19:36,605] Trial 691 finished with value: 0.8169489502906799 and parameters: {'fp_type': 'morgan_rdkit', 'combined_morgan_radius': 3, 'combined_morgan_nBits': 1024, 'combined_rdkit_maxPath': 7, 'combined_rdkit_nBits': 1024, 'num_hidden_layers': 3, 'hidden_dim_0': 256, 'hidden_dim_1': 128, 'hidden_dim_2': 512, 'kl_weight': 0.0005193038002078272, 'lr': 0.00546258869597667, 'batch_size': 128, 'dropout_rate': 0.15967688939324604, 'prior_mu': -0.019221146929465013, 'prior_sigma': 0.09281783799874688, 'normalization': 'layer'}. Best is trial 587 with value: 0.4552353322505951.
Generating morgan_rdkit fingerprints...
Generated fingerprints with 2048 features for 841 molecules
Trial 690: 5-fold CV loss = 0.5374
[I 2025-08-07 19:19:43,629] Trial 690 finished with value: 0.5373935997486115 and parameters: {'fp_type': 'morgan_rdkit', 'combined_morgan_radius': 3, 'combined_morgan_nBits': 1024, 'combined_rdkit_maxPath': 7, 'combined_rdkit_nBits': 1024, 'num_hidden_layers': 3, 'hidden_dim_0': 256, 'hidden_dim_1': 128, 'hidden_dim_2': 64, 'kl_weight': 0.0006395626608248754, 'lr': 0.006574090595119753, 'batch_size': 128, 'dropout_rate': 0.1616029744989881, 'prior_mu': -0.018485373145311977, 'prior_sigma': 0.0926275643906099, 'normalization': 'layer'}. Best is trial 587 with value: 0.4552353322505951.
Generating rdkit fingerprints...
Generated fingerprints with 512 features for 841 molecules
Trial 693: 5-fold CV loss = 0.4809
[I 2025-08-07 19:20:05,700] Trial 693 finished with value: 0.48088163137435913 and parameters: {'fp_type': 'morgan_rdkit', 'combined_morgan_radius': 3, 'combined_morgan_nBits': 1024, 'combined_rdkit_maxPath': 5, 'combined_rdkit_nBits': 1024, 'num_hidden_layers': 3, 'hidden_dim_0': 256, 'hidden_dim_1': 1024, 'hidden_dim_2': 64, 'kl_weight': 0.0006442498235113924, 'lr': 0.006252483170865648, 'batch_size': 128, 'dropout_rate': 0.1456686835271976, 'prior_mu': -0.06875879151507379, 'prior_sigma': 0.08117692681841235, 'normalization': 'layer'}. Best is trial 587 with value: 0.4552353322505951.
Generating rdkit fingerprints...
Generated fingerprints with 512 features for 841 molecules
Trial 684: 5-fold CV loss = 0.5796
[I 2025-08-07 19:20:07,973] Trial 684 finished with value: 0.5796096622943878 and parameters: {'fp_type': 'morgan_rdkit', 'combined_morgan_radius': 3, 'combined_morgan_nBits': 1024, 'combined_rdkit_maxPath': 7, 'combined_rdkit_nBits': 1024, 'num_hidden_layers': 3, 'hidden_dim_0': 256, 'hidden_dim_1': 1024, 'hidden_dim_2': 256, 'kl_weight': 0.0005260682543822485, 'lr': 0.005485411848746184, 'batch_size': 128, 'dropout_rate': 0.11777062574882391, 'prior_mu': -0.08720908486408575, 'prior_sigma': 0.09421203358665464, 'normalization': 'layer'}. Best is trial 587 with value: 0.4552353322505951.
Generating rdkit fingerprints...
Generated fingerprints with 512 features for 841 molecules
Trial 694: 5-fold CV loss = 0.5148
[I 2025-08-07 19:20:21,386] Trial 694 finished with value: 0.5148416757583618 and parameters: {'fp_type': 'rdkit', 'rdkit_only_maxPath': 5, 'rdkit_only_nBits': 512, 'num_hidden_layers': 3, 'hidden_dim_0': 256, 'hidden_dim_1': 1024, 'hidden_dim_2': 64, 'kl_weight': 0.0004042385201017118, 'lr': 0.006190811118865108, 'batch_size': 128, 'dropout_rate': 0.1440051971646212, 'prior_mu': -0.02992322864300127, 'prior_sigma': 0.10156538587231008, 'normalization': 'layer'}. Best is trial 587 with value: 0.4552353322505951.
Generating morgan_rdkit fingerprints...
Generated fingerprints with 2048 features for 841 molecules
Trial 692: 5-fold CV loss = 0.4718
[I 2025-08-07 19:20:26,844] Trial 692 finished with value: 0.47183545827865603 and parameters: {'fp_type': 'morgan_rdkit', 'combined_morgan_radius': 3, 'combined_morgan_nBits': 1024, 'combined_rdkit_maxPath': 7, 'combined_rdkit_nBits': 1024, 'num_hidden_layers': 3, 'hidden_dim_0': 256, 'hidden_dim_1': 1024, 'hidden_dim_2': 64, 'kl_weight': 0.0005346615081969277, 'lr': 0.005460527272588358, 'batch_size': 128, 'dropout_rate': 0.14224279049205085, 'prior_mu': -0.08277070264775674, 'prior_sigma': 0.0816951623608404, 'normalization': 'layer'}. Best is trial 587 with value: 0.4552353322505951.
Generating morgan_rdkit fingerprints...
Generated fingerprints with 2048 features for 841 molecules
Trial 697: 5-fold CV loss = 0.7338
[I 2025-08-07 19:20:48,915] Trial 697 finished with value: 0.7338020086288453 and parameters: {'fp_type': 'morgan_rdkit', 'combined_morgan_radius': 3, 'combined_morgan_nBits': 1024, 'combined_rdkit_maxPath': 7, 'combined_rdkit_nBits': 1024, 'num_hidden_layers': 3, 'hidden_dim_0': 256, 'hidden_dim_1': 1024, 'hidden_dim_2': 64, 'kl_weight': 0.005444691994620893, 'lr': 0.006931462003817598, 'batch_size': 128, 'dropout_rate': 0.08925732145952059, 'prior_mu': -0.06115466423449877, 'prior_sigma': 0.1800022532174262, 'normalization': 'layer'}. Best is trial 587 with value: 0.4552353322505951.
Generating morgan_rdkit fingerprints...
Generated fingerprints with 2048 features for 841 molecules
Trial 695: 5-fold CV loss = 0.5220
[I 2025-08-07 19:20:50,452] Trial 695 finished with value: 0.5219836235046387 and parameters: {'fp_type': 'rdkit', 'rdkit_only_maxPath': 5, 'rdkit_only_nBits': 512, 'num_hidden_layers': 3, 'hidden_dim_0': 256, 'hidden_dim_1': 1024, 'hidden_dim_2': 64, 'kl_weight': 0.0003816551046213855, 'lr': 0.006929915140933467, 'batch_size': 128, 'dropout_rate': 0.17536936067750072, 'prior_mu': -0.0812606250546583, 'prior_sigma': 0.10209795931024038, 'normalization': 'layer'}. Best is trial 587 with value: 0.4552353322505951.
Generating morgan_rdkit fingerprints...
Generated fingerprints with 2048 features for 841 molecules
Trial 698: 5-fold CV loss = 0.4647
[I 2025-08-07 19:21:24,107] Trial 698 finished with value: 0.4647181570529938 and parameters: {'fp_type': 'morgan_rdkit', 'combined_morgan_radius': 3, 'combined_morgan_nBits': 1024, 'combined_rdkit_maxPath': 7, 'combined_rdkit_nBits': 1024, 'num_hidden_layers': 3, 'hidden_dim_0': 256, 'hidden_dim_1': 1024, 'hidden_dim_2': 64, 'kl_weight': 0.00038575205358249294, 'lr': 0.0068619413102524425, 'batch_size': 128, 'dropout_rate': 0.1725153638152922, 'prior_mu': -0.06573714268968867, 'prior_sigma': 0.08803899984929779, 'normalization': 'layer'}. Best is trial 587 with value: 0.4552353322505951.
Generating morgan_rdkit fingerprints...
Generated fingerprints with 2048 features for 841 molecules
Trial 700: 5-fold CV loss = 0.4652
[I 2025-08-07 19:21:27,760] Trial 700 finished with value: 0.4652139663696289 and parameters: {'fp_type': 'morgan_rdkit', 'combined_morgan_radius': 3, 'combined_morgan_nBits': 1024, 'combined_rdkit_maxPath': 7, 'combined_rdkit_nBits': 1024, 'num_hidden_layers': 3, 'hidden_dim_0': 256, 'hidden_dim_1': 1024, 'hidden_dim_2': 64, 'kl_weight': 0.0003327981111695626, 'lr': 0.009993840368206195, 'batch_size': 128, 'dropout_rate': 0.13180075633425495, 'prior_mu': -0.023209780594969788, 'prior_sigma': 0.08757679668194039, 'normalization': 'layer'}. Best is trial 587 with value: 0.4552353322505951.
Generating morgan_rdkit fingerprints...
Generated fingerprints with 2048 features for 841 molecules
Trial 699: 5-fold CV loss = 0.4679
[I 2025-08-07 19:21:29,373] Trial 699 finished with value: 0.46792917847633364 and parameters: {'fp_type': 'morgan_rdkit', 'combined_morgan_radius': 3, 'combined_morgan_nBits': 1024, 'combined_rdkit_maxPath': 7, 'combined_rdkit_nBits': 1024, 'num_hidden_layers': 3, 'hidden_dim_0': 256, 'hidden_dim_1': 1024, 'hidden_dim_2': 64, 'kl_weight': 0.00036280426490869333, 'lr': 0.009398992115130858, 'batch_size': 128, 'dropout_rate': 0.17545533374333966, 'prior_mu': 0.15851661414453444, 'prior_sigma': 0.08742137420117917, 'normalization': 'layer'}. Best is trial 587 with value: 0.4552353322505951.
Generating morgan_rdkit fingerprints...
Generated fingerprints with 2048 features for 841 molecules
Trial 696: 5-fold CV loss = 0.5722
[I 2025-08-07 19:21:33,349] Trial 696 finished with value: 0.5722009241580963 and parameters: {'fp_type': 'rdkit', 'rdkit_only_maxPath': 5, 'rdkit_only_nBits': 512, 'num_hidden_layers': 3, 'hidden_dim_0': 256, 'hidden_dim_1': 1024, 'hidden_dim_2': 64, 'kl_weight': 0.00040797551458664666, 'lr': 0.006967573845860962, 'batch_size': 128, 'dropout_rate': 0.17506747387761107, 'prior_mu': -0.06465942106340934, 'prior_sigma': 0.09999695500012848, 'normalization': 'layer'}. Best is trial 587 with value: 0.4552353322505951.
Generating morgan_rdkit fingerprints...
Generated fingerprints with 2048 features for 841 molecules
Trial 703: 5-fold CV loss = 0.4669
[I 2025-08-07 19:22:05,302] Trial 703 finished with value: 0.4669466555118561 and parameters: {'fp_type': 'morgan_rdkit', 'combined_morgan_radius': 3, 'combined_morgan_nBits': 1024, 'combined_rdkit_maxPath': 7, 'combined_rdkit_nBits': 1024, 'num_hidden_layers': 3, 'hidden_dim_0': 256, 'hidden_dim_1': 1024, 'hidden_dim_2': 64, 'kl_weight': 0.000962354820631824, 'lr': 0.008025578968361698, 'batch_size': 128, 'dropout_rate': 0.15398882484426227, 'prior_mu': -0.049826488906084675, 'prior_sigma': 0.09681281451431309, 'normalization': 'layer'}. Best is trial 587 with value: 0.4552353322505951.
Generating morgan_rdkit fingerprints...
Generated fingerprints with 2048 features for 841 molecules
Trial 702: 5-fold CV loss = 0.4632
[I 2025-08-07 19:22:11,329] Trial 702 finished with value: 0.463198846578598 and parameters: {'fp_type': 'morgan_rdkit', 'combined_morgan_radius': 3, 'combined_morgan_nBits': 1024, 'combined_rdkit_maxPath': 7, 'combined_rdkit_nBits': 1024, 'num_hidden_layers': 3, 'hidden_dim_0': 256, 'hidden_dim_1': 1024, 'hidden_dim_2': 64, 'kl_weight': 0.000304293443817704, 'lr': 0.009222496270934952, 'batch_size': 128, 'dropout_rate': 0.15217950242559924, 'prior_mu': -0.04731261980124203, 'prior_sigma': 0.0969368372457416, 'normalization': 'layer'}. Best is trial 587 with value: 0.4552353322505951.
Generating morgan_rdkit fingerprints...
Generated fingerprints with 2048 features for 841 molecules
Trial 701: 5-fold CV loss = 0.5674
[I 2025-08-07 19:22:17,372] Trial 701 finished with value: 0.5674065053462982 and parameters: {'fp_type': 'morgan_rdkit', 'combined_morgan_radius': 3, 'combined_morgan_nBits': 1024, 'combined_rdkit_maxPath': 7, 'combined_rdkit_nBits': 1024, 'num_hidden_layers': 3, 'hidden_dim_0': 256, 'hidden_dim_1': 1024, 'hidden_dim_2': 64, 'kl_weight': 0.000320244897077488, 'lr': 0.009173006712940829, 'batch_size': 128, 'dropout_rate': 0.13073925114045568, 'prior_mu': -0.023330421192892994, 'prior_sigma': 0.09852649616173359, 'normalization': 'layer'}. Best is trial 587 with value: 0.4552353322505951.
Generating morgan_rdkit fingerprints...
Generated fingerprints with 2048 features for 841 molecules
Trial 705: 5-fold CV loss = 0.4667
[I 2025-08-07 19:22:48,390] Trial 705 finished with value: 0.466692715883255 and parameters: {'fp_type': 'morgan_rdkit', 'combined_morgan_radius': 3, 'combined_morgan_nBits': 1024, 'combined_rdkit_maxPath': 7, 'combined_rdkit_nBits': 1024, 'num_hidden_layers': 3, 'hidden_dim_0': 256, 'hidden_dim_1': 1024, 'hidden_dim_2': 64, 'kl_weight': 0.0004673982609940674, 'lr': 0.00613639629379895, 'batch_size': 128, 'dropout_rate': 0.14006064342866548, 'prior_mu': -0.031638285859206375, 'prior_sigma': 0.09535130236565995, 'normalization': 'layer'}. Best is trial 587 with value: 0.4552353322505951.
Generating morgan_rdkit fingerprints...
Generated fingerprints with 2048 features for 841 molecules
Trial 706: 5-fold CV loss = 0.4645
