[I 2025-08-07 19:46:20,551] Trial 823 finished with value: 0.47352791428565977 and parameters: {'fp_type': 'morgan_rdkit', 'combined_morgan_radius': 3, 'combined_morgan_nBits': 1024, 'combined_rdkit_maxPath': 7, 'combined_rdkit_nBits': 1024, 'num_hidden_layers': 3, 'hidden_dim_0': 256, 'hidden_dim_1': 1024, 'hidden_dim_2': 64, 'kl_weight': 0.0002492790508204586, 'lr': 0.005333870577259157, 'batch_size': 128, 'dropout_rate': 0.12218613161591278, 'prior_mu': -0.02574090785033315, 'prior_sigma': 0.1004741086625057, 'normalization': 'layer'}. Best is trial 587 with value: 0.4552353322505951.
Generating morgan_rdkit fingerprints...
Generated fingerprints with 1280 features for 841 molecules
Trial 826: 5-fold CV loss = 0.4629
[I 2025-08-07 19:46:22,176] Trial 826 finished with value: 0.4628682494163513 and parameters: {'fp_type': 'morgan_rdkit', 'combined_morgan_radius': 3, 'combined_morgan_nBits': 1024, 'combined_rdkit_maxPath': 7, 'combined_rdkit_nBits': 1024, 'num_hidden_layers': 3, 'hidden_dim_0': 256, 'hidden_dim_1': 1024, 'hidden_dim_2': 64, 'kl_weight': 0.0003611140406204676, 'lr': 0.005934881404072962, 'batch_size': 64, 'dropout_rate': 0.12268401486253003, 'prior_mu': -0.012859454586253762, 'prior_sigma': 0.0800920171678691, 'normalization': 'layer'}. Best is trial 587 with value: 0.4552353322505951.
Generating morgan_rdkit fingerprints...
Generated fingerprints with 1280 features for 841 molecules
Trial 827: 5-fold CV loss = 0.4753
[I 2025-08-07 19:46:33,015] Trial 827 finished with value: 0.4752512276172638 and parameters: {'fp_type': 'morgan_rdkit', 'combined_morgan_radius': 3, 'combined_morgan_nBits': 1024, 'combined_rdkit_maxPath': 8, 'combined_rdkit_nBits': 1024, 'num_hidden_layers': 3, 'hidden_dim_0': 256, 'hidden_dim_1': 1024, 'hidden_dim_2': 64, 'kl_weight': 0.0002437712966810276, 'lr': 0.006074215900461548, 'batch_size': 64, 'dropout_rate': 0.149823864414731, 'prior_mu': -0.03385804007393866, 'prior_sigma': 0.09312838034222838, 'normalization': 'layer'}. Best is trial 587 with value: 0.4552353322505951.
Generating morgan_rdkit fingerprints...
Generated fingerprints with 2048 features for 841 molecules
Trial 828: 5-fold CV loss = 0.4579
[I 2025-08-07 19:46:38,278] Trial 828 finished with value: 0.4578962743282318 and parameters: {'fp_type': 'morgan_rdkit', 'combined_morgan_radius': 3, 'combined_morgan_nBits': 1024, 'combined_rdkit_maxPath': 7, 'combined_rdkit_nBits': 1024, 'num_hidden_layers': 3, 'hidden_dim_0': 256, 'hidden_dim_1': 1024, 'hidden_dim_2': 64, 'kl_weight': 0.00026066050112748837, 'lr': 0.0060756947599408155, 'batch_size': 128, 'dropout_rate': 0.14649721296147855, 'prior_mu': -0.03534625952260538, 'prior_sigma': 0.08062571235980173, 'normalization': 'layer'}. Best is trial 587 with value: 0.4552353322505951.
Generating morgan_rdkit fingerprints...
Generated fingerprints with 1280 features for 841 molecules
Trial 832: 5-fold CV loss = 0.5442
[I 2025-08-07 19:46:57,802] Trial 832 finished with value: 0.54420964717865 and parameters: {'fp_type': 'morgan_rdkit', 'combined_morgan_radius': 3, 'combined_morgan_nBits': 1024, 'combined_rdkit_maxPath': 7, 'combined_rdkit_nBits': 256, 'num_hidden_layers': 1, 'hidden_dim_0': 512, 'kl_weight': 0.00020388637907177152, 'lr': 0.007202998862656676, 'batch_size': 64, 'dropout_rate': 0.09639737054944536, 'prior_mu': -0.03474744437838285, 'prior_sigma': 0.07516154112593092, 'normalization': 'layer'}. Best is trial 587 with value: 0.4552353322505951.
Generating morgan_rdkit fingerprints...
Generated fingerprints with 2048 features for 841 molecules
Trial 830: 5-fold CV loss = 0.5177
[I 2025-08-07 19:47:20,631] Trial 830 finished with value: 0.5176547467708588 and parameters: {'fp_type': 'morgan_rdkit', 'combined_morgan_radius': 3, 'combined_morgan_nBits': 1024, 'combined_rdkit_maxPath': 7, 'combined_rdkit_nBits': 256, 'num_hidden_layers': 3, 'hidden_dim_0': 256, 'hidden_dim_1': 1024, 'hidden_dim_2': 64, 'kl_weight': 0.000284333018450178, 'lr': 0.008839802956311371, 'batch_size': 64, 'dropout_rate': 0.14474216823631406, 'prior_mu': -0.03292769867234602, 'prior_sigma': 0.09415878560374949, 'normalization': 'layer'}. Best is trial 587 with value: 0.4552353322505951.
Generating morgan_rdkit fingerprints...
Generated fingerprints with 2048 features for 841 molecules
Trial 831: 5-fold CV loss = 0.4737
[I 2025-08-07 19:47:25,001] Trial 831 finished with value: 0.47370787858963015 and parameters: {'fp_type': 'morgan_rdkit', 'combined_morgan_radius': 3, 'combined_morgan_nBits': 1024, 'combined_rdkit_maxPath': 7, 'combined_rdkit_nBits': 1024, 'num_hidden_layers': 3, 'hidden_dim_0': 256, 'hidden_dim_1': 1024, 'hidden_dim_2': 64, 'kl_weight': 0.00028414464120445613, 'lr': 0.008884867738066076, 'batch_size': 64, 'dropout_rate': 0.09948141406774617, 'prior_mu': -0.03536720764799019, 'prior_sigma': 0.09603647195419779, 'normalization': 'layer'}. Best is trial 587 with value: 0.4552353322505951.
Generating morgan_rdkit fingerprints...
Generated fingerprints with 2048 features for 841 molecules
Trial 833: 5-fold CV loss = 0.4634
[I 2025-08-07 19:47:44,418] Trial 833 finished with value: 0.46341882944107055 and parameters: {'fp_type': 'morgan_rdkit', 'combined_morgan_radius': 3, 'combined_morgan_nBits': 1024, 'combined_rdkit_maxPath': 7, 'combined_rdkit_nBits': 1024, 'num_hidden_layers': 3, 'hidden_dim_0': 256, 'hidden_dim_1': 1024, 'hidden_dim_2': 64, 'kl_weight': 0.00023667195635755802, 'lr': 0.008778572412839164, 'batch_size': 64, 'dropout_rate': 0.14315582841459482, 'prior_mu': -0.03943031447852841, 'prior_sigma': 0.08028562318535012, 'normalization': 'layer'}. Best is trial 587 with value: 0.4552353322505951.
Generating morgan_rdkit fingerprints...
Generated fingerprints with 2048 features for 841 molecules
Trial 829: 5-fold CV loss = 0.5117
[I 2025-08-07 19:48:05,155] Trial 829 finished with value: 0.511661046743393 and parameters: {'fp_type': 'morgan_rdkit', 'combined_morgan_radius': 3, 'combined_morgan_nBits': 1024, 'combined_rdkit_maxPath': 7, 'combined_rdkit_nBits': 256, 'num_hidden_layers': 3, 'hidden_dim_0': 256, 'hidden_dim_1': 1024, 'hidden_dim_2': 64, 'kl_weight': 0.0002878408494715243, 'lr': 0.0058819152702771025, 'batch_size': 64, 'dropout_rate': 0.14606468284275292, 'prior_mu': -0.032008776948575235, 'prior_sigma': 0.09446599597738803, 'normalization': 'layer'}. Best is trial 587 with value: 0.4552353322505951.
Generating morgan_rdkit fingerprints...
Generated fingerprints with 2048 features for 841 molecules
Trial 835: 5-fold CV loss = 0.4618
[I 2025-08-07 19:48:15,218] Trial 835 finished with value: 0.46178818941116334 and parameters: {'fp_type': 'morgan_rdkit', 'combined_morgan_radius': 3, 'combined_morgan_nBits': 1024, 'combined_rdkit_maxPath': 7, 'combined_rdkit_nBits': 1024, 'num_hidden_layers': 3, 'hidden_dim_0': 256, 'hidden_dim_1': 1024, 'hidden_dim_2': 64, 'kl_weight': 0.00023362369849428725, 'lr': 0.0073239224723159494, 'batch_size': 64, 'dropout_rate': 0.17426740479416433, 'prior_mu': -0.024793085594392805, 'prior_sigma': 0.0774986632800379, 'normalization': 'layer'}. Best is trial 587 with value: 0.4552353322505951.
Generating morgan_rdkit fingerprints...
Generated fingerprints with 2048 features for 841 molecules
Trial 836: 5-fold CV loss = 0.4617
[I 2025-08-07 19:48:20,458] Trial 836 finished with value: 0.4616633355617523 and parameters: {'fp_type': 'morgan_rdkit', 'combined_morgan_radius': 3, 'combined_morgan_nBits': 1024, 'combined_rdkit_maxPath': 7, 'combined_rdkit_nBits': 1024, 'num_hidden_layers': 3, 'hidden_dim_0': 256, 'hidden_dim_1': 1024, 'hidden_dim_2': 64, 'kl_weight': 0.0002094854281284158, 'lr': 0.0073860141300706094, 'batch_size': 64, 'dropout_rate': 0.1693609497436894, 'prior_mu': 0.1426284761991322, 'prior_sigma': 0.07018673918858262, 'normalization': 'layer'}. Best is trial 587 with value: 0.4552353322505951.
Generating morgan_rdkit fingerprints...
Generated fingerprints with 2048 features for 841 molecules
Trial 834: 5-fold CV loss = 0.4666
[I 2025-08-07 19:48:27,507] Trial 834 finished with value: 0.4665755331516266 and parameters: {'fp_type': 'morgan_rdkit', 'combined_morgan_radius': 3, 'combined_morgan_nBits': 1024, 'combined_rdkit_maxPath': 7, 'combined_rdkit_nBits': 1024, 'num_hidden_layers': 3, 'hidden_dim_0': 256, 'hidden_dim_1': 1024, 'hidden_dim_2': 64, 'kl_weight': 0.0002606088092209759, 'lr': 0.007321206792880389, 'batch_size': 64, 'dropout_rate': 0.1732263825922856, 'prior_mu': -0.032856652136612, 'prior_sigma': 0.08178589444599185, 'normalization': 'layer'}. Best is trial 587 with value: 0.4552353322505951.
Generating morgan_rdkit fingerprints...
Generated fingerprints with 2048 features for 841 molecules
Trial 839: 5-fold CV loss = 0.4679
[I 2025-08-07 19:48:55,334] Trial 839 finished with value: 0.46786662340164187 and parameters: {'fp_type': 'morgan_rdkit', 'combined_morgan_radius': 3, 'combined_morgan_nBits': 1024, 'combined_rdkit_maxPath': 6, 'combined_rdkit_nBits': 1024, 'num_hidden_layers': 3, 'hidden_dim_0': 256, 'hidden_dim_1': 1024, 'hidden_dim_2': 64, 'kl_weight': 0.00020313416111135318, 'lr': 0.006490702283162843, 'batch_size': 64, 'dropout_rate': 0.1682773216060381, 'prior_mu': -0.0029362233828329233, 'prior_sigma': 0.06602829478730929, 'normalization': 'layer'}. Best is trial 587 with value: 0.4552353322505951.
Generating morgan_rdkit fingerprints...
Generated fingerprints with 2048 features for 841 molecules
Trial 838: 5-fold CV loss = 0.4646
[I 2025-08-07 19:49:01,283] Trial 838 finished with value: 0.4646354019641876 and parameters: {'fp_type': 'morgan_rdkit', 'combined_morgan_radius': 3, 'combined_morgan_nBits': 1024, 'combined_rdkit_maxPath': 7, 'combined_rdkit_nBits': 1024, 'num_hidden_layers': 3, 'hidden_dim_0': 256, 'hidden_dim_1': 1024, 'hidden_dim_2': 64, 'kl_weight': 0.00024066840755303993, 'lr': 0.007203349391501377, 'batch_size': 64, 'dropout_rate': 0.17893445645900058, 'prior_mu': -0.02269371564386721, 'prior_sigma': 0.08655075050393392, 'normalization': 'layer'}. Best is trial 587 with value: 0.4552353322505951.
Generating morgan_rdkit fingerprints...
Generated fingerprints with 2048 features for 841 molecules
Trial 841: 5-fold CV loss = 0.4719
[I 2025-08-07 19:49:29,151] Trial 841 finished with value: 0.47188168168067934 and parameters: {'fp_type': 'morgan_rdkit', 'combined_morgan_radius': 3, 'combined_morgan_nBits': 1024, 'combined_rdkit_maxPath': 7, 'combined_rdkit_nBits': 1024, 'num_hidden_layers': 3, 'hidden_dim_0': 256, 'hidden_dim_1': 1024, 'hidden_dim_2': 64, 'kl_weight': 0.0002039805099231768, 'lr': 0.007027590143193746, 'batch_size': 64, 'dropout_rate': 0.18009441305960866, 'prior_mu': 0.17916322729923478, 'prior_sigma': 0.07397843159365408, 'normalization': 'layer'}. Best is trial 587 with value: 0.4552353322505951.
Generating morgan_rdkit fingerprints...
Generated fingerprints with 2048 features for 841 molecules
Trial 840: 5-fold CV loss = 0.4735
[I 2025-08-07 19:49:31,409] Trial 840 finished with value: 0.4735319197177887 and parameters: {'fp_type': 'morgan_rdkit', 'combined_morgan_radius': 3, 'combined_morgan_nBits': 1024, 'combined_rdkit_maxPath': 6, 'combined_rdkit_nBits': 1024, 'num_hidden_layers': 3, 'hidden_dim_0': 256, 'hidden_dim_1': 1024, 'hidden_dim_2': 64, 'kl_weight': 0.00023417814330627037, 'lr': 0.006315736413942773, 'batch_size': 64, 'dropout_rate': 0.49591323505665025, 'prior_mu': 0.14972907611037684, 'prior_sigma': 0.06661548189150758, 'normalization': 'layer'}. Best is trial 587 with value: 0.4552353322505951.
Generating morgan_rdkit fingerprints...
Generated fingerprints with 2048 features for 841 molecules
Trial 842: 5-fold CV loss = 0.5273
[I 2025-08-07 19:49:51,444] Trial 842 finished with value: 0.5272608816623687 and parameters: {'fp_type': 'morgan_rdkit', 'combined_morgan_radius': 3, 'combined_morgan_nBits': 1024, 'combined_rdkit_maxPath': 7, 'combined_rdkit_nBits': 1024, 'num_hidden_layers': 3, 'hidden_dim_0': 256, 'hidden_dim_1': 128, 'hidden_dim_2': 64, 'kl_weight': 0.000226437488257014, 'lr': 0.006572872759793683, 'batch_size': 64, 'dropout_rate': 0.1587953527004772, 'prior_mu': -0.0005429395217945955, 'prior_sigma': 0.06830812906901834, 'normalization': 'none'}. Best is trial 587 with value: 0.4552353322505951.
Generating morgan_rdkit fingerprints...
Generated fingerprints with 2048 features for 841 molecules
Trial 843: 5-fold CV loss = 0.5203
[I 2025-08-07 19:50:16,729] Trial 843 finished with value: 0.5203159570693969 and parameters: {'fp_type': 'morgan_rdkit', 'combined_morgan_radius': 3, 'combined_morgan_nBits': 1024, 'combined_rdkit_maxPath': 7, 'combined_rdkit_nBits': 1024, 'num_hidden_layers': 3, 'hidden_dim_0': 256, 'hidden_dim_1': 128, 'hidden_dim_2': 64, 'kl_weight': 0.00023407421008391548, 'lr': 0.006289486151442828, 'batch_size': 64, 'dropout_rate': 0.15925444383197107, 'prior_mu': -0.003616384702319682, 'prior_sigma': 0.07171633271460875, 'normalization': 'none'}. Best is trial 587 with value: 0.4552353322505951.
Generating morgan_rdkit fingerprints...
Generated fingerprints with 2048 features for 841 molecules
Trial 837: 5-fold CV loss = 0.4663
[I 2025-08-07 19:50:18,789] Trial 837 finished with value: 0.46631613969802854 and parameters: {'fp_type': 'morgan_rdkit', 'combined_morgan_radius': 3, 'combined_morgan_nBits': 1024, 'combined_rdkit_maxPath': 7, 'combined_rdkit_nBits': 1024, 'num_hidden_layers': 3, 'hidden_dim_0': 256, 'hidden_dim_1': 1024, 'hidden_dim_2': 64, 'kl_weight': 0.00024073537314640278, 'lr': 0.007270745768841973, 'batch_size': 64, 'dropout_rate': 0.17146577071602948, 'prior_mu': -0.024529683770413688, 'prior_sigma': 0.08216256901927184, 'normalization': 'layer'}. Best is trial 587 with value: 0.4552353322505951.
Generating rdkit fingerprints...
Generated fingerprints with 1024 features for 841 molecules
Trial 844: 5-fold CV loss = 0.5747
[I 2025-08-07 19:50:27,668] Trial 844 finished with value: 0.5746912002563477 and parameters: {'fp_type': 'morgan_rdkit', 'combined_morgan_radius': 3, 'combined_morgan_nBits': 1024, 'combined_rdkit_maxPath': 7, 'combined_rdkit_nBits': 1024, 'num_hidden_layers': 3, 'hidden_dim_0': 256, 'hidden_dim_1': 128, 'hidden_dim_2': 64, 'kl_weight': 0.00031051947118622544, 'lr': 0.005605759137396264, 'batch_size': 64, 'dropout_rate': 0.16888443667160546, 'prior_mu': -0.14840905115848863, 'prior_sigma': 0.08340121054631267, 'normalization': 'none'}. Best is trial 587 with value: 0.4552353322505951.
Generating rdkit fingerprints...
Generated fingerprints with 1024 features for 841 molecules
Trial 845: 5-fold CV loss = 0.8847
[I 2025-08-07 19:50:29,492] Trial 845 finished with value: 0.8846946716308594 and parameters: {'fp_type': 'morgan_rdkit', 'combined_morgan_radius': 3, 'combined_morgan_nBits': 1024, 'combined_rdkit_maxPath': 7, 'combined_rdkit_nBits': 1024, 'num_hidden_layers': 3, 'hidden_dim_0': 256, 'hidden_dim_1': 1024, 'hidden_dim_2': 1024, 'kl_weight': 0.0003124847997726346, 'lr': 0.005581048175233102, 'batch_size': 64, 'dropout_rate': 0.16085057672777503, 'prior_mu': -0.007294582150931265, 'prior_sigma': 0.1501003288998026, 'normalization': 'layer'}. Best is trial 587 with value: 0.4552353322505951.
Generating rdkit fingerprints...
Generated fingerprints with 1024 features for 841 molecules
Trial 846: 5-fold CV loss = 0.7238
[I 2025-08-07 19:51:00,778] Trial 846 finished with value: 0.7238453686237335 and parameters: {'fp_type': 'morgan_rdkit', 'combined_morgan_radius': 3, 'combined_morgan_nBits': 1024, 'combined_rdkit_maxPath': 7, 'combined_rdkit_nBits': 1024, 'num_hidden_layers': 3, 'hidden_dim_0': 256, 'hidden_dim_1': 1024, 'hidden_dim_2': 1024, 'kl_weight': 0.0001989548995891306, 'lr': 0.0056463703372365386, 'batch_size': 64, 'dropout_rate': 0.1640717743013963, 'prior_mu': -0.09890754282123979, 'prior_sigma': 0.1120298129287842, 'normalization': 'layer'}. Best is trial 587 with value: 0.4552353322505951.
Generating rdkit fingerprints...
Generated fingerprints with 1024 features for 841 molecules
Trial 849: 5-fold CV loss = 0.4743
[I 2025-08-07 19:51:36,322] Trial 849 finished with value: 0.47434160113334656 and parameters: {'fp_type': 'rdkit', 'rdkit_only_maxPath': 7, 'rdkit_only_nBits': 1024, 'num_hidden_layers': 3, 'hidden_dim_0': 256, 'hidden_dim_1': 1024, 'hidden_dim_2': 64, 'kl_weight': 0.0002727371154672799, 'lr': 0.004270325718210038, 'batch_size': 64, 'dropout_rate': 0.15908520449356206, 'prior_mu': -0.01846785529135495, 'prior_sigma': 0.08007997659740353, 'normalization': 'layer'}. Best is trial 587 with value: 0.4552353322505951.
Generating morgan_rdkit fingerprints...
Generated fingerprints with 2048 features for 841 molecules
Trial 850: 5-fold CV loss = 0.4764
[I 2025-08-07 19:51:50,484] Trial 850 finished with value: 0.4763527989387512 and parameters: {'fp_type': 'rdkit', 'rdkit_only_maxPath': 7, 'rdkit_only_nBits': 1024, 'num_hidden_layers': 3, 'hidden_dim_0': 256, 'hidden_dim_1': 1024, 'hidden_dim_2': 64, 'kl_weight': 0.0006554704054519344, 'lr': 0.007804354573993991, 'batch_size': 64, 'dropout_rate': 0.18055890114864603, 'prior_mu': -0.017625527021919777, 'prior_sigma': 0.07048485081787682, 'normalization': 'layer'}. Best is trial 587 with value: 0.4552353322505951.
Generating morgan_rdkit fingerprints...
Generated fingerprints with 2048 features for 841 molecules
Trial 848: 5-fold CV loss = 0.6489
[I 2025-08-07 19:52:03,301] Trial 848 finished with value: 0.6489049255847931 and parameters: {'fp_type': 'rdkit', 'rdkit_only_maxPath': 7, 'rdkit_only_nBits': 1024, 'num_hidden_layers': 3, 'hidden_dim_0': 256, 'hidden_dim_1': 1024, 'hidden_dim_2': 1024, 'kl_weight': 0.00019859314162534565, 'lr': 0.00786795699020849, 'batch_size': 64, 'dropout_rate': 0.15704268248687742, 'prior_mu': -0.01868196511053848, 'prior_sigma': 0.1137187063588359, 'normalization': 'layer'}. Best is trial 587 with value: 0.4552353322505951.
Generating morgan_rdkit fingerprints...
Generated fingerprints with 2048 features for 841 molecules
Trial 852: 5-fold CV loss = 1.0557
[I 2025-08-07 19:52:06,129] Trial 852 finished with value: 1.0556984424591065 and parameters: {'fp_type': 'morgan_rdkit', 'combined_morgan_radius': 3, 'combined_morgan_nBits': 1024, 'combined_rdkit_maxPath': 7, 'combined_rdkit_nBits': 1024, 'num_hidden_layers': 0, 'kl_weight': 0.0003412558364947929, 'lr': 0.00774732317474642, 'batch_size': 64, 'dropout_rate': 0.1507056482214035, 'prior_mu': -0.11553425577017684, 'prior_sigma': 0.07691253018057322, 'normalization': 'layer'}. Best is trial 587 with value: 0.4552353322505951.
Generating morgan_rdkit fingerprints...
Generated fingerprints with 2048 features for 841 molecules
Trial 851: 5-fold CV loss = 0.4620
[I 2025-08-07 19:52:25,320] Trial 851 finished with value: 0.4620405793190002 and parameters: {'fp_type': 'morgan_rdkit', 'combined_morgan_radius': 3, 'combined_morgan_nBits': 1024, 'combined_rdkit_maxPath': 7, 'combined_rdkit_nBits': 1024, 'num_hidden_layers': 3, 'hidden_dim_0': 256, 'hidden_dim_1': 1024, 'hidden_dim_2': 64, 'kl_weight': 0.0006149484688547057, 'lr': 0.007852191966296378, 'batch_size': 64, 'dropout_rate': 0.15515747984995124, 'prior_mu': -0.0166847689652199, 'prior_sigma': 0.07109223696803922, 'normalization': 'layer'}. Best is trial 587 with value: 0.4552353322505951.
Generating morgan_rdkit fingerprints...
Generated fingerprints with 2048 features for 841 molecules
Trial 854: 5-fold CV loss = 0.4752
[I 2025-08-07 19:52:33,659] Trial 854 finished with value: 0.4752239942550659 and parameters: {'fp_type': 'morgan_rdkit', 'combined_morgan_radius': 3, 'combined_morgan_nBits': 1024, 'combined_rdkit_maxPath': 5, 'combined_rdkit_nBits': 1024, 'num_hidden_layers': 3, 'hidden_dim_0': 256, 'hidden_dim_1': 1024, 'hidden_dim_2': 64, 'kl_weight': 0.00027983244640225857, 'lr': 0.006894815957974776, 'batch_size': 128, 'dropout_rate': 0.08307873598126553, 'prior_mu': 0.0079734274890404, 'prior_sigma': 0.08863337240818259, 'normalization': 'layer'}. Best is trial 587 with value: 0.4552353322505951.
Generating morgan_rdkit fingerprints...
Generated fingerprints with 2048 features for 841 molecules
Trial 855: 5-fold CV loss = 0.8814
[I 2025-08-07 19:52:38,310] Trial 855 finished with value: 0.8813507080078125 and parameters: {'fp_type': 'morgan_rdkit', 'combined_morgan_radius': 3, 'combined_morgan_nBits': 1024, 'combined_rdkit_maxPath': 7, 'combined_rdkit_nBits': 1024, 'num_hidden_layers': 3, 'hidden_dim_0': 512, 'hidden_dim_1': 1024, 'hidden_dim_2': 512, 'kl_weight': 0.0002765437473986293, 'lr': 0.0068740978889570425, 'batch_size': 128, 'dropout_rate': 0.07318158745896228, 'prior_mu': -0.04201319046216341, 'prior_sigma': 0.08825836754962829, 'normalization': 'layer'}. Best is trial 587 with value: 0.4552353322505951.
Generating morgan_rdkit fingerprints...
Generated fingerprints with 2048 features for 841 molecules
Trial 856: 5-fold CV loss = 0.8159
[I 2025-08-07 19:52:59,080] Trial 856 finished with value: 0.8158968925476074 and parameters: {'fp_type': 'morgan_rdkit', 'combined_morgan_radius': 3, 'combined_morgan_nBits': 1024, 'combined_rdkit_maxPath': 7, 'combined_rdkit_nBits': 1024, 'num_hidden_layers': 3, 'hidden_dim_0': 256, 'hidden_dim_1': 1024, 'hidden_dim_2': 512, 'kl_weight': 0.00032846666863191933, 'lr': 0.0065898876001446996, 'batch_size': 128, 'dropout_rate': 0.4145576257700508, 'prior_mu': -0.04126048832670984, 'prior_sigma': 0.1055429567226763, 'normalization': 'layer'}. Best is trial 587 with value: 0.4552353322505951.
Generating morgan_rdkit fingerprints...
Generated fingerprints with 1536 features for 841 molecules
Trial 853: 5-fold CV loss = 0.4565
