[I 2025-08-07 16:29:51,437] Trial 88 finished with value: 0.4771708548069 and parameters: {'fp_type': 'morgan_rdkit', 'combined_morgan_radius': 2, 'combined_morgan_nBits': 512, 'combined_rdkit_maxPath': 7, 'combined_rdkit_nBits': 1024, 'num_hidden_layers': 2, 'hidden_dim_0': 64, 'hidden_dim_1': 512, 'kl_weight': 0.00010179188875219269, 'lr': 0.0033197764792414746, 'batch_size': 32, 'dropout_rate': 0.2859765104175083, 'prior_mu': 0.0952728249315069, 'prior_sigma': 0.04668573847054102, 'normalization': 'layer'}. Best is trial 86 with value: 0.473599910736084.
Generating morgan_rdkit fingerprints...
Generated fingerprints with 1536 features for 841 molecules
Trial 93: 5-fold CV loss = 0.5202
[I 2025-08-07 16:29:56,886] Trial 93 finished with value: 0.5201873898506164 and parameters: {'fp_type': 'morgan', 'morgan_only_radius': 2, 'morgan_only_nBits': 1024, 'num_hidden_layers': 2, 'hidden_dim_0': 1024, 'hidden_dim_1': 512, 'kl_weight': 0.00014438751607633423, 'lr': 0.002511704552829814, 'batch_size': 32, 'dropout_rate': 0.09741693727026995, 'prior_mu': 0.06977331102928434, 'prior_sigma': 0.027797876240607783, 'normalization': 'layer'}. Best is trial 86 with value: 0.473599910736084.
Generating morgan_rdkit fingerprints...
Generated fingerprints with 1536 features for 841 molecules
Trial 97: 5-fold CV loss = 0.4766
[I 2025-08-07 16:30:38,023] Trial 97 finished with value: 0.4766231596469879 and parameters: {'fp_type': 'morgan_rdkit', 'combined_morgan_radius': 2, 'combined_morgan_nBits': 512, 'combined_rdkit_maxPath': 7, 'combined_rdkit_nBits': 1024, 'num_hidden_layers': 2, 'hidden_dim_0': 64, 'hidden_dim_1': 512, 'kl_weight': 0.00018148738953969372, 'lr': 0.003310575697770902, 'batch_size': 32, 'dropout_rate': 0.08338716208578037, 'prior_mu': 0.07343506150789772, 'prior_sigma': 0.02768636837043155, 'normalization': 'layer'}. Best is trial 86 with value: 0.473599910736084.
Generating morgan_rdkit fingerprints...
Generated fingerprints with 1536 features for 841 molecules
Trial 96: 5-fold CV loss = 0.4805
[I 2025-08-07 16:30:40,548] Trial 96 finished with value: 0.4804996490478516 and parameters: {'fp_type': 'morgan_rdkit', 'combined_morgan_radius': 2, 'combined_morgan_nBits': 512, 'combined_rdkit_maxPath': 7, 'combined_rdkit_nBits': 1024, 'num_hidden_layers': 2, 'hidden_dim_0': 64, 'hidden_dim_1': 512, 'kl_weight': 0.00017186220138300272, 'lr': 0.0030566835868201412, 'batch_size': 32, 'dropout_rate': 0.09423459773540724, 'prior_mu': 0.04841180612335568, 'prior_sigma': 0.019097041384413767, 'normalization': 'layer'}. Best is trial 86 with value: 0.473599910736084.
Generating morgan_rdkit fingerprints...
Generated fingerprints with 1536 features for 841 molecules
Trial 99: 5-fold CV loss = 0.4788
[I 2025-08-07 16:31:27,333] Trial 99 finished with value: 0.4788272142410278 and parameters: {'fp_type': 'morgan_rdkit', 'combined_morgan_radius': 2, 'combined_morgan_nBits': 512, 'combined_rdkit_maxPath': 7, 'combined_rdkit_nBits': 1024, 'num_hidden_layers': 2, 'hidden_dim_0': 256, 'hidden_dim_1': 512, 'kl_weight': 0.0001697020720588001, 'lr': 0.002947222892533636, 'batch_size': 32, 'dropout_rate': 0.04607079037078243, 'prior_mu': 0.05404694411101523, 'prior_sigma': 0.02110866048028156, 'normalization': 'layer'}. Best is trial 86 with value: 0.473599910736084.
Generating morgan_rdkit fingerprints...
Generated fingerprints with 1536 features for 841 molecules
Trial 101: 5-fold CV loss = 0.4815
[I 2025-08-07 16:31:29,938] Trial 101 finished with value: 0.48147265911102294 and parameters: {'fp_type': 'morgan_rdkit', 'combined_morgan_radius': 2, 'combined_morgan_nBits': 512, 'combined_rdkit_maxPath': 7, 'combined_rdkit_nBits': 1024, 'num_hidden_layers': 2, 'hidden_dim_0': 256, 'hidden_dim_1': 512, 'kl_weight': 0.0001885750993402405, 'lr': 0.0029007115299259146, 'batch_size': 32, 'dropout_rate': 0.04898315827805844, 'prior_mu': 0.04842178858289478, 'prior_sigma': 0.013742300390628546, 'normalization': 'layer'}. Best is trial 86 with value: 0.473599910736084.
Generating morgan_rdkit fingerprints...
Generated fingerprints with 1536 features for 841 molecules
Trial 100: 5-fold CV loss = 0.4784
[I 2025-08-07 16:31:36,141] Trial 100 finished with value: 0.478417295217514 and parameters: {'fp_type': 'morgan_rdkit', 'combined_morgan_radius': 2, 'combined_morgan_nBits': 512, 'combined_rdkit_maxPath': 7, 'combined_rdkit_nBits': 1024, 'num_hidden_layers': 2, 'hidden_dim_0': 256, 'hidden_dim_1': 512, 'kl_weight': 0.00012322692006222076, 'lr': 0.00275974215319516, 'batch_size': 32, 'dropout_rate': 0.07690506748392643, 'prior_mu': 0.04201674926192058, 'prior_sigma': 0.016474251621757946, 'normalization': 'layer'}. Best is trial 86 with value: 0.473599910736084.
Generating morgan_rdkit fingerprints...
Generated fingerprints with 1536 features for 841 molecules
Trial 98: 5-fold CV loss = 0.4862
[I 2025-08-07 16:31:48,318] Trial 98 finished with value: 0.48616147637367246 and parameters: {'fp_type': 'morgan_rdkit', 'combined_morgan_radius': 2, 'combined_morgan_nBits': 512, 'combined_rdkit_maxPath': 7, 'combined_rdkit_nBits': 1024, 'num_hidden_layers': 2, 'hidden_dim_0': 1024, 'hidden_dim_1': 512, 'kl_weight': 0.00018489856248950215, 'lr': 0.0031723634741889378, 'batch_size': 32, 'dropout_rate': 0.08709684744116591, 'prior_mu': 0.07212175877796256, 'prior_sigma': 0.018551209789738975, 'normalization': 'layer'}. Best is trial 86 with value: 0.473599910736084.
Generating morgan_rdkit fingerprints...
Generated fingerprints with 1536 features for 841 molecules
Trial 104: 5-fold CV loss = 0.4781
[I 2025-08-07 16:32:18,927] Trial 104 finished with value: 0.4781071126461029 and parameters: {'fp_type': 'morgan_rdkit', 'combined_morgan_radius': 2, 'combined_morgan_nBits': 512, 'combined_rdkit_maxPath': 7, 'combined_rdkit_nBits': 1024, 'num_hidden_layers': 2, 'hidden_dim_0': 256, 'hidden_dim_1': 512, 'kl_weight': 0.00024208830384564865, 'lr': 0.003235104448637841, 'batch_size': 32, 'dropout_rate': 0.03366381928200683, 'prior_mu': 0.026161077682686423, 'prior_sigma': 0.01744419967622443, 'normalization': 'layer'}. Best is trial 86 with value: 0.473599910736084.
Generating morgan_rdkit fingerprints...
Generated fingerprints with 1536 features for 841 molecules
Trial 103: 5-fold CV loss = 0.4845
[I 2025-08-07 16:32:27,403] Trial 103 finished with value: 0.4844705879688263 and parameters: {'fp_type': 'morgan_rdkit', 'combined_morgan_radius': 2, 'combined_morgan_nBits': 512, 'combined_rdkit_maxPath': 7, 'combined_rdkit_nBits': 1024, 'num_hidden_layers': 2, 'hidden_dim_0': 256, 'hidden_dim_1': 256, 'kl_weight': 0.00023820776682235588, 'lr': 0.0033558044627062613, 'batch_size': 32, 'dropout_rate': 0.07760151675390149, 'prior_mu': -0.005613643380120117, 'prior_sigma': 0.019384476059535964, 'normalization': 'layer'}. Best is trial 86 with value: 0.473599910736084.
Generating morgan_rdkit fingerprints...
Generated fingerprints with 1536 features for 841 molecules
Trial 102: 5-fold CV loss = 0.4867
[I 2025-08-07 16:32:38,004] Trial 102 finished with value: 0.4866707980632782 and parameters: {'fp_type': 'morgan_rdkit', 'combined_morgan_radius': 2, 'combined_morgan_nBits': 512, 'combined_rdkit_maxPath': 7, 'combined_rdkit_nBits': 1024, 'num_hidden_layers': 2, 'hidden_dim_0': 256, 'hidden_dim_1': 256, 'kl_weight': 0.0001803317521087426, 'lr': 0.0033836523895197737, 'batch_size': 32, 'dropout_rate': 0.04123376104408275, 'prior_mu': 0.04861511407238068, 'prior_sigma': 0.018100078728724697, 'normalization': 'layer'}. Best is trial 86 with value: 0.473599910736084.
Generating morgan_rdkit fingerprints...
Generated fingerprints with 1536 features for 841 molecules
Trial 106: 5-fold CV loss = 0.4795
[I 2025-08-07 16:33:04,729] Trial 106 finished with value: 0.4795033812522888 and parameters: {'fp_type': 'morgan_rdkit', 'combined_morgan_radius': 2, 'combined_morgan_nBits': 512, 'combined_rdkit_maxPath': 7, 'combined_rdkit_nBits': 1024, 'num_hidden_layers': 2, 'hidden_dim_0': 256, 'hidden_dim_1': 512, 'kl_weight': 0.00025234924316233664, 'lr': 0.003334580366122783, 'batch_size': 32, 'dropout_rate': 0.036850364202466714, 'prior_mu': 0.024412137147021486, 'prior_sigma': 0.018646611741331455, 'normalization': 'layer'}. Best is trial 86 with value: 0.473599910736084.
Generating morgan_rdkit fingerprints...
Generated fingerprints with 1536 features for 841 molecules
Trial 107: 5-fold CV loss = 0.4867
[I 2025-08-07 16:33:27,081] Trial 107 finished with value: 0.48669671416282656 and parameters: {'fp_type': 'morgan_rdkit', 'combined_morgan_radius': 2, 'combined_morgan_nBits': 512, 'combined_rdkit_maxPath': 7, 'combined_rdkit_nBits': 1024, 'num_hidden_layers': 2, 'hidden_dim_0': 256, 'hidden_dim_1': 512, 'kl_weight': 0.00012739717217546587, 'lr': 0.004043309036215006, 'batch_size': 32, 'dropout_rate': 0.033489534407290966, 'prior_mu': 0.024065341969329603, 'prior_sigma': 0.03144861169141984, 'normalization': 'layer'}. Best is trial 86 with value: 0.473599910736084.
Generating morgan_rdkit fingerprints...
Generated fingerprints with 1536 features for 841 molecules
Trial 105: 5-fold CV loss = 0.4847
[I 2025-08-07 16:33:39,909] Trial 105 finished with value: 0.48472523093223574 and parameters: {'fp_type': 'morgan_rdkit', 'combined_morgan_radius': 2, 'combined_morgan_nBits': 512, 'combined_rdkit_maxPath': 7, 'combined_rdkit_nBits': 1024, 'num_hidden_layers': 2, 'hidden_dim_0': 256, 'hidden_dim_1': 512, 'kl_weight': 0.00023293010408012, 'lr': 0.0036347353154847425, 'batch_size': 32, 'dropout_rate': 0.01766512634686404, 'prior_mu': 0.022041001910209662, 'prior_sigma': 0.019062762271000216, 'normalization': 'layer'}. Best is trial 86 with value: 0.473599910736084.
Generating morgan_rdkit fingerprints...
Generated fingerprints with 1536 features for 841 molecules
Trial 108: 5-fold CV loss = 0.4847
[I 2025-08-07 16:33:46,058] Trial 108 finished with value: 0.48470481038093566 and parameters: {'fp_type': 'morgan_rdkit', 'combined_morgan_radius': 2, 'combined_morgan_nBits': 512, 'combined_rdkit_maxPath': 7, 'combined_rdkit_nBits': 1024, 'num_hidden_layers': 2, 'hidden_dim_0': 256, 'hidden_dim_1': 512, 'kl_weight': 0.00012589662004437851, 'lr': 0.003877684262922876, 'batch_size': 32, 'dropout_rate': 0.027090777059120035, 'prior_mu': 0.02258537870607534, 'prior_sigma': 0.01024041712282809, 'normalization': 'layer'}. Best is trial 86 with value: 0.473599910736084.
Generating morgan_rdkit fingerprints...
Generated fingerprints with 1024 features for 841 molecules
Trial 109: 5-fold CV loss = 0.5284
[I 2025-08-07 16:33:59,006] Trial 109 finished with value: 0.5284046351909637 and parameters: {'fp_type': 'morgan_rdkit', 'combined_morgan_radius': 2, 'combined_morgan_nBits': 512, 'combined_rdkit_maxPath': 7, 'combined_rdkit_nBits': 1024, 'num_hidden_layers': 2, 'hidden_dim_0': 256, 'hidden_dim_1': 512, 'kl_weight': 0.031982866715586714, 'lr': 0.004158376048914078, 'batch_size': 32, 'dropout_rate': 0.040044963758117606, 'prior_mu': 0.018888629063176954, 'prior_sigma': 0.03244020605753431, 'normalization': 'layer'}. Best is trial 86 with value: 0.473599910736084.
Generating morgan_rdkit fingerprints...
Generated fingerprints with 1024 features for 841 molecules
Trial 110: 5-fold CV loss = 0.4830
[I 2025-08-07 16:34:23,624] Trial 110 finished with value: 0.48299720883369446 and parameters: {'fp_type': 'morgan_rdkit', 'combined_morgan_radius': 2, 'combined_morgan_nBits': 512, 'combined_rdkit_maxPath': 7, 'combined_rdkit_nBits': 1024, 'num_hidden_layers': 2, 'hidden_dim_0': 256, 'hidden_dim_1': 512, 'kl_weight': 0.00023994223784615468, 'lr': 0.004570210042176133, 'batch_size': 32, 'dropout_rate': 0.018423678391689628, 'prior_mu': 0.004409407598289172, 'prior_sigma': 0.02610202247401478, 'normalization': 'layer'}. Best is trial 86 with value: 0.473599910736084.
Generating morgan_rdkit fingerprints...
Generated fingerprints with 1536 features for 841 molecules
Trial 113: 5-fold CV loss = 0.5216
[I 2025-08-07 16:34:49,493] Trial 113 finished with value: 0.5215537309646606 and parameters: {'fp_type': 'morgan_rdkit', 'combined_morgan_radius': 2, 'combined_morgan_nBits': 512, 'combined_rdkit_maxPath': 7, 'combined_rdkit_nBits': 512, 'num_hidden_layers': 2, 'hidden_dim_0': 256, 'hidden_dim_1': 1024, 'kl_weight': 0.00027940021071256747, 'lr': 0.005743730280748571, 'batch_size': 32, 'dropout_rate': 0.07264464889325291, 'prior_mu': 0.036204353462798586, 'prior_sigma': 0.025777337964452342, 'normalization': 'layer'}. Best is trial 86 with value: 0.473599910736084.
Generating morgan_rdkit fingerprints...
Generated fingerprints with 1536 features for 841 molecules
Trial 112: 5-fold CV loss = 0.5492
[I 2025-08-07 16:35:05,674] Trial 112 finished with value: 0.5492423117160797 and parameters: {'fp_type': 'morgan_rdkit', 'combined_morgan_radius': 2, 'combined_morgan_nBits': 512, 'combined_rdkit_maxPath': 7, 'combined_rdkit_nBits': 512, 'num_hidden_layers': 2, 'hidden_dim_0': 256, 'hidden_dim_1': 1024, 'kl_weight': 0.005202268323518444, 'lr': 0.005696366446448707, 'batch_size': 32, 'dropout_rate': 0.010433235868173275, 'prior_mu': 0.00839712901107657, 'prior_sigma': 0.025605297288861545, 'normalization': 'layer'}. Best is trial 86 with value: 0.473599910736084.
Generating morgan_rdkit fingerprints...
Generated fingerprints with 1536 features for 841 molecules
Trial 114: 5-fold CV loss = 0.4884
[I 2025-08-07 16:35:41,416] Trial 114 finished with value: 0.4883801519870758 and parameters: {'fp_type': 'morgan_rdkit', 'combined_morgan_radius': 2, 'combined_morgan_nBits': 512, 'combined_rdkit_maxPath': 7, 'combined_rdkit_nBits': 1024, 'num_hidden_layers': 2, 'hidden_dim_0': 256, 'hidden_dim_1': 1024, 'kl_weight': 0.0045411507987777565, 'lr': 0.0027711609658530876, 'batch_size': 32, 'dropout_rate': 0.07544418141203627, 'prior_mu': 0.034168252346111455, 'prior_sigma': 0.0366856039696367, 'normalization': 'layer'}. Best is trial 86 with value: 0.473599910736084.
Generating morgan_rdkit fingerprints...
Generated fingerprints with 1536 features for 841 molecules
Trial 115: 5-fold CV loss = 0.4888
[I 2025-08-07 16:35:52,939] Trial 115 finished with value: 0.4887514114379883 and parameters: {'fp_type': 'morgan_rdkit', 'combined_morgan_radius': 2, 'combined_morgan_nBits': 512, 'combined_rdkit_maxPath': 7, 'combined_rdkit_nBits': 1024, 'num_hidden_layers': 2, 'hidden_dim_0': 256, 'hidden_dim_1': 512, 'kl_weight': 0.005949441310707142, 'lr': 0.0027980461954879242, 'batch_size': 32, 'dropout_rate': 0.002107260190438026, 'prior_mu': 0.01086705629092595, 'prior_sigma': 0.03775885122895574, 'normalization': 'layer'}. Best is trial 86 with value: 0.473599910736084.
Generating morgan_rdkit fingerprints...
Generated fingerprints with 1536 features for 841 molecules
Trial 111: 5-fold CV loss = 0.5462
[I 2025-08-07 16:36:23,803] Trial 111 finished with value: 0.5462031066417694 and parameters: {'fp_type': 'morgan_rdkit', 'combined_morgan_radius': 2, 'combined_morgan_nBits': 512, 'combined_rdkit_maxPath': 7, 'combined_rdkit_nBits': 1024, 'num_hidden_layers': 2, 'hidden_dim_0': 256, 'hidden_dim_1': 1024, 'kl_weight': 0.023544842519550347, 'lr': 0.0043407593219360234, 'batch_size': 32, 'dropout_rate': 0.002649792679758192, 'prior_mu': 0.009256284565754183, 'prior_sigma': 0.02548313056741522, 'normalization': 'layer'}. Best is trial 86 with value: 0.473599910736084.
Generating morgan_rdkit fingerprints...
Generated fingerprints with 1536 features for 841 molecules
Trial 118: 5-fold CV loss = 0.5151
[I 2025-08-07 16:36:34,345] Trial 118 finished with value: 0.515111768245697 and parameters: {'fp_type': 'morgan_rdkit', 'combined_morgan_radius': 2, 'combined_morgan_nBits': 512, 'combined_rdkit_maxPath': 7, 'combined_rdkit_nBits': 1024, 'num_hidden_layers': 2, 'hidden_dim_0': 256, 'hidden_dim_1': 512, 'kl_weight': 0.001678361422178386, 'lr': 0.003497688924352957, 'batch_size': 32, 'dropout_rate': 0.10589533320457507, 'prior_mu': 0.07944850197882262, 'prior_sigma': 0.01528437529242926, 'normalization': 'layer'}. Best is trial 86 with value: 0.473599910736084.
Generating morgan_rdkit fingerprints...
Generated fingerprints with 1536 features for 841 molecules
Trial 117: 5-fold CV loss = 0.4771
[I 2025-08-07 16:36:36,487] Trial 117 finished with value: 0.4770863175392151 and parameters: {'fp_type': 'morgan_rdkit', 'combined_morgan_radius': 2, 'combined_morgan_nBits': 512, 'combined_rdkit_maxPath': 7, 'combined_rdkit_nBits': 1024, 'num_hidden_layers': 2, 'hidden_dim_0': 256, 'hidden_dim_1': 512, 'kl_weight': 0.00015762310556467605, 'lr': 0.003471606352108901, 'batch_size': 32, 'dropout_rate': 0.10468888481532039, 'prior_mu': 0.05629075471285562, 'prior_sigma': 0.01331922607071122, 'normalization': 'layer'}. Best is trial 86 with value: 0.473599910736084.
Generating morgan_rdkit fingerprints...
Generated fingerprints with 1536 features for 841 molecules
Trial 116: 5-fold CV loss = 0.4716
[I 2025-08-07 16:36:42,010] Trial 116 finished with value: 0.47160428762435913 and parameters: {'fp_type': 'morgan_rdkit', 'combined_morgan_radius': 2, 'combined_morgan_nBits': 512, 'combined_rdkit_maxPath': 7, 'combined_rdkit_nBits': 1024, 'num_hidden_layers': 2, 'hidden_dim_0': 256, 'hidden_dim_1': 512, 'kl_weight': 0.0001434360098264803, 'lr': 0.002702580114121984, 'batch_size': 32, 'dropout_rate': 0.08291718174138446, 'prior_mu': 0.0797565471072319, 'prior_sigma': 0.03722065150641289, 'normalization': 'layer'}. Best is trial 116 with value: 0.47160428762435913.
Generating morgan_rdkit fingerprints...
Generated fingerprints with 1536 features for 841 molecules
Trial 121: 5-fold CV loss = 0.4796
[I 2025-08-07 16:37:30,146] Trial 121 finished with value: 0.4796453893184662 and parameters: {'fp_type': 'morgan_rdkit', 'combined_morgan_radius': 2, 'combined_morgan_nBits': 512, 'combined_rdkit_maxPath': 7, 'combined_rdkit_nBits': 1024, 'num_hidden_layers': 2, 'hidden_dim_0': 256, 'hidden_dim_1': 512, 'kl_weight': 0.00014968382979779044, 'lr': 0.0033352732444848015, 'batch_size': 32, 'dropout_rate': 0.08190814754069842, 'prior_mu': -0.020685215367276577, 'prior_sigma': 0.013606401782726488, 'normalization': 'layer'}. Best is trial 116 with value: 0.47160428762435913.
Generating morgan_rdkit fingerprints...
Generated fingerprints with 1536 features for 841 molecules
Trial 120: 5-fold CV loss = 0.5121
[I 2025-08-07 16:37:42,610] Trial 120 finished with value: 0.5121497511863708 and parameters: {'fp_type': 'morgan_rdkit', 'combined_morgan_radius': 2, 'combined_morgan_nBits': 512, 'combined_rdkit_maxPath': 7, 'combined_rdkit_nBits': 1024, 'num_hidden_layers': 2, 'hidden_dim_0': 256, 'hidden_dim_1': 512, 'kl_weight': 0.00908431084949677, 'lr': 0.000363655688539733, 'batch_size': 32, 'dropout_rate': 0.05461633327488391, 'prior_mu': 0.06311401659682392, 'prior_sigma': 0.030471532077850774, 'normalization': 'layer'}. Best is trial 116 with value: 0.47160428762435913.
Generating morgan_rdkit fingerprints...
Generated fingerprints with 1536 features for 841 molecules
Trial 122: 5-fold CV loss = 0.4867
[I 2025-08-07 16:37:49,078] Trial 122 finished with value: 0.4867361307144165 and parameters: {'fp_type': 'morgan_rdkit', 'combined_morgan_radius': 2, 'combined_morgan_nBits': 512, 'combined_rdkit_maxPath': 7, 'combined_rdkit_nBits': 1024, 'num_hidden_layers': 2, 'hidden_dim_0': 256, 'hidden_dim_1': 512, 'kl_weight': 0.0001492557185787393, 'lr': 0.003686484069072295, 'batch_size': 32, 'dropout_rate': 0.12217928453894566, 'prior_mu': 0.05658584871386181, 'prior_sigma': 0.011161634061302113, 'normalization': 'layer'}. Best is trial 116 with value: 0.47160428762435913.
Generating morgan_rdkit fingerprints...
Generated fingerprints with 1536 features for 841 molecules
Trial 123: 5-fold CV loss = 1.0472
[I 2025-08-07 16:38:06,234] Trial 123 finished with value: 1.0472262024879455 and parameters: {'fp_type': 'morgan_rdkit', 'combined_morgan_radius': 2, 'combined_morgan_nBits': 512, 'combined_rdkit_maxPath': 7, 'combined_rdkit_nBits': 1024, 'num_hidden_layers': 2, 'hidden_dim_0': 256, 'hidden_dim_1': 512, 'kl_weight': 0.00012055856046887589, 'lr': 0.0003319196080100126, 'batch_size': 32, 'dropout_rate': 0.06555043024795004, 'prior_mu': 0.06151570675414931, 'prior_sigma': 0.16231103457813414, 'normalization': 'layer'}. Best is trial 116 with value: 0.47160428762435913.
Generating morgan_rdkit fingerprints...
Generated fingerprints with 1536 features for 841 molecules
Trial 124: 5-fold CV loss = 0.4850
[I 2025-08-07 16:38:26,818] Trial 124 finished with value: 0.48501583337783816 and parameters: {'fp_type': 'morgan_rdkit', 'combined_morgan_radius': 2, 'combined_morgan_nBits': 512, 'combined_rdkit_maxPath': 7, 'combined_rdkit_nBits': 1024, 'num_hidden_layers': 2, 'hidden_dim_0': 256, 'hidden_dim_1': 512, 'kl_weight': 0.00012126758079418768, 'lr': 0.003767217412239147, 'batch_size': 32, 'dropout_rate': 0.06887693646650019, 'prior_mu': 0.05223107679577929, 'prior_sigma': 0.021516985733835384, 'normalization': 'layer'}. Best is trial 116 with value: 0.47160428762435913.
Generating morgan_rdkit fingerprints...
Generated fingerprints with 1536 features for 841 molecules
Trial 126: 5-fold CV loss = 0.4881
[I 2025-08-07 16:39:07,623] Trial 126 finished with value: 0.48807533979415896 and parameters: {'fp_type': 'morgan_rdkit', 'combined_morgan_radius': 2, 'combined_morgan_nBits': 512, 'combined_rdkit_maxPath': 7, 'combined_rdkit_nBits': 1024, 'num_hidden_layers': 2, 'hidden_dim_0': 256, 'hidden_dim_1': 512, 'kl_weight': 0.00020139835748452512, 'lr': 0.004741877540394371, 'batch_size': 32, 'dropout_rate': 0.09816223289808214, 'prior_mu': 0.08126539118130148, 'prior_sigma': 0.021886951608056787, 'normalization': 'layer'}. Best is trial 116 with value: 0.47160428762435913.
Generating morgan_rdkit fingerprints...
Generated fingerprints with 2048 features for 841 molecules
Trial 127: 5-fold CV loss = 0.4942
