[I 2025-08-07 16:11:12,850] Trial 26 finished with value: 0.5069023847579956 and parameters: {'fp_type': 'morgan_rdkit', 'combined_morgan_radius': 2, 'combined_morgan_nBits': 512, 'combined_rdkit_maxPath': 5, 'combined_rdkit_nBits': 256, 'num_hidden_layers': 2, 'hidden_dim_0': 64, 'hidden_dim_1': 512, 'kl_weight': 0.00033146150266180114, 'lr': 0.005934319185636593, 'batch_size': 32, 'dropout_rate': 0.4019426812030875, 'prior_mu': 0.08212799474717065, 'prior_sigma': 0.07954038426319307, 'normalization': 'layer'}. Best is trial 6 with value: 0.47947537899017334.
Generating morgan_rdkit fingerprints...
Generated fingerprints with 1536 features for 841 molecules
Trial 32: 5-fold CV loss = 0.5326
[I 2025-08-07 16:11:34,326] Trial 32 finished with value: 0.5326273560523986 and parameters: {'fp_type': 'morgan', 'morgan_only_radius': 3, 'morgan_only_nBits': 2048, 'num_hidden_layers': 3, 'hidden_dim_0': 128, 'hidden_dim_1': 256, 'hidden_dim_2': 1024, 'kl_weight': 0.00010260101986258139, 'lr': 0.005978873672625301, 'batch_size': 32, 'dropout_rate': 0.2567972788052262, 'prior_mu': 0.08394827530505669, 'prior_sigma': 0.11615829510604384, 'normalization': 'layer'}. Best is trial 6 with value: 0.47947537899017334.
Generating morgan_rdkit fingerprints...
Generated fingerprints with 1536 features for 841 molecules
Trial 33: 5-fold CV loss = 0.5157
[I 2025-08-07 16:12:13,458] Trial 33 finished with value: 0.5157190024852752 and parameters: {'fp_type': 'morgan', 'morgan_only_radius': 3, 'morgan_only_nBits': 2048, 'num_hidden_layers': 3, 'hidden_dim_0': 128, 'hidden_dim_1': 256, 'hidden_dim_2': 512, 'kl_weight': 0.0007689858794021473, 'lr': 0.005071017223760115, 'batch_size': 32, 'dropout_rate': 0.2790927290827547, 'prior_mu': 0.004993995978544996, 'prior_sigma': 0.04716947884273179, 'normalization': 'layer'}. Best is trial 6 with value: 0.47947537899017334.
Generating morgan_rdkit fingerprints...
Generated fingerprints with 1536 features for 841 molecules
Trial 34: 5-fold CV loss = 0.5001
[I 2025-08-07 16:12:22,303] Trial 34 finished with value: 0.5001263201236725 and parameters: {'fp_type': 'morgan_rdkit', 'combined_morgan_radius': 2, 'combined_morgan_nBits': 512, 'combined_rdkit_maxPath': 5, 'combined_rdkit_nBits': 1024, 'num_hidden_layers': 2, 'hidden_dim_0': 64, 'hidden_dim_1': 512, 'kl_weight': 0.00037761236111471364, 'lr': 0.006532889243103226, 'batch_size': 32, 'dropout_rate': 0.37523842637165317, 'prior_mu': 0.08553739079158999, 'prior_sigma': 0.11473666402629028, 'normalization': 'layer'}. Best is trial 6 with value: 0.47947537899017334.
Generating morgan_rdkit fingerprints...
Generated fingerprints with 1536 features for 841 molecules
Trial 36: 5-fold CV loss = 0.4903
[I 2025-08-07 16:12:34,003] Trial 36 finished with value: 0.4902896165847778 and parameters: {'fp_type': 'morgan_rdkit', 'combined_morgan_radius': 2, 'combined_morgan_nBits': 512, 'combined_rdkit_maxPath': 5, 'combined_rdkit_nBits': 1024, 'num_hidden_layers': 2, 'hidden_dim_0': 64, 'hidden_dim_1': 512, 'kl_weight': 0.000423260566850452, 'lr': 0.002894163921728807, 'batch_size': 32, 'dropout_rate': 0.3725678990863217, 'prior_mu': 0.16117677984584503, 'prior_sigma': 0.050932606791877943, 'normalization': 'layer'}. Best is trial 6 with value: 0.47947537899017334.
Generating morgan_rdkit fingerprints...
Generated fingerprints with 1536 features for 841 molecules
Trial 39: 5-fold CV loss = 1.7260
[I 2025-08-07 16:12:44,747] Trial 39 finished with value: 1.7259920358657836 and parameters: {'fp_type': 'morgan_rdkit', 'combined_morgan_radius': 2, 'combined_morgan_nBits': 512, 'combined_rdkit_maxPath': 7, 'combined_rdkit_nBits': 1024, 'num_hidden_layers': 0, 'kl_weight': 0.0023628831290038016, 'lr': 0.002549970763838056, 'batch_size': 64, 'dropout_rate': 0.3617421998656442, 'prior_mu': 0.16458361152750645, 'prior_sigma': 0.14002770444142434, 'normalization': 'none'}. Best is trial 6 with value: 0.47947537899017334.
Generating morgan_rdkit fingerprints...
Generated fingerprints with 1536 features for 841 molecules
Trial 40: 5-fold CV loss = 0.5334
[I 2025-08-07 16:12:58,596] Trial 40 finished with value: 0.533400970697403 and parameters: {'fp_type': 'morgan_rdkit', 'combined_morgan_radius': 2, 'combined_morgan_nBits': 512, 'combined_rdkit_maxPath': 5, 'combined_rdkit_nBits': 1024, 'num_hidden_layers': 1, 'hidden_dim_0': 512, 'kl_weight': 0.0023565834345964957, 'lr': 0.007389356580274455, 'batch_size': 128, 'dropout_rate': 0.4562393316774901, 'prior_mu': 0.12953971129647104, 'prior_sigma': 0.04527916963975113, 'normalization': 'layer'}. Best is trial 6 with value: 0.47947537899017334.
Generating morgan_rdkit fingerprints...
Generated fingerprints with 1536 features for 841 molecules
Trial 35: 5-fold CV loss = 0.4894
[I 2025-08-07 16:13:34,993] Trial 35 finished with value: 0.4893608927726746 and parameters: {'fp_type': 'morgan_rdkit', 'combined_morgan_radius': 2, 'combined_morgan_nBits': 512, 'combined_rdkit_maxPath': 5, 'combined_rdkit_nBits': 1024, 'num_hidden_layers': 2, 'hidden_dim_0': 64, 'hidden_dim_1': 512, 'kl_weight': 0.00010130884834535807, 'lr': 0.007063442947341629, 'batch_size': 32, 'dropout_rate': 0.27042329823036715, 'prior_mu': 0.09641165926525556, 'prior_sigma': 0.04565129087100726, 'normalization': 'layer'}. Best is trial 6 with value: 0.47947537899017334.
Generating morgan_rdkit fingerprints...
Generated fingerprints with 2048 features for 841 molecules
Trial 41: 5-fold CV loss = 0.5299
[I 2025-08-07 16:13:49,389] Trial 41 finished with value: 0.5298876821994781 and parameters: {'fp_type': 'morgan_rdkit', 'combined_morgan_radius': 2, 'combined_morgan_nBits': 512, 'combined_rdkit_maxPath': 5, 'combined_rdkit_nBits': 1024, 'num_hidden_layers': 2, 'hidden_dim_0': 256, 'hidden_dim_1': 512, 'kl_weight': 0.00016186937920645465, 'lr': 0.00311956853662934, 'batch_size': 32, 'dropout_rate': 0.29912832587610677, 'prior_mu': 0.14074107440721165, 'prior_sigma': 0.06558308900902961, 'normalization': 'none'}. Best is trial 6 with value: 0.47947537899017334.
Generating rdkit fingerprints...
Generated fingerprints with 512 features for 841 molecules
Trial 37: 5-fold CV loss = 0.5251
[I 2025-08-07 16:14:12,280] Trial 37 finished with value: 0.5251342117786407 and parameters: {'fp_type': 'morgan_rdkit', 'combined_morgan_radius': 2, 'combined_morgan_nBits': 512, 'combined_rdkit_maxPath': 5, 'combined_rdkit_nBits': 1024, 'num_hidden_layers': 2, 'hidden_dim_0': 64, 'hidden_dim_1': 512, 'kl_weight': 0.00241276482509184, 'lr': 0.0027734680261383166, 'batch_size': 32, 'dropout_rate': 0.368760583516505, 'prior_mu': 0.16512513882426783, 'prior_sigma': 0.11440349090441515, 'normalization': 'layer'}. Best is trial 6 with value: 0.47947537899017334.
Generating morgan_rdkit fingerprints...
Generated fingerprints with 1536 features for 841 molecules
Trial 38: 5-fold CV loss = 0.4957
[I 2025-08-07 16:14:16,539] Trial 38 finished with value: 0.49573081731796265 and parameters: {'fp_type': 'morgan_rdkit', 'combined_morgan_radius': 2, 'combined_morgan_nBits': 512, 'combined_rdkit_maxPath': 5, 'combined_rdkit_nBits': 1024, 'num_hidden_layers': 2, 'hidden_dim_0': 512, 'hidden_dim_1': 512, 'kl_weight': 0.002138986252711194, 'lr': 0.002579692803287179, 'batch_size': 32, 'dropout_rate': 0.366067570585215, 'prior_mu': 0.13917475973114102, 'prior_sigma': 0.14304169272854744, 'normalization': 'layer'}. Best is trial 6 with value: 0.47947537899017334.
Generating morgan_rdkit fingerprints...
Generated fingerprints with 1536 features for 841 molecules
Trial 43: 5-fold CV loss = 0.5456
[I 2025-08-07 16:14:20,970] Trial 43 finished with value: 0.5455634117126464 and parameters: {'fp_type': 'rdkit', 'rdkit_only_maxPath': 7, 'rdkit_only_nBits': 512, 'num_hidden_layers': 1, 'hidden_dim_0': 512, 'kl_weight': 0.00015991892531095763, 'lr': 0.007371427580102945, 'batch_size': 128, 'dropout_rate': 0.2338365378690565, 'prior_mu': -0.06626999320235911, 'prior_sigma': 0.02431778624210732, 'normalization': 'layer'}. Best is trial 6 with value: 0.47947537899017334.
Generating morgan_rdkit fingerprints...
Generated fingerprints with 1536 features for 841 molecules
Trial 42: 5-fold CV loss = 0.4969
[I 2025-08-07 16:14:33,262] Trial 42 finished with value: 0.4968961954116821 and parameters: {'fp_type': 'morgan_rdkit', 'combined_morgan_radius': 3, 'combined_morgan_nBits': 1024, 'combined_rdkit_maxPath': 7, 'combined_rdkit_nBits': 1024, 'num_hidden_layers': 1, 'hidden_dim_0': 256, 'kl_weight': 0.00017443148614091416, 'lr': 0.003125548499575683, 'batch_size': 64, 'dropout_rate': 0.24262039862609708, 'prior_mu': -0.05666472480430749, 'prior_sigma': 0.024526294054225028, 'normalization': 'none'}. Best is trial 6 with value: 0.47947537899017334.
Generating morgan_rdkit fingerprints...
Generated fingerprints with 1536 features for 841 molecules
Trial 46: 5-fold CV loss = 0.5147
[I 2025-08-07 16:14:50,833] Trial 46 finished with value: 0.5147304892539978 and parameters: {'fp_type': 'morgan_rdkit', 'combined_morgan_radius': 2, 'combined_morgan_nBits': 512, 'combined_rdkit_maxPath': 5, 'combined_rdkit_nBits': 1024, 'num_hidden_layers': 1, 'hidden_dim_0': 64, 'kl_weight': 0.0001757086893685711, 'lr': 0.0038743172323177115, 'batch_size': 32, 'dropout_rate': 0.16095983547521048, 'prior_mu': 0.1770668635071819, 'prior_sigma': 0.053727919730390705, 'normalization': 'layer'}. Best is trial 6 with value: 0.47947537899017334.
Generating morgan_rdkit fingerprints...
Generated fingerprints with 1536 features for 841 molecules
Trial 45: 5-fold CV loss = 0.5240
[I 2025-08-07 16:14:54,661] Trial 45 finished with value: 0.5239665448665619 and parameters: {'fp_type': 'morgan_rdkit', 'combined_morgan_radius': 2, 'combined_morgan_nBits': 512, 'combined_rdkit_maxPath': 5, 'combined_rdkit_nBits': 1024, 'num_hidden_layers': 1, 'hidden_dim_0': 64, 'kl_weight': 0.0001667239189438533, 'lr': 0.007543168816442803, 'batch_size': 32, 'dropout_rate': 0.23886376559804495, 'prior_mu': 0.17449277515302897, 'prior_sigma': 0.032172824008115976, 'normalization': 'layer'}. Best is trial 6 with value: 0.47947537899017334.
Generating rdkit fingerprints...
Generated fingerprints with 256 features for 841 molecules
Trial 49: 5-fold CV loss = 0.8957
[I 2025-08-07 16:15:05,172] Trial 49 finished with value: 0.895674729347229 and parameters: {'fp_type': 'rdkit', 'rdkit_only_maxPath': 8, 'rdkit_only_nBits': 256, 'num_hidden_layers': 2, 'hidden_dim_0': 1024, 'hidden_dim_1': 512, 'kl_weight': 0.006198007436345218, 'lr': 0.002081583100176579, 'batch_size': 128, 'dropout_rate': 0.42757352954220273, 'prior_mu': 0.10381356642364618, 'prior_sigma': 0.06859944303823232, 'normalization': 'layer'}. Best is trial 6 with value: 0.47947537899017334.
Generating morgan_rdkit fingerprints...
Generated fingerprints with 1536 features for 841 molecules
Trial 44: 5-fold CV loss = 0.4939
[I 2025-08-07 16:15:23,461] Trial 44 finished with value: 0.4939243793487549 and parameters: {'fp_type': 'morgan_rdkit', 'combined_morgan_radius': 2, 'combined_morgan_nBits': 512, 'combined_rdkit_maxPath': 5, 'combined_rdkit_nBits': 1024, 'num_hidden_layers': 2, 'hidden_dim_0': 64, 'hidden_dim_1': 512, 'kl_weight': 0.00014686738433538097, 'lr': 0.007351736546019097, 'batch_size': 32, 'dropout_rate': 0.23819477844864398, 'prior_mu': -0.0917919210868483, 'prior_sigma': 0.03408242316618311, 'normalization': 'layer'}. Best is trial 6 with value: 0.47947537899017334.
Generating morgan_rdkit fingerprints...
Generated fingerprints with 1536 features for 841 molecules
Trial 50: 5-fold CV loss = 0.5657
[I 2025-08-07 16:16:03,123] Trial 50 finished with value: 0.5657451808452606 and parameters: {'fp_type': 'morgan_rdkit', 'combined_morgan_radius': 3, 'combined_morgan_nBits': 512, 'combined_rdkit_maxPath': 7, 'combined_rdkit_nBits': 1024, 'num_hidden_layers': 3, 'hidden_dim_0': 64, 'hidden_dim_1': 64, 'hidden_dim_2': 128, 'kl_weight': 0.0004853586048905823, 'lr': 0.009192512070939973, 'batch_size': 64, 'dropout_rate': 0.3039965061973184, 'prior_mu': 0.0294563944451091, 'prior_sigma': 0.08836617670757925, 'normalization': 'layer'}. Best is trial 6 with value: 0.47947537899017334.
Generating morgan_rdkit fingerprints...
Generated fingerprints with 1536 features for 841 molecules
Trial 48: 5-fold CV loss = 0.4799
[I 2025-08-07 16:16:07,772] Trial 48 finished with value: 0.47994033098220823 and parameters: {'fp_type': 'morgan_rdkit', 'combined_morgan_radius': 2, 'combined_morgan_nBits': 512, 'combined_rdkit_maxPath': 7, 'combined_rdkit_nBits': 1024, 'num_hidden_layers': 2, 'hidden_dim_0': 64, 'hidden_dim_1': 512, 'kl_weight': 0.0004525890553742432, 'lr': 0.0020573547408403816, 'batch_size': 32, 'dropout_rate': 0.4223027414074306, 'prior_mu': 0.09914132354669422, 'prior_sigma': 0.03707705306504623, 'normalization': 'layer'}. Best is trial 6 with value: 0.47947537899017334.
Generating rdkit fingerprints...
Generated fingerprints with 512 features for 841 molecules
Trial 53: 5-fold CV loss = 0.6698
[I 2025-08-07 16:16:30,681] Trial 53 finished with value: 0.6697625875473022 and parameters: {'fp_type': 'rdkit', 'rdkit_only_maxPath': 7, 'rdkit_only_nBits': 512, 'num_hidden_layers': 0, 'kl_weight': 0.000938012442328448, 'lr': 0.0020599013034553744, 'batch_size': 64, 'dropout_rate': 0.4254000137727937, 'prior_mu': 0.13057475565964005, 'prior_sigma': 0.010163117258396533, 'normalization': 'layer'}. Best is trial 6 with value: 0.47947537899017334.
Generating morgan_rdkit fingerprints...
Generated fingerprints with 1536 features for 841 molecules
Trial 52: 5-fold CV loss = 0.5142
[I 2025-08-07 16:16:32,159] Trial 52 finished with value: 0.5141941249370575 and parameters: {'fp_type': 'morgan_rdkit', 'combined_morgan_radius': 3, 'combined_morgan_nBits': 512, 'combined_rdkit_maxPath': 8, 'combined_rdkit_nBits': 1024, 'num_hidden_layers': 2, 'hidden_dim_0': 1024, 'hidden_dim_1': 128, 'kl_weight': 0.00012088865315561209, 'lr': 0.00824283552439356, 'batch_size': 64, 'dropout_rate': 0.2173274920162618, 'prior_mu': -0.13107353841243527, 'prior_sigma': 0.014509640387325363, 'normalization': 'layer'}. Best is trial 6 with value: 0.47947537899017334.
Generating morgan_rdkit fingerprints...
Generated fingerprints with 1536 features for 841 molecules
Trial 51: 5-fold CV loss = 0.4900
[I 2025-08-07 16:17:23,495] Trial 51 finished with value: 0.4899568438529968 and parameters: {'fp_type': 'morgan_rdkit', 'combined_morgan_radius': 3, 'combined_morgan_nBits': 512, 'combined_rdkit_maxPath': 8, 'combined_rdkit_nBits': 1024, 'num_hidden_layers': 3, 'hidden_dim_0': 64, 'hidden_dim_1': 64, 'hidden_dim_2': 128, 'kl_weight': 0.00046526566659583146, 'lr': 0.008933992958793784, 'batch_size': 64, 'dropout_rate': 0.29578160463372555, 'prior_mu': -0.12804482739644973, 'prior_sigma': 0.03476748947306335, 'normalization': 'layer'}. Best is trial 6 with value: 0.47947537899017334.
Generating morgan_rdkit fingerprints...
Generated fingerprints with 1536 features for 841 molecules
Trial 55: 5-fold CV loss = 0.4936
[I 2025-08-07 16:17:33,195] Trial 55 finished with value: 0.49362900853157043 and parameters: {'fp_type': 'morgan_rdkit', 'combined_morgan_radius': 2, 'combined_morgan_nBits': 512, 'combined_rdkit_maxPath': 7, 'combined_rdkit_nBits': 1024, 'num_hidden_layers': 2, 'hidden_dim_0': 64, 'hidden_dim_1': 512, 'kl_weight': 0.0005378899121329002, 'lr': 0.0036967568225851136, 'batch_size': 32, 'dropout_rate': 0.3532367056881177, 'prior_mu': -0.11530438796777696, 'prior_sigma': 0.03826591396895194, 'normalization': 'layer'}. Best is trial 6 with value: 0.47947537899017334.
Generating morgan_rdkit fingerprints...
Generated fingerprints with 1536 features for 841 molecules
Trial 54: 5-fold CV loss = 0.4775
[I 2025-08-07 16:17:35,547] Trial 54 finished with value: 0.47750294804573057 and parameters: {'fp_type': 'morgan_rdkit', 'combined_morgan_radius': 2, 'combined_morgan_nBits': 512, 'combined_rdkit_maxPath': 7, 'combined_rdkit_nBits': 1024, 'num_hidden_layers': 2, 'hidden_dim_0': 64, 'hidden_dim_1': 512, 'kl_weight': 0.0001250591772699102, 'lr': 0.0038130468119791957, 'batch_size': 32, 'dropout_rate': 0.20866170266059902, 'prior_mu': -0.12896612433806062, 'prior_sigma': 0.03883372433928188, 'normalization': 'layer'}. Best is trial 54 with value: 0.47750294804573057.
Generating morgan_rdkit fingerprints...
Generated fingerprints with 1536 features for 841 molecules
Trial 47: 5-fold CV loss = 0.4876
[I 2025-08-07 16:17:56,522] Trial 47 finished with value: 0.48757668733596804 and parameters: {'fp_type': 'morgan_rdkit', 'combined_morgan_radius': 2, 'combined_morgan_nBits': 512, 'combined_rdkit_maxPath': 5, 'combined_rdkit_nBits': 1024, 'num_hidden_layers': 2, 'hidden_dim_0': 64, 'hidden_dim_1': 512, 'kl_weight': 0.0005079152007586702, 'lr': 0.003844463698534519, 'batch_size': 32, 'dropout_rate': 0.34986509543902566, 'prior_mu': 0.17715930001523078, 'prior_sigma': 0.05684444887143583, 'normalization': 'layer'}. Best is trial 54 with value: 0.47750294804573057.
Generating morgan_rdkit fingerprints...
Generated fingerprints with 1536 features for 841 molecules
Trial 58: 5-fold CV loss = 0.4902
[I 2025-08-07 16:18:23,572] Trial 58 finished with value: 0.4901919007301331 and parameters: {'fp_type': 'morgan_rdkit', 'combined_morgan_radius': 3, 'combined_morgan_nBits': 512, 'combined_rdkit_maxPath': 8, 'combined_rdkit_nBits': 1024, 'num_hidden_layers': 3, 'hidden_dim_0': 64, 'hidden_dim_1': 64, 'hidden_dim_2': 128, 'kl_weight': 0.0002074278031744214, 'lr': 0.006368184542955027, 'batch_size': 64, 'dropout_rate': 0.11286778331127173, 'prior_mu': -0.18552754238946229, 'prior_sigma': 0.05750371812832088, 'normalization': 'layer'}. Best is trial 54 with value: 0.47750294804573057.
Generating morgan fingerprints...
Generated fingerprints with 1024 features for 841 molecules
Trial 57: 5-fold CV loss = 0.4881
[I 2025-08-07 16:18:55,897] Trial 57 finished with value: 0.4880851149559021 and parameters: {'fp_type': 'morgan_rdkit', 'combined_morgan_radius': 3, 'combined_morgan_nBits': 512, 'combined_rdkit_maxPath': 8, 'combined_rdkit_nBits': 1024, 'num_hidden_layers': 3, 'hidden_dim_0': 64, 'hidden_dim_1': 64, 'hidden_dim_2': 128, 'kl_weight': 0.00037408334388787124, 'lr': 0.0013888620363505374, 'batch_size': 64, 'dropout_rate': 0.26939128967285864, 'prior_mu': -0.19522129611647493, 'prior_sigma': 0.05047604313229946, 'normalization': 'layer'}. Best is trial 54 with value: 0.47750294804573057.
Generating morgan fingerprints...
Generated fingerprints with 1024 features for 841 molecules
Trial 60: 5-fold CV loss = 0.5435
[I 2025-08-07 16:18:59,170] Trial 60 finished with value: 0.5435133814811707 and parameters: {'fp_type': 'morgan', 'morgan_only_radius': 2, 'morgan_only_nBits': 1024, 'num_hidden_layers': 2, 'hidden_dim_0': 1024, 'hidden_dim_1': 512, 'kl_weight': 0.017517072967721058, 'lr': 0.001259460767777362, 'batch_size': 32, 'dropout_rate': 0.2702732674975822, 'prior_mu': 0.05938387512410474, 'prior_sigma': 0.04090552799549257, 'normalization': 'layer'}. Best is trial 54 with value: 0.47750294804573057.
Generating morgan_rdkit fingerprints...
Generated fingerprints with 1536 features for 841 molecules
Trial 56: 5-fold CV loss = 0.4911
[I 2025-08-07 16:19:07,761] Trial 56 finished with value: 0.49108839631080625 and parameters: {'fp_type': 'morgan_rdkit', 'combined_morgan_radius': 3, 'combined_morgan_nBits': 512, 'combined_rdkit_maxPath': 8, 'combined_rdkit_nBits': 1024, 'num_hidden_layers': 3, 'hidden_dim_0': 64, 'hidden_dim_1': 64, 'hidden_dim_2': 128, 'kl_weight': 0.0005803979118402061, 'lr': 0.003537864928099712, 'batch_size': 64, 'dropout_rate': 0.3443542722781934, 'prior_mu': -0.1773881586624861, 'prior_sigma': 0.03889626132342945, 'normalization': 'layer'}. Best is trial 54 with value: 0.47750294804573057.
Generating morgan_rdkit fingerprints...
Generated fingerprints with 1536 features for 841 molecules
Trial 61: 5-fold CV loss = 0.5476
[I 2025-08-07 16:19:29,344] Trial 61 finished with value: 0.5475662350654602 and parameters: {'fp_type': 'morgan', 'morgan_only_radius': 2, 'morgan_only_nBits': 1024, 'num_hidden_layers': 3, 'hidden_dim_0': 1024, 'hidden_dim_1': 64, 'hidden_dim_2': 256, 'kl_weight': 0.001190531433577005, 'lr': 0.0008069559426430795, 'batch_size': 64, 'dropout_rate': 0.1551321380898928, 'prior_mu': -0.16289662908070546, 'prior_sigma': 0.0234066185779615, 'normalization': 'layer'}. Best is trial 54 with value: 0.47750294804573057.
Generating morgan_rdkit fingerprints...
Generated fingerprints with 1536 features for 841 molecules
Trial 62: 5-fold CV loss = 0.5311
[I 2025-08-07 16:19:31,487] Trial 62 finished with value: 0.5310951113700867 and parameters: {'fp_type': 'morgan_rdkit', 'combined_morgan_radius': 3, 'combined_morgan_nBits': 1024, 'combined_rdkit_maxPath': 7, 'combined_rdkit_nBits': 512, 'num_hidden_layers': 3, 'hidden_dim_0': 64, 'hidden_dim_1': 64, 'hidden_dim_2': 256, 'kl_weight': 0.001060731620631449, 'lr': 0.0013667956511759193, 'batch_size': 64, 'dropout_rate': 0.20227657464758209, 'prior_mu': -0.16422568466181456, 'prior_sigma': 0.021808653702162714, 'normalization': 'layer'}. Best is trial 54 with value: 0.47750294804573057.
Generating morgan_rdkit fingerprints...
Generated fingerprints with 1536 features for 841 molecules
Trial 63: 5-fold CV loss = 1.0621
[I 2025-08-07 16:20:06,830] Trial 63 finished with value: 1.062107217311859 and parameters: {'fp_type': 'morgan_rdkit', 'combined_morgan_radius': 3, 'combined_morgan_nBits': 1024, 'combined_rdkit_maxPath': 7, 'combined_rdkit_nBits': 512, 'num_hidden_layers': 3, 'hidden_dim_0': 1024, 'hidden_dim_1': 64, 'hidden_dim_2': 256, 'kl_weight': 0.0011525357988866258, 'lr': 0.001401336881989448, 'batch_size': 64, 'dropout_rate': 0.15419646736167897, 'prior_mu': -0.16212535608945194, 'prior_sigma': 0.16997442857642286, 'normalization': 'none'}. Best is trial 54 with value: 0.47750294804573057.
Generating morgan_rdkit fingerprints...
Generated fingerprints with 1536 features for 841 molecules
Trial 59: 5-fold CV loss = 0.7500
