[I 2025-08-07 23:58:41,512] Trial 2116 finished with value: 0.4737078368663788 and parameters: {'fp_type': 'morgan_rdkit', 'combined_morgan_radius': 3, 'combined_morgan_nBits': 1024, 'combined_rdkit_maxPath': 7, 'combined_rdkit_nBits': 1024, 'num_hidden_layers': 3, 'hidden_dim_0': 64, 'hidden_dim_1': 1024, 'hidden_dim_2': 64, 'kl_weight': 0.00022437570388782419, 'lr': 0.007602043000322443, 'batch_size': 128, 'dropout_rate': 0.19244293818734665, 'prior_mu': 0.00037795647939408913, 'prior_sigma': 0.09669173596089084, 'normalization': 'layer'}. Best is trial 896 with value: 0.4533553242683411.
Generating morgan_rdkit fingerprints...
Generated fingerprints with 2048 features for 841 molecules
Trial 2115: 5-fold CV loss = 0.4595
[I 2025-08-07 23:58:52,899] Trial 2115 finished with value: 0.4595202565193176 and parameters: {'fp_type': 'morgan_rdkit', 'combined_morgan_radius': 3, 'combined_morgan_nBits': 1024, 'combined_rdkit_maxPath': 7, 'combined_rdkit_nBits': 1024, 'num_hidden_layers': 3, 'hidden_dim_0': 1024, 'hidden_dim_1': 1024, 'hidden_dim_2': 64, 'kl_weight': 0.00022776442239661422, 'lr': 0.007878041917528444, 'batch_size': 128, 'dropout_rate': 0.19145521387925962, 'prior_mu': -0.027420625270460745, 'prior_sigma': 0.10239259520683373, 'normalization': 'layer'}. Best is trial 896 with value: 0.4533553242683411.
Generating morgan_rdkit fingerprints...
Generated fingerprints with 2048 features for 841 molecules
Trial 2117: 5-fold CV loss = 0.5127
[I 2025-08-07 23:59:25,026] Trial 2117 finished with value: 0.5126549541950226 and parameters: {'fp_type': 'morgan_rdkit', 'combined_morgan_radius': 3, 'combined_morgan_nBits': 1024, 'combined_rdkit_maxPath': 7, 'combined_rdkit_nBits': 1024, 'num_hidden_layers': 3, 'hidden_dim_0': 256, 'hidden_dim_1': 1024, 'hidden_dim_2': 64, 'kl_weight': 0.09759605460992068, 'lr': 0.008006814850587815, 'batch_size': 128, 'dropout_rate': 0.22057112088095926, 'prior_mu': -0.0275187072378068, 'prior_sigma': 0.09474537497028969, 'normalization': 'layer'}. Best is trial 896 with value: 0.4533553242683411.
Generating morgan_rdkit fingerprints...
Generated fingerprints with 2048 features for 841 molecules
Trial 2119: 5-fold CV loss = 0.4659
[I 2025-08-07 23:59:26,498] Trial 2119 finished with value: 0.46587331891059874 and parameters: {'fp_type': 'morgan_rdkit', 'combined_morgan_radius': 3, 'combined_morgan_nBits': 1024, 'combined_rdkit_maxPath': 7, 'combined_rdkit_nBits': 1024, 'num_hidden_layers': 3, 'hidden_dim_0': 1024, 'hidden_dim_1': 1024, 'hidden_dim_2': 64, 'kl_weight': 0.000385014960411178, 'lr': 0.009205250970268428, 'batch_size': 64, 'dropout_rate': 0.1313671519916186, 'prior_mu': -0.025075468563362232, 'prior_sigma': 0.08897484964095347, 'normalization': 'layer'}. Best is trial 896 with value: 0.4533553242683411.
Generating morgan_rdkit fingerprints...
Generated fingerprints with 2048 features for 841 molecules
Trial 2120: 5-fold CV loss = 0.4674
[I 2025-08-07 23:59:56,903] Trial 2120 finished with value: 0.46736298203468324 and parameters: {'fp_type': 'morgan_rdkit', 'combined_morgan_radius': 3, 'combined_morgan_nBits': 1024, 'combined_rdkit_maxPath': 7, 'combined_rdkit_nBits': 1024, 'num_hidden_layers': 3, 'hidden_dim_0': 256, 'hidden_dim_1': 1024, 'hidden_dim_2': 64, 'kl_weight': 0.0003208846509190789, 'lr': 0.009352546223175526, 'batch_size': 64, 'dropout_rate': 0.1320882548205395, 'prior_mu': -0.044199406148521594, 'prior_sigma': 0.08876314321855715, 'normalization': 'layer'}. Best is trial 896 with value: 0.4533553242683411.
Generating morgan_rdkit fingerprints...
Generated fingerprints with 2048 features for 841 molecules
Trial 2122: 5-fold CV loss = 0.4773
[I 2025-08-08 00:00:00,355] Trial 2122 finished with value: 0.47733561396598817 and parameters: {'fp_type': 'morgan_rdkit', 'combined_morgan_radius': 3, 'combined_morgan_nBits': 1024, 'combined_rdkit_maxPath': 7, 'combined_rdkit_nBits': 1024, 'num_hidden_layers': 3, 'hidden_dim_0': 256, 'hidden_dim_1': 1024, 'hidden_dim_2': 64, 'kl_weight': 0.00028651591421195586, 'lr': 0.0052017980002528824, 'batch_size': 128, 'dropout_rate': 0.10235742453965978, 'prior_mu': -0.044901752048886016, 'prior_sigma': 0.07570483704769486, 'normalization': 'layer'}. Best is trial 896 with value: 0.4533553242683411.
Generating morgan_rdkit fingerprints...
Generated fingerprints with 1536 features for 841 molecules
Trial 2121: 5-fold CV loss = 0.4651
[I 2025-08-08 00:00:18,968] Trial 2121 finished with value: 0.465122389793396 and parameters: {'fp_type': 'morgan_rdkit', 'combined_morgan_radius': 3, 'combined_morgan_nBits': 1024, 'combined_rdkit_maxPath': 7, 'combined_rdkit_nBits': 1024, 'num_hidden_layers': 3, 'hidden_dim_0': 256, 'hidden_dim_1': 1024, 'hidden_dim_2': 64, 'kl_weight': 0.0002873104855986676, 'lr': 0.004068525732093056, 'batch_size': 64, 'dropout_rate': 0.13096472080935803, 'prior_mu': -0.04179751816274009, 'prior_sigma': 0.07611569624507185, 'normalization': 'layer'}. Best is trial 896 with value: 0.4533553242683411.
Generating morgan_rdkit fingerprints...
Generated fingerprints with 1536 features for 841 molecules
Trial 2118: 5-fold CV loss = 0.4689
[I 2025-08-08 00:00:24,248] Trial 2118 finished with value: 0.4689295172691345 and parameters: {'fp_type': 'morgan_rdkit', 'combined_morgan_radius': 3, 'combined_morgan_nBits': 1024, 'combined_rdkit_maxPath': 7, 'combined_rdkit_nBits': 1024, 'num_hidden_layers': 3, 'hidden_dim_0': 1024, 'hidden_dim_1': 1024, 'hidden_dim_2': 64, 'kl_weight': 0.000212773878607841, 'lr': 0.009935367166460225, 'batch_size': 64, 'dropout_rate': 0.21775951354996473, 'prior_mu': -0.025886753829114692, 'prior_sigma': 0.09535571027207496, 'normalization': 'layer'}. Best is trial 896 with value: 0.4533553242683411.
Generating morgan_rdkit fingerprints...
Generated fingerprints with 1536 features for 841 molecules
Trial 2124: 5-fold CV loss = 0.5889
[I 2025-08-08 00:00:32,376] Trial 2124 finished with value: 0.5888901829719544 and parameters: {'fp_type': 'morgan_rdkit', 'combined_morgan_radius': 3, 'combined_morgan_nBits': 1024, 'combined_rdkit_maxPath': 7, 'combined_rdkit_nBits': 512, 'num_hidden_layers': 3, 'hidden_dim_0': 256, 'hidden_dim_1': 1024, 'hidden_dim_2': 64, 'kl_weight': 0.0003388997503237212, 'lr': 0.0038895761710222355, 'batch_size': 128, 'dropout_rate': 0.06884565561203261, 'prior_mu': -0.035996939637581646, 'prior_sigma': 0.08133173333640195, 'normalization': 'layer'}. Best is trial 896 with value: 0.4533553242683411.
Generating morgan_rdkit fingerprints...
Generated fingerprints with 2048 features for 841 molecules
Trial 2123: 5-fold CV loss = 0.4659
[I 2025-08-08 00:00:49,716] Trial 2123 finished with value: 0.4659234881401062 and parameters: {'fp_type': 'morgan_rdkit', 'combined_morgan_radius': 3, 'combined_morgan_nBits': 1024, 'combined_rdkit_maxPath': 7, 'combined_rdkit_nBits': 1024, 'num_hidden_layers': 3, 'hidden_dim_0': 256, 'hidden_dim_1': 1024, 'hidden_dim_2': 64, 'kl_weight': 0.000285020412165985, 'lr': 0.005405611999721487, 'batch_size': 128, 'dropout_rate': 0.10239318423876365, 'prior_mu': -0.03617610361321427, 'prior_sigma': 0.07624080887920283, 'normalization': 'layer'}. Best is trial 896 with value: 0.4533553242683411.
Generating morgan_rdkit fingerprints...
Generated fingerprints with 2048 features for 841 molecules
Trial 2125: 5-fold CV loss = 0.5636
[I 2025-08-08 00:00:52,696] Trial 2125 finished with value: 0.563599967956543 and parameters: {'fp_type': 'morgan_rdkit', 'combined_morgan_radius': 3, 'combined_morgan_nBits': 1024, 'combined_rdkit_maxPath': 7, 'combined_rdkit_nBits': 512, 'num_hidden_layers': 3, 'hidden_dim_0': 256, 'hidden_dim_1': 1024, 'hidden_dim_2': 64, 'kl_weight': 0.0003342130377905149, 'lr': 0.006791289508451667, 'batch_size': 128, 'dropout_rate': 0.11953277273762632, 'prior_mu': -0.005908776471165753, 'prior_sigma': 0.08252687488170941, 'normalization': 'layer'}. Best is trial 896 with value: 0.4533553242683411.
Generating morgan fingerprints...
Generated fingerprints with 2048 features for 841 molecules
Trial 2127: 5-fold CV loss = 0.5649
[I 2025-08-08 00:01:06,973] Trial 2127 finished with value: 0.5648661732673645 and parameters: {'fp_type': 'morgan_rdkit', 'combined_morgan_radius': 3, 'combined_morgan_nBits': 1024, 'combined_rdkit_maxPath': 7, 'combined_rdkit_nBits': 1024, 'num_hidden_layers': 3, 'hidden_dim_0': 256, 'hidden_dim_1': 128, 'hidden_dim_2': 64, 'kl_weight': 0.00038536748513453716, 'lr': 0.006922583310050479, 'batch_size': 128, 'dropout_rate': 0.11734796472519621, 'prior_mu': -0.004977670289682271, 'prior_sigma': 0.08013293886315323, 'normalization': 'layer'}. Best is trial 896 with value: 0.4533553242683411.
Generating morgan_rdkit fingerprints...
Generated fingerprints with 2048 features for 841 molecules
Trial 2129: 5-fold CV loss = 1.0165
[I 2025-08-08 00:01:11,915] Trial 2129 finished with value: 1.0165083408355713 and parameters: {'fp_type': 'morgan', 'morgan_only_radius': 3, 'morgan_only_nBits': 2048, 'num_hidden_layers': 3, 'hidden_dim_0': 256, 'hidden_dim_1': 1024, 'hidden_dim_2': 512, 'kl_weight': 0.0004102267626370785, 'lr': 0.0002577806339735081, 'batch_size': 128, 'dropout_rate': 0.1126217282953232, 'prior_mu': -0.018224877713855954, 'prior_sigma': 0.11198700191658917, 'normalization': 'layer'}. Best is trial 896 with value: 0.4533553242683411.
Generating morgan_rdkit fingerprints...
Generated fingerprints with 2048 features for 841 molecules
Trial 2128: 5-fold CV loss = 0.6270
[I 2025-08-08 00:01:38,058] Trial 2128 finished with value: 0.626969826221466 and parameters: {'fp_type': 'morgan_rdkit', 'combined_morgan_radius': 3, 'combined_morgan_nBits': 1024, 'combined_rdkit_maxPath': 7, 'combined_rdkit_nBits': 1024, 'num_hidden_layers': 3, 'hidden_dim_0': 256, 'hidden_dim_1': 128, 'hidden_dim_2': 64, 'kl_weight': 0.0004182926731461434, 'lr': 0.007100185328082935, 'batch_size': 128, 'dropout_rate': 0.11899052762517753, 'prior_mu': -0.005572753907200974, 'prior_sigma': 0.1111864674829725, 'normalization': 'layer'}. Best is trial 896 with value: 0.4533553242683411.
Generating morgan_rdkit fingerprints...
Generated fingerprints with 1280 features for 841 molecules
Trial 2130: 5-fold CV loss = 0.6493
[I 2025-08-08 00:01:39,569] Trial 2130 finished with value: 0.6492875754833222 and parameters: {'fp_type': 'morgan_rdkit', 'combined_morgan_radius': 3, 'combined_morgan_nBits': 1024, 'combined_rdkit_maxPath': 7, 'combined_rdkit_nBits': 1024, 'num_hidden_layers': 3, 'hidden_dim_0': 256, 'hidden_dim_1': 1024, 'hidden_dim_2': 64, 'kl_weight': 0.00047661421464922487, 'lr': 0.006067832393929681, 'batch_size': 128, 'dropout_rate': 0.1795817999030373, 'prior_mu': -0.0200928703334608, 'prior_sigma': 0.10991347942195887, 'normalization': 'layer'}. Best is trial 896 with value: 0.4533553242683411.
Generating morgan_rdkit fingerprints...
Generated fingerprints with 2048 features for 841 molecules
Trial 2131: 5-fold CV loss = 0.4741
[I 2025-08-08 00:01:51,464] Trial 2131 finished with value: 0.474084734916687 and parameters: {'fp_type': 'morgan_rdkit', 'combined_morgan_radius': 3, 'combined_morgan_nBits': 1024, 'combined_rdkit_maxPath': 7, 'combined_rdkit_nBits': 1024, 'num_hidden_layers': 3, 'hidden_dim_0': 256, 'hidden_dim_1': 1024, 'hidden_dim_2': 64, 'kl_weight': 0.00048723603985721247, 'lr': 0.006135128138903928, 'batch_size': 128, 'dropout_rate': 0.18014109028812794, 'prior_mu': -0.021581275756095374, 'prior_sigma': 0.08560017729477377, 'normalization': 'layer'}. Best is trial 896 with value: 0.4533553242683411.
Generating morgan_rdkit fingerprints...
Generated fingerprints with 1280 features for 841 molecules
Trial 2126: 5-fold CV loss = 0.4887
[I 2025-08-08 00:02:07,549] Trial 2126 finished with value: 0.4886993050575256 and parameters: {'fp_type': 'morgan_rdkit', 'combined_morgan_radius': 3, 'combined_morgan_nBits': 1024, 'combined_rdkit_maxPath': 7, 'combined_rdkit_nBits': 512, 'num_hidden_layers': 3, 'hidden_dim_0': 256, 'hidden_dim_1': 1024, 'hidden_dim_2': 64, 'kl_weight': 0.0003315960994859009, 'lr': 0.00692420891379497, 'batch_size': 128, 'dropout_rate': 0.11989726540712908, 'prior_mu': -0.004752916067922226, 'prior_sigma': 0.08193416661308225, 'normalization': 'layer'}. Best is trial 896 with value: 0.4533553242683411.
Generating morgan_rdkit fingerprints...
Generated fingerprints with 1280 features for 841 molecules
Trial 2132: 5-fold CV loss = 0.5157
[I 2025-08-08 00:02:22,222] Trial 2132 finished with value: 0.5157382369041443 and parameters: {'fp_type': 'morgan_rdkit', 'combined_morgan_radius': 3, 'combined_morgan_nBits': 1024, 'combined_rdkit_maxPath': 7, 'combined_rdkit_nBits': 256, 'num_hidden_layers': 3, 'hidden_dim_0': 256, 'hidden_dim_1': 1024, 'hidden_dim_2': 64, 'kl_weight': 0.00025616726076897295, 'lr': 0.006121891109492068, 'batch_size': 128, 'dropout_rate': 0.17888530442761816, 'prior_mu': -0.02236202407892533, 'prior_sigma': 0.08552450973401587, 'normalization': 'layer'}. Best is trial 896 with value: 0.4533553242683411.
Generating morgan_rdkit fingerprints...
Generated fingerprints with 2048 features for 841 molecules
Trial 2133: 5-fold CV loss = 0.4585
[I 2025-08-08 00:02:25,166] Trial 2133 finished with value: 0.458493310213089 and parameters: {'fp_type': 'morgan_rdkit', 'combined_morgan_radius': 3, 'combined_morgan_nBits': 1024, 'combined_rdkit_maxPath': 7, 'combined_rdkit_nBits': 1024, 'num_hidden_layers': 3, 'hidden_dim_0': 256, 'hidden_dim_1': 1024, 'hidden_dim_2': 64, 'kl_weight': 0.00025997851399230224, 'lr': 0.0061419540502099185, 'batch_size': 128, 'dropout_rate': 0.14812964546881985, 'prior_mu': -0.055740540534672894, 'prior_sigma': 0.08710891422517839, 'normalization': 'layer'}. Best is trial 896 with value: 0.4533553242683411.
Generating morgan_rdkit fingerprints...
Generated fingerprints with 2048 features for 841 molecules
Trial 2134: 5-fold CV loss = 0.5118
[I 2025-08-08 00:02:26,423] Trial 2134 finished with value: 0.5117789328098297 and parameters: {'fp_type': 'morgan_rdkit', 'combined_morgan_radius': 3, 'combined_morgan_nBits': 1024, 'combined_rdkit_maxPath': 7, 'combined_rdkit_nBits': 256, 'num_hidden_layers': 3, 'hidden_dim_0': 256, 'hidden_dim_1': 1024, 'hidden_dim_2': 64, 'kl_weight': 0.0002541670829343863, 'lr': 0.008550613016767723, 'batch_size': 128, 'dropout_rate': 0.14482040963986526, 'prior_mu': 0.007149495890316632, 'prior_sigma': 0.09140355620112078, 'normalization': 'layer'}. Best is trial 896 with value: 0.4533553242683411.
Generating morgan_rdkit fingerprints...
Generated fingerprints with 2048 features for 841 molecules
Trial 2137: 5-fold CV loss = 0.6570
[I 2025-08-08 00:02:53,014] Trial 2137 finished with value: 0.6570027053356171 and parameters: {'fp_type': 'morgan_rdkit', 'combined_morgan_radius': 3, 'combined_morgan_nBits': 1024, 'combined_rdkit_maxPath': 7, 'combined_rdkit_nBits': 1024, 'num_hidden_layers': 3, 'hidden_dim_0': 256, 'hidden_dim_1': 1024, 'hidden_dim_2': 64, 'kl_weight': 0.0001974372873092765, 'lr': 0.004924713937718126, 'batch_size': 128, 'dropout_rate': 0.14451364998045924, 'prior_mu': -0.07256239691850914, 'prior_sigma': 0.091223017918172, 'normalization': 'none'}. Best is trial 896 with value: 0.4533553242683411.
Generating morgan_rdkit fingerprints...
Generated fingerprints with 1536 features for 841 molecules
Trial 2136: 5-fold CV loss = 0.6913
[I 2025-08-08 00:03:00,717] Trial 2136 finished with value: 0.691317081451416 and parameters: {'fp_type': 'morgan_rdkit', 'combined_morgan_radius': 3, 'combined_morgan_nBits': 1024, 'combined_rdkit_maxPath': 7, 'combined_rdkit_nBits': 1024, 'num_hidden_layers': 3, 'hidden_dim_0': 256, 'hidden_dim_1': 1024, 'hidden_dim_2': 64, 'kl_weight': 0.0030939593745563728, 'lr': 0.009975589410582901, 'batch_size': 128, 'dropout_rate': 0.14553644909616692, 'prior_mu': 0.006429031516261394, 'prior_sigma': 0.09154761476676897, 'normalization': 'none'}. Best is trial 896 with value: 0.4533553242683411.
Generating morgan_rdkit fingerprints...
Generated fingerprints with 1536 features for 841 molecules
Trial 2138: 5-fold CV loss = 0.4657
[I 2025-08-08 00:03:11,228] Trial 2138 finished with value: 0.4657158493995667 and parameters: {'fp_type': 'morgan_rdkit', 'combined_morgan_radius': 3, 'combined_morgan_nBits': 1024, 'combined_rdkit_maxPath': 7, 'combined_rdkit_nBits': 1024, 'num_hidden_layers': 3, 'hidden_dim_0': 256, 'hidden_dim_1': 1024, 'hidden_dim_2': 64, 'kl_weight': 0.00019803501606790623, 'lr': 0.0050852471322125024, 'batch_size': 128, 'dropout_rate': 0.1438678731701993, 'prior_mu': -0.06001282361917348, 'prior_sigma': 0.08946923634489971, 'normalization': 'layer'}. Best is trial 896 with value: 0.4533553242683411.
Generating morgan_rdkit fingerprints...
Generated fingerprints with 1536 features for 841 molecules
Trial 2135: 5-fold CV loss = 0.5115
[I 2025-08-08 00:03:23,203] Trial 2135 finished with value: 0.5114956498146057 and parameters: {'fp_type': 'morgan_rdkit', 'combined_morgan_radius': 3, 'combined_morgan_nBits': 1024, 'combined_rdkit_maxPath': 7, 'combined_rdkit_nBits': 256, 'num_hidden_layers': 3, 'hidden_dim_0': 256, 'hidden_dim_1': 1024, 'hidden_dim_2': 64, 'kl_weight': 0.00025149246409974173, 'lr': 0.007845879664979653, 'batch_size': 128, 'dropout_rate': 0.14377122922681282, 'prior_mu': -0.056480806476633214, 'prior_sigma': 0.09156959730953432, 'normalization': 'layer'}. Best is trial 896 with value: 0.4533553242683411.
Generating morgan_rdkit fingerprints...
Generated fingerprints with 1536 features for 841 molecules
Trial 2139: 5-fold CV loss = 0.4693
[I 2025-08-08 00:03:32,961] Trial 2139 finished with value: 0.4692514717578888 and parameters: {'fp_type': 'morgan_rdkit', 'combined_morgan_radius': 3, 'combined_morgan_nBits': 512, 'combined_rdkit_maxPath': 6, 'combined_rdkit_nBits': 1024, 'num_hidden_layers': 3, 'hidden_dim_0': 256, 'hidden_dim_1': 1024, 'hidden_dim_2': 64, 'kl_weight': 0.00020151260118319716, 'lr': 0.005222307532172462, 'batch_size': 128, 'dropout_rate': 0.14811286355881847, 'prior_mu': -0.06081100143058997, 'prior_sigma': 0.08757303624642124, 'normalization': 'layer'}. Best is trial 896 with value: 0.4533553242683411.
Generating morgan_rdkit fingerprints...
Generated fingerprints with 2048 features for 841 molecules
Trial 2141: 5-fold CV loss = 0.8357
[I 2025-08-08 00:03:35,352] Trial 2141 finished with value: 0.8356900930404663 and parameters: {'fp_type': 'morgan_rdkit', 'combined_morgan_radius': 3, 'combined_morgan_nBits': 512, 'combined_rdkit_maxPath': 6, 'combined_rdkit_nBits': 1024, 'num_hidden_layers': 3, 'hidden_dim_0': 256, 'hidden_dim_1': 64, 'hidden_dim_2': 1024, 'kl_weight': 0.0002300700810272534, 'lr': 0.005521152692333165, 'batch_size': 128, 'dropout_rate': 0.14396622481262586, 'prior_mu': -0.05392036543990329, 'prior_sigma': 0.0869644803143524, 'normalization': 'layer'}. Best is trial 896 with value: 0.4533553242683411.
Generating morgan_rdkit fingerprints...
Generated fingerprints with 2048 features for 841 molecules
Trial 2140: 5-fold CV loss = 0.7949
[I 2025-08-08 00:03:43,092] Trial 2140 finished with value: 0.7948810219764709 and parameters: {'fp_type': 'morgan_rdkit', 'combined_morgan_radius': 3, 'combined_morgan_nBits': 512, 'combined_rdkit_maxPath': 6, 'combined_rdkit_nBits': 1024, 'num_hidden_layers': 3, 'hidden_dim_0': 256, 'hidden_dim_1': 512, 'hidden_dim_2': 1024, 'kl_weight': 0.00019799085686072738, 'lr': 0.005166225885408286, 'batch_size': 128, 'dropout_rate': 0.1379658180619604, 'prior_mu': -0.061814850487887554, 'prior_sigma': 0.08931822614428006, 'normalization': 'layer'}. Best is trial 896 with value: 0.4533553242683411.
Generating morgan_rdkit fingerprints...
Generated fingerprints with 2048 features for 841 molecules
Trial 2143: 5-fold CV loss = 0.4610
[I 2025-08-08 00:04:11,723] Trial 2143 finished with value: 0.46097400188446047 and parameters: {'fp_type': 'morgan_rdkit', 'combined_morgan_radius': 3, 'combined_morgan_nBits': 1024, 'combined_rdkit_maxPath': 7, 'combined_rdkit_nBits': 1024, 'num_hidden_layers': 3, 'hidden_dim_0': 256, 'hidden_dim_1': 512, 'hidden_dim_2': 64, 'kl_weight': 0.0003106611225252126, 'lr': 0.005573813908574979, 'batch_size': 128, 'dropout_rate': 0.1353766068166845, 'prior_mu': -0.014862948761514576, 'prior_sigma': 0.08556000742470847, 'normalization': 'layer'}. Best is trial 896 with value: 0.4533553242683411.
Generating morgan_rdkit fingerprints...
Generated fingerprints with 2048 features for 841 molecules
Trial 2144: 5-fold CV loss = 0.4679
[I 2025-08-08 00:04:18,769] Trial 2144 finished with value: 0.4679023861885071 and parameters: {'fp_type': 'morgan_rdkit', 'combined_morgan_radius': 3, 'combined_morgan_nBits': 1024, 'combined_rdkit_maxPath': 7, 'combined_rdkit_nBits': 1024, 'num_hidden_layers': 3, 'hidden_dim_0': 256, 'hidden_dim_1': 512, 'hidden_dim_2': 64, 'kl_weight': 0.0003073588498441997, 'lr': 0.004526701656934947, 'batch_size': 128, 'dropout_rate': 0.1385550799146276, 'prior_mu': -0.027665546336088597, 'prior_sigma': 0.0875121669889778, 'normalization': 'layer'}. Best is trial 896 with value: 0.4533553242683411.
Generating morgan_rdkit fingerprints...
Generated fingerprints with 2048 features for 841 molecules
Trial 2142: 5-fold CV loss = 0.5413
[I 2025-08-08 00:04:48,645] Trial 2142 finished with value: 0.5413383185863495 and parameters: {'fp_type': 'morgan_rdkit', 'combined_morgan_radius': 3, 'combined_morgan_nBits': 512, 'combined_rdkit_maxPath': 6, 'combined_rdkit_nBits': 1024, 'num_hidden_layers': 3, 'hidden_dim_0': 256, 'hidden_dim_1': 512, 'hidden_dim_2': 64, 'kl_weight': 0.0003679440247621556, 'lr': 0.005610046604930974, 'batch_size': 128, 'dropout_rate': 0.13735575218977422, 'prior_mu': -0.03280715306120876, 'prior_sigma': 0.0884131360767514, 'normalization': 'layer'}. Best is trial 896 with value: 0.4533553242683411.
Generating morgan_rdkit fingerprints...
Generated fingerprints with 2048 features for 841 molecules
Trial 2145: 5-fold CV loss = 0.4679
