[I 2025-08-08 01:13:12,070] Trial 2476 finished with value: 0.464572936296463 and parameters: {'fp_type': 'morgan_rdkit', 'combined_morgan_radius': 3, 'combined_morgan_nBits': 1024, 'combined_rdkit_maxPath': 7, 'combined_rdkit_nBits': 1024, 'num_hidden_layers': 3, 'hidden_dim_0': 256, 'hidden_dim_1': 1024, 'hidden_dim_2': 64, 'kl_weight': 0.0002228651548937761, 'lr': 0.008314896258111534, 'batch_size': 128, 'dropout_rate': 0.11694797114936198, 'prior_mu': -0.021657886381996533, 'prior_sigma': 0.08688027829803159, 'normalization': 'layer'}. Best is trial 896 with value: 0.4533553242683411.
Generating morgan_rdkit fingerprints...
Generated fingerprints with 2048 features for 841 molecules
Trial 2475: 5-fold CV loss = 0.5527
[I 2025-08-08 01:13:22,517] Trial 2475 finished with value: 0.5526973664760589 and parameters: {'fp_type': 'morgan_rdkit', 'combined_morgan_radius': 3, 'combined_morgan_nBits': 1024, 'combined_rdkit_maxPath': 7, 'combined_rdkit_nBits': 1024, 'num_hidden_layers': 3, 'hidden_dim_0': 256, 'hidden_dim_1': 1024, 'hidden_dim_2': 64, 'kl_weight': 0.00022983856105110524, 'lr': 0.00812583719893321, 'batch_size': 128, 'dropout_rate': 0.11299834409328553, 'prior_mu': -0.023291798756454103, 'prior_sigma': 0.09269952563927644, 'normalization': 'none'}. Best is trial 896 with value: 0.4533553242683411.
Generating morgan_rdkit fingerprints...
Generated fingerprints with 2048 features for 841 molecules
Trial 2479: 5-fold CV loss = 0.4861
[I 2025-08-08 01:13:38,331] Trial 2479 finished with value: 0.4861336052417755 and parameters: {'fp_type': 'morgan_rdkit', 'combined_morgan_radius': 3, 'combined_morgan_nBits': 1024, 'combined_rdkit_maxPath': 5, 'combined_rdkit_nBits': 1024, 'num_hidden_layers': 3, 'hidden_dim_0': 64, 'hidden_dim_1': 1024, 'hidden_dim_2': 64, 'kl_weight': 0.00023524355414880602, 'lr': 0.006929467257951158, 'batch_size': 128, 'dropout_rate': 0.09373330036371796, 'prior_mu': 0.015253876465089841, 'prior_sigma': 0.08273468991169278, 'normalization': 'layer'}. Best is trial 896 with value: 0.4533553242683411.
Generating morgan_rdkit fingerprints...
Generated fingerprints with 2048 features for 841 molecules
Trial 2477: 5-fold CV loss = 0.4634
[I 2025-08-08 01:13:59,451] Trial 2477 finished with value: 0.46344620585441587 and parameters: {'fp_type': 'morgan_rdkit', 'combined_morgan_radius': 3, 'combined_morgan_nBits': 1024, 'combined_rdkit_maxPath': 7, 'combined_rdkit_nBits': 1024, 'num_hidden_layers': 3, 'hidden_dim_0': 256, 'hidden_dim_1': 1024, 'hidden_dim_2': 64, 'kl_weight': 0.00023611819897478734, 'lr': 0.008671468451387892, 'batch_size': 128, 'dropout_rate': 0.11562196800566708, 'prior_mu': -0.021564281759207337, 'prior_sigma': 0.08653499487824333, 'normalization': 'layer'}. Best is trial 896 with value: 0.4533553242683411.
Generating morgan_rdkit fingerprints...
Generated fingerprints with 2048 features for 841 molecules
Trial 2480: 5-fold CV loss = 0.4791
[I 2025-08-08 01:14:12,651] Trial 2480 finished with value: 0.47910560965538024 and parameters: {'fp_type': 'morgan_rdkit', 'combined_morgan_radius': 3, 'combined_morgan_nBits': 1024, 'combined_rdkit_maxPath': 7, 'combined_rdkit_nBits': 1024, 'num_hidden_layers': 3, 'hidden_dim_0': 64, 'hidden_dim_1': 1024, 'hidden_dim_2': 64, 'kl_weight': 0.0002020960900399552, 'lr': 0.006882490499681269, 'batch_size': 128, 'dropout_rate': 0.09288429014700425, 'prior_mu': 0.027616818212046736, 'prior_sigma': 0.1177381992154626, 'normalization': 'layer'}. Best is trial 896 with value: 0.4533553242683411.
Generating morgan_rdkit fingerprints...
Generated fingerprints with 2048 features for 841 molecules
Trial 2481: 5-fold CV loss = 0.5470
[I 2025-08-08 01:14:14,949] Trial 2481 finished with value: 0.5470125079154968 and parameters: {'fp_type': 'morgan_rdkit', 'combined_morgan_radius': 3, 'combined_morgan_nBits': 1024, 'combined_rdkit_maxPath': 7, 'combined_rdkit_nBits': 1024, 'num_hidden_layers': 3, 'hidden_dim_0': 256, 'hidden_dim_1': 1024, 'hidden_dim_2': 64, 'kl_weight': 0.00017060605873239475, 'lr': 0.009939758039398837, 'batch_size': 128, 'dropout_rate': 0.08772500278268966, 'prior_mu': -0.010615025899290753, 'prior_sigma': 0.11757081041910142, 'normalization': 'layer'}. Best is trial 896 with value: 0.4533553242683411.
Generating morgan_rdkit fingerprints...
Generated fingerprints with 1536 features for 841 molecules
Trial 2478: 5-fold CV loss = 0.4780
[I 2025-08-08 01:14:22,219] Trial 2478 finished with value: 0.47799046635627745 and parameters: {'fp_type': 'morgan_rdkit', 'combined_morgan_radius': 3, 'combined_morgan_nBits': 1024, 'combined_rdkit_maxPath': 5, 'combined_rdkit_nBits': 1024, 'num_hidden_layers': 3, 'hidden_dim_0': 64, 'hidden_dim_1': 1024, 'hidden_dim_2': 64, 'kl_weight': 0.0007908995964265443, 'lr': 0.008500164225607197, 'batch_size': 128, 'dropout_rate': 0.11718974849014786, 'prior_mu': 0.02977975036700271, 'prior_sigma': 0.08650443062123449, 'normalization': 'layer'}. Best is trial 896 with value: 0.4533553242683411.
Generating morgan_rdkit fingerprints...
Generated fingerprints with 1536 features for 841 molecules
Trial 2484: 5-fold CV loss = 0.5738
[I 2025-08-08 01:14:44,452] Trial 2484 finished with value: 0.5737943708896637 and parameters: {'fp_type': 'morgan_rdkit', 'combined_morgan_radius': 3, 'combined_morgan_nBits': 1024, 'combined_rdkit_maxPath': 7, 'combined_rdkit_nBits': 512, 'num_hidden_layers': 3, 'hidden_dim_0': 256, 'hidden_dim_1': 1024, 'hidden_dim_2': 64, 'kl_weight': 0.00017367534740965333, 'lr': 0.0074700349528494395, 'batch_size': 128, 'dropout_rate': 0.10366280649077629, 'prior_mu': -0.05055715861799061, 'prior_sigma': 0.11316125382459036, 'normalization': 'layer'}. Best is trial 896 with value: 0.4533553242683411.
Generating morgan_rdkit fingerprints...
Generated fingerprints with 2048 features for 841 molecules
Trial 2483: 5-fold CV loss = 0.4689
[I 2025-08-08 01:14:54,308] Trial 2483 finished with value: 0.46892377734184265 and parameters: {'fp_type': 'morgan_rdkit', 'combined_morgan_radius': 3, 'combined_morgan_nBits': 1024, 'combined_rdkit_maxPath': 7, 'combined_rdkit_nBits': 1024, 'num_hidden_layers': 3, 'hidden_dim_0': 256, 'hidden_dim_1': 1024, 'hidden_dim_2': 64, 'kl_weight': 0.00017350214649449413, 'lr': 0.009130064079533956, 'batch_size': 128, 'dropout_rate': 0.1015864804394765, 'prior_mu': -0.011182527933093211, 'prior_sigma': 0.09725044570341859, 'normalization': 'layer'}. Best is trial 896 with value: 0.4533553242683411.
Generating morgan_rdkit fingerprints...
Generated fingerprints with 2048 features for 841 molecules
Trial 2482: 5-fold CV loss = 0.4848
[I 2025-08-08 01:15:01,155] Trial 2482 finished with value: 0.48475022315979005 and parameters: {'fp_type': 'morgan_rdkit', 'combined_morgan_radius': 3, 'combined_morgan_nBits': 1024, 'combined_rdkit_maxPath': 7, 'combined_rdkit_nBits': 1024, 'num_hidden_layers': 3, 'hidden_dim_0': 256, 'hidden_dim_1': 1024, 'hidden_dim_2': 64, 'kl_weight': 0.0010590604743160234, 'lr': 0.009985536205045746, 'batch_size': 128, 'dropout_rate': 0.0867182873631066, 'prior_mu': -0.011435061051160104, 'prior_sigma': 0.11577358548112367, 'normalization': 'layer'}. Best is trial 896 with value: 0.4533553242683411.
Generating morgan_rdkit fingerprints...
Generated fingerprints with 2048 features for 841 molecules
Trial 2486: 5-fold CV loss = 0.4654
[I 2025-08-08 01:15:24,716] Trial 2486 finished with value: 0.4654241740703583 and parameters: {'fp_type': 'morgan_rdkit', 'combined_morgan_radius': 3, 'combined_morgan_nBits': 1024, 'combined_rdkit_maxPath': 7, 'combined_rdkit_nBits': 1024, 'num_hidden_layers': 3, 'hidden_dim_0': 256, 'hidden_dim_1': 1024, 'hidden_dim_2': 64, 'kl_weight': 0.00012797546462016442, 'lr': 0.009236866919469322, 'batch_size': 128, 'dropout_rate': 0.07572088114788221, 'prior_mu': -0.04380542909459427, 'prior_sigma': 0.09552475498810847, 'normalization': 'layer'}. Best is trial 896 with value: 0.4533553242683411.
Generating morgan_rdkit fingerprints...
Generated fingerprints with 2048 features for 841 molecules
Trial 2489: 5-fold CV loss = 0.8943
[I 2025-08-08 01:15:37,830] Trial 2489 finished with value: 0.8942909836769104 and parameters: {'fp_type': 'morgan_rdkit', 'combined_morgan_radius': 3, 'combined_morgan_nBits': 1024, 'combined_rdkit_maxPath': 7, 'combined_rdkit_nBits': 1024, 'num_hidden_layers': 3, 'hidden_dim_0': 256, 'hidden_dim_1': 1024, 'hidden_dim_2': 1024, 'kl_weight': 0.00014647173539380308, 'lr': 0.007341871576143002, 'batch_size': 128, 'dropout_rate': 0.04944906604606088, 'prior_mu': 0.011022264497801772, 'prior_sigma': 0.08972509914492954, 'normalization': 'layer'}. Best is trial 896 with value: 0.4533553242683411.
Generating morgan_rdkit fingerprints...
Generated fingerprints with 2048 features for 841 molecules
Trial 2487: 5-fold CV loss = 0.4702
[I 2025-08-08 01:15:39,803] Trial 2487 finished with value: 0.47021721601486205 and parameters: {'fp_type': 'morgan_rdkit', 'combined_morgan_radius': 3, 'combined_morgan_nBits': 1024, 'combined_rdkit_maxPath': 7, 'combined_rdkit_nBits': 1024, 'num_hidden_layers': 3, 'hidden_dim_0': 1024, 'hidden_dim_1': 1024, 'hidden_dim_2': 64, 'kl_weight': 0.0001297249945232256, 'lr': 0.007490412504604846, 'batch_size': 128, 'dropout_rate': 0.07846660773020508, 'prior_mu': -0.04371255579581959, 'prior_sigma': 0.0823064657174754, 'normalization': 'layer'}. Best is trial 896 with value: 0.4533553242683411.
Generating morgan_rdkit fingerprints...
Generated fingerprints with 2048 features for 841 molecules
Trial 2485: 5-fold CV loss = 0.5848
[I 2025-08-08 01:15:44,206] Trial 2485 finished with value: 0.5847642719745636 and parameters: {'fp_type': 'morgan_rdkit', 'combined_morgan_radius': 3, 'combined_morgan_nBits': 1024, 'combined_rdkit_maxPath': 7, 'combined_rdkit_nBits': 512, 'num_hidden_layers': 3, 'hidden_dim_0': 256, 'hidden_dim_1': 1024, 'hidden_dim_2': 64, 'kl_weight': 0.00018271357053288757, 'lr': 0.007475337321984646, 'batch_size': 128, 'dropout_rate': 0.07662914027312495, 'prior_mu': -0.101087111782536, 'prior_sigma': 0.11181449324868621, 'normalization': 'layer'}. Best is trial 896 with value: 0.4533553242683411.
Generating morgan_rdkit fingerprints...
Generated fingerprints with 2048 features for 841 molecules
Trial 2488: 5-fold CV loss = 0.4676
[I 2025-08-08 01:15:55,719] Trial 2488 finished with value: 0.4676193714141846 and parameters: {'fp_type': 'morgan_rdkit', 'combined_morgan_radius': 3, 'combined_morgan_nBits': 1024, 'combined_rdkit_maxPath': 7, 'combined_rdkit_nBits': 1024, 'num_hidden_layers': 3, 'hidden_dim_0': 1024, 'hidden_dim_1': 1024, 'hidden_dim_2': 64, 'kl_weight': 0.00020283007083332264, 'lr': 0.007536073750381216, 'batch_size': 128, 'dropout_rate': 0.05773206116996618, 'prior_mu': -0.030964924048878135, 'prior_sigma': 0.07940942352296369, 'normalization': 'layer'}. Best is trial 896 with value: 0.4533553242683411.
Generating morgan_rdkit fingerprints...
Generated fingerprints with 2048 features for 841 molecules
Trial 2490: 5-fold CV loss = 0.4699
[I 2025-08-08 01:16:18,571] Trial 2490 finished with value: 0.4699429988861084 and parameters: {'fp_type': 'morgan_rdkit', 'combined_morgan_radius': 3, 'combined_morgan_nBits': 1024, 'combined_rdkit_maxPath': 7, 'combined_rdkit_nBits': 1024, 'num_hidden_layers': 3, 'hidden_dim_0': 1024, 'hidden_dim_1': 1024, 'hidden_dim_2': 64, 'kl_weight': 0.00018954883013238215, 'lr': 0.0067965624826960514, 'batch_size': 128, 'dropout_rate': 0.06027598634551708, 'prior_mu': -0.031359313401435544, 'prior_sigma': 0.08150339781109552, 'normalization': 'layer'}. Best is trial 896 with value: 0.4533553242683411.
Generating morgan_rdkit fingerprints...
Generated fingerprints with 2048 features for 841 molecules
Trial 2493: 5-fold CV loss = 0.8039
[I 2025-08-08 01:16:23,898] Trial 2493 finished with value: 0.8038567841053009 and parameters: {'fp_type': 'morgan_rdkit', 'combined_morgan_radius': 2, 'combined_morgan_nBits': 1024, 'combined_rdkit_maxPath': 7, 'combined_rdkit_nBits': 1024, 'num_hidden_layers': 3, 'hidden_dim_0': 256, 'hidden_dim_1': 1024, 'hidden_dim_2': 256, 'kl_weight': 0.00024250752415462388, 'lr': 0.006807577352039827, 'batch_size': 128, 'dropout_rate': 0.11087209093684666, 'prior_mu': -0.07934573685288904, 'prior_sigma': 0.10084438866714115, 'normalization': 'layer'}. Best is trial 896 with value: 0.4533553242683411.
Generating morgan_rdkit fingerprints...
Generated fingerprints with 2048 features for 841 molecules
Trial 2491: 5-fold CV loss = 0.4573
[I 2025-08-08 01:16:29,101] Trial 2491 finished with value: 0.4572541296482086 and parameters: {'fp_type': 'morgan_rdkit', 'combined_morgan_radius': 3, 'combined_morgan_nBits': 1024, 'combined_rdkit_maxPath': 7, 'combined_rdkit_nBits': 1024, 'num_hidden_layers': 3, 'hidden_dim_0': 256, 'hidden_dim_1': 1024, 'hidden_dim_2': 64, 'kl_weight': 0.0001956268966259069, 'lr': 0.006815969195502765, 'batch_size': 128, 'dropout_rate': 0.1088470817127445, 'prior_mu': -0.07621411489879318, 'prior_sigma': 0.10126242727009711, 'normalization': 'layer'}. Best is trial 896 with value: 0.4533553242683411.
Generating morgan_rdkit fingerprints...
Generated fingerprints with 2048 features for 841 molecules
Trial 2494: 5-fold CV loss = 0.5407
[I 2025-08-08 01:16:59,474] Trial 2494 finished with value: 0.540733814239502 and parameters: {'fp_type': 'morgan_rdkit', 'combined_morgan_radius': 3, 'combined_morgan_nBits': 1024, 'combined_rdkit_maxPath': 7, 'combined_rdkit_nBits': 1024, 'num_hidden_layers': 3, 'hidden_dim_0': 256, 'hidden_dim_1': 1024, 'hidden_dim_2': 256, 'kl_weight': 0.00024123299466387164, 'lr': 0.008576610858939312, 'batch_size': 128, 'dropout_rate': 0.09743269307015232, 'prior_mu': -0.04765886491804009, 'prior_sigma': 0.09848677190006568, 'normalization': 'layer'}. Best is trial 896 with value: 0.4533553242683411.
Generating morgan_rdkit fingerprints...
Generated fingerprints with 2048 features for 841 molecules
Trial 2496: 5-fold CV loss = 0.4645
[I 2025-08-08 01:17:17,164] Trial 2496 finished with value: 0.46451085805892944 and parameters: {'fp_type': 'morgan_rdkit', 'combined_morgan_radius': 3, 'combined_morgan_nBits': 1024, 'combined_rdkit_maxPath': 7, 'combined_rdkit_nBits': 1024, 'num_hidden_layers': 3, 'hidden_dim_0': 256, 'hidden_dim_1': 1024, 'hidden_dim_2': 64, 'kl_weight': 0.00022045360056411516, 'lr': 0.0065715012221238996, 'batch_size': 128, 'dropout_rate': 0.10840320544679813, 'prior_mu': -0.016065153948695912, 'prior_sigma': 0.10609166166935856, 'normalization': 'layer'}. Best is trial 896 with value: 0.4533553242683411.
Generating morgan_rdkit fingerprints...
Generated fingerprints with 2048 features for 841 molecules
Trial 2492: 5-fold CV loss = 0.4868
[I 2025-08-08 01:17:25,514] Trial 2492 finished with value: 0.48683985471725466 and parameters: {'fp_type': 'morgan_rdkit', 'combined_morgan_radius': 2, 'combined_morgan_nBits': 1024, 'combined_rdkit_maxPath': 7, 'combined_rdkit_nBits': 1024, 'num_hidden_layers': 3, 'hidden_dim_0': 256, 'hidden_dim_1': 1024, 'hidden_dim_2': 64, 'kl_weight': 0.01891747015233078, 'lr': 0.006767178734210123, 'batch_size': 128, 'dropout_rate': 0.10835407966023747, 'prior_mu': -0.0789980725119181, 'prior_sigma': 0.10180518094130747, 'normalization': 'layer'}. Best is trial 896 with value: 0.4533553242683411.
Generating morgan_rdkit fingerprints...
Generated fingerprints with 2048 features for 841 molecules
Trial 2495: 5-fold CV loss = 0.4687
[I 2025-08-08 01:17:27,030] Trial 2495 finished with value: 0.4686814725399017 and parameters: {'fp_type': 'morgan_rdkit', 'combined_morgan_radius': 3, 'combined_morgan_nBits': 1024, 'combined_rdkit_maxPath': 7, 'combined_rdkit_nBits': 1024, 'num_hidden_layers': 3, 'hidden_dim_0': 256, 'hidden_dim_1': 1024, 'hidden_dim_2': 64, 'kl_weight': 0.00015451818801988062, 'lr': 0.008306311459382116, 'batch_size': 128, 'dropout_rate': 0.09795824125521171, 'prior_mu': -0.01628343657302921, 'prior_sigma': 0.09190119465789748, 'normalization': 'layer'}. Best is trial 896 with value: 0.4533553242683411.
Generating morgan fingerprints...
Generated fingerprints with 2048 features for 841 molecules
Trial 2497: 5-fold CV loss = 0.4682
[I 2025-08-08 01:17:39,289] Trial 2497 finished with value: 0.46815463304519656 and parameters: {'fp_type': 'morgan_rdkit', 'combined_morgan_radius': 3, 'combined_morgan_nBits': 1024, 'combined_rdkit_maxPath': 7, 'combined_rdkit_nBits': 1024, 'num_hidden_layers': 3, 'hidden_dim_0': 256, 'hidden_dim_1': 1024, 'hidden_dim_2': 64, 'kl_weight': 0.00022128961905261375, 'lr': 0.00650103420752426, 'batch_size': 128, 'dropout_rate': 0.10752585491928757, 'prior_mu': -0.10699810607544016, 'prior_sigma': 0.10838143468659128, 'normalization': 'layer'}. Best is trial 896 with value: 0.4533553242683411.
Generating rdkit fingerprints...
Generated fingerprints with 1024 features for 841 molecules
Trial 2498: 5-fold CV loss = 0.4701
[I 2025-08-08 01:18:01,874] Trial 2498 finished with value: 0.4700692355632782 and parameters: {'fp_type': 'morgan_rdkit', 'combined_morgan_radius': 3, 'combined_morgan_nBits': 1024, 'combined_rdkit_maxPath': 7, 'combined_rdkit_nBits': 1024, 'num_hidden_layers': 3, 'hidden_dim_0': 256, 'hidden_dim_1': 1024, 'hidden_dim_2': 64, 'kl_weight': 0.00021184172330413107, 'lr': 0.006673871404101989, 'batch_size': 128, 'dropout_rate': 0.10886232424353473, 'prior_mu': 0.03908142939208534, 'prior_sigma': 0.1111539527537993, 'normalization': 'layer'}. Best is trial 896 with value: 0.4533553242683411.
Generating rdkit fingerprints...
Generated fingerprints with 1024 features for 841 molecules
Trial 2500: 5-fold CV loss = 0.5285
[I 2025-08-08 01:18:05,485] Trial 2500 finished with value: 0.5284832358360291 and parameters: {'fp_type': 'morgan', 'morgan_only_radius': 3, 'morgan_only_nBits': 2048, 'num_hidden_layers': 3, 'hidden_dim_0': 256, 'hidden_dim_1': 128, 'hidden_dim_2': 64, 'kl_weight': 0.00021046659323861025, 'lr': 0.006747131775656438, 'batch_size': 128, 'dropout_rate': 0.11548699169369624, 'prior_mu': -0.029075985689083934, 'prior_sigma': 0.10802541354437213, 'normalization': 'layer'}. Best is trial 896 with value: 0.4533553242683411.
Generating rdkit fingerprints...
Generated fingerprints with 1024 features for 841 molecules
Trial 2502: 5-fold CV loss = 0.6684
[I 2025-08-08 01:18:44,372] Trial 2502 finished with value: 0.6684241175651551 and parameters: {'fp_type': 'rdkit', 'rdkit_only_maxPath': 8, 'rdkit_only_nBits': 1024, 'num_hidden_layers': 3, 'hidden_dim_0': 256, 'hidden_dim_1': 1024, 'hidden_dim_2': 64, 'kl_weight': 0.0002329934542682364, 'lr': 0.006742751304092344, 'batch_size': 128, 'dropout_rate': 0.11573521539047989, 'prior_mu': -0.031205714343360596, 'prior_sigma': 0.1089451936247052, 'normalization': 'layer'}. Best is trial 896 with value: 0.4533553242683411.
Generating morgan_rdkit fingerprints...
Generated fingerprints with 2048 features for 841 molecules
Trial 2499: 5-fold CV loss = 0.4639
[I 2025-08-08 01:19:15,311] Trial 2499 finished with value: 0.4638708710670471 and parameters: {'fp_type': 'morgan_rdkit', 'combined_morgan_radius': 3, 'combined_morgan_nBits': 1024, 'combined_rdkit_maxPath': 7, 'combined_rdkit_nBits': 1024, 'num_hidden_layers': 3, 'hidden_dim_0': 256, 'hidden_dim_1': 1024, 'hidden_dim_2': 64, 'kl_weight': 0.00020251894256582436, 'lr': 0.006670014908567698, 'batch_size': 128, 'dropout_rate': 0.11278261180994766, 'prior_mu': -0.030013547608707232, 'prior_sigma': 0.1076075922558339, 'normalization': 'layer'}. Best is trial 896 with value: 0.4533553242683411.
Generating morgan_rdkit fingerprints...
Generated fingerprints with 2048 features for 841 molecules
Trial 2501: 5-fold CV loss = 0.5105
[I 2025-08-08 01:19:36,986] Trial 2501 finished with value: 0.5104678809642792 and parameters: {'fp_type': 'rdkit', 'rdkit_only_maxPath': 8, 'rdkit_only_nBits': 1024, 'num_hidden_layers': 3, 'hidden_dim_0': 256, 'hidden_dim_1': 1024, 'hidden_dim_2': 64, 'kl_weight': 0.00020471484922821059, 'lr': 0.006511425066865233, 'batch_size': 32, 'dropout_rate': 0.11890639804878395, 'prior_mu': -0.11932309780799344, 'prior_sigma': 0.11138399725178559, 'normalization': 'layer'}. Best is trial 896 with value: 0.4533553242683411.
Generating morgan_rdkit fingerprints...
Generated fingerprints with 2048 features for 841 molecules
Trial 2506: 5-fold CV loss = 0.6302
[I 2025-08-08 01:20:22,082] Trial 2506 finished with value: 0.6301930725574494 and parameters: {'fp_type': 'morgan_rdkit', 'combined_morgan_radius': 3, 'combined_morgan_nBits': 1024, 'combined_rdkit_maxPath': 7, 'combined_rdkit_nBits': 1024, 'num_hidden_layers': 3, 'hidden_dim_0': 256, 'hidden_dim_1': 1024, 'hidden_dim_2': 512, 'kl_weight': 0.007710122445378324, 'lr': 0.007029226665276065, 'batch_size': 64, 'dropout_rate': 0.09946942246177504, 'prior_mu': -0.10372966330909097, 'prior_sigma': 0.0795772640616542, 'normalization': 'layer'}. Best is trial 896 with value: 0.4533553242683411.
Generating morgan_rdkit fingerprints...
Generated fingerprints with 2048 features for 841 molecules
Trial 2504: 5-fold CV loss = 0.4784
[I 2025-08-08 01:20:36,712] Trial 2504 finished with value: 0.47838225960731506 and parameters: {'fp_type': 'morgan_rdkit', 'combined_morgan_radius': 3, 'combined_morgan_nBits': 1024, 'combined_rdkit_maxPath': 7, 'combined_rdkit_nBits': 1024, 'num_hidden_layers': 3, 'hidden_dim_0': 256, 'hidden_dim_1': 1024, 'hidden_dim_2': 512, 'kl_weight': 0.00024635396841671216, 'lr': 0.00691101885734724, 'batch_size': 32, 'dropout_rate': 0.11940056458290395, 'prior_mu': -0.11047337549570974, 'prior_sigma': 0.13501484271019168, 'normalization': 'layer'}. Best is trial 896 with value: 0.4533553242683411.
Generating morgan_rdkit fingerprints...
Generated fingerprints with 2048 features for 841 molecules
Trial 2507: 5-fold CV loss = 0.4652
