[I 2025-08-07 20:52:59,526] Trial 1153 finished with value: 0.5530666172504425 and parameters: {'fp_type': 'rdkit', 'rdkit_only_maxPath': 7, 'rdkit_only_nBits': 1024, 'num_hidden_layers': 3, 'hidden_dim_0': 256, 'hidden_dim_1': 1024, 'hidden_dim_2': 64, 'kl_weight': 0.0004387328137425948, 'lr': 0.006756739565002784, 'batch_size': 128, 'dropout_rate': 0.09662182681947905, 'prior_mu': -0.0032431387095804495, 'prior_sigma': 0.09880262608321466, 'normalization': 'layer'}. Best is trial 896 with value: 0.4533553242683411.
Generating morgan_rdkit fingerprints...
Generated fingerprints with 2048 features for 841 molecules
Trial 1157: 5-fold CV loss = 0.5166
[I 2025-08-07 20:53:04,427] Trial 1157 finished with value: 0.5166067004203796 and parameters: {'fp_type': 'morgan_rdkit', 'combined_morgan_radius': 3, 'combined_morgan_nBits': 1024, 'combined_rdkit_maxPath': 7, 'combined_rdkit_nBits': 1024, 'num_hidden_layers': 1, 'hidden_dim_0': 256, 'kl_weight': 0.0004599617124664962, 'lr': 0.004860620949486615, 'batch_size': 128, 'dropout_rate': 0.06263028775284812, 'prior_mu': -0.023944683374682772, 'prior_sigma': 0.10746716840647355, 'normalization': 'layer'}. Best is trial 896 with value: 0.4533553242683411.
Generating morgan_rdkit fingerprints...
Generated fingerprints with 2048 features for 841 molecules
Trial 1158: 5-fold CV loss = 0.4628
[I 2025-08-07 20:53:29,191] Trial 1158 finished with value: 0.46275978684425356 and parameters: {'fp_type': 'morgan_rdkit', 'combined_morgan_radius': 3, 'combined_morgan_nBits': 1024, 'combined_rdkit_maxPath': 7, 'combined_rdkit_nBits': 1024, 'num_hidden_layers': 3, 'hidden_dim_0': 256, 'hidden_dim_1': 1024, 'hidden_dim_2': 64, 'kl_weight': 0.00046716680511145524, 'lr': 0.0049125717465645915, 'batch_size': 128, 'dropout_rate': 0.11142947567173435, 'prior_mu': -0.024048075465715628, 'prior_sigma': 0.07006729177732457, 'normalization': 'layer'}. Best is trial 896 with value: 0.4533553242683411.
Generating morgan_rdkit fingerprints...
Generated fingerprints with 2048 features for 841 molecules
Trial 1160: 5-fold CV loss = 0.4644
[I 2025-08-07 20:53:38,895] Trial 1160 finished with value: 0.46438429951667787 and parameters: {'fp_type': 'morgan_rdkit', 'combined_morgan_radius': 3, 'combined_morgan_nBits': 1024, 'combined_rdkit_maxPath': 7, 'combined_rdkit_nBits': 1024, 'num_hidden_layers': 3, 'hidden_dim_0': 256, 'hidden_dim_1': 1024, 'hidden_dim_2': 64, 'kl_weight': 0.0002053348361760433, 'lr': 0.006392695201936784, 'batch_size': 128, 'dropout_rate': 0.128313365735779, 'prior_mu': -0.03725470674795146, 'prior_sigma': 0.07077075813276967, 'normalization': 'layer'}. Best is trial 896 with value: 0.4533553242683411.
Generating morgan_rdkit fingerprints...
Generated fingerprints with 2048 features for 841 molecules
Trial 1154: 5-fold CV loss = 0.6598
[I 2025-08-07 20:53:43,499] Trial 1154 finished with value: 0.6598122596740723 and parameters: {'fp_type': 'rdkit', 'rdkit_only_maxPath': 7, 'rdkit_only_nBits': 1024, 'num_hidden_layers': 3, 'hidden_dim_0': 256, 'hidden_dim_1': 1024, 'hidden_dim_2': 64, 'kl_weight': 0.00020773578405961312, 'lr': 0.005729895217505248, 'batch_size': 128, 'dropout_rate': 0.1383658325146062, 'prior_mu': 0.011995022671288241, 'prior_sigma': 0.10754450969403068, 'normalization': 'layer'}. Best is trial 896 with value: 0.4533553242683411.
Generating morgan_rdkit fingerprints...
Generated fingerprints with 2048 features for 841 molecules
Trial 1159: 5-fold CV loss = 0.4692
[I 2025-08-07 20:53:54,063] Trial 1159 finished with value: 0.4692206263542175 and parameters: {'fp_type': 'morgan_rdkit', 'combined_morgan_radius': 3, 'combined_morgan_nBits': 1024, 'combined_rdkit_maxPath': 7, 'combined_rdkit_nBits': 1024, 'num_hidden_layers': 3, 'hidden_dim_0': 256, 'hidden_dim_1': 1024, 'hidden_dim_2': 64, 'kl_weight': 0.00020426891401031333, 'lr': 0.005036231662005196, 'batch_size': 128, 'dropout_rate': 0.11077101017180135, 'prior_mu': -0.025548420098026735, 'prior_sigma': 0.06969458441528201, 'normalization': 'layer'}. Best is trial 896 with value: 0.4533553242683411.
Generating morgan_rdkit fingerprints...
Generated fingerprints with 2048 features for 841 molecules
Trial 1161: 5-fold CV loss = 0.5649
[I 2025-08-07 20:54:10,474] Trial 1161 finished with value: 0.5649035334587097 and parameters: {'fp_type': 'morgan_rdkit', 'combined_morgan_radius': 3, 'combined_morgan_nBits': 1024, 'combined_rdkit_maxPath': 7, 'combined_rdkit_nBits': 1024, 'num_hidden_layers': 3, 'hidden_dim_0': 256, 'hidden_dim_1': 64, 'hidden_dim_2': 64, 'kl_weight': 0.00020159458486980892, 'lr': 0.00633800534097116, 'batch_size': 128, 'dropout_rate': 0.12759471015232834, 'prior_mu': -0.03721537043280827, 'prior_sigma': 0.07912865032591497, 'normalization': 'layer'}. Best is trial 896 with value: 0.4533553242683411.
Generating morgan_rdkit fingerprints...
Generated fingerprints with 2048 features for 841 molecules
Trial 1164: 5-fold CV loss = 0.8022
[I 2025-08-07 20:54:22,254] Trial 1164 finished with value: 0.8021901965141296 and parameters: {'fp_type': 'morgan_rdkit', 'combined_morgan_radius': 3, 'combined_morgan_nBits': 1024, 'combined_rdkit_maxPath': 7, 'combined_rdkit_nBits': 1024, 'num_hidden_layers': 3, 'hidden_dim_0': 256, 'hidden_dim_1': 1024, 'hidden_dim_2': 512, 'kl_weight': 0.000316765946828894, 'lr': 0.007228800954825105, 'batch_size': 128, 'dropout_rate': 0.14708009761182875, 'prior_mu': -0.013612635550892496, 'prior_sigma': 0.08464454895015149, 'normalization': 'layer'}. Best is trial 896 with value: 0.4533553242683411.
Generating morgan_rdkit fingerprints...
Generated fingerprints with 2048 features for 841 molecules
Trial 1162: 5-fold CV loss = 0.4788
[I 2025-08-07 20:54:23,812] Trial 1162 finished with value: 0.4787593066692352 and parameters: {'fp_type': 'morgan_rdkit', 'combined_morgan_radius': 3, 'combined_morgan_nBits': 1024, 'combined_rdkit_maxPath': 7, 'combined_rdkit_nBits': 1024, 'num_hidden_layers': 3, 'hidden_dim_0': 256, 'hidden_dim_1': 64, 'hidden_dim_2': 64, 'kl_weight': 0.0003217433737386328, 'lr': 0.004001716523680654, 'batch_size': 128, 'dropout_rate': 0.14331858772230957, 'prior_mu': -0.014468336765040524, 'prior_sigma': 0.08644225007225155, 'normalization': 'layer'}. Best is trial 896 with value: 0.4533553242683411.
Generating morgan_rdkit fingerprints...
Generated fingerprints with 2048 features for 841 molecules
Trial 1165: 5-fold CV loss = 0.5578
[I 2025-08-07 20:54:46,275] Trial 1165 finished with value: 0.5578087270259857 and parameters: {'fp_type': 'morgan_rdkit', 'combined_morgan_radius': 3, 'combined_morgan_nBits': 1024, 'combined_rdkit_maxPath': 7, 'combined_rdkit_nBits': 1024, 'num_hidden_layers': 3, 'hidden_dim_0': 256, 'hidden_dim_1': 1024, 'hidden_dim_2': 64, 'kl_weight': 0.00031035621058234737, 'lr': 0.0072282365782217846, 'batch_size': 128, 'dropout_rate': 0.14757054922837962, 'prior_mu': -0.012439676458626451, 'prior_sigma': 0.0857531113841682, 'normalization': 'layer'}. Best is trial 896 with value: 0.4533553242683411.
Generating morgan_rdkit fingerprints...
Generated fingerprints with 2048 features for 841 molecules
Trial 1167: 5-fold CV loss = 0.4637
[I 2025-08-07 20:54:55,997] Trial 1167 finished with value: 0.463665235042572 and parameters: {'fp_type': 'morgan_rdkit', 'combined_morgan_radius': 3, 'combined_morgan_nBits': 1024, 'combined_rdkit_maxPath': 7, 'combined_rdkit_nBits': 1024, 'num_hidden_layers': 3, 'hidden_dim_0': 256, 'hidden_dim_1': 1024, 'hidden_dim_2': 64, 'kl_weight': 0.00038793723677245427, 'lr': 0.004407852469093097, 'batch_size': 128, 'dropout_rate': 0.07956765505462776, 'prior_mu': -0.04663168006218388, 'prior_sigma': 0.05982216629488448, 'normalization': 'layer'}. Best is trial 896 with value: 0.4533553242683411.
Generating morgan_rdkit fingerprints...
Generated fingerprints with 2048 features for 841 molecules
Trial 1166: 5-fold CV loss = 0.4695
[I 2025-08-07 20:55:29,504] Trial 1166 finished with value: 0.46947053670883176 and parameters: {'fp_type': 'morgan_rdkit', 'combined_morgan_radius': 3, 'combined_morgan_nBits': 1024, 'combined_rdkit_maxPath': 7, 'combined_rdkit_nBits': 1024, 'num_hidden_layers': 3, 'hidden_dim_0': 256, 'hidden_dim_1': 1024, 'hidden_dim_2': 64, 'kl_weight': 0.0003809950158007776, 'lr': 0.003980724790462723, 'batch_size': 128, 'dropout_rate': 0.08423883489462894, 'prior_mu': -0.05856413047042014, 'prior_sigma': 0.09137652303979278, 'normalization': 'layer'}. Best is trial 896 with value: 0.4533553242683411.
Generating morgan_rdkit fingerprints...
Generated fingerprints with 2048 features for 841 molecules
Trial 1168: 5-fold CV loss = 0.4689
[I 2025-08-07 20:55:31,331] Trial 1168 finished with value: 0.46885895133018496 and parameters: {'fp_type': 'morgan_rdkit', 'combined_morgan_radius': 3, 'combined_morgan_nBits': 1024, 'combined_rdkit_maxPath': 7, 'combined_rdkit_nBits': 1024, 'num_hidden_layers': 3, 'hidden_dim_0': 256, 'hidden_dim_1': 1024, 'hidden_dim_2': 64, 'kl_weight': 0.0003895484519408572, 'lr': 0.008081617680177833, 'batch_size': 64, 'dropout_rate': 0.08701726126971286, 'prior_mu': -0.058216506462600515, 'prior_sigma': 0.09250370351755624, 'normalization': 'layer'}. Best is trial 896 with value: 0.4533553242683411.
Generating morgan_rdkit fingerprints...
Generated fingerprints with 2048 features for 841 molecules
Trial 1163: 5-fold CV loss = 0.4732
[I 2025-08-07 20:55:37,539] Trial 1163 finished with value: 0.473164427280426 and parameters: {'fp_type': 'morgan_rdkit', 'combined_morgan_radius': 3, 'combined_morgan_nBits': 1024, 'combined_rdkit_maxPath': 7, 'combined_rdkit_nBits': 1024, 'num_hidden_layers': 3, 'hidden_dim_0': 256, 'hidden_dim_1': 64, 'hidden_dim_2': 64, 'kl_weight': 0.00031008892361035414, 'lr': 0.007136542389558036, 'batch_size': 128, 'dropout_rate': 0.1457372465051072, 'prior_mu': -0.010667113417609734, 'prior_sigma': 0.08579415931054954, 'normalization': 'layer'}. Best is trial 896 with value: 0.4533553242683411.
Generating morgan_rdkit fingerprints...
Generated fingerprints with 2048 features for 841 molecules
Trial 1169: 5-fold CV loss = 0.4651
[I 2025-08-07 20:55:42,623] Trial 1169 finished with value: 0.4650949418544769 and parameters: {'fp_type': 'morgan_rdkit', 'combined_morgan_radius': 3, 'combined_morgan_nBits': 1024, 'combined_rdkit_maxPath': 7, 'combined_rdkit_nBits': 1024, 'num_hidden_layers': 3, 'hidden_dim_0': 256, 'hidden_dim_1': 1024, 'hidden_dim_2': 64, 'kl_weight': 0.00025975002276121484, 'lr': 0.00839520756795205, 'batch_size': 64, 'dropout_rate': 0.11944161561913794, 'prior_mu': -0.021202024733014236, 'prior_sigma': 0.09216953631484774, 'normalization': 'layer'}. Best is trial 896 with value: 0.4533553242683411.
Generating morgan_rdkit fingerprints...
Generated fingerprints with 2048 features for 841 molecules
Trial 1171: 5-fold CV loss = 0.4609
[I 2025-08-07 20:56:09,863] Trial 1171 finished with value: 0.4608877539634705 and parameters: {'fp_type': 'morgan_rdkit', 'combined_morgan_radius': 3, 'combined_morgan_nBits': 1024, 'combined_rdkit_maxPath': 7, 'combined_rdkit_nBits': 1024, 'num_hidden_layers': 3, 'hidden_dim_0': 256, 'hidden_dim_1': 1024, 'hidden_dim_2': 64, 'kl_weight': 0.00025528331661608304, 'lr': 0.005917287638844928, 'batch_size': 128, 'dropout_rate': 0.11911675846070453, 'prior_mu': 0.0035188853301906537, 'prior_sigma': 0.06597152679073366, 'normalization': 'layer'}. Best is trial 896 with value: 0.4533553242683411.
Generating morgan_rdkit fingerprints...
Generated fingerprints with 2048 features for 841 molecules
Trial 1173: 5-fold CV loss = 0.4564
[I 2025-08-07 20:56:19,253] Trial 1173 finished with value: 0.45644278526306153 and parameters: {'fp_type': 'morgan_rdkit', 'combined_morgan_radius': 3, 'combined_morgan_nBits': 1024, 'combined_rdkit_maxPath': 7, 'combined_rdkit_nBits': 1024, 'num_hidden_layers': 3, 'hidden_dim_0': 256, 'hidden_dim_1': 1024, 'hidden_dim_2': 64, 'kl_weight': 0.00023944855249869452, 'lr': 0.006016161615197138, 'batch_size': 128, 'dropout_rate': 0.10833292692057533, 'prior_mu': 0.00046633952257770124, 'prior_sigma': 0.07473207692538275, 'normalization': 'layer'}. Best is trial 896 with value: 0.4533553242683411.
Generating morgan_rdkit fingerprints...
Generated fingerprints with 2048 features for 841 molecules
Trial 1170: 5-fold CV loss = 0.4696
[I 2025-08-07 20:56:41,035] Trial 1170 finished with value: 0.4695947468280792 and parameters: {'fp_type': 'morgan_rdkit', 'combined_morgan_radius': 3, 'combined_morgan_nBits': 1024, 'combined_rdkit_maxPath': 7, 'combined_rdkit_nBits': 1024, 'num_hidden_layers': 3, 'hidden_dim_0': 256, 'hidden_dim_1': 1024, 'hidden_dim_2': 64, 'kl_weight': 0.0002572612950634985, 'lr': 0.008497724079638076, 'batch_size': 64, 'dropout_rate': 0.12354110120309003, 'prior_mu': -0.021715879393707487, 'prior_sigma': 0.06604169691660208, 'normalization': 'layer'}. Best is trial 896 with value: 0.4533553242683411.
Generating morgan_rdkit fingerprints...
Generated fingerprints with 2048 features for 841 molecules
Trial 1175: 5-fold CV loss = 0.5355
[I 2025-08-07 20:56:49,111] Trial 1175 finished with value: 0.5355299949645996 and parameters: {'fp_type': 'morgan_rdkit', 'combined_morgan_radius': 3, 'combined_morgan_nBits': 1024, 'combined_rdkit_maxPath': 7, 'combined_rdkit_nBits': 1024, 'num_hidden_layers': 3, 'hidden_dim_0': 256, 'hidden_dim_1': 128, 'hidden_dim_2': 64, 'kl_weight': 0.0002708172977130751, 'lr': 0.006503186442365195, 'batch_size': 128, 'dropout_rate': 0.10570213781843034, 'prior_mu': 0.02121436553187671, 'prior_sigma': 0.07706038891554373, 'normalization': 'layer'}. Best is trial 896 with value: 0.4533553242683411.
Generating morgan_rdkit fingerprints...
Generated fingerprints with 2048 features for 841 molecules
Trial 1174: 5-fold CV loss = 0.6376
[I 2025-08-07 20:56:50,975] Trial 1174 finished with value: 0.6376377940177917 and parameters: {'fp_type': 'morgan_rdkit', 'combined_morgan_radius': 3, 'combined_morgan_nBits': 1024, 'combined_rdkit_maxPath': 7, 'combined_rdkit_nBits': 1024, 'num_hidden_layers': 3, 'hidden_dim_0': 256, 'hidden_dim_1': 1024, 'hidden_dim_2': 64, 'kl_weight': 0.00027882421897699815, 'lr': 0.006087872290004749, 'batch_size': 128, 'dropout_rate': 0.10792726282668569, 'prior_mu': -0.033197348183197396, 'prior_sigma': 0.1290536687871256, 'normalization': 'layer'}. Best is trial 896 with value: 0.4533553242683411.
Generating morgan_rdkit fingerprints...
Generated fingerprints with 2048 features for 841 molecules
Trial 1177: 5-fold CV loss = 0.4626
[I 2025-08-07 20:57:25,998] Trial 1177 finished with value: 0.4626008927822113 and parameters: {'fp_type': 'morgan_rdkit', 'combined_morgan_radius': 3, 'combined_morgan_nBits': 1024, 'combined_rdkit_maxPath': 7, 'combined_rdkit_nBits': 1024, 'num_hidden_layers': 3, 'hidden_dim_0': 256, 'hidden_dim_1': 1024, 'hidden_dim_2': 64, 'kl_weight': 0.0003479572939707161, 'lr': 0.006484234839862478, 'batch_size': 128, 'dropout_rate': 0.10916361198949634, 'prior_mu': 0.0035989803883097384, 'prior_sigma': 0.08053939809454982, 'normalization': 'layer'}. Best is trial 896 with value: 0.4533553242683411.
Generating morgan_rdkit fingerprints...
Generated fingerprints with 2048 features for 841 molecules
Trial 1176: 5-fold CV loss = 0.6501
[I 2025-08-07 20:57:27,137] Trial 1176 finished with value: 0.6500859081745147 and parameters: {'fp_type': 'morgan_rdkit', 'combined_morgan_radius': 3, 'combined_morgan_nBits': 1024, 'combined_rdkit_maxPath': 7, 'combined_rdkit_nBits': 1024, 'num_hidden_layers': 3, 'hidden_dim_0': 256, 'hidden_dim_1': 1024, 'hidden_dim_2': 64, 'kl_weight': 0.00027939434973287154, 'lr': 0.006645692076507663, 'batch_size': 128, 'dropout_rate': 0.1021255854441097, 'prior_mu': 0.019808716733183556, 'prior_sigma': 0.12316466324250963, 'normalization': 'layer'}. Best is trial 896 with value: 0.4533553242683411.
Generating morgan_rdkit fingerprints...
Generated fingerprints with 2048 features for 841 molecules
Trial 1178: 5-fold CV loss = 0.4636
[I 2025-08-07 20:57:33,558] Trial 1178 finished with value: 0.46359339356422424 and parameters: {'fp_type': 'morgan_rdkit', 'combined_morgan_radius': 3, 'combined_morgan_nBits': 1024, 'combined_rdkit_maxPath': 7, 'combined_rdkit_nBits': 1024, 'num_hidden_layers': 3, 'hidden_dim_0': 256, 'hidden_dim_1': 1024, 'hidden_dim_2': 64, 'kl_weight': 0.00035168717557597763, 'lr': 0.006647762638617313, 'batch_size': 128, 'dropout_rate': 0.1123665321976177, 'prior_mu': 0.016613379249733738, 'prior_sigma': 0.07965033139238695, 'normalization': 'layer'}. Best is trial 896 with value: 0.4533553242683411.
Generating morgan_rdkit fingerprints...
Generated fingerprints with 2048 features for 841 molecules
Trial 1172: 5-fold CV loss = 0.4735
[I 2025-08-07 20:57:38,247] Trial 1172 finished with value: 0.4734689652919769 and parameters: {'fp_type': 'morgan_rdkit', 'combined_morgan_radius': 3, 'combined_morgan_nBits': 1024, 'combined_rdkit_maxPath': 7, 'combined_rdkit_nBits': 1024, 'num_hidden_layers': 3, 'hidden_dim_0': 256, 'hidden_dim_1': 1024, 'hidden_dim_2': 64, 'kl_weight': 0.0002482629102527141, 'lr': 0.005978232343121168, 'batch_size': 128, 'dropout_rate': 0.12113445993362665, 'prior_mu': -0.02196723533347899, 'prior_sigma': 0.12216693535661205, 'normalization': 'layer'}. Best is trial 896 with value: 0.4533553242683411.
Generating morgan_rdkit fingerprints...
Generated fingerprints with 2048 features for 841 molecules
Trial 1181: 5-fold CV loss = 0.8884
[I 2025-08-07 20:57:53,252] Trial 1181 finished with value: 0.8884436249732971 and parameters: {'fp_type': 'morgan_rdkit', 'combined_morgan_radius': 3, 'combined_morgan_nBits': 1024, 'combined_rdkit_maxPath': 7, 'combined_rdkit_nBits': 1024, 'num_hidden_layers': 3, 'hidden_dim_0': 256, 'hidden_dim_1': 1024, 'hidden_dim_2': 1024, 'kl_weight': 0.00023772135824341183, 'lr': 0.007472824244751411, 'batch_size': 128, 'dropout_rate': 0.13021474975057615, 'prior_mu': 0.004114082085663743, 'prior_sigma': 0.11329680706856984, 'normalization': 'layer'}. Best is trial 896 with value: 0.4533553242683411.
Generating morgan_rdkit fingerprints...
Generated fingerprints with 2048 features for 841 molecules
Trial 1179: 5-fold CV loss = 0.6289
[I 2025-08-07 20:57:57,288] Trial 1179 finished with value: 0.6288603365421295 and parameters: {'fp_type': 'morgan_rdkit', 'combined_morgan_radius': 3, 'combined_morgan_nBits': 1024, 'combined_rdkit_maxPath': 7, 'combined_rdkit_nBits': 1024, 'num_hidden_layers': 3, 'hidden_dim_0': 256, 'hidden_dim_1': 1024, 'hidden_dim_2': 64, 'kl_weight': 0.0003030147594429012, 'lr': 0.006816746120043792, 'batch_size': 128, 'dropout_rate': 0.11374018756148131, 'prior_mu': 0.0030249395372342718, 'prior_sigma': 0.10339131158875456, 'normalization': 'layer'}. Best is trial 896 with value: 0.4533553242683411.
Generating morgan_rdkit fingerprints...
Generated fingerprints with 2048 features for 841 molecules
Trial 1183: 5-fold CV loss = 0.6476
[I 2025-08-07 20:58:26,681] Trial 1183 finished with value: 0.6475733339786529 and parameters: {'fp_type': 'morgan_rdkit', 'combined_morgan_radius': 3, 'combined_morgan_nBits': 1024, 'combined_rdkit_maxPath': 7, 'combined_rdkit_nBits': 1024, 'num_hidden_layers': 3, 'hidden_dim_0': 256, 'hidden_dim_1': 1024, 'hidden_dim_2': 128, 'kl_weight': 0.0003248414729212335, 'lr': 0.007591833325918188, 'batch_size': 128, 'dropout_rate': 0.115160117023634, 'prior_mu': -0.00014978323003815922, 'prior_sigma': 0.07618192187034795, 'normalization': 'none'}. Best is trial 896 with value: 0.4533553242683411.
Generating morgan_rdkit fingerprints...
Generated fingerprints with 2048 features for 841 molecules
Trial 1180: 5-fold CV loss = 0.4677
[I 2025-08-07 20:58:28,283] Trial 1180 finished with value: 0.46772475242614747 and parameters: {'fp_type': 'morgan_rdkit', 'combined_morgan_radius': 3, 'combined_morgan_nBits': 1024, 'combined_rdkit_maxPath': 7, 'combined_rdkit_nBits': 1024, 'num_hidden_layers': 3, 'hidden_dim_0': 256, 'hidden_dim_1': 1024, 'hidden_dim_2': 64, 'kl_weight': 0.00034382957363599534, 'lr': 0.00743818491213721, 'batch_size': 128, 'dropout_rate': 0.11485654579609464, 'prior_mu': 0.011544350974206459, 'prior_sigma': 0.103056339977656, 'normalization': 'layer'}. Best is trial 896 with value: 0.4533553242683411.
Generating morgan_rdkit fingerprints...
Generated fingerprints with 2048 features for 841 molecules
Trial 1184: 5-fold CV loss = 0.5846
[I 2025-08-07 20:58:39,856] Trial 1184 finished with value: 0.5845511436462403 and parameters: {'fp_type': 'morgan_rdkit', 'combined_morgan_radius': 3, 'combined_morgan_nBits': 1024, 'combined_rdkit_maxPath': 7, 'combined_rdkit_nBits': 1024, 'num_hidden_layers': 3, 'hidden_dim_0': 256, 'hidden_dim_1': 1024, 'hidden_dim_2': 64, 'kl_weight': 0.00040498552693434264, 'lr': 0.007603442833850467, 'batch_size': 128, 'dropout_rate': 0.13240093689673368, 'prior_mu': 0.009711056721557365, 'prior_sigma': 0.10053883464952186, 'normalization': 'none'}. Best is trial 896 with value: 0.4533553242683411.
Generating morgan_rdkit fingerprints...
Generated fingerprints with 2048 features for 841 molecules
Trial 1185: 5-fold CV loss = 0.4718
[I 2025-08-07 20:59:09,054] Trial 1185 finished with value: 0.47178774476051333 and parameters: {'fp_type': 'morgan_rdkit', 'combined_morgan_radius': 3, 'combined_morgan_nBits': 1024, 'combined_rdkit_maxPath': 7, 'combined_rdkit_nBits': 1024, 'num_hidden_layers': 3, 'hidden_dim_0': 256, 'hidden_dim_1': 1024, 'hidden_dim_2': 64, 'kl_weight': 0.0005071203559128606, 'lr': 0.005723862086199311, 'batch_size': 128, 'dropout_rate': 0.12899681893846185, 'prior_mu': 0.01065500973259186, 'prior_sigma': 0.10181204534985686, 'normalization': 'layer'}. Best is trial 896 with value: 0.4533553242683411.
Generating morgan_rdkit fingerprints...
Generated fingerprints with 2048 features for 841 molecules
Trial 1187: 5-fold CV loss = 0.5395
