[I 2025-08-07 22:03:00,456] Trial 1513 finished with value: 0.5620733559131622 and parameters: {'fp_type': 'morgan_rdkit', 'combined_morgan_radius': 3, 'combined_morgan_nBits': 1024, 'combined_rdkit_maxPath': 7, 'combined_rdkit_nBits': 1024, 'num_hidden_layers': 3, 'hidden_dim_0': 256, 'hidden_dim_1': 64, 'hidden_dim_2': 64, 'kl_weight': 0.00034785836389723753, 'lr': 0.0059575311104297, 'batch_size': 128, 'dropout_rate': 0.10520618195089994, 'prior_mu': -0.03339618054919168, 'prior_sigma': 0.0692076265430479, 'normalization': 'layer'}. Best is trial 896 with value: 0.4533553242683411.
Generating morgan_rdkit fingerprints...
Generated fingerprints with 2048 features for 841 molecules
Trial 1516: 5-fold CV loss = 0.4633
[I 2025-08-07 22:03:21,429] Trial 1516 finished with value: 0.4633097112178802 and parameters: {'fp_type': 'morgan_rdkit', 'combined_morgan_radius': 3, 'combined_morgan_nBits': 1024, 'combined_rdkit_maxPath': 7, 'combined_rdkit_nBits': 1024, 'num_hidden_layers': 3, 'hidden_dim_0': 256, 'hidden_dim_1': 1024, 'hidden_dim_2': 64, 'kl_weight': 0.00041281605711211233, 'lr': 0.00661431576170953, 'batch_size': 128, 'dropout_rate': 0.08974927855867663, 'prior_mu': -0.05851717918862351, 'prior_sigma': 0.08602655604565931, 'normalization': 'layer'}. Best is trial 896 with value: 0.4533553242683411.
Generating morgan_rdkit fingerprints...
Generated fingerprints with 2048 features for 841 molecules
Trial 1518: 5-fold CV loss = 0.4650
[I 2025-08-07 22:03:41,766] Trial 1518 finished with value: 0.46500340700149534 and parameters: {'fp_type': 'morgan_rdkit', 'combined_morgan_radius': 3, 'combined_morgan_nBits': 1024, 'combined_rdkit_maxPath': 7, 'combined_rdkit_nBits': 1024, 'num_hidden_layers': 3, 'hidden_dim_0': 256, 'hidden_dim_1': 1024, 'hidden_dim_2': 64, 'kl_weight': 0.00044909845909909754, 'lr': 0.005667420754915174, 'batch_size': 128, 'dropout_rate': 0.08722358077326176, 'prior_mu': -0.06038334723940644, 'prior_sigma': 0.08051023560950692, 'normalization': 'layer'}. Best is trial 896 with value: 0.4533553242683411.
Generating morgan_rdkit fingerprints...
Generated fingerprints with 2048 features for 841 molecules
Trial 1519: 5-fold CV loss = 0.4842
[I 2025-08-07 22:03:45,386] Trial 1519 finished with value: 0.48420352935791017 and parameters: {'fp_type': 'morgan_rdkit', 'combined_morgan_radius': 3, 'combined_morgan_nBits': 1024, 'combined_rdkit_maxPath': 5, 'combined_rdkit_nBits': 1024, 'num_hidden_layers': 3, 'hidden_dim_0': 256, 'hidden_dim_1': 1024, 'hidden_dim_2': 64, 'kl_weight': 0.0004574518582340904, 'lr': 0.00556886615091222, 'batch_size': 128, 'dropout_rate': 0.07281152541393543, 'prior_mu': -0.06006809659706224, 'prior_sigma': 0.09016572439637106, 'normalization': 'layer'}. Best is trial 896 with value: 0.4533553242683411.
Generating rdkit fingerprints...
Generated fingerprints with 512 features for 841 molecules
Trial 1520: 5-fold CV loss = 0.4807
[I 2025-08-07 22:03:50,608] Trial 1520 finished with value: 0.4806575834751129 and parameters: {'fp_type': 'morgan_rdkit', 'combined_morgan_radius': 3, 'combined_morgan_nBits': 1024, 'combined_rdkit_maxPath': 5, 'combined_rdkit_nBits': 1024, 'num_hidden_layers': 3, 'hidden_dim_0': 256, 'hidden_dim_1': 1024, 'hidden_dim_2': 64, 'kl_weight': 0.0007522605150134115, 'lr': 0.00493774155646368, 'batch_size': 128, 'dropout_rate': 0.07323189595683306, 'prior_mu': -0.04304956186968158, 'prior_sigma': 0.07978909178196983, 'normalization': 'layer'}. Best is trial 896 with value: 0.4533553242683411.
Generating rdkit fingerprints...
Generated fingerprints with 512 features for 841 molecules
Trial 1517: 5-fold CV loss = 0.4704
[I 2025-08-07 22:04:08,795] Trial 1517 finished with value: 0.47040568590164183 and parameters: {'fp_type': 'morgan_rdkit', 'combined_morgan_radius': 3, 'combined_morgan_nBits': 1024, 'combined_rdkit_maxPath': 7, 'combined_rdkit_nBits': 1024, 'num_hidden_layers': 3, 'hidden_dim_0': 256, 'hidden_dim_1': 1024, 'hidden_dim_2': 64, 'kl_weight': 0.00038573274135387625, 'lr': 0.006540833445661362, 'batch_size': 128, 'dropout_rate': 0.07366339979276536, 'prior_mu': -0.039353657443431736, 'prior_sigma': 0.08911822507701715, 'normalization': 'layer'}. Best is trial 896 with value: 0.4533553242683411.
Generating morgan_rdkit fingerprints...
Generated fingerprints with 2048 features for 841 molecules
Trial 1521: 5-fold CV loss = 0.5775
[I 2025-08-07 22:04:11,993] Trial 1521 finished with value: 0.5775073289871215 and parameters: {'fp_type': 'morgan_rdkit', 'combined_morgan_radius': 3, 'combined_morgan_nBits': 1024, 'combined_rdkit_maxPath': 5, 'combined_rdkit_nBits': 1024, 'num_hidden_layers': 3, 'hidden_dim_0': 256, 'hidden_dim_1': 1024, 'hidden_dim_2': 64, 'kl_weight': 0.0005129004885212907, 'lr': 0.005176996349165577, 'batch_size': 128, 'dropout_rate': 0.03445442684987175, 'prior_mu': -0.012457983611062274, 'prior_sigma': 0.09163827934840314, 'normalization': 'layer'}. Best is trial 896 with value: 0.4533553242683411.
Generating morgan_rdkit fingerprints...
Generated fingerprints with 2048 features for 841 molecules
Trial 1523: 5-fold CV loss = 0.5066
[I 2025-08-07 22:04:38,560] Trial 1523 finished with value: 0.5065580606460571 and parameters: {'fp_type': 'rdkit', 'rdkit_only_maxPath': 6, 'rdkit_only_nBits': 512, 'num_hidden_layers': 3, 'hidden_dim_0': 1024, 'hidden_dim_1': 1024, 'hidden_dim_2': 64, 'kl_weight': 0.00031773563551112434, 'lr': 0.006322470468734296, 'batch_size': 128, 'dropout_rate': 0.11115787336469894, 'prior_mu': -0.010483013869668182, 'prior_sigma': 0.07473444643285841, 'normalization': 'layer'}. Best is trial 896 with value: 0.4533553242683411.
Generating morgan_rdkit fingerprints...
Generated fingerprints with 2048 features for 841 molecules
Trial 1522: 5-fold CV loss = 0.5770
[I 2025-08-07 22:04:46,912] Trial 1522 finished with value: 0.5770434379577637 and parameters: {'fp_type': 'rdkit', 'rdkit_only_maxPath': 6, 'rdkit_only_nBits': 512, 'num_hidden_layers': 3, 'hidden_dim_0': 256, 'hidden_dim_1': 1024, 'hidden_dim_2': 64, 'kl_weight': 0.0003169062506628611, 'lr': 0.004957221876784593, 'batch_size': 128, 'dropout_rate': 0.07098241654072843, 'prior_mu': -0.010107365886677447, 'prior_sigma': 0.07311005040097229, 'normalization': 'layer'}. Best is trial 896 with value: 0.4533553242683411.
Generating morgan_rdkit fingerprints...
Generated fingerprints with 2048 features for 841 molecules
Trial 1525: 5-fold CV loss = 0.4637
[I 2025-08-07 22:04:53,304] Trial 1525 finished with value: 0.46367110013961793 and parameters: {'fp_type': 'morgan_rdkit', 'combined_morgan_radius': 3, 'combined_morgan_nBits': 1024, 'combined_rdkit_maxPath': 7, 'combined_rdkit_nBits': 1024, 'num_hidden_layers': 3, 'hidden_dim_0': 256, 'hidden_dim_1': 1024, 'hidden_dim_2': 64, 'kl_weight': 0.00032649490526923347, 'lr': 0.00720581364083227, 'batch_size': 128, 'dropout_rate': 0.09686546768846709, 'prior_mu': -0.011772872522689957, 'prior_sigma': 0.07332876575592003, 'normalization': 'layer'}. Best is trial 896 with value: 0.4533553242683411.
Generating morgan_rdkit fingerprints...
Generated fingerprints with 2048 features for 841 molecules
Trial 1526: 5-fold CV loss = 0.4711
[I 2025-08-07 22:05:10,927] Trial 1526 finished with value: 0.47106451988220216 and parameters: {'fp_type': 'morgan_rdkit', 'combined_morgan_radius': 3, 'combined_morgan_nBits': 1024, 'combined_rdkit_maxPath': 7, 'combined_rdkit_nBits': 1024, 'num_hidden_layers': 3, 'hidden_dim_0': 256, 'hidden_dim_1': 1024, 'hidden_dim_2': 64, 'kl_weight': 0.00030721714548748484, 'lr': 0.007295297492646242, 'batch_size': 128, 'dropout_rate': 0.09803224464701647, 'prior_mu': -0.028385003069758052, 'prior_sigma': 0.061745659970374005, 'normalization': 'layer'}. Best is trial 896 with value: 0.4533553242683411.
Generating morgan_rdkit fingerprints...
Generated fingerprints with 1280 features for 841 molecules
Trial 1528: 5-fold CV loss = 0.8340
[I 2025-08-07 22:05:21,013] Trial 1528 finished with value: 0.8339971899986267 and parameters: {'fp_type': 'morgan_rdkit', 'combined_morgan_radius': 3, 'combined_morgan_nBits': 1024, 'combined_rdkit_maxPath': 6, 'combined_rdkit_nBits': 1024, 'num_hidden_layers': 3, 'hidden_dim_0': 256, 'hidden_dim_1': 1024, 'hidden_dim_2': 128, 'kl_weight': 0.00037715724986173165, 'lr': 0.00010260651075922574, 'batch_size': 128, 'dropout_rate': 0.10667653660219427, 'prior_mu': -0.02947290208621306, 'prior_sigma': 0.06344586462758194, 'normalization': 'layer'}. Best is trial 896 with value: 0.4533553242683411.
Generating morgan_rdkit fingerprints...
Generated fingerprints with 1280 features for 841 molecules
Trial 1527: 5-fold CV loss = 0.4689
[I 2025-08-07 22:05:35,619] Trial 1527 finished with value: 0.468926864862442 and parameters: {'fp_type': 'morgan_rdkit', 'combined_morgan_radius': 3, 'combined_morgan_nBits': 1024, 'combined_rdkit_maxPath': 7, 'combined_rdkit_nBits': 1024, 'num_hidden_layers': 3, 'hidden_dim_0': 256, 'hidden_dim_1': 1024, 'hidden_dim_2': 64, 'kl_weight': 0.0003707127724545282, 'lr': 0.0072847276140711355, 'batch_size': 128, 'dropout_rate': 0.09608315116158844, 'prior_mu': -0.02559884103705765, 'prior_sigma': 0.0612286841913872, 'normalization': 'layer'}. Best is trial 896 with value: 0.4533553242683411.
Generating morgan_rdkit fingerprints...
Generated fingerprints with 2048 features for 841 molecules
Trial 1529: 5-fold CV loss = 0.6684
[I 2025-08-07 22:05:39,178] Trial 1529 finished with value: 0.6684026062488556 and parameters: {'fp_type': 'morgan_rdkit', 'combined_morgan_radius': 3, 'combined_morgan_nBits': 1024, 'combined_rdkit_maxPath': 6, 'combined_rdkit_nBits': 256, 'num_hidden_layers': 3, 'hidden_dim_0': 256, 'hidden_dim_1': 1024, 'hidden_dim_2': 64, 'kl_weight': 0.0003824737095459194, 'lr': 0.004415875393159633, 'batch_size': 128, 'dropout_rate': 0.1059527423561486, 'prior_mu': -0.033145381380020066, 'prior_sigma': 0.09500339111723201, 'normalization': 'layer'}. Best is trial 896 with value: 0.4533553242683411.
Generating morgan_rdkit fingerprints...
Generated fingerprints with 2048 features for 841 molecules
Trial 1524: 5-fold CV loss = 0.4634
[I 2025-08-07 22:05:44,871] Trial 1524 finished with value: 0.4633963704109192 and parameters: {'fp_type': 'morgan_rdkit', 'combined_morgan_radius': 3, 'combined_morgan_nBits': 1024, 'combined_rdkit_maxPath': 7, 'combined_rdkit_nBits': 1024, 'num_hidden_layers': 3, 'hidden_dim_0': 1024, 'hidden_dim_1': 1024, 'hidden_dim_2': 64, 'kl_weight': 0.000317873530491634, 'lr': 0.004919125823269904, 'batch_size': 128, 'dropout_rate': 0.09543471602228207, 'prior_mu': -0.013418090409585423, 'prior_sigma': 0.07235040428942721, 'normalization': 'layer'}. Best is trial 896 with value: 0.4533553242683411.
Generating morgan_rdkit fingerprints...
Generated fingerprints with 2048 features for 841 molecules
Trial 1530: 5-fold CV loss = 0.5911
[I 2025-08-07 22:05:51,992] Trial 1530 finished with value: 0.5910591006278991 and parameters: {'fp_type': 'morgan_rdkit', 'combined_morgan_radius': 3, 'combined_morgan_nBits': 1024, 'combined_rdkit_maxPath': 7, 'combined_rdkit_nBits': 256, 'num_hidden_layers': 3, 'hidden_dim_0': 256, 'hidden_dim_1': 1024, 'hidden_dim_2': 64, 'kl_weight': 0.0006236974943362847, 'lr': 0.005992799274634636, 'batch_size': 128, 'dropout_rate': 0.13793872899912882, 'prior_mu': -0.02034961100686885, 'prior_sigma': 0.08446355564782464, 'normalization': 'layer'}. Best is trial 896 with value: 0.4533553242683411.
Generating morgan_rdkit fingerprints...
Generated fingerprints with 2048 features for 841 molecules
Trial 1532: 5-fold CV loss = 0.4753
[I 2025-08-07 22:06:22,814] Trial 1532 finished with value: 0.475294691324234 and parameters: {'fp_type': 'morgan_rdkit', 'combined_morgan_radius': 3, 'combined_morgan_nBits': 1024, 'combined_rdkit_maxPath': 7, 'combined_rdkit_nBits': 1024, 'num_hidden_layers': 3, 'hidden_dim_0': 256, 'hidden_dim_1': 1024, 'hidden_dim_2': 64, 'kl_weight': 0.00970807888067496, 'lr': 0.006042576419143297, 'batch_size': 128, 'dropout_rate': 0.13839060967969555, 'prior_mu': -0.017864519359063642, 'prior_sigma': 0.0858521484552067, 'normalization': 'layer'}. Best is trial 896 with value: 0.4533553242683411.
Generating morgan_rdkit fingerprints...
Generated fingerprints with 2048 features for 841 molecules
Trial 1531: 5-fold CV loss = 0.5437
[I 2025-08-07 22:06:26,780] Trial 1531 finished with value: 0.5436619102954865 and parameters: {'fp_type': 'morgan_rdkit', 'combined_morgan_radius': 3, 'combined_morgan_nBits': 1024, 'combined_rdkit_maxPath': 7, 'combined_rdkit_nBits': 1024, 'num_hidden_layers': 3, 'hidden_dim_0': 256, 'hidden_dim_1': 1024, 'hidden_dim_2': 64, 'kl_weight': 0.0004891748318925468, 'lr': 0.006059630202947087, 'batch_size': 128, 'dropout_rate': 0.14898610256042175, 'prior_mu': -0.017895478698262905, 'prior_sigma': 0.0950171097626179, 'normalization': 'layer'}. Best is trial 896 with value: 0.4533553242683411.
Generating morgan_rdkit fingerprints...
Generated fingerprints with 2048 features for 841 molecules
Trial 1534: 5-fold CV loss = 0.4695
[I 2025-08-07 22:06:40,264] Trial 1534 finished with value: 0.46952526569366454 and parameters: {'fp_type': 'morgan_rdkit', 'combined_morgan_radius': 3, 'combined_morgan_nBits': 1024, 'combined_rdkit_maxPath': 7, 'combined_rdkit_nBits': 1024, 'num_hidden_layers': 3, 'hidden_dim_0': 256, 'hidden_dim_1': 1024, 'hidden_dim_2': 64, 'kl_weight': 0.0004608940937492739, 'lr': 0.005531165935790023, 'batch_size': 128, 'dropout_rate': 0.1525020037024306, 'prior_mu': -0.0035667933390519137, 'prior_sigma': 0.08105472928660072, 'normalization': 'layer'}. Best is trial 896 with value: 0.4533553242683411.
Generating morgan_rdkit fingerprints...
Generated fingerprints with 2048 features for 841 molecules
Trial 1535: 5-fold CV loss = 0.4663
[I 2025-08-07 22:07:08,055] Trial 1535 finished with value: 0.46633299589157107 and parameters: {'fp_type': 'morgan_rdkit', 'combined_morgan_radius': 3, 'combined_morgan_nBits': 1024, 'combined_rdkit_maxPath': 7, 'combined_rdkit_nBits': 1024, 'num_hidden_layers': 3, 'hidden_dim_0': 256, 'hidden_dim_1': 1024, 'hidden_dim_2': 256, 'kl_weight': 0.0004983862162976945, 'lr': 0.005492981150209506, 'batch_size': 64, 'dropout_rate': 0.15181795021775826, 'prior_mu': -0.0039355352290011796, 'prior_sigma': 0.05429996204531103, 'normalization': 'layer'}. Best is trial 896 with value: 0.4533553242683411.
Generating morgan_rdkit fingerprints...
Generated fingerprints with 2048 features for 841 molecules
Trial 1533: 5-fold CV loss = 0.4663
[I 2025-08-07 22:07:13,160] Trial 1533 finished with value: 0.46633200645446776 and parameters: {'fp_type': 'morgan_rdkit', 'combined_morgan_radius': 3, 'combined_morgan_nBits': 1024, 'combined_rdkit_maxPath': 7, 'combined_rdkit_nBits': 1024, 'num_hidden_layers': 3, 'hidden_dim_0': 256, 'hidden_dim_1': 1024, 'hidden_dim_2': 64, 'kl_weight': 0.0005038628386237032, 'lr': 0.00598678386392088, 'batch_size': 128, 'dropout_rate': 0.14059659327026347, 'prior_mu': -0.019298117853078355, 'prior_sigma': 0.07993442143246288, 'normalization': 'layer'}. Best is trial 896 with value: 0.4533553242683411.
Generating morgan_rdkit fingerprints...
Generated fingerprints with 2048 features for 841 molecules
Trial 1536: 5-fold CV loss = 0.4733
[I 2025-08-07 22:07:18,610] Trial 1536 finished with value: 0.47334580421447753 and parameters: {'fp_type': 'morgan_rdkit', 'combined_morgan_radius': 3, 'combined_morgan_nBits': 1024, 'combined_rdkit_maxPath': 7, 'combined_rdkit_nBits': 1024, 'num_hidden_layers': 3, 'hidden_dim_0': 256, 'hidden_dim_1': 1024, 'hidden_dim_2': 64, 'kl_weight': 0.00025837099340011733, 'lr': 0.006741884637821962, 'batch_size': 128, 'dropout_rate': 0.08554839645752821, 'prior_mu': -0.04084391917269033, 'prior_sigma': 0.07906068427859365, 'normalization': 'layer'}. Best is trial 896 with value: 0.4533553242683411.
Generating morgan_rdkit fingerprints...
Generated fingerprints with 2048 features for 841 molecules
Trial 1537: 5-fold CV loss = 0.4803
[I 2025-08-07 22:07:42,578] Trial 1537 finished with value: 0.4803121626377106 and parameters: {'fp_type': 'morgan_rdkit', 'combined_morgan_radius': 3, 'combined_morgan_nBits': 1024, 'combined_rdkit_maxPath': 7, 'combined_rdkit_nBits': 1024, 'num_hidden_layers': 3, 'hidden_dim_0': 256, 'hidden_dim_1': 1024, 'hidden_dim_2': 256, 'kl_weight': 0.002628428537492891, 'lr': 0.006628578181173089, 'batch_size': 64, 'dropout_rate': 0.08333318340808628, 'prior_mu': -0.040007539518659666, 'prior_sigma': 0.07826296620860049, 'normalization': 'layer'}. Best is trial 896 with value: 0.4533553242683411.
Generating morgan_rdkit fingerprints...
Generated fingerprints with 2048 features for 841 molecules
Trial 1538: 5-fold CV loss = 0.4726
[I 2025-08-07 22:07:44,430] Trial 1538 finished with value: 0.4726006627082825 and parameters: {'fp_type': 'morgan_rdkit', 'combined_morgan_radius': 3, 'combined_morgan_nBits': 1024, 'combined_rdkit_maxPath': 7, 'combined_rdkit_nBits': 1024, 'num_hidden_layers': 3, 'hidden_dim_0': 256, 'hidden_dim_1': 1024, 'hidden_dim_2': 64, 'kl_weight': 0.000296520855286023, 'lr': 0.0069409198312129815, 'batch_size': 128, 'dropout_rate': 0.08657352925203543, 'prior_mu': 0.025161298835369526, 'prior_sigma': 0.0788462372938033, 'normalization': 'layer'}. Best is trial 896 with value: 0.4533553242683411.
Generating morgan_rdkit fingerprints...
Generated fingerprints with 2048 features for 841 molecules
Trial 1539: 5-fold CV loss = 0.6144
[I 2025-08-07 22:08:10,768] Trial 1539 finished with value: 0.6144396066665649 and parameters: {'fp_type': 'morgan_rdkit', 'combined_morgan_radius': 3, 'combined_morgan_nBits': 1024, 'combined_rdkit_maxPath': 7, 'combined_rdkit_nBits': 1024, 'num_hidden_layers': 3, 'hidden_dim_0': 256, 'hidden_dim_1': 1024, 'hidden_dim_2': 64, 'kl_weight': 0.00025417622226888716, 'lr': 0.00686358321325831, 'batch_size': 128, 'dropout_rate': 0.08620706354307345, 'prior_mu': -0.041453160823765545, 'prior_sigma': 0.06648621971496181, 'normalization': 'none'}. Best is trial 896 with value: 0.4533553242683411.
Generating morgan_rdkit fingerprints...
Generated fingerprints with 2048 features for 841 molecules
Trial 1542: 5-fold CV loss = 0.4803
[I 2025-08-07 22:08:20,908] Trial 1542 finished with value: 0.480328369140625 and parameters: {'fp_type': 'morgan_rdkit', 'combined_morgan_radius': 3, 'combined_morgan_nBits': 1024, 'combined_rdkit_maxPath': 8, 'combined_rdkit_nBits': 1024, 'num_hidden_layers': 3, 'hidden_dim_0': 1024, 'hidden_dim_1': 1024, 'hidden_dim_2': 64, 'kl_weight': 0.00025603209785255554, 'lr': 0.007630613686326716, 'batch_size': 128, 'dropout_rate': 0.113641900957987, 'prior_mu': 0.011431211475374417, 'prior_sigma': 0.0663071895583546, 'normalization': 'layer'}. Best is trial 896 with value: 0.4533553242683411.
Generating morgan_rdkit fingerprints...
Generated fingerprints with 2048 features for 841 molecules
Trial 1540: 5-fold CV loss = 0.5453
[I 2025-08-07 22:08:29,693] Trial 1540 finished with value: 0.5452983140945434 and parameters: {'fp_type': 'morgan_rdkit', 'combined_morgan_radius': 3, 'combined_morgan_nBits': 1024, 'combined_rdkit_maxPath': 7, 'combined_rdkit_nBits': 1024, 'num_hidden_layers': 3, 'hidden_dim_0': 1024, 'hidden_dim_1': 1024, 'hidden_dim_2': 64, 'kl_weight': 0.00029761128826957545, 'lr': 0.007537166033211126, 'batch_size': 128, 'dropout_rate': 0.11358052798103854, 'prior_mu': -0.05317305276247858, 'prior_sigma': 0.06737016596494817, 'normalization': 'none'}. Best is trial 896 with value: 0.4533553242683411.
Generating morgan_rdkit fingerprints...
Generated fingerprints with 2048 features for 841 molecules
Trial 1541: 5-fold CV loss = 0.5321
[I 2025-08-07 22:08:35,412] Trial 1541 finished with value: 0.5321319937705994 and parameters: {'fp_type': 'morgan_rdkit', 'combined_morgan_radius': 3, 'combined_morgan_nBits': 1024, 'combined_rdkit_maxPath': 7, 'combined_rdkit_nBits': 1024, 'num_hidden_layers': 3, 'hidden_dim_0': 1024, 'hidden_dim_1': 1024, 'hidden_dim_2': 64, 'kl_weight': 0.0137547044259864, 'lr': 0.007379535973054347, 'batch_size': 128, 'dropout_rate': 0.10912380301901999, 'prior_mu': -0.0550931352700631, 'prior_sigma': 0.068025260418636, 'normalization': 'none'}. Best is trial 896 with value: 0.4533553242683411.
Generating morgan_rdkit fingerprints...
Generated fingerprints with 2048 features for 841 molecules
Trial 1544: 5-fold CV loss = 0.4619
[I 2025-08-07 22:09:00,806] Trial 1544 finished with value: 0.4619261801242828 and parameters: {'fp_type': 'morgan_rdkit', 'combined_morgan_radius': 3, 'combined_morgan_nBits': 1024, 'combined_rdkit_maxPath': 7, 'combined_rdkit_nBits': 1024, 'num_hidden_layers': 3, 'hidden_dim_0': 256, 'hidden_dim_1': 1024, 'hidden_dim_2': 64, 'kl_weight': 0.000408972057383801, 'lr': 0.004583799999045493, 'batch_size': 128, 'dropout_rate': 0.06436735683795525, 'prior_mu': -0.03155161660048706, 'prior_sigma': 0.06951920962352719, 'normalization': 'layer'}. Best is trial 896 with value: 0.4533553242683411.
Generating morgan_rdkit fingerprints...
Generated fingerprints with 2048 features for 841 molecules
Trial 1545: 5-fold CV loss = 0.5646
[I 2025-08-07 22:09:17,357] Trial 1545 finished with value: 0.5645521461963654 and parameters: {'fp_type': 'morgan_rdkit', 'combined_morgan_radius': 3, 'combined_morgan_nBits': 1024, 'combined_rdkit_maxPath': 7, 'combined_rdkit_nBits': 1024, 'num_hidden_layers': 3, 'hidden_dim_0': 256, 'hidden_dim_1': 1024, 'hidden_dim_2': 64, 'kl_weight': 0.0004134366100895127, 'lr': 0.004778500581233524, 'batch_size': 128, 'dropout_rate': 0.10442554185326093, 'prior_mu': -0.03520815607042672, 'prior_sigma': 0.08921793849462505, 'normalization': 'layer'}. Best is trial 896 with value: 0.4533553242683411.
Generating morgan_rdkit fingerprints...
Generated fingerprints with 2048 features for 841 molecules
Trial 1546: 5-fold CV loss = 0.4664
