Using device: cuda
Starting comprehensive hyperparameter optimization with 5-fold CV...
Testing fingerprint types:
- Morgan (radius 2-3, nBits 1024/2048)
- RDKit (maxPath 5-8, nBits 256/512/1024)
- Morgan+RDKit combined
- Architecture: 0-3 hidden layers
- Cross-validation: 5-fold
Generating morgan_rdkit fingerprints...
Generating morgan fingerprints...
Generating morgan_rdkit fingerprints...
Generating morgan_rdkit fingerprints...
Generated fingerprints with 2048 features for 841 molecules
Generated fingerprints with 1024 features for 841 molecules
Generated fingerprints with 768 features for 841 molecules
Generated fingerprints with 1536 features for 841 molecules
Trial 0: 5-fold CV loss = 0.5374
[I 2025-08-07 16:02:29,450] Trial 0 finished with value: 0.537375545501709 and parameters: {'fp_type': 'morgan', 'morgan_only_radius': 2, 'morgan_only_nBits': 2048, 'num_hidden_layers': 1, 'hidden_dim_0': 512, 'kl_weight': 0.0006088897694607685, 'lr': 0.00634541967659228, 'batch_size': 128, 'dropout_rate': 0.06847352703580029, 'prior_mu': -0.0952762783298704, 'prior_sigma': 0.033209964478638006, 'normalization': 'layer'}. Best is trial 0 with value: 0.537375545501709.
Generating rdkit fingerprints...
Generated fingerprints with 512 features for 841 molecules
Trial 3: 5-fold CV loss = 1.1243
[I 2025-08-07 16:02:30,274] Trial 3 finished with value: 1.1243048906326294 and parameters: {'fp_type': 'morgan_rdkit', 'combined_morgan_radius': 2, 'combined_morgan_nBits': 512, 'combined_rdkit_maxPath': 8, 'combined_rdkit_nBits': 512, 'num_hidden_layers': 0, 'kl_weight': 0.07923056664861053, 'lr': 0.00032224066859423543, 'batch_size': 128, 'dropout_rate': 0.22335657874749776, 'prior_mu': 0.14250003377915638, 'prior_sigma': 0.13073810451550957, 'normalization': 'none'}. Best is trial 0 with value: 0.537375545501709.
Generating morgan fingerprints...
Generated fingerprints with 1024 features for 841 molecules
Trial 2: 5-fold CV loss = 0.9696
[I 2025-08-07 16:02:33,520] Trial 2 finished with value: 0.9696071863174438 and parameters: {'fp_type': 'morgan_rdkit', 'combined_morgan_radius': 3, 'combined_morgan_nBits': 512, 'combined_rdkit_maxPath': 8, 'combined_rdkit_nBits': 1024, 'num_hidden_layers': 3, 'hidden_dim_0': 256, 'hidden_dim_1': 64, 'hidden_dim_2': 512, 'kl_weight': 0.0011379881317500923, 'lr': 0.0031248411555689208, 'batch_size': 128, 'dropout_rate': 0.4068985025986158, 'prior_mu': -0.03990813656520942, 'prior_sigma': 0.15214408810590868, 'normalization': 'none'}. Best is trial 0 with value: 0.537375545501709.
Generating morgan_rdkit fingerprints...
Generated fingerprints with 1536 features for 841 molecules
Trial 1: 5-fold CV loss = 0.6096
[I 2025-08-07 16:02:46,502] Trial 1 finished with value: 0.6095646500587464 and parameters: {'fp_type': 'morgan_rdkit', 'combined_morgan_radius': 3, 'combined_morgan_nBits': 512, 'combined_rdkit_maxPath': 7, 'combined_rdkit_nBits': 256, 'num_hidden_layers': 0, 'kl_weight': 0.003149769476445487, 'lr': 0.007513763550533257, 'batch_size': 32, 'dropout_rate': 0.2331984489932329, 'prior_mu': -0.03652547670210243, 'prior_sigma': 0.014786753876742876, 'normalization': 'none'}. Best is trial 0 with value: 0.537375545501709.
Generating morgan fingerprints...
Generated fingerprints with 1024 features for 841 molecules
Trial 4: 5-fold CV loss = 0.7821
[I 2025-08-07 16:02:49,725] Trial 4 finished with value: 0.7821352243423462 and parameters: {'fp_type': 'rdkit', 'rdkit_only_maxPath': 6, 'rdkit_only_nBits': 512, 'num_hidden_layers': 1, 'hidden_dim_0': 128, 'kl_weight': 0.0002173403261682087, 'lr': 0.00034249809137364964, 'batch_size': 128, 'dropout_rate': 0.058033248720835706, 'prior_mu': -0.19889765463755105, 'prior_sigma': 0.06260089165273364, 'normalization': 'layer'}. Best is trial 0 with value: 0.537375545501709.
Generating morgan_rdkit fingerprints...
Generated fingerprints with 2048 features for 841 molecules
Trial 5: 5-fold CV loss = 0.5677
[I 2025-08-07 16:03:03,893] Trial 5 finished with value: 0.5677223265171051 and parameters: {'fp_type': 'morgan', 'morgan_only_radius': 3, 'morgan_only_nBits': 1024, 'num_hidden_layers': 1, 'hidden_dim_0': 512, 'kl_weight': 0.0004948571422721981, 'lr': 0.008381718002533445, 'batch_size': 128, 'dropout_rate': 0.4435205846700236, 'prior_mu': -0.1070658717658827, 'prior_sigma': 0.15432800181734221, 'normalization': 'none'}. Best is trial 0 with value: 0.537375545501709.
Generating rdkit fingerprints...
Generated fingerprints with 1024 features for 841 molecules
Trial 8: 5-fold CV loss = 0.5273
[I 2025-08-07 16:03:24,459] Trial 8 finished with value: 0.5272762238979339 and parameters: {'fp_type': 'morgan_rdkit', 'combined_morgan_radius': 3, 'combined_morgan_nBits': 1024, 'combined_rdkit_maxPath': 8, 'combined_rdkit_nBits': 1024, 'num_hidden_layers': 1, 'hidden_dim_0': 512, 'kl_weight': 0.014259394609566772, 'lr': 0.0022422273889379394, 'batch_size': 128, 'dropout_rate': 0.44533267604419685, 'prior_mu': 0.055701730120826964, 'prior_sigma': 0.06401065654147223, 'normalization': 'layer'}. Best is trial 8 with value: 0.5272762238979339.
Generating morgan_rdkit fingerprints...
Generated fingerprints with 1536 features for 841 molecules
Trial 10: 5-fold CV loss = 0.5206
[I 2025-08-07 16:03:40,154] Trial 10 finished with value: 0.5205568015575409 and parameters: {'fp_type': 'morgan_rdkit', 'combined_morgan_radius': 3, 'combined_morgan_nBits': 512, 'combined_rdkit_maxPath': 5, 'combined_rdkit_nBits': 1024, 'num_hidden_layers': 1, 'hidden_dim_0': 64, 'kl_weight': 0.0001196796629159251, 'lr': 0.008903720918342878, 'batch_size': 128, 'dropout_rate': 0.22384576060634037, 'prior_mu': 0.07561164710539675, 'prior_sigma': 0.05908867648277829, 'normalization': 'layer'}. Best is trial 10 with value: 0.5205568015575409.
Generating rdkit fingerprints...
Generated fingerprints with 1024 features for 841 molecules
Trial 7: 5-fold CV loss = 0.5506
[I 2025-08-07 16:03:40,884] Trial 7 finished with value: 0.5505785763263702 and parameters: {'fp_type': 'morgan', 'morgan_only_radius': 2, 'morgan_only_nBits': 1024, 'num_hidden_layers': 1, 'hidden_dim_0': 128, 'kl_weight': 0.009313353680993662, 'lr': 0.00046812708489730553, 'batch_size': 64, 'dropout_rate': 0.14862685517356516, 'prior_mu': 0.032417875212107455, 'prior_sigma': 0.04270868326633311, 'normalization': 'layer'}. Best is trial 10 with value: 0.5205568015575409.
Generating rdkit fingerprints...
Generated fingerprints with 256 features for 841 molecules
Trial 6: 5-fold CV loss = 0.4795
[I 2025-08-07 16:03:56,148] Trial 6 finished with value: 0.47947537899017334 and parameters: {'fp_type': 'morgan_rdkit', 'combined_morgan_radius': 2, 'combined_morgan_nBits': 512, 'combined_rdkit_maxPath': 7, 'combined_rdkit_nBits': 1024, 'num_hidden_layers': 2, 'hidden_dim_0': 1024, 'hidden_dim_1': 512, 'kl_weight': 0.0020664281865135615, 'lr': 0.006999272190974462, 'batch_size': 64, 'dropout_rate': 0.2310169607573297, 'prior_mu': 0.15200924189101944, 'prior_sigma': 0.1764768473802194, 'normalization': 'layer'}. Best is trial 6 with value: 0.47947537899017334.
Generating rdkit fingerprints...
Generated fingerprints with 1024 features for 841 molecules
Trial 11: 5-fold CV loss = 1.4769
[I 2025-08-07 16:04:09,336] Trial 11 finished with value: 1.4768662452697754 and parameters: {'fp_type': 'rdkit', 'rdkit_only_maxPath': 5, 'rdkit_only_nBits': 1024, 'num_hidden_layers': 1, 'hidden_dim_0': 256, 'kl_weight': 0.01407211019813261, 'lr': 0.0011370227231210642, 'batch_size': 64, 'dropout_rate': 0.20619256088319265, 'prior_mu': 0.1987218764834192, 'prior_sigma': 0.19028568907806806, 'normalization': 'none'}. Best is trial 6 with value: 0.47947537899017334.
Generating morgan_rdkit fingerprints...
Generated fingerprints with 1536 features for 841 molecules
Trial 13: 5-fold CV loss = 0.9434
[I 2025-08-07 16:04:26,705] Trial 13 finished with value: 0.9433546781539917 and parameters: {'fp_type': 'rdkit', 'rdkit_only_maxPath': 5, 'rdkit_only_nBits': 1024, 'num_hidden_layers': 3, 'hidden_dim_0': 1024, 'hidden_dim_1': 512, 'hidden_dim_2': 256, 'kl_weight': 0.0037971965690067567, 'lr': 0.00011079774814941298, 'batch_size': 64, 'dropout_rate': 0.33836664515051706, 'prior_mu': 0.1692693422754101, 'prior_sigma': 0.18231904145229325, 'normalization': 'layer'}. Best is trial 6 with value: 0.47947537899017334.
Generating morgan_rdkit fingerprints...
Generated fingerprints with 1536 features for 841 molecules
Trial 14: 5-fold CV loss = 0.4858
[I 2025-08-07 16:05:03,956] Trial 14 finished with value: 0.4858094096183777 and parameters: {'fp_type': 'morgan_rdkit', 'combined_morgan_radius': 2, 'combined_morgan_nBits': 512, 'combined_rdkit_maxPath': 5, 'combined_rdkit_nBits': 1024, 'num_hidden_layers': 3, 'hidden_dim_0': 64, 'hidden_dim_1': 512, 'hidden_dim_2': 256, 'kl_weight': 0.0001124620987987389, 'lr': 0.003697153758618029, 'batch_size': 64, 'dropout_rate': 0.3355234687321518, 'prior_mu': 0.10655476080157854, 'prior_sigma': 0.09571471809544874, 'normalization': 'layer'}. Best is trial 6 with value: 0.47947537899017334.
Generating morgan_rdkit fingerprints...
Generated fingerprints with 1536 features for 841 molecules
Trial 12: 5-fold CV loss = 0.7006
[I 2025-08-07 16:05:25,385] Trial 12 finished with value: 0.7006490349769592 and parameters: {'fp_type': 'rdkit', 'rdkit_only_maxPath': 6, 'rdkit_only_nBits': 256, 'num_hidden_layers': 0, 'kl_weight': 0.005154671870127288, 'lr': 0.0017460881256373645, 'batch_size': 32, 'dropout_rate': 0.12560413582403263, 'prior_mu': 0.017530216301923612, 'prior_sigma': 0.015147327954139457, 'normalization': 'layer'}. Best is trial 6 with value: 0.47947537899017334.
Generating morgan_rdkit fingerprints...
Generated fingerprints with 1536 features for 841 molecules
Trial 9: 5-fold CV loss = 0.5349
[I 2025-08-07 16:05:29,562] Trial 9 finished with value: 0.5349199652671814 and parameters: {'fp_type': 'rdkit', 'rdkit_only_maxPath': 8, 'rdkit_only_nBits': 1024, 'num_hidden_layers': 3, 'hidden_dim_0': 1024, 'hidden_dim_1': 256, 'hidden_dim_2': 128, 'kl_weight': 0.00016626822704963215, 'lr': 0.0002640088859363139, 'batch_size': 64, 'dropout_rate': 0.08721254361871089, 'prior_mu': -0.16106060996706512, 'prior_sigma': 0.0291351906635404, 'normalization': 'layer'}. Best is trial 6 with value: 0.47947537899017334.
Generating morgan_rdkit fingerprints...
Generated fingerprints with 1536 features for 841 molecules
Trial 15: 5-fold CV loss = 0.5003
[I 2025-08-07 16:05:41,268] Trial 15 finished with value: 0.5002962410449981 and parameters: {'fp_type': 'morgan_rdkit', 'combined_morgan_radius': 2, 'combined_morgan_nBits': 512, 'combined_rdkit_maxPath': 5, 'combined_rdkit_nBits': 1024, 'num_hidden_layers': 2, 'hidden_dim_0': 64, 'hidden_dim_1': 512, 'kl_weight': 0.00011539342544861638, 'lr': 0.0032530705880826787, 'batch_size': 32, 'dropout_rate': 0.32304349474904615, 'prior_mu': 0.10433221841920332, 'prior_sigma': 0.10322455216249035, 'normalization': 'layer'}. Best is trial 6 with value: 0.47947537899017334.
Generating morgan_rdkit fingerprints...
Generated fingerprints with 2048 features for 841 molecules
Trial 16: 5-fold CV loss = 0.5888
[I 2025-08-07 16:06:04,044] Trial 16 finished with value: 0.5887872636318207 and parameters: {'fp_type': 'morgan_rdkit', 'combined_morgan_radius': 2, 'combined_morgan_nBits': 512, 'combined_rdkit_maxPath': 6, 'combined_rdkit_nBits': 1024, 'num_hidden_layers': 2, 'hidden_dim_0': 64, 'hidden_dim_1': 512, 'kl_weight': 0.07661065684531626, 'lr': 0.002506790383591731, 'batch_size': 64, 'dropout_rate': 0.32791030030092416, 'prior_mu': 0.11335376089690372, 'prior_sigma': 0.09348238293975214, 'normalization': 'layer'}. Best is trial 6 with value: 0.47947537899017334.
Generating morgan_rdkit fingerprints...
Generated fingerprints with 1536 features for 841 molecules
Trial 19: 5-fold CV loss = 0.5187
[I 2025-08-07 16:06:33,294] Trial 19 finished with value: 0.5186610162258148 and parameters: {'fp_type': 'morgan_rdkit', 'combined_morgan_radius': 2, 'combined_morgan_nBits': 1024, 'combined_rdkit_maxPath': 6, 'combined_rdkit_nBits': 1024, 'num_hidden_layers': 2, 'hidden_dim_0': 1024, 'hidden_dim_1': 512, 'kl_weight': 0.04784336118180768, 'lr': 0.004294032921454123, 'batch_size': 64, 'dropout_rate': 0.3218376766268071, 'prior_mu': 0.11498247356420387, 'prior_sigma': 0.10211441873203748, 'normalization': 'layer'}. Best is trial 6 with value: 0.47947537899017334.
Generating morgan_rdkit fingerprints...
Generated fingerprints with 1024 features for 841 molecules
Trial 18: 5-fold CV loss = 0.5539
[I 2025-08-07 16:06:44,964] Trial 18 finished with value: 0.553864473104477 and parameters: {'fp_type': 'morgan_rdkit', 'combined_morgan_radius': 2, 'combined_morgan_nBits': 512, 'combined_rdkit_maxPath': 6, 'combined_rdkit_nBits': 1024, 'num_hidden_layers': 2, 'hidden_dim_0': 64, 'hidden_dim_1': 512, 'kl_weight': 0.05455166293335001, 'lr': 0.00416549564202083, 'batch_size': 64, 'dropout_rate': 0.3343776410953367, 'prior_mu': 0.11311348695931783, 'prior_sigma': 0.0967954457715569, 'normalization': 'layer'}. Best is trial 6 with value: 0.47947537899017334.
Generating morgan_rdkit fingerprints...
Generated fingerprints with 1536 features for 841 molecules
Trial 21: 5-fold CV loss = 0.8653
[I 2025-08-07 16:06:56,149] Trial 21 finished with value: 0.8652560353279114 and parameters: {'fp_type': 'morgan_rdkit', 'combined_morgan_radius': 2, 'combined_morgan_nBits': 512, 'combined_rdkit_maxPath': 7, 'combined_rdkit_nBits': 512, 'num_hidden_layers': 3, 'hidden_dim_0': 1024, 'hidden_dim_1': 128, 'hidden_dim_2': 256, 'kl_weight': 0.0014080322992159227, 'lr': 0.0011794413778017832, 'batch_size': 64, 'dropout_rate': 0.2917317064467569, 'prior_mu': 0.1894236771947334, 'prior_sigma': 0.12483896146095898, 'normalization': 'layer'}. Best is trial 6 with value: 0.47947537899017334.
Generating morgan fingerprints...
Generated fingerprints with 2048 features for 841 molecules
Trial 20: 5-fold CV loss = 0.5762
[I 2025-08-07 16:07:20,949] Trial 20 finished with value: 0.5762169778347015 and parameters: {'fp_type': 'morgan_rdkit', 'combined_morgan_radius': 2, 'combined_morgan_nBits': 1024, 'combined_rdkit_maxPath': 7, 'combined_rdkit_nBits': 512, 'num_hidden_layers': 2, 'hidden_dim_0': 1024, 'hidden_dim_1': 1024, 'kl_weight': 0.0014313486604105494, 'lr': 0.00469106647607901, 'batch_size': 64, 'dropout_rate': 0.002710311067882165, 'prior_mu': 0.14436254448993754, 'prior_sigma': 0.12074735646919313, 'normalization': 'layer'}. Best is trial 6 with value: 0.47947537899017334.
Generating morgan_rdkit fingerprints...
Generated fingerprints with 1536 features for 841 molecules
Trial 22: 5-fold CV loss = 0.8802
[I 2025-08-07 16:07:23,409] Trial 22 finished with value: 0.8801964163780213 and parameters: {'fp_type': 'morgan_rdkit', 'combined_morgan_radius': 2, 'combined_morgan_nBits': 1024, 'combined_rdkit_maxPath': 7, 'combined_rdkit_nBits': 512, 'num_hidden_layers': 3, 'hidden_dim_0': 1024, 'hidden_dim_1': 1024, 'hidden_dim_2': 256, 'kl_weight': 0.001579263883723284, 'lr': 0.0008828342394916336, 'batch_size': 64, 'dropout_rate': 0.2654857558988068, 'prior_mu': 0.19058731668443246, 'prior_sigma': 0.13238643048810128, 'normalization': 'layer'}. Best is trial 6 with value: 0.47947537899017334.
Generating morgan_rdkit fingerprints...
Generated fingerprints with 1536 features for 841 molecules
Trial 17: 5-fold CV loss = 0.5487
[I 2025-08-07 16:07:43,350] Trial 17 finished with value: 0.548748105764389 and parameters: {'fp_type': 'morgan_rdkit', 'combined_morgan_radius': 2, 'combined_morgan_nBits': 512, 'combined_rdkit_maxPath': 6, 'combined_rdkit_nBits': 1024, 'num_hidden_layers': 2, 'hidden_dim_0': 64, 'hidden_dim_1': 512, 'kl_weight': 0.04995471949270946, 'lr': 0.0035279072494312745, 'batch_size': 64, 'dropout_rate': 0.32289629947525067, 'prior_mu': 0.12089807899745496, 'prior_sigma': 0.09728987650527526, 'normalization': 'layer'}. Best is trial 6 with value: 0.47947537899017334.
Generating morgan_rdkit fingerprints...
Generated fingerprints with 768 features for 841 molecules
Trial 23: 5-fold CV loss = 0.6018
[I 2025-08-07 16:07:54,836] Trial 23 finished with value: 0.6017706215381622 and parameters: {'fp_type': 'morgan', 'morgan_only_radius': 3, 'morgan_only_nBits': 2048, 'num_hidden_layers': 3, 'hidden_dim_0': 64, 'hidden_dim_1': 1024, 'hidden_dim_2': 1024, 'kl_weight': 0.00046785189961880044, 'lr': 0.004869506745554308, 'batch_size': 64, 'dropout_rate': 0.40504980342752395, 'prior_mu': 0.15440668705955396, 'prior_sigma': 0.15976280446484212, 'normalization': 'layer'}. Best is trial 6 with value: 0.47947537899017334.
Generating morgan_rdkit fingerprints...
Generated fingerprints with 768 features for 841 molecules
Trial 25: 5-fold CV loss = 0.4949
[I 2025-08-07 16:08:53,282] Trial 25 finished with value: 0.49492980241775514 and parameters: {'fp_type': 'morgan_rdkit', 'combined_morgan_radius': 2, 'combined_morgan_nBits': 512, 'combined_rdkit_maxPath': 5, 'combined_rdkit_nBits': 1024, 'num_hidden_layers': 2, 'hidden_dim_0': 64, 'hidden_dim_1': 512, 'kl_weight': 0.0002776140334278578, 'lr': 0.0045782704536856235, 'batch_size': 32, 'dropout_rate': 0.37445019816139347, 'prior_mu': 0.08749855323401688, 'prior_sigma': 0.07436909909496722, 'normalization': 'layer'}. Best is trial 6 with value: 0.47947537899017334.
Generating morgan_rdkit fingerprints...
Generated fingerprints with 768 features for 841 molecules
Trial 24: 5-fold CV loss = 0.4976
[I 2025-08-07 16:09:08,747] Trial 24 finished with value: 0.4976049780845642 and parameters: {'fp_type': 'morgan_rdkit', 'combined_morgan_radius': 2, 'combined_morgan_nBits': 512, 'combined_rdkit_maxPath': 5, 'combined_rdkit_nBits': 1024, 'num_hidden_layers': 2, 'hidden_dim_0': 64, 'hidden_dim_1': 512, 'kl_weight': 0.0003317441454291164, 'lr': 0.0015662901012278299, 'batch_size': 32, 'dropout_rate': 0.3958972625606293, 'prior_mu': 0.08603847957056703, 'prior_sigma': 0.08198881707539224, 'normalization': 'layer'}. Best is trial 6 with value: 0.47947537899017334.
Generating morgan_rdkit fingerprints...
Generated fingerprints with 768 features for 841 molecules
Trial 27: 5-fold CV loss = 0.5230
[I 2025-08-07 16:09:17,399] Trial 27 finished with value: 0.5229799032211304 and parameters: {'fp_type': 'morgan_rdkit', 'combined_morgan_radius': 2, 'combined_morgan_nBits': 512, 'combined_rdkit_maxPath': 5, 'combined_rdkit_nBits': 256, 'num_hidden_layers': 2, 'hidden_dim_0': 64, 'hidden_dim_1': 512, 'kl_weight': 0.0002498312811239204, 'lr': 0.0017750235494979273, 'batch_size': 32, 'dropout_rate': 0.38248632096668, 'prior_mu': 0.061291881775669466, 'prior_sigma': 0.07748363785555182, 'normalization': 'layer'}. Best is trial 6 with value: 0.47947537899017334.
Generating morgan_rdkit fingerprints...
Generated fingerprints with 1536 features for 841 molecules
Trial 29: 5-fold CV loss = 0.6272
[I 2025-08-07 16:09:51,334] Trial 29 finished with value: 0.627240526676178 and parameters: {'fp_type': 'morgan_rdkit', 'combined_morgan_radius': 2, 'combined_morgan_nBits': 512, 'combined_rdkit_maxPath': 5, 'combined_rdkit_nBits': 256, 'num_hidden_layers': 2, 'hidden_dim_0': 64, 'hidden_dim_1': 64, 'kl_weight': 0.00024166291119460067, 'lr': 0.0007434470041465461, 'batch_size': 32, 'dropout_rate': 0.4966563801232677, 'prior_mu': 0.0437512010506832, 'prior_sigma': 0.08008632667306811, 'normalization': 'none'}. Best is trial 6 with value: 0.47947537899017334.
Generating morgan fingerprints...
Generated fingerprints with 2048 features for 841 molecules
Trial 30: 5-fold CV loss = 0.6251
[I 2025-08-07 16:10:37,591] Trial 30 finished with value: 0.62513108253479 and parameters: {'fp_type': 'morgan_rdkit', 'combined_morgan_radius': 2, 'combined_morgan_nBits': 512, 'combined_rdkit_maxPath': 5, 'combined_rdkit_nBits': 1024, 'num_hidden_layers': 3, 'hidden_dim_0': 256, 'hidden_dim_1': 128, 'hidden_dim_2': 64, 'kl_weight': 0.000699491504003907, 'lr': 0.009997150691178892, 'batch_size': 32, 'dropout_rate': 0.1844789613465766, 'prior_mu': -0.026938314044238937, 'prior_sigma': 0.19985316664941316, 'normalization': 'none'}. Best is trial 6 with value: 0.47947537899017334.
Generating morgan fingerprints...
Generated fingerprints with 2048 features for 841 molecules
Trial 28: 5-fold CV loss = 0.5491
[I 2025-08-07 16:10:50,354] Trial 28 finished with value: 0.5490671217441558 and parameters: {'fp_type': 'morgan_rdkit', 'combined_morgan_radius': 2, 'combined_morgan_nBits': 512, 'combined_rdkit_maxPath': 5, 'combined_rdkit_nBits': 256, 'num_hidden_layers': 2, 'hidden_dim_0': 64, 'hidden_dim_1': 512, 'kl_weight': 0.000272541335997222, 'lr': 0.001606179920116449, 'batch_size': 32, 'dropout_rate': 0.48902728930895806, 'prior_mu': 0.07766504851644947, 'prior_sigma': 0.07536215071037304, 'normalization': 'layer'}. Best is trial 6 with value: 0.47947537899017334.
Generating morgan fingerprints...
Generated fingerprints with 2048 features for 841 molecules
Trial 31: 5-fold CV loss = 0.5172
[I 2025-08-07 16:11:05,123] Trial 31 finished with value: 0.5171881794929505 and parameters: {'fp_type': 'morgan', 'morgan_only_radius': 3, 'morgan_only_nBits': 2048, 'num_hidden_layers': 3, 'hidden_dim_0': 128, 'hidden_dim_1': 256, 'hidden_dim_2': 64, 'kl_weight': 0.0008278375270117374, 'lr': 0.005639851576782338, 'batch_size': 32, 'dropout_rate': 0.1918768408449887, 'prior_mu': -0.008022674611023711, 'prior_sigma': 0.1763319281993781, 'normalization': 'layer'}. Best is trial 6 with value: 0.47947537899017334.
Generating morgan_rdkit fingerprints...
Generated fingerprints with 1536 features for 841 molecules
Trial 26: 5-fold CV loss = 0.5069
