[I 2025-08-07 16:50:26,420] Trial 153 finished with value: 0.5143989622592926 and parameters: {'fp_type': 'morgan_rdkit', 'combined_morgan_radius': 2, 'combined_morgan_nBits': 512, 'combined_rdkit_maxPath': 7, 'combined_rdkit_nBits': 1024, 'num_hidden_layers': 2, 'hidden_dim_0': 64, 'hidden_dim_1': 256, 'kl_weight': 0.00010211672967652154, 'lr': 0.0025419606723572894, 'batch_size': 32, 'dropout_rate': 0.23242751089337169, 'prior_mu': 0.06710652943883655, 'prior_sigma': 0.04656376711593885, 'normalization': 'none'}. Best is trial 116 with value: 0.47160428762435913.
Generating morgan fingerprints...
Generated fingerprints with 2048 features for 841 molecules
Trial 159: 5-fold CV loss = 0.5807
[I 2025-08-07 16:50:27,337] Trial 159 finished with value: 0.5806562542915344 and parameters: {'fp_type': 'morgan', 'morgan_only_radius': 3, 'morgan_only_nBits': 2048, 'num_hidden_layers': 2, 'hidden_dim_0': 64, 'hidden_dim_1': 256, 'kl_weight': 0.0001320439062133973, 'lr': 0.002254755854424188, 'batch_size': 32, 'dropout_rate': 0.2836657841166845, 'prior_mu': 0.060640694942591944, 'prior_sigma': 0.03943116440010197, 'normalization': 'none'}. Best is trial 116 with value: 0.47160428762435913.
Generating morgan_rdkit fingerprints...
Generated fingerprints with 1536 features for 841 molecules
Trial 157: 5-fold CV loss = 0.5179
[I 2025-08-07 16:50:40,895] Trial 157 finished with value: 0.5179427742958069 and parameters: {'fp_type': 'morgan', 'morgan_only_radius': 3, 'morgan_only_nBits': 2048, 'num_hidden_layers': 2, 'hidden_dim_0': 64, 'hidden_dim_1': 512, 'kl_weight': 0.0001338136754447826, 'lr': 0.002238944960618703, 'batch_size': 32, 'dropout_rate': 0.25283609068298074, 'prior_mu': 0.08820793696092828, 'prior_sigma': 0.041125341799821385, 'normalization': 'layer'}. Best is trial 116 with value: 0.47160428762435913.
Generating morgan_rdkit fingerprints...
Generated fingerprints with 1536 features for 841 molecules
Trial 158: 5-fold CV loss = 0.5147
[I 2025-08-07 16:50:45,913] Trial 158 finished with value: 0.514666086435318 and parameters: {'fp_type': 'morgan_rdkit', 'combined_morgan_radius': 2, 'combined_morgan_nBits': 512, 'combined_rdkit_maxPath': 7, 'combined_rdkit_nBits': 1024, 'num_hidden_layers': 2, 'hidden_dim_0': 64, 'hidden_dim_1': 256, 'kl_weight': 0.00013989837449486256, 'lr': 0.0029193845182358953, 'batch_size': 32, 'dropout_rate': 0.28393725444929435, 'prior_mu': 0.062172307093610796, 'prior_sigma': 0.03960438490382716, 'normalization': 'none'}. Best is trial 116 with value: 0.47160428762435913.
Generating morgan_rdkit fingerprints...
Generated fingerprints with 1024 features for 841 molecules
Trial 161: 5-fold CV loss = 0.4812
[I 2025-08-07 16:50:57,597] Trial 161 finished with value: 0.48122265934944153 and parameters: {'fp_type': 'morgan_rdkit', 'combined_morgan_radius': 2, 'combined_morgan_nBits': 512, 'combined_rdkit_maxPath': 7, 'combined_rdkit_nBits': 1024, 'num_hidden_layers': 2, 'hidden_dim_0': 64, 'hidden_dim_1': 512, 'kl_weight': 0.0001220147500629036, 'lr': 0.002878756430351349, 'batch_size': 128, 'dropout_rate': 0.28990673848692466, 'prior_mu': 0.08956242116473928, 'prior_sigma': 0.028800775766810723, 'normalization': 'layer'}. Best is trial 116 with value: 0.47160428762435913.
Generating morgan_rdkit fingerprints...
Generated fingerprints with 1536 features for 841 molecules
Trial 163: 5-fold CV loss = 0.5105
[I 2025-08-07 16:51:18,478] Trial 163 finished with value: 0.5105024039745331 and parameters: {'fp_type': 'morgan_rdkit', 'combined_morgan_radius': 2, 'combined_morgan_nBits': 512, 'combined_rdkit_maxPath': 7, 'combined_rdkit_nBits': 512, 'num_hidden_layers': 2, 'hidden_dim_0': 64, 'hidden_dim_1': 512, 'kl_weight': 0.00012037156236559425, 'lr': 0.0026593654899799385, 'batch_size': 128, 'dropout_rate': 0.29354510800124806, 'prior_mu': 0.04902143458419689, 'prior_sigma': 0.02979320414472742, 'normalization': 'layer'}. Best is trial 116 with value: 0.47160428762435913.
Generating morgan_rdkit fingerprints...
Generated fingerprints with 1536 features for 841 molecules
Trial 162: 5-fold CV loss = 0.4872
[I 2025-08-07 16:51:26,435] Trial 162 finished with value: 0.48718989491462705 and parameters: {'fp_type': 'morgan_rdkit', 'combined_morgan_radius': 2, 'combined_morgan_nBits': 512, 'combined_rdkit_maxPath': 7, 'combined_rdkit_nBits': 1024, 'num_hidden_layers': 2, 'hidden_dim_0': 64, 'hidden_dim_1': 512, 'kl_weight': 0.00011840771481061256, 'lr': 0.002913582709779153, 'batch_size': 128, 'dropout_rate': 0.29167324060493904, 'prior_mu': 0.09252604728411652, 'prior_sigma': 0.028695358340010947, 'normalization': 'layer'}. Best is trial 116 with value: 0.47160428762435913.
Generating morgan_rdkit fingerprints...
Generated fingerprints with 1536 features for 841 molecules
Trial 164: 5-fold CV loss = 0.4786
[I 2025-08-07 16:51:55,854] Trial 164 finished with value: 0.47858740091323854 and parameters: {'fp_type': 'morgan_rdkit', 'combined_morgan_radius': 2, 'combined_morgan_nBits': 512, 'combined_rdkit_maxPath': 7, 'combined_rdkit_nBits': 1024, 'num_hidden_layers': 2, 'hidden_dim_0': 64, 'hidden_dim_1': 512, 'kl_weight': 0.00015412681820301075, 'lr': 0.0026477733269598155, 'batch_size': 32, 'dropout_rate': 0.30848192350686426, 'prior_mu': 0.04747947536899528, 'prior_sigma': 0.02544834355108691, 'normalization': 'layer'}. Best is trial 116 with value: 0.47160428762435913.
Generating morgan_rdkit fingerprints...
Generated fingerprints with 1536 features for 841 molecules
Trial 160: 5-fold CV loss = 0.5177
[I 2025-08-07 16:52:03,063] Trial 160 finished with value: 0.517730462551117 and parameters: {'fp_type': 'morgan', 'morgan_only_radius': 3, 'morgan_only_nBits': 2048, 'num_hidden_layers': 2, 'hidden_dim_0': 64, 'hidden_dim_1': 512, 'kl_weight': 0.00012856185583693143, 'lr': 0.002852640262025194, 'batch_size': 32, 'dropout_rate': 0.21112822514725704, 'prior_mu': 0.09268551677771611, 'prior_sigma': 0.03999294920744567, 'normalization': 'layer'}. Best is trial 116 with value: 0.47160428762435913.
Generating morgan_rdkit fingerprints...
Generated fingerprints with 1536 features for 841 molecules
Trial 165: 5-fold CV loss = 0.4758
[I 2025-08-07 16:52:27,448] Trial 165 finished with value: 0.4758331298828125 and parameters: {'fp_type': 'morgan_rdkit', 'combined_morgan_radius': 2, 'combined_morgan_nBits': 512, 'combined_rdkit_maxPath': 7, 'combined_rdkit_nBits': 1024, 'num_hidden_layers': 2, 'hidden_dim_0': 128, 'hidden_dim_1': 512, 'kl_weight': 0.0001587269772876688, 'lr': 0.003742404943567449, 'batch_size': 32, 'dropout_rate': 0.15909477412945294, 'prior_mu': 0.11171052380446996, 'prior_sigma': 0.025831064791866816, 'normalization': 'layer'}. Best is trial 116 with value: 0.47160428762435913.
Generating morgan_rdkit fingerprints...
Generated fingerprints with 1536 features for 841 molecules
Trial 167: 5-fold CV loss = 0.4771
[I 2025-08-07 16:53:04,315] Trial 167 finished with value: 0.4770733952522278 and parameters: {'fp_type': 'morgan_rdkit', 'combined_morgan_radius': 2, 'combined_morgan_nBits': 512, 'combined_rdkit_maxPath': 7, 'combined_rdkit_nBits': 1024, 'num_hidden_layers': 2, 'hidden_dim_0': 64, 'hidden_dim_1': 512, 'kl_weight': 0.00015957392877866545, 'lr': 0.001992358532654007, 'batch_size': 32, 'dropout_rate': 0.30252448355881156, 'prior_mu': 0.04418120351359961, 'prior_sigma': 0.03184762636075974, 'normalization': 'layer'}. Best is trial 116 with value: 0.47160428762435913.
Generating morgan_rdkit fingerprints...
Generated fingerprints with 1536 features for 841 molecules
Trial 166: 5-fold CV loss = 0.4796
[I 2025-08-07 16:53:06,873] Trial 166 finished with value: 0.4796301186084747 and parameters: {'fp_type': 'morgan_rdkit', 'combined_morgan_radius': 2, 'combined_morgan_nBits': 512, 'combined_rdkit_maxPath': 7, 'combined_rdkit_nBits': 1024, 'num_hidden_layers': 2, 'hidden_dim_0': 128, 'hidden_dim_1': 512, 'kl_weight': 0.00015830771971408816, 'lr': 0.003739193339772652, 'batch_size': 32, 'dropout_rate': 0.26627697077804385, 'prior_mu': 0.11019620815696037, 'prior_sigma': 0.025055122605158492, 'normalization': 'layer'}. Best is trial 116 with value: 0.47160428762435913.
Generating morgan_rdkit fingerprints...
Generated fingerprints with 1536 features for 841 molecules
Trial 169: 5-fold CV loss = 0.4797
[I 2025-08-07 16:53:25,558] Trial 169 finished with value: 0.47970850467681886 and parameters: {'fp_type': 'morgan_rdkit', 'combined_morgan_radius': 2, 'combined_morgan_nBits': 512, 'combined_rdkit_maxPath': 7, 'combined_rdkit_nBits': 1024, 'num_hidden_layers': 2, 'hidden_dim_0': 128, 'hidden_dim_1': 512, 'kl_weight': 0.0001589515574399212, 'lr': 0.0023984526150615565, 'batch_size': 32, 'dropout_rate': 0.2736501068632064, 'prior_mu': 0.11372323012348876, 'prior_sigma': 0.024518090283156845, 'normalization': 'layer'}. Best is trial 116 with value: 0.47160428762435913.
Generating morgan_rdkit fingerprints...
Generated fingerprints with 1536 features for 841 molecules
Trial 170: 5-fold CV loss = 0.4787
[I 2025-08-07 16:54:04,861] Trial 170 finished with value: 0.47871164679527284 and parameters: {'fp_type': 'morgan_rdkit', 'combined_morgan_radius': 2, 'combined_morgan_nBits': 512, 'combined_rdkit_maxPath': 7, 'combined_rdkit_nBits': 1024, 'num_hidden_layers': 2, 'hidden_dim_0': 128, 'hidden_dim_1': 512, 'kl_weight': 0.00020651080042263366, 'lr': 0.0018091713597907296, 'batch_size': 32, 'dropout_rate': 0.1642002359391034, 'prior_mu': 0.11115315197740014, 'prior_sigma': 0.03227659943099669, 'normalization': 'layer'}. Best is trial 116 with value: 0.47160428762435913.
Generating morgan_rdkit fingerprints...
Generated fingerprints with 1536 features for 841 molecules
Trial 172: 5-fold CV loss = 0.4825
[I 2025-08-07 16:54:31,466] Trial 172 finished with value: 0.48248874545097353 and parameters: {'fp_type': 'morgan_rdkit', 'combined_morgan_radius': 2, 'combined_morgan_nBits': 512, 'combined_rdkit_maxPath': 7, 'combined_rdkit_nBits': 1024, 'num_hidden_layers': 2, 'hidden_dim_0': 128, 'hidden_dim_1': 512, 'kl_weight': 0.00020491925288722269, 'lr': 0.002005306237437153, 'batch_size': 32, 'dropout_rate': 0.16150825999617077, 'prior_mu': 0.07911383222423116, 'prior_sigma': 0.03249540936728387, 'normalization': 'layer'}. Best is trial 116 with value: 0.47160428762435913.
Generating morgan_rdkit fingerprints...
Generated fingerprints with 1536 features for 841 molecules
Trial 171: 5-fold CV loss = 0.4797
[I 2025-08-07 16:54:32,877] Trial 171 finished with value: 0.47970154881477356 and parameters: {'fp_type': 'morgan_rdkit', 'combined_morgan_radius': 2, 'combined_morgan_nBits': 512, 'combined_rdkit_maxPath': 7, 'combined_rdkit_nBits': 1024, 'num_hidden_layers': 2, 'hidden_dim_0': 128, 'hidden_dim_1': 64, 'kl_weight': 0.00019586890622635565, 'lr': 0.002407435504957087, 'batch_size': 32, 'dropout_rate': 0.1631830121298363, 'prior_mu': 0.08094297511735897, 'prior_sigma': 0.03406514404952913, 'normalization': 'layer'}. Best is trial 116 with value: 0.47160428762435913.
Generating morgan_rdkit fingerprints...
Generated fingerprints with 1536 features for 841 molecules
Trial 168: 5-fold CV loss = 0.4776
[I 2025-08-07 16:55:17,431] Trial 168 finished with value: 0.477570104598999 and parameters: {'fp_type': 'morgan_rdkit', 'combined_morgan_radius': 2, 'combined_morgan_nBits': 512, 'combined_rdkit_maxPath': 7, 'combined_rdkit_nBits': 1024, 'num_hidden_layers': 2, 'hidden_dim_0': 128, 'hidden_dim_1': 512, 'kl_weight': 0.00016218650870841495, 'lr': 0.001979470622609301, 'batch_size': 32, 'dropout_rate': 0.32988213679870804, 'prior_mu': 0.11053752119266842, 'prior_sigma': 0.03329714680354082, 'normalization': 'layer'}. Best is trial 116 with value: 0.47160428762435913.
Generating morgan_rdkit fingerprints...
Generated fingerprints with 1536 features for 841 molecules
Trial 173: 5-fold CV loss = 0.4797
[I 2025-08-07 16:55:27,235] Trial 173 finished with value: 0.47966715693473816 and parameters: {'fp_type': 'morgan_rdkit', 'combined_morgan_radius': 2, 'combined_morgan_nBits': 512, 'combined_rdkit_maxPath': 7, 'combined_rdkit_nBits': 1024, 'num_hidden_layers': 2, 'hidden_dim_0': 128, 'hidden_dim_1': 64, 'kl_weight': 0.00019627921518495628, 'lr': 0.0020052450603840967, 'batch_size': 32, 'dropout_rate': 0.3294502632430754, 'prior_mu': -0.10317930570309031, 'prior_sigma': 0.03676123256081852, 'normalization': 'layer'}. Best is trial 116 with value: 0.47160428762435913.
Generating morgan_rdkit fingerprints...
Generated fingerprints with 1536 features for 841 molecules
Trial 174: 5-fold CV loss = 0.4817
[I 2025-08-07 16:55:48,477] Trial 174 finished with value: 0.48167778849601744 and parameters: {'fp_type': 'morgan_rdkit', 'combined_morgan_radius': 2, 'combined_morgan_nBits': 512, 'combined_rdkit_maxPath': 7, 'combined_rdkit_nBits': 1024, 'num_hidden_layers': 2, 'hidden_dim_0': 64, 'hidden_dim_1': 512, 'kl_weight': 0.0001441623204387633, 'lr': 0.0025535707921394285, 'batch_size': 32, 'dropout_rate': 0.3071826802898687, 'prior_mu': 0.0432652047411041, 'prior_sigma': 0.03603473899924639, 'normalization': 'layer'}. Best is trial 116 with value: 0.47160428762435913.
Generating morgan_rdkit fingerprints...
Generated fingerprints with 1536 features for 841 molecules
Trial 177: 5-fold CV loss = 0.4829
[I 2025-08-07 16:56:24,383] Trial 177 finished with value: 0.4828695774078369 and parameters: {'fp_type': 'morgan_rdkit', 'combined_morgan_radius': 2, 'combined_morgan_nBits': 512, 'combined_rdkit_maxPath': 7, 'combined_rdkit_nBits': 1024, 'num_hidden_layers': 2, 'hidden_dim_0': 128, 'hidden_dim_1': 512, 'kl_weight': 0.000143620273311583, 'lr': 0.0016612403804250049, 'batch_size': 32, 'dropout_rate': 0.1486518726014627, 'prior_mu': 0.12043999430005498, 'prior_sigma': 0.03062290365727582, 'normalization': 'layer'}. Best is trial 116 with value: 0.47160428762435913.
Generating morgan_rdkit fingerprints...
Generated fingerprints with 2048 features for 841 molecules
Trial 175: 5-fold CV loss = 0.4791
[I 2025-08-07 16:56:42,363] Trial 175 finished with value: 0.4791496455669403 and parameters: {'fp_type': 'morgan_rdkit', 'combined_morgan_radius': 2, 'combined_morgan_nBits': 512, 'combined_rdkit_maxPath': 7, 'combined_rdkit_nBits': 1024, 'num_hidden_layers': 2, 'hidden_dim_0': 64, 'hidden_dim_1': 512, 'kl_weight': 0.000146664855529049, 'lr': 0.001679906917170969, 'batch_size': 32, 'dropout_rate': 0.30833593450900376, 'prior_mu': 0.04430574897460325, 'prior_sigma': 0.04416761605019753, 'normalization': 'layer'}. Best is trial 116 with value: 0.47160428762435913.
Generating morgan_rdkit fingerprints...
Generated fingerprints with 2048 features for 841 molecules
Trial 178: 5-fold CV loss = 0.4788
[I 2025-08-07 16:57:12,824] Trial 178 finished with value: 0.4787502408027649 and parameters: {'fp_type': 'morgan_rdkit', 'combined_morgan_radius': 2, 'combined_morgan_nBits': 512, 'combined_rdkit_maxPath': 7, 'combined_rdkit_nBits': 1024, 'num_hidden_layers': 2, 'hidden_dim_0': 128, 'hidden_dim_1': 512, 'kl_weight': 0.00011769665967260408, 'lr': 0.0017682317089058803, 'batch_size': 32, 'dropout_rate': 0.14924892322267597, 'prior_mu': 0.09947759781645742, 'prior_sigma': 0.04438524825797562, 'normalization': 'layer'}. Best is trial 116 with value: 0.47160428762435913.
Generating morgan_rdkit fingerprints...
Generated fingerprints with 2048 features for 841 molecules
Trial 179: 5-fold CV loss = 0.4672
[I 2025-08-07 16:57:40,745] Trial 179 finished with value: 0.4671938598155975 and parameters: {'fp_type': 'morgan_rdkit', 'combined_morgan_radius': 2, 'combined_morgan_nBits': 1024, 'combined_rdkit_maxPath': 7, 'combined_rdkit_nBits': 1024, 'num_hidden_layers': 2, 'hidden_dim_0': 64, 'hidden_dim_1': 512, 'kl_weight': 0.00011461514297082344, 'lr': 0.0017934810460017972, 'batch_size': 32, 'dropout_rate': 0.336954572329395, 'prior_mu': 0.09679493733775257, 'prior_sigma': 0.04399490297774805, 'normalization': 'layer'}. Best is trial 179 with value: 0.4671938598155975.
Generating morgan_rdkit fingerprints...
Generated fingerprints with 2048 features for 841 molecules
Trial 180: 5-fold CV loss = 0.4797
[I 2025-08-07 16:58:16,753] Trial 180 finished with value: 0.4796615719795227 and parameters: {'fp_type': 'morgan_rdkit', 'combined_morgan_radius': 2, 'combined_morgan_nBits': 1024, 'combined_rdkit_maxPath': 7, 'combined_rdkit_nBits': 1024, 'num_hidden_layers': 2, 'hidden_dim_0': 128, 'hidden_dim_1': 512, 'kl_weight': 0.00011765841528538852, 'lr': 0.003136876492820104, 'batch_size': 32, 'dropout_rate': 0.33593694545079844, 'prior_mu': 0.09743053878419625, 'prior_sigma': 0.03766165024171642, 'normalization': 'layer'}. Best is trial 179 with value: 0.4671938598155975.
Generating morgan_rdkit fingerprints...
Generated fingerprints with 2048 features for 841 molecules
Trial 181: 5-fold CV loss = 0.4884
[I 2025-08-07 16:58:26,849] Trial 181 finished with value: 0.48840320110321045 and parameters: {'fp_type': 'morgan_rdkit', 'combined_morgan_radius': 2, 'combined_morgan_nBits': 1024, 'combined_rdkit_maxPath': 7, 'combined_rdkit_nBits': 1024, 'num_hidden_layers': 2, 'hidden_dim_0': 64, 'hidden_dim_1': 512, 'kl_weight': 0.00017981642478935117, 'lr': 0.002157422352906591, 'batch_size': 32, 'dropout_rate': 0.19053086631960695, 'prior_mu': 0.06123103330465664, 'prior_sigma': 0.04975278722506079, 'normalization': 'layer'}. Best is trial 179 with value: 0.4671938598155975.
Generating morgan_rdkit fingerprints...
Generated fingerprints with 2048 features for 841 molecules
Trial 176: 5-fold CV loss = 0.4800
[I 2025-08-07 16:58:36,601] Trial 176 finished with value: 0.4799659073352814 and parameters: {'fp_type': 'morgan_rdkit', 'combined_morgan_radius': 2, 'combined_morgan_nBits': 512, 'combined_rdkit_maxPath': 7, 'combined_rdkit_nBits': 1024, 'num_hidden_layers': 2, 'hidden_dim_0': 128, 'hidden_dim_1': 512, 'kl_weight': 0.00013658287709356496, 'lr': 0.0017306310156325313, 'batch_size': 32, 'dropout_rate': 0.3346497910719429, 'prior_mu': 0.10572921343449296, 'prior_sigma': 0.04337269198846838, 'normalization': 'layer'}. Best is trial 179 with value: 0.4671938598155975.
Generating morgan_rdkit fingerprints...
Generated fingerprints with 2048 features for 841 molecules
Trial 182: 5-fold CV loss = 0.4828
[I 2025-08-07 16:58:58,498] Trial 182 finished with value: 0.4828100264072418 and parameters: {'fp_type': 'morgan_rdkit', 'combined_morgan_radius': 2, 'combined_morgan_nBits': 1024, 'combined_rdkit_maxPath': 7, 'combined_rdkit_nBits': 1024, 'num_hidden_layers': 2, 'hidden_dim_0': 64, 'hidden_dim_1': 512, 'kl_weight': 0.000180611754853095, 'lr': 0.0014779225377710193, 'batch_size': 32, 'dropout_rate': 0.33874428075537716, 'prior_mu': 0.09872477903179798, 'prior_sigma': 0.05191467032304463, 'normalization': 'layer'}. Best is trial 179 with value: 0.4671938598155975.
Generating morgan_rdkit fingerprints...
Generated fingerprints with 2048 features for 841 molecules
Trial 184: 5-fold CV loss = 0.4802
[I 2025-08-07 16:59:46,611] Trial 184 finished with value: 0.4802221417427063 and parameters: {'fp_type': 'morgan_rdkit', 'combined_morgan_radius': 2, 'combined_morgan_nBits': 1024, 'combined_rdkit_maxPath': 7, 'combined_rdkit_nBits': 1024, 'num_hidden_layers': 2, 'hidden_dim_0': 64, 'hidden_dim_1': 512, 'kl_weight': 0.00011004078406339632, 'lr': 0.0019234453364946808, 'batch_size': 32, 'dropout_rate': 0.3547835671671958, 'prior_mu': 0.10639033702260006, 'prior_sigma': 0.04250867858485278, 'normalization': 'layer'}. Best is trial 179 with value: 0.4671938598155975.
Generating morgan_rdkit fingerprints...
Generated fingerprints with 2048 features for 841 molecules
Trial 186: 5-fold CV loss = 0.4751
[I 2025-08-07 16:59:55,696] Trial 186 finished with value: 0.47508984208106997 and parameters: {'fp_type': 'morgan_rdkit', 'combined_morgan_radius': 2, 'combined_morgan_nBits': 1024, 'combined_rdkit_maxPath': 7, 'combined_rdkit_nBits': 1024, 'num_hidden_layers': 2, 'hidden_dim_0': 64, 'hidden_dim_1': 512, 'kl_weight': 0.00011033643410102857, 'lr': 0.0036192142485908132, 'batch_size': 32, 'dropout_rate': 0.319745154138758, 'prior_mu': 0.0741899734081157, 'prior_sigma': 0.027950847834034762, 'normalization': 'layer'}. Best is trial 179 with value: 0.4671938598155975.
Generating morgan_rdkit fingerprints...
Generated fingerprints with 2048 features for 841 molecules
Trial 183: 5-fold CV loss = 0.4872
[I 2025-08-07 17:00:38,592] Trial 183 finished with value: 0.4872461974620819 and parameters: {'fp_type': 'morgan_rdkit', 'combined_morgan_radius': 2, 'combined_morgan_nBits': 1024, 'combined_rdkit_maxPath': 8, 'combined_rdkit_nBits': 1024, 'num_hidden_layers': 2, 'hidden_dim_0': 64, 'hidden_dim_1': 512, 'kl_weight': 0.0001820293452623693, 'lr': 0.0012210188754792563, 'batch_size': 32, 'dropout_rate': 0.3207952430404569, 'prior_mu': 0.07306949705186941, 'prior_sigma': 0.05027202084897456, 'normalization': 'layer'}. Best is trial 179 with value: 0.4671938598155975.
Generating rdkit fingerprints...
Generated fingerprints with 512 features for 841 molecules
Trial 187: 5-fold CV loss = 0.4946
[I 2025-08-07 17:00:46,509] Trial 187 finished with value: 0.4946165382862091 and parameters: {'fp_type': 'morgan_rdkit', 'combined_morgan_radius': 2, 'combined_morgan_nBits': 1024, 'combined_rdkit_maxPath': 8, 'combined_rdkit_nBits': 1024, 'num_hidden_layers': 2, 'hidden_dim_0': 64, 'hidden_dim_1': 512, 'kl_weight': 0.00012560810839110038, 'lr': 0.003631378617141536, 'batch_size': 32, 'dropout_rate': 0.32506929394185213, 'prior_mu': 0.08443630917410658, 'prior_sigma': 0.01705083969735336, 'normalization': 'layer'}. Best is trial 179 with value: 0.4671938598155975.
Generating rdkit fingerprints...
Generated fingerprints with 512 features for 841 molecules
Trial 188: 5-fold CV loss = 0.4818
