[I 2025-08-07 20:23:41,134] Trial 1005 finished with value: 0.4644641876220703 and parameters: {'fp_type': 'morgan_rdkit', 'combined_morgan_radius': 3, 'combined_morgan_nBits': 1024, 'combined_rdkit_maxPath': 7, 'combined_rdkit_nBits': 1024, 'num_hidden_layers': 3, 'hidden_dim_0': 256, 'hidden_dim_1': 1024, 'hidden_dim_2': 64, 'kl_weight': 0.001151772538519618, 'lr': 0.007177605789546617, 'batch_size': 128, 'dropout_rate': 0.10327512143801718, 'prior_mu': -0.018253454866147475, 'prior_sigma': 0.07249904186507522, 'normalization': 'layer'}. Best is trial 896 with value: 0.4533553242683411.
Generating morgan_rdkit fingerprints...
Generated fingerprints with 2048 features for 841 molecules
Trial 1007: 5-fold CV loss = 0.4599
[I 2025-08-07 20:23:56,484] Trial 1007 finished with value: 0.4598738670349121 and parameters: {'fp_type': 'morgan_rdkit', 'combined_morgan_radius': 3, 'combined_morgan_nBits': 1024, 'combined_rdkit_maxPath': 7, 'combined_rdkit_nBits': 1024, 'num_hidden_layers': 3, 'hidden_dim_0': 256, 'hidden_dim_1': 1024, 'hidden_dim_2': 64, 'kl_weight': 0.000337737574494449, 'lr': 0.0058267931177858395, 'batch_size': 128, 'dropout_rate': 0.11152374276796924, 'prior_mu': -0.019201444138752168, 'prior_sigma': 0.0736408856851313, 'normalization': 'layer'}. Best is trial 896 with value: 0.4533553242683411.
Generating morgan_rdkit fingerprints...
Generated fingerprints with 2048 features for 841 molecules
Trial 1006: 5-fold CV loss = 0.4575
[I 2025-08-07 20:24:00,122] Trial 1006 finished with value: 0.4574775755405426 and parameters: {'fp_type': 'morgan_rdkit', 'combined_morgan_radius': 3, 'combined_morgan_nBits': 1024, 'combined_rdkit_maxPath': 7, 'combined_rdkit_nBits': 1024, 'num_hidden_layers': 3, 'hidden_dim_0': 256, 'hidden_dim_1': 1024, 'hidden_dim_2': 64, 'kl_weight': 0.0003492850925940589, 'lr': 0.00562619107259948, 'batch_size': 128, 'dropout_rate': 0.10904478363610166, 'prior_mu': -0.021409394697036673, 'prior_sigma': 0.06860311531735108, 'normalization': 'layer'}. Best is trial 896 with value: 0.4533553242683411.
Generating morgan_rdkit fingerprints...
Generated fingerprints with 2048 features for 841 molecules
Trial 1009: 5-fold CV loss = 0.8723
[I 2025-08-07 20:24:12,883] Trial 1009 finished with value: 0.8722570180892945 and parameters: {'fp_type': 'morgan_rdkit', 'combined_morgan_radius': 3, 'combined_morgan_nBits': 1024, 'combined_rdkit_maxPath': 7, 'combined_rdkit_nBits': 1024, 'num_hidden_layers': 3, 'hidden_dim_0': 256, 'hidden_dim_1': 1024, 'hidden_dim_2': 64, 'kl_weight': 0.000339335278004926, 'lr': 0.000375797538566918, 'batch_size': 128, 'dropout_rate': 0.11009477933608246, 'prior_mu': 0.0013837472489837575, 'prior_sigma': 0.08000883997861184, 'normalization': 'layer'}. Best is trial 896 with value: 0.4533553242683411.
Generating morgan_rdkit fingerprints...
Generated fingerprints with 2048 features for 841 molecules
Trial 1008: 5-fold CV loss = 0.8781
[I 2025-08-07 20:24:23,346] Trial 1008 finished with value: 0.8780756711959838 and parameters: {'fp_type': 'morgan_rdkit', 'combined_morgan_radius': 3, 'combined_morgan_nBits': 1024, 'combined_rdkit_maxPath': 7, 'combined_rdkit_nBits': 1024, 'num_hidden_layers': 3, 'hidden_dim_0': 256, 'hidden_dim_1': 1024, 'hidden_dim_2': 64, 'kl_weight': 0.00034515744320879927, 'lr': 0.00037282202717135845, 'batch_size': 128, 'dropout_rate': 0.10876709438331225, 'prior_mu': -0.02080268094348016, 'prior_sigma': 0.0742381005114645, 'normalization': 'layer'}. Best is trial 896 with value: 0.4533553242683411.
Generating morgan_rdkit fingerprints...
Generated fingerprints with 2048 features for 841 molecules
Trial 1010: 5-fold CV loss = 0.4674
[I 2025-08-07 20:24:37,157] Trial 1010 finished with value: 0.4673833191394806 and parameters: {'fp_type': 'morgan_rdkit', 'combined_morgan_radius': 3, 'combined_morgan_nBits': 1024, 'combined_rdkit_maxPath': 7, 'combined_rdkit_nBits': 1024, 'num_hidden_layers': 3, 'hidden_dim_0': 256, 'hidden_dim_1': 1024, 'hidden_dim_2': 64, 'kl_weight': 0.0003493718647048422, 'lr': 0.004936474787705764, 'batch_size': 128, 'dropout_rate': 0.1118711862365562, 'prior_mu': -0.01982371484974233, 'prior_sigma': 0.07880789660569654, 'normalization': 'layer'}. Best is trial 896 with value: 0.4533553242683411.
Generating morgan_rdkit fingerprints...
Generated fingerprints with 2048 features for 841 molecules
Trial 1011: 5-fold CV loss = 0.4619
[I 2025-08-07 20:24:43,092] Trial 1011 finished with value: 0.4618799686431885 and parameters: {'fp_type': 'morgan_rdkit', 'combined_morgan_radius': 3, 'combined_morgan_nBits': 1024, 'combined_rdkit_maxPath': 7, 'combined_rdkit_nBits': 1024, 'num_hidden_layers': 3, 'hidden_dim_0': 256, 'hidden_dim_1': 1024, 'hidden_dim_2': 64, 'kl_weight': 0.0003467098759174839, 'lr': 0.004724352629470993, 'batch_size': 128, 'dropout_rate': 0.11087927918144984, 'prior_mu': -0.023414010063514977, 'prior_sigma': 0.06620195359000121, 'normalization': 'layer'}. Best is trial 896 with value: 0.4533553242683411.
Generating morgan_rdkit fingerprints...
Generated fingerprints with 2048 features for 841 molecules
Trial 1012: 5-fold CV loss = 0.4647
[I 2025-08-07 20:25:10,271] Trial 1012 finished with value: 0.46473386883735657 and parameters: {'fp_type': 'morgan_rdkit', 'combined_morgan_radius': 3, 'combined_morgan_nBits': 1024, 'combined_rdkit_maxPath': 7, 'combined_rdkit_nBits': 1024, 'num_hidden_layers': 3, 'hidden_dim_0': 256, 'hidden_dim_1': 1024, 'hidden_dim_2': 64, 'kl_weight': 0.000337540964146291, 'lr': 0.004981472593719048, 'batch_size': 128, 'dropout_rate': 0.10858569225836746, 'prior_mu': -0.02271046328710943, 'prior_sigma': 0.06928209680504623, 'normalization': 'layer'}. Best is trial 896 with value: 0.4533553242683411.
Generating morgan_rdkit fingerprints...
Generated fingerprints with 2048 features for 841 molecules
Trial 1014: 5-fold CV loss = 0.4640
[I 2025-08-07 20:25:15,792] Trial 1014 finished with value: 0.4640366494655609 and parameters: {'fp_type': 'morgan_rdkit', 'combined_morgan_radius': 3, 'combined_morgan_nBits': 1024, 'combined_rdkit_maxPath': 7, 'combined_rdkit_nBits': 1024, 'num_hidden_layers': 3, 'hidden_dim_0': 256, 'hidden_dim_1': 1024, 'hidden_dim_2': 64, 'kl_weight': 0.00036850844948339395, 'lr': 0.005379108243304302, 'batch_size': 128, 'dropout_rate': 0.10566021107454973, 'prior_mu': -0.028280281368975, 'prior_sigma': 0.06747923066926198, 'normalization': 'layer'}. Best is trial 896 with value: 0.4533553242683411.
Generating morgan_rdkit fingerprints...
Generated fingerprints with 2048 features for 841 molecules
Trial 1015: 5-fold CV loss = 0.4628
[I 2025-08-07 20:25:23,821] Trial 1015 finished with value: 0.4628396391868591 and parameters: {'fp_type': 'morgan_rdkit', 'combined_morgan_radius': 3, 'combined_morgan_nBits': 1024, 'combined_rdkit_maxPath': 7, 'combined_rdkit_nBits': 1024, 'num_hidden_layers': 3, 'hidden_dim_0': 256, 'hidden_dim_1': 1024, 'hidden_dim_2': 64, 'kl_weight': 0.000313698248922271, 'lr': 0.005196380140121945, 'batch_size': 128, 'dropout_rate': 0.1089603926711533, 'prior_mu': -0.026916645698305278, 'prior_sigma': 0.06426110099552444, 'normalization': 'layer'}. Best is trial 896 with value: 0.4533553242683411.
Generating morgan_rdkit fingerprints...
Generated fingerprints with 2048 features for 841 molecules
Trial 1018: 5-fold CV loss = 0.8795
[I 2025-08-07 20:25:40,574] Trial 1018 finished with value: 0.8795195341110229 and parameters: {'fp_type': 'morgan_rdkit', 'combined_morgan_radius': 3, 'combined_morgan_nBits': 1024, 'combined_rdkit_maxPath': 7, 'combined_rdkit_nBits': 1024, 'num_hidden_layers': 3, 'hidden_dim_0': 256, 'hidden_dim_1': 256, 'hidden_dim_2': 64, 'kl_weight': 0.0003815433960442024, 'lr': 0.0006803460364517231, 'batch_size': 128, 'dropout_rate': 0.11780581647963631, 'prior_mu': -0.030327370694515944, 'prior_sigma': 0.06881435652725178, 'normalization': 'layer'}. Best is trial 896 with value: 0.4533553242683411.
Generating morgan_rdkit fingerprints...
Generated fingerprints with 2048 features for 841 molecules
Trial 1017: 5-fold CV loss = 0.4671
[I 2025-08-07 20:25:51,807] Trial 1017 finished with value: 0.4670707046985626 and parameters: {'fp_type': 'morgan_rdkit', 'combined_morgan_radius': 3, 'combined_morgan_nBits': 1024, 'combined_rdkit_maxPath': 7, 'combined_rdkit_nBits': 1024, 'num_hidden_layers': 3, 'hidden_dim_0': 256, 'hidden_dim_1': 256, 'hidden_dim_2': 64, 'kl_weight': 0.0003122476655824398, 'lr': 0.00528655493998206, 'batch_size': 128, 'dropout_rate': 0.08641213179387362, 'prior_mu': -0.02787059979324969, 'prior_sigma': 0.07208874035236598, 'normalization': 'layer'}. Best is trial 896 with value: 0.4533553242683411.
Generating morgan_rdkit fingerprints...
Generated fingerprints with 2048 features for 841 molecules
Trial 1013: 5-fold CV loss = 0.4588
[I 2025-08-07 20:25:59,819] Trial 1013 finished with value: 0.45881672501564025 and parameters: {'fp_type': 'morgan_rdkit', 'combined_morgan_radius': 3, 'combined_morgan_nBits': 1024, 'combined_rdkit_maxPath': 7, 'combined_rdkit_nBits': 1024, 'num_hidden_layers': 3, 'hidden_dim_0': 256, 'hidden_dim_1': 1024, 'hidden_dim_2': 64, 'kl_weight': 0.00036151249367724083, 'lr': 0.00496196311421404, 'batch_size': 128, 'dropout_rate': 0.10980758809382865, 'prior_mu': -0.026390791546198285, 'prior_sigma': 0.06449542262269181, 'normalization': 'layer'}. Best is trial 896 with value: 0.4533553242683411.
Generating morgan_rdkit fingerprints...
Generated fingerprints with 2048 features for 841 molecules
Trial 1016: 5-fold CV loss = 0.4703
[I 2025-08-07 20:26:15,081] Trial 1016 finished with value: 0.47028623819351195 and parameters: {'fp_type': 'morgan_rdkit', 'combined_morgan_radius': 3, 'combined_morgan_nBits': 1024, 'combined_rdkit_maxPath': 7, 'combined_rdkit_nBits': 1024, 'num_hidden_layers': 3, 'hidden_dim_0': 128, 'hidden_dim_1': 256, 'hidden_dim_2': 64, 'kl_weight': 0.0003785772092720449, 'lr': 0.00532974624591256, 'batch_size': 128, 'dropout_rate': 0.08522046582218586, 'prior_mu': -0.028538030750646183, 'prior_sigma': 0.06616528837147426, 'normalization': 'layer'}. Best is trial 896 with value: 0.4533553242683411.
Generating morgan_rdkit fingerprints...
Generated fingerprints with 2048 features for 841 molecules
Trial 1020: 5-fold CV loss = 0.4716
[I 2025-08-07 20:26:23,587] Trial 1020 finished with value: 0.4715896487236023 and parameters: {'fp_type': 'morgan_rdkit', 'combined_morgan_radius': 3, 'combined_morgan_nBits': 1024, 'combined_rdkit_maxPath': 7, 'combined_rdkit_nBits': 1024, 'num_hidden_layers': 3, 'hidden_dim_0': 128, 'hidden_dim_1': 1024, 'hidden_dim_2': 64, 'kl_weight': 0.0004088613059134232, 'lr': 0.005660580531095823, 'batch_size': 128, 'dropout_rate': 0.050959913904261564, 'prior_mu': -0.014378873671445153, 'prior_sigma': 0.06681889137205464, 'normalization': 'layer'}. Best is trial 896 with value: 0.4533553242683411.
Generating morgan_rdkit fingerprints...
Generated fingerprints with 2048 features for 841 molecules
Trial 1019: 5-fold CV loss = 0.4845
[I 2025-08-07 20:26:36,955] Trial 1019 finished with value: 0.4845034122467041 and parameters: {'fp_type': 'morgan_rdkit', 'combined_morgan_radius': 3, 'combined_morgan_nBits': 1024, 'combined_rdkit_maxPath': 7, 'combined_rdkit_nBits': 1024, 'num_hidden_layers': 3, 'hidden_dim_0': 128, 'hidden_dim_1': 1024, 'hidden_dim_2': 64, 'kl_weight': 0.00030341676286244214, 'lr': 0.005590514260011467, 'batch_size': 128, 'dropout_rate': 0.0813995620962677, 'prior_mu': -0.011636679535331007, 'prior_sigma': 0.15528630286335904, 'normalization': 'layer'}. Best is trial 896 with value: 0.4533553242683411.
Generating morgan_rdkit fingerprints...
Generated fingerprints with 2048 features for 841 molecules
Trial 1023: 5-fold CV loss = 0.4646
[I 2025-08-07 20:27:01,448] Trial 1023 finished with value: 0.4645598351955414 and parameters: {'fp_type': 'morgan_rdkit', 'combined_morgan_radius': 3, 'combined_morgan_nBits': 1024, 'combined_rdkit_maxPath': 7, 'combined_rdkit_nBits': 1024, 'num_hidden_layers': 3, 'hidden_dim_0': 256, 'hidden_dim_1': 1024, 'hidden_dim_2': 64, 'kl_weight': 0.00028335951750443504, 'lr': 0.004570706654855336, 'batch_size': 128, 'dropout_rate': 0.09806604862318904, 'prior_mu': -0.005532521930012966, 'prior_sigma': 0.06475119476697308, 'normalization': 'layer'}. Best is trial 896 with value: 0.4533553242683411.
Generating morgan_rdkit fingerprints...
Generated fingerprints with 1280 features for 841 molecules
Trial 1022: 5-fold CV loss = 0.4680
[I 2025-08-07 20:27:11,869] Trial 1022 finished with value: 0.4680097997188568 and parameters: {'fp_type': 'morgan_rdkit', 'combined_morgan_radius': 3, 'combined_morgan_nBits': 1024, 'combined_rdkit_maxPath': 7, 'combined_rdkit_nBits': 1024, 'num_hidden_layers': 3, 'hidden_dim_0': 256, 'hidden_dim_1': 1024, 'hidden_dim_2': 64, 'kl_weight': 0.0002896359176647298, 'lr': 0.004821310167947104, 'batch_size': 128, 'dropout_rate': 0.0957374535276315, 'prior_mu': -0.01258213611958189, 'prior_sigma': 0.06888651492722982, 'normalization': 'layer'}. Best is trial 896 with value: 0.4533553242683411.
Generating morgan_rdkit fingerprints...
Generated fingerprints with 1280 features for 841 molecules
Trial 1024: 5-fold CV loss = 0.4638
[I 2025-08-07 20:27:15,121] Trial 1024 finished with value: 0.46382946372032163 and parameters: {'fp_type': 'morgan_rdkit', 'combined_morgan_radius': 3, 'combined_morgan_nBits': 1024, 'combined_rdkit_maxPath': 7, 'combined_rdkit_nBits': 1024, 'num_hidden_layers': 3, 'hidden_dim_0': 256, 'hidden_dim_1': 1024, 'hidden_dim_2': 64, 'kl_weight': 0.0002689471772907462, 'lr': 0.004422690086030509, 'batch_size': 128, 'dropout_rate': 0.11696116659345765, 'prior_mu': 0.013603349571096074, 'prior_sigma': 0.058353097671305226, 'normalization': 'layer'}. Best is trial 896 with value: 0.4533553242683411.
Generating morgan_rdkit fingerprints...
Generated fingerprints with 2048 features for 841 molecules
Trial 1025: 5-fold CV loss = 0.5203
[I 2025-08-07 20:27:30,204] Trial 1025 finished with value: 0.5202604711055756 and parameters: {'fp_type': 'morgan_rdkit', 'combined_morgan_radius': 3, 'combined_morgan_nBits': 1024, 'combined_rdkit_maxPath': 7, 'combined_rdkit_nBits': 256, 'num_hidden_layers': 3, 'hidden_dim_0': 256, 'hidden_dim_1': 1024, 'hidden_dim_2': 64, 'kl_weight': 0.00024306784257202845, 'lr': 0.004830217163106763, 'batch_size': 128, 'dropout_rate': 0.09682937029629403, 'prior_mu': 0.017160907022609844, 'prior_sigma': 0.06876693749197796, 'normalization': 'layer'}. Best is trial 896 with value: 0.4533553242683411.
Generating morgan_rdkit fingerprints...
Generated fingerprints with 2048 features for 841 molecules
Trial 1021: 5-fold CV loss = 0.4623
[I 2025-08-07 20:27:32,136] Trial 1021 finished with value: 0.4623046457767487 and parameters: {'fp_type': 'morgan_rdkit', 'combined_morgan_radius': 3, 'combined_morgan_nBits': 1024, 'combined_rdkit_maxPath': 7, 'combined_rdkit_nBits': 1024, 'num_hidden_layers': 3, 'hidden_dim_0': 256, 'hidden_dim_1': 1024, 'hidden_dim_2': 64, 'kl_weight': 0.0002781092587770062, 'lr': 0.004649299435941653, 'batch_size': 128, 'dropout_rate': 0.09508379741741066, 'prior_mu': -0.013731521773793186, 'prior_sigma': 0.06321541283126514, 'normalization': 'layer'}. Best is trial 896 with value: 0.4533553242683411.
Generating morgan_rdkit fingerprints...
Generated fingerprints with 2048 features for 841 molecules
Trial 1026: 5-fold CV loss = 0.5133
[I 2025-08-07 20:27:51,798] Trial 1026 finished with value: 0.5132653772830963 and parameters: {'fp_type': 'morgan_rdkit', 'combined_morgan_radius': 3, 'combined_morgan_nBits': 1024, 'combined_rdkit_maxPath': 6, 'combined_rdkit_nBits': 256, 'num_hidden_layers': 3, 'hidden_dim_0': 256, 'hidden_dim_1': 1024, 'hidden_dim_2': 64, 'kl_weight': 0.00023814780095538326, 'lr': 0.0043248263023002035, 'batch_size': 128, 'dropout_rate': 0.1039823085260673, 'prior_mu': -0.0009379453134640316, 'prior_sigma': 0.06163709215140119, 'normalization': 'layer'}. Best is trial 896 with value: 0.4533553242683411.
Generating morgan_rdkit fingerprints...
Generated fingerprints with 2048 features for 841 molecules
Trial 1027: 5-fold CV loss = 0.4762
[I 2025-08-07 20:27:55,280] Trial 1027 finished with value: 0.47615700364112856 and parameters: {'fp_type': 'morgan_rdkit', 'combined_morgan_radius': 3, 'combined_morgan_nBits': 1024, 'combined_rdkit_maxPath': 6, 'combined_rdkit_nBits': 1024, 'num_hidden_layers': 3, 'hidden_dim_0': 256, 'hidden_dim_1': 1024, 'hidden_dim_2': 64, 'kl_weight': 0.0002378433638484894, 'lr': 0.004728684812976645, 'batch_size': 128, 'dropout_rate': 0.10482477793697004, 'prior_mu': -0.00016434601517222383, 'prior_sigma': 0.07034867643814885, 'normalization': 'layer'}. Best is trial 896 with value: 0.4533553242683411.
Generating morgan_rdkit fingerprints...
Generated fingerprints with 2048 features for 841 molecules
Trial 1028: 5-fold CV loss = 0.4671
[I 2025-08-07 20:28:01,478] Trial 1028 finished with value: 0.46707106232643125 and parameters: {'fp_type': 'morgan_rdkit', 'combined_morgan_radius': 3, 'combined_morgan_nBits': 1024, 'combined_rdkit_maxPath': 7, 'combined_rdkit_nBits': 1024, 'num_hidden_layers': 3, 'hidden_dim_0': 256, 'hidden_dim_1': 1024, 'hidden_dim_2': 64, 'kl_weight': 0.00023211411996538518, 'lr': 0.004653717676873465, 'batch_size': 128, 'dropout_rate': 0.10946131951217952, 'prior_mu': -0.002369553710767613, 'prior_sigma': 0.061458979133183905, 'normalization': 'layer'}. Best is trial 896 with value: 0.4533553242683411.
Generating morgan_rdkit fingerprints...
Generated fingerprints with 2048 features for 841 molecules
Trial 1032: 5-fold CV loss = 0.6321
[I 2025-08-07 20:28:24,744] Trial 1032 finished with value: 0.6320746898651123 and parameters: {'fp_type': 'morgan_rdkit', 'combined_morgan_radius': 3, 'combined_morgan_nBits': 1024, 'combined_rdkit_maxPath': 7, 'combined_rdkit_nBits': 1024, 'num_hidden_layers': 3, 'hidden_dim_0': 256, 'hidden_dim_1': 1024, 'hidden_dim_2': 64, 'kl_weight': 0.00032892050979269066, 'lr': 0.005520715977694689, 'batch_size': 128, 'dropout_rate': 0.11811664382607007, 'prior_mu': -0.019314903336598264, 'prior_sigma': 0.06645817867178376, 'normalization': 'none'}. Best is trial 896 with value: 0.4533553242683411.
Generating morgan_rdkit fingerprints...
Generated fingerprints with 2048 features for 841 molecules
Trial 1031: 5-fold CV loss = 0.5502
[I 2025-08-07 20:28:28,517] Trial 1031 finished with value: 0.5501749396324158 and parameters: {'fp_type': 'morgan_rdkit', 'combined_morgan_radius': 3, 'combined_morgan_nBits': 1024, 'combined_rdkit_maxPath': 7, 'combined_rdkit_nBits': 1024, 'num_hidden_layers': 3, 'hidden_dim_0': 256, 'hidden_dim_1': 64, 'hidden_dim_2': 64, 'kl_weight': 0.0003322258263427653, 'lr': 0.005611894309530726, 'batch_size': 128, 'dropout_rate': 0.11354830355424211, 'prior_mu': -0.020225907675501278, 'prior_sigma': 0.05954571760395511, 'normalization': 'layer'}. Best is trial 896 with value: 0.4533553242683411.
Generating morgan_rdkit fingerprints...
Generated fingerprints with 2048 features for 841 molecules
Trial 1034: 5-fold CV loss = 0.9022
[I 2025-08-07 20:28:36,458] Trial 1034 finished with value: 0.902179753780365 and parameters: {'fp_type': 'morgan_rdkit', 'combined_morgan_radius': 3, 'combined_morgan_nBits': 1024, 'combined_rdkit_maxPath': 7, 'combined_rdkit_nBits': 1024, 'num_hidden_layers': 0, 'kl_weight': 0.0004198551251951954, 'lr': 0.005911506924676483, 'batch_size': 128, 'dropout_rate': 0.08339324273315309, 'prior_mu': -0.03293601516561971, 'prior_sigma': 0.0649245583410773, 'normalization': 'layer'}. Best is trial 896 with value: 0.4533553242683411.
Generating morgan_rdkit fingerprints...
Generated fingerprints with 2048 features for 841 molecules
Trial 1030: 5-fold CV loss = 0.6217
[I 2025-08-07 20:28:39,770] Trial 1030 finished with value: 0.6216653704643249 and parameters: {'fp_type': 'morgan_rdkit', 'combined_morgan_radius': 3, 'combined_morgan_nBits': 1024, 'combined_rdkit_maxPath': 7, 'combined_rdkit_nBits': 1024, 'num_hidden_layers': 3, 'hidden_dim_0': 256, 'hidden_dim_1': 64, 'hidden_dim_2': 64, 'kl_weight': 0.000323476202151583, 'lr': 0.005621735491425222, 'batch_size': 128, 'dropout_rate': 0.10727166003536426, 'prior_mu': -0.01795526497455997, 'prior_sigma': 0.06205656564104777, 'normalization': 'layer'}. Best is trial 896 with value: 0.4533553242683411.
Generating morgan_rdkit fingerprints...
Generated fingerprints with 2048 features for 841 molecules
Trial 1033: 5-fold CV loss = 0.5013
[I 2025-08-07 20:28:47,229] Trial 1033 finished with value: 0.5012937307357788 and parameters: {'fp_type': 'morgan_rdkit', 'combined_morgan_radius': 3, 'combined_morgan_nBits': 1024, 'combined_rdkit_maxPath': 7, 'combined_rdkit_nBits': 1024, 'num_hidden_layers': 1, 'hidden_dim_0': 256, 'kl_weight': 0.0001865147719699753, 'lr': 0.005721884372032966, 'batch_size': 128, 'dropout_rate': 0.08329176162179189, 'prior_mu': -0.032803735173260705, 'prior_sigma': 0.06385614354555437, 'normalization': 'layer'}. Best is trial 896 with value: 0.4533553242683411.
Generating morgan_rdkit fingerprints...
Generated fingerprints with 2048 features for 841 molecules
Trial 1029: 5-fold CV loss = 0.4650
[I 2025-08-07 20:29:03,912] Trial 1029 finished with value: 0.4650189757347107 and parameters: {'fp_type': 'morgan_rdkit', 'combined_morgan_radius': 3, 'combined_morgan_nBits': 1024, 'combined_rdkit_maxPath': 7, 'combined_rdkit_nBits': 1024, 'num_hidden_layers': 3, 'hidden_dim_0': 256, 'hidden_dim_1': 1024, 'hidden_dim_2': 64, 'kl_weight': 0.00023722780132168935, 'lr': 0.004473411559927403, 'batch_size': 128, 'dropout_rate': 0.10609601552312677, 'prior_mu': 0.0017942382714089926, 'prior_sigma': 0.06612011656014095, 'normalization': 'layer'}. Best is trial 896 with value: 0.4533553242683411.
Generating morgan_rdkit fingerprints...
Generated fingerprints with 2048 features for 841 molecules
Trial 1035: 5-fold CV loss = 0.4676
