[I 2025-08-07 21:39:55,559] Trial 1396 finished with value: 0.47322224378585814 and parameters: {'fp_type': 'morgan_rdkit', 'combined_morgan_radius': 3, 'combined_morgan_nBits': 1024, 'combined_rdkit_maxPath': 7, 'combined_rdkit_nBits': 1024, 'num_hidden_layers': 3, 'hidden_dim_0': 128, 'hidden_dim_1': 1024, 'hidden_dim_2': 64, 'kl_weight': 0.0005080433001019184, 'lr': 0.005371732427315572, 'batch_size': 64, 'dropout_rate': 0.17849925654745688, 'prior_mu': -0.031985406280714244, 'prior_sigma': 0.08404556344643026, 'normalization': 'layer'}. Best is trial 896 with value: 0.4533553242683411.
Generating morgan_rdkit fingerprints...
Generated fingerprints with 2048 features for 841 molecules
Trial 1398: 5-fold CV loss = 0.4703
[I 2025-08-07 21:40:09,452] Trial 1398 finished with value: 0.47026106119155886 and parameters: {'fp_type': 'morgan_rdkit', 'combined_morgan_radius': 3, 'combined_morgan_nBits': 1024, 'combined_rdkit_maxPath': 7, 'combined_rdkit_nBits': 1024, 'num_hidden_layers': 3, 'hidden_dim_0': 128, 'hidden_dim_1': 1024, 'hidden_dim_2': 64, 'kl_weight': 0.0005186905964124845, 'lr': 0.005060022236945389, 'batch_size': 128, 'dropout_rate': 0.13744132085047536, 'prior_mu': -0.032714204078579195, 'prior_sigma': 0.06861550187828395, 'normalization': 'layer'}. Best is trial 896 with value: 0.4533553242683411.
Generating morgan_rdkit fingerprints...
Generated fingerprints with 2048 features for 841 molecules
Trial 1393: 5-fold CV loss = 0.4634
[I 2025-08-07 21:40:19,796] Trial 1393 finished with value: 0.46336294412612916 and parameters: {'fp_type': 'morgan_rdkit', 'combined_morgan_radius': 3, 'combined_morgan_nBits': 1024, 'combined_rdkit_maxPath': 7, 'combined_rdkit_nBits': 1024, 'num_hidden_layers': 3, 'hidden_dim_0': 256, 'hidden_dim_1': 1024, 'hidden_dim_2': 64, 'kl_weight': 0.0003758921090629942, 'lr': 0.004910445354244021, 'batch_size': 64, 'dropout_rate': 0.18553880632754235, 'prior_mu': -0.12037624083698881, 'prior_sigma': 0.08011161799760835, 'normalization': 'layer'}. Best is trial 896 with value: 0.4533553242683411.
Generating morgan_rdkit fingerprints...
Generated fingerprints with 2048 features for 841 molecules
Trial 1400: 5-fold CV loss = 0.8681
[I 2025-08-07 21:40:25,953] Trial 1400 finished with value: 0.8680912971496582 and parameters: {'fp_type': 'morgan_rdkit', 'combined_morgan_radius': 3, 'combined_morgan_nBits': 1024, 'combined_rdkit_maxPath': 7, 'combined_rdkit_nBits': 1024, 'num_hidden_layers': 3, 'hidden_dim_0': 256, 'hidden_dim_1': 1024, 'hidden_dim_2': 256, 'kl_weight': 0.00025612788713233784, 'lr': 0.000337171975461052, 'batch_size': 128, 'dropout_rate': 0.14446907395768055, 'prior_mu': -0.13397331658976877, 'prior_sigma': 0.07442454386016212, 'normalization': 'layer'}. Best is trial 896 with value: 0.4533553242683411.
Generating morgan_rdkit fingerprints...
Generated fingerprints with 2048 features for 841 molecules
Trial 1395: 5-fold CV loss = 0.5806
[I 2025-08-07 21:40:37,358] Trial 1395 finished with value: 0.5805918395519256 and parameters: {'fp_type': 'morgan_rdkit', 'combined_morgan_radius': 3, 'combined_morgan_nBits': 1024, 'combined_rdkit_maxPath': 7, 'combined_rdkit_nBits': 1024, 'num_hidden_layers': 3, 'hidden_dim_0': 128, 'hidden_dim_1': 1024, 'hidden_dim_2': 64, 'kl_weight': 0.0005004753572085323, 'lr': 0.000961262689992599, 'batch_size': 64, 'dropout_rate': 0.18325351808852197, 'prior_mu': -0.03431189415736925, 'prior_sigma': 0.08278005114512649, 'normalization': 'layer'}. Best is trial 896 with value: 0.4533553242683411.
Generating morgan_rdkit fingerprints...
Generated fingerprints with 2048 features for 841 molecules
Trial 1402: 5-fold CV loss = 0.8796
[I 2025-08-07 21:40:39,524] Trial 1402 finished with value: 0.8796222567558288 and parameters: {'fp_type': 'morgan_rdkit', 'combined_morgan_radius': 3, 'combined_morgan_nBits': 1024, 'combined_rdkit_maxPath': 7, 'combined_rdkit_nBits': 1024, 'num_hidden_layers': 3, 'hidden_dim_0': 256, 'hidden_dim_1': 1024, 'hidden_dim_2': 64, 'kl_weight': 0.00020862957349287732, 'lr': 0.0009005389666426166, 'batch_size': 128, 'dropout_rate': 0.1591676797660594, 'prior_mu': -0.026705968639970497, 'prior_sigma': 0.08448576188116104, 'normalization': 'layer'}. Best is trial 896 with value: 0.4533553242683411.
Generating morgan_rdkit fingerprints...
Generated fingerprints with 2048 features for 841 molecules
Trial 1399: 5-fold CV loss = 0.4705
[I 2025-08-07 21:40:44,707] Trial 1399 finished with value: 0.4705372631549835 and parameters: {'fp_type': 'morgan_rdkit', 'combined_morgan_radius': 3, 'combined_morgan_nBits': 1024, 'combined_rdkit_maxPath': 7, 'combined_rdkit_nBits': 1024, 'num_hidden_layers': 3, 'hidden_dim_0': 256, 'hidden_dim_1': 1024, 'hidden_dim_2': 256, 'kl_weight': 0.0002421398172299383, 'lr': 0.006646633963103138, 'batch_size': 128, 'dropout_rate': 0.13777556588365053, 'prior_mu': 0.16340157252035145, 'prior_sigma': 0.0685674998091473, 'normalization': 'layer'}. Best is trial 896 with value: 0.4533553242683411.
Generating morgan_rdkit fingerprints...
Generated fingerprints with 2048 features for 841 molecules
Trial 1404: 5-fold CV loss = 0.5628
[I 2025-08-07 21:41:07,704] Trial 1404 finished with value: 0.5628347992897034 and parameters: {'fp_type': 'morgan_rdkit', 'combined_morgan_radius': 3, 'combined_morgan_nBits': 1024, 'combined_rdkit_maxPath': 7, 'combined_rdkit_nBits': 1024, 'num_hidden_layers': 3, 'hidden_dim_0': 256, 'hidden_dim_1': 1024, 'hidden_dim_2': 64, 'kl_weight': 0.00015203152247056452, 'lr': 0.006606110100974949, 'batch_size': 128, 'dropout_rate': 0.13370785367974983, 'prior_mu': -0.0575823333759909, 'prior_sigma': 0.06711606710572982, 'normalization': 'layer'}. Best is trial 896 with value: 0.4533553242683411.
Generating morgan_rdkit fingerprints...
Generated fingerprints with 2048 features for 841 molecules
Trial 1405: 5-fold CV loss = 0.4666
[I 2025-08-07 21:41:26,937] Trial 1405 finished with value: 0.46655789017677307 and parameters: {'fp_type': 'morgan_rdkit', 'combined_morgan_radius': 3, 'combined_morgan_nBits': 1024, 'combined_rdkit_maxPath': 7, 'combined_rdkit_nBits': 1024, 'num_hidden_layers': 3, 'hidden_dim_0': 256, 'hidden_dim_1': 1024, 'hidden_dim_2': 64, 'kl_weight': 0.0003292402732876228, 'lr': 0.0065591108194659395, 'batch_size': 128, 'dropout_rate': 0.14969637249611575, 'prior_mu': -0.03858107248115023, 'prior_sigma': 0.07593243707053192, 'normalization': 'layer'}. Best is trial 896 with value: 0.4533553242683411.
Generating morgan_rdkit fingerprints...
Generated fingerprints with 2048 features for 841 molecules
Trial 1403: 5-fold CV loss = 0.4635
[I 2025-08-07 21:41:32,364] Trial 1403 finished with value: 0.4635387361049652 and parameters: {'fp_type': 'morgan_rdkit', 'combined_morgan_radius': 3, 'combined_morgan_nBits': 1024, 'combined_rdkit_maxPath': 7, 'combined_rdkit_nBits': 1024, 'num_hidden_layers': 3, 'hidden_dim_0': 256, 'hidden_dim_1': 1024, 'hidden_dim_2': 64, 'kl_weight': 0.00015248915525842513, 'lr': 0.006627447069775291, 'batch_size': 128, 'dropout_rate': 0.16038002714860647, 'prior_mu': 0.12290264304387596, 'prior_sigma': 0.0746435994624317, 'normalization': 'layer'}. Best is trial 896 with value: 0.4533553242683411.
Generating morgan_rdkit fingerprints...
Generated fingerprints with 2048 features for 841 molecules
Trial 1401: 5-fold CV loss = 0.4707
[I 2025-08-07 21:41:43,967] Trial 1401 finished with value: 0.4706744611263275 and parameters: {'fp_type': 'morgan_rdkit', 'combined_morgan_radius': 3, 'combined_morgan_nBits': 1024, 'combined_rdkit_maxPath': 7, 'combined_rdkit_nBits': 1024, 'num_hidden_layers': 3, 'hidden_dim_0': 256, 'hidden_dim_1': 1024, 'hidden_dim_2': 64, 'kl_weight': 0.00015065505908109638, 'lr': 0.006655123128514137, 'batch_size': 128, 'dropout_rate': 0.14808973490326144, 'prior_mu': 0.1654907211251186, 'prior_sigma': 0.08547350169008454, 'normalization': 'layer'}. Best is trial 896 with value: 0.4533553242683411.
Generating morgan_rdkit fingerprints...
Generated fingerprints with 2048 features for 841 molecules
Trial 1406: 5-fold CV loss = 0.6680
[I 2025-08-07 21:41:48,339] Trial 1406 finished with value: 0.6680307745933532 and parameters: {'fp_type': 'morgan_rdkit', 'combined_morgan_radius': 3, 'combined_morgan_nBits': 1024, 'combined_rdkit_maxPath': 7, 'combined_rdkit_nBits': 1024, 'num_hidden_layers': 3, 'hidden_dim_0': 256, 'hidden_dim_1': 1024, 'hidden_dim_2': 512, 'kl_weight': 0.0003219718499097917, 'lr': 0.004330520397439367, 'batch_size': 128, 'dropout_rate': 0.16003629788271106, 'prior_mu': -0.025212927696921406, 'prior_sigma': 0.0870635328132138, 'normalization': 'layer'}. Best is trial 896 with value: 0.4533553242683411.
Generating morgan_rdkit fingerprints...
Generated fingerprints with 2048 features for 841 molecules
Trial 1407: 5-fold CV loss = 0.6720
[I 2025-08-07 21:41:52,712] Trial 1407 finished with value: 0.6719847679138183 and parameters: {'fp_type': 'morgan_rdkit', 'combined_morgan_radius': 3, 'combined_morgan_nBits': 1024, 'combined_rdkit_maxPath': 7, 'combined_rdkit_nBits': 1024, 'num_hidden_layers': 3, 'hidden_dim_0': 256, 'hidden_dim_1': 64, 'hidden_dim_2': 64, 'kl_weight': 0.00038972484129644764, 'lr': 0.005527369659568254, 'batch_size': 128, 'dropout_rate': 0.15463237897097779, 'prior_mu': -0.19547024651431763, 'prior_sigma': 0.08661309136286008, 'normalization': 'none'}. Best is trial 896 with value: 0.4533553242683411.
Generating morgan_rdkit fingerprints...
Generated fingerprints with 2048 features for 841 molecules
Trial 1408: 5-fold CV loss = 0.6542
[I 2025-08-07 21:42:18,887] Trial 1408 finished with value: 0.6541513562202453 and parameters: {'fp_type': 'morgan_rdkit', 'combined_morgan_radius': 3, 'combined_morgan_nBits': 1024, 'combined_rdkit_maxPath': 7, 'combined_rdkit_nBits': 1024, 'num_hidden_layers': 3, 'hidden_dim_0': 256, 'hidden_dim_1': 1024, 'hidden_dim_2': 64, 'kl_weight': 0.00037328681305867065, 'lr': 0.004457273503685081, 'batch_size': 128, 'dropout_rate': 0.14409155323118794, 'prior_mu': -0.02629606449136368, 'prior_sigma': 0.0873844671280832, 'normalization': 'none'}. Best is trial 896 with value: 0.4533553242683411.
Generating rdkit fingerprints...
Generated fingerprints with 1024 features for 841 molecules
Trial 1410: 5-fold CV loss = 0.6031
[I 2025-08-07 21:42:21,853] Trial 1410 finished with value: 0.6031416416168213 and parameters: {'fp_type': 'morgan_rdkit', 'combined_morgan_radius': 3, 'combined_morgan_nBits': 1024, 'combined_rdkit_maxPath': 7, 'combined_rdkit_nBits': 1024, 'num_hidden_layers': 3, 'hidden_dim_0': 256, 'hidden_dim_1': 1024, 'hidden_dim_2': 64, 'kl_weight': 0.0002626270971318475, 'lr': 0.005571661772472927, 'batch_size': 128, 'dropout_rate': 0.1374424608509116, 'prior_mu': -0.029949107383408117, 'prior_sigma': 0.07194645881306971, 'normalization': 'none'}. Best is trial 896 with value: 0.4533553242683411.
Generating morgan_rdkit fingerprints...
Generated fingerprints with 2048 features for 841 molecules
Trial 1411: 5-fold CV loss = 0.4665
[I 2025-08-07 21:42:37,242] Trial 1411 finished with value: 0.4665069103240967 and parameters: {'fp_type': 'morgan_rdkit', 'combined_morgan_radius': 3, 'combined_morgan_nBits': 1024, 'combined_rdkit_maxPath': 7, 'combined_rdkit_nBits': 1024, 'num_hidden_layers': 3, 'hidden_dim_0': 256, 'hidden_dim_1': 1024, 'hidden_dim_2': 64, 'kl_weight': 0.00024838769955244487, 'lr': 0.005965371941934202, 'batch_size': 128, 'dropout_rate': 0.13321299154598773, 'prior_mu': -0.022134018555178228, 'prior_sigma': 0.07734105140631582, 'normalization': 'layer'}. Best is trial 896 with value: 0.4533553242683411.
Generating morgan_rdkit fingerprints...
Generated fingerprints with 2048 features for 841 molecules
Trial 1413: 5-fold CV loss = 0.4616
[I 2025-08-07 21:42:56,596] Trial 1413 finished with value: 0.4615833342075348 and parameters: {'fp_type': 'morgan_rdkit', 'combined_morgan_radius': 3, 'combined_morgan_nBits': 1024, 'combined_rdkit_maxPath': 7, 'combined_rdkit_nBits': 1024, 'num_hidden_layers': 3, 'hidden_dim_0': 256, 'hidden_dim_1': 1024, 'hidden_dim_2': 64, 'kl_weight': 0.0004436023979149996, 'lr': 0.009971334513008386, 'batch_size': 128, 'dropout_rate': 0.12956993527738317, 'prior_mu': -0.11435293297308768, 'prior_sigma': 0.07693928090364595, 'normalization': 'layer'}. Best is trial 896 with value: 0.4533553242683411.
Generating rdkit fingerprints...
Generated fingerprints with 1024 features for 841 molecules
Trial 1409: 5-fold CV loss = 0.6677
[I 2025-08-07 21:43:08,593] Trial 1409 finished with value: 0.6676500558853149 and parameters: {'fp_type': 'morgan_rdkit', 'combined_morgan_radius': 3, 'combined_morgan_nBits': 1024, 'combined_rdkit_maxPath': 7, 'combined_rdkit_nBits': 1024, 'num_hidden_layers': 3, 'hidden_dim_0': 256, 'hidden_dim_1': 1024, 'hidden_dim_2': 512, 'kl_weight': 0.0002618806244370553, 'lr': 0.00435525344984466, 'batch_size': 128, 'dropout_rate': 0.1344038403231566, 'prior_mu': -0.02428407621560663, 'prior_sigma': 0.08681941988024681, 'normalization': 'none'}. Best is trial 896 with value: 0.4533553242683411.
Generating morgan_rdkit fingerprints...
Generated fingerprints with 2048 features for 841 molecules
Trial 1412: 5-fold CV loss = 0.4851
[I 2025-08-07 21:43:12,352] Trial 1412 finished with value: 0.48514782190322875 and parameters: {'fp_type': 'rdkit', 'rdkit_only_maxPath': 6, 'rdkit_only_nBits': 1024, 'num_hidden_layers': 3, 'hidden_dim_0': 256, 'hidden_dim_1': 1024, 'hidden_dim_2': 64, 'kl_weight': 0.00026109973780475543, 'lr': 0.0037812521755206737, 'batch_size': 128, 'dropout_rate': 0.132691826408173, 'prior_mu': -0.02017456855701244, 'prior_sigma': 0.053514947761474224, 'normalization': 'layer'}. Best is trial 896 with value: 0.4533553242683411.
Generating morgan_rdkit fingerprints...
Generated fingerprints with 2048 features for 841 molecules
Trial 1414: 5-fold CV loss = 0.4663
[I 2025-08-07 21:43:20,304] Trial 1414 finished with value: 0.4662528455257416 and parameters: {'fp_type': 'morgan_rdkit', 'combined_morgan_radius': 3, 'combined_morgan_nBits': 1024, 'combined_rdkit_maxPath': 7, 'combined_rdkit_nBits': 1024, 'num_hidden_layers': 3, 'hidden_dim_0': 256, 'hidden_dim_1': 1024, 'hidden_dim_2': 64, 'kl_weight': 0.00019334251206236066, 'lr': 0.0070494515260121566, 'batch_size': 128, 'dropout_rate': 0.1700608149220279, 'prior_mu': -0.07432453675547965, 'prior_sigma': 0.0806077422689086, 'normalization': 'layer'}. Best is trial 896 with value: 0.4533553242683411.
Generating morgan_rdkit fingerprints...
Generated fingerprints with 2048 features for 841 molecules
Trial 1415: 5-fold CV loss = 0.5126
[I 2025-08-07 21:43:25,268] Trial 1415 finished with value: 0.5126089692115784 and parameters: {'fp_type': 'rdkit', 'rdkit_only_maxPath': 6, 'rdkit_only_nBits': 1024, 'num_hidden_layers': 1, 'hidden_dim_0': 256, 'kl_weight': 0.000588380146680455, 'lr': 0.007136711690076247, 'batch_size': 128, 'dropout_rate': 0.16955398955576925, 'prior_mu': -0.019015154669303355, 'prior_sigma': 0.08160490050112883, 'normalization': 'layer'}. Best is trial 896 with value: 0.4533553242683411.
Generating morgan_rdkit fingerprints...
Generated fingerprints with 2048 features for 841 molecules
Trial 1418: 5-fold CV loss = 0.4754
[I 2025-08-07 21:43:53,560] Trial 1418 finished with value: 0.47537441849708556 and parameters: {'fp_type': 'morgan_rdkit', 'combined_morgan_radius': 3, 'combined_morgan_nBits': 1024, 'combined_rdkit_maxPath': 6, 'combined_rdkit_nBits': 1024, 'num_hidden_layers': 3, 'hidden_dim_0': 1024, 'hidden_dim_1': 1024, 'hidden_dim_2': 64, 'kl_weight': 0.0006167718916537042, 'lr': 0.004980651473892851, 'batch_size': 128, 'dropout_rate': 0.1526136640605724, 'prior_mu': 0.18373278383926075, 'prior_sigma': 0.0710478278200045, 'normalization': 'layer'}. Best is trial 896 with value: 0.4533553242683411.
Generating morgan_rdkit fingerprints...
Generated fingerprints with 2048 features for 841 molecules
Trial 1419: 5-fold CV loss = 0.4734
[I 2025-08-07 21:43:57,604] Trial 1419 finished with value: 0.4734440267086029 and parameters: {'fp_type': 'morgan_rdkit', 'combined_morgan_radius': 3, 'combined_morgan_nBits': 1024, 'combined_rdkit_maxPath': 6, 'combined_rdkit_nBits': 1024, 'num_hidden_layers': 3, 'hidden_dim_0': 256, 'hidden_dim_1': 1024, 'hidden_dim_2': 64, 'kl_weight': 0.00030790181297105275, 'lr': 0.006154006637810298, 'batch_size': 128, 'dropout_rate': 0.15330175411950864, 'prior_mu': -0.041273068523272595, 'prior_sigma': 0.06985085282815028, 'normalization': 'layer'}. Best is trial 896 with value: 0.4533553242683411.
Generating morgan_rdkit fingerprints...
Generated fingerprints with 2048 features for 841 molecules
Trial 1417: 5-fold CV loss = 0.5578
[I 2025-08-07 21:43:59,258] Trial 1417 finished with value: 0.5578161239624023 and parameters: {'fp_type': 'morgan_rdkit', 'combined_morgan_radius': 3, 'combined_morgan_nBits': 1024, 'combined_rdkit_maxPath': 7, 'combined_rdkit_nBits': 1024, 'num_hidden_layers': 3, 'hidden_dim_0': 256, 'hidden_dim_1': 1024, 'hidden_dim_2': 64, 'kl_weight': 0.000592315324914963, 'lr': 0.006976624443053905, 'batch_size': 128, 'dropout_rate': 0.1698446224851537, 'prior_mu': -0.03931704580618157, 'prior_sigma': 0.08203315960620493, 'normalization': 'layer'}. Best is trial 896 with value: 0.4533553242683411.
Generating morgan_rdkit fingerprints...
Generated fingerprints with 2048 features for 841 molecules
Trial 1421: 5-fold CV loss = 0.4637
[I 2025-08-07 21:44:28,156] Trial 1421 finished with value: 0.4636762797832489 and parameters: {'fp_type': 'morgan_rdkit', 'combined_morgan_radius': 3, 'combined_morgan_nBits': 1024, 'combined_rdkit_maxPath': 7, 'combined_rdkit_nBits': 1024, 'num_hidden_layers': 3, 'hidden_dim_0': 256, 'hidden_dim_1': 1024, 'hidden_dim_2': 64, 'kl_weight': 0.0002192331949677962, 'lr': 0.008686179179508582, 'batch_size': 128, 'dropout_rate': 0.14266662556396548, 'prior_mu': -0.037442741974421594, 'prior_sigma': 0.061639639161785956, 'normalization': 'layer'}. Best is trial 896 with value: 0.4533553242683411.
Generating morgan_rdkit fingerprints...
Generated fingerprints with 2048 features for 841 molecules
Trial 1420: 5-fold CV loss = 0.4642
[I 2025-08-07 21:44:36,273] Trial 1420 finished with value: 0.4641828715801239 and parameters: {'fp_type': 'morgan_rdkit', 'combined_morgan_radius': 3, 'combined_morgan_nBits': 1024, 'combined_rdkit_maxPath': 7, 'combined_rdkit_nBits': 1024, 'num_hidden_layers': 3, 'hidden_dim_0': 256, 'hidden_dim_1': 128, 'hidden_dim_2': 64, 'kl_weight': 0.00020991574209810264, 'lr': 0.00614171741088548, 'batch_size': 128, 'dropout_rate': 0.1405650186021759, 'prior_mu': -0.03896674869975958, 'prior_sigma': 0.06052971469389411, 'normalization': 'layer'}. Best is trial 896 with value: 0.4533553242683411.
Generating morgan_rdkit fingerprints...
Generated fingerprints with 2048 features for 841 molecules
Trial 1416: 5-fold CV loss = 0.4617
[I 2025-08-07 21:44:40,906] Trial 1416 finished with value: 0.4617229700088501 and parameters: {'fp_type': 'morgan_rdkit', 'combined_morgan_radius': 3, 'combined_morgan_nBits': 1024, 'combined_rdkit_maxPath': 7, 'combined_rdkit_nBits': 1024, 'num_hidden_layers': 3, 'hidden_dim_0': 256, 'hidden_dim_1': 1024, 'hidden_dim_2': 64, 'kl_weight': 0.000817891787771527, 'lr': 0.007162622766065468, 'batch_size': 128, 'dropout_rate': 0.17343411629057884, 'prior_mu': -0.06736801200724851, 'prior_sigma': 0.0709320866318245, 'normalization': 'layer'}. Best is trial 896 with value: 0.4533553242683411.
Generating morgan_rdkit fingerprints...
Generated fingerprints with 2048 features for 841 molecules
Trial 1422: 5-fold CV loss = 0.4660
[I 2025-08-07 21:44:56,245] Trial 1422 finished with value: 0.4659645140171051 and parameters: {'fp_type': 'morgan_rdkit', 'combined_morgan_radius': 3, 'combined_morgan_nBits': 1024, 'combined_rdkit_maxPath': 7, 'combined_rdkit_nBits': 1024, 'num_hidden_layers': 3, 'hidden_dim_0': 256, 'hidden_dim_1': 128, 'hidden_dim_2': 64, 'kl_weight': 0.00021437736091241828, 'lr': 0.008714135123784609, 'batch_size': 128, 'dropout_rate': 0.14252799472464, 'prior_mu': -0.05142651261050944, 'prior_sigma': 0.0752158415956213, 'normalization': 'layer'}. Best is trial 896 with value: 0.4533553242683411.
Generating morgan_rdkit fingerprints...
Generated fingerprints with 2048 features for 841 molecules
Trial 1423: 5-fold CV loss = 0.4657
[I 2025-08-07 21:45:01,962] Trial 1423 finished with value: 0.4657088935375214 and parameters: {'fp_type': 'morgan_rdkit', 'combined_morgan_radius': 3, 'combined_morgan_nBits': 1024, 'combined_rdkit_maxPath': 7, 'combined_rdkit_nBits': 1024, 'num_hidden_layers': 3, 'hidden_dim_0': 256, 'hidden_dim_1': 1024, 'hidden_dim_2': 64, 'kl_weight': 0.00042218851387750125, 'lr': 0.0060697077039087, 'batch_size': 128, 'dropout_rate': 0.12419155937612508, 'prior_mu': -0.09539160311025295, 'prior_sigma': 0.07351377780116104, 'normalization': 'layer'}. Best is trial 896 with value: 0.4533553242683411.
Generating morgan_rdkit fingerprints...
Generated fingerprints with 2048 features for 841 molecules
Trial 1424: 5-fold CV loss = 0.4674
[I 2025-08-07 21:45:17,335] Trial 1424 finished with value: 0.46740530133247377 and parameters: {'fp_type': 'morgan_rdkit', 'combined_morgan_radius': 3, 'combined_morgan_nBits': 1024, 'combined_rdkit_maxPath': 7, 'combined_rdkit_nBits': 1024, 'num_hidden_layers': 3, 'hidden_dim_0': 256, 'hidden_dim_1': 1024, 'hidden_dim_2': 64, 'kl_weight': 0.0004190749721870735, 'lr': 0.007655641327889364, 'batch_size': 128, 'dropout_rate': 0.12078100817622653, 'prior_mu': 0.18617191151959153, 'prior_sigma': 0.07504820586264367, 'normalization': 'layer'}. Best is trial 896 with value: 0.4533553242683411.
Generating morgan_rdkit fingerprints...
Generated fingerprints with 2048 features for 841 molecules
Trial 1425: 5-fold CV loss = 0.4663
