[I 2025-08-07 23:46:02,880] Trial 2055 finished with value: 0.5037493526935577 and parameters: {'fp_type': 'morgan_rdkit', 'combined_morgan_radius': 3, 'combined_morgan_nBits': 1024, 'combined_rdkit_maxPath': 7, 'combined_rdkit_nBits': 1024, 'num_hidden_layers': 1, 'hidden_dim_0': 256, 'kl_weight': 0.00018949441464952445, 'lr': 0.006545698393945276, 'batch_size': 128, 'dropout_rate': 0.045800611199432004, 'prior_mu': -0.04889207002129499, 'prior_sigma': 0.11011240273592889, 'normalization': 'layer'}. Best is trial 896 with value: 0.4533553242683411.
Generating morgan_rdkit fingerprints...
Generated fingerprints with 2048 features for 841 molecules
Trial 2058: 5-fold CV loss = 0.5230
[I 2025-08-07 23:46:29,957] Trial 2058 finished with value: 0.5230490803718567 and parameters: {'fp_type': 'morgan_rdkit', 'combined_morgan_radius': 3, 'combined_morgan_nBits': 1024, 'combined_rdkit_maxPath': 7, 'combined_rdkit_nBits': 256, 'num_hidden_layers': 3, 'hidden_dim_0': 256, 'hidden_dim_1': 1024, 'hidden_dim_2': 64, 'kl_weight': 0.00019301913807037653, 'lr': 0.009150659663619835, 'batch_size': 128, 'dropout_rate': 0.1538534980209449, 'prior_mu': -0.028323698761273296, 'prior_sigma': 0.08780053612426812, 'normalization': 'layer'}. Best is trial 896 with value: 0.4533553242683411.
Generating morgan_rdkit fingerprints...
Generated fingerprints with 2048 features for 841 molecules
Trial 2057: 5-fold CV loss = 0.4804
[I 2025-08-07 23:46:35,267] Trial 2057 finished with value: 0.48039926290512086 and parameters: {'fp_type': 'morgan_rdkit', 'combined_morgan_radius': 3, 'combined_morgan_nBits': 1024, 'combined_rdkit_maxPath': 6, 'combined_rdkit_nBits': 1024, 'num_hidden_layers': 3, 'hidden_dim_0': 256, 'hidden_dim_1': 1024, 'hidden_dim_2': 64, 'kl_weight': 0.0003197730391287412, 'lr': 0.0064752396055469475, 'batch_size': 128, 'dropout_rate': 0.11665091920041606, 'prior_mu': -0.04750891891732144, 'prior_sigma': 0.11166956611367125, 'normalization': 'layer'}. Best is trial 896 with value: 0.4533553242683411.
Generating morgan_rdkit fingerprints...
Generated fingerprints with 2048 features for 841 molecules
Trial 2056: 5-fold CV loss = 0.4971
[I 2025-08-07 23:46:38,919] Trial 2056 finished with value: 0.497087699174881 and parameters: {'fp_type': 'morgan_rdkit', 'combined_morgan_radius': 3, 'combined_morgan_nBits': 1024, 'combined_rdkit_maxPath': 7, 'combined_rdkit_nBits': 1024, 'num_hidden_layers': 1, 'hidden_dim_0': 256, 'kl_weight': 0.00019398379494144086, 'lr': 0.00849248782027415, 'batch_size': 128, 'dropout_rate': 0.11723479225756393, 'prior_mu': -0.04716787806959047, 'prior_sigma': 0.10006075521086248, 'normalization': 'layer'}. Best is trial 896 with value: 0.4533553242683411.
Generating morgan_rdkit fingerprints...
Generated fingerprints with 2048 features for 841 molecules
Trial 2059: 5-fold CV loss = 0.4721
[I 2025-08-07 23:46:40,836] Trial 2059 finished with value: 0.47208606004714965 and parameters: {'fp_type': 'morgan_rdkit', 'combined_morgan_radius': 3, 'combined_morgan_nBits': 1024, 'combined_rdkit_maxPath': 6, 'combined_rdkit_nBits': 1024, 'num_hidden_layers': 3, 'hidden_dim_0': 256, 'hidden_dim_1': 1024, 'hidden_dim_2': 64, 'kl_weight': 0.0002768033525263008, 'lr': 0.008943125067783947, 'batch_size': 128, 'dropout_rate': 0.15357644896109826, 'prior_mu': -0.02405168202992245, 'prior_sigma': 0.0962007666405868, 'normalization': 'layer'}. Best is trial 896 with value: 0.4533553242683411.
Generating morgan_rdkit fingerprints...
Generated fingerprints with 2048 features for 841 molecules
Trial 2063: 5-fold CV loss = 0.8062
[I 2025-08-07 23:47:03,220] Trial 2063 finished with value: 0.8062426447868347 and parameters: {'fp_type': 'morgan_rdkit', 'combined_morgan_radius': 3, 'combined_morgan_nBits': 1024, 'combined_rdkit_maxPath': 7, 'combined_rdkit_nBits': 1024, 'num_hidden_layers': 3, 'hidden_dim_0': 64, 'hidden_dim_1': 1024, 'hidden_dim_2': 1024, 'kl_weight': 0.00032739757463898824, 'lr': 0.0074570073911533665, 'batch_size': 128, 'dropout_rate': 0.17885361505271383, 'prior_mu': -0.012217778878635427, 'prior_sigma': 0.0787477586733884, 'normalization': 'layer'}. Best is trial 896 with value: 0.4533553242683411.
Generating morgan_rdkit fingerprints...
Generated fingerprints with 2048 features for 841 molecules
Trial 2060: 5-fold CV loss = 0.4733
[I 2025-08-07 23:47:05,130] Trial 2060 finished with value: 0.4732938349246979 and parameters: {'fp_type': 'morgan_rdkit', 'combined_morgan_radius': 3, 'combined_morgan_nBits': 1024, 'combined_rdkit_maxPath': 6, 'combined_rdkit_nBits': 1024, 'num_hidden_layers': 3, 'hidden_dim_0': 256, 'hidden_dim_1': 1024, 'hidden_dim_2': 64, 'kl_weight': 0.00027780641389045936, 'lr': 0.007578233092550168, 'batch_size': 128, 'dropout_rate': 0.13559669382901474, 'prior_mu': -0.020673751923192766, 'prior_sigma': 0.0786698442647951, 'normalization': 'layer'}. Best is trial 896 with value: 0.4533553242683411.
Generating rdkit fingerprints...
Generated fingerprints with 256 features for 841 molecules
Trial 2065: 5-fold CV loss = 0.8876
[I 2025-08-07 23:47:18,480] Trial 2065 finished with value: 0.8876114249229431 and parameters: {'fp_type': 'rdkit', 'rdkit_only_maxPath': 7, 'rdkit_only_nBits': 256, 'num_hidden_layers': 3, 'hidden_dim_0': 256, 'hidden_dim_1': 1024, 'hidden_dim_2': 64, 'kl_weight': 0.0002284630688664537, 'lr': 0.006080033313073682, 'batch_size': 128, 'dropout_rate': 0.07594828441652945, 'prior_mu': -0.027845736617868752, 'prior_sigma': 0.08670234660605759, 'normalization': 'layer'}. Best is trial 896 with value: 0.4533553242683411.
Generating morgan_rdkit fingerprints...
Generated fingerprints with 2048 features for 841 molecules
Trial 2061: 5-fold CV loss = 0.4616
[I 2025-08-07 23:47:36,948] Trial 2061 finished with value: 0.46155441999435426 and parameters: {'fp_type': 'morgan_rdkit', 'combined_morgan_radius': 3, 'combined_morgan_nBits': 1024, 'combined_rdkit_maxPath': 7, 'combined_rdkit_nBits': 1024, 'num_hidden_layers': 3, 'hidden_dim_0': 256, 'hidden_dim_1': 1024, 'hidden_dim_2': 64, 'kl_weight': 0.0002398357395878506, 'lr': 0.007178210812411543, 'batch_size': 128, 'dropout_rate': 0.18434997700063516, 'prior_mu': -0.021508513495479067, 'prior_sigma': 0.09560187589737223, 'normalization': 'layer'}. Best is trial 896 with value: 0.4533553242683411.
Generating morgan_rdkit fingerprints...
Generated fingerprints with 2048 features for 841 molecules
Trial 2064: 5-fold CV loss = 0.4655
[I 2025-08-07 23:47:45,859] Trial 2064 finished with value: 0.46549750566482545 and parameters: {'fp_type': 'morgan_rdkit', 'combined_morgan_radius': 3, 'combined_morgan_nBits': 1024, 'combined_rdkit_maxPath': 7, 'combined_rdkit_nBits': 1024, 'num_hidden_layers': 3, 'hidden_dim_0': 256, 'hidden_dim_1': 1024, 'hidden_dim_2': 64, 'kl_weight': 0.00023302454608783803, 'lr': 0.005922930841732753, 'batch_size': 128, 'dropout_rate': 0.12769406332290945, 'prior_mu': -0.0196355544952033, 'prior_sigma': 0.0863647035043641, 'normalization': 'layer'}. Best is trial 896 with value: 0.4533553242683411.
Generating morgan_rdkit fingerprints...
Generated fingerprints with 2048 features for 841 molecules
Trial 2066: 5-fold CV loss = 0.4600
[I 2025-08-07 23:48:03,247] Trial 2066 finished with value: 0.4600031614303589 and parameters: {'fp_type': 'morgan_rdkit', 'combined_morgan_radius': 3, 'combined_morgan_nBits': 1024, 'combined_rdkit_maxPath': 7, 'combined_rdkit_nBits': 1024, 'num_hidden_layers': 3, 'hidden_dim_0': 256, 'hidden_dim_1': 1024, 'hidden_dim_2': 64, 'kl_weight': 0.00043692201411152484, 'lr': 0.0044306390616174005, 'batch_size': 128, 'dropout_rate': 0.18579713678549023, 'prior_mu': -0.012773531040498332, 'prior_sigma': 0.07275138499918538, 'normalization': 'layer'}. Best is trial 896 with value: 0.4533553242683411.
Generating morgan_rdkit fingerprints...
Generated fingerprints with 2048 features for 841 molecules
Trial 2062: 5-fold CV loss = 0.4718
[I 2025-08-07 23:48:11,721] Trial 2062 finished with value: 0.47178250551223755 and parameters: {'fp_type': 'morgan_rdkit', 'combined_morgan_radius': 3, 'combined_morgan_nBits': 1024, 'combined_rdkit_maxPath': 7, 'combined_rdkit_nBits': 1024, 'num_hidden_layers': 3, 'hidden_dim_0': 64, 'hidden_dim_1': 1024, 'hidden_dim_2': 64, 'kl_weight': 0.00027166759177251485, 'lr': 0.00713961860488435, 'batch_size': 128, 'dropout_rate': 0.17870279917225748, 'prior_mu': -0.023210469375611054, 'prior_sigma': 0.0789973093244315, 'normalization': 'layer'}. Best is trial 896 with value: 0.4533553242683411.
Generating morgan_rdkit fingerprints...
Generated fingerprints with 2048 features for 841 molecules
Trial 2068: 5-fold CV loss = 0.7555
[I 2025-08-07 23:48:14,107] Trial 2068 finished with value: 0.7554924011230468 and parameters: {'fp_type': 'morgan_rdkit', 'combined_morgan_radius': 3, 'combined_morgan_nBits': 1024, 'combined_rdkit_maxPath': 7, 'combined_rdkit_nBits': 1024, 'num_hidden_layers': 3, 'hidden_dim_0': 256, 'hidden_dim_1': 1024, 'hidden_dim_2': 64, 'kl_weight': 0.028801236220304494, 'lr': 0.006796291727577732, 'batch_size': 128, 'dropout_rate': 0.4604571804498029, 'prior_mu': 0.008337360005509241, 'prior_sigma': 0.17866255561216418, 'normalization': 'layer'}. Best is trial 896 with value: 0.4533553242683411.
Generating morgan_rdkit fingerprints...
Generated fingerprints with 2048 features for 841 molecules
Trial 2067: 5-fold CV loss = 0.4716
[I 2025-08-07 23:48:34,654] Trial 2067 finished with value: 0.4715605080127716 and parameters: {'fp_type': 'morgan_rdkit', 'combined_morgan_radius': 3, 'combined_morgan_nBits': 1024, 'combined_rdkit_maxPath': 7, 'combined_rdkit_nBits': 1024, 'num_hidden_layers': 3, 'hidden_dim_0': 256, 'hidden_dim_1': 1024, 'hidden_dim_2': 64, 'kl_weight': 0.00042383834933048663, 'lr': 0.004450026737228726, 'batch_size': 128, 'dropout_rate': 0.1269626829657952, 'prior_mu': -0.011721913955137395, 'prior_sigma': 0.07337978926397003, 'normalization': 'layer'}. Best is trial 896 with value: 0.4533553242683411.
Generating morgan_rdkit fingerprints...
Generated fingerprints with 2048 features for 841 molecules
Trial 2071: 5-fold CV loss = 0.4654
[I 2025-08-07 23:48:49,963] Trial 2071 finished with value: 0.4653501152992249 and parameters: {'fp_type': 'morgan_rdkit', 'combined_morgan_radius': 3, 'combined_morgan_nBits': 1024, 'combined_rdkit_maxPath': 7, 'combined_rdkit_nBits': 1024, 'num_hidden_layers': 3, 'hidden_dim_0': 256, 'hidden_dim_1': 1024, 'hidden_dim_2': 64, 'kl_weight': 0.00036595238266830363, 'lr': 0.008202816726323323, 'batch_size': 128, 'dropout_rate': 0.13679132472360253, 'prior_mu': -0.031620564792316515, 'prior_sigma': 0.07544380280747942, 'normalization': 'layer'}. Best is trial 896 with value: 0.4533553242683411.
Generating morgan_rdkit fingerprints...
Generated fingerprints with 2048 features for 841 molecules
Trial 2069: 5-fold CV loss = 0.4586
[I 2025-08-07 23:48:53,193] Trial 2069 finished with value: 0.45858222246170044 and parameters: {'fp_type': 'morgan_rdkit', 'combined_morgan_radius': 3, 'combined_morgan_nBits': 1024, 'combined_rdkit_maxPath': 7, 'combined_rdkit_nBits': 1024, 'num_hidden_layers': 3, 'hidden_dim_0': 256, 'hidden_dim_1': 1024, 'hidden_dim_2': 64, 'kl_weight': 0.0003339535600361776, 'lr': 0.006820902794047665, 'batch_size': 64, 'dropout_rate': 0.20736729848236657, 'prior_mu': 0.00842404010630617, 'prior_sigma': 0.07536182293156367, 'normalization': 'layer'}. Best is trial 896 with value: 0.4533553242683411.
Generating morgan_rdkit fingerprints...
Generated fingerprints with 1536 features for 841 molecules
Trial 2072: 5-fold CV loss = 0.4719
[I 2025-08-07 23:49:35,378] Trial 2072 finished with value: 0.4718570113182068 and parameters: {'fp_type': 'morgan_rdkit', 'combined_morgan_radius': 3, 'combined_morgan_nBits': 1024, 'combined_rdkit_maxPath': 7, 'combined_rdkit_nBits': 1024, 'num_hidden_layers': 3, 'hidden_dim_0': 1024, 'hidden_dim_1': 1024, 'hidden_dim_2': 64, 'kl_weight': 0.00034065174387207817, 'lr': 0.008357061328999845, 'batch_size': 64, 'dropout_rate': 0.09013113320001105, 'prior_mu': -0.04041557149280263, 'prior_sigma': 0.07574819302226818, 'normalization': 'layer'}. Best is trial 896 with value: 0.4533553242683411.
Generating morgan_rdkit fingerprints...
Generated fingerprints with 1024 features for 841 molecules
Trial 2074: 5-fold CV loss = 0.4893
[I 2025-08-07 23:49:38,093] Trial 2074 finished with value: 0.4892665266990662 and parameters: {'fp_type': 'morgan_rdkit', 'combined_morgan_radius': 3, 'combined_morgan_nBits': 1024, 'combined_rdkit_maxPath': 7, 'combined_rdkit_nBits': 512, 'num_hidden_layers': 3, 'hidden_dim_0': 1024, 'hidden_dim_1': 1024, 'hidden_dim_2': 64, 'kl_weight': 0.0001512725951540249, 'lr': 0.005206202998238706, 'batch_size': 128, 'dropout_rate': 0.08909113055901269, 'prior_mu': -0.04118105654756892, 'prior_sigma': 0.0903803125146113, 'normalization': 'layer'}. Best is trial 896 with value: 0.4533553242683411.
Generating morgan_rdkit fingerprints...
Generated fingerprints with 1536 features for 841 molecules
Trial 2073: 5-fold CV loss = 0.4687
[I 2025-08-07 23:49:52,020] Trial 2073 finished with value: 0.4687179446220398 and parameters: {'fp_type': 'morgan_rdkit', 'combined_morgan_radius': 3, 'combined_morgan_nBits': 1024, 'combined_rdkit_maxPath': 7, 'combined_rdkit_nBits': 1024, 'num_hidden_layers': 3, 'hidden_dim_0': 1024, 'hidden_dim_1': 1024, 'hidden_dim_2': 64, 'kl_weight': 0.00031249509680770924, 'lr': 0.0056635215838566014, 'batch_size': 64, 'dropout_rate': 0.0013471134400925011, 'prior_mu': -0.040192754087434834, 'prior_sigma': 0.06844785528444507, 'normalization': 'layer'}. Best is trial 896 with value: 0.4533553242683411.
Generating morgan_rdkit fingerprints...
Generated fingerprints with 1536 features for 841 molecules
Trial 2070: 5-fold CV loss = 0.4665
[I 2025-08-07 23:50:07,571] Trial 2070 finished with value: 0.46650232672691344 and parameters: {'fp_type': 'morgan_rdkit', 'combined_morgan_radius': 3, 'combined_morgan_nBits': 1024, 'combined_rdkit_maxPath': 7, 'combined_rdkit_nBits': 1024, 'num_hidden_layers': 3, 'hidden_dim_0': 256, 'hidden_dim_1': 1024, 'hidden_dim_2': 64, 'kl_weight': 0.0003468800561723105, 'lr': 0.005390308450173217, 'batch_size': 64, 'dropout_rate': 0.13978569432164942, 'prior_mu': -0.03230638851551622, 'prior_sigma': 0.07270454779641007, 'normalization': 'layer'}. Best is trial 896 with value: 0.4533553242683411.
Generating morgan_rdkit fingerprints...
Generated fingerprints with 2048 features for 841 molecules
Trial 2076: 5-fold CV loss = 0.4647
[I 2025-08-07 23:50:14,204] Trial 2076 finished with value: 0.46471675038337706 and parameters: {'fp_type': 'morgan_rdkit', 'combined_morgan_radius': 3, 'combined_morgan_nBits': 512, 'combined_rdkit_maxPath': 7, 'combined_rdkit_nBits': 1024, 'num_hidden_layers': 3, 'hidden_dim_0': 256, 'hidden_dim_1': 1024, 'hidden_dim_2': 64, 'kl_weight': 0.0002954460333042282, 'lr': 0.00545410052945865, 'batch_size': 128, 'dropout_rate': 0.10866022204427989, 'prior_mu': -0.16993511693061164, 'prior_sigma': 0.06888833190885041, 'normalization': 'layer'}. Best is trial 896 with value: 0.4533553242683411.
Generating morgan_rdkit fingerprints...
Generated fingerprints with 2048 features for 841 molecules
Trial 2075: 5-fold CV loss = 0.4921
[I 2025-08-07 23:50:35,722] Trial 2075 finished with value: 0.4920764327049255 and parameters: {'fp_type': 'morgan_rdkit', 'combined_morgan_radius': 3, 'combined_morgan_nBits': 512, 'combined_rdkit_maxPath': 7, 'combined_rdkit_nBits': 512, 'num_hidden_layers': 3, 'hidden_dim_0': 256, 'hidden_dim_1': 1024, 'hidden_dim_2': 64, 'kl_weight': 0.00015232928881826267, 'lr': 0.005394586036252156, 'batch_size': 128, 'dropout_rate': 0.10897289911443359, 'prior_mu': -0.003011972506550605, 'prior_sigma': 0.06729300031418425, 'normalization': 'layer'}. Best is trial 896 with value: 0.4533553242683411.
Generating morgan_rdkit fingerprints...
Generated fingerprints with 2048 features for 841 molecules
Trial 2077: 5-fold CV loss = 0.4597
[I 2025-08-07 23:50:39,048] Trial 2077 finished with value: 0.4596777677536011 and parameters: {'fp_type': 'morgan_rdkit', 'combined_morgan_radius': 3, 'combined_morgan_nBits': 512, 'combined_rdkit_maxPath': 7, 'combined_rdkit_nBits': 1024, 'num_hidden_layers': 3, 'hidden_dim_0': 256, 'hidden_dim_1': 1024, 'hidden_dim_2': 64, 'kl_weight': 0.00041389980123608417, 'lr': 0.006281995108716034, 'batch_size': 128, 'dropout_rate': 0.11053762653455235, 'prior_mu': -0.031060716716568192, 'prior_sigma': 0.08122859288828271, 'normalization': 'layer'}. Best is trial 896 with value: 0.4533553242683411.
Generating morgan_rdkit fingerprints...
Generated fingerprints with 1280 features for 841 molecules
Trial 2079: 5-fold CV loss = 0.4674
[I 2025-08-07 23:50:47,435] Trial 2079 finished with value: 0.467377769947052 and parameters: {'fp_type': 'morgan_rdkit', 'combined_morgan_radius': 3, 'combined_morgan_nBits': 1024, 'combined_rdkit_maxPath': 7, 'combined_rdkit_nBits': 1024, 'num_hidden_layers': 3, 'hidden_dim_0': 256, 'hidden_dim_1': 1024, 'hidden_dim_2': 64, 'kl_weight': 0.0004278640327155069, 'lr': 0.006409880036177173, 'batch_size': 128, 'dropout_rate': 0.1459573843935311, 'prior_mu': -0.00021386358954274699, 'prior_sigma': 0.08191440760836156, 'normalization': 'layer'}. Best is trial 896 with value: 0.4533553242683411.
Generating morgan fingerprints...
Generated fingerprints with 2048 features for 841 molecules
Trial 2082: 5-fold CV loss = 0.5333
[I 2025-08-07 23:51:06,712] Trial 2082 finished with value: 0.5333442091941833 and parameters: {'fp_type': 'morgan', 'morgan_only_radius': 3, 'morgan_only_nBits': 2048, 'num_hidden_layers': 3, 'hidden_dim_0': 256, 'hidden_dim_1': 1024, 'hidden_dim_2': 64, 'kl_weight': 0.0013264165330122257, 'lr': 0.007691496095466523, 'batch_size': 128, 'dropout_rate': 0.15771635045659604, 'prior_mu': -0.053255184573059805, 'prior_sigma': 0.0888910786436337, 'normalization': 'layer'}. Best is trial 896 with value: 0.4533553242683411.
Generating morgan_rdkit fingerprints...
Generated fingerprints with 1280 features for 841 molecules
Trial 2081: 5-fold CV loss = 0.5632
[I 2025-08-07 23:51:14,190] Trial 2081 finished with value: 0.5632355332374572 and parameters: {'fp_type': 'morgan_rdkit', 'combined_morgan_radius': 3, 'combined_morgan_nBits': 1024, 'combined_rdkit_maxPath': 7, 'combined_rdkit_nBits': 256, 'num_hidden_layers': 3, 'hidden_dim_0': 256, 'hidden_dim_1': 1024, 'hidden_dim_2': 64, 'kl_weight': 0.0002616205233509156, 'lr': 0.009983207783483713, 'batch_size': 128, 'dropout_rate': 0.15256835599983645, 'prior_mu': -0.05031137793357081, 'prior_sigma': 0.08599283443816728, 'normalization': 'none'}. Best is trial 896 with value: 0.4533553242683411.
Generating morgan_rdkit fingerprints...
Generated fingerprints with 2048 features for 841 molecules
Trial 2080: 5-fold CV loss = 0.5656
[I 2025-08-07 23:51:31,618] Trial 2080 finished with value: 0.5656443893909454 and parameters: {'fp_type': 'morgan_rdkit', 'combined_morgan_radius': 3, 'combined_morgan_nBits': 1024, 'combined_rdkit_maxPath': 7, 'combined_rdkit_nBits': 1024, 'num_hidden_layers': 3, 'hidden_dim_0': 256, 'hidden_dim_1': 1024, 'hidden_dim_2': 64, 'kl_weight': 0.0002611880922679202, 'lr': 0.006271273695754839, 'batch_size': 128, 'dropout_rate': 0.15608850032793345, 'prior_mu': -0.030791027281411698, 'prior_sigma': 0.08313233807687001, 'normalization': 'none'}. Best is trial 896 with value: 0.4533553242683411.
Generating morgan_rdkit fingerprints...
Generated fingerprints with 2048 features for 841 molecules
Trial 2083: 5-fold CV loss = 0.5641
[I 2025-08-07 23:51:35,630] Trial 2083 finished with value: 0.5641404211521148 and parameters: {'fp_type': 'morgan_rdkit', 'combined_morgan_radius': 3, 'combined_morgan_nBits': 1024, 'combined_rdkit_maxPath': 7, 'combined_rdkit_nBits': 256, 'num_hidden_layers': 3, 'hidden_dim_0': 256, 'hidden_dim_1': 1024, 'hidden_dim_2': 64, 'kl_weight': 0.000255953932104905, 'lr': 0.009084153380674417, 'batch_size': 128, 'dropout_rate': 0.07704994036938688, 'prior_mu': -0.007065028683870768, 'prior_sigma': 0.0941574104059012, 'normalization': 'none'}. Best is trial 896 with value: 0.4533553242683411.
Generating morgan_rdkit fingerprints...
Generated fingerprints with 2048 features for 841 molecules
Trial 2078: 5-fold CV loss = 0.4624
[I 2025-08-07 23:51:43,404] Trial 2078 finished with value: 0.46240106225013733 and parameters: {'fp_type': 'morgan_rdkit', 'combined_morgan_radius': 3, 'combined_morgan_nBits': 1024, 'combined_rdkit_maxPath': 7, 'combined_rdkit_nBits': 1024, 'num_hidden_layers': 3, 'hidden_dim_0': 256, 'hidden_dim_1': 1024, 'hidden_dim_2': 64, 'kl_weight': 0.0004369986403327349, 'lr': 0.006094700485800095, 'batch_size': 128, 'dropout_rate': 0.10639172875467218, 'prior_mu': -0.0010170087994096563, 'prior_sigma': 0.08062296376423304, 'normalization': 'layer'}. Best is trial 896 with value: 0.4533553242683411.
Generating morgan_rdkit fingerprints...
Generated fingerprints with 2048 features for 841 molecules
Trial 2084: 5-fold CV loss = 0.4730
[I 2025-08-07 23:51:59,452] Trial 2084 finished with value: 0.47300153970718384 and parameters: {'fp_type': 'morgan_rdkit', 'combined_morgan_radius': 3, 'combined_morgan_nBits': 1024, 'combined_rdkit_maxPath': 7, 'combined_rdkit_nBits': 1024, 'num_hidden_layers': 3, 'hidden_dim_0': 256, 'hidden_dim_1': 1024, 'hidden_dim_2': 128, 'kl_weight': 0.0002050621787841331, 'lr': 0.009212906663152902, 'batch_size': 128, 'dropout_rate': 0.0749810580538505, 'prior_mu': -0.00619943857416435, 'prior_sigma': 0.09344871609112124, 'normalization': 'layer'}. Best is trial 896 with value: 0.4533553242683411.
Generating rdkit fingerprints...
Generated fingerprints with 256 features for 841 molecules
Trial 2086: 5-fold CV loss = 0.5665
