[I 2025-08-08 00:17:20,201] Trial 2207 finished with value: 0.4837963581085205 and parameters: {'fp_type': 'morgan_rdkit', 'combined_morgan_radius': 3, 'combined_morgan_nBits': 1024, 'combined_rdkit_maxPath': 5, 'combined_rdkit_nBits': 1024, 'num_hidden_layers': 3, 'hidden_dim_0': 256, 'hidden_dim_1': 1024, 'hidden_dim_2': 64, 'kl_weight': 0.0005231380347861834, 'lr': 0.0051024944402868035, 'batch_size': 64, 'dropout_rate': 0.08527158219389441, 'prior_mu': -0.030777282192219417, 'prior_sigma': 0.0770535908113875, 'normalization': 'layer'}. Best is trial 896 with value: 0.4533553242683411.
Generating morgan_rdkit fingerprints...
Generated fingerprints with 2048 features for 841 molecules
Trial 2205: 5-fold CV loss = 0.4689
[I 2025-08-08 00:17:22,392] Trial 2205 finished with value: 0.46893270611763 and parameters: {'fp_type': 'morgan_rdkit', 'combined_morgan_radius': 3, 'combined_morgan_nBits': 1024, 'combined_rdkit_maxPath': 7, 'combined_rdkit_nBits': 1024, 'num_hidden_layers': 3, 'hidden_dim_0': 256, 'hidden_dim_1': 1024, 'hidden_dim_2': 64, 'kl_weight': 0.0005368835194955188, 'lr': 0.004173356929745055, 'batch_size': 64, 'dropout_rate': 0.0852872002743797, 'prior_mu': -0.031098963946338442, 'prior_sigma': 0.08490666323011305, 'normalization': 'layer'}. Best is trial 896 with value: 0.4533553242683411.
Generating morgan_rdkit fingerprints...
Generated fingerprints with 2048 features for 841 molecules
Trial 2209: 5-fold CV loss = 0.7906
[I 2025-08-08 00:17:40,950] Trial 2209 finished with value: 0.7906463027000428 and parameters: {'fp_type': 'morgan_rdkit', 'combined_morgan_radius': 3, 'combined_morgan_nBits': 1024, 'combined_rdkit_maxPath': 7, 'combined_rdkit_nBits': 1024, 'num_hidden_layers': 3, 'hidden_dim_0': 256, 'hidden_dim_1': 1024, 'hidden_dim_2': 512, 'kl_weight': 0.00036475093544273293, 'lr': 0.009170499439831658, 'batch_size': 128, 'dropout_rate': 0.1420419518692714, 'prior_mu': -0.03465952103692794, 'prior_sigma': 0.08939984469359114, 'normalization': 'layer'}. Best is trial 896 with value: 0.4533553242683411.
Generating morgan_rdkit fingerprints...
Generated fingerprints with 2048 features for 841 molecules
Trial 2206: 5-fold CV loss = 0.4669
[I 2025-08-08 00:18:05,696] Trial 2206 finished with value: 0.46694478392601013 and parameters: {'fp_type': 'morgan_rdkit', 'combined_morgan_radius': 3, 'combined_morgan_nBits': 1024, 'combined_rdkit_maxPath': 7, 'combined_rdkit_nBits': 1024, 'num_hidden_layers': 3, 'hidden_dim_0': 256, 'hidden_dim_1': 1024, 'hidden_dim_2': 64, 'kl_weight': 0.00040525319740590727, 'lr': 0.005255908204268977, 'batch_size': 128, 'dropout_rate': 0.09051384651441137, 'prior_mu': -0.006493813704625294, 'prior_sigma': 0.08607571365005967, 'normalization': 'layer'}. Best is trial 896 with value: 0.4533553242683411.
Generating morgan_rdkit fingerprints...
Generated fingerprints with 2048 features for 841 molecules
Trial 2210: 5-fold CV loss = 0.4610
[I 2025-08-08 00:18:09,058] Trial 2210 finished with value: 0.4610073804855347 and parameters: {'fp_type': 'morgan_rdkit', 'combined_morgan_radius': 3, 'combined_morgan_nBits': 1024, 'combined_rdkit_maxPath': 7, 'combined_rdkit_nBits': 1024, 'num_hidden_layers': 3, 'hidden_dim_0': 256, 'hidden_dim_1': 1024, 'hidden_dim_2': 64, 'kl_weight': 0.00037460805411665323, 'lr': 0.009163653108097906, 'batch_size': 128, 'dropout_rate': 0.1167359836127795, 'prior_mu': -0.03896846525537047, 'prior_sigma': 0.09142241391207233, 'normalization': 'layer'}. Best is trial 896 with value: 0.4533553242683411.
Generating morgan_rdkit fingerprints...
Generated fingerprints with 2048 features for 841 molecules
Trial 2208: 5-fold CV loss = 0.4820
[I 2025-08-08 00:18:16,309] Trial 2208 finished with value: 0.48202791810035706 and parameters: {'fp_type': 'morgan_rdkit', 'combined_morgan_radius': 3, 'combined_morgan_nBits': 1024, 'combined_rdkit_maxPath': 5, 'combined_rdkit_nBits': 1024, 'num_hidden_layers': 3, 'hidden_dim_0': 256, 'hidden_dim_1': 1024, 'hidden_dim_2': 64, 'kl_weight': 0.000532935846611527, 'lr': 0.00651728445519319, 'batch_size': 64, 'dropout_rate': 0.08421195868069686, 'prior_mu': -0.03280454280927268, 'prior_sigma': 0.09015450782775135, 'normalization': 'layer'}. Best is trial 896 with value: 0.4533553242683411.
Generating morgan_rdkit fingerprints...
Generated fingerprints with 2048 features for 841 molecules
Trial 2211: 5-fold CV loss = 0.4575
[I 2025-08-08 00:18:21,973] Trial 2211 finished with value: 0.457452255487442 and parameters: {'fp_type': 'morgan_rdkit', 'combined_morgan_radius': 3, 'combined_morgan_nBits': 1024, 'combined_rdkit_maxPath': 7, 'combined_rdkit_nBits': 1024, 'num_hidden_layers': 3, 'hidden_dim_0': 256, 'hidden_dim_1': 1024, 'hidden_dim_2': 64, 'kl_weight': 0.0001916371131450354, 'lr': 0.006569540656555628, 'batch_size': 128, 'dropout_rate': 0.12179604603750263, 'prior_mu': -0.05544179079787592, 'prior_sigma': 0.09958159663667061, 'normalization': 'layer'}. Best is trial 896 with value: 0.4533553242683411.
Generating morgan_rdkit fingerprints...
Generated fingerprints with 2048 features for 841 molecules
Trial 2215: 5-fold CV loss = 0.4665
[I 2025-08-08 00:18:58,551] Trial 2215 finished with value: 0.4664576411247253 and parameters: {'fp_type': 'morgan_rdkit', 'combined_morgan_radius': 3, 'combined_morgan_nBits': 1024, 'combined_rdkit_maxPath': 7, 'combined_rdkit_nBits': 1024, 'num_hidden_layers': 3, 'hidden_dim_0': 1024, 'hidden_dim_1': 1024, 'hidden_dim_2': 64, 'kl_weight': 0.00016905721209737982, 'lr': 0.007427912332028099, 'batch_size': 128, 'dropout_rate': 0.1388785031371912, 'prior_mu': -0.06163669404557154, 'prior_sigma': 0.10478091034558425, 'normalization': 'layer'}. Best is trial 896 with value: 0.4533553242683411.
Generating morgan_rdkit fingerprints...
Generated fingerprints with 2048 features for 841 molecules
Trial 2213: 5-fold CV loss = 0.4703
[I 2025-08-08 00:19:00,404] Trial 2213 finished with value: 0.47025728821754453 and parameters: {'fp_type': 'morgan_rdkit', 'combined_morgan_radius': 3, 'combined_morgan_nBits': 1024, 'combined_rdkit_maxPath': 7, 'combined_rdkit_nBits': 1024, 'num_hidden_layers': 3, 'hidden_dim_0': 1024, 'hidden_dim_1': 256, 'hidden_dim_2': 64, 'kl_weight': 0.00018626123742341986, 'lr': 0.006426978808068496, 'batch_size': 128, 'dropout_rate': 0.12369178781580374, 'prior_mu': -0.02419740757967796, 'prior_sigma': 0.09944911470878641, 'normalization': 'layer'}. Best is trial 896 with value: 0.4533553242683411.
Generating morgan fingerprints...
Generated fingerprints with 1024 features for 841 molecules
Trial 2217: 5-fold CV loss = 0.5270
[I 2025-08-08 00:19:24,240] Trial 2217 finished with value: 0.5270459711551666 and parameters: {'fp_type': 'morgan', 'morgan_only_radius': 2, 'morgan_only_nBits': 1024, 'num_hidden_layers': 3, 'hidden_dim_0': 256, 'hidden_dim_1': 1024, 'hidden_dim_2': 64, 'kl_weight': 0.00014520699246989968, 'lr': 0.007977092415360555, 'batch_size': 128, 'dropout_rate': 0.1373609618025241, 'prior_mu': -0.07473968992068525, 'prior_sigma': 0.10093074377260726, 'normalization': 'layer'}. Best is trial 896 with value: 0.4533553242683411.
Generating morgan_rdkit fingerprints...
Generated fingerprints with 2048 features for 841 molecules
Trial 2214: 5-fold CV loss = 0.4595
[I 2025-08-08 00:19:26,840] Trial 2214 finished with value: 0.45946391224861144 and parameters: {'fp_type': 'morgan_rdkit', 'combined_morgan_radius': 3, 'combined_morgan_nBits': 1024, 'combined_rdkit_maxPath': 7, 'combined_rdkit_nBits': 1024, 'num_hidden_layers': 3, 'hidden_dim_0': 1024, 'hidden_dim_1': 256, 'hidden_dim_2': 64, 'kl_weight': 0.00028667112666089066, 'lr': 0.007706731723809394, 'batch_size': 128, 'dropout_rate': 0.13776384593467286, 'prior_mu': -0.02196405649422368, 'prior_sigma': 0.0969532968640273, 'normalization': 'layer'}. Best is trial 896 with value: 0.4533553242683411.
Generating morgan_rdkit fingerprints...
Generated fingerprints with 2048 features for 841 molecules
Trial 2216: 5-fold CV loss = 0.5654
[I 2025-08-08 00:19:35,166] Trial 2216 finished with value: 0.565399807691574 and parameters: {'fp_type': 'morgan_rdkit', 'combined_morgan_radius': 3, 'combined_morgan_nBits': 1024, 'combined_rdkit_maxPath': 7, 'combined_rdkit_nBits': 1024, 'num_hidden_layers': 3, 'hidden_dim_0': 256, 'hidden_dim_1': 256, 'hidden_dim_2': 64, 'kl_weight': 0.00015794062265788464, 'lr': 0.007914834301197392, 'batch_size': 128, 'dropout_rate': 0.13311455432001523, 'prior_mu': -0.08398533452452142, 'prior_sigma': 0.1060635905199797, 'normalization': 'layer'}. Best is trial 896 with value: 0.4533553242683411.
Generating morgan_rdkit fingerprints...
Generated fingerprints with 2048 features for 841 molecules
Trial 2212: 5-fold CV loss = 0.4621
[I 2025-08-08 00:20:03,439] Trial 2212 finished with value: 0.46212148666381836 and parameters: {'fp_type': 'morgan_rdkit', 'combined_morgan_radius': 3, 'combined_morgan_nBits': 1024, 'combined_rdkit_maxPath': 7, 'combined_rdkit_nBits': 1024, 'num_hidden_layers': 3, 'hidden_dim_0': 256, 'hidden_dim_1': 1024, 'hidden_dim_2': 64, 'kl_weight': 0.0002897879334548881, 'lr': 0.006352226414787823, 'batch_size': 128, 'dropout_rate': 0.11630624259721141, 'prior_mu': -0.055005843621889976, 'prior_sigma': 0.09884049203151606, 'normalization': 'layer'}. Best is trial 896 with value: 0.4533553242683411.
Generating morgan_rdkit fingerprints...
Generated fingerprints with 1536 features for 841 molecules
Trial 2219: 5-fold CV loss = 0.6164
[I 2025-08-08 00:20:08,911] Trial 2219 finished with value: 0.616383719444275 and parameters: {'fp_type': 'morgan_rdkit', 'combined_morgan_radius': 3, 'combined_morgan_nBits': 1024, 'combined_rdkit_maxPath': 7, 'combined_rdkit_nBits': 1024, 'num_hidden_layers': 3, 'hidden_dim_0': 256, 'hidden_dim_1': 1024, 'hidden_dim_2': 128, 'kl_weight': 0.00016853038626055603, 'lr': 0.007922646824197837, 'batch_size': 128, 'dropout_rate': 0.3290821144571363, 'prior_mu': -0.061816918725958445, 'prior_sigma': 0.10034459740513485, 'normalization': 'layer'}. Best is trial 896 with value: 0.4533553242683411.
Generating morgan_rdkit fingerprints...
Generated fingerprints with 1536 features for 841 molecules
Trial 2218: 5-fold CV loss = 0.4682
[I 2025-08-08 00:20:10,341] Trial 2218 finished with value: 0.46815544962882993 and parameters: {'fp_type': 'morgan_rdkit', 'combined_morgan_radius': 3, 'combined_morgan_nBits': 1024, 'combined_rdkit_maxPath': 7, 'combined_rdkit_nBits': 1024, 'num_hidden_layers': 3, 'hidden_dim_0': 64, 'hidden_dim_1': 1024, 'hidden_dim_2': 64, 'kl_weight': 0.0001835826603610021, 'lr': 0.007849611112867826, 'batch_size': 128, 'dropout_rate': 0.14528377411330035, 'prior_mu': -0.0660084381766631, 'prior_sigma': 0.0965244446651485, 'normalization': 'layer'}. Best is trial 896 with value: 0.4533553242683411.
Generating morgan_rdkit fingerprints...
Generated fingerprints with 2048 features for 841 molecules
Trial 2220: 5-fold CV loss = 0.4737
[I 2025-08-08 00:20:21,057] Trial 2220 finished with value: 0.4737474322319031 and parameters: {'fp_type': 'morgan_rdkit', 'combined_morgan_radius': 3, 'combined_morgan_nBits': 1024, 'combined_rdkit_maxPath': 7, 'combined_rdkit_nBits': 1024, 'num_hidden_layers': 3, 'hidden_dim_0': 64, 'hidden_dim_1': 1024, 'hidden_dim_2': 64, 'kl_weight': 0.00016240852439215514, 'lr': 0.006802299965369032, 'batch_size': 128, 'dropout_rate': 0.14926800630913759, 'prior_mu': -0.06407347041991952, 'prior_sigma': 0.10938108446655243, 'normalization': 'layer'}. Best is trial 896 with value: 0.4533553242683411.
Generating morgan_rdkit fingerprints...
Generated fingerprints with 1536 features for 841 molecules
Trial 2223: 5-fold CV loss = 0.7311
[I 2025-08-08 00:20:35,340] Trial 2223 finished with value: 0.7310976922512055 and parameters: {'fp_type': 'morgan_rdkit', 'combined_morgan_radius': 3, 'combined_morgan_nBits': 1024, 'combined_rdkit_maxPath': 7, 'combined_rdkit_nBits': 1024, 'num_hidden_layers': 3, 'hidden_dim_0': 256, 'hidden_dim_1': 64, 'hidden_dim_2': 64, 'kl_weight': 0.00016561745313638056, 'lr': 0.007028831771261521, 'batch_size': 128, 'dropout_rate': 0.06541145572808785, 'prior_mu': -0.080324112823105, 'prior_sigma': 0.10470511517098063, 'normalization': 'layer'}. Best is trial 896 with value: 0.4533553242683411.
Generating morgan_rdkit fingerprints...
Generated fingerprints with 2048 features for 841 molecules
Trial 2224: 5-fold CV loss = 0.6521
[I 2025-08-08 00:20:48,259] Trial 2224 finished with value: 0.6520977675914764 and parameters: {'fp_type': 'morgan_rdkit', 'combined_morgan_radius': 3, 'combined_morgan_nBits': 512, 'combined_rdkit_maxPath': 7, 'combined_rdkit_nBits': 1024, 'num_hidden_layers': 3, 'hidden_dim_0': 512, 'hidden_dim_1': 64, 'hidden_dim_2': 64, 'kl_weight': 0.00019275771188998877, 'lr': 0.007213994188403, 'batch_size': 128, 'dropout_rate': 0.04683918232536484, 'prior_mu': -0.05626092687009862, 'prior_sigma': 0.10499229777773103, 'normalization': 'layer'}. Best is trial 896 with value: 0.4533553242683411.
Generating morgan_rdkit fingerprints...
Generated fingerprints with 2048 features for 841 molecules
Trial 2222: 5-fold CV loss = 0.4864
[I 2025-08-08 00:21:15,822] Trial 2222 finished with value: 0.486362361907959 and parameters: {'fp_type': 'morgan_rdkit', 'combined_morgan_radius': 3, 'combined_morgan_nBits': 512, 'combined_rdkit_maxPath': 7, 'combined_rdkit_nBits': 1024, 'num_hidden_layers': 3, 'hidden_dim_0': 256, 'hidden_dim_1': 64, 'hidden_dim_2': 64, 'kl_weight': 0.00015783264485523052, 'lr': 0.006878431972378929, 'batch_size': 128, 'dropout_rate': 0.15005897894238043, 'prior_mu': -0.07213868981532448, 'prior_sigma': 0.09448266675740746, 'normalization': 'layer'}. Best is trial 896 with value: 0.4533553242683411.
Generating morgan_rdkit fingerprints...
Generated fingerprints with 2048 features for 841 molecules
Trial 2225: 5-fold CV loss = 0.4741
[I 2025-08-08 00:21:17,001] Trial 2225 finished with value: 0.47405357360839845 and parameters: {'fp_type': 'morgan_rdkit', 'combined_morgan_radius': 3, 'combined_morgan_nBits': 1024, 'combined_rdkit_maxPath': 7, 'combined_rdkit_nBits': 1024, 'num_hidden_layers': 3, 'hidden_dim_0': 256, 'hidden_dim_1': 1024, 'hidden_dim_2': 64, 'kl_weight': 0.0001851659446949782, 'lr': 0.008501017365462061, 'batch_size': 128, 'dropout_rate': 0.046508592328785375, 'prior_mu': -0.05787283219340858, 'prior_sigma': 0.10271817830431014, 'normalization': 'layer'}. Best is trial 896 with value: 0.4533553242683411.
Generating morgan_rdkit fingerprints...
Generated fingerprints with 2048 features for 841 molecules
Trial 2226: 5-fold CV loss = 0.4582
[I 2025-08-08 00:21:28,068] Trial 2226 finished with value: 0.45818294286727906 and parameters: {'fp_type': 'morgan_rdkit', 'combined_morgan_radius': 3, 'combined_morgan_nBits': 1024, 'combined_rdkit_maxPath': 7, 'combined_rdkit_nBits': 1024, 'num_hidden_layers': 3, 'hidden_dim_0': 256, 'hidden_dim_1': 1024, 'hidden_dim_2': 64, 'kl_weight': 0.00014764456182743727, 'lr': 0.008587012747784614, 'batch_size': 128, 'dropout_rate': 0.15935158641963548, 'prior_mu': -0.07081393291922715, 'prior_sigma': 0.09939297612744553, 'normalization': 'layer'}. Best is trial 896 with value: 0.4533553242683411.
Generating morgan_rdkit fingerprints...
Generated fingerprints with 2048 features for 841 molecules
Trial 2228: 5-fold CV loss = 0.4798
[I 2025-08-08 00:21:55,074] Trial 2228 finished with value: 0.47978138327598574 and parameters: {'fp_type': 'morgan_rdkit', 'combined_morgan_radius': 2, 'combined_morgan_nBits': 1024, 'combined_rdkit_maxPath': 7, 'combined_rdkit_nBits': 1024, 'num_hidden_layers': 3, 'hidden_dim_0': 256, 'hidden_dim_1': 1024, 'hidden_dim_2': 64, 'kl_weight': 0.0001856642496798628, 'lr': 0.00858646745677949, 'batch_size': 128, 'dropout_rate': 0.1258323072376138, 'prior_mu': -0.0712859206839042, 'prior_sigma': 0.10107730220206235, 'normalization': 'layer'}. Best is trial 896 with value: 0.4533553242683411.
Generating morgan_rdkit fingerprints...
Generated fingerprints with 2048 features for 841 molecules
Trial 2229: 5-fold CV loss = 0.5616
[I 2025-08-08 00:21:58,362] Trial 2229 finished with value: 0.56158047914505 and parameters: {'fp_type': 'morgan_rdkit', 'combined_morgan_radius': 3, 'combined_morgan_nBits': 1024, 'combined_rdkit_maxPath': 7, 'combined_rdkit_nBits': 1024, 'num_hidden_layers': 3, 'hidden_dim_0': 256, 'hidden_dim_1': 1024, 'hidden_dim_2': 64, 'kl_weight': 0.00012858514315801844, 'lr': 0.009255122335167253, 'batch_size': 128, 'dropout_rate': 0.17059169630347565, 'prior_mu': -0.06916834965958434, 'prior_sigma': 0.0952500641289832, 'normalization': 'layer'}. Best is trial 896 with value: 0.4533553242683411.
Generating morgan_rdkit fingerprints...
Generated fingerprints with 2048 features for 841 molecules
Trial 2227: 5-fold CV loss = 0.4729
[I 2025-08-08 00:22:11,059] Trial 2227 finished with value: 0.47290908694267275 and parameters: {'fp_type': 'morgan_rdkit', 'combined_morgan_radius': 2, 'combined_morgan_nBits': 1024, 'combined_rdkit_maxPath': 7, 'combined_rdkit_nBits': 1024, 'num_hidden_layers': 3, 'hidden_dim_0': 256, 'hidden_dim_1': 1024, 'hidden_dim_2': 64, 'kl_weight': 0.00019941301850570026, 'lr': 0.008627658655873317, 'batch_size': 128, 'dropout_rate': 0.16439843764500384, 'prior_mu': -0.04702566080085486, 'prior_sigma': 0.10176519529268468, 'normalization': 'layer'}. Best is trial 896 with value: 0.4533553242683411.
Generating morgan_rdkit fingerprints...
Generated fingerprints with 2048 features for 841 molecules
Trial 2221: 5-fold CV loss = 0.5692
[I 2025-08-08 00:22:12,867] Trial 2221 finished with value: 0.5692221939563751 and parameters: {'fp_type': 'morgan_rdkit', 'combined_morgan_radius': 3, 'combined_morgan_nBits': 512, 'combined_rdkit_maxPath': 7, 'combined_rdkit_nBits': 1024, 'num_hidden_layers': 3, 'hidden_dim_0': 64, 'hidden_dim_1': 64, 'hidden_dim_2': 128, 'kl_weight': 0.00017021365274725613, 'lr': 0.006909176774434738, 'batch_size': 128, 'dropout_rate': 0.14757576950805187, 'prior_mu': -0.06435232057646165, 'prior_sigma': 0.09752185312761087, 'normalization': 'layer'}. Best is trial 896 with value: 0.4533553242683411.
Generating morgan_rdkit fingerprints...
Generated fingerprints with 2048 features for 841 molecules
Trial 2231: 5-fold CV loss = 0.8025
[I 2025-08-08 00:22:19,870] Trial 2231 finished with value: 0.8025330781936646 and parameters: {'fp_type': 'morgan_rdkit', 'combined_morgan_radius': 3, 'combined_morgan_nBits': 1024, 'combined_rdkit_maxPath': 7, 'combined_rdkit_nBits': 1024, 'num_hidden_layers': 3, 'hidden_dim_0': 256, 'hidden_dim_1': 1024, 'hidden_dim_2': 64, 'kl_weight': 0.0001500912200826147, 'lr': 0.009048241414150008, 'batch_size': 128, 'dropout_rate': 0.1677618930124367, 'prior_mu': -0.08105230929800461, 'prior_sigma': 0.10711853336916942, 'normalization': 'none'}. Best is trial 896 with value: 0.4533553242683411.
Generating morgan_rdkit fingerprints...
Generated fingerprints with 2048 features for 841 molecules
Trial 2230: 5-fold CV loss = 0.4678
[I 2025-08-08 00:22:39,560] Trial 2230 finished with value: 0.46783037185668946 and parameters: {'fp_type': 'morgan_rdkit', 'combined_morgan_radius': 3, 'combined_morgan_nBits': 1024, 'combined_rdkit_maxPath': 7, 'combined_rdkit_nBits': 1024, 'num_hidden_layers': 3, 'hidden_dim_0': 256, 'hidden_dim_1': 1024, 'hidden_dim_2': 64, 'kl_weight': 0.00015468884202818084, 'lr': 0.009178326302463697, 'batch_size': 128, 'dropout_rate': 0.1702418034014157, 'prior_mu': -0.0923025341439504, 'prior_sigma': 0.10501378974986694, 'normalization': 'layer'}. Best is trial 896 with value: 0.4533553242683411.
Generating morgan_rdkit fingerprints...
Generated fingerprints with 2048 features for 841 molecules
Trial 2234: 5-fold CV loss = 0.5593
[I 2025-08-08 00:22:48,972] Trial 2234 finished with value: 0.5592741549015046 and parameters: {'fp_type': 'morgan_rdkit', 'combined_morgan_radius': 3, 'combined_morgan_nBits': 1024, 'combined_rdkit_maxPath': 7, 'combined_rdkit_nBits': 1024, 'num_hidden_layers': 3, 'hidden_dim_0': 256, 'hidden_dim_1': 1024, 'hidden_dim_2': 64, 'kl_weight': 0.00015487076028446964, 'lr': 0.00991854896767804, 'batch_size': 128, 'dropout_rate': 0.16936701832263962, 'prior_mu': -0.07439603756897151, 'prior_sigma': 0.10568284747717359, 'normalization': 'layer'}. Best is trial 896 with value: 0.4533553242683411.
Generating morgan_rdkit fingerprints...
Generated fingerprints with 2048 features for 841 molecules
Trial 2236: 5-fold CV loss = 0.7872
[I 2025-08-08 00:23:09,838] Trial 2236 finished with value: 0.7871740698814392 and parameters: {'fp_type': 'morgan_rdkit', 'combined_morgan_radius': 3, 'combined_morgan_nBits': 1024, 'combined_rdkit_maxPath': 7, 'combined_rdkit_nBits': 1024, 'num_hidden_layers': 3, 'hidden_dim_0': 256, 'hidden_dim_1': 128, 'hidden_dim_2': 512, 'kl_weight': 0.0001428371709390169, 'lr': 0.009208177403288952, 'batch_size': 128, 'dropout_rate': 0.16636380105664242, 'prior_mu': -0.09697899799972169, 'prior_sigma': 0.10981067121197516, 'normalization': 'layer'}. Best is trial 896 with value: 0.4533553242683411.
Generating morgan_rdkit fingerprints...
Generated fingerprints with 2048 features for 841 molecules
Trial 2232: 5-fold CV loss = 0.6304
[I 2025-08-08 00:23:14,944] Trial 2232 finished with value: 0.6303830802440643 and parameters: {'fp_type': 'morgan_rdkit', 'combined_morgan_radius': 3, 'combined_morgan_nBits': 1024, 'combined_rdkit_maxPath': 7, 'combined_rdkit_nBits': 1024, 'num_hidden_layers': 3, 'hidden_dim_0': 256, 'hidden_dim_1': 1024, 'hidden_dim_2': 64, 'kl_weight': 0.0001346089180391129, 'lr': 0.009073036238657779, 'batch_size': 128, 'dropout_rate': 0.17051093511744006, 'prior_mu': -0.08133766491314354, 'prior_sigma': 0.1046768104162815, 'normalization': 'none'}. Best is trial 896 with value: 0.4533553242683411.
Generating morgan fingerprints...
Generated fingerprints with 1024 features for 841 molecules
Trial 2235: 5-fold CV loss = 0.5692
