[I 2025-08-07 23:11:36,021] Trial 1876 finished with value: 0.4616324484348297 and parameters: {'fp_type': 'morgan_rdkit', 'combined_morgan_radius': 3, 'combined_morgan_nBits': 1024, 'combined_rdkit_maxPath': 7, 'combined_rdkit_nBits': 1024, 'num_hidden_layers': 3, 'hidden_dim_0': 256, 'hidden_dim_1': 256, 'hidden_dim_2': 64, 'kl_weight': 0.00034746469375493687, 'lr': 0.00667624203691344, 'batch_size': 128, 'dropout_rate': 0.02685843008141567, 'prior_mu': -0.04521988666390811, 'prior_sigma': 0.09723772420852593, 'normalization': 'layer'}. Best is trial 896 with value: 0.4533553242683411.
Generating morgan_rdkit fingerprints...
Generated fingerprints with 2048 features for 841 molecules
Trial 1877: 5-fold CV loss = 0.5587
[I 2025-08-07 23:11:39,769] Trial 1877 finished with value: 0.5587183773517609 and parameters: {'fp_type': 'morgan_rdkit', 'combined_morgan_radius': 3, 'combined_morgan_nBits': 1024, 'combined_rdkit_maxPath': 7, 'combined_rdkit_nBits': 1024, 'num_hidden_layers': 3, 'hidden_dim_0': 256, 'hidden_dim_1': 1024, 'hidden_dim_2': 128, 'kl_weight': 0.0005604355834149639, 'lr': 0.006755104113021991, 'batch_size': 128, 'dropout_rate': 0.1024742923886366, 'prior_mu': -0.018015776914985893, 'prior_sigma': 0.09178891847843618, 'normalization': 'layer'}. Best is trial 896 with value: 0.4533553242683411.
Generating morgan_rdkit fingerprints...
Generated fingerprints with 2048 features for 841 molecules
Trial 1878: 5-fold CV loss = 0.5458
[I 2025-08-07 23:11:53,440] Trial 1878 finished with value: 0.5457642316818238 and parameters: {'fp_type': 'morgan_rdkit', 'combined_morgan_radius': 3, 'combined_morgan_nBits': 1024, 'combined_rdkit_maxPath': 7, 'combined_rdkit_nBits': 1024, 'num_hidden_layers': 3, 'hidden_dim_0': 256, 'hidden_dim_1': 64, 'hidden_dim_2': 64, 'kl_weight': 0.0005588582587889763, 'lr': 0.008140356323051854, 'batch_size': 128, 'dropout_rate': 0.11776105834618528, 'prior_mu': -0.015507884150335908, 'prior_sigma': 0.09118386072219814, 'normalization': 'layer'}. Best is trial 896 with value: 0.4533553242683411.
Generating morgan_rdkit fingerprints...
Generated fingerprints with 2048 features for 841 molecules
Trial 1880: 5-fold CV loss = 0.4989
[I 2025-08-07 23:12:01,404] Trial 1880 finished with value: 0.4988512873649597 and parameters: {'fp_type': 'morgan_rdkit', 'combined_morgan_radius': 3, 'combined_morgan_nBits': 1024, 'combined_rdkit_maxPath': 7, 'combined_rdkit_nBits': 1024, 'num_hidden_layers': 1, 'hidden_dim_0': 256, 'kl_weight': 0.00031048154793184604, 'lr': 0.008116313931970272, 'batch_size': 128, 'dropout_rate': 0.1189932918457865, 'prior_mu': -0.029513713067013465, 'prior_sigma': 0.08493313133252793, 'normalization': 'layer'}. Best is trial 896 with value: 0.4533553242683411.
Generating morgan_rdkit fingerprints...
Generated fingerprints with 2048 features for 841 molecules
Trial 1873: 5-fold CV loss = 0.4755
[I 2025-08-07 23:12:12,030] Trial 1873 finished with value: 0.47551408410072327 and parameters: {'fp_type': 'morgan_rdkit', 'combined_morgan_radius': 3, 'combined_morgan_nBits': 1024, 'combined_rdkit_maxPath': 6, 'combined_rdkit_nBits': 1024, 'num_hidden_layers': 3, 'hidden_dim_0': 256, 'hidden_dim_1': 256, 'hidden_dim_2': 128, 'kl_weight': 0.0004126875416928639, 'lr': 0.005417068179018169, 'batch_size': 128, 'dropout_rate': 0.10134502806519191, 'prior_mu': -0.0768981898210723, 'prior_sigma': 0.09798967487821938, 'normalization': 'layer'}. Best is trial 896 with value: 0.4533553242683411.
Generating morgan_rdkit fingerprints...
Generated fingerprints with 2048 features for 841 molecules
Trial 1882: 5-fold CV loss = 0.4599
[I 2025-08-07 23:12:37,066] Trial 1882 finished with value: 0.45987303256988527 and parameters: {'fp_type': 'morgan_rdkit', 'combined_morgan_radius': 3, 'combined_morgan_nBits': 1024, 'combined_rdkit_maxPath': 7, 'combined_rdkit_nBits': 1024, 'num_hidden_layers': 3, 'hidden_dim_0': 256, 'hidden_dim_1': 1024, 'hidden_dim_2': 64, 'kl_weight': 0.00030156919362738595, 'lr': 0.007126397782657604, 'batch_size': 128, 'dropout_rate': 0.18513564910531255, 'prior_mu': -0.026320409917045765, 'prior_sigma': 0.0756644063363553, 'normalization': 'layer'}. Best is trial 896 with value: 0.4533553242683411.
Generating morgan_rdkit fingerprints...
Generated fingerprints with 1536 features for 841 molecules
Trial 1879: 5-fold CV loss = 0.5672
[I 2025-08-07 23:12:41,531] Trial 1879 finished with value: 0.5671910583972931 and parameters: {'fp_type': 'morgan_rdkit', 'combined_morgan_radius': 3, 'combined_morgan_nBits': 1024, 'combined_rdkit_maxPath': 7, 'combined_rdkit_nBits': 1024, 'num_hidden_layers': 3, 'hidden_dim_0': 256, 'hidden_dim_1': 64, 'hidden_dim_2': 64, 'kl_weight': 0.0003199476390409663, 'lr': 0.008120994027354467, 'batch_size': 128, 'dropout_rate': 0.12047841729669703, 'prior_mu': -0.016245085120145258, 'prior_sigma': 0.08454052618040532, 'normalization': 'layer'}. Best is trial 896 with value: 0.4533553242683411.
Generating morgan_rdkit fingerprints...
Generated fingerprints with 2048 features for 841 molecules
Trial 1881: 5-fold CV loss = 0.4630
[I 2025-08-07 23:12:45,375] Trial 1881 finished with value: 0.46303906440734866 and parameters: {'fp_type': 'morgan_rdkit', 'combined_morgan_radius': 3, 'combined_morgan_nBits': 1024, 'combined_rdkit_maxPath': 7, 'combined_rdkit_nBits': 1024, 'num_hidden_layers': 3, 'hidden_dim_0': 256, 'hidden_dim_1': 1024, 'hidden_dim_2': 64, 'kl_weight': 0.0003108587956938031, 'lr': 0.005216632987059155, 'batch_size': 128, 'dropout_rate': 0.1234043965142554, 'prior_mu': -0.030294044236317028, 'prior_sigma': 0.08368640858137869, 'normalization': 'layer'}. Best is trial 896 with value: 0.4533553242683411.
Generating morgan_rdkit fingerprints...
Generated fingerprints with 1536 features for 841 molecules
Trial 1884: 5-fold CV loss = 0.4941
[I 2025-08-07 23:13:11,862] Trial 1884 finished with value: 0.4941382765769958 and parameters: {'fp_type': 'morgan_rdkit', 'combined_morgan_radius': 3, 'combined_morgan_nBits': 1024, 'combined_rdkit_maxPath': 7, 'combined_rdkit_nBits': 512, 'num_hidden_layers': 3, 'hidden_dim_0': 256, 'hidden_dim_1': 1024, 'hidden_dim_2': 64, 'kl_weight': 0.0003463897311074257, 'lr': 0.006328521511127699, 'batch_size': 128, 'dropout_rate': 0.08251732298740809, 'prior_mu': -0.0422674009475861, 'prior_sigma': 0.08307264321310595, 'normalization': 'layer'}. Best is trial 896 with value: 0.4533553242683411.
Generating morgan_rdkit fingerprints...
Generated fingerprints with 2048 features for 841 molecules
Trial 1886: 5-fold CV loss = 0.4937
[I 2025-08-07 23:13:25,253] Trial 1886 finished with value: 0.49374268054962156 and parameters: {'fp_type': 'morgan_rdkit', 'combined_morgan_radius': 3, 'combined_morgan_nBits': 1024, 'combined_rdkit_maxPath': 7, 'combined_rdkit_nBits': 512, 'num_hidden_layers': 3, 'hidden_dim_0': 256, 'hidden_dim_1': 1024, 'hidden_dim_2': 64, 'kl_weight': 0.0002468688578366362, 'lr': 0.0063555461274794845, 'batch_size': 128, 'dropout_rate': 0.0860039531144732, 'prior_mu': -0.03982543830594764, 'prior_sigma': 0.07545474462438427, 'normalization': 'layer'}. Best is trial 896 with value: 0.4533553242683411.
Generating morgan_rdkit fingerprints...
Generated fingerprints with 2048 features for 841 molecules
Trial 1885: 5-fold CV loss = 0.5563
[I 2025-08-07 23:13:32,933] Trial 1885 finished with value: 0.5563383400440216 and parameters: {'fp_type': 'morgan_rdkit', 'combined_morgan_radius': 3, 'combined_morgan_nBits': 1024, 'combined_rdkit_maxPath': 7, 'combined_rdkit_nBits': 1024, 'num_hidden_layers': 3, 'hidden_dim_0': 256, 'hidden_dim_1': 1024, 'hidden_dim_2': 64, 'kl_weight': 0.00025069179013370547, 'lr': 0.006334158294075081, 'batch_size': 128, 'dropout_rate': 0.148155318046781, 'prior_mu': -0.03200824275787288, 'prior_sigma': 0.08124921290636469, 'normalization': 'layer'}. Best is trial 896 with value: 0.4533553242683411.
Generating morgan_rdkit fingerprints...
Generated fingerprints with 2048 features for 841 molecules
Trial 1883: 5-fold CV loss = 0.4649
[I 2025-08-07 23:13:38,249] Trial 1883 finished with value: 0.4648980855941772 and parameters: {'fp_type': 'morgan_rdkit', 'combined_morgan_radius': 3, 'combined_morgan_nBits': 1024, 'combined_rdkit_maxPath': 7, 'combined_rdkit_nBits': 1024, 'num_hidden_layers': 3, 'hidden_dim_0': 256, 'hidden_dim_1': 1024, 'hidden_dim_2': 64, 'kl_weight': 0.0003161702241568834, 'lr': 0.007008573126074012, 'batch_size': 128, 'dropout_rate': 0.18188073183617515, 'prior_mu': -0.027445131527534895, 'prior_sigma': 0.07453360852439152, 'normalization': 'layer'}. Best is trial 896 with value: 0.4533553242683411.
Generating morgan_rdkit fingerprints...
Generated fingerprints with 2048 features for 841 molecules
Trial 1887: 5-fold CV loss = 0.4679
[I 2025-08-07 23:13:49,507] Trial 1887 finished with value: 0.46792941093444823 and parameters: {'fp_type': 'morgan_rdkit', 'combined_morgan_radius': 3, 'combined_morgan_nBits': 1024, 'combined_rdkit_maxPath': 7, 'combined_rdkit_nBits': 1024, 'num_hidden_layers': 3, 'hidden_dim_0': 256, 'hidden_dim_1': 1024, 'hidden_dim_2': 64, 'kl_weight': 0.00024788582829583333, 'lr': 0.006912160707526603, 'batch_size': 128, 'dropout_rate': 0.14926549497819563, 'prior_mu': -0.010201641337945797, 'prior_sigma': 0.07496988247794523, 'normalization': 'layer'}. Best is trial 896 with value: 0.4533553242683411.
Generating rdkit fingerprints...
Generated fingerprints with 256 features for 841 molecules
Trial 1888: 5-fold CV loss = 0.4639
[I 2025-08-07 23:14:04,499] Trial 1888 finished with value: 0.46390005946159363 and parameters: {'fp_type': 'morgan_rdkit', 'combined_morgan_radius': 3, 'combined_morgan_nBits': 1024, 'combined_rdkit_maxPath': 7, 'combined_rdkit_nBits': 1024, 'num_hidden_layers': 3, 'hidden_dim_0': 512, 'hidden_dim_1': 1024, 'hidden_dim_2': 64, 'kl_weight': 0.0004663666868923292, 'lr': 0.0071007754077529375, 'batch_size': 128, 'dropout_rate': 0.14692910765784853, 'prior_mu': -0.010454256820426291, 'prior_sigma': 0.06591840060748416, 'normalization': 'layer'}. Best is trial 896 with value: 0.4533553242683411.
Generating rdkit fingerprints...
Generated fingerprints with 256 features for 841 molecules
Trial 1891: 5-fold CV loss = 0.8880
[I 2025-08-07 23:14:07,051] Trial 1891 finished with value: 0.8879869818687439 and parameters: {'fp_type': 'rdkit', 'rdkit_only_maxPath': 8, 'rdkit_only_nBits': 256, 'num_hidden_layers': 3, 'hidden_dim_0': 512, 'hidden_dim_1': 1024, 'hidden_dim_2': 64, 'kl_weight': 0.0004702169531081655, 'lr': 0.008399003932631075, 'batch_size': 128, 'dropout_rate': 0.49707638982309266, 'prior_mu': -0.05101408786709449, 'prior_sigma': 0.06606162964582113, 'normalization': 'layer'}. Best is trial 896 with value: 0.4533553242683411.
Generating morgan_rdkit fingerprints...
Generated fingerprints with 2048 features for 841 molecules
Trial 1889: 5-fold CV loss = 0.4794
[I 2025-08-07 23:14:15,460] Trial 1889 finished with value: 0.47935581803321836 and parameters: {'fp_type': 'morgan_rdkit', 'combined_morgan_radius': 3, 'combined_morgan_nBits': 1024, 'combined_rdkit_maxPath': 5, 'combined_rdkit_nBits': 1024, 'num_hidden_layers': 3, 'hidden_dim_0': 256, 'hidden_dim_1': 1024, 'hidden_dim_2': 64, 'kl_weight': 0.00017701574911567483, 'lr': 0.006969393682599619, 'batch_size': 128, 'dropout_rate': 0.197247624883492, 'prior_mu': -0.00828571974992516, 'prior_sigma': 0.08768872470156071, 'normalization': 'layer'}. Best is trial 896 with value: 0.4533553242683411.
Generating morgan_rdkit fingerprints...
Generated fingerprints with 2048 features for 841 molecules
Trial 1892: 5-fold CV loss = 0.8883
[I 2025-08-07 23:14:25,345] Trial 1892 finished with value: 0.888260543346405 and parameters: {'fp_type': 'rdkit', 'rdkit_only_maxPath': 8, 'rdkit_only_nBits': 256, 'num_hidden_layers': 3, 'hidden_dim_0': 256, 'hidden_dim_1': 1024, 'hidden_dim_2': 64, 'kl_weight': 0.00018022868942396678, 'lr': 0.008376514777957221, 'batch_size': 128, 'dropout_rate': 0.10884598631951643, 'prior_mu': -0.04976998089248435, 'prior_sigma': 0.08809339903197932, 'normalization': 'layer'}. Best is trial 896 with value: 0.4533553242683411.
Generating morgan_rdkit fingerprints...
Generated fingerprints with 2048 features for 841 molecules
Trial 1893: 5-fold CV loss = 0.4802
[I 2025-08-07 23:14:36,390] Trial 1893 finished with value: 0.48017423748970034 and parameters: {'fp_type': 'morgan_rdkit', 'combined_morgan_radius': 3, 'combined_morgan_nBits': 1024, 'combined_rdkit_maxPath': 5, 'combined_rdkit_nBits': 1024, 'num_hidden_layers': 3, 'hidden_dim_0': 256, 'hidden_dim_1': 1024, 'hidden_dim_2': 64, 'kl_weight': 0.000874731125053762, 'lr': 0.005804949383144825, 'batch_size': 128, 'dropout_rate': 0.11102295164147065, 'prior_mu': -0.06509784462314352, 'prior_sigma': 0.08786043234987191, 'normalization': 'layer'}. Best is trial 896 with value: 0.4533553242683411.
Generating morgan_rdkit fingerprints...
Generated fingerprints with 2048 features for 841 molecules
Trial 1894: 5-fold CV loss = 0.6990
[I 2025-08-07 23:15:01,452] Trial 1894 finished with value: 0.6990101933479309 and parameters: {'fp_type': 'morgan_rdkit', 'combined_morgan_radius': 3, 'combined_morgan_nBits': 1024, 'combined_rdkit_maxPath': 7, 'combined_rdkit_nBits': 1024, 'num_hidden_layers': 3, 'hidden_dim_0': 256, 'hidden_dim_1': 1024, 'hidden_dim_2': 64, 'kl_weight': 0.0003815171656305955, 'lr': 0.00576728036179846, 'batch_size': 128, 'dropout_rate': 0.06672881138552224, 'prior_mu': -0.06423083762677154, 'prior_sigma': 0.09209084026078415, 'normalization': 'none'}. Best is trial 896 with value: 0.4533553242683411.
Generating morgan_rdkit fingerprints...
Generated fingerprints with 2048 features for 841 molecules
Trial 1896: 5-fold CV loss = 0.7309
[I 2025-08-07 23:15:02,980] Trial 1896 finished with value: 0.7309096872806549 and parameters: {'fp_type': 'morgan_rdkit', 'combined_morgan_radius': 3, 'combined_morgan_nBits': 1024, 'combined_rdkit_maxPath': 7, 'combined_rdkit_nBits': 1024, 'num_hidden_layers': 3, 'hidden_dim_0': 256, 'hidden_dim_1': 1024, 'hidden_dim_2': 64, 'kl_weight': 0.000366319940142439, 'lr': 0.0077449755277483765, 'batch_size': 128, 'dropout_rate': 0.06470551202865803, 'prior_mu': -0.02135799924883848, 'prior_sigma': 0.10112657527558852, 'normalization': 'none'}. Best is trial 896 with value: 0.4533553242683411.
Generating morgan_rdkit fingerprints...
Generated fingerprints with 2048 features for 841 molecules
Trial 1890: 5-fold CV loss = 0.4670
[I 2025-08-07 23:15:04,925] Trial 1890 finished with value: 0.46698870062828063 and parameters: {'fp_type': 'morgan_rdkit', 'combined_morgan_radius': 3, 'combined_morgan_nBits': 1024, 'combined_rdkit_maxPath': 7, 'combined_rdkit_nBits': 1024, 'num_hidden_layers': 3, 'hidden_dim_0': 512, 'hidden_dim_1': 1024, 'hidden_dim_2': 64, 'kl_weight': 0.0004661960609505094, 'lr': 0.008227786987826193, 'batch_size': 128, 'dropout_rate': 0.11044396448184077, 'prior_mu': -0.007155226552432135, 'prior_sigma': 0.06576930834872072, 'normalization': 'layer'}. Best is trial 896 with value: 0.4533553242683411.
Generating morgan_rdkit fingerprints...
Generated fingerprints with 2048 features for 841 molecules
Trial 1895: 5-fold CV loss = 0.4633
[I 2025-08-07 23:15:08,825] Trial 1895 finished with value: 0.46334236264228823 and parameters: {'fp_type': 'morgan_rdkit', 'combined_morgan_radius': 3, 'combined_morgan_nBits': 1024, 'combined_rdkit_maxPath': 7, 'combined_rdkit_nBits': 1024, 'num_hidden_layers': 3, 'hidden_dim_0': 256, 'hidden_dim_1': 1024, 'hidden_dim_2': 64, 'kl_weight': 0.0003667616177410742, 'lr': 0.005836649918858405, 'batch_size': 128, 'dropout_rate': 0.06718299211957145, 'prior_mu': -0.06206028145354636, 'prior_sigma': 0.07971931224666726, 'normalization': 'layer'}. Best is trial 896 with value: 0.4533553242683411.
Generating morgan_rdkit fingerprints...
Generated fingerprints with 2048 features for 841 molecules
Trial 1900: 5-fold CV loss = 0.8873
[I 2025-08-07 23:15:24,864] Trial 1900 finished with value: 0.8872580766677857 and parameters: {'fp_type': 'morgan_rdkit', 'combined_morgan_radius': 3, 'combined_morgan_nBits': 1024, 'combined_rdkit_maxPath': 7, 'combined_rdkit_nBits': 1024, 'num_hidden_layers': 3, 'hidden_dim_0': 256, 'hidden_dim_1': 1024, 'hidden_dim_2': 1024, 'kl_weight': 0.0006403405297353545, 'lr': 0.005308972189828794, 'batch_size': 128, 'dropout_rate': 0.17236547066096802, 'prior_mu': -0.03687763033501566, 'prior_sigma': 0.09367645542253418, 'normalization': 'layer'}. Best is trial 896 with value: 0.4533553242683411.
Generating morgan_rdkit fingerprints...
Generated fingerprints with 2048 features for 841 molecules
Trial 1898: 5-fold CV loss = 0.4582
[I 2025-08-07 23:15:45,396] Trial 1898 finished with value: 0.45821226239204405 and parameters: {'fp_type': 'morgan_rdkit', 'combined_morgan_radius': 3, 'combined_morgan_nBits': 1024, 'combined_rdkit_maxPath': 7, 'combined_rdkit_nBits': 1024, 'num_hidden_layers': 3, 'hidden_dim_0': 256, 'hidden_dim_1': 1024, 'hidden_dim_2': 64, 'kl_weight': 0.00027726683073793523, 'lr': 0.005260668782059465, 'batch_size': 128, 'dropout_rate': 0.17288832998688686, 'prior_mu': -0.037240808295490646, 'prior_sigma': 0.08035461432928225, 'normalization': 'layer'}. Best is trial 896 with value: 0.4533553242683411.
Generating morgan_rdkit fingerprints...
Generated fingerprints with 2048 features for 841 molecules
Trial 1901: 5-fold CV loss = 0.9014
[I 2025-08-07 23:15:59,748] Trial 1901 finished with value: 0.9013866066932679 and parameters: {'fp_type': 'morgan_rdkit', 'combined_morgan_radius': 3, 'combined_morgan_nBits': 1024, 'combined_rdkit_maxPath': 7, 'combined_rdkit_nBits': 1024, 'num_hidden_layers': 3, 'hidden_dim_0': 128, 'hidden_dim_1': 1024, 'hidden_dim_2': 64, 'kl_weight': 0.0002766487659817209, 'lr': 0.000124355185842615, 'batch_size': 128, 'dropout_rate': 0.08873517691764782, 'prior_mu': -0.024295773475660188, 'prior_sigma': 0.07893072813089841, 'normalization': 'layer'}. Best is trial 896 with value: 0.4533553242683411.
Generating morgan_rdkit fingerprints...
Generated fingerprints with 2048 features for 841 molecules
Trial 1897: 5-fold CV loss = 0.4587
[I 2025-08-07 23:16:01,938] Trial 1897 finished with value: 0.458729612827301 and parameters: {'fp_type': 'morgan_rdkit', 'combined_morgan_radius': 3, 'combined_morgan_nBits': 1024, 'combined_rdkit_maxPath': 7, 'combined_rdkit_nBits': 1024, 'num_hidden_layers': 3, 'hidden_dim_0': 256, 'hidden_dim_1': 1024, 'hidden_dim_2': 64, 'kl_weight': 0.00036023389617806677, 'lr': 0.007754044221374404, 'batch_size': 128, 'dropout_rate': 0.17429795197921463, 'prior_mu': -0.022006374663231323, 'prior_sigma': 0.1000687936362075, 'normalization': 'layer'}. Best is trial 896 with value: 0.4533553242683411.
Generating morgan_rdkit fingerprints...
Generated fingerprints with 2048 features for 841 molecules
Trial 1902: 5-fold CV loss = 0.5338
[I 2025-08-07 23:16:17,481] Trial 1902 finished with value: 0.5338108360767364 and parameters: {'fp_type': 'morgan_rdkit', 'combined_morgan_radius': 3, 'combined_morgan_nBits': 1024, 'combined_rdkit_maxPath': 7, 'combined_rdkit_nBits': 1024, 'num_hidden_layers': 3, 'hidden_dim_0': 256, 'hidden_dim_1': 1024, 'hidden_dim_2': 64, 'kl_weight': 0.00024032895662215009, 'lr': 0.008848317424817884, 'batch_size': 128, 'dropout_rate': 0.1904044149687399, 'prior_mu': -0.02521276036150718, 'prior_sigma': 0.08080934363134705, 'normalization': 'layer'}. Best is trial 896 with value: 0.4533553242683411.
Generating morgan_rdkit fingerprints...
Generated fingerprints with 2048 features for 841 molecules
Trial 1899: 5-fold CV loss = 0.4646
[I 2025-08-07 23:16:27,406] Trial 1899 finished with value: 0.46457670331001283 and parameters: {'fp_type': 'morgan_rdkit', 'combined_morgan_radius': 3, 'combined_morgan_nBits': 1024, 'combined_rdkit_maxPath': 7, 'combined_rdkit_nBits': 1024, 'num_hidden_layers': 3, 'hidden_dim_0': 256, 'hidden_dim_1': 1024, 'hidden_dim_2': 64, 'kl_weight': 0.00027605971576876874, 'lr': 0.009146615599692745, 'batch_size': 128, 'dropout_rate': 0.16925062406521243, 'prior_mu': -0.03910730553954739, 'prior_sigma': 0.07927135169013032, 'normalization': 'layer'}. Best is trial 896 with value: 0.4533553242683411.
Generating morgan_rdkit fingerprints...
Generated fingerprints with 2048 features for 841 molecules
Trial 1903: 5-fold CV loss = 0.4670
[I 2025-08-07 23:16:43,186] Trial 1903 finished with value: 0.46700804233551024 and parameters: {'fp_type': 'morgan_rdkit', 'combined_morgan_radius': 3, 'combined_morgan_nBits': 1024, 'combined_rdkit_maxPath': 7, 'combined_rdkit_nBits': 1024, 'num_hidden_layers': 3, 'hidden_dim_0': 256, 'hidden_dim_1': 1024, 'hidden_dim_2': 64, 'kl_weight': 0.00021680103424566463, 'lr': 0.009128603727868905, 'batch_size': 128, 'dropout_rate': 0.18771574555187076, 'prior_mu': -0.029361654323576087, 'prior_sigma': 0.08134867650589529, 'normalization': 'layer'}. Best is trial 896 with value: 0.4533553242683411.
Generating morgan_rdkit fingerprints...
Generated fingerprints with 2048 features for 841 molecules
Trial 1904: 5-fold CV loss = 0.4696
[I 2025-08-07 23:16:54,224] Trial 1904 finished with value: 0.4695712625980377 and parameters: {'fp_type': 'morgan_rdkit', 'combined_morgan_radius': 3, 'combined_morgan_nBits': 1024, 'combined_rdkit_maxPath': 7, 'combined_rdkit_nBits': 1024, 'num_hidden_layers': 3, 'hidden_dim_0': 256, 'hidden_dim_1': 1024, 'hidden_dim_2': 64, 'kl_weight': 0.00024656210520795864, 'lr': 0.009201805278592568, 'batch_size': 128, 'dropout_rate': 0.15901443428569273, 'prior_mu': -0.030317257844160075, 'prior_sigma': 0.08082546400490259, 'normalization': 'layer'}. Best is trial 896 with value: 0.4533553242683411.
Generating morgan_rdkit fingerprints...
Generated fingerprints with 2048 features for 841 molecules
Trial 1905: 5-fold CV loss = 0.4609
