[I 2025-08-07 16:20:15,386] Trial 59 finished with value: 0.749993872642517 and parameters: {'fp_type': 'morgan_rdkit', 'combined_morgan_radius': 2, 'combined_morgan_nBits': 512, 'combined_rdkit_maxPath': 7, 'combined_rdkit_nBits': 1024, 'num_hidden_layers': 2, 'hidden_dim_0': 64, 'hidden_dim_1': 512, 'kl_weight': 0.0001043280370111882, 'lr': 0.00017153635660405221, 'batch_size': 32, 'dropout_rate': 0.27041463285850054, 'prior_mu': 0.06445057207043761, 'prior_sigma': 0.057135410416407205, 'normalization': 'layer'}. Best is trial 54 with value: 0.47750294804573057.
Generating morgan_rdkit fingerprints...
Generated fingerprints with 1536 features for 841 molecules
Trial 64: 5-fold CV loss = 0.4864
[I 2025-08-07 16:20:27,577] Trial 64 finished with value: 0.48637736439704893 and parameters: {'fp_type': 'morgan_rdkit', 'combined_morgan_radius': 3, 'combined_morgan_nBits': 512, 'combined_rdkit_maxPath': 7, 'combined_rdkit_nBits': 1024, 'num_hidden_layers': 2, 'hidden_dim_0': 64, 'hidden_dim_1': 512, 'kl_weight': 0.00010071515055680525, 'lr': 0.0021385895516172985, 'batch_size': 64, 'dropout_rate': 0.1974371612108311, 'prior_mu': 0.1010629303362526, 'prior_sigma': 0.05845746753876524, 'normalization': 'layer'}. Best is trial 54 with value: 0.47750294804573057.
Generating morgan_rdkit fingerprints...
Generated fingerprints with 1536 features for 841 molecules
Trial 65: 5-fold CV loss = 0.4836
[I 2025-08-07 16:20:43,853] Trial 65 finished with value: 0.4835583508014679 and parameters: {'fp_type': 'morgan_rdkit', 'combined_morgan_radius': 2, 'combined_morgan_nBits': 512, 'combined_rdkit_maxPath': 7, 'combined_rdkit_nBits': 1024, 'num_hidden_layers': 2, 'hidden_dim_0': 64, 'hidden_dim_1': 512, 'kl_weight': 0.00010088725894573435, 'lr': 0.002258511982556135, 'batch_size': 32, 'dropout_rate': 0.1777678679825978, 'prior_mu': 0.10346925604721707, 'prior_sigma': 0.05640411435388046, 'normalization': 'layer'}. Best is trial 54 with value: 0.47750294804573057.
Generating morgan_rdkit fingerprints...
Generated fingerprints with 1536 features for 841 molecules
Trial 66: 5-fold CV loss = 0.6199
[I 2025-08-07 16:20:52,851] Trial 66 finished with value: 0.6199059069156647 and parameters: {'fp_type': 'morgan_rdkit', 'combined_morgan_radius': 2, 'combined_morgan_nBits': 512, 'combined_rdkit_maxPath': 7, 'combined_rdkit_nBits': 1024, 'num_hidden_layers': 2, 'hidden_dim_0': 64, 'hidden_dim_1': 512, 'kl_weight': 0.0001230076233891488, 'lr': 0.0009889626834962129, 'batch_size': 128, 'dropout_rate': 0.31521192135574455, 'prior_mu': 0.1003259678736417, 'prior_sigma': 0.058214944874228076, 'normalization': 'layer'}. Best is trial 54 with value: 0.47750294804573057.
Generating morgan_rdkit fingerprints...
Generated fingerprints with 1536 features for 841 molecules
Trial 68: 5-fold CV loss = 0.6442
[I 2025-08-07 16:21:16,735] Trial 68 finished with value: 0.644199687242508 and parameters: {'fp_type': 'morgan_rdkit', 'combined_morgan_radius': 3, 'combined_morgan_nBits': 512, 'combined_rdkit_maxPath': 7, 'combined_rdkit_nBits': 1024, 'num_hidden_layers': 2, 'hidden_dim_0': 64, 'hidden_dim_1': 1024, 'kl_weight': 0.00013294760389869774, 'lr': 0.0010245421965953219, 'batch_size': 64, 'dropout_rate': 0.1790374863432977, 'prior_mu': -0.1427955335794803, 'prior_sigma': 0.06963350084704077, 'normalization': 'layer'}. Best is trial 54 with value: 0.47750294804573057.
Generating rdkit fingerprints...
Generated fingerprints with 256 features for 841 molecules
Trial 69: 5-fold CV loss = 0.5302
[I 2025-08-07 16:21:20,710] Trial 69 finished with value: 0.5301731526851654 and parameters: {'fp_type': 'morgan_rdkit', 'combined_morgan_radius': 2, 'combined_morgan_nBits': 512, 'combined_rdkit_maxPath': 7, 'combined_rdkit_nBits': 1024, 'num_hidden_layers': 2, 'hidden_dim_0': 64, 'hidden_dim_1': 512, 'kl_weight': 0.0001258789310313062, 'lr': 0.002248531105843432, 'batch_size': 128, 'dropout_rate': 0.13275944929755473, 'prior_mu': 0.12067740572176264, 'prior_sigma': 0.06366944627727174, 'normalization': 'layer'}. Best is trial 54 with value: 0.47750294804573057.
Generating rdkit fingerprints...
Generated fingerprints with 256 features for 841 molecules
Trial 67: 5-fold CV loss = 0.6057
[I 2025-08-07 16:21:27,138] Trial 67 finished with value: 0.6056949973106385 and parameters: {'fp_type': 'morgan_rdkit', 'combined_morgan_radius': 2, 'combined_morgan_nBits': 512, 'combined_rdkit_maxPath': 7, 'combined_rdkit_nBits': 1024, 'num_hidden_layers': 2, 'hidden_dim_0': 64, 'hidden_dim_1': 512, 'kl_weight': 0.0003113269426963062, 'lr': 0.0006573298823986024, 'batch_size': 128, 'dropout_rate': 0.3128106729629931, 'prior_mu': 0.10551215051889132, 'prior_sigma': 0.04902894895749026, 'normalization': 'layer'}. Best is trial 54 with value: 0.47750294804573057.
Generating rdkit fingerprints...
Generated fingerprints with 256 features for 841 molecules
Trial 70: 5-fold CV loss = 0.7487
[I 2025-08-07 16:22:01,976] Trial 70 finished with value: 0.7487430095672607 and parameters: {'fp_type': 'morgan_rdkit', 'combined_morgan_radius': 2, 'combined_morgan_nBits': 512, 'combined_rdkit_maxPath': 7, 'combined_rdkit_nBits': 1024, 'num_hidden_layers': 2, 'hidden_dim_0': 128, 'hidden_dim_1': 1024, 'kl_weight': 0.00021036616551213077, 'lr': 0.0005693690000287173, 'batch_size': 32, 'dropout_rate': 0.17942690141567938, 'prior_mu': 0.15082185858233021, 'prior_sigma': 0.07119639509714942, 'normalization': 'layer'}. Best is trial 54 with value: 0.47750294804573057.
Generating morgan_rdkit fingerprints...
Generated fingerprints with 1536 features for 841 molecules
Trial 71: 5-fold CV loss = 0.8677
[I 2025-08-07 16:22:34,828] Trial 71 finished with value: 0.8677422523498535 and parameters: {'fp_type': 'rdkit', 'rdkit_only_maxPath': 7, 'rdkit_only_nBits': 256, 'num_hidden_layers': 2, 'hidden_dim_0': 128, 'hidden_dim_1': 512, 'kl_weight': 0.00019634022519119938, 'lr': 0.00217720641223202, 'batch_size': 32, 'dropout_rate': 0.13115074240116273, 'prior_mu': 0.1491234743825852, 'prior_sigma': 0.09118431958359907, 'normalization': 'layer'}. Best is trial 54 with value: 0.47750294804573057.
Generating morgan_rdkit fingerprints...
Generated fingerprints with 1536 features for 841 molecules
Trial 72: 5-fold CV loss = 0.6372
[I 2025-08-07 16:22:57,830] Trial 72 finished with value: 0.6371649503707886 and parameters: {'fp_type': 'rdkit', 'rdkit_only_maxPath': 5, 'rdkit_only_nBits': 256, 'num_hidden_layers': 2, 'hidden_dim_0': 128, 'hidden_dim_1': 512, 'kl_weight': 0.0002951979996435687, 'lr': 0.001810766584027775, 'batch_size': 32, 'dropout_rate': 0.2107569449656968, 'prior_mu': 0.1505605003786404, 'prior_sigma': 0.10578821481766057, 'normalization': 'layer'}. Best is trial 54 with value: 0.47750294804573057.
Generating morgan_rdkit fingerprints...
Generated fingerprints with 1536 features for 841 molecules
Trial 74: 5-fold CV loss = 0.5512
[I 2025-08-07 16:23:10,361] Trial 74 finished with value: 0.5512412190437317 and parameters: {'fp_type': 'morgan_rdkit', 'combined_morgan_radius': 3, 'combined_morgan_nBits': 512, 'combined_rdkit_maxPath': 6, 'combined_rdkit_nBits': 1024, 'num_hidden_layers': 2, 'hidden_dim_0': 64, 'hidden_dim_1': 512, 'kl_weight': 0.00021767690009053797, 'lr': 0.0016942145907556563, 'batch_size': 64, 'dropout_rate': 0.22158875860242155, 'prior_mu': 0.042270497825569436, 'prior_sigma': 0.08689139983293104, 'normalization': 'layer'}. Best is trial 54 with value: 0.47750294804573057.
Generating morgan_rdkit fingerprints...
Generated fingerprints with 768 features for 841 molecules
Trial 75: 5-fold CV loss = 0.5132
[I 2025-08-07 16:23:23,654] Trial 75 finished with value: 0.5131948471069336 and parameters: {'fp_type': 'morgan_rdkit', 'combined_morgan_radius': 3, 'combined_morgan_nBits': 512, 'combined_rdkit_maxPath': 6, 'combined_rdkit_nBits': 1024, 'num_hidden_layers': 2, 'hidden_dim_0': 64, 'hidden_dim_1': 512, 'kl_weight': 0.00025497724525881183, 'lr': 0.004412688007139521, 'batch_size': 64, 'dropout_rate': 0.21695804099730412, 'prior_mu': -0.19989589267190028, 'prior_sigma': 0.08408668797604345, 'normalization': 'layer'}. Best is trial 54 with value: 0.47750294804573057.
Generating morgan_rdkit fingerprints...
Generated fingerprints with 768 features for 841 molecules
Trial 76: 5-fold CV loss = 0.5209
[I 2025-08-07 16:23:38,012] Trial 76 finished with value: 0.5208802282810211 and parameters: {'fp_type': 'morgan_rdkit', 'combined_morgan_radius': 3, 'combined_morgan_nBits': 512, 'combined_rdkit_maxPath': 6, 'combined_rdkit_nBits': 1024, 'num_hidden_layers': 2, 'hidden_dim_0': 64, 'hidden_dim_1': 512, 'kl_weight': 0.0003721605855499747, 'lr': 0.004119666178488442, 'batch_size': 64, 'dropout_rate': 0.2223149687891373, 'prior_mu': 0.18623326604406965, 'prior_sigma': 0.08583252013104645, 'normalization': 'layer'}. Best is trial 54 with value: 0.47750294804573057.
Generating morgan_rdkit fingerprints...
Generated fingerprints with 768 features for 841 molecules
Trial 79: 5-fold CV loss = 0.6073
[I 2025-08-07 16:24:05,367] Trial 79 finished with value: 0.6073186516761779 and parameters: {'fp_type': 'morgan_rdkit', 'combined_morgan_radius': 2, 'combined_morgan_nBits': 512, 'combined_rdkit_maxPath': 7, 'combined_rdkit_nBits': 256, 'num_hidden_layers': 3, 'hidden_dim_0': 256, 'hidden_dim_1': 128, 'hidden_dim_2': 64, 'kl_weight': 0.000697857544347715, 'lr': 0.005354054200267729, 'batch_size': 64, 'dropout_rate': 0.2014714798458217, 'prior_mu': 0.07276001669853303, 'prior_sigma': 0.051454187582020486, 'normalization': 'layer'}. Best is trial 54 with value: 0.47750294804573057.
Generating morgan_rdkit fingerprints...
Generated fingerprints with 1536 features for 841 molecules
Trial 77: 5-fold CV loss = 0.5330
[I 2025-08-07 16:24:10,674] Trial 77 finished with value: 0.5329927921295166 and parameters: {'fp_type': 'morgan_rdkit', 'combined_morgan_radius': 3, 'combined_morgan_nBits': 512, 'combined_rdkit_maxPath': 7, 'combined_rdkit_nBits': 256, 'num_hidden_layers': 3, 'hidden_dim_0': 64, 'hidden_dim_1': 512, 'hidden_dim_2': 64, 'kl_weight': 0.0003755016647971781, 'lr': 0.004996118631683673, 'batch_size': 64, 'dropout_rate': 0.19679035869225192, 'prior_mu': -0.1991946970399504, 'prior_sigma': 0.05352540320155609, 'normalization': 'layer'}. Best is trial 54 with value: 0.47750294804573057.
Generating morgan_rdkit fingerprints...
Generated fingerprints with 1536 features for 841 molecules
Trial 78: 5-fold CV loss = 0.6111
[I 2025-08-07 16:24:12,307] Trial 78 finished with value: 0.6111048877239227 and parameters: {'fp_type': 'morgan_rdkit', 'combined_morgan_radius': 2, 'combined_morgan_nBits': 512, 'combined_rdkit_maxPath': 7, 'combined_rdkit_nBits': 256, 'num_hidden_layers': 3, 'hidden_dim_0': 64, 'hidden_dim_1': 128, 'hidden_dim_2': 512, 'kl_weight': 0.0003843330710150877, 'lr': 0.005162934709305137, 'batch_size': 64, 'dropout_rate': 0.19818718209372585, 'prior_mu': 0.19848062685447743, 'prior_sigma': 0.052431877150319904, 'normalization': 'layer'}. Best is trial 54 with value: 0.47750294804573057.
Generating morgan_rdkit fingerprints...
Generated fingerprints with 2048 features for 841 molecules
Trial 80: 5-fold CV loss = 0.5381
[I 2025-08-07 16:24:55,349] Trial 80 finished with value: 0.5381119906902313 and parameters: {'fp_type': 'morgan_rdkit', 'combined_morgan_radius': 2, 'combined_morgan_nBits': 512, 'combined_rdkit_maxPath': 8, 'combined_rdkit_nBits': 1024, 'num_hidden_layers': 3, 'hidden_dim_0': 64, 'hidden_dim_1': 256, 'hidden_dim_2': 1024, 'kl_weight': 0.003390859356060234, 'lr': 0.0019299863471918738, 'batch_size': 64, 'dropout_rate': 0.25616377762571524, 'prior_mu': -0.08940186936603631, 'prior_sigma': 0.02979932928466865, 'normalization': 'none'}. Best is trial 54 with value: 0.47750294804573057.
Generating morgan_rdkit fingerprints...
Generated fingerprints with 1536 features for 841 molecules
Trial 82: 5-fold CV loss = 0.5311
[I 2025-08-07 16:25:22,046] Trial 82 finished with value: 0.5310680866241455 and parameters: {'fp_type': 'morgan_rdkit', 'combined_morgan_radius': 2, 'combined_morgan_nBits': 1024, 'combined_rdkit_maxPath': 8, 'combined_rdkit_nBits': 1024, 'num_hidden_layers': 1, 'hidden_dim_0': 512, 'kl_weight': 0.003567538201401001, 'lr': 0.0019529063700796487, 'batch_size': 32, 'dropout_rate': 0.4703086323778156, 'prior_mu': 0.1269472624792752, 'prior_sigma': 0.06188319502805141, 'normalization': 'none'}. Best is trial 54 with value: 0.47750294804573057.
Generating morgan_rdkit fingerprints...
Generated fingerprints with 1536 features for 841 molecules
Trial 81: 5-fold CV loss = 0.5442
[I 2025-08-07 16:25:27,004] Trial 81 finished with value: 0.5441685259342194 and parameters: {'fp_type': 'morgan_rdkit', 'combined_morgan_radius': 2, 'combined_morgan_nBits': 512, 'combined_rdkit_maxPath': 8, 'combined_rdkit_nBits': 1024, 'num_hidden_layers': 1, 'hidden_dim_0': 512, 'kl_weight': 0.0030162548491815084, 'lr': 0.0028961464865210774, 'batch_size': 32, 'dropout_rate': 0.25610201186301684, 'prior_mu': 0.12743258849044853, 'prior_sigma': 0.062343572059630065, 'normalization': 'none'}. Best is trial 54 with value: 0.47750294804573057.
Generating morgan_rdkit fingerprints...
Generated fingerprints with 1536 features for 841 molecules
Trial 83: 5-fold CV loss = 0.5091
[I 2025-08-07 16:25:47,478] Trial 83 finished with value: 0.5090702533721924 and parameters: {'fp_type': 'morgan_rdkit', 'combined_morgan_radius': 2, 'combined_morgan_nBits': 1024, 'combined_rdkit_maxPath': 7, 'combined_rdkit_nBits': 512, 'num_hidden_layers': 1, 'hidden_dim_0': 512, 'kl_weight': 0.00014212682573300515, 'lr': 0.0014734097638868838, 'batch_size': 32, 'dropout_rate': 0.4786526913894318, 'prior_mu': 0.13618972134231874, 'prior_sigma': 0.06247568548645646, 'normalization': 'layer'}. Best is trial 54 with value: 0.47750294804573057.
Generating morgan_rdkit fingerprints...
Generated fingerprints with 1536 features for 841 molecules
Trial 84: 5-fold CV loss = 0.4812
[I 2025-08-07 16:26:42,294] Trial 84 finished with value: 0.48118318915367125 and parameters: {'fp_type': 'morgan_rdkit', 'combined_morgan_radius': 2, 'combined_morgan_nBits': 512, 'combined_rdkit_maxPath': 7, 'combined_rdkit_nBits': 1024, 'num_hidden_layers': 2, 'hidden_dim_0': 64, 'hidden_dim_1': 512, 'kl_weight': 0.0001076891598167885, 'lr': 0.002681819233742502, 'batch_size': 32, 'dropout_rate': 0.17163914873518032, 'prior_mu': 0.10439714786026859, 'prior_sigma': 0.04166271411721934, 'normalization': 'layer'}. Best is trial 54 with value: 0.47750294804573057.
Generating morgan_rdkit fingerprints...
Generated fingerprints with 1536 features for 841 molecules
Trial 73: 5-fold CV loss = 0.7028
[I 2025-08-07 16:26:48,797] Trial 73 finished with value: 0.7027658939361572 and parameters: {'fp_type': 'rdkit', 'rdkit_only_maxPath': 6, 'rdkit_only_nBits': 256, 'num_hidden_layers': 2, 'hidden_dim_0': 128, 'hidden_dim_1': 512, 'kl_weight': 0.0002182648058178133, 'lr': 0.0017843641084087205, 'batch_size': 32, 'dropout_rate': 0.17072089808566654, 'prior_mu': 0.18588850804303478, 'prior_sigma': 0.08998690566681972, 'normalization': 'layer'}. Best is trial 54 with value: 0.47750294804573057.
Generating morgan_rdkit fingerprints...
Generated fingerprints with 1536 features for 841 molecules
Trial 86: 5-fold CV loss = 0.4736
[I 2025-08-07 16:26:55,357] Trial 86 finished with value: 0.473599910736084 and parameters: {'fp_type': 'morgan_rdkit', 'combined_morgan_radius': 2, 'combined_morgan_nBits': 512, 'combined_rdkit_maxPath': 7, 'combined_rdkit_nBits': 1024, 'num_hidden_layers': 2, 'hidden_dim_0': 64, 'hidden_dim_1': 512, 'kl_weight': 0.00010140324231969657, 'lr': 0.0031892239687124476, 'batch_size': 32, 'dropout_rate': 0.1676184942761345, 'prior_mu': 0.09448024847300418, 'prior_sigma': 0.04612146640583136, 'normalization': 'layer'}. Best is trial 86 with value: 0.473599910736084.
Generating morgan_rdkit fingerprints...
Generated fingerprints with 1536 features for 841 molecules
Trial 85: 5-fold CV loss = 0.4848
[I 2025-08-07 16:27:07,342] Trial 85 finished with value: 0.48475596904754636 and parameters: {'fp_type': 'morgan_rdkit', 'combined_morgan_radius': 2, 'combined_morgan_nBits': 512, 'combined_rdkit_maxPath': 7, 'combined_rdkit_nBits': 1024, 'num_hidden_layers': 2, 'hidden_dim_0': 64, 'hidden_dim_1': 512, 'kl_weight': 0.00010210744689805387, 'lr': 0.002419608216047806, 'batch_size': 32, 'dropout_rate': 0.28271407057257536, 'prior_mu': 0.10325349657167217, 'prior_sigma': 0.04353000877493038, 'normalization': 'layer'}. Best is trial 86 with value: 0.473599910736084.
Generating morgan_rdkit fingerprints...
Generated fingerprints with 1536 features for 841 molecules
Trial 87: 5-fold CV loss = 0.4776
[I 2025-08-07 16:28:04,684] Trial 87 finished with value: 0.4775656223297119 and parameters: {'fp_type': 'morgan_rdkit', 'combined_morgan_radius': 2, 'combined_morgan_nBits': 512, 'combined_rdkit_maxPath': 7, 'combined_rdkit_nBits': 1024, 'num_hidden_layers': 2, 'hidden_dim_0': 64, 'hidden_dim_1': 512, 'kl_weight': 0.0001015600056909151, 'lr': 0.0024513817202027463, 'batch_size': 32, 'dropout_rate': 0.08858019626673046, 'prior_mu': 0.09419682081411884, 'prior_sigma': 0.04536630326816411, 'normalization': 'layer'}. Best is trial 86 with value: 0.473599910736084.
Generating morgan fingerprints...
Generated fingerprints with 1024 features for 841 molecules
Trial 89: 5-fold CV loss = 0.4823
[I 2025-08-07 16:28:08,348] Trial 89 finished with value: 0.48228933215141295 and parameters: {'fp_type': 'morgan_rdkit', 'combined_morgan_radius': 2, 'combined_morgan_nBits': 512, 'combined_rdkit_maxPath': 7, 'combined_rdkit_nBits': 1024, 'num_hidden_layers': 2, 'hidden_dim_0': 64, 'hidden_dim_1': 512, 'kl_weight': 0.00010021405994153414, 'lr': 0.0024027132701221338, 'batch_size': 32, 'dropout_rate': 0.11155062894841837, 'prior_mu': 0.0931987177193858, 'prior_sigma': 0.04494705370308752, 'normalization': 'layer'}. Best is trial 86 with value: 0.473599910736084.
Generating morgan fingerprints...
Generated fingerprints with 1024 features for 841 molecules
Trial 90: 5-fold CV loss = 0.4887
[I 2025-08-07 16:28:39,283] Trial 90 finished with value: 0.4886570990085602 and parameters: {'fp_type': 'morgan_rdkit', 'combined_morgan_radius': 2, 'combined_morgan_nBits': 512, 'combined_rdkit_maxPath': 7, 'combined_rdkit_nBits': 1024, 'num_hidden_layers': 2, 'hidden_dim_0': 64, 'hidden_dim_1': 512, 'kl_weight': 0.0001147162966031651, 'lr': 0.0023806517192607045, 'batch_size': 32, 'dropout_rate': 0.17230626555983056, 'prior_mu': 0.1115596965261867, 'prior_sigma': 0.0431737885563351, 'normalization': 'layer'}. Best is trial 86 with value: 0.473599910736084.
Generating morgan fingerprints...
Generated fingerprints with 1024 features for 841 molecules
Trial 92: 5-fold CV loss = 0.5231
[I 2025-08-07 16:28:46,633] Trial 92 finished with value: 0.5231269121170044 and parameters: {'fp_type': 'morgan', 'morgan_only_radius': 2, 'morgan_only_nBits': 1024, 'num_hidden_layers': 2, 'hidden_dim_0': 64, 'hidden_dim_1': 512, 'kl_weight': 0.00014056541195654377, 'lr': 0.0024704064895505634, 'batch_size': 32, 'dropout_rate': 0.06273956294573581, 'prior_mu': 0.09183544259312164, 'prior_sigma': 0.04269750733510824, 'normalization': 'layer'}. Best is trial 86 with value: 0.473599910736084.
Generating morgan_rdkit fingerprints...
Generated fingerprints with 1536 features for 841 molecules
Trial 91: 5-fold CV loss = 0.5224
[I 2025-08-07 16:28:51,646] Trial 91 finished with value: 0.5223791718482971 and parameters: {'fp_type': 'morgan', 'morgan_only_radius': 2, 'morgan_only_nBits': 1024, 'num_hidden_layers': 2, 'hidden_dim_0': 64, 'hidden_dim_1': 512, 'kl_weight': 0.00015004303486230918, 'lr': 0.002449753198931158, 'batch_size': 32, 'dropout_rate': 0.05556077069791307, 'prior_mu': 0.09097571094449772, 'prior_sigma': 0.035767256511812236, 'normalization': 'layer'}. Best is trial 86 with value: 0.473599910736084.
Generating morgan_rdkit fingerprints...
Generated fingerprints with 1536 features for 841 molecules
Trial 95: 5-fold CV loss = 0.4824
[I 2025-08-07 16:29:40,583] Trial 95 finished with value: 0.4824305772781372 and parameters: {'fp_type': 'morgan_rdkit', 'combined_morgan_radius': 2, 'combined_morgan_nBits': 512, 'combined_rdkit_maxPath': 7, 'combined_rdkit_nBits': 1024, 'num_hidden_layers': 2, 'hidden_dim_0': 64, 'hidden_dim_1': 512, 'kl_weight': 0.00017782613914959477, 'lr': 0.003138238415197075, 'batch_size': 32, 'dropout_rate': 0.14449093023301707, 'prior_mu': 0.06797055795270557, 'prior_sigma': 0.027937946097223613, 'normalization': 'layer'}. Best is trial 86 with value: 0.473599910736084.
Generating morgan_rdkit fingerprints...
Generated fingerprints with 1536 features for 841 molecules
Trial 94: 5-fold CV loss = 0.4762
[I 2025-08-07 16:29:46,800] Trial 94 finished with value: 0.47617133259773253 and parameters: {'fp_type': 'morgan_rdkit', 'combined_morgan_radius': 2, 'combined_morgan_nBits': 512, 'combined_rdkit_maxPath': 7, 'combined_rdkit_nBits': 1024, 'num_hidden_layers': 2, 'hidden_dim_0': 64, 'hidden_dim_1': 512, 'kl_weight': 0.0001764539672181266, 'lr': 0.0032745272075848063, 'batch_size': 32, 'dropout_rate': 0.08034797222762759, 'prior_mu': 0.0717983439824531, 'prior_sigma': 0.03626750794787437, 'normalization': 'layer'}. Best is trial 86 with value: 0.473599910736084.
Generating morgan_rdkit fingerprints...
Generated fingerprints with 1536 features for 841 molecules
Trial 88: 5-fold CV loss = 0.4772
