[I 2025-08-08 02:02:23,669] Trial 2716 finished with value: 0.561849707365036 and parameters: {'fp_type': 'morgan_rdkit', 'combined_morgan_radius': 3, 'combined_morgan_nBits': 1024, 'combined_rdkit_maxPath': 7, 'combined_rdkit_nBits': 1024, 'num_hidden_layers': 3, 'hidden_dim_0': 256, 'hidden_dim_1': 128, 'hidden_dim_2': 64, 'kl_weight': 0.00047304433861840826, 'lr': 0.0058180098451821646, 'batch_size': 128, 'dropout_rate': 0.1368118091568272, 'prior_mu': -0.031134224740450866, 'prior_sigma': 0.06484799700661892, 'normalization': 'layer'}. Best is trial 896 with value: 0.4533553242683411.
Generating morgan fingerprints...
Generated fingerprints with 1024 features for 841 molecules
Trial 2717: 5-fold CV loss = 0.4853
[I 2025-08-08 02:02:30,987] Trial 2717 finished with value: 0.4853258430957794 and parameters: {'fp_type': 'morgan_rdkit', 'combined_morgan_radius': 3, 'combined_morgan_nBits': 1024, 'combined_rdkit_maxPath': 7, 'combined_rdkit_nBits': 1024, 'num_hidden_layers': 3, 'hidden_dim_0': 256, 'hidden_dim_1': 1024, 'hidden_dim_2': 64, 'kl_weight': 0.019051617447884497, 'lr': 0.006402618443506039, 'batch_size': 128, 'dropout_rate': 0.13026777335738307, 'prior_mu': -0.030630520270630103, 'prior_sigma': 0.06691017973296579, 'normalization': 'layer'}. Best is trial 896 with value: 0.4533553242683411.
Generating morgan fingerprints...
Generated fingerprints with 1024 features for 841 molecules
Trial 2714: 5-fold CV loss = 0.4931
[I 2025-08-08 02:02:44,825] Trial 2714 finished with value: 0.4930708944797516 and parameters: {'fp_type': 'morgan_rdkit', 'combined_morgan_radius': 3, 'combined_morgan_nBits': 1024, 'combined_rdkit_maxPath': 5, 'combined_rdkit_nBits': 1024, 'num_hidden_layers': 3, 'hidden_dim_0': 256, 'hidden_dim_1': 1024, 'hidden_dim_2': 64, 'kl_weight': 0.0022044748947037084, 'lr': 0.005903393026631351, 'batch_size': 128, 'dropout_rate': 0.13167800131393287, 'prior_mu': -0.03238213080326, 'prior_sigma': 0.0685760664297822, 'normalization': 'layer'}. Best is trial 896 with value: 0.4533553242683411.
Generating morgan fingerprints...
Generated fingerprints with 1024 features for 841 molecules
Trial 2720: 5-fold CV loss = 0.5288
[I 2025-08-08 02:02:54,055] Trial 2720 finished with value: 0.5287989139556885 and parameters: {'fp_type': 'morgan', 'morgan_only_radius': 2, 'morgan_only_nBits': 1024, 'num_hidden_layers': 3, 'hidden_dim_0': 512, 'hidden_dim_1': 1024, 'hidden_dim_2': 64, 'kl_weight': 0.0025122896992289144, 'lr': 0.006659306517028296, 'batch_size': 64, 'dropout_rate': 0.13530514847733124, 'prior_mu': -0.0456412394955347, 'prior_sigma': 0.06719420433565287, 'normalization': 'layer'}. Best is trial 896 with value: 0.4533553242683411.
Generating morgan_rdkit fingerprints...
Generated fingerprints with 2048 features for 841 molecules
Trial 2718: 5-fold CV loss = 0.4710
[I 2025-08-08 02:03:01,083] Trial 2718 finished with value: 0.471036958694458 and parameters: {'fp_type': 'morgan_rdkit', 'combined_morgan_radius': 3, 'combined_morgan_nBits': 1024, 'combined_rdkit_maxPath': 7, 'combined_rdkit_nBits': 1024, 'num_hidden_layers': 3, 'hidden_dim_0': 512, 'hidden_dim_1': 128, 'hidden_dim_2': 64, 'kl_weight': 0.0058672967581202265, 'lr': 0.006446403865225812, 'batch_size': 64, 'dropout_rate': 0.13112713432696432, 'prior_mu': -0.027879867764438303, 'prior_sigma': 0.07129235993790067, 'normalization': 'layer'}. Best is trial 896 with value: 0.4533553242683411.
Generating morgan_rdkit fingerprints...
Generated fingerprints with 1536 features for 841 molecules
Trial 2719: 5-fold CV loss = 0.8124
[I 2025-08-08 02:03:12,086] Trial 2719 finished with value: 0.8123839139938355 and parameters: {'fp_type': 'morgan', 'morgan_only_radius': 2, 'morgan_only_nBits': 1024, 'num_hidden_layers': 3, 'hidden_dim_0': 256, 'hidden_dim_1': 1024, 'hidden_dim_2': 64, 'kl_weight': 0.008133544247089888, 'lr': 0.00044981309719019727, 'batch_size': 64, 'dropout_rate': 0.1325671871592065, 'prior_mu': -0.026754892889148046, 'prior_sigma': 0.06933324970682052, 'normalization': 'layer'}. Best is trial 896 with value: 0.4533553242683411.
Generating morgan_rdkit fingerprints...
Generated fingerprints with 1536 features for 841 molecules
Trial 2722: 5-fold CV loss = 0.4775
[I 2025-08-08 02:03:31,380] Trial 2722 finished with value: 0.47752713561058047 and parameters: {'fp_type': 'morgan_rdkit', 'combined_morgan_radius': 2, 'combined_morgan_nBits': 1024, 'combined_rdkit_maxPath': 7, 'combined_rdkit_nBits': 1024, 'num_hidden_layers': 3, 'hidden_dim_0': 256, 'hidden_dim_1': 1024, 'hidden_dim_2': 64, 'kl_weight': 0.003389125519241717, 'lr': 0.0064896556237797505, 'batch_size': 128, 'dropout_rate': 0.12406818936988023, 'prior_mu': -0.024262912548825073, 'prior_sigma': 0.07107191619715848, 'normalization': 'layer'}. Best is trial 896 with value: 0.4533553242683411.
Generating morgan_rdkit fingerprints...
Generated fingerprints with 1536 features for 841 molecules
Trial 2723: 5-fold CV loss = 0.4964
[I 2025-08-08 02:03:35,389] Trial 2723 finished with value: 0.4964158833026886 and parameters: {'fp_type': 'morgan_rdkit', 'combined_morgan_radius': 3, 'combined_morgan_nBits': 1024, 'combined_rdkit_maxPath': 7, 'combined_rdkit_nBits': 512, 'num_hidden_layers': 3, 'hidden_dim_0': 256, 'hidden_dim_1': 1024, 'hidden_dim_2': 64, 'kl_weight': 0.0010831641129775014, 'lr': 0.006517461445099073, 'batch_size': 128, 'dropout_rate': 0.12708886843989237, 'prior_mu': -0.021656654058337943, 'prior_sigma': 0.07112653115853783, 'normalization': 'layer'}. Best is trial 896 with value: 0.4533553242683411.
Generating morgan_rdkit fingerprints...
Generated fingerprints with 2048 features for 841 molecules
Trial 2724: 5-fold CV loss = 0.5043
[I 2025-08-08 02:04:00,809] Trial 2724 finished with value: 0.5042603552341461 and parameters: {'fp_type': 'morgan_rdkit', 'combined_morgan_radius': 2, 'combined_morgan_nBits': 1024, 'combined_rdkit_maxPath': 7, 'combined_rdkit_nBits': 512, 'num_hidden_layers': 3, 'hidden_dim_0': 256, 'hidden_dim_1': 1024, 'hidden_dim_2': 64, 'kl_weight': 0.0025948878170138933, 'lr': 0.006759989317002809, 'batch_size': 128, 'dropout_rate': 0.12192970403009717, 'prior_mu': -0.042504238591123664, 'prior_sigma': 0.07328038857261587, 'normalization': 'layer'}. Best is trial 896 with value: 0.4533553242683411.
Generating morgan_rdkit fingerprints...
Generated fingerprints with 2048 features for 841 molecules
Trial 2725: 5-fold CV loss = 0.4958
[I 2025-08-08 02:04:05,249] Trial 2725 finished with value: 0.49578569531440736 and parameters: {'fp_type': 'morgan_rdkit', 'combined_morgan_radius': 3, 'combined_morgan_nBits': 1024, 'combined_rdkit_maxPath': 7, 'combined_rdkit_nBits': 512, 'num_hidden_layers': 3, 'hidden_dim_0': 256, 'hidden_dim_1': 1024, 'hidden_dim_2': 64, 'kl_weight': 0.0005360252142634434, 'lr': 0.00677565708288322, 'batch_size': 128, 'dropout_rate': 0.12053766635029577, 'prior_mu': -0.04012671905543066, 'prior_sigma': 0.06766650240085299, 'normalization': 'layer'}. Best is trial 896 with value: 0.4533553242683411.
Generating morgan_rdkit fingerprints...
Generated fingerprints with 2048 features for 841 molecules
Trial 2726: 5-fold CV loss = 0.4806
[I 2025-08-08 02:04:17,154] Trial 2726 finished with value: 0.48062923550605774 and parameters: {'fp_type': 'morgan_rdkit', 'combined_morgan_radius': 3, 'combined_morgan_nBits': 1024, 'combined_rdkit_maxPath': 7, 'combined_rdkit_nBits': 1024, 'num_hidden_layers': 3, 'hidden_dim_0': 256, 'hidden_dim_1': 1024, 'hidden_dim_2': 64, 'kl_weight': 0.011711211148402527, 'lr': 0.006892574430089055, 'batch_size': 128, 'dropout_rate': 0.12073135254859235, 'prior_mu': -0.04334407109236573, 'prior_sigma': 0.07396598114270662, 'normalization': 'layer'}. Best is trial 896 with value: 0.4533553242683411.
Generating morgan_rdkit fingerprints...
Generated fingerprints with 2048 features for 841 molecules
Trial 2721: 5-fold CV loss = 0.5114
[I 2025-08-08 02:04:19,379] Trial 2721 finished with value: 0.5113975942134857 and parameters: {'fp_type': 'morgan', 'morgan_only_radius': 2, 'morgan_only_nBits': 1024, 'num_hidden_layers': 3, 'hidden_dim_0': 512, 'hidden_dim_1': 1024, 'hidden_dim_2': 64, 'kl_weight': 0.0031633588009259733, 'lr': 0.006446523499901888, 'batch_size': 64, 'dropout_rate': 0.3028952086112305, 'prior_mu': -0.025079719116187196, 'prior_sigma': 0.07100637757008707, 'normalization': 'layer'}. Best is trial 896 with value: 0.4533553242683411.
Generating morgan_rdkit fingerprints...
Generated fingerprints with 2048 features for 841 molecules
Trial 2728: 5-fold CV loss = 0.4834
[I 2025-08-08 02:04:42,526] Trial 2728 finished with value: 0.4833504557609558 and parameters: {'fp_type': 'morgan_rdkit', 'combined_morgan_radius': 3, 'combined_morgan_nBits': 1024, 'combined_rdkit_maxPath': 7, 'combined_rdkit_nBits': 1024, 'num_hidden_layers': 3, 'hidden_dim_0': 256, 'hidden_dim_1': 1024, 'hidden_dim_2': 64, 'kl_weight': 0.010104808783115503, 'lr': 0.005980678157718777, 'batch_size': 128, 'dropout_rate': 0.14114516366012647, 'prior_mu': -0.04339527400653981, 'prior_sigma': 0.0729590025465476, 'normalization': 'layer'}. Best is trial 896 with value: 0.4533553242683411.
Generating morgan_rdkit fingerprints...
Generated fingerprints with 2048 features for 841 molecules
Trial 2727: 5-fold CV loss = 0.4672
[I 2025-08-08 02:04:55,040] Trial 2727 finished with value: 0.467181921005249 and parameters: {'fp_type': 'morgan_rdkit', 'combined_morgan_radius': 3, 'combined_morgan_nBits': 1024, 'combined_rdkit_maxPath': 7, 'combined_rdkit_nBits': 1024, 'num_hidden_layers': 3, 'hidden_dim_0': 256, 'hidden_dim_1': 1024, 'hidden_dim_2': 64, 'kl_weight': 0.001723979186951558, 'lr': 0.00569278451503612, 'batch_size': 128, 'dropout_rate': 0.12204849491892772, 'prior_mu': -0.04076974618390404, 'prior_sigma': 0.06352344075944577, 'normalization': 'layer'}. Best is trial 896 with value: 0.4533553242683411.
Generating morgan_rdkit fingerprints...
Generated fingerprints with 2048 features for 841 molecules
Trial 2729: 5-fold CV loss = 0.4693
[I 2025-08-08 02:05:03,602] Trial 2729 finished with value: 0.4693432033061981 and parameters: {'fp_type': 'morgan_rdkit', 'combined_morgan_radius': 3, 'combined_morgan_nBits': 1024, 'combined_rdkit_maxPath': 7, 'combined_rdkit_nBits': 1024, 'num_hidden_layers': 3, 'hidden_dim_0': 256, 'hidden_dim_1': 1024, 'hidden_dim_2': 64, 'kl_weight': 0.0015436202136825505, 'lr': 0.005662503083354658, 'batch_size': 128, 'dropout_rate': 0.31552564923747417, 'prior_mu': -0.03620106936314103, 'prior_sigma': 0.06481149895323597, 'normalization': 'layer'}. Best is trial 896 with value: 0.4533553242683411.
Generating morgan_rdkit fingerprints...
Generated fingerprints with 2048 features for 841 molecules
Trial 2731: 5-fold CV loss = 0.4780
[I 2025-08-08 02:05:21,552] Trial 2731 finished with value: 0.4780374109745026 and parameters: {'fp_type': 'morgan_rdkit', 'combined_morgan_radius': 3, 'combined_morgan_nBits': 1024, 'combined_rdkit_maxPath': 7, 'combined_rdkit_nBits': 1024, 'num_hidden_layers': 3, 'hidden_dim_0': 1024, 'hidden_dim_1': 1024, 'hidden_dim_2': 64, 'kl_weight': 0.016920917017470543, 'lr': 0.005693120889717686, 'batch_size': 128, 'dropout_rate': 0.11647998085776161, 'prior_mu': -0.03297877524662332, 'prior_sigma': 0.07516160608251407, 'normalization': 'layer'}. Best is trial 896 with value: 0.4533553242683411.
Generating morgan_rdkit fingerprints...
Generated fingerprints with 1536 features for 841 molecules
Trial 2733: 5-fold CV loss = 0.4625
[I 2025-08-08 02:05:43,647] Trial 2733 finished with value: 0.4624974727630615 and parameters: {'fp_type': 'morgan_rdkit', 'combined_morgan_radius': 3, 'combined_morgan_nBits': 1024, 'combined_rdkit_maxPath': 7, 'combined_rdkit_nBits': 1024, 'num_hidden_layers': 3, 'hidden_dim_0': 1024, 'hidden_dim_1': 1024, 'hidden_dim_2': 64, 'kl_weight': 0.0009533273942114419, 'lr': 0.006999146283778417, 'batch_size': 128, 'dropout_rate': 0.14104688554542627, 'prior_mu': -0.018616666468845085, 'prior_sigma': 0.07492489921577544, 'normalization': 'layer'}. Best is trial 896 with value: 0.4533553242683411.
Generating morgan_rdkit fingerprints...
Generated fingerprints with 1536 features for 841 molecules
Trial 2732: 5-fold CV loss = 0.4649
[I 2025-08-08 02:05:47,598] Trial 2732 finished with value: 0.4648918092250824 and parameters: {'fp_type': 'morgan_rdkit', 'combined_morgan_radius': 3, 'combined_morgan_nBits': 1024, 'combined_rdkit_maxPath': 7, 'combined_rdkit_nBits': 1024, 'num_hidden_layers': 3, 'hidden_dim_0': 1024, 'hidden_dim_1': 1024, 'hidden_dim_2': 64, 'kl_weight': 0.0007377938544917427, 'lr': 0.006937590608763281, 'batch_size': 128, 'dropout_rate': 0.1403284898646003, 'prior_mu': -0.019291009504456114, 'prior_sigma': 0.07766578471092729, 'normalization': 'layer'}. Best is trial 896 with value: 0.4533553242683411.
Generating morgan_rdkit fingerprints...
Generated fingerprints with 768 features for 841 molecules
Trial 2730: 5-fold CV loss = 0.4706
[I 2025-08-08 02:05:52,116] Trial 2730 finished with value: 0.47061869502067566 and parameters: {'fp_type': 'morgan_rdkit', 'combined_morgan_radius': 3, 'combined_morgan_nBits': 1024, 'combined_rdkit_maxPath': 7, 'combined_rdkit_nBits': 1024, 'num_hidden_layers': 3, 'hidden_dim_0': 256, 'hidden_dim_1': 1024, 'hidden_dim_2': 64, 'kl_weight': 0.003708354676038056, 'lr': 0.005993255960036333, 'batch_size': 128, 'dropout_rate': 0.1399339630885489, 'prior_mu': -0.03576086704643789, 'prior_sigma': 0.07560806789331657, 'normalization': 'layer'}. Best is trial 896 with value: 0.4533553242683411.
Generating morgan_rdkit fingerprints...
Generated fingerprints with 1536 features for 841 molecules
Trial 2734: 5-fold CV loss = 0.5602
[I 2025-08-08 02:06:02,971] Trial 2734 finished with value: 0.5602014124393463 and parameters: {'fp_type': 'morgan_rdkit', 'combined_morgan_radius': 3, 'combined_morgan_nBits': 512, 'combined_rdkit_maxPath': 7, 'combined_rdkit_nBits': 1024, 'num_hidden_layers': 3, 'hidden_dim_0': 256, 'hidden_dim_1': 1024, 'hidden_dim_2': 256, 'kl_weight': 0.0009017571470429795, 'lr': 0.006920714983873284, 'batch_size': 128, 'dropout_rate': 0.14163999192017013, 'prior_mu': -0.018407018338304115, 'prior_sigma': 0.07474247702050467, 'normalization': 'layer'}. Best is trial 896 with value: 0.4533553242683411.
Generating morgan_rdkit fingerprints...
Generated fingerprints with 2048 features for 841 molecules
Trial 2735: 5-fold CV loss = 0.4644
[I 2025-08-08 02:06:27,495] Trial 2735 finished with value: 0.46441901922225953 and parameters: {'fp_type': 'morgan_rdkit', 'combined_morgan_radius': 3, 'combined_morgan_nBits': 512, 'combined_rdkit_maxPath': 7, 'combined_rdkit_nBits': 1024, 'num_hidden_layers': 3, 'hidden_dim_0': 256, 'hidden_dim_1': 1024, 'hidden_dim_2': 64, 'kl_weight': 0.0003224290344195946, 'lr': 0.007106018844546087, 'batch_size': 128, 'dropout_rate': 0.1289044283551971, 'prior_mu': -0.049408071022985514, 'prior_sigma': 0.06868863566573066, 'normalization': 'layer'}. Best is trial 896 with value: 0.4533553242683411.
Generating morgan_rdkit fingerprints...
Generated fingerprints with 1280 features for 841 molecules
Trial 2738: 5-fold CV loss = 0.7008
[I 2025-08-08 02:06:32,618] Trial 2738 finished with value: 0.700812578201294 and parameters: {'fp_type': 'morgan_rdkit', 'combined_morgan_radius': 3, 'combined_morgan_nBits': 1024, 'combined_rdkit_maxPath': 7, 'combined_rdkit_nBits': 1024, 'num_hidden_layers': 2, 'hidden_dim_0': 256, 'hidden_dim_1': 1024, 'kl_weight': 0.0014273336149208957, 'lr': 0.0073583236503892945, 'batch_size': 128, 'dropout_rate': 0.12915302510235496, 'prior_mu': -0.04892031411265496, 'prior_sigma': 0.06828579687571416, 'normalization': 'none'}. Best is trial 896 with value: 0.4533553242683411.
Generating morgan_rdkit fingerprints...
Generated fingerprints with 1280 features for 841 molecules
Trial 2737: 5-fold CV loss = 0.7266
[I 2025-08-08 02:06:42,805] Trial 2737 finished with value: 0.7265756607055665 and parameters: {'fp_type': 'morgan_rdkit', 'combined_morgan_radius': 3, 'combined_morgan_nBits': 512, 'combined_rdkit_maxPath': 7, 'combined_rdkit_nBits': 1024, 'num_hidden_layers': 2, 'hidden_dim_0': 256, 'hidden_dim_1': 1024, 'kl_weight': 0.0015600547135271431, 'lr': 0.007066190637205338, 'batch_size': 128, 'dropout_rate': 0.11361012188692514, 'prior_mu': -0.050297917860338964, 'prior_sigma': 0.06932354037608826, 'normalization': 'none'}. Best is trial 896 with value: 0.4533553242683411.
Generating morgan_rdkit fingerprints...
Generated fingerprints with 1280 features for 841 molecules
Trial 2736: 5-fold CV loss = 0.5772
[I 2025-08-08 02:06:44,891] Trial 2736 finished with value: 0.5771680176258087 and parameters: {'fp_type': 'morgan_rdkit', 'combined_morgan_radius': 3, 'combined_morgan_nBits': 512, 'combined_rdkit_maxPath': 7, 'combined_rdkit_nBits': 256, 'num_hidden_layers': 3, 'hidden_dim_0': 256, 'hidden_dim_1': 1024, 'hidden_dim_2': 256, 'kl_weight': 0.00032459299240639666, 'lr': 0.006233168105524804, 'batch_size': 128, 'dropout_rate': 0.13437335056439673, 'prior_mu': -0.05271190432489585, 'prior_sigma': 0.06880110362868276, 'normalization': 'none'}. Best is trial 896 with value: 0.4533553242683411.
Generating morgan_rdkit fingerprints...
Generated fingerprints with 2048 features for 841 molecules
Trial 2739: 5-fold CV loss = 0.5948
[I 2025-08-08 02:06:56,851] Trial 2739 finished with value: 0.5948215961456299 and parameters: {'fp_type': 'morgan_rdkit', 'combined_morgan_radius': 3, 'combined_morgan_nBits': 1024, 'combined_rdkit_maxPath': 7, 'combined_rdkit_nBits': 256, 'num_hidden_layers': 3, 'hidden_dim_0': 256, 'hidden_dim_1': 1024, 'hidden_dim_2': 64, 'kl_weight': 0.0006448404515321046, 'lr': 0.006331378181631456, 'batch_size': 128, 'dropout_rate': 0.11313962548965636, 'prior_mu': -0.02895974195509335, 'prior_sigma': 0.07240451955637878, 'normalization': 'layer'}. Best is trial 896 with value: 0.4533553242683411.
Generating morgan_rdkit fingerprints...
Generated fingerprints with 2048 features for 841 molecules
Trial 2740: 5-fold CV loss = 0.5164
[I 2025-08-08 02:06:59,590] Trial 2740 finished with value: 0.5164404094219208 and parameters: {'fp_type': 'morgan_rdkit', 'combined_morgan_radius': 3, 'combined_morgan_nBits': 1024, 'combined_rdkit_maxPath': 7, 'combined_rdkit_nBits': 256, 'num_hidden_layers': 3, 'hidden_dim_0': 256, 'hidden_dim_1': 1024, 'hidden_dim_2': 64, 'kl_weight': 0.0018846726620496059, 'lr': 0.006269286517299266, 'batch_size': 128, 'dropout_rate': 0.11606333039520965, 'prior_mu': -0.026750179298665126, 'prior_sigma': 0.07248907440581032, 'normalization': 'layer'}. Best is trial 896 with value: 0.4533553242683411.
Generating morgan_rdkit fingerprints...
Generated fingerprints with 2048 features for 841 molecules
Trial 2744: 5-fold CV loss = 0.5397
[I 2025-08-08 02:07:31,256] Trial 2744 finished with value: 0.5396805524826049 and parameters: {'fp_type': 'morgan_rdkit', 'combined_morgan_radius': 3, 'combined_morgan_nBits': 1024, 'combined_rdkit_maxPath': 7, 'combined_rdkit_nBits': 1024, 'num_hidden_layers': 3, 'hidden_dim_0': 256, 'hidden_dim_1': 256, 'hidden_dim_2': 64, 'kl_weight': 0.0030073728599390305, 'lr': 0.005751187696435285, 'batch_size': 128, 'dropout_rate': 0.12897184973842238, 'prior_mu': -0.022745092742883333, 'prior_sigma': 0.07814431734925943, 'normalization': 'layer'}. Best is trial 896 with value: 0.4533553242683411.
Generating morgan_rdkit fingerprints...
Generated fingerprints with 2048 features for 841 molecules
Trial 2743: 5-fold CV loss = 0.5590
[I 2025-08-08 02:07:34,819] Trial 2743 finished with value: 0.5589657008647919 and parameters: {'fp_type': 'morgan_rdkit', 'combined_morgan_radius': 3, 'combined_morgan_nBits': 1024, 'combined_rdkit_maxPath': 7, 'combined_rdkit_nBits': 1024, 'num_hidden_layers': 3, 'hidden_dim_0': 256, 'hidden_dim_1': 256, 'hidden_dim_2': 64, 'kl_weight': 0.0004135776558942242, 'lr': 0.0058209459345863815, 'batch_size': 128, 'dropout_rate': 0.12038912356448729, 'prior_mu': -0.02668417441141536, 'prior_sigma': 0.0751206132066092, 'normalization': 'layer'}. Best is trial 896 with value: 0.4533553242683411.
Generating morgan_rdkit fingerprints...
Generated fingerprints with 2048 features for 841 molecules
Trial 2742: 5-fold CV loss = 0.4631
[I 2025-08-08 02:07:38,180] Trial 2742 finished with value: 0.4630758464336395 and parameters: {'fp_type': 'morgan_rdkit', 'combined_morgan_radius': 3, 'combined_morgan_nBits': 1024, 'combined_rdkit_maxPath': 7, 'combined_rdkit_nBits': 1024, 'num_hidden_layers': 3, 'hidden_dim_0': 256, 'hidden_dim_1': 1024, 'hidden_dim_2': 64, 'kl_weight': 0.0002919388588438552, 'lr': 0.0064319943425117775, 'batch_size': 128, 'dropout_rate': 0.11864765180494742, 'prior_mu': -0.02626169115906277, 'prior_sigma': 0.07760261614992212, 'normalization': 'layer'}. Best is trial 896 with value: 0.4533553242683411.
Generating morgan_rdkit fingerprints...
Generated fingerprints with 2048 features for 841 molecules
Trial 2741: 5-fold CV loss = 0.5230
[I 2025-08-08 02:07:57,639] Trial 2741 finished with value: 0.5229850292205811 and parameters: {'fp_type': 'morgan_rdkit', 'combined_morgan_radius': 3, 'combined_morgan_nBits': 1024, 'combined_rdkit_maxPath': 7, 'combined_rdkit_nBits': 256, 'num_hidden_layers': 3, 'hidden_dim_0': 256, 'hidden_dim_1': 1024, 'hidden_dim_2': 64, 'kl_weight': 0.006344232119194651, 'lr': 0.006211681440323098, 'batch_size': 128, 'dropout_rate': 0.1213230042293438, 'prior_mu': -0.021446118127541422, 'prior_sigma': 0.0780031211028481, 'normalization': 'layer'}. Best is trial 896 with value: 0.4533553242683411.
Generating morgan_rdkit fingerprints...
Generated fingerprints with 2048 features for 841 molecules
Trial 2745: 5-fold CV loss = 0.5060
