[I 2025-08-07 21:10:44,893] Trial 1246 finished with value: 0.5564265251159668 and parameters: {'fp_type': 'morgan_rdkit', 'combined_morgan_radius': 3, 'combined_morgan_nBits': 1024, 'combined_rdkit_maxPath': 7, 'combined_rdkit_nBits': 1024, 'num_hidden_layers': 3, 'hidden_dim_0': 256, 'hidden_dim_1': 1024, 'hidden_dim_2': 64, 'kl_weight': 0.00040237463775924303, 'lr': 0.005482325037871589, 'batch_size': 128, 'dropout_rate': 0.1198756662466586, 'prior_mu': -0.038869362348072554, 'prior_sigma': 0.1086269344293831, 'normalization': 'layer'}. Best is trial 896 with value: 0.4533553242683411.
Generating morgan_rdkit fingerprints...
Generated fingerprints with 2048 features for 841 molecules
Trial 1244: 5-fold CV loss = 0.4836
[I 2025-08-07 21:11:09,748] Trial 1244 finished with value: 0.48357104063034057 and parameters: {'fp_type': 'morgan_rdkit', 'combined_morgan_radius': 3, 'combined_morgan_nBits': 1024, 'combined_rdkit_maxPath': 7, 'combined_rdkit_nBits': 1024, 'num_hidden_layers': 3, 'hidden_dim_0': 256, 'hidden_dim_1': 1024, 'hidden_dim_2': 64, 'kl_weight': 0.03095882989684517, 'lr': 0.006997161054869579, 'batch_size': 128, 'dropout_rate': 0.1117575887140442, 'prior_mu': 0.008201861363956838, 'prior_sigma': 0.109475830472895, 'normalization': 'layer'}. Best is trial 896 with value: 0.4533553242683411.
Generating morgan_rdkit fingerprints...
Generated fingerprints with 2048 features for 841 molecules
Trial 1247: 5-fold CV loss = 0.4664
[I 2025-08-07 21:11:14,854] Trial 1247 finished with value: 0.4663786470890045 and parameters: {'fp_type': 'morgan_rdkit', 'combined_morgan_radius': 3, 'combined_morgan_nBits': 1024, 'combined_rdkit_maxPath': 7, 'combined_rdkit_nBits': 1024, 'num_hidden_layers': 3, 'hidden_dim_0': 1024, 'hidden_dim_1': 1024, 'hidden_dim_2': 64, 'kl_weight': 0.00039889497535904457, 'lr': 0.005371402420329968, 'batch_size': 128, 'dropout_rate': 0.1270339510656644, 'prior_mu': -0.03866595965624538, 'prior_sigma': 0.09033967803079354, 'normalization': 'layer'}. Best is trial 896 with value: 0.4533553242683411.
Generating morgan_rdkit fingerprints...
Generated fingerprints with 2048 features for 841 molecules
Trial 1248: 5-fold CV loss = 0.4578
[I 2025-08-07 21:11:19,895] Trial 1248 finished with value: 0.45779054164886473 and parameters: {'fp_type': 'morgan_rdkit', 'combined_morgan_radius': 3, 'combined_morgan_nBits': 1024, 'combined_rdkit_maxPath': 7, 'combined_rdkit_nBits': 1024, 'num_hidden_layers': 3, 'hidden_dim_0': 1024, 'hidden_dim_1': 1024, 'hidden_dim_2': 64, 'kl_weight': 0.0004166068329931926, 'lr': 0.009531904852642282, 'batch_size': 128, 'dropout_rate': 0.12599840186404665, 'prior_mu': -0.03875831679034142, 'prior_sigma': 0.09035992377633796, 'normalization': 'layer'}. Best is trial 896 with value: 0.4533553242683411.
Generating morgan fingerprints...
Generated fingerprints with 2048 features for 841 molecules
Trial 1249: 5-fold CV loss = 0.4732
[I 2025-08-07 21:11:26,463] Trial 1249 finished with value: 0.4732419908046722 and parameters: {'fp_type': 'morgan_rdkit', 'combined_morgan_radius': 3, 'combined_morgan_nBits': 1024, 'combined_rdkit_maxPath': 7, 'combined_rdkit_nBits': 1024, 'num_hidden_layers': 3, 'hidden_dim_0': 1024, 'hidden_dim_1': 1024, 'hidden_dim_2': 64, 'kl_weight': 0.021085874460582948, 'lr': 0.006522024868205499, 'batch_size': 128, 'dropout_rate': 0.12817396872116957, 'prior_mu': -0.0016223839175939, 'prior_sigma': 0.08991418959942417, 'normalization': 'layer'}. Best is trial 896 with value: 0.4533553242683411.
Generating morgan fingerprints...
Generated fingerprints with 2048 features for 841 molecules
Trial 1252: 5-fold CV loss = 0.5278
[I 2025-08-07 21:11:40,534] Trial 1252 finished with value: 0.5277744770050049 and parameters: {'fp_type': 'morgan', 'morgan_only_radius': 3, 'morgan_only_nBits': 2048, 'num_hidden_layers': 3, 'hidden_dim_0': 1024, 'hidden_dim_1': 1024, 'hidden_dim_2': 64, 'kl_weight': 0.00022092484561342238, 'lr': 0.009507031898042329, 'batch_size': 128, 'dropout_rate': 0.1514783217727062, 'prior_mu': -0.025933135931994564, 'prior_sigma': 0.09001499009602701, 'normalization': 'layer'}. Best is trial 896 with value: 0.4533553242683411.
Generating morgan_rdkit fingerprints...
Generated fingerprints with 2048 features for 841 molecules
Trial 1253: 5-fold CV loss = 0.5264
[I 2025-08-07 21:11:45,126] Trial 1253 finished with value: 0.5263737201690674 and parameters: {'fp_type': 'morgan', 'morgan_only_radius': 3, 'morgan_only_nBits': 2048, 'num_hidden_layers': 3, 'hidden_dim_0': 1024, 'hidden_dim_1': 1024, 'hidden_dim_2': 64, 'kl_weight': 0.00022783167287517263, 'lr': 0.009628675290249852, 'batch_size': 128, 'dropout_rate': 0.15281590477991688, 'prior_mu': -0.026897087834895743, 'prior_sigma': 0.08565322426226857, 'normalization': 'layer'}. Best is trial 896 with value: 0.4533553242683411.
Generating morgan_rdkit fingerprints...
Generated fingerprints with 2048 features for 841 molecules
Trial 1255: 5-fold CV loss = 1.1151
[I 2025-08-07 21:11:51,628] Trial 1255 finished with value: 1.115074872970581 and parameters: {'fp_type': 'morgan_rdkit', 'combined_morgan_radius': 3, 'combined_morgan_nBits': 1024, 'combined_rdkit_maxPath': 5, 'combined_rdkit_nBits': 1024, 'num_hidden_layers': 0, 'kl_weight': 0.0002653400662352953, 'lr': 0.00928194238758766, 'batch_size': 128, 'dropout_rate': 0.14466291739024872, 'prior_mu': -0.008561874356171565, 'prior_sigma': 0.09238905131403573, 'normalization': 'layer'}. Best is trial 896 with value: 0.4533553242683411.
Generating morgan_rdkit fingerprints...
Generated fingerprints with 2048 features for 841 molecules
Trial 1254: 5-fold CV loss = 0.4846
[I 2025-08-07 21:12:13,092] Trial 1254 finished with value: 0.4845799088478088 and parameters: {'fp_type': 'morgan_rdkit', 'combined_morgan_radius': 3, 'combined_morgan_nBits': 1024, 'combined_rdkit_maxPath': 5, 'combined_rdkit_nBits': 1024, 'num_hidden_layers': 3, 'hidden_dim_0': 1024, 'hidden_dim_1': 1024, 'hidden_dim_2': 64, 'kl_weight': 0.0005445722493985304, 'lr': 0.00977393568887884, 'batch_size': 128, 'dropout_rate': 0.14633872631430508, 'prior_mu': -0.009433267086621474, 'prior_sigma': 0.08603333193491597, 'normalization': 'layer'}. Best is trial 896 with value: 0.4533553242683411.
Generating morgan_rdkit fingerprints...
Generated fingerprints with 2048 features for 841 molecules
Trial 1251: 5-fold CV loss = 0.4703
[I 2025-08-07 21:12:14,161] Trial 1251 finished with value: 0.4703166902065277 and parameters: {'fp_type': 'morgan_rdkit', 'combined_morgan_radius': 3, 'combined_morgan_nBits': 1024, 'combined_rdkit_maxPath': 7, 'combined_rdkit_nBits': 1024, 'num_hidden_layers': 3, 'hidden_dim_0': 256, 'hidden_dim_1': 1024, 'hidden_dim_2': 64, 'kl_weight': 0.0002582750599361277, 'lr': 0.009915979343417397, 'batch_size': 128, 'dropout_rate': 0.08827034006742306, 'prior_mu': -0.000857538509443893, 'prior_sigma': 0.11640370425818992, 'normalization': 'layer'}. Best is trial 896 with value: 0.4533553242683411.
Generating morgan_rdkit fingerprints...
Generated fingerprints with 2048 features for 841 molecules
Trial 1256: 5-fold CV loss = 0.7051
[I 2025-08-07 21:12:29,053] Trial 1256 finished with value: 0.7050610661506653 and parameters: {'fp_type': 'morgan_rdkit', 'combined_morgan_radius': 3, 'combined_morgan_nBits': 1024, 'combined_rdkit_maxPath': 7, 'combined_rdkit_nBits': 1024, 'num_hidden_layers': 3, 'hidden_dim_0': 1024, 'hidden_dim_1': 1024, 'hidden_dim_2': 64, 'kl_weight': 0.000564160848962622, 'lr': 0.00932696203723227, 'batch_size': 128, 'dropout_rate': 0.14003710298369093, 'prior_mu': -0.020045785989661818, 'prior_sigma': 0.08363950196655585, 'normalization': 'none'}. Best is trial 896 with value: 0.4533553242683411.
Generating rdkit fingerprints...
Generated fingerprints with 256 features for 841 molecules
Trial 1250: 5-fold CV loss = 0.4589
[I 2025-08-07 21:12:34,945] Trial 1250 finished with value: 0.45886296033859253 and parameters: {'fp_type': 'morgan_rdkit', 'combined_morgan_radius': 3, 'combined_morgan_nBits': 1024, 'combined_rdkit_maxPath': 7, 'combined_rdkit_nBits': 1024, 'num_hidden_layers': 3, 'hidden_dim_0': 1024, 'hidden_dim_1': 1024, 'hidden_dim_2': 64, 'kl_weight': 0.00026087938049033156, 'lr': 0.006469345153165362, 'batch_size': 128, 'dropout_rate': 0.09150262518316125, 'prior_mu': -0.0025528097747278336, 'prior_sigma': 0.07790077362116475, 'normalization': 'layer'}. Best is trial 896 with value: 0.4533553242683411.
Generating rdkit fingerprints...
Generated fingerprints with 256 features for 841 molecules
Trial 1258: 5-fold CV loss = 0.8501
[I 2025-08-07 21:12:51,320] Trial 1258 finished with value: 0.8501179158687592 and parameters: {'fp_type': 'morgan_rdkit', 'combined_morgan_radius': 3, 'combined_morgan_nBits': 1024, 'combined_rdkit_maxPath': 7, 'combined_rdkit_nBits': 1024, 'num_hidden_layers': 3, 'hidden_dim_0': 1024, 'hidden_dim_1': 1024, 'hidden_dim_2': 64, 'kl_weight': 0.00044763271292708943, 'lr': 0.009942374237654773, 'batch_size': 128, 'dropout_rate': 0.13390478550016444, 'prior_mu': -0.019017774885501697, 'prior_sigma': 0.0843209283599473, 'normalization': 'none'}. Best is trial 896 with value: 0.4533553242683411.
Generating rdkit fingerprints...
Generated fingerprints with 256 features for 841 molecules
Trial 1259: 5-fold CV loss = 0.8870
[I 2025-08-07 21:12:54,778] Trial 1259 finished with value: 0.886993670463562 and parameters: {'fp_type': 'rdkit', 'rdkit_only_maxPath': 8, 'rdkit_only_nBits': 256, 'num_hidden_layers': 1, 'hidden_dim_0': 1024, 'kl_weight': 0.0004495082537605813, 'lr': 0.008961935138425393, 'batch_size': 64, 'dropout_rate': 0.13328417341958634, 'prior_mu': -0.03336025461683048, 'prior_sigma': 0.09163673518764165, 'normalization': 'layer'}. Best is trial 896 with value: 0.4533553242683411.
Generating morgan_rdkit fingerprints...
Generated fingerprints with 1280 features for 841 molecules
Trial 1257: 5-fold CV loss = 0.5951
[I 2025-08-07 21:13:06,599] Trial 1257 finished with value: 0.595140951871872 and parameters: {'fp_type': 'morgan_rdkit', 'combined_morgan_radius': 3, 'combined_morgan_nBits': 1024, 'combined_rdkit_maxPath': 7, 'combined_rdkit_nBits': 1024, 'num_hidden_layers': 3, 'hidden_dim_0': 512, 'hidden_dim_1': 1024, 'hidden_dim_2': 64, 'kl_weight': 0.00029737646949757804, 'lr': 0.009952718564553395, 'batch_size': 128, 'dropout_rate': 0.15896413938514223, 'prior_mu': -0.02061028900337669, 'prior_sigma': 0.0899045207384582, 'normalization': 'none'}. Best is trial 896 with value: 0.4533553242683411.
Generating morgan_rdkit fingerprints...
Generated fingerprints with 1536 features for 841 molecules
Trial 1262: 5-fold CV loss = 0.6708
[I 2025-08-07 21:13:20,094] Trial 1262 finished with value: 0.6707816302776337 and parameters: {'fp_type': 'morgan_rdkit', 'combined_morgan_radius': 3, 'combined_morgan_nBits': 1024, 'combined_rdkit_maxPath': 7, 'combined_rdkit_nBits': 256, 'num_hidden_layers': 3, 'hidden_dim_0': 1024, 'hidden_dim_1': 1024, 'hidden_dim_2': 64, 'kl_weight': 0.00021926814800133073, 'lr': 0.008822477313483528, 'batch_size': 128, 'dropout_rate': 0.08207662962781298, 'prior_mu': 0.01046811756141059, 'prior_sigma': 0.18073262705559162, 'normalization': 'layer'}. Best is trial 896 with value: 0.4533553242683411.
Generating morgan_rdkit fingerprints...
Generated fingerprints with 1536 features for 841 molecules
Trial 1260: 5-fold CV loss = 0.8878
[I 2025-08-07 21:13:21,703] Trial 1260 finished with value: 0.8878005504608154 and parameters: {'fp_type': 'rdkit', 'rdkit_only_maxPath': 8, 'rdkit_only_nBits': 256, 'num_hidden_layers': 3, 'hidden_dim_0': 128, 'hidden_dim_1': 1024, 'hidden_dim_2': 64, 'kl_weight': 0.00022273949900094886, 'lr': 0.008647319359925288, 'batch_size': 64, 'dropout_rate': 0.08789900142638118, 'prior_mu': 0.0217308497258833, 'prior_sigma': 0.08103420372743061, 'normalization': 'layer'}. Best is trial 896 with value: 0.4533553242683411.
Generating morgan_rdkit fingerprints...
Generated fingerprints with 1536 features for 841 molecules
Trial 1261: 5-fold CV loss = 0.8879
[I 2025-08-07 21:13:28,529] Trial 1261 finished with value: 0.8878612041473388 and parameters: {'fp_type': 'rdkit', 'rdkit_only_maxPath': 8, 'rdkit_only_nBits': 256, 'num_hidden_layers': 3, 'hidden_dim_0': 1024, 'hidden_dim_1': 1024, 'hidden_dim_2': 64, 'kl_weight': 0.00019377270611429045, 'lr': 0.008728991242323224, 'batch_size': 64, 'dropout_rate': 0.09309609330890921, 'prior_mu': 0.023197198023311508, 'prior_sigma': 0.07990077769009488, 'normalization': 'layer'}. Best is trial 896 with value: 0.4533553242683411.
Generating morgan_rdkit fingerprints...
Generated fingerprints with 1536 features for 841 molecules
Trial 1263: 5-fold CV loss = 0.4958
[I 2025-08-07 21:13:50,394] Trial 1263 finished with value: 0.49583327770233154 and parameters: {'fp_type': 'morgan_rdkit', 'combined_morgan_radius': 3, 'combined_morgan_nBits': 1024, 'combined_rdkit_maxPath': 7, 'combined_rdkit_nBits': 512, 'num_hidden_layers': 3, 'hidden_dim_0': 1024, 'hidden_dim_1': 1024, 'hidden_dim_2': 64, 'kl_weight': 0.00019763128011565122, 'lr': 0.008751902983053826, 'batch_size': 128, 'dropout_rate': 0.08376982849126413, 'prior_mu': 0.01650336920387804, 'prior_sigma': 0.0789787746006097, 'normalization': 'layer'}. Best is trial 896 with value: 0.4533553242683411.
Generating morgan_rdkit fingerprints...
Generated fingerprints with 2048 features for 841 molecules
Trial 1264: 5-fold CV loss = 0.4933
[I 2025-08-07 21:13:55,445] Trial 1264 finished with value: 0.49332948923110964 and parameters: {'fp_type': 'morgan_rdkit', 'combined_morgan_radius': 3, 'combined_morgan_nBits': 1024, 'combined_rdkit_maxPath': 7, 'combined_rdkit_nBits': 512, 'num_hidden_layers': 3, 'hidden_dim_0': 1024, 'hidden_dim_1': 1024, 'hidden_dim_2': 64, 'kl_weight': 0.00019524857270270852, 'lr': 0.008368615661742353, 'batch_size': 128, 'dropout_rate': 0.08551561348080437, 'prior_mu': 0.01816727057288712, 'prior_sigma': 0.08347682013464013, 'normalization': 'layer'}. Best is trial 896 with value: 0.4533553242683411.
Generating morgan_rdkit fingerprints...
Generated fingerprints with 2048 features for 841 molecules
Trial 1266: 5-fold CV loss = 0.5100
[I 2025-08-07 21:14:23,731] Trial 1266 finished with value: 0.5099942564964295 and parameters: {'fp_type': 'morgan_rdkit', 'combined_morgan_radius': 3, 'combined_morgan_nBits': 1024, 'combined_rdkit_maxPath': 7, 'combined_rdkit_nBits': 512, 'num_hidden_layers': 3, 'hidden_dim_0': 1024, 'hidden_dim_1': 1024, 'hidden_dim_2': 128, 'kl_weight': 0.0002517817291353431, 'lr': 0.008255182301632958, 'batch_size': 128, 'dropout_rate': 0.0787869315199081, 'prior_mu': 0.0022701100363200534, 'prior_sigma': 0.08567772093402966, 'normalization': 'layer'}. Best is trial 896 with value: 0.4533553242683411.
Generating morgan_rdkit fingerprints...
Generated fingerprints with 2048 features for 841 molecules
Trial 1268: 5-fold CV loss = 0.5456
[I 2025-08-07 21:14:34,256] Trial 1268 finished with value: 0.5455536782741547 and parameters: {'fp_type': 'morgan_rdkit', 'combined_morgan_radius': 3, 'combined_morgan_nBits': 1024, 'combined_rdkit_maxPath': 7, 'combined_rdkit_nBits': 1024, 'num_hidden_layers': 3, 'hidden_dim_0': 1024, 'hidden_dim_1': 1024, 'hidden_dim_2': 128, 'kl_weight': 0.00025259926730527497, 'lr': 0.007872225915456981, 'batch_size': 128, 'dropout_rate': 0.07663367925176007, 'prior_mu': 0.002407437600359677, 'prior_sigma': 0.08858927758687483, 'normalization': 'layer'}. Best is trial 896 with value: 0.4533553242683411.
Generating morgan_rdkit fingerprints...
Generated fingerprints with 2048 features for 841 molecules
Trial 1265: 5-fold CV loss = 0.5748
[I 2025-08-07 21:14:36,704] Trial 1265 finished with value: 0.57476886510849 and parameters: {'fp_type': 'morgan_rdkit', 'combined_morgan_radius': 3, 'combined_morgan_nBits': 1024, 'combined_rdkit_maxPath': 7, 'combined_rdkit_nBits': 512, 'num_hidden_layers': 3, 'hidden_dim_0': 1024, 'hidden_dim_1': 1024, 'hidden_dim_2': 128, 'kl_weight': 0.00018931873451556353, 'lr': 0.008727553424828767, 'batch_size': 128, 'dropout_rate': 0.0873401053876715, 'prior_mu': 0.01519120184684256, 'prior_sigma': 0.07935616315663883, 'normalization': 'layer'}. Best is trial 896 with value: 0.4533553242683411.
Generating morgan_rdkit fingerprints...
Generated fingerprints with 2048 features for 841 molecules
Trial 1267: 5-fold CV loss = 0.4641
[I 2025-08-07 21:14:41,538] Trial 1267 finished with value: 0.4641478359699249 and parameters: {'fp_type': 'morgan_rdkit', 'combined_morgan_radius': 3, 'combined_morgan_nBits': 1024, 'combined_rdkit_maxPath': 7, 'combined_rdkit_nBits': 1024, 'num_hidden_layers': 3, 'hidden_dim_0': 1024, 'hidden_dim_1': 1024, 'hidden_dim_2': 128, 'kl_weight': 0.00024748929252698526, 'lr': 0.007873625028935217, 'batch_size': 128, 'dropout_rate': 0.09526426781190986, 'prior_mu': 0.004495664307904136, 'prior_sigma': 0.08475968377719245, 'normalization': 'layer'}. Best is trial 896 with value: 0.4533553242683411.
Generating morgan_rdkit fingerprints...
Generated fingerprints with 2048 features for 841 molecules
Trial 1270: 5-fold CV loss = 0.7371
[I 2025-08-07 21:15:04,371] Trial 1270 finished with value: 0.7370990633964538 and parameters: {'fp_type': 'morgan_rdkit', 'combined_morgan_radius': 3, 'combined_morgan_nBits': 1024, 'combined_rdkit_maxPath': 7, 'combined_rdkit_nBits': 1024, 'num_hidden_layers': 3, 'hidden_dim_0': 1024, 'hidden_dim_1': 1024, 'hidden_dim_2': 256, 'kl_weight': 0.0002791544884941727, 'lr': 0.007872173491088787, 'batch_size': 128, 'dropout_rate': 0.16272274439141415, 'prior_mu': -0.0033391909712635233, 'prior_sigma': 0.09438451660991795, 'normalization': 'layer'}. Best is trial 896 with value: 0.4533553242683411.
Generating morgan_rdkit fingerprints...
Generated fingerprints with 2048 features for 841 molecules
Trial 1269: 5-fold CV loss = 0.6186
[I 2025-08-07 21:15:09,940] Trial 1269 finished with value: 0.6185738801956177 and parameters: {'fp_type': 'morgan_rdkit', 'combined_morgan_radius': 3, 'combined_morgan_nBits': 1024, 'combined_rdkit_maxPath': 7, 'combined_rdkit_nBits': 1024, 'num_hidden_layers': 3, 'hidden_dim_0': 1024, 'hidden_dim_1': 1024, 'hidden_dim_2': 256, 'kl_weight': 0.00024859650220932617, 'lr': 0.007729085741276956, 'batch_size': 128, 'dropout_rate': 0.09598018606490756, 'prior_mu': -0.0004004582038230949, 'prior_sigma': 0.08830820769261612, 'normalization': 'layer'}. Best is trial 896 with value: 0.4533553242683411.
Generating morgan_rdkit fingerprints...
Generated fingerprints with 2048 features for 841 molecules
Trial 1272: 5-fold CV loss = 0.4623
[I 2025-08-07 21:15:27,918] Trial 1272 finished with value: 0.4622501373291016 and parameters: {'fp_type': 'morgan_rdkit', 'combined_morgan_radius': 3, 'combined_morgan_nBits': 1024, 'combined_rdkit_maxPath': 7, 'combined_rdkit_nBits': 1024, 'num_hidden_layers': 3, 'hidden_dim_0': 1024, 'hidden_dim_1': 1024, 'hidden_dim_2': 64, 'kl_weight': 0.0002957525735791329, 'lr': 0.007835645206323759, 'batch_size': 128, 'dropout_rate': 0.1620281523494639, 'prior_mu': -0.0049770629765857125, 'prior_sigma': 0.09343813127245629, 'normalization': 'layer'}. Best is trial 896 with value: 0.4533553242683411.
Generating morgan_rdkit fingerprints...
Generated fingerprints with 2048 features for 841 molecules
Trial 1273: 5-fold CV loss = 0.4608
[I 2025-08-07 21:15:47,365] Trial 1273 finished with value: 0.4607750475406647 and parameters: {'fp_type': 'morgan_rdkit', 'combined_morgan_radius': 3, 'combined_morgan_nBits': 1024, 'combined_rdkit_maxPath': 7, 'combined_rdkit_nBits': 1024, 'num_hidden_layers': 3, 'hidden_dim_0': 1024, 'hidden_dim_1': 1024, 'hidden_dim_2': 64, 'kl_weight': 0.00030280609003230754, 'lr': 0.007424827175096471, 'batch_size': 128, 'dropout_rate': 0.15074619573990627, 'prior_mu': -0.0051291862162676505, 'prior_sigma': 0.08907465355229785, 'normalization': 'layer'}. Best is trial 896 with value: 0.4533553242683411.
Generating morgan_rdkit fingerprints...
Generated fingerprints with 2048 features for 841 molecules
Trial 1274: 5-fold CV loss = 0.4604
[I 2025-08-07 21:16:07,432] Trial 1274 finished with value: 0.4604206681251526 and parameters: {'fp_type': 'morgan_rdkit', 'combined_morgan_radius': 3, 'combined_morgan_nBits': 1024, 'combined_rdkit_maxPath': 7, 'combined_rdkit_nBits': 1024, 'num_hidden_layers': 3, 'hidden_dim_0': 1024, 'hidden_dim_1': 128, 'hidden_dim_2': 64, 'kl_weight': 0.00028878522457425736, 'lr': 0.0072332017704186706, 'batch_size': 128, 'dropout_rate': 0.06613546077202526, 'prior_mu': -0.00952719473212085, 'prior_sigma': 0.0770427159472431, 'normalization': 'layer'}. Best is trial 896 with value: 0.4533553242683411.
Generating morgan_rdkit fingerprints...
Generated fingerprints with 2048 features for 841 molecules
Trial 1271: 5-fold CV loss = 0.4638
[I 2025-08-07 21:16:08,949] Trial 1271 finished with value: 0.46382023096084596 and parameters: {'fp_type': 'morgan_rdkit', 'combined_morgan_radius': 3, 'combined_morgan_nBits': 1024, 'combined_rdkit_maxPath': 7, 'combined_rdkit_nBits': 1024, 'num_hidden_layers': 3, 'hidden_dim_0': 1024, 'hidden_dim_1': 1024, 'hidden_dim_2': 64, 'kl_weight': 0.00028181934351297565, 'lr': 0.007796111287167134, 'batch_size': 128, 'dropout_rate': 0.16167921830412785, 'prior_mu': -0.0027131386266527773, 'prior_sigma': 0.08888789423264777, 'normalization': 'layer'}. Best is trial 896 with value: 0.4533553242683411.
Generating morgan_rdkit fingerprints...
Generated fingerprints with 2048 features for 841 molecules
Trial 1275: 5-fold CV loss = 0.4642
