[I 2025-08-07 23:22:44,746] Trial 1935 finished with value: 0.6071949779987336 and parameters: {'fp_type': 'rdkit', 'rdkit_only_maxPath': 5, 'rdkit_only_nBits': 512, 'num_hidden_layers': 3, 'hidden_dim_0': 256, 'hidden_dim_1': 64, 'hidden_dim_2': 64, 'kl_weight': 0.000294120442773143, 'lr': 0.0058263517462516555, 'batch_size': 128, 'dropout_rate': 0.1579406615637963, 'prior_mu': 0.0015998532852786566, 'prior_sigma': 0.08116921709782532, 'normalization': 'layer'}. Best is trial 896 with value: 0.4533553242683411.
Generating morgan_rdkit fingerprints...
Generated fingerprints with 2048 features for 841 molecules
Trial 1937: 5-fold CV loss = 0.5100
[I 2025-08-07 23:22:59,159] Trial 1937 finished with value: 0.5100263059139252 and parameters: {'fp_type': 'rdkit', 'rdkit_only_maxPath': 5, 'rdkit_only_nBits': 512, 'num_hidden_layers': 3, 'hidden_dim_0': 256, 'hidden_dim_1': 1024, 'hidden_dim_2': 64, 'kl_weight': 0.0002649121474288227, 'lr': 0.005723649368829785, 'batch_size': 128, 'dropout_rate': 0.15738224315495802, 'prior_mu': -0.01527783015358582, 'prior_sigma': 0.08097868530305373, 'normalization': 'layer'}. Best is trial 896 with value: 0.4533553242683411.
Generating morgan_rdkit fingerprints...
Generated fingerprints with 2048 features for 841 molecules
Trial 1936: 5-fold CV loss = 0.5186
[I 2025-08-07 23:23:00,643] Trial 1936 finished with value: 0.5185840904712677 and parameters: {'fp_type': 'rdkit', 'rdkit_only_maxPath': 5, 'rdkit_only_nBits': 512, 'num_hidden_layers': 3, 'hidden_dim_0': 256, 'hidden_dim_1': 1024, 'hidden_dim_2': 64, 'kl_weight': 0.0002578955440426603, 'lr': 0.009986185524097519, 'batch_size': 128, 'dropout_rate': 0.15518396506362417, 'prior_mu': -0.016542411598427478, 'prior_sigma': 0.07954055765179452, 'normalization': 'layer'}. Best is trial 896 with value: 0.4533553242683411.
Generating morgan_rdkit fingerprints...
Generated fingerprints with 2048 features for 841 molecules
Trial 1939: 5-fold CV loss = 0.4743
[I 2025-08-07 23:23:23,089] Trial 1939 finished with value: 0.4742526710033417 and parameters: {'fp_type': 'morgan_rdkit', 'combined_morgan_radius': 3, 'combined_morgan_nBits': 1024, 'combined_rdkit_maxPath': 7, 'combined_rdkit_nBits': 1024, 'num_hidden_layers': 3, 'hidden_dim_0': 256, 'hidden_dim_1': 1024, 'hidden_dim_2': 64, 'kl_weight': 0.0002564295050445439, 'lr': 0.00995581933141078, 'batch_size': 128, 'dropout_rate': 0.1526457563917711, 'prior_mu': -0.027670434390953645, 'prior_sigma': 0.08071665177007051, 'normalization': 'layer'}. Best is trial 896 with value: 0.4533553242683411.
Generating morgan_rdkit fingerprints...
Generated fingerprints with 2048 features for 841 molecules
Trial 1940: 5-fold CV loss = 0.4600
[I 2025-08-07 23:23:35,811] Trial 1940 finished with value: 0.4599811673164368 and parameters: {'fp_type': 'morgan_rdkit', 'combined_morgan_radius': 3, 'combined_morgan_nBits': 1024, 'combined_rdkit_maxPath': 7, 'combined_rdkit_nBits': 1024, 'num_hidden_layers': 3, 'hidden_dim_0': 256, 'hidden_dim_1': 1024, 'hidden_dim_2': 64, 'kl_weight': 0.00016164591275213348, 'lr': 0.007384915417307332, 'batch_size': 128, 'dropout_rate': 0.20798962209340222, 'prior_mu': -0.025278309291121515, 'prior_sigma': 0.08831458353790075, 'normalization': 'layer'}. Best is trial 896 with value: 0.4533553242683411.
Generating morgan_rdkit fingerprints...
Generated fingerprints with 2048 features for 841 molecules
Trial 1943: 5-fold CV loss = 0.8777
[I 2025-08-07 23:23:53,391] Trial 1943 finished with value: 0.8777082681655883 and parameters: {'fp_type': 'morgan_rdkit', 'combined_morgan_radius': 3, 'combined_morgan_nBits': 1024, 'combined_rdkit_maxPath': 7, 'combined_rdkit_nBits': 1024, 'num_hidden_layers': 3, 'hidden_dim_0': 256, 'hidden_dim_1': 128, 'hidden_dim_2': 64, 'kl_weight': 0.00018548676730242917, 'lr': 0.0008186964690148777, 'batch_size': 128, 'dropout_rate': 0.16935450769198884, 'prior_mu': -0.011618815144999621, 'prior_sigma': 0.08446825966346412, 'normalization': 'layer'}. Best is trial 896 with value: 0.4533553242683411.
Generating morgan_rdkit fingerprints...
Generated fingerprints with 2048 features for 841 molecules
Trial 1944: 5-fold CV loss = 1.0220
[I 2025-08-07 23:24:00,669] Trial 1944 finished with value: 1.0219633102416992 and parameters: {'fp_type': 'morgan_rdkit', 'combined_morgan_radius': 3, 'combined_morgan_nBits': 1024, 'combined_rdkit_maxPath': 7, 'combined_rdkit_nBits': 1024, 'num_hidden_layers': 0, 'kl_weight': 0.0003182526294449333, 'lr': 0.006277771945712995, 'batch_size': 128, 'dropout_rate': 0.15297694396381664, 'prior_mu': -0.02694055007193533, 'prior_sigma': 0.0731381778400611, 'normalization': 'layer'}. Best is trial 896 with value: 0.4533553242683411.
Generating morgan_rdkit fingerprints...
Generated fingerprints with 2048 features for 841 molecules
Trial 1941: 5-fold CV loss = 0.4630
[I 2025-08-07 23:24:05,410] Trial 1941 finished with value: 0.46297443509101865 and parameters: {'fp_type': 'morgan_rdkit', 'combined_morgan_radius': 3, 'combined_morgan_nBits': 1024, 'combined_rdkit_maxPath': 7, 'combined_rdkit_nBits': 1024, 'num_hidden_layers': 3, 'hidden_dim_0': 256, 'hidden_dim_1': 1024, 'hidden_dim_2': 64, 'kl_weight': 0.00016205813444320242, 'lr': 0.007349788633262633, 'batch_size': 128, 'dropout_rate': 0.16882171078492147, 'prior_mu': -0.028491116308711276, 'prior_sigma': 0.0891981684405665, 'normalization': 'layer'}. Best is trial 896 with value: 0.4533553242683411.
Generating morgan_rdkit fingerprints...
Generated fingerprints with 2048 features for 841 molecules
Trial 1942: 5-fold CV loss = 0.4623
[I 2025-08-07 23:24:06,975] Trial 1942 finished with value: 0.46226759552955626 and parameters: {'fp_type': 'morgan_rdkit', 'combined_morgan_radius': 3, 'combined_morgan_nBits': 1024, 'combined_rdkit_maxPath': 7, 'combined_rdkit_nBits': 1024, 'num_hidden_layers': 3, 'hidden_dim_0': 256, 'hidden_dim_1': 1024, 'hidden_dim_2': 64, 'kl_weight': 0.00030925958502786246, 'lr': 0.007463822339971219, 'batch_size': 128, 'dropout_rate': 0.15277887803870155, 'prior_mu': -0.027971791695950248, 'prior_sigma': 0.08857838485760547, 'normalization': 'layer'}. Best is trial 896 with value: 0.4533553242683411.
Generating morgan_rdkit fingerprints...
Generated fingerprints with 2048 features for 841 molecules
Trial 1938: 5-fold CV loss = 0.5148
[I 2025-08-07 23:24:34,158] Trial 1938 finished with value: 0.5147915482521057 and parameters: {'fp_type': 'rdkit', 'rdkit_only_maxPath': 5, 'rdkit_only_nBits': 512, 'num_hidden_layers': 3, 'hidden_dim_0': 256, 'hidden_dim_1': 1024, 'hidden_dim_2': 64, 'kl_weight': 0.0002566674297496018, 'lr': 0.005673680772283955, 'batch_size': 128, 'dropout_rate': 0.15927479883180995, 'prior_mu': -0.014982910022949394, 'prior_sigma': 0.08302593863227492, 'normalization': 'layer'}. Best is trial 896 with value: 0.4533553242683411.
Generating morgan_rdkit fingerprints...
Generated fingerprints with 2048 features for 841 molecules
Trial 1947: 5-fold CV loss = 0.4803
[I 2025-08-07 23:24:36,857] Trial 1947 finished with value: 0.4803127467632294 and parameters: {'fp_type': 'morgan_rdkit', 'combined_morgan_radius': 3, 'combined_morgan_nBits': 1024, 'combined_rdkit_maxPath': 5, 'combined_rdkit_nBits': 1024, 'num_hidden_layers': 3, 'hidden_dim_0': 256, 'hidden_dim_1': 1024, 'hidden_dim_2': 64, 'kl_weight': 0.00022762008699305587, 'lr': 0.006320029910574614, 'batch_size': 128, 'dropout_rate': 0.16145020039125538, 'prior_mu': -0.005949278736168628, 'prior_sigma': 0.0723512293233811, 'normalization': 'layer'}. Best is trial 896 with value: 0.4533553242683411.
Generating morgan_rdkit fingerprints...
Generated fingerprints with 2048 features for 841 molecules
Trial 1945: 5-fold CV loss = 0.4595
[I 2025-08-07 23:24:41,227] Trial 1945 finished with value: 0.4595483660697937 and parameters: {'fp_type': 'morgan_rdkit', 'combined_morgan_radius': 3, 'combined_morgan_nBits': 1024, 'combined_rdkit_maxPath': 7, 'combined_rdkit_nBits': 1024, 'num_hidden_layers': 3, 'hidden_dim_0': 256, 'hidden_dim_1': 1024, 'hidden_dim_2': 64, 'kl_weight': 0.0003147247691936769, 'lr': 0.007657304526727068, 'batch_size': 128, 'dropout_rate': 0.19275572365369956, 'prior_mu': -0.01741635067778704, 'prior_sigma': 0.08814483895228614, 'normalization': 'layer'}. Best is trial 896 with value: 0.4533553242683411.
Generating morgan_rdkit fingerprints...
Generated fingerprints with 2048 features for 841 molecules
Trial 1946: 5-fold CV loss = 0.4859
[I 2025-08-07 23:24:47,385] Trial 1946 finished with value: 0.4859258413314819 and parameters: {'fp_type': 'morgan_rdkit', 'combined_morgan_radius': 3, 'combined_morgan_nBits': 1024, 'combined_rdkit_maxPath': 5, 'combined_rdkit_nBits': 1024, 'num_hidden_layers': 3, 'hidden_dim_0': 256, 'hidden_dim_1': 1024, 'hidden_dim_2': 64, 'kl_weight': 0.00031343775242856505, 'lr': 0.0062311691459064214, 'batch_size': 128, 'dropout_rate': 0.14728014077532178, 'prior_mu': 0.01259211065273256, 'prior_sigma': 0.07355092302924805, 'normalization': 'layer'}. Best is trial 896 with value: 0.4533553242683411.
Generating morgan_rdkit fingerprints...
Generated fingerprints with 2048 features for 841 molecules
Trial 1950: 5-fold CV loss = 0.4649
[I 2025-08-07 23:25:18,232] Trial 1950 finished with value: 0.46487917304039 and parameters: {'fp_type': 'morgan_rdkit', 'combined_morgan_radius': 3, 'combined_morgan_nBits': 1024, 'combined_rdkit_maxPath': 7, 'combined_rdkit_nBits': 1024, 'num_hidden_layers': 3, 'hidden_dim_0': 256, 'hidden_dim_1': 1024, 'hidden_dim_2': 64, 'kl_weight': 0.00031947276192302105, 'lr': 0.005440728407980524, 'batch_size': 128, 'dropout_rate': 0.1484782839268505, 'prior_mu': -0.021063688249728582, 'prior_sigma': 0.07601346943543741, 'normalization': 'layer'}. Best is trial 896 with value: 0.4533553242683411.
Generating morgan_rdkit fingerprints...
Generated fingerprints with 2048 features for 841 molecules
Trial 1949: 5-fold CV loss = 0.4640
[I 2025-08-07 23:25:20,295] Trial 1949 finished with value: 0.4640374958515167 and parameters: {'fp_type': 'morgan_rdkit', 'combined_morgan_radius': 3, 'combined_morgan_nBits': 1024, 'combined_rdkit_maxPath': 7, 'combined_rdkit_nBits': 1024, 'num_hidden_layers': 3, 'hidden_dim_0': 256, 'hidden_dim_1': 1024, 'hidden_dim_2': 64, 'kl_weight': 0.00031009948291159075, 'lr': 0.006257124655298748, 'batch_size': 128, 'dropout_rate': 0.17291873811540642, 'prior_mu': 0.011336735540306604, 'prior_sigma': 0.0760220698313111, 'normalization': 'layer'}. Best is trial 896 with value: 0.4533553242683411.
Generating morgan_rdkit fingerprints...
Generated fingerprints with 2048 features for 841 molecules
Trial 1951: 5-fold CV loss = 0.5635
[I 2025-08-07 23:25:40,876] Trial 1951 finished with value: 0.5634824752807617 and parameters: {'fp_type': 'morgan_rdkit', 'combined_morgan_radius': 3, 'combined_morgan_nBits': 1024, 'combined_rdkit_maxPath': 7, 'combined_rdkit_nBits': 1024, 'num_hidden_layers': 3, 'hidden_dim_0': 256, 'hidden_dim_1': 256, 'hidden_dim_2': 64, 'kl_weight': 0.0001949219589622325, 'lr': 0.005542516545972152, 'batch_size': 128, 'dropout_rate': 0.17072469277667884, 'prior_mu': -0.021775178131471062, 'prior_sigma': 0.07659611594763244, 'normalization': 'layer'}. Best is trial 896 with value: 0.4533553242683411.
Generating morgan_rdkit fingerprints...
Generated fingerprints with 2048 features for 841 molecules
Trial 1948: 5-fold CV loss = 0.4853
[I 2025-08-07 23:25:42,180] Trial 1948 finished with value: 0.48533007502555847 and parameters: {'fp_type': 'morgan_rdkit', 'combined_morgan_radius': 3, 'combined_morgan_nBits': 1024, 'combined_rdkit_maxPath': 5, 'combined_rdkit_nBits': 1024, 'num_hidden_layers': 3, 'hidden_dim_0': 256, 'hidden_dim_1': 1024, 'hidden_dim_2': 64, 'kl_weight': 0.0002232778392919636, 'lr': 0.006198486347365168, 'batch_size': 128, 'dropout_rate': 0.14575763336479874, 'prior_mu': 0.010233336657183043, 'prior_sigma': 0.07245085373927576, 'normalization': 'layer'}. Best is trial 896 with value: 0.4533553242683411.
Generating morgan fingerprints...
Generated fingerprints with 1024 features for 841 molecules
Trial 1952: 5-fold CV loss = 0.4859
[I 2025-08-07 23:25:49,864] Trial 1952 finished with value: 0.485853511095047 and parameters: {'fp_type': 'morgan_rdkit', 'combined_morgan_radius': 3, 'combined_morgan_nBits': 1024, 'combined_rdkit_maxPath': 6, 'combined_rdkit_nBits': 1024, 'num_hidden_layers': 3, 'hidden_dim_0': 256, 'hidden_dim_1': 256, 'hidden_dim_2': 128, 'kl_weight': 0.00022239970075802493, 'lr': 0.006883095755754385, 'batch_size': 128, 'dropout_rate': 0.17317323789777184, 'prior_mu': -0.003936160318520942, 'prior_sigma': 0.0782636290375746, 'normalization': 'layer'}. Best is trial 896 with value: 0.4533553242683411.
Generating morgan fingerprints...
Generated fingerprints with 1024 features for 841 molecules
Trial 1953: 5-fold CV loss = 0.4631
[I 2025-08-07 23:26:04,537] Trial 1953 finished with value: 0.46314549446105957 and parameters: {'fp_type': 'morgan_rdkit', 'combined_morgan_radius': 3, 'combined_morgan_nBits': 1024, 'combined_rdkit_maxPath': 7, 'combined_rdkit_nBits': 1024, 'num_hidden_layers': 3, 'hidden_dim_0': 256, 'hidden_dim_1': 256, 'hidden_dim_2': 128, 'kl_weight': 0.00022179077888442826, 'lr': 0.008473787655650034, 'batch_size': 128, 'dropout_rate': 0.14520425175866933, 'prior_mu': -0.030899724187396733, 'prior_sigma': 0.08569861107014562, 'normalization': 'layer'}. Best is trial 896 with value: 0.4533553242683411.
Generating morgan_rdkit fingerprints...
Generated fingerprints with 2048 features for 841 molecules
Trial 1956: 5-fold CV loss = 0.5203
[I 2025-08-07 23:26:14,100] Trial 1956 finished with value: 0.5202783882617951 and parameters: {'fp_type': 'morgan', 'morgan_only_radius': 2, 'morgan_only_nBits': 1024, 'num_hidden_layers': 3, 'hidden_dim_0': 256, 'hidden_dim_1': 1024, 'hidden_dim_2': 64, 'kl_weight': 0.0002744963796707997, 'lr': 0.00876386431401086, 'batch_size': 128, 'dropout_rate': 0.13957039632361193, 'prior_mu': -0.03363623488499255, 'prior_sigma': 0.08440345446229078, 'normalization': 'layer'}. Best is trial 896 with value: 0.4533553242683411.
Generating morgan_rdkit fingerprints...
Generated fingerprints with 2048 features for 841 molecules
Trial 1955: 5-fold CV loss = 0.5286
[I 2025-08-07 23:26:30,445] Trial 1955 finished with value: 0.5285520315170288 and parameters: {'fp_type': 'morgan', 'morgan_only_radius': 2, 'morgan_only_nBits': 1024, 'num_hidden_layers': 3, 'hidden_dim_0': 256, 'hidden_dim_1': 1024, 'hidden_dim_2': 64, 'kl_weight': 0.0002646641112340845, 'lr': 0.0072906482172112805, 'batch_size': 128, 'dropout_rate': 0.14207093369376708, 'prior_mu': -0.029422776306457458, 'prior_sigma': 0.0826150315239144, 'normalization': 'layer'}. Best is trial 896 with value: 0.4533553242683411.
Generating morgan_rdkit fingerprints...
Generated fingerprints with 2048 features for 841 molecules
Trial 1954: 5-fold CV loss = 0.4645
[I 2025-08-07 23:26:43,150] Trial 1954 finished with value: 0.46454364657402036 and parameters: {'fp_type': 'morgan_rdkit', 'combined_morgan_radius': 3, 'combined_morgan_nBits': 1024, 'combined_rdkit_maxPath': 7, 'combined_rdkit_nBits': 1024, 'num_hidden_layers': 3, 'hidden_dim_0': 256, 'hidden_dim_1': 1024, 'hidden_dim_2': 64, 'kl_weight': 0.00022985380746533854, 'lr': 0.00866667540225131, 'batch_size': 128, 'dropout_rate': 0.4104759233188249, 'prior_mu': -0.003414015450894224, 'prior_sigma': 0.08311767799573759, 'normalization': 'layer'}. Best is trial 896 with value: 0.4533553242683411.
Generating morgan_rdkit fingerprints...
Generated fingerprints with 2048 features for 841 molecules
Trial 1958: 5-fold CV loss = 0.4767
[I 2025-08-07 23:26:54,123] Trial 1958 finished with value: 0.47670853734016416 and parameters: {'fp_type': 'morgan_rdkit', 'combined_morgan_radius': 3, 'combined_morgan_nBits': 1024, 'combined_rdkit_maxPath': 7, 'combined_rdkit_nBits': 1024, 'num_hidden_layers': 3, 'hidden_dim_0': 1024, 'hidden_dim_1': 1024, 'hidden_dim_2': 64, 'kl_weight': 0.0002702025060675867, 'lr': 0.004648625033156752, 'batch_size': 128, 'dropout_rate': 0.15706359658124824, 'prior_mu': -0.012554853877790586, 'prior_sigma': 0.09144503043891757, 'normalization': 'layer'}. Best is trial 896 with value: 0.4533553242683411.
Generating morgan_rdkit fingerprints...
Generated fingerprints with 2048 features for 841 molecules
Trial 1957: 5-fold CV loss = 0.4677
[I 2025-08-07 23:26:55,653] Trial 1957 finished with value: 0.46774313449859617 and parameters: {'fp_type': 'morgan_rdkit', 'combined_morgan_radius': 3, 'combined_morgan_nBits': 1024, 'combined_rdkit_maxPath': 7, 'combined_rdkit_nBits': 1024, 'num_hidden_layers': 3, 'hidden_dim_0': 256, 'hidden_dim_1': 1024, 'hidden_dim_2': 64, 'kl_weight': 0.0002482708570657039, 'lr': 0.004528429783545542, 'batch_size': 128, 'dropout_rate': 0.1623074658085294, 'prior_mu': -0.011466734468875476, 'prior_sigma': 0.08187461104750954, 'normalization': 'layer'}. Best is trial 896 with value: 0.4533553242683411.
Generating morgan_rdkit fingerprints...
Generated fingerprints with 2048 features for 841 molecules
Trial 1961: 5-fold CV loss = 0.4658
[I 2025-08-07 23:27:30,190] Trial 1961 finished with value: 0.4657597005367279 and parameters: {'fp_type': 'morgan_rdkit', 'combined_morgan_radius': 3, 'combined_morgan_nBits': 1024, 'combined_rdkit_maxPath': 7, 'combined_rdkit_nBits': 1024, 'num_hidden_layers': 3, 'hidden_dim_0': 256, 'hidden_dim_1': 1024, 'hidden_dim_2': 64, 'kl_weight': 0.0003340046134786996, 'lr': 0.007648938054210161, 'batch_size': 128, 'dropout_rate': 0.16206795403124538, 'prior_mu': -0.017648742899530744, 'prior_sigma': 0.08000357276783539, 'normalization': 'layer'}. Best is trial 896 with value: 0.4533553242683411.
Generating morgan_rdkit fingerprints...
Generated fingerprints with 1280 features for 841 molecules
Trial 1960: 5-fold CV loss = 0.4661
[I 2025-08-07 23:27:43,810] Trial 1960 finished with value: 0.46611987948417666 and parameters: {'fp_type': 'morgan_rdkit', 'combined_morgan_radius': 3, 'combined_morgan_nBits': 1024, 'combined_rdkit_maxPath': 7, 'combined_rdkit_nBits': 1024, 'num_hidden_layers': 3, 'hidden_dim_0': 1024, 'hidden_dim_1': 1024, 'hidden_dim_2': 64, 'kl_weight': 0.00031900943706021824, 'lr': 0.004665350779795137, 'batch_size': 128, 'dropout_rate': 0.1602967602736352, 'prior_mu': -0.01578113397469897, 'prior_sigma': 0.08077234256877389, 'normalization': 'layer'}. Best is trial 896 with value: 0.4533553242683411.
Generating morgan_rdkit fingerprints...
Generated fingerprints with 1280 features for 841 molecules
Trial 1962: 5-fold CV loss = 0.4731
[I 2025-08-07 23:27:57,150] Trial 1962 finished with value: 0.4730628550052643 and parameters: {'fp_type': 'morgan_rdkit', 'combined_morgan_radius': 3, 'combined_morgan_nBits': 1024, 'combined_rdkit_maxPath': 7, 'combined_rdkit_nBits': 1024, 'num_hidden_layers': 3, 'hidden_dim_0': 256, 'hidden_dim_1': 1024, 'hidden_dim_2': 256, 'kl_weight': 0.00032011041763641733, 'lr': 0.005042591320721148, 'batch_size': 128, 'dropout_rate': 0.1884115829504932, 'prior_mu': -0.023254519242058378, 'prior_sigma': 0.09042229151078422, 'normalization': 'layer'}. Best is trial 896 with value: 0.4533553242683411.
Generating morgan_rdkit fingerprints...
Generated fingerprints with 2048 features for 841 molecules
Trial 1963: 5-fold CV loss = 0.5818
[I 2025-08-07 23:28:02,516] Trial 1963 finished with value: 0.5817844092845916 and parameters: {'fp_type': 'morgan_rdkit', 'combined_morgan_radius': 3, 'combined_morgan_nBits': 1024, 'combined_rdkit_maxPath': 7, 'combined_rdkit_nBits': 256, 'num_hidden_layers': 3, 'hidden_dim_0': 512, 'hidden_dim_1': 1024, 'hidden_dim_2': 256, 'kl_weight': 0.0003223451694802799, 'lr': 0.006829725668734605, 'batch_size': 128, 'dropout_rate': 0.18688966502948504, 'prior_mu': -0.02190784487291207, 'prior_sigma': 0.08621561801117973, 'normalization': 'layer'}. Best is trial 896 with value: 0.4533553242683411.
Generating morgan_rdkit fingerprints...
Generated fingerprints with 2048 features for 841 molecules
Trial 1959: 5-fold CV loss = 0.4663
[I 2025-08-07 23:28:05,669] Trial 1959 finished with value: 0.46627953052520754 and parameters: {'fp_type': 'morgan_rdkit', 'combined_morgan_radius': 3, 'combined_morgan_nBits': 1024, 'combined_rdkit_maxPath': 7, 'combined_rdkit_nBits': 1024, 'num_hidden_layers': 3, 'hidden_dim_0': 1024, 'hidden_dim_1': 1024, 'hidden_dim_2': 64, 'kl_weight': 0.016534520084778417, 'lr': 0.006903190421519629, 'batch_size': 128, 'dropout_rate': 0.16025094235639498, 'prior_mu': -0.00876254376194216, 'prior_sigma': 0.0896238567402604, 'normalization': 'layer'}. Best is trial 896 with value: 0.4533553242683411.
Generating morgan_rdkit fingerprints...
Generated fingerprints with 2048 features for 841 molecules
Trial 1965: 5-fold CV loss = 0.4706
[I 2025-08-07 23:28:35,786] Trial 1965 finished with value: 0.47060019969940187 and parameters: {'fp_type': 'morgan_rdkit', 'combined_morgan_radius': 3, 'combined_morgan_nBits': 1024, 'combined_rdkit_maxPath': 7, 'combined_rdkit_nBits': 1024, 'num_hidden_layers': 3, 'hidden_dim_0': 512, 'hidden_dim_1': 1024, 'hidden_dim_2': 64, 'kl_weight': 0.0018430338149511643, 'lr': 0.009988242973815408, 'batch_size': 128, 'dropout_rate': 0.21613134969444162, 'prior_mu': -0.034265597750721764, 'prior_sigma': 0.07213258137804279, 'normalization': 'layer'}. Best is trial 896 with value: 0.4533553242683411.
Generating morgan_rdkit fingerprints...
Generated fingerprints with 2048 features for 841 molecules
Trial 1966: 5-fold CV loss = 0.4659
