[I 2025-08-07 20:47:07,257] Trial 1126 finished with value: 0.47308977842330935 and parameters: {'fp_type': 'morgan_rdkit', 'combined_morgan_radius': 3, 'combined_morgan_nBits': 1024, 'combined_rdkit_maxPath': 7, 'combined_rdkit_nBits': 1024, 'num_hidden_layers': 3, 'hidden_dim_0': 1024, 'hidden_dim_1': 1024, 'hidden_dim_2': 64, 'kl_weight': 0.006616691680071253, 'lr': 0.005333210084449723, 'batch_size': 128, 'dropout_rate': 0.15476042036601642, 'prior_mu': -0.05355043424848453, 'prior_sigma': 0.056355171994409384, 'normalization': 'layer'}. Best is trial 896 with value: 0.4533553242683411.
Generating morgan_rdkit fingerprints...
Generated fingerprints with 2048 features for 841 molecules
Trial 1129: 5-fold CV loss = 0.8911
[I 2025-08-07 20:47:21,488] Trial 1129 finished with value: 0.89114408493042 and parameters: {'fp_type': 'morgan_rdkit', 'combined_morgan_radius': 3, 'combined_morgan_nBits': 1024, 'combined_rdkit_maxPath': 7, 'combined_rdkit_nBits': 1024, 'num_hidden_layers': 3, 'hidden_dim_0': 256, 'hidden_dim_1': 1024, 'hidden_dim_2': 1024, 'kl_weight': 0.0009803864627134784, 'lr': 0.009317944617717223, 'batch_size': 128, 'dropout_rate': 0.11870696060045514, 'prior_mu': -0.02669232062203577, 'prior_sigma': 0.08407971502850813, 'normalization': 'layer'}. Best is trial 896 with value: 0.4533553242683411.
Generating morgan_rdkit fingerprints...
Generated fingerprints with 2048 features for 841 molecules
Trial 1125: 5-fold CV loss = 0.4647
[I 2025-08-07 20:47:27,768] Trial 1125 finished with value: 0.4647424936294556 and parameters: {'fp_type': 'morgan_rdkit', 'combined_morgan_radius': 3, 'combined_morgan_nBits': 1024, 'combined_rdkit_maxPath': 7, 'combined_rdkit_nBits': 1024, 'num_hidden_layers': 3, 'hidden_dim_0': 1024, 'hidden_dim_1': 1024, 'hidden_dim_2': 64, 'kl_weight': 0.00046482925661141597, 'lr': 0.004675937441700075, 'batch_size': 128, 'dropout_rate': 0.12323334396600173, 'prior_mu': -0.024947537456409385, 'prior_sigma': 0.07283992250107994, 'normalization': 'layer'}. Best is trial 896 with value: 0.4533553242683411.
Generating morgan_rdkit fingerprints...
Generated fingerprints with 2048 features for 841 molecules
Trial 1128: 5-fold CV loss = 0.4688
[I 2025-08-07 20:47:51,277] Trial 1128 finished with value: 0.4688089430332184 and parameters: {'fp_type': 'morgan_rdkit', 'combined_morgan_radius': 3, 'combined_morgan_nBits': 1024, 'combined_rdkit_maxPath': 7, 'combined_rdkit_nBits': 1024, 'num_hidden_layers': 3, 'hidden_dim_0': 256, 'hidden_dim_1': 1024, 'hidden_dim_2': 128, 'kl_weight': 0.00023857083352912112, 'lr': 0.005276499700283128, 'batch_size': 128, 'dropout_rate': 0.07643615482913967, 'prior_mu': -0.0515089441125902, 'prior_sigma': 0.08392479428101635, 'normalization': 'layer'}. Best is trial 896 with value: 0.4533553242683411.
Generating morgan_rdkit fingerprints...
Generated fingerprints with 2048 features for 841 molecules
Trial 1130: 5-fold CV loss = 0.4699
[I 2025-08-07 20:47:57,354] Trial 1130 finished with value: 0.4698715627193451 and parameters: {'fp_type': 'morgan_rdkit', 'combined_morgan_radius': 3, 'combined_morgan_nBits': 1024, 'combined_rdkit_maxPath': 7, 'combined_rdkit_nBits': 1024, 'num_hidden_layers': 3, 'hidden_dim_0': 256, 'hidden_dim_1': 1024, 'hidden_dim_2': 64, 'kl_weight': 0.00023142795015904707, 'lr': 0.007794500269219928, 'batch_size': 128, 'dropout_rate': 0.07107852057508716, 'prior_mu': -0.017736185966278416, 'prior_sigma': 0.10295913025259264, 'normalization': 'layer'}. Best is trial 896 with value: 0.4533553242683411.
Generating morgan_rdkit fingerprints...
Generated fingerprints with 2048 features for 841 molecules
Trial 1131: 5-fold CV loss = 0.5418
[I 2025-08-07 20:48:17,458] Trial 1131 finished with value: 0.5418459951877594 and parameters: {'fp_type': 'morgan_rdkit', 'combined_morgan_radius': 3, 'combined_morgan_nBits': 1024, 'combined_rdkit_maxPath': 7, 'combined_rdkit_nBits': 1024, 'num_hidden_layers': 3, 'hidden_dim_0': 256, 'hidden_dim_1': 1024, 'hidden_dim_2': 128, 'kl_weight': 0.00023920216832508327, 'lr': 0.0077149979765177065, 'batch_size': 128, 'dropout_rate': 0.07301803385402188, 'prior_mu': -0.017156034696386768, 'prior_sigma': 0.10334699885506793, 'normalization': 'layer'}. Best is trial 896 with value: 0.4533553242683411.
Generating morgan_rdkit fingerprints...
Generated fingerprints with 2048 features for 841 molecules
Trial 1133: 5-fold CV loss = 0.7454
[I 2025-08-07 20:48:27,820] Trial 1133 finished with value: 0.7453804612159729 and parameters: {'fp_type': 'morgan_rdkit', 'combined_morgan_radius': 3, 'combined_morgan_nBits': 1024, 'combined_rdkit_maxPath': 7, 'combined_rdkit_nBits': 1024, 'num_hidden_layers': 3, 'hidden_dim_0': 256, 'hidden_dim_1': 1024, 'hidden_dim_2': 256, 'kl_weight': 0.00041289933396031366, 'lr': 0.005905319375130199, 'batch_size': 128, 'dropout_rate': 0.14124305893285624, 'prior_mu': -0.004489208368453441, 'prior_sigma': 0.11143233099344726, 'normalization': 'layer'}. Best is trial 896 with value: 0.4533553242683411.
Generating morgan_rdkit fingerprints...
Generated fingerprints with 2048 features for 841 molecules
Trial 1132: 5-fold CV loss = 0.5475
[I 2025-08-07 20:48:33,225] Trial 1132 finished with value: 0.5475290060043335 and parameters: {'fp_type': 'morgan_rdkit', 'combined_morgan_radius': 3, 'combined_morgan_nBits': 1024, 'combined_rdkit_maxPath': 7, 'combined_rdkit_nBits': 1024, 'num_hidden_layers': 3, 'hidden_dim_0': 256, 'hidden_dim_1': 64, 'hidden_dim_2': 64, 'kl_weight': 0.00039496228239988316, 'lr': 0.007441698869205853, 'batch_size': 128, 'dropout_rate': 0.14192943994010607, 'prior_mu': -0.01713411720358577, 'prior_sigma': 0.10302638768030935, 'normalization': 'layer'}. Best is trial 896 with value: 0.4533553242683411.
Generating morgan_rdkit fingerprints...
Generated fingerprints with 2048 features for 841 molecules
Trial 1127: 5-fold CV loss = 0.5823
[I 2025-08-07 20:48:39,847] Trial 1127 finished with value: 0.5823270201683044 and parameters: {'fp_type': 'morgan_rdkit', 'combined_morgan_radius': 3, 'combined_morgan_nBits': 1024, 'combined_rdkit_maxPath': 7, 'combined_rdkit_nBits': 1024, 'num_hidden_layers': 3, 'hidden_dim_0': 1024, 'hidden_dim_1': 1024, 'hidden_dim_2': 1024, 'kl_weight': 0.00023235096041806914, 'lr': 0.00920602388487141, 'batch_size': 128, 'dropout_rate': 0.07156725482632076, 'prior_mu': -0.0530513991120087, 'prior_sigma': 0.07919163114540151, 'normalization': 'layer'}. Best is trial 896 with value: 0.4533553242683411.
Generating morgan_rdkit fingerprints...
Generated fingerprints with 2048 features for 841 molecules
Trial 1135: 5-fold CV loss = 0.4728
[I 2025-08-07 20:49:01,097] Trial 1135 finished with value: 0.4727970540523529 and parameters: {'fp_type': 'morgan_rdkit', 'combined_morgan_radius': 3, 'combined_morgan_nBits': 1024, 'combined_rdkit_maxPath': 6, 'combined_rdkit_nBits': 1024, 'num_hidden_layers': 3, 'hidden_dim_0': 512, 'hidden_dim_1': 1024, 'hidden_dim_2': 64, 'kl_weight': 0.0003223611231809411, 'lr': 0.007261545589812156, 'batch_size': 128, 'dropout_rate': 0.1071827244008983, 'prior_mu': 0.009258335375007832, 'prior_sigma': 0.09344532445304145, 'normalization': 'layer'}. Best is trial 896 with value: 0.4533553242683411.
Generating morgan_rdkit fingerprints...
Generated fingerprints with 2048 features for 841 molecules
Trial 1134: 5-fold CV loss = 0.6355
[I 2025-08-07 20:49:08,802] Trial 1134 finished with value: 0.6354680538177491 and parameters: {'fp_type': 'morgan_rdkit', 'combined_morgan_radius': 3, 'combined_morgan_nBits': 1024, 'combined_rdkit_maxPath': 6, 'combined_rdkit_nBits': 1024, 'num_hidden_layers': 3, 'hidden_dim_0': 512, 'hidden_dim_1': 1024, 'hidden_dim_2': 256, 'kl_weight': 0.0004138528551878962, 'lr': 0.005829603538149374, 'batch_size': 128, 'dropout_rate': 0.14057550348041317, 'prior_mu': -0.004979533619477202, 'prior_sigma': 0.11101550506733711, 'normalization': 'layer'}. Best is trial 896 with value: 0.4533553242683411.
Generating morgan_rdkit fingerprints...
Generated fingerprints with 2048 features for 841 molecules
Trial 1136: 5-fold CV loss = 0.4729
[I 2025-08-07 20:49:13,814] Trial 1136 finished with value: 0.4729446470737457 and parameters: {'fp_type': 'morgan_rdkit', 'combined_morgan_radius': 3, 'combined_morgan_nBits': 1024, 'combined_rdkit_maxPath': 6, 'combined_rdkit_nBits': 1024, 'num_hidden_layers': 3, 'hidden_dim_0': 256, 'hidden_dim_1': 1024, 'hidden_dim_2': 64, 'kl_weight': 0.00032824958437023706, 'lr': 0.006158791811172337, 'batch_size': 128, 'dropout_rate': 0.10765436425732702, 'prior_mu': -0.029742789303939622, 'prior_sigma': 0.09366369606375805, 'normalization': 'layer'}. Best is trial 896 with value: 0.4533553242683411.
Generating morgan_rdkit fingerprints...
Generated fingerprints with 2048 features for 841 molecules
Trial 1137: 5-fold CV loss = 0.8698
[I 2025-08-07 20:49:16,934] Trial 1137 finished with value: 0.8698407888412476 and parameters: {'fp_type': 'morgan_rdkit', 'combined_morgan_radius': 3, 'combined_morgan_nBits': 1024, 'combined_rdkit_maxPath': 6, 'combined_rdkit_nBits': 1024, 'num_hidden_layers': 3, 'hidden_dim_0': 512, 'hidden_dim_1': 1024, 'hidden_dim_2': 64, 'kl_weight': 0.00018006243746095603, 'lr': 0.000749037699910013, 'batch_size': 128, 'dropout_rate': 0.09049913409862716, 'prior_mu': -0.03077020399779819, 'prior_sigma': 0.09399020586665906, 'normalization': 'layer'}. Best is trial 896 with value: 0.4533553242683411.
Generating morgan_rdkit fingerprints...
Generated fingerprints with 2048 features for 841 molecules
Trial 1138: 5-fold CV loss = 0.4693
[I 2025-08-07 20:49:35,801] Trial 1138 finished with value: 0.46928141117095945 and parameters: {'fp_type': 'morgan_rdkit', 'combined_morgan_radius': 3, 'combined_morgan_nBits': 1024, 'combined_rdkit_maxPath': 7, 'combined_rdkit_nBits': 1024, 'num_hidden_layers': 3, 'hidden_dim_0': 256, 'hidden_dim_1': 1024, 'hidden_dim_2': 64, 'kl_weight': 0.0001856843789563167, 'lr': 0.0061558083507972025, 'batch_size': 128, 'dropout_rate': 0.15410986272331828, 'prior_mu': -0.03016861074753531, 'prior_sigma': 0.07680790362521467, 'normalization': 'layer'}. Best is trial 896 with value: 0.4533553242683411.
Generating morgan_rdkit fingerprints...
Generated fingerprints with 1280 features for 841 molecules
Trial 1140: 5-fold CV loss = 0.4845
[I 2025-08-07 20:49:53,049] Trial 1140 finished with value: 0.48451967239379884 and parameters: {'fp_type': 'morgan_rdkit', 'combined_morgan_radius': 3, 'combined_morgan_nBits': 1024, 'combined_rdkit_maxPath': 7, 'combined_rdkit_nBits': 1024, 'num_hidden_layers': 3, 'hidden_dim_0': 256, 'hidden_dim_1': 1024, 'hidden_dim_2': 64, 'kl_weight': 0.02400763718912554, 'lr': 0.005334119442290698, 'batch_size': 128, 'dropout_rate': 0.0837996273091709, 'prior_mu': -0.03049175063319669, 'prior_sigma': 0.06277284253445696, 'normalization': 'layer'}. Best is trial 896 with value: 0.4533553242683411.
Generating morgan_rdkit fingerprints...
Generated fingerprints with 1280 features for 841 molecules
Trial 1139: 5-fold CV loss = 0.5693
[I 2025-08-07 20:50:09,040] Trial 1139 finished with value: 0.5692590594291687 and parameters: {'fp_type': 'morgan_rdkit', 'combined_morgan_radius': 3, 'combined_morgan_nBits': 1024, 'combined_rdkit_maxPath': 7, 'combined_rdkit_nBits': 1024, 'num_hidden_layers': 3, 'hidden_dim_0': 256, 'hidden_dim_1': 1024, 'hidden_dim_2': 64, 'kl_weight': 0.0003579937369024069, 'lr': 0.006287665240440718, 'batch_size': 128, 'dropout_rate': 0.08593573339884047, 'prior_mu': -0.03230356428058492, 'prior_sigma': 0.11559207168886577, 'normalization': 'layer'}. Best is trial 896 with value: 0.4533553242683411.
Generating morgan fingerprints...
Generated fingerprints with 2048 features for 841 molecules
Trial 1142: 5-fold CV loss = 0.5170
[I 2025-08-07 20:50:11,697] Trial 1142 finished with value: 0.5169795095920563 and parameters: {'fp_type': 'morgan_rdkit', 'combined_morgan_radius': 3, 'combined_morgan_nBits': 1024, 'combined_rdkit_maxPath': 7, 'combined_rdkit_nBits': 256, 'num_hidden_layers': 3, 'hidden_dim_0': 256, 'hidden_dim_1': 1024, 'hidden_dim_2': 64, 'kl_weight': 0.00035650981535118715, 'lr': 0.005296732881690356, 'batch_size': 128, 'dropout_rate': 0.11979254080462758, 'prior_mu': -0.043385903335310956, 'prior_sigma': 0.11569114815507629, 'normalization': 'layer'}. Best is trial 896 with value: 0.4533553242683411.
Generating morgan_rdkit fingerprints...
Generated fingerprints with 2048 features for 841 molecules
Trial 1143: 5-fold CV loss = 0.5110
[I 2025-08-07 20:50:30,914] Trial 1143 finished with value: 0.5110036551952362 and parameters: {'fp_type': 'morgan_rdkit', 'combined_morgan_radius': 3, 'combined_morgan_nBits': 1024, 'combined_rdkit_maxPath': 7, 'combined_rdkit_nBits': 256, 'num_hidden_layers': 3, 'hidden_dim_0': 256, 'hidden_dim_1': 256, 'hidden_dim_2': 64, 'kl_weight': 0.0003567620467232937, 'lr': 0.006988500610534442, 'batch_size': 64, 'dropout_rate': 0.11971110996256873, 'prior_mu': -0.042795564864838875, 'prior_sigma': 0.07038193756291482, 'normalization': 'layer'}. Best is trial 896 with value: 0.4533553242683411.
Generating morgan fingerprints...
Generated fingerprints with 2048 features for 841 molecules
Trial 1146: 5-fold CV loss = 0.5727
[I 2025-08-07 20:50:55,413] Trial 1146 finished with value: 0.5727460622787476 and parameters: {'fp_type': 'morgan', 'morgan_only_radius': 3, 'morgan_only_nBits': 2048, 'num_hidden_layers': 3, 'hidden_dim_0': 256, 'hidden_dim_1': 128, 'hidden_dim_2': 64, 'kl_weight': 0.00028771283125790894, 'lr': 0.007991683133163886, 'batch_size': 128, 'dropout_rate': 0.04403916781135722, 'prior_mu': -0.012994553848700362, 'prior_sigma': 0.08851279533621409, 'normalization': 'none'}. Best is trial 896 with value: 0.4533553242683411.
Generating morgan_rdkit fingerprints...
Generated fingerprints with 2048 features for 841 molecules
Trial 1145: 5-fold CV loss = 0.4621
[I 2025-08-07 20:50:56,601] Trial 1145 finished with value: 0.4620622038841248 and parameters: {'fp_type': 'morgan_rdkit', 'combined_morgan_radius': 3, 'combined_morgan_nBits': 1024, 'combined_rdkit_maxPath': 7, 'combined_rdkit_nBits': 1024, 'num_hidden_layers': 3, 'hidden_dim_0': 256, 'hidden_dim_1': 256, 'hidden_dim_2': 64, 'kl_weight': 0.00029527997408557426, 'lr': 0.007255757510895097, 'batch_size': 64, 'dropout_rate': 0.12663986614456266, 'prior_mu': -0.013767894400369405, 'prior_sigma': 0.08841460042259143, 'normalization': 'layer'}. Best is trial 896 with value: 0.4533553242683411.
Generating morgan_rdkit fingerprints...
Generated fingerprints with 2048 features for 841 molecules
Trial 1144: 5-fold CV loss = 0.5709
[I 2025-08-07 20:51:17,991] Trial 1144 finished with value: 0.5708882212638855 and parameters: {'fp_type': 'morgan', 'morgan_only_radius': 3, 'morgan_only_nBits': 2048, 'num_hidden_layers': 3, 'hidden_dim_0': 256, 'hidden_dim_1': 256, 'hidden_dim_2': 64, 'kl_weight': 0.00029788706833868225, 'lr': 0.007310851468372067, 'batch_size': 64, 'dropout_rate': 0.1173616032989937, 'prior_mu': -0.014566428817516477, 'prior_sigma': 0.08971757906675361, 'normalization': 'none'}. Best is trial 896 with value: 0.4533553242683411.
Generating morgan_rdkit fingerprints...
Generated fingerprints with 2048 features for 841 molecules
Trial 1148: 5-fold CV loss = 0.4824
[I 2025-08-07 20:51:22,777] Trial 1148 finished with value: 0.48240424394607545 and parameters: {'fp_type': 'morgan_rdkit', 'combined_morgan_radius': 3, 'combined_morgan_nBits': 1024, 'combined_rdkit_maxPath': 5, 'combined_rdkit_nBits': 1024, 'num_hidden_layers': 3, 'hidden_dim_0': 256, 'hidden_dim_1': 1024, 'hidden_dim_2': 64, 'kl_weight': 0.0002581933166793268, 'lr': 0.008663656804660807, 'batch_size': 128, 'dropout_rate': 0.1545937482646561, 'prior_mu': -0.019153649383609025, 'prior_sigma': 0.08198970667850315, 'normalization': 'layer'}. Best is trial 896 with value: 0.4533553242683411.
Generating morgan_rdkit fingerprints...
Generated fingerprints with 2048 features for 841 molecules
Trial 1147: 5-fold CV loss = 0.4665
[I 2025-08-07 20:51:34,908] Trial 1147 finished with value: 0.4665001392364502 and parameters: {'fp_type': 'morgan_rdkit', 'combined_morgan_radius': 3, 'combined_morgan_nBits': 1024, 'combined_rdkit_maxPath': 7, 'combined_rdkit_nBits': 1024, 'num_hidden_layers': 3, 'hidden_dim_0': 256, 'hidden_dim_1': 1024, 'hidden_dim_2': 64, 'kl_weight': 0.00026339101712641967, 'lr': 0.009122406338391826, 'batch_size': 128, 'dropout_rate': 0.1537704209736574, 'prior_mu': 0.020779832365324026, 'prior_sigma': 0.0777028760418157, 'normalization': 'layer'}. Best is trial 896 with value: 0.4533553242683411.
Generating rdkit fingerprints...
Generated fingerprints with 1024 features for 841 molecules
Trial 1141: 5-fold CV loss = 0.4937
[I 2025-08-07 20:51:39,963] Trial 1141 finished with value: 0.4937353253364563 and parameters: {'fp_type': 'morgan_rdkit', 'combined_morgan_radius': 3, 'combined_morgan_nBits': 1024, 'combined_rdkit_maxPath': 7, 'combined_rdkit_nBits': 1024, 'num_hidden_layers': 3, 'hidden_dim_0': 256, 'hidden_dim_1': 1024, 'hidden_dim_2': 64, 'kl_weight': 0.0003567411376438367, 'lr': 0.005383649414689626, 'batch_size': 128, 'dropout_rate': 0.156025208359453, 'prior_mu': -0.041743765031742576, 'prior_sigma': 0.16125693365961927, 'normalization': 'layer'}. Best is trial 896 with value: 0.4533553242683411.
Generating morgan_rdkit fingerprints...
Generated fingerprints with 2048 features for 841 molecules
Trial 1149: 5-fold CV loss = 0.4881
[I 2025-08-07 20:51:55,839] Trial 1149 finished with value: 0.4881167709827423 and parameters: {'fp_type': 'morgan_rdkit', 'combined_morgan_radius': 3, 'combined_morgan_nBits': 1024, 'combined_rdkit_maxPath': 5, 'combined_rdkit_nBits': 1024, 'num_hidden_layers': 3, 'hidden_dim_0': 256, 'hidden_dim_1': 1024, 'hidden_dim_2': 64, 'kl_weight': 0.000261461661922768, 'lr': 0.00901581213717871, 'batch_size': 128, 'dropout_rate': 0.1536443204592666, 'prior_mu': -0.02225548150090984, 'prior_sigma': 0.08172828175770379, 'normalization': 'layer'}. Best is trial 896 with value: 0.4533553242683411.
Generating rdkit fingerprints...
Generated fingerprints with 1024 features for 841 molecules
Trial 1152: 5-fold CV loss = 1.3037
[I 2025-08-07 20:51:58,591] Trial 1152 finished with value: 1.3037403345108032 and parameters: {'fp_type': 'morgan_rdkit', 'combined_morgan_radius': 3, 'combined_morgan_nBits': 1024, 'combined_rdkit_maxPath': 7, 'combined_rdkit_nBits': 1024, 'num_hidden_layers': 0, 'kl_weight': 0.0004377924694008011, 'lr': 0.006488529636447209, 'batch_size': 128, 'dropout_rate': 0.09670806317301764, 'prior_mu': -0.004480353217654866, 'prior_sigma': 0.09798640352984442, 'normalization': 'layer'}. Best is trial 896 with value: 0.4533553242683411.
Generating rdkit fingerprints...
Generated fingerprints with 1024 features for 841 molecules
Trial 1150: 5-fold CV loss = 0.4798
[I 2025-08-07 20:52:04,864] Trial 1150 finished with value: 0.47977265119552615 and parameters: {'fp_type': 'morgan_rdkit', 'combined_morgan_radius': 3, 'combined_morgan_nBits': 1024, 'combined_rdkit_maxPath': 7, 'combined_rdkit_nBits': 1024, 'num_hidden_layers': 3, 'hidden_dim_0': 256, 'hidden_dim_1': 1024, 'hidden_dim_2': 64, 'kl_weight': 0.010603178964879147, 'lr': 0.0057339782972105745, 'batch_size': 128, 'dropout_rate': 0.10458041837223947, 'prior_mu': -0.005118776780384551, 'prior_sigma': 0.07523412815905126, 'normalization': 'layer'}. Best is trial 896 with value: 0.4533553242683411.
Generating rdkit fingerprints...
Generated fingerprints with 1024 features for 841 molecules
Trial 1151: 5-fold CV loss = 0.5321
[I 2025-08-07 20:52:20,766] Trial 1151 finished with value: 0.532129991054535 and parameters: {'fp_type': 'rdkit', 'rdkit_only_maxPath': 7, 'rdkit_only_nBits': 1024, 'num_hidden_layers': 3, 'hidden_dim_0': 256, 'hidden_dim_1': 1024, 'hidden_dim_2': 64, 'kl_weight': 0.004392580260343153, 'lr': 0.0056065286974010245, 'batch_size': 128, 'dropout_rate': 0.0985178106175224, 'prior_mu': -0.005367485971661336, 'prior_sigma': 0.09770147301513542, 'normalization': 'layer'}. Best is trial 896 with value: 0.4533553242683411.
Generating morgan_rdkit fingerprints...
Generated fingerprints with 2048 features for 841 molecules
Trial 1155: 5-fold CV loss = 0.6503
[I 2025-08-07 20:52:37,451] Trial 1155 finished with value: 0.6502897143363953 and parameters: {'fp_type': 'rdkit', 'rdkit_only_maxPath': 7, 'rdkit_only_nBits': 1024, 'num_hidden_layers': 3, 'hidden_dim_0': 256, 'hidden_dim_1': 1024, 'hidden_dim_2': 64, 'kl_weight': 0.0002159094333325449, 'lr': 0.008055014801040445, 'batch_size': 128, 'dropout_rate': 0.13638666338998873, 'prior_mu': 0.007991445045361055, 'prior_sigma': 0.14390466196729812, 'normalization': 'layer'}. Best is trial 896 with value: 0.4533553242683411.
Generating morgan_rdkit fingerprints...
Generated fingerprints with 2048 features for 841 molecules
Trial 1156: 5-fold CV loss = 0.5030
[I 2025-08-07 20:52:48,629] Trial 1156 finished with value: 0.503032797574997 and parameters: {'fp_type': 'morgan_rdkit', 'combined_morgan_radius': 3, 'combined_morgan_nBits': 1024, 'combined_rdkit_maxPath': 7, 'combined_rdkit_nBits': 1024, 'num_hidden_layers': 1, 'hidden_dim_0': 256, 'kl_weight': 0.0003141736529704153, 'lr': 0.007838179690102271, 'batch_size': 128, 'dropout_rate': 0.1362480588681508, 'prior_mu': 0.009442513398112584, 'prior_sigma': 0.10735251007719389, 'normalization': 'layer'}. Best is trial 896 with value: 0.4533553242683411.
Generating morgan_rdkit fingerprints...
Generated fingerprints with 2048 features for 841 molecules
Trial 1153: 5-fold CV loss = 0.5531
