[I 2025-08-07 23:34:51,757] Trial 1996 finished with value: 0.546291035413742 and parameters: {'fp_type': 'morgan_rdkit', 'combined_morgan_radius': 3, 'combined_morgan_nBits': 1024, 'combined_rdkit_maxPath': 7, 'combined_rdkit_nBits': 1024, 'num_hidden_layers': 3, 'hidden_dim_0': 256, 'hidden_dim_1': 1024, 'hidden_dim_2': 64, 'kl_weight': 0.00035926228329711564, 'lr': 0.006769051733235277, 'batch_size': 128, 'dropout_rate': 0.13732603095079277, 'prior_mu': 0.004756166940935006, 'prior_sigma': 0.0769478056075835, 'normalization': 'layer'}. Best is trial 896 with value: 0.4533553242683411.
Generating morgan_rdkit fingerprints...
Generated fingerprints with 2048 features for 841 molecules
Trial 1990: 5-fold CV loss = 0.4724
[I 2025-08-07 23:35:01,249] Trial 1990 finished with value: 0.4723669648170471 and parameters: {'fp_type': 'morgan_rdkit', 'combined_morgan_radius': 3, 'combined_morgan_nBits': 1024, 'combined_rdkit_maxPath': 8, 'combined_rdkit_nBits': 1024, 'num_hidden_layers': 3, 'hidden_dim_0': 256, 'hidden_dim_1': 1024, 'hidden_dim_2': 64, 'kl_weight': 0.00029685632280687934, 'lr': 0.00770315330382779, 'batch_size': 128, 'dropout_rate': 0.1780335747999991, 'prior_mu': -0.02812506734509762, 'prior_sigma': 0.09561141964061647, 'normalization': 'layer'}. Best is trial 896 with value: 0.4533553242683411.
Generating morgan_rdkit fingerprints...
Generated fingerprints with 2048 features for 841 molecules
Trial 1995: 5-fold CV loss = 0.4635
[I 2025-08-07 23:35:04,728] Trial 1995 finished with value: 0.46353434324264525 and parameters: {'fp_type': 'morgan_rdkit', 'combined_morgan_radius': 3, 'combined_morgan_nBits': 1024, 'combined_rdkit_maxPath': 7, 'combined_rdkit_nBits': 1024, 'num_hidden_layers': 3, 'hidden_dim_0': 256, 'hidden_dim_1': 1024, 'hidden_dim_2': 64, 'kl_weight': 0.00036196727964379796, 'lr': 0.006875211353726356, 'batch_size': 128, 'dropout_rate': 0.1568800569389749, 'prior_mu': 0.0005592924319158133, 'prior_sigma': 0.07422807750887656, 'normalization': 'layer'}. Best is trial 896 with value: 0.4533553242683411.
Generating morgan_rdkit fingerprints...
Generated fingerprints with 2048 features for 841 molecules
Trial 1998: 5-fold CV loss = 0.5597
[I 2025-08-07 23:35:16,190] Trial 1998 finished with value: 0.55967418551445 and parameters: {'fp_type': 'morgan_rdkit', 'combined_morgan_radius': 3, 'combined_morgan_nBits': 1024, 'combined_rdkit_maxPath': 7, 'combined_rdkit_nBits': 1024, 'num_hidden_layers': 3, 'hidden_dim_0': 256, 'hidden_dim_1': 1024, 'hidden_dim_2': 64, 'kl_weight': 0.00020239685025997327, 'lr': 0.005897613386777788, 'batch_size': 128, 'dropout_rate': 0.17617965834678656, 'prior_mu': -0.0020656281070666684, 'prior_sigma': 0.08370850299582099, 'normalization': 'layer'}. Best is trial 896 with value: 0.4533553242683411.
Generating morgan_rdkit fingerprints...
Generated fingerprints with 2048 features for 841 molecules
Trial 1999: 5-fold CV loss = 0.4632
[I 2025-08-07 23:35:46,817] Trial 1999 finished with value: 0.4631883680820465 and parameters: {'fp_type': 'morgan_rdkit', 'combined_morgan_radius': 3, 'combined_morgan_nBits': 1024, 'combined_rdkit_maxPath': 7, 'combined_rdkit_nBits': 1024, 'num_hidden_layers': 3, 'hidden_dim_0': 256, 'hidden_dim_1': 1024, 'hidden_dim_2': 64, 'kl_weight': 0.00024005699439655823, 'lr': 0.005707553832668711, 'batch_size': 128, 'dropout_rate': 0.17262560904208485, 'prior_mu': -0.0363863781885588, 'prior_sigma': 0.10113744692626686, 'normalization': 'layer'}. Best is trial 896 with value: 0.4533553242683411.
Generating morgan_rdkit fingerprints...
Generated fingerprints with 2048 features for 841 molecules
Trial 2001: 5-fold CV loss = 0.5740
[I 2025-08-07 23:35:52,170] Trial 2001 finished with value: 0.5740097224712372 and parameters: {'fp_type': 'morgan_rdkit', 'combined_morgan_radius': 3, 'combined_morgan_nBits': 1024, 'combined_rdkit_maxPath': 7, 'combined_rdkit_nBits': 1024, 'num_hidden_layers': 3, 'hidden_dim_0': 1024, 'hidden_dim_1': 1024, 'hidden_dim_2': 64, 'kl_weight': 0.00022331996369486968, 'lr': 0.005817789045471239, 'batch_size': 128, 'dropout_rate': 0.13208035267760074, 'prior_mu': -0.03597015168724832, 'prior_sigma': 0.11179614798622552, 'normalization': 'layer'}. Best is trial 896 with value: 0.4533553242683411.
Generating morgan_rdkit fingerprints...
Generated fingerprints with 2048 features for 841 molecules
Trial 2002: 5-fold CV loss = 0.4640
[I 2025-08-07 23:35:58,968] Trial 2002 finished with value: 0.4640210628509521 and parameters: {'fp_type': 'morgan_rdkit', 'combined_morgan_radius': 3, 'combined_morgan_nBits': 1024, 'combined_rdkit_maxPath': 7, 'combined_rdkit_nBits': 1024, 'num_hidden_layers': 3, 'hidden_dim_0': 1024, 'hidden_dim_1': 1024, 'hidden_dim_2': 64, 'kl_weight': 0.0002330671421682842, 'lr': 0.008401481471442759, 'batch_size': 128, 'dropout_rate': 0.12562282204053246, 'prior_mu': -0.038335142344281085, 'prior_sigma': 0.11396052059146643, 'normalization': 'layer'}. Best is trial 896 with value: 0.4533553242683411.
Generating morgan_rdkit fingerprints...
Generated fingerprints with 2048 features for 841 molecules
Trial 2000: 5-fold CV loss = 0.4637
[I 2025-08-07 23:36:30,065] Trial 2000 finished with value: 0.46374534368515014 and parameters: {'fp_type': 'morgan_rdkit', 'combined_morgan_radius': 3, 'combined_morgan_nBits': 1024, 'combined_rdkit_maxPath': 7, 'combined_rdkit_nBits': 1024, 'num_hidden_layers': 3, 'hidden_dim_0': 256, 'hidden_dim_1': 1024, 'hidden_dim_2': 64, 'kl_weight': 0.00020273110239493676, 'lr': 0.005803084236927487, 'batch_size': 128, 'dropout_rate': 0.12612478361409818, 'prior_mu': -0.03699076499877532, 'prior_sigma': 0.08399523055463273, 'normalization': 'layer'}. Best is trial 896 with value: 0.4533553242683411.
Generating morgan_rdkit fingerprints...
Generated fingerprints with 2048 features for 841 molecules
Trial 2003: 5-fold CV loss = 0.4851
[I 2025-08-07 23:36:31,852] Trial 2003 finished with value: 0.48507627844810486 and parameters: {'fp_type': 'morgan_rdkit', 'combined_morgan_radius': 3, 'combined_morgan_nBits': 1024, 'combined_rdkit_maxPath': 7, 'combined_rdkit_nBits': 1024, 'num_hidden_layers': 3, 'hidden_dim_0': 1024, 'hidden_dim_1': 1024, 'hidden_dim_2': 64, 'kl_weight': 0.03493684624293617, 'lr': 0.008650749878532484, 'batch_size': 128, 'dropout_rate': 0.13163168502138126, 'prior_mu': -0.016264532517646473, 'prior_sigma': 0.08965121328378202, 'normalization': 'layer'}. Best is trial 896 with value: 0.4533553242683411.
Generating morgan_rdkit fingerprints...
Generated fingerprints with 2048 features for 841 molecules
Trial 2005: 5-fold CV loss = 0.5715
[I 2025-08-07 23:36:40,999] Trial 2005 finished with value: 0.5714788138866425 and parameters: {'fp_type': 'morgan_rdkit', 'combined_morgan_radius': 3, 'combined_morgan_nBits': 1024, 'combined_rdkit_maxPath': 7, 'combined_rdkit_nBits': 1024, 'num_hidden_layers': 3, 'hidden_dim_0': 256, 'hidden_dim_1': 64, 'hidden_dim_2': 128, 'kl_weight': 0.0002651064963245008, 'lr': 0.0099843033985147, 'batch_size': 128, 'dropout_rate': 0.16300027857538216, 'prior_mu': -0.014373537389543094, 'prior_sigma': 0.08810644280241388, 'normalization': 'layer'}. Best is trial 896 with value: 0.4533553242683411.
Generating morgan_rdkit fingerprints...
Generated fingerprints with 2048 features for 841 molecules
Trial 2004: 5-fold CV loss = 0.4729
[I 2025-08-07 23:36:51,493] Trial 2004 finished with value: 0.47292585372924806 and parameters: {'fp_type': 'morgan_rdkit', 'combined_morgan_radius': 3, 'combined_morgan_nBits': 1024, 'combined_rdkit_maxPath': 7, 'combined_rdkit_nBits': 1024, 'num_hidden_layers': 3, 'hidden_dim_0': 256, 'hidden_dim_1': 1024, 'hidden_dim_2': 64, 'kl_weight': 0.00026702947453054274, 'lr': 0.008279296120385976, 'batch_size': 128, 'dropout_rate': 0.12328401357316109, 'prior_mu': -0.01509274006181202, 'prior_sigma': 0.08843747151000053, 'normalization': 'layer'}. Best is trial 896 with value: 0.4533553242683411.
Generating morgan_rdkit fingerprints...
Generated fingerprints with 2048 features for 841 molecules
Trial 2008: 5-fold CV loss = 0.8177
[I 2025-08-07 23:37:06,722] Trial 2008 finished with value: 0.8177154064178467 and parameters: {'fp_type': 'morgan_rdkit', 'combined_morgan_radius': 3, 'combined_morgan_nBits': 1024, 'combined_rdkit_maxPath': 7, 'combined_rdkit_nBits': 1024, 'num_hidden_layers': 3, 'hidden_dim_0': 256, 'hidden_dim_1': 1024, 'hidden_dim_2': 1024, 'kl_weight': 0.0003195314165511375, 'lr': 0.007137372349927711, 'batch_size': 128, 'dropout_rate': 0.19451202480262914, 'prior_mu': -0.023212014897741103, 'prior_sigma': 0.07727655918887869, 'normalization': 'layer'}. Best is trial 896 with value: 0.4533553242683411.
Generating morgan_rdkit fingerprints...
Generated fingerprints with 1280 features for 841 molecules
Trial 2009: 5-fold CV loss = 0.8906
[I 2025-08-07 23:37:11,444] Trial 2009 finished with value: 0.8905819654464722 and parameters: {'fp_type': 'morgan_rdkit', 'combined_morgan_radius': 3, 'combined_morgan_nBits': 1024, 'combined_rdkit_maxPath': 7, 'combined_rdkit_nBits': 1024, 'num_hidden_layers': 3, 'hidden_dim_0': 256, 'hidden_dim_1': 1024, 'hidden_dim_2': 1024, 'kl_weight': 0.0003098329657062994, 'lr': 0.007281929773195941, 'batch_size': 128, 'dropout_rate': 0.14295499574422288, 'prior_mu': -0.02573115206441884, 'prior_sigma': 0.07759375105125982, 'normalization': 'layer'}. Best is trial 896 with value: 0.4533553242683411.
Generating morgan_rdkit fingerprints...
Generated fingerprints with 2048 features for 841 molecules
Trial 2007: 5-fold CV loss = 0.4739
[I 2025-08-07 23:37:17,793] Trial 2007 finished with value: 0.4738882601261139 and parameters: {'fp_type': 'morgan_rdkit', 'combined_morgan_radius': 3, 'combined_morgan_nBits': 1024, 'combined_rdkit_maxPath': 7, 'combined_rdkit_nBits': 1024, 'num_hidden_layers': 3, 'hidden_dim_0': 256, 'hidden_dim_1': 64, 'hidden_dim_2': 64, 'kl_weight': 0.0002637124002902087, 'lr': 0.007322454394324624, 'batch_size': 128, 'dropout_rate': 0.16464171239339553, 'prior_mu': -0.017237455505211437, 'prior_sigma': 0.07856997649119958, 'normalization': 'layer'}. Best is trial 896 with value: 0.4533553242683411.
Generating morgan_rdkit fingerprints...
Generated fingerprints with 1280 features for 841 molecules
Trial 2010: 5-fold CV loss = 0.5115
[I 2025-08-07 23:37:33,739] Trial 2010 finished with value: 0.5115279853343964 and parameters: {'fp_type': 'morgan_rdkit', 'combined_morgan_radius': 3, 'combined_morgan_nBits': 1024, 'combined_rdkit_maxPath': 7, 'combined_rdkit_nBits': 256, 'num_hidden_layers': 3, 'hidden_dim_0': 256, 'hidden_dim_1': 1024, 'hidden_dim_2': 64, 'kl_weight': 0.0003898875763752505, 'lr': 0.006772416443106847, 'batch_size': 128, 'dropout_rate': 0.14888682528782177, 'prior_mu': -0.04561760424355755, 'prior_sigma': 0.07131283747653168, 'normalization': 'layer'}. Best is trial 896 with value: 0.4533553242683411.
Generating morgan_rdkit fingerprints...
Generated fingerprints with 2048 features for 841 molecules
Trial 2013: 5-fold CV loss = 1.2689
[I 2025-08-07 23:37:40,746] Trial 2013 finished with value: 1.2688968181610107 and parameters: {'fp_type': 'morgan_rdkit', 'combined_morgan_radius': 3, 'combined_morgan_nBits': 1024, 'combined_rdkit_maxPath': 7, 'combined_rdkit_nBits': 1024, 'num_hidden_layers': 0, 'kl_weight': 0.00017578548789422193, 'lr': 0.006376305247780285, 'batch_size': 128, 'dropout_rate': 0.1560141473102799, 'prior_mu': -0.00471858218534766, 'prior_sigma': 0.10202011493878106, 'normalization': 'layer'}. Best is trial 896 with value: 0.4533553242683411.
Generating morgan_rdkit fingerprints...
Generated fingerprints with 2048 features for 841 molecules
Trial 2006: 5-fold CV loss = 0.6432
[I 2025-08-07 23:37:42,510] Trial 2006 finished with value: 0.6432075083255768 and parameters: {'fp_type': 'morgan_rdkit', 'combined_morgan_radius': 3, 'combined_morgan_nBits': 1024, 'combined_rdkit_maxPath': 7, 'combined_rdkit_nBits': 1024, 'num_hidden_layers': 3, 'hidden_dim_0': 256, 'hidden_dim_1': 64, 'hidden_dim_2': 64, 'kl_weight': 0.0002587345534774675, 'lr': 0.007319635464552864, 'batch_size': 128, 'dropout_rate': 0.14728951319749864, 'prior_mu': -0.02039950395075898, 'prior_sigma': 0.08896967001723623, 'normalization': 'layer'}. Best is trial 896 with value: 0.4533553242683411.
Generating morgan_rdkit fingerprints...
Generated fingerprints with 2048 features for 841 molecules
Trial 2012: 5-fold CV loss = 0.5022
[I 2025-08-07 23:37:54,802] Trial 2012 finished with value: 0.5021857261657715 and parameters: {'fp_type': 'morgan_rdkit', 'combined_morgan_radius': 3, 'combined_morgan_nBits': 1024, 'combined_rdkit_maxPath': 7, 'combined_rdkit_nBits': 256, 'num_hidden_layers': 3, 'hidden_dim_0': 256, 'hidden_dim_1': 1024, 'hidden_dim_2': 64, 'kl_weight': 0.00036859626464469413, 'lr': 0.006377344915007551, 'batch_size': 128, 'dropout_rate': 0.1465862853077366, 'prior_mu': -0.0440535061409965, 'prior_sigma': 0.07206831756087007, 'normalization': 'layer'}. Best is trial 896 with value: 0.4533553242683411.
Generating morgan_rdkit fingerprints...
Generated fingerprints with 2048 features for 841 molecules
Trial 2011: 5-fold CV loss = 0.4791
[I 2025-08-07 23:38:12,959] Trial 2011 finished with value: 0.4791184484958649 and parameters: {'fp_type': 'morgan_rdkit', 'combined_morgan_radius': 3, 'combined_morgan_nBits': 1024, 'combined_rdkit_maxPath': 7, 'combined_rdkit_nBits': 1024, 'num_hidden_layers': 3, 'hidden_dim_0': 256, 'hidden_dim_1': 1024, 'hidden_dim_2': 64, 'kl_weight': 0.00037677302541324443, 'lr': 0.006378078563863245, 'batch_size': 128, 'dropout_rate': 0.16650835092835503, 'prior_mu': -0.04251417248071178, 'prior_sigma': 0.09263395031962993, 'normalization': 'layer'}. Best is trial 896 with value: 0.4533553242683411.
Generating morgan fingerprints...
Generated fingerprints with 1024 features for 841 molecules
Trial 2014: 5-fold CV loss = 0.4630
[I 2025-08-07 23:38:22,004] Trial 2014 finished with value: 0.4630029559135437 and parameters: {'fp_type': 'morgan_rdkit', 'combined_morgan_radius': 3, 'combined_morgan_nBits': 1024, 'combined_rdkit_maxPath': 7, 'combined_rdkit_nBits': 1024, 'num_hidden_layers': 3, 'hidden_dim_0': 256, 'hidden_dim_1': 1024, 'hidden_dim_2': 64, 'kl_weight': 0.00038669608828001265, 'lr': 0.006362202566280283, 'batch_size': 128, 'dropout_rate': 0.14624141496455462, 'prior_mu': -0.030626904690983517, 'prior_sigma': 0.09376132956294037, 'normalization': 'layer'}. Best is trial 896 with value: 0.4533553242683411.
Generating morgan fingerprints...
Generated fingerprints with 1024 features for 841 molecules
Trial 2016: 5-fold CV loss = 0.5558
[I 2025-08-07 23:38:29,920] Trial 2016 finished with value: 0.5558363854885101 and parameters: {'fp_type': 'morgan_rdkit', 'combined_morgan_radius': 3, 'combined_morgan_nBits': 1024, 'combined_rdkit_maxPath': 7, 'combined_rdkit_nBits': 1024, 'num_hidden_layers': 3, 'hidden_dim_0': 256, 'hidden_dim_1': 1024, 'hidden_dim_2': 64, 'kl_weight': 0.0003030599397974024, 'lr': 0.005342948847347086, 'batch_size': 128, 'dropout_rate': 0.12306560293230678, 'prior_mu': -0.027592012790230293, 'prior_sigma': 0.09302823001437031, 'normalization': 'layer'}. Best is trial 896 with value: 0.4533553242683411.
Generating morgan fingerprints...
Generated fingerprints with 1024 features for 841 molecules
Trial 2018: 5-fold CV loss = 0.5216
[I 2025-08-07 23:38:42,788] Trial 2018 finished with value: 0.5215574979782105 and parameters: {'fp_type': 'morgan', 'morgan_only_radius': 2, 'morgan_only_nBits': 1024, 'num_hidden_layers': 3, 'hidden_dim_0': 256, 'hidden_dim_1': 1024, 'hidden_dim_2': 64, 'kl_weight': 0.00032080930727998436, 'lr': 0.005338157729178328, 'batch_size': 128, 'dropout_rate': 0.12520520362677093, 'prior_mu': -0.008114195105383337, 'prior_sigma': 0.08283840384869912, 'normalization': 'layer'}. Best is trial 896 with value: 0.4533553242683411.
Generating morgan_rdkit fingerprints...
Generated fingerprints with 2048 features for 841 molecules
Trial 2017: 5-fold CV loss = 0.5279
[I 2025-08-07 23:38:50,875] Trial 2017 finished with value: 0.5278538703918457 and parameters: {'fp_type': 'morgan', 'morgan_only_radius': 2, 'morgan_only_nBits': 1024, 'num_hidden_layers': 3, 'hidden_dim_0': 256, 'hidden_dim_1': 1024, 'hidden_dim_2': 64, 'kl_weight': 0.00031374844635484396, 'lr': 0.008240439944381466, 'batch_size': 128, 'dropout_rate': 0.13827312523038743, 'prior_mu': -0.02981674078708164, 'prior_sigma': 0.08205980268094593, 'normalization': 'layer'}. Best is trial 896 with value: 0.4533553242683411.
Generating morgan_rdkit fingerprints...
Generated fingerprints with 2048 features for 841 molecules
Trial 2019: 5-fold CV loss = 0.6725
[I 2025-08-07 23:38:58,098] Trial 2019 finished with value: 0.6724653899669647 and parameters: {'fp_type': 'morgan', 'morgan_only_radius': 2, 'morgan_only_nBits': 1024, 'num_hidden_layers': 3, 'hidden_dim_0': 256, 'hidden_dim_1': 1024, 'hidden_dim_2': 64, 'kl_weight': 0.0003271965430385795, 'lr': 0.004285954441074014, 'batch_size': 128, 'dropout_rate': 0.13674964101386555, 'prior_mu': -0.008828371845717201, 'prior_sigma': 0.1474431946823283, 'normalization': 'layer'}. Best is trial 896 with value: 0.4533553242683411.
Generating morgan_rdkit fingerprints...
Generated fingerprints with 2048 features for 841 molecules
Trial 2015: 5-fold CV loss = 0.5340
[I 2025-08-07 23:39:08,050] Trial 2015 finished with value: 0.5339840531349183 and parameters: {'fp_type': 'morgan_rdkit', 'combined_morgan_radius': 3, 'combined_morgan_nBits': 1024, 'combined_rdkit_maxPath': 7, 'combined_rdkit_nBits': 1024, 'num_hidden_layers': 3, 'hidden_dim_0': 256, 'hidden_dim_1': 1024, 'hidden_dim_2': 64, 'kl_weight': 0.00015123361671334786, 'lr': 0.0064059431298002754, 'batch_size': 128, 'dropout_rate': 0.14046352201805934, 'prior_mu': -0.04334326921988835, 'prior_sigma': 0.08266961926314392, 'normalization': 'layer'}. Best is trial 896 with value: 0.4533553242683411.
Generating morgan_rdkit fingerprints...
Generated fingerprints with 2048 features for 841 molecules
Trial 2020: 5-fold CV loss = 0.4735
[I 2025-08-07 23:39:24,553] Trial 2020 finished with value: 0.4734653830528259 and parameters: {'fp_type': 'morgan_rdkit', 'combined_morgan_radius': 3, 'combined_morgan_nBits': 1024, 'combined_rdkit_maxPath': 7, 'combined_rdkit_nBits': 1024, 'num_hidden_layers': 3, 'hidden_dim_0': 256, 'hidden_dim_1': 1024, 'hidden_dim_2': 64, 'kl_weight': 0.00029219223576365863, 'lr': 0.008250503515575054, 'batch_size': 64, 'dropout_rate': 0.16902219603690546, 'prior_mu': 0.019373574014828025, 'prior_sigma': 0.09700300158196165, 'normalization': 'layer'}. Best is trial 896 with value: 0.4533553242683411.
Generating morgan_rdkit fingerprints...
Generated fingerprints with 2048 features for 841 molecules
Trial 2022: 5-fold CV loss = 0.4791
[I 2025-08-07 23:39:33,636] Trial 2022 finished with value: 0.47908854484558105 and parameters: {'fp_type': 'morgan_rdkit', 'combined_morgan_radius': 3, 'combined_morgan_nBits': 1024, 'combined_rdkit_maxPath': 5, 'combined_rdkit_nBits': 1024, 'num_hidden_layers': 3, 'hidden_dim_0': 256, 'hidden_dim_1': 1024, 'hidden_dim_2': 64, 'kl_weight': 0.00022972263639172214, 'lr': 0.0079259176680185, 'batch_size': 64, 'dropout_rate': 0.1719258686475453, 'prior_mu': 0.020717977913705842, 'prior_sigma': 0.07488602698520434, 'normalization': 'layer'}. Best is trial 896 with value: 0.4533553242683411.
Generating morgan_rdkit fingerprints...
Generated fingerprints with 2048 features for 841 molecules
Trial 2021: 5-fold CV loss = 0.8068
[I 2025-08-07 23:39:46,101] Trial 2021 finished with value: 0.8068440079689025 and parameters: {'fp_type': 'morgan_rdkit', 'combined_morgan_radius': 3, 'combined_morgan_nBits': 1024, 'combined_rdkit_maxPath': 5, 'combined_rdkit_nBits': 1024, 'num_hidden_layers': 3, 'hidden_dim_0': 256, 'hidden_dim_1': 128, 'hidden_dim_2': 64, 'kl_weight': 0.00021361224876249133, 'lr': 0.00045276619046739745, 'batch_size': 64, 'dropout_rate': 0.2286003319334321, 'prior_mu': -0.012843101795839428, 'prior_sigma': 0.08562973262429248, 'normalization': 'layer'}. Best is trial 896 with value: 0.4533553242683411.
Generating rdkit fingerprints...
Generated fingerprints with 1024 features for 841 molecules
Trial 2024: 5-fold CV loss = 0.6132
[I 2025-08-07 23:39:50,751] Trial 2024 finished with value: 0.6132113695144653 and parameters: {'fp_type': 'morgan_rdkit', 'combined_morgan_radius': 3, 'combined_morgan_nBits': 1024, 'combined_rdkit_maxPath': 7, 'combined_rdkit_nBits': 1024, 'num_hidden_layers': 3, 'hidden_dim_0': 256, 'hidden_dim_1': 128, 'hidden_dim_2': 64, 'kl_weight': 0.000209005102869104, 'lr': 0.009270211788314307, 'batch_size': 128, 'dropout_rate': 0.1574575672950469, 'prior_mu': -0.033773926464744655, 'prior_sigma': 0.07469715893029086, 'normalization': 'layer'}. Best is trial 896 with value: 0.4533553242683411.
Generating rdkit fingerprints...
Generated fingerprints with 1024 features for 841 molecules
Trial 2027: 5-fold CV loss = 0.7784
[I 2025-08-07 23:40:11,866] Trial 2027 finished with value: 0.7783979892730712 and parameters: {'fp_type': 'rdkit', 'rdkit_only_maxPath': 6, 'rdkit_only_nBits': 1024, 'num_hidden_layers': 3, 'hidden_dim_0': 256, 'hidden_dim_1': 1024, 'hidden_dim_2': 64, 'kl_weight': 0.00039763932571235957, 'lr': 0.007476808183199458, 'batch_size': 128, 'dropout_rate': 0.13116822561169336, 'prior_mu': -0.022022061326076224, 'prior_sigma': 0.11972831334906685, 'normalization': 'none'}. Best is trial 896 with value: 0.4533553242683411.
Generating morgan_rdkit fingerprints...
Generated fingerprints with 2048 features for 841 molecules
Trial 2025: 5-fold CV loss = 0.6008
