[I 2025-08-07 19:59:51,236] Trial 886 finished with value: 0.5574519038200378 and parameters: {'fp_type': 'morgan_rdkit', 'combined_morgan_radius': 3, 'combined_morgan_nBits': 1024, 'combined_rdkit_maxPath': 8, 'combined_rdkit_nBits': 1024, 'num_hidden_layers': 3, 'hidden_dim_0': 256, 'hidden_dim_1': 1024, 'hidden_dim_2': 64, 'kl_weight': 0.00034208992732490313, 'lr': 0.005679455036428214, 'batch_size': 128, 'dropout_rate': 0.10776171169018597, 'prior_mu': -0.02722067862119871, 'prior_sigma': 0.1041439810441962, 'normalization': 'layer'}. Best is trial 587 with value: 0.4552353322505951.
Generating morgan_rdkit fingerprints...
Generated fingerprints with 2048 features for 841 molecules
Trial 887: 5-fold CV loss = 0.4715
[I 2025-08-07 20:00:20,998] Trial 887 finished with value: 0.47153803110122683 and parameters: {'fp_type': 'morgan_rdkit', 'combined_morgan_radius': 3, 'combined_morgan_nBits': 1024, 'combined_rdkit_maxPath': 8, 'combined_rdkit_nBits': 1024, 'num_hidden_layers': 3, 'hidden_dim_0': 256, 'hidden_dim_1': 1024, 'hidden_dim_2': 64, 'kl_weight': 0.00034357808082672686, 'lr': 0.004223996118807412, 'batch_size': 128, 'dropout_rate': 0.1347797384748195, 'prior_mu': -0.04353294479457028, 'prior_sigma': 0.10335473794300448, 'normalization': 'layer'}. Best is trial 587 with value: 0.4552353322505951.
Generating morgan_rdkit fingerprints...
Generated fingerprints with 2048 features for 841 molecules
Trial 889: 5-fold CV loss = 0.4690
[I 2025-08-07 20:00:26,696] Trial 889 finished with value: 0.46902536749839785 and parameters: {'fp_type': 'morgan_rdkit', 'combined_morgan_radius': 3, 'combined_morgan_nBits': 1024, 'combined_rdkit_maxPath': 7, 'combined_rdkit_nBits': 1024, 'num_hidden_layers': 3, 'hidden_dim_0': 256, 'hidden_dim_1': 1024, 'hidden_dim_2': 64, 'kl_weight': 0.00025059100053164573, 'lr': 0.007645456213363715, 'batch_size': 128, 'dropout_rate': 0.13490687451469482, 'prior_mu': -0.04525056910996089, 'prior_sigma': 0.0967472256914447, 'normalization': 'layer'}. Best is trial 587 with value: 0.4552353322505951.
Generating morgan_rdkit fingerprints...
Generated fingerprints with 2048 features for 841 molecules
Trial 888: 5-fold CV loss = 0.5672
[I 2025-08-07 20:00:30,365] Trial 888 finished with value: 0.5671887457370758 and parameters: {'fp_type': 'morgan_rdkit', 'combined_morgan_radius': 3, 'combined_morgan_nBits': 1024, 'combined_rdkit_maxPath': 8, 'combined_rdkit_nBits': 1024, 'num_hidden_layers': 3, 'hidden_dim_0': 128, 'hidden_dim_1': 1024, 'hidden_dim_2': 64, 'kl_weight': 0.0003416027054670397, 'lr': 0.007472038573449109, 'batch_size': 128, 'dropout_rate': 0.1069189208516789, 'prior_mu': -0.04228515130359559, 'prior_sigma': 0.10411080566681079, 'normalization': 'layer'}. Best is trial 587 with value: 0.4552353322505951.
Generating morgan_rdkit fingerprints...
Generated fingerprints with 2048 features for 841 molecules
Trial 891: 5-fold CV loss = 0.8733
[I 2025-08-07 20:00:51,339] Trial 891 finished with value: 0.8732962965965271 and parameters: {'fp_type': 'morgan_rdkit', 'combined_morgan_radius': 3, 'combined_morgan_nBits': 1024, 'combined_rdkit_maxPath': 7, 'combined_rdkit_nBits': 1024, 'num_hidden_layers': 3, 'hidden_dim_0': 256, 'hidden_dim_1': 1024, 'hidden_dim_2': 64, 'kl_weight': 0.0004154691859638965, 'lr': 0.00027202629420466484, 'batch_size': 128, 'dropout_rate': 0.10570675136861651, 'prior_mu': -0.0026918079488767697, 'prior_sigma': 0.09044223214540191, 'normalization': 'layer'}. Best is trial 587 with value: 0.4552353322505951.
Generating morgan_rdkit fingerprints...
Generated fingerprints with 2048 features for 841 molecules
Trial 884: 5-fold CV loss = 0.5024
[I 2025-08-07 20:00:54,967] Trial 884 finished with value: 0.5024279057979584 and parameters: {'fp_type': 'morgan_rdkit', 'combined_morgan_radius': 3, 'combined_morgan_nBits': 1024, 'combined_rdkit_maxPath': 8, 'combined_rdkit_nBits': 1024, 'num_hidden_layers': 3, 'hidden_dim_0': 256, 'hidden_dim_1': 1024, 'hidden_dim_2': 64, 'kl_weight': 0.0031308837044025572, 'lr': 0.006290313256524974, 'batch_size': 128, 'dropout_rate': 0.43613400387472123, 'prior_mu': -0.15886525514239958, 'prior_sigma': 0.09804914660113406, 'normalization': 'layer'}. Best is trial 587 with value: 0.4552353322505951.
Generating morgan_rdkit fingerprints...
Generated fingerprints with 2048 features for 841 molecules
Trial 890: 5-fold CV loss = 0.4662
[I 2025-08-07 20:01:03,510] Trial 890 finished with value: 0.4661971390247345 and parameters: {'fp_type': 'morgan_rdkit', 'combined_morgan_radius': 3, 'combined_morgan_nBits': 1024, 'combined_rdkit_maxPath': 7, 'combined_rdkit_nBits': 1024, 'num_hidden_layers': 3, 'hidden_dim_0': 128, 'hidden_dim_1': 1024, 'hidden_dim_2': 64, 'kl_weight': 0.0002460162705973902, 'lr': 0.007602790128507878, 'batch_size': 128, 'dropout_rate': 0.13573614521048044, 'prior_mu': -0.0058174864021120765, 'prior_sigma': 0.09085656935787917, 'normalization': 'layer'}. Best is trial 587 with value: 0.4552353322505951.
Generating morgan_rdkit fingerprints...
Generated fingerprints with 2048 features for 841 molecules
Trial 892: 5-fold CV loss = 0.4668
[I 2025-08-07 20:01:25,191] Trial 892 finished with value: 0.46681239604949953 and parameters: {'fp_type': 'morgan_rdkit', 'combined_morgan_radius': 3, 'combined_morgan_nBits': 1024, 'combined_rdkit_maxPath': 7, 'combined_rdkit_nBits': 1024, 'num_hidden_layers': 3, 'hidden_dim_0': 256, 'hidden_dim_1': 1024, 'hidden_dim_2': 64, 'kl_weight': 0.00041154089974607507, 'lr': 0.006382034275978553, 'batch_size': 128, 'dropout_rate': 0.13956191698976045, 'prior_mu': -0.006877213657392221, 'prior_sigma': 0.08861726229357411, 'normalization': 'layer'}. Best is trial 587 with value: 0.4552353322505951.
Generating morgan_rdkit fingerprints...
Generated fingerprints with 2048 features for 841 molecules
Trial 893: 5-fold CV loss = 0.4613
[I 2025-08-07 20:01:35,085] Trial 893 finished with value: 0.4613331496715546 and parameters: {'fp_type': 'morgan_rdkit', 'combined_morgan_radius': 3, 'combined_morgan_nBits': 1024, 'combined_rdkit_maxPath': 7, 'combined_rdkit_nBits': 1024, 'num_hidden_layers': 3, 'hidden_dim_0': 256, 'hidden_dim_1': 1024, 'hidden_dim_2': 64, 'kl_weight': 0.00025458636182672137, 'lr': 0.006336286588839564, 'batch_size': 128, 'dropout_rate': 0.1390734187340095, 'prior_mu': -0.031147453617398804, 'prior_sigma': 0.1144766449743997, 'normalization': 'layer'}. Best is trial 587 with value: 0.4552353322505951.
Generating morgan_rdkit fingerprints...
Generated fingerprints with 2048 features for 841 molecules
Trial 895: 5-fold CV loss = 0.4856
[I 2025-08-07 20:01:50,031] Trial 895 finished with value: 0.4855960726737976 and parameters: {'fp_type': 'morgan_rdkit', 'combined_morgan_radius': 3, 'combined_morgan_nBits': 1024, 'combined_rdkit_maxPath': 7, 'combined_rdkit_nBits': 1024, 'num_hidden_layers': 3, 'hidden_dim_0': 256, 'hidden_dim_1': 1024, 'hidden_dim_2': 64, 'kl_weight': 0.000401654706177302, 'lr': 0.006833608686228907, 'batch_size': 128, 'dropout_rate': 0.059277658743777134, 'prior_mu': -0.028530146327387568, 'prior_sigma': 0.11335821196691839, 'normalization': 'layer'}. Best is trial 587 with value: 0.4552353322505951.
Generating morgan_rdkit fingerprints...
Generated fingerprints with 2048 features for 841 molecules
Trial 897: 5-fold CV loss = 0.4775
[I 2025-08-07 20:02:14,574] Trial 897 finished with value: 0.4775278389453888 and parameters: {'fp_type': 'morgan_rdkit', 'combined_morgan_radius': 3, 'combined_morgan_nBits': 1024, 'combined_rdkit_maxPath': 6, 'combined_rdkit_nBits': 1024, 'num_hidden_layers': 3, 'hidden_dim_0': 256, 'hidden_dim_1': 1024, 'hidden_dim_2': 64, 'kl_weight': 0.00024358480505647738, 'lr': 0.00693054295476069, 'batch_size': 128, 'dropout_rate': 0.12692266325089926, 'prior_mu': -0.03348039252025983, 'prior_sigma': 0.11516407282695726, 'normalization': 'layer'}. Best is trial 587 with value: 0.4552353322505951.
Generating morgan_rdkit fingerprints...
Generated fingerprints with 2048 features for 841 molecules
Trial 898: 5-fold CV loss = 0.7713
[I 2025-08-07 20:02:19,362] Trial 898 finished with value: 0.7713382959365844 and parameters: {'fp_type': 'morgan_rdkit', 'combined_morgan_radius': 3, 'combined_morgan_nBits': 1024, 'combined_rdkit_maxPath': 6, 'combined_rdkit_nBits': 1024, 'num_hidden_layers': 3, 'hidden_dim_0': 256, 'hidden_dim_1': 1024, 'hidden_dim_2': 64, 'kl_weight': 0.0002651554210804561, 'lr': 0.00808703740528496, 'batch_size': 128, 'dropout_rate': 0.12101389593781235, 'prior_mu': -0.036259228456182804, 'prior_sigma': 0.12066091995627598, 'normalization': 'none'}. Best is trial 587 with value: 0.4552353322505951.
Generating morgan_rdkit fingerprints...
Generated fingerprints with 2048 features for 841 molecules
Trial 894: 5-fold CV loss = 0.4651
[I 2025-08-07 20:02:23,878] Trial 894 finished with value: 0.4651148021221161 and parameters: {'fp_type': 'morgan_rdkit', 'combined_morgan_radius': 3, 'combined_morgan_nBits': 1024, 'combined_rdkit_maxPath': 7, 'combined_rdkit_nBits': 1024, 'num_hidden_layers': 3, 'hidden_dim_0': 256, 'hidden_dim_1': 1024, 'hidden_dim_2': 64, 'kl_weight': 0.0003980282682224587, 'lr': 0.00812389023527562, 'batch_size': 128, 'dropout_rate': 0.14093308124313306, 'prior_mu': 0.011533627453484446, 'prior_sigma': 0.08859819822633809, 'normalization': 'layer'}. Best is trial 587 with value: 0.4552353322505951.
Generating morgan_rdkit fingerprints...
Generated fingerprints with 2048 features for 841 molecules
Trial 896: 5-fold CV loss = 0.4534
[I 2025-08-07 20:02:30,144] Trial 896 finished with value: 0.4533553242683411 and parameters: {'fp_type': 'morgan_rdkit', 'combined_morgan_radius': 3, 'combined_morgan_nBits': 1024, 'combined_rdkit_maxPath': 7, 'combined_rdkit_nBits': 1024, 'num_hidden_layers': 3, 'hidden_dim_0': 256, 'hidden_dim_1': 1024, 'hidden_dim_2': 64, 'kl_weight': 0.00025947860303592507, 'lr': 0.008273967055130194, 'batch_size': 128, 'dropout_rate': 0.1292726019913086, 'prior_mu': -0.027188868237925323, 'prior_sigma': 0.11356166797056175, 'normalization': 'layer'}. Best is trial 896 with value: 0.4533553242683411.
Generating morgan_rdkit fingerprints...
Generated fingerprints with 2048 features for 841 molecules
Trial 899: 5-fold CV loss = 0.7691
[I 2025-08-07 20:02:43,516] Trial 899 finished with value: 0.7690580904483795 and parameters: {'fp_type': 'morgan_rdkit', 'combined_morgan_radius': 3, 'combined_morgan_nBits': 1024, 'combined_rdkit_maxPath': 7, 'combined_rdkit_nBits': 1024, 'num_hidden_layers': 3, 'hidden_dim_0': 256, 'hidden_dim_1': 1024, 'hidden_dim_2': 64, 'kl_weight': 0.0002603277010601649, 'lr': 0.008247906199077696, 'batch_size': 128, 'dropout_rate': 0.12962778903070774, 'prior_mu': -0.037828796762722626, 'prior_sigma': 0.11693480760039221, 'normalization': 'none'}. Best is trial 896 with value: 0.4533553242683411.
Generating morgan_rdkit fingerprints...
Generated fingerprints with 1280 features for 841 molecules
Trial 903: 5-fold CV loss = 0.6549
[I 2025-08-07 20:03:24,676] Trial 903 finished with value: 0.6548717558383942 and parameters: {'fp_type': 'morgan_rdkit', 'combined_morgan_radius': 3, 'combined_morgan_nBits': 1024, 'combined_rdkit_maxPath': 7, 'combined_rdkit_nBits': 256, 'num_hidden_layers': 3, 'hidden_dim_0': 1024, 'hidden_dim_1': 64, 'hidden_dim_2': 256, 'kl_weight': 0.0002434109725367407, 'lr': 0.007188567368481873, 'batch_size': 64, 'dropout_rate': 0.11341731129186422, 'prior_mu': -0.024175747014296638, 'prior_sigma': 0.11403633948666156, 'normalization': 'layer'}. Best is trial 896 with value: 0.4533553242683411.
Generating morgan_rdkit fingerprints...
Generated fingerprints with 2048 features for 841 molecules
Trial 900: 5-fold CV loss = 0.4694
[I 2025-08-07 20:03:31,370] Trial 900 finished with value: 0.4693861186504364 and parameters: {'fp_type': 'morgan_rdkit', 'combined_morgan_radius': 3, 'combined_morgan_nBits': 1024, 'combined_rdkit_maxPath': 7, 'combined_rdkit_nBits': 1024, 'num_hidden_layers': 3, 'hidden_dim_0': 1024, 'hidden_dim_1': 1024, 'hidden_dim_2': 256, 'kl_weight': 0.00027545966489087384, 'lr': 0.008334300409675971, 'batch_size': 64, 'dropout_rate': 0.14351810326371345, 'prior_mu': -0.027293690560696117, 'prior_sigma': 0.12428501782493707, 'normalization': 'layer'}. Best is trial 896 with value: 0.4533553242683411.
Generating morgan_rdkit fingerprints...
Generated fingerprints with 2048 features for 841 molecules
Trial 904: 5-fold CV loss = 0.8825
[I 2025-08-07 20:03:36,381] Trial 904 finished with value: 0.8824663043022156 and parameters: {'fp_type': 'morgan_rdkit', 'combined_morgan_radius': 3, 'combined_morgan_nBits': 1024, 'combined_rdkit_maxPath': 7, 'combined_rdkit_nBits': 1024, 'num_hidden_layers': 3, 'hidden_dim_0': 256, 'hidden_dim_1': 256, 'hidden_dim_2': 512, 'kl_weight': 0.0002725267844802658, 'lr': 0.0063306178867433265, 'batch_size': 128, 'dropout_rate': 0.46043987297009087, 'prior_mu': -0.026550697567224543, 'prior_sigma': 0.11650942804675532, 'normalization': 'layer'}. Best is trial 896 with value: 0.4533553242683411.
Generating morgan_rdkit fingerprints...
Generated fingerprints with 2048 features for 841 molecules
Trial 902: 5-fold CV loss = 0.4697
[I 2025-08-07 20:03:53,000] Trial 902 finished with value: 0.46967745423316953 and parameters: {'fp_type': 'morgan_rdkit', 'combined_morgan_radius': 3, 'combined_morgan_nBits': 1024, 'combined_rdkit_maxPath': 7, 'combined_rdkit_nBits': 1024, 'num_hidden_layers': 3, 'hidden_dim_0': 256, 'hidden_dim_1': 64, 'hidden_dim_2': 64, 'kl_weight': 0.0002504933830065737, 'lr': 0.007322441758576195, 'batch_size': 64, 'dropout_rate': 0.12788314443988358, 'prior_mu': -0.023988537889130666, 'prior_sigma': 0.11951835393043574, 'normalization': 'layer'}. Best is trial 896 with value: 0.4533553242683411.
Generating morgan_rdkit fingerprints...
Generated fingerprints with 2048 features for 841 molecules
Trial 906: 5-fold CV loss = 0.4619
[I 2025-08-07 20:04:15,493] Trial 906 finished with value: 0.461908632516861 and parameters: {'fp_type': 'morgan_rdkit', 'combined_morgan_radius': 3, 'combined_morgan_nBits': 1024, 'combined_rdkit_maxPath': 7, 'combined_rdkit_nBits': 1024, 'num_hidden_layers': 3, 'hidden_dim_0': 256, 'hidden_dim_1': 1024, 'hidden_dim_2': 64, 'kl_weight': 0.0003048144760398712, 'lr': 0.007171535138391862, 'batch_size': 128, 'dropout_rate': 0.12798443454072517, 'prior_mu': -0.014590264469453969, 'prior_sigma': 0.10348555270123563, 'normalization': 'layer'}. Best is trial 896 with value: 0.4533553242683411.
Generating morgan_rdkit fingerprints...
Generated fingerprints with 2048 features for 841 molecules
Trial 905: 5-fold CV loss = 0.4871
[I 2025-08-07 20:04:29,794] Trial 905 finished with value: 0.4870682120323181 and parameters: {'fp_type': 'morgan_rdkit', 'combined_morgan_radius': 3, 'combined_morgan_nBits': 1024, 'combined_rdkit_maxPath': 7, 'combined_rdkit_nBits': 1024, 'num_hidden_layers': 3, 'hidden_dim_0': 256, 'hidden_dim_1': 256, 'hidden_dim_2': 64, 'kl_weight': 0.04870100875794476, 'lr': 0.006368957355204309, 'batch_size': 128, 'dropout_rate': 0.07972264272991889, 'prior_mu': -0.01631547112954462, 'prior_sigma': 0.12218877814669993, 'normalization': 'layer'}. Best is trial 896 with value: 0.4533553242683411.
Generating morgan_rdkit fingerprints...
Generated fingerprints with 2048 features for 841 molecules
Trial 901: 5-fold CV loss = 0.6416
[I 2025-08-07 20:04:35,364] Trial 901 finished with value: 0.64158895611763 and parameters: {'fp_type': 'morgan_rdkit', 'combined_morgan_radius': 3, 'combined_morgan_nBits': 1024, 'combined_rdkit_maxPath': 7, 'combined_rdkit_nBits': 1024, 'num_hidden_layers': 3, 'hidden_dim_0': 256, 'hidden_dim_1': 64, 'hidden_dim_2': 256, 'kl_weight': 0.0002729663365272893, 'lr': 0.007112786427518005, 'batch_size': 64, 'dropout_rate': 0.12675810353532058, 'prior_mu': -0.0495816263970512, 'prior_sigma': 0.11362324917029701, 'normalization': 'layer'}. Best is trial 896 with value: 0.4533553242683411.
Generating morgan_rdkit fingerprints...
Generated fingerprints with 2048 features for 841 molecules
Trial 908: 5-fold CV loss = 0.4789
[I 2025-08-07 20:04:55,581] Trial 908 finished with value: 0.47889145016670226 and parameters: {'fp_type': 'morgan_rdkit', 'combined_morgan_radius': 3, 'combined_morgan_nBits': 1024, 'combined_rdkit_maxPath': 7, 'combined_rdkit_nBits': 1024, 'num_hidden_layers': 3, 'hidden_dim_0': 256, 'hidden_dim_1': 1024, 'hidden_dim_2': 64, 'kl_weight': 0.0002220755229907063, 'lr': 0.006000489539048582, 'batch_size': 128, 'dropout_rate': 0.0786480605382194, 'prior_mu': -0.019048640750717976, 'prior_sigma': 0.11216837016094332, 'normalization': 'layer'}. Best is trial 896 with value: 0.4533553242683411.
Generating morgan_rdkit fingerprints...
Generated fingerprints with 2048 features for 841 molecules
Trial 907: 5-fold CV loss = 0.4676
[I 2025-08-07 20:04:56,886] Trial 907 finished with value: 0.4676254212856293 and parameters: {'fp_type': 'morgan_rdkit', 'combined_morgan_radius': 3, 'combined_morgan_nBits': 1024, 'combined_rdkit_maxPath': 7, 'combined_rdkit_nBits': 1024, 'num_hidden_layers': 3, 'hidden_dim_0': 256, 'hidden_dim_1': 1024, 'hidden_dim_2': 64, 'kl_weight': 0.00021762731977488143, 'lr': 0.006687142650348148, 'batch_size': 128, 'dropout_rate': 0.12047577013217647, 'prior_mu': -0.01412298851781182, 'prior_sigma': 0.11026736315383547, 'normalization': 'layer'}. Best is trial 896 with value: 0.4533553242683411.
Generating morgan_rdkit fingerprints...
Generated fingerprints with 2048 features for 841 molecules
Trial 909: 5-fold CV loss = 0.5667
[I 2025-08-07 20:05:09,507] Trial 909 finished with value: 0.5667027056217193 and parameters: {'fp_type': 'morgan_rdkit', 'combined_morgan_radius': 3, 'combined_morgan_nBits': 1024, 'combined_rdkit_maxPath': 7, 'combined_rdkit_nBits': 1024, 'num_hidden_layers': 3, 'hidden_dim_0': 256, 'hidden_dim_1': 1024, 'hidden_dim_2': 64, 'kl_weight': 0.00021719829326019978, 'lr': 0.005995239203590281, 'batch_size': 128, 'dropout_rate': 0.10949156184255174, 'prior_mu': -0.011941066916811132, 'prior_sigma': 0.11187041058172044, 'normalization': 'layer'}. Best is trial 896 with value: 0.4533553242683411.
Generating morgan_rdkit fingerprints...
Generated fingerprints with 2048 features for 841 molecules
Trial 911: 5-fold CV loss = 0.5097
[I 2025-08-07 20:05:21,242] Trial 911 finished with value: 0.5097236037254333 and parameters: {'fp_type': 'morgan_rdkit', 'combined_morgan_radius': 3, 'combined_morgan_nBits': 1024, 'combined_rdkit_maxPath': 7, 'combined_rdkit_nBits': 1024, 'num_hidden_layers': 1, 'hidden_dim_0': 256, 'kl_weight': 0.00020803995852117072, 'lr': 0.006660299381404568, 'batch_size': 128, 'dropout_rate': 0.115589000618747, 'prior_mu': -0.010549945581269544, 'prior_sigma': 0.11017468679254643, 'normalization': 'layer'}. Best is trial 896 with value: 0.4533553242683411.
Generating morgan_rdkit fingerprints...
Generated fingerprints with 2048 features for 841 molecules
Trial 914: 5-fold CV loss = 1.3146
[I 2025-08-07 20:05:28,965] Trial 914 finished with value: 1.3146358013153077 and parameters: {'fp_type': 'morgan_rdkit', 'combined_morgan_radius': 3, 'combined_morgan_nBits': 1024, 'combined_rdkit_maxPath': 7, 'combined_rdkit_nBits': 1024, 'num_hidden_layers': 0, 'kl_weight': 0.00031304606716954286, 'lr': 0.007642826540907619, 'batch_size': 128, 'dropout_rate': 0.13319862752238443, 'prior_mu': 0.0032162811647408023, 'prior_sigma': 0.10763905789879516, 'normalization': 'layer'}. Best is trial 896 with value: 0.4533553242683411.
Generating morgan_rdkit fingerprints...
Generated fingerprints with 2048 features for 841 molecules
Trial 912: 5-fold CV loss = 0.5094
[I 2025-08-07 20:05:36,932] Trial 912 finished with value: 0.5093526124954224 and parameters: {'fp_type': 'morgan_rdkit', 'combined_morgan_radius': 3, 'combined_morgan_nBits': 1024, 'combined_rdkit_maxPath': 7, 'combined_rdkit_nBits': 1024, 'num_hidden_layers': 1, 'hidden_dim_0': 256, 'kl_weight': 0.0003099022106231525, 'lr': 0.0077903372313703305, 'batch_size': 128, 'dropout_rate': 0.10830836249093674, 'prior_mu': -0.029124393745491688, 'prior_sigma': 0.11086413960043436, 'normalization': 'layer'}. Best is trial 896 with value: 0.4533553242683411.
Generating morgan_rdkit fingerprints...
Generated fingerprints with 2048 features for 841 molecules
Trial 910: 5-fold CV loss = 0.5534
[I 2025-08-07 20:05:52,010] Trial 910 finished with value: 0.5534046590328217 and parameters: {'fp_type': 'morgan_rdkit', 'combined_morgan_radius': 3, 'combined_morgan_nBits': 1024, 'combined_rdkit_maxPath': 7, 'combined_rdkit_nBits': 1024, 'num_hidden_layers': 3, 'hidden_dim_0': 256, 'hidden_dim_1': 1024, 'hidden_dim_2': 64, 'kl_weight': 0.0002193320663324065, 'lr': 0.005920531487361995, 'batch_size': 128, 'dropout_rate': 0.11402791194984026, 'prior_mu': -0.010213574059649481, 'prior_sigma': 0.10922773113703746, 'normalization': 'layer'}. Best is trial 896 with value: 0.4533553242683411.
Generating morgan_rdkit fingerprints...
Generated fingerprints with 2048 features for 841 molecules
Trial 913: 5-fold CV loss = 0.4724
[I 2025-08-07 20:05:54,771] Trial 913 finished with value: 0.47238590121269225 and parameters: {'fp_type': 'morgan_rdkit', 'combined_morgan_radius': 3, 'combined_morgan_nBits': 1024, 'combined_rdkit_maxPath': 7, 'combined_rdkit_nBits': 1024, 'num_hidden_layers': 3, 'hidden_dim_0': 256, 'hidden_dim_1': 1024, 'hidden_dim_2': 64, 'kl_weight': 0.0003079134271460986, 'lr': 0.007656251342707945, 'batch_size': 128, 'dropout_rate': 0.10322909049304269, 'prior_mu': -0.030095253691012888, 'prior_sigma': 0.10948068500562626, 'normalization': 'layer'}. Best is trial 896 with value: 0.4533553242683411.
Generating morgan_rdkit fingerprints...
Generated fingerprints with 2048 features for 841 molecules
Trial 915: 5-fold CV loss = 0.4689
