[I 2025-08-07 18:46:39,725] Trial 524 finished with value: 0.45850964784622195 and parameters: {'fp_type': 'morgan_rdkit', 'combined_morgan_radius': 3, 'combined_morgan_nBits': 1024, 'combined_rdkit_maxPath': 7, 'combined_rdkit_nBits': 1024, 'num_hidden_layers': 3, 'hidden_dim_0': 256, 'hidden_dim_1': 1024, 'hidden_dim_2': 64, 'kl_weight': 0.00040685388904282107, 'lr': 0.007678570176968462, 'batch_size': 128, 'dropout_rate': 0.13949239724898105, 'prior_mu': -0.019691257155700085, 'prior_sigma': 0.09317920769946604, 'normalization': 'layer'}. Best is trial 505 with value: 0.4575017273426056.
Generating morgan_rdkit fingerprints...
Generated fingerprints with 2048 features for 841 molecules
Trial 526: 5-fold CV loss = 0.4623
[I 2025-08-07 18:47:15,377] Trial 526 finished with value: 0.4623455047607422 and parameters: {'fp_type': 'morgan_rdkit', 'combined_morgan_radius': 3, 'combined_morgan_nBits': 1024, 'combined_rdkit_maxPath': 7, 'combined_rdkit_nBits': 1024, 'num_hidden_layers': 3, 'hidden_dim_0': 256, 'hidden_dim_1': 1024, 'hidden_dim_2': 64, 'kl_weight': 0.00040164086580416787, 'lr': 0.005265837820113603, 'batch_size': 128, 'dropout_rate': 0.13723369025986298, 'prior_mu': -0.01446004154738244, 'prior_sigma': 0.08117298682081046, 'normalization': 'layer'}. Best is trial 505 with value: 0.4575017273426056.
Generating morgan_rdkit fingerprints...
Generated fingerprints with 2048 features for 841 molecules
Trial 529: 5-fold CV loss = 0.4735
[I 2025-08-07 18:47:20,152] Trial 529 finished with value: 0.4735009431838989 and parameters: {'fp_type': 'morgan_rdkit', 'combined_morgan_radius': 3, 'combined_morgan_nBits': 1024, 'combined_rdkit_maxPath': 7, 'combined_rdkit_nBits': 1024, 'num_hidden_layers': 3, 'hidden_dim_0': 256, 'hidden_dim_1': 1024, 'hidden_dim_2': 64, 'kl_weight': 0.00040831253867917714, 'lr': 0.005828303430846993, 'batch_size': 128, 'dropout_rate': 0.16003223903536629, 'prior_mu': -0.025597018711150776, 'prior_sigma': 0.0986558275744352, 'normalization': 'layer'}. Best is trial 505 with value: 0.4575017273426056.
Generating morgan_rdkit fingerprints...
Generated fingerprints with 2048 features for 841 molecules
Trial 528: 5-fold CV loss = 0.4637
[I 2025-08-07 18:47:24,937] Trial 528 finished with value: 0.4637145161628723 and parameters: {'fp_type': 'morgan_rdkit', 'combined_morgan_radius': 3, 'combined_morgan_nBits': 1024, 'combined_rdkit_maxPath': 7, 'combined_rdkit_nBits': 1024, 'num_hidden_layers': 3, 'hidden_dim_0': 256, 'hidden_dim_1': 1024, 'hidden_dim_2': 64, 'kl_weight': 0.00023280252790448128, 'lr': 0.0057434835536167815, 'batch_size': 128, 'dropout_rate': 0.15704096597124645, 'prior_mu': -0.03802107371665786, 'prior_sigma': 0.09827936832465185, 'normalization': 'layer'}. Best is trial 505 with value: 0.4575017273426056.
Generating morgan_rdkit fingerprints...
Generated fingerprints with 2048 features for 841 molecules
Trial 531: 5-fold CV loss = 0.5461
[I 2025-08-07 18:47:49,809] Trial 531 finished with value: 0.5460845232009888 and parameters: {'fp_type': 'morgan_rdkit', 'combined_morgan_radius': 3, 'combined_morgan_nBits': 1024, 'combined_rdkit_maxPath': 7, 'combined_rdkit_nBits': 1024, 'num_hidden_layers': 3, 'hidden_dim_0': 256, 'hidden_dim_1': 1024, 'hidden_dim_2': 64, 'kl_weight': 0.0005552482517345692, 'lr': 0.007629006728660896, 'batch_size': 128, 'dropout_rate': 0.11170598378404767, 'prior_mu': -0.03876643241814206, 'prior_sigma': 0.07960197311606576, 'normalization': 'layer'}. Best is trial 505 with value: 0.4575017273426056.
Generating morgan_rdkit fingerprints...
Generated fingerprints with 2048 features for 841 molecules
Trial 532: 5-fold CV loss = 0.5392
[I 2025-08-07 18:47:58,619] Trial 532 finished with value: 0.5392411649227142 and parameters: {'fp_type': 'morgan_rdkit', 'combined_morgan_radius': 3, 'combined_morgan_nBits': 1024, 'combined_rdkit_maxPath': 7, 'combined_rdkit_nBits': 1024, 'num_hidden_layers': 3, 'hidden_dim_0': 256, 'hidden_dim_1': 1024, 'hidden_dim_2': 64, 'kl_weight': 0.0005355402929389429, 'lr': 0.0077174340653787515, 'batch_size': 128, 'dropout_rate': 0.13121894437339243, 'prior_mu': -0.03711168779387561, 'prior_sigma': 0.1008635610205079, 'normalization': 'layer'}. Best is trial 505 with value: 0.4575017273426056.
Generating morgan_rdkit fingerprints...
Generated fingerprints with 2048 features for 841 molecules
Trial 527: 5-fold CV loss = 0.4715
[I 2025-08-07 18:48:00,023] Trial 527 finished with value: 0.4714564085006714 and parameters: {'fp_type': 'morgan_rdkit', 'combined_morgan_radius': 3, 'combined_morgan_nBits': 1024, 'combined_rdkit_maxPath': 7, 'combined_rdkit_nBits': 1024, 'num_hidden_layers': 3, 'hidden_dim_0': 256, 'hidden_dim_1': 1024, 'hidden_dim_2': 64, 'kl_weight': 0.0003903332463587227, 'lr': 0.00794252394121308, 'batch_size': 128, 'dropout_rate': 0.14251062599493372, 'prior_mu': -0.014809748199838196, 'prior_sigma': 0.07984069141709305, 'normalization': 'layer'}. Best is trial 505 with value: 0.4575017273426056.
Generating morgan_rdkit fingerprints...
Generated fingerprints with 2048 features for 841 molecules
Trial 530: 5-fold CV loss = 0.4612
[I 2025-08-07 18:48:19,942] Trial 530 finished with value: 0.4611871182918549 and parameters: {'fp_type': 'morgan_rdkit', 'combined_morgan_radius': 3, 'combined_morgan_nBits': 1024, 'combined_rdkit_maxPath': 7, 'combined_rdkit_nBits': 1024, 'num_hidden_layers': 3, 'hidden_dim_0': 256, 'hidden_dim_1': 1024, 'hidden_dim_2': 64, 'kl_weight': 0.00033500244772842426, 'lr': 0.005725689087981818, 'batch_size': 128, 'dropout_rate': 0.11657301355771041, 'prior_mu': -0.021663218277396736, 'prior_sigma': 0.0994834208842107, 'normalization': 'layer'}. Best is trial 505 with value: 0.4575017273426056.
Generating morgan_rdkit fingerprints...
Generated fingerprints with 2048 features for 841 molecules
Trial 534: 5-fold CV loss = 0.4636
[I 2025-08-07 18:48:39,670] Trial 534 finished with value: 0.46360352635383606 and parameters: {'fp_type': 'morgan_rdkit', 'combined_morgan_radius': 3, 'combined_morgan_nBits': 1024, 'combined_rdkit_maxPath': 7, 'combined_rdkit_nBits': 1024, 'num_hidden_layers': 3, 'hidden_dim_0': 256, 'hidden_dim_1': 1024, 'hidden_dim_2': 64, 'kl_weight': 0.00022925755948731703, 'lr': 0.006439630649574361, 'batch_size': 128, 'dropout_rate': 0.15494622177653233, 'prior_mu': -0.025735791434709138, 'prior_sigma': 0.09258800240725641, 'normalization': 'layer'}. Best is trial 505 with value: 0.4575017273426056.
Generating morgan_rdkit fingerprints...
Generated fingerprints with 2048 features for 841 molecules
Trial 533: 5-fold CV loss = 0.4634
[I 2025-08-07 18:48:42,421] Trial 533 finished with value: 0.46339505910873413 and parameters: {'fp_type': 'morgan_rdkit', 'combined_morgan_radius': 3, 'combined_morgan_nBits': 1024, 'combined_rdkit_maxPath': 7, 'combined_rdkit_nBits': 1024, 'num_hidden_layers': 3, 'hidden_dim_0': 256, 'hidden_dim_1': 1024, 'hidden_dim_2': 64, 'kl_weight': 0.00022597376402285843, 'lr': 0.0051215766530428265, 'batch_size': 128, 'dropout_rate': 0.1313292074927238, 'prior_mu': -0.026991411245180882, 'prior_sigma': 0.0990021416406056, 'normalization': 'layer'}. Best is trial 505 with value: 0.4575017273426056.
Generating morgan_rdkit fingerprints...
Generated fingerprints with 2048 features for 841 molecules
Trial 538: 5-fold CV loss = 0.8886
[I 2025-08-07 18:48:58,094] Trial 538 finished with value: 0.8886173963546753 and parameters: {'fp_type': 'morgan_rdkit', 'combined_morgan_radius': 3, 'combined_morgan_nBits': 1024, 'combined_rdkit_maxPath': 7, 'combined_rdkit_nBits': 1024, 'num_hidden_layers': 3, 'hidden_dim_0': 256, 'hidden_dim_1': 1024, 'hidden_dim_2': 512, 'kl_weight': 0.00023025831317605947, 'lr': 0.006801982058892914, 'batch_size': 128, 'dropout_rate': 0.12240345562248423, 'prior_mu': -0.04657862973795824, 'prior_sigma': 0.09619768060681481, 'normalization': 'layer'}. Best is trial 505 with value: 0.4575017273426056.
Generating morgan_rdkit fingerprints...
Generated fingerprints with 2048 features for 841 molecules
Trial 536: 5-fold CV loss = 0.7304
[I 2025-08-07 18:49:06,294] Trial 536 finished with value: 0.7304347574710846 and parameters: {'fp_type': 'morgan_rdkit', 'combined_morgan_radius': 3, 'combined_morgan_nBits': 1024, 'combined_rdkit_maxPath': 7, 'combined_rdkit_nBits': 1024, 'num_hidden_layers': 3, 'hidden_dim_0': 256, 'hidden_dim_1': 1024, 'hidden_dim_2': 512, 'kl_weight': 0.00030948650755347894, 'lr': 0.006281195949818314, 'batch_size': 128, 'dropout_rate': 0.11055809685530822, 'prior_mu': -0.0269763016650889, 'prior_sigma': 0.09342381004076074, 'normalization': 'layer'}. Best is trial 505 with value: 0.4575017273426056.
Generating morgan_rdkit fingerprints...
Generated fingerprints with 2048 features for 841 molecules
Trial 537: 5-fold CV loss = 0.7210
[I 2025-08-07 18:49:13,367] Trial 537 finished with value: 0.7210401475429535 and parameters: {'fp_type': 'morgan_rdkit', 'combined_morgan_radius': 3, 'combined_morgan_nBits': 1024, 'combined_rdkit_maxPath': 7, 'combined_rdkit_nBits': 1024, 'num_hidden_layers': 3, 'hidden_dim_0': 256, 'hidden_dim_1': 1024, 'hidden_dim_2': 512, 'kl_weight': 0.0002338260363231932, 'lr': 0.006610311901370416, 'batch_size': 128, 'dropout_rate': 0.11554809361341371, 'prior_mu': -0.042758699807505504, 'prior_sigma': 0.09713819634461995, 'normalization': 'layer'}. Best is trial 505 with value: 0.4575017273426056.
Generating morgan_rdkit fingerprints...
Generated fingerprints with 2048 features for 841 molecules
Trial 535: 5-fold CV loss = 0.7417
[I 2025-08-07 18:49:22,295] Trial 535 finished with value: 0.7416744768619538 and parameters: {'fp_type': 'morgan_rdkit', 'combined_morgan_radius': 3, 'combined_morgan_nBits': 1024, 'combined_rdkit_maxPath': 7, 'combined_rdkit_nBits': 1024, 'num_hidden_layers': 3, 'hidden_dim_0': 256, 'hidden_dim_1': 1024, 'hidden_dim_2': 512, 'kl_weight': 0.00023768671251266668, 'lr': 0.005005693848929526, 'batch_size': 128, 'dropout_rate': 0.159470664460176, 'prior_mu': -0.0447855055554452, 'prior_sigma': 0.09196661406057394, 'normalization': 'layer'}. Best is trial 505 with value: 0.4575017273426056.
Generating morgan_rdkit fingerprints...
Generated fingerprints with 2048 features for 841 molecules
Trial 539: 5-fold CV loss = 0.5488
[I 2025-08-07 18:49:44,262] Trial 539 finished with value: 0.5487793922424317 and parameters: {'fp_type': 'morgan_rdkit', 'combined_morgan_radius': 3, 'combined_morgan_nBits': 1024, 'combined_rdkit_maxPath': 7, 'combined_rdkit_nBits': 1024, 'num_hidden_layers': 3, 'hidden_dim_0': 256, 'hidden_dim_1': 1024, 'hidden_dim_2': 64, 'kl_weight': 0.00024026240438943607, 'lr': 0.0052306121873650965, 'batch_size': 128, 'dropout_rate': 0.13318319347057186, 'prior_mu': -0.027602713220086464, 'prior_sigma': 0.1067037997751872, 'normalization': 'layer'}. Best is trial 505 with value: 0.4575017273426056.
Generating morgan_rdkit fingerprints...
Generated fingerprints with 1536 features for 841 molecules
Trial 541: 5-fold CV loss = 0.4750
[I 2025-08-07 18:49:58,072] Trial 541 finished with value: 0.47495427131652834 and parameters: {'fp_type': 'morgan_rdkit', 'combined_morgan_radius': 3, 'combined_morgan_nBits': 1024, 'combined_rdkit_maxPath': 7, 'combined_rdkit_nBits': 1024, 'num_hidden_layers': 3, 'hidden_dim_0': 256, 'hidden_dim_1': 1024, 'hidden_dim_2': 64, 'kl_weight': 0.00022370277477939518, 'lr': 0.005155078613390487, 'batch_size': 128, 'dropout_rate': 0.16034726103142866, 'prior_mu': -0.025262092014605768, 'prior_sigma': 0.1073226815821307, 'normalization': 'layer'}. Best is trial 505 with value: 0.4575017273426056.
Generating morgan_rdkit fingerprints...
Generated fingerprints with 1536 features for 841 molecules
Trial 540: 5-fold CV loss = 0.4762
[I 2025-08-07 18:50:07,743] Trial 540 finished with value: 0.47615734934806825 and parameters: {'fp_type': 'morgan_rdkit', 'combined_morgan_radius': 3, 'combined_morgan_nBits': 1024, 'combined_rdkit_maxPath': 7, 'combined_rdkit_nBits': 1024, 'num_hidden_layers': 3, 'hidden_dim_0': 256, 'hidden_dim_1': 1024, 'hidden_dim_2': 64, 'kl_weight': 0.00022206771346630546, 'lr': 0.005192854856647863, 'batch_size': 128, 'dropout_rate': 0.11948908409718946, 'prior_mu': -0.027985599562913813, 'prior_sigma': 0.10287876092006182, 'normalization': 'layer'}. Best is trial 505 with value: 0.4575017273426056.
Generating morgan_rdkit fingerprints...
Generated fingerprints with 1536 features for 841 molecules
Trial 543: 5-fold CV loss = 0.5063
[I 2025-08-07 18:50:22,615] Trial 543 finished with value: 0.5062975287437439 and parameters: {'fp_type': 'morgan_rdkit', 'combined_morgan_radius': 3, 'combined_morgan_nBits': 1024, 'combined_rdkit_maxPath': 7, 'combined_rdkit_nBits': 512, 'num_hidden_layers': 3, 'hidden_dim_0': 256, 'hidden_dim_1': 1024, 'hidden_dim_2': 64, 'kl_weight': 0.00022219694456032514, 'lr': 0.007148054433409874, 'batch_size': 128, 'dropout_rate': 0.12387572324701462, 'prior_mu': -0.026513542715304414, 'prior_sigma': 0.1024070493254018, 'normalization': 'layer'}. Best is trial 505 with value: 0.4575017273426056.
Generating morgan_rdkit fingerprints...
Generated fingerprints with 2048 features for 841 molecules
Trial 544: 5-fold CV loss = 0.5107
[I 2025-08-07 18:50:35,809] Trial 544 finished with value: 0.5107130825519561 and parameters: {'fp_type': 'morgan_rdkit', 'combined_morgan_radius': 3, 'combined_morgan_nBits': 1024, 'combined_rdkit_maxPath': 7, 'combined_rdkit_nBits': 512, 'num_hidden_layers': 3, 'hidden_dim_0': 256, 'hidden_dim_1': 1024, 'hidden_dim_2': 64, 'kl_weight': 0.0002890798646129097, 'lr': 0.007131257424796845, 'batch_size': 128, 'dropout_rate': 0.12593100468687085, 'prior_mu': -0.0615628601707718, 'prior_sigma': 0.10449176137233011, 'normalization': 'layer'}. Best is trial 505 with value: 0.4575017273426056.
Generating morgan_rdkit fingerprints...
Generated fingerprints with 2048 features for 841 molecules
Trial 545: 5-fold CV loss = 0.6457
[I 2025-08-07 18:50:53,820] Trial 545 finished with value: 0.6457129836082458 and parameters: {'fp_type': 'morgan_rdkit', 'combined_morgan_radius': 3, 'combined_morgan_nBits': 1024, 'combined_rdkit_maxPath': 7, 'combined_rdkit_nBits': 512, 'num_hidden_layers': 3, 'hidden_dim_0': 256, 'hidden_dim_1': 1024, 'hidden_dim_2': 256, 'kl_weight': 0.00030088557457652154, 'lr': 0.007303791654908973, 'batch_size': 128, 'dropout_rate': 0.1306206163803663, 'prior_mu': -0.03361294599368777, 'prior_sigma': 0.09947295331703715, 'normalization': 'layer'}. Best is trial 505 with value: 0.4575017273426056.
Generating morgan_rdkit fingerprints...
Generated fingerprints with 2048 features for 841 molecules
Trial 546: 5-fold CV loss = 0.6426
[I 2025-08-07 18:51:05,875] Trial 546 finished with value: 0.6426411628723144 and parameters: {'fp_type': 'morgan_rdkit', 'combined_morgan_radius': 3, 'combined_morgan_nBits': 1024, 'combined_rdkit_maxPath': 7, 'combined_rdkit_nBits': 1024, 'num_hidden_layers': 3, 'hidden_dim_0': 256, 'hidden_dim_1': 1024, 'hidden_dim_2': 256, 'kl_weight': 0.00030241744086030635, 'lr': 0.005975195715670102, 'batch_size': 128, 'dropout_rate': 0.1379061940457261, 'prior_mu': -0.009742611143879292, 'prior_sigma': 0.09843433566990202, 'normalization': 'layer'}. Best is trial 505 with value: 0.4575017273426056.
Generating morgan_rdkit fingerprints...
Generated fingerprints with 2048 features for 841 molecules
Trial 542: 5-fold CV loss = 0.4660
[I 2025-08-07 18:51:15,093] Trial 542 finished with value: 0.46600325107574464 and parameters: {'fp_type': 'morgan_rdkit', 'combined_morgan_radius': 3, 'combined_morgan_nBits': 1024, 'combined_rdkit_maxPath': 7, 'combined_rdkit_nBits': 1024, 'num_hidden_layers': 3, 'hidden_dim_0': 256, 'hidden_dim_1': 1024, 'hidden_dim_2': 64, 'kl_weight': 0.0002253965494548516, 'lr': 0.0053297745325676365, 'batch_size': 128, 'dropout_rate': 0.1292244622905658, 'prior_mu': -0.026525392930809986, 'prior_sigma': 0.10634239556854144, 'normalization': 'layer'}. Best is trial 505 with value: 0.4575017273426056.
Generating morgan_rdkit fingerprints...
Generated fingerprints with 2048 features for 841 molecules
Trial 547: 5-fold CV loss = 0.4582
[I 2025-08-07 18:51:20,676] Trial 547 finished with value: 0.4581935465335846 and parameters: {'fp_type': 'morgan_rdkit', 'combined_morgan_radius': 3, 'combined_morgan_nBits': 1024, 'combined_rdkit_maxPath': 7, 'combined_rdkit_nBits': 1024, 'num_hidden_layers': 3, 'hidden_dim_0': 256, 'hidden_dim_1': 1024, 'hidden_dim_2': 64, 'kl_weight': 0.0003162353018631688, 'lr': 0.005971136545816129, 'batch_size': 128, 'dropout_rate': 0.15154828595744418, 'prior_mu': -0.03547558101736863, 'prior_sigma': 0.09820795848293891, 'normalization': 'layer'}. Best is trial 505 with value: 0.4575017273426056.
Generating morgan_rdkit fingerprints...
Generated fingerprints with 2048 features for 841 molecules
Trial 549: 5-fold CV loss = 0.4672
[I 2025-08-07 18:51:47,689] Trial 549 finished with value: 0.4671989858150482 and parameters: {'fp_type': 'morgan_rdkit', 'combined_morgan_radius': 3, 'combined_morgan_nBits': 1024, 'combined_rdkit_maxPath': 7, 'combined_rdkit_nBits': 1024, 'num_hidden_layers': 3, 'hidden_dim_0': 256, 'hidden_dim_1': 1024, 'hidden_dim_2': 64, 'kl_weight': 0.0003465243224787159, 'lr': 0.006222010906957668, 'batch_size': 128, 'dropout_rate': 0.15098643628290437, 'prior_mu': -0.009607708308227172, 'prior_sigma': 0.09040968333357002, 'normalization': 'layer'}. Best is trial 505 with value: 0.4575017273426056.
Generating morgan_rdkit fingerprints...
Generated fingerprints with 2048 features for 841 molecules
Trial 548: 5-fold CV loss = 0.4589
[I 2025-08-07 18:51:52,040] Trial 548 finished with value: 0.4589195787906647 and parameters: {'fp_type': 'morgan_rdkit', 'combined_morgan_radius': 3, 'combined_morgan_nBits': 1024, 'combined_rdkit_maxPath': 7, 'combined_rdkit_nBits': 1024, 'num_hidden_layers': 3, 'hidden_dim_0': 256, 'hidden_dim_1': 1024, 'hidden_dim_2': 64, 'kl_weight': 0.0003341149370894001, 'lr': 0.006015677477803322, 'batch_size': 128, 'dropout_rate': 0.15058428154611234, 'prior_mu': -0.008931447784760242, 'prior_sigma': 0.09324560368938653, 'normalization': 'layer'}. Best is trial 505 with value: 0.4575017273426056.
Generating morgan_rdkit fingerprints...
Generated fingerprints with 2048 features for 841 molecules
Trial 551: 5-fold CV loss = 0.4741
[I 2025-08-07 18:52:02,759] Trial 551 finished with value: 0.47407216429710386 and parameters: {'fp_type': 'morgan_rdkit', 'combined_morgan_radius': 3, 'combined_morgan_nBits': 1024, 'combined_rdkit_maxPath': 7, 'combined_rdkit_nBits': 1024, 'num_hidden_layers': 3, 'hidden_dim_0': 256, 'hidden_dim_1': 1024, 'hidden_dim_2': 64, 'kl_weight': 0.0003498181208891978, 'lr': 0.006051854813296765, 'batch_size': 128, 'dropout_rate': 0.10287472007801718, 'prior_mu': -0.01881492470992418, 'prior_sigma': 0.11150607662543245, 'normalization': 'layer'}. Best is trial 505 with value: 0.4575017273426056.
Generating morgan_rdkit fingerprints...
Generated fingerprints with 2048 features for 841 molecules
Trial 550: 5-fold CV loss = 0.5579
[I 2025-08-07 18:52:35,590] Trial 550 finished with value: 0.5579140245914459 and parameters: {'fp_type': 'morgan_rdkit', 'combined_morgan_radius': 3, 'combined_morgan_nBits': 1024, 'combined_rdkit_maxPath': 7, 'combined_rdkit_nBits': 1024, 'num_hidden_layers': 3, 'hidden_dim_0': 256, 'hidden_dim_1': 1024, 'hidden_dim_2': 64, 'kl_weight': 0.0002526072441757149, 'lr': 0.005752378528499371, 'batch_size': 128, 'dropout_rate': 0.14855627790249012, 'prior_mu': -0.038247896661207786, 'prior_sigma': 0.09048152925159572, 'normalization': 'layer'}. Best is trial 505 with value: 0.4575017273426056.
Generating morgan_rdkit fingerprints...
Generated fingerprints with 2048 features for 841 molecules
Trial 554: 5-fold CV loss = 0.4657
[I 2025-08-07 18:52:38,889] Trial 554 finished with value: 0.46571284532546997 and parameters: {'fp_type': 'morgan_rdkit', 'combined_morgan_radius': 3, 'combined_morgan_nBits': 1024, 'combined_rdkit_maxPath': 7, 'combined_rdkit_nBits': 1024, 'num_hidden_layers': 3, 'hidden_dim_0': 256, 'hidden_dim_1': 1024, 'hidden_dim_2': 64, 'kl_weight': 0.0003851370840263833, 'lr': 0.006558735928618546, 'batch_size': 128, 'dropout_rate': 0.14869029164529443, 'prior_mu': -0.021597394335415795, 'prior_sigma': 0.09334027580788029, 'normalization': 'layer'}. Best is trial 505 with value: 0.4575017273426056.
Generating morgan_rdkit fingerprints...
Generated fingerprints with 2048 features for 841 molecules
Trial 552: 5-fold CV loss = 0.4724
[I 2025-08-07 18:52:41,516] Trial 552 finished with value: 0.47241983413696287 and parameters: {'fp_type': 'morgan_rdkit', 'combined_morgan_radius': 3, 'combined_morgan_nBits': 1024, 'combined_rdkit_maxPath': 7, 'combined_rdkit_nBits': 1024, 'num_hidden_layers': 3, 'hidden_dim_0': 256, 'hidden_dim_1': 1024, 'hidden_dim_2': 64, 'kl_weight': 0.0003630908782738695, 'lr': 0.005988602524052268, 'batch_size': 128, 'dropout_rate': 0.1485193480826945, 'prior_mu': -0.01852123254732, 'prior_sigma': 0.11269935128843885, 'normalization': 'layer'}. Best is trial 505 with value: 0.4575017273426056.
Generating morgan_rdkit fingerprints...
Generated fingerprints with 2048 features for 841 molecules
Trial 553: 5-fold CV loss = 0.4621
[I 2025-08-07 18:52:53,475] Trial 553 finished with value: 0.462060010433197 and parameters: {'fp_type': 'morgan_rdkit', 'combined_morgan_radius': 3, 'combined_morgan_nBits': 1024, 'combined_rdkit_maxPath': 7, 'combined_rdkit_nBits': 1024, 'num_hidden_layers': 3, 'hidden_dim_0': 256, 'hidden_dim_1': 1024, 'hidden_dim_2': 64, 'kl_weight': 0.0004247445275484994, 'lr': 0.006121583284753959, 'batch_size': 128, 'dropout_rate': 0.14800416477708211, 'prior_mu': -0.0193652228496716, 'prior_sigma': 0.09410127744023296, 'normalization': 'layer'}. Best is trial 505 with value: 0.4575017273426056.
Generating morgan_rdkit fingerprints...
Generated fingerprints with 2048 features for 841 molecules
Trial 556: 5-fold CV loss = 0.4826
