[I 2025-08-08 01:56:51,102] Trial 2686 finished with value: 0.4666595458984375 and parameters: {'fp_type': 'morgan_rdkit', 'combined_morgan_radius': 3, 'combined_morgan_nBits': 1024, 'combined_rdkit_maxPath': 7, 'combined_rdkit_nBits': 1024, 'num_hidden_layers': 3, 'hidden_dim_0': 256, 'hidden_dim_1': 1024, 'hidden_dim_2': 64, 'kl_weight': 0.00013333285283471867, 'lr': 0.008070200741118468, 'batch_size': 128, 'dropout_rate': 0.08282837449735113, 'prior_mu': -0.06033956269440882, 'prior_sigma': 0.09733552965031815, 'normalization': 'layer'}. Best is trial 896 with value: 0.4533553242683411.
Generating morgan_rdkit fingerprints...
Generated fingerprints with 2048 features for 841 molecules
Trial 2687: 5-fold CV loss = 0.8096
[I 2025-08-08 01:56:55,853] Trial 2687 finished with value: 0.8096271872520446 and parameters: {'fp_type': 'morgan_rdkit', 'combined_morgan_radius': 3, 'combined_morgan_nBits': 1024, 'combined_rdkit_maxPath': 7, 'combined_rdkit_nBits': 1024, 'num_hidden_layers': 3, 'hidden_dim_0': 256, 'hidden_dim_1': 1024, 'hidden_dim_2': 64, 'kl_weight': 0.00013374678584012967, 'lr': 0.006412317090559841, 'batch_size': 128, 'dropout_rate': 0.079925331906591, 'prior_mu': -0.039373554546019124, 'prior_sigma': 0.1835855777934693, 'normalization': 'layer'}. Best is trial 896 with value: 0.4533553242683411.
Generating morgan_rdkit fingerprints...
Generated fingerprints with 2048 features for 841 molecules
Trial 2688: 5-fold CV loss = 1.1637
[I 2025-08-08 01:57:06,415] Trial 2688 finished with value: 1.16372652053833 and parameters: {'fp_type': 'morgan_rdkit', 'combined_morgan_radius': 3, 'combined_morgan_nBits': 1024, 'combined_rdkit_maxPath': 7, 'combined_rdkit_nBits': 1024, 'num_hidden_layers': 0, 'kl_weight': 0.00013223424989956015, 'lr': 0.0061961290380139365, 'batch_size': 128, 'dropout_rate': 0.13052780093944674, 'prior_mu': -0.07563690155218603, 'prior_sigma': 0.09656287069714584, 'normalization': 'layer'}. Best is trial 896 with value: 0.4533553242683411.
Generating morgan_rdkit fingerprints...
Generated fingerprints with 2048 features for 841 molecules
Trial 2690: 5-fold CV loss = 0.5689
[I 2025-08-08 01:57:28,942] Trial 2690 finished with value: 0.5689363241195678 and parameters: {'fp_type': 'morgan_rdkit', 'combined_morgan_radius': 3, 'combined_morgan_nBits': 1024, 'combined_rdkit_maxPath': 7, 'combined_rdkit_nBits': 1024, 'num_hidden_layers': 1, 'hidden_dim_0': 1024, 'kl_weight': 0.00020981828255132556, 'lr': 0.007258807530316278, 'batch_size': 128, 'dropout_rate': 0.10719873676287191, 'prior_mu': 0.017611055755975186, 'prior_sigma': 0.10684383309945768, 'normalization': 'layer'}. Best is trial 896 with value: 0.4533553242683411.
Generating morgan_rdkit fingerprints...
Generated fingerprints with 2048 features for 841 molecules
Trial 2689: 5-fold CV loss = 0.4643
[I 2025-08-08 01:57:38,489] Trial 2689 finished with value: 0.4643292486667633 and parameters: {'fp_type': 'morgan_rdkit', 'combined_morgan_radius': 3, 'combined_morgan_nBits': 1024, 'combined_rdkit_maxPath': 7, 'combined_rdkit_nBits': 1024, 'num_hidden_layers': 3, 'hidden_dim_0': 1024, 'hidden_dim_1': 1024, 'hidden_dim_2': 64, 'kl_weight': 0.0002138831442494557, 'lr': 0.006181536977838331, 'batch_size': 128, 'dropout_rate': 0.13164645733972766, 'prior_mu': -0.037414621358712555, 'prior_sigma': 0.07707519598156164, 'normalization': 'layer'}. Best is trial 896 with value: 0.4533553242683411.
Generating morgan_rdkit fingerprints...
Generated fingerprints with 2048 features for 841 molecules
Trial 2691: 5-fold CV loss = 0.4663
[I 2025-08-08 01:57:52,166] Trial 2691 finished with value: 0.46628065705299376 and parameters: {'fp_type': 'morgan_rdkit', 'combined_morgan_radius': 3, 'combined_morgan_nBits': 1024, 'combined_rdkit_maxPath': 7, 'combined_rdkit_nBits': 1024, 'num_hidden_layers': 3, 'hidden_dim_0': 1024, 'hidden_dim_1': 1024, 'hidden_dim_2': 64, 'kl_weight': 0.00021078548076673334, 'lr': 0.009968875444860794, 'batch_size': 128, 'dropout_rate': 0.029847188717636086, 'prior_mu': 0.014899423504855026, 'prior_sigma': 0.07628910734789734, 'normalization': 'layer'}. Best is trial 896 with value: 0.4533553242683411.
Generating morgan_rdkit fingerprints...
Generated fingerprints with 2048 features for 841 molecules
Trial 2692: 5-fold CV loss = 0.4795
[I 2025-08-08 01:57:57,619] Trial 2692 finished with value: 0.4794957280158997 and parameters: {'fp_type': 'morgan_rdkit', 'combined_morgan_radius': 3, 'combined_morgan_nBits': 1024, 'combined_rdkit_maxPath': 6, 'combined_rdkit_nBits': 1024, 'num_hidden_layers': 3, 'hidden_dim_0': 256, 'hidden_dim_1': 1024, 'hidden_dim_2': 64, 'kl_weight': 0.0003388062926683712, 'lr': 0.008757905257269853, 'batch_size': 128, 'dropout_rate': 0.09626060865514749, 'prior_mu': 0.00653647805683869, 'prior_sigma': 0.07742991405176815, 'normalization': 'layer'}. Best is trial 896 with value: 0.4533553242683411.
Generating morgan_rdkit fingerprints...
Generated fingerprints with 2048 features for 841 molecules
Trial 2678: 5-fold CV loss = 0.8720
[I 2025-08-08 01:58:02,122] Trial 2678 finished with value: 0.8720057129859924 and parameters: {'fp_type': 'rdkit', 'rdkit_only_maxPath': 7, 'rdkit_only_nBits': 256, 'num_hidden_layers': 3, 'hidden_dim_0': 128, 'hidden_dim_1': 1024, 'hidden_dim_2': 1024, 'kl_weight': 0.0004958537967442789, 'lr': 0.00859072149524657, 'batch_size': 32, 'dropout_rate': 0.06754756479682608, 'prior_mu': 0.00114122797203179, 'prior_sigma': 0.08335059810401893, 'normalization': 'layer'}. Best is trial 896 with value: 0.4533553242683411.
Generating morgan_rdkit fingerprints...
Generated fingerprints with 2048 features for 841 molecules
Trial 2693: 5-fold CV loss = 0.4772
[I 2025-08-08 01:58:10,898] Trial 2693 finished with value: 0.477240777015686 and parameters: {'fp_type': 'morgan_rdkit', 'combined_morgan_radius': 3, 'combined_morgan_nBits': 1024, 'combined_rdkit_maxPath': 6, 'combined_rdkit_nBits': 1024, 'num_hidden_layers': 3, 'hidden_dim_0': 256, 'hidden_dim_1': 1024, 'hidden_dim_2': 64, 'kl_weight': 0.0002721181347088354, 'lr': 0.008646564987750427, 'batch_size': 128, 'dropout_rate': 0.09648671319434356, 'prior_mu': 0.009368036860742144, 'prior_sigma': 0.07185865402827617, 'normalization': 'layer'}. Best is trial 896 with value: 0.4533553242683411.
Generating morgan_rdkit fingerprints...
Generated fingerprints with 2048 features for 841 molecules
Trial 2695: 5-fold CV loss = 0.4627
[I 2025-08-08 01:58:38,612] Trial 2695 finished with value: 0.4627446591854095 and parameters: {'fp_type': 'morgan_rdkit', 'combined_morgan_radius': 3, 'combined_morgan_nBits': 1024, 'combined_rdkit_maxPath': 7, 'combined_rdkit_nBits': 1024, 'num_hidden_layers': 3, 'hidden_dim_0': 256, 'hidden_dim_1': 1024, 'hidden_dim_2': 64, 'kl_weight': 0.0002721694970242821, 'lr': 0.006803860238852287, 'batch_size': 128, 'dropout_rate': 0.11099168297233684, 'prior_mu': -0.05166253638292756, 'prior_sigma': 0.09109038033270156, 'normalization': 'layer'}. Best is trial 896 with value: 0.4533553242683411.
Generating morgan_rdkit fingerprints...
Generated fingerprints with 2048 features for 841 molecules
Trial 2694: 5-fold CV loss = 0.4692
[I 2025-08-08 01:58:50,140] Trial 2694 finished with value: 0.46915491223335265 and parameters: {'fp_type': 'morgan_rdkit', 'combined_morgan_radius': 3, 'combined_morgan_nBits': 1024, 'combined_rdkit_maxPath': 7, 'combined_rdkit_nBits': 1024, 'num_hidden_layers': 3, 'hidden_dim_0': 256, 'hidden_dim_1': 1024, 'hidden_dim_2': 64, 'kl_weight': 0.00027571789560142416, 'lr': 0.008617065724255071, 'batch_size': 128, 'dropout_rate': 0.095738462110072, 'prior_mu': -0.051699311493376796, 'prior_sigma': 0.09204707841021095, 'normalization': 'layer'}. Best is trial 896 with value: 0.4533553242683411.
Generating morgan_rdkit fingerprints...
Generated fingerprints with 2048 features for 841 molecules
Trial 2697: 5-fold CV loss = 0.4635
[I 2025-08-08 01:58:55,253] Trial 2697 finished with value: 0.4635129332542419 and parameters: {'fp_type': 'morgan_rdkit', 'combined_morgan_radius': 3, 'combined_morgan_nBits': 1024, 'combined_rdkit_maxPath': 7, 'combined_rdkit_nBits': 1024, 'num_hidden_layers': 3, 'hidden_dim_0': 256, 'hidden_dim_1': 1024, 'hidden_dim_2': 64, 'kl_weight': 0.00027270247809620075, 'lr': 0.006855247943536225, 'batch_size': 128, 'dropout_rate': 0.11370116076284834, 'prior_mu': -0.01242945457270358, 'prior_sigma': 0.09136019207754775, 'normalization': 'layer'}. Best is trial 896 with value: 0.4533553242683411.
Generating morgan_rdkit fingerprints...
Generated fingerprints with 2048 features for 841 molecules
Trial 2698: 5-fold CV loss = 0.8181
[I 2025-08-08 01:59:05,588] Trial 2698 finished with value: 0.8180743813514709 and parameters: {'fp_type': 'morgan_rdkit', 'combined_morgan_radius': 3, 'combined_morgan_nBits': 1024, 'combined_rdkit_maxPath': 7, 'combined_rdkit_nBits': 1024, 'num_hidden_layers': 3, 'hidden_dim_0': 256, 'hidden_dim_1': 1024, 'hidden_dim_2': 64, 'kl_weight': 0.00035940204589000646, 'lr': 0.0012449423045143803, 'batch_size': 128, 'dropout_rate': 0.05179453274204314, 'prior_mu': -0.013119174491481781, 'prior_sigma': 0.10362675767023315, 'normalization': 'layer'}. Best is trial 896 with value: 0.4533553242683411.
Generating morgan_rdkit fingerprints...
Generated fingerprints with 1536 features for 841 molecules
Trial 2701: 5-fold CV loss = 0.8075
[I 2025-08-08 01:59:21,479] Trial 2701 finished with value: 0.8075152158737182 and parameters: {'fp_type': 'morgan_rdkit', 'combined_morgan_radius': 2, 'combined_morgan_nBits': 1024, 'combined_rdkit_maxPath': 7, 'combined_rdkit_nBits': 512, 'num_hidden_layers': 3, 'hidden_dim_0': 256, 'hidden_dim_1': 512, 'hidden_dim_2': 64, 'kl_weight': 0.00017083252344934064, 'lr': 0.007844400080466597, 'batch_size': 128, 'dropout_rate': 0.07393959558666335, 'prior_mu': -0.02821361609949521, 'prior_sigma': 0.11113790657887981, 'normalization': 'layer'}. Best is trial 896 with value: 0.4533553242683411.
Generating morgan_rdkit fingerprints...
Generated fingerprints with 2048 features for 841 molecules
Trial 2700: 5-fold CV loss = 0.6593
[I 2025-08-08 01:59:29,879] Trial 2700 finished with value: 0.6592995464801789 and parameters: {'fp_type': 'morgan_rdkit', 'combined_morgan_radius': 3, 'combined_morgan_nBits': 1024, 'combined_rdkit_maxPath': 7, 'combined_rdkit_nBits': 1024, 'num_hidden_layers': 3, 'hidden_dim_0': 256, 'hidden_dim_1': 512, 'hidden_dim_2': 64, 'kl_weight': 0.0003804307789796895, 'lr': 0.007520049423026903, 'batch_size': 128, 'dropout_rate': 0.051452063518536005, 'prior_mu': -0.023740607156687982, 'prior_sigma': 0.11077250041427199, 'normalization': 'layer'}. Best is trial 896 with value: 0.4533553242683411.
Generating morgan_rdkit fingerprints...
Generated fingerprints with 2048 features for 841 molecules
Trial 2696: 5-fold CV loss = 0.4633
[I 2025-08-08 01:59:32,162] Trial 2696 finished with value: 0.46330792307853697 and parameters: {'fp_type': 'morgan_rdkit', 'combined_morgan_radius': 3, 'combined_morgan_nBits': 1024, 'combined_rdkit_maxPath': 7, 'combined_rdkit_nBits': 1024, 'num_hidden_layers': 3, 'hidden_dim_0': 256, 'hidden_dim_1': 1024, 'hidden_dim_2': 64, 'kl_weight': 0.0002565298580559533, 'lr': 0.007449399383149515, 'batch_size': 128, 'dropout_rate': 0.11738015281122696, 'prior_mu': -0.053159027983435234, 'prior_sigma': 0.09263879677862956, 'normalization': 'layer'}. Best is trial 896 with value: 0.4533553242683411.
Generating morgan_rdkit fingerprints...
Generated fingerprints with 2048 features for 841 molecules
Trial 2699: 5-fold CV loss = 0.4654
[I 2025-08-08 01:59:52,563] Trial 2699 finished with value: 0.4653740406036377 and parameters: {'fp_type': 'morgan_rdkit', 'combined_morgan_radius': 3, 'combined_morgan_nBits': 1024, 'combined_rdkit_maxPath': 7, 'combined_rdkit_nBits': 1024, 'num_hidden_layers': 3, 'hidden_dim_0': 256, 'hidden_dim_1': 512, 'hidden_dim_2': 64, 'kl_weight': 0.0003620010384178485, 'lr': 0.0074768221612235754, 'batch_size': 128, 'dropout_rate': 0.08741537021866683, 'prior_mu': -0.012300702368430678, 'prior_sigma': 0.10457684567103508, 'normalization': 'layer'}. Best is trial 896 with value: 0.4533553242683411.
Generating morgan_rdkit fingerprints...
Generated fingerprints with 2048 features for 841 molecules
Trial 2702: 5-fold CV loss = 0.4734
[I 2025-08-08 01:59:55,432] Trial 2702 finished with value: 0.47340641021728513 and parameters: {'fp_type': 'morgan_rdkit', 'combined_morgan_radius': 3, 'combined_morgan_nBits': 1024, 'combined_rdkit_maxPath': 7, 'combined_rdkit_nBits': 1024, 'num_hidden_layers': 3, 'hidden_dim_0': 256, 'hidden_dim_1': 1024, 'hidden_dim_2': 64, 'kl_weight': 0.00039017366672331095, 'lr': 0.0075035497509274235, 'batch_size': 128, 'dropout_rate': 0.12131856065816325, 'prior_mu': -0.06839091114255806, 'prior_sigma': 0.08639935964315354, 'normalization': 'layer'}. Best is trial 896 with value: 0.4533553242683411.
Generating morgan_rdkit fingerprints...
Generated fingerprints with 2048 features for 841 molecules
Trial 2704: 5-fold CV loss = 0.8816
[I 2025-08-08 02:00:09,422] Trial 2704 finished with value: 0.8816030144691467 and parameters: {'fp_type': 'morgan_rdkit', 'combined_morgan_radius': 3, 'combined_morgan_nBits': 1024, 'combined_rdkit_maxPath': 8, 'combined_rdkit_nBits': 1024, 'num_hidden_layers': 3, 'hidden_dim_0': 256, 'hidden_dim_1': 1024, 'hidden_dim_2': 128, 'kl_weight': 0.00015588604447276723, 'lr': 0.0007890928407531912, 'batch_size': 128, 'dropout_rate': 0.0873944872557214, 'prior_mu': -0.03876281584126912, 'prior_sigma': 0.08035850803644091, 'normalization': 'layer'}. Best is trial 896 with value: 0.4533553242683411.
Generating morgan_rdkit fingerprints...
Generated fingerprints with 2048 features for 841 molecules
Trial 2703: 5-fold CV loss = 0.4707
[I 2025-08-08 02:00:26,822] Trial 2703 finished with value: 0.47071759700775145 and parameters: {'fp_type': 'morgan_rdkit', 'combined_morgan_radius': 3, 'combined_morgan_nBits': 1024, 'combined_rdkit_maxPath': 7, 'combined_rdkit_nBits': 1024, 'num_hidden_layers': 3, 'hidden_dim_0': 256, 'hidden_dim_1': 1024, 'hidden_dim_2': 128, 'kl_weight': 0.0003239993428211405, 'lr': 0.00591569142160365, 'batch_size': 128, 'dropout_rate': 0.08750197614591801, 'prior_mu': -0.0383386420027882, 'prior_sigma': 0.08667379440420794, 'normalization': 'layer'}. Best is trial 896 with value: 0.4533553242683411.
Generating morgan_rdkit fingerprints...
Generated fingerprints with 2048 features for 841 molecules
Trial 2706: 5-fold CV loss = 0.6239
[I 2025-08-08 02:00:29,605] Trial 2706 finished with value: 0.6238791823387146 and parameters: {'fp_type': 'morgan_rdkit', 'combined_morgan_radius': 3, 'combined_morgan_nBits': 1024, 'combined_rdkit_maxPath': 8, 'combined_rdkit_nBits': 1024, 'num_hidden_layers': 3, 'hidden_dim_0': 256, 'hidden_dim_1': 1024, 'hidden_dim_2': 64, 'kl_weight': 0.00015331730539133446, 'lr': 0.005811327383696197, 'batch_size': 128, 'dropout_rate': 0.34194638858689363, 'prior_mu': 0.026694483384200947, 'prior_sigma': 0.07969583514268506, 'normalization': 'layer'}. Best is trial 896 with value: 0.4533553242683411.
Generating morgan_rdkit fingerprints...
Generated fingerprints with 1280 features for 841 molecules
Trial 2709: 5-fold CV loss = 0.6011
[I 2025-08-08 02:00:54,232] Trial 2709 finished with value: 0.601144301891327 and parameters: {'fp_type': 'morgan_rdkit', 'combined_morgan_radius': 3, 'combined_morgan_nBits': 1024, 'combined_rdkit_maxPath': 7, 'combined_rdkit_nBits': 256, 'num_hidden_layers': 3, 'hidden_dim_0': 256, 'hidden_dim_1': 1024, 'hidden_dim_2': 64, 'kl_weight': 0.0002310887384086086, 'lr': 0.009182109203001417, 'batch_size': 128, 'dropout_rate': 0.10615987123769492, 'prior_mu': -0.020524592044500693, 'prior_sigma': 0.09936014605583915, 'normalization': 'layer'}. Best is trial 896 with value: 0.4533553242683411.
Generating morgan_rdkit fingerprints...
Generated fingerprints with 2048 features for 841 molecules
Trial 2705: 5-fold CV loss = 0.4701
[I 2025-08-08 02:01:01,231] Trial 2705 finished with value: 0.47012231349945066 and parameters: {'fp_type': 'morgan_rdkit', 'combined_morgan_radius': 3, 'combined_morgan_nBits': 1024, 'combined_rdkit_maxPath': 7, 'combined_rdkit_nBits': 1024, 'num_hidden_layers': 3, 'hidden_dim_0': 256, 'hidden_dim_1': 1024, 'hidden_dim_2': 128, 'kl_weight': 0.0001498523778040268, 'lr': 0.006517285429997414, 'batch_size': 128, 'dropout_rate': 0.12016716017121613, 'prior_mu': -0.03849933613992236, 'prior_sigma': 0.08756998658442733, 'normalization': 'layer'}. Best is trial 896 with value: 0.4533553242683411.
Generating morgan_rdkit fingerprints...
Generated fingerprints with 2048 features for 841 molecules
Trial 2708: 5-fold CV loss = 0.4704
[I 2025-08-08 02:01:05,186] Trial 2708 finished with value: 0.47036693096160886 and parameters: {'fp_type': 'morgan_rdkit', 'combined_morgan_radius': 3, 'combined_morgan_nBits': 1024, 'combined_rdkit_maxPath': 7, 'combined_rdkit_nBits': 1024, 'num_hidden_layers': 3, 'hidden_dim_0': 256, 'hidden_dim_1': 1024, 'hidden_dim_2': 64, 'kl_weight': 0.00023476313160537038, 'lr': 0.00999910678832408, 'batch_size': 128, 'dropout_rate': 0.13262958746921472, 'prior_mu': -0.021663924374242655, 'prior_sigma': 0.09716275633548223, 'normalization': 'layer'}. Best is trial 896 with value: 0.4533553242683411.
Generating morgan_rdkit fingerprints...
Generated fingerprints with 2048 features for 841 molecules
Trial 2710: 5-fold CV loss = 0.4579
[I 2025-08-08 02:01:29,102] Trial 2710 finished with value: 0.45789448618888856 and parameters: {'fp_type': 'morgan_rdkit', 'combined_morgan_radius': 3, 'combined_morgan_nBits': 1024, 'combined_rdkit_maxPath': 7, 'combined_rdkit_nBits': 1024, 'num_hidden_layers': 3, 'hidden_dim_0': 256, 'hidden_dim_1': 1024, 'hidden_dim_2': 64, 'kl_weight': 0.0030651522443671986, 'lr': 0.0068138679452368275, 'batch_size': 128, 'dropout_rate': 0.13291999317023692, 'prior_mu': -0.030898476196804935, 'prior_sigma': 0.07169670176481807, 'normalization': 'layer'}. Best is trial 896 with value: 0.4533553242683411.
Generating morgan_rdkit fingerprints...
Generated fingerprints with 2048 features for 841 molecules
Trial 2707: 5-fold CV loss = 0.4711
[I 2025-08-08 02:01:32,348] Trial 2707 finished with value: 0.47111877202987673 and parameters: {'fp_type': 'morgan_rdkit', 'combined_morgan_radius': 3, 'combined_morgan_nBits': 1024, 'combined_rdkit_maxPath': 7, 'combined_rdkit_nBits': 1024, 'num_hidden_layers': 3, 'hidden_dim_0': 256, 'hidden_dim_1': 1024, 'hidden_dim_2': 64, 'kl_weight': 0.0002380479638541851, 'lr': 0.00611066092238771, 'batch_size': 128, 'dropout_rate': 0.10416222572197138, 'prior_mu': 0.02754010063238211, 'prior_sigma': 0.08173865797739709, 'normalization': 'layer'}. Best is trial 896 with value: 0.4533553242683411.
Generating morgan_rdkit fingerprints...
Generated fingerprints with 2048 features for 841 molecules
Trial 2712: 5-fold CV loss = 0.4768
[I 2025-08-08 02:01:35,726] Trial 2712 finished with value: 0.47684416770935056 and parameters: {'fp_type': 'morgan_rdkit', 'combined_morgan_radius': 3, 'combined_morgan_nBits': 1024, 'combined_rdkit_maxPath': 5, 'combined_rdkit_nBits': 1024, 'num_hidden_layers': 3, 'hidden_dim_0': 256, 'hidden_dim_1': 1024, 'hidden_dim_2': 64, 'kl_weight': 0.00018277908990568836, 'lr': 0.008282119815004615, 'batch_size': 128, 'dropout_rate': 0.07366546910910016, 'prior_mu': -0.006270234100058973, 'prior_sigma': 0.07231883476888475, 'normalization': 'layer'}. Best is trial 896 with value: 0.4533553242683411.
Generating morgan_rdkit fingerprints...
Generated fingerprints with 2048 features for 841 molecules
Trial 2711: 5-fold CV loss = 0.4813
[I 2025-08-08 02:01:41,677] Trial 2711 finished with value: 0.48134017586708067 and parameters: {'fp_type': 'morgan_rdkit', 'combined_morgan_radius': 3, 'combined_morgan_nBits': 1024, 'combined_rdkit_maxPath': 5, 'combined_rdkit_nBits': 1024, 'num_hidden_layers': 3, 'hidden_dim_0': 256, 'hidden_dim_1': 1024, 'hidden_dim_2': 64, 'kl_weight': 0.0005848090545057312, 'lr': 0.009226016119288341, 'batch_size': 128, 'dropout_rate': 0.1323356632239533, 'prior_mu': -0.03154207365790934, 'prior_sigma': 0.08228846606129321, 'normalization': 'layer'}. Best is trial 896 with value: 0.4533553242683411.
Generating morgan_rdkit fingerprints...
Generated fingerprints with 2048 features for 841 molecules
Trial 2713: 5-fold CV loss = 0.5045
[I 2025-08-08 02:01:55,844] Trial 2713 finished with value: 0.5044677019119262 and parameters: {'fp_type': 'morgan_rdkit', 'combined_morgan_radius': 3, 'combined_morgan_nBits': 1024, 'combined_rdkit_maxPath': 5, 'combined_rdkit_nBits': 1024, 'num_hidden_layers': 3, 'hidden_dim_0': 256, 'hidden_dim_1': 1024, 'hidden_dim_2': 64, 'kl_weight': 0.0302531853338135, 'lr': 0.005996775205769858, 'batch_size': 128, 'dropout_rate': 0.1344616309037241, 'prior_mu': -0.03282223552863107, 'prior_sigma': 0.07102138482383066, 'normalization': 'layer'}. Best is trial 896 with value: 0.4533553242683411.
Generating morgan_rdkit fingerprints...
Generated fingerprints with 2048 features for 841 molecules
Trial 2715: 5-fold CV loss = 0.4761
[I 2025-08-08 02:02:15,276] Trial 2715 finished with value: 0.4761372864246368 and parameters: {'fp_type': 'morgan_rdkit', 'combined_morgan_radius': 3, 'combined_morgan_nBits': 1024, 'combined_rdkit_maxPath': 7, 'combined_rdkit_nBits': 1024, 'num_hidden_layers': 3, 'hidden_dim_0': 256, 'hidden_dim_1': 1024, 'hidden_dim_2': 64, 'kl_weight': 0.005331322614459448, 'lr': 0.006176168043944903, 'batch_size': 128, 'dropout_rate': 0.13351490970688906, 'prior_mu': -0.03384642215036335, 'prior_sigma': 0.06697997350736054, 'normalization': 'layer'}. Best is trial 896 with value: 0.4533553242683411.
Generating morgan_rdkit fingerprints...
Generated fingerprints with 2048 features for 841 molecules
Trial 2716: 5-fold CV loss = 0.5618
