[I 2025-08-07 23:52:09,422] Trial 2086 finished with value: 0.5665211379528046 and parameters: {'fp_type': 'morgan_rdkit', 'combined_morgan_radius': 3, 'combined_morgan_nBits': 1024, 'combined_rdkit_maxPath': 7, 'combined_rdkit_nBits': 1024, 'num_hidden_layers': 3, 'hidden_dim_0': 256, 'hidden_dim_1': 64, 'hidden_dim_2': 128, 'kl_weight': 0.0003776103001506762, 'lr': 0.007350602219548863, 'batch_size': 128, 'dropout_rate': 0.16995093619286958, 'prior_mu': -0.016459915983637503, 'prior_sigma': 0.0788367212038374, 'normalization': 'layer'}. Best is trial 896 with value: 0.4533553242683411.
Generating morgan_rdkit fingerprints...
Generated fingerprints with 2048 features for 841 molecules
Trial 2088: 5-fold CV loss = 0.8943
[I 2025-08-07 23:52:11,368] Trial 2088 finished with value: 0.8942532777786255 and parameters: {'fp_type': 'rdkit', 'rdkit_only_maxPath': 7, 'rdkit_only_nBits': 256, 'num_hidden_layers': 3, 'hidden_dim_0': 256, 'hidden_dim_1': 512, 'hidden_dim_2': 1024, 'kl_weight': 0.0003680759073496103, 'lr': 0.008078702381947692, 'batch_size': 128, 'dropout_rate': 0.12386225440228593, 'prior_mu': -0.017963406292410344, 'prior_sigma': 0.09833430549911631, 'normalization': 'layer'}. Best is trial 896 with value: 0.4533553242683411.
Generating morgan_rdkit fingerprints...
Generated fingerprints with 2048 features for 841 molecules
Trial 2089: 5-fold CV loss = 0.8872
[I 2025-08-07 23:52:31,240] Trial 2089 finished with value: 0.8872433781623841 and parameters: {'fp_type': 'morgan_rdkit', 'combined_morgan_radius': 3, 'combined_morgan_nBits': 1024, 'combined_rdkit_maxPath': 7, 'combined_rdkit_nBits': 1024, 'num_hidden_layers': 3, 'hidden_dim_0': 256, 'hidden_dim_1': 1024, 'hidden_dim_2': 1024, 'kl_weight': 0.00022107262344615055, 'lr': 0.008015946079731294, 'batch_size': 128, 'dropout_rate': 0.1248003683049123, 'prior_mu': -0.02588620981445982, 'prior_sigma': 0.0998134397799121, 'normalization': 'layer'}. Best is trial 896 with value: 0.4533553242683411.
Generating morgan_rdkit fingerprints...
Generated fingerprints with 2048 features for 841 molecules
Trial 2085: 5-fold CV loss = 0.4760
[I 2025-08-07 23:52:39,889] Trial 2085 finished with value: 0.47595803141593934 and parameters: {'fp_type': 'morgan_rdkit', 'combined_morgan_radius': 3, 'combined_morgan_nBits': 1024, 'combined_rdkit_maxPath': 7, 'combined_rdkit_nBits': 1024, 'num_hidden_layers': 3, 'hidden_dim_0': 256, 'hidden_dim_1': 64, 'hidden_dim_2': 64, 'kl_weight': 0.0002179458582977951, 'lr': 0.008531426035968001, 'batch_size': 128, 'dropout_rate': 0.17176236207280432, 'prior_mu': -0.008165863934785826, 'prior_sigma': 0.09690072700788932, 'normalization': 'layer'}. Best is trial 896 with value: 0.4533553242683411.
Generating morgan_rdkit fingerprints...
Generated fingerprints with 2048 features for 841 molecules
Trial 2090: 5-fold CV loss = 0.4741
[I 2025-08-07 23:53:22,080] Trial 2090 finished with value: 0.47412100434303284 and parameters: {'fp_type': 'morgan_rdkit', 'combined_morgan_radius': 3, 'combined_morgan_nBits': 1024, 'combined_rdkit_maxPath': 7, 'combined_rdkit_nBits': 1024, 'num_hidden_layers': 3, 'hidden_dim_0': 256, 'hidden_dim_1': 1024, 'hidden_dim_2': 64, 'kl_weight': 0.00029823339570750514, 'lr': 0.006868524107667968, 'batch_size': 32, 'dropout_rate': 0.13401797059135787, 'prior_mu': -0.023661773428846233, 'prior_sigma': 0.08712710640730745, 'normalization': 'layer'}. Best is trial 896 with value: 0.4533553242683411.
Generating morgan_rdkit fingerprints...
Generated fingerprints with 2048 features for 841 molecules
Trial 2087: 5-fold CV loss = 0.4614
[I 2025-08-07 23:53:31,760] Trial 2087 finished with value: 0.46143250465393065 and parameters: {'fp_type': 'morgan_rdkit', 'combined_morgan_radius': 3, 'combined_morgan_nBits': 1024, 'combined_rdkit_maxPath': 7, 'combined_rdkit_nBits': 1024, 'num_hidden_layers': 3, 'hidden_dim_0': 256, 'hidden_dim_1': 512, 'hidden_dim_2': 128, 'kl_weight': 0.00022323798580905287, 'lr': 0.007659189175344041, 'batch_size': 128, 'dropout_rate': 0.12672404276351323, 'prior_mu': -0.01671955212671113, 'prior_sigma': 0.10647491393530535, 'normalization': 'layer'}. Best is trial 896 with value: 0.4533553242683411.
Generating morgan_rdkit fingerprints...
Generated fingerprints with 2048 features for 841 molecules
Trial 2091: 5-fold CV loss = 0.4680
[I 2025-08-07 23:53:34,515] Trial 2091 finished with value: 0.46803597211837766 and parameters: {'fp_type': 'morgan_rdkit', 'combined_morgan_radius': 3, 'combined_morgan_nBits': 1024, 'combined_rdkit_maxPath': 7, 'combined_rdkit_nBits': 1024, 'num_hidden_layers': 3, 'hidden_dim_0': 256, 'hidden_dim_1': 1024, 'hidden_dim_2': 64, 'kl_weight': 0.0003019066754922203, 'lr': 0.0068652661398791335, 'batch_size': 32, 'dropout_rate': 0.09065120141316185, 'prior_mu': -0.040149573005152726, 'prior_sigma': 0.08844960829158294, 'normalization': 'layer'}. Best is trial 896 with value: 0.4533553242683411.
Generating morgan_rdkit fingerprints...
Generated fingerprints with 2048 features for 841 molecules
Trial 2093: 5-fold CV loss = 0.4673
[I 2025-08-07 23:53:59,751] Trial 2093 finished with value: 0.4673052132129669 and parameters: {'fp_type': 'morgan_rdkit', 'combined_morgan_radius': 3, 'combined_morgan_nBits': 1024, 'combined_rdkit_maxPath': 7, 'combined_rdkit_nBits': 1024, 'num_hidden_layers': 3, 'hidden_dim_0': 256, 'hidden_dim_1': 1024, 'hidden_dim_2': 64, 'kl_weight': 0.00030195518952846277, 'lr': 0.007469009966293939, 'batch_size': 128, 'dropout_rate': 0.0906065650124392, 'prior_mu': -0.04126413184725404, 'prior_sigma': 0.07193763747197274, 'normalization': 'layer'}. Best is trial 896 with value: 0.4533553242683411.
Generating morgan_rdkit fingerprints...
Generated fingerprints with 2048 features for 841 molecules
Trial 2096: 5-fold CV loss = 0.9870
[I 2025-08-07 23:54:10,347] Trial 2096 finished with value: 0.9870150566101075 and parameters: {'fp_type': 'morgan_rdkit', 'combined_morgan_radius': 3, 'combined_morgan_nBits': 1024, 'combined_rdkit_maxPath': 7, 'combined_rdkit_nBits': 1024, 'num_hidden_layers': 0, 'kl_weight': 0.00034935443338268235, 'lr': 0.0059075702754737185, 'batch_size': 128, 'dropout_rate': 0.09903822645067918, 'prior_mu': -0.03197297477485844, 'prior_sigma': 0.07784538169107241, 'normalization': 'layer'}. Best is trial 896 with value: 0.4533553242683411.
Generating morgan_rdkit fingerprints...
Generated fingerprints with 2048 features for 841 molecules
Trial 2095: 5-fold CV loss = 0.4637
[I 2025-08-07 23:54:15,316] Trial 2095 finished with value: 0.46370607018470766 and parameters: {'fp_type': 'morgan_rdkit', 'combined_morgan_radius': 3, 'combined_morgan_nBits': 1024, 'combined_rdkit_maxPath': 7, 'combined_rdkit_nBits': 1024, 'num_hidden_layers': 3, 'hidden_dim_0': 256, 'hidden_dim_1': 1024, 'hidden_dim_2': 64, 'kl_weight': 0.000339742786211807, 'lr': 0.006079650023676209, 'batch_size': 128, 'dropout_rate': 0.14040060474925173, 'prior_mu': -0.03322230799538699, 'prior_sigma': 0.07601595352241793, 'normalization': 'layer'}. Best is trial 896 with value: 0.4533553242683411.
Generating morgan_rdkit fingerprints...
Generated fingerprints with 2048 features for 841 molecules
Trial 2092: 5-fold CV loss = 0.4630
[I 2025-08-07 23:54:33,800] Trial 2092 finished with value: 0.4629643321037292 and parameters: {'fp_type': 'morgan_rdkit', 'combined_morgan_radius': 3, 'combined_morgan_nBits': 1024, 'combined_rdkit_maxPath': 7, 'combined_rdkit_nBits': 1024, 'num_hidden_layers': 3, 'hidden_dim_0': 256, 'hidden_dim_1': 1024, 'hidden_dim_2': 64, 'kl_weight': 0.0003050122529949869, 'lr': 0.00675357327105323, 'batch_size': 32, 'dropout_rate': 0.09124716574397107, 'prior_mu': -0.040142842330533494, 'prior_sigma': 0.10674399854136665, 'normalization': 'layer'}. Best is trial 896 with value: 0.4533553242683411.
Generating morgan_rdkit fingerprints...
Generated fingerprints with 2048 features for 841 molecules
Trial 2094: 5-fold CV loss = 0.5834
[I 2025-08-07 23:54:48,393] Trial 2094 finished with value: 0.5834161818027497 and parameters: {'fp_type': 'morgan_rdkit', 'combined_morgan_radius': 3, 'combined_morgan_nBits': 1024, 'combined_rdkit_maxPath': 8, 'combined_rdkit_nBits': 1024, 'num_hidden_layers': 3, 'hidden_dim_0': 256, 'hidden_dim_1': 1024, 'hidden_dim_2': 64, 'kl_weight': 0.0003158100704287543, 'lr': 0.006671309564908537, 'batch_size': 128, 'dropout_rate': 0.0941107227919559, 'prior_mu': -0.04194954487217743, 'prior_sigma': 0.09052895994373246, 'normalization': 'layer'}. Best is trial 896 with value: 0.4533553242683411.
Generating morgan_rdkit fingerprints...
Generated fingerprints with 2048 features for 841 molecules
Trial 2098: 5-fold CV loss = 0.5506
[I 2025-08-07 23:54:52,640] Trial 2098 finished with value: 0.5506067216396332 and parameters: {'fp_type': 'morgan_rdkit', 'combined_morgan_radius': 3, 'combined_morgan_nBits': 1024, 'combined_rdkit_maxPath': 8, 'combined_rdkit_nBits': 1024, 'num_hidden_layers': 3, 'hidden_dim_0': 256, 'hidden_dim_1': 1024, 'hidden_dim_2': 64, 'kl_weight': 0.00042625866741155224, 'lr': 0.00918586761888848, 'batch_size': 128, 'dropout_rate': 0.1452039060604882, 'prior_mu': 0.01497096051366776, 'prior_sigma': 0.08609248559963636, 'normalization': 'layer'}. Best is trial 896 with value: 0.4533553242683411.
Generating morgan_rdkit fingerprints...
Generated fingerprints with 2048 features for 841 molecules
Trial 2097: 5-fold CV loss = 0.4796
[I 2025-08-07 23:55:02,726] Trial 2097 finished with value: 0.47963025569915774 and parameters: {'fp_type': 'morgan_rdkit', 'combined_morgan_radius': 3, 'combined_morgan_nBits': 1024, 'combined_rdkit_maxPath': 8, 'combined_rdkit_nBits': 1024, 'num_hidden_layers': 3, 'hidden_dim_0': 256, 'hidden_dim_1': 1024, 'hidden_dim_2': 64, 'kl_weight': 0.0003956212079154843, 'lr': 0.004955133219851593, 'batch_size': 128, 'dropout_rate': 0.13681932854257134, 'prior_mu': 0.01606176551036899, 'prior_sigma': 0.0850241259489435, 'normalization': 'layer'}. Best is trial 896 with value: 0.4533553242683411.
Generating morgan_rdkit fingerprints...
Generated fingerprints with 2048 features for 841 molecules
Trial 2099: 5-fold CV loss = 0.8132
[I 2025-08-07 23:55:09,123] Trial 2099 finished with value: 0.8132032155990601 and parameters: {'fp_type': 'morgan_rdkit', 'combined_morgan_radius': 3, 'combined_morgan_nBits': 1024, 'combined_rdkit_maxPath': 8, 'combined_rdkit_nBits': 1024, 'num_hidden_layers': 3, 'hidden_dim_0': 128, 'hidden_dim_1': 1024, 'hidden_dim_2': 256, 'kl_weight': 0.0004026855818207042, 'lr': 0.004886207236792648, 'batch_size': 128, 'dropout_rate': 0.055966661834781925, 'prior_mu': 0.015351959735803014, 'prior_sigma': 0.08528560625330997, 'normalization': 'layer'}. Best is trial 896 with value: 0.4533553242683411.
Generating morgan_rdkit fingerprints...
Generated fingerprints with 2048 features for 841 molecules
Trial 2101: 5-fold CV loss = 0.4894
[I 2025-08-07 23:55:27,286] Trial 2101 finished with value: 0.48943644762039185 and parameters: {'fp_type': 'morgan_rdkit', 'combined_morgan_radius': 3, 'combined_morgan_nBits': 1024, 'combined_rdkit_maxPath': 5, 'combined_rdkit_nBits': 1024, 'num_hidden_layers': 3, 'hidden_dim_0': 256, 'hidden_dim_1': 1024, 'hidden_dim_2': 256, 'kl_weight': 0.00027521550897896774, 'lr': 0.004774461473517003, 'batch_size': 128, 'dropout_rate': 0.05370555436230236, 'prior_mu': -0.05111963805716895, 'prior_sigma': 0.08367840790820189, 'normalization': 'layer'}. Best is trial 896 with value: 0.4533553242683411.
Generating morgan fingerprints...
Generated fingerprints with 2048 features for 841 molecules
Trial 2102: 5-fold CV loss = 0.4837
[I 2025-08-07 23:55:42,518] Trial 2102 finished with value: 0.48374195098876954 and parameters: {'fp_type': 'morgan_rdkit', 'combined_morgan_radius': 3, 'combined_morgan_nBits': 1024, 'combined_rdkit_maxPath': 5, 'combined_rdkit_nBits': 1024, 'num_hidden_layers': 3, 'hidden_dim_0': 128, 'hidden_dim_1': 1024, 'hidden_dim_2': 256, 'kl_weight': 0.00017489401107671578, 'lr': 0.00859888206580609, 'batch_size': 128, 'dropout_rate': 0.057114341488507914, 'prior_mu': -0.050813727875211684, 'prior_sigma': 0.08147229890184352, 'normalization': 'layer'}. Best is trial 896 with value: 0.4533553242683411.
Generating morgan_rdkit fingerprints...
Generated fingerprints with 2048 features for 841 molecules
Trial 2104: 5-fold CV loss = 0.5286
[I 2025-08-07 23:55:47,333] Trial 2104 finished with value: 0.5285708606243134 and parameters: {'fp_type': 'morgan', 'morgan_only_radius': 3, 'morgan_only_nBits': 2048, 'num_hidden_layers': 3, 'hidden_dim_0': 256, 'hidden_dim_1': 1024, 'hidden_dim_2': 64, 'kl_weight': 0.00018558215984521733, 'lr': 0.008481802032601852, 'batch_size': 128, 'dropout_rate': 0.1168216690006792, 'prior_mu': -0.02561680438383179, 'prior_sigma': 0.09273321192960848, 'normalization': 'layer'}. Best is trial 896 with value: 0.4533553242683411.
Generating morgan_rdkit fingerprints...
Generated fingerprints with 2048 features for 841 molecules
Trial 2103: 5-fold CV loss = 0.4828
[I 2025-08-07 23:55:55,170] Trial 2103 finished with value: 0.48283752202987673 and parameters: {'fp_type': 'morgan_rdkit', 'combined_morgan_radius': 2, 'combined_morgan_nBits': 1024, 'combined_rdkit_maxPath': 5, 'combined_rdkit_nBits': 1024, 'num_hidden_layers': 3, 'hidden_dim_0': 256, 'hidden_dim_1': 1024, 'hidden_dim_2': 64, 'kl_weight': 0.0001797887464017522, 'lr': 0.008549104773223248, 'batch_size': 128, 'dropout_rate': 0.11570286001485075, 'prior_mu': -0.05609805732383252, 'prior_sigma': 0.11555434478106949, 'normalization': 'layer'}. Best is trial 896 with value: 0.4533553242683411.
Generating morgan_rdkit fingerprints...
Generated fingerprints with 2048 features for 841 molecules
Trial 2100: 5-fold CV loss = 0.4951
[I 2025-08-07 23:56:07,143] Trial 2100 finished with value: 0.495073401927948 and parameters: {'fp_type': 'morgan_rdkit', 'combined_morgan_radius': 3, 'combined_morgan_nBits': 1024, 'combined_rdkit_maxPath': 5, 'combined_rdkit_nBits': 1024, 'num_hidden_layers': 3, 'hidden_dim_0': 128, 'hidden_dim_1': 1024, 'hidden_dim_2': 64, 'kl_weight': 0.0004403343480320047, 'lr': 0.008671042422017937, 'batch_size': 128, 'dropout_rate': 0.14566765064076442, 'prior_mu': -0.0512001756865926, 'prior_sigma': 0.13814865587505062, 'normalization': 'layer'}. Best is trial 896 with value: 0.4533553242683411.
Generating rdkit fingerprints...
Generated fingerprints with 1024 features for 841 molecules
Trial 2106: 5-fold CV loss = 0.4683
[I 2025-08-07 23:56:25,337] Trial 2106 finished with value: 0.4683206856250763 and parameters: {'fp_type': 'morgan_rdkit', 'combined_morgan_radius': 2, 'combined_morgan_nBits': 1024, 'combined_rdkit_maxPath': 7, 'combined_rdkit_nBits': 1024, 'num_hidden_layers': 3, 'hidden_dim_0': 256, 'hidden_dim_1': 1024, 'hidden_dim_2': 64, 'kl_weight': 0.00025639288284846456, 'lr': 0.007430123057203135, 'batch_size': 128, 'dropout_rate': 0.15121615324118173, 'prior_mu': -0.017462602029908205, 'prior_sigma': 0.07309032989544692, 'normalization': 'layer'}. Best is trial 896 with value: 0.4533553242683411.
Generating morgan_rdkit fingerprints...
Generated fingerprints with 2048 features for 841 molecules
Trial 2105: 5-fold CV loss = 0.4688
[I 2025-08-07 23:56:28,867] Trial 2105 finished with value: 0.4688271701335907 and parameters: {'fp_type': 'morgan_rdkit', 'combined_morgan_radius': 2, 'combined_morgan_nBits': 1024, 'combined_rdkit_maxPath': 7, 'combined_rdkit_nBits': 1024, 'num_hidden_layers': 3, 'hidden_dim_0': 256, 'hidden_dim_1': 1024, 'hidden_dim_2': 64, 'kl_weight': 0.00026646668653541145, 'lr': 0.007422335489812241, 'batch_size': 128, 'dropout_rate': 0.1600234516759651, 'prior_mu': -0.02753770264004746, 'prior_sigma': 0.09189144099406286, 'normalization': 'layer'}. Best is trial 896 with value: 0.4533553242683411.
Generating rdkit fingerprints...
Generated fingerprints with 1024 features for 841 molecules
Trial 2107: 5-fold CV loss = 0.4640
[I 2025-08-07 23:56:47,927] Trial 2107 finished with value: 0.4639913499355316 and parameters: {'fp_type': 'morgan_rdkit', 'combined_morgan_radius': 3, 'combined_morgan_nBits': 1024, 'combined_rdkit_maxPath': 7, 'combined_rdkit_nBits': 1024, 'num_hidden_layers': 3, 'hidden_dim_0': 256, 'hidden_dim_1': 1024, 'hidden_dim_2': 64, 'kl_weight': 0.00024781528386093327, 'lr': 0.0074494049503877596, 'batch_size': 128, 'dropout_rate': 0.1620173549494821, 'prior_mu': -0.0193434245875252, 'prior_sigma': 0.07330264007323037, 'normalization': 'layer'}. Best is trial 896 with value: 0.4533553242683411.
Generating rdkit fingerprints...
Generated fingerprints with 1024 features for 841 molecules
Trial 2109: 5-fold CV loss = 0.4661
[I 2025-08-07 23:57:02,488] Trial 2109 finished with value: 0.46613034009933474 and parameters: {'fp_type': 'morgan_rdkit', 'combined_morgan_radius': 3, 'combined_morgan_nBits': 1024, 'combined_rdkit_maxPath': 7, 'combined_rdkit_nBits': 1024, 'num_hidden_layers': 3, 'hidden_dim_0': 256, 'hidden_dim_1': 256, 'hidden_dim_2': 64, 'kl_weight': 0.00035031188480462346, 'lr': 0.005782469375551709, 'batch_size': 128, 'dropout_rate': 0.16166144723663134, 'prior_mu': -0.013123056034685898, 'prior_sigma': 0.07812843157207087, 'normalization': 'layer'}. Best is trial 896 with value: 0.4533553242683411.
Generating rdkit fingerprints...
Generated fingerprints with 1024 features for 841 molecules
Trial 2110: 5-fold CV loss = 0.6855
[I 2025-08-07 23:57:09,385] Trial 2110 finished with value: 0.6855181097984314 and parameters: {'fp_type': 'rdkit', 'rdkit_only_maxPath': 8, 'rdkit_only_nBits': 1024, 'num_hidden_layers': 3, 'hidden_dim_0': 256, 'hidden_dim_1': 256, 'hidden_dim_2': 64, 'kl_weight': 0.0003669200512926931, 'lr': 0.0057256743200326185, 'batch_size': 128, 'dropout_rate': 0.08030077779138423, 'prior_mu': -0.01259799850551554, 'prior_sigma': 0.06729023609333581, 'normalization': 'layer'}. Best is trial 896 with value: 0.4533553242683411.
Generating morgan_rdkit fingerprints...
Generated fingerprints with 2048 features for 841 molecules
Trial 2113: 5-fold CV loss = 0.4661
[I 2025-08-07 23:57:45,870] Trial 2113 finished with value: 0.4661231219768524 and parameters: {'fp_type': 'morgan_rdkit', 'combined_morgan_radius': 3, 'combined_morgan_nBits': 1024, 'combined_rdkit_maxPath': 7, 'combined_rdkit_nBits': 1024, 'num_hidden_layers': 3, 'hidden_dim_0': 512, 'hidden_dim_1': 1024, 'hidden_dim_2': 64, 'kl_weight': 0.000468477835443356, 'lr': 0.006512392434239403, 'batch_size': 128, 'dropout_rate': 0.17024886324027413, 'prior_mu': -0.033703505901525155, 'prior_sigma': 0.07990593545701373, 'normalization': 'layer'}. Best is trial 896 with value: 0.4533553242683411.
Generating morgan_rdkit fingerprints...
Generated fingerprints with 2048 features for 841 molecules
Trial 2111: 5-fold CV loss = 0.6515
[I 2025-08-07 23:57:53,735] Trial 2111 finished with value: 0.6515155136585236 and parameters: {'fp_type': 'rdkit', 'rdkit_only_maxPath': 8, 'rdkit_only_nBits': 1024, 'num_hidden_layers': 3, 'hidden_dim_0': 256, 'hidden_dim_1': 256, 'hidden_dim_2': 64, 'kl_weight': 0.0003522810194723467, 'lr': 0.005661137377024132, 'batch_size': 128, 'dropout_rate': 0.0795566607155215, 'prior_mu': -0.01156294239303881, 'prior_sigma': 0.06784830941292286, 'normalization': 'layer'}. Best is trial 896 with value: 0.4533553242683411.
Generating morgan_rdkit fingerprints...
Generated fingerprints with 2048 features for 841 molecules
Trial 2112: 5-fold CV loss = 0.5005
[I 2025-08-07 23:58:02,278] Trial 2112 finished with value: 0.5004921853542328 and parameters: {'fp_type': 'rdkit', 'rdkit_only_maxPath': 8, 'rdkit_only_nBits': 1024, 'num_hidden_layers': 3, 'hidden_dim_0': 512, 'hidden_dim_1': 1024, 'hidden_dim_2': 64, 'kl_weight': 0.0004595621959058255, 'lr': 0.006548865862819877, 'batch_size': 128, 'dropout_rate': 0.07974306175518887, 'prior_mu': -0.034709714328223125, 'prior_sigma': 0.07039824104516526, 'normalization': 'layer'}. Best is trial 896 with value: 0.4533553242683411.
Generating morgan_rdkit fingerprints...
Generated fingerprints with 2048 features for 841 molecules
Trial 2114: 5-fold CV loss = 0.4646
[I 2025-08-07 23:58:34,574] Trial 2114 finished with value: 0.4646302819252014 and parameters: {'fp_type': 'morgan_rdkit', 'combined_morgan_radius': 3, 'combined_morgan_nBits': 1024, 'combined_rdkit_maxPath': 7, 'combined_rdkit_nBits': 1024, 'num_hidden_layers': 3, 'hidden_dim_0': 64, 'hidden_dim_1': 1024, 'hidden_dim_2': 64, 'kl_weight': 0.0002954351316739575, 'lr': 0.006310762318697304, 'batch_size': 128, 'dropout_rate': 0.1030632910111273, 'prior_mu': 0.0033561290182428163, 'prior_sigma': 0.10160871033426908, 'normalization': 'layer'}. Best is trial 896 with value: 0.4533553242683411.
Generating morgan_rdkit fingerprints...
Generated fingerprints with 2048 features for 841 molecules
Trial 2108: 5-fold CV loss = 0.5085
[I 2025-08-07 23:58:36,742] Trial 2108 finished with value: 0.50849170088768 and parameters: {'fp_type': 'rdkit', 'rdkit_only_maxPath': 8, 'rdkit_only_nBits': 1024, 'num_hidden_layers': 3, 'hidden_dim_0': 256, 'hidden_dim_1': 256, 'hidden_dim_2': 64, 'kl_weight': 0.00024370407182775693, 'lr': 0.0074377233324121675, 'batch_size': 128, 'dropout_rate': 0.16214863821110576, 'prior_mu': -0.012979736454824557, 'prior_sigma': 0.07077658233269357, 'normalization': 'layer'}. Best is trial 896 with value: 0.4533553242683411.
Generating morgan_rdkit fingerprints...
Generated fingerprints with 2048 features for 841 molecules
Trial 2116: 5-fold CV loss = 0.4737
