[I 2025-08-07 18:59:39,048] Trial 587 finished with value: 0.4552353322505951 and parameters: {'fp_type': 'morgan_rdkit', 'combined_morgan_radius': 3, 'combined_morgan_nBits': 1024, 'combined_rdkit_maxPath': 7, 'combined_rdkit_nBits': 1024, 'num_hidden_layers': 3, 'hidden_dim_0': 256, 'hidden_dim_1': 1024, 'hidden_dim_2': 64, 'kl_weight': 0.0003652936026529487, 'lr': 0.007305897896939693, 'batch_size': 128, 'dropout_rate': 0.15305646521192348, 'prior_mu': -0.022265089418161396, 'prior_sigma': 0.08981069425729316, 'normalization': 'layer'}. Best is trial 587 with value: 0.4552353322505951.
Generating morgan_rdkit fingerprints...
Generated fingerprints with 2048 features for 841 molecules
Trial 588: 5-fold CV loss = 0.4707
[I 2025-08-07 18:59:52,800] Trial 588 finished with value: 0.4706990957260132 and parameters: {'fp_type': 'morgan_rdkit', 'combined_morgan_radius': 3, 'combined_morgan_nBits': 1024, 'combined_rdkit_maxPath': 7, 'combined_rdkit_nBits': 1024, 'num_hidden_layers': 3, 'hidden_dim_0': 256, 'hidden_dim_1': 1024, 'hidden_dim_2': 64, 'kl_weight': 0.0003957128205955863, 'lr': 0.0072550874802957445, 'batch_size': 128, 'dropout_rate': 0.15061514252265817, 'prior_mu': -0.03132148903476015, 'prior_sigma': 0.09039878138719942, 'normalization': 'layer'}. Best is trial 587 with value: 0.4552353322505951.
Generating morgan_rdkit fingerprints...
Generated fingerprints with 1280 features for 841 molecules
Trial 586: 5-fold CV loss = 0.6702
[I 2025-08-07 19:00:04,374] Trial 586 finished with value: 0.6701660573482513 and parameters: {'fp_type': 'rdkit', 'rdkit_only_maxPath': 8, 'rdkit_only_nBits': 1024, 'num_hidden_layers': 3, 'hidden_dim_0': 256, 'hidden_dim_1': 1024, 'hidden_dim_2': 64, 'kl_weight': 0.0003925365308315296, 'lr': 0.007038479849002648, 'batch_size': 128, 'dropout_rate': 0.12214101110548034, 'prior_mu': -0.022751861480530496, 'prior_sigma': 0.09902766985400703, 'normalization': 'layer'}. Best is trial 587 with value: 0.4552353322505951.
Generating morgan_rdkit fingerprints...
Generated fingerprints with 1280 features for 841 molecules
Trial 589: 5-fold CV loss = 0.4578
[I 2025-08-07 19:00:13,247] Trial 589 finished with value: 0.4577645719051361 and parameters: {'fp_type': 'morgan_rdkit', 'combined_morgan_radius': 3, 'combined_morgan_nBits': 1024, 'combined_rdkit_maxPath': 7, 'combined_rdkit_nBits': 1024, 'num_hidden_layers': 3, 'hidden_dim_0': 256, 'hidden_dim_1': 1024, 'hidden_dim_2': 64, 'kl_weight': 0.0003802994396024012, 'lr': 0.007362691338620884, 'batch_size': 128, 'dropout_rate': 0.1535523142087249, 'prior_mu': -0.03190659253800261, 'prior_sigma': 0.08995766523622685, 'normalization': 'layer'}. Best is trial 587 with value: 0.4552353322505951.
Generating morgan_rdkit fingerprints...
Generated fingerprints with 1280 features for 841 molecules
Trial 590: 5-fold CV loss = 0.5142
[I 2025-08-07 19:00:25,453] Trial 590 finished with value: 0.5141613185405731 and parameters: {'fp_type': 'morgan_rdkit', 'combined_morgan_radius': 3, 'combined_morgan_nBits': 1024, 'combined_rdkit_maxPath': 7, 'combined_rdkit_nBits': 256, 'num_hidden_layers': 3, 'hidden_dim_0': 256, 'hidden_dim_1': 1024, 'hidden_dim_2': 64, 'kl_weight': 0.00037295954593718794, 'lr': 0.00798556337033328, 'batch_size': 128, 'dropout_rate': 0.14022562025147486, 'prior_mu': -0.02055888576829719, 'prior_sigma': 0.09342808085934676, 'normalization': 'layer'}. Best is trial 587 with value: 0.4552353322505951.
Generating morgan_rdkit fingerprints...
Generated fingerprints with 2048 features for 841 molecules
Trial 585: 5-fold CV loss = 0.6363
[I 2025-08-07 19:00:31,903] Trial 585 finished with value: 0.6362540364265442 and parameters: {'fp_type': 'rdkit', 'rdkit_only_maxPath': 8, 'rdkit_only_nBits': 1024, 'num_hidden_layers': 3, 'hidden_dim_0': 256, 'hidden_dim_1': 1024, 'hidden_dim_2': 64, 'kl_weight': 0.00038866155590301345, 'lr': 0.006489790271070522, 'batch_size': 128, 'dropout_rate': 0.12411139173045799, 'prior_mu': -0.023216113383124733, 'prior_sigma': 0.09700655971479245, 'normalization': 'layer'}. Best is trial 587 with value: 0.4552353322505951.
Generating morgan_rdkit fingerprints...
Generated fingerprints with 2048 features for 841 molecules
Trial 592: 5-fold CV loss = 0.5230
[I 2025-08-07 19:00:40,959] Trial 592 finished with value: 0.5230355262756348 and parameters: {'fp_type': 'morgan_rdkit', 'combined_morgan_radius': 3, 'combined_morgan_nBits': 1024, 'combined_rdkit_maxPath': 7, 'combined_rdkit_nBits': 256, 'num_hidden_layers': 3, 'hidden_dim_0': 256, 'hidden_dim_1': 1024, 'hidden_dim_2': 64, 'kl_weight': 0.00034746795177513875, 'lr': 0.008397730797448235, 'batch_size': 128, 'dropout_rate': 0.14099623012927787, 'prior_mu': -0.03092688458221736, 'prior_sigma': 0.08890039081271302, 'normalization': 'layer'}. Best is trial 587 with value: 0.4552353322505951.
Generating morgan_rdkit fingerprints...
Generated fingerprints with 2048 features for 841 molecules
Trial 591: 5-fold CV loss = 0.5134
[I 2025-08-07 19:00:55,396] Trial 591 finished with value: 0.513374537229538 and parameters: {'fp_type': 'morgan_rdkit', 'combined_morgan_radius': 3, 'combined_morgan_nBits': 1024, 'combined_rdkit_maxPath': 7, 'combined_rdkit_nBits': 256, 'num_hidden_layers': 3, 'hidden_dim_0': 256, 'hidden_dim_1': 1024, 'hidden_dim_2': 64, 'kl_weight': 0.00033322311791959933, 'lr': 0.008268880982714704, 'batch_size': 128, 'dropout_rate': 0.1547092102824376, 'prior_mu': -0.016755036866763703, 'prior_sigma': 0.09408031543964984, 'normalization': 'layer'}. Best is trial 587 with value: 0.4552353322505951.
Generating morgan_rdkit fingerprints...
Generated fingerprints with 2048 features for 841 molecules
Trial 593: 5-fold CV loss = 0.4648
[I 2025-08-07 19:01:09,464] Trial 593 finished with value: 0.4648440062999725 and parameters: {'fp_type': 'morgan_rdkit', 'combined_morgan_radius': 3, 'combined_morgan_nBits': 1024, 'combined_rdkit_maxPath': 7, 'combined_rdkit_nBits': 1024, 'num_hidden_layers': 3, 'hidden_dim_0': 256, 'hidden_dim_1': 1024, 'hidden_dim_2': 64, 'kl_weight': 0.00032215676854289305, 'lr': 0.008132214353951122, 'batch_size': 128, 'dropout_rate': 0.1575469441246658, 'prior_mu': -0.03624391957019738, 'prior_sigma': 0.08917095416728696, 'normalization': 'layer'}. Best is trial 587 with value: 0.4552353322505951.
Generating morgan fingerprints...
Generated fingerprints with 2048 features for 841 molecules
Trial 595: 5-fold CV loss = 0.4669
[I 2025-08-07 19:01:15,750] Trial 595 finished with value: 0.46686164736747743 and parameters: {'fp_type': 'morgan_rdkit', 'combined_morgan_radius': 3, 'combined_morgan_nBits': 1024, 'combined_rdkit_maxPath': 7, 'combined_rdkit_nBits': 1024, 'num_hidden_layers': 3, 'hidden_dim_0': 256, 'hidden_dim_1': 1024, 'hidden_dim_2': 64, 'kl_weight': 0.0006043230762933694, 'lr': 0.007409221386283149, 'batch_size': 128, 'dropout_rate': 0.15761430747366995, 'prior_mu': -0.03787621065216554, 'prior_sigma': 0.08910542521105447, 'normalization': 'layer'}. Best is trial 587 with value: 0.4552353322505951.
Generating morgan fingerprints...
Generated fingerprints with 1024 features for 841 molecules
Trial 597: 5-fold CV loss = 0.6086
[I 2025-08-07 19:01:39,498] Trial 597 finished with value: 0.6086238503456116 and parameters: {'fp_type': 'morgan', 'morgan_only_radius': 2, 'morgan_only_nBits': 2048, 'num_hidden_layers': 3, 'hidden_dim_0': 256, 'hidden_dim_1': 1024, 'hidden_dim_2': 256, 'kl_weight': 0.0004613370400097156, 'lr': 0.007683105993609232, 'batch_size': 128, 'dropout_rate': 0.16057222734514645, 'prior_mu': -0.03745443775063559, 'prior_sigma': 0.0892683235816892, 'normalization': 'none'}. Best is trial 587 with value: 0.4552353322505951.
Generating morgan_rdkit fingerprints...
Generated fingerprints with 2048 features for 841 molecules
Trial 596: 5-fold CV loss = 0.4634
[I 2025-08-07 19:01:40,780] Trial 596 finished with value: 0.4634135365486145 and parameters: {'fp_type': 'morgan_rdkit', 'combined_morgan_radius': 3, 'combined_morgan_nBits': 1024, 'combined_rdkit_maxPath': 7, 'combined_rdkit_nBits': 1024, 'num_hidden_layers': 3, 'hidden_dim_0': 256, 'hidden_dim_1': 1024, 'hidden_dim_2': 64, 'kl_weight': 0.0005731867249219436, 'lr': 0.007499924715371297, 'batch_size': 128, 'dropout_rate': 0.16505058485375038, 'prior_mu': -0.036567657389594777, 'prior_sigma': 0.06301363359635219, 'normalization': 'layer'}. Best is trial 587 with value: 0.4552353322505951.
Generating morgan_rdkit fingerprints...
Generated fingerprints with 2048 features for 841 molecules
Trial 598: 5-fold CV loss = 0.5823
[I 2025-08-07 19:01:44,515] Trial 598 finished with value: 0.5823379278182983 and parameters: {'fp_type': 'morgan', 'morgan_only_radius': 2, 'morgan_only_nBits': 1024, 'num_hidden_layers': 3, 'hidden_dim_0': 256, 'hidden_dim_1': 1024, 'hidden_dim_2': 64, 'kl_weight': 0.00046981103059745783, 'lr': 0.00914189768286853, 'batch_size': 128, 'dropout_rate': 0.1393050334335449, 'prior_mu': -0.03423547045808939, 'prior_sigma': 0.08697878515010327, 'normalization': 'none'}. Best is trial 587 with value: 0.4552353322505951.
Generating morgan_rdkit fingerprints...
Generated fingerprints with 2048 features for 841 molecules
Trial 594: 5-fold CV loss = 0.4633
[I 2025-08-07 19:01:58,398] Trial 594 finished with value: 0.4632773041725159 and parameters: {'fp_type': 'morgan_rdkit', 'combined_morgan_radius': 3, 'combined_morgan_nBits': 1024, 'combined_rdkit_maxPath': 7, 'combined_rdkit_nBits': 1024, 'num_hidden_layers': 3, 'hidden_dim_0': 256, 'hidden_dim_1': 1024, 'hidden_dim_2': 64, 'kl_weight': 0.00031922572021486346, 'lr': 0.008794914791451896, 'batch_size': 128, 'dropout_rate': 0.1567009612870879, 'prior_mu': -0.032496147322987765, 'prior_sigma': 0.08772378035194581, 'normalization': 'layer'}. Best is trial 587 with value: 0.4552353322505951.
Generating morgan_rdkit fingerprints...
Generated fingerprints with 2048 features for 841 molecules
Trial 601: 5-fold CV loss = 0.4811
[I 2025-08-07 19:02:20,380] Trial 601 finished with value: 0.4811233699321747 and parameters: {'fp_type': 'morgan_rdkit', 'combined_morgan_radius': 3, 'combined_morgan_nBits': 1024, 'combined_rdkit_maxPath': 7, 'combined_rdkit_nBits': 1024, 'num_hidden_layers': 3, 'hidden_dim_0': 256, 'hidden_dim_1': 1024, 'hidden_dim_2': 128, 'kl_weight': 0.0006040127176628127, 'lr': 0.008797134449907549, 'batch_size': 128, 'dropout_rate': 0.16935395384214583, 'prior_mu': -0.04790657326746329, 'prior_sigma': 0.09437589190600466, 'normalization': 'layer'}. Best is trial 587 with value: 0.4552353322505951.
Generating morgan_rdkit fingerprints...
Generated fingerprints with 2048 features for 841 molecules
Trial 599: 5-fold CV loss = 0.4624
[I 2025-08-07 19:02:24,325] Trial 599 finished with value: 0.4624283194541931 and parameters: {'fp_type': 'morgan_rdkit', 'combined_morgan_radius': 3, 'combined_morgan_nBits': 1024, 'combined_rdkit_maxPath': 7, 'combined_rdkit_nBits': 1024, 'num_hidden_layers': 3, 'hidden_dim_0': 256, 'hidden_dim_1': 1024, 'hidden_dim_2': 64, 'kl_weight': 0.00031073359166576336, 'lr': 0.008405338017314886, 'batch_size': 128, 'dropout_rate': 0.13697206050560273, 'prior_mu': -0.03098226549746169, 'prior_sigma': 0.08632055757106595, 'normalization': 'layer'}. Best is trial 587 with value: 0.4552353322505951.
Generating morgan_rdkit fingerprints...
Generated fingerprints with 2048 features for 841 molecules
Trial 600: 5-fold CV loss = 0.4617
[I 2025-08-07 19:02:32,387] Trial 600 finished with value: 0.46167383193969724 and parameters: {'fp_type': 'morgan_rdkit', 'combined_morgan_radius': 3, 'combined_morgan_nBits': 1024, 'combined_rdkit_maxPath': 7, 'combined_rdkit_nBits': 1024, 'num_hidden_layers': 3, 'hidden_dim_0': 256, 'hidden_dim_1': 1024, 'hidden_dim_2': 64, 'kl_weight': 0.0005243236571879189, 'lr': 0.009075818585778292, 'batch_size': 128, 'dropout_rate': 0.16663581113890083, 'prior_mu': -0.038606120478015295, 'prior_sigma': 0.06159668023168807, 'normalization': 'layer'}. Best is trial 587 with value: 0.4552353322505951.
Generating morgan_rdkit fingerprints...
Generated fingerprints with 2048 features for 841 molecules
Trial 603: 5-fold CV loss = 0.4613
[I 2025-08-07 19:02:55,754] Trial 603 finished with value: 0.46133832931518554 and parameters: {'fp_type': 'morgan_rdkit', 'combined_morgan_radius': 3, 'combined_morgan_nBits': 1024, 'combined_rdkit_maxPath': 7, 'combined_rdkit_nBits': 1024, 'num_hidden_layers': 3, 'hidden_dim_0': 256, 'hidden_dim_1': 1024, 'hidden_dim_2': 64, 'kl_weight': 0.00046588791844358606, 'lr': 0.009035141652202006, 'batch_size': 128, 'dropout_rate': 0.16178627106953183, 'prior_mu': -0.038532467143962384, 'prior_sigma': 0.09104613266001527, 'normalization': 'layer'}. Best is trial 587 with value: 0.4552353322505951.
Generating morgan_rdkit fingerprints...
Generated fingerprints with 2048 features for 841 molecules
Trial 604: 5-fold CV loss = 0.4610
[I 2025-08-07 19:03:06,512] Trial 604 finished with value: 0.46096210479736327 and parameters: {'fp_type': 'morgan_rdkit', 'combined_morgan_radius': 3, 'combined_morgan_nBits': 1024, 'combined_rdkit_maxPath': 7, 'combined_rdkit_nBits': 1024, 'num_hidden_layers': 3, 'hidden_dim_0': 256, 'hidden_dim_1': 1024, 'hidden_dim_2': 64, 'kl_weight': 0.0005156724163408175, 'lr': 0.008769778883131097, 'batch_size': 128, 'dropout_rate': 0.16466800082059285, 'prior_mu': -0.03806709011551613, 'prior_sigma': 0.08938646566680199, 'normalization': 'layer'}. Best is trial 587 with value: 0.4552353322505951.
Generating morgan_rdkit fingerprints...
Generated fingerprints with 2048 features for 841 molecules
Trial 605: 5-fold CV loss = 0.4682
[I 2025-08-07 19:03:20,001] Trial 605 finished with value: 0.46819586157798765 and parameters: {'fp_type': 'morgan_rdkit', 'combined_morgan_radius': 3, 'combined_morgan_nBits': 1024, 'combined_rdkit_maxPath': 7, 'combined_rdkit_nBits': 1024, 'num_hidden_layers': 3, 'hidden_dim_0': 256, 'hidden_dim_1': 1024, 'hidden_dim_2': 64, 'kl_weight': 0.0004954608596569451, 'lr': 0.009463023049888988, 'batch_size': 128, 'dropout_rate': 0.14834384462154565, 'prior_mu': -0.048811024207481346, 'prior_sigma': 0.061261885982309916, 'normalization': 'layer'}. Best is trial 587 with value: 0.4552353322505951.
Generating morgan_rdkit fingerprints...
Generated fingerprints with 2048 features for 841 molecules
Trial 606: 5-fold CV loss = 0.4691
[I 2025-08-07 19:03:27,610] Trial 606 finished with value: 0.4690994381904602 and parameters: {'fp_type': 'morgan_rdkit', 'combined_morgan_radius': 3, 'combined_morgan_nBits': 1024, 'combined_rdkit_maxPath': 7, 'combined_rdkit_nBits': 1024, 'num_hidden_layers': 3, 'hidden_dim_0': 256, 'hidden_dim_1': 1024, 'hidden_dim_2': 64, 'kl_weight': 0.0005932980912083665, 'lr': 0.00998542201040866, 'batch_size': 128, 'dropout_rate': 0.168500703161912, 'prior_mu': -0.05157307232442121, 'prior_sigma': 0.06269221604675368, 'normalization': 'layer'}. Best is trial 587 with value: 0.4552353322505951.
Generating morgan_rdkit fingerprints...
Generated fingerprints with 2048 features for 841 molecules
Trial 602: 5-fold CV loss = 0.4656
[I 2025-08-07 19:03:29,622] Trial 602 finished with value: 0.4656224727630615 and parameters: {'fp_type': 'morgan_rdkit', 'combined_morgan_radius': 3, 'combined_morgan_nBits': 1024, 'combined_rdkit_maxPath': 7, 'combined_rdkit_nBits': 1024, 'num_hidden_layers': 3, 'hidden_dim_0': 256, 'hidden_dim_1': 1024, 'hidden_dim_2': 64, 'kl_weight': 0.0005263154032262875, 'lr': 0.008859899467566861, 'batch_size': 128, 'dropout_rate': 0.16664497449742227, 'prior_mu': -0.04860158008555427, 'prior_sigma': 0.09509738603220574, 'normalization': 'layer'}. Best is trial 587 with value: 0.4552353322505951.
Generating morgan_rdkit fingerprints...
Generated fingerprints with 2048 features for 841 molecules
Trial 607: 5-fold CV loss = 0.5342
[I 2025-08-07 19:03:44,348] Trial 607 finished with value: 0.5341936707496643 and parameters: {'fp_type': 'morgan_rdkit', 'combined_morgan_radius': 3, 'combined_morgan_nBits': 1024, 'combined_rdkit_maxPath': 7, 'combined_rdkit_nBits': 1024, 'num_hidden_layers': 3, 'hidden_dim_0': 256, 'hidden_dim_1': 1024, 'hidden_dim_2': 64, 'kl_weight': 0.000798783488209587, 'lr': 0.00988795809375014, 'batch_size': 128, 'dropout_rate': 0.16832607426769003, 'prior_mu': -0.0587129519452952, 'prior_sigma': 0.10082231599806385, 'normalization': 'layer'}. Best is trial 587 with value: 0.4552353322505951.
Generating morgan_rdkit fingerprints...
Generated fingerprints with 2048 features for 841 molecules
Trial 609: 5-fold CV loss = 0.4673
[I 2025-08-07 19:04:02,796] Trial 609 finished with value: 0.46734742522239686 and parameters: {'fp_type': 'morgan_rdkit', 'combined_morgan_radius': 3, 'combined_morgan_nBits': 1024, 'combined_rdkit_maxPath': 7, 'combined_rdkit_nBits': 1024, 'num_hidden_layers': 3, 'hidden_dim_0': 256, 'hidden_dim_1': 1024, 'hidden_dim_2': 64, 'kl_weight': 0.0005677426871502215, 'lr': 0.009216448669505986, 'batch_size': 128, 'dropout_rate': 0.16856622427165124, 'prior_mu': -0.06155186610573817, 'prior_sigma': 0.10108507984488004, 'normalization': 'layer'}. Best is trial 587 with value: 0.4552353322505951.
Generating morgan_rdkit fingerprints...
Generated fingerprints with 2048 features for 841 molecules
Trial 608: 5-fold CV loss = 0.4692
[I 2025-08-07 19:04:15,638] Trial 608 finished with value: 0.46918630599975586 and parameters: {'fp_type': 'morgan_rdkit', 'combined_morgan_radius': 3, 'combined_morgan_nBits': 1024, 'combined_rdkit_maxPath': 7, 'combined_rdkit_nBits': 1024, 'num_hidden_layers': 3, 'hidden_dim_0': 256, 'hidden_dim_1': 1024, 'hidden_dim_2': 64, 'kl_weight': 0.0007337400155089211, 'lr': 0.00864982815857734, 'batch_size': 128, 'dropout_rate': 0.1690402089219058, 'prior_mu': -0.04333046280631019, 'prior_sigma': 0.101069547505659, 'normalization': 'layer'}. Best is trial 587 with value: 0.4552353322505951.
Generating morgan_rdkit fingerprints...
Generated fingerprints with 2048 features for 841 molecules
Trial 611: 5-fold CV loss = 0.4681
[I 2025-08-07 19:04:24,793] Trial 611 finished with value: 0.46809672713279726 and parameters: {'fp_type': 'morgan_rdkit', 'combined_morgan_radius': 3, 'combined_morgan_nBits': 1024, 'combined_rdkit_maxPath': 7, 'combined_rdkit_nBits': 1024, 'num_hidden_layers': 3, 'hidden_dim_0': 256, 'hidden_dim_1': 1024, 'hidden_dim_2': 64, 'kl_weight': 0.000514126656086959, 'lr': 0.008874050550027865, 'batch_size': 128, 'dropout_rate': 0.16257422077623984, 'prior_mu': -0.040112846049719514, 'prior_sigma': 0.0859352764365514, 'normalization': 'layer'}. Best is trial 587 with value: 0.4552353322505951.
Generating morgan_rdkit fingerprints...
Generated fingerprints with 2048 features for 841 molecules
Trial 612: 5-fold CV loss = 0.4681
[I 2025-08-07 19:04:40,762] Trial 612 finished with value: 0.46813284158706664 and parameters: {'fp_type': 'morgan_rdkit', 'combined_morgan_radius': 3, 'combined_morgan_nBits': 1024, 'combined_rdkit_maxPath': 7, 'combined_rdkit_nBits': 1024, 'num_hidden_layers': 3, 'hidden_dim_0': 256, 'hidden_dim_1': 1024, 'hidden_dim_2': 64, 'kl_weight': 0.0004388458037518647, 'lr': 0.00853319612314833, 'batch_size': 128, 'dropout_rate': 0.15631162958301087, 'prior_mu': -0.038015459723557916, 'prior_sigma': 0.08689943054049755, 'normalization': 'layer'}. Best is trial 587 with value: 0.4552353322505951.
Generating morgan_rdkit fingerprints...
Generated fingerprints with 2048 features for 841 molecules
Trial 614: 5-fold CV loss = 0.4675
[I 2025-08-07 19:05:02,113] Trial 614 finished with value: 0.4675066351890564 and parameters: {'fp_type': 'morgan_rdkit', 'combined_morgan_radius': 3, 'combined_morgan_nBits': 1024, 'combined_rdkit_maxPath': 7, 'combined_rdkit_nBits': 1024, 'num_hidden_layers': 3, 'hidden_dim_0': 256, 'hidden_dim_1': 1024, 'hidden_dim_2': 128, 'kl_weight': 0.00045483677587497665, 'lr': 0.007791573108345713, 'batch_size': 128, 'dropout_rate': 0.15233562477580578, 'prior_mu': -0.03233046395001827, 'prior_sigma': 0.06048452640892889, 'normalization': 'layer'}. Best is trial 587 with value: 0.4552353322505951.
Generating morgan_rdkit fingerprints...
Generated fingerprints with 1536 features for 841 molecules
Trial 610: 5-fold CV loss = 0.4639
[I 2025-08-07 19:05:06,942] Trial 610 finished with value: 0.46385456919670104 and parameters: {'fp_type': 'morgan_rdkit', 'combined_morgan_radius': 3, 'combined_morgan_nBits': 1024, 'combined_rdkit_maxPath': 7, 'combined_rdkit_nBits': 1024, 'num_hidden_layers': 3, 'hidden_dim_0': 256, 'hidden_dim_1': 1024, 'hidden_dim_2': 64, 'kl_weight': 0.0007829764037412803, 'lr': 0.009114313434227986, 'batch_size': 128, 'dropout_rate': 0.16463868533999773, 'prior_mu': -0.03981726253190493, 'prior_sigma': 0.10120907653799514, 'normalization': 'layer'}. Best is trial 587 with value: 0.4552353322505951.
Generating morgan_rdkit fingerprints...
Generated fingerprints with 1536 features for 841 molecules
Trial 613: 5-fold CV loss = 0.4638
[I 2025-08-07 19:05:10,714] Trial 613 finished with value: 0.46378610730171205 and parameters: {'fp_type': 'morgan_rdkit', 'combined_morgan_radius': 3, 'combined_morgan_nBits': 1024, 'combined_rdkit_maxPath': 7, 'combined_rdkit_nBits': 1024, 'num_hidden_layers': 3, 'hidden_dim_0': 256, 'hidden_dim_1': 1024, 'hidden_dim_2': 128, 'kl_weight': 0.0004375463559528642, 'lr': 0.008013206083663679, 'batch_size': 128, 'dropout_rate': 0.1536413591457559, 'prior_mu': -0.04196681750739089, 'prior_sigma': 0.05981198094059298, 'normalization': 'layer'}. Best is trial 587 with value: 0.4552353322505951.
Generating morgan_rdkit fingerprints...
Generated fingerprints with 2048 features for 841 molecules
Trial 615: 5-fold CV loss = 0.4724
