[I 2025-08-07 20:17:53,898] Trial 976 finished with value: 0.7941567063331604 and parameters: {'fp_type': 'morgan_rdkit', 'combined_morgan_radius': 3, 'combined_morgan_nBits': 1024, 'combined_rdkit_maxPath': 7, 'combined_rdkit_nBits': 256, 'num_hidden_layers': 3, 'hidden_dim_0': 256, 'hidden_dim_1': 256, 'hidden_dim_2': 256, 'kl_weight': 0.0003771292719964011, 'lr': 0.00739935873953821, 'batch_size': 128, 'dropout_rate': 0.3635620025602315, 'prior_mu': -0.010840783279322228, 'prior_sigma': 0.11477896562827353, 'normalization': 'layer'}. Best is trial 896 with value: 0.4533553242683411.
Generating morgan_rdkit fingerprints...
Generated fingerprints with 2048 features for 841 molecules
Trial 977: 5-fold CV loss = 0.5535
[I 2025-08-07 20:18:22,472] Trial 977 finished with value: 0.5535238444805145 and parameters: {'fp_type': 'morgan_rdkit', 'combined_morgan_radius': 3, 'combined_morgan_nBits': 1024, 'combined_rdkit_maxPath': 7, 'combined_rdkit_nBits': 1024, 'num_hidden_layers': 3, 'hidden_dim_0': 256, 'hidden_dim_1': 1024, 'hidden_dim_2': 256, 'kl_weight': 0.0003799848938313728, 'lr': 0.006033431960254796, 'batch_size': 128, 'dropout_rate': 0.12962038987409674, 'prior_mu': -0.01807548700500225, 'prior_sigma': 0.08576830475693524, 'normalization': 'layer'}. Best is trial 896 with value: 0.4533553242683411.
Generating morgan_rdkit fingerprints...
Generated fingerprints with 2048 features for 841 molecules
Trial 979: 5-fold CV loss = 0.4572
[I 2025-08-07 20:18:34,525] Trial 979 finished with value: 0.45715834498405455 and parameters: {'fp_type': 'morgan_rdkit', 'combined_morgan_radius': 3, 'combined_morgan_nBits': 1024, 'combined_rdkit_maxPath': 7, 'combined_rdkit_nBits': 1024, 'num_hidden_layers': 3, 'hidden_dim_0': 256, 'hidden_dim_1': 1024, 'hidden_dim_2': 64, 'kl_weight': 0.00023682653520980056, 'lr': 0.005924306878148067, 'batch_size': 128, 'dropout_rate': 0.07409612411411398, 'prior_mu': 0.01102096725347674, 'prior_sigma': 0.07287014388738369, 'normalization': 'layer'}. Best is trial 896 with value: 0.4533553242683411.
Generating morgan_rdkit fingerprints...
Generated fingerprints with 2048 features for 841 molecules
Trial 980: 5-fold CV loss = 0.5588
[I 2025-08-07 20:18:51,462] Trial 980 finished with value: 0.5587571144104004 and parameters: {'fp_type': 'morgan_rdkit', 'combined_morgan_radius': 3, 'combined_morgan_nBits': 1024, 'combined_rdkit_maxPath': 7, 'combined_rdkit_nBits': 1024, 'num_hidden_layers': 3, 'hidden_dim_0': 256, 'hidden_dim_1': 64, 'hidden_dim_2': 64, 'kl_weight': 0.00023115943752422774, 'lr': 0.006530240535702981, 'batch_size': 128, 'dropout_rate': 0.0823099794076799, 'prior_mu': 0.005389873677411106, 'prior_sigma': 0.07315963465535182, 'normalization': 'layer'}. Best is trial 896 with value: 0.4533553242683411.
Generating morgan_rdkit fingerprints...
Generated fingerprints with 2048 features for 841 molecules
Trial 978: 5-fold CV loss = 0.4711
[I 2025-08-07 20:18:53,129] Trial 978 finished with value: 0.4710879147052765 and parameters: {'fp_type': 'morgan_rdkit', 'combined_morgan_radius': 3, 'combined_morgan_nBits': 1024, 'combined_rdkit_maxPath': 7, 'combined_rdkit_nBits': 1024, 'num_hidden_layers': 3, 'hidden_dim_0': 256, 'hidden_dim_1': 1024, 'hidden_dim_2': 256, 'kl_weight': 0.00023306204433503456, 'lr': 0.006193689914919431, 'batch_size': 128, 'dropout_rate': 0.06534382264185512, 'prior_mu': 0.009419079885865128, 'prior_sigma': 0.07592307231109276, 'normalization': 'layer'}. Best is trial 896 with value: 0.4533553242683411.
Generating morgan_rdkit fingerprints...
Generated fingerprints with 2048 features for 841 molecules
Trial 974: 5-fold CV loss = 0.4681
[I 2025-08-07 20:19:10,636] Trial 974 finished with value: 0.46808323860168455 and parameters: {'fp_type': 'morgan_rdkit', 'combined_morgan_radius': 3, 'combined_morgan_nBits': 1024, 'combined_rdkit_maxPath': 7, 'combined_rdkit_nBits': 1024, 'num_hidden_layers': 3, 'hidden_dim_0': 256, 'hidden_dim_1': 256, 'hidden_dim_2': 64, 'kl_weight': 0.0002988271809792176, 'lr': 0.007478659138567714, 'batch_size': 128, 'dropout_rate': 0.12706357977656046, 'prior_mu': -0.011288701829064066, 'prior_sigma': 0.11726079824693696, 'normalization': 'layer'}. Best is trial 896 with value: 0.4533553242683411.
Generating morgan_rdkit fingerprints...
Generated fingerprints with 2048 features for 841 molecules
Trial 981: 5-fold CV loss = 0.4758
[I 2025-08-07 20:19:15,900] Trial 981 finished with value: 0.4757703304290771 and parameters: {'fp_type': 'morgan_rdkit', 'combined_morgan_radius': 3, 'combined_morgan_nBits': 1024, 'combined_rdkit_maxPath': 7, 'combined_rdkit_nBits': 1024, 'num_hidden_layers': 3, 'hidden_dim_0': 256, 'hidden_dim_1': 64, 'hidden_dim_2': 64, 'kl_weight': 0.0002191661706664694, 'lr': 0.005574704804721309, 'batch_size': 128, 'dropout_rate': 0.06041666356564189, 'prior_mu': 0.012581737248291636, 'prior_sigma': 0.06953542165440967, 'normalization': 'layer'}. Best is trial 896 with value: 0.4533553242683411.
Generating morgan_rdkit fingerprints...
Generated fingerprints with 2048 features for 841 molecules
Trial 982: 5-fold CV loss = 0.4646
[I 2025-08-07 20:19:30,234] Trial 982 finished with value: 0.4646124720573425 and parameters: {'fp_type': 'morgan_rdkit', 'combined_morgan_radius': 3, 'combined_morgan_nBits': 1024, 'combined_rdkit_maxPath': 7, 'combined_rdkit_nBits': 1024, 'num_hidden_layers': 3, 'hidden_dim_0': 256, 'hidden_dim_1': 1024, 'hidden_dim_2': 64, 'kl_weight': 0.00021982338809463196, 'lr': 0.005260472592469533, 'batch_size': 128, 'dropout_rate': 0.08666752965991151, 'prior_mu': 0.014748498282632552, 'prior_sigma': 0.07350187249869067, 'normalization': 'layer'}. Best is trial 896 with value: 0.4533553242683411.
Generating morgan_rdkit fingerprints...
Generated fingerprints with 2048 features for 841 molecules
Trial 983: 5-fold CV loss = 0.4844
[I 2025-08-07 20:19:47,135] Trial 983 finished with value: 0.4843700289726257 and parameters: {'fp_type': 'morgan_rdkit', 'combined_morgan_radius': 3, 'combined_morgan_nBits': 1024, 'combined_rdkit_maxPath': 8, 'combined_rdkit_nBits': 1024, 'num_hidden_layers': 3, 'hidden_dim_0': 512, 'hidden_dim_1': 1024, 'hidden_dim_2': 64, 'kl_weight': 0.00021479832953907603, 'lr': 0.005210958456619586, 'batch_size': 128, 'dropout_rate': 0.051947017070981746, 'prior_mu': 0.016549053318097258, 'prior_sigma': 0.06678268197193328, 'normalization': 'layer'}. Best is trial 896 with value: 0.4533553242683411.
Generating morgan_rdkit fingerprints...
Generated fingerprints with 2048 features for 841 molecules
Trial 986: 5-fold CV loss = 0.8139
[I 2025-08-07 20:19:54,183] Trial 986 finished with value: 0.8138904571533203 and parameters: {'fp_type': 'morgan_rdkit', 'combined_morgan_radius': 3, 'combined_morgan_nBits': 1024, 'combined_rdkit_maxPath': 8, 'combined_rdkit_nBits': 1024, 'num_hidden_layers': 3, 'hidden_dim_0': 256, 'hidden_dim_1': 1024, 'hidden_dim_2': 512, 'kl_weight': 0.000256952056788799, 'lr': 0.005849951576517197, 'batch_size': 128, 'dropout_rate': 0.0712039415025016, 'prior_mu': 0.013021514129373489, 'prior_sigma': 0.07276242182460482, 'normalization': 'layer'}. Best is trial 896 with value: 0.4533553242683411.
Generating morgan_rdkit fingerprints...
Generated fingerprints with 2048 features for 841 molecules
Trial 985: 5-fold CV loss = 0.5816
[I 2025-08-07 20:19:57,334] Trial 985 finished with value: 0.5816149413585663 and parameters: {'fp_type': 'morgan_rdkit', 'combined_morgan_radius': 3, 'combined_morgan_nBits': 1024, 'combined_rdkit_maxPath': 5, 'combined_rdkit_nBits': 1024, 'num_hidden_layers': 3, 'hidden_dim_0': 512, 'hidden_dim_1': 1024, 'hidden_dim_2': 512, 'kl_weight': 0.0002096730447468938, 'lr': 0.005055266463802439, 'batch_size': 128, 'dropout_rate': 0.09810387587658939, 'prior_mu': 0.0174329363935897, 'prior_sigma': 0.07046636956762836, 'normalization': 'layer'}. Best is trial 896 with value: 0.4533553242683411.
Generating morgan_rdkit fingerprints...
Generated fingerprints with 2048 features for 841 molecules
Trial 987: 5-fold CV loss = 0.5903
[I 2025-08-07 20:20:33,177] Trial 987 finished with value: 0.5903215110301971 and parameters: {'fp_type': 'morgan_rdkit', 'combined_morgan_radius': 3, 'combined_morgan_nBits': 1024, 'combined_rdkit_maxPath': 5, 'combined_rdkit_nBits': 1024, 'num_hidden_layers': 3, 'hidden_dim_0': 256, 'hidden_dim_1': 1024, 'hidden_dim_2': 512, 'kl_weight': 0.0002552021956544402, 'lr': 0.0055818716461833884, 'batch_size': 128, 'dropout_rate': 0.07994667746736342, 'prior_mu': 0.006254196709667375, 'prior_sigma': 0.07350932939154042, 'normalization': 'layer'}. Best is trial 896 with value: 0.4533553242683411.
Generating morgan_rdkit fingerprints...
Generated fingerprints with 2048 features for 841 molecules
Trial 988: 5-fold CV loss = 0.4645
[I 2025-08-07 20:20:34,953] Trial 988 finished with value: 0.46449376940727233 and parameters: {'fp_type': 'morgan_rdkit', 'combined_morgan_radius': 3, 'combined_morgan_nBits': 1024, 'combined_rdkit_maxPath': 7, 'combined_rdkit_nBits': 1024, 'num_hidden_layers': 3, 'hidden_dim_0': 256, 'hidden_dim_1': 1024, 'hidden_dim_2': 64, 'kl_weight': 0.00019392295597473347, 'lr': 0.005969210085599353, 'batch_size': 128, 'dropout_rate': 0.06620077591366243, 'prior_mu': 0.0034821189386891518, 'prior_sigma': 0.07099697403189976, 'normalization': 'layer'}. Best is trial 896 with value: 0.4533553242683411.
Generating morgan fingerprints...
Generated fingerprints with 2048 features for 841 molecules
Trial 989: 5-fold CV loss = 0.4658
[I 2025-08-07 20:20:44,474] Trial 989 finished with value: 0.46579098105430605 and parameters: {'fp_type': 'morgan_rdkit', 'combined_morgan_radius': 3, 'combined_morgan_nBits': 1024, 'combined_rdkit_maxPath': 7, 'combined_rdkit_nBits': 1024, 'num_hidden_layers': 3, 'hidden_dim_0': 256, 'hidden_dim_1': 1024, 'hidden_dim_2': 64, 'kl_weight': 0.00025801304093460203, 'lr': 0.005828477749126142, 'batch_size': 128, 'dropout_rate': 0.07002785483656772, 'prior_mu': 0.003686917168649672, 'prior_sigma': 0.07508816799561731, 'normalization': 'layer'}. Best is trial 896 with value: 0.4533553242683411.
Generating morgan fingerprints...
Generated fingerprints with 2048 features for 841 molecules
Trial 984: 5-fold CV loss = 0.5526
[I 2025-08-07 20:20:50,511] Trial 984 finished with value: 0.5526370704174042 and parameters: {'fp_type': 'morgan_rdkit', 'combined_morgan_radius': 3, 'combined_morgan_nBits': 1024, 'combined_rdkit_maxPath': 7, 'combined_rdkit_nBits': 1024, 'num_hidden_layers': 3, 'hidden_dim_0': 512, 'hidden_dim_1': 1024, 'hidden_dim_2': 512, 'kl_weight': 0.00020990875869375205, 'lr': 0.0051564463555038974, 'batch_size': 128, 'dropout_rate': 0.059728585179838325, 'prior_mu': 0.00885663527157766, 'prior_sigma': 0.06865968304365161, 'normalization': 'layer'}. Best is trial 896 with value: 0.4533553242683411.
Generating morgan fingerprints...
Generated fingerprints with 2048 features for 841 molecules
Trial 991: 5-fold CV loss = 0.5260
[I 2025-08-07 20:20:53,716] Trial 991 finished with value: 0.5259952187538147 and parameters: {'fp_type': 'morgan', 'morgan_only_radius': 3, 'morgan_only_nBits': 2048, 'num_hidden_layers': 3, 'hidden_dim_0': 256, 'hidden_dim_1': 1024, 'hidden_dim_2': 64, 'kl_weight': 0.00025940541577582895, 'lr': 0.006335299780456385, 'batch_size': 128, 'dropout_rate': 0.06071144271913749, 'prior_mu': 0.003038768955476617, 'prior_sigma': 0.07715700815307314, 'normalization': 'layer'}. Best is trial 896 with value: 0.4533553242683411.
Generating morgan_rdkit fingerprints...
Generated fingerprints with 2048 features for 841 molecules
Trial 992: 5-fold CV loss = 0.5281
[I 2025-08-07 20:21:05,155] Trial 992 finished with value: 0.5280548632144928 and parameters: {'fp_type': 'morgan', 'morgan_only_radius': 3, 'morgan_only_nBits': 2048, 'num_hidden_layers': 3, 'hidden_dim_0': 256, 'hidden_dim_1': 1024, 'hidden_dim_2': 64, 'kl_weight': 0.0002772946804187538, 'lr': 0.006308530681188738, 'batch_size': 128, 'dropout_rate': 0.07504341878850387, 'prior_mu': -0.0010052407306657615, 'prior_sigma': 0.07816091807811962, 'normalization': 'layer'}. Best is trial 896 with value: 0.4533553242683411.
Generating morgan_rdkit fingerprints...
Generated fingerprints with 2048 features for 841 molecules
Trial 995: 5-fold CV loss = 0.6223
[I 2025-08-07 20:21:29,196] Trial 995 finished with value: 0.6223019123077392 and parameters: {'fp_type': 'morgan_rdkit', 'combined_morgan_radius': 3, 'combined_morgan_nBits': 1024, 'combined_rdkit_maxPath': 7, 'combined_rdkit_nBits': 1024, 'num_hidden_layers': 3, 'hidden_dim_0': 256, 'hidden_dim_1': 128, 'hidden_dim_2': 64, 'kl_weight': 0.00023532337094252998, 'lr': 0.006886578934129545, 'batch_size': 128, 'dropout_rate': 0.09200368492058413, 'prior_mu': -0.007077027557991264, 'prior_sigma': 0.07965341206962834, 'normalization': 'none'}. Best is trial 896 with value: 0.4533553242683411.
Generating morgan_rdkit fingerprints...
Generated fingerprints with 2048 features for 841 molecules
Trial 990: 5-fold CV loss = 0.4678
[I 2025-08-07 20:21:30,392] Trial 990 finished with value: 0.4678296685218811 and parameters: {'fp_type': 'morgan_rdkit', 'combined_morgan_radius': 3, 'combined_morgan_nBits': 1024, 'combined_rdkit_maxPath': 7, 'combined_rdkit_nBits': 1024, 'num_hidden_layers': 3, 'hidden_dim_0': 256, 'hidden_dim_1': 1024, 'hidden_dim_2': 64, 'kl_weight': 0.0002539930528917901, 'lr': 0.006033519189216582, 'batch_size': 128, 'dropout_rate': 0.07077826306734807, 'prior_mu': 0.004356129096746639, 'prior_sigma': 0.0771797149356158, 'normalization': 'layer'}. Best is trial 896 with value: 0.4533553242683411.
Generating morgan_rdkit fingerprints...
Generated fingerprints with 2048 features for 841 molecules
Trial 994: 5-fold CV loss = 0.4655
[I 2025-08-07 20:21:32,890] Trial 994 finished with value: 0.465488475561142 and parameters: {'fp_type': 'morgan_rdkit', 'combined_morgan_radius': 3, 'combined_morgan_nBits': 1024, 'combined_rdkit_maxPath': 7, 'combined_rdkit_nBits': 1024, 'num_hidden_layers': 3, 'hidden_dim_0': 256, 'hidden_dim_1': 128, 'hidden_dim_2': 64, 'kl_weight': 0.0002778132568265815, 'lr': 0.006829866064877768, 'batch_size': 128, 'dropout_rate': 0.07853007521330935, 'prior_mu': -0.0036446271342779734, 'prior_sigma': 0.0772662236050328, 'normalization': 'layer'}. Best is trial 896 with value: 0.4533553242683411.
Generating morgan_rdkit fingerprints...
Generated fingerprints with 2048 features for 841 molecules
Trial 993: 5-fold CV loss = 0.5924
[I 2025-08-07 20:22:01,343] Trial 993 finished with value: 0.5923626899719239 and parameters: {'fp_type': 'morgan', 'morgan_only_radius': 3, 'morgan_only_nBits': 2048, 'num_hidden_layers': 3, 'hidden_dim_0': 256, 'hidden_dim_1': 1024, 'hidden_dim_2': 64, 'kl_weight': 0.0002673247084130946, 'lr': 0.006409515065645265, 'batch_size': 128, 'dropout_rate': 0.07601753981897891, 'prior_mu': -0.0018489859336548956, 'prior_sigma': 0.07736384320347954, 'normalization': 'none'}. Best is trial 896 with value: 0.4533553242683411.
Generating morgan_rdkit fingerprints...
Generated fingerprints with 2048 features for 841 molecules
Trial 996: 5-fold CV loss = 0.4640
[I 2025-08-07 20:22:05,953] Trial 996 finished with value: 0.4639862418174744 and parameters: {'fp_type': 'morgan_rdkit', 'combined_morgan_radius': 3, 'combined_morgan_nBits': 1024, 'combined_rdkit_maxPath': 7, 'combined_rdkit_nBits': 1024, 'num_hidden_layers': 3, 'hidden_dim_0': 256, 'hidden_dim_1': 1024, 'hidden_dim_2': 64, 'kl_weight': 0.0002754813782669795, 'lr': 0.006963649910227323, 'batch_size': 128, 'dropout_rate': 0.07583937140540747, 'prior_mu': -0.006776366957332868, 'prior_sigma': 0.07801632317032657, 'normalization': 'layer'}. Best is trial 896 with value: 0.4533553242683411.
Generating rdkit fingerprints...
Generated fingerprints with 256 features for 841 molecules
Trial 998: 5-fold CV loss = 0.4719
[I 2025-08-07 20:22:15,864] Trial 998 finished with value: 0.47193887233734133 and parameters: {'fp_type': 'morgan_rdkit', 'combined_morgan_radius': 3, 'combined_morgan_nBits': 1024, 'combined_rdkit_maxPath': 7, 'combined_rdkit_nBits': 1024, 'num_hidden_layers': 3, 'hidden_dim_0': 256, 'hidden_dim_1': 1024, 'hidden_dim_2': 64, 'kl_weight': 0.000302125417108014, 'lr': 0.004170048295202657, 'batch_size': 128, 'dropout_rate': 0.09955501448902138, 'prior_mu': -0.010792937247661265, 'prior_sigma': 0.08447150639086294, 'normalization': 'layer'}. Best is trial 896 with value: 0.4533553242683411.
Generating rdkit fingerprints...
Generated fingerprints with 256 features for 841 molecules
Trial 997: 5-fold CV loss = 0.4609
[I 2025-08-07 20:22:30,852] Trial 997 finished with value: 0.46089704632759093 and parameters: {'fp_type': 'morgan_rdkit', 'combined_morgan_radius': 3, 'combined_morgan_nBits': 1024, 'combined_rdkit_maxPath': 7, 'combined_rdkit_nBits': 1024, 'num_hidden_layers': 3, 'hidden_dim_0': 256, 'hidden_dim_1': 1024, 'hidden_dim_2': 64, 'kl_weight': 0.00030076262176513394, 'lr': 0.0041801498275570795, 'batch_size': 128, 'dropout_rate': 0.09357070088394293, 'prior_mu': -0.0075373914418124036, 'prior_sigma': 0.06488639415943431, 'normalization': 'layer'}. Best is trial 896 with value: 0.4533553242683411.
Generating rdkit fingerprints...
Generated fingerprints with 256 features for 841 molecules
Trial 1001: 5-fold CV loss = 0.8439
[I 2025-08-07 20:22:37,308] Trial 1001 finished with value: 0.8439008712768554 and parameters: {'fp_type': 'rdkit', 'rdkit_only_maxPath': 5, 'rdkit_only_nBits': 256, 'num_hidden_layers': 3, 'hidden_dim_0': 256, 'hidden_dim_1': 1024, 'hidden_dim_2': 1024, 'kl_weight': 0.00018941785519633103, 'lr': 0.00786295006929968, 'batch_size': 128, 'dropout_rate': 0.08840704213152549, 'prior_mu': -0.01739516200602687, 'prior_sigma': 0.08373485884103356, 'normalization': 'layer'}. Best is trial 896 with value: 0.4533553242683411.
Generating morgan_rdkit fingerprints...
Generated fingerprints with 1536 features for 841 molecules
Trial 1000: 5-fold CV loss = 0.6659
[I 2025-08-07 20:22:39,824] Trial 1000 finished with value: 0.6659254550933837 and parameters: {'fp_type': 'rdkit', 'rdkit_only_maxPath': 5, 'rdkit_only_nBits': 256, 'num_hidden_layers': 3, 'hidden_dim_0': 256, 'hidden_dim_1': 1024, 'hidden_dim_2': 64, 'kl_weight': 0.00030405430319008973, 'lr': 0.00781679191322651, 'batch_size': 128, 'dropout_rate': 0.09489712733246773, 'prior_mu': -0.01575948109649294, 'prior_sigma': 0.08294821588887995, 'normalization': 'layer'}. Best is trial 896 with value: 0.4533553242683411.
Generating morgan_rdkit fingerprints...
Generated fingerprints with 1536 features for 841 molecules
Trial 1002: 5-fold CV loss = 0.9164
[I 2025-08-07 20:22:52,957] Trial 1002 finished with value: 0.9163655519485474 and parameters: {'fp_type': 'rdkit', 'rdkit_only_maxPath': 5, 'rdkit_only_nBits': 256, 'num_hidden_layers': 3, 'hidden_dim_0': 256, 'hidden_dim_1': 1024, 'hidden_dim_2': 1024, 'kl_weight': 0.00022567483520728005, 'lr': 0.00014782445602175932, 'batch_size': 128, 'dropout_rate': 0.09180599388446256, 'prior_mu': -0.010471727351287187, 'prior_sigma': 0.08195960751371453, 'normalization': 'layer'}. Best is trial 896 with value: 0.4533553242683411.
Generating morgan_rdkit fingerprints...
Generated fingerprints with 2048 features for 841 molecules
Trial 1004: 5-fold CV loss = 0.4981
[I 2025-08-07 20:23:17,819] Trial 1004 finished with value: 0.4980871558189392 and parameters: {'fp_type': 'morgan_rdkit', 'combined_morgan_radius': 3, 'combined_morgan_nBits': 1024, 'combined_rdkit_maxPath': 7, 'combined_rdkit_nBits': 512, 'num_hidden_layers': 3, 'hidden_dim_0': 256, 'hidden_dim_1': 1024, 'hidden_dim_2': 64, 'kl_weight': 0.0002327094361440905, 'lr': 0.007318645684037996, 'batch_size': 128, 'dropout_rate': 0.1014154028507222, 'prior_mu': -0.02175320026236235, 'prior_sigma': 0.07110729606111892, 'normalization': 'layer'}. Best is trial 896 with value: 0.4533553242683411.
Generating morgan_rdkit fingerprints...
Generated fingerprints with 2048 features for 841 molecules
Trial 1003: 5-fold CV loss = 0.4939
[I 2025-08-07 20:23:19,520] Trial 1003 finished with value: 0.49392818212509154 and parameters: {'fp_type': 'morgan_rdkit', 'combined_morgan_radius': 3, 'combined_morgan_nBits': 1024, 'combined_rdkit_maxPath': 7, 'combined_rdkit_nBits': 512, 'num_hidden_layers': 3, 'hidden_dim_0': 256, 'hidden_dim_1': 1024, 'hidden_dim_2': 64, 'kl_weight': 0.001144280839516657, 'lr': 0.007913318046198624, 'batch_size': 128, 'dropout_rate': 0.4029493498805702, 'prior_mu': -0.0191656401940396, 'prior_sigma': 0.07036616219600912, 'normalization': 'layer'}. Best is trial 896 with value: 0.4533553242683411.
Generating morgan_rdkit fingerprints...
Generated fingerprints with 2048 features for 841 molecules
Trial 999: 5-fold CV loss = 0.5594
[I 2025-08-07 20:23:23,950] Trial 999 finished with value: 0.5594316303730011 and parameters: {'fp_type': 'morgan_rdkit', 'combined_morgan_radius': 3, 'combined_morgan_nBits': 1024, 'combined_rdkit_maxPath': 7, 'combined_rdkit_nBits': 1024, 'num_hidden_layers': 3, 'hidden_dim_0': 256, 'hidden_dim_1': 1024, 'hidden_dim_2': 64, 'kl_weight': 0.0003093226072161411, 'lr': 0.004279908965046946, 'batch_size': 128, 'dropout_rate': 0.09719692914478836, 'prior_mu': -0.009950801233344356, 'prior_sigma': 0.08426916772764126, 'normalization': 'layer'}. Best is trial 896 with value: 0.4533553242683411.
Generating morgan_rdkit fingerprints...
Generated fingerprints with 2048 features for 841 molecules
Trial 1005: 5-fold CV loss = 0.4645
