[I 2025-08-07 21:04:38,750] Trial 1215 finished with value: 0.4645692706108093 and parameters: {'fp_type': 'morgan_rdkit', 'combined_morgan_radius': 3, 'combined_morgan_nBits': 1024, 'combined_rdkit_maxPath': 7, 'combined_rdkit_nBits': 1024, 'num_hidden_layers': 3, 'hidden_dim_0': 256, 'hidden_dim_1': 1024, 'hidden_dim_2': 64, 'kl_weight': 0.0002977916791393908, 'lr': 0.008617093033701465, 'batch_size': 128, 'dropout_rate': 0.14578903512146826, 'prior_mu': -0.027432471082236166, 'prior_sigma': 0.09930560123532897, 'normalization': 'layer'}. Best is trial 896 with value: 0.4533553242683411.
Generating morgan_rdkit fingerprints...
Generated fingerprints with 2048 features for 841 molecules
Trial 1217: 5-fold CV loss = 0.4644
[I 2025-08-07 21:05:04,057] Trial 1217 finished with value: 0.46436012387275694 and parameters: {'fp_type': 'morgan_rdkit', 'combined_morgan_radius': 3, 'combined_morgan_nBits': 1024, 'combined_rdkit_maxPath': 7, 'combined_rdkit_nBits': 1024, 'num_hidden_layers': 3, 'hidden_dim_0': 256, 'hidden_dim_1': 1024, 'hidden_dim_2': 64, 'kl_weight': 0.00030478341477712355, 'lr': 0.00571922730385422, 'batch_size': 128, 'dropout_rate': 0.1445517821164275, 'prior_mu': -0.026160605021284797, 'prior_sigma': 0.09937118800398496, 'normalization': 'layer'}. Best is trial 896 with value: 0.4533553242683411.
Generating morgan_rdkit fingerprints...
Generated fingerprints with 2048 features for 841 molecules
Trial 1218: 5-fold CV loss = 0.5607
[I 2025-08-07 21:05:07,175] Trial 1218 finished with value: 0.5606640577316284 and parameters: {'fp_type': 'morgan_rdkit', 'combined_morgan_radius': 3, 'combined_morgan_nBits': 1024, 'combined_rdkit_maxPath': 7, 'combined_rdkit_nBits': 1024, 'num_hidden_layers': 3, 'hidden_dim_0': 256, 'hidden_dim_1': 1024, 'hidden_dim_2': 64, 'kl_weight': 0.00029698877167913236, 'lr': 0.0056671725864259025, 'batch_size': 128, 'dropout_rate': 0.11467604593469295, 'prior_mu': -0.023746739625834394, 'prior_sigma': 0.09956201174282465, 'normalization': 'layer'}. Best is trial 896 with value: 0.4533553242683411.
Generating morgan_rdkit fingerprints...
Generated fingerprints with 2048 features for 841 molecules
Trial 1219: 5-fold CV loss = 0.4708
[I 2025-08-07 21:05:19,632] Trial 1219 finished with value: 0.4708029985427856 and parameters: {'fp_type': 'morgan_rdkit', 'combined_morgan_radius': 3, 'combined_morgan_nBits': 1024, 'combined_rdkit_maxPath': 7, 'combined_rdkit_nBits': 1024, 'num_hidden_layers': 3, 'hidden_dim_0': 256, 'hidden_dim_1': 1024, 'hidden_dim_2': 64, 'kl_weight': 0.0003879708722114328, 'lr': 0.005709714743260975, 'batch_size': 128, 'dropout_rate': 0.11321026006804685, 'prior_mu': -0.019712528172040954, 'prior_sigma': 0.11048356542550676, 'normalization': 'layer'}. Best is trial 896 with value: 0.4533553242683411.
Generating morgan_rdkit fingerprints...
Generated fingerprints with 2048 features for 841 molecules
Trial 1216: 5-fold CV loss = 0.4632
[I 2025-08-07 21:05:42,212] Trial 1216 finished with value: 0.4632182538509369 and parameters: {'fp_type': 'morgan_rdkit', 'combined_morgan_radius': 3, 'combined_morgan_nBits': 1024, 'combined_rdkit_maxPath': 7, 'combined_rdkit_nBits': 1024, 'num_hidden_layers': 3, 'hidden_dim_0': 256, 'hidden_dim_1': 1024, 'hidden_dim_2': 64, 'kl_weight': 0.00029148632790732085, 'lr': 0.008758207159404932, 'batch_size': 128, 'dropout_rate': 0.14778646013318597, 'prior_mu': -0.027234961497040047, 'prior_sigma': 0.0994600894307689, 'normalization': 'layer'}. Best is trial 896 with value: 0.4533553242683411.
Generating morgan_rdkit fingerprints...
Generated fingerprints with 2048 features for 841 molecules
Trial 1220: 5-fold CV loss = 0.4661
[I 2025-08-07 21:05:51,720] Trial 1220 finished with value: 0.46605939269065855 and parameters: {'fp_type': 'morgan_rdkit', 'combined_morgan_radius': 3, 'combined_morgan_nBits': 1024, 'combined_rdkit_maxPath': 7, 'combined_rdkit_nBits': 1024, 'num_hidden_layers': 3, 'hidden_dim_0': 256, 'hidden_dim_1': 1024, 'hidden_dim_2': 64, 'kl_weight': 0.00038151063175772507, 'lr': 0.006500119539441955, 'batch_size': 128, 'dropout_rate': 0.11292990298094797, 'prior_mu': -0.017992685967378245, 'prior_sigma': 0.09389098736752652, 'normalization': 'layer'}. Best is trial 896 with value: 0.4533553242683411.
Generating morgan_rdkit fingerprints...
Generated fingerprints with 2048 features for 841 molecules
Trial 1222: 5-fold CV loss = 0.4647
[I 2025-08-07 21:05:54,029] Trial 1222 finished with value: 0.46474903225898745 and parameters: {'fp_type': 'morgan_rdkit', 'combined_morgan_radius': 3, 'combined_morgan_nBits': 1024, 'combined_rdkit_maxPath': 7, 'combined_rdkit_nBits': 1024, 'num_hidden_layers': 3, 'hidden_dim_0': 256, 'hidden_dim_1': 1024, 'hidden_dim_2': 64, 'kl_weight': 0.00037649732298746495, 'lr': 0.0064801943569456465, 'batch_size': 128, 'dropout_rate': 0.13483865178190307, 'prior_mu': -0.03403768100044628, 'prior_sigma': 0.08332808394381239, 'normalization': 'layer'}. Best is trial 896 with value: 0.4533553242683411.
Generating morgan_rdkit fingerprints...
Generated fingerprints with 2048 features for 841 molecules
Trial 1221: 5-fold CV loss = 0.4721
[I 2025-08-07 21:06:07,356] Trial 1221 finished with value: 0.47212501168251036 and parameters: {'fp_type': 'morgan_rdkit', 'combined_morgan_radius': 3, 'combined_morgan_nBits': 1024, 'combined_rdkit_maxPath': 7, 'combined_rdkit_nBits': 1024, 'num_hidden_layers': 3, 'hidden_dim_0': 256, 'hidden_dim_1': 1024, 'hidden_dim_2': 64, 'kl_weight': 0.0003870980172200403, 'lr': 0.006526318687900837, 'batch_size': 128, 'dropout_rate': 0.1082682492738476, 'prior_mu': -0.017485340953229275, 'prior_sigma': 0.11042929413926508, 'normalization': 'layer'}. Best is trial 896 with value: 0.4533553242683411.
Generating morgan_rdkit fingerprints...
Generated fingerprints with 2048 features for 841 molecules
Trial 1223: 5-fold CV loss = 0.8004
[I 2025-08-07 21:06:29,144] Trial 1223 finished with value: 0.8004435956478119 and parameters: {'fp_type': 'morgan_rdkit', 'combined_morgan_radius': 3, 'combined_morgan_nBits': 1024, 'combined_rdkit_maxPath': 7, 'combined_rdkit_nBits': 1024, 'num_hidden_layers': 3, 'hidden_dim_0': 256, 'hidden_dim_1': 1024, 'hidden_dim_2': 512, 'kl_weight': 0.0003703542336892612, 'lr': 0.006544194483012253, 'batch_size': 128, 'dropout_rate': 0.16268383909867537, 'prior_mu': -0.03603352511089543, 'prior_sigma': 0.09325216911221199, 'normalization': 'layer'}. Best is trial 896 with value: 0.4533553242683411.
Generating morgan_rdkit fingerprints...
Generated fingerprints with 2048 features for 841 molecules
Trial 1224: 5-fold CV loss = 0.4639
[I 2025-08-07 21:06:33,201] Trial 1224 finished with value: 0.46385056972503663 and parameters: {'fp_type': 'morgan_rdkit', 'combined_morgan_radius': 3, 'combined_morgan_nBits': 1024, 'combined_rdkit_maxPath': 7, 'combined_rdkit_nBits': 1024, 'num_hidden_layers': 3, 'hidden_dim_0': 256, 'hidden_dim_1': 1024, 'hidden_dim_2': 64, 'kl_weight': 0.0005234073794700614, 'lr': 0.007567931038209249, 'batch_size': 128, 'dropout_rate': 0.13474374018157392, 'prior_mu': -0.0008762193967371216, 'prior_sigma': 0.083774795341315, 'normalization': 'layer'}. Best is trial 896 with value: 0.4533553242683411.
Generating morgan_rdkit fingerprints...
Generated fingerprints with 2048 features for 841 molecules
Trial 1225: 5-fold CV loss = 0.6316
[I 2025-08-07 21:06:36,562] Trial 1225 finished with value: 0.6316116988658905 and parameters: {'fp_type': 'morgan_rdkit', 'combined_morgan_radius': 3, 'combined_morgan_nBits': 1024, 'combined_rdkit_maxPath': 7, 'combined_rdkit_nBits': 1024, 'num_hidden_layers': 3, 'hidden_dim_0': 256, 'hidden_dim_1': 1024, 'hidden_dim_2': 512, 'kl_weight': 0.0005017017239087747, 'lr': 0.007729074056375659, 'batch_size': 128, 'dropout_rate': 0.16242142341045104, 'prior_mu': -0.0011522913555486423, 'prior_sigma': 0.09192451346683252, 'normalization': 'layer'}. Best is trial 896 with value: 0.4533553242683411.
Generating morgan_rdkit fingerprints...
Generated fingerprints with 2048 features for 841 molecules
Trial 1228: 5-fold CV loss = 0.8767
[I 2025-08-07 21:07:02,307] Trial 1228 finished with value: 0.8767480254173279 and parameters: {'fp_type': 'morgan_rdkit', 'combined_morgan_radius': 3, 'combined_morgan_nBits': 1024, 'combined_rdkit_maxPath': 7, 'combined_rdkit_nBits': 1024, 'num_hidden_layers': 3, 'hidden_dim_0': 256, 'hidden_dim_1': 128, 'hidden_dim_2': 64, 'kl_weight': 0.00044359487487752937, 'lr': 0.00028012905299124356, 'batch_size': 64, 'dropout_rate': 0.12191861523875895, 'prior_mu': 0.013598032817710206, 'prior_sigma': 0.07619296415011308, 'normalization': 'layer'}. Best is trial 896 with value: 0.4533553242683411.
Generating morgan_rdkit fingerprints...
Generated fingerprints with 2048 features for 841 molecules
Trial 1229: 5-fold CV loss = 0.4668
[I 2025-08-07 21:07:16,659] Trial 1229 finished with value: 0.466783219575882 and parameters: {'fp_type': 'morgan_rdkit', 'combined_morgan_radius': 3, 'combined_morgan_nBits': 1024, 'combined_rdkit_maxPath': 7, 'combined_rdkit_nBits': 1024, 'num_hidden_layers': 3, 'hidden_dim_0': 256, 'hidden_dim_1': 1024, 'hidden_dim_2': 64, 'kl_weight': 0.0004366412953546439, 'lr': 0.007088390313273642, 'batch_size': 64, 'dropout_rate': 0.12284709377918322, 'prior_mu': -0.04490943661607358, 'prior_sigma': 0.0671197193175058, 'normalization': 'layer'}. Best is trial 896 with value: 0.4533553242683411.
Generating morgan_rdkit fingerprints...
Generated fingerprints with 2048 features for 841 molecules
Trial 1226: 5-fold CV loss = 0.4730
[I 2025-08-07 21:07:37,697] Trial 1226 finished with value: 0.4730005443096161 and parameters: {'fp_type': 'morgan_rdkit', 'combined_morgan_radius': 3, 'combined_morgan_nBits': 1024, 'combined_rdkit_maxPath': 7, 'combined_rdkit_nBits': 1024, 'num_hidden_layers': 3, 'hidden_dim_0': 256, 'hidden_dim_1': 128, 'hidden_dim_2': 512, 'kl_weight': 0.0005063266485618507, 'lr': 0.00758860860239272, 'batch_size': 64, 'dropout_rate': 0.1597274883071706, 'prior_mu': 7.912462980642215e-05, 'prior_sigma': 0.07502192687586524, 'normalization': 'layer'}. Best is trial 896 with value: 0.4533553242683411.
Generating morgan_rdkit fingerprints...
Generated fingerprints with 2048 features for 841 molecules
Trial 1230: 5-fold CV loss = 0.4601
[I 2025-08-07 21:07:44,758] Trial 1230 finished with value: 0.46013882756233215 and parameters: {'fp_type': 'morgan_rdkit', 'combined_morgan_radius': 3, 'combined_morgan_nBits': 1024, 'combined_rdkit_maxPath': 7, 'combined_rdkit_nBits': 1024, 'num_hidden_layers': 3, 'hidden_dim_0': 256, 'hidden_dim_1': 1024, 'hidden_dim_2': 64, 'kl_weight': 0.00026530231676750115, 'lr': 0.007119544885969293, 'batch_size': 128, 'dropout_rate': 0.10464198830606726, 'prior_mu': -0.043611782367489235, 'prior_sigma': 0.08729247451848068, 'normalization': 'layer'}. Best is trial 896 with value: 0.4533553242683411.
Generating morgan_rdkit fingerprints...
Generated fingerprints with 2048 features for 841 molecules
Trial 1231: 5-fold CV loss = 0.5504
[I 2025-08-07 21:07:50,207] Trial 1231 finished with value: 0.5503808081150054 and parameters: {'fp_type': 'morgan_rdkit', 'combined_morgan_radius': 3, 'combined_morgan_nBits': 1024, 'combined_rdkit_maxPath': 7, 'combined_rdkit_nBits': 1024, 'num_hidden_layers': 3, 'hidden_dim_0': 256, 'hidden_dim_1': 1024, 'hidden_dim_2': 64, 'kl_weight': 0.00026755886667025546, 'lr': 0.005256971295529781, 'batch_size': 128, 'dropout_rate': 0.10108747157523382, 'prior_mu': -0.011081875428027344, 'prior_sigma': 0.08740012641744153, 'normalization': 'layer'}. Best is trial 896 with value: 0.4533553242683411.
Generating morgan_rdkit fingerprints...
Generated fingerprints with 2048 features for 841 molecules
Trial 1227: 5-fold CV loss = 0.4676
[I 2025-08-07 21:08:14,871] Trial 1227 finished with value: 0.4676426947116852 and parameters: {'fp_type': 'morgan_rdkit', 'combined_morgan_radius': 3, 'combined_morgan_nBits': 1024, 'combined_rdkit_maxPath': 7, 'combined_rdkit_nBits': 1024, 'num_hidden_layers': 3, 'hidden_dim_0': 256, 'hidden_dim_1': 1024, 'hidden_dim_2': 64, 'kl_weight': 0.00046745453674897677, 'lr': 0.007647704606386728, 'batch_size': 64, 'dropout_rate': 0.12211698196498325, 'prior_mu': -0.04551461808731305, 'prior_sigma': 0.07566178207955207, 'normalization': 'layer'}. Best is trial 896 with value: 0.4533553242683411.
Generating morgan_rdkit fingerprints...
Generated fingerprints with 2048 features for 841 molecules
Trial 1232: 5-fold CV loss = 0.6474
[I 2025-08-07 21:08:18,597] Trial 1232 finished with value: 0.6473730742931366 and parameters: {'fp_type': 'morgan_rdkit', 'combined_morgan_radius': 3, 'combined_morgan_nBits': 1024, 'combined_rdkit_maxPath': 7, 'combined_rdkit_nBits': 1024, 'num_hidden_layers': 3, 'hidden_dim_0': 256, 'hidden_dim_1': 1024, 'hidden_dim_2': 64, 'kl_weight': 0.0002684235013401427, 'lr': 0.005066004017035204, 'batch_size': 128, 'dropout_rate': 0.09647947338701737, 'prior_mu': -0.012659465899861477, 'prior_sigma': 0.08680702853926749, 'normalization': 'layer'}. Best is trial 896 with value: 0.4533553242683411.
Generating morgan_rdkit fingerprints...
Generated fingerprints with 2048 features for 841 molecules
Trial 1233: 5-fold CV loss = 0.5325
[I 2025-08-07 21:08:23,334] Trial 1233 finished with value: 0.5324672639369965 and parameters: {'fp_type': 'morgan_rdkit', 'combined_morgan_radius': 3, 'combined_morgan_nBits': 1024, 'combined_rdkit_maxPath': 7, 'combined_rdkit_nBits': 1024, 'num_hidden_layers': 3, 'hidden_dim_0': 256, 'hidden_dim_1': 1024, 'hidden_dim_2': 64, 'kl_weight': 0.0003253641577329337, 'lr': 0.004960850252946946, 'batch_size': 128, 'dropout_rate': 0.13630807389321364, 'prior_mu': -0.013477018378253497, 'prior_sigma': 0.08100113364016867, 'normalization': 'layer'}. Best is trial 896 with value: 0.4533553242683411.
Generating morgan_rdkit fingerprints...
Generated fingerprints with 2048 features for 841 molecules
Trial 1234: 5-fold CV loss = 0.4700
[I 2025-08-07 21:08:26,442] Trial 1234 finished with value: 0.46996294260025023 and parameters: {'fp_type': 'morgan_rdkit', 'combined_morgan_radius': 3, 'combined_morgan_nBits': 1024, 'combined_rdkit_maxPath': 6, 'combined_rdkit_nBits': 1024, 'num_hidden_layers': 3, 'hidden_dim_0': 256, 'hidden_dim_1': 1024, 'hidden_dim_2': 64, 'kl_weight': 0.0003264352312480824, 'lr': 0.00606109442660038, 'batch_size': 128, 'dropout_rate': 0.13736107920498306, 'prior_mu': -0.016424085863681204, 'prior_sigma': 0.08107963543827704, 'normalization': 'layer'}. Best is trial 896 with value: 0.4533553242683411.
Generating morgan_rdkit fingerprints...
Generated fingerprints with 2048 features for 841 molecules
Trial 1238: 5-fold CV loss = 0.7595
[I 2025-08-07 21:08:42,287] Trial 1238 finished with value: 0.759491240978241 and parameters: {'fp_type': 'morgan_rdkit', 'combined_morgan_radius': 3, 'combined_morgan_nBits': 1024, 'combined_rdkit_maxPath': 7, 'combined_rdkit_nBits': 1024, 'num_hidden_layers': 3, 'hidden_dim_0': 256, 'hidden_dim_1': 64, 'hidden_dim_2': 64, 'kl_weight': 0.00022314641040402353, 'lr': 0.006039480857696864, 'batch_size': 128, 'dropout_rate': 0.08559483891226238, 'prior_mu': -0.031370860108735917, 'prior_sigma': 0.10484938381439644, 'normalization': 'none'}. Best is trial 896 with value: 0.4533553242683411.
Generating rdkit fingerprints...
Generated fingerprints with 256 features for 841 molecules
Trial 1239: 5-fold CV loss = 0.8879
[I 2025-08-07 21:08:55,727] Trial 1239 finished with value: 0.8878633975982666 and parameters: {'fp_type': 'rdkit', 'rdkit_only_maxPath': 8, 'rdkit_only_nBits': 256, 'num_hidden_layers': 3, 'hidden_dim_0': 256, 'hidden_dim_1': 1024, 'hidden_dim_2': 128, 'kl_weight': 0.0003452990195267826, 'lr': 0.008059451970921082, 'batch_size': 128, 'dropout_rate': 0.14885603444246676, 'prior_mu': -0.025410599615624235, 'prior_sigma': 0.06840258149181602, 'normalization': 'layer'}. Best is trial 896 with value: 0.4533553242683411.
Generating morgan_rdkit fingerprints...
Generated fingerprints with 2048 features for 841 molecules
Trial 1236: 5-fold CV loss = 0.4827
[I 2025-08-07 21:09:06,822] Trial 1236 finished with value: 0.4827391982078552 and parameters: {'fp_type': 'morgan_rdkit', 'combined_morgan_radius': 3, 'combined_morgan_nBits': 1024, 'combined_rdkit_maxPath': 6, 'combined_rdkit_nBits': 1024, 'num_hidden_layers': 3, 'hidden_dim_0': 256, 'hidden_dim_1': 1024, 'hidden_dim_2': 64, 'kl_weight': 0.00021683759651978463, 'lr': 0.006028431124679297, 'batch_size': 128, 'dropout_rate': 0.1377912880076858, 'prior_mu': -0.03149934860155087, 'prior_sigma': 0.0820589246050617, 'normalization': 'layer'}. Best is trial 896 with value: 0.4533553242683411.
Generating morgan_rdkit fingerprints...
Generated fingerprints with 2048 features for 841 molecules
Trial 1237: 5-fold CV loss = 0.4792
[I 2025-08-07 21:09:08,356] Trial 1237 finished with value: 0.4792136073112488 and parameters: {'fp_type': 'morgan_rdkit', 'combined_morgan_radius': 3, 'combined_morgan_nBits': 1024, 'combined_rdkit_maxPath': 6, 'combined_rdkit_nBits': 1024, 'num_hidden_layers': 3, 'hidden_dim_0': 256, 'hidden_dim_1': 1024, 'hidden_dim_2': 64, 'kl_weight': 0.00032772945508723116, 'lr': 0.005998562027641191, 'batch_size': 128, 'dropout_rate': 0.17528086449869146, 'prior_mu': -0.03035531678919981, 'prior_sigma': 0.10393152478241181, 'normalization': 'layer'}. Best is trial 896 with value: 0.4533553242683411.
Generating morgan_rdkit fingerprints...
Generated fingerprints with 2048 features for 841 molecules
Trial 1240: 5-fold CV loss = 0.4821
[I 2025-08-07 21:09:30,068] Trial 1240 finished with value: 0.4821177661418915 and parameters: {'fp_type': 'morgan_rdkit', 'combined_morgan_radius': 3, 'combined_morgan_nBits': 1024, 'combined_rdkit_maxPath': 7, 'combined_rdkit_nBits': 1024, 'num_hidden_layers': 3, 'hidden_dim_0': 256, 'hidden_dim_1': 256, 'hidden_dim_2': 64, 'kl_weight': 0.01584606102386225, 'lr': 0.00685094469059967, 'batch_size': 128, 'dropout_rate': 0.17149596676894888, 'prior_mu': 0.021462819785972073, 'prior_sigma': 0.05443599469401902, 'normalization': 'layer'}. Best is trial 896 with value: 0.4533553242683411.
Generating morgan_rdkit fingerprints...
Generated fingerprints with 2048 features for 841 molecules
Trial 1235: 5-fold CV loss = 0.5642
[I 2025-08-07 21:09:37,829] Trial 1235 finished with value: 0.5642235755920411 and parameters: {'fp_type': 'morgan_rdkit', 'combined_morgan_radius': 3, 'combined_morgan_nBits': 1024, 'combined_rdkit_maxPath': 6, 'combined_rdkit_nBits': 1024, 'num_hidden_layers': 3, 'hidden_dim_0': 256, 'hidden_dim_1': 64, 'hidden_dim_2': 64, 'kl_weight': 0.0003350448329660241, 'lr': 0.005992296325169622, 'batch_size': 128, 'dropout_rate': 0.13997252444708017, 'prior_mu': -0.015197414282208329, 'prior_sigma': 0.10408199024676978, 'normalization': 'layer'}. Best is trial 896 with value: 0.4533553242683411.
Generating morgan_rdkit fingerprints...
Generated fingerprints with 2048 features for 841 molecules
Trial 1242: 5-fold CV loss = 0.5724
[I 2025-08-07 21:09:50,085] Trial 1242 finished with value: 0.5724133133888245 and parameters: {'fp_type': 'morgan_rdkit', 'combined_morgan_radius': 3, 'combined_morgan_nBits': 1024, 'combined_rdkit_maxPath': 7, 'combined_rdkit_nBits': 1024, 'num_hidden_layers': 3, 'hidden_dim_0': 256, 'hidden_dim_1': 256, 'hidden_dim_2': 64, 'kl_weight': 0.00029002332534410337, 'lr': 0.007169741916567479, 'batch_size': 128, 'dropout_rate': 0.10607823321547427, 'prior_mu': -0.020797279772313132, 'prior_sigma': 0.09509484180336253, 'normalization': 'layer'}. Best is trial 896 with value: 0.4533553242683411.
Generating morgan_rdkit fingerprints...
Generated fingerprints with 2048 features for 841 molecules
Trial 1243: 5-fold CV loss = 0.4670
[I 2025-08-07 21:10:03,490] Trial 1243 finished with value: 0.4670179605484009 and parameters: {'fp_type': 'morgan_rdkit', 'combined_morgan_radius': 3, 'combined_morgan_nBits': 1024, 'combined_rdkit_maxPath': 7, 'combined_rdkit_nBits': 1024, 'num_hidden_layers': 3, 'hidden_dim_0': 256, 'hidden_dim_1': 1024, 'hidden_dim_2': 64, 'kl_weight': 0.00017467960677671165, 'lr': 0.008059259933116212, 'batch_size': 128, 'dropout_rate': 0.10791098973518744, 'prior_mu': -0.021300178165748453, 'prior_sigma': 0.07175663504771358, 'normalization': 'layer'}. Best is trial 896 with value: 0.4533553242683411.
Generating morgan_rdkit fingerprints...
Generated fingerprints with 2048 features for 841 molecules
Trial 1241: 5-fold CV loss = 0.4615
[I 2025-08-07 21:10:13,791] Trial 1241 finished with value: 0.46146257519721984 and parameters: {'fp_type': 'morgan_rdkit', 'combined_morgan_radius': 3, 'combined_morgan_nBits': 1024, 'combined_rdkit_maxPath': 7, 'combined_rdkit_nBits': 1024, 'num_hidden_layers': 3, 'hidden_dim_0': 256, 'hidden_dim_1': 256, 'hidden_dim_2': 64, 'kl_weight': 0.00018374704600429955, 'lr': 0.006962257054141721, 'batch_size': 128, 'dropout_rate': 0.17512447531330402, 'prior_mu': 0.009624841215325818, 'prior_sigma': 0.09565893025731266, 'normalization': 'layer'}. Best is trial 896 with value: 0.4533553242683411.
Generating morgan_rdkit fingerprints...
Generated fingerprints with 2048 features for 841 molecules
Trial 1245: 5-fold CV loss = 0.4654
[I 2025-08-07 21:10:35,537] Trial 1245 finished with value: 0.46538606882095335 and parameters: {'fp_type': 'morgan_rdkit', 'combined_morgan_radius': 3, 'combined_morgan_nBits': 1024, 'combined_rdkit_maxPath': 7, 'combined_rdkit_nBits': 1024, 'num_hidden_layers': 3, 'hidden_dim_0': 256, 'hidden_dim_1': 1024, 'hidden_dim_2': 64, 'kl_weight': 0.00017059668887437558, 'lr': 0.00805965879795301, 'batch_size': 128, 'dropout_rate': 0.11639847202052683, 'prior_mu': 0.009219794650495057, 'prior_sigma': 0.07222488194169882, 'normalization': 'layer'}. Best is trial 896 with value: 0.4533553242683411.
Generating morgan_rdkit fingerprints...
Generated fingerprints with 2048 features for 841 molecules
Trial 1246: 5-fold CV loss = 0.5564
