[I 2025-08-08 01:01:17,791] Trial 2418 finished with value: 0.5821860253810882 and parameters: {'fp_type': 'rdkit', 'rdkit_only_maxPath': 6, 'rdkit_only_nBits': 512, 'num_hidden_layers': 3, 'hidden_dim_0': 128, 'hidden_dim_1': 1024, 'hidden_dim_2': 64, 'kl_weight': 0.00011227564709194354, 'lr': 0.008202251690030016, 'batch_size': 128, 'dropout_rate': 0.06576947182119615, 'prior_mu': 0.030612916117937435, 'prior_sigma': 0.12118211654385201, 'normalization': 'layer'}. Best is trial 896 with value: 0.4533553242683411.
Generating morgan_rdkit fingerprints...
Generated fingerprints with 2048 features for 841 molecules
Trial 2417: 5-fold CV loss = 0.4648
[I 2025-08-08 01:01:27,315] Trial 2417 finished with value: 0.4648062288761139 and parameters: {'fp_type': 'morgan_rdkit', 'combined_morgan_radius': 3, 'combined_morgan_nBits': 1024, 'combined_rdkit_maxPath': 7, 'combined_rdkit_nBits': 1024, 'num_hidden_layers': 3, 'hidden_dim_0': 128, 'hidden_dim_1': 1024, 'hidden_dim_2': 64, 'kl_weight': 0.00010631905348002492, 'lr': 0.008046647559478974, 'batch_size': 32, 'dropout_rate': 0.0848801896074837, 'prior_mu': -0.003368846101439599, 'prior_sigma': 0.12160460040394801, 'normalization': 'layer'}. Best is trial 896 with value: 0.4533553242683411.
Generating morgan_rdkit fingerprints...
Generated fingerprints with 2048 features for 841 molecules
Trial 2419: 5-fold CV loss = 0.6345
[I 2025-08-08 01:01:44,548] Trial 2419 finished with value: 0.6344857096672059 and parameters: {'fp_type': 'morgan_rdkit', 'combined_morgan_radius': 3, 'combined_morgan_nBits': 1024, 'combined_rdkit_maxPath': 7, 'combined_rdkit_nBits': 1024, 'num_hidden_layers': 3, 'hidden_dim_0': 1024, 'hidden_dim_1': 1024, 'hidden_dim_2': 64, 'kl_weight': 0.0001375699945021846, 'lr': 0.007918774266384182, 'batch_size': 128, 'dropout_rate': 0.09065276237295276, 'prior_mu': 0.016770142959951214, 'prior_sigma': 0.09886042504423945, 'normalization': 'layer'}. Best is trial 896 with value: 0.4533553242683411.
Generating morgan_rdkit fingerprints...
Generated fingerprints with 1280 features for 841 molecules
Trial 2420: 5-fold CV loss = 0.4627
[I 2025-08-08 01:02:09,320] Trial 2420 finished with value: 0.46270700097084044 and parameters: {'fp_type': 'morgan_rdkit', 'combined_morgan_radius': 3, 'combined_morgan_nBits': 1024, 'combined_rdkit_maxPath': 7, 'combined_rdkit_nBits': 1024, 'num_hidden_layers': 3, 'hidden_dim_0': 1024, 'hidden_dim_1': 1024, 'hidden_dim_2': 64, 'kl_weight': 0.00014611014696448572, 'lr': 0.00919995517576897, 'batch_size': 128, 'dropout_rate': 0.09184065658692522, 'prior_mu': -0.0010421843053146258, 'prior_sigma': 0.10568980107671233, 'normalization': 'layer'}. Best is trial 896 with value: 0.4533553242683411.
Generating morgan_rdkit fingerprints...
Generated fingerprints with 2048 features for 841 molecules
Trial 2421: 5-fold CV loss = 0.5172
[I 2025-08-08 01:02:12,590] Trial 2421 finished with value: 0.5172304809093475 and parameters: {'fp_type': 'morgan_rdkit', 'combined_morgan_radius': 3, 'combined_morgan_nBits': 1024, 'combined_rdkit_maxPath': 7, 'combined_rdkit_nBits': 256, 'num_hidden_layers': 3, 'hidden_dim_0': 256, 'hidden_dim_1': 1024, 'hidden_dim_2': 64, 'kl_weight': 0.00015303750579016907, 'lr': 0.009996563874272788, 'batch_size': 128, 'dropout_rate': 0.10507893231090196, 'prior_mu': -0.002318628805545824, 'prior_sigma': 0.10677232639045199, 'normalization': 'layer'}. Best is trial 896 with value: 0.4533553242683411.
Generating morgan_rdkit fingerprints...
Generated fingerprints with 2048 features for 841 molecules
Trial 2422: 5-fold CV loss = 0.8693
[I 2025-08-08 01:02:32,747] Trial 2422 finished with value: 0.8692888736724853 and parameters: {'fp_type': 'morgan_rdkit', 'combined_morgan_radius': 3, 'combined_morgan_nBits': 1024, 'combined_rdkit_maxPath': 7, 'combined_rdkit_nBits': 1024, 'num_hidden_layers': 3, 'hidden_dim_0': 256, 'hidden_dim_1': 1024, 'hidden_dim_2': 64, 'kl_weight': 0.00019198620792099612, 'lr': 0.0006552611655386646, 'batch_size': 128, 'dropout_rate': 0.10169100165947811, 'prior_mu': 0.008480038477049225, 'prior_sigma': 0.10983359148928261, 'normalization': 'layer'}. Best is trial 896 with value: 0.4533553242683411.
Generating morgan_rdkit fingerprints...
Generated fingerprints with 2048 features for 841 molecules
Trial 2423: 5-fold CV loss = 0.4687
[I 2025-08-08 01:02:44,520] Trial 2423 finished with value: 0.46868634819984434 and parameters: {'fp_type': 'morgan_rdkit', 'combined_morgan_radius': 3, 'combined_morgan_nBits': 1024, 'combined_rdkit_maxPath': 7, 'combined_rdkit_nBits': 1024, 'num_hidden_layers': 3, 'hidden_dim_0': 256, 'hidden_dim_1': 1024, 'hidden_dim_2': 64, 'kl_weight': 0.00019617412568661587, 'lr': 0.008690144128616855, 'batch_size': 128, 'dropout_rate': 0.06335112121918825, 'prior_mu': 0.012026084571033546, 'prior_sigma': 0.11376579309481058, 'normalization': 'layer'}. Best is trial 896 with value: 0.4533553242683411.
Generating morgan_rdkit fingerprints...
Generated fingerprints with 2048 features for 841 molecules
Trial 2415: 5-fold CV loss = 0.4917
[I 2025-08-08 01:03:10,032] Trial 2415 finished with value: 0.49169919490814207 and parameters: {'fp_type': 'rdkit', 'rdkit_only_maxPath': 6, 'rdkit_only_nBits': 512, 'num_hidden_layers': 3, 'hidden_dim_0': 128, 'hidden_dim_1': 1024, 'hidden_dim_2': 64, 'kl_weight': 0.00015476496849294936, 'lr': 0.007949801478098211, 'batch_size': 32, 'dropout_rate': 0.06893141681988316, 'prior_mu': -0.0014172500603642259, 'prior_sigma': 0.09890654076700044, 'normalization': 'layer'}. Best is trial 896 with value: 0.4533553242683411.
Generating morgan_rdkit fingerprints...
Generated fingerprints with 2048 features for 841 molecules
Trial 2424: 5-fold CV loss = 0.4702
[I 2025-08-08 01:03:18,578] Trial 2424 finished with value: 0.4702476143836975 and parameters: {'fp_type': 'morgan_rdkit', 'combined_morgan_radius': 3, 'combined_morgan_nBits': 1024, 'combined_rdkit_maxPath': 7, 'combined_rdkit_nBits': 1024, 'num_hidden_layers': 3, 'hidden_dim_0': 256, 'hidden_dim_1': 1024, 'hidden_dim_2': 64, 'kl_weight': 0.0017049732674027452, 'lr': 0.008621678779659539, 'batch_size': 128, 'dropout_rate': 0.06180315829585019, 'prior_mu': 0.024735357111208972, 'prior_sigma': 0.1146067473481955, 'normalization': 'layer'}. Best is trial 896 with value: 0.4533553242683411.
Generating morgan_rdkit fingerprints...
Generated fingerprints with 2048 features for 841 molecules
Trial 2416: 5-fold CV loss = 0.4784
[I 2025-08-08 01:03:21,425] Trial 2416 finished with value: 0.47843878865242007 and parameters: {'fp_type': 'morgan_rdkit', 'combined_morgan_radius': 3, 'combined_morgan_nBits': 1024, 'combined_rdkit_maxPath': 7, 'combined_rdkit_nBits': 1024, 'num_hidden_layers': 3, 'hidden_dim_0': 128, 'hidden_dim_1': 1024, 'hidden_dim_2': 64, 'kl_weight': 0.00010143533350392144, 'lr': 0.0080775941403092, 'batch_size': 32, 'dropout_rate': 0.06587755625655753, 'prior_mu': 0.0004147717623363932, 'prior_sigma': 0.10821624196844808, 'normalization': 'layer'}. Best is trial 896 with value: 0.4533553242683411.
Generating morgan_rdkit fingerprints...
Generated fingerprints with 2048 features for 841 molecules
Trial 2425: 5-fold CV loss = 0.4719
[I 2025-08-08 01:03:24,146] Trial 2425 finished with value: 0.47194317579269407 and parameters: {'fp_type': 'morgan_rdkit', 'combined_morgan_radius': 3, 'combined_morgan_nBits': 1024, 'combined_rdkit_maxPath': 7, 'combined_rdkit_nBits': 1024, 'num_hidden_layers': 3, 'hidden_dim_0': 256, 'hidden_dim_1': 1024, 'hidden_dim_2': 64, 'kl_weight': 0.00015699001555386278, 'lr': 0.009977381550792783, 'batch_size': 128, 'dropout_rate': 0.042566072684227095, 'prior_mu': -0.004131369377230668, 'prior_sigma': 0.1009716499709361, 'normalization': 'layer'}. Best is trial 896 with value: 0.4533553242683411.
Generating morgan_rdkit fingerprints...
Generated fingerprints with 2048 features for 841 molecules
Trial 2429: 5-fold CV loss = 0.8880
[I 2025-08-08 01:03:36,505] Trial 2429 finished with value: 0.888030219078064 and parameters: {'fp_type': 'morgan_rdkit', 'combined_morgan_radius': 3, 'combined_morgan_nBits': 1024, 'combined_rdkit_maxPath': 7, 'combined_rdkit_nBits': 1024, 'num_hidden_layers': 3, 'hidden_dim_0': 256, 'hidden_dim_1': 1024, 'hidden_dim_2': 512, 'kl_weight': 0.00012690228812498408, 'lr': 0.0071833568085746995, 'batch_size': 128, 'dropout_rate': 0.09520817790674843, 'prior_mu': 0.01823999399437131, 'prior_sigma': 0.09553210390827684, 'normalization': 'layer'}. Best is trial 896 with value: 0.4533553242683411.
Generating morgan_rdkit fingerprints...
Generated fingerprints with 2048 features for 841 molecules
Trial 2427: 5-fold CV loss = 0.8029
[I 2025-08-08 01:03:44,689] Trial 2427 finished with value: 0.8029027938842773 and parameters: {'fp_type': 'morgan_rdkit', 'combined_morgan_radius': 3, 'combined_morgan_nBits': 1024, 'combined_rdkit_maxPath': 7, 'combined_rdkit_nBits': 1024, 'num_hidden_layers': 3, 'hidden_dim_0': 256, 'hidden_dim_1': 256, 'hidden_dim_2': 512, 'kl_weight': 0.00018716155666719222, 'lr': 0.007111299189765258, 'batch_size': 128, 'dropout_rate': 0.042905547119252256, 'prior_mu': 0.003102662752666293, 'prior_sigma': 0.09636644191362101, 'normalization': 'layer'}. Best is trial 896 with value: 0.4533553242683411.
Generating morgan_rdkit fingerprints...
Generated fingerprints with 2048 features for 841 molecules
Trial 2426: 5-fold CV loss = 0.8135
[I 2025-08-08 01:03:47,073] Trial 2426 finished with value: 0.8135302066802979 and parameters: {'fp_type': 'morgan_rdkit', 'combined_morgan_radius': 3, 'combined_morgan_nBits': 1024, 'combined_rdkit_maxPath': 7, 'combined_rdkit_nBits': 1024, 'num_hidden_layers': 3, 'hidden_dim_0': 256, 'hidden_dim_1': 1024, 'hidden_dim_2': 512, 'kl_weight': 0.00012283770901163322, 'lr': 0.008519838717599548, 'batch_size': 128, 'dropout_rate': 0.08640501336972749, 'prior_mu': 0.018182433060706174, 'prior_sigma': 0.10214458956054238, 'normalization': 'layer'}. Best is trial 896 with value: 0.4533553242683411.
Generating morgan_rdkit fingerprints...
Generated fingerprints with 2048 features for 841 molecules
Trial 2430: 5-fold CV loss = 0.5592
[I 2025-08-08 01:04:07,560] Trial 2430 finished with value: 0.5592266023159027 and parameters: {'fp_type': 'morgan_rdkit', 'combined_morgan_radius': 3, 'combined_morgan_nBits': 1024, 'combined_rdkit_maxPath': 7, 'combined_rdkit_nBits': 1024, 'num_hidden_layers': 3, 'hidden_dim_0': 256, 'hidden_dim_1': 256, 'hidden_dim_2': 64, 'kl_weight': 0.00018723219565921226, 'lr': 0.007145628122791684, 'batch_size': 128, 'dropout_rate': 0.08592330352409343, 'prior_mu': -0.007526061929777918, 'prior_sigma': 0.09134422493118524, 'normalization': 'layer'}. Best is trial 896 with value: 0.4533553242683411.
Generating morgan_rdkit fingerprints...
Generated fingerprints with 2048 features for 841 molecules
Trial 2431: 5-fold CV loss = 0.6414
[I 2025-08-08 01:04:18,567] Trial 2431 finished with value: 0.6413605868816376 and parameters: {'fp_type': 'morgan_rdkit', 'combined_morgan_radius': 3, 'combined_morgan_nBits': 1024, 'combined_rdkit_maxPath': 7, 'combined_rdkit_nBits': 1024, 'num_hidden_layers': 3, 'hidden_dim_0': 256, 'hidden_dim_1': 1024, 'hidden_dim_2': 64, 'kl_weight': 0.00018723260484151773, 'lr': 0.009041307254409561, 'batch_size': 128, 'dropout_rate': 0.10727684067452081, 'prior_mu': -0.07020342141313377, 'prior_sigma': 0.09161795142738778, 'normalization': 'layer'}. Best is trial 896 with value: 0.4533553242683411.
Generating morgan_rdkit fingerprints...
Generated fingerprints with 2048 features for 841 molecules
Trial 2432: 5-fold CV loss = 0.5518
[I 2025-08-08 01:04:37,389] Trial 2432 finished with value: 0.5518060743808746 and parameters: {'fp_type': 'morgan_rdkit', 'combined_morgan_radius': 3, 'combined_morgan_nBits': 1024, 'combined_rdkit_maxPath': 7, 'combined_rdkit_nBits': 1024, 'num_hidden_layers': 3, 'hidden_dim_0': 512, 'hidden_dim_1': 64, 'hidden_dim_2': 64, 'kl_weight': 0.00019616565548305316, 'lr': 0.009063334738027758, 'batch_size': 128, 'dropout_rate': 0.10922716228351165, 'prior_mu': -0.004741807020389529, 'prior_sigma': 0.09152962781086543, 'normalization': 'layer'}. Best is trial 896 with value: 0.4533553242683411.
Generating morgan fingerprints...
Generated fingerprints with 2048 features for 841 molecules
Trial 2435: 5-fold CV loss = 0.7899
[I 2025-08-08 01:04:55,803] Trial 2435 finished with value: 0.7898701310157776 and parameters: {'fp_type': 'morgan', 'morgan_only_radius': 3, 'morgan_only_nBits': 2048, 'num_hidden_layers': 0, 'kl_weight': 0.00016487466374364893, 'lr': 0.007786639716044016, 'batch_size': 64, 'dropout_rate': 0.07908339006977529, 'prior_mu': 0.028120603633107425, 'prior_sigma': 0.10485460846532092, 'normalization': 'layer'}. Best is trial 896 with value: 0.4533553242683411.
Generating morgan_rdkit fingerprints...
Generated fingerprints with 2048 features for 841 molecules
Trial 2433: 5-fold CV loss = 0.4604
[I 2025-08-08 01:05:02,107] Trial 2433 finished with value: 0.46043331623077394 and parameters: {'fp_type': 'morgan_rdkit', 'combined_morgan_radius': 3, 'combined_morgan_nBits': 1024, 'combined_rdkit_maxPath': 7, 'combined_rdkit_nBits': 1024, 'num_hidden_layers': 3, 'hidden_dim_0': 512, 'hidden_dim_1': 64, 'hidden_dim_2': 64, 'kl_weight': 0.00013408735900143247, 'lr': 0.007795241282617067, 'batch_size': 64, 'dropout_rate': 0.10766996811903236, 'prior_mu': -0.08848309124392857, 'prior_sigma': 0.09105817142075275, 'normalization': 'layer'}. Best is trial 896 with value: 0.4533553242683411.
Generating morgan_rdkit fingerprints...
Generated fingerprints with 2048 features for 841 molecules
Trial 2428: 5-fold CV loss = 0.4732
[I 2025-08-08 01:05:06,343] Trial 2428 finished with value: 0.4731570065021515 and parameters: {'fp_type': 'morgan_rdkit', 'combined_morgan_radius': 3, 'combined_morgan_nBits': 1024, 'combined_rdkit_maxPath': 7, 'combined_rdkit_nBits': 1024, 'num_hidden_layers': 3, 'hidden_dim_0': 256, 'hidden_dim_1': 256, 'hidden_dim_2': 64, 'kl_weight': 0.00011826612469542438, 'lr': 0.007298803698087887, 'batch_size': 128, 'dropout_rate': 0.10523529363919687, 'prior_mu': 0.03096062499933226, 'prior_sigma': 0.09235456154963799, 'normalization': 'layer'}. Best is trial 896 with value: 0.4533553242683411.
Generating morgan_rdkit fingerprints...
Generated fingerprints with 2048 features for 841 molecules
Trial 2434: 5-fold CV loss = 0.4689
[I 2025-08-08 01:05:10,749] Trial 2434 finished with value: 0.4688904583454132 and parameters: {'fp_type': 'morgan_rdkit', 'combined_morgan_radius': 3, 'combined_morgan_nBits': 1024, 'combined_rdkit_maxPath': 7, 'combined_rdkit_nBits': 1024, 'num_hidden_layers': 3, 'hidden_dim_0': 512, 'hidden_dim_1': 64, 'hidden_dim_2': 64, 'kl_weight': 0.0001397966118002091, 'lr': 0.007693571754645929, 'batch_size': 64, 'dropout_rate': 0.08142216297070659, 'prior_mu': -0.009566088749900066, 'prior_sigma': 0.09580823669281355, 'normalization': 'layer'}. Best is trial 896 with value: 0.4533553242683411.
Generating morgan_rdkit fingerprints...
Generated fingerprints with 2048 features for 841 molecules
Trial 2439: 5-fold CV loss = 0.8008
[I 2025-08-08 01:05:30,128] Trial 2439 finished with value: 0.8007632911205291 and parameters: {'fp_type': 'morgan_rdkit', 'combined_morgan_radius': 3, 'combined_morgan_nBits': 1024, 'combined_rdkit_maxPath': 8, 'combined_rdkit_nBits': 1024, 'num_hidden_layers': 3, 'hidden_dim_0': 256, 'hidden_dim_1': 1024, 'hidden_dim_2': 64, 'kl_weight': 0.00016500910412504293, 'lr': 0.009207581893376468, 'batch_size': 128, 'dropout_rate': 0.09584370267017481, 'prior_mu': 0.012433189208330154, 'prior_sigma': 0.11071087810559006, 'normalization': 'layer'}. Best is trial 896 with value: 0.4533553242683411.
Generating morgan_rdkit fingerprints...
Generated fingerprints with 2048 features for 841 molecules
Trial 2437: 5-fold CV loss = 0.4646
[I 2025-08-08 01:05:41,348] Trial 2437 finished with value: 0.46457685232162477 and parameters: {'fp_type': 'morgan_rdkit', 'combined_morgan_radius': 3, 'combined_morgan_nBits': 1024, 'combined_rdkit_maxPath': 7, 'combined_rdkit_nBits': 1024, 'num_hidden_layers': 3, 'hidden_dim_0': 256, 'hidden_dim_1': 1024, 'hidden_dim_2': 64, 'kl_weight': 0.00010014048073016728, 'lr': 0.007182434584949884, 'batch_size': 128, 'dropout_rate': 0.09720353109118385, 'prior_mu': 0.010845062297027436, 'prior_sigma': 0.09648728786239673, 'normalization': 'layer'}. Best is trial 896 with value: 0.4533553242683411.
Generating morgan_rdkit fingerprints...
Generated fingerprints with 2048 features for 841 molecules
Trial 2440: 5-fold CV loss = 0.8605
[I 2025-08-08 01:05:56,316] Trial 2440 finished with value: 0.8605285525321961 and parameters: {'fp_type': 'morgan_rdkit', 'combined_morgan_radius': 3, 'combined_morgan_nBits': 1024, 'combined_rdkit_maxPath': 7, 'combined_rdkit_nBits': 1024, 'num_hidden_layers': 3, 'hidden_dim_0': 256, 'hidden_dim_1': 1024, 'hidden_dim_2': 64, 'kl_weight': 0.00020209723133261608, 'lr': 0.0003468542601704886, 'batch_size': 128, 'dropout_rate': 0.0776105467859113, 'prior_mu': 0.006396857665169587, 'prior_sigma': 0.10232861027367539, 'normalization': 'layer'}. Best is trial 896 with value: 0.4533553242683411.
Generating morgan_rdkit fingerprints...
Generated fingerprints with 2048 features for 841 molecules
Trial 2436: 5-fold CV loss = 0.4644
[I 2025-08-08 01:06:06,003] Trial 2436 finished with value: 0.46436851620674136 and parameters: {'fp_type': 'morgan_rdkit', 'combined_morgan_radius': 3, 'combined_morgan_nBits': 1024, 'combined_rdkit_maxPath': 7, 'combined_rdkit_nBits': 1024, 'num_hidden_layers': 3, 'hidden_dim_0': 256, 'hidden_dim_1': 1024, 'hidden_dim_2': 64, 'kl_weight': 0.0001428251779369334, 'lr': 0.007787535020613208, 'batch_size': 128, 'dropout_rate': 0.4468673214128172, 'prior_mu': -0.009314011493555987, 'prior_sigma': 0.09631716086204822, 'normalization': 'layer'}. Best is trial 896 with value: 0.4533553242683411.
Generating morgan_rdkit fingerprints...
Generated fingerprints with 2048 features for 841 molecules
Trial 2441: 5-fold CV loss = 0.8126
[I 2025-08-08 01:06:07,921] Trial 2441 finished with value: 0.8126033186912537 and parameters: {'fp_type': 'morgan_rdkit', 'combined_morgan_radius': 3, 'combined_morgan_nBits': 1024, 'combined_rdkit_maxPath': 7, 'combined_rdkit_nBits': 1024, 'num_hidden_layers': 3, 'hidden_dim_0': 256, 'hidden_dim_1': 1024, 'hidden_dim_2': 64, 'kl_weight': 0.00019997645063072158, 'lr': 0.001353200551736337, 'batch_size': 128, 'dropout_rate': 0.07704068480035356, 'prior_mu': 0.005578431220034328, 'prior_sigma': 0.09926861321928881, 'normalization': 'layer'}. Best is trial 896 with value: 0.4533553242683411.
Generating morgan_rdkit fingerprints...
Generated fingerprints with 1280 features for 841 molecules
Trial 2444: 5-fold CV loss = 0.6673
[I 2025-08-08 01:06:34,757] Trial 2444 finished with value: 0.6673498094081879 and parameters: {'fp_type': 'morgan_rdkit', 'combined_morgan_radius': 3, 'combined_morgan_nBits': 1024, 'combined_rdkit_maxPath': 7, 'combined_rdkit_nBits': 256, 'num_hidden_layers': 3, 'hidden_dim_0': 256, 'hidden_dim_1': 1024, 'hidden_dim_2': 256, 'kl_weight': 0.00016177680273480108, 'lr': 0.009185803773759197, 'batch_size': 128, 'dropout_rate': 0.09157374357274502, 'prior_mu': -0.06881748823457434, 'prior_sigma': 0.10571930013246757, 'normalization': 'layer'}. Best is trial 896 with value: 0.4533553242683411.
Generating morgan_rdkit fingerprints...
Generated fingerprints with 2048 features for 841 molecules
Trial 2438: 5-fold CV loss = 0.4616
[I 2025-08-08 01:06:40,910] Trial 2438 finished with value: 0.46164087653160096 and parameters: {'fp_type': 'morgan_rdkit', 'combined_morgan_radius': 3, 'combined_morgan_nBits': 1024, 'combined_rdkit_maxPath': 7, 'combined_rdkit_nBits': 1024, 'num_hidden_layers': 3, 'hidden_dim_0': 256, 'hidden_dim_1': 1024, 'hidden_dim_2': 64, 'kl_weight': 0.00015078676988581136, 'lr': 0.009216409587526817, 'batch_size': 128, 'dropout_rate': 0.09926671685298628, 'prior_mu': 0.006843878309039316, 'prior_sigma': 0.0965648714768, 'normalization': 'layer'}. Best is trial 896 with value: 0.4533553242683411.
Generating morgan_rdkit fingerprints...
Generated fingerprints with 2048 features for 841 molecules
Trial 2442: 5-fold CV loss = 0.4608
[I 2025-08-08 01:06:43,485] Trial 2442 finished with value: 0.4608089685440063 and parameters: {'fp_type': 'morgan_rdkit', 'combined_morgan_radius': 3, 'combined_morgan_nBits': 1024, 'combined_rdkit_maxPath': 7, 'combined_rdkit_nBits': 1024, 'num_hidden_layers': 3, 'hidden_dim_0': 256, 'hidden_dim_1': 1024, 'hidden_dim_2': 64, 'kl_weight': 0.0001493257548422082, 'lr': 0.00866120669231344, 'batch_size': 128, 'dropout_rate': 0.09164384915526695, 'prior_mu': -0.011190139462948563, 'prior_sigma': 0.10450164175498325, 'normalization': 'layer'}. Best is trial 896 with value: 0.4533553242683411.
Generating morgan_rdkit fingerprints...
Generated fingerprints with 2048 features for 841 molecules
Trial 2443: 5-fold CV loss = 0.6242
[I 2025-08-08 01:06:55,907] Trial 2443 finished with value: 0.6242485761642456 and parameters: {'fp_type': 'morgan_rdkit', 'combined_morgan_radius': 3, 'combined_morgan_nBits': 1024, 'combined_rdkit_maxPath': 7, 'combined_rdkit_nBits': 1024, 'num_hidden_layers': 3, 'hidden_dim_0': 256, 'hidden_dim_1': 1024, 'hidden_dim_2': 256, 'kl_weight': 0.00015910739766690287, 'lr': 0.00996614051253291, 'batch_size': 128, 'dropout_rate': 0.09073887411494085, 'prior_mu': -0.00800261983087978, 'prior_sigma': 0.10358974962335188, 'normalization': 'layer'}. Best is trial 896 with value: 0.4533553242683411.
Generating morgan_rdkit fingerprints...
Generated fingerprints with 2048 features for 841 molecules
Trial 2445: 5-fold CV loss = 0.4677
