[I 2025-08-07 18:34:24,986] Trial 465 finished with value: 0.4675120174884796 and parameters: {'fp_type': 'morgan_rdkit', 'combined_morgan_radius': 2, 'combined_morgan_nBits': 1024, 'combined_rdkit_maxPath': 7, 'combined_rdkit_nBits': 1024, 'num_hidden_layers': 3, 'hidden_dim_0': 256, 'hidden_dim_1': 1024, 'hidden_dim_2': 64, 'kl_weight': 0.00025846449307998236, 'lr': 0.00504397872070479, 'batch_size': 128, 'dropout_rate': 0.18894926882285462, 'prior_mu': -0.0016103466699527334, 'prior_sigma': 0.07323488476698858, 'normalization': 'layer'}. Best is trial 455 with value: 0.46377224922180177.
Generating morgan_rdkit fingerprints...
Generated fingerprints with 2048 features for 841 molecules
Trial 468: 5-fold CV loss = 0.5615
[I 2025-08-07 18:34:54,380] Trial 468 finished with value: 0.5615062057971955 and parameters: {'fp_type': 'morgan_rdkit', 'combined_morgan_radius': 2, 'combined_morgan_nBits': 1024, 'combined_rdkit_maxPath': 7, 'combined_rdkit_nBits': 1024, 'num_hidden_layers': 3, 'hidden_dim_0': 256, 'hidden_dim_1': 1024, 'hidden_dim_2': 64, 'kl_weight': 0.00025925533021625317, 'lr': 0.004148805881544264, 'batch_size': 128, 'dropout_rate': 0.18329759297841758, 'prior_mu': 0.018187283400041387, 'prior_sigma': 0.07120165922198313, 'normalization': 'layer'}. Best is trial 455 with value: 0.46377224922180177.
Generating morgan_rdkit fingerprints...
Generated fingerprints with 2048 features for 841 molecules
Trial 469: 5-fold CV loss = 0.4653
[I 2025-08-07 18:35:07,136] Trial 469 finished with value: 0.4652790606021881 and parameters: {'fp_type': 'morgan_rdkit', 'combined_morgan_radius': 2, 'combined_morgan_nBits': 1024, 'combined_rdkit_maxPath': 7, 'combined_rdkit_nBits': 1024, 'num_hidden_layers': 3, 'hidden_dim_0': 256, 'hidden_dim_1': 1024, 'hidden_dim_2': 64, 'kl_weight': 0.00030160509459479346, 'lr': 0.005077582282712073, 'batch_size': 128, 'dropout_rate': 0.18587572922981088, 'prior_mu': 0.0011595542208193265, 'prior_sigma': 0.06745291382900293, 'normalization': 'layer'}. Best is trial 455 with value: 0.46377224922180177.
Generating morgan_rdkit fingerprints...
Generated fingerprints with 2048 features for 841 molecules
Trial 467: 5-fold CV loss = 0.4677
[I 2025-08-07 18:35:16,749] Trial 467 finished with value: 0.46772022247314454 and parameters: {'fp_type': 'morgan_rdkit', 'combined_morgan_radius': 2, 'combined_morgan_nBits': 1024, 'combined_rdkit_maxPath': 7, 'combined_rdkit_nBits': 1024, 'num_hidden_layers': 3, 'hidden_dim_0': 256, 'hidden_dim_1': 1024, 'hidden_dim_2': 64, 'kl_weight': 0.0003006477082890605, 'lr': 0.004516607897942308, 'batch_size': 128, 'dropout_rate': 0.1855579953082192, 'prior_mu': 0.00021098073339249207, 'prior_sigma': 0.07874729060298179, 'normalization': 'layer'}. Best is trial 455 with value: 0.46377224922180177.
Generating morgan_rdkit fingerprints...
Generated fingerprints with 2048 features for 841 molecules
Trial 470: 5-fold CV loss = 0.4709
[I 2025-08-07 18:35:31,373] Trial 470 finished with value: 0.47089130282402036 and parameters: {'fp_type': 'morgan_rdkit', 'combined_morgan_radius': 2, 'combined_morgan_nBits': 1024, 'combined_rdkit_maxPath': 7, 'combined_rdkit_nBits': 1024, 'num_hidden_layers': 3, 'hidden_dim_0': 256, 'hidden_dim_1': 1024, 'hidden_dim_2': 64, 'kl_weight': 0.00027385702324223693, 'lr': 0.005176799372278086, 'batch_size': 128, 'dropout_rate': 0.18656481728339835, 'prior_mu': -0.0023625491220751176, 'prior_sigma': 0.06744681759877227, 'normalization': 'layer'}. Best is trial 455 with value: 0.46377224922180177.
Generating morgan_rdkit fingerprints...
Generated fingerprints with 2048 features for 841 molecules
Trial 464: 5-fold CV loss = 0.4681
[I 2025-08-07 18:35:42,116] Trial 464 finished with value: 0.4681146562099457 and parameters: {'fp_type': 'morgan_rdkit', 'combined_morgan_radius': 2, 'combined_morgan_nBits': 1024, 'combined_rdkit_maxPath': 7, 'combined_rdkit_nBits': 1024, 'num_hidden_layers': 3, 'hidden_dim_0': 256, 'hidden_dim_1': 1024, 'hidden_dim_2': 64, 'kl_weight': 0.0002598334838302502, 'lr': 0.0038248144188245538, 'batch_size': 128, 'dropout_rate': 0.18107621479722205, 'prior_mu': 0.001277625168064428, 'prior_sigma': 0.08184605727342505, 'normalization': 'layer'}. Best is trial 455 with value: 0.46377224922180177.
Generating morgan_rdkit fingerprints...
Generated fingerprints with 2048 features for 841 molecules
Trial 471: 5-fold CV loss = 0.4749
[I 2025-08-07 18:35:47,063] Trial 471 finished with value: 0.47486295104026793 and parameters: {'fp_type': 'morgan_rdkit', 'combined_morgan_radius': 2, 'combined_morgan_nBits': 1024, 'combined_rdkit_maxPath': 7, 'combined_rdkit_nBits': 1024, 'num_hidden_layers': 3, 'hidden_dim_0': 256, 'hidden_dim_1': 1024, 'hidden_dim_2': 64, 'kl_weight': 0.00027604534243069355, 'lr': 0.005264376380560456, 'batch_size': 128, 'dropout_rate': 0.1880786845451516, 'prior_mu': -0.013651005107159272, 'prior_sigma': 0.0670789647998992, 'normalization': 'layer'}. Best is trial 455 with value: 0.46377224922180177.
Generating morgan_rdkit fingerprints...
Generated fingerprints with 2048 features for 841 molecules
Trial 473: 5-fold CV loss = 0.4639
[I 2025-08-07 18:36:06,121] Trial 473 finished with value: 0.46391957998275757 and parameters: {'fp_type': 'morgan_rdkit', 'combined_morgan_radius': 2, 'combined_morgan_nBits': 1024, 'combined_rdkit_maxPath': 7, 'combined_rdkit_nBits': 1024, 'num_hidden_layers': 3, 'hidden_dim_0': 256, 'hidden_dim_1': 1024, 'hidden_dim_2': 64, 'kl_weight': 0.0003588582572752852, 'lr': 0.005882278131101573, 'batch_size': 128, 'dropout_rate': 0.17113775777726295, 'prior_mu': -0.007079722681701128, 'prior_sigma': 0.06731586375110205, 'normalization': 'layer'}. Best is trial 455 with value: 0.46377224922180177.
Generating morgan_rdkit fingerprints...
Generated fingerprints with 2048 features for 841 molecules
Trial 472: 5-fold CV loss = 0.4746
[I 2025-08-07 18:36:11,628] Trial 472 finished with value: 0.47460018992424013 and parameters: {'fp_type': 'morgan_rdkit', 'combined_morgan_radius': 2, 'combined_morgan_nBits': 1024, 'combined_rdkit_maxPath': 7, 'combined_rdkit_nBits': 1024, 'num_hidden_layers': 3, 'hidden_dim_0': 256, 'hidden_dim_1': 1024, 'hidden_dim_2': 64, 'kl_weight': 0.00031898286228781617, 'lr': 0.0047753001673643426, 'batch_size': 128, 'dropout_rate': 0.18628617905750225, 'prior_mu': -0.010893506501219025, 'prior_sigma': 0.06879371382102442, 'normalization': 'layer'}. Best is trial 455 with value: 0.46377224922180177.
Generating morgan_rdkit fingerprints...
Generated fingerprints with 2048 features for 841 molecules
Trial 475: 5-fold CV loss = 0.4760
[I 2025-08-07 18:36:18,577] Trial 475 finished with value: 0.47601677775382994 and parameters: {'fp_type': 'morgan_rdkit', 'combined_morgan_radius': 2, 'combined_morgan_nBits': 1024, 'combined_rdkit_maxPath': 5, 'combined_rdkit_nBits': 1024, 'num_hidden_layers': 3, 'hidden_dim_0': 256, 'hidden_dim_1': 1024, 'hidden_dim_2': 64, 'kl_weight': 0.00037714770905835184, 'lr': 0.004833410727004945, 'batch_size': 128, 'dropout_rate': 0.16997421440884886, 'prior_mu': -0.007093784992136597, 'prior_sigma': 0.07622958638596022, 'normalization': 'layer'}. Best is trial 455 with value: 0.46377224922180177.
Generating morgan_rdkit fingerprints...
Generated fingerprints with 2048 features for 841 molecules
Trial 476: 5-fold CV loss = 0.4816
[I 2025-08-07 18:36:32,729] Trial 476 finished with value: 0.4815800726413727 and parameters: {'fp_type': 'morgan_rdkit', 'combined_morgan_radius': 2, 'combined_morgan_nBits': 1024, 'combined_rdkit_maxPath': 5, 'combined_rdkit_nBits': 1024, 'num_hidden_layers': 3, 'hidden_dim_0': 256, 'hidden_dim_1': 1024, 'hidden_dim_2': 64, 'kl_weight': 0.00039628543397106396, 'lr': 0.006060363772428437, 'batch_size': 128, 'dropout_rate': 0.1752734072287324, 'prior_mu': -0.007584541976491261, 'prior_sigma': 0.07745528057165689, 'normalization': 'layer'}. Best is trial 455 with value: 0.46377224922180177.
Generating morgan_rdkit fingerprints...
Generated fingerprints with 2048 features for 841 molecules
Trial 477: 5-fold CV loss = 0.4846
[I 2025-08-07 18:36:49,687] Trial 477 finished with value: 0.4845577239990234 and parameters: {'fp_type': 'morgan_rdkit', 'combined_morgan_radius': 2, 'combined_morgan_nBits': 1024, 'combined_rdkit_maxPath': 5, 'combined_rdkit_nBits': 1024, 'num_hidden_layers': 3, 'hidden_dim_0': 256, 'hidden_dim_1': 1024, 'hidden_dim_2': 64, 'kl_weight': 0.0003408996588129633, 'lr': 0.006210223713136593, 'batch_size': 128, 'dropout_rate': 0.17311197043067444, 'prior_mu': -0.03140836973299521, 'prior_sigma': 0.07604412589091088, 'normalization': 'layer'}. Best is trial 455 with value: 0.46377224922180177.
Generating morgan_rdkit fingerprints...
Generated fingerprints with 2048 features for 841 molecules
Trial 478: 5-fold CV loss = 0.4682
[I 2025-08-07 18:37:05,781] Trial 478 finished with value: 0.46815432906150817 and parameters: {'fp_type': 'morgan_rdkit', 'combined_morgan_radius': 2, 'combined_morgan_nBits': 1024, 'combined_rdkit_maxPath': 7, 'combined_rdkit_nBits': 1024, 'num_hidden_layers': 3, 'hidden_dim_0': 256, 'hidden_dim_1': 1024, 'hidden_dim_2': 64, 'kl_weight': 0.00032421658633449447, 'lr': 0.005656644265403851, 'batch_size': 128, 'dropout_rate': 0.172664558076786, 'prior_mu': -0.002548353124602673, 'prior_sigma': 0.07911102691963677, 'normalization': 'layer'}. Best is trial 455 with value: 0.46377224922180177.
Generating morgan_rdkit fingerprints...
Generated fingerprints with 2048 features for 841 molecules
Trial 479: 5-fold CV loss = 0.4579
[I 2025-08-07 18:37:12,564] Trial 479 finished with value: 0.4579240560531616 and parameters: {'fp_type': 'morgan_rdkit', 'combined_morgan_radius': 3, 'combined_morgan_nBits': 1024, 'combined_rdkit_maxPath': 7, 'combined_rdkit_nBits': 1024, 'num_hidden_layers': 3, 'hidden_dim_0': 256, 'hidden_dim_1': 1024, 'hidden_dim_2': 64, 'kl_weight': 0.0003263663871681723, 'lr': 0.005650468082369675, 'batch_size': 128, 'dropout_rate': 0.17921498262021585, 'prior_mu': -0.0159204819619721, 'prior_sigma': 0.07996597999808955, 'normalization': 'layer'}. Best is trial 479 with value: 0.4579240560531616.
Generating morgan_rdkit fingerprints...
Generated fingerprints with 2048 features for 841 molecules
Trial 474: 5-fold CV loss = 0.4699
[I 2025-08-07 18:37:20,042] Trial 474 finished with value: 0.46987912654876707 and parameters: {'fp_type': 'morgan_rdkit', 'combined_morgan_radius': 2, 'combined_morgan_nBits': 1024, 'combined_rdkit_maxPath': 7, 'combined_rdkit_nBits': 1024, 'num_hidden_layers': 3, 'hidden_dim_0': 256, 'hidden_dim_1': 1024, 'hidden_dim_2': 64, 'kl_weight': 0.00036545808214700896, 'lr': 0.005788421454099226, 'batch_size': 128, 'dropout_rate': 0.17572273702477853, 'prior_mu': -0.008994599846946604, 'prior_sigma': 0.07872084906798962, 'normalization': 'layer'}. Best is trial 479 with value: 0.4579240560531616.
Generating morgan_rdkit fingerprints...
Generated fingerprints with 2048 features for 841 molecules
Trial 480: 5-fold CV loss = 0.5805
[I 2025-08-07 18:37:32,708] Trial 480 finished with value: 0.5804922223091126 and parameters: {'fp_type': 'morgan_rdkit', 'combined_morgan_radius': 2, 'combined_morgan_nBits': 1024, 'combined_rdkit_maxPath': 7, 'combined_rdkit_nBits': 1024, 'num_hidden_layers': 3, 'hidden_dim_0': 256, 'hidden_dim_1': 1024, 'hidden_dim_2': 64, 'kl_weight': 0.00025997733642211873, 'lr': 0.005381821327188785, 'batch_size': 128, 'dropout_rate': 0.1876477762290018, 'prior_mu': -0.0033733352234518142, 'prior_sigma': 0.06517246081302644, 'normalization': 'none'}. Best is trial 479 with value: 0.4579240560531616.
Generating morgan_rdkit fingerprints...
Generated fingerprints with 2048 features for 841 molecules
Trial 482: 5-fold CV loss = 0.5652
[I 2025-08-07 18:37:46,598] Trial 482 finished with value: 0.56516535282135 and parameters: {'fp_type': 'morgan_rdkit', 'combined_morgan_radius': 2, 'combined_morgan_nBits': 1024, 'combined_rdkit_maxPath': 7, 'combined_rdkit_nBits': 1024, 'num_hidden_layers': 3, 'hidden_dim_0': 256, 'hidden_dim_1': 1024, 'hidden_dim_2': 64, 'kl_weight': 0.00031666800895299274, 'lr': 0.0056044970447154474, 'batch_size': 128, 'dropout_rate': 0.16617415557726994, 'prior_mu': -0.02599472066211268, 'prior_sigma': 0.08075546090991693, 'normalization': 'none'}. Best is trial 479 with value: 0.4579240560531616.
Generating morgan_rdkit fingerprints...
Generated fingerprints with 2048 features for 841 molecules
Trial 481: 5-fold CV loss = 0.5279
[I 2025-08-07 18:37:57,151] Trial 481 finished with value: 0.5279385626316071 and parameters: {'fp_type': 'morgan_rdkit', 'combined_morgan_radius': 3, 'combined_morgan_nBits': 1024, 'combined_rdkit_maxPath': 7, 'combined_rdkit_nBits': 1024, 'num_hidden_layers': 3, 'hidden_dim_0': 256, 'hidden_dim_1': 1024, 'hidden_dim_2': 64, 'kl_weight': 0.00030383560378668983, 'lr': 0.005659539843224106, 'batch_size': 128, 'dropout_rate': 0.1681149574716632, 'prior_mu': -0.02221052002839976, 'prior_sigma': 0.06479705545466337, 'normalization': 'none'}. Best is trial 479 with value: 0.4579240560531616.
Generating morgan_rdkit fingerprints...
Generated fingerprints with 2048 features for 841 molecules
Trial 485: 5-fold CV loss = 0.6563
[I 2025-08-07 18:38:16,434] Trial 485 finished with value: 0.6563387215137482 and parameters: {'fp_type': 'morgan_rdkit', 'combined_morgan_radius': 2, 'combined_morgan_nBits': 1024, 'combined_rdkit_maxPath': 8, 'combined_rdkit_nBits': 1024, 'num_hidden_layers': 3, 'hidden_dim_0': 256, 'hidden_dim_1': 1024, 'hidden_dim_2': 64, 'kl_weight': 0.0004531251747698191, 'lr': 0.006945701473677025, 'batch_size': 128, 'dropout_rate': 0.1748424759210517, 'prior_mu': 0.0008271708533919538, 'prior_sigma': 0.07193478880112855, 'normalization': 'layer'}. Best is trial 479 with value: 0.4579240560531616.
Generating morgan_rdkit fingerprints...
Generated fingerprints with 2048 features for 841 molecules
Trial 484: 5-fold CV loss = 0.5441
[I 2025-08-07 18:38:29,576] Trial 484 finished with value: 0.544069629907608 and parameters: {'fp_type': 'morgan_rdkit', 'combined_morgan_radius': 2, 'combined_morgan_nBits': 1024, 'combined_rdkit_maxPath': 8, 'combined_rdkit_nBits': 1024, 'num_hidden_layers': 3, 'hidden_dim_0': 256, 'hidden_dim_1': 1024, 'hidden_dim_2': 64, 'kl_weight': 0.00045533246392942864, 'lr': 0.00652070323657212, 'batch_size': 128, 'dropout_rate': 0.16766991310007556, 'prior_mu': -0.026954060907758315, 'prior_sigma': 0.07971499330811208, 'normalization': 'layer'}. Best is trial 479 with value: 0.4579240560531616.
Generating morgan_rdkit fingerprints...
Generated fingerprints with 2048 features for 841 molecules
Trial 486: 5-fold CV loss = 0.4934
[I 2025-08-07 18:38:35,437] Trial 486 finished with value: 0.4934065580368042 and parameters: {'fp_type': 'morgan_rdkit', 'combined_morgan_radius': 2, 'combined_morgan_nBits': 1024, 'combined_rdkit_maxPath': 8, 'combined_rdkit_nBits': 1024, 'num_hidden_layers': 3, 'hidden_dim_0': 256, 'hidden_dim_1': 1024, 'hidden_dim_2': 64, 'kl_weight': 0.00047637025972708125, 'lr': 0.00693757072791847, 'batch_size': 128, 'dropout_rate': 0.18166175249366937, 'prior_mu': 0.0007100694107815596, 'prior_sigma': 0.06060679367873529, 'normalization': 'layer'}. Best is trial 479 with value: 0.4579240560531616.
Generating morgan_rdkit fingerprints...
Generated fingerprints with 2048 features for 841 molecules
Trial 483: 5-fold CV loss = 0.6117
[I 2025-08-07 18:38:56,937] Trial 483 finished with value: 0.6117032647132874 and parameters: {'fp_type': 'morgan_rdkit', 'combined_morgan_radius': 2, 'combined_morgan_nBits': 1024, 'combined_rdkit_maxPath': 7, 'combined_rdkit_nBits': 1024, 'num_hidden_layers': 3, 'hidden_dim_0': 256, 'hidden_dim_1': 1024, 'hidden_dim_2': 64, 'kl_weight': 0.00047277189501065546, 'lr': 0.007291622462519586, 'batch_size': 128, 'dropout_rate': 0.16557410570115846, 'prior_mu': -0.02362138341896581, 'prior_sigma': 0.08078917420828317, 'normalization': 'none'}. Best is trial 479 with value: 0.4579240560531616.
Generating morgan_rdkit fingerprints...
Generated fingerprints with 1536 features for 841 molecules
Trial 487: 5-fold CV loss = 0.4678
[I 2025-08-07 18:38:58,310] Trial 487 finished with value: 0.4678369700908661 and parameters: {'fp_type': 'morgan_rdkit', 'combined_morgan_radius': 2, 'combined_morgan_nBits': 1024, 'combined_rdkit_maxPath': 7, 'combined_rdkit_nBits': 1024, 'num_hidden_layers': 3, 'hidden_dim_0': 256, 'hidden_dim_1': 1024, 'hidden_dim_2': 64, 'kl_weight': 0.0003538056718151231, 'lr': 0.00470570733247686, 'batch_size': 128, 'dropout_rate': 0.14298525448768645, 'prior_mu': -0.015064756125855654, 'prior_sigma': 0.08155549892165855, 'normalization': 'layer'}. Best is trial 479 with value: 0.4579240560531616.
Generating morgan_rdkit fingerprints...
Generated fingerprints with 1536 features for 841 molecules
Trial 489: 5-fold CV loss = 0.4717
[I 2025-08-07 18:39:25,752] Trial 489 finished with value: 0.47173452377319336 and parameters: {'fp_type': 'morgan_rdkit', 'combined_morgan_radius': 2, 'combined_morgan_nBits': 1024, 'combined_rdkit_maxPath': 7, 'combined_rdkit_nBits': 1024, 'num_hidden_layers': 3, 'hidden_dim_0': 256, 'hidden_dim_1': 1024, 'hidden_dim_2': 64, 'kl_weight': 0.0003406139516476272, 'lr': 0.004987702193804761, 'batch_size': 128, 'dropout_rate': 0.1462044442894063, 'prior_mu': -0.012934262168499978, 'prior_sigma': 0.08628499480197369, 'normalization': 'layer'}. Best is trial 479 with value: 0.4579240560531616.
Generating morgan_rdkit fingerprints...
Generated fingerprints with 2048 features for 841 molecules
Trial 491: 5-fold CV loss = 0.5058
[I 2025-08-07 18:39:33,387] Trial 491 finished with value: 0.5058353245258331 and parameters: {'fp_type': 'morgan_rdkit', 'combined_morgan_radius': 2, 'combined_morgan_nBits': 1024, 'combined_rdkit_maxPath': 7, 'combined_rdkit_nBits': 512, 'num_hidden_layers': 3, 'hidden_dim_0': 256, 'hidden_dim_1': 1024, 'hidden_dim_2': 64, 'kl_weight': 0.0003464021286314854, 'lr': 0.004885703086547834, 'batch_size': 128, 'dropout_rate': 0.14992183842827117, 'prior_mu': -0.009776747139566553, 'prior_sigma': 0.07316865913438814, 'normalization': 'layer'}. Best is trial 479 with value: 0.4579240560531616.
Generating morgan_rdkit fingerprints...
Generated fingerprints with 2048 features for 841 molecules
Trial 488: 5-fold CV loss = 0.4669
[I 2025-08-07 18:39:36,195] Trial 488 finished with value: 0.4668526589870453 and parameters: {'fp_type': 'morgan_rdkit', 'combined_morgan_radius': 2, 'combined_morgan_nBits': 1024, 'combined_rdkit_maxPath': 7, 'combined_rdkit_nBits': 1024, 'num_hidden_layers': 3, 'hidden_dim_0': 256, 'hidden_dim_1': 1024, 'hidden_dim_2': 64, 'kl_weight': 0.0003324058608643128, 'lr': 0.0049326942266420945, 'batch_size': 128, 'dropout_rate': 0.14734888763844806, 'prior_mu': -0.0027585667874015555, 'prior_sigma': 0.08518690079157476, 'normalization': 'layer'}. Best is trial 479 with value: 0.4579240560531616.
Generating morgan_rdkit fingerprints...
Generated fingerprints with 2048 features for 841 molecules
Trial 492: 5-fold CV loss = 0.4698
[I 2025-08-07 18:40:14,495] Trial 492 finished with value: 0.4698259174823761 and parameters: {'fp_type': 'morgan_rdkit', 'combined_morgan_radius': 2, 'combined_morgan_nBits': 1024, 'combined_rdkit_maxPath': 7, 'combined_rdkit_nBits': 1024, 'num_hidden_layers': 3, 'hidden_dim_0': 256, 'hidden_dim_1': 1024, 'hidden_dim_2': 64, 'kl_weight': 0.00027717015453525913, 'lr': 0.004494499301118933, 'batch_size': 128, 'dropout_rate': 0.17880943218090048, 'prior_mu': -0.00485237980095391, 'prior_sigma': 0.07305476923273212, 'normalization': 'layer'}. Best is trial 479 with value: 0.4579240560531616.
Generating morgan_rdkit fingerprints...
Generated fingerprints with 2048 features for 841 molecules
Trial 493: 5-fold CV loss = 0.4662
[I 2025-08-07 18:40:15,562] Trial 493 finished with value: 0.466151362657547 and parameters: {'fp_type': 'morgan_rdkit', 'combined_morgan_radius': 2, 'combined_morgan_nBits': 1024, 'combined_rdkit_maxPath': 7, 'combined_rdkit_nBits': 1024, 'num_hidden_layers': 3, 'hidden_dim_0': 256, 'hidden_dim_1': 1024, 'hidden_dim_2': 64, 'kl_weight': 0.0002508483897072071, 'lr': 0.0046349920297881295, 'batch_size': 128, 'dropout_rate': 0.1855239020632209, 'prior_mu': -0.00046595252568201696, 'prior_sigma': 0.08381357277627115, 'normalization': 'layer'}. Best is trial 479 with value: 0.4579240560531616.
Generating morgan_rdkit fingerprints...
Generated fingerprints with 2048 features for 841 molecules
Trial 490: 5-fold CV loss = 0.5879
[I 2025-08-07 18:40:25,194] Trial 490 finished with value: 0.5878718376159668 and parameters: {'fp_type': 'morgan_rdkit', 'combined_morgan_radius': 2, 'combined_morgan_nBits': 1024, 'combined_rdkit_maxPath': 7, 'combined_rdkit_nBits': 512, 'num_hidden_layers': 3, 'hidden_dim_0': 256, 'hidden_dim_1': 1024, 'hidden_dim_2': 64, 'kl_weight': 0.0003320938464761901, 'lr': 0.004665640689198836, 'batch_size': 128, 'dropout_rate': 0.18358834036718055, 'prior_mu': -0.013441806522433895, 'prior_sigma': 0.08618574097976678, 'normalization': 'layer'}. Best is trial 479 with value: 0.4579240560531616.
Generating morgan_rdkit fingerprints...
Generated fingerprints with 2048 features for 841 molecules
Trial 494: 5-fold CV loss = 0.4719
[I 2025-08-07 18:40:34,023] Trial 494 finished with value: 0.4719038963317871 and parameters: {'fp_type': 'morgan_rdkit', 'combined_morgan_radius': 2, 'combined_morgan_nBits': 1024, 'combined_rdkit_maxPath': 7, 'combined_rdkit_nBits': 1024, 'num_hidden_layers': 3, 'hidden_dim_0': 256, 'hidden_dim_1': 1024, 'hidden_dim_2': 64, 'kl_weight': 0.0002980732495741098, 'lr': 0.0059885815197046844, 'batch_size': 128, 'dropout_rate': 0.13381564342761615, 'prior_mu': -0.0015085375729710802, 'prior_sigma': 0.08857283622864803, 'normalization': 'layer'}. Best is trial 479 with value: 0.4579240560531616.
Generating morgan_rdkit fingerprints...
Generated fingerprints with 2048 features for 841 molecules
Trial 496: 5-fold CV loss = 0.4782
