[I 2025-08-07 19:22:54,812] Trial 706 finished with value: 0.4645203411579132 and parameters: {'fp_type': 'morgan_rdkit', 'combined_morgan_radius': 3, 'combined_morgan_nBits': 1024, 'combined_rdkit_maxPath': 7, 'combined_rdkit_nBits': 1024, 'num_hidden_layers': 3, 'hidden_dim_0': 256, 'hidden_dim_1': 1024, 'hidden_dim_2': 64, 'kl_weight': 0.00029063015710317693, 'lr': 0.008600868380226015, 'batch_size': 128, 'dropout_rate': 0.1581991310243488, 'prior_mu': -0.05416355334973877, 'prior_sigma': 0.09665581133999275, 'normalization': 'layer'}. Best is trial 587 with value: 0.4552353322505951.
Generating morgan_rdkit fingerprints...
Generated fingerprints with 2048 features for 841 molecules
Trial 707: 5-fold CV loss = 0.8665
[I 2025-08-07 19:22:57,964] Trial 707 finished with value: 0.8665030598640442 and parameters: {'fp_type': 'morgan_rdkit', 'combined_morgan_radius': 3, 'combined_morgan_nBits': 1024, 'combined_rdkit_maxPath': 6, 'combined_rdkit_nBits': 1024, 'num_hidden_layers': 3, 'hidden_dim_0': 256, 'hidden_dim_1': 1024, 'hidden_dim_2': 64, 'kl_weight': 0.0002901337980064243, 'lr': 0.00019417772907418985, 'batch_size': 128, 'dropout_rate': 0.16349087715174332, 'prior_mu': -0.05423474741159634, 'prior_sigma': 0.0785255668794591, 'normalization': 'layer'}. Best is trial 587 with value: 0.4552353322505951.
Generating morgan_rdkit fingerprints...
Generated fingerprints with 2048 features for 841 molecules
Trial 704: 5-fold CV loss = 0.4701
[I 2025-08-07 19:23:04,919] Trial 704 finished with value: 0.47005916237831114 and parameters: {'fp_type': 'morgan_rdkit', 'combined_morgan_radius': 3, 'combined_morgan_nBits': 1024, 'combined_rdkit_maxPath': 7, 'combined_rdkit_nBits': 1024, 'num_hidden_layers': 3, 'hidden_dim_0': 256, 'hidden_dim_1': 1024, 'hidden_dim_2': 64, 'kl_weight': 0.0004607339447525237, 'lr': 0.00824369550618794, 'batch_size': 128, 'dropout_rate': 0.15546047902880483, 'prior_mu': -0.04543609748825103, 'prior_sigma': 0.09626949412641779, 'normalization': 'layer'}. Best is trial 587 with value: 0.4552353322505951.
Generating morgan_rdkit fingerprints...
Generated fingerprints with 2048 features for 841 molecules
Trial 708: 5-fold CV loss = 0.4763
[I 2025-08-07 19:23:17,916] Trial 708 finished with value: 0.47634871006011964 and parameters: {'fp_type': 'morgan_rdkit', 'combined_morgan_radius': 3, 'combined_morgan_nBits': 1024, 'combined_rdkit_maxPath': 6, 'combined_rdkit_nBits': 1024, 'num_hidden_layers': 3, 'hidden_dim_0': 256, 'hidden_dim_1': 1024, 'hidden_dim_2': 64, 'kl_weight': 0.00030049342019057763, 'lr': 0.008951365225312207, 'batch_size': 128, 'dropout_rate': 0.16375749166935674, 'prior_mu': -0.0522191448197689, 'prior_sigma': 0.07765997511783235, 'normalization': 'layer'}. Best is trial 587 with value: 0.4552353322505951.
Generating morgan_rdkit fingerprints...
Generated fingerprints with 2048 features for 841 molecules
Trial 709: 5-fold CV loss = 0.5528
[I 2025-08-07 19:23:34,844] Trial 709 finished with value: 0.5528391122817993 and parameters: {'fp_type': 'morgan_rdkit', 'combined_morgan_radius': 3, 'combined_morgan_nBits': 1024, 'combined_rdkit_maxPath': 7, 'combined_rdkit_nBits': 1024, 'num_hidden_layers': 3, 'hidden_dim_0': 256, 'hidden_dim_1': 1024, 'hidden_dim_2': 64, 'kl_weight': 0.0002805893965928277, 'lr': 0.009178907689337129, 'batch_size': 128, 'dropout_rate': 0.15060135992198678, 'prior_mu': -0.04476159447928013, 'prior_sigma': 0.0791771737723831, 'normalization': 'none'}. Best is trial 587 with value: 0.4552353322505951.
Generating morgan_rdkit fingerprints...
Generated fingerprints with 2048 features for 841 molecules
Trial 710: 5-fold CV loss = 0.4941
[I 2025-08-07 19:23:50,038] Trial 710 finished with value: 0.49412516355514524 and parameters: {'fp_type': 'morgan_rdkit', 'combined_morgan_radius': 3, 'combined_morgan_nBits': 1024, 'combined_rdkit_maxPath': 7, 'combined_rdkit_nBits': 1024, 'num_hidden_layers': 3, 'hidden_dim_0': 256, 'hidden_dim_1': 1024, 'hidden_dim_2': 64, 'kl_weight': 0.03160967695014546, 'lr': 0.008863477548139445, 'batch_size': 128, 'dropout_rate': 0.149339136089761, 'prior_mu': -0.04327401156554593, 'prior_sigma': 0.0908619009744143, 'normalization': 'layer'}. Best is trial 587 with value: 0.4552353322505951.
Generating morgan_rdkit fingerprints...
Generated fingerprints with 2048 features for 841 molecules
Trial 712: 5-fold CV loss = 0.5558
[I 2025-08-07 19:23:58,870] Trial 712 finished with value: 0.5557918131351471 and parameters: {'fp_type': 'morgan_rdkit', 'combined_morgan_radius': 3, 'combined_morgan_nBits': 1024, 'combined_rdkit_maxPath': 7, 'combined_rdkit_nBits': 1024, 'num_hidden_layers': 3, 'hidden_dim_0': 256, 'hidden_dim_1': 1024, 'hidden_dim_2': 64, 'kl_weight': 0.0002607423565807653, 'lr': 0.009038931771479377, 'batch_size': 128, 'dropout_rate': 0.14994899995888214, 'prior_mu': -0.03940438733430432, 'prior_sigma': 0.09081193279253681, 'normalization': 'none'}. Best is trial 587 with value: 0.4552353322505951.
Generating morgan_rdkit fingerprints...
Generated fingerprints with 2048 features for 841 molecules
Trial 713: 5-fold CV loss = 0.5838
[I 2025-08-07 19:24:21,161] Trial 713 finished with value: 0.583806973695755 and parameters: {'fp_type': 'morgan_rdkit', 'combined_morgan_radius': 3, 'combined_morgan_nBits': 1024, 'combined_rdkit_maxPath': 7, 'combined_rdkit_nBits': 1024, 'num_hidden_layers': 3, 'hidden_dim_0': 256, 'hidden_dim_1': 1024, 'hidden_dim_2': 64, 'kl_weight': 0.09456633269956431, 'lr': 0.0077220413328725045, 'batch_size': 128, 'dropout_rate': 0.14978072625319408, 'prior_mu': -0.1784424949310008, 'prior_sigma': 0.09131734786453685, 'normalization': 'layer'}. Best is trial 587 with value: 0.4552353322505951.
Generating morgan_rdkit fingerprints...
Generated fingerprints with 2048 features for 841 molecules
Trial 715: 5-fold CV loss = 0.4659
[I 2025-08-07 19:24:38,656] Trial 715 finished with value: 0.4658917486667633 and parameters: {'fp_type': 'morgan_rdkit', 'combined_morgan_radius': 3, 'combined_morgan_nBits': 1024, 'combined_rdkit_maxPath': 7, 'combined_rdkit_nBits': 1024, 'num_hidden_layers': 3, 'hidden_dim_0': 256, 'hidden_dim_1': 1024, 'hidden_dim_2': 64, 'kl_weight': 0.0003421833341935997, 'lr': 0.007834210260355917, 'batch_size': 128, 'dropout_rate': 0.14029710765844416, 'prior_mu': -0.030964816900108237, 'prior_sigma': 0.1041803809405756, 'normalization': 'layer'}. Best is trial 587 with value: 0.4552353322505951.
Generating morgan_rdkit fingerprints...
Generated fingerprints with 2048 features for 841 molecules
Trial 714: 5-fold CV loss = 0.4674
[I 2025-08-07 19:24:42,960] Trial 714 finished with value: 0.46738900542259215 and parameters: {'fp_type': 'morgan_rdkit', 'combined_morgan_radius': 3, 'combined_morgan_nBits': 1024, 'combined_rdkit_maxPath': 7, 'combined_rdkit_nBits': 1024, 'num_hidden_layers': 3, 'hidden_dim_0': 256, 'hidden_dim_1': 1024, 'hidden_dim_2': 64, 'kl_weight': 0.0014158082344209323, 'lr': 0.007638183990990834, 'batch_size': 128, 'dropout_rate': 0.1424307685936977, 'prior_mu': -0.03684256512350682, 'prior_sigma': 0.08321453242372469, 'normalization': 'layer'}. Best is trial 587 with value: 0.4552353322505951.
Generating morgan_rdkit fingerprints...
Generated fingerprints with 2048 features for 841 molecules
Trial 716: 5-fold CV loss = 0.4609
[I 2025-08-07 19:25:06,866] Trial 716 finished with value: 0.4608518421649933 and parameters: {'fp_type': 'morgan_rdkit', 'combined_morgan_radius': 3, 'combined_morgan_nBits': 1024, 'combined_rdkit_maxPath': 7, 'combined_rdkit_nBits': 1024, 'num_hidden_layers': 3, 'hidden_dim_0': 256, 'hidden_dim_1': 1024, 'hidden_dim_2': 64, 'kl_weight': 0.0003251389296007524, 'lr': 0.008145578638070179, 'batch_size': 128, 'dropout_rate': 0.13828118041118756, 'prior_mu': -0.033424756335219914, 'prior_sigma': 0.10452276943854227, 'normalization': 'layer'}. Best is trial 587 with value: 0.4552353322505951.
Generating morgan_rdkit fingerprints...
Generated fingerprints with 2048 features for 841 molecules
Trial 711: 5-fold CV loss = 0.5802
[I 2025-08-07 19:25:09,348] Trial 711 finished with value: 0.58021439909935 and parameters: {'fp_type': 'morgan_rdkit', 'combined_morgan_radius': 3, 'combined_morgan_nBits': 1024, 'combined_rdkit_maxPath': 7, 'combined_rdkit_nBits': 1024, 'num_hidden_layers': 3, 'hidden_dim_0': 256, 'hidden_dim_1': 1024, 'hidden_dim_2': 64, 'kl_weight': 0.000333989958187545, 'lr': 0.009205684368710798, 'batch_size': 128, 'dropout_rate': 0.15010773935616079, 'prior_mu': -0.04274454012033642, 'prior_sigma': 0.10436870134945779, 'normalization': 'none'}. Best is trial 587 with value: 0.4552353322505951.
Generating morgan_rdkit fingerprints...
Generated fingerprints with 2048 features for 841 molecules
Trial 717: 5-fold CV loss = 0.4628
[I 2025-08-07 19:25:16,300] Trial 717 finished with value: 0.46275336742401124 and parameters: {'fp_type': 'morgan_rdkit', 'combined_morgan_radius': 3, 'combined_morgan_nBits': 1024, 'combined_rdkit_maxPath': 7, 'combined_rdkit_nBits': 1024, 'num_hidden_layers': 3, 'hidden_dim_0': 256, 'hidden_dim_1': 1024, 'hidden_dim_2': 64, 'kl_weight': 0.00033001727191319096, 'lr': 0.008311334940511386, 'batch_size': 128, 'dropout_rate': 0.1668739337264172, 'prior_mu': -0.039834923819276224, 'prior_sigma': 0.08361331600033833, 'normalization': 'layer'}. Best is trial 587 with value: 0.4552353322505951.
Generating morgan_rdkit fingerprints...
Generated fingerprints with 2048 features for 841 molecules
Trial 718: 5-fold CV loss = 0.4686
[I 2025-08-07 19:25:38,857] Trial 718 finished with value: 0.4685990035533905 and parameters: {'fp_type': 'morgan_rdkit', 'combined_morgan_radius': 3, 'combined_morgan_nBits': 1024, 'combined_rdkit_maxPath': 7, 'combined_rdkit_nBits': 1024, 'num_hidden_layers': 3, 'hidden_dim_0': 256, 'hidden_dim_1': 1024, 'hidden_dim_2': 64, 'kl_weight': 0.00035425444644009163, 'lr': 0.005051972292839426, 'batch_size': 128, 'dropout_rate': 0.16648641348617738, 'prior_mu': -0.03791153083492474, 'prior_sigma': 0.08439861774174062, 'normalization': 'layer'}. Best is trial 587 with value: 0.4552353322505951.
Generating morgan_rdkit fingerprints...
Generated fingerprints with 2048 features for 841 molecules
Trial 721: 5-fold CV loss = 0.4655
[I 2025-08-07 19:25:53,829] Trial 721 finished with value: 0.465496814250946 and parameters: {'fp_type': 'morgan_rdkit', 'combined_morgan_radius': 3, 'combined_morgan_nBits': 1024, 'combined_rdkit_maxPath': 7, 'combined_rdkit_nBits': 1024, 'num_hidden_layers': 3, 'hidden_dim_0': 256, 'hidden_dim_1': 1024, 'hidden_dim_2': 64, 'kl_weight': 0.00031697206606230607, 'lr': 0.008362791930381827, 'batch_size': 128, 'dropout_rate': 0.12370186870748649, 'prior_mu': -0.05676264143610443, 'prior_sigma': 0.10563036882506406, 'normalization': 'layer'}. Best is trial 587 with value: 0.4552353322505951.
Generating morgan_rdkit fingerprints...
Generated fingerprints with 2048 features for 841 molecules
Trial 719: 5-fold CV loss = 0.4625
[I 2025-08-07 19:25:57,559] Trial 719 finished with value: 0.4625252544879913 and parameters: {'fp_type': 'morgan_rdkit', 'combined_morgan_radius': 3, 'combined_morgan_nBits': 1024, 'combined_rdkit_maxPath': 7, 'combined_rdkit_nBits': 1024, 'num_hidden_layers': 3, 'hidden_dim_0': 256, 'hidden_dim_1': 1024, 'hidden_dim_2': 64, 'kl_weight': 0.0003341513718643861, 'lr': 0.009909231705641983, 'batch_size': 128, 'dropout_rate': 0.12760481788791986, 'prior_mu': -0.03948319982027197, 'prior_sigma': 0.11563691833869603, 'normalization': 'layer'}. Best is trial 587 with value: 0.4552353322505951.
Generating morgan_rdkit fingerprints...
Generated fingerprints with 2048 features for 841 molecules
Trial 723: 5-fold CV loss = 0.4809
[I 2025-08-07 19:26:23,100] Trial 723 finished with value: 0.48085048198699953 and parameters: {'fp_type': 'morgan_rdkit', 'combined_morgan_radius': 3, 'combined_morgan_nBits': 1024, 'combined_rdkit_maxPath': 5, 'combined_rdkit_nBits': 1024, 'num_hidden_layers': 3, 'hidden_dim_0': 256, 'hidden_dim_1': 1024, 'hidden_dim_2': 64, 'kl_weight': 0.0003140899296318702, 'lr': 0.00998690531851477, 'batch_size': 128, 'dropout_rate': 0.1274330395694206, 'prior_mu': -0.031074911696710387, 'prior_sigma': 0.1074090025034565, 'normalization': 'layer'}. Best is trial 587 with value: 0.4552353322505951.
Generating morgan_rdkit fingerprints...
Generated fingerprints with 2048 features for 841 molecules
Trial 722: 5-fold CV loss = 0.4788
[I 2025-08-07 19:26:24,681] Trial 722 finished with value: 0.47878794074058534 and parameters: {'fp_type': 'morgan_rdkit', 'combined_morgan_radius': 3, 'combined_morgan_nBits': 1024, 'combined_rdkit_maxPath': 5, 'combined_rdkit_nBits': 1024, 'num_hidden_layers': 3, 'hidden_dim_0': 256, 'hidden_dim_1': 1024, 'hidden_dim_2': 64, 'kl_weight': 0.000318183365389458, 'lr': 0.00838843820424965, 'batch_size': 128, 'dropout_rate': 0.12530244211412683, 'prior_mu': -0.056945013641647516, 'prior_sigma': 0.10600357749459674, 'normalization': 'layer'}. Best is trial 587 with value: 0.4552353322505951.
Generating morgan_rdkit fingerprints...
Generated fingerprints with 2048 features for 841 molecules
Trial 720: 5-fold CV loss = 0.4686
[I 2025-08-07 19:26:38,536] Trial 720 finished with value: 0.4685924589633942 and parameters: {'fp_type': 'morgan_rdkit', 'combined_morgan_radius': 3, 'combined_morgan_nBits': 1024, 'combined_rdkit_maxPath': 7, 'combined_rdkit_nBits': 1024, 'num_hidden_layers': 3, 'hidden_dim_0': 256, 'hidden_dim_1': 1024, 'hidden_dim_2': 64, 'kl_weight': 0.0003519672916613272, 'lr': 0.008316712121242922, 'batch_size': 128, 'dropout_rate': 0.12594892131012286, 'prior_mu': -0.03715337968240608, 'prior_sigma': 0.10262280501334874, 'normalization': 'layer'}. Best is trial 587 with value: 0.4552353322505951.
Generating morgan_rdkit fingerprints...
Generated fingerprints with 2048 features for 841 molecules
Trial 724: 5-fold CV loss = 0.4662
[I 2025-08-07 19:26:45,667] Trial 724 finished with value: 0.4662408769130707 and parameters: {'fp_type': 'morgan_rdkit', 'combined_morgan_radius': 3, 'combined_morgan_nBits': 1024, 'combined_rdkit_maxPath': 7, 'combined_rdkit_nBits': 1024, 'num_hidden_layers': 3, 'hidden_dim_0': 1024, 'hidden_dim_1': 1024, 'hidden_dim_2': 64, 'kl_weight': 0.0003735545585926464, 'lr': 0.009978764601334887, 'batch_size': 128, 'dropout_rate': 0.10651742713541382, 'prior_mu': -0.05234126829909248, 'prior_sigma': 0.1215776504554115, 'normalization': 'layer'}. Best is trial 587 with value: 0.4552353322505951.
Generating morgan_rdkit fingerprints...
Generated fingerprints with 2048 features for 841 molecules
Trial 725: 5-fold CV loss = 0.4690
[I 2025-08-07 19:27:02,310] Trial 725 finished with value: 0.4689677357673645 and parameters: {'fp_type': 'morgan_rdkit', 'combined_morgan_radius': 3, 'combined_morgan_nBits': 1024, 'combined_rdkit_maxPath': 7, 'combined_rdkit_nBits': 1024, 'num_hidden_layers': 3, 'hidden_dim_0': 256, 'hidden_dim_1': 1024, 'hidden_dim_2': 64, 'kl_weight': 0.00036082932020082675, 'lr': 0.009755591884355043, 'batch_size': 128, 'dropout_rate': 0.10734802701258422, 'prior_mu': -0.04921904414587419, 'prior_sigma': 0.10982685159436636, 'normalization': 'layer'}. Best is trial 587 with value: 0.4552353322505951.
Generating morgan_rdkit fingerprints...
Generated fingerprints with 2048 features for 841 molecules
Trial 728: 5-fold CV loss = 0.6166
[I 2025-08-07 19:27:16,616] Trial 728 finished with value: 0.616635799407959 and parameters: {'fp_type': 'morgan_rdkit', 'combined_morgan_radius': 3, 'combined_morgan_nBits': 1024, 'combined_rdkit_maxPath': 7, 'combined_rdkit_nBits': 1024, 'num_hidden_layers': 3, 'hidden_dim_0': 512, 'hidden_dim_1': 64, 'hidden_dim_2': 64, 'kl_weight': 0.0004001306201500093, 'lr': 0.009916415397651377, 'batch_size': 128, 'dropout_rate': 0.13771877997001783, 'prior_mu': -0.04715692394901133, 'prior_sigma': 0.11611873095449624, 'normalization': 'layer'}. Best is trial 587 with value: 0.4552353322505951.
Generating morgan_rdkit fingerprints...
Generated fingerprints with 2048 features for 841 molecules
Trial 726: 5-fold CV loss = 0.4686
[I 2025-08-07 19:27:23,290] Trial 726 finished with value: 0.4686126530170441 and parameters: {'fp_type': 'morgan_rdkit', 'combined_morgan_radius': 3, 'combined_morgan_nBits': 1024, 'combined_rdkit_maxPath': 7, 'combined_rdkit_nBits': 1024, 'num_hidden_layers': 3, 'hidden_dim_0': 1024, 'hidden_dim_1': 1024, 'hidden_dim_2': 64, 'kl_weight': 0.0003811286002273307, 'lr': 0.009960167499450764, 'batch_size': 128, 'dropout_rate': 0.11252882573781803, 'prior_mu': -0.051160136196597455, 'prior_sigma': 0.11398590563147538, 'normalization': 'layer'}. Best is trial 587 with value: 0.4552353322505951.
Generating morgan_rdkit fingerprints...
Generated fingerprints with 2048 features for 841 molecules
Trial 729: 5-fold CV loss = 0.5657
[I 2025-08-07 19:27:39,443] Trial 729 finished with value: 0.5657253086566925 and parameters: {'fp_type': 'morgan_rdkit', 'combined_morgan_radius': 3, 'combined_morgan_nBits': 1024, 'combined_rdkit_maxPath': 7, 'combined_rdkit_nBits': 1024, 'num_hidden_layers': 3, 'hidden_dim_0': 512, 'hidden_dim_1': 64, 'hidden_dim_2': 128, 'kl_weight': 0.0004158585532131151, 'lr': 0.009306260641969752, 'batch_size': 128, 'dropout_rate': 0.13650020811477992, 'prior_mu': -0.06461736000271819, 'prior_sigma': 0.11022926681216531, 'normalization': 'layer'}. Best is trial 587 with value: 0.4552353322505951.
Generating morgan_rdkit fingerprints...
Generated fingerprints with 1280 features for 841 molecules
Trial 730: 5-fold CV loss = 0.4680
[I 2025-08-07 19:27:57,845] Trial 730 finished with value: 0.4679944932460785 and parameters: {'fp_type': 'morgan_rdkit', 'combined_morgan_radius': 3, 'combined_morgan_nBits': 1024, 'combined_rdkit_maxPath': 7, 'combined_rdkit_nBits': 1024, 'num_hidden_layers': 3, 'hidden_dim_0': 256, 'hidden_dim_1': 1024, 'hidden_dim_2': 128, 'kl_weight': 0.0002862991908811589, 'lr': 0.009085060971862497, 'batch_size': 128, 'dropout_rate': 0.1380021471573668, 'prior_mu': -0.014496990529768982, 'prior_sigma': 0.07408184567466986, 'normalization': 'layer'}. Best is trial 587 with value: 0.4552353322505951.
Generating morgan_rdkit fingerprints...
Generated fingerprints with 1280 features for 841 molecules
Trial 731: 5-fold CV loss = 0.6470
[I 2025-08-07 19:28:00,991] Trial 731 finished with value: 0.6470195412635803 and parameters: {'fp_type': 'morgan_rdkit', 'combined_morgan_radius': 3, 'combined_morgan_nBits': 1024, 'combined_rdkit_maxPath': 7, 'combined_rdkit_nBits': 1024, 'num_hidden_layers': 3, 'hidden_dim_0': 256, 'hidden_dim_1': 1024, 'hidden_dim_2': 128, 'kl_weight': 0.00029059907343026155, 'lr': 0.00896115260124611, 'batch_size': 128, 'dropout_rate': 0.13708913904529682, 'prior_mu': -0.01592415061620021, 'prior_sigma': 0.07414871419671076, 'normalization': 'layer'}. Best is trial 587 with value: 0.4552353322505951.
Generating morgan_rdkit fingerprints...
Generated fingerprints with 1280 features for 841 molecules
Trial 732: 5-fold CV loss = 0.5094
[I 2025-08-07 19:28:12,391] Trial 732 finished with value: 0.5093597769737244 and parameters: {'fp_type': 'morgan_rdkit', 'combined_morgan_radius': 3, 'combined_morgan_nBits': 1024, 'combined_rdkit_maxPath': 7, 'combined_rdkit_nBits': 256, 'num_hidden_layers': 3, 'hidden_dim_0': 256, 'hidden_dim_1': 1024, 'hidden_dim_2': 64, 'kl_weight': 0.0002848452387037043, 'lr': 0.00860846940873969, 'batch_size': 128, 'dropout_rate': 0.17672232972045812, 'prior_mu': -0.06934384143040609, 'prior_sigma': 0.11452753891631, 'normalization': 'layer'}. Best is trial 587 with value: 0.4552353322505951.
Generating morgan_rdkit fingerprints...
Generated fingerprints with 1536 features for 841 molecules
Trial 727: 5-fold CV loss = 0.4668
[I 2025-08-07 19:28:31,041] Trial 727 finished with value: 0.4668278396129608 and parameters: {'fp_type': 'morgan_rdkit', 'combined_morgan_radius': 3, 'combined_morgan_nBits': 1024, 'combined_rdkit_maxPath': 7, 'combined_rdkit_nBits': 1024, 'num_hidden_layers': 3, 'hidden_dim_0': 1024, 'hidden_dim_1': 64, 'hidden_dim_2': 64, 'kl_weight': 0.00038502858951561367, 'lr': 0.009890353346399525, 'batch_size': 128, 'dropout_rate': 0.1077949203519019, 'prior_mu': -0.04701615988434403, 'prior_sigma': 0.11634580460351893, 'normalization': 'layer'}. Best is trial 587 with value: 0.4552353322505951.
Generating morgan_rdkit fingerprints...
Generated fingerprints with 1536 features for 841 molecules
Trial 733: 5-fold CV loss = 0.5184
[I 2025-08-07 19:28:38,206] Trial 733 finished with value: 0.5183652818202973 and parameters: {'fp_type': 'morgan_rdkit', 'combined_morgan_radius': 3, 'combined_morgan_nBits': 1024, 'combined_rdkit_maxPath': 7, 'combined_rdkit_nBits': 256, 'num_hidden_layers': 3, 'hidden_dim_0': 256, 'hidden_dim_1': 1024, 'hidden_dim_2': 64, 'kl_weight': 0.0003193718589776339, 'lr': 0.008464202636442956, 'batch_size': 128, 'dropout_rate': 0.17250029666074668, 'prior_mu': -0.04157751482686283, 'prior_sigma': 0.12703812633071324, 'normalization': 'layer'}. Best is trial 587 with value: 0.4552353322505951.
Generating morgan_rdkit fingerprints...
Generated fingerprints with 2048 features for 841 molecules
Trial 734: 5-fold CV loss = 0.5124
[I 2025-08-07 19:28:46,371] Trial 734 finished with value: 0.5123816728591919 and parameters: {'fp_type': 'morgan_rdkit', 'combined_morgan_radius': 3, 'combined_morgan_nBits': 1024, 'combined_rdkit_maxPath': 7, 'combined_rdkit_nBits': 256, 'num_hidden_layers': 3, 'hidden_dim_0': 256, 'hidden_dim_1': 1024, 'hidden_dim_2': 64, 'kl_weight': 0.0003306971642457734, 'lr': 0.008485347725078618, 'batch_size': 128, 'dropout_rate': 0.16179880788621537, 'prior_mu': -0.04187452324515341, 'prior_sigma': 0.08393056272785018, 'normalization': 'layer'}. Best is trial 587 with value: 0.4552353322505951.
Generating morgan_rdkit fingerprints...
Generated fingerprints with 2048 features for 841 molecules
Trial 735: 5-fold CV loss = 0.4956
