[I 2025-08-08 01:50:43,140] Trial 2656 finished with value: 0.48588459491729735 and parameters: {'fp_type': 'morgan_rdkit', 'combined_morgan_radius': 3, 'combined_morgan_nBits': 1024, 'combined_rdkit_maxPath': 5, 'combined_rdkit_nBits': 1024, 'num_hidden_layers': 3, 'hidden_dim_0': 256, 'hidden_dim_1': 1024, 'hidden_dim_2': 64, 'kl_weight': 0.0003561687854064565, 'lr': 0.009003259780697428, 'batch_size': 128, 'dropout_rate': 0.07498134713965525, 'prior_mu': -0.020340573164749548, 'prior_sigma': 0.09259767091504206, 'normalization': 'layer'}. Best is trial 896 with value: 0.4533553242683411.
Generating morgan_rdkit fingerprints...
Generated fingerprints with 1280 features for 841 molecules
Trial 2657: 5-fold CV loss = 0.4856
[I 2025-08-08 01:51:06,838] Trial 2657 finished with value: 0.48561092019081115 and parameters: {'fp_type': 'morgan_rdkit', 'combined_morgan_radius': 3, 'combined_morgan_nBits': 1024, 'combined_rdkit_maxPath': 5, 'combined_rdkit_nBits': 1024, 'num_hidden_layers': 3, 'hidden_dim_0': 1024, 'hidden_dim_1': 1024, 'hidden_dim_2': 64, 'kl_weight': 0.00036184135501010845, 'lr': 0.006419895743235974, 'batch_size': 128, 'dropout_rate': 0.07323838210944046, 'prior_mu': -0.020695623590926665, 'prior_sigma': 0.08354796466873327, 'normalization': 'layer'}. Best is trial 896 with value: 0.4533553242683411.
Generating morgan_rdkit fingerprints...
Generated fingerprints with 1280 features for 841 molecules
Trial 2659: 5-fold CV loss = 0.5170
[I 2025-08-08 01:51:12,578] Trial 2659 finished with value: 0.5170110166072845 and parameters: {'fp_type': 'morgan_rdkit', 'combined_morgan_radius': 2, 'combined_morgan_nBits': 1024, 'combined_rdkit_maxPath': 7, 'combined_rdkit_nBits': 256, 'num_hidden_layers': 3, 'hidden_dim_0': 1024, 'hidden_dim_1': 1024, 'hidden_dim_2': 64, 'kl_weight': 0.00029708962022969757, 'lr': 0.006545495873929468, 'batch_size': 128, 'dropout_rate': 0.05752441209152301, 'prior_mu': -0.03473210330766095, 'prior_sigma': 0.08326043693346762, 'normalization': 'layer'}. Best is trial 896 with value: 0.4533553242683411.
Generating morgan_rdkit fingerprints...
Generated fingerprints with 2048 features for 841 molecules
Trial 2658: 5-fold CV loss = 0.4705
[I 2025-08-08 01:51:17,940] Trial 2658 finished with value: 0.470472127199173 and parameters: {'fp_type': 'morgan_rdkit', 'combined_morgan_radius': 2, 'combined_morgan_nBits': 1024, 'combined_rdkit_maxPath': 7, 'combined_rdkit_nBits': 1024, 'num_hidden_layers': 3, 'hidden_dim_0': 256, 'hidden_dim_1': 1024, 'hidden_dim_2': 64, 'kl_weight': 0.0003739608531909966, 'lr': 0.008400967667269851, 'batch_size': 128, 'dropout_rate': 0.07824797097983213, 'prior_mu': 0.013485488209695843, 'prior_sigma': 0.09168579206030801, 'normalization': 'layer'}. Best is trial 896 with value: 0.4533553242683411.
Generating morgan_rdkit fingerprints...
Generated fingerprints with 2048 features for 841 molecules
Trial 2655: 5-fold CV loss = 0.4667
[I 2025-08-08 01:51:33,420] Trial 2655 finished with value: 0.4666888236999512 and parameters: {'fp_type': 'morgan_rdkit', 'combined_morgan_radius': 3, 'combined_morgan_nBits': 1024, 'combined_rdkit_maxPath': 7, 'combined_rdkit_nBits': 1024, 'num_hidden_layers': 3, 'hidden_dim_0': 256, 'hidden_dim_1': 1024, 'hidden_dim_2': 64, 'kl_weight': 0.00037161737830867657, 'lr': 0.009213029675119512, 'batch_size': 128, 'dropout_rate': 0.07193274755499561, 'prior_mu': 0.0021690094555005127, 'prior_sigma': 0.09358378688088893, 'normalization': 'layer'}. Best is trial 896 with value: 0.4533553242683411.
Generating morgan_rdkit fingerprints...
Generated fingerprints with 2048 features for 841 molecules
Trial 2661: 5-fold CV loss = 0.4689
[I 2025-08-08 01:51:48,169] Trial 2661 finished with value: 0.4688772618770599 and parameters: {'fp_type': 'morgan_rdkit', 'combined_morgan_radius': 3, 'combined_morgan_nBits': 1024, 'combined_rdkit_maxPath': 7, 'combined_rdkit_nBits': 1024, 'num_hidden_layers': 3, 'hidden_dim_0': 256, 'hidden_dim_1': 1024, 'hidden_dim_2': 64, 'kl_weight': 0.0001296196293767577, 'lr': 0.008449150994450498, 'batch_size': 128, 'dropout_rate': 0.0856259241596238, 'prior_mu': 0.014007928282775044, 'prior_sigma': 0.09223651030222332, 'normalization': 'layer'}. Best is trial 896 with value: 0.4533553242683411.
Generating morgan_rdkit fingerprints...
Generated fingerprints with 2048 features for 841 molecules
Trial 2660: 5-fold CV loss = 0.5102
[I 2025-08-08 01:51:56,348] Trial 2660 finished with value: 0.5102153182029724 and parameters: {'fp_type': 'morgan_rdkit', 'combined_morgan_radius': 3, 'combined_morgan_nBits': 1024, 'combined_rdkit_maxPath': 7, 'combined_rdkit_nBits': 256, 'num_hidden_layers': 3, 'hidden_dim_0': 256, 'hidden_dim_1': 1024, 'hidden_dim_2': 64, 'kl_weight': 0.0002941505605734332, 'lr': 0.0064621921957886954, 'batch_size': 128, 'dropout_rate': 0.058602842977552264, 'prior_mu': -0.03600017796425964, 'prior_sigma': 0.0826453907951583, 'normalization': 'layer'}. Best is trial 896 with value: 0.4533553242683411.
Generating morgan_rdkit fingerprints...
Generated fingerprints with 2048 features for 841 molecules
Trial 2662: 5-fold CV loss = 0.6957
[I 2025-08-08 01:52:04,981] Trial 2662 finished with value: 0.6957392990589142 and parameters: {'fp_type': 'morgan_rdkit', 'combined_morgan_radius': 3, 'combined_morgan_nBits': 1024, 'combined_rdkit_maxPath': 7, 'combined_rdkit_nBits': 1024, 'num_hidden_layers': 3, 'hidden_dim_0': 256, 'hidden_dim_1': 1024, 'hidden_dim_2': 64, 'kl_weight': 0.00042746418418741864, 'lr': 0.008485949270528766, 'batch_size': 128, 'dropout_rate': 0.08961152289411067, 'prior_mu': -0.03155461146620518, 'prior_sigma': 0.10605295538867394, 'normalization': 'none'}. Best is trial 896 with value: 0.4533553242683411.
Generating morgan_rdkit fingerprints...
Generated fingerprints with 2048 features for 841 molecules
Trial 2665: 5-fold CV loss = 0.7860
[I 2025-08-08 01:52:17,166] Trial 2665 finished with value: 0.7860419869422912 and parameters: {'fp_type': 'morgan_rdkit', 'combined_morgan_radius': 3, 'combined_morgan_nBits': 1024, 'combined_rdkit_maxPath': 7, 'combined_rdkit_nBits': 1024, 'num_hidden_layers': 3, 'hidden_dim_0': 64, 'hidden_dim_1': 128, 'hidden_dim_2': 64, 'kl_weight': 0.0004582133498546699, 'lr': 0.0008871280743664215, 'batch_size': 128, 'dropout_rate': 0.09243542016095714, 'prior_mu': 0.03163591377362502, 'prior_sigma': 0.10192872672098154, 'normalization': 'none'}. Best is trial 896 with value: 0.4533553242683411.
Generating morgan_rdkit fingerprints...
Generated fingerprints with 2048 features for 841 molecules
Trial 2664: 5-fold CV loss = 0.5895
[I 2025-08-08 01:52:21,300] Trial 2664 finished with value: 0.5895189762115478 and parameters: {'fp_type': 'morgan_rdkit', 'combined_morgan_radius': 3, 'combined_morgan_nBits': 1024, 'combined_rdkit_maxPath': 7, 'combined_rdkit_nBits': 1024, 'num_hidden_layers': 3, 'hidden_dim_0': 64, 'hidden_dim_1': 128, 'hidden_dim_2': 512, 'kl_weight': 0.00029395072621661133, 'lr': 0.006883009710758284, 'batch_size': 128, 'dropout_rate': 0.08993814236396207, 'prior_mu': -0.03313866415902522, 'prior_sigma': 0.10135972798202462, 'normalization': 'none'}. Best is trial 896 with value: 0.4533553242683411.
Generating morgan_rdkit fingerprints...
Generated fingerprints with 2048 features for 841 molecules
Trial 2666: 5-fold CV loss = 0.8250
[I 2025-08-08 01:52:29,809] Trial 2666 finished with value: 0.8250115513801575 and parameters: {'fp_type': 'morgan_rdkit', 'combined_morgan_radius': 3, 'combined_morgan_nBits': 1024, 'combined_rdkit_maxPath': 7, 'combined_rdkit_nBits': 1024, 'num_hidden_layers': 3, 'hidden_dim_0': 64, 'hidden_dim_1': 256, 'hidden_dim_2': 512, 'kl_weight': 0.00018353347185418777, 'lr': 0.0070309103002816845, 'batch_size': 128, 'dropout_rate': 0.11473792127141261, 'prior_mu': 0.03548800131888027, 'prior_sigma': 0.10136557209467285, 'normalization': 'layer'}. Best is trial 896 with value: 0.4533553242683411.
Generating morgan_rdkit fingerprints...
Generated fingerprints with 2048 features for 841 molecules
Trial 2663: 5-fold CV loss = 0.7331
[I 2025-08-08 01:52:42,306] Trial 2663 finished with value: 0.7330573499202728 and parameters: {'fp_type': 'morgan_rdkit', 'combined_morgan_radius': 3, 'combined_morgan_nBits': 1024, 'combined_rdkit_maxPath': 7, 'combined_rdkit_nBits': 1024, 'num_hidden_layers': 3, 'hidden_dim_0': 64, 'hidden_dim_1': 1024, 'hidden_dim_2': 512, 'kl_weight': 0.00030042096881625826, 'lr': 0.008146125493211392, 'batch_size': 128, 'dropout_rate': 0.08914715804805576, 'prior_mu': -0.031236992887149047, 'prior_sigma': 0.10261043695397112, 'normalization': 'none'}. Best is trial 896 with value: 0.4533553242683411.
Generating morgan_rdkit fingerprints...
Generated fingerprints with 1536 features for 841 molecules
Trial 2668: 5-fold CV loss = 0.4662
[I 2025-08-08 01:53:08,702] Trial 2668 finished with value: 0.46615387201309205 and parameters: {'fp_type': 'morgan_rdkit', 'combined_morgan_radius': 3, 'combined_morgan_nBits': 1024, 'combined_rdkit_maxPath': 7, 'combined_rdkit_nBits': 1024, 'num_hidden_layers': 3, 'hidden_dim_0': 256, 'hidden_dim_1': 256, 'hidden_dim_2': 64, 'kl_weight': 0.00018994632028824607, 'lr': 0.009994923835281739, 'batch_size': 64, 'dropout_rate': 0.4187187324805678, 'prior_mu': -0.015624689267471514, 'prior_sigma': 0.07612225873257417, 'normalization': 'layer'}. Best is trial 896 with value: 0.4533553242683411.
Generating morgan_rdkit fingerprints...
Generated fingerprints with 1536 features for 841 molecules
Trial 2669: 5-fold CV loss = 0.4672
[I 2025-08-08 01:53:11,835] Trial 2669 finished with value: 0.46716758608818054 and parameters: {'fp_type': 'morgan_rdkit', 'combined_morgan_radius': 3, 'combined_morgan_nBits': 1024, 'combined_rdkit_maxPath': 7, 'combined_rdkit_nBits': 1024, 'num_hidden_layers': 3, 'hidden_dim_0': 256, 'hidden_dim_1': 1024, 'hidden_dim_2': 64, 'kl_weight': 0.0003307401762450816, 'lr': 0.007852188370446588, 'batch_size': 64, 'dropout_rate': 0.1271593596265364, 'prior_mu': -0.023819731276055252, 'prior_sigma': 0.07482864456917843, 'normalization': 'layer'}. Best is trial 896 with value: 0.4533553242683411.
Generating morgan_rdkit fingerprints...
Generated fingerprints with 1536 features for 841 molecules
Trial 2667: 5-fold CV loss = 0.5534
[I 2025-08-08 01:53:45,570] Trial 2667 finished with value: 0.5534014582633973 and parameters: {'fp_type': 'morgan_rdkit', 'combined_morgan_radius': 3, 'combined_morgan_nBits': 1024, 'combined_rdkit_maxPath': 7, 'combined_rdkit_nBits': 1024, 'num_hidden_layers': 3, 'hidden_dim_0': 256, 'hidden_dim_1': 256, 'hidden_dim_2': 512, 'kl_weight': 0.00018394415222572325, 'lr': 0.007224390958448918, 'batch_size': 64, 'dropout_rate': 0.12207776868962072, 'prior_mu': -0.06065199489404059, 'prior_sigma': 0.09854223958662357, 'normalization': 'layer'}. Best is trial 896 with value: 0.4533553242683411.
Generating morgan fingerprints...
Generated fingerprints with 2048 features for 841 molecules
Trial 2671: 5-fold CV loss = 0.4658
[I 2025-08-08 01:53:49,773] Trial 2671 finished with value: 0.46583319902420045 and parameters: {'fp_type': 'morgan_rdkit', 'combined_morgan_radius': 3, 'combined_morgan_nBits': 512, 'combined_rdkit_maxPath': 7, 'combined_rdkit_nBits': 1024, 'num_hidden_layers': 3, 'hidden_dim_0': 256, 'hidden_dim_1': 1024, 'hidden_dim_2': 64, 'kl_weight': 0.0002535738472967785, 'lr': 0.007455798080335418, 'batch_size': 128, 'dropout_rate': 0.12970181423699276, 'prior_mu': -0.04795118611954044, 'prior_sigma': 0.10906902257913352, 'normalization': 'layer'}. Best is trial 896 with value: 0.4533553242683411.
Generating morgan_rdkit fingerprints...
Generated fingerprints with 2048 features for 841 molecules
Trial 2672: 5-fold CV loss = 0.4601
[I 2025-08-08 01:54:01,474] Trial 2672 finished with value: 0.4600828647613525 and parameters: {'fp_type': 'morgan_rdkit', 'combined_morgan_radius': 3, 'combined_morgan_nBits': 512, 'combined_rdkit_maxPath': 7, 'combined_rdkit_nBits': 1024, 'num_hidden_layers': 3, 'hidden_dim_0': 256, 'hidden_dim_1': 1024, 'hidden_dim_2': 64, 'kl_weight': 0.0006445694957846332, 'lr': 0.006154191186142829, 'batch_size': 128, 'dropout_rate': 0.10439210588900838, 'prior_mu': -0.04342572009325855, 'prior_sigma': 0.0967809807832045, 'normalization': 'layer'}. Best is trial 896 with value: 0.4533553242683411.
Generating morgan fingerprints...
Generated fingerprints with 2048 features for 841 molecules
Trial 2673: 5-fold CV loss = 0.5216
[I 2025-08-08 01:54:15,895] Trial 2673 finished with value: 0.5216470181941986 and parameters: {'fp_type': 'morgan', 'morgan_only_radius': 3, 'morgan_only_nBits': 2048, 'num_hidden_layers': 3, 'hidden_dim_0': 256, 'hidden_dim_1': 1024, 'hidden_dim_2': 64, 'kl_weight': 0.00023790610250274086, 'lr': 0.006459480739558588, 'batch_size': 128, 'dropout_rate': 0.10786074048350194, 'prior_mu': -0.04406296763363868, 'prior_sigma': 0.10826093757519203, 'normalization': 'layer'}. Best is trial 896 with value: 0.4533553242683411.
Generating rdkit fingerprints...
Generated fingerprints with 256 features for 841 molecules
Trial 2674: 5-fold CV loss = 0.4769
[I 2025-08-08 01:54:34,796] Trial 2674 finished with value: 0.4769112288951874 and parameters: {'fp_type': 'morgan_rdkit', 'combined_morgan_radius': 3, 'combined_morgan_nBits': 1024, 'combined_rdkit_maxPath': 8, 'combined_rdkit_nBits': 1024, 'num_hidden_layers': 3, 'hidden_dim_0': 256, 'hidden_dim_1': 1024, 'hidden_dim_2': 64, 'kl_weight': 0.0001586635859297923, 'lr': 0.0061491123664306835, 'batch_size': 128, 'dropout_rate': 0.10099876466855373, 'prior_mu': -0.04535857742650403, 'prior_sigma': 0.08607923563371428, 'normalization': 'layer'}. Best is trial 896 with value: 0.4533553242683411.
Generating rdkit fingerprints...
Generated fingerprints with 256 features for 841 molecules
Trial 2670: 5-fold CV loss = 0.4646
[I 2025-08-08 01:54:45,476] Trial 2670 finished with value: 0.4645697593688965 and parameters: {'fp_type': 'morgan_rdkit', 'combined_morgan_radius': 3, 'combined_morgan_nBits': 512, 'combined_rdkit_maxPath': 7, 'combined_rdkit_nBits': 1024, 'num_hidden_layers': 3, 'hidden_dim_0': 256, 'hidden_dim_1': 1024, 'hidden_dim_2': 64, 'kl_weight': 0.00024814538107319087, 'lr': 0.007532051840665142, 'batch_size': 64, 'dropout_rate': 0.12433513379470248, 'prior_mu': -0.017133955042804055, 'prior_sigma': 0.07487854512216022, 'normalization': 'layer'}. Best is trial 896 with value: 0.4533553242683411.
Generating rdkit fingerprints...
Generated fingerprints with 256 features for 841 molecules
Trial 2675: 5-fold CV loss = 0.5112
[I 2025-08-08 01:54:52,177] Trial 2675 finished with value: 0.5112454473972321 and parameters: {'fp_type': 'morgan', 'morgan_only_radius': 3, 'morgan_only_nBits': 2048, 'num_hidden_layers': 3, 'hidden_dim_0': 256, 'hidden_dim_1': 1024, 'hidden_dim_2': 64, 'kl_weight': 0.000157875606747572, 'lr': 0.009290067523128664, 'batch_size': 32, 'dropout_rate': 0.0664324551604723, 'prior_mu': -0.023446494223536965, 'prior_sigma': 0.08616276700908156, 'normalization': 'layer'}. Best is trial 896 with value: 0.4533553242683411.
Generating rdkit fingerprints...
Generated fingerprints with 256 features for 841 molecules
Trial 2677: 5-fold CV loss = 0.8877
[I 2025-08-08 01:55:02,766] Trial 2677 finished with value: 0.8877101898193359 and parameters: {'fp_type': 'rdkit', 'rdkit_only_maxPath': 7, 'rdkit_only_nBits': 256, 'num_hidden_layers': 3, 'hidden_dim_0': 128, 'hidden_dim_1': 1024, 'hidden_dim_2': 64, 'kl_weight': 0.00040648264254181126, 'lr': 0.007954233869946047, 'batch_size': 32, 'dropout_rate': 0.06354259150465, 'prior_mu': -0.003898846506120929, 'prior_sigma': 0.08201284323149413, 'normalization': 'layer'}. Best is trial 896 with value: 0.4533553242683411.
Generating morgan_rdkit fingerprints...
Generated fingerprints with 2048 features for 841 molecules
Trial 2679: 5-fold CV loss = 0.8877
[I 2025-08-08 01:55:09,049] Trial 2679 finished with value: 0.8877036094665527 and parameters: {'fp_type': 'rdkit', 'rdkit_only_maxPath': 7, 'rdkit_only_nBits': 256, 'num_hidden_layers': 3, 'hidden_dim_0': 128, 'hidden_dim_1': 1024, 'hidden_dim_2': 64, 'kl_weight': 0.0004177854167366064, 'lr': 0.008320086463556168, 'batch_size': 128, 'dropout_rate': 0.11474180101706494, 'prior_mu': -0.002637018287972352, 'prior_sigma': 0.08002563027811452, 'normalization': 'layer'}. Best is trial 896 with value: 0.4533553242683411.
Generating morgan_rdkit fingerprints...
Generated fingerprints with 2048 features for 841 molecules
Trial 2680: 5-fold CV loss = 0.8975
[I 2025-08-08 01:55:18,118] Trial 2680 finished with value: 0.8975056290626526 and parameters: {'fp_type': 'morgan_rdkit', 'combined_morgan_radius': 3, 'combined_morgan_nBits': 1024, 'combined_rdkit_maxPath': 7, 'combined_rdkit_nBits': 1024, 'num_hidden_layers': 3, 'hidden_dim_0': 256, 'hidden_dim_1': 1024, 'hidden_dim_2': 1024, 'kl_weight': 0.01522627889094483, 'lr': 0.00917552687458836, 'batch_size': 128, 'dropout_rate': 0.11391016707698466, 'prior_mu': 0.006788025268195327, 'prior_sigma': 0.08098910798964333, 'normalization': 'layer'}. Best is trial 896 with value: 0.4533553242683411.
Generating morgan_rdkit fingerprints...
Generated fingerprints with 2048 features for 841 molecules
Trial 2681: 5-fold CV loss = 0.8897
[I 2025-08-08 01:55:25,879] Trial 2681 finished with value: 0.889730715751648 and parameters: {'fp_type': 'morgan_rdkit', 'combined_morgan_radius': 3, 'combined_morgan_nBits': 1024, 'combined_rdkit_maxPath': 7, 'combined_rdkit_nBits': 1024, 'num_hidden_layers': 3, 'hidden_dim_0': 256, 'hidden_dim_1': 1024, 'hidden_dim_2': 1024, 'kl_weight': 0.00011459458292126855, 'lr': 0.009106818932946223, 'batch_size': 128, 'dropout_rate': 0.08305871765489972, 'prior_mu': -0.01331597838545406, 'prior_sigma': 0.08951604636903883, 'normalization': 'layer'}. Best is trial 896 with value: 0.4533553242683411.
Generating morgan_rdkit fingerprints...
Generated fingerprints with 2048 features for 841 molecules
Trial 2682: 5-fold CV loss = 0.5537
[I 2025-08-08 01:55:57,415] Trial 2682 finished with value: 0.5536945939064026 and parameters: {'fp_type': 'morgan_rdkit', 'combined_morgan_radius': 3, 'combined_morgan_nBits': 1024, 'combined_rdkit_maxPath': 7, 'combined_rdkit_nBits': 1024, 'num_hidden_layers': 3, 'hidden_dim_0': 256, 'hidden_dim_1': 1024, 'hidden_dim_2': 256, 'kl_weight': 0.000503176671165377, 'lr': 0.007055580120070353, 'batch_size': 128, 'dropout_rate': 0.09701489511872936, 'prior_mu': -0.015305123828062747, 'prior_sigma': 0.08971382264815493, 'normalization': 'layer'}. Best is trial 896 with value: 0.4533553242683411.
Generating morgan_rdkit fingerprints...
Generated fingerprints with 2048 features for 841 molecules
Trial 2676: 5-fold CV loss = 0.8388
[I 2025-08-08 01:55:58,940] Trial 2676 finished with value: 0.8387789487838745 and parameters: {'fp_type': 'rdkit', 'rdkit_only_maxPath': 7, 'rdkit_only_nBits': 256, 'num_hidden_layers': 3, 'hidden_dim_0': 256, 'hidden_dim_1': 1024, 'hidden_dim_2': 64, 'kl_weight': 0.0004158917825962748, 'lr': 0.009277851148959215, 'batch_size': 32, 'dropout_rate': 0.06510334392916439, 'prior_mu': -0.003070839571246339, 'prior_sigma': 0.08575079625323856, 'normalization': 'layer'}. Best is trial 896 with value: 0.4533553242683411.
Generating morgan_rdkit fingerprints...
Generated fingerprints with 2048 features for 841 molecules
Trial 2683: 5-fold CV loss = 0.6307
[I 2025-08-08 01:56:08,501] Trial 2683 finished with value: 0.6307468831539154 and parameters: {'fp_type': 'morgan_rdkit', 'combined_morgan_radius': 3, 'combined_morgan_nBits': 1024, 'combined_rdkit_maxPath': 7, 'combined_rdkit_nBits': 1024, 'num_hidden_layers': 3, 'hidden_dim_0': 256, 'hidden_dim_1': 1024, 'hidden_dim_2': 256, 'kl_weight': 0.0004935117468918116, 'lr': 0.007063850037264461, 'batch_size': 128, 'dropout_rate': 0.09839607975363925, 'prior_mu': -0.027719937379994584, 'prior_sigma': 0.11817323810475762, 'normalization': 'layer'}. Best is trial 896 with value: 0.4533553242683411.
Generating morgan_rdkit fingerprints...
Generated fingerprints with 2048 features for 841 molecules
Trial 2684: 5-fold CV loss = 0.4727
[I 2025-08-08 01:56:31,437] Trial 2684 finished with value: 0.4727072477340698 and parameters: {'fp_type': 'morgan_rdkit', 'combined_morgan_radius': 3, 'combined_morgan_nBits': 1024, 'combined_rdkit_maxPath': 7, 'combined_rdkit_nBits': 1024, 'num_hidden_layers': 3, 'hidden_dim_0': 256, 'hidden_dim_1': 1024, 'hidden_dim_2': 64, 'kl_weight': 0.00032258963011217313, 'lr': 0.008123832541994277, 'batch_size': 128, 'dropout_rate': 0.08027125061004604, 'prior_mu': -0.05934649584958232, 'prior_sigma': 0.0713647207937035, 'normalization': 'layer'}. Best is trial 896 with value: 0.4533553242683411.
Generating morgan_rdkit fingerprints...
Generated fingerprints with 2048 features for 841 molecules
Trial 2685: 5-fold CV loss = 0.4653
[I 2025-08-08 01:56:48,830] Trial 2685 finished with value: 0.46533400416374204 and parameters: {'fp_type': 'morgan_rdkit', 'combined_morgan_radius': 3, 'combined_morgan_nBits': 1024, 'combined_rdkit_maxPath': 7, 'combined_rdkit_nBits': 1024, 'num_hidden_layers': 3, 'hidden_dim_0': 256, 'hidden_dim_1': 1024, 'hidden_dim_2': 64, 'kl_weight': 0.00031215257402291037, 'lr': 0.008069533703184056, 'batch_size': 128, 'dropout_rate': 0.07972996066110592, 'prior_mu': -0.025805350928472998, 'prior_sigma': 0.09493854958263531, 'normalization': 'layer'}. Best is trial 896 with value: 0.4533553242683411.
Generating morgan_rdkit fingerprints...
Generated fingerprints with 2048 features for 841 molecules
Trial 2686: 5-fold CV loss = 0.4667
