[I 2025-08-08 00:29:49,899] Trial 2263 finished with value: 0.7312214791774749 and parameters: {'fp_type': 'morgan_rdkit', 'combined_morgan_radius': 3, 'combined_morgan_nBits': 1024, 'combined_rdkit_maxPath': 7, 'combined_rdkit_nBits': 1024, 'num_hidden_layers': 3, 'hidden_dim_0': 256, 'hidden_dim_1': 1024, 'hidden_dim_2': 512, 'kl_weight': 0.00013553954564536023, 'lr': 0.00990103279087336, 'batch_size': 128, 'dropout_rate': 0.07498696094682564, 'prior_mu': -0.05256253770874247, 'prior_sigma': 0.11749816488608193, 'normalization': 'layer'}. Best is trial 896 with value: 0.4533553242683411.
Generating morgan_rdkit fingerprints...
Generated fingerprints with 2048 features for 841 molecules
Trial 2266: 5-fold CV loss = 0.7925
[I 2025-08-08 00:29:58,660] Trial 2266 finished with value: 0.7925333023071289 and parameters: {'fp_type': 'rdkit', 'rdkit_only_maxPath': 7, 'rdkit_only_nBits': 512, 'num_hidden_layers': 3, 'hidden_dim_0': 256, 'hidden_dim_1': 128, 'hidden_dim_2': 64, 'kl_weight': 0.00022189149403045453, 'lr': 0.009092984401356913, 'batch_size': 128, 'dropout_rate': 0.07553256620752896, 'prior_mu': -0.050516257875322004, 'prior_sigma': 0.1114036589504893, 'normalization': 'layer'}. Best is trial 896 with value: 0.4533553242683411.
Generating morgan_rdkit fingerprints...
Generated fingerprints with 2048 features for 841 molecules
Trial 2267: 5-fold CV loss = 0.4837
[I 2025-08-08 00:30:03,214] Trial 2267 finished with value: 0.4836733520030975 and parameters: {'fp_type': 'morgan_rdkit', 'combined_morgan_radius': 3, 'combined_morgan_nBits': 1024, 'combined_rdkit_maxPath': 7, 'combined_rdkit_nBits': 1024, 'num_hidden_layers': 3, 'hidden_dim_0': 256, 'hidden_dim_1': 1024, 'hidden_dim_2': 64, 'kl_weight': 0.00012470309969446562, 'lr': 0.009799268612892374, 'batch_size': 128, 'dropout_rate': 0.08874137060393383, 'prior_mu': -0.07646978712274292, 'prior_sigma': 0.11414483797362755, 'normalization': 'layer'}. Best is trial 896 with value: 0.4533553242683411.
Generating morgan_rdkit fingerprints...
Generated fingerprints with 2048 features for 841 molecules
Trial 2268: 5-fold CV loss = 0.4753
[I 2025-08-08 00:30:35,178] Trial 2268 finished with value: 0.47533198595047 and parameters: {'fp_type': 'morgan_rdkit', 'combined_morgan_radius': 3, 'combined_morgan_nBits': 1024, 'combined_rdkit_maxPath': 7, 'combined_rdkit_nBits': 1024, 'num_hidden_layers': 3, 'hidden_dim_0': 256, 'hidden_dim_1': 128, 'hidden_dim_2': 64, 'kl_weight': 0.0001895239426345718, 'lr': 0.00921237020096101, 'batch_size': 128, 'dropout_rate': 0.08377962966909808, 'prior_mu': -0.046363200404708184, 'prior_sigma': 0.1130060394471691, 'normalization': 'layer'}. Best is trial 896 with value: 0.4533553242683411.
Generating morgan_rdkit fingerprints...
Generated fingerprints with 2048 features for 841 molecules
Trial 2271: 5-fold CV loss = 0.4714
[I 2025-08-08 00:30:38,788] Trial 2271 finished with value: 0.4714237332344055 and parameters: {'fp_type': 'morgan_rdkit', 'combined_morgan_radius': 2, 'combined_morgan_nBits': 1024, 'combined_rdkit_maxPath': 7, 'combined_rdkit_nBits': 1024, 'num_hidden_layers': 3, 'hidden_dim_0': 256, 'hidden_dim_1': 1024, 'hidden_dim_2': 64, 'kl_weight': 0.00020070328969157777, 'lr': 0.008807873398590795, 'batch_size': 128, 'dropout_rate': 0.06651599154763006, 'prior_mu': -0.0637774585630008, 'prior_sigma': 0.10287689546287002, 'normalization': 'layer'}. Best is trial 896 with value: 0.4533553242683411.
Generating morgan_rdkit fingerprints...
Generated fingerprints with 2048 features for 841 molecules
Trial 2270: 5-fold CV loss = 0.4788
[I 2025-08-08 00:30:56,008] Trial 2270 finished with value: 0.4787704825401306 and parameters: {'fp_type': 'morgan_rdkit', 'combined_morgan_radius': 2, 'combined_morgan_nBits': 1024, 'combined_rdkit_maxPath': 7, 'combined_rdkit_nBits': 1024, 'num_hidden_layers': 3, 'hidden_dim_0': 256, 'hidden_dim_1': 1024, 'hidden_dim_2': 64, 'kl_weight': 0.00014764425913617156, 'lr': 0.009167490023342877, 'batch_size': 128, 'dropout_rate': 0.08255394416946717, 'prior_mu': -0.0771368421650932, 'prior_sigma': 0.10653711375918026, 'normalization': 'layer'}. Best is trial 896 with value: 0.4533553242683411.
Generating morgan_rdkit fingerprints...
Generated fingerprints with 2048 features for 841 molecules
Trial 2272: 5-fold CV loss = 0.7226
[I 2025-08-08 00:31:04,238] Trial 2272 finished with value: 0.7226244747638703 and parameters: {'fp_type': 'morgan_rdkit', 'combined_morgan_radius': 2, 'combined_morgan_nBits': 1024, 'combined_rdkit_maxPath': 7, 'combined_rdkit_nBits': 1024, 'num_hidden_layers': 3, 'hidden_dim_0': 256, 'hidden_dim_1': 1024, 'hidden_dim_2': 128, 'kl_weight': 0.0001664204051333067, 'lr': 0.008907909852251277, 'batch_size': 128, 'dropout_rate': 0.03742451647296112, 'prior_mu': -0.06219410309971927, 'prior_sigma': 0.12079674831194404, 'normalization': 'layer'}. Best is trial 896 with value: 0.4533553242683411.
Generating morgan_rdkit fingerprints...
Generated fingerprints with 2048 features for 841 molecules
Trial 2269: 5-fold CV loss = 0.5460
[I 2025-08-08 00:31:20,453] Trial 2269 finished with value: 0.5459725439548493 and parameters: {'fp_type': 'morgan_rdkit', 'combined_morgan_radius': 2, 'combined_morgan_nBits': 1024, 'combined_rdkit_maxPath': 7, 'combined_rdkit_nBits': 1024, 'num_hidden_layers': 3, 'hidden_dim_0': 256, 'hidden_dim_1': 128, 'hidden_dim_2': 64, 'kl_weight': 0.0001364801431288191, 'lr': 0.009115584123807806, 'batch_size': 128, 'dropout_rate': 0.03705174247680443, 'prior_mu': 0.14242080050238934, 'prior_sigma': 0.11094696597625597, 'normalization': 'layer'}. Best is trial 896 with value: 0.4533553242683411.
Generating morgan_rdkit fingerprints...
Generated fingerprints with 2048 features for 841 molecules
Trial 2273: 5-fold CV loss = 0.4721
[I 2025-08-08 00:31:27,186] Trial 2273 finished with value: 0.4720866918563843 and parameters: {'fp_type': 'morgan_rdkit', 'combined_morgan_radius': 3, 'combined_morgan_nBits': 1024, 'combined_rdkit_maxPath': 7, 'combined_rdkit_nBits': 1024, 'num_hidden_layers': 3, 'hidden_dim_0': 256, 'hidden_dim_1': 1024, 'hidden_dim_2': 128, 'kl_weight': 0.00016614713429180568, 'lr': 0.008607873863894147, 'batch_size': 128, 'dropout_rate': 0.048635655916258964, 'prior_mu': -0.06000581982271294, 'prior_sigma': 0.11346733258192884, 'normalization': 'layer'}. Best is trial 896 with value: 0.4533553242683411.
Generating morgan_rdkit fingerprints...
Generated fingerprints with 1280 features for 841 molecules
Trial 2277: 5-fold CV loss = 0.6943
[I 2025-08-08 00:31:46,716] Trial 2277 finished with value: 0.6943177461624146 and parameters: {'fp_type': 'morgan_rdkit', 'combined_morgan_radius': 3, 'combined_morgan_nBits': 1024, 'combined_rdkit_maxPath': 7, 'combined_rdkit_nBits': 256, 'num_hidden_layers': 3, 'hidden_dim_0': 256, 'hidden_dim_1': 1024, 'hidden_dim_2': 64, 'kl_weight': 0.00019007262550540567, 'lr': 0.009973982792777484, 'batch_size': 128, 'dropout_rate': 0.07887747700714026, 'prior_mu': -0.04594237262844284, 'prior_sigma': 0.12037116821971502, 'normalization': 'layer'}. Best is trial 896 with value: 0.4533553242683411.
Generating morgan_rdkit fingerprints...
Generated fingerprints with 2048 features for 841 molecules
Trial 2275: 5-fold CV loss = 0.4653
[I 2025-08-08 00:31:50,131] Trial 2275 finished with value: 0.4653208315372467 and parameters: {'fp_type': 'morgan_rdkit', 'combined_morgan_radius': 3, 'combined_morgan_nBits': 1024, 'combined_rdkit_maxPath': 7, 'combined_rdkit_nBits': 1024, 'num_hidden_layers': 3, 'hidden_dim_0': 256, 'hidden_dim_1': 1024, 'hidden_dim_2': 64, 'kl_weight': 0.00020472405637020368, 'lr': 0.009932036961534945, 'batch_size': 128, 'dropout_rate': 0.0730343830516016, 'prior_mu': -0.1992224351862546, 'prior_sigma': 0.1153225267424367, 'normalization': 'layer'}. Best is trial 896 with value: 0.4533553242683411.
Generating morgan_rdkit fingerprints...
Generated fingerprints with 2048 features for 841 molecules
Trial 2274: 5-fold CV loss = 0.4738
[I 2025-08-08 00:32:10,963] Trial 2274 finished with value: 0.47380952835083007 and parameters: {'fp_type': 'morgan_rdkit', 'combined_morgan_radius': 3, 'combined_morgan_nBits': 1024, 'combined_rdkit_maxPath': 7, 'combined_rdkit_nBits': 1024, 'num_hidden_layers': 3, 'hidden_dim_0': 256, 'hidden_dim_1': 1024, 'hidden_dim_2': 128, 'kl_weight': 0.00013751091643242214, 'lr': 0.008595871171797624, 'batch_size': 128, 'dropout_rate': 0.0752218289674349, 'prior_mu': -0.058873297048591525, 'prior_sigma': 0.12010734549204176, 'normalization': 'layer'}. Best is trial 896 with value: 0.4533553242683411.
Generating morgan_rdkit fingerprints...
Generated fingerprints with 2048 features for 841 molecules
Trial 2278: 5-fold CV loss = 0.4668
[I 2025-08-08 00:32:27,106] Trial 2278 finished with value: 0.466789311170578 and parameters: {'fp_type': 'morgan_rdkit', 'combined_morgan_radius': 3, 'combined_morgan_nBits': 1024, 'combined_rdkit_maxPath': 7, 'combined_rdkit_nBits': 1024, 'num_hidden_layers': 3, 'hidden_dim_0': 256, 'hidden_dim_1': 1024, 'hidden_dim_2': 64, 'kl_weight': 0.00019631379312699275, 'lr': 0.008512215345262296, 'batch_size': 128, 'dropout_rate': 0.06814171111100768, 'prior_mu': -0.05641621635780656, 'prior_sigma': 0.11236404303357901, 'normalization': 'layer'}. Best is trial 896 with value: 0.4533553242683411.
Generating morgan_rdkit fingerprints...
Generated fingerprints with 1536 features for 841 molecules
Trial 2279: 5-fold CV loss = 0.5788
[I 2025-08-08 00:32:32,133] Trial 2279 finished with value: 0.578750878572464 and parameters: {'fp_type': 'morgan_rdkit', 'combined_morgan_radius': 3, 'combined_morgan_nBits': 1024, 'combined_rdkit_maxPath': 8, 'combined_rdkit_nBits': 1024, 'num_hidden_layers': 3, 'hidden_dim_0': 256, 'hidden_dim_1': 1024, 'hidden_dim_2': 64, 'kl_weight': 0.00015605748216760215, 'lr': 0.009922501407136682, 'batch_size': 128, 'dropout_rate': 0.09258276119109851, 'prior_mu': 0.02114765868692177, 'prior_sigma': 0.12423885533505112, 'normalization': 'layer'}. Best is trial 896 with value: 0.4533553242683411.
Generating morgan_rdkit fingerprints...
Generated fingerprints with 1536 features for 841 molecules
Trial 2276: 5-fold CV loss = 0.4671
[I 2025-08-08 00:33:01,043] Trial 2276 finished with value: 0.46707006692886355 and parameters: {'fp_type': 'morgan_rdkit', 'combined_morgan_radius': 3, 'combined_morgan_nBits': 1024, 'combined_rdkit_maxPath': 7, 'combined_rdkit_nBits': 1024, 'num_hidden_layers': 3, 'hidden_dim_0': 256, 'hidden_dim_1': 1024, 'hidden_dim_2': 64, 'kl_weight': 0.00018634622714697042, 'lr': 0.008442732204324075, 'batch_size': 128, 'dropout_rate': 0.06666955098068379, 'prior_mu': -0.04775823577897881, 'prior_sigma': 0.1167209880529547, 'normalization': 'layer'}. Best is trial 896 with value: 0.4533553242683411.
Generating morgan_rdkit fingerprints...
Generated fingerprints with 1536 features for 841 molecules
Trial 2281: 5-fold CV loss = 0.6546
[I 2025-08-08 00:33:04,278] Trial 2281 finished with value: 0.6545756340026856 and parameters: {'fp_type': 'morgan_rdkit', 'combined_morgan_radius': 3, 'combined_morgan_nBits': 512, 'combined_rdkit_maxPath': 7, 'combined_rdkit_nBits': 1024, 'num_hidden_layers': 3, 'hidden_dim_0': 128, 'hidden_dim_1': 1024, 'hidden_dim_2': 256, 'kl_weight': 0.00014767527938082313, 'lr': 0.008482321538629786, 'batch_size': 128, 'dropout_rate': 0.09262181736691984, 'prior_mu': -0.04531179481145069, 'prior_sigma': 0.10855035475335105, 'normalization': 'layer'}. Best is trial 896 with value: 0.4533553242683411.
Generating morgan_rdkit fingerprints...
Generated fingerprints with 2048 features for 841 molecules
Trial 2282: 5-fold CV loss = 0.6287
[I 2025-08-08 00:33:11,769] Trial 2282 finished with value: 0.6286883294582367 and parameters: {'fp_type': 'morgan_rdkit', 'combined_morgan_radius': 3, 'combined_morgan_nBits': 512, 'combined_rdkit_maxPath': 7, 'combined_rdkit_nBits': 1024, 'num_hidden_layers': 3, 'hidden_dim_0': 128, 'hidden_dim_1': 1024, 'hidden_dim_2': 256, 'kl_weight': 0.00019275388297025433, 'lr': 0.009972997186823901, 'batch_size': 128, 'dropout_rate': 0.09147353715436607, 'prior_mu': -0.04704291194719724, 'prior_sigma': 0.10931104954227572, 'normalization': 'layer'}. Best is trial 896 with value: 0.4533553242683411.
Generating morgan_rdkit fingerprints...
Generated fingerprints with 2048 features for 841 molecules
Trial 2280: 5-fold CV loss = 0.4716
[I 2025-08-08 00:33:27,533] Trial 2280 finished with value: 0.47160564661026 and parameters: {'fp_type': 'morgan_rdkit', 'combined_morgan_radius': 3, 'combined_morgan_nBits': 1024, 'combined_rdkit_maxPath': 8, 'combined_rdkit_nBits': 1024, 'num_hidden_layers': 3, 'hidden_dim_0': 256, 'hidden_dim_1': 1024, 'hidden_dim_2': 64, 'kl_weight': 0.00019398216648682055, 'lr': 0.008424770557663943, 'batch_size': 128, 'dropout_rate': 0.0930643425456585, 'prior_mu': -0.05146613771421406, 'prior_sigma': 0.10672805775024555, 'normalization': 'layer'}. Best is trial 896 with value: 0.4533553242683411.
Generating morgan_rdkit fingerprints...
Generated fingerprints with 2048 features for 841 molecules
Trial 2284: 5-fold CV loss = 0.4733
[I 2025-08-08 00:33:40,702] Trial 2284 finished with value: 0.4732786238193512 and parameters: {'fp_type': 'morgan_rdkit', 'combined_morgan_radius': 3, 'combined_morgan_nBits': 1024, 'combined_rdkit_maxPath': 7, 'combined_rdkit_nBits': 1024, 'num_hidden_layers': 3, 'hidden_dim_0': 1024, 'hidden_dim_1': 1024, 'hidden_dim_2': 64, 'kl_weight': 0.00019982473508258557, 'lr': 0.008965893745488217, 'batch_size': 128, 'dropout_rate': 0.08805920660046043, 'prior_mu': -0.0492667280024109, 'prior_sigma': 0.10693788732708667, 'normalization': 'layer'}. Best is trial 896 with value: 0.4533553242683411.
Generating morgan_rdkit fingerprints...
Generated fingerprints with 2048 features for 841 molecules
Trial 2283: 5-fold CV loss = 0.5127
[I 2025-08-08 00:33:56,810] Trial 2283 finished with value: 0.5127447068691253 and parameters: {'fp_type': 'morgan_rdkit', 'combined_morgan_radius': 3, 'combined_morgan_nBits': 512, 'combined_rdkit_maxPath': 7, 'combined_rdkit_nBits': 1024, 'num_hidden_layers': 1, 'hidden_dim_0': 128, 'kl_weight': 0.0002012529363551508, 'lr': 0.009868686534769234, 'batch_size': 128, 'dropout_rate': 0.08658900221062217, 'prior_mu': -0.04275329995766523, 'prior_sigma': 0.1115003053507661, 'normalization': 'layer'}. Best is trial 896 with value: 0.4533553242683411.
Generating morgan_rdkit fingerprints...
Generated fingerprints with 2048 features for 841 molecules
Trial 2285: 5-fold CV loss = 0.4649
[I 2025-08-08 00:34:00,703] Trial 2285 finished with value: 0.4648639321327209 and parameters: {'fp_type': 'morgan_rdkit', 'combined_morgan_radius': 3, 'combined_morgan_nBits': 1024, 'combined_rdkit_maxPath': 7, 'combined_rdkit_nBits': 1024, 'num_hidden_layers': 3, 'hidden_dim_0': 1024, 'hidden_dim_1': 1024, 'hidden_dim_2': 64, 'kl_weight': 0.00019882647301696136, 'lr': 0.008285738837627763, 'batch_size': 128, 'dropout_rate': 0.08265356526860612, 'prior_mu': -0.04257251980517479, 'prior_sigma': 0.10384769411296757, 'normalization': 'layer'}. Best is trial 896 with value: 0.4533553242683411.
Generating morgan_rdkit fingerprints...
Generated fingerprints with 2048 features for 841 molecules
Trial 2286: 5-fold CV loss = 0.4671
[I 2025-08-08 00:34:17,251] Trial 2286 finished with value: 0.46708256006240845 and parameters: {'fp_type': 'morgan_rdkit', 'combined_morgan_radius': 3, 'combined_morgan_nBits': 1024, 'combined_rdkit_maxPath': 7, 'combined_rdkit_nBits': 1024, 'num_hidden_layers': 3, 'hidden_dim_0': 1024, 'hidden_dim_1': 1024, 'hidden_dim_2': 64, 'kl_weight': 0.00017513752878328022, 'lr': 0.009996349199626744, 'batch_size': 128, 'dropout_rate': 0.08335643784150554, 'prior_mu': -0.04157713212996843, 'prior_sigma': 0.1115518601506506, 'normalization': 'layer'}. Best is trial 896 with value: 0.4533553242683411.
Generating morgan_rdkit fingerprints...
Generated fingerprints with 2048 features for 841 molecules
Trial 2287: 5-fold CV loss = 0.4693
[I 2025-08-08 00:34:18,862] Trial 2287 finished with value: 0.4693490147590637 and parameters: {'fp_type': 'morgan_rdkit', 'combined_morgan_radius': 3, 'combined_morgan_nBits': 1024, 'combined_rdkit_maxPath': 7, 'combined_rdkit_nBits': 1024, 'num_hidden_layers': 3, 'hidden_dim_0': 256, 'hidden_dim_1': 1024, 'hidden_dim_2': 64, 'kl_weight': 0.00016370108268567654, 'lr': 0.008092471926828482, 'batch_size': 128, 'dropout_rate': 0.08281057033011564, 'prior_mu': -0.043035470033152175, 'prior_sigma': 0.10195836385384642, 'normalization': 'layer'}. Best is trial 896 with value: 0.4533553242683411.
Generating morgan_rdkit fingerprints...
Generated fingerprints with 2048 features for 841 molecules
Trial 2289: 5-fold CV loss = 0.5729
[I 2025-08-08 00:34:36,096] Trial 2289 finished with value: 0.57287118434906 and parameters: {'fp_type': 'morgan_rdkit', 'combined_morgan_radius': 3, 'combined_morgan_nBits': 1024, 'combined_rdkit_maxPath': 5, 'combined_rdkit_nBits': 1024, 'num_hidden_layers': 3, 'hidden_dim_0': 256, 'hidden_dim_1': 1024, 'hidden_dim_2': 64, 'kl_weight': 0.00017121840018704705, 'lr': 0.008030290911987155, 'batch_size': 128, 'dropout_rate': 0.06010269436477466, 'prior_mu': -0.04127281842021426, 'prior_sigma': 0.10527452806566479, 'normalization': 'none'}. Best is trial 896 with value: 0.4533553242683411.
Generating morgan_rdkit fingerprints...
Generated fingerprints with 2048 features for 841 molecules
Trial 2288: 5-fold CV loss = 0.6591
[I 2025-08-08 00:34:44,283] Trial 2288 finished with value: 0.6591007113456726 and parameters: {'fp_type': 'morgan_rdkit', 'combined_morgan_radius': 3, 'combined_morgan_nBits': 1024, 'combined_rdkit_maxPath': 5, 'combined_rdkit_nBits': 1024, 'num_hidden_layers': 3, 'hidden_dim_0': 256, 'hidden_dim_1': 1024, 'hidden_dim_2': 64, 'kl_weight': 0.00016550925580456895, 'lr': 0.008081408955794052, 'batch_size': 128, 'dropout_rate': 0.061357743945349597, 'prior_mu': -0.043558410625261626, 'prior_sigma': 0.10246409611160741, 'normalization': 'none'}. Best is trial 896 with value: 0.4533553242683411.
Generating morgan_rdkit fingerprints...
Generated fingerprints with 2048 features for 841 molecules
Trial 2291: 5-fold CV loss = 0.9050
[I 2025-08-08 00:34:45,658] Trial 2291 finished with value: 0.9050002872943879 and parameters: {'fp_type': 'morgan_rdkit', 'combined_morgan_radius': 3, 'combined_morgan_nBits': 1024, 'combined_rdkit_maxPath': 7, 'combined_rdkit_nBits': 1024, 'num_hidden_layers': 3, 'hidden_dim_0': 256, 'hidden_dim_1': 1024, 'hidden_dim_2': 64, 'kl_weight': 0.00013311288635745478, 'lr': 0.008952488537533299, 'batch_size': 128, 'dropout_rate': 0.059499447921235134, 'prior_mu': -0.0542566479682191, 'prior_sigma': 0.10557877226381819, 'normalization': 'none'}. Best is trial 896 with value: 0.4533553242683411.
Generating morgan_rdkit fingerprints...
Generated fingerprints with 2048 features for 841 molecules
Trial 2290: 5-fold CV loss = 0.7885
[I 2025-08-08 00:34:55,779] Trial 2290 finished with value: 0.7884899258613587 and parameters: {'fp_type': 'morgan_rdkit', 'combined_morgan_radius': 3, 'combined_morgan_nBits': 1024, 'combined_rdkit_maxPath': 7, 'combined_rdkit_nBits': 1024, 'num_hidden_layers': 3, 'hidden_dim_0': 256, 'hidden_dim_1': 1024, 'hidden_dim_2': 64, 'kl_weight': 0.00021368546037330168, 'lr': 0.009966576707311476, 'batch_size': 128, 'dropout_rate': 0.05722016447398717, 'prior_mu': -0.04169231224495656, 'prior_sigma': 0.11375496187978673, 'normalization': 'none'}. Best is trial 896 with value: 0.4533553242683411.
Generating morgan_rdkit fingerprints...
Generated fingerprints with 2048 features for 841 molecules
Trial 2292: 5-fold CV loss = 0.4629
[I 2025-08-08 00:35:17,491] Trial 2292 finished with value: 0.4629055857658386 and parameters: {'fp_type': 'morgan_rdkit', 'combined_morgan_radius': 3, 'combined_morgan_nBits': 1024, 'combined_rdkit_maxPath': 7, 'combined_rdkit_nBits': 1024, 'num_hidden_layers': 3, 'hidden_dim_0': 256, 'hidden_dim_1': 1024, 'hidden_dim_2': 64, 'kl_weight': 0.0001274690850575957, 'lr': 0.009956350482635597, 'batch_size': 128, 'dropout_rate': 0.10103593260745665, 'prior_mu': -0.05453341171323728, 'prior_sigma': 0.10442533162023362, 'normalization': 'layer'}. Best is trial 896 with value: 0.4533553242683411.
Generating morgan_rdkit fingerprints...
Generated fingerprints with 2048 features for 841 molecules
Trial 2294: 5-fold CV loss = 0.4688
[I 2025-08-08 00:35:27,833] Trial 2294 finished with value: 0.46878520846366883 and parameters: {'fp_type': 'morgan_rdkit', 'combined_morgan_radius': 3, 'combined_morgan_nBits': 1024, 'combined_rdkit_maxPath': 7, 'combined_rdkit_nBits': 1024, 'num_hidden_layers': 3, 'hidden_dim_0': 256, 'hidden_dim_1': 1024, 'hidden_dim_2': 64, 'kl_weight': 0.0002237893514943409, 'lr': 0.009052082897197746, 'batch_size': 64, 'dropout_rate': 0.10188868220884495, 'prior_mu': -0.06085366452728803, 'prior_sigma': 0.09897564570028117, 'normalization': 'layer'}. Best is trial 896 with value: 0.4533553242683411.
Generating morgan_rdkit fingerprints...
Generated fingerprints with 2048 features for 841 molecules
Trial 2293: 5-fold CV loss = 0.8635
[I 2025-08-08 00:35:51,502] Trial 2293 finished with value: 0.8634641289710998 and parameters: {'fp_type': 'morgan_rdkit', 'combined_morgan_radius': 3, 'combined_morgan_nBits': 1024, 'combined_rdkit_maxPath': 7, 'combined_rdkit_nBits': 1024, 'num_hidden_layers': 3, 'hidden_dim_0': 256, 'hidden_dim_1': 1024, 'hidden_dim_2': 64, 'kl_weight': 0.0002091081102654508, 'lr': 0.0007516454581905826, 'batch_size': 64, 'dropout_rate': 0.10534553268614891, 'prior_mu': -0.05966981505732663, 'prior_sigma': 0.11509909483462606, 'normalization': 'layer'}. Best is trial 896 with value: 0.4533553242683411.
Generating morgan_rdkit fingerprints...
Generated fingerprints with 2048 features for 841 molecules
Trial 2297: 5-fold CV loss = 0.5630
