[I 2025-08-07 17:30:04,130] Trial 281 finished with value: 0.4909534275531769 and parameters: {'fp_type': 'morgan_rdkit', 'combined_morgan_radius': 2, 'combined_morgan_nBits': 512, 'combined_rdkit_maxPath': 5, 'combined_rdkit_nBits': 1024, 'num_hidden_layers': 2, 'hidden_dim_0': 64, 'hidden_dim_1': 1024, 'kl_weight': 0.00010195518875096745, 'lr': 0.0019920728480954334, 'batch_size': 32, 'dropout_rate': 0.39122283594747376, 'prior_mu': 0.0517105808614066, 'prior_sigma': 0.022081935549370865, 'normalization': 'layer'}. Best is trial 179 with value: 0.4671938598155975.
Generating morgan_rdkit fingerprints...
Generated fingerprints with 1536 features for 841 molecules
Trial 280: 5-fold CV loss = 0.4828
[I 2025-08-07 17:30:07,784] Trial 280 finished with value: 0.4827557742595673 and parameters: {'fp_type': 'morgan_rdkit', 'combined_morgan_radius': 2, 'combined_morgan_nBits': 512, 'combined_rdkit_maxPath': 7, 'combined_rdkit_nBits': 1024, 'num_hidden_layers': 2, 'hidden_dim_0': 64, 'hidden_dim_1': 1024, 'kl_weight': 0.00010008768256688926, 'lr': 0.0027576262538108426, 'batch_size': 32, 'dropout_rate': 0.28250151215011265, 'prior_mu': 0.01968580900046149, 'prior_sigma': 0.022517467229800824, 'normalization': 'layer'}. Best is trial 179 with value: 0.4671938598155975.
Generating morgan_rdkit fingerprints...
Generated fingerprints with 1536 features for 841 molecules
Trial 284: 5-fold CV loss = 0.5648
[I 2025-08-07 17:30:56,113] Trial 284 finished with value: 0.5647533655166626 and parameters: {'fp_type': 'morgan_rdkit', 'combined_morgan_radius': 2, 'combined_morgan_nBits': 512, 'combined_rdkit_maxPath': 7, 'combined_rdkit_nBits': 1024, 'num_hidden_layers': 2, 'hidden_dim_0': 512, 'hidden_dim_1': 512, 'kl_weight': 0.0607385453727574, 'lr': 0.0016764117918892155, 'batch_size': 32, 'dropout_rate': 0.2816277012013873, 'prior_mu': 0.01507188185827344, 'prior_sigma': 0.01755510036330117, 'normalization': 'layer'}. Best is trial 179 with value: 0.4671938598155975.
Generating morgan_rdkit fingerprints...
Generated fingerprints with 1536 features for 841 molecules
Trial 285: 5-fold CV loss = 0.4746
[I 2025-08-07 17:31:01,234] Trial 285 finished with value: 0.47460017800331117 and parameters: {'fp_type': 'morgan_rdkit', 'combined_morgan_radius': 2, 'combined_morgan_nBits': 512, 'combined_rdkit_maxPath': 7, 'combined_rdkit_nBits': 1024, 'num_hidden_layers': 2, 'hidden_dim_0': 512, 'hidden_dim_1': 512, 'kl_weight': 0.00010008627837802203, 'lr': 0.0019851301072071753, 'batch_size': 32, 'dropout_rate': 0.28005188363565736, 'prior_mu': 0.06018319489930048, 'prior_sigma': 0.01701952434202947, 'normalization': 'layer'}. Best is trial 179 with value: 0.4671938598155975.
Generating morgan_rdkit fingerprints...
Generated fingerprints with 1536 features for 841 molecules
Trial 283: 5-fold CV loss = 0.4939
[I 2025-08-07 17:31:10,424] Trial 283 finished with value: 0.4938915252685547 and parameters: {'fp_type': 'morgan_rdkit', 'combined_morgan_radius': 2, 'combined_morgan_nBits': 512, 'combined_rdkit_maxPath': 5, 'combined_rdkit_nBits': 1024, 'num_hidden_layers': 2, 'hidden_dim_0': 512, 'hidden_dim_1': 1024, 'kl_weight': 0.00010978019358973418, 'lr': 0.001955039262154802, 'batch_size': 32, 'dropout_rate': 0.2825979252556898, 'prior_mu': 0.05686101433615396, 'prior_sigma': 0.010059950192257592, 'normalization': 'layer'}. Best is trial 179 with value: 0.4671938598155975.
Generating morgan_rdkit fingerprints...
Generated fingerprints with 1536 features for 841 molecules
Trial 287: 5-fold CV loss = 0.4823
[I 2025-08-07 17:31:42,912] Trial 287 finished with value: 0.4823138117790222 and parameters: {'fp_type': 'morgan_rdkit', 'combined_morgan_radius': 2, 'combined_morgan_nBits': 512, 'combined_rdkit_maxPath': 7, 'combined_rdkit_nBits': 1024, 'num_hidden_layers': 2, 'hidden_dim_0': 512, 'hidden_dim_1': 256, 'kl_weight': 0.00011227158765120794, 'lr': 0.0018811623592786346, 'batch_size': 32, 'dropout_rate': 0.27474348483413963, 'prior_mu': 0.05844143105120841, 'prior_sigma': 0.010608486128846545, 'normalization': 'layer'}. Best is trial 179 with value: 0.4671938598155975.
Generating morgan_rdkit fingerprints...
Generated fingerprints with 1536 features for 841 molecules
Trial 286: 5-fold CV loss = 0.4777
[I 2025-08-07 17:32:00,602] Trial 286 finished with value: 0.4777020335197449 and parameters: {'fp_type': 'morgan_rdkit', 'combined_morgan_radius': 2, 'combined_morgan_nBits': 512, 'combined_rdkit_maxPath': 7, 'combined_rdkit_nBits': 1024, 'num_hidden_layers': 2, 'hidden_dim_0': 512, 'hidden_dim_1': 512, 'kl_weight': 0.0001133059696990129, 'lr': 0.0019394664981695244, 'batch_size': 32, 'dropout_rate': 0.2783507518453955, 'prior_mu': 0.05999429844843935, 'prior_sigma': 0.03362288925456564, 'normalization': 'layer'}. Best is trial 179 with value: 0.4671938598155975.
Generating morgan_rdkit fingerprints...
Generated fingerprints with 1536 features for 841 molecules
Trial 282: 5-fold CV loss = 0.4857
[I 2025-08-07 17:32:07,616] Trial 282 finished with value: 0.48565136194229125 and parameters: {'fp_type': 'morgan_rdkit', 'combined_morgan_radius': 2, 'combined_morgan_nBits': 512, 'combined_rdkit_maxPath': 5, 'combined_rdkit_nBits': 1024, 'num_hidden_layers': 2, 'hidden_dim_0': 512, 'hidden_dim_1': 512, 'kl_weight': 0.00010118278707531834, 'lr': 0.001903790545248478, 'batch_size': 32, 'dropout_rate': 0.28353266684525147, 'prior_mu': 0.019233931554550446, 'prior_sigma': 0.022129124978153315, 'normalization': 'layer'}. Best is trial 179 with value: 0.4671938598155975.
Generating morgan_rdkit fingerprints...
Generated fingerprints with 1536 features for 841 molecules
Trial 289: 5-fold CV loss = 0.4806
[I 2025-08-07 17:32:28,577] Trial 289 finished with value: 0.48064051270484925 and parameters: {'fp_type': 'morgan_rdkit', 'combined_morgan_radius': 2, 'combined_morgan_nBits': 512, 'combined_rdkit_maxPath': 7, 'combined_rdkit_nBits': 1024, 'num_hidden_layers': 2, 'hidden_dim_0': 512, 'hidden_dim_1': 512, 'kl_weight': 0.00012515529179903164, 'lr': 0.002068972693413583, 'batch_size': 32, 'dropout_rate': 0.2703168167022596, 'prior_mu': 0.06523294860569309, 'prior_sigma': 0.01590038903779383, 'normalization': 'layer'}. Best is trial 179 with value: 0.4671938598155975.
Generating morgan_rdkit fingerprints...
Generated fingerprints with 1536 features for 841 molecules
Trial 288: 5-fold CV loss = 0.4768
[I 2025-08-07 17:32:30,341] Trial 288 finished with value: 0.4768302202224731 and parameters: {'fp_type': 'morgan_rdkit', 'combined_morgan_radius': 2, 'combined_morgan_nBits': 512, 'combined_rdkit_maxPath': 7, 'combined_rdkit_nBits': 1024, 'num_hidden_layers': 2, 'hidden_dim_0': 512, 'hidden_dim_1': 512, 'kl_weight': 0.00011378980762481367, 'lr': 0.0018903251536251256, 'batch_size': 32, 'dropout_rate': 0.27223088406785256, 'prior_mu': 0.05775419899927318, 'prior_sigma': 0.015563278655675774, 'normalization': 'layer'}. Best is trial 179 with value: 0.4671938598155975.
Generating morgan_rdkit fingerprints...
Generated fingerprints with 768 features for 841 molecules
Trial 290: 5-fold CV loss = 0.4759
[I 2025-08-07 17:33:04,224] Trial 290 finished with value: 0.47588154673576355 and parameters: {'fp_type': 'morgan_rdkit', 'combined_morgan_radius': 2, 'combined_morgan_nBits': 512, 'combined_rdkit_maxPath': 7, 'combined_rdkit_nBits': 1024, 'num_hidden_layers': 2, 'hidden_dim_0': 512, 'hidden_dim_1': 512, 'kl_weight': 0.00010006924670439199, 'lr': 0.002119172048231739, 'batch_size': 32, 'dropout_rate': 0.2694949764065971, 'prior_mu': 0.06294468735749474, 'prior_sigma': 0.016193732663767318, 'normalization': 'layer'}. Best is trial 179 with value: 0.4671938598155975.
Generating morgan_rdkit fingerprints...
Generated fingerprints with 768 features for 841 molecules
Trial 292: 5-fold CV loss = 0.4952
[I 2025-08-07 17:33:27,898] Trial 292 finished with value: 0.49521070122718813 and parameters: {'fp_type': 'morgan_rdkit', 'combined_morgan_radius': 2, 'combined_morgan_nBits': 512, 'combined_rdkit_maxPath': 8, 'combined_rdkit_nBits': 1024, 'num_hidden_layers': 2, 'hidden_dim_0': 512, 'hidden_dim_1': 512, 'kl_weight': 0.00012847518596768772, 'lr': 0.002231738093076231, 'batch_size': 32, 'dropout_rate': 0.2948777758514305, 'prior_mu': 0.0655874976788039, 'prior_sigma': 0.016206955378265553, 'normalization': 'layer'}. Best is trial 179 with value: 0.4671938598155975.
Generating rdkit fingerprints...
Generated fingerprints with 1024 features for 841 molecules
Trial 293: 5-fold CV loss = 0.5300
[I 2025-08-07 17:33:40,350] Trial 293 finished with value: 0.529955530166626 and parameters: {'fp_type': 'morgan_rdkit', 'combined_morgan_radius': 2, 'combined_morgan_nBits': 512, 'combined_rdkit_maxPath': 7, 'combined_rdkit_nBits': 256, 'num_hidden_layers': 2, 'hidden_dim_0': 64, 'hidden_dim_1': 512, 'kl_weight': 0.0001307297894012067, 'lr': 0.0017159927324522026, 'batch_size': 32, 'dropout_rate': 0.2971904298701606, 'prior_mu': 0.050172608093337, 'prior_sigma': 0.020240827647294787, 'normalization': 'layer'}. Best is trial 179 with value: 0.4671938598155975.
Generating rdkit fingerprints...
Generated fingerprints with 1024 features for 841 molecules
Trial 294: 5-fold CV loss = 0.5263
[I 2025-08-07 17:33:57,495] Trial 294 finished with value: 0.5263153493404389 and parameters: {'fp_type': 'morgan_rdkit', 'combined_morgan_radius': 2, 'combined_morgan_nBits': 512, 'combined_rdkit_maxPath': 7, 'combined_rdkit_nBits': 256, 'num_hidden_layers': 2, 'hidden_dim_0': 64, 'hidden_dim_1': 512, 'kl_weight': 0.00012820148843269028, 'lr': 0.0022803926686704484, 'batch_size': 32, 'dropout_rate': 0.2911115450604127, 'prior_mu': 0.050138407893973384, 'prior_sigma': 0.020947158899659868, 'normalization': 'layer'}. Best is trial 179 with value: 0.4671938598155975.
Generating rdkit fingerprints...
Generated fingerprints with 1024 features for 841 molecules
Trial 295: 5-fold CV loss = 0.5006
[I 2025-08-07 17:34:14,337] Trial 295 finished with value: 0.5005866348743438 and parameters: {'fp_type': 'rdkit', 'rdkit_only_maxPath': 5, 'rdkit_only_nBits': 1024, 'num_hidden_layers': 2, 'hidden_dim_0': 64, 'hidden_dim_1': 512, 'kl_weight': 0.00012874530789465133, 'lr': 0.0016165819140543012, 'batch_size': 32, 'dropout_rate': 0.26251916330468833, 'prior_mu': 0.04933657151985623, 'prior_sigma': 0.020071833110945726, 'normalization': 'layer'}. Best is trial 179 with value: 0.4671938598155975.
Generating morgan_rdkit fingerprints...
Generated fingerprints with 1536 features for 841 molecules
Trial 291: 5-fold CV loss = 0.4826
[I 2025-08-07 17:34:23,202] Trial 291 finished with value: 0.4825659036636353 and parameters: {'fp_type': 'morgan_rdkit', 'combined_morgan_radius': 2, 'combined_morgan_nBits': 512, 'combined_rdkit_maxPath': 7, 'combined_rdkit_nBits': 1024, 'num_hidden_layers': 2, 'hidden_dim_0': 512, 'hidden_dim_1': 512, 'kl_weight': 0.00012702464627570336, 'lr': 0.00223099367281625, 'batch_size': 32, 'dropout_rate': 0.2709806791429553, 'prior_mu': 0.06831378198027302, 'prior_sigma': 0.015255827618944779, 'normalization': 'layer'}. Best is trial 179 with value: 0.4671938598155975.
Generating morgan_rdkit fingerprints...
Generated fingerprints with 1536 features for 841 molecules
Trial 297: 5-fold CV loss = 0.5025
[I 2025-08-07 17:34:54,990] Trial 297 finished with value: 0.5025358915328979 and parameters: {'fp_type': 'rdkit', 'rdkit_only_maxPath': 5, 'rdkit_only_nBits': 1024, 'num_hidden_layers': 2, 'hidden_dim_0': 512, 'hidden_dim_1': 512, 'kl_weight': 0.00010068584869232352, 'lr': 0.002548503534997284, 'batch_size': 32, 'dropout_rate': 0.2625716186523131, 'prior_mu': 0.07242024905716025, 'prior_sigma': 0.029430567605742367, 'normalization': 'layer'}. Best is trial 179 with value: 0.4671938598155975.
Generating morgan_rdkit fingerprints...
Generated fingerprints with 1536 features for 841 molecules
Trial 296: 5-fold CV loss = 0.5045
[I 2025-08-07 17:35:06,734] Trial 296 finished with value: 0.5045097649097443 and parameters: {'fp_type': 'rdkit', 'rdkit_only_maxPath': 5, 'rdkit_only_nBits': 1024, 'num_hidden_layers': 2, 'hidden_dim_0': 64, 'hidden_dim_1': 512, 'kl_weight': 0.00012273886961728568, 'lr': 0.0024630793255756922, 'batch_size': 32, 'dropout_rate': 0.3127650533917114, 'prior_mu': 0.03133942772429937, 'prior_sigma': 0.03082150931740771, 'normalization': 'layer'}. Best is trial 179 with value: 0.4671938598155975.
Generating morgan_rdkit fingerprints...
Generated fingerprints with 1536 features for 841 molecules
Trial 298: 5-fold CV loss = 0.4798
[I 2025-08-07 17:35:11,443] Trial 298 finished with value: 0.4798082530498505 and parameters: {'fp_type': 'morgan_rdkit', 'combined_morgan_radius': 2, 'combined_morgan_nBits': 512, 'combined_rdkit_maxPath': 7, 'combined_rdkit_nBits': 1024, 'num_hidden_layers': 2, 'hidden_dim_0': 512, 'hidden_dim_1': 512, 'kl_weight': 0.00011934049914870594, 'lr': 0.0025590082574782104, 'batch_size': 32, 'dropout_rate': 0.31586050443169134, 'prior_mu': 0.033787628952910806, 'prior_sigma': 0.029251466102682675, 'normalization': 'layer'}. Best is trial 179 with value: 0.4671938598155975.
Generating morgan_rdkit fingerprints...
Generated fingerprints with 2048 features for 841 molecules
Trial 300: 5-fold CV loss = 0.4801
[I 2025-08-07 17:36:11,349] Trial 300 finished with value: 0.48006941080093385 and parameters: {'fp_type': 'morgan_rdkit', 'combined_morgan_radius': 2, 'combined_morgan_nBits': 512, 'combined_rdkit_maxPath': 7, 'combined_rdkit_nBits': 1024, 'num_hidden_layers': 2, 'hidden_dim_0': 64, 'hidden_dim_1': 512, 'kl_weight': 0.00011200937851293025, 'lr': 0.0014048039790243792, 'batch_size': 32, 'dropout_rate': 0.2509232442545722, 'prior_mu': 0.008316618589667289, 'prior_sigma': 0.02508901112719699, 'normalization': 'layer'}. Best is trial 179 with value: 0.4671938598155975.
Generating morgan_rdkit fingerprints...
Generated fingerprints with 2048 features for 841 molecules
Trial 301: 5-fold CV loss = 0.4887
[I 2025-08-07 17:36:40,908] Trial 301 finished with value: 0.4887476086616516 and parameters: {'fp_type': 'morgan_rdkit', 'combined_morgan_radius': 3, 'combined_morgan_nBits': 512, 'combined_rdkit_maxPath': 7, 'combined_rdkit_nBits': 1024, 'num_hidden_layers': 2, 'hidden_dim_0': 64, 'hidden_dim_1': 512, 'kl_weight': 0.0027364817872611493, 'lr': 0.0014632522765918683, 'batch_size': 32, 'dropout_rate': 0.24840745680163692, 'prior_mu': 0.03661149863211218, 'prior_sigma': 0.024319488056027905, 'normalization': 'layer'}. Best is trial 179 with value: 0.4671938598155975.
Generating morgan_rdkit fingerprints...
Generated fingerprints with 2048 features for 841 molecules
Trial 302: 5-fold CV loss = 0.4886
[I 2025-08-07 17:37:05,865] Trial 302 finished with value: 0.4885578155517578 and parameters: {'fp_type': 'morgan_rdkit', 'combined_morgan_radius': 3, 'combined_morgan_nBits': 1024, 'combined_rdkit_maxPath': 7, 'combined_rdkit_nBits': 1024, 'num_hidden_layers': 2, 'hidden_dim_0': 64, 'hidden_dim_1': 512, 'kl_weight': 0.00011377901367001635, 'lr': 0.0013851261171542873, 'batch_size': 32, 'dropout_rate': 0.21311953030998387, 'prior_mu': 0.011375938771541496, 'prior_sigma': 0.09859364267182036, 'normalization': 'layer'}. Best is trial 179 with value: 0.4671938598155975.
Generating morgan_rdkit fingerprints...
Generated fingerprints with 1536 features for 841 molecules
Trial 299: 5-fold CV loss = 0.4722
[I 2025-08-07 17:37:17,908] Trial 299 finished with value: 0.47223901748657227 and parameters: {'fp_type': 'morgan_rdkit', 'combined_morgan_radius': 3, 'combined_morgan_nBits': 512, 'combined_rdkit_maxPath': 7, 'combined_rdkit_nBits': 1024, 'num_hidden_layers': 2, 'hidden_dim_0': 64, 'hidden_dim_1': 512, 'kl_weight': 0.00010146922377256513, 'lr': 0.002532207814042101, 'batch_size': 32, 'dropout_rate': 0.31477702393198426, 'prior_mu': 0.03393932211339197, 'prior_sigma': 0.029828442605370056, 'normalization': 'layer'}. Best is trial 179 with value: 0.4671938598155975.
Generating morgan_rdkit fingerprints...
Generated fingerprints with 1536 features for 841 molecules
Trial 303: 5-fold CV loss = 0.4853
[I 2025-08-07 17:37:32,180] Trial 303 finished with value: 0.48534610867500305 and parameters: {'fp_type': 'morgan_rdkit', 'combined_morgan_radius': 3, 'combined_morgan_nBits': 1024, 'combined_rdkit_maxPath': 7, 'combined_rdkit_nBits': 1024, 'num_hidden_layers': 2, 'hidden_dim_0': 64, 'hidden_dim_1': 512, 'kl_weight': 0.00011415298051749389, 'lr': 0.0006955166804805231, 'batch_size': 32, 'dropout_rate': 0.2804580719666337, 'prior_mu': 0.03912671862186139, 'prior_sigma': 0.036264316171756225, 'normalization': 'layer'}. Best is trial 179 with value: 0.4671938598155975.
Generating morgan_rdkit fingerprints...
Generated fingerprints with 1536 features for 841 molecules
Trial 305: 5-fold CV loss = 0.4750
[I 2025-08-07 17:38:14,494] Trial 305 finished with value: 0.47499420046806334 and parameters: {'fp_type': 'morgan_rdkit', 'combined_morgan_radius': 2, 'combined_morgan_nBits': 512, 'combined_rdkit_maxPath': 7, 'combined_rdkit_nBits': 1024, 'num_hidden_layers': 2, 'hidden_dim_0': 64, 'hidden_dim_1': 512, 'kl_weight': 0.00010068218199428127, 'lr': 0.0008794139285409822, 'batch_size': 32, 'dropout_rate': 0.28300159810212505, 'prior_mu': 0.05648193837744659, 'prior_sigma': 0.022633610065974037, 'normalization': 'layer'}. Best is trial 179 with value: 0.4671938598155975.
Generating morgan_rdkit fingerprints...
Generated fingerprints with 1536 features for 841 molecules
Trial 304: 5-fold CV loss = 0.4729
[I 2025-08-07 17:38:18,229] Trial 304 finished with value: 0.4729273319244385 and parameters: {'fp_type': 'morgan_rdkit', 'combined_morgan_radius': 2, 'combined_morgan_nBits': 1024, 'combined_rdkit_maxPath': 7, 'combined_rdkit_nBits': 1024, 'num_hidden_layers': 2, 'hidden_dim_0': 64, 'hidden_dim_1': 512, 'kl_weight': 0.00010160394671659648, 'lr': 0.0009343404108165051, 'batch_size': 32, 'dropout_rate': 0.2120773223826001, 'prior_mu': 0.05597530362033361, 'prior_sigma': 0.03429947464700514, 'normalization': 'layer'}. Best is trial 179 with value: 0.4671938598155975.
Generating morgan_rdkit fingerprints...
Generated fingerprints with 2048 features for 841 molecules
Trial 307: 5-fold CV loss = 0.4856
[I 2025-08-07 17:38:42,138] Trial 307 finished with value: 0.4855936050415039 and parameters: {'fp_type': 'morgan_rdkit', 'combined_morgan_radius': 3, 'combined_morgan_nBits': 512, 'combined_rdkit_maxPath': 7, 'combined_rdkit_nBits': 1024, 'num_hidden_layers': 2, 'hidden_dim_0': 64, 'hidden_dim_1': 64, 'kl_weight': 0.0017369653755159432, 'lr': 0.0027200947186397494, 'batch_size': 32, 'dropout_rate': 0.3053666332241738, 'prior_mu': 0.02737537753530358, 'prior_sigma': 0.033932636334384245, 'normalization': 'layer'}. Best is trial 179 with value: 0.4671938598155975.
Generating morgan_rdkit fingerprints...
Generated fingerprints with 2048 features for 841 molecules
Trial 308: 5-fold CV loss = 0.4796
[I 2025-08-07 17:38:57,416] Trial 308 finished with value: 0.47960605621337893 and parameters: {'fp_type': 'morgan_rdkit', 'combined_morgan_radius': 3, 'combined_morgan_nBits': 512, 'combined_rdkit_maxPath': 7, 'combined_rdkit_nBits': 1024, 'num_hidden_layers': 2, 'hidden_dim_0': 64, 'hidden_dim_1': 512, 'kl_weight': 0.00014242425431537967, 'lr': 0.0027004213799514246, 'batch_size': 64, 'dropout_rate': 0.342119236348338, 'prior_mu': 0.04694077477104927, 'prior_sigma': 0.041312457048231874, 'normalization': 'layer'}. Best is trial 179 with value: 0.4671938598155975.
Generating morgan_rdkit fingerprints...
Generated fingerprints with 2048 features for 841 molecules
Trial 306: 5-fold CV loss = 0.4763
[I 2025-08-07 17:39:01,420] Trial 306 finished with value: 0.4762809216976166 and parameters: {'fp_type': 'morgan_rdkit', 'combined_morgan_radius': 3, 'combined_morgan_nBits': 512, 'combined_rdkit_maxPath': 7, 'combined_rdkit_nBits': 1024, 'num_hidden_layers': 2, 'hidden_dim_0': 64, 'hidden_dim_1': 512, 'kl_weight': 0.0001442880779898515, 'lr': 0.0028244928465319765, 'batch_size': 64, 'dropout_rate': 0.3263564030449087, 'prior_mu': 0.027971610453806323, 'prior_sigma': 0.038431473766137994, 'normalization': 'layer'}. Best is trial 179 with value: 0.4671938598155975.
Generating morgan_rdkit fingerprints...
Generated fingerprints with 2048 features for 841 molecules
Trial 309: 5-fold CV loss = 0.5429
[I 2025-08-07 17:39:29,440] Trial 309 finished with value: 0.5428950846195221 and parameters: {'fp_type': 'morgan_rdkit', 'combined_morgan_radius': 3, 'combined_morgan_nBits': 1024, 'combined_rdkit_maxPath': 7, 'combined_rdkit_nBits': 1024, 'num_hidden_layers': 2, 'hidden_dim_0': 64, 'hidden_dim_1': 512, 'kl_weight': 0.03555058794503753, 'lr': 0.000805011368753559, 'batch_size': 64, 'dropout_rate': 0.3061258683200989, 'prior_mu': 0.06551011381841448, 'prior_sigma': 0.04197300726039962, 'normalization': 'layer'}. Best is trial 179 with value: 0.4671938598155975.
Generating morgan_rdkit fingerprints...
Generated fingerprints with 2048 features for 841 molecules
Trial 311: 5-fold CV loss = 0.4807
[I 2025-08-07 17:40:01,923] Trial 311 finished with value: 0.4806807577610016 and parameters: {'fp_type': 'morgan_rdkit', 'combined_morgan_radius': 3, 'combined_morgan_nBits': 1024, 'combined_rdkit_maxPath': 7, 'combined_rdkit_nBits': 1024, 'num_hidden_layers': 2, 'hidden_dim_0': 64, 'hidden_dim_1': 512, 'kl_weight': 0.000167180087540074, 'lr': 0.0008377633254834531, 'batch_size': 32, 'dropout_rate': 0.2621685855524689, 'prior_mu': 0.06524409154531793, 'prior_sigma': 0.037600028004455575, 'normalization': 'layer'}. Best is trial 179 with value: 0.4671938598155975.
Generating morgan_rdkit fingerprints...
Generated fingerprints with 2048 features for 841 molecules
Trial 310: 5-fold CV loss = 0.4815
