[I 2025-08-07 22:54:30,070] Trial 1785 finished with value: 0.5553971588611603 and parameters: {'fp_type': 'morgan_rdkit', 'combined_morgan_radius': 3, 'combined_morgan_nBits': 1024, 'combined_rdkit_maxPath': 7, 'combined_rdkit_nBits': 1024, 'num_hidden_layers': 3, 'hidden_dim_0': 256, 'hidden_dim_1': 1024, 'hidden_dim_2': 64, 'kl_weight': 0.00028302119519021143, 'lr': 0.006821074683225014, 'batch_size': 128, 'dropout_rate': 0.47664013860856247, 'prior_mu': -0.04474095043192446, 'prior_sigma': 0.07159326604272251, 'normalization': 'none'}. Best is trial 896 with value: 0.4533553242683411.
Generating morgan_rdkit fingerprints...
Generated fingerprints with 2048 features for 841 molecules
Trial 1787: 5-fold CV loss = 0.4609
[I 2025-08-07 22:55:01,021] Trial 1787 finished with value: 0.4608971118927002 and parameters: {'fp_type': 'morgan_rdkit', 'combined_morgan_radius': 3, 'combined_morgan_nBits': 1024, 'combined_rdkit_maxPath': 7, 'combined_rdkit_nBits': 1024, 'num_hidden_layers': 3, 'hidden_dim_0': 256, 'hidden_dim_1': 1024, 'hidden_dim_2': 64, 'kl_weight': 0.0002367252533996498, 'lr': 0.006914008227341784, 'batch_size': 128, 'dropout_rate': 0.19131483560763024, 'prior_mu': -0.043065523718384825, 'prior_sigma': 0.09027091829522359, 'normalization': 'layer'}. Best is trial 896 with value: 0.4533553242683411.
Generating morgan_rdkit fingerprints...
Generated fingerprints with 2048 features for 841 molecules
Trial 1789: 5-fold CV loss = 0.4673
[I 2025-08-07 22:55:07,579] Trial 1789 finished with value: 0.46734774112701416 and parameters: {'fp_type': 'morgan_rdkit', 'combined_morgan_radius': 3, 'combined_morgan_nBits': 1024, 'combined_rdkit_maxPath': 7, 'combined_rdkit_nBits': 1024, 'num_hidden_layers': 3, 'hidden_dim_0': 256, 'hidden_dim_1': 1024, 'hidden_dim_2': 64, 'kl_weight': 0.0002452086672061873, 'lr': 0.006766126148158908, 'batch_size': 128, 'dropout_rate': 0.13429494673816356, 'prior_mu': -0.0346417823206174, 'prior_sigma': 0.09110778069294388, 'normalization': 'layer'}. Best is trial 896 with value: 0.4533553242683411.
Generating morgan_rdkit fingerprints...
Generated fingerprints with 2048 features for 841 molecules
Trial 1788: 5-fold CV loss = 0.4672
[I 2025-08-07 22:55:16,735] Trial 1788 finished with value: 0.4672479689121246 and parameters: {'fp_type': 'morgan_rdkit', 'combined_morgan_radius': 3, 'combined_morgan_nBits': 1024, 'combined_rdkit_maxPath': 7, 'combined_rdkit_nBits': 1024, 'num_hidden_layers': 3, 'hidden_dim_0': 256, 'hidden_dim_1': 1024, 'hidden_dim_2': 64, 'kl_weight': 0.00024832016431637903, 'lr': 0.006805883825546012, 'batch_size': 128, 'dropout_rate': 0.13748568356893284, 'prior_mu': -0.04330255356118976, 'prior_sigma': 0.0918632781782262, 'normalization': 'layer'}. Best is trial 896 with value: 0.4533553242683411.
Generating morgan_rdkit fingerprints...
Generated fingerprints with 1536 features for 841 molecules
Trial 1790: 5-fold CV loss = 0.6340
[I 2025-08-07 22:55:30,029] Trial 1790 finished with value: 0.6339992463588715 and parameters: {'fp_type': 'morgan_rdkit', 'combined_morgan_radius': 3, 'combined_morgan_nBits': 1024, 'combined_rdkit_maxPath': 7, 'combined_rdkit_nBits': 1024, 'num_hidden_layers': 3, 'hidden_dim_0': 256, 'hidden_dim_1': 128, 'hidden_dim_2': 64, 'kl_weight': 0.00035086316688521775, 'lr': 0.00789952669116913, 'batch_size': 128, 'dropout_rate': 0.13437055474052423, 'prior_mu': -0.03560655269622728, 'prior_sigma': 0.09243403758692191, 'normalization': 'layer'}. Best is trial 896 with value: 0.4533553242683411.
Generating morgan_rdkit fingerprints...
Generated fingerprints with 1536 features for 841 molecules
Trial 1791: 5-fold CV loss = 0.6439
[I 2025-08-07 22:55:36,215] Trial 1791 finished with value: 0.6439374029636383 and parameters: {'fp_type': 'morgan_rdkit', 'combined_morgan_radius': 3, 'combined_morgan_nBits': 1024, 'combined_rdkit_maxPath': 7, 'combined_rdkit_nBits': 1024, 'num_hidden_layers': 3, 'hidden_dim_0': 256, 'hidden_dim_1': 128, 'hidden_dim_2': 64, 'kl_weight': 0.00035306650030745705, 'lr': 0.00787173549086135, 'batch_size': 128, 'dropout_rate': 0.11160096061330704, 'prior_mu': -0.01993103807627602, 'prior_sigma': 0.07852626313941534, 'normalization': 'layer'}. Best is trial 896 with value: 0.4533553242683411.
Generating morgan_rdkit fingerprints...
Generated fingerprints with 1536 features for 841 molecules
Trial 1786: 5-fold CV loss = 0.4628
[I 2025-08-07 22:55:47,813] Trial 1786 finished with value: 0.46277551651000975 and parameters: {'fp_type': 'morgan_rdkit', 'combined_morgan_radius': 3, 'combined_morgan_nBits': 1024, 'combined_rdkit_maxPath': 7, 'combined_rdkit_nBits': 1024, 'num_hidden_layers': 3, 'hidden_dim_0': 256, 'hidden_dim_1': 1024, 'hidden_dim_2': 64, 'kl_weight': 0.0002931133279258713, 'lr': 0.009981507098568484, 'batch_size': 128, 'dropout_rate': 0.21733173481003942, 'prior_mu': -0.04426831773781238, 'prior_sigma': 0.0923514978727371, 'normalization': 'layer'}. Best is trial 896 with value: 0.4533553242683411.
Generating morgan_rdkit fingerprints...
Generated fingerprints with 1536 features for 841 molecules
Trial 1794: 5-fold CV loss = 0.8905
[I 2025-08-07 22:55:52,494] Trial 1794 finished with value: 0.8905009388923645 and parameters: {'fp_type': 'morgan_rdkit', 'combined_morgan_radius': 3, 'combined_morgan_nBits': 1024, 'combined_rdkit_maxPath': 7, 'combined_rdkit_nBits': 512, 'num_hidden_layers': 3, 'hidden_dim_0': 256, 'hidden_dim_1': 1024, 'hidden_dim_2': 1024, 'kl_weight': 0.00029764900254848246, 'lr': 0.006232816138832243, 'batch_size': 128, 'dropout_rate': 0.15143127527226782, 'prior_mu': -0.03287829410555168, 'prior_sigma': 0.07288200408987122, 'normalization': 'layer'}. Best is trial 896 with value: 0.4533553242683411.
Generating morgan_rdkit fingerprints...
Generated fingerprints with 2048 features for 841 molecules
Trial 1792: 5-fold CV loss = 0.4926
[I 2025-08-07 22:56:17,474] Trial 1792 finished with value: 0.4925935387611389 and parameters: {'fp_type': 'morgan_rdkit', 'combined_morgan_radius': 3, 'combined_morgan_nBits': 1024, 'combined_rdkit_maxPath': 7, 'combined_rdkit_nBits': 512, 'num_hidden_layers': 3, 'hidden_dim_0': 256, 'hidden_dim_1': 1024, 'hidden_dim_2': 64, 'kl_weight': 0.00034257365361852035, 'lr': 0.00790228245251221, 'batch_size': 128, 'dropout_rate': 0.1487346930883171, 'prior_mu': -0.017703821901911138, 'prior_sigma': 0.07805536327438631, 'normalization': 'layer'}. Best is trial 896 with value: 0.4533553242683411.
Generating morgan_rdkit fingerprints...
Generated fingerprints with 2048 features for 841 molecules
Trial 1793: 5-fold CV loss = 0.4887
[I 2025-08-07 22:56:21,961] Trial 1793 finished with value: 0.4886645495891571 and parameters: {'fp_type': 'morgan_rdkit', 'combined_morgan_radius': 3, 'combined_morgan_nBits': 1024, 'combined_rdkit_maxPath': 7, 'combined_rdkit_nBits': 512, 'num_hidden_layers': 3, 'hidden_dim_0': 256, 'hidden_dim_1': 1024, 'hidden_dim_2': 64, 'kl_weight': 0.0003034086905962244, 'lr': 0.00624538082021106, 'batch_size': 128, 'dropout_rate': 0.3764801364726024, 'prior_mu': -0.016087051367615426, 'prior_sigma': 0.07405513620484347, 'normalization': 'layer'}. Best is trial 896 with value: 0.4533553242683411.
Generating morgan_rdkit fingerprints...
Generated fingerprints with 2048 features for 841 molecules
Trial 1796: 5-fold CV loss = 0.4706
[I 2025-08-07 22:56:26,743] Trial 1796 finished with value: 0.47061885595321656 and parameters: {'fp_type': 'morgan_rdkit', 'combined_morgan_radius': 3, 'combined_morgan_nBits': 1024, 'combined_rdkit_maxPath': 7, 'combined_rdkit_nBits': 1024, 'num_hidden_layers': 3, 'hidden_dim_0': 256, 'hidden_dim_1': 1024, 'hidden_dim_2': 64, 'kl_weight': 0.0004442073930431473, 'lr': 0.009966999997591135, 'batch_size': 128, 'dropout_rate': 0.05698864851293373, 'prior_mu': -0.019679926718923647, 'prior_sigma': 0.08469570791810692, 'normalization': 'layer'}. Best is trial 896 with value: 0.4533553242683411.
Generating morgan fingerprints...
Generated fingerprints with 1024 features for 841 molecules
Trial 1799: 5-fold CV loss = 0.5276
[I 2025-08-07 22:56:45,397] Trial 1799 finished with value: 0.5275543868541718 and parameters: {'fp_type': 'morgan', 'morgan_only_radius': 2, 'morgan_only_nBits': 1024, 'num_hidden_layers': 3, 'hidden_dim_0': 256, 'hidden_dim_1': 1024, 'hidden_dim_2': 64, 'kl_weight': 0.000437760662718987, 'lr': 0.007276606160299713, 'batch_size': 128, 'dropout_rate': 0.09410203397173703, 'prior_mu': -0.05003440776437485, 'prior_sigma': 0.0850171011508553, 'normalization': 'layer'}. Best is trial 896 with value: 0.4533553242683411.
Generating morgan_rdkit fingerprints...
Generated fingerprints with 2048 features for 841 molecules
Trial 1795: 5-fold CV loss = 0.8731
[I 2025-08-07 22:56:58,761] Trial 1795 finished with value: 0.8731154561042785 and parameters: {'fp_type': 'morgan_rdkit', 'combined_morgan_radius': 3, 'combined_morgan_nBits': 1024, 'combined_rdkit_maxPath': 7, 'combined_rdkit_nBits': 512, 'num_hidden_layers': 3, 'hidden_dim_0': 256, 'hidden_dim_1': 1024, 'hidden_dim_2': 64, 'kl_weight': 0.00041335810549193865, 'lr': 0.00024639061231997324, 'batch_size': 128, 'dropout_rate': 0.05815093998100201, 'prior_mu': -0.018866128736375696, 'prior_sigma': 0.0730487936202572, 'normalization': 'layer'}. Best is trial 896 with value: 0.4533553242683411.
Generating morgan_rdkit fingerprints...
Generated fingerprints with 2048 features for 841 molecules
Trial 1798: 5-fold CV loss = 0.4642
[I 2025-08-07 22:57:06,198] Trial 1798 finished with value: 0.4641902506351471 and parameters: {'fp_type': 'morgan_rdkit', 'combined_morgan_radius': 3, 'combined_morgan_nBits': 1024, 'combined_rdkit_maxPath': 7, 'combined_rdkit_nBits': 1024, 'num_hidden_layers': 3, 'hidden_dim_0': 256, 'hidden_dim_1': 1024, 'hidden_dim_2': 64, 'kl_weight': 0.00044951081455160745, 'lr': 0.007367008782120971, 'batch_size': 128, 'dropout_rate': 0.05969046815846422, 'prior_mu': -0.05302533846802402, 'prior_sigma': 0.0845326442989774, 'normalization': 'layer'}. Best is trial 896 with value: 0.4533553242683411.
Generating morgan_rdkit fingerprints...
Generated fingerprints with 2048 features for 841 molecules
Trial 1797: 5-fold CV loss = 0.4795
[I 2025-08-07 22:57:15,729] Trial 1797 finished with value: 0.4795289397239685 and parameters: {'fp_type': 'morgan_rdkit', 'combined_morgan_radius': 3, 'combined_morgan_nBits': 1024, 'combined_rdkit_maxPath': 7, 'combined_rdkit_nBits': 1024, 'num_hidden_layers': 3, 'hidden_dim_0': 256, 'hidden_dim_1': 1024, 'hidden_dim_2': 64, 'kl_weight': 0.011841691945126652, 'lr': 0.007143845850493125, 'batch_size': 128, 'dropout_rate': 0.06119410907263609, 'prior_mu': -0.05417765610085436, 'prior_sigma': 0.08559479969307235, 'normalization': 'layer'}. Best is trial 896 with value: 0.4533553242683411.
Generating morgan_rdkit fingerprints...
Generated fingerprints with 2048 features for 841 molecules
Trial 1800: 5-fold CV loss = 0.4741
[I 2025-08-07 22:57:19,634] Trial 1800 finished with value: 0.474139130115509 and parameters: {'fp_type': 'morgan_rdkit', 'combined_morgan_radius': 3, 'combined_morgan_nBits': 1024, 'combined_rdkit_maxPath': 7, 'combined_rdkit_nBits': 1024, 'num_hidden_layers': 3, 'hidden_dim_0': 256, 'hidden_dim_1': 1024, 'hidden_dim_2': 64, 'kl_weight': 0.0048075557915407754, 'lr': 0.008890267947439613, 'batch_size': 128, 'dropout_rate': 0.06577069932377616, 'prior_mu': -0.03279052910578001, 'prior_sigma': 0.07970570735257229, 'normalization': 'layer'}. Best is trial 896 with value: 0.4533553242683411.
Generating rdkit fingerprints...
Generated fingerprints with 512 features for 841 molecules
Trial 1804: 5-fold CV loss = 0.8879
[I 2025-08-07 22:57:30,680] Trial 1804 finished with value: 0.8879112482070923 and parameters: {'fp_type': 'rdkit', 'rdkit_only_maxPath': 8, 'rdkit_only_nBits': 512, 'num_hidden_layers': 3, 'hidden_dim_0': 256, 'hidden_dim_1': 1024, 'hidden_dim_2': 64, 'kl_weight': 0.0002616638063158844, 'lr': 0.005776808824990819, 'batch_size': 128, 'dropout_rate': 0.16220794426783755, 'prior_mu': -0.03586551800792955, 'prior_sigma': 0.09538982670821196, 'normalization': 'layer'}. Best is trial 896 with value: 0.4533553242683411.
Generating morgan_rdkit fingerprints...
Generated fingerprints with 2048 features for 841 molecules
Trial 1802: 5-fold CV loss = 0.4750
[I 2025-08-07 22:57:51,922] Trial 1802 finished with value: 0.4750135660171509 and parameters: {'fp_type': 'morgan_rdkit', 'combined_morgan_radius': 3, 'combined_morgan_nBits': 1024, 'combined_rdkit_maxPath': 7, 'combined_rdkit_nBits': 1024, 'num_hidden_layers': 3, 'hidden_dim_0': 256, 'hidden_dim_1': 1024, 'hidden_dim_2': 64, 'kl_weight': 0.00020658280517136052, 'lr': 0.008601286276938352, 'batch_size': 128, 'dropout_rate': 0.10148377466502237, 'prior_mu': 0.025388733758006987, 'prior_sigma': 0.13156251815514403, 'normalization': 'layer'}. Best is trial 896 with value: 0.4533553242683411.
Generating morgan_rdkit fingerprints...
Generated fingerprints with 2048 features for 841 molecules
Trial 1805: 5-fold CV loss = 0.4682
[I 2025-08-07 22:58:04,168] Trial 1805 finished with value: 0.4681668817996979 and parameters: {'fp_type': 'morgan_rdkit', 'combined_morgan_radius': 3, 'combined_morgan_nBits': 1024, 'combined_rdkit_maxPath': 7, 'combined_rdkit_nBits': 1024, 'num_hidden_layers': 3, 'hidden_dim_0': 256, 'hidden_dim_1': 1024, 'hidden_dim_2': 64, 'kl_weight': 0.00037795019974050094, 'lr': 0.00847051563335288, 'batch_size': 128, 'dropout_rate': 0.10151823775355565, 'prior_mu': -0.029221364392074137, 'prior_sigma': 0.06969738553909403, 'normalization': 'layer'}. Best is trial 896 with value: 0.4533553242683411.
Generating morgan_rdkit fingerprints...
Generated fingerprints with 2048 features for 841 molecules
Trial 1803: 5-fold CV loss = 0.4682
[I 2025-08-07 22:58:16,167] Trial 1803 finished with value: 0.4682465136051178 and parameters: {'fp_type': 'morgan_rdkit', 'combined_morgan_radius': 3, 'combined_morgan_nBits': 1024, 'combined_rdkit_maxPath': 7, 'combined_rdkit_nBits': 1024, 'num_hidden_layers': 3, 'hidden_dim_0': 256, 'hidden_dim_1': 1024, 'hidden_dim_2': 64, 'kl_weight': 0.00020390031218784531, 'lr': 0.005832821327205297, 'batch_size': 128, 'dropout_rate': 0.1043731500291822, 'prior_mu': -0.032722944756276906, 'prior_sigma': 0.09570161770776466, 'normalization': 'layer'}. Best is trial 896 with value: 0.4533553242683411.
Generating morgan_rdkit fingerprints...
Generated fingerprints with 2048 features for 841 molecules
Trial 1806: 5-fold CV loss = 0.7420
[I 2025-08-07 22:58:23,504] Trial 1806 finished with value: 0.7420441746711731 and parameters: {'fp_type': 'morgan_rdkit', 'combined_morgan_radius': 3, 'combined_morgan_nBits': 1024, 'combined_rdkit_maxPath': 7, 'combined_rdkit_nBits': 1024, 'num_hidden_layers': 3, 'hidden_dim_0': 256, 'hidden_dim_1': 1024, 'hidden_dim_2': 512, 'kl_weight': 0.0003635453810304353, 'lr': 0.006452504034247732, 'batch_size': 128, 'dropout_rate': 0.12540476725974134, 'prior_mu': -0.027968151014150962, 'prior_sigma': 0.07017894639340508, 'normalization': 'layer'}. Best is trial 896 with value: 0.4533553242683411.
Generating morgan_rdkit fingerprints...
Generated fingerprints with 2048 features for 841 molecules
Trial 1801: 5-fold CV loss = 0.4630
[I 2025-08-07 22:58:30,773] Trial 1801 finished with value: 0.4629877805709839 and parameters: {'fp_type': 'morgan_rdkit', 'combined_morgan_radius': 3, 'combined_morgan_nBits': 1024, 'combined_rdkit_maxPath': 7, 'combined_rdkit_nBits': 1024, 'num_hidden_layers': 3, 'hidden_dim_0': 256, 'hidden_dim_1': 1024, 'hidden_dim_2': 64, 'kl_weight': 0.00020769811375182475, 'lr': 0.008713972586259822, 'batch_size': 128, 'dropout_rate': 0.10001666712401511, 'prior_mu': -0.031097317937199963, 'prior_sigma': 0.07856202143505867, 'normalization': 'layer'}. Best is trial 896 with value: 0.4533553242683411.
Generating morgan_rdkit fingerprints...
Generated fingerprints with 2048 features for 841 molecules
Trial 1807: 5-fold CV loss = 0.4681
[I 2025-08-07 22:58:41,219] Trial 1807 finished with value: 0.46806437373161314 and parameters: {'fp_type': 'morgan_rdkit', 'combined_morgan_radius': 3, 'combined_morgan_nBits': 1024, 'combined_rdkit_maxPath': 7, 'combined_rdkit_nBits': 1024, 'num_hidden_layers': 3, 'hidden_dim_0': 256, 'hidden_dim_1': 1024, 'hidden_dim_2': 64, 'kl_weight': 0.00033575144951315615, 'lr': 0.006544099261217879, 'batch_size': 128, 'dropout_rate': 0.12509776891736693, 'prior_mu': -0.07030167879657254, 'prior_sigma': 0.0770345404086471, 'normalization': 'layer'}. Best is trial 896 with value: 0.4533553242683411.
Generating morgan_rdkit fingerprints...
Generated fingerprints with 2048 features for 841 molecules
Trial 1809: 5-fold CV loss = 0.4830
[I 2025-08-07 22:58:55,977] Trial 1809 finished with value: 0.48303104639053346 and parameters: {'fp_type': 'morgan_rdkit', 'combined_morgan_radius': 3, 'combined_morgan_nBits': 1024, 'combined_rdkit_maxPath': 5, 'combined_rdkit_nBits': 1024, 'num_hidden_layers': 3, 'hidden_dim_0': 128, 'hidden_dim_1': 1024, 'hidden_dim_2': 64, 'kl_weight': 0.0003426040721061185, 'lr': 0.006456147492435123, 'batch_size': 128, 'dropout_rate': 0.08898966301024046, 'prior_mu': -0.06990379291700209, 'prior_sigma': 0.07737432064476149, 'normalization': 'layer'}. Best is trial 896 with value: 0.4533553242683411.
Generating morgan_rdkit fingerprints...
Generated fingerprints with 2048 features for 841 molecules
Trial 1811: 5-fold CV loss = 0.5633
[I 2025-08-07 22:59:08,963] Trial 1811 finished with value: 0.563270491361618 and parameters: {'fp_type': 'morgan_rdkit', 'combined_morgan_radius': 3, 'combined_morgan_nBits': 1024, 'combined_rdkit_maxPath': 7, 'combined_rdkit_nBits': 1024, 'num_hidden_layers': 3, 'hidden_dim_0': 128, 'hidden_dim_1': 1024, 'hidden_dim_2': 64, 'kl_weight': 0.00026513363738539774, 'lr': 0.007439635654693031, 'batch_size': 128, 'dropout_rate': 0.07654349093818287, 'prior_mu': -0.04466212208170488, 'prior_sigma': 0.08836503526656748, 'normalization': 'layer'}. Best is trial 896 with value: 0.4533553242683411.
Generating morgan_rdkit fingerprints...
Generated fingerprints with 2048 features for 841 molecules
Trial 1812: 5-fold CV loss = 0.8736
[I 2025-08-07 22:59:18,374] Trial 1812 finished with value: 0.8735659718513489 and parameters: {'fp_type': 'morgan_rdkit', 'combined_morgan_radius': 3, 'combined_morgan_nBits': 1024, 'combined_rdkit_maxPath': 7, 'combined_rdkit_nBits': 1024, 'num_hidden_layers': 3, 'hidden_dim_0': 256, 'hidden_dim_1': 1024, 'hidden_dim_2': 64, 'kl_weight': 0.0002679723322840432, 'lr': 0.0006308905035652975, 'batch_size': 128, 'dropout_rate': 0.07612857692853646, 'prior_mu': -0.04428050801783741, 'prior_sigma': 0.08785640652343613, 'normalization': 'layer'}. Best is trial 896 with value: 0.4533553242683411.
Generating morgan_rdkit fingerprints...
Generated fingerprints with 2048 features for 841 molecules
Trial 1808: 5-fold CV loss = 0.5563
[I 2025-08-07 22:59:22,024] Trial 1808 finished with value: 0.5562910854816436 and parameters: {'fp_type': 'morgan_rdkit', 'combined_morgan_radius': 3, 'combined_morgan_nBits': 1024, 'combined_rdkit_maxPath': 7, 'combined_rdkit_nBits': 1024, 'num_hidden_layers': 3, 'hidden_dim_0': 128, 'hidden_dim_1': 1024, 'hidden_dim_2': 512, 'kl_weight': 0.0022759161352448863, 'lr': 0.006417013042365907, 'batch_size': 128, 'dropout_rate': 0.08303175799433252, 'prior_mu': -0.022902792098596345, 'prior_sigma': 0.0765861764345876, 'normalization': 'layer'}. Best is trial 896 with value: 0.4533553242683411.
Generating morgan_rdkit fingerprints...
Generated fingerprints with 2048 features for 841 molecules
Trial 1810: 5-fold CV loss = 0.4962
[I 2025-08-07 22:59:38,399] Trial 1810 finished with value: 0.496197772026062 and parameters: {'fp_type': 'morgan_rdkit', 'combined_morgan_radius': 3, 'combined_morgan_nBits': 1024, 'combined_rdkit_maxPath': 5, 'combined_rdkit_nBits': 1024, 'num_hidden_layers': 3, 'hidden_dim_0': 128, 'hidden_dim_1': 1024, 'hidden_dim_2': 64, 'kl_weight': 0.00031879104630049427, 'lr': 0.006437474656584497, 'batch_size': 128, 'dropout_rate': 0.08693274668947772, 'prior_mu': -0.05901472679251856, 'prior_sigma': 0.07542868715081627, 'normalization': 'layer'}. Best is trial 896 with value: 0.4533553242683411.
Generating morgan_rdkit fingerprints...
Generated fingerprints with 2048 features for 841 molecules
Trial 1813: 5-fold CV loss = 0.4707
[I 2025-08-07 22:59:40,899] Trial 1813 finished with value: 0.4707002997398376 and parameters: {'fp_type': 'morgan_rdkit', 'combined_morgan_radius': 3, 'combined_morgan_nBits': 1024, 'combined_rdkit_maxPath': 7, 'combined_rdkit_nBits': 1024, 'num_hidden_layers': 3, 'hidden_dim_0': 256, 'hidden_dim_1': 1024, 'hidden_dim_2': 64, 'kl_weight': 0.0004908647810727662, 'lr': 0.009989596302323022, 'batch_size': 128, 'dropout_rate': 0.11735398359055435, 'prior_mu': -0.012645383705838363, 'prior_sigma': 0.0808468102612728, 'normalization': 'layer'}. Best is trial 896 with value: 0.4533553242683411.
Generating morgan_rdkit fingerprints...
Generated fingerprints with 2048 features for 841 molecules
Trial 1814: 5-fold CV loss = 0.4660
[I 2025-08-07 23:00:00,892] Trial 1814 finished with value: 0.46600730419158937 and parameters: {'fp_type': 'morgan_rdkit', 'combined_morgan_radius': 3, 'combined_morgan_nBits': 1024, 'combined_rdkit_maxPath': 7, 'combined_rdkit_nBits': 1024, 'num_hidden_layers': 3, 'hidden_dim_0': 256, 'hidden_dim_1': 1024, 'hidden_dim_2': 64, 'kl_weight': 0.00047129466202157496, 'lr': 0.005773132676644264, 'batch_size': 128, 'dropout_rate': 0.11343426725034027, 'prior_mu': -0.021852571821535792, 'prior_sigma': 0.0822042179436734, 'normalization': 'layer'}. Best is trial 896 with value: 0.4533553242683411.
Generating morgan_rdkit fingerprints...
Generated fingerprints with 2048 features for 841 molecules
Trial 1815: 5-fold CV loss = 0.4635
