[I 2025-08-08 00:55:19,100] Trial 2387 finished with value: 0.5748863697052002 and parameters: {'fp_type': 'morgan_rdkit', 'combined_morgan_radius': 3, 'combined_morgan_nBits': 1024, 'combined_rdkit_maxPath': 7, 'combined_rdkit_nBits': 1024, 'num_hidden_layers': 3, 'hidden_dim_0': 256, 'hidden_dim_1': 1024, 'hidden_dim_2': 256, 'kl_weight': 0.0001000101801157862, 'lr': 0.00907460123626794, 'batch_size': 128, 'dropout_rate': 0.08581929674669143, 'prior_mu': 0.022223757306029143, 'prior_sigma': 0.09722843961119294, 'normalization': 'layer'}. Best is trial 896 with value: 0.4533553242683411.
Generating morgan_rdkit fingerprints...
Generated fingerprints with 2048 features for 841 molecules
Trial 2388: 5-fold CV loss = 0.5032
[I 2025-08-08 00:55:23,696] Trial 2388 finished with value: 0.5032143592834473 and parameters: {'fp_type': 'morgan_rdkit', 'combined_morgan_radius': 3, 'combined_morgan_nBits': 1024, 'combined_rdkit_maxPath': 7, 'combined_rdkit_nBits': 1024, 'num_hidden_layers': 1, 'hidden_dim_0': 256, 'kl_weight': 0.0001713508899162647, 'lr': 0.009259075401723178, 'batch_size': 128, 'dropout_rate': 0.08604418844025005, 'prior_mu': 0.011871793548034044, 'prior_sigma': 0.09346371707042246, 'normalization': 'layer'}. Best is trial 896 with value: 0.4533553242683411.
Generating morgan_rdkit fingerprints...
Generated fingerprints with 2048 features for 841 molecules
Trial 2384: 5-fold CV loss = 0.4716
[I 2025-08-08 00:55:34,548] Trial 2384 finished with value: 0.4716097772121429 and parameters: {'fp_type': 'morgan_rdkit', 'combined_morgan_radius': 3, 'combined_morgan_nBits': 512, 'combined_rdkit_maxPath': 7, 'combined_rdkit_nBits': 1024, 'num_hidden_layers': 3, 'hidden_dim_0': 256, 'hidden_dim_1': 64, 'hidden_dim_2': 64, 'kl_weight': 0.00012251380349835063, 'lr': 0.007625796594059175, 'batch_size': 64, 'dropout_rate': 0.06926977778839576, 'prior_mu': 0.006438319781930843, 'prior_sigma': 0.1177182394465762, 'normalization': 'layer'}. Best is trial 896 with value: 0.4533553242683411.
Generating morgan fingerprints...
Generated fingerprints with 1024 features for 841 molecules
Trial 2389: 5-fold CV loss = 0.4628
[I 2025-08-08 00:55:54,306] Trial 2389 finished with value: 0.4627844631671906 and parameters: {'fp_type': 'morgan_rdkit', 'combined_morgan_radius': 3, 'combined_morgan_nBits': 1024, 'combined_rdkit_maxPath': 7, 'combined_rdkit_nBits': 1024, 'num_hidden_layers': 3, 'hidden_dim_0': 256, 'hidden_dim_1': 1024, 'hidden_dim_2': 64, 'kl_weight': 0.0001718370420546523, 'lr': 0.008676898146447525, 'batch_size': 128, 'dropout_rate': 0.08675715464414592, 'prior_mu': 0.008391316124869245, 'prior_sigma': 0.09429894010034827, 'normalization': 'layer'}. Best is trial 896 with value: 0.4533553242683411.
Generating morgan fingerprints...
Generated fingerprints with 1024 features for 841 molecules
Trial 2390: 5-fold CV loss = 0.4825
[I 2025-08-08 00:56:03,355] Trial 2390 finished with value: 0.48254204988479615 and parameters: {'fp_type': 'morgan_rdkit', 'combined_morgan_radius': 3, 'combined_morgan_nBits': 1024, 'combined_rdkit_maxPath': 7, 'combined_rdkit_nBits': 1024, 'num_hidden_layers': 3, 'hidden_dim_0': 128, 'hidden_dim_1': 1024, 'hidden_dim_2': 64, 'kl_weight': 0.00015317170781238237, 'lr': 0.008472913837608335, 'batch_size': 128, 'dropout_rate': 0.09773104610731215, 'prior_mu': 0.009583979188806241, 'prior_sigma': 0.11187185831015889, 'normalization': 'layer'}. Best is trial 896 with value: 0.4533553242683411.
Generating morgan_rdkit fingerprints...
Generated fingerprints with 1280 features for 841 molecules
Trial 2391: 5-fold CV loss = 0.5214
[I 2025-08-08 00:56:11,209] Trial 2391 finished with value: 0.5213829100131988 and parameters: {'fp_type': 'morgan', 'morgan_only_radius': 2, 'morgan_only_nBits': 1024, 'num_hidden_layers': 3, 'hidden_dim_0': 256, 'hidden_dim_1': 1024, 'hidden_dim_2': 64, 'kl_weight': 0.0001781941438097731, 'lr': 0.008805261797393103, 'batch_size': 128, 'dropout_rate': 0.0979512636464111, 'prior_mu': 0.005235877352764415, 'prior_sigma': 0.11259657683973402, 'normalization': 'layer'}. Best is trial 896 with value: 0.4533553242683411.
Generating morgan_rdkit fingerprints...
Generated fingerprints with 2048 features for 841 molecules
Trial 2392: 5-fold CV loss = 0.5273
[I 2025-08-08 00:56:16,415] Trial 2392 finished with value: 0.5273383975028991 and parameters: {'fp_type': 'morgan', 'morgan_only_radius': 2, 'morgan_only_nBits': 1024, 'num_hidden_layers': 3, 'hidden_dim_0': 256, 'hidden_dim_1': 1024, 'hidden_dim_2': 64, 'kl_weight': 0.00015402405079992164, 'lr': 0.008521154793720303, 'batch_size': 128, 'dropout_rate': 0.09893784392786055, 'prior_mu': 0.006232483873759773, 'prior_sigma': 0.10299810889603435, 'normalization': 'layer'}. Best is trial 896 with value: 0.4533553242683411.
Generating morgan_rdkit fingerprints...
Generated fingerprints with 2048 features for 841 molecules
Trial 2383: 5-fold CV loss = 0.4691
[I 2025-08-08 00:56:24,738] Trial 2383 finished with value: 0.46907398104667664 and parameters: {'fp_type': 'morgan_rdkit', 'combined_morgan_radius': 3, 'combined_morgan_nBits': 512, 'combined_rdkit_maxPath': 7, 'combined_rdkit_nBits': 1024, 'num_hidden_layers': 3, 'hidden_dim_0': 256, 'hidden_dim_1': 1024, 'hidden_dim_2': 64, 'kl_weight': 0.00011400177977551072, 'lr': 0.007671364722087301, 'batch_size': 64, 'dropout_rate': 0.07329633077807189, 'prior_mu': 0.006124664012094376, 'prior_sigma': 0.12512307423831354, 'normalization': 'layer'}. Best is trial 896 with value: 0.4533553242683411.
Generating morgan_rdkit fingerprints...
Generated fingerprints with 2048 features for 841 molecules
Trial 2393: 5-fold CV loss = 0.6006
[I 2025-08-08 00:56:34,929] Trial 2393 finished with value: 0.6006314516067505 and parameters: {'fp_type': 'morgan_rdkit', 'combined_morgan_radius': 3, 'combined_morgan_nBits': 1024, 'combined_rdkit_maxPath': 5, 'combined_rdkit_nBits': 256, 'num_hidden_layers': 3, 'hidden_dim_0': 256, 'hidden_dim_1': 1024, 'hidden_dim_2': 64, 'kl_weight': 0.0001764241412674214, 'lr': 0.007531344708450062, 'batch_size': 128, 'dropout_rate': 0.09949239319965306, 'prior_mu': 0.03155579208685072, 'prior_sigma': 0.10380875022964932, 'normalization': 'layer'}. Best is trial 896 with value: 0.4533553242683411.
Generating morgan_rdkit fingerprints...
Generated fingerprints with 2048 features for 841 molecules
Trial 2395: 5-fold CV loss = 0.8295
[I 2025-08-08 00:56:47,253] Trial 2395 finished with value: 0.829542589187622 and parameters: {'fp_type': 'morgan_rdkit', 'combined_morgan_radius': 3, 'combined_morgan_nBits': 1024, 'combined_rdkit_maxPath': 5, 'combined_rdkit_nBits': 1024, 'num_hidden_layers': 3, 'hidden_dim_0': 256, 'hidden_dim_1': 1024, 'hidden_dim_2': 64, 'kl_weight': 0.00011717227100612407, 'lr': 0.0001983447121948411, 'batch_size': 128, 'dropout_rate': 0.07352339344428795, 'prior_mu': 0.024908779801680887, 'prior_sigma': 0.16888908095407795, 'normalization': 'layer'}. Best is trial 896 with value: 0.4533553242683411.
Generating morgan_rdkit fingerprints...
Generated fingerprints with 2048 features for 841 molecules
Trial 2398: 5-fold CV loss = 0.8885
[I 2025-08-08 00:56:59,654] Trial 2398 finished with value: 0.8885104775428772 and parameters: {'fp_type': 'morgan_rdkit', 'combined_morgan_radius': 3, 'combined_morgan_nBits': 1024, 'combined_rdkit_maxPath': 7, 'combined_rdkit_nBits': 1024, 'num_hidden_layers': 3, 'hidden_dim_0': 256, 'hidden_dim_1': 1024, 'hidden_dim_2': 512, 'kl_weight': 0.00014057641436555966, 'lr': 0.009256403365422388, 'batch_size': 128, 'dropout_rate': 0.08604686733278724, 'prior_mu': 0.017033998436575173, 'prior_sigma': 0.09954305469474664, 'normalization': 'layer'}. Best is trial 896 with value: 0.4533553242683411.
Generating morgan_rdkit fingerprints...
Generated fingerprints with 2048 features for 841 molecules
Trial 2394: 5-fold CV loss = 0.4688
[I 2025-08-08 00:57:12,197] Trial 2394 finished with value: 0.4688496828079224 and parameters: {'fp_type': 'morgan_rdkit', 'combined_morgan_radius': 3, 'combined_morgan_nBits': 1024, 'combined_rdkit_maxPath': 7, 'combined_rdkit_nBits': 1024, 'num_hidden_layers': 3, 'hidden_dim_0': 256, 'hidden_dim_1': 1024, 'hidden_dim_2': 64, 'kl_weight': 0.00014452054346962039, 'lr': 0.0074263269768641066, 'batch_size': 128, 'dropout_rate': 0.06948622102817328, 'prior_mu': 0.020596432732434545, 'prior_sigma': 0.10216348505681487, 'normalization': 'layer'}. Best is trial 896 with value: 0.4533553242683411.
Generating morgan_rdkit fingerprints...
Generated fingerprints with 2048 features for 841 molecules
Trial 2397: 5-fold CV loss = 0.4668
[I 2025-08-08 00:57:17,906] Trial 2397 finished with value: 0.466805225610733 and parameters: {'fp_type': 'morgan_rdkit', 'combined_morgan_radius': 3, 'combined_morgan_nBits': 1024, 'combined_rdkit_maxPath': 7, 'combined_rdkit_nBits': 1024, 'num_hidden_layers': 3, 'hidden_dim_0': 256, 'hidden_dim_1': 1024, 'hidden_dim_2': 64, 'kl_weight': 0.00015231067226804113, 'lr': 0.008389661071846702, 'batch_size': 128, 'dropout_rate': 0.08456214776540684, 'prior_mu': 0.024699672726744636, 'prior_sigma': 0.09328172768723823, 'normalization': 'layer'}. Best is trial 896 with value: 0.4533553242683411.
Generating morgan_rdkit fingerprints...
Generated fingerprints with 2048 features for 841 molecules
Trial 2396: 5-fold CV loss = 0.4906
[I 2025-08-08 00:57:26,404] Trial 2396 finished with value: 0.49060786962509156 and parameters: {'fp_type': 'morgan_rdkit', 'combined_morgan_radius': 3, 'combined_morgan_nBits': 1024, 'combined_rdkit_maxPath': 5, 'combined_rdkit_nBits': 1024, 'num_hidden_layers': 3, 'hidden_dim_0': 256, 'hidden_dim_1': 1024, 'hidden_dim_2': 64, 'kl_weight': 0.00017047354827990014, 'lr': 0.0074450297368525535, 'batch_size': 128, 'dropout_rate': 0.08594047931670622, 'prior_mu': 0.022731625856591373, 'prior_sigma': 0.09985362421610867, 'normalization': 'layer'}. Best is trial 896 with value: 0.4533553242683411.
Generating morgan_rdkit fingerprints...
Generated fingerprints with 2048 features for 841 molecules
Trial 2399: 5-fold CV loss = 0.4700
[I 2025-08-08 00:57:37,686] Trial 2399 finished with value: 0.4700326442718506 and parameters: {'fp_type': 'morgan_rdkit', 'combined_morgan_radius': 3, 'combined_morgan_nBits': 1024, 'combined_rdkit_maxPath': 7, 'combined_rdkit_nBits': 1024, 'num_hidden_layers': 3, 'hidden_dim_0': 256, 'hidden_dim_1': 1024, 'hidden_dim_2': 64, 'kl_weight': 0.00017873437508806402, 'lr': 0.009969226123495776, 'batch_size': 128, 'dropout_rate': 0.06408336681908182, 'prior_mu': 0.0010199201452622871, 'prior_sigma': 0.09359961183638754, 'normalization': 'layer'}. Best is trial 896 with value: 0.4533553242683411.
Generating morgan_rdkit fingerprints...
Generated fingerprints with 2048 features for 841 molecules
Trial 2401: 5-fold CV loss = 0.6661
[I 2025-08-08 00:57:51,925] Trial 2401 finished with value: 0.6661422610282898 and parameters: {'fp_type': 'morgan_rdkit', 'combined_morgan_radius': 3, 'combined_morgan_nBits': 1024, 'combined_rdkit_maxPath': 7, 'combined_rdkit_nBits': 1024, 'num_hidden_layers': 3, 'hidden_dim_0': 256, 'hidden_dim_1': 1024, 'hidden_dim_2': 64, 'kl_weight': 0.00017259408089681207, 'lr': 0.007319607990824218, 'batch_size': 128, 'dropout_rate': 0.09033789987809487, 'prior_mu': 0.014548588632679313, 'prior_sigma': 0.09310545404081035, 'normalization': 'none'}. Best is trial 896 with value: 0.4533553242683411.
Generating morgan_rdkit fingerprints...
Generated fingerprints with 2048 features for 841 molecules
Trial 2403: 5-fold CV loss = 0.8138
[I 2025-08-08 00:57:54,943] Trial 2403 finished with value: 0.8137915253639221 and parameters: {'fp_type': 'morgan_rdkit', 'combined_morgan_radius': 3, 'combined_morgan_nBits': 1024, 'combined_rdkit_maxPath': 7, 'combined_rdkit_nBits': 1024, 'num_hidden_layers': 3, 'hidden_dim_0': 256, 'hidden_dim_1': 1024, 'hidden_dim_2': 64, 'kl_weight': 0.00012907110841796544, 'lr': 0.008134851625475222, 'batch_size': 128, 'dropout_rate': 0.09536754062402654, 'prior_mu': 0.015455181365318775, 'prior_sigma': 0.10671617866967317, 'normalization': 'none'}. Best is trial 896 with value: 0.4533553242683411.
Generating morgan_rdkit fingerprints...
Generated fingerprints with 2048 features for 841 molecules
Trial 2400: 5-fold CV loss = 0.5763
[I 2025-08-08 00:58:10,737] Trial 2400 finished with value: 0.5763093769550324 and parameters: {'fp_type': 'morgan_rdkit', 'combined_morgan_radius': 3, 'combined_morgan_nBits': 1024, 'combined_rdkit_maxPath': 7, 'combined_rdkit_nBits': 1024, 'num_hidden_layers': 3, 'hidden_dim_0': 64, 'hidden_dim_1': 1024, 'hidden_dim_2': 64, 'kl_weight': 0.00017581424748080874, 'lr': 0.00844969601066172, 'batch_size': 128, 'dropout_rate': 0.08454476922064665, 'prior_mu': 0.025123875288576344, 'prior_sigma': 0.09458238183861159, 'normalization': 'none'}. Best is trial 896 with value: 0.4533553242683411.
Generating morgan_rdkit fingerprints...
Generated fingerprints with 2048 features for 841 molecules
Trial 2405: 5-fold CV loss = 0.5528
[I 2025-08-08 00:58:22,694] Trial 2405 finished with value: 0.5528490245342255 and parameters: {'fp_type': 'morgan_rdkit', 'combined_morgan_radius': 3, 'combined_morgan_nBits': 1024, 'combined_rdkit_maxPath': 7, 'combined_rdkit_nBits': 1024, 'num_hidden_layers': 3, 'hidden_dim_0': 256, 'hidden_dim_1': 512, 'hidden_dim_2': 64, 'kl_weight': 0.00011173595787695146, 'lr': 0.009300512680564537, 'batch_size': 128, 'dropout_rate': 0.07784836269137334, 'prior_mu': 0.0037348210126113036, 'prior_sigma': 0.09694418933675479, 'normalization': 'layer'}. Best is trial 896 with value: 0.4533553242683411.
Generating morgan_rdkit fingerprints...
Generated fingerprints with 2048 features for 841 molecules
Trial 2404: 5-fold CV loss = 0.5582
[I 2025-08-08 00:58:30,895] Trial 2404 finished with value: 0.5582043588161468 and parameters: {'fp_type': 'morgan_rdkit', 'combined_morgan_radius': 3, 'combined_morgan_nBits': 1024, 'combined_rdkit_maxPath': 7, 'combined_rdkit_nBits': 1024, 'num_hidden_layers': 3, 'hidden_dim_0': 64, 'hidden_dim_1': 512, 'hidden_dim_2': 64, 'kl_weight': 0.0001228427330398628, 'lr': 0.008204382732052151, 'batch_size': 128, 'dropout_rate': 0.027457301305261805, 'prior_mu': 0.016778676750040748, 'prior_sigma': 0.10778713206109843, 'normalization': 'layer'}. Best is trial 896 with value: 0.4533553242683411.
Generating morgan_rdkit fingerprints...
Generated fingerprints with 2048 features for 841 molecules
Trial 2407: 5-fold CV loss = 0.5540
[I 2025-08-08 00:58:55,184] Trial 2407 finished with value: 0.5539794564247131 and parameters: {'fp_type': 'morgan_rdkit', 'combined_morgan_radius': 3, 'combined_morgan_nBits': 1024, 'combined_rdkit_maxPath': 7, 'combined_rdkit_nBits': 1024, 'num_hidden_layers': 3, 'hidden_dim_0': 256, 'hidden_dim_1': 1024, 'hidden_dim_2': 64, 'kl_weight': 0.00014066314384166684, 'lr': 0.009221185687226054, 'batch_size': 128, 'dropout_rate': 0.05290465110093151, 'prior_mu': -0.0006281711196071994, 'prior_sigma': 0.11496072071470077, 'normalization': 'layer'}. Best is trial 896 with value: 0.4533553242683411.
Generating morgan_rdkit fingerprints...
Generated fingerprints with 2048 features for 841 molecules
Trial 2408: 5-fold CV loss = 0.5402
[I 2025-08-08 00:59:11,485] Trial 2408 finished with value: 0.5401849985122681 and parameters: {'fp_type': 'morgan_rdkit', 'combined_morgan_radius': 3, 'combined_morgan_nBits': 1024, 'combined_rdkit_maxPath': 7, 'combined_rdkit_nBits': 1024, 'num_hidden_layers': 3, 'hidden_dim_0': 256, 'hidden_dim_1': 1024, 'hidden_dim_2': 128, 'kl_weight': 0.0001395881354771447, 'lr': 0.00994102552893391, 'batch_size': 128, 'dropout_rate': 0.05811345089217827, 'prior_mu': 0.037307299410583146, 'prior_sigma': 0.1034091789015167, 'normalization': 'layer'}. Best is trial 896 with value: 0.4533553242683411.
Generating morgan_rdkit fingerprints...
Generated fingerprints with 2048 features for 841 molecules
Trial 2406: 5-fold CV loss = 0.4588
[I 2025-08-08 00:59:14,336] Trial 2406 finished with value: 0.4587747812271118 and parameters: {'fp_type': 'morgan_rdkit', 'combined_morgan_radius': 3, 'combined_morgan_nBits': 1024, 'combined_rdkit_maxPath': 7, 'combined_rdkit_nBits': 1024, 'num_hidden_layers': 3, 'hidden_dim_0': 256, 'hidden_dim_1': 1024, 'hidden_dim_2': 64, 'kl_weight': 0.00012844018927809218, 'lr': 0.008986833259206307, 'batch_size': 128, 'dropout_rate': 0.10030975040649812, 'prior_mu': 0.0074556119313547616, 'prior_sigma': 0.11014498640303413, 'normalization': 'layer'}. Best is trial 896 with value: 0.4533553242683411.
Generating morgan_rdkit fingerprints...
Generated fingerprints with 1536 features for 841 molecules
Trial 2402: 5-fold CV loss = 0.5504
[I 2025-08-08 00:59:22,469] Trial 2402 finished with value: 0.5504194855690002 and parameters: {'fp_type': 'morgan_rdkit', 'combined_morgan_radius': 3, 'combined_morgan_nBits': 1024, 'combined_rdkit_maxPath': 7, 'combined_rdkit_nBits': 1024, 'num_hidden_layers': 3, 'hidden_dim_0': 64, 'hidden_dim_1': 1024, 'hidden_dim_2': 64, 'kl_weight': 0.00018079933406008075, 'lr': 0.00838388293004526, 'batch_size': 128, 'dropout_rate': 0.09314268404683246, 'prior_mu': 0.014026967741535105, 'prior_sigma': 0.09404524159293606, 'normalization': 'none'}. Best is trial 896 with value: 0.4533553242683411.
Generating morgan_rdkit fingerprints...
Generated fingerprints with 1536 features for 841 molecules
Trial 2410: 5-fold CV loss = 0.8869
[I 2025-08-08 00:59:27,243] Trial 2410 finished with value: 0.8869084119796753 and parameters: {'fp_type': 'morgan_rdkit', 'combined_morgan_radius': 3, 'combined_morgan_nBits': 1024, 'combined_rdkit_maxPath': 7, 'combined_rdkit_nBits': 1024, 'num_hidden_layers': 3, 'hidden_dim_0': 256, 'hidden_dim_1': 1024, 'hidden_dim_2': 1024, 'kl_weight': 0.00019018696287839704, 'lr': 0.007294345364387309, 'batch_size': 128, 'dropout_rate': 0.1010258781963655, 'prior_mu': 0.004820389522268782, 'prior_sigma': 0.09892219764547283, 'normalization': 'layer'}. Best is trial 896 with value: 0.4533553242683411.
Generating morgan_rdkit fingerprints...
Generated fingerprints with 1536 features for 841 molecules
Trial 2409: 5-fold CV loss = 0.5660
[I 2025-08-08 00:59:30,668] Trial 2409 finished with value: 0.5659729421138764 and parameters: {'fp_type': 'morgan_rdkit', 'combined_morgan_radius': 3, 'combined_morgan_nBits': 1024, 'combined_rdkit_maxPath': 7, 'combined_rdkit_nBits': 1024, 'num_hidden_layers': 3, 'hidden_dim_0': 256, 'hidden_dim_1': 1024, 'hidden_dim_2': 128, 'kl_weight': 0.00018630423426251017, 'lr': 0.00996330798082145, 'batch_size': 128, 'dropout_rate': 0.10190422434354005, 'prior_mu': 0.037989180603803886, 'prior_sigma': 0.10307533277376844, 'normalization': 'layer'}. Best is trial 896 with value: 0.4533553242683411.
Generating morgan_rdkit fingerprints...
Generated fingerprints with 2048 features for 841 molecules
Trial 2411: 5-fold CV loss = 0.8897
[I 2025-08-08 00:59:41,422] Trial 2411 finished with value: 0.889688766002655 and parameters: {'fp_type': 'morgan_rdkit', 'combined_morgan_radius': 2, 'combined_morgan_nBits': 1024, 'combined_rdkit_maxPath': 7, 'combined_rdkit_nBits': 512, 'num_hidden_layers': 3, 'hidden_dim_0': 256, 'hidden_dim_1': 1024, 'hidden_dim_2': 1024, 'kl_weight': 0.00017032615961019815, 'lr': 0.007202227994774213, 'batch_size': 128, 'dropout_rate': 0.07639987703225763, 'prior_mu': 0.003330337188145068, 'prior_sigma': 0.09196849275410446, 'normalization': 'layer'}. Best is trial 896 with value: 0.4533553242683411.
Generating rdkit fingerprints...
Generated fingerprints with 512 features for 841 molecules
Trial 2412: 5-fold CV loss = 0.8876
[I 2025-08-08 01:00:00,351] Trial 2412 finished with value: 0.887551462650299 and parameters: {'fp_type': 'morgan_rdkit', 'combined_morgan_radius': 2, 'combined_morgan_nBits': 1024, 'combined_rdkit_maxPath': 7, 'combined_rdkit_nBits': 512, 'num_hidden_layers': 3, 'hidden_dim_0': 256, 'hidden_dim_1': 1024, 'hidden_dim_2': 1024, 'kl_weight': 0.0001829915475325402, 'lr': 0.0073742613193752485, 'batch_size': 128, 'dropout_rate': 0.07554431868273419, 'prior_mu': -0.00144295594179681, 'prior_sigma': 0.09908660281220595, 'normalization': 'layer'}. Best is trial 896 with value: 0.4533553242683411.
Generating morgan_rdkit fingerprints...
Generated fingerprints with 2048 features for 841 molecules
Trial 2413: 5-fold CV loss = 0.4997
[I 2025-08-08 01:00:05,552] Trial 2413 finished with value: 0.49974032044410704 and parameters: {'fp_type': 'morgan_rdkit', 'combined_morgan_radius': 2, 'combined_morgan_nBits': 1024, 'combined_rdkit_maxPath': 7, 'combined_rdkit_nBits': 512, 'num_hidden_layers': 3, 'hidden_dim_0': 256, 'hidden_dim_1': 1024, 'hidden_dim_2': 64, 'kl_weight': 0.00015785616875269368, 'lr': 0.00724500697781114, 'batch_size': 128, 'dropout_rate': 0.07515084663551824, 'prior_mu': 0.010961301190862908, 'prior_sigma': 0.09214947230301007, 'normalization': 'layer'}. Best is trial 896 with value: 0.4533553242683411.
Generating morgan_rdkit fingerprints...
Generated fingerprints with 2048 features for 841 molecules
Trial 2414: 5-fold CV loss = 0.4680
[I 2025-08-08 01:00:38,924] Trial 2414 finished with value: 0.46800824999809265 and parameters: {'fp_type': 'morgan_rdkit', 'combined_morgan_radius': 2, 'combined_morgan_nBits': 1024, 'combined_rdkit_maxPath': 7, 'combined_rdkit_nBits': 1024, 'num_hidden_layers': 3, 'hidden_dim_0': 256, 'hidden_dim_1': 1024, 'hidden_dim_2': 64, 'kl_weight': 0.00016877541141710478, 'lr': 0.007306791252551673, 'batch_size': 32, 'dropout_rate': 0.07859908525567735, 'prior_mu': -0.00046570804866818624, 'prior_sigma': 0.09247589824250788, 'normalization': 'layer'}. Best is trial 896 with value: 0.4533553242683411.
Generating rdkit fingerprints...
Generated fingerprints with 512 features for 841 molecules
Trial 2418: 5-fold CV loss = 0.5822
