[I 2025-08-07 17:21:02,087] Trial 251 finished with value: 0.4828583598136902 and parameters: {'fp_type': 'morgan_rdkit', 'combined_morgan_radius': 2, 'combined_morgan_nBits': 512, 'combined_rdkit_maxPath': 7, 'combined_rdkit_nBits': 1024, 'num_hidden_layers': 2, 'hidden_dim_0': 64, 'hidden_dim_1': 64, 'kl_weight': 0.00010039590343554463, 'lr': 0.0030118769127595157, 'batch_size': 32, 'dropout_rate': 0.26505975056113007, 'prior_mu': 0.03873358247250088, 'prior_sigma': 0.02361707698701123, 'normalization': 'layer'}. Best is trial 179 with value: 0.4671938598155975.
Generating morgan_rdkit fingerprints...
Generated fingerprints with 1536 features for 841 molecules
Trial 249: 5-fold CV loss = 0.4818
[I 2025-08-07 17:21:06,811] Trial 249 finished with value: 0.4817659556865692 and parameters: {'fp_type': 'morgan_rdkit', 'combined_morgan_radius': 2, 'combined_morgan_nBits': 512, 'combined_rdkit_maxPath': 7, 'combined_rdkit_nBits': 1024, 'num_hidden_layers': 2, 'hidden_dim_0': 64, 'hidden_dim_1': 512, 'kl_weight': 0.00011715513932341374, 'lr': 0.0030584330646962585, 'batch_size': 32, 'dropout_rate': 0.24184395135678802, 'prior_mu': 0.036348057392142405, 'prior_sigma': 0.02705398179702248, 'normalization': 'layer'}. Best is trial 179 with value: 0.4671938598155975.
Generating morgan_rdkit fingerprints...
Generated fingerprints with 2048 features for 841 molecules
Trial 254: 5-fold CV loss = 0.4870
[I 2025-08-07 17:21:38,489] Trial 254 finished with value: 0.48703192472457885 and parameters: {'fp_type': 'morgan_rdkit', 'combined_morgan_radius': 2, 'combined_morgan_nBits': 1024, 'combined_rdkit_maxPath': 5, 'combined_rdkit_nBits': 1024, 'num_hidden_layers': 2, 'hidden_dim_0': 64, 'hidden_dim_1': 512, 'kl_weight': 0.0001338383121743267, 'lr': 0.0015924864434905947, 'batch_size': 128, 'dropout_rate': 0.22131663351407926, 'prior_mu': 0.00238261495898961, 'prior_sigma': 0.03186219018257542, 'normalization': 'layer'}. Best is trial 179 with value: 0.4671938598155975.
Generating morgan fingerprints...
Generated fingerprints with 1024 features for 841 molecules
Trial 252: 5-fold CV loss = 0.4723
[I 2025-08-07 17:21:47,215] Trial 252 finished with value: 0.4723475992679596 and parameters: {'fp_type': 'morgan_rdkit', 'combined_morgan_radius': 2, 'combined_morgan_nBits': 512, 'combined_rdkit_maxPath': 7, 'combined_rdkit_nBits': 1024, 'num_hidden_layers': 2, 'hidden_dim_0': 64, 'hidden_dim_1': 512, 'kl_weight': 0.0001165784111993517, 'lr': 0.0016262948071061156, 'batch_size': 32, 'dropout_rate': 0.26145627006796734, 'prior_mu': 0.04849091812191349, 'prior_sigma': 0.02345202897107485, 'normalization': 'layer'}. Best is trial 179 with value: 0.4671938598155975.
Generating morgan fingerprints...
Generated fingerprints with 1024 features for 841 molecules
Trial 248: 5-fold CV loss = 0.4775
[I 2025-08-07 17:22:05,641] Trial 248 finished with value: 0.4775311231613159 and parameters: {'fp_type': 'morgan_rdkit', 'combined_morgan_radius': 2, 'combined_morgan_nBits': 512, 'combined_rdkit_maxPath': 7, 'combined_rdkit_nBits': 1024, 'num_hidden_layers': 2, 'hidden_dim_0': 64, 'hidden_dim_1': 512, 'kl_weight': 0.00011450033904257282, 'lr': 0.0030490381194199358, 'batch_size': 32, 'dropout_rate': 0.26623248419388723, 'prior_mu': 0.03454079655588586, 'prior_sigma': 0.027055042154002652, 'normalization': 'layer'}. Best is trial 179 with value: 0.4671938598155975.
Generating morgan_rdkit fingerprints...
Generated fingerprints with 1536 features for 841 molecules
Trial 253: 5-fold CV loss = 0.4857
[I 2025-08-07 17:22:09,811] Trial 253 finished with value: 0.48566156029701235 and parameters: {'fp_type': 'morgan_rdkit', 'combined_morgan_radius': 2, 'combined_morgan_nBits': 512, 'combined_rdkit_maxPath': 7, 'combined_rdkit_nBits': 1024, 'num_hidden_layers': 2, 'hidden_dim_0': 64, 'hidden_dim_1': 512, 'kl_weight': 0.00012306681091799558, 'lr': 0.0027660303958094677, 'batch_size': 32, 'dropout_rate': 0.25427013655142133, 'prior_mu': 0.0025621747203724244, 'prior_sigma': 0.029332874070083743, 'normalization': 'layer'}. Best is trial 179 with value: 0.4671938598155975.
Generating morgan fingerprints...
Generated fingerprints with 1024 features for 841 molecules
Trial 256: 5-fold CV loss = 0.5097
[I 2025-08-07 17:22:17,970] Trial 256 finished with value: 0.509695303440094 and parameters: {'fp_type': 'morgan', 'morgan_only_radius': 2, 'morgan_only_nBits': 1024, 'num_hidden_layers': 2, 'hidden_dim_0': 64, 'hidden_dim_1': 512, 'kl_weight': 0.00010006916856901731, 'lr': 0.0016636781836643995, 'batch_size': 32, 'dropout_rate': 0.2530350285114188, 'prior_mu': 0.050520501542220986, 'prior_sigma': 0.023180478922139012, 'normalization': 'layer'}. Best is trial 179 with value: 0.4671938598155975.
Generating morgan_rdkit fingerprints...
Generated fingerprints with 1536 features for 841 molecules
Trial 258: 5-fold CV loss = 0.5663
[I 2025-08-07 17:22:42,390] Trial 258 finished with value: 0.5663319230079651 and parameters: {'fp_type': 'morgan', 'morgan_only_radius': 2, 'morgan_only_nBits': 1024, 'num_hidden_layers': 2, 'hidden_dim_0': 64, 'hidden_dim_1': 256, 'kl_weight': 0.012615589901778452, 'lr': 0.0016177912769453431, 'batch_size': 32, 'dropout_rate': 0.27925061213300917, 'prior_mu': 0.04978203594330649, 'prior_sigma': 0.022375811328056674, 'normalization': 'layer'}. Best is trial 179 with value: 0.4671938598155975.
Generating morgan_rdkit fingerprints...
Generated fingerprints with 1536 features for 841 molecules
Trial 255: 5-fold CV loss = 0.5408
[I 2025-08-07 17:22:56,753] Trial 255 finished with value: 0.5407955765724182 and parameters: {'fp_type': 'morgan', 'morgan_only_radius': 2, 'morgan_only_nBits': 1024, 'num_hidden_layers': 2, 'hidden_dim_0': 64, 'hidden_dim_1': 512, 'kl_weight': 0.00011594940096582526, 'lr': 0.0002307052943869876, 'batch_size': 32, 'dropout_rate': 0.25518203601359213, 'prior_mu': 0.048497109673831376, 'prior_sigma': 0.023084271171848053, 'normalization': 'layer'}. Best is trial 179 with value: 0.4671938598155975.
Generating morgan_rdkit fingerprints...
Generated fingerprints with 1536 features for 841 molecules
Trial 259: 5-fold CV loss = 0.4789
[I 2025-08-07 17:23:27,825] Trial 259 finished with value: 0.47890894412994384 and parameters: {'fp_type': 'morgan_rdkit', 'combined_morgan_radius': 2, 'combined_morgan_nBits': 512, 'combined_rdkit_maxPath': 7, 'combined_rdkit_nBits': 1024, 'num_hidden_layers': 2, 'hidden_dim_0': 64, 'hidden_dim_1': 512, 'kl_weight': 0.00013413959332822468, 'lr': 0.003418630257370526, 'batch_size': 32, 'dropout_rate': 0.27845388864024573, 'prior_mu': 0.08643225547024495, 'prior_sigma': 0.03264613754931474, 'normalization': 'layer'}. Best is trial 179 with value: 0.4671938598155975.
Generating morgan_rdkit fingerprints...
Generated fingerprints with 1536 features for 841 molecules
Trial 260: 5-fold CV loss = 0.4775
[I 2025-08-07 17:24:01,765] Trial 260 finished with value: 0.47750729918479917 and parameters: {'fp_type': 'morgan_rdkit', 'combined_morgan_radius': 2, 'combined_morgan_nBits': 512, 'combined_rdkit_maxPath': 7, 'combined_rdkit_nBits': 1024, 'num_hidden_layers': 2, 'hidden_dim_0': 64, 'hidden_dim_1': 512, 'kl_weight': 0.00013303278872151236, 'lr': 0.0012890426423163182, 'batch_size': 32, 'dropout_rate': 0.22515298239791537, 'prior_mu': 0.08758404355628828, 'prior_sigma': 0.03216934154677822, 'normalization': 'layer'}. Best is trial 179 with value: 0.4671938598155975.
Generating morgan_rdkit fingerprints...
Generated fingerprints with 1536 features for 841 molecules
Trial 262: 5-fold CV loss = 0.4767
[I 2025-08-07 17:24:32,592] Trial 262 finished with value: 0.4766586422920227 and parameters: {'fp_type': 'morgan_rdkit', 'combined_morgan_radius': 2, 'combined_morgan_nBits': 512, 'combined_rdkit_maxPath': 7, 'combined_rdkit_nBits': 1024, 'num_hidden_layers': 2, 'hidden_dim_0': 64, 'hidden_dim_1': 512, 'kl_weight': 0.00014477121770935513, 'lr': 0.0026793919962272055, 'batch_size': 32, 'dropout_rate': 0.22527241468416875, 'prior_mu': 0.08528495693542958, 'prior_sigma': 0.031017512956763665, 'normalization': 'layer'}. Best is trial 179 with value: 0.4671938598155975.
Generating morgan_rdkit fingerprints...
Generated fingerprints with 1536 features for 841 molecules
Trial 257: 5-fold CV loss = 0.4734
[I 2025-08-07 17:24:40,915] Trial 257 finished with value: 0.47344298362731935 and parameters: {'fp_type': 'morgan_rdkit', 'combined_morgan_radius': 2, 'combined_morgan_nBits': 512, 'combined_rdkit_maxPath': 7, 'combined_rdkit_nBits': 1024, 'num_hidden_layers': 2, 'hidden_dim_0': 64, 'hidden_dim_1': 512, 'kl_weight': 0.00012831442162386145, 'lr': 0.0016144132340490162, 'batch_size': 32, 'dropout_rate': 0.2547541254025222, 'prior_mu': 0.050406363349855356, 'prior_sigma': 0.02204052893376759, 'normalization': 'layer'}. Best is trial 179 with value: 0.4671938598155975.
Generating morgan_rdkit fingerprints...
Generated fingerprints with 2048 features for 841 molecules
Trial 263: 5-fold CV loss = 0.4759
[I 2025-08-07 17:25:04,771] Trial 263 finished with value: 0.4758889973163605 and parameters: {'fp_type': 'morgan_rdkit', 'combined_morgan_radius': 2, 'combined_morgan_nBits': 512, 'combined_rdkit_maxPath': 7, 'combined_rdkit_nBits': 1024, 'num_hidden_layers': 2, 'hidden_dim_0': 64, 'hidden_dim_1': 512, 'kl_weight': 0.00014492553782143527, 'lr': 0.002717355330231453, 'batch_size': 32, 'dropout_rate': 0.24537745812262393, 'prior_mu': 0.018218158394860115, 'prior_sigma': 0.01922284864889561, 'normalization': 'layer'}. Best is trial 179 with value: 0.4671938598155975.
Generating morgan_rdkit fingerprints...
Generated fingerprints with 2048 features for 841 molecules
Trial 261: 5-fold CV loss = 0.5080
[I 2025-08-07 17:25:21,808] Trial 261 finished with value: 0.5080195188522338 and parameters: {'fp_type': 'morgan_rdkit', 'combined_morgan_radius': 2, 'combined_morgan_nBits': 512, 'combined_rdkit_maxPath': 7, 'combined_rdkit_nBits': 1024, 'num_hidden_layers': 2, 'hidden_dim_0': 64, 'hidden_dim_1': 512, 'kl_weight': 0.00014382629467847455, 'lr': 0.003395040539785806, 'batch_size': 32, 'dropout_rate': 0.23224704770367932, 'prior_mu': 0.08544385619989478, 'prior_sigma': 0.12356855338106118, 'normalization': 'layer'}. Best is trial 179 with value: 0.4671938598155975.
Generating morgan_rdkit fingerprints...
Generated fingerprints with 2048 features for 841 molecules
Trial 264: 5-fold CV loss = 0.4789
[I 2025-08-07 17:25:24,782] Trial 264 finished with value: 0.4789002239704132 and parameters: {'fp_type': 'morgan_rdkit', 'combined_morgan_radius': 2, 'combined_morgan_nBits': 512, 'combined_rdkit_maxPath': 7, 'combined_rdkit_nBits': 1024, 'num_hidden_layers': 2, 'hidden_dim_0': 64, 'hidden_dim_1': 128, 'kl_weight': 0.0001142654145497797, 'lr': 0.002002180613024493, 'batch_size': 32, 'dropout_rate': 0.2466133975569552, 'prior_mu': 0.02066394561046355, 'prior_sigma': 0.01914725152818595, 'normalization': 'layer'}. Best is trial 179 with value: 0.4671938598155975.
Generating morgan_rdkit fingerprints...
Generated fingerprints with 1280 features for 841 molecules
Trial 266: 5-fold CV loss = 0.4846
[I 2025-08-07 17:25:50,629] Trial 266 finished with value: 0.48461946845054626 and parameters: {'fp_type': 'morgan_rdkit', 'combined_morgan_radius': 2, 'combined_morgan_nBits': 1024, 'combined_rdkit_maxPath': 7, 'combined_rdkit_nBits': 1024, 'num_hidden_layers': 2, 'hidden_dim_0': 64, 'hidden_dim_1': 128, 'kl_weight': 0.00011375845938721528, 'lr': 0.001362862413599969, 'batch_size': 32, 'dropout_rate': 0.24618997484946728, 'prior_mu': 0.025017472006885512, 'prior_sigma': 0.01865213310971536, 'normalization': 'layer'}. Best is trial 179 with value: 0.4671938598155975.
Generating morgan_rdkit fingerprints...
Generated fingerprints with 1536 features for 841 molecules
Trial 268: 5-fold CV loss = 0.5184
[I 2025-08-07 17:26:08,945] Trial 268 finished with value: 0.5183944284915925 and parameters: {'fp_type': 'morgan_rdkit', 'combined_morgan_radius': 2, 'combined_morgan_nBits': 1024, 'combined_rdkit_maxPath': 8, 'combined_rdkit_nBits': 256, 'num_hidden_layers': 2, 'hidden_dim_0': 64, 'hidden_dim_1': 512, 'kl_weight': 0.00010119410009138995, 'lr': 0.0015406921696718052, 'batch_size': 32, 'dropout_rate': 0.26297572554708104, 'prior_mu': 0.043657879481413364, 'prior_sigma': 0.01889196297485881, 'normalization': 'layer'}. Best is trial 179 with value: 0.4671938598155975.
Generating morgan_rdkit fingerprints...
Generated fingerprints with 1536 features for 841 molecules
Trial 269: 5-fold CV loss = 0.4861
[I 2025-08-07 17:26:45,077] Trial 269 finished with value: 0.4861305594444275 and parameters: {'fp_type': 'morgan_rdkit', 'combined_morgan_radius': 2, 'combined_morgan_nBits': 512, 'combined_rdkit_maxPath': 7, 'combined_rdkit_nBits': 1024, 'num_hidden_layers': 2, 'hidden_dim_0': 64, 'hidden_dim_1': 512, 'kl_weight': 0.00012608548392074246, 'lr': 0.0017490104095237166, 'batch_size': 32, 'dropout_rate': 0.267268883140174, 'prior_mu': 0.029357310079594714, 'prior_sigma': 0.023614614833893016, 'normalization': 'layer'}. Best is trial 179 with value: 0.4671938598155975.
Generating morgan_rdkit fingerprints...
Generated fingerprints with 1536 features for 841 molecules
Trial 267: 5-fold CV loss = 0.4795
[I 2025-08-07 17:26:50,632] Trial 267 finished with value: 0.4794619381427765 and parameters: {'fp_type': 'morgan_rdkit', 'combined_morgan_radius': 2, 'combined_morgan_nBits': 1024, 'combined_rdkit_maxPath': 7, 'combined_rdkit_nBits': 1024, 'num_hidden_layers': 2, 'hidden_dim_0': 64, 'hidden_dim_1': 512, 'kl_weight': 0.00011579851382649728, 'lr': 0.0015013321022314553, 'batch_size': 32, 'dropout_rate': 0.2464023240932854, 'prior_mu': 0.025624921041673403, 'prior_sigma': 0.01879214977683246, 'normalization': 'layer'}. Best is trial 179 with value: 0.4671938598155975.
Generating morgan_rdkit fingerprints...
Generated fingerprints with 1024 features for 841 molecules
Trial 270: 5-fold CV loss = 0.4954
[I 2025-08-07 17:27:05,747] Trial 270 finished with value: 0.4953990638256073 and parameters: {'fp_type': 'morgan_rdkit', 'combined_morgan_radius': 2, 'combined_morgan_nBits': 512, 'combined_rdkit_maxPath': 7, 'combined_rdkit_nBits': 1024, 'num_hidden_layers': 2, 'hidden_dim_0': 64, 'hidden_dim_1': 512, 'kl_weight': 0.0001257730018921755, 'lr': 0.0017983706460642445, 'batch_size': 32, 'dropout_rate': 0.26927898615221224, 'prior_mu': 0.031292824581429554, 'prior_sigma': 0.02460520518392917, 'normalization': 'none'}. Best is trial 179 with value: 0.4671938598155975.
Generating morgan_rdkit fingerprints...
Generated fingerprints with 1024 features for 841 molecules
Trial 265: 5-fold CV loss = 0.4805
[I 2025-08-07 17:27:11,622] Trial 265 finished with value: 0.4805020272731781 and parameters: {'fp_type': 'morgan_rdkit', 'combined_morgan_radius': 2, 'combined_morgan_nBits': 1024, 'combined_rdkit_maxPath': 7, 'combined_rdkit_nBits': 1024, 'num_hidden_layers': 2, 'hidden_dim_0': 64, 'hidden_dim_1': 512, 'kl_weight': 0.00011403188490737737, 'lr': 0.001893371692501751, 'batch_size': 32, 'dropout_rate': 0.23483703961663713, 'prior_mu': 0.055163279006014254, 'prior_sigma': 0.020046159510562656, 'normalization': 'layer'}. Best is trial 179 with value: 0.4671938598155975.
Generating morgan_rdkit fingerprints...
Generated fingerprints with 1024 features for 841 molecules
Trial 271: 5-fold CV loss = 0.5028
[I 2025-08-07 17:27:38,585] Trial 271 finished with value: 0.5028347253799439 and parameters: {'fp_type': 'morgan_rdkit', 'combined_morgan_radius': 2, 'combined_morgan_nBits': 512, 'combined_rdkit_maxPath': 7, 'combined_rdkit_nBits': 1024, 'num_hidden_layers': 2, 'hidden_dim_0': 64, 'hidden_dim_1': 512, 'kl_weight': 0.00013069718701868267, 'lr': 0.002464596406741043, 'batch_size': 32, 'dropout_rate': 0.2376521608801749, 'prior_mu': 0.04131703048221254, 'prior_sigma': 0.02601748042497524, 'normalization': 'none'}. Best is trial 179 with value: 0.4671938598155975.
Generating morgan_rdkit fingerprints...
Generated fingerprints with 1024 features for 841 molecules
Trial 273: 5-fold CV loss = 0.5074
[I 2025-08-07 17:27:54,324] Trial 273 finished with value: 0.5074306309223175 and parameters: {'fp_type': 'morgan_rdkit', 'combined_morgan_radius': 2, 'combined_morgan_nBits': 512, 'combined_rdkit_maxPath': 7, 'combined_rdkit_nBits': 512, 'num_hidden_layers': 2, 'hidden_dim_0': 64, 'hidden_dim_1': 512, 'kl_weight': 0.00014956682865994203, 'lr': 0.0023990643082561604, 'batch_size': 32, 'dropout_rate': 0.2343834585874569, 'prior_mu': 0.055216787894814184, 'prior_sigma': 0.01408841476246829, 'normalization': 'layer'}. Best is trial 179 with value: 0.4671938598155975.
Generating morgan_rdkit fingerprints...
Generated fingerprints with 1536 features for 841 molecules
Trial 272: 5-fold CV loss = 0.5204
[I 2025-08-07 17:28:00,499] Trial 272 finished with value: 0.5203507602214813 and parameters: {'fp_type': 'morgan_rdkit', 'combined_morgan_radius': 2, 'combined_morgan_nBits': 512, 'combined_rdkit_maxPath': 7, 'combined_rdkit_nBits': 512, 'num_hidden_layers': 2, 'hidden_dim_0': 1024, 'hidden_dim_1': 512, 'kl_weight': 0.00013082756873258015, 'lr': 0.0011302190637640162, 'batch_size': 32, 'dropout_rate': 0.2365749218332998, 'prior_mu': -0.010734835916780382, 'prior_sigma': 0.025667550516992203, 'normalization': 'none'}. Best is trial 179 with value: 0.4671938598155975.
Generating morgan_rdkit fingerprints...
Generated fingerprints with 1536 features for 841 molecules
Trial 275: 5-fold CV loss = 0.5024
[I 2025-08-07 17:28:01,801] Trial 275 finished with value: 0.5023677110671997 and parameters: {'fp_type': 'morgan_rdkit', 'combined_morgan_radius': 2, 'combined_morgan_nBits': 512, 'combined_rdkit_maxPath': 7, 'combined_rdkit_nBits': 512, 'num_hidden_layers': 2, 'hidden_dim_0': 64, 'hidden_dim_1': 512, 'kl_weight': 0.00015347135122380164, 'lr': 0.002252013555721685, 'batch_size': 128, 'dropout_rate': 0.25520482933643857, 'prior_mu': 0.045508501146038126, 'prior_sigma': 0.013175864255005854, 'normalization': 'layer'}. Best is trial 179 with value: 0.4671938598155975.
Generating morgan_rdkit fingerprints...
Generated fingerprints with 1536 features for 841 molecules
Trial 277: 5-fold CV loss = 0.4819
[I 2025-08-07 17:28:39,242] Trial 277 finished with value: 0.48192085027694703 and parameters: {'fp_type': 'morgan_rdkit', 'combined_morgan_radius': 2, 'combined_morgan_nBits': 512, 'combined_rdkit_maxPath': 7, 'combined_rdkit_nBits': 1024, 'num_hidden_layers': 2, 'hidden_dim_0': 64, 'hidden_dim_1': 512, 'kl_weight': 0.00014802664703422307, 'lr': 0.002139444102038234, 'batch_size': 128, 'dropout_rate': 0.25729797299965534, 'prior_mu': 0.04037514562308944, 'prior_sigma': 0.028415377889165337, 'normalization': 'layer'}. Best is trial 179 with value: 0.4671938598155975.
Generating morgan_rdkit fingerprints...
Generated fingerprints with 1536 features for 841 molecules
Trial 276: 5-fold CV loss = 0.4805
[I 2025-08-07 17:28:58,260] Trial 276 finished with value: 0.4805258572101593 and parameters: {'fp_type': 'morgan_rdkit', 'combined_morgan_radius': 2, 'combined_morgan_nBits': 512, 'combined_rdkit_maxPath': 7, 'combined_rdkit_nBits': 1024, 'num_hidden_layers': 2, 'hidden_dim_0': 1024, 'hidden_dim_1': 512, 'kl_weight': 0.00010035572717637255, 'lr': 0.002153687303650748, 'batch_size': 32, 'dropout_rate': 0.256998604209057, 'prior_mu': 0.043136957445918944, 'prior_sigma': 0.02912437640173183, 'normalization': 'layer'}. Best is trial 179 with value: 0.4671938598155975.
Generating morgan_rdkit fingerprints...
Generated fingerprints with 1536 features for 841 molecules
Trial 278: 5-fold CV loss = 0.4757
[I 2025-08-07 17:29:09,209] Trial 278 finished with value: 0.4757268726825714 and parameters: {'fp_type': 'morgan_rdkit', 'combined_morgan_radius': 2, 'combined_morgan_nBits': 512, 'combined_rdkit_maxPath': 7, 'combined_rdkit_nBits': 1024, 'num_hidden_layers': 2, 'hidden_dim_0': 64, 'hidden_dim_1': 512, 'kl_weight': 0.0001013317022281923, 'lr': 0.0020420866742195936, 'batch_size': 32, 'dropout_rate': 0.27875982412378325, 'prior_mu': 0.05565666973319856, 'prior_sigma': 0.02222542605267816, 'normalization': 'layer'}. Best is trial 179 with value: 0.4671938598155975.
Generating morgan_rdkit fingerprints...
Generated fingerprints with 1536 features for 841 molecules
Trial 274: 5-fold CV loss = 0.5065
[I 2025-08-07 17:29:52,165] Trial 274 finished with value: 0.506541520357132 and parameters: {'fp_type': 'morgan_rdkit', 'combined_morgan_radius': 2, 'combined_morgan_nBits': 512, 'combined_rdkit_maxPath': 7, 'combined_rdkit_nBits': 512, 'num_hidden_layers': 2, 'hidden_dim_0': 64, 'hidden_dim_1': 512, 'kl_weight': 0.00014948025202181483, 'lr': 0.0024223443146093706, 'batch_size': 32, 'dropout_rate': 0.38563241854633024, 'prior_mu': 0.04357600302488306, 'prior_sigma': 0.013784120987644963, 'normalization': 'layer'}. Best is trial 179 with value: 0.4671938598155975.
Generating morgan_rdkit fingerprints...
Generated fingerprints with 1536 features for 841 molecules
Trial 279: 5-fold CV loss = 0.4755
[I 2025-08-07 17:29:59,590] Trial 279 finished with value: 0.4755358278751373 and parameters: {'fp_type': 'morgan_rdkit', 'combined_morgan_radius': 2, 'combined_morgan_nBits': 512, 'combined_rdkit_maxPath': 7, 'combined_rdkit_nBits': 1024, 'num_hidden_layers': 2, 'hidden_dim_0': 512, 'hidden_dim_1': 512, 'kl_weight': 0.00010177069578664642, 'lr': 0.0027627368390848077, 'batch_size': 32, 'dropout_rate': 0.27996027013118496, 'prior_mu': 0.014447938320363347, 'prior_sigma': 0.021243252399086986, 'normalization': 'layer'}. Best is trial 179 with value: 0.4671938598155975.
Generating morgan_rdkit fingerprints...
Generated fingerprints with 1536 features for 841 molecules
Trial 281: 5-fold CV loss = 0.4910
