[I 2025-08-07 16:39:11,240] Trial 127 finished with value: 0.4942063748836517 and parameters: {'fp_type': 'morgan_rdkit', 'combined_morgan_radius': 2, 'combined_morgan_nBits': 512, 'combined_rdkit_maxPath': 7, 'combined_rdkit_nBits': 1024, 'num_hidden_layers': 2, 'hidden_dim_0': 256, 'hidden_dim_1': 512, 'kl_weight': 0.00020087535060351038, 'lr': 0.004816756709900637, 'batch_size': 32, 'dropout_rate': 0.04776660902248474, 'prior_mu': 0.08301208911233093, 'prior_sigma': 0.03279892722520157, 'normalization': 'layer'}. Best is trial 116 with value: 0.47160428762435913.
Generating morgan_rdkit fingerprints...
Generated fingerprints with 2048 features for 841 molecules
Trial 129: 5-fold CV loss = 0.4797
[I 2025-08-07 16:39:47,378] Trial 129 finished with value: 0.47968819737434387 and parameters: {'fp_type': 'morgan_rdkit', 'combined_morgan_radius': 2, 'combined_morgan_nBits': 1024, 'combined_rdkit_maxPath': 7, 'combined_rdkit_nBits': 1024, 'num_hidden_layers': 2, 'hidden_dim_0': 1024, 'hidden_dim_1': 512, 'kl_weight': 0.000163492057811712, 'lr': 0.0030677229089330228, 'batch_size': 32, 'dropout_rate': 0.1209020347883669, 'prior_mu': 0.04237495857122731, 'prior_sigma': 0.01718094770412307, 'normalization': 'layer'}. Best is trial 116 with value: 0.47160428762435913.
Generating rdkit fingerprints...
Generated fingerprints with 1024 features for 841 molecules
Trial 128: 5-fold CV loss = 0.4855
[I 2025-08-07 16:39:57,984] Trial 128 finished with value: 0.4855427026748657 and parameters: {'fp_type': 'morgan_rdkit', 'combined_morgan_radius': 2, 'combined_morgan_nBits': 1024, 'combined_rdkit_maxPath': 7, 'combined_rdkit_nBits': 1024, 'num_hidden_layers': 2, 'hidden_dim_0': 1024, 'hidden_dim_1': 512, 'kl_weight': 0.0001604133231702847, 'lr': 0.003032128583420704, 'batch_size': 32, 'dropout_rate': 0.04908946033259518, 'prior_mu': 0.0757631389307047, 'prior_sigma': 0.015365072906961751, 'normalization': 'layer'}. Best is trial 116 with value: 0.47160428762435913.
Generating rdkit fingerprints...
Generated fingerprints with 1024 features for 841 molecules
Trial 131: 5-fold CV loss = 0.7007
[I 2025-08-07 16:40:19,051] Trial 131 finished with value: 0.7006587624549866 and parameters: {'fp_type': 'rdkit', 'rdkit_only_maxPath': 8, 'rdkit_only_nBits': 1024, 'num_hidden_layers': 2, 'hidden_dim_0': 256, 'hidden_dim_1': 128, 'kl_weight': 0.0003186494373311704, 'lr': 0.002650561225764156, 'batch_size': 128, 'dropout_rate': 0.032107098359822436, 'prior_mu': 0.03691863520782894, 'prior_sigma': 0.04757680593810605, 'normalization': 'none'}. Best is trial 116 with value: 0.47160428762435913.
Generating morgan_rdkit fingerprints...
Generated fingerprints with 768 features for 841 molecules
Trial 125: 5-fold CV loss = 0.5702
[I 2025-08-07 16:40:40,206] Trial 125 finished with value: 0.5701522529125214 and parameters: {'fp_type': 'morgan_rdkit', 'combined_morgan_radius': 2, 'combined_morgan_nBits': 512, 'combined_rdkit_maxPath': 7, 'combined_rdkit_nBits': 1024, 'num_hidden_layers': 2, 'hidden_dim_0': 256, 'hidden_dim_1': 512, 'kl_weight': 0.00011831029856758633, 'lr': 0.0029986875704108456, 'batch_size': 32, 'dropout_rate': 0.06572717788527802, 'prior_mu': 0.03943572131942219, 'prior_sigma': 0.1965607821487561, 'normalization': 'layer'}. Best is trial 116 with value: 0.47160428762435913.
Generating morgan_rdkit fingerprints...
Generated fingerprints with 768 features for 841 molecules
Trial 119: 5-fold CV loss = 0.5999
[I 2025-08-07 16:40:54,428] Trial 119 finished with value: 0.5998862683773041 and parameters: {'fp_type': 'morgan_rdkit', 'combined_morgan_radius': 2, 'combined_morgan_nBits': 512, 'combined_rdkit_maxPath': 7, 'combined_rdkit_nBits': 1024, 'num_hidden_layers': 2, 'hidden_dim_0': 256, 'hidden_dim_1': 512, 'kl_weight': 0.007965120847031635, 'lr': 0.0034557288360537765, 'batch_size': 32, 'dropout_rate': 0.11417870257826354, 'prior_mu': 0.055490968015807246, 'prior_sigma': 0.19001265057889144, 'normalization': 'layer'}. Best is trial 116 with value: 0.47160428762435913.
Generating morgan_rdkit fingerprints...
Generated fingerprints with 1536 features for 841 molecules
Trial 132: 5-fold CV loss = 0.5275
[I 2025-08-07 16:41:08,195] Trial 132 finished with value: 0.5275301337242126 and parameters: {'fp_type': 'morgan_rdkit', 'combined_morgan_radius': 2, 'combined_morgan_nBits': 512, 'combined_rdkit_maxPath': 6, 'combined_rdkit_nBits': 256, 'num_hidden_layers': 2, 'hidden_dim_0': 256, 'hidden_dim_1': 512, 'kl_weight': 0.00013206242215392118, 'lr': 0.0033807112876875593, 'batch_size': 32, 'dropout_rate': 0.06166811617515545, 'prior_mu': 0.05328542367173021, 'prior_sigma': 0.04032751697421234, 'normalization': 'layer'}. Best is trial 116 with value: 0.47160428762435913.
Generating morgan_rdkit fingerprints...
Generated fingerprints with 1536 features for 841 molecules
Trial 135: 5-fold CV loss = 0.4840
[I 2025-08-07 16:41:46,555] Trial 135 finished with value: 0.48404611349105836 and parameters: {'fp_type': 'morgan_rdkit', 'combined_morgan_radius': 2, 'combined_morgan_nBits': 512, 'combined_rdkit_maxPath': 7, 'combined_rdkit_nBits': 1024, 'num_hidden_layers': 2, 'hidden_dim_0': 256, 'hidden_dim_1': 512, 'kl_weight': 0.00014629640796179629, 'lr': 0.0027429563340408735, 'batch_size': 32, 'dropout_rate': 0.07992893391091815, 'prior_mu': -0.04090042022967012, 'prior_sigma': 0.010030194737278736, 'normalization': 'layer'}. Best is trial 116 with value: 0.47160428762435913.
Generating morgan_rdkit fingerprints...
Generated fingerprints with 1536 features for 841 molecules
Trial 130: 5-fold CV loss = 0.6139
[I 2025-08-07 16:41:54,531] Trial 130 finished with value: 0.6139393746852875 and parameters: {'fp_type': 'rdkit', 'rdkit_only_maxPath': 8, 'rdkit_only_nBits': 1024, 'num_hidden_layers': 2, 'hidden_dim_0': 256, 'hidden_dim_1': 128, 'kl_weight': 0.00013581821669686494, 'lr': 0.0027794568900137108, 'batch_size': 32, 'dropout_rate': 0.09053192882359355, 'prior_mu': 0.037235556940133405, 'prior_sigma': 0.18555451399006628, 'normalization': 'layer'}. Best is trial 116 with value: 0.47160428762435913.
Generating morgan_rdkit fingerprints...
Generated fingerprints with 1536 features for 841 molecules
Trial 136: 5-fold CV loss = 0.4811
[I 2025-08-07 16:42:29,452] Trial 136 finished with value: 0.4810727834701538 and parameters: {'fp_type': 'morgan_rdkit', 'combined_morgan_radius': 2, 'combined_morgan_nBits': 512, 'combined_rdkit_maxPath': 7, 'combined_rdkit_nBits': 1024, 'num_hidden_layers': 2, 'hidden_dim_0': 256, 'hidden_dim_1': 512, 'kl_weight': 0.0001554684445442456, 'lr': 0.003283901448474236, 'batch_size': 32, 'dropout_rate': 0.08625293470476778, 'prior_mu': 0.02774180900059142, 'prior_sigma': 0.014034515367918927, 'normalization': 'layer'}. Best is trial 116 with value: 0.47160428762435913.
Generating morgan_rdkit fingerprints...
Generated fingerprints with 1536 features for 841 molecules
Trial 133: 5-fold CV loss = 0.5292
[I 2025-08-07 16:43:01,324] Trial 133 finished with value: 0.529185950756073 and parameters: {'fp_type': 'morgan_rdkit', 'combined_morgan_radius': 2, 'combined_morgan_nBits': 512, 'combined_rdkit_maxPath': 6, 'combined_rdkit_nBits': 256, 'num_hidden_layers': 2, 'hidden_dim_0': 256, 'hidden_dim_1': 512, 'kl_weight': 0.0002635126310854364, 'lr': 0.003422948422620959, 'batch_size': 32, 'dropout_rate': 0.09395336310931438, 'prior_mu': 0.056005176199808576, 'prior_sigma': 0.13488187453286493, 'normalization': 'layer'}. Best is trial 116 with value: 0.47160428762435913.
Generating morgan_rdkit fingerprints...
Generated fingerprints with 1536 features for 841 molecules
Trial 137: 5-fold CV loss = 0.5894
[I 2025-08-07 16:43:15,239] Trial 137 finished with value: 0.5894395351409912 and parameters: {'fp_type': 'morgan_rdkit', 'combined_morgan_radius': 2, 'combined_morgan_nBits': 512, 'combined_rdkit_maxPath': 7, 'combined_rdkit_nBits': 1024, 'num_hidden_layers': 2, 'hidden_dim_0': 256, 'hidden_dim_1': 512, 'kl_weight': 0.09059624564631483, 'lr': 0.004107108312863985, 'batch_size': 32, 'dropout_rate': 0.08408816457667855, 'prior_mu': -0.07491382978345547, 'prior_sigma': 0.013143106304175102, 'normalization': 'layer'}. Best is trial 116 with value: 0.47160428762435913.
Generating morgan_rdkit fingerprints...
Generated fingerprints with 1536 features for 841 molecules
Trial 138: 5-fold CV loss = 0.4895
[I 2025-08-07 16:43:24,009] Trial 138 finished with value: 0.4894700527191162 and parameters: {'fp_type': 'morgan_rdkit', 'combined_morgan_radius': 2, 'combined_morgan_nBits': 512, 'combined_rdkit_maxPath': 7, 'combined_rdkit_nBits': 1024, 'num_hidden_layers': 2, 'hidden_dim_0': 256, 'hidden_dim_1': 512, 'kl_weight': 0.000163656374700013, 'lr': 0.00402837024405177, 'batch_size': 32, 'dropout_rate': 0.10202801190121655, 'prior_mu': 0.11924659296476581, 'prior_sigma': 0.02272926051339536, 'normalization': 'layer'}. Best is trial 116 with value: 0.47160428762435913.
Generating morgan_rdkit fingerprints...
Generated fingerprints with 1536 features for 841 molecules
Trial 134: 5-fold CV loss = 0.4789
[I 2025-08-07 16:43:40,388] Trial 134 finished with value: 0.47888439893722534 and parameters: {'fp_type': 'morgan_rdkit', 'combined_morgan_radius': 2, 'combined_morgan_nBits': 512, 'combined_rdkit_maxPath': 7, 'combined_rdkit_nBits': 1024, 'num_hidden_layers': 2, 'hidden_dim_0': 256, 'hidden_dim_1': 512, 'kl_weight': 0.00015096650858035452, 'lr': 0.0032776911828871626, 'batch_size': 32, 'dropout_rate': 0.08454735857557999, 'prior_mu': 0.028748352150299326, 'prior_sigma': 0.022661587002027903, 'normalization': 'layer'}. Best is trial 116 with value: 0.47160428762435913.
Generating morgan_rdkit fingerprints...
Generated fingerprints with 1536 features for 841 molecules
Trial 140: 5-fold CV loss = 0.4891
[I 2025-08-07 16:43:57,264] Trial 140 finished with value: 0.4890863001346588 and parameters: {'fp_type': 'morgan_rdkit', 'combined_morgan_radius': 2, 'combined_morgan_nBits': 512, 'combined_rdkit_maxPath': 7, 'combined_rdkit_nBits': 1024, 'num_hidden_layers': 2, 'hidden_dim_0': 64, 'hidden_dim_1': 512, 'kl_weight': 0.00011269682779936872, 'lr': 0.006669956016590285, 'batch_size': 32, 'dropout_rate': 0.10773639197328408, 'prior_mu': -0.020308337340209794, 'prior_sigma': 0.021625276216095685, 'normalization': 'layer'}. Best is trial 116 with value: 0.47160428762435913.
Generating morgan_rdkit fingerprints...
Generated fingerprints with 1536 features for 841 molecules
Trial 139: 5-fold CV loss = 0.4834
[I 2025-08-07 16:44:25,784] Trial 139 finished with value: 0.48338841199874877 and parameters: {'fp_type': 'morgan_rdkit', 'combined_morgan_radius': 2, 'combined_morgan_nBits': 512, 'combined_rdkit_maxPath': 7, 'combined_rdkit_nBits': 1024, 'num_hidden_layers': 2, 'hidden_dim_0': 256, 'hidden_dim_1': 512, 'kl_weight': 0.00017291903003470262, 'lr': 0.004030261369402183, 'batch_size': 32, 'dropout_rate': 0.10094201824059479, 'prior_mu': -0.007107071148545786, 'prior_sigma': 0.022460350787988158, 'normalization': 'layer'}. Best is trial 116 with value: 0.47160428762435913.
Generating morgan_rdkit fingerprints...
Generated fingerprints with 1536 features for 841 molecules
Trial 141: 5-fold CV loss = 0.4756
[I 2025-08-07 16:44:34,649] Trial 141 finished with value: 0.475649756193161 and parameters: {'fp_type': 'morgan_rdkit', 'combined_morgan_radius': 2, 'combined_morgan_nBits': 512, 'combined_rdkit_maxPath': 7, 'combined_rdkit_nBits': 1024, 'num_hidden_layers': 2, 'hidden_dim_0': 64, 'hidden_dim_1': 512, 'kl_weight': 0.0001136764973450846, 'lr': 0.0022437286354139506, 'batch_size': 32, 'dropout_rate': 0.24708490686031237, 'prior_mu': -0.0035253557073178336, 'prior_sigma': 0.028795727979885208, 'normalization': 'layer'}. Best is trial 116 with value: 0.47160428762435913.
Generating morgan_rdkit fingerprints...
Generated fingerprints with 1536 features for 841 molecules
Trial 143: 5-fold CV loss = 1.0568
[I 2025-08-07 16:44:40,919] Trial 143 finished with value: 1.0568235635757446 and parameters: {'fp_type': 'morgan_rdkit', 'combined_morgan_radius': 2, 'combined_morgan_nBits': 512, 'combined_rdkit_maxPath': 7, 'combined_rdkit_nBits': 1024, 'num_hidden_layers': 2, 'hidden_dim_0': 512, 'hidden_dim_1': 512, 'kl_weight': 0.00021841169859768733, 'lr': 0.00010037000727273775, 'batch_size': 32, 'dropout_rate': 0.03823215106832133, 'prior_mu': 0.08710747305886046, 'prior_sigma': 0.14723720664730194, 'normalization': 'layer'}. Best is trial 116 with value: 0.47160428762435913.
Generating morgan_rdkit fingerprints...
Generated fingerprints with 1536 features for 841 molecules
Trial 145: 5-fold CV loss = 0.4810
[I 2025-08-07 16:45:38,613] Trial 145 finished with value: 0.4809949159622192 and parameters: {'fp_type': 'morgan_rdkit', 'combined_morgan_radius': 2, 'combined_morgan_nBits': 512, 'combined_rdkit_maxPath': 7, 'combined_rdkit_nBits': 1024, 'num_hidden_layers': 2, 'hidden_dim_0': 64, 'hidden_dim_1': 512, 'kl_weight': 0.00011072799321678887, 'lr': 0.0021619515938128015, 'batch_size': 32, 'dropout_rate': 0.24842964366355988, 'prior_mu': 0.06710088939584238, 'prior_sigma': 0.029280965400598775, 'normalization': 'layer'}. Best is trial 116 with value: 0.47160428762435913.
Generating morgan_rdkit fingerprints...
Generated fingerprints with 1536 features for 841 molecules
Trial 146: 5-fold CV loss = 0.4730
[I 2025-08-07 16:45:54,038] Trial 146 finished with value: 0.4729857385158539 and parameters: {'fp_type': 'morgan_rdkit', 'combined_morgan_radius': 2, 'combined_morgan_nBits': 512, 'combined_rdkit_maxPath': 7, 'combined_rdkit_nBits': 1024, 'num_hidden_layers': 2, 'hidden_dim_0': 64, 'hidden_dim_1': 512, 'kl_weight': 0.0001304703036322353, 'lr': 0.0022366771608602148, 'batch_size': 32, 'dropout_rate': 0.23532817993061442, 'prior_mu': 0.06914096110888703, 'prior_sigma': 0.03490956962444046, 'normalization': 'layer'}. Best is trial 116 with value: 0.47160428762435913.
Generating morgan_rdkit fingerprints...
Generated fingerprints with 1536 features for 841 molecules
Trial 144: 5-fold CV loss = 0.4770
[I 2025-08-07 16:45:58,354] Trial 144 finished with value: 0.47699795961380004 and parameters: {'fp_type': 'morgan_rdkit', 'combined_morgan_radius': 2, 'combined_morgan_nBits': 512, 'combined_rdkit_maxPath': 7, 'combined_rdkit_nBits': 1024, 'num_hidden_layers': 2, 'hidden_dim_0': 256, 'hidden_dim_1': 512, 'kl_weight': 0.0001361895844109865, 'lr': 0.0026134773136194554, 'batch_size': 32, 'dropout_rate': 0.13496339570359905, 'prior_mu': 0.06708684496656614, 'prior_sigma': 0.02925838640890074, 'normalization': 'layer'}. Best is trial 116 with value: 0.47160428762435913.
Generating morgan_rdkit fingerprints...
Generated fingerprints with 1536 features for 841 molecules
Trial 148: 5-fold CV loss = 0.4789
[I 2025-08-07 16:46:54,806] Trial 148 finished with value: 0.4789186239242554 and parameters: {'fp_type': 'morgan_rdkit', 'combined_morgan_radius': 2, 'combined_morgan_nBits': 512, 'combined_rdkit_maxPath': 7, 'combined_rdkit_nBits': 1024, 'num_hidden_layers': 2, 'hidden_dim_0': 64, 'hidden_dim_1': 512, 'kl_weight': 0.0001305407227846301, 'lr': 0.0018762317459856495, 'batch_size': 32, 'dropout_rate': 0.24314391467126903, 'prior_mu': 0.09661010355524009, 'prior_sigma': 0.03613836129940359, 'normalization': 'layer'}. Best is trial 116 with value: 0.47160428762435913.
Generating morgan_rdkit fingerprints...
Generated fingerprints with 1536 features for 841 molecules
Trial 147: 5-fold CV loss = 0.4727
[I 2025-08-07 16:46:56,475] Trial 147 finished with value: 0.4727389872074127 and parameters: {'fp_type': 'morgan_rdkit', 'combined_morgan_radius': 2, 'combined_morgan_nBits': 512, 'combined_rdkit_maxPath': 7, 'combined_rdkit_nBits': 1024, 'num_hidden_layers': 2, 'hidden_dim_0': 64, 'hidden_dim_1': 512, 'kl_weight': 0.00013591804515233335, 'lr': 0.0019500985364854628, 'batch_size': 32, 'dropout_rate': 0.24719531994689053, 'prior_mu': 0.07258748583536963, 'prior_sigma': 0.03656838696129163, 'normalization': 'layer'}. Best is trial 116 with value: 0.47160428762435913.
Generating morgan_rdkit fingerprints...
Generated fingerprints with 1536 features for 841 molecules
Trial 149: 5-fold CV loss = 0.4791
[I 2025-08-07 16:47:41,307] Trial 149 finished with value: 0.479063481092453 and parameters: {'fp_type': 'morgan_rdkit', 'combined_morgan_radius': 2, 'combined_morgan_nBits': 512, 'combined_rdkit_maxPath': 7, 'combined_rdkit_nBits': 1024, 'num_hidden_layers': 2, 'hidden_dim_0': 64, 'hidden_dim_1': 512, 'kl_weight': 0.00013832601310697783, 'lr': 0.0019910156163401604, 'batch_size': 32, 'dropout_rate': 0.14139126976675725, 'prior_mu': 0.07668018049539296, 'prior_sigma': 0.035260373432219785, 'normalization': 'layer'}. Best is trial 116 with value: 0.47160428762435913.
Generating morgan_rdkit fingerprints...
Generated fingerprints with 1536 features for 841 molecules
Trial 142: 5-fold CV loss = 0.5405
[I 2025-08-07 16:47:55,948] Trial 142 finished with value: 0.540494966506958 and parameters: {'fp_type': 'morgan_rdkit', 'combined_morgan_radius': 2, 'combined_morgan_nBits': 512, 'combined_rdkit_maxPath': 7, 'combined_rdkit_nBits': 1024, 'num_hidden_layers': 2, 'hidden_dim_0': 64, 'hidden_dim_1': 512, 'kl_weight': 0.00011490705791693282, 'lr': 0.00010652858425975296, 'batch_size': 32, 'dropout_rate': 0.13629855670466418, 'prior_mu': -0.004106198657191404, 'prior_sigma': 0.03405167065153679, 'normalization': 'layer'}. Best is trial 116 with value: 0.47160428762435913.
Generating morgan_rdkit fingerprints...
Generated fingerprints with 1536 features for 841 molecules
Trial 150: 5-fold CV loss = 0.4916
[I 2025-08-07 16:47:57,112] Trial 150 finished with value: 0.49156638979911804 and parameters: {'fp_type': 'morgan_rdkit', 'combined_morgan_radius': 2, 'combined_morgan_nBits': 512, 'combined_rdkit_maxPath': 7, 'combined_rdkit_nBits': 1024, 'num_hidden_layers': 2, 'hidden_dim_0': 64, 'hidden_dim_1': 512, 'kl_weight': 0.00010108493218339827, 'lr': 0.002355588511811915, 'batch_size': 32, 'dropout_rate': 0.13013395402334435, 'prior_mu': 0.07839297462954974, 'prior_sigma': 0.03372315325006624, 'normalization': 'layer'}. Best is trial 116 with value: 0.47160428762435913.
Generating morgan_rdkit fingerprints...
Generated fingerprints with 1536 features for 841 molecules
Trial 151: 5-fold CV loss = 0.4789
[I 2025-08-07 16:48:17,473] Trial 151 finished with value: 0.4789034307003021 and parameters: {'fp_type': 'morgan_rdkit', 'combined_morgan_radius': 2, 'combined_morgan_nBits': 512, 'combined_rdkit_maxPath': 7, 'combined_rdkit_nBits': 1024, 'num_hidden_layers': 2, 'hidden_dim_0': 64, 'hidden_dim_1': 512, 'kl_weight': 0.00010200564126313103, 'lr': 0.0015876523896010994, 'batch_size': 32, 'dropout_rate': 0.13817252764893587, 'prior_mu': 0.07437071099304703, 'prior_sigma': 0.046939425654777385, 'normalization': 'layer'}. Best is trial 116 with value: 0.47160428762435913.
Generating morgan_rdkit fingerprints...
Generated fingerprints with 1536 features for 841 molecules
Trial 154: 5-fold CV loss = 0.4794
[I 2025-08-07 16:48:50,668] Trial 154 finished with value: 0.4794302821159363 and parameters: {'fp_type': 'morgan_rdkit', 'combined_morgan_radius': 2, 'combined_morgan_nBits': 512, 'combined_rdkit_maxPath': 7, 'combined_rdkit_nBits': 1024, 'num_hidden_layers': 2, 'hidden_dim_0': 64, 'hidden_dim_1': 512, 'kl_weight': 0.00018121679176424298, 'lr': 0.002578492671209458, 'batch_size': 32, 'dropout_rate': 0.2302455488902434, 'prior_mu': 0.06869087478631358, 'prior_sigma': 0.027939469285812785, 'normalization': 'layer'}. Best is trial 116 with value: 0.47160428762435913.
Generating morgan_rdkit fingerprints...
Generated fingerprints with 1536 features for 841 molecules
Trial 152: 5-fold CV loss = 0.4844
[I 2025-08-07 16:49:39,186] Trial 152 finished with value: 0.4843511044979095 and parameters: {'fp_type': 'morgan_rdkit', 'combined_morgan_radius': 2, 'combined_morgan_nBits': 512, 'combined_rdkit_maxPath': 7, 'combined_rdkit_nBits': 1024, 'num_hidden_layers': 2, 'hidden_dim_0': 64, 'hidden_dim_1': 512, 'kl_weight': 0.00010135861807186714, 'lr': 0.0015838042922778175, 'batch_size': 32, 'dropout_rate': 0.22688056330301046, 'prior_mu': 0.07033132137522514, 'prior_sigma': 0.04746859903322602, 'normalization': 'layer'}. Best is trial 116 with value: 0.47160428762435913.
Generating morgan fingerprints...
Generated fingerprints with 2048 features for 841 molecules
Trial 155: 5-fold CV loss = 0.4826
[I 2025-08-07 16:49:39,867] Trial 155 finished with value: 0.4825688123703003 and parameters: {'fp_type': 'morgan_rdkit', 'combined_morgan_radius': 2, 'combined_morgan_nBits': 512, 'combined_rdkit_maxPath': 7, 'combined_rdkit_nBits': 1024, 'num_hidden_layers': 2, 'hidden_dim_0': 64, 'hidden_dim_1': 512, 'kl_weight': 0.00018716367774546084, 'lr': 0.0021468916955147384, 'batch_size': 32, 'dropout_rate': 0.2593127041797927, 'prior_mu': 0.08728127559721183, 'prior_sigma': 0.04012926568528705, 'normalization': 'layer'}. Best is trial 116 with value: 0.47160428762435913.
Generating morgan_rdkit fingerprints...
Generated fingerprints with 1536 features for 841 molecules
Trial 156: 5-fold CV loss = 0.4769
[I 2025-08-07 16:49:53,625] Trial 156 finished with value: 0.4769191324710846 and parameters: {'fp_type': 'morgan_rdkit', 'combined_morgan_radius': 2, 'combined_morgan_nBits': 512, 'combined_rdkit_maxPath': 7, 'combined_rdkit_nBits': 1024, 'num_hidden_layers': 2, 'hidden_dim_0': 64, 'hidden_dim_1': 512, 'kl_weight': 0.0001313933784567318, 'lr': 0.0021842339619383144, 'batch_size': 32, 'dropout_rate': 0.28981019761744, 'prior_mu': 0.06402828809590669, 'prior_sigma': 0.029729518340369465, 'normalization': 'layer'}. Best is trial 116 with value: 0.47160428762435913.
Generating morgan fingerprints...
Generated fingerprints with 2048 features for 841 molecules
Trial 153: 5-fold CV loss = 0.5144
