[I 2025-08-07 22:20:47,632] Trial 1606 finished with value: 0.4688697218894958 and parameters: {'fp_type': 'morgan_rdkit', 'combined_morgan_radius': 3, 'combined_morgan_nBits': 1024, 'combined_rdkit_maxPath': 7, 'combined_rdkit_nBits': 1024, 'num_hidden_layers': 3, 'hidden_dim_0': 256, 'hidden_dim_1': 1024, 'hidden_dim_2': 64, 'kl_weight': 0.000497898155563108, 'lr': 0.008271517753460444, 'batch_size': 128, 'dropout_rate': 0.10789385361254963, 'prior_mu': -0.06148661322419791, 'prior_sigma': 0.08039206111843074, 'normalization': 'layer'}. Best is trial 896 with value: 0.4533553242683411.
Generating morgan_rdkit fingerprints...
Generated fingerprints with 2048 features for 841 molecules
Trial 1607: 5-fold CV loss = 0.4786
[I 2025-08-07 22:20:56,477] Trial 1607 finished with value: 0.4785638332366943 and parameters: {'fp_type': 'morgan_rdkit', 'combined_morgan_radius': 3, 'combined_morgan_nBits': 1024, 'combined_rdkit_maxPath': 6, 'combined_rdkit_nBits': 1024, 'num_hidden_layers': 3, 'hidden_dim_0': 256, 'hidden_dim_1': 1024, 'hidden_dim_2': 64, 'kl_weight': 0.0005147937493491162, 'lr': 0.00816469825137969, 'batch_size': 128, 'dropout_rate': 0.10654922407919777, 'prior_mu': -0.05585212366122977, 'prior_sigma': 0.07942871533690393, 'normalization': 'layer'}. Best is trial 896 with value: 0.4533553242683411.
Generating morgan_rdkit fingerprints...
Generated fingerprints with 2048 features for 841 molecules
Trial 1608: 5-fold CV loss = 0.4665
[I 2025-08-07 22:21:00,752] Trial 1608 finished with value: 0.4664789617061615 and parameters: {'fp_type': 'morgan_rdkit', 'combined_morgan_radius': 3, 'combined_morgan_nBits': 1024, 'combined_rdkit_maxPath': 7, 'combined_rdkit_nBits': 1024, 'num_hidden_layers': 3, 'hidden_dim_0': 256, 'hidden_dim_1': 1024, 'hidden_dim_2': 64, 'kl_weight': 0.0004880033034845428, 'lr': 0.008160672402352373, 'batch_size': 128, 'dropout_rate': 0.10552702085677632, 'prior_mu': -0.059377997750675954, 'prior_sigma': 0.065934737470755, 'normalization': 'layer'}. Best is trial 896 with value: 0.4533553242683411.
Generating morgan_rdkit fingerprints...
Generated fingerprints with 2048 features for 841 molecules
Trial 1604: 5-fold CV loss = 0.4571
[I 2025-08-07 22:21:11,868] Trial 1604 finished with value: 0.45711947083473203 and parameters: {'fp_type': 'morgan_rdkit', 'combined_morgan_radius': 3, 'combined_morgan_nBits': 1024, 'combined_rdkit_maxPath': 7, 'combined_rdkit_nBits': 1024, 'num_hidden_layers': 3, 'hidden_dim_0': 256, 'hidden_dim_1': 1024, 'hidden_dim_2': 64, 'kl_weight': 0.0004622944204999899, 'lr': 0.008361824832557825, 'batch_size': 128, 'dropout_rate': 0.11146931344531219, 'prior_mu': -0.04806054856128579, 'prior_sigma': 0.09613006640031094, 'normalization': 'layer'}. Best is trial 896 with value: 0.4533553242683411.
Generating rdkit fingerprints...
Generated fingerprints with 256 features for 841 molecules
Trial 1609: 5-fold CV loss = 0.4709
[I 2025-08-07 22:21:19,691] Trial 1609 finished with value: 0.4709456145763397 and parameters: {'fp_type': 'morgan_rdkit', 'combined_morgan_radius': 3, 'combined_morgan_nBits': 1024, 'combined_rdkit_maxPath': 6, 'combined_rdkit_nBits': 1024, 'num_hidden_layers': 3, 'hidden_dim_0': 1024, 'hidden_dim_1': 1024, 'hidden_dim_2': 64, 'kl_weight': 0.0005686191467274523, 'lr': 0.009145554709473033, 'batch_size': 128, 'dropout_rate': 0.10447136352197361, 'prior_mu': -0.0557710011307262, 'prior_sigma': 0.06711048005159923, 'normalization': 'layer'}. Best is trial 896 with value: 0.4533553242683411.
Generating rdkit fingerprints...
Generated fingerprints with 256 features for 841 molecules
Trial 1611: 5-fold CV loss = 0.4698
[I 2025-08-07 22:21:41,655] Trial 1611 finished with value: 0.46982818841934204 and parameters: {'fp_type': 'morgan_rdkit', 'combined_morgan_radius': 3, 'combined_morgan_nBits': 1024, 'combined_rdkit_maxPath': 7, 'combined_rdkit_nBits': 1024, 'num_hidden_layers': 3, 'hidden_dim_0': 1024, 'hidden_dim_1': 1024, 'hidden_dim_2': 64, 'kl_weight': 0.0004306477255786392, 'lr': 0.008971049914501891, 'batch_size': 64, 'dropout_rate': 0.09763997657766671, 'prior_mu': -0.05267944608121866, 'prior_sigma': 0.07293437402444716, 'normalization': 'layer'}. Best is trial 896 with value: 0.4533553242683411.
Generating rdkit fingerprints...
Generated fingerprints with 256 features for 841 molecules
Trial 1610: 5-fold CV loss = 0.4681
[I 2025-08-07 22:21:57,744] Trial 1610 finished with value: 0.4680512070655823 and parameters: {'fp_type': 'morgan_rdkit', 'combined_morgan_radius': 3, 'combined_morgan_nBits': 1024, 'combined_rdkit_maxPath': 7, 'combined_rdkit_nBits': 1024, 'num_hidden_layers': 3, 'hidden_dim_0': 256, 'hidden_dim_1': 1024, 'hidden_dim_2': 64, 'kl_weight': 0.0006628180564459812, 'lr': 0.009050608780667352, 'batch_size': 64, 'dropout_rate': 0.09444094693387088, 'prior_mu': -0.055481217189216524, 'prior_sigma': 0.06662430980560316, 'normalization': 'layer'}. Best is trial 896 with value: 0.4533553242683411.
Generating rdkit fingerprints...
Generated fingerprints with 256 features for 841 molecules
Trial 1613: 5-fold CV loss = 0.5327
[I 2025-08-07 22:22:17,756] Trial 1613 finished with value: 0.5326640486717225 and parameters: {'fp_type': 'rdkit', 'rdkit_only_maxPath': 5, 'rdkit_only_nBits': 256, 'num_hidden_layers': 3, 'hidden_dim_0': 256, 'hidden_dim_1': 1024, 'hidden_dim_2': 64, 'kl_weight': 0.0007407486198546626, 'lr': 0.00945424275377286, 'batch_size': 128, 'dropout_rate': 0.09759693035018635, 'prior_mu': -0.06748819023576652, 'prior_sigma': 0.10196712374354476, 'normalization': 'layer'}. Best is trial 896 with value: 0.4533553242683411.
Generating morgan_rdkit fingerprints...
Generated fingerprints with 2048 features for 841 molecules
Trial 1614: 5-fold CV loss = 0.5627
[I 2025-08-07 22:22:20,093] Trial 1614 finished with value: 0.5627147316932678 and parameters: {'fp_type': 'rdkit', 'rdkit_only_maxPath': 5, 'rdkit_only_nBits': 256, 'num_hidden_layers': 3, 'hidden_dim_0': 256, 'hidden_dim_1': 1024, 'hidden_dim_2': 64, 'kl_weight': 0.0007744449166460211, 'lr': 0.009256836227891514, 'batch_size': 128, 'dropout_rate': 0.09841396359310986, 'prior_mu': -0.05579118583476055, 'prior_sigma': 0.10189602090023892, 'normalization': 'layer'}. Best is trial 896 with value: 0.4533553242683411.
Generating morgan_rdkit fingerprints...
Generated fingerprints with 2048 features for 841 molecules
Trial 1617: 5-fold CV loss = 0.4719
[I 2025-08-07 22:22:54,703] Trial 1617 finished with value: 0.4718815922737122 and parameters: {'fp_type': 'morgan_rdkit', 'combined_morgan_radius': 3, 'combined_morgan_nBits': 1024, 'combined_rdkit_maxPath': 7, 'combined_rdkit_nBits': 1024, 'num_hidden_layers': 3, 'hidden_dim_0': 256, 'hidden_dim_1': 1024, 'hidden_dim_2': 64, 'kl_weight': 0.0005426762336721763, 'lr': 0.008481448633430137, 'batch_size': 128, 'dropout_rate': 0.11194473490744705, 'prior_mu': -0.04722163947782885, 'prior_sigma': 0.09629728800827501, 'normalization': 'layer'}. Best is trial 896 with value: 0.4533553242683411.
Generating morgan_rdkit fingerprints...
Generated fingerprints with 2048 features for 841 molecules
Trial 1616: 5-fold CV loss = 0.4733
[I 2025-08-07 22:22:56,592] Trial 1616 finished with value: 0.47325552701950074 and parameters: {'fp_type': 'morgan_rdkit', 'combined_morgan_radius': 3, 'combined_morgan_nBits': 1024, 'combined_rdkit_maxPath': 7, 'combined_rdkit_nBits': 1024, 'num_hidden_layers': 3, 'hidden_dim_0': 256, 'hidden_dim_1': 1024, 'hidden_dim_2': 64, 'kl_weight': 0.000592987786578542, 'lr': 0.008590674022184051, 'batch_size': 128, 'dropout_rate': 0.11360481524988886, 'prior_mu': -0.06027432624861116, 'prior_sigma': 0.09649061244448252, 'normalization': 'layer'}. Best is trial 896 with value: 0.4533553242683411.
Generating morgan_rdkit fingerprints...
Generated fingerprints with 2048 features for 841 molecules
Trial 1612: 5-fold CV loss = 0.5461
[I 2025-08-07 22:23:12,455] Trial 1612 finished with value: 0.5461349308490753 and parameters: {'fp_type': 'rdkit', 'rdkit_only_maxPath': 5, 'rdkit_only_nBits': 256, 'num_hidden_layers': 3, 'hidden_dim_0': 1024, 'hidden_dim_1': 1024, 'hidden_dim_2': 64, 'kl_weight': 0.027200532449468795, 'lr': 0.009028219880580968, 'batch_size': 128, 'dropout_rate': 0.09717755441819739, 'prior_mu': -0.0625699635411948, 'prior_sigma': 0.10097959101398273, 'normalization': 'layer'}. Best is trial 896 with value: 0.4533553242683411.
Generating morgan_rdkit fingerprints...
Generated fingerprints with 2048 features for 841 molecules
Trial 1615: 5-fold CV loss = 0.5309
[I 2025-08-07 22:23:16,945] Trial 1615 finished with value: 0.5309173583984375 and parameters: {'fp_type': 'rdkit', 'rdkit_only_maxPath': 5, 'rdkit_only_nBits': 256, 'num_hidden_layers': 3, 'hidden_dim_0': 256, 'hidden_dim_1': 1024, 'hidden_dim_2': 64, 'kl_weight': 0.0005475562421395682, 'lr': 0.009324241045273615, 'batch_size': 128, 'dropout_rate': 0.10289694624181947, 'prior_mu': -0.06907769499975884, 'prior_sigma': 0.09651923399066527, 'normalization': 'layer'}. Best is trial 896 with value: 0.4533553242683411.
Generating morgan_rdkit fingerprints...
Generated fingerprints with 2048 features for 841 molecules
Trial 1618: 5-fold CV loss = 0.4693
[I 2025-08-07 22:23:32,273] Trial 1618 finished with value: 0.4692950487136841 and parameters: {'fp_type': 'morgan_rdkit', 'combined_morgan_radius': 3, 'combined_morgan_nBits': 1024, 'combined_rdkit_maxPath': 7, 'combined_rdkit_nBits': 1024, 'num_hidden_layers': 3, 'hidden_dim_0': 256, 'hidden_dim_1': 1024, 'hidden_dim_2': 64, 'kl_weight': 0.0004949629668189795, 'lr': 0.008338043723071417, 'batch_size': 128, 'dropout_rate': 0.1087356150976524, 'prior_mu': -0.06507204718237743, 'prior_sigma': 0.09629798199436793, 'normalization': 'layer'}. Best is trial 896 with value: 0.4533553242683411.
Generating morgan_rdkit fingerprints...
Generated fingerprints with 2048 features for 841 molecules
Trial 1619: 5-fold CV loss = 0.4608
[I 2025-08-07 22:23:39,776] Trial 1619 finished with value: 0.46082490086555483 and parameters: {'fp_type': 'morgan_rdkit', 'combined_morgan_radius': 3, 'combined_morgan_nBits': 1024, 'combined_rdkit_maxPath': 7, 'combined_rdkit_nBits': 1024, 'num_hidden_layers': 3, 'hidden_dim_0': 256, 'hidden_dim_1': 1024, 'hidden_dim_2': 64, 'kl_weight': 0.0005435208900763256, 'lr': 0.008263401090141877, 'batch_size': 128, 'dropout_rate': 0.1053672122577996, 'prior_mu': -0.07323522875407645, 'prior_sigma': 0.09929766851637245, 'normalization': 'layer'}. Best is trial 896 with value: 0.4533553242683411.
Generating morgan_rdkit fingerprints...
Generated fingerprints with 2048 features for 841 molecules
Trial 1623: 5-fold CV loss = 0.7944
[I 2025-08-07 22:24:03,450] Trial 1623 finished with value: 0.794432520866394 and parameters: {'fp_type': 'morgan_rdkit', 'combined_morgan_radius': 3, 'combined_morgan_nBits': 1024, 'combined_rdkit_maxPath': 7, 'combined_rdkit_nBits': 1024, 'num_hidden_layers': 3, 'hidden_dim_0': 256, 'hidden_dim_1': 1024, 'hidden_dim_2': 512, 'kl_weight': 0.00044951049935268016, 'lr': 0.007494720535478587, 'batch_size': 128, 'dropout_rate': 0.08754010444350509, 'prior_mu': -0.050299088043763485, 'prior_sigma': 0.09168723520648321, 'normalization': 'layer'}. Best is trial 896 with value: 0.4533553242683411.
Generating morgan_rdkit fingerprints...
Generated fingerprints with 2048 features for 841 molecules
Trial 1622: 5-fold CV loss = 0.7375
[I 2025-08-07 22:24:05,090] Trial 1622 finished with value: 0.7374949038028717 and parameters: {'fp_type': 'morgan_rdkit', 'combined_morgan_radius': 3, 'combined_morgan_nBits': 1024, 'combined_rdkit_maxPath': 7, 'combined_rdkit_nBits': 1024, 'num_hidden_layers': 3, 'hidden_dim_0': 256, 'hidden_dim_1': 1024, 'hidden_dim_2': 512, 'kl_weight': 0.0005833021620066763, 'lr': 0.007709790164204124, 'batch_size': 128, 'dropout_rate': 0.08827567337383592, 'prior_mu': -0.05125431390424927, 'prior_sigma': 0.0933958212325259, 'normalization': 'layer'}. Best is trial 896 with value: 0.4533553242683411.
Generating morgan_rdkit fingerprints...
Generated fingerprints with 2048 features for 841 molecules
Trial 1621: 5-fold CV loss = 0.4653
[I 2025-08-07 22:24:11,477] Trial 1621 finished with value: 0.4652589499950409 and parameters: {'fp_type': 'morgan_rdkit', 'combined_morgan_radius': 3, 'combined_morgan_nBits': 1024, 'combined_rdkit_maxPath': 7, 'combined_rdkit_nBits': 1024, 'num_hidden_layers': 3, 'hidden_dim_0': 256, 'hidden_dim_1': 1024, 'hidden_dim_2': 64, 'kl_weight': 0.0004981651798815131, 'lr': 0.009938110510635615, 'batch_size': 128, 'dropout_rate': 0.11365121181681791, 'prior_mu': -0.0495775383059361, 'prior_sigma': 0.09169337913239343, 'normalization': 'layer'}. Best is trial 896 with value: 0.4533553242683411.
Generating morgan_rdkit fingerprints...
Generated fingerprints with 1536 features for 841 molecules
Trial 1625: 5-fold CV loss = 0.5643
[I 2025-08-07 22:24:35,418] Trial 1625 finished with value: 0.5642593741416931 and parameters: {'fp_type': 'morgan_rdkit', 'combined_morgan_radius': 3, 'combined_morgan_nBits': 1024, 'combined_rdkit_maxPath': 7, 'combined_rdkit_nBits': 1024, 'num_hidden_layers': 3, 'hidden_dim_0': 256, 'hidden_dim_1': 1024, 'hidden_dim_2': 64, 'kl_weight': 0.00045457254195346706, 'lr': 0.007634681951000156, 'batch_size': 128, 'dropout_rate': 0.1144670552516415, 'prior_mu': -0.047451165537161555, 'prior_sigma': 0.09155778199660237, 'normalization': 'layer'}. Best is trial 896 with value: 0.4533553242683411.
Generating morgan_rdkit fingerprints...
Generated fingerprints with 1536 features for 841 molecules
Trial 1620: 5-fold CV loss = 0.4657
[I 2025-08-07 22:24:47,705] Trial 1620 finished with value: 0.46566792726516726 and parameters: {'fp_type': 'morgan_rdkit', 'combined_morgan_radius': 3, 'combined_morgan_nBits': 1024, 'combined_rdkit_maxPath': 7, 'combined_rdkit_nBits': 1024, 'num_hidden_layers': 3, 'hidden_dim_0': 256, 'hidden_dim_1': 1024, 'hidden_dim_2': 64, 'kl_weight': 0.0005874598956799545, 'lr': 0.009837203013668526, 'batch_size': 128, 'dropout_rate': 0.10900705407572714, 'prior_mu': -0.071129925188446, 'prior_sigma': 0.09472037595305911, 'normalization': 'layer'}. Best is trial 896 with value: 0.4533553242683411.
Generating morgan_rdkit fingerprints...
Generated fingerprints with 1536 features for 841 molecules
Trial 1624: 5-fold CV loss = 0.5807
[I 2025-08-07 22:24:55,794] Trial 1624 finished with value: 0.5807324111461639 and parameters: {'fp_type': 'morgan_rdkit', 'combined_morgan_radius': 3, 'combined_morgan_nBits': 1024, 'combined_rdkit_maxPath': 8, 'combined_rdkit_nBits': 1024, 'num_hidden_layers': 3, 'hidden_dim_0': 256, 'hidden_dim_1': 1024, 'hidden_dim_2': 64, 'kl_weight': 0.00058313063664155, 'lr': 0.008243320572747515, 'batch_size': 128, 'dropout_rate': 0.11763405518444571, 'prior_mu': -0.049579272720242824, 'prior_sigma': 0.09345938277998507, 'normalization': 'layer'}. Best is trial 896 with value: 0.4533553242683411.
Generating morgan_rdkit fingerprints...
Generated fingerprints with 1536 features for 841 molecules
Trial 1626: 5-fold CV loss = 0.5926
[I 2025-08-07 22:25:02,130] Trial 1626 finished with value: 0.5925986289978027 and parameters: {'fp_type': 'morgan_rdkit', 'combined_morgan_radius': 3, 'combined_morgan_nBits': 1024, 'combined_rdkit_maxPath': 8, 'combined_rdkit_nBits': 512, 'num_hidden_layers': 3, 'hidden_dim_0': 256, 'hidden_dim_1': 1024, 'hidden_dim_2': 64, 'kl_weight': 0.0004358284005472275, 'lr': 0.007630304121006688, 'batch_size': 128, 'dropout_rate': 0.11796985055838395, 'prior_mu': -0.048039804520211095, 'prior_sigma': 0.10054726631053411, 'normalization': 'layer'}. Best is trial 896 with value: 0.4533553242683411.
Generating morgan_rdkit fingerprints...
Generated fingerprints with 2048 features for 841 molecules
Trial 1627: 5-fold CV loss = 0.4974
[I 2025-08-07 22:25:14,404] Trial 1627 finished with value: 0.4974058449268341 and parameters: {'fp_type': 'morgan_rdkit', 'combined_morgan_radius': 3, 'combined_morgan_nBits': 1024, 'combined_rdkit_maxPath': 8, 'combined_rdkit_nBits': 512, 'num_hidden_layers': 3, 'hidden_dim_0': 256, 'hidden_dim_1': 1024, 'hidden_dim_2': 64, 'kl_weight': 0.0006767102523597412, 'lr': 0.008086581697322558, 'batch_size': 128, 'dropout_rate': 0.07986999793963033, 'prior_mu': -0.04370901768273621, 'prior_sigma': 0.10106801002184379, 'normalization': 'layer'}. Best is trial 896 with value: 0.4533553242683411.
Generating morgan_rdkit fingerprints...
Generated fingerprints with 2048 features for 841 molecules
Trial 1629: 5-fold CV loss = 0.6468
[I 2025-08-07 22:25:24,898] Trial 1629 finished with value: 0.6467893600463868 and parameters: {'fp_type': 'morgan_rdkit', 'combined_morgan_radius': 3, 'combined_morgan_nBits': 1024, 'combined_rdkit_maxPath': 7, 'combined_rdkit_nBits': 512, 'num_hidden_layers': 3, 'hidden_dim_0': 256, 'hidden_dim_1': 1024, 'hidden_dim_2': 64, 'kl_weight': 0.0006388487050283309, 'lr': 0.0076050867275608185, 'batch_size': 128, 'dropout_rate': 0.08624211978162497, 'prior_mu': -0.04182040908857824, 'prior_sigma': 0.1010207201364498, 'normalization': 'layer'}. Best is trial 896 with value: 0.4533553242683411.
Generating morgan_rdkit fingerprints...
Generated fingerprints with 2048 features for 841 molecules
Trial 1631: 5-fold CV loss = 0.5554
[I 2025-08-07 22:25:43,209] Trial 1631 finished with value: 0.5554094851016999 and parameters: {'fp_type': 'morgan_rdkit', 'combined_morgan_radius': 3, 'combined_morgan_nBits': 1024, 'combined_rdkit_maxPath': 7, 'combined_rdkit_nBits': 1024, 'num_hidden_layers': 3, 'hidden_dim_0': 256, 'hidden_dim_1': 64, 'hidden_dim_2': 64, 'kl_weight': 0.0006522539707222296, 'lr': 0.009971782513278814, 'batch_size': 128, 'dropout_rate': 0.08662571102733159, 'prior_mu': -0.0782793076315474, 'prior_sigma': 0.08862102066957235, 'normalization': 'layer'}. Best is trial 896 with value: 0.4533553242683411.
Generating morgan_rdkit fingerprints...
Generated fingerprints with 2048 features for 841 molecules
Trial 1632: 5-fold CV loss = 0.5572
[I 2025-08-07 22:25:57,954] Trial 1632 finished with value: 0.5572377860546112 and parameters: {'fp_type': 'morgan_rdkit', 'combined_morgan_radius': 3, 'combined_morgan_nBits': 1024, 'combined_rdkit_maxPath': 7, 'combined_rdkit_nBits': 1024, 'num_hidden_layers': 3, 'hidden_dim_0': 256, 'hidden_dim_1': 64, 'hidden_dim_2': 64, 'kl_weight': 0.0004399450179024719, 'lr': 0.00823741834496377, 'batch_size': 128, 'dropout_rate': 0.10049838564646989, 'prior_mu': -0.06178194136268289, 'prior_sigma': 0.08994642133773535, 'normalization': 'layer'}. Best is trial 896 with value: 0.4533553242683411.
Generating morgan_rdkit fingerprints...
Generated fingerprints with 2048 features for 841 molecules
Trial 1630: 5-fold CV loss = 0.4545
[I 2025-08-07 22:26:03,421] Trial 1630 finished with value: 0.4545258343219757 and parameters: {'fp_type': 'morgan_rdkit', 'combined_morgan_radius': 3, 'combined_morgan_nBits': 1024, 'combined_rdkit_maxPath': 7, 'combined_rdkit_nBits': 1024, 'num_hidden_layers': 3, 'hidden_dim_0': 256, 'hidden_dim_1': 1024, 'hidden_dim_2': 64, 'kl_weight': 0.00042737784182347686, 'lr': 0.007521010537219584, 'batch_size': 128, 'dropout_rate': 0.08243264229019856, 'prior_mu': -0.04398389605661219, 'prior_sigma': 0.08934963504771133, 'normalization': 'layer'}. Best is trial 896 with value: 0.4533553242683411.
Generating morgan_rdkit fingerprints...
Generated fingerprints with 2048 features for 841 molecules
Trial 1633: 5-fold CV loss = 0.4674
[I 2025-08-07 22:26:19,159] Trial 1633 finished with value: 0.46744915246963503 and parameters: {'fp_type': 'morgan_rdkit', 'combined_morgan_radius': 3, 'combined_morgan_nBits': 1024, 'combined_rdkit_maxPath': 7, 'combined_rdkit_nBits': 1024, 'num_hidden_layers': 3, 'hidden_dim_0': 256, 'hidden_dim_1': 1024, 'hidden_dim_2': 64, 'kl_weight': 0.0004566474557876736, 'lr': 0.008577653990296358, 'batch_size': 128, 'dropout_rate': 0.10341809898716499, 'prior_mu': -0.05597660510375631, 'prior_sigma': 0.09046201546270599, 'normalization': 'layer'}. Best is trial 896 with value: 0.4533553242683411.
Generating morgan_rdkit fingerprints...
Generated fingerprints with 2048 features for 841 molecules
Trial 1628: 5-fold CV loss = 0.5952
[I 2025-08-07 22:26:21,938] Trial 1628 finished with value: 0.5951653122901917 and parameters: {'fp_type': 'morgan_rdkit', 'combined_morgan_radius': 3, 'combined_morgan_nBits': 1024, 'combined_rdkit_maxPath': 8, 'combined_rdkit_nBits': 512, 'num_hidden_layers': 3, 'hidden_dim_0': 256, 'hidden_dim_1': 1024, 'hidden_dim_2': 64, 'kl_weight': 0.0004343209971075048, 'lr': 0.008281998806070221, 'batch_size': 128, 'dropout_rate': 0.08231333602766631, 'prior_mu': -0.04453630703328599, 'prior_sigma': 0.10100588735739639, 'normalization': 'layer'}. Best is trial 896 with value: 0.4533553242683411.
Generating morgan_rdkit fingerprints...
Generated fingerprints with 2048 features for 841 molecules
Trial 1635: 5-fold CV loss = 0.8885
[I 2025-08-07 22:26:28,585] Trial 1635 finished with value: 0.8884697914123535 and parameters: {'fp_type': 'morgan_rdkit', 'combined_morgan_radius': 3, 'combined_morgan_nBits': 1024, 'combined_rdkit_maxPath': 7, 'combined_rdkit_nBits': 1024, 'num_hidden_layers': 3, 'hidden_dim_0': 256, 'hidden_dim_1': 1024, 'hidden_dim_2': 1024, 'kl_weight': 0.000490378824273752, 'lr': 0.00884364896680411, 'batch_size': 128, 'dropout_rate': 0.06348092252941913, 'prior_mu': -0.05980254687109869, 'prior_sigma': 0.09189097185453335, 'normalization': 'layer'}. Best is trial 896 with value: 0.4533553242683411.
Generating morgan_rdkit fingerprints...
Generated fingerprints with 2048 features for 841 molecules
Trial 1634: 5-fold CV loss = 0.5656
