[I 2025-08-07 23:17:06,538] Trial 1905 finished with value: 0.4609160542488098 and parameters: {'fp_type': 'morgan_rdkit', 'combined_morgan_radius': 3, 'combined_morgan_nBits': 1024, 'combined_rdkit_maxPath': 7, 'combined_rdkit_nBits': 1024, 'num_hidden_layers': 3, 'hidden_dim_0': 256, 'hidden_dim_1': 1024, 'hidden_dim_2': 64, 'kl_weight': 0.00021383367532059225, 'lr': 0.009384580731679002, 'batch_size': 128, 'dropout_rate': 0.18408399162046474, 'prior_mu': -0.03201333967032065, 'prior_sigma': 0.15758749857273063, 'normalization': 'layer'}. Best is trial 896 with value: 0.4533553242683411.
Generating morgan fingerprints...
Generated fingerprints with 2048 features for 841 molecules
Trial 1907: 5-fold CV loss = 0.7266
[I 2025-08-07 23:17:12,695] Trial 1907 finished with value: 0.7266133725643158 and parameters: {'fp_type': 'morgan_rdkit', 'combined_morgan_radius': 3, 'combined_morgan_nBits': 1024, 'combined_rdkit_maxPath': 7, 'combined_rdkit_nBits': 1024, 'num_hidden_layers': 3, 'hidden_dim_0': 256, 'hidden_dim_1': 1024, 'hidden_dim_2': 256, 'kl_weight': 0.00021355718336770808, 'lr': 0.007421984219616777, 'batch_size': 128, 'dropout_rate': 0.19588804310118502, 'prior_mu': -0.016078337086304052, 'prior_sigma': 0.08341573292209992, 'normalization': 'layer'}. Best is trial 896 with value: 0.4533553242683411.
Generating morgan fingerprints...
Generated fingerprints with 2048 features for 841 molecules
Trial 1909: 5-fold CV loss = 0.5308
[I 2025-08-07 23:17:30,358] Trial 1909 finished with value: 0.5307894706726074 and parameters: {'fp_type': 'morgan', 'morgan_only_radius': 3, 'morgan_only_nBits': 2048, 'num_hidden_layers': 3, 'hidden_dim_0': 256, 'hidden_dim_1': 1024, 'hidden_dim_2': 256, 'kl_weight': 0.00021400065569779152, 'lr': 0.0074527414339841955, 'batch_size': 128, 'dropout_rate': 0.20185007790295903, 'prior_mu': -0.016775101441814814, 'prior_sigma': 0.08440771319063704, 'normalization': 'layer'}. Best is trial 896 with value: 0.4533553242683411.
Generating morgan_rdkit fingerprints...
Generated fingerprints with 1536 features for 841 molecules
Trial 1910: 5-fold CV loss = 0.5259
[I 2025-08-07 23:17:34,459] Trial 1910 finished with value: 0.525931429862976 and parameters: {'fp_type': 'morgan', 'morgan_only_radius': 3, 'morgan_only_nBits': 2048, 'num_hidden_layers': 3, 'hidden_dim_0': 256, 'hidden_dim_1': 1024, 'hidden_dim_2': 64, 'kl_weight': 0.0002555946021003998, 'lr': 0.006526492557479633, 'batch_size': 128, 'dropout_rate': 0.1742600105325234, 'prior_mu': -0.018612202517598493, 'prior_sigma': 0.08573547743739468, 'normalization': 'layer'}. Best is trial 896 with value: 0.4533553242683411.
Generating morgan_rdkit fingerprints...
Generated fingerprints with 1536 features for 841 molecules
Trial 1908: 5-fold CV loss = 0.4554
[I 2025-08-07 23:17:51,133] Trial 1908 finished with value: 0.45542466044425967 and parameters: {'fp_type': 'morgan_rdkit', 'combined_morgan_radius': 3, 'combined_morgan_nBits': 1024, 'combined_rdkit_maxPath': 7, 'combined_rdkit_nBits': 1024, 'num_hidden_layers': 3, 'hidden_dim_0': 256, 'hidden_dim_1': 1024, 'hidden_dim_2': 64, 'kl_weight': 0.0002695347245942141, 'lr': 0.007563711309604935, 'batch_size': 128, 'dropout_rate': 0.16155697743284123, 'prior_mu': -0.017991664960133637, 'prior_sigma': 0.08501994379314665, 'normalization': 'layer'}. Best is trial 896 with value: 0.4533553242683411.
Generating morgan_rdkit fingerprints...
Generated fingerprints with 1536 features for 841 molecules
Trial 1906: 5-fold CV loss = 0.4589
[I 2025-08-07 23:18:00,831] Trial 1906 finished with value: 0.4589071273803711 and parameters: {'fp_type': 'morgan_rdkit', 'combined_morgan_radius': 3, 'combined_morgan_nBits': 1024, 'combined_rdkit_maxPath': 7, 'combined_rdkit_nBits': 1024, 'num_hidden_layers': 3, 'hidden_dim_0': 256, 'hidden_dim_1': 1024, 'hidden_dim_2': 64, 'kl_weight': 0.00020874189840461597, 'lr': 0.007459659902294981, 'batch_size': 128, 'dropout_rate': 0.17955782520989483, 'prior_mu': -0.03235192255541362, 'prior_sigma': 0.08381249861082866, 'normalization': 'layer'}. Best is trial 896 with value: 0.4533553242683411.
Generating morgan_rdkit fingerprints...
Generated fingerprints with 1280 features for 841 molecules
Trial 1911: 5-fold CV loss = 0.4629
[I 2025-08-07 23:18:09,119] Trial 1911 finished with value: 0.4628682672977448 and parameters: {'fp_type': 'morgan_rdkit', 'combined_morgan_radius': 3, 'combined_morgan_nBits': 512, 'combined_rdkit_maxPath': 7, 'combined_rdkit_nBits': 1024, 'num_hidden_layers': 3, 'hidden_dim_0': 256, 'hidden_dim_1': 1024, 'hidden_dim_2': 64, 'kl_weight': 0.0002740694549240304, 'lr': 0.0063679739104574706, 'batch_size': 128, 'dropout_rate': 0.17477736877674419, 'prior_mu': -0.03631335987495224, 'prior_sigma': 0.07773396685235265, 'normalization': 'layer'}. Best is trial 896 with value: 0.4533553242683411.
Generating morgan_rdkit fingerprints...
Generated fingerprints with 1280 features for 841 molecules
Trial 1912: 5-fold CV loss = 0.4710
[I 2025-08-07 23:18:16,009] Trial 1912 finished with value: 0.4710462749004364 and parameters: {'fp_type': 'morgan_rdkit', 'combined_morgan_radius': 3, 'combined_morgan_nBits': 512, 'combined_rdkit_maxPath': 7, 'combined_rdkit_nBits': 1024, 'num_hidden_layers': 3, 'hidden_dim_0': 256, 'hidden_dim_1': 1024, 'hidden_dim_2': 64, 'kl_weight': 0.0002709988856030555, 'lr': 0.009989641458824233, 'batch_size': 128, 'dropout_rate': 0.17739223707712132, 'prior_mu': -0.03580906012486683, 'prior_sigma': 0.07757778397473251, 'normalization': 'layer'}. Best is trial 896 with value: 0.4533553242683411.
Generating morgan_rdkit fingerprints...
Generated fingerprints with 2048 features for 841 molecules
Trial 1915: 5-fold CV loss = 0.7486
[I 2025-08-07 23:18:31,064] Trial 1915 finished with value: 0.7486087024211884 and parameters: {'fp_type': 'morgan_rdkit', 'combined_morgan_radius': 3, 'combined_morgan_nBits': 1024, 'combined_rdkit_maxPath': 7, 'combined_rdkit_nBits': 256, 'num_hidden_layers': 3, 'hidden_dim_0': 256, 'hidden_dim_1': 1024, 'hidden_dim_2': 512, 'kl_weight': 0.00024202686226034402, 'lr': 0.005264667379471807, 'batch_size': 128, 'dropout_rate': 0.1671699318288293, 'prior_mu': -0.006670863649096046, 'prior_sigma': 0.07872260629425501, 'normalization': 'layer'}. Best is trial 896 with value: 0.4533553242683411.
Generating morgan_rdkit fingerprints...
Generated fingerprints with 2048 features for 841 molecules
Trial 1916: 5-fold CV loss = 0.8182
[I 2025-08-07 23:18:44,851] Trial 1916 finished with value: 0.8181678414344787 and parameters: {'fp_type': 'morgan_rdkit', 'combined_morgan_radius': 3, 'combined_morgan_nBits': 1024, 'combined_rdkit_maxPath': 7, 'combined_rdkit_nBits': 1024, 'num_hidden_layers': 3, 'hidden_dim_0': 256, 'hidden_dim_1': 128, 'hidden_dim_2': 512, 'kl_weight': 0.00023950319759665764, 'lr': 0.005201875314987664, 'batch_size': 128, 'dropout_rate': 0.16847584073555563, 'prior_mu': -0.0054917595478336245, 'prior_sigma': 0.0797889099561365, 'normalization': 'layer'}. Best is trial 896 with value: 0.4533553242683411.
Generating morgan_rdkit fingerprints...
Generated fingerprints with 2048 features for 841 molecules
Trial 1913: 5-fold CV loss = 0.4602
[I 2025-08-07 23:19:00,585] Trial 1913 finished with value: 0.46019611954689027 and parameters: {'fp_type': 'morgan_rdkit', 'combined_morgan_radius': 3, 'combined_morgan_nBits': 512, 'combined_rdkit_maxPath': 7, 'combined_rdkit_nBits': 1024, 'num_hidden_layers': 3, 'hidden_dim_0': 256, 'hidden_dim_1': 1024, 'hidden_dim_2': 64, 'kl_weight': 0.00023257089075897134, 'lr': 0.005166284144698029, 'batch_size': 128, 'dropout_rate': 0.17953785938343553, 'prior_mu': -0.003498490942518674, 'prior_sigma': 0.0781463178680264, 'normalization': 'layer'}. Best is trial 896 with value: 0.4533553242683411.
Generating morgan_rdkit fingerprints...
Generated fingerprints with 2048 features for 841 molecules
Trial 1917: 5-fold CV loss = 0.4650
[I 2025-08-07 23:19:11,531] Trial 1917 finished with value: 0.46500171422958375 and parameters: {'fp_type': 'morgan_rdkit', 'combined_morgan_radius': 3, 'combined_morgan_nBits': 1024, 'combined_rdkit_maxPath': 7, 'combined_rdkit_nBits': 1024, 'num_hidden_layers': 3, 'hidden_dim_0': 256, 'hidden_dim_1': 1024, 'hidden_dim_2': 64, 'kl_weight': 0.0002355853564657577, 'lr': 0.006018451836250129, 'batch_size': 128, 'dropout_rate': 0.1662686929112717, 'prior_mu': -0.014221778765553505, 'prior_sigma': 0.08230986394351793, 'normalization': 'layer'}. Best is trial 896 with value: 0.4533553242683411.
Generating morgan_rdkit fingerprints...
Generated fingerprints with 2048 features for 841 molecules
Trial 1914: 5-fold CV loss = 0.5161
[I 2025-08-07 23:19:14,307] Trial 1914 finished with value: 0.5160862326622009 and parameters: {'fp_type': 'morgan_rdkit', 'combined_morgan_radius': 3, 'combined_morgan_nBits': 1024, 'combined_rdkit_maxPath': 7, 'combined_rdkit_nBits': 256, 'num_hidden_layers': 3, 'hidden_dim_0': 256, 'hidden_dim_1': 1024, 'hidden_dim_2': 64, 'kl_weight': 0.00023530996394659426, 'lr': 0.005142364381401297, 'batch_size': 128, 'dropout_rate': 0.16989852340047235, 'prior_mu': -0.0025640298763869047, 'prior_sigma': 0.07756169017978126, 'normalization': 'layer'}. Best is trial 896 with value: 0.4533553242683411.
Generating morgan_rdkit fingerprints...
Generated fingerprints with 2048 features for 841 molecules
Trial 1918: 5-fold CV loss = 0.4658
[I 2025-08-07 23:19:26,131] Trial 1918 finished with value: 0.4657879889011383 and parameters: {'fp_type': 'morgan_rdkit', 'combined_morgan_radius': 3, 'combined_morgan_nBits': 1024, 'combined_rdkit_maxPath': 7, 'combined_rdkit_nBits': 1024, 'num_hidden_layers': 3, 'hidden_dim_0': 256, 'hidden_dim_1': 1024, 'hidden_dim_2': 64, 'kl_weight': 0.0028457358276243335, 'lr': 0.006038960701162176, 'batch_size': 128, 'dropout_rate': 0.16556830003641243, 'prior_mu': -0.014634107273692333, 'prior_sigma': 0.08321196934396276, 'normalization': 'layer'}. Best is trial 896 with value: 0.4533553242683411.
Generating morgan_rdkit fingerprints...
Generated fingerprints with 2048 features for 841 molecules
Trial 1920: 5-fold CV loss = 0.4711
[I 2025-08-07 23:19:48,685] Trial 1920 finished with value: 0.4710520088672638 and parameters: {'fp_type': 'morgan_rdkit', 'combined_morgan_radius': 3, 'combined_morgan_nBits': 1024, 'combined_rdkit_maxPath': 7, 'combined_rdkit_nBits': 1024, 'num_hidden_layers': 3, 'hidden_dim_0': 256, 'hidden_dim_1': 1024, 'hidden_dim_2': 64, 'kl_weight': 0.0002657372989732518, 'lr': 0.006485989946406761, 'batch_size': 128, 'dropout_rate': 0.16350724490044014, 'prior_mu': -0.014501063377880437, 'prior_sigma': 0.08565461150885757, 'normalization': 'layer'}. Best is trial 896 with value: 0.4533553242683411.
Generating morgan_rdkit fingerprints...
Generated fingerprints with 2048 features for 841 molecules
Trial 1919: 5-fold CV loss = 0.4700
[I 2025-08-07 23:19:59,999] Trial 1919 finished with value: 0.4699943244457245 and parameters: {'fp_type': 'morgan_rdkit', 'combined_morgan_radius': 3, 'combined_morgan_nBits': 1024, 'combined_rdkit_maxPath': 7, 'combined_rdkit_nBits': 1024, 'num_hidden_layers': 3, 'hidden_dim_0': 256, 'hidden_dim_1': 1024, 'hidden_dim_2': 64, 'kl_weight': 0.00018137787732240622, 'lr': 0.006015939707274973, 'batch_size': 128, 'dropout_rate': 0.15928110582842092, 'prior_mu': -0.013186417243198845, 'prior_sigma': 0.08316377976785892, 'normalization': 'layer'}. Best is trial 896 with value: 0.4533553242683411.
Generating morgan_rdkit fingerprints...
Generated fingerprints with 2048 features for 841 molecules
Trial 1922: 5-fold CV loss = 0.4595
[I 2025-08-07 23:20:11,737] Trial 1922 finished with value: 0.4594806969165802 and parameters: {'fp_type': 'morgan_rdkit', 'combined_morgan_radius': 3, 'combined_morgan_nBits': 1024, 'combined_rdkit_maxPath': 7, 'combined_rdkit_nBits': 1024, 'num_hidden_layers': 3, 'hidden_dim_0': 256, 'hidden_dim_1': 1024, 'hidden_dim_2': 64, 'kl_weight': 0.000267516816756746, 'lr': 0.006760299256423669, 'batch_size': 128, 'dropout_rate': 0.15839588350218056, 'prior_mu': 0.012330594178242447, 'prior_sigma': 0.08558974132556157, 'normalization': 'layer'}. Best is trial 896 with value: 0.4533553242683411.
Generating morgan_rdkit fingerprints...
Generated fingerprints with 2048 features for 841 molecules
Trial 1923: 5-fold CV loss = 0.4622
[I 2025-08-07 23:20:28,412] Trial 1923 finished with value: 0.4622001051902771 and parameters: {'fp_type': 'morgan_rdkit', 'combined_morgan_radius': 3, 'combined_morgan_nBits': 1024, 'combined_rdkit_maxPath': 7, 'combined_rdkit_nBits': 1024, 'num_hidden_layers': 3, 'hidden_dim_0': 256, 'hidden_dim_1': 1024, 'hidden_dim_2': 64, 'kl_weight': 0.0001901549172590447, 'lr': 0.006795081242948392, 'batch_size': 128, 'dropout_rate': 0.16113423919819408, 'prior_mu': 0.006113911715846057, 'prior_sigma': 0.08299547333281476, 'normalization': 'layer'}. Best is trial 896 with value: 0.4533553242683411.
Generating morgan_rdkit fingerprints...
Generated fingerprints with 2048 features for 841 molecules
Trial 1921: 5-fold CV loss = 0.5456
[I 2025-08-07 23:20:32,457] Trial 1921 finished with value: 0.5455916881561279 and parameters: {'fp_type': 'morgan_rdkit', 'combined_morgan_radius': 3, 'combined_morgan_nBits': 1024, 'combined_rdkit_maxPath': 7, 'combined_rdkit_nBits': 1024, 'num_hidden_layers': 3, 'hidden_dim_0': 256, 'hidden_dim_1': 1024, 'hidden_dim_2': 64, 'kl_weight': 0.00027020552242298045, 'lr': 0.0068109222788839945, 'batch_size': 128, 'dropout_rate': 0.1638344013472829, 'prior_mu': -0.013952151209531876, 'prior_sigma': 0.08527729147166979, 'normalization': 'layer'}. Best is trial 896 with value: 0.4533553242683411.
Generating morgan_rdkit fingerprints...
Generated fingerprints with 2048 features for 841 molecules
Trial 1925: 5-fold CV loss = 0.5103
[I 2025-08-07 23:20:37,052] Trial 1925 finished with value: 0.510263878107071 and parameters: {'fp_type': 'morgan_rdkit', 'combined_morgan_radius': 3, 'combined_morgan_nBits': 1024, 'combined_rdkit_maxPath': 7, 'combined_rdkit_nBits': 1024, 'num_hidden_layers': 1, 'hidden_dim_0': 256, 'kl_weight': 0.0002014319438800365, 'lr': 0.00686708881317169, 'batch_size': 128, 'dropout_rate': 0.18576501684783675, 'prior_mu': -0.022200498026668507, 'prior_sigma': 0.08117168350861009, 'normalization': 'layer'}. Best is trial 896 with value: 0.4533553242683411.
Generating morgan_rdkit fingerprints...
Generated fingerprints with 2048 features for 841 molecules
Trial 1924: 5-fold CV loss = 0.5527
[I 2025-08-07 23:20:50,007] Trial 1924 finished with value: 0.5526873648166657 and parameters: {'fp_type': 'morgan_rdkit', 'combined_morgan_radius': 3, 'combined_morgan_nBits': 1024, 'combined_rdkit_maxPath': 7, 'combined_rdkit_nBits': 1024, 'num_hidden_layers': 3, 'hidden_dim_0': 256, 'hidden_dim_1': 1024, 'hidden_dim_2': 64, 'kl_weight': 0.00019745252059074, 'lr': 0.0067368179419500076, 'batch_size': 128, 'dropout_rate': 0.18123281831484211, 'prior_mu': -0.023682582726713034, 'prior_sigma': 0.08523382054429948, 'normalization': 'layer'}. Best is trial 896 with value: 0.4533553242683411.
Generating morgan_rdkit fingerprints...
Generated fingerprints with 2048 features for 841 molecules
Trial 1926: 5-fold CV loss = 0.4648
[I 2025-08-07 23:21:14,057] Trial 1926 finished with value: 0.4647960543632507 and parameters: {'fp_type': 'morgan_rdkit', 'combined_morgan_radius': 3, 'combined_morgan_nBits': 1024, 'combined_rdkit_maxPath': 7, 'combined_rdkit_nBits': 1024, 'num_hidden_layers': 3, 'hidden_dim_0': 128, 'hidden_dim_1': 1024, 'hidden_dim_2': 64, 'kl_weight': 0.00028559033006574905, 'lr': 0.0071362454476847385, 'batch_size': 64, 'dropout_rate': 0.16830175601587463, 'prior_mu': -0.023826827676939784, 'prior_sigma': 0.07509835289587569, 'normalization': 'layer'}. Best is trial 896 with value: 0.4533553242683411.
Generating morgan_rdkit fingerprints...
Generated fingerprints with 2048 features for 841 molecules
Trial 1929: 5-fold CV loss = 0.8557
[I 2025-08-07 23:21:18,828] Trial 1929 finished with value: 0.8557062268257141 and parameters: {'fp_type': 'morgan_rdkit', 'combined_morgan_radius': 3, 'combined_morgan_nBits': 1024, 'combined_rdkit_maxPath': 7, 'combined_rdkit_nBits': 1024, 'num_hidden_layers': 3, 'hidden_dim_0': 128, 'hidden_dim_1': 1024, 'hidden_dim_2': 1024, 'kl_weight': 0.00027620629161614435, 'lr': 0.001139075618742173, 'batch_size': 64, 'dropout_rate': 0.15212231195398668, 'prior_mu': -0.021368311268392944, 'prior_sigma': 0.07849725989372784, 'normalization': 'layer'}. Best is trial 896 with value: 0.4533553242683411.
Generating morgan_rdkit fingerprints...
Generated fingerprints with 2048 features for 841 molecules
Trial 1928: 5-fold CV loss = 0.6454
[I 2025-08-07 23:21:33,763] Trial 1928 finished with value: 0.6454278349876403 and parameters: {'fp_type': 'morgan_rdkit', 'combined_morgan_radius': 3, 'combined_morgan_nBits': 1024, 'combined_rdkit_maxPath': 7, 'combined_rdkit_nBits': 1024, 'num_hidden_layers': 3, 'hidden_dim_0': 256, 'hidden_dim_1': 1024, 'hidden_dim_2': 1024, 'kl_weight': 0.0003017878099502799, 'lr': 0.008434579658872949, 'batch_size': 64, 'dropout_rate': 0.1886374740028498, 'prior_mu': -0.021415064221144486, 'prior_sigma': 0.07576860047716008, 'normalization': 'layer'}. Best is trial 896 with value: 0.4533553242683411.
Generating morgan_rdkit fingerprints...
Generated fingerprints with 1536 features for 841 molecules
Trial 1930: 5-fold CV loss = 0.8104
[I 2025-08-07 23:21:37,680] Trial 1930 finished with value: 0.8104253888130188 and parameters: {'fp_type': 'morgan_rdkit', 'combined_morgan_radius': 3, 'combined_morgan_nBits': 1024, 'combined_rdkit_maxPath': 7, 'combined_rdkit_nBits': 1024, 'num_hidden_layers': 3, 'hidden_dim_0': 256, 'hidden_dim_1': 1024, 'hidden_dim_2': 64, 'kl_weight': 0.000221760854174979, 'lr': 0.0013766542040773487, 'batch_size': 128, 'dropout_rate': 0.185713695308494, 'prior_mu': -0.0009755997319208531, 'prior_sigma': 0.07556110513494012, 'normalization': 'layer'}. Best is trial 896 with value: 0.4533553242683411.
Generating morgan_rdkit fingerprints...
Generated fingerprints with 1536 features for 841 molecules
Trial 1933: 5-fold CV loss = 0.8293
[I 2025-08-07 23:21:50,400] Trial 1933 finished with value: 0.8293084025382995 and parameters: {'fp_type': 'morgan_rdkit', 'combined_morgan_radius': 3, 'combined_morgan_nBits': 1024, 'combined_rdkit_maxPath': 8, 'combined_rdkit_nBits': 512, 'num_hidden_layers': 3, 'hidden_dim_0': 256, 'hidden_dim_1': 1024, 'hidden_dim_2': 64, 'kl_weight': 0.000293170801339489, 'lr': 0.0005798139363600772, 'batch_size': 128, 'dropout_rate': 0.19669826480738484, 'prior_mu': -0.008351150420007262, 'prior_sigma': 0.08796638137362932, 'normalization': 'none'}. Best is trial 896 with value: 0.4533553242683411.
Generating morgan_rdkit fingerprints...
Generated fingerprints with 2048 features for 841 molecules
Trial 1932: 5-fold CV loss = 0.5947
[I 2025-08-07 23:22:07,734] Trial 1932 finished with value: 0.5946632623672485 and parameters: {'fp_type': 'morgan_rdkit', 'combined_morgan_radius': 3, 'combined_morgan_nBits': 1024, 'combined_rdkit_maxPath': 8, 'combined_rdkit_nBits': 512, 'num_hidden_layers': 3, 'hidden_dim_0': 256, 'hidden_dim_1': 1024, 'hidden_dim_2': 64, 'kl_weight': 0.00021796444978876956, 'lr': 0.008103796016846134, 'batch_size': 128, 'dropout_rate': 0.17428515373808265, 'prior_mu': -0.007900026217482576, 'prior_sigma': 0.08727791932744125, 'normalization': 'none'}. Best is trial 896 with value: 0.4533553242683411.
Generating rdkit fingerprints...
Generated fingerprints with 512 features for 841 molecules
Trial 1931: 5-fold CV loss = 0.5646
[I 2025-08-07 23:22:09,064] Trial 1931 finished with value: 0.564624297618866 and parameters: {'fp_type': 'morgan_rdkit', 'combined_morgan_radius': 3, 'combined_morgan_nBits': 1024, 'combined_rdkit_maxPath': 7, 'combined_rdkit_nBits': 1024, 'num_hidden_layers': 3, 'hidden_dim_0': 256, 'hidden_dim_1': 64, 'hidden_dim_2': 64, 'kl_weight': 0.0002943790585180172, 'lr': 0.008319082328187252, 'batch_size': 128, 'dropout_rate': 0.17933532100346983, 'prior_mu': 0.0015933441933205297, 'prior_sigma': 0.07640112000244983, 'normalization': 'none'}. Best is trial 896 with value: 0.4533553242683411.
Generating rdkit fingerprints...
Generated fingerprints with 512 features for 841 molecules
Trial 1934: 5-fold CV loss = 0.4637
[I 2025-08-07 23:22:24,551] Trial 1934 finished with value: 0.46369016766548155 and parameters: {'fp_type': 'morgan_rdkit', 'combined_morgan_radius': 3, 'combined_morgan_nBits': 1024, 'combined_rdkit_maxPath': 7, 'combined_rdkit_nBits': 1024, 'num_hidden_layers': 3, 'hidden_dim_0': 256, 'hidden_dim_1': 64, 'hidden_dim_2': 64, 'kl_weight': 0.00022613457312031267, 'lr': 0.008002000608092558, 'batch_size': 128, 'dropout_rate': 0.17581571634151358, 'prior_mu': 0.003324186326115159, 'prior_sigma': 0.07928531573176337, 'normalization': 'layer'}. Best is trial 896 with value: 0.4533553242683411.
Generating rdkit fingerprints...
Generated fingerprints with 512 features for 841 molecules
Trial 1927: 5-fold CV loss = 0.5734
[I 2025-08-07 23:22:43,910] Trial 1927 finished with value: 0.5734274029731751 and parameters: {'fp_type': 'morgan_rdkit', 'combined_morgan_radius': 3, 'combined_morgan_nBits': 1024, 'combined_rdkit_maxPath': 7, 'combined_rdkit_nBits': 1024, 'num_hidden_layers': 3, 'hidden_dim_0': 256, 'hidden_dim_1': 1024, 'hidden_dim_2': 1024, 'kl_weight': 0.00028947165410488155, 'lr': 0.0081175197420393, 'batch_size': 64, 'dropout_rate': 0.18081287293930115, 'prior_mu': -0.02180520100039682, 'prior_sigma': 0.07465808853830282, 'normalization': 'layer'}. Best is trial 896 with value: 0.4533553242683411.
Generating rdkit fingerprints...
Generated fingerprints with 512 features for 841 molecules
Trial 1935: 5-fold CV loss = 0.6072
