[I 2025-08-08 02:15:33,962] Trial 2778 finished with value: 0.4658449053764343 and parameters: {'fp_type': 'morgan_rdkit', 'combined_morgan_radius': 3, 'combined_morgan_nBits': 1024, 'combined_rdkit_maxPath': 7, 'combined_rdkit_nBits': 1024, 'num_hidden_layers': 3, 'hidden_dim_0': 256, 'hidden_dim_1': 512, 'hidden_dim_2': 64, 'kl_weight': 0.0008194696880460375, 'lr': 0.00783682531306053, 'batch_size': 128, 'dropout_rate': 0.10634761473395764, 'prior_mu': -0.07014451602327819, 'prior_sigma': 0.08964010095902328, 'normalization': 'layer'}. Best is trial 896 with value: 0.4533553242683411.
Generating morgan_rdkit fingerprints...
Generated fingerprints with 2048 features for 841 molecules
Trial 2777: 5-fold CV loss = 0.4659
[I 2025-08-08 02:15:36,543] Trial 2777 finished with value: 0.4659263610839844 and parameters: {'fp_type': 'morgan_rdkit', 'combined_morgan_radius': 3, 'combined_morgan_nBits': 1024, 'combined_rdkit_maxPath': 7, 'combined_rdkit_nBits': 1024, 'num_hidden_layers': 3, 'hidden_dim_0': 1024, 'hidden_dim_1': 1024, 'hidden_dim_2': 64, 'kl_weight': 0.00035186984633599276, 'lr': 0.006630255607662693, 'batch_size': 128, 'dropout_rate': 0.10286613274316954, 'prior_mu': -0.07121533488225308, 'prior_sigma': 0.0885078958710797, 'normalization': 'layer'}. Best is trial 896 with value: 0.4533553242683411.
Generating morgan_rdkit fingerprints...
Generated fingerprints with 2048 features for 841 molecules
Trial 2776: 5-fold CV loss = 0.4656
[I 2025-08-08 02:15:40,339] Trial 2776 finished with value: 0.46562824845314027 and parameters: {'fp_type': 'morgan_rdkit', 'combined_morgan_radius': 3, 'combined_morgan_nBits': 1024, 'combined_rdkit_maxPath': 7, 'combined_rdkit_nBits': 1024, 'num_hidden_layers': 3, 'hidden_dim_0': 1024, 'hidden_dim_1': 1024, 'hidden_dim_2': 64, 'kl_weight': 0.0011858569835344964, 'lr': 0.006763951083270924, 'batch_size': 128, 'dropout_rate': 0.13972301930253056, 'prior_mu': -0.03386958845591666, 'prior_sigma': 0.07676610177686094, 'normalization': 'layer'}. Best is trial 896 with value: 0.4533553242683411.
Generating morgan_rdkit fingerprints...
Generated fingerprints with 2048 features for 841 molecules
Trial 2762: 5-fold CV loss = 0.6073
[I 2025-08-08 02:15:48,477] Trial 2762 finished with value: 0.6072687327861785 and parameters: {'fp_type': 'rdkit', 'rdkit_only_maxPath': 8, 'rdkit_only_nBits': 1024, 'num_hidden_layers': 3, 'hidden_dim_0': 256, 'hidden_dim_1': 1024, 'hidden_dim_2': 1024, 'kl_weight': 0.0002765184679714595, 'lr': 0.007926958832927553, 'batch_size': 32, 'dropout_rate': 0.10274042120667216, 'prior_mu': -0.031545746160198146, 'prior_sigma': 0.07696511781011148, 'normalization': 'layer'}. Best is trial 896 with value: 0.4533553242683411.
Generating morgan_rdkit fingerprints...
Generated fingerprints with 2048 features for 841 molecules
Trial 2780: 5-fold CV loss = 0.5425
[I 2025-08-08 02:16:08,037] Trial 2780 finished with value: 0.5425062954425812 and parameters: {'fp_type': 'morgan_rdkit', 'combined_morgan_radius': 3, 'combined_morgan_nBits': 1024, 'combined_rdkit_maxPath': 7, 'combined_rdkit_nBits': 1024, 'num_hidden_layers': 3, 'hidden_dim_0': 256, 'hidden_dim_1': 1024, 'hidden_dim_2': 64, 'kl_weight': 0.0007035583143922452, 'lr': 0.009050179942589666, 'batch_size': 128, 'dropout_rate': 0.14321116228406156, 'prior_mu': -0.021369584309554785, 'prior_sigma': 0.08379690819310304, 'normalization': 'layer'}. Best is trial 896 with value: 0.4533553242683411.
Generating morgan_rdkit fingerprints...
Generated fingerprints with 2048 features for 841 molecules
Trial 2779: 5-fold CV loss = 0.4945
