[I 2025-08-07 21:22:33,239] Trial 1306 finished with value: 0.4635316252708435 and parameters: {'fp_type': 'morgan_rdkit', 'combined_morgan_radius': 3, 'combined_morgan_nBits': 1024, 'combined_rdkit_maxPath': 7, 'combined_rdkit_nBits': 1024, 'num_hidden_layers': 3, 'hidden_dim_0': 256, 'hidden_dim_1': 1024, 'hidden_dim_2': 64, 'kl_weight': 0.00020189059022451917, 'lr': 0.008243200816855983, 'batch_size': 128, 'dropout_rate': 0.13886396600461404, 'prior_mu': -0.04309470204006672, 'prior_sigma': 0.0784020636229517, 'normalization': 'layer'}. Best is trial 896 with value: 0.4533553242683411.
Generating morgan_rdkit fingerprints...
Generated fingerprints with 2048 features for 841 molecules
Trial 1304: 5-fold CV loss = 0.4696
[I 2025-08-07 21:22:42,640] Trial 1304 finished with value: 0.46957688331604003 and parameters: {'fp_type': 'morgan_rdkit', 'combined_morgan_radius': 3, 'combined_morgan_nBits': 1024, 'combined_rdkit_maxPath': 7, 'combined_rdkit_nBits': 1024, 'num_hidden_layers': 3, 'hidden_dim_0': 128, 'hidden_dim_1': 1024, 'hidden_dim_2': 64, 'kl_weight': 0.0002084188319729631, 'lr': 0.00826839256011005, 'batch_size': 128, 'dropout_rate': 0.13780412429151068, 'prior_mu': -0.04508912302053329, 'prior_sigma': 0.11326215426338852, 'normalization': 'layer'}. Best is trial 896 with value: 0.4533553242683411.
Generating morgan_rdkit fingerprints...
Generated fingerprints with 2048 features for 841 molecules
Trial 1308: 5-fold CV loss = 0.4834
[I 2025-08-07 21:22:46,691] Trial 1308 finished with value: 0.48343983888626096 and parameters: {'fp_type': 'morgan_rdkit', 'combined_morgan_radius': 3, 'combined_morgan_nBits': 1024, 'combined_rdkit_maxPath': 5, 'combined_rdkit_nBits': 1024, 'num_hidden_layers': 3, 'hidden_dim_0': 256, 'hidden_dim_1': 1024, 'hidden_dim_2': 64, 'kl_weight': 0.0003194362113258983, 'lr': 0.007095462064628839, 'batch_size': 128, 'dropout_rate': 0.14126068415101065, 'prior_mu': -0.042095702032209345, 'prior_sigma': 0.07363606138253223, 'normalization': 'layer'}. Best is trial 896 with value: 0.4533553242683411.
Generating morgan_rdkit fingerprints...
Generated fingerprints with 2048 features for 841 molecules
Trial 1307: 5-fold CV loss = 0.4860
[I 2025-08-07 21:22:59,978] Trial 1307 finished with value: 0.48603634238243104 and parameters: {'fp_type': 'morgan_rdkit', 'combined_morgan_radius': 3, 'combined_morgan_nBits': 1024, 'combined_rdkit_maxPath': 5, 'combined_rdkit_nBits': 1024, 'num_hidden_layers': 3, 'hidden_dim_0': 256, 'hidden_dim_1': 1024, 'hidden_dim_2': 64, 'kl_weight': 0.005947734231694005, 'lr': 0.008537572282510694, 'batch_size': 128, 'dropout_rate': 0.13872028863187302, 'prior_mu': -0.0010315063738217736, 'prior_sigma': 0.07855037156462696, 'normalization': 'layer'}. Best is trial 896 with value: 0.4533553242683411.
Generating morgan_rdkit fingerprints...
Generated fingerprints with 2048 features for 841 molecules
Trial 1309: 5-fold CV loss = 0.4784
[I 2025-08-07 21:23:12,191] Trial 1309 finished with value: 0.47842627167701723 and parameters: {'fp_type': 'morgan_rdkit', 'combined_morgan_radius': 3, 'combined_morgan_nBits': 1024, 'combined_rdkit_maxPath': 7, 'combined_rdkit_nBits': 1024, 'num_hidden_layers': 3, 'hidden_dim_0': 256, 'hidden_dim_1': 1024, 'hidden_dim_2': 64, 'kl_weight': 0.005470770585818956, 'lr': 0.007206176338373607, 'batch_size': 128, 'dropout_rate': 0.07794531654788867, 'prior_mu': -0.03296400617719097, 'prior_sigma': 0.07298196683046819, 'normalization': 'layer'}. Best is trial 896 with value: 0.4533553242683411.
Generating morgan_rdkit fingerprints...
Generated fingerprints with 2048 features for 841 molecules
Trial 1311: 5-fold CV loss = 0.4641
[I 2025-08-07 21:23:26,016] Trial 1311 finished with value: 0.46414140462875364 and parameters: {'fp_type': 'morgan_rdkit', 'combined_morgan_radius': 3, 'combined_morgan_nBits': 1024, 'combined_rdkit_maxPath': 7, 'combined_rdkit_nBits': 1024, 'num_hidden_layers': 3, 'hidden_dim_0': 256, 'hidden_dim_1': 1024, 'hidden_dim_2': 64, 'kl_weight': 0.0005079866358549381, 'lr': 0.007268834176909134, 'batch_size': 128, 'dropout_rate': 0.07886573740818043, 'prior_mu': -0.0331495688091253, 'prior_sigma': 0.09910904179511, 'normalization': 'layer'}. Best is trial 896 with value: 0.4533553242683411.
Generating morgan_rdkit fingerprints...
Generated fingerprints with 2048 features for 841 molecules
Trial 1313: 5-fold CV loss = 0.8869
[I 2025-08-07 21:23:34,928] Trial 1313 finished with value: 0.8869325876235962 and parameters: {'fp_type': 'morgan_rdkit', 'combined_morgan_radius': 3, 'combined_morgan_nBits': 1024, 'combined_rdkit_maxPath': 7, 'combined_rdkit_nBits': 1024, 'num_hidden_layers': 3, 'hidden_dim_0': 256, 'hidden_dim_1': 1024, 'hidden_dim_2': 1024, 'kl_weight': 0.0004947882020225064, 'lr': 0.006149050827860536, 'batch_size': 128, 'dropout_rate': 0.16866265129939917, 'prior_mu': -0.02046154913241631, 'prior_sigma': 0.11872669645570827, 'normalization': 'none'}. Best is trial 896 with value: 0.4533553242683411.
Generating morgan_rdkit fingerprints...
Generated fingerprints with 2048 features for 841 molecules
Trial 1310: 5-fold CV loss = 0.4669
[I 2025-08-07 21:23:40,027] Trial 1310 finished with value: 0.46691721081733706 and parameters: {'fp_type': 'morgan_rdkit', 'combined_morgan_radius': 3, 'combined_morgan_nBits': 1024, 'combined_rdkit_maxPath': 7, 'combined_rdkit_nBits': 1024, 'num_hidden_layers': 3, 'hidden_dim_0': 256, 'hidden_dim_1': 1024, 'hidden_dim_2': 64, 'kl_weight': 0.0005002012825293158, 'lr': 0.007165334925332912, 'batch_size': 128, 'dropout_rate': 0.07571835547717531, 'prior_mu': 0.013526557327386765, 'prior_sigma': 0.07366499935785506, 'normalization': 'layer'}. Best is trial 896 with value: 0.4533553242683411.
Generating morgan_rdkit fingerprints...
Generated fingerprints with 2048 features for 841 molecules
Trial 1314: 5-fold CV loss = 0.7405
[I 2025-08-07 21:23:54,175] Trial 1314 finished with value: 0.7404579520225525 and parameters: {'fp_type': 'morgan_rdkit', 'combined_morgan_radius': 3, 'combined_morgan_nBits': 1024, 'combined_rdkit_maxPath': 7, 'combined_rdkit_nBits': 1024, 'num_hidden_layers': 3, 'hidden_dim_0': 256, 'hidden_dim_1': 1024, 'hidden_dim_2': 64, 'kl_weight': 0.0013337411192234077, 'lr': 0.006119937262470325, 'batch_size': 128, 'dropout_rate': 0.17391438793721695, 'prior_mu': 0.014047573114797148, 'prior_sigma': 0.11857984681562542, 'normalization': 'none'}. Best is trial 896 with value: 0.4533553242683411.
Generating morgan_rdkit fingerprints...
Generated fingerprints with 2048 features for 841 molecules
Trial 1315: 5-fold CV loss = 0.5622
[I 2025-08-07 21:24:13,838] Trial 1315 finished with value: 0.56216841340065 and parameters: {'fp_type': 'morgan_rdkit', 'combined_morgan_radius': 3, 'combined_morgan_nBits': 1024, 'combined_rdkit_maxPath': 7, 'combined_rdkit_nBits': 1024, 'num_hidden_layers': 3, 'hidden_dim_0': 256, 'hidden_dim_1': 1024, 'hidden_dim_2': 64, 'kl_weight': 0.00023898558558337247, 'lr': 0.009334936977471873, 'batch_size': 128, 'dropout_rate': 0.1077300640975366, 'prior_mu': -0.014166768435462957, 'prior_sigma': 0.09575094713684025, 'normalization': 'layer'}. Best is trial 896 with value: 0.4533553242683411.
Generating morgan_rdkit fingerprints...
Generated fingerprints with 2048 features for 841 molecules
Trial 1316: 5-fold CV loss = 0.4619
[I 2025-08-07 21:24:27,678] Trial 1316 finished with value: 0.4618525803089142 and parameters: {'fp_type': 'morgan_rdkit', 'combined_morgan_radius': 3, 'combined_morgan_nBits': 1024, 'combined_rdkit_maxPath': 7, 'combined_rdkit_nBits': 1024, 'num_hidden_layers': 3, 'hidden_dim_0': 256, 'hidden_dim_1': 1024, 'hidden_dim_2': 64, 'kl_weight': 0.00023830311732063003, 'lr': 0.009362907808090416, 'batch_size': 128, 'dropout_rate': 0.10870257695901292, 'prior_mu': -0.01754205826676579, 'prior_sigma': 0.06432418060549039, 'normalization': 'layer'}. Best is trial 896 with value: 0.4533553242683411.
Generating morgan_rdkit fingerprints...
Generated fingerprints with 2048 features for 841 molecules
Trial 1317: 5-fold CV loss = 0.4657
[I 2025-08-07 21:24:37,114] Trial 1317 finished with value: 0.465679532289505 and parameters: {'fp_type': 'morgan_rdkit', 'combined_morgan_radius': 3, 'combined_morgan_nBits': 1024, 'combined_rdkit_maxPath': 7, 'combined_rdkit_nBits': 1024, 'num_hidden_layers': 3, 'hidden_dim_0': 256, 'hidden_dim_1': 1024, 'hidden_dim_2': 64, 'kl_weight': 0.00023742279838579353, 'lr': 0.009164056743728298, 'batch_size': 64, 'dropout_rate': 0.10823581011603331, 'prior_mu': -0.014733947577165604, 'prior_sigma': 0.09123351361254799, 'normalization': 'layer'}. Best is trial 896 with value: 0.4533553242683411.
Generating morgan_rdkit fingerprints...
Generated fingerprints with 2048 features for 841 molecules
Trial 1312: 5-fold CV loss = 0.4626
[I 2025-08-07 21:24:47,226] Trial 1312 finished with value: 0.46263784170150757 and parameters: {'fp_type': 'morgan_rdkit', 'combined_morgan_radius': 3, 'combined_morgan_nBits': 1024, 'combined_rdkit_maxPath': 7, 'combined_rdkit_nBits': 1024, 'num_hidden_layers': 3, 'hidden_dim_0': 256, 'hidden_dim_1': 1024, 'hidden_dim_2': 64, 'kl_weight': 0.00024387969386993751, 'lr': 0.009936257235965076, 'batch_size': 128, 'dropout_rate': 0.07512457179143177, 'prior_mu': -0.029654299608694187, 'prior_sigma': 0.118540606789764, 'normalization': 'layer'}. Best is trial 896 with value: 0.4533553242683411.
Generating morgan_rdkit fingerprints...
Generated fingerprints with 2048 features for 841 molecules
Trial 1320: 5-fold CV loss = 0.7464
[I 2025-08-07 21:24:56,700] Trial 1320 finished with value: 0.7464336216449737 and parameters: {'fp_type': 'morgan_rdkit', 'combined_morgan_radius': 3, 'combined_morgan_nBits': 1024, 'combined_rdkit_maxPath': 7, 'combined_rdkit_nBits': 1024, 'num_hidden_layers': 3, 'hidden_dim_0': 256, 'hidden_dim_1': 1024, 'hidden_dim_2': 256, 'kl_weight': 0.0003485095757837478, 'lr': 0.0062547915580017195, 'batch_size': 128, 'dropout_rate': 0.12434463001568961, 'prior_mu': -0.02753763990906883, 'prior_sigma': 0.08220735548650179, 'normalization': 'layer'}. Best is trial 896 with value: 0.4533553242683411.
Generating morgan_rdkit fingerprints...
Generated fingerprints with 2048 features for 841 molecules
Trial 1318: 5-fold CV loss = 0.4683
[I 2025-08-07 21:25:08,883] Trial 1318 finished with value: 0.4682557165622711 and parameters: {'fp_type': 'morgan_rdkit', 'combined_morgan_radius': 3, 'combined_morgan_nBits': 1024, 'combined_rdkit_maxPath': 7, 'combined_rdkit_nBits': 1024, 'num_hidden_layers': 3, 'hidden_dim_0': 256, 'hidden_dim_1': 1024, 'hidden_dim_2': 64, 'kl_weight': 0.0003477164909448446, 'lr': 0.006557174493865412, 'batch_size': 64, 'dropout_rate': 0.15015215010187008, 'prior_mu': -0.023454012356280366, 'prior_sigma': 0.09214728194284416, 'normalization': 'layer'}. Best is trial 896 with value: 0.4533553242683411.
Generating rdkit fingerprints...
Generated fingerprints with 512 features for 841 molecules
Trial 1322: 5-fold CV loss = 0.4656
[I 2025-08-07 21:25:31,013] Trial 1322 finished with value: 0.4656005322933197 and parameters: {'fp_type': 'morgan_rdkit', 'combined_morgan_radius': 3, 'combined_morgan_nBits': 1024, 'combined_rdkit_maxPath': 7, 'combined_rdkit_nBits': 1024, 'num_hidden_layers': 3, 'hidden_dim_0': 256, 'hidden_dim_1': 1024, 'hidden_dim_2': 64, 'kl_weight': 0.0003053433139821801, 'lr': 0.007565068454130967, 'batch_size': 128, 'dropout_rate': 0.1518852783409973, 'prior_mu': -0.020935432443859453, 'prior_sigma': 0.08984653601496481, 'normalization': 'layer'}. Best is trial 896 with value: 0.4533553242683411.
Generating morgan_rdkit fingerprints...
Generated fingerprints with 2048 features for 841 molecules
Trial 1323: 5-fold CV loss = 0.5290
[I 2025-08-07 21:25:49,832] Trial 1323 finished with value: 0.5290181934833527 and parameters: {'fp_type': 'rdkit', 'rdkit_only_maxPath': 5, 'rdkit_only_nBits': 512, 'num_hidden_layers': 3, 'hidden_dim_0': 256, 'hidden_dim_1': 1024, 'hidden_dim_2': 64, 'kl_weight': 0.00030526609043834225, 'lr': 0.007664144707716119, 'batch_size': 128, 'dropout_rate': 0.0926509057891224, 'prior_mu': 0.0048610544995513014, 'prior_sigma': 0.1247875754484862, 'normalization': 'layer'}. Best is trial 896 with value: 0.4533553242683411.
Generating morgan_rdkit fingerprints...
Generated fingerprints with 2048 features for 841 molecules
Trial 1319: 5-fold CV loss = 0.4661
[I 2025-08-07 21:25:54,389] Trial 1319 finished with value: 0.46610196232795714 and parameters: {'fp_type': 'morgan_rdkit', 'combined_morgan_radius': 3, 'combined_morgan_nBits': 1024, 'combined_rdkit_maxPath': 7, 'combined_rdkit_nBits': 1024, 'num_hidden_layers': 3, 'hidden_dim_0': 256, 'hidden_dim_1': 1024, 'hidden_dim_2': 256, 'kl_weight': 0.0003429058971930271, 'lr': 0.006386876994636391, 'batch_size': 64, 'dropout_rate': 0.14805698369876757, 'prior_mu': -0.026754155210776, 'prior_sigma': 0.09135855564037099, 'normalization': 'layer'}. Best is trial 896 with value: 0.4533553242683411.
Generating morgan_rdkit fingerprints...
Generated fingerprints with 2048 features for 841 molecules
Trial 1326: 5-fold CV loss = 0.8871
[I 2025-08-07 21:26:11,393] Trial 1326 finished with value: 0.887116265296936 and parameters: {'fp_type': 'morgan_rdkit', 'combined_morgan_radius': 3, 'combined_morgan_nBits': 1024, 'combined_rdkit_maxPath': 7, 'combined_rdkit_nBits': 1024, 'num_hidden_layers': 3, 'hidden_dim_0': 256, 'hidden_dim_1': 256, 'hidden_dim_2': 512, 'kl_weight': 0.00040901085459300857, 'lr': 0.0058858144498295335, 'batch_size': 128, 'dropout_rate': 0.12361270975881322, 'prior_mu': -0.006854296535213717, 'prior_sigma': 0.08383776307635091, 'normalization': 'layer'}. Best is trial 896 with value: 0.4533553242683411.
Generating morgan_rdkit fingerprints...
Generated fingerprints with 2048 features for 841 molecules
Trial 1321: 5-fold CV loss = 0.6283
[I 2025-08-07 21:26:14,444] Trial 1321 finished with value: 0.6283070027828217 and parameters: {'fp_type': 'morgan_rdkit', 'combined_morgan_radius': 3, 'combined_morgan_nBits': 1024, 'combined_rdkit_maxPath': 7, 'combined_rdkit_nBits': 1024, 'num_hidden_layers': 3, 'hidden_dim_0': 256, 'hidden_dim_1': 1024, 'hidden_dim_2': 256, 'kl_weight': 0.00034938500146660057, 'lr': 0.006367269958363756, 'batch_size': 128, 'dropout_rate': 0.12531404582034877, 'prior_mu': 0.004911607384098818, 'prior_sigma': 0.08291352106687787, 'normalization': 'layer'}. Best is trial 896 with value: 0.4533553242683411.
Generating morgan_rdkit fingerprints...
Generated fingerprints with 2048 features for 841 molecules
Trial 1325: 5-fold CV loss = 0.8127
[I 2025-08-07 21:26:16,470] Trial 1325 finished with value: 0.8127247393131256 and parameters: {'fp_type': 'morgan_rdkit', 'combined_morgan_radius': 3, 'combined_morgan_nBits': 1024, 'combined_rdkit_maxPath': 7, 'combined_rdkit_nBits': 1024, 'num_hidden_layers': 3, 'hidden_dim_0': 256, 'hidden_dim_1': 1024, 'hidden_dim_2': 512, 'kl_weight': 0.0003991698036511017, 'lr': 0.005841240827130337, 'batch_size': 128, 'dropout_rate': 0.05876034082960139, 'prior_mu': -0.006856574448507471, 'prior_sigma': 0.09814701196494445, 'normalization': 'layer'}. Best is trial 896 with value: 0.4533553242683411.
Generating morgan_rdkit fingerprints...
Generated fingerprints with 2048 features for 841 molecules
Trial 1324: 5-fold CV loss = 0.4657
[I 2025-08-07 21:26:24,321] Trial 1324 finished with value: 0.4656578600406647 and parameters: {'fp_type': 'morgan_rdkit', 'combined_morgan_radius': 3, 'combined_morgan_nBits': 1024, 'combined_rdkit_maxPath': 7, 'combined_rdkit_nBits': 1024, 'num_hidden_layers': 3, 'hidden_dim_0': 256, 'hidden_dim_1': 1024, 'hidden_dim_2': 64, 'kl_weight': 0.00029742892171988854, 'lr': 0.005661891140711104, 'batch_size': 128, 'dropout_rate': 0.08991719658820801, 'prior_mu': 0.0071623465650171025, 'prior_sigma': 0.12584123216242038, 'normalization': 'layer'}. Best is trial 896 with value: 0.4533553242683411.
Generating morgan_rdkit fingerprints...
Generated fingerprints with 2048 features for 841 molecules
Trial 1329: 5-fold CV loss = 0.4706
[I 2025-08-07 21:26:53,606] Trial 1329 finished with value: 0.47059960961341857 and parameters: {'fp_type': 'morgan_rdkit', 'combined_morgan_radius': 3, 'combined_morgan_nBits': 1024, 'combined_rdkit_maxPath': 7, 'combined_rdkit_nBits': 1024, 'num_hidden_layers': 3, 'hidden_dim_0': 256, 'hidden_dim_1': 1024, 'hidden_dim_2': 64, 'kl_weight': 0.0002794201470786736, 'lr': 0.00688024895858066, 'batch_size': 128, 'dropout_rate': 0.08732523265812742, 'prior_mu': -0.03537708593296063, 'prior_sigma': 0.0682843129103517, 'normalization': 'layer'}. Best is trial 896 with value: 0.4533553242683411.
Generating morgan_rdkit fingerprints...
Generated fingerprints with 2048 features for 841 molecules
Trial 1330: 5-fold CV loss = 0.4650
[I 2025-08-07 21:27:01,238] Trial 1330 finished with value: 0.46504189968109133 and parameters: {'fp_type': 'morgan_rdkit', 'combined_morgan_radius': 3, 'combined_morgan_nBits': 1024, 'combined_rdkit_maxPath': 7, 'combined_rdkit_nBits': 1024, 'num_hidden_layers': 3, 'hidden_dim_0': 1024, 'hidden_dim_1': 1024, 'hidden_dim_2': 64, 'kl_weight': 0.0002705572259699816, 'lr': 0.008390998776832205, 'batch_size': 128, 'dropout_rate': 0.18356517964711042, 'prior_mu': -0.03778864772273779, 'prior_sigma': 0.06951687777817482, 'normalization': 'layer'}. Best is trial 896 with value: 0.4533553242683411.
Generating morgan_rdkit fingerprints...
Generated fingerprints with 2048 features for 841 molecules
Trial 1327: 5-fold CV loss = 0.5518
[I 2025-08-07 21:27:10,857] Trial 1327 finished with value: 0.5517987489700318 and parameters: {'fp_type': 'morgan_rdkit', 'combined_morgan_radius': 3, 'combined_morgan_nBits': 1024, 'combined_rdkit_maxPath': 7, 'combined_rdkit_nBits': 1024, 'num_hidden_layers': 3, 'hidden_dim_0': 256, 'hidden_dim_1': 1024, 'hidden_dim_2': 64, 'kl_weight': 0.0024234184662617407, 'lr': 0.005625732379954427, 'batch_size': 128, 'dropout_rate': 0.05889257745997652, 'prior_mu': 0.0018471484272306335, 'prior_sigma': 0.09850858819020622, 'normalization': 'layer'}. Best is trial 896 with value: 0.4533553242683411.
Generating morgan_rdkit fingerprints...
Generated fingerprints with 2048 features for 841 molecules
Trial 1331: 5-fold CV loss = 0.4716
[I 2025-08-07 21:27:30,789] Trial 1331 finished with value: 0.47160451412200927 and parameters: {'fp_type': 'morgan_rdkit', 'combined_morgan_radius': 3, 'combined_morgan_nBits': 1024, 'combined_rdkit_maxPath': 7, 'combined_rdkit_nBits': 1024, 'num_hidden_layers': 3, 'hidden_dim_0': 1024, 'hidden_dim_1': 1024, 'hidden_dim_2': 64, 'kl_weight': 0.00018094135403557313, 'lr': 0.008476261447840172, 'batch_size': 128, 'dropout_rate': 0.1639465942216689, 'prior_mu': -0.012782765259282246, 'prior_sigma': 0.07682946041914664, 'normalization': 'layer'}. Best is trial 896 with value: 0.4533553242683411.
Generating morgan_rdkit fingerprints...
Generated fingerprints with 2048 features for 841 molecules
Trial 1332: 5-fold CV loss = 0.4577
[I 2025-08-07 21:27:38,047] Trial 1332 finished with value: 0.45766907930374146 and parameters: {'fp_type': 'morgan_rdkit', 'combined_morgan_radius': 3, 'combined_morgan_nBits': 1024, 'combined_rdkit_maxPath': 7, 'combined_rdkit_nBits': 1024, 'num_hidden_layers': 3, 'hidden_dim_0': 256, 'hidden_dim_1': 1024, 'hidden_dim_2': 64, 'kl_weight': 0.00018032642345097727, 'lr': 0.0075127611608771586, 'batch_size': 128, 'dropout_rate': 0.16639485686500113, 'prior_mu': -0.012994518734052942, 'prior_sigma': 0.0777859720847753, 'normalization': 'layer'}. Best is trial 896 with value: 0.4533553242683411.
Generating morgan_rdkit fingerprints...
Generated fingerprints with 2048 features for 841 molecules
Trial 1328: 5-fold CV loss = 0.4665
[I 2025-08-07 21:27:45,848] Trial 1328 finished with value: 0.466456001996994 and parameters: {'fp_type': 'morgan_rdkit', 'combined_morgan_radius': 3, 'combined_morgan_nBits': 1024, 'combined_rdkit_maxPath': 7, 'combined_rdkit_nBits': 1024, 'num_hidden_layers': 3, 'hidden_dim_0': 256, 'hidden_dim_1': 1024, 'hidden_dim_2': 64, 'kl_weight': 0.00027594217319937855, 'lr': 0.005672865629664229, 'batch_size': 128, 'dropout_rate': 0.1649532527210777, 'prior_mu': -0.01305562848159678, 'prior_sigma': 0.06920529530365102, 'normalization': 'layer'}. Best is trial 896 with value: 0.4533553242683411.
Generating morgan_rdkit fingerprints...
Generated fingerprints with 2048 features for 841 molecules
Trial 1333: 5-fold CV loss = 0.4697
[I 2025-08-07 21:28:02,500] Trial 1333 finished with value: 0.4697037756443024 and parameters: {'fp_type': 'morgan_rdkit', 'combined_morgan_radius': 3, 'combined_morgan_nBits': 1024, 'combined_rdkit_maxPath': 7, 'combined_rdkit_nBits': 1024, 'num_hidden_layers': 3, 'hidden_dim_0': 256, 'hidden_dim_1': 1024, 'hidden_dim_2': 64, 'kl_weight': 0.00017014228889188695, 'lr': 0.0075105367318486155, 'batch_size': 128, 'dropout_rate': 0.10017623582097386, 'prior_mu': -0.012364024439544319, 'prior_sigma': 0.07950863879167518, 'normalization': 'layer'}. Best is trial 896 with value: 0.4533553242683411.
Generating morgan_rdkit fingerprints...
Generated fingerprints with 2048 features for 841 molecules
Trial 1334: 5-fold CV loss = 0.4690
[I 2025-08-07 21:28:13,504] Trial 1334 finished with value: 0.4689853250980377 and parameters: {'fp_type': 'morgan_rdkit', 'combined_morgan_radius': 3, 'combined_morgan_nBits': 1024, 'combined_rdkit_maxPath': 7, 'combined_rdkit_nBits': 1024, 'num_hidden_layers': 3, 'hidden_dim_0': 256, 'hidden_dim_1': 1024, 'hidden_dim_2': 64, 'kl_weight': 0.0003137564381512303, 'lr': 0.0074259500423284166, 'batch_size': 128, 'dropout_rate': 0.11459767161254782, 'prior_mu': -0.015724188372548343, 'prior_sigma': 0.07909899500045187, 'normalization': 'layer'}. Best is trial 896 with value: 0.4533553242683411.
Generating morgan_rdkit fingerprints...
Generated fingerprints with 2048 features for 841 molecules
Trial 1335: 5-fold CV loss = 0.4615
