[I 2025-08-07 20:29:17,074] Trial 1035 finished with value: 0.46762728691101074 and parameters: {'fp_type': 'morgan_rdkit', 'combined_morgan_radius': 3, 'combined_morgan_nBits': 1024, 'combined_rdkit_maxPath': 7, 'combined_rdkit_nBits': 1024, 'num_hidden_layers': 3, 'hidden_dim_0': 256, 'hidden_dim_1': 1024, 'hidden_dim_2': 64, 'kl_weight': 0.00040427596097007934, 'lr': 0.005273894059416864, 'batch_size': 128, 'dropout_rate': 0.07923377170541157, 'prior_mu': -0.03314951301301692, 'prior_sigma': 0.07317955463683228, 'normalization': 'layer'}. Best is trial 896 with value: 0.4533553242683411.
Generating morgan_rdkit fingerprints...
Generated fingerprints with 2048 features for 841 molecules
Trial 1037: 5-fold CV loss = 0.4777
[I 2025-08-07 20:29:29,662] Trial 1037 finished with value: 0.47768995761871336 and parameters: {'fp_type': 'morgan_rdkit', 'combined_morgan_radius': 3, 'combined_morgan_nBits': 1024, 'combined_rdkit_maxPath': 8, 'combined_rdkit_nBits': 1024, 'num_hidden_layers': 3, 'hidden_dim_0': 256, 'hidden_dim_1': 1024, 'hidden_dim_2': 64, 'kl_weight': 0.00041723687387450366, 'lr': 0.005089335107505456, 'batch_size': 128, 'dropout_rate': 0.1204142187403122, 'prior_mu': -0.006582836726282765, 'prior_sigma': 0.0704266668477513, 'normalization': 'layer'}. Best is trial 896 with value: 0.4533553242683411.
Generating morgan_rdkit fingerprints...
Generated fingerprints with 2048 features for 841 molecules
Trial 1036: 5-fold CV loss = 0.4601
[I 2025-08-07 20:29:44,909] Trial 1036 finished with value: 0.46007784008979796 and parameters: {'fp_type': 'morgan_rdkit', 'combined_morgan_radius': 3, 'combined_morgan_nBits': 1024, 'combined_rdkit_maxPath': 7, 'combined_rdkit_nBits': 1024, 'num_hidden_layers': 3, 'hidden_dim_0': 256, 'hidden_dim_1': 1024, 'hidden_dim_2': 64, 'kl_weight': 0.00019855241972041598, 'lr': 0.00407614182221483, 'batch_size': 128, 'dropout_rate': 0.07436841622480123, 'prior_mu': -0.034493991076009235, 'prior_sigma': 0.07297718547091855, 'normalization': 'layer'}. Best is trial 896 with value: 0.4533553242683411.
Generating morgan_rdkit fingerprints...
Generated fingerprints with 2048 features for 841 molecules
Trial 1040: 5-fold CV loss = 0.4875
[I 2025-08-07 20:29:52,433] Trial 1040 finished with value: 0.48748125433921813 and parameters: {'fp_type': 'morgan_rdkit', 'combined_morgan_radius': 3, 'combined_morgan_nBits': 1024, 'combined_rdkit_maxPath': 5, 'combined_rdkit_nBits': 1024, 'num_hidden_layers': 3, 'hidden_dim_0': 256, 'hidden_dim_1': 1024, 'hidden_dim_2': 64, 'kl_weight': 0.0002774844261213457, 'lr': 0.006056394980048325, 'batch_size': 128, 'dropout_rate': 0.09418694832246517, 'prior_mu': -0.02269337846710215, 'prior_sigma': 0.07551184436601943, 'normalization': 'layer'}. Best is trial 896 with value: 0.4533553242683411.
Generating morgan_rdkit fingerprints...
Generated fingerprints with 2048 features for 841 molecules
Trial 1039: 5-fold CV loss = 0.4787
[I 2025-08-07 20:30:05,663] Trial 1039 finished with value: 0.47870728373527527 and parameters: {'fp_type': 'morgan_rdkit', 'combined_morgan_radius': 3, 'combined_morgan_nBits': 1024, 'combined_rdkit_maxPath': 8, 'combined_rdkit_nBits': 1024, 'num_hidden_layers': 3, 'hidden_dim_0': 256, 'hidden_dim_1': 1024, 'hidden_dim_2': 64, 'kl_weight': 0.00037047729519159786, 'lr': 0.005066774325802627, 'batch_size': 128, 'dropout_rate': 0.12069257666744283, 'prior_mu': -0.008477663566502024, 'prior_sigma': 0.07423493230689854, 'normalization': 'layer'}. Best is trial 896 with value: 0.4533553242683411.
Generating morgan_rdkit fingerprints...
Generated fingerprints with 2048 features for 841 molecules
Trial 1042: 5-fold CV loss = 0.5576
[I 2025-08-07 20:30:22,325] Trial 1042 finished with value: 0.5575772404670716 and parameters: {'fp_type': 'morgan_rdkit', 'combined_morgan_radius': 3, 'combined_morgan_nBits': 1024, 'combined_rdkit_maxPath': 7, 'combined_rdkit_nBits': 1024, 'num_hidden_layers': 3, 'hidden_dim_0': 256, 'hidden_dim_1': 1024, 'hidden_dim_2': 64, 'kl_weight': 0.00019217060845195722, 'lr': 0.003947090652075645, 'batch_size': 128, 'dropout_rate': 0.06268090406381603, 'prior_mu': -0.045105985720059305, 'prior_sigma': 0.07357156406095015, 'normalization': 'layer'}. Best is trial 896 with value: 0.4533553242683411.
Generating morgan_rdkit fingerprints...
Generated fingerprints with 2048 features for 841 molecules
Trial 1041: 5-fold CV loss = 0.4891
[I 2025-08-07 20:30:27,457] Trial 1041 finished with value: 0.4891274392604828 and parameters: {'fp_type': 'morgan_rdkit', 'combined_morgan_radius': 3, 'combined_morgan_nBits': 1024, 'combined_rdkit_maxPath': 5, 'combined_rdkit_nBits': 1024, 'num_hidden_layers': 3, 'hidden_dim_0': 256, 'hidden_dim_1': 1024, 'hidden_dim_2': 64, 'kl_weight': 0.0001916054346523752, 'lr': 0.004804438866692994, 'batch_size': 128, 'dropout_rate': 0.06424187949666743, 'prior_mu': -0.05255802134697138, 'prior_sigma': 0.07395683890343453, 'normalization': 'layer'}. Best is trial 896 with value: 0.4533553242683411.
Generating morgan_rdkit fingerprints...
Generated fingerprints with 2048 features for 841 molecules
Trial 1038: 5-fold CV loss = 0.5649
[I 2025-08-07 20:30:35,970] Trial 1038 finished with value: 0.5649361431598663 and parameters: {'fp_type': 'morgan_rdkit', 'combined_morgan_radius': 3, 'combined_morgan_nBits': 1024, 'combined_rdkit_maxPath': 8, 'combined_rdkit_nBits': 1024, 'num_hidden_layers': 3, 'hidden_dim_0': 256, 'hidden_dim_1': 1024, 'hidden_dim_2': 64, 'kl_weight': 0.000393498692298488, 'lr': 0.005115097852202411, 'batch_size': 128, 'dropout_rate': 0.11886214871632553, 'prior_mu': -0.009022307008389869, 'prior_sigma': 0.07323059253547115, 'normalization': 'layer'}. Best is trial 896 with value: 0.4533553242683411.
Generating morgan_rdkit fingerprints...
Generated fingerprints with 2048 features for 841 molecules
Trial 1043: 5-fold CV loss = 0.4682
[I 2025-08-07 20:30:55,383] Trial 1043 finished with value: 0.4682012677192688 and parameters: {'fp_type': 'morgan_rdkit', 'combined_morgan_radius': 3, 'combined_morgan_nBits': 1024, 'combined_rdkit_maxPath': 7, 'combined_rdkit_nBits': 1024, 'num_hidden_layers': 3, 'hidden_dim_0': 256, 'hidden_dim_1': 1024, 'hidden_dim_2': 64, 'kl_weight': 0.00019613132816563578, 'lr': 0.0038967353383821783, 'batch_size': 128, 'dropout_rate': 0.04189540162730786, 'prior_mu': -0.05342462768845049, 'prior_sigma': 0.07108299799149856, 'normalization': 'layer'}. Best is trial 896 with value: 0.4533553242683411.
Generating morgan_rdkit fingerprints...
Generated fingerprints with 2048 features for 841 molecules
Trial 1044: 5-fold CV loss = 0.4711
[I 2025-08-07 20:31:02,513] Trial 1044 finished with value: 0.47112047076225283 and parameters: {'fp_type': 'morgan_rdkit', 'combined_morgan_radius': 3, 'combined_morgan_nBits': 1024, 'combined_rdkit_maxPath': 7, 'combined_rdkit_nBits': 1024, 'num_hidden_layers': 3, 'hidden_dim_0': 256, 'hidden_dim_1': 1024, 'hidden_dim_2': 64, 'kl_weight': 0.0001939938552398181, 'lr': 0.004185832077955959, 'batch_size': 128, 'dropout_rate': 0.05495823213221418, 'prior_mu': -0.03783914205243395, 'prior_sigma': 0.06934621101022725, 'normalization': 'layer'}. Best is trial 896 with value: 0.4533553242683411.
Generating morgan_rdkit fingerprints...
Generated fingerprints with 1536 features for 841 molecules
Trial 1045: 5-fold CV loss = 0.4678
[I 2025-08-07 20:31:22,476] Trial 1045 finished with value: 0.4678116083145142 and parameters: {'fp_type': 'morgan_rdkit', 'combined_morgan_radius': 3, 'combined_morgan_nBits': 1024, 'combined_rdkit_maxPath': 7, 'combined_rdkit_nBits': 1024, 'num_hidden_layers': 3, 'hidden_dim_0': 256, 'hidden_dim_1': 1024, 'hidden_dim_2': 64, 'kl_weight': 0.0002024715186304232, 'lr': 0.004346116948430394, 'batch_size': 128, 'dropout_rate': 0.03255721137773171, 'prior_mu': -0.040433763603675774, 'prior_sigma': 0.0687908915636721, 'normalization': 'layer'}. Best is trial 896 with value: 0.4533553242683411.
Generating morgan_rdkit fingerprints...
Generated fingerprints with 1536 features for 841 molecules
Trial 1047: 5-fold CV loss = 0.5420
[I 2025-08-07 20:31:28,126] Trial 1047 finished with value: 0.5419699728488923 and parameters: {'fp_type': 'morgan_rdkit', 'combined_morgan_radius': 3, 'combined_morgan_nBits': 1024, 'combined_rdkit_maxPath': 7, 'combined_rdkit_nBits': 1024, 'num_hidden_layers': 3, 'hidden_dim_0': 256, 'hidden_dim_1': 1024, 'hidden_dim_2': 64, 'kl_weight': 0.00018005027308835964, 'lr': 0.004092620877358607, 'batch_size': 128, 'dropout_rate': 0.052287597597636626, 'prior_mu': -0.03984713652468397, 'prior_sigma': 0.05557101909517122, 'normalization': 'layer'}. Best is trial 896 with value: 0.4533553242683411.
Generating morgan_rdkit fingerprints...
Generated fingerprints with 1536 features for 841 molecules
Trial 1048: 5-fold CV loss = 0.4833
[I 2025-08-07 20:31:37,460] Trial 1048 finished with value: 0.48329102993011475 and parameters: {'fp_type': 'morgan_rdkit', 'combined_morgan_radius': 3, 'combined_morgan_nBits': 1024, 'combined_rdkit_maxPath': 7, 'combined_rdkit_nBits': 512, 'num_hidden_layers': 3, 'hidden_dim_0': 256, 'hidden_dim_1': 1024, 'hidden_dim_2': 64, 'kl_weight': 0.00022105563320910858, 'lr': 0.004275960335770415, 'batch_size': 128, 'dropout_rate': 0.08506364972319008, 'prior_mu': -0.02351354115516662, 'prior_sigma': 0.06444375518113267, 'normalization': 'layer'}. Best is trial 896 with value: 0.4533553242683411.
Generating morgan_rdkit fingerprints...
Generated fingerprints with 2048 features for 841 molecules
Trial 1049: 5-fold CV loss = 0.8883
[I 2025-08-07 20:31:40,827] Trial 1049 finished with value: 0.8882655382156373 and parameters: {'fp_type': 'morgan_rdkit', 'combined_morgan_radius': 3, 'combined_morgan_nBits': 1024, 'combined_rdkit_maxPath': 7, 'combined_rdkit_nBits': 512, 'num_hidden_layers': 3, 'hidden_dim_0': 256, 'hidden_dim_1': 1024, 'hidden_dim_2': 1024, 'kl_weight': 0.00021480433802240667, 'lr': 0.004916432545590124, 'batch_size': 128, 'dropout_rate': 0.08782016344647377, 'prior_mu': 0.007236665115058088, 'prior_sigma': 0.0682515759798861, 'normalization': 'layer'}. Best is trial 896 with value: 0.4533553242683411.
Generating morgan_rdkit fingerprints...
Generated fingerprints with 2048 features for 841 molecules
Trial 1050: 5-fold CV loss = 0.8874
[I 2025-08-07 20:31:50,256] Trial 1050 finished with value: 0.8874226689338685 and parameters: {'fp_type': 'morgan_rdkit', 'combined_morgan_radius': 3, 'combined_morgan_nBits': 1024, 'combined_rdkit_maxPath': 7, 'combined_rdkit_nBits': 512, 'num_hidden_layers': 3, 'hidden_dim_0': 1024, 'hidden_dim_1': 128, 'hidden_dim_2': 1024, 'kl_weight': 0.00021093223139761455, 'lr': 0.004687785903513835, 'batch_size': 128, 'dropout_rate': 0.07180004796884737, 'prior_mu': 0.008217951023923125, 'prior_sigma': 0.06774095553286066, 'normalization': 'layer'}. Best is trial 896 with value: 0.4533553242683411.
Generating morgan_rdkit fingerprints...
Generated fingerprints with 2048 features for 841 molecules
Trial 1046: 5-fold CV loss = 0.4824
[I 2025-08-07 20:32:10,121] Trial 1046 finished with value: 0.48235424160957335 and parameters: {'fp_type': 'morgan_rdkit', 'combined_morgan_radius': 3, 'combined_morgan_nBits': 1024, 'combined_rdkit_maxPath': 7, 'combined_rdkit_nBits': 1024, 'num_hidden_layers': 3, 'hidden_dim_0': 256, 'hidden_dim_1': 128, 'hidden_dim_2': 64, 'kl_weight': 0.016702919053377722, 'lr': 0.00493554108889166, 'batch_size': 128, 'dropout_rate': 0.049289076097501855, 'prior_mu': -0.037902194408585735, 'prior_sigma': 0.07016297513725063, 'normalization': 'layer'}. Best is trial 896 with value: 0.4533553242683411.
Generating morgan_rdkit fingerprints...
Generated fingerprints with 2048 features for 841 molecules
Trial 1051: 5-fold CV loss = 0.6282
[I 2025-08-07 20:32:26,272] Trial 1051 finished with value: 0.6282497584819794 and parameters: {'fp_type': 'morgan_rdkit', 'combined_morgan_radius': 3, 'combined_morgan_nBits': 1024, 'combined_rdkit_maxPath': 7, 'combined_rdkit_nBits': 1024, 'num_hidden_layers': 3, 'hidden_dim_0': 1024, 'hidden_dim_1': 128, 'hidden_dim_2': 1024, 'kl_weight': 0.00025812717063711753, 'lr': 0.004887384897626447, 'batch_size': 128, 'dropout_rate': 0.06828195640021809, 'prior_mu': -0.01731688888750195, 'prior_sigma': 0.06846424477339226, 'normalization': 'none'}. Best is trial 896 with value: 0.4533553242683411.
Generating morgan_rdkit fingerprints...
Generated fingerprints with 2048 features for 841 molecules
Trial 1053: 5-fold CV loss = 0.5518
[I 2025-08-07 20:32:27,869] Trial 1053 finished with value: 0.551789653301239 and parameters: {'fp_type': 'morgan_rdkit', 'combined_morgan_radius': 3, 'combined_morgan_nBits': 1024, 'combined_rdkit_maxPath': 7, 'combined_rdkit_nBits': 1024, 'num_hidden_layers': 3, 'hidden_dim_0': 256, 'hidden_dim_1': 1024, 'hidden_dim_2': 64, 'kl_weight': 0.00025515081411119815, 'lr': 0.005389159043802113, 'batch_size': 128, 'dropout_rate': 0.07375854829064823, 'prior_mu': -0.016791167583086727, 'prior_sigma': 0.07556356624266389, 'normalization': 'layer'}. Best is trial 896 with value: 0.4533553242683411.
Generating morgan_rdkit fingerprints...
Generated fingerprints with 2048 features for 841 molecules
Trial 1052: 5-fold CV loss = 0.5127
[I 2025-08-07 20:32:43,517] Trial 1052 finished with value: 0.5127272009849548 and parameters: {'fp_type': 'morgan_rdkit', 'combined_morgan_radius': 3, 'combined_morgan_nBits': 1024, 'combined_rdkit_maxPath': 7, 'combined_rdkit_nBits': 1024, 'num_hidden_layers': 3, 'hidden_dim_0': 1024, 'hidden_dim_1': 128, 'hidden_dim_2': 64, 'kl_weight': 0.00025506496317292585, 'lr': 0.005406938165459578, 'batch_size': 128, 'dropout_rate': 0.07635336763985309, 'prior_mu': -0.017848781558363114, 'prior_sigma': 0.07174692308276284, 'normalization': 'none'}. Best is trial 896 with value: 0.4533553242683411.
Generating morgan fingerprints...
Generated fingerprints with 1024 features for 841 molecules
Trial 1054: 5-fold CV loss = 0.9992
[I 2025-08-07 20:33:00,089] Trial 1054 finished with value: 0.999158775806427 and parameters: {'fp_type': 'morgan_rdkit', 'combined_morgan_radius': 3, 'combined_morgan_nBits': 1024, 'combined_rdkit_maxPath': 7, 'combined_rdkit_nBits': 1024, 'num_hidden_layers': 3, 'hidden_dim_0': 256, 'hidden_dim_1': 1024, 'hidden_dim_2': 128, 'kl_weight': 0.0002576416333640819, 'lr': 0.005471014012337888, 'batch_size': 128, 'dropout_rate': 0.07014812078280439, 'prior_mu': -0.017319490483369164, 'prior_sigma': 0.17348668887979854, 'normalization': 'none'}. Best is trial 896 with value: 0.4533553242683411.
Generating morgan_rdkit fingerprints...
Generated fingerprints with 2048 features for 841 molecules
Trial 1055: 5-fold CV loss = 0.5593
[I 2025-08-07 20:33:04,401] Trial 1055 finished with value: 0.5592527031898499 and parameters: {'fp_type': 'morgan_rdkit', 'combined_morgan_radius': 3, 'combined_morgan_nBits': 1024, 'combined_rdkit_maxPath': 7, 'combined_rdkit_nBits': 1024, 'num_hidden_layers': 3, 'hidden_dim_0': 256, 'hidden_dim_1': 1024, 'hidden_dim_2': 256, 'kl_weight': 0.00026136897102821454, 'lr': 0.005454650135634798, 'batch_size': 128, 'dropout_rate': 0.07232701157991392, 'prior_mu': -0.025799783162637785, 'prior_sigma': 0.07492091024973689, 'normalization': 'layer'}. Best is trial 896 with value: 0.4533553242683411.
Generating morgan fingerprints...
Generated fingerprints with 1024 features for 841 molecules
Trial 1056: 5-fold CV loss = 0.4678
[I 2025-08-07 20:33:17,385] Trial 1056 finished with value: 0.46784527897834777 and parameters: {'fp_type': 'morgan_rdkit', 'combined_morgan_radius': 3, 'combined_morgan_nBits': 1024, 'combined_rdkit_maxPath': 7, 'combined_rdkit_nBits': 1024, 'num_hidden_layers': 3, 'hidden_dim_0': 256, 'hidden_dim_1': 1024, 'hidden_dim_2': 128, 'kl_weight': 0.0002906015476552043, 'lr': 0.0058454296925453736, 'batch_size': 128, 'dropout_rate': 0.08092916560867171, 'prior_mu': -0.026498193703876807, 'prior_sigma': 0.08631871711204103, 'normalization': 'layer'}. Best is trial 896 with value: 0.4533553242683411.
Generating morgan_rdkit fingerprints...
Generated fingerprints with 2048 features for 841 molecules
Trial 1059: 5-fold CV loss = 0.5197
[I 2025-08-07 20:33:22,623] Trial 1059 finished with value: 0.5197356641292572 and parameters: {'fp_type': 'morgan', 'morgan_only_radius': 2, 'morgan_only_nBits': 1024, 'num_hidden_layers': 3, 'hidden_dim_0': 256, 'hidden_dim_1': 1024, 'hidden_dim_2': 64, 'kl_weight': 0.0003018078128292411, 'lr': 0.0059879680469700994, 'batch_size': 128, 'dropout_rate': 0.09140447689605327, 'prior_mu': -0.028403291073429742, 'prior_sigma': 0.08753898703885654, 'normalization': 'layer'}. Best is trial 896 with value: 0.4533553242683411.
Generating morgan_rdkit fingerprints...
Generated fingerprints with 2048 features for 841 molecules
Trial 1057: 5-fold CV loss = 0.5328
[I 2025-08-07 20:33:38,793] Trial 1057 finished with value: 0.5328461349010467 and parameters: {'fp_type': 'morgan', 'morgan_only_radius': 2, 'morgan_only_nBits': 1024, 'num_hidden_layers': 3, 'hidden_dim_0': 256, 'hidden_dim_1': 1024, 'hidden_dim_2': 128, 'kl_weight': 0.0003027906521495507, 'lr': 0.005736470371866552, 'batch_size': 128, 'dropout_rate': 0.08920222241856104, 'prior_mu': -0.029428769515261535, 'prior_sigma': 0.1752044607127586, 'normalization': 'layer'}. Best is trial 896 with value: 0.4533553242683411.
Generating morgan_rdkit fingerprints...
Generated fingerprints with 2048 features for 841 molecules
Trial 1061: 5-fold CV loss = 0.4639
[I 2025-08-07 20:33:58,127] Trial 1061 finished with value: 0.46394161581993104 and parameters: {'fp_type': 'morgan_rdkit', 'combined_morgan_radius': 3, 'combined_morgan_nBits': 1024, 'combined_rdkit_maxPath': 7, 'combined_rdkit_nBits': 1024, 'num_hidden_layers': 3, 'hidden_dim_0': 256, 'hidden_dim_1': 1024, 'hidden_dim_2': 64, 'kl_weight': 0.0003193145633452659, 'lr': 0.006273055746047792, 'batch_size': 128, 'dropout_rate': 0.10040153881355912, 'prior_mu': -0.005956206706505136, 'prior_sigma': 0.06159294872425076, 'normalization': 'layer'}. Best is trial 896 with value: 0.4533553242683411.
Generating morgan_rdkit fingerprints...
Generated fingerprints with 2048 features for 841 molecules
Trial 1060: 5-fold CV loss = 0.4674
[I 2025-08-07 20:34:05,069] Trial 1060 finished with value: 0.4673841238021851 and parameters: {'fp_type': 'morgan_rdkit', 'combined_morgan_radius': 3, 'combined_morgan_nBits': 1024, 'combined_rdkit_maxPath': 7, 'combined_rdkit_nBits': 1024, 'num_hidden_layers': 3, 'hidden_dim_0': 512, 'hidden_dim_1': 1024, 'hidden_dim_2': 64, 'kl_weight': 0.0027045468927040456, 'lr': 0.0060431393913154986, 'batch_size': 128, 'dropout_rate': 0.08852277884302975, 'prior_mu': -0.006278233163104021, 'prior_sigma': 0.08715794200225138, 'normalization': 'layer'}. Best is trial 896 with value: 0.4533553242683411.
Generating rdkit fingerprints...
Generated fingerprints with 1024 features for 841 molecules
Trial 1064: 5-fold CV loss = 0.8871
[I 2025-08-07 20:34:17,980] Trial 1064 finished with value: 0.8871219635009766 and parameters: {'fp_type': 'rdkit', 'rdkit_only_maxPath': 8, 'rdkit_only_nBits': 1024, 'num_hidden_layers': 3, 'hidden_dim_0': 256, 'hidden_dim_1': 256, 'hidden_dim_2': 64, 'kl_weight': 0.00022712141670389266, 'lr': 0.0045582462430362675, 'batch_size': 128, 'dropout_rate': 0.11041692869280272, 'prior_mu': -0.046999419739678305, 'prior_sigma': 0.12225145790507388, 'normalization': 'layer'}. Best is trial 896 with value: 0.4533553242683411.
Generating morgan_rdkit fingerprints...
Generated fingerprints with 2048 features for 841 molecules
Trial 1058: 5-fold CV loss = 0.4821
[I 2025-08-07 20:34:31,036] Trial 1058 finished with value: 0.48207733035087585 and parameters: {'fp_type': 'morgan_rdkit', 'combined_morgan_radius': 3, 'combined_morgan_nBits': 1024, 'combined_rdkit_maxPath': 7, 'combined_rdkit_nBits': 1024, 'num_hidden_layers': 3, 'hidden_dim_0': 256, 'hidden_dim_1': 1024, 'hidden_dim_2': 64, 'kl_weight': 0.0003049725192749171, 'lr': 0.005996143075009259, 'batch_size': 128, 'dropout_rate': 0.0932680142631774, 'prior_mu': -0.025545462797542526, 'prior_sigma': 0.08867057735010239, 'normalization': 'layer'}. Best is trial 896 with value: 0.4533553242683411.
Generating morgan_rdkit fingerprints...
Generated fingerprints with 2048 features for 841 molecules
Trial 1062: 5-fold CV loss = 0.4619
[I 2025-08-07 20:34:36,713] Trial 1062 finished with value: 0.46185003519058226 and parameters: {'fp_type': 'morgan_rdkit', 'combined_morgan_radius': 3, 'combined_morgan_nBits': 1024, 'combined_rdkit_maxPath': 7, 'combined_rdkit_nBits': 1024, 'num_hidden_layers': 3, 'hidden_dim_0': 512, 'hidden_dim_1': 256, 'hidden_dim_2': 64, 'kl_weight': 0.00022538397269239688, 'lr': 0.006207469481135541, 'batch_size': 128, 'dropout_rate': 0.10035129986716762, 'prior_mu': -0.006870845550469316, 'prior_sigma': 0.07792165291190577, 'normalization': 'layer'}. Best is trial 896 with value: 0.4533553242683411.
Generating morgan_rdkit fingerprints...
Generated fingerprints with 2048 features for 841 molecules
Trial 1063: 5-fold CV loss = 0.4660
[I 2025-08-07 20:34:41,770] Trial 1063 finished with value: 0.4659793496131897 and parameters: {'fp_type': 'morgan_rdkit', 'combined_morgan_radius': 3, 'combined_morgan_nBits': 1024, 'combined_rdkit_maxPath': 7, 'combined_rdkit_nBits': 1024, 'num_hidden_layers': 3, 'hidden_dim_0': 512, 'hidden_dim_1': 256, 'hidden_dim_2': 64, 'kl_weight': 0.00022904040936435536, 'lr': 0.006038711869995398, 'batch_size': 128, 'dropout_rate': 0.10212719823246935, 'prior_mu': -0.00939012105039567, 'prior_sigma': 0.09069821258355618, 'normalization': 'layer'}. Best is trial 896 with value: 0.4533553242683411.
Generating morgan_rdkit fingerprints...
Generated fingerprints with 2048 features for 841 molecules
Trial 1065: 5-fold CV loss = 0.5494
