[I 2025-08-08 00:23:17,531] Trial 2235 finished with value: 0.5692028939723969 and parameters: {'fp_type': 'morgan_rdkit', 'combined_morgan_radius': 3, 'combined_morgan_nBits': 1024, 'combined_rdkit_maxPath': 7, 'combined_rdkit_nBits': 1024, 'num_hidden_layers': 3, 'hidden_dim_0': 256, 'hidden_dim_1': 1024, 'hidden_dim_2': 64, 'kl_weight': 0.00016847267593971283, 'lr': 0.009993591991520081, 'batch_size': 128, 'dropout_rate': 0.16241722327314095, 'prior_mu': -0.09187359442860535, 'prior_sigma': 0.10177364156935827, 'normalization': 'layer'}. Best is trial 896 with value: 0.4533553242683411.
Generating morgan fingerprints...
Generated fingerprints with 1024 features for 841 molecules
Trial 2233: 5-fold CV loss = 0.7716
[I 2025-08-08 00:23:24,662] Trial 2233 finished with value: 0.7716187357902526 and parameters: {'fp_type': 'morgan_rdkit', 'combined_morgan_radius': 3, 'combined_morgan_nBits': 1024, 'combined_rdkit_maxPath': 7, 'combined_rdkit_nBits': 1024, 'num_hidden_layers': 3, 'hidden_dim_0': 256, 'hidden_dim_1': 1024, 'hidden_dim_2': 64, 'kl_weight': 0.0001580833199320445, 'lr': 0.009337938861957917, 'batch_size': 128, 'dropout_rate': 0.15756923008804252, 'prior_mu': -0.06580582257144447, 'prior_sigma': 0.10913985593429663, 'normalization': 'none'}. Best is trial 896 with value: 0.4533553242683411.
Generating morgan fingerprints...
Generated fingerprints with 1024 features for 841 molecules
Trial 2239: 5-fold CV loss = 0.5196
[I 2025-08-08 00:23:43,256] Trial 2239 finished with value: 0.5196354866027832 and parameters: {'fp_type': 'morgan', 'morgan_only_radius': 2, 'morgan_only_nBits': 1024, 'num_hidden_layers': 3, 'hidden_dim_0': 256, 'hidden_dim_1': 1024, 'hidden_dim_2': 64, 'kl_weight': 0.0001779759047312407, 'lr': 0.008344032703782357, 'batch_size': 128, 'dropout_rate': 0.16066915045724325, 'prior_mu': -0.07025979276868805, 'prior_sigma': 0.09996217205102631, 'normalization': 'layer'}. Best is trial 896 with value: 0.4533553242683411.
Generating morgan_rdkit fingerprints...
Generated fingerprints with 2048 features for 841 molecules
Trial 2237: 5-fold CV loss = 0.4636
[I 2025-08-08 00:23:44,395] Trial 2237 finished with value: 0.4635571718215942 and parameters: {'fp_type': 'morgan_rdkit', 'combined_morgan_radius': 3, 'combined_morgan_nBits': 1024, 'combined_rdkit_maxPath': 7, 'combined_rdkit_nBits': 1024, 'num_hidden_layers': 3, 'hidden_dim_0': 256, 'hidden_dim_1': 1024, 'hidden_dim_2': 64, 'kl_weight': 0.00014105219561783326, 'lr': 0.008515707709882815, 'batch_size': 128, 'dropout_rate': 0.1591331314821025, 'prior_mu': -0.10364923243894299, 'prior_sigma': 0.10156235996906117, 'normalization': 'layer'}. Best is trial 896 with value: 0.4533553242683411.
Generating morgan_rdkit fingerprints...
Generated fingerprints with 2048 features for 841 molecules
Trial 2238: 5-fold CV loss = 0.5289
[I 2025-08-08 00:23:49,823] Trial 2238 finished with value: 0.5288841784000397 and parameters: {'fp_type': 'morgan', 'morgan_only_radius': 2, 'morgan_only_nBits': 1024, 'num_hidden_layers': 3, 'hidden_dim_0': 256, 'hidden_dim_1': 1024, 'hidden_dim_2': 64, 'kl_weight': 0.00016446483064835242, 'lr': 0.008433181663348353, 'batch_size': 128, 'dropout_rate': 0.15768411692704454, 'prior_mu': -0.09424720281267034, 'prior_sigma': 0.10147792209954097, 'normalization': 'layer'}. Best is trial 896 with value: 0.4533553242683411.
Generating morgan_rdkit fingerprints...
Generated fingerprints with 2048 features for 841 molecules
Trial 2242: 5-fold CV loss = 0.4781
[I 2025-08-08 00:24:22,755] Trial 2242 finished with value: 0.4781247913837433 and parameters: {'fp_type': 'morgan_rdkit', 'combined_morgan_radius': 3, 'combined_morgan_nBits': 1024, 'combined_rdkit_maxPath': 7, 'combined_rdkit_nBits': 1024, 'num_hidden_layers': 3, 'hidden_dim_0': 256, 'hidden_dim_1': 1024, 'hidden_dim_2': 64, 'kl_weight': 0.0001222315832181321, 'lr': 0.008038860269986098, 'batch_size': 64, 'dropout_rate': 0.07470185981217457, 'prior_mu': -0.08500611883091662, 'prior_sigma': 0.09706953551589684, 'normalization': 'layer'}. Best is trial 896 with value: 0.4533553242683411.
Generating morgan_rdkit fingerprints...
Generated fingerprints with 2048 features for 841 molecules
Trial 2241: 5-fold CV loss = 0.4760
[I 2025-08-08 00:24:50,129] Trial 2241 finished with value: 0.47600204348564146 and parameters: {'fp_type': 'morgan_rdkit', 'combined_morgan_radius': 3, 'combined_morgan_nBits': 1024, 'combined_rdkit_maxPath': 6, 'combined_rdkit_nBits': 1024, 'num_hidden_layers': 3, 'hidden_dim_0': 256, 'hidden_dim_1': 1024, 'hidden_dim_2': 64, 'kl_weight': 0.00013043282648039626, 'lr': 0.007995102204231486, 'batch_size': 32, 'dropout_rate': 0.15967371464099075, 'prior_mu': -0.08097121617676797, 'prior_sigma': 0.10193305083236891, 'normalization': 'layer'}. Best is trial 896 with value: 0.4533553242683411.
Generating morgan_rdkit fingerprints...
Generated fingerprints with 1536 features for 841 molecules
Trial 2243: 5-fold CV loss = 0.4781
[I 2025-08-08 00:25:15,146] Trial 2243 finished with value: 0.4780657947063446 and parameters: {'fp_type': 'morgan_rdkit', 'combined_morgan_radius': 3, 'combined_morgan_nBits': 1024, 'combined_rdkit_maxPath': 6, 'combined_rdkit_nBits': 1024, 'num_hidden_layers': 3, 'hidden_dim_0': 256, 'hidden_dim_1': 1024, 'hidden_dim_2': 64, 'kl_weight': 0.0001594006115574516, 'lr': 0.007922878205012258, 'batch_size': 32, 'dropout_rate': 0.16964258232924856, 'prior_mu': -0.08579074528320267, 'prior_sigma': 0.10608277180751471, 'normalization': 'layer'}. Best is trial 896 with value: 0.4533553242683411.
Generating morgan_rdkit fingerprints...
Generated fingerprints with 1536 features for 841 molecules
Trial 2240: 5-fold CV loss = 0.5234
[I 2025-08-08 00:25:21,752] Trial 2240 finished with value: 0.5233656287193298 and parameters: {'fp_type': 'morgan', 'morgan_only_radius': 2, 'morgan_only_nBits': 1024, 'num_hidden_layers': 3, 'hidden_dim_0': 256, 'hidden_dim_1': 1024, 'hidden_dim_2': 64, 'kl_weight': 0.0001536302784899586, 'lr': 0.00862909490352306, 'batch_size': 32, 'dropout_rate': 0.15860172014406848, 'prior_mu': -0.06916347972150205, 'prior_sigma': 0.09932946652957433, 'normalization': 'layer'}. Best is trial 896 with value: 0.4533553242683411.
Generating morgan_rdkit fingerprints...
Generated fingerprints with 1536 features for 841 molecules
Trial 2244: 5-fold CV loss = 0.4765
[I 2025-08-08 00:25:31,251] Trial 2244 finished with value: 0.47647502422332766 and parameters: {'fp_type': 'morgan_rdkit', 'combined_morgan_radius': 3, 'combined_morgan_nBits': 1024, 'combined_rdkit_maxPath': 6, 'combined_rdkit_nBits': 1024, 'num_hidden_layers': 3, 'hidden_dim_0': 256, 'hidden_dim_1': 1024, 'hidden_dim_2': 64, 'kl_weight': 0.00013664294823092309, 'lr': 0.007817654071788213, 'batch_size': 32, 'dropout_rate': 0.17278917812623906, 'prior_mu': -0.06793020053787345, 'prior_sigma': 0.1051739120692207, 'normalization': 'layer'}. Best is trial 896 with value: 0.4533553242683411.
Generating morgan_rdkit fingerprints...
Generated fingerprints with 1536 features for 841 molecules
Trial 2245: 5-fold CV loss = 0.4863
[I 2025-08-08 00:25:34,918] Trial 2245 finished with value: 0.4862853646278381 and parameters: {'fp_type': 'morgan_rdkit', 'combined_morgan_radius': 3, 'combined_morgan_nBits': 1024, 'combined_rdkit_maxPath': 7, 'combined_rdkit_nBits': 512, 'num_hidden_layers': 3, 'hidden_dim_0': 512, 'hidden_dim_1': 1024, 'hidden_dim_2': 64, 'kl_weight': 0.00014809269472668355, 'lr': 0.009218997014532453, 'batch_size': 128, 'dropout_rate': 0.31058143757153805, 'prior_mu': -0.06722655383498052, 'prior_sigma': 0.10765458380238056, 'normalization': 'layer'}. Best is trial 896 with value: 0.4533553242683411.
Generating morgan_rdkit fingerprints...
Generated fingerprints with 2048 features for 841 molecules
Trial 2248: 5-fold CV loss = 0.5883
[I 2025-08-08 00:26:05,795] Trial 2248 finished with value: 0.5883443474769592 and parameters: {'fp_type': 'morgan_rdkit', 'combined_morgan_radius': 3, 'combined_morgan_nBits': 1024, 'combined_rdkit_maxPath': 7, 'combined_rdkit_nBits': 512, 'num_hidden_layers': 3, 'hidden_dim_0': 256, 'hidden_dim_1': 1024, 'hidden_dim_2': 64, 'kl_weight': 0.00012450470663422826, 'lr': 0.007301850389242295, 'batch_size': 128, 'dropout_rate': 0.09835667267217946, 'prior_mu': -0.07119892060948897, 'prior_sigma': 0.11362005907922154, 'normalization': 'layer'}. Best is trial 896 with value: 0.4533553242683411.
Generating morgan_rdkit fingerprints...
Generated fingerprints with 2048 features for 841 molecules
Trial 2246: 5-fold CV loss = 0.5557
[I 2025-08-08 00:26:08,089] Trial 2246 finished with value: 0.5556589066982269 and parameters: {'fp_type': 'morgan_rdkit', 'combined_morgan_radius': 3, 'combined_morgan_nBits': 1024, 'combined_rdkit_maxPath': 7, 'combined_rdkit_nBits': 512, 'num_hidden_layers': 3, 'hidden_dim_0': 256, 'hidden_dim_1': 512, 'hidden_dim_2': 64, 'kl_weight': 0.00022842943896425206, 'lr': 0.009239200924712686, 'batch_size': 128, 'dropout_rate': 0.09851851726694644, 'prior_mu': -0.07586450726959607, 'prior_sigma': 0.0979381296111258, 'normalization': 'layer'}. Best is trial 896 with value: 0.4533553242683411.
Generating morgan_rdkit fingerprints...
Generated fingerprints with 2048 features for 841 molecules
Trial 2249: 5-fold CV loss = 0.4660
[I 2025-08-08 00:26:20,574] Trial 2249 finished with value: 0.4660293161869049 and parameters: {'fp_type': 'morgan_rdkit', 'combined_morgan_radius': 3, 'combined_morgan_nBits': 1024, 'combined_rdkit_maxPath': 7, 'combined_rdkit_nBits': 1024, 'num_hidden_layers': 3, 'hidden_dim_0': 256, 'hidden_dim_1': 512, 'hidden_dim_2': 64, 'kl_weight': 0.00014761647511409053, 'lr': 0.00718577898066039, 'batch_size': 128, 'dropout_rate': 0.05724799470328902, 'prior_mu': -0.05848124795286437, 'prior_sigma': 0.09906984172406343, 'normalization': 'layer'}. Best is trial 896 with value: 0.4533553242683411.
Generating morgan_rdkit fingerprints...
Generated fingerprints with 2048 features for 841 molecules
Trial 2250: 5-fold CV loss = 0.8027
[I 2025-08-08 00:26:32,109] Trial 2250 finished with value: 0.8027396082878113 and parameters: {'fp_type': 'morgan_rdkit', 'combined_morgan_radius': 3, 'combined_morgan_nBits': 1024, 'combined_rdkit_maxPath': 7, 'combined_rdkit_nBits': 1024, 'num_hidden_layers': 3, 'hidden_dim_0': 256, 'hidden_dim_1': 512, 'hidden_dim_2': 1024, 'kl_weight': 0.0001358641474849293, 'lr': 0.006117167244238688, 'batch_size': 128, 'dropout_rate': 0.3568035152614953, 'prior_mu': -0.06880076197571826, 'prior_sigma': 0.10599841663317722, 'normalization': 'layer'}. Best is trial 896 with value: 0.4533553242683411.
Generating morgan_rdkit fingerprints...
Generated fingerprints with 2048 features for 841 molecules
Trial 2252: 5-fold CV loss = 0.8883
[I 2025-08-08 00:26:40,013] Trial 2252 finished with value: 0.8883296251296997 and parameters: {'fp_type': 'morgan_rdkit', 'combined_morgan_radius': 3, 'combined_morgan_nBits': 1024, 'combined_rdkit_maxPath': 7, 'combined_rdkit_nBits': 1024, 'num_hidden_layers': 3, 'hidden_dim_0': 256, 'hidden_dim_1': 1024, 'hidden_dim_2': 1024, 'kl_weight': 0.00014070035308827488, 'lr': 0.0063895357011046205, 'batch_size': 128, 'dropout_rate': 0.07248744138658945, 'prior_mu': -0.06439703627417237, 'prior_sigma': 0.11022028761421354, 'normalization': 'layer'}. Best is trial 896 with value: 0.4533553242683411.
Generating morgan_rdkit fingerprints...
Generated fingerprints with 2048 features for 841 molecules
Trial 2247: 5-fold CV loss = 0.4909
[I 2025-08-08 00:27:01,270] Trial 2247 finished with value: 0.49091452956199644 and parameters: {'fp_type': 'morgan_rdkit', 'combined_morgan_radius': 3, 'combined_morgan_nBits': 1024, 'combined_rdkit_maxPath': 7, 'combined_rdkit_nBits': 512, 'num_hidden_layers': 3, 'hidden_dim_0': 512, 'hidden_dim_1': 512, 'hidden_dim_2': 64, 'kl_weight': 0.00019125842593096498, 'lr': 0.009907041749089908, 'batch_size': 128, 'dropout_rate': 0.07713700555500282, 'prior_mu': -0.06938994064524844, 'prior_sigma': 0.10907856292089932, 'normalization': 'layer'}. Best is trial 896 with value: 0.4533553242683411.
Generating morgan_rdkit fingerprints...
Generated fingerprints with 2048 features for 841 molecules
Trial 2251: 5-fold CV loss = 0.5567
[I 2025-08-08 00:27:03,393] Trial 2251 finished with value: 0.5566555202007294 and parameters: {'fp_type': 'morgan_rdkit', 'combined_morgan_radius': 3, 'combined_morgan_nBits': 1024, 'combined_rdkit_maxPath': 7, 'combined_rdkit_nBits': 1024, 'num_hidden_layers': 3, 'hidden_dim_0': 256, 'hidden_dim_1': 1024, 'hidden_dim_2': 64, 'kl_weight': 0.00017262519925149078, 'lr': 0.006131509153423281, 'batch_size': 128, 'dropout_rate': 0.1510976776011891, 'prior_mu': -0.08246286688466604, 'prior_sigma': 0.109830242186434, 'normalization': 'layer'}. Best is trial 896 with value: 0.4533553242683411.
Generating morgan_rdkit fingerprints...
Generated fingerprints with 2048 features for 841 molecules
Trial 2253: 5-fold CV loss = 0.4578
[I 2025-08-08 00:27:11,936] Trial 2253 finished with value: 0.4577765643596649 and parameters: {'fp_type': 'morgan_rdkit', 'combined_morgan_radius': 3, 'combined_morgan_nBits': 1024, 'combined_rdkit_maxPath': 7, 'combined_rdkit_nBits': 1024, 'num_hidden_layers': 3, 'hidden_dim_0': 256, 'hidden_dim_1': 1024, 'hidden_dim_2': 64, 'kl_weight': 0.0001851166101914432, 'lr': 0.00999829208374297, 'batch_size': 128, 'dropout_rate': 0.07731598983062282, 'prior_mu': -0.047135623134051965, 'prior_sigma': 0.11037831402915138, 'normalization': 'layer'}. Best is trial 896 with value: 0.4533553242683411.
Generating morgan_rdkit fingerprints...
Generated fingerprints with 2048 features for 841 molecules
Trial 2254: 5-fold CV loss = 0.4737
[I 2025-08-08 00:27:21,706] Trial 2254 finished with value: 0.4737418472766876 and parameters: {'fp_type': 'morgan_rdkit', 'combined_morgan_radius': 3, 'combined_morgan_nBits': 1024, 'combined_rdkit_maxPath': 7, 'combined_rdkit_nBits': 1024, 'num_hidden_layers': 3, 'hidden_dim_0': 256, 'hidden_dim_1': 1024, 'hidden_dim_2': 64, 'kl_weight': 0.0001746764072254522, 'lr': 0.007547114064476994, 'batch_size': 128, 'dropout_rate': 0.15430108786870866, 'prior_mu': -0.05998122147695777, 'prior_sigma': 0.10075759913220232, 'normalization': 'layer'}. Best is trial 896 with value: 0.4533553242683411.
Generating morgan_rdkit fingerprints...
Generated fingerprints with 2048 features for 841 molecules
Trial 2256: 5-fold CV loss = 0.5580
[I 2025-08-08 00:27:49,135] Trial 2256 finished with value: 0.5579682171344758 and parameters: {'fp_type': 'morgan_rdkit', 'combined_morgan_radius': 3, 'combined_morgan_nBits': 1024, 'combined_rdkit_maxPath': 7, 'combined_rdkit_nBits': 1024, 'num_hidden_layers': 3, 'hidden_dim_0': 256, 'hidden_dim_1': 1024, 'hidden_dim_2': 64, 'kl_weight': 0.00019648811167195796, 'lr': 0.00847811197452505, 'batch_size': 128, 'dropout_rate': 0.08773689780413554, 'prior_mu': -0.08054934418850024, 'prior_sigma': 0.0972379024948643, 'normalization': 'layer'}. Best is trial 896 with value: 0.4533553242683411.
Generating morgan_rdkit fingerprints...
Generated fingerprints with 2048 features for 841 molecules
Trial 2257: 5-fold CV loss = 0.4645
[I 2025-08-08 00:27:56,544] Trial 2257 finished with value: 0.46447000503540037 and parameters: {'fp_type': 'morgan_rdkit', 'combined_morgan_radius': 3, 'combined_morgan_nBits': 1024, 'combined_rdkit_maxPath': 7, 'combined_rdkit_nBits': 1024, 'num_hidden_layers': 3, 'hidden_dim_0': 1024, 'hidden_dim_1': 1024, 'hidden_dim_2': 64, 'kl_weight': 0.00016496735638155534, 'lr': 0.009780426882544968, 'batch_size': 64, 'dropout_rate': 0.05727861613262957, 'prior_mu': -0.05725421755908699, 'prior_sigma': 0.10913081673845015, 'normalization': 'layer'}. Best is trial 896 with value: 0.4533553242683411.
Generating morgan_rdkit fingerprints...
Generated fingerprints with 2048 features for 841 molecules
Trial 2259: 5-fold CV loss = 1.0654
[I 2025-08-08 00:28:08,646] Trial 2259 finished with value: 1.0653704404830933 and parameters: {'fp_type': 'morgan_rdkit', 'combined_morgan_radius': 3, 'combined_morgan_nBits': 1024, 'combined_rdkit_maxPath': 5, 'combined_rdkit_nBits': 1024, 'num_hidden_layers': 0, 'kl_weight': 0.00013519942082255531, 'lr': 0.009586982976490212, 'batch_size': 64, 'dropout_rate': 0.06379257297829288, 'prior_mu': -0.05476093634719846, 'prior_sigma': 0.10517355901705003, 'normalization': 'layer'}. Best is trial 896 with value: 0.4533553242683411.
Generating morgan_rdkit fingerprints...
Generated fingerprints with 2048 features for 841 molecules
Trial 2258: 5-fold CV loss = 0.4690
[I 2025-08-08 00:28:10,565] Trial 2258 finished with value: 0.4690269410610199 and parameters: {'fp_type': 'morgan_rdkit', 'combined_morgan_radius': 3, 'combined_morgan_nBits': 1024, 'combined_rdkit_maxPath': 7, 'combined_rdkit_nBits': 1024, 'num_hidden_layers': 3, 'hidden_dim_0': 1024, 'hidden_dim_1': 1024, 'hidden_dim_2': 64, 'kl_weight': 0.00017835311010504245, 'lr': 0.009518384009678202, 'batch_size': 64, 'dropout_rate': 0.05799638987700872, 'prior_mu': -0.07497561773926797, 'prior_sigma': 0.10154079462718502, 'normalization': 'layer'}. Best is trial 896 with value: 0.4533553242683411.
Generating morgan_rdkit fingerprints...
Generated fingerprints with 2048 features for 841 molecules
Trial 2255: 5-fold CV loss = 0.4769
[I 2025-08-08 00:28:25,357] Trial 2255 finished with value: 0.47694694995880127 and parameters: {'fp_type': 'morgan_rdkit', 'combined_morgan_radius': 3, 'combined_morgan_nBits': 1024, 'combined_rdkit_maxPath': 7, 'combined_rdkit_nBits': 1024, 'num_hidden_layers': 3, 'hidden_dim_0': 256, 'hidden_dim_1': 1024, 'hidden_dim_2': 64, 'kl_weight': 0.00017214776256641617, 'lr': 0.008488607813740758, 'batch_size': 128, 'dropout_rate': 0.15268827249511635, 'prior_mu': -0.08696504541522856, 'prior_sigma': 0.10240813863828048, 'normalization': 'layer'}. Best is trial 896 with value: 0.4533553242683411.
Generating morgan_rdkit fingerprints...
Generated fingerprints with 2048 features for 841 molecules
Trial 2260: 5-fold CV loss = 0.4668
[I 2025-08-08 00:28:39,966] Trial 2260 finished with value: 0.4667869031429291 and parameters: {'fp_type': 'morgan_rdkit', 'combined_morgan_radius': 3, 'combined_morgan_nBits': 1024, 'combined_rdkit_maxPath': 7, 'combined_rdkit_nBits': 1024, 'num_hidden_layers': 3, 'hidden_dim_0': 256, 'hidden_dim_1': 1024, 'hidden_dim_2': 64, 'kl_weight': 0.0001551343018449769, 'lr': 0.009398357848246119, 'batch_size': 128, 'dropout_rate': 0.06250360011241288, 'prior_mu': -0.05209043372408469, 'prior_sigma': 0.11185333335805443, 'normalization': 'layer'}. Best is trial 896 with value: 0.4533553242683411.
Generating rdkit fingerprints...
Generated fingerprints with 512 features for 841 molecules
Trial 2262: 5-fold CV loss = 0.6259
[I 2025-08-08 00:28:56,959] Trial 2262 finished with value: 0.6258821666240693 and parameters: {'fp_type': 'morgan_rdkit', 'combined_morgan_radius': 3, 'combined_morgan_nBits': 1024, 'combined_rdkit_maxPath': 7, 'combined_rdkit_nBits': 1024, 'num_hidden_layers': 3, 'hidden_dim_0': 256, 'hidden_dim_1': 1024, 'hidden_dim_2': 512, 'kl_weight': 0.00017653368587125382, 'lr': 0.009166855529240752, 'batch_size': 128, 'dropout_rate': 0.08080140840802288, 'prior_mu': -0.05455963097077511, 'prior_sigma': 0.10661086252934672, 'normalization': 'layer'}. Best is trial 896 with value: 0.4533553242683411.
Generating rdkit fingerprints...
Generated fingerprints with 512 features for 841 molecules
Trial 2261: 5-fold CV loss = 0.4689
[I 2025-08-08 00:29:13,040] Trial 2261 finished with value: 0.4689122259616852 and parameters: {'fp_type': 'morgan_rdkit', 'combined_morgan_radius': 3, 'combined_morgan_nBits': 1024, 'combined_rdkit_maxPath': 7, 'combined_rdkit_nBits': 1024, 'num_hidden_layers': 3, 'hidden_dim_0': 256, 'hidden_dim_1': 1024, 'hidden_dim_2': 64, 'kl_weight': 0.00018290622529999571, 'lr': 0.009658889872317963, 'batch_size': 128, 'dropout_rate': 0.06411482527051258, 'prior_mu': -0.08713731838706106, 'prior_sigma': 0.11811770495603689, 'normalization': 'layer'}. Best is trial 896 with value: 0.4533553242683411.
Generating rdkit fingerprints...
Generated fingerprints with 512 features for 841 molecules
Trial 2264: 5-fold CV loss = 0.6118
[I 2025-08-08 00:29:31,278] Trial 2264 finished with value: 0.611815619468689 and parameters: {'fp_type': 'rdkit', 'rdkit_only_maxPath': 7, 'rdkit_only_nBits': 512, 'num_hidden_layers': 3, 'hidden_dim_0': 256, 'hidden_dim_1': 1024, 'hidden_dim_2': 64, 'kl_weight': 0.0001416250288785321, 'lr': 0.009884504022391157, 'batch_size': 128, 'dropout_rate': 0.07089604676461682, 'prior_mu': -0.052108092465302715, 'prior_sigma': 0.10809345761350866, 'normalization': 'layer'}. Best is trial 896 with value: 0.4533553242683411.
Generating morgan_rdkit fingerprints...
Generated fingerprints with 2048 features for 841 molecules
Trial 2265: 5-fold CV loss = 0.6470
[I 2025-08-08 00:29:46,191] Trial 2265 finished with value: 0.6470267593860626 and parameters: {'fp_type': 'rdkit', 'rdkit_only_maxPath': 7, 'rdkit_only_nBits': 512, 'num_hidden_layers': 3, 'hidden_dim_0': 256, 'hidden_dim_1': 1024, 'hidden_dim_2': 64, 'kl_weight': 0.00014035758342238085, 'lr': 0.009792618065505486, 'batch_size': 128, 'dropout_rate': 0.07246568879992708, 'prior_mu': -0.049129656438124406, 'prior_sigma': 0.11456847411316083, 'normalization': 'layer'}. Best is trial 896 with value: 0.4533553242683411.
Generating morgan_rdkit fingerprints...
Generated fingerprints with 2048 features for 841 molecules
Trial 2263: 5-fold CV loss = 0.7312
