[I 2025-08-08 00:48:49,285] Trial 2353 finished with value: 0.5957453906536102 and parameters: {'fp_type': 'morgan_rdkit', 'combined_morgan_radius': 2, 'combined_morgan_nBits': 1024, 'combined_rdkit_maxPath': 7, 'combined_rdkit_nBits': 256, 'num_hidden_layers': 3, 'hidden_dim_0': 256, 'hidden_dim_1': 1024, 'hidden_dim_2': 128, 'kl_weight': 0.00013823803516078734, 'lr': 0.008686434505518302, 'batch_size': 128, 'dropout_rate': 0.09236765271759594, 'prior_mu': 0.015529575216819445, 'prior_sigma': 0.1098098920674318, 'normalization': 'layer'}. Best is trial 896 with value: 0.4533553242683411.
Generating morgan_rdkit fingerprints...
Generated fingerprints with 2048 features for 841 molecules
Trial 2357: 5-fold CV loss = 0.7557
[I 2025-08-08 00:49:17,537] Trial 2357 finished with value: 0.7556604743003845 and parameters: {'fp_type': 'morgan_rdkit', 'combined_morgan_radius': 3, 'combined_morgan_nBits': 1024, 'combined_rdkit_maxPath': 7, 'combined_rdkit_nBits': 1024, 'num_hidden_layers': 3, 'hidden_dim_0': 256, 'hidden_dim_1': 1024, 'hidden_dim_2': 1024, 'kl_weight': 0.00015026440304702517, 'lr': 0.008435762168125875, 'batch_size': 128, 'dropout_rate': 0.0539310301921017, 'prior_mu': 0.02447538753735267, 'prior_sigma': 0.09941817878621517, 'normalization': 'layer'}. Best is trial 896 with value: 0.4533553242683411.
Generating morgan_rdkit fingerprints...
Generated fingerprints with 2048 features for 841 molecules
Trial 2359: 5-fold CV loss = 0.8242
[I 2025-08-08 00:49:22,542] Trial 2359 finished with value: 0.8241790771484375 and parameters: {'fp_type': 'morgan_rdkit', 'combined_morgan_radius': 3, 'combined_morgan_nBits': 1024, 'combined_rdkit_maxPath': 7, 'combined_rdkit_nBits': 1024, 'num_hidden_layers': 3, 'hidden_dim_0': 256, 'hidden_dim_1': 1024, 'hidden_dim_2': 1024, 'kl_weight': 0.00015773074390457962, 'lr': 0.00935620329530715, 'batch_size': 128, 'dropout_rate': 0.07884599081253, 'prior_mu': 0.03882222428945683, 'prior_sigma': 0.09982943015957439, 'normalization': 'layer'}. Best is trial 896 with value: 0.4533553242683411.
Generating morgan_rdkit fingerprints...
Generated fingerprints with 2048 features for 841 molecules
Trial 2358: 5-fold CV loss = 0.4699
[I 2025-08-08 00:49:28,550] Trial 2358 finished with value: 0.46989675164222716 and parameters: {'fp_type': 'morgan_rdkit', 'combined_morgan_radius': 3, 'combined_morgan_nBits': 1024, 'combined_rdkit_maxPath': 7, 'combined_rdkit_nBits': 1024, 'num_hidden_layers': 3, 'hidden_dim_0': 256, 'hidden_dim_1': 1024, 'hidden_dim_2': 64, 'kl_weight': 0.0001377877153707584, 'lr': 0.008648490141555906, 'batch_size': 128, 'dropout_rate': 0.07589382469333977, 'prior_mu': 0.01791477256892724, 'prior_sigma': 0.10258418665079203, 'normalization': 'layer'}. Best is trial 896 with value: 0.4533553242683411.
Generating morgan_rdkit fingerprints...
Generated fingerprints with 2048 features for 841 molecules
Trial 2362: 5-fold CV loss = 0.5728
[I 2025-08-08 00:49:53,774] Trial 2362 finished with value: 0.5727699756622314 and parameters: {'fp_type': 'morgan_rdkit', 'combined_morgan_radius': 3, 'combined_morgan_nBits': 1024, 'combined_rdkit_maxPath': 7, 'combined_rdkit_nBits': 1024, 'num_hidden_layers': 3, 'hidden_dim_0': 128, 'hidden_dim_1': 1024, 'hidden_dim_2': 64, 'kl_weight': 0.00015156594310470275, 'lr': 0.009246851962506138, 'batch_size': 128, 'dropout_rate': 0.08350086428855334, 'prior_mu': 0.026207069038034707, 'prior_sigma': 0.10755189230282998, 'normalization': 'layer'}. Best is trial 896 with value: 0.4533553242683411.
Generating morgan_rdkit fingerprints...
Generated fingerprints with 2048 features for 841 molecules
Trial 2360: 5-fold CV loss = 0.6489
[I 2025-08-08 00:49:56,957] Trial 2360 finished with value: 0.6489212810993195 and parameters: {'fp_type': 'morgan_rdkit', 'combined_morgan_radius': 3, 'combined_morgan_nBits': 1024, 'combined_rdkit_maxPath': 8, 'combined_rdkit_nBits': 1024, 'num_hidden_layers': 3, 'hidden_dim_0': 256, 'hidden_dim_1': 1024, 'hidden_dim_2': 64, 'kl_weight': 0.00012109121642328786, 'lr': 0.009193364534948291, 'batch_size': 128, 'dropout_rate': 0.07264566624319362, 'prior_mu': 0.028273591794780426, 'prior_sigma': 0.10365672265117606, 'normalization': 'layer'}. Best is trial 896 with value: 0.4533553242683411.
Generating morgan_rdkit fingerprints...
Generated fingerprints with 2048 features for 841 molecules
Trial 2355: 5-fold CV loss = 0.5506
[I 2025-08-08 00:49:58,497] Trial 2355 finished with value: 0.5506472170352936 and parameters: {'fp_type': 'morgan_rdkit', 'combined_morgan_radius': 2, 'combined_morgan_nBits': 1024, 'combined_rdkit_maxPath': 7, 'combined_rdkit_nBits': 1024, 'num_hidden_layers': 3, 'hidden_dim_0': 256, 'hidden_dim_1': 1024, 'hidden_dim_2': 128, 'kl_weight': 0.00011621218106470997, 'lr': 0.009204563781447217, 'batch_size': 128, 'dropout_rate': 0.06327236565714797, 'prior_mu': 0.03155358081557072, 'prior_sigma': 0.10814511289453303, 'normalization': 'layer'}. Best is trial 896 with value: 0.4533553242683411.
Generating morgan_rdkit fingerprints...
Generated fingerprints with 2048 features for 841 molecules
Trial 2361: 5-fold CV loss = 0.5557
[I 2025-08-08 00:50:18,395] Trial 2361 finished with value: 0.5556547045707703 and parameters: {'fp_type': 'morgan_rdkit', 'combined_morgan_radius': 3, 'combined_morgan_nBits': 1024, 'combined_rdkit_maxPath': 8, 'combined_rdkit_nBits': 1024, 'num_hidden_layers': 3, 'hidden_dim_0': 256, 'hidden_dim_1': 1024, 'hidden_dim_2': 64, 'kl_weight': 0.00012639945192163845, 'lr': 0.007860686522649735, 'batch_size': 128, 'dropout_rate': 0.07318456636130995, 'prior_mu': 0.01204954723427799, 'prior_sigma': 0.10306188400420628, 'normalization': 'layer'}. Best is trial 896 with value: 0.4533553242683411.
Generating morgan_rdkit fingerprints...
Generated fingerprints with 2048 features for 841 molecules
Trial 2363: 5-fold CV loss = 0.4813
[I 2025-08-08 00:50:38,517] Trial 2363 finished with value: 0.48126779198646547 and parameters: {'fp_type': 'morgan_rdkit', 'combined_morgan_radius': 3, 'combined_morgan_nBits': 1024, 'combined_rdkit_maxPath': 8, 'combined_rdkit_nBits': 1024, 'num_hidden_layers': 3, 'hidden_dim_0': 256, 'hidden_dim_1': 1024, 'hidden_dim_2': 64, 'kl_weight': 0.00015535343695785036, 'lr': 0.007788127786951215, 'batch_size': 128, 'dropout_rate': 0.06934033321992787, 'prior_mu': 0.015797628832888697, 'prior_sigma': 0.11451577096662525, 'normalization': 'layer'}. Best is trial 896 with value: 0.4533553242683411.
Generating morgan_rdkit fingerprints...
Generated fingerprints with 2048 features for 841 molecules
Trial 2364: 5-fold CV loss = 0.7977
[I 2025-08-08 00:50:40,333] Trial 2364 finished with value: 0.7976851105690003 and parameters: {'fp_type': 'morgan_rdkit', 'combined_morgan_radius': 3, 'combined_morgan_nBits': 1024, 'combined_rdkit_maxPath': 7, 'combined_rdkit_nBits': 1024, 'num_hidden_layers': 3, 'hidden_dim_0': 256, 'hidden_dim_1': 1024, 'hidden_dim_2': 64, 'kl_weight': 0.00014983198082480135, 'lr': 0.009955918219725794, 'batch_size': 128, 'dropout_rate': 0.09304492939243048, 'prior_mu': 0.03105453539993175, 'prior_sigma': 0.11431169477844562, 'normalization': 'none'}. Best is trial 896 with value: 0.4533553242683411.
Generating morgan_rdkit fingerprints...
Generated fingerprints with 2048 features for 841 molecules
Trial 2368: 5-fold CV loss = 0.4777
[I 2025-08-08 00:51:09,617] Trial 2368 finished with value: 0.4776955842971802 and parameters: {'fp_type': 'morgan_rdkit', 'combined_morgan_radius': 3, 'combined_morgan_nBits': 1024, 'combined_rdkit_maxPath': 5, 'combined_rdkit_nBits': 1024, 'num_hidden_layers': 3, 'hidden_dim_0': 256, 'hidden_dim_1': 1024, 'hidden_dim_2': 64, 'kl_weight': 0.00015496061553077578, 'lr': 0.0077308566050403645, 'batch_size': 128, 'dropout_rate': 0.09481207723431022, 'prior_mu': 0.009331340025551504, 'prior_sigma': 0.10434138885258588, 'normalization': 'layer'}. Best is trial 896 with value: 0.4533553242683411.
Generating morgan_rdkit fingerprints...
Generated fingerprints with 2048 features for 841 molecules
Trial 2367: 5-fold CV loss = 0.4726
[I 2025-08-08 00:51:12,845] Trial 2367 finished with value: 0.4726130187511444 and parameters: {'fp_type': 'morgan_rdkit', 'combined_morgan_radius': 3, 'combined_morgan_nBits': 1024, 'combined_rdkit_maxPath': 7, 'combined_rdkit_nBits': 1024, 'num_hidden_layers': 3, 'hidden_dim_0': 256, 'hidden_dim_1': 1024, 'hidden_dim_2': 64, 'kl_weight': 0.00015263538630174374, 'lr': 0.009962266118649577, 'batch_size': 128, 'dropout_rate': 0.09492195320332981, 'prior_mu': 0.01346333584722375, 'prior_sigma': 0.09482248203129046, 'normalization': 'layer'}. Best is trial 896 with value: 0.4533553242683411.
Generating morgan_rdkit fingerprints...
Generated fingerprints with 2048 features for 841 molecules
Trial 2366: 5-fold CV loss = 0.4741
[I 2025-08-08 00:51:19,686] Trial 2366 finished with value: 0.4741490066051483 and parameters: {'fp_type': 'morgan_rdkit', 'combined_morgan_radius': 3, 'combined_morgan_nBits': 1024, 'combined_rdkit_maxPath': 7, 'combined_rdkit_nBits': 1024, 'num_hidden_layers': 3, 'hidden_dim_0': 256, 'hidden_dim_1': 1024, 'hidden_dim_2': 64, 'kl_weight': 0.00013040242885586876, 'lr': 0.007974604605648243, 'batch_size': 128, 'dropout_rate': 0.09340618197398, 'prior_mu': 0.014517130098518849, 'prior_sigma': 0.0973489703055403, 'normalization': 'layer'}. Best is trial 896 with value: 0.4533553242683411.
Generating morgan_rdkit fingerprints...
Generated fingerprints with 2048 features for 841 molecules
Trial 2365: 5-fold CV loss = 0.6807
[I 2025-08-08 00:51:27,072] Trial 2365 finished with value: 0.6806864738464355 and parameters: {'fp_type': 'morgan_rdkit', 'combined_morgan_radius': 3, 'combined_morgan_nBits': 1024, 'combined_rdkit_maxPath': 7, 'combined_rdkit_nBits': 1024, 'num_hidden_layers': 3, 'hidden_dim_0': 256, 'hidden_dim_1': 1024, 'hidden_dim_2': 64, 'kl_weight': 0.00011680775028016304, 'lr': 0.008083838172107642, 'batch_size': 128, 'dropout_rate': 0.09544976818941976, 'prior_mu': 0.011596421808872487, 'prior_sigma': 0.0950678290546947, 'normalization': 'none'}. Best is trial 896 with value: 0.4533553242683411.
Generating morgan_rdkit fingerprints...
Generated fingerprints with 2048 features for 841 molecules
Trial 2369: 5-fold CV loss = 0.6230
[I 2025-08-08 00:51:42,290] Trial 2369 finished with value: 0.6230016350746155 and parameters: {'fp_type': 'morgan_rdkit', 'combined_morgan_radius': 3, 'combined_morgan_nBits': 1024, 'combined_rdkit_maxPath': 7, 'combined_rdkit_nBits': 1024, 'num_hidden_layers': 3, 'hidden_dim_0': 256, 'hidden_dim_1': 128, 'hidden_dim_2': 64, 'kl_weight': 0.00012049829641300053, 'lr': 0.008217636721443313, 'batch_size': 128, 'dropout_rate': 0.097234030069964, 'prior_mu': 0.04025635022121541, 'prior_sigma': 0.09511629120350099, 'normalization': 'layer'}. Best is trial 896 with value: 0.4533553242683411.
Generating morgan_rdkit fingerprints...
Generated fingerprints with 2048 features for 841 molecules
Trial 2370: 5-fold CV loss = 0.4650
[I 2025-08-08 00:51:58,800] Trial 2370 finished with value: 0.4650071859359741 and parameters: {'fp_type': 'morgan_rdkit', 'combined_morgan_radius': 3, 'combined_morgan_nBits': 1024, 'combined_rdkit_maxPath': 7, 'combined_rdkit_nBits': 1024, 'num_hidden_layers': 3, 'hidden_dim_0': 256, 'hidden_dim_1': 128, 'hidden_dim_2': 64, 'kl_weight': 0.00010011734158360544, 'lr': 0.008311142374430314, 'batch_size': 128, 'dropout_rate': 0.08227411717506854, 'prior_mu': 0.01961055828981057, 'prior_sigma': 0.0956436818255099, 'normalization': 'layer'}. Best is trial 896 with value: 0.4533553242683411.
Generating morgan_rdkit fingerprints...
Generated fingerprints with 2048 features for 841 molecules
Trial 2371: 5-fold CV loss = 0.6392
[I 2025-08-08 00:52:05,304] Trial 2371 finished with value: 0.639203542470932 and parameters: {'fp_type': 'morgan_rdkit', 'combined_morgan_radius': 3, 'combined_morgan_nBits': 1024, 'combined_rdkit_maxPath': 7, 'combined_rdkit_nBits': 1024, 'num_hidden_layers': 3, 'hidden_dim_0': 1024, 'hidden_dim_1': 128, 'hidden_dim_2': 64, 'kl_weight': 0.0001552665315629047, 'lr': 0.008571735027862133, 'batch_size': 128, 'dropout_rate': 0.08061248257073832, 'prior_mu': 0.018123119295157433, 'prior_sigma': 0.09541530243034947, 'normalization': 'layer'}. Best is trial 896 with value: 0.4533553242683411.
Generating morgan_rdkit fingerprints...
Generated fingerprints with 2048 features for 841 molecules
Trial 2373: 5-fold CV loss = 0.4631
[I 2025-08-08 00:52:24,423] Trial 2373 finished with value: 0.46310181021690366 and parameters: {'fp_type': 'morgan_rdkit', 'combined_morgan_radius': 3, 'combined_morgan_nBits': 1024, 'combined_rdkit_maxPath': 7, 'combined_rdkit_nBits': 1024, 'num_hidden_layers': 3, 'hidden_dim_0': 1024, 'hidden_dim_1': 1024, 'hidden_dim_2': 64, 'kl_weight': 0.00015074638060130218, 'lr': 0.008517753660200389, 'batch_size': 128, 'dropout_rate': 0.08168861675545581, 'prior_mu': 0.01783714474921517, 'prior_sigma': 0.09910082262048177, 'normalization': 'layer'}. Best is trial 896 with value: 0.4533553242683411.
Generating morgan_rdkit fingerprints...
Generated fingerprints with 2048 features for 841 molecules
Trial 2374: 5-fold CV loss = 0.4637
[I 2025-08-08 00:52:37,812] Trial 2374 finished with value: 0.4636805295944214 and parameters: {'fp_type': 'morgan_rdkit', 'combined_morgan_radius': 3, 'combined_morgan_nBits': 1024, 'combined_rdkit_maxPath': 7, 'combined_rdkit_nBits': 1024, 'num_hidden_layers': 3, 'hidden_dim_0': 256, 'hidden_dim_1': 1024, 'hidden_dim_2': 64, 'kl_weight': 0.00015934260482301853, 'lr': 0.007529332270038954, 'batch_size': 128, 'dropout_rate': 0.08497688980479519, 'prior_mu': 0.0341910691761568, 'prior_sigma': 0.09960801585959092, 'normalization': 'layer'}. Best is trial 896 with value: 0.4533553242683411.
Generating morgan_rdkit fingerprints...
Generated fingerprints with 2048 features for 841 molecules
Trial 2372: 5-fold CV loss = 0.5635
[I 2025-08-08 00:52:42,946] Trial 2372 finished with value: 0.5635442435741425 and parameters: {'fp_type': 'morgan_rdkit', 'combined_morgan_radius': 3, 'combined_morgan_nBits': 1024, 'combined_rdkit_maxPath': 7, 'combined_rdkit_nBits': 1024, 'num_hidden_layers': 3, 'hidden_dim_0': 1024, 'hidden_dim_1': 1024, 'hidden_dim_2': 64, 'kl_weight': 0.00016098345860994805, 'lr': 0.008504495392032753, 'batch_size': 128, 'dropout_rate': 0.08013670744914982, 'prior_mu': 0.024268870333771026, 'prior_sigma': 0.10095211697828076, 'normalization': 'layer'}. Best is trial 896 with value: 0.4533553242683411.
Generating morgan_rdkit fingerprints...
Generated fingerprints with 2048 features for 841 molecules
Trial 2376: 5-fold CV loss = 0.4672
[I 2025-08-08 00:52:57,238] Trial 2376 finished with value: 0.46723464131355286 and parameters: {'fp_type': 'morgan_rdkit', 'combined_morgan_radius': 3, 'combined_morgan_nBits': 1024, 'combined_rdkit_maxPath': 6, 'combined_rdkit_nBits': 1024, 'num_hidden_layers': 3, 'hidden_dim_0': 256, 'hidden_dim_1': 1024, 'hidden_dim_2': 64, 'kl_weight': 0.00013472127337963398, 'lr': 0.0099735988782401, 'batch_size': 128, 'dropout_rate': 0.05949980640851207, 'prior_mu': 0.012169704530945605, 'prior_sigma': 0.10061462378182526, 'normalization': 'layer'}. Best is trial 896 with value: 0.4533553242683411.
Generating morgan_rdkit fingerprints...
Generated fingerprints with 2048 features for 841 molecules
Trial 2375: 5-fold CV loss = 0.4671
[I 2025-08-08 00:53:03,020] Trial 2375 finished with value: 0.46711580753326415 and parameters: {'fp_type': 'morgan_rdkit', 'combined_morgan_radius': 3, 'combined_morgan_nBits': 1024, 'combined_rdkit_maxPath': 7, 'combined_rdkit_nBits': 1024, 'num_hidden_layers': 3, 'hidden_dim_0': 256, 'hidden_dim_1': 1024, 'hidden_dim_2': 64, 'kl_weight': 0.0001659793998087473, 'lr': 0.007662698281395438, 'batch_size': 128, 'dropout_rate': 0.05313914315415409, 'prior_mu': 0.03202207286778079, 'prior_sigma': 0.09945361441309193, 'normalization': 'layer'}. Best is trial 896 with value: 0.4533553242683411.
Generating morgan_rdkit fingerprints...
Generated fingerprints with 2048 features for 841 molecules
Trial 2377: 5-fold CV loss = 0.4789
[I 2025-08-08 00:53:12,299] Trial 2377 finished with value: 0.47888439893722534 and parameters: {'fp_type': 'morgan_rdkit', 'combined_morgan_radius': 3, 'combined_morgan_nBits': 1024, 'combined_rdkit_maxPath': 6, 'combined_rdkit_nBits': 1024, 'num_hidden_layers': 3, 'hidden_dim_0': 256, 'hidden_dim_1': 1024, 'hidden_dim_2': 64, 'kl_weight': 0.00013506005348792513, 'lr': 0.00923521429551742, 'batch_size': 128, 'dropout_rate': 0.060696798727262566, 'prior_mu': 0.00592232874933747, 'prior_sigma': 0.10900124748680047, 'normalization': 'layer'}. Best is trial 896 with value: 0.4533553242683411.
Generating morgan_rdkit fingerprints...
Generated fingerprints with 2048 features for 841 molecules
Trial 2379: 5-fold CV loss = 1.2759
[I 2025-08-08 00:53:26,862] Trial 2379 finished with value: 1.2758612036705017 and parameters: {'fp_type': 'morgan_rdkit', 'combined_morgan_radius': 3, 'combined_morgan_nBits': 1024, 'combined_rdkit_maxPath': 7, 'combined_rdkit_nBits': 1024, 'num_hidden_layers': 3, 'hidden_dim_0': 512, 'hidden_dim_1': 1024, 'hidden_dim_2': 64, 'kl_weight': 0.00017149105766881394, 'lr': 0.00011521672256343156, 'batch_size': 128, 'dropout_rate': 0.051814409341325085, 'prior_mu': 0.03635193255415619, 'prior_sigma': 0.11126115131452942, 'normalization': 'layer'}. Best is trial 896 with value: 0.4533553242683411.
Generating morgan_rdkit fingerprints...
Generated fingerprints with 2048 features for 841 molecules
Trial 2378: 5-fold CV loss = 0.4745
[I 2025-08-08 00:53:54,366] Trial 2378 finished with value: 0.47450398206710814 and parameters: {'fp_type': 'morgan_rdkit', 'combined_morgan_radius': 3, 'combined_morgan_nBits': 1024, 'combined_rdkit_maxPath': 6, 'combined_rdkit_nBits': 1024, 'num_hidden_layers': 3, 'hidden_dim_0': 512, 'hidden_dim_1': 1024, 'hidden_dim_2': 64, 'kl_weight': 0.00016653983410201898, 'lr': 0.009983675958748795, 'batch_size': 128, 'dropout_rate': 0.042982843668556814, 'prior_mu': 0.005333670477492156, 'prior_sigma': 0.10773645028430681, 'normalization': 'layer'}. Best is trial 896 with value: 0.4533553242683411.
Generating morgan_rdkit fingerprints...
Generated fingerprints with 1536 features for 841 molecules
Trial 2380: 5-fold CV loss = 0.4617
[I 2025-08-08 00:54:01,079] Trial 2380 finished with value: 0.4616978704929352 and parameters: {'fp_type': 'morgan_rdkit', 'combined_morgan_radius': 3, 'combined_morgan_nBits': 1024, 'combined_rdkit_maxPath': 7, 'combined_rdkit_nBits': 1024, 'num_hidden_layers': 3, 'hidden_dim_0': 256, 'hidden_dim_1': 1024, 'hidden_dim_2': 64, 'kl_weight': 0.00013335200378733115, 'lr': 0.009067182922702689, 'batch_size': 128, 'dropout_rate': 0.08823420809526625, 'prior_mu': 0.00600245591959183, 'prior_sigma': 0.12396846120655478, 'normalization': 'layer'}. Best is trial 896 with value: 0.4533553242683411.
Generating morgan_rdkit fingerprints...
Generated fingerprints with 1536 features for 841 molecules
Trial 2381: 5-fold CV loss = 0.4728
[I 2025-08-08 00:54:04,384] Trial 2381 finished with value: 0.4728139162063599 and parameters: {'fp_type': 'morgan_rdkit', 'combined_morgan_radius': 3, 'combined_morgan_nBits': 1024, 'combined_rdkit_maxPath': 7, 'combined_rdkit_nBits': 1024, 'num_hidden_layers': 3, 'hidden_dim_0': 256, 'hidden_dim_1': 1024, 'hidden_dim_2': 64, 'kl_weight': 0.00011295403745212527, 'lr': 0.007554217057956975, 'batch_size': 64, 'dropout_rate': 0.07041376911176142, 'prior_mu': 0.004043563403939823, 'prior_sigma': 0.1067627462741851, 'normalization': 'layer'}. Best is trial 896 with value: 0.4533553242683411.
Generating morgan_rdkit fingerprints...
Generated fingerprints with 1536 features for 841 molecules
Trial 2382: 5-fold CV loss = 0.4628
[I 2025-08-08 00:54:28,117] Trial 2382 finished with value: 0.46280385851860045 and parameters: {'fp_type': 'morgan_rdkit', 'combined_morgan_radius': 3, 'combined_morgan_nBits': 1024, 'combined_rdkit_maxPath': 7, 'combined_rdkit_nBits': 1024, 'num_hidden_layers': 3, 'hidden_dim_0': 256, 'hidden_dim_1': 64, 'hidden_dim_2': 64, 'kl_weight': 0.00013789745613912094, 'lr': 0.007750415428911085, 'batch_size': 64, 'dropout_rate': 0.06896748274571797, 'prior_mu': 0.004877841122508636, 'prior_sigma': 0.10544752493603687, 'normalization': 'layer'}. Best is trial 896 with value: 0.4533553242683411.
Generating morgan_rdkit fingerprints...
Generated fingerprints with 1536 features for 841 molecules
Trial 2385: 5-fold CV loss = 0.4759
[I 2025-08-08 00:54:41,081] Trial 2385 finished with value: 0.475903058052063 and parameters: {'fp_type': 'morgan_rdkit', 'combined_morgan_radius': 3, 'combined_morgan_nBits': 512, 'combined_rdkit_maxPath': 7, 'combined_rdkit_nBits': 1024, 'num_hidden_layers': 3, 'hidden_dim_0': 256, 'hidden_dim_1': 1024, 'hidden_dim_2': 64, 'kl_weight': 0.00013776132064832145, 'lr': 0.007601200418958131, 'batch_size': 128, 'dropout_rate': 0.10023065835148826, 'prior_mu': 0.011258810025205863, 'prior_sigma': 0.11782195312333654, 'normalization': 'layer'}. Best is trial 896 with value: 0.4533553242683411.
Generating morgan_rdkit fingerprints...
Generated fingerprints with 2048 features for 841 molecules
Trial 2386: 5-fold CV loss = 0.7221
[I 2025-08-08 00:54:57,098] Trial 2386 finished with value: 0.7221248507499695 and parameters: {'fp_type': 'morgan_rdkit', 'combined_morgan_radius': 3, 'combined_morgan_nBits': 512, 'combined_rdkit_maxPath': 7, 'combined_rdkit_nBits': 1024, 'num_hidden_layers': 3, 'hidden_dim_0': 256, 'hidden_dim_1': 1024, 'hidden_dim_2': 256, 'kl_weight': 0.00011581053752262082, 'lr': 0.007682929710694545, 'batch_size': 128, 'dropout_rate': 0.09835860599762826, 'prior_mu': 0.021603956937501313, 'prior_sigma': 0.0959240688464235, 'normalization': 'layer'}. Best is trial 896 with value: 0.4533553242683411.
Generating morgan_rdkit fingerprints...
Generated fingerprints with 2048 features for 841 molecules
Trial 2387: 5-fold CV loss = 0.5749
