[I 2025-08-07 19:40:03,362] Trial 795 finished with value: 0.5544780313968658 and parameters: {'fp_type': 'morgan_rdkit', 'combined_morgan_radius': 3, 'combined_morgan_nBits': 1024, 'combined_rdkit_maxPath': 7, 'combined_rdkit_nBits': 1024, 'num_hidden_layers': 3, 'hidden_dim_0': 256, 'hidden_dim_1': 256, 'hidden_dim_2': 64, 'kl_weight': 0.00028035132523143914, 'lr': 0.008221472774644663, 'batch_size': 128, 'dropout_rate': 0.10621216213072784, 'prior_mu': -4.059587078462934e-06, 'prior_sigma': 0.10405777562694325, 'normalization': 'layer'}. Best is trial 587 with value: 0.4552353322505951.
Generating morgan_rdkit fingerprints...
Generated fingerprints with 2048 features for 841 molecules
Trial 797: 5-fold CV loss = 0.5002
[I 2025-08-07 19:40:29,633] Trial 797 finished with value: 0.5001831114292145 and parameters: {'fp_type': 'morgan_rdkit', 'combined_morgan_radius': 3, 'combined_morgan_nBits': 1024, 'combined_rdkit_maxPath': 7, 'combined_rdkit_nBits': 1024, 'num_hidden_layers': 1, 'hidden_dim_0': 256, 'kl_weight': 0.0005940392618962563, 'lr': 0.0066215064860743154, 'batch_size': 128, 'dropout_rate': 0.08816817281264672, 'prior_mu': 0.0017371452313359806, 'prior_sigma': 0.11158268793213841, 'normalization': 'layer'}. Best is trial 587 with value: 0.4552353322505951.
Generating morgan_rdkit fingerprints...
Generated fingerprints with 2048 features for 841 molecules
Trial 798: 5-fold CV loss = 0.5690
[I 2025-08-07 19:40:33,094] Trial 798 finished with value: 0.5689843595027924 and parameters: {'fp_type': 'morgan_rdkit', 'combined_morgan_radius': 3, 'combined_morgan_nBits': 1024, 'combined_rdkit_maxPath': 7, 'combined_rdkit_nBits': 1024, 'num_hidden_layers': 3, 'hidden_dim_0': 256, 'hidden_dim_1': 256, 'hidden_dim_2': 64, 'kl_weight': 0.0005099896300239071, 'lr': 0.0067103428351319855, 'batch_size': 128, 'dropout_rate': 0.08514270804733529, 'prior_mu': -0.0020720513641960428, 'prior_sigma': 0.1093622810610703, 'normalization': 'layer'}. Best is trial 587 with value: 0.4552353322505951.
Generating morgan_rdkit fingerprints...
Generated fingerprints with 2048 features for 841 molecules
Trial 799: 5-fold CV loss = 0.7282
[I 2025-08-07 19:40:35,241] Trial 799 finished with value: 0.7282220005989075 and parameters: {'fp_type': 'morgan_rdkit', 'combined_morgan_radius': 3, 'combined_morgan_nBits': 1024, 'combined_rdkit_maxPath': 7, 'combined_rdkit_nBits': 1024, 'num_hidden_layers': 3, 'hidden_dim_0': 256, 'hidden_dim_1': 256, 'hidden_dim_2': 64, 'kl_weight': 0.0005862444712700278, 'lr': 0.00661804776621067, 'batch_size': 128, 'dropout_rate': 0.07883909781506257, 'prior_mu': 0.0032226387652846637, 'prior_sigma': 0.11190904564363173, 'normalization': 'layer'}. Best is trial 587 with value: 0.4552353322505951.
Generating morgan_rdkit fingerprints...
Generated fingerprints with 2048 features for 841 molecules
Trial 796: 5-fold CV loss = 0.5488
[I 2025-08-07 19:40:54,888] Trial 796 finished with value: 0.5488158464431763 and parameters: {'fp_type': 'morgan_rdkit', 'combined_morgan_radius': 3, 'combined_morgan_nBits': 1024, 'combined_rdkit_maxPath': 7, 'combined_rdkit_nBits': 1024, 'num_hidden_layers': 3, 'hidden_dim_0': 256, 'hidden_dim_1': 256, 'hidden_dim_2': 64, 'kl_weight': 0.0005340311697659889, 'lr': 0.007920393815534993, 'batch_size': 128, 'dropout_rate': 0.07873680544943139, 'prior_mu': 0.003726685207456528, 'prior_sigma': 0.10324044135272017, 'normalization': 'layer'}. Best is trial 587 with value: 0.4552353322505951.
Generating morgan_rdkit fingerprints...
Generated fingerprints with 2048 features for 841 molecules
Trial 800: 5-fold CV loss = 0.8880
[I 2025-08-07 19:41:09,610] Trial 800 finished with value: 0.887974739074707 and parameters: {'fp_type': 'morgan_rdkit', 'combined_morgan_radius': 3, 'combined_morgan_nBits': 1024, 'combined_rdkit_maxPath': 7, 'combined_rdkit_nBits': 1024, 'num_hidden_layers': 3, 'hidden_dim_0': 1024, 'hidden_dim_1': 256, 'hidden_dim_2': 64, 'kl_weight': 0.000518380116232964, 'lr': 0.00012699620843750653, 'batch_size': 128, 'dropout_rate': 0.08820905697984074, 'prior_mu': -0.009462420312230824, 'prior_sigma': 0.10816495588326464, 'normalization': 'layer'}. Best is trial 587 with value: 0.4552353322505951.
Generating morgan_rdkit fingerprints...
Generated fingerprints with 2048 features for 841 molecules
Trial 801: 5-fold CV loss = 0.4650
[I 2025-08-07 19:41:15,113] Trial 801 finished with value: 0.46504928469657897 and parameters: {'fp_type': 'morgan_rdkit', 'combined_morgan_radius': 3, 'combined_morgan_nBits': 1024, 'combined_rdkit_maxPath': 7, 'combined_rdkit_nBits': 1024, 'num_hidden_layers': 3, 'hidden_dim_0': 1024, 'hidden_dim_1': 256, 'hidden_dim_2': 64, 'kl_weight': 0.0005554126209710698, 'lr': 0.007599727609367271, 'batch_size': 128, 'dropout_rate': 0.07344783520378645, 'prior_mu': -0.008147363200803694, 'prior_sigma': 0.10913257811320523, 'normalization': 'layer'}. Best is trial 587 with value: 0.4552353322505951.
Generating morgan_rdkit fingerprints...
Generated fingerprints with 1280 features for 841 molecules
Trial 802: 5-fold CV loss = 0.4657
[I 2025-08-07 19:41:23,315] Trial 802 finished with value: 0.4657424807548523 and parameters: {'fp_type': 'morgan_rdkit', 'combined_morgan_radius': 3, 'combined_morgan_nBits': 1024, 'combined_rdkit_maxPath': 7, 'combined_rdkit_nBits': 1024, 'num_hidden_layers': 3, 'hidden_dim_0': 1024, 'hidden_dim_1': 256, 'hidden_dim_2': 64, 'kl_weight': 0.00047778540427440247, 'lr': 0.007500114387458438, 'batch_size': 128, 'dropout_rate': 0.08395368694464282, 'prior_mu': -0.006506239815449948, 'prior_sigma': 0.10108227922982728, 'normalization': 'layer'}. Best is trial 587 with value: 0.4552353322505951.
Generating morgan_rdkit fingerprints...
Generated fingerprints with 1536 features for 841 molecules
Trial 805: 5-fold CV loss = 0.6078
[I 2025-08-07 19:41:37,521] Trial 805 finished with value: 0.607769352197647 and parameters: {'fp_type': 'morgan_rdkit', 'combined_morgan_radius': 3, 'combined_morgan_nBits': 1024, 'combined_rdkit_maxPath': 7, 'combined_rdkit_nBits': 256, 'num_hidden_layers': 3, 'hidden_dim_0': 256, 'hidden_dim_1': 256, 'hidden_dim_2': 64, 'kl_weight': 0.000422047156713495, 'lr': 0.007541236682568391, 'batch_size': 128, 'dropout_rate': 0.0963894687076159, 'prior_mu': -0.00923071960244483, 'prior_sigma': 0.10277864240638529, 'normalization': 'none'}. Best is trial 587 with value: 0.4552353322505951.
Generating morgan_rdkit fingerprints...
Generated fingerprints with 1536 features for 841 molecules
Trial 803: 5-fold CV loss = 0.8626
[I 2025-08-07 19:41:46,928] Trial 803 finished with value: 0.8626094698905945 and parameters: {'fp_type': 'morgan_rdkit', 'combined_morgan_radius': 3, 'combined_morgan_nBits': 1024, 'combined_rdkit_maxPath': 7, 'combined_rdkit_nBits': 1024, 'num_hidden_layers': 3, 'hidden_dim_0': 1024, 'hidden_dim_1': 256, 'hidden_dim_2': 64, 'kl_weight': 0.0004542490194933568, 'lr': 0.0004191146989394993, 'batch_size': 128, 'dropout_rate': 0.09943154644744268, 'prior_mu': -0.009667804554555499, 'prior_sigma': 0.10401000181933039, 'normalization': 'layer'}. Best is trial 587 with value: 0.4552353322505951.
Generating morgan_rdkit fingerprints...
Generated fingerprints with 2048 features for 841 molecules
Trial 806: 5-fold CV loss = 0.4933
[I 2025-08-07 19:42:05,151] Trial 806 finished with value: 0.4933308959007263 and parameters: {'fp_type': 'morgan_rdkit', 'combined_morgan_radius': 3, 'combined_morgan_nBits': 1024, 'combined_rdkit_maxPath': 7, 'combined_rdkit_nBits': 512, 'num_hidden_layers': 3, 'hidden_dim_0': 256, 'hidden_dim_1': 256, 'hidden_dim_2': 64, 'kl_weight': 0.00041351609837028404, 'lr': 0.00711039166381991, 'batch_size': 128, 'dropout_rate': 0.09392551662106502, 'prior_mu': 0.008597999448241612, 'prior_sigma': 0.10545505979842834, 'normalization': 'layer'}. Best is trial 587 with value: 0.4552353322505951.
Generating morgan_rdkit fingerprints...
Generated fingerprints with 2048 features for 841 molecules
Trial 804: 5-fold CV loss = 0.5965
[I 2025-08-07 19:42:08,140] Trial 804 finished with value: 0.5964886844158173 and parameters: {'fp_type': 'morgan_rdkit', 'combined_morgan_radius': 3, 'combined_morgan_nBits': 1024, 'combined_rdkit_maxPath': 7, 'combined_rdkit_nBits': 1024, 'num_hidden_layers': 3, 'hidden_dim_0': 256, 'hidden_dim_1': 256, 'hidden_dim_2': 64, 'kl_weight': 0.00041557739521383327, 'lr': 0.007376542032908085, 'batch_size': 128, 'dropout_rate': 0.09051344872933857, 'prior_mu': -0.007437082871502727, 'prior_sigma': 0.10418033197211088, 'normalization': 'none'}. Best is trial 587 with value: 0.4552353322505951.
Generating morgan_rdkit fingerprints...
Generated fingerprints with 2048 features for 841 molecules
Trial 807: 5-fold CV loss = 0.6007
[I 2025-08-07 19:42:12,561] Trial 807 finished with value: 0.6007395803928375 and parameters: {'fp_type': 'morgan_rdkit', 'combined_morgan_radius': 3, 'combined_morgan_nBits': 1024, 'combined_rdkit_maxPath': 7, 'combined_rdkit_nBits': 512, 'num_hidden_layers': 3, 'hidden_dim_0': 256, 'hidden_dim_1': 256, 'hidden_dim_2': 64, 'kl_weight': 0.00041111087161834115, 'lr': 0.00576628097835186, 'batch_size': 128, 'dropout_rate': 0.09906548444553594, 'prior_mu': -0.014502372693644655, 'prior_sigma': 0.09759655829656955, 'normalization': 'layer'}. Best is trial 587 with value: 0.4552353322505951.
Generating morgan_rdkit fingerprints...
Generated fingerprints with 2048 features for 841 molecules
Trial 809: 5-fold CV loss = 0.8074
[I 2025-08-07 19:42:33,266] Trial 809 finished with value: 0.807430648803711 and parameters: {'fp_type': 'morgan_rdkit', 'combined_morgan_radius': 3, 'combined_morgan_nBits': 1024, 'combined_rdkit_maxPath': 7, 'combined_rdkit_nBits': 1024, 'num_hidden_layers': 3, 'hidden_dim_0': 256, 'hidden_dim_1': 64, 'hidden_dim_2': 256, 'kl_weight': 0.0006947406283475342, 'lr': 0.008274611333866538, 'batch_size': 128, 'dropout_rate': 0.10751517267199284, 'prior_mu': -0.016793157936755922, 'prior_sigma': 0.09935555041082143, 'normalization': 'layer'}. Best is trial 587 with value: 0.4552353322505951.
Generating morgan_rdkit fingerprints...
Generated fingerprints with 2048 features for 841 molecules
Trial 810: 5-fold CV loss = 0.8080
[I 2025-08-07 19:42:40,884] Trial 810 finished with value: 0.8079991817474366 and parameters: {'fp_type': 'morgan_rdkit', 'combined_morgan_radius': 3, 'combined_morgan_nBits': 1024, 'combined_rdkit_maxPath': 7, 'combined_rdkit_nBits': 1024, 'num_hidden_layers': 3, 'hidden_dim_0': 256, 'hidden_dim_1': 64, 'hidden_dim_2': 256, 'kl_weight': 0.0003638535029606676, 'lr': 0.005787657293933447, 'batch_size': 128, 'dropout_rate': 0.07322569937289007, 'prior_mu': -0.020028086408637714, 'prior_sigma': 0.0988115001866062, 'normalization': 'layer'}. Best is trial 587 with value: 0.4552353322505951.
Generating morgan_rdkit fingerprints...
Generated fingerprints with 2048 features for 841 molecules
Trial 811: 5-fold CV loss = 0.5673
[I 2025-08-07 19:42:46,913] Trial 811 finished with value: 0.5673045754432678 and parameters: {'fp_type': 'morgan_rdkit', 'combined_morgan_radius': 3, 'combined_morgan_nBits': 1024, 'combined_rdkit_maxPath': 7, 'combined_rdkit_nBits': 1024, 'num_hidden_layers': 3, 'hidden_dim_0': 256, 'hidden_dim_1': 64, 'hidden_dim_2': 64, 'kl_weight': 0.0037595809642475024, 'lr': 0.008368344245348958, 'batch_size': 128, 'dropout_rate': 0.10711404715958463, 'prior_mu': -0.015750671078489355, 'prior_sigma': 0.09483824416772843, 'normalization': 'layer'}. Best is trial 587 with value: 0.4552353322505951.
Generating morgan_rdkit fingerprints...
Generated fingerprints with 2048 features for 841 molecules
Trial 812: 5-fold CV loss = 0.5464
[I 2025-08-07 19:43:10,574] Trial 812 finished with value: 0.5464215755462647 and parameters: {'fp_type': 'morgan_rdkit', 'combined_morgan_radius': 3, 'combined_morgan_nBits': 1024, 'combined_rdkit_maxPath': 7, 'combined_rdkit_nBits': 1024, 'num_hidden_layers': 3, 'hidden_dim_0': 256, 'hidden_dim_1': 1024, 'hidden_dim_2': 64, 'kl_weight': 0.0039201185016305125, 'lr': 0.0065967369795043185, 'batch_size': 128, 'dropout_rate': 0.06299058885738715, 'prior_mu': -0.020041914334939525, 'prior_sigma': 0.09470784956370527, 'normalization': 'layer'}. Best is trial 587 with value: 0.4552353322505951.
Generating morgan_rdkit fingerprints...
Generated fingerprints with 2048 features for 841 molecules
Trial 814: 5-fold CV loss = 0.5595
[I 2025-08-07 19:43:20,795] Trial 814 finished with value: 0.559502637386322 and parameters: {'fp_type': 'morgan_rdkit', 'combined_morgan_radius': 3, 'combined_morgan_nBits': 1024, 'combined_rdkit_maxPath': 7, 'combined_rdkit_nBits': 1024, 'num_hidden_layers': 3, 'hidden_dim_0': 256, 'hidden_dim_1': 1024, 'hidden_dim_2': 64, 'kl_weight': 0.0003145742879005521, 'lr': 0.006591611723398377, 'batch_size': 128, 'dropout_rate': 0.11650884758360491, 'prior_mu': -0.021006493522545584, 'prior_sigma': 0.11133171508160777, 'normalization': 'layer'}. Best is trial 587 with value: 0.4552353322505951.
Generating morgan fingerprints...
Generated fingerprints with 1024 features for 841 molecules
Trial 813: 5-fold CV loss = 0.4675
[I 2025-08-07 19:43:28,736] Trial 813 finished with value: 0.46745327711105344 and parameters: {'fp_type': 'morgan_rdkit', 'combined_morgan_radius': 3, 'combined_morgan_nBits': 1024, 'combined_rdkit_maxPath': 7, 'combined_rdkit_nBits': 1024, 'num_hidden_layers': 3, 'hidden_dim_0': 256, 'hidden_dim_1': 1024, 'hidden_dim_2': 64, 'kl_weight': 0.0003320883652721768, 'lr': 0.00660262192252794, 'batch_size': 128, 'dropout_rate': 0.11120689752472429, 'prior_mu': -0.0017432312712113204, 'prior_sigma': 0.0944740108455447, 'normalization': 'layer'}. Best is trial 587 with value: 0.4552353322505951.
Generating morgan_rdkit fingerprints...
Generated fingerprints with 2048 features for 841 molecules
Trial 808: 5-fold CV loss = 0.5395
[I 2025-08-07 19:43:36,059] Trial 808 finished with value: 0.5395245373249054 and parameters: {'fp_type': 'morgan_rdkit', 'combined_morgan_radius': 3, 'combined_morgan_nBits': 1024, 'combined_rdkit_maxPath': 7, 'combined_rdkit_nBits': 1024, 'num_hidden_layers': 3, 'hidden_dim_0': 256, 'hidden_dim_1': 64, 'hidden_dim_2': 64, 'kl_weight': 0.0003948673227557498, 'lr': 0.007002930120772084, 'batch_size': 128, 'dropout_rate': 0.0637508113514595, 'prior_mu': -0.015691949151944863, 'prior_sigma': 0.09758438880246442, 'normalization': 'layer'}. Best is trial 587 with value: 0.4552353322505951.
Generating morgan fingerprints...
Generated fingerprints with 1024 features for 841 molecules
Trial 816: 5-fold CV loss = 0.8723
[I 2025-08-07 19:43:37,843] Trial 816 finished with value: 0.8722986698150634 and parameters: {'fp_type': 'morgan', 'morgan_only_radius': 3, 'morgan_only_nBits': 1024, 'num_hidden_layers': 3, 'hidden_dim_0': 128, 'hidden_dim_1': 1024, 'hidden_dim_2': 64, 'kl_weight': 0.013828796486930011, 'lr': 0.00054709929469052, 'batch_size': 128, 'dropout_rate': 0.10910233093522084, 'prior_mu': -0.011699557962731297, 'prior_sigma': 0.07276248927096249, 'normalization': 'layer'}. Best is trial 587 with value: 0.4552353322505951.
Generating morgan_rdkit fingerprints...
Generated fingerprints with 2048 features for 841 molecules
Trial 815: 5-fold CV loss = 0.4772
[I 2025-08-07 19:43:56,587] Trial 815 finished with value: 0.47718937397003175 and parameters: {'fp_type': 'morgan_rdkit', 'combined_morgan_radius': 3, 'combined_morgan_nBits': 1024, 'combined_rdkit_maxPath': 7, 'combined_rdkit_nBits': 1024, 'num_hidden_layers': 3, 'hidden_dim_0': 256, 'hidden_dim_1': 1024, 'hidden_dim_2': 64, 'kl_weight': 0.00890753738737634, 'lr': 0.006666950136012916, 'batch_size': 128, 'dropout_rate': 0.11684734036788112, 'prior_mu': -0.003665802517080201, 'prior_sigma': 0.1080245642473053, 'normalization': 'layer'}. Best is trial 587 with value: 0.4552353322505951.
Generating morgan_rdkit fingerprints...
Generated fingerprints with 2048 features for 841 molecules
Trial 819: 5-fold CV loss = 0.4750
[I 2025-08-07 19:44:17,197] Trial 819 finished with value: 0.4750113308429718 and parameters: {'fp_type': 'morgan_rdkit', 'combined_morgan_radius': 3, 'combined_morgan_nBits': 1024, 'combined_rdkit_maxPath': 7, 'combined_rdkit_nBits': 1024, 'num_hidden_layers': 3, 'hidden_dim_0': 256, 'hidden_dim_1': 1024, 'hidden_dim_2': 128, 'kl_weight': 0.00048156885441384223, 'lr': 0.008070984214957331, 'batch_size': 128, 'dropout_rate': 0.14671218071603526, 'prior_mu': 0.007307951441713839, 'prior_sigma': 0.10744674716465351, 'normalization': 'layer'}. Best is trial 587 with value: 0.4552353322505951.
Generating morgan_rdkit fingerprints...
Generated fingerprints with 2048 features for 841 molecules
Trial 817: 5-fold CV loss = 0.6250
[I 2025-08-07 19:44:23,350] Trial 817 finished with value: 0.6250338852405548 and parameters: {'fp_type': 'morgan_rdkit', 'combined_morgan_radius': 3, 'combined_morgan_nBits': 1024, 'combined_rdkit_maxPath': 7, 'combined_rdkit_nBits': 1024, 'num_hidden_layers': 3, 'hidden_dim_0': 128, 'hidden_dim_1': 1024, 'hidden_dim_2': 128, 'kl_weight': 0.0004703736140014249, 'lr': 0.00800675136634814, 'batch_size': 128, 'dropout_rate': 0.11408253086017135, 'prior_mu': 0.010866876155689906, 'prior_sigma': 0.1069087988690537, 'normalization': 'layer'}. Best is trial 587 with value: 0.4552353322505951.
Generating morgan_rdkit fingerprints...
Generated fingerprints with 2048 features for 841 molecules
Trial 818: 5-fold CV loss = 0.5262
[I 2025-08-07 19:44:35,509] Trial 818 finished with value: 0.5262142837047576 and parameters: {'fp_type': 'morgan', 'morgan_only_radius': 3, 'morgan_only_nBits': 1024, 'num_hidden_layers': 3, 'hidden_dim_0': 128, 'hidden_dim_1': 1024, 'hidden_dim_2': 128, 'kl_weight': 0.0004750288572515359, 'lr': 0.00828983820376879, 'batch_size': 128, 'dropout_rate': 0.052793994181578985, 'prior_mu': -0.02615177770045881, 'prior_sigma': 0.07286251529478031, 'normalization': 'layer'}. Best is trial 587 with value: 0.4552353322505951.
Generating morgan_rdkit fingerprints...
Generated fingerprints with 2048 features for 841 molecules
Trial 820: 5-fold CV loss = 0.5405
[I 2025-08-07 19:44:38,632] Trial 820 finished with value: 0.5405458629131317 and parameters: {'fp_type': 'morgan_rdkit', 'combined_morgan_radius': 3, 'combined_morgan_nBits': 1024, 'combined_rdkit_maxPath': 7, 'combined_rdkit_nBits': 1024, 'num_hidden_layers': 3, 'hidden_dim_0': 256, 'hidden_dim_1': 1024, 'hidden_dim_2': 128, 'kl_weight': 0.00047936443800944764, 'lr': 0.007886847737877291, 'batch_size': 128, 'dropout_rate': 0.0213326690923078, 'prior_mu': -0.028595805475829367, 'prior_sigma': 0.1011009023622647, 'normalization': 'layer'}. Best is trial 587 with value: 0.4552353322505951.
Generating morgan_rdkit fingerprints...
Generated fingerprints with 2048 features for 841 molecules
Trial 821: 5-fold CV loss = 0.4840
[I 2025-08-07 19:45:03,101] Trial 821 finished with value: 0.48401962518692015 and parameters: {'fp_type': 'morgan_rdkit', 'combined_morgan_radius': 3, 'combined_morgan_nBits': 1024, 'combined_rdkit_maxPath': 7, 'combined_rdkit_nBits': 1024, 'num_hidden_layers': 3, 'hidden_dim_0': 256, 'hidden_dim_1': 1024, 'hidden_dim_2': 64, 'kl_weight': 0.00025777456502758917, 'lr': 0.005325389476275524, 'batch_size': 128, 'dropout_rate': 0.4890504286723585, 'prior_mu': -0.02606175220204004, 'prior_sigma': 0.1018844269516315, 'normalization': 'layer'}. Best is trial 587 with value: 0.4552353322505951.
Generating morgan_rdkit fingerprints...
Generated fingerprints with 2048 features for 841 molecules
Trial 822: 5-fold CV loss = 0.5535
[I 2025-08-07 19:45:12,900] Trial 822 finished with value: 0.5535403490066528 and parameters: {'fp_type': 'morgan_rdkit', 'combined_morgan_radius': 3, 'combined_morgan_nBits': 1024, 'combined_rdkit_maxPath': 7, 'combined_rdkit_nBits': 1024, 'num_hidden_layers': 3, 'hidden_dim_0': 256, 'hidden_dim_1': 1024, 'hidden_dim_2': 64, 'kl_weight': 0.0002536142771699958, 'lr': 0.005016041581552569, 'batch_size': 128, 'dropout_rate': 0.14886990092351185, 'prior_mu': -0.024217679592918602, 'prior_sigma': 0.1000549194748672, 'normalization': 'layer'}. Best is trial 587 with value: 0.4552353322505951.
Generating morgan_rdkit fingerprints...
Generated fingerprints with 2048 features for 841 molecules
Trial 824: 5-fold CV loss = 0.4589
[I 2025-08-07 19:45:35,141] Trial 824 finished with value: 0.45889835953712466 and parameters: {'fp_type': 'morgan_rdkit', 'combined_morgan_radius': 3, 'combined_morgan_nBits': 1024, 'combined_rdkit_maxPath': 7, 'combined_rdkit_nBits': 1024, 'num_hidden_layers': 3, 'hidden_dim_0': 256, 'hidden_dim_1': 1024, 'hidden_dim_2': 64, 'kl_weight': 0.0002561460735261561, 'lr': 0.00538707801050062, 'batch_size': 64, 'dropout_rate': 0.14651799840382929, 'prior_mu': -0.022695696945809418, 'prior_sigma': 0.07986760934115437, 'normalization': 'layer'}. Best is trial 587 with value: 0.4552353322505951.
Generating morgan_rdkit fingerprints...
Generated fingerprints with 2048 features for 841 molecules
Trial 825: 5-fold CV loss = 0.4720
[I 2025-08-07 19:46:02,195] Trial 825 finished with value: 0.47201225757598875 and parameters: {'fp_type': 'morgan_rdkit', 'combined_morgan_radius': 3, 'combined_morgan_nBits': 1024, 'combined_rdkit_maxPath': 8, 'combined_rdkit_nBits': 1024, 'num_hidden_layers': 3, 'hidden_dim_0': 256, 'hidden_dim_1': 1024, 'hidden_dim_2': 64, 'kl_weight': 0.0003489717819497402, 'lr': 0.004912244833333628, 'batch_size': 64, 'dropout_rate': 0.1523714909590315, 'prior_mu': -0.013058024080948638, 'prior_sigma': 0.0912702948672861, 'normalization': 'layer'}. Best is trial 587 with value: 0.4552353322505951.
Generating morgan_rdkit fingerprints...
Generated fingerprints with 2048 features for 841 molecules
Trial 823: 5-fold CV loss = 0.4735
