[I 2025-08-07 21:57:34,575] Trial 1487 finished with value: 0.46675858497619627 and parameters: {'fp_type': 'morgan_rdkit', 'combined_morgan_radius': 3, 'combined_morgan_nBits': 1024, 'combined_rdkit_maxPath': 7, 'combined_rdkit_nBits': 1024, 'num_hidden_layers': 3, 'hidden_dim_0': 256, 'hidden_dim_1': 1024, 'hidden_dim_2': 64, 'kl_weight': 0.0004653542480139365, 'lr': 0.004925391547730203, 'batch_size': 64, 'dropout_rate': 0.09159728725251912, 'prior_mu': -0.05311680180202846, 'prior_sigma': 0.06896660559970706, 'normalization': 'layer'}. Best is trial 896 with value: 0.4533553242683411.
Generating morgan_rdkit fingerprints...
Generated fingerprints with 2048 features for 841 molecules
Trial 1485: 5-fold CV loss = 0.5319
[I 2025-08-07 21:57:42,970] Trial 1485 finished with value: 0.5319160103797913 and parameters: {'fp_type': 'morgan_rdkit', 'combined_morgan_radius': 3, 'combined_morgan_nBits': 1024, 'combined_rdkit_maxPath': 7, 'combined_rdkit_nBits': 1024, 'num_hidden_layers': 3, 'hidden_dim_0': 256, 'hidden_dim_1': 1024, 'hidden_dim_2': 64, 'kl_weight': 0.000431362842469884, 'lr': 0.004897823629102368, 'batch_size': 64, 'dropout_rate': 0.060115398017499315, 'prior_mu': -0.04958812876738226, 'prior_sigma': 0.061058423317564385, 'normalization': 'none'}. Best is trial 896 with value: 0.4533553242683411.
Generating morgan_rdkit fingerprints...
Generated fingerprints with 2048 features for 841 molecules
Trial 1488: 5-fold CV loss = 0.7267
[I 2025-08-07 21:57:47,893] Trial 1488 finished with value: 0.7267161011695862 and parameters: {'fp_type': 'morgan_rdkit', 'combined_morgan_radius': 3, 'combined_morgan_nBits': 1024, 'combined_rdkit_maxPath': 7, 'combined_rdkit_nBits': 1024, 'num_hidden_layers': 3, 'hidden_dim_0': 256, 'hidden_dim_1': 1024, 'hidden_dim_2': 512, 'kl_weight': 0.00043370482164474777, 'lr': 0.0048779960493538, 'batch_size': 128, 'dropout_rate': 0.09351903311823494, 'prior_mu': -0.04391703117392979, 'prior_sigma': 0.0695997087007377, 'normalization': 'layer'}. Best is trial 896 with value: 0.4533553242683411.
Generating morgan_rdkit fingerprints...
Generated fingerprints with 2048 features for 841 molecules
Trial 1484: 5-fold CV loss = 0.5278
[I 2025-08-07 21:58:00,791] Trial 1484 finished with value: 0.5278116643428803 and parameters: {'fp_type': 'morgan_rdkit', 'combined_morgan_radius': 3, 'combined_morgan_nBits': 1024, 'combined_rdkit_maxPath': 7, 'combined_rdkit_nBits': 1024, 'num_hidden_layers': 3, 'hidden_dim_0': 256, 'hidden_dim_1': 1024, 'hidden_dim_2': 256, 'kl_weight': 0.00043770172720951095, 'lr': 0.005046510535374004, 'batch_size': 128, 'dropout_rate': 0.06337357327213688, 'prior_mu': -0.05157810956513117, 'prior_sigma': 0.0592478510746872, 'normalization': 'none'}. Best is trial 896 with value: 0.4533553242683411.
Generating morgan_rdkit fingerprints...
Generated fingerprints with 2048 features for 841 molecules
Trial 1491: 5-fold CV loss = 0.4730
[I 2025-08-07 21:58:21,496] Trial 1491 finished with value: 0.4730234920978546 and parameters: {'fp_type': 'morgan_rdkit', 'combined_morgan_radius': 3, 'combined_morgan_nBits': 1024, 'combined_rdkit_maxPath': 7, 'combined_rdkit_nBits': 1024, 'num_hidden_layers': 3, 'hidden_dim_0': 256, 'hidden_dim_1': 1024, 'hidden_dim_2': 64, 'kl_weight': 0.000897076704046116, 'lr': 0.0061579550434416605, 'batch_size': 128, 'dropout_rate': 0.08072504200507172, 'prior_mu': -0.03959021628370109, 'prior_sigma': 0.07138452309354558, 'normalization': 'layer'}. Best is trial 896 with value: 0.4533553242683411.
Generating morgan_rdkit fingerprints...
Generated fingerprints with 2048 features for 841 molecules
Trial 1489: 5-fold CV loss = 0.4680
[I 2025-08-07 21:58:35,698] Trial 1489 finished with value: 0.4680329620838165 and parameters: {'fp_type': 'morgan_rdkit', 'combined_morgan_radius': 3, 'combined_morgan_nBits': 1024, 'combined_rdkit_maxPath': 7, 'combined_rdkit_nBits': 1024, 'num_hidden_layers': 3, 'hidden_dim_0': 256, 'hidden_dim_1': 1024, 'hidden_dim_2': 512, 'kl_weight': 0.00042621440008287195, 'lr': 0.006079203833802555, 'batch_size': 128, 'dropout_rate': 0.09048947830830803, 'prior_mu': -0.04246573061509637, 'prior_sigma': 0.06215594371066003, 'normalization': 'layer'}. Best is trial 896 with value: 0.4533553242683411.
Generating morgan_rdkit fingerprints...
Generated fingerprints with 2048 features for 841 molecules
Trial 1490: 5-fold CV loss = 0.5501
[I 2025-08-07 21:58:50,142] Trial 1490 finished with value: 0.5501223802566528 and parameters: {'fp_type': 'morgan_rdkit', 'combined_morgan_radius': 3, 'combined_morgan_nBits': 1024, 'combined_rdkit_maxPath': 7, 'combined_rdkit_nBits': 1024, 'num_hidden_layers': 3, 'hidden_dim_0': 256, 'hidden_dim_1': 1024, 'hidden_dim_2': 512, 'kl_weight': 0.00042854753047181886, 'lr': 0.006439320612918048, 'batch_size': 128, 'dropout_rate': 0.09400695005792904, 'prior_mu': -0.03936503332084694, 'prior_sigma': 0.07262144403562969, 'normalization': 'layer'}. Best is trial 896 with value: 0.4533553242683411.
Generating morgan fingerprints...
Generated fingerprints with 1024 features for 841 molecules
Trial 1493: 5-fold CV loss = 0.4631
[I 2025-08-07 21:59:01,300] Trial 1493 finished with value: 0.46307259798049927 and parameters: {'fp_type': 'morgan_rdkit', 'combined_morgan_radius': 3, 'combined_morgan_nBits': 1024, 'combined_rdkit_maxPath': 7, 'combined_rdkit_nBits': 1024, 'num_hidden_layers': 3, 'hidden_dim_0': 1024, 'hidden_dim_1': 1024, 'hidden_dim_2': 64, 'kl_weight': 0.00039756269164777265, 'lr': 0.006122473577094523, 'batch_size': 128, 'dropout_rate': 0.09501996909531998, 'prior_mu': -0.0373151518068751, 'prior_sigma': 0.0730210840035783, 'normalization': 'layer'}. Best is trial 896 with value: 0.4533553242683411.
Generating morgan fingerprints...
Generated fingerprints with 1024 features for 841 molecules
Trial 1494: 5-fold CV loss = 0.4642
[I 2025-08-07 21:59:14,080] Trial 1494 finished with value: 0.4641757071018219 and parameters: {'fp_type': 'morgan_rdkit', 'combined_morgan_radius': 3, 'combined_morgan_nBits': 1024, 'combined_rdkit_maxPath': 7, 'combined_rdkit_nBits': 1024, 'num_hidden_layers': 3, 'hidden_dim_0': 1024, 'hidden_dim_1': 1024, 'hidden_dim_2': 64, 'kl_weight': 0.000371314865734399, 'lr': 0.006131104332735425, 'batch_size': 128, 'dropout_rate': 0.07832322898575057, 'prior_mu': -0.03870398299624794, 'prior_sigma': 0.0735562807292851, 'normalization': 'layer'}. Best is trial 896 with value: 0.4533553242683411.
Generating morgan fingerprints...
Generated fingerprints with 1024 features for 841 molecules
Trial 1495: 5-fold CV loss = 0.5371
[I 2025-08-07 21:59:18,574] Trial 1495 finished with value: 0.5370975136756897 and parameters: {'fp_type': 'morgan', 'morgan_only_radius': 2, 'morgan_only_nBits': 1024, 'num_hidden_layers': 3, 'hidden_dim_0': 1024, 'hidden_dim_1': 128, 'hidden_dim_2': 64, 'kl_weight': 0.0005213978656680266, 'lr': 0.006038569314966591, 'batch_size': 128, 'dropout_rate': 0.09742360225542906, 'prior_mu': -0.03672352087419798, 'prior_sigma': 0.0732287519494943, 'normalization': 'layer'}. Best is trial 896 with value: 0.4533553242683411.
Generating morgan_rdkit fingerprints...
Generated fingerprints with 2048 features for 841 molecules
Trial 1496: 5-fold CV loss = 0.5322
[I 2025-08-07 21:59:23,463] Trial 1496 finished with value: 0.532168573141098 and parameters: {'fp_type': 'morgan', 'morgan_only_radius': 2, 'morgan_only_nBits': 1024, 'num_hidden_layers': 3, 'hidden_dim_0': 256, 'hidden_dim_1': 128, 'hidden_dim_2': 64, 'kl_weight': 0.0005487979013644363, 'lr': 0.0056485810818611565, 'batch_size': 128, 'dropout_rate': 0.07832079106546624, 'prior_mu': -0.03510152914351412, 'prior_sigma': 0.07686823377270402, 'normalization': 'layer'}. Best is trial 896 with value: 0.4533553242683411.
Generating morgan_rdkit fingerprints...
Generated fingerprints with 2048 features for 841 molecules
Trial 1492: 5-fold CV loss = 0.4649
[I 2025-08-07 21:59:31,479] Trial 1492 finished with value: 0.4648752748966217 and parameters: {'fp_type': 'morgan_rdkit', 'combined_morgan_radius': 3, 'combined_morgan_nBits': 1024, 'combined_rdkit_maxPath': 7, 'combined_rdkit_nBits': 1024, 'num_hidden_layers': 3, 'hidden_dim_0': 256, 'hidden_dim_1': 1024, 'hidden_dim_2': 64, 'kl_weight': 0.0008794057199386867, 'lr': 0.006133075354548493, 'batch_size': 128, 'dropout_rate': 0.07491347261540506, 'prior_mu': -0.038026633054820624, 'prior_sigma': 0.07279635967907885, 'normalization': 'layer'}. Best is trial 896 with value: 0.4533553242683411.
Generating morgan_rdkit fingerprints...
Generated fingerprints with 2048 features for 841 molecules
Trial 1497: 5-fold CV loss = 0.5343
[I 2025-08-07 21:59:37,694] Trial 1497 finished with value: 0.534329491853714 and parameters: {'fp_type': 'morgan', 'morgan_only_radius': 2, 'morgan_only_nBits': 1024, 'num_hidden_layers': 3, 'hidden_dim_0': 128, 'hidden_dim_1': 128, 'hidden_dim_2': 64, 'kl_weight': 0.00035704201926944353, 'lr': 0.005614612038354532, 'batch_size': 128, 'dropout_rate': 0.08072205252480166, 'prior_mu': -0.030707958450787574, 'prior_sigma': 0.06861495082992604, 'normalization': 'layer'}. Best is trial 896 with value: 0.4533553242683411.
Generating morgan_rdkit fingerprints...
Generated fingerprints with 2048 features for 841 molecules
Trial 1499: 5-fold CV loss = 0.4762
[I 2025-08-07 21:59:53,148] Trial 1499 finished with value: 0.476167893409729 and parameters: {'fp_type': 'morgan_rdkit', 'combined_morgan_radius': 3, 'combined_morgan_nBits': 1024, 'combined_rdkit_maxPath': 7, 'combined_rdkit_nBits': 1024, 'num_hidden_layers': 3, 'hidden_dim_0': 128, 'hidden_dim_1': 1024, 'hidden_dim_2': 64, 'kl_weight': 0.0003564373339508088, 'lr': 0.005349604063156067, 'batch_size': 128, 'dropout_rate': 0.08673883770254737, 'prior_mu': -0.025012433567746923, 'prior_sigma': 0.06817895201509276, 'normalization': 'layer'}. Best is trial 896 with value: 0.4533553242683411.
Generating morgan_rdkit fingerprints...
Generated fingerprints with 2048 features for 841 molecules
Trial 1502: 5-fold CV loss = 1.0068
[I 2025-08-07 22:00:02,763] Trial 1502 finished with value: 1.0067525386810303 and parameters: {'fp_type': 'morgan_rdkit', 'combined_morgan_radius': 3, 'combined_morgan_nBits': 1024, 'combined_rdkit_maxPath': 7, 'combined_rdkit_nBits': 1024, 'num_hidden_layers': 0, 'kl_weight': 0.0005069414260692799, 'lr': 0.006675047982599778, 'batch_size': 128, 'dropout_rate': 0.0920599863873844, 'prior_mu': -0.05620228618611212, 'prior_sigma': 0.07682759772888804, 'normalization': 'layer'}. Best is trial 896 with value: 0.4533553242683411.
Generating morgan_rdkit fingerprints...
Generated fingerprints with 2048 features for 841 molecules
Trial 1498: 5-fold CV loss = 0.4634
[I 2025-08-07 22:00:18,284] Trial 1498 finished with value: 0.46340708136558534 and parameters: {'fp_type': 'morgan_rdkit', 'combined_morgan_radius': 3, 'combined_morgan_nBits': 1024, 'combined_rdkit_maxPath': 7, 'combined_rdkit_nBits': 1024, 'num_hidden_layers': 3, 'hidden_dim_0': 128, 'hidden_dim_1': 1024, 'hidden_dim_2': 64, 'kl_weight': 0.0005690265073924354, 'lr': 0.005390008449827944, 'batch_size': 128, 'dropout_rate': 0.08218870037096937, 'prior_mu': -0.02698834832980351, 'prior_sigma': 0.06802334493584464, 'normalization': 'layer'}. Best is trial 896 with value: 0.4533553242683411.
Generating morgan_rdkit fingerprints...
Generated fingerprints with 1536 features for 841 molecules
Trial 1501: 5-fold CV loss = 0.4755
[I 2025-08-07 22:00:20,132] Trial 1501 finished with value: 0.4754911303520203 and parameters: {'fp_type': 'morgan_rdkit', 'combined_morgan_radius': 3, 'combined_morgan_nBits': 1024, 'combined_rdkit_maxPath': 7, 'combined_rdkit_nBits': 1024, 'num_hidden_layers': 3, 'hidden_dim_0': 256, 'hidden_dim_1': 1024, 'hidden_dim_2': 64, 'kl_weight': 0.0005896291623167874, 'lr': 0.0053122975585280785, 'batch_size': 128, 'dropout_rate': 0.08647549725159302, 'prior_mu': -0.02551976265955849, 'prior_sigma': 0.07817008231248938, 'normalization': 'layer'}. Best is trial 896 with value: 0.4533553242683411.
Generating morgan_rdkit fingerprints...
Generated fingerprints with 1536 features for 841 molecules
Trial 1503: 5-fold CV loss = 0.4630
[I 2025-08-07 22:00:35,226] Trial 1503 finished with value: 0.4629707336425781 and parameters: {'fp_type': 'morgan_rdkit', 'combined_morgan_radius': 3, 'combined_morgan_nBits': 1024, 'combined_rdkit_maxPath': 7, 'combined_rdkit_nBits': 1024, 'num_hidden_layers': 3, 'hidden_dim_0': 256, 'hidden_dim_1': 1024, 'hidden_dim_2': 64, 'kl_weight': 0.00040110289569333967, 'lr': 0.005202965196864308, 'batch_size': 128, 'dropout_rate': 0.06663296643020344, 'prior_mu': -0.0269808619628278, 'prior_sigma': 0.06386403178437389, 'normalization': 'layer'}. Best is trial 896 with value: 0.4533553242683411.
Generating morgan_rdkit fingerprints...
Generated fingerprints with 2048 features for 841 molecules
Trial 1505: 5-fold CV loss = 0.7247
[I 2025-08-07 22:00:50,883] Trial 1505 finished with value: 0.7246504724025726 and parameters: {'fp_type': 'morgan_rdkit', 'combined_morgan_radius': 3, 'combined_morgan_nBits': 1024, 'combined_rdkit_maxPath': 7, 'combined_rdkit_nBits': 512, 'num_hidden_layers': 3, 'hidden_dim_0': 256, 'hidden_dim_1': 1024, 'hidden_dim_2': 1024, 'kl_weight': 0.0003745676370535117, 'lr': 0.004603437989913762, 'batch_size': 128, 'dropout_rate': 0.0992098258984372, 'prior_mu': -0.04888063904303798, 'prior_sigma': 0.0640384778571471, 'normalization': 'layer'}. Best is trial 896 with value: 0.4533553242683411.
Generating morgan_rdkit fingerprints...
Generated fingerprints with 2048 features for 841 molecules
Trial 1506: 5-fold CV loss = 0.8914
[I 2025-08-07 22:00:55,376] Trial 1506 finished with value: 0.891362988948822 and parameters: {'fp_type': 'morgan_rdkit', 'combined_morgan_radius': 3, 'combined_morgan_nBits': 1024, 'combined_rdkit_maxPath': 7, 'combined_rdkit_nBits': 1024, 'num_hidden_layers': 3, 'hidden_dim_0': 256, 'hidden_dim_1': 1024, 'hidden_dim_2': 1024, 'kl_weight': 0.0004727541560596171, 'lr': 0.004543525675315354, 'batch_size': 128, 'dropout_rate': 0.0977391214348402, 'prior_mu': -0.044313684103416635, 'prior_sigma': 0.09309820731844827, 'normalization': 'layer'}. Best is trial 896 with value: 0.4533553242683411.
Generating morgan_rdkit fingerprints...
Generated fingerprints with 2048 features for 841 molecules
Trial 1500: 5-fold CV loss = 0.4601
[I 2025-08-07 22:01:08,792] Trial 1500 finished with value: 0.46008166670799255 and parameters: {'fp_type': 'morgan_rdkit', 'combined_morgan_radius': 3, 'combined_morgan_nBits': 1024, 'combined_rdkit_maxPath': 7, 'combined_rdkit_nBits': 1024, 'num_hidden_layers': 3, 'hidden_dim_0': 128, 'hidden_dim_1': 1024, 'hidden_dim_2': 64, 'kl_weight': 0.00035646857860382206, 'lr': 0.005307043969498841, 'batch_size': 128, 'dropout_rate': 0.08463935217055793, 'prior_mu': -0.028074458011306577, 'prior_sigma': 0.07847326093729515, 'normalization': 'layer'}. Best is trial 896 with value: 0.4533553242683411.
Generating morgan_rdkit fingerprints...
Generated fingerprints with 2048 features for 841 molecules
Trial 1504: 5-fold CV loss = 0.4839
[I 2025-08-07 22:01:19,566] Trial 1504 finished with value: 0.48386157155036924 and parameters: {'fp_type': 'morgan_rdkit', 'combined_morgan_radius': 3, 'combined_morgan_nBits': 1024, 'combined_rdkit_maxPath': 7, 'combined_rdkit_nBits': 512, 'num_hidden_layers': 3, 'hidden_dim_0': 256, 'hidden_dim_1': 1024, 'hidden_dim_2': 64, 'kl_weight': 0.0003554507464309424, 'lr': 0.006644649301087417, 'batch_size': 128, 'dropout_rate': 0.09969608976805966, 'prior_mu': -0.046780828550566866, 'prior_sigma': 0.09344891085207267, 'normalization': 'layer'}. Best is trial 896 with value: 0.4533553242683411.
Generating morgan_rdkit fingerprints...
Generated fingerprints with 2048 features for 841 molecules
Trial 1508: 5-fold CV loss = 0.4667
[I 2025-08-07 22:01:28,530] Trial 1508 finished with value: 0.46665229797363283 and parameters: {'fp_type': 'morgan_rdkit', 'combined_morgan_radius': 3, 'combined_morgan_nBits': 1024, 'combined_rdkit_maxPath': 7, 'combined_rdkit_nBits': 1024, 'num_hidden_layers': 3, 'hidden_dim_0': 256, 'hidden_dim_1': 1024, 'hidden_dim_2': 64, 'kl_weight': 0.00033241417683039614, 'lr': 0.006771755336293633, 'batch_size': 128, 'dropout_rate': 0.10029014906236192, 'prior_mu': -0.019816460442348124, 'prior_sigma': 0.07804501107908152, 'normalization': 'layer'}. Best is trial 896 with value: 0.4533553242683411.
Generating morgan_rdkit fingerprints...
Generated fingerprints with 2048 features for 841 molecules
Trial 1507: 5-fold CV loss = 0.4604
[I 2025-08-07 22:01:35,547] Trial 1507 finished with value: 0.46042601466178895 and parameters: {'fp_type': 'morgan_rdkit', 'combined_morgan_radius': 3, 'combined_morgan_nBits': 1024, 'combined_rdkit_maxPath': 7, 'combined_rdkit_nBits': 1024, 'num_hidden_layers': 3, 'hidden_dim_0': 256, 'hidden_dim_1': 1024, 'hidden_dim_2': 64, 'kl_weight': 0.00046072420103573865, 'lr': 0.006369382127068848, 'batch_size': 128, 'dropout_rate': 0.0962238619079786, 'prior_mu': -0.04609129902978539, 'prior_sigma': 0.09287325685350001, 'normalization': 'layer'}. Best is trial 896 with value: 0.4533553242683411.
Generating morgan_rdkit fingerprints...
Generated fingerprints with 2048 features for 841 molecules
Trial 1510: 5-fold CV loss = 0.8757
[I 2025-08-07 22:01:58,961] Trial 1510 finished with value: 0.8757022738456726 and parameters: {'fp_type': 'morgan_rdkit', 'combined_morgan_radius': 3, 'combined_morgan_nBits': 1024, 'combined_rdkit_maxPath': 7, 'combined_rdkit_nBits': 1024, 'num_hidden_layers': 3, 'hidden_dim_0': 256, 'hidden_dim_1': 1024, 'hidden_dim_2': 64, 'kl_weight': 0.0004142824718563345, 'lr': 0.0005278618034447542, 'batch_size': 64, 'dropout_rate': 0.06771767337829075, 'prior_mu': -0.022577288237672678, 'prior_sigma': 0.0757105876069768, 'normalization': 'layer'}. Best is trial 896 with value: 0.4533553242683411.
Generating morgan_rdkit fingerprints...
Generated fingerprints with 2048 features for 841 molecules
Trial 1511: 5-fold CV loss = 0.4764
[I 2025-08-07 22:02:09,668] Trial 1511 finished with value: 0.4764467358589172 and parameters: {'fp_type': 'morgan_rdkit', 'combined_morgan_radius': 3, 'combined_morgan_nBits': 1024, 'combined_rdkit_maxPath': 7, 'combined_rdkit_nBits': 1024, 'num_hidden_layers': 3, 'hidden_dim_0': 256, 'hidden_dim_1': 64, 'hidden_dim_2': 64, 'kl_weight': 0.00445553399251507, 'lr': 0.006103042899032223, 'batch_size': 64, 'dropout_rate': 0.10711964809102725, 'prior_mu': -0.021377143302610792, 'prior_sigma': 0.05807827462422581, 'normalization': 'layer'}. Best is trial 896 with value: 0.4533553242683411.
Generating morgan_rdkit fingerprints...
Generated fingerprints with 2048 features for 841 molecules
Trial 1512: 5-fold CV loss = 0.4640
[I 2025-08-07 22:02:22,434] Trial 1512 finished with value: 0.4639667570590973 and parameters: {'fp_type': 'morgan_rdkit', 'combined_morgan_radius': 3, 'combined_morgan_nBits': 1024, 'combined_rdkit_maxPath': 7, 'combined_rdkit_nBits': 1024, 'num_hidden_layers': 3, 'hidden_dim_0': 256, 'hidden_dim_1': 1024, 'hidden_dim_2': 64, 'kl_weight': 0.0003321382041202948, 'lr': 0.005910796120243596, 'batch_size': 64, 'dropout_rate': 0.0568266072802388, 'prior_mu': -0.02042245391590532, 'prior_sigma': 0.06889048179547622, 'normalization': 'layer'}. Best is trial 896 with value: 0.4533553242683411.
Generating morgan_rdkit fingerprints...
Generated fingerprints with 2048 features for 841 molecules
Trial 1514: 5-fold CV loss = 0.4642
[I 2025-08-07 22:02:43,371] Trial 1514 finished with value: 0.4642128348350525 and parameters: {'fp_type': 'morgan_rdkit', 'combined_morgan_radius': 3, 'combined_morgan_nBits': 1024, 'combined_rdkit_maxPath': 7, 'combined_rdkit_nBits': 1024, 'num_hidden_layers': 3, 'hidden_dim_0': 256, 'hidden_dim_1': 1024, 'hidden_dim_2': 64, 'kl_weight': 0.0003334335395690784, 'lr': 0.0058330934109004605, 'batch_size': 128, 'dropout_rate': 0.10954820876017317, 'prior_mu': -0.034028641709094934, 'prior_sigma': 0.07016507989235, 'normalization': 'layer'}. Best is trial 896 with value: 0.4533553242683411.
Generating morgan_rdkit fingerprints...
Generated fingerprints with 2048 features for 841 molecules
Trial 1509: 5-fold CV loss = 0.4669
[I 2025-08-07 22:02:45,909] Trial 1509 finished with value: 0.4668953835964203 and parameters: {'fp_type': 'morgan_rdkit', 'combined_morgan_radius': 3, 'combined_morgan_nBits': 1024, 'combined_rdkit_maxPath': 7, 'combined_rdkit_nBits': 1024, 'num_hidden_layers': 3, 'hidden_dim_0': 256, 'hidden_dim_1': 1024, 'hidden_dim_2': 64, 'kl_weight': 0.0003352930579756411, 'lr': 0.0066916774170398185, 'batch_size': 128, 'dropout_rate': 0.10156803663786512, 'prior_mu': -0.019390106488057147, 'prior_sigma': 0.07560815028754135, 'normalization': 'layer'}. Best is trial 896 with value: 0.4533553242683411.
Generating morgan_rdkit fingerprints...
Generated fingerprints with 2048 features for 841 molecules
Trial 1515: 5-fold CV loss = 0.5466
[I 2025-08-07 22:02:54,813] Trial 1515 finished with value: 0.546562910079956 and parameters: {'fp_type': 'morgan_rdkit', 'combined_morgan_radius': 3, 'combined_morgan_nBits': 1024, 'combined_rdkit_maxPath': 7, 'combined_rdkit_nBits': 1024, 'num_hidden_layers': 3, 'hidden_dim_0': 256, 'hidden_dim_1': 1024, 'hidden_dim_2': 64, 'kl_weight': 0.00040581642009973774, 'lr': 0.006752955501061578, 'batch_size': 128, 'dropout_rate': 0.04466779564939549, 'prior_mu': -0.029998627001194766, 'prior_sigma': 0.08567553137029404, 'normalization': 'layer'}. Best is trial 896 with value: 0.4533553242683411.
Generating morgan_rdkit fingerprints...
Generated fingerprints with 2048 features for 841 molecules
Trial 1513: 5-fold CV loss = 0.5621
