[I 2025-08-07 22:43:44,641] Trial 1723 finished with value: 0.4668002903461456 and parameters: {'fp_type': 'morgan_rdkit', 'combined_morgan_radius': 3, 'combined_morgan_nBits': 1024, 'combined_rdkit_maxPath': 7, 'combined_rdkit_nBits': 1024, 'num_hidden_layers': 3, 'hidden_dim_0': 256, 'hidden_dim_1': 1024, 'hidden_dim_2': 64, 'kl_weight': 0.000699239300561005, 'lr': 0.007979520048818346, 'batch_size': 128, 'dropout_rate': 0.04556091374785519, 'prior_mu': -0.033136681968941595, 'prior_sigma': 0.08192992194624832, 'normalization': 'layer'}. Best is trial 896 with value: 0.4533553242683411.
Generating morgan_rdkit fingerprints...
Generated fingerprints with 2048 features for 841 molecules
Trial 1727: 5-fold CV loss = 0.4661
[I 2025-08-07 22:44:03,314] Trial 1727 finished with value: 0.4660583078861237 and parameters: {'fp_type': 'morgan_rdkit', 'combined_morgan_radius': 3, 'combined_morgan_nBits': 1024, 'combined_rdkit_maxPath': 7, 'combined_rdkit_nBits': 1024, 'num_hidden_layers': 3, 'hidden_dim_0': 256, 'hidden_dim_1': 1024, 'hidden_dim_2': 64, 'kl_weight': 0.0004418165551007878, 'lr': 0.008458364158195453, 'batch_size': 128, 'dropout_rate': 0.06276104349423813, 'prior_mu': -0.034158526552527546, 'prior_sigma': 0.0861108441847112, 'normalization': 'layer'}. Best is trial 896 with value: 0.4533553242683411.
Generating morgan_rdkit fingerprints...
Generated fingerprints with 2048 features for 841 molecules
Trial 1728: 5-fold CV loss = 0.4628
[I 2025-08-07 22:44:13,705] Trial 1728 finished with value: 0.4627805590629578 and parameters: {'fp_type': 'morgan_rdkit', 'combined_morgan_radius': 3, 'combined_morgan_nBits': 1024, 'combined_rdkit_maxPath': 7, 'combined_rdkit_nBits': 1024, 'num_hidden_layers': 3, 'hidden_dim_0': 256, 'hidden_dim_1': 1024, 'hidden_dim_2': 64, 'kl_weight': 0.00030033056339325264, 'lr': 0.006978494196680639, 'batch_size': 128, 'dropout_rate': 0.08003130367038533, 'prior_mu': -0.030248860858038223, 'prior_sigma': 0.0801213660531522, 'normalization': 'layer'}. Best is trial 896 with value: 0.4533553242683411.
Generating morgan_rdkit fingerprints...
Generated fingerprints with 2048 features for 841 molecules
Trial 1726: 5-fold CV loss = 0.4697
[I 2025-08-07 22:44:23,853] Trial 1726 finished with value: 0.4696842670440674 and parameters: {'fp_type': 'morgan_rdkit', 'combined_morgan_radius': 3, 'combined_morgan_nBits': 1024, 'combined_rdkit_maxPath': 7, 'combined_rdkit_nBits': 1024, 'num_hidden_layers': 3, 'hidden_dim_0': 256, 'hidden_dim_1': 1024, 'hidden_dim_2': 64, 'kl_weight': 0.0004883531968759943, 'lr': 0.008310993251853381, 'batch_size': 128, 'dropout_rate': 0.043178056773701276, 'prior_mu': -0.03474049434937465, 'prior_sigma': 0.08980888644781435, 'normalization': 'layer'}. Best is trial 896 with value: 0.4533553242683411.
Generating morgan_rdkit fingerprints...
Generated fingerprints with 2048 features for 841 molecules
Trial 1730: 5-fold CV loss = 0.8103
[I 2025-08-07 22:44:25,479] Trial 1730 finished with value: 0.810252022743225 and parameters: {'fp_type': 'morgan_rdkit', 'combined_morgan_radius': 3, 'combined_morgan_nBits': 1024, 'combined_rdkit_maxPath': 7, 'combined_rdkit_nBits': 1024, 'num_hidden_layers': 3, 'hidden_dim_0': 256, 'hidden_dim_1': 1024, 'hidden_dim_2': 512, 'kl_weight': 0.0003050524325339126, 'lr': 0.006737674061359926, 'batch_size': 128, 'dropout_rate': 0.07573171853311761, 'prior_mu': -0.01960264964036793, 'prior_sigma': 0.08903860005593074, 'normalization': 'layer'}. Best is trial 896 with value: 0.4533553242683411.
Generating morgan fingerprints...
Generated fingerprints with 2048 features for 841 molecules
Trial 1729: 5-fold CV loss = 0.4748
[I 2025-08-07 22:44:37,553] Trial 1729 finished with value: 0.4747971832752228 and parameters: {'fp_type': 'morgan_rdkit', 'combined_morgan_radius': 3, 'combined_morgan_nBits': 1024, 'combined_rdkit_maxPath': 7, 'combined_rdkit_nBits': 1024, 'num_hidden_layers': 3, 'hidden_dim_0': 256, 'hidden_dim_1': 1024, 'hidden_dim_2': 64, 'kl_weight': 0.00031524391303743325, 'lr': 0.00670626653262021, 'batch_size': 128, 'dropout_rate': 0.07947326717276974, 'prior_mu': -0.01774395821177629, 'prior_sigma': 0.08067419932604233, 'normalization': 'layer'}. Best is trial 896 with value: 0.4533553242683411.
Generating morgan fingerprints...
Generated fingerprints with 2048 features for 841 molecules
Trial 1733: 5-fold CV loss = 0.5254
[I 2025-08-07 22:44:41,689] Trial 1733 finished with value: 0.525383859872818 and parameters: {'fp_type': 'morgan', 'morgan_only_radius': 3, 'morgan_only_nBits': 2048, 'num_hidden_layers': 3, 'hidden_dim_0': 256, 'hidden_dim_1': 1024, 'hidden_dim_2': 64, 'kl_weight': 0.0004074224672330847, 'lr': 0.006604851202197548, 'batch_size': 128, 'dropout_rate': 0.08280082589139376, 'prior_mu': -0.01619006541179439, 'prior_sigma': 0.08007226987053984, 'normalization': 'layer'}. Best is trial 896 with value: 0.4533553242683411.
Generating morgan_rdkit fingerprints...
Generated fingerprints with 2048 features for 841 molecules
Trial 1731: 5-fold CV loss = 0.7556
[I 2025-08-07 22:44:44,617] Trial 1731 finished with value: 0.755554986000061 and parameters: {'fp_type': 'morgan_rdkit', 'combined_morgan_radius': 3, 'combined_morgan_nBits': 1024, 'combined_rdkit_maxPath': 7, 'combined_rdkit_nBits': 1024, 'num_hidden_layers': 3, 'hidden_dim_0': 256, 'hidden_dim_1': 1024, 'hidden_dim_2': 512, 'kl_weight': 0.00030741138943010183, 'lr': 0.006757735938032453, 'batch_size': 128, 'dropout_rate': 0.07598868834840788, 'prior_mu': -0.017211559857498136, 'prior_sigma': 0.08905829691806032, 'normalization': 'layer'}. Best is trial 896 with value: 0.4533553242683411.
Generating morgan_rdkit fingerprints...
Generated fingerprints with 2048 features for 841 molecules
Trial 1732: 5-fold CV loss = 0.8881
[I 2025-08-07 22:44:55,044] Trial 1732 finished with value: 0.8880571365356446 and parameters: {'fp_type': 'morgan_rdkit', 'combined_morgan_radius': 3, 'combined_morgan_nBits': 1024, 'combined_rdkit_maxPath': 7, 'combined_rdkit_nBits': 1024, 'num_hidden_layers': 3, 'hidden_dim_0': 256, 'hidden_dim_1': 1024, 'hidden_dim_2': 512, 'kl_weight': 0.00032247719906886355, 'lr': 0.006564538721451139, 'batch_size': 128, 'dropout_rate': 0.07378088986804375, 'prior_mu': -0.021808321442455873, 'prior_sigma': 0.08915546415473415, 'normalization': 'layer'}. Best is trial 896 with value: 0.4533553242683411.
Generating morgan_rdkit fingerprints...
Generated fingerprints with 2048 features for 841 molecules
Trial 1734: 5-fold CV loss = 0.5303
[I 2025-08-07 22:45:06,736] Trial 1734 finished with value: 0.5303135395050049 and parameters: {'fp_type': 'morgan', 'morgan_only_radius': 3, 'morgan_only_nBits': 2048, 'num_hidden_layers': 3, 'hidden_dim_0': 256, 'hidden_dim_1': 1024, 'hidden_dim_2': 64, 'kl_weight': 0.0004180451344120172, 'lr': 0.007661121737111461, 'batch_size': 128, 'dropout_rate': 0.07613658208342682, 'prior_mu': -0.05027449254187419, 'prior_sigma': 0.08726984174432462, 'normalization': 'layer'}. Best is trial 896 with value: 0.4533553242683411.
Generating morgan_rdkit fingerprints...
Generated fingerprints with 2048 features for 841 molecules
Trial 1735: 5-fold CV loss = 0.5522
[I 2025-08-07 22:45:15,693] Trial 1735 finished with value: 0.5521571099758148 and parameters: {'fp_type': 'morgan_rdkit', 'combined_morgan_radius': 3, 'combined_morgan_nBits': 1024, 'combined_rdkit_maxPath': 7, 'combined_rdkit_nBits': 1024, 'num_hidden_layers': 3, 'hidden_dim_0': 256, 'hidden_dim_1': 1024, 'hidden_dim_2': 64, 'kl_weight': 0.0004338911850724952, 'lr': 0.00728780304861319, 'batch_size': 128, 'dropout_rate': 0.06655722456950726, 'prior_mu': -0.05105157282363372, 'prior_sigma': 0.08727180234367123, 'normalization': 'layer'}. Best is trial 896 with value: 0.4533553242683411.
Generating morgan_rdkit fingerprints...
Generated fingerprints with 2048 features for 841 molecules
Trial 1736: 5-fold CV loss = 0.4633
[I 2025-08-07 22:45:24,862] Trial 1736 finished with value: 0.463333398103714 and parameters: {'fp_type': 'morgan_rdkit', 'combined_morgan_radius': 3, 'combined_morgan_nBits': 1024, 'combined_rdkit_maxPath': 7, 'combined_rdkit_nBits': 1024, 'num_hidden_layers': 3, 'hidden_dim_0': 256, 'hidden_dim_1': 1024, 'hidden_dim_2': 64, 'kl_weight': 0.00042956583002672267, 'lr': 0.007642883684689978, 'batch_size': 128, 'dropout_rate': 0.0596596137050841, 'prior_mu': -0.0507422021786116, 'prior_sigma': 0.07795640083293584, 'normalization': 'layer'}. Best is trial 896 with value: 0.4533553242683411.
Generating morgan_rdkit fingerprints...
Generated fingerprints with 2048 features for 841 molecules
Trial 1739: 5-fold CV loss = 0.4658
[I 2025-08-07 22:45:50,034] Trial 1739 finished with value: 0.4657871901988983 and parameters: {'fp_type': 'morgan_rdkit', 'combined_morgan_radius': 3, 'combined_morgan_nBits': 1024, 'combined_rdkit_maxPath': 7, 'combined_rdkit_nBits': 1024, 'num_hidden_layers': 3, 'hidden_dim_0': 128, 'hidden_dim_1': 1024, 'hidden_dim_2': 64, 'kl_weight': 0.00036326002802080585, 'lr': 0.009123001406674203, 'batch_size': 128, 'dropout_rate': 0.08567353720203845, 'prior_mu': -0.04327883031824101, 'prior_sigma': 0.07750518351019513, 'normalization': 'layer'}. Best is trial 896 with value: 0.4533553242683411.
Generating rdkit fingerprints...
Generated fingerprints with 1024 features for 841 molecules
Trial 1738: 5-fold CV loss = 0.4689
[I 2025-08-07 22:45:59,895] Trial 1738 finished with value: 0.4688557744026184 and parameters: {'fp_type': 'morgan_rdkit', 'combined_morgan_radius': 3, 'combined_morgan_nBits': 1024, 'combined_rdkit_maxPath': 7, 'combined_rdkit_nBits': 1024, 'num_hidden_layers': 3, 'hidden_dim_0': 128, 'hidden_dim_1': 1024, 'hidden_dim_2': 64, 'kl_weight': 0.00035618083627715825, 'lr': 0.007465493510349767, 'batch_size': 128, 'dropout_rate': 0.058944507368578015, 'prior_mu': -0.040620460694852825, 'prior_sigma': 0.07666691981372613, 'normalization': 'layer'}. Best is trial 896 with value: 0.4533553242683411.
Generating morgan_rdkit fingerprints...
Generated fingerprints with 2048 features for 841 molecules
Trial 1740: 5-fold CV loss = 0.4569
[I 2025-08-07 22:46:03,486] Trial 1740 finished with value: 0.45692241191864014 and parameters: {'fp_type': 'morgan_rdkit', 'combined_morgan_radius': 3, 'combined_morgan_nBits': 1024, 'combined_rdkit_maxPath': 7, 'combined_rdkit_nBits': 1024, 'num_hidden_layers': 3, 'hidden_dim_0': 256, 'hidden_dim_1': 1024, 'hidden_dim_2': 64, 'kl_weight': 0.00035223185942388893, 'lr': 0.00998499501015549, 'batch_size': 128, 'dropout_rate': 0.08585754710106278, 'prior_mu': -0.04198765049638215, 'prior_sigma': 0.07800421640668552, 'normalization': 'layer'}. Best is trial 896 with value: 0.4533553242683411.
Generating rdkit fingerprints...
Generated fingerprints with 1024 features for 841 molecules
Trial 1737: 5-fold CV loss = 0.5713
[I 2025-08-07 22:46:08,203] Trial 1737 finished with value: 0.5712886989116669 and parameters: {'fp_type': 'morgan_rdkit', 'combined_morgan_radius': 3, 'combined_morgan_nBits': 1024, 'combined_rdkit_maxPath': 7, 'combined_rdkit_nBits': 1024, 'num_hidden_layers': 3, 'hidden_dim_0': 128, 'hidden_dim_1': 1024, 'hidden_dim_2': 64, 'kl_weight': 0.00043726157611176624, 'lr': 0.007585269040000023, 'batch_size': 128, 'dropout_rate': 0.08401292649024776, 'prior_mu': -0.05105966211830719, 'prior_sigma': 0.0764651607428935, 'normalization': 'layer'}. Best is trial 896 with value: 0.4533553242683411.
Generating rdkit fingerprints...
Generated fingerprints with 1024 features for 841 molecules
Trial 1741: 5-fold CV loss = 0.8314
[I 2025-08-07 22:46:15,347] Trial 1741 finished with value: 0.8313788771629333 and parameters: {'fp_type': 'rdkit', 'rdkit_only_maxPath': 6, 'rdkit_only_nBits': 1024, 'num_hidden_layers': 3, 'hidden_dim_0': 256, 'hidden_dim_1': 128, 'hidden_dim_2': 128, 'kl_weight': 0.0003577303495470718, 'lr': 0.006111174411165835, 'batch_size': 128, 'dropout_rate': 0.0912458000396644, 'prior_mu': -0.027068159618162557, 'prior_sigma': 0.16977954979828452, 'normalization': 'layer'}. Best is trial 896 with value: 0.4533553242683411.
Generating morgan_rdkit fingerprints...
Generated fingerprints with 2048 features for 841 molecules
Trial 1745: 5-fold CV loss = 1.0697
[I 2025-08-07 22:46:22,154] Trial 1745 finished with value: 1.069711446762085 and parameters: {'fp_type': 'morgan_rdkit', 'combined_morgan_radius': 3, 'combined_morgan_nBits': 1024, 'combined_rdkit_maxPath': 7, 'combined_rdkit_nBits': 1024, 'num_hidden_layers': 0, 'kl_weight': 0.0002959396463699157, 'lr': 0.008944355442589615, 'batch_size': 128, 'dropout_rate': 0.0708482369646392, 'prior_mu': -0.042571273760438455, 'prior_sigma': 0.08341439199296631, 'normalization': 'layer'}. Best is trial 896 with value: 0.4533553242683411.
Generating morgan_rdkit fingerprints...
Generated fingerprints with 2048 features for 841 molecules
Trial 1746: 5-fold CV loss = 0.8901
[I 2025-08-07 22:46:37,803] Trial 1746 finished with value: 0.8901182413101196 and parameters: {'fp_type': 'morgan_rdkit', 'combined_morgan_radius': 3, 'combined_morgan_nBits': 1024, 'combined_rdkit_maxPath': 7, 'combined_rdkit_nBits': 1024, 'num_hidden_layers': 3, 'hidden_dim_0': 256, 'hidden_dim_1': 1024, 'hidden_dim_2': 1024, 'kl_weight': 0.00028634864984744524, 'lr': 0.009431868603023356, 'batch_size': 128, 'dropout_rate': 0.08371234135293483, 'prior_mu': -0.044784988649194044, 'prior_sigma': 0.08047786547956079, 'normalization': 'layer'}. Best is trial 896 with value: 0.4533553242683411.
Generating morgan_rdkit fingerprints...
Generated fingerprints with 2048 features for 841 molecules
Trial 1743: 5-fold CV loss = 0.4740
[I 2025-08-07 22:46:50,348] Trial 1743 finished with value: 0.47399288415908813 and parameters: {'fp_type': 'rdkit', 'rdkit_only_maxPath': 6, 'rdkit_only_nBits': 1024, 'num_hidden_layers': 3, 'hidden_dim_0': 256, 'hidden_dim_1': 1024, 'hidden_dim_2': 128, 'kl_weight': 0.00029903840316786303, 'lr': 0.009870576326398805, 'batch_size': 128, 'dropout_rate': 0.0865423862411042, 'prior_mu': -0.054904619590198184, 'prior_sigma': 0.08052054679423806, 'normalization': 'layer'}. Best is trial 896 with value: 0.4533553242683411.
Generating morgan_rdkit fingerprints...
Generated fingerprints with 2048 features for 841 molecules
Trial 1742: 5-fold CV loss = 0.4742
[I 2025-08-07 22:46:58,244] Trial 1742 finished with value: 0.47416529059410095 and parameters: {'fp_type': 'morgan_rdkit', 'combined_morgan_radius': 3, 'combined_morgan_nBits': 1024, 'combined_rdkit_maxPath': 7, 'combined_rdkit_nBits': 1024, 'num_hidden_layers': 3, 'hidden_dim_0': 256, 'hidden_dim_1': 1024, 'hidden_dim_2': 128, 'kl_weight': 0.0005010785628514266, 'lr': 0.0062268476924277096, 'batch_size': 128, 'dropout_rate': 0.0869372010093105, 'prior_mu': -0.02279554312746212, 'prior_sigma': 0.08410827654249717, 'normalization': 'layer'}. Best is trial 896 with value: 0.4533553242683411.
Generating morgan_rdkit fingerprints...
Generated fingerprints with 2048 features for 841 molecules
Trial 1747: 5-fold CV loss = 0.4693
[I 2025-08-07 22:47:10,807] Trial 1747 finished with value: 0.46930487751960753 and parameters: {'fp_type': 'morgan_rdkit', 'combined_morgan_radius': 3, 'combined_morgan_nBits': 1024, 'combined_rdkit_maxPath': 7, 'combined_rdkit_nBits': 1024, 'num_hidden_layers': 3, 'hidden_dim_0': 256, 'hidden_dim_1': 1024, 'hidden_dim_2': 64, 'kl_weight': 0.0003015459992528557, 'lr': 0.009351938851636299, 'batch_size': 128, 'dropout_rate': 0.06245093314393999, 'prior_mu': -0.057477986079741375, 'prior_sigma': 0.07546759766943514, 'normalization': 'layer'}. Best is trial 896 with value: 0.4533553242683411.
Generating morgan_rdkit fingerprints...
Generated fingerprints with 2048 features for 841 molecules
Trial 1748: 5-fold CV loss = 0.4655
[I 2025-08-07 22:47:27,578] Trial 1748 finished with value: 0.4654814302921295 and parameters: {'fp_type': 'morgan_rdkit', 'combined_morgan_radius': 3, 'combined_morgan_nBits': 1024, 'combined_rdkit_maxPath': 7, 'combined_rdkit_nBits': 1024, 'num_hidden_layers': 3, 'hidden_dim_0': 256, 'hidden_dim_1': 1024, 'hidden_dim_2': 64, 'kl_weight': 0.00032822163161754474, 'lr': 0.00883179690138294, 'batch_size': 128, 'dropout_rate': 0.06889942975703539, 'prior_mu': -0.04240152036910885, 'prior_sigma': 0.0775226069767307, 'normalization': 'layer'}. Best is trial 896 with value: 0.4533553242683411.
Generating morgan_rdkit fingerprints...
Generated fingerprints with 2048 features for 841 molecules
Trial 1744: 5-fold CV loss = 0.7437
[I 2025-08-07 22:47:37,652] Trial 1744 finished with value: 0.7436667084693909 and parameters: {'fp_type': 'rdkit', 'rdkit_only_maxPath': 6, 'rdkit_only_nBits': 1024, 'num_hidden_layers': 3, 'hidden_dim_0': 256, 'hidden_dim_1': 128, 'hidden_dim_2': 1024, 'kl_weight': 0.0002853502724403379, 'lr': 0.009523863399338157, 'batch_size': 128, 'dropout_rate': 0.08795379400104059, 'prior_mu': -0.04708261718296436, 'prior_sigma': 0.08027917732466254, 'normalization': 'layer'}. Best is trial 896 with value: 0.4533553242683411.
Generating morgan_rdkit fingerprints...
Generated fingerprints with 2048 features for 841 molecules
Trial 1750: 5-fold CV loss = 0.5475
[I 2025-08-07 22:47:44,203] Trial 1750 finished with value: 0.5475343406200409 and parameters: {'fp_type': 'morgan_rdkit', 'combined_morgan_radius': 3, 'combined_morgan_nBits': 1024, 'combined_rdkit_maxPath': 7, 'combined_rdkit_nBits': 1024, 'num_hidden_layers': 3, 'hidden_dim_0': 256, 'hidden_dim_1': 1024, 'hidden_dim_2': 64, 'kl_weight': 0.00034265990753124117, 'lr': 0.009547660769979427, 'batch_size': 128, 'dropout_rate': 0.19110362338380335, 'prior_mu': -0.04272580573481457, 'prior_sigma': 0.0770430554065451, 'normalization': 'layer'}. Best is trial 896 with value: 0.4533553242683411.
Generating morgan_rdkit fingerprints...
Generated fingerprints with 2048 features for 841 molecules
Trial 1749: 5-fold CV loss = 0.5004
[I 2025-08-07 22:47:59,108] Trial 1749 finished with value: 0.5004373550415039 and parameters: {'fp_type': 'morgan_rdkit', 'combined_morgan_radius': 3, 'combined_morgan_nBits': 1024, 'combined_rdkit_maxPath': 7, 'combined_rdkit_nBits': 1024, 'num_hidden_layers': 3, 'hidden_dim_0': 256, 'hidden_dim_1': 1024, 'hidden_dim_2': 64, 'kl_weight': 0.04031329100436657, 'lr': 0.009755867782152362, 'batch_size': 128, 'dropout_rate': 0.3237671878963442, 'prior_mu': -0.039806525053693524, 'prior_sigma': 0.07651228804574704, 'normalization': 'layer'}. Best is trial 896 with value: 0.4533553242683411.
Generating morgan_rdkit fingerprints...
Generated fingerprints with 2048 features for 841 molecules
Trial 1751: 5-fold CV loss = 0.4630
[I 2025-08-07 22:48:08,725] Trial 1751 finished with value: 0.462967187166214 and parameters: {'fp_type': 'morgan_rdkit', 'combined_morgan_radius': 3, 'combined_morgan_nBits': 1024, 'combined_rdkit_maxPath': 7, 'combined_rdkit_nBits': 1024, 'num_hidden_layers': 3, 'hidden_dim_0': 256, 'hidden_dim_1': 1024, 'hidden_dim_2': 64, 'kl_weight': 0.00034051238740257823, 'lr': 0.009363605151538727, 'batch_size': 128, 'dropout_rate': 0.17742269869377572, 'prior_mu': -0.03777393365545083, 'prior_sigma': 0.07614604505705902, 'normalization': 'layer'}. Best is trial 896 with value: 0.4533553242683411.
Generating morgan_rdkit fingerprints...
Generated fingerprints with 2048 features for 841 molecules
Trial 1753: 5-fold CV loss = 0.4606
[I 2025-08-07 22:48:21,854] Trial 1753 finished with value: 0.4605858623981476 and parameters: {'fp_type': 'morgan_rdkit', 'combined_morgan_radius': 3, 'combined_morgan_nBits': 1024, 'combined_rdkit_maxPath': 7, 'combined_rdkit_nBits': 1024, 'num_hidden_layers': 3, 'hidden_dim_0': 256, 'hidden_dim_1': 1024, 'hidden_dim_2': 64, 'kl_weight': 0.00025052872087288496, 'lr': 0.00871312264747456, 'batch_size': 128, 'dropout_rate': 0.17773815840578544, 'prior_mu': -0.0376626244930609, 'prior_sigma': 0.0846561500555433, 'normalization': 'layer'}. Best is trial 896 with value: 0.4533553242683411.
Generating morgan_rdkit fingerprints...
Generated fingerprints with 2048 features for 841 molecules
Trial 1755: 5-fold CV loss = 0.5667
[I 2025-08-07 22:48:45,677] Trial 1755 finished with value: 0.5667162716388703 and parameters: {'fp_type': 'morgan_rdkit', 'combined_morgan_radius': 3, 'combined_morgan_nBits': 1024, 'combined_rdkit_maxPath': 7, 'combined_rdkit_nBits': 1024, 'num_hidden_layers': 1, 'hidden_dim_0': 512, 'kl_weight': 0.08776400979256634, 'lr': 0.009856914180974178, 'batch_size': 128, 'dropout_rate': 0.075996910775945, 'prior_mu': -0.033533437549670204, 'prior_sigma': 0.08482535236045533, 'normalization': 'layer'}. Best is trial 896 with value: 0.4533553242683411.
Generating morgan_rdkit fingerprints...
Generated fingerprints with 2048 features for 841 molecules
Trial 1756: 5-fold CV loss = 0.4861
[I 2025-08-07 22:48:47,791] Trial 1756 finished with value: 0.48608310222625734 and parameters: {'fp_type': 'morgan_rdkit', 'combined_morgan_radius': 3, 'combined_morgan_nBits': 1024, 'combined_rdkit_maxPath': 5, 'combined_rdkit_nBits': 1024, 'num_hidden_layers': 3, 'hidden_dim_0': 512, 'hidden_dim_1': 1024, 'hidden_dim_2': 64, 'kl_weight': 0.00033214207259275907, 'lr': 0.009806433884774765, 'batch_size': 128, 'dropout_rate': 0.05117093763320912, 'prior_mu': -0.06648825076437882, 'prior_sigma': 0.0813938385986757, 'normalization': 'layer'}. Best is trial 896 with value: 0.4533553242683411.
Generating morgan_rdkit fingerprints...
Generated fingerprints with 2048 features for 841 molecules
Trial 1752: 5-fold CV loss = 0.4676
