[I 2025-08-07 17:51:03,980] Trial 343 finished with value: 0.48846455812454226 and parameters: {'fp_type': 'morgan_rdkit', 'combined_morgan_radius': 2, 'combined_morgan_nBits': 512, 'combined_rdkit_maxPath': 7, 'combined_rdkit_nBits': 1024, 'num_hidden_layers': 2, 'hidden_dim_0': 64, 'hidden_dim_1': 512, 'kl_weight': 0.00018352841495514752, 'lr': 0.002024708688284516, 'batch_size': 32, 'dropout_rate': 0.23933955983967994, 'prior_mu': 0.049619605255557205, 'prior_sigma': 0.04040847642577762, 'normalization': 'layer'}. Best is trial 179 with value: 0.4671938598155975.
Generating morgan_rdkit fingerprints...
Generated fingerprints with 768 features for 841 molecules
Trial 342: 5-fold CV loss = 0.4785
[I 2025-08-07 17:51:05,246] Trial 342 finished with value: 0.47851389050483706 and parameters: {'fp_type': 'morgan_rdkit', 'combined_morgan_radius': 2, 'combined_morgan_nBits': 512, 'combined_rdkit_maxPath': 7, 'combined_rdkit_nBits': 1024, 'num_hidden_layers': 2, 'hidden_dim_0': 64, 'hidden_dim_1': 512, 'kl_weight': 0.00019504799500193512, 'lr': 0.0020319411452461474, 'batch_size': 32, 'dropout_rate': 0.23790326481593976, 'prior_mu': 0.05227882841157058, 'prior_sigma': 0.04767751599353272, 'normalization': 'layer'}. Best is trial 179 with value: 0.4671938598155975.
Generating morgan_rdkit fingerprints...
Generated fingerprints with 768 features for 841 molecules
Trial 347: 5-fold CV loss = 0.5829
[I 2025-08-07 17:51:16,896] Trial 347 finished with value: 0.5828521490097046 and parameters: {'fp_type': 'morgan_rdkit', 'combined_morgan_radius': 2, 'combined_morgan_nBits': 512, 'combined_rdkit_maxPath': 7, 'combined_rdkit_nBits': 256, 'num_hidden_layers': 2, 'hidden_dim_0': 64, 'hidden_dim_1': 512, 'kl_weight': 0.00013537471702066117, 'lr': 0.0015795450231878073, 'batch_size': 128, 'dropout_rate': 0.24836830944254912, 'prior_mu': 0.06648533174695068, 'prior_sigma': 0.05268752636327261, 'normalization': 'none'}. Best is trial 179 with value: 0.4671938598155975.
Generating morgan_rdkit fingerprints...
Generated fingerprints with 1536 features for 841 molecules
Trial 345: 5-fold CV loss = 0.5779
[I 2025-08-07 17:51:21,092] Trial 345 finished with value: 0.5779034256935119 and parameters: {'fp_type': 'morgan_rdkit', 'combined_morgan_radius': 2, 'combined_morgan_nBits': 512, 'combined_rdkit_maxPath': 7, 'combined_rdkit_nBits': 256, 'num_hidden_layers': 2, 'hidden_dim_0': 64, 'hidden_dim_1': 512, 'kl_weight': 0.0001921716670390906, 'lr': 0.0017922070127242107, 'batch_size': 128, 'dropout_rate': 0.24638497297214587, 'prior_mu': 0.06171118991429407, 'prior_sigma': 0.039334303268799636, 'normalization': 'none'}. Best is trial 179 with value: 0.4671938598155975.
Generating morgan_rdkit fingerprints...
Generated fingerprints with 1536 features for 841 molecules
Trial 348: 5-fold CV loss = 0.4835
[I 2025-08-07 17:52:06,416] Trial 348 finished with value: 0.48345500230789185 and parameters: {'fp_type': 'morgan_rdkit', 'combined_morgan_radius': 2, 'combined_morgan_nBits': 512, 'combined_rdkit_maxPath': 7, 'combined_rdkit_nBits': 1024, 'num_hidden_layers': 2, 'hidden_dim_0': 64, 'hidden_dim_1': 512, 'kl_weight': 0.0001399062094605023, 'lr': 0.001811746689217983, 'batch_size': 32, 'dropout_rate': 0.22772701352745467, 'prior_mu': 0.062375908774878565, 'prior_sigma': 0.01403800287198651, 'normalization': 'layer'}. Best is trial 179 with value: 0.4671938598155975.
Generating morgan_rdkit fingerprints...
Generated fingerprints with 1536 features for 841 molecules
Trial 346: 5-fold CV loss = 0.5390
[I 2025-08-07 17:52:12,955] Trial 346 finished with value: 0.5390289902687073 and parameters: {'fp_type': 'morgan_rdkit', 'combined_morgan_radius': 2, 'combined_morgan_nBits': 512, 'combined_rdkit_maxPath': 7, 'combined_rdkit_nBits': 256, 'num_hidden_layers': 2, 'hidden_dim_0': 64, 'hidden_dim_1': 512, 'kl_weight': 0.00014056656166977583, 'lr': 0.00152870569762179, 'batch_size': 32, 'dropout_rate': 0.24772506963955476, 'prior_mu': 0.05836426236518436, 'prior_sigma': 0.0454927178590251, 'normalization': 'none'}. Best is trial 179 with value: 0.4671938598155975.
Generating morgan_rdkit fingerprints...
Generated fingerprints with 1536 features for 841 molecules
Trial 344: 5-fold CV loss = 0.5330
[I 2025-08-07 17:53:34,067] Trial 344 finished with value: 0.5329759657382965 and parameters: {'fp_type': 'morgan_rdkit', 'combined_morgan_radius': 2, 'combined_morgan_nBits': 512, 'combined_rdkit_maxPath': 7, 'combined_rdkit_nBits': 256, 'num_hidden_layers': 2, 'hidden_dim_0': 64, 'hidden_dim_1': 512, 'kl_weight': 0.0001852444628386029, 'lr': 0.0015575616169679872, 'batch_size': 32, 'dropout_rate': 0.23066421254500988, 'prior_mu': 0.05527900124073514, 'prior_sigma': 0.04475378389990753, 'normalization': 'none'}. Best is trial 179 with value: 0.4671938598155975.
Generating morgan_rdkit fingerprints...
Generated fingerprints with 1536 features for 841 molecules
Trial 350: 5-fold CV loss = 0.5013
[I 2025-08-07 17:53:36,861] Trial 350 finished with value: 0.5013348996639252 and parameters: {'fp_type': 'morgan_rdkit', 'combined_morgan_radius': 2, 'combined_morgan_nBits': 512, 'combined_rdkit_maxPath': 7, 'combined_rdkit_nBits': 1024, 'num_hidden_layers': 2, 'hidden_dim_0': 64, 'hidden_dim_1': 512, 'kl_weight': 0.00014638413148956425, 'lr': 0.0015447040138927956, 'batch_size': 32, 'dropout_rate': 0.2746048313020908, 'prior_mu': 0.0432101044187638, 'prior_sigma': 0.08068575994858967, 'normalization': 'layer'}. Best is trial 179 with value: 0.4671938598155975.
Generating morgan_rdkit fingerprints...
Generated fingerprints with 1536 features for 841 molecules
Trial 351: 5-fold CV loss = 0.4744
[I 2025-08-07 17:53:39,891] Trial 351 finished with value: 0.474350905418396 and parameters: {'fp_type': 'morgan_rdkit', 'combined_morgan_radius': 2, 'combined_morgan_nBits': 512, 'combined_rdkit_maxPath': 7, 'combined_rdkit_nBits': 1024, 'num_hidden_layers': 2, 'hidden_dim_0': 64, 'hidden_dim_1': 512, 'kl_weight': 0.00011083604419440064, 'lr': 0.0016881645613020082, 'batch_size': 32, 'dropout_rate': 0.2757920441113258, 'prior_mu': 0.03909620023516416, 'prior_sigma': 0.035339996283061684, 'normalization': 'layer'}. Best is trial 179 with value: 0.4671938598155975.
Generating morgan_rdkit fingerprints...
Generated fingerprints with 1536 features for 841 molecules
Trial 349: 5-fold CV loss = 0.6938
[I 2025-08-07 17:53:40,989] Trial 349 finished with value: 0.6938363552093506 and parameters: {'fp_type': 'morgan_rdkit', 'combined_morgan_radius': 2, 'combined_morgan_nBits': 512, 'combined_rdkit_maxPath': 7, 'combined_rdkit_nBits': 1024, 'num_hidden_layers': 2, 'hidden_dim_0': 64, 'hidden_dim_1': 512, 'kl_weight': 0.00014438410850646673, 'lr': 0.0016999783598438919, 'batch_size': 32, 'dropout_rate': 0.22746014131530995, 'prior_mu': 0.03564118492393346, 'prior_sigma': 0.17212675371676678, 'normalization': 'layer'}. Best is trial 179 with value: 0.4671938598155975.
Generating morgan_rdkit fingerprints...
Generated fingerprints with 1536 features for 841 molecules
Trial 353: 5-fold CV loss = 0.4868
[I 2025-08-07 17:54:28,875] Trial 353 finished with value: 0.4868350148200989 and parameters: {'fp_type': 'morgan_rdkit', 'combined_morgan_radius': 2, 'combined_morgan_nBits': 512, 'combined_rdkit_maxPath': 7, 'combined_rdkit_nBits': 1024, 'num_hidden_layers': 2, 'hidden_dim_0': 64, 'hidden_dim_1': 512, 'kl_weight': 0.0001138520572321769, 'lr': 0.0022151992168139172, 'batch_size': 32, 'dropout_rate': 0.2546783485520513, 'prior_mu': 0.03967545516997263, 'prior_sigma': 0.033106154892302765, 'normalization': 'layer'}. Best is trial 179 with value: 0.4671938598155975.
Generating morgan_rdkit fingerprints...
Generated fingerprints with 1536 features for 841 molecules
Trial 354: 5-fold CV loss = 0.4747
[I 2025-08-07 17:55:08,870] Trial 354 finished with value: 0.47471354007720945 and parameters: {'fp_type': 'morgan_rdkit', 'combined_morgan_radius': 2, 'combined_morgan_nBits': 512, 'combined_rdkit_maxPath': 7, 'combined_rdkit_nBits': 1024, 'num_hidden_layers': 2, 'hidden_dim_0': 64, 'hidden_dim_1': 512, 'kl_weight': 0.00010136367886570543, 'lr': 0.00171861233892894, 'batch_size': 32, 'dropout_rate': 0.2934365417613122, 'prior_mu': 0.03212638127865874, 'prior_sigma': 0.034646773249142546, 'normalization': 'layer'}. Best is trial 179 with value: 0.4671938598155975.
Generating morgan_rdkit fingerprints...
Generated fingerprints with 1536 features for 841 molecules
Trial 355: 5-fold CV loss = 0.4756
[I 2025-08-07 17:55:32,287] Trial 355 finished with value: 0.4756075322628021 and parameters: {'fp_type': 'morgan_rdkit', 'combined_morgan_radius': 2, 'combined_morgan_nBits': 512, 'combined_rdkit_maxPath': 7, 'combined_rdkit_nBits': 1024, 'num_hidden_layers': 2, 'hidden_dim_0': 64, 'hidden_dim_1': 512, 'kl_weight': 0.00010111655792459145, 'lr': 0.0016949849530493721, 'batch_size': 32, 'dropout_rate': 0.2941151601626048, 'prior_mu': 0.03237598267184287, 'prior_sigma': 0.0349524119422971, 'normalization': 'layer'}. Best is trial 179 with value: 0.4671938598155975.
Generating rdkit fingerprints...
Generated fingerprints with 256 features for 841 molecules
Trial 356: 5-fold CV loss = 0.4861
[I 2025-08-07 17:55:37,482] Trial 356 finished with value: 0.486071914434433 and parameters: {'fp_type': 'morgan_rdkit', 'combined_morgan_radius': 2, 'combined_morgan_nBits': 512, 'combined_rdkit_maxPath': 7, 'combined_rdkit_nBits': 1024, 'num_hidden_layers': 2, 'hidden_dim_0': 64, 'hidden_dim_1': 1024, 'kl_weight': 0.0001007504289515417, 'lr': 0.001720817642464848, 'batch_size': 32, 'dropout_rate': 0.28920605997054993, 'prior_mu': 0.03213455405439956, 'prior_sigma': 0.03423832942520534, 'normalization': 'layer'}. Best is trial 179 with value: 0.4671938598155975.
Generating rdkit fingerprints...
Generated fingerprints with 256 features for 841 molecules
Trial 357: 5-fold CV loss = 0.4928
[I 2025-08-07 17:56:17,562] Trial 357 finished with value: 0.4928479135036469 and parameters: {'fp_type': 'morgan_rdkit', 'combined_morgan_radius': 2, 'combined_morgan_nBits': 512, 'combined_rdkit_maxPath': 5, 'combined_rdkit_nBits': 1024, 'num_hidden_layers': 2, 'hidden_dim_0': 64, 'hidden_dim_1': 1024, 'kl_weight': 0.00011319633984316147, 'lr': 0.0017341002048386553, 'batch_size': 32, 'dropout_rate': 0.2955373671321336, 'prior_mu': 0.02708843195758299, 'prior_sigma': 0.03643501797720313, 'normalization': 'layer'}. Best is trial 179 with value: 0.4671938598155975.
Generating rdkit fingerprints...
Generated fingerprints with 256 features for 841 molecules
Trial 359: 5-fold CV loss = 0.8877
[I 2025-08-07 17:56:18,550] Trial 359 finished with value: 0.887666130065918 and parameters: {'fp_type': 'rdkit', 'rdkit_only_maxPath': 8, 'rdkit_only_nBits': 256, 'num_hidden_layers': 2, 'hidden_dim_0': 64, 'hidden_dim_1': 512, 'kl_weight': 0.00011699814995371914, 'lr': 0.0017964439352508208, 'batch_size': 32, 'dropout_rate': 0.27466963532764027, 'prior_mu': 0.024671426642905614, 'prior_sigma': 0.0380160557414651, 'normalization': 'layer'}. Best is trial 179 with value: 0.4671938598155975.
Generating morgan_rdkit fingerprints...
Generated fingerprints with 1536 features for 841 molecules
Trial 358: 5-fold CV loss = 0.8882
[I 2025-08-07 17:56:31,642] Trial 358 finished with value: 0.8881624221801758 and parameters: {'fp_type': 'rdkit', 'rdkit_only_maxPath': 8, 'rdkit_only_nBits': 256, 'num_hidden_layers': 2, 'hidden_dim_0': 64, 'hidden_dim_1': 1024, 'kl_weight': 0.00011374210636464841, 'lr': 0.0018892516072562006, 'batch_size': 32, 'dropout_rate': 0.29917180440434826, 'prior_mu': 0.02497610160030026, 'prior_sigma': 0.03660137546175552, 'normalization': 'layer'}. Best is trial 179 with value: 0.4671938598155975.
Generating morgan_rdkit fingerprints...
Generated fingerprints with 1536 features for 841 molecules
Trial 352: 5-fold CV loss = 0.4793
[I 2025-08-07 17:56:46,394] Trial 352 finished with value: 0.47925313711166384 and parameters: {'fp_type': 'morgan_rdkit', 'combined_morgan_radius': 2, 'combined_morgan_nBits': 512, 'combined_rdkit_maxPath': 7, 'combined_rdkit_nBits': 1024, 'num_hidden_layers': 2, 'hidden_dim_0': 64, 'hidden_dim_1': 512, 'kl_weight': 0.00010040713580472898, 'lr': 0.002575253200882262, 'batch_size': 32, 'dropout_rate': 0.2768647837785478, 'prior_mu': 0.04293777826250765, 'prior_sigma': 0.03458968715565466, 'normalization': 'layer'}. Best is trial 179 with value: 0.4671938598155975.
Generating morgan_rdkit fingerprints...
Generated fingerprints with 1536 features for 841 molecules
Trial 361: 5-fold CV loss = 0.8009
[I 2025-08-07 17:57:03,563] Trial 361 finished with value: 0.8008726358413696 and parameters: {'fp_type': 'morgan_rdkit', 'combined_morgan_radius': 3, 'combined_morgan_nBits': 512, 'combined_rdkit_maxPath': 7, 'combined_rdkit_nBits': 1024, 'num_hidden_layers': 2, 'hidden_dim_0': 64, 'hidden_dim_1': 512, 'kl_weight': 0.0001304978650201417, 'lr': 0.0019077303607852054, 'batch_size': 32, 'dropout_rate': 0.2995760612178892, 'prior_mu': 0.04463416857074104, 'prior_sigma': 0.157794114075114, 'normalization': 'layer'}. Best is trial 179 with value: 0.4671938598155975.
Generating morgan fingerprints...
Generated fingerprints with 1024 features for 841 molecules
Trial 364: 5-fold CV loss = 0.5252
[I 2025-08-07 17:57:38,554] Trial 364 finished with value: 0.5251694738864898 and parameters: {'fp_type': 'morgan', 'morgan_only_radius': 3, 'morgan_only_nBits': 1024, 'num_hidden_layers': 2, 'hidden_dim_0': 64, 'hidden_dim_1': 512, 'kl_weight': 0.0001584267178940215, 'lr': 0.0014849891820636237, 'batch_size': 32, 'dropout_rate': 0.25736796456589983, 'prior_mu': 0.08779603508354755, 'prior_sigma': 0.028622602632691216, 'normalization': 'layer'}. Best is trial 179 with value: 0.4671938598155975.
Generating morgan_rdkit fingerprints...
Generated fingerprints with 1536 features for 841 molecules
Trial 362: 5-fold CV loss = 0.4902
[I 2025-08-07 17:57:54,951] Trial 362 finished with value: 0.49021672606468203 and parameters: {'fp_type': 'morgan_rdkit', 'combined_morgan_radius': 3, 'combined_morgan_nBits': 512, 'combined_rdkit_maxPath': 7, 'combined_rdkit_nBits': 1024, 'num_hidden_layers': 2, 'hidden_dim_0': 64, 'hidden_dim_1': 512, 'kl_weight': 0.00012890255696890198, 'lr': 0.0013316326779442584, 'batch_size': 32, 'dropout_rate': 0.2735422645337446, 'prior_mu': 0.08538636150553898, 'prior_sigma': 0.03170967454821671, 'normalization': 'layer'}. Best is trial 179 with value: 0.4671938598155975.
Generating morgan_rdkit fingerprints...
Generated fingerprints with 1024 features for 841 molecules
Trial 360: 5-fold CV loss = 0.7851
[I 2025-08-07 17:58:31,898] Trial 360 finished with value: 0.7850791931152343 and parameters: {'fp_type': 'rdkit', 'rdkit_only_maxPath': 7, 'rdkit_only_nBits': 256, 'num_hidden_layers': 2, 'hidden_dim_0': 64, 'hidden_dim_1': 512, 'kl_weight': 0.00012295834407340074, 'lr': 0.0014182876588196244, 'batch_size': 32, 'dropout_rate': 0.27411583937039513, 'prior_mu': 0.04380526033075877, 'prior_sigma': 0.03102393147402436, 'normalization': 'layer'}. Best is trial 179 with value: 0.4671938598155975.
Generating morgan_rdkit fingerprints...
Generated fingerprints with 1024 features for 841 molecules
Trial 365: 5-fold CV loss = 0.4839
[I 2025-08-07 17:58:40,079] Trial 365 finished with value: 0.48393174409866335 and parameters: {'fp_type': 'morgan_rdkit', 'combined_morgan_radius': 2, 'combined_morgan_nBits': 512, 'combined_rdkit_maxPath': 7, 'combined_rdkit_nBits': 1024, 'num_hidden_layers': 2, 'hidden_dim_0': 64, 'hidden_dim_1': 512, 'kl_weight': 0.0001244828675703671, 'lr': 0.0014006232892027298, 'batch_size': 32, 'dropout_rate': 0.2722300693050551, 'prior_mu': 0.0818547671185766, 'prior_sigma': 0.029192253714206626, 'normalization': 'layer'}. Best is trial 179 with value: 0.4671938598155975.
Generating morgan_rdkit fingerprints...
Generated fingerprints with 1024 features for 841 molecules
Trial 367: 5-fold CV loss = 0.5005
[I 2025-08-07 17:59:23,328] Trial 367 finished with value: 0.5005356431007385 and parameters: {'fp_type': 'morgan_rdkit', 'combined_morgan_radius': 2, 'combined_morgan_nBits': 512, 'combined_rdkit_maxPath': 7, 'combined_rdkit_nBits': 512, 'num_hidden_layers': 2, 'hidden_dim_0': 64, 'hidden_dim_1': 512, 'kl_weight': 0.00010017319259650797, 'lr': 0.002565565469939779, 'batch_size': 32, 'dropout_rate': 0.2604697474113938, 'prior_mu': 0.07234823720859246, 'prior_sigma': 0.01485183656473249, 'normalization': 'layer'}. Best is trial 179 with value: 0.4671938598155975.
Generating morgan_rdkit fingerprints...
Generated fingerprints with 1536 features for 841 molecules
Trial 368: 5-fold CV loss = 0.5108
[I 2025-08-07 17:59:26,867] Trial 368 finished with value: 0.5107829570770264 and parameters: {'fp_type': 'morgan_rdkit', 'combined_morgan_radius': 2, 'combined_morgan_nBits': 512, 'combined_rdkit_maxPath': 7, 'combined_rdkit_nBits': 512, 'num_hidden_layers': 2, 'hidden_dim_0': 64, 'hidden_dim_1': 256, 'kl_weight': 0.0001651998307933746, 'lr': 0.002621405321226474, 'batch_size': 32, 'dropout_rate': 0.2846757311173745, 'prior_mu': 0.10157272265253584, 'prior_sigma': 0.014464307101947868, 'normalization': 'layer'}. Best is trial 179 with value: 0.4671938598155975.
Generating morgan_rdkit fingerprints...
Generated fingerprints with 1536 features for 841 molecules
Trial 369: 5-fold CV loss = 0.4793
[I 2025-08-07 18:00:23,216] Trial 369 finished with value: 0.4792606055736542 and parameters: {'fp_type': 'morgan_rdkit', 'combined_morgan_radius': 2, 'combined_morgan_nBits': 512, 'combined_rdkit_maxPath': 7, 'combined_rdkit_nBits': 1024, 'num_hidden_layers': 2, 'hidden_dim_0': 64, 'hidden_dim_1': 256, 'kl_weight': 0.00016296036299529991, 'lr': 0.00221429133990535, 'batch_size': 32, 'dropout_rate': 0.2864284197562442, 'prior_mu': 0.06833898084862446, 'prior_sigma': 0.020656494619072967, 'normalization': 'layer'}. Best is trial 179 with value: 0.4671938598155975.
Generating morgan_rdkit fingerprints...
Generated fingerprints with 1536 features for 841 molecules
Trial 370: 5-fold CV loss = 0.4727
[I 2025-08-07 18:00:26,232] Trial 370 finished with value: 0.47273547649383546 and parameters: {'fp_type': 'morgan_rdkit', 'combined_morgan_radius': 2, 'combined_morgan_nBits': 512, 'combined_rdkit_maxPath': 7, 'combined_rdkit_nBits': 1024, 'num_hidden_layers': 2, 'hidden_dim_0': 64, 'hidden_dim_1': 512, 'kl_weight': 0.00011096399475316795, 'lr': 0.0029915751150807746, 'batch_size': 32, 'dropout_rate': 0.25974950900117744, 'prior_mu': 0.03754923649696339, 'prior_sigma': 0.019819769486119593, 'normalization': 'layer'}. Best is trial 179 with value: 0.4671938598155975.
Generating morgan_rdkit fingerprints...
Generated fingerprints with 1536 features for 841 molecules
Trial 366: 5-fold CV loss = 0.5205
[I 2025-08-07 18:00:45,498] Trial 366 finished with value: 0.5204953014850616 and parameters: {'fp_type': 'morgan_rdkit', 'combined_morgan_radius': 2, 'combined_morgan_nBits': 512, 'combined_rdkit_maxPath': 7, 'combined_rdkit_nBits': 512, 'num_hidden_layers': 2, 'hidden_dim_0': 64, 'hidden_dim_1': 512, 'kl_weight': 0.00011966074132938623, 'lr': 0.0029591178208505232, 'batch_size': 32, 'dropout_rate': 0.2616335554208522, 'prior_mu': 0.07053495182266284, 'prior_sigma': 0.12891011258009813, 'normalization': 'layer'}. Best is trial 179 with value: 0.4671938598155975.
Generating morgan_rdkit fingerprints...
Generated fingerprints with 1536 features for 841 molecules
Trial 363: 5-fold CV loss = 0.6331
[I 2025-08-07 18:00:47,349] Trial 363 finished with value: 0.6331286072731018 and parameters: {'fp_type': 'morgan_rdkit', 'combined_morgan_radius': 3, 'combined_morgan_nBits': 512, 'combined_rdkit_maxPath': 7, 'combined_rdkit_nBits': 1024, 'num_hidden_layers': 2, 'hidden_dim_0': 64, 'hidden_dim_1': 512, 'kl_weight': 0.00012768054636123598, 'lr': 0.0019206019057574518, 'batch_size': 32, 'dropout_rate': 0.25866726859643163, 'prior_mu': 0.08134832412830484, 'prior_sigma': 0.11705709784370708, 'normalization': 'layer'}. Best is trial 179 with value: 0.4671938598155975.
Generating morgan_rdkit fingerprints...
Generated fingerprints with 1536 features for 841 molecules
Trial 372: 5-fold CV loss = 0.5094
[I 2025-08-07 18:00:49,781] Trial 372 finished with value: 0.5093894183635712 and parameters: {'fp_type': 'morgan_rdkit', 'combined_morgan_radius': 2, 'combined_morgan_nBits': 512, 'combined_rdkit_maxPath': 7, 'combined_rdkit_nBits': 1024, 'num_hidden_layers': 1, 'hidden_dim_0': 64, 'kl_weight': 0.0001397183972158835, 'lr': 0.002977487554472246, 'batch_size': 64, 'dropout_rate': 0.25413416075142686, 'prior_mu': 0.03907697217400057, 'prior_sigma': 0.04111904797924871, 'normalization': 'layer'}. Best is trial 179 with value: 0.4671938598155975.
Generating morgan_rdkit fingerprints...
Generated fingerprints with 1536 features for 841 molecules
Trial 371: 5-fold CV loss = 0.5119
[I 2025-08-07 18:01:07,447] Trial 371 finished with value: 0.5119254946708679 and parameters: {'fp_type': 'morgan_rdkit', 'combined_morgan_radius': 2, 'combined_morgan_nBits': 512, 'combined_rdkit_maxPath': 7, 'combined_rdkit_nBits': 1024, 'num_hidden_layers': 1, 'hidden_dim_0': 64, 'kl_weight': 0.0013564279668780586, 'lr': 0.002892558824676705, 'batch_size': 32, 'dropout_rate': 0.25967304810659725, 'prior_mu': 0.03572245049202607, 'prior_sigma': 0.02606876383100859, 'normalization': 'layer'}. Best is trial 179 with value: 0.4671938598155975.
Generating morgan_rdkit fingerprints...
Generated fingerprints with 1536 features for 841 molecules
Trial 373: 5-fold CV loss = 0.4809
