[I 2025-08-07 18:25:28,346] Trial 437 finished with value: 0.47632290720939635 and parameters: {'fp_type': 'morgan_rdkit', 'combined_morgan_radius': 2, 'combined_morgan_nBits': 512, 'combined_rdkit_maxPath': 7, 'combined_rdkit_nBits': 1024, 'num_hidden_layers': 3, 'hidden_dim_0': 64, 'hidden_dim_1': 512, 'hidden_dim_2': 1024, 'kl_weight': 0.0010622758107960758, 'lr': 0.002493904825151961, 'batch_size': 32, 'dropout_rate': 0.23540458520391588, 'prior_mu': 0.04172023750226145, 'prior_sigma': 0.05271246954627383, 'normalization': 'layer'}. Best is trial 179 with value: 0.4671938598155975.
Generating morgan_rdkit fingerprints...
Generated fingerprints with 768 features for 841 molecules
Trial 436: 5-fold CV loss = 0.5031
[I 2025-08-07 18:25:33,164] Trial 436 finished with value: 0.5030706882476806 and parameters: {'fp_type': 'morgan_rdkit', 'combined_morgan_radius': 2, 'combined_morgan_nBits': 512, 'combined_rdkit_maxPath': 7, 'combined_rdkit_nBits': 512, 'num_hidden_layers': 3, 'hidden_dim_0': 64, 'hidden_dim_1': 512, 'hidden_dim_2': 1024, 'kl_weight': 0.0001182045159677897, 'lr': 0.002513307078975339, 'batch_size': 32, 'dropout_rate': 0.3549763073826037, 'prior_mu': 0.05486108839154663, 'prior_sigma': 0.05270755681471914, 'normalization': 'layer'}. Best is trial 179 with value: 0.4671938598155975.
Generating morgan_rdkit fingerprints...
Generated fingerprints with 768 features for 841 molecules
Trial 438: 5-fold CV loss = 0.5350
[I 2025-08-07 18:25:57,268] Trial 438 finished with value: 0.5350279152393341 and parameters: {'fp_type': 'morgan_rdkit', 'combined_morgan_radius': 3, 'combined_morgan_nBits': 512, 'combined_rdkit_maxPath': 7, 'combined_rdkit_nBits': 256, 'num_hidden_layers': 3, 'hidden_dim_0': 64, 'hidden_dim_1': 512, 'hidden_dim_2': 1024, 'kl_weight': 0.0001234309459465481, 'lr': 0.0025691839674228754, 'batch_size': 32, 'dropout_rate': 0.24066647315966588, 'prior_mu': 0.0452336371137586, 'prior_sigma': 0.042434307648821654, 'normalization': 'layer'}. Best is trial 179 with value: 0.4671938598155975.
Generating morgan_rdkit fingerprints...
Generated fingerprints with 1536 features for 841 molecules
Trial 427: 5-fold CV loss = 0.5903
[I 2025-08-07 18:26:04,528] Trial 427 finished with value: 0.5903031826019287 and parameters: {'fp_type': 'rdkit', 'rdkit_only_maxPath': 7, 'rdkit_only_nBits': 512, 'num_hidden_layers': 3, 'hidden_dim_0': 64, 'hidden_dim_1': 256, 'hidden_dim_2': 1024, 'kl_weight': 0.0038773252569044812, 'lr': 0.0022525998623638176, 'batch_size': 32, 'dropout_rate': 0.22315989351375307, 'prior_mu': 0.045381488375637685, 'prior_sigma': 0.049067533147391554, 'normalization': 'layer'}. Best is trial 179 with value: 0.4671938598155975.
Generating morgan_rdkit fingerprints...
Generated fingerprints with 1536 features for 841 molecules
Trial 440: 5-fold CV loss = 0.6519
[I 2025-08-07 18:26:41,973] Trial 440 finished with value: 0.651945275068283 and parameters: {'fp_type': 'morgan_rdkit', 'combined_morgan_radius': 3, 'combined_morgan_nBits': 512, 'combined_rdkit_maxPath': 7, 'combined_rdkit_nBits': 256, 'num_hidden_layers': 3, 'hidden_dim_0': 64, 'hidden_dim_1': 512, 'hidden_dim_2': 64, 'kl_weight': 0.00015347679431468954, 'lr': 0.002675295609695813, 'batch_size': 32, 'dropout_rate': 0.20219697239613282, 'prior_mu': 0.025872261627503383, 'prior_sigma': 0.1440763401919648, 'normalization': 'layer'}. Best is trial 179 with value: 0.4671938598155975.
Generating morgan_rdkit fingerprints...
Generated fingerprints with 1536 features for 841 molecules
Trial 439: 5-fold CV loss = 0.5226
[I 2025-08-07 18:26:51,707] Trial 439 finished with value: 0.5225812733173371 and parameters: {'fp_type': 'morgan_rdkit', 'combined_morgan_radius': 3, 'combined_morgan_nBits': 512, 'combined_rdkit_maxPath': 7, 'combined_rdkit_nBits': 256, 'num_hidden_layers': 3, 'hidden_dim_0': 64, 'hidden_dim_1': 512, 'hidden_dim_2': 64, 'kl_weight': 0.0001245341485208742, 'lr': 0.0025356412621870003, 'batch_size': 32, 'dropout_rate': 0.25105071188240513, 'prior_mu': 0.028895283917593325, 'prior_sigma': 0.06326235849131082, 'normalization': 'layer'}. Best is trial 179 with value: 0.4671938598155975.
Generating morgan_rdkit fingerprints...
Generated fingerprints with 1536 features for 841 molecules
Trial 443: 5-fold CV loss = 0.5037
[I 2025-08-07 18:27:32,570] Trial 443 finished with value: 0.503652685880661 and parameters: {'fp_type': 'morgan_rdkit', 'combined_morgan_radius': 2, 'combined_morgan_nBits': 512, 'combined_rdkit_maxPath': 7, 'combined_rdkit_nBits': 1024, 'num_hidden_layers': 1, 'hidden_dim_0': 256, 'kl_weight': 0.00013292024419527703, 'lr': 0.003132856629393378, 'batch_size': 32, 'dropout_rate': 0.2493529709404085, 'prior_mu': -0.07462345397543706, 'prior_sigma': 0.042848610229762996, 'normalization': 'layer'}. Best is trial 179 with value: 0.4671938598155975.
Generating morgan_rdkit fingerprints...
Generated fingerprints with 1536 features for 841 molecules
Trial 441: 5-fold CV loss = 0.4706
[I 2025-08-07 18:27:56,368] Trial 441 finished with value: 0.4705534398555756 and parameters: {'fp_type': 'morgan_rdkit', 'combined_morgan_radius': 2, 'combined_morgan_nBits': 512, 'combined_rdkit_maxPath': 7, 'combined_rdkit_nBits': 1024, 'num_hidden_layers': 3, 'hidden_dim_0': 256, 'hidden_dim_1': 1024, 'hidden_dim_2': 64, 'kl_weight': 0.00014903165017597205, 'lr': 0.0027307121269102602, 'batch_size': 32, 'dropout_rate': 0.19663690267728345, 'prior_mu': 0.02835773098183566, 'prior_sigma': 0.039949612605735686, 'normalization': 'layer'}. Best is trial 179 with value: 0.4671938598155975.
Generating morgan_rdkit fingerprints...
Generated fingerprints with 1536 features for 841 molecules
Trial 445: 5-fold CV loss = 0.4906
[I 2025-08-07 18:28:35,690] Trial 445 finished with value: 0.49061516523361204 and parameters: {'fp_type': 'morgan_rdkit', 'combined_morgan_radius': 2, 'combined_morgan_nBits': 512, 'combined_rdkit_maxPath': 5, 'combined_rdkit_nBits': 1024, 'num_hidden_layers': 3, 'hidden_dim_0': 64, 'hidden_dim_1': 512, 'hidden_dim_2': 256, 'kl_weight': 0.0001627690792898112, 'lr': 0.00283777603143782, 'batch_size': 32, 'dropout_rate': 0.22868375658495732, 'prior_mu': 0.06651356916351596, 'prior_sigma': 0.040208348908795835, 'normalization': 'layer'}. Best is trial 179 with value: 0.4671938598155975.
Generating morgan_rdkit fingerprints...
Generated fingerprints with 1536 features for 841 molecules
Trial 446: 5-fold CV loss = 0.4967
[I 2025-08-07 18:28:55,169] Trial 446 finished with value: 0.49669901728630067 and parameters: {'fp_type': 'morgan_rdkit', 'combined_morgan_radius': 2, 'combined_morgan_nBits': 512, 'combined_rdkit_maxPath': 7, 'combined_rdkit_nBits': 1024, 'num_hidden_layers': 1, 'hidden_dim_0': 256, 'kl_weight': 0.0001559111838370413, 'lr': 0.0035630175113508657, 'batch_size': 32, 'dropout_rate': 0.21445564391813368, 'prior_mu': 0.014427526241632807, 'prior_sigma': 0.04094434314054343, 'normalization': 'layer'}. Best is trial 179 with value: 0.4671938598155975.
Generating morgan_rdkit fingerprints...
Generated fingerprints with 1536 features for 841 molecules
Trial 444: 5-fold CV loss = 0.5642
[I 2025-08-07 18:29:02,333] Trial 444 finished with value: 0.5641595423221588 and parameters: {'fp_type': 'morgan_rdkit', 'combined_morgan_radius': 2, 'combined_morgan_nBits': 512, 'combined_rdkit_maxPath': 7, 'combined_rdkit_nBits': 1024, 'num_hidden_layers': 3, 'hidden_dim_0': 256, 'hidden_dim_1': 512, 'hidden_dim_2': 256, 'kl_weight': 0.0001609846454591479, 'lr': 0.00013486163744229706, 'batch_size': 32, 'dropout_rate': 0.2523840059063237, 'prior_mu': 0.06655258012626906, 'prior_sigma': 0.042845922927073794, 'normalization': 'layer'}. Best is trial 179 with value: 0.4671938598155975.
Generating morgan_rdkit fingerprints...
Generated fingerprints with 1536 features for 841 molecules
Trial 449: 5-fold CV loss = 0.6349
[I 2025-08-07 18:29:19,010] Trial 449 finished with value: 0.634931218624115 and parameters: {'fp_type': 'morgan_rdkit', 'combined_morgan_radius': 2, 'combined_morgan_nBits': 512, 'combined_rdkit_maxPath': 7, 'combined_rdkit_nBits': 1024, 'num_hidden_layers': 0, 'kl_weight': 0.0001418660368786307, 'lr': 0.0031086634526703775, 'batch_size': 32, 'dropout_rate': 0.24089717273020692, 'prior_mu': 0.033033951006122775, 'prior_sigma': 0.036008053951217055, 'normalization': 'layer'}. Best is trial 179 with value: 0.4671938598155975.
Generating morgan_rdkit fingerprints...
Generated fingerprints with 1536 features for 841 molecules
Trial 442: 5-fold CV loss = 0.4716
[I 2025-08-07 18:29:52,178] Trial 442 finished with value: 0.47162491679191587 and parameters: {'fp_type': 'morgan_rdkit', 'combined_morgan_radius': 2, 'combined_morgan_nBits': 512, 'combined_rdkit_maxPath': 7, 'combined_rdkit_nBits': 1024, 'num_hidden_layers': 3, 'hidden_dim_0': 256, 'hidden_dim_1': 1024, 'hidden_dim_2': 64, 'kl_weight': 0.00016071427929419233, 'lr': 0.0036341890438708747, 'batch_size': 32, 'dropout_rate': 0.1999230806905777, 'prior_mu': 0.030130928981920848, 'prior_sigma': 0.06782200076608397, 'normalization': 'layer'}. Best is trial 179 with value: 0.4671938598155975.
Generating morgan_rdkit fingerprints...
Generated fingerprints with 2048 features for 841 molecules
Trial 447: 5-fold CV loss = 0.5002
[I 2025-08-07 18:29:55,805] Trial 447 finished with value: 0.5002142667770386 and parameters: {'fp_type': 'morgan_rdkit', 'combined_morgan_radius': 2, 'combined_morgan_nBits': 512, 'combined_rdkit_maxPath': 7, 'combined_rdkit_nBits': 1024, 'num_hidden_layers': 1, 'hidden_dim_0': 256, 'kl_weight': 0.00016439634568745338, 'lr': 0.0032907540050258195, 'batch_size': 32, 'dropout_rate': 0.4087630489413022, 'prior_mu': 0.028794349318002364, 'prior_sigma': 0.10944381505459061, 'normalization': 'layer'}. Best is trial 179 with value: 0.4671938598155975.
Generating morgan_rdkit fingerprints...
Generated fingerprints with 2048 features for 841 molecules
Trial 450: 5-fold CV loss = 0.4785
[I 2025-08-07 18:30:36,262] Trial 450 finished with value: 0.47854272127151487 and parameters: {'fp_type': 'morgan_rdkit', 'combined_morgan_radius': 2, 'combined_morgan_nBits': 512, 'combined_rdkit_maxPath': 7, 'combined_rdkit_nBits': 1024, 'num_hidden_layers': 3, 'hidden_dim_0': 1024, 'hidden_dim_1': 1024, 'hidden_dim_2': 64, 'kl_weight': 0.00019397833868861747, 'lr': 0.003373983024739776, 'batch_size': 32, 'dropout_rate': 0.21109933971809924, 'prior_mu': 0.02167365343682425, 'prior_sigma': 0.01675858547589581, 'normalization': 'layer'}. Best is trial 179 with value: 0.4671938598155975.
Generating morgan_rdkit fingerprints...
Generated fingerprints with 2048 features for 841 molecules
Trial 448: 5-fold CV loss = 0.4676
[I 2025-08-07 18:30:50,806] Trial 448 finished with value: 0.4675723612308502 and parameters: {'fp_type': 'morgan_rdkit', 'combined_morgan_radius': 2, 'combined_morgan_nBits': 512, 'combined_rdkit_maxPath': 7, 'combined_rdkit_nBits': 1024, 'num_hidden_layers': 3, 'hidden_dim_0': 256, 'hidden_dim_1': 512, 'hidden_dim_2': 64, 'kl_weight': 0.00016718434255918145, 'lr': 0.003413674837567062, 'batch_size': 32, 'dropout_rate': 0.19883266398942695, 'prior_mu': 0.030915878797317636, 'prior_sigma': 0.03791854896432458, 'normalization': 'layer'}. Best is trial 179 with value: 0.4671938598155975.
Generating morgan_rdkit fingerprints...
Generated fingerprints with 2048 features for 841 molecules
Trial 452: 5-fold CV loss = 0.4703
[I 2025-08-07 18:31:26,490] Trial 452 finished with value: 0.47026864290237425 and parameters: {'fp_type': 'morgan_rdkit', 'combined_morgan_radius': 2, 'combined_morgan_nBits': 1024, 'combined_rdkit_maxPath': 7, 'combined_rdkit_nBits': 1024, 'num_hidden_layers': 3, 'hidden_dim_0': 256, 'hidden_dim_1': 1024, 'hidden_dim_2': 64, 'kl_weight': 0.0001874268273957737, 'lr': 0.003749524177064585, 'batch_size': 32, 'dropout_rate': 0.1970323337292884, 'prior_mu': 0.018598582822000286, 'prior_sigma': 0.09014919796193988, 'normalization': 'layer'}. Best is trial 179 with value: 0.4671938598155975.
Generating morgan_rdkit fingerprints...
Generated fingerprints with 2048 features for 841 molecules
Trial 453: 5-fold CV loss = 0.4796
[I 2025-08-07 18:31:35,992] Trial 453 finished with value: 0.47955634593963625 and parameters: {'fp_type': 'morgan_rdkit', 'combined_morgan_radius': 2, 'combined_morgan_nBits': 1024, 'combined_rdkit_maxPath': 7, 'combined_rdkit_nBits': 1024, 'num_hidden_layers': 3, 'hidden_dim_0': 256, 'hidden_dim_1': 1024, 'hidden_dim_2': 64, 'kl_weight': 0.0001412855978861537, 'lr': 0.003779223965002741, 'batch_size': 32, 'dropout_rate': 0.1916520836578092, 'prior_mu': 0.011910032514065107, 'prior_sigma': 0.02023726468623863, 'normalization': 'layer'}. Best is trial 179 with value: 0.4671938598155975.
Generating morgan_rdkit fingerprints...
Generated fingerprints with 2048 features for 841 molecules
Trial 456: 5-fold CV loss = 0.7489
[I 2025-08-07 18:31:53,829] Trial 456 finished with value: 0.7489306330680847 and parameters: {'fp_type': 'morgan_rdkit', 'combined_morgan_radius': 2, 'combined_morgan_nBits': 1024, 'combined_rdkit_maxPath': 7, 'combined_rdkit_nBits': 1024, 'num_hidden_layers': 3, 'hidden_dim_0': 256, 'hidden_dim_1': 1024, 'hidden_dim_2': 64, 'kl_weight': 0.00019964181163182094, 'lr': 0.0035491934027442576, 'batch_size': 128, 'dropout_rate': 0.19657745379424033, 'prior_mu': 0.0017735755291851812, 'prior_sigma': 0.10232251879672893, 'normalization': 'layer'}. Best is trial 179 with value: 0.4671938598155975.
Generating morgan_rdkit fingerprints...
Generated fingerprints with 2048 features for 841 molecules
Trial 455: 5-fold CV loss = 0.4638
[I 2025-08-07 18:32:13,687] Trial 455 finished with value: 0.46377224922180177 and parameters: {'fp_type': 'morgan_rdkit', 'combined_morgan_radius': 2, 'combined_morgan_nBits': 1024, 'combined_rdkit_maxPath': 7, 'combined_rdkit_nBits': 1024, 'num_hidden_layers': 3, 'hidden_dim_0': 256, 'hidden_dim_1': 1024, 'hidden_dim_2': 64, 'kl_weight': 0.00018355497777901148, 'lr': 0.003593242468787106, 'batch_size': 128, 'dropout_rate': 0.19562440745468482, 'prior_mu': 0.007789072295354561, 'prior_sigma': 0.07922947490193429, 'normalization': 'layer'}. Best is trial 455 with value: 0.46377224922180177.
Generating morgan fingerprints...
Generated fingerprints with 1024 features for 841 molecules
Trial 454: 5-fold CV loss = 0.4747
[I 2025-08-07 18:32:31,661] Trial 454 finished with value: 0.47466482520103453 and parameters: {'fp_type': 'morgan_rdkit', 'combined_morgan_radius': 2, 'combined_morgan_nBits': 1024, 'combined_rdkit_maxPath': 7, 'combined_rdkit_nBits': 1024, 'num_hidden_layers': 3, 'hidden_dim_0': 256, 'hidden_dim_1': 1024, 'hidden_dim_2': 64, 'kl_weight': 0.0002792752889196856, 'lr': 0.003759139254936694, 'batch_size': 32, 'dropout_rate': 0.19720880986697478, 'prior_mu': 0.010788035766240867, 'prior_sigma': 0.038860853765034585, 'normalization': 'layer'}. Best is trial 455 with value: 0.46377224922180177.
Generating morgan_rdkit fingerprints...
Generated fingerprints with 2048 features for 841 molecules
Trial 451: 5-fold CV loss = 0.4815
[I 2025-08-07 18:32:33,035] Trial 451 finished with value: 0.4814668774604797 and parameters: {'fp_type': 'morgan_rdkit', 'combined_morgan_radius': 2, 'combined_morgan_nBits': 1024, 'combined_rdkit_maxPath': 7, 'combined_rdkit_nBits': 1024, 'num_hidden_layers': 3, 'hidden_dim_0': 256, 'hidden_dim_1': 1024, 'hidden_dim_2': 64, 'kl_weight': 0.00017707961342945734, 'lr': 0.0037740295778742575, 'batch_size': 32, 'dropout_rate': 0.2035078622772229, 'prior_mu': 0.024447179985175746, 'prior_sigma': 0.016324215732172413, 'normalization': 'layer'}. Best is trial 455 with value: 0.46377224922180177.
Generating morgan fingerprints...
Generated fingerprints with 1024 features for 841 molecules
Trial 458: 5-fold CV loss = 0.5246
[I 2025-08-07 18:32:48,972] Trial 458 finished with value: 0.5246019423007965 and parameters: {'fp_type': 'morgan', 'morgan_only_radius': 3, 'morgan_only_nBits': 1024, 'num_hidden_layers': 3, 'hidden_dim_0': 256, 'hidden_dim_1': 1024, 'hidden_dim_2': 64, 'kl_weight': 0.00018476822159615858, 'lr': 0.004043342073186754, 'batch_size': 64, 'dropout_rate': 0.20003442892214954, 'prior_mu': 0.00634828946510042, 'prior_sigma': 0.09146637715711999, 'normalization': 'layer'}. Best is trial 455 with value: 0.46377224922180177.
Generating morgan_rdkit fingerprints...
Generated fingerprints with 2048 features for 841 molecules
Trial 457: 5-fold CV loss = 0.4691
[I 2025-08-07 18:33:07,562] Trial 457 finished with value: 0.4690936625003815 and parameters: {'fp_type': 'morgan_rdkit', 'combined_morgan_radius': 2, 'combined_morgan_nBits': 1024, 'combined_rdkit_maxPath': 7, 'combined_rdkit_nBits': 1024, 'num_hidden_layers': 3, 'hidden_dim_0': 256, 'hidden_dim_1': 1024, 'hidden_dim_2': 64, 'kl_weight': 0.0002262135681262901, 'lr': 0.0038854527586835936, 'batch_size': 32, 'dropout_rate': 0.19789139552410154, 'prior_mu': 0.01988864028889345, 'prior_sigma': 0.0683351202768725, 'normalization': 'layer'}. Best is trial 455 with value: 0.46377224922180177.
Generating morgan_rdkit fingerprints...
Generated fingerprints with 2048 features for 841 molecules
Trial 459: 5-fold CV loss = 0.4717
[I 2025-08-07 18:33:20,841] Trial 459 finished with value: 0.4716882348060608 and parameters: {'fp_type': 'morgan_rdkit', 'combined_morgan_radius': 2, 'combined_morgan_nBits': 1024, 'combined_rdkit_maxPath': 7, 'combined_rdkit_nBits': 1024, 'num_hidden_layers': 3, 'hidden_dim_0': 256, 'hidden_dim_1': 1024, 'hidden_dim_2': 64, 'kl_weight': 0.00025109085448745907, 'lr': 0.004764771141555344, 'batch_size': 128, 'dropout_rate': 0.1989132476868649, 'prior_mu': 0.0036564913340430306, 'prior_sigma': 0.03913252703954146, 'normalization': 'layer'}. Best is trial 455 with value: 0.46377224922180177.
Generating morgan_rdkit fingerprints...
Generated fingerprints with 2048 features for 841 molecules
Trial 460: 5-fold CV loss = 0.5370
[I 2025-08-07 18:33:36,462] Trial 460 finished with value: 0.5369878649711609 and parameters: {'fp_type': 'morgan', 'morgan_only_radius': 3, 'morgan_only_nBits': 1024, 'num_hidden_layers': 3, 'hidden_dim_0': 256, 'hidden_dim_1': 1024, 'hidden_dim_2': 64, 'kl_weight': 0.0002106233133153566, 'lr': 0.0043135653702843935, 'batch_size': 128, 'dropout_rate': 0.2057367726697235, 'prior_mu': 0.006441231688070868, 'prior_sigma': 0.09655829503351417, 'normalization': 'layer'}. Best is trial 455 with value: 0.46377224922180177.
Generating morgan_rdkit fingerprints...
Generated fingerprints with 2048 features for 841 molecules
Trial 461: 5-fold CV loss = 0.4651
[I 2025-08-07 18:33:37,616] Trial 461 finished with value: 0.46505858898162844 and parameters: {'fp_type': 'morgan_rdkit', 'combined_morgan_radius': 2, 'combined_morgan_nBits': 1024, 'combined_rdkit_maxPath': 7, 'combined_rdkit_nBits': 1024, 'num_hidden_layers': 3, 'hidden_dim_0': 256, 'hidden_dim_1': 1024, 'hidden_dim_2': 64, 'kl_weight': 0.00021623268074725925, 'lr': 0.0035546211888788227, 'batch_size': 128, 'dropout_rate': 0.20255698188520063, 'prior_mu': 0.02188006298115374, 'prior_sigma': 0.06760701015294543, 'normalization': 'layer'}. Best is trial 455 with value: 0.46377224922180177.
Generating morgan_rdkit fingerprints...
Generated fingerprints with 2048 features for 841 molecules
Trial 462: 5-fold CV loss = 0.6274
[I 2025-08-07 18:33:41,205] Trial 462 finished with value: 0.6274366080760956 and parameters: {'fp_type': 'morgan_rdkit', 'combined_morgan_radius': 2, 'combined_morgan_nBits': 1024, 'combined_rdkit_maxPath': 7, 'combined_rdkit_nBits': 1024, 'num_hidden_layers': 3, 'hidden_dim_0': 256, 'hidden_dim_1': 1024, 'hidden_dim_2': 64, 'kl_weight': 0.00021304620997093844, 'lr': 0.004295627149476756, 'batch_size': 128, 'dropout_rate': 0.19231671866245761, 'prior_mu': 0.015432506008892018, 'prior_sigma': 0.08413373228289925, 'normalization': 'layer'}. Best is trial 455 with value: 0.46377224922180177.
Generating morgan_rdkit fingerprints...
Generated fingerprints with 2048 features for 841 molecules
Trial 463: 5-fold CV loss = 0.4744
[I 2025-08-07 18:34:09,617] Trial 463 finished with value: 0.474353963136673 and parameters: {'fp_type': 'morgan_rdkit', 'combined_morgan_radius': 2, 'combined_morgan_nBits': 1024, 'combined_rdkit_maxPath': 7, 'combined_rdkit_nBits': 1024, 'num_hidden_layers': 3, 'hidden_dim_0': 256, 'hidden_dim_1': 1024, 'hidden_dim_2': 64, 'kl_weight': 0.00022456557337399634, 'lr': 0.005246746877832169, 'batch_size': 128, 'dropout_rate': 0.19276769592176096, 'prior_mu': 0.006399992265535882, 'prior_sigma': 0.06971517908055513, 'normalization': 'layer'}. Best is trial 455 with value: 0.46377224922180177.
Generating morgan_rdkit fingerprints...
Generated fingerprints with 2048 features for 841 molecules
Trial 466: 5-fold CV loss = 0.4705
[I 2025-08-07 18:34:20,572] Trial 466 finished with value: 0.47053098678588867 and parameters: {'fp_type': 'morgan_rdkit', 'combined_morgan_radius': 2, 'combined_morgan_nBits': 1024, 'combined_rdkit_maxPath': 7, 'combined_rdkit_nBits': 1024, 'num_hidden_layers': 3, 'hidden_dim_0': 256, 'hidden_dim_1': 1024, 'hidden_dim_2': 64, 'kl_weight': 0.0002722291505633743, 'lr': 0.004847324530350701, 'batch_size': 128, 'dropout_rate': 0.1878756592777598, 'prior_mu': -0.0006386634700190144, 'prior_sigma': 0.06746685151851758, 'normalization': 'layer'}. Best is trial 455 with value: 0.46377224922180177.
Generating morgan_rdkit fingerprints...
Generated fingerprints with 2048 features for 841 molecules
Trial 465: 5-fold CV loss = 0.4675
