[I 2025-08-07 19:05:23,659] Trial 615 finished with value: 0.4724273681640625 and parameters: {'fp_type': 'morgan_rdkit', 'combined_morgan_radius': 3, 'combined_morgan_nBits': 1024, 'combined_rdkit_maxPath': 7, 'combined_rdkit_nBits': 1024, 'num_hidden_layers': 3, 'hidden_dim_0': 128, 'hidden_dim_1': 1024, 'hidden_dim_2': 128, 'kl_weight': 0.00042690725132968804, 'lr': 0.007783084990316436, 'batch_size': 128, 'dropout_rate': 0.14876211561322236, 'prior_mu': -0.03101348592640262, 'prior_sigma': 0.09617566421380745, 'normalization': 'layer'}. Best is trial 587 with value: 0.4552353322505951.
Generating morgan_rdkit fingerprints...
Generated fingerprints with 1536 features for 841 molecules
Trial 616: 5-fold CV loss = 0.4871
[I 2025-08-07 19:05:45,874] Trial 616 finished with value: 0.48708739280700686 and parameters: {'fp_type': 'morgan_rdkit', 'combined_morgan_radius': 3, 'combined_morgan_nBits': 1024, 'combined_rdkit_maxPath': 7, 'combined_rdkit_nBits': 512, 'num_hidden_layers': 3, 'hidden_dim_0': 256, 'hidden_dim_1': 1024, 'hidden_dim_2': 64, 'kl_weight': 0.00042699746527954176, 'lr': 0.007916393592027459, 'batch_size': 128, 'dropout_rate': 0.15239732734106867, 'prior_mu': -0.03054051992720823, 'prior_sigma': 0.09673682227526964, 'normalization': 'layer'}. Best is trial 587 with value: 0.4552353322505951.
Generating morgan_rdkit fingerprints...
Generated fingerprints with 2048 features for 841 molecules
Trial 619: 5-fold CV loss = 0.6466
[I 2025-08-07 19:05:54,922] Trial 619 finished with value: 0.646611875295639 and parameters: {'fp_type': 'morgan_rdkit', 'combined_morgan_radius': 3, 'combined_morgan_nBits': 1024, 'combined_rdkit_maxPath': 7, 'combined_rdkit_nBits': 512, 'num_hidden_layers': 3, 'hidden_dim_0': 256, 'hidden_dim_1': 128, 'hidden_dim_2': 256, 'kl_weight': 0.0004932880585053245, 'lr': 0.007981803841524106, 'batch_size': 128, 'dropout_rate': 0.1514320576450973, 'prior_mu': -0.052105302171411655, 'prior_sigma': 0.05723140677585099, 'normalization': 'layer'}. Best is trial 587 with value: 0.4552353322505951.
Generating morgan_rdkit fingerprints...
Generated fingerprints with 2048 features for 841 molecules
Trial 618: 5-fold CV loss = 0.4719
[I 2025-08-07 19:06:07,145] Trial 618 finished with value: 0.4719219386577606 and parameters: {'fp_type': 'morgan_rdkit', 'combined_morgan_radius': 3, 'combined_morgan_nBits': 1024, 'combined_rdkit_maxPath': 7, 'combined_rdkit_nBits': 1024, 'num_hidden_layers': 3, 'hidden_dim_0': 128, 'hidden_dim_1': 128, 'hidden_dim_2': 128, 'kl_weight': 0.0005494978375462257, 'lr': 0.007895428888146042, 'batch_size': 128, 'dropout_rate': 0.15076421760521166, 'prior_mu': -0.030250864830795976, 'prior_sigma': 0.05803241233096425, 'normalization': 'layer'}. Best is trial 587 with value: 0.4552353322505951.
Generating morgan_rdkit fingerprints...
Generated fingerprints with 2048 features for 841 molecules
Trial 617: 5-fold CV loss = 0.6608
[I 2025-08-07 19:06:14,639] Trial 617 finished with value: 0.6608331263065338 and parameters: {'fp_type': 'morgan_rdkit', 'combined_morgan_radius': 3, 'combined_morgan_nBits': 1024, 'combined_rdkit_maxPath': 7, 'combined_rdkit_nBits': 512, 'num_hidden_layers': 3, 'hidden_dim_0': 128, 'hidden_dim_1': 1024, 'hidden_dim_2': 64, 'kl_weight': 0.000910250614738311, 'lr': 0.009089645762317527, 'batch_size': 128, 'dropout_rate': 0.1506974362509632, 'prior_mu': -0.04052180180255201, 'prior_sigma': 0.09705055147401026, 'normalization': 'layer'}. Best is trial 587 with value: 0.4552353322505951.
Generating morgan_rdkit fingerprints...
Generated fingerprints with 2048 features for 841 molecules
Trial 620: 5-fold CV loss = 0.4662
[I 2025-08-07 19:06:30,104] Trial 620 finished with value: 0.4661778748035431 and parameters: {'fp_type': 'morgan_rdkit', 'combined_morgan_radius': 3, 'combined_morgan_nBits': 1024, 'combined_rdkit_maxPath': 7, 'combined_rdkit_nBits': 1024, 'num_hidden_layers': 3, 'hidden_dim_0': 256, 'hidden_dim_1': 128, 'hidden_dim_2': 128, 'kl_weight': 0.0005438371110769308, 'lr': 0.0072083981499390295, 'batch_size': 128, 'dropout_rate': 0.13508742484443034, 'prior_mu': -0.05134983451690341, 'prior_sigma': 0.058395283033111506, 'normalization': 'layer'}. Best is trial 587 with value: 0.4552353322505951.
Generating morgan_rdkit fingerprints...
Generated fingerprints with 2048 features for 841 molecules
Trial 621: 5-fold CV loss = 0.5551
[I 2025-08-07 19:06:31,177] Trial 621 finished with value: 0.5550938129425049 and parameters: {'fp_type': 'morgan_rdkit', 'combined_morgan_radius': 3, 'combined_morgan_nBits': 1024, 'combined_rdkit_maxPath': 7, 'combined_rdkit_nBits': 1024, 'num_hidden_layers': 3, 'hidden_dim_0': 256, 'hidden_dim_1': 1024, 'hidden_dim_2': 128, 'kl_weight': 0.0005735370744620812, 'lr': 0.007254525265206583, 'batch_size': 128, 'dropout_rate': 0.13525351714819212, 'prior_mu': -0.040862384993547496, 'prior_sigma': 0.08946951356937691, 'normalization': 'layer'}. Best is trial 587 with value: 0.4552353322505951.
Generating morgan_rdkit fingerprints...
Generated fingerprints with 2048 features for 841 molecules
Trial 622: 5-fold CV loss = 0.5419
[I 2025-08-07 19:07:01,654] Trial 622 finished with value: 0.5419057667255401 and parameters: {'fp_type': 'morgan_rdkit', 'combined_morgan_radius': 3, 'combined_morgan_nBits': 1024, 'combined_rdkit_maxPath': 7, 'combined_rdkit_nBits': 1024, 'num_hidden_layers': 3, 'hidden_dim_0': 256, 'hidden_dim_1': 1024, 'hidden_dim_2': 128, 'kl_weight': 0.0005855308742807325, 'lr': 0.007139216193053838, 'batch_size': 128, 'dropout_rate': 0.14139751433327763, 'prior_mu': -0.045666491271225865, 'prior_sigma': 0.09007943091065805, 'normalization': 'layer'}. Best is trial 587 with value: 0.4552353322505951.
Generating morgan_rdkit fingerprints...
Generated fingerprints with 2048 features for 841 molecules
Trial 625: 5-fold CV loss = 0.4668
[I 2025-08-07 19:07:06,284] Trial 625 finished with value: 0.4667961776256561 and parameters: {'fp_type': 'morgan_rdkit', 'combined_morgan_radius': 3, 'combined_morgan_nBits': 1024, 'combined_rdkit_maxPath': 7, 'combined_rdkit_nBits': 1024, 'num_hidden_layers': 3, 'hidden_dim_0': 256, 'hidden_dim_1': 1024, 'hidden_dim_2': 64, 'kl_weight': 0.0006590559870882325, 'lr': 0.008622189330439246, 'batch_size': 128, 'dropout_rate': 0.1606405810797023, 'prior_mu': -0.027183657210228973, 'prior_sigma': 0.0849518660589058, 'normalization': 'layer'}. Best is trial 587 with value: 0.4552353322505951.
Generating morgan_rdkit fingerprints...
Generated fingerprints with 2048 features for 841 molecules
Trial 624: 5-fold CV loss = 0.4680
[I 2025-08-07 19:07:17,691] Trial 624 finished with value: 0.4680402874946594 and parameters: {'fp_type': 'morgan_rdkit', 'combined_morgan_radius': 3, 'combined_morgan_nBits': 1024, 'combined_rdkit_maxPath': 7, 'combined_rdkit_nBits': 1024, 'num_hidden_layers': 3, 'hidden_dim_0': 256, 'hidden_dim_1': 1024, 'hidden_dim_2': 128, 'kl_weight': 0.0006567185299043472, 'lr': 0.008491757630965012, 'batch_size': 128, 'dropout_rate': 0.13828540241599827, 'prior_mu': -0.040297477012279724, 'prior_sigma': 0.08997761305982277, 'normalization': 'layer'}. Best is trial 587 with value: 0.4552353322505951.
Generating morgan_rdkit fingerprints...
Generated fingerprints with 2048 features for 841 molecules
Trial 627: 5-fold CV loss = 0.8366
[I 2025-08-07 19:07:25,390] Trial 627 finished with value: 0.8366304874420166 and parameters: {'fp_type': 'morgan_rdkit', 'combined_morgan_radius': 3, 'combined_morgan_nBits': 1024, 'combined_rdkit_maxPath': 7, 'combined_rdkit_nBits': 1024, 'num_hidden_layers': 3, 'hidden_dim_0': 256, 'hidden_dim_1': 1024, 'hidden_dim_2': 1024, 'kl_weight': 0.0004449500187437366, 'lr': 0.008351709858463037, 'batch_size': 128, 'dropout_rate': 0.09534135794682118, 'prior_mu': -0.03475498565180729, 'prior_sigma': 0.09181763155694427, 'normalization': 'layer'}. Best is trial 587 with value: 0.4552353322505951.
Generating morgan_rdkit fingerprints...
Generated fingerprints with 2048 features for 841 molecules
Trial 623: 5-fold CV loss = 0.5574
[I 2025-08-07 19:07:32,203] Trial 623 finished with value: 0.5574488341808319 and parameters: {'fp_type': 'morgan_rdkit', 'combined_morgan_radius': 3, 'combined_morgan_nBits': 1024, 'combined_rdkit_maxPath': 7, 'combined_rdkit_nBits': 1024, 'num_hidden_layers': 3, 'hidden_dim_0': 256, 'hidden_dim_1': 1024, 'hidden_dim_2': 128, 'kl_weight': 0.0005621057266482661, 'lr': 0.007133713817895178, 'batch_size': 128, 'dropout_rate': 0.1346428842095129, 'prior_mu': -0.04324910006414753, 'prior_sigma': 0.09161817079417027, 'normalization': 'layer'}. Best is trial 587 with value: 0.4552353322505951.
Generating morgan_rdkit fingerprints...
Generated fingerprints with 2048 features for 841 molecules
Trial 628: 5-fold CV loss = 0.8332
[I 2025-08-07 19:07:39,533] Trial 628 finished with value: 0.8332374691963196 and parameters: {'fp_type': 'morgan_rdkit', 'combined_morgan_radius': 3, 'combined_morgan_nBits': 1024, 'combined_rdkit_maxPath': 7, 'combined_rdkit_nBits': 1024, 'num_hidden_layers': 3, 'hidden_dim_0': 256, 'hidden_dim_1': 1024, 'hidden_dim_2': 1024, 'kl_weight': 0.00043097192854525907, 'lr': 0.0075303845293077645, 'batch_size': 128, 'dropout_rate': 0.159706714744982, 'prior_mu': -0.031776746151953535, 'prior_sigma': 0.09362111553438386, 'normalization': 'layer'}. Best is trial 587 with value: 0.4552353322505951.
Generating morgan_rdkit fingerprints...
Generated fingerprints with 2048 features for 841 molecules
Trial 626: 5-fold CV loss = 0.4735
[I 2025-08-07 19:07:50,207] Trial 626 finished with value: 0.4734620928764343 and parameters: {'fp_type': 'morgan_rdkit', 'combined_morgan_radius': 3, 'combined_morgan_nBits': 1024, 'combined_rdkit_maxPath': 7, 'combined_rdkit_nBits': 1024, 'num_hidden_layers': 3, 'hidden_dim_0': 256, 'hidden_dim_1': 1024, 'hidden_dim_2': 64, 'kl_weight': 0.0006622652613754839, 'lr': 0.009995542231401469, 'batch_size': 128, 'dropout_rate': 0.15828292673721522, 'prior_mu': -0.02852157411060129, 'prior_sigma': 0.08454889929753792, 'normalization': 'layer'}. Best is trial 587 with value: 0.4552353322505951.
Generating morgan_rdkit fingerprints...
Generated fingerprints with 2048 features for 841 molecules
Trial 629: 5-fold CV loss = 0.4799
[I 2025-08-07 19:08:00,206] Trial 629 finished with value: 0.4799000322818756 and parameters: {'fp_type': 'morgan_rdkit', 'combined_morgan_radius': 3, 'combined_morgan_nBits': 1024, 'combined_rdkit_maxPath': 6, 'combined_rdkit_nBits': 1024, 'num_hidden_layers': 3, 'hidden_dim_0': 256, 'hidden_dim_1': 1024, 'hidden_dim_2': 64, 'kl_weight': 0.0004019843192567735, 'lr': 0.007624940448013089, 'batch_size': 128, 'dropout_rate': 0.16066067766239472, 'prior_mu': -0.06191863213190968, 'prior_sigma': 0.10379538688860136, 'normalization': 'layer'}. Best is trial 587 with value: 0.4552353322505951.
Generating morgan_rdkit fingerprints...
Generated fingerprints with 2048 features for 841 molecules
Trial 631: 5-fold CV loss = 0.4728
[I 2025-08-07 19:08:15,350] Trial 631 finished with value: 0.4727695047855377 and parameters: {'fp_type': 'morgan_rdkit', 'combined_morgan_radius': 3, 'combined_morgan_nBits': 1024, 'combined_rdkit_maxPath': 6, 'combined_rdkit_nBits': 1024, 'num_hidden_layers': 3, 'hidden_dim_0': 256, 'hidden_dim_1': 1024, 'hidden_dim_2': 64, 'kl_weight': 0.0003948556363313443, 'lr': 0.009328863201649013, 'batch_size': 128, 'dropout_rate': 0.14698499945772653, 'prior_mu': -0.02761548192193703, 'prior_sigma': 0.08491057258235118, 'normalization': 'layer'}. Best is trial 587 with value: 0.4552353322505951.
Generating morgan_rdkit fingerprints...
Generated fingerprints with 2048 features for 841 molecules
Trial 633: 5-fold CV loss = 0.7161
[I 2025-08-07 19:08:33,817] Trial 633 finished with value: 0.7160546004772186 and parameters: {'fp_type': 'morgan_rdkit', 'combined_morgan_radius': 3, 'combined_morgan_nBits': 1024, 'combined_rdkit_maxPath': 7, 'combined_rdkit_nBits': 1024, 'num_hidden_layers': 3, 'hidden_dim_0': 256, 'hidden_dim_1': 1024, 'hidden_dim_2': 512, 'kl_weight': 0.00048283865634353494, 'lr': 0.008633525677553365, 'batch_size': 128, 'dropout_rate': 0.11648793961745867, 'prior_mu': -0.02598781312941306, 'prior_sigma': 0.09866572849949128, 'normalization': 'layer'}. Best is trial 587 with value: 0.4552353322505951.
Generating morgan_rdkit fingerprints...
Generated fingerprints with 2048 features for 841 molecules
Trial 630: 5-fold CV loss = 0.4853
[I 2025-08-07 19:08:40,739] Trial 630 finished with value: 0.48534372448921204 and parameters: {'fp_type': 'morgan_rdkit', 'combined_morgan_radius': 3, 'combined_morgan_nBits': 1024, 'combined_rdkit_maxPath': 6, 'combined_rdkit_nBits': 1024, 'num_hidden_layers': 3, 'hidden_dim_0': 256, 'hidden_dim_1': 1024, 'hidden_dim_2': 64, 'kl_weight': 0.0004120794507722323, 'lr': 0.009809890350261469, 'batch_size': 128, 'dropout_rate': 0.1599193016141552, 'prior_mu': -0.029156321989228996, 'prior_sigma': 0.08315023996795003, 'normalization': 'layer'}. Best is trial 587 with value: 0.4552353322505951.
Generating morgan_rdkit fingerprints...
Generated fingerprints with 2048 features for 841 molecules
Trial 632: 5-fold CV loss = 0.4704
[I 2025-08-07 19:08:47,176] Trial 632 finished with value: 0.47039291858673093 and parameters: {'fp_type': 'morgan_rdkit', 'combined_morgan_radius': 3, 'combined_morgan_nBits': 1024, 'combined_rdkit_maxPath': 7, 'combined_rdkit_nBits': 1024, 'num_hidden_layers': 3, 'hidden_dim_0': 1024, 'hidden_dim_1': 1024, 'hidden_dim_2': 64, 'kl_weight': 0.00038175729924136203, 'lr': 0.009041763351482622, 'batch_size': 128, 'dropout_rate': 0.10761414607569018, 'prior_mu': -0.053792223070428885, 'prior_sigma': 0.09779729356761581, 'normalization': 'layer'}. Best is trial 587 with value: 0.4552353322505951.
Generating morgan_rdkit fingerprints...
Generated fingerprints with 2048 features for 841 molecules
Trial 634: 5-fold CV loss = 0.7239
[I 2025-08-07 19:08:52,282] Trial 634 finished with value: 0.7239179313182831 and parameters: {'fp_type': 'morgan_rdkit', 'combined_morgan_radius': 3, 'combined_morgan_nBits': 1024, 'combined_rdkit_maxPath': 7, 'combined_rdkit_nBits': 1024, 'num_hidden_layers': 3, 'hidden_dim_0': 1024, 'hidden_dim_1': 1024, 'hidden_dim_2': 512, 'kl_weight': 0.00046769915487968966, 'lr': 0.008629808432174205, 'batch_size': 128, 'dropout_rate': 0.11413001875769817, 'prior_mu': -0.05150459392639013, 'prior_sigma': 0.09766087741101565, 'normalization': 'layer'}. Best is trial 587 with value: 0.4552353322505951.
Generating morgan_rdkit fingerprints...
Generated fingerprints with 2048 features for 841 molecules
Trial 635: 5-fold CV loss = 0.5099
[I 2025-08-07 19:09:32,145] Trial 635 finished with value: 0.5099335670471191 and parameters: {'fp_type': 'morgan_rdkit', 'combined_morgan_radius': 3, 'combined_morgan_nBits': 1024, 'combined_rdkit_maxPath': 7, 'combined_rdkit_nBits': 1024, 'num_hidden_layers': 3, 'hidden_dim_0': 1024, 'hidden_dim_1': 64, 'hidden_dim_2': 64, 'kl_weight': 0.0003791238468768352, 'lr': 0.008076855341428792, 'batch_size': 128, 'dropout_rate': 0.14560195166671902, 'prior_mu': -0.05130783987245798, 'prior_sigma': 0.0954320384158624, 'normalization': 'none'}. Best is trial 587 with value: 0.4552353322505951.
Generating morgan_rdkit fingerprints...
Generated fingerprints with 2048 features for 841 molecules
Trial 638: 5-fold CV loss = 0.6395
[I 2025-08-07 19:09:35,416] Trial 638 finished with value: 0.6394739270210266 and parameters: {'fp_type': 'morgan_rdkit', 'combined_morgan_radius': 3, 'combined_morgan_nBits': 1024, 'combined_rdkit_maxPath': 7, 'combined_rdkit_nBits': 1024, 'num_hidden_layers': 3, 'hidden_dim_0': 256, 'hidden_dim_1': 1024, 'hidden_dim_2': 64, 'kl_weight': 0.0003733808026897276, 'lr': 0.007015222349339815, 'batch_size': 128, 'dropout_rate': 0.14423218840534066, 'prior_mu': -0.03588078020638641, 'prior_sigma': 0.0941154755225689, 'normalization': 'none'}. Best is trial 587 with value: 0.4552353322505951.
Generating morgan_rdkit fingerprints...
Generated fingerprints with 2048 features for 841 molecules
Trial 637: 5-fold CV loss = 0.5481
[I 2025-08-07 19:09:39,895] Trial 637 finished with value: 0.5480913281440735 and parameters: {'fp_type': 'morgan_rdkit', 'combined_morgan_radius': 3, 'combined_morgan_nBits': 1024, 'combined_rdkit_maxPath': 7, 'combined_rdkit_nBits': 1024, 'num_hidden_layers': 3, 'hidden_dim_0': 256, 'hidden_dim_1': 64, 'hidden_dim_2': 64, 'kl_weight': 0.00048566291438494844, 'lr': 0.007999756128828769, 'batch_size': 128, 'dropout_rate': 0.14491875892141792, 'prior_mu': -0.03833495059445226, 'prior_sigma': 0.10460397745375181, 'normalization': 'none'}. Best is trial 587 with value: 0.4552353322505951.
Generating morgan fingerprints...
Generated fingerprints with 2048 features for 841 molecules
Trial 639: 5-fold CV loss = 0.4841
[I 2025-08-07 19:10:01,649] Trial 639 finished with value: 0.4841110646724701 and parameters: {'fp_type': 'morgan_rdkit', 'combined_morgan_radius': 3, 'combined_morgan_nBits': 1024, 'combined_rdkit_maxPath': 5, 'combined_rdkit_nBits': 1024, 'num_hidden_layers': 3, 'hidden_dim_0': 256, 'hidden_dim_1': 1024, 'hidden_dim_2': 64, 'kl_weight': 0.00030982805523902234, 'lr': 0.007147467329979385, 'batch_size': 128, 'dropout_rate': 0.13309487819354426, 'prior_mu': -0.03667903391031141, 'prior_sigma': 0.10411845974331539, 'normalization': 'layer'}. Best is trial 587 with value: 0.4552353322505951.
Generating morgan fingerprints...
Generated fingerprints with 2048 features for 841 molecules
Trial 641: 5-fold CV loss = 0.5255
[I 2025-08-07 19:10:09,212] Trial 641 finished with value: 0.525496369600296 and parameters: {'fp_type': 'morgan', 'morgan_only_radius': 3, 'morgan_only_nBits': 2048, 'num_hidden_layers': 3, 'hidden_dim_0': 256, 'hidden_dim_1': 1024, 'hidden_dim_2': 64, 'kl_weight': 0.00030395625234584856, 'lr': 0.007077821877273666, 'batch_size': 128, 'dropout_rate': 0.13192882587146082, 'prior_mu': -0.022502663206850772, 'prior_sigma': 0.08774567962927576, 'normalization': 'layer'}. Best is trial 587 with value: 0.4552353322505951.
Generating morgan_rdkit fingerprints...
Generated fingerprints with 2048 features for 841 molecules
Trial 636: 5-fold CV loss = 0.6495
[I 2025-08-07 19:10:17,352] Trial 636 finished with value: 0.6494853258132934 and parameters: {'fp_type': 'morgan_rdkit', 'combined_morgan_radius': 3, 'combined_morgan_nBits': 1024, 'combined_rdkit_maxPath': 7, 'combined_rdkit_nBits': 1024, 'num_hidden_layers': 3, 'hidden_dim_0': 1024, 'hidden_dim_1': 1024, 'hidden_dim_2': 64, 'kl_weight': 0.00036082995987814356, 'lr': 0.008172791736100003, 'batch_size': 128, 'dropout_rate': 0.14472236110837222, 'prior_mu': -0.0544985257212795, 'prior_sigma': 0.09598720605449713, 'normalization': 'none'}. Best is trial 587 with value: 0.4552353322505951.
Generating morgan_rdkit fingerprints...
Generated fingerprints with 2048 features for 841 molecules
Trial 640: 5-fold CV loss = 0.4647
[I 2025-08-07 19:10:20,732] Trial 640 finished with value: 0.4646841764450073 and parameters: {'fp_type': 'morgan_rdkit', 'combined_morgan_radius': 3, 'combined_morgan_nBits': 1024, 'combined_rdkit_maxPath': 7, 'combined_rdkit_nBits': 1024, 'num_hidden_layers': 3, 'hidden_dim_0': 256, 'hidden_dim_1': 1024, 'hidden_dim_2': 64, 'kl_weight': 0.0003076424775968172, 'lr': 0.007331628256314335, 'batch_size': 128, 'dropout_rate': 0.13069449905762312, 'prior_mu': -0.022479298570105617, 'prior_sigma': 0.089746134031605, 'normalization': 'layer'}. Best is trial 587 with value: 0.4552353322505951.
Generating morgan_rdkit fingerprints...
Generated fingerprints with 2048 features for 841 molecules
Trial 642: 5-fold CV loss = 0.5257
[I 2025-08-07 19:10:26,128] Trial 642 finished with value: 0.5257499277591705 and parameters: {'fp_type': 'morgan', 'morgan_only_radius': 3, 'morgan_only_nBits': 2048, 'num_hidden_layers': 3, 'hidden_dim_0': 256, 'hidden_dim_1': 1024, 'hidden_dim_2': 64, 'kl_weight': 0.0002980906906386099, 'lr': 0.007689450144846384, 'batch_size': 128, 'dropout_rate': 0.16829374432759206, 'prior_mu': -0.025185245381306585, 'prior_sigma': 0.08763654548577023, 'normalization': 'layer'}. Best is trial 587 with value: 0.4552353322505951.
Generating morgan_rdkit fingerprints...
Generated fingerprints with 2048 features for 841 molecules
Trial 643: 5-fold CV loss = 0.8751
[I 2025-08-07 19:10:41,017] Trial 643 finished with value: 0.8750852942466736 and parameters: {'fp_type': 'morgan_rdkit', 'combined_morgan_radius': 3, 'combined_morgan_nBits': 1024, 'combined_rdkit_maxPath': 7, 'combined_rdkit_nBits': 1024, 'num_hidden_layers': 3, 'hidden_dim_0': 256, 'hidden_dim_1': 1024, 'hidden_dim_2': 64, 'kl_weight': 0.00027648237928309624, 'lr': 0.0004879664173428676, 'batch_size': 128, 'dropout_rate': 0.1732165440902396, 'prior_mu': -0.023785157795378396, 'prior_sigma': 0.09032042669630774, 'normalization': 'layer'}. Best is trial 587 with value: 0.4552353322505951.
Generating morgan_rdkit fingerprints...
Generated fingerprints with 2048 features for 841 molecules
Trial 646: 5-fold CV loss = 0.4737
[I 2025-08-07 19:11:00,618] Trial 646 finished with value: 0.4737305223941803 and parameters: {'fp_type': 'morgan_rdkit', 'combined_morgan_radius': 3, 'combined_morgan_nBits': 1024, 'combined_rdkit_maxPath': 7, 'combined_rdkit_nBits': 1024, 'num_hidden_layers': 3, 'hidden_dim_0': 256, 'hidden_dim_1': 1024, 'hidden_dim_2': 64, 'kl_weight': 0.00043653194106697043, 'lr': 0.006707289988445823, 'batch_size': 128, 'dropout_rate': 0.17563873277828937, 'prior_mu': -0.04277903461606712, 'prior_sigma': 0.08178809605260053, 'normalization': 'layer'}. Best is trial 587 with value: 0.4552353322505951.
Generating morgan_rdkit fingerprints...
Generated fingerprints with 2048 features for 841 molecules
Trial 645: 5-fold CV loss = 0.4655
