[I 2025-08-08 01:32:34,871] Trial 2566 finished with value: 0.5658107042312622 and parameters: {'fp_type': 'rdkit', 'rdkit_only_maxPath': 6, 'rdkit_only_nBits': 512, 'num_hidden_layers': 3, 'hidden_dim_0': 256, 'hidden_dim_1': 1024, 'hidden_dim_2': 64, 'kl_weight': 0.001431176374158019, 'lr': 0.006530683349708752, 'batch_size': 128, 'dropout_rate': 0.07207344905683553, 'prior_mu': -0.011418247161583718, 'prior_sigma': 0.0892167709940699, 'normalization': 'layer'}. Best is trial 896 with value: 0.4533553242683411.
Generating morgan_rdkit fingerprints...
Generated fingerprints with 2048 features for 841 molecules
Trial 2559: 5-fold CV loss = 0.5550
[I 2025-08-08 01:32:44,494] Trial 2559 finished with value: 0.5549538552761077 and parameters: {'fp_type': 'morgan_rdkit', 'combined_morgan_radius': 3, 'combined_morgan_nBits': 1024, 'combined_rdkit_maxPath': 7, 'combined_rdkit_nBits': 1024, 'num_hidden_layers': 3, 'hidden_dim_0': 1024, 'hidden_dim_1': 1024, 'hidden_dim_2': 512, 'kl_weight': 0.0005046383590877805, 'lr': 0.006001588384180783, 'batch_size': 64, 'dropout_rate': 0.10689326783108805, 'prior_mu': -0.02735324550272923, 'prior_sigma': 0.07973709537691631, 'normalization': 'layer'}. Best is trial 896 with value: 0.4533553242683411.
Generating morgan_rdkit fingerprints...
Generated fingerprints with 2048 features for 841 molecules
Trial 2568: 5-fold CV loss = 0.8036
[I 2025-08-08 01:33:01,132] Trial 2568 finished with value: 0.8036266088485717 and parameters: {'fp_type': 'morgan_rdkit', 'combined_morgan_radius': 3, 'combined_morgan_nBits': 1024, 'combined_rdkit_maxPath': 8, 'combined_rdkit_nBits': 1024, 'num_hidden_layers': 3, 'hidden_dim_0': 256, 'hidden_dim_1': 1024, 'hidden_dim_2': 64, 'kl_weight': 0.0004006272952786403, 'lr': 0.00997625043908758, 'batch_size': 128, 'dropout_rate': 0.0742360322283518, 'prior_mu': -0.01713676282377018, 'prior_sigma': 0.11022350458295276, 'normalization': 'none'}. Best is trial 896 with value: 0.4533553242683411.
Generating morgan_rdkit fingerprints...
Generated fingerprints with 2048 features for 841 molecules
Trial 2569: 5-fold CV loss = 0.6666
[I 2025-08-08 01:33:07,364] Trial 2569 finished with value: 0.6665829300880433 and parameters: {'fp_type': 'morgan_rdkit', 'combined_morgan_radius': 3, 'combined_morgan_nBits': 1024, 'combined_rdkit_maxPath': 8, 'combined_rdkit_nBits': 1024, 'num_hidden_layers': 3, 'hidden_dim_0': 256, 'hidden_dim_1': 1024, 'hidden_dim_2': 128, 'kl_weight': 0.025147437987992696, 'lr': 0.0059779371940531945, 'batch_size': 128, 'dropout_rate': 0.06310088026279669, 'prior_mu': 0.0006802793190296974, 'prior_sigma': 0.07673114399420948, 'normalization': 'none'}. Best is trial 896 with value: 0.4533553242683411.
Generating morgan_rdkit fingerprints...
Generated fingerprints with 2048 features for 841 molecules
Trial 2567: 5-fold CV loss = 0.5122
[I 2025-08-08 01:33:15,231] Trial 2567 finished with value: 0.5121811389923095 and parameters: {'fp_type': 'rdkit', 'rdkit_only_maxPath': 6, 'rdkit_only_nBits': 512, 'num_hidden_layers': 3, 'hidden_dim_0': 256, 'hidden_dim_1': 1024, 'hidden_dim_2': 128, 'kl_weight': 0.00027257890895141646, 'lr': 0.0064915602874475245, 'batch_size': 128, 'dropout_rate': 0.2335810761335715, 'prior_mu': -0.01837182978376266, 'prior_sigma': 0.07685581822566155, 'normalization': 'layer'}. Best is trial 896 with value: 0.4533553242683411.
Generating morgan_rdkit fingerprints...
Generated fingerprints with 2048 features for 841 molecules
Trial 2572: 5-fold CV loss = 0.4635
[I 2025-08-08 01:33:46,071] Trial 2572 finished with value: 0.46351739168167116 and parameters: {'fp_type': 'morgan_rdkit', 'combined_morgan_radius': 3, 'combined_morgan_nBits': 1024, 'combined_rdkit_maxPath': 7, 'combined_rdkit_nBits': 1024, 'num_hidden_layers': 3, 'hidden_dim_0': 256, 'hidden_dim_1': 1024, 'hidden_dim_2': 64, 'kl_weight': 0.000268883556315193, 'lr': 0.007420783765257771, 'batch_size': 128, 'dropout_rate': 0.08854023713649783, 'prior_mu': -0.020179259889083874, 'prior_sigma': 0.08568668927113983, 'normalization': 'layer'}. Best is trial 896 with value: 0.4533553242683411.
Generating morgan_rdkit fingerprints...
Generated fingerprints with 2048 features for 841 molecules
Trial 2571: 5-fold CV loss = 0.4554
[I 2025-08-08 01:33:55,985] Trial 2571 finished with value: 0.4554311692714691 and parameters: {'fp_type': 'morgan_rdkit', 'combined_morgan_radius': 3, 'combined_morgan_nBits': 1024, 'combined_rdkit_maxPath': 7, 'combined_rdkit_nBits': 1024, 'num_hidden_layers': 3, 'hidden_dim_0': 256, 'hidden_dim_1': 1024, 'hidden_dim_2': 64, 'kl_weight': 0.00025866784209287397, 'lr': 0.007717099796304982, 'batch_size': 128, 'dropout_rate': 0.08939652192444209, 'prior_mu': 0.0005680176876041894, 'prior_sigma': 0.08519650131270136, 'normalization': 'layer'}. Best is trial 896 with value: 0.4533553242683411.
Generating morgan_rdkit fingerprints...
Generated fingerprints with 2048 features for 841 molecules
Trial 2573: 5-fold CV loss = 0.4591
[I 2025-08-08 01:33:59,493] Trial 2573 finished with value: 0.4591019332408905 and parameters: {'fp_type': 'morgan_rdkit', 'combined_morgan_radius': 3, 'combined_morgan_nBits': 1024, 'combined_rdkit_maxPath': 7, 'combined_rdkit_nBits': 1024, 'num_hidden_layers': 3, 'hidden_dim_0': 256, 'hidden_dim_1': 1024, 'hidden_dim_2': 64, 'kl_weight': 0.00025776942020399484, 'lr': 0.007858692821861914, 'batch_size': 128, 'dropout_rate': 0.0877034113015768, 'prior_mu': -0.03389726260270943, 'prior_sigma': 0.08577129968434088, 'normalization': 'layer'}. Best is trial 896 with value: 0.4533553242683411.
Generating morgan_rdkit fingerprints...
Generated fingerprints with 2048 features for 841 molecules
Trial 2570: 5-fold CV loss = 0.5683
[I 2025-08-08 01:34:21,214] Trial 2570 finished with value: 0.5682964980602264 and parameters: {'fp_type': 'morgan_rdkit', 'combined_morgan_radius': 3, 'combined_morgan_nBits': 1024, 'combined_rdkit_maxPath': 8, 'combined_rdkit_nBits': 1024, 'num_hidden_layers': 3, 'hidden_dim_0': 256, 'hidden_dim_1': 1024, 'hidden_dim_2': 128, 'kl_weight': 0.00040015781602995904, 'lr': 0.007370779964355056, 'batch_size': 128, 'dropout_rate': 0.07605611970795587, 'prior_mu': -0.016428534126114436, 'prior_sigma': 0.1112179891848521, 'normalization': 'layer'}. Best is trial 896 with value: 0.4533553242683411.
Generating morgan_rdkit fingerprints...
Generated fingerprints with 2048 features for 841 molecules
Trial 2574: 5-fold CV loss = 0.5648
[I 2025-08-08 01:34:34,660] Trial 2574 finished with value: 0.5648026645183564 and parameters: {'fp_type': 'morgan_rdkit', 'combined_morgan_radius': 3, 'combined_morgan_nBits': 1024, 'combined_rdkit_maxPath': 7, 'combined_rdkit_nBits': 1024, 'num_hidden_layers': 3, 'hidden_dim_0': 256, 'hidden_dim_1': 1024, 'hidden_dim_2': 64, 'kl_weight': 0.0003591180729421071, 'lr': 0.0072807107550536205, 'batch_size': 128, 'dropout_rate': 0.12869320005505563, 'prior_mu': -0.03492783917530078, 'prior_sigma': 0.1751130146375693, 'normalization': 'layer'}. Best is trial 896 with value: 0.4533553242683411.
Generating morgan_rdkit fingerprints...
Generated fingerprints with 2048 features for 841 molecules
Trial 2576: 5-fold CV loss = 0.4736
[I 2025-08-08 01:34:39,911] Trial 2576 finished with value: 0.4735554099082947 and parameters: {'fp_type': 'morgan_rdkit', 'combined_morgan_radius': 2, 'combined_morgan_nBits': 1024, 'combined_rdkit_maxPath': 7, 'combined_rdkit_nBits': 1024, 'num_hidden_layers': 3, 'hidden_dim_0': 256, 'hidden_dim_1': 1024, 'hidden_dim_2': 64, 'kl_weight': 0.00022438059441043102, 'lr': 0.008518843454020498, 'batch_size': 128, 'dropout_rate': 0.03617710882716864, 'prior_mu': 0.011966769356355326, 'prior_sigma': 0.09143070785516788, 'normalization': 'layer'}. Best is trial 896 with value: 0.4533553242683411.
Generating morgan_rdkit fingerprints...
Generated fingerprints with 2048 features for 841 molecules
Trial 2575: 5-fold CV loss = 0.4699
[I 2025-08-08 01:34:55,074] Trial 2575 finished with value: 0.4698643207550049 and parameters: {'fp_type': 'morgan_rdkit', 'combined_morgan_radius': 3, 'combined_morgan_nBits': 1024, 'combined_rdkit_maxPath': 7, 'combined_rdkit_nBits': 1024, 'num_hidden_layers': 3, 'hidden_dim_0': 256, 'hidden_dim_1': 1024, 'hidden_dim_2': 64, 'kl_weight': 0.009001716880595109, 'lr': 0.007941846554736525, 'batch_size': 128, 'dropout_rate': 0.0854706740447804, 'prior_mu': 0.016365989230163292, 'prior_sigma': 0.09056246927655885, 'normalization': 'layer'}. Best is trial 896 with value: 0.4533553242683411.
Generating morgan_rdkit fingerprints...
Generated fingerprints with 2048 features for 841 molecules
Trial 2578: 5-fold CV loss = 0.4712
[I 2025-08-08 01:35:09,481] Trial 2578 finished with value: 0.47122989892959594 and parameters: {'fp_type': 'morgan_rdkit', 'combined_morgan_radius': 2, 'combined_morgan_nBits': 1024, 'combined_rdkit_maxPath': 7, 'combined_rdkit_nBits': 1024, 'num_hidden_layers': 3, 'hidden_dim_0': 256, 'hidden_dim_1': 1024, 'hidden_dim_2': 64, 'kl_weight': 0.00020233485763899436, 'lr': 0.008513500170345642, 'batch_size': 128, 'dropout_rate': 0.09566212291581355, 'prior_mu': -0.15329684524717893, 'prior_sigma': 0.09082729652612984, 'normalization': 'layer'}. Best is trial 896 with value: 0.4533553242683411.
Generating morgan_rdkit fingerprints...
Generated fingerprints with 2048 features for 841 molecules
Trial 2579: 5-fold CV loss = 0.4850
[I 2025-08-08 01:35:16,961] Trial 2579 finished with value: 0.4849775493144989 and parameters: {'fp_type': 'morgan_rdkit', 'combined_morgan_radius': 3, 'combined_morgan_nBits': 1024, 'combined_rdkit_maxPath': 5, 'combined_rdkit_nBits': 1024, 'num_hidden_layers': 3, 'hidden_dim_0': 256, 'hidden_dim_1': 128, 'hidden_dim_2': 64, 'kl_weight': 0.0002007190870436036, 'lr': 0.008257012869441076, 'batch_size': 128, 'dropout_rate': 0.08393085937736129, 'prior_mu': 0.0052349047479002785, 'prior_sigma': 0.09013277786765352, 'normalization': 'layer'}. Best is trial 896 with value: 0.4533553242683411.
Generating morgan_rdkit fingerprints...
Generated fingerprints with 2048 features for 841 molecules
Trial 2581: 5-fold CV loss = 0.4910
[I 2025-08-08 01:35:39,510] Trial 2581 finished with value: 0.4910049378871918 and parameters: {'fp_type': 'morgan_rdkit', 'combined_morgan_radius': 3, 'combined_morgan_nBits': 1024, 'combined_rdkit_maxPath': 5, 'combined_rdkit_nBits': 1024, 'num_hidden_layers': 3, 'hidden_dim_0': 256, 'hidden_dim_1': 128, 'hidden_dim_2': 64, 'kl_weight': 0.00019437271209274477, 'lr': 0.008008422740058018, 'batch_size': 128, 'dropout_rate': 0.08579764547423466, 'prior_mu': 0.0007604776291081632, 'prior_sigma': 0.0947112091431272, 'normalization': 'layer'}. Best is trial 896 with value: 0.4533553242683411.
Generating morgan_rdkit fingerprints...
Generated fingerprints with 2048 features for 841 molecules
Trial 2577: 5-fold CV loss = 0.4701
[I 2025-08-08 01:35:48,020] Trial 2577 finished with value: 0.47011805772781373 and parameters: {'fp_type': 'morgan_rdkit', 'combined_morgan_radius': 3, 'combined_morgan_nBits': 1024, 'combined_rdkit_maxPath': 7, 'combined_rdkit_nBits': 1024, 'num_hidden_layers': 3, 'hidden_dim_0': 256, 'hidden_dim_1': 1024, 'hidden_dim_2': 64, 'kl_weight': 0.00020569342418007674, 'lr': 0.008583527253069106, 'batch_size': 128, 'dropout_rate': 0.08363362187037635, 'prior_mu': 0.015109735865618744, 'prior_sigma': 0.09069422594990423, 'normalization': 'layer'}. Best is trial 896 with value: 0.4533553242683411.
Generating morgan_rdkit fingerprints...
Generated fingerprints with 2048 features for 841 molecules
Trial 2580: 5-fold CV loss = 0.5425
[I 2025-08-08 01:35:50,366] Trial 2580 finished with value: 0.5424986183643341 and parameters: {'fp_type': 'morgan_rdkit', 'combined_morgan_radius': 3, 'combined_morgan_nBits': 1024, 'combined_rdkit_maxPath': 7, 'combined_rdkit_nBits': 1024, 'num_hidden_layers': 3, 'hidden_dim_0': 256, 'hidden_dim_1': 128, 'hidden_dim_2': 64, 'kl_weight': 0.0002369822717023778, 'lr': 0.008399524543613705, 'batch_size': 128, 'dropout_rate': 0.09371639029350524, 'prior_mu': 0.008115341136854939, 'prior_sigma': 0.09518321560282514, 'normalization': 'layer'}. Best is trial 896 with value: 0.4533553242683411.
Generating morgan_rdkit fingerprints...
Generated fingerprints with 2048 features for 841 molecules
Trial 2582: 5-fold CV loss = 0.9270
[I 2025-08-08 01:35:55,853] Trial 2582 finished with value: 0.9269781231880188 and parameters: {'fp_type': 'morgan_rdkit', 'combined_morgan_radius': 3, 'combined_morgan_nBits': 1024, 'combined_rdkit_maxPath': 7, 'combined_rdkit_nBits': 1024, 'num_hidden_layers': 3, 'hidden_dim_0': 256, 'hidden_dim_1': 1024, 'hidden_dim_2': 64, 'kl_weight': 0.00021309164393312245, 'lr': 0.00010027465901623633, 'batch_size': 128, 'dropout_rate': 0.07409925472864587, 'prior_mu': 0.01688268500383807, 'prior_sigma': 0.09567297503900048, 'normalization': 'layer'}. Best is trial 896 with value: 0.4533553242683411.
Generating morgan_rdkit fingerprints...
Generated fingerprints with 2048 features for 841 molecules
Trial 2583: 5-fold CV loss = 0.4602
[I 2025-08-08 01:36:19,287] Trial 2583 finished with value: 0.46023056507110593 and parameters: {'fp_type': 'morgan_rdkit', 'combined_morgan_radius': 3, 'combined_morgan_nBits': 1024, 'combined_rdkit_maxPath': 7, 'combined_rdkit_nBits': 1024, 'num_hidden_layers': 3, 'hidden_dim_0': 256, 'hidden_dim_1': 1024, 'hidden_dim_2': 64, 'kl_weight': 0.000230922085941333, 'lr': 0.00866095437982346, 'batch_size': 128, 'dropout_rate': 0.09582049046663904, 'prior_mu': 0.015681200195867252, 'prior_sigma': 0.09441320678060038, 'normalization': 'layer'}. Best is trial 896 with value: 0.4533553242683411.
Generating morgan_rdkit fingerprints...
Generated fingerprints with 1536 features for 841 molecules
Trial 2586: 5-fold CV loss = 0.4621
[I 2025-08-08 01:36:37,466] Trial 2586 finished with value: 0.4620989918708801 and parameters: {'fp_type': 'morgan_rdkit', 'combined_morgan_radius': 3, 'combined_morgan_nBits': 1024, 'combined_rdkit_maxPath': 7, 'combined_rdkit_nBits': 1024, 'num_hidden_layers': 3, 'hidden_dim_0': 512, 'hidden_dim_1': 1024, 'hidden_dim_2': 64, 'kl_weight': 0.00016842043962382112, 'lr': 0.009225802015282406, 'batch_size': 128, 'dropout_rate': 0.09687419802183335, 'prior_mu': 0.024483793981789747, 'prior_sigma': 0.08721318437751281, 'normalization': 'layer'}. Best is trial 896 with value: 0.4533553242683411.
Generating morgan fingerprints...
Generated fingerprints with 1024 features for 841 molecules
Trial 2585: 5-fold CV loss = 0.4672
[I 2025-08-08 01:36:43,747] Trial 2585 finished with value: 0.46715710759162904 and parameters: {'fp_type': 'morgan_rdkit', 'combined_morgan_radius': 3, 'combined_morgan_nBits': 1024, 'combined_rdkit_maxPath': 7, 'combined_rdkit_nBits': 1024, 'num_hidden_layers': 3, 'hidden_dim_0': 256, 'hidden_dim_1': 1024, 'hidden_dim_2': 64, 'kl_weight': 0.00017117442334417654, 'lr': 0.007603202522354201, 'batch_size': 128, 'dropout_rate': 0.09915152936793141, 'prior_mu': 0.01817967596122118, 'prior_sigma': 0.08741297832731953, 'normalization': 'layer'}. Best is trial 896 with value: 0.4533553242683411.
Generating morgan fingerprints...
Generated fingerprints with 1024 features for 841 molecules
Trial 2584: 5-fold CV loss = 0.4627
[I 2025-08-08 01:37:20,514] Trial 2584 finished with value: 0.46274229884147644 and parameters: {'fp_type': 'morgan_rdkit', 'combined_morgan_radius': 3, 'combined_morgan_nBits': 1024, 'combined_rdkit_maxPath': 7, 'combined_rdkit_nBits': 1024, 'num_hidden_layers': 3, 'hidden_dim_0': 256, 'hidden_dim_1': 1024, 'hidden_dim_2': 64, 'kl_weight': 0.00023971039663797105, 'lr': 0.009112122273947438, 'batch_size': 128, 'dropout_rate': 0.09400877671486293, 'prior_mu': 0.018040533856778736, 'prior_sigma': 0.0950427159364734, 'normalization': 'layer'}. Best is trial 896 with value: 0.4533553242683411.
Generating morgan_rdkit fingerprints...
Generated fingerprints with 1536 features for 841 molecules
Trial 2587: 5-fold CV loss = 0.4651
[I 2025-08-08 01:37:21,693] Trial 2587 finished with value: 0.4650870680809021 and parameters: {'fp_type': 'morgan_rdkit', 'combined_morgan_radius': 3, 'combined_morgan_nBits': 512, 'combined_rdkit_maxPath': 7, 'combined_rdkit_nBits': 1024, 'num_hidden_layers': 3, 'hidden_dim_0': 256, 'hidden_dim_1': 1024, 'hidden_dim_2': 64, 'kl_weight': 0.0001605013730340978, 'lr': 0.00767627086532732, 'batch_size': 32, 'dropout_rate': 0.09797061716623251, 'prior_mu': 0.0013801925173124799, 'prior_sigma': 0.08749313916153222, 'normalization': 'layer'}. Best is trial 896 with value: 0.4533553242683411.
Generating morgan_rdkit fingerprints...
Generated fingerprints with 2048 features for 841 molecules
Trial 2588: 5-fold CV loss = 0.5191
[I 2025-08-08 01:37:36,942] Trial 2588 finished with value: 0.5191082894802094 and parameters: {'fp_type': 'morgan', 'morgan_only_radius': 2, 'morgan_only_nBits': 1024, 'num_hidden_layers': 3, 'hidden_dim_0': 256, 'hidden_dim_1': 1024, 'hidden_dim_2': 64, 'kl_weight': 0.00024946544630981797, 'lr': 0.007693011277881233, 'batch_size': 32, 'dropout_rate': 0.06227880615683828, 'prior_mu': 0.0024354290990522207, 'prior_sigma': 0.08568588765324836, 'normalization': 'layer'}. Best is trial 896 with value: 0.4533553242683411.
Generating morgan_rdkit fingerprints...
Generated fingerprints with 2048 features for 841 molecules
Trial 2591: 5-fold CV loss = 0.4664
[I 2025-08-08 01:37:57,790] Trial 2591 finished with value: 0.46644110679626466 and parameters: {'fp_type': 'morgan_rdkit', 'combined_morgan_radius': 3, 'combined_morgan_nBits': 1024, 'combined_rdkit_maxPath': 7, 'combined_rdkit_nBits': 1024, 'num_hidden_layers': 3, 'hidden_dim_0': 256, 'hidden_dim_1': 256, 'hidden_dim_2': 64, 'kl_weight': 0.0002475215134780778, 'lr': 0.007585271288530523, 'batch_size': 128, 'dropout_rate': 0.07814418223493447, 'prior_mu': 0.004917624715927231, 'prior_sigma': 0.08446513887389885, 'normalization': 'layer'}. Best is trial 896 with value: 0.4533553242683411.
Generating morgan_rdkit fingerprints...
Generated fingerprints with 2048 features for 841 molecules
Trial 2589: 5-fold CV loss = 0.5281
[I 2025-08-08 01:38:02,442] Trial 2589 finished with value: 0.5281255602836609 and parameters: {'fp_type': 'morgan', 'morgan_only_radius': 2, 'morgan_only_nBits': 1024, 'num_hidden_layers': 3, 'hidden_dim_0': 256, 'hidden_dim_1': 512, 'hidden_dim_2': 64, 'kl_weight': 0.0002494645824518995, 'lr': 0.007712606173122726, 'batch_size': 32, 'dropout_rate': 0.0631863469580872, 'prior_mu': 0.003114179558841223, 'prior_sigma': 0.08570399334944484, 'normalization': 'layer'}. Best is trial 896 with value: 0.4533553242683411.
Generating morgan_rdkit fingerprints...
Generated fingerprints with 2048 features for 841 molecules
Trial 2592: 5-fold CV loss = 0.4698
[I 2025-08-08 01:38:17,318] Trial 2592 finished with value: 0.46979864239692687 and parameters: {'fp_type': 'morgan_rdkit', 'combined_morgan_radius': 3, 'combined_morgan_nBits': 1024, 'combined_rdkit_maxPath': 7, 'combined_rdkit_nBits': 1024, 'num_hidden_layers': 3, 'hidden_dim_0': 256, 'hidden_dim_1': 256, 'hidden_dim_2': 64, 'kl_weight': 0.00018917944993654897, 'lr': 0.007419738939864003, 'batch_size': 128, 'dropout_rate': 0.07287020518430833, 'prior_mu': 0.03650835991229382, 'prior_sigma': 0.09783131326448626, 'normalization': 'layer'}. Best is trial 896 with value: 0.4533553242683411.
Generating morgan_rdkit fingerprints...
Generated fingerprints with 2048 features for 841 molecules
Trial 2594: 5-fold CV loss = 0.8763
[I 2025-08-08 01:38:30,041] Trial 2594 finished with value: 0.8762899160385131 and parameters: {'fp_type': 'morgan_rdkit', 'combined_morgan_radius': 3, 'combined_morgan_nBits': 1024, 'combined_rdkit_maxPath': 7, 'combined_rdkit_nBits': 1024, 'num_hidden_layers': 3, 'hidden_dim_0': 256, 'hidden_dim_1': 64, 'hidden_dim_2': 64, 'kl_weight': 0.00019892858488132403, 'lr': 0.0010978092742433682, 'batch_size': 128, 'dropout_rate': 0.07812424816594771, 'prior_mu': 0.027135021182071256, 'prior_sigma': 0.10026932270992894, 'normalization': 'layer'}. Best is trial 896 with value: 0.4533553242683411.
Generating morgan_rdkit fingerprints...
Generated fingerprints with 2048 features for 841 molecules
Trial 2593: 5-fold CV loss = 0.4672
[I 2025-08-08 01:38:33,040] Trial 2593 finished with value: 0.4671736299991608 and parameters: {'fp_type': 'morgan_rdkit', 'combined_morgan_radius': 3, 'combined_morgan_nBits': 1024, 'combined_rdkit_maxPath': 7, 'combined_rdkit_nBits': 1024, 'num_hidden_layers': 3, 'hidden_dim_0': 256, 'hidden_dim_1': 512, 'hidden_dim_2': 64, 'kl_weight': 0.00019207780461816503, 'lr': 0.009146337283766246, 'batch_size': 128, 'dropout_rate': 0.06721600708608765, 'prior_mu': 0.0082193734938505, 'prior_sigma': 0.09897992622773445, 'normalization': 'layer'}. Best is trial 896 with value: 0.4533553242683411.
Generating morgan_rdkit fingerprints...
Generated fingerprints with 2048 features for 841 molecules
Trial 2597: 5-fold CV loss = 0.8881
[I 2025-08-08 01:38:45,544] Trial 2597 finished with value: 0.8881146311759949 and parameters: {'fp_type': 'morgan_rdkit', 'combined_morgan_radius': 3, 'combined_morgan_nBits': 1024, 'combined_rdkit_maxPath': 7, 'combined_rdkit_nBits': 1024, 'num_hidden_layers': 3, 'hidden_dim_0': 256, 'hidden_dim_1': 1024, 'hidden_dim_2': 1024, 'kl_weight': 0.00016293205309683172, 'lr': 0.009239541256740884, 'batch_size': 128, 'dropout_rate': 0.10199563987183632, 'prior_mu': -0.00561100836476145, 'prior_sigma': 0.0899352006064482, 'normalization': 'layer'}. Best is trial 896 with value: 0.4533553242683411.
Generating morgan_rdkit fingerprints...
Generated fingerprints with 2048 features for 841 molecules
Trial 2595: 5-fold CV loss = 0.5385
