[I 2025-08-07 19:11:03,236] Trial 645 finished with value: 0.4655292809009552 and parameters: {'fp_type': 'morgan_rdkit', 'combined_morgan_radius': 3, 'combined_morgan_nBits': 1024, 'combined_rdkit_maxPath': 7, 'combined_rdkit_nBits': 1024, 'num_hidden_layers': 3, 'hidden_dim_0': 256, 'hidden_dim_1': 1024, 'hidden_dim_2': 64, 'kl_weight': 0.00047442133160467324, 'lr': 0.009419311401658302, 'batch_size': 128, 'dropout_rate': 0.1726515496663531, 'prior_mu': -0.04406873558830721, 'prior_sigma': 0.08214070040109941, 'normalization': 'layer'}. Best is trial 587 with value: 0.4552353322505951.
Generating rdkit fingerprints...
Generated fingerprints with 1024 features for 841 molecules
Trial 647: 5-fold CV loss = 0.4646
[I 2025-08-07 19:11:32,491] Trial 647 finished with value: 0.4646484851837158 and parameters: {'fp_type': 'morgan_rdkit', 'combined_morgan_radius': 3, 'combined_morgan_nBits': 1024, 'combined_rdkit_maxPath': 7, 'combined_rdkit_nBits': 1024, 'num_hidden_layers': 3, 'hidden_dim_0': 256, 'hidden_dim_1': 1024, 'hidden_dim_2': 64, 'kl_weight': 0.0004852937803307859, 'lr': 0.009155068181536183, 'batch_size': 128, 'dropout_rate': 0.1548303297169315, 'prior_mu': -0.04380158087354344, 'prior_sigma': 0.08171076286869608, 'normalization': 'layer'}. Best is trial 587 with value: 0.4552353322505951.
Generating morgan_rdkit fingerprints...
Generated fingerprints with 2048 features for 841 molecules
Trial 648: 5-fold CV loss = 0.4662
[I 2025-08-07 19:11:36,466] Trial 648 finished with value: 0.466179221868515 and parameters: {'fp_type': 'morgan_rdkit', 'combined_morgan_radius': 3, 'combined_morgan_nBits': 1024, 'combined_rdkit_maxPath': 7, 'combined_rdkit_nBits': 1024, 'num_hidden_layers': 3, 'hidden_dim_0': 256, 'hidden_dim_1': 1024, 'hidden_dim_2': 64, 'kl_weight': 0.0005297850256135941, 'lr': 0.009119343207118021, 'batch_size': 128, 'dropout_rate': 0.15397191544523797, 'prior_mu': -0.013829722997243716, 'prior_sigma': 0.09279167229352395, 'normalization': 'layer'}. Best is trial 587 with value: 0.4552353322505951.
Generating rdkit fingerprints...
Generated fingerprints with 1024 features for 841 molecules
Trial 649: 5-fold CV loss = 0.5052
[I 2025-08-07 19:11:36,989] Trial 649 finished with value: 0.5052133440971375 and parameters: {'fp_type': 'rdkit', 'rdkit_only_maxPath': 5, 'rdkit_only_nBits': 1024, 'num_hidden_layers': 3, 'hidden_dim_0': 256, 'hidden_dim_1': 1024, 'hidden_dim_2': 64, 'kl_weight': 0.00034715061472624886, 'lr': 0.008795606528007711, 'batch_size': 128, 'dropout_rate': 0.15594970959479246, 'prior_mu': -0.013241558654926246, 'prior_sigma': 0.08620408524076857, 'normalization': 'layer'}. Best is trial 587 with value: 0.4552353322505951.
Generating morgan_rdkit fingerprints...
Generated fingerprints with 2048 features for 841 molecules
Trial 644: 5-fold CV loss = 0.4666
[I 2025-08-07 19:11:51,037] Trial 644 finished with value: 0.4665638267993927 and parameters: {'fp_type': 'morgan_rdkit', 'combined_morgan_radius': 3, 'combined_morgan_nBits': 1024, 'combined_rdkit_maxPath': 7, 'combined_rdkit_nBits': 1024, 'num_hidden_layers': 3, 'hidden_dim_0': 256, 'hidden_dim_1': 1024, 'hidden_dim_2': 64, 'kl_weight': 0.0002888726097857353, 'lr': 0.007561491083658199, 'batch_size': 128, 'dropout_rate': 0.1703025810663839, 'prior_mu': -0.0238022544646853, 'prior_sigma': 0.0903008801956344, 'normalization': 'layer'}. Best is trial 587 with value: 0.4552353322505951.
Generating morgan_rdkit fingerprints...
Generated fingerprints with 2048 features for 841 molecules
Trial 651: 5-fold CV loss = 0.5013
[I 2025-08-07 19:12:06,916] Trial 651 finished with value: 0.5013433396816254 and parameters: {'fp_type': 'rdkit', 'rdkit_only_maxPath': 5, 'rdkit_only_nBits': 1024, 'num_hidden_layers': 3, 'hidden_dim_0': 256, 'hidden_dim_1': 1024, 'hidden_dim_2': 64, 'kl_weight': 0.00034921814196473336, 'lr': 0.006209171480482317, 'batch_size': 128, 'dropout_rate': 0.16412696295874077, 'prior_mu': -0.08126555017749451, 'prior_sigma': 0.08654454565721889, 'normalization': 'layer'}. Best is trial 587 with value: 0.4552353322505951.
Generating morgan_rdkit fingerprints...
Generated fingerprints with 2048 features for 841 molecules
Trial 652: 5-fold CV loss = 0.6556
[I 2025-08-07 19:12:17,405] Trial 652 finished with value: 0.6555992305278778 and parameters: {'fp_type': 'morgan_rdkit', 'combined_morgan_radius': 3, 'combined_morgan_nBits': 1024, 'combined_rdkit_maxPath': 7, 'combined_rdkit_nBits': 1024, 'num_hidden_layers': 3, 'hidden_dim_0': 256, 'hidden_dim_1': 1024, 'hidden_dim_2': 256, 'kl_weight': 0.0003642282918029816, 'lr': 0.0066561540725049734, 'batch_size': 128, 'dropout_rate': 0.13901544666656013, 'prior_mu': -0.03188252787884269, 'prior_sigma': 0.09907576065443399, 'normalization': 'layer'}. Best is trial 587 with value: 0.4552353322505951.
Generating morgan_rdkit fingerprints...
Generated fingerprints with 2048 features for 841 molecules
Trial 650: 5-fold CV loss = 0.4666
[I 2025-08-07 19:12:29,895] Trial 650 finished with value: 0.466615754365921 and parameters: {'fp_type': 'morgan_rdkit', 'combined_morgan_radius': 3, 'combined_morgan_nBits': 1024, 'combined_rdkit_maxPath': 7, 'combined_rdkit_nBits': 1024, 'num_hidden_layers': 3, 'hidden_dim_0': 256, 'hidden_dim_1': 1024, 'hidden_dim_2': 64, 'kl_weight': 0.00034812220964462444, 'lr': 0.008322972199729089, 'batch_size': 128, 'dropout_rate': 0.1537669541365395, 'prior_mu': -0.010351070986497627, 'prior_sigma': 0.09377871334476746, 'normalization': 'layer'}. Best is trial 587 with value: 0.4552353322505951.
Generating morgan_rdkit fingerprints...
Generated fingerprints with 2048 features for 841 molecules
Trial 654: 5-fold CV loss = 0.5628
[I 2025-08-07 19:12:43,164] Trial 654 finished with value: 0.562785518169403 and parameters: {'fp_type': 'morgan_rdkit', 'combined_morgan_radius': 3, 'combined_morgan_nBits': 1024, 'combined_rdkit_maxPath': 7, 'combined_rdkit_nBits': 1024, 'num_hidden_layers': 3, 'hidden_dim_0': 256, 'hidden_dim_1': 1024, 'hidden_dim_2': 64, 'kl_weight': 0.0004218039097356675, 'lr': 0.006760520489003128, 'batch_size': 128, 'dropout_rate': 0.13936448601615575, 'prior_mu': -0.03400652569548325, 'prior_sigma': 0.10050852731737464, 'normalization': 'layer'}. Best is trial 587 with value: 0.4552353322505951.
Generating morgan_rdkit fingerprints...
Generated fingerprints with 2048 features for 841 molecules
Trial 655: 5-fold CV loss = 0.4643
[I 2025-08-07 19:13:08,505] Trial 655 finished with value: 0.46425601840019226 and parameters: {'fp_type': 'morgan_rdkit', 'combined_morgan_radius': 3, 'combined_morgan_nBits': 1024, 'combined_rdkit_maxPath': 7, 'combined_rdkit_nBits': 1024, 'num_hidden_layers': 3, 'hidden_dim_0': 256, 'hidden_dim_1': 1024, 'hidden_dim_2': 64, 'kl_weight': 0.00043465078285494094, 'lr': 0.0077207124807217465, 'batch_size': 128, 'dropout_rate': 0.48493225991617894, 'prior_mu': -0.03505607574318999, 'prior_sigma': 0.09387515134164431, 'normalization': 'layer'}. Best is trial 587 with value: 0.4552353322505951.
Generating morgan_rdkit fingerprints...
Generated fingerprints with 2048 features for 841 molecules
Trial 656: 5-fold CV loss = 0.4720
[I 2025-08-07 19:13:16,680] Trial 656 finished with value: 0.4720461547374725 and parameters: {'fp_type': 'morgan_rdkit', 'combined_morgan_radius': 3, 'combined_morgan_nBits': 1024, 'combined_rdkit_maxPath': 7, 'combined_rdkit_nBits': 1024, 'num_hidden_layers': 3, 'hidden_dim_0': 256, 'hidden_dim_1': 1024, 'hidden_dim_2': 64, 'kl_weight': 0.00041462270242153675, 'lr': 0.009954781604449863, 'batch_size': 128, 'dropout_rate': 0.11693757215543436, 'prior_mu': -0.0360031877962094, 'prior_sigma': 0.06303398116874326, 'normalization': 'layer'}. Best is trial 587 with value: 0.4552353322505951.
Generating morgan_rdkit fingerprints...
Generated fingerprints with 2048 features for 841 molecules
Trial 657: 5-fold CV loss = 0.4719
[I 2025-08-07 19:13:24,934] Trial 657 finished with value: 0.4718665063381195 and parameters: {'fp_type': 'morgan_rdkit', 'combined_morgan_radius': 3, 'combined_morgan_nBits': 1024, 'combined_rdkit_maxPath': 7, 'combined_rdkit_nBits': 1024, 'num_hidden_layers': 3, 'hidden_dim_0': 256, 'hidden_dim_1': 1024, 'hidden_dim_2': 64, 'kl_weight': 0.00026090765696094577, 'lr': 0.007776365681412575, 'batch_size': 128, 'dropout_rate': 0.1214108724841608, 'prior_mu': -0.0325877059627432, 'prior_sigma': 0.09345968962088497, 'normalization': 'layer'}. Best is trial 587 with value: 0.4552353322505951.
Generating morgan_rdkit fingerprints...
Generated fingerprints with 2048 features for 841 molecules
Trial 653: 5-fold CV loss = 0.4625
[I 2025-08-07 19:13:39,685] Trial 653 finished with value: 0.4625083327293396 and parameters: {'fp_type': 'morgan_rdkit', 'combined_morgan_radius': 3, 'combined_morgan_nBits': 1024, 'combined_rdkit_maxPath': 7, 'combined_rdkit_nBits': 1024, 'num_hidden_layers': 3, 'hidden_dim_0': 256, 'hidden_dim_1': 1024, 'hidden_dim_2': 64, 'kl_weight': 0.0003625433047533635, 'lr': 0.006172843070604575, 'batch_size': 128, 'dropout_rate': 0.1377676653246685, 'prior_mu': -0.03295931074127823, 'prior_sigma': 0.09994010976822242, 'normalization': 'layer'}. Best is trial 587 with value: 0.4552353322505951.
Generating morgan_rdkit fingerprints...
Generated fingerprints with 2048 features for 841 molecules
Trial 658: 5-fold CV loss = 0.5619
[I 2025-08-07 19:13:52,245] Trial 658 finished with value: 0.5619242250919342 and parameters: {'fp_type': 'morgan_rdkit', 'combined_morgan_radius': 3, 'combined_morgan_nBits': 1024, 'combined_rdkit_maxPath': 7, 'combined_rdkit_nBits': 1024, 'num_hidden_layers': 3, 'hidden_dim_0': 256, 'hidden_dim_1': 1024, 'hidden_dim_2': 64, 'kl_weight': 0.00026782602295836105, 'lr': 0.006090257491669578, 'batch_size': 128, 'dropout_rate': 0.12571640072478774, 'prior_mu': -0.020382581581383487, 'prior_sigma': 0.10463672240172255, 'normalization': 'layer'}. Best is trial 587 with value: 0.4552353322505951.
Generating morgan_rdkit fingerprints...
Generated fingerprints with 1280 features for 841 molecules
Trial 660: 5-fold CV loss = 0.4664
[I 2025-08-07 19:13:57,975] Trial 660 finished with value: 0.46635388135910033 and parameters: {'fp_type': 'morgan_rdkit', 'combined_morgan_radius': 3, 'combined_morgan_nBits': 1024, 'combined_rdkit_maxPath': 7, 'combined_rdkit_nBits': 1024, 'num_hidden_layers': 3, 'hidden_dim_0': 256, 'hidden_dim_1': 1024, 'hidden_dim_2': 64, 'kl_weight': 0.0002758735780772733, 'lr': 0.006092632882778286, 'batch_size': 128, 'dropout_rate': 0.1298105468218375, 'prior_mu': -0.01915602263924364, 'prior_sigma': 0.07927832006672453, 'normalization': 'layer'}. Best is trial 587 with value: 0.4552353322505951.
Generating morgan_rdkit fingerprints...
Generated fingerprints with 1280 features for 841 molecules
Trial 659: 5-fold CV loss = 0.5631
[I 2025-08-07 19:14:08,952] Trial 659 finished with value: 0.5631145298480987 and parameters: {'fp_type': 'morgan_rdkit', 'combined_morgan_radius': 3, 'combined_morgan_nBits': 1024, 'combined_rdkit_maxPath': 7, 'combined_rdkit_nBits': 1024, 'num_hidden_layers': 3, 'hidden_dim_0': 256, 'hidden_dim_1': 1024, 'hidden_dim_2': 64, 'kl_weight': 0.0002621595278883728, 'lr': 0.005914793833407792, 'batch_size': 128, 'dropout_rate': 0.12964182727801948, 'prior_mu': -0.0176608356248351, 'prior_sigma': 0.09128256987235232, 'normalization': 'layer'}. Best is trial 587 with value: 0.4552353322505951.
Generating morgan_rdkit fingerprints...
Generated fingerprints with 1280 features for 841 molecules
Trial 662: 5-fold CV loss = 0.5055
[I 2025-08-07 19:14:34,105] Trial 662 finished with value: 0.5055380403995514 and parameters: {'fp_type': 'morgan_rdkit', 'combined_morgan_radius': 3, 'combined_morgan_nBits': 1024, 'combined_rdkit_maxPath': 7, 'combined_rdkit_nBits': 256, 'num_hidden_layers': 3, 'hidden_dim_0': 256, 'hidden_dim_1': 1024, 'hidden_dim_2': 64, 'kl_weight': 0.000299512306708174, 'lr': 0.005813164278288444, 'batch_size': 64, 'dropout_rate': 0.10130821279747915, 'prior_mu': -0.010116920872158538, 'prior_sigma': 0.1004843186398842, 'normalization': 'layer'}. Best is trial 587 with value: 0.4552353322505951.
Generating morgan_rdkit fingerprints...
Generated fingerprints with 2048 features for 841 molecules
Trial 663: 5-fold CV loss = 0.5085
[I 2025-08-07 19:14:39,290] Trial 663 finished with value: 0.50854994058609 and parameters: {'fp_type': 'morgan_rdkit', 'combined_morgan_radius': 3, 'combined_morgan_nBits': 1024, 'combined_rdkit_maxPath': 7, 'combined_rdkit_nBits': 256, 'num_hidden_layers': 3, 'hidden_dim_0': 256, 'hidden_dim_1': 1024, 'hidden_dim_2': 64, 'kl_weight': 0.0003358237395825769, 'lr': 0.005652143093254846, 'batch_size': 64, 'dropout_rate': 0.10242622159886323, 'prior_mu': -0.02683682039410808, 'prior_sigma': 0.11057319494666473, 'normalization': 'layer'}. Best is trial 587 with value: 0.4552353322505951.
Generating morgan_rdkit fingerprints...
Generated fingerprints with 2048 features for 841 molecules
Trial 664: 5-fold CV loss = 0.5124
[I 2025-08-07 19:15:08,397] Trial 664 finished with value: 0.512440699338913 and parameters: {'fp_type': 'morgan_rdkit', 'combined_morgan_radius': 3, 'combined_morgan_nBits': 1024, 'combined_rdkit_maxPath': 7, 'combined_rdkit_nBits': 256, 'num_hidden_layers': 3, 'hidden_dim_0': 256, 'hidden_dim_1': 1024, 'hidden_dim_2': 64, 'kl_weight': 0.00032799776962860516, 'lr': 0.005718277919529913, 'batch_size': 64, 'dropout_rate': 0.13778811569193541, 'prior_mu': -0.027008419568894063, 'prior_sigma': 0.10021144675149857, 'normalization': 'layer'}. Best is trial 587 with value: 0.4552353322505951.
Generating morgan_rdkit fingerprints...
Generated fingerprints with 2048 features for 841 molecules
Trial 665: 5-fold CV loss = 0.4816
[I 2025-08-07 19:15:13,033] Trial 665 finished with value: 0.4815764784812927 and parameters: {'fp_type': 'morgan_rdkit', 'combined_morgan_radius': 3, 'combined_morgan_nBits': 1024, 'combined_rdkit_maxPath': 5, 'combined_rdkit_nBits': 1024, 'num_hidden_layers': 3, 'hidden_dim_0': 256, 'hidden_dim_1': 1024, 'hidden_dim_2': 64, 'kl_weight': 0.0003293298184722523, 'lr': 0.006674358100332783, 'batch_size': 128, 'dropout_rate': 0.1444576964870695, 'prior_mu': -0.0274174204170918, 'prior_sigma': 0.1064151341963551, 'normalization': 'layer'}. Best is trial 587 with value: 0.4552353322505951.
Generating morgan_rdkit fingerprints...
Generated fingerprints with 2048 features for 841 molecules
Trial 666: 5-fold CV loss = 0.4653
[I 2025-08-07 19:15:21,534] Trial 666 finished with value: 0.46530826687812804 and parameters: {'fp_type': 'morgan_rdkit', 'combined_morgan_radius': 3, 'combined_morgan_nBits': 1024, 'combined_rdkit_maxPath': 7, 'combined_rdkit_nBits': 1024, 'num_hidden_layers': 3, 'hidden_dim_0': 256, 'hidden_dim_1': 1024, 'hidden_dim_2': 64, 'kl_weight': 0.0003739782263146237, 'lr': 0.0071641299196965385, 'batch_size': 128, 'dropout_rate': 0.14432892307121997, 'prior_mu': -0.027247470461446863, 'prior_sigma': 0.1062783287406596, 'normalization': 'layer'}. Best is trial 587 with value: 0.4552353322505951.
Generating morgan_rdkit fingerprints...
Generated fingerprints with 2048 features for 841 molecules
Trial 667: 5-fold CV loss = 0.5550
[I 2025-08-07 19:15:58,282] Trial 667 finished with value: 0.5549647569656372 and parameters: {'fp_type': 'morgan_rdkit', 'combined_morgan_radius': 3, 'combined_morgan_nBits': 1024, 'combined_rdkit_maxPath': 8, 'combined_rdkit_nBits': 1024, 'num_hidden_layers': 3, 'hidden_dim_0': 256, 'hidden_dim_1': 1024, 'hidden_dim_2': 64, 'kl_weight': 0.0003819060581073703, 'lr': 0.006566067598470209, 'batch_size': 128, 'dropout_rate': 0.1464541121031259, 'prior_mu': -0.00913936963506139, 'prior_sigma': 0.09637899826696256, 'normalization': 'layer'}. Best is trial 587 with value: 0.4552353322505951.
Generating morgan_rdkit fingerprints...
Generated fingerprints with 2048 features for 841 molecules
Trial 668: 5-fold CV loss = 0.5603
[I 2025-08-07 19:15:59,376] Trial 668 finished with value: 0.5603081345558166 and parameters: {'fp_type': 'morgan_rdkit', 'combined_morgan_radius': 3, 'combined_morgan_nBits': 1024, 'combined_rdkit_maxPath': 8, 'combined_rdkit_nBits': 1024, 'num_hidden_layers': 3, 'hidden_dim_0': 256, 'hidden_dim_1': 1024, 'hidden_dim_2': 64, 'kl_weight': 0.0003826841570035812, 'lr': 0.006900821774722996, 'batch_size': 128, 'dropout_rate': 0.14755587593557826, 'prior_mu': -0.01105576304533357, 'prior_sigma': 0.09655278630325356, 'normalization': 'layer'}. Best is trial 587 with value: 0.4552353322505951.
Generating morgan_rdkit fingerprints...
Generated fingerprints with 2048 features for 841 molecules
Trial 661: 5-fold CV loss = 0.4684
[I 2025-08-07 19:16:00,552] Trial 661 finished with value: 0.4684054970741272 and parameters: {'fp_type': 'morgan_rdkit', 'combined_morgan_radius': 3, 'combined_morgan_nBits': 1024, 'combined_rdkit_maxPath': 7, 'combined_rdkit_nBits': 1024, 'num_hidden_layers': 3, 'hidden_dim_0': 256, 'hidden_dim_1': 1024, 'hidden_dim_2': 64, 'kl_weight': 0.00027371666155389155, 'lr': 0.005933593243906113, 'batch_size': 64, 'dropout_rate': 0.1030928078101073, 'prior_mu': -0.020325561425926928, 'prior_sigma': 0.1108071638583987, 'normalization': 'layer'}. Best is trial 587 with value: 0.4552353322505951.
Generating morgan_rdkit fingerprints...
Generated fingerprints with 2048 features for 841 molecules
Trial 669: 5-fold CV loss = 0.4773
[I 2025-08-07 19:16:09,159] Trial 669 finished with value: 0.4773492991924286 and parameters: {'fp_type': 'morgan_rdkit', 'combined_morgan_radius': 3, 'combined_morgan_nBits': 1024, 'combined_rdkit_maxPath': 8, 'combined_rdkit_nBits': 1024, 'num_hidden_layers': 3, 'hidden_dim_0': 256, 'hidden_dim_1': 1024, 'hidden_dim_2': 64, 'kl_weight': 0.0005062899923234021, 'lr': 0.006627331217644857, 'batch_size': 128, 'dropout_rate': 0.16585683234077173, 'prior_mu': -0.010947259053282234, 'prior_sigma': 0.0984292579797319, 'normalization': 'layer'}. Best is trial 587 with value: 0.4552353322505951.
Generating morgan_rdkit fingerprints...
Generated fingerprints with 2048 features for 841 molecules
Trial 673: 5-fold CV loss = 0.4639
[I 2025-08-07 19:16:40,570] Trial 673 finished with value: 0.4638975262641907 and parameters: {'fp_type': 'morgan_rdkit', 'combined_morgan_radius': 3, 'combined_morgan_nBits': 1024, 'combined_rdkit_maxPath': 7, 'combined_rdkit_nBits': 1024, 'num_hidden_layers': 3, 'hidden_dim_0': 256, 'hidden_dim_1': 1024, 'hidden_dim_2': 64, 'kl_weight': 0.00022698664293954938, 'lr': 0.00844132874777958, 'batch_size': 128, 'dropout_rate': 0.11831874209329533, 'prior_mu': -0.04405860784190574, 'prior_sigma': 0.08618197608318891, 'normalization': 'layer'}. Best is trial 587 with value: 0.4552353322505951.
Generating morgan_rdkit fingerprints...
Generated fingerprints with 2048 features for 841 molecules
Trial 671: 5-fold CV loss = 0.4627
[I 2025-08-07 19:16:46,469] Trial 671 finished with value: 0.4627071976661682 and parameters: {'fp_type': 'morgan_rdkit', 'combined_morgan_radius': 3, 'combined_morgan_nBits': 1024, 'combined_rdkit_maxPath': 7, 'combined_rdkit_nBits': 1024, 'num_hidden_layers': 3, 'hidden_dim_0': 256, 'hidden_dim_1': 1024, 'hidden_dim_2': 64, 'kl_weight': 0.0005186094062115737, 'lr': 0.006235125007509233, 'batch_size': 128, 'dropout_rate': 0.1627489139353902, 'prior_mu': -0.06269506607607435, 'prior_sigma': 0.08681192679965902, 'normalization': 'layer'}. Best is trial 587 with value: 0.4552353322505951.
Generating morgan_rdkit fingerprints...
Generated fingerprints with 2048 features for 841 molecules
Trial 672: 5-fold CV loss = 0.8726
[I 2025-08-07 19:16:52,990] Trial 672 finished with value: 0.8725541234016418 and parameters: {'fp_type': 'morgan_rdkit', 'combined_morgan_radius': 3, 'combined_morgan_nBits': 1024, 'combined_rdkit_maxPath': 7, 'combined_rdkit_nBits': 1024, 'num_hidden_layers': 3, 'hidden_dim_0': 256, 'hidden_dim_1': 1024, 'hidden_dim_2': 64, 'kl_weight': 0.0005027899889200736, 'lr': 0.0003062195612624763, 'batch_size': 128, 'dropout_rate': 0.16644684797558335, 'prior_mu': -0.04699197601893456, 'prior_sigma': 0.08496110089892187, 'normalization': 'layer'}. Best is trial 587 with value: 0.4552353322505951.
Generating morgan_rdkit fingerprints...
Generated fingerprints with 2048 features for 841 molecules
Trial 670: 5-fold CV loss = 0.4682
[I 2025-08-07 19:16:56,937] Trial 670 finished with value: 0.46822166442871094 and parameters: {'fp_type': 'morgan_rdkit', 'combined_morgan_radius': 3, 'combined_morgan_nBits': 1024, 'combined_rdkit_maxPath': 7, 'combined_rdkit_nBits': 1024, 'num_hidden_layers': 3, 'hidden_dim_0': 256, 'hidden_dim_1': 1024, 'hidden_dim_2': 64, 'kl_weight': 0.0005260664211884329, 'lr': 0.007091169424345925, 'batch_size': 128, 'dropout_rate': 0.16341363324458133, 'prior_mu': -0.048467283628912644, 'prior_sigma': 0.08462333703453324, 'normalization': 'layer'}. Best is trial 587 with value: 0.4552353322505951.
Generating morgan_rdkit fingerprints...
Generated fingerprints with 2048 features for 841 molecules
Trial 674: 5-fold CV loss = 0.4648
[I 2025-08-07 19:17:17,459] Trial 674 finished with value: 0.46483455300331117 and parameters: {'fp_type': 'morgan_rdkit', 'combined_morgan_radius': 3, 'combined_morgan_nBits': 1024, 'combined_rdkit_maxPath': 7, 'combined_rdkit_nBits': 1024, 'num_hidden_layers': 3, 'hidden_dim_0': 256, 'hidden_dim_1': 1024, 'hidden_dim_2': 64, 'kl_weight': 0.00032755554389621283, 'lr': 0.0073387933185488675, 'batch_size': 128, 'dropout_rate': 0.13489410263091073, 'prior_mu': -0.06443503953645202, 'prior_sigma': 0.07148922833304262, 'normalization': 'layer'}. Best is trial 587 with value: 0.4552353322505951.
Generating morgan_rdkit fingerprints...
Generated fingerprints with 2048 features for 841 molecules
Trial 675: 5-fold CV loss = 0.5433
