[I 2025-08-08 02:08:08,822] Trial 2745 finished with value: 0.505960476398468 and parameters: {'fp_type': 'morgan_rdkit', 'combined_morgan_radius': 3, 'combined_morgan_nBits': 1024, 'combined_rdkit_maxPath': 7, 'combined_rdkit_nBits': 1024, 'num_hidden_layers': 3, 'hidden_dim_0': 256, 'hidden_dim_1': 1024, 'hidden_dim_2': 64, 'kl_weight': 0.06059614162545282, 'lr': 0.007380220983752864, 'batch_size': 128, 'dropout_rate': 0.12189977394591946, 'prior_mu': -0.03493534041847209, 'prior_sigma': 0.0755620665807834, 'normalization': 'layer'}. Best is trial 896 with value: 0.4533553242683411.
Generating morgan_rdkit fingerprints...
Generated fingerprints with 2048 features for 841 molecules
Trial 2746: 5-fold CV loss = 0.5084
[I 2025-08-08 02:08:11,707] Trial 2746 finished with value: 0.5084053456783295 and parameters: {'fp_type': 'morgan_rdkit', 'combined_morgan_radius': 3, 'combined_morgan_nBits': 1024, 'combined_rdkit_maxPath': 6, 'combined_rdkit_nBits': 1024, 'num_hidden_layers': 3, 'hidden_dim_0': 256, 'hidden_dim_1': 1024, 'hidden_dim_2': 64, 'kl_weight': 0.05248468753754882, 'lr': 0.00720015815589231, 'batch_size': 128, 'dropout_rate': 0.1083603731306478, 'prior_mu': -0.039684724074911776, 'prior_sigma': 0.07935657400271878, 'normalization': 'layer'}. Best is trial 896 with value: 0.4533553242683411.
Generating morgan_rdkit fingerprints...
Generated fingerprints with 2048 features for 841 molecules
Trial 2747: 5-fold CV loss = 0.4724
[I 2025-08-08 02:08:26,217] Trial 2747 finished with value: 0.47243328094482423 and parameters: {'fp_type': 'morgan_rdkit', 'combined_morgan_radius': 3, 'combined_morgan_nBits': 1024, 'combined_rdkit_maxPath': 6, 'combined_rdkit_nBits': 1024, 'num_hidden_layers': 3, 'hidden_dim_0': 256, 'hidden_dim_1': 1024, 'hidden_dim_2': 64, 'kl_weight': 0.0004353089658627187, 'lr': 0.007158007512303698, 'batch_size': 128, 'dropout_rate': 0.4040741218888407, 'prior_mu': -0.03831784569665926, 'prior_sigma': 0.06357401005627154, 'normalization': 'layer'}. Best is trial 896 with value: 0.4533553242683411.
Generating morgan_rdkit fingerprints...
Generated fingerprints with 2048 features for 841 molecules
Trial 2749: 5-fold CV loss = 0.5274
[I 2025-08-08 02:08:30,120] Trial 2749 finished with value: 0.5273817241191864 and parameters: {'fp_type': 'morgan_rdkit', 'combined_morgan_radius': 3, 'combined_morgan_nBits': 1024, 'combined_rdkit_maxPath': 6, 'combined_rdkit_nBits': 1024, 'num_hidden_layers': 1, 'hidden_dim_0': 256, 'kl_weight': 0.025591145803974587, 'lr': 0.007569091451587572, 'batch_size': 128, 'dropout_rate': 0.10852808458527402, 'prior_mu': -0.04125805232687399, 'prior_sigma': 0.08138088329552973, 'normalization': 'layer'}. Best is trial 896 with value: 0.4533553242683411.
Generating morgan_rdkit fingerprints...
Generated fingerprints with 2048 features for 841 molecules
Trial 2750: 5-fold CV loss = 0.5665
[I 2025-08-08 02:08:50,657] Trial 2750 finished with value: 0.5665114521980286 and parameters: {'fp_type': 'morgan_rdkit', 'combined_morgan_radius': 3, 'combined_morgan_nBits': 1024, 'combined_rdkit_maxPath': 7, 'combined_rdkit_nBits': 1024, 'num_hidden_layers': 3, 'hidden_dim_0': 256, 'hidden_dim_1': 64, 'hidden_dim_2': 64, 'kl_weight': 0.0004477868650623074, 'lr': 0.007721123609142955, 'batch_size': 128, 'dropout_rate': 0.13674420154189226, 'prior_mu': -0.04498124851123528, 'prior_sigma': 0.08154078987725531, 'normalization': 'layer'}. Best is trial 896 with value: 0.4533553242683411.
Generating morgan_rdkit fingerprints...
Generated fingerprints with 2048 features for 841 molecules
Trial 2752: 5-fold CV loss = 0.5489
[I 2025-08-08 02:09:02,568] Trial 2752 finished with value: 0.5488663375377655 and parameters: {'fp_type': 'morgan_rdkit', 'combined_morgan_radius': 3, 'combined_morgan_nBits': 1024, 'combined_rdkit_maxPath': 7, 'combined_rdkit_nBits': 1024, 'num_hidden_layers': 3, 'hidden_dim_0': 256, 'hidden_dim_1': 64, 'hidden_dim_2': 64, 'kl_weight': 0.007522779227038314, 'lr': 0.007805331737651214, 'batch_size': 128, 'dropout_rate': 0.13160752172181148, 'prior_mu': -0.017037055193276102, 'prior_sigma': 0.080329775807373, 'normalization': 'layer'}. Best is trial 896 with value: 0.4533553242683411.
Generating morgan_rdkit fingerprints...
Generated fingerprints with 2048 features for 841 molecules
Trial 2748: 5-fold CV loss = 0.4685
[I 2025-08-08 02:09:10,912] Trial 2748 finished with value: 0.4685492753982544 and parameters: {'fp_type': 'morgan_rdkit', 'combined_morgan_radius': 3, 'combined_morgan_nBits': 1024, 'combined_rdkit_maxPath': 6, 'combined_rdkit_nBits': 1024, 'num_hidden_layers': 3, 'hidden_dim_0': 256, 'hidden_dim_1': 1024, 'hidden_dim_2': 64, 'kl_weight': 0.00034252341600729465, 'lr': 0.007269776846916357, 'batch_size': 128, 'dropout_rate': 0.10818715641390342, 'prior_mu': -0.04090545747514546, 'prior_sigma': 0.06331966901959374, 'normalization': 'layer'}. Best is trial 896 with value: 0.4533553242683411.
Generating morgan_rdkit fingerprints...
Generated fingerprints with 2048 features for 841 molecules
Trial 2753: 5-fold CV loss = 0.8099
[I 2025-08-08 02:09:19,622] Trial 2753 finished with value: 0.8099485278129578 and parameters: {'fp_type': 'morgan_rdkit', 'combined_morgan_radius': 3, 'combined_morgan_nBits': 1024, 'combined_rdkit_maxPath': 7, 'combined_rdkit_nBits': 1024, 'num_hidden_layers': 3, 'hidden_dim_0': 256, 'hidden_dim_1': 1024, 'hidden_dim_2': 64, 'kl_weight': 0.0012851358292505744, 'lr': 0.0009760101530991899, 'batch_size': 128, 'dropout_rate': 0.11002253719704477, 'prior_mu': -0.013594427691052314, 'prior_sigma': 0.07314127921219551, 'normalization': 'layer'}. Best is trial 896 with value: 0.4533553242683411.
Generating morgan_rdkit fingerprints...
Generated fingerprints with 2048 features for 841 molecules
Trial 2751: 5-fold CV loss = 0.4684
[I 2025-08-08 02:09:28,216] Trial 2751 finished with value: 0.4684191882610321 and parameters: {'fp_type': 'morgan_rdkit', 'combined_morgan_radius': 3, 'combined_morgan_nBits': 1024, 'combined_rdkit_maxPath': 7, 'combined_rdkit_nBits': 1024, 'num_hidden_layers': 3, 'hidden_dim_0': 256, 'hidden_dim_1': 1024, 'hidden_dim_2': 64, 'kl_weight': 0.0003324364248274458, 'lr': 0.007737639660311464, 'batch_size': 128, 'dropout_rate': 0.1378705841856876, 'prior_mu': -0.015467144751577379, 'prior_sigma': 0.08259702857649587, 'normalization': 'layer'}. Best is trial 896 with value: 0.4533553242683411.
Generating morgan_rdkit fingerprints...
Generated fingerprints with 2048 features for 841 molecules
Trial 2754: 5-fold CV loss = 0.4740
[I 2025-08-08 02:09:43,591] Trial 2754 finished with value: 0.47395036816596986 and parameters: {'fp_type': 'morgan_rdkit', 'combined_morgan_radius': 3, 'combined_morgan_nBits': 1024, 'combined_rdkit_maxPath': 7, 'combined_rdkit_nBits': 1024, 'num_hidden_layers': 3, 'hidden_dim_0': 128, 'hidden_dim_1': 1024, 'hidden_dim_2': 64, 'kl_weight': 0.0049729992279798066, 'lr': 0.006726198517137587, 'batch_size': 128, 'dropout_rate': 0.13905083895112985, 'prior_mu': -0.015863383629866695, 'prior_sigma': 0.08415820627801399, 'normalization': 'layer'}. Best is trial 896 with value: 0.4533553242683411.
Generating morgan_rdkit fingerprints...
Generated fingerprints with 2048 features for 841 molecules
Trial 2756: 5-fold CV loss = 0.4786
[I 2025-08-08 02:10:01,526] Trial 2756 finished with value: 0.4786136865615845 and parameters: {'fp_type': 'morgan_rdkit', 'combined_morgan_radius': 3, 'combined_morgan_nBits': 1024, 'combined_rdkit_maxPath': 7, 'combined_rdkit_nBits': 1024, 'num_hidden_layers': 3, 'hidden_dim_0': 128, 'hidden_dim_1': 1024, 'hidden_dim_2': 64, 'kl_weight': 0.0005652152924868126, 'lr': 0.0067790520006052015, 'batch_size': 128, 'dropout_rate': 0.13604030957584906, 'prior_mu': -0.0566769531410887, 'prior_sigma': 0.08462901905155998, 'normalization': 'layer'}. Best is trial 896 with value: 0.4533553242683411.
Generating morgan_rdkit fingerprints...
Generated fingerprints with 2048 features for 841 molecules
Trial 2757: 5-fold CV loss = 0.4743
[I 2025-08-08 02:10:18,923] Trial 2757 finished with value: 0.4742643892765045 and parameters: {'fp_type': 'morgan_rdkit', 'combined_morgan_radius': 3, 'combined_morgan_nBits': 1024, 'combined_rdkit_maxPath': 7, 'combined_rdkit_nBits': 1024, 'num_hidden_layers': 3, 'hidden_dim_0': 128, 'hidden_dim_1': 1024, 'hidden_dim_2': 64, 'kl_weight': 0.004047246165380907, 'lr': 0.006702410425169518, 'batch_size': 128, 'dropout_rate': 0.12526844372865018, 'prior_mu': -0.05865974979811882, 'prior_sigma': 0.07109826527413331, 'normalization': 'layer'}. Best is trial 896 with value: 0.4533553242683411.
Generating morgan_rdkit fingerprints...
Generated fingerprints with 2048 features for 841 molecules
Trial 2758: 5-fold CV loss = 0.4645
[I 2025-08-08 02:10:22,318] Trial 2758 finished with value: 0.46450703740119936 and parameters: {'fp_type': 'morgan_rdkit', 'combined_morgan_radius': 3, 'combined_morgan_nBits': 1024, 'combined_rdkit_maxPath': 7, 'combined_rdkit_nBits': 1024, 'num_hidden_layers': 3, 'hidden_dim_0': 256, 'hidden_dim_1': 1024, 'hidden_dim_2': 64, 'kl_weight': 0.004151481007594268, 'lr': 0.005658606670678121, 'batch_size': 128, 'dropout_rate': 0.12478934766076044, 'prior_mu': -0.059651275686309374, 'prior_sigma': 0.07790566933342437, 'normalization': 'layer'}. Best is trial 896 with value: 0.4533553242683411.
Generating morgan_rdkit fingerprints...
Generated fingerprints with 2048 features for 841 molecules
Trial 2755: 5-fold CV loss = 0.4727
[I 2025-08-08 02:10:34,171] Trial 2755 finished with value: 0.47266335487365724 and parameters: {'fp_type': 'morgan_rdkit', 'combined_morgan_radius': 3, 'combined_morgan_nBits': 1024, 'combined_rdkit_maxPath': 7, 'combined_rdkit_nBits': 1024, 'num_hidden_layers': 3, 'hidden_dim_0': 256, 'hidden_dim_1': 1024, 'hidden_dim_2': 64, 'kl_weight': 0.0008528679370009631, 'lr': 0.0068185212922446045, 'batch_size': 128, 'dropout_rate': 0.13938167194203216, 'prior_mu': -0.06004417270796409, 'prior_sigma': 0.07221514901384965, 'normalization': 'layer'}. Best is trial 896 with value: 0.4533553242683411.
Generating rdkit fingerprints...
Generated fingerprints with 1024 features for 841 molecules
Trial 2759: 5-fold CV loss = 0.4736
[I 2025-08-08 02:11:17,856] Trial 2759 finished with value: 0.4736421465873718 and parameters: {'fp_type': 'morgan_rdkit', 'combined_morgan_radius': 3, 'combined_morgan_nBits': 1024, 'combined_rdkit_maxPath': 7, 'combined_rdkit_nBits': 1024, 'num_hidden_layers': 3, 'hidden_dim_0': 256, 'hidden_dim_1': 1024, 'hidden_dim_2': 64, 'kl_weight': 0.0002773194229020697, 'lr': 0.005618634177174168, 'batch_size': 32, 'dropout_rate': 0.12691721154161606, 'prior_mu': -0.06217663233438216, 'prior_sigma': 0.07049168295878785, 'normalization': 'layer'}. Best is trial 896 with value: 0.4533553242683411.
Generating morgan_rdkit fingerprints...
Generated fingerprints with 2048 features for 841 molecules
Trial 2763: 5-fold CV loss = 0.4785
[I 2025-08-08 02:11:56,399] Trial 2763 finished with value: 0.4785080969333649 and parameters: {'fp_type': 'morgan_rdkit', 'combined_morgan_radius': 2, 'combined_morgan_nBits': 1024, 'combined_rdkit_maxPath': 8, 'combined_rdkit_nBits': 1024, 'num_hidden_layers': 3, 'hidden_dim_0': 256, 'hidden_dim_1': 1024, 'hidden_dim_2': 64, 'kl_weight': 0.0003693915398124584, 'lr': 0.007963892641301373, 'batch_size': 128, 'dropout_rate': 0.11258864571529328, 'prior_mu': -0.03225380326804278, 'prior_sigma': 0.07542822903843466, 'normalization': 'layer'}. Best is trial 896 with value: 0.4533553242683411.
Generating rdkit fingerprints...
Generated fingerprints with 1024 features for 841 molecules
Trial 2761: 5-fold CV loss = 0.4867
[I 2025-08-08 02:12:09,952] Trial 2761 finished with value: 0.4867464005947113 and parameters: {'fp_type': 'morgan_rdkit', 'combined_morgan_radius': 2, 'combined_morgan_nBits': 1024, 'combined_rdkit_maxPath': 7, 'combined_rdkit_nBits': 1024, 'num_hidden_layers': 3, 'hidden_dim_0': 256, 'hidden_dim_1': 1024, 'hidden_dim_2': 1024, 'kl_weight': 0.00029565645869447573, 'lr': 0.007955332062128874, 'batch_size': 32, 'dropout_rate': 0.10141298768324049, 'prior_mu': -0.03191076496126319, 'prior_sigma': 0.07459626735519312, 'normalization': 'layer'}. Best is trial 896 with value: 0.4533553242683411.
Generating rdkit fingerprints...
Generated fingerprints with 1024 features for 841 molecules
Trial 2764: 5-fold CV loss = 0.8979
[I 2025-08-08 02:12:17,286] Trial 2764 finished with value: 0.8978717088699341 and parameters: {'fp_type': 'rdkit', 'rdkit_only_maxPath': 8, 'rdkit_only_nBits': 1024, 'num_hidden_layers': 3, 'hidden_dim_0': 256, 'hidden_dim_1': 1024, 'hidden_dim_2': 1024, 'kl_weight': 0.0003005028669139499, 'lr': 0.007969306609297538, 'batch_size': 128, 'dropout_rate': 0.10206435534570646, 'prior_mu': -0.02971526471126476, 'prior_sigma': 0.08774074965389621, 'normalization': 'layer'}. Best is trial 896 with value: 0.4533553242683411.
Generating morgan_rdkit fingerprints...
Generated fingerprints with 2048 features for 841 molecules
Trial 2760: 5-fold CV loss = 0.4847
[I 2025-08-08 02:12:54,205] Trial 2760 finished with value: 0.48469236493110657 and parameters: {'fp_type': 'morgan_rdkit', 'combined_morgan_radius': 2, 'combined_morgan_nBits': 1024, 'combined_rdkit_maxPath': 7, 'combined_rdkit_nBits': 1024, 'num_hidden_layers': 3, 'hidden_dim_0': 256, 'hidden_dim_1': 1024, 'hidden_dim_2': 1024, 'kl_weight': 0.0020016249481229595, 'lr': 0.00586187662843942, 'batch_size': 32, 'dropout_rate': 0.10178687301373379, 'prior_mu': -0.028966173637903256, 'prior_sigma': 0.07754530925029843, 'normalization': 'layer'}. Best is trial 896 with value: 0.4533553242683411.
Generating morgan_rdkit fingerprints...
Generated fingerprints with 2048 features for 841 molecules
Trial 2765: 5-fold CV loss = 0.4972
[I 2025-08-08 02:13:09,892] Trial 2765 finished with value: 0.49718531370162966 and parameters: {'fp_type': 'rdkit', 'rdkit_only_maxPath': 8, 'rdkit_only_nBits': 1024, 'num_hidden_layers': 3, 'hidden_dim_0': 64, 'hidden_dim_1': 1024, 'hidden_dim_2': 64, 'kl_weight': 0.0003978514668067894, 'lr': 0.006169751642963836, 'batch_size': 128, 'dropout_rate': 0.10204736874302107, 'prior_mu': -0.02460562000290266, 'prior_sigma': 0.06713882532006168, 'normalization': 'layer'}. Best is trial 896 with value: 0.4533553242683411.
Generating morgan_rdkit fingerprints...
Generated fingerprints with 2048 features for 841 molecules
Trial 2766: 5-fold CV loss = 0.4645
[I 2025-08-08 02:13:13,810] Trial 2766 finished with value: 0.4645180761814117 and parameters: {'fp_type': 'morgan_rdkit', 'combined_morgan_radius': 3, 'combined_morgan_nBits': 1024, 'combined_rdkit_maxPath': 7, 'combined_rdkit_nBits': 1024, 'num_hidden_layers': 3, 'hidden_dim_0': 256, 'hidden_dim_1': 128, 'hidden_dim_2': 64, 'kl_weight': 0.000398056562941483, 'lr': 0.006147039776105133, 'batch_size': 128, 'dropout_rate': 0.46957819372795967, 'prior_mu': -0.04654091211106642, 'prior_sigma': 0.06659588270766376, 'normalization': 'layer'}. Best is trial 896 with value: 0.4533553242683411.
Generating morgan_rdkit fingerprints...
Generated fingerprints with 2048 features for 841 molecules
Trial 2768: 5-fold CV loss = 1.2176
[I 2025-08-08 02:13:19,919] Trial 2768 finished with value: 1.2175668478012085 and parameters: {'fp_type': 'morgan_rdkit', 'combined_morgan_radius': 3, 'combined_morgan_nBits': 1024, 'combined_rdkit_maxPath': 7, 'combined_rdkit_nBits': 1024, 'num_hidden_layers': 0, 'kl_weight': 0.00026136224229699546, 'lr': 0.007066416934111047, 'batch_size': 64, 'dropout_rate': 0.11493339086767751, 'prior_mu': -0.04751762183105752, 'prior_sigma': 0.08610380551769065, 'normalization': 'layer'}. Best is trial 896 with value: 0.4533553242683411.
Generating morgan_rdkit fingerprints...
Generated fingerprints with 2048 features for 841 molecules
Trial 2769: 5-fold CV loss = 1.1699
[I 2025-08-08 02:13:29,216] Trial 2769 finished with value: 1.1699471473693848 and parameters: {'fp_type': 'morgan_rdkit', 'combined_morgan_radius': 3, 'combined_morgan_nBits': 1024, 'combined_rdkit_maxPath': 7, 'combined_rdkit_nBits': 1024, 'num_hidden_layers': 0, 'kl_weight': 0.04119430211300687, 'lr': 0.007220700950616124, 'batch_size': 64, 'dropout_rate': 0.11598113867020678, 'prior_mu': -0.010295508554472938, 'prior_sigma': 0.08655405066204533, 'normalization': 'layer'}. Best is trial 896 with value: 0.4533553242683411.
Generating morgan_rdkit fingerprints...
Generated fingerprints with 2048 features for 841 molecules
Trial 2767: 5-fold CV loss = 0.4790
[I 2025-08-08 02:13:46,372] Trial 2767 finished with value: 0.47903387546539306 and parameters: {'fp_type': 'morgan_rdkit', 'combined_morgan_radius': 3, 'combined_morgan_nBits': 1024, 'combined_rdkit_maxPath': 7, 'combined_rdkit_nBits': 1024, 'num_hidden_layers': 3, 'hidden_dim_0': 64, 'hidden_dim_1': 128, 'hidden_dim_2': 64, 'kl_weight': 0.002226159580357743, 'lr': 0.007344684843917994, 'batch_size': 128, 'dropout_rate': 0.11443471529841041, 'prior_mu': -0.0220401503025914, 'prior_sigma': 0.06719747253986015, 'normalization': 'layer'}. Best is trial 896 with value: 0.4533553242683411.
Generating morgan_rdkit fingerprints...
Generated fingerprints with 2048 features for 841 molecules
Trial 2770: 5-fold CV loss = 0.4698
[I 2025-08-08 02:13:52,897] Trial 2770 finished with value: 0.4698358476161957 and parameters: {'fp_type': 'morgan_rdkit', 'combined_morgan_radius': 3, 'combined_morgan_nBits': 1024, 'combined_rdkit_maxPath': 7, 'combined_rdkit_nBits': 1024, 'num_hidden_layers': 3, 'hidden_dim_0': 256, 'hidden_dim_1': 1024, 'hidden_dim_2': 64, 'kl_weight': 0.002289504700585243, 'lr': 0.007379040607466195, 'batch_size': 128, 'dropout_rate': 0.1135422730705393, 'prior_mu': -0.01037013806061087, 'prior_sigma': 0.08224678605188855, 'normalization': 'layer'}. Best is trial 896 with value: 0.4533553242683411.
Generating morgan_rdkit fingerprints...
Generated fingerprints with 2048 features for 841 molecules
Trial 2771: 5-fold CV loss = 0.4647
[I 2025-08-08 02:14:11,826] Trial 2771 finished with value: 0.4647463023662567 and parameters: {'fp_type': 'morgan_rdkit', 'combined_morgan_radius': 3, 'combined_morgan_nBits': 1024, 'combined_rdkit_maxPath': 7, 'combined_rdkit_nBits': 1024, 'num_hidden_layers': 3, 'hidden_dim_0': 256, 'hidden_dim_1': 1024, 'hidden_dim_2': 64, 'kl_weight': 0.0004962948291907928, 'lr': 0.008455727328907633, 'batch_size': 128, 'dropout_rate': 0.09603220876455819, 'prior_mu': -0.09585013313404737, 'prior_sigma': 0.09011083357102402, 'normalization': 'layer'}. Best is trial 896 with value: 0.4533553242683411.
Generating morgan_rdkit fingerprints...
Generated fingerprints with 2048 features for 841 molecules
Trial 2773: 5-fold CV loss = 0.7258
[I 2025-08-08 02:14:21,458] Trial 2773 finished with value: 0.7257986843585968 and parameters: {'fp_type': 'morgan_rdkit', 'combined_morgan_radius': 3, 'combined_morgan_nBits': 1024, 'combined_rdkit_maxPath': 7, 'combined_rdkit_nBits': 1024, 'num_hidden_layers': 3, 'hidden_dim_0': 256, 'hidden_dim_1': 1024, 'hidden_dim_2': 512, 'kl_weight': 0.0002505345273738141, 'lr': 0.008391160646095984, 'batch_size': 128, 'dropout_rate': 0.12575308355701278, 'prior_mu': -0.08107519256905725, 'prior_sigma': 0.07906133754559282, 'normalization': 'layer'}. Best is trial 896 with value: 0.4533553242683411.
Generating morgan_rdkit fingerprints...
Generated fingerprints with 2048 features for 841 molecules
Trial 2772: 5-fold CV loss = 0.4732
[I 2025-08-08 02:14:44,600] Trial 2772 finished with value: 0.47323453426361084 and parameters: {'fp_type': 'morgan_rdkit', 'combined_morgan_radius': 3, 'combined_morgan_nBits': 1024, 'combined_rdkit_maxPath': 7, 'combined_rdkit_nBits': 1024, 'num_hidden_layers': 3, 'hidden_dim_0': 256, 'hidden_dim_1': 1024, 'hidden_dim_2': 64, 'kl_weight': 0.006788708892214854, 'lr': 0.009999964943642413, 'batch_size': 128, 'dropout_rate': 0.1446738502260629, 'prior_mu': -0.015964711798937922, 'prior_sigma': 0.08084418335294724, 'normalization': 'layer'}. Best is trial 896 with value: 0.4533553242683411.
Generating morgan_rdkit fingerprints...
Generated fingerprints with 2048 features for 841 molecules
Trial 2774: 5-fold CV loss = 0.4669
[I 2025-08-08 02:14:52,871] Trial 2774 finished with value: 0.46686877608299254 and parameters: {'fp_type': 'morgan_rdkit', 'combined_morgan_radius': 3, 'combined_morgan_nBits': 1024, 'combined_rdkit_maxPath': 7, 'combined_rdkit_nBits': 1024, 'num_hidden_layers': 3, 'hidden_dim_0': 256, 'hidden_dim_1': 1024, 'hidden_dim_2': 64, 'kl_weight': 0.0002532880379581592, 'lr': 0.006407306110382569, 'batch_size': 128, 'dropout_rate': 0.12469340192101827, 'prior_mu': -0.03304411287206632, 'prior_sigma': 0.07800188241850578, 'normalization': 'layer'}. Best is trial 896 with value: 0.4533553242683411.
Generating morgan_rdkit fingerprints...
Generated fingerprints with 2048 features for 841 molecules
Trial 2775: 5-fold CV loss = 0.4736
[I 2025-08-08 02:15:00,008] Trial 2775 finished with value: 0.4736087143421173 and parameters: {'fp_type': 'morgan_rdkit', 'combined_morgan_radius': 3, 'combined_morgan_nBits': 1024, 'combined_rdkit_maxPath': 7, 'combined_rdkit_nBits': 1024, 'num_hidden_layers': 3, 'hidden_dim_0': 1024, 'hidden_dim_1': 1024, 'hidden_dim_2': 64, 'kl_weight': 0.01159984876906363, 'lr': 0.006325133062214261, 'batch_size': 128, 'dropout_rate': 0.13529009065287376, 'prior_mu': -0.03568976885339995, 'prior_sigma': 0.07708992111236487, 'normalization': 'layer'}. Best is trial 896 with value: 0.4533553242683411.
Generating morgan_rdkit fingerprints...
Generated fingerprints with 2048 features for 841 molecules
Trial 2778: 5-fold CV loss = 0.4658
