[I 2025-08-08 00:35:58,855] Trial 2297 finished with value: 0.562979930639267 and parameters: {'fp_type': 'morgan_rdkit', 'combined_morgan_radius': 3, 'combined_morgan_nBits': 1024, 'combined_rdkit_maxPath': 7, 'combined_rdkit_nBits': 1024, 'num_hidden_layers': 3, 'hidden_dim_0': 64, 'hidden_dim_1': 1024, 'hidden_dim_2': 64, 'kl_weight': 0.00020889904659864548, 'lr': 0.007687623511712422, 'batch_size': 128, 'dropout_rate': 0.10054202552006958, 'prior_mu': -0.03637823856206137, 'prior_sigma': 0.11949586069175883, 'normalization': 'layer'}. Best is trial 896 with value: 0.4533553242683411.
Generating morgan_rdkit fingerprints...
Generated fingerprints with 1280 features for 841 molecules
Trial 2295: 5-fold CV loss = 0.4658
[I 2025-08-08 00:36:03,659] Trial 2295 finished with value: 0.4657659351825714 and parameters: {'fp_type': 'morgan_rdkit', 'combined_morgan_radius': 3, 'combined_morgan_nBits': 1024, 'combined_rdkit_maxPath': 7, 'combined_rdkit_nBits': 1024, 'num_hidden_layers': 3, 'hidden_dim_0': 256, 'hidden_dim_1': 1024, 'hidden_dim_2': 64, 'kl_weight': 0.00021279864830194687, 'lr': 0.009024377401584151, 'batch_size': 64, 'dropout_rate': 0.1049967979779299, 'prior_mu': -0.0735590368312865, 'prior_sigma': 0.11665342477782406, 'normalization': 'layer'}. Best is trial 896 with value: 0.4533553242683411.
Generating morgan_rdkit fingerprints...
Generated fingerprints with 2048 features for 841 molecules
Trial 2296: 5-fold CV loss = 0.4681
[I 2025-08-08 00:36:15,057] Trial 2296 finished with value: 0.4681288838386536 and parameters: {'fp_type': 'morgan_rdkit', 'combined_morgan_radius': 3, 'combined_morgan_nBits': 1024, 'combined_rdkit_maxPath': 7, 'combined_rdkit_nBits': 1024, 'num_hidden_layers': 3, 'hidden_dim_0': 256, 'hidden_dim_1': 256, 'hidden_dim_2': 64, 'kl_weight': 0.0001951163754653679, 'lr': 0.008997092911329057, 'batch_size': 64, 'dropout_rate': 0.10354053616920428, 'prior_mu': 0.006208407409704488, 'prior_sigma': 0.11613563702501437, 'normalization': 'layer'}. Best is trial 896 with value: 0.4533553242683411.
Generating morgan_rdkit fingerprints...
Generated fingerprints with 1280 features for 841 molecules
Trial 2299: 5-fold CV loss = 0.5216
[I 2025-08-08 00:36:25,416] Trial 2299 finished with value: 0.521574592590332 and parameters: {'fp_type': 'morgan_rdkit', 'combined_morgan_radius': 3, 'combined_morgan_nBits': 1024, 'combined_rdkit_maxPath': 7, 'combined_rdkit_nBits': 256, 'num_hidden_layers': 3, 'hidden_dim_0': 512, 'hidden_dim_1': 1024, 'hidden_dim_2': 64, 'kl_weight': 0.00015675588041950996, 'lr': 0.008700996803897736, 'batch_size': 128, 'dropout_rate': 0.08034827688598284, 'prior_mu': 0.022321639990037632, 'prior_sigma': 0.09726370335588104, 'normalization': 'layer'}. Best is trial 896 with value: 0.4533553242683411.
Generating morgan fingerprints...
Generated fingerprints with 2048 features for 841 molecules
Trial 2301: 5-fold CV loss = 0.6404
[I 2025-08-08 00:36:39,260] Trial 2301 finished with value: 0.6403775095939637 and parameters: {'fp_type': 'morgan_rdkit', 'combined_morgan_radius': 3, 'combined_morgan_nBits': 1024, 'combined_rdkit_maxPath': 7, 'combined_rdkit_nBits': 256, 'num_hidden_layers': 3, 'hidden_dim_0': 256, 'hidden_dim_1': 1024, 'hidden_dim_2': 64, 'kl_weight': 0.00015498406562782194, 'lr': 0.007859808080708845, 'batch_size': 128, 'dropout_rate': 0.09186080874745431, 'prior_mu': -0.038481343402716015, 'prior_sigma': 0.09853739029348879, 'normalization': 'layer'}. Best is trial 896 with value: 0.4533553242683411.
Generating morgan fingerprints...
Generated fingerprints with 2048 features for 841 molecules
Trial 2302: 5-fold CV loss = 0.7526
[I 2025-08-08 00:36:48,118] Trial 2302 finished with value: 0.7525996565818787 and parameters: {'fp_type': 'morgan', 'morgan_only_radius': 3, 'morgan_only_nBits': 2048, 'num_hidden_layers': 3, 'hidden_dim_0': 256, 'hidden_dim_1': 1024, 'hidden_dim_2': 1024, 'kl_weight': 0.00015253964250002796, 'lr': 0.00796237897986784, 'batch_size': 128, 'dropout_rate': 0.07258132739756872, 'prior_mu': -0.03762560208905727, 'prior_sigma': 0.11175553593952274, 'normalization': 'layer'}. Best is trial 896 with value: 0.4533553242683411.
Generating morgan_rdkit fingerprints...
Generated fingerprints with 2048 features for 841 molecules
Trial 2300: 5-fold CV loss = 0.4699
[I 2025-08-08 00:37:01,816] Trial 2300 finished with value: 0.4699239134788513 and parameters: {'fp_type': 'morgan_rdkit', 'combined_morgan_radius': 3, 'combined_morgan_nBits': 1024, 'combined_rdkit_maxPath': 7, 'combined_rdkit_nBits': 1024, 'num_hidden_layers': 3, 'hidden_dim_0': 256, 'hidden_dim_1': 256, 'hidden_dim_2': 64, 'kl_weight': 0.00015780198772828794, 'lr': 0.007767591928025148, 'batch_size': 128, 'dropout_rate': 0.09600598517700669, 'prior_mu': 0.02837058538884359, 'prior_sigma': 0.0968061451874029, 'normalization': 'layer'}. Best is trial 896 with value: 0.4533553242683411.
Generating morgan_rdkit fingerprints...
Generated fingerprints with 2048 features for 841 molecules
Trial 2303: 5-fold CV loss = 0.6729
[I 2025-08-08 00:37:09,768] Trial 2303 finished with value: 0.6729051828384399 and parameters: {'fp_type': 'morgan', 'morgan_only_radius': 3, 'morgan_only_nBits': 2048, 'num_hidden_layers': 3, 'hidden_dim_0': 256, 'hidden_dim_1': 1024, 'hidden_dim_2': 1024, 'kl_weight': 0.00017778163538254284, 'lr': 0.007546126695004391, 'batch_size': 128, 'dropout_rate': 0.07291395807962392, 'prior_mu': 0.0008865726925335188, 'prior_sigma': 0.10957709372435269, 'normalization': 'layer'}. Best is trial 896 with value: 0.4533553242683411.
Generating morgan_rdkit fingerprints...
Generated fingerprints with 2048 features for 841 molecules
Trial 2298: 5-fold CV loss = 0.5693
[I 2025-08-08 00:37:20,815] Trial 2298 finished with value: 0.5693383395671845 and parameters: {'fp_type': 'morgan_rdkit', 'combined_morgan_radius': 3, 'combined_morgan_nBits': 1024, 'combined_rdkit_maxPath': 7, 'combined_rdkit_nBits': 1024, 'num_hidden_layers': 3, 'hidden_dim_0': 64, 'hidden_dim_1': 1024, 'hidden_dim_2': 64, 'kl_weight': 0.00021144962742869334, 'lr': 0.007729275718325039, 'batch_size': 128, 'dropout_rate': 0.07431571186529323, 'prior_mu': 0.0025869997116834964, 'prior_sigma': 0.11742964880598077, 'normalization': 'layer'}. Best is trial 896 with value: 0.4533553242683411.
Generating morgan_rdkit fingerprints...
Generated fingerprints with 2048 features for 841 molecules
Trial 2304: 5-fold CV loss = 0.4675
[I 2025-08-08 00:37:27,818] Trial 2304 finished with value: 0.4675048887729645 and parameters: {'fp_type': 'morgan_rdkit', 'combined_morgan_radius': 3, 'combined_morgan_nBits': 1024, 'combined_rdkit_maxPath': 7, 'combined_rdkit_nBits': 1024, 'num_hidden_layers': 3, 'hidden_dim_0': 256, 'hidden_dim_1': 1024, 'hidden_dim_2': 64, 'kl_weight': 0.0002195383914711466, 'lr': 0.007476913336291289, 'batch_size': 128, 'dropout_rate': 0.04846320580913564, 'prior_mu': -0.051125036956386434, 'prior_sigma': 0.10362824202568229, 'normalization': 'layer'}. Best is trial 896 with value: 0.4533553242683411.
Generating morgan_rdkit fingerprints...
Generated fingerprints with 2048 features for 841 molecules
Trial 2305: 5-fold CV loss = 0.7436
[I 2025-08-08 00:37:49,688] Trial 2305 finished with value: 0.7435969591140748 and parameters: {'fp_type': 'morgan_rdkit', 'combined_morgan_radius': 3, 'combined_morgan_nBits': 1024, 'combined_rdkit_maxPath': 7, 'combined_rdkit_nBits': 1024, 'num_hidden_layers': 3, 'hidden_dim_0': 256, 'hidden_dim_1': 1024, 'hidden_dim_2': 64, 'kl_weight': 0.0002112406557105636, 'lr': 0.007506858532276569, 'batch_size': 128, 'dropout_rate': 0.048260529256564405, 'prior_mu': 7.992260063329273e-05, 'prior_sigma': 0.19189144376142628, 'normalization': 'layer'}. Best is trial 896 with value: 0.4533553242683411.
Generating morgan_rdkit fingerprints...
Generated fingerprints with 2048 features for 841 molecules
Trial 2306: 5-fold CV loss = 0.4631
[I 2025-08-08 00:37:51,183] Trial 2306 finished with value: 0.4631134569644928 and parameters: {'fp_type': 'morgan_rdkit', 'combined_morgan_radius': 3, 'combined_morgan_nBits': 1024, 'combined_rdkit_maxPath': 7, 'combined_rdkit_nBits': 1024, 'num_hidden_layers': 3, 'hidden_dim_0': 256, 'hidden_dim_1': 1024, 'hidden_dim_2': 64, 'kl_weight': 0.00023222754448561471, 'lr': 0.00870673234420123, 'batch_size': 128, 'dropout_rate': 0.10730737006674315, 'prior_mu': -0.052344328740699844, 'prior_sigma': 0.10082394231290509, 'normalization': 'layer'}. Best is trial 896 with value: 0.4533553242683411.
Generating morgan_rdkit fingerprints...
Generated fingerprints with 2048 features for 841 molecules
Trial 2308: 5-fold CV loss = 0.4621
[I 2025-08-08 00:38:07,752] Trial 2308 finished with value: 0.46207488179206846 and parameters: {'fp_type': 'morgan_rdkit', 'combined_morgan_radius': 3, 'combined_morgan_nBits': 1024, 'combined_rdkit_maxPath': 7, 'combined_rdkit_nBits': 1024, 'num_hidden_layers': 3, 'hidden_dim_0': 256, 'hidden_dim_1': 1024, 'hidden_dim_2': 64, 'kl_weight': 0.00017831149891387544, 'lr': 0.008679869514458082, 'batch_size': 128, 'dropout_rate': 0.10849717717836552, 'prior_mu': -0.036679591511274125, 'prior_sigma': 0.10973587178294372, 'normalization': 'layer'}. Best is trial 896 with value: 0.4533553242683411.
Generating morgan_rdkit fingerprints...
Generated fingerprints with 2048 features for 841 molecules
Trial 2310: 5-fold CV loss = 0.4648
[I 2025-08-08 00:38:29,178] Trial 2310 finished with value: 0.4647935688495636 and parameters: {'fp_type': 'morgan_rdkit', 'combined_morgan_radius': 3, 'combined_morgan_nBits': 1024, 'combined_rdkit_maxPath': 7, 'combined_rdkit_nBits': 1024, 'num_hidden_layers': 3, 'hidden_dim_0': 256, 'hidden_dim_1': 1024, 'hidden_dim_2': 64, 'kl_weight': 0.00018301463863443454, 'lr': 0.00860749108139928, 'batch_size': 128, 'dropout_rate': 0.0913459941982832, 'prior_mu': -0.07528287376545045, 'prior_sigma': 0.09826590706281806, 'normalization': 'layer'}. Best is trial 896 with value: 0.4533553242683411.
Generating morgan_rdkit fingerprints...
Generated fingerprints with 2048 features for 841 molecules
Trial 2311: 5-fold CV loss = 0.4551
[I 2025-08-08 00:38:42,663] Trial 2311 finished with value: 0.45513864755630495 and parameters: {'fp_type': 'morgan_rdkit', 'combined_morgan_radius': 3, 'combined_morgan_nBits': 1024, 'combined_rdkit_maxPath': 7, 'combined_rdkit_nBits': 1024, 'num_hidden_layers': 3, 'hidden_dim_0': 256, 'hidden_dim_1': 1024, 'hidden_dim_2': 64, 'kl_weight': 0.00013744297472436808, 'lr': 0.008351141154425491, 'batch_size': 128, 'dropout_rate': 0.08960706063370855, 'prior_mu': 0.014969291076572007, 'prior_sigma': 0.09919718232553311, 'normalization': 'layer'}. Best is trial 896 with value: 0.4533553242683411.
Generating morgan_rdkit fingerprints...
Generated fingerprints with 2048 features for 841 molecules
Trial 2309: 5-fold CV loss = 0.4688
[I 2025-08-08 00:38:48,149] Trial 2309 finished with value: 0.4688087046146393 and parameters: {'fp_type': 'morgan_rdkit', 'combined_morgan_radius': 3, 'combined_morgan_nBits': 1024, 'combined_rdkit_maxPath': 7, 'combined_rdkit_nBits': 1024, 'num_hidden_layers': 3, 'hidden_dim_0': 256, 'hidden_dim_1': 1024, 'hidden_dim_2': 64, 'kl_weight': 0.00023269298763973898, 'lr': 0.00868453438287129, 'batch_size': 128, 'dropout_rate': 0.10734363110760808, 'prior_mu': -0.03720168958140169, 'prior_sigma': 0.10019225114378269, 'normalization': 'layer'}. Best is trial 896 with value: 0.4533553242683411.
Generating morgan_rdkit fingerprints...
Generated fingerprints with 2048 features for 841 molecules
Trial 2307: 5-fold CV loss = 0.4612
[I 2025-08-08 00:39:05,084] Trial 2307 finished with value: 0.4611790657043457 and parameters: {'fp_type': 'morgan_rdkit', 'combined_morgan_radius': 3, 'combined_morgan_nBits': 1024, 'combined_rdkit_maxPath': 7, 'combined_rdkit_nBits': 1024, 'num_hidden_layers': 3, 'hidden_dim_0': 256, 'hidden_dim_1': 1024, 'hidden_dim_2': 64, 'kl_weight': 0.00022522940466924063, 'lr': 0.008889032887344375, 'batch_size': 128, 'dropout_rate': 0.11046900193388014, 'prior_mu': -0.07410596308672351, 'prior_sigma': 0.1036668843591477, 'normalization': 'layer'}. Best is trial 896 with value: 0.4533553242683411.
Generating morgan_rdkit fingerprints...
Generated fingerprints with 2048 features for 841 molecules
Trial 2312: 5-fold CV loss = 0.5500
[I 2025-08-08 00:39:09,182] Trial 2312 finished with value: 0.550032514333725 and parameters: {'fp_type': 'morgan_rdkit', 'combined_morgan_radius': 3, 'combined_morgan_nBits': 1024, 'combined_rdkit_maxPath': 7, 'combined_rdkit_nBits': 1024, 'num_hidden_layers': 3, 'hidden_dim_0': 256, 'hidden_dim_1': 1024, 'hidden_dim_2': 64, 'kl_weight': 0.0001307393165205477, 'lr': 0.0071182133828537955, 'batch_size': 128, 'dropout_rate': 0.11120685565788882, 'prior_mu': -0.062352211233475834, 'prior_sigma': 0.0954366265584011, 'normalization': 'layer'}. Best is trial 896 with value: 0.4533553242683411.
Generating morgan_rdkit fingerprints...
Generated fingerprints with 2048 features for 841 molecules
Trial 2313: 5-fold CV loss = 0.4567
[I 2025-08-08 00:39:21,855] Trial 2313 finished with value: 0.4567290723323822 and parameters: {'fp_type': 'morgan_rdkit', 'combined_morgan_radius': 3, 'combined_morgan_nBits': 1024, 'combined_rdkit_maxPath': 7, 'combined_rdkit_nBits': 1024, 'num_hidden_layers': 3, 'hidden_dim_0': 256, 'hidden_dim_1': 1024, 'hidden_dim_2': 64, 'kl_weight': 0.00012707429759588698, 'lr': 0.009016178138517726, 'batch_size': 128, 'dropout_rate': 0.08194432045512079, 'prior_mu': 0.016206835998060644, 'prior_sigma': 0.1006510845757746, 'normalization': 'layer'}. Best is trial 896 with value: 0.4533553242683411.
Generating morgan_rdkit fingerprints...
Generated fingerprints with 2048 features for 841 molecules
Trial 2316: 5-fold CV loss = 0.4707
[I 2025-08-08 00:39:50,512] Trial 2316 finished with value: 0.4707462966442108 and parameters: {'fp_type': 'morgan_rdkit', 'combined_morgan_radius': 3, 'combined_morgan_nBits': 1024, 'combined_rdkit_maxPath': 7, 'combined_rdkit_nBits': 1024, 'num_hidden_layers': 3, 'hidden_dim_0': 256, 'hidden_dim_1': 1024, 'hidden_dim_2': 64, 'kl_weight': 0.00012930773535860417, 'lr': 0.009322008430406311, 'batch_size': 128, 'dropout_rate': 0.08069731335617894, 'prior_mu': 0.014920458923598244, 'prior_sigma': 0.10574382664524552, 'normalization': 'layer'}. Best is trial 896 with value: 0.4533553242683411.
Generating morgan_rdkit fingerprints...
Generated fingerprints with 2048 features for 841 molecules
Trial 2314: 5-fold CV loss = 0.4676
[I 2025-08-08 00:39:53,179] Trial 2314 finished with value: 0.4675824880599976 and parameters: {'fp_type': 'morgan_rdkit', 'combined_morgan_radius': 3, 'combined_morgan_nBits': 1024, 'combined_rdkit_maxPath': 7, 'combined_rdkit_nBits': 1024, 'num_hidden_layers': 3, 'hidden_dim_0': 256, 'hidden_dim_1': 1024, 'hidden_dim_2': 64, 'kl_weight': 0.00014303853001010892, 'lr': 0.009017290557287937, 'batch_size': 128, 'dropout_rate': 0.07683145968889157, 'prior_mu': 0.020909625821203114, 'prior_sigma': 0.10298641057476465, 'normalization': 'layer'}. Best is trial 896 with value: 0.4533553242683411.
Generating morgan_rdkit fingerprints...
Generated fingerprints with 2048 features for 841 molecules
Trial 2317: 5-fold CV loss = 0.4629
[I 2025-08-08 00:39:55,727] Trial 2317 finished with value: 0.4629428029060364 and parameters: {'fp_type': 'morgan_rdkit', 'combined_morgan_radius': 3, 'combined_morgan_nBits': 1024, 'combined_rdkit_maxPath': 7, 'combined_rdkit_nBits': 1024, 'num_hidden_layers': 3, 'hidden_dim_0': 256, 'hidden_dim_1': 1024, 'hidden_dim_2': 64, 'kl_weight': 0.0001282543518251292, 'lr': 0.009975797438086466, 'batch_size': 128, 'dropout_rate': 0.07862704698375408, 'prior_mu': 0.02839470010444361, 'prior_sigma': 0.10242249070846476, 'normalization': 'layer'}. Best is trial 896 with value: 0.4533553242683411.
Generating morgan_rdkit fingerprints...
Generated fingerprints with 2048 features for 841 molecules
Trial 2320: 5-fold CV loss = 0.8915
[I 2025-08-08 00:40:05,877] Trial 2320 finished with value: 0.8915152192115784 and parameters: {'fp_type': 'morgan_rdkit', 'combined_morgan_radius': 3, 'combined_morgan_nBits': 1024, 'combined_rdkit_maxPath': 6, 'combined_rdkit_nBits': 1024, 'num_hidden_layers': 3, 'hidden_dim_0': 256, 'hidden_dim_1': 1024, 'hidden_dim_2': 512, 'kl_weight': 0.00013109034878476062, 'lr': 0.009907058686280766, 'batch_size': 128, 'dropout_rate': 0.07297735365509359, 'prior_mu': 0.03273678281764939, 'prior_sigma': 0.10131696876177652, 'normalization': 'layer'}. Best is trial 896 with value: 0.4533553242683411.
Generating morgan_rdkit fingerprints...
Generated fingerprints with 2048 features for 841 molecules
Trial 2315: 5-fold CV loss = 0.4774
[I 2025-08-08 00:40:21,116] Trial 2315 finished with value: 0.4773674368858337 and parameters: {'fp_type': 'morgan_rdkit', 'combined_morgan_radius': 3, 'combined_morgan_nBits': 1024, 'combined_rdkit_maxPath': 7, 'combined_rdkit_nBits': 1024, 'num_hidden_layers': 3, 'hidden_dim_0': 256, 'hidden_dim_1': 1024, 'hidden_dim_2': 64, 'kl_weight': 0.00013846497387640352, 'lr': 0.00994347394831331, 'batch_size': 128, 'dropout_rate': 0.07962056939724424, 'prior_mu': 0.017096904887959497, 'prior_sigma': 0.10319003101053224, 'normalization': 'layer'}. Best is trial 896 with value: 0.4533553242683411.
Generating morgan_rdkit fingerprints...
Generated fingerprints with 2048 features for 841 molecules
Trial 2318: 5-fold CV loss = 0.4655
[I 2025-08-08 00:40:34,278] Trial 2318 finished with value: 0.4654501974582672 and parameters: {'fp_type': 'morgan_rdkit', 'combined_morgan_radius': 3, 'combined_morgan_nBits': 1024, 'combined_rdkit_maxPath': 7, 'combined_rdkit_nBits': 1024, 'num_hidden_layers': 3, 'hidden_dim_0': 256, 'hidden_dim_1': 1024, 'hidden_dim_2': 64, 'kl_weight': 0.0001446947537181781, 'lr': 0.009253137444346289, 'batch_size': 128, 'dropout_rate': 0.06717205590767242, 'prior_mu': 0.03804830084535043, 'prior_sigma': 0.10434874003925756, 'normalization': 'layer'}. Best is trial 896 with value: 0.4533553242683411.
Generating morgan_rdkit fingerprints...
Generated fingerprints with 2048 features for 841 molecules
Trial 2321: 5-fold CV loss = 0.4613
[I 2025-08-08 00:40:44,798] Trial 2321 finished with value: 0.4613485991954803 and parameters: {'fp_type': 'morgan_rdkit', 'combined_morgan_radius': 3, 'combined_morgan_nBits': 1024, 'combined_rdkit_maxPath': 7, 'combined_rdkit_nBits': 1024, 'num_hidden_layers': 3, 'hidden_dim_0': 256, 'hidden_dim_1': 1024, 'hidden_dim_2': 64, 'kl_weight': 0.00012080977326986004, 'lr': 0.008674355436082415, 'batch_size': 128, 'dropout_rate': 0.06720127172005054, 'prior_mu': 0.024610133153353288, 'prior_sigma': 0.1005832329516946, 'normalization': 'layer'}. Best is trial 896 with value: 0.4533553242683411.
Generating morgan_rdkit fingerprints...
Generated fingerprints with 2048 features for 841 molecules
Trial 2319: 5-fold CV loss = 0.4673
[I 2025-08-08 00:40:48,557] Trial 2319 finished with value: 0.46731971502304076 and parameters: {'fp_type': 'morgan_rdkit', 'combined_morgan_radius': 3, 'combined_morgan_nBits': 1024, 'combined_rdkit_maxPath': 6, 'combined_rdkit_nBits': 1024, 'num_hidden_layers': 3, 'hidden_dim_0': 256, 'hidden_dim_1': 1024, 'hidden_dim_2': 64, 'kl_weight': 0.00010997421106915907, 'lr': 0.009038353248878993, 'batch_size': 128, 'dropout_rate': 0.06473835731390419, 'prior_mu': 0.01134596383022531, 'prior_sigma': 0.10116000402529236, 'normalization': 'layer'}. Best is trial 896 with value: 0.4533553242683411.
Generating morgan_rdkit fingerprints...
Generated fingerprints with 2048 features for 841 molecules
Trial 2323: 5-fold CV loss = 0.4621
[I 2025-08-08 00:41:19,223] Trial 2323 finished with value: 0.46206640005111693 and parameters: {'fp_type': 'morgan_rdkit', 'combined_morgan_radius': 3, 'combined_morgan_nBits': 1024, 'combined_rdkit_maxPath': 7, 'combined_rdkit_nBits': 1024, 'num_hidden_layers': 3, 'hidden_dim_0': 512, 'hidden_dim_1': 1024, 'hidden_dim_2': 64, 'kl_weight': 0.00012659902357387598, 'lr': 0.009952977079193822, 'batch_size': 128, 'dropout_rate': 0.06805296436304238, 'prior_mu': 0.012930030661847888, 'prior_sigma': 0.10161981214222661, 'normalization': 'layer'}. Best is trial 896 with value: 0.4533553242683411.
Generating morgan_rdkit fingerprints...
Generated fingerprints with 2048 features for 841 molecules
Trial 2324: 5-fold CV loss = 0.4650
[I 2025-08-08 00:41:23,470] Trial 2324 finished with value: 0.46500609517097474 and parameters: {'fp_type': 'morgan_rdkit', 'combined_morgan_radius': 3, 'combined_morgan_nBits': 1024, 'combined_rdkit_maxPath': 7, 'combined_rdkit_nBits': 1024, 'num_hidden_layers': 3, 'hidden_dim_0': 256, 'hidden_dim_1': 1024, 'hidden_dim_2': 64, 'kl_weight': 0.00011303629552735986, 'lr': 0.00921071980231897, 'batch_size': 128, 'dropout_rate': 0.08479430057268393, 'prior_mu': 0.03220326499852711, 'prior_sigma': 0.10750406893752411, 'normalization': 'layer'}. Best is trial 896 with value: 0.4533553242683411.
Generating rdkit fingerprints...
Generated fingerprints with 256 features for 841 molecules
Trial 2325: 5-fold CV loss = 0.4652
[I 2025-08-08 00:41:45,098] Trial 2325 finished with value: 0.4651658535003662 and parameters: {'fp_type': 'morgan_rdkit', 'combined_morgan_radius': 3, 'combined_morgan_nBits': 1024, 'combined_rdkit_maxPath': 7, 'combined_rdkit_nBits': 1024, 'num_hidden_layers': 3, 'hidden_dim_0': 512, 'hidden_dim_1': 1024, 'hidden_dim_2': 64, 'kl_weight': 0.00012477095033220221, 'lr': 0.009109001801004081, 'batch_size': 128, 'dropout_rate': 0.08776378680150088, 'prior_mu': 0.02738698385391347, 'prior_sigma': 0.10642730604980948, 'normalization': 'layer'}. Best is trial 896 with value: 0.4533553242683411.
Generating rdkit fingerprints...
Generated fingerprints with 256 features for 841 molecules
Trial 2326: 5-fold CV loss = 0.5504
