[I 2025-08-07 17:10:44,859] Trial 219 finished with value: 0.47674558162689207 and parameters: {'fp_type': 'morgan_rdkit', 'combined_morgan_radius': 2, 'combined_morgan_nBits': 512, 'combined_rdkit_maxPath': 7, 'combined_rdkit_nBits': 1024, 'num_hidden_layers': 2, 'hidden_dim_0': 64, 'hidden_dim_1': 512, 'kl_weight': 0.00013646734812961743, 'lr': 0.0024780956911985503, 'batch_size': 32, 'dropout_rate': 0.2884488857023384, 'prior_mu': 0.06828860149463067, 'prior_sigma': 0.01471488324257998, 'normalization': 'layer'}. Best is trial 179 with value: 0.4671938598155975.
Generating morgan_rdkit fingerprints...
Generated fingerprints with 2048 features for 841 molecules
Trial 218: 5-fold CV loss = 0.4782
[I 2025-08-07 17:10:59,156] Trial 218 finished with value: 0.478169584274292 and parameters: {'fp_type': 'morgan_rdkit', 'combined_morgan_radius': 2, 'combined_morgan_nBits': 512, 'combined_rdkit_maxPath': 7, 'combined_rdkit_nBits': 1024, 'num_hidden_layers': 2, 'hidden_dim_0': 64, 'hidden_dim_1': 512, 'kl_weight': 0.00014111496675841713, 'lr': 0.002539551569900202, 'batch_size': 32, 'dropout_rate': 0.28681229152746296, 'prior_mu': 0.057694158342578614, 'prior_sigma': 0.013104569817796063, 'normalization': 'layer'}. Best is trial 179 with value: 0.4671938598155975.
Generating morgan_rdkit fingerprints...
Generated fingerprints with 2048 features for 841 molecules
Trial 222: 5-fold CV loss = 0.4779
[I 2025-08-07 17:11:34,847] Trial 222 finished with value: 0.47789698243141177 and parameters: {'fp_type': 'morgan_rdkit', 'combined_morgan_radius': 2, 'combined_morgan_nBits': 1024, 'combined_rdkit_maxPath': 7, 'combined_rdkit_nBits': 1024, 'num_hidden_layers': 2, 'hidden_dim_0': 64, 'hidden_dim_1': 512, 'kl_weight': 0.0001399543829272288, 'lr': 0.002555591623706797, 'batch_size': 32, 'dropout_rate': 0.27288718614710517, 'prior_mu': 0.048477481189468596, 'prior_sigma': 0.015918712193626533, 'normalization': 'layer'}. Best is trial 179 with value: 0.4671938598155975.
Generating morgan_rdkit fingerprints...
Generated fingerprints with 1536 features for 841 molecules
Trial 223: 5-fold CV loss = 0.4793
[I 2025-08-07 17:11:52,159] Trial 223 finished with value: 0.4793149769306183 and parameters: {'fp_type': 'morgan_rdkit', 'combined_morgan_radius': 2, 'combined_morgan_nBits': 1024, 'combined_rdkit_maxPath': 7, 'combined_rdkit_nBits': 1024, 'num_hidden_layers': 2, 'hidden_dim_0': 64, 'hidden_dim_1': 512, 'kl_weight': 0.0001813659388678788, 'lr': 0.0021033814657124977, 'batch_size': 32, 'dropout_rate': 0.26986837593623475, 'prior_mu': 0.0679029298774651, 'prior_sigma': 0.01791978465234868, 'normalization': 'layer'}. Best is trial 179 with value: 0.4671938598155975.
Generating morgan_rdkit fingerprints...
Generated fingerprints with 1536 features for 841 molecules
Trial 221: 5-fold CV loss = 0.4815
[I 2025-08-07 17:12:08,427] Trial 221 finished with value: 0.4815459489822388 and parameters: {'fp_type': 'morgan_rdkit', 'combined_morgan_radius': 2, 'combined_morgan_nBits': 512, 'combined_rdkit_maxPath': 7, 'combined_rdkit_nBits': 1024, 'num_hidden_layers': 2, 'hidden_dim_0': 64, 'hidden_dim_1': 512, 'kl_weight': 0.00014421863189637777, 'lr': 0.0025922206437838133, 'batch_size': 32, 'dropout_rate': 0.2853281898302079, 'prior_mu': 0.06906805568095499, 'prior_sigma': 0.016185943078652818, 'normalization': 'layer'}. Best is trial 179 with value: 0.4671938598155975.
Generating morgan_rdkit fingerprints...
Generated fingerprints with 1536 features for 841 molecules
Trial 224: 5-fold CV loss = 0.4850
[I 2025-08-07 17:12:26,032] Trial 224 finished with value: 0.48499333262443545 and parameters: {'fp_type': 'morgan_rdkit', 'combined_morgan_radius': 2, 'combined_morgan_nBits': 512, 'combined_rdkit_maxPath': 7, 'combined_rdkit_nBits': 1024, 'num_hidden_layers': 2, 'hidden_dim_0': 64, 'hidden_dim_1': 512, 'kl_weight': 0.000177680169812087, 'lr': 0.002150374671162775, 'batch_size': 32, 'dropout_rate': 0.29240657169612033, 'prior_mu': 0.0709430524994851, 'prior_sigma': 0.01867233080300742, 'normalization': 'layer'}. Best is trial 179 with value: 0.4671938598155975.
Generating morgan_rdkit fingerprints...
Generated fingerprints with 1536 features for 841 molecules
Trial 225: 5-fold CV loss = 0.4832
[I 2025-08-07 17:12:49,450] Trial 225 finished with value: 0.48315733671188354 and parameters: {'fp_type': 'morgan_rdkit', 'combined_morgan_radius': 2, 'combined_morgan_nBits': 512, 'combined_rdkit_maxPath': 7, 'combined_rdkit_nBits': 1024, 'num_hidden_layers': 2, 'hidden_dim_0': 64, 'hidden_dim_1': 512, 'kl_weight': 0.0001209517959096737, 'lr': 0.002810179284743556, 'batch_size': 32, 'dropout_rate': 0.2931081817739703, 'prior_mu': 0.06932567559789943, 'prior_sigma': 0.01074879015040789, 'normalization': 'layer'}. Best is trial 179 with value: 0.4671938598155975.
Generating morgan_rdkit fingerprints...
Generated fingerprints with 1536 features for 841 molecules
Trial 226: 5-fold CV loss = 0.4849
[I 2025-08-07 17:13:18,518] Trial 226 finished with value: 0.4848703682422638 and parameters: {'fp_type': 'morgan_rdkit', 'combined_morgan_radius': 2, 'combined_morgan_nBits': 512, 'combined_rdkit_maxPath': 7, 'combined_rdkit_nBits': 1024, 'num_hidden_layers': 2, 'hidden_dim_0': 64, 'hidden_dim_1': 512, 'kl_weight': 0.00012129541878365818, 'lr': 0.0028754996627756413, 'batch_size': 32, 'dropout_rate': 0.29494031082186106, 'prior_mu': 0.07705249923237194, 'prior_sigma': 0.011165538338351393, 'normalization': 'layer'}. Best is trial 179 with value: 0.4671938598155975.
Generating morgan_rdkit fingerprints...
Generated fingerprints with 1536 features for 841 molecules
Trial 227: 5-fold CV loss = 0.4739
[I 2025-08-07 17:13:22,702] Trial 227 finished with value: 0.47391107082366946 and parameters: {'fp_type': 'morgan_rdkit', 'combined_morgan_radius': 2, 'combined_morgan_nBits': 512, 'combined_rdkit_maxPath': 7, 'combined_rdkit_nBits': 1024, 'num_hidden_layers': 2, 'hidden_dim_0': 64, 'hidden_dim_1': 512, 'kl_weight': 0.00011706842042802903, 'lr': 0.002871383997413172, 'batch_size': 32, 'dropout_rate': 0.25663987721221876, 'prior_mu': 0.07871870194708097, 'prior_sigma': 0.026438521012523374, 'normalization': 'layer'}. Best is trial 179 with value: 0.4671938598155975.
Generating morgan_rdkit fingerprints...
Generated fingerprints with 1536 features for 841 molecules
Trial 220: 5-fold CV loss = 0.4720
[I 2025-08-07 17:13:45,110] Trial 220 finished with value: 0.472037261724472 and parameters: {'fp_type': 'morgan_rdkit', 'combined_morgan_radius': 2, 'combined_morgan_nBits': 512, 'combined_rdkit_maxPath': 7, 'combined_rdkit_nBits': 1024, 'num_hidden_layers': 2, 'hidden_dim_0': 64, 'hidden_dim_1': 512, 'kl_weight': 0.00013511137075045574, 'lr': 0.0025621160041400114, 'batch_size': 32, 'dropout_rate': 0.2877036705478766, 'prior_mu': 0.04946674793208524, 'prior_sigma': 0.018286647587763712, 'normalization': 'layer'}. Best is trial 179 with value: 0.4671938598155975.
Generating morgan_rdkit fingerprints...
Generated fingerprints with 1536 features for 841 molecules
Trial 228: 5-fold CV loss = 0.4760
[I 2025-08-07 17:13:57,315] Trial 228 finished with value: 0.476001638174057 and parameters: {'fp_type': 'morgan_rdkit', 'combined_morgan_radius': 2, 'combined_morgan_nBits': 512, 'combined_rdkit_maxPath': 7, 'combined_rdkit_nBits': 1024, 'num_hidden_layers': 2, 'hidden_dim_0': 64, 'hidden_dim_1': 512, 'kl_weight': 0.00011398364248972846, 'lr': 0.0029491662959478713, 'batch_size': 32, 'dropout_rate': 0.25704833093125756, 'prior_mu': 0.07814195227974298, 'prior_sigma': 0.025895502487432883, 'normalization': 'layer'}. Best is trial 179 with value: 0.4671938598155975.
Generating morgan_rdkit fingerprints...
Generated fingerprints with 1536 features for 841 molecules
Trial 230: 5-fold CV loss = 0.4822
[I 2025-08-07 17:14:29,353] Trial 230 finished with value: 0.4821547091007233 and parameters: {'fp_type': 'morgan_rdkit', 'combined_morgan_radius': 2, 'combined_morgan_nBits': 512, 'combined_rdkit_maxPath': 7, 'combined_rdkit_nBits': 1024, 'num_hidden_layers': 2, 'hidden_dim_0': 64, 'hidden_dim_1': 512, 'kl_weight': 0.00015121493814789568, 'lr': 0.0022303769725050015, 'batch_size': 32, 'dropout_rate': 0.26009691615842717, 'prior_mu': 0.05228440462704775, 'prior_sigma': 0.02638701673205557, 'normalization': 'layer'}. Best is trial 179 with value: 0.4671938598155975.
Generating morgan_rdkit fingerprints...
Generated fingerprints with 768 features for 841 molecules
Trial 232: 5-fold CV loss = 0.4814
[I 2025-08-07 17:15:03,033] Trial 232 finished with value: 0.481389707326889 and parameters: {'fp_type': 'morgan_rdkit', 'combined_morgan_radius': 3, 'combined_morgan_nBits': 512, 'combined_rdkit_maxPath': 7, 'combined_rdkit_nBits': 1024, 'num_hidden_layers': 2, 'hidden_dim_0': 64, 'hidden_dim_1': 512, 'kl_weight': 0.00011209094678136101, 'lr': 0.0026756277420320294, 'batch_size': 32, 'dropout_rate': 0.25826721755771676, 'prior_mu': 0.08042937586128847, 'prior_sigma': 0.025834543993596734, 'normalization': 'layer'}. Best is trial 179 with value: 0.4671938598155975.
Generating morgan_rdkit fingerprints...
Generated fingerprints with 1536 features for 841 molecules
Trial 233: 5-fold CV loss = 0.5237
[I 2025-08-07 17:15:09,149] Trial 233 finished with value: 0.5236885786056519 and parameters: {'fp_type': 'morgan_rdkit', 'combined_morgan_radius': 3, 'combined_morgan_nBits': 512, 'combined_rdkit_maxPath': 7, 'combined_rdkit_nBits': 256, 'num_hidden_layers': 2, 'hidden_dim_0': 64, 'hidden_dim_1': 512, 'kl_weight': 0.00011502505119570808, 'lr': 0.002600719742468335, 'batch_size': 32, 'dropout_rate': 0.23758789621744708, 'prior_mu': 0.08334395816911702, 'prior_sigma': 0.023619672385227518, 'normalization': 'layer'}. Best is trial 179 with value: 0.4671938598155975.
Generating morgan_rdkit fingerprints...
Generated fingerprints with 1536 features for 841 molecules
Trial 229: 5-fold CV loss = 0.4686
[I 2025-08-07 17:15:12,582] Trial 229 finished with value: 0.4685673534870148 and parameters: {'fp_type': 'morgan_rdkit', 'combined_morgan_radius': 2, 'combined_morgan_nBits': 512, 'combined_rdkit_maxPath': 7, 'combined_rdkit_nBits': 1024, 'num_hidden_layers': 2, 'hidden_dim_0': 64, 'hidden_dim_1': 512, 'kl_weight': 0.00010013897519170779, 'lr': 0.0018367619319754384, 'batch_size': 32, 'dropout_rate': 0.26282315887506535, 'prior_mu': 0.0347750469258476, 'prior_sigma': 0.025555037513877443, 'normalization': 'layer'}. Best is trial 179 with value: 0.4671938598155975.
Generating morgan_rdkit fingerprints...
Generated fingerprints with 1536 features for 841 molecules
Trial 234: 5-fold CV loss = 0.4817
[I 2025-08-07 17:16:01,692] Trial 234 finished with value: 0.48167866468429565 and parameters: {'fp_type': 'morgan_rdkit', 'combined_morgan_radius': 2, 'combined_morgan_nBits': 512, 'combined_rdkit_maxPath': 7, 'combined_rdkit_nBits': 1024, 'num_hidden_layers': 2, 'hidden_dim_0': 64, 'hidden_dim_1': 512, 'kl_weight': 0.00013027947084591173, 'lr': 0.00242832879620934, 'batch_size': 32, 'dropout_rate': 0.2317774309909791, 'prior_mu': 0.03846001056192397, 'prior_sigma': 0.021051445583829948, 'normalization': 'layer'}. Best is trial 179 with value: 0.4671938598155975.
Generating morgan_rdkit fingerprints...
Generated fingerprints with 1536 features for 841 molecules
Trial 235: 5-fold CV loss = 0.4751
[I 2025-08-07 17:16:05,848] Trial 235 finished with value: 0.4751145601272583 and parameters: {'fp_type': 'morgan_rdkit', 'combined_morgan_radius': 2, 'combined_morgan_nBits': 512, 'combined_rdkit_maxPath': 7, 'combined_rdkit_nBits': 1024, 'num_hidden_layers': 2, 'hidden_dim_0': 64, 'hidden_dim_1': 512, 'kl_weight': 0.00012934832716996554, 'lr': 0.0024197462658409365, 'batch_size': 32, 'dropout_rate': 0.26420721802160557, 'prior_mu': 0.03489821876714147, 'prior_sigma': 0.022009155288595265, 'normalization': 'layer'}. Best is trial 179 with value: 0.4671938598155975.
Generating morgan_rdkit fingerprints...
Generated fingerprints with 1536 features for 841 molecules
Trial 231: 5-fold CV loss = 0.4803
[I 2025-08-07 17:16:18,377] Trial 231 finished with value: 0.4802632749080658 and parameters: {'fp_type': 'morgan_rdkit', 'combined_morgan_radius': 3, 'combined_morgan_nBits': 512, 'combined_rdkit_maxPath': 7, 'combined_rdkit_nBits': 1024, 'num_hidden_layers': 2, 'hidden_dim_0': 64, 'hidden_dim_1': 512, 'kl_weight': 0.00013116920625495795, 'lr': 0.0023589666344407726, 'batch_size': 32, 'dropout_rate': 0.26240728665535135, 'prior_mu': 0.04494518227242076, 'prior_sigma': 0.024876408323819783, 'normalization': 'layer'}. Best is trial 179 with value: 0.4671938598155975.
Generating morgan_rdkit fingerprints...
Generated fingerprints with 1536 features for 841 molecules
Trial 236: 5-fold CV loss = 0.4749
[I 2025-08-07 17:16:47,944] Trial 236 finished with value: 0.47491341829299927 and parameters: {'fp_type': 'morgan_rdkit', 'combined_morgan_radius': 2, 'combined_morgan_nBits': 512, 'combined_rdkit_maxPath': 7, 'combined_rdkit_nBits': 1024, 'num_hidden_layers': 2, 'hidden_dim_0': 64, 'hidden_dim_1': 512, 'kl_weight': 0.00010200271591358815, 'lr': 0.00184820446414105, 'batch_size': 32, 'dropout_rate': 0.2639556050521602, 'prior_mu': 0.06571325703903212, 'prior_sigma': 0.021522266760463354, 'normalization': 'layer'}. Best is trial 179 with value: 0.4671938598155975.
Generating morgan_rdkit fingerprints...
Generated fingerprints with 1536 features for 841 molecules
Trial 238: 5-fold CV loss = 0.4810
[I 2025-08-07 17:17:01,734] Trial 238 finished with value: 0.4810134470462799 and parameters: {'fp_type': 'morgan_rdkit', 'combined_morgan_radius': 2, 'combined_morgan_nBits': 512, 'combined_rdkit_maxPath': 7, 'combined_rdkit_nBits': 1024, 'num_hidden_layers': 2, 'hidden_dim_0': 64, 'hidden_dim_1': 512, 'kl_weight': 0.0001000486154239858, 'lr': 0.001876408386914136, 'batch_size': 32, 'dropout_rate': 0.2669944638319128, 'prior_mu': 0.03039308126012756, 'prior_sigma': 0.02136896723920536, 'normalization': 'layer'}. Best is trial 179 with value: 0.4671938598155975.
Generating morgan_rdkit fingerprints...
Generated fingerprints with 1536 features for 841 molecules
Trial 237: 5-fold CV loss = 0.4739
[I 2025-08-07 17:17:16,616] Trial 237 finished with value: 0.4739492893218994 and parameters: {'fp_type': 'morgan_rdkit', 'combined_morgan_radius': 2, 'combined_morgan_nBits': 512, 'combined_rdkit_maxPath': 7, 'combined_rdkit_nBits': 1024, 'num_hidden_layers': 2, 'hidden_dim_0': 64, 'hidden_dim_1': 512, 'kl_weight': 0.00010048640002685618, 'lr': 0.001841684987426821, 'batch_size': 32, 'dropout_rate': 0.26732037168658185, 'prior_mu': 0.064259340665599, 'prior_sigma': 0.02831914136474454, 'normalization': 'layer'}. Best is trial 179 with value: 0.4671938598155975.
Generating morgan_rdkit fingerprints...
Generated fingerprints with 1536 features for 841 molecules
Trial 241: 5-fold CV loss = 0.4853
[I 2025-08-07 17:17:43,488] Trial 241 finished with value: 0.48534172773361206 and parameters: {'fp_type': 'morgan_rdkit', 'combined_morgan_radius': 2, 'combined_morgan_nBits': 512, 'combined_rdkit_maxPath': 6, 'combined_rdkit_nBits': 1024, 'num_hidden_layers': 2, 'hidden_dim_0': 64, 'hidden_dim_1': 512, 'kl_weight': 0.00011102406222346279, 'lr': 0.002932300017725678, 'batch_size': 32, 'dropout_rate': 0.2516430333494784, 'prior_mu': 0.03290540873834723, 'prior_sigma': 0.018628428441336713, 'normalization': 'layer'}. Best is trial 179 with value: 0.4671938598155975.
Generating morgan_rdkit fingerprints...
Generated fingerprints with 1536 features for 841 molecules
Trial 240: 5-fold CV loss = 0.4841
[I 2025-08-07 17:18:04,766] Trial 240 finished with value: 0.4841242372989655 and parameters: {'fp_type': 'morgan_rdkit', 'combined_morgan_radius': 2, 'combined_morgan_nBits': 512, 'combined_rdkit_maxPath': 6, 'combined_rdkit_nBits': 1024, 'num_hidden_layers': 2, 'hidden_dim_0': 64, 'hidden_dim_1': 512, 'kl_weight': 0.00010104255118236418, 'lr': 0.001768550720530475, 'batch_size': 32, 'dropout_rate': 0.2552485603446824, 'prior_mu': 0.019009688919149205, 'prior_sigma': 0.02048727806492287, 'normalization': 'layer'}. Best is trial 179 with value: 0.4671938598155975.
Generating morgan_rdkit fingerprints...
Generated fingerprints with 1536 features for 841 molecules
Trial 242: 5-fold CV loss = 0.4812
[I 2025-08-07 17:18:07,908] Trial 242 finished with value: 0.48115214705467224 and parameters: {'fp_type': 'morgan_rdkit', 'combined_morgan_radius': 2, 'combined_morgan_nBits': 512, 'combined_rdkit_maxPath': 6, 'combined_rdkit_nBits': 1024, 'num_hidden_layers': 2, 'hidden_dim_0': 64, 'hidden_dim_1': 512, 'kl_weight': 0.00010067242199048777, 'lr': 0.0018565236826110648, 'batch_size': 32, 'dropout_rate': 0.2534229492445279, 'prior_mu': 0.012488276398767505, 'prior_sigma': 0.02169371973525915, 'normalization': 'layer'}. Best is trial 179 with value: 0.4671938598155975.
Generating morgan_rdkit fingerprints...
Generated fingerprints with 1536 features for 841 molecules
Trial 243: 5-fold CV loss = 0.5374
[I 2025-08-07 17:19:06,459] Trial 243 finished with value: 0.5373540222644806 and parameters: {'fp_type': 'morgan_rdkit', 'combined_morgan_radius': 2, 'combined_morgan_nBits': 512, 'combined_rdkit_maxPath': 7, 'combined_rdkit_nBits': 1024, 'num_hidden_layers': 2, 'hidden_dim_0': 64, 'hidden_dim_1': 512, 'kl_weight': 0.00010271625188869268, 'lr': 0.0017893956285558665, 'batch_size': 32, 'dropout_rate': 0.2745424867035896, 'prior_mu': -0.017353916888183638, 'prior_sigma': 0.10783873426539026, 'normalization': 'none'}. Best is trial 179 with value: 0.4671938598155975.
Generating morgan_rdkit fingerprints...
Generated fingerprints with 1536 features for 841 molecules
Trial 245: 5-fold CV loss = 0.4782
[I 2025-08-07 17:19:07,610] Trial 245 finished with value: 0.47821434736251833 and parameters: {'fp_type': 'morgan_rdkit', 'combined_morgan_radius': 2, 'combined_morgan_nBits': 512, 'combined_rdkit_maxPath': 7, 'combined_rdkit_nBits': 1024, 'num_hidden_layers': 2, 'hidden_dim_0': 64, 'hidden_dim_1': 512, 'kl_weight': 0.00011613456916376699, 'lr': 0.0020888600820020775, 'batch_size': 32, 'dropout_rate': 0.2736356294400632, 'prior_mu': 0.07552249134417693, 'prior_sigma': 0.02645384079514061, 'normalization': 'layer'}. Best is trial 179 with value: 0.4671938598155975.
Generating morgan_rdkit fingerprints...
Generated fingerprints with 1536 features for 841 molecules
Trial 239: 5-fold CV loss = 0.4689
[I 2025-08-07 17:19:12,824] Trial 239 finished with value: 0.4689377903938293 and parameters: {'fp_type': 'morgan_rdkit', 'combined_morgan_radius': 2, 'combined_morgan_nBits': 512, 'combined_rdkit_maxPath': 7, 'combined_rdkit_nBits': 1024, 'num_hidden_layers': 2, 'hidden_dim_0': 64, 'hidden_dim_1': 512, 'kl_weight': 0.00010020148988003183, 'lr': 0.0029083027002111254, 'batch_size': 32, 'dropout_rate': 0.27316716017077847, 'prior_mu': 0.03126032624889352, 'prior_sigma': 0.021872133287662972, 'normalization': 'layer'}. Best is trial 179 with value: 0.4671938598155975.
Generating morgan_rdkit fingerprints...
Generated fingerprints with 1536 features for 841 molecules
Trial 244: 5-fold CV loss = 0.4770
[I 2025-08-07 17:19:46,161] Trial 244 finished with value: 0.4770141661167145 and parameters: {'fp_type': 'morgan_rdkit', 'combined_morgan_radius': 2, 'combined_morgan_nBits': 512, 'combined_rdkit_maxPath': 7, 'combined_rdkit_nBits': 1024, 'num_hidden_layers': 2, 'hidden_dim_0': 64, 'hidden_dim_1': 512, 'kl_weight': 0.00011423063693720047, 'lr': 0.001867590287919227, 'batch_size': 32, 'dropout_rate': 0.27590290396528194, 'prior_mu': 0.07413108077898833, 'prior_sigma': 0.015449829779104519, 'normalization': 'layer'}. Best is trial 179 with value: 0.4671938598155975.
Generating morgan_rdkit fingerprints...
Generated fingerprints with 1536 features for 841 molecules
Trial 246: 5-fold CV loss = 0.4859
[I 2025-08-07 17:19:54,367] Trial 246 finished with value: 0.48587037324905397 and parameters: {'fp_type': 'morgan_rdkit', 'combined_morgan_radius': 2, 'combined_morgan_nBits': 512, 'combined_rdkit_maxPath': 7, 'combined_rdkit_nBits': 1024, 'num_hidden_layers': 2, 'hidden_dim_0': 64, 'hidden_dim_1': 512, 'kl_weight': 0.00011932929032683081, 'lr': 0.0021421206199849917, 'batch_size': 32, 'dropout_rate': 0.26764821691282353, 'prior_mu': 0.07707407783247149, 'prior_sigma': 0.01602870096160521, 'normalization': 'layer'}. Best is trial 179 with value: 0.4671938598155975.
Generating morgan_rdkit fingerprints...
Generated fingerprints with 1536 features for 841 molecules
Trial 247: 5-fold CV loss = 0.4845
[I 2025-08-07 17:20:01,417] Trial 247 finished with value: 0.48446401953697205 and parameters: {'fp_type': 'morgan_rdkit', 'combined_morgan_radius': 2, 'combined_morgan_nBits': 512, 'combined_rdkit_maxPath': 7, 'combined_rdkit_nBits': 1024, 'num_hidden_layers': 2, 'hidden_dim_0': 64, 'hidden_dim_1': 512, 'kl_weight': 0.00011878360728003915, 'lr': 0.003130353246368029, 'batch_size': 32, 'dropout_rate': 0.23994978612488901, 'prior_mu': 0.06304241088984894, 'prior_sigma': 0.015883947335407128, 'normalization': 'layer'}. Best is trial 179 with value: 0.4671938598155975.
Generating morgan_rdkit fingerprints...
Generated fingerprints with 1536 features for 841 molecules
Trial 250: 5-fold CV loss = 0.4791
[I 2025-08-07 17:20:43,685] Trial 250 finished with value: 0.47913148403167727 and parameters: {'fp_type': 'morgan_rdkit', 'combined_morgan_radius': 2, 'combined_morgan_nBits': 512, 'combined_rdkit_maxPath': 7, 'combined_rdkit_nBits': 1024, 'num_hidden_layers': 2, 'hidden_dim_0': 64, 'hidden_dim_1': 64, 'kl_weight': 0.00010084626460711403, 'lr': 0.003063946237231951, 'batch_size': 32, 'dropout_rate': 0.23985534820830223, 'prior_mu': 0.03555683069369512, 'prior_sigma': 0.027159168791302226, 'normalization': 'layer'}. Best is trial 179 with value: 0.4671938598155975.
Generating morgan_rdkit fingerprints...
Generated fingerprints with 1536 features for 841 molecules
Trial 251: 5-fold CV loss = 0.4829
