[I 2025-08-07 19:53:12,323] Trial 853 finished with value: 0.45653292536735535 and parameters: {'fp_type': 'morgan_rdkit', 'combined_morgan_radius': 3, 'combined_morgan_nBits': 1024, 'combined_rdkit_maxPath': 7, 'combined_rdkit_nBits': 1024, 'num_hidden_layers': 3, 'hidden_dim_0': 256, 'hidden_dim_1': 1024, 'hidden_dim_2': 64, 'kl_weight': 0.0003281096530571468, 'lr': 0.00479204486590324, 'batch_size': 64, 'dropout_rate': 0.08763679160322528, 'prior_mu': -0.04036211239062247, 'prior_sigma': 0.07650158243154913, 'normalization': 'layer'}. Best is trial 587 with value: 0.4552353322505951.
Generating morgan_rdkit fingerprints...
Generated fingerprints with 1536 features for 841 molecules
Trial 847: 5-fold CV loss = 0.5746
[I 2025-08-07 19:53:16,137] Trial 847 finished with value: 0.5745994627475739 and parameters: {'fp_type': 'rdkit', 'rdkit_only_maxPath': 7, 'rdkit_only_nBits': 1024, 'num_hidden_layers': 3, 'hidden_dim_0': 256, 'hidden_dim_1': 1024, 'hidden_dim_2': 1024, 'kl_weight': 0.00020528131846231552, 'lr': 0.005706742852366289, 'batch_size': 64, 'dropout_rate': 0.16460596757728857, 'prior_mu': 0.12772358035935996, 'prior_sigma': 0.0712752694595511, 'normalization': 'layer'}. Best is trial 587 with value: 0.4552353322505951.
Generating morgan_rdkit fingerprints...
Generated fingerprints with 1536 features for 841 molecules
Trial 857: 5-fold CV loss = 0.4649
[I 2025-08-07 19:53:30,030] Trial 857 finished with value: 0.4648634552955627 and parameters: {'fp_type': 'morgan_rdkit', 'combined_morgan_radius': 3, 'combined_morgan_nBits': 1024, 'combined_rdkit_maxPath': 7, 'combined_rdkit_nBits': 1024, 'num_hidden_layers': 3, 'hidden_dim_0': 256, 'hidden_dim_1': 1024, 'hidden_dim_2': 64, 'kl_weight': 0.0003368290686256042, 'lr': 0.004711169038040727, 'batch_size': 128, 'dropout_rate': 0.10936728120317911, 'prior_mu': -0.0072191532737429995, 'prior_sigma': 0.08439034982726601, 'normalization': 'layer'}. Best is trial 587 with value: 0.4552353322505951.
Generating morgan_rdkit fingerprints...
Generated fingerprints with 1536 features for 841 molecules
Trial 858: 5-fold CV loss = 0.5112
[I 2025-08-07 19:53:34,275] Trial 858 finished with value: 0.5112315893173218 and parameters: {'fp_type': 'morgan_rdkit', 'combined_morgan_radius': 3, 'combined_morgan_nBits': 1024, 'combined_rdkit_maxPath': 7, 'combined_rdkit_nBits': 512, 'num_hidden_layers': 3, 'hidden_dim_0': 256, 'hidden_dim_1': 1024, 'hidden_dim_2': 64, 'kl_weight': 0.0003711008253558299, 'lr': 0.006278252267909451, 'batch_size': 128, 'dropout_rate': 0.10747843925357495, 'prior_mu': -0.009761216327956027, 'prior_sigma': 0.08454481103816949, 'normalization': 'layer'}. Best is trial 587 with value: 0.4552353322505951.
Generating morgan_rdkit fingerprints...
Generated fingerprints with 2048 features for 841 molecules
Trial 862: 5-fold CV loss = 0.4736
[I 2025-08-07 19:54:13,662] Trial 862 finished with value: 0.47361997365951536 and parameters: {'fp_type': 'morgan_rdkit', 'combined_morgan_radius': 3, 'combined_morgan_nBits': 1024, 'combined_rdkit_maxPath': 7, 'combined_rdkit_nBits': 1024, 'num_hidden_layers': 3, 'hidden_dim_0': 256, 'hidden_dim_1': 1024, 'hidden_dim_2': 64, 'kl_weight': 0.00031102382804870947, 'lr': 0.004957386256115496, 'batch_size': 64, 'dropout_rate': 0.07918612324465264, 'prior_mu': -0.027341967845638214, 'prior_sigma': 0.07805192005535792, 'normalization': 'layer'}. Best is trial 587 with value: 0.4552353322505951.
Generating morgan fingerprints...
Generated fingerprints with 2048 features for 841 molecules
Trial 861: 5-fold CV loss = 0.5007
[I 2025-08-07 19:54:18,917] Trial 861 finished with value: 0.5007416009902954 and parameters: {'fp_type': 'morgan_rdkit', 'combined_morgan_radius': 3, 'combined_morgan_nBits': 1024, 'combined_rdkit_maxPath': 7, 'combined_rdkit_nBits': 512, 'num_hidden_layers': 3, 'hidden_dim_0': 256, 'hidden_dim_1': 1024, 'hidden_dim_2': 64, 'kl_weight': 0.0003032094144163328, 'lr': 0.0048320209937000105, 'batch_size': 64, 'dropout_rate': 0.0785029268667427, 'prior_mu': -0.026795430914374786, 'prior_sigma': 0.07627558748287651, 'normalization': 'layer'}. Best is trial 587 with value: 0.4552353322505951.
Generating morgan fingerprints...
Generated fingerprints with 2048 features for 841 molecules
Trial 859: 5-fold CV loss = 0.4851
[I 2025-08-07 19:54:21,377] Trial 859 finished with value: 0.4850913166999817 and parameters: {'fp_type': 'morgan_rdkit', 'combined_morgan_radius': 3, 'combined_morgan_nBits': 1024, 'combined_rdkit_maxPath': 7, 'combined_rdkit_nBits': 512, 'num_hidden_layers': 3, 'hidden_dim_0': 256, 'hidden_dim_1': 1024, 'hidden_dim_2': 64, 'kl_weight': 0.0003110555096747954, 'lr': 0.005856928189804244, 'batch_size': 64, 'dropout_rate': 0.06858533558268701, 'prior_mu': -0.011920646722308258, 'prior_sigma': 0.07546542392674324, 'normalization': 'layer'}. Best is trial 587 with value: 0.4552353322505951.
Generating morgan fingerprints...
Generated fingerprints with 2048 features for 841 molecules
Trial 863: 5-fold CV loss = 0.5172
[I 2025-08-07 19:54:42,011] Trial 863 finished with value: 0.517196673154831 and parameters: {'fp_type': 'morgan', 'morgan_only_radius': 2, 'morgan_only_nBits': 2048, 'num_hidden_layers': 3, 'hidden_dim_0': 256, 'hidden_dim_1': 1024, 'hidden_dim_2': 64, 'kl_weight': 0.00025870925553551097, 'lr': 0.004551193771166493, 'batch_size': 64, 'dropout_rate': 0.08758995862889353, 'prior_mu': 0.0029971875891970177, 'prior_sigma': 0.07621906149493107, 'normalization': 'layer'}. Best is trial 587 with value: 0.4552353322505951.
Generating morgan_rdkit fingerprints...
Generated fingerprints with 2048 features for 841 molecules
Trial 864: 5-fold CV loss = 0.5132
[I 2025-08-07 19:54:55,875] Trial 864 finished with value: 0.5132463634014129 and parameters: {'fp_type': 'morgan', 'morgan_only_radius': 2, 'morgan_only_nBits': 2048, 'num_hidden_layers': 3, 'hidden_dim_0': 256, 'hidden_dim_1': 1024, 'hidden_dim_2': 64, 'kl_weight': 0.00026762659513039383, 'lr': 0.004411507632096131, 'batch_size': 64, 'dropout_rate': 0.0901511671350343, 'prior_mu': -0.0455458813793483, 'prior_sigma': 0.0795734895964324, 'normalization': 'layer'}. Best is trial 587 with value: 0.4552353322505951.
Generating morgan_rdkit fingerprints...
Generated fingerprints with 2048 features for 841 molecules
Trial 865: 5-fold CV loss = 0.5196
[I 2025-08-07 19:55:01,328] Trial 865 finished with value: 0.5196415185928345 and parameters: {'fp_type': 'morgan', 'morgan_only_radius': 2, 'morgan_only_nBits': 2048, 'num_hidden_layers': 3, 'hidden_dim_0': 256, 'hidden_dim_1': 256, 'hidden_dim_2': 64, 'kl_weight': 0.0002638424544090524, 'lr': 0.005382470130601875, 'batch_size': 64, 'dropout_rate': 0.09138178553412168, 'prior_mu': 0.0007700494848052238, 'prior_sigma': 0.0797574534983699, 'normalization': 'layer'}. Best is trial 587 with value: 0.4552353322505951.
Generating morgan_rdkit fingerprints...
Generated fingerprints with 2048 features for 841 molecules
Trial 860: 5-fold CV loss = 0.4942
[I 2025-08-07 19:55:12,890] Trial 860 finished with value: 0.4941994845867157 and parameters: {'fp_type': 'morgan_rdkit', 'combined_morgan_radius': 3, 'combined_morgan_nBits': 1024, 'combined_rdkit_maxPath': 7, 'combined_rdkit_nBits': 512, 'num_hidden_layers': 3, 'hidden_dim_0': 256, 'hidden_dim_1': 1024, 'hidden_dim_2': 64, 'kl_weight': 0.00032753287995435516, 'lr': 0.005200945617699309, 'batch_size': 64, 'dropout_rate': 0.08995500511429227, 'prior_mu': -0.007933407636473926, 'prior_sigma': 0.0754713358253208, 'normalization': 'layer'}. Best is trial 587 with value: 0.4552353322505951.
Generating morgan_rdkit fingerprints...
Generated fingerprints with 2048 features for 841 molecules
Trial 866: 5-fold CV loss = 0.4659
[I 2025-08-07 19:55:27,007] Trial 866 finished with value: 0.46589634418487547 and parameters: {'fp_type': 'morgan_rdkit', 'combined_morgan_radius': 3, 'combined_morgan_nBits': 1024, 'combined_rdkit_maxPath': 7, 'combined_rdkit_nBits': 1024, 'num_hidden_layers': 3, 'hidden_dim_0': 256, 'hidden_dim_1': 256, 'hidden_dim_2': 64, 'kl_weight': 0.0003753696773835974, 'lr': 0.006046512848476578, 'batch_size': 64, 'dropout_rate': 0.09585973693016599, 'prior_mu': -0.0491416836416656, 'prior_sigma': 0.08027804234528638, 'normalization': 'layer'}. Best is trial 587 with value: 0.4552353322505951.
Generating morgan_rdkit fingerprints...
Generated fingerprints with 2048 features for 841 molecules
Trial 867: 5-fold CV loss = 0.4647
[I 2025-08-07 19:55:50,080] Trial 867 finished with value: 0.46465773582458497 and parameters: {'fp_type': 'morgan_rdkit', 'combined_morgan_radius': 3, 'combined_morgan_nBits': 1024, 'combined_rdkit_maxPath': 7, 'combined_rdkit_nBits': 1024, 'num_hidden_layers': 3, 'hidden_dim_0': 256, 'hidden_dim_1': 256, 'hidden_dim_2': 64, 'kl_weight': 0.00037624422703484825, 'lr': 0.005324320336813948, 'batch_size': 64, 'dropout_rate': 0.08823692287087467, 'prior_mu': -0.02235343991890293, 'prior_sigma': 0.08171830118186192, 'normalization': 'layer'}. Best is trial 587 with value: 0.4552353322505951.
Generating morgan_rdkit fingerprints...
Generated fingerprints with 2048 features for 841 molecules
Trial 870: 5-fold CV loss = 0.4674
[I 2025-08-07 19:56:04,753] Trial 870 finished with value: 0.4674172341823578 and parameters: {'fp_type': 'morgan_rdkit', 'combined_morgan_radius': 3, 'combined_morgan_nBits': 1024, 'combined_rdkit_maxPath': 7, 'combined_rdkit_nBits': 1024, 'num_hidden_layers': 3, 'hidden_dim_0': 256, 'hidden_dim_1': 1024, 'hidden_dim_2': 64, 'kl_weight': 0.0003824332081648942, 'lr': 0.006286352711633399, 'batch_size': 64, 'dropout_rate': 0.10044113767368477, 'prior_mu': -0.03565047781904496, 'prior_sigma': 0.08402538083828695, 'normalization': 'layer'}. Best is trial 587 with value: 0.4552353322505951.
Generating morgan_rdkit fingerprints...
Generated fingerprints with 2048 features for 841 molecules
Trial 868: 5-fold CV loss = 0.4641
[I 2025-08-07 19:56:10,430] Trial 868 finished with value: 0.4640808582305908 and parameters: {'fp_type': 'morgan_rdkit', 'combined_morgan_radius': 3, 'combined_morgan_nBits': 1024, 'combined_rdkit_maxPath': 7, 'combined_rdkit_nBits': 1024, 'num_hidden_layers': 3, 'hidden_dim_0': 256, 'hidden_dim_1': 1024, 'hidden_dim_2': 64, 'kl_weight': 0.00037483236532665317, 'lr': 0.006109459065790144, 'batch_size': 64, 'dropout_rate': 0.09755257403536041, 'prior_mu': -0.035269769890348135, 'prior_sigma': 0.08368870542963772, 'normalization': 'layer'}. Best is trial 587 with value: 0.4552353322505951.
Generating morgan_rdkit fingerprints...
Generated fingerprints with 2048 features for 841 molecules
Trial 871: 5-fold CV loss = 0.4629
[I 2025-08-07 19:56:49,172] Trial 871 finished with value: 0.46291726231575014 and parameters: {'fp_type': 'morgan_rdkit', 'combined_morgan_radius': 3, 'combined_morgan_nBits': 1024, 'combined_rdkit_maxPath': 7, 'combined_rdkit_nBits': 1024, 'num_hidden_layers': 3, 'hidden_dim_0': 256, 'hidden_dim_1': 1024, 'hidden_dim_2': 64, 'kl_weight': 0.00034748728891542295, 'lr': 0.006192634352019147, 'batch_size': 64, 'dropout_rate': 0.10241378376966578, 'prior_mu': -0.03339612340396071, 'prior_sigma': 0.11863206495108887, 'normalization': 'layer'}. Best is trial 587 with value: 0.4552353322505951.
Generating morgan_rdkit fingerprints...
Generated fingerprints with 2048 features for 841 molecules
Trial 872: 5-fold CV loss = 0.4691
[I 2025-08-07 19:56:52,170] Trial 872 finished with value: 0.46909639835357664 and parameters: {'fp_type': 'morgan_rdkit', 'combined_morgan_radius': 3, 'combined_morgan_nBits': 1024, 'combined_rdkit_maxPath': 7, 'combined_rdkit_nBits': 1024, 'num_hidden_layers': 3, 'hidden_dim_0': 256, 'hidden_dim_1': 1024, 'hidden_dim_2': 64, 'kl_weight': 0.0002904606139384295, 'lr': 0.005782303205758094, 'batch_size': 64, 'dropout_rate': 0.11717867919321479, 'prior_mu': -0.028942144824831102, 'prior_sigma': 0.11789946520003415, 'normalization': 'layer'}. Best is trial 587 with value: 0.4552353322505951.
Generating morgan_rdkit fingerprints...
Generated fingerprints with 2048 features for 841 molecules
Trial 873: 5-fold CV loss = 0.4610
[I 2025-08-07 19:57:21,391] Trial 873 finished with value: 0.46103405952453613 and parameters: {'fp_type': 'morgan_rdkit', 'combined_morgan_radius': 3, 'combined_morgan_nBits': 1024, 'combined_rdkit_maxPath': 7, 'combined_rdkit_nBits': 1024, 'num_hidden_layers': 3, 'hidden_dim_0': 256, 'hidden_dim_1': 1024, 'hidden_dim_2': 64, 'kl_weight': 0.00028669693221548115, 'lr': 0.006995103444900564, 'batch_size': 64, 'dropout_rate': 0.11878173134640432, 'prior_mu': -0.023637252807850256, 'prior_sigma': 0.10388106166902959, 'normalization': 'layer'}. Best is trial 587 with value: 0.4552353322505951.
Generating morgan_rdkit fingerprints...
Generated fingerprints with 2048 features for 841 molecules
Trial 869: 5-fold CV loss = 0.4667
[I 2025-08-07 19:57:23,825] Trial 869 finished with value: 0.466693252325058 and parameters: {'fp_type': 'morgan_rdkit', 'combined_morgan_radius': 3, 'combined_morgan_nBits': 1024, 'combined_rdkit_maxPath': 7, 'combined_rdkit_nBits': 1024, 'num_hidden_layers': 3, 'hidden_dim_0': 256, 'hidden_dim_1': 1024, 'hidden_dim_2': 64, 'kl_weight': 0.0003759306557455153, 'lr': 0.006081366738927046, 'batch_size': 64, 'dropout_rate': 0.09599915705140126, 'prior_mu': -0.03556339157083275, 'prior_sigma': 0.08327167698477578, 'normalization': 'layer'}. Best is trial 587 with value: 0.4552353322505951.
Generating morgan_rdkit fingerprints...
Generated fingerprints with 2048 features for 841 molecules
Trial 875: 5-fold CV loss = 0.5766
[I 2025-08-07 19:57:35,651] Trial 875 finished with value: 0.5766087710857392 and parameters: {'fp_type': 'morgan_rdkit', 'combined_morgan_radius': 3, 'combined_morgan_nBits': 1024, 'combined_rdkit_maxPath': 7, 'combined_rdkit_nBits': 1024, 'num_hidden_layers': 3, 'hidden_dim_0': 256, 'hidden_dim_1': 1024, 'hidden_dim_2': 256, 'kl_weight': 0.00021494243534814686, 'lr': 0.0070116126138907164, 'batch_size': 128, 'dropout_rate': 0.0700463965995559, 'prior_mu': 0.13479118532621007, 'prior_sigma': 0.08964278304290108, 'normalization': 'layer'}. Best is trial 587 with value: 0.4552353322505951.
Generating morgan_rdkit fingerprints...
Generated fingerprints with 2048 features for 841 molecules
Trial 874: 5-fold CV loss = 0.4673
[I 2025-08-07 19:57:39,623] Trial 874 finished with value: 0.4672944784164429 and parameters: {'fp_type': 'morgan_rdkit', 'combined_morgan_radius': 3, 'combined_morgan_nBits': 1024, 'combined_rdkit_maxPath': 7, 'combined_rdkit_nBits': 1024, 'num_hidden_layers': 3, 'hidden_dim_0': 256, 'hidden_dim_1': 1024, 'hidden_dim_2': 64, 'kl_weight': 0.00021653977544091647, 'lr': 0.007147963348145135, 'batch_size': 128, 'dropout_rate': 0.12464731227186723, 'prior_mu': -0.19234263028199727, 'prior_sigma': 0.10355004040539109, 'normalization': 'layer'}. Best is trial 587 with value: 0.4552353322505951.
Generating morgan_rdkit fingerprints...
Generated fingerprints with 2048 features for 841 molecules
Trial 878: 5-fold CV loss = 0.6626
[I 2025-08-07 19:58:07,326] Trial 878 finished with value: 0.662626850605011 and parameters: {'fp_type': 'morgan_rdkit', 'combined_morgan_radius': 3, 'combined_morgan_nBits': 1024, 'combined_rdkit_maxPath': 7, 'combined_rdkit_nBits': 1024, 'num_hidden_layers': 3, 'hidden_dim_0': 512, 'hidden_dim_1': 1024, 'hidden_dim_2': 64, 'kl_weight': 0.0252810795692984, 'lr': 0.004954919155271511, 'batch_size': 128, 'dropout_rate': 0.11768996860782349, 'prior_mu': -0.021504551569159078, 'prior_sigma': 0.10488375564747861, 'normalization': 'layer'}. Best is trial 587 with value: 0.4552353322505951.
Generating morgan_rdkit fingerprints...
Generated fingerprints with 2048 features for 841 molecules
Trial 879: 5-fold CV loss = 0.6340
[I 2025-08-07 19:58:16,131] Trial 879 finished with value: 0.6339614033699036 and parameters: {'fp_type': 'morgan_rdkit', 'combined_morgan_radius': 3, 'combined_morgan_nBits': 1024, 'combined_rdkit_maxPath': 7, 'combined_rdkit_nBits': 1024, 'num_hidden_layers': 3, 'hidden_dim_0': 512, 'hidden_dim_1': 1024, 'hidden_dim_2': 64, 'kl_weight': 0.0003065261541894377, 'lr': 0.004979108622381127, 'batch_size': 128, 'dropout_rate': 0.1166996374548275, 'prior_mu': -0.021245246585806232, 'prior_sigma': 0.10863564049178312, 'normalization': 'layer'}. Best is trial 587 with value: 0.4552353322505951.
Generating morgan_rdkit fingerprints...
Generated fingerprints with 2048 features for 841 molecules
Trial 876: 5-fold CV loss = 0.4782
[I 2025-08-07 19:58:26,145] Trial 876 finished with value: 0.47820077538490297 and parameters: {'fp_type': 'morgan_rdkit', 'combined_morgan_radius': 3, 'combined_morgan_nBits': 1024, 'combined_rdkit_maxPath': 7, 'combined_rdkit_nBits': 1024, 'num_hidden_layers': 3, 'hidden_dim_0': 256, 'hidden_dim_1': 1024, 'hidden_dim_2': 64, 'kl_weight': 0.00029860167735313523, 'lr': 0.005021388437859861, 'batch_size': 128, 'dropout_rate': 0.11874152571968696, 'prior_mu': -0.021879017119969372, 'prior_sigma': 0.10965718362407617, 'normalization': 'layer'}. Best is trial 587 with value: 0.4552353322505951.
Generating morgan_rdkit fingerprints...
Generated fingerprints with 2048 features for 841 molecules
Trial 880: 5-fold CV loss = 0.4773
[I 2025-08-07 19:58:39,776] Trial 880 finished with value: 0.47726194858551024 and parameters: {'fp_type': 'morgan_rdkit', 'combined_morgan_radius': 3, 'combined_morgan_nBits': 1024, 'combined_rdkit_maxPath': 5, 'combined_rdkit_nBits': 1024, 'num_hidden_layers': 3, 'hidden_dim_0': 256, 'hidden_dim_1': 1024, 'hidden_dim_2': 64, 'kl_weight': 0.0002925660264506837, 'lr': 0.005576863905368444, 'batch_size': 128, 'dropout_rate': 0.11558425288362471, 'prior_mu': -0.016255306259977422, 'prior_sigma': 0.10820952199967825, 'normalization': 'layer'}. Best is trial 587 with value: 0.4552353322505951.
Generating morgan_rdkit fingerprints...
Generated fingerprints with 2048 features for 841 molecules
Trial 877: 5-fold CV loss = 0.5585
[I 2025-08-07 19:58:48,911] Trial 877 finished with value: 0.5585149705410004 and parameters: {'fp_type': 'morgan_rdkit', 'combined_morgan_radius': 3, 'combined_morgan_nBits': 1024, 'combined_rdkit_maxPath': 7, 'combined_rdkit_nBits': 1024, 'num_hidden_layers': 3, 'hidden_dim_0': 256, 'hidden_dim_1': 1024, 'hidden_dim_2': 64, 'kl_weight': 0.00030623169501166716, 'lr': 0.006770566788120916, 'batch_size': 128, 'dropout_rate': 0.11792646884089646, 'prior_mu': -0.020628535244390976, 'prior_sigma': 0.10642350053723412, 'normalization': 'layer'}. Best is trial 587 with value: 0.4552353322505951.
Generating morgan_rdkit fingerprints...
Generated fingerprints with 2048 features for 841 molecules
Trial 881: 5-fold CV loss = 0.4837
[I 2025-08-07 19:58:54,661] Trial 881 finished with value: 0.48369088768959045 and parameters: {'fp_type': 'morgan_rdkit', 'combined_morgan_radius': 3, 'combined_morgan_nBits': 1024, 'combined_rdkit_maxPath': 5, 'combined_rdkit_nBits': 1024, 'num_hidden_layers': 3, 'hidden_dim_0': 256, 'hidden_dim_1': 1024, 'hidden_dim_2': 64, 'kl_weight': 0.00027799509583666056, 'lr': 0.006575647667568534, 'batch_size': 128, 'dropout_rate': 0.12788078526933847, 'prior_mu': -0.01563175804115408, 'prior_sigma': 0.1112223504503756, 'normalization': 'layer'}. Best is trial 587 with value: 0.4552353322505951.
Generating morgan_rdkit fingerprints...
Generated fingerprints with 2048 features for 841 molecules
Trial 883: 5-fold CV loss = 0.5529
[I 2025-08-07 19:59:11,343] Trial 883 finished with value: 0.5529449939727783 and parameters: {'fp_type': 'morgan_rdkit', 'combined_morgan_radius': 3, 'combined_morgan_nBits': 1024, 'combined_rdkit_maxPath': 7, 'combined_rdkit_nBits': 1024, 'num_hidden_layers': 3, 'hidden_dim_0': 256, 'hidden_dim_1': 1024, 'hidden_dim_2': 64, 'kl_weight': 0.00042166503822411414, 'lr': 0.006741424596946383, 'batch_size': 128, 'dropout_rate': 0.1285441987600159, 'prior_mu': -0.012350183029391053, 'prior_sigma': 0.09961168647162298, 'normalization': 'layer'}. Best is trial 587 with value: 0.4552353322505951.
Generating morgan_rdkit fingerprints...
Generated fingerprints with 2048 features for 841 molecules
Trial 885: 5-fold CV loss = 0.8677
[I 2025-08-07 19:59:21,619] Trial 885 finished with value: 0.8676616430282593 and parameters: {'fp_type': 'morgan_rdkit', 'combined_morgan_radius': 3, 'combined_morgan_nBits': 1024, 'combined_rdkit_maxPath': 7, 'combined_rdkit_nBits': 1024, 'num_hidden_layers': 3, 'hidden_dim_0': 256, 'hidden_dim_1': 1024, 'hidden_dim_2': 64, 'kl_weight': 0.00042674868108246903, 'lr': 0.0003145599119446334, 'batch_size': 128, 'dropout_rate': 0.12626017116637095, 'prior_mu': -0.029534956033716673, 'prior_sigma': 0.09962218676979745, 'normalization': 'layer'}. Best is trial 587 with value: 0.4552353322505951.
Generating morgan_rdkit fingerprints...
Generated fingerprints with 2048 features for 841 molecules
Trial 882: 5-fold CV loss = 0.4624
[I 2025-08-07 19:59:29,969] Trial 882 finished with value: 0.4624093294143677 and parameters: {'fp_type': 'morgan_rdkit', 'combined_morgan_radius': 3, 'combined_morgan_nBits': 1024, 'combined_rdkit_maxPath': 7, 'combined_rdkit_nBits': 1024, 'num_hidden_layers': 3, 'hidden_dim_0': 256, 'hidden_dim_1': 1024, 'hidden_dim_2': 64, 'kl_weight': 0.0003382986172221031, 'lr': 0.00556625401924578, 'batch_size': 128, 'dropout_rate': 0.10653007201005024, 'prior_mu': -0.01377461291679769, 'prior_sigma': 0.0991817573866029, 'normalization': 'layer'}. Best is trial 587 with value: 0.4552353322505951.
Generating morgan_rdkit fingerprints...
Generated fingerprints with 2048 features for 841 molecules
Trial 886: 5-fold CV loss = 0.5575
