[I 2025-08-07 21:51:24,973] Trial 1457 finished with value: 0.8877775430679321 and parameters: {'fp_type': 'rdkit', 'rdkit_only_maxPath': 8, 'rdkit_only_nBits': 256, 'num_hidden_layers': 3, 'hidden_dim_0': 256, 'hidden_dim_1': 1024, 'hidden_dim_2': 64, 'kl_weight': 0.0002946949598277078, 'lr': 0.005785898030413597, 'batch_size': 128, 'dropout_rate': 0.12944702575631695, 'prior_mu': 0.0008728349060135726, 'prior_sigma': 0.061787908467214034, 'normalization': 'layer'}. Best is trial 896 with value: 0.4533553242683411.
Generating morgan_rdkit fingerprints...
Generated fingerprints with 2048 features for 841 molecules
Trial 1455: 5-fold CV loss = 0.4625
[I 2025-08-07 21:51:26,799] Trial 1455 finished with value: 0.46252591609954835 and parameters: {'fp_type': 'morgan_rdkit', 'combined_morgan_radius': 3, 'combined_morgan_nBits': 1024, 'combined_rdkit_maxPath': 7, 'combined_rdkit_nBits': 1024, 'num_hidden_layers': 3, 'hidden_dim_0': 1024, 'hidden_dim_1': 1024, 'hidden_dim_2': 64, 'kl_weight': 0.00035825168892755126, 'lr': 0.005788021663133757, 'batch_size': 128, 'dropout_rate': 0.10321400151443146, 'prior_mu': -0.04168007016250731, 'prior_sigma': 0.07098984663928386, 'normalization': 'layer'}. Best is trial 896 with value: 0.4533553242683411.
Generating morgan_rdkit fingerprints...
Generated fingerprints with 2048 features for 841 molecules
Trial 1456: 5-fold CV loss = 0.8878
[I 2025-08-07 21:51:30,172] Trial 1456 finished with value: 0.8877768874168396 and parameters: {'fp_type': 'rdkit', 'rdkit_only_maxPath': 7, 'rdkit_only_nBits': 256, 'num_hidden_layers': 3, 'hidden_dim_0': 1024, 'hidden_dim_1': 1024, 'hidden_dim_2': 64, 'kl_weight': 0.000296853823905273, 'lr': 0.005809030796567023, 'batch_size': 128, 'dropout_rate': 0.12312195058752894, 'prior_mu': 0.0002244895401089502, 'prior_sigma': 0.06795244971891475, 'normalization': 'layer'}. Best is trial 896 with value: 0.4533553242683411.
Generating morgan_rdkit fingerprints...
Generated fingerprints with 2048 features for 841 molecules
Trial 1459: 5-fold CV loss = 0.4679
[I 2025-08-07 21:52:07,007] Trial 1459 finished with value: 0.4679288327693939 and parameters: {'fp_type': 'morgan_rdkit', 'combined_morgan_radius': 3, 'combined_morgan_nBits': 1024, 'combined_rdkit_maxPath': 7, 'combined_rdkit_nBits': 1024, 'num_hidden_layers': 3, 'hidden_dim_0': 256, 'hidden_dim_1': 1024, 'hidden_dim_2': 64, 'kl_weight': 0.00027579937813158796, 'lr': 0.007122681300328352, 'batch_size': 64, 'dropout_rate': 0.12214722471841141, 'prior_mu': -0.029564921546772933, 'prior_sigma': 0.06813303754553363, 'normalization': 'layer'}. Best is trial 896 with value: 0.4533553242683411.
Generating morgan_rdkit fingerprints...
Generated fingerprints with 2048 features for 841 molecules
Trial 1458: 5-fold CV loss = 0.8647
[I 2025-08-07 21:52:18,663] Trial 1458 finished with value: 0.8647051334381104 and parameters: {'fp_type': 'rdkit', 'rdkit_only_maxPath': 7, 'rdkit_only_nBits': 256, 'num_hidden_layers': 3, 'hidden_dim_0': 256, 'hidden_dim_1': 1024, 'hidden_dim_2': 64, 'kl_weight': 0.00028607271084518, 'lr': 0.005728357846634563, 'batch_size': 128, 'dropout_rate': 0.12553504645690386, 'prior_mu': 0.004514665646054163, 'prior_sigma': 0.06177456408352362, 'normalization': 'layer'}. Best is trial 896 with value: 0.4533553242683411.
Generating morgan_rdkit fingerprints...
Generated fingerprints with 2048 features for 841 molecules
Trial 1462: 5-fold CV loss = 0.8888
[I 2025-08-07 21:52:21,991] Trial 1462 finished with value: 0.8888289093971252 and parameters: {'fp_type': 'morgan_rdkit', 'combined_morgan_radius': 3, 'combined_morgan_nBits': 1024, 'combined_rdkit_maxPath': 8, 'combined_rdkit_nBits': 1024, 'num_hidden_layers': 3, 'hidden_dim_0': 256, 'hidden_dim_1': 1024, 'hidden_dim_2': 512, 'kl_weight': 0.00038339836488508034, 'lr': 0.006495002813087453, 'batch_size': 128, 'dropout_rate': 0.10243866386662134, 'prior_mu': -0.032215230709422046, 'prior_sigma': 0.08226437435027951, 'normalization': 'layer'}. Best is trial 896 with value: 0.4533553242683411.
Generating morgan_rdkit fingerprints...
Generated fingerprints with 2048 features for 841 molecules
Trial 1460: 5-fold CV loss = 0.4728
[I 2025-08-07 21:52:24,513] Trial 1460 finished with value: 0.4728096008300781 and parameters: {'fp_type': 'morgan_rdkit', 'combined_morgan_radius': 3, 'combined_morgan_nBits': 1024, 'combined_rdkit_maxPath': 8, 'combined_rdkit_nBits': 1024, 'num_hidden_layers': 3, 'hidden_dim_0': 256, 'hidden_dim_1': 1024, 'hidden_dim_2': 64, 'kl_weight': 0.0002809884159360396, 'lr': 0.007064865970302355, 'batch_size': 64, 'dropout_rate': 0.12424274257461079, 'prior_mu': -0.029451325370436935, 'prior_sigma': 0.08324393470120292, 'normalization': 'layer'}. Best is trial 896 with value: 0.4533553242683411.
Generating morgan_rdkit fingerprints...
Generated fingerprints with 2048 features for 841 molecules
Trial 1461: 5-fold CV loss = 0.4615
[I 2025-08-07 21:52:43,598] Trial 1461 finished with value: 0.46147316694259644 and parameters: {'fp_type': 'morgan_rdkit', 'combined_morgan_radius': 3, 'combined_morgan_nBits': 1024, 'combined_rdkit_maxPath': 7, 'combined_rdkit_nBits': 1024, 'num_hidden_layers': 3, 'hidden_dim_0': 256, 'hidden_dim_1': 1024, 'hidden_dim_2': 64, 'kl_weight': 0.0002677289743726619, 'lr': 0.007123716382411949, 'batch_size': 64, 'dropout_rate': 0.1209682438660917, 'prior_mu': -0.029485803984712122, 'prior_sigma': 0.0809493588646392, 'normalization': 'layer'}. Best is trial 896 with value: 0.4533553242683411.
Generating morgan_rdkit fingerprints...
Generated fingerprints with 2048 features for 841 molecules
Trial 1464: 5-fold CV loss = 0.4637
[I 2025-08-07 21:53:00,372] Trial 1464 finished with value: 0.46367715001106263 and parameters: {'fp_type': 'morgan_rdkit', 'combined_morgan_radius': 3, 'combined_morgan_nBits': 1024, 'combined_rdkit_maxPath': 7, 'combined_rdkit_nBits': 1024, 'num_hidden_layers': 3, 'hidden_dim_0': 256, 'hidden_dim_1': 1024, 'hidden_dim_2': 64, 'kl_weight': 0.00046989505724101695, 'lr': 0.007039808296204895, 'batch_size': 128, 'dropout_rate': 0.12644847254243893, 'prior_mu': -0.02348558798484894, 'prior_sigma': 0.08516293386998529, 'normalization': 'layer'}. Best is trial 896 with value: 0.4533553242683411.
Generating morgan_rdkit fingerprints...
Generated fingerprints with 2048 features for 841 molecules
Trial 1465: 5-fold CV loss = 0.4579
[I 2025-08-07 21:53:04,890] Trial 1465 finished with value: 0.4578647792339325 and parameters: {'fp_type': 'morgan_rdkit', 'combined_morgan_radius': 3, 'combined_morgan_nBits': 1024, 'combined_rdkit_maxPath': 7, 'combined_rdkit_nBits': 1024, 'num_hidden_layers': 3, 'hidden_dim_0': 256, 'hidden_dim_1': 1024, 'hidden_dim_2': 64, 'kl_weight': 0.0003637893399945168, 'lr': 0.006238493705253669, 'batch_size': 128, 'dropout_rate': 0.09738053583557678, 'prior_mu': -0.018098739026933538, 'prior_sigma': 0.07931883366516483, 'normalization': 'layer'}. Best is trial 896 with value: 0.4533553242683411.
Generating morgan_rdkit fingerprints...
Generated fingerprints with 2048 features for 841 molecules
Trial 1467: 5-fold CV loss = 0.4639
[I 2025-08-07 21:53:35,156] Trial 1467 finished with value: 0.4638902544975281 and parameters: {'fp_type': 'morgan_rdkit', 'combined_morgan_radius': 3, 'combined_morgan_nBits': 1024, 'combined_rdkit_maxPath': 7, 'combined_rdkit_nBits': 1024, 'num_hidden_layers': 3, 'hidden_dim_0': 128, 'hidden_dim_1': 1024, 'hidden_dim_2': 64, 'kl_weight': 0.0004141347753579, 'lr': 0.0062497775196115974, 'batch_size': 128, 'dropout_rate': 0.10073872394612549, 'prior_mu': -0.01646894629155516, 'prior_sigma': 0.07486900289315311, 'normalization': 'layer'}. Best is trial 896 with value: 0.4533553242683411.
Generating morgan_rdkit fingerprints...
Generated fingerprints with 2048 features for 841 molecules
Trial 1466: 5-fold CV loss = 0.4653
[I 2025-08-07 21:53:39,717] Trial 1466 finished with value: 0.4653204619884491 and parameters: {'fp_type': 'morgan_rdkit', 'combined_morgan_radius': 3, 'combined_morgan_nBits': 1024, 'combined_rdkit_maxPath': 7, 'combined_rdkit_nBits': 1024, 'num_hidden_layers': 3, 'hidden_dim_0': 256, 'hidden_dim_1': 1024, 'hidden_dim_2': 64, 'kl_weight': 0.00046088952451349066, 'lr': 0.0062693565585206935, 'batch_size': 128, 'dropout_rate': 0.1108743836709849, 'prior_mu': -0.018000453873625463, 'prior_sigma': 0.07496551468085626, 'normalization': 'layer'}. Best is trial 896 with value: 0.4533553242683411.
Generating morgan_rdkit fingerprints...
Generated fingerprints with 2048 features for 841 molecules
Trial 1468: 5-fold CV loss = 0.4663
[I 2025-08-07 21:53:46,053] Trial 1468 finished with value: 0.46629269123077394 and parameters: {'fp_type': 'morgan_rdkit', 'combined_morgan_radius': 3, 'combined_morgan_nBits': 1024, 'combined_rdkit_maxPath': 7, 'combined_rdkit_nBits': 1024, 'num_hidden_layers': 3, 'hidden_dim_0': 256, 'hidden_dim_1': 1024, 'hidden_dim_2': 64, 'kl_weight': 0.00046768900820284544, 'lr': 0.005576822054207588, 'batch_size': 128, 'dropout_rate': 0.08430649288508835, 'prior_mu': -0.03965802341116548, 'prior_sigma': 0.07370481098555805, 'normalization': 'layer'}. Best is trial 896 with value: 0.4533553242683411.
Generating morgan_rdkit fingerprints...
Generated fingerprints with 2048 features for 841 molecules
Trial 1463: 5-fold CV loss = 0.4723
[I 2025-08-07 21:54:06,115] Trial 1463 finished with value: 0.4723343372344971 and parameters: {'fp_type': 'morgan_rdkit', 'combined_morgan_radius': 3, 'combined_morgan_nBits': 1024, 'combined_rdkit_maxPath': 8, 'combined_rdkit_nBits': 1024, 'num_hidden_layers': 3, 'hidden_dim_0': 256, 'hidden_dim_1': 1024, 'hidden_dim_2': 64, 'kl_weight': 0.00038455463080358483, 'lr': 0.0064403185495787475, 'batch_size': 128, 'dropout_rate': 0.10069303674797746, 'prior_mu': -0.03274959767295934, 'prior_sigma': 0.08121577388361786, 'normalization': 'layer'}. Best is trial 896 with value: 0.4533553242683411.
Generating morgan_rdkit fingerprints...
Generated fingerprints with 2048 features for 841 molecules
Trial 1469: 5-fold CV loss = 0.4587
[I 2025-08-07 21:54:10,401] Trial 1469 finished with value: 0.45871288180351255 and parameters: {'fp_type': 'morgan_rdkit', 'combined_morgan_radius': 3, 'combined_morgan_nBits': 1024, 'combined_rdkit_maxPath': 7, 'combined_rdkit_nBits': 1024, 'num_hidden_layers': 3, 'hidden_dim_0': 256, 'hidden_dim_1': 1024, 'hidden_dim_2': 64, 'kl_weight': 0.0005175991891177591, 'lr': 0.005383388226255452, 'batch_size': 128, 'dropout_rate': 0.0823877797980644, 'prior_mu': -0.05037942800457899, 'prior_sigma': 0.06542675240346514, 'normalization': 'layer'}. Best is trial 896 with value: 0.4533553242683411.
Generating morgan_rdkit fingerprints...
Generated fingerprints with 2048 features for 841 molecules
Trial 1471: 5-fold CV loss = 0.4729
[I 2025-08-07 21:54:32,809] Trial 1471 finished with value: 0.4728818297386169 and parameters: {'fp_type': 'morgan_rdkit', 'combined_morgan_radius': 3, 'combined_morgan_nBits': 1024, 'combined_rdkit_maxPath': 7, 'combined_rdkit_nBits': 1024, 'num_hidden_layers': 3, 'hidden_dim_0': 256, 'hidden_dim_1': 128, 'hidden_dim_2': 64, 'kl_weight': 0.0003885201073039563, 'lr': 0.0053214739554862, 'batch_size': 128, 'dropout_rate': 0.10579629014004188, 'prior_mu': -0.036206535962911124, 'prior_sigma': 0.06449816569299956, 'normalization': 'layer'}. Best is trial 896 with value: 0.4533553242683411.
Generating morgan_rdkit fingerprints...
Generated fingerprints with 2048 features for 841 molecules
Trial 1473: 5-fold CV loss = 0.5445
[I 2025-08-07 21:54:37,214] Trial 1473 finished with value: 0.5444947600364685 and parameters: {'fp_type': 'morgan_rdkit', 'combined_morgan_radius': 3, 'combined_morgan_nBits': 1024, 'combined_rdkit_maxPath': 7, 'combined_rdkit_nBits': 1024, 'num_hidden_layers': 3, 'hidden_dim_0': 256, 'hidden_dim_1': 1024, 'hidden_dim_2': 64, 'kl_weight': 0.0005474143434791322, 'lr': 0.005136727143828807, 'batch_size': 128, 'dropout_rate': 0.07065998428258313, 'prior_mu': -0.0604255056474749, 'prior_sigma': 0.060103432476719613, 'normalization': 'layer'}. Best is trial 896 with value: 0.4533553242683411.
Generating morgan_rdkit fingerprints...
Generated fingerprints with 2048 features for 841 molecules
Trial 1470: 5-fold CV loss = 0.4640
[I 2025-08-07 21:54:45,896] Trial 1470 finished with value: 0.46398845911026 and parameters: {'fp_type': 'morgan_rdkit', 'combined_morgan_radius': 3, 'combined_morgan_nBits': 1024, 'combined_rdkit_maxPath': 7, 'combined_rdkit_nBits': 1024, 'num_hidden_layers': 3, 'hidden_dim_0': 256, 'hidden_dim_1': 1024, 'hidden_dim_2': 64, 'kl_weight': 0.0003838944613488055, 'lr': 0.005407755883525608, 'batch_size': 128, 'dropout_rate': 0.06703754115069631, 'prior_mu': -0.048846875305534464, 'prior_sigma': 0.07760502338452355, 'normalization': 'layer'}. Best is trial 896 with value: 0.4533553242683411.
Generating morgan_rdkit fingerprints...
Generated fingerprints with 2048 features for 841 molecules
Trial 1474: 5-fold CV loss = 0.4661
[I 2025-08-07 21:55:09,472] Trial 1474 finished with value: 0.4660543203353882 and parameters: {'fp_type': 'morgan_rdkit', 'combined_morgan_radius': 3, 'combined_morgan_nBits': 1024, 'combined_rdkit_maxPath': 7, 'combined_rdkit_nBits': 1024, 'num_hidden_layers': 3, 'hidden_dim_0': 256, 'hidden_dim_1': 1024, 'hidden_dim_2': 64, 'kl_weight': 0.0005695780932136798, 'lr': 0.0052229011464917235, 'batch_size': 128, 'dropout_rate': 0.07081808257083391, 'prior_mu': -0.058232040340623945, 'prior_sigma': 0.06200307357501665, 'normalization': 'layer'}. Best is trial 896 with value: 0.4533553242683411.
Generating morgan_rdkit fingerprints...
Generated fingerprints with 2048 features for 841 molecules
Trial 1475: 5-fold CV loss = 0.4678
[I 2025-08-07 21:55:13,469] Trial 1475 finished with value: 0.4677619099617004 and parameters: {'fp_type': 'morgan_rdkit', 'combined_morgan_radius': 3, 'combined_morgan_nBits': 1024, 'combined_rdkit_maxPath': 7, 'combined_rdkit_nBits': 1024, 'num_hidden_layers': 3, 'hidden_dim_0': 256, 'hidden_dim_1': 1024, 'hidden_dim_2': 64, 'kl_weight': 0.0004553201431757725, 'lr': 0.0051935449161468255, 'batch_size': 128, 'dropout_rate': 0.07036359464462948, 'prior_mu': -0.054283804107133904, 'prior_sigma': 0.06341904910036182, 'normalization': 'layer'}. Best is trial 896 with value: 0.4533553242683411.
Generating morgan_rdkit fingerprints...
Generated fingerprints with 2048 features for 841 molecules
Trial 1476: 5-fold CV loss = 0.4718
[I 2025-08-07 21:55:29,506] Trial 1476 finished with value: 0.4717624545097351 and parameters: {'fp_type': 'morgan_rdkit', 'combined_morgan_radius': 3, 'combined_morgan_nBits': 1024, 'combined_rdkit_maxPath': 6, 'combined_rdkit_nBits': 1024, 'num_hidden_layers': 3, 'hidden_dim_0': 256, 'hidden_dim_1': 1024, 'hidden_dim_2': 64, 'kl_weight': 0.0005467022255479625, 'lr': 0.0051094157567178064, 'batch_size': 128, 'dropout_rate': 0.04976135177668695, 'prior_mu': -0.04718219049477075, 'prior_sigma': 0.06354789923613102, 'normalization': 'layer'}. Best is trial 896 with value: 0.4533553242683411.
Generating morgan_rdkit fingerprints...
Generated fingerprints with 2048 features for 841 molecules
Trial 1472: 5-fold CV loss = 0.4654
[I 2025-08-07 21:55:31,088] Trial 1472 finished with value: 0.4653718709945679 and parameters: {'fp_type': 'morgan_rdkit', 'combined_morgan_radius': 3, 'combined_morgan_nBits': 1024, 'combined_rdkit_maxPath': 7, 'combined_rdkit_nBits': 1024, 'num_hidden_layers': 3, 'hidden_dim_0': 256, 'hidden_dim_1': 1024, 'hidden_dim_2': 64, 'kl_weight': 0.0003745562054239428, 'lr': 0.005445699124428115, 'batch_size': 128, 'dropout_rate': 0.09094222810859602, 'prior_mu': -0.04879542542816196, 'prior_sigma': 0.06558691193621739, 'normalization': 'layer'}. Best is trial 896 with value: 0.4533553242683411.
Generating morgan_rdkit fingerprints...
Generated fingerprints with 1280 features for 841 molecules
Trial 1478: 5-fold CV loss = 0.4632
[I 2025-08-07 21:55:45,320] Trial 1478 finished with value: 0.46320276856422427 and parameters: {'fp_type': 'morgan_rdkit', 'combined_morgan_radius': 3, 'combined_morgan_nBits': 1024, 'combined_rdkit_maxPath': 6, 'combined_rdkit_nBits': 1024, 'num_hidden_layers': 3, 'hidden_dim_0': 256, 'hidden_dim_1': 1024, 'hidden_dim_2': 64, 'kl_weight': 0.0006409725797705106, 'lr': 0.005544601967651726, 'batch_size': 128, 'dropout_rate': 0.05235272201512439, 'prior_mu': -0.05419516605305845, 'prior_sigma': 0.06523060476702847, 'normalization': 'layer'}. Best is trial 896 with value: 0.4533553242683411.
Generating morgan_rdkit fingerprints...
Generated fingerprints with 1280 features for 841 molecules
Trial 1477: 5-fold CV loss = 0.4600
[I 2025-08-07 21:55:49,160] Trial 1477 finished with value: 0.4599831461906433 and parameters: {'fp_type': 'morgan_rdkit', 'combined_morgan_radius': 3, 'combined_morgan_nBits': 1024, 'combined_rdkit_maxPath': 7, 'combined_rdkit_nBits': 1024, 'num_hidden_layers': 3, 'hidden_dim_0': 256, 'hidden_dim_1': 1024, 'hidden_dim_2': 64, 'kl_weight': 0.0005097475356745349, 'lr': 0.005457218579942615, 'batch_size': 128, 'dropout_rate': 0.08178838036439551, 'prior_mu': -0.059919800470950996, 'prior_sigma': 0.06596904289361573, 'normalization': 'layer'}. Best is trial 896 with value: 0.4533553242683411.
Generating morgan_rdkit fingerprints...
Generated fingerprints with 2048 features for 841 molecules
Trial 1481: 5-fold CV loss = 0.5130
[I 2025-08-07 21:56:13,587] Trial 1481 finished with value: 0.5130120098590851 and parameters: {'fp_type': 'morgan_rdkit', 'combined_morgan_radius': 3, 'combined_morgan_nBits': 1024, 'combined_rdkit_maxPath': 7, 'combined_rdkit_nBits': 256, 'num_hidden_layers': 3, 'hidden_dim_0': 1024, 'hidden_dim_1': 1024, 'hidden_dim_2': 64, 'kl_weight': 0.00048440945770419035, 'lr': 0.005617948729916706, 'batch_size': 128, 'dropout_rate': 0.08660353476030498, 'prior_mu': -0.06925505536655432, 'prior_sigma': 0.07016361120916415, 'normalization': 'layer'}. Best is trial 896 with value: 0.4533553242683411.
Generating morgan_rdkit fingerprints...
Generated fingerprints with 2048 features for 841 molecules
Trial 1480: 5-fold CV loss = 0.5423
[I 2025-08-07 21:56:16,945] Trial 1480 finished with value: 0.5422883033752441 and parameters: {'fp_type': 'morgan_rdkit', 'combined_morgan_radius': 3, 'combined_morgan_nBits': 1024, 'combined_rdkit_maxPath': 7, 'combined_rdkit_nBits': 256, 'num_hidden_layers': 1, 'hidden_dim_0': 512, 'kl_weight': 0.0005097281990673719, 'lr': 0.005749998812648451, 'batch_size': 128, 'dropout_rate': 0.07594714122685664, 'prior_mu': -0.06648504566795514, 'prior_sigma': 0.06710168153673957, 'normalization': 'layer'}. Best is trial 896 with value: 0.4533553242683411.
Generating morgan_rdkit fingerprints...
Generated fingerprints with 2048 features for 841 molecules
Trial 1479: 5-fold CV loss = 0.4626
[I 2025-08-07 21:56:28,952] Trial 1479 finished with value: 0.46259382367134094 and parameters: {'fp_type': 'morgan_rdkit', 'combined_morgan_radius': 3, 'combined_morgan_nBits': 1024, 'combined_rdkit_maxPath': 7, 'combined_rdkit_nBits': 1024, 'num_hidden_layers': 3, 'hidden_dim_0': 256, 'hidden_dim_1': 1024, 'hidden_dim_2': 64, 'kl_weight': 0.0005119170676783838, 'lr': 0.005599736969233784, 'batch_size': 128, 'dropout_rate': 0.0796246530953828, 'prior_mu': -0.06546542693733957, 'prior_sigma': 0.06694881769731312, 'normalization': 'layer'}. Best is trial 896 with value: 0.4533553242683411.
Generating morgan_rdkit fingerprints...
Generated fingerprints with 2048 features for 841 molecules
Trial 1483: 5-fold CV loss = 0.6073
[I 2025-08-07 21:56:41,340] Trial 1483 finished with value: 0.6072975218296051 and parameters: {'fp_type': 'morgan_rdkit', 'combined_morgan_radius': 3, 'combined_morgan_nBits': 1024, 'combined_rdkit_maxPath': 7, 'combined_rdkit_nBits': 1024, 'num_hidden_layers': 1, 'hidden_dim_0': 512, 'kl_weight': 0.0006625450713852789, 'lr': 0.004915997846041909, 'batch_size': 128, 'dropout_rate': 0.08162841314285213, 'prior_mu': -0.047736182903813595, 'prior_sigma': 0.05728710306680959, 'normalization': 'none'}. Best is trial 896 with value: 0.4533553242683411.
Generating morgan_rdkit fingerprints...
Generated fingerprints with 2048 features for 841 molecules
Trial 1482: 5-fold CV loss = 0.4725
[I 2025-08-07 21:56:46,362] Trial 1482 finished with value: 0.47250024080276487 and parameters: {'fp_type': 'morgan_rdkit', 'combined_morgan_radius': 3, 'combined_morgan_nBits': 1024, 'combined_rdkit_maxPath': 7, 'combined_rdkit_nBits': 1024, 'num_hidden_layers': 3, 'hidden_dim_0': 512, 'hidden_dim_1': 1024, 'hidden_dim_2': 256, 'kl_weight': 0.0007072403882526933, 'lr': 0.005771317528689969, 'batch_size': 128, 'dropout_rate': 0.08827443287554623, 'prior_mu': -0.06857376297402717, 'prior_sigma': 0.06690075159805954, 'normalization': 'layer'}. Best is trial 896 with value: 0.4533553242683411.
Generating morgan_rdkit fingerprints...
Generated fingerprints with 2048 features for 841 molecules
Trial 1486: 5-fold CV loss = 0.4664
[I 2025-08-07 21:57:21,621] Trial 1486 finished with value: 0.46644082069396975 and parameters: {'fp_type': 'morgan_rdkit', 'combined_morgan_radius': 3, 'combined_morgan_nBits': 1024, 'combined_rdkit_maxPath': 7, 'combined_rdkit_nBits': 1024, 'num_hidden_layers': 3, 'hidden_dim_0': 256, 'hidden_dim_1': 1024, 'hidden_dim_2': 64, 'kl_weight': 0.0004375275096310286, 'lr': 0.006005031208872978, 'batch_size': 64, 'dropout_rate': 0.0655275170876716, 'prior_mu': -0.04932552466096564, 'prior_sigma': 0.052723506071168165, 'normalization': 'layer'}. Best is trial 896 with value: 0.4533553242683411.
Generating morgan_rdkit fingerprints...
Generated fingerprints with 2048 features for 841 molecules
Trial 1487: 5-fold CV loss = 0.4668
