[I 2025-08-08 01:45:12,018] Trial 2627 finished with value: 0.5774175524711609 and parameters: {'fp_type': 'morgan_rdkit', 'combined_morgan_radius': 3, 'combined_morgan_nBits': 1024, 'combined_rdkit_maxPath': 5, 'combined_rdkit_nBits': 1024, 'num_hidden_layers': 3, 'hidden_dim_0': 256, 'hidden_dim_1': 1024, 'hidden_dim_2': 256, 'kl_weight': 0.00031015943574588334, 'lr': 0.007337230866309258, 'batch_size': 128, 'dropout_rate': 0.09270438815933697, 'prior_mu': -0.011446861868681999, 'prior_sigma': 0.10562615784724763, 'normalization': 'layer'}. Best is trial 896 with value: 0.4533553242683411.
Generating morgan_rdkit fingerprints...
Generated fingerprints with 1536 features for 841 molecules
Trial 2625: 5-fold CV loss = 0.4654
[I 2025-08-08 01:45:15,792] Trial 2625 finished with value: 0.4654228687286377 and parameters: {'fp_type': 'morgan_rdkit', 'combined_morgan_radius': 3, 'combined_morgan_nBits': 1024, 'combined_rdkit_maxPath': 7, 'combined_rdkit_nBits': 1024, 'num_hidden_layers': 3, 'hidden_dim_0': 256, 'hidden_dim_1': 1024, 'hidden_dim_2': 64, 'kl_weight': 0.00035212117849026315, 'lr': 0.00745569248910319, 'batch_size': 128, 'dropout_rate': 0.09760380685979295, 'prior_mu': -0.08739980790345236, 'prior_sigma': 0.09415251138127187, 'normalization': 'layer'}. Best is trial 896 with value: 0.4533553242683411.
Generating morgan fingerprints...
Generated fingerprints with 1024 features for 841 molecules
Trial 2626: 5-fold CV loss = 0.8900
[I 2025-08-08 01:45:20,372] Trial 2626 finished with value: 0.8900312900543212 and parameters: {'fp_type': 'morgan_rdkit', 'combined_morgan_radius': 3, 'combined_morgan_nBits': 1024, 'combined_rdkit_maxPath': 7, 'combined_rdkit_nBits': 1024, 'num_hidden_layers': 3, 'hidden_dim_0': 256, 'hidden_dim_1': 1024, 'hidden_dim_2': 64, 'kl_weight': 0.0003163774596390359, 'lr': 0.00016629410933905486, 'batch_size': 128, 'dropout_rate': 0.058337336933656364, 'prior_mu': -0.008774026341525284, 'prior_sigma': 0.09310209490029529, 'normalization': 'layer'}. Best is trial 896 with value: 0.4533553242683411.
Generating morgan fingerprints...
Generated fingerprints with 1024 features for 841 molecules
Trial 2630: 5-fold CV loss = 0.5266
[I 2025-08-08 01:45:39,924] Trial 2630 finished with value: 0.5266083717346192 and parameters: {'fp_type': 'morgan', 'morgan_only_radius': 2, 'morgan_only_nBits': 1024, 'num_hidden_layers': 3, 'hidden_dim_0': 1024, 'hidden_dim_1': 1024, 'hidden_dim_2': 64, 'kl_weight': 0.00031065855315032937, 'lr': 0.007962203168575595, 'batch_size': 128, 'dropout_rate': 0.11576419179339201, 'prior_mu': -0.05658937450096653, 'prior_sigma': 0.08307909694038457, 'normalization': 'layer'}. Best is trial 896 with value: 0.4533553242683411.
Generating rdkit fingerprints...
Generated fingerprints with 512 features for 841 molecules
Trial 2631: 5-fold CV loss = 0.5589
[I 2025-08-08 01:45:42,921] Trial 2631 finished with value: 0.5589110374450683 and parameters: {'fp_type': 'morgan', 'morgan_only_radius': 2, 'morgan_only_nBits': 1024, 'num_hidden_layers': 1, 'hidden_dim_0': 1024, 'kl_weight': 0.00020340503361903356, 'lr': 0.008227882658374245, 'batch_size': 128, 'dropout_rate': 0.12148820402648053, 'prior_mu': -0.02924981415406196, 'prior_sigma': 0.08310495643907675, 'normalization': 'layer'}. Best is trial 896 with value: 0.4533553242683411.
Generating morgan_rdkit fingerprints...
Generated fingerprints with 2048 features for 841 molecules
Trial 2629: 5-fold CV loss = 0.4717
[I 2025-08-08 01:45:46,739] Trial 2629 finished with value: 0.47172889709472654 and parameters: {'fp_type': 'morgan_rdkit', 'combined_morgan_radius': 3, 'combined_morgan_nBits': 512, 'combined_rdkit_maxPath': 7, 'combined_rdkit_nBits': 1024, 'num_hidden_layers': 3, 'hidden_dim_0': 256, 'hidden_dim_1': 1024, 'hidden_dim_2': 64, 'kl_weight': 0.0003425138499683308, 'lr': 0.00837943840750267, 'batch_size': 128, 'dropout_rate': 0.09930181204589346, 'prior_mu': -0.08670734786277526, 'prior_sigma': 0.09440019863987227, 'normalization': 'layer'}. Best is trial 896 with value: 0.4533553242683411.
Generating rdkit fingerprints...
Generated fingerprints with 512 features for 841 molecules
Trial 2632: 5-fold CV loss = 0.6751
[I 2025-08-08 01:46:13,689] Trial 2632 finished with value: 0.6750826835632324 and parameters: {'fp_type': 'rdkit', 'rdkit_only_maxPath': 5, 'rdkit_only_nBits': 512, 'num_hidden_layers': 3, 'hidden_dim_0': 256, 'hidden_dim_1': 1024, 'hidden_dim_2': 64, 'kl_weight': 0.00021107772141621206, 'lr': 0.0084089715216369, 'batch_size': 128, 'dropout_rate': 0.1276126232975097, 'prior_mu': -0.042045580073948735, 'prior_sigma': 0.12159899992749504, 'normalization': 'layer'}. Best is trial 896 with value: 0.4533553242683411.
Generating morgan_rdkit fingerprints...
Generated fingerprints with 2048 features for 841 molecules
Trial 2634: 5-fold CV loss = 0.6265
[I 2025-08-08 01:46:20,503] Trial 2634 finished with value: 0.6264902889728546 and parameters: {'fp_type': 'rdkit', 'rdkit_only_maxPath': 5, 'rdkit_only_nBits': 512, 'num_hidden_layers': 3, 'hidden_dim_0': 256, 'hidden_dim_1': 1024, 'hidden_dim_2': 64, 'kl_weight': 0.0001824559755594929, 'lr': 0.007331454535594074, 'batch_size': 128, 'dropout_rate': 0.07048573160887864, 'prior_mu': -0.03788817689493617, 'prior_sigma': 0.12350181972692614, 'normalization': 'layer'}. Best is trial 896 with value: 0.4533553242683411.
Generating morgan_rdkit fingerprints...
Generated fingerprints with 2048 features for 841 molecules
Trial 2633: 5-fold CV loss = 0.4615
[I 2025-08-08 01:46:43,003] Trial 2633 finished with value: 0.46151845455169677 and parameters: {'fp_type': 'morgan_rdkit', 'combined_morgan_radius': 3, 'combined_morgan_nBits': 1024, 'combined_rdkit_maxPath': 7, 'combined_rdkit_nBits': 1024, 'num_hidden_layers': 3, 'hidden_dim_0': 256, 'hidden_dim_1': 1024, 'hidden_dim_2': 64, 'kl_weight': 0.0004380846309791754, 'lr': 0.006670007285509352, 'batch_size': 128, 'dropout_rate': 0.10202557860614787, 'prior_mu': -0.039133574027391295, 'prior_sigma': 0.10229433912383416, 'normalization': 'layer'}. Best is trial 896 with value: 0.4533553242683411.
Generating morgan_rdkit fingerprints...
Generated fingerprints with 2048 features for 841 molecules
Trial 2628: 5-fold CV loss = 0.6422
[I 2025-08-08 01:46:47,770] Trial 2628 finished with value: 0.6421514034271241 and parameters: {'fp_type': 'morgan_rdkit', 'combined_morgan_radius': 3, 'combined_morgan_nBits': 512, 'combined_rdkit_maxPath': 7, 'combined_rdkit_nBits': 1024, 'num_hidden_layers': 3, 'hidden_dim_0': 256, 'hidden_dim_1': 1024, 'hidden_dim_2': 256, 'kl_weight': 0.0003190463132984037, 'lr': 0.007424823731358686, 'batch_size': 128, 'dropout_rate': 0.09386010805349075, 'prior_mu': -0.010709388515180726, 'prior_sigma': 0.1212276991913183, 'normalization': 'layer'}. Best is trial 896 with value: 0.4533553242683411.
Generating morgan_rdkit fingerprints...
Generated fingerprints with 2048 features for 841 molecules
Trial 2636: 5-fold CV loss = 0.4711
[I 2025-08-08 01:46:57,824] Trial 2636 finished with value: 0.4711483895778656 and parameters: {'fp_type': 'morgan_rdkit', 'combined_morgan_radius': 3, 'combined_morgan_nBits': 1024, 'combined_rdkit_maxPath': 7, 'combined_rdkit_nBits': 1024, 'num_hidden_layers': 3, 'hidden_dim_0': 256, 'hidden_dim_1': 1024, 'hidden_dim_2': 64, 'kl_weight': 0.00044710791932575043, 'lr': 0.006568136725215118, 'batch_size': 128, 'dropout_rate': 0.10781118938965484, 'prior_mu': 0.022309850373434276, 'prior_sigma': 0.09850493332471968, 'normalization': 'layer'}. Best is trial 896 with value: 0.4533553242683411.
Generating morgan_rdkit fingerprints...
Generated fingerprints with 1280 features for 841 molecules
Trial 2635: 5-fold CV loss = 0.4643
[I 2025-08-08 01:47:01,842] Trial 2635 finished with value: 0.4643303692340851 and parameters: {'fp_type': 'morgan_rdkit', 'combined_morgan_radius': 3, 'combined_morgan_nBits': 1024, 'combined_rdkit_maxPath': 7, 'combined_rdkit_nBits': 1024, 'num_hidden_layers': 3, 'hidden_dim_0': 256, 'hidden_dim_1': 1024, 'hidden_dim_2': 64, 'kl_weight': 0.00044319241380405766, 'lr': 0.006663542424978406, 'batch_size': 128, 'dropout_rate': 0.07073123492798371, 'prior_mu': -0.03364774893245495, 'prior_sigma': 0.09886963103568322, 'normalization': 'layer'}. Best is trial 896 with value: 0.4533553242683411.
Generating morgan_rdkit fingerprints...
Generated fingerprints with 2048 features for 841 molecules
Trial 2639: 5-fold CV loss = 0.5045
[I 2025-08-08 01:47:23,322] Trial 2639 finished with value: 0.5045216917991638 and parameters: {'fp_type': 'morgan_rdkit', 'combined_morgan_radius': 3, 'combined_morgan_nBits': 1024, 'combined_rdkit_maxPath': 6, 'combined_rdkit_nBits': 256, 'num_hidden_layers': 3, 'hidden_dim_0': 256, 'hidden_dim_1': 1024, 'hidden_dim_2': 64, 'kl_weight': 0.00025806191612931414, 'lr': 0.00999389783410205, 'batch_size': 128, 'dropout_rate': 0.0595858588988419, 'prior_mu': -0.02401345027728367, 'prior_sigma': 0.07286826784960121, 'normalization': 'layer'}. Best is trial 896 with value: 0.4533553242683411.
Generating morgan_rdkit fingerprints...
Generated fingerprints with 2048 features for 841 molecules
Trial 2637: 5-fold CV loss = 0.4686
[I 2025-08-08 01:47:34,876] Trial 2637 finished with value: 0.4685771346092224 and parameters: {'fp_type': 'morgan_rdkit', 'combined_morgan_radius': 3, 'combined_morgan_nBits': 1024, 'combined_rdkit_maxPath': 7, 'combined_rdkit_nBits': 1024, 'num_hidden_layers': 3, 'hidden_dim_0': 256, 'hidden_dim_1': 1024, 'hidden_dim_2': 64, 'kl_weight': 0.0005572016425754729, 'lr': 0.006606766033039851, 'batch_size': 128, 'dropout_rate': 0.08491278088648192, 'prior_mu': 0.02096552854180915, 'prior_sigma': 0.07264393635847208, 'normalization': 'layer'}. Best is trial 896 with value: 0.4533553242683411.
Generating morgan_rdkit fingerprints...
Generated fingerprints with 2048 features for 841 molecules
Trial 2640: 5-fold CV loss = 0.4773
[I 2025-08-08 01:47:36,987] Trial 2640 finished with value: 0.4772508919239044 and parameters: {'fp_type': 'morgan_rdkit', 'combined_morgan_radius': 3, 'combined_morgan_nBits': 1024, 'combined_rdkit_maxPath': 6, 'combined_rdkit_nBits': 1024, 'num_hidden_layers': 3, 'hidden_dim_0': 512, 'hidden_dim_1': 1024, 'hidden_dim_2': 64, 'kl_weight': 0.0005504287876458011, 'lr': 0.008799094442391261, 'batch_size': 128, 'dropout_rate': 0.08026821094440757, 'prior_mu': -0.021728092801999856, 'prior_sigma': 0.07382065533305822, 'normalization': 'layer'}. Best is trial 896 with value: 0.4533553242683411.
Generating morgan_rdkit fingerprints...
Generated fingerprints with 2048 features for 841 molecules
Trial 2641: 5-fold CV loss = 0.4669
[I 2025-08-08 01:48:02,692] Trial 2641 finished with value: 0.46688355803489684 and parameters: {'fp_type': 'morgan_rdkit', 'combined_morgan_radius': 3, 'combined_morgan_nBits': 1024, 'combined_rdkit_maxPath': 7, 'combined_rdkit_nBits': 1024, 'num_hidden_layers': 3, 'hidden_dim_0': 512, 'hidden_dim_1': 512, 'hidden_dim_2': 64, 'kl_weight': 0.00027159630993410977, 'lr': 0.008720399639430386, 'batch_size': 128, 'dropout_rate': 0.0837257802642874, 'prior_mu': 0.0014031001886455046, 'prior_sigma': 0.10692835631791855, 'normalization': 'layer'}. Best is trial 896 with value: 0.4533553242683411.
Generating morgan_rdkit fingerprints...
Generated fingerprints with 2048 features for 841 molecules
Trial 2638: 5-fold CV loss = 0.5646
[I 2025-08-08 01:48:12,714] Trial 2638 finished with value: 0.5645850479602814 and parameters: {'fp_type': 'morgan_rdkit', 'combined_morgan_radius': 3, 'combined_morgan_nBits': 1024, 'combined_rdkit_maxPath': 7, 'combined_rdkit_nBits': 1024, 'num_hidden_layers': 3, 'hidden_dim_0': 256, 'hidden_dim_1': 1024, 'hidden_dim_2': 64, 'kl_weight': 0.0002569001585706579, 'lr': 0.006786091948535145, 'batch_size': 128, 'dropout_rate': 0.10948391579888571, 'prior_mu': 0.021209863645815077, 'prior_sigma': 0.09747250928924293, 'normalization': 'layer'}. Best is trial 896 with value: 0.4533553242683411.
Generating morgan_rdkit fingerprints...
Generated fingerprints with 2048 features for 841 molecules
Trial 2642: 5-fold CV loss = 0.5362
[I 2025-08-08 01:48:15,732] Trial 2642 finished with value: 0.5361513376235962 and parameters: {'fp_type': 'morgan_rdkit', 'combined_morgan_radius': 3, 'combined_morgan_nBits': 1024, 'combined_rdkit_maxPath': 7, 'combined_rdkit_nBits': 1024, 'num_hidden_layers': 3, 'hidden_dim_0': 512, 'hidden_dim_1': 1024, 'hidden_dim_2': 64, 'kl_weight': 0.00028388827709126236, 'lr': 0.008705175146466522, 'batch_size': 128, 'dropout_rate': 0.12711253839218398, 'prior_mu': -0.17375336290675425, 'prior_sigma': 0.07880132317572587, 'normalization': 'layer'}. Best is trial 896 with value: 0.4533553242683411.
Generating morgan_rdkit fingerprints...
Generated fingerprints with 2048 features for 841 molecules
Trial 2643: 5-fold CV loss = 0.4693
[I 2025-08-08 01:48:20,049] Trial 2643 finished with value: 0.46934248208999635 and parameters: {'fp_type': 'morgan_rdkit', 'combined_morgan_radius': 3, 'combined_morgan_nBits': 1024, 'combined_rdkit_maxPath': 7, 'combined_rdkit_nBits': 1024, 'num_hidden_layers': 3, 'hidden_dim_0': 256, 'hidden_dim_1': 512, 'hidden_dim_2': 64, 'kl_weight': 0.0002558891367282968, 'lr': 0.007841184376607389, 'batch_size': 128, 'dropout_rate': 0.11437080172568329, 'prior_mu': -0.046562420827997344, 'prior_sigma': 0.07885755182110836, 'normalization': 'layer'}. Best is trial 896 with value: 0.4533553242683411.
Generating morgan_rdkit fingerprints...
Generated fingerprints with 2048 features for 841 molecules
Trial 2644: 5-fold CV loss = 0.4601
[I 2025-08-08 01:48:37,793] Trial 2644 finished with value: 0.46013469696044923 and parameters: {'fp_type': 'morgan_rdkit', 'combined_morgan_radius': 3, 'combined_morgan_nBits': 1024, 'combined_rdkit_maxPath': 7, 'combined_rdkit_nBits': 1024, 'num_hidden_layers': 3, 'hidden_dim_0': 256, 'hidden_dim_1': 1024, 'hidden_dim_2': 64, 'kl_weight': 0.0002377948602559785, 'lr': 0.007916824038784579, 'batch_size': 128, 'dropout_rate': 0.11525303243135815, 'prior_mu': -0.05669358678136384, 'prior_sigma': 0.07878504869862546, 'normalization': 'layer'}. Best is trial 896 with value: 0.4533553242683411.
Generating morgan_rdkit fingerprints...
Generated fingerprints with 2048 features for 841 molecules
Trial 2647: 5-fold CV loss = 0.6280
[I 2025-08-08 01:48:53,805] Trial 2647 finished with value: 0.6279803931713104 and parameters: {'fp_type': 'morgan_rdkit', 'combined_morgan_radius': 3, 'combined_morgan_nBits': 1024, 'combined_rdkit_maxPath': 7, 'combined_rdkit_nBits': 1024, 'num_hidden_layers': 3, 'hidden_dim_0': 256, 'hidden_dim_1': 64, 'hidden_dim_2': 128, 'kl_weight': 0.00016852937713306203, 'lr': 0.007538572579610277, 'batch_size': 128, 'dropout_rate': 0.09375223021581394, 'prior_mu': -0.028120756686345748, 'prior_sigma': 0.08854154144943589, 'normalization': 'layer'}. Best is trial 896 with value: 0.4533553242683411.
Generating morgan_rdkit fingerprints...
Generated fingerprints with 2048 features for 841 molecules
Trial 2649: 5-fold CV loss = 0.8904
[I 2025-08-08 01:49:08,997] Trial 2649 finished with value: 0.8904475927352905 and parameters: {'fp_type': 'morgan_rdkit', 'combined_morgan_radius': 3, 'combined_morgan_nBits': 1024, 'combined_rdkit_maxPath': 8, 'combined_rdkit_nBits': 1024, 'num_hidden_layers': 3, 'hidden_dim_0': 128, 'hidden_dim_1': 1024, 'hidden_dim_2': 1024, 'kl_weight': 0.00037383004034859975, 'lr': 0.009263856507382498, 'batch_size': 128, 'dropout_rate': 0.12870948436039836, 'prior_mu': 0.04350741242014701, 'prior_sigma': 0.10945624550559865, 'normalization': 'layer'}. Best is trial 896 with value: 0.4533553242683411.
Generating morgan_rdkit fingerprints...
Generated fingerprints with 2048 features for 841 molecules
Trial 2648: 5-fold CV loss = 0.6171
[I 2025-08-08 01:49:10,872] Trial 2648 finished with value: 0.6171081483364105 and parameters: {'fp_type': 'morgan_rdkit', 'combined_morgan_radius': 3, 'combined_morgan_nBits': 1024, 'combined_rdkit_maxPath': 7, 'combined_rdkit_nBits': 1024, 'num_hidden_layers': 3, 'hidden_dim_0': 256, 'hidden_dim_1': 64, 'hidden_dim_2': 128, 'kl_weight': 0.00017085459992705727, 'lr': 0.007344692994249431, 'batch_size': 128, 'dropout_rate': 0.09351894998406363, 'prior_mu': -0.029356634977088666, 'prior_sigma': 0.08866002192631812, 'normalization': 'layer'}. Best is trial 896 with value: 0.4533553242683411.
Generating morgan_rdkit fingerprints...
Generated fingerprints with 2048 features for 841 molecules
Trial 2646: 5-fold CV loss = 0.4660
[I 2025-08-08 01:49:22,643] Trial 2646 finished with value: 0.46604670882225036 and parameters: {'fp_type': 'morgan_rdkit', 'combined_morgan_radius': 3, 'combined_morgan_nBits': 1024, 'combined_rdkit_maxPath': 7, 'combined_rdkit_nBits': 1024, 'num_hidden_layers': 3, 'hidden_dim_0': 256, 'hidden_dim_1': 64, 'hidden_dim_2': 64, 'kl_weight': 0.00022136719006271165, 'lr': 0.007765361362075387, 'batch_size': 128, 'dropout_rate': 0.1198522646418574, 'prior_mu': -0.05512331108440939, 'prior_sigma': 0.08841314866238748, 'normalization': 'layer'}. Best is trial 896 with value: 0.4533553242683411.
Generating morgan_rdkit fingerprints...
Generated fingerprints with 2048 features for 841 molecules
Trial 2651: 5-fold CV loss = 0.7395
[I 2025-08-08 01:49:40,010] Trial 2651 finished with value: 0.7394884884357452 and parameters: {'fp_type': 'morgan_rdkit', 'combined_morgan_radius': 3, 'combined_morgan_nBits': 1024, 'combined_rdkit_maxPath': 7, 'combined_rdkit_nBits': 1024, 'num_hidden_layers': 3, 'hidden_dim_0': 256, 'hidden_dim_1': 1024, 'hidden_dim_2': 64, 'kl_weight': 0.00022240443261534737, 'lr': 0.003292955534726328, 'batch_size': 128, 'dropout_rate': 0.10230188725922719, 'prior_mu': -0.009075211732337838, 'prior_sigma': 0.1036479392823278, 'normalization': 'layer'}. Best is trial 896 with value: 0.4533553242683411.
Generating morgan_rdkit fingerprints...
Generated fingerprints with 2048 features for 841 molecules
Trial 2650: 5-fold CV loss = 0.4629
[I 2025-08-08 01:49:52,893] Trial 2650 finished with value: 0.4628995358943939 and parameters: {'fp_type': 'morgan_rdkit', 'combined_morgan_radius': 3, 'combined_morgan_nBits': 1024, 'combined_rdkit_maxPath': 7, 'combined_rdkit_nBits': 1024, 'num_hidden_layers': 3, 'hidden_dim_0': 256, 'hidden_dim_1': 1024, 'hidden_dim_2': 64, 'kl_weight': 0.00020823364277301537, 'lr': 0.00723562749943933, 'batch_size': 128, 'dropout_rate': 0.1040549154671038, 'prior_mu': -0.008620655618651687, 'prior_sigma': 0.08586518249807772, 'normalization': 'layer'}. Best is trial 896 with value: 0.4533553242683411.
Generating morgan_rdkit fingerprints...
Generated fingerprints with 2048 features for 841 molecules
Trial 2645: 5-fold CV loss = 0.4643
[I 2025-08-08 01:50:04,750] Trial 2645 finished with value: 0.4643169164657593 and parameters: {'fp_type': 'morgan_rdkit', 'combined_morgan_radius': 3, 'combined_morgan_nBits': 1024, 'combined_rdkit_maxPath': 7, 'combined_rdkit_nBits': 1024, 'num_hidden_layers': 3, 'hidden_dim_0': 256, 'hidden_dim_1': 64, 'hidden_dim_2': 64, 'kl_weight': 0.0002145646729138474, 'lr': 0.007818789860843065, 'batch_size': 128, 'dropout_rate': 0.12660114625106034, 'prior_mu': -0.049539711663734005, 'prior_sigma': 0.07797424723622472, 'normalization': 'layer'}. Best is trial 896 with value: 0.4533553242683411.
Generating morgan_rdkit fingerprints...
Generated fingerprints with 2048 features for 841 molecules
Trial 2653: 5-fold CV loss = 0.5668
[I 2025-08-08 01:50:16,894] Trial 2653 finished with value: 0.5667931318283081 and parameters: {'fp_type': 'morgan_rdkit', 'combined_morgan_radius': 3, 'combined_morgan_nBits': 1024, 'combined_rdkit_maxPath': 7, 'combined_rdkit_nBits': 1024, 'num_hidden_layers': 3, 'hidden_dim_0': 256, 'hidden_dim_1': 1024, 'hidden_dim_2': 64, 'kl_weight': 0.08072999311645553, 'lr': 0.0070085218714911095, 'batch_size': 128, 'dropout_rate': 0.039995407073208165, 'prior_mu': 0.00026327718701902453, 'prior_sigma': 0.113686808234655, 'normalization': 'layer'}. Best is trial 896 with value: 0.4533553242683411.
Generating morgan_rdkit fingerprints...
Generated fingerprints with 2048 features for 841 molecules
Trial 2652: 5-fold CV loss = 0.4654
[I 2025-08-08 01:50:22,438] Trial 2652 finished with value: 0.46535800099372865 and parameters: {'fp_type': 'morgan_rdkit', 'combined_morgan_radius': 3, 'combined_morgan_nBits': 1024, 'combined_rdkit_maxPath': 7, 'combined_rdkit_nBits': 1024, 'num_hidden_layers': 3, 'hidden_dim_0': 256, 'hidden_dim_1': 1024, 'hidden_dim_2': 64, 'kl_weight': 0.0001907139201953019, 'lr': 0.00997471750849684, 'batch_size': 128, 'dropout_rate': 0.10444672168661909, 'prior_mu': -0.009082228281755044, 'prior_sigma': 0.11327765337285609, 'normalization': 'layer'}. Best is trial 896 with value: 0.4533553242683411.
Generating morgan_rdkit fingerprints...
Generated fingerprints with 2048 features for 841 molecules
Trial 2654: 5-fold CV loss = 0.4734
[I 2025-08-08 01:50:34,580] Trial 2654 finished with value: 0.47335827350616455 and parameters: {'fp_type': 'morgan_rdkit', 'combined_morgan_radius': 3, 'combined_morgan_nBits': 1024, 'combined_rdkit_maxPath': 7, 'combined_rdkit_nBits': 1024, 'num_hidden_layers': 3, 'hidden_dim_0': 256, 'hidden_dim_1': 1024, 'hidden_dim_2': 64, 'kl_weight': 0.00011135415436957893, 'lr': 0.009103489244869947, 'batch_size': 128, 'dropout_rate': 0.04485944712055089, 'prior_mu': -0.04378091414700032, 'prior_sigma': 0.11371284455314803, 'normalization': 'layer'}. Best is trial 896 with value: 0.4533553242683411.
Generating morgan_rdkit fingerprints...
Generated fingerprints with 2048 features for 841 molecules
Trial 2656: 5-fold CV loss = 0.4859
