[I 2025-08-07 19:34:45,528] Trial 766 finished with value: 0.664014732837677 and parameters: {'fp_type': 'morgan_rdkit', 'combined_morgan_radius': 3, 'combined_morgan_nBits': 1024, 'combined_rdkit_maxPath': 6, 'combined_rdkit_nBits': 1024, 'num_hidden_layers': 3, 'hidden_dim_0': 256, 'hidden_dim_1': 1024, 'hidden_dim_2': 64, 'kl_weight': 0.05979193682837157, 'lr': 0.00612511605902097, 'batch_size': 128, 'dropout_rate': 0.12688501930085969, 'prior_mu': -0.004899133007928347, 'prior_sigma': 0.07042603242361772, 'normalization': 'none'}. Best is trial 587 with value: 0.4552353322505951.
Generating morgan_rdkit fingerprints...
Generated fingerprints with 2048 features for 841 molecules
Trial 765: 5-fold CV loss = 0.4965
[I 2025-08-07 19:34:54,831] Trial 765 finished with value: 0.49647685289382937 and parameters: {'fp_type': 'morgan_rdkit', 'combined_morgan_radius': 3, 'combined_morgan_nBits': 1024, 'combined_rdkit_maxPath': 7, 'combined_rdkit_nBits': 1024, 'num_hidden_layers': 3, 'hidden_dim_0': 256, 'hidden_dim_1': 128, 'hidden_dim_2': 64, 'kl_weight': 0.07225734570537304, 'lr': 0.006921373772723975, 'batch_size': 128, 'dropout_rate': 0.11591504869195246, 'prior_mu': -0.006338266314429467, 'prior_sigma': 0.07839934121995047, 'normalization': 'layer'}. Best is trial 587 with value: 0.4552353322505951.
Generating morgan_rdkit fingerprints...
Generated fingerprints with 2048 features for 841 molecules
Trial 769: 5-fold CV loss = 0.4667
[I 2025-08-07 19:35:23,063] Trial 769 finished with value: 0.466740483045578 and parameters: {'fp_type': 'morgan_rdkit', 'combined_morgan_radius': 3, 'combined_morgan_nBits': 1024, 'combined_rdkit_maxPath': 7, 'combined_rdkit_nBits': 1024, 'num_hidden_layers': 3, 'hidden_dim_0': 256, 'hidden_dim_1': 1024, 'hidden_dim_2': 64, 'kl_weight': 0.0003796178705563248, 'lr': 0.00752466660947054, 'batch_size': 128, 'dropout_rate': 0.08479438218574639, 'prior_mu': -0.011139275955631908, 'prior_sigma': 0.08215071339000754, 'normalization': 'layer'}. Best is trial 587 with value: 0.4552353322505951.
Generating morgan_rdkit fingerprints...
Generated fingerprints with 2048 features for 841 molecules
Trial 768: 5-fold CV loss = 0.4677
[I 2025-08-07 19:35:25,050] Trial 768 finished with value: 0.4676732957363129 and parameters: {'fp_type': 'morgan_rdkit', 'combined_morgan_radius': 3, 'combined_morgan_nBits': 1024, 'combined_rdkit_maxPath': 7, 'combined_rdkit_nBits': 1024, 'num_hidden_layers': 3, 'hidden_dim_0': 256, 'hidden_dim_1': 1024, 'hidden_dim_2': 64, 'kl_weight': 0.0022816939520459195, 'lr': 0.007395115491861647, 'batch_size': 128, 'dropout_rate': 0.12813258641160927, 'prior_mu': -0.016444867685637566, 'prior_sigma': 0.08453952334601399, 'normalization': 'layer'}. Best is trial 587 with value: 0.4552353322505951.
Generating morgan_rdkit fingerprints...
Generated fingerprints with 2048 features for 841 molecules
Trial 770: 5-fold CV loss = 0.5483
[I 2025-08-07 19:35:30,841] Trial 770 finished with value: 0.5482660710811615 and parameters: {'fp_type': 'morgan_rdkit', 'combined_morgan_radius': 3, 'combined_morgan_nBits': 1024, 'combined_rdkit_maxPath': 7, 'combined_rdkit_nBits': 1024, 'num_hidden_layers': 3, 'hidden_dim_0': 256, 'hidden_dim_1': 1024, 'hidden_dim_2': 64, 'kl_weight': 0.0012456004932116325, 'lr': 0.007386923728231921, 'batch_size': 128, 'dropout_rate': 0.1312991876855704, 'prior_mu': -0.1253901354478383, 'prior_sigma': 0.11983739878970918, 'normalization': 'layer'}. Best is trial 587 with value: 0.4552353322505951.
Generating morgan_rdkit fingerprints...
Generated fingerprints with 2048 features for 841 molecules
Trial 767: 5-fold CV loss = 0.5613
[I 2025-08-07 19:35:45,800] Trial 767 finished with value: 0.5612742662429809 and parameters: {'fp_type': 'morgan_rdkit', 'combined_morgan_radius': 3, 'combined_morgan_nBits': 1024, 'combined_rdkit_maxPath': 6, 'combined_rdkit_nBits': 1024, 'num_hidden_layers': 3, 'hidden_dim_0': 256, 'hidden_dim_1': 128, 'hidden_dim_2': 64, 'kl_weight': 0.0003625871468348589, 'lr': 0.007338666734124073, 'batch_size': 128, 'dropout_rate': 0.3972420647432905, 'prior_mu': -0.00491309673605609, 'prior_sigma': 0.07039722786139048, 'normalization': 'none'}. Best is trial 587 with value: 0.4552353322505951.
Generating morgan_rdkit fingerprints...
Generated fingerprints with 2048 features for 841 molecules
Trial 771: 5-fold CV loss = 0.7961
[I 2025-08-07 19:35:53,778] Trial 771 finished with value: 0.7961420059204102 and parameters: {'fp_type': 'morgan_rdkit', 'combined_morgan_radius': 3, 'combined_morgan_nBits': 1024, 'combined_rdkit_maxPath': 7, 'combined_rdkit_nBits': 1024, 'num_hidden_layers': 3, 'hidden_dim_0': 256, 'hidden_dim_1': 1024, 'hidden_dim_2': 64, 'kl_weight': 0.002210331725319369, 'lr': 0.006231733891670382, 'batch_size': 128, 'dropout_rate': 0.13726127443547556, 'prior_mu': -0.02638780528677786, 'prior_sigma': 0.1915726497798223, 'normalization': 'layer'}. Best is trial 587 with value: 0.4552353322505951.
Generating morgan_rdkit fingerprints...
Generated fingerprints with 2048 features for 841 molecules
Trial 773: 5-fold CV loss = 0.4660
[I 2025-08-07 19:36:12,378] Trial 773 finished with value: 0.4660180687904358 and parameters: {'fp_type': 'morgan_rdkit', 'combined_morgan_radius': 3, 'combined_morgan_nBits': 1024, 'combined_rdkit_maxPath': 7, 'combined_rdkit_nBits': 1024, 'num_hidden_layers': 3, 'hidden_dim_0': 256, 'hidden_dim_1': 1024, 'hidden_dim_2': 64, 'kl_weight': 0.0003776901522009255, 'lr': 0.006302695830603679, 'batch_size': 128, 'dropout_rate': 0.14015292550234149, 'prior_mu': -0.025365751438843082, 'prior_sigma': 0.09013940953796534, 'normalization': 'layer'}. Best is trial 587 with value: 0.4552353322505951.
Generating morgan_rdkit fingerprints...
Generated fingerprints with 2048 features for 841 molecules
Trial 776: 5-fold CV loss = 0.8860
[I 2025-08-07 19:36:26,364] Trial 776 finished with value: 0.885959243774414 and parameters: {'fp_type': 'morgan_rdkit', 'combined_morgan_radius': 3, 'combined_morgan_nBits': 1024, 'combined_rdkit_maxPath': 7, 'combined_rdkit_nBits': 1024, 'num_hidden_layers': 3, 'hidden_dim_0': 256, 'hidden_dim_1': 1024, 'hidden_dim_2': 128, 'kl_weight': 0.006654527604516871, 'lr': 0.005223376097837235, 'batch_size': 128, 'dropout_rate': 0.12506668440140672, 'prior_mu': -0.011288499296895134, 'prior_sigma': 0.16610142999040953, 'normalization': 'layer'}. Best is trial 587 with value: 0.4552353322505951.
Generating morgan_rdkit fingerprints...
Generated fingerprints with 2048 features for 841 molecules
Trial 772: 5-fold CV loss = 0.4603
[I 2025-08-07 19:36:30,956] Trial 772 finished with value: 0.4603379309177399 and parameters: {'fp_type': 'morgan_rdkit', 'combined_morgan_radius': 3, 'combined_morgan_nBits': 1024, 'combined_rdkit_maxPath': 7, 'combined_rdkit_nBits': 1024, 'num_hidden_layers': 3, 'hidden_dim_0': 256, 'hidden_dim_1': 1024, 'hidden_dim_2': 64, 'kl_weight': 0.00037555357602469603, 'lr': 0.0061898086647101235, 'batch_size': 128, 'dropout_rate': 0.1362258138352709, 'prior_mu': -0.025763661612853435, 'prior_sigma': 0.10963589829972475, 'normalization': 'layer'}. Best is trial 587 with value: 0.4552353322505951.
Generating morgan_rdkit fingerprints...
Generated fingerprints with 2048 features for 841 molecules
Trial 775: 5-fold CV loss = 0.4884
[I 2025-08-07 19:36:31,968] Trial 775 finished with value: 0.4884379327297211 and parameters: {'fp_type': 'morgan_rdkit', 'combined_morgan_radius': 3, 'combined_morgan_nBits': 1024, 'combined_rdkit_maxPath': 5, 'combined_rdkit_nBits': 1024, 'num_hidden_layers': 3, 'hidden_dim_0': 256, 'hidden_dim_1': 1024, 'hidden_dim_2': 128, 'kl_weight': 0.0006865545890856649, 'lr': 0.005131756828390973, 'batch_size': 128, 'dropout_rate': 0.1364864265571428, 'prior_mu': -0.025014026698434094, 'prior_sigma': 0.0908806465812171, 'normalization': 'layer'}. Best is trial 587 with value: 0.4552353322505951.
Generating morgan_rdkit fingerprints...
Generated fingerprints with 2048 features for 841 molecules
Trial 777: 5-fold CV loss = 0.4779
[I 2025-08-07 19:37:01,363] Trial 777 finished with value: 0.47789090871810913 and parameters: {'fp_type': 'morgan_rdkit', 'combined_morgan_radius': 3, 'combined_morgan_nBits': 1024, 'combined_rdkit_maxPath': 5, 'combined_rdkit_nBits': 1024, 'num_hidden_layers': 3, 'hidden_dim_0': 256, 'hidden_dim_1': 1024, 'hidden_dim_2': 64, 'kl_weight': 0.0008042072627806681, 'lr': 0.008044679005447204, 'batch_size': 128, 'dropout_rate': 0.433618900761318, 'prior_mu': -0.026277046420038547, 'prior_sigma': 0.11135158174002484, 'normalization': 'layer'}. Best is trial 587 with value: 0.4552353322505951.
Generating morgan_rdkit fingerprints...
Generated fingerprints with 2048 features for 841 molecules
Trial 779: 5-fold CV loss = 0.5444
[I 2025-08-07 19:37:08,354] Trial 779 finished with value: 0.5444019734859467 and parameters: {'fp_type': 'morgan_rdkit', 'combined_morgan_radius': 3, 'combined_morgan_nBits': 1024, 'combined_rdkit_maxPath': 7, 'combined_rdkit_nBits': 1024, 'num_hidden_layers': 3, 'hidden_dim_0': 512, 'hidden_dim_1': 1024, 'hidden_dim_2': 64, 'kl_weight': 0.0003744029853156156, 'lr': 0.008014889680531875, 'batch_size': 128, 'dropout_rate': 0.10515725736381801, 'prior_mu': 0.1696942934572835, 'prior_sigma': 0.10908603090369769, 'normalization': 'layer'}. Best is trial 587 with value: 0.4552353322505951.
Generating rdkit fingerprints...
Generated fingerprints with 256 features for 841 molecules
Trial 774: 5-fold CV loss = 0.5435
[I 2025-08-07 19:37:10,903] Trial 774 finished with value: 0.5434997737407684 and parameters: {'fp_type': 'morgan_rdkit', 'combined_morgan_radius': 3, 'combined_morgan_nBits': 1024, 'combined_rdkit_maxPath': 7, 'combined_rdkit_nBits': 1024, 'num_hidden_layers': 3, 'hidden_dim_0': 256, 'hidden_dim_1': 1024, 'hidden_dim_2': 128, 'kl_weight': 0.00038092753320278816, 'lr': 0.006145012419769465, 'batch_size': 128, 'dropout_rate': 0.1387156724914325, 'prior_mu': -0.026023002152871216, 'prior_sigma': 0.09142077019910737, 'normalization': 'layer'}. Best is trial 587 with value: 0.4552353322505951.
Generating rdkit fingerprints...
Generated fingerprints with 256 features for 841 molecules
Trial 778: 5-fold CV loss = 0.6279
[I 2025-08-07 19:37:14,654] Trial 778 finished with value: 0.6278502106666565 and parameters: {'fp_type': 'morgan_rdkit', 'combined_morgan_radius': 3, 'combined_morgan_nBits': 1024, 'combined_rdkit_maxPath': 5, 'combined_rdkit_nBits': 1024, 'num_hidden_layers': 3, 'hidden_dim_0': 512, 'hidden_dim_1': 1024, 'hidden_dim_2': 64, 'kl_weight': 0.0003803051899408285, 'lr': 0.0046719038953181155, 'batch_size': 128, 'dropout_rate': 0.1351428022607606, 'prior_mu': -0.02333020250224245, 'prior_sigma': 0.11260670381915847, 'normalization': 'layer'}. Best is trial 587 with value: 0.4552353322505951.
Generating rdkit fingerprints...
Generated fingerprints with 256 features for 841 molecules
Trial 781: 5-fold CV loss = 0.8880
[I 2025-08-07 19:37:23,743] Trial 781 finished with value: 0.8879734992980957 and parameters: {'fp_type': 'rdkit', 'rdkit_only_maxPath': 8, 'rdkit_only_nBits': 256, 'num_hidden_layers': 3, 'hidden_dim_0': 256, 'hidden_dim_1': 1024, 'hidden_dim_2': 64, 'kl_weight': 0.0003676207913829399, 'lr': 0.004612677024114546, 'batch_size': 128, 'dropout_rate': 0.12114619937139777, 'prior_mu': -0.017265432914464793, 'prior_sigma': 0.11521537403520353, 'normalization': 'layer'}. Best is trial 587 with value: 0.4552353322505951.
Generating morgan_rdkit fingerprints...
Generated fingerprints with 1536 features for 841 molecules
Trial 783: 5-fold CV loss = 0.8884
[I 2025-08-07 19:37:34,889] Trial 783 finished with value: 0.8883858680725097 and parameters: {'fp_type': 'rdkit', 'rdkit_only_maxPath': 8, 'rdkit_only_nBits': 256, 'num_hidden_layers': 3, 'hidden_dim_0': 256, 'hidden_dim_1': 1024, 'hidden_dim_2': 64, 'kl_weight': 0.00043255459030203504, 'lr': 0.005466108330199582, 'batch_size': 128, 'dropout_rate': 0.12146975243787964, 'prior_mu': -0.010975939384982947, 'prior_sigma': 0.11386640952473469, 'normalization': 'layer'}. Best is trial 587 with value: 0.4552353322505951.
Generating morgan_rdkit fingerprints...
Generated fingerprints with 2048 features for 841 molecules
Trial 784: 5-fold CV loss = 0.8926
[I 2025-08-07 19:37:37,313] Trial 784 finished with value: 0.8925580501556396 and parameters: {'fp_type': 'morgan_rdkit', 'combined_morgan_radius': 3, 'combined_morgan_nBits': 1024, 'combined_rdkit_maxPath': 7, 'combined_rdkit_nBits': 512, 'num_hidden_layers': 3, 'hidden_dim_0': 256, 'hidden_dim_1': 1024, 'hidden_dim_2': 256, 'kl_weight': 0.0004262162121059272, 'lr': 0.0053928894178857, 'batch_size': 128, 'dropout_rate': 0.09263450209767586, 'prior_mu': -0.03279164209873714, 'prior_sigma': 0.11248708713356055, 'normalization': 'layer'}. Best is trial 587 with value: 0.4552353322505951.
Generating morgan_rdkit fingerprints...
Generated fingerprints with 2048 features for 841 molecules
Trial 780: 5-fold CV loss = 0.4556
[I 2025-08-07 19:37:48,127] Trial 780 finished with value: 0.4555538475513458 and parameters: {'fp_type': 'morgan_rdkit', 'combined_morgan_radius': 3, 'combined_morgan_nBits': 1024, 'combined_rdkit_maxPath': 7, 'combined_rdkit_nBits': 1024, 'num_hidden_layers': 3, 'hidden_dim_0': 256, 'hidden_dim_1': 1024, 'hidden_dim_2': 64, 'kl_weight': 0.00039221548413324116, 'lr': 0.007921936121113214, 'batch_size': 128, 'dropout_rate': 0.10654338535017105, 'prior_mu': -0.01533226383865355, 'prior_sigma': 0.1087686092437162, 'normalization': 'layer'}. Best is trial 587 with value: 0.4552353322505951.
Generating morgan_rdkit fingerprints...
Generated fingerprints with 2048 features for 841 molecules
Trial 782: 5-fold CV loss = 0.8880
[I 2025-08-07 19:37:52,906] Trial 782 finished with value: 0.888021981716156 and parameters: {'fp_type': 'rdkit', 'rdkit_only_maxPath': 8, 'rdkit_only_nBits': 256, 'num_hidden_layers': 3, 'hidden_dim_0': 256, 'hidden_dim_1': 1024, 'hidden_dim_2': 64, 'kl_weight': 0.0004215361073710767, 'lr': 0.006810955790981954, 'batch_size': 128, 'dropout_rate': 0.12344149490854699, 'prior_mu': -0.014132975197709818, 'prior_sigma': 0.10791684727697354, 'normalization': 'layer'}. Best is trial 587 with value: 0.4552353322505951.
Generating morgan_rdkit fingerprints...
Generated fingerprints with 2048 features for 841 molecules
Trial 786: 5-fold CV loss = 0.8650
[I 2025-08-07 19:37:58,036] Trial 786 finished with value: 0.8649710178375244 and parameters: {'fp_type': 'morgan_rdkit', 'combined_morgan_radius': 3, 'combined_morgan_nBits': 1024, 'combined_rdkit_maxPath': 7, 'combined_rdkit_nBits': 1024, 'num_hidden_layers': 3, 'hidden_dim_0': 128, 'hidden_dim_1': 1024, 'hidden_dim_2': 64, 'kl_weight': 0.0018555642591648706, 'lr': 0.0004792198932513917, 'batch_size': 128, 'dropout_rate': 0.13319170257725782, 'prior_mu': -0.0148058086882675, 'prior_sigma': 0.11789260821382366, 'normalization': 'layer'}. Best is trial 587 with value: 0.4552353322505951.
Generating morgan_rdkit fingerprints...
Generated fingerprints with 2048 features for 841 molecules
Trial 787: 5-fold CV loss = 0.4677
[I 2025-08-07 19:38:25,930] Trial 787 finished with value: 0.4677147626876831 and parameters: {'fp_type': 'morgan_rdkit', 'combined_morgan_radius': 3, 'combined_morgan_nBits': 1024, 'combined_rdkit_maxPath': 7, 'combined_rdkit_nBits': 1024, 'num_hidden_layers': 3, 'hidden_dim_0': 256, 'hidden_dim_1': 1024, 'hidden_dim_2': 64, 'kl_weight': 0.00046386364502137877, 'lr': 0.007127301214706124, 'batch_size': 128, 'dropout_rate': 0.08986689473040205, 'prior_mu': 0.006660618054233888, 'prior_sigma': 0.10528731276060604, 'normalization': 'layer'}. Best is trial 587 with value: 0.4552353322505951.
Generating morgan_rdkit fingerprints...
Generated fingerprints with 2048 features for 841 molecules
Trial 789: 5-fold CV loss = 0.5421
[I 2025-08-07 19:38:37,560] Trial 789 finished with value: 0.5421239852905273 and parameters: {'fp_type': 'morgan_rdkit', 'combined_morgan_radius': 3, 'combined_morgan_nBits': 1024, 'combined_rdkit_maxPath': 7, 'combined_rdkit_nBits': 1024, 'num_hidden_layers': 3, 'hidden_dim_0': 256, 'hidden_dim_1': 1024, 'hidden_dim_2': 64, 'kl_weight': 0.0004640973616306731, 'lr': 0.007358394946465455, 'batch_size': 128, 'dropout_rate': 0.09706676103578996, 'prior_mu': 0.005038974318604818, 'prior_sigma': 0.1073646438622931, 'normalization': 'layer'}. Best is trial 587 with value: 0.4552353322505951.
Generating morgan_rdkit fingerprints...
Generated fingerprints with 2048 features for 841 molecules
Trial 785: 5-fold CV loss = 0.4676
[I 2025-08-07 19:38:45,070] Trial 785 finished with value: 0.4676166892051697 and parameters: {'fp_type': 'morgan_rdkit', 'combined_morgan_radius': 3, 'combined_morgan_nBits': 1024, 'combined_rdkit_maxPath': 7, 'combined_rdkit_nBits': 1024, 'num_hidden_layers': 3, 'hidden_dim_0': 256, 'hidden_dim_1': 1024, 'hidden_dim_2': 64, 'kl_weight': 0.00030996060352576416, 'lr': 0.006954786887047225, 'batch_size': 128, 'dropout_rate': 0.12943613343539734, 'prior_mu': -0.0309527071903074, 'prior_sigma': 0.1083285488292238, 'normalization': 'layer'}. Best is trial 587 with value: 0.4552353322505951.
Generating morgan_rdkit fingerprints...
Generated fingerprints with 2048 features for 841 molecules
Trial 790: 5-fold CV loss = 0.4628
[I 2025-08-07 19:39:03,475] Trial 790 finished with value: 0.46279035210609437 and parameters: {'fp_type': 'morgan_rdkit', 'combined_morgan_radius': 3, 'combined_morgan_nBits': 1024, 'combined_rdkit_maxPath': 7, 'combined_rdkit_nBits': 1024, 'num_hidden_layers': 3, 'hidden_dim_0': 256, 'hidden_dim_1': 256, 'hidden_dim_2': 64, 'kl_weight': 0.0004660287256786733, 'lr': 0.0077568038365100804, 'batch_size': 128, 'dropout_rate': 0.09830310124370738, 'prior_mu': -0.006668351804638439, 'prior_sigma': 0.10799824124983178, 'normalization': 'layer'}. Best is trial 587 with value: 0.4552353322505951.
Generating morgan_rdkit fingerprints...
Generated fingerprints with 2048 features for 841 molecules
Trial 793: 5-fold CV loss = 0.8753
[I 2025-08-07 19:39:19,006] Trial 793 finished with value: 0.8752640604972839 and parameters: {'fp_type': 'morgan_rdkit', 'combined_morgan_radius': 3, 'combined_morgan_nBits': 1024, 'combined_rdkit_maxPath': 7, 'combined_rdkit_nBits': 1024, 'num_hidden_layers': 3, 'hidden_dim_0': 256, 'hidden_dim_1': 1024, 'hidden_dim_2': 64, 'kl_weight': 0.00035085579268933557, 'lr': 0.0006237764081091153, 'batch_size': 128, 'dropout_rate': 0.10945216329406941, 'prior_mu': -0.01817222744766886, 'prior_sigma': 0.10483395412092478, 'normalization': 'layer'}. Best is trial 587 with value: 0.4552353322505951.
Generating morgan_rdkit fingerprints...
Generated fingerprints with 2048 features for 841 molecules
Trial 791: 5-fold CV loss = 0.4596
[I 2025-08-07 19:39:26,239] Trial 791 finished with value: 0.4595698654651642 and parameters: {'fp_type': 'morgan_rdkit', 'combined_morgan_radius': 3, 'combined_morgan_nBits': 1024, 'combined_rdkit_maxPath': 7, 'combined_rdkit_nBits': 1024, 'num_hidden_layers': 3, 'hidden_dim_0': 256, 'hidden_dim_1': 256, 'hidden_dim_2': 64, 'kl_weight': 0.0003116125227614673, 'lr': 0.007947647224265945, 'batch_size': 128, 'dropout_rate': 0.10629888471088478, 'prior_mu': -0.006306359111224534, 'prior_sigma': 0.10433229174298185, 'normalization': 'layer'}. Best is trial 587 with value: 0.4552353322505951.
Generating morgan_rdkit fingerprints...
Generated fingerprints with 2048 features for 841 molecules
Trial 788: 5-fold CV loss = 0.4588
[I 2025-08-07 19:39:37,014] Trial 788 finished with value: 0.45875146985054016 and parameters: {'fp_type': 'morgan_rdkit', 'combined_morgan_radius': 3, 'combined_morgan_nBits': 1024, 'combined_rdkit_maxPath': 7, 'combined_rdkit_nBits': 1024, 'num_hidden_layers': 3, 'hidden_dim_0': 256, 'hidden_dim_1': 1024, 'hidden_dim_2': 64, 'kl_weight': 0.00047135286472057734, 'lr': 0.007257171579527622, 'batch_size': 128, 'dropout_rate': 0.09069076466454046, 'prior_mu': -0.009449672012229505, 'prior_sigma': 0.10638294328881241, 'normalization': 'layer'}. Best is trial 587 with value: 0.4552353322505951.
Generating morgan_rdkit fingerprints...
Generated fingerprints with 2048 features for 841 molecules
Trial 792: 5-fold CV loss = 0.4822
[I 2025-08-07 19:39:42,977] Trial 792 finished with value: 0.48218865394592286 and parameters: {'fp_type': 'morgan_rdkit', 'combined_morgan_radius': 3, 'combined_morgan_nBits': 1024, 'combined_rdkit_maxPath': 7, 'combined_rdkit_nBits': 1024, 'num_hidden_layers': 3, 'hidden_dim_0': 256, 'hidden_dim_1': 256, 'hidden_dim_2': 64, 'kl_weight': 0.004670346878715396, 'lr': 0.007926313547227976, 'batch_size': 128, 'dropout_rate': 0.10438428972196984, 'prior_mu': -0.006095256349950312, 'prior_sigma': 0.10068864861401164, 'normalization': 'layer'}. Best is trial 587 with value: 0.4552353322505951.
Generating morgan_rdkit fingerprints...
Generated fingerprints with 2048 features for 841 molecules
Trial 794: 5-fold CV loss = 0.4689
[I 2025-08-07 19:39:58,490] Trial 794 finished with value: 0.4689366340637207 and parameters: {'fp_type': 'morgan_rdkit', 'combined_morgan_radius': 3, 'combined_morgan_nBits': 1024, 'combined_rdkit_maxPath': 7, 'combined_rdkit_nBits': 1024, 'num_hidden_layers': 3, 'hidden_dim_0': 256, 'hidden_dim_1': 1024, 'hidden_dim_2': 64, 'kl_weight': 0.0002884018878205226, 'lr': 0.005987394077463473, 'batch_size': 128, 'dropout_rate': 0.10478076113363277, 'prior_mu': -0.018677278455575493, 'prior_sigma': 0.10165843264381098, 'normalization': 'layer'}. Best is trial 587 with value: 0.4552353322505951.
Generating morgan_rdkit fingerprints...
Generated fingerprints with 2048 features for 841 molecules
Trial 795: 5-fold CV loss = 0.5545
