[I 2025-08-07 22:37:55,806] Trial 1697 finished with value: 0.5755888760089874 and parameters: {'fp_type': 'morgan_rdkit', 'combined_morgan_radius': 3, 'combined_morgan_nBits': 1024, 'combined_rdkit_maxPath': 7, 'combined_rdkit_nBits': 256, 'num_hidden_layers': 3, 'hidden_dim_0': 256, 'hidden_dim_1': 1024, 'hidden_dim_2': 64, 'kl_weight': 0.0003455242588246868, 'lr': 0.00791338481818189, 'batch_size': 128, 'dropout_rate': 0.10628943698537241, 'prior_mu': -0.03683259079177928, 'prior_sigma': 0.08575259959948392, 'normalization': 'layer'}. Best is trial 896 with value: 0.4533553242683411.
Generating morgan_rdkit fingerprints...
Generated fingerprints with 2048 features for 841 molecules
Trial 1698: 5-fold CV loss = 0.4646
[I 2025-08-07 22:38:11,954] Trial 1698 finished with value: 0.4645914316177368 and parameters: {'fp_type': 'morgan_rdkit', 'combined_morgan_radius': 3, 'combined_morgan_nBits': 1024, 'combined_rdkit_maxPath': 7, 'combined_rdkit_nBits': 1024, 'num_hidden_layers': 3, 'hidden_dim_0': 256, 'hidden_dim_1': 1024, 'hidden_dim_2': 64, 'kl_weight': 0.00039595433830031355, 'lr': 0.00782960081923899, 'batch_size': 128, 'dropout_rate': 0.3491529285731796, 'prior_mu': -0.0360933639539176, 'prior_sigma': 0.06476117570868987, 'normalization': 'layer'}. Best is trial 896 with value: 0.4533553242683411.
Generating morgan_rdkit fingerprints...
Generated fingerprints with 2048 features for 841 molecules
Trial 1696: 5-fold CV loss = 0.7399
[I 2025-08-07 22:38:14,837] Trial 1696 finished with value: 0.7398588299751282 and parameters: {'fp_type': 'rdkit', 'rdkit_only_maxPath': 7, 'rdkit_only_nBits': 512, 'num_hidden_layers': 3, 'hidden_dim_0': 256, 'hidden_dim_1': 1024, 'hidden_dim_2': 64, 'kl_weight': 0.0005651063095721683, 'lr': 0.007397154567688579, 'batch_size': 128, 'dropout_rate': 0.10499178042266887, 'prior_mu': -0.0313272634559897, 'prior_sigma': 0.08711774901581495, 'normalization': 'layer'}. Best is trial 896 with value: 0.4533553242683411.
Generating morgan_rdkit fingerprints...
Generated fingerprints with 2048 features for 841 molecules
Trial 1699: 5-fold CV loss = 0.4784
[I 2025-08-07 22:38:31,366] Trial 1699 finished with value: 0.47839794754981996 and parameters: {'fp_type': 'morgan_rdkit', 'combined_morgan_radius': 3, 'combined_morgan_nBits': 1024, 'combined_rdkit_maxPath': 7, 'combined_rdkit_nBits': 1024, 'num_hidden_layers': 3, 'hidden_dim_0': 256, 'hidden_dim_1': 1024, 'hidden_dim_2': 256, 'kl_weight': 0.0003976694883289732, 'lr': 0.007426112266071072, 'batch_size': 128, 'dropout_rate': 0.07733107985040061, 'prior_mu': -0.03852106924085941, 'prior_sigma': 0.063987853833119, 'normalization': 'layer'}. Best is trial 896 with value: 0.4533553242683411.
Generating morgan_rdkit fingerprints...
Generated fingerprints with 2048 features for 841 molecules
Trial 1694: 5-fold CV loss = 0.4763
[I 2025-08-07 22:38:37,845] Trial 1694 finished with value: 0.4762792348861694 and parameters: {'fp_type': 'morgan_rdkit', 'combined_morgan_radius': 3, 'combined_morgan_nBits': 1024, 'combined_rdkit_maxPath': 7, 'combined_rdkit_nBits': 1024, 'num_hidden_layers': 3, 'hidden_dim_0': 128, 'hidden_dim_1': 1024, 'hidden_dim_2': 64, 'kl_weight': 0.00032921688835481805, 'lr': 0.006526104621279559, 'batch_size': 128, 'dropout_rate': 0.1025148606568803, 'prior_mu': -0.027544830002917783, 'prior_sigma': 0.08541891989742946, 'normalization': 'layer'}. Best is trial 896 with value: 0.4533553242683411.
Generating morgan_rdkit fingerprints...
Generated fingerprints with 2048 features for 841 molecules
Trial 1701: 5-fold CV loss = 0.6229
[I 2025-08-07 22:39:05,257] Trial 1701 finished with value: 0.6228627741336823 and parameters: {'fp_type': 'morgan_rdkit', 'combined_morgan_radius': 3, 'combined_morgan_nBits': 1024, 'combined_rdkit_maxPath': 7, 'combined_rdkit_nBits': 1024, 'num_hidden_layers': 3, 'hidden_dim_0': 256, 'hidden_dim_1': 1024, 'hidden_dim_2': 256, 'kl_weight': 0.00046126447007772877, 'lr': 0.009980080413956547, 'batch_size': 128, 'dropout_rate': 0.07346357172891914, 'prior_mu': -0.06994828161975225, 'prior_sigma': 0.10766263591322348, 'normalization': 'layer'}. Best is trial 896 with value: 0.4533553242683411.
Generating morgan_rdkit fingerprints...
Generated fingerprints with 2048 features for 841 molecules
Trial 1700: 5-fold CV loss = 0.4731
[I 2025-08-07 22:39:16,495] Trial 1700 finished with value: 0.47307934165000914 and parameters: {'fp_type': 'morgan_rdkit', 'combined_morgan_radius': 3, 'combined_morgan_nBits': 1024, 'combined_rdkit_maxPath': 7, 'combined_rdkit_nBits': 1024, 'num_hidden_layers': 3, 'hidden_dim_0': 256, 'hidden_dim_1': 1024, 'hidden_dim_2': 256, 'kl_weight': 0.0004399826219569186, 'lr': 0.007236291772653515, 'batch_size': 128, 'dropout_rate': 0.10430356888158682, 'prior_mu': -0.027821156614108764, 'prior_sigma': 0.10858472187377112, 'normalization': 'layer'}. Best is trial 896 with value: 0.4533553242683411.
Generating morgan_rdkit fingerprints...
Generated fingerprints with 2048 features for 841 molecules
Trial 1702: 5-fold CV loss = 0.4640
[I 2025-08-07 22:39:20,700] Trial 1702 finished with value: 0.46398383378982544 and parameters: {'fp_type': 'morgan_rdkit', 'combined_morgan_radius': 3, 'combined_morgan_nBits': 1024, 'combined_rdkit_maxPath': 7, 'combined_rdkit_nBits': 1024, 'num_hidden_layers': 3, 'hidden_dim_0': 512, 'hidden_dim_1': 1024, 'hidden_dim_2': 64, 'kl_weight': 0.00044367485092340283, 'lr': 0.009231261426159949, 'batch_size': 128, 'dropout_rate': 0.12042074245523007, 'prior_mu': -0.030009036193432252, 'prior_sigma': 0.1539576293166501, 'normalization': 'layer'}. Best is trial 896 with value: 0.4533553242683411.
Generating morgan_rdkit fingerprints...
Generated fingerprints with 2048 features for 841 molecules
Trial 1703: 5-fold CV loss = 0.4725
[I 2025-08-07 22:39:46,136] Trial 1703 finished with value: 0.47248793840408326 and parameters: {'fp_type': 'morgan_rdkit', 'combined_morgan_radius': 3, 'combined_morgan_nBits': 1024, 'combined_rdkit_maxPath': 7, 'combined_rdkit_nBits': 1024, 'num_hidden_layers': 3, 'hidden_dim_0': 256, 'hidden_dim_1': 1024, 'hidden_dim_2': 64, 'kl_weight': 0.00043129812686583033, 'lr': 0.00908804555285466, 'batch_size': 128, 'dropout_rate': 0.11730790154663287, 'prior_mu': -0.06863841042739492, 'prior_sigma': 0.05515679067069458, 'normalization': 'layer'}. Best is trial 896 with value: 0.4533553242683411.
Generating morgan_rdkit fingerprints...
Generated fingerprints with 2048 features for 841 molecules
Trial 1706: 5-fold CV loss = 0.5699
[I 2025-08-07 22:39:50,452] Trial 1706 finished with value: 0.5699095726013184 and parameters: {'fp_type': 'morgan_rdkit', 'combined_morgan_radius': 3, 'combined_morgan_nBits': 1024, 'combined_rdkit_maxPath': 7, 'combined_rdkit_nBits': 1024, 'num_hidden_layers': 3, 'hidden_dim_0': 256, 'hidden_dim_1': 1024, 'hidden_dim_2': 64, 'kl_weight': 0.0003225028315205892, 'lr': 0.0063861794664165795, 'batch_size': 128, 'dropout_rate': 0.1140825289757457, 'prior_mu': -0.04570807478657187, 'prior_sigma': 0.10188826264675077, 'normalization': 'layer'}. Best is trial 896 with value: 0.4533553242683411.
Generating morgan_rdkit fingerprints...
Generated fingerprints with 2048 features for 841 molecules
Trial 1705: 5-fold CV loss = 0.4625
[I 2025-08-07 22:40:00,007] Trial 1705 finished with value: 0.4625366985797882 and parameters: {'fp_type': 'morgan_rdkit', 'combined_morgan_radius': 3, 'combined_morgan_nBits': 1024, 'combined_rdkit_maxPath': 7, 'combined_rdkit_nBits': 1024, 'num_hidden_layers': 3, 'hidden_dim_0': 512, 'hidden_dim_1': 1024, 'hidden_dim_2': 64, 'kl_weight': 0.00032880495011223875, 'lr': 0.00909906858532919, 'batch_size': 128, 'dropout_rate': 0.11555476150362881, 'prior_mu': -0.04670066906554245, 'prior_sigma': 0.09541857065738957, 'normalization': 'layer'}. Best is trial 896 with value: 0.4533553242683411.
Generating morgan_rdkit fingerprints...
Generated fingerprints with 2048 features for 841 molecules
Trial 1704: 5-fold CV loss = 0.4637
[I 2025-08-07 22:40:07,706] Trial 1704 finished with value: 0.4637138843536377 and parameters: {'fp_type': 'morgan_rdkit', 'combined_morgan_radius': 3, 'combined_morgan_nBits': 1024, 'combined_rdkit_maxPath': 7, 'combined_rdkit_nBits': 1024, 'num_hidden_layers': 3, 'hidden_dim_0': 256, 'hidden_dim_1': 1024, 'hidden_dim_2': 64, 'kl_weight': 0.00044783327127216014, 'lr': 0.00916725736365493, 'batch_size': 128, 'dropout_rate': 0.18870453249104352, 'prior_mu': -0.04709215618475275, 'prior_sigma': 0.09469544622653657, 'normalization': 'layer'}. Best is trial 896 with value: 0.4533553242683411.
Generating morgan_rdkit fingerprints...
Generated fingerprints with 2048 features for 841 molecules
Trial 1709: 5-fold CV loss = 0.4743
[I 2025-08-07 22:40:38,356] Trial 1709 finished with value: 0.47428805828094484 and parameters: {'fp_type': 'morgan_rdkit', 'combined_morgan_radius': 3, 'combined_morgan_nBits': 1024, 'combined_rdkit_maxPath': 7, 'combined_rdkit_nBits': 1024, 'num_hidden_layers': 3, 'hidden_dim_0': 256, 'hidden_dim_1': 1024, 'hidden_dim_2': 64, 'kl_weight': 0.00036995423125647065, 'lr': 0.008336427163291617, 'batch_size': 128, 'dropout_rate': 0.13421335060575104, 'prior_mu': -0.023168257397577125, 'prior_sigma': 0.07295711774117358, 'normalization': 'layer'}. Best is trial 896 with value: 0.4533553242683411.
Generating morgan_rdkit fingerprints...
Generated fingerprints with 2048 features for 841 molecules
Trial 1708: 5-fold CV loss = 0.5649
[I 2025-08-07 22:40:40,830] Trial 1708 finished with value: 0.5649159014225006 and parameters: {'fp_type': 'morgan_rdkit', 'combined_morgan_radius': 3, 'combined_morgan_nBits': 1024, 'combined_rdkit_maxPath': 7, 'combined_rdkit_nBits': 1024, 'num_hidden_layers': 3, 'hidden_dim_0': 256, 'hidden_dim_1': 1024, 'hidden_dim_2': 64, 'kl_weight': 0.0003151992804729191, 'lr': 0.008237101380340214, 'batch_size': 128, 'dropout_rate': 0.13137956497849151, 'prior_mu': -0.03995919451842561, 'prior_sigma': 0.09405445276276436, 'normalization': 'none'}. Best is trial 896 with value: 0.4533553242683411.
Generating morgan fingerprints...
Generated fingerprints with 1024 features for 841 molecules
Trial 1707: 5-fold CV loss = 0.7538
[I 2025-08-07 22:40:43,521] Trial 1707 finished with value: 0.7538005709648132 and parameters: {'fp_type': 'morgan_rdkit', 'combined_morgan_radius': 3, 'combined_morgan_nBits': 1024, 'combined_rdkit_maxPath': 7, 'combined_rdkit_nBits': 1024, 'num_hidden_layers': 3, 'hidden_dim_0': 256, 'hidden_dim_1': 1024, 'hidden_dim_2': 64, 'kl_weight': 0.0003111104346149103, 'lr': 0.00637884023912494, 'batch_size': 128, 'dropout_rate': 0.1308622852579426, 'prior_mu': -0.04231984011984858, 'prior_sigma': 0.09379981744307975, 'normalization': 'none'}. Best is trial 896 with value: 0.4533553242683411.
Generating morgan_rdkit fingerprints...
Generated fingerprints with 2048 features for 841 molecules
Trial 1711: 5-fold CV loss = 0.8255
[I 2025-08-07 22:40:57,820] Trial 1711 finished with value: 0.8255205035209656 and parameters: {'fp_type': 'morgan_rdkit', 'combined_morgan_radius': 3, 'combined_morgan_nBits': 1024, 'combined_rdkit_maxPath': 6, 'combined_rdkit_nBits': 1024, 'num_hidden_layers': 3, 'hidden_dim_0': 256, 'hidden_dim_1': 1024, 'hidden_dim_2': 64, 'kl_weight': 0.0005050454016568388, 'lr': 0.0012726047296537377, 'batch_size': 128, 'dropout_rate': 0.12645694102431304, 'prior_mu': -0.03848284660480736, 'prior_sigma': 0.09172907034346871, 'normalization': 'none'}. Best is trial 896 with value: 0.4533553242683411.
Generating morgan_rdkit fingerprints...
Generated fingerprints with 2048 features for 841 molecules
Trial 1712: 5-fold CV loss = 0.5286
[I 2025-08-07 22:40:59,512] Trial 1712 finished with value: 0.528597605228424 and parameters: {'fp_type': 'morgan', 'morgan_only_radius': 2, 'morgan_only_nBits': 1024, 'num_hidden_layers': 3, 'hidden_dim_0': 256, 'hidden_dim_1': 1024, 'hidden_dim_2': 64, 'kl_weight': 0.0005227817188301752, 'lr': 0.006388470373024855, 'batch_size': 128, 'dropout_rate': 0.07524414399098867, 'prior_mu': -0.02355931713540735, 'prior_sigma': 0.08419367404042831, 'normalization': 'layer'}. Best is trial 896 with value: 0.4533553242683411.
Generating morgan_rdkit fingerprints...
Generated fingerprints with 2048 features for 841 molecules
Trial 1710: 5-fold CV loss = 0.5810
[I 2025-08-07 22:41:06,083] Trial 1710 finished with value: 0.5810242474079133 and parameters: {'fp_type': 'morgan_rdkit', 'combined_morgan_radius': 3, 'combined_morgan_nBits': 1024, 'combined_rdkit_maxPath': 7, 'combined_rdkit_nBits': 1024, 'num_hidden_layers': 3, 'hidden_dim_0': 256, 'hidden_dim_1': 1024, 'hidden_dim_2': 64, 'kl_weight': 0.0003772578231002097, 'lr': 0.008026581839040127, 'batch_size': 128, 'dropout_rate': 0.13296838341302328, 'prior_mu': -0.02305943562502178, 'prior_sigma': 0.07254229611479575, 'normalization': 'none'}. Best is trial 896 with value: 0.4533553242683411.
Generating morgan_rdkit fingerprints...
Generated fingerprints with 1536 features for 841 molecules
Trial 1715: 5-fold CV loss = 0.4692
[I 2025-08-07 22:41:39,703] Trial 1715 finished with value: 0.46923147439956664 and parameters: {'fp_type': 'morgan_rdkit', 'combined_morgan_radius': 3, 'combined_morgan_nBits': 1024, 'combined_rdkit_maxPath': 7, 'combined_rdkit_nBits': 1024, 'num_hidden_layers': 3, 'hidden_dim_0': 256, 'hidden_dim_1': 1024, 'hidden_dim_2': 64, 'kl_weight': 0.0003799575186000755, 'lr': 0.007225130899037232, 'batch_size': 128, 'dropout_rate': 0.09754854612356617, 'prior_mu': -0.026158712404480085, 'prior_sigma': 0.10403034317982673, 'normalization': 'layer'}. Best is trial 896 with value: 0.4533553242683411.
Generating morgan_rdkit fingerprints...
Generated fingerprints with 1536 features for 841 molecules
Trial 1714: 5-fold CV loss = 0.4569
[I 2025-08-07 22:41:42,222] Trial 1714 finished with value: 0.45692178010940554 and parameters: {'fp_type': 'morgan_rdkit', 'combined_morgan_radius': 3, 'combined_morgan_nBits': 1024, 'combined_rdkit_maxPath': 7, 'combined_rdkit_nBits': 1024, 'num_hidden_layers': 3, 'hidden_dim_0': 256, 'hidden_dim_1': 1024, 'hidden_dim_2': 64, 'kl_weight': 0.00037729021901729065, 'lr': 0.00723290910273606, 'batch_size': 128, 'dropout_rate': 0.07566086009925203, 'prior_mu': -0.023404694355147096, 'prior_sigma': 0.08262130020929971, 'normalization': 'layer'}. Best is trial 896 with value: 0.4533553242683411.
Generating morgan_rdkit fingerprints...
Generated fingerprints with 2048 features for 841 molecules
Trial 1713: 5-fold CV loss = 0.8593
[I 2025-08-07 22:41:46,862] Trial 1713 finished with value: 0.8593275547027588 and parameters: {'fp_type': 'morgan_rdkit', 'combined_morgan_radius': 3, 'combined_morgan_nBits': 1024, 'combined_rdkit_maxPath': 6, 'combined_rdkit_nBits': 1024, 'num_hidden_layers': 3, 'hidden_dim_0': 256, 'hidden_dim_1': 1024, 'hidden_dim_2': 64, 'kl_weight': 0.0003699694744436701, 'lr': 0.00017753801349797293, 'batch_size': 128, 'dropout_rate': 0.07352463891703015, 'prior_mu': -0.02307642721696016, 'prior_sigma': 0.0835056917170556, 'normalization': 'layer'}. Best is trial 896 with value: 0.4533553242683411.
Generating morgan_rdkit fingerprints...
Generated fingerprints with 1536 features for 841 molecules
Trial 1716: 5-fold CV loss = 0.8807
[I 2025-08-07 22:41:53,994] Trial 1716 finished with value: 0.8807090997695923 and parameters: {'fp_type': 'morgan_rdkit', 'combined_morgan_radius': 3, 'combined_morgan_nBits': 1024, 'combined_rdkit_maxPath': 7, 'combined_rdkit_nBits': 512, 'num_hidden_layers': 3, 'hidden_dim_0': 256, 'hidden_dim_1': 1024, 'hidden_dim_2': 64, 'kl_weight': 0.00037944065846489734, 'lr': 0.00017610586759857024, 'batch_size': 128, 'dropout_rate': 0.09914038810362039, 'prior_mu': -0.06055983923935794, 'prior_sigma': 0.06719005489366121, 'normalization': 'layer'}. Best is trial 896 with value: 0.4533553242683411.
Generating morgan_rdkit fingerprints...
Generated fingerprints with 2048 features for 841 molecules
Trial 1717: 5-fold CV loss = 0.4919
[I 2025-08-07 22:42:20,237] Trial 1717 finished with value: 0.49185144901275635 and parameters: {'fp_type': 'morgan_rdkit', 'combined_morgan_radius': 3, 'combined_morgan_nBits': 1024, 'combined_rdkit_maxPath': 7, 'combined_rdkit_nBits': 512, 'num_hidden_layers': 3, 'hidden_dim_0': 256, 'hidden_dim_1': 1024, 'hidden_dim_2': 64, 'kl_weight': 0.00037677861047973635, 'lr': 0.007037003438793677, 'batch_size': 128, 'dropout_rate': 0.1044519975433178, 'prior_mu': -0.06287668741170827, 'prior_sigma': 0.0831686778200774, 'normalization': 'layer'}. Best is trial 896 with value: 0.4533553242683411.
Generating morgan_rdkit fingerprints...
Generated fingerprints with 1280 features for 841 molecules
Trial 1718: 5-fold CV loss = 0.4855
[I 2025-08-07 22:42:26,502] Trial 1718 finished with value: 0.4855459094047546 and parameters: {'fp_type': 'morgan_rdkit', 'combined_morgan_radius': 3, 'combined_morgan_nBits': 1024, 'combined_rdkit_maxPath': 7, 'combined_rdkit_nBits': 1024, 'num_hidden_layers': 3, 'hidden_dim_0': 256, 'hidden_dim_1': 1024, 'hidden_dim_2': 64, 'kl_weight': 0.02045170975739122, 'lr': 0.006994349452400501, 'batch_size': 128, 'dropout_rate': 0.06319515065066685, 'prior_mu': -0.06152040641011551, 'prior_sigma': 0.08478078238842529, 'normalization': 'layer'}. Best is trial 896 with value: 0.4533553242683411.
Generating morgan_rdkit fingerprints...
Generated fingerprints with 1280 features for 841 molecules
Trial 1720: 5-fold CV loss = 0.4715
[I 2025-08-07 22:42:45,811] Trial 1720 finished with value: 0.4715287148952484 and parameters: {'fp_type': 'morgan_rdkit', 'combined_morgan_radius': 3, 'combined_morgan_nBits': 1024, 'combined_rdkit_maxPath': 7, 'combined_rdkit_nBits': 1024, 'num_hidden_layers': 3, 'hidden_dim_0': 256, 'hidden_dim_1': 1024, 'hidden_dim_2': 64, 'kl_weight': 0.0005859118149119419, 'lr': 0.007319030643067986, 'batch_size': 128, 'dropout_rate': 0.06704591259649104, 'prior_mu': -0.01704552866837623, 'prior_sigma': 0.08302391675397555, 'normalization': 'layer'}. Best is trial 896 with value: 0.4533553242683411.
Generating morgan_rdkit fingerprints...
Generated fingerprints with 2048 features for 841 molecules
Trial 1721: 5-fold CV loss = 0.5162
[I 2025-08-07 22:42:47,283] Trial 1721 finished with value: 0.516235762834549 and parameters: {'fp_type': 'morgan_rdkit', 'combined_morgan_radius': 3, 'combined_morgan_nBits': 1024, 'combined_rdkit_maxPath': 7, 'combined_rdkit_nBits': 256, 'num_hidden_layers': 3, 'hidden_dim_0': 256, 'hidden_dim_1': 1024, 'hidden_dim_2': 64, 'kl_weight': 0.0006614462079028412, 'lr': 0.007471585522518851, 'batch_size': 128, 'dropout_rate': 0.05563835354013187, 'prior_mu': -0.033346288832800566, 'prior_sigma': 0.08328347385014659, 'normalization': 'layer'}. Best is trial 896 with value: 0.4533553242683411.
Generating morgan_rdkit fingerprints...
Generated fingerprints with 2048 features for 841 molecules
Trial 1722: 5-fold CV loss = 0.5933
[I 2025-08-07 22:42:55,488] Trial 1722 finished with value: 0.5932917475700379 and parameters: {'fp_type': 'morgan_rdkit', 'combined_morgan_radius': 3, 'combined_morgan_nBits': 1024, 'combined_rdkit_maxPath': 7, 'combined_rdkit_nBits': 256, 'num_hidden_layers': 3, 'hidden_dim_0': 256, 'hidden_dim_1': 1024, 'hidden_dim_2': 64, 'kl_weight': 0.0005837728021260933, 'lr': 0.00781395093762193, 'batch_size': 128, 'dropout_rate': 0.05261674524587233, 'prior_mu': -0.01586771411982632, 'prior_sigma': 0.08123192410028919, 'normalization': 'layer'}. Best is trial 896 with value: 0.4533553242683411.
Generating morgan_rdkit fingerprints...
Generated fingerprints with 2048 features for 841 molecules
Trial 1719: 5-fold CV loss = 0.5932
[I 2025-08-07 22:42:57,772] Trial 1719 finished with value: 0.5931517243385315 and parameters: {'fp_type': 'morgan_rdkit', 'combined_morgan_radius': 3, 'combined_morgan_nBits': 1024, 'combined_rdkit_maxPath': 7, 'combined_rdkit_nBits': 512, 'num_hidden_layers': 3, 'hidden_dim_0': 256, 'hidden_dim_1': 1024, 'hidden_dim_2': 64, 'kl_weight': 0.0005619640956536042, 'lr': 0.007244310797486191, 'batch_size': 128, 'dropout_rate': 0.06320439824073087, 'prior_mu': -0.05983465105802882, 'prior_sigma': 0.08230903755028585, 'normalization': 'layer'}. Best is trial 896 with value: 0.4533553242683411.
Generating morgan_rdkit fingerprints...
Generated fingerprints with 2048 features for 841 molecules
Trial 1724: 5-fold CV loss = 0.4817
[I 2025-08-07 22:43:28,322] Trial 1724 finished with value: 0.4817440390586853 and parameters: {'fp_type': 'morgan_rdkit', 'combined_morgan_radius': 3, 'combined_morgan_nBits': 1024, 'combined_rdkit_maxPath': 8, 'combined_rdkit_nBits': 1024, 'num_hidden_layers': 3, 'hidden_dim_0': 256, 'hidden_dim_1': 1024, 'hidden_dim_2': 64, 'kl_weight': 0.0004942122707058237, 'lr': 0.008226941127468225, 'batch_size': 128, 'dropout_rate': 0.07249204543181903, 'prior_mu': -0.0516790904322276, 'prior_sigma': 0.08820725728704629, 'normalization': 'layer'}. Best is trial 896 with value: 0.4533553242683411.
Generating morgan_rdkit fingerprints...
Generated fingerprints with 2048 features for 841 molecules
Trial 1725: 5-fold CV loss = 0.5421
[I 2025-08-07 22:43:33,009] Trial 1725 finished with value: 0.5421451568603516 and parameters: {'fp_type': 'morgan_rdkit', 'combined_morgan_radius': 3, 'combined_morgan_nBits': 1024, 'combined_rdkit_maxPath': 8, 'combined_rdkit_nBits': 1024, 'num_hidden_layers': 3, 'hidden_dim_0': 256, 'hidden_dim_1': 1024, 'hidden_dim_2': 64, 'kl_weight': 0.0004839471999195987, 'lr': 0.008392957497343694, 'batch_size': 128, 'dropout_rate': 0.06792756154401608, 'prior_mu': -0.03704771778605201, 'prior_sigma': 0.08736754192704149, 'normalization': 'layer'}. Best is trial 896 with value: 0.4533553242683411.
Generating morgan_rdkit fingerprints...
Generated fingerprints with 2048 features for 841 molecules
Trial 1723: 5-fold CV loss = 0.4668
