[I 2025-08-07 22:48:49,395] Trial 1752 finished with value: 0.46756832003593446 and parameters: {'fp_type': 'morgan_rdkit', 'combined_morgan_radius': 3, 'combined_morgan_nBits': 1024, 'combined_rdkit_maxPath': 7, 'combined_rdkit_nBits': 1024, 'num_hidden_layers': 3, 'hidden_dim_0': 256, 'hidden_dim_1': 1024, 'hidden_dim_2': 64, 'kl_weight': 0.00033901998839302967, 'lr': 0.009699615413911322, 'batch_size': 128, 'dropout_rate': 0.17737565517186038, 'prior_mu': -0.03893318361617694, 'prior_sigma': 0.07511662478353368, 'normalization': 'layer'}. Best is trial 896 with value: 0.4533553242683411.
Generating morgan_rdkit fingerprints...
Generated fingerprints with 2048 features for 841 molecules
Trial 1754: 5-fold CV loss = 0.4636
[I 2025-08-07 22:48:58,348] Trial 1754 finished with value: 0.4635627448558807 and parameters: {'fp_type': 'morgan_rdkit', 'combined_morgan_radius': 3, 'combined_morgan_nBits': 1024, 'combined_rdkit_maxPath': 7, 'combined_rdkit_nBits': 1024, 'num_hidden_layers': 3, 'hidden_dim_0': 512, 'hidden_dim_1': 1024, 'hidden_dim_2': 64, 'kl_weight': 0.0002458617428478404, 'lr': 0.009414056742363898, 'batch_size': 128, 'dropout_rate': 0.20209288842122244, 'prior_mu': -0.03368413956559792, 'prior_sigma': 0.08471767631734473, 'normalization': 'layer'}. Best is trial 896 with value: 0.4533553242683411.
Generating morgan_rdkit fingerprints...
Generated fingerprints with 2048 features for 841 molecules
Trial 1757: 5-fold CV loss = 0.4741
[I 2025-08-07 22:49:16,174] Trial 1757 finished with value: 0.47406341433525084 and parameters: {'fp_type': 'morgan_rdkit', 'combined_morgan_radius': 3, 'combined_morgan_nBits': 1024, 'combined_rdkit_maxPath': 5, 'combined_rdkit_nBits': 1024, 'num_hidden_layers': 3, 'hidden_dim_0': 256, 'hidden_dim_1': 64, 'hidden_dim_2': 64, 'kl_weight': 0.0002609266379718941, 'lr': 0.009541205973461673, 'batch_size': 128, 'dropout_rate': 0.05241919278317994, 'prior_mu': -0.056971624696634, 'prior_sigma': 0.07360819468766694, 'normalization': 'layer'}. Best is trial 896 with value: 0.4533553242683411.
Generating morgan_rdkit fingerprints...
Generated fingerprints with 2048 features for 841 molecules
Trial 1758: 5-fold CV loss = 0.4674
[I 2025-08-07 22:49:22,365] Trial 1758 finished with value: 0.46739216446876525 and parameters: {'fp_type': 'morgan_rdkit', 'combined_morgan_radius': 3, 'combined_morgan_nBits': 1024, 'combined_rdkit_maxPath': 7, 'combined_rdkit_nBits': 1024, 'num_hidden_layers': 3, 'hidden_dim_0': 256, 'hidden_dim_1': 64, 'hidden_dim_2': 64, 'kl_weight': 0.00026744913959473606, 'lr': 0.009902471531200632, 'batch_size': 128, 'dropout_rate': 0.03678080244390174, 'prior_mu': -0.054985549085015545, 'prior_sigma': 0.07356013327249233, 'normalization': 'layer'}. Best is trial 896 with value: 0.4533553242683411.
Generating morgan_rdkit fingerprints...
Generated fingerprints with 2048 features for 841 molecules
Trial 1761: 5-fold CV loss = 0.8758
[I 2025-08-07 22:49:38,006] Trial 1761 finished with value: 0.8758022308349609 and parameters: {'fp_type': 'morgan_rdkit', 'combined_morgan_radius': 3, 'combined_morgan_nBits': 1024, 'combined_rdkit_maxPath': 7, 'combined_rdkit_nBits': 1024, 'num_hidden_layers': 3, 'hidden_dim_0': 256, 'hidden_dim_1': 1024, 'hidden_dim_2': 64, 'kl_weight': 0.0003665443162252239, 'lr': 0.00028887794862334746, 'batch_size': 128, 'dropout_rate': 0.13767610985940446, 'prior_mu': -0.05008762089254201, 'prior_sigma': 0.08089735509292921, 'normalization': 'layer'}. Best is trial 896 with value: 0.4533553242683411.
Generating morgan_rdkit fingerprints...
Generated fingerprints with 2048 features for 841 molecules
Trial 1762: 5-fold CV loss = 0.4660
[I 2025-08-07 22:49:52,647] Trial 1762 finished with value: 0.4659814894199371 and parameters: {'fp_type': 'morgan_rdkit', 'combined_morgan_radius': 3, 'combined_morgan_nBits': 1024, 'combined_rdkit_maxPath': 7, 'combined_rdkit_nBits': 1024, 'num_hidden_layers': 3, 'hidden_dim_0': 256, 'hidden_dim_1': 1024, 'hidden_dim_2': 64, 'kl_weight': 0.00038248649315625213, 'lr': 0.008645702144427022, 'batch_size': 128, 'dropout_rate': 0.13952436735485124, 'prior_mu': -0.030826186162773165, 'prior_sigma': 0.07938990976447709, 'normalization': 'layer'}. Best is trial 896 with value: 0.4533553242683411.
Generating morgan_rdkit fingerprints...
Generated fingerprints with 2048 features for 841 molecules
Trial 1760: 5-fold CV loss = 0.4674
[I 2025-08-07 22:49:59,173] Trial 1760 finished with value: 0.4673594832420349 and parameters: {'fp_type': 'morgan_rdkit', 'combined_morgan_radius': 3, 'combined_morgan_nBits': 1024, 'combined_rdkit_maxPath': 7, 'combined_rdkit_nBits': 1024, 'num_hidden_layers': 3, 'hidden_dim_0': 256, 'hidden_dim_1': 64, 'hidden_dim_2': 64, 'kl_weight': 0.00027108696176363913, 'lr': 0.008481052823086132, 'batch_size': 128, 'dropout_rate': 0.1412707109278413, 'prior_mu': -0.05403377603760025, 'prior_sigma': 0.07354518935479662, 'normalization': 'layer'}. Best is trial 896 with value: 0.4533553242683411.
Generating morgan_rdkit fingerprints...
Generated fingerprints with 2048 features for 841 molecules
Trial 1759: 5-fold CV loss = 0.4666
[I 2025-08-07 22:50:18,913] Trial 1759 finished with value: 0.4666041433811188 and parameters: {'fp_type': 'morgan_rdkit', 'combined_morgan_radius': 3, 'combined_morgan_nBits': 1024, 'combined_rdkit_maxPath': 7, 'combined_rdkit_nBits': 1024, 'num_hidden_layers': 3, 'hidden_dim_0': 256, 'hidden_dim_1': 1024, 'hidden_dim_2': 64, 'kl_weight': 0.0002739035022031363, 'lr': 0.008644397014798598, 'batch_size': 128, 'dropout_rate': 0.140919070927351, 'prior_mu': -0.054495913872102446, 'prior_sigma': 0.07323095596150629, 'normalization': 'layer'}. Best is trial 896 with value: 0.4533553242683411.
Generating morgan_rdkit fingerprints...
Generated fingerprints with 2048 features for 841 molecules
Trial 1763: 5-fold CV loss = 0.4676
[I 2025-08-07 22:50:21,474] Trial 1763 finished with value: 0.4675940990447998 and parameters: {'fp_type': 'morgan_rdkit', 'combined_morgan_radius': 3, 'combined_morgan_nBits': 1024, 'combined_rdkit_maxPath': 7, 'combined_rdkit_nBits': 1024, 'num_hidden_layers': 3, 'hidden_dim_0': 256, 'hidden_dim_1': 1024, 'hidden_dim_2': 64, 'kl_weight': 0.00038171066341445646, 'lr': 0.008641092138343246, 'batch_size': 128, 'dropout_rate': 0.1413666076154731, 'prior_mu': -0.04749425382888546, 'prior_sigma': 0.08679120404559353, 'normalization': 'layer'}. Best is trial 896 with value: 0.4533553242683411.
Generating morgan_rdkit fingerprints...
Generated fingerprints with 2048 features for 841 molecules
Trial 1764: 5-fold CV loss = 0.4710
[I 2025-08-07 22:50:26,361] Trial 1764 finished with value: 0.47104265689849856 and parameters: {'fp_type': 'morgan_rdkit', 'combined_morgan_radius': 3, 'combined_morgan_nBits': 1024, 'combined_rdkit_maxPath': 7, 'combined_rdkit_nBits': 1024, 'num_hidden_layers': 3, 'hidden_dim_0': 256, 'hidden_dim_1': 1024, 'hidden_dim_2': 64, 'kl_weight': 0.00028854046488425804, 'lr': 0.008642504141572707, 'batch_size': 128, 'dropout_rate': 0.0915566350490737, 'prior_mu': -0.049490222238236514, 'prior_sigma': 0.09202136443658368, 'normalization': 'layer'}. Best is trial 896 with value: 0.4533553242683411.
Generating morgan_rdkit fingerprints...
Generated fingerprints with 2048 features for 841 molecules
Trial 1765: 5-fold CV loss = 0.8642
[I 2025-08-07 22:50:31,145] Trial 1765 finished with value: 0.8641865491867066 and parameters: {'fp_type': 'morgan_rdkit', 'combined_morgan_radius': 3, 'combined_morgan_nBits': 1024, 'combined_rdkit_maxPath': 7, 'combined_rdkit_nBits': 1024, 'num_hidden_layers': 3, 'hidden_dim_0': 256, 'hidden_dim_1': 1024, 'hidden_dim_2': 64, 'kl_weight': 0.00029815974233483335, 'lr': 0.0005009165313788744, 'batch_size': 128, 'dropout_rate': 0.0755293770706004, 'prior_mu': -0.04835211057406174, 'prior_sigma': 0.09149699611597292, 'normalization': 'layer'}. Best is trial 896 with value: 0.4533553242683411.
Generating morgan_rdkit fingerprints...
Generated fingerprints with 1280 features for 841 molecules
Trial 1768: 5-fold CV loss = 0.4720
[I 2025-08-07 22:50:57,957] Trial 1768 finished with value: 0.4720380127429962 and parameters: {'fp_type': 'morgan_rdkit', 'combined_morgan_radius': 3, 'combined_morgan_nBits': 1024, 'combined_rdkit_maxPath': 7, 'combined_rdkit_nBits': 1024, 'num_hidden_layers': 3, 'hidden_dim_0': 256, 'hidden_dim_1': 1024, 'hidden_dim_2': 64, 'kl_weight': 0.00021790250353077834, 'lr': 0.00818166182628088, 'batch_size': 128, 'dropout_rate': 0.06556654912327296, 'prior_mu': -0.028535318539399127, 'prior_sigma': 0.08289993673439522, 'normalization': 'layer'}. Best is trial 896 with value: 0.4533553242683411.
Generating morgan_rdkit fingerprints...
Generated fingerprints with 1280 features for 841 molecules
Trial 1767: 5-fold CV loss = 0.4712
[I 2025-08-07 22:51:03,908] Trial 1767 finished with value: 0.4712004065513611 and parameters: {'fp_type': 'morgan_rdkit', 'combined_morgan_radius': 3, 'combined_morgan_nBits': 1024, 'combined_rdkit_maxPath': 6, 'combined_rdkit_nBits': 1024, 'num_hidden_layers': 3, 'hidden_dim_0': 256, 'hidden_dim_1': 1024, 'hidden_dim_2': 64, 'kl_weight': 0.00031161508406951085, 'lr': 0.008907999411247064, 'batch_size': 128, 'dropout_rate': 0.09355014576624968, 'prior_mu': -0.07487615152678297, 'prior_sigma': 0.0908437341800749, 'normalization': 'layer'}. Best is trial 896 with value: 0.4533553242683411.
Generating morgan_rdkit fingerprints...
Generated fingerprints with 1280 features for 841 molecules
Trial 1769: 5-fold CV loss = 0.5059
[I 2025-08-07 22:51:17,349] Trial 1769 finished with value: 0.5058875501155853 and parameters: {'fp_type': 'morgan_rdkit', 'combined_morgan_radius': 3, 'combined_morgan_nBits': 1024, 'combined_rdkit_maxPath': 6, 'combined_rdkit_nBits': 256, 'num_hidden_layers': 3, 'hidden_dim_0': 256, 'hidden_dim_1': 1024, 'hidden_dim_2': 64, 'kl_weight': 0.00033640967241502137, 'lr': 0.008117854099460246, 'batch_size': 128, 'dropout_rate': 0.0689885523575856, 'prior_mu': -0.029476335342848083, 'prior_sigma': 0.08042260494705225, 'normalization': 'layer'}. Best is trial 896 with value: 0.4533553242683411.
Generating morgan_rdkit fingerprints...
Generated fingerprints with 2048 features for 841 molecules
Trial 1770: 5-fold CV loss = 0.5015
[I 2025-08-07 22:51:23,024] Trial 1770 finished with value: 0.501545512676239 and parameters: {'fp_type': 'morgan_rdkit', 'combined_morgan_radius': 3, 'combined_morgan_nBits': 1024, 'combined_rdkit_maxPath': 6, 'combined_rdkit_nBits': 256, 'num_hidden_layers': 3, 'hidden_dim_0': 256, 'hidden_dim_1': 1024, 'hidden_dim_2': 64, 'kl_weight': 0.00031976602717011807, 'lr': 0.009898027697678781, 'batch_size': 128, 'dropout_rate': 0.09424752201890196, 'prior_mu': -0.033520573170906835, 'prior_sigma': 0.0795631125475924, 'normalization': 'layer'}. Best is trial 896 with value: 0.4533553242683411.
Generating morgan_rdkit fingerprints...
Generated fingerprints with 2048 features for 841 molecules
Trial 1771: 5-fold CV loss = 0.5870
[I 2025-08-07 22:51:37,690] Trial 1771 finished with value: 0.5870479762554168 and parameters: {'fp_type': 'morgan_rdkit', 'combined_morgan_radius': 3, 'combined_morgan_nBits': 1024, 'combined_rdkit_maxPath': 7, 'combined_rdkit_nBits': 256, 'num_hidden_layers': 3, 'hidden_dim_0': 256, 'hidden_dim_1': 1024, 'hidden_dim_2': 64, 'kl_weight': 0.0003926083387622646, 'lr': 0.00804740964395027, 'batch_size': 128, 'dropout_rate': 0.16811927508579055, 'prior_mu': -0.03528135688398722, 'prior_sigma': 0.07891824853380057, 'normalization': 'layer'}. Best is trial 896 with value: 0.4533553242683411.
Generating morgan_rdkit fingerprints...
Generated fingerprints with 2048 features for 841 molecules
Trial 1773: 5-fold CV loss = 0.4694
[I 2025-08-07 22:51:56,699] Trial 1773 finished with value: 0.469368988275528 and parameters: {'fp_type': 'morgan_rdkit', 'combined_morgan_radius': 3, 'combined_morgan_nBits': 1024, 'combined_rdkit_maxPath': 7, 'combined_rdkit_nBits': 1024, 'num_hidden_layers': 3, 'hidden_dim_0': 256, 'hidden_dim_1': 1024, 'hidden_dim_2': 64, 'kl_weight': 0.00039150926306006473, 'lr': 0.008051541789320986, 'batch_size': 128, 'dropout_rate': 0.17105125633083051, 'prior_mu': -0.03922646190253456, 'prior_sigma': 0.08634608313998955, 'normalization': 'layer'}. Best is trial 896 with value: 0.4533553242683411.
Generating morgan_rdkit fingerprints...
Generated fingerprints with 2048 features for 841 molecules
Trial 1766: 5-fold CV loss = 0.4652
[I 2025-08-07 22:51:59,283] Trial 1766 finished with value: 0.465226948261261 and parameters: {'fp_type': 'morgan_rdkit', 'combined_morgan_radius': 3, 'combined_morgan_nBits': 1024, 'combined_rdkit_maxPath': 7, 'combined_rdkit_nBits': 1024, 'num_hidden_layers': 3, 'hidden_dim_0': 256, 'hidden_dim_1': 1024, 'hidden_dim_2': 64, 'kl_weight': 0.00021844026760275764, 'lr': 0.008763437420802638, 'batch_size': 128, 'dropout_rate': 0.09324035928427765, 'prior_mu': -0.04855363890985146, 'prior_sigma': 0.0886953559675763, 'normalization': 'layer'}. Best is trial 896 with value: 0.4533553242683411.
Generating morgan_rdkit fingerprints...
Generated fingerprints with 2048 features for 841 molecules
Trial 1772: 5-fold CV loss = 0.4717
[I 2025-08-07 22:52:10,960] Trial 1772 finished with value: 0.47167489528656004 and parameters: {'fp_type': 'morgan_rdkit', 'combined_morgan_radius': 3, 'combined_morgan_nBits': 1024, 'combined_rdkit_maxPath': 7, 'combined_rdkit_nBits': 1024, 'num_hidden_layers': 3, 'hidden_dim_0': 256, 'hidden_dim_1': 1024, 'hidden_dim_2': 64, 'kl_weight': 0.00038242437322615167, 'lr': 0.008962052642863831, 'batch_size': 128, 'dropout_rate': 0.16787010889303597, 'prior_mu': -0.041185313034521456, 'prior_sigma': 0.08721601579314317, 'normalization': 'layer'}. Best is trial 896 with value: 0.4533553242683411.
Generating morgan_rdkit fingerprints...
Generated fingerprints with 2048 features for 841 molecules
Trial 1774: 5-fold CV loss = 0.6451
[I 2025-08-07 22:52:21,412] Trial 1774 finished with value: 0.6450922310352325 and parameters: {'fp_type': 'morgan_rdkit', 'combined_morgan_radius': 3, 'combined_morgan_nBits': 1024, 'combined_rdkit_maxPath': 7, 'combined_rdkit_nBits': 1024, 'num_hidden_layers': 3, 'hidden_dim_0': 256, 'hidden_dim_1': 1024, 'hidden_dim_2': 64, 'kl_weight': 0.00022276323380392366, 'lr': 0.008754340842206672, 'batch_size': 128, 'dropout_rate': 0.151228042538363, 'prior_mu': -0.04010465927685654, 'prior_sigma': 0.194555033983843, 'normalization': 'layer'}. Best is trial 896 with value: 0.4533553242683411.
Generating morgan fingerprints...
Generated fingerprints with 1024 features for 841 molecules
Trial 1775: 5-fold CV loss = 0.4724
[I 2025-08-07 22:52:31,687] Trial 1775 finished with value: 0.4724239110946655 and parameters: {'fp_type': 'morgan_rdkit', 'combined_morgan_radius': 3, 'combined_morgan_nBits': 1024, 'combined_rdkit_maxPath': 7, 'combined_rdkit_nBits': 1024, 'num_hidden_layers': 3, 'hidden_dim_0': 256, 'hidden_dim_1': 1024, 'hidden_dim_2': 64, 'kl_weight': 0.00023437690494114414, 'lr': 0.008918706610838446, 'batch_size': 128, 'dropout_rate': 0.1507745351178157, 'prior_mu': -0.02773999538881463, 'prior_sigma': 0.08577505951639276, 'normalization': 'layer'}. Best is trial 896 with value: 0.4533553242683411.
Generating morgan_rdkit fingerprints...
Generated fingerprints with 2048 features for 841 molecules
Trial 1778: 5-fold CV loss = 0.5294
[I 2025-08-07 22:52:49,736] Trial 1778 finished with value: 0.529431015253067 and parameters: {'fp_type': 'morgan', 'morgan_only_radius': 2, 'morgan_only_nBits': 1024, 'num_hidden_layers': 3, 'hidden_dim_0': 256, 'hidden_dim_1': 1024, 'hidden_dim_2': 256, 'kl_weight': 0.0003283702612861161, 'lr': 0.006023414502687841, 'batch_size': 128, 'dropout_rate': 0.08074115351509578, 'prior_mu': -0.02694618991582296, 'prior_sigma': 0.07595632987088949, 'normalization': 'layer'}. Best is trial 896 with value: 0.4533553242683411.
Generating morgan_rdkit fingerprints...
Generated fingerprints with 2048 features for 841 molecules
Trial 1779: 5-fold CV loss = 0.4680
[I 2025-08-07 22:53:08,142] Trial 1779 finished with value: 0.4679774582386017 and parameters: {'fp_type': 'morgan_rdkit', 'combined_morgan_radius': 3, 'combined_morgan_nBits': 1024, 'combined_rdkit_maxPath': 7, 'combined_rdkit_nBits': 1024, 'num_hidden_layers': 3, 'hidden_dim_0': 256, 'hidden_dim_1': 1024, 'hidden_dim_2': 64, 'kl_weight': 0.00032812612154793126, 'lr': 0.006142930435471376, 'batch_size': 128, 'dropout_rate': 0.08258451465377546, 'prior_mu': -0.026171441195165047, 'prior_sigma': 0.07665920186113967, 'normalization': 'layer'}. Best is trial 896 with value: 0.4533553242683411.
Generating morgan_rdkit fingerprints...
Generated fingerprints with 2048 features for 841 molecules
Trial 1777: 5-fold CV loss = 0.4674
[I 2025-08-07 22:53:21,649] Trial 1777 finished with value: 0.4673625290393829 and parameters: {'fp_type': 'morgan_rdkit', 'combined_morgan_radius': 3, 'combined_morgan_nBits': 1024, 'combined_rdkit_maxPath': 7, 'combined_rdkit_nBits': 1024, 'num_hidden_layers': 3, 'hidden_dim_0': 256, 'hidden_dim_1': 1024, 'hidden_dim_2': 256, 'kl_weight': 0.00025780318409571575, 'lr': 0.006096551561385862, 'batch_size': 128, 'dropout_rate': 0.1240934443294996, 'prior_mu': -0.02589382935011844, 'prior_sigma': 0.07631423695009507, 'normalization': 'layer'}. Best is trial 896 with value: 0.4533553242683411.
Generating morgan_rdkit fingerprints...
Generated fingerprints with 2048 features for 841 molecules
Trial 1776: 5-fold CV loss = 0.4622
[I 2025-08-07 22:53:26,168] Trial 1776 finished with value: 0.462178099155426 and parameters: {'fp_type': 'morgan_rdkit', 'combined_morgan_radius': 3, 'combined_morgan_nBits': 1024, 'combined_rdkit_maxPath': 7, 'combined_rdkit_nBits': 1024, 'num_hidden_layers': 3, 'hidden_dim_0': 256, 'hidden_dim_1': 1024, 'hidden_dim_2': 64, 'kl_weight': 0.0003610678666349432, 'lr': 0.0098622542309771, 'batch_size': 128, 'dropout_rate': 0.08013344493087209, 'prior_mu': -0.026704544703920637, 'prior_sigma': 0.08297025229549723, 'normalization': 'layer'}. Best is trial 896 with value: 0.4533553242683411.
Generating morgan_rdkit fingerprints...
Generated fingerprints with 2048 features for 841 molecules
Trial 1780: 5-fold CV loss = 0.4800
[I 2025-08-07 22:53:40,962] Trial 1780 finished with value: 0.47999379634857176 and parameters: {'fp_type': 'morgan_rdkit', 'combined_morgan_radius': 3, 'combined_morgan_nBits': 1024, 'combined_rdkit_maxPath': 8, 'combined_rdkit_nBits': 1024, 'num_hidden_layers': 3, 'hidden_dim_0': 256, 'hidden_dim_1': 1024, 'hidden_dim_2': 64, 'kl_weight': 0.00040951330936220173, 'lr': 0.007318988256287357, 'batch_size': 128, 'dropout_rate': 0.11814913937247978, 'prior_mu': -0.025303833801330437, 'prior_sigma': 0.08265669124333914, 'normalization': 'layer'}. Best is trial 896 with value: 0.4533553242683411.
Generating morgan_rdkit fingerprints...
Generated fingerprints with 2048 features for 841 molecules
Trial 1781: 5-fold CV loss = 0.4818
[I 2025-08-07 22:53:47,503] Trial 1781 finished with value: 0.48181429505348206 and parameters: {'fp_type': 'morgan_rdkit', 'combined_morgan_radius': 3, 'combined_morgan_nBits': 1024, 'combined_rdkit_maxPath': 8, 'combined_rdkit_nBits': 1024, 'num_hidden_layers': 3, 'hidden_dim_0': 256, 'hidden_dim_1': 1024, 'hidden_dim_2': 64, 'kl_weight': 0.0036874739252412284, 'lr': 0.007840897667658001, 'batch_size': 128, 'dropout_rate': 0.1223968304235123, 'prior_mu': -0.06433106148952417, 'prior_sigma': 0.08166673877713423, 'normalization': 'layer'}. Best is trial 896 with value: 0.4533553242683411.
Generating morgan_rdkit fingerprints...
Generated fingerprints with 2048 features for 841 molecules
Trial 1783: 5-fold CV loss = 0.8525
[I 2025-08-07 22:54:11,812] Trial 1783 finished with value: 0.8525386333465577 and parameters: {'fp_type': 'morgan_rdkit', 'combined_morgan_radius': 3, 'combined_morgan_nBits': 1024, 'combined_rdkit_maxPath': 7, 'combined_rdkit_nBits': 1024, 'num_hidden_layers': 3, 'hidden_dim_0': 256, 'hidden_dim_1': 1024, 'hidden_dim_2': 64, 'kl_weight': 0.00040850185605866056, 'lr': 0.00021310324242949073, 'batch_size': 128, 'dropout_rate': 0.10120483971549146, 'prior_mu': -0.06102233416376708, 'prior_sigma': 0.07180846663498008, 'normalization': 'none'}. Best is trial 896 with value: 0.4533553242683411.
Generating morgan_rdkit fingerprints...
Generated fingerprints with 2048 features for 841 molecules
Trial 1784: 5-fold CV loss = 0.6535
[I 2025-08-07 22:54:18,086] Trial 1784 finished with value: 0.6534875452518463 and parameters: {'fp_type': 'morgan_rdkit', 'combined_morgan_radius': 3, 'combined_morgan_nBits': 1024, 'combined_rdkit_maxPath': 7, 'combined_rdkit_nBits': 1024, 'num_hidden_layers': 3, 'hidden_dim_0': 256, 'hidden_dim_1': 1024, 'hidden_dim_2': 64, 'kl_weight': 0.0002951593628210635, 'lr': 0.007878188338467691, 'batch_size': 128, 'dropout_rate': 0.10676898157597421, 'prior_mu': -0.06480508232369193, 'prior_sigma': 0.0881225460723734, 'normalization': 'none'}. Best is trial 896 with value: 0.4533553242683411.
Generating morgan_rdkit fingerprints...
Generated fingerprints with 2048 features for 841 molecules
Trial 1782: 5-fold CV loss = 0.5482
[I 2025-08-07 22:54:19,927] Trial 1782 finished with value: 0.5481947004795075 and parameters: {'fp_type': 'morgan_rdkit', 'combined_morgan_radius': 3, 'combined_morgan_nBits': 1024, 'combined_rdkit_maxPath': 8, 'combined_rdkit_nBits': 1024, 'num_hidden_layers': 3, 'hidden_dim_0': 256, 'hidden_dim_1': 1024, 'hidden_dim_2': 64, 'kl_weight': 0.0004056912373835367, 'lr': 0.009872728009696267, 'batch_size': 128, 'dropout_rate': 0.18620342866717468, 'prior_mu': -0.03640507871552755, 'prior_sigma': 0.08294983054049221, 'normalization': 'layer'}. Best is trial 896 with value: 0.4533553242683411.
Generating morgan_rdkit fingerprints...
Generated fingerprints with 2048 features for 841 molecules
Trial 1785: 5-fold CV loss = 0.5554
