[I 2025-08-07 23:40:17,416] Trial 2025 finished with value: 0.6008461534976959 and parameters: {'fp_type': 'morgan_rdkit', 'combined_morgan_radius': 3, 'combined_morgan_nBits': 1024, 'combined_rdkit_maxPath': 7, 'combined_rdkit_nBits': 1024, 'num_hidden_layers': 3, 'hidden_dim_0': 256, 'hidden_dim_1': 128, 'hidden_dim_2': 64, 'kl_weight': 0.00019857045214421784, 'lr': 0.00749429167318329, 'batch_size': 128, 'dropout_rate': 0.11983914529158689, 'prior_mu': -0.0330939223901937, 'prior_sigma': 0.11656159343478785, 'normalization': 'none'}. Best is trial 896 with value: 0.4533553242683411.
Generating morgan_rdkit fingerprints...
Generated fingerprints with 2048 features for 841 molecules
Trial 2026: 5-fold CV loss = 0.6858
[I 2025-08-07 23:40:39,452] Trial 2026 finished with value: 0.6858217775821686 and parameters: {'fp_type': 'rdkit', 'rdkit_only_maxPath': 6, 'rdkit_only_nBits': 1024, 'num_hidden_layers': 3, 'hidden_dim_0': 256, 'hidden_dim_1': 1024, 'hidden_dim_2': 64, 'kl_weight': 0.0003882803358684173, 'lr': 0.009038260401226454, 'batch_size': 128, 'dropout_rate': 0.15812471284353294, 'prior_mu': -0.035545323916480645, 'prior_sigma': 0.1231312744125126, 'normalization': 'none'}. Best is trial 896 with value: 0.4533553242683411.
Generating morgan_rdkit fingerprints...
Generated fingerprints with 2048 features for 841 molecules
Trial 2023: 5-fold CV loss = 0.4914
[I 2025-08-07 23:40:44,982] Trial 2023 finished with value: 0.49137812852859497 and parameters: {'fp_type': 'morgan_rdkit', 'combined_morgan_radius': 3, 'combined_morgan_nBits': 1024, 'combined_rdkit_maxPath': 5, 'combined_rdkit_nBits': 1024, 'num_hidden_layers': 3, 'hidden_dim_0': 256, 'hidden_dim_1': 128, 'hidden_dim_2': 64, 'kl_weight': 0.00022043350707123398, 'lr': 0.009068875239752907, 'batch_size': 64, 'dropout_rate': 0.19506595041018746, 'prior_mu': 0.014874458382538515, 'prior_sigma': 0.0987675826281168, 'normalization': 'layer'}. Best is trial 896 with value: 0.4533553242683411.
Generating morgan_rdkit fingerprints...
Generated fingerprints with 2048 features for 841 molecules
Trial 2028: 5-fold CV loss = 0.4614
[I 2025-08-07 23:40:49,321] Trial 2028 finished with value: 0.46143198013305664 and parameters: {'fp_type': 'morgan_rdkit', 'combined_morgan_radius': 3, 'combined_morgan_nBits': 1024, 'combined_rdkit_maxPath': 7, 'combined_rdkit_nBits': 1024, 'num_hidden_layers': 3, 'hidden_dim_0': 256, 'hidden_dim_1': 256, 'hidden_dim_2': 64, 'kl_weight': 0.00035309907968604905, 'lr': 0.005914423814135534, 'batch_size': 128, 'dropout_rate': 0.11960913141173636, 'prior_mu': 0.00034144899839496566, 'prior_sigma': 0.06939447705364411, 'normalization': 'layer'}. Best is trial 896 with value: 0.4533553242683411.
Generating morgan_rdkit fingerprints...
Generated fingerprints with 2048 features for 841 molecules
Trial 2029: 5-fold CV loss = 0.4689
[I 2025-08-07 23:40:58,437] Trial 2029 finished with value: 0.46893664002418517 and parameters: {'fp_type': 'morgan_rdkit', 'combined_morgan_radius': 3, 'combined_morgan_nBits': 1024, 'combined_rdkit_maxPath': 7, 'combined_rdkit_nBits': 1024, 'num_hidden_layers': 3, 'hidden_dim_0': 256, 'hidden_dim_1': 1024, 'hidden_dim_2': 64, 'kl_weight': 0.00026252289637703857, 'lr': 0.006020872262398894, 'batch_size': 128, 'dropout_rate': 0.11661474185161463, 'prior_mu': -0.01850341027264094, 'prior_sigma': 0.06903442245231589, 'normalization': 'layer'}. Best is trial 896 with value: 0.4533553242683411.
Generating morgan_rdkit fingerprints...
Generated fingerprints with 2048 features for 841 molecules
Trial 2032: 5-fold CV loss = 0.4877
[I 2025-08-07 23:41:20,702] Trial 2032 finished with value: 0.4876819133758545 and parameters: {'fp_type': 'morgan_rdkit', 'combined_morgan_radius': 3, 'combined_morgan_nBits': 1024, 'combined_rdkit_maxPath': 6, 'combined_rdkit_nBits': 1024, 'num_hidden_layers': 3, 'hidden_dim_0': 256, 'hidden_dim_1': 1024, 'hidden_dim_2': 128, 'kl_weight': 0.009912923650834416, 'lr': 0.0066925719160598075, 'batch_size': 128, 'dropout_rate': 0.15341137442013195, 'prior_mu': -0.02382900616196157, 'prior_sigma': 0.07868408487532975, 'normalization': 'layer'}. Best is trial 896 with value: 0.4533553242683411.
Generating morgan_rdkit fingerprints...
Generated fingerprints with 2048 features for 841 molecules
Trial 2030: 5-fold CV loss = 0.5595
[I 2025-08-07 23:41:30,996] Trial 2030 finished with value: 0.5595147609710693 and parameters: {'fp_type': 'morgan_rdkit', 'combined_morgan_radius': 3, 'combined_morgan_nBits': 1024, 'combined_rdkit_maxPath': 7, 'combined_rdkit_nBits': 1024, 'num_hidden_layers': 3, 'hidden_dim_0': 256, 'hidden_dim_1': 256, 'hidden_dim_2': 64, 'kl_weight': 0.00027903115551068566, 'lr': 0.006002074142401588, 'batch_size': 128, 'dropout_rate': 0.19416220504961662, 'prior_mu': 0.002524707735550082, 'prior_sigma': 0.06972454637545375, 'normalization': 'layer'}. Best is trial 896 with value: 0.4533553242683411.
Generating morgan_rdkit fingerprints...
Generated fingerprints with 2048 features for 841 molecules
Trial 2033: 5-fold CV loss = 0.4689
[I 2025-08-07 23:41:40,172] Trial 2033 finished with value: 0.4688552916049957 and parameters: {'fp_type': 'morgan_rdkit', 'combined_morgan_radius': 3, 'combined_morgan_nBits': 1024, 'combined_rdkit_maxPath': 7, 'combined_rdkit_nBits': 1024, 'num_hidden_layers': 3, 'hidden_dim_0': 256, 'hidden_dim_1': 1024, 'hidden_dim_2': 64, 'kl_weight': 0.0002881976610702885, 'lr': 0.0068976316875539985, 'batch_size': 128, 'dropout_rate': 0.18331562819901112, 'prior_mu': -0.025892828745148797, 'prior_sigma': 0.0786152963593136, 'normalization': 'layer'}. Best is trial 896 with value: 0.4533553242683411.
Generating morgan_rdkit fingerprints...
Generated fingerprints with 1536 features for 841 molecules
Trial 2035: 5-fold CV loss = 0.8672
[I 2025-08-07 23:42:00,953] Trial 2035 finished with value: 0.8671510577201843 and parameters: {'fp_type': 'morgan_rdkit', 'combined_morgan_radius': 3, 'combined_morgan_nBits': 1024, 'combined_rdkit_maxPath': 7, 'combined_rdkit_nBits': 1024, 'num_hidden_layers': 3, 'hidden_dim_0': 512, 'hidden_dim_1': 1024, 'hidden_dim_2': 64, 'kl_weight': 0.0004138574216710425, 'lr': 0.0003122894314044941, 'batch_size': 128, 'dropout_rate': 0.016976772799503492, 'prior_mu': -0.04442549685692065, 'prior_sigma': 0.08063788934889884, 'normalization': 'layer'}. Best is trial 896 with value: 0.4533553242683411.
Generating morgan_rdkit fingerprints...
Generated fingerprints with 1536 features for 841 molecules
Trial 2034: 5-fold CV loss = 0.4641
[I 2025-08-07 23:42:04,421] Trial 2034 finished with value: 0.4641004025936127 and parameters: {'fp_type': 'morgan_rdkit', 'combined_morgan_radius': 3, 'combined_morgan_nBits': 1024, 'combined_rdkit_maxPath': 7, 'combined_rdkit_nBits': 1024, 'num_hidden_layers': 3, 'hidden_dim_0': 512, 'hidden_dim_1': 1024, 'hidden_dim_2': 64, 'kl_weight': 0.0002856558019323801, 'lr': 0.004927669995499396, 'batch_size': 128, 'dropout_rate': 0.38685296933851254, 'prior_mu': -0.04470413566715501, 'prior_sigma': 0.0863117946215128, 'normalization': 'layer'}. Best is trial 896 with value: 0.4533553242683411.
Generating morgan_rdkit fingerprints...
Generated fingerprints with 2048 features for 841 molecules
Trial 2036: 5-fold CV loss = 0.4643
[I 2025-08-07 23:42:31,528] Trial 2036 finished with value: 0.4642843842506409 and parameters: {'fp_type': 'morgan_rdkit', 'combined_morgan_radius': 3, 'combined_morgan_nBits': 512, 'combined_rdkit_maxPath': 7, 'combined_rdkit_nBits': 1024, 'num_hidden_layers': 3, 'hidden_dim_0': 512, 'hidden_dim_1': 1024, 'hidden_dim_2': 64, 'kl_weight': 0.000349798833848848, 'lr': 0.004789564804559517, 'batch_size': 128, 'dropout_rate': 0.12958365983100573, 'prior_mu': -0.04492366677168016, 'prior_sigma': 0.08690647468899364, 'normalization': 'layer'}. Best is trial 896 with value: 0.4533553242683411.
Generating morgan_rdkit fingerprints...
Generated fingerprints with 2048 features for 841 molecules
Trial 2037: 5-fold CV loss = 0.7959
[I 2025-08-07 23:42:33,062] Trial 2037 finished with value: 0.7959018647670746 and parameters: {'fp_type': 'morgan_rdkit', 'combined_morgan_radius': 3, 'combined_morgan_nBits': 512, 'combined_rdkit_maxPath': 7, 'combined_rdkit_nBits': 1024, 'num_hidden_layers': 3, 'hidden_dim_0': 256, 'hidden_dim_1': 1024, 'hidden_dim_2': 64, 'kl_weight': 0.0003389462640373997, 'lr': 0.0048762731488126545, 'batch_size': 128, 'dropout_rate': 0.12851220532995883, 'prior_mu': -0.009767409728485402, 'prior_sigma': 0.16449921211805377, 'normalization': 'layer'}. Best is trial 896 with value: 0.4533553242683411.
Generating morgan_rdkit fingerprints...
Generated fingerprints with 2048 features for 841 molecules
Trial 2031: 5-fold CV loss = 0.4698
[I 2025-08-07 23:42:36,169] Trial 2031 finished with value: 0.4697524726390839 and parameters: {'fp_type': 'morgan_rdkit', 'combined_morgan_radius': 3, 'combined_morgan_nBits': 1024, 'combined_rdkit_maxPath': 7, 'combined_rdkit_nBits': 1024, 'num_hidden_layers': 3, 'hidden_dim_0': 256, 'hidden_dim_1': 256, 'hidden_dim_2': 128, 'kl_weight': 0.004016648737892165, 'lr': 0.005905959753585851, 'batch_size': 128, 'dropout_rate': 0.11518483828688347, 'prior_mu': 0.004582590430587592, 'prior_sigma': 0.07008243439408916, 'normalization': 'layer'}. Best is trial 896 with value: 0.4533553242683411.
Generating morgan_rdkit fingerprints...
Generated fingerprints with 2048 features for 841 molecules
Trial 2038: 5-fold CV loss = 0.4595
[I 2025-08-07 23:42:41,490] Trial 2038 finished with value: 0.4595206081867218 and parameters: {'fp_type': 'morgan_rdkit', 'combined_morgan_radius': 3, 'combined_morgan_nBits': 1024, 'combined_rdkit_maxPath': 7, 'combined_rdkit_nBits': 1024, 'num_hidden_layers': 3, 'hidden_dim_0': 256, 'hidden_dim_1': 512, 'hidden_dim_2': 64, 'kl_weight': 0.0003411241976546107, 'lr': 0.007854803281158245, 'batch_size': 128, 'dropout_rate': 0.12954400454717524, 'prior_mu': -0.00556119616705111, 'prior_sigma': 0.07293677587810696, 'normalization': 'layer'}. Best is trial 896 with value: 0.4533553242683411.
Generating morgan_rdkit fingerprints...
Generated fingerprints with 2048 features for 841 molecules
Trial 2039: 5-fold CV loss = 0.7187
[I 2025-08-07 23:43:07,308] Trial 2039 finished with value: 0.7187411785125732 and parameters: {'fp_type': 'morgan_rdkit', 'combined_morgan_radius': 3, 'combined_morgan_nBits': 1024, 'combined_rdkit_maxPath': 7, 'combined_rdkit_nBits': 1024, 'num_hidden_layers': 3, 'hidden_dim_0': 256, 'hidden_dim_1': 1024, 'hidden_dim_2': 256, 'kl_weight': 0.0001718943191825295, 'lr': 0.008277937737844198, 'batch_size': 128, 'dropout_rate': 0.14464190854809544, 'prior_mu': 0.008174949475052656, 'prior_sigma': 0.10431416273150246, 'normalization': 'layer'}. Best is trial 896 with value: 0.4533553242683411.
Generating morgan_rdkit fingerprints...
Generated fingerprints with 2048 features for 841 molecules
Trial 2042: 5-fold CV loss = 0.5419
[I 2025-08-07 23:43:15,817] Trial 2042 finished with value: 0.5419060826301575 and parameters: {'fp_type': 'morgan_rdkit', 'combined_morgan_radius': 3, 'combined_morgan_nBits': 1024, 'combined_rdkit_maxPath': 8, 'combined_rdkit_nBits': 1024, 'num_hidden_layers': 3, 'hidden_dim_0': 1024, 'hidden_dim_1': 1024, 'hidden_dim_2': 64, 'kl_weight': 0.00040259825938369426, 'lr': 0.009923136282604703, 'batch_size': 128, 'dropout_rate': 0.1422146874590899, 'prior_mu': -0.016846529278657336, 'prior_sigma': 0.10381879333200764, 'normalization': 'layer'}. Best is trial 896 with value: 0.4533553242683411.
Generating morgan_rdkit fingerprints...
Generated fingerprints with 2048 features for 841 molecules
Trial 2040: 5-fold CV loss = 0.4758
[I 2025-08-07 23:43:31,209] Trial 2040 finished with value: 0.47581673264503477 and parameters: {'fp_type': 'morgan_rdkit', 'combined_morgan_radius': 3, 'combined_morgan_nBits': 1024, 'combined_rdkit_maxPath': 7, 'combined_rdkit_nBits': 1024, 'num_hidden_layers': 3, 'hidden_dim_0': 256, 'hidden_dim_1': 1024, 'hidden_dim_2': 256, 'kl_weight': 0.00024948074621484426, 'lr': 0.009934728497695286, 'batch_size': 128, 'dropout_rate': 0.14166974058954512, 'prior_mu': -0.014017124816547008, 'prior_sigma': 0.07311542970562065, 'normalization': 'layer'}. Best is trial 896 with value: 0.4533553242683411.
Generating morgan_rdkit fingerprints...
Generated fingerprints with 2048 features for 841 molecules
Trial 2044: 5-fold CV loss = 0.8695
[I 2025-08-07 23:43:37,432] Trial 2044 finished with value: 0.8694929242134094 and parameters: {'fp_type': 'morgan_rdkit', 'combined_morgan_radius': 3, 'combined_morgan_nBits': 1024, 'combined_rdkit_maxPath': 7, 'combined_rdkit_nBits': 1024, 'num_hidden_layers': 3, 'hidden_dim_0': 256, 'hidden_dim_1': 1024, 'hidden_dim_2': 64, 'kl_weight': 0.000250447903989926, 'lr': 0.0007074633358706148, 'batch_size': 128, 'dropout_rate': 0.16570117934623294, 'prior_mu': -0.032814595484121786, 'prior_sigma': 0.09074591822949057, 'normalization': 'layer'}. Best is trial 896 with value: 0.4533553242683411.
Generating morgan_rdkit fingerprints...
Generated fingerprints with 2048 features for 841 molecules
Trial 2046: 5-fold CV loss = 0.8837
[I 2025-08-07 23:43:53,175] Trial 2046 finished with value: 0.8837247729301453 and parameters: {'fp_type': 'morgan_rdkit', 'combined_morgan_radius': 3, 'combined_morgan_nBits': 1024, 'combined_rdkit_maxPath': 7, 'combined_rdkit_nBits': 1024, 'num_hidden_layers': 3, 'hidden_dim_0': 256, 'hidden_dim_1': 1024, 'hidden_dim_2': 64, 'kl_weight': 0.000312980538778733, 'lr': 0.0009621193718939798, 'batch_size': 128, 'dropout_rate': 0.17541857337123123, 'prior_mu': -0.024770129236051736, 'prior_sigma': 0.09620718161479948, 'normalization': 'layer'}. Best is trial 896 with value: 0.4533553242683411.
Generating morgan_rdkit fingerprints...
Generated fingerprints with 2048 features for 841 molecules
Trial 2043: 5-fold CV loss = 0.5652
[I 2025-08-07 23:44:01,454] Trial 2043 finished with value: 0.5652102291584015 and parameters: {'fp_type': 'morgan_rdkit', 'combined_morgan_radius': 3, 'combined_morgan_nBits': 1024, 'combined_rdkit_maxPath': 8, 'combined_rdkit_nBits': 1024, 'num_hidden_layers': 3, 'hidden_dim_0': 1024, 'hidden_dim_1': 1024, 'hidden_dim_2': 64, 'kl_weight': 0.0002484047840769192, 'lr': 0.005388057521490524, 'batch_size': 128, 'dropout_rate': 0.164655947744391, 'prior_mu': -0.017758861815924933, 'prior_sigma': 0.09246382602330012, 'normalization': 'layer'}. Best is trial 896 with value: 0.4533553242683411.
Generating morgan_rdkit fingerprints...
Generated fingerprints with 2048 features for 841 molecules
Trial 2041: 5-fold CV loss = 0.4649
[I 2025-08-07 23:44:19,321] Trial 2041 finished with value: 0.46486170291900636 and parameters: {'fp_type': 'morgan_rdkit', 'combined_morgan_radius': 3, 'combined_morgan_nBits': 1024, 'combined_rdkit_maxPath': 7, 'combined_rdkit_nBits': 1024, 'num_hidden_layers': 3, 'hidden_dim_0': 256, 'hidden_dim_1': 512, 'hidden_dim_2': 64, 'kl_weight': 0.00016560356056398166, 'lr': 0.008571043100347722, 'batch_size': 128, 'dropout_rate': 0.16462027022581283, 'prior_mu': -0.014070634989236476, 'prior_sigma': 0.09089282839338649, 'normalization': 'layer'}. Best is trial 896 with value: 0.4533553242683411.
Generating morgan_rdkit fingerprints...
Generated fingerprints with 2048 features for 841 molecules
Trial 2045: 5-fold CV loss = 0.4675
[I 2025-08-07 23:44:32,722] Trial 2045 finished with value: 0.46748959422111513 and parameters: {'fp_type': 'morgan_rdkit', 'combined_morgan_radius': 3, 'combined_morgan_nBits': 1024, 'combined_rdkit_maxPath': 7, 'combined_rdkit_nBits': 1024, 'num_hidden_layers': 3, 'hidden_dim_0': 256, 'hidden_dim_1': 1024, 'hidden_dim_2': 64, 'kl_weight': 0.00025011383727966844, 'lr': 0.005451347911991664, 'batch_size': 128, 'dropout_rate': 0.1654026988252747, 'prior_mu': -0.032117164881760474, 'prior_sigma': 0.09163308427937718, 'normalization': 'layer'}. Best is trial 896 with value: 0.4533553242683411.
Generating morgan_rdkit fingerprints...
Generated fingerprints with 2048 features for 841 molecules
Trial 2047: 5-fold CV loss = 0.4611
[I 2025-08-07 23:44:34,617] Trial 2047 finished with value: 0.46110092401504515 and parameters: {'fp_type': 'morgan_rdkit', 'combined_morgan_radius': 3, 'combined_morgan_nBits': 1024, 'combined_rdkit_maxPath': 7, 'combined_rdkit_nBits': 1024, 'num_hidden_layers': 3, 'hidden_dim_0': 256, 'hidden_dim_1': 1024, 'hidden_dim_2': 64, 'kl_weight': 0.0004071653211426335, 'lr': 0.0055119722781871595, 'batch_size': 128, 'dropout_rate': 0.10576753069381467, 'prior_mu': -0.036970919641539444, 'prior_sigma': 0.08385681008781619, 'normalization': 'layer'}. Best is trial 896 with value: 0.4533553242683411.
Generating morgan_rdkit fingerprints...
Generated fingerprints with 2048 features for 841 molecules
Trial 2051: 5-fold CV loss = 0.8831
[I 2025-08-07 23:44:43,624] Trial 2051 finished with value: 0.8830511808395386 and parameters: {'fp_type': 'morgan_rdkit', 'combined_morgan_radius': 3, 'combined_morgan_nBits': 1024, 'combined_rdkit_maxPath': 7, 'combined_rdkit_nBits': 1024, 'num_hidden_layers': 3, 'hidden_dim_0': 128, 'hidden_dim_1': 1024, 'hidden_dim_2': 512, 'kl_weight': 0.0003409715702737361, 'lr': 0.007088444744288412, 'batch_size': 128, 'dropout_rate': 0.15367515919587302, 'prior_mu': -0.025006688513503694, 'prior_sigma': 0.08139902900465015, 'normalization': 'layer'}. Best is trial 896 with value: 0.4533553242683411.
Generating morgan_rdkit fingerprints...
Generated fingerprints with 2048 features for 841 molecules
Trial 2048: 5-fold CV loss = 0.4609
[I 2025-08-07 23:44:46,036] Trial 2048 finished with value: 0.4608851790428162 and parameters: {'fp_type': 'morgan_rdkit', 'combined_morgan_radius': 3, 'combined_morgan_nBits': 1024, 'combined_rdkit_maxPath': 7, 'combined_rdkit_nBits': 1024, 'num_hidden_layers': 3, 'hidden_dim_0': 256, 'hidden_dim_1': 1024, 'hidden_dim_2': 64, 'kl_weight': 0.00039875910214089806, 'lr': 0.00711111690231751, 'batch_size': 128, 'dropout_rate': 0.10638352053560787, 'prior_mu': -0.03730278844843736, 'prior_sigma': 0.08232132304345438, 'normalization': 'layer'}. Best is trial 896 with value: 0.4533553242683411.
Generating morgan_rdkit fingerprints...
Generated fingerprints with 2048 features for 841 molecules
Trial 2052: 5-fold CV loss = 0.4624
[I 2025-08-07 23:45:20,459] Trial 2052 finished with value: 0.46237273812294005 and parameters: {'fp_type': 'morgan_rdkit', 'combined_morgan_radius': 3, 'combined_morgan_nBits': 1024, 'combined_rdkit_maxPath': 7, 'combined_rdkit_nBits': 1024, 'num_hidden_layers': 3, 'hidden_dim_0': 256, 'hidden_dim_1': 1024, 'hidden_dim_2': 64, 'kl_weight': 0.0002980751074290958, 'lr': 0.0067579862100676435, 'batch_size': 128, 'dropout_rate': 0.09816615018266944, 'prior_mu': 0.028477711986480126, 'prior_sigma': 0.0761483941008256, 'normalization': 'layer'}. Best is trial 896 with value: 0.4533553242683411.
Generating morgan_rdkit fingerprints...
Generated fingerprints with 2048 features for 841 molecules
Trial 2053: 5-fold CV loss = 0.4677
[I 2025-08-07 23:45:26,934] Trial 2053 finished with value: 0.4677159309387207 and parameters: {'fp_type': 'morgan_rdkit', 'combined_morgan_radius': 3, 'combined_morgan_nBits': 1024, 'combined_rdkit_maxPath': 7, 'combined_rdkit_nBits': 1024, 'num_hidden_layers': 3, 'hidden_dim_0': 256, 'hidden_dim_1': 1024, 'hidden_dim_2': 64, 'kl_weight': 0.0002994387009022521, 'lr': 0.0077867239285025775, 'batch_size': 128, 'dropout_rate': 0.09768245332262815, 'prior_mu': -0.005339309882941663, 'prior_sigma': 0.0755785067057961, 'normalization': 'layer'}. Best is trial 896 with value: 0.4533553242683411.
Generating morgan_rdkit fingerprints...
Generated fingerprints with 2048 features for 841 molecules
Trial 2049: 5-fold CV loss = 0.6795
[I 2025-08-07 23:45:37,107] Trial 2049 finished with value: 0.6794889807701111 and parameters: {'fp_type': 'morgan_rdkit', 'combined_morgan_radius': 3, 'combined_morgan_nBits': 1024, 'combined_rdkit_maxPath': 7, 'combined_rdkit_nBits': 1024, 'num_hidden_layers': 3, 'hidden_dim_0': 128, 'hidden_dim_1': 1024, 'hidden_dim_2': 512, 'kl_weight': 0.000383606019151491, 'lr': 0.0037422782697130916, 'batch_size': 128, 'dropout_rate': 0.037985881555812194, 'prior_mu': -0.036439100776254445, 'prior_sigma': 0.0838789967246546, 'normalization': 'layer'}. Best is trial 896 with value: 0.4533553242683411.
Generating morgan_rdkit fingerprints...
Generated fingerprints with 2048 features for 841 molecules
Trial 2050: 5-fold CV loss = 0.6591
[I 2025-08-07 23:45:40,877] Trial 2050 finished with value: 0.6591402232646942 and parameters: {'fp_type': 'morgan_rdkit', 'combined_morgan_radius': 3, 'combined_morgan_nBits': 1024, 'combined_rdkit_maxPath': 7, 'combined_rdkit_nBits': 1024, 'num_hidden_layers': 3, 'hidden_dim_0': 256, 'hidden_dim_1': 1024, 'hidden_dim_2': 512, 'kl_weight': 0.0003935173860697987, 'lr': 0.0035140709007348983, 'batch_size': 128, 'dropout_rate': 0.09973517497565168, 'prior_mu': -0.03842364710636548, 'prior_sigma': 0.08375555441519662, 'normalization': 'layer'}. Best is trial 896 with value: 0.4533553242683411.
Generating morgan_rdkit fingerprints...
Generated fingerprints with 2048 features for 841 molecules
Trial 2054: 5-fold CV loss = 0.4649
[I 2025-08-07 23:46:01,952] Trial 2054 finished with value: 0.46490066647529604 and parameters: {'fp_type': 'morgan_rdkit', 'combined_morgan_radius': 3, 'combined_morgan_nBits': 1024, 'combined_rdkit_maxPath': 7, 'combined_rdkit_nBits': 1024, 'num_hidden_layers': 3, 'hidden_dim_0': 256, 'hidden_dim_1': 1024, 'hidden_dim_2': 64, 'kl_weight': 0.0003590551227220637, 'lr': 0.008046262711139014, 'batch_size': 128, 'dropout_rate': 0.11719469260044924, 'prior_mu': -0.0032115949174852283, 'prior_sigma': 0.10076387076225075, 'normalization': 'layer'}. Best is trial 896 with value: 0.4533553242683411.
Generating morgan_rdkit fingerprints...
Generated fingerprints with 1280 features for 841 molecules
Trial 2055: 5-fold CV loss = 0.5037
