[I 2025-08-07 21:16:14,011] Trial 1275 finished with value: 0.4642413258552551 and parameters: {'fp_type': 'morgan_rdkit', 'combined_morgan_radius': 3, 'combined_morgan_nBits': 1024, 'combined_rdkit_maxPath': 7, 'combined_rdkit_nBits': 1024, 'num_hidden_layers': 3, 'hidden_dim_0': 1024, 'hidden_dim_1': 128, 'hidden_dim_2': 64, 'kl_weight': 0.00028961418259601377, 'lr': 0.0071719189878281416, 'batch_size': 128, 'dropout_rate': 0.06789119603199092, 'prior_mu': -0.009308612339233599, 'prior_sigma': 0.07611063338196263, 'normalization': 'layer'}. Best is trial 896 with value: 0.4533553242683411.
Generating morgan_rdkit fingerprints...
Generated fingerprints with 2048 features for 841 molecules
Trial 1276: 5-fold CV loss = 0.4696
[I 2025-08-07 21:16:24,376] Trial 1276 finished with value: 0.4696142375469208 and parameters: {'fp_type': 'morgan_rdkit', 'combined_morgan_radius': 3, 'combined_morgan_nBits': 1024, 'combined_rdkit_maxPath': 7, 'combined_rdkit_nBits': 1024, 'num_hidden_layers': 3, 'hidden_dim_0': 1024, 'hidden_dim_1': 128, 'hidden_dim_2': 64, 'kl_weight': 0.00021729094429394688, 'lr': 0.009978462427311442, 'batch_size': 128, 'dropout_rate': 0.1521328290571206, 'prior_mu': -0.009589886431151901, 'prior_sigma': 0.0765733577998387, 'normalization': 'layer'}. Best is trial 896 with value: 0.4533553242683411.
Generating morgan_rdkit fingerprints...
Generated fingerprints with 2048 features for 841 molecules
Trial 1279: 5-fold CV loss = 0.4615
[I 2025-08-07 21:16:56,207] Trial 1279 finished with value: 0.4614520311355591 and parameters: {'fp_type': 'morgan_rdkit', 'combined_morgan_radius': 3, 'combined_morgan_nBits': 1024, 'combined_rdkit_maxPath': 7, 'combined_rdkit_nBits': 1024, 'num_hidden_layers': 3, 'hidden_dim_0': 1024, 'hidden_dim_1': 1024, 'hidden_dim_2': 64, 'kl_weight': 0.00022718875206802352, 'lr': 0.009154562867353498, 'batch_size': 128, 'dropout_rate': 0.182388609650202, 'prior_mu': 0.00846592285129806, 'prior_sigma': 0.09486250065564122, 'normalization': 'layer'}. Best is trial 896 with value: 0.4533553242683411.
Generating morgan_rdkit fingerprints...
Generated fingerprints with 2048 features for 841 molecules
Trial 1277: 5-fold CV loss = 0.5175
[I 2025-08-07 21:17:08,991] Trial 1277 finished with value: 0.5175242006778717 and parameters: {'fp_type': 'morgan_rdkit', 'combined_morgan_radius': 3, 'combined_morgan_nBits': 1024, 'combined_rdkit_maxPath': 8, 'combined_rdkit_nBits': 1024, 'num_hidden_layers': 1, 'hidden_dim_0': 1024, 'kl_weight': 0.00022012151217143188, 'lr': 0.009066254895791253, 'batch_size': 128, 'dropout_rate': 0.14377048214561353, 'prior_mu': 0.008875218417957902, 'prior_sigma': 0.0831486744488543, 'normalization': 'layer'}. Best is trial 896 with value: 0.4533553242683411.
Generating morgan_rdkit fingerprints...
Generated fingerprints with 2048 features for 841 molecules
Trial 1280: 5-fold CV loss = 0.4636
[I 2025-08-07 21:17:11,453] Trial 1280 finished with value: 0.46358232498168944 and parameters: {'fp_type': 'morgan_rdkit', 'combined_morgan_radius': 3, 'combined_morgan_nBits': 1024, 'combined_rdkit_maxPath': 7, 'combined_rdkit_nBits': 1024, 'num_hidden_layers': 3, 'hidden_dim_0': 1024, 'hidden_dim_1': 1024, 'hidden_dim_2': 64, 'kl_weight': 0.00023050111714512764, 'lr': 0.009088624468354565, 'batch_size': 128, 'dropout_rate': 0.10177427088832776, 'prior_mu': 0.005936152533957208, 'prior_sigma': 0.12105559161256271, 'normalization': 'layer'}. Best is trial 896 with value: 0.4533553242683411.
Generating morgan_rdkit fingerprints...
Generated fingerprints with 2048 features for 841 molecules
Trial 1278: 5-fold CV loss = 0.5774
[I 2025-08-07 21:17:19,495] Trial 1278 finished with value: 0.5774343192577363 and parameters: {'fp_type': 'morgan_rdkit', 'combined_morgan_radius': 3, 'combined_morgan_nBits': 1024, 'combined_rdkit_maxPath': 8, 'combined_rdkit_nBits': 1024, 'num_hidden_layers': 3, 'hidden_dim_0': 1024, 'hidden_dim_1': 1024, 'hidden_dim_2': 64, 'kl_weight': 0.00021916721590770858, 'lr': 0.009006337235461447, 'batch_size': 128, 'dropout_rate': 0.14385032202468673, 'prior_mu': -0.012161627862884517, 'prior_sigma': 0.09610580950163204, 'normalization': 'layer'}. Best is trial 896 with value: 0.4533553242683411.
Generating morgan_rdkit fingerprints...
Generated fingerprints with 2048 features for 841 molecules
Trial 1281: 5-fold CV loss = 0.4769
[I 2025-08-07 21:17:45,039] Trial 1281 finished with value: 0.47688051462173464 and parameters: {'fp_type': 'morgan_rdkit', 'combined_morgan_radius': 3, 'combined_morgan_nBits': 1024, 'combined_rdkit_maxPath': 8, 'combined_rdkit_nBits': 1024, 'num_hidden_layers': 3, 'hidden_dim_0': 1024, 'hidden_dim_1': 1024, 'hidden_dim_2': 64, 'kl_weight': 0.00032408548634034094, 'lr': 0.008648945912576462, 'batch_size': 128, 'dropout_rate': 0.14314282178903553, 'prior_mu': -0.035943598031054964, 'prior_sigma': 0.08198442880862275, 'normalization': 'layer'}. Best is trial 896 with value: 0.4533553242683411.
Generating morgan_rdkit fingerprints...
Generated fingerprints with 2048 features for 841 molecules
Trial 1283: 5-fold CV loss = 0.4714
[I 2025-08-07 21:17:48,956] Trial 1283 finished with value: 0.4713660657405853 and parameters: {'fp_type': 'morgan_rdkit', 'combined_morgan_radius': 3, 'combined_morgan_nBits': 1024, 'combined_rdkit_maxPath': 7, 'combined_rdkit_nBits': 1024, 'num_hidden_layers': 3, 'hidden_dim_0': 1024, 'hidden_dim_1': 1024, 'hidden_dim_2': 64, 'kl_weight': 0.0003514334722664761, 'lr': 0.008304736390600621, 'batch_size': 128, 'dropout_rate': 0.12946459137952193, 'prior_mu': -0.036213468875776485, 'prior_sigma': 0.08114653735687745, 'normalization': 'layer'}. Best is trial 896 with value: 0.4533553242683411.
Generating morgan_rdkit fingerprints...
Generated fingerprints with 2048 features for 841 molecules
Trial 1282: 5-fold CV loss = 0.4648
[I 2025-08-07 21:18:03,629] Trial 1282 finished with value: 0.46481682658195494 and parameters: {'fp_type': 'morgan_rdkit', 'combined_morgan_radius': 3, 'combined_morgan_nBits': 1024, 'combined_rdkit_maxPath': 7, 'combined_rdkit_nBits': 1024, 'num_hidden_layers': 3, 'hidden_dim_0': 1024, 'hidden_dim_1': 1024, 'hidden_dim_2': 64, 'kl_weight': 0.0003443220173109584, 'lr': 0.008379190692918547, 'batch_size': 128, 'dropout_rate': 0.1017475729273364, 'prior_mu': -0.038637050394463496, 'prior_sigma': 0.08124725788194916, 'normalization': 'layer'}. Best is trial 896 with value: 0.4533553242683411.
Generating morgan_rdkit fingerprints...
Generated fingerprints with 2048 features for 841 molecules
Trial 1286: 5-fold CV loss = 0.4648
[I 2025-08-07 21:18:30,642] Trial 1286 finished with value: 0.4647934973239899 and parameters: {'fp_type': 'morgan_rdkit', 'combined_morgan_radius': 3, 'combined_morgan_nBits': 1024, 'combined_rdkit_maxPath': 7, 'combined_rdkit_nBits': 1024, 'num_hidden_layers': 3, 'hidden_dim_0': 1024, 'hidden_dim_1': 256, 'hidden_dim_2': 64, 'kl_weight': 0.00025437810882839127, 'lr': 0.006920680637072297, 'batch_size': 64, 'dropout_rate': 0.12521465151709532, 'prior_mu': -0.026175185570410667, 'prior_sigma': 0.08570746559173616, 'normalization': 'layer'}. Best is trial 896 with value: 0.4533553242683411.
Generating morgan_rdkit fingerprints...
Generated fingerprints with 2048 features for 841 molecules
Trial 1285: 5-fold CV loss = 0.4656
[I 2025-08-07 21:18:48,196] Trial 1285 finished with value: 0.46556782722473145 and parameters: {'fp_type': 'morgan_rdkit', 'combined_morgan_radius': 3, 'combined_morgan_nBits': 1024, 'combined_rdkit_maxPath': 7, 'combined_rdkit_nBits': 1024, 'num_hidden_layers': 3, 'hidden_dim_0': 1024, 'hidden_dim_1': 256, 'hidden_dim_2': 64, 'kl_weight': 0.0018980942089392512, 'lr': 0.006840822851636446, 'batch_size': 64, 'dropout_rate': 0.1299555045631232, 'prior_mu': -0.030181550116990384, 'prior_sigma': 0.09159098434209095, 'normalization': 'layer'}. Best is trial 896 with value: 0.4533553242683411.
Generating morgan_rdkit fingerprints...
Generated fingerprints with 1280 features for 841 molecules
Trial 1284: 5-fold CV loss = 0.4626
[I 2025-08-07 21:19:04,988] Trial 1284 finished with value: 0.4625891447067261 and parameters: {'fp_type': 'morgan_rdkit', 'combined_morgan_radius': 3, 'combined_morgan_nBits': 1024, 'combined_rdkit_maxPath': 7, 'combined_rdkit_nBits': 1024, 'num_hidden_layers': 3, 'hidden_dim_0': 1024, 'hidden_dim_1': 1024, 'hidden_dim_2': 64, 'kl_weight': 0.00033273124515691295, 'lr': 0.00821006327184991, 'batch_size': 64, 'dropout_rate': 0.13125900248086653, 'prior_mu': -0.036345020274740646, 'prior_sigma': 0.08092579300047002, 'normalization': 'layer'}. Best is trial 896 with value: 0.4533553242683411.
Generating morgan_rdkit fingerprints...
Generated fingerprints with 1280 features for 841 molecules
Trial 1288: 5-fold CV loss = 0.4647
[I 2025-08-07 21:19:09,590] Trial 1288 finished with value: 0.4647213637828827 and parameters: {'fp_type': 'morgan_rdkit', 'combined_morgan_radius': 3, 'combined_morgan_nBits': 1024, 'combined_rdkit_maxPath': 7, 'combined_rdkit_nBits': 1024, 'num_hidden_layers': 3, 'hidden_dim_0': 1024, 'hidden_dim_1': 1024, 'hidden_dim_2': 64, 'kl_weight': 0.00039985686691181656, 'lr': 0.0066898559329609045, 'batch_size': 128, 'dropout_rate': 0.13177979115892358, 'prior_mu': -0.01453428414080657, 'prior_sigma': 0.09196585722917414, 'normalization': 'layer'}. Best is trial 896 with value: 0.4533553242683411.
Generating morgan_rdkit fingerprints...
Generated fingerprints with 1280 features for 841 molecules
Trial 1287: 5-fold CV loss = 0.4629
[I 2025-08-07 21:19:12,855] Trial 1287 finished with value: 0.4629027247428894 and parameters: {'fp_type': 'morgan_rdkit', 'combined_morgan_radius': 3, 'combined_morgan_nBits': 1024, 'combined_rdkit_maxPath': 7, 'combined_rdkit_nBits': 1024, 'num_hidden_layers': 3, 'hidden_dim_0': 1024, 'hidden_dim_1': 256, 'hidden_dim_2': 64, 'kl_weight': 0.00026077932549054624, 'lr': 0.00691631527385245, 'batch_size': 64, 'dropout_rate': 0.12845144470823816, 'prior_mu': -0.02893146804832389, 'prior_sigma': 0.0932147071214537, 'normalization': 'layer'}. Best is trial 896 with value: 0.4533553242683411.
Generating morgan_rdkit fingerprints...
Generated fingerprints with 1280 features for 841 molecules
Trial 1289: 5-fold CV loss = 0.5115
[I 2025-08-07 21:19:21,402] Trial 1289 finished with value: 0.5115128338336945 and parameters: {'fp_type': 'morgan_rdkit', 'combined_morgan_radius': 3, 'combined_morgan_nBits': 1024, 'combined_rdkit_maxPath': 7, 'combined_rdkit_nBits': 256, 'num_hidden_layers': 3, 'hidden_dim_0': 1024, 'hidden_dim_1': 1024, 'hidden_dim_2': 64, 'kl_weight': 0.00038168577193989177, 'lr': 0.007295322484266076, 'batch_size': 128, 'dropout_rate': 0.16858275694080294, 'prior_mu': -0.017885037596220503, 'prior_sigma': 0.07727827530087084, 'normalization': 'layer'}. Best is trial 896 with value: 0.4533553242683411.
Generating morgan_rdkit fingerprints...
Generated fingerprints with 2048 features for 841 molecules
Trial 1291: 5-fold CV loss = 0.5143
[I 2025-08-07 21:19:37,486] Trial 1291 finished with value: 0.5142876982688904 and parameters: {'fp_type': 'morgan_rdkit', 'combined_morgan_radius': 3, 'combined_morgan_nBits': 1024, 'combined_rdkit_maxPath': 7, 'combined_rdkit_nBits': 256, 'num_hidden_layers': 3, 'hidden_dim_0': 1024, 'hidden_dim_1': 1024, 'hidden_dim_2': 64, 'kl_weight': 0.00025614214638774253, 'lr': 0.007448695128679493, 'batch_size': 128, 'dropout_rate': 0.09487116517293658, 'prior_mu': -0.015527867872215686, 'prior_sigma': 0.05846917086619354, 'normalization': 'layer'}. Best is trial 896 with value: 0.4533553242683411.
Generating morgan_rdkit fingerprints...
Generated fingerprints with 2048 features for 841 molecules
Trial 1293: 5-fold CV loss = 0.4668
[I 2025-08-07 21:19:56,693] Trial 1293 finished with value: 0.4668485701084137 and parameters: {'fp_type': 'morgan_rdkit', 'combined_morgan_radius': 3, 'combined_morgan_nBits': 1024, 'combined_rdkit_maxPath': 7, 'combined_rdkit_nBits': 1024, 'num_hidden_layers': 3, 'hidden_dim_0': 1024, 'hidden_dim_1': 1024, 'hidden_dim_2': 64, 'kl_weight': 0.0003090129134338155, 'lr': 0.006436469098534692, 'batch_size': 128, 'dropout_rate': 0.09266718403348354, 'prior_mu': -0.0005465941962239846, 'prior_sigma': 0.05800752665199625, 'normalization': 'layer'}. Best is trial 896 with value: 0.4533553242683411.
Generating morgan_rdkit fingerprints...
Generated fingerprints with 2048 features for 841 molecules
Trial 1292: 5-fold CV loss = 0.5096
[I 2025-08-07 21:19:58,240] Trial 1292 finished with value: 0.5096372425556183 and parameters: {'fp_type': 'morgan_rdkit', 'combined_morgan_radius': 3, 'combined_morgan_nBits': 1024, 'combined_rdkit_maxPath': 7, 'combined_rdkit_nBits': 256, 'num_hidden_layers': 3, 'hidden_dim_0': 1024, 'hidden_dim_1': 1024, 'hidden_dim_2': 64, 'kl_weight': 0.00017352019878981277, 'lr': 0.007383268185134027, 'batch_size': 128, 'dropout_rate': 0.09212497219839443, 'prior_mu': -0.01760540571745817, 'prior_sigma': 0.07689668094292115, 'normalization': 'layer'}. Best is trial 896 with value: 0.4533553242683411.
Generating morgan_rdkit fingerprints...
Generated fingerprints with 2048 features for 841 molecules
Trial 1294: 5-fold CV loss = 0.4737
[I 2025-08-07 21:20:14,731] Trial 1294 finished with value: 0.4736787021160126 and parameters: {'fp_type': 'morgan_rdkit', 'combined_morgan_radius': 3, 'combined_morgan_nBits': 1024, 'combined_rdkit_maxPath': 7, 'combined_rdkit_nBits': 1024, 'num_hidden_layers': 3, 'hidden_dim_0': 1024, 'hidden_dim_1': 1024, 'hidden_dim_2': 64, 'kl_weight': 0.0003058020243181338, 'lr': 0.006501441839078246, 'batch_size': 128, 'dropout_rate': 0.15569832598379885, 'prior_mu': -0.003165666730633534, 'prior_sigma': 0.09731626120446142, 'normalization': 'layer'}. Best is trial 896 with value: 0.4533553242683411.
Generating morgan_rdkit fingerprints...
Generated fingerprints with 2048 features for 841 molecules
Trial 1290: 5-fold CV loss = 0.5228
[I 2025-08-07 21:20:26,649] Trial 1290 finished with value: 0.5228062629699707 and parameters: {'fp_type': 'morgan_rdkit', 'combined_morgan_radius': 3, 'combined_morgan_nBits': 1024, 'combined_rdkit_maxPath': 7, 'combined_rdkit_nBits': 256, 'num_hidden_layers': 3, 'hidden_dim_0': 1024, 'hidden_dim_1': 64, 'hidden_dim_2': 64, 'kl_weight': 0.00041484058518277954, 'lr': 0.007249058288246467, 'batch_size': 128, 'dropout_rate': 0.153730164663801, 'prior_mu': -0.015482309084771708, 'prior_sigma': 0.0966712930078153, 'normalization': 'layer'}. Best is trial 896 with value: 0.4533553242683411.
Generating morgan_rdkit fingerprints...
Generated fingerprints with 2048 features for 841 molecules
Trial 1295: 5-fold CV loss = 0.4642
[I 2025-08-07 21:20:44,228] Trial 1295 finished with value: 0.4641777813434601 and parameters: {'fp_type': 'morgan_rdkit', 'combined_morgan_radius': 3, 'combined_morgan_nBits': 1024, 'combined_rdkit_maxPath': 7, 'combined_rdkit_nBits': 1024, 'num_hidden_layers': 3, 'hidden_dim_0': 1024, 'hidden_dim_1': 64, 'hidden_dim_2': 64, 'kl_weight': 0.003321703423631422, 'lr': 0.007892055512753614, 'batch_size': 128, 'dropout_rate': 0.15502631106703976, 'prior_mu': -0.008512800368864667, 'prior_sigma': 0.0861297546617974, 'normalization': 'layer'}. Best is trial 896 with value: 0.4533553242683411.
Generating morgan_rdkit fingerprints...
Generated fingerprints with 2048 features for 841 molecules
Trial 1297: 5-fold CV loss = 0.4679
[I 2025-08-07 21:20:52,697] Trial 1297 finished with value: 0.46785008907318115 and parameters: {'fp_type': 'morgan_rdkit', 'combined_morgan_radius': 3, 'combined_morgan_nBits': 1024, 'combined_rdkit_maxPath': 7, 'combined_rdkit_nBits': 1024, 'num_hidden_layers': 3, 'hidden_dim_0': 1024, 'hidden_dim_1': 64, 'hidden_dim_2': 64, 'kl_weight': 0.00044412367413370626, 'lr': 0.00796569402927911, 'batch_size': 128, 'dropout_rate': 0.08142716907710695, 'prior_mu': -0.009578455760279186, 'prior_sigma': 0.0867786918181268, 'normalization': 'layer'}. Best is trial 896 with value: 0.4533553242683411.
Generating morgan_rdkit fingerprints...
Generated fingerprints with 2048 features for 841 molecules
Trial 1300: 5-fold CV loss = 0.8289
[I 2025-08-07 21:21:09,990] Trial 1300 finished with value: 0.8289459943771362 and parameters: {'fp_type': 'morgan_rdkit', 'combined_morgan_radius': 3, 'combined_morgan_nBits': 1024, 'combined_rdkit_maxPath': 7, 'combined_rdkit_nBits': 1024, 'num_hidden_layers': 3, 'hidden_dim_0': 512, 'hidden_dim_1': 1024, 'hidden_dim_2': 512, 'kl_weight': 0.00036773220337050827, 'lr': 0.0001634957650763926, 'batch_size': 128, 'dropout_rate': 0.11793756347095954, 'prior_mu': -0.024467702248147562, 'prior_sigma': 0.07081403900818674, 'normalization': 'layer'}. Best is trial 896 with value: 0.4533553242683411.
Generating morgan_rdkit fingerprints...
Generated fingerprints with 2048 features for 841 molecules
Trial 1296: 5-fold CV loss = 0.4800
[I 2025-08-07 21:21:11,128] Trial 1296 finished with value: 0.48002994656562803 and parameters: {'fp_type': 'morgan_rdkit', 'combined_morgan_radius': 3, 'combined_morgan_nBits': 1024, 'combined_rdkit_maxPath': 7, 'combined_rdkit_nBits': 1024, 'num_hidden_layers': 3, 'hidden_dim_0': 512, 'hidden_dim_1': 64, 'hidden_dim_2': 64, 'kl_weight': 0.00042818185558521365, 'lr': 0.006516545692005288, 'batch_size': 128, 'dropout_rate': 0.118573071382263, 'prior_mu': -0.007531431034769952, 'prior_sigma': 0.0865005302732767, 'normalization': 'layer'}. Best is trial 896 with value: 0.4533553242683411.
Generating morgan fingerprints...
Generated fingerprints with 2048 features for 841 molecules
Trial 1299: 5-fold CV loss = 0.4624
[I 2025-08-07 21:21:26,655] Trial 1299 finished with value: 0.4623944640159607 and parameters: {'fp_type': 'morgan_rdkit', 'combined_morgan_radius': 3, 'combined_morgan_nBits': 1024, 'combined_rdkit_maxPath': 7, 'combined_rdkit_nBits': 1024, 'num_hidden_layers': 3, 'hidden_dim_0': 512, 'hidden_dim_1': 1024, 'hidden_dim_2': 64, 'kl_weight': 0.0003627652916733483, 'lr': 0.006605408153830379, 'batch_size': 128, 'dropout_rate': 0.11870732834845091, 'prior_mu': -0.024728502471120437, 'prior_sigma': 0.06828104256393719, 'normalization': 'layer'}. Best is trial 896 with value: 0.4533553242683411.
Generating morgan fingerprints...
Generated fingerprints with 2048 features for 841 molecules
Trial 1302: 5-fold CV loss = 0.5372
[I 2025-08-07 21:21:35,456] Trial 1302 finished with value: 0.5371666133403779 and parameters: {'fp_type': 'morgan', 'morgan_only_radius': 3, 'morgan_only_nBits': 2048, 'num_hidden_layers': 3, 'hidden_dim_0': 256, 'hidden_dim_1': 1024, 'hidden_dim_2': 64, 'kl_weight': 0.0002729957509312488, 'lr': 0.006303276783610955, 'batch_size': 128, 'dropout_rate': 0.1052487431332513, 'prior_mu': -0.02523752989225498, 'prior_sigma': 0.0661302933284214, 'normalization': 'layer'}. Best is trial 896 with value: 0.4533553242683411.
Generating morgan_rdkit fingerprints...
Generated fingerprints with 2048 features for 841 molecules
Trial 1301: 5-fold CV loss = 0.4648
[I 2025-08-07 21:21:48,251] Trial 1301 finished with value: 0.4647739052772522 and parameters: {'fp_type': 'morgan_rdkit', 'combined_morgan_radius': 3, 'combined_morgan_nBits': 1024, 'combined_rdkit_maxPath': 7, 'combined_rdkit_nBits': 1024, 'num_hidden_layers': 3, 'hidden_dim_0': 128, 'hidden_dim_1': 1024, 'hidden_dim_2': 64, 'kl_weight': 0.0002762523351251739, 'lr': 0.0065482941774743855, 'batch_size': 128, 'dropout_rate': 0.10237034901730771, 'prior_mu': -0.05013811084908605, 'prior_sigma': 0.08955303740940634, 'normalization': 'layer'}. Best is trial 896 with value: 0.4533553242683411.
Generating morgan_rdkit fingerprints...
Generated fingerprints with 2048 features for 841 molecules
Trial 1303: 5-fold CV loss = 0.5284
[I 2025-08-07 21:21:53,860] Trial 1303 finished with value: 0.5283894658088684 and parameters: {'fp_type': 'morgan', 'morgan_only_radius': 3, 'morgan_only_nBits': 2048, 'num_hidden_layers': 3, 'hidden_dim_0': 256, 'hidden_dim_1': 1024, 'hidden_dim_2': 64, 'kl_weight': 0.0002698715091594082, 'lr': 0.009829981805455289, 'batch_size': 128, 'dropout_rate': 0.10196942625639431, 'prior_mu': 0.004125780214087722, 'prior_sigma': 0.11340014443345538, 'normalization': 'layer'}. Best is trial 896 with value: 0.4533553242683411.
Generating morgan_rdkit fingerprints...
Generated fingerprints with 2048 features for 841 molecules
Trial 1298: 5-fold CV loss = 0.4624
[I 2025-08-07 21:21:55,935] Trial 1298 finished with value: 0.4623971343040466 and parameters: {'fp_type': 'morgan_rdkit', 'combined_morgan_radius': 3, 'combined_morgan_nBits': 1024, 'combined_rdkit_maxPath': 7, 'combined_rdkit_nBits': 1024, 'num_hidden_layers': 3, 'hidden_dim_0': 512, 'hidden_dim_1': 1024, 'hidden_dim_2': 64, 'kl_weight': 0.003268895457393557, 'lr': 0.00792776222951557, 'batch_size': 128, 'dropout_rate': 0.11647758122202416, 'prior_mu': -0.009529753667590256, 'prior_sigma': 0.08586341152537634, 'normalization': 'layer'}. Best is trial 896 with value: 0.4533553242683411.
Generating morgan_rdkit fingerprints...
Generated fingerprints with 2048 features for 841 molecules
Trial 1305: 5-fold CV loss = 0.5575
[I 2025-08-07 21:22:21,948] Trial 1305 finished with value: 0.5574760556221008 and parameters: {'fp_type': 'morgan_rdkit', 'combined_morgan_radius': 3, 'combined_morgan_nBits': 1024, 'combined_rdkit_maxPath': 7, 'combined_rdkit_nBits': 1024, 'num_hidden_layers': 3, 'hidden_dim_0': 256, 'hidden_dim_1': 1024, 'hidden_dim_2': 64, 'kl_weight': 0.00019711587323152947, 'lr': 0.007968393971282359, 'batch_size': 128, 'dropout_rate': 0.13732509264972673, 'prior_mu': -0.0008437059554903502, 'prior_sigma': 0.11302455453042913, 'normalization': 'layer'}. Best is trial 896 with value: 0.4533553242683411.
Generating morgan_rdkit fingerprints...
Generated fingerprints with 2048 features for 841 molecules
Trial 1306: 5-fold CV loss = 0.4635
