[I 2025-08-07 23:00:09,178] Trial 1815 finished with value: 0.4634929060935974 and parameters: {'fp_type': 'morgan_rdkit', 'combined_morgan_radius': 3, 'combined_morgan_nBits': 1024, 'combined_rdkit_maxPath': 7, 'combined_rdkit_nBits': 1024, 'num_hidden_layers': 3, 'hidden_dim_0': 256, 'hidden_dim_1': 1024, 'hidden_dim_2': 64, 'kl_weight': 0.00046281778927879827, 'lr': 0.007985166086354405, 'batch_size': 128, 'dropout_rate': 0.11716863767675849, 'prior_mu': -0.058313158202895635, 'prior_sigma': 0.07296882854482407, 'normalization': 'layer'}. Best is trial 896 with value: 0.4533553242683411.
Generating morgan_rdkit fingerprints...
Generated fingerprints with 2048 features for 841 molecules
Trial 1817: 5-fold CV loss = 0.5363
[I 2025-08-07 23:00:13,576] Trial 1817 finished with value: 0.5363240599632263 and parameters: {'fp_type': 'morgan_rdkit', 'combined_morgan_radius': 3, 'combined_morgan_nBits': 1024, 'combined_rdkit_maxPath': 7, 'combined_rdkit_nBits': 1024, 'num_hidden_layers': 3, 'hidden_dim_0': 256, 'hidden_dim_1': 1024, 'hidden_dim_2': 64, 'kl_weight': 0.0003912984154565123, 'lr': 0.008171365775701923, 'batch_size': 128, 'dropout_rate': 0.11136664946471816, 'prior_mu': -0.04154484116244418, 'prior_sigma': 0.0945203444437568, 'normalization': 'layer'}. Best is trial 896 with value: 0.4533553242683411.
Generating morgan_rdkit fingerprints...
Generated fingerprints with 2048 features for 841 molecules
Trial 1819: 5-fold CV loss = 0.5067
[I 2025-08-07 23:00:46,951] Trial 1819 finished with value: 0.5066837012767792 and parameters: {'fp_type': 'morgan_rdkit', 'combined_morgan_radius': 3, 'combined_morgan_nBits': 1024, 'combined_rdkit_maxPath': 7, 'combined_rdkit_nBits': 1024, 'num_hidden_layers': 1, 'hidden_dim_0': 256, 'kl_weight': 0.00038232004439722, 'lr': 0.007251586219183063, 'batch_size': 128, 'dropout_rate': 0.14544192225493632, 'prior_mu': -0.03727163868806513, 'prior_sigma': 0.09458428762080394, 'normalization': 'layer'}. Best is trial 896 with value: 0.4533553242683411.
Generating morgan_rdkit fingerprints...
Generated fingerprints with 2048 features for 841 molecules
Trial 1820: 5-fold CV loss = 0.4719
[I 2025-08-07 23:00:53,400] Trial 1820 finished with value: 0.4719397187232971 and parameters: {'fp_type': 'morgan_rdkit', 'combined_morgan_radius': 3, 'combined_morgan_nBits': 1024, 'combined_rdkit_maxPath': 7, 'combined_rdkit_nBits': 1024, 'num_hidden_layers': 3, 'hidden_dim_0': 256, 'hidden_dim_1': 1024, 'hidden_dim_2': 128, 'kl_weight': 0.0003126071536920346, 'lr': 0.007192562775736634, 'batch_size': 128, 'dropout_rate': 0.15973850188264993, 'prior_mu': -0.014494035037318737, 'prior_sigma': 0.08725678460748446, 'normalization': 'layer'}. Best is trial 896 with value: 0.4533553242683411.
Generating morgan fingerprints...
Generated fingerprints with 2048 features for 841 molecules
Trial 1818: 5-fold CV loss = 0.4650
[I 2025-08-07 23:00:55,193] Trial 1818 finished with value: 0.46502068638801575 and parameters: {'fp_type': 'morgan_rdkit', 'combined_morgan_radius': 3, 'combined_morgan_nBits': 1024, 'combined_rdkit_maxPath': 7, 'combined_rdkit_nBits': 1024, 'num_hidden_layers': 3, 'hidden_dim_0': 256, 'hidden_dim_1': 1024, 'hidden_dim_2': 128, 'kl_weight': 0.000399049527229491, 'lr': 0.007917170951842406, 'batch_size': 128, 'dropout_rate': 0.16248904281825866, 'prior_mu': -0.03928639424222734, 'prior_sigma': 0.09236125740818031, 'normalization': 'layer'}. Best is trial 896 with value: 0.4533553242683411.
Generating morgan fingerprints...
Generated fingerprints with 2048 features for 841 molecules
Trial 1816: 5-fold CV loss = 0.4607
[I 2025-08-07 23:01:03,720] Trial 1816 finished with value: 0.46066470742225646 and parameters: {'fp_type': 'morgan_rdkit', 'combined_morgan_radius': 3, 'combined_morgan_nBits': 1024, 'combined_rdkit_maxPath': 7, 'combined_rdkit_nBits': 1024, 'num_hidden_layers': 3, 'hidden_dim_0': 256, 'hidden_dim_1': 1024, 'hidden_dim_2': 64, 'kl_weight': 0.00040726872849339367, 'lr': 0.008029585207237957, 'batch_size': 128, 'dropout_rate': 0.1125194364996478, 'prior_mu': -0.011819731446695228, 'prior_sigma': 0.09411316516141287, 'normalization': 'layer'}. Best is trial 896 with value: 0.4533553242683411.
Generating morgan_rdkit fingerprints...
Generated fingerprints with 2048 features for 841 molecules
Trial 1822: 5-fold CV loss = 0.5270
[I 2025-08-07 23:01:12,137] Trial 1822 finished with value: 0.5270015239715576 and parameters: {'fp_type': 'morgan', 'morgan_only_radius': 3, 'morgan_only_nBits': 2048, 'num_hidden_layers': 3, 'hidden_dim_0': 256, 'hidden_dim_1': 1024, 'hidden_dim_2': 64, 'kl_weight': 0.0002352182615461546, 'lr': 0.005947038944142497, 'batch_size': 128, 'dropout_rate': 0.17123979441792, 'prior_mu': -0.011535173858837407, 'prior_sigma': 0.06971068271103104, 'normalization': 'layer'}. Best is trial 896 with value: 0.4533553242683411.
Generating morgan_rdkit fingerprints...
Generated fingerprints with 2048 features for 841 molecules
Trial 1823: 5-fold CV loss = 0.5300
[I 2025-08-07 23:01:17,433] Trial 1823 finished with value: 0.5299991726875305 and parameters: {'fp_type': 'morgan', 'morgan_only_radius': 3, 'morgan_only_nBits': 2048, 'num_hidden_layers': 3, 'hidden_dim_0': 512, 'hidden_dim_1': 1024, 'hidden_dim_2': 64, 'kl_weight': 0.008365092527834505, 'lr': 0.005913887329855405, 'batch_size': 128, 'dropout_rate': 0.13618026480144213, 'prior_mu': -0.048405335945264236, 'prior_sigma': 0.06996023851311929, 'normalization': 'layer'}. Best is trial 896 with value: 0.4533553242683411.
Generating morgan_rdkit fingerprints...
Generated fingerprints with 2048 features for 841 molecules
Trial 1825: 5-fold CV loss = 0.8909
[I 2025-08-07 23:01:26,484] Trial 1825 finished with value: 0.8908698201179505 and parameters: {'fp_type': 'morgan_rdkit', 'combined_morgan_radius': 3, 'combined_morgan_nBits': 1024, 'combined_rdkit_maxPath': 7, 'combined_rdkit_nBits': 1024, 'num_hidden_layers': 3, 'hidden_dim_0': 512, 'hidden_dim_1': 256, 'hidden_dim_2': 1024, 'kl_weight': 0.0002914096655597358, 'lr': 0.008941926019726532, 'batch_size': 128, 'dropout_rate': 0.13846017339851918, 'prior_mu': -0.024194860519380166, 'prior_sigma': 0.08190398542001522, 'normalization': 'layer'}. Best is trial 896 with value: 0.4533553242683411.
Generating rdkit fingerprints...
Generated fingerprints with 1024 features for 841 molecules
Trial 1826: 5-fold CV loss = 0.8915
[I 2025-08-07 23:01:30,942] Trial 1826 finished with value: 0.8915311455726623 and parameters: {'fp_type': 'morgan_rdkit', 'combined_morgan_radius': 3, 'combined_morgan_nBits': 1024, 'combined_rdkit_maxPath': 7, 'combined_rdkit_nBits': 1024, 'num_hidden_layers': 3, 'hidden_dim_0': 256, 'hidden_dim_1': 64, 'hidden_dim_2': 1024, 'kl_weight': 0.0002833063812537664, 'lr': 0.00883088809974344, 'batch_size': 128, 'dropout_rate': 0.1303557980624691, 'prior_mu': -0.023779496675579586, 'prior_sigma': 0.0901072078330787, 'normalization': 'layer'}. Best is trial 896 with value: 0.4533553242683411.
Generating rdkit fingerprints...
Generated fingerprints with 1024 features for 841 molecules
Trial 1821: 5-fold CV loss = 0.7089
[I 2025-08-07 23:01:41,349] Trial 1821 finished with value: 0.7088889598846435 and parameters: {'fp_type': 'morgan_rdkit', 'combined_morgan_radius': 3, 'combined_morgan_nBits': 1024, 'combined_rdkit_maxPath': 7, 'combined_rdkit_nBits': 1024, 'num_hidden_layers': 3, 'hidden_dim_0': 256, 'hidden_dim_1': 1024, 'hidden_dim_2': 1024, 'kl_weight': 0.0003073768692467455, 'lr': 0.007158882572356445, 'batch_size': 128, 'dropout_rate': 0.15964784255131778, 'prior_mu': -0.012319574173121187, 'prior_sigma': 0.08955677727410141, 'normalization': 'layer'}. Best is trial 896 with value: 0.4533553242683411.
Generating morgan_rdkit fingerprints...
Generated fingerprints with 2048 features for 841 molecules
Trial 1827: 5-fold CV loss = 0.5654
[I 2025-08-07 23:02:13,635] Trial 1827 finished with value: 0.5653644025325775 and parameters: {'fp_type': 'rdkit', 'rdkit_only_maxPath': 7, 'rdkit_only_nBits': 1024, 'num_hidden_layers': 3, 'hidden_dim_0': 256, 'hidden_dim_1': 64, 'hidden_dim_2': 64, 'kl_weight': 0.00031472268786782967, 'lr': 0.007099923554859861, 'batch_size': 128, 'dropout_rate': 0.12763774076770823, 'prior_mu': -0.030596243906723657, 'prior_sigma': 0.09069274633094813, 'normalization': 'layer'}. Best is trial 896 with value: 0.4533553242683411.
Generating morgan_rdkit fingerprints...
Generated fingerprints with 2048 features for 841 molecules
Trial 1828: 5-fold CV loss = 0.4744
[I 2025-08-07 23:02:19,367] Trial 1828 finished with value: 0.4744104862213135 and parameters: {'fp_type': 'rdkit', 'rdkit_only_maxPath': 7, 'rdkit_only_nBits': 1024, 'num_hidden_layers': 3, 'hidden_dim_0': 256, 'hidden_dim_1': 1024, 'hidden_dim_2': 64, 'kl_weight': 0.000335790962608326, 'lr': 0.007101736451086503, 'batch_size': 128, 'dropout_rate': 0.09166165010443864, 'prior_mu': -0.03182147444377703, 'prior_sigma': 0.07309545826765929, 'normalization': 'layer'}. Best is trial 896 with value: 0.4533553242683411.
Generating morgan_rdkit fingerprints...
Generated fingerprints with 2048 features for 841 molecules
Trial 1829: 5-fold CV loss = 0.4660
[I 2025-08-07 23:02:30,066] Trial 1829 finished with value: 0.4660278677940369 and parameters: {'fp_type': 'morgan_rdkit', 'combined_morgan_radius': 3, 'combined_morgan_nBits': 1024, 'combined_rdkit_maxPath': 7, 'combined_rdkit_nBits': 1024, 'num_hidden_layers': 3, 'hidden_dim_0': 256, 'hidden_dim_1': 1024, 'hidden_dim_2': 64, 'kl_weight': 0.00023091372265718717, 'lr': 0.006878488070843763, 'batch_size': 128, 'dropout_rate': 0.09038135272970496, 'prior_mu': -0.030276494791560464, 'prior_sigma': 0.07361359607343596, 'normalization': 'layer'}. Best is trial 896 with value: 0.4533553242683411.
Generating morgan_rdkit fingerprints...
Generated fingerprints with 2048 features for 841 molecules
Trial 1824: 5-fold CV loss = 0.4668
[I 2025-08-07 23:02:34,877] Trial 1824 finished with value: 0.4668013215065002 and parameters: {'fp_type': 'morgan_rdkit', 'combined_morgan_radius': 3, 'combined_morgan_nBits': 1024, 'combined_rdkit_maxPath': 7, 'combined_rdkit_nBits': 1024, 'num_hidden_layers': 3, 'hidden_dim_0': 512, 'hidden_dim_1': 256, 'hidden_dim_2': 64, 'kl_weight': 0.00024387040023204071, 'lr': 0.0057621376649261286, 'batch_size': 128, 'dropout_rate': 0.13642937699658364, 'prior_mu': -0.02558620431945699, 'prior_sigma': 0.07060833815700533, 'normalization': 'layer'}. Best is trial 896 with value: 0.4533553242683411.
Generating morgan_rdkit fingerprints...
Generated fingerprints with 2048 features for 841 molecules
Trial 1831: 5-fold CV loss = 0.5650
[I 2025-08-07 23:02:50,298] Trial 1831 finished with value: 0.5650324106216431 and parameters: {'fp_type': 'morgan_rdkit', 'combined_morgan_radius': 3, 'combined_morgan_nBits': 1024, 'combined_rdkit_maxPath': 7, 'combined_rdkit_nBits': 1024, 'num_hidden_layers': 3, 'hidden_dim_0': 256, 'hidden_dim_1': 1024, 'hidden_dim_2': 64, 'kl_weight': 0.00019157788033851824, 'lr': 0.0057537934206504625, 'batch_size': 128, 'dropout_rate': 0.09766019926330634, 'prior_mu': -0.050953143769370934, 'prior_sigma': 0.08238053733830004, 'normalization': 'layer'}. Best is trial 896 with value: 0.4533553242683411.
Generating morgan_rdkit fingerprints...
Generated fingerprints with 2048 features for 841 molecules
Trial 1830: 5-fold CV loss = 0.4661
[I 2025-08-07 23:02:53,832] Trial 1830 finished with value: 0.4660776913166046 and parameters: {'fp_type': 'morgan_rdkit', 'combined_morgan_radius': 3, 'combined_morgan_nBits': 1024, 'combined_rdkit_maxPath': 7, 'combined_rdkit_nBits': 1024, 'num_hidden_layers': 3, 'hidden_dim_0': 256, 'hidden_dim_1': 1024, 'hidden_dim_2': 64, 'kl_weight': 0.00023110434893667831, 'lr': 0.005557639884018021, 'batch_size': 128, 'dropout_rate': 0.09223593825957896, 'prior_mu': -0.04919157197313198, 'prior_sigma': 0.0793169959075671, 'normalization': 'layer'}. Best is trial 896 with value: 0.4533553242683411.
Generating morgan_rdkit fingerprints...
Generated fingerprints with 2048 features for 841 molecules
Trial 1835: 5-fold CV loss = 0.5618
[I 2025-08-07 23:03:21,695] Trial 1835 finished with value: 0.5618257164955139 and parameters: {'fp_type': 'morgan_rdkit', 'combined_morgan_radius': 3, 'combined_morgan_nBits': 1024, 'combined_rdkit_maxPath': 7, 'combined_rdkit_nBits': 1024, 'num_hidden_layers': 3, 'hidden_dim_0': 256, 'hidden_dim_1': 1024, 'hidden_dim_2': 64, 'kl_weight': 0.0005301883794420209, 'lr': 0.008006973160071203, 'batch_size': 128, 'dropout_rate': 0.15117462598738912, 'prior_mu': -0.039057027431217854, 'prior_sigma': 0.09793331477383072, 'normalization': 'layer'}. Best is trial 896 with value: 0.4533553242683411.
Generating morgan_rdkit fingerprints...
Generated fingerprints with 2048 features for 841 molecules
Trial 1834: 5-fold CV loss = 0.4773
[I 2025-08-07 23:03:39,545] Trial 1834 finished with value: 0.47730897068977357 and parameters: {'fp_type': 'morgan_rdkit', 'combined_morgan_radius': 3, 'combined_morgan_nBits': 1024, 'combined_rdkit_maxPath': 7, 'combined_rdkit_nBits': 1024, 'num_hidden_layers': 3, 'hidden_dim_0': 256, 'hidden_dim_1': 1024, 'hidden_dim_2': 256, 'kl_weight': 0.0005307499048101175, 'lr': 0.009965072585803732, 'batch_size': 128, 'dropout_rate': 0.3961555863361219, 'prior_mu': -0.04344860005657753, 'prior_sigma': 0.07959413487306886, 'normalization': 'layer'}. Best is trial 896 with value: 0.4533553242683411.
Generating morgan_rdkit fingerprints...
Generated fingerprints with 2048 features for 841 molecules
Trial 1832: 5-fold CV loss = 0.4710
[I 2025-08-07 23:03:45,301] Trial 1832 finished with value: 0.47102808952331543 and parameters: {'fp_type': 'morgan_rdkit', 'combined_morgan_radius': 3, 'combined_morgan_nBits': 1024, 'combined_rdkit_maxPath': 7, 'combined_rdkit_nBits': 1024, 'num_hidden_layers': 3, 'hidden_dim_0': 256, 'hidden_dim_1': 1024, 'hidden_dim_2': 256, 'kl_weight': 0.00019517962469785177, 'lr': 0.005676547436096194, 'batch_size': 128, 'dropout_rate': 0.15032142532486747, 'prior_mu': -0.048079306456307584, 'prior_sigma': 0.0808594629324034, 'normalization': 'layer'}. Best is trial 896 with value: 0.4533553242683411.
Generating morgan_rdkit fingerprints...
Generated fingerprints with 2048 features for 841 molecules
Trial 1836: 5-fold CV loss = 0.4720
[I 2025-08-07 23:03:57,085] Trial 1836 finished with value: 0.4720367074012756 and parameters: {'fp_type': 'morgan_rdkit', 'combined_morgan_radius': 3, 'combined_morgan_nBits': 1024, 'combined_rdkit_maxPath': 7, 'combined_rdkit_nBits': 1024, 'num_hidden_layers': 3, 'hidden_dim_0': 256, 'hidden_dim_1': 1024, 'hidden_dim_2': 64, 'kl_weight': 0.00036847016427948463, 'lr': 0.008986659717634063, 'batch_size': 128, 'dropout_rate': 0.18601429765440397, 'prior_mu': -0.020215836504455378, 'prior_sigma': 0.0755548916702376, 'normalization': 'layer'}. Best is trial 896 with value: 0.4533553242683411.
Generating morgan_rdkit fingerprints...
Generated fingerprints with 2048 features for 841 molecules
Trial 1833: 5-fold CV loss = 0.5701
[I 2025-08-07 23:04:00,029] Trial 1833 finished with value: 0.5701232790946961 and parameters: {'fp_type': 'morgan_rdkit', 'combined_morgan_radius': 3, 'combined_morgan_nBits': 1024, 'combined_rdkit_maxPath': 7, 'combined_rdkit_nBits': 1024, 'num_hidden_layers': 3, 'hidden_dim_0': 256, 'hidden_dim_1': 1024, 'hidden_dim_2': 256, 'kl_weight': 0.0005066937958263924, 'lr': 0.009098695522860162, 'batch_size': 128, 'dropout_rate': 0.1527509113148274, 'prior_mu': -0.05105130342474438, 'prior_sigma': 0.0804346265383242, 'normalization': 'layer'}. Best is trial 896 with value: 0.4533553242683411.
Generating morgan_rdkit fingerprints...
Generated fingerprints with 2048 features for 841 molecules
Trial 1838: 5-fold CV loss = 0.7165
[I 2025-08-07 23:04:17,060] Trial 1838 finished with value: 0.7164545059204102 and parameters: {'fp_type': 'morgan_rdkit', 'combined_morgan_radius': 3, 'combined_morgan_nBits': 1024, 'combined_rdkit_maxPath': 7, 'combined_rdkit_nBits': 1024, 'num_hidden_layers': 3, 'hidden_dim_0': 256, 'hidden_dim_1': 1024, 'hidden_dim_2': 64, 'kl_weight': 0.00036112512526746785, 'lr': 0.006455816927089171, 'batch_size': 128, 'dropout_rate': 0.07011735755003143, 'prior_mu': -0.05947769295423795, 'prior_sigma': 0.08616039297014629, 'normalization': 'none'}. Best is trial 896 with value: 0.4533553242683411.
Generating morgan_rdkit fingerprints...
Generated fingerprints with 2048 features for 841 molecules
Trial 1837: 5-fold CV loss = 0.4673
[I 2025-08-07 23:04:18,174] Trial 1837 finished with value: 0.46728941798210144 and parameters: {'fp_type': 'morgan_rdkit', 'combined_morgan_radius': 3, 'combined_morgan_nBits': 1024, 'combined_rdkit_maxPath': 7, 'combined_rdkit_nBits': 1024, 'num_hidden_layers': 3, 'hidden_dim_0': 256, 'hidden_dim_1': 1024, 'hidden_dim_2': 64, 'kl_weight': 0.00035840612525891676, 'lr': 0.009119785433441146, 'batch_size': 128, 'dropout_rate': 0.07142293307309223, 'prior_mu': -0.018522390864911822, 'prior_sigma': 0.08327417260388933, 'normalization': 'layer'}. Best is trial 896 with value: 0.4533553242683411.
Generating morgan_rdkit fingerprints...
Generated fingerprints with 1280 features for 841 molecules
Trial 1839: 5-fold CV loss = 0.6307
[I 2025-08-07 23:04:28,877] Trial 1839 finished with value: 0.6307414889335632 and parameters: {'fp_type': 'morgan_rdkit', 'combined_morgan_radius': 3, 'combined_morgan_nBits': 1024, 'combined_rdkit_maxPath': 7, 'combined_rdkit_nBits': 1024, 'num_hidden_layers': 3, 'hidden_dim_0': 256, 'hidden_dim_1': 1024, 'hidden_dim_2': 64, 'kl_weight': 0.00043997191095168425, 'lr': 0.006302156258212008, 'batch_size': 128, 'dropout_rate': 0.12286219218671764, 'prior_mu': -0.03643136861061064, 'prior_sigma': 0.08574503641217017, 'normalization': 'none'}. Best is trial 896 with value: 0.4533553242683411.
Generating morgan_rdkit fingerprints...
Generated fingerprints with 2048 features for 841 molecules
Trial 1842: 5-fold CV loss = 0.6039
[I 2025-08-07 23:04:45,740] Trial 1842 finished with value: 0.6038736343383789 and parameters: {'fp_type': 'morgan_rdkit', 'combined_morgan_radius': 3, 'combined_morgan_nBits': 1024, 'combined_rdkit_maxPath': 7, 'combined_rdkit_nBits': 256, 'num_hidden_layers': 3, 'hidden_dim_0': 256, 'hidden_dim_1': 128, 'hidden_dim_2': 64, 'kl_weight': 0.0004336472851748591, 'lr': 0.0076991635396116065, 'batch_size': 128, 'dropout_rate': 0.11043238846385423, 'prior_mu': -0.037435876359703094, 'prior_sigma': 0.0678755165777575, 'normalization': 'layer'}. Best is trial 896 with value: 0.4533553242683411.
Generating morgan_rdkit fingerprints...
Generated fingerprints with 2048 features for 841 molecules
Trial 1843: 5-fold CV loss = 0.8723
[I 2025-08-07 23:04:52,825] Trial 1843 finished with value: 0.8723393082618713 and parameters: {'fp_type': 'morgan_rdkit', 'combined_morgan_radius': 3, 'combined_morgan_nBits': 1024, 'combined_rdkit_maxPath': 7, 'combined_rdkit_nBits': 1024, 'num_hidden_layers': 3, 'hidden_dim_0': 256, 'hidden_dim_1': 128, 'hidden_dim_2': 64, 'kl_weight': 0.00026901203392319564, 'lr': 0.00036281313041937134, 'batch_size': 128, 'dropout_rate': 0.1725638604605827, 'prior_mu': -0.010758834393820839, 'prior_sigma': 0.09822569018321062, 'normalization': 'layer'}. Best is trial 896 with value: 0.4533553242683411.
Generating morgan_rdkit fingerprints...
Generated fingerprints with 2048 features for 841 molecules
Trial 1841: 5-fold CV loss = 0.4690
[I 2025-08-07 23:05:19,945] Trial 1841 finished with value: 0.46904929876327517 and parameters: {'fp_type': 'morgan_rdkit', 'combined_morgan_radius': 3, 'combined_morgan_nBits': 1024, 'combined_rdkit_maxPath': 7, 'combined_rdkit_nBits': 1024, 'num_hidden_layers': 3, 'hidden_dim_0': 256, 'hidden_dim_1': 128, 'hidden_dim_2': 64, 'kl_weight': 0.00043154669990627, 'lr': 0.007642375334416788, 'batch_size': 128, 'dropout_rate': 0.1072103110657555, 'prior_mu': -0.03479847907015153, 'prior_sigma': 0.08537302097858508, 'normalization': 'layer'}. Best is trial 896 with value: 0.4533553242683411.
Generating morgan_rdkit fingerprints...
Generated fingerprints with 2048 features for 841 molecules
Trial 1845: 5-fold CV loss = 0.4622
[I 2025-08-07 23:05:26,761] Trial 1845 finished with value: 0.46218117475509646 and parameters: {'fp_type': 'morgan_rdkit', 'combined_morgan_radius': 3, 'combined_morgan_nBits': 1024, 'combined_rdkit_maxPath': 7, 'combined_rdkit_nBits': 1024, 'num_hidden_layers': 3, 'hidden_dim_0': 256, 'hidden_dim_1': 1024, 'hidden_dim_2': 64, 'kl_weight': 0.00027931209146209233, 'lr': 0.007544654928797374, 'batch_size': 128, 'dropout_rate': 0.10583231355956574, 'prior_mu': -0.024177531414222603, 'prior_sigma': 0.07564765897207451, 'normalization': 'layer'}. Best is trial 896 with value: 0.4533553242683411.
Generating morgan_rdkit fingerprints...
Generated fingerprints with 2048 features for 841 molecules
Trial 1844: 5-fold CV loss = 0.4658
[I 2025-08-07 23:05:32,343] Trial 1844 finished with value: 0.4657819211483002 and parameters: {'fp_type': 'morgan_rdkit', 'combined_morgan_radius': 3, 'combined_morgan_nBits': 1024, 'combined_rdkit_maxPath': 7, 'combined_rdkit_nBits': 1024, 'num_hidden_layers': 3, 'hidden_dim_0': 256, 'hidden_dim_1': 1024, 'hidden_dim_2': 64, 'kl_weight': 0.0002621782243895897, 'lr': 0.00672028781868129, 'batch_size': 128, 'dropout_rate': 0.17740824982029355, 'prior_mu': -0.08722749113135367, 'prior_sigma': 0.09765977214708435, 'normalization': 'layer'}. Best is trial 896 with value: 0.4533553242683411.
Generating morgan_rdkit fingerprints...
Generated fingerprints with 2048 features for 841 molecules
Trial 1848: 5-fold CV loss = 1.2354
