[I 2025-08-08 00:11:14,539] Trial 2177 finished with value: 1.1726628303527833 and parameters: {'fp_type': 'morgan_rdkit', 'combined_morgan_radius': 3, 'combined_morgan_nBits': 1024, 'combined_rdkit_maxPath': 7, 'combined_rdkit_nBits': 1024, 'num_hidden_layers': 0, 'kl_weight': 0.022179360333959106, 'lr': 0.009934615170459196, 'batch_size': 128, 'dropout_rate': 0.09481505635769173, 'prior_mu': -0.03854330521667114, 'prior_sigma': 0.07920295604821716, 'normalization': 'layer'}. Best is trial 896 with value: 0.4533553242683411.
Generating morgan_rdkit fingerprints...
Generated fingerprints with 2048 features for 841 molecules
Trial 2176: 5-fold CV loss = 0.6264
[I 2025-08-08 00:11:58,288] Trial 2176 finished with value: 0.6264296650886536 and parameters: {'fp_type': 'morgan_rdkit', 'combined_morgan_radius': 3, 'combined_morgan_nBits': 1024, 'combined_rdkit_maxPath': 7, 'combined_rdkit_nBits': 1024, 'num_hidden_layers': 3, 'hidden_dim_0': 256, 'hidden_dim_1': 1024, 'hidden_dim_2': 64, 'kl_weight': 0.0020128243633065128, 'lr': 0.005550420076819125, 'batch_size': 128, 'dropout_rate': 0.13631287677470577, 'prior_mu': -0.03872690361805391, 'prior_sigma': 0.07959741357676216, 'normalization': 'none'}. Best is trial 896 with value: 0.4533553242683411.
Generating morgan_rdkit fingerprints...
Generated fingerprints with 2048 features for 841 molecules
Trial 2179: 5-fold CV loss = 0.4743
[I 2025-08-08 00:12:02,493] Trial 2179 finished with value: 0.47427358031272887 and parameters: {'fp_type': 'morgan_rdkit', 'combined_morgan_radius': 3, 'combined_morgan_nBits': 1024, 'combined_rdkit_maxPath': 7, 'combined_rdkit_nBits': 1024, 'num_hidden_layers': 3, 'hidden_dim_0': 256, 'hidden_dim_1': 1024, 'hidden_dim_2': 256, 'kl_weight': 0.00030696057666874005, 'lr': 0.005397617925329394, 'batch_size': 128, 'dropout_rate': 0.1427907755308712, 'prior_mu': -0.03783025022102116, 'prior_sigma': 0.07996054631913675, 'normalization': 'layer'}. Best is trial 896 with value: 0.4533553242683411.
Generating morgan_rdkit fingerprints...
Generated fingerprints with 2048 features for 841 molecules
Trial 2178: 5-fold CV loss = 0.4734
[I 2025-08-08 00:12:07,362] Trial 2178 finished with value: 0.4733858048915863 and parameters: {'fp_type': 'morgan_rdkit', 'combined_morgan_radius': 3, 'combined_morgan_nBits': 1024, 'combined_rdkit_maxPath': 7, 'combined_rdkit_nBits': 1024, 'num_hidden_layers': 3, 'hidden_dim_0': 256, 'hidden_dim_1': 1024, 'hidden_dim_2': 256, 'kl_weight': 0.00028854159093702144, 'lr': 0.005468267468345755, 'batch_size': 128, 'dropout_rate': 0.06584445040102387, 'prior_mu': -0.03910074805960706, 'prior_sigma': 0.08159758920172785, 'normalization': 'layer'}. Best is trial 896 with value: 0.4533553242683411.
Generating morgan_rdkit fingerprints...
Generated fingerprints with 2048 features for 841 molecules
Trial 2175: 5-fold CV loss = 0.6015
[I 2025-08-08 00:12:29,052] Trial 2175 finished with value: 0.6014883399009705 and parameters: {'fp_type': 'morgan_rdkit', 'combined_morgan_radius': 3, 'combined_morgan_nBits': 1024, 'combined_rdkit_maxPath': 7, 'combined_rdkit_nBits': 1024, 'num_hidden_layers': 3, 'hidden_dim_0': 256, 'hidden_dim_1': 1024, 'hidden_dim_2': 256, 'kl_weight': 0.00014626030166725294, 'lr': 0.005573408828308274, 'batch_size': 128, 'dropout_rate': 0.13784217017478997, 'prior_mu': -0.036083303606445516, 'prior_sigma': 0.07972626129284262, 'normalization': 'none'}. Best is trial 896 with value: 0.4533553242683411.
Generating morgan_rdkit fingerprints...
Generated fingerprints with 2048 features for 841 molecules
Trial 2181: 5-fold CV loss = 0.4654
[I 2025-08-08 00:12:41,317] Trial 2181 finished with value: 0.46538410782814027 and parameters: {'fp_type': 'morgan_rdkit', 'combined_morgan_radius': 3, 'combined_morgan_nBits': 1024, 'combined_rdkit_maxPath': 7, 'combined_rdkit_nBits': 1024, 'num_hidden_layers': 3, 'hidden_dim_0': 256, 'hidden_dim_1': 1024, 'hidden_dim_2': 64, 'kl_weight': 0.00020804479125868358, 'lr': 0.006302384455944755, 'batch_size': 128, 'dropout_rate': 0.0680526284626359, 'prior_mu': -0.019084758678798552, 'prior_sigma': 0.0927813100746027, 'normalization': 'layer'}. Best is trial 896 with value: 0.4533553242683411.
Generating morgan_rdkit fingerprints...
Generated fingerprints with 2048 features for 841 molecules
Trial 2180: 5-fold CV loss = 0.6579
[I 2025-08-08 00:12:47,791] Trial 2180 finished with value: 0.6578928470611572 and parameters: {'fp_type': 'morgan_rdkit', 'combined_morgan_radius': 3, 'combined_morgan_nBits': 1024, 'combined_rdkit_maxPath': 7, 'combined_rdkit_nBits': 1024, 'num_hidden_layers': 3, 'hidden_dim_0': 256, 'hidden_dim_1': 1024, 'hidden_dim_2': 256, 'kl_weight': 0.0003080615658437045, 'lr': 0.006507264715792687, 'batch_size': 128, 'dropout_rate': 0.1467860125926814, 'prior_mu': -0.056738126871574555, 'prior_sigma': 0.09271155030440409, 'normalization': 'layer'}. Best is trial 896 with value: 0.4533553242683411.
Generating morgan_rdkit fingerprints...
Generated fingerprints with 2048 features for 841 molecules
Trial 2182: 5-fold CV loss = 0.4750
[I 2025-08-08 00:12:51,823] Trial 2182 finished with value: 0.4749829173088074 and parameters: {'fp_type': 'morgan_rdkit', 'combined_morgan_radius': 3, 'combined_morgan_nBits': 1024, 'combined_rdkit_maxPath': 7, 'combined_rdkit_nBits': 1024, 'num_hidden_layers': 3, 'hidden_dim_0': 128, 'hidden_dim_1': 1024, 'hidden_dim_2': 64, 'kl_weight': 0.00014543809755206653, 'lr': 0.006300148253116241, 'batch_size': 128, 'dropout_rate': 0.12405407180768037, 'prior_mu': -0.019668991426097765, 'prior_sigma': 0.08919841865014667, 'normalization': 'layer'}. Best is trial 896 with value: 0.4533553242683411.
Generating morgan_rdkit fingerprints...
Generated fingerprints with 2048 features for 841 molecules
Trial 2184: 5-fold CV loss = 0.5687
[I 2025-08-08 00:13:15,040] Trial 2184 finished with value: 0.5687238156795502 and parameters: {'fp_type': 'morgan_rdkit', 'combined_morgan_radius': 3, 'combined_morgan_nBits': 1024, 'combined_rdkit_maxPath': 7, 'combined_rdkit_nBits': 1024, 'num_hidden_layers': 3, 'hidden_dim_0': 128, 'hidden_dim_1': 128, 'hidden_dim_2': 64, 'kl_weight': 0.0002563070834838181, 'lr': 0.006644386698644757, 'batch_size': 128, 'dropout_rate': 0.12070070635744652, 'prior_mu': -0.06715156817569981, 'prior_sigma': 0.08861749078964619, 'normalization': 'layer'}. Best is trial 896 with value: 0.4533553242683411.
Generating morgan_rdkit fingerprints...
Generated fingerprints with 2048 features for 841 molecules
Trial 2186: 5-fold CV loss = 0.4650
[I 2025-08-08 00:13:29,827] Trial 2186 finished with value: 0.4649827182292938 and parameters: {'fp_type': 'morgan_rdkit', 'combined_morgan_radius': 3, 'combined_morgan_nBits': 1024, 'combined_rdkit_maxPath': 7, 'combined_rdkit_nBits': 1024, 'num_hidden_layers': 3, 'hidden_dim_0': 256, 'hidden_dim_1': 1024, 'hidden_dim_2': 64, 'kl_weight': 0.0002501446072577251, 'lr': 0.00916559578631194, 'batch_size': 128, 'dropout_rate': 0.09436664148150782, 'prior_mu': -0.06849805387711005, 'prior_sigma': 0.08806941907272052, 'normalization': 'layer'}. Best is trial 896 with value: 0.4533553242683411.
Generating morgan_rdkit fingerprints...
Generated fingerprints with 2048 features for 841 molecules
Trial 2185: 5-fold CV loss = 0.4801
[I 2025-08-08 00:13:44,170] Trial 2185 finished with value: 0.4800988852977753 and parameters: {'fp_type': 'morgan_rdkit', 'combined_morgan_radius': 3, 'combined_morgan_nBits': 1024, 'combined_rdkit_maxPath': 7, 'combined_rdkit_nBits': 1024, 'num_hidden_layers': 3, 'hidden_dim_0': 128, 'hidden_dim_1': 128, 'hidden_dim_2': 64, 'kl_weight': 0.00023921397302353333, 'lr': 0.009109267171101257, 'batch_size': 128, 'dropout_rate': 0.09416607828917141, 'prior_mu': -0.029350730082744435, 'prior_sigma': 0.08752507069648435, 'normalization': 'layer'}. Best is trial 896 with value: 0.4533553242683411.
Generating morgan_rdkit fingerprints...
Generated fingerprints with 2048 features for 841 molecules
Trial 2187: 5-fold CV loss = 0.4730
[I 2025-08-08 00:13:50,115] Trial 2187 finished with value: 0.4730193495750427 and parameters: {'fp_type': 'morgan_rdkit', 'combined_morgan_radius': 3, 'combined_morgan_nBits': 1024, 'combined_rdkit_maxPath': 7, 'combined_rdkit_nBits': 1024, 'num_hidden_layers': 3, 'hidden_dim_0': 256, 'hidden_dim_1': 1024, 'hidden_dim_2': 64, 'kl_weight': 0.0004510067120431055, 'lr': 0.009982590238912216, 'batch_size': 128, 'dropout_rate': 0.08136175390261233, 'prior_mu': -0.0489912837695367, 'prior_sigma': 0.08324146612639355, 'normalization': 'layer'}. Best is trial 896 with value: 0.4533553242683411.
Generating morgan_rdkit fingerprints...
Generated fingerprints with 2048 features for 841 molecules
Trial 2183: 5-fold CV loss = 0.4724
[I 2025-08-08 00:14:09,145] Trial 2183 finished with value: 0.4724008202552795 and parameters: {'fp_type': 'morgan_rdkit', 'combined_morgan_radius': 3, 'combined_morgan_nBits': 1024, 'combined_rdkit_maxPath': 7, 'combined_rdkit_nBits': 1024, 'num_hidden_layers': 3, 'hidden_dim_0': 128, 'hidden_dim_1': 1024, 'hidden_dim_2': 64, 'kl_weight': 0.00021097247292591566, 'lr': 0.006409402746407342, 'batch_size': 128, 'dropout_rate': 0.12200918264380954, 'prior_mu': 0.00805901394887372, 'prior_sigma': 0.08883392514228759, 'normalization': 'layer'}. Best is trial 896 with value: 0.4533553242683411.
Generating morgan_rdkit fingerprints...
Generated fingerprints with 2048 features for 841 molecules
Trial 2188: 5-fold CV loss = 0.4626
[I 2025-08-08 00:14:17,335] Trial 2188 finished with value: 0.4625648021697998 and parameters: {'fp_type': 'morgan_rdkit', 'combined_morgan_radius': 3, 'combined_morgan_nBits': 1024, 'combined_rdkit_maxPath': 7, 'combined_rdkit_nBits': 1024, 'num_hidden_layers': 3, 'hidden_dim_0': 256, 'hidden_dim_1': 1024, 'hidden_dim_2': 64, 'kl_weight': 0.00047077060039393993, 'lr': 0.00793104650351632, 'batch_size': 128, 'dropout_rate': 0.0837079644445438, 'prior_mu': -0.02896774614349665, 'prior_sigma': 0.12843925269100098, 'normalization': 'layer'}. Best is trial 896 with value: 0.4533553242683411.
Generating morgan_rdkit fingerprints...
Generated fingerprints with 2048 features for 841 molecules
Trial 2190: 5-fold CV loss = 0.6430
[I 2025-08-08 00:14:20,428] Trial 2190 finished with value: 0.6430314660072327 and parameters: {'fp_type': 'morgan_rdkit', 'combined_morgan_radius': 3, 'combined_morgan_nBits': 1024, 'combined_rdkit_maxPath': 7, 'combined_rdkit_nBits': 1024, 'num_hidden_layers': 3, 'hidden_dim_0': 256, 'hidden_dim_1': 1024, 'hidden_dim_2': 64, 'kl_weight': 0.00039316915254269073, 'lr': 0.004762616826776695, 'batch_size': 128, 'dropout_rate': 0.14898205100363376, 'prior_mu': -0.03023934657474661, 'prior_sigma': 0.11524333134010808, 'normalization': 'layer'}. Best is trial 896 with value: 0.4533553242683411.
Generating morgan_rdkit fingerprints...
Generated fingerprints with 2048 features for 841 molecules
Trial 2192: 5-fold CV loss = 0.8802
[I 2025-08-08 00:14:35,419] Trial 2192 finished with value: 0.8801504254341126 and parameters: {'fp_type': 'morgan_rdkit', 'combined_morgan_radius': 3, 'combined_morgan_nBits': 1024, 'combined_rdkit_maxPath': 7, 'combined_rdkit_nBits': 1024, 'num_hidden_layers': 3, 'hidden_dim_0': 256, 'hidden_dim_1': 1024, 'hidden_dim_2': 64, 'kl_weight': 0.0003989998034123547, 'lr': 0.0012201426436881573, 'batch_size': 128, 'dropout_rate': 0.15220073328381495, 'prior_mu': -0.01946938731087268, 'prior_sigma': 0.10253742928982278, 'normalization': 'layer'}. Best is trial 896 with value: 0.4533553242683411.
Generating morgan_rdkit fingerprints...
Generated fingerprints with 2048 features for 841 molecules
Trial 2191: 5-fold CV loss = 0.8597
[I 2025-08-08 00:14:54,078] Trial 2191 finished with value: 0.8596614360809326 and parameters: {'fp_type': 'morgan_rdkit', 'combined_morgan_radius': 3, 'combined_morgan_nBits': 1024, 'combined_rdkit_maxPath': 7, 'combined_rdkit_nBits': 1024, 'num_hidden_layers': 3, 'hidden_dim_0': 256, 'hidden_dim_1': 1024, 'hidden_dim_2': 64, 'kl_weight': 0.00039688659250049045, 'lr': 0.00038591057357065917, 'batch_size': 128, 'dropout_rate': 0.14990740075664807, 'prior_mu': -0.02735224127593277, 'prior_sigma': 0.10123299514068816, 'normalization': 'layer'}. Best is trial 896 with value: 0.4533553242683411.
Generating rdkit fingerprints...
Generated fingerprints with 256 features for 841 molecules
Trial 2189: 5-fold CV loss = 0.4782
[I 2025-08-08 00:14:56,056] Trial 2189 finished with value: 0.4782247424125671 and parameters: {'fp_type': 'morgan_rdkit', 'combined_morgan_radius': 3, 'combined_morgan_nBits': 1024, 'combined_rdkit_maxPath': 7, 'combined_rdkit_nBits': 1024, 'num_hidden_layers': 3, 'hidden_dim_0': 256, 'hidden_dim_1': 1024, 'hidden_dim_2': 64, 'kl_weight': 0.00048319497446191106, 'lr': 0.004724720454661621, 'batch_size': 128, 'dropout_rate': 0.15001853634671727, 'prior_mu': 0.007844681772050345, 'prior_sigma': 0.11649844172014813, 'normalization': 'layer'}. Best is trial 896 with value: 0.4533553242683411.
Generating rdkit fingerprints...
Generated fingerprints with 256 features for 841 molecules
Trial 2193: 5-fold CV loss = 0.4711
[I 2025-08-08 00:14:57,167] Trial 2193 finished with value: 0.4711106538772583 and parameters: {'fp_type': 'morgan_rdkit', 'combined_morgan_radius': 3, 'combined_morgan_nBits': 1024, 'combined_rdkit_maxPath': 7, 'combined_rdkit_nBits': 1024, 'num_hidden_layers': 3, 'hidden_dim_0': 256, 'hidden_dim_1': 1024, 'hidden_dim_2': 64, 'kl_weight': 0.0003191199605378853, 'lr': 0.00730488907592072, 'batch_size': 128, 'dropout_rate': 0.11387051359001035, 'prior_mu': -0.012577395620685036, 'prior_sigma': 0.07861248418107608, 'normalization': 'layer'}. Best is trial 896 with value: 0.4533553242683411.
Generating rdkit fingerprints...
Generated fingerprints with 256 features for 841 molecules
Trial 2197: 5-fold CV loss = 0.8933
[I 2025-08-08 00:15:12,265] Trial 2197 finished with value: 0.8932946443557739 and parameters: {'fp_type': 'rdkit', 'rdkit_only_maxPath': 6, 'rdkit_only_nBits': 256, 'num_hidden_layers': 3, 'hidden_dim_0': 256, 'hidden_dim_1': 1024, 'hidden_dim_2': 1024, 'kl_weight': 0.00027476808129960837, 'lr': 0.007961463948104718, 'batch_size': 128, 'dropout_rate': 0.1294774299568676, 'prior_mu': -0.055836460108631816, 'prior_sigma': 0.08418194005332241, 'normalization': 'layer'}. Best is trial 896 with value: 0.4533553242683411.
Generating morgan_rdkit fingerprints...
Generated fingerprints with 2048 features for 841 molecules
Trial 2194: 5-fold CV loss = 0.4675
[I 2025-08-08 00:15:16,264] Trial 2194 finished with value: 0.46745280623435975 and parameters: {'fp_type': 'morgan_rdkit', 'combined_morgan_radius': 3, 'combined_morgan_nBits': 1024, 'combined_rdkit_maxPath': 7, 'combined_rdkit_nBits': 1024, 'num_hidden_layers': 3, 'hidden_dim_0': 256, 'hidden_dim_1': 1024, 'hidden_dim_2': 64, 'kl_weight': 0.0003142191725167585, 'lr': 0.007236493802676424, 'batch_size': 128, 'dropout_rate': 0.1306049571240768, 'prior_mu': 0.010906523168368796, 'prior_sigma': 0.0784460578689903, 'normalization': 'layer'}. Best is trial 896 with value: 0.4533553242683411.
Generating morgan_rdkit fingerprints...
Generated fingerprints with 1536 features for 841 molecules
Trial 2196: 5-fold CV loss = 0.8887
[I 2025-08-08 00:15:20,864] Trial 2196 finished with value: 0.8886665940284729 and parameters: {'fp_type': 'rdkit', 'rdkit_only_maxPath': 6, 'rdkit_only_nBits': 256, 'num_hidden_layers': 3, 'hidden_dim_0': 256, 'hidden_dim_1': 1024, 'hidden_dim_2': 1024, 'kl_weight': 0.0003199692430785219, 'lr': 0.007242917120988849, 'batch_size': 128, 'dropout_rate': 0.1142979228802903, 'prior_mu': -0.04536452605471353, 'prior_sigma': 0.07809661790551156, 'normalization': 'layer'}. Best is trial 896 with value: 0.4533553242683411.
Generating morgan_rdkit fingerprints...
Generated fingerprints with 2048 features for 841 molecules
Trial 2198: 5-fold CV loss = 0.6503
[I 2025-08-08 00:15:49,290] Trial 2198 finished with value: 0.6502603113651275 and parameters: {'fp_type': 'morgan_rdkit', 'combined_morgan_radius': 3, 'combined_morgan_nBits': 1024, 'combined_rdkit_maxPath': 8, 'combined_rdkit_nBits': 1024, 'num_hidden_layers': 3, 'hidden_dim_0': 256, 'hidden_dim_1': 1024, 'hidden_dim_2': 64, 'kl_weight': 0.0003381505727993456, 'lr': 0.007074991522675112, 'batch_size': 128, 'dropout_rate': 0.10198054571618773, 'prior_mu': -0.045869074228267824, 'prior_sigma': 0.09463992567063864, 'normalization': 'layer'}. Best is trial 896 with value: 0.4533553242683411.
Generating morgan_rdkit fingerprints...
Generated fingerprints with 1536 features for 841 molecules
Trial 2199: 5-fold CV loss = 0.6781
[I 2025-08-08 00:15:52,726] Trial 2199 finished with value: 0.6780900239944458 and parameters: {'fp_type': 'morgan_rdkit', 'combined_morgan_radius': 3, 'combined_morgan_nBits': 1024, 'combined_rdkit_maxPath': 8, 'combined_rdkit_nBits': 512, 'num_hidden_layers': 3, 'hidden_dim_0': 256, 'hidden_dim_1': 1024, 'hidden_dim_2': 64, 'kl_weight': 0.00022327949524836817, 'lr': 0.005846336229020995, 'batch_size': 128, 'dropout_rate': 0.09787393822393275, 'prior_mu': -0.04729035777044119, 'prior_sigma': 0.09451219604688503, 'normalization': 'layer'}. Best is trial 896 with value: 0.4533553242683411.
Generating morgan_rdkit fingerprints...
Generated fingerprints with 1280 features for 841 molecules
Trial 2201: 5-fold CV loss = 0.6747
[I 2025-08-08 00:16:14,658] Trial 2201 finished with value: 0.6747051477432251 and parameters: {'fp_type': 'morgan_rdkit', 'combined_morgan_radius': 3, 'combined_morgan_nBits': 1024, 'combined_rdkit_maxPath': 7, 'combined_rdkit_nBits': 512, 'num_hidden_layers': 3, 'hidden_dim_0': 256, 'hidden_dim_1': 1024, 'hidden_dim_2': 64, 'kl_weight': 0.00022897643246566515, 'lr': 0.008440771710075137, 'batch_size': 128, 'dropout_rate': 0.0736561269491452, 'prior_mu': -0.017956285508610104, 'prior_sigma': 0.10740489641831152, 'normalization': 'layer'}. Best is trial 896 with value: 0.4533553242683411.
Generating morgan_rdkit fingerprints...
Generated fingerprints with 1280 features for 841 molecules
Trial 2200: 5-fold CV loss = 0.5588
[I 2025-08-08 00:16:21,496] Trial 2200 finished with value: 0.5588480770587921 and parameters: {'fp_type': 'morgan_rdkit', 'combined_morgan_radius': 3, 'combined_morgan_nBits': 1024, 'combined_rdkit_maxPath': 8, 'combined_rdkit_nBits': 1024, 'num_hidden_layers': 3, 'hidden_dim_0': 256, 'hidden_dim_1': 1024, 'hidden_dim_2': 64, 'kl_weight': 0.00022357261933529803, 'lr': 0.005905330940686555, 'batch_size': 128, 'dropout_rate': 0.10353295228434854, 'prior_mu': -0.01736393932412596, 'prior_sigma': 0.09352720216166249, 'normalization': 'layer'}. Best is trial 896 with value: 0.4533553242683411.
Generating morgan_rdkit fingerprints...
Generated fingerprints with 1280 features for 841 molecules
Trial 2202: 5-fold CV loss = 0.5140
[I 2025-08-08 00:16:24,697] Trial 2202 finished with value: 0.5139961242675781 and parameters: {'fp_type': 'morgan_rdkit', 'combined_morgan_radius': 3, 'combined_morgan_nBits': 1024, 'combined_rdkit_maxPath': 7, 'combined_rdkit_nBits': 256, 'num_hidden_layers': 3, 'hidden_dim_0': 256, 'hidden_dim_1': 1024, 'hidden_dim_2': 64, 'kl_weight': 0.00026461940429030133, 'lr': 0.008530630470313511, 'batch_size': 128, 'dropout_rate': 0.16208141443983828, 'prior_mu': -0.014868812651374078, 'prior_sigma': 0.08262430326297977, 'normalization': 'layer'}. Best is trial 896 with value: 0.4533553242683411.
Generating morgan_rdkit fingerprints...
Generated fingerprints with 2048 features for 841 molecules
Trial 2195: 5-fold CV loss = 0.7293
[I 2025-08-08 00:16:34,287] Trial 2195 finished with value: 0.729315459728241 and parameters: {'fp_type': 'rdkit', 'rdkit_only_maxPath': 6, 'rdkit_only_nBits': 256, 'num_hidden_layers': 3, 'hidden_dim_0': 256, 'hidden_dim_1': 1024, 'hidden_dim_2': 64, 'kl_weight': 0.00031771491235772054, 'lr': 0.007197076866214235, 'batch_size': 128, 'dropout_rate': 0.12978773367690424, 'prior_mu': 0.012488478955283855, 'prior_sigma': 0.08290922254001187, 'normalization': 'layer'}. Best is trial 896 with value: 0.4533553242683411.
Generating morgan_rdkit fingerprints...
Generated fingerprints with 2048 features for 841 molecules
Trial 2203: 5-fold CV loss = 0.5937
[I 2025-08-08 00:16:41,983] Trial 2203 finished with value: 0.5936616599559784 and parameters: {'fp_type': 'morgan_rdkit', 'combined_morgan_radius': 3, 'combined_morgan_nBits': 1024, 'combined_rdkit_maxPath': 7, 'combined_rdkit_nBits': 256, 'num_hidden_layers': 3, 'hidden_dim_0': 256, 'hidden_dim_1': 1024, 'hidden_dim_2': 64, 'kl_weight': 0.00027064168744677167, 'lr': 0.004365349510833514, 'batch_size': 128, 'dropout_rate': 0.16133615483569558, 'prior_mu': -0.005856383822579975, 'prior_sigma': 0.08489613710415053, 'normalization': 'layer'}. Best is trial 896 with value: 0.4533553242683411.
Generating morgan_rdkit fingerprints...
Generated fingerprints with 2048 features for 841 molecules
Trial 2204: 5-fold CV loss = 0.5222
[I 2025-08-08 00:17:13,658] Trial 2204 finished with value: 0.5221991240978241 and parameters: {'fp_type': 'morgan_rdkit', 'combined_morgan_radius': 3, 'combined_morgan_nBits': 1024, 'combined_rdkit_maxPath': 7, 'combined_rdkit_nBits': 256, 'num_hidden_layers': 3, 'hidden_dim_0': 256, 'hidden_dim_1': 1024, 'hidden_dim_2': 64, 'kl_weight': 0.0024280830969260333, 'lr': 0.005000206103235655, 'batch_size': 128, 'dropout_rate': 0.1634227635679442, 'prior_mu': -0.003103917457076914, 'prior_sigma': 0.08507422049190297, 'normalization': 'layer'}. Best is trial 896 with value: 0.4533553242683411.
Generating morgan_rdkit fingerprints...
Generated fingerprints with 2048 features for 841 molecules
Trial 2207: 5-fold CV loss = 0.4838
