[I 2025-08-07 20:34:54,688] Trial 1065 finished with value: 0.5494189918041229 and parameters: {'fp_type': 'morgan_rdkit', 'combined_morgan_radius': 3, 'combined_morgan_nBits': 1024, 'combined_rdkit_maxPath': 7, 'combined_rdkit_nBits': 1024, 'num_hidden_layers': 3, 'hidden_dim_0': 256, 'hidden_dim_1': 1024, 'hidden_dim_2': 64, 'kl_weight': 0.0003430697146353149, 'lr': 0.00649096985234903, 'batch_size': 128, 'dropout_rate': 0.10174385536543588, 'prior_mu': -0.012886011133330105, 'prior_sigma': 0.09147358344007572, 'normalization': 'layer'}. Best is trial 896 with value: 0.4533553242683411.
Generating morgan_rdkit fingerprints...
Generated fingerprints with 2048 features for 841 molecules
Trial 1068: 5-fold CV loss = 0.4638
[I 2025-08-07 20:35:21,611] Trial 1068 finished with value: 0.46381434202194216 and parameters: {'fp_type': 'morgan_rdkit', 'combined_morgan_radius': 3, 'combined_morgan_nBits': 1024, 'combined_rdkit_maxPath': 7, 'combined_rdkit_nBits': 1024, 'num_hidden_layers': 3, 'hidden_dim_0': 256, 'hidden_dim_1': 1024, 'hidden_dim_2': 64, 'kl_weight': 0.0001755374650459353, 'lr': 0.005037597778922184, 'batch_size': 128, 'dropout_rate': 0.11790453898624788, 'prior_mu': -0.034130443042976695, 'prior_sigma': 0.09171256037955552, 'normalization': 'layer'}. Best is trial 896 with value: 0.4533553242683411.
Generating morgan_rdkit fingerprints...
Generated fingerprints with 2048 features for 841 molecules
Trial 1067: 5-fold CV loss = 0.4638
[I 2025-08-07 20:35:33,814] Trial 1067 finished with value: 0.4637730062007904 and parameters: {'fp_type': 'morgan_rdkit', 'combined_morgan_radius': 3, 'combined_morgan_nBits': 1024, 'combined_rdkit_maxPath': 7, 'combined_rdkit_nBits': 1024, 'num_hidden_layers': 3, 'hidden_dim_0': 256, 'hidden_dim_1': 1024, 'hidden_dim_2': 64, 'kl_weight': 0.0003329273670903005, 'lr': 0.00658914754923933, 'batch_size': 128, 'dropout_rate': 0.12309544340538987, 'prior_mu': -0.012917043662527484, 'prior_sigma': 0.09153441789878351, 'normalization': 'layer'}. Best is trial 896 with value: 0.4533553242683411.
Generating morgan_rdkit fingerprints...
Generated fingerprints with 2048 features for 841 molecules
Trial 1070: 5-fold CV loss = 0.8826
[I 2025-08-07 20:35:38,501] Trial 1070 finished with value: 0.8826075315475463 and parameters: {'fp_type': 'morgan_rdkit', 'combined_morgan_radius': 3, 'combined_morgan_nBits': 1024, 'combined_rdkit_maxPath': 7, 'combined_rdkit_nBits': 1024, 'num_hidden_layers': 3, 'hidden_dim_0': 256, 'hidden_dim_1': 1024, 'hidden_dim_2': 64, 'kl_weight': 0.0002696366317562663, 'lr': 0.0005429533886551756, 'batch_size': 128, 'dropout_rate': 0.1284898684370359, 'prior_mu': 0.0021595389883631716, 'prior_sigma': 0.07716400205728714, 'normalization': 'layer'}. Best is trial 896 with value: 0.4533553242683411.
Generating morgan_rdkit fingerprints...
Generated fingerprints with 2048 features for 841 molecules
Trial 1069: 5-fold CV loss = 0.4689
[I 2025-08-07 20:35:40,741] Trial 1069 finished with value: 0.468885999917984 and parameters: {'fp_type': 'morgan_rdkit', 'combined_morgan_radius': 3, 'combined_morgan_nBits': 1024, 'combined_rdkit_maxPath': 7, 'combined_rdkit_nBits': 1024, 'num_hidden_layers': 3, 'hidden_dim_0': 256, 'hidden_dim_1': 1024, 'hidden_dim_2': 64, 'kl_weight': 0.00027602720113144053, 'lr': 0.005031461897475916, 'batch_size': 128, 'dropout_rate': 0.12510576969026735, 'prior_mu': 0.001319734997635557, 'prior_sigma': 0.06472061709641759, 'normalization': 'layer'}. Best is trial 896 with value: 0.4533553242683411.
Generating morgan_rdkit fingerprints...
Generated fingerprints with 1280 features for 841 molecules
Trial 1066: 5-fold CV loss = 0.5340
[I 2025-08-07 20:35:54,489] Trial 1066 finished with value: 0.5339930295944214 and parameters: {'fp_type': 'morgan_rdkit', 'combined_morgan_radius': 3, 'combined_morgan_nBits': 1024, 'combined_rdkit_maxPath': 7, 'combined_rdkit_nBits': 1024, 'num_hidden_layers': 3, 'hidden_dim_0': 256, 'hidden_dim_1': 1024, 'hidden_dim_2': 64, 'kl_weight': 0.00017404856012992372, 'lr': 0.006657121131637161, 'batch_size': 128, 'dropout_rate': 0.10318002694956008, 'prior_mu': -0.013106628788205807, 'prior_sigma': 0.0920061025423646, 'normalization': 'layer'}. Best is trial 896 with value: 0.4533553242683411.
Generating morgan_rdkit fingerprints...
Generated fingerprints with 1280 features for 841 molecules
Trial 1072: 5-fold CV loss = 0.4688
[I 2025-08-07 20:36:17,178] Trial 1072 finished with value: 0.46880027651786804 and parameters: {'fp_type': 'morgan_rdkit', 'combined_morgan_radius': 3, 'combined_morgan_nBits': 1024, 'combined_rdkit_maxPath': 7, 'combined_rdkit_nBits': 1024, 'num_hidden_layers': 3, 'hidden_dim_0': 256, 'hidden_dim_1': 1024, 'hidden_dim_2': 64, 'kl_weight': 0.0002807094183244712, 'lr': 0.005380430447414121, 'batch_size': 128, 'dropout_rate': 0.11427009992677045, 'prior_mu': 0.016967316189554445, 'prior_sigma': 0.07947389893206037, 'normalization': 'layer'}. Best is trial 896 with value: 0.4533553242683411.
Generating morgan_rdkit fingerprints...
Generated fingerprints with 1280 features for 841 molecules
Trial 1073: 5-fold CV loss = 0.5162
[I 2025-08-07 20:36:18,288] Trial 1073 finished with value: 0.5162117421627045 and parameters: {'fp_type': 'morgan_rdkit', 'combined_morgan_radius': 3, 'combined_morgan_nBits': 1024, 'combined_rdkit_maxPath': 7, 'combined_rdkit_nBits': 256, 'num_hidden_layers': 3, 'hidden_dim_0': 256, 'hidden_dim_1': 1024, 'hidden_dim_2': 64, 'kl_weight': 0.0003602755960743608, 'lr': 0.005396408057924627, 'batch_size': 128, 'dropout_rate': 0.11668229304376632, 'prior_mu': -0.02301272589121064, 'prior_sigma': 0.09692519008836034, 'normalization': 'layer'}. Best is trial 896 with value: 0.4533553242683411.
Generating morgan_rdkit fingerprints...
Generated fingerprints with 2048 features for 841 molecules
Trial 1071: 5-fold CV loss = 0.4661
[I 2025-08-07 20:36:36,059] Trial 1071 finished with value: 0.46613162755966187 and parameters: {'fp_type': 'morgan_rdkit', 'combined_morgan_radius': 3, 'combined_morgan_nBits': 1024, 'combined_rdkit_maxPath': 7, 'combined_rdkit_nBits': 1024, 'num_hidden_layers': 3, 'hidden_dim_0': 256, 'hidden_dim_1': 1024, 'hidden_dim_2': 64, 'kl_weight': 0.00026580989009418395, 'lr': 0.005141088472288948, 'batch_size': 128, 'dropout_rate': 0.11065774580489411, 'prior_mu': 0.002832635815301821, 'prior_sigma': 0.07651751122105462, 'normalization': 'layer'}. Best is trial 896 with value: 0.4533553242683411.
Generating morgan_rdkit fingerprints...
Generated fingerprints with 2048 features for 841 molecules
Trial 1075: 5-fold CV loss = 0.5190
[I 2025-08-07 20:36:45,366] Trial 1075 finished with value: 0.5189742684364319 and parameters: {'fp_type': 'morgan_rdkit', 'combined_morgan_radius': 3, 'combined_morgan_nBits': 1024, 'combined_rdkit_maxPath': 7, 'combined_rdkit_nBits': 256, 'num_hidden_layers': 3, 'hidden_dim_0': 256, 'hidden_dim_1': 1024, 'hidden_dim_2': 64, 'kl_weight': 0.0003631017527757261, 'lr': 0.004608433258842135, 'batch_size': 128, 'dropout_rate': 0.1113851107319388, 'prior_mu': -0.055238082070114755, 'prior_sigma': 0.07249396968422163, 'normalization': 'layer'}. Best is trial 896 with value: 0.4533553242683411.
Generating morgan_rdkit fingerprints...
Generated fingerprints with 2048 features for 841 molecules
Trial 1076: 5-fold CV loss = 0.4675
[I 2025-08-07 20:37:01,045] Trial 1076 finished with value: 0.46753785014152527 and parameters: {'fp_type': 'morgan_rdkit', 'combined_morgan_radius': 3, 'combined_morgan_nBits': 1024, 'combined_rdkit_maxPath': 7, 'combined_rdkit_nBits': 1024, 'num_hidden_layers': 3, 'hidden_dim_0': 256, 'hidden_dim_1': 1024, 'hidden_dim_2': 64, 'kl_weight': 0.00032274045527161204, 'lr': 0.004529414983015467, 'batch_size': 128, 'dropout_rate': 0.13027380639558322, 'prior_mu': -0.05760129235575863, 'prior_sigma': 0.07385133291669803, 'normalization': 'layer'}. Best is trial 896 with value: 0.4533553242683411.
Generating morgan_rdkit fingerprints...
Generated fingerprints with 2048 features for 841 molecules
Trial 1074: 5-fold CV loss = 0.6031
[I 2025-08-07 20:37:10,723] Trial 1074 finished with value: 0.6030865788459778 and parameters: {'fp_type': 'morgan_rdkit', 'combined_morgan_radius': 3, 'combined_morgan_nBits': 1024, 'combined_rdkit_maxPath': 7, 'combined_rdkit_nBits': 256, 'num_hidden_layers': 3, 'hidden_dim_0': 256, 'hidden_dim_1': 1024, 'hidden_dim_2': 64, 'kl_weight': 0.00035102111754144226, 'lr': 0.005428423484914789, 'batch_size': 128, 'dropout_rate': 0.11224780185673545, 'prior_mu': 0.016694172871364325, 'prior_sigma': 0.07983053847839765, 'normalization': 'layer'}. Best is trial 896 with value: 0.4533553242683411.
Generating morgan_rdkit fingerprints...
Generated fingerprints with 2048 features for 841 molecules
Trial 1078: 5-fold CV loss = 0.4775
[I 2025-08-07 20:37:16,909] Trial 1078 finished with value: 0.4775437891483307 and parameters: {'fp_type': 'morgan_rdkit', 'combined_morgan_radius': 3, 'combined_morgan_nBits': 1024, 'combined_rdkit_maxPath': 6, 'combined_rdkit_nBits': 1024, 'num_hidden_layers': 3, 'hidden_dim_0': 256, 'hidden_dim_1': 1024, 'hidden_dim_2': 64, 'kl_weight': 0.00031464584174510635, 'lr': 0.00653771041621339, 'batch_size': 128, 'dropout_rate': 0.07782650964505793, 'prior_mu': -0.04595012591063333, 'prior_sigma': 0.08377234319334535, 'normalization': 'layer'}. Best is trial 896 with value: 0.4533553242683411.
Generating morgan_rdkit fingerprints...
Generated fingerprints with 2048 features for 841 molecules
Trial 1077: 5-fold CV loss = 0.4668
[I 2025-08-07 20:37:28,272] Trial 1077 finished with value: 0.46679518222808836 and parameters: {'fp_type': 'morgan_rdkit', 'combined_morgan_radius': 3, 'combined_morgan_nBits': 1024, 'combined_rdkit_maxPath': 7, 'combined_rdkit_nBits': 1024, 'num_hidden_layers': 3, 'hidden_dim_0': 256, 'hidden_dim_1': 1024, 'hidden_dim_2': 64, 'kl_weight': 0.0003239205240780504, 'lr': 0.006625344974047819, 'batch_size': 128, 'dropout_rate': 0.07857374585886034, 'prior_mu': -0.033636564115847215, 'prior_sigma': 0.07174395743147262, 'normalization': 'layer'}. Best is trial 896 with value: 0.4533553242683411.
Generating morgan_rdkit fingerprints...
Generated fingerprints with 2048 features for 841 molecules
Trial 1079: 5-fold CV loss = 0.4743
[I 2025-08-07 20:37:42,937] Trial 1079 finished with value: 0.47433815598487855 and parameters: {'fp_type': 'morgan_rdkit', 'combined_morgan_radius': 3, 'combined_morgan_nBits': 1024, 'combined_rdkit_maxPath': 7, 'combined_rdkit_nBits': 1024, 'num_hidden_layers': 3, 'hidden_dim_0': 256, 'hidden_dim_1': 1024, 'hidden_dim_2': 64, 'kl_weight': 0.00020962854801184506, 'lr': 0.006620444842700406, 'batch_size': 128, 'dropout_rate': 0.07646467549980304, 'prior_mu': -0.03472064531433001, 'prior_sigma': 0.08306163817820808, 'normalization': 'layer'}. Best is trial 896 with value: 0.4533553242683411.
Generating morgan_rdkit fingerprints...
Generated fingerprints with 2048 features for 841 molecules
Trial 1081: 5-fold CV loss = 0.6390
[I 2025-08-07 20:37:54,275] Trial 1081 finished with value: 0.6389674842357635 and parameters: {'fp_type': 'morgan_rdkit', 'combined_morgan_radius': 3, 'combined_morgan_nBits': 1024, 'combined_rdkit_maxPath': 7, 'combined_rdkit_nBits': 1024, 'num_hidden_layers': 3, 'hidden_dim_0': 256, 'hidden_dim_1': 1024, 'hidden_dim_2': 256, 'kl_weight': 0.0002091521018935883, 'lr': 0.0059072217599774645, 'batch_size': 128, 'dropout_rate': 0.06276202643345133, 'prior_mu': -0.022370743522528477, 'prior_sigma': 0.09801400362898322, 'normalization': 'layer'}. Best is trial 896 with value: 0.4533553242683411.
Generating morgan_rdkit fingerprints...
Generated fingerprints with 2048 features for 841 molecules
Trial 1082: 5-fold CV loss = 0.8214
[I 2025-08-07 20:37:58,156] Trial 1082 finished with value: 0.8213562607765198 and parameters: {'fp_type': 'morgan_rdkit', 'combined_morgan_radius': 3, 'combined_morgan_nBits': 1024, 'combined_rdkit_maxPath': 7, 'combined_rdkit_nBits': 1024, 'num_hidden_layers': 3, 'hidden_dim_0': 256, 'hidden_dim_1': 1024, 'hidden_dim_2': 256, 'kl_weight': 0.00021291944654870998, 'lr': 0.005858922225796656, 'batch_size': 128, 'dropout_rate': 0.06485846281138494, 'prior_mu': -0.023233986820488467, 'prior_sigma': 0.09578455271753065, 'normalization': 'layer'}. Best is trial 896 with value: 0.4533553242683411.
Generating rdkit fingerprints...
Generated fingerprints with 512 features for 841 molecules
Trial 1083: 5-fold CV loss = 0.4635
[I 2025-08-07 20:38:24,956] Trial 1083 finished with value: 0.46345534920692444 and parameters: {'fp_type': 'morgan_rdkit', 'combined_morgan_radius': 3, 'combined_morgan_nBits': 1024, 'combined_rdkit_maxPath': 7, 'combined_rdkit_nBits': 1024, 'num_hidden_layers': 3, 'hidden_dim_0': 256, 'hidden_dim_1': 1024, 'hidden_dim_2': 64, 'kl_weight': 0.00024237125187979124, 'lr': 0.0059019957711097205, 'batch_size': 128, 'dropout_rate': 0.09263184980244646, 'prior_mu': -0.021299800067649664, 'prior_sigma': 0.09523508666296061, 'normalization': 'layer'}. Best is trial 896 with value: 0.4533553242683411.
Generating rdkit fingerprints...
Generated fingerprints with 512 features for 841 molecules
Trial 1084: 5-fold CV loss = 0.4637
[I 2025-08-07 20:38:28,709] Trial 1084 finished with value: 0.4636965751647949 and parameters: {'fp_type': 'morgan_rdkit', 'combined_morgan_radius': 3, 'combined_morgan_nBits': 1024, 'combined_rdkit_maxPath': 7, 'combined_rdkit_nBits': 1024, 'num_hidden_layers': 3, 'hidden_dim_0': 256, 'hidden_dim_1': 64, 'hidden_dim_2': 64, 'kl_weight': 0.0002454395331837674, 'lr': 0.005829041683679201, 'batch_size': 128, 'dropout_rate': 0.09449624366926383, 'prior_mu': -0.020784662204731248, 'prior_sigma': 0.05969662575490321, 'normalization': 'layer'}. Best is trial 896 with value: 0.4533553242683411.
Generating rdkit fingerprints...
Generated fingerprints with 512 features for 841 molecules
Trial 1080: 5-fold CV loss = 0.4808
[I 2025-08-07 20:38:35,130] Trial 1080 finished with value: 0.4808451533317566 and parameters: {'fp_type': 'morgan_rdkit', 'combined_morgan_radius': 3, 'combined_morgan_nBits': 1024, 'combined_rdkit_maxPath': 6, 'combined_rdkit_nBits': 1024, 'num_hidden_layers': 3, 'hidden_dim_0': 256, 'hidden_dim_1': 1024, 'hidden_dim_2': 64, 'kl_weight': 0.00020847131540119854, 'lr': 0.006423960396243689, 'batch_size': 128, 'dropout_rate': 0.08059015695979489, 'prior_mu': -0.03466019700453241, 'prior_sigma': 0.08564665730895252, 'normalization': 'layer'}. Best is trial 896 with value: 0.4533553242683411.
Generating morgan_rdkit fingerprints...
Generated fingerprints with 2048 features for 841 molecules
Trial 1085: 5-fold CV loss = 0.5533
[I 2025-08-07 20:38:55,233] Trial 1085 finished with value: 0.5533178269863128 and parameters: {'fp_type': 'rdkit', 'rdkit_only_maxPath': 6, 'rdkit_only_nBits': 512, 'num_hidden_layers': 3, 'hidden_dim_0': 256, 'hidden_dim_1': 1024, 'hidden_dim_2': 64, 'kl_weight': 0.0002449788349437799, 'lr': 0.00848006948794618, 'batch_size': 128, 'dropout_rate': 0.09161331011232167, 'prior_mu': -0.043222104610203725, 'prior_sigma': 0.11158172899504036, 'normalization': 'layer'}. Best is trial 896 with value: 0.4533553242683411.
Generating morgan_rdkit fingerprints...
Generated fingerprints with 2048 features for 841 molecules
Trial 1087: 5-fold CV loss = 0.5250
[I 2025-08-07 20:39:01,624] Trial 1087 finished with value: 0.5249813914299011 and parameters: {'fp_type': 'rdkit', 'rdkit_only_maxPath': 6, 'rdkit_only_nBits': 512, 'num_hidden_layers': 1, 'hidden_dim_0': 256, 'kl_weight': 0.00028442910573611317, 'lr': 0.006907184297353226, 'batch_size': 128, 'dropout_rate': 0.13602704227876689, 'prior_mu': -0.004959488329708509, 'prior_sigma': 0.0852924027716862, 'normalization': 'layer'}. Best is trial 896 with value: 0.4533553242683411.
Generating morgan_rdkit fingerprints...
Generated fingerprints with 2048 features for 841 molecules
Trial 1086: 5-fold CV loss = 0.5879
[I 2025-08-07 20:39:11,565] Trial 1086 finished with value: 0.5879255533218384 and parameters: {'fp_type': 'rdkit', 'rdkit_only_maxPath': 6, 'rdkit_only_nBits': 512, 'num_hidden_layers': 3, 'hidden_dim_0': 256, 'hidden_dim_1': 64, 'hidden_dim_2': 64, 'kl_weight': 0.0014854817520253958, 'lr': 0.008418742773338202, 'batch_size': 128, 'dropout_rate': 0.13605766566918123, 'prior_mu': -0.0033673964699324575, 'prior_sigma': 0.06393433611748557, 'normalization': 'layer'}. Best is trial 896 with value: 0.4533553242683411.
Generating morgan_rdkit fingerprints...
Generated fingerprints with 2048 features for 841 molecules
Trial 1090: 5-fold CV loss = 0.5614
[I 2025-08-07 20:39:45,492] Trial 1090 finished with value: 0.5614044964313507 and parameters: {'fp_type': 'morgan_rdkit', 'combined_morgan_radius': 3, 'combined_morgan_nBits': 1024, 'combined_rdkit_maxPath': 7, 'combined_rdkit_nBits': 1024, 'num_hidden_layers': 3, 'hidden_dim_0': 256, 'hidden_dim_1': 1024, 'hidden_dim_2': 512, 'kl_weight': 0.0003709811628605127, 'lr': 0.006943294087262467, 'batch_size': 128, 'dropout_rate': 0.12572645867490895, 'prior_mu': -0.013752138275857572, 'prior_sigma': 0.06519425843669108, 'normalization': 'layer'}. Best is trial 896 with value: 0.4533553242683411.
Generating morgan_rdkit fingerprints...
Generated fingerprints with 2048 features for 841 molecules
Trial 1091: 5-fold CV loss = 0.7357
[I 2025-08-07 20:39:47,701] Trial 1091 finished with value: 0.7356902301311493 and parameters: {'fp_type': 'morgan_rdkit', 'combined_morgan_radius': 3, 'combined_morgan_nBits': 1024, 'combined_rdkit_maxPath': 7, 'combined_rdkit_nBits': 1024, 'num_hidden_layers': 3, 'hidden_dim_0': 128, 'hidden_dim_1': 1024, 'hidden_dim_2': 512, 'kl_weight': 0.00038200225972352225, 'lr': 0.004249015213688045, 'batch_size': 128, 'dropout_rate': 0.1222204925631511, 'prior_mu': -0.015438984508586693, 'prior_sigma': 0.0788567810579383, 'normalization': 'layer'}. Best is trial 896 with value: 0.4533553242683411.
Generating morgan_rdkit fingerprints...
Generated fingerprints with 2048 features for 841 molecules
Trial 1089: 5-fold CV loss = 0.5511
[I 2025-08-07 20:39:55,617] Trial 1089 finished with value: 0.5511163532733917 and parameters: {'fp_type': 'morgan_rdkit', 'combined_morgan_radius': 3, 'combined_morgan_nBits': 1024, 'combined_rdkit_maxPath': 7, 'combined_rdkit_nBits': 1024, 'num_hidden_layers': 3, 'hidden_dim_0': 256, 'hidden_dim_1': 1024, 'hidden_dim_2': 64, 'kl_weight': 0.00029611499658850984, 'lr': 0.0040951428792352276, 'batch_size': 128, 'dropout_rate': 0.13267206854405272, 'prior_mu': -0.0038110227283833535, 'prior_sigma': 0.07729514333550493, 'normalization': 'layer'}. Best is trial 896 with value: 0.4533553242683411.
Generating morgan_rdkit fingerprints...
Generated fingerprints with 2048 features for 841 molecules
Trial 1088: 5-fold CV loss = 0.6587
[I 2025-08-07 20:40:13,090] Trial 1088 finished with value: 0.6587229013442993 and parameters: {'fp_type': 'morgan_rdkit', 'combined_morgan_radius': 3, 'combined_morgan_nBits': 1024, 'combined_rdkit_maxPath': 7, 'combined_rdkit_nBits': 1024, 'num_hidden_layers': 3, 'hidden_dim_0': 256, 'hidden_dim_1': 1024, 'hidden_dim_2': 512, 'kl_weight': 0.00037544569035169076, 'lr': 0.008258566208531654, 'batch_size': 128, 'dropout_rate': 0.138143618511084, 'prior_mu': -0.04273168564507965, 'prior_sigma': 0.11278986467184872, 'normalization': 'layer'}. Best is trial 896 with value: 0.4533553242683411.
Generating morgan_rdkit fingerprints...
Generated fingerprints with 2048 features for 841 molecules
Trial 1094: 5-fold CV loss = 1.4419
[I 2025-08-07 20:40:19,610] Trial 1094 finished with value: 1.4419144153594972 and parameters: {'fp_type': 'morgan_rdkit', 'combined_morgan_radius': 3, 'combined_morgan_nBits': 1024, 'combined_rdkit_maxPath': 7, 'combined_rdkit_nBits': 1024, 'num_hidden_layers': 0, 'kl_weight': 0.00043883944274005187, 'lr': 0.005001483750780813, 'batch_size': 64, 'dropout_rate': 0.15391665399777177, 'prior_mu': 0.008639684983577183, 'prior_sigma': 0.11256594939745564, 'normalization': 'layer'}. Best is trial 896 with value: 0.4533553242683411.
Generating morgan_rdkit fingerprints...
Generated fingerprints with 2048 features for 841 molecules
Trial 1092: 5-fold CV loss = 0.7205
[I 2025-08-07 20:40:20,749] Trial 1092 finished with value: 0.7205262541770935 and parameters: {'fp_type': 'morgan_rdkit', 'combined_morgan_radius': 3, 'combined_morgan_nBits': 1024, 'combined_rdkit_maxPath': 7, 'combined_rdkit_nBits': 1024, 'num_hidden_layers': 3, 'hidden_dim_0': 256, 'hidden_dim_1': 1024, 'hidden_dim_2': 64, 'kl_weight': 0.0002953647075031827, 'lr': 0.004146939336019866, 'batch_size': 128, 'dropout_rate': 0.1519526476112447, 'prior_mu': 0.01122491917019762, 'prior_sigma': 0.12641242016503088, 'normalization': 'layer'}. Best is trial 896 with value: 0.4533553242683411.
Generating morgan_rdkit fingerprints...
Generated fingerprints with 2048 features for 841 molecules
Trial 1093: 5-fold CV loss = 0.4675
[I 2025-08-07 20:40:37,205] Trial 1093 finished with value: 0.4675200581550598 and parameters: {'fp_type': 'morgan_rdkit', 'combined_morgan_radius': 3, 'combined_morgan_nBits': 1024, 'combined_rdkit_maxPath': 7, 'combined_rdkit_nBits': 1024, 'num_hidden_layers': 3, 'hidden_dim_0': 256, 'hidden_dim_1': 1024, 'hidden_dim_2': 64, 'kl_weight': 0.0002810025226466527, 'lr': 0.005119396728856828, 'batch_size': 64, 'dropout_rate': 0.15107496235806436, 'prior_mu': -0.02937546135319516, 'prior_sigma': 0.07657581738110558, 'normalization': 'layer'}. Best is trial 896 with value: 0.4533553242683411.
Generating morgan_rdkit fingerprints...
Generated fingerprints with 2048 features for 841 molecules
Trial 1097: 5-fold CV loss = 0.4816
