[I 2025-08-07 18:53:11,438] Trial 556 finished with value: 0.4825965821743011 and parameters: {'fp_type': 'morgan_rdkit', 'combined_morgan_radius': 3, 'combined_morgan_nBits': 1024, 'combined_rdkit_maxPath': 5, 'combined_rdkit_nBits': 1024, 'num_hidden_layers': 3, 'hidden_dim_0': 256, 'hidden_dim_1': 1024, 'hidden_dim_2': 64, 'kl_weight': 0.00042397666167433756, 'lr': 0.0065265521031965335, 'batch_size': 128, 'dropout_rate': 0.15036941461579273, 'prior_mu': -0.011248319535007587, 'prior_sigma': 0.09592699776114805, 'normalization': 'layer'}. Best is trial 505 with value: 0.4575017273426056.
Generating morgan_rdkit fingerprints...
Generated fingerprints with 2048 features for 841 molecules
Trial 557: 5-fold CV loss = 0.4814
[I 2025-08-07 18:53:18,337] Trial 557 finished with value: 0.4813860714435577 and parameters: {'fp_type': 'morgan_rdkit', 'combined_morgan_radius': 3, 'combined_morgan_nBits': 1024, 'combined_rdkit_maxPath': 5, 'combined_rdkit_nBits': 1024, 'num_hidden_layers': 3, 'hidden_dim_0': 256, 'hidden_dim_1': 1024, 'hidden_dim_2': 128, 'kl_weight': 0.00045349090014725965, 'lr': 0.0062827199148200825, 'batch_size': 128, 'dropout_rate': 0.15741528524600149, 'prior_mu': -0.009223524818219612, 'prior_sigma': 0.09390043531954366, 'normalization': 'layer'}. Best is trial 505 with value: 0.4575017273426056.
Generating morgan_rdkit fingerprints...
Generated fingerprints with 2048 features for 841 molecules
Trial 558: 5-fold CV loss = 0.5516
[I 2025-08-07 18:53:42,718] Trial 558 finished with value: 0.5516112744808197 and parameters: {'fp_type': 'morgan_rdkit', 'combined_morgan_radius': 3, 'combined_morgan_nBits': 1024, 'combined_rdkit_maxPath': 5, 'combined_rdkit_nBits': 1024, 'num_hidden_layers': 3, 'hidden_dim_0': 256, 'hidden_dim_1': 1024, 'hidden_dim_2': 128, 'kl_weight': 0.0004993175057967423, 'lr': 0.006698392396400324, 'batch_size': 128, 'dropout_rate': 0.16202442694821714, 'prior_mu': -0.009557464450865829, 'prior_sigma': 0.09533687760353768, 'normalization': 'none'}. Best is trial 505 with value: 0.4575017273426056.
Generating morgan_rdkit fingerprints...
Generated fingerprints with 2048 features for 841 molecules
Trial 559: 5-fold CV loss = 0.6341
[I 2025-08-07 18:53:51,138] Trial 559 finished with value: 0.6340631365776062 and parameters: {'fp_type': 'morgan_rdkit', 'combined_morgan_radius': 3, 'combined_morgan_nBits': 1024, 'combined_rdkit_maxPath': 7, 'combined_rdkit_nBits': 1024, 'num_hidden_layers': 3, 'hidden_dim_0': 256, 'hidden_dim_1': 1024, 'hidden_dim_2': 128, 'kl_weight': 0.0004236092874129929, 'lr': 0.006525362667501609, 'batch_size': 128, 'dropout_rate': 0.15728227388431343, 'prior_mu': -0.02273333207792825, 'prior_sigma': 0.09403340040013256, 'normalization': 'none'}. Best is trial 505 with value: 0.4575017273426056.
Generating morgan_rdkit fingerprints...
Generated fingerprints with 2048 features for 841 molecules
Trial 560: 5-fold CV loss = 0.4690
[I 2025-08-07 18:54:07,417] Trial 560 finished with value: 0.46896634101867674 and parameters: {'fp_type': 'morgan_rdkit', 'combined_morgan_radius': 3, 'combined_morgan_nBits': 1024, 'combined_rdkit_maxPath': 7, 'combined_rdkit_nBits': 1024, 'num_hidden_layers': 3, 'hidden_dim_0': 256, 'hidden_dim_1': 1024, 'hidden_dim_2': 64, 'kl_weight': 0.0006546627761450151, 'lr': 0.006752107216320992, 'batch_size': 128, 'dropout_rate': 0.13443804258839134, 'prior_mu': -0.021081424691435865, 'prior_sigma': 0.09938971993153944, 'normalization': 'layer'}. Best is trial 505 with value: 0.4575017273426056.
Generating morgan_rdkit fingerprints...
Generated fingerprints with 2048 features for 841 molecules
Trial 555: 5-fold CV loss = 0.4637
[I 2025-08-07 18:54:24,318] Trial 555 finished with value: 0.4636632323265076 and parameters: {'fp_type': 'morgan_rdkit', 'combined_morgan_radius': 3, 'combined_morgan_nBits': 1024, 'combined_rdkit_maxPath': 7, 'combined_rdkit_nBits': 1024, 'num_hidden_layers': 3, 'hidden_dim_0': 256, 'hidden_dim_1': 1024, 'hidden_dim_2': 64, 'kl_weight': 0.0004403605807833072, 'lr': 0.006704214565091197, 'batch_size': 128, 'dropout_rate': 0.13926299536351408, 'prior_mu': -0.02157547392849428, 'prior_sigma': 0.09459373208148317, 'normalization': 'layer'}. Best is trial 505 with value: 0.4575017273426056.
Generating morgan_rdkit fingerprints...
Generated fingerprints with 2048 features for 841 molecules
Trial 562: 5-fold CV loss = 0.4707
[I 2025-08-07 18:54:30,556] Trial 562 finished with value: 0.47073270082473756 and parameters: {'fp_type': 'morgan_rdkit', 'combined_morgan_radius': 3, 'combined_morgan_nBits': 1024, 'combined_rdkit_maxPath': 7, 'combined_rdkit_nBits': 1024, 'num_hidden_layers': 3, 'hidden_dim_0': 256, 'hidden_dim_1': 1024, 'hidden_dim_2': 64, 'kl_weight': 0.0006532227137913204, 'lr': 0.005492490392201985, 'batch_size': 128, 'dropout_rate': 0.13579149976960497, 'prior_mu': -0.025007163063802545, 'prior_sigma': 0.1007335066279553, 'normalization': 'layer'}. Best is trial 505 with value: 0.4575017273426056.
Generating morgan_rdkit fingerprints...
Generated fingerprints with 2048 features for 841 molecules
Trial 561: 5-fold CV loss = 0.4691
[I 2025-08-07 18:54:45,343] Trial 561 finished with value: 0.4690873742103577 and parameters: {'fp_type': 'morgan_rdkit', 'combined_morgan_radius': 3, 'combined_morgan_nBits': 1024, 'combined_rdkit_maxPath': 7, 'combined_rdkit_nBits': 1024, 'num_hidden_layers': 3, 'hidden_dim_0': 256, 'hidden_dim_1': 1024, 'hidden_dim_2': 64, 'kl_weight': 0.0004104882171779544, 'lr': 0.0054766195095136945, 'batch_size': 128, 'dropout_rate': 0.1351692055679306, 'prior_mu': -0.022701257402040355, 'prior_sigma': 0.10109658879847641, 'normalization': 'layer'}. Best is trial 505 with value: 0.4575017273426056.
Generating morgan_rdkit fingerprints...
Generated fingerprints with 2048 features for 841 molecules
Trial 563: 5-fold CV loss = 0.4671
[I 2025-08-07 18:54:57,446] Trial 563 finished with value: 0.46712720990180967 and parameters: {'fp_type': 'morgan_rdkit', 'combined_morgan_radius': 3, 'combined_morgan_nBits': 1024, 'combined_rdkit_maxPath': 7, 'combined_rdkit_nBits': 1024, 'num_hidden_layers': 3, 'hidden_dim_0': 256, 'hidden_dim_1': 1024, 'hidden_dim_2': 64, 'kl_weight': 0.00036241298149291125, 'lr': 0.005555335046115477, 'batch_size': 128, 'dropout_rate': 0.16466183070276907, 'prior_mu': -0.027570491357343917, 'prior_sigma': 0.10269648321840791, 'normalization': 'layer'}. Best is trial 505 with value: 0.4575017273426056.
Generating morgan_rdkit fingerprints...
Generated fingerprints with 2048 features for 841 molecules
Trial 565: 5-fold CV loss = 0.4599
[I 2025-08-07 18:55:13,588] Trial 565 finished with value: 0.4598796248435974 and parameters: {'fp_type': 'morgan_rdkit', 'combined_morgan_radius': 3, 'combined_morgan_nBits': 1024, 'combined_rdkit_maxPath': 7, 'combined_rdkit_nBits': 1024, 'num_hidden_layers': 3, 'hidden_dim_0': 256, 'hidden_dim_1': 1024, 'hidden_dim_2': 64, 'kl_weight': 0.0003837907509052881, 'lr': 0.005465811428124996, 'batch_size': 128, 'dropout_rate': 0.11573432126999292, 'prior_mu': -0.04709177102872957, 'prior_sigma': 0.10310873192409434, 'normalization': 'layer'}. Best is trial 505 with value: 0.4575017273426056.
Generating morgan_rdkit fingerprints...
Generated fingerprints with 2048 features for 841 molecules
Trial 566: 5-fold CV loss = 0.6577
[I 2025-08-07 18:55:26,685] Trial 566 finished with value: 0.6576711952686309 and parameters: {'fp_type': 'morgan_rdkit', 'combined_morgan_radius': 3, 'combined_morgan_nBits': 1024, 'combined_rdkit_maxPath': 8, 'combined_rdkit_nBits': 1024, 'num_hidden_layers': 3, 'hidden_dim_0': 256, 'hidden_dim_1': 1024, 'hidden_dim_2': 64, 'kl_weight': 0.0005241447858939512, 'lr': 0.008408311428801923, 'batch_size': 128, 'dropout_rate': 0.11519277102739606, 'prior_mu': -0.031683842470389446, 'prior_sigma': 0.10572353386934535, 'normalization': 'layer'}. Best is trial 505 with value: 0.4575017273426056.
Generating morgan_rdkit fingerprints...
Generated fingerprints with 2048 features for 841 molecules
Trial 567: 5-fold CV loss = 0.4893
[I 2025-08-07 18:55:49,119] Trial 567 finished with value: 0.48927862048149107 and parameters: {'fp_type': 'morgan_rdkit', 'combined_morgan_radius': 3, 'combined_morgan_nBits': 1024, 'combined_rdkit_maxPath': 8, 'combined_rdkit_nBits': 1024, 'num_hidden_layers': 3, 'hidden_dim_0': 256, 'hidden_dim_1': 1024, 'hidden_dim_2': 64, 'kl_weight': 0.00037366215399222373, 'lr': 0.00827564413564615, 'batch_size': 128, 'dropout_rate': 0.1205339487540198, 'prior_mu': -0.04387299222232206, 'prior_sigma': 0.10302864885098431, 'normalization': 'layer'}. Best is trial 505 with value: 0.4575017273426056.
Generating morgan_rdkit fingerprints...
Generated fingerprints with 2048 features for 841 molecules
Trial 568: 5-fold CV loss = 0.5486
[I 2025-08-07 18:55:54,713] Trial 568 finished with value: 0.5486416041851043 and parameters: {'fp_type': 'morgan_rdkit', 'combined_morgan_radius': 3, 'combined_morgan_nBits': 1024, 'combined_rdkit_maxPath': 8, 'combined_rdkit_nBits': 1024, 'num_hidden_layers': 3, 'hidden_dim_0': 256, 'hidden_dim_1': 1024, 'hidden_dim_2': 64, 'kl_weight': 0.00047144259183744323, 'lr': 0.007759702900843987, 'batch_size': 128, 'dropout_rate': 0.11507436653374867, 'prior_mu': -0.03465563434841272, 'prior_sigma': 0.10499648516688972, 'normalization': 'layer'}. Best is trial 505 with value: 0.4575017273426056.
Generating morgan_rdkit fingerprints...
Generated fingerprints with 2048 features for 841 molecules
Trial 569: 5-fold CV loss = 0.6307
[I 2025-08-07 18:56:03,990] Trial 569 finished with value: 0.6306736648082734 and parameters: {'fp_type': 'morgan_rdkit', 'combined_morgan_radius': 3, 'combined_morgan_nBits': 1024, 'combined_rdkit_maxPath': 7, 'combined_rdkit_nBits': 1024, 'num_hidden_layers': 3, 'hidden_dim_0': 256, 'hidden_dim_1': 1024, 'hidden_dim_2': 64, 'kl_weight': 0.0004240884851032589, 'lr': 0.007369689904679473, 'batch_size': 128, 'dropout_rate': 0.10561813470076811, 'prior_mu': -0.0560064480131867, 'prior_sigma': 0.09675061951750791, 'normalization': 'layer'}. Best is trial 505 with value: 0.4575017273426056.
Generating morgan_rdkit fingerprints...
Generated fingerprints with 2048 features for 841 molecules
Trial 564: 5-fold CV loss = 0.6492
[I 2025-08-07 18:56:07,760] Trial 564 finished with value: 0.6491643011569976 and parameters: {'fp_type': 'morgan_rdkit', 'combined_morgan_radius': 3, 'combined_morgan_nBits': 1024, 'combined_rdkit_maxPath': 8, 'combined_rdkit_nBits': 1024, 'num_hidden_layers': 3, 'hidden_dim_0': 256, 'hidden_dim_1': 1024, 'hidden_dim_2': 64, 'kl_weight': 0.000523277016815509, 'lr': 0.005416503638128164, 'batch_size': 128, 'dropout_rate': 0.1120677001273796, 'prior_mu': -0.028517531554211765, 'prior_sigma': 0.10089847524127685, 'normalization': 'layer'}. Best is trial 505 with value: 0.4575017273426056.
Generating morgan fingerprints...
Generated fingerprints with 1024 features for 841 molecules
Trial 570: 5-fold CV loss = 0.5526
[I 2025-08-07 18:56:30,075] Trial 570 finished with value: 0.5526302695274353 and parameters: {'fp_type': 'morgan_rdkit', 'combined_morgan_radius': 3, 'combined_morgan_nBits': 1024, 'combined_rdkit_maxPath': 7, 'combined_rdkit_nBits': 1024, 'num_hidden_layers': 3, 'hidden_dim_0': 256, 'hidden_dim_1': 1024, 'hidden_dim_2': 64, 'kl_weight': 0.0004993986789755052, 'lr': 0.00751865777543517, 'batch_size': 128, 'dropout_rate': 0.111709715314592, 'prior_mu': -0.04595235522289, 'prior_sigma': 0.09767069339641338, 'normalization': 'layer'}. Best is trial 505 with value: 0.4575017273426056.
Generating morgan_rdkit fingerprints...
Generated fingerprints with 2048 features for 841 molecules
Trial 571: 5-fold CV loss = 0.5362
[I 2025-08-07 18:56:32,583] Trial 571 finished with value: 0.5362110614776612 and parameters: {'fp_type': 'morgan_rdkit', 'combined_morgan_radius': 3, 'combined_morgan_nBits': 1024, 'combined_rdkit_maxPath': 7, 'combined_rdkit_nBits': 1024, 'num_hidden_layers': 3, 'hidden_dim_0': 256, 'hidden_dim_1': 1024, 'hidden_dim_2': 64, 'kl_weight': 0.00040098553326042954, 'lr': 0.005072269356403911, 'batch_size': 128, 'dropout_rate': 0.10039077860121502, 'prior_mu': -0.0548787256305841, 'prior_sigma': 0.09706179600741134, 'normalization': 'layer'}. Best is trial 505 with value: 0.4575017273426056.
Generating morgan_rdkit fingerprints...
Generated fingerprints with 2048 features for 841 molecules
Trial 573: 5-fold CV loss = 0.5372
[I 2025-08-07 18:56:57,931] Trial 573 finished with value: 0.537215381860733 and parameters: {'fp_type': 'morgan', 'morgan_only_radius': 3, 'morgan_only_nBits': 1024, 'num_hidden_layers': 3, 'hidden_dim_0': 256, 'hidden_dim_1': 1024, 'hidden_dim_2': 64, 'kl_weight': 0.0003626382275886335, 'lr': 0.005017128223527953, 'batch_size': 128, 'dropout_rate': 0.13088265935470603, 'prior_mu': -0.04429797835611298, 'prior_sigma': 0.09236891728508884, 'normalization': 'layer'}. Best is trial 505 with value: 0.4575017273426056.
Generating morgan_rdkit fingerprints...
Generated fingerprints with 2048 features for 841 molecules
Trial 572: 5-fold CV loss = 0.4675
[I 2025-08-07 18:57:02,860] Trial 572 finished with value: 0.4674913823604584 and parameters: {'fp_type': 'morgan_rdkit', 'combined_morgan_radius': 3, 'combined_morgan_nBits': 1024, 'combined_rdkit_maxPath': 7, 'combined_rdkit_nBits': 1024, 'num_hidden_layers': 3, 'hidden_dim_0': 256, 'hidden_dim_1': 1024, 'hidden_dim_2': 64, 'kl_weight': 0.00034335117380026724, 'lr': 0.005356637778526661, 'batch_size': 128, 'dropout_rate': 0.12804943602748406, 'prior_mu': -0.045455131731491544, 'prior_sigma': 0.09235312846256756, 'normalization': 'layer'}. Best is trial 505 with value: 0.4575017273426056.
Generating morgan_rdkit fingerprints...
Generated fingerprints with 2048 features for 841 molecules
Trial 575: 5-fold CV loss = 0.4641
[I 2025-08-07 18:57:11,000] Trial 575 finished with value: 0.4640897631645203 and parameters: {'fp_type': 'morgan_rdkit', 'combined_morgan_radius': 3, 'combined_morgan_nBits': 1024, 'combined_rdkit_maxPath': 7, 'combined_rdkit_nBits': 1024, 'num_hidden_layers': 3, 'hidden_dim_0': 256, 'hidden_dim_1': 1024, 'hidden_dim_2': 64, 'kl_weight': 0.0002176750033214616, 'lr': 0.006115090481031966, 'batch_size': 128, 'dropout_rate': 0.12672498648294817, 'prior_mu': -0.01646135182220792, 'prior_sigma': 0.09238029632862249, 'normalization': 'layer'}. Best is trial 505 with value: 0.4575017273426056.
Generating morgan_rdkit fingerprints...
Generated fingerprints with 2048 features for 841 molecules
Trial 574: 5-fold CV loss = 0.4771
[I 2025-08-07 18:57:12,965] Trial 574 finished with value: 0.4771393597126007 and parameters: {'fp_type': 'morgan_rdkit', 'combined_morgan_radius': 3, 'combined_morgan_nBits': 1024, 'combined_rdkit_maxPath': 6, 'combined_rdkit_nBits': 1024, 'num_hidden_layers': 3, 'hidden_dim_0': 256, 'hidden_dim_1': 1024, 'hidden_dim_2': 64, 'kl_weight': 0.00034406946899242943, 'lr': 0.004927396317072938, 'batch_size': 128, 'dropout_rate': 0.1302148249909406, 'prior_mu': -0.017233111964017153, 'prior_sigma': 0.09287815341346514, 'normalization': 'layer'}. Best is trial 505 with value: 0.4575017273426056.
Generating morgan_rdkit fingerprints...
Generated fingerprints with 2048 features for 841 molecules
Trial 578: 5-fold CV loss = 0.4679
[I 2025-08-07 18:57:45,953] Trial 578 finished with value: 0.4678549826145172 and parameters: {'fp_type': 'morgan_rdkit', 'combined_morgan_radius': 3, 'combined_morgan_nBits': 1024, 'combined_rdkit_maxPath': 6, 'combined_rdkit_nBits': 1024, 'num_hidden_layers': 3, 'hidden_dim_0': 256, 'hidden_dim_1': 1024, 'hidden_dim_2': 64, 'kl_weight': 0.00021282316592709667, 'lr': 0.0063453372779738795, 'batch_size': 128, 'dropout_rate': 0.14082016039748413, 'prior_mu': -0.017943179652724874, 'prior_sigma': 0.09214865442293182, 'normalization': 'layer'}. Best is trial 505 with value: 0.4575017273426056.
Generating morgan_rdkit fingerprints...
Generated fingerprints with 2048 features for 841 molecules
Trial 579: 5-fold CV loss = 0.5558
[I 2025-08-07 18:57:52,479] Trial 579 finished with value: 0.5558016419410705 and parameters: {'fp_type': 'morgan_rdkit', 'combined_morgan_radius': 3, 'combined_morgan_nBits': 1024, 'combined_rdkit_maxPath': 7, 'combined_rdkit_nBits': 1024, 'num_hidden_layers': 3, 'hidden_dim_0': 256, 'hidden_dim_1': 1024, 'hidden_dim_2': 64, 'kl_weight': 0.00021537164397792202, 'lr': 0.006337042076512265, 'batch_size': 128, 'dropout_rate': 0.13997180119380243, 'prior_mu': -0.01580234762502828, 'prior_sigma': 0.1083472107297503, 'normalization': 'layer'}. Best is trial 505 with value: 0.4575017273426056.
Generating morgan_rdkit fingerprints...
Generated fingerprints with 2048 features for 841 molecules
Trial 577: 5-fold CV loss = 0.4657
[I 2025-08-07 18:57:58,394] Trial 577 finished with value: 0.4656682014465332 and parameters: {'fp_type': 'morgan_rdkit', 'combined_morgan_radius': 3, 'combined_morgan_nBits': 1024, 'combined_rdkit_maxPath': 7, 'combined_rdkit_nBits': 1024, 'num_hidden_layers': 3, 'hidden_dim_0': 256, 'hidden_dim_1': 1024, 'hidden_dim_2': 64, 'kl_weight': 0.0003213428098671711, 'lr': 0.006488696957393194, 'batch_size': 128, 'dropout_rate': 0.13939194444459158, 'prior_mu': -0.01751744173252688, 'prior_sigma': 0.08594138620290402, 'normalization': 'layer'}. Best is trial 505 with value: 0.4575017273426056.
Generating morgan_rdkit fingerprints...
Generated fingerprints with 2048 features for 841 molecules
Trial 580: 5-fold CV loss = 0.4687
[I 2025-08-07 18:58:27,772] Trial 580 finished with value: 0.4686614215373993 and parameters: {'fp_type': 'morgan_rdkit', 'combined_morgan_radius': 3, 'combined_morgan_nBits': 1024, 'combined_rdkit_maxPath': 7, 'combined_rdkit_nBits': 1024, 'num_hidden_layers': 3, 'hidden_dim_0': 256, 'hidden_dim_1': 1024, 'hidden_dim_2': 64, 'kl_weight': 0.00043494101464004124, 'lr': 0.005893832873278433, 'batch_size': 128, 'dropout_rate': 0.16518496123309845, 'prior_mu': -0.012925097761354002, 'prior_sigma': 0.1089093459886591, 'normalization': 'layer'}. Best is trial 505 with value: 0.4575017273426056.
Generating rdkit fingerprints...
Generated fingerprints with 1024 features for 841 molecules
Trial 581: 5-fold CV loss = 0.4681
[I 2025-08-07 18:58:33,763] Trial 581 finished with value: 0.4680829346179962 and parameters: {'fp_type': 'morgan_rdkit', 'combined_morgan_radius': 3, 'combined_morgan_nBits': 1024, 'combined_rdkit_maxPath': 7, 'combined_rdkit_nBits': 1024, 'num_hidden_layers': 3, 'hidden_dim_0': 256, 'hidden_dim_1': 1024, 'hidden_dim_2': 64, 'kl_weight': 0.00032048823953320334, 'lr': 0.0058976348120067515, 'batch_size': 128, 'dropout_rate': 0.16585052693384983, 'prior_mu': -0.009534949499804475, 'prior_sigma': 0.08662978348464401, 'normalization': 'layer'}. Best is trial 505 with value: 0.4575017273426056.
Generating morgan_rdkit fingerprints...
Generated fingerprints with 2048 features for 841 molecules
Trial 576: 5-fold CV loss = 0.4645
[I 2025-08-07 18:58:39,091] Trial 576 finished with value: 0.46452654600143434 and parameters: {'fp_type': 'morgan_rdkit', 'combined_morgan_radius': 3, 'combined_morgan_nBits': 1024, 'combined_rdkit_maxPath': 7, 'combined_rdkit_nBits': 1024, 'num_hidden_layers': 3, 'hidden_dim_0': 256, 'hidden_dim_1': 1024, 'hidden_dim_2': 64, 'kl_weight': 0.0003327891166129701, 'lr': 0.006286632269414626, 'batch_size': 128, 'dropout_rate': 0.14250702839185003, 'prior_mu': -0.014186554969772, 'prior_sigma': 0.09167964864143263, 'normalization': 'layer'}. Best is trial 505 with value: 0.4575017273426056.
Generating rdkit fingerprints...
Generated fingerprints with 1024 features for 841 molecules
Trial 582: 5-fold CV loss = 0.5420
[I 2025-08-07 18:58:54,316] Trial 582 finished with value: 0.542024302482605 and parameters: {'fp_type': 'morgan_rdkit', 'combined_morgan_radius': 3, 'combined_morgan_nBits': 1024, 'combined_rdkit_maxPath': 7, 'combined_rdkit_nBits': 1024, 'num_hidden_layers': 3, 'hidden_dim_0': 256, 'hidden_dim_1': 1024, 'hidden_dim_2': 64, 'kl_weight': 0.0004586356061821952, 'lr': 0.006875788562746301, 'batch_size': 128, 'dropout_rate': 0.1249438639557151, 'prior_mu': -0.06954979011096678, 'prior_sigma': 0.11672295194639414, 'normalization': 'layer'}. Best is trial 505 with value: 0.4575017273426056.
Generating rdkit fingerprints...
Generated fingerprints with 1024 features for 841 molecules
Trial 583: 5-fold CV loss = 0.7201
[I 2025-08-07 18:59:01,216] Trial 583 finished with value: 0.7201260983943939 and parameters: {'fp_type': 'rdkit', 'rdkit_only_maxPath': 8, 'rdkit_only_nBits': 1024, 'num_hidden_layers': 3, 'hidden_dim_0': 256, 'hidden_dim_1': 1024, 'hidden_dim_2': 64, 'kl_weight': 0.0002856787584716015, 'lr': 0.006658827941360885, 'batch_size': 128, 'dropout_rate': 0.12550238676541328, 'prior_mu': -0.06802436943436704, 'prior_sigma': 0.09684950314526973, 'normalization': 'layer'}. Best is trial 505 with value: 0.4575017273426056.
Generating morgan_rdkit fingerprints...
Generated fingerprints with 2048 features for 841 molecules
Trial 584: 5-fold CV loss = 0.5649
[I 2025-08-07 18:59:11,403] Trial 584 finished with value: 0.5648864328861236 and parameters: {'fp_type': 'morgan_rdkit', 'combined_morgan_radius': 3, 'combined_morgan_nBits': 1024, 'combined_rdkit_maxPath': 7, 'combined_rdkit_nBits': 1024, 'num_hidden_layers': 3, 'hidden_dim_0': 256, 'hidden_dim_1': 1024, 'hidden_dim_2': 64, 'kl_weight': 0.0002823474963392241, 'lr': 0.006659944783871516, 'batch_size': 128, 'dropout_rate': 0.12266798643427893, 'prior_mu': -0.022709145316856492, 'prior_sigma': 0.09834300334265864, 'normalization': 'layer'}. Best is trial 505 with value: 0.4575017273426056.
Generating morgan_rdkit fingerprints...
Generated fingerprints with 2048 features for 841 molecules
Trial 587: 5-fold CV loss = 0.4552
