[I 2025-08-07 21:33:51,950] Trial 1365 finished with value: 0.46705264449119566 and parameters: {'fp_type': 'morgan_rdkit', 'combined_morgan_radius': 3, 'combined_morgan_nBits': 1024, 'combined_rdkit_maxPath': 7, 'combined_rdkit_nBits': 1024, 'num_hidden_layers': 3, 'hidden_dim_0': 256, 'hidden_dim_1': 1024, 'hidden_dim_2': 64, 'kl_weight': 0.00045142966809358847, 'lr': 0.007106965812474263, 'batch_size': 128, 'dropout_rate': 0.15730938384036836, 'prior_mu': -0.039402773950069594, 'prior_sigma': 0.07418029775616242, 'normalization': 'layer'}. Best is trial 896 with value: 0.4533553242683411.
Generating morgan_rdkit fingerprints...
Generated fingerprints with 2048 features for 841 molecules
Trial 1366: 5-fold CV loss = 0.4781
[I 2025-08-07 21:34:01,038] Trial 1366 finished with value: 0.4780915200710297 and parameters: {'fp_type': 'morgan_rdkit', 'combined_morgan_radius': 3, 'combined_morgan_nBits': 1024, 'combined_rdkit_maxPath': 5, 'combined_rdkit_nBits': 1024, 'num_hidden_layers': 3, 'hidden_dim_0': 256, 'hidden_dim_1': 1024, 'hidden_dim_2': 64, 'kl_weight': 0.0005402718989033637, 'lr': 0.007488735275138646, 'batch_size': 128, 'dropout_rate': 0.16430668906240703, 'prior_mu': -0.06510290618584486, 'prior_sigma': 0.07475894926391037, 'normalization': 'layer'}. Best is trial 896 with value: 0.4533553242683411.
Generating morgan_rdkit fingerprints...
Generated fingerprints with 2048 features for 841 molecules
Trial 1368: 5-fold CV loss = 0.4855
[I 2025-08-07 21:34:08,860] Trial 1368 finished with value: 0.4855356812477112 and parameters: {'fp_type': 'morgan_rdkit', 'combined_morgan_radius': 3, 'combined_morgan_nBits': 1024, 'combined_rdkit_maxPath': 5, 'combined_rdkit_nBits': 1024, 'num_hidden_layers': 3, 'hidden_dim_0': 256, 'hidden_dim_1': 1024, 'hidden_dim_2': 64, 'kl_weight': 0.00017730847348160886, 'lr': 0.004705446941806129, 'batch_size': 64, 'dropout_rate': 0.18132855085920463, 'prior_mu': -0.18543944021939052, 'prior_sigma': 0.06075907679679478, 'normalization': 'layer'}. Best is trial 896 with value: 0.4533553242683411.
Generating morgan_rdkit fingerprints...
Generated fingerprints with 2048 features for 841 molecules
Trial 1367: 5-fold CV loss = 0.4829
[I 2025-08-07 21:34:31,971] Trial 1367 finished with value: 0.48285112380981443 and parameters: {'fp_type': 'morgan_rdkit', 'combined_morgan_radius': 3, 'combined_morgan_nBits': 1024, 'combined_rdkit_maxPath': 5, 'combined_rdkit_nBits': 1024, 'num_hidden_layers': 3, 'hidden_dim_0': 256, 'hidden_dim_1': 1024, 'hidden_dim_2': 64, 'kl_weight': 0.00019836052348874635, 'lr': 0.004606545160521537, 'batch_size': 128, 'dropout_rate': 0.16414800649095676, 'prior_mu': -0.17967733134130626, 'prior_sigma': 0.059875573288668, 'normalization': 'layer'}. Best is trial 896 with value: 0.4533553242683411.
Generating morgan_rdkit fingerprints...
Generated fingerprints with 2048 features for 841 molecules
Trial 1369: 5-fold CV loss = 0.4601
[I 2025-08-07 21:34:40,063] Trial 1369 finished with value: 0.46011751890182495 and parameters: {'fp_type': 'morgan_rdkit', 'combined_morgan_radius': 3, 'combined_morgan_nBits': 1024, 'combined_rdkit_maxPath': 7, 'combined_rdkit_nBits': 1024, 'num_hidden_layers': 3, 'hidden_dim_0': 256, 'hidden_dim_1': 1024, 'hidden_dim_2': 64, 'kl_weight': 0.00016019159789722813, 'lr': 0.004342922581879973, 'batch_size': 64, 'dropout_rate': 0.1930696677617482, 'prior_mu': 0.19537285766377602, 'prior_sigma': 0.07087151117299932, 'normalization': 'layer'}. Best is trial 896 with value: 0.4533553242683411.
Generating morgan_rdkit fingerprints...
Generated fingerprints with 2048 features for 841 molecules
Trial 1371: 5-fold CV loss = 0.4747
[I 2025-08-07 21:34:48,767] Trial 1371 finished with value: 0.4746570289134979 and parameters: {'fp_type': 'morgan_rdkit', 'combined_morgan_radius': 3, 'combined_morgan_nBits': 1024, 'combined_rdkit_maxPath': 7, 'combined_rdkit_nBits': 1024, 'num_hidden_layers': 3, 'hidden_dim_0': 256, 'hidden_dim_1': 1024, 'hidden_dim_2': 64, 'kl_weight': 0.0001907664843416848, 'lr': 0.004685004947349987, 'batch_size': 128, 'dropout_rate': 0.16992286608784407, 'prior_mu': 0.1988950636091882, 'prior_sigma': 0.06921519193149303, 'normalization': 'layer'}. Best is trial 896 with value: 0.4533553242683411.
Generating morgan_rdkit fingerprints...
Generated fingerprints with 2048 features for 841 molecules
Trial 1370: 5-fold CV loss = 0.4642
[I 2025-08-07 21:35:10,467] Trial 1370 finished with value: 0.4642429530620575 and parameters: {'fp_type': 'morgan_rdkit', 'combined_morgan_radius': 3, 'combined_morgan_nBits': 1024, 'combined_rdkit_maxPath': 7, 'combined_rdkit_nBits': 1024, 'num_hidden_layers': 3, 'hidden_dim_0': 256, 'hidden_dim_1': 1024, 'hidden_dim_2': 128, 'kl_weight': 0.00018133858226323293, 'lr': 0.0047452005137188814, 'batch_size': 64, 'dropout_rate': 0.18924542664923083, 'prior_mu': 0.18164062870818487, 'prior_sigma': 0.054415371914292486, 'normalization': 'layer'}. Best is trial 896 with value: 0.4533553242683411.
Generating morgan_rdkit fingerprints...
Generated fingerprints with 2048 features for 841 molecules
Trial 1373: 5-fold CV loss = 0.4675
[I 2025-08-07 21:35:19,627] Trial 1373 finished with value: 0.46749186515808105 and parameters: {'fp_type': 'morgan_rdkit', 'combined_morgan_radius': 3, 'combined_morgan_nBits': 1024, 'combined_rdkit_maxPath': 7, 'combined_rdkit_nBits': 1024, 'num_hidden_layers': 3, 'hidden_dim_0': 256, 'hidden_dim_1': 1024, 'hidden_dim_2': 128, 'kl_weight': 0.00020212798728882906, 'lr': 0.00458651128871363, 'batch_size': 128, 'dropout_rate': 0.16720320356422652, 'prior_mu': -0.04556438874434978, 'prior_sigma': 0.06319132878502767, 'normalization': 'layer'}. Best is trial 896 with value: 0.4533553242683411.
Generating morgan_rdkit fingerprints...
Generated fingerprints with 2048 features for 841 molecules
Trial 1374: 5-fold CV loss = 0.4640
[I 2025-08-07 21:35:32,238] Trial 1374 finished with value: 0.4640105187892914 and parameters: {'fp_type': 'morgan_rdkit', 'combined_morgan_radius': 3, 'combined_morgan_nBits': 1024, 'combined_rdkit_maxPath': 7, 'combined_rdkit_nBits': 1024, 'num_hidden_layers': 3, 'hidden_dim_0': 256, 'hidden_dim_1': 1024, 'hidden_dim_2': 64, 'kl_weight': 0.00021672674203043757, 'lr': 0.004427388825816547, 'batch_size': 128, 'dropout_rate': 0.16824986561084831, 'prior_mu': -0.054154056650926596, 'prior_sigma': 0.06420672898091886, 'normalization': 'layer'}. Best is trial 896 with value: 0.4533553242683411.
Generating morgan_rdkit fingerprints...
Generated fingerprints with 2048 features for 841 molecules
Trial 1376: 5-fold CV loss = 0.4669
[I 2025-08-07 21:35:56,036] Trial 1376 finished with value: 0.4668668985366821 and parameters: {'fp_type': 'morgan_rdkit', 'combined_morgan_radius': 3, 'combined_morgan_nBits': 1024, 'combined_rdkit_maxPath': 7, 'combined_rdkit_nBits': 1024, 'num_hidden_layers': 3, 'hidden_dim_0': 256, 'hidden_dim_1': 1024, 'hidden_dim_2': 64, 'kl_weight': 0.00022702774388568873, 'lr': 0.003854743210830499, 'batch_size': 128, 'dropout_rate': 0.15612458842386623, 'prior_mu': -0.12495601910258913, 'prior_sigma': 0.06742004372848959, 'normalization': 'layer'}. Best is trial 896 with value: 0.4533553242683411.
Generating morgan_rdkit fingerprints...
Generated fingerprints with 2048 features for 841 molecules
Trial 1375: 5-fold CV loss = 0.4615
[I 2025-08-07 21:36:03,423] Trial 1375 finished with value: 0.4614818811416626 and parameters: {'fp_type': 'morgan_rdkit', 'combined_morgan_radius': 3, 'combined_morgan_nBits': 1024, 'combined_rdkit_maxPath': 7, 'combined_rdkit_nBits': 1024, 'num_hidden_layers': 3, 'hidden_dim_0': 256, 'hidden_dim_1': 1024, 'hidden_dim_2': 64, 'kl_weight': 0.00015624969427960572, 'lr': 0.00429552438101907, 'batch_size': 128, 'dropout_rate': 0.155709735111607, 'prior_mu': -0.056687335743119335, 'prior_sigma': 0.06257574941752979, 'normalization': 'layer'}. Best is trial 896 with value: 0.4533553242683411.
Generating morgan_rdkit fingerprints...
Generated fingerprints with 2048 features for 841 molecules
Trial 1377: 5-fold CV loss = 0.4628
[I 2025-08-07 21:36:13,150] Trial 1377 finished with value: 0.4627677619457245 and parameters: {'fp_type': 'morgan_rdkit', 'combined_morgan_radius': 3, 'combined_morgan_nBits': 1024, 'combined_rdkit_maxPath': 7, 'combined_rdkit_nBits': 1024, 'num_hidden_layers': 3, 'hidden_dim_0': 256, 'hidden_dim_1': 1024, 'hidden_dim_2': 64, 'kl_weight': 0.00021619411791870514, 'lr': 0.00515635829614918, 'batch_size': 128, 'dropout_rate': 0.160423732271257, 'prior_mu': 0.1492242687973913, 'prior_sigma': 0.06402322973233007, 'normalization': 'layer'}. Best is trial 896 with value: 0.4533553242683411.
Generating morgan_rdkit fingerprints...
Generated fingerprints with 2048 features for 841 molecules
Trial 1372: 5-fold CV loss = 0.4603
[I 2025-08-07 21:36:22,635] Trial 1372 finished with value: 0.4602771520614624 and parameters: {'fp_type': 'morgan_rdkit', 'combined_morgan_radius': 3, 'combined_morgan_nBits': 1024, 'combined_rdkit_maxPath': 7, 'combined_rdkit_nBits': 1024, 'num_hidden_layers': 3, 'hidden_dim_0': 256, 'hidden_dim_1': 1024, 'hidden_dim_2': 128, 'kl_weight': 0.00015957938415184938, 'lr': 0.004165828179111738, 'batch_size': 128, 'dropout_rate': 0.15740161355505108, 'prior_mu': 0.16536791732068756, 'prior_sigma': 0.06319037863535523, 'normalization': 'layer'}. Best is trial 896 with value: 0.4533553242683411.
Generating morgan_rdkit fingerprints...
Generated fingerprints with 2048 features for 841 molecules
Trial 1378: 5-fold CV loss = 0.4667
[I 2025-08-07 21:36:34,642] Trial 1378 finished with value: 0.4666993021965027 and parameters: {'fp_type': 'morgan_rdkit', 'combined_morgan_radius': 3, 'combined_morgan_nBits': 1024, 'combined_rdkit_maxPath': 7, 'combined_rdkit_nBits': 1024, 'num_hidden_layers': 3, 'hidden_dim_0': 256, 'hidden_dim_1': 1024, 'hidden_dim_2': 64, 'kl_weight': 0.00017087264417621855, 'lr': 0.005232233639682648, 'batch_size': 128, 'dropout_rate': 0.15457668412862627, 'prior_mu': 0.11199894541332887, 'prior_sigma': 0.06419636874479065, 'normalization': 'layer'}. Best is trial 896 with value: 0.4533553242683411.
Generating morgan_rdkit fingerprints...
Generated fingerprints with 2048 features for 841 molecules
Trial 1379: 5-fold CV loss = 0.4642
[I 2025-08-07 21:36:54,603] Trial 1379 finished with value: 0.4642366349697113 and parameters: {'fp_type': 'morgan_rdkit', 'combined_morgan_radius': 3, 'combined_morgan_nBits': 1024, 'combined_rdkit_maxPath': 7, 'combined_rdkit_nBits': 1024, 'num_hidden_layers': 3, 'hidden_dim_0': 256, 'hidden_dim_1': 1024, 'hidden_dim_2': 64, 'kl_weight': 0.00021431705638039566, 'lr': 0.005314812859108851, 'batch_size': 128, 'dropout_rate': 0.17019265662117683, 'prior_mu': 0.1250975638221399, 'prior_sigma': 0.06649883786944892, 'normalization': 'layer'}. Best is trial 896 with value: 0.4533553242683411.
Generating morgan_rdkit fingerprints...
Generated fingerprints with 1280 features for 841 molecules
Trial 1380: 5-fold CV loss = 0.4606
[I 2025-08-07 21:37:01,163] Trial 1380 finished with value: 0.4606253743171692 and parameters: {'fp_type': 'morgan_rdkit', 'combined_morgan_radius': 3, 'combined_morgan_nBits': 1024, 'combined_rdkit_maxPath': 7, 'combined_rdkit_nBits': 1024, 'num_hidden_layers': 3, 'hidden_dim_0': 256, 'hidden_dim_1': 1024, 'hidden_dim_2': 64, 'kl_weight': 0.00017604868286019929, 'lr': 0.005333449989518216, 'batch_size': 128, 'dropout_rate': 0.15101150108689146, 'prior_mu': 0.15879048405537055, 'prior_sigma': 0.06917487394539976, 'normalization': 'layer'}. Best is trial 896 with value: 0.4533553242683411.
Generating morgan_rdkit fingerprints...
Generated fingerprints with 2048 features for 841 molecules
Trial 1382: 5-fold CV loss = 0.4688
[I 2025-08-07 21:37:08,455] Trial 1382 finished with value: 0.4687995374202728 and parameters: {'fp_type': 'morgan_rdkit', 'combined_morgan_radius': 3, 'combined_morgan_nBits': 1024, 'combined_rdkit_maxPath': 7, 'combined_rdkit_nBits': 1024, 'num_hidden_layers': 3, 'hidden_dim_0': 256, 'hidden_dim_1': 1024, 'hidden_dim_2': 64, 'kl_weight': 0.00022387529025225884, 'lr': 0.005032674290200122, 'batch_size': 128, 'dropout_rate': 0.1721740795461595, 'prior_mu': -0.03230555597774414, 'prior_sigma': 0.05908297078174794, 'normalization': 'layer'}. Best is trial 896 with value: 0.4533553242683411.
Generating morgan_rdkit fingerprints...
Generated fingerprints with 1280 features for 841 molecules
Trial 1383: 5-fold CV loss = 0.8364
[I 2025-08-07 21:37:19,492] Trial 1383 finished with value: 0.8363880276679992 and parameters: {'fp_type': 'morgan_rdkit', 'combined_morgan_radius': 3, 'combined_morgan_nBits': 1024, 'combined_rdkit_maxPath': 7, 'combined_rdkit_nBits': 256, 'num_hidden_layers': 3, 'hidden_dim_0': 512, 'hidden_dim_1': 1024, 'hidden_dim_2': 512, 'kl_weight': 0.00019419427073017956, 'lr': 0.00012009173943932687, 'batch_size': 128, 'dropout_rate': 0.1869222815521816, 'prior_mu': 0.15264677833341075, 'prior_sigma': 0.058493967514771025, 'normalization': 'layer'}. Best is trial 896 with value: 0.4533553242683411.
Generating morgan fingerprints...
Generated fingerprints with 2048 features for 841 molecules
Trial 1381: 5-fold CV loss = 0.5533
[I 2025-08-07 21:37:31,909] Trial 1381 finished with value: 0.5533027946949005 and parameters: {'fp_type': 'morgan_rdkit', 'combined_morgan_radius': 3, 'combined_morgan_nBits': 1024, 'combined_rdkit_maxPath': 7, 'combined_rdkit_nBits': 1024, 'num_hidden_layers': 3, 'hidden_dim_0': 512, 'hidden_dim_1': 1024, 'hidden_dim_2': 64, 'kl_weight': 0.000226091493129972, 'lr': 0.005445450700176764, 'batch_size': 128, 'dropout_rate': 0.15069978909371737, 'prior_mu': 0.117230211062513, 'prior_sigma': 0.06649212295739998, 'normalization': 'layer'}. Best is trial 896 with value: 0.4533553242683411.
Generating morgan fingerprints...
Generated fingerprints with 2048 features for 841 molecules
Trial 1385: 5-fold CV loss = 0.5149
[I 2025-08-07 21:37:36,375] Trial 1385 finished with value: 0.5149386405944825 and parameters: {'fp_type': 'morgan_rdkit', 'combined_morgan_radius': 3, 'combined_morgan_nBits': 1024, 'combined_rdkit_maxPath': 7, 'combined_rdkit_nBits': 256, 'num_hidden_layers': 3, 'hidden_dim_0': 512, 'hidden_dim_1': 1024, 'hidden_dim_2': 64, 'kl_weight': 0.00023342792171783717, 'lr': 0.005759289561685381, 'batch_size': 128, 'dropout_rate': 0.14752467919546744, 'prior_mu': 0.13332158001704172, 'prior_sigma': 0.07297500125156559, 'normalization': 'layer'}. Best is trial 896 with value: 0.4533553242683411.
Generating morgan fingerprints...
Generated fingerprints with 2048 features for 841 molecules
Trial 1384: 5-fold CV loss = 0.4613
[I 2025-08-07 21:37:39,673] Trial 1384 finished with value: 0.4612655520439148 and parameters: {'fp_type': 'morgan_rdkit', 'combined_morgan_radius': 3, 'combined_morgan_nBits': 1024, 'combined_rdkit_maxPath': 7, 'combined_rdkit_nBits': 1024, 'num_hidden_layers': 3, 'hidden_dim_0': 512, 'hidden_dim_1': 1024, 'hidden_dim_2': 64, 'kl_weight': 0.0002274200812283366, 'lr': 0.005813672503816911, 'batch_size': 128, 'dropout_rate': 0.1445884931028355, 'prior_mu': 0.17671361489367765, 'prior_sigma': 0.07256461462881184, 'normalization': 'layer'}. Best is trial 896 with value: 0.4533553242683411.
Generating morgan_rdkit fingerprints...
Generated fingerprints with 2048 features for 841 molecules
Trial 1386: 5-fold CV loss = 0.5208
[I 2025-08-07 21:37:48,141] Trial 1386 finished with value: 0.5208422780036926 and parameters: {'fp_type': 'morgan', 'morgan_only_radius': 3, 'morgan_only_nBits': 2048, 'num_hidden_layers': 3, 'hidden_dim_0': 256, 'hidden_dim_1': 1024, 'hidden_dim_2': 64, 'kl_weight': 0.00024175877379048843, 'lr': 0.005690850409146574, 'batch_size': 128, 'dropout_rate': 0.14881873724530692, 'prior_mu': -0.16185099072931944, 'prior_sigma': 0.07187224402131173, 'normalization': 'layer'}. Best is trial 896 with value: 0.4533553242683411.
Generating morgan_rdkit fingerprints...
Generated fingerprints with 2048 features for 841 molecules
Trial 1388: 5-fold CV loss = 0.5140
[I 2025-08-07 21:37:57,337] Trial 1388 finished with value: 0.5140306353569031 and parameters: {'fp_type': 'morgan', 'morgan_only_radius': 3, 'morgan_only_nBits': 2048, 'num_hidden_layers': 3, 'hidden_dim_0': 256, 'hidden_dim_1': 1024, 'hidden_dim_2': 64, 'kl_weight': 0.00024219069191432798, 'lr': 0.0059201229787241945, 'batch_size': 128, 'dropout_rate': 0.1680002484087547, 'prior_mu': 0.13538460900372712, 'prior_sigma': 0.07568589337554482, 'normalization': 'layer'}. Best is trial 896 with value: 0.4533553242683411.
Generating morgan_rdkit fingerprints...
Generated fingerprints with 2048 features for 841 molecules
Trial 1389: 5-fold CV loss = 0.6491
[I 2025-08-07 21:38:12,126] Trial 1389 finished with value: 0.6490741789340972 and parameters: {'fp_type': 'morgan_rdkit', 'combined_morgan_radius': 3, 'combined_morgan_nBits': 1024, 'combined_rdkit_maxPath': 7, 'combined_rdkit_nBits': 1024, 'num_hidden_layers': 3, 'hidden_dim_0': 256, 'hidden_dim_1': 1024, 'hidden_dim_2': 64, 'kl_weight': 0.00018998170020369134, 'lr': 0.005884054041959109, 'batch_size': 128, 'dropout_rate': 0.1632192538939093, 'prior_mu': 0.1721524629044728, 'prior_sigma': 0.07651313220164602, 'normalization': 'none'}. Best is trial 896 with value: 0.4533553242683411.
Generating morgan_rdkit fingerprints...
Generated fingerprints with 2048 features for 841 molecules
Trial 1387: 5-fold CV loss = 0.5286
[I 2025-08-07 21:38:15,751] Trial 1387 finished with value: 0.5285622894763946 and parameters: {'fp_type': 'morgan', 'morgan_only_radius': 3, 'morgan_only_nBits': 2048, 'num_hidden_layers': 3, 'hidden_dim_0': 256, 'hidden_dim_1': 1024, 'hidden_dim_2': 64, 'kl_weight': 0.0016092606927810853, 'lr': 0.005833862387345993, 'batch_size': 128, 'dropout_rate': 0.14642254714351471, 'prior_mu': -0.045410549618589494, 'prior_sigma': 0.0717359421853006, 'normalization': 'layer'}. Best is trial 896 with value: 0.4533553242683411.
Generating morgan_rdkit fingerprints...
Generated fingerprints with 2048 features for 841 molecules
Trial 1391: 5-fold CV loss = 0.4655
[I 2025-08-07 21:38:33,287] Trial 1391 finished with value: 0.4654514312744141 and parameters: {'fp_type': 'morgan_rdkit', 'combined_morgan_radius': 3, 'combined_morgan_nBits': 1024, 'combined_rdkit_maxPath': 7, 'combined_rdkit_nBits': 1024, 'num_hidden_layers': 3, 'hidden_dim_0': 256, 'hidden_dim_1': 1024, 'hidden_dim_2': 64, 'kl_weight': 0.00018286901941722602, 'lr': 0.006203846186760239, 'batch_size': 128, 'dropout_rate': 0.158899733001037, 'prior_mu': -0.04422315832849665, 'prior_sigma': 0.07863704249617952, 'normalization': 'layer'}. Best is trial 896 with value: 0.4533553242683411.
Generating morgan_rdkit fingerprints...
Generated fingerprints with 2048 features for 841 molecules
Trial 1390: 5-fold CV loss = 0.4630
[I 2025-08-07 21:38:43,093] Trial 1390 finished with value: 0.4630329966545105 and parameters: {'fp_type': 'morgan_rdkit', 'combined_morgan_radius': 3, 'combined_morgan_nBits': 1024, 'combined_rdkit_maxPath': 7, 'combined_rdkit_nBits': 1024, 'num_hidden_layers': 3, 'hidden_dim_0': 1024, 'hidden_dim_1': 1024, 'hidden_dim_2': 64, 'kl_weight': 0.001630247890426478, 'lr': 0.00629331854970714, 'batch_size': 128, 'dropout_rate': 0.16971440449713268, 'prior_mu': -0.04608382916815906, 'prior_sigma': 0.07933701027148025, 'normalization': 'layer'}. Best is trial 896 with value: 0.4533553242683411.
Generating morgan_rdkit fingerprints...
Generated fingerprints with 2048 features for 841 molecules
Trial 1392: 5-fold CV loss = 0.4619
[I 2025-08-07 21:38:56,729] Trial 1392 finished with value: 0.4619348168373108 and parameters: {'fp_type': 'morgan_rdkit', 'combined_morgan_radius': 3, 'combined_morgan_nBits': 1024, 'combined_rdkit_maxPath': 7, 'combined_rdkit_nBits': 1024, 'num_hidden_layers': 3, 'hidden_dim_0': 1024, 'hidden_dim_1': 1024, 'hidden_dim_2': 64, 'kl_weight': 0.00037128178690129103, 'lr': 0.006370507250708716, 'batch_size': 128, 'dropout_rate': 0.18789394140590995, 'prior_mu': -0.04378157656380095, 'prior_sigma': 0.08002060497091323, 'normalization': 'layer'}. Best is trial 896 with value: 0.4533553242683411.
Generating morgan_rdkit fingerprints...
Generated fingerprints with 2048 features for 841 molecules
Trial 1394: 5-fold CV loss = 0.4725
[I 2025-08-07 21:39:20,816] Trial 1394 finished with value: 0.4724790811538696 and parameters: {'fp_type': 'morgan_rdkit', 'combined_morgan_radius': 3, 'combined_morgan_nBits': 1024, 'combined_rdkit_maxPath': 7, 'combined_rdkit_nBits': 1024, 'num_hidden_layers': 3, 'hidden_dim_0': 1024, 'hidden_dim_1': 1024, 'hidden_dim_2': 64, 'kl_weight': 0.00036601646490925333, 'lr': 0.004893981211587524, 'batch_size': 64, 'dropout_rate': 0.17339809742198592, 'prior_mu': -0.146298532759201, 'prior_sigma': 0.08119694066936645, 'normalization': 'layer'}. Best is trial 896 with value: 0.4533553242683411.
Generating morgan_rdkit fingerprints...
Generated fingerprints with 2048 features for 841 molecules
Trial 1397: 5-fold CV loss = 0.8759
[I 2025-08-07 21:39:36,141] Trial 1397 finished with value: 0.8758960723876953 and parameters: {'fp_type': 'morgan_rdkit', 'combined_morgan_radius': 3, 'combined_morgan_nBits': 1024, 'combined_rdkit_maxPath': 7, 'combined_rdkit_nBits': 1024, 'num_hidden_layers': 3, 'hidden_dim_0': 256, 'hidden_dim_1': 1024, 'hidden_dim_2': 64, 'kl_weight': 0.00043856109507281444, 'lr': 0.0006065921182455146, 'batch_size': 128, 'dropout_rate': 0.2025128482773255, 'prior_mu': -0.03232160741378841, 'prior_sigma': 0.08304382364346548, 'normalization': 'layer'}. Best is trial 896 with value: 0.4533553242683411.
Generating morgan_rdkit fingerprints...
Generated fingerprints with 2048 features for 841 molecules
Trial 1396: 5-fold CV loss = 0.4732
