[I 2025-08-07 22:09:21,107] Trial 1546 finished with value: 0.4663506090641022 and parameters: {'fp_type': 'morgan_rdkit', 'combined_morgan_radius': 3, 'combined_morgan_nBits': 1024, 'combined_rdkit_maxPath': 7, 'combined_rdkit_nBits': 1024, 'num_hidden_layers': 3, 'hidden_dim_0': 256, 'hidden_dim_1': 1024, 'hidden_dim_2': 64, 'kl_weight': 0.0004008106296706218, 'lr': 0.005575866374696934, 'batch_size': 128, 'dropout_rate': 0.062250257642687976, 'prior_mu': -0.033450849160815053, 'prior_sigma': 0.0908835406114333, 'normalization': 'layer'}. Best is trial 896 with value: 0.4533553242683411.
Generating morgan_rdkit fingerprints...
Generated fingerprints with 2048 features for 841 molecules
Trial 1543: 5-fold CV loss = 0.4652
[I 2025-08-07 22:09:32,579] Trial 1543 finished with value: 0.4652394950389862 and parameters: {'fp_type': 'morgan_rdkit', 'combined_morgan_radius': 3, 'combined_morgan_nBits': 1024, 'combined_rdkit_maxPath': 7, 'combined_rdkit_nBits': 1024, 'num_hidden_layers': 3, 'hidden_dim_0': 1024, 'hidden_dim_1': 1024, 'hidden_dim_2': 64, 'kl_weight': 0.00041277419927897557, 'lr': 0.007624619189316673, 'batch_size': 128, 'dropout_rate': 0.11086661723628309, 'prior_mu': -0.05376799749629843, 'prior_sigma': 0.06924100334128558, 'normalization': 'layer'}. Best is trial 896 with value: 0.4533553242683411.
Generating morgan_rdkit fingerprints...
Generated fingerprints with 1536 features for 841 molecules
Trial 1547: 5-fold CV loss = 0.4673
[I 2025-08-07 22:09:45,003] Trial 1547 finished with value: 0.4673044681549072 and parameters: {'fp_type': 'morgan_rdkit', 'combined_morgan_radius': 3, 'combined_morgan_nBits': 1024, 'combined_rdkit_maxPath': 7, 'combined_rdkit_nBits': 1024, 'num_hidden_layers': 3, 'hidden_dim_0': 256, 'hidden_dim_1': 1024, 'hidden_dim_2': 64, 'kl_weight': 0.00037007056737491605, 'lr': 0.005214895913215216, 'batch_size': 128, 'dropout_rate': 0.13504898123344536, 'prior_mu': -0.024213348513812315, 'prior_sigma': 0.08887963185342378, 'normalization': 'layer'}. Best is trial 896 with value: 0.4533553242683411.
Generating morgan_rdkit fingerprints...
Generated fingerprints with 1536 features for 841 molecules
Trial 1549: 5-fold CV loss = 0.4640
[I 2025-08-07 22:10:05,505] Trial 1549 finished with value: 0.4639724612236023 and parameters: {'fp_type': 'morgan_rdkit', 'combined_morgan_radius': 3, 'combined_morgan_nBits': 1024, 'combined_rdkit_maxPath': 7, 'combined_rdkit_nBits': 1024, 'num_hidden_layers': 3, 'hidden_dim_0': 256, 'hidden_dim_1': 1024, 'hidden_dim_2': 64, 'kl_weight': 0.00035576439407879505, 'lr': 0.006280321202445915, 'batch_size': 128, 'dropout_rate': 0.13675554135114537, 'prior_mu': -0.025468261511272204, 'prior_sigma': 0.08334845036577816, 'normalization': 'layer'}. Best is trial 896 with value: 0.4533553242683411.
Generating morgan_rdkit fingerprints...
Generated fingerprints with 1536 features for 841 molecules
Trial 1551: 5-fold CV loss = 0.4836
[I 2025-08-07 22:10:22,899] Trial 1551 finished with value: 0.4835750341415405 and parameters: {'fp_type': 'morgan_rdkit', 'combined_morgan_radius': 3, 'combined_morgan_nBits': 1024, 'combined_rdkit_maxPath': 7, 'combined_rdkit_nBits': 512, 'num_hidden_layers': 3, 'hidden_dim_0': 256, 'hidden_dim_1': 1024, 'hidden_dim_2': 64, 'kl_weight': 0.0003130613777867198, 'lr': 0.006347337835810606, 'batch_size': 128, 'dropout_rate': 0.21135869569321206, 'prior_mu': -0.005013151282811882, 'prior_sigma': 0.0755998174161613, 'normalization': 'layer'}. Best is trial 896 with value: 0.4533553242683411.
Generating morgan_rdkit fingerprints...
Generated fingerprints with 2048 features for 841 molecules
Trial 1548: 5-fold CV loss = 0.4666
[I 2025-08-07 22:10:26,754] Trial 1548 finished with value: 0.4665554404258728 and parameters: {'fp_type': 'morgan_rdkit', 'combined_morgan_radius': 3, 'combined_morgan_nBits': 1024, 'combined_rdkit_maxPath': 7, 'combined_rdkit_nBits': 1024, 'num_hidden_layers': 3, 'hidden_dim_0': 256, 'hidden_dim_1': 1024, 'hidden_dim_2': 64, 'kl_weight': 0.0003580504186966561, 'lr': 0.0055155077389123725, 'batch_size': 128, 'dropout_rate': 0.2099494586962602, 'prior_mu': -0.025461765238644515, 'prior_sigma': 0.08488178657895651, 'normalization': 'layer'}. Best is trial 896 with value: 0.4533553242683411.
Generating morgan_rdkit fingerprints...
Generated fingerprints with 2048 features for 841 molecules
Trial 1550: 5-fold CV loss = 0.4848
[I 2025-08-07 22:10:57,296] Trial 1550 finished with value: 0.48475463390350343 and parameters: {'fp_type': 'morgan_rdkit', 'combined_morgan_radius': 3, 'combined_morgan_nBits': 1024, 'combined_rdkit_maxPath': 7, 'combined_rdkit_nBits': 512, 'num_hidden_layers': 3, 'hidden_dim_0': 256, 'hidden_dim_1': 1024, 'hidden_dim_2': 64, 'kl_weight': 0.0003506259553631572, 'lr': 0.006341971637031372, 'batch_size': 128, 'dropout_rate': 0.13430287286081022, 'prior_mu': -0.025144504172026756, 'prior_sigma': 0.07556402347586631, 'normalization': 'layer'}. Best is trial 896 with value: 0.4533553242683411.
Generating morgan_rdkit fingerprints...
Generated fingerprints with 2048 features for 841 molecules
Trial 1552: 5-fold CV loss = 0.4812
[I 2025-08-07 22:10:59,352] Trial 1552 finished with value: 0.4811538279056549 and parameters: {'fp_type': 'morgan_rdkit', 'combined_morgan_radius': 3, 'combined_morgan_nBits': 1024, 'combined_rdkit_maxPath': 7, 'combined_rdkit_nBits': 512, 'num_hidden_layers': 3, 'hidden_dim_0': 256, 'hidden_dim_1': 1024, 'hidden_dim_2': 64, 'kl_weight': 0.00030924507073612023, 'lr': 0.0063522194167235785, 'batch_size': 64, 'dropout_rate': 0.14943873111297631, 'prior_mu': -0.002796387577188149, 'prior_sigma': 0.07488779768168108, 'normalization': 'layer'}. Best is trial 896 with value: 0.4533553242683411.
Generating morgan_rdkit fingerprints...
Generated fingerprints with 2048 features for 841 molecules
Trial 1554: 5-fold CV loss = 1.0355
[I 2025-08-07 22:11:00,808] Trial 1554 finished with value: 1.035461139678955 and parameters: {'fp_type': 'morgan_rdkit', 'combined_morgan_radius': 3, 'combined_morgan_nBits': 1024, 'combined_rdkit_maxPath': 7, 'combined_rdkit_nBits': 1024, 'num_hidden_layers': 3, 'hidden_dim_0': 256, 'hidden_dim_1': 1024, 'hidden_dim_2': 1024, 'kl_weight': 0.00028122726037056153, 'lr': 0.00015527132676446145, 'batch_size': 64, 'dropout_rate': 0.15726886077344326, 'prior_mu': 0.008418562623164308, 'prior_sigma': 0.09503452761238419, 'normalization': 'layer'}. Best is trial 896 with value: 0.4533553242683411.
Generating morgan_rdkit fingerprints...
Generated fingerprints with 2048 features for 841 molecules
Trial 1553: 5-fold CV loss = 0.7275
[I 2025-08-07 22:11:17,640] Trial 1553 finished with value: 0.7274719417095185 and parameters: {'fp_type': 'morgan_rdkit', 'combined_morgan_radius': 3, 'combined_morgan_nBits': 1024, 'combined_rdkit_maxPath': 7, 'combined_rdkit_nBits': 1024, 'num_hidden_layers': 3, 'hidden_dim_0': 256, 'hidden_dim_1': 1024, 'hidden_dim_2': 1024, 'kl_weight': 0.002037772309440873, 'lr': 0.005651101560986774, 'batch_size': 64, 'dropout_rate': 0.15616814761747855, 'prior_mu': 0.008885976821084766, 'prior_sigma': 0.09634401743616558, 'normalization': 'layer'}. Best is trial 896 with value: 0.4533553242683411.
Generating morgan_rdkit fingerprints...
Generated fingerprints with 2048 features for 841 molecules
Trial 1556: 5-fold CV loss = 0.7982
[I 2025-08-07 22:11:22,057] Trial 1556 finished with value: 0.7982433617115021 and parameters: {'fp_type': 'morgan_rdkit', 'combined_morgan_radius': 3, 'combined_morgan_nBits': 1024, 'combined_rdkit_maxPath': 7, 'combined_rdkit_nBits': 1024, 'num_hidden_layers': 3, 'hidden_dim_0': 256, 'hidden_dim_1': 64, 'hidden_dim_2': 1024, 'kl_weight': 0.0005662315434219538, 'lr': 0.007072068773856662, 'batch_size': 128, 'dropout_rate': 0.15396760264261516, 'prior_mu': 0.006049934355098879, 'prior_sigma': 0.05715938543342053, 'normalization': 'layer'}. Best is trial 896 with value: 0.4533553242683411.
Generating morgan fingerprints...
Generated fingerprints with 2048 features for 841 molecules
Trial 1559: 5-fold CV loss = 0.5271
[I 2025-08-07 22:11:39,681] Trial 1559 finished with value: 0.5271471619606019 and parameters: {'fp_type': 'morgan', 'morgan_only_radius': 3, 'morgan_only_nBits': 2048, 'num_hidden_layers': 3, 'hidden_dim_0': 256, 'hidden_dim_1': 1024, 'hidden_dim_2': 64, 'kl_weight': 0.00025285927640858637, 'lr': 0.006871377062179435, 'batch_size': 128, 'dropout_rate': 0.09460947746113885, 'prior_mu': -0.01137794032558529, 'prior_sigma': 0.08295478739297739, 'normalization': 'layer'}. Best is trial 896 with value: 0.4533553242683411.
Generating morgan_rdkit fingerprints...
Generated fingerprints with 2048 features for 841 molecules
Trial 1558: 5-fold CV loss = 0.4596
[I 2025-08-07 22:11:53,831] Trial 1558 finished with value: 0.459582245349884 and parameters: {'fp_type': 'morgan_rdkit', 'combined_morgan_radius': 3, 'combined_morgan_nBits': 1024, 'combined_rdkit_maxPath': 7, 'combined_rdkit_nBits': 1024, 'num_hidden_layers': 3, 'hidden_dim_0': 512, 'hidden_dim_1': 64, 'hidden_dim_2': 128, 'kl_weight': 0.0005759490424340093, 'lr': 0.007048543228932442, 'batch_size': 128, 'dropout_rate': 0.11657145068742464, 'prior_mu': -0.011628842724204006, 'prior_sigma': 0.05659647742006025, 'normalization': 'layer'}. Best is trial 896 with value: 0.4533553242683411.
Generating morgan_rdkit fingerprints...
Generated fingerprints with 2048 features for 841 molecules
Trial 1557: 5-fold CV loss = 0.5625
[I 2025-08-07 22:11:56,745] Trial 1557 finished with value: 0.5625499665737153 and parameters: {'fp_type': 'morgan_rdkit', 'combined_morgan_radius': 3, 'combined_morgan_nBits': 1024, 'combined_rdkit_maxPath': 7, 'combined_rdkit_nBits': 1024, 'num_hidden_layers': 3, 'hidden_dim_0': 256, 'hidden_dim_1': 64, 'hidden_dim_2': 128, 'kl_weight': 0.0002447866957421403, 'lr': 0.006845770756460217, 'batch_size': 128, 'dropout_rate': 0.09597880341945786, 'prior_mu': -0.013568111993806347, 'prior_sigma': 0.0826945435812216, 'normalization': 'layer'}. Best is trial 896 with value: 0.4533553242683411.
Generating morgan_rdkit fingerprints...
Generated fingerprints with 2048 features for 841 molecules
Trial 1561: 5-fold CV loss = 0.8814
[I 2025-08-07 22:12:12,732] Trial 1561 finished with value: 0.8814353227615357 and parameters: {'fp_type': 'morgan_rdkit', 'combined_morgan_radius': 3, 'combined_morgan_nBits': 1024, 'combined_rdkit_maxPath': 7, 'combined_rdkit_nBits': 1024, 'num_hidden_layers': 3, 'hidden_dim_0': 256, 'hidden_dim_1': 1024, 'hidden_dim_2': 64, 'kl_weight': 0.007193312819740661, 'lr': 0.0007035724543154713, 'batch_size': 128, 'dropout_rate': 0.13052228697034118, 'prior_mu': -0.04581708962696788, 'prior_sigma': 0.07285474621366576, 'normalization': 'layer'}. Best is trial 896 with value: 0.4533553242683411.
Generating morgan_rdkit fingerprints...
Generated fingerprints with 2048 features for 841 molecules
Trial 1560: 5-fold CV loss = 0.7374
[I 2025-08-07 22:12:17,827] Trial 1560 finished with value: 0.7374203026294708 and parameters: {'fp_type': 'morgan_rdkit', 'combined_morgan_radius': 3, 'combined_morgan_nBits': 1024, 'combined_rdkit_maxPath': 7, 'combined_rdkit_nBits': 1024, 'num_hidden_layers': 3, 'hidden_dim_0': 256, 'hidden_dim_1': 1024, 'hidden_dim_2': 128, 'kl_weight': 0.00024682250190171296, 'lr': 0.0008028706660780918, 'batch_size': 128, 'dropout_rate': 0.11598248576749089, 'prior_mu': -0.04521999098233349, 'prior_sigma': 0.07380556332915053, 'normalization': 'layer'}. Best is trial 896 with value: 0.4533553242683411.
Generating morgan_rdkit fingerprints...
Generated fingerprints with 2048 features for 841 molecules
Trial 1563: 5-fold CV loss = 0.8900
[I 2025-08-07 22:12:28,642] Trial 1563 finished with value: 0.8899853825569153 and parameters: {'fp_type': 'morgan_rdkit', 'combined_morgan_radius': 3, 'combined_morgan_nBits': 1024, 'combined_rdkit_maxPath': 7, 'combined_rdkit_nBits': 1024, 'num_hidden_layers': 3, 'hidden_dim_0': 256, 'hidden_dim_1': 1024, 'hidden_dim_2': 64, 'kl_weight': 0.06696474755909498, 'lr': 0.005088660780711883, 'batch_size': 128, 'dropout_rate': 0.11808528588845518, 'prior_mu': -0.03477020500794094, 'prior_sigma': 0.19992980047157471, 'normalization': 'layer'}. Best is trial 896 with value: 0.4533553242683411.
Generating rdkit fingerprints...
Generated fingerprints with 1024 features for 841 molecules
Trial 1562: 5-fold CV loss = 0.5500
[I 2025-08-07 22:12:43,563] Trial 1562 finished with value: 0.5499987065792084 and parameters: {'fp_type': 'morgan_rdkit', 'combined_morgan_radius': 3, 'combined_morgan_nBits': 1024, 'combined_rdkit_maxPath': 7, 'combined_rdkit_nBits': 1024, 'num_hidden_layers': 3, 'hidden_dim_0': 256, 'hidden_dim_1': 1024, 'hidden_dim_2': 64, 'kl_weight': 0.0003094016666116355, 'lr': 0.005084764321931948, 'batch_size': 128, 'dropout_rate': 0.13076353965069815, 'prior_mu': -0.046996828642561723, 'prior_sigma': 0.07335131115454811, 'normalization': 'layer'}. Best is trial 896 with value: 0.4533553242683411.
Generating morgan_rdkit fingerprints...
Generated fingerprints with 2048 features for 841 molecules
Trial 1564: 5-fold CV loss = 0.5566
[I 2025-08-07 22:13:00,438] Trial 1564 finished with value: 0.5566152393817901 and parameters: {'fp_type': 'morgan_rdkit', 'combined_morgan_radius': 3, 'combined_morgan_nBits': 1024, 'combined_rdkit_maxPath': 8, 'combined_rdkit_nBits': 1024, 'num_hidden_layers': 3, 'hidden_dim_0': 256, 'hidden_dim_1': 1024, 'hidden_dim_2': 64, 'kl_weight': 0.00029247748427337696, 'lr': 0.005050741774714532, 'batch_size': 128, 'dropout_rate': 0.07873906595020272, 'prior_mu': -0.03743737610539231, 'prior_sigma': 0.08761268708639433, 'normalization': 'layer'}. Best is trial 896 with value: 0.4533553242683411.
Generating rdkit fingerprints...
Generated fingerprints with 1024 features for 841 molecules
Trial 1565: 5-fold CV loss = 0.6706
[I 2025-08-07 22:13:09,058] Trial 1565 finished with value: 0.6705504417419433 and parameters: {'fp_type': 'rdkit', 'rdkit_only_maxPath': 8, 'rdkit_only_nBits': 1024, 'num_hidden_layers': 3, 'hidden_dim_0': 256, 'hidden_dim_1': 1024, 'hidden_dim_2': 64, 'kl_weight': 0.00029559692392655995, 'lr': 0.007805147481028203, 'batch_size': 128, 'dropout_rate': 0.07961991867345429, 'prior_mu': -0.01811073482294496, 'prior_sigma': 0.08808992009506875, 'normalization': 'layer'}. Best is trial 896 with value: 0.4533553242683411.
Generating morgan_rdkit fingerprints...
Generated fingerprints with 2048 features for 841 molecules
Trial 1555: 5-fold CV loss = 0.4695
[I 2025-08-07 22:13:20,288] Trial 1555 finished with value: 0.46947973370552065 and parameters: {'fp_type': 'morgan_rdkit', 'combined_morgan_radius': 3, 'combined_morgan_nBits': 1024, 'combined_rdkit_maxPath': 7, 'combined_rdkit_nBits': 1024, 'num_hidden_layers': 3, 'hidden_dim_0': 256, 'hidden_dim_1': 1024, 'hidden_dim_2': 128, 'kl_weight': 0.000295650423054781, 'lr': 0.007029221352161134, 'batch_size': 64, 'dropout_rate': 0.15542464588051608, 'prior_mu': 0.004500223635728679, 'prior_sigma': 0.07212312111357709, 'normalization': 'layer'}. Best is trial 896 with value: 0.4533553242683411.
Generating morgan_rdkit fingerprints...
Generated fingerprints with 2048 features for 841 molecules
Trial 1567: 5-fold CV loss = 0.6398
[I 2025-08-07 22:13:44,643] Trial 1567 finished with value: 0.6398163437843323 and parameters: {'fp_type': 'rdkit', 'rdkit_only_maxPath': 8, 'rdkit_only_nBits': 1024, 'num_hidden_layers': 3, 'hidden_dim_0': 256, 'hidden_dim_1': 1024, 'hidden_dim_2': 64, 'kl_weight': 0.00045225187832633585, 'lr': 0.007828648982547462, 'batch_size': 128, 'dropout_rate': 0.14609786666573726, 'prior_mu': -0.017920875745300786, 'prior_sigma': 0.07894232871169422, 'normalization': 'layer'}. Best is trial 896 with value: 0.4533553242683411.
Generating morgan_rdkit fingerprints...
Generated fingerprints with 2048 features for 841 molecules
Trial 1566: 5-fold CV loss = 0.4861
[I 2025-08-07 22:13:46,289] Trial 1566 finished with value: 0.48608589768409727 and parameters: {'fp_type': 'morgan_rdkit', 'combined_morgan_radius': 3, 'combined_morgan_nBits': 1024, 'combined_rdkit_maxPath': 8, 'combined_rdkit_nBits': 1024, 'num_hidden_layers': 3, 'hidden_dim_0': 256, 'hidden_dim_1': 1024, 'hidden_dim_2': 64, 'kl_weight': 0.0010349764330947256, 'lr': 0.00414603783677263, 'batch_size': 128, 'dropout_rate': 0.19401554197270607, 'prior_mu': -0.02068484702703815, 'prior_sigma': 0.06421432810932819, 'normalization': 'layer'}. Best is trial 896 with value: 0.4533553242683411.
Generating morgan_rdkit fingerprints...
Generated fingerprints with 2048 features for 841 molecules
Trial 1568: 5-fold CV loss = 0.4638
[I 2025-08-07 22:13:52,926] Trial 1568 finished with value: 0.46376588344573977 and parameters: {'fp_type': 'morgan_rdkit', 'combined_morgan_radius': 3, 'combined_morgan_nBits': 1024, 'combined_rdkit_maxPath': 7, 'combined_rdkit_nBits': 1024, 'num_hidden_layers': 3, 'hidden_dim_0': 256, 'hidden_dim_1': 1024, 'hidden_dim_2': 64, 'kl_weight': 0.0004758549923387247, 'lr': 0.004069979996246245, 'batch_size': 128, 'dropout_rate': 0.17924448504308207, 'prior_mu': -0.005020626343506904, 'prior_sigma': 0.07937497913733452, 'normalization': 'layer'}. Best is trial 896 with value: 0.4533553242683411.
Generating morgan_rdkit fingerprints...
Generated fingerprints with 2048 features for 841 molecules
Trial 1570: 5-fold CV loss = 0.8865
[I 2025-08-07 22:14:02,581] Trial 1570 finished with value: 0.8864696502685547 and parameters: {'fp_type': 'morgan_rdkit', 'combined_morgan_radius': 3, 'combined_morgan_nBits': 1024, 'combined_rdkit_maxPath': 7, 'combined_rdkit_nBits': 1024, 'num_hidden_layers': 3, 'hidden_dim_0': 256, 'hidden_dim_1': 1024, 'hidden_dim_2': 512, 'kl_weight': 0.00036009780967033114, 'lr': 0.005787522519155423, 'batch_size': 128, 'dropout_rate': 0.18091062101246064, 'prior_mu': -0.004081872129397844, 'prior_sigma': 0.1496761342903038, 'normalization': 'layer'}. Best is trial 896 with value: 0.4533553242683411.
Generating morgan_rdkit fingerprints...
Generated fingerprints with 2048 features for 841 molecules
Trial 1571: 5-fold CV loss = 0.7149
[I 2025-08-07 22:14:31,922] Trial 1571 finished with value: 0.7148520529270173 and parameters: {'fp_type': 'morgan_rdkit', 'combined_morgan_radius': 3, 'combined_morgan_nBits': 1024, 'combined_rdkit_maxPath': 7, 'combined_rdkit_nBits': 1024, 'num_hidden_layers': 3, 'hidden_dim_0': 256, 'hidden_dim_1': 128, 'hidden_dim_2': 512, 'kl_weight': 0.0003458203224213616, 'lr': 0.005846951867933557, 'batch_size': 128, 'dropout_rate': 0.1793404086038322, 'prior_mu': -0.0047315499236997745, 'prior_sigma': 0.09089475026420514, 'normalization': 'layer'}. Best is trial 896 with value: 0.4533553242683411.
Generating morgan_rdkit fingerprints...
Generated fingerprints with 2048 features for 841 molecules
Trial 1572: 5-fold CV loss = 0.4704
[I 2025-08-07 22:14:37,276] Trial 1572 finished with value: 0.4703694939613342 and parameters: {'fp_type': 'morgan_rdkit', 'combined_morgan_radius': 3, 'combined_morgan_nBits': 1024, 'combined_rdkit_maxPath': 7, 'combined_rdkit_nBits': 1024, 'num_hidden_layers': 3, 'hidden_dim_0': 256, 'hidden_dim_1': 128, 'hidden_dim_2': 64, 'kl_weight': 0.0003595482616685261, 'lr': 0.0062553872493382925, 'batch_size': 128, 'dropout_rate': 0.0987623241291822, 'prior_mu': -0.0319191087278881, 'prior_sigma': 0.09387647398955187, 'normalization': 'layer'}. Best is trial 896 with value: 0.4533553242683411.
Generating morgan_rdkit fingerprints...
Generated fingerprints with 2048 features for 841 molecules
Trial 1573: 5-fold CV loss = 0.4692
[I 2025-08-07 22:14:50,968] Trial 1573 finished with value: 0.46919100284576415 and parameters: {'fp_type': 'morgan_rdkit', 'combined_morgan_radius': 3, 'combined_morgan_nBits': 1024, 'combined_rdkit_maxPath': 7, 'combined_rdkit_nBits': 1024, 'num_hidden_layers': 3, 'hidden_dim_0': 256, 'hidden_dim_1': 128, 'hidden_dim_2': 64, 'kl_weight': 0.00022935112498636634, 'lr': 0.006021978997950896, 'batch_size': 128, 'dropout_rate': 0.10168297392655194, 'prior_mu': -0.028174115474669824, 'prior_sigma': 0.09272827519249917, 'normalization': 'layer'}. Best is trial 896 with value: 0.4533553242683411.
Generating morgan_rdkit fingerprints...
Generated fingerprints with 1280 features for 841 molecules
Trial 1569: 5-fold CV loss = 0.4609
[I 2025-08-07 22:14:53,711] Trial 1569 finished with value: 0.46089798808097837 and parameters: {'fp_type': 'morgan_rdkit', 'combined_morgan_radius': 3, 'combined_morgan_nBits': 1024, 'combined_rdkit_maxPath': 7, 'combined_rdkit_nBits': 1024, 'num_hidden_layers': 3, 'hidden_dim_0': 256, 'hidden_dim_1': 1024, 'hidden_dim_2': 64, 'kl_weight': 0.00043737134180178803, 'lr': 0.0057077090992379955, 'batch_size': 128, 'dropout_rate': 0.1967067340382384, 'prior_mu': -0.004805586396870742, 'prior_sigma': 0.0648781141284907, 'normalization': 'layer'}. Best is trial 896 with value: 0.4533553242683411.
Generating morgan_rdkit fingerprints...
Generated fingerprints with 1280 features for 841 molecules
Trial 1575: 5-fold CV loss = 0.4671
[I 2025-08-07 22:15:20,035] Trial 1575 finished with value: 0.4670947313308716 and parameters: {'fp_type': 'morgan_rdkit', 'combined_morgan_radius': 3, 'combined_morgan_nBits': 1024, 'combined_rdkit_maxPath': 7, 'combined_rdkit_nBits': 1024, 'num_hidden_layers': 3, 'hidden_dim_0': 256, 'hidden_dim_1': 1024, 'hidden_dim_2': 64, 'kl_weight': 0.00024787018272090484, 'lr': 0.004508180918646512, 'batch_size': 128, 'dropout_rate': 0.10452658670561364, 'prior_mu': -0.026925086112005427, 'prior_sigma': 0.0838042074129801, 'normalization': 'layer'}. Best is trial 896 with value: 0.4533553242683411.
Generating morgan_rdkit fingerprints...
Generated fingerprints with 1280 features for 841 molecules
Trial 1576: 5-fold CV loss = 0.5812
