[I 2025-08-07 22:26:36,838] Trial 1634 finished with value: 0.5656468093395233 and parameters: {'fp_type': 'morgan_rdkit', 'combined_morgan_radius': 3, 'combined_morgan_nBits': 1024, 'combined_rdkit_maxPath': 7, 'combined_rdkit_nBits': 1024, 'num_hidden_layers': 3, 'hidden_dim_0': 256, 'hidden_dim_1': 1024, 'hidden_dim_2': 64, 'kl_weight': 0.0004171036653109645, 'lr': 0.007201880383570683, 'batch_size': 128, 'dropout_rate': 0.10263769182364858, 'prior_mu': -0.04123697546346729, 'prior_sigma': 0.10549698580798056, 'normalization': 'layer'}. Best is trial 896 with value: 0.4533553242683411.
Generating morgan_rdkit fingerprints...
Generated fingerprints with 2048 features for 841 molecules
Trial 1636: 5-fold CV loss = 0.8446
[I 2025-08-07 22:26:38,622] Trial 1636 finished with value: 0.8445911645889282 and parameters: {'fp_type': 'morgan_rdkit', 'combined_morgan_radius': 3, 'combined_morgan_nBits': 1024, 'combined_rdkit_maxPath': 7, 'combined_rdkit_nBits': 1024, 'num_hidden_layers': 3, 'hidden_dim_0': 256, 'hidden_dim_1': 1024, 'hidden_dim_2': 1024, 'kl_weight': 0.0005061691125299409, 'lr': 0.008743480563363656, 'batch_size': 128, 'dropout_rate': 0.06374103875456638, 'prior_mu': -0.05646470244015622, 'prior_sigma': 0.09255601073665276, 'normalization': 'layer'}. Best is trial 896 with value: 0.4533553242683411.
Generating morgan_rdkit fingerprints...
Generated fingerprints with 2048 features for 841 molecules
Trial 1640: 5-fold CV loss = 0.4633
[I 2025-08-07 22:27:12,125] Trial 1640 finished with value: 0.46328893303871155 and parameters: {'fp_type': 'morgan_rdkit', 'combined_morgan_radius': 3, 'combined_morgan_nBits': 1024, 'combined_rdkit_maxPath': 7, 'combined_rdkit_nBits': 1024, 'num_hidden_layers': 3, 'hidden_dim_0': 256, 'hidden_dim_1': 1024, 'hidden_dim_2': 64, 'kl_weight': 0.0005364886339538816, 'lr': 0.007756158860892277, 'batch_size': 128, 'dropout_rate': 0.1224897963440631, 'prior_mu': -0.04576663587030503, 'prior_sigma': 0.0947902853951321, 'normalization': 'layer'}. Best is trial 896 with value: 0.4533553242683411.
Generating morgan_rdkit fingerprints...
Generated fingerprints with 2048 features for 841 molecules
Trial 1639: 5-fold CV loss = 0.4667
[I 2025-08-07 22:27:17,668] Trial 1639 finished with value: 0.46673662662506105 and parameters: {'fp_type': 'morgan_rdkit', 'combined_morgan_radius': 3, 'combined_morgan_nBits': 1024, 'combined_rdkit_maxPath': 7, 'combined_rdkit_nBits': 1024, 'num_hidden_layers': 3, 'hidden_dim_0': 256, 'hidden_dim_1': 1024, 'hidden_dim_2': 64, 'kl_weight': 0.0004936600290780026, 'lr': 0.007571351320267516, 'batch_size': 128, 'dropout_rate': 0.12247289443818515, 'prior_mu': -0.05503061890366668, 'prior_sigma': 0.0958916160732995, 'normalization': 'layer'}. Best is trial 896 with value: 0.4533553242683411.
Generating morgan_rdkit fingerprints...
Generated fingerprints with 2048 features for 841 molecules
Trial 1638: 5-fold CV loss = 0.4682
[I 2025-08-07 22:27:25,172] Trial 1638 finished with value: 0.4682142972946167 and parameters: {'fp_type': 'morgan_rdkit', 'combined_morgan_radius': 3, 'combined_morgan_nBits': 1024, 'combined_rdkit_maxPath': 7, 'combined_rdkit_nBits': 1024, 'num_hidden_layers': 3, 'hidden_dim_0': 256, 'hidden_dim_1': 1024, 'hidden_dim_2': 64, 'kl_weight': 0.0005116717368024459, 'lr': 0.007500375832207115, 'batch_size': 128, 'dropout_rate': 0.04909610710090428, 'prior_mu': -0.045030054243425974, 'prior_sigma': 0.09610426424344548, 'normalization': 'layer'}. Best is trial 896 with value: 0.4533553242683411.
Generating morgan_rdkit fingerprints...
Generated fingerprints with 2048 features for 841 molecules
Trial 1641: 5-fold CV loss = 0.4693
[I 2025-08-07 22:27:48,486] Trial 1641 finished with value: 0.4692755460739136 and parameters: {'fp_type': 'morgan_rdkit', 'combined_morgan_radius': 3, 'combined_morgan_nBits': 1024, 'combined_rdkit_maxPath': 7, 'combined_rdkit_nBits': 1024, 'num_hidden_layers': 3, 'hidden_dim_0': 256, 'hidden_dim_1': 1024, 'hidden_dim_2': 64, 'kl_weight': 0.0004855881599374008, 'lr': 0.007551313176824688, 'batch_size': 128, 'dropout_rate': 0.07807422196915369, 'prior_mu': -0.0430848885117162, 'prior_sigma': 0.09564115824805768, 'normalization': 'layer'}. Best is trial 896 with value: 0.4533553242683411.
Generating morgan_rdkit fingerprints...
Generated fingerprints with 2048 features for 841 molecules
Trial 1642: 5-fold CV loss = 0.4702
[I 2025-08-07 22:27:55,601] Trial 1642 finished with value: 0.47021374106407166 and parameters: {'fp_type': 'morgan_rdkit', 'combined_morgan_radius': 3, 'combined_morgan_nBits': 1024, 'combined_rdkit_maxPath': 7, 'combined_rdkit_nBits': 1024, 'num_hidden_layers': 3, 'hidden_dim_0': 256, 'hidden_dim_1': 1024, 'hidden_dim_2': 64, 'kl_weight': 0.00042549724469717045, 'lr': 0.009135825590725729, 'batch_size': 128, 'dropout_rate': 0.07933130907715373, 'prior_mu': -0.04418343412405788, 'prior_sigma': 0.08929461889321971, 'normalization': 'layer'}. Best is trial 896 with value: 0.4533553242683411.
Generating morgan_rdkit fingerprints...
Generated fingerprints with 2048 features for 841 molecules
Trial 1637: 5-fold CV loss = 0.4661
[I 2025-08-07 22:27:57,288] Trial 1637 finished with value: 0.4661244213581085 and parameters: {'fp_type': 'morgan_rdkit', 'combined_morgan_radius': 3, 'combined_morgan_nBits': 1024, 'combined_rdkit_maxPath': 7, 'combined_rdkit_nBits': 1024, 'num_hidden_layers': 3, 'hidden_dim_0': 256, 'hidden_dim_1': 1024, 'hidden_dim_2': 64, 'kl_weight': 0.00046837376873646935, 'lr': 0.008933545560360167, 'batch_size': 128, 'dropout_rate': 0.052258434861790194, 'prior_mu': -0.05647973295441692, 'prior_sigma': 0.0938635907226601, 'normalization': 'layer'}. Best is trial 896 with value: 0.4533553242683411.
Generating morgan_rdkit fingerprints...
Generated fingerprints with 2048 features for 841 molecules
Trial 1643: 5-fold CV loss = 0.5610
[I 2025-08-07 22:28:09,272] Trial 1643 finished with value: 0.5610253274440765 and parameters: {'fp_type': 'morgan_rdkit', 'combined_morgan_radius': 3, 'combined_morgan_nBits': 1024, 'combined_rdkit_maxPath': 7, 'combined_rdkit_nBits': 1024, 'num_hidden_layers': 3, 'hidden_dim_0': 256, 'hidden_dim_1': 1024, 'hidden_dim_2': 64, 'kl_weight': 0.0004154048728442091, 'lr': 0.009096392049949107, 'batch_size': 128, 'dropout_rate': 0.07227277952690708, 'prior_mu': -0.043010976859572336, 'prior_sigma': 0.08838907045222807, 'normalization': 'layer'}. Best is trial 896 with value: 0.4533553242683411.
Generating morgan_rdkit fingerprints...
Generated fingerprints with 2048 features for 841 molecules
Trial 1644: 5-fold CV loss = 0.7015
[I 2025-08-07 22:28:13,819] Trial 1644 finished with value: 0.7014894723892212 and parameters: {'fp_type': 'morgan_rdkit', 'combined_morgan_radius': 3, 'combined_morgan_nBits': 1024, 'combined_rdkit_maxPath': 7, 'combined_rdkit_nBits': 1024, 'num_hidden_layers': 3, 'hidden_dim_0': 256, 'hidden_dim_1': 1024, 'hidden_dim_2': 256, 'kl_weight': 0.0004105855341945495, 'lr': 0.008915632009980554, 'batch_size': 128, 'dropout_rate': 0.06980664818999303, 'prior_mu': -0.041797952416849485, 'prior_sigma': 0.08980201281532565, 'normalization': 'layer'}. Best is trial 896 with value: 0.4533553242683411.
Generating morgan_rdkit fingerprints...
Generated fingerprints with 2048 features for 841 molecules
Trial 1645: 5-fold CV loss = 0.4650
[I 2025-08-07 22:28:36,978] Trial 1645 finished with value: 0.4650377810001373 and parameters: {'fp_type': 'morgan_rdkit', 'combined_morgan_radius': 3, 'combined_morgan_nBits': 1024, 'combined_rdkit_maxPath': 7, 'combined_rdkit_nBits': 1024, 'num_hidden_layers': 3, 'hidden_dim_0': 256, 'hidden_dim_1': 1024, 'hidden_dim_2': 64, 'kl_weight': 0.00039877656019661554, 'lr': 0.008411705303518577, 'batch_size': 128, 'dropout_rate': 0.07175500341277428, 'prior_mu': -0.06538843542834491, 'prior_sigma': 0.08936633069175694, 'normalization': 'layer'}. Best is trial 896 with value: 0.4533553242683411.
Generating morgan_rdkit fingerprints...
Generated fingerprints with 2048 features for 841 molecules
Trial 1648: 5-fold CV loss = 0.4618
[I 2025-08-07 22:28:48,739] Trial 1648 finished with value: 0.46179832220077516 and parameters: {'fp_type': 'morgan_rdkit', 'combined_morgan_radius': 3, 'combined_morgan_nBits': 1024, 'combined_rdkit_maxPath': 7, 'combined_rdkit_nBits': 1024, 'num_hidden_layers': 3, 'hidden_dim_0': 256, 'hidden_dim_1': 1024, 'hidden_dim_2': 64, 'kl_weight': 0.00039823054866086534, 'lr': 0.00831128953817207, 'batch_size': 128, 'dropout_rate': 0.09187549229034096, 'prior_mu': -0.05178923169987194, 'prior_sigma': 0.09108821499592672, 'normalization': 'layer'}. Best is trial 896 with value: 0.4533553242683411.
Generating morgan_rdkit fingerprints...
Generated fingerprints with 2048 features for 841 molecules
Trial 1647: 5-fold CV loss = 0.4777
[I 2025-08-07 22:29:02,531] Trial 1647 finished with value: 0.4777431786060333 and parameters: {'fp_type': 'morgan_rdkit', 'combined_morgan_radius': 3, 'combined_morgan_nBits': 1024, 'combined_rdkit_maxPath': 7, 'combined_rdkit_nBits': 1024, 'num_hidden_layers': 3, 'hidden_dim_0': 256, 'hidden_dim_1': 128, 'hidden_dim_2': 64, 'kl_weight': 0.0004085666449767739, 'lr': 0.008389901036152897, 'batch_size': 128, 'dropout_rate': 0.0713264539729136, 'prior_mu': -0.06377808717412434, 'prior_sigma': 0.09094204104050915, 'normalization': 'layer'}. Best is trial 896 with value: 0.4533553242683411.
Generating morgan_rdkit fingerprints...
Generated fingerprints with 2048 features for 841 molecules
Trial 1646: 5-fold CV loss = 0.6313
[I 2025-08-07 22:29:13,835] Trial 1646 finished with value: 0.6313258111476898 and parameters: {'fp_type': 'morgan_rdkit', 'combined_morgan_radius': 3, 'combined_morgan_nBits': 1024, 'combined_rdkit_maxPath': 7, 'combined_rdkit_nBits': 1024, 'num_hidden_layers': 3, 'hidden_dim_0': 256, 'hidden_dim_1': 128, 'hidden_dim_2': 256, 'kl_weight': 0.000414896287435572, 'lr': 0.009994372982326999, 'batch_size': 128, 'dropout_rate': 0.06549731759036888, 'prior_mu': -0.06359567252789299, 'prior_sigma': 0.08798825464518206, 'normalization': 'layer'}. Best is trial 896 with value: 0.4533553242683411.
Generating morgan_rdkit fingerprints...
Generated fingerprints with 1280 features for 841 molecules
Trial 1649: 5-fold CV loss = 0.4738
[I 2025-08-07 22:29:25,808] Trial 1649 finished with value: 0.4738038003444672 and parameters: {'fp_type': 'morgan_rdkit', 'combined_morgan_radius': 3, 'combined_morgan_nBits': 1024, 'combined_rdkit_maxPath': 7, 'combined_rdkit_nBits': 1024, 'num_hidden_layers': 3, 'hidden_dim_0': 256, 'hidden_dim_1': 128, 'hidden_dim_2': 64, 'kl_weight': 0.0006343777526193603, 'lr': 0.007401624550684222, 'batch_size': 128, 'dropout_rate': 0.09649236521913913, 'prior_mu': -0.05285072943840321, 'prior_sigma': 0.0982989437917998, 'normalization': 'layer'}. Best is trial 896 with value: 0.4533553242683411.
Generating morgan_rdkit fingerprints...
Generated fingerprints with 2048 features for 841 molecules
Trial 1650: 5-fold CV loss = 0.4712
[I 2025-08-07 22:29:29,720] Trial 1650 finished with value: 0.47123804688453674 and parameters: {'fp_type': 'morgan_rdkit', 'combined_morgan_radius': 3, 'combined_morgan_nBits': 1024, 'combined_rdkit_maxPath': 7, 'combined_rdkit_nBits': 1024, 'num_hidden_layers': 3, 'hidden_dim_0': 256, 'hidden_dim_1': 128, 'hidden_dim_2': 64, 'kl_weight': 0.0005333331619186032, 'lr': 0.007241211189002917, 'batch_size': 128, 'dropout_rate': 0.11762244693433803, 'prior_mu': -0.03814628839657651, 'prior_sigma': 0.09815683755839387, 'normalization': 'layer'}. Best is trial 896 with value: 0.4533553242683411.
Generating morgan_rdkit fingerprints...
Generated fingerprints with 1280 features for 841 molecules
Trial 1654: 5-fold CV loss = 0.5876
[I 2025-08-07 22:29:54,087] Trial 1654 finished with value: 0.5875735759735108 and parameters: {'fp_type': 'morgan_rdkit', 'combined_morgan_radius': 3, 'combined_morgan_nBits': 1024, 'combined_rdkit_maxPath': 7, 'combined_rdkit_nBits': 256, 'num_hidden_layers': 3, 'hidden_dim_0': 256, 'hidden_dim_1': 1024, 'hidden_dim_2': 64, 'kl_weight': 0.00046269903622818393, 'lr': 0.007379927986916319, 'batch_size': 128, 'dropout_rate': 0.12436442235361905, 'prior_mu': -0.03890834920015273, 'prior_sigma': 0.0871999227702704, 'normalization': 'none'}. Best is trial 896 with value: 0.4533553242683411.
Generating morgan_rdkit fingerprints...
Generated fingerprints with 2048 features for 841 molecules
Trial 1651: 5-fold CV loss = 0.5365
[I 2025-08-07 22:29:57,208] Trial 1651 finished with value: 0.5365347623825073 and parameters: {'fp_type': 'morgan_rdkit', 'combined_morgan_radius': 3, 'combined_morgan_nBits': 1024, 'combined_rdkit_maxPath': 7, 'combined_rdkit_nBits': 1024, 'num_hidden_layers': 3, 'hidden_dim_0': 256, 'hidden_dim_1': 1024, 'hidden_dim_2': 64, 'kl_weight': 0.0005941383159168655, 'lr': 0.007334054300855016, 'batch_size': 128, 'dropout_rate': 0.12371530383402744, 'prior_mu': -0.04027168248018579, 'prior_sigma': 0.09825471224075581, 'normalization': 'layer'}. Best is trial 896 with value: 0.4533553242683411.
Generating morgan_rdkit fingerprints...
Generated fingerprints with 2048 features for 841 molecules
Trial 1653: 5-fold CV loss = 0.6261
[I 2025-08-07 22:30:03,492] Trial 1653 finished with value: 0.6260683536529541 and parameters: {'fp_type': 'morgan_rdkit', 'combined_morgan_radius': 3, 'combined_morgan_nBits': 1024, 'combined_rdkit_maxPath': 7, 'combined_rdkit_nBits': 1024, 'num_hidden_layers': 3, 'hidden_dim_0': 256, 'hidden_dim_1': 1024, 'hidden_dim_2': 64, 'kl_weight': 0.0005292949595370357, 'lr': 0.007621354926562966, 'batch_size': 128, 'dropout_rate': 0.11731079025209086, 'prior_mu': -0.03880066401014043, 'prior_sigma': 0.0987569834252559, 'normalization': 'none'}. Best is trial 896 with value: 0.4533553242683411.
Generating morgan_rdkit fingerprints...
Generated fingerprints with 2048 features for 841 molecules
Trial 1652: 5-fold CV loss = 0.5767
[I 2025-08-07 22:30:28,544] Trial 1652 finished with value: 0.5766593456268311 and parameters: {'fp_type': 'morgan_rdkit', 'combined_morgan_radius': 3, 'combined_morgan_nBits': 1024, 'combined_rdkit_maxPath': 7, 'combined_rdkit_nBits': 256, 'num_hidden_layers': 3, 'hidden_dim_0': 256, 'hidden_dim_1': 1024, 'hidden_dim_2': 64, 'kl_weight': 0.0005867092732165807, 'lr': 0.007161920083318261, 'batch_size': 128, 'dropout_rate': 0.11912112593646196, 'prior_mu': -0.03796867963085021, 'prior_sigma': 0.09476227992670776, 'normalization': 'none'}. Best is trial 896 with value: 0.4533553242683411.
Generating morgan_rdkit fingerprints...
Generated fingerprints with 2048 features for 841 molecules
Trial 1655: 5-fold CV loss = 0.4614
[I 2025-08-07 22:30:34,088] Trial 1655 finished with value: 0.46142917275428774 and parameters: {'fp_type': 'morgan_rdkit', 'combined_morgan_radius': 3, 'combined_morgan_nBits': 1024, 'combined_rdkit_maxPath': 7, 'combined_rdkit_nBits': 1024, 'num_hidden_layers': 3, 'hidden_dim_0': 256, 'hidden_dim_1': 1024, 'hidden_dim_2': 64, 'kl_weight': 0.0006025340417007442, 'lr': 0.008055770219360377, 'batch_size': 128, 'dropout_rate': 0.1106056611611323, 'prior_mu': -0.04870256111434774, 'prior_sigma': 0.09261937637310966, 'normalization': 'layer'}. Best is trial 896 with value: 0.4533553242683411.
Generating morgan_rdkit fingerprints...
Generated fingerprints with 2048 features for 841 molecules
Trial 1657: 5-fold CV loss = 0.4759
[I 2025-08-07 22:30:42,245] Trial 1657 finished with value: 0.47585532665252683 and parameters: {'fp_type': 'morgan_rdkit', 'combined_morgan_radius': 3, 'combined_morgan_nBits': 1024, 'combined_rdkit_maxPath': 7, 'combined_rdkit_nBits': 1024, 'num_hidden_layers': 3, 'hidden_dim_0': 256, 'hidden_dim_1': 1024, 'hidden_dim_2': 64, 'kl_weight': 0.00038077716078314494, 'lr': 0.00787194201865585, 'batch_size': 128, 'dropout_rate': 0.11243318808514498, 'prior_mu': -0.03633797934362787, 'prior_sigma': 0.09410815318700697, 'normalization': 'layer'}. Best is trial 896 with value: 0.4533553242683411.
Generating morgan_rdkit fingerprints...
Generated fingerprints with 2048 features for 841 molecules
Trial 1656: 5-fold CV loss = 0.4641
[I 2025-08-07 22:31:00,316] Trial 1656 finished with value: 0.4641189932823181 and parameters: {'fp_type': 'morgan_rdkit', 'combined_morgan_radius': 3, 'combined_morgan_nBits': 1024, 'combined_rdkit_maxPath': 7, 'combined_rdkit_nBits': 1024, 'num_hidden_layers': 3, 'hidden_dim_0': 256, 'hidden_dim_1': 1024, 'hidden_dim_2': 64, 'kl_weight': 0.00037641962734537277, 'lr': 0.007672818861628785, 'batch_size': 128, 'dropout_rate': 0.11050799694891897, 'prior_mu': -0.04591081139385772, 'prior_sigma': 0.09319276004111177, 'normalization': 'layer'}. Best is trial 896 with value: 0.4533553242683411.
Generating morgan_rdkit fingerprints...
Generated fingerprints with 2048 features for 841 molecules
Trial 1659: 5-fold CV loss = 0.4662
[I 2025-08-07 22:31:10,911] Trial 1659 finished with value: 0.46617265343666076 and parameters: {'fp_type': 'morgan_rdkit', 'combined_morgan_radius': 3, 'combined_morgan_nBits': 1024, 'combined_rdkit_maxPath': 7, 'combined_rdkit_nBits': 1024, 'num_hidden_layers': 3, 'hidden_dim_0': 256, 'hidden_dim_1': 1024, 'hidden_dim_2': 64, 'kl_weight': 0.0003790198015348265, 'lr': 0.008072141695659169, 'batch_size': 128, 'dropout_rate': 0.09042766739352716, 'prior_mu': -0.04876712003275649, 'prior_sigma': 0.08722421365544052, 'normalization': 'layer'}. Best is trial 896 with value: 0.4533553242683411.
Generating morgan_rdkit fingerprints...
Generated fingerprints with 2048 features for 841 molecules
Trial 1660: 5-fold CV loss = 0.4775
[I 2025-08-07 22:31:24,065] Trial 1660 finished with value: 0.47753298878669737 and parameters: {'fp_type': 'morgan_rdkit', 'combined_morgan_radius': 3, 'combined_morgan_nBits': 1024, 'combined_rdkit_maxPath': 6, 'combined_rdkit_nBits': 1024, 'num_hidden_layers': 3, 'hidden_dim_0': 256, 'hidden_dim_1': 1024, 'hidden_dim_2': 128, 'kl_weight': 0.0003962409826860003, 'lr': 0.0069063181528547, 'batch_size': 128, 'dropout_rate': 0.09740770497241648, 'prior_mu': -0.052104586964432195, 'prior_sigma': 0.08659705489611366, 'normalization': 'layer'}. Best is trial 896 with value: 0.4533553242683411.
Generating morgan_rdkit fingerprints...
Generated fingerprints with 2048 features for 841 molecules
Trial 1662: 5-fold CV loss = 0.4969
[I 2025-08-07 22:31:39,993] Trial 1662 finished with value: 0.4968717873096466 and parameters: {'fp_type': 'morgan_rdkit', 'combined_morgan_radius': 3, 'combined_morgan_nBits': 1024, 'combined_rdkit_maxPath': 6, 'combined_rdkit_nBits': 1024, 'num_hidden_layers': 3, 'hidden_dim_0': 256, 'hidden_dim_1': 1024, 'hidden_dim_2': 128, 'kl_weight': 0.0004511530576866779, 'lr': 0.009945429212944043, 'batch_size': 128, 'dropout_rate': 0.08110164036128917, 'prior_mu': -0.035011431928988083, 'prior_sigma': 0.10279106092048733, 'normalization': 'layer'}. Best is trial 896 with value: 0.4533553242683411.
Generating morgan_rdkit fingerprints...
Generated fingerprints with 2048 features for 841 molecules
Trial 1658: 5-fold CV loss = 0.4730
[I 2025-08-07 22:32:00,371] Trial 1658 finished with value: 0.4729752540588379 and parameters: {'fp_type': 'morgan_rdkit', 'combined_morgan_radius': 3, 'combined_morgan_nBits': 1024, 'combined_rdkit_maxPath': 7, 'combined_rdkit_nBits': 1024, 'num_hidden_layers': 3, 'hidden_dim_0': 256, 'hidden_dim_1': 1024, 'hidden_dim_2': 64, 'kl_weight': 0.00038451061336994166, 'lr': 0.008091588712451036, 'batch_size': 128, 'dropout_rate': 0.10534288645932657, 'prior_mu': -0.0513257402884002, 'prior_sigma': 0.09306466276518036, 'normalization': 'layer'}. Best is trial 896 with value: 0.4533553242683411.
Generating morgan_rdkit fingerprints...
Generated fingerprints with 2048 features for 841 molecules
Trial 1661: 5-fold CV loss = 0.4795
[I 2025-08-07 22:32:03,409] Trial 1661 finished with value: 0.47952136397361755 and parameters: {'fp_type': 'morgan_rdkit', 'combined_morgan_radius': 3, 'combined_morgan_nBits': 1024, 'combined_rdkit_maxPath': 7, 'combined_rdkit_nBits': 1024, 'num_hidden_layers': 3, 'hidden_dim_0': 256, 'hidden_dim_1': 1024, 'hidden_dim_2': 128, 'kl_weight': 0.00047019994146189583, 'lr': 0.006962088093478022, 'batch_size': 128, 'dropout_rate': 0.08345226503635107, 'prior_mu': -0.04944139779353023, 'prior_sigma': 0.10380855844983805, 'normalization': 'layer'}. Best is trial 896 with value: 0.4533553242683411.
Generating morgan_rdkit fingerprints...
Generated fingerprints with 2048 features for 841 molecules
Trial 1663: 5-fold CV loss = 0.4610
[I 2025-08-07 22:32:08,842] Trial 1663 finished with value: 0.46097689867019653 and parameters: {'fp_type': 'morgan_rdkit', 'combined_morgan_radius': 3, 'combined_morgan_nBits': 1024, 'combined_rdkit_maxPath': 7, 'combined_rdkit_nBits': 1024, 'num_hidden_layers': 3, 'hidden_dim_0': 256, 'hidden_dim_1': 1024, 'hidden_dim_2': 64, 'kl_weight': 0.00046555433304471986, 'lr': 0.008828385257141379, 'batch_size': 128, 'dropout_rate': 0.08184341675023794, 'prior_mu': -0.033216689675401895, 'prior_sigma': 0.10321749680167347, 'normalization': 'layer'}. Best is trial 896 with value: 0.4533553242683411.
Generating morgan_rdkit fingerprints...
Generated fingerprints with 2048 features for 841 molecules
Trial 1664: 5-fold CV loss = 0.5514
[I 2025-08-07 22:32:10,167] Trial 1664 finished with value: 0.5513959646224975 and parameters: {'fp_type': 'morgan_rdkit', 'combined_morgan_radius': 3, 'combined_morgan_nBits': 1024, 'combined_rdkit_maxPath': 7, 'combined_rdkit_nBits': 1024, 'num_hidden_layers': 3, 'hidden_dim_0': 256, 'hidden_dim_1': 1024, 'hidden_dim_2': 64, 'kl_weight': 0.0004712917271875952, 'lr': 0.007005293273747714, 'batch_size': 128, 'dropout_rate': 0.1283034427085332, 'prior_mu': -0.0582651892653727, 'prior_sigma': 0.05906695499423308, 'normalization': 'layer'}. Best is trial 896 with value: 0.4533553242683411.
Generating morgan_rdkit fingerprints...
Generated fingerprints with 2048 features for 841 molecules
Trial 1666: 5-fold CV loss = 0.8827
