[I 2025-08-07 21:28:15,236] Trial 1335 finished with value: 0.46145579814910886 and parameters: {'fp_type': 'morgan_rdkit', 'combined_morgan_radius': 3, 'combined_morgan_nBits': 1024, 'combined_rdkit_maxPath': 7, 'combined_rdkit_nBits': 1024, 'num_hidden_layers': 3, 'hidden_dim_0': 256, 'hidden_dim_1': 1024, 'hidden_dim_2': 64, 'kl_weight': 0.00019971932389822517, 'lr': 0.007639444404840748, 'batch_size': 128, 'dropout_rate': 0.17608096520261657, 'prior_mu': -0.0017249415278116822, 'prior_sigma': 0.07747046501320314, 'normalization': 'layer'}. Best is trial 896 with value: 0.4533553242683411.
Generating morgan_rdkit fingerprints...
Generated fingerprints with 2048 features for 841 molecules
Trial 1338: 5-fold CV loss = 0.4723
[I 2025-08-07 21:28:42,358] Trial 1338 finished with value: 0.47234978079795836 and parameters: {'fp_type': 'morgan_rdkit', 'combined_morgan_radius': 3, 'combined_morgan_nBits': 1024, 'combined_rdkit_maxPath': 6, 'combined_rdkit_nBits': 1024, 'num_hidden_layers': 3, 'hidden_dim_0': 256, 'hidden_dim_1': 1024, 'hidden_dim_2': 64, 'kl_weight': 0.00019411892076129012, 'lr': 0.008415679889176004, 'batch_size': 128, 'dropout_rate': 0.1800108120427673, 'prior_mu': -0.04860266377275093, 'prior_sigma': 0.07362899809834225, 'normalization': 'layer'}. Best is trial 896 with value: 0.4533553242683411.
Generating morgan fingerprints...
Generated fingerprints with 1024 features for 841 molecules
Trial 1339: 5-fold CV loss = 0.4795
[I 2025-08-07 21:28:43,735] Trial 1339 finished with value: 0.47947690486907957 and parameters: {'fp_type': 'morgan_rdkit', 'combined_morgan_radius': 3, 'combined_morgan_nBits': 1024, 'combined_rdkit_maxPath': 6, 'combined_rdkit_nBits': 1024, 'num_hidden_layers': 3, 'hidden_dim_0': 256, 'hidden_dim_1': 256, 'hidden_dim_2': 64, 'kl_weight': 0.00016270101166901792, 'lr': 0.00875428963410349, 'batch_size': 128, 'dropout_rate': 0.18116391928412376, 'prior_mu': -0.04989977482059528, 'prior_sigma': 0.07275007537127982, 'normalization': 'layer'}. Best is trial 896 with value: 0.4533553242683411.
Generating morgan_rdkit fingerprints...
Generated fingerprints with 2048 features for 841 molecules
Trial 1337: 5-fold CV loss = 0.4725
[I 2025-08-07 21:28:48,390] Trial 1337 finished with value: 0.47251641750335693 and parameters: {'fp_type': 'morgan_rdkit', 'combined_morgan_radius': 3, 'combined_morgan_nBits': 1024, 'combined_rdkit_maxPath': 6, 'combined_rdkit_nBits': 1024, 'num_hidden_layers': 3, 'hidden_dim_0': 256, 'hidden_dim_1': 1024, 'hidden_dim_2': 64, 'kl_weight': 0.00020165146634800073, 'lr': 0.008611931824641443, 'batch_size': 128, 'dropout_rate': 0.1783185193155355, 'prior_mu': -0.004044666109084029, 'prior_sigma': 0.0742171181163735, 'normalization': 'layer'}. Best is trial 896 with value: 0.4533553242683411.
Generating morgan fingerprints...
Generated fingerprints with 1024 features for 841 molecules
Trial 1340: 5-fold CV loss = 0.8664
[I 2025-08-07 21:29:13,222] Trial 1340 finished with value: 0.8664214015007019 and parameters: {'fp_type': 'morgan', 'morgan_only_radius': 2, 'morgan_only_nBits': 1024, 'num_hidden_layers': 3, 'hidden_dim_0': 256, 'hidden_dim_1': 256, 'hidden_dim_2': 64, 'kl_weight': 0.0004681811826812765, 'lr': 0.0002415448546263415, 'batch_size': 128, 'dropout_rate': 0.16658046892240358, 'prior_mu': -0.024250213277939827, 'prior_sigma': 0.07405702771087896, 'normalization': 'layer'}. Best is trial 896 with value: 0.4533553242683411.
Generating morgan_rdkit fingerprints...
Generated fingerprints with 2048 features for 841 molecules
Trial 1341: 5-fold CV loss = 0.7406
[I 2025-08-07 21:29:18,281] Trial 1341 finished with value: 0.7405662655830383 and parameters: {'fp_type': 'morgan_rdkit', 'combined_morgan_radius': 3, 'combined_morgan_nBits': 1024, 'combined_rdkit_maxPath': 7, 'combined_rdkit_nBits': 1024, 'num_hidden_layers': 3, 'hidden_dim_0': 128, 'hidden_dim_1': 1024, 'hidden_dim_2': 1024, 'kl_weight': 0.00016708644203878808, 'lr': 0.008892727111290346, 'batch_size': 128, 'dropout_rate': 0.16790840199317777, 'prior_mu': -0.023401851539564426, 'prior_sigma': 0.08206470786523941, 'normalization': 'layer'}. Best is trial 896 with value: 0.4533553242683411.
Generating morgan_rdkit fingerprints...
Generated fingerprints with 2048 features for 841 molecules
Trial 1336: 5-fold CV loss = 0.4595
[I 2025-08-07 21:29:20,773] Trial 1336 finished with value: 0.4595471084117889 and parameters: {'fp_type': 'morgan_rdkit', 'combined_morgan_radius': 3, 'combined_morgan_nBits': 1024, 'combined_rdkit_maxPath': 7, 'combined_rdkit_nBits': 1024, 'num_hidden_layers': 3, 'hidden_dim_0': 256, 'hidden_dim_1': 1024, 'hidden_dim_2': 64, 'kl_weight': 0.00017100615587995307, 'lr': 0.008817826696501017, 'batch_size': 128, 'dropout_rate': 0.17831687784475814, 'prior_mu': -0.049832957481260653, 'prior_sigma': 0.07589162890859238, 'normalization': 'layer'}. Best is trial 896 with value: 0.4533553242683411.
Generating morgan_rdkit fingerprints...
Generated fingerprints with 2048 features for 841 molecules
Trial 1343: 5-fold CV loss = 0.8363
[I 2025-08-07 21:29:35,054] Trial 1343 finished with value: 0.8362731099128723 and parameters: {'fp_type': 'morgan_rdkit', 'combined_morgan_radius': 3, 'combined_morgan_nBits': 1024, 'combined_rdkit_maxPath': 7, 'combined_rdkit_nBits': 1024, 'num_hidden_layers': 3, 'hidden_dim_0': 128, 'hidden_dim_1': 1024, 'hidden_dim_2': 1024, 'kl_weight': 0.00018142948023580158, 'lr': 0.009979391420824558, 'batch_size': 128, 'dropout_rate': 0.15926957144213097, 'prior_mu': -0.030413414295337466, 'prior_sigma': 0.08234704875336768, 'normalization': 'layer'}. Best is trial 896 with value: 0.4533553242683411.
Generating rdkit fingerprints...
Generated fingerprints with 512 features for 841 molecules
Trial 1342: 5-fold CV loss = 0.6210
[I 2025-08-07 21:29:42,214] Trial 1342 finished with value: 0.6209542870521545 and parameters: {'fp_type': 'morgan', 'morgan_only_radius': 2, 'morgan_only_nBits': 1024, 'num_hidden_layers': 3, 'hidden_dim_0': 256, 'hidden_dim_1': 1024, 'hidden_dim_2': 1024, 'kl_weight': 0.0001716234282717906, 'lr': 0.006981258007963032, 'batch_size': 64, 'dropout_rate': 0.16556592223499206, 'prior_mu': -0.022748875596842383, 'prior_sigma': 0.08184136969748514, 'normalization': 'layer'}. Best is trial 896 with value: 0.4533553242683411.
Generating rdkit fingerprints...
Generated fingerprints with 512 features for 841 molecules
Trial 1344: 5-fold CV loss = 0.4706
[I 2025-08-07 21:30:03,900] Trial 1344 finished with value: 0.4705561697483063 and parameters: {'fp_type': 'morgan_rdkit', 'combined_morgan_radius': 3, 'combined_morgan_nBits': 1024, 'combined_rdkit_maxPath': 7, 'combined_rdkit_nBits': 1024, 'num_hidden_layers': 3, 'hidden_dim_0': 256, 'hidden_dim_1': 1024, 'hidden_dim_2': 64, 'kl_weight': 0.00016099571046826935, 'lr': 0.006849572693933316, 'batch_size': 64, 'dropout_rate': 0.1586229455691906, 'prior_mu': -0.03321899386164444, 'prior_sigma': 0.07967353977605912, 'normalization': 'layer'}. Best is trial 896 with value: 0.4533553242683411.
Generating rdkit fingerprints...
Generated fingerprints with 512 features for 841 molecules
Trial 1346: 5-fold CV loss = 0.5100
[I 2025-08-07 21:30:09,495] Trial 1346 finished with value: 0.5100392043590546 and parameters: {'fp_type': 'rdkit', 'rdkit_only_maxPath': 5, 'rdkit_only_nBits': 512, 'num_hidden_layers': 3, 'hidden_dim_0': 256, 'hidden_dim_1': 1024, 'hidden_dim_2': 64, 'kl_weight': 0.00018443026008742308, 'lr': 0.009314306558549916, 'batch_size': 128, 'dropout_rate': 0.18941699929072134, 'prior_mu': -0.05701735052443209, 'prior_sigma': 0.07536261578094629, 'normalization': 'layer'}. Best is trial 896 with value: 0.4533553242683411.
Generating morgan_rdkit fingerprints...
Generated fingerprints with 2048 features for 841 molecules
Trial 1345: 5-fold CV loss = 0.5036
[I 2025-08-07 21:30:26,474] Trial 1345 finished with value: 0.5035591006278992 and parameters: {'fp_type': 'morgan_rdkit', 'combined_morgan_radius': 3, 'combined_morgan_nBits': 1024, 'combined_rdkit_maxPath': 7, 'combined_rdkit_nBits': 1024, 'num_hidden_layers': 1, 'hidden_dim_0': 256, 'kl_weight': 0.00016936505386557315, 'lr': 0.009156743625613157, 'batch_size': 64, 'dropout_rate': 0.17640214136741802, 'prior_mu': -0.06138897466402126, 'prior_sigma': 0.07793973969127775, 'normalization': 'layer'}. Best is trial 896 with value: 0.4533553242683411.
Generating morgan_rdkit fingerprints...
Generated fingerprints with 2048 features for 841 molecules
Trial 1347: 5-fold CV loss = 0.5152
[I 2025-08-07 21:30:30,012] Trial 1347 finished with value: 0.5152173459529876 and parameters: {'fp_type': 'rdkit', 'rdkit_only_maxPath': 5, 'rdkit_only_nBits': 512, 'num_hidden_layers': 3, 'hidden_dim_0': 256, 'hidden_dim_1': 1024, 'hidden_dim_2': 64, 'kl_weight': 0.00017055595646379558, 'lr': 0.009293769136159185, 'batch_size': 128, 'dropout_rate': 0.17908734933153309, 'prior_mu': -0.054896276773728214, 'prior_sigma': 0.0756044796821661, 'normalization': 'layer'}. Best is trial 896 with value: 0.4533553242683411.
Generating morgan_rdkit fingerprints...
Generated fingerprints with 2048 features for 841 molecules
Trial 1348: 5-fold CV loss = 0.5102
[I 2025-08-07 21:30:39,585] Trial 1348 finished with value: 0.5102469623088837 and parameters: {'fp_type': 'rdkit', 'rdkit_only_maxPath': 5, 'rdkit_only_nBits': 512, 'num_hidden_layers': 3, 'hidden_dim_0': 256, 'hidden_dim_1': 1024, 'hidden_dim_2': 64, 'kl_weight': 0.00019919903850608095, 'lr': 0.009772470044659651, 'batch_size': 128, 'dropout_rate': 0.18755284672473768, 'prior_mu': -0.03911121412692134, 'prior_sigma': 0.07544674630345187, 'normalization': 'layer'}. Best is trial 896 with value: 0.4533553242683411.
Generating morgan_rdkit fingerprints...
Generated fingerprints with 2048 features for 841 molecules
Trial 1352: 5-fold CV loss = 0.9800
[I 2025-08-07 21:30:47,409] Trial 1352 finished with value: 0.9799730062484742 and parameters: {'fp_type': 'morgan_rdkit', 'combined_morgan_radius': 3, 'combined_morgan_nBits': 1024, 'combined_rdkit_maxPath': 7, 'combined_rdkit_nBits': 1024, 'num_hidden_layers': 0, 'kl_weight': 0.0001775605668122748, 'lr': 0.008175781829503511, 'batch_size': 128, 'dropout_rate': 0.180379663146023, 'prior_mu': -0.054545017227507056, 'prior_sigma': 0.07056572676608061, 'normalization': 'layer'}. Best is trial 896 with value: 0.4533553242683411.
Generating morgan_rdkit fingerprints...
Generated fingerprints with 2048 features for 841 molecules
Trial 1349: 5-fold CV loss = 0.4657
[I 2025-08-07 21:30:50,728] Trial 1349 finished with value: 0.46574201583862307 and parameters: {'fp_type': 'morgan_rdkit', 'combined_morgan_radius': 3, 'combined_morgan_nBits': 1024, 'combined_rdkit_maxPath': 7, 'combined_rdkit_nBits': 1024, 'num_hidden_layers': 3, 'hidden_dim_0': 256, 'hidden_dim_1': 1024, 'hidden_dim_2': 64, 'kl_weight': 0.00015797475495572404, 'lr': 0.009046935349820864, 'batch_size': 128, 'dropout_rate': 0.17650795570583236, 'prior_mu': -0.04988088408750047, 'prior_sigma': 0.07728004867263091, 'normalization': 'layer'}. Best is trial 896 with value: 0.4533553242683411.
Generating morgan_rdkit fingerprints...
Generated fingerprints with 2048 features for 841 molecules
Trial 1354: 5-fold CV loss = 0.5774
[I 2025-08-07 21:31:22,556] Trial 1354 finished with value: 0.5773691654205322 and parameters: {'fp_type': 'morgan_rdkit', 'combined_morgan_radius': 3, 'combined_morgan_nBits': 1024, 'combined_rdkit_maxPath': 7, 'combined_rdkit_nBits': 1024, 'num_hidden_layers': 3, 'hidden_dim_0': 1024, 'hidden_dim_1': 128, 'hidden_dim_2': 64, 'kl_weight': 0.0005794284822696487, 'lr': 0.009982448734687975, 'batch_size': 128, 'dropout_rate': 0.18473056750833342, 'prior_mu': -0.049152506216447456, 'prior_sigma': 0.07088282839472061, 'normalization': 'none'}. Best is trial 896 with value: 0.4533553242683411.
Generating morgan_rdkit fingerprints...
Generated fingerprints with 2048 features for 841 molecules
Trial 1353: 5-fold CV loss = 0.4707
[I 2025-08-07 21:31:25,810] Trial 1353 finished with value: 0.47073363065719603 and parameters: {'fp_type': 'morgan_rdkit', 'combined_morgan_radius': 3, 'combined_morgan_nBits': 1024, 'combined_rdkit_maxPath': 7, 'combined_rdkit_nBits': 1024, 'num_hidden_layers': 3, 'hidden_dim_0': 1024, 'hidden_dim_1': 128, 'hidden_dim_2': 64, 'kl_weight': 0.00016496314215723234, 'lr': 0.005089297321661079, 'batch_size': 128, 'dropout_rate': 0.17479308055717774, 'prior_mu': -0.052673590090017, 'prior_sigma': 0.07044426869478629, 'normalization': 'layer'}. Best is trial 896 with value: 0.4533553242683411.
Generating morgan_rdkit fingerprints...
Generated fingerprints with 2048 features for 841 molecules
Trial 1351: 5-fold CV loss = 0.5717
[I 2025-08-07 21:31:31,397] Trial 1351 finished with value: 0.5717206478118897 and parameters: {'fp_type': 'morgan_rdkit', 'combined_morgan_radius': 3, 'combined_morgan_nBits': 1024, 'combined_rdkit_maxPath': 7, 'combined_rdkit_nBits': 1024, 'num_hidden_layers': 3, 'hidden_dim_0': 1024, 'hidden_dim_1': 1024, 'hidden_dim_2': 64, 'kl_weight': 0.0001828459807158106, 'lr': 0.00800885828629428, 'batch_size': 128, 'dropout_rate': 0.18603555947794473, 'prior_mu': -0.05178249211830696, 'prior_sigma': 0.07236768478263499, 'normalization': 'none'}. Best is trial 896 with value: 0.4533553242683411.
Generating morgan_rdkit fingerprints...
Generated fingerprints with 2048 features for 841 molecules
Trial 1350: 5-fold CV loss = 0.4644
[I 2025-08-07 21:31:48,482] Trial 1350 finished with value: 0.46440123915672304 and parameters: {'fp_type': 'morgan_rdkit', 'combined_morgan_radius': 3, 'combined_morgan_nBits': 1024, 'combined_rdkit_maxPath': 7, 'combined_rdkit_nBits': 1024, 'num_hidden_layers': 3, 'hidden_dim_0': 1024, 'hidden_dim_1': 1024, 'hidden_dim_2': 64, 'kl_weight': 0.00017083949699421146, 'lr': 0.009120798894947851, 'batch_size': 128, 'dropout_rate': 0.17511010566881413, 'prior_mu': -0.04773261189792756, 'prior_sigma': 0.07032144461314772, 'normalization': 'layer'}. Best is trial 896 with value: 0.4533553242683411.
Generating morgan_rdkit fingerprints...
Generated fingerprints with 2048 features for 841 molecules
Trial 1355: 5-fold CV loss = 0.4648
[I 2025-08-07 21:32:03,207] Trial 1355 finished with value: 0.4648232817649841 and parameters: {'fp_type': 'morgan_rdkit', 'combined_morgan_radius': 3, 'combined_morgan_nBits': 1024, 'combined_rdkit_maxPath': 7, 'combined_rdkit_nBits': 1024, 'num_hidden_layers': 3, 'hidden_dim_0': 256, 'hidden_dim_1': 1024, 'hidden_dim_2': 64, 'kl_weight': 0.00020908174656535079, 'lr': 0.00826626854390552, 'batch_size': 128, 'dropout_rate': 0.17207317242070472, 'prior_mu': -0.0444659682380885, 'prior_sigma': 0.0652306593568303, 'normalization': 'layer'}. Best is trial 896 with value: 0.4533553242683411.
Generating morgan_rdkit fingerprints...
Generated fingerprints with 2048 features for 841 molecules
Trial 1356: 5-fold CV loss = 0.5516
[I 2025-08-07 21:32:06,609] Trial 1356 finished with value: 0.5515852451324463 and parameters: {'fp_type': 'morgan_rdkit', 'combined_morgan_radius': 3, 'combined_morgan_nBits': 1024, 'combined_rdkit_maxPath': 8, 'combined_rdkit_nBits': 1024, 'num_hidden_layers': 3, 'hidden_dim_0': 256, 'hidden_dim_1': 1024, 'hidden_dim_2': 64, 'kl_weight': 0.000206609452365334, 'lr': 0.00806461330941821, 'batch_size': 128, 'dropout_rate': 0.1914371859642998, 'prior_mu': -0.05978541828814811, 'prior_sigma': 0.07870385221940172, 'normalization': 'layer'}. Best is trial 896 with value: 0.4533553242683411.
Generating morgan_rdkit fingerprints...
Generated fingerprints with 2048 features for 841 molecules
Trial 1357: 5-fold CV loss = 0.4834
[I 2025-08-07 21:32:30,313] Trial 1357 finished with value: 0.483352392911911 and parameters: {'fp_type': 'morgan_rdkit', 'combined_morgan_radius': 3, 'combined_morgan_nBits': 1024, 'combined_rdkit_maxPath': 8, 'combined_rdkit_nBits': 1024, 'num_hidden_layers': 3, 'hidden_dim_0': 256, 'hidden_dim_1': 1024, 'hidden_dim_2': 64, 'kl_weight': 0.00020672467409978137, 'lr': 0.008009278374650864, 'batch_size': 128, 'dropout_rate': 0.1741100825572056, 'prior_mu': -0.06308489601237385, 'prior_sigma': 0.06274710553621625, 'normalization': 'layer'}. Best is trial 896 with value: 0.4533553242683411.
Generating morgan_rdkit fingerprints...
Generated fingerprints with 1536 features for 841 molecules
Trial 1360: 5-fold CV loss = 0.4645
[I 2025-08-07 21:32:42,308] Trial 1360 finished with value: 0.4644913852214813 and parameters: {'fp_type': 'morgan_rdkit', 'combined_morgan_radius': 3, 'combined_morgan_nBits': 1024, 'combined_rdkit_maxPath': 7, 'combined_rdkit_nBits': 1024, 'num_hidden_layers': 3, 'hidden_dim_0': 256, 'hidden_dim_1': 1024, 'hidden_dim_2': 64, 'kl_weight': 0.0004381377951502686, 'lr': 0.00467659240853193, 'batch_size': 128, 'dropout_rate': 0.15486623499117247, 'prior_mu': -0.037798830866760794, 'prior_sigma': 0.07808271270299666, 'normalization': 'layer'}. Best is trial 896 with value: 0.4533553242683411.
Generating morgan_rdkit fingerprints...
Generated fingerprints with 2048 features for 841 molecules
Trial 1359: 5-fold CV loss = 0.5984
[I 2025-08-07 21:32:48,136] Trial 1359 finished with value: 0.5983909487724304 and parameters: {'fp_type': 'morgan_rdkit', 'combined_morgan_radius': 3, 'combined_morgan_nBits': 1024, 'combined_rdkit_maxPath': 8, 'combined_rdkit_nBits': 1024, 'num_hidden_layers': 3, 'hidden_dim_0': 256, 'hidden_dim_1': 1024, 'hidden_dim_2': 64, 'kl_weight': 0.04208287720630268, 'lr': 0.004863207165454378, 'batch_size': 128, 'dropout_rate': 0.16991228584216117, 'prior_mu': -0.03868278638580541, 'prior_sigma': 0.07838826096679043, 'normalization': 'layer'}. Best is trial 896 with value: 0.4533553242683411.
Generating morgan_rdkit fingerprints...
Generated fingerprints with 1536 features for 841 molecules
Trial 1362: 5-fold CV loss = 0.8860
[I 2025-08-07 21:32:55,986] Trial 1362 finished with value: 0.8860047101974488 and parameters: {'fp_type': 'morgan_rdkit', 'combined_morgan_radius': 3, 'combined_morgan_nBits': 1024, 'combined_rdkit_maxPath': 7, 'combined_rdkit_nBits': 1024, 'num_hidden_layers': 3, 'hidden_dim_0': 256, 'hidden_dim_1': 1024, 'hidden_dim_2': 64, 'kl_weight': 0.00039824804750628864, 'lr': 0.005188309138980207, 'batch_size': 128, 'dropout_rate': 0.19562641612762446, 'prior_mu': -0.042334220580038356, 'prior_sigma': 0.16630979730925183, 'normalization': 'layer'}. Best is trial 896 with value: 0.4533553242683411.
Generating morgan_rdkit fingerprints...
Generated fingerprints with 1536 features for 841 molecules
Trial 1364: 5-fold CV loss = 0.8809
[I 2025-08-07 21:33:20,311] Trial 1364 finished with value: 0.8808740139007568 and parameters: {'fp_type': 'morgan_rdkit', 'combined_morgan_radius': 3, 'combined_morgan_nBits': 1024, 'combined_rdkit_maxPath': 7, 'combined_rdkit_nBits': 512, 'num_hidden_layers': 3, 'hidden_dim_0': 256, 'hidden_dim_1': 1024, 'hidden_dim_2': 64, 'kl_weight': 0.0001547461389949852, 'lr': 0.0002066498623431339, 'batch_size': 128, 'dropout_rate': 0.16096655192041248, 'prior_mu': 0.02430535153685119, 'prior_sigma': 0.06664591301001048, 'normalization': 'layer'}. Best is trial 896 with value: 0.4533553242683411.
Generating morgan_rdkit fingerprints...
Generated fingerprints with 2048 features for 841 molecules
Trial 1361: 5-fold CV loss = 0.5707
[I 2025-08-07 21:33:21,754] Trial 1361 finished with value: 0.570722371339798 and parameters: {'fp_type': 'morgan_rdkit', 'combined_morgan_radius': 3, 'combined_morgan_nBits': 1024, 'combined_rdkit_maxPath': 7, 'combined_rdkit_nBits': 512, 'num_hidden_layers': 3, 'hidden_dim_0': 256, 'hidden_dim_1': 1024, 'hidden_dim_2': 64, 'kl_weight': 0.0004190100122131032, 'lr': 0.005256787671524238, 'batch_size': 128, 'dropout_rate': 0.14615391392126975, 'prior_mu': -0.04212043554219763, 'prior_sigma': 0.06595010862839057, 'normalization': 'layer'}. Best is trial 896 with value: 0.4533553242683411.
Generating morgan_rdkit fingerprints...
Generated fingerprints with 2048 features for 841 molecules
Trial 1358: 5-fold CV loss = 0.4595
[I 2025-08-07 21:33:25,949] Trial 1358 finished with value: 0.4594843924045563 and parameters: {'fp_type': 'morgan_rdkit', 'combined_morgan_radius': 3, 'combined_morgan_nBits': 1024, 'combined_rdkit_maxPath': 7, 'combined_rdkit_nBits': 1024, 'num_hidden_layers': 3, 'hidden_dim_0': 256, 'hidden_dim_1': 1024, 'hidden_dim_2': 64, 'kl_weight': 0.00020430579392789923, 'lr': 0.004658793019164698, 'batch_size': 128, 'dropout_rate': 0.1628463243821155, 'prior_mu': 0.18682490728668652, 'prior_sigma': 0.06599366876330147, 'normalization': 'layer'}. Best is trial 896 with value: 0.4533553242683411.
Generating morgan_rdkit fingerprints...
Generated fingerprints with 2048 features for 841 molecules
Trial 1363: 5-fold CV loss = 0.5853
[I 2025-08-07 21:33:27,721] Trial 1363 finished with value: 0.5852568924427033 and parameters: {'fp_type': 'morgan_rdkit', 'combined_morgan_radius': 3, 'combined_morgan_nBits': 1024, 'combined_rdkit_maxPath': 7, 'combined_rdkit_nBits': 512, 'num_hidden_layers': 3, 'hidden_dim_0': 256, 'hidden_dim_1': 1024, 'hidden_dim_2': 64, 'kl_weight': 0.00015836268391080735, 'lr': 0.007522722092457765, 'batch_size': 128, 'dropout_rate': 0.16073075092953218, 'prior_mu': -0.0669437392714817, 'prior_sigma': 0.08390818300113406, 'normalization': 'layer'}. Best is trial 896 with value: 0.4533553242683411.
Generating morgan_rdkit fingerprints...
Generated fingerprints with 2048 features for 841 molecules
Trial 1365: 5-fold CV loss = 0.4671
