[I 2025-08-07 18:01:32,548] Trial 373 finished with value: 0.48086233139038087 and parameters: {'fp_type': 'morgan_rdkit', 'combined_morgan_radius': 2, 'combined_morgan_nBits': 512, 'combined_rdkit_maxPath': 7, 'combined_rdkit_nBits': 1024, 'num_hidden_layers': 2, 'hidden_dim_0': 64, 'hidden_dim_1': 128, 'kl_weight': 0.00014372008285043093, 'lr': 0.0028775877409608955, 'batch_size': 64, 'dropout_rate': 0.1898795189810949, 'prior_mu': 0.039734602409373314, 'prior_sigma': 0.026552937876230705, 'normalization': 'layer'}. Best is trial 179 with value: 0.4671938598155975.
Generating morgan_rdkit fingerprints...
Generated fingerprints with 1536 features for 841 molecules
Trial 375: 5-fold CV loss = 0.4776
[I 2025-08-07 18:01:39,980] Trial 375 finished with value: 0.4775713562965393 and parameters: {'fp_type': 'morgan_rdkit', 'combined_morgan_radius': 2, 'combined_morgan_nBits': 512, 'combined_rdkit_maxPath': 7, 'combined_rdkit_nBits': 1024, 'num_hidden_layers': 2, 'hidden_dim_0': 64, 'hidden_dim_1': 128, 'kl_weight': 0.00011466821239833767, 'lr': 0.0032710691650924884, 'batch_size': 32, 'dropout_rate': 0.2136632408212207, 'prior_mu': 0.034038818684155384, 'prior_sigma': 0.02520145780192298, 'normalization': 'layer'}. Best is trial 179 with value: 0.4671938598155975.
Generating morgan_rdkit fingerprints...
Generated fingerprints with 1536 features for 841 molecules
Trial 376: 5-fold CV loss = 0.5669
[I 2025-08-07 18:02:03,285] Trial 376 finished with value: 0.5668971419334412 and parameters: {'fp_type': 'morgan_rdkit', 'combined_morgan_radius': 2, 'combined_morgan_nBits': 512, 'combined_rdkit_maxPath': 8, 'combined_rdkit_nBits': 1024, 'num_hidden_layers': 2, 'hidden_dim_0': 64, 'hidden_dim_1': 128, 'kl_weight': 0.01880047751643497, 'lr': 0.003230607068337269, 'batch_size': 32, 'dropout_rate': 0.19176515830304366, 'prior_mu': 0.036821419286897285, 'prior_sigma': 0.018197165191462188, 'normalization': 'layer'}. Best is trial 179 with value: 0.4671938598155975.
Generating morgan_rdkit fingerprints...
Generated fingerprints with 1536 features for 841 molecules
Trial 378: 5-fold CV loss = 0.4937
[I 2025-08-07 18:02:35,167] Trial 378 finished with value: 0.49365670084953306 and parameters: {'fp_type': 'morgan_rdkit', 'combined_morgan_radius': 2, 'combined_morgan_nBits': 512, 'combined_rdkit_maxPath': 8, 'combined_rdkit_nBits': 1024, 'num_hidden_layers': 2, 'hidden_dim_0': 64, 'hidden_dim_1': 512, 'kl_weight': 0.00011303091290039415, 'lr': 0.002380337697616489, 'batch_size': 32, 'dropout_rate': 0.30937818007454193, 'prior_mu': 0.03316135687348043, 'prior_sigma': 0.010054019138821492, 'normalization': 'layer'}. Best is trial 179 with value: 0.4671938598155975.
Generating morgan_rdkit fingerprints...
Generated fingerprints with 1536 features for 841 molecules
Trial 379: 5-fold CV loss = 0.4821
[I 2025-08-07 18:02:56,022] Trial 379 finished with value: 0.48214731812477113 and parameters: {'fp_type': 'morgan_rdkit', 'combined_morgan_radius': 2, 'combined_morgan_nBits': 512, 'combined_rdkit_maxPath': 6, 'combined_rdkit_nBits': 1024, 'num_hidden_layers': 2, 'hidden_dim_0': 64, 'hidden_dim_1': 512, 'kl_weight': 0.00011310110696267666, 'lr': 0.0024465446172367944, 'batch_size': 32, 'dropout_rate': 0.2477487578394613, 'prior_mu': 0.02321228331132927, 'prior_sigma': 0.0308494112128596, 'normalization': 'layer'}. Best is trial 179 with value: 0.4671938598155975.
Generating morgan_rdkit fingerprints...
Generated fingerprints with 1536 features for 841 molecules
Trial 380: 5-fold CV loss = 0.4846
[I 2025-08-07 18:03:13,950] Trial 380 finished with value: 0.48459577560424805 and parameters: {'fp_type': 'morgan_rdkit', 'combined_morgan_radius': 2, 'combined_morgan_nBits': 512, 'combined_rdkit_maxPath': 6, 'combined_rdkit_nBits': 1024, 'num_hidden_layers': 2, 'hidden_dim_0': 64, 'hidden_dim_1': 512, 'kl_weight': 0.0001498201334783544, 'lr': 0.002511858004743399, 'batch_size': 32, 'dropout_rate': 0.2461233307975515, 'prior_mu': 0.02311469589593239, 'prior_sigma': 0.017866065722371056, 'normalization': 'layer'}. Best is trial 179 with value: 0.4671938598155975.
Generating morgan_rdkit fingerprints...
Generated fingerprints with 1536 features for 841 molecules
Trial 377: 5-fold CV loss = 0.4901
[I 2025-08-07 18:03:17,172] Trial 377 finished with value: 0.49011828303337096 and parameters: {'fp_type': 'morgan_rdkit', 'combined_morgan_radius': 2, 'combined_morgan_nBits': 512, 'combined_rdkit_maxPath': 8, 'combined_rdkit_nBits': 1024, 'num_hidden_layers': 2, 'hidden_dim_0': 64, 'hidden_dim_1': 512, 'kl_weight': 0.00011342263042042803, 'lr': 0.003206196498923198, 'batch_size': 32, 'dropout_rate': 0.3048797937329572, 'prior_mu': 0.03410413169525309, 'prior_sigma': 0.01956499608684011, 'normalization': 'layer'}. Best is trial 179 with value: 0.4671938598155975.
Generating morgan_rdkit fingerprints...
Generated fingerprints with 1536 features for 841 molecules
Trial 381: 5-fold CV loss = 0.4814
[I 2025-08-07 18:03:51,245] Trial 381 finished with value: 0.48144121170043946 and parameters: {'fp_type': 'morgan_rdkit', 'combined_morgan_radius': 2, 'combined_morgan_nBits': 512, 'combined_rdkit_maxPath': 7, 'combined_rdkit_nBits': 1024, 'num_hidden_layers': 2, 'hidden_dim_0': 64, 'hidden_dim_1': 512, 'kl_weight': 0.0001512942256139692, 'lr': 0.00269194486919602, 'batch_size': 32, 'dropout_rate': 0.28267902391847755, 'prior_mu': 0.0478529362182699, 'prior_sigma': 0.016329160061464315, 'normalization': 'layer'}. Best is trial 179 with value: 0.4671938598155975.
Generating morgan_rdkit fingerprints...
Generated fingerprints with 1536 features for 841 molecules
Trial 374: 5-fold CV loss = 0.5524
[I 2025-08-07 18:04:03,093] Trial 374 finished with value: 0.5523613035678864 and parameters: {'fp_type': 'morgan_rdkit', 'combined_morgan_radius': 2, 'combined_morgan_nBits': 512, 'combined_rdkit_maxPath': 8, 'combined_rdkit_nBits': 1024, 'num_hidden_layers': 2, 'hidden_dim_0': 64, 'hidden_dim_1': 512, 'kl_weight': 0.019698217780823864, 'lr': 0.0029385436819640348, 'batch_size': 32, 'dropout_rate': 0.30425323680808114, 'prior_mu': 0.034902518723497616, 'prior_sigma': 0.040163008554170265, 'normalization': 'layer'}. Best is trial 179 with value: 0.4671938598155975.
Generating morgan_rdkit fingerprints...
Generated fingerprints with 1536 features for 841 molecules
Trial 382: 5-fold CV loss = 0.4768
[I 2025-08-07 18:04:05,024] Trial 382 finished with value: 0.476822566986084 and parameters: {'fp_type': 'morgan_rdkit', 'combined_morgan_radius': 2, 'combined_morgan_nBits': 512, 'combined_rdkit_maxPath': 7, 'combined_rdkit_nBits': 1024, 'num_hidden_layers': 2, 'hidden_dim_0': 64, 'hidden_dim_1': 512, 'kl_weight': 0.00013197006550940438, 'lr': 0.0027230549324522403, 'batch_size': 32, 'dropout_rate': 0.28279191376356067, 'prior_mu': 0.044796623211044086, 'prior_sigma': 0.02020120346960161, 'normalization': 'layer'}. Best is trial 179 with value: 0.4671938598155975.
Generating morgan_rdkit fingerprints...
Generated fingerprints with 1536 features for 841 molecules
Trial 383: 5-fold CV loss = 0.4826
[I 2025-08-07 18:04:56,924] Trial 383 finished with value: 0.4825660765171051 and parameters: {'fp_type': 'morgan_rdkit', 'combined_morgan_radius': 2, 'combined_morgan_nBits': 512, 'combined_rdkit_maxPath': 7, 'combined_rdkit_nBits': 1024, 'num_hidden_layers': 2, 'hidden_dim_0': 64, 'hidden_dim_1': 512, 'kl_weight': 0.00013577954861155946, 'lr': 0.0028240047545298203, 'batch_size': 32, 'dropout_rate': 0.287160049356761, 'prior_mu': 0.046341358870909566, 'prior_sigma': 0.04065140594036592, 'normalization': 'layer'}. Best is trial 179 with value: 0.4671938598155975.
Generating morgan fingerprints...
Generated fingerprints with 2048 features for 841 molecules
Trial 384: 5-fold CV loss = 0.4741
[I 2025-08-07 18:04:57,832] Trial 384 finished with value: 0.47405827045440674 and parameters: {'fp_type': 'morgan_rdkit', 'combined_morgan_radius': 2, 'combined_morgan_nBits': 512, 'combined_rdkit_maxPath': 7, 'combined_rdkit_nBits': 1024, 'num_hidden_layers': 2, 'hidden_dim_0': 64, 'hidden_dim_1': 512, 'kl_weight': 0.00012901507720358986, 'lr': 0.0022283699920184544, 'batch_size': 32, 'dropout_rate': 0.2667803960601744, 'prior_mu': 0.05702596443061767, 'prior_sigma': 0.032626856776162755, 'normalization': 'layer'}. Best is trial 179 with value: 0.4671938598155975.
Generating morgan fingerprints...
Generated fingerprints with 2048 features for 841 molecules
Trial 388: 5-fold CV loss = 0.5121
[I 2025-08-07 18:05:10,106] Trial 388 finished with value: 0.5120579898357391 and parameters: {'fp_type': 'morgan', 'morgan_only_radius': 2, 'morgan_only_nBits': 2048, 'num_hidden_layers': 2, 'hidden_dim_0': 64, 'hidden_dim_1': 512, 'kl_weight': 0.00011290756370322376, 'lr': 0.002205644346494971, 'batch_size': 128, 'dropout_rate': 0.4473167593520759, 'prior_mu': 0.05475598927819071, 'prior_sigma': 0.014035199853152013, 'normalization': 'layer'}. Best is trial 179 with value: 0.4671938598155975.
Generating morgan_rdkit fingerprints...
Generated fingerprints with 1536 features for 841 molecules
Trial 386: 5-fold CV loss = 0.4833
[I 2025-08-07 18:05:15,844] Trial 386 finished with value: 0.48329769968986513 and parameters: {'fp_type': 'morgan_rdkit', 'combined_morgan_radius': 2, 'combined_morgan_nBits': 512, 'combined_rdkit_maxPath': 7, 'combined_rdkit_nBits': 1024, 'num_hidden_layers': 2, 'hidden_dim_0': 64, 'hidden_dim_1': 512, 'kl_weight': 0.00017496026529389448, 'lr': 0.0021604105246295358, 'batch_size': 32, 'dropout_rate': 0.444475527295537, 'prior_mu': 0.05753431606135745, 'prior_sigma': 0.03336568059820322, 'normalization': 'layer'}. Best is trial 179 with value: 0.4671938598155975.
Generating morgan_rdkit fingerprints...
Generated fingerprints with 1536 features for 841 molecules
Trial 387: 5-fold CV loss = 0.5076
[I 2025-08-07 18:05:49,422] Trial 387 finished with value: 0.5076498687267303 and parameters: {'fp_type': 'morgan', 'morgan_only_radius': 2, 'morgan_only_nBits': 2048, 'num_hidden_layers': 2, 'hidden_dim_0': 64, 'hidden_dim_1': 512, 'kl_weight': 0.00017109466819364692, 'lr': 0.0022031177988747295, 'batch_size': 32, 'dropout_rate': 0.2715615024538367, 'prior_mu': 0.055716129968808134, 'prior_sigma': 0.03137124457782179, 'normalization': 'layer'}. Best is trial 179 with value: 0.4671938598155975.
Generating morgan_rdkit fingerprints...
Generated fingerprints with 1536 features for 841 molecules
Trial 390: 5-fold CV loss = 0.4796
[I 2025-08-07 18:06:08,727] Trial 390 finished with value: 0.47958187460899354 and parameters: {'fp_type': 'morgan_rdkit', 'combined_morgan_radius': 2, 'combined_morgan_nBits': 512, 'combined_rdkit_maxPath': 7, 'combined_rdkit_nBits': 1024, 'num_hidden_layers': 2, 'hidden_dim_0': 1024, 'hidden_dim_1': 64, 'kl_weight': 0.00012320754435013885, 'lr': 0.002422890789271727, 'batch_size': 32, 'dropout_rate': 0.2746308338254817, 'prior_mu': 0.10211471563252465, 'prior_sigma': 0.0266989208645625, 'normalization': 'layer'}. Best is trial 179 with value: 0.4671938598155975.
Generating morgan_rdkit fingerprints...
Generated fingerprints with 1536 features for 841 molecules
Trial 389: 5-fold CV loss = 0.4715
[I 2025-08-07 18:06:27,281] Trial 389 finished with value: 0.47147892117500306 and parameters: {'fp_type': 'morgan_rdkit', 'combined_morgan_radius': 2, 'combined_morgan_nBits': 512, 'combined_rdkit_maxPath': 7, 'combined_rdkit_nBits': 1024, 'num_hidden_layers': 2, 'hidden_dim_0': 64, 'hidden_dim_1': 512, 'kl_weight': 0.00012652631212388513, 'lr': 0.0016092185430399732, 'batch_size': 32, 'dropout_rate': 0.27136107505807533, 'prior_mu': 0.058948286011040345, 'prior_sigma': 0.028450378957867804, 'normalization': 'layer'}. Best is trial 179 with value: 0.4671938598155975.
Generating morgan_rdkit fingerprints...
Generated fingerprints with 1536 features for 841 molecules
Trial 392: 5-fold CV loss = 0.4955
[I 2025-08-07 18:06:58,422] Trial 392 finished with value: 0.4954818904399872 and parameters: {'fp_type': 'morgan_rdkit', 'combined_morgan_radius': 2, 'combined_morgan_nBits': 512, 'combined_rdkit_maxPath': 5, 'combined_rdkit_nBits': 1024, 'num_hidden_layers': 2, 'hidden_dim_0': 64, 'hidden_dim_1': 512, 'kl_weight': 0.00011043618451664911, 'lr': 0.0016404913930002582, 'batch_size': 32, 'dropout_rate': 0.26651132856554294, 'prior_mu': 0.01598245587140894, 'prior_sigma': 0.02397105565773989, 'normalization': 'layer'}. Best is trial 179 with value: 0.4671938598155975.
Generating morgan_rdkit fingerprints...
Generated fingerprints with 1536 features for 841 molecules
Trial 385: 5-fold CV loss = 0.4750
[I 2025-08-07 18:07:07,793] Trial 385 finished with value: 0.47499436140060425 and parameters: {'fp_type': 'morgan_rdkit', 'combined_morgan_radius': 2, 'combined_morgan_nBits': 512, 'combined_rdkit_maxPath': 7, 'combined_rdkit_nBits': 1024, 'num_hidden_layers': 2, 'hidden_dim_0': 64, 'hidden_dim_1': 512, 'kl_weight': 0.00013000358747356975, 'lr': 0.002135089385379906, 'batch_size': 32, 'dropout_rate': 0.27046801381310503, 'prior_mu': 0.048258966967736835, 'prior_sigma': 0.02987132642741103, 'normalization': 'layer'}. Best is trial 179 with value: 0.4671938598155975.
Generating morgan_rdkit fingerprints...
Generated fingerprints with 1536 features for 841 molecules
Trial 391: 5-fold CV loss = 0.4795
[I 2025-08-07 18:07:13,515] Trial 391 finished with value: 0.4794857144355774 and parameters: {'fp_type': 'morgan_rdkit', 'combined_morgan_radius': 2, 'combined_morgan_nBits': 512, 'combined_rdkit_maxPath': 7, 'combined_rdkit_nBits': 1024, 'num_hidden_layers': 2, 'hidden_dim_0': 1024, 'hidden_dim_1': 512, 'kl_weight': 0.00010027522352743171, 'lr': 0.002385027249087925, 'batch_size': 32, 'dropout_rate': 0.26985179510031065, 'prior_mu': 0.04915341884235879, 'prior_sigma': 0.025296872405756093, 'normalization': 'layer'}. Best is trial 179 with value: 0.4671938598155975.
Generating morgan_rdkit fingerprints...
Generated fingerprints with 1536 features for 841 molecules
Trial 393: 5-fold CV loss = 0.5194
[I 2025-08-07 18:07:18,307] Trial 393 finished with value: 0.5194266438484192 and parameters: {'fp_type': 'morgan_rdkit', 'combined_morgan_radius': 2, 'combined_morgan_nBits': 512, 'combined_rdkit_maxPath': 5, 'combined_rdkit_nBits': 1024, 'num_hidden_layers': 2, 'hidden_dim_0': 512, 'hidden_dim_1': 512, 'kl_weight': 0.00739075700896248, 'lr': 0.0016316526256988399, 'batch_size': 32, 'dropout_rate': 0.26703104359782576, 'prior_mu': 0.06276750600802859, 'prior_sigma': 0.02358817086619995, 'normalization': 'layer'}. Best is trial 179 with value: 0.4671938598155975.
Generating morgan_rdkit fingerprints...
Generated fingerprints with 1536 features for 841 molecules
Trial 394: 5-fold CV loss = 0.4819
[I 2025-08-07 18:07:48,445] Trial 394 finished with value: 0.48194263577461244 and parameters: {'fp_type': 'morgan_rdkit', 'combined_morgan_radius': 2, 'combined_morgan_nBits': 512, 'combined_rdkit_maxPath': 7, 'combined_rdkit_nBits': 1024, 'num_hidden_layers': 2, 'hidden_dim_0': 64, 'hidden_dim_1': 512, 'kl_weight': 0.00013234024892097915, 'lr': 0.002573134565609939, 'batch_size': 32, 'dropout_rate': 0.2645430045171228, 'prior_mu': 0.06449270032817363, 'prior_sigma': 0.022119874797977213, 'normalization': 'layer'}. Best is trial 179 with value: 0.4671938598155975.
Generating morgan_rdkit fingerprints...
Generated fingerprints with 2048 features for 841 molecules
Trial 397: 5-fold CV loss = 0.4742
[I 2025-08-07 18:08:12,370] Trial 397 finished with value: 0.47423826456069945 and parameters: {'fp_type': 'morgan_rdkit', 'combined_morgan_radius': 2, 'combined_morgan_nBits': 512, 'combined_rdkit_maxPath': 7, 'combined_rdkit_nBits': 1024, 'num_hidden_layers': 2, 'hidden_dim_0': 64, 'hidden_dim_1': 512, 'kl_weight': 0.00013769231655187916, 'lr': 0.0026218712044020743, 'batch_size': 32, 'dropout_rate': 0.1793370698875662, 'prior_mu': 0.07488220644469878, 'prior_sigma': 0.020919573042053483, 'normalization': 'layer'}. Best is trial 179 with value: 0.4671938598155975.
Generating morgan_rdkit fingerprints...
Generated fingerprints with 2048 features for 841 molecules
Trial 398: 5-fold CV loss = 0.4847
[I 2025-08-07 18:08:30,695] Trial 398 finished with value: 0.4846698701381683 and parameters: {'fp_type': 'morgan_rdkit', 'combined_morgan_radius': 2, 'combined_morgan_nBits': 1024, 'combined_rdkit_maxPath': 7, 'combined_rdkit_nBits': 1024, 'num_hidden_layers': 2, 'hidden_dim_0': 64, 'hidden_dim_1': 512, 'kl_weight': 0.00015506391124231976, 'lr': 0.0019495297265824318, 'batch_size': 32, 'dropout_rate': 0.24904365522825794, 'prior_mu': 0.07564650200202017, 'prior_sigma': 0.013971635120506655, 'normalization': 'layer'}. Best is trial 179 with value: 0.4671938598155975.
Generating morgan_rdkit fingerprints...
Generated fingerprints with 1536 features for 841 molecules
Trial 396: 5-fold CV loss = 0.5397
[I 2025-08-07 18:08:54,906] Trial 396 finished with value: 0.5397352039813995 and parameters: {'fp_type': 'morgan_rdkit', 'combined_morgan_radius': 2, 'combined_morgan_nBits': 512, 'combined_rdkit_maxPath': 7, 'combined_rdkit_nBits': 1024, 'num_hidden_layers': 2, 'hidden_dim_0': 512, 'hidden_dim_1': 512, 'kl_weight': 0.011355737455651016, 'lr': 0.00267695199839693, 'batch_size': 32, 'dropout_rate': 0.17306121322216889, 'prior_mu': 0.0642409829491258, 'prior_sigma': 0.02031662733297335, 'normalization': 'layer'}. Best is trial 179 with value: 0.4671938598155975.
Generating morgan_rdkit fingerprints...
Generated fingerprints with 1536 features for 841 molecules
Trial 399: 5-fold CV loss = 0.4805
[I 2025-08-07 18:09:10,269] Trial 399 finished with value: 0.48045268654823303 and parameters: {'fp_type': 'morgan_rdkit', 'combined_morgan_radius': 3, 'combined_morgan_nBits': 1024, 'combined_rdkit_maxPath': 7, 'combined_rdkit_nBits': 1024, 'num_hidden_layers': 2, 'hidden_dim_0': 64, 'hidden_dim_1': 512, 'kl_weight': 0.00016177774364348617, 'lr': 0.001995488641991593, 'batch_size': 32, 'dropout_rate': 0.21635506334395524, 'prior_mu': 0.07692363509189991, 'prior_sigma': 0.028210690942764755, 'normalization': 'layer'}. Best is trial 179 with value: 0.4671938598155975.
Generating morgan_rdkit fingerprints...
Generated fingerprints with 1536 features for 841 molecules
Trial 400: 5-fold CV loss = 0.4778
[I 2025-08-07 18:09:26,872] Trial 400 finished with value: 0.47779768109321596 and parameters: {'fp_type': 'morgan_rdkit', 'combined_morgan_radius': 3, 'combined_morgan_nBits': 512, 'combined_rdkit_maxPath': 7, 'combined_rdkit_nBits': 1024, 'num_hidden_layers': 2, 'hidden_dim_0': 128, 'hidden_dim_1': 512, 'kl_weight': 0.00015139981765952397, 'lr': 0.003015965462133517, 'batch_size': 32, 'dropout_rate': 0.16987186564925422, 'prior_mu': 0.08731929968535007, 'prior_sigma': 0.028449009668213864, 'normalization': 'layer'}. Best is trial 179 with value: 0.4671938598155975.
Generating morgan_rdkit fingerprints...
Generated fingerprints with 1536 features for 841 molecules
Trial 395: 5-fold CV loss = 0.4822
[I 2025-08-07 18:09:48,036] Trial 395 finished with value: 0.4821811854839325 and parameters: {'fp_type': 'morgan_rdkit', 'combined_morgan_radius': 2, 'combined_morgan_nBits': 512, 'combined_rdkit_maxPath': 7, 'combined_rdkit_nBits': 1024, 'num_hidden_layers': 2, 'hidden_dim_0': 512, 'hidden_dim_1': 512, 'kl_weight': 0.00015056673972171081, 'lr': 0.0025756858887977965, 'batch_size': 32, 'dropout_rate': 0.26137043731812554, 'prior_mu': 0.06198667711730191, 'prior_sigma': 0.02229050690186673, 'normalization': 'layer'}. Best is trial 179 with value: 0.4671938598155975.
Generating morgan_rdkit fingerprints...
Generated fingerprints with 1536 features for 841 molecules
Trial 402: 5-fold CV loss = 0.4802
[I 2025-08-07 18:10:16,417] Trial 402 finished with value: 0.48020960092544557 and parameters: {'fp_type': 'morgan_rdkit', 'combined_morgan_radius': 2, 'combined_morgan_nBits': 512, 'combined_rdkit_maxPath': 7, 'combined_rdkit_nBits': 1024, 'num_hidden_layers': 2, 'hidden_dim_0': 128, 'hidden_dim_1': 512, 'kl_weight': 0.00014826144305266298, 'lr': 0.0030119949971138395, 'batch_size': 32, 'dropout_rate': 0.23195025997491808, 'prior_mu': 0.08875274407814902, 'prior_sigma': 0.0272361470264975, 'normalization': 'layer'}. Best is trial 179 with value: 0.4671938598155975.
Generating morgan_rdkit fingerprints...
Generated fingerprints with 1536 features for 841 molecules
Trial 401: 5-fold CV loss = 0.4788
[I 2025-08-07 18:10:21,959] Trial 401 finished with value: 0.47881948947906494 and parameters: {'fp_type': 'morgan_rdkit', 'combined_morgan_radius': 3, 'combined_morgan_nBits': 512, 'combined_rdkit_maxPath': 7, 'combined_rdkit_nBits': 1024, 'num_hidden_layers': 2, 'hidden_dim_0': 64, 'hidden_dim_1': 512, 'kl_weight': 0.0001500219647639079, 'lr': 0.003062970344953102, 'batch_size': 32, 'dropout_rate': 0.18116368538310973, 'prior_mu': 0.0958800327787911, 'prior_sigma': 0.030013611360831076, 'normalization': 'layer'}. Best is trial 179 with value: 0.4671938598155975.
Generating morgan_rdkit fingerprints...
Generated fingerprints with 1536 features for 841 molecules
Trial 403: 5-fold CV loss = 0.4725
[I 2025-08-07 18:10:29,281] Trial 403 finished with value: 0.47253805994987486 and parameters: {'fp_type': 'morgan_rdkit', 'combined_morgan_radius': 2, 'combined_morgan_nBits': 512, 'combined_rdkit_maxPath': 7, 'combined_rdkit_nBits': 1024, 'num_hidden_layers': 2, 'hidden_dim_0': 64, 'hidden_dim_1': 512, 'kl_weight': 0.00012926509364038236, 'lr': 0.0015400519228519012, 'batch_size': 32, 'dropout_rate': 0.20111277106073336, 'prior_mu': 0.07409814661820521, 'prior_sigma': 0.02165785852940539, 'normalization': 'layer'}. Best is trial 179 with value: 0.4671938598155975.
Generating morgan_rdkit fingerprints...
Generated fingerprints with 1536 features for 841 molecules
Trial 407: 5-fold CV loss = 0.4830
