[I 2025-08-07 17:00:48,927] Trial 188 finished with value: 0.4818397104740143 and parameters: {'fp_type': 'morgan_rdkit', 'combined_morgan_radius': 2, 'combined_morgan_nBits': 1024, 'combined_rdkit_maxPath': 7, 'combined_rdkit_nBits': 1024, 'num_hidden_layers': 2, 'hidden_dim_0': 64, 'hidden_dim_1': 512, 'kl_weight': 0.00011354197954528339, 'lr': 0.004416748496406175, 'batch_size': 32, 'dropout_rate': 0.32179666456524986, 'prior_mu': 0.07509869018498651, 'prior_sigma': 0.031854082115842786, 'normalization': 'layer'}. Best is trial 179 with value: 0.4671938598155975.
Generating rdkit fingerprints...
Generated fingerprints with 512 features for 841 molecules
Trial 185: 5-fold CV loss = 0.4786
[I 2025-08-07 17:01:45,724] Trial 185 finished with value: 0.47864857912063596 and parameters: {'fp_type': 'morgan_rdkit', 'combined_morgan_radius': 2, 'combined_morgan_nBits': 1024, 'combined_rdkit_maxPath': 7, 'combined_rdkit_nBits': 1024, 'num_hidden_layers': 2, 'hidden_dim_0': 64, 'hidden_dim_1': 512, 'kl_weight': 0.0001105946926697034, 'lr': 0.0014658380157665462, 'batch_size': 32, 'dropout_rate': 0.3576557063454202, 'prior_mu': 0.07280532906147062, 'prior_sigma': 0.030631777787011656, 'normalization': 'layer'}. Best is trial 179 with value: 0.4671938598155975.
Generating rdkit fingerprints...
Generated fingerprints with 512 features for 841 molecules
Trial 191: 5-fold CV loss = 0.5826
[I 2025-08-07 17:02:04,079] Trial 191 finished with value: 0.5826465249061584 and parameters: {'fp_type': 'rdkit', 'rdkit_only_maxPath': 7, 'rdkit_only_nBits': 512, 'num_hidden_layers': 2, 'hidden_dim_0': 64, 'hidden_dim_1': 512, 'kl_weight': 0.00010107387570795747, 'lr': 0.003769011524278669, 'batch_size': 32, 'dropout_rate': 0.34554979027488303, 'prior_mu': 0.065021102513901, 'prior_sigma': 0.028576606935215788, 'normalization': 'layer'}. Best is trial 179 with value: 0.4671938598155975.
Generating morgan_rdkit fingerprints...
Generated fingerprints with 1280 features for 841 molecules
Trial 190: 5-fold CV loss = 0.5113
[I 2025-08-07 17:02:09,913] Trial 190 finished with value: 0.5113482296466827 and parameters: {'fp_type': 'rdkit', 'rdkit_only_maxPath': 6, 'rdkit_only_nBits': 512, 'num_hidden_layers': 2, 'hidden_dim_0': 64, 'hidden_dim_1': 128, 'kl_weight': 0.00011057047150251274, 'lr': 0.0045015004449658474, 'batch_size': 32, 'dropout_rate': 0.24183513280536204, 'prior_mu': 0.07201525459596128, 'prior_sigma': 0.028554640904751936, 'normalization': 'layer'}. Best is trial 179 with value: 0.4671938598155975.
Generating morgan_rdkit fingerprints...
Generated fingerprints with 1536 features for 841 molecules
Trial 193: 5-fold CV loss = 0.5159
[I 2025-08-07 17:02:48,342] Trial 193 finished with value: 0.5158854484558105 and parameters: {'fp_type': 'morgan_rdkit', 'combined_morgan_radius': 2, 'combined_morgan_nBits': 1024, 'combined_rdkit_maxPath': 6, 'combined_rdkit_nBits': 256, 'num_hidden_layers': 2, 'hidden_dim_0': 64, 'hidden_dim_1': 512, 'kl_weight': 0.00023347415027325357, 'lr': 0.0031975479747314603, 'batch_size': 32, 'dropout_rate': 0.24018744016585997, 'prior_mu': 0.12820956091090663, 'prior_sigma': 0.03571464344961722, 'normalization': 'layer'}. Best is trial 179 with value: 0.4671938598155975.
Generating morgan_rdkit fingerprints...
Generated fingerprints with 1536 features for 841 molecules
Trial 189: 5-fold CV loss = 0.5027
[I 2025-08-07 17:02:56,514] Trial 189 finished with value: 0.502731728553772 and parameters: {'fp_type': 'rdkit', 'rdkit_only_maxPath': 6, 'rdkit_only_nBits': 512, 'num_hidden_layers': 2, 'hidden_dim_0': 64, 'hidden_dim_1': 512, 'kl_weight': 0.00011221939785931809, 'lr': 0.0036558425057128733, 'batch_size': 32, 'dropout_rate': 0.3169762104670915, 'prior_mu': 0.08221748602145587, 'prior_sigma': 0.028308807168134983, 'normalization': 'layer'}. Best is trial 179 with value: 0.4671938598155975.
Generating morgan_rdkit fingerprints...
Generated fingerprints with 1536 features for 841 molecules
Trial 194: 5-fold CV loss = 0.4786
[I 2025-08-07 17:03:24,338] Trial 194 finished with value: 0.4785736560821533 and parameters: {'fp_type': 'morgan_rdkit', 'combined_morgan_radius': 2, 'combined_morgan_nBits': 512, 'combined_rdkit_maxPath': 7, 'combined_rdkit_nBits': 1024, 'num_hidden_layers': 2, 'hidden_dim_0': 64, 'hidden_dim_1': 512, 'kl_weight': 0.00015991554326214494, 'lr': 0.002346789789724598, 'batch_size': 32, 'dropout_rate': 0.30449682325863825, 'prior_mu': 0.08616631210116615, 'prior_sigma': 0.03628186289255704, 'normalization': 'layer'}. Best is trial 179 with value: 0.4671938598155975.
Generating morgan_rdkit fingerprints...
Generated fingerprints with 1536 features for 841 molecules
Trial 195: 5-fold CV loss = 0.4786
[I 2025-08-07 17:03:46,544] Trial 195 finished with value: 0.4785893440246582 and parameters: {'fp_type': 'morgan_rdkit', 'combined_morgan_radius': 2, 'combined_morgan_nBits': 512, 'combined_rdkit_maxPath': 7, 'combined_rdkit_nBits': 1024, 'num_hidden_layers': 2, 'hidden_dim_0': 64, 'hidden_dim_1': 512, 'kl_weight': 0.00016531513715402696, 'lr': 0.002219997498650102, 'batch_size': 32, 'dropout_rate': 0.29942740275459473, 'prior_mu': 0.056628525542162196, 'prior_sigma': 0.0175079808787892, 'normalization': 'layer'}. Best is trial 179 with value: 0.4671938598155975.
Generating morgan_rdkit fingerprints...
Generated fingerprints with 1536 features for 841 molecules
Trial 196: 5-fold CV loss = 0.4767
[I 2025-08-07 17:04:11,329] Trial 196 finished with value: 0.4766814291477203 and parameters: {'fp_type': 'morgan_rdkit', 'combined_morgan_radius': 2, 'combined_morgan_nBits': 512, 'combined_rdkit_maxPath': 7, 'combined_rdkit_nBits': 1024, 'num_hidden_layers': 2, 'hidden_dim_0': 64, 'hidden_dim_1': 512, 'kl_weight': 0.00015993364791697226, 'lr': 0.0022861034138553383, 'batch_size': 32, 'dropout_rate': 0.262446609789648, 'prior_mu': 0.06170292632136308, 'prior_sigma': 0.019117710991890503, 'normalization': 'layer'}. Best is trial 179 with value: 0.4671938598155975.
Generating morgan_rdkit fingerprints...
Generated fingerprints with 1536 features for 841 molecules
Trial 197: 5-fold CV loss = 0.4785
[I 2025-08-07 17:04:24,968] Trial 197 finished with value: 0.478469717502594 and parameters: {'fp_type': 'morgan_rdkit', 'combined_morgan_radius': 2, 'combined_morgan_nBits': 512, 'combined_rdkit_maxPath': 7, 'combined_rdkit_nBits': 1024, 'num_hidden_layers': 2, 'hidden_dim_0': 512, 'hidden_dim_1': 512, 'kl_weight': 0.00013180825666693022, 'lr': 0.00205792728831785, 'batch_size': 32, 'dropout_rate': 0.1243577553684253, 'prior_mu': 0.061390487082555706, 'prior_sigma': 0.02031092466319371, 'normalization': 'layer'}. Best is trial 179 with value: 0.4671938598155975.
Generating morgan_rdkit fingerprints...
Generated fingerprints with 1536 features for 841 molecules
Trial 198: 5-fold CV loss = 0.5090
[I 2025-08-07 17:04:40,360] Trial 198 finished with value: 0.509032917022705 and parameters: {'fp_type': 'morgan_rdkit', 'combined_morgan_radius': 2, 'combined_morgan_nBits': 512, 'combined_rdkit_maxPath': 7, 'combined_rdkit_nBits': 1024, 'num_hidden_layers': 2, 'hidden_dim_0': 512, 'hidden_dim_1': 512, 'kl_weight': 0.0001386318788504354, 'lr': 0.00013475277734774919, 'batch_size': 32, 'dropout_rate': 0.11732358105452645, 'prior_mu': 0.09647785567472182, 'prior_sigma': 0.02430624649070002, 'normalization': 'layer'}. Best is trial 179 with value: 0.4671938598155975.
Generating morgan_rdkit fingerprints...
Generated fingerprints with 1024 features for 841 molecules
Trial 200: 5-fold CV loss = 0.5831
[I 2025-08-07 17:04:43,530] Trial 200 finished with value: 0.5831254482269287 and parameters: {'fp_type': 'morgan_rdkit', 'combined_morgan_radius': 2, 'combined_morgan_nBits': 512, 'combined_rdkit_maxPath': 7, 'combined_rdkit_nBits': 1024, 'num_hidden_layers': 0, 'kl_weight': 0.00014301578296618112, 'lr': 0.001949275041875952, 'batch_size': 32, 'dropout_rate': 0.2638310559392429, 'prior_mu': -0.15003539271122818, 'prior_sigma': 0.02464021025423435, 'normalization': 'layer'}. Best is trial 179 with value: 0.4671938598155975.
Generating morgan_rdkit fingerprints...
Generated fingerprints with 1024 features for 841 molecules
Trial 201: 5-fold CV loss = 0.6081
[I 2025-08-07 17:04:59,017] Trial 201 finished with value: 0.6081326365470886 and parameters: {'fp_type': 'morgan_rdkit', 'combined_morgan_radius': 2, 'combined_morgan_nBits': 512, 'combined_rdkit_maxPath': 7, 'combined_rdkit_nBits': 512, 'num_hidden_layers': 0, 'kl_weight': 0.0001628929944540125, 'lr': 0.0031481900221324802, 'batch_size': 32, 'dropout_rate': 0.25971294187752053, 'prior_mu': -0.04716347683537912, 'prior_sigma': 0.03855621660146681, 'normalization': 'layer'}. Best is trial 179 with value: 0.4671938598155975.
Generating morgan_rdkit fingerprints...
Generated fingerprints with 1536 features for 841 molecules
Trial 192: 5-fold CV loss = 0.5024
[I 2025-08-07 17:05:31,929] Trial 192 finished with value: 0.502436888217926 and parameters: {'fp_type': 'rdkit', 'rdkit_only_maxPath': 6, 'rdkit_only_nBits': 512, 'num_hidden_layers': 2, 'hidden_dim_0': 64, 'hidden_dim_1': 128, 'kl_weight': 0.00016105466456779082, 'lr': 0.003620477962684899, 'batch_size': 32, 'dropout_rate': 0.3011154064466733, 'prior_mu': -0.14421739618063698, 'prior_sigma': 0.03617580650451676, 'normalization': 'layer'}. Best is trial 179 with value: 0.4671938598155975.
Generating morgan_rdkit fingerprints...
Generated fingerprints with 1536 features for 841 molecules
Trial 199: 5-fold CV loss = 0.4800
[I 2025-08-07 17:05:37,040] Trial 199 finished with value: 0.48001611828804014 and parameters: {'fp_type': 'morgan_rdkit', 'combined_morgan_radius': 2, 'combined_morgan_nBits': 512, 'combined_rdkit_maxPath': 7, 'combined_rdkit_nBits': 1024, 'num_hidden_layers': 2, 'hidden_dim_0': 64, 'hidden_dim_1': 512, 'kl_weight': 0.00013521912466500497, 'lr': 0.0020000030888583714, 'batch_size': 32, 'dropout_rate': 0.2620431467737151, 'prior_mu': 0.09324398245296432, 'prior_sigma': 0.02393089135793743, 'normalization': 'layer'}. Best is trial 179 with value: 0.4671938598155975.
Generating morgan_rdkit fingerprints...
Generated fingerprints with 1536 features for 841 molecules
Trial 202: 5-fold CV loss = 0.5067
[I 2025-08-07 17:05:48,234] Trial 202 finished with value: 0.506703907251358 and parameters: {'fp_type': 'morgan_rdkit', 'combined_morgan_radius': 2, 'combined_morgan_nBits': 512, 'combined_rdkit_maxPath': 7, 'combined_rdkit_nBits': 512, 'num_hidden_layers': 2, 'hidden_dim_0': 64, 'hidden_dim_1': 512, 'kl_weight': 0.0001591163856733238, 'lr': 0.003128445093462375, 'batch_size': 32, 'dropout_rate': 0.18581639305806005, 'prior_mu': 0.06773553221958595, 'prior_sigma': 0.03908489530595112, 'normalization': 'layer'}. Best is trial 179 with value: 0.4671938598155975.
Generating morgan_rdkit fingerprints...
Generated fingerprints with 1536 features for 841 molecules
Trial 203: 5-fold CV loss = 0.4849
[I 2025-08-07 17:05:53,885] Trial 203 finished with value: 0.4848606824874878 and parameters: {'fp_type': 'morgan_rdkit', 'combined_morgan_radius': 2, 'combined_morgan_nBits': 512, 'combined_rdkit_maxPath': 7, 'combined_rdkit_nBits': 1024, 'num_hidden_layers': 2, 'hidden_dim_0': 64, 'hidden_dim_1': 512, 'kl_weight': 0.0002255985652135826, 'lr': 0.002306058547189074, 'batch_size': 32, 'dropout_rate': 0.2778788610177489, 'prior_mu': 0.11479320818537261, 'prior_sigma': 0.033247497161830425, 'normalization': 'layer'}. Best is trial 179 with value: 0.4671938598155975.
Generating morgan_rdkit fingerprints...
Generated fingerprints with 1536 features for 841 molecules
Trial 207: 5-fold CV loss = 0.4845
[I 2025-08-07 17:06:33,163] Trial 207 finished with value: 0.4845051884651184 and parameters: {'fp_type': 'morgan_rdkit', 'combined_morgan_radius': 2, 'combined_morgan_nBits': 512, 'combined_rdkit_maxPath': 7, 'combined_rdkit_nBits': 1024, 'num_hidden_layers': 2, 'hidden_dim_0': 64, 'hidden_dim_1': 512, 'kl_weight': 0.0001254521301422097, 'lr': 0.002732844180927173, 'batch_size': 32, 'dropout_rate': 0.07564041212435738, 'prior_mu': 0.05332992694908593, 'prior_sigma': 0.014313430129661636, 'normalization': 'layer'}. Best is trial 179 with value: 0.4671938598155975.
Generating morgan_rdkit fingerprints...
Generated fingerprints with 1536 features for 841 molecules
Trial 206: 5-fold CV loss = 0.4813
[I 2025-08-07 17:06:46,480] Trial 206 finished with value: 0.48128215670585633 and parameters: {'fp_type': 'morgan_rdkit', 'combined_morgan_radius': 2, 'combined_morgan_nBits': 512, 'combined_rdkit_maxPath': 7, 'combined_rdkit_nBits': 1024, 'num_hidden_layers': 2, 'hidden_dim_0': 64, 'hidden_dim_1': 512, 'kl_weight': 0.00012528176850617917, 'lr': 0.00262620659145296, 'batch_size': 32, 'dropout_rate': 0.27424972822576205, 'prior_mu': 0.052268346467098645, 'prior_sigma': 0.01537381882744205, 'normalization': 'layer'}. Best is trial 179 with value: 0.4671938598155975.
Generating morgan_rdkit fingerprints...
Generated fingerprints with 1536 features for 841 molecules
Trial 205: 5-fold CV loss = 0.4739
[I 2025-08-07 17:07:20,407] Trial 205 finished with value: 0.47389833331108094 and parameters: {'fp_type': 'morgan_rdkit', 'combined_morgan_radius': 2, 'combined_morgan_nBits': 512, 'combined_rdkit_maxPath': 7, 'combined_rdkit_nBits': 1024, 'num_hidden_layers': 2, 'hidden_dim_0': 64, 'hidden_dim_1': 512, 'kl_weight': 0.0001245107575523697, 'lr': 0.0024923789416782566, 'batch_size': 32, 'dropout_rate': 0.2794674895556165, 'prior_mu': 0.05258441909932182, 'prior_sigma': 0.0153672855706721, 'normalization': 'layer'}. Best is trial 179 with value: 0.4671938598155975.
Generating morgan_rdkit fingerprints...
Generated fingerprints with 1536 features for 841 molecules
Trial 209: 5-fold CV loss = 0.4819
[I 2025-08-07 17:07:36,336] Trial 209 finished with value: 0.4819063305854797 and parameters: {'fp_type': 'morgan_rdkit', 'combined_morgan_radius': 2, 'combined_morgan_nBits': 512, 'combined_rdkit_maxPath': 7, 'combined_rdkit_nBits': 1024, 'num_hidden_layers': 2, 'hidden_dim_0': 64, 'hidden_dim_1': 512, 'kl_weight': 0.00010388705576628406, 'lr': 0.0025245867783632464, 'batch_size': 32, 'dropout_rate': 0.09510690090301427, 'prior_mu': 0.082964884949922, 'prior_sigma': 0.019774403974992916, 'normalization': 'layer'}. Best is trial 179 with value: 0.4671938598155975.
Generating morgan_rdkit fingerprints...
Generated fingerprints with 1536 features for 841 molecules
Trial 208: 5-fold CV loss = 0.4735
[I 2025-08-07 17:07:39,572] Trial 208 finished with value: 0.4735248386859894 and parameters: {'fp_type': 'morgan_rdkit', 'combined_morgan_radius': 2, 'combined_morgan_nBits': 512, 'combined_rdkit_maxPath': 7, 'combined_rdkit_nBits': 1024, 'num_hidden_layers': 2, 'hidden_dim_0': 64, 'hidden_dim_1': 512, 'kl_weight': 0.00010031355676726261, 'lr': 0.002557089559516692, 'batch_size': 32, 'dropout_rate': 0.24912999226884888, 'prior_mu': 0.03236741341611374, 'prior_sigma': 0.018989438644231346, 'normalization': 'layer'}. Best is trial 179 with value: 0.4671938598155975.
Generating morgan_rdkit fingerprints...
Generated fingerprints with 1536 features for 841 molecules
Trial 204: 5-fold CV loss = 0.4747
[I 2025-08-07 17:08:07,508] Trial 204 finished with value: 0.4746816039085388 and parameters: {'fp_type': 'morgan_rdkit', 'combined_morgan_radius': 2, 'combined_morgan_nBits': 512, 'combined_rdkit_maxPath': 7, 'combined_rdkit_nBits': 1024, 'num_hidden_layers': 2, 'hidden_dim_0': 64, 'hidden_dim_1': 512, 'kl_weight': 0.0001241903439493225, 'lr': 0.0026739869572129475, 'batch_size': 32, 'dropout_rate': 0.27541949686635664, 'prior_mu': 0.05403140771420306, 'prior_sigma': 0.01581131926342456, 'normalization': 'layer'}. Best is trial 179 with value: 0.4671938598155975.
Generating morgan_rdkit fingerprints...
Generated fingerprints with 1536 features for 841 molecules
Trial 212: 5-fold CV loss = 0.4968
[I 2025-08-07 17:08:19,478] Trial 212 finished with value: 0.4968211233615875 and parameters: {'fp_type': 'morgan_rdkit', 'combined_morgan_radius': 2, 'combined_morgan_nBits': 512, 'combined_rdkit_maxPath': 5, 'combined_rdkit_nBits': 1024, 'num_hidden_layers': 2, 'hidden_dim_0': 64, 'hidden_dim_1': 1024, 'kl_weight': 0.00010195774197157577, 'lr': 0.002182851304395206, 'batch_size': 32, 'dropout_rate': 0.2500271146884094, 'prior_mu': 0.06346170140094115, 'prior_sigma': 0.027035106602610656, 'normalization': 'layer'}. Best is trial 179 with value: 0.4671938598155975.
Generating morgan_rdkit fingerprints...
Generated fingerprints with 1536 features for 841 molecules
Trial 211: 5-fold CV loss = 0.4748
[I 2025-08-07 17:08:48,016] Trial 211 finished with value: 0.47478826642036437 and parameters: {'fp_type': 'morgan_rdkit', 'combined_morgan_radius': 2, 'combined_morgan_nBits': 512, 'combined_rdkit_maxPath': 7, 'combined_rdkit_nBits': 1024, 'num_hidden_layers': 2, 'hidden_dim_0': 64, 'hidden_dim_1': 512, 'kl_weight': 0.00014073711605742595, 'lr': 0.0022032192905786572, 'batch_size': 32, 'dropout_rate': 0.25095937203349883, 'prior_mu': 0.06393401580817745, 'prior_sigma': 0.032211115074679525, 'normalization': 'layer'}. Best is trial 179 with value: 0.4671938598155975.
Generating morgan_rdkit fingerprints...
Generated fingerprints with 1536 features for 841 molecules
Trial 210: 5-fold CV loss = 0.4719
[I 2025-08-07 17:09:04,223] Trial 210 finished with value: 0.4718773186206818 and parameters: {'fp_type': 'morgan_rdkit', 'combined_morgan_radius': 2, 'combined_morgan_nBits': 512, 'combined_rdkit_maxPath': 7, 'combined_rdkit_nBits': 1024, 'num_hidden_layers': 2, 'hidden_dim_0': 64, 'hidden_dim_1': 512, 'kl_weight': 0.00014431245149892894, 'lr': 0.002467945322072249, 'batch_size': 32, 'dropout_rate': 0.2483449744849523, 'prior_mu': 0.07917311894747094, 'prior_sigma': 0.019560758967766767, 'normalization': 'layer'}. Best is trial 179 with value: 0.4671938598155975.
Generating morgan_rdkit fingerprints...
Generated fingerprints with 1536 features for 841 molecules
Trial 214: 5-fold CV loss = 0.4811
[I 2025-08-07 17:09:10,416] Trial 214 finished with value: 0.481071001291275 and parameters: {'fp_type': 'morgan_rdkit', 'combined_morgan_radius': 2, 'combined_morgan_nBits': 512, 'combined_rdkit_maxPath': 7, 'combined_rdkit_nBits': 1024, 'num_hidden_layers': 2, 'hidden_dim_0': 64, 'hidden_dim_1': 512, 'kl_weight': 0.00012200338413861155, 'lr': 0.002361046479722665, 'batch_size': 32, 'dropout_rate': 0.27825212694291446, 'prior_mu': 0.07672116478607272, 'prior_sigma': 0.020964741679324536, 'normalization': 'layer'}. Best is trial 179 with value: 0.4671938598155975.
Generating morgan_rdkit fingerprints...
Generated fingerprints with 1536 features for 841 molecules
Trial 215: 5-fold CV loss = 0.4753
[I 2025-08-07 17:09:51,148] Trial 215 finished with value: 0.4752614736557007 and parameters: {'fp_type': 'morgan_rdkit', 'combined_morgan_radius': 2, 'combined_morgan_nBits': 512, 'combined_rdkit_maxPath': 7, 'combined_rdkit_nBits': 1024, 'num_hidden_layers': 2, 'hidden_dim_0': 64, 'hidden_dim_1': 512, 'kl_weight': 0.00012042725226449306, 'lr': 0.0024830787687697346, 'batch_size': 32, 'dropout_rate': 0.2814637244376921, 'prior_mu': 0.05792834815739341, 'prior_sigma': 0.010745655765005399, 'normalization': 'layer'}. Best is trial 179 with value: 0.4671938598155975.
Generating morgan_rdkit fingerprints...
Generated fingerprints with 1536 features for 841 molecules
Trial 217: 5-fold CV loss = 0.4890
[I 2025-08-07 17:09:52,833] Trial 217 finished with value: 0.48897120356559753 and parameters: {'fp_type': 'morgan_rdkit', 'combined_morgan_radius': 2, 'combined_morgan_nBits': 512, 'combined_rdkit_maxPath': 7, 'combined_rdkit_nBits': 1024, 'num_hidden_layers': 2, 'hidden_dim_0': 64, 'hidden_dim_1': 512, 'kl_weight': 0.0001409674189849002, 'lr': 0.0028773490501494132, 'batch_size': 32, 'dropout_rate': 0.24782059370653406, 'prior_mu': 0.05862182116809018, 'prior_sigma': 0.010844821201334157, 'normalization': 'layer'}. Best is trial 179 with value: 0.4671938598155975.
Generating morgan_rdkit fingerprints...
Generated fingerprints with 1536 features for 841 molecules
Trial 213: 5-fold CV loss = 0.4783
[I 2025-08-07 17:10:29,708] Trial 213 finished with value: 0.4782505214214325 and parameters: {'fp_type': 'morgan_rdkit', 'combined_morgan_radius': 2, 'combined_morgan_nBits': 512, 'combined_rdkit_maxPath': 7, 'combined_rdkit_nBits': 1024, 'num_hidden_layers': 2, 'hidden_dim_0': 64, 'hidden_dim_1': 1024, 'kl_weight': 0.00011478111493500318, 'lr': 0.002323531269623857, 'batch_size': 32, 'dropout_rate': 0.246025601236504, 'prior_mu': 0.061533346546116106, 'prior_sigma': 0.011945768908467456, 'normalization': 'layer'}. Best is trial 179 with value: 0.4671938598155975.
Generating morgan_rdkit fingerprints...
Generated fingerprints with 1536 features for 841 molecules
Trial 216: 5-fold CV loss = 0.4816
[I 2025-08-07 17:10:42,503] Trial 216 finished with value: 0.48161378502845764 and parameters: {'fp_type': 'morgan_rdkit', 'combined_morgan_radius': 2, 'combined_morgan_nBits': 512, 'combined_rdkit_maxPath': 7, 'combined_rdkit_nBits': 1024, 'num_hidden_layers': 2, 'hidden_dim_0': 64, 'hidden_dim_1': 512, 'kl_weight': 0.00012642940510260292, 'lr': 0.0023389833442350365, 'batch_size': 32, 'dropout_rate': 0.24964127828650481, 'prior_mu': 0.05808359081032745, 'prior_sigma': 0.021299818795682324, 'normalization': 'layer'}. Best is trial 179 with value: 0.4671938598155975.
Generating morgan_rdkit fingerprints...
Generated fingerprints with 1536 features for 841 molecules
Trial 219: 5-fold CV loss = 0.4767
