[I 2025-08-07 17:40:11,299] Trial 310 finished with value: 0.48153159618377683 and parameters: {'fp_type': 'morgan_rdkit', 'combined_morgan_radius': 3, 'combined_morgan_nBits': 1024, 'combined_rdkit_maxPath': 7, 'combined_rdkit_nBits': 1024, 'num_hidden_layers': 2, 'hidden_dim_0': 64, 'hidden_dim_1': 512, 'kl_weight': 0.00014378146695739793, 'lr': 0.0009060467112047351, 'batch_size': 32, 'dropout_rate': 0.3006761329079742, 'prior_mu': 0.06288448177232883, 'prior_sigma': 0.03837607989591648, 'normalization': 'layer'}. Best is trial 179 with value: 0.4671938598155975.
Generating morgan_rdkit fingerprints...
Generated fingerprints with 2048 features for 841 molecules
Trial 313: 5-fold CV loss = 0.4980
[I 2025-08-07 17:40:29,560] Trial 313 finished with value: 0.49795066118240355 and parameters: {'fp_type': 'morgan_rdkit', 'combined_morgan_radius': 2, 'combined_morgan_nBits': 1024, 'combined_rdkit_maxPath': 7, 'combined_rdkit_nBits': 1024, 'num_hidden_layers': 1, 'hidden_dim_0': 64, 'kl_weight': 0.0001733637047948986, 'lr': 0.0016579871916408428, 'batch_size': 32, 'dropout_rate': 0.2612996714314332, 'prior_mu': 0.07656738101746566, 'prior_sigma': 0.03258823392229967, 'normalization': 'layer'}. Best is trial 179 with value: 0.4671938598155975.
Generating morgan_rdkit fingerprints...
Generated fingerprints with 2048 features for 841 molecules
Trial 314: 5-fold CV loss = 0.4830
[I 2025-08-07 17:40:58,155] Trial 314 finished with value: 0.48298996686935425 and parameters: {'fp_type': 'morgan_rdkit', 'combined_morgan_radius': 2, 'combined_morgan_nBits': 1024, 'combined_rdkit_maxPath': 7, 'combined_rdkit_nBits': 1024, 'num_hidden_layers': 2, 'hidden_dim_0': 64, 'hidden_dim_1': 256, 'kl_weight': 0.0008658826026709072, 'lr': 0.0009257212598317819, 'batch_size': 32, 'dropout_rate': 0.20800748430997268, 'prior_mu': 0.07973098768010507, 'prior_sigma': 0.03392146763862904, 'normalization': 'layer'}. Best is trial 179 with value: 0.4671938598155975.
Generating morgan_rdkit fingerprints...
Generated fingerprints with 2048 features for 841 molecules
Trial 315: 5-fold CV loss = 0.4758
[I 2025-08-07 17:41:17,340] Trial 315 finished with value: 0.47580639719963075 and parameters: {'fp_type': 'morgan_rdkit', 'combined_morgan_radius': 2, 'combined_morgan_nBits': 1024, 'combined_rdkit_maxPath': 7, 'combined_rdkit_nBits': 1024, 'num_hidden_layers': 2, 'hidden_dim_0': 64, 'hidden_dim_1': 256, 'kl_weight': 0.00011239571485820345, 'lr': 0.0008340427845468502, 'batch_size': 32, 'dropout_rate': 0.21809170208177017, 'prior_mu': 0.05484671834710169, 'prior_sigma': 0.03467078811898847, 'normalization': 'layer'}. Best is trial 179 with value: 0.4671938598155975.
Generating morgan_rdkit fingerprints...
Generated fingerprints with 1536 features for 841 molecules
Trial 312: 5-fold CV loss = 0.4887
[I 2025-08-07 17:41:32,220] Trial 312 finished with value: 0.48866714239120485 and parameters: {'fp_type': 'morgan_rdkit', 'combined_morgan_radius': 2, 'combined_morgan_nBits': 1024, 'combined_rdkit_maxPath': 7, 'combined_rdkit_nBits': 1024, 'num_hidden_layers': 2, 'hidden_dim_0': 64, 'hidden_dim_1': 512, 'kl_weight': 0.00010049489090078567, 'lr': 0.0008081698414221897, 'batch_size': 32, 'dropout_rate': 0.20388679600223186, 'prior_mu': 0.06632099265232581, 'prior_sigma': 0.03657790392129196, 'normalization': 'layer'}. Best is trial 179 with value: 0.4671938598155975.
Generating morgan_rdkit fingerprints...
Generated fingerprints with 1536 features for 841 molecules
Trial 316: 5-fold CV loss = 0.4854
[I 2025-08-07 17:42:01,607] Trial 316 finished with value: 0.4854357481002808 and parameters: {'fp_type': 'morgan_rdkit', 'combined_morgan_radius': 2, 'combined_morgan_nBits': 1024, 'combined_rdkit_maxPath': 7, 'combined_rdkit_nBits': 1024, 'num_hidden_layers': 2, 'hidden_dim_0': 64, 'hidden_dim_1': 512, 'kl_weight': 0.00010008803998436614, 'lr': 0.0010048390221761101, 'batch_size': 32, 'dropout_rate': 0.2252508181992505, 'prior_mu': 0.05235592363489164, 'prior_sigma': 0.0344495315674022, 'normalization': 'layer'}. Best is trial 179 with value: 0.4671938598155975.
Generating morgan fingerprints...
Generated fingerprints with 2048 features for 841 molecules
Trial 317: 5-fold CV loss = 0.4758
[I 2025-08-07 17:42:07,550] Trial 317 finished with value: 0.475815612077713 and parameters: {'fp_type': 'morgan_rdkit', 'combined_morgan_radius': 2, 'combined_morgan_nBits': 1024, 'combined_rdkit_maxPath': 7, 'combined_rdkit_nBits': 1024, 'num_hidden_layers': 2, 'hidden_dim_0': 64, 'hidden_dim_1': 512, 'kl_weight': 0.00011481705376498103, 'lr': 0.0008150033604760345, 'batch_size': 32, 'dropout_rate': 0.22379616153709334, 'prior_mu': 0.05570898694142233, 'prior_sigma': 0.02693793646947165, 'normalization': 'layer'}. Best is trial 179 with value: 0.4671938598155975.
Generating morgan fingerprints...
Generated fingerprints with 2048 features for 841 molecules
Trial 321: 5-fold CV loss = 0.5181
[I 2025-08-07 17:42:23,743] Trial 321 finished with value: 0.518126231431961 and parameters: {'fp_type': 'morgan', 'morgan_only_radius': 3, 'morgan_only_nBits': 2048, 'num_hidden_layers': 2, 'hidden_dim_0': 64, 'hidden_dim_1': 128, 'kl_weight': 0.0001317440749414992, 'lr': 0.0007517345122478377, 'batch_size': 128, 'dropout_rate': 0.26864480922061157, 'prior_mu': 0.04165076296613038, 'prior_sigma': 0.012574011377441977, 'normalization': 'layer'}. Best is trial 179 with value: 0.4671938598155975.
Generating morgan_rdkit fingerprints...
Generated fingerprints with 1536 features for 841 molecules
Trial 318: 5-fold CV loss = 0.4769
[I 2025-08-07 17:42:56,821] Trial 318 finished with value: 0.476933079957962 and parameters: {'fp_type': 'morgan_rdkit', 'combined_morgan_radius': 2, 'combined_morgan_nBits': 512, 'combined_rdkit_maxPath': 8, 'combined_rdkit_nBits': 1024, 'num_hidden_layers': 2, 'hidden_dim_0': 64, 'hidden_dim_1': 512, 'kl_weight': 0.00012924637093885812, 'lr': 0.0010850703392471578, 'batch_size': 32, 'dropout_rate': 0.28605072025057426, 'prior_mu': 0.042256095231646806, 'prior_sigma': 0.027328647957453104, 'normalization': 'layer'}. Best is trial 179 with value: 0.4671938598155975.
Generating morgan_rdkit fingerprints...
Generated fingerprints with 1536 features for 841 molecules
Trial 320: 5-fold CV loss = 0.5215
[I 2025-08-07 17:42:57,952] Trial 320 finished with value: 0.5214883625507355 and parameters: {'fp_type': 'morgan', 'morgan_only_radius': 3, 'morgan_only_nBits': 2048, 'num_hidden_layers': 2, 'hidden_dim_0': 64, 'hidden_dim_1': 128, 'kl_weight': 0.0001294411868001865, 'lr': 0.0009620092288219825, 'batch_size': 32, 'dropout_rate': 0.2889226359370537, 'prior_mu': 0.041068337013112105, 'prior_sigma': 0.027266267258106266, 'normalization': 'layer'}. Best is trial 179 with value: 0.4671938598155975.
Generating morgan_rdkit fingerprints...
Generated fingerprints with 1536 features for 841 molecules
Trial 322: 5-fold CV loss = 0.4745
[I 2025-08-07 17:43:18,884] Trial 322 finished with value: 0.4744658708572388 and parameters: {'fp_type': 'morgan_rdkit', 'combined_morgan_radius': 2, 'combined_morgan_nBits': 512, 'combined_rdkit_maxPath': 7, 'combined_rdkit_nBits': 1024, 'num_hidden_layers': 2, 'hidden_dim_0': 64, 'hidden_dim_1': 512, 'kl_weight': 0.00013099518463583604, 'lr': 0.002406773672750976, 'batch_size': 32, 'dropout_rate': 0.28718248944779723, 'prior_mu': 0.07240583653218892, 'prior_sigma': 0.018412351290206866, 'normalization': 'layer'}. Best is trial 179 with value: 0.4671938598155975.
Generating morgan_rdkit fingerprints...
Generated fingerprints with 1536 features for 841 molecules
Trial 325: 5-fold CV loss = 0.5591
[I 2025-08-07 17:43:44,079] Trial 325 finished with value: 0.5590789437294006 and parameters: {'fp_type': 'morgan_rdkit', 'combined_morgan_radius': 2, 'combined_morgan_nBits': 512, 'combined_rdkit_maxPath': 6, 'combined_rdkit_nBits': 1024, 'num_hidden_layers': 2, 'hidden_dim_0': 64, 'hidden_dim_1': 512, 'kl_weight': 0.00016049675960615493, 'lr': 0.0010642549922404594, 'batch_size': 32, 'dropout_rate': 0.2542572636596541, 'prior_mu': 0.08989588940539084, 'prior_sigma': 0.01794406705164135, 'normalization': 'none'}. Best is trial 179 with value: 0.4671938598155975.
Generating morgan_rdkit fingerprints...
Generated fingerprints with 1536 features for 841 molecules
Trial 323: 5-fold CV loss = 0.4897
[I 2025-08-07 17:43:50,759] Trial 323 finished with value: 0.48972862362861636 and parameters: {'fp_type': 'morgan_rdkit', 'combined_morgan_radius': 2, 'combined_morgan_nBits': 512, 'combined_rdkit_maxPath': 6, 'combined_rdkit_nBits': 1024, 'num_hidden_layers': 2, 'hidden_dim_0': 64, 'hidden_dim_1': 512, 'kl_weight': 0.00011890013192826465, 'lr': 0.0010591631349584274, 'batch_size': 32, 'dropout_rate': 0.24326167416241848, 'prior_mu': 0.09086811272392827, 'prior_sigma': 0.017915894139906078, 'normalization': 'layer'}. Best is trial 179 with value: 0.4671938598155975.
Generating morgan_rdkit fingerprints...
Generated fingerprints with 1536 features for 841 molecules
Trial 326: 5-fold CV loss = 0.4942
[I 2025-08-07 17:44:37,823] Trial 326 finished with value: 0.49424423575401305 and parameters: {'fp_type': 'morgan_rdkit', 'combined_morgan_radius': 2, 'combined_morgan_nBits': 512, 'combined_rdkit_maxPath': 7, 'combined_rdkit_nBits': 1024, 'num_hidden_layers': 2, 'hidden_dim_0': 64, 'hidden_dim_1': 512, 'kl_weight': 0.00014509831704385894, 'lr': 0.0005935659308517555, 'batch_size': 32, 'dropout_rate': 0.31387259189537337, 'prior_mu': 0.07175248139333504, 'prior_sigma': 0.02391698067004578, 'normalization': 'layer'}. Best is trial 179 with value: 0.4671938598155975.
Generating morgan_rdkit fingerprints...
Generated fingerprints with 1536 features for 841 molecules
Trial 319: 5-fold CV loss = 0.4854
[I 2025-08-07 17:45:03,026] Trial 319 finished with value: 0.4854108214378357 and parameters: {'fp_type': 'morgan_rdkit', 'combined_morgan_radius': 2, 'combined_morgan_nBits': 512, 'combined_rdkit_maxPath': 8, 'combined_rdkit_nBits': 1024, 'num_hidden_layers': 2, 'hidden_dim_0': 64, 'hidden_dim_1': 512, 'kl_weight': 0.00012873615110417549, 'lr': 0.001019829733570738, 'batch_size': 32, 'dropout_rate': 0.29091811749458346, 'prior_mu': 0.04518571860321097, 'prior_sigma': 0.027000589571426974, 'normalization': 'layer'}. Best is trial 179 with value: 0.4671938598155975.
Generating morgan_rdkit fingerprints...
Generated fingerprints with 1536 features for 841 molecules
Trial 327: 5-fold CV loss = 0.4849
[I 2025-08-07 17:45:26,404] Trial 327 finished with value: 0.48491703271865844 and parameters: {'fp_type': 'morgan_rdkit', 'combined_morgan_radius': 2, 'combined_morgan_nBits': 512, 'combined_rdkit_maxPath': 7, 'combined_rdkit_nBits': 1024, 'num_hidden_layers': 2, 'hidden_dim_0': 1024, 'hidden_dim_1': 512, 'kl_weight': 0.00010053230361712407, 'lr': 0.002417239747511466, 'batch_size': 32, 'dropout_rate': 0.3157592999332039, 'prior_mu': 0.07350455483757659, 'prior_sigma': 0.07355791853295729, 'normalization': 'layer'}. Best is trial 179 with value: 0.4671938598155975.
Generating morgan_rdkit fingerprints...
Generated fingerprints with 1536 features for 841 molecules
Trial 328: 5-fold CV loss = 0.4814
[I 2025-08-07 17:45:30,828] Trial 328 finished with value: 0.48138447999954226 and parameters: {'fp_type': 'morgan_rdkit', 'combined_morgan_radius': 2, 'combined_morgan_nBits': 512, 'combined_rdkit_maxPath': 7, 'combined_rdkit_nBits': 1024, 'num_hidden_layers': 2, 'hidden_dim_0': 1024, 'hidden_dim_1': 512, 'kl_weight': 0.00010084200307745014, 'lr': 0.001778585055362958, 'batch_size': 32, 'dropout_rate': 0.26942642299847286, 'prior_mu': 0.07905957822315036, 'prior_sigma': 0.022913741061991406, 'normalization': 'layer'}. Best is trial 179 with value: 0.4671938598155975.
Generating morgan_rdkit fingerprints...
Generated fingerprints with 1536 features for 841 molecules
Trial 324: 5-fold CV loss = 0.5019
[I 2025-08-07 17:45:46,808] Trial 324 finished with value: 0.5019254148006439 and parameters: {'fp_type': 'morgan_rdkit', 'combined_morgan_radius': 2, 'combined_morgan_nBits': 512, 'combined_rdkit_maxPath': 7, 'combined_rdkit_nBits': 1024, 'num_hidden_layers': 2, 'hidden_dim_0': 64, 'hidden_dim_1': 512, 'kl_weight': 0.00010000588876024085, 'lr': 0.0011148491477814455, 'batch_size': 32, 'dropout_rate': 0.2521521053199047, 'prior_mu': 0.09178304525016981, 'prior_sigma': 0.07451152653667127, 'normalization': 'layer'}. Best is trial 179 with value: 0.4671938598155975.
Generating morgan_rdkit fingerprints...
Generated fingerprints with 1536 features for 841 molecules
Trial 331: 5-fold CV loss = 0.4845
[I 2025-08-07 17:46:30,120] Trial 331 finished with value: 0.48446274399757383 and parameters: {'fp_type': 'morgan_rdkit', 'combined_morgan_radius': 2, 'combined_morgan_nBits': 512, 'combined_rdkit_maxPath': 7, 'combined_rdkit_nBits': 1024, 'num_hidden_layers': 2, 'hidden_dim_0': 64, 'hidden_dim_1': 512, 'kl_weight': 0.00016300731530483615, 'lr': 0.001194970840094017, 'batch_size': 32, 'dropout_rate': 0.25524510893968816, 'prior_mu': 0.09579296029399453, 'prior_sigma': 0.030728819359516556, 'normalization': 'layer'}. Best is trial 179 with value: 0.4671938598155975.
Generating morgan_rdkit fingerprints...
Generated fingerprints with 1536 features for 841 molecules
Trial 330: 5-fold CV loss = 0.4817
[I 2025-08-07 17:46:42,590] Trial 330 finished with value: 0.4816864490509033 and parameters: {'fp_type': 'morgan_rdkit', 'combined_morgan_radius': 2, 'combined_morgan_nBits': 512, 'combined_rdkit_maxPath': 7, 'combined_rdkit_nBits': 1024, 'num_hidden_layers': 2, 'hidden_dim_0': 64, 'hidden_dim_1': 512, 'kl_weight': 0.0001621822639710818, 'lr': 0.001798035775047256, 'batch_size': 32, 'dropout_rate': 0.2672462293689326, 'prior_mu': 0.079328655452165, 'prior_sigma': 0.02996389585641892, 'normalization': 'layer'}. Best is trial 179 with value: 0.4671938598155975.
Generating morgan_rdkit fingerprints...
Generated fingerprints with 1536 features for 841 molecules
Trial 332: 5-fold CV loss = 0.4806
[I 2025-08-07 17:47:10,572] Trial 332 finished with value: 0.4806258261203766 and parameters: {'fp_type': 'morgan_rdkit', 'combined_morgan_radius': 2, 'combined_morgan_nBits': 512, 'combined_rdkit_maxPath': 7, 'combined_rdkit_nBits': 1024, 'num_hidden_layers': 2, 'hidden_dim_0': 64, 'hidden_dim_1': 512, 'kl_weight': 0.00015384261361032077, 'lr': 0.0012254320109631328, 'batch_size': 32, 'dropout_rate': 0.2625143731953845, 'prior_mu': 0.09920895787498187, 'prior_sigma': 0.018538335033932388, 'normalization': 'layer'}. Best is trial 179 with value: 0.4671938598155975.
Generating morgan_rdkit fingerprints...
Generated fingerprints with 1536 features for 841 molecules
Trial 333: 5-fold CV loss = 0.4795
[I 2025-08-07 17:47:43,130] Trial 333 finished with value: 0.47950822710990904 and parameters: {'fp_type': 'morgan_rdkit', 'combined_morgan_radius': 2, 'combined_morgan_nBits': 512, 'combined_rdkit_maxPath': 7, 'combined_rdkit_nBits': 1024, 'num_hidden_layers': 2, 'hidden_dim_0': 64, 'hidden_dim_1': 64, 'kl_weight': 0.00014341590283788798, 'lr': 0.00040198818153111483, 'batch_size': 32, 'dropout_rate': 0.26528623030870674, 'prior_mu': 0.07120083414626181, 'prior_sigma': 0.018256067056691066, 'normalization': 'layer'}. Best is trial 179 with value: 0.4671938598155975.
Generating morgan_rdkit fingerprints...
Generated fingerprints with 1536 features for 841 molecules
Trial 334: 5-fold CV loss = 0.4909
[I 2025-08-07 17:47:50,293] Trial 334 finished with value: 0.49093382358551024 and parameters: {'fp_type': 'morgan_rdkit', 'combined_morgan_radius': 2, 'combined_morgan_nBits': 512, 'combined_rdkit_maxPath': 7, 'combined_rdkit_nBits': 1024, 'num_hidden_layers': 2, 'hidden_dim_0': 64, 'hidden_dim_1': 64, 'kl_weight': 0.0006813361289820588, 'lr': 0.00228695521602683, 'batch_size': 32, 'dropout_rate': 0.3349295507801306, 'prior_mu': 0.06001070578605961, 'prior_sigma': 0.01901721110453792, 'normalization': 'layer'}. Best is trial 179 with value: 0.4671938598155975.
Generating morgan_rdkit fingerprints...
Generated fingerprints with 1536 features for 841 molecules
Trial 329: 5-fold CV loss = 0.4829
[I 2025-08-07 17:48:00,312] Trial 329 finished with value: 0.48285387754440307 and parameters: {'fp_type': 'morgan_rdkit', 'combined_morgan_radius': 2, 'combined_morgan_nBits': 512, 'combined_rdkit_maxPath': 7, 'combined_rdkit_nBits': 1024, 'num_hidden_layers': 2, 'hidden_dim_0': 1024, 'hidden_dim_1': 512, 'kl_weight': 0.00011244730792584334, 'lr': 0.0011728021937238596, 'batch_size': 32, 'dropout_rate': 0.33386881323338286, 'prior_mu': 0.08100152813464542, 'prior_sigma': 0.03071129638032072, 'normalization': 'layer'}. Best is trial 179 with value: 0.4671938598155975.
Generating morgan_rdkit fingerprints...
Generated fingerprints with 1536 features for 841 molecules
Trial 336: 5-fold CV loss = 0.4765
[I 2025-08-07 17:48:44,540] Trial 336 finished with value: 0.4765008807182312 and parameters: {'fp_type': 'morgan_rdkit', 'combined_morgan_radius': 2, 'combined_morgan_nBits': 512, 'combined_rdkit_maxPath': 7, 'combined_rdkit_nBits': 1024, 'num_hidden_layers': 2, 'hidden_dim_0': 64, 'hidden_dim_1': 512, 'kl_weight': 0.00011521454877118561, 'lr': 0.0023081300270157176, 'batch_size': 32, 'dropout_rate': 0.3457327173186828, 'prior_mu': 0.06036544913369227, 'prior_sigma': 0.024462486210539883, 'normalization': 'layer'}. Best is trial 179 with value: 0.4671938598155975.
Generating morgan_rdkit fingerprints...
Generated fingerprints with 1536 features for 841 molecules
Trial 337: 5-fold CV loss = 0.4739
[I 2025-08-07 17:48:52,496] Trial 337 finished with value: 0.47391980290412905 and parameters: {'fp_type': 'morgan_rdkit', 'combined_morgan_radius': 2, 'combined_morgan_nBits': 512, 'combined_rdkit_maxPath': 7, 'combined_rdkit_nBits': 1024, 'num_hidden_layers': 2, 'hidden_dim_0': 64, 'hidden_dim_1': 512, 'kl_weight': 0.00011694818029382485, 'lr': 0.0020397450554568144, 'batch_size': 32, 'dropout_rate': 0.24574813079377578, 'prior_mu': 0.051678534547748955, 'prior_sigma': 0.02361207960208356, 'normalization': 'layer'}. Best is trial 179 with value: 0.4671938598155975.
Generating morgan_rdkit fingerprints...
Generated fingerprints with 1536 features for 841 molecules
Trial 335: 5-fold CV loss = 0.4761
[I 2025-08-07 17:49:04,127] Trial 335 finished with value: 0.4760517418384552 and parameters: {'fp_type': 'morgan_rdkit', 'combined_morgan_radius': 2, 'combined_morgan_nBits': 512, 'combined_rdkit_maxPath': 7, 'combined_rdkit_nBits': 1024, 'num_hidden_layers': 2, 'hidden_dim_0': 64, 'hidden_dim_1': 512, 'kl_weight': 0.00011525532918771906, 'lr': 0.0023748484032796212, 'batch_size': 32, 'dropout_rate': 0.3640647822895372, 'prior_mu': 0.07054235191498179, 'prior_sigma': 0.023176143924710138, 'normalization': 'layer'}. Best is trial 179 with value: 0.4671938598155975.
Generating morgan_rdkit fingerprints...
Generated fingerprints with 1536 features for 841 molecules
Trial 339: 5-fold CV loss = 0.4750
[I 2025-08-07 17:49:53,966] Trial 339 finished with value: 0.4750480055809021 and parameters: {'fp_type': 'morgan_rdkit', 'combined_morgan_radius': 2, 'combined_morgan_nBits': 512, 'combined_rdkit_maxPath': 7, 'combined_rdkit_nBits': 1024, 'num_hidden_layers': 2, 'hidden_dim_0': 64, 'hidden_dim_1': 512, 'kl_weight': 0.00013081076259181132, 'lr': 0.002041550197840391, 'batch_size': 32, 'dropout_rate': 0.24261929268224203, 'prior_mu': 0.050140409807447675, 'prior_sigma': 0.04399908295293551, 'normalization': 'layer'}. Best is trial 179 with value: 0.4671938598155975.
Generating morgan_rdkit fingerprints...
Generated fingerprints with 1536 features for 841 molecules
Trial 340: 5-fold CV loss = 0.4805
[I 2025-08-07 17:50:01,581] Trial 340 finished with value: 0.48054760694503784 and parameters: {'fp_type': 'morgan_rdkit', 'combined_morgan_radius': 2, 'combined_morgan_nBits': 512, 'combined_rdkit_maxPath': 7, 'combined_rdkit_nBits': 1024, 'num_hidden_layers': 2, 'hidden_dim_0': 64, 'hidden_dim_1': 512, 'kl_weight': 0.00011680437259837585, 'lr': 0.002121312086761158, 'batch_size': 32, 'dropout_rate': 0.23346609015308942, 'prior_mu': 0.05057397101270219, 'prior_sigma': 0.042138662917584, 'normalization': 'layer'}. Best is trial 179 with value: 0.4671938598155975.
Generating morgan_rdkit fingerprints...
Generated fingerprints with 1536 features for 841 molecules
Trial 338: 5-fold CV loss = 0.4759
[I 2025-08-07 17:50:44,817] Trial 338 finished with value: 0.4758564233779907 and parameters: {'fp_type': 'morgan_rdkit', 'combined_morgan_radius': 2, 'combined_morgan_nBits': 512, 'combined_rdkit_maxPath': 7, 'combined_rdkit_nBits': 1024, 'num_hidden_layers': 2, 'hidden_dim_0': 64, 'hidden_dim_1': 512, 'kl_weight': 0.00011942245576623839, 'lr': 0.0020513493786785656, 'batch_size': 32, 'dropout_rate': 0.24223451083500308, 'prior_mu': 0.05021217597136573, 'prior_sigma': 0.023849874076002208, 'normalization': 'layer'}. Best is trial 179 with value: 0.4671938598155975.
Generating morgan_rdkit fingerprints...
Generated fingerprints with 768 features for 841 molecules
Trial 341: 5-fold CV loss = 0.4783
[I 2025-08-07 17:51:00,293] Trial 341 finished with value: 0.4783255457878113 and parameters: {'fp_type': 'morgan_rdkit', 'combined_morgan_radius': 2, 'combined_morgan_nBits': 512, 'combined_rdkit_maxPath': 7, 'combined_rdkit_nBits': 1024, 'num_hidden_layers': 2, 'hidden_dim_0': 64, 'hidden_dim_1': 512, 'kl_weight': 0.0001304628690036076, 'lr': 0.0020290775036159916, 'batch_size': 32, 'dropout_rate': 0.2352242026024848, 'prior_mu': 0.05231315414150162, 'prior_sigma': 0.045035827360514945, 'normalization': 'layer'}. Best is trial 179 with value: 0.4671938598155975.
Generating morgan_rdkit fingerprints...
Generated fingerprints with 768 features for 841 molecules
Trial 343: 5-fold CV loss = 0.4885
