[I 2025-08-07 23:28:37,595] Trial 1966 finished with value: 0.4659080743789673 and parameters: {'fp_type': 'morgan_rdkit', 'combined_morgan_radius': 3, 'combined_morgan_nBits': 1024, 'combined_rdkit_maxPath': 7, 'combined_rdkit_nBits': 1024, 'num_hidden_layers': 3, 'hidden_dim_0': 256, 'hidden_dim_1': 1024, 'hidden_dim_2': 64, 'kl_weight': 0.00019174706230918709, 'lr': 0.005849408589592692, 'batch_size': 128, 'dropout_rate': 0.14040355411003358, 'prior_mu': -0.034555653548160925, 'prior_sigma': 0.07239901594688355, 'normalization': 'layer'}. Best is trial 896 with value: 0.4533553242683411.
Generating morgan_rdkit fingerprints...
Generated fingerprints with 2048 features for 841 molecules
Trial 1964: 5-fold CV loss = 0.5837
[I 2025-08-07 23:28:39,347] Trial 1964 finished with value: 0.5836526274681091 and parameters: {'fp_type': 'morgan_rdkit', 'combined_morgan_radius': 3, 'combined_morgan_nBits': 1024, 'combined_rdkit_maxPath': 7, 'combined_rdkit_nBits': 256, 'num_hidden_layers': 3, 'hidden_dim_0': 512, 'hidden_dim_1': 1024, 'hidden_dim_2': 256, 'kl_weight': 0.00018641852740215154, 'lr': 0.006676570995285995, 'batch_size': 128, 'dropout_rate': 0.33983373260231253, 'prior_mu': -0.033839375693611166, 'prior_sigma': 0.08975448113662708, 'normalization': 'layer'}. Best is trial 896 with value: 0.4533553242683411.
Generating morgan_rdkit fingerprints...
Generated fingerprints with 2048 features for 841 molecules
Trial 1969: 5-fold CV loss = 0.7014
[I 2025-08-07 23:29:03,127] Trial 1969 finished with value: 0.7014439582824707 and parameters: {'fp_type': 'morgan_rdkit', 'combined_morgan_radius': 3, 'combined_morgan_nBits': 1024, 'combined_rdkit_maxPath': 7, 'combined_rdkit_nBits': 1024, 'num_hidden_layers': 3, 'hidden_dim_0': 256, 'hidden_dim_1': 1024, 'hidden_dim_2': 512, 'kl_weight': 0.00028318858490757845, 'lr': 0.007824213691875147, 'batch_size': 128, 'dropout_rate': 0.15153728635393854, 'prior_mu': -0.029297108381030598, 'prior_sigma': 0.07646762230561059, 'normalization': 'layer'}. Best is trial 896 with value: 0.4533553242683411.
Generating morgan_rdkit fingerprints...
Generated fingerprints with 2048 features for 841 molecules
Trial 1968: 5-fold CV loss = 0.4703
[I 2025-08-07 23:29:15,468] Trial 1968 finished with value: 0.4702759385108948 and parameters: {'fp_type': 'morgan_rdkit', 'combined_morgan_radius': 3, 'combined_morgan_nBits': 1024, 'combined_rdkit_maxPath': 7, 'combined_rdkit_nBits': 1024, 'num_hidden_layers': 3, 'hidden_dim_0': 256, 'hidden_dim_1': 1024, 'hidden_dim_2': 64, 'kl_weight': 0.00028363086669173617, 'lr': 0.008101325193506101, 'batch_size': 128, 'dropout_rate': 0.17582041390776623, 'prior_mu': -0.030099897903052935, 'prior_sigma': 0.07852129484585393, 'normalization': 'layer'}. Best is trial 896 with value: 0.4533553242683411.
Generating morgan_rdkit fingerprints...
Generated fingerprints with 2048 features for 841 molecules
Trial 1971: 5-fold CV loss = 0.4747
[I 2025-08-07 23:29:34,609] Trial 1971 finished with value: 0.47469413876533506 and parameters: {'fp_type': 'morgan_rdkit', 'combined_morgan_radius': 3, 'combined_morgan_nBits': 1024, 'combined_rdkit_maxPath': 7, 'combined_rdkit_nBits': 1024, 'num_hidden_layers': 3, 'hidden_dim_0': 256, 'hidden_dim_1': 1024, 'hidden_dim_2': 64, 'kl_weight': 0.005905278942063594, 'lr': 0.009143004665250124, 'batch_size': 128, 'dropout_rate': 0.1371449637289136, 'prior_mu': -0.0019812690723246956, 'prior_sigma': 0.077932219934054, 'normalization': 'layer'}. Best is trial 896 with value: 0.4533553242683411.
Generating morgan_rdkit fingerprints...
Generated fingerprints with 2048 features for 841 molecules
Trial 1970: 5-fold CV loss = 0.4728
[I 2025-08-07 23:29:37,019] Trial 1970 finished with value: 0.47280900478363036 and parameters: {'fp_type': 'morgan_rdkit', 'combined_morgan_radius': 3, 'combined_morgan_nBits': 1024, 'combined_rdkit_maxPath': 7, 'combined_rdkit_nBits': 1024, 'num_hidden_layers': 3, 'hidden_dim_0': 256, 'hidden_dim_1': 128, 'hidden_dim_2': 64, 'kl_weight': 0.0002763928134844464, 'lr': 0.007885393932229178, 'batch_size': 128, 'dropout_rate': 0.17750443533118093, 'prior_mu': -0.0009477949771122679, 'prior_sigma': 0.0787713017690845, 'normalization': 'layer'}. Best is trial 896 with value: 0.4533553242683411.
Generating morgan_rdkit fingerprints...
Generated fingerprints with 1536 features for 841 molecules
Trial 1967: 5-fold CV loss = 0.4608
[I 2025-08-07 23:29:39,826] Trial 1967 finished with value: 0.46078464984893797 and parameters: {'fp_type': 'morgan_rdkit', 'combined_morgan_radius': 3, 'combined_morgan_nBits': 1024, 'combined_rdkit_maxPath': 7, 'combined_rdkit_nBits': 1024, 'num_hidden_layers': 3, 'hidden_dim_0': 256, 'hidden_dim_1': 1024, 'hidden_dim_2': 64, 'kl_weight': 0.0001828997178347585, 'lr': 0.005673287268794492, 'batch_size': 128, 'dropout_rate': 0.14070645058883965, 'prior_mu': -0.03388253391011722, 'prior_sigma': 0.07143593647288315, 'normalization': 'layer'}. Best is trial 896 with value: 0.4533553242683411.
Generating morgan_rdkit fingerprints...
Generated fingerprints with 1536 features for 841 molecules
Trial 1972: 5-fold CV loss = 0.4685
[I 2025-08-07 23:30:01,215] Trial 1972 finished with value: 0.4684904217720032 and parameters: {'fp_type': 'morgan_rdkit', 'combined_morgan_radius': 3, 'combined_morgan_nBits': 1024, 'combined_rdkit_maxPath': 7, 'combined_rdkit_nBits': 1024, 'num_hidden_layers': 3, 'hidden_dim_0': 256, 'hidden_dim_1': 1024, 'hidden_dim_2': 64, 'kl_weight': 0.0002400836129987654, 'lr': 0.005610824652609791, 'batch_size': 128, 'dropout_rate': 0.13561471054547947, 'prior_mu': 0.004637190862288984, 'prior_sigma': 0.08637280892697574, 'normalization': 'layer'}. Best is trial 896 with value: 0.4533553242683411.
Generating morgan_rdkit fingerprints...
Generated fingerprints with 1536 features for 841 molecules
Trial 1973: 5-fold CV loss = 0.4635
[I 2025-08-07 23:30:31,305] Trial 1973 finished with value: 0.4635124564170837 and parameters: {'fp_type': 'morgan_rdkit', 'combined_morgan_radius': 3, 'combined_morgan_nBits': 1024, 'combined_rdkit_maxPath': 7, 'combined_rdkit_nBits': 1024, 'num_hidden_layers': 3, 'hidden_dim_0': 256, 'hidden_dim_1': 1024, 'hidden_dim_2': 64, 'kl_weight': 0.0003484146404350205, 'lr': 0.005241728029518922, 'batch_size': 64, 'dropout_rate': 0.36693761471935393, 'prior_mu': -0.039952585006672814, 'prior_sigma': 0.09370707055170566, 'normalization': 'layer'}. Best is trial 896 with value: 0.4533553242683411.
Generating morgan_rdkit fingerprints...
Generated fingerprints with 2048 features for 841 molecules
Trial 1976: 5-fold CV loss = 0.4704
[I 2025-08-07 23:30:56,039] Trial 1976 finished with value: 0.4703580379486084 and parameters: {'fp_type': 'morgan_rdkit', 'combined_morgan_radius': 3, 'combined_morgan_nBits': 512, 'combined_rdkit_maxPath': 7, 'combined_rdkit_nBits': 1024, 'num_hidden_layers': 3, 'hidden_dim_0': 128, 'hidden_dim_1': 1024, 'hidden_dim_2': 64, 'kl_weight': 0.00033236157100194835, 'lr': 0.0072337397004250134, 'batch_size': 64, 'dropout_rate': 0.15401969561274728, 'prior_mu': -0.020409219339311353, 'prior_sigma': 0.092131121737199, 'normalization': 'layer'}. Best is trial 896 with value: 0.4533553242683411.
Generating morgan_rdkit fingerprints...
Generated fingerprints with 2048 features for 841 molecules
Trial 1977: 5-fold CV loss = 0.4672
[I 2025-08-07 23:30:59,358] Trial 1977 finished with value: 0.4672181248664856 and parameters: {'fp_type': 'morgan_rdkit', 'combined_morgan_radius': 3, 'combined_morgan_nBits': 1024, 'combined_rdkit_maxPath': 6, 'combined_rdkit_nBits': 1024, 'num_hidden_layers': 3, 'hidden_dim_0': 256, 'hidden_dim_1': 1024, 'hidden_dim_2': 64, 'kl_weight': 0.00034417520438567695, 'lr': 0.007132255549467171, 'batch_size': 128, 'dropout_rate': 0.14926072858799475, 'prior_mu': -0.021642302196163338, 'prior_sigma': 0.08526699599810934, 'normalization': 'layer'}. Best is trial 896 with value: 0.4533553242683411.
Generating morgan_rdkit fingerprints...
Generated fingerprints with 2048 features for 841 molecules
Trial 1974: 5-fold CV loss = 0.4665
[I 2025-08-07 23:31:03,446] Trial 1974 finished with value: 0.4664957046508789 and parameters: {'fp_type': 'morgan_rdkit', 'combined_morgan_radius': 3, 'combined_morgan_nBits': 512, 'combined_rdkit_maxPath': 7, 'combined_rdkit_nBits': 1024, 'num_hidden_layers': 3, 'hidden_dim_0': 128, 'hidden_dim_1': 1024, 'hidden_dim_2': 64, 'kl_weight': 0.00034287250861443934, 'lr': 0.005378316793608925, 'batch_size': 64, 'dropout_rate': 0.14815879735079002, 'prior_mu': -0.04086338264548823, 'prior_sigma': 0.08676967617884931, 'normalization': 'layer'}. Best is trial 896 with value: 0.4533553242683411.
Generating morgan_rdkit fingerprints...
Generated fingerprints with 2048 features for 841 molecules
Trial 1978: 5-fold CV loss = 0.4742
[I 2025-08-07 23:31:29,212] Trial 1978 finished with value: 0.47419150471687316 and parameters: {'fp_type': 'morgan_rdkit', 'combined_morgan_radius': 3, 'combined_morgan_nBits': 1024, 'combined_rdkit_maxPath': 6, 'combined_rdkit_nBits': 1024, 'num_hidden_layers': 3, 'hidden_dim_0': 256, 'hidden_dim_1': 1024, 'hidden_dim_2': 64, 'kl_weight': 0.00034323603057889414, 'lr': 0.006496752503960068, 'batch_size': 128, 'dropout_rate': 0.16782382846205712, 'prior_mu': -0.023624079946225535, 'prior_sigma': 0.08561043841374744, 'normalization': 'layer'}. Best is trial 896 with value: 0.4533553242683411.
Generating morgan_rdkit fingerprints...
Generated fingerprints with 2048 features for 841 molecules
Trial 1979: 5-fold CV loss = 0.4641
[I 2025-08-07 23:31:34,164] Trial 1979 finished with value: 0.46405794024467467 and parameters: {'fp_type': 'morgan_rdkit', 'combined_morgan_radius': 3, 'combined_morgan_nBits': 1024, 'combined_rdkit_maxPath': 7, 'combined_rdkit_nBits': 1024, 'num_hidden_layers': 3, 'hidden_dim_0': 256, 'hidden_dim_1': 1024, 'hidden_dim_2': 64, 'kl_weight': 0.0002871386236111284, 'lr': 0.006407402811933306, 'batch_size': 128, 'dropout_rate': 0.2053353306587415, 'prior_mu': -0.013554480897616322, 'prior_sigma': 0.07428937132488593, 'normalization': 'layer'}. Best is trial 896 with value: 0.4533553242683411.
Generating morgan_rdkit fingerprints...
Generated fingerprints with 2048 features for 841 molecules
Trial 1975: 5-fold CV loss = 0.4603
[I 2025-08-07 23:31:42,914] Trial 1975 finished with value: 0.4602811515331268 and parameters: {'fp_type': 'morgan_rdkit', 'combined_morgan_radius': 3, 'combined_morgan_nBits': 512, 'combined_rdkit_maxPath': 7, 'combined_rdkit_nBits': 1024, 'num_hidden_layers': 3, 'hidden_dim_0': 128, 'hidden_dim_1': 1024, 'hidden_dim_2': 64, 'kl_weight': 0.00034442916461784, 'lr': 0.00717793938515127, 'batch_size': 64, 'dropout_rate': 0.14654202943231115, 'prior_mu': -0.02150016826445931, 'prior_sigma': 0.08633602804650929, 'normalization': 'layer'}. Best is trial 896 with value: 0.4533553242683411.
Generating morgan_rdkit fingerprints...
Generated fingerprints with 1536 features for 841 molecules
Trial 1980: 5-fold CV loss = 0.4637
[I 2025-08-07 23:31:56,482] Trial 1980 finished with value: 0.4636947214603424 and parameters: {'fp_type': 'morgan_rdkit', 'combined_morgan_radius': 3, 'combined_morgan_nBits': 1024, 'combined_rdkit_maxPath': 7, 'combined_rdkit_nBits': 1024, 'num_hidden_layers': 3, 'hidden_dim_0': 256, 'hidden_dim_1': 1024, 'hidden_dim_2': 64, 'kl_weight': 0.0002546024190403986, 'lr': 0.006337562689565422, 'batch_size': 128, 'dropout_rate': 0.1630088979852475, 'prior_mu': -0.009339962543191664, 'prior_sigma': 0.07387118443367847, 'normalization': 'layer'}. Best is trial 896 with value: 0.4533553242683411.
Generating morgan_rdkit fingerprints...
Generated fingerprints with 1536 features for 841 molecules
Trial 1981: 5-fold CV loss = 0.4704
[I 2025-08-07 23:32:06,679] Trial 1981 finished with value: 0.4703709721565247 and parameters: {'fp_type': 'morgan_rdkit', 'combined_morgan_radius': 3, 'combined_morgan_nBits': 1024, 'combined_rdkit_maxPath': 7, 'combined_rdkit_nBits': 1024, 'num_hidden_layers': 3, 'hidden_dim_0': 256, 'hidden_dim_1': 1024, 'hidden_dim_2': 64, 'kl_weight': 0.0002462665027098562, 'lr': 0.006208210641931987, 'batch_size': 128, 'dropout_rate': 0.13417993546161147, 'prior_mu': -0.0079503767271203, 'prior_sigma': 0.0747624463618308, 'normalization': 'layer'}. Best is trial 896 with value: 0.4533553242683411.
Generating morgan_rdkit fingerprints...
Generated fingerprints with 1536 features for 841 molecules
Trial 1982: 5-fold CV loss = 0.4627
[I 2025-08-07 23:32:08,637] Trial 1982 finished with value: 0.46265028715133666 and parameters: {'fp_type': 'morgan_rdkit', 'combined_morgan_radius': 3, 'combined_morgan_nBits': 1024, 'combined_rdkit_maxPath': 7, 'combined_rdkit_nBits': 1024, 'num_hidden_layers': 3, 'hidden_dim_0': 256, 'hidden_dim_1': 1024, 'hidden_dim_2': 64, 'kl_weight': 0.0002472138308678119, 'lr': 0.009002716602546484, 'batch_size': 128, 'dropout_rate': 0.16764171859144533, 'prior_mu': -0.009135499544147344, 'prior_sigma': 0.07999450769679772, 'normalization': 'layer'}. Best is trial 896 with value: 0.4533553242683411.
Generating morgan_rdkit fingerprints...
Generated fingerprints with 1536 features for 841 molecules
Trial 1986: 5-fold CV loss = 0.5652
[I 2025-08-07 23:32:37,027] Trial 1986 finished with value: 0.5652347326278686 and parameters: {'fp_type': 'morgan_rdkit', 'combined_morgan_radius': 3, 'combined_morgan_nBits': 1024, 'combined_rdkit_maxPath': 7, 'combined_rdkit_nBits': 512, 'num_hidden_layers': 3, 'hidden_dim_0': 256, 'hidden_dim_1': 1024, 'hidden_dim_2': 64, 'kl_weight': 0.0002081165907490811, 'lr': 0.008363154105356983, 'batch_size': 128, 'dropout_rate': 0.19881688668279263, 'prior_mu': -0.03970522034664328, 'prior_sigma': 0.08176583386944548, 'normalization': 'layer'}. Best is trial 896 with value: 0.4533553242683411.
Generating morgan_rdkit fingerprints...
Generated fingerprints with 2048 features for 841 molecules
Trial 1985: 5-fold CV loss = 0.4934
[I 2025-08-07 23:32:43,448] Trial 1985 finished with value: 0.49338900446891787 and parameters: {'fp_type': 'morgan_rdkit', 'combined_morgan_radius': 3, 'combined_morgan_nBits': 1024, 'combined_rdkit_maxPath': 7, 'combined_rdkit_nBits': 512, 'num_hidden_layers': 3, 'hidden_dim_0': 256, 'hidden_dim_1': 1024, 'hidden_dim_2': 64, 'kl_weight': 0.0002933646430366423, 'lr': 0.009062472702737143, 'batch_size': 128, 'dropout_rate': 0.16810277161920015, 'prior_mu': -0.04068778877767731, 'prior_sigma': 0.07969418971903067, 'normalization': 'layer'}. Best is trial 896 with value: 0.4533553242683411.
Generating morgan_rdkit fingerprints...
Generated fingerprints with 2048 features for 841 molecules
Trial 1984: 5-fold CV loss = 0.5755
[I 2025-08-07 23:32:45,957] Trial 1984 finished with value: 0.5754688858985901 and parameters: {'fp_type': 'morgan_rdkit', 'combined_morgan_radius': 3, 'combined_morgan_nBits': 1024, 'combined_rdkit_maxPath': 7, 'combined_rdkit_nBits': 512, 'num_hidden_layers': 3, 'hidden_dim_0': 256, 'hidden_dim_1': 1024, 'hidden_dim_2': 64, 'kl_weight': 0.0002132693704426285, 'lr': 0.009031164514736423, 'batch_size': 128, 'dropout_rate': 0.13290338462553705, 'prior_mu': -0.040714233645899336, 'prior_sigma': 0.08210743240488988, 'normalization': 'layer'}. Best is trial 896 with value: 0.4533553242683411.
Generating morgan_rdkit fingerprints...
Generated fingerprints with 2048 features for 841 molecules
Trial 1983: 5-fold CV loss = 0.4864
[I 2025-08-07 23:33:08,715] Trial 1983 finished with value: 0.48644837737083435 and parameters: {'fp_type': 'morgan_rdkit', 'combined_morgan_radius': 3, 'combined_morgan_nBits': 1024, 'combined_rdkit_maxPath': 7, 'combined_rdkit_nBits': 512, 'num_hidden_layers': 3, 'hidden_dim_0': 256, 'hidden_dim_1': 1024, 'hidden_dim_2': 64, 'kl_weight': 0.00024241784178951806, 'lr': 0.008838081914233104, 'batch_size': 128, 'dropout_rate': 0.1330375349522136, 'prior_mu': -0.009548512112578317, 'prior_sigma': 0.08124539080887583, 'normalization': 'layer'}. Best is trial 896 with value: 0.4533553242683411.
Generating morgan_rdkit fingerprints...
Generated fingerprints with 2048 features for 841 molecules
Trial 1987: 5-fold CV loss = 0.6818
[I 2025-08-07 23:33:15,190] Trial 1987 finished with value: 0.6817635297775269 and parameters: {'fp_type': 'morgan_rdkit', 'combined_morgan_radius': 3, 'combined_morgan_nBits': 1024, 'combined_rdkit_maxPath': 7, 'combined_rdkit_nBits': 1024, 'num_hidden_layers': 3, 'hidden_dim_0': 256, 'hidden_dim_1': 1024, 'hidden_dim_2': 64, 'kl_weight': 0.0002977255522272014, 'lr': 0.007774946673390397, 'batch_size': 128, 'dropout_rate': 0.18624338014587452, 'prior_mu': -0.028475687146733483, 'prior_sigma': 0.09568600209082463, 'normalization': 'none'}. Best is trial 896 with value: 0.4533553242683411.
Generating morgan_rdkit fingerprints...
Generated fingerprints with 2048 features for 841 molecules
Trial 1988: 5-fold CV loss = 0.6117
[I 2025-08-07 23:33:31,891] Trial 1988 finished with value: 0.6116859316825867 and parameters: {'fp_type': 'morgan_rdkit', 'combined_morgan_radius': 3, 'combined_morgan_nBits': 1024, 'combined_rdkit_maxPath': 8, 'combined_rdkit_nBits': 1024, 'num_hidden_layers': 3, 'hidden_dim_0': 256, 'hidden_dim_1': 1024, 'hidden_dim_2': 64, 'kl_weight': 0.0001627010085602076, 'lr': 0.0076236993762988856, 'batch_size': 128, 'dropout_rate': 0.18336656014273187, 'prior_mu': -0.025933896428732436, 'prior_sigma': 0.09015114377484128, 'normalization': 'none'}. Best is trial 896 with value: 0.4533553242683411.
Generating morgan_rdkit fingerprints...
Generated fingerprints with 2048 features for 841 molecules
Trial 1989: 5-fold CV loss = 0.4623
[I 2025-08-07 23:33:38,976] Trial 1989 finished with value: 0.46227834224700926 and parameters: {'fp_type': 'morgan_rdkit', 'combined_morgan_radius': 3, 'combined_morgan_nBits': 1024, 'combined_rdkit_maxPath': 7, 'combined_rdkit_nBits': 1024, 'num_hidden_layers': 3, 'hidden_dim_0': 256, 'hidden_dim_1': 1024, 'hidden_dim_2': 64, 'kl_weight': 0.0003135254771152073, 'lr': 0.007798266995557086, 'batch_size': 128, 'dropout_rate': 0.15439496935366795, 'prior_mu': 0.018129872238686732, 'prior_sigma': 0.09387822077796115, 'normalization': 'layer'}. Best is trial 896 with value: 0.4533553242683411.
Generating morgan_rdkit fingerprints...
Generated fingerprints with 2048 features for 841 molecules
Trial 1991: 5-fold CV loss = 0.5686
[I 2025-08-07 23:33:53,111] Trial 1991 finished with value: 0.5686280786991119 and parameters: {'fp_type': 'morgan_rdkit', 'combined_morgan_radius': 3, 'combined_morgan_nBits': 1024, 'combined_rdkit_maxPath': 7, 'combined_rdkit_nBits': 1024, 'num_hidden_layers': 3, 'hidden_dim_0': 256, 'hidden_dim_1': 1024, 'hidden_dim_2': 64, 'kl_weight': 0.049572193070160434, 'lr': 0.0059237439675695735, 'batch_size': 128, 'dropout_rate': 0.18111967533479228, 'prior_mu': -0.02811988044411893, 'prior_sigma': 0.09050162393382681, 'normalization': 'layer'}. Best is trial 896 with value: 0.4533553242683411.
Generating morgan_rdkit fingerprints...
Generated fingerprints with 2048 features for 841 molecules
Trial 1993: 5-fold CV loss = 0.8170
[I 2025-08-07 23:34:10,359] Trial 1993 finished with value: 0.8169729113578796 and parameters: {'fp_type': 'morgan_rdkit', 'combined_morgan_radius': 3, 'combined_morgan_nBits': 1024, 'combined_rdkit_maxPath': 7, 'combined_rdkit_nBits': 1024, 'num_hidden_layers': 3, 'hidden_dim_0': 256, 'hidden_dim_1': 128, 'hidden_dim_2': 512, 'kl_weight': 0.00028512451368358806, 'lr': 0.004940533112216393, 'batch_size': 128, 'dropout_rate': 0.14479707842223136, 'prior_mu': -0.017717658010047474, 'prior_sigma': 0.06942377966769199, 'normalization': 'layer'}. Best is trial 896 with value: 0.4533553242683411.
Generating morgan_rdkit fingerprints...
Generated fingerprints with 2048 features for 841 molecules
Trial 1992: 5-fold CV loss = 0.4654
[I 2025-08-07 23:34:15,950] Trial 1992 finished with value: 0.4654289722442627 and parameters: {'fp_type': 'morgan_rdkit', 'combined_morgan_radius': 3, 'combined_morgan_nBits': 1024, 'combined_rdkit_maxPath': 7, 'combined_rdkit_nBits': 1024, 'num_hidden_layers': 3, 'hidden_dim_0': 256, 'hidden_dim_1': 1024, 'hidden_dim_2': 64, 'kl_weight': 0.0002807288444842693, 'lr': 0.005004489260397707, 'batch_size': 128, 'dropout_rate': 0.15208238521996859, 'prior_mu': -0.030017074205720588, 'prior_sigma': 0.06996502025740135, 'normalization': 'layer'}. Best is trial 896 with value: 0.4533553242683411.
Generating morgan_rdkit fingerprints...
Generated fingerprints with 2048 features for 841 molecules
Trial 1994: 5-fold CV loss = 0.6800
[I 2025-08-07 23:34:27,061] Trial 1994 finished with value: 0.6800091803073883 and parameters: {'fp_type': 'morgan_rdkit', 'combined_morgan_radius': 3, 'combined_morgan_nBits': 1024, 'combined_rdkit_maxPath': 7, 'combined_rdkit_nBits': 1024, 'num_hidden_layers': 3, 'hidden_dim_0': 256, 'hidden_dim_1': 1024, 'hidden_dim_2': 512, 'kl_weight': 0.00035922072695813555, 'lr': 0.005061698819103918, 'batch_size': 128, 'dropout_rate': 0.1551684989157409, 'prior_mu': -0.018918373106097435, 'prior_sigma': 0.06983990338012233, 'normalization': 'layer'}. Best is trial 896 with value: 0.4533553242683411.
Generating morgan fingerprints...
Generated fingerprints with 2048 features for 841 molecules
Trial 1997: 5-fold CV loss = 0.5637
[I 2025-08-07 23:34:39,009] Trial 1997 finished with value: 0.563742733001709 and parameters: {'fp_type': 'morgan', 'morgan_only_radius': 3, 'morgan_only_nBits': 2048, 'num_hidden_layers': 1, 'hidden_dim_0': 256, 'kl_weight': 0.0003568437072213008, 'lr': 0.006907758638677971, 'batch_size': 128, 'dropout_rate': 0.14064973332726655, 'prior_mu': 0.007492305502775283, 'prior_sigma': 0.07647152528275312, 'normalization': 'layer'}. Best is trial 896 with value: 0.4533553242683411.
Generating morgan_rdkit fingerprints...
Generated fingerprints with 2048 features for 841 molecules
Trial 1996: 5-fold CV loss = 0.5463
