[I 2025-08-08 00:41:53,067] Trial 2326 finished with value: 0.5504311382770538 and parameters: {'fp_type': 'morgan_rdkit', 'combined_morgan_radius': 3, 'combined_morgan_nBits': 1024, 'combined_rdkit_maxPath': 7, 'combined_rdkit_nBits': 1024, 'num_hidden_layers': 3, 'hidden_dim_0': 256, 'hidden_dim_1': 64, 'hidden_dim_2': 64, 'kl_weight': 0.00011694210068958566, 'lr': 0.008655858687233236, 'batch_size': 128, 'dropout_rate': 0.08566174798019752, 'prior_mu': 0.011055576117333831, 'prior_sigma': 0.10773583219317692, 'normalization': 'layer'}. Best is trial 896 with value: 0.4533553242683411.
Generating rdkit fingerprints...
Generated fingerprints with 256 features for 841 molecules
Trial 2322: 5-fold CV loss = 0.4593
[I 2025-08-08 00:41:53,879] Trial 2322 finished with value: 0.45926268100738527 and parameters: {'fp_type': 'morgan_rdkit', 'combined_morgan_radius': 3, 'combined_morgan_nBits': 1024, 'combined_rdkit_maxPath': 7, 'combined_rdkit_nBits': 1024, 'num_hidden_layers': 3, 'hidden_dim_0': 256, 'hidden_dim_1': 1024, 'hidden_dim_2': 64, 'kl_weight': 0.0001102001144273526, 'lr': 0.009090075605603636, 'batch_size': 128, 'dropout_rate': 0.0666996236611679, 'prior_mu': -0.009278229305073929, 'prior_sigma': 0.10025333982811661, 'normalization': 'layer'}. Best is trial 896 with value: 0.4533553242683411.
Generating rdkit fingerprints...
Generated fingerprints with 256 features for 841 molecules
Trial 2327: 5-fold CV loss = 0.5305
[I 2025-08-08 00:43:00,816] Trial 2327 finished with value: 0.5305460214614868 and parameters: {'fp_type': 'rdkit', 'rdkit_only_maxPath': 5, 'rdkit_only_nBits': 256, 'num_hidden_layers': 3, 'hidden_dim_0': 256, 'hidden_dim_1': 64, 'hidden_dim_2': 64, 'kl_weight': 0.00013144625693786005, 'lr': 0.009104993674326692, 'batch_size': 32, 'dropout_rate': 0.08518268098580026, 'prior_mu': 0.01926273998781627, 'prior_sigma': 0.09751331580576224, 'normalization': 'layer'}. Best is trial 896 with value: 0.4533553242683411.
Generating morgan_rdkit fingerprints...
Generated fingerprints with 2048 features for 841 molecules
Trial 2331: 5-fold CV loss = 0.5168
[I 2025-08-08 00:43:25,420] Trial 2331 finished with value: 0.5168414115905762 and parameters: {'fp_type': 'morgan_rdkit', 'combined_morgan_radius': 3, 'combined_morgan_nBits': 1024, 'combined_rdkit_maxPath': 8, 'combined_rdkit_nBits': 1024, 'num_hidden_layers': 1, 'hidden_dim_0': 256, 'kl_weight': 0.00011429640059379111, 'lr': 0.008544076195140606, 'batch_size': 128, 'dropout_rate': 0.08081770439267455, 'prior_mu': 0.010982170212292669, 'prior_sigma': 0.09845109734107103, 'normalization': 'layer'}. Best is trial 896 with value: 0.4533553242683411.
Generating morgan_rdkit fingerprints...
Generated fingerprints with 2048 features for 841 molecules
Trial 2329: 5-fold CV loss = 0.5329
[I 2025-08-08 00:43:38,388] Trial 2329 finished with value: 0.5329436957836151 and parameters: {'fp_type': 'rdkit', 'rdkit_only_maxPath': 5, 'rdkit_only_nBits': 256, 'num_hidden_layers': 3, 'hidden_dim_0': 1024, 'hidden_dim_1': 1024, 'hidden_dim_2': 64, 'kl_weight': 0.00012007984378434925, 'lr': 0.009980597324396831, 'batch_size': 32, 'dropout_rate': 0.08014431772648996, 'prior_mu': 0.022862753186125642, 'prior_sigma': 0.09936713013391363, 'normalization': 'layer'}. Best is trial 896 with value: 0.4533553242683411.
Generating morgan_rdkit fingerprints...
Generated fingerprints with 2048 features for 841 molecules
Trial 2332: 5-fold CV loss = 0.4648
[I 2025-08-08 00:44:01,343] Trial 2332 finished with value: 0.46481788754463194 and parameters: {'fp_type': 'morgan_rdkit', 'combined_morgan_radius': 3, 'combined_morgan_nBits': 1024, 'combined_rdkit_maxPath': 7, 'combined_rdkit_nBits': 1024, 'num_hidden_layers': 3, 'hidden_dim_0': 1024, 'hidden_dim_1': 1024, 'hidden_dim_2': 64, 'kl_weight': 0.00012504565696679927, 'lr': 0.009951555712733772, 'batch_size': 128, 'dropout_rate': 0.09130698608915294, 'prior_mu': 0.026018847384860003, 'prior_sigma': 0.09676296250208194, 'normalization': 'layer'}. Best is trial 896 with value: 0.4533553242683411.
Generating morgan_rdkit fingerprints...
Generated fingerprints with 2048 features for 841 molecules
Trial 2333: 5-fold CV loss = 0.5396
[I 2025-08-08 00:44:25,493] Trial 2333 finished with value: 0.539589387178421 and parameters: {'fp_type': 'morgan_rdkit', 'combined_morgan_radius': 3, 'combined_morgan_nBits': 1024, 'combined_rdkit_maxPath': 7, 'combined_rdkit_nBits': 1024, 'num_hidden_layers': 3, 'hidden_dim_0': 256, 'hidden_dim_1': 1024, 'hidden_dim_2': 256, 'kl_weight': 0.00013099046369088673, 'lr': 0.008282388033180328, 'batch_size': 128, 'dropout_rate': 0.05769254948504418, 'prior_mu': 0.0298092519940733, 'prior_sigma': 0.09748951272808415, 'normalization': 'layer'}. Best is trial 896 with value: 0.4533553242683411.
Generating morgan_rdkit fingerprints...
Generated fingerprints with 2048 features for 841 molecules
Trial 2328: 5-fold CV loss = 0.5216
[I 2025-08-08 00:44:32,687] Trial 2328 finished with value: 0.5216043889522552 and parameters: {'fp_type': 'rdkit', 'rdkit_only_maxPath': 5, 'rdkit_only_nBits': 256, 'num_hidden_layers': 3, 'hidden_dim_0': 256, 'hidden_dim_1': 1024, 'hidden_dim_2': 64, 'kl_weight': 0.00012277555942002353, 'lr': 0.008519771954963664, 'batch_size': 32, 'dropout_rate': 0.074026004745615, 'prior_mu': 0.02220738469808465, 'prior_sigma': 0.09717653190636061, 'normalization': 'layer'}. Best is trial 896 with value: 0.4533553242683411.
Generating morgan_rdkit fingerprints...
Generated fingerprints with 2048 features for 841 molecules
Trial 2334: 5-fold CV loss = 0.4927
[I 2025-08-08 00:44:47,692] Trial 2334 finished with value: 0.4927115797996521 and parameters: {'fp_type': 'morgan_rdkit', 'combined_morgan_radius': 3, 'combined_morgan_nBits': 1024, 'combined_rdkit_maxPath': 7, 'combined_rdkit_nBits': 1024, 'num_hidden_layers': 3, 'hidden_dim_0': 256, 'hidden_dim_1': 1024, 'hidden_dim_2': 256, 'kl_weight': 0.00011747122360945903, 'lr': 0.00836943923995941, 'batch_size': 128, 'dropout_rate': 0.07334426233674474, 'prior_mu': 0.029404149309871133, 'prior_sigma': 0.10776003072167027, 'normalization': 'layer'}. Best is trial 896 with value: 0.4533553242683411.
Generating morgan_rdkit fingerprints...
Generated fingerprints with 2048 features for 841 molecules
Trial 2335: 5-fold CV loss = 0.4579
[I 2025-08-08 00:45:07,431] Trial 2335 finished with value: 0.457915210723877 and parameters: {'fp_type': 'morgan_rdkit', 'combined_morgan_radius': 3, 'combined_morgan_nBits': 1024, 'combined_rdkit_maxPath': 7, 'combined_rdkit_nBits': 1024, 'num_hidden_layers': 3, 'hidden_dim_0': 256, 'hidden_dim_1': 1024, 'hidden_dim_2': 64, 'kl_weight': 0.0001425742702827406, 'lr': 0.008366052245606832, 'batch_size': 128, 'dropout_rate': 0.07962330853313224, 'prior_mu': 0.015727868896427747, 'prior_sigma': 0.10453810933084509, 'normalization': 'layer'}. Best is trial 896 with value: 0.4533553242683411.
Generating morgan_rdkit fingerprints...
Generated fingerprints with 2048 features for 841 molecules
Trial 2336: 5-fold CV loss = 0.5685
[I 2025-08-08 00:45:20,121] Trial 2336 finished with value: 0.5685008406639099 and parameters: {'fp_type': 'morgan_rdkit', 'combined_morgan_radius': 3, 'combined_morgan_nBits': 1024, 'combined_rdkit_maxPath': 7, 'combined_rdkit_nBits': 1024, 'num_hidden_layers': 3, 'hidden_dim_0': 256, 'hidden_dim_1': 1024, 'hidden_dim_2': 64, 'kl_weight': 0.00010839862303400317, 'lr': 0.008237434913078826, 'batch_size': 128, 'dropout_rate': 0.07798246861340466, 'prior_mu': 0.021347931606749176, 'prior_sigma': 0.10589148457737009, 'normalization': 'layer'}. Best is trial 896 with value: 0.4533553242683411.
Generating morgan_rdkit fingerprints...
Generated fingerprints with 2048 features for 841 molecules
Trial 2337: 5-fold CV loss = 0.4635
[I 2025-08-08 00:45:25,860] Trial 2337 finished with value: 0.4635275423526764 and parameters: {'fp_type': 'morgan_rdkit', 'combined_morgan_radius': 3, 'combined_morgan_nBits': 1024, 'combined_rdkit_maxPath': 7, 'combined_rdkit_nBits': 1024, 'num_hidden_layers': 3, 'hidden_dim_0': 256, 'hidden_dim_1': 1024, 'hidden_dim_2': 64, 'kl_weight': 0.00014481483092286548, 'lr': 0.008131136817907378, 'batch_size': 128, 'dropout_rate': 0.0912640316199031, 'prior_mu': 0.018533530736243264, 'prior_sigma': 0.10140316292520453, 'normalization': 'layer'}. Best is trial 896 with value: 0.4533553242683411.
Generating morgan_rdkit fingerprints...
Generated fingerprints with 2048 features for 841 molecules
Trial 2340: 5-fold CV loss = 0.4951
[I 2025-08-08 00:45:49,387] Trial 2340 finished with value: 0.495095819234848 and parameters: {'fp_type': 'morgan_rdkit', 'combined_morgan_radius': 3, 'combined_morgan_nBits': 1024, 'combined_rdkit_maxPath': 5, 'combined_rdkit_nBits': 1024, 'num_hidden_layers': 3, 'hidden_dim_0': 256, 'hidden_dim_1': 1024, 'hidden_dim_2': 64, 'kl_weight': 0.00010478573810189633, 'lr': 0.00998035140711975, 'batch_size': 128, 'dropout_rate': 0.054385193730251385, 'prior_mu': 0.028291830609521326, 'prior_sigma': 0.10830345090377053, 'normalization': 'layer'}. Best is trial 896 with value: 0.4533553242683411.
Generating morgan_rdkit fingerprints...
Generated fingerprints with 2048 features for 841 molecules
Trial 2338: 5-fold CV loss = 0.4661
[I 2025-08-08 00:45:55,566] Trial 2338 finished with value: 0.46609851717948914 and parameters: {'fp_type': 'morgan_rdkit', 'combined_morgan_radius': 3, 'combined_morgan_nBits': 1024, 'combined_rdkit_maxPath': 7, 'combined_rdkit_nBits': 1024, 'num_hidden_layers': 3, 'hidden_dim_0': 256, 'hidden_dim_1': 1024, 'hidden_dim_2': 64, 'kl_weight': 0.00013574064277278237, 'lr': 0.008195228314564, 'batch_size': 128, 'dropout_rate': 0.062242909401818265, 'prior_mu': 0.010097697229816478, 'prior_sigma': 0.10792815188387594, 'normalization': 'layer'}. Best is trial 896 with value: 0.4533553242683411.
Generating morgan_rdkit fingerprints...
Generated fingerprints with 2048 features for 841 molecules
Trial 2339: 5-fold CV loss = 0.4684
[I 2025-08-08 00:46:18,857] Trial 2339 finished with value: 0.4684096992015839 and parameters: {'fp_type': 'morgan_rdkit', 'combined_morgan_radius': 3, 'combined_morgan_nBits': 1024, 'combined_rdkit_maxPath': 7, 'combined_rdkit_nBits': 1024, 'num_hidden_layers': 3, 'hidden_dim_0': 256, 'hidden_dim_1': 1024, 'hidden_dim_2': 64, 'kl_weight': 0.0001215648779674017, 'lr': 0.008999312378467858, 'batch_size': 128, 'dropout_rate': 0.05184488000499912, 'prior_mu': 0.013273764822824363, 'prior_sigma': 0.11148674209061986, 'normalization': 'layer'}. Best is trial 896 with value: 0.4533553242683411.
Generating morgan_rdkit fingerprints...
Generated fingerprints with 1024 features for 841 molecules
Trial 2341: 5-fold CV loss = 0.4732
[I 2025-08-08 00:46:27,168] Trial 2341 finished with value: 0.4732272446155548 and parameters: {'fp_type': 'morgan_rdkit', 'combined_morgan_radius': 3, 'combined_morgan_nBits': 1024, 'combined_rdkit_maxPath': 7, 'combined_rdkit_nBits': 1024, 'num_hidden_layers': 3, 'hidden_dim_0': 256, 'hidden_dim_1': 1024, 'hidden_dim_2': 64, 'kl_weight': 0.00014140420416934203, 'lr': 0.008926146018696467, 'batch_size': 128, 'dropout_rate': 0.06329340772975955, 'prior_mu': 0.0371564758435977, 'prior_sigma': 0.11299142705405987, 'normalization': 'layer'}. Best is trial 896 with value: 0.4533553242683411.
Generating morgan_rdkit fingerprints...
Generated fingerprints with 1024 features for 841 molecules
Trial 2342: 5-fold CV loss = 0.5557
[I 2025-08-08 00:46:38,113] Trial 2342 finished with value: 0.5556558609008789 and parameters: {'fp_type': 'morgan_rdkit', 'combined_morgan_radius': 3, 'combined_morgan_nBits': 1024, 'combined_rdkit_maxPath': 7, 'combined_rdkit_nBits': 1024, 'num_hidden_layers': 3, 'hidden_dim_0': 256, 'hidden_dim_1': 128, 'hidden_dim_2': 64, 'kl_weight': 0.00012286540167611595, 'lr': 0.009183474732815009, 'batch_size': 128, 'dropout_rate': 0.06899840051840825, 'prior_mu': 0.009272365234775681, 'prior_sigma': 0.11168708708637545, 'normalization': 'layer'}. Best is trial 896 with value: 0.4533553242683411.
Generating morgan_rdkit fingerprints...
Generated fingerprints with 1536 features for 841 molecules
Trial 2344: 5-fold CV loss = 0.8885
[I 2025-08-08 00:46:40,935] Trial 2344 finished with value: 0.8884532809257507 and parameters: {'fp_type': 'morgan_rdkit', 'combined_morgan_radius': 3, 'combined_morgan_nBits': 512, 'combined_rdkit_maxPath': 7, 'combined_rdkit_nBits': 512, 'num_hidden_layers': 3, 'hidden_dim_0': 256, 'hidden_dim_1': 1024, 'hidden_dim_2': 512, 'kl_weight': 0.00011500477847379382, 'lr': 0.009226395550581714, 'batch_size': 128, 'dropout_rate': 0.08106782823609146, 'prior_mu': 0.0337206434078683, 'prior_sigma': 0.10981165617850847, 'normalization': 'layer'}. Best is trial 896 with value: 0.4533553242683411.
Generating morgan_rdkit fingerprints...
Generated fingerprints with 2048 features for 841 molecules
Trial 2343: 5-fold CV loss = 0.8893
[I 2025-08-08 00:46:42,262] Trial 2343 finished with value: 0.8892932057380676 and parameters: {'fp_type': 'morgan_rdkit', 'combined_morgan_radius': 3, 'combined_morgan_nBits': 512, 'combined_rdkit_maxPath': 7, 'combined_rdkit_nBits': 512, 'num_hidden_layers': 3, 'hidden_dim_0': 256, 'hidden_dim_1': 1024, 'hidden_dim_2': 512, 'kl_weight': 0.00010566290804293348, 'lr': 0.009166424948402566, 'batch_size': 128, 'dropout_rate': 0.07054119009568682, 'prior_mu': 0.030041029210863705, 'prior_sigma': 0.10471989941512717, 'normalization': 'layer'}. Best is trial 896 with value: 0.4533553242683411.
Generating morgan_rdkit fingerprints...
Generated fingerprints with 2048 features for 841 molecules
Trial 2330: 5-fold CV loss = 0.5245
[I 2025-08-08 00:46:43,722] Trial 2330 finished with value: 0.5245360851287841 and parameters: {'fp_type': 'rdkit', 'rdkit_only_maxPath': 5, 'rdkit_only_nBits': 256, 'num_hidden_layers': 3, 'hidden_dim_0': 1024, 'hidden_dim_1': 1024, 'hidden_dim_2': 64, 'kl_weight': 0.00011021764679630481, 'lr': 0.008316214482647685, 'batch_size': 32, 'dropout_rate': 0.07965666615021065, 'prior_mu': 0.020611298909050866, 'prior_sigma': 0.10526204195999184, 'normalization': 'layer'}. Best is trial 896 with value: 0.4533553242683411.
Generating morgan_rdkit fingerprints...
Generated fingerprints with 2048 features for 841 molecules
Trial 2346: 5-fold CV loss = 0.5330
[I 2025-08-08 00:47:15,785] Trial 2346 finished with value: 0.5329765677452087 and parameters: {'fp_type': 'morgan_rdkit', 'combined_morgan_radius': 3, 'combined_morgan_nBits': 1024, 'combined_rdkit_maxPath': 7, 'combined_rdkit_nBits': 1024, 'num_hidden_layers': 3, 'hidden_dim_0': 256, 'hidden_dim_1': 256, 'hidden_dim_2': 64, 'kl_weight': 0.00011087337246730153, 'lr': 0.008205383590109708, 'batch_size': 128, 'dropout_rate': 0.07580657402107818, 'prior_mu': 0.035981159404694936, 'prior_sigma': 0.10357112804275216, 'normalization': 'layer'}. Best is trial 896 with value: 0.4533553242683411.
Generating morgan fingerprints...
Generated fingerprints with 2048 features for 841 molecules
Trial 2345: 5-fold CV loss = 0.4855
[I 2025-08-08 00:47:28,097] Trial 2345 finished with value: 0.48551505208015444 and parameters: {'fp_type': 'morgan_rdkit', 'combined_morgan_radius': 3, 'combined_morgan_nBits': 1024, 'combined_rdkit_maxPath': 7, 'combined_rdkit_nBits': 512, 'num_hidden_layers': 3, 'hidden_dim_0': 256, 'hidden_dim_1': 1024, 'hidden_dim_2': 64, 'kl_weight': 0.00014392668935881185, 'lr': 0.008125214439532399, 'batch_size': 64, 'dropout_rate': 0.0784467375057033, 'prior_mu': 0.01659904428513323, 'prior_sigma': 0.10460276598826937, 'normalization': 'layer'}. Best is trial 896 with value: 0.4533553242683411.
Generating morgan fingerprints...
Generated fingerprints with 2048 features for 841 molecules
Trial 2349: 5-fold CV loss = 0.5271
[I 2025-08-08 00:47:44,066] Trial 2349 finished with value: 0.5271154105663299 and parameters: {'fp_type': 'morgan', 'morgan_only_radius': 3, 'morgan_only_nBits': 2048, 'num_hidden_layers': 3, 'hidden_dim_0': 256, 'hidden_dim_1': 512, 'hidden_dim_2': 64, 'kl_weight': 0.00013631947102364466, 'lr': 0.008226517745593225, 'batch_size': 64, 'dropout_rate': 0.0875514178909478, 'prior_mu': 0.018726595566016406, 'prior_sigma': 0.10941836704875665, 'normalization': 'layer'}. Best is trial 896 with value: 0.4533553242683411.
Generating morgan_rdkit fingerprints...
Generated fingerprints with 1280 features for 841 molecules
Trial 2350: 5-fold CV loss = 0.5217
[I 2025-08-08 00:47:51,989] Trial 2350 finished with value: 0.5216798186302185 and parameters: {'fp_type': 'morgan', 'morgan_only_radius': 3, 'morgan_only_nBits': 2048, 'num_hidden_layers': 3, 'hidden_dim_0': 64, 'hidden_dim_1': 512, 'hidden_dim_2': 64, 'kl_weight': 0.00014315514326325215, 'lr': 0.009198385233439877, 'batch_size': 128, 'dropout_rate': 0.09030213179852868, 'prior_mu': 0.0204768413670832, 'prior_sigma': 0.10125367082185854, 'normalization': 'layer'}. Best is trial 896 with value: 0.4533553242683411.
Generating morgan_rdkit fingerprints...
Generated fingerprints with 2048 features for 841 molecules
Trial 2347: 5-fold CV loss = 0.4634
[I 2025-08-08 00:47:58,845] Trial 2347 finished with value: 0.46335781216621397 and parameters: {'fp_type': 'morgan_rdkit', 'combined_morgan_radius': 3, 'combined_morgan_nBits': 1024, 'combined_rdkit_maxPath': 7, 'combined_rdkit_nBits': 1024, 'num_hidden_layers': 3, 'hidden_dim_0': 256, 'hidden_dim_1': 256, 'hidden_dim_2': 64, 'kl_weight': 0.00013921456666295012, 'lr': 0.007890532984535951, 'batch_size': 64, 'dropout_rate': 0.07773776489409305, 'prior_mu': 0.025153017723679307, 'prior_sigma': 0.10455481136111992, 'normalization': 'layer'}. Best is trial 896 with value: 0.4533553242683411.
Generating morgan_rdkit fingerprints...
Generated fingerprints with 1280 features for 841 molecules
Trial 2351: 5-fold CV loss = 0.7328
[I 2025-08-08 00:48:03,307] Trial 2351 finished with value: 0.7328024744987488 and parameters: {'fp_type': 'morgan_rdkit', 'combined_morgan_radius': 3, 'combined_morgan_nBits': 1024, 'combined_rdkit_maxPath': 7, 'combined_rdkit_nBits': 256, 'num_hidden_layers': 3, 'hidden_dim_0': 256, 'hidden_dim_1': 1024, 'hidden_dim_2': 64, 'kl_weight': 0.0001476863530797373, 'lr': 0.00902795728694409, 'batch_size': 128, 'dropout_rate': 0.09157008554630133, 'prior_mu': 0.020743226573451415, 'prior_sigma': 0.10844266604484959, 'normalization': 'layer'}. Best is trial 896 with value: 0.4533553242683411.
Generating morgan_rdkit fingerprints...
Generated fingerprints with 2048 features for 841 molecules
Trial 2348: 5-fold CV loss = 0.4749
[I 2025-08-08 00:48:24,214] Trial 2348 finished with value: 0.47494771480560305 and parameters: {'fp_type': 'morgan_rdkit', 'combined_morgan_radius': 3, 'combined_morgan_nBits': 1024, 'combined_rdkit_maxPath': 7, 'combined_rdkit_nBits': 1024, 'num_hidden_layers': 3, 'hidden_dim_0': 64, 'hidden_dim_1': 256, 'hidden_dim_2': 64, 'kl_weight': 0.00013892321219577245, 'lr': 0.008014684551724174, 'batch_size': 128, 'dropout_rate': 0.08940051454911536, 'prior_mu': 0.0156664103850613, 'prior_sigma': 0.10465715588509811, 'normalization': 'layer'}. Best is trial 896 with value: 0.4533553242683411.
Generating morgan_rdkit fingerprints...
Generated fingerprints with 2048 features for 841 molecules
Trial 2352: 5-fold CV loss = 0.5476
[I 2025-08-08 00:48:32,041] Trial 2352 finished with value: 0.5476152300834656 and parameters: {'fp_type': 'morgan_rdkit', 'combined_morgan_radius': 3, 'combined_morgan_nBits': 1024, 'combined_rdkit_maxPath': 7, 'combined_rdkit_nBits': 1024, 'num_hidden_layers': 3, 'hidden_dim_0': 256, 'hidden_dim_1': 1024, 'hidden_dim_2': 64, 'kl_weight': 0.00016440344761805328, 'lr': 0.008080839748082819, 'batch_size': 128, 'dropout_rate': 0.09166175688007543, 'prior_mu': 0.021172227761043872, 'prior_sigma': 0.10661159745499442, 'normalization': 'layer'}. Best is trial 896 with value: 0.4533553242683411.
Generating morgan_rdkit fingerprints...
Generated fingerprints with 2048 features for 841 molecules
Trial 2356: 5-fold CV loss = 1.4687
[I 2025-08-08 00:48:40,403] Trial 2356 finished with value: 1.4687102079391479 and parameters: {'fp_type': 'morgan_rdkit', 'combined_morgan_radius': 2, 'combined_morgan_nBits': 1024, 'combined_rdkit_maxPath': 7, 'combined_rdkit_nBits': 1024, 'num_hidden_layers': 0, 'kl_weight': 0.00012339792104424288, 'lr': 0.009258003162997932, 'batch_size': 128, 'dropout_rate': 0.06668016249421872, 'prior_mu': 0.015045266035140769, 'prior_sigma': 0.11392807705425143, 'normalization': 'layer'}. Best is trial 896 with value: 0.4533553242683411.
Generating morgan_rdkit fingerprints...
Generated fingerprints with 2048 features for 841 molecules
Trial 2354: 5-fold CV loss = 0.4674
[I 2025-08-08 00:48:45,981] Trial 2354 finished with value: 0.4673966825008392 and parameters: {'fp_type': 'morgan_rdkit', 'combined_morgan_radius': 3, 'combined_morgan_nBits': 1024, 'combined_rdkit_maxPath': 7, 'combined_rdkit_nBits': 1024, 'num_hidden_layers': 3, 'hidden_dim_0': 256, 'hidden_dim_1': 1024, 'hidden_dim_2': 64, 'kl_weight': 0.00010122954536047788, 'lr': 0.00813340451163235, 'batch_size': 128, 'dropout_rate': 0.06224122369848388, 'prior_mu': 0.02415324576556359, 'prior_sigma': 0.11140988278489306, 'normalization': 'layer'}. Best is trial 896 with value: 0.4533553242683411.
Generating morgan_rdkit fingerprints...
Generated fingerprints with 2048 features for 841 molecules
Trial 2353: 5-fold CV loss = 0.5957
