[I 2025-08-07 22:15:29,480] Trial 1576 finished with value: 0.5812250792980194 and parameters: {'fp_type': 'morgan_rdkit', 'combined_morgan_radius': 3, 'combined_morgan_nBits': 1024, 'combined_rdkit_maxPath': 7, 'combined_rdkit_nBits': 256, 'num_hidden_layers': 3, 'hidden_dim_0': 1024, 'hidden_dim_1': 1024, 'hidden_dim_2': 64, 'kl_weight': 0.0004137395487383719, 'lr': 0.004582374144038663, 'batch_size': 128, 'dropout_rate': 0.057309149864733525, 'prior_mu': -0.014149240386044024, 'prior_sigma': 0.09843039065409988, 'normalization': 'layer'}. Best is trial 896 with value: 0.4533553242683411.
Generating morgan_rdkit fingerprints...
Generated fingerprints with 2048 features for 841 molecules
Trial 1574: 5-fold CV loss = 0.4686
[I 2025-08-07 22:15:37,015] Trial 1574 finished with value: 0.46858190298080443 and parameters: {'fp_type': 'morgan_rdkit', 'combined_morgan_radius': 3, 'combined_morgan_nBits': 1024, 'combined_rdkit_maxPath': 7, 'combined_rdkit_nBits': 1024, 'num_hidden_layers': 3, 'hidden_dim_0': 256, 'hidden_dim_1': 1024, 'hidden_dim_2': 64, 'kl_weight': 0.0002396422953122649, 'lr': 0.0062772592217502305, 'batch_size': 128, 'dropout_rate': 0.10254162600158354, 'prior_mu': -0.02995689177577006, 'prior_sigma': 0.0979751765276918, 'normalization': 'layer'}. Best is trial 896 with value: 0.4533553242683411.
Generating morgan_rdkit fingerprints...
Generated fingerprints with 2048 features for 841 molecules
Trial 1577: 5-fold CV loss = 0.5590
[I 2025-08-07 22:15:47,148] Trial 1577 finished with value: 0.5589956700801849 and parameters: {'fp_type': 'morgan_rdkit', 'combined_morgan_radius': 3, 'combined_morgan_nBits': 1024, 'combined_rdkit_maxPath': 7, 'combined_rdkit_nBits': 256, 'num_hidden_layers': 1, 'hidden_dim_0': 1024, 'kl_weight': 0.0002714611183311334, 'lr': 0.007710908986627616, 'batch_size': 128, 'dropout_rate': 0.143758140600356, 'prior_mu': -0.01582422069481767, 'prior_sigma': 0.09865999925813396, 'normalization': 'layer'}. Best is trial 896 with value: 0.4533553242683411.
Generating morgan fingerprints...
Generated fingerprints with 2048 features for 841 molecules
Trial 1578: 5-fold CV loss = 0.5117
[I 2025-08-07 22:15:55,762] Trial 1578 finished with value: 0.5116603136062622 and parameters: {'fp_type': 'morgan_rdkit', 'combined_morgan_radius': 3, 'combined_morgan_nBits': 1024, 'combined_rdkit_maxPath': 7, 'combined_rdkit_nBits': 256, 'num_hidden_layers': 3, 'hidden_dim_0': 1024, 'hidden_dim_1': 1024, 'hidden_dim_2': 64, 'kl_weight': 0.00040835109650255345, 'lr': 0.007751172747830388, 'batch_size': 128, 'dropout_rate': 0.05572016409539132, 'prior_mu': -0.013145079237292238, 'prior_sigma': 0.09907745528126484, 'normalization': 'layer'}. Best is trial 896 with value: 0.4533553242683411.
Generating morgan fingerprints...
Generated fingerprints with 2048 features for 841 molecules
Trial 1579: 5-fold CV loss = 0.4643
[I 2025-08-07 22:16:11,778] Trial 1579 finished with value: 0.46430124044418336 and parameters: {'fp_type': 'morgan_rdkit', 'combined_morgan_radius': 3, 'combined_morgan_nBits': 1024, 'combined_rdkit_maxPath': 7, 'combined_rdkit_nBits': 1024, 'num_hidden_layers': 3, 'hidden_dim_0': 256, 'hidden_dim_1': 1024, 'hidden_dim_2': 64, 'kl_weight': 0.00027769295831815867, 'lr': 0.007760753131366508, 'batch_size': 128, 'dropout_rate': 0.14598758420947489, 'prior_mu': 0.01973342090572905, 'prior_sigma': 0.07739073683286042, 'normalization': 'layer'}. Best is trial 896 with value: 0.4533553242683411.
Generating morgan fingerprints...
Generated fingerprints with 2048 features for 841 molecules
Trial 1580: 5-fold CV loss = 0.5055
[I 2025-08-07 22:16:13,058] Trial 1580 finished with value: 0.5055359363555908 and parameters: {'fp_type': 'morgan_rdkit', 'combined_morgan_radius': 3, 'combined_morgan_nBits': 1024, 'combined_rdkit_maxPath': 6, 'combined_rdkit_nBits': 1024, 'num_hidden_layers': 1, 'hidden_dim_0': 512, 'kl_weight': 0.00027656621089200455, 'lr': 0.00780590781829654, 'batch_size': 128, 'dropout_rate': 0.1449021695701991, 'prior_mu': -0.040431214839152796, 'prior_sigma': 0.07756700731026739, 'normalization': 'layer'}. Best is trial 896 with value: 0.4533553242683411.
Generating morgan fingerprints...
Generated fingerprints with 2048 features for 841 molecules
Trial 1582: 5-fold CV loss = 0.5267
[I 2025-08-07 22:16:16,544] Trial 1582 finished with value: 0.526729267835617 and parameters: {'fp_type': 'morgan', 'morgan_only_radius': 3, 'morgan_only_nBits': 2048, 'num_hidden_layers': 3, 'hidden_dim_0': 512, 'hidden_dim_1': 1024, 'hidden_dim_2': 64, 'kl_weight': 0.00032732346391617866, 'lr': 0.005353935999797448, 'batch_size': 128, 'dropout_rate': 0.12615796014763728, 'prior_mu': -0.03678358035550304, 'prior_sigma': 0.07017423914842354, 'normalization': 'layer'}. Best is trial 896 with value: 0.4533553242683411.
Generating morgan_rdkit fingerprints...
Generated fingerprints with 2048 features for 841 molecules
Trial 1581: 5-fold CV loss = 0.5348
[I 2025-08-07 22:16:29,799] Trial 1581 finished with value: 0.5347525000572204 and parameters: {'fp_type': 'morgan', 'morgan_only_radius': 3, 'morgan_only_nBits': 2048, 'num_hidden_layers': 3, 'hidden_dim_0': 512, 'hidden_dim_1': 1024, 'hidden_dim_2': 64, 'kl_weight': 0.0003247651034580894, 'lr': 0.005417308044890217, 'batch_size': 128, 'dropout_rate': 0.12936232982365392, 'prior_mu': -0.0398465566369752, 'prior_sigma': 0.07764119110864355, 'normalization': 'layer'}. Best is trial 896 with value: 0.4533553242683411.
Generating morgan_rdkit fingerprints...
Generated fingerprints with 2048 features for 841 molecules
Trial 1585: 5-fold CV loss = 0.8807
[I 2025-08-07 22:16:31,316] Trial 1585 finished with value: 0.8807318449020386 and parameters: {'fp_type': 'morgan_rdkit', 'combined_morgan_radius': 3, 'combined_morgan_nBits': 1024, 'combined_rdkit_maxPath': 7, 'combined_rdkit_nBits': 1024, 'num_hidden_layers': 0, 'kl_weight': 0.00032825083945326697, 'lr': 0.0066086478517867414, 'batch_size': 64, 'dropout_rate': 0.1128936192440067, 'prior_mu': -0.05096729800735599, 'prior_sigma': 0.060017969325500756, 'normalization': 'layer'}. Best is trial 896 with value: 0.4533553242683411.
Generating morgan_rdkit fingerprints...
Generated fingerprints with 2048 features for 841 molecules
Trial 1583: 5-fold CV loss = 0.5241
[I 2025-08-07 22:16:34,784] Trial 1583 finished with value: 0.5240814924240113 and parameters: {'fp_type': 'morgan', 'morgan_only_radius': 3, 'morgan_only_nBits': 2048, 'num_hidden_layers': 3, 'hidden_dim_0': 512, 'hidden_dim_1': 1024, 'hidden_dim_2': 64, 'kl_weight': 0.0003276524145241901, 'lr': 0.006506325648310493, 'batch_size': 128, 'dropout_rate': 0.12120116753299574, 'prior_mu': -0.0397872625130839, 'prior_sigma': 0.07008877584354076, 'normalization': 'layer'}. Best is trial 896 with value: 0.4533553242683411.
Generating morgan_rdkit fingerprints...
Generated fingerprints with 2048 features for 841 molecules
Trial 1584: 5-fold CV loss = 0.5179
[I 2025-08-07 22:16:55,307] Trial 1584 finished with value: 0.517909026145935 and parameters: {'fp_type': 'morgan', 'morgan_only_radius': 3, 'morgan_only_nBits': 2048, 'num_hidden_layers': 3, 'hidden_dim_0': 256, 'hidden_dim_1': 1024, 'hidden_dim_2': 64, 'kl_weight': 0.00033739644514943154, 'lr': 0.005386494415306186, 'batch_size': 64, 'dropout_rate': 0.12568638070010701, 'prior_mu': -0.02244588481363293, 'prior_sigma': 0.060571675711527155, 'normalization': 'layer'}. Best is trial 896 with value: 0.4533553242683411.
Generating morgan_rdkit fingerprints...
Generated fingerprints with 2048 features for 841 molecules
Trial 1587: 5-fold CV loss = 0.5534
[I 2025-08-07 22:17:03,465] Trial 1587 finished with value: 0.5533774316310882 and parameters: {'fp_type': 'morgan_rdkit', 'combined_morgan_radius': 3, 'combined_morgan_nBits': 1024, 'combined_rdkit_maxPath': 7, 'combined_rdkit_nBits': 1024, 'num_hidden_layers': 3, 'hidden_dim_0': 256, 'hidden_dim_1': 1024, 'hidden_dim_2': 64, 'kl_weight': 0.0006537481141446409, 'lr': 0.006617098533554154, 'batch_size': 128, 'dropout_rate': 0.16584567929196947, 'prior_mu': -0.021587227248357762, 'prior_sigma': 0.08482795293540933, 'normalization': 'layer'}. Best is trial 896 with value: 0.4533553242683411.
Generating morgan_rdkit fingerprints...
Generated fingerprints with 2048 features for 841 molecules
Trial 1588: 5-fold CV loss = 0.4679
[I 2025-08-07 22:17:12,772] Trial 1588 finished with value: 0.4678641378879547 and parameters: {'fp_type': 'morgan_rdkit', 'combined_morgan_radius': 3, 'combined_morgan_nBits': 1024, 'combined_rdkit_maxPath': 7, 'combined_rdkit_nBits': 1024, 'num_hidden_layers': 3, 'hidden_dim_0': 256, 'hidden_dim_1': 1024, 'hidden_dim_2': 64, 'kl_weight': 0.0004826953042087596, 'lr': 0.007130113447628828, 'batch_size': 128, 'dropout_rate': 0.09108793889858827, 'prior_mu': -0.02293525992845671, 'prior_sigma': 0.08192214757467932, 'normalization': 'layer'}. Best is trial 896 with value: 0.4533553242683411.
Generating morgan_rdkit fingerprints...
Generated fingerprints with 2048 features for 841 molecules
Trial 1590: 5-fold CV loss = 0.4618
[I 2025-08-07 22:17:38,852] Trial 1590 finished with value: 0.4618090271949768 and parameters: {'fp_type': 'morgan_rdkit', 'combined_morgan_radius': 3, 'combined_morgan_nBits': 1024, 'combined_rdkit_maxPath': 7, 'combined_rdkit_nBits': 1024, 'num_hidden_layers': 3, 'hidden_dim_0': 256, 'hidden_dim_1': 1024, 'hidden_dim_2': 64, 'kl_weight': 0.00039753517725184365, 'lr': 0.0070435850300937, 'batch_size': 128, 'dropout_rate': 0.09327166791910932, 'prior_mu': -0.07327968962194935, 'prior_sigma': 0.08191805706873405, 'normalization': 'layer'}. Best is trial 896 with value: 0.4533553242683411.
Generating morgan_rdkit fingerprints...
Generated fingerprints with 2048 features for 841 molecules
Trial 1589: 5-fold CV loss = 0.4656
[I 2025-08-07 22:17:50,399] Trial 1589 finished with value: 0.46557414531707764 and parameters: {'fp_type': 'morgan_rdkit', 'combined_morgan_radius': 3, 'combined_morgan_nBits': 1024, 'combined_rdkit_maxPath': 7, 'combined_rdkit_nBits': 1024, 'num_hidden_layers': 3, 'hidden_dim_0': 256, 'hidden_dim_1': 1024, 'hidden_dim_2': 64, 'kl_weight': 0.00022758028185207191, 'lr': 0.0071347645834529535, 'batch_size': 128, 'dropout_rate': 0.16950582634212455, 'prior_mu': -0.02364556530007291, 'prior_sigma': 0.08378786971419912, 'normalization': 'layer'}. Best is trial 896 with value: 0.4533553242683411.
Generating morgan_rdkit fingerprints...
Generated fingerprints with 2048 features for 841 molecules
Trial 1592: 5-fold CV loss = 0.8668
[I 2025-08-07 22:17:54,047] Trial 1592 finished with value: 0.866786789894104 and parameters: {'fp_type': 'morgan_rdkit', 'combined_morgan_radius': 3, 'combined_morgan_nBits': 1024, 'combined_rdkit_maxPath': 7, 'combined_rdkit_nBits': 1024, 'num_hidden_layers': 3, 'hidden_dim_0': 256, 'hidden_dim_1': 1024, 'hidden_dim_2': 256, 'kl_weight': 0.00022196186954528483, 'lr': 0.00041947512303076574, 'batch_size': 128, 'dropout_rate': 0.07077182592146995, 'prior_mu': -0.00022911591520206193, 'prior_sigma': 0.08693430688909107, 'normalization': 'layer'}. Best is trial 896 with value: 0.4533553242683411.
Generating morgan_rdkit fingerprints...
Generated fingerprints with 2048 features for 841 molecules
Trial 1591: 5-fold CV loss = 0.4682
[I 2025-08-07 22:17:58,844] Trial 1591 finished with value: 0.4681972086429596 and parameters: {'fp_type': 'morgan_rdkit', 'combined_morgan_radius': 3, 'combined_morgan_nBits': 1024, 'combined_rdkit_maxPath': 7, 'combined_rdkit_nBits': 1024, 'num_hidden_layers': 3, 'hidden_dim_0': 256, 'hidden_dim_1': 1024, 'hidden_dim_2': 64, 'kl_weight': 0.0002259214930739899, 'lr': 0.005846856783649929, 'batch_size': 128, 'dropout_rate': 0.07288798001581939, 'prior_mu': -0.00076473881828952, 'prior_sigma': 0.08753177564898196, 'normalization': 'layer'}. Best is trial 896 with value: 0.4533553242683411.
Generating morgan_rdkit fingerprints...
Generated fingerprints with 2048 features for 841 molecules
Trial 1594: 5-fold CV loss = 0.4700
[I 2025-08-07 22:18:26,326] Trial 1594 finished with value: 0.46999427676200867 and parameters: {'fp_type': 'morgan_rdkit', 'combined_morgan_radius': 3, 'combined_morgan_nBits': 1024, 'combined_rdkit_maxPath': 7, 'combined_rdkit_nBits': 1024, 'num_hidden_layers': 3, 'hidden_dim_0': 256, 'hidden_dim_1': 1024, 'hidden_dim_2': 64, 'kl_weight': 0.0005528754390783744, 'lr': 0.0059197634585381334, 'batch_size': 128, 'dropout_rate': 0.13764052354068593, 'prior_mu': -0.009604929621319884, 'prior_sigma': 0.07010437153662297, 'normalization': 'layer'}. Best is trial 896 with value: 0.4533553242683411.
Generating morgan_rdkit fingerprints...
Generated fingerprints with 2048 features for 841 molecules
Trial 1586: 5-fold CV loss = 0.4700
[I 2025-08-07 22:18:34,344] Trial 1586 finished with value: 0.4699685096740723 and parameters: {'fp_type': 'morgan_rdkit', 'combined_morgan_radius': 3, 'combined_morgan_nBits': 1024, 'combined_rdkit_maxPath': 7, 'combined_rdkit_nBits': 1024, 'num_hidden_layers': 3, 'hidden_dim_0': 256, 'hidden_dim_1': 1024, 'hidden_dim_2': 64, 'kl_weight': 0.00036189405517918514, 'lr': 0.0066080554647286365, 'batch_size': 64, 'dropout_rate': 0.08821715734368872, 'prior_mu': -0.025195526027181954, 'prior_sigma': 0.084154620898661, 'normalization': 'layer'}. Best is trial 896 with value: 0.4533553242683411.
Generating morgan_rdkit fingerprints...
Generated fingerprints with 2048 features for 841 molecules
Trial 1595: 5-fold CV loss = 0.5520
[I 2025-08-07 22:18:37,928] Trial 1595 finished with value: 0.551985788345337 and parameters: {'fp_type': 'morgan_rdkit', 'combined_morgan_radius': 3, 'combined_morgan_nBits': 1024, 'combined_rdkit_maxPath': 7, 'combined_rdkit_nBits': 1024, 'num_hidden_layers': 3, 'hidden_dim_0': 128, 'hidden_dim_1': 1024, 'hidden_dim_2': 64, 'kl_weight': 0.0003774325972957559, 'lr': 0.006054471170409023, 'batch_size': 128, 'dropout_rate': 0.1399746557475006, 'prior_mu': 0.012791745328888571, 'prior_sigma': 0.07136930357537301, 'normalization': 'none'}. Best is trial 896 with value: 0.4533553242683411.
Generating morgan_rdkit fingerprints...
Generated fingerprints with 2048 features for 841 molecules
Trial 1596: 5-fold CV loss = 0.6576
[I 2025-08-07 22:18:43,486] Trial 1596 finished with value: 0.6575559854507447 and parameters: {'fp_type': 'morgan_rdkit', 'combined_morgan_radius': 3, 'combined_morgan_nBits': 1024, 'combined_rdkit_maxPath': 7, 'combined_rdkit_nBits': 1024, 'num_hidden_layers': 3, 'hidden_dim_0': 128, 'hidden_dim_1': 1024, 'hidden_dim_2': 64, 'kl_weight': 0.0003915825018777857, 'lr': 0.0010511578095142517, 'batch_size': 128, 'dropout_rate': 0.08636028190901482, 'prior_mu': 0.013064123795155251, 'prior_sigma': 0.0647060209425507, 'normalization': 'none'}. Best is trial 896 with value: 0.4533553242683411.
Generating morgan_rdkit fingerprints...
Generated fingerprints with 2048 features for 841 molecules
Trial 1593: 5-fold CV loss = 0.5639
[I 2025-08-07 22:18:53,867] Trial 1593 finished with value: 0.5639393627643585 and parameters: {'fp_type': 'morgan_rdkit', 'combined_morgan_radius': 3, 'combined_morgan_nBits': 1024, 'combined_rdkit_maxPath': 7, 'combined_rdkit_nBits': 1024, 'num_hidden_layers': 3, 'hidden_dim_0': 256, 'hidden_dim_1': 1024, 'hidden_dim_2': 256, 'kl_weight': 0.0005237105856453591, 'lr': 0.006205424808993286, 'batch_size': 128, 'dropout_rate': 0.13805118356839705, 'prior_mu': -0.008834272241408972, 'prior_sigma': 0.08820338835348385, 'normalization': 'layer'}. Best is trial 896 with value: 0.4533553242683411.
Generating morgan_rdkit fingerprints...
Generated fingerprints with 2048 features for 841 molecules
Trial 1599: 5-fold CV loss = 0.4820
[I 2025-08-07 22:19:10,995] Trial 1599 finished with value: 0.4820341825485229 and parameters: {'fp_type': 'morgan_rdkit', 'combined_morgan_radius': 3, 'combined_morgan_nBits': 1024, 'combined_rdkit_maxPath': 5, 'combined_rdkit_nBits': 1024, 'num_hidden_layers': 3, 'hidden_dim_0': 256, 'hidden_dim_1': 1024, 'hidden_dim_2': 64, 'kl_weight': 0.0002655754552573341, 'lr': 0.004866062917489866, 'batch_size': 128, 'dropout_rate': 0.15793855901011492, 'prior_mu': -0.03132098756186867, 'prior_sigma': 0.07592604315737177, 'normalization': 'layer'}. Best is trial 896 with value: 0.4533553242683411.
Generating morgan_rdkit fingerprints...
Generated fingerprints with 2048 features for 841 molecules
Trial 1598: 5-fold CV loss = 0.4643
[I 2025-08-07 22:19:22,623] Trial 1598 finished with value: 0.46430681347846986 and parameters: {'fp_type': 'morgan_rdkit', 'combined_morgan_radius': 3, 'combined_morgan_nBits': 1024, 'combined_rdkit_maxPath': 7, 'combined_rdkit_nBits': 1024, 'num_hidden_layers': 3, 'hidden_dim_0': 256, 'hidden_dim_1': 1024, 'hidden_dim_2': 64, 'kl_weight': 0.00027870544005402357, 'lr': 0.00487741537817098, 'batch_size': 128, 'dropout_rate': 0.15969437383438403, 'prior_mu': -0.03316365954925829, 'prior_sigma': 0.07596142791460166, 'normalization': 'layer'}. Best is trial 896 with value: 0.4533553242683411.
Generating morgan_rdkit fingerprints...
Generated fingerprints with 2048 features for 841 molecules
Trial 1600: 5-fold CV loss = 0.4905
[I 2025-08-07 22:19:30,148] Trial 1600 finished with value: 0.4904503464698792 and parameters: {'fp_type': 'morgan_rdkit', 'combined_morgan_radius': 3, 'combined_morgan_nBits': 1024, 'combined_rdkit_maxPath': 5, 'combined_rdkit_nBits': 1024, 'num_hidden_layers': 3, 'hidden_dim_0': 256, 'hidden_dim_1': 1024, 'hidden_dim_2': 64, 'kl_weight': 0.0003001698051764532, 'lr': 0.0049001120804084515, 'batch_size': 128, 'dropout_rate': 0.1598274315074191, 'prior_mu': -0.033361361403075954, 'prior_sigma': 0.07543973046092106, 'normalization': 'layer'}. Best is trial 896 with value: 0.4533553242683411.
Generating morgan_rdkit fingerprints...
Generated fingerprints with 2048 features for 841 molecules
Trial 1597: 5-fold CV loss = 0.5828
[I 2025-08-07 22:19:36,110] Trial 1597 finished with value: 0.5828448951244354 and parameters: {'fp_type': 'morgan_rdkit', 'combined_morgan_radius': 3, 'combined_morgan_nBits': 1024, 'combined_rdkit_maxPath': 5, 'combined_rdkit_nBits': 1024, 'num_hidden_layers': 3, 'hidden_dim_0': 256, 'hidden_dim_1': 1024, 'hidden_dim_2': 64, 'kl_weight': 0.0002769605733697982, 'lr': 0.004720863688549038, 'batch_size': 128, 'dropout_rate': 0.11001464670193398, 'prior_mu': -0.03329491094850393, 'prior_sigma': 0.09167797823706167, 'normalization': 'none'}. Best is trial 896 with value: 0.4533553242683411.
Generating morgan_rdkit fingerprints...
Generated fingerprints with 2048 features for 841 molecules
Trial 1601: 5-fold CV loss = 0.5573
[I 2025-08-07 22:19:46,227] Trial 1601 finished with value: 0.5573294520378113 and parameters: {'fp_type': 'morgan_rdkit', 'combined_morgan_radius': 3, 'combined_morgan_nBits': 1024, 'combined_rdkit_maxPath': 7, 'combined_rdkit_nBits': 1024, 'num_hidden_layers': 3, 'hidden_dim_0': 256, 'hidden_dim_1': 1024, 'hidden_dim_2': 64, 'kl_weight': 0.00029194325997272447, 'lr': 0.0081347147073697, 'batch_size': 128, 'dropout_rate': 0.11311805870691712, 'prior_mu': -0.04770833023406848, 'prior_sigma': 0.09436941999250933, 'normalization': 'layer'}. Best is trial 896 with value: 0.4533553242683411.
Generating morgan_rdkit fingerprints...
Generated fingerprints with 2048 features for 841 molecules
Trial 1602: 5-fold CV loss = 0.4587
[I 2025-08-07 22:20:08,874] Trial 1602 finished with value: 0.4586935222148895 and parameters: {'fp_type': 'morgan_rdkit', 'combined_morgan_radius': 3, 'combined_morgan_nBits': 1024, 'combined_rdkit_maxPath': 7, 'combined_rdkit_nBits': 1024, 'num_hidden_layers': 3, 'hidden_dim_0': 256, 'hidden_dim_1': 1024, 'hidden_dim_2': 64, 'kl_weight': 0.0004375172021980746, 'lr': 0.007839537261023996, 'batch_size': 128, 'dropout_rate': 0.10990431408759951, 'prior_mu': -0.046436642740925856, 'prior_sigma': 0.09226802896473162, 'normalization': 'layer'}. Best is trial 896 with value: 0.4533553242683411.
Generating morgan_rdkit fingerprints...
Generated fingerprints with 2048 features for 841 molecules
Trial 1603: 5-fold CV loss = 0.5500
[I 2025-08-07 22:20:12,497] Trial 1603 finished with value: 0.5499625384807587 and parameters: {'fp_type': 'morgan_rdkit', 'combined_morgan_radius': 3, 'combined_morgan_nBits': 1024, 'combined_rdkit_maxPath': 7, 'combined_rdkit_nBits': 1024, 'num_hidden_layers': 3, 'hidden_dim_0': 256, 'hidden_dim_1': 1024, 'hidden_dim_2': 64, 'kl_weight': 0.00045163130635823, 'lr': 0.00807122233902103, 'batch_size': 128, 'dropout_rate': 0.11681011575282182, 'prior_mu': -0.048921078119264765, 'prior_sigma': 0.09594656877585243, 'normalization': 'layer'}. Best is trial 896 with value: 0.4533553242683411.
Generating morgan_rdkit fingerprints...
Generated fingerprints with 2048 features for 841 molecules
Trial 1605: 5-fold CV loss = 0.4641
[I 2025-08-07 22:20:26,013] Trial 1605 finished with value: 0.4641151249408722 and parameters: {'fp_type': 'morgan_rdkit', 'combined_morgan_radius': 3, 'combined_morgan_nBits': 1024, 'combined_rdkit_maxPath': 7, 'combined_rdkit_nBits': 1024, 'num_hidden_layers': 3, 'hidden_dim_0': 256, 'hidden_dim_1': 1024, 'hidden_dim_2': 64, 'kl_weight': 0.0004602275587715212, 'lr': 0.005563984001997992, 'batch_size': 128, 'dropout_rate': 0.11999247205807569, 'prior_mu': -0.01781967664238851, 'prior_sigma': 0.08027265751497444, 'normalization': 'layer'}. Best is trial 896 with value: 0.4533553242683411.
Generating morgan_rdkit fingerprints...
Generated fingerprints with 2048 features for 841 molecules
Trial 1606: 5-fold CV loss = 0.4689
