[I 2025-08-08 01:07:10,938] Trial 2445 finished with value: 0.4677155315876007 and parameters: {'fp_type': 'morgan_rdkit', 'combined_morgan_radius': 3, 'combined_morgan_nBits': 1024, 'combined_rdkit_maxPath': 7, 'combined_rdkit_nBits': 1024, 'num_hidden_layers': 3, 'hidden_dim_0': 256, 'hidden_dim_1': 1024, 'hidden_dim_2': 64, 'kl_weight': 0.00012271892309516575, 'lr': 0.008371267180671847, 'batch_size': 128, 'dropout_rate': 0.09897294306240959, 'prior_mu': -0.014211247785781329, 'prior_sigma': 0.08987828173850602, 'normalization': 'layer'}. Best is trial 896 with value: 0.4533553242683411.
Generating morgan_rdkit fingerprints...
Generated fingerprints with 2048 features for 841 molecules
Trial 2447: 5-fold CV loss = 0.4631
[I 2025-08-08 01:07:34,814] Trial 2447 finished with value: 0.46312605738639834 and parameters: {'fp_type': 'morgan_rdkit', 'combined_morgan_radius': 3, 'combined_morgan_nBits': 1024, 'combined_rdkit_maxPath': 7, 'combined_rdkit_nBits': 1024, 'num_hidden_layers': 3, 'hidden_dim_0': 1024, 'hidden_dim_1': 1024, 'hidden_dim_2': 64, 'kl_weight': 0.00018313004264117606, 'lr': 0.008268960344681872, 'batch_size': 128, 'dropout_rate': 0.05760213277403324, 'prior_mu': -0.06424926656181028, 'prior_sigma': 0.11185168821585323, 'normalization': 'layer'}. Best is trial 896 with value: 0.4533553242683411.
Generating morgan_rdkit fingerprints...
Generated fingerprints with 2048 features for 841 molecules
Trial 2449: 5-fold CV loss = 0.5563
[I 2025-08-08 01:07:51,175] Trial 2449 finished with value: 0.5562514424324035 and parameters: {'fp_type': 'morgan_rdkit', 'combined_morgan_radius': 3, 'combined_morgan_nBits': 1024, 'combined_rdkit_maxPath': 7, 'combined_rdkit_nBits': 1024, 'num_hidden_layers': 3, 'hidden_dim_0': 1024, 'hidden_dim_1': 128, 'hidden_dim_2': 64, 'kl_weight': 0.00019924987036827035, 'lr': 0.008212059692810757, 'batch_size': 128, 'dropout_rate': 0.05696014052608686, 'prior_mu': -0.06392663248549227, 'prior_sigma': 0.11242987123744057, 'normalization': 'layer'}. Best is trial 896 with value: 0.4533553242683411.
Generating morgan_rdkit fingerprints...
Generated fingerprints with 2048 features for 841 molecules
Trial 2448: 5-fold CV loss = 0.4704
[I 2025-08-08 01:07:53,655] Trial 2448 finished with value: 0.4703852891921997 and parameters: {'fp_type': 'morgan_rdkit', 'combined_morgan_radius': 3, 'combined_morgan_nBits': 1024, 'combined_rdkit_maxPath': 7, 'combined_rdkit_nBits': 1024, 'num_hidden_layers': 3, 'hidden_dim_0': 1024, 'hidden_dim_1': 1024, 'hidden_dim_2': 64, 'kl_weight': 0.00018671032378957583, 'lr': 0.008208915262836514, 'batch_size': 128, 'dropout_rate': 0.05301190599485886, 'prior_mu': -0.06406335614908863, 'prior_sigma': 0.11839893184076067, 'normalization': 'layer'}. Best is trial 896 with value: 0.4533553242683411.
Generating morgan_rdkit fingerprints...
Generated fingerprints with 2048 features for 841 molecules
Trial 2446: 5-fold CV loss = 0.4656
[I 2025-08-08 01:08:16,446] Trial 2446 finished with value: 0.46563500761985777 and parameters: {'fp_type': 'morgan_rdkit', 'combined_morgan_radius': 3, 'combined_morgan_nBits': 1024, 'combined_rdkit_maxPath': 7, 'combined_rdkit_nBits': 1024, 'num_hidden_layers': 3, 'hidden_dim_0': 256, 'hidden_dim_1': 1024, 'hidden_dim_2': 64, 'kl_weight': 0.00017968568246792016, 'lr': 0.009945916032648565, 'batch_size': 128, 'dropout_rate': 0.08931485269509597, 'prior_mu': -0.0628583044418238, 'prior_sigma': 0.10388352015887196, 'normalization': 'layer'}. Best is trial 896 with value: 0.4533553242683411.
Generating morgan_rdkit fingerprints...
Generated fingerprints with 2048 features for 841 molecules
Trial 2450: 5-fold CV loss = 0.4671
[I 2025-08-08 01:08:21,549] Trial 2450 finished with value: 0.46705090403556826 and parameters: {'fp_type': 'morgan_rdkit', 'combined_morgan_radius': 3, 'combined_morgan_nBits': 1024, 'combined_rdkit_maxPath': 7, 'combined_rdkit_nBits': 1024, 'num_hidden_layers': 3, 'hidden_dim_0': 256, 'hidden_dim_1': 128, 'hidden_dim_2': 64, 'kl_weight': 0.00020659449587231827, 'lr': 0.007245940835158656, 'batch_size': 128, 'dropout_rate': 0.07095305680406135, 'prior_mu': 0.021022064218287867, 'prior_sigma': 0.08972761462078514, 'normalization': 'layer'}. Best is trial 896 with value: 0.4533553242683411.
Generating morgan_rdkit fingerprints...
Generated fingerprints with 2048 features for 841 molecules
Trial 2451: 5-fold CV loss = 0.4881
[I 2025-08-08 01:08:25,880] Trial 2451 finished with value: 0.48812930583953856 and parameters: {'fp_type': 'morgan_rdkit', 'combined_morgan_radius': 3, 'combined_morgan_nBits': 1024, 'combined_rdkit_maxPath': 6, 'combined_rdkit_nBits': 1024, 'num_hidden_layers': 3, 'hidden_dim_0': 256, 'hidden_dim_1': 1024, 'hidden_dim_2': 64, 'kl_weight': 0.012181920724005809, 'lr': 0.006909948070712368, 'batch_size': 128, 'dropout_rate': 0.07098121220254766, 'prior_mu': 0.021556211806777265, 'prior_sigma': 0.08964471550613552, 'normalization': 'layer'}. Best is trial 896 with value: 0.4533553242683411.
Generating morgan_rdkit fingerprints...
Generated fingerprints with 2048 features for 841 molecules
Trial 2452: 5-fold CV loss = 0.4681
[I 2025-08-08 01:08:46,514] Trial 2452 finished with value: 0.46805721521377563 and parameters: {'fp_type': 'morgan_rdkit', 'combined_morgan_radius': 3, 'combined_morgan_nBits': 1024, 'combined_rdkit_maxPath': 7, 'combined_rdkit_nBits': 1024, 'num_hidden_layers': 3, 'hidden_dim_0': 256, 'hidden_dim_1': 1024, 'hidden_dim_2': 64, 'kl_weight': 0.0002119641531418101, 'lr': 0.0069550228570377575, 'batch_size': 128, 'dropout_rate': 0.11118527766674985, 'prior_mu': 0.02121830503031091, 'prior_sigma': 0.08989050423756946, 'normalization': 'layer'}. Best is trial 896 with value: 0.4533553242683411.
Generating morgan fingerprints...
Generated fingerprints with 1024 features for 841 molecules
Trial 2454: 5-fold CV loss = 0.5618
[I 2025-08-08 01:08:56,569] Trial 2454 finished with value: 0.5617523610591888 and parameters: {'fp_type': 'morgan_rdkit', 'combined_morgan_radius': 3, 'combined_morgan_nBits': 1024, 'combined_rdkit_maxPath': 6, 'combined_rdkit_nBits': 1024, 'num_hidden_layers': 3, 'hidden_dim_0': 256, 'hidden_dim_1': 1024, 'hidden_dim_2': 64, 'kl_weight': 0.00021796175083430575, 'lr': 0.0068935883815904216, 'batch_size': 128, 'dropout_rate': 0.10461509958820381, 'prior_mu': -0.07606937730034653, 'prior_sigma': 0.10869974459754421, 'normalization': 'layer'}. Best is trial 896 with value: 0.4533553242683411.
Generating morgan fingerprints...
Generated fingerprints with 1024 features for 841 molecules
Trial 2455: 5-fold CV loss = 0.5575
[I 2025-08-08 01:08:57,779] Trial 2455 finished with value: 0.5575467884540558 and parameters: {'fp_type': 'morgan_rdkit', 'combined_morgan_radius': 3, 'combined_morgan_nBits': 1024, 'combined_rdkit_maxPath': 7, 'combined_rdkit_nBits': 1024, 'num_hidden_layers': 3, 'hidden_dim_0': 256, 'hidden_dim_1': 1024, 'hidden_dim_2': 64, 'kl_weight': 0.00012681868193514125, 'lr': 0.007658984785664133, 'batch_size': 128, 'dropout_rate': 0.11353226224066393, 'prior_mu': -0.10811621987233258, 'prior_sigma': 0.10890591968269471, 'normalization': 'layer'}. Best is trial 896 with value: 0.4533553242683411.
Generating rdkit fingerprints...
Generated fingerprints with 1024 features for 841 molecules
Trial 2456: 5-fold CV loss = 0.5531
[I 2025-08-08 01:09:08,513] Trial 2456 finished with value: 0.5531034886837005 and parameters: {'fp_type': 'morgan', 'morgan_only_radius': 2, 'morgan_only_nBits': 1024, 'num_hidden_layers': 1, 'hidden_dim_0': 256, 'kl_weight': 0.004319750779495715, 'lr': 0.00777583373711553, 'batch_size': 128, 'dropout_rate': 0.08319326209707076, 'prior_mu': -0.017155381434060344, 'prior_sigma': 0.09352067846545342, 'normalization': 'layer'}. Best is trial 896 with value: 0.4533553242683411.
Generating morgan_rdkit fingerprints...
Generated fingerprints with 2048 features for 841 molecules
Trial 2457: 5-fold CV loss = 0.5175
[I 2025-08-08 01:09:19,440] Trial 2457 finished with value: 0.5174707353115082 and parameters: {'fp_type': 'morgan', 'morgan_only_radius': 2, 'morgan_only_nBits': 1024, 'num_hidden_layers': 3, 'hidden_dim_0': 256, 'hidden_dim_1': 1024, 'hidden_dim_2': 64, 'kl_weight': 0.00012044906540851729, 'lr': 0.007774830900325564, 'batch_size': 128, 'dropout_rate': 0.0831647552705554, 'prior_mu': -0.015472812953919501, 'prior_sigma': 0.09961857464476492, 'normalization': 'layer'}. Best is trial 896 with value: 0.4533553242683411.
Generating rdkit fingerprints...
Generated fingerprints with 1024 features for 841 molecules
Trial 2458: 5-fold CV loss = 0.5017
[I 2025-08-08 01:09:30,809] Trial 2458 finished with value: 0.5016553699970245 and parameters: {'fp_type': 'rdkit', 'rdkit_only_maxPath': 7, 'rdkit_only_nBits': 1024, 'num_hidden_layers': 1, 'hidden_dim_0': 256, 'kl_weight': 0.0012827240085012631, 'lr': 0.009180265351811514, 'batch_size': 128, 'dropout_rate': 0.08069846771234913, 'prior_mu': -0.0173723872383418, 'prior_sigma': 0.09290947438168798, 'normalization': 'layer'}. Best is trial 896 with value: 0.4533553242683411.
Generating morgan_rdkit fingerprints...
Generated fingerprints with 2048 features for 841 molecules
Trial 2453: 5-fold CV loss = 0.4746
[I 2025-08-08 01:09:35,439] Trial 2453 finished with value: 0.47457315325737 and parameters: {'fp_type': 'morgan_rdkit', 'combined_morgan_radius': 3, 'combined_morgan_nBits': 1024, 'combined_rdkit_maxPath': 6, 'combined_rdkit_nBits': 1024, 'num_hidden_layers': 3, 'hidden_dim_0': 256, 'hidden_dim_1': 1024, 'hidden_dim_2': 64, 'kl_weight': 0.004155570769536277, 'lr': 0.0068964362914966364, 'batch_size': 128, 'dropout_rate': 0.07143817763105335, 'prior_mu': -0.018181432450134857, 'prior_sigma': 0.09270796514072108, 'normalization': 'layer'}. Best is trial 896 with value: 0.4533553242683411.
Generating morgan_rdkit fingerprints...
Generated fingerprints with 2048 features for 841 molecules
Trial 2461: 5-fold CV loss = 0.5493
[I 2025-08-08 01:10:00,571] Trial 2461 finished with value: 0.5492505609989167 and parameters: {'fp_type': 'morgan_rdkit', 'combined_morgan_radius': 3, 'combined_morgan_nBits': 1024, 'combined_rdkit_maxPath': 7, 'combined_rdkit_nBits': 1024, 'num_hidden_layers': 3, 'hidden_dim_0': 256, 'hidden_dim_1': 1024, 'hidden_dim_2': 64, 'kl_weight': 0.00014329067844213303, 'lr': 0.00846539286375433, 'batch_size': 128, 'dropout_rate': 0.10557373278653588, 'prior_mu': -0.0027475275613752254, 'prior_sigma': 0.09949539161127692, 'normalization': 'layer'}. Best is trial 896 with value: 0.4533553242683411.
Generating morgan_rdkit fingerprints...
Generated fingerprints with 2048 features for 841 molecules
Trial 2459: 5-fold CV loss = 0.4719
[I 2025-08-08 01:10:02,913] Trial 2459 finished with value: 0.47194979786872865 and parameters: {'fp_type': 'morgan_rdkit', 'combined_morgan_radius': 3, 'combined_morgan_nBits': 1024, 'combined_rdkit_maxPath': 7, 'combined_rdkit_nBits': 1024, 'num_hidden_layers': 3, 'hidden_dim_0': 256, 'hidden_dim_1': 1024, 'hidden_dim_2': 64, 'kl_weight': 0.0035660143705246103, 'lr': 0.008408810821771497, 'batch_size': 128, 'dropout_rate': 0.08440128040732105, 'prior_mu': -0.003502767443117339, 'prior_sigma': 0.09975460193323277, 'normalization': 'layer'}. Best is trial 896 with value: 0.4533553242683411.
Generating morgan_rdkit fingerprints...
Generated fingerprints with 2048 features for 841 molecules
Trial 2460: 5-fold CV loss = 0.4831
[I 2025-08-08 01:10:08,187] Trial 2460 finished with value: 0.48311290740966795 and parameters: {'fp_type': 'rdkit', 'rdkit_only_maxPath': 7, 'rdkit_only_nBits': 1024, 'num_hidden_layers': 3, 'hidden_dim_0': 256, 'hidden_dim_1': 512, 'hidden_dim_2': 64, 'kl_weight': 0.0001436598176575476, 'lr': 0.009038641387308411, 'batch_size': 128, 'dropout_rate': 0.10105356887407389, 'prior_mu': -0.0028897053496961984, 'prior_sigma': 0.09902829671189568, 'normalization': 'layer'}. Best is trial 896 with value: 0.4533553242683411.
Generating morgan_rdkit fingerprints...
Generated fingerprints with 2048 features for 841 molecules
Trial 2463: 5-fold CV loss = 0.5839
[I 2025-08-08 01:10:36,604] Trial 2463 finished with value: 0.5838810861110687 and parameters: {'fp_type': 'morgan_rdkit', 'combined_morgan_radius': 3, 'combined_morgan_nBits': 1024, 'combined_rdkit_maxPath': 7, 'combined_rdkit_nBits': 1024, 'num_hidden_layers': 3, 'hidden_dim_0': 256, 'hidden_dim_1': 512, 'hidden_dim_2': 64, 'kl_weight': 0.00016467505888837354, 'lr': 0.009101292173659193, 'batch_size': 128, 'dropout_rate': 0.0970606005051676, 'prior_mu': -0.005983276362598065, 'prior_sigma': 0.1439652364833946, 'normalization': 'layer'}. Best is trial 896 with value: 0.4533553242683411.
Generating morgan_rdkit fingerprints...
Generated fingerprints with 1536 features for 841 molecules
Trial 2465: 5-fold CV loss = 0.4825
[I 2025-08-08 01:10:52,785] Trial 2465 finished with value: 0.482465660572052 and parameters: {'fp_type': 'morgan_rdkit', 'combined_morgan_radius': 3, 'combined_morgan_nBits': 1024, 'combined_rdkit_maxPath': 7, 'combined_rdkit_nBits': 1024, 'num_hidden_layers': 3, 'hidden_dim_0': 256, 'hidden_dim_1': 1024, 'hidden_dim_2': 128, 'kl_weight': 0.00017345498847024174, 'lr': 0.006996787199835255, 'batch_size': 128, 'dropout_rate': 0.11256443682853656, 'prior_mu': -0.024891920834261762, 'prior_sigma': 0.09600404627981646, 'normalization': 'layer'}. Best is trial 896 with value: 0.4533553242683411.
Generating morgan_rdkit fingerprints...
Generated fingerprints with 1536 features for 841 molecules
Trial 2464: 5-fold CV loss = 0.4653
[I 2025-08-08 01:10:57,752] Trial 2464 finished with value: 0.465339595079422 and parameters: {'fp_type': 'morgan_rdkit', 'combined_morgan_radius': 3, 'combined_morgan_nBits': 1024, 'combined_rdkit_maxPath': 7, 'combined_rdkit_nBits': 1024, 'num_hidden_layers': 3, 'hidden_dim_0': 256, 'hidden_dim_1': 1024, 'hidden_dim_2': 64, 'kl_weight': 0.0001688388513181112, 'lr': 0.009044803819807037, 'batch_size': 128, 'dropout_rate': 0.10163465833071673, 'prior_mu': -0.05774824900000252, 'prior_sigma': 0.09634301997929555, 'normalization': 'layer'}. Best is trial 896 with value: 0.4533553242683411.
Generating morgan_rdkit fingerprints...
Generated fingerprints with 768 features for 841 molecules
Trial 2466: 5-fold CV loss = 0.4774
[I 2025-08-08 01:11:19,445] Trial 2466 finished with value: 0.4773933827877045 and parameters: {'fp_type': 'morgan_rdkit', 'combined_morgan_radius': 3, 'combined_morgan_nBits': 512, 'combined_rdkit_maxPath': 8, 'combined_rdkit_nBits': 1024, 'num_hidden_layers': 3, 'hidden_dim_0': 256, 'hidden_dim_1': 1024, 'hidden_dim_2': 64, 'kl_weight': 0.0002087860054265449, 'lr': 0.006978320823556569, 'batch_size': 128, 'dropout_rate': 0.1118812524255586, 'prior_mu': -0.05752099814468434, 'prior_sigma': 0.08838825088401091, 'normalization': 'layer'}. Best is trial 896 with value: 0.4533553242683411.
Generating morgan_rdkit fingerprints...
Generated fingerprints with 2048 features for 841 molecules
Trial 2462: 5-fold CV loss = 0.4678
[I 2025-08-08 01:11:25,995] Trial 2462 finished with value: 0.4678034007549286 and parameters: {'fp_type': 'morgan_rdkit', 'combined_morgan_radius': 3, 'combined_morgan_nBits': 1024, 'combined_rdkit_maxPath': 7, 'combined_rdkit_nBits': 1024, 'num_hidden_layers': 3, 'hidden_dim_0': 256, 'hidden_dim_1': 512, 'hidden_dim_2': 128, 'kl_weight': 0.00015244155726993353, 'lr': 0.008889956716746174, 'batch_size': 128, 'dropout_rate': 0.10434725764088375, 'prior_mu': -0.055036795942333655, 'prior_sigma': 0.11550081898115636, 'normalization': 'layer'}. Best is trial 896 with value: 0.4533553242683411.
Generating morgan_rdkit fingerprints...
Generated fingerprints with 1280 features for 841 molecules
Trial 2468: 5-fold CV loss = 0.8793
[I 2025-08-08 01:11:37,365] Trial 2468 finished with value: 0.8793263673782349 and parameters: {'fp_type': 'morgan_rdkit', 'combined_morgan_radius': 3, 'combined_morgan_nBits': 512, 'combined_rdkit_maxPath': 8, 'combined_rdkit_nBits': 256, 'num_hidden_layers': 3, 'hidden_dim_0': 256, 'hidden_dim_1': 1024, 'hidden_dim_2': 64, 'kl_weight': 0.00021366640793198338, 'lr': 0.0004094375270537371, 'batch_size': 64, 'dropout_rate': 0.06880556705720717, 'prior_mu': -0.026596171578741168, 'prior_sigma': 0.08790130666859372, 'normalization': 'layer'}. Best is trial 896 with value: 0.4533553242683411.
Generating morgan_rdkit fingerprints...
Generated fingerprints with 2048 features for 841 molecules
Trial 2467: 5-fold CV loss = 0.4673
[I 2025-08-08 01:11:38,864] Trial 2467 finished with value: 0.46729238629341124 and parameters: {'fp_type': 'morgan_rdkit', 'combined_morgan_radius': 3, 'combined_morgan_nBits': 512, 'combined_rdkit_maxPath': 7, 'combined_rdkit_nBits': 1024, 'num_hidden_layers': 3, 'hidden_dim_0': 256, 'hidden_dim_1': 1024, 'hidden_dim_2': 64, 'kl_weight': 0.0002114775563811547, 'lr': 0.007624968124689922, 'batch_size': 128, 'dropout_rate': 0.06783513995159651, 'prior_mu': -0.05447313373542285, 'prior_sigma': 0.10345990735593978, 'normalization': 'layer'}. Best is trial 896 with value: 0.4533553242683411.
Generating morgan_rdkit fingerprints...
Generated fingerprints with 2048 features for 841 molecules
Trial 2471: 5-fold CV loss = 0.8694
[I 2025-08-08 01:12:04,521] Trial 2471 finished with value: 0.8693845629692077 and parameters: {'fp_type': 'morgan_rdkit', 'combined_morgan_radius': 3, 'combined_morgan_nBits': 1024, 'combined_rdkit_maxPath': 7, 'combined_rdkit_nBits': 1024, 'num_hidden_layers': 3, 'hidden_dim_0': 256, 'hidden_dim_1': 1024, 'hidden_dim_2': 64, 'kl_weight': 0.00011488106868120057, 'lr': 0.0005067452767402437, 'batch_size': 128, 'dropout_rate': 0.09029640162021485, 'prior_mu': -0.010913035533813379, 'prior_sigma': 0.10207111001371523, 'normalization': 'layer'}. Best is trial 896 with value: 0.4533553242683411.
Generating morgan_rdkit fingerprints...
Generated fingerprints with 2048 features for 841 molecules
Trial 2469: 5-fold CV loss = 0.4675
[I 2025-08-08 01:12:11,771] Trial 2469 finished with value: 0.4675076544284821 and parameters: {'fp_type': 'morgan_rdkit', 'combined_morgan_radius': 3, 'combined_morgan_nBits': 1024, 'combined_rdkit_maxPath': 7, 'combined_rdkit_nBits': 1024, 'num_hidden_layers': 3, 'hidden_dim_0': 256, 'hidden_dim_1': 1024, 'hidden_dim_2': 64, 'kl_weight': 0.00013341364071810957, 'lr': 0.007839844585589784, 'batch_size': 64, 'dropout_rate': 0.06581489323228415, 'prior_mu': -0.02637615603030804, 'prior_sigma': 0.10528376986489013, 'normalization': 'layer'}. Best is trial 896 with value: 0.4533553242683411.
Generating morgan_rdkit fingerprints...
Generated fingerprints with 2048 features for 841 molecules
Trial 2472: 5-fold CV loss = 0.4654
[I 2025-08-08 01:12:23,178] Trial 2472 finished with value: 0.4653557538986206 and parameters: {'fp_type': 'morgan_rdkit', 'combined_morgan_radius': 3, 'combined_morgan_nBits': 1024, 'combined_rdkit_maxPath': 7, 'combined_rdkit_nBits': 1024, 'num_hidden_layers': 3, 'hidden_dim_0': 256, 'hidden_dim_1': 1024, 'hidden_dim_2': 64, 'kl_weight': 0.00013818984473076116, 'lr': 0.009935562726966515, 'batch_size': 128, 'dropout_rate': 0.0915605557989139, 'prior_mu': 0.005731662564389433, 'prior_sigma': 0.10736724810845794, 'normalization': 'layer'}. Best is trial 896 with value: 0.4533553242683411.
Generating morgan_rdkit fingerprints...
Generated fingerprints with 2048 features for 841 molecules
Trial 2474: 5-fold CV loss = 0.7376
[I 2025-08-08 01:12:37,102] Trial 2474 finished with value: 0.7376416087150574 and parameters: {'fp_type': 'morgan_rdkit', 'combined_morgan_radius': 3, 'combined_morgan_nBits': 1024, 'combined_rdkit_maxPath': 7, 'combined_rdkit_nBits': 1024, 'num_hidden_layers': 3, 'hidden_dim_0': 256, 'hidden_dim_1': 1024, 'hidden_dim_2': 64, 'kl_weight': 0.0001821120958847022, 'lr': 0.006989819510159038, 'batch_size': 128, 'dropout_rate': 0.08065865092543, 'prior_mu': 0.0013753157624289095, 'prior_sigma': 0.0933213741562409, 'normalization': 'none'}. Best is trial 896 with value: 0.4533553242683411.
Generating morgan_rdkit fingerprints...
Generated fingerprints with 2048 features for 841 molecules
Trial 2473: 5-fold CV loss = 0.4677
[I 2025-08-08 01:13:04,823] Trial 2473 finished with value: 0.46774853467941285 and parameters: {'fp_type': 'morgan_rdkit', 'combined_morgan_radius': 3, 'combined_morgan_nBits': 1024, 'combined_rdkit_maxPath': 7, 'combined_rdkit_nBits': 1024, 'num_hidden_layers': 3, 'hidden_dim_0': 256, 'hidden_dim_1': 1024, 'hidden_dim_2': 64, 'kl_weight': 0.00010027030982736137, 'lr': 0.008103463333744093, 'batch_size': 128, 'dropout_rate': 0.07707564107123024, 'prior_mu': 0.003182156205335438, 'prior_sigma': 0.10785278831240744, 'normalization': 'layer'}. Best is trial 896 with value: 0.4533553242683411.
Generating morgan_rdkit fingerprints...
Generated fingerprints with 2048 features for 841 molecules
Trial 2470: 5-fold CV loss = 0.5181
[I 2025-08-08 01:13:10,563] Trial 2470 finished with value: 0.518072658777237 and parameters: {'fp_type': 'morgan_rdkit', 'combined_morgan_radius': 3, 'combined_morgan_nBits': 1024, 'combined_rdkit_maxPath': 7, 'combined_rdkit_nBits': 256, 'num_hidden_layers': 3, 'hidden_dim_0': 256, 'hidden_dim_1': 1024, 'hidden_dim_2': 64, 'kl_weight': 0.00011519306062388144, 'lr': 0.007624640342883385, 'batch_size': 64, 'dropout_rate': 0.07031498821307078, 'prior_mu': -0.02667285727506436, 'prior_sigma': 0.104182114449745, 'normalization': 'layer'}. Best is trial 896 with value: 0.4533553242683411.
Generating morgan_rdkit fingerprints...
Generated fingerprints with 2048 features for 841 molecules
Trial 2476: 5-fold CV loss = 0.4646
