[I 2025-08-07 18:40:58,650] Trial 496 finished with value: 0.4782130777835846 and parameters: {'fp_type': 'morgan_rdkit', 'combined_morgan_radius': 2, 'combined_morgan_nBits': 1024, 'combined_rdkit_maxPath': 7, 'combined_rdkit_nBits': 1024, 'num_hidden_layers': 3, 'hidden_dim_0': 256, 'hidden_dim_1': 1024, 'hidden_dim_2': 64, 'kl_weight': 0.00029697543152307286, 'lr': 0.00443543011041053, 'batch_size': 128, 'dropout_rate': 0.13739295269872173, 'prior_mu': -0.002746173103512779, 'prior_sigma': 0.08793110815771694, 'normalization': 'layer'}. Best is trial 479 with value: 0.4579240560531616.
Generating morgan_rdkit fingerprints...
Generated fingerprints with 2048 features for 841 molecules
Trial 495: 5-fold CV loss = 0.4678
[I 2025-08-07 18:41:04,257] Trial 495 finished with value: 0.46780459880828856 and parameters: {'fp_type': 'morgan_rdkit', 'combined_morgan_radius': 2, 'combined_morgan_nBits': 1024, 'combined_rdkit_maxPath': 7, 'combined_rdkit_nBits': 1024, 'num_hidden_layers': 3, 'hidden_dim_0': 256, 'hidden_dim_1': 1024, 'hidden_dim_2': 64, 'kl_weight': 0.0002904905358259852, 'lr': 0.005900623463055947, 'batch_size': 128, 'dropout_rate': 0.15471009898458996, 'prior_mu': -0.01810799619391206, 'prior_sigma': 0.08776889360565196, 'normalization': 'layer'}. Best is trial 479 with value: 0.4579240560531616.
Generating morgan_rdkit fingerprints...
Generated fingerprints with 2048 features for 841 molecules
Trial 498: 5-fold CV loss = 0.4843
[I 2025-08-07 18:41:30,213] Trial 498 finished with value: 0.48428640961647035 and parameters: {'fp_type': 'morgan_rdkit', 'combined_morgan_radius': 2, 'combined_morgan_nBits': 1024, 'combined_rdkit_maxPath': 7, 'combined_rdkit_nBits': 1024, 'num_hidden_layers': 3, 'hidden_dim_0': 256, 'hidden_dim_1': 1024, 'hidden_dim_2': 64, 'kl_weight': 0.0003905463641632309, 'lr': 0.005354768579777773, 'batch_size': 128, 'dropout_rate': 0.15339505589695648, 'prior_mu': -0.004135761148576742, 'prior_sigma': 0.08335583273427134, 'normalization': 'layer'}. Best is trial 479 with value: 0.4579240560531616.
Generating morgan_rdkit fingerprints...
Generated fingerprints with 2048 features for 841 molecules
Trial 499: 5-fold CV loss = 0.4830
[I 2025-08-07 18:41:34,545] Trial 499 finished with value: 0.4830284655094147 and parameters: {'fp_type': 'morgan_rdkit', 'combined_morgan_radius': 2, 'combined_morgan_nBits': 1024, 'combined_rdkit_maxPath': 7, 'combined_rdkit_nBits': 1024, 'num_hidden_layers': 3, 'hidden_dim_0': 256, 'hidden_dim_1': 1024, 'hidden_dim_2': 64, 'kl_weight': 0.00040460319340157407, 'lr': 0.0055984038312811, 'batch_size': 128, 'dropout_rate': 0.17697855534006735, 'prior_mu': -0.01915897753699098, 'prior_sigma': 0.07787504223489769, 'normalization': 'layer'}. Best is trial 479 with value: 0.4579240560531616.
Generating morgan_rdkit fingerprints...
Generated fingerprints with 2048 features for 841 molecules
Trial 500: 5-fold CV loss = 0.4683
[I 2025-08-07 18:41:48,072] Trial 500 finished with value: 0.4682607114315033 and parameters: {'fp_type': 'morgan_rdkit', 'combined_morgan_radius': 2, 'combined_morgan_nBits': 1024, 'combined_rdkit_maxPath': 7, 'combined_rdkit_nBits': 1024, 'num_hidden_layers': 3, 'hidden_dim_0': 256, 'hidden_dim_1': 1024, 'hidden_dim_2': 64, 'kl_weight': 0.0003977974097834861, 'lr': 0.005391597836064446, 'batch_size': 128, 'dropout_rate': 0.14941362697344374, 'prior_mu': -0.01367349195289237, 'prior_sigma': 0.08432110363544887, 'normalization': 'layer'}. Best is trial 479 with value: 0.4579240560531616.
Generating morgan_rdkit fingerprints...
Generated fingerprints with 2048 features for 841 molecules
Trial 497: 5-fold CV loss = 0.4673
[I 2025-08-07 18:42:03,907] Trial 497 finished with value: 0.4673032224178314 and parameters: {'fp_type': 'morgan_rdkit', 'combined_morgan_radius': 2, 'combined_morgan_nBits': 1024, 'combined_rdkit_maxPath': 7, 'combined_rdkit_nBits': 1024, 'num_hidden_layers': 3, 'hidden_dim_0': 256, 'hidden_dim_1': 1024, 'hidden_dim_2': 64, 'kl_weight': 0.00029362845836686745, 'lr': 0.005834045240384872, 'batch_size': 128, 'dropout_rate': 0.14382170334760327, 'prior_mu': -0.0015372142893954597, 'prior_sigma': 0.08862803944800293, 'normalization': 'layer'}. Best is trial 479 with value: 0.4579240560531616.
Generating morgan_rdkit fingerprints...
Generated fingerprints with 2048 features for 841 molecules
Trial 502: 5-fold CV loss = 0.4676
[I 2025-08-07 18:42:15,330] Trial 502 finished with value: 0.4675767183303833 and parameters: {'fp_type': 'morgan_rdkit', 'combined_morgan_radius': 3, 'combined_morgan_nBits': 1024, 'combined_rdkit_maxPath': 7, 'combined_rdkit_nBits': 1024, 'num_hidden_layers': 3, 'hidden_dim_0': 256, 'hidden_dim_1': 1024, 'hidden_dim_2': 64, 'kl_weight': 0.0002522870187466235, 'lr': 0.004480458718491948, 'batch_size': 128, 'dropout_rate': 0.15316753575586783, 'prior_mu': -0.03497911545268856, 'prior_sigma': 0.08299517397798621, 'normalization': 'layer'}. Best is trial 479 with value: 0.4579240560531616.
Generating morgan_rdkit fingerprints...
Generated fingerprints with 2048 features for 841 molecules
Trial 501: 5-fold CV loss = 0.4657
[I 2025-08-07 18:42:29,966] Trial 501 finished with value: 0.46568494439125063 and parameters: {'fp_type': 'morgan_rdkit', 'combined_morgan_radius': 3, 'combined_morgan_nBits': 1024, 'combined_rdkit_maxPath': 7, 'combined_rdkit_nBits': 1024, 'num_hidden_layers': 3, 'hidden_dim_0': 256, 'hidden_dim_1': 1024, 'hidden_dim_2': 64, 'kl_weight': 0.00025522602301738005, 'lr': 0.005618055299055097, 'batch_size': 128, 'dropout_rate': 0.15586984144934357, 'prior_mu': -0.016978047043443047, 'prior_sigma': 0.0776918454510643, 'normalization': 'layer'}. Best is trial 479 with value: 0.4579240560531616.
Generating morgan fingerprints...
Generated fingerprints with 2048 features for 841 molecules
Trial 503: 5-fold CV loss = 0.4669
[I 2025-08-07 18:42:33,576] Trial 503 finished with value: 0.46691234707832335 and parameters: {'fp_type': 'morgan_rdkit', 'combined_morgan_radius': 3, 'combined_morgan_nBits': 1024, 'combined_rdkit_maxPath': 7, 'combined_rdkit_nBits': 1024, 'num_hidden_layers': 3, 'hidden_dim_0': 256, 'hidden_dim_1': 1024, 'hidden_dim_2': 64, 'kl_weight': 0.0002544968289241368, 'lr': 0.005111610428659593, 'batch_size': 128, 'dropout_rate': 0.14609921445328677, 'prior_mu': -0.03996202998094324, 'prior_sigma': 0.08360953704887471, 'normalization': 'layer'}. Best is trial 479 with value: 0.4579240560531616.
Generating morgan fingerprints...
Generated fingerprints with 2048 features for 841 molecules
Trial 505: 5-fold CV loss = 0.4575
[I 2025-08-07 18:42:53,576] Trial 505 finished with value: 0.4575017273426056 and parameters: {'fp_type': 'morgan_rdkit', 'combined_morgan_radius': 3, 'combined_morgan_nBits': 1024, 'combined_rdkit_maxPath': 7, 'combined_rdkit_nBits': 1024, 'num_hidden_layers': 3, 'hidden_dim_0': 256, 'hidden_dim_1': 1024, 'hidden_dim_2': 64, 'kl_weight': 0.0002436280157406634, 'lr': 0.008144641536628465, 'batch_size': 128, 'dropout_rate': 0.14704644903756758, 'prior_mu': -0.02057426377487076, 'prior_sigma': 0.09124905116329157, 'normalization': 'layer'}. Best is trial 505 with value: 0.4575017273426056.
Generating morgan fingerprints...
Generated fingerprints with 2048 features for 841 molecules
Trial 507: 5-fold CV loss = 0.5227
[I 2025-08-07 18:42:55,789] Trial 507 finished with value: 0.5227259635925293 and parameters: {'fp_type': 'morgan', 'morgan_only_radius': 2, 'morgan_only_nBits': 2048, 'num_hidden_layers': 3, 'hidden_dim_0': 256, 'hidden_dim_1': 1024, 'hidden_dim_2': 64, 'kl_weight': 0.00024481825465745897, 'lr': 0.006341126883630052, 'batch_size': 128, 'dropout_rate': 0.1284634284095995, 'prior_mu': -0.042101022298034745, 'prior_sigma': 0.08391266598242429, 'normalization': 'layer'}. Best is trial 505 with value: 0.4575017273426056.
Generating morgan_rdkit fingerprints...
Generated fingerprints with 2048 features for 841 molecules
Trial 506: 5-fold CV loss = 0.5255
[I 2025-08-07 18:42:59,451] Trial 506 finished with value: 0.5254513561725617 and parameters: {'fp_type': 'morgan', 'morgan_only_radius': 2, 'morgan_only_nBits': 2048, 'num_hidden_layers': 3, 'hidden_dim_0': 256, 'hidden_dim_1': 1024, 'hidden_dim_2': 64, 'kl_weight': 0.00024059252784153302, 'lr': 0.006175327360220319, 'batch_size': 128, 'dropout_rate': 0.14906593279462696, 'prior_mu': -0.04905610640037012, 'prior_sigma': 0.08304947501582169, 'normalization': 'layer'}. Best is trial 505 with value: 0.4575017273426056.
Generating morgan_rdkit fingerprints...
Generated fingerprints with 2048 features for 841 molecules
Trial 508: 5-fold CV loss = 0.5259
[I 2025-08-07 18:43:17,334] Trial 508 finished with value: 0.5259486377239228 and parameters: {'fp_type': 'morgan', 'morgan_only_radius': 2, 'morgan_only_nBits': 2048, 'num_hidden_layers': 3, 'hidden_dim_0': 256, 'hidden_dim_1': 1024, 'hidden_dim_2': 64, 'kl_weight': 0.00024287439522209184, 'lr': 0.008086216921148113, 'batch_size': 128, 'dropout_rate': 0.1439814531903113, 'prior_mu': -0.0405076117558546, 'prior_sigma': 0.09388412369379295, 'normalization': 'layer'}. Best is trial 505 with value: 0.4575017273426056.
Generating morgan_rdkit fingerprints...
Generated fingerprints with 2048 features for 841 molecules
Trial 509: 5-fold CV loss = 0.4683
[I 2025-08-07 18:43:31,349] Trial 509 finished with value: 0.4683432102203369 and parameters: {'fp_type': 'morgan_rdkit', 'combined_morgan_radius': 3, 'combined_morgan_nBits': 1024, 'combined_rdkit_maxPath': 7, 'combined_rdkit_nBits': 1024, 'num_hidden_layers': 3, 'hidden_dim_0': 256, 'hidden_dim_1': 1024, 'hidden_dim_2': 64, 'kl_weight': 0.00024314862011711645, 'lr': 0.009880308919497267, 'batch_size': 128, 'dropout_rate': 0.1442613887161068, 'prior_mu': -0.03522774724497725, 'prior_sigma': 0.07478327307102499, 'normalization': 'layer'}. Best is trial 505 with value: 0.4575017273426056.
Generating morgan_rdkit fingerprints...
Generated fingerprints with 2048 features for 841 molecules
Trial 504: 5-fold CV loss = 0.4598
[I 2025-08-07 18:43:40,933] Trial 504 finished with value: 0.4598046839237213 and parameters: {'fp_type': 'morgan_rdkit', 'combined_morgan_radius': 3, 'combined_morgan_nBits': 1024, 'combined_rdkit_maxPath': 7, 'combined_rdkit_nBits': 1024, 'num_hidden_layers': 3, 'hidden_dim_0': 256, 'hidden_dim_1': 1024, 'hidden_dim_2': 64, 'kl_weight': 0.00025722792613257597, 'lr': 0.007792469265191227, 'batch_size': 128, 'dropout_rate': 0.1435125022598876, 'prior_mu': -0.017527857324285124, 'prior_sigma': 0.09364725122880012, 'normalization': 'layer'}. Best is trial 505 with value: 0.4575017273426056.
Generating morgan_rdkit fingerprints...
Generated fingerprints with 2048 features for 841 molecules
Trial 510: 5-fold CV loss = 0.5415
[I 2025-08-07 18:43:50,282] Trial 510 finished with value: 0.5414823770523072 and parameters: {'fp_type': 'morgan_rdkit', 'combined_morgan_radius': 3, 'combined_morgan_nBits': 1024, 'combined_rdkit_maxPath': 7, 'combined_rdkit_nBits': 1024, 'num_hidden_layers': 3, 'hidden_dim_0': 256, 'hidden_dim_1': 1024, 'hidden_dim_2': 64, 'kl_weight': 0.00030273925777628643, 'lr': 0.004509534895350994, 'batch_size': 128, 'dropout_rate': 0.14728843475694986, 'prior_mu': -0.03634392298084921, 'prior_sigma': 0.09549803104075022, 'normalization': 'layer'}. Best is trial 505 with value: 0.4575017273426056.
Generating morgan_rdkit fingerprints...
Generated fingerprints with 2048 features for 841 molecules
Trial 511: 5-fold CV loss = 0.4620
[I 2025-08-07 18:43:55,126] Trial 511 finished with value: 0.4619549334049225 and parameters: {'fp_type': 'morgan_rdkit', 'combined_morgan_radius': 3, 'combined_morgan_nBits': 1024, 'combined_rdkit_maxPath': 7, 'combined_rdkit_nBits': 1024, 'num_hidden_layers': 3, 'hidden_dim_0': 256, 'hidden_dim_1': 1024, 'hidden_dim_2': 128, 'kl_weight': 0.0002956002539283364, 'lr': 0.008701283636475635, 'batch_size': 128, 'dropout_rate': 0.139107625198021, 'prior_mu': -0.03180635689298928, 'prior_sigma': 0.07482060091477916, 'normalization': 'layer'}. Best is trial 505 with value: 0.4575017273426056.
Generating morgan_rdkit fingerprints...
Generated fingerprints with 2048 features for 841 molecules
Trial 512: 5-fold CV loss = 0.4693
[I 2025-08-07 18:44:11,221] Trial 512 finished with value: 0.4693057000637054 and parameters: {'fp_type': 'morgan_rdkit', 'combined_morgan_radius': 3, 'combined_morgan_nBits': 1024, 'combined_rdkit_maxPath': 7, 'combined_rdkit_nBits': 1024, 'num_hidden_layers': 3, 'hidden_dim_0': 256, 'hidden_dim_1': 1024, 'hidden_dim_2': 64, 'kl_weight': 0.00031126244080712277, 'lr': 0.008254796087998843, 'batch_size': 128, 'dropout_rate': 0.1439742234052068, 'prior_mu': -0.028381302269617478, 'prior_sigma': 0.08190837584848414, 'normalization': 'layer'}. Best is trial 505 with value: 0.4575017273426056.
Generating morgan_rdkit fingerprints...
Generated fingerprints with 2048 features for 841 molecules
Trial 515: 5-fold CV loss = 0.5456
[I 2025-08-07 18:44:30,506] Trial 515 finished with value: 0.5455778539180756 and parameters: {'fp_type': 'morgan_rdkit', 'combined_morgan_radius': 3, 'combined_morgan_nBits': 1024, 'combined_rdkit_maxPath': 7, 'combined_rdkit_nBits': 1024, 'num_hidden_layers': 3, 'hidden_dim_0': 256, 'hidden_dim_1': 1024, 'hidden_dim_2': 128, 'kl_weight': 0.00032301130449173397, 'lr': 0.009505056544031238, 'batch_size': 128, 'dropout_rate': 0.14006788574037887, 'prior_mu': -0.03139952514614995, 'prior_sigma': 0.0900837275320552, 'normalization': 'layer'}. Best is trial 505 with value: 0.4575017273426056.
Generating morgan_rdkit fingerprints...
Generated fingerprints with 2048 features for 841 molecules
Trial 514: 5-fold CV loss = 0.5660
[I 2025-08-07 18:44:44,706] Trial 514 finished with value: 0.5659948348999023 and parameters: {'fp_type': 'morgan_rdkit', 'combined_morgan_radius': 3, 'combined_morgan_nBits': 1024, 'combined_rdkit_maxPath': 7, 'combined_rdkit_nBits': 1024, 'num_hidden_layers': 3, 'hidden_dim_0': 256, 'hidden_dim_1': 1024, 'hidden_dim_2': 128, 'kl_weight': 0.00033597406531903323, 'lr': 0.007625810494549561, 'batch_size': 128, 'dropout_rate': 0.14088331099278853, 'prior_mu': -0.03230815602605301, 'prior_sigma': 0.0873121686309548, 'normalization': 'layer'}. Best is trial 505 with value: 0.4575017273426056.
Generating rdkit fingerprints...
Generated fingerprints with 256 features for 841 molecules
Trial 516: 5-fold CV loss = 0.4752
[I 2025-08-07 18:44:54,945] Trial 516 finished with value: 0.47521178126335145 and parameters: {'fp_type': 'morgan_rdkit', 'combined_morgan_radius': 3, 'combined_morgan_nBits': 1024, 'combined_rdkit_maxPath': 7, 'combined_rdkit_nBits': 1024, 'num_hidden_layers': 3, 'hidden_dim_0': 256, 'hidden_dim_1': 1024, 'hidden_dim_2': 128, 'kl_weight': 0.00035564066225922625, 'lr': 0.008526135930276896, 'batch_size': 128, 'dropout_rate': 0.12612262610776562, 'prior_mu': -0.03410560559216075, 'prior_sigma': 0.08832445945153292, 'normalization': 'layer'}. Best is trial 505 with value: 0.4575017273426056.
Generating rdkit fingerprints...
Generated fingerprints with 256 features for 841 molecules
Trial 517: 5-fold CV loss = 0.5506
[I 2025-08-07 18:44:58,968] Trial 517 finished with value: 0.5505868554115295 and parameters: {'fp_type': 'morgan_rdkit', 'combined_morgan_radius': 3, 'combined_morgan_nBits': 1024, 'combined_rdkit_maxPath': 7, 'combined_rdkit_nBits': 1024, 'num_hidden_layers': 3, 'hidden_dim_0': 256, 'hidden_dim_1': 1024, 'hidden_dim_2': 64, 'kl_weight': 0.00035779533054564673, 'lr': 0.009910008603413557, 'batch_size': 128, 'dropout_rate': 0.15738075950202013, 'prior_mu': -0.018241742082123123, 'prior_sigma': 0.08615834652966711, 'normalization': 'layer'}. Best is trial 505 with value: 0.4575017273426056.
Generating rdkit fingerprints...
Generated fingerprints with 256 features for 841 molecules
Trial 513: 5-fold CV loss = 0.4674
[I 2025-08-07 18:45:19,573] Trial 513 finished with value: 0.4674017786979675 and parameters: {'fp_type': 'morgan_rdkit', 'combined_morgan_radius': 3, 'combined_morgan_nBits': 1024, 'combined_rdkit_maxPath': 7, 'combined_rdkit_nBits': 1024, 'num_hidden_layers': 3, 'hidden_dim_0': 256, 'hidden_dim_1': 1024, 'hidden_dim_2': 64, 'kl_weight': 0.0003062863738288584, 'lr': 0.007264031730693853, 'batch_size': 128, 'dropout_rate': 0.14008157977533028, 'prior_mu': -0.03282334901396326, 'prior_sigma': 0.08819896238613312, 'normalization': 'layer'}. Best is trial 505 with value: 0.4575017273426056.
Generating morgan_rdkit fingerprints...
Generated fingerprints with 1280 features for 841 molecules
Trial 518: 5-fold CV loss = 0.7892
[I 2025-08-07 18:45:29,294] Trial 518 finished with value: 0.7892066240310669 and parameters: {'fp_type': 'rdkit', 'rdkit_only_maxPath': 6, 'rdkit_only_nBits': 256, 'num_hidden_layers': 3, 'hidden_dim_0': 256, 'hidden_dim_1': 1024, 'hidden_dim_2': 128, 'kl_weight': 0.0002641850813490333, 'lr': 0.009030002555993977, 'batch_size': 128, 'dropout_rate': 0.12387064965439923, 'prior_mu': -0.01819573090289379, 'prior_sigma': 0.07640985332024845, 'normalization': 'layer'}. Best is trial 505 with value: 0.4575017273426056.
Generating morgan_rdkit fingerprints...
Generated fingerprints with 1280 features for 841 molecules
Trial 520: 5-fold CV loss = 0.6757
[I 2025-08-07 18:45:36,569] Trial 520 finished with value: 0.6757203161716461 and parameters: {'fp_type': 'rdkit', 'rdkit_only_maxPath': 6, 'rdkit_only_nBits': 256, 'num_hidden_layers': 3, 'hidden_dim_0': 256, 'hidden_dim_1': 1024, 'hidden_dim_2': 64, 'kl_weight': 0.0002603175668600318, 'lr': 0.008806719626186897, 'batch_size': 128, 'dropout_rate': 0.12064040318316671, 'prior_mu': -0.051247174060408254, 'prior_sigma': 0.07669285332309515, 'normalization': 'layer'}. Best is trial 505 with value: 0.4575017273426056.
Generating morgan_rdkit fingerprints...
Generated fingerprints with 1280 features for 841 molecules
Trial 519: 5-fold CV loss = 0.6326
[I 2025-08-07 18:45:50,381] Trial 519 finished with value: 0.6326057195663453 and parameters: {'fp_type': 'rdkit', 'rdkit_only_maxPath': 6, 'rdkit_only_nBits': 256, 'num_hidden_layers': 3, 'hidden_dim_0': 256, 'hidden_dim_1': 1024, 'hidden_dim_2': 64, 'kl_weight': 0.00026222412950346213, 'lr': 0.009452542203934223, 'batch_size': 128, 'dropout_rate': 0.15477411838211053, 'prior_mu': -0.05699725987188895, 'prior_sigma': 0.07545281511095615, 'normalization': 'layer'}. Best is trial 505 with value: 0.4575017273426056.
Generating morgan_rdkit fingerprints...
Generated fingerprints with 2048 features for 841 molecules
Trial 523: 5-fold CV loss = 0.5166
[I 2025-08-07 18:46:08,731] Trial 523 finished with value: 0.5166286349296569 and parameters: {'fp_type': 'morgan_rdkit', 'combined_morgan_radius': 3, 'combined_morgan_nBits': 1024, 'combined_rdkit_maxPath': 7, 'combined_rdkit_nBits': 256, 'num_hidden_layers': 3, 'hidden_dim_0': 256, 'hidden_dim_1': 1024, 'hidden_dim_2': 64, 'kl_weight': 0.00028882015917560414, 'lr': 0.006900872795330692, 'batch_size': 128, 'dropout_rate': 0.15425837766742484, 'prior_mu': -0.020206740651232562, 'prior_sigma': 0.09371569770366515, 'normalization': 'layer'}. Best is trial 505 with value: 0.4575017273426056.
Generating morgan_rdkit fingerprints...
Generated fingerprints with 2048 features for 841 molecules
Trial 522: 5-fold CV loss = 0.5035
[I 2025-08-07 18:46:17,396] Trial 522 finished with value: 0.5035486340522766 and parameters: {'fp_type': 'morgan_rdkit', 'combined_morgan_radius': 3, 'combined_morgan_nBits': 1024, 'combined_rdkit_maxPath': 6, 'combined_rdkit_nBits': 256, 'num_hidden_layers': 3, 'hidden_dim_0': 256, 'hidden_dim_1': 1024, 'hidden_dim_2': 64, 'kl_weight': 0.000285878231696946, 'lr': 0.00657937257274273, 'batch_size': 128, 'dropout_rate': 0.13364315908077706, 'prior_mu': -0.02109359289988452, 'prior_sigma': 0.09209688581921549, 'normalization': 'layer'}. Best is trial 505 with value: 0.4575017273426056.
Generating morgan_rdkit fingerprints...
Generated fingerprints with 2048 features for 841 molecules
Trial 521: 5-fold CV loss = 0.5160
[I 2025-08-07 18:46:28,390] Trial 521 finished with value: 0.5160286247730255 and parameters: {'fp_type': 'morgan_rdkit', 'combined_morgan_radius': 3, 'combined_morgan_nBits': 1024, 'combined_rdkit_maxPath': 7, 'combined_rdkit_nBits': 256, 'num_hidden_layers': 3, 'hidden_dim_0': 256, 'hidden_dim_1': 1024, 'hidden_dim_2': 64, 'kl_weight': 0.0002698615584610292, 'lr': 0.008812143251555679, 'batch_size': 128, 'dropout_rate': 0.13169302691067705, 'prior_mu': -0.05421165481727311, 'prior_sigma': 0.07662036080693434, 'normalization': 'layer'}. Best is trial 505 with value: 0.4575017273426056.
Generating morgan_rdkit fingerprints...
Generated fingerprints with 2048 features for 841 molecules
Trial 525: 5-fold CV loss = 0.4733
[I 2025-08-07 18:46:38,194] Trial 525 finished with value: 0.4732837975025177 and parameters: {'fp_type': 'morgan_rdkit', 'combined_morgan_radius': 3, 'combined_morgan_nBits': 1024, 'combined_rdkit_maxPath': 6, 'combined_rdkit_nBits': 1024, 'num_hidden_layers': 3, 'hidden_dim_0': 256, 'hidden_dim_1': 1024, 'hidden_dim_2': 64, 'kl_weight': 0.00042262898321303256, 'lr': 0.007985091903016016, 'batch_size': 128, 'dropout_rate': 0.13770543871322807, 'prior_mu': -0.015448339773154848, 'prior_sigma': 0.08205979408248221, 'normalization': 'layer'}. Best is trial 505 with value: 0.4575017273426056.
Generating morgan_rdkit fingerprints...
Generated fingerprints with 2048 features for 841 molecules
Trial 524: 5-fold CV loss = 0.4585
