[I 2025-08-07 22:32:18,093] Trial 1666 finished with value: 0.8826511263847351 and parameters: {'fp_type': 'morgan_rdkit', 'combined_morgan_radius': 3, 'combined_morgan_nBits': 1024, 'combined_rdkit_maxPath': 7, 'combined_rdkit_nBits': 1024, 'num_hidden_layers': 0, 'kl_weight': 0.0004605252467262243, 'lr': 0.009060705590799958, 'batch_size': 128, 'dropout_rate': 0.12938600599914843, 'prior_mu': -0.03622210933294946, 'prior_sigma': 0.059895919851739435, 'normalization': 'layer'}. Best is trial 896 with value: 0.4533553242683411.
Generating morgan fingerprints...
Generated fingerprints with 1024 features for 841 molecules
Trial 1668: 5-fold CV loss = 0.4699
[I 2025-08-07 22:32:45,574] Trial 1668 finished with value: 0.4698828339576721 and parameters: {'fp_type': 'morgan_rdkit', 'combined_morgan_radius': 3, 'combined_morgan_nBits': 1024, 'combined_rdkit_maxPath': 7, 'combined_rdkit_nBits': 1024, 'num_hidden_layers': 3, 'hidden_dim_0': 128, 'hidden_dim_1': 1024, 'hidden_dim_2': 64, 'kl_weight': 0.0003714259174089879, 'lr': 0.00915205315686354, 'batch_size': 128, 'dropout_rate': 0.09515770202916678, 'prior_mu': -0.03657465083003959, 'prior_sigma': 0.08488295355683728, 'normalization': 'layer'}. Best is trial 896 with value: 0.4533553242683411.
Generating morgan fingerprints...
Generated fingerprints with 1024 features for 841 molecules
Trial 1669: 5-fold CV loss = 0.5252
[I 2025-08-07 22:32:49,518] Trial 1669 finished with value: 0.5251705288887024 and parameters: {'fp_type': 'morgan', 'morgan_only_radius': 2, 'morgan_only_nBits': 1024, 'num_hidden_layers': 3, 'hidden_dim_0': 256, 'hidden_dim_1': 1024, 'hidden_dim_2': 64, 'kl_weight': 0.00036107131127198754, 'lr': 0.00817985933853213, 'batch_size': 128, 'dropout_rate': 0.09428784873429888, 'prior_mu': -0.042958159799217896, 'prior_sigma': 0.08599446169029616, 'normalization': 'layer'}. Best is trial 896 with value: 0.4533553242683411.
Generating morgan_rdkit fingerprints...
Generated fingerprints with 2048 features for 841 molecules
Trial 1667: 5-fold CV loss = 0.4671
[I 2025-08-07 22:32:52,560] Trial 1667 finished with value: 0.46709474325180056 and parameters: {'fp_type': 'morgan_rdkit', 'combined_morgan_radius': 3, 'combined_morgan_nBits': 1024, 'combined_rdkit_maxPath': 7, 'combined_rdkit_nBits': 1024, 'num_hidden_layers': 3, 'hidden_dim_0': 256, 'hidden_dim_1': 1024, 'hidden_dim_2': 64, 'kl_weight': 0.0004500594427751153, 'lr': 0.007163792320454288, 'batch_size': 128, 'dropout_rate': 0.12629779759539358, 'prior_mu': -0.037291695702489545, 'prior_sigma': 0.08542862855339937, 'normalization': 'layer'}. Best is trial 896 with value: 0.4533553242683411.
Generating morgan_rdkit fingerprints...
Generated fingerprints with 2048 features for 841 molecules
Trial 1670: 5-fold CV loss = 0.5797
[I 2025-08-07 22:33:06,625] Trial 1670 finished with value: 0.5797278404235839 and parameters: {'fp_type': 'morgan', 'morgan_only_radius': 2, 'morgan_only_nBits': 1024, 'num_hidden_layers': 3, 'hidden_dim_0': 256, 'hidden_dim_1': 1024, 'hidden_dim_2': 64, 'kl_weight': 0.056755461841464766, 'lr': 0.008096066425541882, 'batch_size': 128, 'dropout_rate': 0.09792457887580039, 'prior_mu': -0.04553883133721604, 'prior_sigma': 0.05201551737655445, 'normalization': 'layer'}. Best is trial 896 with value: 0.4533553242683411.
Generating morgan_rdkit fingerprints...
Generated fingerprints with 2048 features for 841 molecules
Trial 1665: 5-fold CV loss = 0.4650
[I 2025-08-07 22:33:21,935] Trial 1665 finished with value: 0.4650487959384918 and parameters: {'fp_type': 'morgan_rdkit', 'combined_morgan_radius': 3, 'combined_morgan_nBits': 1024, 'combined_rdkit_maxPath': 7, 'combined_rdkit_nBits': 1024, 'num_hidden_layers': 3, 'hidden_dim_0': 256, 'hidden_dim_1': 1024, 'hidden_dim_2': 64, 'kl_weight': 0.00044845623933879874, 'lr': 0.0070175869537892595, 'batch_size': 128, 'dropout_rate': 0.12849311193469237, 'prior_mu': -0.03475801854689369, 'prior_sigma': 0.060482717591467644, 'normalization': 'layer'}. Best is trial 896 with value: 0.4533553242683411.
Generating morgan_rdkit fingerprints...
Generated fingerprints with 2048 features for 841 molecules
Trial 1672: 5-fold CV loss = 0.4715
[I 2025-08-07 22:33:36,224] Trial 1672 finished with value: 0.4714725613594055 and parameters: {'fp_type': 'morgan_rdkit', 'combined_morgan_radius': 3, 'combined_morgan_nBits': 1024, 'combined_rdkit_maxPath': 7, 'combined_rdkit_nBits': 1024, 'num_hidden_layers': 3, 'hidden_dim_0': 256, 'hidden_dim_1': 1024, 'hidden_dim_2': 64, 'kl_weight': 0.0005395126811283969, 'lr': 0.007009158174365069, 'batch_size': 128, 'dropout_rate': 0.10589053544125714, 'prior_mu': -0.032503351829569246, 'prior_sigma': 0.09688964534319092, 'normalization': 'layer'}. Best is trial 896 with value: 0.4533553242683411.
Generating morgan_rdkit fingerprints...
Generated fingerprints with 2048 features for 841 molecules
Trial 1673: 5-fold CV loss = 0.4702
[I 2025-08-07 22:33:40,503] Trial 1673 finished with value: 0.47018571496009826 and parameters: {'fp_type': 'morgan_rdkit', 'combined_morgan_radius': 3, 'combined_morgan_nBits': 1024, 'combined_rdkit_maxPath': 7, 'combined_rdkit_nBits': 1024, 'num_hidden_layers': 3, 'hidden_dim_0': 256, 'hidden_dim_1': 1024, 'hidden_dim_2': 64, 'kl_weight': 0.0005210599880884144, 'lr': 0.006816311045304809, 'batch_size': 128, 'dropout_rate': 0.10705542326083559, 'prior_mu': -0.03238297554063137, 'prior_sigma': 0.06302892064775673, 'normalization': 'layer'}. Best is trial 896 with value: 0.4533553242683411.
Generating morgan_rdkit fingerprints...
Generated fingerprints with 2048 features for 841 molecules
Trial 1671: 5-fold CV loss = 0.4671
[I 2025-08-07 22:33:56,100] Trial 1671 finished with value: 0.46711374521255494 and parameters: {'fp_type': 'morgan_rdkit', 'combined_morgan_radius': 3, 'combined_morgan_nBits': 1024, 'combined_rdkit_maxPath': 7, 'combined_rdkit_nBits': 1024, 'num_hidden_layers': 3, 'hidden_dim_0': 256, 'hidden_dim_1': 1024, 'hidden_dim_2': 64, 'kl_weight': 0.00041517567425354183, 'lr': 0.0070372722902725705, 'batch_size': 128, 'dropout_rate': 0.4265644042857974, 'prior_mu': -0.032733721429201966, 'prior_sigma': 0.08557258925118477, 'normalization': 'layer'}. Best is trial 896 with value: 0.4533553242683411.
Generating morgan_rdkit fingerprints...
Generated fingerprints with 2048 features for 841 molecules
Trial 1676: 5-fold CV loss = 0.4611
[I 2025-08-07 22:34:15,041] Trial 1676 finished with value: 0.46105814576148985 and parameters: {'fp_type': 'morgan_rdkit', 'combined_morgan_radius': 3, 'combined_morgan_nBits': 1024, 'combined_rdkit_maxPath': 7, 'combined_rdkit_nBits': 1024, 'num_hidden_layers': 3, 'hidden_dim_0': 256, 'hidden_dim_1': 1024, 'hidden_dim_2': 64, 'kl_weight': 0.0003678818722836684, 'lr': 0.007629167973761761, 'batch_size': 128, 'dropout_rate': 0.11890083347084132, 'prior_mu': -0.08072417428541726, 'prior_sigma': 0.09215811067734549, 'normalization': 'layer'}. Best is trial 896 with value: 0.4533553242683411.
Generating morgan_rdkit fingerprints...
Generated fingerprints with 2048 features for 841 molecules
Trial 1675: 5-fold CV loss = 0.4693
[I 2025-08-07 22:34:17,693] Trial 1675 finished with value: 0.46925758719444277 and parameters: {'fp_type': 'morgan_rdkit', 'combined_morgan_radius': 3, 'combined_morgan_nBits': 1024, 'combined_rdkit_maxPath': 7, 'combined_rdkit_nBits': 1024, 'num_hidden_layers': 3, 'hidden_dim_0': 256, 'hidden_dim_1': 1024, 'hidden_dim_2': 64, 'kl_weight': 0.00037062027330260976, 'lr': 0.007463867905815526, 'batch_size': 128, 'dropout_rate': 0.12257619348785825, 'prior_mu': -0.06257063948301556, 'prior_sigma': 0.06406255977916397, 'normalization': 'layer'}. Best is trial 896 with value: 0.4533553242683411.
Generating morgan_rdkit fingerprints...
Generated fingerprints with 2048 features for 841 molecules
Trial 1674: 5-fold CV loss = 0.4628
[I 2025-08-07 22:34:34,007] Trial 1674 finished with value: 0.4628336846828461 and parameters: {'fp_type': 'morgan_rdkit', 'combined_morgan_radius': 3, 'combined_morgan_nBits': 1024, 'combined_rdkit_maxPath': 7, 'combined_rdkit_nBits': 1024, 'num_hidden_layers': 3, 'hidden_dim_0': 256, 'hidden_dim_1': 1024, 'hidden_dim_2': 64, 'kl_weight': 0.0005291400980008738, 'lr': 0.006750492272041731, 'batch_size': 128, 'dropout_rate': 0.10716741157087649, 'prior_mu': -0.07562671646435623, 'prior_sigma': 0.06245349180512667, 'normalization': 'layer'}. Best is trial 896 with value: 0.4533553242683411.
Generating morgan_rdkit fingerprints...
Generated fingerprints with 2048 features for 841 molecules
Trial 1678: 5-fold CV loss = 0.7951
[I 2025-08-07 22:34:38,304] Trial 1678 finished with value: 0.7951352715492248 and parameters: {'fp_type': 'morgan_rdkit', 'combined_morgan_radius': 3, 'combined_morgan_nBits': 1024, 'combined_rdkit_maxPath': 7, 'combined_rdkit_nBits': 1024, 'num_hidden_layers': 3, 'hidden_dim_0': 256, 'hidden_dim_1': 1024, 'hidden_dim_2': 512, 'kl_weight': 0.0003516382836057886, 'lr': 0.008489045618261639, 'batch_size': 128, 'dropout_rate': 0.11482432749043017, 'prior_mu': -0.056948306580667706, 'prior_sigma': 0.0895828118756495, 'normalization': 'layer'}. Best is trial 896 with value: 0.4533553242683411.
Generating morgan_rdkit fingerprints...
Generated fingerprints with 2048 features for 841 molecules
Trial 1677: 5-fold CV loss = 0.4641
[I 2025-08-07 22:34:46,405] Trial 1677 finished with value: 0.46410109400749205 and parameters: {'fp_type': 'morgan_rdkit', 'combined_morgan_radius': 3, 'combined_morgan_nBits': 1024, 'combined_rdkit_maxPath': 7, 'combined_rdkit_nBits': 1024, 'num_hidden_layers': 3, 'hidden_dim_0': 256, 'hidden_dim_1': 1024, 'hidden_dim_2': 64, 'kl_weight': 0.0003554782830768261, 'lr': 0.008388752476487307, 'batch_size': 128, 'dropout_rate': 0.11845296911465966, 'prior_mu': -0.05647317407862438, 'prior_sigma': 0.0899756934812722, 'normalization': 'layer'}. Best is trial 896 with value: 0.4533553242683411.
Generating morgan_rdkit fingerprints...
Generated fingerprints with 2048 features for 841 molecules
Trial 1679: 5-fold CV loss = 0.5812
[I 2025-08-07 22:34:56,449] Trial 1679 finished with value: 0.5812413394451141 and parameters: {'fp_type': 'morgan_rdkit', 'combined_morgan_radius': 3, 'combined_morgan_nBits': 1024, 'combined_rdkit_maxPath': 5, 'combined_rdkit_nBits': 1024, 'num_hidden_layers': 3, 'hidden_dim_0': 256, 'hidden_dim_1': 1024, 'hidden_dim_2': 512, 'kl_weight': 0.00034557384713824037, 'lr': 0.008528110267302259, 'batch_size': 128, 'dropout_rate': 0.11285085800452108, 'prior_mu': -0.039862936673855945, 'prior_sigma': 0.08989271729513532, 'normalization': 'layer'}. Best is trial 896 with value: 0.4533553242683411.
Generating morgan_rdkit fingerprints...
Generated fingerprints with 2048 features for 841 molecules
Trial 1681: 5-fold CV loss = 0.4871
[I 2025-08-07 22:35:05,547] Trial 1681 finished with value: 0.4871066153049469 and parameters: {'fp_type': 'morgan_rdkit', 'combined_morgan_radius': 3, 'combined_morgan_nBits': 1024, 'combined_rdkit_maxPath': 5, 'combined_rdkit_nBits': 1024, 'num_hidden_layers': 3, 'hidden_dim_0': 256, 'hidden_dim_1': 1024, 'hidden_dim_2': 64, 'kl_weight': 0.000423881632615123, 'lr': 0.008483206293606134, 'batch_size': 128, 'dropout_rate': 0.08268005890837606, 'prior_mu': -0.04562399076083952, 'prior_sigma': 0.0990985767047944, 'normalization': 'layer'}. Best is trial 896 with value: 0.4533553242683411.
Generating morgan_rdkit fingerprints...
Generated fingerprints with 2048 features for 841 molecules
Trial 1683: 5-fold CV loss = 0.4662
[I 2025-08-07 22:35:36,325] Trial 1683 finished with value: 0.4661516070365906 and parameters: {'fp_type': 'morgan_rdkit', 'combined_morgan_radius': 3, 'combined_morgan_nBits': 1024, 'combined_rdkit_maxPath': 7, 'combined_rdkit_nBits': 1024, 'num_hidden_layers': 3, 'hidden_dim_0': 256, 'hidden_dim_1': 64, 'hidden_dim_2': 64, 'kl_weight': 0.00040823556326888315, 'lr': 0.009370973219924174, 'batch_size': 128, 'dropout_rate': 0.08130509800529641, 'prior_mu': -0.02867946424035795, 'prior_sigma': 0.06880454426613675, 'normalization': 'layer'}. Best is trial 896 with value: 0.4533553242683411.
Generating morgan_rdkit fingerprints...
Generated fingerprints with 2048 features for 841 molecules
Trial 1684: 5-fold CV loss = 0.5445
[I 2025-08-07 22:35:38,974] Trial 1684 finished with value: 0.5444920182228088 and parameters: {'fp_type': 'morgan_rdkit', 'combined_morgan_radius': 3, 'combined_morgan_nBits': 1024, 'combined_rdkit_maxPath': 7, 'combined_rdkit_nBits': 1024, 'num_hidden_layers': 3, 'hidden_dim_0': 256, 'hidden_dim_1': 64, 'hidden_dim_2': 64, 'kl_weight': 0.00040492284114009876, 'lr': 0.009996497299690148, 'batch_size': 128, 'dropout_rate': 0.09981452667425682, 'prior_mu': -0.02856993655902955, 'prior_sigma': 0.10697042564534961, 'normalization': 'layer'}. Best is trial 896 with value: 0.4533553242683411.
Generating morgan_rdkit fingerprints...
Generated fingerprints with 2048 features for 841 molecules
Trial 1680: 5-fold CV loss = 0.4856
[I 2025-08-07 22:35:43,781] Trial 1680 finished with value: 0.4855846405029297 and parameters: {'fp_type': 'morgan_rdkit', 'combined_morgan_radius': 3, 'combined_morgan_nBits': 1024, 'combined_rdkit_maxPath': 5, 'combined_rdkit_nBits': 1024, 'num_hidden_layers': 3, 'hidden_dim_0': 256, 'hidden_dim_1': 1024, 'hidden_dim_2': 64, 'kl_weight': 0.00035487746908977817, 'lr': 0.008543197718451313, 'batch_size': 128, 'dropout_rate': 0.008694908162788062, 'prior_mu': -0.044308448005285384, 'prior_sigma': 0.09017641460429619, 'normalization': 'layer'}. Best is trial 896 with value: 0.4533553242683411.
Generating morgan_rdkit fingerprints...
Generated fingerprints with 2048 features for 841 molecules
Trial 1682: 5-fold CV loss = 0.4621
[I 2025-08-07 22:35:55,195] Trial 1682 finished with value: 0.4621106445789337 and parameters: {'fp_type': 'morgan_rdkit', 'combined_morgan_radius': 3, 'combined_morgan_nBits': 1024, 'combined_rdkit_maxPath': 7, 'combined_rdkit_nBits': 1024, 'num_hidden_layers': 3, 'hidden_dim_0': 256, 'hidden_dim_1': 64, 'hidden_dim_2': 64, 'kl_weight': 0.0004121735356568154, 'lr': 0.00924092086988894, 'batch_size': 128, 'dropout_rate': 0.08639881578601512, 'prior_mu': -0.042579596811640745, 'prior_sigma': 0.09965991341868766, 'normalization': 'layer'}. Best is trial 896 with value: 0.4533553242683411.
Generating morgan_rdkit fingerprints...
Generated fingerprints with 2048 features for 841 molecules
Trial 1685: 5-fold CV loss = 0.5597
[I 2025-08-07 22:36:14,015] Trial 1685 finished with value: 0.5596819818019867 and parameters: {'fp_type': 'morgan_rdkit', 'combined_morgan_radius': 3, 'combined_morgan_nBits': 1024, 'combined_rdkit_maxPath': 7, 'combined_rdkit_nBits': 1024, 'num_hidden_layers': 3, 'hidden_dim_0': 256, 'hidden_dim_1': 1024, 'hidden_dim_2': 64, 'kl_weight': 0.00041045274988446237, 'lr': 0.007821960456903332, 'batch_size': 128, 'dropout_rate': 0.09331196075351875, 'prior_mu': -0.04389689926160641, 'prior_sigma': 0.09775786945392517, 'normalization': 'layer'}. Best is trial 896 with value: 0.4533553242683411.
Generating morgan_rdkit fingerprints...
Generated fingerprints with 2048 features for 841 molecules
Trial 1686: 5-fold CV loss = 0.4659
[I 2025-08-07 22:36:16,969] Trial 1686 finished with value: 0.46587916612625124 and parameters: {'fp_type': 'morgan_rdkit', 'combined_morgan_radius': 3, 'combined_morgan_nBits': 1024, 'combined_rdkit_maxPath': 7, 'combined_rdkit_nBits': 1024, 'num_hidden_layers': 3, 'hidden_dim_0': 256, 'hidden_dim_1': 1024, 'hidden_dim_2': 64, 'kl_weight': 0.0006839039508638543, 'lr': 0.0077326715761166665, 'batch_size': 128, 'dropout_rate': 0.09008044035178937, 'prior_mu': -0.04430414946485066, 'prior_sigma': 0.09748532548916627, 'normalization': 'layer'}. Best is trial 896 with value: 0.4533553242683411.
Generating morgan_rdkit fingerprints...
Generated fingerprints with 2048 features for 841 molecules
Trial 1690: 5-fold CV loss = 0.8019
[I 2025-08-07 22:36:40,780] Trial 1690 finished with value: 0.8018907010555267 and parameters: {'fp_type': 'morgan_rdkit', 'combined_morgan_radius': 3, 'combined_morgan_nBits': 1024, 'combined_rdkit_maxPath': 7, 'combined_rdkit_nBits': 1024, 'num_hidden_layers': 3, 'hidden_dim_0': 256, 'hidden_dim_1': 1024, 'hidden_dim_2': 1024, 'kl_weight': 0.0004928625078411056, 'lr': 0.006719885450655096, 'batch_size': 128, 'dropout_rate': 0.05997924977200148, 'prior_mu': -0.05355883785259873, 'prior_sigma': 0.06957283979809423, 'normalization': 'layer'}. Best is trial 896 with value: 0.4533553242683411.
Generating morgan_rdkit fingerprints...
Generated fingerprints with 2048 features for 841 molecules
Trial 1688: 5-fold CV loss = 0.4658
[I 2025-08-07 22:36:48,715] Trial 1688 finished with value: 0.4658038020133972 and parameters: {'fp_type': 'morgan_rdkit', 'combined_morgan_radius': 3, 'combined_morgan_nBits': 1024, 'combined_rdkit_maxPath': 7, 'combined_rdkit_nBits': 1024, 'num_hidden_layers': 3, 'hidden_dim_0': 256, 'hidden_dim_1': 1024, 'hidden_dim_2': 64, 'kl_weight': 0.0007503863935894898, 'lr': 0.00755116577829051, 'batch_size': 128, 'dropout_rate': 0.09232301406069467, 'prior_mu': -0.05442534044680864, 'prior_sigma': 0.06927098925776164, 'normalization': 'layer'}. Best is trial 896 with value: 0.4533553242683411.
Generating morgan_rdkit fingerprints...
Generated fingerprints with 2048 features for 841 molecules
Trial 1689: 5-fold CV loss = 0.7336
[I 2025-08-07 22:36:53,642] Trial 1689 finished with value: 0.7335876226425171 and parameters: {'fp_type': 'morgan_rdkit', 'combined_morgan_radius': 3, 'combined_morgan_nBits': 1024, 'combined_rdkit_maxPath': 7, 'combined_rdkit_nBits': 1024, 'num_hidden_layers': 3, 'hidden_dim_0': 256, 'hidden_dim_1': 1024, 'hidden_dim_2': 1024, 'kl_weight': 0.00034044770738755203, 'lr': 0.006648426270733405, 'batch_size': 128, 'dropout_rate': 0.05556329601260569, 'prior_mu': -0.0523426588687768, 'prior_sigma': 0.0692182730506048, 'normalization': 'layer'}. Best is trial 896 with value: 0.4533553242683411.
Generating morgan_rdkit fingerprints...
Generated fingerprints with 2048 features for 841 molecules
Trial 1687: 5-fold CV loss = 0.4675
[I 2025-08-07 22:37:09,509] Trial 1687 finished with value: 0.4675341069698334 and parameters: {'fp_type': 'morgan_rdkit', 'combined_morgan_radius': 3, 'combined_morgan_nBits': 1024, 'combined_rdkit_maxPath': 7, 'combined_rdkit_nBits': 1024, 'num_hidden_layers': 3, 'hidden_dim_0': 256, 'hidden_dim_1': 1024, 'hidden_dim_2': 64, 'kl_weight': 0.0004972594013561476, 'lr': 0.007539506261801258, 'batch_size': 128, 'dropout_rate': 0.09311308062705267, 'prior_mu': -0.0537379413217566, 'prior_sigma': 0.09587370034184181, 'normalization': 'layer'}. Best is trial 896 with value: 0.4533553242683411.
Generating morgan_rdkit fingerprints...
Generated fingerprints with 2048 features for 841 molecules
Trial 1691: 5-fold CV loss = 0.4720
[I 2025-08-07 22:37:16,960] Trial 1691 finished with value: 0.47195249795913696 and parameters: {'fp_type': 'morgan_rdkit', 'combined_morgan_radius': 3, 'combined_morgan_nBits': 1024, 'combined_rdkit_maxPath': 7, 'combined_rdkit_nBits': 1024, 'num_hidden_layers': 3, 'hidden_dim_0': 256, 'hidden_dim_1': 1024, 'hidden_dim_2': 64, 'kl_weight': 0.0003405112199156327, 'lr': 0.006834695995568697, 'batch_size': 128, 'dropout_rate': 0.12961480252693042, 'prior_mu': -0.06426942523569887, 'prior_sigma': 0.07126405600080499, 'normalization': 'layer'}. Best is trial 896 with value: 0.4533553242683411.
Generating rdkit fingerprints...
Generated fingerprints with 512 features for 841 molecules
Trial 1692: 5-fold CV loss = 0.5064
[I 2025-08-07 22:37:22,134] Trial 1692 finished with value: 0.5063956320285797 and parameters: {'fp_type': 'morgan_rdkit', 'combined_morgan_radius': 3, 'combined_morgan_nBits': 1024, 'combined_rdkit_maxPath': 7, 'combined_rdkit_nBits': 1024, 'num_hidden_layers': 1, 'hidden_dim_0': 128, 'kl_weight': 0.0012530112030473815, 'lr': 0.006866333205194854, 'batch_size': 128, 'dropout_rate': 0.13107610565788175, 'prior_mu': -0.03026020976794414, 'prior_sigma': 0.08268849907861418, 'normalization': 'layer'}. Best is trial 896 with value: 0.4533553242683411.
Generating rdkit fingerprints...
Generated fingerprints with 512 features for 841 molecules
Trial 1695: 5-fold CV loss = 0.8872
[I 2025-08-07 22:37:31,221] Trial 1695 finished with value: 0.8872299075126648 and parameters: {'fp_type': 'rdkit', 'rdkit_only_maxPath': 7, 'rdkit_only_nBits': 512, 'num_hidden_layers': 3, 'hidden_dim_0': 256, 'hidden_dim_1': 1024, 'hidden_dim_2': 64, 'kl_weight': 0.0005951784253807298, 'lr': 0.006313579519725238, 'batch_size': 128, 'dropout_rate': 0.042094631235938484, 'prior_mu': -0.02782217632274859, 'prior_sigma': 0.1870664331741388, 'normalization': 'layer'}. Best is trial 896 with value: 0.4533553242683411.
Generating morgan_rdkit fingerprints...
Generated fingerprints with 1280 features for 841 molecules
Trial 1693: 5-fold CV loss = 0.7350
[I 2025-08-07 22:37:32,819] Trial 1693 finished with value: 0.7350451111793518 and parameters: {'fp_type': 'morgan_rdkit', 'combined_morgan_radius': 3, 'combined_morgan_nBits': 1024, 'combined_rdkit_maxPath': 7, 'combined_rdkit_nBits': 1024, 'num_hidden_layers': 3, 'hidden_dim_0': 256, 'hidden_dim_1': 1024, 'hidden_dim_2': 64, 'kl_weight': 0.0003382750187552024, 'lr': 0.006499678412640231, 'batch_size': 128, 'dropout_rate': 0.12946563038003173, 'prior_mu': -0.02766727790520629, 'prior_sigma': 0.18537041672297166, 'normalization': 'layer'}. Best is trial 896 with value: 0.4533553242683411.
Generating morgan_rdkit fingerprints...
Generated fingerprints with 2048 features for 841 molecules
Trial 1697: 5-fold CV loss = 0.5756
