[I 2025-08-08 00:04:52,079] Trial 2145 finished with value: 0.4679300606250763 and parameters: {'fp_type': 'morgan_rdkit', 'combined_morgan_radius': 3, 'combined_morgan_nBits': 1024, 'combined_rdkit_maxPath': 7, 'combined_rdkit_nBits': 1024, 'num_hidden_layers': 3, 'hidden_dim_0': 256, 'hidden_dim_1': 1024, 'hidden_dim_2': 64, 'kl_weight': 0.0001662017941804348, 'lr': 0.0044382918745839725, 'batch_size': 128, 'dropout_rate': 0.1354780063965504, 'prior_mu': -0.03227377503193039, 'prior_sigma': 0.09486509778178738, 'normalization': 'layer'}. Best is trial 896 with value: 0.4533553242683411.
Generating morgan_rdkit fingerprints...
Generated fingerprints with 2048 features for 841 molecules
Trial 2146: 5-fold CV loss = 0.4743
[I 2025-08-08 00:04:57,184] Trial 2146 finished with value: 0.4743482232093811 and parameters: {'fp_type': 'morgan_rdkit', 'combined_morgan_radius': 3, 'combined_morgan_nBits': 1024, 'combined_rdkit_maxPath': 7, 'combined_rdkit_nBits': 1024, 'num_hidden_layers': 3, 'hidden_dim_0': 256, 'hidden_dim_1': 1024, 'hidden_dim_2': 64, 'kl_weight': 0.00707265950921176, 'lr': 0.004709411167586615, 'batch_size': 128, 'dropout_rate': 0.15386779025726102, 'prior_mu': -0.03069445465937882, 'prior_sigma': 0.09494822626114177, 'normalization': 'layer'}. Best is trial 896 with value: 0.4533553242683411.
Generating morgan_rdkit fingerprints...
Generated fingerprints with 2048 features for 841 molecules
Trial 2147: 5-fold CV loss = 0.4670
[I 2025-08-08 00:05:10,075] Trial 2147 finished with value: 0.4670443654060364 and parameters: {'fp_type': 'morgan_rdkit', 'combined_morgan_radius': 3, 'combined_morgan_nBits': 1024, 'combined_rdkit_maxPath': 7, 'combined_rdkit_nBits': 1024, 'num_hidden_layers': 3, 'hidden_dim_0': 256, 'hidden_dim_1': 1024, 'hidden_dim_2': 64, 'kl_weight': 0.005285643608777989, 'lr': 0.005747082545038409, 'batch_size': 128, 'dropout_rate': 0.15492740716095185, 'prior_mu': -0.07962125418393343, 'prior_sigma': 0.09493575967342165, 'normalization': 'layer'}. Best is trial 896 with value: 0.4533553242683411.
Generating morgan fingerprints...
Generated fingerprints with 1024 features for 841 molecules
Trial 2151: 5-fold CV loss = 0.5271
[I 2025-08-08 00:05:31,769] Trial 2151 finished with value: 0.5270985066890717 and parameters: {'fp_type': 'morgan', 'morgan_only_radius': 2, 'morgan_only_nBits': 1024, 'num_hidden_layers': 3, 'hidden_dim_0': 256, 'hidden_dim_1': 1024, 'hidden_dim_2': 64, 'kl_weight': 0.0003796008565022894, 'lr': 0.0061196541059712175, 'batch_size': 128, 'dropout_rate': 0.15162608152404078, 'prior_mu': -0.015447633055758676, 'prior_sigma': 0.08437233787435312, 'normalization': 'layer'}. Best is trial 896 with value: 0.4533553242683411.
Generating morgan_rdkit fingerprints...
Generated fingerprints with 2048 features for 841 molecules
Trial 2150: 5-fold CV loss = 0.4701
[I 2025-08-08 00:05:34,395] Trial 2150 finished with value: 0.4701088726520538 and parameters: {'fp_type': 'morgan_rdkit', 'combined_morgan_radius': 3, 'combined_morgan_nBits': 1024, 'combined_rdkit_maxPath': 7, 'combined_rdkit_nBits': 1024, 'num_hidden_layers': 3, 'hidden_dim_0': 256, 'hidden_dim_1': 1024, 'hidden_dim_2': 64, 'kl_weight': 0.0004450552113102309, 'lr': 0.0059285676348142325, 'batch_size': 128, 'dropout_rate': 0.1528456406175667, 'prior_mu': -0.011681094557515505, 'prior_sigma': 0.08348972885716813, 'normalization': 'layer'}. Best is trial 896 with value: 0.4533553242683411.
Generating morgan_rdkit fingerprints...
Generated fingerprints with 2048 features for 841 molecules
Trial 2149: 5-fold CV loss = 0.6351
[I 2025-08-08 00:05:38,928] Trial 2149 finished with value: 0.6350714981555938 and parameters: {'fp_type': 'morgan_rdkit', 'combined_morgan_radius': 3, 'combined_morgan_nBits': 1024, 'combined_rdkit_maxPath': 7, 'combined_rdkit_nBits': 1024, 'num_hidden_layers': 3, 'hidden_dim_0': 256, 'hidden_dim_1': 1024, 'hidden_dim_2': 64, 'kl_weight': 0.0004287649165473065, 'lr': 0.005848604000564694, 'batch_size': 128, 'dropout_rate': 0.15075084969557856, 'prior_mu': -0.012431577618042255, 'prior_sigma': 0.09613666968685466, 'normalization': 'layer'}. Best is trial 896 with value: 0.4533553242683411.
Generating morgan_rdkit fingerprints...
Generated fingerprints with 2048 features for 841 molecules
Trial 2152: 5-fold CV loss = 0.5627
[I 2025-08-08 00:06:14,496] Trial 2152 finished with value: 0.5627219498157501 and parameters: {'fp_type': 'morgan_rdkit', 'combined_morgan_radius': 3, 'combined_morgan_nBits': 1024, 'combined_rdkit_maxPath': 7, 'combined_rdkit_nBits': 1024, 'num_hidden_layers': 3, 'hidden_dim_0': 256, 'hidden_dim_1': 1024, 'hidden_dim_2': 64, 'kl_weight': 0.0004309179702733477, 'lr': 0.00605216778737429, 'batch_size': 128, 'dropout_rate': 0.12357665356718811, 'prior_mu': -0.04574677234344936, 'prior_sigma': 0.08375834268361597, 'normalization': 'layer'}. Best is trial 896 with value: 0.4533553242683411.
Generating morgan_rdkit fingerprints...
Generated fingerprints with 2048 features for 841 molecules
Trial 2148: 5-fold CV loss = 0.4596
[I 2025-08-08 00:06:19,220] Trial 2148 finished with value: 0.45955740213394164 and parameters: {'fp_type': 'morgan_rdkit', 'combined_morgan_radius': 3, 'combined_morgan_nBits': 1024, 'combined_rdkit_maxPath': 7, 'combined_rdkit_nBits': 1024, 'num_hidden_layers': 3, 'hidden_dim_0': 256, 'hidden_dim_1': 1024, 'hidden_dim_2': 64, 'kl_weight': 0.0004429871222974993, 'lr': 0.005905036343500294, 'batch_size': 128, 'dropout_rate': 0.15342810009478672, 'prior_mu': -0.010436504307134649, 'prior_sigma': 0.0940131120846979, 'normalization': 'layer'}. Best is trial 896 with value: 0.4533553242683411.
Generating morgan_rdkit fingerprints...
Generated fingerprints with 2048 features for 841 molecules
Trial 2153: 5-fold CV loss = 0.5745
[I 2025-08-08 00:06:24,599] Trial 2153 finished with value: 0.5744800627231598 and parameters: {'fp_type': 'morgan_rdkit', 'combined_morgan_radius': 3, 'combined_morgan_nBits': 1024, 'combined_rdkit_maxPath': 7, 'combined_rdkit_nBits': 1024, 'num_hidden_layers': 3, 'hidden_dim_0': 256, 'hidden_dim_1': 1024, 'hidden_dim_2': 512, 'kl_weight': 0.0002775302112414071, 'lr': 0.009192136127865456, 'batch_size': 128, 'dropout_rate': 0.12788629237092253, 'prior_mu': -0.04318812140491995, 'prior_sigma': 0.09941677951746887, 'normalization': 'layer'}. Best is trial 896 with value: 0.4533553242683411.
Generating morgan_rdkit fingerprints...
Generated fingerprints with 2048 features for 841 molecules
Trial 2154: 5-fold CV loss = 0.5356
[I 2025-08-08 00:06:28,511] Trial 2154 finished with value: 0.5355656683444977 and parameters: {'fp_type': 'morgan_rdkit', 'combined_morgan_radius': 3, 'combined_morgan_nBits': 1024, 'combined_rdkit_maxPath': 7, 'combined_rdkit_nBits': 1024, 'num_hidden_layers': 1, 'hidden_dim_0': 1024, 'kl_weight': 0.00027446508256863606, 'lr': 0.006331040545663763, 'batch_size': 128, 'dropout_rate': 0.12728080239881595, 'prior_mu': -0.04467437812886411, 'prior_sigma': 0.09034707391917365, 'normalization': 'layer'}. Best is trial 896 with value: 0.4533553242683411.
Generating morgan_rdkit fingerprints...
Generated fingerprints with 2048 features for 841 molecules
Trial 2157: 5-fold CV loss = 0.4661
[I 2025-08-08 00:07:05,580] Trial 2157 finished with value: 0.4661211550235748 and parameters: {'fp_type': 'morgan_rdkit', 'combined_morgan_radius': 3, 'combined_morgan_nBits': 1024, 'combined_rdkit_maxPath': 7, 'combined_rdkit_nBits': 1024, 'num_hidden_layers': 3, 'hidden_dim_0': 1024, 'hidden_dim_1': 1024, 'hidden_dim_2': 64, 'kl_weight': 0.0002319664180842742, 'lr': 0.008073266675346696, 'batch_size': 128, 'dropout_rate': 0.1261797499316763, 'prior_mu': -0.022762148243555463, 'prior_sigma': 0.09016126406062772, 'normalization': 'layer'}. Best is trial 896 with value: 0.4533553242683411.
Generating morgan_rdkit fingerprints...
Generated fingerprints with 2048 features for 841 molecules
Trial 2156: 5-fold CV loss = 0.8072
[I 2025-08-08 00:07:15,700] Trial 2156 finished with value: 0.8072049021720886 and parameters: {'fp_type': 'morgan_rdkit', 'combined_morgan_radius': 3, 'combined_morgan_nBits': 1024, 'combined_rdkit_maxPath': 7, 'combined_rdkit_nBits': 1024, 'num_hidden_layers': 3, 'hidden_dim_0': 1024, 'hidden_dim_1': 1024, 'hidden_dim_2': 512, 'kl_weight': 0.00028391542980640654, 'lr': 0.009155436427110534, 'batch_size': 128, 'dropout_rate': 0.13001666339259177, 'prior_mu': -0.02044180864489672, 'prior_sigma': 0.09925374392607657, 'normalization': 'layer'}. Best is trial 896 with value: 0.4533553242683411.
Generating morgan_rdkit fingerprints...
Generated fingerprints with 2048 features for 841 molecules
Trial 2158: 5-fold CV loss = 0.5633
[I 2025-08-08 00:07:18,533] Trial 2158 finished with value: 0.5632655322551727 and parameters: {'fp_type': 'morgan_rdkit', 'combined_morgan_radius': 3, 'combined_morgan_nBits': 1024, 'combined_rdkit_maxPath': 7, 'combined_rdkit_nBits': 1024, 'num_hidden_layers': 3, 'hidden_dim_0': 256, 'hidden_dim_1': 1024, 'hidden_dim_2': 64, 'kl_weight': 0.00023080665459738195, 'lr': 0.008131364274243708, 'batch_size': 128, 'dropout_rate': 0.11016851519005617, 'prior_mu': 0.028067522497329335, 'prior_sigma': 0.08631643509926364, 'normalization': 'layer'}. Best is trial 896 with value: 0.4533553242683411.
Generating morgan_rdkit fingerprints...
Generated fingerprints with 2048 features for 841 molecules
Trial 2155: 5-fold CV loss = 0.4920
[I 2025-08-08 00:07:27,926] Trial 2155 finished with value: 0.4919776737689972 and parameters: {'fp_type': 'morgan_rdkit', 'combined_morgan_radius': 3, 'combined_morgan_nBits': 1024, 'combined_rdkit_maxPath': 7, 'combined_rdkit_nBits': 1024, 'num_hidden_layers': 1, 'hidden_dim_0': 1024, 'kl_weight': 0.0002771392978960851, 'lr': 0.006560304883462038, 'batch_size': 32, 'dropout_rate': 0.12521386790949854, 'prior_mu': -0.02302494228179439, 'prior_sigma': 0.09136133962450546, 'normalization': 'layer'}. Best is trial 896 with value: 0.4533553242683411.
Generating morgan_rdkit fingerprints...
Generated fingerprints with 2048 features for 841 molecules
Trial 2162: 5-fold CV loss = 0.4654
[I 2025-08-08 00:08:06,968] Trial 2162 finished with value: 0.46538594365119934 and parameters: {'fp_type': 'morgan_rdkit', 'combined_morgan_radius': 3, 'combined_morgan_nBits': 1024, 'combined_rdkit_maxPath': 7, 'combined_rdkit_nBits': 1024, 'num_hidden_layers': 3, 'hidden_dim_0': 256, 'hidden_dim_1': 1024, 'hidden_dim_2': 64, 'kl_weight': 0.0003464916988107349, 'lr': 0.007283306749852375, 'batch_size': 128, 'dropout_rate': 0.0873759668961972, 'prior_mu': -0.001473548439101996, 'prior_sigma': 0.08355400287693147, 'normalization': 'layer'}. Best is trial 896 with value: 0.4533553242683411.
Generating morgan_rdkit fingerprints...
Generated fingerprints with 2048 features for 841 molecules
Trial 2159: 5-fold CV loss = 0.4657
[I 2025-08-08 00:08:12,970] Trial 2159 finished with value: 0.4657153904438019 and parameters: {'fp_type': 'morgan_rdkit', 'combined_morgan_radius': 3, 'combined_morgan_nBits': 1024, 'combined_rdkit_maxPath': 7, 'combined_rdkit_nBits': 1024, 'num_hidden_layers': 3, 'hidden_dim_0': 256, 'hidden_dim_1': 1024, 'hidden_dim_2': 64, 'kl_weight': 0.0003460587538167731, 'lr': 0.006990417198792984, 'batch_size': 32, 'dropout_rate': 0.13727650659041635, 'prior_mu': 0.0007952674389195766, 'prior_sigma': 0.08575473881719975, 'normalization': 'layer'}. Best is trial 896 with value: 0.4533553242683411.
Generating morgan_rdkit fingerprints...
Generated fingerprints with 2048 features for 841 molecules
Trial 2163: 5-fold CV loss = 0.4660
[I 2025-08-08 00:08:49,310] Trial 2163 finished with value: 0.4660432517528534 and parameters: {'fp_type': 'morgan_rdkit', 'combined_morgan_radius': 3, 'combined_morgan_nBits': 1024, 'combined_rdkit_maxPath': 7, 'combined_rdkit_nBits': 1024, 'num_hidden_layers': 3, 'hidden_dim_0': 256, 'hidden_dim_1': 1024, 'hidden_dim_2': 64, 'kl_weight': 0.0003330404752818209, 'lr': 0.005086917738932926, 'batch_size': 128, 'dropout_rate': 0.13813030013568187, 'prior_mu': -0.03595755966460564, 'prior_sigma': 0.08596263512226138, 'normalization': 'layer'}. Best is trial 896 with value: 0.4533553242683411.
Generating morgan_rdkit fingerprints...
Generated fingerprints with 2048 features for 841 molecules
Trial 2164: 5-fold CV loss = 0.4608
[I 2025-08-08 00:08:51,428] Trial 2164 finished with value: 0.4607711732387543 and parameters: {'fp_type': 'morgan_rdkit', 'combined_morgan_radius': 3, 'combined_morgan_nBits': 1024, 'combined_rdkit_maxPath': 7, 'combined_rdkit_nBits': 1024, 'num_hidden_layers': 3, 'hidden_dim_0': 256, 'hidden_dim_1': 1024, 'hidden_dim_2': 64, 'kl_weight': 0.0005275027319494779, 'lr': 0.005256542128661383, 'batch_size': 128, 'dropout_rate': 0.10056027466495714, 'prior_mu': -0.03211797308070477, 'prior_sigma': 0.08271302809981952, 'normalization': 'layer'}. Best is trial 896 with value: 0.4533553242683411.
Generating morgan_rdkit fingerprints...
Generated fingerprints with 2048 features for 841 molecules
Trial 2161: 5-fold CV loss = 0.4670
[I 2025-08-08 00:08:59,348] Trial 2161 finished with value: 0.4669774234294891 and parameters: {'fp_type': 'morgan_rdkit', 'combined_morgan_radius': 3, 'combined_morgan_nBits': 1024, 'combined_rdkit_maxPath': 7, 'combined_rdkit_nBits': 1024, 'num_hidden_layers': 3, 'hidden_dim_0': 256, 'hidden_dim_1': 1024, 'hidden_dim_2': 64, 'kl_weight': 0.00035068562348730496, 'lr': 0.007109220339333892, 'batch_size': 32, 'dropout_rate': 0.08749934437687663, 'prior_mu': 0.0017032900483347976, 'prior_sigma': 0.08363640068894854, 'normalization': 'layer'}. Best is trial 896 with value: 0.4533553242683411.
Generating morgan_rdkit fingerprints...
Generated fingerprints with 2048 features for 841 molecules
Trial 2165: 5-fold CV loss = 0.4768
[I 2025-08-08 00:09:31,706] Trial 2165 finished with value: 0.4767616331577301 and parameters: {'fp_type': 'morgan_rdkit', 'combined_morgan_radius': 2, 'combined_morgan_nBits': 1024, 'combined_rdkit_maxPath': 7, 'combined_rdkit_nBits': 1024, 'num_hidden_layers': 3, 'hidden_dim_0': 64, 'hidden_dim_1': 1024, 'hidden_dim_2': 64, 'kl_weight': 0.00037926235052167955, 'lr': 0.00856570762833981, 'batch_size': 128, 'dropout_rate': 0.10112419140611126, 'prior_mu': -0.03608771874829954, 'prior_sigma': 0.08107443085186654, 'normalization': 'layer'}. Best is trial 896 with value: 0.4533553242683411.
Generating morgan_rdkit fingerprints...
Generated fingerprints with 2048 features for 841 molecules
Trial 2166: 5-fold CV loss = 0.4707
[I 2025-08-08 00:09:33,365] Trial 2166 finished with value: 0.4706731140613556 and parameters: {'fp_type': 'morgan_rdkit', 'combined_morgan_radius': 2, 'combined_morgan_nBits': 1024, 'combined_rdkit_maxPath': 7, 'combined_rdkit_nBits': 1024, 'num_hidden_layers': 3, 'hidden_dim_0': 512, 'hidden_dim_1': 1024, 'hidden_dim_2': 128, 'kl_weight': 0.0003910449648258563, 'lr': 0.008516191774305902, 'batch_size': 128, 'dropout_rate': 0.10946703010410701, 'prior_mu': -0.04902377239107508, 'prior_sigma': 0.09122159105659489, 'normalization': 'layer'}. Best is trial 896 with value: 0.4533553242683411.
Generating morgan_rdkit fingerprints...
Generated fingerprints with 2048 features for 841 molecules
Trial 2167: 5-fold CV loss = 0.5524
[I 2025-08-08 00:09:50,444] Trial 2167 finished with value: 0.5524406254291534 and parameters: {'fp_type': 'morgan_rdkit', 'combined_morgan_radius': 2, 'combined_morgan_nBits': 1024, 'combined_rdkit_maxPath': 7, 'combined_rdkit_nBits': 1024, 'num_hidden_layers': 3, 'hidden_dim_0': 64, 'hidden_dim_1': 1024, 'hidden_dim_2': 64, 'kl_weight': 0.0003776360704818641, 'lr': 0.008485487067755924, 'batch_size': 128, 'dropout_rate': 0.11050170073038991, 'prior_mu': -0.049902707522210155, 'prior_sigma': 0.12109882808675046, 'normalization': 'layer'}. Best is trial 896 with value: 0.4533553242683411.
Generating morgan_rdkit fingerprints...
Generated fingerprints with 2048 features for 841 molecules
Trial 2168: 5-fold CV loss = 0.4723
[I 2025-08-08 00:10:12,007] Trial 2168 finished with value: 0.4722916007041931 and parameters: {'fp_type': 'morgan_rdkit', 'combined_morgan_radius': 3, 'combined_morgan_nBits': 1024, 'combined_rdkit_maxPath': 7, 'combined_rdkit_nBits': 1024, 'num_hidden_layers': 3, 'hidden_dim_0': 512, 'hidden_dim_1': 1024, 'hidden_dim_2': 128, 'kl_weight': 0.0002360641876613456, 'lr': 0.006454947384160853, 'batch_size': 128, 'dropout_rate': 0.1086130596361625, 'prior_mu': -0.027189856705545717, 'prior_sigma': 0.0922841523448934, 'normalization': 'layer'}. Best is trial 896 with value: 0.4533553242683411.
Generating morgan_rdkit fingerprints...
Generated fingerprints with 2048 features for 841 molecules
Trial 2169: 5-fold CV loss = 0.8091
[I 2025-08-08 00:10:14,447] Trial 2169 finished with value: 0.8090619802474975 and parameters: {'fp_type': 'morgan_rdkit', 'combined_morgan_radius': 3, 'combined_morgan_nBits': 1024, 'combined_rdkit_maxPath': 7, 'combined_rdkit_nBits': 1024, 'num_hidden_layers': 3, 'hidden_dim_0': 256, 'hidden_dim_1': 64, 'hidden_dim_2': 64, 'kl_weight': 0.0003115323103364859, 'lr': 0.0008666837486839347, 'batch_size': 64, 'dropout_rate': 0.07256495595425791, 'prior_mu': -0.024913433061396338, 'prior_sigma': 0.10486633080632425, 'normalization': 'layer'}. Best is trial 896 with value: 0.4533553242683411.
Generating morgan fingerprints...
Generated fingerprints with 2048 features for 841 molecules
Trial 2170: 5-fold CV loss = 0.8780
[I 2025-08-08 00:10:29,713] Trial 2170 finished with value: 0.8779875993728637 and parameters: {'fp_type': 'morgan_rdkit', 'combined_morgan_radius': 3, 'combined_morgan_nBits': 1024, 'combined_rdkit_maxPath': 7, 'combined_rdkit_nBits': 1024, 'num_hidden_layers': 3, 'hidden_dim_0': 256, 'hidden_dim_1': 1024, 'hidden_dim_2': 64, 'kl_weight': 0.000172293682733341, 'lr': 0.0010422237074945969, 'batch_size': 64, 'dropout_rate': 0.15067151636940132, 'prior_mu': -0.02516305146031958, 'prior_sigma': 0.10345810356273631, 'normalization': 'layer'}. Best is trial 896 with value: 0.4533553242683411.
Generating morgan fingerprints...
Generated fingerprints with 2048 features for 841 molecules
Trial 2172: 5-fold CV loss = 0.5311
[I 2025-08-08 00:10:31,600] Trial 2172 finished with value: 0.5311284780502319 and parameters: {'fp_type': 'morgan', 'morgan_only_radius': 3, 'morgan_only_nBits': 2048, 'num_hidden_layers': 3, 'hidden_dim_0': 256, 'hidden_dim_1': 1024, 'hidden_dim_2': 64, 'kl_weight': 0.00017170220540600823, 'lr': 0.0076313229246113, 'batch_size': 128, 'dropout_rate': 0.15781292081576406, 'prior_mu': -0.008225119043837525, 'prior_sigma': 0.09748477173110229, 'normalization': 'layer'}. Best is trial 896 with value: 0.4533553242683411.
Generating morgan_rdkit fingerprints...
Generated fingerprints with 2048 features for 841 molecules
Trial 2160: 5-fold CV loss = 0.4718
[I 2025-08-08 00:10:36,042] Trial 2160 finished with value: 0.4718094527721405 and parameters: {'fp_type': 'morgan_rdkit', 'combined_morgan_radius': 3, 'combined_morgan_nBits': 1024, 'combined_rdkit_maxPath': 7, 'combined_rdkit_nBits': 1024, 'num_hidden_layers': 3, 'hidden_dim_0': 256, 'hidden_dim_1': 1024, 'hidden_dim_2': 64, 'kl_weight': 0.000347452650311557, 'lr': 0.00706460078169606, 'batch_size': 32, 'dropout_rate': 0.10923273928462955, 'prior_mu': -0.00031357151526889906, 'prior_sigma': 0.08669314983607429, 'normalization': 'layer'}. Best is trial 896 with value: 0.4533553242683411.
Generating morgan_rdkit fingerprints...
Generated fingerprints with 2048 features for 841 molecules
Trial 2173: 5-fold CV loss = 0.5246
[I 2025-08-08 00:11:01,962] Trial 2173 finished with value: 0.5246206164360047 and parameters: {'fp_type': 'morgan', 'morgan_only_radius': 3, 'morgan_only_nBits': 2048, 'num_hidden_layers': 3, 'hidden_dim_0': 256, 'hidden_dim_1': 1024, 'hidden_dim_2': 64, 'kl_weight': 0.0005167198473121671, 'lr': 0.0077029969573070775, 'batch_size': 128, 'dropout_rate': 0.16019623863310914, 'prior_mu': -0.009179449167889668, 'prior_sigma': 0.09775651968156011, 'normalization': 'layer'}. Best is trial 896 with value: 0.4533553242683411.
Generating morgan_rdkit fingerprints...
Generated fingerprints with 2048 features for 841 molecules
Trial 2174: 5-fold CV loss = 0.6167
[I 2025-08-08 00:11:08,063] Trial 2174 finished with value: 0.6166519284248352 and parameters: {'fp_type': 'morgan_rdkit', 'combined_morgan_radius': 3, 'combined_morgan_nBits': 1024, 'combined_rdkit_maxPath': 7, 'combined_rdkit_nBits': 1024, 'num_hidden_layers': 3, 'hidden_dim_0': 256, 'hidden_dim_1': 1024, 'hidden_dim_2': 64, 'kl_weight': 0.0696950029136884, 'lr': 0.006750894934973786, 'batch_size': 128, 'dropout_rate': 0.1356893163437092, 'prior_mu': -0.016208596392375277, 'prior_sigma': 0.0881216329177382, 'normalization': 'none'}. Best is trial 896 with value: 0.4533553242683411.
Generating morgan_rdkit fingerprints...
Generated fingerprints with 2048 features for 841 molecules
Trial 2171: 5-fold CV loss = 0.4785
[I 2025-08-08 00:11:11,953] Trial 2171 finished with value: 0.47852191925048826 and parameters: {'fp_type': 'morgan_rdkit', 'combined_morgan_radius': 3, 'combined_morgan_nBits': 1024, 'combined_rdkit_maxPath': 7, 'combined_rdkit_nBits': 1024, 'num_hidden_layers': 3, 'hidden_dim_0': 256, 'hidden_dim_1': 64, 'hidden_dim_2': 64, 'kl_weight': 0.014051291697202161, 'lr': 0.007781041338748905, 'batch_size': 64, 'dropout_rate': 0.15940148199408516, 'prior_mu': -0.009126894731087343, 'prior_sigma': 0.09761872147357052, 'normalization': 'layer'}. Best is trial 896 with value: 0.4533553242683411.
Generating morgan_rdkit fingerprints...
Generated fingerprints with 2048 features for 841 molecules
Trial 2177: 5-fold CV loss = 1.1727
