[I 2025-08-07 19:28:52,709] Trial 735 finished with value: 0.4956433415412903 and parameters: {'fp_type': 'morgan_rdkit', 'combined_morgan_radius': 3, 'combined_morgan_nBits': 1024, 'combined_rdkit_maxPath': 7, 'combined_rdkit_nBits': 512, 'num_hidden_layers': 3, 'hidden_dim_0': 256, 'hidden_dim_1': 1024, 'hidden_dim_2': 64, 'kl_weight': 0.00035211730293619646, 'lr': 0.008293363657335219, 'batch_size': 128, 'dropout_rate': 0.1597863430157594, 'prior_mu': -0.04075678687767786, 'prior_sigma': 0.12669146491735295, 'normalization': 'layer'}. Best is trial 587 with value: 0.4552353322505951.
Generating morgan_rdkit fingerprints...
Generated fingerprints with 2048 features for 841 molecules
Trial 737: 5-fold CV loss = 0.5660
[I 2025-08-07 19:29:13,348] Trial 737 finished with value: 0.5659590005874634 and parameters: {'fp_type': 'morgan_rdkit', 'combined_morgan_radius': 3, 'combined_morgan_nBits': 1024, 'combined_rdkit_maxPath': 7, 'combined_rdkit_nBits': 1024, 'num_hidden_layers': 3, 'hidden_dim_0': 256, 'hidden_dim_1': 1024, 'hidden_dim_2': 64, 'kl_weight': 0.0003371862517865898, 'lr': 0.007681606997664726, 'batch_size': 128, 'dropout_rate': 0.15799524360306139, 'prior_mu': -0.10077344346457032, 'prior_sigma': 0.12061233560091605, 'normalization': 'layer'}. Best is trial 587 with value: 0.4552353322505951.
Generating morgan_rdkit fingerprints...
Generated fingerprints with 2048 features for 841 molecules
Trial 739: 5-fold CV loss = 0.5468
[I 2025-08-07 19:29:22,188] Trial 739 finished with value: 0.5468126237392426 and parameters: {'fp_type': 'morgan_rdkit', 'combined_morgan_radius': 3, 'combined_morgan_nBits': 1024, 'combined_rdkit_maxPath': 7, 'combined_rdkit_nBits': 1024, 'num_hidden_layers': 3, 'hidden_dim_0': 256, 'hidden_dim_1': 128, 'hidden_dim_2': 64, 'kl_weight': 0.0004329078997032627, 'lr': 0.00757523969239134, 'batch_size': 128, 'dropout_rate': 0.09217510716317946, 'prior_mu': -0.00606963111603151, 'prior_sigma': 0.0802234540680775, 'normalization': 'layer'}. Best is trial 587 with value: 0.4552353322505951.
Generating morgan_rdkit fingerprints...
Generated fingerprints with 2048 features for 841 molecules
Trial 738: 5-fold CV loss = 0.5590
[I 2025-08-07 19:29:31,253] Trial 738 finished with value: 0.5590160191059113 and parameters: {'fp_type': 'morgan_rdkit', 'combined_morgan_radius': 3, 'combined_morgan_nBits': 1024, 'combined_rdkit_maxPath': 7, 'combined_rdkit_nBits': 1024, 'num_hidden_layers': 3, 'hidden_dim_0': 256, 'hidden_dim_1': 1024, 'hidden_dim_2': 64, 'kl_weight': 0.0004259940023337618, 'lr': 0.007762399171779835, 'batch_size': 128, 'dropout_rate': 0.12226215341925027, 'prior_mu': -0.007398037683873756, 'prior_sigma': 0.08077656582812748, 'normalization': 'layer'}. Best is trial 587 with value: 0.4552353322505951.
Generating morgan_rdkit fingerprints...
Generated fingerprints with 2048 features for 841 molecules
Trial 736: 5-fold CV loss = 0.5546
[I 2025-08-07 19:29:54,788] Trial 736 finished with value: 0.5545736968517303 and parameters: {'fp_type': 'morgan_rdkit', 'combined_morgan_radius': 3, 'combined_morgan_nBits': 1024, 'combined_rdkit_maxPath': 7, 'combined_rdkit_nBits': 512, 'num_hidden_layers': 3, 'hidden_dim_0': 256, 'hidden_dim_1': 1024, 'hidden_dim_2': 64, 'kl_weight': 0.00033596554199013645, 'lr': 0.008326454359407431, 'batch_size': 128, 'dropout_rate': 0.16111903387550675, 'prior_mu': -0.03944582712701135, 'prior_sigma': 0.08428963618515856, 'normalization': 'layer'}. Best is trial 587 with value: 0.4552353322505951.
Generating morgan_rdkit fingerprints...
Generated fingerprints with 2048 features for 841 molecules
Trial 741: 5-fold CV loss = 0.4646
[I 2025-08-07 19:29:59,112] Trial 741 finished with value: 0.4646055519580841 and parameters: {'fp_type': 'morgan_rdkit', 'combined_morgan_radius': 3, 'combined_morgan_nBits': 1024, 'combined_rdkit_maxPath': 7, 'combined_rdkit_nBits': 1024, 'num_hidden_layers': 3, 'hidden_dim_0': 256, 'hidden_dim_1': 1024, 'hidden_dim_2': 64, 'kl_weight': 0.00026740858053565136, 'lr': 0.008003683397061426, 'batch_size': 128, 'dropout_rate': 0.14344779815508094, 'prior_mu': -0.028471060164499608, 'prior_sigma': 0.08628053514402424, 'normalization': 'layer'}. Best is trial 587 with value: 0.4552353322505951.
Generating morgan_rdkit fingerprints...
Generated fingerprints with 2048 features for 841 molecules
Trial 740: 5-fold CV loss = 0.4603
[I 2025-08-07 19:30:05,256] Trial 740 finished with value: 0.46029162406921387 and parameters: {'fp_type': 'morgan_rdkit', 'combined_morgan_radius': 3, 'combined_morgan_nBits': 1024, 'combined_rdkit_maxPath': 7, 'combined_rdkit_nBits': 1024, 'num_hidden_layers': 3, 'hidden_dim_0': 256, 'hidden_dim_1': 1024, 'hidden_dim_2': 64, 'kl_weight': 0.0004345802279923798, 'lr': 0.00759963223462215, 'batch_size': 128, 'dropout_rate': 0.46857149011512733, 'prior_mu': -0.030488573160678788, 'prior_sigma': 0.08030825186069888, 'normalization': 'layer'}. Best is trial 587 with value: 0.4552353322505951.
Generating morgan_rdkit fingerprints...
Generated fingerprints with 2048 features for 841 molecules
Trial 744: 5-fold CV loss = 0.5694
[I 2025-08-07 19:30:52,996] Trial 744 finished with value: 0.5693910896778107 and parameters: {'fp_type': 'morgan_rdkit', 'combined_morgan_radius': 3, 'combined_morgan_nBits': 1024, 'combined_rdkit_maxPath': 7, 'combined_rdkit_nBits': 1024, 'num_hidden_layers': 3, 'hidden_dim_0': 256, 'hidden_dim_1': 1024, 'hidden_dim_2': 512, 'kl_weight': 0.0004033383526401969, 'lr': 0.009304695332097008, 'batch_size': 64, 'dropout_rate': 0.15057828390152617, 'prior_mu': -0.03182609298878765, 'prior_sigma': 0.08843114008014337, 'normalization': 'layer'}. Best is trial 587 with value: 0.4552353322505951.
Generating morgan_rdkit fingerprints...
Generated fingerprints with 2048 features for 841 molecules
Trial 742: 5-fold CV loss = 0.4679
[I 2025-08-07 19:31:09,415] Trial 742 finished with value: 0.46789708733558655 and parameters: {'fp_type': 'morgan_rdkit', 'combined_morgan_radius': 3, 'combined_morgan_nBits': 1024, 'combined_rdkit_maxPath': 7, 'combined_rdkit_nBits': 1024, 'num_hidden_layers': 3, 'hidden_dim_0': 256, 'hidden_dim_1': 1024, 'hidden_dim_2': 512, 'kl_weight': 0.00026412880844915563, 'lr': 0.008988806565788224, 'batch_size': 64, 'dropout_rate': 0.14632230696249965, 'prior_mu': -0.030635245967683685, 'prior_sigma': 0.08624619344081486, 'normalization': 'layer'}. Best is trial 587 with value: 0.4552353322505951.
Generating morgan_rdkit fingerprints...
Generated fingerprints with 2048 features for 841 molecules
Trial 745: 5-fold CV loss = 0.5546
[I 2025-08-07 19:31:18,122] Trial 745 finished with value: 0.5545750319957733 and parameters: {'fp_type': 'morgan_rdkit', 'combined_morgan_radius': 3, 'combined_morgan_nBits': 1024, 'combined_rdkit_maxPath': 8, 'combined_rdkit_nBits': 1024, 'num_hidden_layers': 3, 'hidden_dim_0': 256, 'hidden_dim_1': 1024, 'hidden_dim_2': 512, 'kl_weight': 0.0004804596459618667, 'lr': 0.007122540921740825, 'batch_size': 64, 'dropout_rate': 0.12793031421711218, 'prior_mu': -0.06073489233136807, 'prior_sigma': 0.07675676612238962, 'normalization': 'layer'}. Best is trial 587 with value: 0.4552353322505951.
Generating morgan_rdkit fingerprints...
Generated fingerprints with 2048 features for 841 molecules
Trial 746: 5-fold CV loss = 0.7314
[I 2025-08-07 19:31:23,489] Trial 746 finished with value: 0.7314481556415557 and parameters: {'fp_type': 'morgan_rdkit', 'combined_morgan_radius': 3, 'combined_morgan_nBits': 1024, 'combined_rdkit_maxPath': 8, 'combined_rdkit_nBits': 1024, 'num_hidden_layers': 3, 'hidden_dim_0': 256, 'hidden_dim_1': 1024, 'hidden_dim_2': 64, 'kl_weight': 0.000448142829771367, 'lr': 0.007188028149019921, 'batch_size': 128, 'dropout_rate': 0.1235854157093778, 'prior_mu': -0.021596115998056928, 'prior_sigma': 0.13221082563849906, 'normalization': 'layer'}. Best is trial 587 with value: 0.4552353322505951.
Generating morgan_rdkit fingerprints...
Generated fingerprints with 2048 features for 841 molecules
Trial 749: 5-fold CV loss = 0.5541
[I 2025-08-07 19:31:59,132] Trial 749 finished with value: 0.5541349411010742 and parameters: {'fp_type': 'morgan_rdkit', 'combined_morgan_radius': 3, 'combined_morgan_nBits': 1024, 'combined_rdkit_maxPath': 7, 'combined_rdkit_nBits': 1024, 'num_hidden_layers': 3, 'hidden_dim_0': 256, 'hidden_dim_1': 1024, 'hidden_dim_2': 64, 'kl_weight': 0.00046953896971443427, 'lr': 0.006021079112006119, 'batch_size': 128, 'dropout_rate': 0.4191560068026822, 'prior_mu': -0.071468881546153, 'prior_sigma': 0.0816233374932194, 'normalization': 'layer'}. Best is trial 587 with value: 0.4552353322505951.
Generating morgan fingerprints...
Generated fingerprints with 2048 features for 841 molecules
Trial 747: 5-fold CV loss = 0.5735
[I 2025-08-07 19:32:02,937] Trial 747 finished with value: 0.5735416352748871 and parameters: {'fp_type': 'morgan_rdkit', 'combined_morgan_radius': 3, 'combined_morgan_nBits': 1024, 'combined_rdkit_maxPath': 8, 'combined_rdkit_nBits': 1024, 'num_hidden_layers': 3, 'hidden_dim_0': 256, 'hidden_dim_1': 1024, 'hidden_dim_2': 64, 'kl_weight': 0.0005139499387184468, 'lr': 0.007107983175655673, 'batch_size': 128, 'dropout_rate': 0.11865049871741128, 'prior_mu': -0.07359830463746335, 'prior_sigma': 0.07625105610715027, 'normalization': 'layer'}. Best is trial 587 with value: 0.4552353322505951.
Generating morgan_rdkit fingerprints...
Generated fingerprints with 2048 features for 841 molecules
Trial 748: 5-fold CV loss = 0.4604
[I 2025-08-07 19:32:04,898] Trial 748 finished with value: 0.46041407585144045 and parameters: {'fp_type': 'morgan_rdkit', 'combined_morgan_radius': 3, 'combined_morgan_nBits': 1024, 'combined_rdkit_maxPath': 7, 'combined_rdkit_nBits': 1024, 'num_hidden_layers': 3, 'hidden_dim_0': 256, 'hidden_dim_1': 1024, 'hidden_dim_2': 64, 'kl_weight': 0.0004888736719647505, 'lr': 0.007291303695190725, 'batch_size': 128, 'dropout_rate': 0.1329178404213685, 'prior_mu': -0.017487816095652885, 'prior_sigma': 0.0817051960340593, 'normalization': 'layer'}. Best is trial 587 with value: 0.4552353322505951.
Generating morgan fingerprints...
Generated fingerprints with 2048 features for 841 molecules
Trial 743: 5-fold CV loss = 0.5645
[I 2025-08-07 19:32:12,834] Trial 743 finished with value: 0.5644784331321716 and parameters: {'fp_type': 'morgan_rdkit', 'combined_morgan_radius': 3, 'combined_morgan_nBits': 1024, 'combined_rdkit_maxPath': 7, 'combined_rdkit_nBits': 1024, 'num_hidden_layers': 3, 'hidden_dim_0': 256, 'hidden_dim_1': 1024, 'hidden_dim_2': 512, 'kl_weight': 0.0002468335732278183, 'lr': 0.008936270842172137, 'batch_size': 64, 'dropout_rate': 0.14586029665409753, 'prior_mu': -0.030508481401170913, 'prior_sigma': 0.08753015667823491, 'normalization': 'layer'}. Best is trial 587 with value: 0.4552353322505951.
Generating morgan fingerprints...
Generated fingerprints with 2048 features for 841 molecules
Trial 750: 5-fold CV loss = 0.5030
[I 2025-08-07 19:32:20,895] Trial 750 finished with value: 0.5029593586921692 and parameters: {'fp_type': 'morgan', 'morgan_only_radius': 2, 'morgan_only_nBits': 2048, 'num_hidden_layers': 3, 'hidden_dim_0': 256, 'hidden_dim_1': 1024, 'hidden_dim_2': 64, 'kl_weight': 0.0004920178507476417, 'lr': 0.00755327455758641, 'batch_size': 128, 'dropout_rate': 0.472218666862727, 'prior_mu': -0.016334973203794356, 'prior_sigma': 0.07235490261701505, 'normalization': 'layer'}. Best is trial 587 with value: 0.4552353322505951.
Generating morgan_rdkit fingerprints...
Generated fingerprints with 2048 features for 841 molecules
Trial 752: 5-fold CV loss = 0.5156
[I 2025-08-07 19:32:32,452] Trial 752 finished with value: 0.5155753433704376 and parameters: {'fp_type': 'morgan', 'morgan_only_radius': 2, 'morgan_only_nBits': 2048, 'num_hidden_layers': 3, 'hidden_dim_0': 256, 'hidden_dim_1': 1024, 'hidden_dim_2': 64, 'kl_weight': 0.0005864020503647141, 'lr': 0.006432742439442474, 'batch_size': 128, 'dropout_rate': 0.1324210151920376, 'prior_mu': -0.012922281808862224, 'prior_sigma': 0.08153631329062123, 'normalization': 'layer'}. Best is trial 587 with value: 0.4552353322505951.
Generating morgan_rdkit fingerprints...
Generated fingerprints with 2048 features for 841 molecules
Trial 754: 5-fold CV loss = 0.7937
[I 2025-08-07 19:32:38,240] Trial 754 finished with value: 0.793704479932785 and parameters: {'fp_type': 'morgan_rdkit', 'combined_morgan_radius': 3, 'combined_morgan_nBits': 1024, 'combined_rdkit_maxPath': 7, 'combined_rdkit_nBits': 1024, 'num_hidden_layers': 3, 'hidden_dim_0': 256, 'hidden_dim_1': 1024, 'hidden_dim_2': 64, 'kl_weight': 0.0006123484186122389, 'lr': 0.0065382911697883656, 'batch_size': 128, 'dropout_rate': 0.13227941587257985, 'prior_mu': 0.19830936532311527, 'prior_sigma': 0.13537242007109934, 'normalization': 'layer'}. Best is trial 587 with value: 0.4552353322505951.
Generating morgan_rdkit fingerprints...
Generated fingerprints with 2048 features for 841 molecules
Trial 753: 5-fold CV loss = 0.6608
[I 2025-08-07 19:32:59,479] Trial 753 finished with value: 0.6607980132102966 and parameters: {'fp_type': 'morgan', 'morgan_only_radius': 2, 'morgan_only_nBits': 2048, 'num_hidden_layers': 3, 'hidden_dim_0': 256, 'hidden_dim_1': 1024, 'hidden_dim_2': 64, 'kl_weight': 0.0005361328768816778, 'lr': 0.006301729996181711, 'batch_size': 128, 'dropout_rate': 0.3755860696232239, 'prior_mu': -0.01447639513006434, 'prior_sigma': 0.1353588516297097, 'normalization': 'layer'}. Best is trial 587 with value: 0.4552353322505951.
Generating morgan_rdkit fingerprints...
Generated fingerprints with 2048 features for 841 molecules
Trial 755: 5-fold CV loss = 0.4582
[I 2025-08-07 19:33:12,564] Trial 755 finished with value: 0.45820422768592833 and parameters: {'fp_type': 'morgan_rdkit', 'combined_morgan_radius': 3, 'combined_morgan_nBits': 1024, 'combined_rdkit_maxPath': 7, 'combined_rdkit_nBits': 1024, 'num_hidden_layers': 3, 'hidden_dim_0': 256, 'hidden_dim_1': 1024, 'hidden_dim_2': 64, 'kl_weight': 0.0003971861482688776, 'lr': 0.006663660917734345, 'batch_size': 128, 'dropout_rate': 0.11592421498716046, 'prior_mu': -0.005895420451518335, 'prior_sigma': 0.07608932130273428, 'normalization': 'layer'}. Best is trial 587 with value: 0.4552353322505951.
Generating morgan_rdkit fingerprints...
Generated fingerprints with 2048 features for 841 molecules
Trial 756: 5-fold CV loss = 0.4665
[I 2025-08-07 19:33:15,909] Trial 756 finished with value: 0.46650943756103513 and parameters: {'fp_type': 'morgan_rdkit', 'combined_morgan_radius': 3, 'combined_morgan_nBits': 1024, 'combined_rdkit_maxPath': 7, 'combined_rdkit_nBits': 1024, 'num_hidden_layers': 3, 'hidden_dim_0': 256, 'hidden_dim_1': 1024, 'hidden_dim_2': 64, 'kl_weight': 0.00042698917733299216, 'lr': 0.005913500532026744, 'batch_size': 128, 'dropout_rate': 0.11628798745177815, 'prior_mu': -0.004866798211360369, 'prior_sigma': 0.07808083994353296, 'normalization': 'layer'}. Best is trial 587 with value: 0.4552353322505951.
Generating morgan_rdkit fingerprints...
Generated fingerprints with 2048 features for 841 molecules
Trial 751: 5-fold CV loss = 0.4674
[I 2025-08-07 19:33:22,444] Trial 751 finished with value: 0.4673988461494446 and parameters: {'fp_type': 'morgan_rdkit', 'combined_morgan_radius': 3, 'combined_morgan_nBits': 1024, 'combined_rdkit_maxPath': 7, 'combined_rdkit_nBits': 1024, 'num_hidden_layers': 3, 'hidden_dim_0': 256, 'hidden_dim_1': 1024, 'hidden_dim_2': 64, 'kl_weight': 0.00040017421316491345, 'lr': 0.007451943923119231, 'batch_size': 128, 'dropout_rate': 0.45148408987706135, 'prior_mu': -0.013658157494750148, 'prior_sigma': 0.10118992568946535, 'normalization': 'layer'}. Best is trial 587 with value: 0.4552353322505951.
Generating rdkit fingerprints...
Generated fingerprints with 256 features for 841 molecules
Trial 759: 5-fold CV loss = 0.8915
[I 2025-08-07 19:33:30,015] Trial 759 finished with value: 0.8915004014968873 and parameters: {'fp_type': 'morgan_rdkit', 'combined_morgan_radius': 3, 'combined_morgan_nBits': 1024, 'combined_rdkit_maxPath': 7, 'combined_rdkit_nBits': 1024, 'num_hidden_layers': 3, 'hidden_dim_0': 256, 'hidden_dim_1': 1024, 'hidden_dim_2': 1024, 'kl_weight': 0.00047648287943514853, 'lr': 0.005693307627184209, 'batch_size': 128, 'dropout_rate': 0.0979306183348774, 'prior_mu': -0.004701112188741306, 'prior_sigma': 0.07380712745523976, 'normalization': 'layer'}. Best is trial 587 with value: 0.4552353322505951.
Generating morgan_rdkit fingerprints...
Generated fingerprints with 2048 features for 841 molecules
Trial 760: 5-fold CV loss = 0.8867
[I 2025-08-07 19:33:46,276] Trial 760 finished with value: 0.8866727352142334 and parameters: {'fp_type': 'rdkit', 'rdkit_only_maxPath': 6, 'rdkit_only_nBits': 256, 'num_hidden_layers': 3, 'hidden_dim_0': 128, 'hidden_dim_1': 1024, 'hidden_dim_2': 1024, 'kl_weight': 0.0004887413705121103, 'lr': 0.005550462939711456, 'batch_size': 128, 'dropout_rate': 0.09873857444694145, 'prior_mu': 0.004524672647046875, 'prior_sigma': 0.080914376739003, 'normalization': 'layer'}. Best is trial 587 with value: 0.4552353322505951.
Generating morgan_rdkit fingerprints...
Generated fingerprints with 2048 features for 841 molecules
Trial 758: 5-fold CV loss = 0.7194
[I 2025-08-07 19:33:50,943] Trial 758 finished with value: 0.7193871021270752 and parameters: {'fp_type': 'morgan_rdkit', 'combined_morgan_radius': 3, 'combined_morgan_nBits': 1024, 'combined_rdkit_maxPath': 7, 'combined_rdkit_nBits': 1024, 'num_hidden_layers': 3, 'hidden_dim_0': 256, 'hidden_dim_1': 1024, 'hidden_dim_2': 1024, 'kl_weight': 0.0004307215049728958, 'lr': 0.00573801130224484, 'batch_size': 128, 'dropout_rate': 0.4582099743153521, 'prior_mu': -0.0029939452728346885, 'prior_sigma': 0.07003037884109, 'normalization': 'layer'}. Best is trial 587 with value: 0.4552353322505951.
Generating morgan_rdkit fingerprints...
Generated fingerprints with 2048 features for 841 molecules
Trial 761: 5-fold CV loss = 0.4754
[I 2025-08-07 19:34:04,130] Trial 761 finished with value: 0.47544209361076356 and parameters: {'fp_type': 'morgan_rdkit', 'combined_morgan_radius': 3, 'combined_morgan_nBits': 1024, 'combined_rdkit_maxPath': 7, 'combined_rdkit_nBits': 1024, 'num_hidden_layers': 3, 'hidden_dim_0': 256, 'hidden_dim_1': 1024, 'hidden_dim_2': 64, 'kl_weight': 0.0005052279264410466, 'lr': 0.006639699880160266, 'batch_size': 128, 'dropout_rate': 0.10864490119683237, 'prior_mu': 0.004315368728966915, 'prior_sigma': 0.07546204233199102, 'normalization': 'layer'}. Best is trial 587 with value: 0.4552353322505951.
Generating morgan_rdkit fingerprints...
Generated fingerprints with 2048 features for 841 molecules
Trial 764: 5-fold CV loss = 1.0683
[I 2025-08-07 19:34:11,477] Trial 764 finished with value: 1.068299162387848 and parameters: {'fp_type': 'morgan_rdkit', 'combined_morgan_radius': 3, 'combined_morgan_nBits': 1024, 'combined_rdkit_maxPath': 7, 'combined_rdkit_nBits': 1024, 'num_hidden_layers': 0, 'kl_weight': 0.0005581783597966572, 'lr': 0.006777388130880344, 'batch_size': 128, 'dropout_rate': 0.1174061044630514, 'prior_mu': -0.020346909036583705, 'prior_sigma': 0.07535587895764624, 'normalization': 'layer'}. Best is trial 587 with value: 0.4552353322505951.
Generating morgan_rdkit fingerprints...
Generated fingerprints with 2048 features for 841 molecules
Trial 763: 5-fold CV loss = 0.4736
[I 2025-08-07 19:34:23,993] Trial 763 finished with value: 0.47364273071289065 and parameters: {'fp_type': 'morgan_rdkit', 'combined_morgan_radius': 3, 'combined_morgan_nBits': 1024, 'combined_rdkit_maxPath': 7, 'combined_rdkit_nBits': 1024, 'num_hidden_layers': 3, 'hidden_dim_0': 256, 'hidden_dim_1': 1024, 'hidden_dim_2': 64, 'kl_weight': 0.0005522064859786079, 'lr': 0.006976300341350804, 'batch_size': 128, 'dropout_rate': 0.11217142907649238, 'prior_mu': -0.021321600289775276, 'prior_sigma': 0.07800861453757489, 'normalization': 'layer'}. Best is trial 587 with value: 0.4552353322505951.
Generating morgan_rdkit fingerprints...
Generated fingerprints with 2048 features for 841 molecules
Trial 757: 5-fold CV loss = 0.4638
[I 2025-08-07 19:34:28,890] Trial 757 finished with value: 0.46384363174438475 and parameters: {'fp_type': 'morgan_rdkit', 'combined_morgan_radius': 3, 'combined_morgan_nBits': 1024, 'combined_rdkit_maxPath': 7, 'combined_rdkit_nBits': 1024, 'num_hidden_layers': 3, 'hidden_dim_0': 256, 'hidden_dim_1': 1024, 'hidden_dim_2': 64, 'kl_weight': 0.00041902006353825765, 'lr': 0.005771064353621105, 'batch_size': 128, 'dropout_rate': 0.11647765894172073, 'prior_mu': -0.022331052739055612, 'prior_sigma': 0.07757094442519441, 'normalization': 'layer'}. Best is trial 587 with value: 0.4552353322505951.
Generating morgan_rdkit fingerprints...
Generated fingerprints with 2048 features for 841 molecules
Trial 762: 5-fold CV loss = 0.4776
[I 2025-08-07 19:34:30,808] Trial 762 finished with value: 0.47756510972976685 and parameters: {'fp_type': 'morgan_rdkit', 'combined_morgan_radius': 3, 'combined_morgan_nBits': 1024, 'combined_rdkit_maxPath': 6, 'combined_rdkit_nBits': 1024, 'num_hidden_layers': 3, 'hidden_dim_0': 256, 'hidden_dim_1': 128, 'hidden_dim_2': 64, 'kl_weight': 0.00041552289197804436, 'lr': 0.006871862288591723, 'batch_size': 128, 'dropout_rate': 0.11444615538132777, 'prior_mu': -0.02016859646865696, 'prior_sigma': 0.07567312440365713, 'normalization': 'layer'}. Best is trial 587 with value: 0.4552353322505951.
Generating morgan_rdkit fingerprints...
Generated fingerprints with 2048 features for 841 molecules
Trial 766: 5-fold CV loss = 0.6640
