[I 2025-08-07 23:05:40,532] Trial 1848 finished with value: 1.2353778600692749 and parameters: {'fp_type': 'morgan_rdkit', 'combined_morgan_radius': 3, 'combined_morgan_nBits': 1024, 'combined_rdkit_maxPath': 6, 'combined_rdkit_nBits': 1024, 'num_hidden_layers': 0, 'kl_weight': 0.00032701395821214404, 'lr': 0.00822913493476503, 'batch_size': 128, 'dropout_rate': 0.14353221907641908, 'prior_mu': -0.018053388756506656, 'prior_sigma': 0.09066813291974021, 'normalization': 'layer'}. Best is trial 896 with value: 0.4533553242683411.
Generating morgan_rdkit fingerprints...
Generated fingerprints with 1536 features for 841 molecules
Trial 1840: 5-fold CV loss = 0.5787
[I 2025-08-07 23:05:42,210] Trial 1840 finished with value: 0.5786774516105652 and parameters: {'fp_type': 'morgan_rdkit', 'combined_morgan_radius': 3, 'combined_morgan_nBits': 1024, 'combined_rdkit_maxPath': 7, 'combined_rdkit_nBits': 1024, 'num_hidden_layers': 3, 'hidden_dim_0': 256, 'hidden_dim_1': 1024, 'hidden_dim_2': 64, 'kl_weight': 0.0004298133239033326, 'lr': 0.006390152898249428, 'batch_size': 128, 'dropout_rate': 0.12541322184632772, 'prior_mu': -0.059040978049127314, 'prior_sigma': 0.08502667022819825, 'normalization': 'none'}. Best is trial 896 with value: 0.4533553242683411.
Generating morgan_rdkit fingerprints...
Generated fingerprints with 1536 features for 841 molecules
Trial 1847: 5-fold CV loss = 0.8724
[I 2025-08-07 23:05:58,833] Trial 1847 finished with value: 0.8724028468132019 and parameters: {'fp_type': 'morgan_rdkit', 'combined_morgan_radius': 3, 'combined_morgan_nBits': 1024, 'combined_rdkit_maxPath': 7, 'combined_rdkit_nBits': 1024, 'num_hidden_layers': 3, 'hidden_dim_0': 256, 'hidden_dim_1': 1024, 'hidden_dim_2': 64, 'kl_weight': 0.0003110572829852474, 'lr': 0.0001401653652887467, 'batch_size': 128, 'dropout_rate': 0.14399859599698653, 'prior_mu': -0.017884701065627256, 'prior_sigma': 0.09072547017540442, 'normalization': 'layer'}. Best is trial 896 with value: 0.4533553242683411.
Generating morgan_rdkit fingerprints...
Generated fingerprints with 1536 features for 841 molecules
Trial 1846: 5-fold CV loss = 0.4611
[I 2025-08-07 23:06:11,616] Trial 1846 finished with value: 0.46107558012008665 and parameters: {'fp_type': 'morgan_rdkit', 'combined_morgan_radius': 3, 'combined_morgan_nBits': 1024, 'combined_rdkit_maxPath': 7, 'combined_rdkit_nBits': 1024, 'num_hidden_layers': 3, 'hidden_dim_0': 256, 'hidden_dim_1': 1024, 'hidden_dim_2': 64, 'kl_weight': 0.00027513416350804316, 'lr': 0.006664944664289335, 'batch_size': 128, 'dropout_rate': 0.12350687028030176, 'prior_mu': -0.023660141632736793, 'prior_sigma': 0.0751479462581475, 'normalization': 'layer'}. Best is trial 896 with value: 0.4533553242683411.
Generating morgan_rdkit fingerprints...
Generated fingerprints with 2048 features for 841 molecules
Trial 1849: 5-fold CV loss = 0.5572
[I 2025-08-07 23:06:16,393] Trial 1849 finished with value: 0.5572366297245026 and parameters: {'fp_type': 'morgan_rdkit', 'combined_morgan_radius': 3, 'combined_morgan_nBits': 512, 'combined_rdkit_maxPath': 7, 'combined_rdkit_nBits': 1024, 'num_hidden_layers': 3, 'hidden_dim_0': 256, 'hidden_dim_1': 1024, 'hidden_dim_2': 64, 'kl_weight': 0.00039484320486099, 'lr': 0.006645645465866754, 'batch_size': 128, 'dropout_rate': 0.08280419677825951, 'prior_mu': -0.027547067440710754, 'prior_sigma': 0.06753816585111166, 'normalization': 'layer'}. Best is trial 896 with value: 0.4533553242683411.
Generating morgan_rdkit fingerprints...
Generated fingerprints with 2048 features for 841 molecules
Trial 1851: 5-fold CV loss = 0.4608
[I 2025-08-07 23:06:40,693] Trial 1851 finished with value: 0.4607729971408844 and parameters: {'fp_type': 'morgan_rdkit', 'combined_morgan_radius': 3, 'combined_morgan_nBits': 512, 'combined_rdkit_maxPath': 7, 'combined_rdkit_nBits': 1024, 'num_hidden_layers': 3, 'hidden_dim_0': 256, 'hidden_dim_1': 1024, 'hidden_dim_2': 64, 'kl_weight': 0.0003762772665733141, 'lr': 0.006798926830667773, 'batch_size': 128, 'dropout_rate': 0.08259547636618557, 'prior_mu': -0.02840420734421837, 'prior_sigma': 0.07341818417182724, 'normalization': 'layer'}. Best is trial 896 with value: 0.4533553242683411.
Generating morgan_rdkit fingerprints...
Generated fingerprints with 2048 features for 841 molecules
Trial 1853: 5-fold CV loss = 0.4704
[I 2025-08-07 23:06:52,359] Trial 1853 finished with value: 0.4704392313957214 and parameters: {'fp_type': 'morgan_rdkit', 'combined_morgan_radius': 3, 'combined_morgan_nBits': 1024, 'combined_rdkit_maxPath': 7, 'combined_rdkit_nBits': 1024, 'num_hidden_layers': 3, 'hidden_dim_0': 256, 'hidden_dim_1': 1024, 'hidden_dim_2': 64, 'kl_weight': 0.00021199377769757688, 'lr': 0.008468183988187368, 'batch_size': 128, 'dropout_rate': 0.0963787557179152, 'prior_mu': -0.04376090368134712, 'prior_sigma': 0.07116957553632185, 'normalization': 'layer'}. Best is trial 896 with value: 0.4533553242683411.
Generating morgan_rdkit fingerprints...
Generated fingerprints with 2048 features for 841 molecules
Trial 1852: 5-fold CV loss = 0.4660
[I 2025-08-07 23:07:00,251] Trial 1852 finished with value: 0.4660004496574402 and parameters: {'fp_type': 'morgan_rdkit', 'combined_morgan_radius': 3, 'combined_morgan_nBits': 1024, 'combined_rdkit_maxPath': 7, 'combined_rdkit_nBits': 1024, 'num_hidden_layers': 3, 'hidden_dim_0': 256, 'hidden_dim_1': 1024, 'hidden_dim_2': 64, 'kl_weight': 0.0003792054534812407, 'lr': 0.008386110149272544, 'batch_size': 128, 'dropout_rate': 0.08273004474359386, 'prior_mu': -0.04442570371042708, 'prior_sigma': 0.06680733072582036, 'normalization': 'layer'}. Best is trial 896 with value: 0.4533553242683411.
Generating morgan_rdkit fingerprints...
Generated fingerprints with 2048 features for 841 molecules
Trial 1854: 5-fold CV loss = 0.4741
[I 2025-08-07 23:07:22,019] Trial 1854 finished with value: 0.47409054040908816 and parameters: {'fp_type': 'morgan_rdkit', 'combined_morgan_radius': 3, 'combined_morgan_nBits': 1024, 'combined_rdkit_maxPath': 8, 'combined_rdkit_nBits': 1024, 'num_hidden_layers': 3, 'hidden_dim_0': 256, 'hidden_dim_1': 1024, 'hidden_dim_2': 64, 'kl_weight': 0.000338013496040865, 'lr': 0.008209056458367267, 'batch_size': 128, 'dropout_rate': 0.09989123237089301, 'prior_mu': -0.008062523123476417, 'prior_sigma': 0.07845011407655589, 'normalization': 'layer'}. Best is trial 896 with value: 0.4533553242683411.
Generating morgan_rdkit fingerprints...
Generated fingerprints with 2048 features for 841 molecules
Trial 1856: 5-fold CV loss = 0.7132
[I 2025-08-07 23:07:40,517] Trial 1856 finished with value: 0.7132048428058624 and parameters: {'fp_type': 'morgan_rdkit', 'combined_morgan_radius': 3, 'combined_morgan_nBits': 1024, 'combined_rdkit_maxPath': 8, 'combined_rdkit_nBits': 1024, 'num_hidden_layers': 3, 'hidden_dim_0': 256, 'hidden_dim_1': 1024, 'hidden_dim_2': 64, 'kl_weight': 0.00032393750037356566, 'lr': 0.005513329510295883, 'batch_size': 128, 'dropout_rate': 0.13221802447770015, 'prior_mu': -0.010999517434207708, 'prior_sigma': 0.0940542366194605, 'normalization': 'layer'}. Best is trial 896 with value: 0.4533553242683411.
Generating morgan_rdkit fingerprints...
Generated fingerprints with 2048 features for 841 molecules
Trial 1850: 5-fold CV loss = 0.4601
[I 2025-08-07 23:07:46,798] Trial 1850 finished with value: 0.460130512714386 and parameters: {'fp_type': 'morgan_rdkit', 'combined_morgan_radius': 3, 'combined_morgan_nBits': 512, 'combined_rdkit_maxPath': 7, 'combined_rdkit_nBits': 1024, 'num_hidden_layers': 3, 'hidden_dim_0': 256, 'hidden_dim_1': 1024, 'hidden_dim_2': 64, 'kl_weight': 0.001493264487624024, 'lr': 0.00691238352488162, 'batch_size': 128, 'dropout_rate': 0.43876844978094665, 'prior_mu': -0.00815808436274324, 'prior_sigma': 0.0747418566419318, 'normalization': 'layer'}. Best is trial 896 with value: 0.4533553242683411.
Generating morgan_rdkit fingerprints...
Generated fingerprints with 2048 features for 841 molecules
Trial 1855: 5-fold CV loss = 0.4787
[I 2025-08-07 23:07:48,042] Trial 1855 finished with value: 0.478699141740799 and parameters: {'fp_type': 'morgan_rdkit', 'combined_morgan_radius': 3, 'combined_morgan_nBits': 1024, 'combined_rdkit_maxPath': 8, 'combined_rdkit_nBits': 1024, 'num_hidden_layers': 3, 'hidden_dim_0': 256, 'hidden_dim_1': 1024, 'hidden_dim_2': 64, 'kl_weight': 0.0003411321925781642, 'lr': 0.005406767630829199, 'batch_size': 128, 'dropout_rate': 0.11811893489735859, 'prior_mu': -0.007488127591245515, 'prior_sigma': 0.09436570225676118, 'normalization': 'layer'}. Best is trial 896 with value: 0.4533553242683411.
Generating morgan_rdkit fingerprints...
Generated fingerprints with 2048 features for 841 molecules
Trial 1857: 5-fold CV loss = 0.5593
[I 2025-08-07 23:07:53,572] Trial 1857 finished with value: 0.5593205988407135 and parameters: {'fp_type': 'morgan_rdkit', 'combined_morgan_radius': 3, 'combined_morgan_nBits': 1024, 'combined_rdkit_maxPath': 7, 'combined_rdkit_nBits': 1024, 'num_hidden_layers': 3, 'hidden_dim_0': 256, 'hidden_dim_1': 1024, 'hidden_dim_2': 64, 'kl_weight': 0.00024158034102493136, 'lr': 0.009981864192203071, 'batch_size': 128, 'dropout_rate': 0.16611550711490708, 'prior_mu': -0.03771672057295571, 'prior_sigma': 0.09430664218218456, 'normalization': 'layer'}. Best is trial 896 with value: 0.4533553242683411.
Generating morgan_rdkit fingerprints...
Generated fingerprints with 2048 features for 841 molecules
Trial 1861: 5-fold CV loss = 0.4808
[I 2025-08-07 23:08:21,971] Trial 1861 finished with value: 0.48083223700523375 and parameters: {'fp_type': 'morgan_rdkit', 'combined_morgan_radius': 3, 'combined_morgan_nBits': 1024, 'combined_rdkit_maxPath': 5, 'combined_rdkit_nBits': 1024, 'num_hidden_layers': 3, 'hidden_dim_0': 256, 'hidden_dim_1': 1024, 'hidden_dim_2': 64, 'kl_weight': 0.0004763044309925502, 'lr': 0.006035965104825068, 'batch_size': 128, 'dropout_rate': 0.11028649989139945, 'prior_mu': -0.03170818652318771, 'prior_sigma': 0.08814689513044074, 'normalization': 'layer'}. Best is trial 896 with value: 0.4533553242683411.
Generating morgan_rdkit fingerprints...
Generated fingerprints with 2048 features for 841 molecules
Trial 1860: 5-fold CV loss = 0.4674
[I 2025-08-07 23:08:33,399] Trial 1860 finished with value: 0.4673613369464874 and parameters: {'fp_type': 'morgan_rdkit', 'combined_morgan_radius': 3, 'combined_morgan_nBits': 1024, 'combined_rdkit_maxPath': 7, 'combined_rdkit_nBits': 1024, 'num_hidden_layers': 3, 'hidden_dim_0': 256, 'hidden_dim_1': 1024, 'hidden_dim_2': 64, 'kl_weight': 0.0004777247624541473, 'lr': 0.007518459132679833, 'batch_size': 128, 'dropout_rate': 0.11099686884009421, 'prior_mu': -0.03574549470319715, 'prior_sigma': 0.08771464091193895, 'normalization': 'layer'}. Best is trial 896 with value: 0.4533553242683411.
Generating morgan_rdkit fingerprints...
Generated fingerprints with 1280 features for 841 molecules
Trial 1858: 5-fold CV loss = 0.4703
[I 2025-08-07 23:08:43,643] Trial 1858 finished with value: 0.4703361451625824 and parameters: {'fp_type': 'morgan_rdkit', 'combined_morgan_radius': 3, 'combined_morgan_nBits': 1024, 'combined_rdkit_maxPath': 7, 'combined_rdkit_nBits': 1024, 'num_hidden_layers': 3, 'hidden_dim_0': 256, 'hidden_dim_1': 1024, 'hidden_dim_2': 64, 'kl_weight': 0.0004966312645830096, 'lr': 0.006032939150449874, 'batch_size': 128, 'dropout_rate': 0.1648764502361245, 'prior_mu': -0.036748007642279173, 'prior_sigma': 0.08844372515367463, 'normalization': 'layer'}. Best is trial 896 with value: 0.4533553242683411.
Generating morgan_rdkit fingerprints...
Generated fingerprints with 1280 features for 841 molecules
Trial 1862: 5-fold CV loss = 0.4691
[I 2025-08-07 23:09:01,615] Trial 1862 finished with value: 0.4690830945968628 and parameters: {'fp_type': 'morgan_rdkit', 'combined_morgan_radius': 3, 'combined_morgan_nBits': 1024, 'combined_rdkit_maxPath': 7, 'combined_rdkit_nBits': 1024, 'num_hidden_layers': 3, 'hidden_dim_0': 256, 'hidden_dim_1': 1024, 'hidden_dim_2': 64, 'kl_weight': 0.00029511475398341804, 'lr': 0.007555975385756142, 'batch_size': 128, 'dropout_rate': 0.07090083007595921, 'prior_mu': -0.05482288636298439, 'prior_sigma': 0.08215793071501969, 'normalization': 'layer'}. Best is trial 896 with value: 0.4533553242683411.
Generating morgan fingerprints...
Generated fingerprints with 1024 features for 841 molecules
Trial 1863: 5-fold CV loss = 0.6990
[I 2025-08-07 23:09:08,741] Trial 1863 finished with value: 0.6990471601486206 and parameters: {'fp_type': 'morgan_rdkit', 'combined_morgan_radius': 3, 'combined_morgan_nBits': 1024, 'combined_rdkit_maxPath': 7, 'combined_rdkit_nBits': 256, 'num_hidden_layers': 3, 'hidden_dim_0': 256, 'hidden_dim_1': 1024, 'hidden_dim_2': 512, 'kl_weight': 0.0002786298993872826, 'lr': 0.006097795887499797, 'batch_size': 128, 'dropout_rate': 0.15854420080749448, 'prior_mu': -0.05478849623599068, 'prior_sigma': 0.0807912993746394, 'normalization': 'layer'}. Best is trial 896 with value: 0.4533553242683411.
Generating morgan_rdkit fingerprints...
Generated fingerprints with 2048 features for 841 molecules
Trial 1864: 5-fold CV loss = 0.5154
[I 2025-08-07 23:09:22,273] Trial 1864 finished with value: 0.5154331922531128 and parameters: {'fp_type': 'morgan_rdkit', 'combined_morgan_radius': 3, 'combined_morgan_nBits': 1024, 'combined_rdkit_maxPath': 7, 'combined_rdkit_nBits': 256, 'num_hidden_layers': 3, 'hidden_dim_0': 256, 'hidden_dim_1': 1024, 'hidden_dim_2': 64, 'kl_weight': 0.0002914176864684538, 'lr': 0.007545440849859729, 'batch_size': 128, 'dropout_rate': 0.07443684744533313, 'prior_mu': -0.05568634978605552, 'prior_sigma': 0.08278639833393493, 'normalization': 'layer'}. Best is trial 896 with value: 0.4533553242683411.
Generating morgan fingerprints...
Generated fingerprints with 1024 features for 841 molecules
Trial 1865: 5-fold CV loss = 0.5919
[I 2025-08-07 23:09:23,690] Trial 1865 finished with value: 0.5919315159320832 and parameters: {'fp_type': 'morgan', 'morgan_only_radius': 2, 'morgan_only_nBits': 1024, 'num_hidden_layers': 3, 'hidden_dim_0': 256, 'hidden_dim_1': 1024, 'hidden_dim_2': 512, 'kl_weight': 0.0002593100457122061, 'lr': 0.007280820548740899, 'batch_size': 128, 'dropout_rate': 0.15642599855766998, 'prior_mu': -0.06518613367770817, 'prior_sigma': 0.07810692268080785, 'normalization': 'layer'}. Best is trial 896 with value: 0.4533553242683411.
Generating morgan_rdkit fingerprints...
Generated fingerprints with 2048 features for 841 molecules
Trial 1859: 5-fold CV loss = 0.4624
[I 2025-08-07 23:09:25,382] Trial 1859 finished with value: 0.46235679388046264 and parameters: {'fp_type': 'morgan_rdkit', 'combined_morgan_radius': 3, 'combined_morgan_nBits': 1024, 'combined_rdkit_maxPath': 7, 'combined_rdkit_nBits': 1024, 'num_hidden_layers': 3, 'hidden_dim_0': 256, 'hidden_dim_1': 1024, 'hidden_dim_2': 64, 'kl_weight': 0.00024762361709554907, 'lr': 0.007589880183086876, 'batch_size': 128, 'dropout_rate': 0.20262660525622472, 'prior_mu': -0.037216327499325214, 'prior_sigma': 0.08801630840780454, 'normalization': 'layer'}. Best is trial 896 with value: 0.4533553242683411.
Generating rdkit fingerprints...
Generated fingerprints with 512 features for 841 molecules
Trial 1866: 5-fold CV loss = 0.4704
[I 2025-08-07 23:09:49,994] Trial 1866 finished with value: 0.4704118609428406 and parameters: {'fp_type': 'morgan_rdkit', 'combined_morgan_radius': 3, 'combined_morgan_nBits': 1024, 'combined_rdkit_maxPath': 7, 'combined_rdkit_nBits': 1024, 'num_hidden_layers': 3, 'hidden_dim_0': 256, 'hidden_dim_1': 1024, 'hidden_dim_2': 64, 'kl_weight': 0.001012262622397873, 'lr': 0.007383668450735519, 'batch_size': 128, 'dropout_rate': 0.14357857018923487, 'prior_mu': 0.021158254460541412, 'prior_sigma': 0.0777460018800244, 'normalization': 'layer'}. Best is trial 896 with value: 0.4533553242683411.
Generating morgan_rdkit fingerprints...
Generated fingerprints with 2048 features for 841 molecules
Trial 1867: 5-fold CV loss = 0.5324
[I 2025-08-07 23:09:52,485] Trial 1867 finished with value: 0.5323625087738038 and parameters: {'fp_type': 'morgan', 'morgan_only_radius': 2, 'morgan_only_nBits': 1024, 'num_hidden_layers': 3, 'hidden_dim_0': 256, 'hidden_dim_1': 1024, 'hidden_dim_2': 64, 'kl_weight': 0.00021995432571088281, 'lr': 0.008949473429586048, 'batch_size': 128, 'dropout_rate': 0.14215051721083347, 'prior_mu': -0.02166265248129439, 'prior_sigma': 0.07819626014829062, 'normalization': 'layer'}. Best is trial 896 with value: 0.4533553242683411.
Generating morgan_rdkit fingerprints...
Generated fingerprints with 2048 features for 841 molecules
Trial 1868: 5-fold CV loss = 0.4700
[I 2025-08-07 23:09:59,155] Trial 1868 finished with value: 0.4699819326400757 and parameters: {'fp_type': 'morgan_rdkit', 'combined_morgan_radius': 3, 'combined_morgan_nBits': 1024, 'combined_rdkit_maxPath': 7, 'combined_rdkit_nBits': 1024, 'num_hidden_layers': 3, 'hidden_dim_0': 256, 'hidden_dim_1': 1024, 'hidden_dim_2': 64, 'kl_weight': 0.001101222553729963, 'lr': 0.008945396760468429, 'batch_size': 128, 'dropout_rate': 0.13207853128868566, 'prior_mu': 0.022007586242378002, 'prior_sigma': 0.07017286864618624, 'normalization': 'layer'}. Best is trial 896 with value: 0.4533553242683411.
Generating morgan_rdkit fingerprints...
Generated fingerprints with 2048 features for 841 molecules
Trial 1869: 5-fold CV loss = 0.8644
[I 2025-08-07 23:10:10,639] Trial 1869 finished with value: 0.8644404411315918 and parameters: {'fp_type': 'rdkit', 'rdkit_only_maxPath': 8, 'rdkit_only_nBits': 512, 'num_hidden_layers': 3, 'hidden_dim_0': 256, 'hidden_dim_1': 1024, 'hidden_dim_2': 64, 'kl_weight': 0.000207950324118971, 'lr': 0.009011838518128224, 'batch_size': 128, 'dropout_rate': 0.048913227695212294, 'prior_mu': 0.027663186955645822, 'prior_sigma': 0.068344384360357, 'normalization': 'layer'}. Best is trial 896 with value: 0.4533553242683411.
Generating morgan_rdkit fingerprints...
Generated fingerprints with 2048 features for 841 molecules
Trial 1870: 5-fold CV loss = 0.4772
[I 2025-08-07 23:10:23,425] Trial 1870 finished with value: 0.477182012796402 and parameters: {'fp_type': 'morgan_rdkit', 'combined_morgan_radius': 3, 'combined_morgan_nBits': 1024, 'combined_rdkit_maxPath': 6, 'combined_rdkit_nBits': 1024, 'num_hidden_layers': 3, 'hidden_dim_0': 256, 'hidden_dim_1': 1024, 'hidden_dim_2': 64, 'kl_weight': 0.00019335385305654484, 'lr': 0.009116690390023791, 'batch_size': 128, 'dropout_rate': 0.1316096596269356, 'prior_mu': -0.02146054442812345, 'prior_sigma': 0.0714477418251298, 'normalization': 'layer'}. Best is trial 896 with value: 0.4533553242683411.
Generating morgan_rdkit fingerprints...
Generated fingerprints with 2048 features for 841 molecules
Trial 1872: 5-fold CV loss = 0.4675
[I 2025-08-07 23:10:35,562] Trial 1872 finished with value: 0.4675055205821991 and parameters: {'fp_type': 'morgan_rdkit', 'combined_morgan_radius': 3, 'combined_morgan_nBits': 1024, 'combined_rdkit_maxPath': 7, 'combined_rdkit_nBits': 1024, 'num_hidden_layers': 3, 'hidden_dim_0': 256, 'hidden_dim_1': 1024, 'hidden_dim_2': 64, 'kl_weight': 0.00041183145160158825, 'lr': 0.006122827830509886, 'batch_size': 128, 'dropout_rate': 0.09879448886653823, 'prior_mu': 0.0015370793127445603, 'prior_sigma': 0.07182143645301962, 'normalization': 'layer'}. Best is trial 896 with value: 0.4533553242683411.
Generating morgan_rdkit fingerprints...
Generated fingerprints with 2048 features for 841 molecules
Trial 1871: 5-fold CV loss = 0.4697
[I 2025-08-07 23:10:41,551] Trial 1871 finished with value: 0.4696649432182312 and parameters: {'fp_type': 'morgan_rdkit', 'combined_morgan_radius': 3, 'combined_morgan_nBits': 1024, 'combined_rdkit_maxPath': 6, 'combined_rdkit_nBits': 1024, 'num_hidden_layers': 3, 'hidden_dim_0': 256, 'hidden_dim_1': 1024, 'hidden_dim_2': 64, 'kl_weight': 0.0004004762599845414, 'lr': 0.005639627428558467, 'batch_size': 128, 'dropout_rate': 0.1310441791118967, 'prior_mu': 0.003140900518218033, 'prior_sigma': 0.07081355514963242, 'normalization': 'layer'}. Best is trial 896 with value: 0.4533553242683411.
Generating morgan_rdkit fingerprints...
Generated fingerprints with 2048 features for 841 molecules
Trial 1875: 5-fold CV loss = 0.5486
[I 2025-08-07 23:11:07,987] Trial 1875 finished with value: 0.5485928654670715 and parameters: {'fp_type': 'morgan_rdkit', 'combined_morgan_radius': 3, 'combined_morgan_nBits': 1024, 'combined_rdkit_maxPath': 7, 'combined_rdkit_nBits': 1024, 'num_hidden_layers': 3, 'hidden_dim_0': 256, 'hidden_dim_1': 1024, 'hidden_dim_2': 64, 'kl_weight': 0.00036826899459285647, 'lr': 0.00558165249840745, 'batch_size': 128, 'dropout_rate': 0.09211105495243027, 'prior_mu': -0.04534319157961497, 'prior_sigma': 0.09858334361280675, 'normalization': 'layer'}. Best is trial 896 with value: 0.4533553242683411.
Generating morgan_rdkit fingerprints...
Generated fingerprints with 2048 features for 841 molecules
Trial 1874: 5-fold CV loss = 0.4745
[I 2025-08-07 23:11:10,788] Trial 1874 finished with value: 0.4745233178138733 and parameters: {'fp_type': 'morgan_rdkit', 'combined_morgan_radius': 3, 'combined_morgan_nBits': 1024, 'combined_rdkit_maxPath': 7, 'combined_rdkit_nBits': 1024, 'num_hidden_layers': 3, 'hidden_dim_0': 256, 'hidden_dim_1': 256, 'hidden_dim_2': 128, 'kl_weight': 0.00040105743285727516, 'lr': 0.0061800606730646615, 'batch_size': 128, 'dropout_rate': 0.09758612479868338, 'prior_mu': 0.0018384011874063057, 'prior_sigma': 0.09656824203758153, 'normalization': 'layer'}. Best is trial 896 with value: 0.4533553242683411.
Generating morgan_rdkit fingerprints...
Generated fingerprints with 2048 features for 841 molecules
Trial 1876: 5-fold CV loss = 0.4616
