[I 2025-08-07 20:59:15,097] Trial 1187 finished with value: 0.5395445585250854 and parameters: {'fp_type': 'morgan_rdkit', 'combined_morgan_radius': 3, 'combined_morgan_nBits': 1024, 'combined_rdkit_maxPath': 7, 'combined_rdkit_nBits': 1024, 'num_hidden_layers': 3, 'hidden_dim_0': 256, 'hidden_dim_1': 256, 'hidden_dim_2': 64, 'kl_weight': 0.0005063349818197555, 'lr': 0.0058059398141574485, 'batch_size': 128, 'dropout_rate': 0.0963563116112147, 'prior_mu': -0.0052401479182932805, 'prior_sigma': 0.09583772149123017, 'normalization': 'layer'}. Best is trial 896 with value: 0.4533553242683411.
Generating morgan fingerprints...
Generated fingerprints with 1024 features for 841 molecules
Trial 1182: 5-fold CV loss = 0.6113
[I 2025-08-07 20:59:26,032] Trial 1182 finished with value: 0.6113294720649719 and parameters: {'fp_type': 'morgan_rdkit', 'combined_morgan_radius': 3, 'combined_morgan_nBits': 1024, 'combined_rdkit_maxPath': 7, 'combined_rdkit_nBits': 1024, 'num_hidden_layers': 3, 'hidden_dim_0': 256, 'hidden_dim_1': 1024, 'hidden_dim_2': 128, 'kl_weight': 0.00030659276123028915, 'lr': 0.007469196187507143, 'batch_size': 128, 'dropout_rate': 0.13709776316221006, 'prior_mu': 0.002963282088913081, 'prior_sigma': 0.10126983016692256, 'normalization': 'none'}. Best is trial 896 with value: 0.4533553242683411.
Generating morgan fingerprints...
Generated fingerprints with 1024 features for 841 molecules
Trial 1186: 5-fold CV loss = 0.4647
[I 2025-08-07 20:59:27,078] Trial 1186 finished with value: 0.4646758854389191 and parameters: {'fp_type': 'morgan_rdkit', 'combined_morgan_radius': 3, 'combined_morgan_nBits': 1024, 'combined_rdkit_maxPath': 7, 'combined_rdkit_nBits': 1024, 'num_hidden_layers': 3, 'hidden_dim_0': 256, 'hidden_dim_1': 1024, 'hidden_dim_2': 64, 'kl_weight': 0.00041397227135127833, 'lr': 0.005709541972161231, 'batch_size': 128, 'dropout_rate': 0.13165340506109216, 'prior_mu': -0.006219089728736447, 'prior_sigma': 0.09595920629387085, 'normalization': 'layer'}. Best is trial 896 with value: 0.4533553242683411.
Generating morgan fingerprints...
Generated fingerprints with 1024 features for 841 molecules
Trial 1189: 5-fold CV loss = 0.5952
[I 2025-08-07 20:59:37,530] Trial 1189 finished with value: 0.5952238023281098 and parameters: {'fp_type': 'morgan', 'morgan_only_radius': 2, 'morgan_only_nBits': 1024, 'num_hidden_layers': 3, 'hidden_dim_0': 256, 'hidden_dim_1': 1024, 'hidden_dim_2': 256, 'kl_weight': 0.00029754249328799745, 'lr': 0.006210982187404725, 'batch_size': 128, 'dropout_rate': 0.1634808559674953, 'prior_mu': -0.005421879433817618, 'prior_sigma': 0.10908479991317564, 'normalization': 'layer'}. Best is trial 896 with value: 0.4533553242683411.
Generating morgan_rdkit fingerprints...
Generated fingerprints with 2048 features for 841 molecules
Trial 1188: 5-fold CV loss = 0.6375
[I 2025-08-07 20:59:50,534] Trial 1188 finished with value: 0.637453955411911 and parameters: {'fp_type': 'morgan_rdkit', 'combined_morgan_radius': 3, 'combined_morgan_nBits': 1024, 'combined_rdkit_maxPath': 7, 'combined_rdkit_nBits': 1024, 'num_hidden_layers': 3, 'hidden_dim_0': 256, 'hidden_dim_1': 256, 'hidden_dim_2': 256, 'kl_weight': 0.00041441271314987337, 'lr': 0.009223784175861664, 'batch_size': 128, 'dropout_rate': 0.09300913195343691, 'prior_mu': -0.004903385799396614, 'prior_sigma': 0.09525832138567476, 'normalization': 'layer'}. Best is trial 896 with value: 0.4533553242683411.
Generating morgan_rdkit fingerprints...
Generated fingerprints with 2048 features for 841 molecules
Trial 1191: 5-fold CV loss = 0.6763
[I 2025-08-07 20:59:59,870] Trial 1191 finished with value: 0.6762744843959808 and parameters: {'fp_type': 'morgan', 'morgan_only_radius': 2, 'morgan_only_nBits': 1024, 'num_hidden_layers': 3, 'hidden_dim_0': 256, 'hidden_dim_1': 1024, 'hidden_dim_2': 512, 'kl_weight': 0.00023012159022676329, 'lr': 0.009516741413727428, 'batch_size': 128, 'dropout_rate': 0.10320330387518284, 'prior_mu': -0.003921285312860518, 'prior_sigma': 0.11056503982538853, 'normalization': 'layer'}. Best is trial 896 with value: 0.4533553242683411.
Generating morgan_rdkit fingerprints...
Generated fingerprints with 1280 features for 841 molecules
Trial 1192: 5-fold CV loss = 0.4773
[I 2025-08-07 21:00:11,275] Trial 1192 finished with value: 0.4773056924343109 and parameters: {'fp_type': 'morgan_rdkit', 'combined_morgan_radius': 3, 'combined_morgan_nBits': 1024, 'combined_rdkit_maxPath': 7, 'combined_rdkit_nBits': 1024, 'num_hidden_layers': 3, 'hidden_dim_0': 128, 'hidden_dim_1': 1024, 'hidden_dim_2': 64, 'kl_weight': 0.00023381763599454554, 'lr': 0.009157524393611194, 'batch_size': 128, 'dropout_rate': 0.10147027319726895, 'prior_mu': -0.008497046231766468, 'prior_sigma': 0.08073300734096357, 'normalization': 'layer'}. Best is trial 896 with value: 0.4533553242683411.
Generating morgan_rdkit fingerprints...
Generated fingerprints with 1280 features for 841 molecules
Trial 1190: 5-fold CV loss = 0.5304
[I 2025-08-07 21:00:24,132] Trial 1190 finished with value: 0.5303832709789276 and parameters: {'fp_type': 'morgan', 'morgan_only_radius': 2, 'morgan_only_nBits': 1024, 'num_hidden_layers': 3, 'hidden_dim_0': 256, 'hidden_dim_1': 1024, 'hidden_dim_2': 256, 'kl_weight': 0.00041858635604459564, 'lr': 0.009728566581609923, 'batch_size': 128, 'dropout_rate': 0.10382686581103213, 'prior_mu': -0.17117598398501888, 'prior_sigma': 0.08283003399048762, 'normalization': 'layer'}. Best is trial 896 with value: 0.4533553242683411.
Generating morgan_rdkit fingerprints...
Generated fingerprints with 1280 features for 841 molecules
Trial 1195: 5-fold CV loss = 0.5105
[I 2025-08-07 21:00:40,996] Trial 1195 finished with value: 0.5105149328708649 and parameters: {'fp_type': 'morgan_rdkit', 'combined_morgan_radius': 3, 'combined_morgan_nBits': 1024, 'combined_rdkit_maxPath': 7, 'combined_rdkit_nBits': 256, 'num_hidden_layers': 3, 'hidden_dim_0': 256, 'hidden_dim_1': 1024, 'hidden_dim_2': 64, 'kl_weight': 0.000347328386624088, 'lr': 0.006878646515964894, 'batch_size': 64, 'dropout_rate': 0.11906728533008115, 'prior_mu': -0.014635722506722196, 'prior_sigma': 0.0747627290744491, 'normalization': 'layer'}. Best is trial 896 with value: 0.4533553242683411.
Generating morgan_rdkit fingerprints...
Generated fingerprints with 1536 features for 841 molecules
Trial 1193: 5-fold CV loss = 0.4672
[I 2025-08-07 21:00:44,847] Trial 1193 finished with value: 0.46715497970581055 and parameters: {'fp_type': 'morgan_rdkit', 'combined_morgan_radius': 3, 'combined_morgan_nBits': 1024, 'combined_rdkit_maxPath': 7, 'combined_rdkit_nBits': 1024, 'num_hidden_layers': 3, 'hidden_dim_0': 128, 'hidden_dim_1': 1024, 'hidden_dim_2': 64, 'kl_weight': 0.00022457702720608342, 'lr': 0.006665395914283563, 'batch_size': 64, 'dropout_rate': 0.1056099203476717, 'prior_mu': -0.009681952507977522, 'prior_sigma': 0.07422855350731064, 'normalization': 'layer'}. Best is trial 896 with value: 0.4533553242683411.
Generating morgan_rdkit fingerprints...
Generated fingerprints with 1536 features for 841 molecules
Trial 1194: 5-fold CV loss = 0.5173
[I 2025-08-07 21:01:00,399] Trial 1194 finished with value: 0.5172935366630554 and parameters: {'fp_type': 'morgan_rdkit', 'combined_morgan_radius': 3, 'combined_morgan_nBits': 1024, 'combined_rdkit_maxPath': 7, 'combined_rdkit_nBits': 256, 'num_hidden_layers': 3, 'hidden_dim_0': 128, 'hidden_dim_1': 1024, 'hidden_dim_2': 64, 'kl_weight': 0.00036421396729897654, 'lr': 0.006828992776149864, 'batch_size': 64, 'dropout_rate': 0.12236535984573164, 'prior_mu': -0.011997807071308186, 'prior_sigma': 0.0745853820380317, 'normalization': 'layer'}. Best is trial 896 with value: 0.4533553242683411.
Generating morgan_rdkit fingerprints...
Generated fingerprints with 1536 features for 841 molecules
Trial 1198: 5-fold CV loss = 0.6382
[I 2025-08-07 21:01:17,139] Trial 1198 finished with value: 0.638188761472702 and parameters: {'fp_type': 'morgan_rdkit', 'combined_morgan_radius': 3, 'combined_morgan_nBits': 1024, 'combined_rdkit_maxPath': 8, 'combined_rdkit_nBits': 512, 'num_hidden_layers': 3, 'hidden_dim_0': 1024, 'hidden_dim_1': 128, 'hidden_dim_2': 64, 'kl_weight': 0.00028238613783960104, 'lr': 0.008201014079058683, 'batch_size': 128, 'dropout_rate': 0.15950635622281398, 'prior_mu': 0.00023760455278043144, 'prior_sigma': 0.08959180683497414, 'normalization': 'layer'}. Best is trial 896 with value: 0.4533553242683411.
Generating morgan_rdkit fingerprints...
Generated fingerprints with 2048 features for 841 molecules
Trial 1197: 5-fold CV loss = 0.5865
[I 2025-08-07 21:01:18,523] Trial 1197 finished with value: 0.5864898800849915 and parameters: {'fp_type': 'morgan_rdkit', 'combined_morgan_radius': 3, 'combined_morgan_nBits': 1024, 'combined_rdkit_maxPath': 8, 'combined_rdkit_nBits': 512, 'num_hidden_layers': 3, 'hidden_dim_0': 1024, 'hidden_dim_1': 1024, 'hidden_dim_2': 64, 'kl_weight': 0.00027955432622527883, 'lr': 0.006273747241334691, 'batch_size': 128, 'dropout_rate': 0.1586994565098126, 'prior_mu': -0.011759397822427034, 'prior_sigma': 0.08811961205459867, 'normalization': 'layer'}. Best is trial 896 with value: 0.4533553242683411.
Generating morgan_rdkit fingerprints...
Generated fingerprints with 2048 features for 841 molecules
Trial 1199: 5-fold CV loss = 0.5822
[I 2025-08-07 21:01:45,489] Trial 1199 finished with value: 0.5821727097034455 and parameters: {'fp_type': 'morgan_rdkit', 'combined_morgan_radius': 3, 'combined_morgan_nBits': 1024, 'combined_rdkit_maxPath': 8, 'combined_rdkit_nBits': 512, 'num_hidden_layers': 3, 'hidden_dim_0': 256, 'hidden_dim_1': 1024, 'hidden_dim_2': 64, 'kl_weight': 0.0002795146102231692, 'lr': 0.008139238560666145, 'batch_size': 128, 'dropout_rate': 0.14211398994804322, 'prior_mu': 0.0012292450195003513, 'prior_sigma': 0.08705816300135497, 'normalization': 'layer'}. Best is trial 896 with value: 0.4533553242683411.
Generating morgan_rdkit fingerprints...
Generated fingerprints with 2048 features for 841 molecules
Trial 1201: 5-fold CV loss = 0.5656
[I 2025-08-07 21:01:50,949] Trial 1201 finished with value: 0.5656418263912201 and parameters: {'fp_type': 'morgan_rdkit', 'combined_morgan_radius': 3, 'combined_morgan_nBits': 1024, 'combined_rdkit_maxPath': 7, 'combined_rdkit_nBits': 1024, 'num_hidden_layers': 3, 'hidden_dim_0': 256, 'hidden_dim_1': 1024, 'hidden_dim_2': 64, 'kl_weight': 0.080380776737294, 'lr': 0.005297504312151501, 'batch_size': 128, 'dropout_rate': 0.14447215539720965, 'prior_mu': -0.018398394936967728, 'prior_sigma': 0.08368754046161297, 'normalization': 'layer'}. Best is trial 896 with value: 0.4533553242683411.
Generating morgan_rdkit fingerprints...
Generated fingerprints with 2048 features for 841 molecules
Trial 1200: 5-fold CV loss = 0.5638
[I 2025-08-07 21:01:57,703] Trial 1200 finished with value: 0.5637628674507141 and parameters: {'fp_type': 'morgan_rdkit', 'combined_morgan_radius': 3, 'combined_morgan_nBits': 1024, 'combined_rdkit_maxPath': 7, 'combined_rdkit_nBits': 1024, 'num_hidden_layers': 3, 'hidden_dim_0': 256, 'hidden_dim_1': 1024, 'hidden_dim_2': 64, 'kl_weight': 0.0002691422791498978, 'lr': 0.005355091817168305, 'batch_size': 128, 'dropout_rate': 0.13879502292520643, 'prior_mu': -0.018557860228570974, 'prior_sigma': 0.1146472916454316, 'normalization': 'layer'}. Best is trial 896 with value: 0.4533553242683411.
Generating morgan_rdkit fingerprints...
Generated fingerprints with 2048 features for 841 molecules
Trial 1196: 5-fold CV loss = 0.5084
[I 2025-08-07 21:02:12,808] Trial 1196 finished with value: 0.5083786904811859 and parameters: {'fp_type': 'morgan_rdkit', 'combined_morgan_radius': 3, 'combined_morgan_nBits': 1024, 'combined_rdkit_maxPath': 7, 'combined_rdkit_nBits': 256, 'num_hidden_layers': 3, 'hidden_dim_0': 256, 'hidden_dim_1': 1024, 'hidden_dim_2': 64, 'kl_weight': 0.00035202343548794434, 'lr': 0.006818713543586097, 'batch_size': 64, 'dropout_rate': 0.1241634548493064, 'prior_mu': -0.014415524057189138, 'prior_sigma': 0.09070361045576396, 'normalization': 'layer'}. Best is trial 896 with value: 0.4533553242683411.
Generating morgan_rdkit fingerprints...
Generated fingerprints with 2048 features for 841 molecules
Trial 1203: 5-fold CV loss = 0.4896
[I 2025-08-07 21:02:22,045] Trial 1203 finished with value: 0.4895627677440643 and parameters: {'fp_type': 'morgan_rdkit', 'combined_morgan_radius': 3, 'combined_morgan_nBits': 1024, 'combined_rdkit_maxPath': 5, 'combined_rdkit_nBits': 1024, 'num_hidden_layers': 3, 'hidden_dim_0': 256, 'hidden_dim_1': 1024, 'hidden_dim_2': 64, 'kl_weight': 0.008200913221029582, 'lr': 0.006098953799849433, 'batch_size': 128, 'dropout_rate': 0.12679616375486125, 'prior_mu': -0.016136979952648258, 'prior_sigma': 0.1169411501591893, 'normalization': 'layer'}. Best is trial 896 with value: 0.4533553242683411.
Generating morgan_rdkit fingerprints...
Generated fingerprints with 2048 features for 841 molecules
Trial 1204: 5-fold CV loss = 0.4615
[I 2025-08-07 21:02:37,821] Trial 1204 finished with value: 0.46153266429901124 and parameters: {'fp_type': 'morgan_rdkit', 'combined_morgan_radius': 3, 'combined_morgan_nBits': 1024, 'combined_rdkit_maxPath': 7, 'combined_rdkit_nBits': 1024, 'num_hidden_layers': 3, 'hidden_dim_0': 256, 'hidden_dim_1': 1024, 'hidden_dim_2': 64, 'kl_weight': 0.00033611226191692555, 'lr': 0.00620247674053365, 'batch_size': 128, 'dropout_rate': 0.12522406075074483, 'prior_mu': -0.02659147693098834, 'prior_sigma': 0.07911974611831768, 'normalization': 'layer'}. Best is trial 896 with value: 0.4533553242683411.
Generating morgan_rdkit fingerprints...
Generated fingerprints with 2048 features for 841 molecules
Trial 1206: 5-fold CV loss = 0.4709
[I 2025-08-07 21:02:54,386] Trial 1206 finished with value: 0.4709292113780975 and parameters: {'fp_type': 'morgan_rdkit', 'combined_morgan_radius': 3, 'combined_morgan_nBits': 1024, 'combined_rdkit_maxPath': 7, 'combined_rdkit_nBits': 1024, 'num_hidden_layers': 3, 'hidden_dim_0': 256, 'hidden_dim_1': 1024, 'hidden_dim_2': 64, 'kl_weight': 0.0003132819180349192, 'lr': 0.0077698758163169636, 'batch_size': 128, 'dropout_rate': 0.11050391047744355, 'prior_mu': 0.015424014184012375, 'prior_sigma': 0.07886403359876043, 'normalization': 'layer'}. Best is trial 896 with value: 0.4533553242683411.
Generating morgan_rdkit fingerprints...
Generated fingerprints with 2048 features for 841 molecules
Trial 1202: 5-fold CV loss = 0.4718
[I 2025-08-07 21:02:55,744] Trial 1202 finished with value: 0.4717813849449158 and parameters: {'fp_type': 'morgan_rdkit', 'combined_morgan_radius': 3, 'combined_morgan_nBits': 1024, 'combined_rdkit_maxPath': 7, 'combined_rdkit_nBits': 1024, 'num_hidden_layers': 3, 'hidden_dim_0': 256, 'hidden_dim_1': 1024, 'hidden_dim_2': 64, 'kl_weight': 0.00035622757530182856, 'lr': 0.005259504900777721, 'batch_size': 128, 'dropout_rate': 0.13347579005758795, 'prior_mu': -0.019368592349077077, 'prior_sigma': 0.1140039802079578, 'normalization': 'layer'}. Best is trial 896 with value: 0.4533553242683411.
Generating morgan_rdkit fingerprints...
Generated fingerprints with 2048 features for 841 molecules
Trial 1207: 5-fold CV loss = 0.4682
[I 2025-08-07 21:03:24,729] Trial 1207 finished with value: 0.4682128131389618 and parameters: {'fp_type': 'morgan_rdkit', 'combined_morgan_radius': 3, 'combined_morgan_nBits': 1024, 'combined_rdkit_maxPath': 7, 'combined_rdkit_nBits': 1024, 'num_hidden_layers': 3, 'hidden_dim_0': 512, 'hidden_dim_1': 1024, 'hidden_dim_2': 64, 'kl_weight': 0.00046064315234920286, 'lr': 0.007462473030321839, 'batch_size': 128, 'dropout_rate': 0.11209150974721246, 'prior_mu': 0.005783979202532306, 'prior_sigma': 0.10568032025730525, 'normalization': 'layer'}. Best is trial 896 with value: 0.4533553242683411.
Trial 1205: 5-fold CV loss = 0.4815
[I 2025-08-07 21:03:24,744] Trial 1205 finished with value: 0.481490421295166 and parameters: {'fp_type': 'morgan_rdkit', 'combined_morgan_radius': 3, 'combined_morgan_nBits': 1024, 'combined_rdkit_maxPath': 5, 'combined_rdkit_nBits': 1024, 'num_hidden_layers': 3, 'hidden_dim_0': 256, 'hidden_dim_1': 1024, 'hidden_dim_2': 64, 'kl_weight': 0.0003240863445307189, 'lr': 0.006088663333181503, 'batch_size': 128, 'dropout_rate': 0.12817077271702854, 'prior_mu': -0.026847841687398517, 'prior_sigma': 0.07815791932450253, 'normalization': 'layer'}. Best is trial 896 with value: 0.4533553242683411.
Generating morgan_rdkit fingerprints...
Generated fingerprints with 2048 features for 841 molecules
Generating morgan_rdkit fingerprints...
Generated fingerprints with 2048 features for 841 molecules
Trial 1208: 5-fold CV loss = 0.4695
[I 2025-08-07 21:03:31,360] Trial 1208 finished with value: 0.4694636702537537 and parameters: {'fp_type': 'morgan_rdkit', 'combined_morgan_radius': 3, 'combined_morgan_nBits': 1024, 'combined_rdkit_maxPath': 7, 'combined_rdkit_nBits': 1024, 'num_hidden_layers': 3, 'hidden_dim_0': 512, 'hidden_dim_1': 1024, 'hidden_dim_2': 64, 'kl_weight': 0.0003947941948172577, 'lr': 0.005576029958972379, 'batch_size': 128, 'dropout_rate': 0.09399972185892992, 'prior_mu': 0.00475334173308687, 'prior_sigma': 0.06243266587927729, 'normalization': 'layer'}. Best is trial 896 with value: 0.4533553242683411.
Generating morgan_rdkit fingerprints...
Generated fingerprints with 2048 features for 841 molecules
Trial 1209: 5-fold CV loss = 0.8883
[I 2025-08-07 21:03:33,597] Trial 1209 finished with value: 0.888277280330658 and parameters: {'fp_type': 'morgan_rdkit', 'combined_morgan_radius': 3, 'combined_morgan_nBits': 1024, 'combined_rdkit_maxPath': 7, 'combined_rdkit_nBits': 1024, 'num_hidden_layers': 3, 'hidden_dim_0': 256, 'hidden_dim_1': 1024, 'hidden_dim_2': 1024, 'kl_weight': 0.0004569503617769213, 'lr': 0.007164309003065731, 'batch_size': 128, 'dropout_rate': 0.09603006254358336, 'prior_mu': 0.0040864322458353955, 'prior_sigma': 0.10612917730753935, 'normalization': 'layer'}. Best is trial 896 with value: 0.4533553242683411.
Generating morgan_rdkit fingerprints...
Generated fingerprints with 2048 features for 841 molecules
Trial 1212: 5-fold CV loss = 0.8910
[I 2025-08-07 21:03:44,440] Trial 1212 finished with value: 0.8909575343132019 and parameters: {'fp_type': 'morgan_rdkit', 'combined_morgan_radius': 3, 'combined_morgan_nBits': 1024, 'combined_rdkit_maxPath': 7, 'combined_rdkit_nBits': 1024, 'num_hidden_layers': 3, 'hidden_dim_0': 256, 'hidden_dim_1': 256, 'hidden_dim_2': 1024, 'kl_weight': 0.00023891956351763553, 'lr': 0.008413681732385742, 'batch_size': 128, 'dropout_rate': 0.15252609694039518, 'prior_mu': -0.00682425974416522, 'prior_sigma': 0.1402211187221694, 'normalization': 'layer'}. Best is trial 896 with value: 0.4533553242683411.
Generating morgan_rdkit fingerprints...
Generated fingerprints with 2048 features for 841 molecules
Trial 1214: 5-fold CV loss = 0.8802
[I 2025-08-07 21:04:01,946] Trial 1214 finished with value: 0.8802481889724731 and parameters: {'fp_type': 'morgan_rdkit', 'combined_morgan_radius': 3, 'combined_morgan_nBits': 1024, 'combined_rdkit_maxPath': 7, 'combined_rdkit_nBits': 1024, 'num_hidden_layers': 3, 'hidden_dim_0': 256, 'hidden_dim_1': 1024, 'hidden_dim_2': 64, 'kl_weight': 0.0002521097296306699, 'lr': 0.00044556009374480257, 'batch_size': 128, 'dropout_rate': 0.1686499145599584, 'prior_mu': -0.009493960607086557, 'prior_sigma': 0.0707536867838766, 'normalization': 'layer'}. Best is trial 896 with value: 0.4533553242683411.
Generating morgan_rdkit fingerprints...
Generated fingerprints with 2048 features for 841 molecules
Trial 1211: 5-fold CV loss = 0.8940
[I 2025-08-07 21:04:10,630] Trial 1211 finished with value: 0.8940271258354187 and parameters: {'fp_type': 'morgan_rdkit', 'combined_morgan_radius': 3, 'combined_morgan_nBits': 1024, 'combined_rdkit_maxPath': 7, 'combined_rdkit_nBits': 1024, 'num_hidden_layers': 3, 'hidden_dim_0': 256, 'hidden_dim_1': 1024, 'hidden_dim_2': 1024, 'kl_weight': 0.0002353788560075953, 'lr': 0.006985420833189774, 'batch_size': 128, 'dropout_rate': 0.09127232773014332, 'prior_mu': -0.007265883146768858, 'prior_sigma': 0.13884089571772723, 'normalization': 'layer'}. Best is trial 896 with value: 0.4533553242683411.
Generating morgan_rdkit fingerprints...
Generated fingerprints with 2048 features for 841 molecules
Trial 1210: 5-fold CV loss = 0.6182
[I 2025-08-07 21:04:15,228] Trial 1210 finished with value: 0.6182321190834046 and parameters: {'fp_type': 'morgan_rdkit', 'combined_morgan_radius': 3, 'combined_morgan_nBits': 1024, 'combined_rdkit_maxPath': 7, 'combined_rdkit_nBits': 1024, 'num_hidden_layers': 3, 'hidden_dim_0': 256, 'hidden_dim_1': 1024, 'hidden_dim_2': 1024, 'kl_weight': 0.00024019359236929046, 'lr': 0.008620169421101212, 'batch_size': 128, 'dropout_rate': 0.09497005184290257, 'prior_mu': -0.006178042080315343, 'prior_sigma': 0.062134008799446694, 'normalization': 'layer'}. Best is trial 896 with value: 0.4533553242683411.
Generating morgan_rdkit fingerprints...
Generated fingerprints with 2048 features for 841 molecules
Trial 1213: 5-fold CV loss = 0.5404
[I 2025-08-07 21:04:18,507] Trial 1213 finished with value: 0.5403925597667694 and parameters: {'fp_type': 'morgan_rdkit', 'combined_morgan_radius': 3, 'combined_morgan_nBits': 1024, 'combined_rdkit_maxPath': 7, 'combined_rdkit_nBits': 1024, 'num_hidden_layers': 3, 'hidden_dim_0': 256, 'hidden_dim_1': 256, 'hidden_dim_2': 64, 'kl_weight': 0.0002449326027530946, 'lr': 0.008696193240940063, 'batch_size': 128, 'dropout_rate': 0.15211225902352538, 'prior_mu': -0.0071286114255422126, 'prior_sigma': 0.07157719569963981, 'normalization': 'layer'}. Best is trial 896 with value: 0.4533553242683411.
Generating morgan_rdkit fingerprints...
Generated fingerprints with 2048 features for 841 molecules
Trial 1215: 5-fold CV loss = 0.4646
