[I 2025-08-08 01:26:25,165] Trial 2537 finished with value: 0.735080623626709 and parameters: {'fp_type': 'morgan_rdkit', 'combined_morgan_radius': 2, 'combined_morgan_nBits': 1024, 'combined_rdkit_maxPath': 7, 'combined_rdkit_nBits': 512, 'num_hidden_layers': 3, 'hidden_dim_0': 256, 'hidden_dim_1': 512, 'hidden_dim_2': 64, 'kl_weight': 0.00021673538482603683, 'lr': 0.007960456513926843, 'batch_size': 128, 'dropout_rate': 0.06873827905177733, 'prior_mu': -0.04325981402556165, 'prior_sigma': 0.11516849817011138, 'normalization': 'layer'}. Best is trial 896 with value: 0.4533553242683411.
Generating morgan_rdkit fingerprints...
Generated fingerprints with 2048 features for 841 molecules
Trial 2536: 5-fold CV loss = 0.4915
[I 2025-08-08 01:26:36,440] Trial 2536 finished with value: 0.49148069620132445 and parameters: {'fp_type': 'morgan_rdkit', 'combined_morgan_radius': 2, 'combined_morgan_nBits': 1024, 'combined_rdkit_maxPath': 6, 'combined_rdkit_nBits': 512, 'num_hidden_layers': 3, 'hidden_dim_0': 256, 'hidden_dim_1': 1024, 'hidden_dim_2': 64, 'kl_weight': 0.0002286876911916904, 'lr': 0.007964397334166451, 'batch_size': 128, 'dropout_rate': 0.07004847814815232, 'prior_mu': -0.0447115020172539, 'prior_sigma': 0.11566903411042816, 'normalization': 'layer'}. Best is trial 896 with value: 0.4533553242683411.
Generating morgan_rdkit fingerprints...
Generated fingerprints with 2048 features for 841 molecules
Trial 2535: 5-fold CV loss = 0.4838
[I 2025-08-08 01:26:39,356] Trial 2535 finished with value: 0.48380271792411805 and parameters: {'fp_type': 'morgan_rdkit', 'combined_morgan_radius': 3, 'combined_morgan_nBits': 1024, 'combined_rdkit_maxPath': 6, 'combined_rdkit_nBits': 512, 'num_hidden_layers': 3, 'hidden_dim_0': 256, 'hidden_dim_1': 1024, 'hidden_dim_2': 64, 'kl_weight': 0.0002789984764962535, 'lr': 0.009979124441085849, 'batch_size': 128, 'dropout_rate': 0.10688048900537017, 'prior_mu': -0.031924157093748004, 'prior_sigma': 0.07825659079220942, 'normalization': 'layer'}. Best is trial 896 with value: 0.4533553242683411.
Generating morgan_rdkit fingerprints...
Generated fingerprints with 2048 features for 841 molecules
Trial 2539: 5-fold CV loss = 0.4660
[I 2025-08-08 01:26:58,524] Trial 2539 finished with value: 0.4659534990787506 and parameters: {'fp_type': 'morgan_rdkit', 'combined_morgan_radius': 3, 'combined_morgan_nBits': 1024, 'combined_rdkit_maxPath': 7, 'combined_rdkit_nBits': 1024, 'num_hidden_layers': 3, 'hidden_dim_0': 256, 'hidden_dim_1': 1024, 'hidden_dim_2': 64, 'kl_weight': 0.00027780143280770904, 'lr': 0.008572035809232856, 'batch_size': 128, 'dropout_rate': 0.11203963268363883, 'prior_mu': -0.022524198731442156, 'prior_sigma': 0.07873257363690707, 'normalization': 'layer'}. Best is trial 896 with value: 0.4533553242683411.
Generating morgan_rdkit fingerprints...
Generated fingerprints with 2048 features for 841 molecules
Trial 2540: 5-fold CV loss = 0.7188
[I 2025-08-08 01:27:05,946] Trial 2540 finished with value: 0.7188003301620484 and parameters: {'fp_type': 'morgan_rdkit', 'combined_morgan_radius': 3, 'combined_morgan_nBits': 1024, 'combined_rdkit_maxPath': 7, 'combined_rdkit_nBits': 1024, 'num_hidden_layers': 3, 'hidden_dim_0': 256, 'hidden_dim_1': 1024, 'hidden_dim_2': 64, 'kl_weight': 0.00026005882058248436, 'lr': 0.0014980610424188477, 'batch_size': 128, 'dropout_rate': 0.10985872825943498, 'prior_mu': -0.024306788300739353, 'prior_sigma': 0.08871581848803653, 'normalization': 'layer'}. Best is trial 896 with value: 0.4533553242683411.
Generating morgan_rdkit fingerprints...
Generated fingerprints with 2048 features for 841 molecules
Trial 2542: 5-fold CV loss = 0.8959
[I 2025-08-08 01:27:15,849] Trial 2542 finished with value: 0.8959139466285706 and parameters: {'fp_type': 'morgan_rdkit', 'combined_morgan_radius': 3, 'combined_morgan_nBits': 1024, 'combined_rdkit_maxPath': 7, 'combined_rdkit_nBits': 1024, 'num_hidden_layers': 3, 'hidden_dim_0': 256, 'hidden_dim_1': 1024, 'hidden_dim_2': 1024, 'kl_weight': 0.002710150264789095, 'lr': 0.0072132499124501984, 'batch_size': 128, 'dropout_rate': 0.08477527113401306, 'prior_mu': -0.004698466471302003, 'prior_sigma': 0.09554944542559739, 'normalization': 'layer'}. Best is trial 896 with value: 0.4533553242683411.
Generating morgan_rdkit fingerprints...
Generated fingerprints with 2048 features for 841 molecules
Trial 2543: 5-fold CV loss = 0.8768
[I 2025-08-08 01:27:29,969] Trial 2543 finished with value: 0.8768473267555237 and parameters: {'fp_type': 'morgan_rdkit', 'combined_morgan_radius': 3, 'combined_morgan_nBits': 1024, 'combined_rdkit_maxPath': 7, 'combined_rdkit_nBits': 1024, 'num_hidden_layers': 3, 'hidden_dim_0': 256, 'hidden_dim_1': 1024, 'hidden_dim_2': 1024, 'kl_weight': 0.00041605400289016306, 'lr': 0.0005883750340997816, 'batch_size': 128, 'dropout_rate': 0.08957858820572331, 'prior_mu': -0.004003933898716783, 'prior_sigma': 0.08419521328407992, 'normalization': 'layer'}. Best is trial 896 with value: 0.4533553242683411.
Generating morgan_rdkit fingerprints...
Generated fingerprints with 2048 features for 841 molecules
Trial 2541: 5-fold CV loss = 0.4721
[I 2025-08-08 01:27:36,988] Trial 2541 finished with value: 0.47213574051856994 and parameters: {'fp_type': 'morgan_rdkit', 'combined_morgan_radius': 3, 'combined_morgan_nBits': 1024, 'combined_rdkit_maxPath': 7, 'combined_rdkit_nBits': 1024, 'num_hidden_layers': 3, 'hidden_dim_0': 256, 'hidden_dim_1': 1024, 'hidden_dim_2': 64, 'kl_weight': 0.00040668747361283025, 'lr': 0.008504587344134047, 'batch_size': 128, 'dropout_rate': 0.0813024852729405, 'prior_mu': -0.005660137922079185, 'prior_sigma': 0.08317266917546283, 'normalization': 'layer'}. Best is trial 896 with value: 0.4533553242683411.
Generating morgan_rdkit fingerprints...
Generated fingerprints with 2048 features for 841 molecules
Trial 2538: 5-fold CV loss = 0.4758
[I 2025-08-08 01:27:42,353] Trial 2538 finished with value: 0.47576252222061155 and parameters: {'fp_type': 'morgan_rdkit', 'combined_morgan_radius': 3, 'combined_morgan_nBits': 1024, 'combined_rdkit_maxPath': 6, 'combined_rdkit_nBits': 1024, 'num_hidden_layers': 3, 'hidden_dim_0': 256, 'hidden_dim_1': 512, 'hidden_dim_2': 64, 'kl_weight': 0.0006307253078048045, 'lr': 0.008095203379267979, 'batch_size': 128, 'dropout_rate': 0.06719184472550575, 'prior_mu': -0.12737153477942628, 'prior_sigma': 0.08930525572553571, 'normalization': 'layer'}. Best is trial 896 with value: 0.4533553242683411.
Generating morgan_rdkit fingerprints...
Generated fingerprints with 2048 features for 841 molecules
Trial 2544: 5-fold CV loss = 0.4692
[I 2025-08-08 01:27:52,323] Trial 2544 finished with value: 0.46920886635780334 and parameters: {'fp_type': 'morgan_rdkit', 'combined_morgan_radius': 3, 'combined_morgan_nBits': 1024, 'combined_rdkit_maxPath': 7, 'combined_rdkit_nBits': 1024, 'num_hidden_layers': 3, 'hidden_dim_0': 256, 'hidden_dim_1': 1024, 'hidden_dim_2': 64, 'kl_weight': 0.0003657496512064489, 'lr': 0.009063709757870493, 'batch_size': 128, 'dropout_rate': 0.09398583949766291, 'prior_mu': -0.015933573741827415, 'prior_sigma': 0.08474145557446534, 'normalization': 'layer'}. Best is trial 896 with value: 0.4533553242683411.
Generating morgan_rdkit fingerprints...
Generated fingerprints with 2048 features for 841 molecules
Trial 2545: 5-fold CV loss = 0.4649
[I 2025-08-08 01:28:14,794] Trial 2545 finished with value: 0.4648812174797058 and parameters: {'fp_type': 'morgan_rdkit', 'combined_morgan_radius': 3, 'combined_morgan_nBits': 1024, 'combined_rdkit_maxPath': 7, 'combined_rdkit_nBits': 1024, 'num_hidden_layers': 3, 'hidden_dim_0': 256, 'hidden_dim_1': 1024, 'hidden_dim_2': 64, 'kl_weight': 0.0005965124111497957, 'lr': 0.008521547162550167, 'batch_size': 128, 'dropout_rate': 0.0625921450464128, 'prior_mu': -0.021420253981334805, 'prior_sigma': 0.10262525960884412, 'normalization': 'layer'}. Best is trial 896 with value: 0.4533553242683411.
Generating morgan_rdkit fingerprints...
Generated fingerprints with 2048 features for 841 molecules
Trial 2548: 5-fold CV loss = 0.5357
[I 2025-08-08 01:28:30,234] Trial 2548 finished with value: 0.5357173800468444 and parameters: {'fp_type': 'morgan_rdkit', 'combined_morgan_radius': 3, 'combined_morgan_nBits': 1024, 'combined_rdkit_maxPath': 7, 'combined_rdkit_nBits': 1024, 'num_hidden_layers': 3, 'hidden_dim_0': 256, 'hidden_dim_1': 1024, 'hidden_dim_2': 64, 'kl_weight': 0.00016790311948015592, 'lr': 0.006135135759165359, 'batch_size': 128, 'dropout_rate': 0.09505570882352274, 'prior_mu': 0.026711043202777267, 'prior_sigma': 0.10613790391291332, 'normalization': 'layer'}. Best is trial 896 with value: 0.4533553242683411.
Generating morgan_rdkit fingerprints...
Generated fingerprints with 2048 features for 841 molecules
Trial 2546: 5-fold CV loss = 0.4660
[I 2025-08-08 01:28:42,046] Trial 2546 finished with value: 0.46596338748931887 and parameters: {'fp_type': 'morgan_rdkit', 'combined_morgan_radius': 3, 'combined_morgan_nBits': 1024, 'combined_rdkit_maxPath': 7, 'combined_rdkit_nBits': 1024, 'num_hidden_layers': 3, 'hidden_dim_0': 256, 'hidden_dim_1': 1024, 'hidden_dim_2': 64, 'kl_weight': 0.0003576220940800271, 'lr': 0.009178767042754398, 'batch_size': 128, 'dropout_rate': 0.09686008771309351, 'prior_mu': -0.08951963591622086, 'prior_sigma': 0.10683285771967076, 'normalization': 'layer'}. Best is trial 896 with value: 0.4533553242683411.
Generating morgan_rdkit fingerprints...
Generated fingerprints with 2048 features for 841 molecules
Trial 2549: 5-fold CV loss = 0.7335
[I 2025-08-08 01:28:47,889] Trial 2549 finished with value: 0.7334883689880372 and parameters: {'fp_type': 'morgan_rdkit', 'combined_morgan_radius': 3, 'combined_morgan_nBits': 1024, 'combined_rdkit_maxPath': 7, 'combined_rdkit_nBits': 1024, 'num_hidden_layers': 3, 'hidden_dim_0': 256, 'hidden_dim_1': 1024, 'hidden_dim_2': 256, 'kl_weight': 0.00016832076947341946, 'lr': 0.009989237469064863, 'batch_size': 128, 'dropout_rate': 0.09879944142184889, 'prior_mu': 0.018857192644264404, 'prior_sigma': 0.160689318528156, 'normalization': 'layer'}. Best is trial 896 with value: 0.4533553242683411.
Generating morgan_rdkit fingerprints...
Generated fingerprints with 2048 features for 841 molecules
Trial 2547: 5-fold CV loss = 0.7266
[I 2025-08-08 01:28:58,520] Trial 2547 finished with value: 0.7265902817249298 and parameters: {'fp_type': 'morgan_rdkit', 'combined_morgan_radius': 3, 'combined_morgan_nBits': 1024, 'combined_rdkit_maxPath': 7, 'combined_rdkit_nBits': 1024, 'num_hidden_layers': 3, 'hidden_dim_0': 256, 'hidden_dim_1': 1024, 'hidden_dim_2': 256, 'kl_weight': 0.0003575595651487576, 'lr': 0.009277261743216157, 'batch_size': 128, 'dropout_rate': 0.09281890707064167, 'prior_mu': 0.023706689300080075, 'prior_sigma': 0.1071325359064079, 'normalization': 'layer'}. Best is trial 896 with value: 0.4533553242683411.
Generating morgan_rdkit fingerprints...
Generated fingerprints with 2048 features for 841 molecules
Trial 2550: 5-fold CV loss = 0.4680
[I 2025-08-08 01:29:14,055] Trial 2550 finished with value: 0.467955482006073 and parameters: {'fp_type': 'morgan_rdkit', 'combined_morgan_radius': 3, 'combined_morgan_nBits': 1024, 'combined_rdkit_maxPath': 7, 'combined_rdkit_nBits': 1024, 'num_hidden_layers': 3, 'hidden_dim_0': 256, 'hidden_dim_1': 1024, 'hidden_dim_2': 64, 'kl_weight': 0.0003331976213865943, 'lr': 0.007208935545497774, 'batch_size': 128, 'dropout_rate': 0.12396161995114421, 'prior_mu': -0.043502738379908375, 'prior_sigma': 0.12077728706284498, 'normalization': 'layer'}. Best is trial 896 with value: 0.4533553242683411.
Generating morgan_rdkit fingerprints...
Generated fingerprints with 2048 features for 841 molecules
Trial 2551: 5-fold CV loss = 0.7140
[I 2025-08-08 01:29:19,187] Trial 2551 finished with value: 0.7140069425106048 and parameters: {'fp_type': 'morgan_rdkit', 'combined_morgan_radius': 3, 'combined_morgan_nBits': 1024, 'combined_rdkit_maxPath': 7, 'combined_rdkit_nBits': 1024, 'num_hidden_layers': 3, 'hidden_dim_0': 256, 'hidden_dim_1': 1024, 'hidden_dim_2': 256, 'kl_weight': 0.00023219448225384793, 'lr': 0.007312290860598052, 'batch_size': 128, 'dropout_rate': 0.12117837836137049, 'prior_mu': 0.009238395715768191, 'prior_sigma': 0.09695802611067422, 'normalization': 'layer'}. Best is trial 896 with value: 0.4533553242683411.
Generating morgan_rdkit fingerprints...
Generated fingerprints with 2048 features for 841 molecules
Trial 2552: 5-fold CV loss = 0.4709
[I 2025-08-08 01:29:28,539] Trial 2552 finished with value: 0.470880126953125 and parameters: {'fp_type': 'morgan_rdkit', 'combined_morgan_radius': 3, 'combined_morgan_nBits': 1024, 'combined_rdkit_maxPath': 7, 'combined_rdkit_nBits': 1024, 'num_hidden_layers': 3, 'hidden_dim_0': 256, 'hidden_dim_1': 1024, 'hidden_dim_2': 64, 'kl_weight': 0.0002258518918193463, 'lr': 0.007213888979514653, 'batch_size': 128, 'dropout_rate': 0.12306381842392337, 'prior_mu': 0.008766420185483154, 'prior_sigma': 0.07435470432311037, 'normalization': 'layer'}. Best is trial 896 with value: 0.4533553242683411.
Generating morgan_rdkit fingerprints...
Generated fingerprints with 2048 features for 841 molecules
Trial 2554: 5-fold CV loss = 0.5598
[I 2025-08-08 01:29:46,399] Trial 2554 finished with value: 0.5597532868385315 and parameters: {'fp_type': 'morgan_rdkit', 'combined_morgan_radius': 3, 'combined_morgan_nBits': 1024, 'combined_rdkit_maxPath': 7, 'combined_rdkit_nBits': 1024, 'num_hidden_layers': 3, 'hidden_dim_0': 256, 'hidden_dim_1': 1024, 'hidden_dim_2': 64, 'kl_weight': 0.00022539801370580304, 'lr': 0.006685444934813907, 'batch_size': 128, 'dropout_rate': 0.11499522676512904, 'prior_mu': 0.00749919991973544, 'prior_sigma': 0.07403554639388225, 'normalization': 'layer'}. Best is trial 896 with value: 0.4533553242683411.
Generating morgan_rdkit fingerprints...
Generated fingerprints with 2048 features for 841 molecules
Trial 2556: 5-fold CV loss = 0.4661
[I 2025-08-08 01:30:11,731] Trial 2556 finished with value: 0.46610291600227355 and parameters: {'fp_type': 'morgan_rdkit', 'combined_morgan_radius': 3, 'combined_morgan_nBits': 1024, 'combined_rdkit_maxPath': 7, 'combined_rdkit_nBits': 1024, 'num_hidden_layers': 3, 'hidden_dim_0': 256, 'hidden_dim_1': 1024, 'hidden_dim_2': 64, 'kl_weight': 0.00028837607894249834, 'lr': 0.007796087085038146, 'batch_size': 128, 'dropout_rate': 0.08342370893487196, 'prior_mu': -0.015226246815967834, 'prior_sigma': 0.09293986702388238, 'normalization': 'layer'}. Best is trial 896 with value: 0.4533553242683411.
Generating morgan_rdkit fingerprints...
Generated fingerprints with 2048 features for 841 molecules
Trial 2553: 5-fold CV loss = 0.4612
[I 2025-08-08 01:30:31,312] Trial 2553 finished with value: 0.4612321317195892 and parameters: {'fp_type': 'morgan_rdkit', 'combined_morgan_radius': 3, 'combined_morgan_nBits': 1024, 'combined_rdkit_maxPath': 7, 'combined_rdkit_nBits': 1024, 'num_hidden_layers': 3, 'hidden_dim_0': 256, 'hidden_dim_1': 1024, 'hidden_dim_2': 64, 'kl_weight': 0.00022602186454515866, 'lr': 0.007059134157329202, 'batch_size': 128, 'dropout_rate': 0.12306533862386994, 'prior_mu': 0.008987914979542544, 'prior_sigma': 0.09737815076286546, 'normalization': 'layer'}. Best is trial 896 with value: 0.4533553242683411.
Generating morgan_rdkit fingerprints...
Generated fingerprints with 2048 features for 841 molecules
Trial 2555: 5-fold CV loss = 0.4714
[I 2025-08-08 01:30:44,968] Trial 2555 finished with value: 0.47136550545692446 and parameters: {'fp_type': 'morgan_rdkit', 'combined_morgan_radius': 3, 'combined_morgan_nBits': 1024, 'combined_rdkit_maxPath': 7, 'combined_rdkit_nBits': 1024, 'num_hidden_layers': 3, 'hidden_dim_0': 256, 'hidden_dim_1': 1024, 'hidden_dim_2': 64, 'kl_weight': 0.0002924728873942073, 'lr': 0.00667694779125855, 'batch_size': 64, 'dropout_rate': 0.08194311715053107, 'prior_mu': -0.02768717419965005, 'prior_sigma': 0.12904171845985213, 'normalization': 'layer'}. Best is trial 896 with value: 0.4533553242683411.
Generating morgan_rdkit fingerprints...
Generated fingerprints with 2048 features for 841 molecules
Trial 2557: 5-fold CV loss = 0.4693
[I 2025-08-08 01:30:51,762] Trial 2557 finished with value: 0.46929476857185365 and parameters: {'fp_type': 'morgan_rdkit', 'combined_morgan_radius': 3, 'combined_morgan_nBits': 1024, 'combined_rdkit_maxPath': 7, 'combined_rdkit_nBits': 1024, 'num_hidden_layers': 3, 'hidden_dim_0': 256, 'hidden_dim_1': 1024, 'hidden_dim_2': 512, 'kl_weight': 0.0005010562855014461, 'lr': 0.005961996480245976, 'batch_size': 64, 'dropout_rate': 0.08232789134523262, 'prior_mu': -0.02651793646378091, 'prior_sigma': 0.09304862313490703, 'normalization': 'layer'}. Best is trial 896 with value: 0.4533553242683411.
Generating morgan_rdkit fingerprints...
Generated fingerprints with 2048 features for 841 molecules
Trial 2558: 5-fold CV loss = 0.4803
[I 2025-08-08 01:31:00,409] Trial 2558 finished with value: 0.48026289939880373 and parameters: {'fp_type': 'morgan_rdkit', 'combined_morgan_radius': 3, 'combined_morgan_nBits': 1024, 'combined_rdkit_maxPath': 7, 'combined_rdkit_nBits': 1024, 'num_hidden_layers': 3, 'hidden_dim_0': 64, 'hidden_dim_1': 1024, 'hidden_dim_2': 64, 'kl_weight': 0.0004986132244312222, 'lr': 0.006068525270987341, 'batch_size': 64, 'dropout_rate': 0.051219034311020206, 'prior_mu': -0.029963233377202383, 'prior_sigma': 0.08124760839592322, 'normalization': 'layer'}. Best is trial 896 with value: 0.4533553242683411.
Generating morgan_rdkit fingerprints...
Generated fingerprints with 2048 features for 841 molecules
Trial 2561: 5-fold CV loss = 0.4724
[I 2025-08-08 01:31:25,022] Trial 2561 finished with value: 0.4723976254463196 and parameters: {'fp_type': 'morgan_rdkit', 'combined_morgan_radius': 3, 'combined_morgan_nBits': 1024, 'combined_rdkit_maxPath': 7, 'combined_rdkit_nBits': 1024, 'num_hidden_layers': 3, 'hidden_dim_0': 64, 'hidden_dim_1': 1024, 'hidden_dim_2': 64, 'kl_weight': 0.00018265132601422311, 'lr': 0.00789070903013964, 'batch_size': 128, 'dropout_rate': 0.047962709315533744, 'prior_mu': -0.040649869854667196, 'prior_sigma': 0.08036575650804118, 'normalization': 'layer'}. Best is trial 896 with value: 0.4533553242683411.
Generating morgan_rdkit fingerprints...
Generated fingerprints with 1280 features for 841 molecules
Trial 2560: 5-fold CV loss = 0.4692
[I 2025-08-08 01:31:35,695] Trial 2560 finished with value: 0.4692128777503967 and parameters: {'fp_type': 'morgan_rdkit', 'combined_morgan_radius': 3, 'combined_morgan_nBits': 1024, 'combined_rdkit_maxPath': 7, 'combined_rdkit_nBits': 1024, 'num_hidden_layers': 3, 'hidden_dim_0': 1024, 'hidden_dim_1': 1024, 'hidden_dim_2': 64, 'kl_weight': 0.00019035692698200508, 'lr': 0.008109198152061, 'batch_size': 128, 'dropout_rate': 0.0508849274649473, 'prior_mu': -0.03994325016742941, 'prior_sigma': 0.08052050660327026, 'normalization': 'layer'}. Best is trial 896 with value: 0.4533553242683411.
Generating morgan_rdkit fingerprints...
Generated fingerprints with 1280 features for 841 molecules
Trial 2562: 5-fold CV loss = 0.5013
[I 2025-08-08 01:31:46,357] Trial 2562 finished with value: 0.5013247489929199 and parameters: {'fp_type': 'morgan_rdkit', 'combined_morgan_radius': 3, 'combined_morgan_nBits': 1024, 'combined_rdkit_maxPath': 7, 'combined_rdkit_nBits': 1024, 'num_hidden_layers': 1, 'hidden_dim_0': 1024, 'kl_weight': 0.00031821754225882024, 'lr': 0.007926055228644984, 'batch_size': 128, 'dropout_rate': 0.10581615359674015, 'prior_mu': -0.04010973385808376, 'prior_sigma': 0.1010769608409415, 'normalization': 'layer'}. Best is trial 896 with value: 0.4533553242683411.
Generating morgan_rdkit fingerprints...
Generated fingerprints with 1280 features for 841 molecules
Trial 2563: 5-fold CV loss = 0.5782
[I 2025-08-08 01:31:51,609] Trial 2563 finished with value: 0.5781854450702667 and parameters: {'fp_type': 'morgan_rdkit', 'combined_morgan_radius': 3, 'combined_morgan_nBits': 1024, 'combined_rdkit_maxPath': 7, 'combined_rdkit_nBits': 256, 'num_hidden_layers': 3, 'hidden_dim_0': 256, 'hidden_dim_1': 1024, 'hidden_dim_2': 64, 'kl_weight': 0.00043715217640117964, 'lr': 0.008674312569206673, 'batch_size': 128, 'dropout_rate': 0.10791118781287833, 'prior_mu': -0.04923021950208866, 'prior_sigma': 0.10081753486335479, 'normalization': 'layer'}. Best is trial 896 with value: 0.4533553242683411.
Generating rdkit fingerprints...
Generated fingerprints with 512 features for 841 molecules
Trial 2565: 5-fold CV loss = 0.6053
[I 2025-08-08 01:32:15,038] Trial 2565 finished with value: 0.6052799344062805 and parameters: {'fp_type': 'morgan_rdkit', 'combined_morgan_radius': 3, 'combined_morgan_nBits': 1024, 'combined_rdkit_maxPath': 7, 'combined_rdkit_nBits': 256, 'num_hidden_layers': 3, 'hidden_dim_0': 256, 'hidden_dim_1': 1024, 'hidden_dim_2': 64, 'kl_weight': 0.044905375307677915, 'lr': 0.008826608120878189, 'batch_size': 128, 'dropout_rate': 0.10990560516130204, 'prior_mu': -0.012229836307097359, 'prior_sigma': 0.08871861926147054, 'normalization': 'layer'}. Best is trial 896 with value: 0.4533553242683411.
Generating rdkit fingerprints...
Generated fingerprints with 512 features for 841 molecules
Trial 2564: 5-fold CV loss = 0.5164
[I 2025-08-08 01:32:22,450] Trial 2564 finished with value: 0.5163870930671692 and parameters: {'fp_type': 'morgan_rdkit', 'combined_morgan_radius': 3, 'combined_morgan_nBits': 1024, 'combined_rdkit_maxPath': 7, 'combined_rdkit_nBits': 256, 'num_hidden_layers': 3, 'hidden_dim_0': 256, 'hidden_dim_1': 1024, 'hidden_dim_2': 64, 'kl_weight': 0.0003162654268541854, 'lr': 0.009097015717346597, 'batch_size': 128, 'dropout_rate': 0.10973908044546142, 'prior_mu': -0.18384642173847698, 'prior_sigma': 0.10166597611887676, 'normalization': 'layer'}. Best is trial 896 with value: 0.4533553242683411.
Generating morgan_rdkit fingerprints...
Generated fingerprints with 2048 features for 841 molecules
Trial 2566: 5-fold CV loss = 0.5658
