[I 2025-08-08 01:38:58,863] Trial 2595 finished with value: 0.5385298609733582 and parameters: {'fp_type': 'morgan_rdkit', 'combined_morgan_radius': 3, 'combined_morgan_nBits': 1024, 'combined_rdkit_maxPath': 7, 'combined_rdkit_nBits': 1024, 'num_hidden_layers': 3, 'hidden_dim_0': 256, 'hidden_dim_1': 64, 'hidden_dim_2': 64, 'kl_weight': 0.00020526963126932333, 'lr': 0.009231806776157946, 'batch_size': 128, 'dropout_rate': 0.10372948720748602, 'prior_mu': 0.03153388319975127, 'prior_sigma': 0.09184887521674315, 'normalization': 'layer'}. Best is trial 896 with value: 0.4533553242683411.
Generating morgan_rdkit fingerprints...
Generated fingerprints with 2048 features for 841 molecules
Trial 2599: 5-fold CV loss = 1.3694
[I 2025-08-08 01:39:06,801] Trial 2599 finished with value: 1.369448971748352 and parameters: {'fp_type': 'morgan_rdkit', 'combined_morgan_radius': 3, 'combined_morgan_nBits': 1024, 'combined_rdkit_maxPath': 7, 'combined_rdkit_nBits': 1024, 'num_hidden_layers': 0, 'kl_weight': 0.0002702047239124373, 'lr': 0.007038460750460157, 'batch_size': 128, 'dropout_rate': 0.08969665835388949, 'prior_mu': -0.0016633798293417697, 'prior_sigma': 0.10508244576399009, 'normalization': 'layer'}. Best is trial 896 with value: 0.4533553242683411.
Generating morgan_rdkit fingerprints...
Generated fingerprints with 2048 features for 841 molecules
Trial 2598: 5-fold CV loss = 0.4624
[I 2025-08-08 01:39:19,292] Trial 2598 finished with value: 0.4623910069465637 and parameters: {'fp_type': 'morgan_rdkit', 'combined_morgan_radius': 3, 'combined_morgan_nBits': 1024, 'combined_rdkit_maxPath': 7, 'combined_rdkit_nBits': 1024, 'num_hidden_layers': 3, 'hidden_dim_0': 256, 'hidden_dim_1': 1024, 'hidden_dim_2': 64, 'kl_weight': 0.00021666939791362177, 'lr': 0.00996825472046201, 'batch_size': 128, 'dropout_rate': 0.08485250354884415, 'prior_mu': 0.009208965590957192, 'prior_sigma': 0.09191528076483893, 'normalization': 'layer'}. Best is trial 896 with value: 0.4533553242683411.
Generating morgan_rdkit fingerprints...
Generated fingerprints with 2048 features for 841 molecules
Trial 2596: 5-fold CV loss = 0.4663
[I 2025-08-08 01:39:27,000] Trial 2596 finished with value: 0.4663336932659149 and parameters: {'fp_type': 'morgan_rdkit', 'combined_morgan_radius': 3, 'combined_morgan_nBits': 1024, 'combined_rdkit_maxPath': 7, 'combined_rdkit_nBits': 1024, 'num_hidden_layers': 3, 'hidden_dim_0': 256, 'hidden_dim_1': 1024, 'hidden_dim_2': 64, 'kl_weight': 0.00021545201644351559, 'lr': 0.009227739681694139, 'batch_size': 128, 'dropout_rate': 0.10390459773237921, 'prior_mu': 0.013287419521100631, 'prior_sigma': 0.10427046948431035, 'normalization': 'layer'}. Best is trial 896 with value: 0.4533553242683411.
Generating morgan_rdkit fingerprints...
Generated fingerprints with 2048 features for 841 molecules
Trial 2600: 5-fold CV loss = 0.4668
[I 2025-08-08 01:39:53,540] Trial 2600 finished with value: 0.4668340563774109 and parameters: {'fp_type': 'morgan_rdkit', 'combined_morgan_radius': 3, 'combined_morgan_nBits': 1024, 'combined_rdkit_maxPath': 7, 'combined_rdkit_nBits': 1024, 'num_hidden_layers': 3, 'hidden_dim_0': 1024, 'hidden_dim_1': 1024, 'hidden_dim_2': 64, 'kl_weight': 0.00027868999667305023, 'lr': 0.00823308902742638, 'batch_size': 128, 'dropout_rate': 0.0802653331887274, 'prior_mu': 0.00813123132000933, 'prior_sigma': 0.10447719751072322, 'normalization': 'layer'}. Best is trial 896 with value: 0.4533553242683411.
Generating morgan_rdkit fingerprints...
Generated fingerprints with 2048 features for 841 molecules
Trial 2601: 5-fold CV loss = 0.4658
[I 2025-08-08 01:39:57,371] Trial 2601 finished with value: 0.4657983064651489 and parameters: {'fp_type': 'morgan_rdkit', 'combined_morgan_radius': 3, 'combined_morgan_nBits': 1024, 'combined_rdkit_maxPath': 7, 'combined_rdkit_nBits': 1024, 'num_hidden_layers': 3, 'hidden_dim_0': 256, 'hidden_dim_1': 1024, 'hidden_dim_2': 64, 'kl_weight': 0.00026642442921388153, 'lr': 0.008303531423384282, 'batch_size': 128, 'dropout_rate': 0.10433639117396443, 'prior_mu': -0.00259559098106105, 'prior_sigma': 0.08390108102580568, 'normalization': 'layer'}. Best is trial 896 with value: 0.4533553242683411.
Generating morgan_rdkit fingerprints...
Generated fingerprints with 2048 features for 841 molecules
Trial 2602: 5-fold CV loss = 0.4649
[I 2025-08-08 01:40:17,573] Trial 2602 finished with value: 0.46489542722702026 and parameters: {'fp_type': 'morgan_rdkit', 'combined_morgan_radius': 3, 'combined_morgan_nBits': 1024, 'combined_rdkit_maxPath': 7, 'combined_rdkit_nBits': 1024, 'num_hidden_layers': 3, 'hidden_dim_0': 1024, 'hidden_dim_1': 1024, 'hidden_dim_2': 64, 'kl_weight': 0.0002611410064445192, 'lr': 0.008219557402602367, 'batch_size': 128, 'dropout_rate': 0.08657206494050315, 'prior_mu': -0.0016373531842987094, 'prior_sigma': 0.08429758019027785, 'normalization': 'layer'}. Best is trial 896 with value: 0.4533553242683411.
Generating morgan_rdkit fingerprints...
Generated fingerprints with 1536 features for 841 molecules
Trial 2604: 5-fold CV loss = 0.5377
[I 2025-08-08 01:40:31,532] Trial 2604 finished with value: 0.5376670002937317 and parameters: {'fp_type': 'morgan_rdkit', 'combined_morgan_radius': 3, 'combined_morgan_nBits': 1024, 'combined_rdkit_maxPath': 7, 'combined_rdkit_nBits': 1024, 'num_hidden_layers': 3, 'hidden_dim_0': 256, 'hidden_dim_1': 1024, 'hidden_dim_2': 64, 'kl_weight': 0.00015944109733366692, 'lr': 0.007206593610694202, 'batch_size': 128, 'dropout_rate': 0.112923511819269, 'prior_mu': -0.05064401563946963, 'prior_sigma': 0.10928264143989423, 'normalization': 'layer'}. Best is trial 896 with value: 0.4533553242683411.
Generating morgan_rdkit fingerprints...
Generated fingerprints with 1536 features for 841 molecules
Trial 2603: 5-fold CV loss = 0.4627
[I 2025-08-08 01:40:37,332] Trial 2603 finished with value: 0.462677139043808 and parameters: {'fp_type': 'morgan_rdkit', 'combined_morgan_radius': 3, 'combined_morgan_nBits': 1024, 'combined_rdkit_maxPath': 7, 'combined_rdkit_nBits': 1024, 'num_hidden_layers': 3, 'hidden_dim_0': 256, 'hidden_dim_1': 1024, 'hidden_dim_2': 64, 'kl_weight': 0.00015801756832083323, 'lr': 0.007183260287632668, 'batch_size': 128, 'dropout_rate': 0.07289645349484711, 'prior_mu': -0.0022805595594992353, 'prior_sigma': 0.08379490912585001, 'normalization': 'layer'}. Best is trial 896 with value: 0.4533553242683411.
Generating morgan_rdkit fingerprints...
Generated fingerprints with 1536 features for 841 molecules
Trial 2590: 5-fold CV loss = 0.4623
[I 2025-08-08 01:40:50,466] Trial 2590 finished with value: 0.4623283326625824 and parameters: {'fp_type': 'morgan_rdkit', 'combined_morgan_radius': 3, 'combined_morgan_nBits': 512, 'combined_rdkit_maxPath': 7, 'combined_rdkit_nBits': 1024, 'num_hidden_layers': 3, 'hidden_dim_0': 256, 'hidden_dim_1': 256, 'hidden_dim_2': 64, 'kl_weight': 0.0002383033800480485, 'lr': 0.007689836469467777, 'batch_size': 32, 'dropout_rate': 0.06659394923025119, 'prior_mu': -0.001334848818303331, 'prior_sigma': 0.08443597835025654, 'normalization': 'layer'}. Best is trial 896 with value: 0.4533553242683411.
Generating morgan_rdkit fingerprints...
Generated fingerprints with 1536 features for 841 molecules
Trial 2605: 5-fold CV loss = 0.6348
[I 2025-08-08 01:40:59,176] Trial 2605 finished with value: 0.6347827255725861 and parameters: {'fp_type': 'morgan_rdkit', 'combined_morgan_radius': 3, 'combined_morgan_nBits': 1024, 'combined_rdkit_maxPath': 7, 'combined_rdkit_nBits': 512, 'num_hidden_layers': 3, 'hidden_dim_0': 256, 'hidden_dim_1': 1024, 'hidden_dim_2': 64, 'kl_weight': 0.00016206111834920947, 'lr': 0.0069855829255179615, 'batch_size': 128, 'dropout_rate': 0.06826794260580576, 'prior_mu': -0.05324452440952519, 'prior_sigma': 0.09622028510633358, 'normalization': 'layer'}. Best is trial 896 with value: 0.4533553242683411.
Generating morgan_rdkit fingerprints...
Generated fingerprints with 2048 features for 841 molecules
Trial 2606: 5-fold CV loss = 0.4938
[I 2025-08-08 01:41:15,200] Trial 2606 finished with value: 0.4937583267688751 and parameters: {'fp_type': 'morgan_rdkit', 'combined_morgan_radius': 3, 'combined_morgan_nBits': 1024, 'combined_rdkit_maxPath': 7, 'combined_rdkit_nBits': 512, 'num_hidden_layers': 3, 'hidden_dim_0': 256, 'hidden_dim_1': 1024, 'hidden_dim_2': 64, 'kl_weight': 0.0002311631004640818, 'lr': 0.007061069804398435, 'batch_size': 64, 'dropout_rate': 0.05801654060016436, 'prior_mu': -0.049737846414472535, 'prior_sigma': 0.08857327362724118, 'normalization': 'layer'}. Best is trial 896 with value: 0.4533553242683411.
Generating rdkit fingerprints...
Generated fingerprints with 256 features for 841 molecules
Trial 2607: 5-fold CV loss = 0.4905
[I 2025-08-08 01:41:22,645] Trial 2607 finished with value: 0.490476930141449 and parameters: {'fp_type': 'morgan_rdkit', 'combined_morgan_radius': 3, 'combined_morgan_nBits': 1024, 'combined_rdkit_maxPath': 7, 'combined_rdkit_nBits': 512, 'num_hidden_layers': 3, 'hidden_dim_0': 256, 'hidden_dim_1': 1024, 'hidden_dim_2': 64, 'kl_weight': 0.00017996886784564427, 'lr': 0.006916825131658102, 'batch_size': 128, 'dropout_rate': 0.11725033753735445, 'prior_mu': -0.0477614790907321, 'prior_sigma': 0.09619459802532543, 'normalization': 'layer'}. Best is trial 896 with value: 0.4533553242683411.
Generating morgan_rdkit fingerprints...
Generated fingerprints with 2048 features for 841 molecules
Trial 2610: 5-fold CV loss = 0.8582
[I 2025-08-08 01:41:30,839] Trial 2610 finished with value: 0.8582072615623474 and parameters: {'fp_type': 'rdkit', 'rdkit_only_maxPath': 7, 'rdkit_only_nBits': 256, 'num_hidden_layers': 3, 'hidden_dim_0': 64, 'hidden_dim_1': 1024, 'hidden_dim_2': 512, 'kl_weight': 0.0011551890667544046, 'lr': 0.008352885962452877, 'batch_size': 128, 'dropout_rate': 0.11467774526631215, 'prior_mu': 0.023105353419540488, 'prior_sigma': 0.09936108305255772, 'normalization': 'none'}. Best is trial 896 with value: 0.4533553242683411.
Generating morgan_rdkit fingerprints...
Generated fingerprints with 2048 features for 841 molecules
Trial 2609: 5-fold CV loss = 0.4616
[I 2025-08-08 01:41:52,654] Trial 2609 finished with value: 0.46161572337150575 and parameters: {'fp_type': 'morgan_rdkit', 'combined_morgan_radius': 3, 'combined_morgan_nBits': 1024, 'combined_rdkit_maxPath': 7, 'combined_rdkit_nBits': 1024, 'num_hidden_layers': 3, 'hidden_dim_0': 256, 'hidden_dim_1': 1024, 'hidden_dim_2': 64, 'kl_weight': 0.00018268049998535816, 'lr': 0.008500587193577665, 'batch_size': 128, 'dropout_rate': 0.09173108348204667, 'prior_mu': -0.04822907531667118, 'prior_sigma': 0.08946719521658437, 'normalization': 'layer'}. Best is trial 896 with value: 0.4533553242683411.
Generating morgan_rdkit fingerprints...
Generated fingerprints with 2048 features for 841 molecules
Trial 2612: 5-fold CV loss = 0.4713
[I 2025-08-08 01:42:04,703] Trial 2612 finished with value: 0.47130924463272095 and parameters: {'fp_type': 'morgan_rdkit', 'combined_morgan_radius': 3, 'combined_morgan_nBits': 1024, 'combined_rdkit_maxPath': 7, 'combined_rdkit_nBits': 1024, 'num_hidden_layers': 3, 'hidden_dim_0': 256, 'hidden_dim_1': 1024, 'hidden_dim_2': 64, 'kl_weight': 0.00030118402402839567, 'lr': 0.009160243058191868, 'batch_size': 128, 'dropout_rate': 0.09151811238652532, 'prior_mu': -0.005898698056334011, 'prior_sigma': 0.0927865766975783, 'normalization': 'layer'}. Best is trial 896 with value: 0.4533553242683411.
Generating morgan_rdkit fingerprints...
Generated fingerprints with 2048 features for 841 molecules
Trial 2611: 5-fold CV loss = 0.5563
[I 2025-08-08 01:42:24,357] Trial 2611 finished with value: 0.5563234746456146 and parameters: {'fp_type': 'morgan_rdkit', 'combined_morgan_radius': 3, 'combined_morgan_nBits': 1024, 'combined_rdkit_maxPath': 7, 'combined_rdkit_nBits': 1024, 'num_hidden_layers': 3, 'hidden_dim_0': 64, 'hidden_dim_1': 1024, 'hidden_dim_2': 512, 'kl_weight': 0.0003035148406706661, 'lr': 0.008810181623809166, 'batch_size': 128, 'dropout_rate': 0.08869992422533537, 'prior_mu': 0.022709487562815378, 'prior_sigma': 0.10074501409415909, 'normalization': 'none'}. Best is trial 896 with value: 0.4533553242683411.
Generating morgan_rdkit fingerprints...
Generated fingerprints with 2048 features for 841 molecules
Trial 2613: 5-fold CV loss = 0.4768
[I 2025-08-08 01:42:38,052] Trial 2613 finished with value: 0.4768236756324768 and parameters: {'fp_type': 'morgan_rdkit', 'combined_morgan_radius': 3, 'combined_morgan_nBits': 1024, 'combined_rdkit_maxPath': 6, 'combined_rdkit_nBits': 1024, 'num_hidden_layers': 3, 'hidden_dim_0': 512, 'hidden_dim_1': 1024, 'hidden_dim_2': 64, 'kl_weight': 0.0002888328711541441, 'lr': 0.007866342102482474, 'batch_size': 128, 'dropout_rate': 0.10151078577157381, 'prior_mu': -0.11456333786247073, 'prior_sigma': 0.1027250791669627, 'normalization': 'layer'}. Best is trial 896 with value: 0.4533553242683411.
Generating morgan_rdkit fingerprints...
Generated fingerprints with 2048 features for 841 molecules
Trial 2614: 5-fold CV loss = 0.5713
[I 2025-08-08 01:42:44,688] Trial 2614 finished with value: 0.5713265597820282 and parameters: {'fp_type': 'morgan_rdkit', 'combined_morgan_radius': 3, 'combined_morgan_nBits': 1024, 'combined_rdkit_maxPath': 7, 'combined_rdkit_nBits': 1024, 'num_hidden_layers': 3, 'hidden_dim_0': 256, 'hidden_dim_1': 1024, 'hidden_dim_2': 64, 'kl_weight': 0.0002801135364556235, 'lr': 0.007842945475269857, 'batch_size': 128, 'dropout_rate': 0.10441499677891694, 'prior_mu': 0.01317635111301305, 'prior_sigma': 0.1521656732939562, 'normalization': 'layer'}. Best is trial 896 with value: 0.4533553242683411.
Generating morgan_rdkit fingerprints...
Generated fingerprints with 2048 features for 841 molecules
Trial 2615: 5-fold CV loss = 0.6314
[I 2025-08-08 01:42:59,298] Trial 2615 finished with value: 0.6313757956027984 and parameters: {'fp_type': 'morgan_rdkit', 'combined_morgan_radius': 3, 'combined_morgan_nBits': 1024, 'combined_rdkit_maxPath': 7, 'combined_rdkit_nBits': 1024, 'num_hidden_layers': 3, 'hidden_dim_0': 256, 'hidden_dim_1': 1024, 'hidden_dim_2': 64, 'kl_weight': 0.00026525255200883486, 'lr': 0.007710320179669143, 'batch_size': 128, 'dropout_rate': 0.1026518723575857, 'prior_mu': -0.039918905524371585, 'prior_sigma': 0.1115516396449137, 'normalization': 'layer'}. Best is trial 896 with value: 0.4533553242683411.
Generating morgan_rdkit fingerprints...
Generated fingerprints with 2048 features for 841 molecules
Trial 2617: 5-fold CV loss = 0.5610
[I 2025-08-08 01:43:19,856] Trial 2617 finished with value: 0.5610259115695954 and parameters: {'fp_type': 'morgan_rdkit', 'combined_morgan_radius': 2, 'combined_morgan_nBits': 1024, 'combined_rdkit_maxPath': 7, 'combined_rdkit_nBits': 1024, 'num_hidden_layers': 3, 'hidden_dim_0': 256, 'hidden_dim_1': 1024, 'hidden_dim_2': 64, 'kl_weight': 0.00020586016828206592, 'lr': 0.00686840109001478, 'batch_size': 128, 'dropout_rate': 0.07749773759870032, 'prior_mu': -0.00750159474604919, 'prior_sigma': 0.1088971246292843, 'normalization': 'layer'}. Best is trial 896 with value: 0.4533553242683411.
Generating morgan_rdkit fingerprints...
Generated fingerprints with 2048 features for 841 molecules
Trial 2616: 5-fold CV loss = 0.5613
[I 2025-08-08 01:43:31,795] Trial 2616 finished with value: 0.5613139986991882 and parameters: {'fp_type': 'morgan_rdkit', 'combined_morgan_radius': 2, 'combined_morgan_nBits': 1024, 'combined_rdkit_maxPath': 7, 'combined_rdkit_nBits': 1024, 'num_hidden_layers': 3, 'hidden_dim_0': 256, 'hidden_dim_1': 1024, 'hidden_dim_2': 64, 'kl_weight': 0.00023510789102677523, 'lr': 0.006874455474601666, 'batch_size': 128, 'dropout_rate': 0.019903120364524372, 'prior_mu': -0.04216935799372294, 'prior_sigma': 0.1140258774020205, 'normalization': 'layer'}. Best is trial 896 with value: 0.4533553242683411.
Generating morgan_rdkit fingerprints...
Generated fingerprints with 2048 features for 841 molecules
Trial 2618: 5-fold CV loss = 0.5380
[I 2025-08-08 01:43:39,075] Trial 2618 finished with value: 0.5380483567714691 and parameters: {'fp_type': 'morgan_rdkit', 'combined_morgan_radius': 3, 'combined_morgan_nBits': 1024, 'combined_rdkit_maxPath': 7, 'combined_rdkit_nBits': 1024, 'num_hidden_layers': 3, 'hidden_dim_0': 256, 'hidden_dim_1': 1024, 'hidden_dim_2': 64, 'kl_weight': 0.00023023646413472326, 'lr': 0.006601149349901426, 'batch_size': 128, 'dropout_rate': 0.07741478314719796, 'prior_mu': -0.005674173645975342, 'prior_sigma': 0.11790541627266493, 'normalization': 'layer'}. Best is trial 896 with value: 0.4533553242683411.
Generating morgan_rdkit fingerprints...
Generated fingerprints with 2048 features for 841 molecules
Trial 2608: 5-fold CV loss = 0.5402
[I 2025-08-08 01:43:45,652] Trial 2608 finished with value: 0.5402290642261505 and parameters: {'fp_type': 'morgan_rdkit', 'combined_morgan_radius': 3, 'combined_morgan_nBits': 1024, 'combined_rdkit_maxPath': 7, 'combined_rdkit_nBits': 512, 'num_hidden_layers': 3, 'hidden_dim_0': 256, 'hidden_dim_1': 1024, 'hidden_dim_2': 64, 'kl_weight': 0.0001812862292469281, 'lr': 0.009996823977512085, 'batch_size': 64, 'dropout_rate': 0.11255193843886416, 'prior_mu': -0.04975968934729208, 'prior_sigma': 0.09690430179339234, 'normalization': 'none'}. Best is trial 896 with value: 0.4533553242683411.
Generating morgan_rdkit fingerprints...
Generated fingerprints with 2048 features for 841 molecules
Trial 2619: 5-fold CV loss = 0.4669
[I 2025-08-08 01:44:01,138] Trial 2619 finished with value: 0.46685991287231443 and parameters: {'fp_type': 'morgan_rdkit', 'combined_morgan_radius': 3, 'combined_morgan_nBits': 1024, 'combined_rdkit_maxPath': 7, 'combined_rdkit_nBits': 1024, 'num_hidden_layers': 3, 'hidden_dim_0': 256, 'hidden_dim_1': 1024, 'hidden_dim_2': 64, 'kl_weight': 0.00023868360899833636, 'lr': 0.009988770887058953, 'batch_size': 64, 'dropout_rate': 0.0747890485107368, 'prior_mu': 0.004446509103364398, 'prior_sigma': 0.08763113656836269, 'normalization': 'layer'}. Best is trial 896 with value: 0.4533553242683411.
Generating morgan_rdkit fingerprints...
Generated fingerprints with 2048 features for 841 molecules
Trial 2623: 5-fold CV loss = 0.7996
[I 2025-08-08 01:44:22,264] Trial 2623 finished with value: 0.7995796859264374 and parameters: {'fp_type': 'morgan_rdkit', 'combined_morgan_radius': 3, 'combined_morgan_nBits': 1024, 'combined_rdkit_maxPath': 7, 'combined_rdkit_nBits': 1024, 'num_hidden_layers': 3, 'hidden_dim_0': 128, 'hidden_dim_1': 1024, 'hidden_dim_2': 1024, 'kl_weight': 0.0007463407426894154, 'lr': 0.008546901386624929, 'batch_size': 128, 'dropout_rate': 0.08846013099350215, 'prior_mu': -0.03772695095196264, 'prior_sigma': 0.08122710577696673, 'normalization': 'layer'}. Best is trial 896 with value: 0.4533553242683411.
Generating morgan_rdkit fingerprints...
Generated fingerprints with 2048 features for 841 molecules
Trial 2621: 5-fold CV loss = 0.4714
[I 2025-08-08 01:44:31,352] Trial 2621 finished with value: 0.47135970592498777 and parameters: {'fp_type': 'morgan_rdkit', 'combined_morgan_radius': 3, 'combined_morgan_nBits': 1024, 'combined_rdkit_maxPath': 7, 'combined_rdkit_nBits': 1024, 'num_hidden_layers': 3, 'hidden_dim_0': 256, 'hidden_dim_1': 1024, 'hidden_dim_2': 64, 'kl_weight': 0.00014139676711184154, 'lr': 0.009166091908131113, 'batch_size': 64, 'dropout_rate': 0.11402145526393294, 'prior_mu': 0.009247480514731933, 'prior_sigma': 0.08835419229306263, 'normalization': 'layer'}. Best is trial 896 with value: 0.4533553242683411.
Generating morgan_rdkit fingerprints...
Generated fingerprints with 2048 features for 841 molecules
Trial 2620: 5-fold CV loss = 0.4695
[I 2025-08-08 01:44:36,299] Trial 2620 finished with value: 0.46952877640724183 and parameters: {'fp_type': 'morgan_rdkit', 'combined_morgan_radius': 3, 'combined_morgan_nBits': 1024, 'combined_rdkit_maxPath': 7, 'combined_rdkit_nBits': 1024, 'num_hidden_layers': 3, 'hidden_dim_0': 256, 'hidden_dim_1': 1024, 'hidden_dim_2': 64, 'kl_weight': 0.00014235092523800467, 'lr': 0.009990456637657184, 'batch_size': 64, 'dropout_rate': 0.07951550009921851, 'prior_mu': 0.011538538820314385, 'prior_sigma': 0.08126775162045256, 'normalization': 'layer'}. Best is trial 896 with value: 0.4533553242683411.
Generating morgan_rdkit fingerprints...
Generated fingerprints with 2048 features for 841 molecules
Trial 2624: 5-fold CV loss = 0.8789
[I 2025-08-08 01:44:43,911] Trial 2624 finished with value: 0.8789052367210388 and parameters: {'fp_type': 'morgan_rdkit', 'combined_morgan_radius': 3, 'combined_morgan_nBits': 1024, 'combined_rdkit_maxPath': 7, 'combined_rdkit_nBits': 1024, 'num_hidden_layers': 3, 'hidden_dim_0': 256, 'hidden_dim_1': 1024, 'hidden_dim_2': 64, 'kl_weight': 0.00014705790310753252, 'lr': 0.000280844809145669, 'batch_size': 128, 'dropout_rate': 0.4837555901956798, 'prior_mu': 0.03150530325922086, 'prior_sigma': 0.09180917514625417, 'normalization': 'layer'}. Best is trial 896 with value: 0.4533553242683411.
Generating morgan_rdkit fingerprints...
Generated fingerprints with 2048 features for 841 molecules
Trial 2622: 5-fold CV loss = 0.4725
[I 2025-08-08 01:45:08,936] Trial 2622 finished with value: 0.4724702715873718 and parameters: {'fp_type': 'morgan_rdkit', 'combined_morgan_radius': 3, 'combined_morgan_nBits': 1024, 'combined_rdkit_maxPath': 7, 'combined_rdkit_nBits': 1024, 'num_hidden_layers': 3, 'hidden_dim_0': 256, 'hidden_dim_1': 1024, 'hidden_dim_2': 64, 'kl_weight': 0.00014834716788348132, 'lr': 0.00911808790632449, 'batch_size': 128, 'dropout_rate': 0.08462163530145103, 'prior_mu': 0.005652994250255212, 'prior_sigma': 0.08801064855379448, 'normalization': 'layer'}. Best is trial 896 with value: 0.4533553242683411.
Generating morgan_rdkit fingerprints...
Generated fingerprints with 1536 features for 841 molecules
Trial 2627: 5-fold CV loss = 0.5774
