[I 2025-08-07 21:45:59,976] Trial 1425 finished with value: 0.4663071811199188 and parameters: {'fp_type': 'morgan_rdkit', 'combined_morgan_radius': 3, 'combined_morgan_nBits': 1024, 'combined_rdkit_maxPath': 7, 'combined_rdkit_nBits': 1024, 'num_hidden_layers': 3, 'hidden_dim_0': 256, 'hidden_dim_1': 1024, 'hidden_dim_2': 64, 'kl_weight': 0.00034213515336327204, 'lr': 0.005563849967055149, 'batch_size': 128, 'dropout_rate': 0.12193699600611775, 'prior_mu': -0.028304345531174183, 'prior_sigma': 0.07415849356094713, 'normalization': 'layer'}. Best is trial 896 with value: 0.4533553242683411.
Generating morgan_rdkit fingerprints...
Generated fingerprints with 2048 features for 841 molecules
Trial 1427: 5-fold CV loss = 0.6298
[I 2025-08-07 21:46:05,497] Trial 1427 finished with value: 0.6298423171043396 and parameters: {'fp_type': 'morgan_rdkit', 'combined_morgan_radius': 3, 'combined_morgan_nBits': 1024, 'combined_rdkit_maxPath': 7, 'combined_rdkit_nBits': 1024, 'num_hidden_layers': 3, 'hidden_dim_0': 1024, 'hidden_dim_1': 1024, 'hidden_dim_2': 1024, 'kl_weight': 0.00034856560137888317, 'lr': 0.005377469215736031, 'batch_size': 64, 'dropout_rate': 0.16145269184773556, 'prior_mu': -0.029076549900827583, 'prior_sigma': 0.0779697226322447, 'normalization': 'layer'}. Best is trial 896 with value: 0.4533553242683411.
Generating morgan_rdkit fingerprints...
Generated fingerprints with 1280 features for 841 molecules
Trial 1426: 5-fold CV loss = 0.4656
[I 2025-08-07 21:46:07,433] Trial 1426 finished with value: 0.46558040380477905 and parameters: {'fp_type': 'morgan_rdkit', 'combined_morgan_radius': 3, 'combined_morgan_nBits': 1024, 'combined_rdkit_maxPath': 7, 'combined_rdkit_nBits': 1024, 'num_hidden_layers': 3, 'hidden_dim_0': 256, 'hidden_dim_1': 1024, 'hidden_dim_2': 64, 'kl_weight': 0.0004165188526210295, 'lr': 0.00538942745565728, 'batch_size': 64, 'dropout_rate': 0.12180596091647065, 'prior_mu': 0.1897520820729917, 'prior_sigma': 0.07790099291250129, 'normalization': 'layer'}. Best is trial 896 with value: 0.4533553242683411.
Generating morgan_rdkit fingerprints...
Generated fingerprints with 1536 features for 841 molecules
Trial 1428: 5-fold CV loss = 0.6512
[I 2025-08-07 21:46:18,784] Trial 1428 finished with value: 0.6511975824832916 and parameters: {'fp_type': 'morgan_rdkit', 'combined_morgan_radius': 3, 'combined_morgan_nBits': 1024, 'combined_rdkit_maxPath': 7, 'combined_rdkit_nBits': 1024, 'num_hidden_layers': 3, 'hidden_dim_0': 1024, 'hidden_dim_1': 1024, 'hidden_dim_2': 1024, 'kl_weight': 0.0003313898596919936, 'lr': 0.005396461033421927, 'batch_size': 64, 'dropout_rate': 0.1571926265572176, 'prior_mu': -0.029672908697671675, 'prior_sigma': 0.06577238810497449, 'normalization': 'layer'}. Best is trial 896 with value: 0.4533553242683411.
Generating morgan_rdkit fingerprints...
Generated fingerprints with 1280 features for 841 molecules
Trial 1432: 5-fold CV loss = 0.6923
[I 2025-08-07 21:46:26,539] Trial 1432 finished with value: 0.6923492193222046 and parameters: {'fp_type': 'morgan_rdkit', 'combined_morgan_radius': 3, 'combined_morgan_nBits': 1024, 'combined_rdkit_maxPath': 8, 'combined_rdkit_nBits': 256, 'num_hidden_layers': 0, 'kl_weight': 0.0002871840469855567, 'lr': 0.001154757988947216, 'batch_size': 128, 'dropout_rate': 0.14959264062371502, 'prior_mu': -0.15350296421572215, 'prior_sigma': 0.08413685825807977, 'normalization': 'layer'}. Best is trial 896 with value: 0.4533553242683411.
Generating morgan_rdkit fingerprints...
Generated fingerprints with 1536 features for 841 molecules
Trial 1430: 5-fold CV loss = 0.5220
[I 2025-08-07 21:46:45,116] Trial 1430 finished with value: 0.5219636380672454 and parameters: {'fp_type': 'morgan_rdkit', 'combined_morgan_radius': 3, 'combined_morgan_nBits': 1024, 'combined_rdkit_maxPath': 7, 'combined_rdkit_nBits': 256, 'num_hidden_layers': 3, 'hidden_dim_0': 256, 'hidden_dim_1': 1024, 'hidden_dim_2': 64, 'kl_weight': 0.00029156678066127634, 'lr': 0.004738104408855356, 'batch_size': 128, 'dropout_rate': 0.20620745252638445, 'prior_mu': -0.016805820545237552, 'prior_sigma': 0.08519017670666386, 'normalization': 'layer'}. Best is trial 896 with value: 0.4533553242683411.
Generating morgan_rdkit fingerprints...
Generated fingerprints with 1536 features for 841 molecules
Trial 1431: 5-fold CV loss = 0.5564
[I 2025-08-07 21:46:50,588] Trial 1431 finished with value: 0.5563740015029908 and parameters: {'fp_type': 'morgan_rdkit', 'combined_morgan_radius': 3, 'combined_morgan_nBits': 1024, 'combined_rdkit_maxPath': 7, 'combined_rdkit_nBits': 512, 'num_hidden_layers': 3, 'hidden_dim_0': 256, 'hidden_dim_1': 1024, 'hidden_dim_2': 64, 'kl_weight': 0.00030059521623464837, 'lr': 0.00787493706881535, 'batch_size': 128, 'dropout_rate': 0.1506423095293301, 'prior_mu': -0.016593456850322496, 'prior_sigma': 0.06641349456160826, 'normalization': 'layer'}. Best is trial 896 with value: 0.4533553242683411.
Generating morgan_rdkit fingerprints...
Generated fingerprints with 2048 features for 841 molecules
Trial 1433: 5-fold CV loss = 0.4950
[I 2025-08-07 21:47:06,273] Trial 1433 finished with value: 0.49504650831222535 and parameters: {'fp_type': 'morgan_rdkit', 'combined_morgan_radius': 3, 'combined_morgan_nBits': 1024, 'combined_rdkit_maxPath': 7, 'combined_rdkit_nBits': 512, 'num_hidden_layers': 3, 'hidden_dim_0': 256, 'hidden_dim_1': 1024, 'hidden_dim_2': 64, 'kl_weight': 0.0001800499440440225, 'lr': 0.004782846189187392, 'batch_size': 128, 'dropout_rate': 0.19531930087127602, 'prior_mu': -0.10805479045950492, 'prior_sigma': 0.06604880593334994, 'normalization': 'layer'}. Best is trial 896 with value: 0.4533553242683411.
Generating morgan_rdkit fingerprints...
Generated fingerprints with 2048 features for 841 molecules
Trial 1434: 5-fold CV loss = 0.5643
[I 2025-08-07 21:47:16,747] Trial 1434 finished with value: 0.5642701387405396 and parameters: {'fp_type': 'morgan_rdkit', 'combined_morgan_radius': 3, 'combined_morgan_nBits': 1024, 'combined_rdkit_maxPath': 7, 'combined_rdkit_nBits': 512, 'num_hidden_layers': 3, 'hidden_dim_0': 256, 'hidden_dim_1': 64, 'hidden_dim_2': 64, 'kl_weight': 0.000470033670567181, 'lr': 0.007768249463754783, 'batch_size': 128, 'dropout_rate': 0.1315696303160256, 'prior_mu': -0.012463834622414705, 'prior_sigma': 0.06638510426899821, 'normalization': 'layer'}. Best is trial 896 with value: 0.4533553242683411.
Generating morgan_rdkit fingerprints...
Generated fingerprints with 2048 features for 841 molecules
Trial 1429: 5-fold CV loss = 0.8033
[I 2025-08-07 21:47:29,952] Trial 1429 finished with value: 0.8032883822917938 and parameters: {'fp_type': 'morgan_rdkit', 'combined_morgan_radius': 3, 'combined_morgan_nBits': 1024, 'combined_rdkit_maxPath': 7, 'combined_rdkit_nBits': 1024, 'num_hidden_layers': 3, 'hidden_dim_0': 1024, 'hidden_dim_1': 1024, 'hidden_dim_2': 1024, 'kl_weight': 0.00030897575096541807, 'lr': 0.005034500628518604, 'batch_size': 64, 'dropout_rate': 0.02489604049499422, 'prior_mu': 0.1925667110544175, 'prior_sigma': 0.07932495116185408, 'normalization': 'layer'}. Best is trial 896 with value: 0.4533553242683411.
Generating morgan_rdkit fingerprints...
Generated fingerprints with 2048 features for 841 molecules
Trial 1437: 5-fold CV loss = 0.4676
[I 2025-08-07 21:47:47,304] Trial 1437 finished with value: 0.46762475967407224 and parameters: {'fp_type': 'morgan_rdkit', 'combined_morgan_radius': 3, 'combined_morgan_nBits': 1024, 'combined_rdkit_maxPath': 7, 'combined_rdkit_nBits': 1024, 'num_hidden_layers': 3, 'hidden_dim_0': 256, 'hidden_dim_1': 1024, 'hidden_dim_2': 64, 'kl_weight': 0.0002395696993249298, 'lr': 0.00877280925975367, 'batch_size': 128, 'dropout_rate': 0.11467726702828056, 'prior_mu': -0.08245588888107522, 'prior_sigma': 0.08150254334085753, 'normalization': 'layer'}. Best is trial 896 with value: 0.4533553242683411.
Generating morgan_rdkit fingerprints...
Generated fingerprints with 2048 features for 841 molecules
Trial 1436: 5-fold CV loss = 0.4684
[I 2025-08-07 21:47:52,085] Trial 1436 finished with value: 0.4683529198169708 and parameters: {'fp_type': 'morgan_rdkit', 'combined_morgan_radius': 3, 'combined_morgan_nBits': 1024, 'combined_rdkit_maxPath': 7, 'combined_rdkit_nBits': 1024, 'num_hidden_layers': 3, 'hidden_dim_0': 256, 'hidden_dim_1': 64, 'hidden_dim_2': 64, 'kl_weight': 0.0002458115075248111, 'lr': 0.008584950517368928, 'batch_size': 128, 'dropout_rate': 0.1311453028172875, 'prior_mu': -0.1393205285170739, 'prior_sigma': 0.08002216884482778, 'normalization': 'layer'}. Best is trial 896 with value: 0.4533553242683411.
Generating morgan_rdkit fingerprints...
Generated fingerprints with 2048 features for 841 molecules
Trial 1435: 5-fold CV loss = 0.4635
[I 2025-08-07 21:48:03,951] Trial 1435 finished with value: 0.4635086297988892 and parameters: {'fp_type': 'morgan_rdkit', 'combined_morgan_radius': 3, 'combined_morgan_nBits': 1024, 'combined_rdkit_maxPath': 7, 'combined_rdkit_nBits': 1024, 'num_hidden_layers': 3, 'hidden_dim_0': 256, 'hidden_dim_1': 64, 'hidden_dim_2': 64, 'kl_weight': 0.00018701978799263896, 'lr': 0.008639212170729656, 'batch_size': 128, 'dropout_rate': 0.12995880453975278, 'prior_mu': -0.009283627612269965, 'prior_sigma': 0.08921820672450566, 'normalization': 'layer'}. Best is trial 896 with value: 0.4533553242683411.
Generating morgan_rdkit fingerprints...
Generated fingerprints with 2048 features for 841 molecules
Trial 1439: 5-fold CV loss = 0.4867
[I 2025-08-07 21:48:14,025] Trial 1439 finished with value: 0.4866632580757141 and parameters: {'fp_type': 'morgan_rdkit', 'combined_morgan_radius': 3, 'combined_morgan_nBits': 1024, 'combined_rdkit_maxPath': 5, 'combined_rdkit_nBits': 1024, 'num_hidden_layers': 3, 'hidden_dim_0': 256, 'hidden_dim_1': 1024, 'hidden_dim_2': 64, 'kl_weight': 0.0003722417210643938, 'lr': 0.006213152041430535, 'batch_size': 128, 'dropout_rate': 0.14176830444482363, 'prior_mu': -0.008803306134543158, 'prior_sigma': 0.08686542201618169, 'normalization': 'layer'}. Best is trial 896 with value: 0.4533553242683411.
Generating morgan_rdkit fingerprints...
Generated fingerprints with 2048 features for 841 molecules
Trial 1440: 5-fold CV loss = 0.4902
[I 2025-08-07 21:48:25,673] Trial 1440 finished with value: 0.49016517400741577 and parameters: {'fp_type': 'morgan_rdkit', 'combined_morgan_radius': 3, 'combined_morgan_nBits': 1024, 'combined_rdkit_maxPath': 5, 'combined_rdkit_nBits': 1024, 'num_hidden_layers': 3, 'hidden_dim_0': 256, 'hidden_dim_1': 1024, 'hidden_dim_2': 64, 'kl_weight': 0.0003764553578808876, 'lr': 0.006165489410708552, 'batch_size': 128, 'dropout_rate': 0.18285072996657478, 'prior_mu': -0.00928598308927616, 'prior_sigma': 0.08923577461759669, 'normalization': 'layer'}. Best is trial 896 with value: 0.4533553242683411.
Generating morgan_rdkit fingerprints...
Generated fingerprints with 2048 features for 841 molecules
Trial 1438: 5-fold CV loss = 0.4798
[I 2025-08-07 21:48:36,063] Trial 1438 finished with value: 0.4797523021697998 and parameters: {'fp_type': 'morgan_rdkit', 'combined_morgan_radius': 3, 'combined_morgan_nBits': 1024, 'combined_rdkit_maxPath': 5, 'combined_rdkit_nBits': 1024, 'num_hidden_layers': 3, 'hidden_dim_0': 256, 'hidden_dim_1': 1024, 'hidden_dim_2': 64, 'kl_weight': 0.00023822351259171297, 'lr': 0.008692667730498985, 'batch_size': 128, 'dropout_rate': 0.16318584504686565, 'prior_mu': -0.0494937397046697, 'prior_sigma': 0.08892532810768905, 'normalization': 'layer'}. Best is trial 896 with value: 0.4533553242683411.
Generating morgan_rdkit fingerprints...
Generated fingerprints with 2048 features for 841 molecules
Trial 1442: 5-fold CV loss = 0.4586
[I 2025-08-07 21:48:55,578] Trial 1442 finished with value: 0.4585651755332947 and parameters: {'fp_type': 'morgan_rdkit', 'combined_morgan_radius': 3, 'combined_morgan_nBits': 1024, 'combined_rdkit_maxPath': 7, 'combined_rdkit_nBits': 1024, 'num_hidden_layers': 3, 'hidden_dim_0': 256, 'hidden_dim_1': 1024, 'hidden_dim_2': 64, 'kl_weight': 0.00026941363302506035, 'lr': 0.006598178358357761, 'batch_size': 128, 'dropout_rate': 0.1782136219015745, 'prior_mu': -0.050700156473267644, 'prior_sigma': 0.07121290800959469, 'normalization': 'layer'}. Best is trial 896 with value: 0.4533553242683411.
Generating morgan_rdkit fingerprints...
Generated fingerprints with 2048 features for 841 molecules
Trial 1441: 5-fold CV loss = 0.4693
[I 2025-08-07 21:48:59,370] Trial 1441 finished with value: 0.4693198919296265 and parameters: {'fp_type': 'morgan_rdkit', 'combined_morgan_radius': 3, 'combined_morgan_nBits': 1024, 'combined_rdkit_maxPath': 7, 'combined_rdkit_nBits': 1024, 'num_hidden_layers': 3, 'hidden_dim_0': 256, 'hidden_dim_1': 1024, 'hidden_dim_2': 64, 'kl_weight': 0.00039862300366801177, 'lr': 0.006454493379779167, 'batch_size': 128, 'dropout_rate': 0.1427030917682897, 'prior_mu': -0.020753330158332584, 'prior_sigma': 0.08879317156530986, 'normalization': 'layer'}. Best is trial 896 with value: 0.4533553242683411.
Generating morgan_rdkit fingerprints...
Generated fingerprints with 2048 features for 841 molecules
Trial 1443: 5-fold CV loss = 0.4616
[I 2025-08-07 21:49:10,613] Trial 1443 finished with value: 0.46161836981773374 and parameters: {'fp_type': 'morgan_rdkit', 'combined_morgan_radius': 3, 'combined_morgan_nBits': 1024, 'combined_rdkit_maxPath': 7, 'combined_rdkit_nBits': 1024, 'num_hidden_layers': 3, 'hidden_dim_0': 256, 'hidden_dim_1': 1024, 'hidden_dim_2': 64, 'kl_weight': 0.0002830682026759238, 'lr': 0.006851267110706336, 'batch_size': 128, 'dropout_rate': 0.16771699054104638, 'prior_mu': -0.06101400128538567, 'prior_sigma': 0.07608888506607894, 'normalization': 'layer'}. Best is trial 896 with value: 0.4533553242683411.
Generating morgan_rdkit fingerprints...
Generated fingerprints with 2048 features for 841 molecules
Trial 1445: 5-fold CV loss = 0.4655
[I 2025-08-07 21:49:31,666] Trial 1445 finished with value: 0.4654993832111359 and parameters: {'fp_type': 'morgan_rdkit', 'combined_morgan_radius': 3, 'combined_morgan_nBits': 1024, 'combined_rdkit_maxPath': 7, 'combined_rdkit_nBits': 1024, 'num_hidden_layers': 3, 'hidden_dim_0': 256, 'hidden_dim_1': 1024, 'hidden_dim_2': 64, 'kl_weight': 0.00027862291826856326, 'lr': 0.006264606079948264, 'batch_size': 128, 'dropout_rate': 0.1640330678243532, 'prior_mu': -0.06118421181987002, 'prior_sigma': 0.07010056981265303, 'normalization': 'layer'}. Best is trial 896 with value: 0.4533553242683411.
Generating morgan_rdkit fingerprints...
Generated fingerprints with 2048 features for 841 molecules
Trial 1446: 5-fold CV loss = 0.4708
[I 2025-08-07 21:49:50,393] Trial 1446 finished with value: 0.4708439469337463 and parameters: {'fp_type': 'morgan_rdkit', 'combined_morgan_radius': 3, 'combined_morgan_nBits': 1024, 'combined_rdkit_maxPath': 7, 'combined_rdkit_nBits': 1024, 'num_hidden_layers': 3, 'hidden_dim_0': 256, 'hidden_dim_1': 1024, 'hidden_dim_2': 64, 'kl_weight': 0.00032327095416274064, 'lr': 0.005892670080792413, 'batch_size': 128, 'dropout_rate': 0.16363440057692125, 'prior_mu': -0.034515832182038825, 'prior_sigma': 0.06878143056746985, 'normalization': 'layer'}. Best is trial 896 with value: 0.4533553242683411.
Generating morgan fingerprints...
Generated fingerprints with 1024 features for 841 molecules
Trial 1447: 5-fold CV loss = 0.4585
[I 2025-08-07 21:49:51,901] Trial 1447 finished with value: 0.45852442383766173 and parameters: {'fp_type': 'morgan_rdkit', 'combined_morgan_radius': 3, 'combined_morgan_nBits': 1024, 'combined_rdkit_maxPath': 7, 'combined_rdkit_nBits': 1024, 'num_hidden_layers': 3, 'hidden_dim_0': 256, 'hidden_dim_1': 1024, 'hidden_dim_2': 64, 'kl_weight': 0.00028083887136376456, 'lr': 0.0058548031292939865, 'batch_size': 128, 'dropout_rate': 0.11716264813059349, 'prior_mu': -0.03280503260206305, 'prior_sigma': 0.06828065789965278, 'normalization': 'layer'}. Best is trial 896 with value: 0.4533553242683411.
Generating morgan_rdkit fingerprints...
Generated fingerprints with 2048 features for 841 molecules
Trial 1444: 5-fold CV loss = 0.4622
[I 2025-08-07 21:50:00,785] Trial 1444 finished with value: 0.46219855546951294 and parameters: {'fp_type': 'morgan_rdkit', 'combined_morgan_radius': 3, 'combined_morgan_nBits': 1024, 'combined_rdkit_maxPath': 7, 'combined_rdkit_nBits': 1024, 'num_hidden_layers': 3, 'hidden_dim_0': 256, 'hidden_dim_1': 1024, 'hidden_dim_2': 64, 'kl_weight': 0.0002739656034653466, 'lr': 0.00695685167463241, 'batch_size': 128, 'dropout_rate': 0.14517754773570446, 'prior_mu': -0.02197030946658327, 'prior_sigma': 0.0758485598291382, 'normalization': 'layer'}. Best is trial 896 with value: 0.4533553242683411.
Generating morgan_rdkit fingerprints...
Generated fingerprints with 2048 features for 841 molecules
Trial 1448: 5-fold CV loss = 0.4692
[I 2025-08-07 21:50:10,927] Trial 1448 finished with value: 0.46916885375976564 and parameters: {'fp_type': 'morgan_rdkit', 'combined_morgan_radius': 3, 'combined_morgan_nBits': 1024, 'combined_rdkit_maxPath': 7, 'combined_rdkit_nBits': 1024, 'num_hidden_layers': 3, 'hidden_dim_0': 256, 'hidden_dim_1': 1024, 'hidden_dim_2': 128, 'kl_weight': 0.0003131931996866156, 'lr': 0.005996210842657872, 'batch_size': 128, 'dropout_rate': 0.11639444681407687, 'prior_mu': -0.03219870062153565, 'prior_sigma': 0.05653584956055691, 'normalization': 'layer'}. Best is trial 896 with value: 0.4533553242683411.
Generating morgan fingerprints...
Generated fingerprints with 1024 features for 841 molecules
Trial 1449: 5-fold CV loss = 0.5281
[I 2025-08-07 21:50:22,548] Trial 1449 finished with value: 0.5280644774436951 and parameters: {'fp_type': 'morgan', 'morgan_only_radius': 2, 'morgan_only_nBits': 1024, 'num_hidden_layers': 3, 'hidden_dim_0': 256, 'hidden_dim_1': 1024, 'hidden_dim_2': 64, 'kl_weight': 0.0002675424159290006, 'lr': 0.006726837075843226, 'batch_size': 128, 'dropout_rate': 0.11439934184352522, 'prior_mu': -0.020544354164727392, 'prior_sigma': 0.05710763832439271, 'normalization': 'layer'}. Best is trial 896 with value: 0.4533553242683411.
Generating morgan_rdkit fingerprints...
Generated fingerprints with 2048 features for 841 molecules
Trial 1452: 5-fold CV loss = 0.5157
[I 2025-08-07 21:50:31,987] Trial 1452 finished with value: 0.5157296478748321 and parameters: {'fp_type': 'morgan', 'morgan_only_radius': 2, 'morgan_only_nBits': 1024, 'num_hidden_layers': 3, 'hidden_dim_0': 256, 'hidden_dim_1': 1024, 'hidden_dim_2': 64, 'kl_weight': 0.00033236415516876204, 'lr': 0.006527936533443508, 'batch_size': 128, 'dropout_rate': 0.11326659135448446, 'prior_mu': 0.016481306462738234, 'prior_sigma': 0.07153667064807338, 'normalization': 'layer'}. Best is trial 896 with value: 0.4533553242683411.
Generating morgan_rdkit fingerprints...
Generated fingerprints with 2048 features for 841 molecules
Trial 1450: 5-fold CV loss = 0.4686
[I 2025-08-07 21:50:40,370] Trial 1450 finished with value: 0.4686137020587921 and parameters: {'fp_type': 'morgan_rdkit', 'combined_morgan_radius': 3, 'combined_morgan_nBits': 1024, 'combined_rdkit_maxPath': 7, 'combined_rdkit_nBits': 1024, 'num_hidden_layers': 3, 'hidden_dim_0': 256, 'hidden_dim_1': 1024, 'hidden_dim_2': 128, 'kl_weight': 0.00032370928623591603, 'lr': 0.006649351941164347, 'batch_size': 128, 'dropout_rate': 0.11511348277977217, 'prior_mu': -0.0331250032372152, 'prior_sigma': 0.07193407520966391, 'normalization': 'layer'}. Best is trial 896 with value: 0.4533553242683411.
Generating morgan_rdkit fingerprints...
Generated fingerprints with 2048 features for 841 molecules
Trial 1453: 5-fold CV loss = 0.6434
[I 2025-08-07 21:51:07,022] Trial 1453 finished with value: 0.6434207618236542 and parameters: {'fp_type': 'morgan_rdkit', 'combined_morgan_radius': 3, 'combined_morgan_nBits': 1024, 'combined_rdkit_maxPath': 7, 'combined_rdkit_nBits': 1024, 'num_hidden_layers': 3, 'hidden_dim_0': 256, 'hidden_dim_1': 1024, 'hidden_dim_2': 256, 'kl_weight': 0.00033711474454256466, 'lr': 0.006456494303977069, 'batch_size': 128, 'dropout_rate': 0.11000889900376719, 'prior_mu': -0.04108800118835645, 'prior_sigma': 0.07086086212272227, 'normalization': 'layer'}. Best is trial 896 with value: 0.4533553242683411.
Generating rdkit fingerprints...
Generated fingerprints with 256 features for 841 molecules
Trial 1454: 5-fold CV loss = 0.4643
[I 2025-08-07 21:51:11,825] Trial 1454 finished with value: 0.4642960548400879 and parameters: {'fp_type': 'morgan_rdkit', 'combined_morgan_radius': 3, 'combined_morgan_nBits': 1024, 'combined_rdkit_maxPath': 7, 'combined_rdkit_nBits': 1024, 'num_hidden_layers': 3, 'hidden_dim_0': 1024, 'hidden_dim_1': 1024, 'hidden_dim_2': 64, 'kl_weight': 0.00034917610731063757, 'lr': 0.00580028506924795, 'batch_size': 128, 'dropout_rate': 0.10529614009056175, 'prior_mu': -0.04155200955647594, 'prior_sigma': 0.07177315427265155, 'normalization': 'layer'}. Best is trial 896 with value: 0.4533553242683411.
Generating rdkit fingerprints...
Generated fingerprints with 256 features for 841 molecules
Trial 1451: 5-fold CV loss = 0.5394
[I 2025-08-07 21:51:23,325] Trial 1451 finished with value: 0.5393643498420715 and parameters: {'fp_type': 'morgan_rdkit', 'combined_morgan_radius': 3, 'combined_morgan_nBits': 1024, 'combined_rdkit_maxPath': 7, 'combined_rdkit_nBits': 1024, 'num_hidden_layers': 3, 'hidden_dim_0': 256, 'hidden_dim_1': 1024, 'hidden_dim_2': 128, 'kl_weight': 0.0003197450206329111, 'lr': 0.0060982004493781794, 'batch_size': 128, 'dropout_rate': 0.11800958505459067, 'prior_mu': 0.014864656149151527, 'prior_sigma': 0.07137359800646553, 'normalization': 'layer'}. Best is trial 896 with value: 0.4533553242683411.
Generating rdkit fingerprints...
Generated fingerprints with 256 features for 841 molecules
Trial 1457: 5-fold CV loss = 0.8878
