[I 2025-08-07 20:12:03,538] Trial 945 finished with value: 0.4684481739997864 and parameters: {'fp_type': 'morgan_rdkit', 'combined_morgan_radius': 3, 'combined_morgan_nBits': 1024, 'combined_rdkit_maxPath': 7, 'combined_rdkit_nBits': 1024, 'num_hidden_layers': 3, 'hidden_dim_0': 256, 'hidden_dim_1': 1024, 'hidden_dim_2': 64, 'kl_weight': 0.0002775250255977479, 'lr': 0.009062669317844526, 'batch_size': 128, 'dropout_rate': 0.10297605509188558, 'prior_mu': -0.007661504251091097, 'prior_sigma': 0.11469260636276969, 'normalization': 'layer'}. Best is trial 896 with value: 0.4533553242683411.
Generating morgan_rdkit fingerprints...
Generated fingerprints with 2048 features for 841 molecules
Trial 944: 5-fold CV loss = 0.4590
[I 2025-08-07 20:12:22,585] Trial 944 finished with value: 0.4589640200138092 and parameters: {'fp_type': 'morgan_rdkit', 'combined_morgan_radius': 3, 'combined_morgan_nBits': 1024, 'combined_rdkit_maxPath': 7, 'combined_rdkit_nBits': 1024, 'num_hidden_layers': 3, 'hidden_dim_0': 256, 'hidden_dim_1': 1024, 'hidden_dim_2': 64, 'kl_weight': 0.0002740653639612671, 'lr': 0.007570396948439502, 'batch_size': 128, 'dropout_rate': 0.12315472274873095, 'prior_mu': -0.006260932329313754, 'prior_sigma': 0.11536263169805208, 'normalization': 'layer'}. Best is trial 896 with value: 0.4533553242683411.
Generating morgan_rdkit fingerprints...
Generated fingerprints with 2048 features for 841 molecules
Trial 947: 5-fold CV loss = 0.8925
[I 2025-08-07 20:12:26,940] Trial 947 finished with value: 0.8925447821617126 and parameters: {'fp_type': 'morgan_rdkit', 'combined_morgan_radius': 3, 'combined_morgan_nBits': 1024, 'combined_rdkit_maxPath': 7, 'combined_rdkit_nBits': 1024, 'num_hidden_layers': 3, 'hidden_dim_0': 256, 'hidden_dim_1': 1024, 'hidden_dim_2': 1024, 'kl_weight': 0.0003808038357017311, 'lr': 0.009011345462399711, 'batch_size': 128, 'dropout_rate': 0.10746016418502095, 'prior_mu': -0.008108778296181264, 'prior_sigma': 0.1099198743397256, 'normalization': 'layer'}. Best is trial 896 with value: 0.4533553242683411.
Generating morgan_rdkit fingerprints...
Generated fingerprints with 2048 features for 841 molecules
Trial 949: 5-fold CV loss = 0.4744
[I 2025-08-07 20:12:32,361] Trial 949 finished with value: 0.47436455488204954 and parameters: {'fp_type': 'morgan_rdkit', 'combined_morgan_radius': 3, 'combined_morgan_nBits': 1024, 'combined_rdkit_maxPath': 6, 'combined_rdkit_nBits': 1024, 'num_hidden_layers': 3, 'hidden_dim_0': 256, 'hidden_dim_1': 1024, 'hidden_dim_2': 64, 'kl_weight': 0.00042158926035725235, 'lr': 0.007948415833529987, 'batch_size': 128, 'dropout_rate': 0.1309558218519868, 'prior_mu': -0.04098317214626119, 'prior_sigma': 0.08551676053174284, 'normalization': 'layer'}. Best is trial 896 with value: 0.4533553242683411.
Generating morgan_rdkit fingerprints...
Generated fingerprints with 1536 features for 841 molecules
Trial 948: 5-fold CV loss = 0.4753
[I 2025-08-07 20:12:36,972] Trial 948 finished with value: 0.47525017857551577 and parameters: {'fp_type': 'morgan_rdkit', 'combined_morgan_radius': 3, 'combined_morgan_nBits': 1024, 'combined_rdkit_maxPath': 7, 'combined_rdkit_nBits': 1024, 'num_hidden_layers': 3, 'hidden_dim_0': 256, 'hidden_dim_1': 1024, 'hidden_dim_2': 64, 'kl_weight': 0.011278204015627664, 'lr': 0.009145377475374052, 'batch_size': 128, 'dropout_rate': 0.10643939383957755, 'prior_mu': -0.038590946250939506, 'prior_sigma': 0.08604145833333764, 'normalization': 'layer'}. Best is trial 896 with value: 0.4533553242683411.
Generating morgan_rdkit fingerprints...
Generated fingerprints with 1536 features for 841 molecules
Trial 950: 5-fold CV loss = 0.4789
[I 2025-08-07 20:13:07,435] Trial 950 finished with value: 0.47888060808181765 and parameters: {'fp_type': 'morgan_rdkit', 'combined_morgan_radius': 3, 'combined_morgan_nBits': 1024, 'combined_rdkit_maxPath': 6, 'combined_rdkit_nBits': 1024, 'num_hidden_layers': 3, 'hidden_dim_0': 256, 'hidden_dim_1': 1024, 'hidden_dim_2': 64, 'kl_weight': 0.0004122166304974717, 'lr': 0.008905342248286702, 'batch_size': 128, 'dropout_rate': 0.11186155041247191, 'prior_mu': -0.0029563895358295997, 'prior_sigma': 0.09549129097683991, 'normalization': 'layer'}. Best is trial 896 with value: 0.4533553242683411.
Generating morgan_rdkit fingerprints...
Generated fingerprints with 2048 features for 841 molecules
Trial 952: 5-fold CV loss = 0.4887
[I 2025-08-07 20:13:09,690] Trial 952 finished with value: 0.48867096900939944 and parameters: {'fp_type': 'morgan_rdkit', 'combined_morgan_radius': 3, 'combined_morgan_nBits': 1024, 'combined_rdkit_maxPath': 7, 'combined_rdkit_nBits': 512, 'num_hidden_layers': 3, 'hidden_dim_0': 256, 'hidden_dim_1': 1024, 'hidden_dim_2': 64, 'kl_weight': 0.0003448693666564117, 'lr': 0.008639943767210456, 'batch_size': 64, 'dropout_rate': 0.11469502096276568, 'prior_mu': 0.009028965142687535, 'prior_sigma': 0.09394846491695683, 'normalization': 'layer'}. Best is trial 896 with value: 0.4533553242683411.
Generating morgan_rdkit fingerprints...
Generated fingerprints with 2048 features for 841 molecules
Trial 953: 5-fold CV loss = 0.5008
[I 2025-08-07 20:13:30,975] Trial 953 finished with value: 0.5008170962333679 and parameters: {'fp_type': 'morgan_rdkit', 'combined_morgan_radius': 3, 'combined_morgan_nBits': 1024, 'combined_rdkit_maxPath': 7, 'combined_rdkit_nBits': 512, 'num_hidden_layers': 3, 'hidden_dim_0': 256, 'hidden_dim_1': 1024, 'hidden_dim_2': 64, 'kl_weight': 0.00033029881210649655, 'lr': 0.008199401987163318, 'batch_size': 64, 'dropout_rate': 0.11806085374355846, 'prior_mu': 0.007908955940029303, 'prior_sigma': 0.09410944350732438, 'normalization': 'layer'}. Best is trial 896 with value: 0.4533553242683411.
Generating morgan_rdkit fingerprints...
Generated fingerprints with 2048 features for 841 molecules
Trial 955: 5-fold CV loss = 0.4646
[I 2025-08-07 20:13:45,757] Trial 955 finished with value: 0.464622563123703 and parameters: {'fp_type': 'morgan_rdkit', 'combined_morgan_radius': 3, 'combined_morgan_nBits': 1024, 'combined_rdkit_maxPath': 7, 'combined_rdkit_nBits': 1024, 'num_hidden_layers': 3, 'hidden_dim_0': 1024, 'hidden_dim_1': 1024, 'hidden_dim_2': 64, 'kl_weight': 0.000339438039152478, 'lr': 0.007855834568793407, 'batch_size': 128, 'dropout_rate': 0.06959347860770926, 'prior_mu': 0.004826998613021971, 'prior_sigma': 0.10348019449429592, 'normalization': 'layer'}. Best is trial 896 with value: 0.4533553242683411.
Generating morgan_rdkit fingerprints...
Generated fingerprints with 2048 features for 841 molecules
Trial 951: 5-fold CV loss = 0.4729
[I 2025-08-07 20:13:58,482] Trial 951 finished with value: 0.472904646396637 and parameters: {'fp_type': 'morgan_rdkit', 'combined_morgan_radius': 3, 'combined_morgan_nBits': 1024, 'combined_rdkit_maxPath': 6, 'combined_rdkit_nBits': 1024, 'num_hidden_layers': 3, 'hidden_dim_0': 1024, 'hidden_dim_1': 1024, 'hidden_dim_2': 64, 'kl_weight': 0.000335762173721512, 'lr': 0.008150142915662953, 'batch_size': 64, 'dropout_rate': 0.1161061147388553, 'prior_mu': -0.0033942893114348813, 'prior_sigma': 0.09422406113489804, 'normalization': 'layer'}. Best is trial 896 with value: 0.4533553242683411.
Generating morgan_rdkit fingerprints...
Generated fingerprints with 2048 features for 841 molecules
Trial 956: 5-fold CV loss = 0.4649
[I 2025-08-07 20:14:09,983] Trial 956 finished with value: 0.46492505073547363 and parameters: {'fp_type': 'morgan_rdkit', 'combined_morgan_radius': 3, 'combined_morgan_nBits': 1024, 'combined_rdkit_maxPath': 7, 'combined_rdkit_nBits': 1024, 'num_hidden_layers': 3, 'hidden_dim_0': 1024, 'hidden_dim_1': 1024, 'hidden_dim_2': 64, 'kl_weight': 0.0004577509326790652, 'lr': 0.007907685577442198, 'batch_size': 128, 'dropout_rate': 0.06916851041691237, 'prior_mu': -0.0003703118714461079, 'prior_sigma': 0.07282745978883966, 'normalization': 'layer'}. Best is trial 896 with value: 0.4533553242683411.
Generating morgan_rdkit fingerprints...
Generated fingerprints with 2048 features for 841 molecules
Trial 954: 5-fold CV loss = 0.4642
[I 2025-08-07 20:14:13,007] Trial 954 finished with value: 0.46419000029563906 and parameters: {'fp_type': 'morgan_rdkit', 'combined_morgan_radius': 3, 'combined_morgan_nBits': 1024, 'combined_rdkit_maxPath': 7, 'combined_rdkit_nBits': 1024, 'num_hidden_layers': 3, 'hidden_dim_0': 1024, 'hidden_dim_1': 1024, 'hidden_dim_2': 64, 'kl_weight': 0.00033101880961636563, 'lr': 0.008193352403102991, 'batch_size': 64, 'dropout_rate': 0.08945190455899077, 'prior_mu': 0.00700401425009092, 'prior_sigma': 0.07307908779264087, 'normalization': 'layer'}. Best is trial 896 with value: 0.4533553242683411.
Generating morgan_rdkit fingerprints...
Generated fingerprints with 2048 features for 841 molecules
Trial 957: 5-fold CV loss = 0.4667
[I 2025-08-07 20:14:22,400] Trial 957 finished with value: 0.46667768955230715 and parameters: {'fp_type': 'morgan_rdkit', 'combined_morgan_radius': 3, 'combined_morgan_nBits': 1024, 'combined_rdkit_maxPath': 7, 'combined_rdkit_nBits': 1024, 'num_hidden_layers': 3, 'hidden_dim_0': 256, 'hidden_dim_1': 1024, 'hidden_dim_2': 64, 'kl_weight': 0.0004491928841085856, 'lr': 0.007509656980497761, 'batch_size': 128, 'dropout_rate': 0.08863319124621144, 'prior_mu': -0.01660609964744708, 'prior_sigma': 0.07371544603991692, 'normalization': 'layer'}. Best is trial 896 with value: 0.4533553242683411.
Generating morgan_rdkit fingerprints...
Generated fingerprints with 2048 features for 841 molecules
Trial 961: 5-fold CV loss = 0.5699
[I 2025-08-07 20:14:54,747] Trial 961 finished with value: 0.5698676586151123 and parameters: {'fp_type': 'morgan_rdkit', 'combined_morgan_radius': 3, 'combined_morgan_nBits': 1024, 'combined_rdkit_maxPath': 7, 'combined_rdkit_nBits': 1024, 'num_hidden_layers': 3, 'hidden_dim_0': 256, 'hidden_dim_1': 256, 'hidden_dim_2': 64, 'kl_weight': 0.00027453516245902774, 'lr': 0.007083415489548388, 'batch_size': 128, 'dropout_rate': 0.12405374880412538, 'prior_mu': -0.01605192293177627, 'prior_sigma': 0.10713206152399715, 'normalization': 'layer'}. Best is trial 896 with value: 0.4533553242683411.
Generating morgan_rdkit fingerprints...
Generated fingerprints with 2048 features for 841 molecules
Trial 959: 5-fold CV loss = 0.4598
[I 2025-08-07 20:14:57,965] Trial 959 finished with value: 0.45983838438987734 and parameters: {'fp_type': 'morgan_rdkit', 'combined_morgan_radius': 3, 'combined_morgan_nBits': 1024, 'combined_rdkit_maxPath': 7, 'combined_rdkit_nBits': 1024, 'num_hidden_layers': 3, 'hidden_dim_0': 256, 'hidden_dim_1': 1024, 'hidden_dim_2': 64, 'kl_weight': 0.0002794093042753103, 'lr': 0.007028461320493381, 'batch_size': 128, 'dropout_rate': 0.09029958040956745, 'prior_mu': -0.014526821588335993, 'prior_sigma': 0.10721504552051835, 'normalization': 'layer'}. Best is trial 896 with value: 0.4533553242683411.
Generating morgan_rdkit fingerprints...
Generated fingerprints with 2048 features for 841 molecules
Trial 960: 5-fold CV loss = 0.4593
[I 2025-08-07 20:15:05,892] Trial 960 finished with value: 0.45925028920173644 and parameters: {'fp_type': 'morgan_rdkit', 'combined_morgan_radius': 3, 'combined_morgan_nBits': 1024, 'combined_rdkit_maxPath': 7, 'combined_rdkit_nBits': 1024, 'num_hidden_layers': 3, 'hidden_dim_0': 256, 'hidden_dim_1': 1024, 'hidden_dim_2': 64, 'kl_weight': 0.0002768387594821377, 'lr': 0.007295161645015024, 'batch_size': 128, 'dropout_rate': 0.12189956028192793, 'prior_mu': -0.013601172600936297, 'prior_sigma': 0.08204691265416754, 'normalization': 'layer'}. Best is trial 896 with value: 0.4533553242683411.
Generating morgan_rdkit fingerprints...
Generated fingerprints with 2048 features for 841 molecules
Trial 958: 5-fold CV loss = 0.4660
[I 2025-08-07 20:15:29,468] Trial 958 finished with value: 0.4660059452056885 and parameters: {'fp_type': 'morgan_rdkit', 'combined_morgan_radius': 3, 'combined_morgan_nBits': 1024, 'combined_rdkit_maxPath': 7, 'combined_rdkit_nBits': 1024, 'num_hidden_layers': 3, 'hidden_dim_0': 256, 'hidden_dim_1': 1024, 'hidden_dim_2': 64, 'kl_weight': 0.00028028285041810505, 'lr': 0.007419103941791703, 'batch_size': 128, 'dropout_rate': 0.08678168535256295, 'prior_mu': -0.0170317548950697, 'prior_sigma': 0.08211808419850214, 'normalization': 'layer'}. Best is trial 896 with value: 0.4533553242683411.
Generating morgan_rdkit fingerprints...
Generated fingerprints with 2048 features for 841 molecules
Trial 963: 5-fold CV loss = 0.6398
[I 2025-08-07 20:15:30,537] Trial 963 finished with value: 0.6397519111633301 and parameters: {'fp_type': 'morgan_rdkit', 'combined_morgan_radius': 3, 'combined_morgan_nBits': 1024, 'combined_rdkit_maxPath': 7, 'combined_rdkit_nBits': 1024, 'num_hidden_layers': 3, 'hidden_dim_0': 256, 'hidden_dim_1': 1024, 'hidden_dim_2': 64, 'kl_weight': 0.00022623816164729028, 'lr': 0.007160482763799597, 'batch_size': 128, 'dropout_rate': 0.09139326383926098, 'prior_mu': -0.010582088763730058, 'prior_sigma': 0.1206996740082509, 'normalization': 'layer'}. Best is trial 896 with value: 0.4533553242683411.
Generating morgan_rdkit fingerprints...
Generated fingerprints with 2048 features for 841 molecules
Trial 962: 5-fold CV loss = 0.4608
[I 2025-08-07 20:15:35,794] Trial 962 finished with value: 0.4608288645744324 and parameters: {'fp_type': 'morgan_rdkit', 'combined_morgan_radius': 3, 'combined_morgan_nBits': 1024, 'combined_rdkit_maxPath': 7, 'combined_rdkit_nBits': 1024, 'num_hidden_layers': 3, 'hidden_dim_0': 256, 'hidden_dim_1': 1024, 'hidden_dim_2': 64, 'kl_weight': 0.0003847960010659453, 'lr': 0.0069500710577447625, 'batch_size': 128, 'dropout_rate': 0.12349693402961318, 'prior_mu': -0.017987885459613304, 'prior_sigma': 0.10245389684263263, 'normalization': 'layer'}. Best is trial 896 with value: 0.4533553242683411.
Generating morgan_rdkit fingerprints...
Generated fingerprints with 2048 features for 841 molecules
Trial 964: 5-fold CV loss = 0.4709
[I 2025-08-07 20:15:55,994] Trial 964 finished with value: 0.470926308631897 and parameters: {'fp_type': 'morgan_rdkit', 'combined_morgan_radius': 3, 'combined_morgan_nBits': 1024, 'combined_rdkit_maxPath': 7, 'combined_rdkit_nBits': 1024, 'num_hidden_layers': 3, 'hidden_dim_0': 256, 'hidden_dim_1': 1024, 'hidden_dim_2': 64, 'kl_weight': 0.00022004652296794697, 'lr': 0.007466185347910645, 'batch_size': 128, 'dropout_rate': 0.04106613991734542, 'prior_mu': -0.0047809938377084416, 'prior_sigma': 0.08121904374362231, 'normalization': 'layer'}. Best is trial 896 with value: 0.4533553242683411.
Generating morgan_rdkit fingerprints...
Generated fingerprints with 2048 features for 841 molecules
Trial 966: 5-fold CV loss = 0.4674
[I 2025-08-07 20:16:10,501] Trial 966 finished with value: 0.4673809170722961 and parameters: {'fp_type': 'morgan_rdkit', 'combined_morgan_radius': 3, 'combined_morgan_nBits': 1024, 'combined_rdkit_maxPath': 7, 'combined_rdkit_nBits': 1024, 'num_hidden_layers': 3, 'hidden_dim_0': 256, 'hidden_dim_1': 1024, 'hidden_dim_2': 64, 'kl_weight': 0.00019170577496205804, 'lr': 0.009350613495708761, 'batch_size': 128, 'dropout_rate': 0.08402579193622617, 'prior_mu': -0.006092903142777401, 'prior_sigma': 0.08183386005587732, 'normalization': 'layer'}. Best is trial 896 with value: 0.4533553242683411.
Generating morgan_rdkit fingerprints...
Generated fingerprints with 2048 features for 841 molecules
Trial 967: 5-fold CV loss = 0.4648
[I 2025-08-07 20:16:13,249] Trial 967 finished with value: 0.4647674739360809 and parameters: {'fp_type': 'morgan_rdkit', 'combined_morgan_radius': 3, 'combined_morgan_nBits': 1024, 'combined_rdkit_maxPath': 7, 'combined_rdkit_nBits': 1024, 'num_hidden_layers': 3, 'hidden_dim_0': 256, 'hidden_dim_1': 1024, 'hidden_dim_2': 64, 'kl_weight': 0.000188655867396218, 'lr': 0.006759913758592208, 'batch_size': 128, 'dropout_rate': 0.08258328925688954, 'prior_mu': -0.004176936317269859, 'prior_sigma': 0.08000781762810162, 'normalization': 'layer'}. Best is trial 896 with value: 0.4533553242683411.
Generating morgan fingerprints...
Generated fingerprints with 1024 features for 841 molecules
Trial 970: 5-fold CV loss = 0.5289
[I 2025-08-07 20:16:35,140] Trial 970 finished with value: 0.5288937747478485 and parameters: {'fp_type': 'morgan', 'morgan_only_radius': 2, 'morgan_only_nBits': 1024, 'num_hidden_layers': 3, 'hidden_dim_0': 256, 'hidden_dim_1': 1024, 'hidden_dim_2': 64, 'kl_weight': 0.0016820850802339014, 'lr': 0.006617796813116044, 'batch_size': 128, 'dropout_rate': 0.09305619196708234, 'prior_mu': 0.0011243253486566303, 'prior_sigma': 0.10909496638842468, 'normalization': 'layer'}. Best is trial 896 with value: 0.4533553242683411.
Generating morgan_rdkit fingerprints...
Generated fingerprints with 2048 features for 841 molecules
Trial 969: 5-fold CV loss = 0.4856
[I 2025-08-07 20:16:50,407] Trial 969 finished with value: 0.48555135130882265 and parameters: {'fp_type': 'morgan_rdkit', 'combined_morgan_radius': 3, 'combined_morgan_nBits': 1024, 'combined_rdkit_maxPath': 7, 'combined_rdkit_nBits': 1024, 'num_hidden_layers': 3, 'hidden_dim_0': 256, 'hidden_dim_1': 1024, 'hidden_dim_2': 64, 'kl_weight': 0.0002485027433012461, 'lr': 0.006670219134747011, 'batch_size': 128, 'dropout_rate': 0.10042196669967365, 'prior_mu': -0.0006361183770626768, 'prior_sigma': 0.10892594159636647, 'normalization': 'layer'}. Best is trial 896 with value: 0.4533553242683411.
Generating morgan_rdkit fingerprints...
Generated fingerprints with 2048 features for 841 molecules
Trial 968: 5-fold CV loss = 0.4617
[I 2025-08-07 20:16:53,946] Trial 968 finished with value: 0.46173485517501833 and parameters: {'fp_type': 'morgan_rdkit', 'combined_morgan_radius': 3, 'combined_morgan_nBits': 1024, 'combined_rdkit_maxPath': 7, 'combined_rdkit_nBits': 1024, 'num_hidden_layers': 3, 'hidden_dim_0': 256, 'hidden_dim_1': 1024, 'hidden_dim_2': 64, 'kl_weight': 0.00019676407043364342, 'lr': 0.006540084407920512, 'batch_size': 128, 'dropout_rate': 0.07783279111579954, 'prior_mu': -0.003233287465394759, 'prior_sigma': 0.0793245842929261, 'normalization': 'layer'}. Best is trial 896 with value: 0.4533553242683411.
Generating morgan_rdkit fingerprints...
Generated fingerprints with 2048 features for 841 molecules
Trial 965: 5-fold CV loss = 0.4674
[I 2025-08-07 20:17:05,997] Trial 965 finished with value: 0.46742265820503237 and parameters: {'fp_type': 'morgan_rdkit', 'combined_morgan_radius': 3, 'combined_morgan_nBits': 1024, 'combined_rdkit_maxPath': 7, 'combined_rdkit_nBits': 1024, 'num_hidden_layers': 3, 'hidden_dim_0': 256, 'hidden_dim_1': 1024, 'hidden_dim_2': 64, 'kl_weight': 0.00018922010261528295, 'lr': 0.009156659440867887, 'batch_size': 128, 'dropout_rate': 0.05568148490722846, 'prior_mu': -0.004391087638643976, 'prior_sigma': 0.08161510530578371, 'normalization': 'layer'}. Best is trial 896 with value: 0.4533553242683411.
Generating morgan_rdkit fingerprints...
Generated fingerprints with 2048 features for 841 molecules
Trial 971: 5-fold CV loss = 0.4674
[I 2025-08-07 20:17:18,089] Trial 971 finished with value: 0.46737716197967527 and parameters: {'fp_type': 'morgan_rdkit', 'combined_morgan_radius': 3, 'combined_morgan_nBits': 1024, 'combined_rdkit_maxPath': 7, 'combined_rdkit_nBits': 1024, 'num_hidden_layers': 3, 'hidden_dim_0': 256, 'hidden_dim_1': 1024, 'hidden_dim_2': 64, 'kl_weight': 0.00025595443015945593, 'lr': 0.006804998083960447, 'batch_size': 128, 'dropout_rate': 0.10329885893891534, 'prior_mu': -0.012110885633647147, 'prior_sigma': 0.10653602668719325, 'normalization': 'layer'}. Best is trial 896 with value: 0.4533553242683411.
Generating morgan_rdkit fingerprints...
Generated fingerprints with 1280 features for 841 molecules
Trial 972: 5-fold CV loss = 0.4706
[I 2025-08-07 20:17:29,816] Trial 972 finished with value: 0.4705586969852448 and parameters: {'fp_type': 'morgan_rdkit', 'combined_morgan_radius': 3, 'combined_morgan_nBits': 1024, 'combined_rdkit_maxPath': 7, 'combined_rdkit_nBits': 1024, 'num_hidden_layers': 3, 'hidden_dim_0': 256, 'hidden_dim_1': 1024, 'hidden_dim_2': 64, 'kl_weight': 0.00029991480572169344, 'lr': 0.007431480086197647, 'batch_size': 128, 'dropout_rate': 0.09968776611576632, 'prior_mu': -0.012486653871884431, 'prior_sigma': 0.0753982488842055, 'normalization': 'layer'}. Best is trial 896 with value: 0.4533553242683411.
Generating morgan_rdkit fingerprints...
Generated fingerprints with 1280 features for 841 molecules
Trial 975: 5-fold CV loss = 0.5919
[I 2025-08-07 20:17:44,662] Trial 975 finished with value: 0.5919164896011353 and parameters: {'fp_type': 'morgan_rdkit', 'combined_morgan_radius': 3, 'combined_morgan_nBits': 1024, 'combined_rdkit_maxPath': 7, 'combined_rdkit_nBits': 256, 'num_hidden_layers': 3, 'hidden_dim_0': 256, 'hidden_dim_1': 256, 'hidden_dim_2': 64, 'kl_weight': 0.00029943489449711804, 'lr': 0.007570379776914051, 'batch_size': 128, 'dropout_rate': 0.12799979449617868, 'prior_mu': -0.013673975146753121, 'prior_sigma': 0.11802001337243886, 'normalization': 'none'}. Best is trial 896 with value: 0.4533553242683411.
Generating morgan_rdkit fingerprints...
Generated fingerprints with 2048 features for 841 molecules
Trial 973: 5-fold CV loss = 0.4608
[I 2025-08-07 20:17:45,762] Trial 973 finished with value: 0.46082568168640137 and parameters: {'fp_type': 'morgan_rdkit', 'combined_morgan_radius': 3, 'combined_morgan_nBits': 1024, 'combined_rdkit_maxPath': 7, 'combined_rdkit_nBits': 1024, 'num_hidden_layers': 3, 'hidden_dim_0': 256, 'hidden_dim_1': 1024, 'hidden_dim_2': 64, 'kl_weight': 0.0002696349578800864, 'lr': 0.007449217113326834, 'batch_size': 128, 'dropout_rate': 0.09993402299133354, 'prior_mu': -0.011877425916741307, 'prior_sigma': 0.07542597160840622, 'normalization': 'layer'}. Best is trial 896 with value: 0.4533553242683411.
Generating morgan_rdkit fingerprints...
Generated fingerprints with 2048 features for 841 molecules
Trial 976: 5-fold CV loss = 0.7942
