[I 2025-08-07 20:40:51,560] Trial 1097 finished with value: 0.4815643608570099 and parameters: {'fp_type': 'morgan_rdkit', 'combined_morgan_radius': 3, 'combined_morgan_nBits': 1024, 'combined_rdkit_maxPath': 5, 'combined_rdkit_nBits': 1024, 'num_hidden_layers': 3, 'hidden_dim_0': 256, 'hidden_dim_1': 1024, 'hidden_dim_2': 64, 'kl_weight': 0.00032883726562237876, 'lr': 0.00551538761885847, 'batch_size': 128, 'dropout_rate': 0.14465958339577797, 'prior_mu': -0.029248791369694965, 'prior_sigma': 0.09975794361989405, 'normalization': 'layer'}. Best is trial 896 with value: 0.4533553242683411.
Generating morgan_rdkit fingerprints...
Generated fingerprints with 2048 features for 841 molecules
Trial 1096: 5-fold CV loss = 0.4766
[I 2025-08-07 20:41:04,416] Trial 1096 finished with value: 0.47660712599754335 and parameters: {'fp_type': 'morgan_rdkit', 'combined_morgan_radius': 3, 'combined_morgan_nBits': 1024, 'combined_rdkit_maxPath': 5, 'combined_rdkit_nBits': 1024, 'num_hidden_layers': 3, 'hidden_dim_0': 256, 'hidden_dim_1': 1024, 'hidden_dim_2': 64, 'kl_weight': 0.00029720494600789867, 'lr': 0.006380564353746785, 'batch_size': 128, 'dropout_rate': 0.15010217921590205, 'prior_mu': -0.02442182720836332, 'prior_sigma': 0.07510872931085998, 'normalization': 'layer'}. Best is trial 896 with value: 0.4533553242683411.
Generating morgan_rdkit fingerprints...
Generated fingerprints with 2048 features for 841 molecules
Trial 1098: 5-fold CV loss = 0.4657
[I 2025-08-07 20:41:14,937] Trial 1098 finished with value: 0.4657429695129395 and parameters: {'fp_type': 'morgan_rdkit', 'combined_morgan_radius': 3, 'combined_morgan_nBits': 1024, 'combined_rdkit_maxPath': 7, 'combined_rdkit_nBits': 1024, 'num_hidden_layers': 3, 'hidden_dim_0': 256, 'hidden_dim_1': 1024, 'hidden_dim_2': 64, 'kl_weight': 0.00018280197836327778, 'lr': 0.006275644576555679, 'batch_size': 128, 'dropout_rate': 0.10400606559722297, 'prior_mu': -0.027736285488203023, 'prior_sigma': 0.0714715103794641, 'normalization': 'layer'}. Best is trial 896 with value: 0.4533553242683411.
Generating morgan_rdkit fingerprints...
Generated fingerprints with 2048 features for 841 molecules
Trial 1099: 5-fold CV loss = 0.4741
[I 2025-08-07 20:41:33,771] Trial 1099 finished with value: 0.47405949234962463 and parameters: {'fp_type': 'morgan_rdkit', 'combined_morgan_radius': 3, 'combined_morgan_nBits': 1024, 'combined_rdkit_maxPath': 7, 'combined_rdkit_nBits': 1024, 'num_hidden_layers': 3, 'hidden_dim_0': 256, 'hidden_dim_1': 1024, 'hidden_dim_2': 64, 'kl_weight': 0.00017951977128713784, 'lr': 0.006363195355012162, 'batch_size': 128, 'dropout_rate': 0.10770462498944121, 'prior_mu': -0.01131377299095893, 'prior_sigma': 0.11807483298063849, 'normalization': 'layer'}. Best is trial 896 with value: 0.4533553242683411.
Generating morgan fingerprints...
Generated fingerprints with 1024 features for 841 molecules
Trial 1101: 5-fold CV loss = 0.5684
[I 2025-08-07 20:41:50,138] Trial 1101 finished with value: 0.5684321999549866 and parameters: {'fp_type': 'morgan_rdkit', 'combined_morgan_radius': 3, 'combined_morgan_nBits': 1024, 'combined_rdkit_maxPath': 7, 'combined_rdkit_nBits': 1024, 'num_hidden_layers': 3, 'hidden_dim_0': 256, 'hidden_dim_1': 1024, 'hidden_dim_2': 64, 'kl_weight': 0.0004137258639928993, 'lr': 0.007595214426130391, 'batch_size': 128, 'dropout_rate': 0.12473281043598629, 'prior_mu': -0.011953255621664693, 'prior_sigma': 0.118883384523083, 'normalization': 'layer'}. Best is trial 896 with value: 0.4533553242683411.
Generating morgan fingerprints...
Generated fingerprints with 1024 features for 841 molecules
Trial 1102: 5-fold CV loss = 0.5331
[I 2025-08-07 20:41:54,408] Trial 1102 finished with value: 0.5331200659275055 and parameters: {'fp_type': 'morgan', 'morgan_only_radius': 2, 'morgan_only_nBits': 1024, 'num_hidden_layers': 3, 'hidden_dim_0': 256, 'hidden_dim_1': 1024, 'hidden_dim_2': 64, 'kl_weight': 0.0004493621942789493, 'lr': 0.00736452329599653, 'batch_size': 128, 'dropout_rate': 0.122281644868244, 'prior_mu': -0.03941676573041518, 'prior_sigma': 0.08239260852420748, 'normalization': 'layer'}. Best is trial 896 with value: 0.4533553242683411.
Generating morgan_rdkit fingerprints...
Generated fingerprints with 2048 features for 841 molecules
Trial 1100: 5-fold CV loss = 0.5417
[I 2025-08-07 20:41:56,665] Trial 1100 finished with value: 0.5417222023010254 and parameters: {'fp_type': 'morgan_rdkit', 'combined_morgan_radius': 3, 'combined_morgan_nBits': 1024, 'combined_rdkit_maxPath': 7, 'combined_rdkit_nBits': 1024, 'num_hidden_layers': 3, 'hidden_dim_0': 256, 'hidden_dim_1': 1024, 'hidden_dim_2': 64, 'kl_weight': 0.00043797848024424736, 'lr': 0.007135656218620921, 'batch_size': 128, 'dropout_rate': 0.10266498797094467, 'prior_mu': -0.014863340065119938, 'prior_sigma': 0.11950084107292372, 'normalization': 'layer'}. Best is trial 896 with value: 0.4533553242683411.
Generating morgan_rdkit fingerprints...
Generated fingerprints with 2048 features for 841 molecules
Trial 1103: 5-fold CV loss = 0.5294
[I 2025-08-07 20:42:19,201] Trial 1103 finished with value: 0.5294090449810028 and parameters: {'fp_type': 'morgan', 'morgan_only_radius': 2, 'morgan_only_nBits': 1024, 'num_hidden_layers': 3, 'hidden_dim_0': 256, 'hidden_dim_1': 256, 'hidden_dim_2': 64, 'kl_weight': 0.0002446354346491452, 'lr': 0.0070257513309840555, 'batch_size': 128, 'dropout_rate': 0.12148938330118986, 'prior_mu': -0.0373155913299486, 'prior_sigma': 0.08685917271234676, 'normalization': 'layer'}. Best is trial 896 with value: 0.4533553242683411.
Generating morgan_rdkit fingerprints...
Generated fingerprints with 2048 features for 841 molecules
Trial 1104: 5-fold CV loss = 0.4739
[I 2025-08-07 20:42:30,953] Trial 1104 finished with value: 0.473908394575119 and parameters: {'fp_type': 'morgan_rdkit', 'combined_morgan_radius': 3, 'combined_morgan_nBits': 1024, 'combined_rdkit_maxPath': 7, 'combined_rdkit_nBits': 1024, 'num_hidden_layers': 3, 'hidden_dim_0': 256, 'hidden_dim_1': 256, 'hidden_dim_2': 64, 'kl_weight': 0.00023679018979747628, 'lr': 0.006932358730037274, 'batch_size': 128, 'dropout_rate': 0.08515891854338603, 'prior_mu': -0.13648817226741183, 'prior_sigma': 0.0927576528501283, 'normalization': 'layer'}. Best is trial 896 with value: 0.4533553242683411.
Generating morgan_rdkit fingerprints...
Generated fingerprints with 2048 features for 841 molecules
Trial 1105: 5-fold CV loss = 0.6231
[I 2025-08-07 20:42:36,352] Trial 1105 finished with value: 0.6231210827827454 and parameters: {'fp_type': 'morgan_rdkit', 'combined_morgan_radius': 3, 'combined_morgan_nBits': 1024, 'combined_rdkit_maxPath': 7, 'combined_rdkit_nBits': 1024, 'num_hidden_layers': 3, 'hidden_dim_0': 256, 'hidden_dim_1': 256, 'hidden_dim_2': 64, 'kl_weight': 0.00023498494192113084, 'lr': 0.005556393052776353, 'batch_size': 128, 'dropout_rate': 0.130490589764749, 'prior_mu': -0.048882081480706684, 'prior_sigma': 0.08717246754066342, 'normalization': 'layer'}. Best is trial 896 with value: 0.4533553242683411.
Generating morgan_rdkit fingerprints...
Generated fingerprints with 2048 features for 841 molecules
Trial 1107: 5-fold CV loss = 0.8334
[I 2025-08-07 20:42:49,042] Trial 1107 finished with value: 0.833435845375061 and parameters: {'fp_type': 'morgan_rdkit', 'combined_morgan_radius': 3, 'combined_morgan_nBits': 1024, 'combined_rdkit_maxPath': 7, 'combined_rdkit_nBits': 1024, 'num_hidden_layers': 3, 'hidden_dim_0': 256, 'hidden_dim_1': 1024, 'hidden_dim_2': 64, 'kl_weight': 0.0003343852649072415, 'lr': 0.005616366190359236, 'batch_size': 128, 'dropout_rate': 0.00889344789807861, 'prior_mu': -0.020797867386214, 'prior_sigma': 0.10108048888041968, 'normalization': 'none'}. Best is trial 896 with value: 0.4533553242683411.
Generating morgan_rdkit fingerprints...
Generated fingerprints with 2048 features for 841 molecules
Trial 1095: 5-fold CV loss = 0.5665
[I 2025-08-07 20:43:00,666] Trial 1095 finished with value: 0.566541439294815 and parameters: {'fp_type': 'morgan_rdkit', 'combined_morgan_radius': 3, 'combined_morgan_nBits': 1024, 'combined_rdkit_maxPath': 7, 'combined_rdkit_nBits': 1024, 'num_hidden_layers': 3, 'hidden_dim_0': 256, 'hidden_dim_1': 1024, 'hidden_dim_2': 64, 'kl_weight': 0.0003019366639402966, 'lr': 0.005001663581679198, 'batch_size': 64, 'dropout_rate': 0.15324911654984255, 'prior_mu': -0.0299441906455136, 'prior_sigma': 0.18693427180009306, 'normalization': 'layer'}. Best is trial 896 with value: 0.4533553242683411.
Generating morgan_rdkit fingerprints...
Generated fingerprints with 2048 features for 841 molecules
Trial 1106: 5-fold CV loss = 0.4729
[I 2025-08-07 20:43:14,070] Trial 1106 finished with value: 0.4728890895843506 and parameters: {'fp_type': 'morgan_rdkit', 'combined_morgan_radius': 3, 'combined_morgan_nBits': 1024, 'combined_rdkit_maxPath': 7, 'combined_rdkit_nBits': 1024, 'num_hidden_layers': 3, 'hidden_dim_0': 256, 'hidden_dim_1': 1024, 'hidden_dim_2': 64, 'kl_weight': 0.0003332594577250347, 'lr': 0.004744185616161727, 'batch_size': 128, 'dropout_rate': 0.08870603135079815, 'prior_mu': -0.019402197516201116, 'prior_sigma': 0.0928660813688726, 'normalization': 'layer'}. Best is trial 896 with value: 0.4533553242683411.
Generating morgan_rdkit fingerprints...
Generated fingerprints with 2048 features for 841 molecules
Trial 1108: 5-fold CV loss = 0.6977
[I 2025-08-07 20:43:21,976] Trial 1108 finished with value: 0.6976835012435914 and parameters: {'fp_type': 'morgan_rdkit', 'combined_morgan_radius': 3, 'combined_morgan_nBits': 1024, 'combined_rdkit_maxPath': 7, 'combined_rdkit_nBits': 1024, 'num_hidden_layers': 3, 'hidden_dim_0': 256, 'hidden_dim_1': 1024, 'hidden_dim_2': 64, 'kl_weight': 0.00034851472456946147, 'lr': 0.00859957145765201, 'batch_size': 128, 'dropout_rate': 0.14218088751653843, 'prior_mu': -0.01922609175441347, 'prior_sigma': 0.10149990561106094, 'normalization': 'none'}. Best is trial 896 with value: 0.4533553242683411.
Generating morgan_rdkit fingerprints...
Generated fingerprints with 2048 features for 841 molecules
Trial 1109: 5-fold CV loss = 0.4676
[I 2025-08-07 20:43:25,783] Trial 1109 finished with value: 0.4676092088222504 and parameters: {'fp_type': 'morgan_rdkit', 'combined_morgan_radius': 3, 'combined_morgan_nBits': 1024, 'combined_rdkit_maxPath': 7, 'combined_rdkit_nBits': 1024, 'num_hidden_layers': 3, 'hidden_dim_0': 256, 'hidden_dim_1': 1024, 'hidden_dim_2': 64, 'kl_weight': 0.0003557397318702332, 'lr': 0.008347317057389418, 'batch_size': 128, 'dropout_rate': 0.14287846505597543, 'prior_mu': -0.03128105777983292, 'prior_sigma': 0.10615697255789452, 'normalization': 'layer'}. Best is trial 896 with value: 0.4533553242683411.
Generating morgan_rdkit fingerprints...
Generated fingerprints with 2048 features for 841 molecules
Trial 1113: 5-fold CV loss = 0.4603
[I 2025-08-07 20:43:59,079] Trial 1113 finished with value: 0.46027145981788636 and parameters: {'fp_type': 'morgan_rdkit', 'combined_morgan_radius': 3, 'combined_morgan_nBits': 1024, 'combined_rdkit_maxPath': 7, 'combined_rdkit_nBits': 1024, 'num_hidden_layers': 3, 'hidden_dim_0': 256, 'hidden_dim_1': 1024, 'hidden_dim_2': 64, 'kl_weight': 0.0002669876382357092, 'lr': 0.00785411675454858, 'batch_size': 128, 'dropout_rate': 0.11096774207337709, 'prior_mu': -0.0024893046728798, 'prior_sigma': 0.06932805131787632, 'normalization': 'layer'}. Best is trial 896 with value: 0.4533553242683411.
Generating morgan_rdkit fingerprints...
Generated fingerprints with 2048 features for 841 molecules
Trial 1111: 5-fold CV loss = 0.4614
[I 2025-08-07 20:44:03,415] Trial 1111 finished with value: 0.46138020157814025 and parameters: {'fp_type': 'morgan_rdkit', 'combined_morgan_radius': 3, 'combined_morgan_nBits': 1024, 'combined_rdkit_maxPath': 7, 'combined_rdkit_nBits': 1024, 'num_hidden_layers': 3, 'hidden_dim_0': 256, 'hidden_dim_1': 1024, 'hidden_dim_2': 64, 'kl_weight': 0.0003843121737946686, 'lr': 0.00846081206641758, 'batch_size': 128, 'dropout_rate': 0.14031271821175725, 'prior_mu': 0.0014044584502373812, 'prior_sigma': 0.10698925838567962, 'normalization': 'layer'}. Best is trial 896 with value: 0.4533553242683411.
Generating morgan_rdkit fingerprints...
Generated fingerprints with 2048 features for 841 molecules
Trial 1112: 5-fold CV loss = 0.4698
[I 2025-08-07 20:44:19,546] Trial 1112 finished with value: 0.4697761535644531 and parameters: {'fp_type': 'morgan_rdkit', 'combined_morgan_radius': 3, 'combined_morgan_nBits': 1024, 'combined_rdkit_maxPath': 7, 'combined_rdkit_nBits': 1024, 'num_hidden_layers': 3, 'hidden_dim_0': 256, 'hidden_dim_1': 1024, 'hidden_dim_2': 64, 'kl_weight': 0.0003822628594889793, 'lr': 0.007930602337375295, 'batch_size': 128, 'dropout_rate': 0.11287744958119489, 'prior_mu': 0.005542553980923249, 'prior_sigma': 0.09715763022977741, 'normalization': 'layer'}. Best is trial 896 with value: 0.4533553242683411.
Generating morgan_rdkit fingerprints...
Generated fingerprints with 2048 features for 841 molecules
Trial 1110: 5-fold CV loss = 0.4824
[I 2025-08-07 20:44:29,795] Trial 1110 finished with value: 0.48238990306854246 and parameters: {'fp_type': 'morgan_rdkit', 'combined_morgan_radius': 3, 'combined_morgan_nBits': 1024, 'combined_rdkit_maxPath': 7, 'combined_rdkit_nBits': 1024, 'num_hidden_layers': 3, 'hidden_dim_0': 256, 'hidden_dim_1': 1024, 'hidden_dim_2': 64, 'kl_weight': 0.0003486295317744798, 'lr': 0.008369247551145752, 'batch_size': 128, 'dropout_rate': 0.11414783412766251, 'prior_mu': 0.00029823722761549223, 'prior_sigma': 0.10642421502604281, 'normalization': 'layer'}. Best is trial 896 with value: 0.4533553242683411.
Generating morgan_rdkit fingerprints...
Generated fingerprints with 2048 features for 841 molecules
Trial 1114: 5-fold CV loss = 0.5603
[I 2025-08-07 20:44:31,701] Trial 1114 finished with value: 0.5602910995483399 and parameters: {'fp_type': 'morgan_rdkit', 'combined_morgan_radius': 3, 'combined_morgan_nBits': 1024, 'combined_rdkit_maxPath': 7, 'combined_rdkit_nBits': 1024, 'num_hidden_layers': 3, 'hidden_dim_0': 128, 'hidden_dim_1': 1024, 'hidden_dim_2': 64, 'kl_weight': 0.0003938884373880982, 'lr': 0.00630616837217517, 'batch_size': 128, 'dropout_rate': 0.12856800939956092, 'prior_mu': 0.002459057227217759, 'prior_sigma': 0.09746654501376698, 'normalization': 'layer'}. Best is trial 896 with value: 0.4533553242683411.
Generating morgan_rdkit fingerprints...
Generated fingerprints with 2048 features for 841 molecules
Trial 1115: 5-fold CV loss = 0.4715
[I 2025-08-07 20:44:48,727] Trial 1115 finished with value: 0.4715433239936829 and parameters: {'fp_type': 'morgan_rdkit', 'combined_morgan_radius': 3, 'combined_morgan_nBits': 1024, 'combined_rdkit_maxPath': 7, 'combined_rdkit_nBits': 1024, 'num_hidden_layers': 3, 'hidden_dim_0': 128, 'hidden_dim_1': 1024, 'hidden_dim_2': 64, 'kl_weight': 0.0002745765368796494, 'lr': 0.006064068620695258, 'batch_size': 128, 'dropout_rate': 0.11485756717229735, 'prior_mu': -0.0087097282425467, 'prior_sigma': 0.09780242523705877, 'normalization': 'layer'}. Best is trial 896 with value: 0.4533553242683411.
Generating morgan_rdkit fingerprints...
Generated fingerprints with 2048 features for 841 molecules
Trial 1116: 5-fold CV loss = 1.0070
[I 2025-08-07 20:45:08,150] Trial 1116 finished with value: 1.0069896459579468 and parameters: {'fp_type': 'morgan_rdkit', 'combined_morgan_radius': 3, 'combined_morgan_nBits': 1024, 'combined_rdkit_maxPath': 8, 'combined_rdkit_nBits': 1024, 'num_hidden_layers': 3, 'hidden_dim_0': 256, 'hidden_dim_1': 1024, 'hidden_dim_2': 64, 'kl_weight': 0.00027077655019157814, 'lr': 0.00010971110709245775, 'batch_size': 128, 'dropout_rate': 0.09761191617933457, 'prior_mu': -0.044010194784382325, 'prior_sigma': 0.08174537582202673, 'normalization': 'layer'}. Best is trial 896 with value: 0.4533553242683411.
Generating morgan_rdkit fingerprints...
Generated fingerprints with 1536 features for 841 molecules
Trial 1118: 5-fold CV loss = 0.4788
[I 2025-08-07 20:45:17,458] Trial 1118 finished with value: 0.4787955582141876 and parameters: {'fp_type': 'morgan_rdkit', 'combined_morgan_radius': 3, 'combined_morgan_nBits': 1024, 'combined_rdkit_maxPath': 8, 'combined_rdkit_nBits': 1024, 'num_hidden_layers': 3, 'hidden_dim_0': 256, 'hidden_dim_1': 1024, 'hidden_dim_2': 64, 'kl_weight': 0.0002904861992280998, 'lr': 0.005822882185899885, 'batch_size': 64, 'dropout_rate': 0.08971922931791357, 'prior_mu': -0.01048237330593078, 'prior_sigma': 0.08061582910692852, 'normalization': 'layer'}. Best is trial 896 with value: 0.4533553242683411.
Generating morgan_rdkit fingerprints...
Generated fingerprints with 1536 features for 841 molecules
Trial 1117: 5-fold CV loss = 0.8745
[I 2025-08-07 20:45:38,593] Trial 1117 finished with value: 0.8744835376739502 and parameters: {'fp_type': 'morgan_rdkit', 'combined_morgan_radius': 3, 'combined_morgan_nBits': 1024, 'combined_rdkit_maxPath': 7, 'combined_rdkit_nBits': 1024, 'num_hidden_layers': 3, 'hidden_dim_0': 128, 'hidden_dim_1': 1024, 'hidden_dim_2': 64, 'kl_weight': 0.00026915297578983347, 'lr': 0.0002269031905292184, 'batch_size': 128, 'dropout_rate': 0.09945091357556454, 'prior_mu': -0.009514746945466543, 'prior_sigma': 0.08897924168524834, 'normalization': 'layer'}. Best is trial 896 with value: 0.4533553242683411.
Generating morgan_rdkit fingerprints...
Generated fingerprints with 1536 features for 841 molecules
Trial 1121: 5-fold CV loss = 0.4972
[I 2025-08-07 20:45:50,417] Trial 1121 finished with value: 0.4971670269966125 and parameters: {'fp_type': 'morgan_rdkit', 'combined_morgan_radius': 3, 'combined_morgan_nBits': 1024, 'combined_rdkit_maxPath': 7, 'combined_rdkit_nBits': 512, 'num_hidden_layers': 3, 'hidden_dim_0': 256, 'hidden_dim_1': 1024, 'hidden_dim_2': 64, 'kl_weight': 0.00021313670917683846, 'lr': 0.006777452543613188, 'batch_size': 128, 'dropout_rate': 0.05765594454042633, 'prior_mu': -0.0350024725147262, 'prior_sigma': 0.08820990690490027, 'normalization': 'layer'}. Best is trial 896 with value: 0.4533553242683411.
Generating morgan_rdkit fingerprints...
Generated fingerprints with 2048 features for 841 molecules
Trial 1119: 5-fold CV loss = 0.4836
[I 2025-08-07 20:46:14,470] Trial 1119 finished with value: 0.4835533142089844 and parameters: {'fp_type': 'morgan_rdkit', 'combined_morgan_radius': 3, 'combined_morgan_nBits': 1024, 'combined_rdkit_maxPath': 8, 'combined_rdkit_nBits': 1024, 'num_hidden_layers': 3, 'hidden_dim_0': 256, 'hidden_dim_1': 1024, 'hidden_dim_2': 64, 'kl_weight': 0.00027304079434845686, 'lr': 0.006876822937980258, 'batch_size': 64, 'dropout_rate': 0.09949565553405637, 'prior_mu': -0.03618890958118322, 'prior_sigma': 0.19536344403578443, 'normalization': 'layer'}. Best is trial 896 with value: 0.4533553242683411.
Generating morgan_rdkit fingerprints...
Generated fingerprints with 2048 features for 841 molecules
Trial 1120: 5-fold CV loss = 0.4858
[I 2025-08-07 20:46:19,661] Trial 1120 finished with value: 0.48581347465515134 and parameters: {'fp_type': 'morgan_rdkit', 'combined_morgan_radius': 3, 'combined_morgan_nBits': 1024, 'combined_rdkit_maxPath': 7, 'combined_rdkit_nBits': 512, 'num_hidden_layers': 3, 'hidden_dim_0': 256, 'hidden_dim_1': 1024, 'hidden_dim_2': 64, 'kl_weight': 0.00031624527970203735, 'lr': 0.006744537266331394, 'batch_size': 64, 'dropout_rate': 0.10153304598487013, 'prior_mu': -0.011656694985125286, 'prior_sigma': 0.06684168097693305, 'normalization': 'layer'}. Best is trial 896 with value: 0.4533553242683411.
Generating morgan_rdkit fingerprints...
Generated fingerprints with 2048 features for 841 molecules
Trial 1123: 5-fold CV loss = 0.4671
[I 2025-08-07 20:46:32,357] Trial 1123 finished with value: 0.4671027481555939 and parameters: {'fp_type': 'morgan_rdkit', 'combined_morgan_radius': 3, 'combined_morgan_nBits': 1024, 'combined_rdkit_maxPath': 7, 'combined_rdkit_nBits': 1024, 'num_hidden_layers': 3, 'hidden_dim_0': 256, 'hidden_dim_1': 1024, 'hidden_dim_2': 64, 'kl_weight': 0.00046628924917050025, 'lr': 0.004531278230937985, 'batch_size': 128, 'dropout_rate': 0.13160824118684422, 'prior_mu': -0.02310590478520932, 'prior_sigma': 0.07368964344983124, 'normalization': 'layer'}. Best is trial 896 with value: 0.4533553242683411.
Generating morgan_rdkit fingerprints...
Generated fingerprints with 2048 features for 841 molecules
Trial 1122: 5-fold CV loss = 0.5009
[I 2025-08-07 20:46:51,625] Trial 1122 finished with value: 0.5009064853191376 and parameters: {'fp_type': 'morgan_rdkit', 'combined_morgan_radius': 3, 'combined_morgan_nBits': 1024, 'combined_rdkit_maxPath': 7, 'combined_rdkit_nBits': 512, 'num_hidden_layers': 3, 'hidden_dim_0': 256, 'hidden_dim_1': 1024, 'hidden_dim_2': 64, 'kl_weight': 0.00019921215929511558, 'lr': 0.006702591410153186, 'batch_size': 128, 'dropout_rate': 0.13035140653792493, 'prior_mu': -0.03728490825960703, 'prior_sigma': 0.0739813624685159, 'normalization': 'layer'}. Best is trial 896 with value: 0.4533553242683411.
Generating morgan_rdkit fingerprints...
Generated fingerprints with 2048 features for 841 molecules
Trial 1124: 5-fold CV loss = 0.4653
[I 2025-08-07 20:46:59,846] Trial 1124 finished with value: 0.465266627073288 and parameters: {'fp_type': 'morgan_rdkit', 'combined_morgan_radius': 3, 'combined_morgan_nBits': 1024, 'combined_rdkit_maxPath': 7, 'combined_rdkit_nBits': 1024, 'num_hidden_layers': 3, 'hidden_dim_0': 256, 'hidden_dim_1': 1024, 'hidden_dim_2': 64, 'kl_weight': 0.00031452277854818216, 'lr': 0.004714092044674181, 'batch_size': 128, 'dropout_rate': 0.131874453063704, 'prior_mu': -0.02219798087755949, 'prior_sigma': 0.0671717156670849, 'normalization': 'layer'}. Best is trial 896 with value: 0.4533553242683411.
Generating morgan_rdkit fingerprints...
Generated fingerprints with 2048 features for 841 molecules
Trial 1126: 5-fold CV loss = 0.4731
