[I 2025-08-08 06:34:02,765] Trial 2550 finished with value: 0.5680006206035614 and parameters: {'fp_type': 'morgan', 'morgan_only_radius': 2, 'morgan_only_nBits': 2048, 'num_hidden_layers': 3, 'hidden_dim_0': 512, 'hidden_dim_1': 128, 'hidden_dim_2': 256, 'kl_weight': 0.0005741776363042952, 'lr': 0.0020988384986246776, 'batch_size': 32, 'dropout_rate': 0.4328435678477624, 'prior_mu': 0.045617279892712324, 'prior_sigma': 0.06362332186239797, 'normalization': 'none'}. Best is trial 2426 with value: 0.515486741065979.
Generating morgan fingerprints...
Generated fingerprints with 2048 features for 900 molecules
Data shape: X=(900, 2048), y=(900,)
Trial 2551: 5-fold CV loss = 0.5498
[I 2025-08-08 06:34:12,924] Trial 2551 finished with value: 0.549759316444397 and parameters: {'fp_type': 'morgan', 'morgan_only_radius': 2, 'morgan_only_nBits': 2048, 'num_hidden_layers': 3, 'hidden_dim_0': 512, 'hidden_dim_1': 128, 'hidden_dim_2': 256, 'kl_weight': 0.0005945782620618028, 'lr': 0.0029910979679032474, 'batch_size': 32, 'dropout_rate': 0.4344652501689476, 'prior_mu': -0.16164593725788243, 'prior_sigma': 0.07076834324668627, 'normalization': 'none'}. Best is trial 2426 with value: 0.515486741065979.
Generating morgan fingerprints...
Generated fingerprints with 2048 features for 900 molecules
Data shape: X=(900, 2048), y=(900,)
Trial 2552: 5-fold CV loss = 0.5311
[I 2025-08-08 06:34:59,425] Trial 2552 finished with value: 0.5310867249965667 and parameters: {'fp_type': 'morgan', 'morgan_only_radius': 2, 'morgan_only_nBits': 2048, 'num_hidden_layers': 3, 'hidden_dim_0': 512, 'hidden_dim_1': 64, 'hidden_dim_2': 512, 'kl_weight': 0.0005700152583239296, 'lr': 0.0014240467687278919, 'batch_size': 32, 'dropout_rate': 0.42649469983883437, 'prior_mu': 0.046110651826135045, 'prior_sigma': 0.09473004090298447, 'normalization': 'none'}. Best is trial 2426 with value: 0.515486741065979.
Generating morgan fingerprints...
Generated fingerprints with 2048 features for 900 molecules
Data shape: X=(900, 2048), y=(900,)
Trial 2547: 5-fold CV loss = 0.5263
[I 2025-08-08 06:35:09,024] Trial 2547 finished with value: 0.5262667655944824 and parameters: {'fp_type': 'morgan', 'morgan_only_radius': 2, 'morgan_only_nBits': 2048, 'num_hidden_layers': 3, 'hidden_dim_0': 512, 'hidden_dim_1': 128, 'hidden_dim_2': 512, 'kl_weight': 0.00013421267206705387, 'lr': 0.002413894220707636, 'batch_size': 32, 'dropout_rate': 0.3950769594587463, 'prior_mu': 0.041409207213873894, 'prior_sigma': 0.06246356330229137, 'normalization': 'none'}. Best is trial 2426 with value: 0.515486741065979.
Generating morgan fingerprints...
Generated fingerprints with 2048 features for 900 molecules
Data shape: X=(900, 2048), y=(900,)
Trial 2553: 5-fold CV loss = 0.5302
[I 2025-08-08 06:35:29,754] Trial 2553 finished with value: 0.5302002131938934 and parameters: {'fp_type': 'morgan', 'morgan_only_radius': 2, 'morgan_only_nBits': 2048, 'num_hidden_layers': 3, 'hidden_dim_0': 512, 'hidden_dim_1': 64, 'hidden_dim_2': 512, 'kl_weight': 0.00098944661860469, 'lr': 0.0029488454238497394, 'batch_size': 32, 'dropout_rate': 0.4311830525268806, 'prior_mu': 0.0501402967439873, 'prior_sigma': 0.0712532372288422, 'normalization': 'none'}. Best is trial 2426 with value: 0.515486741065979.
Generating morgan fingerprints...
Generated fingerprints with 2048 features for 900 molecules
Data shape: X=(900, 2048), y=(900,)
Trial 2554: 5-fold CV loss = 0.5254
[I 2025-08-08 06:35:35,601] Trial 2554 finished with value: 0.5254037618637085 and parameters: {'fp_type': 'morgan', 'morgan_only_radius': 2, 'morgan_only_nBits': 2048, 'num_hidden_layers': 3, 'hidden_dim_0': 512, 'hidden_dim_1': 64, 'hidden_dim_2': 512, 'kl_weight': 0.000704385060196864, 'lr': 0.0019188624667165277, 'batch_size': 32, 'dropout_rate': 0.4134192559078723, 'prior_mu': 0.05036924733225203, 'prior_sigma': 0.07109818105286357, 'normalization': 'none'}. Best is trial 2426 with value: 0.515486741065979.
Generating morgan fingerprints...
Generated fingerprints with 2048 features for 900 molecules
Data shape: X=(900, 2048), y=(900,)
Trial 2558: 5-fold CV loss = 0.7981
[I 2025-08-08 06:36:28,866] Trial 2558 finished with value: 0.7980727553367615 and parameters: {'fp_type': 'morgan', 'morgan_only_radius': 2, 'morgan_only_nBits': 2048, 'num_hidden_layers': 3, 'hidden_dim_0': 512, 'hidden_dim_1': 128, 'hidden_dim_2': 512, 'kl_weight': 0.0004817086007788618, 'lr': 0.0015559677389840104, 'batch_size': 32, 'dropout_rate': 0.44212234006483425, 'prior_mu': 0.06564058489917858, 'prior_sigma': 0.08414651046433894, 'normalization': 'none'}. Best is trial 2426 with value: 0.515486741065979.
Generating morgan fingerprints...
Generated fingerprints with 2048 features for 900 molecules
Data shape: X=(900, 2048), y=(900,)
Trial 2555: 5-fold CV loss = 0.5375
[I 2025-08-08 06:36:43,440] Trial 2555 finished with value: 0.5375156283378602 and parameters: {'fp_type': 'morgan', 'morgan_only_radius': 2, 'morgan_only_nBits': 2048, 'num_hidden_layers': 3, 'hidden_dim_0': 512, 'hidden_dim_1': 128, 'hidden_dim_2': 512, 'kl_weight': 0.00013517154145812268, 'lr': 0.0019069029956998078, 'batch_size': 32, 'dropout_rate': 0.4149120054586178, 'prior_mu': 0.06331659534964079, 'prior_sigma': 0.07090266906005631, 'normalization': 'none'}. Best is trial 2426 with value: 0.515486741065979.
Generating morgan fingerprints...
Generated fingerprints with 2048 features for 900 molecules
Data shape: X=(900, 2048), y=(900,)
Trial 2557: 5-fold CV loss = 0.6842
[I 2025-08-08 06:36:55,059] Trial 2557 finished with value: 0.6842160105705262 and parameters: {'fp_type': 'morgan', 'morgan_only_radius': 2, 'morgan_only_nBits': 2048, 'num_hidden_layers': 3, 'hidden_dim_0': 512, 'hidden_dim_1': 128, 'hidden_dim_2': 512, 'kl_weight': 0.0007090704246941282, 'lr': 0.0018768148466891275, 'batch_size': 32, 'dropout_rate': 0.4130767687650675, 'prior_mu': 0.026789873620065494, 'prior_sigma': 0.08266948256442555, 'normalization': 'none'}. Best is trial 2426 with value: 0.515486741065979.
Generating morgan fingerprints...
Generated fingerprints with 2048 features for 900 molecules
Data shape: X=(900, 2048), y=(900,)
Trial 2559: 5-fold CV loss = 0.5575
[I 2025-08-08 06:37:35,287] Trial 2559 finished with value: 0.557486617565155 and parameters: {'fp_type': 'morgan', 'morgan_only_radius': 2, 'morgan_only_nBits': 2048, 'num_hidden_layers': 3, 'hidden_dim_0': 512, 'hidden_dim_1': 128, 'hidden_dim_2': 512, 'kl_weight': 0.000930697153204724, 'lr': 0.0018584908360490039, 'batch_size': 32, 'dropout_rate': 0.3023754026162243, 'prior_mu': 0.026998064216108373, 'prior_sigma': 0.06684868461967522, 'normalization': 'none'}. Best is trial 2426 with value: 0.515486741065979.
Generating morgan fingerprints...
Generated fingerprints with 2048 features for 900 molecules
Data shape: X=(900, 2048), y=(900,)
Trial 2560: 5-fold CV loss = 0.5271
[I 2025-08-08 06:38:00,846] Trial 2560 finished with value: 0.5271070122718811 and parameters: {'fp_type': 'morgan', 'morgan_only_radius': 2, 'morgan_only_nBits': 2048, 'num_hidden_layers': 3, 'hidden_dim_0': 512, 'hidden_dim_1': 128, 'hidden_dim_2': 512, 'kl_weight': 0.0009552915426782276, 'lr': 0.002251272048422473, 'batch_size': 32, 'dropout_rate': 0.454620412636307, 'prior_mu': 0.027982778501732905, 'prior_sigma': 0.06614960788548868, 'normalization': 'none'}. Best is trial 2426 with value: 0.515486741065979.
Generating rdkit fingerprints...
Generated fingerprints with 1024 features for 900 molecules
Data shape: X=(900, 1024), y=(900,)
Trial 2563: 5-fold CV loss = 0.8164
[I 2025-08-08 06:38:11,539] Trial 2563 finished with value: 0.8164455652236938 and parameters: {'fp_type': 'rdkit', 'rdkit_only_maxPath': 5, 'rdkit_only_nBits': 1024, 'num_hidden_layers': 3, 'hidden_dim_0': 64, 'hidden_dim_1': 256, 'hidden_dim_2': 256, 'kl_weight': 0.0002412486221691045, 'lr': 0.0027066704041660986, 'batch_size': 128, 'dropout_rate': 0.46310035798497334, 'prior_mu': 0.05487889730868578, 'prior_sigma': 0.07629812410834134, 'normalization': 'none'}. Best is trial 2426 with value: 0.515486741065979.
Generating morgan fingerprints...
Generated fingerprints with 2048 features for 900 molecules
Data shape: X=(900, 2048), y=(900,)
Trial 2562: 5-fold CV loss = 0.5852
[I 2025-08-08 06:38:25,596] Trial 2562 finished with value: 0.5851816534996033 and parameters: {'fp_type': 'morgan', 'morgan_only_radius': 2, 'morgan_only_nBits': 2048, 'num_hidden_layers': 3, 'hidden_dim_0': 64, 'hidden_dim_1': 128, 'hidden_dim_2': 256, 'kl_weight': 0.00024424127069688295, 'lr': 0.00229140492114777, 'batch_size': 32, 'dropout_rate': 0.4556856649684127, 'prior_mu': 0.055886199124748834, 'prior_sigma': 0.0763704177862745, 'normalization': 'none'}. Best is trial 2426 with value: 0.515486741065979.
Generating morgan fingerprints...
Generated fingerprints with 2048 features for 900 molecules
Data shape: X=(900, 2048), y=(900,)
Trial 2561: 5-fold CV loss = 0.5593
[I 2025-08-08 06:38:54,399] Trial 2561 finished with value: 0.5592583119869232 and parameters: {'fp_type': 'morgan', 'morgan_only_radius': 2, 'morgan_only_nBits': 2048, 'num_hidden_layers': 3, 'hidden_dim_0': 64, 'hidden_dim_1': 128, 'hidden_dim_2': 256, 'kl_weight': 0.0009463645522103207, 'lr': 0.0022539902379953673, 'batch_size': 32, 'dropout_rate': 0.4548645762586768, 'prior_mu': 0.03415381487165127, 'prior_sigma': 0.06662068219322412, 'normalization': 'none'}. Best is trial 2426 with value: 0.515486741065979.
Generating morgan fingerprints...
Generated fingerprints with 2048 features for 900 molecules
Data shape: X=(900, 2048), y=(900,)
Trial 2564: 5-fold CV loss = 0.5446
[I 2025-08-08 06:39:11,995] Trial 2564 finished with value: 0.5446069896221161 and parameters: {'fp_type': 'morgan', 'morgan_only_radius': 2, 'morgan_only_nBits': 2048, 'num_hidden_layers': 3, 'hidden_dim_0': 512, 'hidden_dim_1': 128, 'hidden_dim_2': 512, 'kl_weight': 0.0004882832721094866, 'lr': 0.00218277929280969, 'batch_size': 32, 'dropout_rate': 0.452702469880774, 'prior_mu': 0.038452805858991634, 'prior_sigma': 0.06729280743725659, 'normalization': 'layer'}. Best is trial 2426 with value: 0.515486741065979.
Generating morgan fingerprints...
Generated fingerprints with 2048 features for 900 molecules
Data shape: X=(900, 2048), y=(900,)
Trial 2556: 5-fold CV loss = 0.5538
[I 2025-08-08 06:39:16,698] Trial 2556 finished with value: 0.5538253962993622 and parameters: {'fp_type': 'morgan', 'morgan_only_radius': 2, 'morgan_only_nBits': 2048, 'num_hidden_layers': 3, 'hidden_dim_0': 512, 'hidden_dim_1': 64, 'hidden_dim_2': 512, 'kl_weight': 0.07366703934210436, 'lr': 0.001926774505058999, 'batch_size': 32, 'dropout_rate': 0.41596986190570845, 'prior_mu': 0.06451282532300046, 'prior_sigma': 0.07129163410714201, 'normalization': 'none'}. Best is trial 2426 with value: 0.515486741065979.
Generating morgan_rdkit fingerprints...
Generated fingerprints with 768 features for 900 molecules
Data shape: X=(900, 768), y=(900,)
Trial 2566: 5-fold CV loss = 0.7519
[I 2025-08-08 06:39:19,957] Trial 2566 finished with value: 0.7519388675689698 and parameters: {'fp_type': 'morgan', 'morgan_only_radius': 2, 'morgan_only_nBits': 2048, 'num_hidden_layers': 3, 'hidden_dim_0': 512, 'hidden_dim_1': 64, 'hidden_dim_2': 512, 'kl_weight': 0.0006518014965925497, 'lr': 0.0017337941234018637, 'batch_size': 64, 'dropout_rate': 0.43552118523957056, 'prior_mu': 0.013667214813091424, 'prior_sigma': 0.05980459783638682, 'normalization': 'none'}. Best is trial 2426 with value: 0.515486741065979.
Generating morgan_rdkit fingerprints...
Generated fingerprints with 768 features for 900 molecules
Data shape: X=(900, 768), y=(900,)
Trial 2565: 5-fold CV loss = 0.5751
[I 2025-08-08 06:39:43,239] Trial 2565 finished with value: 0.575121408700943 and parameters: {'fp_type': 'morgan', 'morgan_only_radius': 2, 'morgan_only_nBits': 2048, 'num_hidden_layers': 3, 'hidden_dim_0': 512, 'hidden_dim_1': 64, 'hidden_dim_2': 512, 'kl_weight': 0.0006361828568672134, 'lr': 0.0017159039550243664, 'batch_size': 32, 'dropout_rate': 0.4412058165290651, 'prior_mu': 0.012404420157582235, 'prior_sigma': 0.0676184777496781, 'normalization': 'none'}. Best is trial 2426 with value: 0.515486741065979.
Generating morgan_rdkit fingerprints...
Generated fingerprints with 768 features for 900 molecules
Data shape: X=(900, 768), y=(900,)
Trial 2567: 5-fold CV loss = 0.7532
[I 2025-08-08 06:39:45,641] Trial 2567 finished with value: 0.7532208621501922 and parameters: {'fp_type': 'morgan', 'morgan_only_radius': 2, 'morgan_only_nBits': 2048, 'num_hidden_layers': 3, 'hidden_dim_0': 512, 'hidden_dim_1': 64, 'hidden_dim_2': 512, 'kl_weight': 0.0006181101880665283, 'lr': 0.0016915302344907102, 'batch_size': 64, 'dropout_rate': 0.43936551558172965, 'prior_mu': 0.01667868511222273, 'prior_sigma': 0.057205642093713094, 'normalization': 'none'}. Best is trial 2426 with value: 0.515486741065979.
Generating morgan_rdkit fingerprints...
Generated fingerprints with 768 features for 900 molecules
Data shape: X=(900, 768), y=(900,)
Trial 2570: 5-fold CV loss = 0.5762
[I 2025-08-08 06:40:57,815] Trial 2570 finished with value: 0.5762093961238861 and parameters: {'fp_type': 'morgan_rdkit', 'combined_morgan_radius': 3, 'combined_morgan_nBits': 512, 'combined_rdkit_maxPath': 7, 'combined_rdkit_nBits': 256, 'num_hidden_layers': 3, 'hidden_dim_0': 512, 'hidden_dim_1': 128, 'hidden_dim_2': 512, 'kl_weight': 0.0008046658540335473, 'lr': 0.0025434209249516723, 'batch_size': 32, 'dropout_rate': 0.42533777015875357, 'prior_mu': 0.04483541927197634, 'prior_sigma': 0.07389456211977286, 'normalization': 'none'}. Best is trial 2426 with value: 0.515486741065979.
Generating morgan fingerprints...
Generated fingerprints with 2048 features for 900 molecules
Data shape: X=(900, 2048), y=(900,)
Trial 2571: 5-fold CV loss = 0.5643
[I 2025-08-08 06:41:00,234] Trial 2571 finished with value: 0.564335024356842 and parameters: {'fp_type': 'morgan_rdkit', 'combined_morgan_radius': 3, 'combined_morgan_nBits': 512, 'combined_rdkit_maxPath': 7, 'combined_rdkit_nBits': 256, 'num_hidden_layers': 3, 'hidden_dim_0': 512, 'hidden_dim_1': 128, 'hidden_dim_2': 1024, 'kl_weight': 0.00018816328638380077, 'lr': 0.0025519115531225573, 'batch_size': 32, 'dropout_rate': 0.42547908020045266, 'prior_mu': 0.04554766712134462, 'prior_sigma': 0.052808251489406315, 'normalization': 'none'}. Best is trial 2426 with value: 0.515486741065979.
Generating morgan fingerprints...
Generated fingerprints with 2048 features for 900 molecules
Data shape: X=(900, 2048), y=(900,)
Trial 2569: 5-fold CV loss = 0.5522
[I 2025-08-08 06:41:19,576] Trial 2569 finished with value: 0.5522342979907989 and parameters: {'fp_type': 'morgan_rdkit', 'combined_morgan_radius': 3, 'combined_morgan_nBits': 512, 'combined_rdkit_maxPath': 7, 'combined_rdkit_nBits': 256, 'num_hidden_layers': 3, 'hidden_dim_0': 512, 'hidden_dim_1': 128, 'hidden_dim_2': 512, 'kl_weight': 0.0007661875032090497, 'lr': 0.0025778504665236158, 'batch_size': 32, 'dropout_rate': 0.42448575146316253, 'prior_mu': 0.046588752765799865, 'prior_sigma': 0.0528629241892715, 'normalization': 'none'}. Best is trial 2426 with value: 0.515486741065979.
Generating morgan fingerprints...
Generated fingerprints with 2048 features for 900 molecules
Data shape: X=(900, 2048), y=(900,)
Trial 2568: 5-fold CV loss = 0.5569
[I 2025-08-08 06:41:39,180] Trial 2568 finished with value: 0.5569300770759582 and parameters: {'fp_type': 'morgan_rdkit', 'combined_morgan_radius': 3, 'combined_morgan_nBits': 512, 'combined_rdkit_maxPath': 7, 'combined_rdkit_nBits': 256, 'num_hidden_layers': 3, 'hidden_dim_0': 512, 'hidden_dim_1': 128, 'hidden_dim_2': 512, 'kl_weight': 0.0006423342174425426, 'lr': 0.0045029492760516095, 'batch_size': 64, 'dropout_rate': 0.43859848843268845, 'prior_mu': 0.045037742797904, 'prior_sigma': 0.061934347952504624, 'normalization': 'none'}. Best is trial 2426 with value: 0.515486741065979.
Generating morgan fingerprints...
Generated fingerprints with 2048 features for 900 molecules
Data shape: X=(900, 2048), y=(900,)
Trial 2572: 5-fold CV loss = 0.5335
[I 2025-08-08 06:41:57,822] Trial 2572 finished with value: 0.5335046827793122 and parameters: {'fp_type': 'morgan', 'morgan_only_radius': 2, 'morgan_only_nBits': 2048, 'num_hidden_layers': 3, 'hidden_dim_0': 512, 'hidden_dim_1': 128, 'hidden_dim_2': 1024, 'kl_weight': 0.0005298114491461359, 'lr': 0.002044781572230955, 'batch_size': 32, 'dropout_rate': 0.4057286597857335, 'prior_mu': 0.04023295038851959, 'prior_sigma': 0.0532314019524696, 'normalization': 'none'}. Best is trial 2426 with value: 0.515486741065979.
Generating morgan fingerprints...
Generated fingerprints with 2048 features for 900 molecules
Data shape: X=(900, 2048), y=(900,)
Trial 2573: 5-fold CV loss = 0.7308
[I 2025-08-08 06:42:03,340] Trial 2573 finished with value: 0.7308273196220398 and parameters: {'fp_type': 'morgan', 'morgan_only_radius': 2, 'morgan_only_nBits': 2048, 'num_hidden_layers': 3, 'hidden_dim_0': 512, 'hidden_dim_1': 512, 'hidden_dim_2': 64, 'kl_weight': 0.0007290154274940295, 'lr': 0.003680855166589484, 'batch_size': 32, 'dropout_rate': 0.4082793004354878, 'prior_mu': 0.036512029780135784, 'prior_sigma': 0.08100640763654914, 'normalization': 'none'}. Best is trial 2426 with value: 0.515486741065979.
Generating morgan fingerprints...
Generated fingerprints with 2048 features for 900 molecules
Data shape: X=(900, 2048), y=(900,)
Trial 2576: 5-fold CV loss = 0.5359
[I 2025-08-08 06:42:54,134] Trial 2576 finished with value: 0.535893714427948 and parameters: {'fp_type': 'morgan', 'morgan_only_radius': 2, 'morgan_only_nBits': 2048, 'num_hidden_layers': 3, 'hidden_dim_0': 512, 'hidden_dim_1': 128, 'hidden_dim_2': 256, 'kl_weight': 0.0007458329488050644, 'lr': 0.0032961905073911656, 'batch_size': 32, 'dropout_rate': 0.4635113240651446, 'prior_mu': 0.06961556004088931, 'prior_sigma': 0.07908160463030171, 'normalization': 'none'}. Best is trial 2426 with value: 0.515486741065979.
Generating morgan fingerprints...
Generated fingerprints with 2048 features for 900 molecules
Data shape: X=(900, 2048), y=(900,)
Trial 2577: 5-fold CV loss = 0.5418
[I 2025-08-08 06:43:04,928] Trial 2577 finished with value: 0.5418349981307984 and parameters: {'fp_type': 'morgan', 'morgan_only_radius': 2, 'morgan_only_nBits': 2048, 'num_hidden_layers': 3, 'hidden_dim_0': 1024, 'hidden_dim_1': 128, 'hidden_dim_2': 256, 'kl_weight': 0.00043039027629626495, 'lr': 0.003234503860779411, 'batch_size': 32, 'dropout_rate': 0.38456235119363125, 'prior_mu': 0.052344363869371295, 'prior_sigma': 0.06438691757328363, 'normalization': 'none'}. Best is trial 2426 with value: 0.515486741065979.
Generating morgan fingerprints...
Generated fingerprints with 2048 features for 900 molecules
Data shape: X=(900, 2048), y=(900,)
Trial 2574: 5-fold CV loss = 0.6154
[I 2025-08-08 06:43:19,010] Trial 2574 finished with value: 0.6153987348079681 and parameters: {'fp_type': 'morgan', 'morgan_only_radius': 2, 'morgan_only_nBits': 2048, 'num_hidden_layers': 3, 'hidden_dim_0': 512, 'hidden_dim_1': 512, 'hidden_dim_2': 64, 'kl_weight': 0.0005084358526964707, 'lr': 0.002050247792889676, 'batch_size': 32, 'dropout_rate': 0.33917585115421095, 'prior_mu': 0.0355915165115384, 'prior_sigma': 0.06278702016625123, 'normalization': 'none'}. Best is trial 2426 with value: 0.515486741065979.
Generating morgan fingerprints...
Generated fingerprints with 2048 features for 900 molecules
Data shape: X=(900, 2048), y=(900,)
Trial 2578: 5-fold CV loss = 0.5371
[I 2025-08-08 06:43:55,652] Trial 2578 finished with value: 0.5370539426803589 and parameters: {'fp_type': 'morgan', 'morgan_only_radius': 2, 'morgan_only_nBits': 2048, 'num_hidden_layers': 3, 'hidden_dim_0': 1024, 'hidden_dim_1': 128, 'hidden_dim_2': 512, 'kl_weight': 0.00041027863008388777, 'lr': 0.002026863846523589, 'batch_size': 32, 'dropout_rate': 0.4474341436437245, 'prior_mu': 0.030314047491155002, 'prior_sigma': 0.08706047296222431, 'normalization': 'none'}. Best is trial 2426 with value: 0.515486741065979.
Generating morgan fingerprints...
Generated fingerprints with 2048 features for 900 molecules
Data shape: X=(900, 2048), y=(900,)
Trial 2575: 5-fold CV loss = 0.7596
[I 2025-08-08 06:44:16,031] Trial 2575 finished with value: 0.7595971524715424 and parameters: {'fp_type': 'morgan', 'morgan_only_radius': 2, 'morgan_only_nBits': 2048, 'num_hidden_layers': 3, 'hidden_dim_0': 512, 'hidden_dim_1': 128, 'hidden_dim_2': 64, 'kl_weight': 0.0005456776207573129, 'lr': 0.0020299050495443463, 'batch_size': 32, 'dropout_rate': 0.4049709941237515, 'prior_mu': 0.03588960071225452, 'prior_sigma': 0.10808939369198046, 'normalization': 'none'}. Best is trial 2426 with value: 0.515486741065979.
Generating morgan fingerprints...
Generated fingerprints with 2048 features for 900 molecules
Data shape: X=(900, 2048), y=(900,)
Trial 2579: 5-fold CV loss = 0.5575
[I 2025-08-08 06:44:33,524] Trial 2579 finished with value: 0.5575283944606781 and parameters: {'fp_type': 'morgan', 'morgan_only_radius': 2, 'morgan_only_nBits': 2048, 'num_hidden_layers': 3, 'hidden_dim_0': 512, 'hidden_dim_1': 128, 'hidden_dim_2': 512, 'kl_weight': 0.0005381784492691651, 'lr': 0.0020993785135057542, 'batch_size': 32, 'dropout_rate': 0.13866739875993106, 'prior_mu': 0.026465404440780972, 'prior_sigma': 0.07374863659731345, 'normalization': 'none'}. Best is trial 2426 with value: 0.515486741065979.
Generating morgan fingerprints...
Generated fingerprints with 2048 features for 900 molecules
Data shape: X=(900, 2048), y=(900,)
Trial 2580: 5-fold CV loss = 0.5246
