[I 2025-08-08 01:36:26,444] Trial 1668 finished with value: 0.801911997795105 and parameters: {'fp_type': 'morgan', 'morgan_only_radius': 2, 'morgan_only_nBits': 2048, 'num_hidden_layers': 3, 'hidden_dim_0': 512, 'hidden_dim_1': 1024, 'hidden_dim_2': 512, 'kl_weight': 0.0006092868924375873, 'lr': 0.0018823757504369731, 'batch_size': 64, 'dropout_rate': 0.39661485887370196, 'prior_mu': 0.04652636345918451, 'prior_sigma': 0.07105482898445666, 'normalization': 'none'}. Best is trial 1528 with value: 0.5170644640922546.
Generating morgan fingerprints...
Generated fingerprints with 2048 features for 900 molecules
Data shape: X=(900, 2048), y=(900,)
Trial 1670: 5-fold CV loss = 0.6986
[I 2025-08-08 01:36:37,206] Trial 1670 finished with value: 0.698612916469574 and parameters: {'fp_type': 'morgan', 'morgan_only_radius': 2, 'morgan_only_nBits': 2048, 'num_hidden_layers': 3, 'hidden_dim_0': 512, 'hidden_dim_1': 1024, 'hidden_dim_2': 64, 'kl_weight': 0.0007223857910609229, 'lr': 0.0018649491057534326, 'batch_size': 64, 'dropout_rate': 0.41763411537895395, 'prior_mu': 0.03577515590930665, 'prior_sigma': 0.07005280586309671, 'normalization': 'none'}. Best is trial 1528 with value: 0.5170644640922546.
Generating morgan fingerprints...
Generated fingerprints with 2048 features for 900 molecules
Data shape: X=(900, 2048), y=(900,)
Trial 1667: 5-fold CV loss = 0.5369
[I 2025-08-08 01:36:59,354] Trial 1667 finished with value: 0.5368699908256531 and parameters: {'fp_type': 'morgan', 'morgan_only_radius': 2, 'morgan_only_nBits': 2048, 'num_hidden_layers': 3, 'hidden_dim_0': 512, 'hidden_dim_1': 1024, 'hidden_dim_2': 1024, 'kl_weight': 0.0006693470370753593, 'lr': 0.0018328126732857048, 'batch_size': 32, 'dropout_rate': 0.38457201935614166, 'prior_mu': 0.03503617456771178, 'prior_sigma': 0.07202961768851164, 'normalization': 'layer'}. Best is trial 1528 with value: 0.5170644640922546.
Generating morgan fingerprints...
Generated fingerprints with 2048 features for 900 molecules
Data shape: X=(900, 2048), y=(900,)
Trial 1672: 5-fold CV loss = 0.9955
[I 2025-08-08 01:37:00,723] Trial 1672 finished with value: 0.9954628348350525 and parameters: {'fp_type': 'morgan', 'morgan_only_radius': 2, 'morgan_only_nBits': 2048, 'num_hidden_layers': 3, 'hidden_dim_0': 512, 'hidden_dim_1': 512, 'hidden_dim_2': 512, 'kl_weight': 0.0005064251378443239, 'lr': 0.001888781113898836, 'batch_size': 32, 'dropout_rate': 0.4122342327742853, 'prior_mu': 0.03841197533487173, 'prior_sigma': 0.07083092183117837, 'normalization': 'none'}. Best is trial 1528 with value: 0.5170644640922546.
Generating morgan fingerprints...
Generated fingerprints with 2048 features for 900 molecules
Data shape: X=(900, 2048), y=(900,)
Trial 1671: 5-fold CV loss = 0.5740
[I 2025-08-08 01:37:53,329] Trial 1671 finished with value: 0.5739828109741211 and parameters: {'fp_type': 'morgan', 'morgan_only_radius': 2, 'morgan_only_nBits': 2048, 'num_hidden_layers': 3, 'hidden_dim_0': 512, 'hidden_dim_1': 128, 'hidden_dim_2': 64, 'kl_weight': 0.0007019156141233826, 'lr': 0.0018627978036207461, 'batch_size': 32, 'dropout_rate': 0.4124472049221711, 'prior_mu': 0.03487131137474563, 'prior_sigma': 0.07015500117276088, 'normalization': 'none'}. Best is trial 1528 with value: 0.5170644640922546.
Generating morgan fingerprints...
Generated fingerprints with 2048 features for 900 molecules
Data shape: X=(900, 2048), y=(900,)
Trial 1674: 5-fold CV loss = 0.6514
[I 2025-08-08 01:38:00,944] Trial 1674 finished with value: 0.6514022827148438 and parameters: {'fp_type': 'morgan', 'morgan_only_radius': 2, 'morgan_only_nBits': 2048, 'num_hidden_layers': 3, 'hidden_dim_0': 256, 'hidden_dim_1': 128, 'hidden_dim_2': 512, 'kl_weight': 0.0008244178652726396, 'lr': 0.0014979786789722507, 'batch_size': 32, 'dropout_rate': 0.4095016855410133, 'prior_mu': 0.050832990194630605, 'prior_sigma': 0.07674566608595654, 'normalization': 'none'}. Best is trial 1528 with value: 0.5170644640922546.
Generating morgan fingerprints...
Generated fingerprints with 2048 features for 900 molecules
Data shape: X=(900, 2048), y=(900,)
Trial 1669: 5-fold CV loss = 0.7094
[I 2025-08-08 01:38:56,181] Trial 1669 finished with value: 0.7094267010688782 and parameters: {'fp_type': 'morgan', 'morgan_only_radius': 2, 'morgan_only_nBits': 2048, 'num_hidden_layers': 3, 'hidden_dim_0': 512, 'hidden_dim_1': 1024, 'hidden_dim_2': 64, 'kl_weight': 0.0006685748783101254, 'lr': 0.0018544675273898864, 'batch_size': 32, 'dropout_rate': 0.39417856072047786, 'prior_mu': 0.04750473124235197, 'prior_sigma': 0.0706253016321059, 'normalization': 'none'}. Best is trial 1528 with value: 0.5170644640922546.
Generating morgan_rdkit fingerprints...
Generated fingerprints with 768 features for 900 molecules
Data shape: X=(900, 768), y=(900,)
Trial 1676: 5-fold CV loss = 0.6928
[I 2025-08-08 01:38:58,583] Trial 1676 finished with value: 0.6928448438644409 and parameters: {'fp_type': 'morgan', 'morgan_only_radius': 2, 'morgan_only_nBits': 2048, 'num_hidden_layers': 3, 'hidden_dim_0': 512, 'hidden_dim_1': 128, 'hidden_dim_2': 512, 'kl_weight': 0.000810400083722951, 'lr': 0.0011459177213693325, 'batch_size': 32, 'dropout_rate': 0.40913294125367966, 'prior_mu': 0.022481945337857183, 'prior_sigma': 0.07577097513993586, 'normalization': 'none'}. Best is trial 1528 with value: 0.5170644640922546.
Generating morgan fingerprints...
Generated fingerprints with 2048 features for 900 molecules
Data shape: X=(900, 2048), y=(900,)
Trial 1675: 5-fold CV loss = 0.6054
[I 2025-08-08 01:39:22,009] Trial 1675 finished with value: 0.6054022192955018 and parameters: {'fp_type': 'morgan', 'morgan_only_radius': 2, 'morgan_only_nBits': 2048, 'num_hidden_layers': 3, 'hidden_dim_0': 512, 'hidden_dim_1': 128, 'hidden_dim_2': 512, 'kl_weight': 0.0008419053517096589, 'lr': 0.0015653110073747284, 'batch_size': 32, 'dropout_rate': 0.4060512319236504, 'prior_mu': 0.05036032608178198, 'prior_sigma': 0.0745665778795431, 'normalization': 'none'}. Best is trial 1528 with value: 0.5170644640922546.
Generating morgan_rdkit fingerprints...
Generated fingerprints with 768 features for 900 molecules
Data shape: X=(900, 768), y=(900,)
Trial 1673: 5-fold CV loss = 0.5537
[I 2025-08-08 01:39:39,939] Trial 1673 finished with value: 0.5536804258823395 and parameters: {'fp_type': 'morgan', 'morgan_only_radius': 2, 'morgan_only_nBits': 2048, 'num_hidden_layers': 3, 'hidden_dim_0': 256, 'hidden_dim_1': 128, 'hidden_dim_2': 512, 'kl_weight': 0.0008329381189894811, 'lr': 0.0018939968325357962, 'batch_size': 32, 'dropout_rate': 0.4007875238046833, 'prior_mu': 0.0472362309350035, 'prior_sigma': 0.0762847524881429, 'normalization': 'none'}. Best is trial 1528 with value: 0.5170644640922546.
Generating morgan_rdkit fingerprints...
Generated fingerprints with 768 features for 900 molecules
Data shape: X=(900, 768), y=(900,)
Trial 1678: 5-fold CV loss = 0.6857
[I 2025-08-08 01:39:52,267] Trial 1678 finished with value: 0.6856568634510041 and parameters: {'fp_type': 'morgan', 'morgan_only_radius': 2, 'morgan_only_nBits': 2048, 'num_hidden_layers': 3, 'hidden_dim_0': 512, 'hidden_dim_1': 128, 'hidden_dim_2': 512, 'kl_weight': 0.0004764188310467174, 'lr': 0.00153389613109158, 'batch_size': 32, 'dropout_rate': 0.41380912079236687, 'prior_mu': 0.04423234630736472, 'prior_sigma': 0.06916217607677021, 'normalization': 'none'}. Best is trial 1528 with value: 0.5170644640922546.
Generating morgan fingerprints...
Generated fingerprints with 2048 features for 900 molecules
Data shape: X=(900, 2048), y=(900,)
Trial 1680: 5-fold CV loss = 0.6738
[I 2025-08-08 01:40:33,355] Trial 1680 finished with value: 0.6738299131393433 and parameters: {'fp_type': 'morgan_rdkit', 'combined_morgan_radius': 2, 'combined_morgan_nBits': 512, 'combined_rdkit_maxPath': 7, 'combined_rdkit_nBits': 256, 'num_hidden_layers': 3, 'hidden_dim_0': 512, 'hidden_dim_1': 128, 'hidden_dim_2': 256, 'kl_weight': 0.0004855667251047975, 'lr': 0.000358646836860353, 'batch_size': 32, 'dropout_rate': 0.4164788009043941, 'prior_mu': 0.020152455007526625, 'prior_sigma': 0.06933817611752063, 'normalization': 'none'}. Best is trial 1528 with value: 0.5170644640922546.
Generating morgan fingerprints...
Generated fingerprints with 2048 features for 900 molecules
Data shape: X=(900, 2048), y=(900,)
Trial 1681: 5-fold CV loss = 0.6149
[I 2025-08-08 01:40:38,852] Trial 1681 finished with value: 0.6149128675460815 and parameters: {'fp_type': 'morgan', 'morgan_only_radius': 2, 'morgan_only_nBits': 2048, 'num_hidden_layers': 3, 'hidden_dim_0': 512, 'hidden_dim_1': 128, 'hidden_dim_2': 256, 'kl_weight': 0.0006008213071777177, 'lr': 0.0016720024997055364, 'batch_size': 32, 'dropout_rate': 0.38989457995617993, 'prior_mu': 0.02288821963390497, 'prior_sigma': 0.06847763641461589, 'normalization': 'none'}. Best is trial 1528 with value: 0.5170644640922546.
Generating morgan fingerprints...
Generated fingerprints with 2048 features for 900 molecules
Data shape: X=(900, 2048), y=(900,)
Trial 1679: 5-fold CV loss = 0.5902
[I 2025-08-08 01:40:39,744] Trial 1679 finished with value: 0.5901709079742432 and parameters: {'fp_type': 'morgan_rdkit', 'combined_morgan_radius': 2, 'combined_morgan_nBits': 512, 'combined_rdkit_maxPath': 7, 'combined_rdkit_nBits': 256, 'num_hidden_layers': 3, 'hidden_dim_0': 512, 'hidden_dim_1': 128, 'hidden_dim_2': 512, 'kl_weight': 0.00048730553622245256, 'lr': 0.0016525676975269632, 'batch_size': 32, 'dropout_rate': 0.41013721892075605, 'prior_mu': 0.039732833525252934, 'prior_sigma': 0.06859133149285987, 'normalization': 'none'}. Best is trial 1528 with value: 0.5170644640922546.
Generating morgan fingerprints...
Generated fingerprints with 2048 features for 900 molecules
Data shape: X=(900, 2048), y=(900,)
Trial 1683: 5-fold CV loss = 0.5799
[I 2025-08-08 01:41:38,443] Trial 1683 finished with value: 0.5799188196659089 and parameters: {'fp_type': 'morgan', 'morgan_only_radius': 2, 'morgan_only_nBits': 2048, 'num_hidden_layers': 3, 'hidden_dim_0': 512, 'hidden_dim_1': 128, 'hidden_dim_2': 512, 'kl_weight': 0.0007197143633799287, 'lr': 0.0019094898807955683, 'batch_size': 32, 'dropout_rate': 0.4222952982581065, 'prior_mu': 0.03989849780410285, 'prior_sigma': 0.06836919320645315, 'normalization': 'none'}. Best is trial 1528 with value: 0.5170644640922546.
Generating morgan fingerprints...
Generated fingerprints with 2048 features for 900 molecules
Data shape: X=(900, 2048), y=(900,)
Trial 1677: 5-fold CV loss = 0.6125
[I 2025-08-08 01:41:47,762] Trial 1677 finished with value: 0.6125455141067505 and parameters: {'fp_type': 'morgan_rdkit', 'combined_morgan_radius': 2, 'combined_morgan_nBits': 512, 'combined_rdkit_maxPath': 7, 'combined_rdkit_nBits': 256, 'num_hidden_layers': 3, 'hidden_dim_0': 512, 'hidden_dim_1': 128, 'hidden_dim_2': 512, 'kl_weight': 0.0004875974530098329, 'lr': 0.0015685607378577615, 'batch_size': 32, 'dropout_rate': 0.40408720663416325, 'prior_mu': 0.018846945032278795, 'prior_sigma': 0.07640461592871726, 'normalization': 'none'}. Best is trial 1528 with value: 0.5170644640922546.
Generating morgan fingerprints...
Generated fingerprints with 2048 features for 900 molecules
Data shape: X=(900, 2048), y=(900,)
Trial 1684: 5-fold CV loss = 0.5411
[I 2025-08-08 01:42:13,463] Trial 1684 finished with value: 0.5410769164562226 and parameters: {'fp_type': 'morgan', 'morgan_only_radius': 2, 'morgan_only_nBits': 2048, 'num_hidden_layers': 3, 'hidden_dim_0': 512, 'hidden_dim_1': 128, 'hidden_dim_2': 512, 'kl_weight': 0.0007135451705838807, 'lr': 0.0019468469327139563, 'batch_size': 32, 'dropout_rate': 0.4217961833007222, 'prior_mu': 0.029293830417992796, 'prior_sigma': 0.06735730247211028, 'normalization': 'none'}. Best is trial 1528 with value: 0.5170644640922546.
Generating morgan fingerprints...
Generated fingerprints with 2048 features for 900 molecules
Data shape: X=(900, 2048), y=(900,)
Trial 1682: 5-fold CV loss = 0.6411
[I 2025-08-08 01:42:45,481] Trial 1682 finished with value: 0.6410948395729065 and parameters: {'fp_type': 'morgan', 'morgan_only_radius': 2, 'morgan_only_nBits': 2048, 'num_hidden_layers': 3, 'hidden_dim_0': 512, 'hidden_dim_1': 128, 'hidden_dim_2': 512, 'kl_weight': 0.0006167280102049865, 'lr': 0.001692668736842777, 'batch_size': 32, 'dropout_rate': 0.39268011469312264, 'prior_mu': 0.02790896949378474, 'prior_sigma': 0.06833760476470478, 'normalization': 'none'}. Best is trial 1528 with value: 0.5170644640922546.
Generating morgan fingerprints...
Generated fingerprints with 2048 features for 900 molecules
Data shape: X=(900, 2048), y=(900,)
Trial 1685: 5-fold CV loss = 0.5242
[I 2025-08-08 01:42:55,910] Trial 1685 finished with value: 0.5242272675037384 and parameters: {'fp_type': 'morgan', 'morgan_only_radius': 2, 'morgan_only_nBits': 2048, 'num_hidden_layers': 3, 'hidden_dim_0': 512, 'hidden_dim_1': 128, 'hidden_dim_2': 512, 'kl_weight': 0.0006470796478704921, 'lr': 0.0019849111164481808, 'batch_size': 32, 'dropout_rate': 0.4102563787737275, 'prior_mu': 0.030183252182220885, 'prior_sigma': 0.07962766105831223, 'normalization': 'none'}. Best is trial 1528 with value: 0.5170644640922546.
Generating morgan fingerprints...
Generated fingerprints with 2048 features for 900 molecules
Data shape: X=(900, 2048), y=(900,)
Trial 1688: 5-fold CV loss = 0.7676
[I 2025-08-08 01:43:03,503] Trial 1688 finished with value: 0.7676027297973633 and parameters: {'fp_type': 'morgan', 'morgan_only_radius': 2, 'morgan_only_nBits': 2048, 'num_hidden_layers': 3, 'hidden_dim_0': 128, 'hidden_dim_1': 128, 'hidden_dim_2': 512, 'kl_weight': 0.0008348013030609194, 'lr': 0.0019829851509806607, 'batch_size': 128, 'dropout_rate': 0.42495722877205544, 'prior_mu': 0.051494746094947204, 'prior_sigma': 0.07980840033338454, 'normalization': 'none'}. Best is trial 1528 with value: 0.5170644640922546.
Generating morgan fingerprints...
Generated fingerprints with 2048 features for 900 molecules
Data shape: X=(900, 2048), y=(900,)
Trial 1687: 5-fold CV loss = 0.6798
[I 2025-08-08 01:43:07,472] Trial 1687 finished with value: 0.6797742724418641 and parameters: {'fp_type': 'morgan', 'morgan_only_radius': 2, 'morgan_only_nBits': 2048, 'num_hidden_layers': 3, 'hidden_dim_0': 512, 'hidden_dim_1': 128, 'hidden_dim_2': 128, 'kl_weight': 0.0006159323511165788, 'lr': 0.0019921145259138525, 'batch_size': 32, 'dropout_rate': 0.4217587759613587, 'prior_mu': 0.05184030399302372, 'prior_sigma': 0.07144418745509738, 'normalization': 'none'}. Best is trial 1528 with value: 0.5170644640922546.
Generating morgan fingerprints...
Generated fingerprints with 2048 features for 900 molecules
Data shape: X=(900, 2048), y=(900,)
Trial 1689: 5-fold CV loss = 0.7758
[I 2025-08-08 01:43:08,528] Trial 1689 finished with value: 0.7757752537727356 and parameters: {'fp_type': 'morgan', 'morgan_only_radius': 2, 'morgan_only_nBits': 2048, 'num_hidden_layers': 3, 'hidden_dim_0': 128, 'hidden_dim_1': 128, 'hidden_dim_2': 512, 'kl_weight': 0.0008301214221039415, 'lr': 0.0019877467270462586, 'batch_size': 128, 'dropout_rate': 0.42615213694765675, 'prior_mu': 0.0537629162070184, 'prior_sigma': 0.07301399074966175, 'normalization': 'none'}. Best is trial 1528 with value: 0.5170644640922546.
Generating morgan fingerprints...
Generated fingerprints with 2048 features for 900 molecules
Data shape: X=(900, 2048), y=(900,)
Trial 1691: 5-fold CV loss = 0.6310
[I 2025-08-08 01:44:17,927] Trial 1691 finished with value: 0.6310024619102478 and parameters: {'fp_type': 'morgan', 'morgan_only_radius': 2, 'morgan_only_nBits': 2048, 'num_hidden_layers': 3, 'hidden_dim_0': 512, 'hidden_dim_1': 128, 'hidden_dim_2': 512, 'kl_weight': 0.0007370071903303215, 'lr': 0.0017687290743468563, 'batch_size': 32, 'dropout_rate': 0.4297556658371629, 'prior_mu': 0.038165341558796154, 'prior_sigma': 0.074086735435338, 'normalization': 'none'}. Best is trial 1528 with value: 0.5170644640922546.
Generating rdkit fingerprints...
Generated fingerprints with 256 features for 900 molecules
Data shape: X=(900, 256), y=(900,)
Trial 1692: 5-fold CV loss = 0.5188
[I 2025-08-08 01:44:25,917] Trial 1692 finished with value: 0.5187715291976929 and parameters: {'fp_type': 'morgan', 'morgan_only_radius': 2, 'morgan_only_nBits': 2048, 'num_hidden_layers': 3, 'hidden_dim_0': 512, 'hidden_dim_1': 128, 'hidden_dim_2': 512, 'kl_weight': 0.0007358176409944587, 'lr': 0.0018234679643549085, 'batch_size': 32, 'dropout_rate': 0.4295303401911895, 'prior_mu': 0.04127896369139151, 'prior_sigma': 0.06707722034841819, 'normalization': 'none'}. Best is trial 1528 with value: 0.5170644640922546.
Generating rdkit fingerprints...
Generated fingerprints with 256 features for 900 molecules
Data shape: X=(900, 256), y=(900,)
Trial 1690: 5-fold CV loss = 0.6434
[I 2025-08-08 01:44:28,054] Trial 1690 finished with value: 0.6434372901916504 and parameters: {'fp_type': 'morgan', 'morgan_only_radius': 2, 'morgan_only_nBits': 2048, 'num_hidden_layers': 3, 'hidden_dim_0': 512, 'hidden_dim_1': 128, 'hidden_dim_2': 128, 'kl_weight': 0.0007622267473908777, 'lr': 0.0017740030387352623, 'batch_size': 32, 'dropout_rate': 0.41969691178909296, 'prior_mu': 0.05378414487277586, 'prior_sigma': 0.07332573155744648, 'normalization': 'none'}. Best is trial 1528 with value: 0.5170644640922546.
Generating rdkit fingerprints...
Generated fingerprints with 256 features for 900 molecules
Data shape: X=(900, 256), y=(900,)
Trial 1693: 5-fold CV loss = 0.6578
[I 2025-08-08 01:44:42,541] Trial 1693 finished with value: 0.6578277945518494 and parameters: {'fp_type': 'rdkit', 'rdkit_only_maxPath': 5, 'rdkit_only_nBits': 256, 'num_hidden_layers': 0, 'kl_weight': 0.0005319008102928694, 'lr': 0.0017913348331729457, 'batch_size': 32, 'dropout_rate': 0.4180298576161537, 'prior_mu': 0.04139781212160769, 'prior_sigma': 0.06645035499988708, 'normalization': 'none'}. Best is trial 1528 with value: 0.5170644640922546.
Generating morgan fingerprints...
Generated fingerprints with 2048 features for 900 molecules
Data shape: X=(900, 2048), y=(900,)
Trial 1694: 5-fold CV loss = 0.6331
[I 2025-08-08 01:45:07,742] Trial 1694 finished with value: 0.6331095218658447 and parameters: {'fp_type': 'rdkit', 'rdkit_only_maxPath': 5, 'rdkit_only_nBits': 256, 'num_hidden_layers': 3, 'hidden_dim_0': 512, 'hidden_dim_1': 128, 'hidden_dim_2': 512, 'kl_weight': 0.0008620829295096725, 'lr': 0.001882874977758542, 'batch_size': 32, 'dropout_rate': 0.4161785894624844, 'prior_mu': 0.035710770698705485, 'prior_sigma': 0.06613793133328486, 'normalization': 'none'}. Best is trial 1528 with value: 0.5170644640922546.
Generating morgan fingerprints...
Generated fingerprints with 2048 features for 900 molecules
Data shape: X=(900, 2048), y=(900,)
Trial 1695: 5-fold CV loss = 0.6318
[I 2025-08-08 01:45:39,198] Trial 1695 finished with value: 0.6318114280700684 and parameters: {'fp_type': 'rdkit', 'rdkit_only_maxPath': 5, 'rdkit_only_nBits': 256, 'num_hidden_layers': 3, 'hidden_dim_0': 512, 'hidden_dim_1': 128, 'hidden_dim_2': 512, 'kl_weight': 0.0005574046345050778, 'lr': 0.0018809224427536611, 'batch_size': 32, 'dropout_rate': 0.4330287484746221, 'prior_mu': 0.03305433271605337, 'prior_sigma': 0.06632803255852761, 'normalization': 'none'}. Best is trial 1528 with value: 0.5170644640922546.
Generating morgan fingerprints...
Generated fingerprints with 2048 features for 900 molecules
Data shape: X=(900, 2048), y=(900,)
Trial 1697: 5-fold CV loss = 0.7406
[I 2025-08-08 01:45:40,822] Trial 1697 finished with value: 0.7405930280685424 and parameters: {'fp_type': 'morgan', 'morgan_only_radius': 2, 'morgan_only_nBits': 2048, 'num_hidden_layers': 3, 'hidden_dim_0': 512, 'hidden_dim_1': 512, 'hidden_dim_2': 512, 'kl_weight': 0.0007062530792782449, 'lr': 0.002098514969088704, 'batch_size': 32, 'dropout_rate': 0.42830845307787824, 'prior_mu': 0.031277417064302725, 'prior_sigma': 0.06526365400547095, 'normalization': 'none'}. Best is trial 1528 with value: 0.5170644640922546.
Generating morgan fingerprints...
Generated fingerprints with 2048 features for 900 molecules
Data shape: X=(900, 2048), y=(900,)
Trial 1686: 5-fold CV loss = 0.5742
[I 2025-08-08 01:45:50,794] Trial 1686 finished with value: 0.5741678416728974 and parameters: {'fp_type': 'morgan', 'morgan_only_radius': 2, 'morgan_only_nBits': 2048, 'num_hidden_layers': 3, 'hidden_dim_0': 512, 'hidden_dim_1': 128, 'hidden_dim_2': 512, 'kl_weight': 0.0006033823708255197, 'lr': 0.0019435515034836727, 'batch_size': 32, 'dropout_rate': 0.4282018683520641, 'prior_mu': 0.030758918525697482, 'prior_sigma': 0.06716375428625933, 'normalization': 'none'}. Best is trial 1528 with value: 0.5170644640922546.
Generating morgan fingerprints...
Generated fingerprints with 2048 features for 900 molecules
Data shape: X=(900, 2048), y=(900,)
Trial 1696: 5-fold CV loss = 0.5386
[I 2025-08-08 01:46:09,437] Trial 1696 finished with value: 0.5385910749435425 and parameters: {'fp_type': 'morgan', 'morgan_only_radius': 2, 'morgan_only_nBits': 2048, 'num_hidden_layers': 3, 'hidden_dim_0': 512, 'hidden_dim_1': 128, 'hidden_dim_2': 512, 'kl_weight': 0.0008544427832965368, 'lr': 0.0020105511584787485, 'batch_size': 32, 'dropout_rate': 0.4284174092304998, 'prior_mu': 0.03308653633956068, 'prior_sigma': 0.06665350387378458, 'normalization': 'none'}. Best is trial 1528 with value: 0.5170644640922546.
Generating morgan fingerprints...
Generated fingerprints with 2048 features for 900 molecules
Data shape: X=(900, 2048), y=(900,)
Trial 1701: 5-fold CV loss = 0.7185
