[I 2025-08-07 16:09:01,283] Trial 32 finished with value: 0.6615968346595764 and parameters: {'fp_type': 'morgan_rdkit', 'combined_morgan_radius': 2, 'combined_morgan_nBits': 1024, 'combined_rdkit_maxPath': 5, 'combined_rdkit_nBits': 1024, 'num_hidden_layers': 0, 'kl_weight': 0.00012826134722222285, 'lr': 0.0021998886336116203, 'batch_size': 128, 'dropout_rate': 0.3281916694981612, 'prior_mu': 0.15157664897900522, 'prior_sigma': 0.03719074508243059, 'normalization': 'none'}. Best is trial 30 with value: 0.5358302295207977.
Generating morgan_rdkit fingerprints...
Generated fingerprints with 2048 features for 900 molecules
Data shape: X=(900, 2048), y=(900,)
Trial 33: 5-fold CV loss = 0.7014
[I 2025-08-07 16:09:05,240] Trial 33 finished with value: 0.7013508319854737 and parameters: {'fp_type': 'morgan_rdkit', 'combined_morgan_radius': 2, 'combined_morgan_nBits': 1024, 'combined_rdkit_maxPath': 5, 'combined_rdkit_nBits': 256, 'num_hidden_layers': 0, 'kl_weight': 0.00010134846154105854, 'lr': 0.001978226297545844, 'batch_size': 128, 'dropout_rate': 0.342342265334333, 'prior_mu': 0.15068342428982515, 'prior_sigma': 0.0809363673618122, 'normalization': 'none'}. Best is trial 30 with value: 0.5358302295207977.
Generating morgan_rdkit fingerprints...
Generated fingerprints with 2048 features for 900 molecules
Data shape: X=(900, 2048), y=(900,)
Trial 29: 5-fold CV loss = 0.5638
[I 2025-08-07 16:09:10,104] Trial 29 finished with value: 0.5637950420379638 and parameters: {'fp_type': 'morgan_rdkit', 'combined_morgan_radius': 2, 'combined_morgan_nBits': 1024, 'combined_rdkit_maxPath': 5, 'combined_rdkit_nBits': 1024, 'num_hidden_layers': 3, 'hidden_dim_0': 512, 'hidden_dim_1': 64, 'hidden_dim_2': 256, 'kl_weight': 0.00010803392146870826, 'lr': 0.006130427249971914, 'batch_size': 128, 'dropout_rate': 0.32196443500667193, 'prior_mu': 0.1401146440632892, 'prior_sigma': 0.03853340183317144, 'normalization': 'none'}. Best is trial 30 with value: 0.5358302295207977.
Generating morgan_rdkit fingerprints...
Generated fingerprints with 2048 features for 900 molecules
Data shape: X=(900, 2048), y=(900,)
Trial 31: 5-fold CV loss = 0.5587
[I 2025-08-07 16:09:22,371] Trial 31 finished with value: 0.5586966037750244 and parameters: {'fp_type': 'morgan_rdkit', 'combined_morgan_radius': 2, 'combined_morgan_nBits': 1024, 'combined_rdkit_maxPath': 5, 'combined_rdkit_nBits': 1024, 'num_hidden_layers': 3, 'hidden_dim_0': 512, 'hidden_dim_1': 128, 'hidden_dim_2': 1024, 'kl_weight': 0.0002443348213233257, 'lr': 0.00196161621689037, 'batch_size': 128, 'dropout_rate': 0.3216765846180117, 'prior_mu': 0.14032977352055945, 'prior_sigma': 0.030867125291979748, 'normalization': 'none'}. Best is trial 30 with value: 0.5358302295207977.
Generating morgan_rdkit fingerprints...
Generated fingerprints with 2048 features for 900 molecules
Data shape: X=(900, 2048), y=(900,)
Trial 35: 5-fold CV loss = 0.5588
[I 2025-08-07 16:09:23,668] Trial 35 finished with value: 0.5587964355945587 and parameters: {'fp_type': 'morgan_rdkit', 'combined_morgan_radius': 2, 'combined_morgan_nBits': 1024, 'combined_rdkit_maxPath': 5, 'combined_rdkit_nBits': 1024, 'num_hidden_layers': 3, 'hidden_dim_0': 512, 'hidden_dim_1': 128, 'hidden_dim_2': 256, 'kl_weight': 0.00023037705996574592, 'lr': 0.00695962797845029, 'batch_size': 128, 'dropout_rate': 0.2963487603910907, 'prior_mu': 0.12721691182543063, 'prior_sigma': 0.02692586347816768, 'normalization': 'none'}. Best is trial 30 with value: 0.5358302295207977.
Generating morgan_rdkit fingerprints...
Generated fingerprints with 2048 features for 900 molecules
Data shape: X=(900, 2048), y=(900,)
Trial 34: 5-fold CV loss = 0.5372
[I 2025-08-07 16:09:44,480] Trial 34 finished with value: 0.5371826648712158 and parameters: {'fp_type': 'morgan_rdkit', 'combined_morgan_radius': 2, 'combined_morgan_nBits': 1024, 'combined_rdkit_maxPath': 5, 'combined_rdkit_nBits': 1024, 'num_hidden_layers': 3, 'hidden_dim_0': 512, 'hidden_dim_1': 128, 'hidden_dim_2': 256, 'kl_weight': 0.00023432555403647706, 'lr': 0.006794036487292491, 'batch_size': 128, 'dropout_rate': 0.3175788638101497, 'prior_mu': 0.1371687344881824, 'prior_sigma': 0.08018251192274584, 'normalization': 'none'}. Best is trial 30 with value: 0.5358302295207977.
Generating morgan_rdkit fingerprints...
Generated fingerprints with 2048 features for 900 molecules
Data shape: X=(900, 2048), y=(900,)
Trial 38: 5-fold CV loss = 0.5784
[I 2025-08-07 16:09:45,659] Trial 38 finished with value: 0.5784442603588105 and parameters: {'fp_type': 'morgan_rdkit', 'combined_morgan_radius': 2, 'combined_morgan_nBits': 1024, 'combined_rdkit_maxPath': 7, 'combined_rdkit_nBits': 1024, 'num_hidden_layers': 3, 'hidden_dim_0': 64, 'hidden_dim_1': 512, 'hidden_dim_2': 256, 'kl_weight': 0.0005705262391119626, 'lr': 0.003358014059274002, 'batch_size': 128, 'dropout_rate': 0.43977948175199033, 'prior_mu': 0.08062987282630679, 'prior_sigma': 0.05091820349190098, 'normalization': 'none'}. Best is trial 30 with value: 0.5358302295207977.
Generating morgan_rdkit fingerprints...
Generated fingerprints with 2048 features for 900 molecules
Data shape: X=(900, 2048), y=(900,)
Trial 36: 5-fold CV loss = 0.5617
[I 2025-08-07 16:09:54,645] Trial 36 finished with value: 0.5616581380367279 and parameters: {'fp_type': 'morgan_rdkit', 'combined_morgan_radius': 2, 'combined_morgan_nBits': 1024, 'combined_rdkit_maxPath': 5, 'combined_rdkit_nBits': 1024, 'num_hidden_layers': 3, 'hidden_dim_0': 512, 'hidden_dim_1': 128, 'hidden_dim_2': 1024, 'kl_weight': 0.00023175735240394736, 'lr': 0.007905391199308819, 'batch_size': 128, 'dropout_rate': 0.30203404506294745, 'prior_mu': 0.12169991667875533, 'prior_sigma': 0.02553765515406016, 'normalization': 'none'}. Best is trial 30 with value: 0.5358302295207977.
Generating morgan_rdkit fingerprints...
Generated fingerprints with 1280 features for 900 molecules
Data shape: X=(900, 1280), y=(900,)
Trial 37: 5-fold CV loss = 0.5517
[I 2025-08-07 16:09:59,891] Trial 37 finished with value: 0.5517326056957245 and parameters: {'fp_type': 'morgan_rdkit', 'combined_morgan_radius': 2, 'combined_morgan_nBits': 1024, 'combined_rdkit_maxPath': 5, 'combined_rdkit_nBits': 1024, 'num_hidden_layers': 3, 'hidden_dim_0': 64, 'hidden_dim_1': 128, 'hidden_dim_2': 256, 'kl_weight': 0.0004712966752777403, 'lr': 0.007133886722932585, 'batch_size': 128, 'dropout_rate': 0.44332952882065185, 'prior_mu': 0.07269646012701617, 'prior_sigma': 0.04930867467239756, 'normalization': 'none'}. Best is trial 30 with value: 0.5358302295207977.
Generating morgan_rdkit fingerprints...
Generated fingerprints with 1280 features for 900 molecules
Data shape: X=(900, 1280), y=(900,)
Trial 42: 5-fold CV loss = 0.8582
[I 2025-08-07 16:10:14,769] Trial 42 finished with value: 0.8581825852394104 and parameters: {'fp_type': 'morgan_rdkit', 'combined_morgan_radius': 2, 'combined_morgan_nBits': 1024, 'combined_rdkit_maxPath': 8, 'combined_rdkit_nBits': 256, 'num_hidden_layers': 3, 'hidden_dim_0': 512, 'hidden_dim_1': 128, 'hidden_dim_2': 256, 'kl_weight': 0.0013767033437608875, 'lr': 0.003746831264109476, 'batch_size': 128, 'dropout_rate': 0.3576024468001787, 'prior_mu': 0.17130056613951572, 'prior_sigma': 0.1081089974709508, 'normalization': 'none'}. Best is trial 30 with value: 0.5358302295207977.
Generating morgan_rdkit fingerprints...
Generated fingerprints with 2048 features for 900 molecules
Data shape: X=(900, 2048), y=(900,)
Trial 39: 5-fold CV loss = 0.6094
[I 2025-08-07 16:10:15,848] Trial 39 finished with value: 0.6093703269958496 and parameters: {'fp_type': 'morgan_rdkit', 'combined_morgan_radius': 2, 'combined_morgan_nBits': 1024, 'combined_rdkit_maxPath': 7, 'combined_rdkit_nBits': 1024, 'num_hidden_layers': 3, 'hidden_dim_0': 64, 'hidden_dim_1': 128, 'hidden_dim_2': 256, 'kl_weight': 0.000559733642305247, 'lr': 0.003545626969862996, 'batch_size': 128, 'dropout_rate': 0.4356265430868853, 'prior_mu': 0.16825584889647432, 'prior_sigma': 0.08075511955999636, 'normalization': 'none'}. Best is trial 30 with value: 0.5358302295207977.
Generating morgan_rdkit fingerprints...
Generated fingerprints with 2048 features for 900 molecules
Data shape: X=(900, 2048), y=(900,)
Trial 40: 5-fold CV loss = 0.5826
[I 2025-08-07 16:10:26,297] Trial 40 finished with value: 0.5826369166374207 and parameters: {'fp_type': 'morgan_rdkit', 'combined_morgan_radius': 2, 'combined_morgan_nBits': 1024, 'combined_rdkit_maxPath': 8, 'combined_rdkit_nBits': 1024, 'num_hidden_layers': 3, 'hidden_dim_0': 512, 'hidden_dim_1': 128, 'hidden_dim_2': 256, 'kl_weight': 0.0005990432282045014, 'lr': 0.007520060738340993, 'batch_size': 128, 'dropout_rate': 0.2256838511132171, 'prior_mu': 0.07285445126850026, 'prior_sigma': 0.10723985525097385, 'normalization': 'none'}. Best is trial 30 with value: 0.5358302295207977.
Generating morgan_rdkit fingerprints...
Generated fingerprints with 2048 features for 900 molecules
Data shape: X=(900, 2048), y=(900,)
Trial 41: 5-fold CV loss = 0.6087
[I 2025-08-07 16:10:35,371] Trial 41 finished with value: 0.6087458610534668 and parameters: {'fp_type': 'morgan_rdkit', 'combined_morgan_radius': 2, 'combined_morgan_nBits': 1024, 'combined_rdkit_maxPath': 8, 'combined_rdkit_nBits': 256, 'num_hidden_layers': 3, 'hidden_dim_0': 512, 'hidden_dim_1': 128, 'hidden_dim_2': 256, 'kl_weight': 0.0005840699456537372, 'lr': 0.0035554573017149683, 'batch_size': 128, 'dropout_rate': 0.3544130704963511, 'prior_mu': 0.18265259618378998, 'prior_sigma': 0.0806131110108813, 'normalization': 'none'}. Best is trial 30 with value: 0.5358302295207977.
Generating morgan_rdkit fingerprints...
Generated fingerprints with 2048 features for 900 molecules
Data shape: X=(900, 2048), y=(900,)
Trial 44: 5-fold CV loss = 0.5935
[I 2025-08-07 16:10:55,750] Trial 44 finished with value: 0.593547809123993 and parameters: {'fp_type': 'morgan_rdkit', 'combined_morgan_radius': 2, 'combined_morgan_nBits': 1024, 'combined_rdkit_maxPath': 5, 'combined_rdkit_nBits': 1024, 'num_hidden_layers': 3, 'hidden_dim_0': 512, 'hidden_dim_1': 1024, 'hidden_dim_2': 256, 'kl_weight': 0.00018046937758896514, 'lr': 0.005068767829891956, 'batch_size': 128, 'dropout_rate': 0.26545552012812695, 'prior_mu': 0.10434750052530381, 'prior_sigma': 0.07987715657957388, 'normalization': 'none'}. Best is trial 30 with value: 0.5358302295207977.
Generating morgan_rdkit fingerprints...
Generated fingerprints with 2048 features for 900 molecules
Data shape: X=(900, 2048), y=(900,)
Trial 45: 5-fold CV loss = 0.5925
[I 2025-08-07 16:10:56,507] Trial 45 finished with value: 0.5924667954444885 and parameters: {'fp_type': 'morgan_rdkit', 'combined_morgan_radius': 2, 'combined_morgan_nBits': 1024, 'combined_rdkit_maxPath': 5, 'combined_rdkit_nBits': 1024, 'num_hidden_layers': 3, 'hidden_dim_0': 512, 'hidden_dim_1': 1024, 'hidden_dim_2': 256, 'kl_weight': 0.00016020831499139162, 'lr': 0.004904039687971106, 'batch_size': 128, 'dropout_rate': 0.2720273414916696, 'prior_mu': 0.11121478103215506, 'prior_sigma': 0.08205092096011617, 'normalization': 'none'}. Best is trial 30 with value: 0.5358302295207977.
Generating morgan fingerprints...
Generated fingerprints with 1024 features for 900 molecules
Data shape: X=(900, 1024), y=(900,)
Trial 43: 5-fold CV loss = 0.6511
[I 2025-08-07 16:11:13,154] Trial 43 finished with value: 0.6510778605937958 and parameters: {'fp_type': 'morgan_rdkit', 'combined_morgan_radius': 2, 'combined_morgan_nBits': 1024, 'combined_rdkit_maxPath': 5, 'combined_rdkit_nBits': 1024, 'num_hidden_layers': 2, 'hidden_dim_0': 256, 'hidden_dim_1': 1024, 'kl_weight': 0.0052406225339629575, 'lr': 0.0009838944685062005, 'batch_size': 64, 'dropout_rate': 0.23280878381141681, 'prior_mu': 0.10381031318413347, 'prior_sigma': 0.07629986044763583, 'normalization': 'none'}. Best is trial 30 with value: 0.5358302295207977.
Generating morgan fingerprints...
Generated fingerprints with 1024 features for 900 molecules
Data shape: X=(900, 1024), y=(900,)
Trial 48: 5-fold CV loss = 0.6515
[I 2025-08-07 16:11:25,607] Trial 48 finished with value: 0.6514709532260895 and parameters: {'fp_type': 'morgan', 'morgan_only_radius': 2, 'morgan_only_nBits': 1024, 'num_hidden_layers': 2, 'hidden_dim_0': 256, 'hidden_dim_1': 512, 'kl_weight': 0.0002993609387744087, 'lr': 0.000936328629562021, 'batch_size': 64, 'dropout_rate': 0.2302056769004696, 'prior_mu': 0.19802125836082995, 'prior_sigma': 0.09971122189512241, 'normalization': 'layer'}. Best is trial 30 with value: 0.5358302295207977.
Generating morgan_rdkit fingerprints...
Generated fingerprints with 2048 features for 900 molecules
Data shape: X=(900, 2048), y=(900,)
Trial 47: 5-fold CV loss = 0.6721
[I 2025-08-07 16:11:31,263] Trial 47 finished with value: 0.6720846652984619 and parameters: {'fp_type': 'morgan_rdkit', 'combined_morgan_radius': 2, 'combined_morgan_nBits': 1024, 'combined_rdkit_maxPath': 5, 'combined_rdkit_nBits': 1024, 'num_hidden_layers': 3, 'hidden_dim_0': 128, 'hidden_dim_1': 1024, 'hidden_dim_2': 64, 'kl_weight': 0.006039315892252267, 'lr': 0.0010207879727104111, 'batch_size': 64, 'dropout_rate': 0.26683290219386185, 'prior_mu': 0.12378417930564663, 'prior_sigma': 0.09873269763856916, 'normalization': 'layer'}. Best is trial 30 with value: 0.5358302295207977.
Generating morgan_rdkit fingerprints...
Generated fingerprints with 2048 features for 900 molecules
Data shape: X=(900, 2048), y=(900,)
Trial 50: 5-fold CV loss = 0.6760
[I 2025-08-07 16:11:37,297] Trial 50 finished with value: 0.6760439872741699 and parameters: {'fp_type': 'morgan_rdkit', 'combined_morgan_radius': 2, 'combined_morgan_nBits': 1024, 'combined_rdkit_maxPath': 5, 'combined_rdkit_nBits': 1024, 'num_hidden_layers': 3, 'hidden_dim_0': 128, 'hidden_dim_1': 64, 'hidden_dim_2': 512, 'kl_weight': 0.0004091049083828954, 'lr': 0.009961464505219, 'batch_size': 128, 'dropout_rate': 0.2959736801019685, 'prior_mu': 0.130818384518663, 'prior_sigma': 0.05649832514469586, 'normalization': 'layer'}. Best is trial 30 with value: 0.5358302295207977.
Generating morgan fingerprints...
Generated fingerprints with 2048 features for 900 molecules
Data shape: X=(900, 2048), y=(900,)
Trial 49: 5-fold CV loss = 0.5475
[I 2025-08-07 16:11:44,303] Trial 49 finished with value: 0.547488933801651 and parameters: {'fp_type': 'morgan', 'morgan_only_radius': 2, 'morgan_only_nBits': 1024, 'num_hidden_layers': 3, 'hidden_dim_0': 128, 'hidden_dim_1': 512, 'hidden_dim_2': 512, 'kl_weight': 0.00033003129968912453, 'lr': 0.006229628454437586, 'batch_size': 64, 'dropout_rate': 0.3102381648668565, 'prior_mu': 0.1315154405871422, 'prior_sigma': 0.0515351401637143, 'normalization': 'layer'}. Best is trial 30 with value: 0.5358302295207977.
Generating morgan_rdkit fingerprints...
Generated fingerprints with 2048 features for 900 molecules
Data shape: X=(900, 2048), y=(900,)
Trial 52: 5-fold CV loss = 0.7321
[I 2025-08-07 16:11:47,236] Trial 52 finished with value: 0.7321053504943847 and parameters: {'fp_type': 'morgan', 'morgan_only_radius': 2, 'morgan_only_nBits': 2048, 'num_hidden_layers': 3, 'hidden_dim_0': 512, 'hidden_dim_1': 512, 'hidden_dim_2': 256, 'kl_weight': 0.0007872361115009986, 'lr': 0.006236170533793705, 'batch_size': 128, 'dropout_rate': 0.4160278357863498, 'prior_mu': 0.1596090474271577, 'prior_sigma': 0.012386820486361007, 'normalization': 'none'}. Best is trial 30 with value: 0.5358302295207977.
Generating morgan_rdkit fingerprints...
Generated fingerprints with 2048 features for 900 molecules
Data shape: X=(900, 2048), y=(900,)
Trial 53: 5-fold CV loss = 0.9065
[I 2025-08-07 16:11:59,641] Trial 53 finished with value: 0.9065318584442139 and parameters: {'fp_type': 'morgan_rdkit', 'combined_morgan_radius': 2, 'combined_morgan_nBits': 1024, 'combined_rdkit_maxPath': 5, 'combined_rdkit_nBits': 1024, 'num_hidden_layers': 2, 'hidden_dim_0': 512, 'hidden_dim_1': 64, 'kl_weight': 0.0007700168845716745, 'lr': 0.000125226836063329, 'batch_size': 128, 'dropout_rate': 0.33911769258488633, 'prior_mu': -0.05757980069130629, 'prior_sigma': 0.08960125762735624, 'normalization': 'none'}. Best is trial 30 with value: 0.5358302295207977.
Generating morgan_rdkit fingerprints...
Generated fingerprints with 1536 features for 900 molecules
Data shape: X=(900, 1536), y=(900,)
Trial 51: 5-fold CV loss = 0.5488
[I 2025-08-07 16:12:02,935] Trial 51 finished with value: 0.5487549722194671 and parameters: {'fp_type': 'morgan_rdkit', 'combined_morgan_radius': 2, 'combined_morgan_nBits': 1024, 'combined_rdkit_maxPath': 5, 'combined_rdkit_nBits': 1024, 'num_hidden_layers': 3, 'hidden_dim_0': 512, 'hidden_dim_1': 64, 'hidden_dim_2': 256, 'kl_weight': 0.00041267865288022713, 'lr': 0.009944572642220748, 'batch_size': 128, 'dropout_rate': 0.3049608435735884, 'prior_mu': 0.16381067716437347, 'prior_sigma': 0.05801838221029418, 'normalization': 'none'}. Best is trial 30 with value: 0.5358302295207977.
Generating morgan_rdkit fingerprints...
Generated fingerprints with 1536 features for 900 molecules
Data shape: X=(900, 1536), y=(900,)
Trial 54: 5-fold CV loss = 0.5434
[I 2025-08-07 16:12:13,098] Trial 54 finished with value: 0.5434252917766571 and parameters: {'fp_type': 'morgan_rdkit', 'combined_morgan_radius': 2, 'combined_morgan_nBits': 1024, 'combined_rdkit_maxPath': 5, 'combined_rdkit_nBits': 1024, 'num_hidden_layers': 3, 'hidden_dim_0': 512, 'hidden_dim_1': 64, 'hidden_dim_2': 256, 'kl_weight': 0.0002570187329560461, 'lr': 0.007906097724750339, 'batch_size': 128, 'dropout_rate': 0.40452720375059437, 'prior_mu': 0.09002225656141451, 'prior_sigma': 0.0890977155622203, 'normalization': 'none'}. Best is trial 30 with value: 0.5358302295207977.
Generating morgan_rdkit fingerprints...
Generated fingerprints with 1536 features for 900 molecules
Data shape: X=(900, 1536), y=(900,)
Trial 55: 5-fold CV loss = 0.5999
[I 2025-08-07 16:12:20,956] Trial 55 finished with value: 0.5998953104019165 and parameters: {'fp_type': 'morgan_rdkit', 'combined_morgan_radius': 2, 'combined_morgan_nBits': 1024, 'combined_rdkit_maxPath': 5, 'combined_rdkit_nBits': 512, 'num_hidden_layers': 3, 'hidden_dim_0': 512, 'hidden_dim_1': 64, 'hidden_dim_2': 256, 'kl_weight': 0.000240897882171586, 'lr': 0.004307965378790327, 'batch_size': 128, 'dropout_rate': 0.468153727917098, 'prior_mu': 0.09597805693242972, 'prior_sigma': 0.07066079099782227, 'normalization': 'none'}. Best is trial 30 with value: 0.5358302295207977.
Generating morgan_rdkit fingerprints...
Generated fingerprints with 1536 features for 900 molecules
Data shape: X=(900, 1536), y=(900,)
Trial 57: 5-fold CV loss = 0.5496
[I 2025-08-07 16:12:40,474] Trial 57 finished with value: 0.549629020690918 and parameters: {'fp_type': 'morgan_rdkit', 'combined_morgan_radius': 2, 'combined_morgan_nBits': 1024, 'combined_rdkit_maxPath': 5, 'combined_rdkit_nBits': 512, 'num_hidden_layers': 3, 'hidden_dim_0': 512, 'hidden_dim_1': 64, 'hidden_dim_2': 256, 'kl_weight': 0.0001420496647003302, 'lr': 0.00813957213407735, 'batch_size': 128, 'dropout_rate': 0.45755909451995525, 'prior_mu': 0.09327608403629213, 'prior_sigma': 0.11632693118412772, 'normalization': 'none'}. Best is trial 30 with value: 0.5358302295207977.
Generating morgan_rdkit fingerprints...
Generated fingerprints with 1536 features for 900 molecules
Data shape: X=(900, 1536), y=(900,)
Trial 56: 5-fold CV loss = 0.5368
[I 2025-08-07 16:12:43,926] Trial 56 finished with value: 0.5367738366127014 and parameters: {'fp_type': 'morgan_rdkit', 'combined_morgan_radius': 2, 'combined_morgan_nBits': 1024, 'combined_rdkit_maxPath': 5, 'combined_rdkit_nBits': 512, 'num_hidden_layers': 3, 'hidden_dim_0': 512, 'hidden_dim_1': 64, 'hidden_dim_2': 256, 'kl_weight': 0.00024646240553304337, 'lr': 0.007976997939520131, 'batch_size': 128, 'dropout_rate': 0.47616960854074153, 'prior_mu': 0.09066003605170553, 'prior_sigma': 0.07209225210923109, 'normalization': 'none'}. Best is trial 30 with value: 0.5358302295207977.
Generating morgan_rdkit fingerprints...
Generated fingerprints with 1024 features for 900 molecules
Data shape: X=(900, 1024), y=(900,)
Trial 58: 5-fold CV loss = 0.5421
[I 2025-08-07 16:12:46,757] Trial 58 finished with value: 0.5421253263950347 and parameters: {'fp_type': 'morgan_rdkit', 'combined_morgan_radius': 2, 'combined_morgan_nBits': 1024, 'combined_rdkit_maxPath': 5, 'combined_rdkit_nBits': 512, 'num_hidden_layers': 3, 'hidden_dim_0': 512, 'hidden_dim_1': 64, 'hidden_dim_2': 256, 'kl_weight': 0.00015240528085106437, 'lr': 0.008182551900656778, 'batch_size': 128, 'dropout_rate': 0.3768476518723144, 'prior_mu': 0.05569464514427987, 'prior_sigma': 0.08788737498677447, 'normalization': 'none'}. Best is trial 30 with value: 0.5358302295207977.
Generating rdkit fingerprints...
Generated fingerprints with 256 features for 900 molecules
Data shape: X=(900, 256), y=(900,)
Trial 46: 5-fold CV loss = 0.5842
[I 2025-08-07 16:12:56,181] Trial 46 finished with value: 0.5841996967792511 and parameters: {'fp_type': 'morgan_rdkit', 'combined_morgan_radius': 2, 'combined_morgan_nBits': 1024, 'combined_rdkit_maxPath': 5, 'combined_rdkit_nBits': 1024, 'num_hidden_layers': 3, 'hidden_dim_0': 512, 'hidden_dim_1': 1024, 'hidden_dim_2': 512, 'kl_weight': 0.00016111021715447903, 'lr': 0.005123209369293516, 'batch_size': 64, 'dropout_rate': 0.26606617108789266, 'prior_mu': 0.10091995878285634, 'prior_sigma': 0.09903976591338524, 'normalization': 'none'}. Best is trial 30 with value: 0.5358302295207977.
Generating rdkit fingerprints...
Generated fingerprints with 256 features for 900 molecules
Data shape: X=(900, 256), y=(900,)
Trial 61: 5-fold CV loss = 0.7940
