[I 2025-08-08 00:27:18,443] Trial 1480 finished with value: 0.6650249361991882 and parameters: {'fp_type': 'morgan', 'morgan_only_radius': 2, 'morgan_only_nBits': 2048, 'num_hidden_layers': 3, 'hidden_dim_0': 512, 'hidden_dim_1': 128, 'hidden_dim_2': 512, 'kl_weight': 0.0008742948100008597, 'lr': 0.0014240413714497661, 'batch_size': 32, 'dropout_rate': 0.4570478280952722, 'prior_mu': 0.08858839679026884, 'prior_sigma': 0.0520263315465896, 'normalization': 'none'}. Best is trial 1400 with value: 0.5178181529045105.
Generating morgan fingerprints...
Generated fingerprints with 2048 features for 900 molecules
Data shape: X=(900, 2048), y=(900,)
Trial 1479: 5-fold CV loss = 0.5507
[I 2025-08-08 00:28:00,394] Trial 1479 finished with value: 0.550724858045578 and parameters: {'fp_type': 'morgan_rdkit', 'combined_morgan_radius': 3, 'combined_morgan_nBits': 512, 'combined_rdkit_maxPath': 7, 'combined_rdkit_nBits': 512, 'num_hidden_layers': 3, 'hidden_dim_0': 512, 'hidden_dim_1': 128, 'hidden_dim_2': 64, 'kl_weight': 0.0006139319371641017, 'lr': 0.0014314416815435242, 'batch_size': 32, 'dropout_rate': 0.4595755548272843, 'prior_mu': 0.09505871263597908, 'prior_sigma': 0.049257718755810816, 'normalization': 'none'}. Best is trial 1400 with value: 0.5178181529045105.
Generating morgan fingerprints...
Generated fingerprints with 2048 features for 900 molecules
Data shape: X=(900, 2048), y=(900,)
Trial 1482: 5-fold CV loss = 0.5503
[I 2025-08-08 00:28:28,829] Trial 1482 finished with value: 0.5503344595432281 and parameters: {'fp_type': 'morgan', 'morgan_only_radius': 2, 'morgan_only_nBits': 2048, 'num_hidden_layers': 3, 'hidden_dim_0': 512, 'hidden_dim_1': 128, 'hidden_dim_2': 512, 'kl_weight': 0.0006937188535803629, 'lr': 0.0018999123017551043, 'batch_size': 32, 'dropout_rate': 0.4593673745490395, 'prior_mu': 0.06011437356737234, 'prior_sigma': 0.057518413959914694, 'normalization': 'none'}. Best is trial 1400 with value: 0.5178181529045105.
Generating morgan fingerprints...
Generated fingerprints with 2048 features for 900 molecules
Data shape: X=(900, 2048), y=(900,)
Trial 1481: 5-fold CV loss = 0.5912
[I 2025-08-08 00:28:46,142] Trial 1481 finished with value: 0.5912362217903138 and parameters: {'fp_type': 'morgan_rdkit', 'combined_morgan_radius': 3, 'combined_morgan_nBits': 512, 'combined_rdkit_maxPath': 7, 'combined_rdkit_nBits': 512, 'num_hidden_layers': 3, 'hidden_dim_0': 512, 'hidden_dim_1': 128, 'hidden_dim_2': 512, 'kl_weight': 0.0008292065012385686, 'lr': 0.0018731379626938038, 'batch_size': 32, 'dropout_rate': 0.4579021641612755, 'prior_mu': 0.06038365797337266, 'prior_sigma': 0.05681528900824068, 'normalization': 'none'}. Best is trial 1400 with value: 0.5178181529045105.
Generating morgan fingerprints...
Generated fingerprints with 2048 features for 900 molecules
Data shape: X=(900, 2048), y=(900,)
Trial 1476: 5-fold CV loss = 0.6883
[I 2025-08-08 00:28:59,724] Trial 1476 finished with value: 0.6883244514465332 and parameters: {'fp_type': 'morgan', 'morgan_only_radius': 2, 'morgan_only_nBits': 2048, 'num_hidden_layers': 2, 'hidden_dim_0': 1024, 'hidden_dim_1': 128, 'kl_weight': 0.0008697823427933682, 'lr': 0.0014660400149044445, 'batch_size': 32, 'dropout_rate': 0.4405069804938115, 'prior_mu': 0.08056783362477873, 'prior_sigma': 0.04937487873670084, 'normalization': 'none'}. Best is trial 1400 with value: 0.5178181529045105.
Generating morgan fingerprints...
Generated fingerprints with 2048 features for 900 molecules
Data shape: X=(900, 2048), y=(900,)
Trial 1486: 5-fold CV loss = 0.7387
[I 2025-08-08 00:29:23,080] Trial 1486 finished with value: 0.7386988997459412 and parameters: {'fp_type': 'morgan', 'morgan_only_radius': 2, 'morgan_only_nBits': 2048, 'num_hidden_layers': 3, 'hidden_dim_0': 512, 'hidden_dim_1': 128, 'hidden_dim_2': 512, 'kl_weight': 0.0005469758020146357, 'lr': 0.0017139655634432957, 'batch_size': 128, 'dropout_rate': 0.46708831112312965, 'prior_mu': 0.04500366558154319, 'prior_sigma': 0.05670070788496961, 'normalization': 'none'}. Best is trial 1400 with value: 0.5178181529045105.
Generating morgan fingerprints...
Generated fingerprints with 2048 features for 900 molecules
Data shape: X=(900, 2048), y=(900,)
Trial 1484: 5-fold CV loss = 0.5954
[I 2025-08-08 00:29:37,478] Trial 1484 finished with value: 0.5953842639923096 and parameters: {'fp_type': 'morgan', 'morgan_only_radius': 2, 'morgan_only_nBits': 2048, 'num_hidden_layers': 3, 'hidden_dim_0': 512, 'hidden_dim_1': 128, 'hidden_dim_2': 512, 'kl_weight': 0.0008334752864217273, 'lr': 0.0016687669279022385, 'batch_size': 32, 'dropout_rate': 0.44715705019560714, 'prior_mu': 0.06097327791709247, 'prior_sigma': 0.05552631152982103, 'normalization': 'none'}. Best is trial 1400 with value: 0.5178181529045105.
Generating morgan fingerprints...
Generated fingerprints with 2048 features for 900 molecules
Data shape: X=(900, 2048), y=(900,)
Trial 1483: 5-fold CV loss = 0.5398
[I 2025-08-08 00:29:49,510] Trial 1483 finished with value: 0.5397870182991028 and parameters: {'fp_type': 'morgan', 'morgan_only_radius': 2, 'morgan_only_nBits': 2048, 'num_hidden_layers': 3, 'hidden_dim_0': 512, 'hidden_dim_1': 128, 'hidden_dim_2': 512, 'kl_weight': 0.0007512015115303162, 'lr': 0.0018351139245270807, 'batch_size': 32, 'dropout_rate': 0.4653664966835402, 'prior_mu': 0.05803417157091403, 'prior_sigma': 0.055594920316348204, 'normalization': 'none'}. Best is trial 1400 with value: 0.5178181529045105.
Generating morgan fingerprints...
Generated fingerprints with 2048 features for 900 molecules
Data shape: X=(900, 2048), y=(900,)
Trial 1488: 5-fold CV loss = 0.7365
[I 2025-08-08 00:29:55,844] Trial 1488 finished with value: 0.7364774227142334 and parameters: {'fp_type': 'morgan', 'morgan_only_radius': 2, 'morgan_only_nBits': 2048, 'num_hidden_layers': 1, 'hidden_dim_0': 512, 'kl_weight': 0.0004222826457247763, 'lr': 0.0019038631846722144, 'batch_size': 32, 'dropout_rate': 0.4656766581760971, 'prior_mu': 0.05416938244211874, 'prior_sigma': 0.06203838401254757, 'normalization': 'none'}. Best is trial 1400 with value: 0.5178181529045105.
Generating morgan fingerprints...
Generated fingerprints with 2048 features for 900 molecules
Data shape: X=(900, 2048), y=(900,)
Trial 1487: 5-fold CV loss = 0.7541
[I 2025-08-08 00:30:12,673] Trial 1487 finished with value: 0.7540774583816529 and parameters: {'fp_type': 'morgan', 'morgan_only_radius': 2, 'morgan_only_nBits': 2048, 'num_hidden_layers': 1, 'hidden_dim_0': 512, 'kl_weight': 0.00047525164941181484, 'lr': 0.0018960910240264299, 'batch_size': 32, 'dropout_rate': 0.45027998355614374, 'prior_mu': 0.054793685844528345, 'prior_sigma': 0.06111323216628303, 'normalization': 'none'}. Best is trial 1400 with value: 0.5178181529045105.
Generating morgan fingerprints...
Generated fingerprints with 2048 features for 900 molecules
Data shape: X=(900, 2048), y=(900,)
Trial 1489: 5-fold CV loss = 0.6597
[I 2025-08-08 00:30:42,798] Trial 1489 finished with value: 0.6596933960914612 and parameters: {'fp_type': 'morgan', 'morgan_only_radius': 2, 'morgan_only_nBits': 2048, 'num_hidden_layers': 3, 'hidden_dim_0': 64, 'hidden_dim_1': 128, 'hidden_dim_2': 512, 'kl_weight': 0.0010678484948487682, 'lr': 0.0018879492980792432, 'batch_size': 32, 'dropout_rate': 0.42133074050910135, 'prior_mu': 0.05243055308614926, 'prior_sigma': 0.14490307240552575, 'normalization': 'none'}. Best is trial 1400 with value: 0.5178181529045105.
Generating morgan fingerprints...
Generated fingerprints with 2048 features for 900 molecules
Data shape: X=(900, 2048), y=(900,)
Trial 1490: 5-fold CV loss = 0.5472
[I 2025-08-08 00:31:16,295] Trial 1490 finished with value: 0.5472156822681427 and parameters: {'fp_type': 'morgan', 'morgan_only_radius': 2, 'morgan_only_nBits': 2048, 'num_hidden_layers': 3, 'hidden_dim_0': 64, 'hidden_dim_1': 128, 'hidden_dim_2': 512, 'kl_weight': 0.0006484823607407387, 'lr': 0.002117391676228119, 'batch_size': 32, 'dropout_rate': 0.4513286724804515, 'prior_mu': 0.044626708820072275, 'prior_sigma': 0.060308574051133323, 'normalization': 'none'}. Best is trial 1400 with value: 0.5178181529045105.
Generating morgan fingerprints...
Generated fingerprints with 2048 features for 900 molecules
Data shape: X=(900, 2048), y=(900,)
Trial 1491: 5-fold CV loss = 0.6621
[I 2025-08-08 00:31:21,773] Trial 1491 finished with value: 0.6620693206787109 and parameters: {'fp_type': 'morgan', 'morgan_only_radius': 2, 'morgan_only_nBits': 2048, 'num_hidden_layers': 3, 'hidden_dim_0': 512, 'hidden_dim_1': 128, 'hidden_dim_2': 512, 'kl_weight': 0.0009689582930097251, 'lr': 0.002128698678143116, 'batch_size': 64, 'dropout_rate': 0.4239074449146839, 'prior_mu': 0.04507761708994987, 'prior_sigma': 0.061393854215106715, 'normalization': 'none'}. Best is trial 1400 with value: 0.5178181529045105.
Generating morgan fingerprints...
Generated fingerprints with 2048 features for 900 molecules
Data shape: X=(900, 2048), y=(900,)
Trial 1492: 5-fold CV loss = 0.5812
[I 2025-08-08 00:31:26,045] Trial 1492 finished with value: 0.5811676025390625 and parameters: {'fp_type': 'morgan', 'morgan_only_radius': 2, 'morgan_only_nBits': 2048, 'num_hidden_layers': 3, 'hidden_dim_0': 512, 'hidden_dim_1': 128, 'hidden_dim_2': 512, 'kl_weight': 0.0007337152222831751, 'lr': 0.0021658625635862837, 'batch_size': 64, 'dropout_rate': 0.38443184123071233, 'prior_mu': 0.044841974497580414, 'prior_sigma': 0.02400983527098105, 'normalization': 'none'}. Best is trial 1400 with value: 0.5178181529045105.
Generating morgan fingerprints...
Generated fingerprints with 2048 features for 900 molecules
Data shape: X=(900, 2048), y=(900,)
Trial 1493: 5-fold CV loss = 0.7853
[I 2025-08-08 00:31:33,452] Trial 1493 finished with value: 0.7853453755378723 and parameters: {'fp_type': 'morgan', 'morgan_only_radius': 2, 'morgan_only_nBits': 2048, 'num_hidden_layers': 3, 'hidden_dim_0': 512, 'hidden_dim_1': 128, 'hidden_dim_2': 512, 'kl_weight': 0.0010516855842156415, 'lr': 0.00022597451860391333, 'batch_size': 64, 'dropout_rate': 0.46891270879000774, 'prior_mu': 0.03483845073923473, 'prior_sigma': 0.06308895708608141, 'normalization': 'none'}. Best is trial 1400 with value: 0.5178181529045105.
Generating morgan fingerprints...
Generated fingerprints with 2048 features for 900 molecules
Data shape: X=(900, 2048), y=(900,)
Trial 1485: 5-fold CV loss = 0.5466
[I 2025-08-08 00:31:38,696] Trial 1485 finished with value: 0.5466215491294861 and parameters: {'fp_type': 'morgan', 'morgan_only_radius': 2, 'morgan_only_nBits': 2048, 'num_hidden_layers': 3, 'hidden_dim_0': 512, 'hidden_dim_1': 128, 'hidden_dim_2': 512, 'kl_weight': 0.0010405837197925295, 'lr': 0.001669746635583412, 'batch_size': 32, 'dropout_rate': 0.44705243627395214, 'prior_mu': 0.05422950098944742, 'prior_sigma': 0.05602660792608931, 'normalization': 'none'}. Best is trial 1400 with value: 0.5178181529045105.
Generating morgan fingerprints...
Generated fingerprints with 2048 features for 900 molecules
Data shape: X=(900, 2048), y=(900,)
Trial 1495: 5-fold CV loss = 0.5431
[I 2025-08-08 00:32:30,032] Trial 1495 finished with value: 0.5431351959705353 and parameters: {'fp_type': 'morgan', 'morgan_only_radius': 2, 'morgan_only_nBits': 2048, 'num_hidden_layers': 3, 'hidden_dim_0': 512, 'hidden_dim_1': 512, 'hidden_dim_2': 512, 'kl_weight': 0.0010505313304178313, 'lr': 0.0016417211913121593, 'batch_size': 32, 'dropout_rate': 0.46937200937680823, 'prior_mu': 0.06925352580794047, 'prior_sigma': 0.058729055475358664, 'normalization': 'layer'}. Best is trial 1400 with value: 0.5178181529045105.
Generating morgan fingerprints...
Generated fingerprints with 2048 features for 900 molecules
Data shape: X=(900, 2048), y=(900,)
Trial 1496: 5-fold CV loss = 0.5689
[I 2025-08-08 00:32:51,571] Trial 1496 finished with value: 0.5689167439937591 and parameters: {'fp_type': 'morgan', 'morgan_only_radius': 2, 'morgan_only_nBits': 2048, 'num_hidden_layers': 3, 'hidden_dim_0': 512, 'hidden_dim_1': 128, 'hidden_dim_2': 512, 'kl_weight': 0.0009265010746228882, 'lr': 0.0015942199375352602, 'batch_size': 32, 'dropout_rate': 0.4671084702778829, 'prior_mu': 0.06966591271395156, 'prior_sigma': 0.08896185416627, 'normalization': 'layer'}. Best is trial 1400 with value: 0.5178181529045105.
Generating morgan fingerprints...
Generated fingerprints with 2048 features for 900 molecules
Data shape: X=(900, 2048), y=(900,)
Trial 1497: 5-fold CV loss = 0.5478
[I 2025-08-08 00:33:21,534] Trial 1497 finished with value: 0.5478266716003418 and parameters: {'fp_type': 'morgan', 'morgan_only_radius': 2, 'morgan_only_nBits': 2048, 'num_hidden_layers': 3, 'hidden_dim_0': 512, 'hidden_dim_1': 128, 'hidden_dim_2': 512, 'kl_weight': 0.000563564160493128, 'lr': 0.001191136460603459, 'batch_size': 32, 'dropout_rate': 0.46804692476499793, 'prior_mu': 0.07518185741389513, 'prior_sigma': 0.05853559662330689, 'normalization': 'layer'}. Best is trial 1400 with value: 0.5178181529045105.
Generating morgan fingerprints...
Generated fingerprints with 2048 features for 900 molecules
Data shape: X=(900, 2048), y=(900,)
Trial 1499: 5-fold CV loss = 0.6009
[I 2025-08-08 00:33:49,996] Trial 1499 finished with value: 0.6009057521820068 and parameters: {'fp_type': 'morgan', 'morgan_only_radius': 2, 'morgan_only_nBits': 2048, 'num_hidden_layers': 3, 'hidden_dim_0': 512, 'hidden_dim_1': 128, 'hidden_dim_2': 128, 'kl_weight': 0.0005656854501790695, 'lr': 0.001991879963989302, 'batch_size': 32, 'dropout_rate': 0.45568137931879044, 'prior_mu': 0.03245872740589346, 'prior_sigma': 0.06377821610568817, 'normalization': 'none'}. Best is trial 1400 with value: 0.5178181529045105.
Generating morgan fingerprints...
Generated fingerprints with 2048 features for 900 molecules
Data shape: X=(900, 2048), y=(900,)
Trial 1498: 5-fold CV loss = 0.5667
[I 2025-08-08 00:33:55,779] Trial 1498 finished with value: 0.5666813611984253 and parameters: {'fp_type': 'morgan', 'morgan_only_radius': 2, 'morgan_only_nBits': 2048, 'num_hidden_layers': 3, 'hidden_dim_0': 512, 'hidden_dim_1': 128, 'hidden_dim_2': 128, 'kl_weight': 0.0006352613412684214, 'lr': 0.0019418543320305435, 'batch_size': 32, 'dropout_rate': 0.23650128472663448, 'prior_mu': 0.03700343768215364, 'prior_sigma': 0.06467497619533627, 'normalization': 'none'}. Best is trial 1400 with value: 0.5178181529045105.
Generating morgan fingerprints...
Generated fingerprints with 2048 features for 900 molecules
Data shape: X=(900, 2048), y=(900,)
Trial 1500: 5-fold CV loss = 0.7106
[I 2025-08-08 00:34:19,143] Trial 1500 finished with value: 0.7106428623199463 and parameters: {'fp_type': 'morgan', 'morgan_only_radius': 2, 'morgan_only_nBits': 2048, 'num_hidden_layers': 3, 'hidden_dim_0': 512, 'hidden_dim_1': 128, 'hidden_dim_2': 128, 'kl_weight': 0.0005859158452911316, 'lr': 0.0019221835707944252, 'batch_size': 32, 'dropout_rate': 0.45729572573696586, 'prior_mu': 0.03288546100757835, 'prior_sigma': 0.06665047010979516, 'normalization': 'none'}. Best is trial 1400 with value: 0.5178181529045105.
Generating morgan fingerprints...
Generated fingerprints with 2048 features for 900 molecules
Data shape: X=(900, 2048), y=(900,)
Trial 1502: 5-fold CV loss = 0.5472
[I 2025-08-08 00:35:05,667] Trial 1502 finished with value: 0.5471644520759582 and parameters: {'fp_type': 'morgan', 'morgan_only_radius': 2, 'morgan_only_nBits': 2048, 'num_hidden_layers': 3, 'hidden_dim_0': 512, 'hidden_dim_1': 128, 'hidden_dim_2': 512, 'kl_weight': 0.0003985932192650783, 'lr': 0.00217211532765516, 'batch_size': 32, 'dropout_rate': 0.4568665498459308, 'prior_mu': 0.04059572809789499, 'prior_sigma': 0.03216305643215686, 'normalization': 'none'}. Best is trial 1400 with value: 0.5178181529045105.
Generating morgan fingerprints...
Generated fingerprints with 2048 features for 900 molecules
Data shape: X=(900, 2048), y=(900,)
Trial 1494: 5-fold CV loss = 0.5726
[I 2025-08-08 00:35:13,270] Trial 1494 finished with value: 0.5725613296031952 and parameters: {'fp_type': 'morgan', 'morgan_only_radius': 2, 'morgan_only_nBits': 2048, 'num_hidden_layers': 3, 'hidden_dim_0': 512, 'hidden_dim_1': 128, 'hidden_dim_2': 512, 'kl_weight': 0.0010551937323416234, 'lr': 0.0016352674628456131, 'batch_size': 32, 'dropout_rate': 0.09152057182212608, 'prior_mu': 0.036274206236042245, 'prior_sigma': 0.05819301544915587, 'normalization': 'none'}. Best is trial 1400 with value: 0.5178181529045105.
Generating morgan fingerprints...
Generated fingerprints with 2048 features for 900 molecules
Data shape: X=(900, 2048), y=(900,)
Trial 1501: 5-fold CV loss = 0.5326
[I 2025-08-08 00:35:36,385] Trial 1501 finished with value: 0.5325938761234283 and parameters: {'fp_type': 'morgan', 'morgan_only_radius': 2, 'morgan_only_nBits': 2048, 'num_hidden_layers': 3, 'hidden_dim_0': 512, 'hidden_dim_1': 128, 'hidden_dim_2': 512, 'kl_weight': 0.00041830572863475545, 'lr': 0.0017969508158612983, 'batch_size': 32, 'dropout_rate': 0.4590311665242299, 'prior_mu': 0.038207078088582355, 'prior_sigma': 0.06436297162757001, 'normalization': 'none'}. Best is trial 1400 with value: 0.5178181529045105.
Generating morgan fingerprints...
Generated fingerprints with 2048 features for 900 molecules
Data shape: X=(900, 2048), y=(900,)
Trial 1503: 5-fold CV loss = 0.6131
[I 2025-08-08 00:35:53,619] Trial 1503 finished with value: 0.6131142497062683 and parameters: {'fp_type': 'morgan', 'morgan_only_radius': 2, 'morgan_only_nBits': 2048, 'num_hidden_layers': 3, 'hidden_dim_0': 512, 'hidden_dim_1': 128, 'hidden_dim_2': 512, 'kl_weight': 0.0007542949398552982, 'lr': 0.0017675216821264822, 'batch_size': 32, 'dropout_rate': 0.46504487607691647, 'prior_mu': 0.04048005458907516, 'prior_sigma': 0.05218064361810608, 'normalization': 'none'}. Best is trial 1400 with value: 0.5178181529045105.
Generating morgan fingerprints...
Generated fingerprints with 2048 features for 900 molecules
Data shape: X=(900, 2048), y=(900,)
Trial 1504: 5-fold CV loss = 0.6574
[I 2025-08-08 00:36:06,698] Trial 1504 finished with value: 0.6574213922023773 and parameters: {'fp_type': 'morgan', 'morgan_only_radius': 2, 'morgan_only_nBits': 2048, 'num_hidden_layers': 3, 'hidden_dim_0': 512, 'hidden_dim_1': 128, 'hidden_dim_2': 512, 'kl_weight': 0.0007324742840665215, 'lr': 0.0017688015940520094, 'batch_size': 32, 'dropout_rate': 0.46703805470115195, 'prior_mu': 0.06581563633507742, 'prior_sigma': 0.061332271024349336, 'normalization': 'none'}. Best is trial 1400 with value: 0.5178181529045105.
Generating morgan fingerprints...
Generated fingerprints with 2048 features for 900 molecules
Data shape: X=(900, 2048), y=(900,)
Trial 1506: 5-fold CV loss = 0.5283
[I 2025-08-08 00:37:06,890] Trial 1506 finished with value: 0.528267765045166 and parameters: {'fp_type': 'morgan', 'morgan_only_radius': 2, 'morgan_only_nBits': 2048, 'num_hidden_layers': 3, 'hidden_dim_0': 512, 'hidden_dim_1': 128, 'hidden_dim_2': 512, 'kl_weight': 0.0008108854604359847, 'lr': 0.002149026783233104, 'batch_size': 32, 'dropout_rate': 0.4672332250454112, 'prior_mu': 0.06295392565411714, 'prior_sigma': 0.05357788727718509, 'normalization': 'none'}. Best is trial 1400 with value: 0.5178181529045105.
Generating morgan fingerprints...
Generated fingerprints with 2048 features for 900 molecules
Data shape: X=(900, 2048), y=(900,)
Trial 1508: 5-fold CV loss = 0.5326
[I 2025-08-08 00:37:08,752] Trial 1508 finished with value: 0.5326421320438385 and parameters: {'fp_type': 'morgan', 'morgan_only_radius': 3, 'morgan_only_nBits': 2048, 'num_hidden_layers': 3, 'hidden_dim_0': 512, 'hidden_dim_1': 128, 'hidden_dim_2': 1024, 'kl_weight': 0.0005015920857930955, 'lr': 0.002157626441067894, 'batch_size': 32, 'dropout_rate': 0.4454091956967469, 'prior_mu': 0.05038655792146454, 'prior_sigma': 0.06664401135841029, 'normalization': 'none'}. Best is trial 1400 with value: 0.5178181529045105.
Generating morgan fingerprints...
Generated fingerprints with 2048 features for 900 molecules
Data shape: X=(900, 2048), y=(900,)
Trial 1510: 5-fold CV loss = 0.7212
[I 2025-08-08 00:37:18,637] Trial 1510 finished with value: 0.7211912512779236 and parameters: {'fp_type': 'morgan', 'morgan_only_radius': 2, 'morgan_only_nBits': 2048, 'num_hidden_layers': 3, 'hidden_dim_0': 512, 'hidden_dim_1': 128, 'hidden_dim_2': 512, 'kl_weight': 0.0009365816854707015, 'lr': 0.00198959563660694, 'batch_size': 128, 'dropout_rate': 0.43566103852129606, 'prior_mu': 0.050739146393172355, 'prior_sigma': 0.05912352461890817, 'normalization': 'none'}. Best is trial 1400 with value: 0.5178181529045105.
Generating morgan fingerprints...
Generated fingerprints with 2048 features for 900 molecules
Data shape: X=(900, 2048), y=(900,)
Trial 1509: 5-fold CV loss = 0.5352
[I 2025-08-08 00:38:03,326] Trial 1509 finished with value: 0.5352016091346741 and parameters: {'fp_type': 'morgan', 'morgan_only_radius': 3, 'morgan_only_nBits': 2048, 'num_hidden_layers': 3, 'hidden_dim_0': 512, 'hidden_dim_1': 128, 'hidden_dim_2': 1024, 'kl_weight': 0.0005281528308941795, 'lr': 0.0021806030921040194, 'batch_size': 32, 'dropout_rate': 0.44547388193333054, 'prior_mu': 0.05027601701923482, 'prior_sigma': 0.06685351441576141, 'normalization': 'none'}. Best is trial 1400 with value: 0.5178181529045105.
Generating morgan fingerprints...
Generated fingerprints with 2048 features for 900 molecules
Data shape: X=(900, 2048), y=(900,)
Trial 1507: 5-fold CV loss = 0.5193
