[I 2025-08-08 03:06:35,176] Trial 1918 finished with value: 0.7813297510147095 and parameters: {'fp_type': 'morgan', 'morgan_only_radius': 2, 'morgan_only_nBits': 2048, 'num_hidden_layers': 3, 'hidden_dim_0': 512, 'hidden_dim_1': 256, 'hidden_dim_2': 512, 'kl_weight': 0.0009901121045416416, 'lr': 0.0015843982577348947, 'batch_size': 32, 'dropout_rate': 0.38362743740175054, 'prior_mu': 0.056048429961050715, 'prior_sigma': 0.07779080244147756, 'normalization': 'none'}. Best is trial 1528 with value: 0.5170644640922546.
Generating morgan fingerprints...
Generated fingerprints with 2048 features for 900 molecules
Data shape: X=(900, 2048), y=(900,)
Trial 1919: 5-fold CV loss = 0.8037
[I 2025-08-08 03:06:36,160] Trial 1919 finished with value: 0.8036708831787109 and parameters: {'fp_type': 'morgan', 'morgan_only_radius': 2, 'morgan_only_nBits': 2048, 'num_hidden_layers': 3, 'hidden_dim_0': 512, 'hidden_dim_1': 128, 'hidden_dim_2': 512, 'kl_weight': 0.0008288826603541969, 'lr': 0.0015807497358768193, 'batch_size': 32, 'dropout_rate': 0.44822911477555566, 'prior_mu': 0.0571582522381722, 'prior_sigma': 0.07899887541822324, 'normalization': 'none'}. Best is trial 1528 with value: 0.5170644640922546.
Generating morgan fingerprints...
Generated fingerprints with 2048 features for 900 molecules
Data shape: X=(900, 2048), y=(900,)
Trial 1922: 5-fold CV loss = 0.7554
[I 2025-08-08 03:07:08,803] Trial 1922 finished with value: 0.7554266333580018 and parameters: {'fp_type': 'morgan', 'morgan_only_radius': 2, 'morgan_only_nBits': 2048, 'num_hidden_layers': 2, 'hidden_dim_0': 512, 'hidden_dim_1': 128, 'kl_weight': 0.0006277346392387536, 'lr': 0.0013163032618369814, 'batch_size': 32, 'dropout_rate': 0.4440071495694497, 'prior_mu': 0.05352495452221187, 'prior_sigma': 0.0846545462239648, 'normalization': 'none'}. Best is trial 1528 with value: 0.5170644640922546.
Generating morgan fingerprints...
Generated fingerprints with 2048 features for 900 molecules
Data shape: X=(900, 2048), y=(900,)
Trial 1923: 5-fold CV loss = 0.6493
[I 2025-08-08 03:07:28,978] Trial 1923 finished with value: 0.6493132174015045 and parameters: {'fp_type': 'morgan', 'morgan_only_radius': 2, 'morgan_only_nBits': 2048, 'num_hidden_layers': 2, 'hidden_dim_0': 512, 'hidden_dim_1': 128, 'kl_weight': 0.0006587630848252608, 'lr': 0.001676838071672997, 'batch_size': 32, 'dropout_rate': 0.44522818658644037, 'prior_mu': 0.05194568305803412, 'prior_sigma': 0.07972279797101757, 'normalization': 'none'}. Best is trial 1528 with value: 0.5170644640922546.
Generating morgan fingerprints...
Generated fingerprints with 2048 features for 900 molecules
Data shape: X=(900, 2048), y=(900,)
Trial 1921: 5-fold CV loss = 0.7100
[I 2025-08-08 03:07:52,200] Trial 1921 finished with value: 0.7099979519844055 and parameters: {'fp_type': 'morgan', 'morgan_only_radius': 2, 'morgan_only_nBits': 2048, 'num_hidden_layers': 2, 'hidden_dim_0': 512, 'hidden_dim_1': 128, 'kl_weight': 0.0008163262677172546, 'lr': 0.001641415435720192, 'batch_size': 32, 'dropout_rate': 0.43489094674841366, 'prior_mu': 0.05231217492419981, 'prior_sigma': 0.08299393753716468, 'normalization': 'none'}. Best is trial 1528 with value: 0.5170644640922546.
Generating morgan fingerprints...
Generated fingerprints with 2048 features for 900 molecules
Data shape: X=(900, 2048), y=(900,)
Trial 1925: 5-fold CV loss = 1.5594
[I 2025-08-08 03:07:59,358] Trial 1925 finished with value: 1.559393835067749 and parameters: {'fp_type': 'morgan', 'morgan_only_radius': 3, 'morgan_only_nBits': 2048, 'num_hidden_layers': 3, 'hidden_dim_0': 512, 'hidden_dim_1': 1024, 'hidden_dim_2': 512, 'kl_weight': 0.0008994773560105061, 'lr': 0.0016932078925346308, 'batch_size': 32, 'dropout_rate': 0.4341009215529923, 'prior_mu': 0.049965183071356854, 'prior_sigma': 0.08364831032900476, 'normalization': 'none'}. Best is trial 1528 with value: 0.5170644640922546.
Generating morgan fingerprints...
Generated fingerprints with 2048 features for 900 molecules
Data shape: X=(900, 2048), y=(900,)
Trial 1927: 5-fold CV loss = 0.8457
[I 2025-08-08 03:08:08,008] Trial 1927 finished with value: 0.8456960916519165 and parameters: {'fp_type': 'morgan', 'morgan_only_radius': 2, 'morgan_only_nBits': 2048, 'num_hidden_layers': 3, 'hidden_dim_0': 512, 'hidden_dim_1': 128, 'hidden_dim_2': 512, 'kl_weight': 0.000530963185282878, 'lr': 0.0018512269203004685, 'batch_size': 128, 'dropout_rate': 0.4150024200881478, 'prior_mu': 0.046999863926584125, 'prior_sigma': 0.07460770256535318, 'normalization': 'none'}. Best is trial 1528 with value: 0.5170644640922546.
Generating morgan fingerprints...
Generated fingerprints with 2048 features for 900 molecules
Data shape: X=(900, 2048), y=(900,)
Trial 1920: 5-fold CV loss = 0.5262
[I 2025-08-08 03:08:11,314] Trial 1920 finished with value: 0.5261748731136322 and parameters: {'fp_type': 'morgan', 'morgan_only_radius': 2, 'morgan_only_nBits': 2048, 'num_hidden_layers': 3, 'hidden_dim_0': 512, 'hidden_dim_1': 128, 'hidden_dim_2': 512, 'kl_weight': 0.0008936721690597306, 'lr': 0.0016147050200507405, 'batch_size': 32, 'dropout_rate': 0.44431424351406995, 'prior_mu': 0.05470332032420075, 'prior_sigma': 0.08342635544739098, 'normalization': 'none'}. Best is trial 1528 with value: 0.5170644640922546.
Generating morgan fingerprints...
Generated fingerprints with 2048 features for 900 molecules
Data shape: X=(900, 2048), y=(900,)
Trial 1924: 5-fold CV loss = 0.5280
[I 2025-08-08 03:08:40,676] Trial 1924 finished with value: 0.5279561460018158 and parameters: {'fp_type': 'morgan', 'morgan_only_radius': 2, 'morgan_only_nBits': 2048, 'num_hidden_layers': 3, 'hidden_dim_0': 512, 'hidden_dim_1': 128, 'hidden_dim_2': 512, 'kl_weight': 0.000873820799608569, 'lr': 0.0016442844708132271, 'batch_size': 32, 'dropout_rate': 0.4332857874453516, 'prior_mu': 0.05077745273700208, 'prior_sigma': 0.08318725629179151, 'normalization': 'none'}. Best is trial 1528 with value: 0.5170644640922546.
Generating morgan fingerprints...
Generated fingerprints with 2048 features for 900 molecules
Data shape: X=(900, 2048), y=(900,)
Trial 1928: 5-fold CV loss = 0.6481
[I 2025-08-08 03:09:48,050] Trial 1928 finished with value: 0.6480914115905761 and parameters: {'fp_type': 'morgan', 'morgan_only_radius': 2, 'morgan_only_nBits': 2048, 'num_hidden_layers': 3, 'hidden_dim_0': 512, 'hidden_dim_1': 128, 'hidden_dim_2': 256, 'kl_weight': 0.0007416782433064256, 'lr': 0.0014848215600810925, 'batch_size': 32, 'dropout_rate': 0.42214387332144776, 'prior_mu': 0.04835083259859575, 'prior_sigma': 0.194862797634255, 'normalization': 'none'}. Best is trial 1528 with value: 0.5170644640922546.
Generating morgan fingerprints...
Generated fingerprints with 2048 features for 900 molecules
Data shape: X=(900, 2048), y=(900,)
Trial 1930: 5-fold CV loss = 0.6676
[I 2025-08-08 03:09:50,617] Trial 1930 finished with value: 0.6675575375556946 and parameters: {'fp_type': 'morgan', 'morgan_only_radius': 2, 'morgan_only_nBits': 2048, 'num_hidden_layers': 3, 'hidden_dim_0': 512, 'hidden_dim_1': 128, 'hidden_dim_2': 256, 'kl_weight': 0.0007469483296597881, 'lr': 0.00024406500678482635, 'batch_size': 32, 'dropout_rate': 0.4186868289581494, 'prior_mu': 0.06259691878940454, 'prior_sigma': 0.07742875080862474, 'normalization': 'layer'}. Best is trial 1528 with value: 0.5170644640922546.
Generating morgan fingerprints...
Generated fingerprints with 2048 features for 900 molecules
Data shape: X=(900, 2048), y=(900,)
Trial 1932: 5-fold CV loss = 0.7430
[I 2025-08-08 03:10:18,081] Trial 1932 finished with value: 0.7429588079452515 and parameters: {'fp_type': 'morgan', 'morgan_only_radius': 2, 'morgan_only_nBits': 2048, 'num_hidden_layers': 3, 'hidden_dim_0': 512, 'hidden_dim_1': 128, 'hidden_dim_2': 512, 'kl_weight': 0.0006200108323726412, 'lr': 0.001824276170525984, 'batch_size': 64, 'dropout_rate': 0.40421416830999374, 'prior_mu': 0.04217426401494205, 'prior_sigma': 0.0734996007323576, 'normalization': 'none'}. Best is trial 1528 with value: 0.5170644640922546.
Generating rdkit fingerprints...
Generated fingerprints with 512 features for 900 molecules
Data shape: X=(900, 512), y=(900,)
Trial 1929: 5-fold CV loss = 0.5956
[I 2025-08-08 03:10:28,499] Trial 1929 finished with value: 0.5956418931484222 and parameters: {'fp_type': 'morgan', 'morgan_only_radius': 2, 'morgan_only_nBits': 2048, 'num_hidden_layers': 3, 'hidden_dim_0': 512, 'hidden_dim_1': 128, 'hidden_dim_2': 512, 'kl_weight': 0.0007668696504936072, 'lr': 0.001447581340256885, 'batch_size': 32, 'dropout_rate': 0.40336992584067405, 'prior_mu': 0.046675408084898916, 'prior_sigma': 0.07552638797283456, 'normalization': 'none'}. Best is trial 1528 with value: 0.5170644640922546.
Generating morgan fingerprints...
Generated fingerprints with 2048 features for 900 molecules
Data shape: X=(900, 2048), y=(900,)
Trial 1933: 5-fold CV loss = 0.6869
[I 2025-08-08 03:10:39,900] Trial 1933 finished with value: 0.6868591427803039 and parameters: {'fp_type': 'rdkit', 'rdkit_only_maxPath': 8, 'rdkit_only_nBits': 512, 'num_hidden_layers': 0, 'kl_weight': 0.000523545347096131, 'lr': 0.0018040089657190882, 'batch_size': 32, 'dropout_rate': 0.4273372829123337, 'prior_mu': 0.04549991027845969, 'prior_sigma': 0.07427399403808078, 'normalization': 'none'}. Best is trial 1528 with value: 0.5170644640922546.
Generating morgan fingerprints...
Generated fingerprints with 2048 features for 900 molecules
Data shape: X=(900, 2048), y=(900,)
Trial 1931: 5-fold CV loss = 0.5619
[I 2025-08-08 03:11:11,272] Trial 1931 finished with value: 0.5619117558002472 and parameters: {'fp_type': 'morgan', 'morgan_only_radius': 2, 'morgan_only_nBits': 2048, 'num_hidden_layers': 3, 'hidden_dim_0': 64, 'hidden_dim_1': 128, 'hidden_dim_2': 512, 'kl_weight': 0.0006158990569797648, 'lr': 0.0017870319436495278, 'batch_size': 32, 'dropout_rate': 0.3991819369283375, 'prior_mu': 0.04380700314028515, 'prior_sigma': 0.07919466689573619, 'normalization': 'none'}. Best is trial 1528 with value: 0.5170644640922546.
Generating morgan fingerprints...
Generated fingerprints with 2048 features for 900 molecules
Data shape: X=(900, 2048), y=(900,)
Trial 1935: 5-fold CV loss = 0.6141
[I 2025-08-08 03:11:35,994] Trial 1935 finished with value: 0.6141216397285462 and parameters: {'fp_type': 'morgan', 'morgan_only_radius': 2, 'morgan_only_nBits': 2048, 'num_hidden_layers': 3, 'hidden_dim_0': 512, 'hidden_dim_1': 128, 'hidden_dim_2': 512, 'kl_weight': 0.0010754901484576198, 'lr': 0.0018153141546355515, 'batch_size': 32, 'dropout_rate': 0.2925213827241602, 'prior_mu': 0.0590462105394508, 'prior_sigma': 0.07132903138131817, 'normalization': 'none'}. Best is trial 1528 with value: 0.5170644640922546.
Generating morgan fingerprints...
Generated fingerprints with 2048 features for 900 molecules
Data shape: X=(900, 2048), y=(900,)
Trial 1934: 5-fold CV loss = 0.5952
[I 2025-08-08 03:12:15,316] Trial 1934 finished with value: 0.5951706826686859 and parameters: {'fp_type': 'morgan', 'morgan_only_radius': 2, 'morgan_only_nBits': 2048, 'num_hidden_layers': 3, 'hidden_dim_0': 256, 'hidden_dim_1': 128, 'hidden_dim_2': 512, 'kl_weight': 0.022169034524782603, 'lr': 0.00187235183045019, 'batch_size': 32, 'dropout_rate': 0.3206353702549331, 'prior_mu': 0.059878961373808874, 'prior_sigma': 0.07111450314761966, 'normalization': 'none'}. Best is trial 1528 with value: 0.5170644640922546.
Generating morgan fingerprints...
Generated fingerprints with 2048 features for 900 molecules
Data shape: X=(900, 2048), y=(900,)
Trial 1926: 5-fold CV loss = 0.5896
[I 2025-08-08 03:12:26,243] Trial 1926 finished with value: 0.5895540475845337 and parameters: {'fp_type': 'morgan', 'morgan_only_radius': 2, 'morgan_only_nBits': 2048, 'num_hidden_layers': 3, 'hidden_dim_0': 512, 'hidden_dim_1': 128, 'hidden_dim_2': 512, 'kl_weight': 0.0008934992788219619, 'lr': 0.0017102535988585935, 'batch_size': 32, 'dropout_rate': 0.42119617659158815, 'prior_mu': 0.048917212057274874, 'prior_sigma': 0.08069848025496715, 'normalization': 'none'}. Best is trial 1528 with value: 0.5170644640922546.
Generating morgan fingerprints...
Generated fingerprints with 2048 features for 900 molecules
Data shape: X=(900, 2048), y=(900,)
Trial 1936: 5-fold CV loss = 0.5488
[I 2025-08-08 03:12:44,606] Trial 1936 finished with value: 0.5487784743309021 and parameters: {'fp_type': 'morgan', 'morgan_only_radius': 2, 'morgan_only_nBits': 2048, 'num_hidden_layers': 3, 'hidden_dim_0': 256, 'hidden_dim_1': 128, 'hidden_dim_2': 512, 'kl_weight': 0.00044982661996709124, 'lr': 0.0018838449192569507, 'batch_size': 32, 'dropout_rate': 0.4482458815898414, 'prior_mu': -0.11826832225617126, 'prior_sigma': 0.07136166592944118, 'normalization': 'none'}. Best is trial 1528 with value: 0.5170644640922546.
Generating morgan fingerprints...
Generated fingerprints with 2048 features for 900 molecules
Data shape: X=(900, 2048), y=(900,)
Trial 1937: 5-fold CV loss = 0.5271
[I 2025-08-08 03:13:23,984] Trial 1937 finished with value: 0.5270866334438324 and parameters: {'fp_type': 'morgan', 'morgan_only_radius': 2, 'morgan_only_nBits': 2048, 'num_hidden_layers': 3, 'hidden_dim_0': 512, 'hidden_dim_1': 128, 'hidden_dim_2': 512, 'kl_weight': 0.00047180410112152146, 'lr': 0.0019300357227133266, 'batch_size': 32, 'dropout_rate': 0.4466379095378255, 'prior_mu': 0.0653670681608898, 'prior_sigma': 0.06959197688680176, 'normalization': 'none'}. Best is trial 1528 with value: 0.5170644640922546.
Generating morgan fingerprints...
Generated fingerprints with 2048 features for 900 molecules
Data shape: X=(900, 2048), y=(900,)
Trial 1938: 5-fold CV loss = 0.5824
[I 2025-08-08 03:14:08,386] Trial 1938 finished with value: 0.5824092030525208 and parameters: {'fp_type': 'morgan', 'morgan_only_radius': 2, 'morgan_only_nBits': 2048, 'num_hidden_layers': 3, 'hidden_dim_0': 512, 'hidden_dim_1': 128, 'hidden_dim_2': 512, 'kl_weight': 0.0006480819794173894, 'lr': 0.001969546969903201, 'batch_size': 32, 'dropout_rate': 0.4325630640401717, 'prior_mu': 0.038911272648346, 'prior_sigma': 0.0745141338414428, 'normalization': 'none'}. Best is trial 1528 with value: 0.5170644640922546.
Generating morgan fingerprints...
Generated fingerprints with 2048 features for 900 molecules
Data shape: X=(900, 2048), y=(900,)
Trial 1940: 5-fold CV loss = 0.5515
[I 2025-08-08 03:14:11,890] Trial 1940 finished with value: 0.5515356004238129 and parameters: {'fp_type': 'morgan', 'morgan_only_radius': 2, 'morgan_only_nBits': 2048, 'num_hidden_layers': 3, 'hidden_dim_0': 512, 'hidden_dim_1': 128, 'hidden_dim_2': 512, 'kl_weight': 0.06507875761201123, 'lr': 0.001987392853251505, 'batch_size': 32, 'dropout_rate': 0.4343384325579839, 'prior_mu': 0.06448299624629728, 'prior_sigma': 0.07490589331729025, 'normalization': 'none'}. Best is trial 1528 with value: 0.5170644640922546.
Generating morgan fingerprints...
Generated fingerprints with 2048 features for 900 molecules
Data shape: X=(900, 2048), y=(900,)
Trial 1941: 5-fold CV loss = 0.5357
[I 2025-08-08 03:14:27,619] Trial 1941 finished with value: 0.5356809616088867 and parameters: {'fp_type': 'morgan', 'morgan_only_radius': 2, 'morgan_only_nBits': 2048, 'num_hidden_layers': 3, 'hidden_dim_0': 512, 'hidden_dim_1': 128, 'hidden_dim_2': 1024, 'kl_weight': 0.000626684679242394, 'lr': 0.002089985778898528, 'batch_size': 32, 'dropout_rate': 0.43210437445642613, 'prior_mu': 0.0370291545072218, 'prior_sigma': 0.07549713262611955, 'normalization': 'none'}. Best is trial 1528 with value: 0.5170644640922546.
Generating morgan fingerprints...
Generated fingerprints with 2048 features for 900 molecules
Data shape: X=(900, 2048), y=(900,)
Trial 1942: 5-fold CV loss = 0.5248
[I 2025-08-08 03:15:51,766] Trial 1942 finished with value: 0.524843841791153 and parameters: {'fp_type': 'morgan', 'morgan_only_radius': 2, 'morgan_only_nBits': 2048, 'num_hidden_layers': 3, 'hidden_dim_0': 512, 'hidden_dim_1': 128, 'hidden_dim_2': 1024, 'kl_weight': 0.0007684380780290755, 'lr': 0.002068483081249204, 'batch_size': 32, 'dropout_rate': 0.411822752285693, 'prior_mu': 0.03893881347879449, 'prior_sigma': 0.06939985999367114, 'normalization': 'none'}. Best is trial 1528 with value: 0.5170644640922546.
Generating morgan fingerprints...
Generated fingerprints with 2048 features for 900 molecules
Data shape: X=(900, 2048), y=(900,)
Trial 1944: 5-fold CV loss = 0.6949
[I 2025-08-08 03:15:55,813] Trial 1944 finished with value: 0.6949429988861084 and parameters: {'fp_type': 'morgan', 'morgan_only_radius': 2, 'morgan_only_nBits': 2048, 'num_hidden_layers': 3, 'hidden_dim_0': 512, 'hidden_dim_1': 128, 'hidden_dim_2': 512, 'kl_weight': 0.0007513771797697111, 'lr': 0.0017231169979436964, 'batch_size': 32, 'dropout_rate': 0.4456207206812874, 'prior_mu': 0.03700387688211863, 'prior_sigma': 0.06950588690611569, 'normalization': 'none'}. Best is trial 1528 with value: 0.5170644640922546.
Generating morgan fingerprints...
Generated fingerprints with 2048 features for 900 molecules
Data shape: X=(900, 2048), y=(900,)
Trial 1943: 5-fold CV loss = 0.5230
[I 2025-08-08 03:16:00,627] Trial 1943 finished with value: 0.5230103075504303 and parameters: {'fp_type': 'morgan', 'morgan_only_radius': 2, 'morgan_only_nBits': 2048, 'num_hidden_layers': 3, 'hidden_dim_0': 512, 'hidden_dim_1': 128, 'hidden_dim_2': 1024, 'kl_weight': 0.0005696324087162954, 'lr': 0.001719874274272391, 'batch_size': 32, 'dropout_rate': 0.410464587363514, 'prior_mu': 0.036684775867943976, 'prior_sigma': 0.07016722488896487, 'normalization': 'none'}. Best is trial 1528 with value: 0.5170644640922546.
Generating morgan fingerprints...
Generated fingerprints with 2048 features for 900 molecules
Data shape: X=(900, 2048), y=(900,)
Trial 1939: 5-fold CV loss = 0.5782
[I 2025-08-08 03:16:08,595] Trial 1939 finished with value: 0.5782293617725373 and parameters: {'fp_type': 'morgan', 'morgan_only_radius': 2, 'morgan_only_nBits': 2048, 'num_hidden_layers': 3, 'hidden_dim_0': 512, 'hidden_dim_1': 128, 'hidden_dim_2': 512, 'kl_weight': 0.00048483973545703163, 'lr': 0.001986180862502104, 'batch_size': 32, 'dropout_rate': 0.4480236416261361, 'prior_mu': 0.03769119340061072, 'prior_sigma': 0.07406916878672422, 'normalization': 'none'}. Best is trial 1528 with value: 0.5170644640922546.
Generating morgan fingerprints...
Generated fingerprints with 2048 features for 900 molecules
Data shape: X=(900, 2048), y=(900,)
Trial 1947: 5-fold CV loss = 0.5468
[I 2025-08-08 03:16:59,836] Trial 1947 finished with value: 0.5468304038047791 and parameters: {'fp_type': 'morgan', 'morgan_only_radius': 3, 'morgan_only_nBits': 2048, 'num_hidden_layers': 3, 'hidden_dim_0': 1024, 'hidden_dim_1': 128, 'hidden_dim_2': 512, 'kl_weight': 0.0009742720853080216, 'lr': 0.0018943025684160382, 'batch_size': 32, 'dropout_rate': 0.4233294404524258, 'prior_mu': 0.05174857906440458, 'prior_sigma': 0.06797708695682739, 'normalization': 'layer'}. Best is trial 1528 with value: 0.5170644640922546.
Generating morgan fingerprints...
Generated fingerprints with 2048 features for 900 molecules
Data shape: X=(900, 2048), y=(900,)
Trial 1949: 5-fold CV loss = 0.7954
[I 2025-08-08 03:17:07,558] Trial 1949 finished with value: 0.7954265952110291 and parameters: {'fp_type': 'morgan', 'morgan_only_radius': 2, 'morgan_only_nBits': 2048, 'num_hidden_layers': 3, 'hidden_dim_0': 512, 'hidden_dim_1': 128, 'hidden_dim_2': 512, 'kl_weight': 0.0006744255570955934, 'lr': 0.001495749424655454, 'batch_size': 128, 'dropout_rate': 0.41567701934048, 'prior_mu': 0.16525812708838872, 'prior_sigma': 0.06616670228696403, 'normalization': 'none'}. Best is trial 1528 with value: 0.5170644640922546.
Generating morgan fingerprints...
Generated fingerprints with 2048 features for 900 molecules
Data shape: X=(900, 2048), y=(900,)
Trial 1946: 5-fold CV loss = 0.5835
[I 2025-08-08 03:17:19,202] Trial 1946 finished with value: 0.5835468471050262 and parameters: {'fp_type': 'morgan', 'morgan_only_radius': 3, 'morgan_only_nBits': 2048, 'num_hidden_layers': 3, 'hidden_dim_0': 1024, 'hidden_dim_1': 128, 'hidden_dim_2': 512, 'kl_weight': 0.0005490574795261475, 'lr': 0.0017005060210661567, 'batch_size': 32, 'dropout_rate': 0.4138242423984893, 'prior_mu': 0.050027044454004736, 'prior_sigma': 0.06842007823466285, 'normalization': 'none'}. Best is trial 1528 with value: 0.5170644640922546.
Generating morgan fingerprints...
Generated fingerprints with 2048 features for 900 molecules
Data shape: X=(900, 2048), y=(900,)
Trial 1945: 5-fold CV loss = 0.6270
[I 2025-08-08 03:18:01,882] Trial 1945 finished with value: 0.6269669890403747 and parameters: {'fp_type': 'morgan', 'morgan_only_radius': 2, 'morgan_only_nBits': 2048, 'num_hidden_layers': 3, 'hidden_dim_0': 512, 'hidden_dim_1': 128, 'hidden_dim_2': 512, 'kl_weight': 0.0010797490775847495, 'lr': 0.001716247207800129, 'batch_size': 32, 'dropout_rate': 0.415925519107977, 'prior_mu': 0.0527582169565769, 'prior_sigma': 0.06856661353931823, 'normalization': 'none'}. Best is trial 1528 with value: 0.5170644640922546.
Generating morgan fingerprints...
Generated fingerprints with 2048 features for 900 molecules
Data shape: X=(900, 2048), y=(900,)
Trial 1951: 5-fold CV loss = 1.0429
[I 2025-08-08 03:18:17,758] Trial 1951 finished with value: 1.0428946137428283 and parameters: {'fp_type': 'morgan', 'morgan_only_radius': 2, 'morgan_only_nBits': 2048, 'num_hidden_layers': 3, 'hidden_dim_0': 512, 'hidden_dim_1': 1024, 'hidden_dim_2': 512, 'kl_weight': 0.000845033020501192, 'lr': 0.002089545233531927, 'batch_size': 32, 'dropout_rate': 0.43677619317418964, 'prior_mu': 0.046011301933175645, 'prior_sigma': 0.07847235819117448, 'normalization': 'none'}. Best is trial 1528 with value: 0.5170644640922546.
Generating rdkit fingerprints...
Generated fingerprints with 1024 features for 900 molecules
Data shape: X=(900, 1024), y=(900,)
Trial 1950: 5-fold CV loss = 0.6170
