[I 2025-08-07 16:21:02,768] Trial 116 finished with value: 0.5558728337287903 and parameters: {'fp_type': 'morgan_rdkit', 'combined_morgan_radius': 3, 'combined_morgan_nBits': 1024, 'combined_rdkit_maxPath': 5, 'combined_rdkit_nBits': 1024, 'num_hidden_layers': 3, 'hidden_dim_0': 512, 'hidden_dim_1': 64, 'hidden_dim_2': 64, 'kl_weight': 0.00013443891568992746, 'lr': 0.0069413703189802394, 'batch_size': 128, 'dropout_rate': 0.4682575423254507, 'prior_mu': -0.01229385942498052, 'prior_sigma': 0.08284667724967616, 'normalization': 'none'}. Best is trial 102 with value: 0.5316388070583343.
Generating morgan_rdkit fingerprints...
Generated fingerprints with 2048 features for 900 molecules
Data shape: X=(900, 2048), y=(900,)
Trial 118: 5-fold CV loss = 0.5647
[I 2025-08-07 16:21:04,260] Trial 118 finished with value: 0.564715301990509 and parameters: {'fp_type': 'morgan_rdkit', 'combined_morgan_radius': 3, 'combined_morgan_nBits': 1024, 'combined_rdkit_maxPath': 6, 'combined_rdkit_nBits': 1024, 'num_hidden_layers': 3, 'hidden_dim_0': 512, 'hidden_dim_1': 512, 'hidden_dim_2': 64, 'kl_weight': 0.00017641344525569166, 'lr': 0.009294725369181463, 'batch_size': 128, 'dropout_rate': 0.47720965131163895, 'prior_mu': -0.05170702238492102, 'prior_sigma': 0.06127391312743013, 'normalization': 'none'}. Best is trial 102 with value: 0.5316388070583343.
Generating morgan_rdkit fingerprints...
Generated fingerprints with 2048 features for 900 molecules
Data shape: X=(900, 2048), y=(900,)
Trial 122: 5-fold CV loss = 0.7056
[I 2025-08-07 16:21:22,191] Trial 122 finished with value: 0.7055803418159485 and parameters: {'fp_type': 'morgan_rdkit', 'combined_morgan_radius': 3, 'combined_morgan_nBits': 1024, 'combined_rdkit_maxPath': 7, 'combined_rdkit_nBits': 1024, 'num_hidden_layers': 3, 'hidden_dim_0': 512, 'hidden_dim_1': 256, 'hidden_dim_2': 128, 'kl_weight': 0.00021291892125084656, 'lr': 0.0007723401298135458, 'batch_size': 128, 'dropout_rate': 0.047388765725483784, 'prior_mu': -0.03684977120327879, 'prior_sigma': 0.06715047172624027, 'normalization': 'none'}. Best is trial 102 with value: 0.5316388070583343.
Generating morgan_rdkit fingerprints...
Generated fingerprints with 2048 features for 900 molecules
Data shape: X=(900, 2048), y=(900,)
Trial 120: 5-fold CV loss = 0.5710
[I 2025-08-07 16:21:23,278] Trial 120 finished with value: 0.5710134267807007 and parameters: {'fp_type': 'morgan_rdkit', 'combined_morgan_radius': 3, 'combined_morgan_nBits': 1024, 'combined_rdkit_maxPath': 6, 'combined_rdkit_nBits': 1024, 'num_hidden_layers': 3, 'hidden_dim_0': 512, 'hidden_dim_1': 64, 'hidden_dim_2': 128, 'kl_weight': 0.00010194790814172957, 'lr': 0.00936070823271985, 'batch_size': 128, 'dropout_rate': 0.046341095863200066, 'prior_mu': -0.0388295336347768, 'prior_sigma': 0.0657385505985584, 'normalization': 'none'}. Best is trial 102 with value: 0.5316388070583343.
Generating morgan_rdkit fingerprints...
Generated fingerprints with 2048 features for 900 molecules
Data shape: X=(900, 2048), y=(900,)
Trial 124: 5-fold CV loss = 0.5431
[I 2025-08-07 16:21:44,917] Trial 124 finished with value: 0.5430857419967652 and parameters: {'fp_type': 'morgan_rdkit', 'combined_morgan_radius': 3, 'combined_morgan_nBits': 1024, 'combined_rdkit_maxPath': 5, 'combined_rdkit_nBits': 1024, 'num_hidden_layers': 3, 'hidden_dim_0': 512, 'hidden_dim_1': 64, 'hidden_dim_2': 256, 'kl_weight': 0.00015032319433595394, 'lr': 0.00816656539950033, 'batch_size': 128, 'dropout_rate': 0.4990360962481938, 'prior_mu': -0.07162021686180545, 'prior_sigma': 0.07565847937941507, 'normalization': 'none'}. Best is trial 102 with value: 0.5316388070583343.
Generating morgan_rdkit fingerprints...
Generated fingerprints with 2048 features for 900 molecules
Data shape: X=(900, 2048), y=(900,)
Trial 121: 5-fold CV loss = 0.5548
[I 2025-08-07 16:21:49,232] Trial 121 finished with value: 0.5547873020172119 and parameters: {'fp_type': 'morgan_rdkit', 'combined_morgan_radius': 3, 'combined_morgan_nBits': 1024, 'combined_rdkit_maxPath': 7, 'combined_rdkit_nBits': 1024, 'num_hidden_layers': 3, 'hidden_dim_0': 512, 'hidden_dim_1': 256, 'hidden_dim_2': 64, 'kl_weight': 0.0001789151268144659, 'lr': 0.009071576192507182, 'batch_size': 128, 'dropout_rate': 0.49937619609633654, 'prior_mu': -0.08978495965533241, 'prior_sigma': 0.06586490701378117, 'normalization': 'none'}. Best is trial 102 with value: 0.5316388070583343.
Generating morgan_rdkit fingerprints...
Generated fingerprints with 2048 features for 900 molecules
Data shape: X=(900, 2048), y=(900,)
Trial 117: 5-fold CV loss = 0.5382
[I 2025-08-07 16:21:50,686] Trial 117 finished with value: 0.5382433891296386 and parameters: {'fp_type': 'morgan_rdkit', 'combined_morgan_radius': 3, 'combined_morgan_nBits': 1024, 'combined_rdkit_maxPath': 5, 'combined_rdkit_nBits': 1024, 'num_hidden_layers': 3, 'hidden_dim_0': 512, 'hidden_dim_1': 64, 'hidden_dim_2': 64, 'kl_weight': 0.00013481311389416733, 'lr': 0.009445155536771742, 'batch_size': 128, 'dropout_rate': 0.4788280031176248, 'prior_mu': -0.04874902309484438, 'prior_sigma': 0.08015804197637004, 'normalization': 'none'}. Best is trial 102 with value: 0.5316388070583343.
Generating morgan_rdkit fingerprints...
Generated fingerprints with 2048 features for 900 molecules
Data shape: X=(900, 2048), y=(900,)
Trial 123: 5-fold CV loss = 0.5392
[I 2025-08-07 16:21:52,969] Trial 123 finished with value: 0.5391624510288239 and parameters: {'fp_type': 'morgan_rdkit', 'combined_morgan_radius': 3, 'combined_morgan_nBits': 1024, 'combined_rdkit_maxPath': 5, 'combined_rdkit_nBits': 1024, 'num_hidden_layers': 3, 'hidden_dim_0': 512, 'hidden_dim_1': 64, 'hidden_dim_2': 256, 'kl_weight': 0.00010276683678344059, 'lr': 0.007907781453255202, 'batch_size': 128, 'dropout_rate': 0.4847318382054387, 'prior_mu': -0.07761123202185899, 'prior_sigma': 0.07584682819192533, 'normalization': 'none'}. Best is trial 102 with value: 0.5316388070583343.
Generating rdkit fingerprints...
Generated fingerprints with 256 features for 900 molecules
Data shape: X=(900, 256), y=(900,)
Trial 125: 5-fold CV loss = 0.5421
[I 2025-08-07 16:22:06,141] Trial 125 finished with value: 0.5421140134334564 and parameters: {'fp_type': 'morgan_rdkit', 'combined_morgan_radius': 3, 'combined_morgan_nBits': 1024, 'combined_rdkit_maxPath': 5, 'combined_rdkit_nBits': 1024, 'num_hidden_layers': 3, 'hidden_dim_0': 512, 'hidden_dim_1': 64, 'hidden_dim_2': 256, 'kl_weight': 0.0001518874498621595, 'lr': 0.008460406906470729, 'batch_size': 128, 'dropout_rate': 0.4872203516428308, 'prior_mu': -0.08499999175847742, 'prior_sigma': 0.07231650870480946, 'normalization': 'none'}. Best is trial 102 with value: 0.5316388070583343.
Generating rdkit fingerprints...
Generated fingerprints with 256 features for 900 molecules
Data shape: X=(900, 256), y=(900,)
Trial 128: 5-fold CV loss = 0.6215
[I 2025-08-07 16:22:07,522] Trial 128 finished with value: 0.6215287327766419 and parameters: {'fp_type': 'rdkit', 'rdkit_only_maxPath': 5, 'rdkit_only_nBits': 256, 'num_hidden_layers': 3, 'hidden_dim_0': 512, 'hidden_dim_1': 64, 'hidden_dim_2': 64, 'kl_weight': 0.00012541680226926694, 'lr': 0.006664823489875835, 'batch_size': 128, 'dropout_rate': 0.4617602051161752, 'prior_mu': -0.062179117375239054, 'prior_sigma': 0.07082750037894225, 'normalization': 'none'}. Best is trial 102 with value: 0.5316388070583343.
Generating morgan_rdkit fingerprints...
Generated fingerprints with 2048 features for 900 molecules
Data shape: X=(900, 2048), y=(900,)
Trial 129: 5-fold CV loss = 0.6178
[I 2025-08-07 16:22:21,059] Trial 129 finished with value: 0.6178106427192688 and parameters: {'fp_type': 'rdkit', 'rdkit_only_maxPath': 5, 'rdkit_only_nBits': 256, 'num_hidden_layers': 3, 'hidden_dim_0': 512, 'hidden_dim_1': 64, 'hidden_dim_2': 64, 'kl_weight': 0.0001260025766889762, 'lr': 0.006021207771155906, 'batch_size': 128, 'dropout_rate': 0.4595951771964154, 'prior_mu': -0.04184338969099841, 'prior_sigma': 0.07953572964070198, 'normalization': 'none'}. Best is trial 102 with value: 0.5316388070583343.
Generating morgan_rdkit fingerprints...
Generated fingerprints with 2048 features for 900 molecules
Data shape: X=(900, 2048), y=(900,)
Trial 126: 5-fold CV loss = 0.5430
[I 2025-08-07 16:22:23,113] Trial 126 finished with value: 0.5429866075515747 and parameters: {'fp_type': 'morgan_rdkit', 'combined_morgan_radius': 3, 'combined_morgan_nBits': 1024, 'combined_rdkit_maxPath': 5, 'combined_rdkit_nBits': 1024, 'num_hidden_layers': 3, 'hidden_dim_0': 512, 'hidden_dim_1': 64, 'hidden_dim_2': 256, 'kl_weight': 0.0001528767495745218, 'lr': 0.007792224190795895, 'batch_size': 128, 'dropout_rate': 0.48681617228771074, 'prior_mu': 0.04807733527363235, 'prior_sigma': 0.07180008225606568, 'normalization': 'none'}. Best is trial 102 with value: 0.5316388070583343.
Generating morgan_rdkit fingerprints...
Generated fingerprints with 1536 features for 900 molecules
Data shape: X=(900, 1536), y=(900,)
Trial 130: 5-fold CV loss = 0.5612
[I 2025-08-07 16:22:36,993] Trial 130 finished with value: 0.5612309455871582 and parameters: {'fp_type': 'morgan_rdkit', 'combined_morgan_radius': 3, 'combined_morgan_nBits': 1024, 'combined_rdkit_maxPath': 5, 'combined_rdkit_nBits': 1024, 'num_hidden_layers': 3, 'hidden_dim_0': 512, 'hidden_dim_1': 128, 'hidden_dim_2': 64, 'kl_weight': 0.00020611138482156289, 'lr': 0.009875957147339434, 'batch_size': 128, 'dropout_rate': 0.14969223762872266, 'prior_mu': 0.007622272792260715, 'prior_sigma': 0.08023677393611951, 'normalization': 'none'}. Best is trial 102 with value: 0.5316388070583343.
Generating morgan_rdkit fingerprints...
Generated fingerprints with 1536 features for 900 molecules
Data shape: X=(900, 1536), y=(900,)
Trial 131: 5-fold CV loss = 0.5567
[I 2025-08-07 16:22:39,880] Trial 131 finished with value: 0.5567487955093384 and parameters: {'fp_type': 'morgan_rdkit', 'combined_morgan_radius': 3, 'combined_morgan_nBits': 1024, 'combined_rdkit_maxPath': 5, 'combined_rdkit_nBits': 1024, 'num_hidden_layers': 3, 'hidden_dim_0': 512, 'hidden_dim_1': 128, 'hidden_dim_2': 1024, 'kl_weight': 0.00019596751219966345, 'lr': 0.007652998773746733, 'batch_size': 128, 'dropout_rate': 0.4444704623202955, 'prior_mu': -0.029475180604661283, 'prior_sigma': 0.08126322640928878, 'normalization': 'none'}. Best is trial 102 with value: 0.5316388070583343.
Generating morgan_rdkit fingerprints...
Generated fingerprints with 2048 features for 900 molecules
Data shape: X=(900, 2048), y=(900,)
Trial 127: 5-fold CV loss = 0.5891
[I 2025-08-07 16:22:46,638] Trial 127 finished with value: 0.589129114151001 and parameters: {'fp_type': 'morgan_rdkit', 'combined_morgan_radius': 3, 'combined_morgan_nBits': 1024, 'combined_rdkit_maxPath': 5, 'combined_rdkit_nBits': 1024, 'num_hidden_layers': 3, 'hidden_dim_0': 512, 'hidden_dim_1': 64, 'hidden_dim_2': 64, 'kl_weight': 0.00012660162802582235, 'lr': 0.007802814730238965, 'batch_size': 128, 'dropout_rate': 0.46247062674726075, 'prior_mu': -0.06684742486052625, 'prior_sigma': 0.07261360877360626, 'normalization': 'none'}. Best is trial 102 with value: 0.5316388070583343.
Generating morgan_rdkit fingerprints...
Generated fingerprints with 1536 features for 900 molecules
Data shape: X=(900, 1536), y=(900,)
Trial 134: 5-fold CV loss = 0.5472
[I 2025-08-07 16:22:58,572] Trial 134 finished with value: 0.5471710324287414 and parameters: {'fp_type': 'morgan_rdkit', 'combined_morgan_radius': 3, 'combined_morgan_nBits': 1024, 'combined_rdkit_maxPath': 5, 'combined_rdkit_nBits': 1024, 'num_hidden_layers': 3, 'hidden_dim_0': 512, 'hidden_dim_1': 64, 'hidden_dim_2': 256, 'kl_weight': 0.0001452550565562679, 'lr': 0.008672423604690598, 'batch_size': 128, 'dropout_rate': 0.4766116363797304, 'prior_mu': 0.0743897121262892, 'prior_sigma': 0.0891038292022571, 'normalization': 'none'}. Best is trial 102 with value: 0.5316388070583343.
Generating morgan_rdkit fingerprints...
Generated fingerprints with 1536 features for 900 molecules
Data shape: X=(900, 1536), y=(900,)
Trial 132: 5-fold CV loss = 0.5944
[I 2025-08-07 16:23:15,249] Trial 132 finished with value: 0.5944043278694153 and parameters: {'fp_type': 'morgan_rdkit', 'combined_morgan_radius': 3, 'combined_morgan_nBits': 1024, 'combined_rdkit_maxPath': 5, 'combined_rdkit_nBits': 512, 'num_hidden_layers': 3, 'hidden_dim_0': 64, 'hidden_dim_1': 128, 'hidden_dim_2': 256, 'kl_weight': 0.0001962172182512152, 'lr': 0.006899073627722483, 'batch_size': 32, 'dropout_rate': 0.4469201380545308, 'prior_mu': 0.06484107773161432, 'prior_sigma': 0.08080156779971419, 'normalization': 'none'}. Best is trial 102 with value: 0.5316388070583343.
Generating morgan_rdkit fingerprints...
Generated fingerprints with 2048 features for 900 molecules
Data shape: X=(900, 2048), y=(900,)
Trial 133: 5-fold CV loss = 0.5989
[I 2025-08-07 16:23:26,646] Trial 133 finished with value: 0.598944342136383 and parameters: {'fp_type': 'morgan_rdkit', 'combined_morgan_radius': 3, 'combined_morgan_nBits': 1024, 'combined_rdkit_maxPath': 5, 'combined_rdkit_nBits': 512, 'num_hidden_layers': 3, 'hidden_dim_0': 64, 'hidden_dim_1': 1024, 'hidden_dim_2': 256, 'kl_weight': 0.013090785229634808, 'lr': 0.004688047366443779, 'batch_size': 32, 'dropout_rate': 0.4781495513684263, 'prior_mu': 0.06615603200078975, 'prior_sigma': 0.09093738901803838, 'normalization': 'none'}. Best is trial 102 with value: 0.5316388070583343.
Generating morgan_rdkit fingerprints...
Generated fingerprints with 2048 features for 900 molecules
Data shape: X=(900, 2048), y=(900,)
Trial 135: 5-fold CV loss = 0.5436
[I 2025-08-07 16:23:47,685] Trial 135 finished with value: 0.5435654580593109 and parameters: {'fp_type': 'morgan_rdkit', 'combined_morgan_radius': 3, 'combined_morgan_nBits': 1024, 'combined_rdkit_maxPath': 5, 'combined_rdkit_nBits': 512, 'num_hidden_layers': 3, 'hidden_dim_0': 512, 'hidden_dim_1': 64, 'hidden_dim_2': 256, 'kl_weight': 0.0001418513641482739, 'lr': 0.008752334657819768, 'batch_size': 128, 'dropout_rate': 0.4790955554008196, 'prior_mu': 0.06797365374034317, 'prior_sigma': 0.08976997879242235, 'normalization': 'none'}. Best is trial 102 with value: 0.5316388070583343.
Generating morgan_rdkit fingerprints...
Generated fingerprints with 2048 features for 900 molecules
Data shape: X=(900, 2048), y=(900,)
Trial 138: 5-fold CV loss = 0.5440
[I 2025-08-07 16:23:55,238] Trial 138 finished with value: 0.543984979391098 and parameters: {'fp_type': 'morgan_rdkit', 'combined_morgan_radius': 3, 'combined_morgan_nBits': 1024, 'combined_rdkit_maxPath': 5, 'combined_rdkit_nBits': 1024, 'num_hidden_layers': 3, 'hidden_dim_0': 512, 'hidden_dim_1': 64, 'hidden_dim_2': 256, 'kl_weight': 0.00010210576269786671, 'lr': 0.009955836173696558, 'batch_size': 128, 'dropout_rate': 0.49087691851936865, 'prior_mu': -0.003968385283572727, 'prior_sigma': 0.0958411251464676, 'normalization': 'none'}. Best is trial 102 with value: 0.5316388070583343.
Generating morgan_rdkit fingerprints...
Generated fingerprints with 2048 features for 900 molecules
Data shape: X=(900, 2048), y=(900,)
Trial 137: 5-fold CV loss = 0.6098
[I 2025-08-07 16:24:05,181] Trial 137 finished with value: 0.6098076581954956 and parameters: {'fp_type': 'morgan_rdkit', 'combined_morgan_radius': 3, 'combined_morgan_nBits': 1024, 'combined_rdkit_maxPath': 5, 'combined_rdkit_nBits': 1024, 'num_hidden_layers': 3, 'hidden_dim_0': 512, 'hidden_dim_1': 1024, 'hidden_dim_2': 256, 'kl_weight': 0.00010095646893778902, 'lr': 0.0059837865199365015, 'batch_size': 128, 'dropout_rate': 0.47834706103922314, 'prior_mu': 0.08853631589881542, 'prior_sigma': 0.09866738098433862, 'normalization': 'none'}. Best is trial 102 with value: 0.5316388070583343.
Generating morgan_rdkit fingerprints...
Generated fingerprints with 2048 features for 900 molecules
Data shape: X=(900, 2048), y=(900,)
Trial 136: 5-fold CV loss = 0.5703
[I 2025-08-07 16:24:06,190] Trial 136 finished with value: 0.5703020036220551 and parameters: {'fp_type': 'morgan_rdkit', 'combined_morgan_radius': 3, 'combined_morgan_nBits': 1024, 'combined_rdkit_maxPath': 5, 'combined_rdkit_nBits': 512, 'num_hidden_layers': 3, 'hidden_dim_0': 64, 'hidden_dim_1': 1024, 'hidden_dim_2': 256, 'kl_weight': 0.00023114818835214974, 'lr': 0.006899628484393073, 'batch_size': 32, 'dropout_rate': 0.47997991343774593, 'prior_mu': 0.06585654813383471, 'prior_sigma': 0.09774348041786177, 'normalization': 'none'}. Best is trial 102 with value: 0.5316388070583343.
Generating morgan_rdkit fingerprints...
Generated fingerprints with 2048 features for 900 molecules
Data shape: X=(900, 2048), y=(900,)
Trial 140: 5-fold CV loss = 0.6730
[I 2025-08-07 16:24:15,166] Trial 140 finished with value: 0.6730204224586487 and parameters: {'fp_type': 'morgan_rdkit', 'combined_morgan_radius': 3, 'combined_morgan_nBits': 1024, 'combined_rdkit_maxPath': 5, 'combined_rdkit_nBits': 1024, 'num_hidden_layers': 3, 'hidden_dim_0': 512, 'hidden_dim_1': 64, 'hidden_dim_2': 256, 'kl_weight': 0.0001687533904182817, 'lr': 0.0060279961039511895, 'batch_size': 128, 'dropout_rate': 0.49112086460586923, 'prior_mu': 0.08616600541866198, 'prior_sigma': 0.16161958848879174, 'normalization': 'none'}. Best is trial 102 with value: 0.5316388070583343.
Generating morgan_rdkit fingerprints...
Generated fingerprints with 2048 features for 900 molecules
Data shape: X=(900, 2048), y=(900,)
Trial 141: 5-fold CV loss = 1.7498
[I 2025-08-07 16:24:23,314] Trial 141 finished with value: 1.7498361110687255 and parameters: {'fp_type': 'morgan_rdkit', 'combined_morgan_radius': 2, 'combined_morgan_nBits': 1024, 'combined_rdkit_maxPath': 5, 'combined_rdkit_nBits': 1024, 'num_hidden_layers': 3, 'hidden_dim_0': 512, 'hidden_dim_1': 64, 'hidden_dim_2': 256, 'kl_weight': 0.00016811021862871327, 'lr': 0.0011696598864024737, 'batch_size': 128, 'dropout_rate': 0.49820997022612923, 'prior_mu': 0.09678251588391926, 'prior_sigma': 0.08663333513732262, 'normalization': 'none'}. Best is trial 102 with value: 0.5316388070583343.
Generating morgan_rdkit fingerprints...
Generated fingerprints with 2048 features for 900 molecules
Data shape: X=(900, 2048), y=(900,)
Trial 142: 5-fold CV loss = 0.6002
[I 2025-08-07 16:24:29,461] Trial 142 finished with value: 0.6001530051231384 and parameters: {'fp_type': 'morgan_rdkit', 'combined_morgan_radius': 2, 'combined_morgan_nBits': 1024, 'combined_rdkit_maxPath': 5, 'combined_rdkit_nBits': 1024, 'num_hidden_layers': 1, 'hidden_dim_0': 1024, 'kl_weight': 0.0021491063775096126, 'lr': 0.005337722945315561, 'batch_size': 128, 'dropout_rate': 0.49105455309611706, 'prior_mu': 0.09529395797661953, 'prior_sigma': 0.08529730731865329, 'normalization': 'none'}. Best is trial 102 with value: 0.5316388070583343.
Generating morgan_rdkit fingerprints...
Generated fingerprints with 2048 features for 900 molecules
Data shape: X=(900, 2048), y=(900,)
Trial 143: 5-fold CV loss = 0.5647
[I 2025-08-07 16:24:38,533] Trial 143 finished with value: 0.5647054731845855 and parameters: {'fp_type': 'morgan_rdkit', 'combined_morgan_radius': 2, 'combined_morgan_nBits': 1024, 'combined_rdkit_maxPath': 5, 'combined_rdkit_nBits': 1024, 'num_hidden_layers': 3, 'hidden_dim_0': 1024, 'hidden_dim_1': 64, 'hidden_dim_2': 512, 'kl_weight': 0.0001616733381982207, 'lr': 0.008525008731825117, 'batch_size': 128, 'dropout_rate': 0.4990598786893419, 'prior_mu': 0.09414195191259916, 'prior_sigma': 0.08498206704442146, 'normalization': 'none'}. Best is trial 102 with value: 0.5316388070583343.
Generating morgan_rdkit fingerprints...
Generated fingerprints with 2048 features for 900 molecules
Data shape: X=(900, 2048), y=(900,)
Trial 139: 5-fold CV loss = 0.5472
[I 2025-08-07 16:24:44,251] Trial 139 finished with value: 0.5471720218658447 and parameters: {'fp_type': 'morgan_rdkit', 'combined_morgan_radius': 3, 'combined_morgan_nBits': 1024, 'combined_rdkit_maxPath': 5, 'combined_rdkit_nBits': 1024, 'num_hidden_layers': 3, 'hidden_dim_0': 512, 'hidden_dim_1': 64, 'hidden_dim_2': 256, 'kl_weight': 0.00010100525984491819, 'lr': 0.006763988177073322, 'batch_size': 128, 'dropout_rate': 0.4888290466567394, 'prior_mu': 0.08753758006851418, 'prior_sigma': 0.09507840943358079, 'normalization': 'none'}. Best is trial 102 with value: 0.5316388070583343.
Generating morgan_rdkit fingerprints...
Generated fingerprints with 2048 features for 900 molecules
Data shape: X=(900, 2048), y=(900,)
Trial 145: 5-fold CV loss = 0.5413
[I 2025-08-07 16:24:50,649] Trial 145 finished with value: 0.5412997841835022 and parameters: {'fp_type': 'morgan_rdkit', 'combined_morgan_radius': 3, 'combined_morgan_nBits': 1024, 'combined_rdkit_maxPath': 5, 'combined_rdkit_nBits': 1024, 'num_hidden_layers': 3, 'hidden_dim_0': 512, 'hidden_dim_1': 64, 'hidden_dim_2': 256, 'kl_weight': 0.00011959026062218308, 'lr': 0.008318950186380613, 'batch_size': 128, 'dropout_rate': 0.46542050733110096, 'prior_mu': -0.11850478334259848, 'prior_sigma': 0.07567501295211516, 'normalization': 'none'}. Best is trial 102 with value: 0.5316388070583343.
Generating morgan_rdkit fingerprints...
Generated fingerprints with 2048 features for 900 molecules
Data shape: X=(900, 2048), y=(900,)
Trial 144: 5-fold CV loss = 0.5462
[I 2025-08-07 16:24:54,839] Trial 144 finished with value: 0.5462077140808106 and parameters: {'fp_type': 'morgan_rdkit', 'combined_morgan_radius': 3, 'combined_morgan_nBits': 1024, 'combined_rdkit_maxPath': 5, 'combined_rdkit_nBits': 1024, 'num_hidden_layers': 3, 'hidden_dim_0': 512, 'hidden_dim_1': 64, 'hidden_dim_2': 256, 'kl_weight': 0.00011428647998377536, 'lr': 0.008123672774469848, 'batch_size': 128, 'dropout_rate': 0.4709211713843714, 'prior_mu': -0.07735445521693186, 'prior_sigma': 0.07742810903665526, 'normalization': 'none'}. Best is trial 102 with value: 0.5316388070583343.
Generating morgan_rdkit fingerprints...
Generated fingerprints with 2048 features for 900 molecules
Data shape: X=(900, 2048), y=(900,)
Trial 146: 5-fold CV loss = 0.5408
