[I 2025-08-07 22:56:31,960] Trial 1229 finished with value: 0.5287453532218933 and parameters: {'fp_type': 'morgan', 'morgan_only_radius': 2, 'morgan_only_nBits': 1024, 'num_hidden_layers': 3, 'hidden_dim_0': 512, 'hidden_dim_1': 128, 'hidden_dim_2': 512, 'kl_weight': 0.004747468399297273, 'lr': 0.0022188569082868103, 'batch_size': 32, 'dropout_rate': 0.4774242066458734, 'prior_mu': 0.01613055779694811, 'prior_sigma': 0.06393376955500014, 'normalization': 'none'}. Best is trial 272 with value: 0.5198344707489013.
Generating rdkit fingerprints...
Generated fingerprints with 256 features for 900 molecules
Data shape: X=(900, 256), y=(900,)
Trial 1228: 5-fold CV loss = 0.5474
[I 2025-08-07 22:56:41,176] Trial 1228 finished with value: 0.5474424242973328 and parameters: {'fp_type': 'morgan', 'morgan_only_radius': 2, 'morgan_only_nBits': 1024, 'num_hidden_layers': 3, 'hidden_dim_0': 512, 'hidden_dim_1': 128, 'hidden_dim_2': 512, 'kl_weight': 0.0003358289688863277, 'lr': 0.0018112192453682066, 'batch_size': 32, 'dropout_rate': 0.4777476578859948, 'prior_mu': 0.016948494155861978, 'prior_sigma': 0.0637496901165799, 'normalization': 'none'}. Best is trial 272 with value: 0.5198344707489013.
Generating rdkit fingerprints...
Generated fingerprints with 256 features for 900 molecules
Data shape: X=(900, 256), y=(900,)
Trial 1225: 5-fold CV loss = 0.5652
[I 2025-08-07 22:57:00,840] Trial 1225 finished with value: 0.5651742577552795 and parameters: {'fp_type': 'morgan', 'morgan_only_radius': 2, 'morgan_only_nBits': 1024, 'num_hidden_layers': 2, 'hidden_dim_0': 64, 'hidden_dim_1': 128, 'kl_weight': 0.00021834713740572666, 'lr': 0.0024524623395738724, 'batch_size': 32, 'dropout_rate': 0.45880925933439093, 'prior_mu': -0.08725639052167276, 'prior_sigma': 0.07168134769051063, 'normalization': 'none'}. Best is trial 272 with value: 0.5198344707489013.
Generating rdkit fingerprints...
Generated fingerprints with 256 features for 900 molecules
Data shape: X=(900, 256), y=(900,)
Trial 1227: 5-fold CV loss = 0.5338
[I 2025-08-07 22:57:03,270] Trial 1227 finished with value: 0.5337783753871918 and parameters: {'fp_type': 'morgan', 'morgan_only_radius': 2, 'morgan_only_nBits': 1024, 'num_hidden_layers': 3, 'hidden_dim_0': 512, 'hidden_dim_1': 128, 'hidden_dim_2': 512, 'kl_weight': 0.00022959213032143534, 'lr': 0.001989873381883504, 'batch_size': 32, 'dropout_rate': 0.47585365995200635, 'prior_mu': 0.013521546790616075, 'prior_sigma': 0.06876261038016064, 'normalization': 'none'}. Best is trial 272 with value: 0.5198344707489013.
Generating rdkit fingerprints...
Generated fingerprints with 256 features for 900 molecules
Data shape: X=(900, 256), y=(900,)
Trial 1230: 5-fold CV loss = 0.6282
[I 2025-08-07 22:57:09,764] Trial 1230 finished with value: 0.6282098889350891 and parameters: {'fp_type': 'rdkit', 'rdkit_only_maxPath': 5, 'rdkit_only_nBits': 256, 'num_hidden_layers': 3, 'hidden_dim_0': 512, 'hidden_dim_1': 128, 'hidden_dim_2': 512, 'kl_weight': 0.0001849415650573858, 'lr': 0.0029012356827129624, 'batch_size': 32, 'dropout_rate': 0.4847341807993442, 'prior_mu': -0.0024404879508591825, 'prior_sigma': 0.0499712836518261, 'normalization': 'none'}. Best is trial 272 with value: 0.5198344707489013.
Generating morgan fingerprints...
Generated fingerprints with 2048 features for 900 molecules
Data shape: X=(900, 2048), y=(900,)
Trial 1231: 5-fold CV loss = 0.7916
[I 2025-08-07 22:57:12,259] Trial 1231 finished with value: 0.791561233997345 and parameters: {'fp_type': 'rdkit', 'rdkit_only_maxPath': 5, 'rdkit_only_nBits': 256, 'num_hidden_layers': 3, 'hidden_dim_0': 512, 'hidden_dim_1': 128, 'hidden_dim_2': 512, 'kl_weight': 0.00018977537804904185, 'lr': 0.0001578194111355278, 'batch_size': 32, 'dropout_rate': 0.4884366319882556, 'prior_mu': -0.013512240840397604, 'prior_sigma': 0.05082961506910507, 'normalization': 'none'}. Best is trial 272 with value: 0.5198344707489013.
Generating morgan fingerprints...
Generated fingerprints with 2048 features for 900 molecules
Data shape: X=(900, 2048), y=(900,)
Trial 1234: 5-fold CV loss = 0.5274
[I 2025-08-07 22:58:23,737] Trial 1234 finished with value: 0.5273930132389069 and parameters: {'fp_type': 'morgan', 'morgan_only_radius': 2, 'morgan_only_nBits': 2048, 'num_hidden_layers': 3, 'hidden_dim_0': 512, 'hidden_dim_1': 128, 'hidden_dim_2': 512, 'kl_weight': 0.0002528548438539158, 'lr': 0.0021737426603248215, 'batch_size': 32, 'dropout_rate': 0.49997982793238305, 'prior_mu': -0.010996101729379511, 'prior_sigma': 0.05472817327820498, 'normalization': 'none'}. Best is trial 272 with value: 0.5198344707489013.
Generating morgan fingerprints...
Generated fingerprints with 2048 features for 900 molecules
Data shape: X=(900, 2048), y=(900,)
Trial 1235: 5-fold CV loss = 0.5446
[I 2025-08-07 22:58:28,386] Trial 1235 finished with value: 0.5446460604667663 and parameters: {'fp_type': 'morgan', 'morgan_only_radius': 2, 'morgan_only_nBits': 2048, 'num_hidden_layers': 3, 'hidden_dim_0': 512, 'hidden_dim_1': 128, 'hidden_dim_2': 512, 'kl_weight': 0.006157552100923575, 'lr': 0.0021906976445687496, 'batch_size': 32, 'dropout_rate': 0.4914333668841522, 'prior_mu': -0.01507699800608789, 'prior_sigma': 0.05507937345657969, 'normalization': 'none'}. Best is trial 272 with value: 0.5198344707489013.
Generating morgan fingerprints...
Generated fingerprints with 1024 features for 900 molecules
Data shape: X=(900, 1024), y=(900,)
Trial 1233: 5-fold CV loss = 0.6123
[I 2025-08-07 22:58:47,976] Trial 1233 finished with value: 0.61233189702034 and parameters: {'fp_type': 'rdkit', 'rdkit_only_maxPath': 5, 'rdkit_only_nBits': 256, 'num_hidden_layers': 3, 'hidden_dim_0': 512, 'hidden_dim_1': 128, 'hidden_dim_2': 512, 'kl_weight': 0.00017849577838674764, 'lr': 0.002178801657201914, 'batch_size': 32, 'dropout_rate': 0.49067192050302, 'prior_mu': -0.013431354312039862, 'prior_sigma': 0.04914670883968285, 'normalization': 'none'}. Best is trial 272 with value: 0.5198344707489013.
Generating morgan fingerprints...
Generated fingerprints with 1024 features for 900 molecules
Data shape: X=(900, 1024), y=(900,)
Trial 1237: 5-fold CV loss = 0.5649
[I 2025-08-07 22:59:32,615] Trial 1237 finished with value: 0.564892464876175 and parameters: {'fp_type': 'morgan', 'morgan_only_radius': 2, 'morgan_only_nBits': 1024, 'num_hidden_layers': 3, 'hidden_dim_0': 512, 'hidden_dim_1': 128, 'hidden_dim_2': 512, 'kl_weight': 0.00037892385228553634, 'lr': 0.002797571506099721, 'batch_size': 32, 'dropout_rate': 0.021635996037275063, 'prior_mu': 0.0011469572806297817, 'prior_sigma': 0.06683695229934765, 'normalization': 'none'}. Best is trial 272 with value: 0.5198344707489013.
Generating morgan fingerprints...
Generated fingerprints with 2048 features for 900 molecules
Data shape: X=(900, 2048), y=(900,)
Trial 1232: 5-fold CV loss = 0.6311
[I 2025-08-07 22:59:38,477] Trial 1232 finished with value: 0.6310874283313751 and parameters: {'fp_type': 'rdkit', 'rdkit_only_maxPath': 5, 'rdkit_only_nBits': 256, 'num_hidden_layers': 3, 'hidden_dim_0': 512, 'hidden_dim_1': 128, 'hidden_dim_2': 512, 'kl_weight': 0.00017279395973142337, 'lr': 0.0029024052472299425, 'batch_size': 32, 'dropout_rate': 0.49065669381753385, 'prior_mu': -0.0120405829152338, 'prior_sigma': 0.06835927357006298, 'normalization': 'none'}. Best is trial 272 with value: 0.5198344707489013.
Generating morgan fingerprints...
Generated fingerprints with 2048 features for 900 molecules
Data shape: X=(900, 2048), y=(900,)
Trial 1236: 5-fold CV loss = 0.5312
[I 2025-08-07 22:59:41,401] Trial 1236 finished with value: 0.5312020480632782 and parameters: {'fp_type': 'morgan', 'morgan_only_radius': 2, 'morgan_only_nBits': 2048, 'num_hidden_layers': 3, 'hidden_dim_0': 512, 'hidden_dim_1': 128, 'hidden_dim_2': 512, 'kl_weight': 0.0002618302256459765, 'lr': 0.0019859113061461964, 'batch_size': 32, 'dropout_rate': 0.49136646126860895, 'prior_mu': -0.014663462218561548, 'prior_sigma': 0.06645641581761287, 'normalization': 'none'}. Best is trial 272 with value: 0.5198344707489013.
Generating morgan fingerprints...
Generated fingerprints with 1024 features for 900 molecules
Data shape: X=(900, 1024), y=(900,)
Trial 1238: 5-fold CV loss = 0.5318
[I 2025-08-07 23:00:34,596] Trial 1238 finished with value: 0.531819885969162 and parameters: {'fp_type': 'morgan', 'morgan_only_radius': 2, 'morgan_only_nBits': 1024, 'num_hidden_layers': 3, 'hidden_dim_0': 512, 'hidden_dim_1': 128, 'hidden_dim_2': 512, 'kl_weight': 0.004384139078073627, 'lr': 0.0027660194998337805, 'batch_size': 32, 'dropout_rate': 0.4630696565978738, 'prior_mu': -0.005963803167920299, 'prior_sigma': 0.06731394027496464, 'normalization': 'none'}. Best is trial 272 with value: 0.5198344707489013.
Generating morgan fingerprints...
Generated fingerprints with 2048 features for 900 molecules
Data shape: X=(900, 2048), y=(900,)
Trial 1242: 5-fold CV loss = 0.6679
[I 2025-08-07 23:00:47,834] Trial 1242 finished with value: 0.667905306816101 and parameters: {'fp_type': 'morgan', 'morgan_only_radius': 2, 'morgan_only_nBits': 2048, 'num_hidden_layers': 3, 'hidden_dim_0': 512, 'hidden_dim_1': 128, 'hidden_dim_2': 256, 'kl_weight': 0.0051508886237177885, 'lr': 0.0016522341361243425, 'batch_size': 128, 'dropout_rate': 0.4999250459397243, 'prior_mu': 0.0047969727654124834, 'prior_sigma': 0.060455642089273454, 'normalization': 'none'}. Best is trial 272 with value: 0.5198344707489013.
Generating morgan fingerprints...
Generated fingerprints with 1024 features for 900 molecules
Data shape: X=(900, 1024), y=(900,)
Trial 1239: 5-fold CV loss = 0.5698
[I 2025-08-07 23:00:56,683] Trial 1239 finished with value: 0.5697638392448425 and parameters: {'fp_type': 'morgan', 'morgan_only_radius': 2, 'morgan_only_nBits': 2048, 'num_hidden_layers': 3, 'hidden_dim_0': 512, 'hidden_dim_1': 128, 'hidden_dim_2': 512, 'kl_weight': 0.004566437136756819, 'lr': 0.0018956464669740577, 'batch_size': 32, 'dropout_rate': 0.4633223916289193, 'prior_mu': 0.0048461800008358265, 'prior_sigma': 0.06133082866063902, 'normalization': 'none'}. Best is trial 272 with value: 0.5198344707489013.
Generating morgan fingerprints...
Generated fingerprints with 1024 features for 900 molecules
Data shape: X=(900, 1024), y=(900,)
Trial 1241: 5-fold CV loss = 0.5427
[I 2025-08-07 23:01:07,896] Trial 1241 finished with value: 0.5427390754222869 and parameters: {'fp_type': 'morgan', 'morgan_only_radius': 2, 'morgan_only_nBits': 1024, 'num_hidden_layers': 3, 'hidden_dim_0': 512, 'hidden_dim_1': 128, 'hidden_dim_2': 256, 'kl_weight': 0.004237143243027907, 'lr': 0.002529702786321756, 'batch_size': 32, 'dropout_rate': 0.4682259124496917, 'prior_mu': 0.005618653458422995, 'prior_sigma': 0.06153232861393424, 'normalization': 'none'}. Best is trial 272 with value: 0.5198344707489013.
Generating morgan fingerprints...
Generated fingerprints with 1024 features for 900 molecules
Data shape: X=(900, 1024), y=(900,)
Trial 1245: 5-fold CV loss = 0.5341
[I 2025-08-07 23:02:04,653] Trial 1245 finished with value: 0.5340605914592743 and parameters: {'fp_type': 'morgan', 'morgan_only_radius': 2, 'morgan_only_nBits': 1024, 'num_hidden_layers': 3, 'hidden_dim_0': 512, 'hidden_dim_1': 256, 'hidden_dim_2': 512, 'kl_weight': 0.00027291629968084324, 'lr': 0.002376850237567962, 'batch_size': 32, 'dropout_rate': 0.47819128480168904, 'prior_mu': 0.02514664403426553, 'prior_sigma': 0.07219732377823466, 'normalization': 'layer'}. Best is trial 272 with value: 0.5198344707489013.
Generating morgan fingerprints...
Generated fingerprints with 2048 features for 900 molecules
Data shape: X=(900, 2048), y=(900,)
Trial 1244: 5-fold CV loss = 0.5248
[I 2025-08-07 23:02:16,556] Trial 1244 finished with value: 0.5247875154018402 and parameters: {'fp_type': 'morgan', 'morgan_only_radius': 2, 'morgan_only_nBits': 1024, 'num_hidden_layers': 3, 'hidden_dim_0': 512, 'hidden_dim_1': 256, 'hidden_dim_2': 512, 'kl_weight': 0.00024250604126379314, 'lr': 0.002465304945888144, 'batch_size': 32, 'dropout_rate': 0.47657168959016, 'prior_mu': -0.02454534218566076, 'prior_sigma': 0.0640096501826904, 'normalization': 'none'}. Best is trial 272 with value: 0.5198344707489013.
Generating morgan fingerprints...
Generated fingerprints with 2048 features for 900 molecules
Data shape: X=(900, 2048), y=(900,)
Trial 1243: 5-fold CV loss = 0.5245
[I 2025-08-07 23:02:42,589] Trial 1243 finished with value: 0.5244955778121948 and parameters: {'fp_type': 'morgan', 'morgan_only_radius': 2, 'morgan_only_nBits': 1024, 'num_hidden_layers': 3, 'hidden_dim_0': 512, 'hidden_dim_1': 256, 'hidden_dim_2': 512, 'kl_weight': 0.0001383978202896969, 'lr': 0.0024493467012436767, 'batch_size': 32, 'dropout_rate': 0.4734446623982253, 'prior_mu': -0.024023069363299933, 'prior_sigma': 0.06267405394556017, 'normalization': 'none'}. Best is trial 272 with value: 0.5198344707489013.
Generating morgan fingerprints...
Generated fingerprints with 2048 features for 900 molecules
Data shape: X=(900, 2048), y=(900,)
Trial 1248: 5-fold CV loss = 0.6352
[I 2025-08-07 23:03:12,707] Trial 1248 finished with value: 0.6351616740226745 and parameters: {'fp_type': 'morgan', 'morgan_only_radius': 2, 'morgan_only_nBits': 2048, 'num_hidden_layers': 0, 'kl_weight': 0.0009851991301928708, 'lr': 0.0020971172899301137, 'batch_size': 32, 'dropout_rate': 0.48526334327170034, 'prior_mu': -0.0074985698554134485, 'prior_sigma': 0.058081985226944556, 'normalization': 'none'}. Best is trial 272 with value: 0.5198344707489013.
Generating morgan fingerprints...
Generated fingerprints with 2048 features for 900 molecules
Data shape: X=(900, 2048), y=(900,)
Trial 1246: 5-fold CV loss = 0.5214
[I 2025-08-07 23:03:30,155] Trial 1246 finished with value: 0.5214084327220917 and parameters: {'fp_type': 'morgan', 'morgan_only_radius': 2, 'morgan_only_nBits': 2048, 'num_hidden_layers': 3, 'hidden_dim_0': 512, 'hidden_dim_1': 128, 'hidden_dim_2': 512, 'kl_weight': 0.0004688275804338579, 'lr': 0.0020509106059764027, 'batch_size': 32, 'dropout_rate': 0.4512963623195549, 'prior_mu': 0.06264114241837351, 'prior_sigma': 0.058173632023105534, 'normalization': 'none'}. Best is trial 272 with value: 0.5198344707489013.
Generating morgan fingerprints...
Generated fingerprints with 2048 features for 900 molecules
Data shape: X=(900, 2048), y=(900,)
Trial 1247: 5-fold CV loss = 0.5526
[I 2025-08-07 23:03:31,154] Trial 1247 finished with value: 0.5525955319404602 and parameters: {'fp_type': 'morgan', 'morgan_only_radius': 2, 'morgan_only_nBits': 2048, 'num_hidden_layers': 3, 'hidden_dim_0': 512, 'hidden_dim_1': 128, 'hidden_dim_2': 512, 'kl_weight': 0.007052881223188748, 'lr': 0.0020633076802153314, 'batch_size': 32, 'dropout_rate': 0.24890560082486884, 'prior_mu': -0.022695539352991307, 'prior_sigma': 0.05810768796748222, 'normalization': 'none'}. Best is trial 272 with value: 0.5198344707489013.
Generating morgan fingerprints...
Generated fingerprints with 2048 features for 900 molecules
Data shape: X=(900, 2048), y=(900,)
Trial 1249: 5-fold CV loss = 1.1369
[I 2025-08-07 23:03:34,196] Trial 1249 finished with value: 1.1368841648101806 and parameters: {'fp_type': 'morgan', 'morgan_only_radius': 2, 'morgan_only_nBits': 2048, 'num_hidden_layers': 3, 'hidden_dim_0': 512, 'hidden_dim_1': 128, 'hidden_dim_2': 512, 'kl_weight': 0.00031819823169661595, 'lr': 0.0017915960565388694, 'batch_size': 64, 'dropout_rate': 0.451478548153826, 'prior_mu': -0.023250857087163464, 'prior_sigma': 0.07333986183317247, 'normalization': 'none'}. Best is trial 272 with value: 0.5198344707489013.
Generating morgan fingerprints...
Generated fingerprints with 2048 features for 900 molecules
Data shape: X=(900, 2048), y=(900,)
Trial 1240: 5-fold CV loss = 1.0194
[I 2025-08-07 23:03:40,859] Trial 1240 finished with value: 1.0193782567977905 and parameters: {'fp_type': 'morgan', 'morgan_only_radius': 2, 'morgan_only_nBits': 2048, 'num_hidden_layers': 3, 'hidden_dim_0': 512, 'hidden_dim_1': 128, 'hidden_dim_2': 256, 'kl_weight': 0.004422792496935755, 'lr': 0.00197035571581375, 'batch_size': 32, 'dropout_rate': 0.46317637569460596, 'prior_mu': 0.004744762898125046, 'prior_sigma': 0.16708121461200245, 'normalization': 'none'}. Best is trial 272 with value: 0.5198344707489013.
Generating morgan fingerprints...
Generated fingerprints with 2048 features for 900 molecules
Data shape: X=(900, 2048), y=(900,)
Trial 1250: 5-fold CV loss = 0.7032
[I 2025-08-07 23:03:47,455] Trial 1250 finished with value: 0.7032065033912659 and parameters: {'fp_type': 'morgan', 'morgan_only_radius': 2, 'morgan_only_nBits': 2048, 'num_hidden_layers': 3, 'hidden_dim_0': 512, 'hidden_dim_1': 128, 'hidden_dim_2': 512, 'kl_weight': 0.0004748672834889948, 'lr': 0.0017274191105853824, 'batch_size': 64, 'dropout_rate': 0.4548705573057316, 'prior_mu': 0.039760372915054826, 'prior_sigma': 0.0551592349236324, 'normalization': 'none'}. Best is trial 272 with value: 0.5198344707489013.
Generating morgan fingerprints...
Generated fingerprints with 2048 features for 900 molecules
Data shape: X=(900, 2048), y=(900,)
Trial 1251: 5-fold CV loss = 0.6892
[I 2025-08-07 23:03:53,296] Trial 1251 finished with value: 0.6891757011413574 and parameters: {'fp_type': 'morgan', 'morgan_only_radius': 2, 'morgan_only_nBits': 2048, 'num_hidden_layers': 3, 'hidden_dim_0': 256, 'hidden_dim_1': 128, 'hidden_dim_2': 512, 'kl_weight': 0.0004604138392997558, 'lr': 0.001779638094177247, 'batch_size': 64, 'dropout_rate': 0.44583493872800095, 'prior_mu': 0.03635809187387963, 'prior_sigma': 0.05248303512787747, 'normalization': 'none'}. Best is trial 272 with value: 0.5198344707489013.
Generating morgan fingerprints...
Generated fingerprints with 2048 features for 900 molecules
Data shape: X=(900, 2048), y=(900,)
Trial 1252: 5-fold CV loss = 0.6315
[I 2025-08-07 23:04:45,745] Trial 1252 finished with value: 0.6315405488014221 and parameters: {'fp_type': 'morgan', 'morgan_only_radius': 2, 'morgan_only_nBits': 2048, 'num_hidden_layers': 3, 'hidden_dim_0': 512, 'hidden_dim_1': 128, 'hidden_dim_2': 512, 'kl_weight': 0.00023253080878737756, 'lr': 0.0016059745364329693, 'batch_size': 32, 'dropout_rate': 0.44393410778369785, 'prior_mu': 0.05383791129754744, 'prior_sigma': 0.04670735392542525, 'normalization': 'none'}. Best is trial 272 with value: 0.5198344707489013.
Generating morgan fingerprints...
Generated fingerprints with 2048 features for 900 molecules
Data shape: X=(900, 2048), y=(900,)
Trial 1254: 5-fold CV loss = 0.6692
[I 2025-08-07 23:04:48,783] Trial 1254 finished with value: 0.6691673219203949 and parameters: {'fp_type': 'morgan', 'morgan_only_radius': 2, 'morgan_only_nBits': 2048, 'num_hidden_layers': 3, 'hidden_dim_0': 512, 'hidden_dim_1': 128, 'hidden_dim_2': 512, 'kl_weight': 0.0003664893466471178, 'lr': 0.001608909747100954, 'batch_size': 32, 'dropout_rate': 0.4451688045979903, 'prior_mu': 0.08349746432490729, 'prior_sigma': 0.053614899560104894, 'normalization': 'none'}. Best is trial 272 with value: 0.5198344707489013.
Generating morgan fingerprints...
Generated fingerprints with 2048 features for 900 molecules
Data shape: X=(900, 2048), y=(900,)
Trial 1255: 5-fold CV loss = 0.5417
[I 2025-08-07 23:05:44,537] Trial 1255 finished with value: 0.5417051136493682 and parameters: {'fp_type': 'morgan', 'morgan_only_radius': 2, 'morgan_only_nBits': 2048, 'num_hidden_layers': 3, 'hidden_dim_0': 512, 'hidden_dim_1': 128, 'hidden_dim_2': 512, 'kl_weight': 0.0003995967307901182, 'lr': 0.0018365600098513458, 'batch_size': 32, 'dropout_rate': 0.446238428494941, 'prior_mu': 0.024181318149075013, 'prior_sigma': 0.05413531987334352, 'normalization': 'none'}. Best is trial 272 with value: 0.5198344707489013.
Generating morgan fingerprints...
Generated fingerprints with 2048 features for 900 molecules
Data shape: X=(900, 2048), y=(900,)
Trial 1257: 5-fold CV loss = 0.5566
[I 2025-08-07 23:05:49,323] Trial 1257 finished with value: 0.5565754175186157 and parameters: {'fp_type': 'morgan', 'morgan_only_radius': 2, 'morgan_only_nBits': 2048, 'num_hidden_layers': 3, 'hidden_dim_0': 512, 'hidden_dim_1': 128, 'hidden_dim_2': 512, 'kl_weight': 0.00042979630838945154, 'lr': 0.0018734729706296773, 'batch_size': 32, 'dropout_rate': 0.32306841677391157, 'prior_mu': 0.06986710343066126, 'prior_sigma': 0.041894587441482264, 'normalization': 'none'}. Best is trial 272 with value: 0.5198344707489013.
Generating morgan_rdkit fingerprints...
Generated fingerprints with 768 features for 900 molecules
Data shape: X=(900, 768), y=(900,)
Trial 1256: 5-fold CV loss = 0.6778
[I 2025-08-07 23:05:54,577] Trial 1256 finished with value: 0.6777645945549011 and parameters: {'fp_type': 'morgan', 'morgan_only_radius': 2, 'morgan_only_nBits': 2048, 'num_hidden_layers': 3, 'hidden_dim_0': 512, 'hidden_dim_1': 128, 'hidden_dim_2': 512, 'kl_weight': 0.00038203281498787604, 'lr': 0.00012169251759956176, 'batch_size': 32, 'dropout_rate': 0.4479731650679439, 'prior_mu': 0.03420293404384517, 'prior_sigma': 0.054427424339908353, 'normalization': 'none'}. Best is trial 272 with value: 0.5198344707489013.
Generating morgan_rdkit fingerprints...
Generated fingerprints with 768 features for 900 molecules
Data shape: X=(900, 768), y=(900,)
Trial 1259: 5-fold CV loss = 0.5694
[I 2025-08-07 23:06:53,613] Trial 1259 finished with value: 0.5694406569004059 and parameters: {'fp_type': 'morgan_rdkit', 'combined_morgan_radius': 2, 'combined_morgan_nBits': 512, 'combined_rdkit_maxPath': 8, 'combined_rdkit_nBits': 256, 'num_hidden_layers': 3, 'hidden_dim_0': 512, 'hidden_dim_1': 128, 'hidden_dim_2': 512, 'kl_weight': 0.000352061017205734, 'lr': 0.0013960734751484252, 'batch_size': 32, 'dropout_rate': 0.42563520029637225, 'prior_mu': 0.04722370943165442, 'prior_sigma': 0.056506171744762114, 'normalization': 'none'}. Best is trial 272 with value: 0.5198344707489013.
Generating morgan fingerprints...
Generated fingerprints with 2048 features for 900 molecules
Data shape: X=(900, 2048), y=(900,)
Trial 1258: 5-fold CV loss = 0.5513
