[I 2025-08-08 01:24:11,299] Trial 1633 finished with value: 0.7519008636474609 and parameters: {'fp_type': 'morgan', 'morgan_only_radius': 2, 'morgan_only_nBits': 2048, 'num_hidden_layers': 3, 'hidden_dim_0': 512, 'hidden_dim_1': 128, 'hidden_dim_2': 512, 'kl_weight': 0.0008093648172582989, 'lr': 0.00011291410749855706, 'batch_size': 32, 'dropout_rate': 0.4136273314487934, 'prior_mu': 0.03805626968240174, 'prior_sigma': 0.06651803761307198, 'normalization': 'none'}. Best is trial 1528 with value: 0.5170644640922546.
Generating morgan fingerprints...
Generated fingerprints with 2048 features for 900 molecules
Data shape: X=(900, 2048), y=(900,)
Trial 1636: 5-fold CV loss = 0.5202
[I 2025-08-08 01:24:18,262] Trial 1636 finished with value: 0.520215779542923 and parameters: {'fp_type': 'morgan', 'morgan_only_radius': 2, 'morgan_only_nBits': 2048, 'num_hidden_layers': 3, 'hidden_dim_0': 512, 'hidden_dim_1': 128, 'hidden_dim_2': 512, 'kl_weight': 0.0006621202671697884, 'lr': 0.002642116424436659, 'batch_size': 32, 'dropout_rate': 0.4263255101827257, 'prior_mu': 0.038261806180806705, 'prior_sigma': 0.06651302145777618, 'normalization': 'none'}. Best is trial 1528 with value: 0.5170644640922546.
Generating morgan fingerprints...
Generated fingerprints with 2048 features for 900 molecules
Data shape: X=(900, 2048), y=(900,)
Trial 1638: 5-fold CV loss = 0.8110
[I 2025-08-08 01:24:56,057] Trial 1638 finished with value: 0.8109946131706238 and parameters: {'fp_type': 'morgan', 'morgan_only_radius': 2, 'morgan_only_nBits': 2048, 'num_hidden_layers': 3, 'hidden_dim_0': 512, 'hidden_dim_1': 128, 'hidden_dim_2': 512, 'kl_weight': 0.000838709588437466, 'lr': 0.0007740754771102133, 'batch_size': 32, 'dropout_rate': 0.4131559596077257, 'prior_mu': 0.04450267988946999, 'prior_sigma': 0.06616024174243558, 'normalization': 'none'}. Best is trial 1528 with value: 0.5170644640922546.
Generating morgan fingerprints...
Generated fingerprints with 2048 features for 900 molecules
Data shape: X=(900, 2048), y=(900,)
Trial 1641: 5-fold CV loss = 0.8428
[I 2025-08-08 01:25:06,994] Trial 1641 finished with value: 0.8427879691123963 and parameters: {'fp_type': 'morgan', 'morgan_only_radius': 3, 'morgan_only_nBits': 2048, 'num_hidden_layers': 3, 'hidden_dim_0': 512, 'hidden_dim_1': 128, 'hidden_dim_2': 512, 'kl_weight': 0.0006540590091802314, 'lr': 0.0028133269087886937, 'batch_size': 128, 'dropout_rate': 0.4215177374856399, 'prior_mu': 0.029510457571916802, 'prior_sigma': 0.06716114344287794, 'normalization': 'none'}. Best is trial 1528 with value: 0.5170644640922546.
Generating morgan fingerprints...
Generated fingerprints with 2048 features for 900 molecules
Data shape: X=(900, 2048), y=(900,)
Trial 1637: 5-fold CV loss = 0.5358
[I 2025-08-08 01:25:22,476] Trial 1637 finished with value: 0.5357973277568817 and parameters: {'fp_type': 'morgan', 'morgan_only_radius': 3, 'morgan_only_nBits': 2048, 'num_hidden_layers': 3, 'hidden_dim_0': 512, 'hidden_dim_1': 128, 'hidden_dim_2': 512, 'kl_weight': 0.0008194886345922308, 'lr': 0.002567506171050685, 'batch_size': 32, 'dropout_rate': 0.4153031874540881, 'prior_mu': 0.03141497189062351, 'prior_sigma': 0.06659100980173727, 'normalization': 'none'}. Best is trial 1528 with value: 0.5170644640922546.
Generating morgan fingerprints...
Generated fingerprints with 2048 features for 900 molecules
Data shape: X=(900, 2048), y=(900,)
Trial 1640: 5-fold CV loss = 0.5368
[I 2025-08-08 01:25:23,313] Trial 1640 finished with value: 0.5367826581001282 and parameters: {'fp_type': 'morgan', 'morgan_only_radius': 3, 'morgan_only_nBits': 2048, 'num_hidden_layers': 3, 'hidden_dim_0': 512, 'hidden_dim_1': 128, 'hidden_dim_2': 512, 'kl_weight': 0.0006303698103630279, 'lr': 0.00275648151477965, 'batch_size': 32, 'dropout_rate': 0.41905009780241975, 'prior_mu': 0.02832164295840684, 'prior_sigma': 0.06754211793790757, 'normalization': 'none'}. Best is trial 1528 with value: 0.5170644640922546.
Generating morgan fingerprints...
Generated fingerprints with 2048 features for 900 molecules
Data shape: X=(900, 2048), y=(900,)
Trial 1642: 5-fold CV loss = 0.5714
[I 2025-08-08 01:26:02,936] Trial 1642 finished with value: 0.5713662266731262 and parameters: {'fp_type': 'morgan', 'morgan_only_radius': 2, 'morgan_only_nBits': 2048, 'num_hidden_layers': 3, 'hidden_dim_0': 64, 'hidden_dim_1': 1024, 'hidden_dim_2': 1024, 'kl_weight': 0.0006377975838045789, 'lr': 0.0026639670040857727, 'batch_size': 32, 'dropout_rate': 0.42699175105733095, 'prior_mu': 0.0428354733296684, 'prior_sigma': 0.06773887493053002, 'normalization': 'none'}. Best is trial 1528 with value: 0.5170644640922546.
Generating morgan fingerprints...
Generated fingerprints with 2048 features for 900 molecules
Data shape: X=(900, 2048), y=(900,)
Trial 1645: 5-fold CV loss = 0.7148
[I 2025-08-08 01:26:22,794] Trial 1645 finished with value: 0.7147915303707123 and parameters: {'fp_type': 'morgan', 'morgan_only_radius': 2, 'morgan_only_nBits': 2048, 'num_hidden_layers': 3, 'hidden_dim_0': 512, 'hidden_dim_1': 128, 'hidden_dim_2': 512, 'kl_weight': 0.0006891485716220242, 'lr': 0.002587389751255106, 'batch_size': 64, 'dropout_rate': 0.43327038228162257, 'prior_mu': 0.04434095938966598, 'prior_sigma': 0.06396291571045515, 'normalization': 'none'}. Best is trial 1528 with value: 0.5170644640922546.
Generating morgan fingerprints...
Generated fingerprints with 2048 features for 900 molecules
Data shape: X=(900, 2048), y=(900,)
Trial 1644: 5-fold CV loss = 0.5473
[I 2025-08-08 01:26:50,815] Trial 1644 finished with value: 0.5472567439079284 and parameters: {'fp_type': 'morgan', 'morgan_only_radius': 2, 'morgan_only_nBits': 2048, 'num_hidden_layers': 3, 'hidden_dim_0': 64, 'hidden_dim_1': 128, 'hidden_dim_2': 512, 'kl_weight': 0.0006393208168699892, 'lr': 0.0030166407410846105, 'batch_size': 32, 'dropout_rate': 0.42970521369654346, 'prior_mu': 0.04242548375594568, 'prior_sigma': 0.06394968904104524, 'normalization': 'none'}. Best is trial 1528 with value: 0.5170644640922546.
Generating morgan fingerprints...
Generated fingerprints with 2048 features for 900 molecules
Data shape: X=(900, 2048), y=(900,)
Trial 1646: 5-fold CV loss = 0.5253
[I 2025-08-08 01:27:21,498] Trial 1646 finished with value: 0.5253445267677307 and parameters: {'fp_type': 'morgan', 'morgan_only_radius': 2, 'morgan_only_nBits': 2048, 'num_hidden_layers': 3, 'hidden_dim_0': 256, 'hidden_dim_1': 128, 'hidden_dim_2': 512, 'kl_weight': 0.0005586685320116772, 'lr': 0.003078948030011589, 'batch_size': 32, 'dropout_rate': 0.42614257248486953, 'prior_mu': 0.041808784215118966, 'prior_sigma': 0.0640014481543976, 'normalization': 'none'}. Best is trial 1528 with value: 0.5170644640922546.
Generating morgan fingerprints...
Generated fingerprints with 2048 features for 900 molecules
Data shape: X=(900, 2048), y=(900,)
Trial 1643: 5-fold CV loss = 0.5359
[I 2025-08-08 01:27:31,325] Trial 1643 finished with value: 0.5358920991420746 and parameters: {'fp_type': 'morgan', 'morgan_only_radius': 2, 'morgan_only_nBits': 2048, 'num_hidden_layers': 3, 'hidden_dim_0': 64, 'hidden_dim_1': 128, 'hidden_dim_2': 512, 'kl_weight': 0.0006471699142820389, 'lr': 0.002658084505061594, 'batch_size': 32, 'dropout_rate': 0.42636276036324755, 'prior_mu': 0.04111853793706434, 'prior_sigma': 0.06797237931315833, 'normalization': 'none'}. Best is trial 1528 with value: 0.5170644640922546.
Generating morgan fingerprints...
Generated fingerprints with 2048 features for 900 molecules
Data shape: X=(900, 2048), y=(900,)
Trial 1639: 5-fold CV loss = 0.5347
[I 2025-08-08 01:27:43,065] Trial 1639 finished with value: 0.5346718549728393 and parameters: {'fp_type': 'morgan', 'morgan_only_radius': 3, 'morgan_only_nBits': 2048, 'num_hidden_layers': 3, 'hidden_dim_0': 512, 'hidden_dim_1': 128, 'hidden_dim_2': 512, 'kl_weight': 0.0006889543738219008, 'lr': 0.0026081679589043867, 'batch_size': 32, 'dropout_rate': 0.42247133135976106, 'prior_mu': 0.028972826695620176, 'prior_sigma': 0.05602632825400022, 'normalization': 'none'}. Best is trial 1528 with value: 0.5170644640922546.
Generating morgan fingerprints...
Generated fingerprints with 2048 features for 900 molecules
Data shape: X=(900, 2048), y=(900,)
Trial 1647: 5-fold CV loss = 0.5590
[I 2025-08-08 01:28:21,334] Trial 1647 finished with value: 0.5589809238910675 and parameters: {'fp_type': 'morgan', 'morgan_only_radius': 2, 'morgan_only_nBits': 2048, 'num_hidden_layers': 3, 'hidden_dim_0': 512, 'hidden_dim_1': 128, 'hidden_dim_2': 512, 'kl_weight': 0.0007336562981218825, 'lr': 0.0019357630048876739, 'batch_size': 32, 'dropout_rate': 0.39804686248569415, 'prior_mu': 0.031062402709653384, 'prior_sigma': 0.06839025707980902, 'normalization': 'none'}. Best is trial 1528 with value: 0.5170644640922546.
Generating morgan fingerprints...
Generated fingerprints with 2048 features for 900 molecules
Data shape: X=(900, 2048), y=(900,)
Trial 1648: 5-fold CV loss = 0.5196
[I 2025-08-08 01:28:45,441] Trial 1648 finished with value: 0.5196030735969543 and parameters: {'fp_type': 'morgan', 'morgan_only_radius': 2, 'morgan_only_nBits': 2048, 'num_hidden_layers': 3, 'hidden_dim_0': 512, 'hidden_dim_1': 128, 'hidden_dim_2': 512, 'kl_weight': 0.00068911357046255, 'lr': 0.0019506329492667727, 'batch_size': 32, 'dropout_rate': 0.4089430938463561, 'prior_mu': 0.03212286301164362, 'prior_sigma': 0.06742971657960176, 'normalization': 'none'}. Best is trial 1528 with value: 0.5170644640922546.
Generating morgan fingerprints...
Generated fingerprints with 2048 features for 900 molecules
Data shape: X=(900, 2048), y=(900,)
Trial 1652: 5-fold CV loss = 0.7238
[I 2025-08-08 01:29:26,842] Trial 1652 finished with value: 0.7237503051757812 and parameters: {'fp_type': 'morgan', 'morgan_only_radius': 2, 'morgan_only_nBits': 2048, 'num_hidden_layers': 3, 'hidden_dim_0': 512, 'hidden_dim_1': 128, 'hidden_dim_2': 256, 'kl_weight': 0.0005765404669341616, 'lr': 0.0018824175411585624, 'batch_size': 32, 'dropout_rate': 0.4208329873431443, 'prior_mu': 0.03302413054218909, 'prior_sigma': 0.069266807648633, 'normalization': 'none'}. Best is trial 1528 with value: 0.5170644640922546.
Generating morgan fingerprints...
Generated fingerprints with 2048 features for 900 molecules
Data shape: X=(900, 2048), y=(900,)
Trial 1649: 5-fold CV loss = 0.5196
[I 2025-08-08 01:29:51,179] Trial 1649 finished with value: 0.5196378052234649 and parameters: {'fp_type': 'morgan', 'morgan_only_radius': 2, 'morgan_only_nBits': 2048, 'num_hidden_layers': 3, 'hidden_dim_0': 512, 'hidden_dim_1': 128, 'hidden_dim_2': 512, 'kl_weight': 0.0007272685243254978, 'lr': 0.0019950592783056025, 'batch_size': 32, 'dropout_rate': 0.4373640388792435, 'prior_mu': 0.033292453375305765, 'prior_sigma': 0.07004312320857772, 'normalization': 'none'}. Best is trial 1528 with value: 0.5170644640922546.
Generating morgan fingerprints...
Generated fingerprints with 2048 features for 900 molecules
Data shape: X=(900, 2048), y=(900,)
Trial 1651: 5-fold CV loss = 0.5308
[I 2025-08-08 01:29:53,811] Trial 1651 finished with value: 0.5308484911918641 and parameters: {'fp_type': 'morgan', 'morgan_only_radius': 2, 'morgan_only_nBits': 2048, 'num_hidden_layers': 3, 'hidden_dim_0': 512, 'hidden_dim_1': 128, 'hidden_dim_2': 512, 'kl_weight': 0.0005443304610303428, 'lr': 0.0020511122440819434, 'batch_size': 32, 'dropout_rate': 0.4307430658392373, 'prior_mu': 0.049307568830533645, 'prior_sigma': 0.0628815460318987, 'normalization': 'none'}. Best is trial 1528 with value: 0.5170644640922546.
Generating morgan fingerprints...
Generated fingerprints with 2048 features for 900 molecules
Data shape: X=(900, 2048), y=(900,)
Trial 1653: 5-fold CV loss = 0.5199
[I 2025-08-08 01:31:05,724] Trial 1653 finished with value: 0.5198508679866791 and parameters: {'fp_type': 'morgan', 'morgan_only_radius': 2, 'morgan_only_nBits': 2048, 'num_hidden_layers': 3, 'hidden_dim_0': 512, 'hidden_dim_1': 128, 'hidden_dim_2': 512, 'kl_weight': 0.000544314746268981, 'lr': 0.0018578337413117617, 'batch_size': 32, 'dropout_rate': 0.4154602916196964, 'prior_mu': 0.03593277704682043, 'prior_sigma': 0.07019304852857006, 'normalization': 'none'}. Best is trial 1528 with value: 0.5170644640922546.
Generating morgan fingerprints...
Generated fingerprints with 2048 features for 900 molecules
Data shape: X=(900, 2048), y=(900,)
Trial 1655: 5-fold CV loss = 0.5224
[I 2025-08-08 01:31:44,633] Trial 1655 finished with value: 0.5224248170852661 and parameters: {'fp_type': 'morgan', 'morgan_only_radius': 2, 'morgan_only_nBits': 2048, 'num_hidden_layers': 3, 'hidden_dim_0': 512, 'hidden_dim_1': 128, 'hidden_dim_2': 512, 'kl_weight': 0.0007616880442876862, 'lr': 0.001850883965641763, 'batch_size': 32, 'dropout_rate': 0.40112887124946073, 'prior_mu': 0.03635708511433491, 'prior_sigma': 0.06983380385725677, 'normalization': 'none'}. Best is trial 1528 with value: 0.5170644640922546.
Generating morgan fingerprints...
Generated fingerprints with 2048 features for 900 molecules
Data shape: X=(900, 2048), y=(900,)
Trial 1656: 5-fold CV loss = 0.7417
[I 2025-08-08 01:31:48,619] Trial 1656 finished with value: 0.7416905641555787 and parameters: {'fp_type': 'morgan', 'morgan_only_radius': 2, 'morgan_only_nBits': 2048, 'num_hidden_layers': 3, 'hidden_dim_0': 512, 'hidden_dim_1': 128, 'hidden_dim_2': 512, 'kl_weight': 0.0007481811882215251, 'lr': 0.0017630815383060268, 'batch_size': 32, 'dropout_rate': 0.44530720624702397, 'prior_mu': 0.03662714759711447, 'prior_sigma': 0.07260492458094092, 'normalization': 'none'}. Best is trial 1528 with value: 0.5170644640922546.
Generating morgan fingerprints...
Generated fingerprints with 2048 features for 900 molecules
Data shape: X=(900, 2048), y=(900,)
Trial 1650: 5-fold CV loss = 0.5242
[I 2025-08-08 01:32:19,327] Trial 1650 finished with value: 0.5241767585277557 and parameters: {'fp_type': 'morgan', 'morgan_only_radius': 2, 'morgan_only_nBits': 2048, 'num_hidden_layers': 3, 'hidden_dim_0': 512, 'hidden_dim_1': 128, 'hidden_dim_2': 512, 'kl_weight': 0.0007581320290932245, 'lr': 0.0020446520969577445, 'batch_size': 32, 'dropout_rate': 0.44212751358238417, 'prior_mu': 0.05029251063591068, 'prior_sigma': 0.06820553602297322, 'normalization': 'none'}. Best is trial 1528 with value: 0.5170644640922546.
Generating morgan fingerprints...
Generated fingerprints with 2048 features for 900 molecules
Data shape: X=(900, 2048), y=(900,)
Trial 1657: 5-fold CV loss = 0.6125
[I 2025-08-08 01:32:48,821] Trial 1657 finished with value: 0.612533301115036 and parameters: {'fp_type': 'morgan', 'morgan_only_radius': 2, 'morgan_only_nBits': 2048, 'num_hidden_layers': 3, 'hidden_dim_0': 512, 'hidden_dim_1': 128, 'hidden_dim_2': 128, 'kl_weight': 0.0007416731995773268, 'lr': 0.0017211862988189646, 'batch_size': 32, 'dropout_rate': 0.39495146355202493, 'prior_mu': 0.03816349738421374, 'prior_sigma': 0.07290516715178778, 'normalization': 'none'}. Best is trial 1528 with value: 0.5170644640922546.
Generating morgan fingerprints...
Generated fingerprints with 2048 features for 900 molecules
Data shape: X=(900, 2048), y=(900,)
Trial 1654: 5-fold CV loss = 0.5184
[I 2025-08-08 01:32:56,864] Trial 1654 finished with value: 0.5184055924415588 and parameters: {'fp_type': 'morgan', 'morgan_only_radius': 2, 'morgan_only_nBits': 2048, 'num_hidden_layers': 3, 'hidden_dim_0': 512, 'hidden_dim_1': 128, 'hidden_dim_2': 512, 'kl_weight': 0.0007812459370822217, 'lr': 0.0018463666776806758, 'batch_size': 32, 'dropout_rate': 0.41863624682054007, 'prior_mu': 0.048502293598304075, 'prior_sigma': 0.06861720635346208, 'normalization': 'none'}. Best is trial 1528 with value: 0.5170644640922546.
Generating morgan fingerprints...
Generated fingerprints with 2048 features for 900 molecules
Data shape: X=(900, 2048), y=(900,)
Trial 1658: 5-fold CV loss = 0.5761
[I 2025-08-08 01:33:19,726] Trial 1658 finished with value: 0.5760522484779358 and parameters: {'fp_type': 'morgan', 'morgan_only_radius': 2, 'morgan_only_nBits': 2048, 'num_hidden_layers': 3, 'hidden_dim_0': 512, 'hidden_dim_1': 128, 'hidden_dim_2': 512, 'kl_weight': 0.0005220623407065423, 'lr': 0.001768086537481574, 'batch_size': 32, 'dropout_rate': 0.4082603973753692, 'prior_mu': 0.03744461614773098, 'prior_sigma': 0.07163027579280917, 'normalization': 'none'}. Best is trial 1528 with value: 0.5170644640922546.
Generating morgan fingerprints...
Generated fingerprints with 2048 features for 900 molecules
Data shape: X=(900, 2048), y=(900,)
Trial 1660: 5-fold CV loss = 0.6953
[I 2025-08-08 01:33:45,052] Trial 1660 finished with value: 0.695345276594162 and parameters: {'fp_type': 'morgan', 'morgan_only_radius': 2, 'morgan_only_nBits': 2048, 'num_hidden_layers': 3, 'hidden_dim_0': 1024, 'hidden_dim_1': 128, 'hidden_dim_2': 512, 'kl_weight': 0.0005304440199267984, 'lr': 0.0017950590170999765, 'batch_size': 32, 'dropout_rate': 0.41803272826836874, 'prior_mu': 0.0249404990711811, 'prior_sigma': 0.07235425502029567, 'normalization': 'none'}. Best is trial 1528 with value: 0.5170644640922546.
Generating morgan fingerprints...
Generated fingerprints with 2048 features for 900 molecules
Data shape: X=(900, 2048), y=(900,)
Trial 1662: 5-fold CV loss = 0.6396
[I 2025-08-08 01:34:29,886] Trial 1662 finished with value: 0.6396494925022125 and parameters: {'fp_type': 'morgan', 'morgan_only_radius': 2, 'morgan_only_nBits': 2048, 'num_hidden_layers': 3, 'hidden_dim_0': 512, 'hidden_dim_1': 128, 'hidden_dim_2': 512, 'kl_weight': 0.0005965461500293367, 'lr': 0.0015933444487404127, 'batch_size': 32, 'dropout_rate': 0.40546016455194145, 'prior_mu': 0.02773393090179018, 'prior_sigma': 0.06990283387182215, 'normalization': 'none'}. Best is trial 1528 with value: 0.5170644640922546.
Generating morgan fingerprints...
Generated fingerprints with 2048 features for 900 molecules
Data shape: X=(900, 2048), y=(900,)
Trial 1664: 5-fold CV loss = 0.8545
[I 2025-08-08 01:34:39,728] Trial 1664 finished with value: 0.854456079006195 and parameters: {'fp_type': 'morgan', 'morgan_only_radius': 2, 'morgan_only_nBits': 2048, 'num_hidden_layers': 3, 'hidden_dim_0': 512, 'hidden_dim_1': 128, 'hidden_dim_2': 512, 'kl_weight': 0.0006774447632580418, 'lr': 0.001601963977206072, 'batch_size': 128, 'dropout_rate': 0.40764458437817264, 'prior_mu': 0.04199243251299869, 'prior_sigma': 0.07344896146186519, 'normalization': 'none'}. Best is trial 1528 with value: 0.5170644640922546.
Generating morgan fingerprints...
Generated fingerprints with 2048 features for 900 molecules
Data shape: X=(900, 2048), y=(900,)
Trial 1663: 5-fold CV loss = 0.5786
[I 2025-08-08 01:35:11,871] Trial 1663 finished with value: 0.5785730242729187 and parameters: {'fp_type': 'morgan', 'morgan_only_radius': 2, 'morgan_only_nBits': 2048, 'num_hidden_layers': 3, 'hidden_dim_0': 512, 'hidden_dim_1': 128, 'hidden_dim_2': 512, 'kl_weight': 0.0006028881605091248, 'lr': 0.0017503728955718986, 'batch_size': 32, 'dropout_rate': 0.4077645820850718, 'prior_mu': 0.04457798106940138, 'prior_sigma': 0.07432787989474063, 'normalization': 'none'}. Best is trial 1528 with value: 0.5170644640922546.
Generating morgan fingerprints...
Generated fingerprints with 2048 features for 900 molecules
Data shape: X=(900, 2048), y=(900,)
Trial 1661: 5-fold CV loss = 0.5706
[I 2025-08-08 01:35:12,545] Trial 1661 finished with value: 0.570640605688095 and parameters: {'fp_type': 'morgan', 'morgan_only_radius': 2, 'morgan_only_nBits': 2048, 'num_hidden_layers': 3, 'hidden_dim_0': 1024, 'hidden_dim_1': 128, 'hidden_dim_2': 512, 'kl_weight': 0.0005387693209620749, 'lr': 0.0016424907549137645, 'batch_size': 32, 'dropout_rate': 0.40523522465732087, 'prior_mu': 0.028930547566921958, 'prior_sigma': 0.1361783169108677, 'normalization': 'none'}. Best is trial 1528 with value: 0.5170644640922546.
Generating morgan fingerprints...
Generated fingerprints with 2048 features for 900 molecules
Data shape: X=(900, 2048), y=(900,)
Trial 1666: 5-fold CV loss = 0.6550
[I 2025-08-08 01:36:04,840] Trial 1666 finished with value: 0.6549804449081421 and parameters: {'fp_type': 'morgan', 'morgan_only_radius': 2, 'morgan_only_nBits': 2048, 'num_hidden_layers': 3, 'hidden_dim_0': 512, 'hidden_dim_1': 128, 'hidden_dim_2': 1024, 'kl_weight': 0.0007129353643945529, 'lr': 0.0016896631666436762, 'batch_size': 32, 'dropout_rate': 0.41868610820712004, 'prior_mu': 0.0322548979868879, 'prior_sigma': 0.072756547171172, 'normalization': 'layer'}. Best is trial 1528 with value: 0.5170644640922546.
Generating morgan fingerprints...
Generated fingerprints with 2048 features for 900 molecules
Data shape: X=(900, 2048), y=(900,)
Trial 1659: 5-fold CV loss = 0.5276
[I 2025-08-08 01:36:14,262] Trial 1659 finished with value: 0.5275657296180725 and parameters: {'fp_type': 'morgan', 'morgan_only_radius': 2, 'morgan_only_nBits': 2048, 'num_hidden_layers': 3, 'hidden_dim_0': 1024, 'hidden_dim_1': 128, 'hidden_dim_2': 512, 'kl_weight': 0.0005661649361851838, 'lr': 0.0017557664164893126, 'batch_size': 32, 'dropout_rate': 0.3859104987819605, 'prior_mu': 0.025657939050139116, 'prior_sigma': 0.07370105282374809, 'normalization': 'none'}. Best is trial 1528 with value: 0.5170644640922546.
Generating morgan fingerprints...
Generated fingerprints with 2048 features for 900 molecules
Data shape: X=(900, 2048), y=(900,)
Trial 1665: 5-fold CV loss = 0.5261
[I 2025-08-08 01:36:17,029] Trial 1665 finished with value: 0.5260910928249359 and parameters: {'fp_type': 'morgan', 'morgan_only_radius': 2, 'morgan_only_nBits': 2048, 'num_hidden_layers': 3, 'hidden_dim_0': 512, 'hidden_dim_1': 128, 'hidden_dim_2': 512, 'kl_weight': 0.0005861869119816904, 'lr': 0.0018154262285358814, 'batch_size': 32, 'dropout_rate': 0.3984922673974862, 'prior_mu': 0.04540944176243496, 'prior_sigma': 0.07315938362427424, 'normalization': 'none'}. Best is trial 1528 with value: 0.5170644640922546.
Generating morgan fingerprints...
Generated fingerprints with 2048 features for 900 molecules
Data shape: X=(900, 2048), y=(900,)
Trial 1668: 5-fold CV loss = 0.8019
