[I 2025-08-07 16:41:57,036] Trial 239 finished with value: 0.5500804483890533 and parameters: {'fp_type': 'morgan', 'morgan_only_radius': 2, 'morgan_only_nBits': 1024, 'num_hidden_layers': 3, 'hidden_dim_0': 512, 'hidden_dim_1': 128, 'hidden_dim_2': 1024, 'kl_weight': 0.0003775304357093334, 'lr': 0.0027885455896397736, 'batch_size': 64, 'dropout_rate': 0.4644076052377434, 'prior_mu': 0.17622669972760294, 'prior_sigma': 0.06695657906783761, 'normalization': 'none'}. Best is trial 208 with value: 0.5269739389419555.
Generating morgan fingerprints...
Generated fingerprints with 1024 features for 900 molecules
Data shape: X=(900, 1024), y=(900,)
Trial 240: 5-fold CV loss = 0.5652
[I 2025-08-07 16:42:10,670] Trial 240 finished with value: 0.5651608228683471 and parameters: {'fp_type': 'morgan', 'morgan_only_radius': 2, 'morgan_only_nBits': 1024, 'num_hidden_layers': 3, 'hidden_dim_0': 64, 'hidden_dim_1': 128, 'hidden_dim_2': 1024, 'kl_weight': 0.00040311064251213603, 'lr': 0.0036988054468611474, 'batch_size': 64, 'dropout_rate': 0.4693486335655552, 'prior_mu': 0.19856184012069242, 'prior_sigma': 0.05336071240204832, 'normalization': 'none'}. Best is trial 208 with value: 0.5269739389419555.
Generating morgan fingerprints...
Generated fingerprints with 1024 features for 900 molecules
Data shape: X=(900, 1024), y=(900,)
Trial 242: 5-fold CV loss = 0.5436
[I 2025-08-07 16:42:29,566] Trial 242 finished with value: 0.5435989141464234 and parameters: {'fp_type': 'morgan', 'morgan_only_radius': 2, 'morgan_only_nBits': 1024, 'num_hidden_layers': 3, 'hidden_dim_0': 512, 'hidden_dim_1': 128, 'hidden_dim_2': 1024, 'kl_weight': 0.0004684017258155295, 'lr': 0.003791880695368653, 'batch_size': 64, 'dropout_rate': 0.4704913625960677, 'prior_mu': 0.15802635538631418, 'prior_sigma': 0.054185395993642624, 'normalization': 'none'}. Best is trial 208 with value: 0.5269739389419555.
Generating morgan fingerprints...
Generated fingerprints with 1024 features for 900 molecules
Data shape: X=(900, 1024), y=(900,)
Trial 243: 5-fold CV loss = 0.5309
[I 2025-08-07 16:42:42,829] Trial 243 finished with value: 0.5308505415916442 and parameters: {'fp_type': 'morgan', 'morgan_only_radius': 3, 'morgan_only_nBits': 1024, 'num_hidden_layers': 3, 'hidden_dim_0': 512, 'hidden_dim_1': 128, 'hidden_dim_2': 1024, 'kl_weight': 0.0006808784813018387, 'lr': 0.0029545145942555828, 'batch_size': 64, 'dropout_rate': 0.41457582773807045, 'prior_mu': 0.00521666385353621, 'prior_sigma': 0.048217138347362236, 'normalization': 'none'}. Best is trial 208 with value: 0.5269739389419555.
Generating morgan fingerprints...
Generated fingerprints with 1024 features for 900 molecules
Data shape: X=(900, 1024), y=(900,)
Trial 241: 5-fold CV loss = 0.5609
[I 2025-08-07 16:43:00,391] Trial 241 finished with value: 0.5608847141265869 and parameters: {'fp_type': 'morgan', 'morgan_only_radius': 2, 'morgan_only_nBits': 1024, 'num_hidden_layers': 3, 'hidden_dim_0': 64, 'hidden_dim_1': 128, 'hidden_dim_2': 1024, 'kl_weight': 0.0008799675073751774, 'lr': 0.002912256230145314, 'batch_size': 64, 'dropout_rate': 0.4704517536589785, 'prior_mu': 0.160807914336291, 'prior_sigma': 0.047802957200459316, 'normalization': 'none'}. Best is trial 208 with value: 0.5269739389419555.
Generating morgan fingerprints...
Generated fingerprints with 1024 features for 900 molecules
Data shape: X=(900, 1024), y=(900,)
Trial 244: 5-fold CV loss = 0.5472
[I 2025-08-07 16:43:08,131] Trial 244 finished with value: 0.5472317576408386 and parameters: {'fp_type': 'morgan', 'morgan_only_radius': 2, 'morgan_only_nBits': 1024, 'num_hidden_layers': 3, 'hidden_dim_0': 512, 'hidden_dim_1': 128, 'hidden_dim_2': 1024, 'kl_weight': 0.0004133889559981667, 'lr': 0.0029708592675439073, 'batch_size': 64, 'dropout_rate': 0.4943036965782017, 'prior_mu': 0.19098889874535724, 'prior_sigma': 0.04481651975677114, 'normalization': 'none'}. Best is trial 208 with value: 0.5269739389419555.
Generating morgan fingerprints...
Generated fingerprints with 1024 features for 900 molecules
Data shape: X=(900, 1024), y=(900,)
Trial 238: 5-fold CV loss = 0.7091
[I 2025-08-07 16:43:08,770] Trial 238 finished with value: 0.7091018557548523 and parameters: {'fp_type': 'morgan', 'morgan_only_radius': 2, 'morgan_only_nBits': 1024, 'num_hidden_layers': 3, 'hidden_dim_0': 512, 'hidden_dim_1': 128, 'hidden_dim_2': 1024, 'kl_weight': 0.00041551714180448, 'lr': 0.002407151869210087, 'batch_size': 64, 'dropout_rate': 0.47112131242227445, 'prior_mu': 0.19733683409542938, 'prior_sigma': 0.18242890264689904, 'normalization': 'none'}. Best is trial 208 with value: 0.5269739389419555.
Generating morgan fingerprints...
Generated fingerprints with 1024 features for 900 molecules
Data shape: X=(900, 1024), y=(900,)
Trial 245: 5-fold CV loss = 0.5518
[I 2025-08-07 16:43:17,123] Trial 245 finished with value: 0.5518081307411193 and parameters: {'fp_type': 'morgan', 'morgan_only_radius': 3, 'morgan_only_nBits': 1024, 'num_hidden_layers': 3, 'hidden_dim_0': 512, 'hidden_dim_1': 128, 'hidden_dim_2': 1024, 'kl_weight': 0.0007568413159494647, 'lr': 0.002853987255281488, 'batch_size': 64, 'dropout_rate': 0.40390783239842154, 'prior_mu': 0.18724854385853015, 'prior_sigma': 0.04842241653386115, 'normalization': 'none'}. Best is trial 208 with value: 0.5269739389419555.
Generating morgan fingerprints...
Generated fingerprints with 1024 features for 900 molecules
Data shape: X=(900, 1024), y=(900,)
Trial 246: 5-fold CV loss = 0.6842
[I 2025-08-07 16:43:46,509] Trial 246 finished with value: 0.6841578543186188 and parameters: {'fp_type': 'morgan', 'morgan_only_radius': 3, 'morgan_only_nBits': 1024, 'num_hidden_layers': 3, 'hidden_dim_0': 512, 'hidden_dim_1': 128, 'hidden_dim_2': 1024, 'kl_weight': 0.000611949032767505, 'lr': 0.001901096655028035, 'batch_size': 64, 'dropout_rate': 0.4084014873871747, 'prior_mu': -0.010764056721012313, 'prior_sigma': 0.060642560361375344, 'normalization': 'none'}. Best is trial 208 with value: 0.5269739389419555.
Generating morgan fingerprints...
Generated fingerprints with 1024 features for 900 molecules
Data shape: X=(900, 1024), y=(900,)
Trial 249: 5-fold CV loss = 0.5732
[I 2025-08-07 16:43:55,978] Trial 249 finished with value: 0.5732314765453339 and parameters: {'fp_type': 'morgan', 'morgan_only_radius': 3, 'morgan_only_nBits': 1024, 'num_hidden_layers': 3, 'hidden_dim_0': 512, 'hidden_dim_1': 128, 'hidden_dim_2': 1024, 'kl_weight': 0.0006566976400557709, 'lr': 0.003420055931295179, 'batch_size': 64, 'dropout_rate': 0.3857957285821149, 'prior_mu': -0.0070836941896766726, 'prior_sigma': 0.05921553152963861, 'normalization': 'layer'}. Best is trial 208 with value: 0.5269739389419555.
Generating morgan fingerprints...
Generated fingerprints with 1024 features for 900 molecules
Data shape: X=(900, 1024), y=(900,)
Trial 247: 5-fold CV loss = 0.5623
[I 2025-08-07 16:43:56,612] Trial 247 finished with value: 0.5623187363147736 and parameters: {'fp_type': 'morgan', 'morgan_only_radius': 3, 'morgan_only_nBits': 1024, 'num_hidden_layers': 3, 'hidden_dim_0': 512, 'hidden_dim_1': 128, 'hidden_dim_2': 1024, 'kl_weight': 0.0006614598827286769, 'lr': 0.0027086061924434, 'batch_size': 64, 'dropout_rate': 0.40622657988384653, 'prior_mu': -0.00903676100454813, 'prior_sigma': 0.05890378981934502, 'normalization': 'none'}. Best is trial 208 with value: 0.5269739389419555.
Generating morgan fingerprints...
Generated fingerprints with 1024 features for 900 molecules
Data shape: X=(900, 1024), y=(900,)
Trial 251: 5-fold CV loss = 0.5414
[I 2025-08-07 16:44:25,343] Trial 251 finished with value: 0.5413989901542664 and parameters: {'fp_type': 'morgan', 'morgan_only_radius': 3, 'morgan_only_nBits': 1024, 'num_hidden_layers': 3, 'hidden_dim_0': 512, 'hidden_dim_1': 128, 'hidden_dim_2': 1024, 'kl_weight': 0.0004500763438463252, 'lr': 0.0037548582982703744, 'batch_size': 64, 'dropout_rate': 0.41861552382621275, 'prior_mu': 0.00488562843872755, 'prior_sigma': 0.0627286566992304, 'normalization': 'none'}. Best is trial 208 with value: 0.5269739389419555.
Generating morgan fingerprints...
Generated fingerprints with 1024 features for 900 molecules
Data shape: X=(900, 1024), y=(900,)
Trial 253: 5-fold CV loss = 0.7202
[I 2025-08-07 16:44:36,594] Trial 253 finished with value: 0.7202108979225159 and parameters: {'fp_type': 'morgan', 'morgan_only_radius': 2, 'morgan_only_nBits': 1024, 'num_hidden_layers': 1, 'hidden_dim_0': 512, 'kl_weight': 0.00027694402995151734, 'lr': 0.003207303813181267, 'batch_size': 64, 'dropout_rate': 0.3805953169941408, 'prior_mu': 0.01278561271759622, 'prior_sigma': 0.06890319722415054, 'normalization': 'none'}. Best is trial 208 with value: 0.5269739389419555.
Generating morgan fingerprints...
Generated fingerprints with 1024 features for 900 molecules
Data shape: X=(900, 1024), y=(900,)
Trial 252: 5-fold CV loss = 0.5488
[I 2025-08-07 16:44:40,141] Trial 252 finished with value: 0.5487847983837127 and parameters: {'fp_type': 'morgan', 'morgan_only_radius': 2, 'morgan_only_nBits': 1024, 'num_hidden_layers': 3, 'hidden_dim_0': 256, 'hidden_dim_1': 128, 'hidden_dim_2': 1024, 'kl_weight': 0.00027251074985863694, 'lr': 0.003911766151373526, 'batch_size': 64, 'dropout_rate': 0.3753265489631999, 'prior_mu': 0.003906657047698707, 'prior_sigma': 0.0648220648775898, 'normalization': 'none'}. Best is trial 208 with value: 0.5269739389419555.
Generating morgan fingerprints...
Generated fingerprints with 1024 features for 900 molecules
Data shape: X=(900, 1024), y=(900,)
Trial 250: 5-fold CV loss = 0.5840
[I 2025-08-07 16:44:42,980] Trial 250 finished with value: 0.5840492963790893 and parameters: {'fp_type': 'morgan', 'morgan_only_radius': 3, 'morgan_only_nBits': 1024, 'num_hidden_layers': 3, 'hidden_dim_0': 512, 'hidden_dim_1': 128, 'hidden_dim_2': 1024, 'kl_weight': 0.00048349265758701384, 'lr': 0.003402502668251599, 'batch_size': 64, 'dropout_rate': 0.4215326500973488, 'prior_mu': -0.007512151934722124, 'prior_sigma': 0.05739068482710112, 'normalization': 'layer'}. Best is trial 208 with value: 0.5269739389419555.
Generating morgan fingerprints...
Generated fingerprints with 1024 features for 900 molecules
Data shape: X=(900, 1024), y=(900,)
Trial 248: 5-fold CV loss = 0.6189
[I 2025-08-07 16:44:57,575] Trial 248 finished with value: 0.6188571870326995 and parameters: {'fp_type': 'morgan', 'morgan_only_radius': 3, 'morgan_only_nBits': 1024, 'num_hidden_layers': 3, 'hidden_dim_0': 512, 'hidden_dim_1': 128, 'hidden_dim_2': 1024, 'kl_weight': 0.00048152948369255564, 'lr': 0.001895906185799643, 'batch_size': 64, 'dropout_rate': 0.39438083579132466, 'prior_mu': 0.006575786398281658, 'prior_sigma': 0.05990259263362648, 'normalization': 'none'}. Best is trial 208 with value: 0.5269739389419555.
Generating morgan fingerprints...
Generated fingerprints with 1024 features for 900 molecules
Data shape: X=(900, 1024), y=(900,)
Trial 254: 5-fold CV loss = 0.5749
[I 2025-08-07 16:45:24,530] Trial 254 finished with value: 0.5749137580394745 and parameters: {'fp_type': 'morgan', 'morgan_only_radius': 2, 'morgan_only_nBits': 1024, 'num_hidden_layers': 3, 'hidden_dim_0': 256, 'hidden_dim_1': 1024, 'hidden_dim_2': 1024, 'kl_weight': 0.00038359489265094173, 'lr': 0.002670436581063858, 'batch_size': 64, 'dropout_rate': 0.3595175297047015, 'prior_mu': 0.034600418043284384, 'prior_sigma': 0.0517621873246585, 'normalization': 'none'}. Best is trial 208 with value: 0.5269739389419555.
Generating morgan fingerprints...
Generated fingerprints with 1024 features for 900 molecules
Data shape: X=(900, 1024), y=(900,)
Trial 255: 5-fold CV loss = 0.6282
[I 2025-08-07 16:45:31,121] Trial 255 finished with value: 0.6282033681869507 and parameters: {'fp_type': 'morgan', 'morgan_only_radius': 2, 'morgan_only_nBits': 1024, 'num_hidden_layers': 3, 'hidden_dim_0': 512, 'hidden_dim_1': 1024, 'hidden_dim_2': 1024, 'kl_weight': 0.0004976813027721678, 'lr': 0.0030324928434223805, 'batch_size': 64, 'dropout_rate': 0.4798231414343792, 'prior_mu': 0.09991091458383006, 'prior_sigma': 0.05536470411724495, 'normalization': 'none'}. Best is trial 208 with value: 0.5269739389419555.
Generating morgan fingerprints...
Generated fingerprints with 1024 features for 900 molecules
Data shape: X=(900, 1024), y=(900,)
Trial 256: 5-fold CV loss = 0.5993
[I 2025-08-07 16:45:45,316] Trial 256 finished with value: 0.5992960631847382 and parameters: {'fp_type': 'morgan', 'morgan_only_radius': 2, 'morgan_only_nBits': 1024, 'num_hidden_layers': 3, 'hidden_dim_0': 512, 'hidden_dim_1': 1024, 'hidden_dim_2': 1024, 'kl_weight': 0.00037166725481395293, 'lr': 0.0026494583413736836, 'batch_size': 64, 'dropout_rate': 0.36275641604476355, 'prior_mu': 0.034940401687516984, 'prior_sigma': 0.05092782352868008, 'normalization': 'none'}. Best is trial 208 with value: 0.5269739389419555.
Generating morgan fingerprints...
Generated fingerprints with 1024 features for 900 molecules
Data shape: X=(900, 1024), y=(900,)
Trial 257: 5-fold CV loss = 0.7355
[I 2025-08-07 16:45:56,554] Trial 257 finished with value: 0.7355244755744934 and parameters: {'fp_type': 'morgan', 'morgan_only_radius': 2, 'morgan_only_nBits': 1024, 'num_hidden_layers': 3, 'hidden_dim_0': 512, 'hidden_dim_1': 1024, 'hidden_dim_2': 1024, 'kl_weight': 0.00038711542545813123, 'lr': 0.0030235394504935505, 'batch_size': 64, 'dropout_rate': 0.3657907310570842, 'prior_mu': 0.025341015533060538, 'prior_sigma': 0.06983169628107831, 'normalization': 'none'}. Best is trial 208 with value: 0.5269739389419555.
Generating morgan fingerprints...
Generated fingerprints with 1024 features for 900 molecules
Data shape: X=(900, 1024), y=(900,)
Trial 259: 5-fold CV loss = 0.5460
[I 2025-08-07 16:46:01,225] Trial 259 finished with value: 0.5459980607032776 and parameters: {'fp_type': 'morgan', 'morgan_only_radius': 2, 'morgan_only_nBits': 1024, 'num_hidden_layers': 3, 'hidden_dim_0': 512, 'hidden_dim_1': 128, 'hidden_dim_2': 1024, 'kl_weight': 0.023781031435716613, 'lr': 0.004313120175145157, 'batch_size': 64, 'dropout_rate': 0.4535290374865001, 'prior_mu': -0.021432051193213498, 'prior_sigma': 0.07002894267995478, 'normalization': 'none'}. Best is trial 208 with value: 0.5269739389419555.
Generating morgan fingerprints...
Generated fingerprints with 1024 features for 900 molecules
Data shape: X=(900, 1024), y=(900,)
Trial 258: 5-fold CV loss = 0.5354
[I 2025-08-07 16:46:05,250] Trial 258 finished with value: 0.5354406237602234 and parameters: {'fp_type': 'morgan', 'morgan_only_radius': 2, 'morgan_only_nBits': 1024, 'num_hidden_layers': 3, 'hidden_dim_0': 512, 'hidden_dim_1': 128, 'hidden_dim_2': 1024, 'kl_weight': 0.00029331982661602937, 'lr': 0.0030809501313904903, 'batch_size': 64, 'dropout_rate': 0.4821781244267049, 'prior_mu': -0.021483525803835564, 'prior_sigma': 0.07077417272646187, 'normalization': 'none'}. Best is trial 208 with value: 0.5269739389419555.
Generating morgan fingerprints...
Generated fingerprints with 1024 features for 900 molecules
Data shape: X=(900, 1024), y=(900,)
Trial 262: 5-fold CV loss = 1.2437
[I 2025-08-07 16:46:33,626] Trial 262 finished with value: 1.2436554908752442 and parameters: {'fp_type': 'morgan', 'morgan_only_radius': 2, 'morgan_only_nBits': 1024, 'num_hidden_layers': 3, 'hidden_dim_0': 512, 'hidden_dim_1': 128, 'hidden_dim_2': 512, 'kl_weight': 0.00012966209248190642, 'lr': 0.0004090155527016659, 'batch_size': 32, 'dropout_rate': 0.4999949306555447, 'prior_mu': 0.12173132927591351, 'prior_sigma': 0.06578303701008047, 'normalization': 'none'}. Best is trial 208 with value: 0.5269739389419555.
Generating morgan fingerprints...
Generated fingerprints with 1024 features for 900 molecules
Data shape: X=(900, 1024), y=(900,)
Trial 263: 5-fold CV loss = 0.5338
[I 2025-08-07 16:47:02,403] Trial 263 finished with value: 0.5337906002998352 and parameters: {'fp_type': 'morgan', 'morgan_only_radius': 2, 'morgan_only_nBits': 1024, 'num_hidden_layers': 3, 'hidden_dim_0': 512, 'hidden_dim_1': 128, 'hidden_dim_2': 1024, 'kl_weight': 0.0002775365266236859, 'lr': 0.0023308152971849867, 'batch_size': 32, 'dropout_rate': 0.499544129227667, 'prior_mu': -0.03137508641737637, 'prior_sigma': 0.07338084588486063, 'normalization': 'none'}. Best is trial 208 with value: 0.5269739389419555.
Generating morgan fingerprints...
Generated fingerprints with 1024 features for 900 molecules
Data shape: X=(900, 1024), y=(900,)
Trial 260: 5-fold CV loss = 0.5448
[I 2025-08-07 16:47:15,657] Trial 260 finished with value: 0.5448072075843811 and parameters: {'fp_type': 'morgan', 'morgan_only_radius': 2, 'morgan_only_nBits': 1024, 'num_hidden_layers': 3, 'hidden_dim_0': 512, 'hidden_dim_1': 128, 'hidden_dim_2': 1024, 'kl_weight': 0.00030153713624406, 'lr': 0.003051515107194236, 'batch_size': 32, 'dropout_rate': 0.4569352750640172, 'prior_mu': -0.025080202975682794, 'prior_sigma': 0.06985713626426417, 'normalization': 'none'}. Best is trial 208 with value: 0.5269739389419555.
Generating morgan fingerprints...
Generated fingerprints with 1024 features for 900 molecules
Data shape: X=(900, 1024), y=(900,)
Trial 264: 5-fold CV loss = 0.7201
[I 2025-08-07 16:47:24,518] Trial 264 finished with value: 0.7201457023620605 and parameters: {'fp_type': 'morgan', 'morgan_only_radius': 2, 'morgan_only_nBits': 1024, 'num_hidden_layers': 3, 'hidden_dim_0': 512, 'hidden_dim_1': 128, 'hidden_dim_2': 1024, 'kl_weight': 0.00029897407736965064, 'lr': 0.0023417080789899705, 'batch_size': 64, 'dropout_rate': 0.483367624659676, 'prior_mu': -0.031771993090954215, 'prior_sigma': 0.07525517302255451, 'normalization': 'none'}. Best is trial 208 with value: 0.5269739389419555.
Generating morgan fingerprints...
Generated fingerprints with 1024 features for 900 molecules
Data shape: X=(900, 1024), y=(900,)
Trial 265: 5-fold CV loss = 0.5414
[I 2025-08-07 16:47:55,701] Trial 265 finished with value: 0.5413790941238403 and parameters: {'fp_type': 'morgan', 'morgan_only_radius': 2, 'morgan_only_nBits': 1024, 'num_hidden_layers': 3, 'hidden_dim_0': 512, 'hidden_dim_1': 128, 'hidden_dim_2': 1024, 'kl_weight': 0.00028443281657005077, 'lr': 0.0028006062477594794, 'batch_size': 32, 'dropout_rate': 0.4839996965642306, 'prior_mu': -0.027593530263709753, 'prior_sigma': 0.07561992261290838, 'normalization': 'none'}. Best is trial 208 with value: 0.5269739389419555.
Generating morgan fingerprints...
Generated fingerprints with 1024 features for 900 molecules
Data shape: X=(900, 1024), y=(900,)
Trial 267: 5-fold CV loss = 0.5337
[I 2025-08-07 16:48:29,992] Trial 267 finished with value: 0.5337369441986084 and parameters: {'fp_type': 'morgan', 'morgan_only_radius': 2, 'morgan_only_nBits': 1024, 'num_hidden_layers': 3, 'hidden_dim_0': 512, 'hidden_dim_1': 128, 'hidden_dim_2': 1024, 'kl_weight': 0.0002524313504393355, 'lr': 0.002628861406052242, 'batch_size': 32, 'dropout_rate': 0.48865021090954147, 'prior_mu': -0.014703157447351086, 'prior_sigma': 0.06344688075826496, 'normalization': 'none'}. Best is trial 208 with value: 0.5269739389419555.
Generating morgan fingerprints...
Generated fingerprints with 1024 features for 900 molecules
Data shape: X=(900, 1024), y=(900,)
Trial 261: 5-fold CV loss = 0.5353
[I 2025-08-07 16:48:37,534] Trial 261 finished with value: 0.5353460609912872 and parameters: {'fp_type': 'morgan', 'morgan_only_radius': 2, 'morgan_only_nBits': 1024, 'num_hidden_layers': 3, 'hidden_dim_0': 512, 'hidden_dim_1': 128, 'hidden_dim_2': 512, 'kl_weight': 0.00012115363953374197, 'lr': 0.0035846691530135133, 'batch_size': 32, 'dropout_rate': 0.48288675804807435, 'prior_mu': -0.023202286533815324, 'prior_sigma': 0.06577132382000282, 'normalization': 'none'}. Best is trial 208 with value: 0.5269739389419555.
Generating morgan fingerprints...
Generated fingerprints with 1024 features for 900 molecules
Data shape: X=(900, 1024), y=(900,)
Trial 268: 5-fold CV loss = 0.5261
[I 2025-08-07 16:49:01,726] Trial 268 finished with value: 0.5260788023471832 and parameters: {'fp_type': 'morgan', 'morgan_only_radius': 2, 'morgan_only_nBits': 1024, 'num_hidden_layers': 3, 'hidden_dim_0': 512, 'hidden_dim_1': 128, 'hidden_dim_2': 1024, 'kl_weight': 0.0002476098515901669, 'lr': 0.0022644722913364532, 'batch_size': 32, 'dropout_rate': 0.49067276319999803, 'prior_mu': -0.038235086687981694, 'prior_sigma': 0.06346170815094408, 'normalization': 'none'}. Best is trial 268 with value: 0.5260788023471832.
Generating morgan fingerprints...
Generated fingerprints with 1024 features for 900 molecules
Data shape: X=(900, 1024), y=(900,)
Trial 266: 5-fold CV loss = 0.5652
[I 2025-08-07 16:49:04,996] Trial 266 finished with value: 0.5652132511138916 and parameters: {'fp_type': 'morgan', 'morgan_only_radius': 2, 'morgan_only_nBits': 1024, 'num_hidden_layers': 3, 'hidden_dim_0': 512, 'hidden_dim_1': 128, 'hidden_dim_2': 1024, 'kl_weight': 0.00025056217767054415, 'lr': 0.0024930005362685886, 'batch_size': 32, 'dropout_rate': 0.08666563140302691, 'prior_mu': -0.03290544683415075, 'prior_sigma': 0.07820386700034018, 'normalization': 'none'}. Best is trial 268 with value: 0.5260788023471832.
Generating morgan fingerprints...
Generated fingerprints with 1024 features for 900 molecules
Data shape: X=(900, 1024), y=(900,)
Trial 269: 5-fold CV loss = 0.5314
[I 2025-08-07 16:49:40,007] Trial 269 finished with value: 0.5313930094242096 and parameters: {'fp_type': 'morgan', 'morgan_only_radius': 2, 'morgan_only_nBits': 1024, 'num_hidden_layers': 3, 'hidden_dim_0': 512, 'hidden_dim_1': 128, 'hidden_dim_2': 1024, 'kl_weight': 0.00024261220953694223, 'lr': 0.002370328568181886, 'batch_size': 32, 'dropout_rate': 0.4923040370596329, 'prior_mu': -0.03980089499116479, 'prior_sigma': 0.06315928265795594, 'normalization': 'none'}. Best is trial 268 with value: 0.5260788023471832.
Generating morgan fingerprints...
Generated fingerprints with 1024 features for 900 molecules
Data shape: X=(900, 1024), y=(900,)
Trial 271: 5-fold CV loss = 0.5691
