[I 2025-08-08 00:38:18,587] Trial 1507 finished with value: 0.5192662298679351 and parameters: {'fp_type': 'morgan', 'morgan_only_radius': 2, 'morgan_only_nBits': 2048, 'num_hidden_layers': 3, 'hidden_dim_0': 512, 'hidden_dim_1': 128, 'hidden_dim_2': 512, 'kl_weight': 0.0009300759016404517, 'lr': 0.0021139440623440505, 'batch_size': 32, 'dropout_rate': 0.4471792843970639, 'prior_mu': 0.06514740761312572, 'prior_sigma': 0.06111069591446624, 'normalization': 'none'}. Best is trial 1400 with value: 0.5178181529045105.
Generating morgan fingerprints...
Generated fingerprints with 2048 features for 900 molecules
Data shape: X=(900, 2048), y=(900,)
Trial 1511: 5-fold CV loss = 0.5217
[I 2025-08-08 00:38:56,785] Trial 1511 finished with value: 0.5216704547405243 and parameters: {'fp_type': 'morgan', 'morgan_only_radius': 2, 'morgan_only_nBits': 2048, 'num_hidden_layers': 3, 'hidden_dim_0': 512, 'hidden_dim_1': 128, 'hidden_dim_2': 512, 'kl_weight': 0.0006450161011408332, 'lr': 0.00221671732577867, 'batch_size': 32, 'dropout_rate': 0.4447869380899695, 'prior_mu': 0.0580247321253239, 'prior_sigma': 0.06247588172657399, 'normalization': 'none'}. Best is trial 1400 with value: 0.5178181529045105.
Generating morgan fingerprints...
Generated fingerprints with 2048 features for 900 molecules
Data shape: X=(900, 2048), y=(900,)
Trial 1505: 5-fold CV loss = 0.5257
[I 2025-08-08 00:39:24,032] Trial 1505 finished with value: 0.5257052958011628 and parameters: {'fp_type': 'morgan', 'morgan_only_radius': 2, 'morgan_only_nBits': 2048, 'num_hidden_layers': 3, 'hidden_dim_0': 512, 'hidden_dim_1': 128, 'hidden_dim_2': 512, 'kl_weight': 0.000730091034332673, 'lr': 0.0021712289531429434, 'batch_size': 32, 'dropout_rate': 0.4444572775071104, 'prior_mu': 0.06552975854558446, 'prior_sigma': 0.06261682158363784, 'normalization': 'none'}. Best is trial 1400 with value: 0.5178181529045105.
Generating morgan fingerprints...
Generated fingerprints with 2048 features for 900 molecules
Data shape: X=(900, 2048), y=(900,)
Trial 1512: 5-fold CV loss = 0.5351
[I 2025-08-08 00:39:33,028] Trial 1512 finished with value: 0.5350534319877625 and parameters: {'fp_type': 'morgan', 'morgan_only_radius': 2, 'morgan_only_nBits': 2048, 'num_hidden_layers': 3, 'hidden_dim_0': 256, 'hidden_dim_1': 128, 'hidden_dim_2': 512, 'kl_weight': 0.0008702791799896922, 'lr': 0.0019496880472706878, 'batch_size': 32, 'dropout_rate': 0.4697518897402482, 'prior_mu': 0.08692521334990061, 'prior_sigma': 0.06264199375041207, 'normalization': 'none'}. Best is trial 1400 with value: 0.5178181529045105.
Generating morgan fingerprints...
Generated fingerprints with 2048 features for 900 molecules
Data shape: X=(900, 2048), y=(900,)
Trial 1513: 5-fold CV loss = 0.5309
[I 2025-08-08 00:40:10,388] Trial 1513 finished with value: 0.5308885931968689 and parameters: {'fp_type': 'morgan', 'morgan_only_radius': 2, 'morgan_only_nBits': 2048, 'num_hidden_layers': 3, 'hidden_dim_0': 512, 'hidden_dim_1': 128, 'hidden_dim_2': 512, 'kl_weight': 0.0008510160655173532, 'lr': 0.002204774341981742, 'batch_size': 32, 'dropout_rate': 0.4329588737585179, 'prior_mu': 0.07291277459382366, 'prior_sigma': 0.05454515216466225, 'normalization': 'none'}. Best is trial 1400 with value: 0.5178181529045105.
Generating morgan fingerprints...
Generated fingerprints with 2048 features for 900 molecules
Data shape: X=(900, 2048), y=(900,)
Trial 1514: 5-fold CV loss = 0.5351
[I 2025-08-08 00:40:18,837] Trial 1514 finished with value: 0.5350854754447937 and parameters: {'fp_type': 'morgan', 'morgan_only_radius': 2, 'morgan_only_nBits': 2048, 'num_hidden_layers': 3, 'hidden_dim_0': 512, 'hidden_dim_1': 128, 'hidden_dim_2': 512, 'kl_weight': 0.0006478467827142675, 'lr': 0.002201380626635058, 'batch_size': 32, 'dropout_rate': 0.4310608201366293, 'prior_mu': 0.0711894613603308, 'prior_sigma': 0.05334933962765731, 'normalization': 'none'}. Best is trial 1400 with value: 0.5178181529045105.
Generating morgan fingerprints...
Generated fingerprints with 2048 features for 900 molecules
Data shape: X=(900, 2048), y=(900,)
Trial 1516: 5-fold CV loss = 0.5527
[I 2025-08-08 00:40:42,477] Trial 1516 finished with value: 0.5527142345905304 and parameters: {'fp_type': 'morgan', 'morgan_only_radius': 2, 'morgan_only_nBits': 2048, 'num_hidden_layers': 3, 'hidden_dim_0': 512, 'hidden_dim_1': 128, 'hidden_dim_2': 512, 'kl_weight': 0.0006396522935665311, 'lr': 0.0021912411618603177, 'batch_size': 32, 'dropout_rate': 0.43726519726285307, 'prior_mu': 0.0789667609631121, 'prior_sigma': 0.05701207625043597, 'normalization': 'none'}. Best is trial 1400 with value: 0.5178181529045105.
Generating morgan fingerprints...
Generated fingerprints with 2048 features for 900 molecules
Data shape: X=(900, 2048), y=(900,)
Trial 1519: 5-fold CV loss = 0.9135
[I 2025-08-08 00:41:09,561] Trial 1519 finished with value: 0.9134964227676392 and parameters: {'fp_type': 'morgan', 'morgan_only_radius': 2, 'morgan_only_nBits': 2048, 'num_hidden_layers': 3, 'hidden_dim_0': 512, 'hidden_dim_1': 1024, 'hidden_dim_2': 512, 'kl_weight': 0.0006006428701998736, 'lr': 0.0008322407787883831, 'batch_size': 32, 'dropout_rate': 0.4172407244997734, 'prior_mu': 0.0635482689002818, 'prior_sigma': 0.058092417892237416, 'normalization': 'none'}. Best is trial 1400 with value: 0.5178181529045105.
Generating morgan fingerprints...
Generated fingerprints with 2048 features for 900 molecules
Data shape: X=(900, 2048), y=(900,)
Trial 1517: 5-fold CV loss = 0.7308
[I 2025-08-08 00:41:29,836] Trial 1517 finished with value: 0.7308337926864624 and parameters: {'fp_type': 'morgan', 'morgan_only_radius': 2, 'morgan_only_nBits': 2048, 'num_hidden_layers': 3, 'hidden_dim_0': 512, 'hidden_dim_1': 1024, 'hidden_dim_2': 256, 'kl_weight': 0.0006623726848362032, 'lr': 0.002218002553362755, 'batch_size': 32, 'dropout_rate': 0.43597501079371587, 'prior_mu': 0.08131560998894408, 'prior_sigma': 0.056894640848590305, 'normalization': 'none'}. Best is trial 1400 with value: 0.5178181529045105.
Generating morgan_rdkit fingerprints...
Generated fingerprints with 768 features for 900 molecules
Data shape: X=(900, 768), y=(900,)
Trial 1518: 5-fold CV loss = 0.6320
[I 2025-08-08 00:41:36,319] Trial 1518 finished with value: 0.6319696187973023 and parameters: {'fp_type': 'morgan', 'morgan_only_radius': 2, 'morgan_only_nBits': 2048, 'num_hidden_layers': 3, 'hidden_dim_0': 512, 'hidden_dim_1': 1024, 'hidden_dim_2': 256, 'kl_weight': 0.0006411538350754855, 'lr': 0.002054451047180675, 'batch_size': 32, 'dropout_rate': 0.40730888359401807, 'prior_mu': 0.06429057913859088, 'prior_sigma': 0.049422153648984585, 'normalization': 'none'}. Best is trial 1400 with value: 0.5178181529045105.
Generating morgan_rdkit fingerprints...
Generated fingerprints with 768 features for 900 molecules
Data shape: X=(900, 768), y=(900,)
Trial 1520: 5-fold CV loss = 0.5915
[I 2025-08-08 00:42:35,038] Trial 1520 finished with value: 0.5914908945560455 and parameters: {'fp_type': 'morgan', 'morgan_only_radius': 2, 'morgan_only_nBits': 2048, 'num_hidden_layers': 3, 'hidden_dim_0': 512, 'hidden_dim_1': 512, 'hidden_dim_2': 256, 'kl_weight': 0.0007100457833752071, 'lr': 0.00202835614326513, 'batch_size': 32, 'dropout_rate': 0.43601504436137, 'prior_mu': 0.07390315925920832, 'prior_sigma': 0.05031285423523407, 'normalization': 'none'}. Best is trial 1400 with value: 0.5178181529045105.
Generating morgan_rdkit fingerprints...
Generated fingerprints with 768 features for 900 molecules
Data shape: X=(900, 768), y=(900,)
Trial 1521: 5-fold CV loss = 0.6452
[I 2025-08-08 00:42:56,790] Trial 1521 finished with value: 0.6452465772628784 and parameters: {'fp_type': 'morgan_rdkit', 'combined_morgan_radius': 2, 'combined_morgan_nBits': 512, 'combined_rdkit_maxPath': 8, 'combined_rdkit_nBits': 256, 'num_hidden_layers': 3, 'hidden_dim_0': 512, 'hidden_dim_1': 512, 'hidden_dim_2': 512, 'kl_weight': 0.0007541350609122867, 'lr': 0.0010354539201541844, 'batch_size': 32, 'dropout_rate': 0.4330235061255349, 'prior_mu': 0.06495896178384734, 'prior_sigma': 0.04794178424341775, 'normalization': 'none'}. Best is trial 1400 with value: 0.5178181529045105.
Generating morgan fingerprints...
Generated fingerprints with 2048 features for 900 molecules
Data shape: X=(900, 2048), y=(900,)
Trial 1522: 5-fold CV loss = 0.5646
[I 2025-08-08 00:42:58,936] Trial 1522 finished with value: 0.5646368026733398 and parameters: {'fp_type': 'morgan_rdkit', 'combined_morgan_radius': 2, 'combined_morgan_nBits': 512, 'combined_rdkit_maxPath': 8, 'combined_rdkit_nBits': 256, 'num_hidden_layers': 3, 'hidden_dim_0': 512, 'hidden_dim_1': 128, 'hidden_dim_2': 512, 'kl_weight': 0.0007481672767913242, 'lr': 0.0019804449634930107, 'batch_size': 32, 'dropout_rate': 0.43128101639621313, 'prior_mu': 0.06080588627693491, 'prior_sigma': 0.05907927506647752, 'normalization': 'none'}. Best is trial 1400 with value: 0.5178181529045105.
Generating morgan fingerprints...
Generated fingerprints with 2048 features for 900 molecules
Data shape: X=(900, 2048), y=(900,)
Trial 1523: 5-fold CV loss = 0.6614
[I 2025-08-08 00:43:08,894] Trial 1523 finished with value: 0.6613999485969544 and parameters: {'fp_type': 'morgan_rdkit', 'combined_morgan_radius': 2, 'combined_morgan_nBits': 512, 'combined_rdkit_maxPath': 8, 'combined_rdkit_nBits': 256, 'num_hidden_layers': 3, 'hidden_dim_0': 512, 'hidden_dim_1': 128, 'hidden_dim_2': 512, 'kl_weight': 0.0007790270773225335, 'lr': 0.00027147565342957366, 'batch_size': 32, 'dropout_rate': 0.4263165381143489, 'prior_mu': 0.06190871003119723, 'prior_sigma': 0.05483473447126449, 'normalization': 'none'}. Best is trial 1400 with value: 0.5178181529045105.
Generating morgan fingerprints...
Generated fingerprints with 2048 features for 900 molecules
Data shape: X=(900, 2048), y=(900,)
Trial 1515: 5-fold CV loss = 0.5621
[I 2025-08-08 00:43:10,804] Trial 1515 finished with value: 0.5621312618255615 and parameters: {'fp_type': 'morgan', 'morgan_only_radius': 2, 'morgan_only_nBits': 2048, 'num_hidden_layers': 3, 'hidden_dim_0': 256, 'hidden_dim_1': 128, 'hidden_dim_2': 512, 'kl_weight': 0.0006265942714700307, 'lr': 0.0021297607989367692, 'batch_size': 32, 'dropout_rate': 0.424444636967265, 'prior_mu': 0.07557947979997244, 'prior_sigma': 0.05558636628274815, 'normalization': 'none'}. Best is trial 1400 with value: 0.5178181529045105.
Generating morgan fingerprints...
Generated fingerprints with 2048 features for 900 molecules
Data shape: X=(900, 2048), y=(900,)
Trial 1526: 5-fold CV loss = 0.5810
[I 2025-08-08 00:44:03,371] Trial 1526 finished with value: 0.5810399889945984 and parameters: {'fp_type': 'morgan', 'morgan_only_radius': 2, 'morgan_only_nBits': 2048, 'num_hidden_layers': 3, 'hidden_dim_0': 512, 'hidden_dim_1': 128, 'hidden_dim_2': 512, 'kl_weight': 0.0005467502311283739, 'lr': 0.0018208339825449456, 'batch_size': 32, 'dropout_rate': 0.4176823203033808, 'prior_mu': 0.05652942567102043, 'prior_sigma': 0.05968496970038564, 'normalization': 'none'}. Best is trial 1400 with value: 0.5178181529045105.
Generating morgan fingerprints...
Generated fingerprints with 2048 features for 900 molecules
Data shape: X=(900, 2048), y=(900,)
Trial 1525: 5-fold CV loss = 0.5309
[I 2025-08-08 00:44:41,373] Trial 1525 finished with value: 0.530926126241684 and parameters: {'fp_type': 'morgan', 'morgan_only_radius': 2, 'morgan_only_nBits': 2048, 'num_hidden_layers': 3, 'hidden_dim_0': 512, 'hidden_dim_1': 128, 'hidden_dim_2': 512, 'kl_weight': 0.00047119572665226385, 'lr': 0.0018968776582022461, 'batch_size': 32, 'dropout_rate': 0.4195124774101989, 'prior_mu': 0.09489588749147565, 'prior_sigma': 0.05870224110595864, 'normalization': 'none'}. Best is trial 1400 with value: 0.5178181529045105.
Generating morgan fingerprints...
Generated fingerprints with 2048 features for 900 molecules
Data shape: X=(900, 2048), y=(900,)
Trial 1524: 5-fold CV loss = 0.5521
[I 2025-08-08 00:44:57,128] Trial 1524 finished with value: 0.5520908772945404 and parameters: {'fp_type': 'morgan', 'morgan_only_radius': 2, 'morgan_only_nBits': 2048, 'num_hidden_layers': 3, 'hidden_dim_0': 512, 'hidden_dim_1': 128, 'hidden_dim_2': 512, 'kl_weight': 0.0008415984297482767, 'lr': 0.0018433788613214331, 'batch_size': 32, 'dropout_rate': 0.4242563140095334, 'prior_mu': 0.059691083873985654, 'prior_sigma': 0.05403238314406651, 'normalization': 'none'}. Best is trial 1400 with value: 0.5178181529045105.
Generating morgan fingerprints...
Generated fingerprints with 2048 features for 900 molecules
Data shape: X=(900, 2048), y=(900,)
Trial 1528: 5-fold CV loss = 0.5171
[I 2025-08-08 00:45:07,662] Trial 1528 finished with value: 0.5170644640922546 and parameters: {'fp_type': 'morgan', 'morgan_only_radius': 2, 'morgan_only_nBits': 2048, 'num_hidden_layers': 3, 'hidden_dim_0': 512, 'hidden_dim_1': 128, 'hidden_dim_2': 512, 'kl_weight': 0.0008203568956846476, 'lr': 0.002252025695507308, 'batch_size': 32, 'dropout_rate': 0.44417429670660424, 'prior_mu': 0.04909277889540582, 'prior_sigma': 0.06045244008340425, 'normalization': 'none'}. Best is trial 1528 with value: 0.5170644640922546.
Generating morgan fingerprints...
Generated fingerprints with 2048 features for 900 molecules
Data shape: X=(900, 2048), y=(900,)
Trial 1531: 5-fold CV loss = 0.7210
[I 2025-08-08 00:45:15,836] Trial 1531 finished with value: 0.7210388422012329 and parameters: {'fp_type': 'morgan', 'morgan_only_radius': 2, 'morgan_only_nBits': 2048, 'num_hidden_layers': 3, 'hidden_dim_0': 512, 'hidden_dim_1': 128, 'hidden_dim_2': 512, 'kl_weight': 0.0008973336803550634, 'lr': 0.00226927145657388, 'batch_size': 128, 'dropout_rate': 0.4437689209854786, 'prior_mu': 0.04641729681824694, 'prior_sigma': 0.0513328913469934, 'normalization': 'none'}. Best is trial 1528 with value: 0.5170644640922546.
Generating morgan fingerprints...
Generated fingerprints with 2048 features for 900 molecules
Data shape: X=(900, 2048), y=(900,)
Trial 1529: 5-fold CV loss = 0.5480
[I 2025-08-08 00:46:08,996] Trial 1529 finished with value: 0.5480314910411834 and parameters: {'fp_type': 'morgan', 'morgan_only_radius': 2, 'morgan_only_nBits': 2048, 'num_hidden_layers': 3, 'hidden_dim_0': 128, 'hidden_dim_1': 128, 'hidden_dim_2': 512, 'kl_weight': 0.0008015324876716468, 'lr': 0.002268422609980319, 'batch_size': 32, 'dropout_rate': 0.4421523374549672, 'prior_mu': 0.05584936762306419, 'prior_sigma': 0.06111849396535809, 'normalization': 'none'}. Best is trial 1528 with value: 0.5170644640922546.
Generating morgan fingerprints...
Generated fingerprints with 2048 features for 900 molecules
Data shape: X=(900, 2048), y=(900,)
Trial 1532: 5-fold CV loss = 0.5534
[I 2025-08-08 00:46:27,462] Trial 1532 finished with value: 0.5533583879470825 and parameters: {'fp_type': 'morgan', 'morgan_only_radius': 2, 'morgan_only_nBits': 2048, 'num_hidden_layers': 3, 'hidden_dim_0': 128, 'hidden_dim_1': 128, 'hidden_dim_2': 512, 'kl_weight': 0.0007179818337947572, 'lr': 0.00204336847215347, 'batch_size': 32, 'dropout_rate': 0.43907633286291636, 'prior_mu': 0.04911104114147978, 'prior_sigma': 0.05329762714355701, 'normalization': 'none'}. Best is trial 1528 with value: 0.5170644640922546.
Generating morgan fingerprints...
Generated fingerprints with 2048 features for 900 molecules
Data shape: X=(900, 2048), y=(900,)
Trial 1530: 5-fold CV loss = 0.5450
[I 2025-08-08 00:46:41,251] Trial 1530 finished with value: 0.5450341999530792 and parameters: {'fp_type': 'morgan', 'morgan_only_radius': 2, 'morgan_only_nBits': 2048, 'num_hidden_layers': 3, 'hidden_dim_0': 512, 'hidden_dim_1': 128, 'hidden_dim_2': 512, 'kl_weight': 0.0008692250678128188, 'lr': 0.0022626868058435853, 'batch_size': 32, 'dropout_rate': 0.44234803546281176, 'prior_mu': 0.08489683394349476, 'prior_sigma': 0.040536856098767254, 'normalization': 'none'}. Best is trial 1528 with value: 0.5170644640922546.
Generating morgan fingerprints...
Generated fingerprints with 2048 features for 900 molecules
Data shape: X=(900, 2048), y=(900,)
Trial 1534: 5-fold CV loss = 0.7484
[I 2025-08-08 00:46:54,332] Trial 1534 finished with value: 0.748400354385376 and parameters: {'fp_type': 'morgan', 'morgan_only_radius': 2, 'morgan_only_nBits': 2048, 'num_hidden_layers': 3, 'hidden_dim_0': 512, 'hidden_dim_1': 128, 'hidden_dim_2': 512, 'kl_weight': 0.0009055724459963099, 'lr': 0.0005706192954796723, 'batch_size': 32, 'dropout_rate': 0.43386879967754105, 'prior_mu': 0.04496246557296995, 'prior_sigma': 0.057838343039929734, 'normalization': 'none'}. Best is trial 1528 with value: 0.5170644640922546.
Generating morgan fingerprints...
Generated fingerprints with 2048 features for 900 molecules
Data shape: X=(900, 2048), y=(900,)
Trial 1533: 5-fold CV loss = 0.5549
[I 2025-08-08 00:47:11,831] Trial 1533 finished with value: 0.5549304842948913 and parameters: {'fp_type': 'morgan', 'morgan_only_radius': 2, 'morgan_only_nBits': 2048, 'num_hidden_layers': 3, 'hidden_dim_0': 512, 'hidden_dim_1': 128, 'hidden_dim_2': 512, 'kl_weight': 0.0007261496769925481, 'lr': 0.0020100879879804264, 'batch_size': 32, 'dropout_rate': 0.43069198486495314, 'prior_mu': 0.04857932409360401, 'prior_sigma': 0.04600416875087906, 'normalization': 'none'}. Best is trial 1528 with value: 0.5170644640922546.
Generating morgan fingerprints...
Generated fingerprints with 2048 features for 900 molecules
Data shape: X=(900, 2048), y=(900,)
Trial 1536: 5-fold CV loss = 0.5633
[I 2025-08-08 00:48:06,869] Trial 1536 finished with value: 0.5632879197597503 and parameters: {'fp_type': 'morgan', 'morgan_only_radius': 2, 'morgan_only_nBits': 2048, 'num_hidden_layers': 3, 'hidden_dim_0': 512, 'hidden_dim_1': 128, 'hidden_dim_2': 512, 'kl_weight': 0.0006927012583690029, 'lr': 0.0016530386869223759, 'batch_size': 32, 'dropout_rate': 0.4072031709871208, 'prior_mu': 0.052674950074208776, 'prior_sigma': 0.05931503181276347, 'normalization': 'none'}. Best is trial 1528 with value: 0.5170644640922546.
Generating rdkit fingerprints...
Generated fingerprints with 1024 features for 900 molecules
Data shape: X=(900, 1024), y=(900,)
Trial 1535: 5-fold CV loss = 0.6580
[I 2025-08-08 00:48:32,621] Trial 1535 finished with value: 0.6579985558986664 and parameters: {'fp_type': 'morgan', 'morgan_only_radius': 2, 'morgan_only_nBits': 2048, 'num_hidden_layers': 3, 'hidden_dim_0': 512, 'hidden_dim_1': 128, 'hidden_dim_2': 512, 'kl_weight': 0.0007894382936255209, 'lr': 0.0016910115106298245, 'batch_size': 32, 'dropout_rate': 0.4348993221890493, 'prior_mu': 0.048878861306527084, 'prior_sigma': 0.05795299563492078, 'normalization': 'none'}. Best is trial 1528 with value: 0.5170644640922546.
Generating rdkit fingerprints...
Generated fingerprints with 1024 features for 900 molecules
Data shape: X=(900, 1024), y=(900,)
Trial 1537: 5-fold CV loss = 0.5387
[I 2025-08-08 00:49:00,067] Trial 1537 finished with value: 0.5387482702732086 and parameters: {'fp_type': 'morgan', 'morgan_only_radius': 2, 'morgan_only_nBits': 2048, 'num_hidden_layers': 3, 'hidden_dim_0': 512, 'hidden_dim_1': 128, 'hidden_dim_2': 512, 'kl_weight': 0.0005910110794353129, 'lr': 0.001725369561793643, 'batch_size': 32, 'dropout_rate': 0.4073842204309765, 'prior_mu': 0.0555438491692779, 'prior_sigma': 0.05808072717876334, 'normalization': 'none'}. Best is trial 1528 with value: 0.5170644640922546.
Generating rdkit fingerprints...
Generated fingerprints with 1024 features for 900 molecules
Data shape: X=(900, 1024), y=(900,)
Trial 1527: 5-fold CV loss = 0.5296
[I 2025-08-08 00:49:09,082] Trial 1527 finished with value: 0.5296460688114166 and parameters: {'fp_type': 'morgan', 'morgan_only_radius': 2, 'morgan_only_nBits': 2048, 'num_hidden_layers': 3, 'hidden_dim_0': 512, 'hidden_dim_1': 128, 'hidden_dim_2': 512, 'kl_weight': 0.00047760977800696575, 'lr': 0.0017874210993127056, 'batch_size': 32, 'dropout_rate': 0.4412502042857349, 'prior_mu': 0.08805905687278223, 'prior_sigma': 0.05958465051045634, 'normalization': 'none'}. Best is trial 1528 with value: 0.5170644640922546.
Generating rdkit fingerprints...
Generated fingerprints with 1024 features for 900 molecules
Data shape: X=(900, 1024), y=(900,)
Trial 1538: 5-fold CV loss = 0.6360
[I 2025-08-08 00:49:16,874] Trial 1538 finished with value: 0.6360430717468262 and parameters: {'fp_type': 'rdkit', 'rdkit_only_maxPath': 8, 'rdkit_only_nBits': 1024, 'num_hidden_layers': 3, 'hidden_dim_0': 512, 'hidden_dim_1': 128, 'hidden_dim_2': 512, 'kl_weight': 0.0008256424602192731, 'lr': 0.0017329057838646124, 'batch_size': 32, 'dropout_rate': 0.4288542205341123, 'prior_mu': 0.07129592223752268, 'prior_sigma': 0.06120375586970572, 'normalization': 'none'}. Best is trial 1528 with value: 0.5170644640922546.
Generating morgan fingerprints...
Generated fingerprints with 2048 features for 900 molecules
Data shape: X=(900, 2048), y=(900,)
Trial 1539: 5-fold CV loss = 0.6402
[I 2025-08-08 00:49:41,022] Trial 1539 finished with value: 0.640222430229187 and parameters: {'fp_type': 'rdkit', 'rdkit_only_maxPath': 8, 'rdkit_only_nBits': 1024, 'num_hidden_layers': 3, 'hidden_dim_0': 64, 'hidden_dim_1': 128, 'hidden_dim_2': 512, 'kl_weight': 0.0005825423223286096, 'lr': 0.001782482510290495, 'batch_size': 32, 'dropout_rate': 0.44901845243842153, 'prior_mu': 0.06927428253189356, 'prior_sigma': 0.05487773666641177, 'normalization': 'none'}. Best is trial 1528 with value: 0.5170644640922546.
Generating morgan fingerprints...
Generated fingerprints with 2048 features for 900 molecules
Data shape: X=(900, 2048), y=(900,)
Trial 1540: 5-fold CV loss = 0.6370
