[I 2025-08-08 08:08:05,025] Trial 2833 finished with value: 0.6943585038185119 and parameters: {'fp_type': 'morgan', 'morgan_only_radius': 2, 'morgan_only_nBits': 2048, 'num_hidden_layers': 2, 'hidden_dim_0': 512, 'hidden_dim_1': 128, 'kl_weight': 0.00029572544570618544, 'lr': 0.0019208475408845997, 'batch_size': 32, 'dropout_rate': 0.44017126529570855, 'prior_mu': 0.0339523432858498, 'prior_sigma': 0.06220835910749883, 'normalization': 'none'}. Best is trial 2752 with value: 0.5150722622871399.
Generating morgan fingerprints...
Generated fingerprints with 2048 features for 900 molecules
Data shape: X=(900, 2048), y=(900,)
Trial 2834: 5-fold CV loss = 0.6220
[I 2025-08-08 08:08:11,373] Trial 2834 finished with value: 0.6220137357711792 and parameters: {'fp_type': 'morgan', 'morgan_only_radius': 2, 'morgan_only_nBits': 2048, 'num_hidden_layers': 3, 'hidden_dim_0': 512, 'hidden_dim_1': 128, 'hidden_dim_2': 64, 'kl_weight': 0.00020918331160082286, 'lr': 0.0013021622575470817, 'batch_size': 32, 'dropout_rate': 0.18786810930455933, 'prior_mu': 0.04838938455057532, 'prior_sigma': 0.08046133960010152, 'normalization': 'none'}. Best is trial 2752 with value: 0.5150722622871399.
Generating morgan fingerprints...
Generated fingerprints with 2048 features for 900 molecules
Data shape: X=(900, 2048), y=(900,)
Trial 2830: 5-fold CV loss = 0.5789
[I 2025-08-08 08:08:31,927] Trial 2830 finished with value: 0.5789318144321441 and parameters: {'fp_type': 'morgan', 'morgan_only_radius': 2, 'morgan_only_nBits': 2048, 'num_hidden_layers': 3, 'hidden_dim_0': 512, 'hidden_dim_1': 128, 'hidden_dim_2': 512, 'kl_weight': 0.0001695944484842771, 'lr': 0.0019112315896951356, 'batch_size': 32, 'dropout_rate': 0.44316803107183583, 'prior_mu': 0.03211275363137486, 'prior_sigma': 0.06474101331717645, 'normalization': 'none'}. Best is trial 2752 with value: 0.5150722622871399.
Generating morgan fingerprints...
Generated fingerprints with 2048 features for 900 molecules
Data shape: X=(900, 2048), y=(900,)
Trial 2835: 5-fold CV loss = 0.5757
[I 2025-08-08 08:08:35,502] Trial 2835 finished with value: 0.5756883561611176 and parameters: {'fp_type': 'morgan', 'morgan_only_radius': 2, 'morgan_only_nBits': 2048, 'num_hidden_layers': 3, 'hidden_dim_0': 512, 'hidden_dim_1': 128, 'hidden_dim_2': 64, 'kl_weight': 0.0008180365877204463, 'lr': 0.0022240427240186158, 'batch_size': 32, 'dropout_rate': 0.34575112055306767, 'prior_mu': 0.048117351944712276, 'prior_sigma': 0.06146097592978661, 'normalization': 'none'}. Best is trial 2752 with value: 0.5150722622871399.
Generating morgan fingerprints...
Generated fingerprints with 2048 features for 900 molecules
Data shape: X=(900, 2048), y=(900,)
Trial 2837: 5-fold CV loss = 0.5281
[I 2025-08-08 08:09:31,700] Trial 2837 finished with value: 0.5280635714530945 and parameters: {'fp_type': 'morgan', 'morgan_only_radius': 2, 'morgan_only_nBits': 2048, 'num_hidden_layers': 3, 'hidden_dim_0': 512, 'hidden_dim_1': 128, 'hidden_dim_2': 512, 'kl_weight': 0.0007996584223390376, 'lr': 0.0021649600992293006, 'batch_size': 32, 'dropout_rate': 0.4613909582251202, 'prior_mu': 0.00711645970323474, 'prior_sigma': 0.07889959963974114, 'normalization': 'none'}. Best is trial 2752 with value: 0.5150722622871399.
Generating morgan fingerprints...
Generated fingerprints with 2048 features for 900 molecules
Data shape: X=(900, 2048), y=(900,)
Trial 2839: 5-fold CV loss = 0.6312
[I 2025-08-08 08:09:54,467] Trial 2839 finished with value: 0.6312419652938843 and parameters: {'fp_type': 'morgan', 'morgan_only_radius': 2, 'morgan_only_nBits': 2048, 'num_hidden_layers': 3, 'hidden_dim_0': 128, 'hidden_dim_1': 256, 'hidden_dim_2': 512, 'kl_weight': 0.0008225556714386392, 'lr': 0.0016978132091198237, 'batch_size': 32, 'dropout_rate': 0.46147371084608546, 'prior_mu': 0.009443651872541783, 'prior_sigma': 0.07963240113752004, 'normalization': 'none'}. Best is trial 2752 with value: 0.5150722622871399.
Generating morgan fingerprints...
Generated fingerprints with 2048 features for 900 molecules
Data shape: X=(900, 2048), y=(900,)
Trial 2838: 5-fold CV loss = 0.6009
[I 2025-08-08 08:10:19,468] Trial 2838 finished with value: 0.600923752784729 and parameters: {'fp_type': 'morgan', 'morgan_only_radius': 2, 'morgan_only_nBits': 2048, 'num_hidden_layers': 3, 'hidden_dim_0': 512, 'hidden_dim_1': 256, 'hidden_dim_2': 512, 'kl_weight': 0.0008035582290476968, 'lr': 0.002168251182761623, 'batch_size': 32, 'dropout_rate': 0.4669337270401235, 'prior_mu': 0.009185521147453368, 'prior_sigma': 0.0788983029511947, 'normalization': 'none'}. Best is trial 2752 with value: 0.5150722622871399.
Generating morgan fingerprints...
Generated fingerprints with 2048 features for 900 molecules
Data shape: X=(900, 2048), y=(900,)
Trial 2840: 5-fold CV loss = 0.5272
[I 2025-08-08 08:10:44,953] Trial 2840 finished with value: 0.5271503150463104 and parameters: {'fp_type': 'morgan', 'morgan_only_radius': 2, 'morgan_only_nBits': 2048, 'num_hidden_layers': 3, 'hidden_dim_0': 512, 'hidden_dim_1': 256, 'hidden_dim_2': 512, 'kl_weight': 0.000849500894435031, 'lr': 0.0021334018132047636, 'batch_size': 32, 'dropout_rate': 0.43826423868946857, 'prior_mu': 0.052994050087828405, 'prior_sigma': 0.07338218299871788, 'normalization': 'none'}. Best is trial 2752 with value: 0.5150722622871399.
Generating morgan fingerprints...
Generated fingerprints with 2048 features for 900 molecules
Data shape: X=(900, 2048), y=(900,)
Trial 2843: 5-fold CV loss = 0.5524
[I 2025-08-08 08:11:16,261] Trial 2843 finished with value: 0.5523970246315002 and parameters: {'fp_type': 'morgan', 'morgan_only_radius': 2, 'morgan_only_nBits': 2048, 'num_hidden_layers': 3, 'hidden_dim_0': 512, 'hidden_dim_1': 128, 'hidden_dim_2': 512, 'kl_weight': 0.0011538959275352906, 'lr': 0.006017446803085653, 'batch_size': 32, 'dropout_rate': 0.45124921461988104, 'prior_mu': 0.04118217500851207, 'prior_sigma': 0.06942023996924798, 'normalization': 'none'}. Best is trial 2752 with value: 0.5150722622871399.
Generating morgan fingerprints...
Generated fingerprints with 2048 features for 900 molecules
Data shape: X=(900, 2048), y=(900,)
Trial 2844: 5-fold CV loss = 0.7927
[I 2025-08-08 08:11:31,950] Trial 2844 finished with value: 0.7926549196243287 and parameters: {'fp_type': 'morgan', 'morgan_only_radius': 2, 'morgan_only_nBits': 2048, 'num_hidden_layers': 3, 'hidden_dim_0': 512, 'hidden_dim_1': 128, 'hidden_dim_2': 512, 'kl_weight': 0.0009792923298677875, 'lr': 0.0016777735638334465, 'batch_size': 64, 'dropout_rate': 0.4049458399079863, 'prior_mu': 0.05641045777707721, 'prior_sigma': 0.07427031596699867, 'normalization': 'none'}. Best is trial 2752 with value: 0.5150722622871399.
Generating morgan fingerprints...
Generated fingerprints with 2048 features for 900 molecules
Data shape: X=(900, 2048), y=(900,)
Trial 2841: 5-fold CV loss = 0.5265
[I 2025-08-08 08:11:32,664] Trial 2841 finished with value: 0.5265477299690247 and parameters: {'fp_type': 'morgan', 'morgan_only_radius': 2, 'morgan_only_nBits': 2048, 'num_hidden_layers': 3, 'hidden_dim_0': 512, 'hidden_dim_1': 128, 'hidden_dim_2': 512, 'kl_weight': 0.0011628008768367482, 'lr': 0.0021143641073403164, 'batch_size': 32, 'dropout_rate': 0.43706782719153037, 'prior_mu': 0.05542037106886315, 'prior_sigma': 0.07406443048559957, 'normalization': 'none'}. Best is trial 2752 with value: 0.5150722622871399.
Generating morgan fingerprints...
Generated fingerprints with 2048 features for 900 molecules
Data shape: X=(900, 2048), y=(900,)
Trial 2842: 5-fold CV loss = 0.6451
[I 2025-08-08 08:12:04,659] Trial 2842 finished with value: 0.645070219039917 and parameters: {'fp_type': 'morgan', 'morgan_only_radius': 2, 'morgan_only_nBits': 2048, 'num_hidden_layers': 3, 'hidden_dim_0': 512, 'hidden_dim_1': 128, 'hidden_dim_2': 512, 'kl_weight': 0.0011744842554395022, 'lr': 0.0016578077141019992, 'batch_size': 32, 'dropout_rate': 0.43638872268899215, 'prior_mu': 0.05772120083522691, 'prior_sigma': 0.07301372859480146, 'normalization': 'none'}. Best is trial 2752 with value: 0.5150722622871399.
Generating morgan fingerprints...
Generated fingerprints with 2048 features for 900 molecules
Data shape: X=(900, 2048), y=(900,)
Trial 2846: 5-fold CV loss = 0.6096
[I 2025-08-08 08:12:31,678] Trial 2846 finished with value: 0.6096437692642211 and parameters: {'fp_type': 'morgan', 'morgan_only_radius': 2, 'morgan_only_nBits': 2048, 'num_hidden_layers': 3, 'hidden_dim_0': 512, 'hidden_dim_1': 128, 'hidden_dim_2': 512, 'kl_weight': 0.00033234543636243913, 'lr': 0.0017838088684318748, 'batch_size': 32, 'dropout_rate': 0.11526810184213959, 'prior_mu': 0.04282769083311828, 'prior_sigma': 0.06625789470731036, 'normalization': 'none'}. Best is trial 2752 with value: 0.5150722622871399.
Generating rdkit fingerprints...
Generated fingerprints with 512 features for 900 molecules
Data shape: X=(900, 512), y=(900,)
Trial 2845: 5-fold CV loss = 0.5462
[I 2025-08-08 08:12:39,177] Trial 2845 finished with value: 0.5462028682231903 and parameters: {'fp_type': 'morgan', 'morgan_only_radius': 2, 'morgan_only_nBits': 2048, 'num_hidden_layers': 3, 'hidden_dim_0': 512, 'hidden_dim_1': 128, 'hidden_dim_2': 512, 'kl_weight': 0.0003398839721674572, 'lr': 0.0020769176726681718, 'batch_size': 32, 'dropout_rate': 0.43746929233779286, 'prior_mu': 0.0438091668301318, 'prior_sigma': 0.05948838015006095, 'normalization': 'none'}. Best is trial 2752 with value: 0.5150722622871399.
Generating morgan fingerprints...
Generated fingerprints with 2048 features for 900 molecules
Data shape: X=(900, 2048), y=(900,)
Trial 2836: 5-fold CV loss = 0.6021
[I 2025-08-08 08:12:46,814] Trial 2836 finished with value: 0.6020983040332795 and parameters: {'fp_type': 'morgan', 'morgan_only_radius': 2, 'morgan_only_nBits': 2048, 'num_hidden_layers': 3, 'hidden_dim_0': 512, 'hidden_dim_1': 128, 'hidden_dim_2': 512, 'kl_weight': 0.0008698970038811093, 'lr': 0.0013379502865861715, 'batch_size': 32, 'dropout_rate': 0.46308178543095263, 'prior_mu': 0.047628201112311336, 'prior_sigma': 0.07682132438362993, 'normalization': 'none'}. Best is trial 2752 with value: 0.5150722622871399.
Generating morgan fingerprints...
Generated fingerprints with 2048 features for 900 molecules
Data shape: X=(900, 2048), y=(900,)
Trial 2849: 5-fold CV loss = 0.6567
[I 2025-08-08 08:12:47,768] Trial 2849 finished with value: 0.6567229151725769 and parameters: {'fp_type': 'morgan', 'morgan_only_radius': 2, 'morgan_only_nBits': 2048, 'num_hidden_layers': 0, 'kl_weight': 0.0008825279205401936, 'lr': 0.0014153582022235602, 'batch_size': 128, 'dropout_rate': 0.45001577124809133, 'prior_mu': 0.03030457618535131, 'prior_sigma': 0.06986197740149216, 'normalization': 'none'}. Best is trial 2752 with value: 0.5150722622871399.
Generating rdkit fingerprints...
Generated fingerprints with 512 features for 900 molecules
Data shape: X=(900, 512), y=(900,)
Trial 2848: 5-fold CV loss = 0.8826
[I 2025-08-08 08:13:08,826] Trial 2848 finished with value: 0.8826311230659485 and parameters: {'fp_type': 'rdkit', 'rdkit_only_maxPath': 5, 'rdkit_only_nBits': 512, 'num_hidden_layers': 3, 'hidden_dim_0': 512, 'hidden_dim_1': 128, 'hidden_dim_2': 512, 'kl_weight': 0.0009178810443682476, 'lr': 0.0008914427016355405, 'batch_size': 32, 'dropout_rate': 0.44656381156105823, 'prior_mu': 0.0751498224694046, 'prior_sigma': 0.059917750097322794, 'normalization': 'none'}. Best is trial 2752 with value: 0.5150722622871399.
Generating morgan fingerprints...
Generated fingerprints with 2048 features for 900 molecules
Data shape: X=(900, 2048), y=(900,)
Trial 2847: 5-fold CV loss = 0.5976
[I 2025-08-08 08:13:49,792] Trial 2847 finished with value: 0.5975584268569947 and parameters: {'fp_type': 'morgan', 'morgan_only_radius': 2, 'morgan_only_nBits': 2048, 'num_hidden_layers': 3, 'hidden_dim_0': 512, 'hidden_dim_1': 128, 'hidden_dim_2': 512, 'kl_weight': 0.0009702997747226971, 'lr': 0.0017709284854859073, 'batch_size': 32, 'dropout_rate': 0.45368015434290254, 'prior_mu': 0.045481790570627484, 'prior_sigma': 0.05817639036914736, 'normalization': 'none'}. Best is trial 2752 with value: 0.5150722622871399.
Generating morgan fingerprints...
Generated fingerprints with 2048 features for 900 molecules
Data shape: X=(900, 2048), y=(900,)
Trial 2851: 5-fold CV loss = 0.5577
[I 2025-08-08 08:14:30,204] Trial 2851 finished with value: 0.5577276468276977 and parameters: {'fp_type': 'rdkit', 'rdkit_only_maxPath': 5, 'rdkit_only_nBits': 512, 'num_hidden_layers': 3, 'hidden_dim_0': 256, 'hidden_dim_1': 128, 'hidden_dim_2': 512, 'kl_weight': 0.0002170948168845143, 'lr': 0.0018821955211544192, 'batch_size': 32, 'dropout_rate': 0.3890185726819313, 'prior_mu': 0.07482194501580729, 'prior_sigma': 0.06519839122453154, 'normalization': 'none'}. Best is trial 2752 with value: 0.5150722622871399.
Generating morgan fingerprints...
Generated fingerprints with 2048 features for 900 molecules
Data shape: X=(900, 2048), y=(900,)
Trial 2854: 5-fold CV loss = 0.8843
[I 2025-08-08 08:14:43,746] Trial 2854 finished with value: 0.8842971086502075 and parameters: {'fp_type': 'morgan', 'morgan_only_radius': 3, 'morgan_only_nBits': 2048, 'num_hidden_layers': 3, 'hidden_dim_0': 512, 'hidden_dim_1': 512, 'hidden_dim_2': 512, 'kl_weight': 0.0007333418675161333, 'lr': 0.0022894752239416057, 'batch_size': 64, 'dropout_rate': 0.40650091312567477, 'prior_mu': 0.03626834347779166, 'prior_sigma': 0.06899056647026615, 'normalization': 'none'}. Best is trial 2752 with value: 0.5150722622871399.
Generating morgan fingerprints...
Generated fingerprints with 2048 features for 900 molecules
Data shape: X=(900, 2048), y=(900,)
Trial 2852: 5-fold CV loss = 0.5247
[I 2025-08-08 08:14:44,452] Trial 2852 finished with value: 0.5247033953666687 and parameters: {'fp_type': 'morgan', 'morgan_only_radius': 2, 'morgan_only_nBits': 2048, 'num_hidden_layers': 3, 'hidden_dim_0': 512, 'hidden_dim_1': 128, 'hidden_dim_2': 512, 'kl_weight': 0.0007430785471134709, 'lr': 0.001921621440306826, 'batch_size': 32, 'dropout_rate': 0.473504846404571, 'prior_mu': 0.02670129501230982, 'prior_sigma': 0.06567780498496531, 'normalization': 'none'}. Best is trial 2752 with value: 0.5150722622871399.
Generating morgan fingerprints...
Generated fingerprints with 2048 features for 900 molecules
Data shape: X=(900, 2048), y=(900,)
Trial 2856: 5-fold CV loss = 0.5287
[I 2025-08-08 08:16:01,534] Trial 2856 finished with value: 0.5286953628063202 and parameters: {'fp_type': 'morgan', 'morgan_only_radius': 2, 'morgan_only_nBits': 2048, 'num_hidden_layers': 3, 'hidden_dim_0': 512, 'hidden_dim_1': 128, 'hidden_dim_2': 512, 'kl_weight': 0.0007757487106562445, 'lr': 0.0022411298132051917, 'batch_size': 32, 'dropout_rate': 0.44866549088143887, 'prior_mu': 0.03827100310378195, 'prior_sigma': 0.05049602505628363, 'normalization': 'none'}. Best is trial 2752 with value: 0.5150722622871399.
Generating morgan fingerprints...
Generated fingerprints with 2048 features for 900 molecules
Data shape: X=(900, 2048), y=(900,)
Trial 2855: 5-fold CV loss = 0.5201
[I 2025-08-08 08:16:03,516] Trial 2855 finished with value: 0.5200798988342286 and parameters: {'fp_type': 'morgan', 'morgan_only_radius': 2, 'morgan_only_nBits': 2048, 'num_hidden_layers': 3, 'hidden_dim_0': 512, 'hidden_dim_1': 128, 'hidden_dim_2': 512, 'kl_weight': 0.0007842135564879068, 'lr': 0.00201473976856639, 'batch_size': 32, 'dropout_rate': 0.4669260986715925, 'prior_mu': 0.03915215259585128, 'prior_sigma': 0.06543288553216334, 'normalization': 'none'}. Best is trial 2752 with value: 0.5150722622871399.
Generating morgan fingerprints...
Generated fingerprints with 2048 features for 900 molecules
Data shape: X=(900, 2048), y=(900,)
Trial 2850: 5-fold CV loss = 0.6425
[I 2025-08-08 08:16:07,620] Trial 2850 finished with value: 0.642520260810852 and parameters: {'fp_type': 'morgan', 'morgan_only_radius': 2, 'morgan_only_nBits': 2048, 'num_hidden_layers': 3, 'hidden_dim_0': 256, 'hidden_dim_1': 512, 'hidden_dim_2': 512, 'kl_weight': 0.00022351184382401811, 'lr': 0.0018851132180230771, 'batch_size': 32, 'dropout_rate': 0.45302735803674477, 'prior_mu': 0.027648056760668255, 'prior_sigma': 0.05131306908742371, 'normalization': 'none'}. Best is trial 2752 with value: 0.5150722622871399.
Generating morgan fingerprints...
Generated fingerprints with 2048 features for 900 molecules
Data shape: X=(900, 2048), y=(900,)
Trial 2853: 5-fold CV loss = 0.5382
[I 2025-08-08 08:16:36,461] Trial 2853 finished with value: 0.5382210075855255 and parameters: {'fp_type': 'morgan', 'morgan_only_radius': 3, 'morgan_only_nBits': 2048, 'num_hidden_layers': 3, 'hidden_dim_0': 256, 'hidden_dim_1': 128, 'hidden_dim_2': 512, 'kl_weight': 0.00028664992666630493, 'lr': 0.0019674041876831905, 'batch_size': 32, 'dropout_rate': 0.39127330636517316, 'prior_mu': 0.03777060849270085, 'prior_sigma': 0.06554210012477207, 'normalization': 'none'}. Best is trial 2752 with value: 0.5150722622871399.
Generating morgan fingerprints...
Generated fingerprints with 2048 features for 900 molecules
Data shape: X=(900, 2048), y=(900,)
Trial 2859: 5-fold CV loss = 0.9627
[I 2025-08-08 08:17:14,087] Trial 2859 finished with value: 0.9627445816993714 and parameters: {'fp_type': 'morgan', 'morgan_only_radius': 2, 'morgan_only_nBits': 2048, 'num_hidden_layers': 3, 'hidden_dim_0': 512, 'hidden_dim_1': 128, 'hidden_dim_2': 512, 'kl_weight': 0.0001940650799522573, 'lr': 0.001554999619050174, 'batch_size': 32, 'dropout_rate': 0.43536918429158344, 'prior_mu': 0.015786575162875887, 'prior_sigma': 0.07287717873153897, 'normalization': 'none'}. Best is trial 2752 with value: 0.5150722622871399.
Generating morgan fingerprints...
Generated fingerprints with 2048 features for 900 molecules
Data shape: X=(900, 2048), y=(900,)
Trial 2858: 5-fold CV loss = 0.5226
[I 2025-08-08 08:17:22,959] Trial 2858 finished with value: 0.5225785672664642 and parameters: {'fp_type': 'morgan', 'morgan_only_radius': 2, 'morgan_only_nBits': 2048, 'num_hidden_layers': 3, 'hidden_dim_0': 512, 'hidden_dim_1': 128, 'hidden_dim_2': 512, 'kl_weight': 0.00020484679657687286, 'lr': 0.002005355229074263, 'batch_size': 32, 'dropout_rate': 0.3726522209356201, 'prior_mu': 0.017844145025626763, 'prior_sigma': 0.07097640920298523, 'normalization': 'none'}. Best is trial 2752 with value: 0.5150722622871399.
Generating morgan fingerprints...
Generated fingerprints with 2048 features for 900 molecules
Data shape: X=(900, 2048), y=(900,)
Trial 2857: 5-fold CV loss = 0.5216
[I 2025-08-08 08:17:45,362] Trial 2857 finished with value: 0.5215672194957733 and parameters: {'fp_type': 'morgan', 'morgan_only_radius': 2, 'morgan_only_nBits': 2048, 'num_hidden_layers': 3, 'hidden_dim_0': 512, 'hidden_dim_1': 128, 'hidden_dim_2': 512, 'kl_weight': 0.00018937563782784697, 'lr': 0.0020402328203316757, 'batch_size': 32, 'dropout_rate': 0.4336146106830766, 'prior_mu': 0.05254619326408984, 'prior_sigma': 0.06993935026703976, 'normalization': 'none'}. Best is trial 2752 with value: 0.5150722622871399.
Generating morgan fingerprints...
Generated fingerprints with 2048 features for 900 molecules
Data shape: X=(900, 2048), y=(900,)
Trial 2863: 5-fold CV loss = 0.6534
[I 2025-08-08 08:18:17,130] Trial 2863 finished with value: 0.65338134765625 and parameters: {'fp_type': 'morgan', 'morgan_only_radius': 2, 'morgan_only_nBits': 2048, 'num_hidden_layers': 3, 'hidden_dim_0': 512, 'hidden_dim_1': 128, 'hidden_dim_2': 512, 'kl_weight': 0.0009762002620980803, 'lr': 0.002255296534759776, 'batch_size': 64, 'dropout_rate': 0.404449930910604, 'prior_mu': 0.06569833369039613, 'prior_sigma': 0.06181539950835501, 'normalization': 'none'}. Best is trial 2752 with value: 0.5150722622871399.
Generating morgan fingerprints...
Generated fingerprints with 2048 features for 900 molecules
Data shape: X=(900, 2048), y=(900,)
Trial 2862: 5-fold CV loss = 0.5356
[I 2025-08-08 08:18:34,137] Trial 2862 finished with value: 0.5355785131454468 and parameters: {'fp_type': 'morgan', 'morgan_only_radius': 2, 'morgan_only_nBits': 2048, 'num_hidden_layers': 3, 'hidden_dim_0': 512, 'hidden_dim_1': 128, 'hidden_dim_2': 512, 'kl_weight': 0.000962640598328607, 'lr': 0.0022228908452367234, 'batch_size': 32, 'dropout_rate': 0.4314167251455836, 'prior_mu': 0.05358161088149087, 'prior_sigma': 0.061644025383925695, 'normalization': 'none'}. Best is trial 2752 with value: 0.5150722622871399.
Generating morgan fingerprints...
Generated fingerprints with 2048 features for 900 molecules
Data shape: X=(900, 2048), y=(900,)
Trial 2860: 5-fold CV loss = 0.6548
[I 2025-08-08 08:19:09,595] Trial 2860 finished with value: 0.6547524511814118 and parameters: {'fp_type': 'morgan', 'morgan_only_radius': 2, 'morgan_only_nBits': 2048, 'num_hidden_layers': 3, 'hidden_dim_0': 512, 'hidden_dim_1': 128, 'hidden_dim_2': 512, 'kl_weight': 0.00019260019560236592, 'lr': 0.0015616400483176775, 'batch_size': 32, 'dropout_rate': 0.4344035376544487, 'prior_mu': 0.05292182472391562, 'prior_sigma': 0.07140938181162829, 'normalization': 'none'}. Best is trial 2752 with value: 0.5150722622871399.
Generating morgan fingerprints...
Generated fingerprints with 2048 features for 900 molecules
Data shape: X=(900, 2048), y=(900,)
Trial 2864: 5-fold CV loss = 0.5627
[I 2025-08-08 08:19:31,762] Trial 2864 finished with value: 0.5626670718193054 and parameters: {'fp_type': 'morgan', 'morgan_only_radius': 2, 'morgan_only_nBits': 2048, 'num_hidden_layers': 3, 'hidden_dim_0': 512, 'hidden_dim_1': 128, 'hidden_dim_2': 128, 'kl_weight': 0.0007643112415686735, 'lr': 0.001690567080208795, 'batch_size': 32, 'dropout_rate': 0.4434520570242215, 'prior_mu': 0.049883792968668635, 'prior_sigma': 0.07679112941599647, 'normalization': 'layer'}. Best is trial 2752 with value: 0.5150722622871399.
Generating morgan fingerprints...
Generated fingerprints with 2048 features for 900 molecules
Data shape: X=(900, 2048), y=(900,)
Trial 2865: 5-fold CV loss = 0.5425
