[I 2025-08-07 18:47:38,338] Trial 558 finished with value: 0.5502835571765899 and parameters: {'fp_type': 'morgan', 'morgan_only_radius': 2, 'morgan_only_nBits': 1024, 'num_hidden_layers': 3, 'hidden_dim_0': 128, 'hidden_dim_1': 128, 'hidden_dim_2': 512, 'kl_weight': 0.0018127321601351352, 'lr': 0.002001634399325891, 'batch_size': 32, 'dropout_rate': 0.447767543416458, 'prior_mu': -0.008341986287016347, 'prior_sigma': 0.07887064769957176, 'normalization': 'none'}. Best is trial 272 with value: 0.5198344707489013.
Generating morgan fingerprints...
Generated fingerprints with 1024 features for 900 molecules
Data shape: X=(900, 1024), y=(900,)
Trial 559: 5-fold CV loss = 0.5299
[I 2025-08-07 18:48:39,104] Trial 559 finished with value: 0.5299372851848603 and parameters: {'fp_type': 'morgan', 'morgan_only_radius': 2, 'morgan_only_nBits': 1024, 'num_hidden_layers': 3, 'hidden_dim_0': 512, 'hidden_dim_1': 128, 'hidden_dim_2': 512, 'kl_weight': 0.0018518005100716876, 'lr': 0.002001058378797938, 'batch_size': 32, 'dropout_rate': 0.44795652746394343, 'prior_mu': -0.005748050378132433, 'prior_sigma': 0.07047687927433059, 'normalization': 'none'}. Best is trial 272 with value: 0.5198344707489013.
Generating morgan fingerprints...
Generated fingerprints with 1024 features for 900 molecules
Data shape: X=(900, 1024), y=(900,)
Trial 562: 5-fold CV loss = 0.6154
[I 2025-08-07 18:48:44,723] Trial 562 finished with value: 0.6153623402118683 and parameters: {'fp_type': 'morgan', 'morgan_only_radius': 2, 'morgan_only_nBits': 1024, 'num_hidden_layers': 3, 'hidden_dim_0': 512, 'hidden_dim_1': 128, 'hidden_dim_2': 512, 'kl_weight': 0.0022448845498588338, 'lr': 0.001635671733938189, 'batch_size': 32, 'dropout_rate': 0.4797813525772174, 'prior_mu': -0.006153332831155956, 'prior_sigma': 0.07083366891638333, 'normalization': 'none'}. Best is trial 272 with value: 0.5198344707489013.
Generating morgan fingerprints...
Generated fingerprints with 1024 features for 900 molecules
Data shape: X=(900, 1024), y=(900,)
Trial 563: 5-fold CV loss = 0.6451
[I 2025-08-07 18:49:44,961] Trial 563 finished with value: 0.645069134235382 and parameters: {'fp_type': 'morgan', 'morgan_only_radius': 2, 'morgan_only_nBits': 1024, 'num_hidden_layers': 3, 'hidden_dim_0': 512, 'hidden_dim_1': 128, 'hidden_dim_2': 512, 'kl_weight': 0.0022851288962715535, 'lr': 0.0016014214845299374, 'batch_size': 32, 'dropout_rate': 0.4806198304742665, 'prior_mu': -0.041306273367468276, 'prior_sigma': 0.07301969615974481, 'normalization': 'none'}. Best is trial 272 with value: 0.5198344707489013.
Generating morgan fingerprints...
Generated fingerprints with 1024 features for 900 molecules
Data shape: X=(900, 1024), y=(900,)
Trial 564: 5-fold CV loss = 0.5730
[I 2025-08-07 18:49:55,707] Trial 564 finished with value: 0.572974681854248 and parameters: {'fp_type': 'morgan', 'morgan_only_radius': 2, 'morgan_only_nBits': 1024, 'num_hidden_layers': 3, 'hidden_dim_0': 512, 'hidden_dim_1': 128, 'hidden_dim_2': 512, 'kl_weight': 0.0014091907804227347, 'lr': 0.0025522607548472387, 'batch_size': 32, 'dropout_rate': 0.16267515041955602, 'prior_mu': -0.03466720891300076, 'prior_sigma': 0.07393238663095435, 'normalization': 'none'}. Best is trial 272 with value: 0.5198344707489013.
Generating morgan fingerprints...
Generated fingerprints with 1024 features for 900 molecules
Data shape: X=(900, 1024), y=(900,)
Trial 561: 5-fold CV loss = 0.5264
[I 2025-08-07 18:50:20,306] Trial 561 finished with value: 0.5264236450195312 and parameters: {'fp_type': 'morgan', 'morgan_only_radius': 2, 'morgan_only_nBits': 1024, 'num_hidden_layers': 3, 'hidden_dim_0': 512, 'hidden_dim_1': 128, 'hidden_dim_2': 512, 'kl_weight': 0.002261326234619487, 'lr': 0.0019640011585348007, 'batch_size': 32, 'dropout_rate': 0.4488175008015173, 'prior_mu': -0.003847049153280109, 'prior_sigma': 0.07078473839440994, 'normalization': 'none'}. Best is trial 272 with value: 0.5198344707489013.
Generating morgan fingerprints...
Generated fingerprints with 1024 features for 900 molecules
Data shape: X=(900, 1024), y=(900,)
Trial 565: 5-fold CV loss = 0.5629
[I 2025-08-07 18:50:36,333] Trial 565 finished with value: 0.5628602802753448 and parameters: {'fp_type': 'morgan', 'morgan_only_radius': 2, 'morgan_only_nBits': 1024, 'num_hidden_layers': 3, 'hidden_dim_0': 512, 'hidden_dim_1': 128, 'hidden_dim_2': 512, 'kl_weight': 0.001425321231827046, 'lr': 0.0024666069692726987, 'batch_size': 32, 'dropout_rate': 0.14914011082243558, 'prior_mu': -0.031057315665477626, 'prior_sigma': 0.06670034139632444, 'normalization': 'none'}. Best is trial 272 with value: 0.5198344707489013.
Generating morgan fingerprints...
Generated fingerprints with 1024 features for 900 molecules
Data shape: X=(900, 1024), y=(900,)
Trial 568: 5-fold CV loss = 0.5864
[I 2025-08-07 18:51:01,311] Trial 568 finished with value: 0.5863521218299865 and parameters: {'fp_type': 'morgan', 'morgan_only_radius': 2, 'morgan_only_nBits': 1024, 'num_hidden_layers': 1, 'hidden_dim_0': 256, 'kl_weight': 0.0021694426202528323, 'lr': 0.0018923764386869328, 'batch_size': 32, 'dropout_rate': 0.4451953278002599, 'prior_mu': -0.022329427048900525, 'prior_sigma': 0.07550441669245876, 'normalization': 'layer'}. Best is trial 272 with value: 0.5198344707489013.
Generating morgan fingerprints...
Generated fingerprints with 1024 features for 900 molecules
Data shape: X=(900, 1024), y=(900,)
Trial 560: 5-fold CV loss = 0.5680
[I 2025-08-07 18:51:18,466] Trial 560 finished with value: 0.5680276036262513 and parameters: {'fp_type': 'morgan', 'morgan_only_radius': 2, 'morgan_only_nBits': 1024, 'num_hidden_layers': 3, 'hidden_dim_0': 512, 'hidden_dim_1': 128, 'hidden_dim_2': 512, 'kl_weight': 0.002268878026796322, 'lr': 0.001996615833525036, 'batch_size': 32, 'dropout_rate': 0.4472927133020571, 'prior_mu': -0.006197696026040634, 'prior_sigma': 0.07055055014780226, 'normalization': 'none'}. Best is trial 272 with value: 0.5198344707489013.
Generating morgan fingerprints...
Generated fingerprints with 1024 features for 900 molecules
Data shape: X=(900, 1024), y=(900,)
Trial 566: 5-fold CV loss = 0.5350
[I 2025-08-07 18:51:19,380] Trial 566 finished with value: 0.534979498386383 and parameters: {'fp_type': 'morgan', 'morgan_only_radius': 2, 'morgan_only_nBits': 1024, 'num_hidden_layers': 3, 'hidden_dim_0': 64, 'hidden_dim_1': 128, 'hidden_dim_2': 512, 'kl_weight': 0.0024753642869052824, 'lr': 0.002338554389004521, 'batch_size': 32, 'dropout_rate': 0.4893874091242085, 'prior_mu': 0.011133335680204366, 'prior_sigma': 0.06774939085244691, 'normalization': 'layer'}. Best is trial 272 with value: 0.5198344707489013.
Generating morgan fingerprints...
Generated fingerprints with 1024 features for 900 molecules
Data shape: X=(900, 1024), y=(900,)
Trial 569: 5-fold CV loss = 0.6483
[I 2025-08-07 18:51:55,391] Trial 569 finished with value: 0.6483487486839294 and parameters: {'fp_type': 'morgan', 'morgan_only_radius': 2, 'morgan_only_nBits': 1024, 'num_hidden_layers': 3, 'hidden_dim_0': 512, 'hidden_dim_1': 128, 'hidden_dim_2': 512, 'kl_weight': 0.0024431668967752887, 'lr': 0.0016665252063204896, 'batch_size': 32, 'dropout_rate': 0.45582911741339516, 'prior_mu': 0.012795848026616522, 'prior_sigma': 0.07014008655079014, 'normalization': 'none'}. Best is trial 272 with value: 0.5198344707489013.
Generating morgan fingerprints...
Generated fingerprints with 1024 features for 900 molecules
Data shape: X=(900, 1024), y=(900,)
Trial 567: 5-fold CV loss = 0.5616
[I 2025-08-07 18:52:02,014] Trial 567 finished with value: 0.5616396725177765 and parameters: {'fp_type': 'morgan', 'morgan_only_radius': 2, 'morgan_only_nBits': 1024, 'num_hidden_layers': 3, 'hidden_dim_0': 64, 'hidden_dim_1': 128, 'hidden_dim_2': 512, 'kl_weight': 0.0020869549445500677, 'lr': 0.0018919923232879356, 'batch_size': 32, 'dropout_rate': 0.4546466650314739, 'prior_mu': -0.024727846331537226, 'prior_sigma': 0.06848328950486055, 'normalization': 'layer'}. Best is trial 272 with value: 0.5198344707489013.
Generating morgan fingerprints...
Generated fingerprints with 1024 features for 900 molecules
Data shape: X=(900, 1024), y=(900,)
Trial 571: 5-fold CV loss = 0.7390
[I 2025-08-07 18:52:02,454] Trial 571 finished with value: 0.7389973759651184 and parameters: {'fp_type': 'morgan', 'morgan_only_radius': 2, 'morgan_only_nBits': 1024, 'num_hidden_layers': 3, 'hidden_dim_0': 512, 'hidden_dim_1': 1024, 'hidden_dim_2': 64, 'kl_weight': 0.0015779542557492674, 'lr': 0.0016755682429646231, 'batch_size': 32, 'dropout_rate': 0.4918611425114483, 'prior_mu': -0.023858751925189173, 'prior_sigma': 0.06971344664764212, 'normalization': 'none'}. Best is trial 272 with value: 0.5198344707489013.
Generating morgan fingerprints...
Generated fingerprints with 1024 features for 900 molecules
Data shape: X=(900, 1024), y=(900,)
Trial 572: 5-fold CV loss = 0.6882
[I 2025-08-07 18:52:45,265] Trial 572 finished with value: 0.6881857573986053 and parameters: {'fp_type': 'morgan', 'morgan_only_radius': 2, 'morgan_only_nBits': 1024, 'num_hidden_layers': 3, 'hidden_dim_0': 512, 'hidden_dim_1': 128, 'hidden_dim_2': 64, 'kl_weight': 0.0020079961700891426, 'lr': 0.00213919854617315, 'batch_size': 32, 'dropout_rate': 0.48912609656457884, 'prior_mu': -0.02370419187064959, 'prior_sigma': 0.08291070447381274, 'normalization': 'none'}. Best is trial 272 with value: 0.5198344707489013.
Generating morgan fingerprints...
Generated fingerprints with 1024 features for 900 molecules
Data shape: X=(900, 1024), y=(900,)
Trial 574: 5-fold CV loss = 0.6603
[I 2025-08-07 18:52:48,333] Trial 574 finished with value: 0.6603248238563537 and parameters: {'fp_type': 'morgan', 'morgan_only_radius': 2, 'morgan_only_nBits': 1024, 'num_hidden_layers': 2, 'hidden_dim_0': 512, 'hidden_dim_1': 128, 'kl_weight': 0.0016683195405909103, 'lr': 0.002131217531112843, 'batch_size': 32, 'dropout_rate': 0.4838972954227353, 'prior_mu': -0.04131516851295232, 'prior_sigma': 0.07557574069828271, 'normalization': 'none'}. Best is trial 272 with value: 0.5198344707489013.
Generating morgan fingerprints...
Generated fingerprints with 1024 features for 900 molecules
Data shape: X=(900, 1024), y=(900,)
Trial 573: 5-fold CV loss = 0.7032
[I 2025-08-07 18:52:51,509] Trial 573 finished with value: 0.7031662583351135 and parameters: {'fp_type': 'morgan', 'morgan_only_radius': 2, 'morgan_only_nBits': 1024, 'num_hidden_layers': 2, 'hidden_dim_0': 512, 'hidden_dim_1': 128, 'kl_weight': 0.001603623663263652, 'lr': 0.002138682906700418, 'batch_size': 32, 'dropout_rate': 0.4910590618107102, 'prior_mu': -0.04056886304375943, 'prior_sigma': 0.07343024322824454, 'normalization': 'none'}. Best is trial 272 with value: 0.5198344707489013.
Generating morgan fingerprints...
Generated fingerprints with 1024 features for 900 molecules
Data shape: X=(900, 1024), y=(900,)
Trial 575: 5-fold CV loss = 0.5296
[I 2025-08-07 18:53:48,521] Trial 575 finished with value: 0.5295752048492431 and parameters: {'fp_type': 'morgan', 'morgan_only_radius': 2, 'morgan_only_nBits': 1024, 'num_hidden_layers': 3, 'hidden_dim_0': 512, 'hidden_dim_1': 128, 'hidden_dim_2': 512, 'kl_weight': 0.001917254842598657, 'lr': 0.00211472400537299, 'batch_size': 32, 'dropout_rate': 0.47657788547294755, 'prior_mu': -0.038582897035650134, 'prior_sigma': 0.07514358999360149, 'normalization': 'none'}. Best is trial 272 with value: 0.5198344707489013.
Generating morgan fingerprints...
Generated fingerprints with 1024 features for 900 molecules
Data shape: X=(900, 1024), y=(900,)
Trial 578: 5-fold CV loss = 0.6558
[I 2025-08-07 18:54:02,691] Trial 578 finished with value: 0.6557631731033325 and parameters: {'fp_type': 'morgan', 'morgan_only_radius': 2, 'morgan_only_nBits': 1024, 'num_hidden_layers': 0, 'kl_weight': 0.002557225563934568, 'lr': 0.001923443990339508, 'batch_size': 32, 'dropout_rate': 0.47400100781328164, 'prior_mu': -0.009713140181171608, 'prior_sigma': 0.06520630425441482, 'normalization': 'none'}. Best is trial 272 with value: 0.5198344707489013.
Generating morgan fingerprints...
Generated fingerprints with 1024 features for 900 molecules
Data shape: X=(900, 1024), y=(900,)
Trial 577: 5-fold CV loss = 0.9133
[I 2025-08-07 18:54:07,045] Trial 577 finished with value: 0.9132535338401795 and parameters: {'fp_type': 'morgan', 'morgan_only_radius': 2, 'morgan_only_nBits': 1024, 'num_hidden_layers': 3, 'hidden_dim_0': 512, 'hidden_dim_1': 512, 'hidden_dim_2': 512, 'kl_weight': 0.00135724225834278, 'lr': 0.0014780377718001424, 'batch_size': 32, 'dropout_rate': 0.47506308637592387, 'prior_mu': -0.007964632418408096, 'prior_sigma': 0.06544962562853536, 'normalization': 'none'}. Best is trial 272 with value: 0.5198344707489013.
Generating morgan fingerprints...
Generated fingerprints with 1024 features for 900 molecules
Data shape: X=(900, 1024), y=(900,)
Trial 579: 5-fold CV loss = 1.1573
[I 2025-08-07 18:54:27,826] Trial 579 finished with value: 1.1572681069374084 and parameters: {'fp_type': 'morgan', 'morgan_only_radius': 2, 'morgan_only_nBits': 1024, 'num_hidden_layers': 3, 'hidden_dim_0': 512, 'hidden_dim_1': 512, 'hidden_dim_2': 512, 'kl_weight': 0.0013428819690885997, 'lr': 0.001488593990642796, 'batch_size': 32, 'dropout_rate': 0.45740342447011056, 'prior_mu': -0.18661582698554785, 'prior_sigma': 0.06422755741008683, 'normalization': 'none'}. Best is trial 272 with value: 0.5198344707489013.
Generating rdkit fingerprints...
Generated fingerprints with 256 features for 900 molecules
Data shape: X=(900, 256), y=(900,)
Trial 576: 5-fold CV loss = 0.5289
[I 2025-08-07 18:55:08,989] Trial 576 finished with value: 0.5289088070392609 and parameters: {'fp_type': 'morgan', 'morgan_only_radius': 2, 'morgan_only_nBits': 1024, 'num_hidden_layers': 3, 'hidden_dim_0': 512, 'hidden_dim_1': 128, 'hidden_dim_2': 512, 'kl_weight': 0.0019267588305341506, 'lr': 0.0018961012115924038, 'batch_size': 32, 'dropout_rate': 0.4764809469724104, 'prior_mu': -0.04245696199501236, 'prior_sigma': 0.06453002443911661, 'normalization': 'none'}. Best is trial 272 with value: 0.5198344707489013.
Generating rdkit fingerprints...
Generated fingerprints with 256 features for 900 molecules
Data shape: X=(900, 256), y=(900,)
Trial 581: 5-fold CV loss = 0.6735
[I 2025-08-07 18:55:11,346] Trial 581 finished with value: 0.6734524846076966 and parameters: {'fp_type': 'rdkit', 'rdkit_only_maxPath': 8, 'rdkit_only_nBits': 256, 'num_hidden_layers': 3, 'hidden_dim_0': 512, 'hidden_dim_1': 128, 'hidden_dim_2': 128, 'kl_weight': 0.0019446806932864851, 'lr': 0.002313110998151249, 'batch_size': 32, 'dropout_rate': 0.4999540349959328, 'prior_mu': -0.030710923228204443, 'prior_sigma': 0.06892250735344084, 'normalization': 'none'}. Best is trial 272 with value: 0.5198344707489013.
Generating morgan fingerprints...
Generated fingerprints with 1024 features for 900 molecules
Data shape: X=(900, 1024), y=(900,)
Trial 582: 5-fold CV loss = 0.6733
[I 2025-08-07 18:56:02,819] Trial 582 finished with value: 0.6732543706893921 and parameters: {'fp_type': 'rdkit', 'rdkit_only_maxPath': 8, 'rdkit_only_nBits': 256, 'num_hidden_layers': 3, 'hidden_dim_0': 512, 'hidden_dim_1': 128, 'hidden_dim_2': 128, 'kl_weight': 0.0026242944042478887, 'lr': 0.0024310725631239653, 'batch_size': 32, 'dropout_rate': 0.4901999247116693, 'prior_mu': 0.004273885321246269, 'prior_sigma': 0.06941265209683557, 'normalization': 'none'}. Best is trial 272 with value: 0.5198344707489013.
Generating morgan fingerprints...
Generated fingerprints with 1024 features for 900 molecules
Data shape: X=(900, 1024), y=(900,)
Trial 570: 5-fold CV loss = 0.5686
[I 2025-08-07 18:56:05,311] Trial 570 finished with value: 0.5685921430587768 and parameters: {'fp_type': 'morgan', 'morgan_only_radius': 2, 'morgan_only_nBits': 1024, 'num_hidden_layers': 3, 'hidden_dim_0': 64, 'hidden_dim_1': 128, 'hidden_dim_2': 512, 'kl_weight': 0.0017131267028851842, 'lr': 0.001666577760146034, 'batch_size': 32, 'dropout_rate': 0.4570361658081428, 'prior_mu': 0.0094271547953182, 'prior_sigma': 0.06964582143387257, 'normalization': 'none'}. Best is trial 272 with value: 0.5198344707489013.
Generating morgan fingerprints...
Generated fingerprints with 1024 features for 900 molecules
Data shape: X=(900, 1024), y=(900,)
Trial 580: 5-fold CV loss = 0.5223
[I 2025-08-07 18:56:12,183] Trial 580 finished with value: 0.5223363101482391 and parameters: {'fp_type': 'morgan', 'morgan_only_radius': 2, 'morgan_only_nBits': 1024, 'num_hidden_layers': 3, 'hidden_dim_0': 512, 'hidden_dim_1': 128, 'hidden_dim_2': 512, 'kl_weight': 0.0018280834978946212, 'lr': 0.0024113224706863276, 'batch_size': 32, 'dropout_rate': 0.4588070746950626, 'prior_mu': 0.000970555285763057, 'prior_sigma': 0.06368272380909053, 'normalization': 'none'}. Best is trial 272 with value: 0.5198344707489013.
Generating morgan fingerprints...
Generated fingerprints with 1024 features for 900 molecules
Data shape: X=(900, 1024), y=(900,)
Trial 583: 5-fold CV loss = 0.5339
[I 2025-08-07 18:56:14,927] Trial 583 finished with value: 0.5339239478111267 and parameters: {'fp_type': 'morgan', 'morgan_only_radius': 2, 'morgan_only_nBits': 1024, 'num_hidden_layers': 3, 'hidden_dim_0': 512, 'hidden_dim_1': 128, 'hidden_dim_2': 512, 'kl_weight': 0.0026047349368664183, 'lr': 0.002539904165114271, 'batch_size': 32, 'dropout_rate': 0.4910482313363485, 'prior_mu': 0.00021051599661353615, 'prior_sigma': 0.07200672351867538, 'normalization': 'none'}. Best is trial 272 with value: 0.5198344707489013.
Generating morgan fingerprints...
Generated fingerprints with 1024 features for 900 molecules
Data shape: X=(900, 1024), y=(900,)
Trial 584: 5-fold CV loss = 0.5343
[I 2025-08-07 18:57:06,427] Trial 584 finished with value: 0.5342706322669983 and parameters: {'fp_type': 'morgan', 'morgan_only_radius': 2, 'morgan_only_nBits': 1024, 'num_hidden_layers': 3, 'hidden_dim_0': 512, 'hidden_dim_1': 128, 'hidden_dim_2': 512, 'kl_weight': 0.0016844338600689103, 'lr': 0.0025706675614500935, 'batch_size': 32, 'dropout_rate': 0.48414630515622226, 'prior_mu': -0.01631338331356877, 'prior_sigma': 0.07328814830447081, 'normalization': 'none'}. Best is trial 272 with value: 0.5198344707489013.
Generating morgan fingerprints...
Generated fingerprints with 1024 features for 900 molecules
Data shape: X=(900, 1024), y=(900,)
Trial 587: 5-fold CV loss = 0.5312
[I 2025-08-07 18:57:12,959] Trial 587 finished with value: 0.5311509907245636 and parameters: {'fp_type': 'morgan', 'morgan_only_radius': 2, 'morgan_only_nBits': 1024, 'num_hidden_layers': 3, 'hidden_dim_0': 512, 'hidden_dim_1': 128, 'hidden_dim_2': 512, 'kl_weight': 0.0017854766555994233, 'lr': 0.0027433589348728254, 'batch_size': 32, 'dropout_rate': 0.4397421857405289, 'prior_mu': 0.018423620620935728, 'prior_sigma': 0.06654367241798034, 'normalization': 'none'}. Best is trial 272 with value: 0.5198344707489013.
Generating morgan fingerprints...
Generated fingerprints with 1024 features for 900 molecules
Data shape: X=(900, 1024), y=(900,)
Trial 588: 5-fold CV loss = 0.9963
[I 2025-08-07 18:57:38,120] Trial 588 finished with value: 0.996329665184021 and parameters: {'fp_type': 'morgan', 'morgan_only_radius': 2, 'morgan_only_nBits': 1024, 'num_hidden_layers': 3, 'hidden_dim_0': 512, 'hidden_dim_1': 128, 'hidden_dim_2': 512, 'kl_weight': 0.001572065505065462, 'lr': 0.00024924507768871445, 'batch_size': 32, 'dropout_rate': 0.4613496476157795, 'prior_mu': 0.018998406700998043, 'prior_sigma': 0.06668431829057915, 'normalization': 'none'}. Best is trial 272 with value: 0.5198344707489013.
Generating morgan fingerprints...
Generated fingerprints with 1024 features for 900 molecules
Data shape: X=(900, 1024), y=(900,)
Trial 586: 5-fold CV loss = 0.5329
[I 2025-08-07 18:58:05,704] Trial 586 finished with value: 0.53287832736969 and parameters: {'fp_type': 'morgan', 'morgan_only_radius': 2, 'morgan_only_nBits': 1024, 'num_hidden_layers': 3, 'hidden_dim_0': 512, 'hidden_dim_1': 128, 'hidden_dim_2': 512, 'kl_weight': 0.001450676505264917, 'lr': 0.002746228355130292, 'batch_size': 32, 'dropout_rate': 0.4474652661068987, 'prior_mu': 0.020794868464581527, 'prior_sigma': 0.07778027140208722, 'normalization': 'none'}. Best is trial 272 with value: 0.5198344707489013.
Generating morgan fingerprints...
Generated fingerprints with 1024 features for 900 molecules
Data shape: X=(900, 1024), y=(900,)
Trial 589: 5-fold CV loss = 0.5317
[I 2025-08-07 18:58:12,006] Trial 589 finished with value: 0.5316873669624329 and parameters: {'fp_type': 'morgan', 'morgan_only_radius': 2, 'morgan_only_nBits': 1024, 'num_hidden_layers': 3, 'hidden_dim_0': 512, 'hidden_dim_1': 128, 'hidden_dim_2': 512, 'kl_weight': 0.0015130890513583605, 'lr': 0.003028463032511796, 'batch_size': 32, 'dropout_rate': 0.46150104889645344, 'prior_mu': -0.04881052408534818, 'prior_sigma': 0.07806753974285029, 'normalization': 'none'}. Best is trial 272 with value: 0.5198344707489013.
Generating morgan fingerprints...
Generated fingerprints with 1024 features for 900 molecules
Data shape: X=(900, 1024), y=(900,)
Trial 590: 5-fold CV loss = 0.5353
[I 2025-08-07 18:58:48,084] Trial 590 finished with value: 0.5353440701961517 and parameters: {'fp_type': 'morgan', 'morgan_only_radius': 2, 'morgan_only_nBits': 1024, 'num_hidden_layers': 3, 'hidden_dim_0': 512, 'hidden_dim_1': 128, 'hidden_dim_2': 512, 'kl_weight': 0.002185932141258388, 'lr': 0.0029717083665478958, 'batch_size': 32, 'dropout_rate': 0.43047072861651525, 'prior_mu': -0.04872460720307016, 'prior_sigma': 0.07785440650485481, 'normalization': 'none'}. Best is trial 272 with value: 0.5198344707489013.
Generating morgan fingerprints...
Generated fingerprints with 1024 features for 900 molecules
Data shape: X=(900, 1024), y=(900,)
Trial 585: 5-fold CV loss = 0.5442
