[I 2025-08-07 17:05:03,815] Trial 304 finished with value: 0.5501503348350525 and parameters: {'fp_type': 'morgan', 'morgan_only_radius': 2, 'morgan_only_nBits': 2048, 'num_hidden_layers': 3, 'hidden_dim_0': 64, 'hidden_dim_1': 256, 'hidden_dim_2': 512, 'kl_weight': 0.0011617265519675143, 'lr': 0.0024787729757745295, 'batch_size': 32, 'dropout_rate': 0.4991348185397268, 'prior_mu': -0.0682203995746887, 'prior_sigma': 0.04913141145872306, 'normalization': 'none'}. Best is trial 272 with value: 0.5198344707489013.
Generating morgan fingerprints...
Generated fingerprints with 1024 features for 900 molecules
Data shape: X=(900, 1024), y=(900,)
Trial 303: 5-fold CV loss = 0.5502
[I 2025-08-07 17:05:04,140] Trial 303 finished with value: 0.5502070665359498 and parameters: {'fp_type': 'morgan', 'morgan_only_radius': 2, 'morgan_only_nBits': 2048, 'num_hidden_layers': 3, 'hidden_dim_0': 64, 'hidden_dim_1': 256, 'hidden_dim_2': 512, 'kl_weight': 0.0017410627887553402, 'lr': 0.0019298670798601149, 'batch_size': 32, 'dropout_rate': 0.49075316334926755, 'prior_mu': -0.05687556113952905, 'prior_sigma': 0.04912024835868813, 'normalization': 'none'}. Best is trial 272 with value: 0.5198344707489013.
Generating morgan fingerprints...
Generated fingerprints with 1024 features for 900 molecules
Data shape: X=(900, 1024), y=(900,)
Trial 302: 5-fold CV loss = 0.5988
[I 2025-08-07 17:05:05,879] Trial 302 finished with value: 0.5987997233867646 and parameters: {'fp_type': 'morgan', 'morgan_only_radius': 2, 'morgan_only_nBits': 2048, 'num_hidden_layers': 3, 'hidden_dim_0': 64, 'hidden_dim_1': 256, 'hidden_dim_2': 512, 'kl_weight': 0.0009830119122548762, 'lr': 0.0015471742946731133, 'batch_size': 32, 'dropout_rate': 0.48653966588792164, 'prior_mu': -0.0469220373350169, 'prior_sigma': 0.06129207923100162, 'normalization': 'none'}. Best is trial 272 with value: 0.5198344707489013.
Generating morgan fingerprints...
Generated fingerprints with 1024 features for 900 molecules
Data shape: X=(900, 1024), y=(900,)
Trial 306: 5-fold CV loss = 0.6112
[I 2025-08-07 17:05:52,472] Trial 306 finished with value: 0.6111867904663086 and parameters: {'fp_type': 'morgan', 'morgan_only_radius': 2, 'morgan_only_nBits': 1024, 'num_hidden_layers': 3, 'hidden_dim_0': 512, 'hidden_dim_1': 256, 'hidden_dim_2': 128, 'kl_weight': 0.0013201076040167644, 'lr': 0.001962073565893812, 'batch_size': 32, 'dropout_rate': 0.48674373574306545, 'prior_mu': -0.058792557102312605, 'prior_sigma': 0.051059463401985035, 'normalization': 'none'}. Best is trial 272 with value: 0.5198344707489013.
Generating morgan fingerprints...
Generated fingerprints with 1024 features for 900 molecules
Data shape: X=(900, 1024), y=(900,)
Trial 307: 5-fold CV loss = 0.6138
[I 2025-08-07 17:06:00,848] Trial 307 finished with value: 0.6138028264045715 and parameters: {'fp_type': 'morgan', 'morgan_only_radius': 2, 'morgan_only_nBits': 1024, 'num_hidden_layers': 3, 'hidden_dim_0': 512, 'hidden_dim_1': 256, 'hidden_dim_2': 128, 'kl_weight': 0.00018181330484975028, 'lr': 0.0024276404937483152, 'batch_size': 32, 'dropout_rate': 0.49954488858550855, 'prior_mu': -0.0487629778178795, 'prior_sigma': 0.057703849685380254, 'normalization': 'none'}. Best is trial 272 with value: 0.5198344707489013.
Generating morgan fingerprints...
Generated fingerprints with 1024 features for 900 molecules
Data shape: X=(900, 1024), y=(900,)
Trial 309: 5-fold CV loss = 0.6161
[I 2025-08-07 17:06:32,092] Trial 309 finished with value: 0.6161217570304871 and parameters: {'fp_type': 'morgan', 'morgan_only_radius': 2, 'morgan_only_nBits': 1024, 'num_hidden_layers': 3, 'hidden_dim_0': 512, 'hidden_dim_1': 256, 'hidden_dim_2': 64, 'kl_weight': 0.00017940161804376933, 'lr': 0.00010491407065374715, 'batch_size': 32, 'dropout_rate': 0.46130646805865394, 'prior_mu': -0.03698290419536053, 'prior_sigma': 0.056284580785257395, 'normalization': 'none'}. Best is trial 272 with value: 0.5198344707489013.
Generating morgan fingerprints...
Generated fingerprints with 1024 features for 900 molecules
Data shape: X=(900, 1024), y=(900,)
Trial 310: 5-fold CV loss = 0.6448
[I 2025-08-07 17:06:48,574] Trial 310 finished with value: 0.644787073135376 and parameters: {'fp_type': 'morgan', 'morgan_only_radius': 3, 'morgan_only_nBits': 1024, 'num_hidden_layers': 3, 'hidden_dim_0': 512, 'hidden_dim_1': 256, 'hidden_dim_2': 64, 'kl_weight': 0.0014738180476583185, 'lr': 0.0020879899671964078, 'batch_size': 32, 'dropout_rate': 0.46453291143267084, 'prior_mu': -0.036521881313852374, 'prior_sigma': 0.055205097437942705, 'normalization': 'none'}. Best is trial 272 with value: 0.5198344707489013.
Generating morgan fingerprints...
Generated fingerprints with 1024 features for 900 molecules
Data shape: X=(900, 1024), y=(900,)
Trial 308: 5-fold CV loss = 0.6117
[I 2025-08-07 17:06:50,827] Trial 308 finished with value: 0.6116816699504852 and parameters: {'fp_type': 'morgan', 'morgan_only_radius': 2, 'morgan_only_nBits': 1024, 'num_hidden_layers': 3, 'hidden_dim_0': 512, 'hidden_dim_1': 256, 'hidden_dim_2': 64, 'kl_weight': 0.0013253432641181075, 'lr': 0.0022368277677310686, 'batch_size': 32, 'dropout_rate': 0.49910238496422393, 'prior_mu': -0.06196312916887364, 'prior_sigma': 0.05250263097155378, 'normalization': 'none'}. Best is trial 272 with value: 0.5198344707489013.
Generating morgan fingerprints...
Generated fingerprints with 1024 features for 900 molecules
Data shape: X=(900, 1024), y=(900,)
Trial 311: 5-fold CV loss = 2.2093
[I 2025-08-07 17:06:54,244] Trial 311 finished with value: 2.2093040227890013 and parameters: {'fp_type': 'morgan', 'morgan_only_radius': 2, 'morgan_only_nBits': 1024, 'num_hidden_layers': 3, 'hidden_dim_0': 512, 'hidden_dim_1': 256, 'hidden_dim_2': 512, 'kl_weight': 0.00022056839454980586, 'lr': 0.002103526254724561, 'batch_size': 32, 'dropout_rate': 0.4757251301964215, 'prior_mu': -0.05525158147773482, 'prior_sigma': 0.12294064830297183, 'normalization': 'none'}. Best is trial 272 with value: 0.5198344707489013.
Generating morgan fingerprints...
Generated fingerprints with 1024 features for 900 molecules
Data shape: X=(900, 1024), y=(900,)
Trial 312: 5-fold CV loss = 0.6181
[I 2025-08-07 17:07:51,651] Trial 312 finished with value: 0.6181210160255433 and parameters: {'fp_type': 'morgan', 'morgan_only_radius': 2, 'morgan_only_nBits': 1024, 'num_hidden_layers': 3, 'hidden_dim_0': 1024, 'hidden_dim_1': 256, 'hidden_dim_2': 512, 'kl_weight': 0.00019862204211331573, 'lr': 0.002084730057704318, 'batch_size': 32, 'dropout_rate': 0.4777929891135414, 'prior_mu': -0.05417918226398716, 'prior_sigma': 0.06396870633735853, 'normalization': 'none'}. Best is trial 272 with value: 0.5198344707489013.
Generating morgan fingerprints...
Generated fingerprints with 1024 features for 900 molecules
Data shape: X=(900, 1024), y=(900,)
Trial 314: 5-fold CV loss = 0.5239
[I 2025-08-07 17:08:04,790] Trial 314 finished with value: 0.5238750636577606 and parameters: {'fp_type': 'morgan', 'morgan_only_radius': 2, 'morgan_only_nBits': 1024, 'num_hidden_layers': 3, 'hidden_dim_0': 512, 'hidden_dim_1': 256, 'hidden_dim_2': 512, 'kl_weight': 0.0007629487722597018, 'lr': 0.002547952916675566, 'batch_size': 32, 'dropout_rate': 0.48915958649790897, 'prior_mu': -0.0521257813103675, 'prior_sigma': 0.0651606450191398, 'normalization': 'none'}. Best is trial 272 with value: 0.5198344707489013.
Generating morgan fingerprints...
Generated fingerprints with 1024 features for 900 molecules
Data shape: X=(900, 1024), y=(900,)
Trial 313: 5-fold CV loss = 0.8208
[I 2025-08-07 17:08:07,732] Trial 313 finished with value: 0.8208093464374542 and parameters: {'fp_type': 'morgan', 'morgan_only_radius': 2, 'morgan_only_nBits': 1024, 'num_hidden_layers': 3, 'hidden_dim_0': 1024, 'hidden_dim_1': 256, 'hidden_dim_2': 512, 'kl_weight': 0.0007122957989632055, 'lr': 0.0017317942242681859, 'batch_size': 32, 'dropout_rate': 0.44235327730676244, 'prior_mu': -0.04960749990355256, 'prior_sigma': 0.06486728063200066, 'normalization': 'none'}. Best is trial 272 with value: 0.5198344707489013.
Generating morgan fingerprints...
Generated fingerprints with 1024 features for 900 molecules
Data shape: X=(900, 1024), y=(900,)
Trial 305: 5-fold CV loss = 0.5563
[I 2025-08-07 17:08:39,952] Trial 305 finished with value: 0.5563418149948121 and parameters: {'fp_type': 'morgan', 'morgan_only_radius': 2, 'morgan_only_nBits': 1024, 'num_hidden_layers': 3, 'hidden_dim_0': 512, 'hidden_dim_1': 256, 'hidden_dim_2': 128, 'kl_weight': 0.0008079650524945595, 'lr': 0.001975822521907553, 'batch_size': 32, 'dropout_rate': 0.49141808166708895, 'prior_mu': -0.057673201056779824, 'prior_sigma': 0.05015013369351956, 'normalization': 'none'}. Best is trial 272 with value: 0.5198344707489013.
Generating morgan fingerprints...
Generated fingerprints with 1024 features for 900 molecules
Data shape: X=(900, 1024), y=(900,)
Trial 316: 5-fold CV loss = 0.5338
[I 2025-08-07 17:09:11,344] Trial 316 finished with value: 0.5337978720664978 and parameters: {'fp_type': 'morgan', 'morgan_only_radius': 2, 'morgan_only_nBits': 1024, 'num_hidden_layers': 3, 'hidden_dim_0': 512, 'hidden_dim_1': 256, 'hidden_dim_2': 512, 'kl_weight': 0.0007490936814128406, 'lr': 0.002552281279199028, 'batch_size': 32, 'dropout_rate': 0.44804221301327346, 'prior_mu': -0.18671298641337575, 'prior_sigma': 0.059422634529307496, 'normalization': 'none'}. Best is trial 272 with value: 0.5198344707489013.
Generating morgan fingerprints...
Generated fingerprints with 1024 features for 900 molecules
Data shape: X=(900, 1024), y=(900,)
Trial 315: 5-fold CV loss = 0.6537
[I 2025-08-07 17:09:20,152] Trial 315 finished with value: 0.6537430047988891 and parameters: {'fp_type': 'morgan', 'morgan_only_radius': 2, 'morgan_only_nBits': 1024, 'num_hidden_layers': 3, 'hidden_dim_0': 512, 'hidden_dim_1': 256, 'hidden_dim_2': 512, 'kl_weight': 0.0007988290573187344, 'lr': 0.001713981856921061, 'batch_size': 32, 'dropout_rate': 0.444618804183086, 'prior_mu': -0.046025690352702917, 'prior_sigma': 0.058870781944709835, 'normalization': 'none'}. Best is trial 272 with value: 0.5198344707489013.
Generating morgan fingerprints...
Generated fingerprints with 1024 features for 900 molecules
Data shape: X=(900, 1024), y=(900,)
Trial 317: 5-fold CV loss = 0.5314
[I 2025-08-07 17:10:07,984] Trial 317 finished with value: 0.5314454674720764 and parameters: {'fp_type': 'morgan', 'morgan_only_radius': 3, 'morgan_only_nBits': 1024, 'num_hidden_layers': 3, 'hidden_dim_0': 512, 'hidden_dim_1': 256, 'hidden_dim_2': 512, 'kl_weight': 0.0008071306723223732, 'lr': 0.0025881683708036825, 'batch_size': 32, 'dropout_rate': 0.4889303858852116, 'prior_mu': -0.07053485054930418, 'prior_sigma': 0.05930336049672081, 'normalization': 'none'}. Best is trial 272 with value: 0.5198344707489013.
Generating morgan fingerprints...
Generated fingerprints with 1024 features for 900 molecules
Data shape: X=(900, 1024), y=(900,)
Trial 319: 5-fold CV loss = 0.5307
[I 2025-08-07 17:10:23,217] Trial 319 finished with value: 0.5306962013244629 and parameters: {'fp_type': 'morgan', 'morgan_only_radius': 3, 'morgan_only_nBits': 1024, 'num_hidden_layers': 3, 'hidden_dim_0': 512, 'hidden_dim_1': 256, 'hidden_dim_2': 512, 'kl_weight': 0.00020548202209672305, 'lr': 0.002554350917134288, 'batch_size': 32, 'dropout_rate': 0.4834713684846361, 'prior_mu': -0.03428162723816483, 'prior_sigma': 0.065085857027009, 'normalization': 'none'}. Best is trial 272 with value: 0.5198344707489013.
Generating morgan fingerprints...
Generated fingerprints with 1024 features for 900 molecules
Data shape: X=(900, 1024), y=(900,)
Trial 320: 5-fold CV loss = 0.5298
[I 2025-08-07 17:10:36,861] Trial 320 finished with value: 0.5297510743141174 and parameters: {'fp_type': 'morgan', 'morgan_only_radius': 3, 'morgan_only_nBits': 1024, 'num_hidden_layers': 3, 'hidden_dim_0': 512, 'hidden_dim_1': 256, 'hidden_dim_2': 512, 'kl_weight': 0.0034316802052391402, 'lr': 0.0026534304862917916, 'batch_size': 32, 'dropout_rate': 0.4850434082241895, 'prior_mu': -0.06444497258794527, 'prior_sigma': 0.06543056196845712, 'normalization': 'none'}. Best is trial 272 with value: 0.5198344707489013.
Generating morgan fingerprints...
Generated fingerprints with 1024 features for 900 molecules
Data shape: X=(900, 1024), y=(900,)
Trial 322: 5-fold CV loss = 1.3293
[I 2025-08-07 17:10:49,379] Trial 322 finished with value: 1.3293412804603577 and parameters: {'fp_type': 'morgan', 'morgan_only_radius': 3, 'morgan_only_nBits': 1024, 'num_hidden_layers': 3, 'hidden_dim_0': 512, 'hidden_dim_1': 256, 'hidden_dim_2': 512, 'kl_weight': 0.0001801609545365063, 'lr': 0.0002591312277733047, 'batch_size': 32, 'dropout_rate': 0.4674620773274284, 'prior_mu': -0.06944136404651896, 'prior_sigma': 0.06749853041456234, 'normalization': 'none'}. Best is trial 272 with value: 0.5198344707489013.
Generating morgan fingerprints...
Generated fingerprints with 1024 features for 900 molecules
Data shape: X=(900, 1024), y=(900,)
Trial 321: 5-fold CV loss = 1.1958
[I 2025-08-07 17:10:50,053] Trial 321 finished with value: 1.1957627892494203 and parameters: {'fp_type': 'morgan', 'morgan_only_radius': 3, 'morgan_only_nBits': 1024, 'num_hidden_layers': 3, 'hidden_dim_0': 512, 'hidden_dim_1': 256, 'hidden_dim_2': 512, 'kl_weight': 0.0006884485049333546, 'lr': 0.00027061546182300235, 'batch_size': 32, 'dropout_rate': 0.482269001641304, 'prior_mu': -0.03021889209886507, 'prior_sigma': 0.06566962927731007, 'normalization': 'none'}. Best is trial 272 with value: 0.5198344707489013.
Generating morgan fingerprints...
Generated fingerprints with 1024 features for 900 molecules
Data shape: X=(900, 1024), y=(900,)
Trial 318: 5-fold CV loss = 0.8125
[I 2025-08-07 17:11:39,988] Trial 318 finished with value: 0.8125395536422729 and parameters: {'fp_type': 'morgan', 'morgan_only_radius': 3, 'morgan_only_nBits': 1024, 'num_hidden_layers': 3, 'hidden_dim_0': 512, 'hidden_dim_1': 256, 'hidden_dim_2': 512, 'kl_weight': 0.0007513739305195547, 'lr': 0.0011247640701319646, 'batch_size': 32, 'dropout_rate': 0.4828493580909227, 'prior_mu': -0.07157766226106489, 'prior_sigma': 0.05833356002255286, 'normalization': 'none'}. Best is trial 272 with value: 0.5198344707489013.
Generating morgan fingerprints...
Generated fingerprints with 1024 features for 900 molecules
Data shape: X=(900, 1024), y=(900,)
Trial 324: 5-fold CV loss = 0.9582
[I 2025-08-07 17:11:50,419] Trial 324 finished with value: 0.9582240343093872 and parameters: {'fp_type': 'morgan', 'morgan_only_radius': 3, 'morgan_only_nBits': 1024, 'num_hidden_layers': 3, 'hidden_dim_0': 512, 'hidden_dim_1': 256, 'hidden_dim_2': 512, 'kl_weight': 0.003504586474573167, 'lr': 0.0012149139252864035, 'batch_size': 32, 'dropout_rate': 0.4796223290906487, 'prior_mu': -0.07314722209182993, 'prior_sigma': 0.06478808799385814, 'normalization': 'none'}. Best is trial 272 with value: 0.5198344707489013.
Generating morgan fingerprints...
Generated fingerprints with 1024 features for 900 molecules
Data shape: X=(900, 1024), y=(900,)
Trial 323: 5-fold CV loss = 0.5589
[I 2025-08-07 17:11:54,070] Trial 323 finished with value: 0.5588764250278473 and parameters: {'fp_type': 'morgan', 'morgan_only_radius': 3, 'morgan_only_nBits': 1024, 'num_hidden_layers': 3, 'hidden_dim_0': 128, 'hidden_dim_1': 256, 'hidden_dim_2': 512, 'kl_weight': 0.003931709741612111, 'lr': 0.002632093719125163, 'batch_size': 32, 'dropout_rate': 0.46686564363292504, 'prior_mu': -0.07223357430657093, 'prior_sigma': 0.06519627179939047, 'normalization': 'none'}. Best is trial 272 with value: 0.5198344707489013.
Generating morgan fingerprints...
Generated fingerprints with 1024 features for 900 molecules
Data shape: X=(900, 1024), y=(900,)
Trial 328: 5-fold CV loss = 0.6952
[I 2025-08-07 17:12:08,773] Trial 328 finished with value: 0.6952156305313111 and parameters: {'fp_type': 'morgan', 'morgan_only_radius': 3, 'morgan_only_nBits': 1024, 'num_hidden_layers': 0, 'kl_weight': 0.00015993561840603536, 'lr': 0.0025474919355956897, 'batch_size': 32, 'dropout_rate': 0.4729977235952249, 'prior_mu': -0.06333745298743182, 'prior_sigma': 0.06189240368549947, 'normalization': 'none'}. Best is trial 272 with value: 0.5198344707489013.
Generating morgan fingerprints...
Generated fingerprints with 1024 features for 900 molecules
Data shape: X=(900, 1024), y=(900,)
Trial 327: 5-fold CV loss = 0.5397
[I 2025-08-07 17:12:46,487] Trial 327 finished with value: 0.5396967053413391 and parameters: {'fp_type': 'morgan', 'morgan_only_radius': 3, 'morgan_only_nBits': 1024, 'num_hidden_layers': 3, 'hidden_dim_0': 512, 'hidden_dim_1': 256, 'hidden_dim_2': 512, 'kl_weight': 0.0029990480695330692, 'lr': 0.0026686777927544952, 'batch_size': 32, 'dropout_rate': 0.464940634957732, 'prior_mu': -0.03537157056368566, 'prior_sigma': 0.06248211377586082, 'normalization': 'none'}. Best is trial 272 with value: 0.5198344707489013.
Generating morgan fingerprints...
Generated fingerprints with 1024 features for 900 molecules
Data shape: X=(900, 1024), y=(900,)
Trial 325: 5-fold CV loss = 0.5447
[I 2025-08-07 17:13:01,250] Trial 325 finished with value: 0.5446712851524353 and parameters: {'fp_type': 'morgan', 'morgan_only_radius': 3, 'morgan_only_nBits': 1024, 'num_hidden_layers': 3, 'hidden_dim_0': 128, 'hidden_dim_1': 256, 'hidden_dim_2': 512, 'kl_weight': 0.002680839725675129, 'lr': 0.0026322542883547217, 'batch_size': 32, 'dropout_rate': 0.47563520358964917, 'prior_mu': -0.0718470442123188, 'prior_sigma': 0.06373082038886325, 'normalization': 'none'}. Best is trial 272 with value: 0.5198344707489013.
Generating rdkit fingerprints...
Generated fingerprints with 1024 features for 900 molecules
Data shape: X=(900, 1024), y=(900,)
Trial 329: 5-fold CV loss = 0.5378
[I 2025-08-07 17:13:26,381] Trial 329 finished with value: 0.5377868354320526 and parameters: {'fp_type': 'morgan', 'morgan_only_radius': 3, 'morgan_only_nBits': 1024, 'num_hidden_layers': 3, 'hidden_dim_0': 512, 'hidden_dim_1': 256, 'hidden_dim_2': 512, 'kl_weight': 0.0025342187719928984, 'lr': 0.002448143199713183, 'batch_size': 32, 'dropout_rate': 0.4887255358442257, 'prior_mu': -0.03638186102027471, 'prior_sigma': 0.04589125651161831, 'normalization': 'none'}. Best is trial 272 with value: 0.5198344707489013.
Generating morgan fingerprints...
Generated fingerprints with 1024 features for 900 molecules
Data shape: X=(900, 1024), y=(900,)
Trial 330: 5-fold CV loss = 0.5394
[I 2025-08-07 17:13:52,428] Trial 330 finished with value: 0.5393793642520904 and parameters: {'fp_type': 'morgan', 'morgan_only_radius': 3, 'morgan_only_nBits': 1024, 'num_hidden_layers': 3, 'hidden_dim_0': 512, 'hidden_dim_1': 256, 'hidden_dim_2': 512, 'kl_weight': 0.00460116123789192, 'lr': 0.0023980516500049474, 'batch_size': 32, 'dropout_rate': 0.4885350634319051, 'prior_mu': -0.046561408253840364, 'prior_sigma': 0.045342969861578465, 'normalization': 'none'}. Best is trial 272 with value: 0.5198344707489013.
Generating rdkit fingerprints...
Generated fingerprints with 256 features for 900 molecules
Data shape: X=(900, 256), y=(900,)
Trial 332: 5-fold CV loss = 0.5537
[I 2025-08-07 17:14:06,894] Trial 332 finished with value: 0.5536881446838379 and parameters: {'fp_type': 'morgan', 'morgan_only_radius': 3, 'morgan_only_nBits': 1024, 'num_hidden_layers': 2, 'hidden_dim_0': 512, 'hidden_dim_1': 256, 'kl_weight': 0.00020707366869186336, 'lr': 0.002368186957938661, 'batch_size': 32, 'dropout_rate': 0.4892439646177291, 'prior_mu': -0.04899464944284269, 'prior_sigma': 0.05383842105380458, 'normalization': 'layer'}. Best is trial 272 with value: 0.5198344707489013.
Generating rdkit fingerprints...
Generated fingerprints with 256 features for 900 molecules
Data shape: X=(900, 256), y=(900,)
Trial 333: 5-fold CV loss = 0.5961
[I 2025-08-07 17:14:38,274] Trial 333 finished with value: 0.5960964679718017 and parameters: {'fp_type': 'rdkit', 'rdkit_only_maxPath': 5, 'rdkit_only_nBits': 256, 'num_hidden_layers': 2, 'hidden_dim_0': 512, 'hidden_dim_1': 512, 'kl_weight': 0.0035822969693592283, 'lr': 0.0027357183184234806, 'batch_size': 32, 'dropout_rate': 0.45612689815219665, 'prior_mu': -0.09678285479342533, 'prior_sigma': 0.0535168319673343, 'normalization': 'none'}. Best is trial 272 with value: 0.5198344707489013.
Generating morgan fingerprints...
Generated fingerprints with 1024 features for 900 molecules
Data shape: X=(900, 1024), y=(900,)
Trial 331: 5-fold CV loss = 0.5411
[I 2025-08-07 17:14:49,027] Trial 331 finished with value: 0.5411131083965302 and parameters: {'fp_type': 'rdkit', 'rdkit_only_maxPath': 5, 'rdkit_only_nBits': 1024, 'num_hidden_layers': 3, 'hidden_dim_0': 512, 'hidden_dim_1': 512, 'hidden_dim_2': 512, 'kl_weight': 0.005381402159648702, 'lr': 0.0023288517378137613, 'batch_size': 32, 'dropout_rate': 0.4876078241836783, 'prior_mu': -0.06450229556018573, 'prior_sigma': 0.04516325462960122, 'normalization': 'layer'}. Best is trial 272 with value: 0.5198344707489013.
Generating morgan fingerprints...
Generated fingerprints with 1024 features for 900 molecules
Data shape: X=(900, 1024), y=(900,)
Trial 335: 5-fold CV loss = 1.0210
[I 2025-08-07 17:14:58,535] Trial 335 finished with value: 1.0210024118423462 and parameters: {'fp_type': 'morgan', 'morgan_only_radius': 3, 'morgan_only_nBits': 1024, 'num_hidden_layers': 3, 'hidden_dim_0': 512, 'hidden_dim_1': 256, 'hidden_dim_2': 512, 'kl_weight': 0.00020491334974670302, 'lr': 0.0007789687063588229, 'batch_size': 32, 'dropout_rate': 0.48060197854506725, 'prior_mu': -0.06238262840605391, 'prior_sigma': 0.05962672359745441, 'normalization': 'none'}. Best is trial 272 with value: 0.5198344707489013.
Generating morgan fingerprints...
Generated fingerprints with 1024 features for 900 molecules
Data shape: X=(900, 1024), y=(900,)
Trial 334: 5-fold CV loss = 0.6148
