[I 2025-08-08 06:55:46,043] Trial 2615 finished with value: 0.9746487200260162 and parameters: {'fp_type': 'morgan', 'morgan_only_radius': 2, 'morgan_only_nBits': 2048, 'num_hidden_layers': 3, 'hidden_dim_0': 512, 'hidden_dim_1': 128, 'hidden_dim_2': 256, 'kl_weight': 0.0005443755976728326, 'lr': 0.0017758411880437854, 'batch_size': 32, 'dropout_rate': 0.4301340949978573, 'prior_mu': 0.025570717347122417, 'prior_sigma': 0.07593112265276324, 'normalization': 'none'}. Best is trial 2426 with value: 0.515486741065979.
Generating morgan fingerprints...
Generated fingerprints with 2048 features for 900 molecules
Data shape: X=(900, 2048), y=(900,)
Trial 2614: 5-fold CV loss = 0.5334
[I 2025-08-08 06:56:05,683] Trial 2614 finished with value: 0.5333972811698914 and parameters: {'fp_type': 'morgan', 'morgan_only_radius': 2, 'morgan_only_nBits': 2048, 'num_hidden_layers': 3, 'hidden_dim_0': 512, 'hidden_dim_1': 128, 'hidden_dim_2': 512, 'kl_weight': 0.0005293492921938589, 'lr': 0.0017963382928949342, 'batch_size': 32, 'dropout_rate': 0.42867232523262305, 'prior_mu': 0.026492163125796293, 'prior_sigma': 0.09063086116495733, 'normalization': 'none'}. Best is trial 2426 with value: 0.515486741065979.
Generating morgan fingerprints...
Generated fingerprints with 2048 features for 900 molecules
Data shape: X=(900, 2048), y=(900,)
Trial 2616: 5-fold CV loss = 0.5379
[I 2025-08-08 06:56:30,641] Trial 2616 finished with value: 0.5379431962966919 and parameters: {'fp_type': 'morgan', 'morgan_only_radius': 2, 'morgan_only_nBits': 2048, 'num_hidden_layers': 3, 'hidden_dim_0': 512, 'hidden_dim_1': 64, 'hidden_dim_2': 512, 'kl_weight': 0.00042551765309416196, 'lr': 0.0037093470256445685, 'batch_size': 32, 'dropout_rate': 0.41122742325088035, 'prior_mu': 0.04327113225147608, 'prior_sigma': 0.0912710044896313, 'normalization': 'none'}. Best is trial 2426 with value: 0.515486741065979.
Generating morgan fingerprints...
Generated fingerprints with 2048 features for 900 molecules
Data shape: X=(900, 2048), y=(900,)
Trial 2618: 5-fold CV loss = 0.7109
[I 2025-08-08 06:56:59,330] Trial 2618 finished with value: 0.7109327673912048 and parameters: {'fp_type': 'morgan', 'morgan_only_radius': 2, 'morgan_only_nBits': 2048, 'num_hidden_layers': 3, 'hidden_dim_0': 512, 'hidden_dim_1': 128, 'hidden_dim_2': 256, 'kl_weight': 0.00022556677919049483, 'lr': 0.0022065277177375237, 'batch_size': 64, 'dropout_rate': 0.4538713600909322, 'prior_mu': 0.13869054964833807, 'prior_sigma': 0.07252819476560718, 'normalization': 'none'}. Best is trial 2426 with value: 0.515486741065979.
Generating morgan fingerprints...
Generated fingerprints with 2048 features for 900 molecules
Data shape: X=(900, 2048), y=(900,)
Trial 2609: 5-fold CV loss = 0.5357
[I 2025-08-08 06:57:02,014] Trial 2609 finished with value: 0.5356982588768006 and parameters: {'fp_type': 'morgan', 'morgan_only_radius': 3, 'morgan_only_nBits': 2048, 'num_hidden_layers': 3, 'hidden_dim_0': 512, 'hidden_dim_1': 128, 'hidden_dim_2': 512, 'kl_weight': 0.00037922430438682217, 'lr': 0.0016793924917252584, 'batch_size': 32, 'dropout_rate': 0.4247143733056312, 'prior_mu': 0.0339645270003445, 'prior_sigma': 0.09081701540012596, 'normalization': 'none'}. Best is trial 2426 with value: 0.515486741065979.
Generating morgan fingerprints...
Generated fingerprints with 2048 features for 900 molecules
Data shape: X=(900, 2048), y=(900,)
Trial 2613: 5-fold CV loss = 0.5251
[I 2025-08-08 06:57:07,506] Trial 2613 finished with value: 0.5251314163208007 and parameters: {'fp_type': 'morgan', 'morgan_only_radius': 2, 'morgan_only_nBits': 2048, 'num_hidden_layers': 3, 'hidden_dim_0': 512, 'hidden_dim_1': 256, 'hidden_dim_2': 512, 'kl_weight': 0.0006685864962072105, 'lr': 0.0017131167623315787, 'batch_size': 32, 'dropout_rate': 0.4292823945086573, 'prior_mu': 0.05596679344439652, 'prior_sigma': 0.08134211024166653, 'normalization': 'none'}. Best is trial 2426 with value: 0.515486741065979.
Generating morgan fingerprints...
Generated fingerprints with 2048 features for 900 molecules
Data shape: X=(900, 2048), y=(900,)
Trial 2617: 5-fold CV loss = 0.5554
[I 2025-08-08 06:57:11,030] Trial 2617 finished with value: 0.555422568321228 and parameters: {'fp_type': 'morgan', 'morgan_only_radius': 2, 'morgan_only_nBits': 2048, 'num_hidden_layers': 3, 'hidden_dim_0': 512, 'hidden_dim_1': 64, 'hidden_dim_2': 512, 'kl_weight': 0.00042984572083598285, 'lr': 0.002169855527422939, 'batch_size': 32, 'dropout_rate': 0.4085572951295294, 'prior_mu': 0.04334875702341002, 'prior_sigma': 0.06890141504798047, 'normalization': 'none'}. Best is trial 2426 with value: 0.515486741065979.
Generating morgan fingerprints...
Generated fingerprints with 2048 features for 900 molecules
Data shape: X=(900, 2048), y=(900,)
Trial 2619: 5-fold CV loss = 1.0781
[I 2025-08-08 06:57:23,917] Trial 2619 finished with value: 1.0781194806098937 and parameters: {'fp_type': 'morgan', 'morgan_only_radius': 2, 'morgan_only_nBits': 2048, 'num_hidden_layers': 3, 'hidden_dim_0': 512, 'hidden_dim_1': 1024, 'hidden_dim_2': 512, 'kl_weight': 0.000857687589929582, 'lr': 0.002032489396026064, 'batch_size': 32, 'dropout_rate': 0.43490512107921325, 'prior_mu': 0.07251192015653601, 'prior_sigma': 0.06873500684077351, 'normalization': 'none'}. Best is trial 2426 with value: 0.515486741065979.
Generating morgan fingerprints...
Generated fingerprints with 2048 features for 900 molecules
Data shape: X=(900, 2048), y=(900,)
Trial 2623: 5-fold CV loss = 0.5603
[I 2025-08-08 06:58:24,369] Trial 2623 finished with value: 0.5603245735168457 and parameters: {'fp_type': 'morgan', 'morgan_only_radius': 2, 'morgan_only_nBits': 2048, 'num_hidden_layers': 3, 'hidden_dim_0': 512, 'hidden_dim_1': 128, 'hidden_dim_2': 256, 'kl_weight': 0.00031163532061893255, 'lr': 0.002676200006671785, 'batch_size': 32, 'dropout_rate': 0.44252326454626856, 'prior_mu': 0.0505314319154917, 'prior_sigma': 0.07631969181469136, 'normalization': 'none'}. Best is trial 2426 with value: 0.515486741065979.
Generating morgan fingerprints...
Generated fingerprints with 2048 features for 900 molecules
Data shape: X=(900, 2048), y=(900,)
Trial 2622: 5-fold CV loss = 0.5255
[I 2025-08-08 06:58:27,704] Trial 2622 finished with value: 0.5255004525184631 and parameters: {'fp_type': 'morgan', 'morgan_only_radius': 2, 'morgan_only_nBits': 2048, 'num_hidden_layers': 3, 'hidden_dim_0': 512, 'hidden_dim_1': 128, 'hidden_dim_2': 256, 'kl_weight': 0.00015190690798032704, 'lr': 0.00272884314982135, 'batch_size': 32, 'dropout_rate': 0.4417139340186182, 'prior_mu': 0.07412530820365157, 'prior_sigma': 0.06505999374488718, 'normalization': 'none'}. Best is trial 2426 with value: 0.515486741065979.
Generating morgan fingerprints...
Generated fingerprints with 2048 features for 900 molecules
Data shape: X=(900, 2048), y=(900,)
Trial 2624: 5-fold CV loss = 0.5422
[I 2025-08-08 06:59:25,112] Trial 2624 finished with value: 0.5421574115753174 and parameters: {'fp_type': 'morgan', 'morgan_only_radius': 2, 'morgan_only_nBits': 2048, 'num_hidden_layers': 3, 'hidden_dim_0': 512, 'hidden_dim_1': 512, 'hidden_dim_2': 1024, 'kl_weight': 0.000767701389346274, 'lr': 0.003102423104392966, 'batch_size': 32, 'dropout_rate': 0.45130277752230125, 'prior_mu': 0.03868430150623578, 'prior_sigma': 0.0725068598719521, 'normalization': 'none'}. Best is trial 2426 with value: 0.515486741065979.
Generating morgan fingerprints...
Generated fingerprints with 2048 features for 900 molecules
Data shape: X=(900, 2048), y=(900,)
Trial 2626: 5-fold CV loss = 0.6970
[I 2025-08-08 06:59:43,826] Trial 2626 finished with value: 0.696958315372467 and parameters: {'fp_type': 'morgan', 'morgan_only_radius': 2, 'morgan_only_nBits': 2048, 'num_hidden_layers': 3, 'hidden_dim_0': 512, 'hidden_dim_1': 128, 'hidden_dim_2': 512, 'kl_weight': 0.0006315840219517651, 'lr': 0.0019213944441498873, 'batch_size': 64, 'dropout_rate': 0.41778910466188973, 'prior_mu': 0.052664299538760034, 'prior_sigma': 0.0636888099051209, 'normalization': 'none'}. Best is trial 2426 with value: 0.515486741065979.
Generating morgan fingerprints...
Generated fingerprints with 2048 features for 900 molecules
Data shape: X=(900, 2048), y=(900,)
Trial 2621: 5-fold CV loss = 0.6460
[I 2025-08-08 06:59:47,574] Trial 2621 finished with value: 0.6459966599941254 and parameters: {'fp_type': 'morgan', 'morgan_only_radius': 2, 'morgan_only_nBits': 2048, 'num_hidden_layers': 3, 'hidden_dim_0': 512, 'hidden_dim_1': 1024, 'hidden_dim_2': 512, 'kl_weight': 0.0008678831540629632, 'lr': 0.007115468400562748, 'batch_size': 32, 'dropout_rate': 0.44283041851344546, 'prior_mu': 0.08975020846721614, 'prior_sigma': 0.16220217596365777, 'normalization': 'none'}. Best is trial 2426 with value: 0.515486741065979.
Generating morgan fingerprints...
Generated fingerprints with 2048 features for 900 molecules
Data shape: X=(900, 2048), y=(900,)
Trial 2625: 5-fold CV loss = 0.6747
[I 2025-08-08 06:59:57,724] Trial 2625 finished with value: 0.6746679186820984 and parameters: {'fp_type': 'morgan', 'morgan_only_radius': 2, 'morgan_only_nBits': 2048, 'num_hidden_layers': 3, 'hidden_dim_0': 512, 'hidden_dim_1': 512, 'hidden_dim_2': 1024, 'kl_weight': 0.0007932073280611626, 'lr': 0.002344260482248036, 'batch_size': 32, 'dropout_rate': 0.45237884759832475, 'prior_mu': 0.08408007271477275, 'prior_sigma': 0.07261149155050246, 'normalization': 'none'}. Best is trial 2426 with value: 0.515486741065979.
Generating morgan fingerprints...
Generated fingerprints with 2048 features for 900 molecules
Data shape: X=(900, 2048), y=(900,)
Trial 2627: 5-fold CV loss = 0.5385
[I 2025-08-08 07:00:39,974] Trial 2627 finished with value: 0.5384890556335449 and parameters: {'fp_type': 'morgan', 'morgan_only_radius': 2, 'morgan_only_nBits': 2048, 'num_hidden_layers': 3, 'hidden_dim_0': 1024, 'hidden_dim_1': 64, 'hidden_dim_2': 512, 'kl_weight': 0.0008220521617825154, 'lr': 0.002403329858049422, 'batch_size': 32, 'dropout_rate': 0.4546990990656754, 'prior_mu': 0.06092814058545856, 'prior_sigma': 0.07632203563062058, 'normalization': 'none'}. Best is trial 2426 with value: 0.515486741065979.
Generating morgan fingerprints...
Generated fingerprints with 2048 features for 900 molecules
Data shape: X=(900, 2048), y=(900,)
Trial 2620: 5-fold CV loss = 0.5425
[I 2025-08-08 07:00:43,157] Trial 2620 finished with value: 0.5425454497337341 and parameters: {'fp_type': 'morgan', 'morgan_only_radius': 2, 'morgan_only_nBits': 2048, 'num_hidden_layers': 3, 'hidden_dim_0': 512, 'hidden_dim_1': 64, 'hidden_dim_2': 512, 'kl_weight': 0.0008279029941762451, 'lr': 0.0021012944334452863, 'batch_size': 32, 'dropout_rate': 0.4360255887992959, 'prior_mu': 0.050586537662446765, 'prior_sigma': 0.06777190421175924, 'normalization': 'none'}. Best is trial 2426 with value: 0.515486741065979.
Generating morgan fingerprints...
Generated fingerprints with 2048 features for 900 molecules
Data shape: X=(900, 2048), y=(900,)
Trial 2630: 5-fold CV loss = 0.8947
[I 2025-08-08 07:00:50,674] Trial 2630 finished with value: 0.8946826457977295 and parameters: {'fp_type': 'morgan', 'morgan_only_radius': 2, 'morgan_only_nBits': 2048, 'num_hidden_layers': 3, 'hidden_dim_0': 512, 'hidden_dim_1': 128, 'hidden_dim_2': 512, 'kl_weight': 0.0010958913267072698, 'lr': 0.002147283766035758, 'batch_size': 128, 'dropout_rate': 0.40122616314425047, 'prior_mu': 0.03374927108996349, 'prior_sigma': 0.08650784153065524, 'normalization': 'none'}. Best is trial 2426 with value: 0.515486741065979.
Generating morgan fingerprints...
Generated fingerprints with 2048 features for 900 molecules
Data shape: X=(900, 2048), y=(900,)
Trial 2631: 5-fold CV loss = 0.9802
[I 2025-08-08 07:01:03,994] Trial 2631 finished with value: 0.9802452683448791 and parameters: {'fp_type': 'morgan', 'morgan_only_radius': 2, 'morgan_only_nBits': 2048, 'num_hidden_layers': 3, 'hidden_dim_0': 512, 'hidden_dim_1': 128, 'hidden_dim_2': 512, 'kl_weight': 0.0004815254013295881, 'lr': 0.0021607693368295156, 'batch_size': 128, 'dropout_rate': 0.4140129468516684, 'prior_mu': 0.024970100557090955, 'prior_sigma': 0.08434956498353875, 'normalization': 'none'}. Best is trial 2426 with value: 0.515486741065979.
Generating morgan fingerprints...
Generated fingerprints with 2048 features for 900 molecules
Data shape: X=(900, 2048), y=(900,)
Trial 2628: 5-fold CV loss = 0.5397
[I 2025-08-08 07:01:17,618] Trial 2628 finished with value: 0.5397215902805328 and parameters: {'fp_type': 'morgan', 'morgan_only_radius': 2, 'morgan_only_nBits': 2048, 'num_hidden_layers': 3, 'hidden_dim_0': 1024, 'hidden_dim_1': 64, 'hidden_dim_2': 512, 'kl_weight': 0.0004889931684307487, 'lr': 0.0024368647591791704, 'batch_size': 32, 'dropout_rate': 0.3890039086634205, 'prior_mu': 0.06124644740498026, 'prior_sigma': 0.075822784048273, 'normalization': 'none'}. Best is trial 2426 with value: 0.515486741065979.
Generating morgan fingerprints...
Generated fingerprints with 2048 features for 900 molecules
Data shape: X=(900, 2048), y=(900,)
Trial 2629: 5-fold CV loss = 0.5274
[I 2025-08-08 07:01:21,479] Trial 2629 finished with value: 0.5273947238922119 and parameters: {'fp_type': 'morgan', 'morgan_only_radius': 2, 'morgan_only_nBits': 2048, 'num_hidden_layers': 3, 'hidden_dim_0': 512, 'hidden_dim_1': 64, 'hidden_dim_2': 512, 'kl_weight': 0.0004936516646770807, 'lr': 0.002134488139359321, 'batch_size': 32, 'dropout_rate': 0.40122025746378565, 'prior_mu': 0.03207601406005929, 'prior_sigma': 0.07737060432557422, 'normalization': 'none'}. Best is trial 2426 with value: 0.515486741065979.
Generating morgan fingerprints...
Generated fingerprints with 2048 features for 900 molecules
Data shape: X=(900, 2048), y=(900,)
Trial 2632: 5-fold CV loss = 0.6551
[I 2025-08-08 07:01:35,333] Trial 2632 finished with value: 0.6550566554069519 and parameters: {'fp_type': 'morgan', 'morgan_only_radius': 2, 'morgan_only_nBits': 2048, 'num_hidden_layers': 3, 'hidden_dim_0': 512, 'hidden_dim_1': 128, 'hidden_dim_2': 256, 'kl_weight': 0.0004831801873249288, 'lr': 0.0019021580419741856, 'batch_size': 32, 'dropout_rate': 0.4205109434818254, 'prior_mu': 0.024916253626607907, 'prior_sigma': 0.06291107855626421, 'normalization': 'none'}. Best is trial 2426 with value: 0.515486741065979.
Generating morgan fingerprints...
Generated fingerprints with 2048 features for 900 molecules
Data shape: X=(900, 2048), y=(900,)
Trial 2636: 5-fold CV loss = 0.7089
[I 2025-08-08 07:01:56,572] Trial 2636 finished with value: 0.7088838696479798 and parameters: {'fp_type': 'morgan', 'morgan_only_radius': 2, 'morgan_only_nBits': 2048, 'num_hidden_layers': 2, 'hidden_dim_0': 512, 'hidden_dim_1': 128, 'kl_weight': 0.0006040478355531649, 'lr': 0.0018458332041720133, 'batch_size': 32, 'dropout_rate': 0.43251576125224456, 'prior_mu': 0.04314807303192404, 'prior_sigma': 0.06893420333076102, 'normalization': 'none'}. Best is trial 2426 with value: 0.515486741065979.
Generating morgan fingerprints...
Generated fingerprints with 2048 features for 900 molecules
Data shape: X=(900, 2048), y=(900,)
Trial 2637: 5-fold CV loss = 0.5607
[I 2025-08-08 07:02:40,045] Trial 2637 finished with value: 0.5607275605201721 and parameters: {'fp_type': 'morgan', 'morgan_only_radius': 2, 'morgan_only_nBits': 2048, 'num_hidden_layers': 3, 'hidden_dim_0': 512, 'hidden_dim_1': 128, 'hidden_dim_2': 256, 'kl_weight': 0.000694890691464516, 'lr': 0.003384712064930358, 'batch_size': 64, 'dropout_rate': 0.46055166500918243, 'prior_mu': 0.042904587272385414, 'prior_sigma': 0.0572132193813513, 'normalization': 'none'}. Best is trial 2426 with value: 0.515486741065979.
Generating morgan fingerprints...
Generated fingerprints with 2048 features for 900 molecules
Data shape: X=(900, 2048), y=(900,)
Trial 2635: 5-fold CV loss = 0.5842
[I 2025-08-08 07:02:53,150] Trial 2635 finished with value: 0.5842083096504211 and parameters: {'fp_type': 'morgan', 'morgan_only_radius': 2, 'morgan_only_nBits': 2048, 'num_hidden_layers': 3, 'hidden_dim_0': 512, 'hidden_dim_1': 128, 'hidden_dim_2': 256, 'kl_weight': 0.0006863274907024234, 'lr': 0.001874469239038032, 'batch_size': 32, 'dropout_rate': 0.4227468561771662, 'prior_mu': 0.04390569647171433, 'prior_sigma': 0.06218360111623634, 'normalization': 'none'}. Best is trial 2426 with value: 0.515486741065979.
Generating morgan fingerprints...
Generated fingerprints with 2048 features for 900 molecules
Data shape: X=(900, 2048), y=(900,)
Trial 2634: 5-fold CV loss = 0.6206
[I 2025-08-08 07:03:14,975] Trial 2634 finished with value: 0.6205605745315552 and parameters: {'fp_type': 'morgan', 'morgan_only_radius': 2, 'morgan_only_nBits': 2048, 'num_hidden_layers': 3, 'hidden_dim_0': 512, 'hidden_dim_1': 128, 'hidden_dim_2': 256, 'kl_weight': 0.0005655940630168573, 'lr': 0.0018274285658152712, 'batch_size': 32, 'dropout_rate': 0.4237314162135338, 'prior_mu': 0.04281201699100747, 'prior_sigma': 0.06333202117938774, 'normalization': 'none'}. Best is trial 2426 with value: 0.515486741065979.
Generating morgan fingerprints...
Generated fingerprints with 2048 features for 900 molecules
Data shape: X=(900, 2048), y=(900,)
Trial 2638: 5-fold CV loss = 0.7695
[I 2025-08-08 07:03:18,924] Trial 2638 finished with value: 0.769468629360199 and parameters: {'fp_type': 'morgan', 'morgan_only_radius': 2, 'morgan_only_nBits': 2048, 'num_hidden_layers': 3, 'hidden_dim_0': 512, 'hidden_dim_1': 128, 'hidden_dim_2': 512, 'kl_weight': 0.0006832171005234545, 'lr': 0.0009769673767106924, 'batch_size': 32, 'dropout_rate': 0.421794834322159, 'prior_mu': 0.04863401977405353, 'prior_sigma': 0.07105358009864612, 'normalization': 'none'}. Best is trial 2426 with value: 0.515486741065979.
Generating morgan fingerprints...
Generated fingerprints with 2048 features for 900 molecules
Data shape: X=(900, 2048), y=(900,)
Trial 2640: 5-fold CV loss = 0.6476
[I 2025-08-08 07:03:42,467] Trial 2640 finished with value: 0.6476259589195251 and parameters: {'fp_type': 'morgan', 'morgan_only_radius': 2, 'morgan_only_nBits': 2048, 'num_hidden_layers': 0, 'kl_weight': 0.0005969054558933456, 'lr': 0.002929674972207304, 'batch_size': 32, 'dropout_rate': 0.46374923731323436, 'prior_mu': 0.055590438697324135, 'prior_sigma': 0.06651655072999424, 'normalization': 'layer'}. Best is trial 2426 with value: 0.515486741065979.
Generating morgan fingerprints...
Generated fingerprints with 2048 features for 900 molecules
Data shape: X=(900, 2048), y=(900,)
Trial 2633: 5-fold CV loss = 0.5541
[I 2025-08-08 07:04:14,289] Trial 2633 finished with value: 0.5540886998176575 and parameters: {'fp_type': 'morgan', 'morgan_only_radius': 2, 'morgan_only_nBits': 2048, 'num_hidden_layers': 3, 'hidden_dim_0': 512, 'hidden_dim_1': 128, 'hidden_dim_2': 256, 'kl_weight': 0.0005726559232881924, 'lr': 0.0018541558993579574, 'batch_size': 32, 'dropout_rate': 0.393117896107036, 'prior_mu': 0.043134623753694534, 'prior_sigma': 0.06159328538671715, 'normalization': 'none'}. Best is trial 2426 with value: 0.515486741065979.
Generating morgan fingerprints...
Generated fingerprints with 2048 features for 900 molecules
Data shape: X=(900, 2048), y=(900,)
Trial 2641: 5-fold CV loss = 0.5393
[I 2025-08-08 07:04:16,377] Trial 2641 finished with value: 0.5392928421497345 and parameters: {'fp_type': 'morgan', 'morgan_only_radius': 2, 'morgan_only_nBits': 2048, 'num_hidden_layers': 3, 'hidden_dim_0': 64, 'hidden_dim_1': 128, 'hidden_dim_2': 512, 'kl_weight': 0.0005820442047250579, 'lr': 0.002875128933894739, 'batch_size': 32, 'dropout_rate': 0.44428320708299285, 'prior_mu': 0.05501461578363954, 'prior_sigma': 0.06615023038624003, 'normalization': 'layer'}. Best is trial 2426 with value: 0.515486741065979.
Generating morgan fingerprints...
Generated fingerprints with 2048 features for 900 molecules
Data shape: X=(900, 2048), y=(900,)
Trial 2639: 5-fold CV loss = 0.5277
[I 2025-08-08 07:04:24,888] Trial 2639 finished with value: 0.5277161180973053 and parameters: {'fp_type': 'morgan', 'morgan_only_radius': 2, 'morgan_only_nBits': 2048, 'num_hidden_layers': 3, 'hidden_dim_0': 64, 'hidden_dim_1': 128, 'hidden_dim_2': 512, 'kl_weight': 0.0005615857919939133, 'lr': 0.002981703906233405, 'batch_size': 32, 'dropout_rate': 0.46475713176805467, 'prior_mu': 0.05282110413948067, 'prior_sigma': 0.06672458488132078, 'normalization': 'none'}. Best is trial 2426 with value: 0.515486741065979.
Generating morgan fingerprints...
Generated fingerprints with 2048 features for 900 molecules
Data shape: X=(900, 2048), y=(900,)
Trial 2645: 5-fold CV loss = 0.7164
[I 2025-08-08 07:04:49,342] Trial 2645 finished with value: 0.7163719415664673 and parameters: {'fp_type': 'morgan', 'morgan_only_radius': 2, 'morgan_only_nBits': 2048, 'num_hidden_layers': 3, 'hidden_dim_0': 512, 'hidden_dim_1': 64, 'hidden_dim_2': 512, 'kl_weight': 0.0009976951945832402, 'lr': 0.001408458374927532, 'batch_size': 64, 'dropout_rate': 0.4083264225522807, 'prior_mu': 0.036516562863620115, 'prior_sigma': 0.0727389761585856, 'normalization': 'none'}. Best is trial 2426 with value: 0.515486741065979.
Generating morgan fingerprints...
Generated fingerprints with 2048 features for 900 molecules
Data shape: X=(900, 2048), y=(900,)
Trial 2644: 5-fold CV loss = 0.5256
[I 2025-08-08 07:05:19,536] Trial 2644 finished with value: 0.5256167590618134 and parameters: {'fp_type': 'morgan', 'morgan_only_radius': 2, 'morgan_only_nBits': 2048, 'num_hidden_layers': 3, 'hidden_dim_0': 512, 'hidden_dim_1': 128, 'hidden_dim_2': 512, 'kl_weight': 0.0009969061426641605, 'lr': 0.0025928769871006513, 'batch_size': 32, 'dropout_rate': 0.40835132252750467, 'prior_mu': 0.06840982190565094, 'prior_sigma': 0.0733742015946316, 'normalization': 'none'}. Best is trial 2426 with value: 0.515486741065979.
Generating morgan fingerprints...
Generated fingerprints with 2048 features for 900 molecules
Data shape: X=(900, 2048), y=(900,)
Trial 2642: 5-fold CV loss = 0.5358
