[I 2025-08-08 06:06:19,842] Trial 2456 finished with value: 0.6097383320331573 and parameters: {'fp_type': 'morgan', 'morgan_only_radius': 2, 'morgan_only_nBits': 2048, 'num_hidden_layers': 3, 'hidden_dim_0': 64, 'hidden_dim_1': 128, 'hidden_dim_2': 512, 'kl_weight': 0.00016217488556029996, 'lr': 0.002383394516533555, 'batch_size': 64, 'dropout_rate': 0.4268205729408198, 'prior_mu': 0.057487217993619694, 'prior_sigma': 0.0736047425246167, 'normalization': 'none'}. Best is trial 2426 with value: 0.515486741065979.
Generating morgan fingerprints...
Generated fingerprints with 2048 features for 900 molecules
Data shape: X=(900, 2048), y=(900,)
Trial 2457: 5-fold CV loss = 0.5623
[I 2025-08-08 06:06:31,399] Trial 2457 finished with value: 0.5623045802116394 and parameters: {'fp_type': 'morgan', 'morgan_only_radius': 2, 'morgan_only_nBits': 2048, 'num_hidden_layers': 3, 'hidden_dim_0': 512, 'hidden_dim_1': 64, 'hidden_dim_2': 512, 'kl_weight': 0.0002005078787453102, 'lr': 0.0029913215605110875, 'batch_size': 64, 'dropout_rate': 0.42495479057556573, 'prior_mu': 0.09483832946720872, 'prior_sigma': 0.0735463922078365, 'normalization': 'none'}. Best is trial 2426 with value: 0.515486741065979.
Generating morgan fingerprints...
Generated fingerprints with 2048 features for 900 molecules
Data shape: X=(900, 2048), y=(900,)
Trial 2458: 5-fold CV loss = 0.7239
[I 2025-08-08 06:06:38,734] Trial 2458 finished with value: 0.723871374130249 and parameters: {'fp_type': 'morgan', 'morgan_only_radius': 2, 'morgan_only_nBits': 2048, 'num_hidden_layers': 3, 'hidden_dim_0': 256, 'hidden_dim_1': 64, 'hidden_dim_2': 512, 'kl_weight': 0.00013264473561342872, 'lr': 0.003140314427072896, 'batch_size': 128, 'dropout_rate': 0.4246465799369198, 'prior_mu': 0.07724461877292345, 'prior_sigma': 0.09081537977027385, 'normalization': 'none'}. Best is trial 2426 with value: 0.515486741065979.
Generating morgan fingerprints...
Generated fingerprints with 2048 features for 900 molecules
Data shape: X=(900, 2048), y=(900,)
Trial 2459: 5-fold CV loss = 0.8630
[I 2025-08-08 06:06:42,561] Trial 2459 finished with value: 0.8630214810371399 and parameters: {'fp_type': 'morgan', 'morgan_only_radius': 2, 'morgan_only_nBits': 2048, 'num_hidden_layers': 3, 'hidden_dim_0': 256, 'hidden_dim_1': 128, 'hidden_dim_2': 512, 'kl_weight': 0.00020430712297737113, 'lr': 0.002670735734644365, 'batch_size': 128, 'dropout_rate': 0.3966460391287592, 'prior_mu': 0.05893946006096441, 'prior_sigma': 0.08762609117969257, 'normalization': 'none'}. Best is trial 2426 with value: 0.515486741065979.
Generating morgan fingerprints...
Generated fingerprints with 2048 features for 900 molecules
Data shape: X=(900, 2048), y=(900,)
Trial 2455: 5-fold CV loss = 0.5724
[I 2025-08-08 06:06:50,985] Trial 2455 finished with value: 0.5724328756332397 and parameters: {'fp_type': 'morgan', 'morgan_only_radius': 2, 'morgan_only_nBits': 2048, 'num_hidden_layers': 3, 'hidden_dim_0': 512, 'hidden_dim_1': 128, 'hidden_dim_2': 512, 'kl_weight': 0.0001458307631551264, 'lr': 0.0023309857478273693, 'batch_size': 64, 'dropout_rate': 0.4006818856430165, 'prior_mu': 0.0585483001228041, 'prior_sigma': 0.07293796901444337, 'normalization': 'layer'}. Best is trial 2426 with value: 0.515486741065979.
Generating morgan fingerprints...
Generated fingerprints with 2048 features for 900 molecules
Data shape: X=(900, 2048), y=(900,)
Trial 2451: 5-fold CV loss = 0.6808
[I 2025-08-08 06:07:03,756] Trial 2451 finished with value: 0.6808323562145233 and parameters: {'fp_type': 'morgan', 'morgan_only_radius': 2, 'morgan_only_nBits': 2048, 'num_hidden_layers': 3, 'hidden_dim_0': 512, 'hidden_dim_1': 128, 'hidden_dim_2': 512, 'kl_weight': 0.0001761343862206291, 'lr': 0.0025464352927653286, 'batch_size': 64, 'dropout_rate': 0.39755368586796275, 'prior_mu': 0.07315623120513214, 'prior_sigma': 0.08688625478466358, 'normalization': 'none'}. Best is trial 2426 with value: 0.515486741065979.
Generating morgan fingerprints...
Generated fingerprints with 2048 features for 900 molecules
Data shape: X=(900, 2048), y=(900,)
Trial 2461: 5-fold CV loss = 0.7751
[I 2025-08-08 06:07:06,189] Trial 2461 finished with value: 0.77513507604599 and parameters: {'fp_type': 'morgan', 'morgan_only_radius': 2, 'morgan_only_nBits': 2048, 'num_hidden_layers': 3, 'hidden_dim_0': 512, 'hidden_dim_1': 128, 'hidden_dim_2': 256, 'kl_weight': 0.00014561886363147024, 'lr': 0.0012335253603042255, 'batch_size': 64, 'dropout_rate': 0.4050902618283008, 'prior_mu': 0.0964678024886072, 'prior_sigma': 0.08127481378318234, 'normalization': 'none'}. Best is trial 2426 with value: 0.515486741065979.
Generating morgan fingerprints...
Generated fingerprints with 2048 features for 900 molecules
Data shape: X=(900, 2048), y=(900,)
Trial 2462: 5-fold CV loss = 0.9251
[I 2025-08-08 06:07:19,741] Trial 2462 finished with value: 0.9251436233520508 and parameters: {'fp_type': 'morgan', 'morgan_only_radius': 2, 'morgan_only_nBits': 2048, 'num_hidden_layers': 3, 'hidden_dim_0': 512, 'hidden_dim_1': 1024, 'hidden_dim_2': 256, 'kl_weight': 0.0004467859982806228, 'lr': 0.0011825076417349267, 'batch_size': 64, 'dropout_rate': 0.4095274532214078, 'prior_mu': 0.07038778607302403, 'prior_sigma': 0.08065253970987395, 'normalization': 'none'}. Best is trial 2426 with value: 0.515486741065979.
Generating morgan fingerprints...
Generated fingerprints with 2048 features for 900 molecules
Data shape: X=(900, 2048), y=(900,)
Trial 2464: 5-fold CV loss = 0.9692
[I 2025-08-08 06:07:25,174] Trial 2464 finished with value: 0.9692158579826355 and parameters: {'fp_type': 'morgan', 'morgan_only_radius': 2, 'morgan_only_nBits': 2048, 'num_hidden_layers': 3, 'hidden_dim_0': 512, 'hidden_dim_1': 1024, 'hidden_dim_2': 512, 'kl_weight': 0.0002469941240819635, 'lr': 0.002284075903415533, 'batch_size': 64, 'dropout_rate': 0.462028555157162, 'prior_mu': 0.05287833286203711, 'prior_sigma': 0.07749449990256155, 'normalization': 'none'}. Best is trial 2426 with value: 0.515486741065979.
Generating morgan fingerprints...
Generated fingerprints with 2048 features for 900 molecules
Data shape: X=(900, 2048), y=(900,)
Trial 2460: 5-fold CV loss = 0.5719
[I 2025-08-08 06:07:27,846] Trial 2460 finished with value: 0.5718634724617004 and parameters: {'fp_type': 'morgan', 'morgan_only_radius': 2, 'morgan_only_nBits': 2048, 'num_hidden_layers': 3, 'hidden_dim_0': 512, 'hidden_dim_1': 128, 'hidden_dim_2': 512, 'kl_weight': 0.00019949913509480658, 'lr': 0.0022866051011812645, 'batch_size': 64, 'dropout_rate': 0.10719572520100412, 'prior_mu': 0.09677424601307184, 'prior_sigma': 0.08148469341669538, 'normalization': 'none'}. Best is trial 2426 with value: 0.515486741065979.
Generating morgan fingerprints...
Generated fingerprints with 2048 features for 900 molecules
Data shape: X=(900, 2048), y=(900,)
Trial 2467: 5-fold CV loss = 0.7628
[I 2025-08-08 06:07:40,969] Trial 2467 finished with value: 0.7627911806106568 and parameters: {'fp_type': 'morgan', 'morgan_only_radius': 3, 'morgan_only_nBits': 2048, 'num_hidden_layers': 2, 'hidden_dim_0': 512, 'hidden_dim_1': 64, 'kl_weight': 0.0005010419317182103, 'lr': 0.0028391918598592927, 'batch_size': 64, 'dropout_rate': 0.4251604634048978, 'prior_mu': 0.0926269944646611, 'prior_sigma': 0.07503839821507784, 'normalization': 'none'}. Best is trial 2426 with value: 0.515486741065979.
Generating morgan fingerprints...
Generated fingerprints with 2048 features for 900 molecules
Data shape: X=(900, 2048), y=(900,)
Trial 2463: 5-fold CV loss = 0.9660
[I 2025-08-08 06:07:43,851] Trial 2463 finished with value: 0.9659976482391357 and parameters: {'fp_type': 'morgan', 'morgan_only_radius': 3, 'morgan_only_nBits': 2048, 'num_hidden_layers': 3, 'hidden_dim_0': 512, 'hidden_dim_1': 1024, 'hidden_dim_2': 256, 'kl_weight': 0.00014941782400049454, 'lr': 0.004036032701783041, 'batch_size': 64, 'dropout_rate': 0.41053817689704486, 'prior_mu': 0.06518388406988317, 'prior_sigma': 0.08149621896401042, 'normalization': 'none'}. Best is trial 2426 with value: 0.515486741065979.
Generating morgan fingerprints...
Generated fingerprints with 2048 features for 900 molecules
Data shape: X=(900, 2048), y=(900,)
Trial 2468: 5-fold CV loss = 0.8818
[I 2025-08-08 06:08:05,129] Trial 2468 finished with value: 0.8818480014801026 and parameters: {'fp_type': 'morgan', 'morgan_only_radius': 2, 'morgan_only_nBits': 2048, 'num_hidden_layers': 3, 'hidden_dim_0': 512, 'hidden_dim_1': 512, 'hidden_dim_2': 512, 'kl_weight': 0.00015316298566705718, 'lr': 0.002413593869699136, 'batch_size': 64, 'dropout_rate': 0.41861207972594056, 'prior_mu': 0.08733141425206827, 'prior_sigma': 0.07272447840222222, 'normalization': 'none'}. Best is trial 2426 with value: 0.515486741065979.
Generating morgan fingerprints...
Generated fingerprints with 2048 features for 900 molecules
Data shape: X=(900, 2048), y=(900,)
Trial 2469: 5-fold CV loss = 0.7557
[I 2025-08-08 06:08:11,178] Trial 2469 finished with value: 0.7557098150253296 and parameters: {'fp_type': 'morgan', 'morgan_only_radius': 2, 'morgan_only_nBits': 2048, 'num_hidden_layers': 1, 'hidden_dim_0': 512, 'kl_weight': 0.00027281659222594195, 'lr': 0.0022003183007978443, 'batch_size': 64, 'dropout_rate': 0.4343117063015565, 'prior_mu': 0.08984939980937083, 'prior_sigma': 0.07243090834195842, 'normalization': 'none'}. Best is trial 2426 with value: 0.515486741065979.
Generating morgan fingerprints...
Generated fingerprints with 2048 features for 900 molecules
Data shape: X=(900, 2048), y=(900,)
Trial 2465: 5-fold CV loss = 0.5399
[I 2025-08-08 06:08:15,316] Trial 2465 finished with value: 0.5399371325969696 and parameters: {'fp_type': 'morgan', 'morgan_only_radius': 3, 'morgan_only_nBits': 2048, 'num_hidden_layers': 3, 'hidden_dim_0': 512, 'hidden_dim_1': 128, 'hidden_dim_2': 512, 'kl_weight': 0.0002746589424830993, 'lr': 0.003996409464872505, 'batch_size': 64, 'dropout_rate': 0.4235662009499632, 'prior_mu': 0.053337686683727396, 'prior_sigma': 0.07573771248484687, 'normalization': 'none'}. Best is trial 2426 with value: 0.515486741065979.
Generating morgan fingerprints...
Generated fingerprints with 2048 features for 900 molecules
Data shape: X=(900, 2048), y=(900,)
Trial 2470: 5-fold CV loss = 0.7993
[I 2025-08-08 06:08:20,201] Trial 2470 finished with value: 0.7993088960647583 and parameters: {'fp_type': 'morgan', 'morgan_only_radius': 2, 'morgan_only_nBits': 2048, 'num_hidden_layers': 3, 'hidden_dim_0': 512, 'hidden_dim_1': 128, 'hidden_dim_2': 512, 'kl_weight': 0.0004749869503172976, 'lr': 0.0021109125143734843, 'batch_size': 64, 'dropout_rate': 0.43782337457861303, 'prior_mu': 0.10997577577146989, 'prior_sigma': 0.07230518700412218, 'normalization': 'none'}. Best is trial 2426 with value: 0.515486741065979.
Generating morgan fingerprints...
Generated fingerprints with 2048 features for 900 molecules
Data shape: X=(900, 2048), y=(900,)
Trial 2466: 5-fold CV loss = 0.6943
[I 2025-08-08 06:08:20,750] Trial 2466 finished with value: 0.6942834377288818 and parameters: {'fp_type': 'morgan', 'morgan_only_radius': 3, 'morgan_only_nBits': 2048, 'num_hidden_layers': 3, 'hidden_dim_0': 512, 'hidden_dim_1': 512, 'hidden_dim_2': 512, 'kl_weight': 0.05931581795121182, 'lr': 0.004095613823234523, 'batch_size': 64, 'dropout_rate': 0.42621858472824226, 'prior_mu': 0.09378163672050696, 'prior_sigma': 0.07468299469978251, 'normalization': 'none'}. Best is trial 2426 with value: 0.515486741065979.
Generating morgan fingerprints...
Generated fingerprints with 2048 features for 900 molecules
Data shape: X=(900, 2048), y=(900,)
Trial 2473: 5-fold CV loss = 0.6068
[I 2025-08-08 06:09:03,464] Trial 2473 finished with value: 0.6067799687385559 and parameters: {'fp_type': 'morgan', 'morgan_only_radius': 2, 'morgan_only_nBits': 2048, 'num_hidden_layers': 3, 'hidden_dim_0': 512, 'hidden_dim_1': 128, 'hidden_dim_2': 512, 'kl_weight': 0.0005582030659819137, 'lr': 0.002616628000758883, 'batch_size': 64, 'dropout_rate': 0.4620243967654577, 'prior_mu': 0.10433476313163272, 'prior_sigma': 0.07873355733361657, 'normalization': 'none'}. Best is trial 2426 with value: 0.515486741065979.
Generating morgan fingerprints...
Generated fingerprints with 2048 features for 900 molecules
Data shape: X=(900, 2048), y=(900,)
Trial 2474: 5-fold CV loss = 0.6048
[I 2025-08-08 06:09:08,336] Trial 2474 finished with value: 0.604804277420044 and parameters: {'fp_type': 'morgan', 'morgan_only_radius': 2, 'morgan_only_nBits': 2048, 'num_hidden_layers': 3, 'hidden_dim_0': 128, 'hidden_dim_1': 128, 'hidden_dim_2': 512, 'kl_weight': 0.00012806075500025035, 'lr': 0.0027289729444871917, 'batch_size': 64, 'dropout_rate': 0.4584659164388876, 'prior_mu': 0.061100520190472504, 'prior_sigma': 0.07790593093500142, 'normalization': 'none'}. Best is trial 2426 with value: 0.515486741065979.
Generating morgan fingerprints...
Generated fingerprints with 2048 features for 900 molecules
Data shape: X=(900, 2048), y=(900,)
Trial 2475: 5-fold CV loss = 0.7352
[I 2025-08-08 06:09:25,621] Trial 2475 finished with value: 0.7352295994758606 and parameters: {'fp_type': 'morgan', 'morgan_only_radius': 2, 'morgan_only_nBits': 2048, 'num_hidden_layers': 3, 'hidden_dim_0': 512, 'hidden_dim_1': 64, 'hidden_dim_2': 256, 'kl_weight': 0.0005869439549236879, 'lr': 0.0019079281615327869, 'batch_size': 64, 'dropout_rate': 0.44403198968789237, 'prior_mu': 0.06274460544209085, 'prior_sigma': 0.07081114432937702, 'normalization': 'none'}. Best is trial 2426 with value: 0.515486741065979.
Generating morgan fingerprints...
Generated fingerprints with 2048 features for 900 molecules
Data shape: X=(900, 2048), y=(900,)
Trial 2476: 5-fold CV loss = 0.6768
[I 2025-08-08 06:09:33,888] Trial 2476 finished with value: 0.6768025517463684 and parameters: {'fp_type': 'morgan', 'morgan_only_radius': 2, 'morgan_only_nBits': 2048, 'num_hidden_layers': 3, 'hidden_dim_0': 512, 'hidden_dim_1': 64, 'hidden_dim_2': 256, 'kl_weight': 0.00012235437788731836, 'lr': 0.0019245848288701514, 'batch_size': 64, 'dropout_rate': 0.44431438332168777, 'prior_mu': 0.051096998401477314, 'prior_sigma': 0.0715379637921875, 'normalization': 'none'}. Best is trial 2426 with value: 0.515486741065979.
Generating morgan fingerprints...
Generated fingerprints with 2048 features for 900 molecules
Data shape: X=(900, 2048), y=(900,)
Trial 2472: 5-fold CV loss = 0.5292
[I 2025-08-08 06:09:34,799] Trial 2472 finished with value: 0.5291855454444885 and parameters: {'fp_type': 'morgan', 'morgan_only_radius': 2, 'morgan_only_nBits': 2048, 'num_hidden_layers': 3, 'hidden_dim_0': 512, 'hidden_dim_1': 128, 'hidden_dim_2': 512, 'kl_weight': 0.000456559823053822, 'lr': 0.0028746550561913964, 'batch_size': 64, 'dropout_rate': 0.45875865833945034, 'prior_mu': 0.10170754172633423, 'prior_sigma': 0.07719997879979966, 'normalization': 'none'}. Best is trial 2426 with value: 0.515486741065979.
Generating rdkit fingerprints...
Generated fingerprints with 512 features for 900 molecules
Data shape: X=(900, 512), y=(900,)
Trial 2477: 5-fold CV loss = 0.7621
[I 2025-08-08 06:09:44,114] Trial 2477 finished with value: 0.7620883822441101 and parameters: {'fp_type': 'morgan', 'morgan_only_radius': 2, 'morgan_only_nBits': 2048, 'num_hidden_layers': 3, 'hidden_dim_0': 512, 'hidden_dim_1': 128, 'hidden_dim_2': 512, 'kl_weight': 0.00018447119792124975, 'lr': 0.0022466170656570343, 'batch_size': 64, 'dropout_rate': 0.431928052151599, 'prior_mu': 0.05001631172376079, 'prior_sigma': 0.07032974893388527, 'normalization': 'none'}. Best is trial 2426 with value: 0.515486741065979.
Generating rdkit fingerprints...
Generated fingerprints with 512 features for 900 molecules
Data shape: X=(900, 512), y=(900,)
Trial 2478: 5-fold CV loss = 0.9103
[I 2025-08-08 06:09:57,372] Trial 2478 finished with value: 0.9103278875350952 and parameters: {'fp_type': 'morgan', 'morgan_only_radius': 2, 'morgan_only_nBits': 2048, 'num_hidden_layers': 3, 'hidden_dim_0': 512, 'hidden_dim_1': 128, 'hidden_dim_2': 512, 'kl_weight': 0.0004456846121050612, 'lr': 0.0022581248652732066, 'batch_size': 64, 'dropout_rate': 0.4148412383819029, 'prior_mu': 0.047707557670103595, 'prior_sigma': 0.08379908282949666, 'normalization': 'none'}. Best is trial 2426 with value: 0.515486741065979.
Generating morgan fingerprints...
Generated fingerprints with 2048 features for 900 molecules
Data shape: X=(900, 2048), y=(900,)
Trial 2479: 5-fold CV loss = 0.6611
[I 2025-08-08 06:10:20,128] Trial 2479 finished with value: 0.661104142665863 and parameters: {'fp_type': 'rdkit', 'rdkit_only_maxPath': 7, 'rdkit_only_nBits': 512, 'num_hidden_layers': 3, 'hidden_dim_0': 512, 'hidden_dim_1': 128, 'hidden_dim_2': 512, 'kl_weight': 0.009284290042792413, 'lr': 0.0022516122548769803, 'batch_size': 64, 'dropout_rate': 0.41625136527897033, 'prior_mu': 0.04683705414444804, 'prior_sigma': 0.0851638210818206, 'normalization': 'none'}. Best is trial 2426 with value: 0.515486741065979.
Generating morgan fingerprints...
Generated fingerprints with 2048 features for 900 molecules
Data shape: X=(900, 2048), y=(900,)
Trial 2480: 5-fold CV loss = 0.6428
[I 2025-08-08 06:10:29,136] Trial 2480 finished with value: 0.6427971482276916 and parameters: {'fp_type': 'rdkit', 'rdkit_only_maxPath': 7, 'rdkit_only_nBits': 512, 'num_hidden_layers': 3, 'hidden_dim_0': 512, 'hidden_dim_1': 128, 'hidden_dim_2': 128, 'kl_weight': 0.000523560179717837, 'lr': 0.0024736174963555157, 'batch_size': 32, 'dropout_rate': 0.32303360779435475, 'prior_mu': 0.07604200801341506, 'prior_sigma': 0.08502660407359536, 'normalization': 'none'}. Best is trial 2426 with value: 0.515486741065979.
Generating morgan fingerprints...
Generated fingerprints with 2048 features for 900 molecules
Data shape: X=(900, 2048), y=(900,)
Trial 2481: 5-fold CV loss = 0.6436
[I 2025-08-08 06:10:46,190] Trial 2481 finished with value: 0.6436042726039887 and parameters: {'fp_type': 'morgan', 'morgan_only_radius': 2, 'morgan_only_nBits': 2048, 'num_hidden_layers': 3, 'hidden_dim_0': 512, 'hidden_dim_1': 128, 'hidden_dim_2': 512, 'kl_weight': 0.0005353549761818576, 'lr': 0.002063603063419387, 'batch_size': 64, 'dropout_rate': 0.4292482286480677, 'prior_mu': 0.07385302838739824, 'prior_sigma': 0.06907408507645182, 'normalization': 'none'}. Best is trial 2426 with value: 0.515486741065979.
Generating morgan fingerprints...
Generated fingerprints with 2048 features for 900 molecules
Data shape: X=(900, 2048), y=(900,)
Trial 2483: 5-fold CV loss = 1.3964
[I 2025-08-08 06:10:51,955] Trial 2483 finished with value: 1.396418046951294 and parameters: {'fp_type': 'morgan', 'morgan_only_radius': 2, 'morgan_only_nBits': 2048, 'num_hidden_layers': 3, 'hidden_dim_0': 512, 'hidden_dim_1': 256, 'hidden_dim_2': 256, 'kl_weight': 0.0005975741084357949, 'lr': 0.0013788308697359692, 'batch_size': 32, 'dropout_rate': 0.43468232545093605, 'prior_mu': 0.04264284821440012, 'prior_sigma': 0.0933525544364146, 'normalization': 'none'}. Best is trial 2426 with value: 0.515486741065979.
Generating morgan fingerprints...
Generated fingerprints with 2048 features for 900 molecules
Data shape: X=(900, 2048), y=(900,)
Trial 2482: 5-fold CV loss = 0.6904
[I 2025-08-08 06:11:00,861] Trial 2482 finished with value: 0.690378212928772 and parameters: {'fp_type': 'morgan', 'morgan_only_radius': 2, 'morgan_only_nBits': 2048, 'num_hidden_layers': 3, 'hidden_dim_0': 512, 'hidden_dim_1': 64, 'hidden_dim_2': 128, 'kl_weight': 0.000540265484646326, 'lr': 0.002042591769706511, 'batch_size': 64, 'dropout_rate': 0.4328348987283677, 'prior_mu': 0.07258279276266473, 'prior_sigma': 0.06879193109508491, 'normalization': 'none'}. Best is trial 2426 with value: 0.515486741065979.
Generating morgan fingerprints...
Generated fingerprints with 2048 features for 900 molecules
Data shape: X=(900, 2048), y=(900,)
Trial 2484: 5-fold CV loss = 0.7362
[I 2025-08-08 06:11:14,116] Trial 2484 finished with value: 0.7361722946166992 and parameters: {'fp_type': 'morgan', 'morgan_only_radius': 2, 'morgan_only_nBits': 2048, 'num_hidden_layers': 3, 'hidden_dim_0': 512, 'hidden_dim_1': 64, 'hidden_dim_2': 256, 'kl_weight': 0.0006272722976848231, 'lr': 0.00012939675788663723, 'batch_size': 64, 'dropout_rate': 0.4369567388190278, 'prior_mu': 0.11050808618533811, 'prior_sigma': 0.07370787960429731, 'normalization': 'none'}. Best is trial 2426 with value: 0.515486741065979.
Generating morgan fingerprints...
Generated fingerprints with 2048 features for 900 molecules
Data shape: X=(900, 2048), y=(900,)
Trial 2486: 5-fold CV loss = 0.9881
[I 2025-08-08 06:11:21,989] Trial 2486 finished with value: 0.9881118178367615 and parameters: {'fp_type': 'morgan', 'morgan_only_radius': 2, 'morgan_only_nBits': 2048, 'num_hidden_layers': 3, 'hidden_dim_0': 512, 'hidden_dim_1': 128, 'hidden_dim_2': 512, 'kl_weight': 0.0006284470687766821, 'lr': 0.0018202797101295627, 'batch_size': 64, 'dropout_rate': 0.45057688670753465, 'prior_mu': 0.05491292699600282, 'prior_sigma': 0.07520481950778875, 'normalization': 'none'}. Best is trial 2426 with value: 0.515486741065979.
Generating morgan fingerprints...
Generated fingerprints with 2048 features for 900 molecules
Data shape: X=(900, 2048), y=(900,)
Trial 2485: 5-fold CV loss = 0.7607
[I 2025-08-08 06:11:26,885] Trial 2485 finished with value: 0.7607316136360168 and parameters: {'fp_type': 'morgan', 'morgan_only_radius': 2, 'morgan_only_nBits': 2048, 'num_hidden_layers': 3, 'hidden_dim_0': 512, 'hidden_dim_1': 64, 'hidden_dim_2': 512, 'kl_weight': 0.0002672555423781772, 'lr': 0.0018239613949890031, 'batch_size': 64, 'dropout_rate': 0.45035104839284, 'prior_mu': -0.17904767980102076, 'prior_sigma': 0.07485525509941383, 'normalization': 'none'}. Best is trial 2426 with value: 0.515486741065979.
Generating morgan fingerprints...
Generated fingerprints with 2048 features for 900 molecules
Data shape: X=(900, 2048), y=(900,)
Trial 2487: 5-fold CV loss = 0.6799
