[I 2025-08-08 08:19:37,352] Trial 2865 finished with value: 0.5424824357032776 and parameters: {'fp_type': 'morgan', 'morgan_only_radius': 2, 'morgan_only_nBits': 2048, 'num_hidden_layers': 3, 'hidden_dim_0': 512, 'hidden_dim_1': 128, 'hidden_dim_2': 128, 'kl_weight': 0.0007527213389330921, 'lr': 0.0017130519039984607, 'batch_size': 32, 'dropout_rate': 0.4721712773136255, 'prior_mu': 0.04691855797091732, 'prior_sigma': 0.07714217490747668, 'normalization': 'layer'}. Best is trial 2752 with value: 0.5150722622871399.
Generating morgan fingerprints...
Generated fingerprints with 2048 features for 900 molecules
Data shape: X=(900, 2048), y=(900,)
Trial 2866: 5-fold CV loss = 0.6029
[I 2025-08-08 08:20:31,136] Trial 2866 finished with value: 0.6028807401657105 and parameters: {'fp_type': 'morgan', 'morgan_only_radius': 2, 'morgan_only_nBits': 2048, 'num_hidden_layers': 3, 'hidden_dim_0': 1024, 'hidden_dim_1': 128, 'hidden_dim_2': 512, 'kl_weight': 0.0002620626036190884, 'lr': 0.0017026290272650403, 'batch_size': 32, 'dropout_rate': 0.22925724782548645, 'prior_mu': 0.02646850678468273, 'prior_sigma': 0.07671638634455602, 'normalization': 'layer'}. Best is trial 2752 with value: 0.5150722622871399.
Generating morgan fingerprints...
Generated fingerprints with 2048 features for 900 molecules
Data shape: X=(900, 2048), y=(900,)
Trial 2868: 5-fold CV loss = 0.5253
[I 2025-08-08 08:20:40,662] Trial 2868 finished with value: 0.5252856314182281 and parameters: {'fp_type': 'morgan', 'morgan_only_radius': 2, 'morgan_only_nBits': 2048, 'num_hidden_layers': 3, 'hidden_dim_0': 1024, 'hidden_dim_1': 128, 'hidden_dim_2': 512, 'kl_weight': 0.0002801446691196812, 'lr': 0.002267320373049693, 'batch_size': 32, 'dropout_rate': 0.4560214478262274, 'prior_mu': 0.03046770558566949, 'prior_sigma': 0.08034247000520599, 'normalization': 'none'}. Best is trial 2752 with value: 0.5150722622871399.
Generating morgan fingerprints...
Generated fingerprints with 2048 features for 900 molecules
Data shape: X=(900, 2048), y=(900,)
Trial 2870: 5-fold CV loss = 0.5602
[I 2025-08-08 08:21:11,147] Trial 2870 finished with value: 0.560172563791275 and parameters: {'fp_type': 'morgan', 'morgan_only_radius': 2, 'morgan_only_nBits': 2048, 'num_hidden_layers': 3, 'hidden_dim_0': 128, 'hidden_dim_1': 128, 'hidden_dim_2': 512, 'kl_weight': 0.0010400393426186108, 'lr': 0.004571849613410949, 'batch_size': 64, 'dropout_rate': 0.4019932315684475, 'prior_mu': 0.06466770177404975, 'prior_sigma': 0.05703538426879219, 'normalization': 'none'}. Best is trial 2752 with value: 0.5150722622871399.
Generating morgan fingerprints...
Generated fingerprints with 2048 features for 900 molecules
Data shape: X=(900, 2048), y=(900,)
Trial 2867: 5-fold CV loss = 0.5721
[I 2025-08-08 08:21:20,560] Trial 2867 finished with value: 0.5721388101577759 and parameters: {'fp_type': 'morgan', 'morgan_only_radius': 2, 'morgan_only_nBits': 2048, 'num_hidden_layers': 3, 'hidden_dim_0': 512, 'hidden_dim_1': 128, 'hidden_dim_2': 512, 'kl_weight': 0.00025769995020924214, 'lr': 0.0017978869792511496, 'batch_size': 32, 'dropout_rate': 0.45645412826207576, 'prior_mu': 0.027734319113249528, 'prior_sigma': 0.056532337162029295, 'normalization': 'none'}. Best is trial 2752 with value: 0.5150722622871399.
Generating morgan fingerprints...
Generated fingerprints with 2048 features for 900 molecules
Data shape: X=(900, 2048), y=(900,)
Trial 2861: 5-fold CV loss = 0.5183
[I 2025-08-08 08:21:30,403] Trial 2861 finished with value: 0.5182909488677978 and parameters: {'fp_type': 'morgan', 'morgan_only_radius': 2, 'morgan_only_nBits': 2048, 'num_hidden_layers': 3, 'hidden_dim_0': 512, 'hidden_dim_1': 128, 'hidden_dim_2': 512, 'kl_weight': 0.00101037359856398, 'lr': 0.002250791214346975, 'batch_size': 32, 'dropout_rate': 0.4319264692200953, 'prior_mu': 0.05087339151655172, 'prior_sigma': 0.07103586363629782, 'normalization': 'none'}. Best is trial 2752 with value: 0.5150722622871399.
Generating morgan fingerprints...
Generated fingerprints with 2048 features for 900 molecules
Data shape: X=(900, 2048), y=(900,)
Trial 2871: 5-fold CV loss = 0.5772
[I 2025-08-08 08:21:32,531] Trial 2871 finished with value: 0.5772436320781708 and parameters: {'fp_type': 'morgan', 'morgan_only_radius': 2, 'morgan_only_nBits': 2048, 'num_hidden_layers': 3, 'hidden_dim_0': 512, 'hidden_dim_1': 128, 'hidden_dim_2': 1024, 'kl_weight': 0.0008651576302466282, 'lr': 0.00393435632053132, 'batch_size': 128, 'dropout_rate': 0.4222993110207005, 'prior_mu': 0.037371316535390754, 'prior_sigma': 0.06824334268562036, 'normalization': 'none'}. Best is trial 2752 with value: 0.5150722622871399.
Generating morgan fingerprints...
Generated fingerprints with 2048 features for 900 molecules
Data shape: X=(900, 2048), y=(900,)
Trial 2872: 5-fold CV loss = 0.7970
[I 2025-08-08 08:21:33,211] Trial 2872 finished with value: 0.7969917893409729 and parameters: {'fp_type': 'morgan', 'morgan_only_radius': 2, 'morgan_only_nBits': 2048, 'num_hidden_layers': 3, 'hidden_dim_0': 512, 'hidden_dim_1': 128, 'hidden_dim_2': 512, 'kl_weight': 0.0008395665765847362, 'lr': 0.0021001080401360393, 'batch_size': 128, 'dropout_rate': 0.42358607971989043, 'prior_mu': 0.03913442846951744, 'prior_sigma': 0.06892685961603023, 'normalization': 'none'}. Best is trial 2752 with value: 0.5150722622871399.
Generating morgan_rdkit fingerprints...
Generated fingerprints with 1280 features for 900 molecules
Data shape: X=(900, 1280), y=(900,)
Trial 2873: 5-fold CV loss = 0.8923
[I 2025-08-08 08:21:52,802] Trial 2873 finished with value: 0.8923345446586609 and parameters: {'fp_type': 'morgan', 'morgan_only_radius': 2, 'morgan_only_nBits': 2048, 'num_hidden_layers': 3, 'hidden_dim_0': 512, 'hidden_dim_1': 128, 'hidden_dim_2': 1024, 'kl_weight': 0.0011108663989961311, 'lr': 0.002259224627017459, 'batch_size': 128, 'dropout_rate': 0.44443331966882116, 'prior_mu': 0.06246310601617741, 'prior_sigma': 0.07395992074851616, 'normalization': 'none'}. Best is trial 2752 with value: 0.5150722622871399.
Generating morgan_rdkit fingerprints...
Generated fingerprints with 1280 features for 900 molecules
Data shape: X=(900, 1280), y=(900,)
Trial 2869: 5-fold CV loss = 0.5413
[I 2025-08-08 08:22:14,319] Trial 2869 finished with value: 0.5413164436817169 and parameters: {'fp_type': 'morgan', 'morgan_only_radius': 2, 'morgan_only_nBits': 2048, 'num_hidden_layers': 3, 'hidden_dim_0': 512, 'hidden_dim_1': 128, 'hidden_dim_2': 512, 'kl_weight': 0.0008084164836798211, 'lr': 0.0022525577045719256, 'batch_size': 32, 'dropout_rate': 0.40744093524288516, 'prior_mu': 0.09715656249049355, 'prior_sigma': 0.05755118464493291, 'normalization': 'none'}. Best is trial 2752 with value: 0.5150722622871399.
Generating morgan_rdkit fingerprints...
Generated fingerprints with 1280 features for 900 molecules
Data shape: X=(900, 1280), y=(900,)
Trial 2875: 5-fold CV loss = 0.8825
[I 2025-08-08 08:22:15,473] Trial 2875 finished with value: 0.8825219988822937 and parameters: {'fp_type': 'morgan_rdkit', 'combined_morgan_radius': 2, 'combined_morgan_nBits': 1024, 'combined_rdkit_maxPath': 7, 'combined_rdkit_nBits': 256, 'num_hidden_layers': 3, 'hidden_dim_0': 512, 'hidden_dim_1': 128, 'hidden_dim_2': 512, 'kl_weight': 0.001149235799590984, 'lr': 0.00011567950429262951, 'batch_size': 32, 'dropout_rate': 0.44720343223837045, 'prior_mu': 0.06500528242710468, 'prior_sigma': 0.08020284622262688, 'normalization': 'none'}. Best is trial 2752 with value: 0.5150722622871399.
Generating morgan fingerprints...
Generated fingerprints with 2048 features for 900 molecules
Data shape: X=(900, 2048), y=(900,)
Trial 2874: 5-fold CV loss = 0.5331
[I 2025-08-08 08:22:36,509] Trial 2874 finished with value: 0.5331234693527221 and parameters: {'fp_type': 'morgan', 'morgan_only_radius': 2, 'morgan_only_nBits': 2048, 'num_hidden_layers': 3, 'hidden_dim_0': 512, 'hidden_dim_1': 128, 'hidden_dim_2': 512, 'kl_weight': 0.0012734832634847633, 'lr': 0.0024269098593613036, 'batch_size': 32, 'dropout_rate': 0.4470140274979521, 'prior_mu': 0.06700023780675844, 'prior_sigma': 0.07471795139035178, 'normalization': 'none'}. Best is trial 2752 with value: 0.5150722622871399.
Generating morgan fingerprints...
Generated fingerprints with 2048 features for 900 molecules
Data shape: X=(900, 2048), y=(900,)
Trial 2878: 5-fold CV loss = 0.5364
[I 2025-08-08 08:23:22,877] Trial 2878 finished with value: 0.5363971889019012 and parameters: {'fp_type': 'morgan', 'morgan_only_radius': 2, 'morgan_only_nBits': 2048, 'num_hidden_layers': 3, 'hidden_dim_0': 512, 'hidden_dim_1': 128, 'hidden_dim_2': 512, 'kl_weight': 0.0009735601733978396, 'lr': 0.002423675548911002, 'batch_size': 32, 'dropout_rate': 0.2679822980631179, 'prior_mu': 0.06951873462951637, 'prior_sigma': 0.07371270685061188, 'normalization': 'none'}. Best is trial 2752 with value: 0.5150722622871399.
Generating morgan fingerprints...
Generated fingerprints with 2048 features for 900 molecules
Data shape: X=(900, 2048), y=(900,)
Trial 2879: 5-fold CV loss = 0.5605
[I 2025-08-08 08:23:38,091] Trial 2879 finished with value: 0.5605239033699035 and parameters: {'fp_type': 'morgan', 'morgan_only_radius': 2, 'morgan_only_nBits': 2048, 'num_hidden_layers': 3, 'hidden_dim_0': 512, 'hidden_dim_1': 128, 'hidden_dim_2': 64, 'kl_weight': 0.0011467064375007955, 'lr': 0.0024130417536730097, 'batch_size': 32, 'dropout_rate': 0.4397624890542489, 'prior_mu': 0.07646339102719847, 'prior_sigma': 0.06240822386571343, 'normalization': 'none'}. Best is trial 2752 with value: 0.5150722622871399.
Generating morgan fingerprints...
Generated fingerprints with 2048 features for 900 molecules
Data shape: X=(900, 2048), y=(900,)
Trial 2877: 5-fold CV loss = 0.5786
[I 2025-08-08 08:24:34,608] Trial 2877 finished with value: 0.5786417245864868 and parameters: {'fp_type': 'morgan_rdkit', 'combined_morgan_radius': 2, 'combined_morgan_nBits': 1024, 'combined_rdkit_maxPath': 7, 'combined_rdkit_nBits': 256, 'num_hidden_layers': 3, 'hidden_dim_0': 512, 'hidden_dim_1': 128, 'hidden_dim_2': 64, 'kl_weight': 0.0011654619210991473, 'lr': 0.0023251096790049457, 'batch_size': 32, 'dropout_rate': 0.44602485721589136, 'prior_mu': 0.07158489469314482, 'prior_sigma': 0.080569208387145, 'normalization': 'none'}. Best is trial 2752 with value: 0.5150722622871399.
Generating morgan fingerprints...
Generated fingerprints with 2048 features for 900 molecules
Data shape: X=(900, 2048), y=(900,)
Trial 2880: 5-fold CV loss = 0.5258
[I 2025-08-08 08:24:41,728] Trial 2880 finished with value: 0.5258487284183502 and parameters: {'fp_type': 'morgan', 'morgan_only_radius': 2, 'morgan_only_nBits': 2048, 'num_hidden_layers': 3, 'hidden_dim_0': 512, 'hidden_dim_1': 128, 'hidden_dim_2': 512, 'kl_weight': 0.00109722094595587, 'lr': 0.002329405579641934, 'batch_size': 32, 'dropout_rate': 0.4408192190772024, 'prior_mu': 0.05981068091026826, 'prior_sigma': 0.06309890846490755, 'normalization': 'none'}. Best is trial 2752 with value: 0.5150722622871399.
Generating morgan fingerprints...
Generated fingerprints with 2048 features for 900 molecules
Data shape: X=(900, 2048), y=(900,)
Trial 2881: 5-fold CV loss = 0.5217
[I 2025-08-08 08:24:49,444] Trial 2881 finished with value: 0.5217257440090179 and parameters: {'fp_type': 'morgan', 'morgan_only_radius': 2, 'morgan_only_nBits': 2048, 'num_hidden_layers': 3, 'hidden_dim_0': 512, 'hidden_dim_1': 128, 'hidden_dim_2': 512, 'kl_weight': 0.0012322018567055765, 'lr': 0.0023486193365643837, 'batch_size': 32, 'dropout_rate': 0.29479983128193654, 'prior_mu': 0.055588814673044835, 'prior_sigma': 0.08137860838296075, 'normalization': 'none'}. Best is trial 2752 with value: 0.5150722622871399.
Generating morgan fingerprints...
Generated fingerprints with 2048 features for 900 molecules
Data shape: X=(900, 2048), y=(900,)
Trial 2876: 5-fold CV loss = 0.6289
[I 2025-08-08 08:24:57,507] Trial 2876 finished with value: 0.6289116263389587 and parameters: {'fp_type': 'morgan_rdkit', 'combined_morgan_radius': 2, 'combined_morgan_nBits': 1024, 'combined_rdkit_maxPath': 7, 'combined_rdkit_nBits': 256, 'num_hidden_layers': 3, 'hidden_dim_0': 512, 'hidden_dim_1': 128, 'hidden_dim_2': 512, 'kl_weight': 0.0011105731665748218, 'lr': 0.0024438116201389365, 'batch_size': 32, 'dropout_rate': 0.44368815467772044, 'prior_mu': 0.0804702339197022, 'prior_sigma': 0.08128892846750763, 'normalization': 'none'}. Best is trial 2752 with value: 0.5150722622871399.
Generating morgan fingerprints...
Generated fingerprints with 2048 features for 900 molecules
Data shape: X=(900, 2048), y=(900,)
Trial 2883: 5-fold CV loss = 0.7655
[I 2025-08-08 08:24:59,063] Trial 2883 finished with value: 0.7654788136482239 and parameters: {'fp_type': 'morgan', 'morgan_only_radius': 2, 'morgan_only_nBits': 2048, 'num_hidden_layers': 1, 'hidden_dim_0': 512, 'kl_weight': 0.001204749642361804, 'lr': 0.0023962856319622097, 'batch_size': 64, 'dropout_rate': 0.46089811001452585, 'prior_mu': 0.056784142797201266, 'prior_sigma': 0.0676452519988702, 'normalization': 'none'}. Best is trial 2752 with value: 0.5150722622871399.
Generating morgan fingerprints...
Generated fingerprints with 2048 features for 900 molecules
Data shape: X=(900, 2048), y=(900,)
Trial 2884: 5-fold CV loss = 0.7662
[I 2025-08-08 08:25:06,470] Trial 2884 finished with value: 0.7661907434463501 and parameters: {'fp_type': 'morgan', 'morgan_only_radius': 2, 'morgan_only_nBits': 2048, 'num_hidden_layers': 3, 'hidden_dim_0': 512, 'hidden_dim_1': 128, 'hidden_dim_2': 512, 'kl_weight': 0.0010353258445566062, 'lr': 0.0022557011841744675, 'batch_size': 64, 'dropout_rate': 0.46175993155196093, 'prior_mu': 0.06276613774468329, 'prior_sigma': 0.06585970641698194, 'normalization': 'none'}. Best is trial 2752 with value: 0.5150722622871399.
Generating morgan fingerprints...
Generated fingerprints with 2048 features for 900 molecules
Data shape: X=(900, 2048), y=(900,)
Trial 2882: 5-fold CV loss = 0.7164
[I 2025-08-08 08:25:17,634] Trial 2882 finished with value: 0.7163830757141113 and parameters: {'fp_type': 'morgan', 'morgan_only_radius': 2, 'morgan_only_nBits': 2048, 'num_hidden_layers': 3, 'hidden_dim_0': 512, 'hidden_dim_1': 128, 'hidden_dim_2': 512, 'kl_weight': 0.0010150395583792234, 'lr': 0.0023081863852935734, 'batch_size': 64, 'dropout_rate': 0.4622705590229638, 'prior_mu': 0.05919412525024337, 'prior_sigma': 0.06717322697087558, 'normalization': 'none'}. Best is trial 2752 with value: 0.5150722622871399.
Generating morgan fingerprints...
Generated fingerprints with 2048 features for 900 molecules
Data shape: X=(900, 2048), y=(900,)
Trial 2887: 5-fold CV loss = 1.1792
[I 2025-08-08 08:25:32,836] Trial 2887 finished with value: 1.1792140245437621 and parameters: {'fp_type': 'morgan', 'morgan_only_radius': 2, 'morgan_only_nBits': 2048, 'num_hidden_layers': 3, 'hidden_dim_0': 512, 'hidden_dim_1': 1024, 'hidden_dim_2': 512, 'kl_weight': 0.0010923237669993417, 'lr': 0.0021876765261654514, 'batch_size': 32, 'dropout_rate': 0.43394177544993784, 'prior_mu': 0.04843844029446723, 'prior_sigma': 0.07182243221000364, 'normalization': 'none'}. Best is trial 2752 with value: 0.5150722622871399.
Generating morgan fingerprints...
Generated fingerprints with 2048 features for 900 molecules
Data shape: X=(900, 2048), y=(900,)
Trial 2885: 5-fold CV loss = 0.9822
[I 2025-08-08 08:25:35,715] Trial 2885 finished with value: 0.9822015166282654 and parameters: {'fp_type': 'morgan', 'morgan_only_radius': 2, 'morgan_only_nBits': 2048, 'num_hidden_layers': 3, 'hidden_dim_0': 512, 'hidden_dim_1': 1024, 'hidden_dim_2': 512, 'kl_weight': 0.0009561746890170917, 'lr': 0.0021678012324672646, 'batch_size': 64, 'dropout_rate': 0.46110989742778613, 'prior_mu': 0.06024287026613363, 'prior_sigma': 0.06579936120989191, 'normalization': 'none'}. Best is trial 2752 with value: 0.5150722622871399.
Generating morgan fingerprints...
Generated fingerprints with 2048 features for 900 molecules
Data shape: X=(900, 2048), y=(900,)
Trial 2886: 5-fold CV loss = 0.5283
[I 2025-08-08 08:26:17,817] Trial 2886 finished with value: 0.5283426403999328 and parameters: {'fp_type': 'morgan', 'morgan_only_radius': 2, 'morgan_only_nBits': 2048, 'num_hidden_layers': 3, 'hidden_dim_0': 512, 'hidden_dim_1': 128, 'hidden_dim_2': 512, 'kl_weight': 0.000980509943515839, 'lr': 0.0021794639504812727, 'batch_size': 32, 'dropout_rate': 0.4338802330825274, 'prior_mu': 0.06334607793999403, 'prior_sigma': 0.07185050741264735, 'normalization': 'none'}. Best is trial 2752 with value: 0.5150722622871399.
Generating morgan fingerprints...
Generated fingerprints with 2048 features for 900 molecules
Data shape: X=(900, 2048), y=(900,)
Trial 2888: 5-fold CV loss = 0.9110
[I 2025-08-08 08:26:38,240] Trial 2888 finished with value: 0.9110255479812622 and parameters: {'fp_type': 'morgan', 'morgan_only_radius': 2, 'morgan_only_nBits': 2048, 'num_hidden_layers': 3, 'hidden_dim_0': 512, 'hidden_dim_1': 1024, 'hidden_dim_2': 512, 'kl_weight': 0.000976905495128111, 'lr': 0.0021314295784337087, 'batch_size': 32, 'dropout_rate': 0.4338758252856124, 'prior_mu': 0.054629565905372796, 'prior_sigma': 0.07178187549828076, 'normalization': 'none'}. Best is trial 2752 with value: 0.5150722622871399.
Generating rdkit fingerprints...
Generated fingerprints with 256 features for 900 molecules
Data shape: X=(900, 256), y=(900,)
Trial 2889: 5-fold CV loss = 0.5276
[I 2025-08-08 08:26:44,685] Trial 2889 finished with value: 0.527628380060196 and parameters: {'fp_type': 'morgan', 'morgan_only_radius': 2, 'morgan_only_nBits': 2048, 'num_hidden_layers': 3, 'hidden_dim_0': 512, 'hidden_dim_1': 128, 'hidden_dim_2': 512, 'kl_weight': 0.0010643621365918627, 'lr': 0.0021013598917473376, 'batch_size': 32, 'dropout_rate': 0.45095585801901417, 'prior_mu': 0.05679608794583439, 'prior_sigma': 0.07447912911268424, 'normalization': 'none'}. Best is trial 2752 with value: 0.5150722622871399.
Generating rdkit fingerprints...
Generated fingerprints with 256 features for 900 molecules
Data shape: X=(900, 256), y=(900,)
Trial 2893: 5-fold CV loss = 0.6731
[I 2025-08-08 08:27:16,077] Trial 2893 finished with value: 0.6731088876724243 and parameters: {'fp_type': 'rdkit', 'rdkit_only_maxPath': 8, 'rdkit_only_nBits': 256, 'num_hidden_layers': 3, 'hidden_dim_0': 128, 'hidden_dim_1': 512, 'hidden_dim_2': 512, 'kl_weight': 0.0008924446339090565, 'lr': 0.0025855349730932635, 'batch_size': 32, 'dropout_rate': 0.45318655782614314, 'prior_mu': 0.04813392541038389, 'prior_sigma': 0.0536834723835682, 'normalization': 'none'}. Best is trial 2752 with value: 0.5150722622871399.
Generating morgan fingerprints...
Generated fingerprints with 2048 features for 900 molecules
Data shape: X=(900, 2048), y=(900,)
Trial 2891: 5-fold CV loss = 0.5723
[I 2025-08-08 08:27:29,091] Trial 2891 finished with value: 0.5723044216632843 and parameters: {'fp_type': 'morgan', 'morgan_only_radius': 2, 'morgan_only_nBits': 2048, 'num_hidden_layers': 3, 'hidden_dim_0': 512, 'hidden_dim_1': 128, 'hidden_dim_2': 512, 'kl_weight': 0.0009335304483806311, 'lr': 0.0020892178996392394, 'batch_size': 32, 'dropout_rate': 0.44952742683477387, 'prior_mu': 0.05596255780554437, 'prior_sigma': 0.07670396651208526, 'normalization': 'none'}. Best is trial 2752 with value: 0.5150722622871399.
Generating morgan fingerprints...
Generated fingerprints with 2048 features for 900 molecules
Data shape: X=(900, 2048), y=(900,)
Trial 2892: 5-fold CV loss = 0.6734
[I 2025-08-08 08:27:39,437] Trial 2892 finished with value: 0.6733670353889465 and parameters: {'fp_type': 'rdkit', 'rdkit_only_maxPath': 8, 'rdkit_only_nBits': 256, 'num_hidden_layers': 3, 'hidden_dim_0': 128, 'hidden_dim_1': 512, 'hidden_dim_2': 512, 'kl_weight': 0.00095205625148804, 'lr': 0.0025396162104960778, 'batch_size': 32, 'dropout_rate': 0.4520547816244285, 'prior_mu': 0.05116451773456371, 'prior_sigma': 0.05361224788595521, 'normalization': 'none'}. Best is trial 2752 with value: 0.5150722622871399.
Generating morgan fingerprints...
Generated fingerprints with 2048 features for 900 molecules
Data shape: X=(900, 2048), y=(900,)
Trial 2894: 5-fold CV loss = 0.5324
[I 2025-08-08 08:28:37,002] Trial 2894 finished with value: 0.5323824286460876 and parameters: {'fp_type': 'morgan', 'morgan_only_radius': 2, 'morgan_only_nBits': 2048, 'num_hidden_layers': 3, 'hidden_dim_0': 512, 'hidden_dim_1': 128, 'hidden_dim_2': 512, 'kl_weight': 0.0008970968740888798, 'lr': 0.0020478755088662853, 'batch_size': 32, 'dropout_rate': 0.4705306203877195, 'prior_mu': 0.07041510860417204, 'prior_sigma': 0.0770701750577034, 'normalization': 'none'}. Best is trial 2752 with value: 0.5150722622871399.
Generating morgan fingerprints...
Generated fingerprints with 2048 features for 900 molecules
Data shape: X=(900, 2048), y=(900,)
Trial 2895: 5-fold CV loss = 0.5211
[I 2025-08-08 08:28:48,855] Trial 2895 finished with value: 0.5211161613464356 and parameters: {'fp_type': 'morgan', 'morgan_only_radius': 2, 'morgan_only_nBits': 2048, 'num_hidden_layers': 3, 'hidden_dim_0': 512, 'hidden_dim_1': 128, 'hidden_dim_2': 512, 'kl_weight': 0.0012306868955446425, 'lr': 0.002506038040973251, 'batch_size': 32, 'dropout_rate': 0.43826064460765546, 'prior_mu': 0.048943214916304684, 'prior_sigma': 0.06016590323316793, 'normalization': 'none'}. Best is trial 2752 with value: 0.5150722622871399.
Generating morgan fingerprints...
Generated fingerprints with 2048 features for 900 molecules
Data shape: X=(900, 2048), y=(900,)
Trial 2890: 5-fold CV loss = 0.5295
