[I 2025-08-08 01:58:57,065] Trial 1727 finished with value: 0.5212599039077759 and parameters: {'fp_type': 'morgan', 'morgan_only_radius': 2, 'morgan_only_nBits': 2048, 'num_hidden_layers': 3, 'hidden_dim_0': 512, 'hidden_dim_1': 128, 'hidden_dim_2': 512, 'kl_weight': 0.0007725825021821503, 'lr': 0.0018663666025467754, 'batch_size': 32, 'dropout_rate': 0.4194573152997091, 'prior_mu': 0.02645174755188947, 'prior_sigma': 0.06894145002076912, 'normalization': 'none'}. Best is trial 1528 with value: 0.5170644640922546.
Generating morgan fingerprints...
Generated fingerprints with 2048 features for 900 molecules
Data shape: X=(900, 2048), y=(900,)
Trial 1732: 5-fold CV loss = 0.5270
[I 2025-08-08 01:58:57,533] Trial 1732 finished with value: 0.5269976258277893 and parameters: {'fp_type': 'morgan', 'morgan_only_radius': 2, 'morgan_only_nBits': 2048, 'num_hidden_layers': 3, 'hidden_dim_0': 512, 'hidden_dim_1': 128, 'hidden_dim_2': 1024, 'kl_weight': 0.0006034021109459141, 'lr': 0.002279349236788735, 'batch_size': 32, 'dropout_rate': 0.4072255311325872, 'prior_mu': 0.03698772021891745, 'prior_sigma': 0.06449724197211328, 'normalization': 'none'}. Best is trial 1528 with value: 0.5170644640922546.
Generating morgan fingerprints...
Generated fingerprints with 2048 features for 900 molecules
Data shape: X=(900, 2048), y=(900,)
Trial 1733: 5-fold CV loss = 0.5260
[I 2025-08-08 01:59:20,829] Trial 1733 finished with value: 0.5260352730751038 and parameters: {'fp_type': 'morgan', 'morgan_only_radius': 2, 'morgan_only_nBits': 2048, 'num_hidden_layers': 3, 'hidden_dim_0': 512, 'hidden_dim_1': 128, 'hidden_dim_2': 1024, 'kl_weight': 0.000611748696605908, 'lr': 0.0020002035605268687, 'batch_size': 32, 'dropout_rate': 0.4340376867075355, 'prior_mu': 0.017748354353533904, 'prior_sigma': 0.06369678368956444, 'normalization': 'none'}. Best is trial 1528 with value: 0.5170644640922546.
Generating morgan fingerprints...
Generated fingerprints with 2048 features for 900 molecules
Data shape: X=(900, 2048), y=(900,)
Trial 1726: 5-fold CV loss = 0.5246
[I 2025-08-08 01:59:22,542] Trial 1726 finished with value: 0.524606341123581 and parameters: {'fp_type': 'morgan', 'morgan_only_radius': 2, 'morgan_only_nBits': 2048, 'num_hidden_layers': 3, 'hidden_dim_0': 512, 'hidden_dim_1': 128, 'hidden_dim_2': 1024, 'kl_weight': 0.0007604289809003749, 'lr': 0.0018455448420812283, 'batch_size': 32, 'dropout_rate': 0.4194328078102315, 'prior_mu': 0.027773911450775207, 'prior_sigma': 0.0706525121201162, 'normalization': 'none'}. Best is trial 1528 with value: 0.5170644640922546.
Generating morgan fingerprints...
Generated fingerprints with 2048 features for 900 molecules
Data shape: X=(900, 2048), y=(900,)
Trial 1736: 5-fold CV loss = 0.7998
[I 2025-08-08 02:00:06,962] Trial 1736 finished with value: 0.7997695684432984 and parameters: {'fp_type': 'morgan', 'morgan_only_radius': 2, 'morgan_only_nBits': 2048, 'num_hidden_layers': 3, 'hidden_dim_0': 512, 'hidden_dim_1': 128, 'hidden_dim_2': 256, 'kl_weight': 0.000910532276794708, 'lr': 0.0014425106688655345, 'batch_size': 32, 'dropout_rate': 0.3970183653678588, 'prior_mu': 0.018388242785401982, 'prior_sigma': 0.09182809799961912, 'normalization': 'none'}. Best is trial 1528 with value: 0.5170644640922546.
Generating morgan fingerprints...
Generated fingerprints with 2048 features for 900 molecules
Data shape: X=(900, 2048), y=(900,)
Trial 1735: 5-fold CV loss = 0.6538
[I 2025-08-08 02:00:08,726] Trial 1735 finished with value: 0.653819453716278 and parameters: {'fp_type': 'morgan', 'morgan_only_radius': 2, 'morgan_only_nBits': 2048, 'num_hidden_layers': 3, 'hidden_dim_0': 512, 'hidden_dim_1': 128, 'hidden_dim_2': 256, 'kl_weight': 0.0007658685378732524, 'lr': 0.0017010051948903534, 'batch_size': 32, 'dropout_rate': 0.4078613485725226, 'prior_mu': 0.018076953410616495, 'prior_sigma': 0.07621527838818844, 'normalization': 'none'}. Best is trial 1528 with value: 0.5170644640922546.
Generating morgan fingerprints...
Generated fingerprints with 2048 features for 900 molecules
Data shape: X=(900, 2048), y=(900,)
Trial 1737: 5-fold CV loss = 0.7765
[I 2025-08-08 02:00:16,958] Trial 1737 finished with value: 0.7765228509902954 and parameters: {'fp_type': 'morgan', 'morgan_only_radius': 2, 'morgan_only_nBits': 2048, 'num_hidden_layers': 3, 'hidden_dim_0': 1024, 'hidden_dim_1': 128, 'hidden_dim_2': 256, 'kl_weight': 0.000932747787015498, 'lr': 0.0014446863404168821, 'batch_size': 64, 'dropout_rate': 0.4188213740150475, 'prior_mu': 0.023416779287675098, 'prior_sigma': 0.07511406675216091, 'normalization': 'none'}. Best is trial 1528 with value: 0.5170644640922546.
Generating morgan fingerprints...
Generated fingerprints with 2048 features for 900 molecules
Data shape: X=(900, 2048), y=(900,)
Trial 1738: 5-fold CV loss = 0.9478
[I 2025-08-08 02:00:25,299] Trial 1738 finished with value: 0.94784996509552 and parameters: {'fp_type': 'morgan', 'morgan_only_radius': 2, 'morgan_only_nBits': 2048, 'num_hidden_layers': 3, 'hidden_dim_0': 1024, 'hidden_dim_1': 128, 'hidden_dim_2': 512, 'kl_weight': 0.0009469057006052647, 'lr': 0.0016239639259587244, 'batch_size': 64, 'dropout_rate': 0.4134483608053464, 'prior_mu': 0.03415454762869985, 'prior_sigma': 0.0743971003024965, 'normalization': 'none'}. Best is trial 1528 with value: 0.5170644640922546.
Generating morgan_rdkit fingerprints...
Generated fingerprints with 1024 features for 900 molecules
Data shape: X=(900, 1024), y=(900,)
Trial 1739: 5-fold CV loss = 0.6039
[I 2025-08-08 02:01:05,355] Trial 1739 finished with value: 0.6038552522659302 and parameters: {'fp_type': 'morgan', 'morgan_only_radius': 2, 'morgan_only_nBits': 2048, 'num_hidden_layers': 3, 'hidden_dim_0': 128, 'hidden_dim_1': 128, 'hidden_dim_2': 512, 'kl_weight': 0.0008888209230928447, 'lr': 0.0016260748586395329, 'batch_size': 32, 'dropout_rate': 0.4000860082771204, 'prior_mu': 0.024616372761301464, 'prior_sigma': 0.07709897105640312, 'normalization': 'none'}. Best is trial 1528 with value: 0.5170644640922546.
Generating morgan_rdkit fingerprints...
Generated fingerprints with 1024 features for 900 molecules
Data shape: X=(900, 1024), y=(900,)
Trial 1734: 5-fold CV loss = 0.5246
[I 2025-08-08 02:01:19,261] Trial 1734 finished with value: 0.524597293138504 and parameters: {'fp_type': 'morgan', 'morgan_only_radius': 2, 'morgan_only_nBits': 2048, 'num_hidden_layers': 3, 'hidden_dim_0': 512, 'hidden_dim_1': 128, 'hidden_dim_2': 1024, 'kl_weight': 0.0009055500518308214, 'lr': 0.001403710265063018, 'batch_size': 32, 'dropout_rate': 0.41140298299317385, 'prior_mu': 0.02244736501608103, 'prior_sigma': 0.07611828542058374, 'normalization': 'none'}. Best is trial 1528 with value: 0.5170644640922546.
Generating morgan_rdkit fingerprints...
Generated fingerprints with 1024 features for 900 molecules
Data shape: X=(900, 1024), y=(900,)
Trial 1741: 5-fold CV loss = 0.5995
[I 2025-08-08 02:01:31,630] Trial 1741 finished with value: 0.5995410561561585 and parameters: {'fp_type': 'morgan_rdkit', 'combined_morgan_radius': 3, 'combined_morgan_nBits': 512, 'combined_rdkit_maxPath': 8, 'combined_rdkit_nBits': 512, 'num_hidden_layers': 3, 'hidden_dim_0': 128, 'hidden_dim_1': 128, 'hidden_dim_2': 512, 'kl_weight': 0.0008669078122291904, 'lr': 0.0017007578774691948, 'batch_size': 32, 'dropout_rate': 0.4103742319830547, 'prior_mu': 0.024257792032717725, 'prior_sigma': 0.07740672779137286, 'normalization': 'none'}. Best is trial 1528 with value: 0.5170644640922546.
Generating morgan fingerprints...
Generated fingerprints with 2048 features for 900 molecules
Data shape: X=(900, 2048), y=(900,)
Trial 1740: 5-fold CV loss = 0.9663
[I 2025-08-08 02:01:47,218] Trial 1740 finished with value: 0.9663051843643189 and parameters: {'fp_type': 'morgan', 'morgan_only_radius': 3, 'morgan_only_nBits': 2048, 'num_hidden_layers': 3, 'hidden_dim_0': 128, 'hidden_dim_1': 256, 'hidden_dim_2': 512, 'kl_weight': 0.0008851573017323322, 'lr': 0.000472450720711298, 'batch_size': 32, 'dropout_rate': 0.4125341617701222, 'prior_mu': 0.026877281933511393, 'prior_sigma': 0.07778308067543928, 'normalization': 'none'}. Best is trial 1528 with value: 0.5170644640922546.
Generating morgan fingerprints...
Generated fingerprints with 2048 features for 900 molecules
Data shape: X=(900, 2048), y=(900,)
Trial 1742: 5-fold CV loss = 0.6162
[I 2025-08-08 02:02:02,479] Trial 1742 finished with value: 0.6161923408508301 and parameters: {'fp_type': 'morgan_rdkit', 'combined_morgan_radius': 3, 'combined_morgan_nBits': 512, 'combined_rdkit_maxPath': 8, 'combined_rdkit_nBits': 512, 'num_hidden_layers': 3, 'hidden_dim_0': 512, 'hidden_dim_1': 256, 'hidden_dim_2': 512, 'kl_weight': 0.000835010768278496, 'lr': 0.0018104206086039807, 'batch_size': 32, 'dropout_rate': 0.42747737171825356, 'prior_mu': 0.015467177498456521, 'prior_sigma': 0.08067192646770177, 'normalization': 'none'}. Best is trial 1528 with value: 0.5170644640922546.
Generating morgan fingerprints...
Generated fingerprints with 2048 features for 900 molecules
Data shape: X=(900, 2048), y=(900,)
Trial 1744: 5-fold CV loss = 0.9699
[I 2025-08-08 02:02:13,026] Trial 1744 finished with value: 0.9698785424232483 and parameters: {'fp_type': 'morgan', 'morgan_only_radius': 3, 'morgan_only_nBits': 2048, 'num_hidden_layers': 3, 'hidden_dim_0': 512, 'hidden_dim_1': 256, 'hidden_dim_2': 512, 'kl_weight': 0.0007504670047850206, 'lr': 0.0017609348903641594, 'batch_size': 32, 'dropout_rate': 0.42727853422504875, 'prior_mu': 0.03648903687883539, 'prior_sigma': 0.06935237745040554, 'normalization': 'none'}. Best is trial 1528 with value: 0.5170644640922546.
Generating morgan fingerprints...
Generated fingerprints with 2048 features for 900 molecules
Data shape: X=(900, 2048), y=(900,)
Trial 1746: 5-fold CV loss = 0.6045
[I 2025-08-08 02:03:04,550] Trial 1746 finished with value: 0.6045071244239807 and parameters: {'fp_type': 'morgan', 'morgan_only_radius': 2, 'morgan_only_nBits': 2048, 'num_hidden_layers': 3, 'hidden_dim_0': 512, 'hidden_dim_1': 128, 'hidden_dim_2': 512, 'kl_weight': 0.0007226854532291383, 'lr': 0.001708157486789476, 'batch_size': 32, 'dropout_rate': 0.4244528979627561, 'prior_mu': 0.03463082463112129, 'prior_sigma': 0.0696200806647697, 'normalization': 'none'}. Best is trial 1528 with value: 0.5170644640922546.
Generating morgan fingerprints...
Generated fingerprints with 2048 features for 900 molecules
Data shape: X=(900, 2048), y=(900,)
Trial 1747: 5-fold CV loss = 0.6233
[I 2025-08-08 02:03:26,955] Trial 1747 finished with value: 0.6232900142669677 and parameters: {'fp_type': 'morgan', 'morgan_only_radius': 2, 'morgan_only_nBits': 2048, 'num_hidden_layers': 3, 'hidden_dim_0': 512, 'hidden_dim_1': 128, 'hidden_dim_2': 128, 'kl_weight': 0.0006846226914543057, 'lr': 0.0019581196955466857, 'batch_size': 32, 'dropout_rate': 0.4032661411948192, 'prior_mu': 0.03252054121067456, 'prior_sigma': 0.07185822475489473, 'normalization': 'none'}. Best is trial 1528 with value: 0.5170644640922546.
Generating morgan fingerprints...
Generated fingerprints with 2048 features for 900 molecules
Data shape: X=(900, 2048), y=(900,)
Trial 1743: 5-fold CV loss = 0.5621
[I 2025-08-08 02:03:41,107] Trial 1743 finished with value: 0.5620937764644622 and parameters: {'fp_type': 'morgan_rdkit', 'combined_morgan_radius': 3, 'combined_morgan_nBits': 512, 'combined_rdkit_maxPath': 8, 'combined_rdkit_nBits': 512, 'num_hidden_layers': 3, 'hidden_dim_0': 512, 'hidden_dim_1': 256, 'hidden_dim_2': 512, 'kl_weight': 0.0008097169080249862, 'lr': 0.004193735625555714, 'batch_size': 32, 'dropout_rate': 0.3897598618376128, 'prior_mu': 0.016704373045187938, 'prior_sigma': 0.06897106306676605, 'normalization': 'none'}. Best is trial 1528 with value: 0.5170644640922546.
Generating morgan fingerprints...
Generated fingerprints with 2048 features for 900 molecules
Data shape: X=(900, 2048), y=(900,)
Trial 1748: 5-fold CV loss = 0.6693
[I 2025-08-08 02:04:08,981] Trial 1748 finished with value: 0.669253671169281 and parameters: {'fp_type': 'morgan', 'morgan_only_radius': 2, 'morgan_only_nBits': 2048, 'num_hidden_layers': 3, 'hidden_dim_0': 512, 'hidden_dim_1': 128, 'hidden_dim_2': 128, 'kl_weight': 0.0006673232970243492, 'lr': 0.001903847458166613, 'batch_size': 32, 'dropout_rate': 0.3995675614976637, 'prior_mu': 0.03052564680176229, 'prior_sigma': 0.0868703405845068, 'normalization': 'none'}. Best is trial 1528 with value: 0.5170644640922546.
Generating morgan fingerprints...
Generated fingerprints with 2048 features for 900 molecules
Data shape: X=(900, 2048), y=(900,)
Trial 1749: 5-fold CV loss = 0.7049
[I 2025-08-08 02:04:33,214] Trial 1749 finished with value: 0.7049439430236817 and parameters: {'fp_type': 'morgan', 'morgan_only_radius': 2, 'morgan_only_nBits': 2048, 'num_hidden_layers': 3, 'hidden_dim_0': 512, 'hidden_dim_1': 128, 'hidden_dim_2': 512, 'kl_weight': 0.00012747615562565707, 'lr': 0.0015309210035011568, 'batch_size': 32, 'dropout_rate': 0.4249042748466435, 'prior_mu': 0.017605386908278207, 'prior_sigma': 0.06711733928457787, 'normalization': 'none'}. Best is trial 1528 with value: 0.5170644640922546.
Generating morgan fingerprints...
Generated fingerprints with 2048 features for 900 molecules
Data shape: X=(900, 2048), y=(900,)
Trial 1745: 5-fold CV loss = 0.6070
[I 2025-08-08 02:04:59,543] Trial 1745 finished with value: 0.6070229828357696 and parameters: {'fp_type': 'morgan', 'morgan_only_radius': 2, 'morgan_only_nBits': 2048, 'num_hidden_layers': 3, 'hidden_dim_0': 512, 'hidden_dim_1': 128, 'hidden_dim_2': 128, 'kl_weight': 0.0007657176047695287, 'lr': 0.0017216175638287451, 'batch_size': 32, 'dropout_rate': 0.43182655361989997, 'prior_mu': 0.033420815800909644, 'prior_sigma': 0.06914537893001399, 'normalization': 'none'}. Best is trial 1528 with value: 0.5170644640922546.
Generating morgan fingerprints...
Generated fingerprints with 2048 features for 900 molecules
Data shape: X=(900, 2048), y=(900,)
Trial 1751: 5-fold CV loss = 0.5428
[I 2025-08-08 02:05:26,754] Trial 1751 finished with value: 0.5427686512470246 and parameters: {'fp_type': 'morgan', 'morgan_only_radius': 2, 'morgan_only_nBits': 2048, 'num_hidden_layers': 3, 'hidden_dim_0': 64, 'hidden_dim_1': 128, 'hidden_dim_2': 512, 'kl_weight': 0.00041501822152719293, 'lr': 0.0019770162493245287, 'batch_size': 32, 'dropout_rate': 0.4261718623552563, 'prior_mu': 0.04335049844887824, 'prior_sigma': 0.07219451826765808, 'normalization': 'none'}. Best is trial 1528 with value: 0.5170644640922546.
Generating morgan fingerprints...
Generated fingerprints with 2048 features for 900 molecules
Data shape: X=(900, 2048), y=(900,)
Trial 1750: 5-fold CV loss = 0.5944
[I 2025-08-08 02:06:10,634] Trial 1750 finished with value: 0.594424170255661 and parameters: {'fp_type': 'morgan', 'morgan_only_radius': 2, 'morgan_only_nBits': 2048, 'num_hidden_layers': 3, 'hidden_dim_0': 512, 'hidden_dim_1': 128, 'hidden_dim_2': 512, 'kl_weight': 0.00012440584827316936, 'lr': 0.001537308056334702, 'batch_size': 32, 'dropout_rate': 0.4302720961743818, 'prior_mu': 0.042059643274128755, 'prior_sigma': 0.0674670897839618, 'normalization': 'none'}. Best is trial 1528 with value: 0.5170644640922546.
Generating morgan fingerprints...
Generated fingerprints with 2048 features for 900 molecules
Data shape: X=(900, 2048), y=(900,)
Trial 1752: 5-fold CV loss = 0.5370
[I 2025-08-08 02:06:17,486] Trial 1752 finished with value: 0.5370104432106018 and parameters: {'fp_type': 'morgan', 'morgan_only_radius': 2, 'morgan_only_nBits': 2048, 'num_hidden_layers': 3, 'hidden_dim_0': 256, 'hidden_dim_1': 128, 'hidden_dim_2': 512, 'kl_weight': 0.000990823756521016, 'lr': 0.00198856303104372, 'batch_size': 32, 'dropout_rate': 0.436358456596199, 'prior_mu': 0.04119062956607489, 'prior_sigma': 0.07315202062583208, 'normalization': 'none'}. Best is trial 1528 with value: 0.5170644640922546.
Generating morgan fingerprints...
Generated fingerprints with 2048 features for 900 molecules
Data shape: X=(900, 2048), y=(900,)
Trial 1754: 5-fold CV loss = 0.5823
[I 2025-08-08 02:06:20,156] Trial 1754 finished with value: 0.5822612524032593 and parameters: {'fp_type': 'morgan', 'morgan_only_radius': 2, 'morgan_only_nBits': 2048, 'num_hidden_layers': 3, 'hidden_dim_0': 256, 'hidden_dim_1': 128, 'hidden_dim_2': 512, 'kl_weight': 0.0005653585633060167, 'lr': 0.001973727100139947, 'batch_size': 32, 'dropout_rate': 0.4162305376008708, 'prior_mu': -0.17687049639474783, 'prior_sigma': 0.06609872016978272, 'normalization': 'none'}. Best is trial 1528 with value: 0.5170644640922546.
Generating morgan fingerprints...
Generated fingerprints with 2048 features for 900 molecules
Data shape: X=(900, 2048), y=(900,)
Trial 1756: 5-fold CV loss = 0.6474
[I 2025-08-08 02:06:36,605] Trial 1756 finished with value: 0.6473809123039246 and parameters: {'fp_type': 'morgan', 'morgan_only_radius': 2, 'morgan_only_nBits': 2048, 'num_hidden_layers': 0, 'kl_weight': 0.0005605660773773727, 'lr': 0.0020052544721611454, 'batch_size': 32, 'dropout_rate': 0.38162023677388196, 'prior_mu': 0.027376025739944927, 'prior_sigma': 0.06564246816517365, 'normalization': 'none'}. Best is trial 1528 with value: 0.5170644640922546.
Generating morgan fingerprints...
Generated fingerprints with 2048 features for 900 molecules
Data shape: X=(900, 2048), y=(900,)
Trial 1757: 5-fold CV loss = 0.6562
[I 2025-08-08 02:07:05,384] Trial 1757 finished with value: 0.6562179028987885 and parameters: {'fp_type': 'morgan', 'morgan_only_radius': 2, 'morgan_only_nBits': 2048, 'num_hidden_layers': 3, 'hidden_dim_0': 512, 'hidden_dim_1': 128, 'hidden_dim_2': 512, 'kl_weight': 0.0006504920038373337, 'lr': 0.0018095020277686077, 'batch_size': 32, 'dropout_rate': 0.4345036204301847, 'prior_mu': 0.027072143954682375, 'prior_sigma': 0.06668472767115101, 'normalization': 'none'}. Best is trial 1528 with value: 0.5170644640922546.
Generating rdkit fingerprints...
Generated fingerprints with 1024 features for 900 molecules
Data shape: X=(900, 1024), y=(900,)
Trial 1758: 5-fold CV loss = 0.6709
[I 2025-08-08 02:07:11,764] Trial 1758 finished with value: 0.6709145545959473 and parameters: {'fp_type': 'morgan', 'morgan_only_radius': 2, 'morgan_only_nBits': 2048, 'num_hidden_layers': 2, 'hidden_dim_0': 512, 'hidden_dim_1': 128, 'kl_weight': 0.0006622097624119511, 'lr': 0.001787650720839704, 'batch_size': 32, 'dropout_rate': 0.4394291983574883, 'prior_mu': 0.04005788147596992, 'prior_sigma': 0.07266196476526966, 'normalization': 'none'}. Best is trial 1528 with value: 0.5170644640922546.
Generating rdkit fingerprints...
Generated fingerprints with 1024 features for 900 molecules
Data shape: X=(900, 1024), y=(900,)
Trial 1755: 5-fold CV loss = 0.6281
[I 2025-08-08 02:07:43,500] Trial 1755 finished with value: 0.6281472861766815 and parameters: {'fp_type': 'morgan', 'morgan_only_radius': 2, 'morgan_only_nBits': 2048, 'num_hidden_layers': 2, 'hidden_dim_0': 256, 'hidden_dim_1': 128, 'kl_weight': 0.0010024554130557953, 'lr': 0.0020130274875566575, 'batch_size': 32, 'dropout_rate': 0.3872316489834389, 'prior_mu': 0.04033381270909067, 'prior_sigma': 0.07334384865247084, 'normalization': 'none'}. Best is trial 1528 with value: 0.5170644640922546.
Generating rdkit fingerprints...
Generated fingerprints with 1024 features for 900 molecules
Data shape: X=(900, 1024), y=(900,)
Trial 1759: 5-fold CV loss = 0.5834
[I 2025-08-08 02:08:16,813] Trial 1759 finished with value: 0.5833773851394654 and parameters: {'fp_type': 'rdkit', 'rdkit_only_maxPath': 7, 'rdkit_only_nBits': 1024, 'num_hidden_layers': 2, 'hidden_dim_0': 512, 'hidden_dim_1': 128, 'kl_weight': 0.0004522793144784324, 'lr': 0.0017772219873612102, 'batch_size': 32, 'dropout_rate': 0.4140153902172852, 'prior_mu': 0.03937728630704473, 'prior_sigma': 0.07270476426989023, 'normalization': 'none'}. Best is trial 1528 with value: 0.5170644640922546.
Generating morgan fingerprints...
Generated fingerprints with 2048 features for 900 molecules
Data shape: X=(900, 2048), y=(900,)
Trial 1760: 5-fold CV loss = 0.6388
[I 2025-08-08 02:08:23,786] Trial 1760 finished with value: 0.6387693881988525 and parameters: {'fp_type': 'rdkit', 'rdkit_only_maxPath': 7, 'rdkit_only_nBits': 1024, 'num_hidden_layers': 3, 'hidden_dim_0': 512, 'hidden_dim_1': 128, 'hidden_dim_2': 64, 'kl_weight': 0.0004382245763858308, 'lr': 0.002094868326174316, 'batch_size': 32, 'dropout_rate': 0.4192306043519721, 'prior_mu': 0.047085910886330684, 'prior_sigma': 0.1300016780860033, 'normalization': 'none'}. Best is trial 1528 with value: 0.5170644640922546.
Generating morgan fingerprints...
Generated fingerprints with 2048 features for 900 molecules
Data shape: X=(900, 2048), y=(900,)
Trial 1762: 5-fold CV loss = 0.6279
[I 2025-08-08 02:09:14,774] Trial 1762 finished with value: 0.6279461860656739 and parameters: {'fp_type': 'morgan', 'morgan_only_radius': 2, 'morgan_only_nBits': 2048, 'num_hidden_layers': 3, 'hidden_dim_0': 512, 'hidden_dim_1': 128, 'hidden_dim_2': 64, 'kl_weight': 0.0008458225624330448, 'lr': 0.0021497450106237595, 'batch_size': 32, 'dropout_rate': 0.4223870418882983, 'prior_mu': 0.04705115989818675, 'prior_sigma': 0.08226341386830124, 'normalization': 'none'}. Best is trial 1528 with value: 0.5170644640922546.
Generating morgan fingerprints...
Generated fingerprints with 2048 features for 900 molecules
Data shape: X=(900, 2048), y=(900,)
Trial 1753: 5-fold CV loss = 0.5447
