[I 2025-08-07 17:54:05,506] Trial 431 finished with value: 0.7650365114212037 and parameters: {'fp_type': 'morgan', 'morgan_only_radius': 2, 'morgan_only_nBits': 1024, 'num_hidden_layers': 3, 'hidden_dim_0': 512, 'hidden_dim_1': 128, 'hidden_dim_2': 512, 'kl_weight': 0.0031348573878036373, 'lr': 0.001297923171417051, 'batch_size': 32, 'dropout_rate': 0.43058210732501145, 'prior_mu': 0.003124486462752896, 'prior_sigma': 0.06399255239176183, 'normalization': 'none'}. Best is trial 272 with value: 0.5198344707489013.
Generating morgan fingerprints...
Generated fingerprints with 1024 features for 900 molecules
Data shape: X=(900, 1024), y=(900,)
Trial 430: 5-fold CV loss = 0.5428
[I 2025-08-07 17:54:17,561] Trial 430 finished with value: 0.5428404986858368 and parameters: {'fp_type': 'morgan', 'morgan_only_radius': 2, 'morgan_only_nBits': 1024, 'num_hidden_layers': 3, 'hidden_dim_0': 512, 'hidden_dim_1': 128, 'hidden_dim_2': 512, 'kl_weight': 0.0035451326862959254, 'lr': 0.0020759615555523423, 'batch_size': 32, 'dropout_rate': 0.4282938333358574, 'prior_mu': -0.0006116092499790279, 'prior_sigma': 0.06135191211802321, 'normalization': 'none'}. Best is trial 272 with value: 0.5198344707489013.
Generating morgan fingerprints...
Generated fingerprints with 1024 features for 900 molecules
Data shape: X=(900, 1024), y=(900,)
Trial 432: 5-fold CV loss = 0.5338
[I 2025-08-07 17:54:59,198] Trial 432 finished with value: 0.5338178157806397 and parameters: {'fp_type': 'morgan', 'morgan_only_radius': 2, 'morgan_only_nBits': 1024, 'num_hidden_layers': 3, 'hidden_dim_0': 512, 'hidden_dim_1': 128, 'hidden_dim_2': 512, 'kl_weight': 0.0031209017891640086, 'lr': 0.0024395786063456195, 'batch_size': 32, 'dropout_rate': 0.47452048223475024, 'prior_mu': -0.01746583276081956, 'prior_sigma': 0.06401072440022239, 'normalization': 'none'}. Best is trial 272 with value: 0.5198344707489013.
Generating morgan fingerprints...
Generated fingerprints with 1024 features for 900 molecules
Data shape: X=(900, 1024), y=(900,)
Trial 436: 5-fold CV loss = 0.5754
[I 2025-08-07 17:55:59,755] Trial 436 finished with value: 0.5754329621791839 and parameters: {'fp_type': 'morgan', 'morgan_only_radius': 2, 'morgan_only_nBits': 1024, 'num_hidden_layers': 3, 'hidden_dim_0': 64, 'hidden_dim_1': 128, 'hidden_dim_2': 512, 'kl_weight': 0.004530365980182392, 'lr': 0.0024222187605594256, 'batch_size': 32, 'dropout_rate': 0.47756657454086443, 'prior_mu': -0.019346396283544433, 'prior_sigma': 0.0773570582889694, 'normalization': 'none'}. Best is trial 272 with value: 0.5198344707489013.
Generating morgan fingerprints...
Generated fingerprints with 1024 features for 900 molecules
Data shape: X=(900, 1024), y=(900,)
Trial 435: 5-fold CV loss = 0.5404
[I 2025-08-07 17:56:00,094] Trial 435 finished with value: 0.5404267847537995 and parameters: {'fp_type': 'morgan', 'morgan_only_radius': 2, 'morgan_only_nBits': 1024, 'num_hidden_layers': 3, 'hidden_dim_0': 64, 'hidden_dim_1': 128, 'hidden_dim_2': 512, 'kl_weight': 0.00379193190312172, 'lr': 0.002407130924446402, 'batch_size': 32, 'dropout_rate': 0.4766853187801828, 'prior_mu': -0.01737358574161559, 'prior_sigma': 0.06942873473870047, 'normalization': 'none'}. Best is trial 272 with value: 0.5198344707489013.
Generating morgan fingerprints...
Generated fingerprints with 1024 features for 900 molecules
Data shape: X=(900, 1024), y=(900,)
Trial 434: 5-fold CV loss = 0.5878
[I 2025-08-07 17:56:07,047] Trial 434 finished with value: 0.5877673149108886 and parameters: {'fp_type': 'morgan', 'morgan_only_radius': 2, 'morgan_only_nBits': 1024, 'num_hidden_layers': 3, 'hidden_dim_0': 64, 'hidden_dim_1': 128, 'hidden_dim_2': 512, 'kl_weight': 0.004819249249849888, 'lr': 0.002451624006764096, 'batch_size': 32, 'dropout_rate': 0.4772102071708825, 'prior_mu': -0.01919987756966453, 'prior_sigma': 0.07694725636936252, 'normalization': 'none'}. Best is trial 272 with value: 0.5198344707489013.
Generating morgan fingerprints...
Generated fingerprints with 1024 features for 900 molecules
Data shape: X=(900, 1024), y=(900,)
Trial 433: 5-fold CV loss = 1.5854
[I 2025-08-07 17:56:42,221] Trial 433 finished with value: 1.5854030966758728 and parameters: {'fp_type': 'morgan', 'morgan_only_radius': 2, 'morgan_only_nBits': 1024, 'num_hidden_layers': 3, 'hidden_dim_0': 512, 'hidden_dim_1': 128, 'hidden_dim_2': 512, 'kl_weight': 0.004702525563735541, 'lr': 0.0014425626477643841, 'batch_size': 32, 'dropout_rate': 0.42889371392658615, 'prior_mu': -0.01966509558900573, 'prior_sigma': 0.16577433545356388, 'normalization': 'none'}. Best is trial 272 with value: 0.5198344707489013.
Generating morgan fingerprints...
Generated fingerprints with 1024 features for 900 molecules
Data shape: X=(900, 1024), y=(900,)
Trial 438: 5-fold CV loss = 0.6947
[I 2025-08-07 17:57:09,988] Trial 438 finished with value: 0.6947331428527832 and parameters: {'fp_type': 'morgan', 'morgan_only_radius': 2, 'morgan_only_nBits': 1024, 'num_hidden_layers': 3, 'hidden_dim_0': 512, 'hidden_dim_1': 128, 'hidden_dim_2': 512, 'kl_weight': 0.005421005091809336, 'lr': 0.001474349701169287, 'batch_size': 32, 'dropout_rate': 0.48238615754045167, 'prior_mu': -0.024038460988342614, 'prior_sigma': 0.06920428878215072, 'normalization': 'none'}. Best is trial 272 with value: 0.5198344707489013.
Generating morgan fingerprints...
Generated fingerprints with 1024 features for 900 molecules
Data shape: X=(900, 1024), y=(900,)
Trial 437: 5-fold CV loss = 0.5228
[I 2025-08-07 17:57:44,200] Trial 437 finished with value: 0.5227799355983734 and parameters: {'fp_type': 'morgan', 'morgan_only_radius': 2, 'morgan_only_nBits': 1024, 'num_hidden_layers': 3, 'hidden_dim_0': 512, 'hidden_dim_1': 128, 'hidden_dim_2': 512, 'kl_weight': 0.0042862167804087765, 'lr': 0.0017348975026395552, 'batch_size': 32, 'dropout_rate': 0.4778948697284658, 'prior_mu': -0.01158604758552855, 'prior_sigma': 0.06904958020863627, 'normalization': 'none'}. Best is trial 272 with value: 0.5198344707489013.
Generating morgan fingerprints...
Generated fingerprints with 1024 features for 900 molecules
Data shape: X=(900, 1024), y=(900,)
Trial 441: 5-fold CV loss = 0.6040
[I 2025-08-07 17:58:20,317] Trial 441 finished with value: 0.6039695024490357 and parameters: {'fp_type': 'morgan', 'morgan_only_radius': 2, 'morgan_only_nBits': 1024, 'num_hidden_layers': 3, 'hidden_dim_0': 512, 'hidden_dim_1': 128, 'hidden_dim_2': 512, 'kl_weight': 0.0034691280247833773, 'lr': 0.0017163764898624643, 'batch_size': 32, 'dropout_rate': 0.4692353926758755, 'prior_mu': 0.0127012362058979, 'prior_sigma': 0.058040268914540755, 'normalization': 'none'}. Best is trial 272 with value: 0.5198344707489013.
Generating morgan fingerprints...
Generated fingerprints with 1024 features for 900 molecules
Data shape: X=(900, 1024), y=(900,)
Trial 439: 5-fold CV loss = 0.5750
[I 2025-08-07 17:58:30,157] Trial 439 finished with value: 0.5749622821807862 and parameters: {'fp_type': 'morgan', 'morgan_only_radius': 2, 'morgan_only_nBits': 1024, 'num_hidden_layers': 3, 'hidden_dim_0': 512, 'hidden_dim_1': 128, 'hidden_dim_2': 512, 'kl_weight': 0.011050667817906602, 'lr': 0.001711273256655385, 'batch_size': 32, 'dropout_rate': 0.48332151461287787, 'prior_mu': -0.02931380783397503, 'prior_sigma': 0.059600752808110134, 'normalization': 'none'}. Best is trial 272 with value: 0.5198344707489013.
Generating morgan fingerprints...
Generated fingerprints with 1024 features for 900 molecules
Data shape: X=(900, 1024), y=(900,)
Trial 442: 5-fold CV loss = 0.6597
[I 2025-08-07 17:58:44,674] Trial 442 finished with value: 0.6597154140472412 and parameters: {'fp_type': 'morgan', 'morgan_only_radius': 2, 'morgan_only_nBits': 1024, 'num_hidden_layers': 3, 'hidden_dim_0': 512, 'hidden_dim_1': 128, 'hidden_dim_2': 512, 'kl_weight': 0.0056843332800137, 'lr': 0.0016737066565316009, 'batch_size': 32, 'dropout_rate': 0.4513327180145049, 'prior_mu': 0.012759505896754647, 'prior_sigma': 0.07173947728294051, 'normalization': 'none'}. Best is trial 272 with value: 0.5198344707489013.
Generating morgan fingerprints...
Generated fingerprints with 1024 features for 900 molecules
Data shape: X=(900, 1024), y=(900,)
Trial 443: 5-fold CV loss = 0.6131
[I 2025-08-07 17:59:33,676] Trial 443 finished with value: 0.6130910515785217 and parameters: {'fp_type': 'morgan', 'morgan_only_radius': 2, 'morgan_only_nBits': 1024, 'num_hidden_layers': 3, 'hidden_dim_0': 512, 'hidden_dim_1': 128, 'hidden_dim_2': 512, 'kl_weight': 0.005415566382835842, 'lr': 0.0017261880269786375, 'batch_size': 32, 'dropout_rate': 0.45184683481254884, 'prior_mu': -0.01097988738730071, 'prior_sigma': 0.07074367194956954, 'normalization': 'none'}. Best is trial 272 with value: 0.5198344707489013.
Generating morgan fingerprints...
Generated fingerprints with 1024 features for 900 molecules
Data shape: X=(900, 1024), y=(900,)
Trial 445: 5-fold CV loss = 0.5336
[I 2025-08-07 17:59:45,466] Trial 445 finished with value: 0.5335557460784912 and parameters: {'fp_type': 'morgan', 'morgan_only_radius': 2, 'morgan_only_nBits': 1024, 'num_hidden_layers': 3, 'hidden_dim_0': 1024, 'hidden_dim_1': 128, 'hidden_dim_2': 512, 'kl_weight': 0.006558438306030066, 'lr': 0.002173214356570975, 'batch_size': 32, 'dropout_rate': 0.46492488178264063, 'prior_mu': -0.01141196321384749, 'prior_sigma': 0.06638429578713, 'normalization': 'none'}. Best is trial 272 with value: 0.5198344707489013.
Generating morgan fingerprints...
Generated fingerprints with 1024 features for 900 molecules
Data shape: X=(900, 1024), y=(900,)
Trial 446: 5-fold CV loss = 0.5972
[I 2025-08-07 18:00:41,574] Trial 446 finished with value: 0.5971552193164825 and parameters: {'fp_type': 'morgan', 'morgan_only_radius': 2, 'morgan_only_nBits': 1024, 'num_hidden_layers': 3, 'hidden_dim_0': 1024, 'hidden_dim_1': 128, 'hidden_dim_2': 512, 'kl_weight': 0.006862028096058349, 'lr': 0.0019250485053944292, 'batch_size': 32, 'dropout_rate': 0.46448340495004997, 'prior_mu': -0.010602042485447516, 'prior_sigma': 0.06633706540619431, 'normalization': 'none'}. Best is trial 272 with value: 0.5198344707489013.
Generating morgan fingerprints...
Generated fingerprints with 1024 features for 900 molecules
Data shape: X=(900, 1024), y=(900,)
Trial 444: 5-fold CV loss = 0.5351
[I 2025-08-07 18:01:10,606] Trial 444 finished with value: 0.5350884377956391 and parameters: {'fp_type': 'morgan', 'morgan_only_radius': 2, 'morgan_only_nBits': 1024, 'num_hidden_layers': 3, 'hidden_dim_0': 512, 'hidden_dim_1': 128, 'hidden_dim_2': 512, 'kl_weight': 0.00439699494882364, 'lr': 0.0022059327122706312, 'batch_size': 32, 'dropout_rate': 0.45637128901296886, 'prior_mu': -0.12410001683970692, 'prior_sigma': 0.06981572756949, 'normalization': 'none'}. Best is trial 272 with value: 0.5198344707489013.
Generating morgan fingerprints...
Generated fingerprints with 1024 features for 900 molecules
Data shape: X=(900, 1024), y=(900,)
Trial 447: 5-fold CV loss = 0.5293
[I 2025-08-07 18:01:30,168] Trial 447 finished with value: 0.5293176114559174 and parameters: {'fp_type': 'morgan', 'morgan_only_radius': 2, 'morgan_only_nBits': 1024, 'num_hidden_layers': 3, 'hidden_dim_0': 512, 'hidden_dim_1': 128, 'hidden_dim_2': 512, 'kl_weight': 0.003978660431133727, 'lr': 0.0019096959420228168, 'batch_size': 32, 'dropout_rate': 0.47019359226589885, 'prior_mu': -0.03505734632112689, 'prior_sigma': 0.0640714130239901, 'normalization': 'none'}. Best is trial 272 with value: 0.5198344707489013.
Generating morgan fingerprints...
Generated fingerprints with 1024 features for 900 molecules
Data shape: X=(900, 1024), y=(900,)
Trial 440: 5-fold CV loss = 0.5812
[I 2025-08-07 18:01:39,088] Trial 440 finished with value: 0.5812301456928253 and parameters: {'fp_type': 'morgan', 'morgan_only_radius': 2, 'morgan_only_nBits': 1024, 'num_hidden_layers': 3, 'hidden_dim_0': 512, 'hidden_dim_1': 128, 'hidden_dim_2': 512, 'kl_weight': 0.005430147364286573, 'lr': 0.0021653319584521683, 'batch_size': 32, 'dropout_rate': 0.4848857450196261, 'prior_mu': 0.010278885207418726, 'prior_sigma': 0.15606330785925182, 'normalization': 'none'}. Best is trial 272 with value: 0.5198344707489013.
Generating morgan fingerprints...
Generated fingerprints with 1024 features for 900 molecules
Data shape: X=(900, 1024), y=(900,)
Trial 450: 5-fold CV loss = 0.7843
[I 2025-08-07 18:02:10,651] Trial 450 finished with value: 0.7843031525611878 and parameters: {'fp_type': 'morgan', 'morgan_only_radius': 2, 'morgan_only_nBits': 1024, 'num_hidden_layers': 3, 'hidden_dim_0': 512, 'hidden_dim_1': 128, 'hidden_dim_2': 512, 'kl_weight': 0.004020060309053626, 'lr': 0.0001483698801847783, 'batch_size': 32, 'dropout_rate': 0.4830615423381573, 'prior_mu': -0.02952957090932819, 'prior_sigma': 0.07406204100007936, 'normalization': 'layer'}. Best is trial 272 with value: 0.5198344707489013.
Generating morgan fingerprints...
Generated fingerprints with 1024 features for 900 molecules
Data shape: X=(900, 1024), y=(900,)
Trial 448: 5-fold CV loss = 0.5273
[I 2025-08-07 18:02:14,149] Trial 448 finished with value: 0.52731152176857 and parameters: {'fp_type': 'morgan', 'morgan_only_radius': 2, 'morgan_only_nBits': 1024, 'num_hidden_layers': 3, 'hidden_dim_0': 512, 'hidden_dim_1': 128, 'hidden_dim_2': 512, 'kl_weight': 0.004196883963442588, 'lr': 0.002198307050302252, 'batch_size': 32, 'dropout_rate': 0.47428419472452304, 'prior_mu': 0.027983499647637716, 'prior_sigma': 0.06385885946513829, 'normalization': 'none'}. Best is trial 272 with value: 0.5198344707489013.
Generating morgan fingerprints...
Generated fingerprints with 1024 features for 900 molecules
Data shape: X=(900, 1024), y=(900,)
Trial 452: 5-fold CV loss = 0.5514
[I 2025-08-07 18:03:04,940] Trial 452 finished with value: 0.551362133026123 and parameters: {'fp_type': 'morgan', 'morgan_only_radius': 2, 'morgan_only_nBits': 1024, 'num_hidden_layers': 3, 'hidden_dim_0': 512, 'hidden_dim_1': 128, 'hidden_dim_2': 512, 'kl_weight': 0.002757358492937308, 'lr': 0.0025266466488902163, 'batch_size': 32, 'dropout_rate': 0.1725426348216825, 'prior_mu': -0.037638744181767124, 'prior_sigma': 0.06309990382384498, 'normalization': 'none'}. Best is trial 272 with value: 0.5198344707489013.
Generating morgan fingerprints...
Generated fingerprints with 1024 features for 900 molecules
Data shape: X=(900, 1024), y=(900,)
Trial 453: 5-fold CV loss = 0.6917
[I 2025-08-07 18:03:15,562] Trial 453 finished with value: 0.6917167067527771 and parameters: {'fp_type': 'morgan', 'morgan_only_radius': 2, 'morgan_only_nBits': 1024, 'num_hidden_layers': 3, 'hidden_dim_0': 512, 'hidden_dim_1': 128, 'hidden_dim_2': 512, 'kl_weight': 0.0042732323997052525, 'lr': 0.0015639337141064435, 'batch_size': 32, 'dropout_rate': 0.47403461610523434, 'prior_mu': 0.0010771766088290982, 'prior_sigma': 0.06440460477647761, 'normalization': 'none'}. Best is trial 272 with value: 0.5198344707489013.
Generating morgan fingerprints...
Generated fingerprints with 1024 features for 900 molecules
Data shape: X=(900, 1024), y=(900,)
Trial 449: 5-fold CV loss = 0.5288
[I 2025-08-07 18:04:09,044] Trial 449 finished with value: 0.5288186490535736 and parameters: {'fp_type': 'morgan', 'morgan_only_radius': 2, 'morgan_only_nBits': 1024, 'num_hidden_layers': 3, 'hidden_dim_0': 512, 'hidden_dim_1': 128, 'hidden_dim_2': 512, 'kl_weight': 0.003857691693624912, 'lr': 0.0018894462299264088, 'batch_size': 32, 'dropout_rate': 0.47534423449908453, 'prior_mu': -0.03598446951776111, 'prior_sigma': 0.06384070809126653, 'normalization': 'none'}. Best is trial 272 with value: 0.5198344707489013.
Generating morgan fingerprints...
Generated fingerprints with 1024 features for 900 molecules
Data shape: X=(900, 1024), y=(900,)
Trial 451: 5-fold CV loss = 0.5751
[I 2025-08-07 18:04:20,343] Trial 451 finished with value: 0.5751056373119354 and parameters: {'fp_type': 'morgan', 'morgan_only_radius': 2, 'morgan_only_nBits': 1024, 'num_hidden_layers': 3, 'hidden_dim_0': 512, 'hidden_dim_1': 128, 'hidden_dim_2': 512, 'kl_weight': 0.004150587842400627, 'lr': 0.0025151146405068344, 'batch_size': 32, 'dropout_rate': 0.47817618209209467, 'prior_mu': -0.036912911209117376, 'prior_sigma': 0.07454404905191764, 'normalization': 'layer'}. Best is trial 272 with value: 0.5198344707489013.
Generating morgan fingerprints...
Generated fingerprints with 1024 features for 900 molecules
Data shape: X=(900, 1024), y=(900,)
Trial 454: 5-fold CV loss = 0.5530
[I 2025-08-07 18:04:31,280] Trial 454 finished with value: 0.5529807209968567 and parameters: {'fp_type': 'morgan', 'morgan_only_radius': 2, 'morgan_only_nBits': 1024, 'num_hidden_layers': 3, 'hidden_dim_0': 512, 'hidden_dim_1': 128, 'hidden_dim_2': 512, 'kl_weight': 0.004503391613359823, 'lr': 0.001559096864826756, 'batch_size': 32, 'dropout_rate': 0.47367607669587275, 'prior_mu': 0.04875758964848027, 'prior_sigma': 0.06839508433346064, 'normalization': 'none'}. Best is trial 272 with value: 0.5198344707489013.
Generating morgan fingerprints...
Generated fingerprints with 1024 features for 900 molecules
Data shape: X=(900, 1024), y=(900,)
Trial 455: 5-fold CV loss = 0.5290
[I 2025-08-07 18:04:36,455] Trial 455 finished with value: 0.528984546661377 and parameters: {'fp_type': 'morgan', 'morgan_only_radius': 2, 'morgan_only_nBits': 1024, 'num_hidden_layers': 3, 'hidden_dim_0': 512, 'hidden_dim_1': 128, 'hidden_dim_2': 512, 'kl_weight': 0.003549996442531921, 'lr': 0.002198946937126124, 'batch_size': 32, 'dropout_rate': 0.48954197628023965, 'prior_mu': 0.01789556289832775, 'prior_sigma': 0.06828591943745739, 'normalization': 'none'}. Best is trial 272 with value: 0.5198344707489013.
Generating morgan fingerprints...
Generated fingerprints with 1024 features for 900 molecules
Data shape: X=(900, 1024), y=(900,)
Trial 458: 5-fold CV loss = 0.9815
[I 2025-08-07 18:05:08,460] Trial 458 finished with value: 0.9814925074577332 and parameters: {'fp_type': 'morgan', 'morgan_only_radius': 2, 'morgan_only_nBits': 1024, 'num_hidden_layers': 3, 'hidden_dim_0': 512, 'hidden_dim_1': 512, 'hidden_dim_2': 512, 'kl_weight': 0.0032744814326193684, 'lr': 0.0018110238513250165, 'batch_size': 32, 'dropout_rate': 0.48915643319558094, 'prior_mu': -0.026080536346925236, 'prior_sigma': 0.06753635872804382, 'normalization': 'none'}. Best is trial 272 with value: 0.5198344707489013.
Generating morgan fingerprints...
Generated fingerprints with 1024 features for 900 molecules
Data shape: X=(900, 1024), y=(900,)
Trial 459: 5-fold CV loss = 0.5932
[I 2025-08-07 18:05:55,079] Trial 459 finished with value: 0.5931872427463531 and parameters: {'fp_type': 'morgan', 'morgan_only_radius': 2, 'morgan_only_nBits': 1024, 'num_hidden_layers': 3, 'hidden_dim_0': 512, 'hidden_dim_1': 128, 'hidden_dim_2': 512, 'kl_weight': 0.003393055476307288, 'lr': 0.0018573422009665358, 'batch_size': 32, 'dropout_rate': 0.46415080554082316, 'prior_mu': -0.02724481320493281, 'prior_sigma': 0.0795243655429295, 'normalization': 'none'}. Best is trial 272 with value: 0.5198344707489013.
Generating morgan fingerprints...
Generated fingerprints with 1024 features for 900 molecules
Data shape: X=(900, 1024), y=(900,)
Trial 460: 5-fold CV loss = 0.5339
[I 2025-08-07 18:06:28,437] Trial 460 finished with value: 0.533894944190979 and parameters: {'fp_type': 'morgan', 'morgan_only_radius': 2, 'morgan_only_nBits': 1024, 'num_hidden_layers': 3, 'hidden_dim_0': 512, 'hidden_dim_1': 128, 'hidden_dim_2': 512, 'kl_weight': 0.005100633799762622, 'lr': 0.0019673427243213533, 'batch_size': 32, 'dropout_rate': 0.46056568703487877, 'prior_mu': 0.005734882824091838, 'prior_sigma': 0.07824085182744529, 'normalization': 'none'}. Best is trial 272 with value: 0.5198344707489013.
Generating morgan fingerprints...
Generated fingerprints with 1024 features for 900 molecules
Data shape: X=(900, 1024), y=(900,)
Trial 456: 5-fold CV loss = 0.5441
[I 2025-08-07 18:06:50,125] Trial 456 finished with value: 0.5441252171993256 and parameters: {'fp_type': 'morgan', 'morgan_only_radius': 2, 'morgan_only_nBits': 1024, 'num_hidden_layers': 3, 'hidden_dim_0': 512, 'hidden_dim_1': 128, 'hidden_dim_2': 512, 'kl_weight': 0.0034691730191791716, 'lr': 0.0018571284933341684, 'batch_size': 32, 'dropout_rate': 0.4678677708478556, 'prior_mu': -0.024498030250317947, 'prior_sigma': 0.06824812927097336, 'normalization': 'none'}. Best is trial 272 with value: 0.5198344707489013.
Generating morgan fingerprints...
Generated fingerprints with 1024 features for 900 molecules
Data shape: X=(900, 1024), y=(900,)
Trial 462: 5-fold CV loss = 0.5611
[I 2025-08-07 18:07:13,233] Trial 462 finished with value: 0.5611129701137543 and parameters: {'fp_type': 'morgan', 'morgan_only_radius': 2, 'morgan_only_nBits': 1024, 'num_hidden_layers': 3, 'hidden_dim_0': 512, 'hidden_dim_1': 128, 'hidden_dim_2': 512, 'kl_weight': 0.0027408204232048307, 'lr': 0.002017119569244605, 'batch_size': 32, 'dropout_rate': 0.4890683782529198, 'prior_mu': -0.011767861298918656, 'prior_sigma': 0.020372865383907174, 'normalization': 'none'}. Best is trial 272 with value: 0.5198344707489013.
Generating morgan fingerprints...
Generated fingerprints with 1024 features for 900 molecules
Data shape: X=(900, 1024), y=(900,)
Trial 461: 5-fold CV loss = 0.5368
[I 2025-08-07 18:07:29,086] Trial 461 finished with value: 0.5367786586284637 and parameters: {'fp_type': 'morgan', 'morgan_only_radius': 2, 'morgan_only_nBits': 1024, 'num_hidden_layers': 3, 'hidden_dim_0': 512, 'hidden_dim_1': 128, 'hidden_dim_2': 512, 'kl_weight': 0.005098968420354534, 'lr': 0.002016195259878643, 'batch_size': 32, 'dropout_rate': 0.4584845298405945, 'prior_mu': -0.005872615339537229, 'prior_sigma': 0.06390708202635141, 'normalization': 'none'}. Best is trial 272 with value: 0.5198344707489013.
Generating morgan fingerprints...
Generated fingerprints with 1024 features for 900 molecules
Data shape: X=(900, 1024), y=(900,)
Trial 457: 5-fold CV loss = 0.6436
