[I 2025-08-08 01:12:34,521] Trial 1603 finished with value: 0.530607134103775 and parameters: {'fp_type': 'morgan', 'morgan_only_radius': 2, 'morgan_only_nBits': 2048, 'num_hidden_layers': 3, 'hidden_dim_0': 512, 'hidden_dim_1': 128, 'hidden_dim_2': 512, 'kl_weight': 0.0004552308236082473, 'lr': 0.002141862361978418, 'batch_size': 32, 'dropout_rate': 0.441360604435574, 'prior_mu': 0.04097143476637627, 'prior_sigma': 0.04970681146639484, 'normalization': 'none'}. Best is trial 1528 with value: 0.5170644640922546.
Generating morgan fingerprints...
Generated fingerprints with 2048 features for 900 molecules
Data shape: X=(900, 2048), y=(900,)
Trial 1606: 5-fold CV loss = 0.5342
[I 2025-08-08 01:13:11,113] Trial 1606 finished with value: 0.5341988265514374 and parameters: {'fp_type': 'morgan', 'morgan_only_radius': 2, 'morgan_only_nBits': 2048, 'num_hidden_layers': 3, 'hidden_dim_0': 512, 'hidden_dim_1': 128, 'hidden_dim_2': 512, 'kl_weight': 0.0005748548104763686, 'lr': 0.0021918281952469257, 'batch_size': 32, 'dropout_rate': 0.4288507018517069, 'prior_mu': 0.08497797007365455, 'prior_sigma': 0.04838987926554156, 'normalization': 'none'}. Best is trial 1528 with value: 0.5170644640922546.
Generating morgan fingerprints...
Generated fingerprints with 2048 features for 900 molecules
Data shape: X=(900, 2048), y=(900,)
Trial 1605: 5-fold CV loss = 0.5287
[I 2025-08-08 01:13:25,656] Trial 1605 finished with value: 0.5287217259407043 and parameters: {'fp_type': 'morgan', 'morgan_only_radius': 2, 'morgan_only_nBits': 2048, 'num_hidden_layers': 3, 'hidden_dim_0': 512, 'hidden_dim_1': 128, 'hidden_dim_2': 512, 'kl_weight': 0.0004672942355680273, 'lr': 0.0026087493520369183, 'batch_size': 32, 'dropout_rate': 0.4253971877633499, 'prior_mu': 0.08313233413510913, 'prior_sigma': 0.06160110213635926, 'normalization': 'none'}. Best is trial 1528 with value: 0.5170644640922546.
Generating morgan fingerprints...
Generated fingerprints with 2048 features for 900 molecules
Data shape: X=(900, 2048), y=(900,)
Trial 1607: 5-fold CV loss = 0.5294
[I 2025-08-08 01:13:56,986] Trial 1607 finished with value: 0.5293525815010071 and parameters: {'fp_type': 'morgan', 'morgan_only_radius': 2, 'morgan_only_nBits': 2048, 'num_hidden_layers': 3, 'hidden_dim_0': 512, 'hidden_dim_1': 128, 'hidden_dim_2': 256, 'kl_weight': 0.0005436419036713193, 'lr': 0.002666139521952159, 'batch_size': 32, 'dropout_rate': 0.42634104246683363, 'prior_mu': 0.07547114043231931, 'prior_sigma': 0.06162923119395762, 'normalization': 'none'}. Best is trial 1528 with value: 0.5170644640922546.
Generating morgan fingerprints...
Generated fingerprints with 2048 features for 900 molecules
Data shape: X=(900, 2048), y=(900,)
Trial 1604: 5-fold CV loss = 1.2004
[I 2025-08-08 01:14:06,435] Trial 1604 finished with value: 1.2004018902778626 and parameters: {'fp_type': 'morgan', 'morgan_only_radius': 2, 'morgan_only_nBits': 2048, 'num_hidden_layers': 3, 'hidden_dim_0': 512, 'hidden_dim_1': 128, 'hidden_dim_2': 256, 'kl_weight': 0.0005399580051855303, 'lr': 0.001983882447239338, 'batch_size': 32, 'dropout_rate': 0.422119872382094, 'prior_mu': 0.043918536339458, 'prior_sigma': 0.11972999975240994, 'normalization': 'none'}. Best is trial 1528 with value: 0.5170644640922546.
Generating morgan fingerprints...
Generated fingerprints with 2048 features for 900 molecules
Data shape: X=(900, 2048), y=(900,)
Trial 1608: 5-fold CV loss = 0.5325
[I 2025-08-08 01:14:08,842] Trial 1608 finished with value: 0.5325430274009705 and parameters: {'fp_type': 'morgan', 'morgan_only_radius': 2, 'morgan_only_nBits': 2048, 'num_hidden_layers': 3, 'hidden_dim_0': 512, 'hidden_dim_1': 128, 'hidden_dim_2': 512, 'kl_weight': 0.0005482678218870467, 'lr': 0.00268051942754679, 'batch_size': 32, 'dropout_rate': 0.42181497312986815, 'prior_mu': 0.07484336484550158, 'prior_sigma': 0.06313031502885612, 'normalization': 'none'}. Best is trial 1528 with value: 0.5170644640922546.
Generating morgan fingerprints...
Generated fingerprints with 2048 features for 900 molecules
Data shape: X=(900, 2048), y=(900,)
Trial 1610: 5-fold CV loss = 0.5357
[I 2025-08-08 01:14:55,817] Trial 1610 finished with value: 0.5356894731521606 and parameters: {'fp_type': 'morgan', 'morgan_only_radius': 2, 'morgan_only_nBits': 2048, 'num_hidden_layers': 3, 'hidden_dim_0': 512, 'hidden_dim_1': 128, 'hidden_dim_2': 512, 'kl_weight': 0.0010562027161051311, 'lr': 0.0019720168820129657, 'batch_size': 32, 'dropout_rate': 0.4584664062449404, 'prior_mu': 0.04669085157922177, 'prior_sigma': 0.053918338284449176, 'normalization': 'layer'}. Best is trial 1528 with value: 0.5170644640922546.
Generating morgan fingerprints...
Generated fingerprints with 2048 features for 900 molecules
Data shape: X=(900, 2048), y=(900,)
Trial 1612: 5-fold CV loss = 0.5390
[I 2025-08-08 01:14:57,051] Trial 1612 finished with value: 0.5390032589435577 and parameters: {'fp_type': 'morgan', 'morgan_only_radius': 2, 'morgan_only_nBits': 2048, 'num_hidden_layers': 3, 'hidden_dim_0': 512, 'hidden_dim_1': 128, 'hidden_dim_2': 512, 'kl_weight': 0.0006432070027014544, 'lr': 0.0023801994893548834, 'batch_size': 32, 'dropout_rate': 0.45898560688380197, 'prior_mu': 0.04982400067966578, 'prior_sigma': 0.05336964434537353, 'normalization': 'layer'}. Best is trial 1528 with value: 0.5170644640922546.
Generating morgan fingerprints...
Generated fingerprints with 2048 features for 900 molecules
Data shape: X=(900, 2048), y=(900,)
Trial 1609: 5-fold CV loss = 0.5285
[I 2025-08-08 01:15:07,818] Trial 1609 finished with value: 0.5284538030624389 and parameters: {'fp_type': 'morgan', 'morgan_only_radius': 2, 'morgan_only_nBits': 2048, 'num_hidden_layers': 3, 'hidden_dim_0': 512, 'hidden_dim_1': 128, 'hidden_dim_2': 512, 'kl_weight': 0.0005345726104394676, 'lr': 0.002647068978885607, 'batch_size': 32, 'dropout_rate': 0.45430313022100305, 'prior_mu': 0.04785742615655973, 'prior_sigma': 0.05356827203779131, 'normalization': 'none'}. Best is trial 1528 with value: 0.5170644640922546.
Generating morgan fingerprints...
Generated fingerprints with 2048 features for 900 molecules
Data shape: X=(900, 2048), y=(900,)
Trial 1614: 5-fold CV loss = 0.5213
[I 2025-08-08 01:16:01,077] Trial 1614 finished with value: 0.5213291347026825 and parameters: {'fp_type': 'morgan', 'morgan_only_radius': 2, 'morgan_only_nBits': 2048, 'num_hidden_layers': 3, 'hidden_dim_0': 512, 'hidden_dim_1': 128, 'hidden_dim_2': 512, 'kl_weight': 0.0007021964774136832, 'lr': 0.002312848756888917, 'batch_size': 32, 'dropout_rate': 0.4386124290589851, 'prior_mu': 0.026546694452854337, 'prior_sigma': 0.06610886947140193, 'normalization': 'none'}. Best is trial 1528 with value: 0.5170644640922546.
Generating morgan fingerprints...
Generated fingerprints with 2048 features for 900 molecules
Data shape: X=(900, 2048), y=(900,)
Trial 1613: 5-fold CV loss = 0.5256
[I 2025-08-08 01:16:19,625] Trial 1613 finished with value: 0.5255622565746307 and parameters: {'fp_type': 'morgan', 'morgan_only_radius': 2, 'morgan_only_nBits': 2048, 'num_hidden_layers': 3, 'hidden_dim_0': 512, 'hidden_dim_1': 128, 'hidden_dim_2': 512, 'kl_weight': 0.0006562697075417787, 'lr': 0.0023333176100714037, 'batch_size': 32, 'dropout_rate': 0.45796653534750914, 'prior_mu': 0.01978798649443181, 'prior_sigma': 0.06604000246840488, 'normalization': 'none'}. Best is trial 1528 with value: 0.5170644640922546.
Generating morgan fingerprints...
Generated fingerprints with 2048 features for 900 molecules
Data shape: X=(900, 2048), y=(900,)
Trial 1615: 5-fold CV loss = 0.5255
[I 2025-08-08 01:16:56,982] Trial 1615 finished with value: 0.5254626214504242 and parameters: {'fp_type': 'morgan', 'morgan_only_radius': 2, 'morgan_only_nBits': 2048, 'num_hidden_layers': 3, 'hidden_dim_0': 512, 'hidden_dim_1': 128, 'hidden_dim_2': 512, 'kl_weight': 0.0007019284900260084, 'lr': 0.0022673410558519663, 'batch_size': 32, 'dropout_rate': 0.44009939342712023, 'prior_mu': 0.019479532423584696, 'prior_sigma': 0.06565970703074028, 'normalization': 'none'}. Best is trial 1528 with value: 0.5170644640922546.
Generating morgan fingerprints...
Generated fingerprints with 2048 features for 900 molecules
Data shape: X=(900, 2048), y=(900,)
Trial 1616: 5-fold CV loss = 0.5229
[I 2025-08-08 01:17:14,165] Trial 1616 finished with value: 0.5228894948959351 and parameters: {'fp_type': 'morgan', 'morgan_only_radius': 2, 'morgan_only_nBits': 2048, 'num_hidden_layers': 3, 'hidden_dim_0': 512, 'hidden_dim_1': 128, 'hidden_dim_2': 512, 'kl_weight': 0.0006536945363799188, 'lr': 0.0021660657795103833, 'batch_size': 32, 'dropout_rate': 0.406666170982528, 'prior_mu': 0.019588397316314572, 'prior_sigma': 0.0637732808243363, 'normalization': 'none'}. Best is trial 1528 with value: 0.5170644640922546.
Generating morgan fingerprints...
Generated fingerprints with 2048 features for 900 molecules
Data shape: X=(900, 2048), y=(900,)
Trial 1619: 5-fold CV loss = 0.7128
[I 2025-08-08 01:17:23,779] Trial 1619 finished with value: 0.712802529335022 and parameters: {'fp_type': 'morgan', 'morgan_only_radius': 2, 'morgan_only_nBits': 2048, 'num_hidden_layers': 3, 'hidden_dim_0': 512, 'hidden_dim_1': 512, 'hidden_dim_2': 512, 'kl_weight': 0.0007915857176794174, 'lr': 0.001975726755974518, 'batch_size': 128, 'dropout_rate': 0.42925077913921433, 'prior_mu': 0.03413586281375859, 'prior_sigma': 0.056338653709433, 'normalization': 'none'}. Best is trial 1528 with value: 0.5170644640922546.
Generating morgan fingerprints...
Generated fingerprints with 2048 features for 900 molecules
Data shape: X=(900, 2048), y=(900,)
Trial 1618: 5-fold CV loss = 1.6068
[I 2025-08-08 01:17:47,982] Trial 1618 finished with value: 1.6068420648574828 and parameters: {'fp_type': 'morgan', 'morgan_only_radius': 2, 'morgan_only_nBits': 2048, 'num_hidden_layers': 3, 'hidden_dim_0': 512, 'hidden_dim_1': 512, 'hidden_dim_2': 512, 'kl_weight': 0.0007161608634277516, 'lr': 0.001963256614493843, 'batch_size': 32, 'dropout_rate': 0.4116052336373108, 'prior_mu': 0.026234954201056933, 'prior_sigma': 0.1118928624122402, 'normalization': 'none'}. Best is trial 1528 with value: 0.5170644640922546.
Generating morgan fingerprints...
Generated fingerprints with 2048 features for 900 molecules
Data shape: X=(900, 2048), y=(900,)
Trial 1617: 5-fold CV loss = 0.5492
[I 2025-08-08 01:17:56,553] Trial 1617 finished with value: 0.5492099463939667 and parameters: {'fp_type': 'morgan', 'morgan_only_radius': 2, 'morgan_only_nBits': 2048, 'num_hidden_layers': 3, 'hidden_dim_0': 512, 'hidden_dim_1': 128, 'hidden_dim_2': 512, 'kl_weight': 0.0007076688661734914, 'lr': 0.0019714074874275784, 'batch_size': 32, 'dropout_rate': 0.4333373113828023, 'prior_mu': 0.02681499993971559, 'prior_sigma': 0.061187883661202834, 'normalization': 'none'}. Best is trial 1528 with value: 0.5170644640922546.
Generating morgan fingerprints...
Generated fingerprints with 2048 features for 900 molecules
Data shape: X=(900, 2048), y=(900,)
Trial 1611: 5-fold CV loss = 0.5394
[I 2025-08-08 01:18:09,502] Trial 1611 finished with value: 0.5393959522247315 and parameters: {'fp_type': 'morgan', 'morgan_only_radius': 2, 'morgan_only_nBits': 2048, 'num_hidden_layers': 3, 'hidden_dim_0': 512, 'hidden_dim_1': 128, 'hidden_dim_2': 512, 'kl_weight': 0.0006637163053926174, 'lr': 0.0009189225774054846, 'batch_size': 32, 'dropout_rate': 0.45776816007661775, 'prior_mu': 0.020419459984995003, 'prior_sigma': 0.05301419472352743, 'normalization': 'layer'}. Best is trial 1528 with value: 0.5170644640922546.
Generating morgan fingerprints...
Generated fingerprints with 2048 features for 900 molecules
Data shape: X=(900, 2048), y=(900,)
Trial 1620: 5-fold CV loss = 0.5483
[I 2025-08-08 01:18:38,189] Trial 1620 finished with value: 0.5483052253723144 and parameters: {'fp_type': 'morgan', 'morgan_only_radius': 2, 'morgan_only_nBits': 2048, 'num_hidden_layers': 3, 'hidden_dim_0': 512, 'hidden_dim_1': 128, 'hidden_dim_2': 512, 'kl_weight': 0.0006201370152784117, 'lr': 0.0019317968984136715, 'batch_size': 32, 'dropout_rate': 0.43241172137724876, 'prior_mu': 0.027906968400204943, 'prior_sigma': 0.0601767803616596, 'normalization': 'none'}. Best is trial 1528 with value: 0.5170644640922546.
Generating morgan fingerprints...
Generated fingerprints with 2048 features for 900 molecules
Data shape: X=(900, 2048), y=(900,)
Trial 1624: 5-fold CV loss = 0.6955
[I 2025-08-08 01:18:58,157] Trial 1624 finished with value: 0.6954592108726502 and parameters: {'fp_type': 'morgan', 'morgan_only_radius': 2, 'morgan_only_nBits': 2048, 'num_hidden_layers': 3, 'hidden_dim_0': 512, 'hidden_dim_1': 128, 'hidden_dim_2': 512, 'kl_weight': 0.0007800489047049966, 'lr': 0.0021773750844694163, 'batch_size': 64, 'dropout_rate': 0.44111833952473134, 'prior_mu': 0.03167961640906315, 'prior_sigma': 0.05803505487784915, 'normalization': 'none'}. Best is trial 1528 with value: 0.5170644640922546.
Generating morgan fingerprints...
Generated fingerprints with 2048 features for 900 molecules
Data shape: X=(900, 2048), y=(900,)
Trial 1622: 5-fold CV loss = 0.5222
[I 2025-08-08 01:19:27,985] Trial 1622 finished with value: 0.5222294390201568 and parameters: {'fp_type': 'morgan', 'morgan_only_radius': 2, 'morgan_only_nBits': 2048, 'num_hidden_layers': 3, 'hidden_dim_0': 512, 'hidden_dim_1': 128, 'hidden_dim_2': 512, 'kl_weight': 0.0006152412681223446, 'lr': 0.0021486617764718808, 'batch_size': 32, 'dropout_rate': 0.4396145016657358, 'prior_mu': 0.029926499188537528, 'prior_sigma': 0.05778706718352091, 'normalization': 'none'}. Best is trial 1528 with value: 0.5170644640922546.
Generating morgan fingerprints...
Generated fingerprints with 2048 features for 900 molecules
Data shape: X=(900, 2048), y=(900,)
Trial 1621: 5-fold CV loss = 0.5422
[I 2025-08-08 01:20:05,790] Trial 1621 finished with value: 0.5421625256538392 and parameters: {'fp_type': 'morgan', 'morgan_only_radius': 2, 'morgan_only_nBits': 2048, 'num_hidden_layers': 3, 'hidden_dim_0': 512, 'hidden_dim_1': 128, 'hidden_dim_2': 512, 'kl_weight': 0.0006122728206198803, 'lr': 0.0020512498247842598, 'batch_size': 32, 'dropout_rate': 0.4362612746302827, 'prior_mu': 0.031854133074519994, 'prior_sigma': 0.05992214698732584, 'normalization': 'none'}. Best is trial 1528 with value: 0.5170644640922546.
Generating rdkit fingerprints...
Generated fingerprints with 512 features for 900 molecules
Data shape: X=(900, 512), y=(900,)
Trial 1625: 5-fold CV loss = 0.5204
[I 2025-08-08 01:20:21,346] Trial 1625 finished with value: 0.5203683614730835 and parameters: {'fp_type': 'morgan', 'morgan_only_radius': 2, 'morgan_only_nBits': 2048, 'num_hidden_layers': 3, 'hidden_dim_0': 512, 'hidden_dim_1': 128, 'hidden_dim_2': 512, 'kl_weight': 0.0008742016731339881, 'lr': 0.002090710865045809, 'batch_size': 32, 'dropout_rate': 0.43519196672638655, 'prior_mu': 0.030768239286208896, 'prior_sigma': 0.0657645229955903, 'normalization': 'none'}. Best is trial 1528 with value: 0.5170644640922546.
Generating morgan fingerprints...
Generated fingerprints with 2048 features for 900 molecules
Data shape: X=(900, 2048), y=(900,)
Trial 1626: 5-fold CV loss = 0.5342
[I 2025-08-08 01:20:41,693] Trial 1626 finished with value: 0.5342376112937928 and parameters: {'fp_type': 'morgan', 'morgan_only_radius': 2, 'morgan_only_nBits': 2048, 'num_hidden_layers': 3, 'hidden_dim_0': 512, 'hidden_dim_1': 128, 'hidden_dim_2': 512, 'kl_weight': 0.0005785567736289608, 'lr': 0.0024178968457370356, 'batch_size': 32, 'dropout_rate': 0.4269448084655886, 'prior_mu': 0.02850864510266388, 'prior_sigma': 0.042683377484177616, 'normalization': 'none'}. Best is trial 1528 with value: 0.5170644640922546.
Generating rdkit fingerprints...
Generated fingerprints with 512 features for 900 molecules
Data shape: X=(900, 512), y=(900,)
Trial 1628: 5-fold CV loss = 0.5255
[I 2025-08-08 01:21:25,351] Trial 1628 finished with value: 0.5254934966564179 and parameters: {'fp_type': 'morgan', 'morgan_only_radius': 2, 'morgan_only_nBits': 2048, 'num_hidden_layers': 3, 'hidden_dim_0': 512, 'hidden_dim_1': 128, 'hidden_dim_2': 512, 'kl_weight': 0.0006132063423191357, 'lr': 0.0024596599204696756, 'batch_size': 32, 'dropout_rate': 0.42903334709269975, 'prior_mu': 0.034655350020589, 'prior_sigma': 0.06653675840707135, 'normalization': 'none'}. Best is trial 1528 with value: 0.5170644640922546.
Generating rdkit fingerprints...
Generated fingerprints with 512 features for 900 molecules
Data shape: X=(900, 512), y=(900,)
Trial 1629: 5-fold CV loss = 0.6037
[I 2025-08-08 01:21:27,164] Trial 1629 finished with value: 0.6036767482757568 and parameters: {'fp_type': 'rdkit', 'rdkit_only_maxPath': 6, 'rdkit_only_nBits': 512, 'num_hidden_layers': 3, 'hidden_dim_0': 512, 'hidden_dim_1': 128, 'hidden_dim_2': 512, 'kl_weight': 0.0007908712681899762, 'lr': 0.0023553405280194685, 'batch_size': 32, 'dropout_rate': 0.4297969795045325, 'prior_mu': 0.03560955631001542, 'prior_sigma': 0.046831507967317935, 'normalization': 'none'}. Best is trial 1528 with value: 0.5170644640922546.
Generating morgan fingerprints...
Generated fingerprints with 2048 features for 900 molecules
Data shape: X=(900, 2048), y=(900,)
Trial 1627: 5-fold CV loss = 0.5873
[I 2025-08-08 01:21:28,322] Trial 1627 finished with value: 0.5872726082801819 and parameters: {'fp_type': 'rdkit', 'rdkit_only_maxPath': 6, 'rdkit_only_nBits': 512, 'num_hidden_layers': 3, 'hidden_dim_0': 512, 'hidden_dim_1': 128, 'hidden_dim_2': 512, 'kl_weight': 0.0005142231152250941, 'lr': 0.0024002276885339, 'batch_size': 32, 'dropout_rate': 0.418881405677687, 'prior_mu': 0.021327990516569847, 'prior_sigma': 0.040735217868367105, 'normalization': 'none'}. Best is trial 1528 with value: 0.5170644640922546.
Generating morgan fingerprints...
Generated fingerprints with 2048 features for 900 molecules
Data shape: X=(900, 2048), y=(900,)
Trial 1623: 5-fold CV loss = 0.5306
[I 2025-08-08 01:21:47,445] Trial 1623 finished with value: 0.5305996716022492 and parameters: {'fp_type': 'morgan', 'morgan_only_radius': 2, 'morgan_only_nBits': 2048, 'num_hidden_layers': 3, 'hidden_dim_0': 512, 'hidden_dim_1': 128, 'hidden_dim_2': 512, 'kl_weight': 0.0006002876463079775, 'lr': 0.002167500011942705, 'batch_size': 32, 'dropout_rate': 0.43644031455082066, 'prior_mu': 0.033186118233434106, 'prior_sigma': 0.05854101816259953, 'normalization': 'none'}. Best is trial 1528 with value: 0.5170644640922546.
Generating morgan fingerprints...
Generated fingerprints with 2048 features for 900 molecules
Data shape: X=(900, 2048), y=(900,)
Trial 1630: 5-fold CV loss = 0.5726
[I 2025-08-08 01:22:10,496] Trial 1630 finished with value: 0.5726092278957366 and parameters: {'fp_type': 'rdkit', 'rdkit_only_maxPath': 6, 'rdkit_only_nBits': 512, 'num_hidden_layers': 1, 'hidden_dim_0': 512, 'kl_weight': 0.0008530371791024451, 'lr': 0.0022507721412406345, 'batch_size': 32, 'dropout_rate': 0.4205210885886239, 'prior_mu': 0.03933253672585113, 'prior_sigma': 0.048124649424610734, 'normalization': 'none'}. Best is trial 1528 with value: 0.5170644640922546.
Generating morgan fingerprints...
Generated fingerprints with 2048 features for 900 molecules
Data shape: X=(900, 2048), y=(900,)
Trial 1634: 5-fold CV loss = 0.5352
[I 2025-08-08 01:23:05,308] Trial 1634 finished with value: 0.5352176427841187 and parameters: {'fp_type': 'morgan', 'morgan_only_radius': 2, 'morgan_only_nBits': 2048, 'num_hidden_layers': 3, 'hidden_dim_0': 512, 'hidden_dim_1': 128, 'hidden_dim_2': 512, 'kl_weight': 0.0007883574811661543, 'lr': 0.002247439550971509, 'batch_size': 32, 'dropout_rate': 0.39794852558992927, 'prior_mu': 0.019900453778244374, 'prior_sigma': 0.05120568727116156, 'normalization': 'none'}. Best is trial 1528 with value: 0.5170644640922546.
Generating morgan fingerprints...
Generated fingerprints with 2048 features for 900 molecules
Data shape: X=(900, 2048), y=(900,)
Trial 1631: 5-fold CV loss = 0.5336
[I 2025-08-08 01:23:07,497] Trial 1631 finished with value: 0.5336183845996857 and parameters: {'fp_type': 'morgan', 'morgan_only_radius': 2, 'morgan_only_nBits': 2048, 'num_hidden_layers': 3, 'hidden_dim_0': 512, 'hidden_dim_1': 128, 'hidden_dim_2': 512, 'kl_weight': 0.0006981968178019713, 'lr': 0.002178485844978973, 'batch_size': 32, 'dropout_rate': 0.41294345305931324, 'prior_mu': 0.022050874843846303, 'prior_sigma': 0.05133890897948981, 'normalization': 'none'}. Best is trial 1528 with value: 0.5170644640922546.
Generating morgan fingerprints...
Generated fingerprints with 2048 features for 900 molecules
Data shape: X=(900, 2048), y=(900,)
Trial 1632: 5-fold CV loss = 0.5301
[I 2025-08-08 01:23:48,062] Trial 1632 finished with value: 0.5301330804824829 and parameters: {'fp_type': 'morgan', 'morgan_only_radius': 2, 'morgan_only_nBits': 2048, 'num_hidden_layers': 3, 'hidden_dim_0': 512, 'hidden_dim_1': 128, 'hidden_dim_2': 512, 'kl_weight': 0.000734256090812174, 'lr': 0.002260727935454885, 'batch_size': 32, 'dropout_rate': 0.40233885565097544, 'prior_mu': 0.03764152223784429, 'prior_sigma': 0.05075964306673039, 'normalization': 'none'}. Best is trial 1528 with value: 0.5170644640922546.
Generating morgan fingerprints...
Generated fingerprints with 2048 features for 900 molecules
Data shape: X=(900, 2048), y=(900,)
Trial 1635: 5-fold CV loss = 0.5551
[I 2025-08-08 01:24:08,304] Trial 1635 finished with value: 0.5550766348838806 and parameters: {'fp_type': 'morgan', 'morgan_only_radius': 2, 'morgan_only_nBits': 2048, 'num_hidden_layers': 3, 'hidden_dim_0': 512, 'hidden_dim_1': 128, 'hidden_dim_2': 512, 'kl_weight': 0.0007082965537299308, 'lr': 0.0021071541361408603, 'batch_size': 32, 'dropout_rate': 0.41874361828845874, 'prior_mu': 0.037588692967946355, 'prior_sigma': 0.0670981782056945, 'normalization': 'none'}. Best is trial 1528 with value: 0.5170644640922546.
Generating morgan fingerprints...
Generated fingerprints with 2048 features for 900 molecules
Data shape: X=(900, 2048), y=(900,)
Trial 1633: 5-fold CV loss = 0.7519
