[I 2025-08-08 02:42:35,219] Trial 1856 finished with value: 0.953508335351944 and parameters: {'fp_type': 'morgan', 'morgan_only_radius': 2, 'morgan_only_nBits': 2048, 'num_hidden_layers': 3, 'hidden_dim_0': 512, 'hidden_dim_1': 512, 'hidden_dim_2': 512, 'kl_weight': 0.0008117037283688884, 'lr': 0.0018544333556782986, 'batch_size': 32, 'dropout_rate': 0.41137762649827997, 'prior_mu': 0.051491281267446565, 'prior_sigma': 0.0741349318761132, 'normalization': 'none'}. Best is trial 1528 with value: 0.5170644640922546.
Generating morgan fingerprints...
Generated fingerprints with 2048 features for 900 molecules
Data shape: X=(900, 2048), y=(900,)
Trial 1858: 5-fold CV loss = 0.5356
[I 2025-08-08 02:43:11,294] Trial 1858 finished with value: 0.5356044948101044 and parameters: {'fp_type': 'morgan', 'morgan_only_radius': 2, 'morgan_only_nBits': 2048, 'num_hidden_layers': 3, 'hidden_dim_0': 512, 'hidden_dim_1': 128, 'hidden_dim_2': 512, 'kl_weight': 0.0008265510851324858, 'lr': 0.0035596906169714495, 'batch_size': 32, 'dropout_rate': 0.40893183143338313, 'prior_mu': 0.034562014403615865, 'prior_sigma': 0.08144173118906774, 'normalization': 'none'}. Best is trial 1528 with value: 0.5170644640922546.
Generating morgan fingerprints...
Generated fingerprints with 2048 features for 900 molecules
Data shape: X=(900, 2048), y=(900,)
Trial 1859: 5-fold CV loss = 0.5270
[I 2025-08-08 02:43:52,980] Trial 1859 finished with value: 0.5269858717918396 and parameters: {'fp_type': 'morgan', 'morgan_only_radius': 2, 'morgan_only_nBits': 2048, 'num_hidden_layers': 3, 'hidden_dim_0': 512, 'hidden_dim_1': 128, 'hidden_dim_2': 512, 'kl_weight': 0.0008065000199629197, 'lr': 0.0022793750236708133, 'batch_size': 32, 'dropout_rate': 0.4014743100983263, 'prior_mu': 0.04012369917877706, 'prior_sigma': 0.07527360218475067, 'normalization': 'none'}. Best is trial 1528 with value: 0.5170644640922546.
Generating morgan fingerprints...
Generated fingerprints with 2048 features for 900 molecules
Data shape: X=(900, 2048), y=(900,)
Trial 1857: 5-fold CV loss = 0.5853
[I 2025-08-08 02:44:09,405] Trial 1857 finished with value: 0.5852654814720154 and parameters: {'fp_type': 'morgan', 'morgan_only_radius': 2, 'morgan_only_nBits': 2048, 'num_hidden_layers': 3, 'hidden_dim_0': 512, 'hidden_dim_1': 128, 'hidden_dim_2': 512, 'kl_weight': 0.0008200597882887283, 'lr': 0.0018544991515823184, 'batch_size': 32, 'dropout_rate': 0.0659237169895649, 'prior_mu': 0.03841604802386182, 'prior_sigma': 0.07499672345357777, 'normalization': 'none'}. Best is trial 1528 with value: 0.5170644640922546.
Generating morgan fingerprints...
Generated fingerprints with 2048 features for 900 molecules
Data shape: X=(900, 2048), y=(900,)
Trial 1851: 5-fold CV loss = 0.5876
[I 2025-08-08 02:44:21,041] Trial 1851 finished with value: 0.5875500559806823 and parameters: {'fp_type': 'morgan_rdkit', 'combined_morgan_radius': 2, 'combined_morgan_nBits': 512, 'combined_rdkit_maxPath': 7, 'combined_rdkit_nBits': 512, 'num_hidden_layers': 3, 'hidden_dim_0': 512, 'hidden_dim_1': 128, 'hidden_dim_2': 512, 'kl_weight': 0.0009491969574325149, 'lr': 0.0036124076177947093, 'batch_size': 32, 'dropout_rate': 0.4344671760499162, 'prior_mu': 0.04207949578812737, 'prior_sigma': 0.07061580182513014, 'normalization': 'none'}. Best is trial 1528 with value: 0.5170644640922546.
Generating morgan fingerprints...
Generated fingerprints with 2048 features for 900 molecules
Data shape: X=(900, 2048), y=(900,)
Trial 1860: 5-fold CV loss = 0.5705
[I 2025-08-08 02:44:27,706] Trial 1860 finished with value: 0.5705483078956604 and parameters: {'fp_type': 'morgan', 'morgan_only_radius': 2, 'morgan_only_nBits': 2048, 'num_hidden_layers': 3, 'hidden_dim_0': 512, 'hidden_dim_1': 128, 'hidden_dim_2': 512, 'kl_weight': 0.0009189647982021644, 'lr': 0.0021737469730838954, 'batch_size': 32, 'dropout_rate': 0.3981083900317828, 'prior_mu': 0.1935477246936872, 'prior_sigma': 0.07526125441735067, 'normalization': 'none'}. Best is trial 1528 with value: 0.5170644640922546.
Generating morgan fingerprints...
Generated fingerprints with 2048 features for 900 molecules
Data shape: X=(900, 2048), y=(900,)
Trial 1862: 5-fold CV loss = 0.6704
[I 2025-08-08 02:44:38,798] Trial 1862 finished with value: 0.6703610062599182 and parameters: {'fp_type': 'morgan', 'morgan_only_radius': 2, 'morgan_only_nBits': 2048, 'num_hidden_layers': 0, 'kl_weight': 0.0006394342879058533, 'lr': 0.002091444953956879, 'batch_size': 32, 'dropout_rate': 0.42174486175587583, 'prior_mu': 0.03333413694433307, 'prior_sigma': 0.07213396989959237, 'normalization': 'none'}. Best is trial 1528 with value: 0.5170644640922546.
Generating morgan fingerprints...
Generated fingerprints with 2048 features for 900 molecules
Data shape: X=(900, 2048), y=(900,)
Trial 1861: 5-fold CV loss = 0.5258
[I 2025-08-08 02:45:24,683] Trial 1861 finished with value: 0.5258361279964447 and parameters: {'fp_type': 'morgan', 'morgan_only_radius': 2, 'morgan_only_nBits': 2048, 'num_hidden_layers': 3, 'hidden_dim_0': 512, 'hidden_dim_1': 128, 'hidden_dim_2': 512, 'kl_weight': 0.0006381059264870986, 'lr': 0.0021059396706104155, 'batch_size': 32, 'dropout_rate': 0.4214005391306663, 'prior_mu': 0.03581971640902916, 'prior_sigma': 0.07242900646449309, 'normalization': 'none'}. Best is trial 1528 with value: 0.5170644640922546.
Generating morgan fingerprints...
Generated fingerprints with 2048 features for 900 molecules
Data shape: X=(900, 2048), y=(900,)
Trial 1864: 5-fold CV loss = 0.5286
[I 2025-08-08 02:45:27,175] Trial 1864 finished with value: 0.5285645842552185 and parameters: {'fp_type': 'morgan', 'morgan_only_radius': 3, 'morgan_only_nBits': 2048, 'num_hidden_layers': 3, 'hidden_dim_0': 512, 'hidden_dim_1': 128, 'hidden_dim_2': 512, 'kl_weight': 0.0006244477863019275, 'lr': 0.0025105754480590084, 'batch_size': 32, 'dropout_rate': 0.42187655946578206, 'prior_mu': 0.033938749997379405, 'prior_sigma': 0.07256450035493843, 'normalization': 'none'}. Best is trial 1528 with value: 0.5170644640922546.
Generating rdkit fingerprints...
Generated fingerprints with 256 features for 900 molecules
Data shape: X=(900, 256), y=(900,)
Trial 1865: 5-fold CV loss = 0.5422
[I 2025-08-08 02:46:08,870] Trial 1865 finished with value: 0.5421754121780396 and parameters: {'fp_type': 'morgan', 'morgan_only_radius': 3, 'morgan_only_nBits': 2048, 'num_hidden_layers': 3, 'hidden_dim_0': 512, 'hidden_dim_1': 128, 'hidden_dim_2': 512, 'kl_weight': 0.0006284447666600308, 'lr': 0.0025546489399715243, 'batch_size': 32, 'dropout_rate': 0.42115280713186903, 'prior_mu': 0.05340761558218601, 'prior_sigma': 0.07970096271270985, 'normalization': 'none'}. Best is trial 1528 with value: 0.5170644640922546.
Generating rdkit fingerprints...
Generated fingerprints with 256 features for 900 molecules
Data shape: X=(900, 256), y=(900,)
Trial 1866: 5-fold CV loss = 0.5372
[I 2025-08-08 02:46:34,934] Trial 1866 finished with value: 0.5371764659881592 and parameters: {'fp_type': 'morgan', 'morgan_only_radius': 2, 'morgan_only_nBits': 2048, 'num_hidden_layers': 3, 'hidden_dim_0': 512, 'hidden_dim_1': 128, 'hidden_dim_2': 512, 'kl_weight': 0.0007269281528360448, 'lr': 0.0024253641599343147, 'batch_size': 32, 'dropout_rate': 0.4136137401095108, 'prior_mu': 0.05125713252786482, 'prior_sigma': 0.10095465701482052, 'normalization': 'none'}. Best is trial 1528 with value: 0.5170644640922546.
Generating rdkit fingerprints...
Generated fingerprints with 256 features for 900 molecules
Data shape: X=(900, 256), y=(900,)
Trial 1867: 5-fold CV loss = 0.5604
[I 2025-08-08 02:46:53,336] Trial 1867 finished with value: 0.5604383826255799 and parameters: {'fp_type': 'rdkit', 'rdkit_only_maxPath': 5, 'rdkit_only_nBits': 256, 'num_hidden_layers': 3, 'hidden_dim_0': 512, 'hidden_dim_1': 128, 'hidden_dim_2': 512, 'kl_weight': 0.0007317696159574829, 'lr': 0.005429995470482468, 'batch_size': 32, 'dropout_rate': 0.4299239440621121, 'prior_mu': 0.050122477383265945, 'prior_sigma': 0.06840898335044682, 'normalization': 'none'}. Best is trial 1528 with value: 0.5170644640922546.
Generating morgan fingerprints...
Generated fingerprints with 2048 features for 900 molecules
Data shape: X=(900, 2048), y=(900,)
Trial 1869: 5-fold CV loss = 0.6354
[I 2025-08-08 02:47:06,907] Trial 1869 finished with value: 0.6353953242301941 and parameters: {'fp_type': 'rdkit', 'rdkit_only_maxPath': 5, 'rdkit_only_nBits': 256, 'num_hidden_layers': 3, 'hidden_dim_0': 128, 'hidden_dim_1': 128, 'hidden_dim_2': 512, 'kl_weight': 0.0007558185300045243, 'lr': 0.002917526824955986, 'batch_size': 32, 'dropout_rate': 0.43270906809196974, 'prior_mu': 0.025249330705484144, 'prior_sigma': 0.06745665204007469, 'normalization': 'none'}. Best is trial 1528 with value: 0.5170644640922546.
Generating morgan fingerprints...
Generated fingerprints with 2048 features for 900 molecules
Data shape: X=(900, 2048), y=(900,)
Trial 1868: 5-fold CV loss = 0.8295
[I 2025-08-08 02:47:44,884] Trial 1868 finished with value: 0.8294934272766114 and parameters: {'fp_type': 'rdkit', 'rdkit_only_maxPath': 5, 'rdkit_only_nBits': 256, 'num_hidden_layers': 3, 'hidden_dim_0': 1024, 'hidden_dim_1': 128, 'hidden_dim_2': 512, 'kl_weight': 0.0007565999399797213, 'lr': 0.0016598664148815383, 'batch_size': 32, 'dropout_rate': 0.4315183615180905, 'prior_mu': 0.026553377062303343, 'prior_sigma': 0.06795361965470781, 'normalization': 'none'}. Best is trial 1528 with value: 0.5170644640922546.
Generating morgan fingerprints...
Generated fingerprints with 2048 features for 900 molecules
Data shape: X=(900, 2048), y=(900,)
Trial 1870: 5-fold CV loss = 0.6093
[I 2025-08-08 02:47:54,584] Trial 1870 finished with value: 0.6092778503894806 and parameters: {'fp_type': 'morgan', 'morgan_only_radius': 2, 'morgan_only_nBits': 2048, 'num_hidden_layers': 3, 'hidden_dim_0': 1024, 'hidden_dim_1': 128, 'hidden_dim_2': 512, 'kl_weight': 0.0009404564042501024, 'lr': 0.0016485696833371663, 'batch_size': 32, 'dropout_rate': 0.4309038679347573, 'prior_mu': 0.024601613575135146, 'prior_sigma': 0.062097367699432936, 'normalization': 'none'}. Best is trial 1528 with value: 0.5170644640922546.
Generating morgan fingerprints...
Generated fingerprints with 2048 features for 900 molecules
Data shape: X=(900, 2048), y=(900,)
Trial 1871: 5-fold CV loss = 0.6607
[I 2025-08-08 02:48:19,604] Trial 1871 finished with value: 0.6606937766075134 and parameters: {'fp_type': 'morgan', 'morgan_only_radius': 2, 'morgan_only_nBits': 2048, 'num_hidden_layers': 3, 'hidden_dim_0': 1024, 'hidden_dim_1': 128, 'hidden_dim_2': 512, 'kl_weight': 0.0009325670804454866, 'lr': 0.0016551905839317963, 'batch_size': 32, 'dropout_rate': 0.4074619457142368, 'prior_mu': 0.043270168107128165, 'prior_sigma': 0.0609224110704626, 'normalization': 'none'}. Best is trial 1528 with value: 0.5170644640922546.
Generating morgan fingerprints...
Generated fingerprints with 2048 features for 900 molecules
Data shape: X=(900, 2048), y=(900,)
Trial 1863: 5-fold CV loss = 0.5309
[I 2025-08-08 02:48:23,153] Trial 1863 finished with value: 0.5308531045913696 and parameters: {'fp_type': 'morgan', 'morgan_only_radius': 3, 'morgan_only_nBits': 2048, 'num_hidden_layers': 3, 'hidden_dim_0': 512, 'hidden_dim_1': 128, 'hidden_dim_2': 512, 'kl_weight': 0.0006399835342159787, 'lr': 0.002107458880442559, 'batch_size': 32, 'dropout_rate': 0.41828979458016874, 'prior_mu': 0.033161358317856264, 'prior_sigma': 0.07283583764369142, 'normalization': 'none'}. Best is trial 1528 with value: 0.5170644640922546.
Generating morgan fingerprints...
Generated fingerprints with 2048 features for 900 molecules
Data shape: X=(900, 2048), y=(900,)
Trial 1873: 5-fold CV loss = 0.5615
[I 2025-08-08 02:49:10,912] Trial 1873 finished with value: 0.5614594757556916 and parameters: {'fp_type': 'morgan', 'morgan_only_radius': 2, 'morgan_only_nBits': 2048, 'num_hidden_layers': 3, 'hidden_dim_0': 512, 'hidden_dim_1': 128, 'hidden_dim_2': 256, 'kl_weight': 0.0005892039081443237, 'lr': 0.0020131113312924615, 'batch_size': 32, 'dropout_rate': 0.16946469185071303, 'prior_mu': 0.04235968324816701, 'prior_sigma': 0.06034591777411088, 'normalization': 'none'}. Best is trial 1528 with value: 0.5170644640922546.
Generating morgan fingerprints...
Generated fingerprints with 2048 features for 900 molecules
Data shape: X=(900, 2048), y=(900,)
Trial 1872: 5-fold CV loss = 0.5591
[I 2025-08-08 02:49:25,183] Trial 1872 finished with value: 0.5591208815574646 and parameters: {'fp_type': 'morgan', 'morgan_only_radius': 2, 'morgan_only_nBits': 2048, 'num_hidden_layers': 3, 'hidden_dim_0': 512, 'hidden_dim_1': 128, 'hidden_dim_2': 512, 'kl_weight': 0.0009200899953670549, 'lr': 0.001770943174358418, 'batch_size': 32, 'dropout_rate': 0.4086504947883126, 'prior_mu': 0.043258339335673544, 'prior_sigma': 0.0606121753403321, 'normalization': 'none'}. Best is trial 1528 with value: 0.5170644640922546.
Generating morgan fingerprints...
Generated fingerprints with 2048 features for 900 molecules
Data shape: X=(900, 2048), y=(900,)
Trial 1874: 5-fold CV loss = 0.5672
[I 2025-08-08 02:49:34,982] Trial 1874 finished with value: 0.5671625375747681 and parameters: {'fp_type': 'morgan', 'morgan_only_radius': 2, 'morgan_only_nBits': 2048, 'num_hidden_layers': 3, 'hidden_dim_0': 512, 'hidden_dim_1': 128, 'hidden_dim_2': 256, 'kl_weight': 0.0005816692792533153, 'lr': 0.002055048934062547, 'batch_size': 32, 'dropout_rate': 0.41404785558780377, 'prior_mu': 0.03449904369000254, 'prior_sigma': 0.06450796058841911, 'normalization': 'none'}. Best is trial 1528 with value: 0.5170644640922546.
Generating morgan fingerprints...
Generated fingerprints with 2048 features for 900 molecules
Data shape: X=(900, 2048), y=(900,)
Trial 1876: 5-fold CV loss = 0.5271
[I 2025-08-08 02:50:23,683] Trial 1876 finished with value: 0.5271158874034881 and parameters: {'fp_type': 'morgan', 'morgan_only_radius': 2, 'morgan_only_nBits': 2048, 'num_hidden_layers': 3, 'hidden_dim_0': 512, 'hidden_dim_1': 128, 'hidden_dim_2': 512, 'kl_weight': 0.0008192832914102601, 'lr': 0.0022514381629252394, 'batch_size': 32, 'dropout_rate': 0.4383707487332921, 'prior_mu': 0.05341340239569324, 'prior_sigma': 0.0649489733420767, 'normalization': 'none'}. Best is trial 1528 with value: 0.5170644640922546.
Generating morgan fingerprints...
Generated fingerprints with 2048 features for 900 molecules
Data shape: X=(900, 2048), y=(900,)
Trial 1878: 5-fold CV loss = 0.5282
[I 2025-08-08 02:50:44,638] Trial 1878 finished with value: 0.5282324254512787 and parameters: {'fp_type': 'morgan', 'morgan_only_radius': 2, 'morgan_only_nBits': 2048, 'num_hidden_layers': 3, 'hidden_dim_0': 512, 'hidden_dim_1': 128, 'hidden_dim_2': 512, 'kl_weight': 0.0008153852515037478, 'lr': 0.0024337702805036438, 'batch_size': 32, 'dropout_rate': 0.43978353887387317, 'prior_mu': 0.053382152950173734, 'prior_sigma': 0.06923451849376097, 'normalization': 'none'}. Best is trial 1528 with value: 0.5170644640922546.
Generating morgan fingerprints...
Generated fingerprints with 2048 features for 900 molecules
Data shape: X=(900, 2048), y=(900,)
Trial 1877: 5-fold CV loss = 0.5332
[I 2025-08-08 02:51:01,242] Trial 1877 finished with value: 0.5332452893257141 and parameters: {'fp_type': 'morgan', 'morgan_only_radius': 2, 'morgan_only_nBits': 2048, 'num_hidden_layers': 3, 'hidden_dim_0': 512, 'hidden_dim_1': 128, 'hidden_dim_2': 512, 'kl_weight': 0.001087044668774748, 'lr': 0.002727946062605741, 'batch_size': 32, 'dropout_rate': 0.44037992324348885, 'prior_mu': 0.054877413732220076, 'prior_sigma': 0.06487932684569378, 'normalization': 'none'}. Best is trial 1528 with value: 0.5170644640922546.
Generating morgan fingerprints...
Generated fingerprints with 2048 features for 900 molecules
Data shape: X=(900, 2048), y=(900,)
Trial 1880: 5-fold CV loss = 0.6694
[I 2025-08-08 02:51:12,447] Trial 1880 finished with value: 0.6694448709487915 and parameters: {'fp_type': 'morgan', 'morgan_only_radius': 2, 'morgan_only_nBits': 2048, 'num_hidden_layers': 2, 'hidden_dim_0': 512, 'hidden_dim_1': 128, 'kl_weight': 0.0010900554279938395, 'lr': 0.002669038644787541, 'batch_size': 32, 'dropout_rate': 0.37635930545672097, 'prior_mu': 0.03070328389885447, 'prior_sigma': 0.014577424137611775, 'normalization': 'none'}. Best is trial 1528 with value: 0.5170644640922546.
Generating morgan fingerprints...
Generated fingerprints with 2048 features for 900 molecules
Data shape: X=(900, 2048), y=(900,)
Trial 1879: 5-fold CV loss = 0.5270
[I 2025-08-08 02:51:17,756] Trial 1879 finished with value: 0.5270068526268006 and parameters: {'fp_type': 'morgan', 'morgan_only_radius': 2, 'morgan_only_nBits': 2048, 'num_hidden_layers': 3, 'hidden_dim_0': 512, 'hidden_dim_1': 128, 'hidden_dim_2': 512, 'kl_weight': 0.0011108727298400707, 'lr': 0.0027638774003957587, 'batch_size': 32, 'dropout_rate': 0.4234704290173124, 'prior_mu': 0.030718486384887608, 'prior_sigma': 0.06880233962604414, 'normalization': 'none'}. Best is trial 1528 with value: 0.5170644640922546.
Generating morgan fingerprints...
Generated fingerprints with 2048 features for 900 molecules
Data shape: X=(900, 2048), y=(900,)
Trial 1882: 5-fold CV loss = 0.5753
[I 2025-08-08 02:52:23,573] Trial 1882 finished with value: 0.5753193616867065 and parameters: {'fp_type': 'morgan', 'morgan_only_radius': 2, 'morgan_only_nBits': 2048, 'num_hidden_layers': 3, 'hidden_dim_0': 64, 'hidden_dim_1': 128, 'hidden_dim_2': 512, 'kl_weight': 0.0006883802152207952, 'lr': 0.0018020056962346335, 'batch_size': 32, 'dropout_rate': 0.42388644770531303, 'prior_mu': 0.022939813913540486, 'prior_sigma': 0.0777229766540228, 'normalization': 'none'}. Best is trial 1528 with value: 0.5170644640922546.
Generating morgan fingerprints...
Generated fingerprints with 2048 features for 900 molecules
Data shape: X=(900, 2048), y=(900,)
Trial 1875: 5-fold CV loss = 0.5568
[I 2025-08-08 02:52:35,859] Trial 1875 finished with value: 0.5568010807037354 and parameters: {'fp_type': 'morgan', 'morgan_only_radius': 2, 'morgan_only_nBits': 2048, 'num_hidden_layers': 3, 'hidden_dim_0': 512, 'hidden_dim_1': 128, 'hidden_dim_2': 512, 'kl_weight': 0.0005826894758912084, 'lr': 0.00198963642796045, 'batch_size': 32, 'dropout_rate': 0.4430621928445372, 'prior_mu': 0.042071617104738605, 'prior_sigma': 0.06459213563865156, 'normalization': 'none'}. Best is trial 1528 with value: 0.5170644640922546.
Generating morgan fingerprints...
Generated fingerprints with 2048 features for 900 molecules
Data shape: X=(900, 2048), y=(900,)
Trial 1884: 5-fold CV loss = 0.6901
[I 2025-08-08 02:52:54,741] Trial 1884 finished with value: 0.6900850057601928 and parameters: {'fp_type': 'morgan', 'morgan_only_radius': 2, 'morgan_only_nBits': 2048, 'num_hidden_layers': 3, 'hidden_dim_0': 256, 'hidden_dim_1': 128, 'hidden_dim_2': 128, 'kl_weight': 0.0006939778429943429, 'lr': 0.0002010637271777177, 'batch_size': 32, 'dropout_rate': 0.44198027380876403, 'prior_mu': 0.038860651689867264, 'prior_sigma': 0.06507985650693925, 'normalization': 'none'}. Best is trial 1528 with value: 0.5170644640922546.
Generating morgan fingerprints...
Generated fingerprints with 2048 features for 900 molecules
Data shape: X=(900, 2048), y=(900,)
Trial 1883: 5-fold CV loss = 0.5534
[I 2025-08-08 02:52:56,841] Trial 1883 finished with value: 0.5534227132797241 and parameters: {'fp_type': 'morgan', 'morgan_only_radius': 2, 'morgan_only_nBits': 2048, 'num_hidden_layers': 3, 'hidden_dim_0': 64, 'hidden_dim_1': 128, 'hidden_dim_2': 512, 'kl_weight': 0.0006784052564107388, 'lr': 0.0018444744047261012, 'batch_size': 32, 'dropout_rate': 0.42941838139678123, 'prior_mu': 0.0399454305753632, 'prior_sigma': 0.083047681252151, 'normalization': 'none'}. Best is trial 1528 with value: 0.5170644640922546.
Generating morgan fingerprints...
Generated fingerprints with 2048 features for 900 molecules
Data shape: X=(900, 2048), y=(900,)
Trial 1885: 5-fold CV loss = 0.6757
[I 2025-08-08 02:53:05,401] Trial 1885 finished with value: 0.67565997838974 and parameters: {'fp_type': 'morgan', 'morgan_only_radius': 2, 'morgan_only_nBits': 2048, 'num_hidden_layers': 3, 'hidden_dim_0': 512, 'hidden_dim_1': 128, 'hidden_dim_2': 128, 'kl_weight': 0.0004925639334622678, 'lr': 0.0022401638948229973, 'batch_size': 128, 'dropout_rate': 0.396349753404919, 'prior_mu': 0.03769164615369573, 'prior_sigma': 0.07045285130267996, 'normalization': 'none'}. Best is trial 1528 with value: 0.5170644640922546.
Generating morgan fingerprints...
Generated fingerprints with 2048 features for 900 molecules
Data shape: X=(900, 2048), y=(900,)
Trial 1886: 5-fold CV loss = 0.7241
[I 2025-08-08 02:53:06,565] Trial 1886 finished with value: 0.7241095185279847 and parameters: {'fp_type': 'morgan', 'morgan_only_radius': 2, 'morgan_only_nBits': 2048, 'num_hidden_layers': 3, 'hidden_dim_0': 512, 'hidden_dim_1': 128, 'hidden_dim_2': 512, 'kl_weight': 0.0009026518101020479, 'lr': 0.0022513274842364804, 'batch_size': 128, 'dropout_rate': 0.39959210839473047, 'prior_mu': 0.0210192655863431, 'prior_sigma': 0.0700177456901883, 'normalization': 'none'}. Best is trial 1528 with value: 0.5170644640922546.
Generating morgan fingerprints...
Generated fingerprints with 2048 features for 900 molecules
Data shape: X=(900, 2048), y=(900,)
Trial 1881: 5-fold CV loss = 1.2323
[I 2025-08-08 02:53:16,527] Trial 1881 finished with value: 1.2322806417942047 and parameters: {'fp_type': 'morgan', 'morgan_only_radius': 2, 'morgan_only_nBits': 2048, 'num_hidden_layers': 3, 'hidden_dim_0': 512, 'hidden_dim_1': 128, 'hidden_dim_2': 128, 'kl_weight': 0.0007146170275697477, 'lr': 0.001887047528270229, 'batch_size': 32, 'dropout_rate': 0.424455551148123, 'prior_mu': 0.03825193660483663, 'prior_sigma': 0.164527973434271, 'normalization': 'none'}. Best is trial 1528 with value: 0.5170644640922546.
Generating morgan fingerprints...
Generated fingerprints with 2048 features for 900 molecules
Data shape: X=(900, 2048), y=(900,)
Trial 1887: 5-fold CV loss = 0.7143
