[I 2025-08-07 23:29:55,033] Trial 1322 finished with value: 0.5975691735744476 and parameters: {'fp_type': 'morgan', 'morgan_only_radius': 3, 'morgan_only_nBits': 1024, 'num_hidden_layers': 3, 'hidden_dim_0': 512, 'hidden_dim_1': 128, 'hidden_dim_2': 256, 'kl_weight': 0.00026808188165451484, 'lr': 0.000632235154454539, 'batch_size': 32, 'dropout_rate': 0.46746967707193043, 'prior_mu': 0.04093991728461368, 'prior_sigma': 0.06585444961524554, 'normalization': 'layer'}. Best is trial 1281 with value: 0.5184582889080047.
Generating morgan fingerprints...
Generated fingerprints with 1024 features for 900 molecules
Data shape: X=(900, 1024), y=(900,)
Trial 1321: 5-fold CV loss = 0.5555
[I 2025-08-07 23:30:21,019] Trial 1321 finished with value: 0.5555398285388946 and parameters: {'fp_type': 'rdkit', 'rdkit_only_maxPath': 6, 'rdkit_only_nBits': 1024, 'num_hidden_layers': 3, 'hidden_dim_0': 512, 'hidden_dim_1': 128, 'hidden_dim_2': 256, 'kl_weight': 0.00010450159819473318, 'lr': 0.0025516159210521865, 'batch_size': 32, 'dropout_rate': 0.46464622745498185, 'prior_mu': 0.05676921275995286, 'prior_sigma': 0.06497269314708054, 'normalization': 'layer'}. Best is trial 1281 with value: 0.5184582889080047.
Generating morgan fingerprints...
Generated fingerprints with 1024 features for 900 molecules
Data shape: X=(900, 1024), y=(900,)
Trial 1318: 5-fold CV loss = 0.6057
[I 2025-08-07 23:30:41,737] Trial 1318 finished with value: 0.6057395696640014 and parameters: {'fp_type': 'rdkit', 'rdkit_only_maxPath': 6, 'rdkit_only_nBits': 1024, 'num_hidden_layers': 3, 'hidden_dim_0': 512, 'hidden_dim_1': 128, 'hidden_dim_2': 512, 'kl_weight': 0.0001504910814559383, 'lr': 0.0015349732516708404, 'batch_size': 32, 'dropout_rate': 0.4627628103888479, 'prior_mu': 0.0677425315262359, 'prior_sigma': 0.06134312205480939, 'normalization': 'none'}. Best is trial 1281 with value: 0.5184582889080047.
Generating morgan fingerprints...
Generated fingerprints with 1024 features for 900 molecules
Data shape: X=(900, 1024), y=(900,)
Trial 1324: 5-fold CV loss = 0.5305
[I 2025-08-07 23:30:50,403] Trial 1324 finished with value: 0.5305331587791443 and parameters: {'fp_type': 'morgan', 'morgan_only_radius': 2, 'morgan_only_nBits': 1024, 'num_hidden_layers': 3, 'hidden_dim_0': 512, 'hidden_dim_1': 128, 'hidden_dim_2': 512, 'kl_weight': 0.0002961355926041346, 'lr': 0.0026217261627303166, 'batch_size': 32, 'dropout_rate': 0.4500330940582027, 'prior_mu': 0.05271295744149605, 'prior_sigma': 0.06395578059783548, 'normalization': 'none'}. Best is trial 1281 with value: 0.5184582889080047.
Generating morgan fingerprints...
Generated fingerprints with 1024 features for 900 molecules
Data shape: X=(900, 1024), y=(900,)
Trial 1323: 5-fold CV loss = 0.5469
[I 2025-08-07 23:30:57,358] Trial 1323 finished with value: 0.5468695044517518 and parameters: {'fp_type': 'morgan', 'morgan_only_radius': 3, 'morgan_only_nBits': 1024, 'num_hidden_layers': 3, 'hidden_dim_0': 512, 'hidden_dim_1': 128, 'hidden_dim_2': 256, 'kl_weight': 0.0001029555310385696, 'lr': 0.0026370729935623607, 'batch_size': 32, 'dropout_rate': 0.4489608920629952, 'prior_mu': 0.03691857911731272, 'prior_sigma': 0.06521245639137192, 'normalization': 'layer'}. Best is trial 1281 with value: 0.5184582889080047.
Generating morgan fingerprints...
Generated fingerprints with 1024 features for 900 molecules
Data shape: X=(900, 1024), y=(900,)
Trial 1325: 5-fold CV loss = 0.6452
[I 2025-08-07 23:31:41,794] Trial 1325 finished with value: 0.6452036201953888 and parameters: {'fp_type': 'morgan', 'morgan_only_radius': 2, 'morgan_only_nBits': 1024, 'num_hidden_layers': 3, 'hidden_dim_0': 512, 'hidden_dim_1': 512, 'hidden_dim_2': 512, 'kl_weight': 0.00010832537698148252, 'lr': 0.0021211227511770026, 'batch_size': 32, 'dropout_rate': 0.44919556557465495, 'prior_mu': 0.05947247244328623, 'prior_sigma': 0.06527486542582166, 'normalization': 'none'}. Best is trial 1281 with value: 0.5184582889080047.
Generating morgan fingerprints...
Generated fingerprints with 1024 features for 900 molecules
Data shape: X=(900, 1024), y=(900,)
Trial 1327: 5-fold CV loss = 0.5758
[I 2025-08-07 23:31:51,071] Trial 1327 finished with value: 0.5757780194282531 and parameters: {'fp_type': 'morgan', 'morgan_only_radius': 2, 'morgan_only_nBits': 1024, 'num_hidden_layers': 3, 'hidden_dim_0': 256, 'hidden_dim_1': 128, 'hidden_dim_2': 512, 'kl_weight': 0.00016729396968723115, 'lr': 0.002098416572482801, 'batch_size': 32, 'dropout_rate': 0.4736502916137226, 'prior_mu': 0.056721952155209476, 'prior_sigma': 0.06647526402224056, 'normalization': 'none'}. Best is trial 1281 with value: 0.5184582889080047.
Generating morgan fingerprints...
Generated fingerprints with 1024 features for 900 molecules
Data shape: X=(900, 1024), y=(900,)
Trial 1330: 5-fold CV loss = 0.6607
[I 2025-08-07 23:32:05,968] Trial 1330 finished with value: 0.660732877254486 and parameters: {'fp_type': 'morgan', 'morgan_only_radius': 2, 'morgan_only_nBits': 1024, 'num_hidden_layers': 1, 'hidden_dim_0': 512, 'kl_weight': 0.00013765618278001183, 'lr': 0.0017754646236989285, 'batch_size': 32, 'dropout_rate': 0.47232227240460994, 'prior_mu': 0.045318763913371404, 'prior_sigma': 0.056422970431131786, 'normalization': 'none'}. Best is trial 1281 with value: 0.5184582889080047.
Generating morgan fingerprints...
Generated fingerprints with 1024 features for 900 molecules
Data shape: X=(900, 1024), y=(900,)
Trial 1331: 5-fold CV loss = 0.9042
[I 2025-08-07 23:32:15,942] Trial 1331 finished with value: 0.904194962978363 and parameters: {'fp_type': 'morgan', 'morgan_only_radius': 2, 'morgan_only_nBits': 1024, 'num_hidden_layers': 3, 'hidden_dim_0': 512, 'hidden_dim_1': 128, 'hidden_dim_2': 512, 'kl_weight': 0.00010456538696762563, 'lr': 0.002386654024121615, 'batch_size': 128, 'dropout_rate': 0.47572011333320363, 'prior_mu': 0.04991021239671361, 'prior_sigma': 0.06987310613632036, 'normalization': 'none'}. Best is trial 1281 with value: 0.5184582889080047.
Generating morgan fingerprints...
Generated fingerprints with 1024 features for 900 molecules
Data shape: X=(900, 1024), y=(900,)
Trial 1328: 5-fold CV loss = 0.6787
[I 2025-08-07 23:32:23,068] Trial 1328 finished with value: 0.6787289559841156 and parameters: {'fp_type': 'morgan', 'morgan_only_radius': 2, 'morgan_only_nBits': 1024, 'num_hidden_layers': 3, 'hidden_dim_0': 256, 'hidden_dim_1': 512, 'hidden_dim_2': 512, 'kl_weight': 0.00013046497138576144, 'lr': 0.002130967356296929, 'batch_size': 32, 'dropout_rate': 0.47368565515881006, 'prior_mu': 0.06360060887380471, 'prior_sigma': 0.056947047826895865, 'normalization': 'none'}. Best is trial 1281 with value: 0.5184582889080047.
Generating morgan fingerprints...
Generated fingerprints with 1024 features for 900 molecules
Data shape: X=(900, 1024), y=(900,)
Trial 1329: 5-fold CV loss = 0.5481
[I 2025-08-07 23:33:22,605] Trial 1329 finished with value: 0.5480588853359223 and parameters: {'fp_type': 'morgan', 'morgan_only_radius': 2, 'morgan_only_nBits': 1024, 'num_hidden_layers': 3, 'hidden_dim_0': 256, 'hidden_dim_1': 128, 'hidden_dim_2': 512, 'kl_weight': 0.00016390897003168227, 'lr': 0.0017668169394734732, 'batch_size': 32, 'dropout_rate': 0.47411351792340145, 'prior_mu': 0.040923760821910266, 'prior_sigma': 0.0583439401788905, 'normalization': 'none'}. Best is trial 1281 with value: 0.5184582889080047.
Generating morgan fingerprints...
Generated fingerprints with 1024 features for 900 molecules
Data shape: X=(900, 1024), y=(900,)
Trial 1332: 5-fold CV loss = 0.5379
[I 2025-08-07 23:33:42,400] Trial 1332 finished with value: 0.5379145324230195 and parameters: {'fp_type': 'morgan', 'morgan_only_radius': 2, 'morgan_only_nBits': 1024, 'num_hidden_layers': 3, 'hidden_dim_0': 512, 'hidden_dim_1': 128, 'hidden_dim_2': 512, 'kl_weight': 0.00042743880009436704, 'lr': 0.0020083525851876164, 'batch_size': 32, 'dropout_rate': 0.4708878694650243, 'prior_mu': 0.03931011519747868, 'prior_sigma': 0.05812879058730504, 'normalization': 'none'}. Best is trial 1281 with value: 0.5184582889080047.
Generating morgan fingerprints...
Generated fingerprints with 1024 features for 900 molecules
Data shape: X=(900, 1024), y=(900,)
Trial 1333: 5-fold CV loss = 0.5661
[I 2025-08-07 23:34:10,891] Trial 1333 finished with value: 0.5661424398422241 and parameters: {'fp_type': 'morgan', 'morgan_only_radius': 2, 'morgan_only_nBits': 1024, 'num_hidden_layers': 3, 'hidden_dim_0': 512, 'hidden_dim_1': 128, 'hidden_dim_2': 512, 'kl_weight': 0.00012546231341050798, 'lr': 0.001964920353672313, 'batch_size': 32, 'dropout_rate': 0.13834847837566555, 'prior_mu': 0.07094705177644334, 'prior_sigma': 0.06046857156043539, 'normalization': 'none'}. Best is trial 1281 with value: 0.5184582889080047.
Generating morgan fingerprints...
Generated fingerprints with 1024 features for 900 molecules
Data shape: X=(900, 1024), y=(900,)
Trial 1335: 5-fold CV loss = 0.5306
[I 2025-08-07 23:34:46,566] Trial 1335 finished with value: 0.5305606007575989 and parameters: {'fp_type': 'morgan', 'morgan_only_radius': 2, 'morgan_only_nBits': 1024, 'num_hidden_layers': 3, 'hidden_dim_0': 512, 'hidden_dim_1': 128, 'hidden_dim_2': 512, 'kl_weight': 0.0001247833179436043, 'lr': 0.002380351706531966, 'batch_size': 32, 'dropout_rate': 0.4816433588428641, 'prior_mu': 0.07052825262945794, 'prior_sigma': 0.06888643563773625, 'normalization': 'none'}. Best is trial 1281 with value: 0.5184582889080047.
Generating morgan fingerprints...
Generated fingerprints with 1024 features for 900 molecules
Data shape: X=(900, 1024), y=(900,)
Trial 1334: 5-fold CV loss = 0.5273
[I 2025-08-07 23:34:50,501] Trial 1334 finished with value: 0.5273176252841949 and parameters: {'fp_type': 'morgan', 'morgan_only_radius': 2, 'morgan_only_nBits': 1024, 'num_hidden_layers': 3, 'hidden_dim_0': 512, 'hidden_dim_1': 128, 'hidden_dim_2': 512, 'kl_weight': 0.0001351024194181608, 'lr': 0.002009371257525134, 'batch_size': 32, 'dropout_rate': 0.47920018548715776, 'prior_mu': 0.06379922740947551, 'prior_sigma': 0.06807667282893332, 'normalization': 'none'}. Best is trial 1281 with value: 0.5184582889080047.
Generating morgan fingerprints...
Generated fingerprints with 1024 features for 900 molecules
Data shape: X=(900, 1024), y=(900,)
Trial 1326: 5-fold CV loss = 0.5441
[I 2025-08-07 23:34:58,822] Trial 1326 finished with value: 0.5440926551818848 and parameters: {'fp_type': 'morgan', 'morgan_only_radius': 2, 'morgan_only_nBits': 1024, 'num_hidden_layers': 3, 'hidden_dim_0': 512, 'hidden_dim_1': 128, 'hidden_dim_2': 512, 'kl_weight': 0.00010091293011324386, 'lr': 0.002094344584998081, 'batch_size': 32, 'dropout_rate': 0.473882810199361, 'prior_mu': 0.03713305995073271, 'prior_sigma': 0.06482454980674533, 'normalization': 'none'}. Best is trial 1281 with value: 0.5184582889080047.
Generating morgan fingerprints...
Generated fingerprints with 1024 features for 900 molecules
Data shape: X=(900, 1024), y=(900,)
Trial 1337: 5-fold CV loss = 0.5272
[I 2025-08-07 23:35:54,466] Trial 1337 finished with value: 0.5272217631340027 and parameters: {'fp_type': 'morgan', 'morgan_only_radius': 2, 'morgan_only_nBits': 1024, 'num_hidden_layers': 3, 'hidden_dim_0': 512, 'hidden_dim_1': 128, 'hidden_dim_2': 512, 'kl_weight': 0.0005195767039739135, 'lr': 0.002259091385084503, 'batch_size': 32, 'dropout_rate': 0.4574801630379253, 'prior_mu': 0.08651914225942473, 'prior_sigma': 0.0641967767197997, 'normalization': 'none'}. Best is trial 1281 with value: 0.5184582889080047.
Generating morgan fingerprints...
Generated fingerprints with 1024 features for 900 molecules
Data shape: X=(900, 1024), y=(900,)
Trial 1338: 5-fold CV loss = 0.5263
[I 2025-08-07 23:36:23,477] Trial 1338 finished with value: 0.5263429284095764 and parameters: {'fp_type': 'morgan', 'morgan_only_radius': 2, 'morgan_only_nBits': 1024, 'num_hidden_layers': 3, 'hidden_dim_0': 512, 'hidden_dim_1': 128, 'hidden_dim_2': 512, 'kl_weight': 0.0005463749029668028, 'lr': 0.0022737871505426784, 'batch_size': 32, 'dropout_rate': 0.4595910237355661, 'prior_mu': 0.03718860065503405, 'prior_sigma': 0.06392362326934886, 'normalization': 'none'}. Best is trial 1281 with value: 0.5184582889080047.
Generating morgan fingerprints...
Generated fingerprints with 1024 features for 900 molecules
Data shape: X=(900, 1024), y=(900,)
Trial 1336: 5-fold CV loss = 0.5319
[I 2025-08-07 23:36:27,122] Trial 1336 finished with value: 0.5319249749183654 and parameters: {'fp_type': 'morgan', 'morgan_only_radius': 2, 'morgan_only_nBits': 1024, 'num_hidden_layers': 3, 'hidden_dim_0': 512, 'hidden_dim_1': 128, 'hidden_dim_2': 512, 'kl_weight': 0.0001508535983265819, 'lr': 0.0023840089440669, 'batch_size': 32, 'dropout_rate': 0.4797247108398625, 'prior_mu': 0.09079006782785305, 'prior_sigma': 0.0685633314114596, 'normalization': 'none'}. Best is trial 1281 with value: 0.5184582889080047.
Generating morgan fingerprints...
Generated fingerprints with 1024 features for 900 molecules
Data shape: X=(900, 1024), y=(900,)
Trial 1340: 5-fold CV loss = 0.5333
[I 2025-08-07 23:36:55,963] Trial 1340 finished with value: 0.5333043217658997 and parameters: {'fp_type': 'morgan', 'morgan_only_radius': 2, 'morgan_only_nBits': 1024, 'num_hidden_layers': 3, 'hidden_dim_0': 512, 'hidden_dim_1': 128, 'hidden_dim_2': 512, 'kl_weight': 0.00033985207652159876, 'lr': 0.002449147859452303, 'batch_size': 32, 'dropout_rate': 0.45972247737328586, 'prior_mu': 0.049640707172417434, 'prior_sigma': 0.07337402182373841, 'normalization': 'none'}. Best is trial 1281 with value: 0.5184582889080047.
Generating morgan fingerprints...
Generated fingerprints with 1024 features for 900 molecules
Data shape: X=(900, 1024), y=(900,)
Trial 1341: 5-fold CV loss = 1.4425
[I 2025-08-07 23:37:12,130] Trial 1341 finished with value: 1.4424888491630554 and parameters: {'fp_type': 'morgan', 'morgan_only_radius': 2, 'morgan_only_nBits': 1024, 'num_hidden_layers': 3, 'hidden_dim_0': 512, 'hidden_dim_1': 128, 'hidden_dim_2': 64, 'kl_weight': 0.003934002760957127, 'lr': 0.002576553744550112, 'batch_size': 32, 'dropout_rate': 0.48169903493185445, 'prior_mu': 0.06635295878170104, 'prior_sigma': 0.16083514893339912, 'normalization': 'none'}. Best is trial 1281 with value: 0.5184582889080047.
Generating morgan fingerprints...
Generated fingerprints with 1024 features for 900 molecules
Data shape: X=(900, 1024), y=(900,)
Trial 1343: 5-fold CV loss = 0.5969
[I 2025-08-07 23:37:50,950] Trial 1343 finished with value: 0.5968972444534302 and parameters: {'fp_type': 'morgan', 'morgan_only_radius': 2, 'morgan_only_nBits': 1024, 'num_hidden_layers': 3, 'hidden_dim_0': 512, 'hidden_dim_1': 128, 'hidden_dim_2': 64, 'kl_weight': 0.0038264022554958393, 'lr': 0.0018445965580794492, 'batch_size': 32, 'dropout_rate': 0.46818798809906903, 'prior_mu': 0.06607401499951007, 'prior_sigma': 0.053543273059235404, 'normalization': 'none'}. Best is trial 1281 with value: 0.5184582889080047.
Generating morgan fingerprints...
Generated fingerprints with 1024 features for 900 molecules
Data shape: X=(900, 1024), y=(900,)
Trial 1342: 5-fold CV loss = 0.5713
[I 2025-08-07 23:38:19,881] Trial 1342 finished with value: 0.5712577939033509 and parameters: {'fp_type': 'morgan', 'morgan_only_radius': 2, 'morgan_only_nBits': 1024, 'num_hidden_layers': 3, 'hidden_dim_0': 512, 'hidden_dim_1': 128, 'hidden_dim_2': 64, 'kl_weight': 0.003909015702576121, 'lr': 0.0014257271995820058, 'batch_size': 32, 'dropout_rate': 0.4656280973554773, 'prior_mu': 0.04974800417093755, 'prior_sigma': 0.053105304946871934, 'normalization': 'none'}. Best is trial 1281 with value: 0.5184582889080047.
Generating morgan fingerprints...
Generated fingerprints with 1024 features for 900 molecules
Data shape: X=(900, 1024), y=(900,)
Trial 1344: 5-fold CV loss = 0.5764
[I 2025-08-07 23:38:29,425] Trial 1344 finished with value: 0.5764205455780029 and parameters: {'fp_type': 'morgan', 'morgan_only_radius': 2, 'morgan_only_nBits': 1024, 'num_hidden_layers': 3, 'hidden_dim_0': 512, 'hidden_dim_1': 128, 'hidden_dim_2': 512, 'kl_weight': 0.014442986953869011, 'lr': 0.0018491643663884096, 'batch_size': 32, 'dropout_rate': 0.4704371621099165, 'prior_mu': 0.04961767612081768, 'prior_sigma': 0.052705870766466704, 'normalization': 'none'}. Best is trial 1281 with value: 0.5184582889080047.
Generating morgan fingerprints...
Generated fingerprints with 1024 features for 900 molecules
Data shape: X=(900, 1024), y=(900,)
Trial 1339: 5-fold CV loss = 0.5999
[I 2025-08-07 23:38:40,391] Trial 1339 finished with value: 0.5999474048614502 and parameters: {'fp_type': 'morgan', 'morgan_only_radius': 2, 'morgan_only_nBits': 1024, 'num_hidden_layers': 3, 'hidden_dim_0': 512, 'hidden_dim_1': 128, 'hidden_dim_2': 64, 'kl_weight': 0.00014613093250386637, 'lr': 0.0023164813650060705, 'batch_size': 32, 'dropout_rate': 0.45842727591779037, 'prior_mu': 0.048937924857977086, 'prior_sigma': 0.07325484610313934, 'normalization': 'none'}. Best is trial 1281 with value: 0.5184582889080047.
Generating morgan fingerprints...
Generated fingerprints with 1024 features for 900 molecules
Data shape: X=(900, 1024), y=(900,)
Trial 1345: 5-fold CV loss = 0.6021
[I 2025-08-07 23:38:45,722] Trial 1345 finished with value: 0.6021172523498535 and parameters: {'fp_type': 'morgan', 'morgan_only_radius': 2, 'morgan_only_nBits': 1024, 'num_hidden_layers': 3, 'hidden_dim_0': 128, 'hidden_dim_1': 128, 'hidden_dim_2': 512, 'kl_weight': 0.0002840336819283047, 'lr': 0.0013931260016124998, 'batch_size': 32, 'dropout_rate': 0.48290103161430387, 'prior_mu': 0.054291171806605164, 'prior_sigma': 0.06142039764699803, 'normalization': 'none'}. Best is trial 1281 with value: 0.5184582889080047.
Generating morgan fingerprints...
Generated fingerprints with 1024 features for 900 molecules
Data shape: X=(900, 1024), y=(900,)
Trial 1349: 5-fold CV loss = 1.6181
[I 2025-08-07 23:39:07,618] Trial 1349 finished with value: 1.6181103467941285 and parameters: {'fp_type': 'morgan', 'morgan_only_radius': 2, 'morgan_only_nBits': 1024, 'num_hidden_layers': 3, 'hidden_dim_0': 512, 'hidden_dim_1': 1024, 'hidden_dim_2': 512, 'kl_weight': 0.0002419323638216619, 'lr': 0.0031000103291833076, 'batch_size': 32, 'dropout_rate': 0.4839090674969119, 'prior_mu': 0.10083616324850397, 'prior_sigma': 0.10145207026520787, 'normalization': 'none'}. Best is trial 1281 with value: 0.5184582889080047.
Generating morgan fingerprints...
Generated fingerprints with 1024 features for 900 molecules
Data shape: X=(900, 1024), y=(900,)
Trial 1347: 5-fold CV loss = 0.6152
[I 2025-08-07 23:39:24,908] Trial 1347 finished with value: 0.6151712775230408 and parameters: {'fp_type': 'morgan', 'morgan_only_radius': 2, 'morgan_only_nBits': 1024, 'num_hidden_layers': 3, 'hidden_dim_0': 128, 'hidden_dim_1': 128, 'hidden_dim_2': 512, 'kl_weight': 0.0002290114241368146, 'lr': 0.0016732619383260585, 'batch_size': 32, 'dropout_rate': 0.482883363047475, 'prior_mu': 0.058657152943597, 'prior_sigma': 0.060876353657316855, 'normalization': 'none'}. Best is trial 1281 with value: 0.5184582889080047.
Generating morgan fingerprints...
Generated fingerprints with 1024 features for 900 molecules
Data shape: X=(900, 1024), y=(900,)
Trial 1350: 5-fold CV loss = 0.5337
[I 2025-08-07 23:40:17,948] Trial 1350 finished with value: 0.5336527526378632 and parameters: {'fp_type': 'morgan', 'morgan_only_radius': 2, 'morgan_only_nBits': 1024, 'num_hidden_layers': 3, 'hidden_dim_0': 512, 'hidden_dim_1': 128, 'hidden_dim_2': 512, 'kl_weight': 0.00020905840458218316, 'lr': 0.002691514483114147, 'batch_size': 32, 'dropout_rate': 0.4361423145557821, 'prior_mu': 0.059862944722295724, 'prior_sigma': 0.07020789429488218, 'normalization': 'none'}. Best is trial 1281 with value: 0.5184582889080047.
Generating morgan fingerprints...
Generated fingerprints with 1024 features for 900 molecules
Data shape: X=(900, 1024), y=(900,)
Trial 1346: 5-fold CV loss = 0.5450
[I 2025-08-07 23:40:28,936] Trial 1346 finished with value: 0.5450039148330689 and parameters: {'fp_type': 'morgan', 'morgan_only_radius': 2, 'morgan_only_nBits': 1024, 'num_hidden_layers': 3, 'hidden_dim_0': 128, 'hidden_dim_1': 128, 'hidden_dim_2': 512, 'kl_weight': 0.0002249633689264434, 'lr': 0.00294923548398967, 'batch_size': 32, 'dropout_rate': 0.48095789771528163, 'prior_mu': 0.0554573914379483, 'prior_sigma': 0.06141889816486743, 'normalization': 'none'}. Best is trial 1281 with value: 0.5184582889080047.
Generating morgan fingerprints...
Generated fingerprints with 1024 features for 900 molecules
Data shape: X=(900, 1024), y=(900,)
Trial 1351: 5-fold CV loss = 0.5326
[I 2025-08-07 23:40:37,122] Trial 1351 finished with value: 0.5326137483119965 and parameters: {'fp_type': 'morgan', 'morgan_only_radius': 2, 'morgan_only_nBits': 1024, 'num_hidden_layers': 3, 'hidden_dim_0': 512, 'hidden_dim_1': 128, 'hidden_dim_2': 512, 'kl_weight': 0.007468108531201609, 'lr': 0.0026712595875286265, 'batch_size': 32, 'dropout_rate': 0.4394308569387364, 'prior_mu': 0.03077385298999675, 'prior_sigma': 0.06953538762867606, 'normalization': 'none'}. Best is trial 1281 with value: 0.5184582889080047.
Generating morgan fingerprints...
Generated fingerprints with 1024 features for 900 molecules
Data shape: X=(900, 1024), y=(900,)
Trial 1353: 5-fold CV loss = 0.7483
[I 2025-08-07 23:40:42,177] Trial 1353 finished with value: 0.7483050465583801 and parameters: {'fp_type': 'morgan', 'morgan_only_radius': 2, 'morgan_only_nBits': 1024, 'num_hidden_layers': 3, 'hidden_dim_0': 512, 'hidden_dim_1': 128, 'hidden_dim_2': 512, 'kl_weight': 0.004925495821551192, 'lr': 0.0021392883101319896, 'batch_size': 128, 'dropout_rate': 0.4478871386837197, 'prior_mu': 0.03152951135951856, 'prior_sigma': 0.06688123452723442, 'normalization': 'none'}. Best is trial 1281 with value: 0.5184582889080047.
Generating morgan fingerprints...
Generated fingerprints with 1024 features for 900 molecules
Data shape: X=(900, 1024), y=(900,)
Trial 1354: 5-fold CV loss = 0.7034
