[I 2025-08-08 05:14:32,352] Trial 2267 finished with value: 0.5719495952129364 and parameters: {'fp_type': 'morgan', 'morgan_only_radius': 2, 'morgan_only_nBits': 2048, 'num_hidden_layers': 3, 'hidden_dim_0': 128, 'hidden_dim_1': 128, 'hidden_dim_2': 512, 'kl_weight': 0.0006088318287959736, 'lr': 0.0018329400047670003, 'batch_size': 32, 'dropout_rate': 0.4177588423867879, 'prior_mu': 0.06287074371783605, 'prior_sigma': 0.059193257831459074, 'normalization': 'none'}. Best is trial 1528 with value: 0.5170644640922546.
Generating morgan fingerprints...
Generated fingerprints with 2048 features for 900 molecules
Data shape: X=(900, 2048), y=(900,)
Trial 2268: 5-fold CV loss = 0.5561
[I 2025-08-08 05:15:10,782] Trial 2268 finished with value: 0.5561213910579681 and parameters: {'fp_type': 'morgan', 'morgan_only_radius': 2, 'morgan_only_nBits': 2048, 'num_hidden_layers': 3, 'hidden_dim_0': 128, 'hidden_dim_1': 128, 'hidden_dim_2': 512, 'kl_weight': 0.00045901188690773394, 'lr': 0.0017562596647497427, 'batch_size': 32, 'dropout_rate': 0.4034005251846547, 'prior_mu': 0.039455179615963135, 'prior_sigma': 0.061538213144214246, 'normalization': 'none'}. Best is trial 1528 with value: 0.5170644640922546.
Generating morgan fingerprints...
Generated fingerprints with 2048 features for 900 molecules
Data shape: X=(900, 2048), y=(900,)
Trial 2264: 5-fold CV loss = 0.5930
[I 2025-08-08 05:15:20,826] Trial 2264 finished with value: 0.5929525017738342 and parameters: {'fp_type': 'morgan', 'morgan_only_radius': 2, 'morgan_only_nBits': 2048, 'num_hidden_layers': 3, 'hidden_dim_0': 128, 'hidden_dim_1': 128, 'hidden_dim_2': 128, 'kl_weight': 0.0005850470757021509, 'lr': 0.0018071361077425488, 'batch_size': 32, 'dropout_rate': 0.4587615957293985, 'prior_mu': 0.06259140359760153, 'prior_sigma': 0.07533058985806086, 'normalization': 'none'}. Best is trial 1528 with value: 0.5170644640922546.
Generating morgan fingerprints...
Generated fingerprints with 2048 features for 900 molecules
Data shape: X=(900, 2048), y=(900,)
Trial 2269: 5-fold CV loss = 0.7012
[I 2025-08-08 05:15:40,000] Trial 2269 finished with value: 0.7012284159660339 and parameters: {'fp_type': 'morgan', 'morgan_only_radius': 2, 'morgan_only_nBits': 2048, 'num_hidden_layers': 3, 'hidden_dim_0': 512, 'hidden_dim_1': 128, 'hidden_dim_2': 256, 'kl_weight': 0.000469282970097097, 'lr': 0.0020082302977469293, 'batch_size': 32, 'dropout_rate': 0.4337984568826145, 'prior_mu': 0.03712812944711117, 'prior_sigma': 0.07462664550432825, 'normalization': 'none'}. Best is trial 1528 with value: 0.5170644640922546.
Generating morgan fingerprints...
Generated fingerprints with 2048 features for 900 molecules
Data shape: X=(900, 2048), y=(900,)
Trial 2272: 5-fold CV loss = 0.9318
[I 2025-08-08 05:16:03,440] Trial 2272 finished with value: 0.9317538857460022 and parameters: {'fp_type': 'morgan', 'morgan_only_radius': 2, 'morgan_only_nBits': 2048, 'num_hidden_layers': 3, 'hidden_dim_0': 512, 'hidden_dim_1': 128, 'hidden_dim_2': 512, 'kl_weight': 0.0001508589624676577, 'lr': 0.0009131615639350069, 'batch_size': 32, 'dropout_rate': 0.4417584581739387, 'prior_mu': 0.0259667360210177, 'prior_sigma': 0.0644950871051539, 'normalization': 'none'}. Best is trial 1528 with value: 0.5170644640922546.
Generating morgan fingerprints...
Generated fingerprints with 2048 features for 900 molecules
Data shape: X=(900, 2048), y=(900,)
Trial 2270: 5-fold CV loss = 0.5786
[I 2025-08-08 05:16:44,418] Trial 2270 finished with value: 0.5786066174507141 and parameters: {'fp_type': 'morgan', 'morgan_only_radius': 2, 'morgan_only_nBits': 2048, 'num_hidden_layers': 3, 'hidden_dim_0': 512, 'hidden_dim_1': 128, 'hidden_dim_2': 256, 'kl_weight': 0.000698999167578163, 'lr': 0.0019629592380213247, 'batch_size': 32, 'dropout_rate': 0.4335403967368742, 'prior_mu': 0.03372173813701274, 'prior_sigma': 0.07485072789770207, 'normalization': 'none'}. Best is trial 1528 with value: 0.5170644640922546.
Generating morgan fingerprints...
Generated fingerprints with 2048 features for 900 molecules
Data shape: X=(900, 2048), y=(900,)
Trial 2271: 5-fold CV loss = 0.9115
[I 2025-08-08 05:16:57,510] Trial 2271 finished with value: 0.9114708542823792 and parameters: {'fp_type': 'morgan', 'morgan_only_radius': 2, 'morgan_only_nBits': 2048, 'num_hidden_layers': 3, 'hidden_dim_0': 512, 'hidden_dim_1': 128, 'hidden_dim_2': 256, 'kl_weight': 0.00015590931568566422, 'lr': 0.001432741235384802, 'batch_size': 32, 'dropout_rate': 0.4323133911375663, 'prior_mu': 0.03560954867551594, 'prior_sigma': 0.09173572365424063, 'normalization': 'none'}. Best is trial 1528 with value: 0.5170644640922546.
Generating morgan fingerprints...
Generated fingerprints with 2048 features for 900 molecules
Data shape: X=(900, 2048), y=(900,)
Trial 2273: 5-fold CV loss = 0.6318
[I 2025-08-08 05:17:05,536] Trial 2273 finished with value: 0.6318313241004944 and parameters: {'fp_type': 'morgan', 'morgan_only_radius': 2, 'morgan_only_nBits': 2048, 'num_hidden_layers': 3, 'hidden_dim_0': 512, 'hidden_dim_1': 128, 'hidden_dim_2': 64, 'kl_weight': 0.000679427589733988, 'lr': 0.002394589995638743, 'batch_size': 32, 'dropout_rate': 0.42635254720749693, 'prior_mu': -0.13799586295715768, 'prior_sigma': 0.06624243478485767, 'normalization': 'none'}. Best is trial 1528 with value: 0.5170644640922546.
Generating morgan fingerprints...
Generated fingerprints with 2048 features for 900 molecules
Data shape: X=(900, 2048), y=(900,)
Trial 2274: 5-fold CV loss = 0.5932
[I 2025-08-08 05:17:40,922] Trial 2274 finished with value: 0.5932491481304168 and parameters: {'fp_type': 'morgan', 'morgan_only_radius': 2, 'morgan_only_nBits': 2048, 'num_hidden_layers': 3, 'hidden_dim_0': 512, 'hidden_dim_1': 64, 'hidden_dim_2': 64, 'kl_weight': 0.00097487435704037, 'lr': 0.00143156580939995, 'batch_size': 32, 'dropout_rate': 0.4244061275164789, 'prior_mu': 0.04628408618046078, 'prior_sigma': 0.06668413128149997, 'normalization': 'none'}. Best is trial 1528 with value: 0.5170644640922546.
Generating morgan fingerprints...
Generated fingerprints with 2048 features for 900 molecules
Data shape: X=(900, 2048), y=(900,)
Trial 2276: 5-fold CV loss = 0.5558
[I 2025-08-08 05:18:12,345] Trial 2276 finished with value: 0.5558203458786011 and parameters: {'fp_type': 'morgan', 'morgan_only_radius': 3, 'morgan_only_nBits': 2048, 'num_hidden_layers': 3, 'hidden_dim_0': 256, 'hidden_dim_1': 64, 'hidden_dim_2': 512, 'kl_weight': 0.0009352423968100235, 'lr': 0.0027559294904694093, 'batch_size': 32, 'dropout_rate': 0.3869202083409591, 'prior_mu': 0.04816058812488997, 'prior_sigma': 0.056482712787446425, 'normalization': 'none'}. Best is trial 1528 with value: 0.5170644640922546.
Generating morgan fingerprints...
Generated fingerprints with 2048 features for 900 molecules
Data shape: X=(900, 2048), y=(900,)
Trial 2278: 5-fold CV loss = 0.6197
[I 2025-08-08 05:18:18,149] Trial 2278 finished with value: 0.619685435295105 and parameters: {'fp_type': 'morgan', 'morgan_only_radius': 2, 'morgan_only_nBits': 2048, 'num_hidden_layers': 1, 'hidden_dim_0': 512, 'kl_weight': 0.0005611319070566024, 'lr': 0.0024715318436944354, 'batch_size': 128, 'dropout_rate': 0.4454542740156099, 'prior_mu': 0.021258243913008734, 'prior_sigma': 0.010914504217412385, 'normalization': 'none'}. Best is trial 1528 with value: 0.5170644640922546.
Generating morgan fingerprints...
Generated fingerprints with 2048 features for 900 molecules
Data shape: X=(900, 2048), y=(900,)
Trial 2266: 5-fold CV loss = 0.5619
[I 2025-08-08 05:18:18,800] Trial 2266 finished with value: 0.5618503749370575 and parameters: {'fp_type': 'morgan', 'morgan_only_radius': 2, 'morgan_only_nBits': 2048, 'num_hidden_layers': 3, 'hidden_dim_0': 128, 'hidden_dim_1': 128, 'hidden_dim_2': 512, 'kl_weight': 0.00015524393303291322, 'lr': 0.0018116339207138268, 'batch_size': 32, 'dropout_rate': 0.45734075645255456, 'prior_mu': 0.06413241986472419, 'prior_sigma': 0.05980261063791821, 'normalization': 'none'}. Best is trial 1528 with value: 0.5170644640922546.
Generating morgan fingerprints...
Generated fingerprints with 2048 features for 900 molecules
Data shape: X=(900, 2048), y=(900,)
Trial 2279: 5-fold CV loss = 0.6757
[I 2025-08-08 05:18:33,605] Trial 2279 finished with value: 0.6756640076637268 and parameters: {'fp_type': 'morgan', 'morgan_only_radius': 2, 'morgan_only_nBits': 2048, 'num_hidden_layers': 0, 'kl_weight': 0.0007101008968317938, 'lr': 0.0021853530292425464, 'batch_size': 32, 'dropout_rate': 0.4053347788746447, 'prior_mu': 0.056731193419553703, 'prior_sigma': 0.07179742119823977, 'normalization': 'none'}. Best is trial 1528 with value: 0.5170644640922546.
Generating morgan fingerprints...
Generated fingerprints with 2048 features for 900 molecules
Data shape: X=(900, 2048), y=(900,)
Trial 2275: 5-fold CV loss = 0.5454
[I 2025-08-08 05:18:38,281] Trial 2275 finished with value: 0.5453735947608948 and parameters: {'fp_type': 'morgan', 'morgan_only_radius': 2, 'morgan_only_nBits': 2048, 'num_hidden_layers': 3, 'hidden_dim_0': 256, 'hidden_dim_1': 64, 'hidden_dim_2': 64, 'kl_weight': 0.0009791242676926817, 'lr': 0.00245644997740145, 'batch_size': 32, 'dropout_rate': 0.42172999923076643, 'prior_mu': 0.04703735535929536, 'prior_sigma': 0.06602475869523447, 'normalization': 'none'}. Best is trial 1528 with value: 0.5170644640922546.
Generating morgan fingerprints...
Generated fingerprints with 2048 features for 900 molecules
Data shape: X=(900, 2048), y=(900,)
Trial 2282: 5-fold CV loss = 1.0276
[I 2025-08-08 05:18:57,554] Trial 2282 finished with value: 1.0276410460472107 and parameters: {'fp_type': 'morgan', 'morgan_only_radius': 2, 'morgan_only_nBits': 2048, 'num_hidden_layers': 3, 'hidden_dim_0': 512, 'hidden_dim_1': 128, 'hidden_dim_2': 512, 'kl_weight': 0.0005595453101061628, 'lr': 0.0020567659850673392, 'batch_size': 64, 'dropout_rate': 0.4451321539484411, 'prior_mu': 0.02698462294358324, 'prior_sigma': 0.07907864934430132, 'normalization': 'none'}. Best is trial 1528 with value: 0.5170644640922546.
Generating morgan fingerprints...
Generated fingerprints with 2048 features for 900 molecules
Data shape: X=(900, 2048), y=(900,)
Trial 2277: 5-fold CV loss = 0.5254
[I 2025-08-08 05:19:08,101] Trial 2277 finished with value: 0.5253721058368683 and parameters: {'fp_type': 'morgan', 'morgan_only_radius': 3, 'morgan_only_nBits': 2048, 'num_hidden_layers': 3, 'hidden_dim_0': 256, 'hidden_dim_1': 128, 'hidden_dim_2': 512, 'kl_weight': 0.0005645599366731483, 'lr': 0.0024927046027562, 'batch_size': 32, 'dropout_rate': 0.44892754584653594, 'prior_mu': 0.022121696404680067, 'prior_sigma': 0.0846094320078157, 'normalization': 'none'}. Best is trial 1528 with value: 0.5170644640922546.
Generating morgan fingerprints...
Generated fingerprints with 2048 features for 900 molecules
Data shape: X=(900, 2048), y=(900,)
Trial 2281: 5-fold CV loss = 0.5853
[I 2025-08-08 05:19:35,786] Trial 2281 finished with value: 0.5853267192840577 and parameters: {'fp_type': 'morgan', 'morgan_only_radius': 2, 'morgan_only_nBits': 2048, 'num_hidden_layers': 3, 'hidden_dim_0': 512, 'hidden_dim_1': 128, 'hidden_dim_2': 512, 'kl_weight': 0.0005716678237425008, 'lr': 0.0020289416263216172, 'batch_size': 32, 'dropout_rate': 0.41783538903446765, 'prior_mu': 0.04768577327590805, 'prior_sigma': 0.0788798225970832, 'normalization': 'none'}. Best is trial 1528 with value: 0.5170644640922546.
Generating morgan fingerprints...
Generated fingerprints with 2048 features for 900 molecules
Data shape: X=(900, 2048), y=(900,)
Trial 2284: 5-fold CV loss = 0.7347
[I 2025-08-08 05:20:12,016] Trial 2284 finished with value: 0.7346908450126648 and parameters: {'fp_type': 'morgan', 'morgan_only_radius': 2, 'morgan_only_nBits': 2048, 'num_hidden_layers': 3, 'hidden_dim_0': 512, 'hidden_dim_1': 128, 'hidden_dim_2': 512, 'kl_weight': 0.000784244652021711, 'lr': 0.0016865018829291174, 'batch_size': 32, 'dropout_rate': 0.4110377954902266, 'prior_mu': 0.05509879303969474, 'prior_sigma': 0.07127798882111508, 'normalization': 'none'}. Best is trial 1528 with value: 0.5170644640922546.
Generating morgan_rdkit fingerprints...
Generated fingerprints with 1536 features for 900 molecules
Data shape: X=(900, 1536), y=(900,)
Trial 2285: 5-fold CV loss = 0.7639
[I 2025-08-08 05:20:23,543] Trial 2285 finished with value: 0.7638592720031738 and parameters: {'fp_type': 'morgan', 'morgan_only_radius': 2, 'morgan_only_nBits': 2048, 'num_hidden_layers': 3, 'hidden_dim_0': 512, 'hidden_dim_1': 128, 'hidden_dim_2': 512, 'kl_weight': 0.00043607573228759375, 'lr': 0.001639274223288271, 'batch_size': 32, 'dropout_rate': 0.4359019878064316, 'prior_mu': 0.03743842549206979, 'prior_sigma': 0.0710126108384068, 'normalization': 'none'}. Best is trial 1528 with value: 0.5170644640922546.
Generating morgan_rdkit fingerprints...
Generated fingerprints with 1536 features for 900 molecules
Data shape: X=(900, 1536), y=(900,)
Trial 2283: 5-fold CV loss = 0.6239
[I 2025-08-08 05:21:23,692] Trial 2283 finished with value: 0.6239479899406433 and parameters: {'fp_type': 'morgan', 'morgan_only_radius': 2, 'morgan_only_nBits': 2048, 'num_hidden_layers': 3, 'hidden_dim_0': 512, 'hidden_dim_1': 128, 'hidden_dim_2': 512, 'kl_weight': 0.0004084299160609993, 'lr': 0.0016245952930073223, 'batch_size': 32, 'dropout_rate': 0.39712699587081085, 'prior_mu': 0.03846206447974686, 'prior_sigma': 0.07158597610674979, 'normalization': 'none'}. Best is trial 1528 with value: 0.5170644640922546.
Generating morgan_rdkit fingerprints...
Generated fingerprints with 1536 features for 900 molecules
Data shape: X=(900, 1536), y=(900,)
Trial 2286: 5-fold CV loss = 0.5831
[I 2025-08-08 05:21:27,362] Trial 2286 finished with value: 0.5831403613090516 and parameters: {'fp_type': 'morgan_rdkit', 'combined_morgan_radius': 2, 'combined_morgan_nBits': 512, 'combined_rdkit_maxPath': 6, 'combined_rdkit_nBits': 1024, 'num_hidden_layers': 3, 'hidden_dim_0': 512, 'hidden_dim_1': 128, 'hidden_dim_2': 512, 'kl_weight': 0.00041368406633472395, 'lr': 0.002252199733925661, 'batch_size': 32, 'dropout_rate': 0.3960383607909569, 'prior_mu': 0.03844314627010447, 'prior_sigma': 0.06235516626256875, 'normalization': 'none'}. Best is trial 1528 with value: 0.5170644640922546.
Generating morgan fingerprints...
Generated fingerprints with 2048 features for 900 molecules
Data shape: X=(900, 2048), y=(900,)
Trial 2280: 5-fold CV loss = 0.5210
[I 2025-08-08 05:21:53,561] Trial 2280 finished with value: 0.5209967613220214 and parameters: {'fp_type': 'morgan', 'morgan_only_radius': 2, 'morgan_only_nBits': 2048, 'num_hidden_layers': 3, 'hidden_dim_0': 512, 'hidden_dim_1': 128, 'hidden_dim_2': 512, 'kl_weight': 0.0007290134341454452, 'lr': 0.0021318908206636048, 'batch_size': 32, 'dropout_rate': 0.40631554983183493, 'prior_mu': 0.05541651437129177, 'prior_sigma': 0.07122217622247118, 'normalization': 'none'}. Best is trial 1528 with value: 0.5170644640922546.
Generating morgan fingerprints...
Generated fingerprints with 2048 features for 900 molecules
Data shape: X=(900, 2048), y=(900,)
Trial 2287: 5-fold CV loss = 0.5564
[I 2025-08-08 05:22:03,147] Trial 2287 finished with value: 0.5564347863197326 and parameters: {'fp_type': 'morgan_rdkit', 'combined_morgan_radius': 2, 'combined_morgan_nBits': 512, 'combined_rdkit_maxPath': 6, 'combined_rdkit_nBits': 1024, 'num_hidden_layers': 3, 'hidden_dim_0': 512, 'hidden_dim_1': 128, 'hidden_dim_2': 512, 'kl_weight': 0.0006710410399102917, 'lr': 0.0022764783271707768, 'batch_size': 32, 'dropout_rate': 0.43919041644992773, 'prior_mu': 0.040807049105342434, 'prior_sigma': 0.06259949287751136, 'normalization': 'none'}. Best is trial 1528 with value: 0.5170644640922546.
Generating morgan fingerprints...
Generated fingerprints with 2048 features for 900 molecules
Data shape: X=(900, 2048), y=(900,)
Trial 2289: 5-fold CV loss = 0.5280
[I 2025-08-08 05:22:32,859] Trial 2289 finished with value: 0.5280037343502044 and parameters: {'fp_type': 'morgan', 'morgan_only_radius': 2, 'morgan_only_nBits': 2048, 'num_hidden_layers': 3, 'hidden_dim_0': 512, 'hidden_dim_1': 64, 'hidden_dim_2': 256, 'kl_weight': 0.00032597585086619976, 'lr': 0.0033979110707062503, 'batch_size': 32, 'dropout_rate': 0.457696986369238, 'prior_mu': 0.0564024882281848, 'prior_sigma': 0.06333186061265597, 'normalization': 'none'}. Best is trial 1528 with value: 0.5170644640922546.
Generating morgan fingerprints...
Generated fingerprints with 2048 features for 900 molecules
Data shape: X=(900, 2048), y=(900,)
Trial 2291: 5-fold CV loss = 0.5305
[I 2025-08-08 05:22:58,907] Trial 2291 finished with value: 0.5305161476135254 and parameters: {'fp_type': 'morgan', 'morgan_only_radius': 2, 'morgan_only_nBits': 2048, 'num_hidden_layers': 3, 'hidden_dim_0': 1024, 'hidden_dim_1': 64, 'hidden_dim_2': 256, 'kl_weight': 0.0004973368561968859, 'lr': 0.0028821162113678105, 'batch_size': 32, 'dropout_rate': 0.4549578933265266, 'prior_mu': 0.03050001610331482, 'prior_sigma': 0.05770740345030935, 'normalization': 'none'}. Best is trial 1528 with value: 0.5170644640922546.
Generating morgan fingerprints...
Generated fingerprints with 2048 features for 900 molecules
Data shape: X=(900, 2048), y=(900,)
Trial 2293: 5-fold CV loss = 0.5827
[I 2025-08-08 05:23:40,442] Trial 2293 finished with value: 0.5827388942241669 and parameters: {'fp_type': 'morgan', 'morgan_only_radius': 2, 'morgan_only_nBits': 2048, 'num_hidden_layers': 3, 'hidden_dim_0': 512, 'hidden_dim_1': 128, 'hidden_dim_2': 512, 'kl_weight': 0.0008471464691860634, 'lr': 0.008941165907909413, 'batch_size': 32, 'dropout_rate': 0.4295185396418056, 'prior_mu': 0.06967998855194873, 'prior_sigma': 0.06852143307884741, 'normalization': 'none'}. Best is trial 1528 with value: 0.5170644640922546.
Generating morgan fingerprints...
Generated fingerprints with 2048 features for 900 molecules
Data shape: X=(900, 2048), y=(900,)
Trial 2292: 5-fold CV loss = 0.5664
[I 2025-08-08 05:23:41,148] Trial 2292 finished with value: 0.5664289474487305 and parameters: {'fp_type': 'morgan', 'morgan_only_radius': 2, 'morgan_only_nBits': 2048, 'num_hidden_layers': 3, 'hidden_dim_0': 1024, 'hidden_dim_1': 128, 'hidden_dim_2': 512, 'kl_weight': 0.0004913387317275961, 'lr': 0.0019192848784510353, 'batch_size': 32, 'dropout_rate': 0.4290716511327044, 'prior_mu': 0.029692900859375905, 'prior_sigma': 0.058055193630971946, 'normalization': 'none'}. Best is trial 1528 with value: 0.5170644640922546.
Generating morgan fingerprints...
Generated fingerprints with 2048 features for 900 molecules
Data shape: X=(900, 2048), y=(900,)
Trial 2288: 5-fold CV loss = 0.5661
[I 2025-08-08 05:23:56,210] Trial 2288 finished with value: 0.5660560905933381 and parameters: {'fp_type': 'morgan_rdkit', 'combined_morgan_radius': 2, 'combined_morgan_nBits': 512, 'combined_rdkit_maxPath': 6, 'combined_rdkit_nBits': 1024, 'num_hidden_layers': 3, 'hidden_dim_0': 512, 'hidden_dim_1': 128, 'hidden_dim_2': 256, 'kl_weight': 0.0006932984514814465, 'lr': 0.002209354054674167, 'batch_size': 32, 'dropout_rate': 0.45644136858182927, 'prior_mu': 0.031165116744394, 'prior_sigma': 0.06299833875526537, 'normalization': 'none'}. Best is trial 1528 with value: 0.5170644640922546.
Generating morgan fingerprints...
Generated fingerprints with 2048 features for 900 molecules
Data shape: X=(900, 2048), y=(900,)
Trial 2295: 5-fold CV loss = 0.6350
[I 2025-08-08 05:24:55,066] Trial 2295 finished with value: 0.6349993526935578 and parameters: {'fp_type': 'morgan', 'morgan_only_radius': 2, 'morgan_only_nBits': 2048, 'num_hidden_layers': 3, 'hidden_dim_0': 512, 'hidden_dim_1': 256, 'hidden_dim_2': 512, 'kl_weight': 0.0006158543895465292, 'lr': 0.0020195905811787058, 'batch_size': 32, 'dropout_rate': 0.44368861678837734, 'prior_mu': 0.10216493830558032, 'prior_sigma': 0.07533626569638771, 'normalization': 'none'}. Best is trial 1528 with value: 0.5170644640922546.
Generating morgan fingerprints...
Generated fingerprints with 2048 features for 900 molecules
Data shape: X=(900, 2048), y=(900,)
Trial 2294: 5-fold CV loss = 0.6763
[I 2025-08-08 05:24:58,706] Trial 2294 finished with value: 0.6763061463832856 and parameters: {'fp_type': 'morgan', 'morgan_only_radius': 2, 'morgan_only_nBits': 2048, 'num_hidden_layers': 3, 'hidden_dim_0': 512, 'hidden_dim_1': 256, 'hidden_dim_2': 512, 'kl_weight': 0.0006499966956665625, 'lr': 0.0019538611590831576, 'batch_size': 32, 'dropout_rate': 0.4416085573266989, 'prior_mu': -0.07409726892231028, 'prior_sigma': 0.07624079846579129, 'normalization': 'none'}. Best is trial 1528 with value: 0.5170644640922546.
Generating morgan fingerprints...
Generated fingerprints with 2048 features for 900 molecules
Data shape: X=(900, 2048), y=(900,)
Trial 2290: 5-fold CV loss = 0.5198
[I 2025-08-08 05:25:11,271] Trial 2290 finished with value: 0.519848644733429 and parameters: {'fp_type': 'morgan', 'morgan_only_radius': 2, 'morgan_only_nBits': 2048, 'num_hidden_layers': 3, 'hidden_dim_0': 512, 'hidden_dim_1': 64, 'hidden_dim_2': 256, 'kl_weight': 0.00033243318649420347, 'lr': 0.0033536401693645534, 'batch_size': 32, 'dropout_rate': 0.45690027774156977, 'prior_mu': 0.030233231949017704, 'prior_sigma': 0.06292584535590977, 'normalization': 'none'}. Best is trial 1528 with value: 0.5170644640922546.
Generating morgan fingerprints...
Generated fingerprints with 2048 features for 900 molecules
Data shape: X=(900, 2048), y=(900,)
Trial 2298: 5-fold CV loss = 0.5386
