[I 2025-08-07 17:27:26,804] Trial 366 finished with value: 0.8683729410171509 and parameters: {'fp_type': 'morgan', 'morgan_only_radius': 2, 'morgan_only_nBits': 1024, 'num_hidden_layers': 3, 'hidden_dim_0': 1024, 'hidden_dim_1': 1024, 'hidden_dim_2': 1024, 'kl_weight': 0.0005776509764285607, 'lr': 0.0018688120990481983, 'batch_size': 32, 'dropout_rate': 0.4338801602020382, 'prior_mu': -0.051929102839522345, 'prior_sigma': 0.06398622938867957, 'normalization': 'none'}. Best is trial 272 with value: 0.5198344707489013.
Generating morgan fingerprints...
Generated fingerprints with 1024 features for 900 molecules
Data shape: X=(900, 1024), y=(900,)
Trial 367: 5-fold CV loss = 0.5268
[I 2025-08-07 17:27:57,611] Trial 367 finished with value: 0.5267851531505585 and parameters: {'fp_type': 'morgan', 'morgan_only_radius': 2, 'morgan_only_nBits': 1024, 'num_hidden_layers': 3, 'hidden_dim_0': 512, 'hidden_dim_1': 128, 'hidden_dim_2': 512, 'kl_weight': 0.0002304742014673401, 'lr': 0.002266709396479899, 'batch_size': 32, 'dropout_rate': 0.4997593649001624, 'prior_mu': -0.05223182062358925, 'prior_sigma': 0.06343386537673062, 'normalization': 'none'}. Best is trial 272 with value: 0.5198344707489013.
Generating morgan fingerprints...
Generated fingerprints with 1024 features for 900 molecules
Data shape: X=(900, 1024), y=(900,)
Trial 370: 5-fold CV loss = 0.5391
[I 2025-08-07 17:28:10,236] Trial 370 finished with value: 0.5390997350215911 and parameters: {'fp_type': 'morgan', 'morgan_only_radius': 2, 'morgan_only_nBits': 1024, 'num_hidden_layers': 3, 'hidden_dim_0': 512, 'hidden_dim_1': 128, 'hidden_dim_2': 128, 'kl_weight': 0.0009628973948873617, 'lr': 0.0026538877624698574, 'batch_size': 32, 'dropout_rate': 0.49123982353609214, 'prior_mu': -0.0519689482763147, 'prior_sigma': 0.05305869441349445, 'normalization': 'layer'}. Best is trial 272 with value: 0.5198344707489013.
Generating morgan fingerprints...
Generated fingerprints with 1024 features for 900 molecules
Data shape: X=(900, 1024), y=(900,)
Trial 368: 5-fold CV loss = 0.5260
[I 2025-08-07 17:28:27,406] Trial 368 finished with value: 0.5260096251964569 and parameters: {'fp_type': 'morgan', 'morgan_only_radius': 2, 'morgan_only_nBits': 1024, 'num_hidden_layers': 3, 'hidden_dim_0': 512, 'hidden_dim_1': 128, 'hidden_dim_2': 512, 'kl_weight': 0.0006860398547529552, 'lr': 0.002628832984037094, 'batch_size': 32, 'dropout_rate': 0.4927984298376708, 'prior_mu': -0.046657109420467344, 'prior_sigma': 0.06383796840633531, 'normalization': 'none'}. Best is trial 272 with value: 0.5198344707489013.
Generating morgan fingerprints...
Generated fingerprints with 1024 features for 900 molecules
Data shape: X=(900, 1024), y=(900,)
Trial 372: 5-fold CV loss = 0.5234
[I 2025-08-07 17:29:29,369] Trial 372 finished with value: 0.523410540819168 and parameters: {'fp_type': 'morgan', 'morgan_only_radius': 2, 'morgan_only_nBits': 1024, 'num_hidden_layers': 3, 'hidden_dim_0': 512, 'hidden_dim_1': 128, 'hidden_dim_2': 512, 'kl_weight': 0.00022414189012782724, 'lr': 0.0022528215156319017, 'batch_size': 32, 'dropout_rate': 0.49859985562985676, 'prior_mu': -0.025164505536224756, 'prior_sigma': 0.062400342401342145, 'normalization': 'none'}. Best is trial 272 with value: 0.5198344707489013.
Generating morgan fingerprints...
Generated fingerprints with 1024 features for 900 molecules
Data shape: X=(900, 1024), y=(900,)
Trial 369: 5-fold CV loss = 0.5452
[I 2025-08-07 17:29:29,777] Trial 369 finished with value: 0.5452261865139008 and parameters: {'fp_type': 'morgan', 'morgan_only_radius': 2, 'morgan_only_nBits': 1024, 'num_hidden_layers': 3, 'hidden_dim_0': 512, 'hidden_dim_1': 1024, 'hidden_dim_2': 128, 'kl_weight': 0.0006011010262774261, 'lr': 0.002669706094613824, 'batch_size': 32, 'dropout_rate': 0.4913417739209179, 'prior_mu': -0.051796947187300574, 'prior_sigma': 0.052565502244711196, 'normalization': 'layer'}. Best is trial 272 with value: 0.5198344707489013.
Generating morgan fingerprints...
Generated fingerprints with 1024 features for 900 molecules
Data shape: X=(900, 1024), y=(900,)
Trial 371: 5-fold CV loss = 0.5396
[I 2025-08-07 17:29:39,111] Trial 371 finished with value: 0.539632397890091 and parameters: {'fp_type': 'morgan', 'morgan_only_radius': 2, 'morgan_only_nBits': 1024, 'num_hidden_layers': 3, 'hidden_dim_0': 512, 'hidden_dim_1': 128, 'hidden_dim_2': 512, 'kl_weight': 0.002042786861873612, 'lr': 0.0021076479754024175, 'batch_size': 32, 'dropout_rate': 0.4990200967296179, 'prior_mu': -0.04660659264184824, 'prior_sigma': 0.054454095150096665, 'normalization': 'none'}. Best is trial 272 with value: 0.5198344707489013.
Generating morgan fingerprints...
Generated fingerprints with 1024 features for 900 molecules
Data shape: X=(900, 1024), y=(900,)
Trial 376: 5-fold CV loss = 1.1124
[I 2025-08-07 17:30:12,533] Trial 376 finished with value: 1.1124151468276977 and parameters: {'fp_type': 'morgan', 'morgan_only_radius': 2, 'morgan_only_nBits': 1024, 'num_hidden_layers': 3, 'hidden_dim_0': 512, 'hidden_dim_1': 128, 'hidden_dim_2': 512, 'kl_weight': 0.000700068930817038, 'lr': 0.0014657782533007342, 'batch_size': 32, 'dropout_rate': 0.49905218460621215, 'prior_mu': -0.024844876121579276, 'prior_sigma': 0.06413883992209991, 'normalization': 'none'}. Best is trial 272 with value: 0.5198344707489013.
Generating morgan fingerprints...
Generated fingerprints with 1024 features for 900 molecules
Data shape: X=(900, 1024), y=(900,)
Trial 374: 5-fold CV loss = 0.5310
[I 2025-08-07 17:30:52,233] Trial 374 finished with value: 0.5310235619544983 and parameters: {'fp_type': 'morgan', 'morgan_only_radius': 2, 'morgan_only_nBits': 1024, 'num_hidden_layers': 3, 'hidden_dim_0': 512, 'hidden_dim_1': 128, 'hidden_dim_2': 512, 'kl_weight': 0.0001736049504717245, 'lr': 0.002094819707107877, 'batch_size': 32, 'dropout_rate': 0.49848182349799347, 'prior_mu': -0.024970461965788785, 'prior_sigma': 0.0627509612074817, 'normalization': 'none'}. Best is trial 272 with value: 0.5198344707489013.
Generating morgan fingerprints...
Generated fingerprints with 1024 features for 900 molecules
Data shape: X=(900, 1024), y=(900,)
Trial 373: 5-fold CV loss = 0.5304
[I 2025-08-07 17:30:53,175] Trial 373 finished with value: 0.5304244935512543 and parameters: {'fp_type': 'morgan', 'morgan_only_radius': 2, 'morgan_only_nBits': 1024, 'num_hidden_layers': 3, 'hidden_dim_0': 512, 'hidden_dim_1': 128, 'hidden_dim_2': 512, 'kl_weight': 0.0006856936935073223, 'lr': 0.0020866369449788974, 'batch_size': 32, 'dropout_rate': 0.49822755943089575, 'prior_mu': -0.026019165955449987, 'prior_sigma': 0.06406534439297354, 'normalization': 'none'}. Best is trial 272 with value: 0.5198344707489013.
Generating morgan fingerprints...
Generated fingerprints with 1024 features for 900 molecules
Data shape: X=(900, 1024), y=(900,)
Trial 377: 5-fold CV loss = 0.5671
[I 2025-08-07 17:31:06,560] Trial 377 finished with value: 0.567094874382019 and parameters: {'fp_type': 'morgan', 'morgan_only_radius': 2, 'morgan_only_nBits': 1024, 'num_hidden_layers': 3, 'hidden_dim_0': 512, 'hidden_dim_1': 128, 'hidden_dim_2': 512, 'kl_weight': 0.0007976996972205503, 'lr': 0.0021196081101248114, 'batch_size': 32, 'dropout_rate': 0.48645030823157914, 'prior_mu': -0.025500606444515565, 'prior_sigma': 0.012408969457402955, 'normalization': 'none'}. Best is trial 272 with value: 0.5198344707489013.
Generating morgan fingerprints...
Generated fingerprints with 1024 features for 900 molecules
Data shape: X=(900, 1024), y=(900,)
Trial 378: 5-fold CV loss = 0.5473
[I 2025-08-07 17:32:11,770] Trial 378 finished with value: 0.5472525656223297 and parameters: {'fp_type': 'morgan', 'morgan_only_radius': 2, 'morgan_only_nBits': 1024, 'num_hidden_layers': 3, 'hidden_dim_0': 512, 'hidden_dim_1': 128, 'hidden_dim_2': 512, 'kl_weight': 0.00017257397417546038, 'lr': 0.00203871072506769, 'batch_size': 32, 'dropout_rate': 0.49981764210046864, 'prior_mu': -0.0207462198465066, 'prior_sigma': 0.06902411869780387, 'normalization': 'none'}. Best is trial 272 with value: 0.5198344707489013.
Generating morgan fingerprints...
Generated fingerprints with 1024 features for 900 molecules
Data shape: X=(900, 1024), y=(900,)
Trial 380: 5-fold CV loss = 0.5619
[I 2025-08-07 17:32:32,495] Trial 380 finished with value: 0.5618880867958069 and parameters: {'fp_type': 'morgan', 'morgan_only_radius': 2, 'morgan_only_nBits': 1024, 'num_hidden_layers': 3, 'hidden_dim_0': 64, 'hidden_dim_1': 128, 'hidden_dim_2': 512, 'kl_weight': 0.0006770927927817211, 'lr': 0.0019519932993983017, 'batch_size': 32, 'dropout_rate': 0.4983282306669807, 'prior_mu': -0.01961182731137774, 'prior_sigma': 0.06889449454146634, 'normalization': 'none'}. Best is trial 272 with value: 0.5198344707489013.
Generating morgan fingerprints...
Generated fingerprints with 1024 features for 900 molecules
Data shape: X=(900, 1024), y=(900,)
Trial 375: 5-fold CV loss = 1.1689
[I 2025-08-07 17:33:12,886] Trial 375 finished with value: 1.1688552796840668 and parameters: {'fp_type': 'morgan', 'morgan_only_radius': 2, 'morgan_only_nBits': 1024, 'num_hidden_layers': 3, 'hidden_dim_0': 512, 'hidden_dim_1': 128, 'hidden_dim_2': 512, 'kl_weight': 0.0006954605449971797, 'lr': 0.001967846706356044, 'batch_size': 32, 'dropout_rate': 0.49798030843946606, 'prior_mu': -0.042867953164793506, 'prior_sigma': 0.13083239342268535, 'normalization': 'none'}. Best is trial 272 with value: 0.5198344707489013.
Generating morgan fingerprints...
Generated fingerprints with 1024 features for 900 molecules
Data shape: X=(900, 1024), y=(900,)
Trial 381: 5-fold CV loss = 0.5650
[I 2025-08-07 17:33:23,619] Trial 381 finished with value: 0.5649649322032928 and parameters: {'fp_type': 'morgan', 'morgan_only_radius': 2, 'morgan_only_nBits': 1024, 'num_hidden_layers': 3, 'hidden_dim_0': 64, 'hidden_dim_1': 128, 'hidden_dim_2': 512, 'kl_weight': 0.0006969873169654783, 'lr': 0.0019482652898323927, 'batch_size': 32, 'dropout_rate': 0.4926183353548026, 'prior_mu': -0.023947871739237445, 'prior_sigma': 0.06608219100834054, 'normalization': 'none'}. Best is trial 272 with value: 0.5198344707489013.
Generating morgan fingerprints...
Generated fingerprints with 1024 features for 900 molecules
Data shape: X=(900, 1024), y=(900,)
Trial 379: 5-fold CV loss = 0.5280
[I 2025-08-07 17:33:46,924] Trial 379 finished with value: 0.5280336618423462 and parameters: {'fp_type': 'morgan', 'morgan_only_radius': 2, 'morgan_only_nBits': 1024, 'num_hidden_layers': 3, 'hidden_dim_0': 512, 'hidden_dim_1': 128, 'hidden_dim_2': 512, 'kl_weight': 0.0006882802235227629, 'lr': 0.0020863058434949476, 'batch_size': 32, 'dropout_rate': 0.4978380532595202, 'prior_mu': -0.026262436764429645, 'prior_sigma': 0.07011836523776228, 'normalization': 'none'}. Best is trial 272 with value: 0.5198344707489013.
Generating morgan fingerprints...
Generated fingerprints with 1024 features for 900 molecules
Data shape: X=(900, 1024), y=(900,)
Trial 382: 5-fold CV loss = 0.5251
[I 2025-08-07 17:34:29,702] Trial 382 finished with value: 0.5250707864761353 and parameters: {'fp_type': 'morgan', 'morgan_only_radius': 2, 'morgan_only_nBits': 1024, 'num_hidden_layers': 3, 'hidden_dim_0': 512, 'hidden_dim_1': 128, 'hidden_dim_2': 512, 'kl_weight': 0.00023227990927363022, 'lr': 0.0017751132652330005, 'batch_size': 32, 'dropout_rate': 0.48382908865823787, 'prior_mu': -0.023267842704133533, 'prior_sigma': 0.06531053651833352, 'normalization': 'none'}. Best is trial 272 with value: 0.5198344707489013.
Generating morgan fingerprints...
Generated fingerprints with 1024 features for 900 molecules
Data shape: X=(900, 1024), y=(900,)
Trial 384: 5-fold CV loss = 0.6121
[I 2025-08-07 17:34:31,258] Trial 384 finished with value: 0.6121264219284057 and parameters: {'fp_type': 'morgan', 'morgan_only_radius': 2, 'morgan_only_nBits': 1024, 'num_hidden_layers': 3, 'hidden_dim_0': 512, 'hidden_dim_1': 128, 'hidden_dim_2': 512, 'kl_weight': 0.00022189119099405718, 'lr': 0.0017186340403889157, 'batch_size': 32, 'dropout_rate': 0.4996533153655979, 'prior_mu': -0.029372663509685225, 'prior_sigma': 0.0635042869676901, 'normalization': 'none'}. Best is trial 272 with value: 0.5198344707489013.
Generating morgan fingerprints...
Generated fingerprints with 1024 features for 900 molecules
Data shape: X=(900, 1024), y=(900,)
Trial 385: 5-fold CV loss = 0.5486
[I 2025-08-07 17:35:46,195] Trial 385 finished with value: 0.5486329853534698 and parameters: {'fp_type': 'morgan', 'morgan_only_radius': 2, 'morgan_only_nBits': 1024, 'num_hidden_layers': 3, 'hidden_dim_0': 512, 'hidden_dim_1': 128, 'hidden_dim_2': 512, 'kl_weight': 0.0005729291299275812, 'lr': 0.0016634218888563707, 'batch_size': 32, 'dropout_rate': 0.48704312823815316, 'prior_mu': -0.023340555928136057, 'prior_sigma': 0.02854984571597921, 'normalization': 'none'}. Best is trial 272 with value: 0.5198344707489013.
Generating morgan fingerprints...
Generated fingerprints with 1024 features for 900 molecules
Data shape: X=(900, 1024), y=(900,)
Trial 386: 5-fold CV loss = 0.5706
[I 2025-08-07 17:35:47,647] Trial 386 finished with value: 0.5705513954162598 and parameters: {'fp_type': 'morgan', 'morgan_only_radius': 2, 'morgan_only_nBits': 1024, 'num_hidden_layers': 3, 'hidden_dim_0': 512, 'hidden_dim_1': 128, 'hidden_dim_2': 512, 'kl_weight': 0.00019400051445866832, 'lr': 0.0017067040621319759, 'batch_size': 32, 'dropout_rate': 0.48409438920926345, 'prior_mu': -0.02685335419050213, 'prior_sigma': 0.06973331593852843, 'normalization': 'none'}. Best is trial 272 with value: 0.5198344707489013.
Generating morgan fingerprints...
Generated fingerprints with 1024 features for 900 molecules
Data shape: X=(900, 1024), y=(900,)
Trial 387: 5-fold CV loss = 0.5857
[I 2025-08-07 17:35:48,160] Trial 387 finished with value: 0.5857106804847717 and parameters: {'fp_type': 'morgan', 'morgan_only_radius': 2, 'morgan_only_nBits': 1024, 'num_hidden_layers': 3, 'hidden_dim_0': 512, 'hidden_dim_1': 128, 'hidden_dim_2': 512, 'kl_weight': 0.0005590229116614827, 'lr': 0.0017732646645917235, 'batch_size': 32, 'dropout_rate': 0.4834453561904066, 'prior_mu': -0.015278242698071359, 'prior_sigma': 0.06979812702638011, 'normalization': 'none'}. Best is trial 272 with value: 0.5198344707489013.
Generating morgan fingerprints...
Generated fingerprints with 1024 features for 900 molecules
Data shape: X=(900, 1024), y=(900,)
Trial 390: 5-fold CV loss = 0.6482
[I 2025-08-07 17:36:52,504] Trial 390 finished with value: 0.648246967792511 and parameters: {'fp_type': 'morgan', 'morgan_only_radius': 2, 'morgan_only_nBits': 1024, 'num_hidden_layers': 3, 'hidden_dim_0': 512, 'hidden_dim_1': 128, 'hidden_dim_2': 512, 'kl_weight': 0.00016926960396083468, 'lr': 0.002114612533981677, 'batch_size': 32, 'dropout_rate': 0.48047257734338095, 'prior_mu': -0.013855974548885153, 'prior_sigma': 0.19701964676148154, 'normalization': 'none'}. Best is trial 272 with value: 0.5198344707489013.
Generating morgan fingerprints...
Generated fingerprints with 1024 features for 900 molecules
Data shape: X=(900, 1024), y=(900,)
Trial 389: 5-fold CV loss = 0.5769
[I 2025-08-07 17:36:59,928] Trial 389 finished with value: 0.5769049286842346 and parameters: {'fp_type': 'morgan', 'morgan_only_radius': 2, 'morgan_only_nBits': 1024, 'num_hidden_layers': 3, 'hidden_dim_0': 512, 'hidden_dim_1': 128, 'hidden_dim_2': 512, 'kl_weight': 0.0008689466151011585, 'lr': 0.0018767399377184197, 'batch_size': 32, 'dropout_rate': 0.11011005271449781, 'prior_mu': -0.02513139130751832, 'prior_sigma': 0.06615169926895556, 'normalization': 'none'}. Best is trial 272 with value: 0.5198344707489013.
Generating morgan fingerprints...
Generated fingerprints with 1024 features for 900 molecules
Data shape: X=(900, 1024), y=(900,)
Trial 391: 5-fold CV loss = 0.8980
[I 2025-08-07 17:37:19,776] Trial 391 finished with value: 0.8980238795280456 and parameters: {'fp_type': 'morgan', 'morgan_only_radius': 2, 'morgan_only_nBits': 1024, 'num_hidden_layers': 3, 'hidden_dim_0': 512, 'hidden_dim_1': 128, 'hidden_dim_2': 512, 'kl_weight': 0.0006316099172118982, 'lr': 0.0013958328920065841, 'batch_size': 32, 'dropout_rate': 0.4815678652790006, 'prior_mu': -0.029738130463997245, 'prior_sigma': 0.06598165904211004, 'normalization': 'none'}. Best is trial 272 with value: 0.5198344707489013.
Generating morgan fingerprints...
Generated fingerprints with 1024 features for 900 molecules
Data shape: X=(900, 1024), y=(900,)
Trial 383: 5-fold CV loss = 0.6511
[I 2025-08-07 17:37:23,371] Trial 383 finished with value: 0.651117742061615 and parameters: {'fp_type': 'morgan', 'morgan_only_radius': 2, 'morgan_only_nBits': 1024, 'num_hidden_layers': 3, 'hidden_dim_0': 512, 'hidden_dim_1': 128, 'hidden_dim_2': 512, 'kl_weight': 0.000177399763898145, 'lr': 0.0016378646062260923, 'batch_size': 32, 'dropout_rate': 0.4844984389578109, 'prior_mu': -0.02698508914035578, 'prior_sigma': 0.06353997955316783, 'normalization': 'none'}. Best is trial 272 with value: 0.5198344707489013.
Generating morgan fingerprints...
Generated fingerprints with 1024 features for 900 molecules
Data shape: X=(900, 1024), y=(900,)
Trial 388: 5-fold CV loss = 0.5852
[I 2025-08-07 17:37:32,929] Trial 388 finished with value: 0.5851885318756104 and parameters: {'fp_type': 'morgan', 'morgan_only_radius': 2, 'morgan_only_nBits': 1024, 'num_hidden_layers': 3, 'hidden_dim_0': 512, 'hidden_dim_1': 128, 'hidden_dim_2': 512, 'kl_weight': 0.0008980393834133101, 'lr': 0.0015953259551002997, 'batch_size': 32, 'dropout_rate': 0.12925377501589888, 'prior_mu': -0.0150813662949796, 'prior_sigma': 0.06878955406973186, 'normalization': 'none'}. Best is trial 272 with value: 0.5198344707489013.
Generating morgan fingerprints...
Generated fingerprints with 1024 features for 900 molecules
Data shape: X=(900, 1024), y=(900,)
Trial 393: 5-fold CV loss = 0.5269
[I 2025-08-07 17:38:37,927] Trial 393 finished with value: 0.5269360601902008 and parameters: {'fp_type': 'morgan', 'morgan_only_radius': 2, 'morgan_only_nBits': 1024, 'num_hidden_layers': 3, 'hidden_dim_0': 512, 'hidden_dim_1': 128, 'hidden_dim_2': 512, 'kl_weight': 0.004233554003380318, 'lr': 0.002244415597862475, 'batch_size': 32, 'dropout_rate': 0.4998809082557218, 'prior_mu': -0.01643735372490117, 'prior_sigma': 0.06250993647226172, 'normalization': 'none'}. Best is trial 272 with value: 0.5198344707489013.
Generating morgan fingerprints...
Generated fingerprints with 1024 features for 900 molecules
Data shape: X=(900, 1024), y=(900,)
Trial 392: 5-fold CV loss = 0.6234
[I 2025-08-07 17:38:38,658] Trial 392 finished with value: 0.6234289169311523 and parameters: {'fp_type': 'morgan', 'morgan_only_radius': 2, 'morgan_only_nBits': 1024, 'num_hidden_layers': 3, 'hidden_dim_0': 512, 'hidden_dim_1': 128, 'hidden_dim_2': 512, 'kl_weight': 0.0007629220632524732, 'lr': 0.0016057221772632997, 'batch_size': 32, 'dropout_rate': 0.47976272257711866, 'prior_mu': -0.03284890193700733, 'prior_sigma': 0.06455465946061859, 'normalization': 'none'}. Best is trial 272 with value: 0.5198344707489013.
Generating morgan fingerprints...
Generated fingerprints with 1024 features for 900 molecules
Data shape: X=(900, 1024), y=(900,)
Trial 396: 5-fold CV loss = 0.5267
[I 2025-08-07 17:40:02,626] Trial 396 finished with value: 0.5266569435596467 and parameters: {'fp_type': 'morgan', 'morgan_only_radius': 2, 'morgan_only_nBits': 1024, 'num_hidden_layers': 3, 'hidden_dim_0': 512, 'hidden_dim_1': 128, 'hidden_dim_2': 512, 'kl_weight': 0.0035991822155568096, 'lr': 0.00223455293260118, 'batch_size': 32, 'dropout_rate': 0.47587516633108995, 'prior_mu': -0.009283212687067721, 'prior_sigma': 0.06159301977427931, 'normalization': 'none'}. Best is trial 272 with value: 0.5198344707489013.
Generating morgan fingerprints...
Generated fingerprints with 1024 features for 900 molecules
Data shape: X=(900, 1024), y=(900,)
Trial 395: 5-fold CV loss = 0.5222
[I 2025-08-07 17:40:15,964] Trial 395 finished with value: 0.5221964001655579 and parameters: {'fp_type': 'morgan', 'morgan_only_radius': 2, 'morgan_only_nBits': 1024, 'num_hidden_layers': 3, 'hidden_dim_0': 512, 'hidden_dim_1': 128, 'hidden_dim_2': 512, 'kl_weight': 0.000282351009286395, 'lr': 0.0022386025082271454, 'batch_size': 32, 'dropout_rate': 0.49973830498823174, 'prior_mu': -0.035509770019738304, 'prior_sigma': 0.06164181223215753, 'normalization': 'none'}. Best is trial 272 with value: 0.5198344707489013.
Generating morgan fingerprints...
Generated fingerprints with 1024 features for 900 molecules
Data shape: X=(900, 1024), y=(900,)
Trial 397: 5-fold CV loss = 0.5453
[I 2025-08-07 17:40:25,456] Trial 397 finished with value: 0.5453406274318695 and parameters: {'fp_type': 'morgan', 'morgan_only_radius': 2, 'morgan_only_nBits': 1024, 'num_hidden_layers': 3, 'hidden_dim_0': 128, 'hidden_dim_1': 128, 'hidden_dim_2': 512, 'kl_weight': 0.0030389312096898227, 'lr': 0.0022975342709468, 'batch_size': 32, 'dropout_rate': 0.48981266579194255, 'prior_mu': -0.0067573872461763, 'prior_sigma': 0.06146387207219245, 'normalization': 'none'}. Best is trial 272 with value: 0.5198344707489013.
Generating morgan fingerprints...
Generated fingerprints with 1024 features for 900 molecules
Data shape: X=(900, 1024), y=(900,)
Trial 398: 5-fold CV loss = 0.5267
[I 2025-08-07 17:41:23,609] Trial 398 finished with value: 0.5267320573329926 and parameters: {'fp_type': 'morgan', 'morgan_only_radius': 2, 'morgan_only_nBits': 1024, 'num_hidden_layers': 3, 'hidden_dim_0': 512, 'hidden_dim_1': 128, 'hidden_dim_2': 512, 'kl_weight': 0.0029236772382841805, 'lr': 0.002223410303422469, 'batch_size': 32, 'dropout_rate': 0.46899703797130554, 'prior_mu': -0.003887354729424034, 'prior_sigma': 0.06020527457492864, 'normalization': 'none'}. Best is trial 272 with value: 0.5198344707489013.
Generating morgan fingerprints...
Generated fingerprints with 1024 features for 900 molecules
Data shape: X=(900, 1024), y=(900,)
Trial 400: 5-fold CV loss = 0.5298
