[I 2025-08-07 23:18:33,106] Trial 1289 finished with value: 0.5764204263687134 and parameters: {'fp_type': 'morgan', 'morgan_only_radius': 2, 'morgan_only_nBits': 2048, 'num_hidden_layers': 3, 'hidden_dim_0': 512, 'hidden_dim_1': 128, 'hidden_dim_2': 512, 'kl_weight': 0.00015490066959404246, 'lr': 0.001695823713768722, 'batch_size': 32, 'dropout_rate': 0.4665570648254396, 'prior_mu': 0.07352294553946975, 'prior_sigma': 0.056636174879390516, 'normalization': 'none'}. Best is trial 1281 with value: 0.5184582889080047.
Generating morgan fingerprints...
Generated fingerprints with 1024 features for 900 molecules
Data shape: X=(900, 1024), y=(900,)
Trial 1290: 5-fold CV loss = 0.7461
[I 2025-08-07 23:19:01,856] Trial 1290 finished with value: 0.7461062371730804 and parameters: {'fp_type': 'morgan', 'morgan_only_radius': 2, 'morgan_only_nBits': 2048, 'num_hidden_layers': 3, 'hidden_dim_0': 512, 'hidden_dim_1': 128, 'hidden_dim_2': 512, 'kl_weight': 0.00016851340123385183, 'lr': 0.0012676324255074666, 'batch_size': 32, 'dropout_rate': 0.46408607252630807, 'prior_mu': 0.05547435495261031, 'prior_sigma': 0.05758312371361308, 'normalization': 'none'}. Best is trial 1281 with value: 0.5184582889080047.
Generating morgan fingerprints...
Generated fingerprints with 1024 features for 900 molecules
Data shape: X=(900, 1024), y=(900,)
Trial 1293: 5-fold CV loss = 0.6519
[I 2025-08-07 23:19:09,973] Trial 1293 finished with value: 0.6518570423126221 and parameters: {'fp_type': 'morgan', 'morgan_only_radius': 2, 'morgan_only_nBits': 1024, 'num_hidden_layers': 3, 'hidden_dim_0': 512, 'hidden_dim_1': 128, 'hidden_dim_2': 512, 'kl_weight': 0.00021704439782020677, 'lr': 0.001226619770877607, 'batch_size': 32, 'dropout_rate': 0.49981439571584646, 'prior_mu': 0.0470737132927722, 'prior_sigma': 0.03574584810310087, 'normalization': 'none'}. Best is trial 1281 with value: 0.5184582889080047.
Generating morgan fingerprints...
Generated fingerprints with 1024 features for 900 molecules
Data shape: X=(900, 1024), y=(900,)
Trial 1291: 5-fold CV loss = 0.7726
[I 2025-08-07 23:19:25,790] Trial 1291 finished with value: 0.7725902438163758 and parameters: {'fp_type': 'morgan', 'morgan_only_radius': 2, 'morgan_only_nBits': 1024, 'num_hidden_layers': 3, 'hidden_dim_0': 512, 'hidden_dim_1': 128, 'hidden_dim_2': 512, 'kl_weight': 0.00014182585700446063, 'lr': 0.0012479257244373695, 'batch_size': 32, 'dropout_rate': 0.4650505361057255, 'prior_mu': 0.06863910207587051, 'prior_sigma': 0.057710011037368586, 'normalization': 'none'}. Best is trial 1281 with value: 0.5184582889080047.
Generating morgan fingerprints...
Generated fingerprints with 1024 features for 900 molecules
Data shape: X=(900, 1024), y=(900,)
Trial 1292: 5-fold CV loss = 0.7083
[I 2025-08-07 23:19:56,987] Trial 1292 finished with value: 0.708254086971283 and parameters: {'fp_type': 'morgan', 'morgan_only_radius': 2, 'morgan_only_nBits': 1024, 'num_hidden_layers': 3, 'hidden_dim_0': 512, 'hidden_dim_1': 128, 'hidden_dim_2': 512, 'kl_weight': 0.00016888286106326165, 'lr': 0.0013587997865478884, 'batch_size': 32, 'dropout_rate': 0.4653013423575778, 'prior_mu': 0.06776207003550563, 'prior_sigma': 0.057614337809474926, 'normalization': 'none'}. Best is trial 1281 with value: 0.5184582889080047.
Generating morgan fingerprints...
Generated fingerprints with 1024 features for 900 molecules
Data shape: X=(900, 1024), y=(900,)
Trial 1295: 5-fold CV loss = 0.5621
[I 2025-08-07 23:20:28,973] Trial 1295 finished with value: 0.5621413290500641 and parameters: {'fp_type': 'morgan', 'morgan_only_radius': 2, 'morgan_only_nBits': 1024, 'num_hidden_layers': 3, 'hidden_dim_0': 512, 'hidden_dim_1': 128, 'hidden_dim_2': 512, 'kl_weight': 0.00020644878704399776, 'lr': 0.0017621194969708225, 'batch_size': 32, 'dropout_rate': 0.4741359795230689, 'prior_mu': 0.06750253376450514, 'prior_sigma': 0.05889296369670355, 'normalization': 'none'}. Best is trial 1281 with value: 0.5184582889080047.
Generating morgan fingerprints...
Generated fingerprints with 2048 features for 900 molecules
Data shape: X=(900, 2048), y=(900,)
Trial 1294: 5-fold CV loss = 0.5819
[I 2025-08-07 23:20:32,033] Trial 1294 finished with value: 0.5819448709487915 and parameters: {'fp_type': 'morgan', 'morgan_only_radius': 2, 'morgan_only_nBits': 1024, 'num_hidden_layers': 3, 'hidden_dim_0': 512, 'hidden_dim_1': 128, 'hidden_dim_2': 512, 'kl_weight': 0.00021273229543732403, 'lr': 0.0018117115720872603, 'batch_size': 32, 'dropout_rate': 0.47340784864829444, 'prior_mu': 0.0936468310161177, 'prior_sigma': 0.05927287269459281, 'normalization': 'none'}. Best is trial 1281 with value: 0.5184582889080047.
Generating morgan fingerprints...
Generated fingerprints with 2048 features for 900 molecules
Data shape: X=(900, 2048), y=(900,)
Trial 1296: 5-fold CV loss = 0.6283
[I 2025-08-07 23:21:25,675] Trial 1296 finished with value: 0.6282754600048065 and parameters: {'fp_type': 'morgan', 'morgan_only_radius': 2, 'morgan_only_nBits': 1024, 'num_hidden_layers': 3, 'hidden_dim_0': 512, 'hidden_dim_1': 128, 'hidden_dim_2': 512, 'kl_weight': 0.00021613307039686035, 'lr': 0.0017879611700313727, 'batch_size': 32, 'dropout_rate': 0.47649843827692206, 'prior_mu': 0.04993855950791691, 'prior_sigma': 0.06318720528887141, 'normalization': 'none'}. Best is trial 1281 with value: 0.5184582889080047.
Generating morgan_rdkit fingerprints...
Generated fingerprints with 768 features for 900 molecules
Data shape: X=(900, 768), y=(900,)
Trial 1298: 5-fold CV loss = 0.5718
[I 2025-08-07 23:21:52,940] Trial 1298 finished with value: 0.5718204259872437 and parameters: {'fp_type': 'morgan', 'morgan_only_radius': 2, 'morgan_only_nBits': 2048, 'num_hidden_layers': 3, 'hidden_dim_0': 512, 'hidden_dim_1': 128, 'hidden_dim_2': 512, 'kl_weight': 0.0002376699142654529, 'lr': 0.001831651928889415, 'batch_size': 32, 'dropout_rate': 0.4775885352172584, 'prior_mu': 0.04682938754321625, 'prior_sigma': 0.0628631438937558, 'normalization': 'none'}. Best is trial 1281 with value: 0.5184582889080047.
Generating morgan_rdkit fingerprints...
Generated fingerprints with 768 features for 900 molecules
Data shape: X=(900, 768), y=(900,)
Trial 1299: 5-fold CV loss = 0.5462
[I 2025-08-07 23:22:07,284] Trial 1299 finished with value: 0.5461902141571044 and parameters: {'fp_type': 'morgan', 'morgan_only_radius': 2, 'morgan_only_nBits': 2048, 'num_hidden_layers': 3, 'hidden_dim_0': 64, 'hidden_dim_1': 128, 'hidden_dim_2': 512, 'kl_weight': 0.00026523380890672375, 'lr': 0.00199003347575384, 'batch_size': 32, 'dropout_rate': 0.49997970619406007, 'prior_mu': 0.04459721582193869, 'prior_sigma': 0.06324034486712718, 'normalization': 'none'}. Best is trial 1281 with value: 0.5184582889080047.
Generating morgan_rdkit fingerprints...
Generated fingerprints with 768 features for 900 molecules
Data shape: X=(900, 768), y=(900,)
Trial 1300: 5-fold CV loss = 0.5580
[I 2025-08-07 23:23:19,587] Trial 1300 finished with value: 0.557962304353714 and parameters: {'fp_type': 'morgan_rdkit', 'combined_morgan_radius': 2, 'combined_morgan_nBits': 512, 'combined_rdkit_maxPath': 6, 'combined_rdkit_nBits': 256, 'num_hidden_layers': 3, 'hidden_dim_0': 64, 'hidden_dim_1': 128, 'hidden_dim_2': 128, 'kl_weight': 0.0002499924332968603, 'lr': 0.0020240227141177553, 'batch_size': 32, 'dropout_rate': 0.3765011512287009, 'prior_mu': 0.06276030916989232, 'prior_sigma': 0.0632062775805954, 'normalization': 'none'}. Best is trial 1281 with value: 0.5184582889080047.
Generating morgan fingerprints...
Generated fingerprints with 2048 features for 900 molecules
Data shape: X=(900, 2048), y=(900,)
Trial 1301: 5-fold CV loss = 0.5507
[I 2025-08-07 23:23:22,845] Trial 1301 finished with value: 0.5507249474525452 and parameters: {'fp_type': 'morgan_rdkit', 'combined_morgan_radius': 2, 'combined_morgan_nBits': 512, 'combined_rdkit_maxPath': 6, 'combined_rdkit_nBits': 256, 'num_hidden_layers': 3, 'hidden_dim_0': 512, 'hidden_dim_1': 128, 'hidden_dim_2': 128, 'kl_weight': 0.000266229868505205, 'lr': 0.0020260896927185466, 'batch_size': 32, 'dropout_rate': 0.48755276147856846, 'prior_mu': 0.061840921518291826, 'prior_sigma': 0.06438006790271562, 'normalization': 'none'}. Best is trial 1281 with value: 0.5184582889080047.
Generating morgan fingerprints...
Generated fingerprints with 2048 features for 900 molecules
Data shape: X=(900, 2048), y=(900,)
Trial 1302: 5-fold CV loss = 0.5469
[I 2025-08-07 23:23:23,993] Trial 1302 finished with value: 0.5468947112560272 and parameters: {'fp_type': 'morgan_rdkit', 'combined_morgan_radius': 2, 'combined_morgan_nBits': 512, 'combined_rdkit_maxPath': 6, 'combined_rdkit_nBits': 256, 'num_hidden_layers': 3, 'hidden_dim_0': 512, 'hidden_dim_1': 128, 'hidden_dim_2': 512, 'kl_weight': 0.0002383796143331041, 'lr': 0.002261219975793429, 'batch_size': 32, 'dropout_rate': 0.4882274596576025, 'prior_mu': 0.06123829766421898, 'prior_sigma': 0.04527287455352533, 'normalization': 'none'}. Best is trial 1281 with value: 0.5184582889080047.
Generating morgan fingerprints...
Generated fingerprints with 2048 features for 900 molecules
Data shape: X=(900, 2048), y=(900,)
Trial 1297: 5-fold CV loss = 0.6464
[I 2025-08-07 23:23:38,616] Trial 1297 finished with value: 0.6463652431964875 and parameters: {'fp_type': 'morgan', 'morgan_only_radius': 2, 'morgan_only_nBits': 1024, 'num_hidden_layers': 3, 'hidden_dim_0': 512, 'hidden_dim_1': 128, 'hidden_dim_2': 512, 'kl_weight': 0.0002434150849626785, 'lr': 0.001870581310239782, 'batch_size': 32, 'dropout_rate': 0.47664769337949475, 'prior_mu': 0.06246088468108343, 'prior_sigma': 0.06239862572227771, 'normalization': 'none'}. Best is trial 1281 with value: 0.5184582889080047.
Generating morgan fingerprints...
Generated fingerprints with 2048 features for 900 molecules
Data shape: X=(900, 2048), y=(900,)
Trial 1304: 5-fold CV loss = 0.5307
[I 2025-08-07 23:24:30,014] Trial 1304 finished with value: 0.5307102859020233 and parameters: {'fp_type': 'morgan', 'morgan_only_radius': 2, 'morgan_only_nBits': 2048, 'num_hidden_layers': 3, 'hidden_dim_0': 512, 'hidden_dim_1': 128, 'hidden_dim_2': 512, 'kl_weight': 0.00019496432390642487, 'lr': 0.0023086027446261926, 'batch_size': 32, 'dropout_rate': 0.49108617327584786, 'prior_mu': 0.06092976815023228, 'prior_sigma': 0.049917176711329427, 'normalization': 'none'}. Best is trial 1281 with value: 0.5184582889080047.
Generating morgan fingerprints...
Generated fingerprints with 2048 features for 900 molecules
Data shape: X=(900, 2048), y=(900,)
Trial 1303: 5-fold CV loss = 0.7228
[I 2025-08-07 23:24:31,031] Trial 1303 finished with value: 0.7227542698383331 and parameters: {'fp_type': 'morgan', 'morgan_only_radius': 2, 'morgan_only_nBits': 2048, 'num_hidden_layers': 3, 'hidden_dim_0': 512, 'hidden_dim_1': 128, 'hidden_dim_2': 512, 'kl_weight': 0.0001658864960775314, 'lr': 0.0014811796047076266, 'batch_size': 32, 'dropout_rate': 0.4898119901496105, 'prior_mu': 0.061528513464911894, 'prior_sigma': 0.04802185863891728, 'normalization': 'none'}. Best is trial 1281 with value: 0.5184582889080047.
Generating morgan fingerprints...
Generated fingerprints with 1024 features for 900 molecules
Data shape: X=(900, 1024), y=(900,)
Trial 1305: 5-fold CV loss = 0.5260
[I 2025-08-07 23:24:42,380] Trial 1305 finished with value: 0.525997132062912 and parameters: {'fp_type': 'morgan', 'morgan_only_radius': 2, 'morgan_only_nBits': 2048, 'num_hidden_layers': 3, 'hidden_dim_0': 512, 'hidden_dim_1': 128, 'hidden_dim_2': 512, 'kl_weight': 0.00013692103377661364, 'lr': 0.0023270059429378056, 'batch_size': 32, 'dropout_rate': 0.49013857832233765, 'prior_mu': 0.05485658453391037, 'prior_sigma': 0.05119383060365088, 'normalization': 'none'}. Best is trial 1281 with value: 0.5184582889080047.
Generating morgan fingerprints...
Generated fingerprints with 1024 features for 900 molecules
Data shape: X=(900, 1024), y=(900,)
Trial 1308: 5-fold CV loss = 0.8848
[I 2025-08-07 23:24:45,395] Trial 1308 finished with value: 0.8848204135894775 and parameters: {'fp_type': 'morgan', 'morgan_only_radius': 2, 'morgan_only_nBits': 1024, 'num_hidden_layers': 3, 'hidden_dim_0': 512, 'hidden_dim_1': 128, 'hidden_dim_2': 512, 'kl_weight': 0.00033088405977348503, 'lr': 0.0023279288789380703, 'batch_size': 128, 'dropout_rate': 0.457917022817832, 'prior_mu': 0.04549788423965069, 'prior_sigma': 0.0713722563053568, 'normalization': 'none'}. Best is trial 1281 with value: 0.5184582889080047.
Generating morgan fingerprints...
Generated fingerprints with 1024 features for 900 molecules
Data shape: X=(900, 1024), y=(900,)
Trial 1307: 5-fold CV loss = 0.6517
[I 2025-08-07 23:24:48,521] Trial 1307 finished with value: 0.6516960144042969 and parameters: {'fp_type': 'morgan', 'morgan_only_radius': 2, 'morgan_only_nBits': 2048, 'num_hidden_layers': 0, 'kl_weight': 0.0037137713922565834, 'lr': 0.0016596179451991767, 'batch_size': 32, 'dropout_rate': 0.48328312441667337, 'prior_mu': 0.04314609492402876, 'prior_sigma': 0.07151808154721978, 'normalization': 'none'}. Best is trial 1281 with value: 0.5184582889080047.
Generating morgan fingerprints...
Generated fingerprints with 1024 features for 900 molecules
Data shape: X=(900, 1024), y=(900,)
Trial 1309: 5-fold CV loss = 0.7011
[I 2025-08-07 23:25:10,732] Trial 1309 finished with value: 0.7010895371437073 and parameters: {'fp_type': 'morgan', 'morgan_only_radius': 2, 'morgan_only_nBits': 1024, 'num_hidden_layers': 3, 'hidden_dim_0': 512, 'hidden_dim_1': 128, 'hidden_dim_2': 512, 'kl_weight': 0.0003134878195253988, 'lr': 0.0016710030107047785, 'batch_size': 32, 'dropout_rate': 0.3339769065208382, 'prior_mu': 0.04077124677867773, 'prior_sigma': 0.07281152102978393, 'normalization': 'none'}. Best is trial 1281 with value: 0.5184582889080047.
Generating morgan fingerprints...
Generated fingerprints with 1024 features for 900 molecules
Data shape: X=(900, 1024), y=(900,)
Trial 1311: 5-fold CV loss = 0.5216
[I 2025-08-07 23:26:14,797] Trial 1311 finished with value: 0.521596485376358 and parameters: {'fp_type': 'morgan', 'morgan_only_radius': 2, 'morgan_only_nBits': 1024, 'num_hidden_layers': 3, 'hidden_dim_0': 512, 'hidden_dim_1': 128, 'hidden_dim_2': 512, 'kl_weight': 0.00011885313780561637, 'lr': 0.002048513490161063, 'batch_size': 32, 'dropout_rate': 0.46815654285774866, 'prior_mu': 0.05230860673990299, 'prior_sigma': 0.06670227448096268, 'normalization': 'none'}. Best is trial 1281 with value: 0.5184582889080047.
Generating morgan fingerprints...
Generated fingerprints with 1024 features for 900 molecules
Data shape: X=(900, 1024), y=(900,)
Trial 1310: 5-fold CV loss = 0.5541
[I 2025-08-07 23:26:37,796] Trial 1310 finished with value: 0.5540994167327881 and parameters: {'fp_type': 'morgan', 'morgan_only_radius': 2, 'morgan_only_nBits': 1024, 'num_hidden_layers': 3, 'hidden_dim_0': 512, 'hidden_dim_1': 128, 'hidden_dim_2': 512, 'kl_weight': 0.005212656044686057, 'lr': 0.0021210458231625032, 'batch_size': 32, 'dropout_rate': 0.3584981485505302, 'prior_mu': 0.0371386744871663, 'prior_sigma': 0.06908177618932698, 'normalization': 'none'}. Best is trial 1281 with value: 0.5184582889080047.
Generating morgan fingerprints...
Generated fingerprints with 1024 features for 900 molecules
Data shape: X=(900, 1024), y=(900,)
Trial 1313: 5-fold CV loss = 0.6838
[I 2025-08-07 23:26:38,577] Trial 1313 finished with value: 0.6837941527366638 and parameters: {'fp_type': 'morgan', 'morgan_only_radius': 2, 'morgan_only_nBits': 1024, 'num_hidden_layers': 2, 'hidden_dim_0': 1024, 'hidden_dim_1': 128, 'kl_weight': 0.00011204004107058703, 'lr': 0.0019252960364785578, 'batch_size': 32, 'dropout_rate': 0.45137161326878933, 'prior_mu': 0.05373989886909394, 'prior_sigma': 0.05947710795695867, 'normalization': 'none'}. Best is trial 1281 with value: 0.5184582889080047.
Generating morgan fingerprints...
Generated fingerprints with 1024 features for 900 molecules
Data shape: X=(900, 1024), y=(900,)
Trial 1312: 5-fold CV loss = 0.5263
[I 2025-08-07 23:26:59,926] Trial 1312 finished with value: 0.5262514591217041 and parameters: {'fp_type': 'morgan', 'morgan_only_radius': 2, 'morgan_only_nBits': 1024, 'num_hidden_layers': 3, 'hidden_dim_0': 512, 'hidden_dim_1': 128, 'hidden_dim_2': 512, 'kl_weight': 0.00020664586953721123, 'lr': 0.0021162678377461067, 'batch_size': 32, 'dropout_rate': 0.4683312807103033, 'prior_mu': 0.05166074264544576, 'prior_sigma': 0.06717262502252247, 'normalization': 'none'}. Best is trial 1281 with value: 0.5184582889080047.
Generating morgan fingerprints...
Generated fingerprints with 1024 features for 900 molecules
Data shape: X=(900, 1024), y=(900,)
Trial 1316: 5-fold CV loss = 0.7450
[I 2025-08-07 23:27:16,518] Trial 1316 finished with value: 0.7449597358703614 and parameters: {'fp_type': 'morgan', 'morgan_only_radius': 2, 'morgan_only_nBits': 1024, 'num_hidden_layers': 3, 'hidden_dim_0': 512, 'hidden_dim_1': 128, 'hidden_dim_2': 512, 'kl_weight': 0.00035713893613342464, 'lr': 0.0009698226098311338, 'batch_size': 64, 'dropout_rate': 0.45583104948237924, 'prior_mu': 0.07524523483904061, 'prior_sigma': 0.054659614290718125, 'normalization': 'none'}. Best is trial 1281 with value: 0.5184582889080047.
Generating morgan fingerprints...
Generated fingerprints with 1024 features for 900 molecules
Data shape: X=(900, 1024), y=(900,)
Trial 1306: 5-fold CV loss = 0.5312
[I 2025-08-07 23:27:43,256] Trial 1306 finished with value: 0.5312130928039551 and parameters: {'fp_type': 'morgan', 'morgan_only_radius': 2, 'morgan_only_nBits': 2048, 'num_hidden_layers': 3, 'hidden_dim_0': 512, 'hidden_dim_1': 128, 'hidden_dim_2': 512, 'kl_weight': 0.00018201674718522977, 'lr': 0.002308720430136427, 'batch_size': 32, 'dropout_rate': 0.49105665365739826, 'prior_mu': 0.05411267844648578, 'prior_sigma': 0.050065017994308764, 'normalization': 'none'}. Best is trial 1281 with value: 0.5184582889080047.
Generating rdkit fingerprints...
Generated fingerprints with 1024 features for 900 molecules
Data shape: X=(900, 1024), y=(900,)
Trial 1315: 5-fold CV loss = 0.5559
[I 2025-08-07 23:27:44,255] Trial 1315 finished with value: 0.5559233069419861 and parameters: {'fp_type': 'morgan', 'morgan_only_radius': 2, 'morgan_only_nBits': 1024, 'num_hidden_layers': 3, 'hidden_dim_0': 512, 'hidden_dim_1': 128, 'hidden_dim_2': 512, 'kl_weight': 0.0003749322040125256, 'lr': 0.0019632222096730846, 'batch_size': 32, 'dropout_rate': 0.45791882559107394, 'prior_mu': 0.08029628395020866, 'prior_sigma': 0.05481231725714752, 'normalization': 'none'}. Best is trial 1281 with value: 0.5184582889080047.
Generating rdkit fingerprints...
Generated fingerprints with 1024 features for 900 molecules
Data shape: X=(900, 1024), y=(900,)
Trial 1314: 5-fold CV loss = 0.6454
[I 2025-08-07 23:27:48,984] Trial 1314 finished with value: 0.6454300999641418 and parameters: {'fp_type': 'morgan', 'morgan_only_radius': 2, 'morgan_only_nBits': 1024, 'num_hidden_layers': 3, 'hidden_dim_0': 1024, 'hidden_dim_1': 128, 'hidden_dim_2': 512, 'kl_weight': 0.00011376797060986555, 'lr': 0.0019067819546968892, 'batch_size': 64, 'dropout_rate': 0.44921739998737364, 'prior_mu': 0.07376765574447386, 'prior_sigma': 0.17969841475699522, 'normalization': 'none'}. Best is trial 1281 with value: 0.5184582889080047.
Generating rdkit fingerprints...
Generated fingerprints with 1024 features for 900 molecules
Data shape: X=(900, 1024), y=(900,)
Trial 1317: 5-fold CV loss = 0.5680
[I 2025-08-07 23:28:42,260] Trial 1317 finished with value: 0.568034291267395 and parameters: {'fp_type': 'morgan', 'morgan_only_radius': 2, 'morgan_only_nBits': 1024, 'num_hidden_layers': 3, 'hidden_dim_0': 128, 'hidden_dim_1': 128, 'hidden_dim_2': 512, 'kl_weight': 0.00012180574696850708, 'lr': 0.0017222100741059905, 'batch_size': 32, 'dropout_rate': 0.4605387336947732, 'prior_mu': 0.04797015353780904, 'prior_sigma': 0.060475894130437184, 'normalization': 'none'}. Best is trial 1281 with value: 0.5184582889080047.
Generating rdkit fingerprints...
Generated fingerprints with 1024 features for 900 molecules
Data shape: X=(900, 1024), y=(900,)
Trial 1319: 5-fold CV loss = 0.6034
[I 2025-08-07 23:28:43,361] Trial 1319 finished with value: 0.6034283638000488 and parameters: {'fp_type': 'rdkit', 'rdkit_only_maxPath': 6, 'rdkit_only_nBits': 1024, 'num_hidden_layers': 3, 'hidden_dim_0': 512, 'hidden_dim_1': 128, 'hidden_dim_2': 512, 'kl_weight': 0.00012147052849329329, 'lr': 0.0016365324514675977, 'batch_size': 32, 'dropout_rate': 0.46172200612195, 'prior_mu': 0.05601099554678893, 'prior_sigma': 0.06053387452646858, 'normalization': 'none'}. Best is trial 1281 with value: 0.5184582889080047.
Generating morgan fingerprints...
Generated fingerprints with 1024 features for 900 molecules
Data shape: X=(900, 1024), y=(900,)
Trial 1320: 5-fold CV loss = 0.6109
[I 2025-08-07 23:29:30,093] Trial 1320 finished with value: 0.6108691096305847 and parameters: {'fp_type': 'rdkit', 'rdkit_only_maxPath': 6, 'rdkit_only_nBits': 1024, 'num_hidden_layers': 3, 'hidden_dim_0': 512, 'hidden_dim_1': 128, 'hidden_dim_2': 512, 'kl_weight': 0.00012322320659565293, 'lr': 0.0015132405641698633, 'batch_size': 32, 'dropout_rate': 0.462712512299965, 'prior_mu': 0.04512235160920636, 'prior_sigma': 0.060199215765907726, 'normalization': 'none'}. Best is trial 1281 with value: 0.5184582889080047.
Generating morgan fingerprints...
Generated fingerprints with 1024 features for 900 molecules
Data shape: X=(900, 1024), y=(900,)
Trial 1322: 5-fold CV loss = 0.5976
