[I 2025-08-07 23:40:46,956] Trial 1354 finished with value: 0.703434145450592 and parameters: {'fp_type': 'morgan', 'morgan_only_radius': 2, 'morgan_only_nBits': 1024, 'num_hidden_layers': 3, 'hidden_dim_0': 64, 'hidden_dim_1': 128, 'hidden_dim_2': 128, 'kl_weight': 0.0003932013227275175, 'lr': 0.002134672438941887, 'batch_size': 128, 'dropout_rate': 0.4999943184561983, 'prior_mu': 0.08076968143749631, 'prior_sigma': 0.0651238152398263, 'normalization': 'none'}. Best is trial 1281 with value: 0.5184582889080047.
Generating morgan fingerprints...
Generated fingerprints with 1024 features for 900 molecules
Data shape: X=(900, 1024), y=(900,)
Trial 1352: 5-fold CV loss = 0.5704
[I 2025-08-07 23:41:29,238] Trial 1352 finished with value: 0.570384007692337 and parameters: {'fp_type': 'morgan', 'morgan_only_radius': 2, 'morgan_only_nBits': 1024, 'num_hidden_layers': 3, 'hidden_dim_0': 64, 'hidden_dim_1': 128, 'hidden_dim_2': 512, 'kl_weight': 0.025884963669574206, 'lr': 0.0021619076697490906, 'batch_size': 32, 'dropout_rate': 0.45016092463827645, 'prior_mu': -0.003896305006095554, 'prior_sigma': 0.06625485125764037, 'normalization': 'none'}. Best is trial 1281 with value: 0.5184582889080047.
Generating morgan fingerprints...
Generated fingerprints with 1024 features for 900 molecules
Data shape: X=(900, 1024), y=(900,)
Trial 1348: 5-fold CV loss = 0.5644
[I 2025-08-07 23:42:00,551] Trial 1348 finished with value: 0.5643820106983185 and parameters: {'fp_type': 'morgan', 'morgan_only_radius': 2, 'morgan_only_nBits': 1024, 'num_hidden_layers': 3, 'hidden_dim_0': 128, 'hidden_dim_1': 1024, 'hidden_dim_2': 512, 'kl_weight': 0.0002173154173263268, 'lr': 0.003044881797745617, 'batch_size': 32, 'dropout_rate': 0.4840108282448574, 'prior_mu': 0.030639890307698286, 'prior_sigma': 0.062204326937881846, 'normalization': 'none'}. Best is trial 1281 with value: 0.5184582889080047.
Generating morgan fingerprints...
Generated fingerprints with 1024 features for 900 molecules
Data shape: X=(900, 1024), y=(900,)
Trial 1355: 5-fold CV loss = 0.5944
[I 2025-08-07 23:42:08,610] Trial 1355 finished with value: 0.5943758547306061 and parameters: {'fp_type': 'morgan', 'morgan_only_radius': 2, 'morgan_only_nBits': 1024, 'num_hidden_layers': 3, 'hidden_dim_0': 64, 'hidden_dim_1': 128, 'hidden_dim_2': 128, 'kl_weight': 0.03216840448222677, 'lr': 0.001953482096180431, 'batch_size': 32, 'dropout_rate': 0.4913912860198731, 'prior_mu': -0.0030250458170526726, 'prior_sigma': 0.06529132743767964, 'normalization': 'none'}. Best is trial 1281 with value: 0.5184582889080047.
Generating morgan fingerprints...
Generated fingerprints with 2048 features for 900 molecules
Data shape: X=(900, 2048), y=(900,)
Trial 1356: 5-fold CV loss = 0.6046
[I 2025-08-07 23:42:20,718] Trial 1356 finished with value: 0.6046192944049835 and parameters: {'fp_type': 'morgan', 'morgan_only_radius': 2, 'morgan_only_nBits': 1024, 'num_hidden_layers': 3, 'hidden_dim_0': 512, 'hidden_dim_1': 128, 'hidden_dim_2': 512, 'kl_weight': 0.006362288987241088, 'lr': 0.0018919772989174463, 'batch_size': 32, 'dropout_rate': 0.4677387278937214, 'prior_mu': -0.002243497387462306, 'prior_sigma': 0.07450295151780134, 'normalization': 'none'}. Best is trial 1281 with value: 0.5184582889080047.
Generating morgan fingerprints...
Generated fingerprints with 2048 features for 900 molecules
Data shape: X=(900, 2048), y=(900,)
Trial 1359: 5-fold CV loss = 0.7560
[I 2025-08-07 23:42:32,522] Trial 1359 finished with value: 0.7559547185897827 and parameters: {'fp_type': 'morgan', 'morgan_only_radius': 2, 'morgan_only_nBits': 2048, 'num_hidden_layers': 3, 'hidden_dim_0': 512, 'hidden_dim_1': 128, 'hidden_dim_2': 512, 'kl_weight': 0.0009014523067266934, 'lr': 0.0017232511339937261, 'batch_size': 64, 'dropout_rate': 0.4700847101009182, 'prior_mu': 0.07550141949199457, 'prior_sigma': 0.05748226047821575, 'normalization': 'none'}. Best is trial 1281 with value: 0.5184582889080047.
Generating morgan fingerprints...
Generated fingerprints with 2048 features for 900 molecules
Data shape: X=(900, 2048), y=(900,)
Trial 1360: 5-fold CV loss = 0.8286
[I 2025-08-07 23:42:35,505] Trial 1360 finished with value: 0.8285708427429199 and parameters: {'fp_type': 'morgan', 'morgan_only_radius': 3, 'morgan_only_nBits': 2048, 'num_hidden_layers': 3, 'hidden_dim_0': 512, 'hidden_dim_1': 128, 'hidden_dim_2': 512, 'kl_weight': 0.0001889030158750402, 'lr': 0.0017065887393374732, 'batch_size': 64, 'dropout_rate': 0.47239044171922656, 'prior_mu': 0.07501775275751568, 'prior_sigma': 0.05686019246761253, 'normalization': 'none'}. Best is trial 1281 with value: 0.5184582889080047.
Generating morgan fingerprints...
Generated fingerprints with 1024 features for 900 molecules
Data shape: X=(900, 1024), y=(900,)
Trial 1357: 5-fold CV loss = 0.5611
[I 2025-08-07 23:42:45,735] Trial 1357 finished with value: 0.5610853016376496 and parameters: {'fp_type': 'morgan', 'morgan_only_radius': 2, 'morgan_only_nBits': 1024, 'num_hidden_layers': 3, 'hidden_dim_0': 512, 'hidden_dim_1': 128, 'hidden_dim_2': 512, 'kl_weight': 0.0001900292502758632, 'lr': 0.0019499122491280496, 'batch_size': 32, 'dropout_rate': 0.4699022668774729, 'prior_mu': -0.01179979221501339, 'prior_sigma': 0.057229941202089955, 'normalization': 'none'}. Best is trial 1281 with value: 0.5184582889080047.
Generating morgan fingerprints...
Generated fingerprints with 2048 features for 900 molecules
Data shape: X=(900, 2048), y=(900,)
Trial 1362: 5-fold CV loss = 0.5348
[I 2025-08-07 23:43:47,752] Trial 1362 finished with value: 0.5347537755966186 and parameters: {'fp_type': 'morgan', 'morgan_only_radius': 2, 'morgan_only_nBits': 1024, 'num_hidden_layers': 3, 'hidden_dim_0': 512, 'hidden_dim_1': 128, 'hidden_dim_2': 512, 'kl_weight': 0.00034133334184817355, 'lr': 0.0024433635772457903, 'batch_size': 32, 'dropout_rate': 0.4917159331663795, 'prior_mu': -0.013902568464880756, 'prior_sigma': 0.07069426005089233, 'normalization': 'none'}. Best is trial 1281 with value: 0.5184582889080047.
Generating morgan fingerprints...
Generated fingerprints with 2048 features for 900 molecules
Data shape: X=(900, 2048), y=(900,)
Trial 1363: 5-fold CV loss = 0.5268
[I 2025-08-07 23:43:50,087] Trial 1363 finished with value: 0.5267737925052642 and parameters: {'fp_type': 'morgan', 'morgan_only_radius': 2, 'morgan_only_nBits': 2048, 'num_hidden_layers': 3, 'hidden_dim_0': 512, 'hidden_dim_1': 128, 'hidden_dim_2': 512, 'kl_weight': 0.005158165947599558, 'lr': 0.002443303872685177, 'batch_size': 32, 'dropout_rate': 0.48971255842389333, 'prior_mu': -0.014347333059482714, 'prior_sigma': 0.07061732510314044, 'normalization': 'none'}. Best is trial 1281 with value: 0.5184582889080047.
Generating morgan fingerprints...
Generated fingerprints with 2048 features for 900 molecules
Data shape: X=(900, 2048), y=(900,)
Trial 1361: 5-fold CV loss = 0.5548
[I 2025-08-07 23:44:11,447] Trial 1361 finished with value: 0.5548358976840972 and parameters: {'fp_type': 'morgan', 'morgan_only_radius': 3, 'morgan_only_nBits': 2048, 'num_hidden_layers': 3, 'hidden_dim_0': 512, 'hidden_dim_1': 128, 'hidden_dim_2': 512, 'kl_weight': 0.00018656017358935483, 'lr': 0.0024682361205496713, 'batch_size': 32, 'dropout_rate': 0.2572099923494031, 'prior_mu': -0.014464034200007941, 'prior_sigma': 0.056236646996036845, 'normalization': 'none'}. Best is trial 1281 with value: 0.5184582889080047.
Generating morgan_rdkit fingerprints...
Generated fingerprints with 1024 features for 900 molecules
Data shape: X=(900, 1024), y=(900,)
Trial 1364: 5-fold CV loss = 0.5253
[I 2025-08-07 23:44:59,219] Trial 1364 finished with value: 0.525252741575241 and parameters: {'fp_type': 'morgan', 'morgan_only_radius': 2, 'morgan_only_nBits': 2048, 'num_hidden_layers': 3, 'hidden_dim_0': 512, 'hidden_dim_1': 128, 'hidden_dim_2': 512, 'kl_weight': 0.0002769736812280567, 'lr': 0.002516967357586115, 'batch_size': 32, 'dropout_rate': 0.4818086287984655, 'prior_mu': 0.04198453062799301, 'prior_sigma': 0.07391760218799541, 'normalization': 'none'}. Best is trial 1281 with value: 0.5184582889080047.
Generating morgan fingerprints...
Generated fingerprints with 1024 features for 900 molecules
Data shape: X=(900, 1024), y=(900,)
Trial 1365: 5-fold CV loss = 0.5218
[I 2025-08-07 23:45:08,031] Trial 1365 finished with value: 0.5217752158641815 and parameters: {'fp_type': 'morgan', 'morgan_only_radius': 2, 'morgan_only_nBits': 2048, 'num_hidden_layers': 3, 'hidden_dim_0': 512, 'hidden_dim_1': 128, 'hidden_dim_2': 512, 'kl_weight': 0.0007651027097902683, 'lr': 0.0021680031332330174, 'batch_size': 32, 'dropout_rate': 0.48048533219838285, 'prior_mu': 0.04656120964110391, 'prior_sigma': 0.06208205891805839, 'normalization': 'none'}. Best is trial 1281 with value: 0.5184582889080047.
Generating morgan_rdkit fingerprints...
Generated fingerprints with 1024 features for 900 molecules
Data shape: X=(900, 1024), y=(900,)
Trial 1366: 5-fold CV loss = 0.6202
[I 2025-08-07 23:45:35,522] Trial 1366 finished with value: 0.6201862215995788 and parameters: {'fp_type': 'morgan_rdkit', 'combined_morgan_radius': 3, 'combined_morgan_nBits': 512, 'combined_rdkit_maxPath': 7, 'combined_rdkit_nBits': 512, 'num_hidden_layers': 3, 'hidden_dim_0': 512, 'hidden_dim_1': 128, 'hidden_dim_2': 512, 'kl_weight': 0.00027572279267739903, 'lr': 0.00226173561791561, 'batch_size': 32, 'dropout_rate': 0.47902702913257755, 'prior_mu': 0.06611133008096244, 'prior_sigma': 0.06225097746406761, 'normalization': 'none'}. Best is trial 1281 with value: 0.5184582889080047.
Generating morgan fingerprints...
Generated fingerprints with 2048 features for 900 molecules
Data shape: X=(900, 2048), y=(900,)
Trial 1368: 5-fold CV loss = 0.6051
[I 2025-08-07 23:46:12,529] Trial 1368 finished with value: 0.6050645351409912 and parameters: {'fp_type': 'morgan_rdkit', 'combined_morgan_radius': 3, 'combined_morgan_nBits': 512, 'combined_rdkit_maxPath': 7, 'combined_rdkit_nBits': 512, 'num_hidden_layers': 3, 'hidden_dim_0': 512, 'hidden_dim_1': 128, 'hidden_dim_2': 1024, 'kl_weight': 0.0006536939554915104, 'lr': 0.002740111086881984, 'batch_size': 32, 'dropout_rate': 0.45557897298799416, 'prior_mu': 0.044343386204707666, 'prior_sigma': 0.06023238313472785, 'normalization': 'none'}. Best is trial 1281 with value: 0.5184582889080047.
Generating morgan fingerprints...
Generated fingerprints with 2048 features for 900 molecules
Data shape: X=(900, 2048), y=(900,)
Trial 1367: 5-fold CV loss = 0.5258
[I 2025-08-07 23:46:28,224] Trial 1367 finished with value: 0.5258315622806549 and parameters: {'fp_type': 'morgan', 'morgan_only_radius': 2, 'morgan_only_nBits': 1024, 'num_hidden_layers': 3, 'hidden_dim_0': 512, 'hidden_dim_1': 128, 'hidden_dim_2': 1024, 'kl_weight': 0.0007143968772790377, 'lr': 0.002169503154310525, 'batch_size': 32, 'dropout_rate': 0.4559495148689455, 'prior_mu': 0.0005568407496790474, 'prior_sigma': 0.06165516392342402, 'normalization': 'none'}. Best is trial 1281 with value: 0.5184582889080047.
Generating morgan fingerprints...
Generated fingerprints with 2048 features for 900 molecules
Data shape: X=(900, 2048), y=(900,)
Trial 1369: 5-fold CV loss = 0.6312
[I 2025-08-07 23:46:41,672] Trial 1369 finished with value: 0.631220817565918 and parameters: {'fp_type': 'morgan', 'morgan_only_radius': 2, 'morgan_only_nBits': 2048, 'num_hidden_layers': 2, 'hidden_dim_0': 512, 'hidden_dim_1': 128, 'kl_weight': 0.0006254221490393091, 'lr': 0.0027844421221213133, 'batch_size': 32, 'dropout_rate': 0.45464298810062925, 'prior_mu': 0.04055379546259223, 'prior_sigma': 0.05415026509734554, 'normalization': 'none'}. Best is trial 1281 with value: 0.5184582889080047.
Generating morgan fingerprints...
Generated fingerprints with 2048 features for 900 molecules
Data shape: X=(900, 2048), y=(900,)
Trial 1358: 5-fold CV loss = 0.5459
[I 2025-08-07 23:46:44,496] Trial 1358 finished with value: 0.5459065556526184 and parameters: {'fp_type': 'morgan', 'morgan_only_radius': 2, 'morgan_only_nBits': 1024, 'num_hidden_layers': 3, 'hidden_dim_0': 512, 'hidden_dim_1': 128, 'hidden_dim_2': 512, 'kl_weight': 0.00018631110351289358, 'lr': 0.0018677239971972971, 'batch_size': 32, 'dropout_rate': 0.49120481862187104, 'prior_mu': 0.06788419319601058, 'prior_sigma': 0.056683144338829476, 'normalization': 'none'}. Best is trial 1281 with value: 0.5184582889080047.
Generating morgan fingerprints...
Generated fingerprints with 2048 features for 900 molecules
Data shape: X=(900, 2048), y=(900,)
Trial 1370: 5-fold CV loss = 0.6974
[I 2025-08-07 23:46:48,828] Trial 1370 finished with value: 0.6974462032318115 and parameters: {'fp_type': 'morgan', 'morgan_only_radius': 2, 'morgan_only_nBits': 2048, 'num_hidden_layers': 2, 'hidden_dim_0': 1024, 'hidden_dim_1': 128, 'kl_weight': 0.0006942089321330242, 'lr': 0.0022479604618281155, 'batch_size': 32, 'dropout_rate': 0.46190103505254454, 'prior_mu': 0.04473139170663909, 'prior_sigma': 0.05358412395898682, 'normalization': 'none'}. Best is trial 1281 with value: 0.5184582889080047.
Generating morgan fingerprints...
Generated fingerprints with 2048 features for 900 molecules
Data shape: X=(900, 2048), y=(900,)
Trial 1371: 5-fold CV loss = 0.5981
[I 2025-08-07 23:47:32,033] Trial 1371 finished with value: 0.5980670869350433 and parameters: {'fp_type': 'morgan', 'morgan_only_radius': 2, 'morgan_only_nBits': 2048, 'num_hidden_layers': 2, 'hidden_dim_0': 512, 'hidden_dim_1': 128, 'kl_weight': 0.0005895591361584372, 'lr': 0.00226916115573138, 'batch_size': 32, 'dropout_rate': 0.4633623346940092, 'prior_mu': 0.05122981416867583, 'prior_sigma': 0.053279781739915794, 'normalization': 'none'}. Best is trial 1281 with value: 0.5184582889080047.
Generating morgan fingerprints...
Generated fingerprints with 2048 features for 900 molecules
Data shape: X=(900, 2048), y=(900,)
Trial 1374: 5-fold CV loss = 0.5336
[I 2025-08-07 23:47:48,830] Trial 1374 finished with value: 0.5336159527301788 and parameters: {'fp_type': 'morgan', 'morgan_only_radius': 2, 'morgan_only_nBits': 2048, 'num_hidden_layers': 3, 'hidden_dim_0': 512, 'hidden_dim_1': 128, 'hidden_dim_2': 512, 'kl_weight': 0.0005930666997263277, 'lr': 0.0025490164831847213, 'batch_size': 32, 'dropout_rate': 0.4650185087602924, 'prior_mu': 0.05423433490548867, 'prior_sigma': 0.04500721288656179, 'normalization': 'none'}. Best is trial 1281 with value: 0.5184582889080047.
Generating morgan fingerprints...
Generated fingerprints with 2048 features for 900 molecules
Data shape: X=(900, 2048), y=(900,)
Trial 1376: 5-fold CV loss = 0.8349
[I 2025-08-07 23:48:12,921] Trial 1376 finished with value: 0.8348562359809876 and parameters: {'fp_type': 'morgan', 'morgan_only_radius': 2, 'morgan_only_nBits': 2048, 'num_hidden_layers': 3, 'hidden_dim_0': 512, 'hidden_dim_1': 512, 'hidden_dim_2': 512, 'kl_weight': 0.0007482645299772985, 'lr': 0.002358584124033652, 'batch_size': 32, 'dropout_rate': 0.4772112327543438, 'prior_mu': 0.044328132897620234, 'prior_sigma': 0.05972083707999879, 'normalization': 'none'}. Best is trial 1281 with value: 0.5184582889080047.
Generating morgan fingerprints...
Generated fingerprints with 2048 features for 900 molecules
Data shape: X=(900, 2048), y=(900,)
Trial 1372: 5-fold CV loss = 0.6211
[I 2025-08-07 23:48:22,806] Trial 1372 finished with value: 0.621125441789627 and parameters: {'fp_type': 'morgan', 'morgan_only_radius': 2, 'morgan_only_nBits': 2048, 'num_hidden_layers': 3, 'hidden_dim_0': 1024, 'hidden_dim_1': 512, 'hidden_dim_2': 512, 'kl_weight': 0.0004725952605066955, 'lr': 0.0023219290844985895, 'batch_size': 32, 'dropout_rate': 0.46524031809388117, 'prior_mu': 0.044815056637075405, 'prior_sigma': 0.05902485307708019, 'normalization': 'none'}. Best is trial 1281 with value: 0.5184582889080047.
Generating morgan fingerprints...
Generated fingerprints with 2048 features for 900 molecules
Data shape: X=(900, 2048), y=(900,)
Trial 1375: 5-fold CV loss = 0.5485
[I 2025-08-07 23:48:55,620] Trial 1375 finished with value: 0.5485312044620514 and parameters: {'fp_type': 'morgan', 'morgan_only_radius': 2, 'morgan_only_nBits': 2048, 'num_hidden_layers': 3, 'hidden_dim_0': 512, 'hidden_dim_1': 512, 'hidden_dim_2': 512, 'kl_weight': 0.00047252378467524945, 'lr': 0.0025633866536427107, 'batch_size': 32, 'dropout_rate': 0.47344004497263414, 'prior_mu': 0.05554289492633647, 'prior_sigma': 0.04366192215325075, 'normalization': 'none'}. Best is trial 1281 with value: 0.5184582889080047.
Generating morgan fingerprints...
Generated fingerprints with 2048 features for 900 molecules
Data shape: X=(900, 2048), y=(900,)
Trial 1377: 5-fold CV loss = 0.5470
[I 2025-08-07 23:49:08,360] Trial 1377 finished with value: 0.546990555524826 and parameters: {'fp_type': 'morgan', 'morgan_only_radius': 2, 'morgan_only_nBits': 2048, 'num_hidden_layers': 3, 'hidden_dim_0': 512, 'hidden_dim_1': 128, 'hidden_dim_2': 512, 'kl_weight': 0.000552672633282207, 'lr': 0.002096136568653232, 'batch_size': 32, 'dropout_rate': 0.47236595050537117, 'prior_mu': 0.03746077983680745, 'prior_sigma': 0.05942609064056486, 'normalization': 'layer'}. Best is trial 1281 with value: 0.5184582889080047.
Generating morgan fingerprints...
Generated fingerprints with 2048 features for 900 molecules
Data shape: X=(900, 2048), y=(900,)
Trial 1373: 5-fold CV loss = 0.7686
[I 2025-08-07 23:49:16,395] Trial 1373 finished with value: 0.7686098515987396 and parameters: {'fp_type': 'morgan', 'morgan_only_radius': 2, 'morgan_only_nBits': 2048, 'num_hidden_layers': 3, 'hidden_dim_0': 512, 'hidden_dim_1': 512, 'hidden_dim_2': 512, 'kl_weight': 0.0007711079995343951, 'lr': 0.0023419529583548425, 'batch_size': 32, 'dropout_rate': 0.4640755842977758, 'prior_mu': 0.04677336498181071, 'prior_sigma': 0.058934252346352065, 'normalization': 'none'}. Best is trial 1281 with value: 0.5184582889080047.
Generating morgan fingerprints...
Generated fingerprints with 2048 features for 900 molecules
Data shape: X=(900, 2048), y=(900,)
Trial 1380: 5-fold CV loss = 0.5504
[I 2025-08-07 23:50:16,991] Trial 1380 finished with value: 0.5503756761550903 and parameters: {'fp_type': 'morgan', 'morgan_only_radius': 2, 'morgan_only_nBits': 2048, 'num_hidden_layers': 3, 'hidden_dim_0': 512, 'hidden_dim_1': 128, 'hidden_dim_2': 512, 'kl_weight': 0.000836078660867533, 'lr': 0.0020772423322873456, 'batch_size': 32, 'dropout_rate': 0.4470171750687977, 'prior_mu': 0.034548907192457776, 'prior_sigma': 0.063594454579404, 'normalization': 'none'}. Best is trial 1281 with value: 0.5184582889080047.
Generating morgan fingerprints...
Generated fingerprints with 2048 features for 900 molecules
Data shape: X=(900, 2048), y=(900,)
Trial 1378: 5-fold CV loss = 0.5370
[I 2025-08-07 23:50:19,607] Trial 1378 finished with value: 0.5370070815086365 and parameters: {'fp_type': 'morgan', 'morgan_only_radius': 2, 'morgan_only_nBits': 2048, 'num_hidden_layers': 3, 'hidden_dim_0': 512, 'hidden_dim_1': 128, 'hidden_dim_2': 512, 'kl_weight': 0.0009792410907764582, 'lr': 0.0021203691408425403, 'batch_size': 32, 'dropout_rate': 0.47536736657404594, 'prior_mu': 0.055911016943306455, 'prior_sigma': 0.06399733417316722, 'normalization': 'none'}. Best is trial 1281 with value: 0.5184582889080047.
Generating morgan fingerprints...
Generated fingerprints with 2048 features for 900 molecules
Data shape: X=(900, 2048), y=(900,)
Trial 1379: 5-fold CV loss = 0.5205
[I 2025-08-07 23:50:25,651] Trial 1379 finished with value: 0.5204857170581818 and parameters: {'fp_type': 'morgan', 'morgan_only_radius': 2, 'morgan_only_nBits': 2048, 'num_hidden_layers': 3, 'hidden_dim_0': 512, 'hidden_dim_1': 128, 'hidden_dim_2': 512, 'kl_weight': 0.0005453122160172711, 'lr': 0.0020981741546941433, 'batch_size': 32, 'dropout_rate': 0.47706113904147746, 'prior_mu': 0.03488923610610358, 'prior_sigma': 0.06343611954155363, 'normalization': 'none'}. Best is trial 1281 with value: 0.5184582889080047.
Generating morgan fingerprints...
Generated fingerprints with 2048 features for 900 molecules
Data shape: X=(900, 2048), y=(900,)
Trial 1382: 5-fold CV loss = 0.5298
[I 2025-08-07 23:51:14,227] Trial 1382 finished with value: 0.5298152685165405 and parameters: {'fp_type': 'morgan', 'morgan_only_radius': 2, 'morgan_only_nBits': 2048, 'num_hidden_layers': 3, 'hidden_dim_0': 512, 'hidden_dim_1': 128, 'hidden_dim_2': 512, 'kl_weight': 0.0007869746686831868, 'lr': 0.0028304441388313484, 'batch_size': 32, 'dropout_rate': 0.48035817500230893, 'prior_mu': 0.06373943636334309, 'prior_sigma': 0.06392246537119128, 'normalization': 'none'}. Best is trial 1281 with value: 0.5184582889080047.
Generating morgan fingerprints...
Generated fingerprints with 2048 features for 900 molecules
Data shape: X=(900, 2048), y=(900,)
Trial 1383: 5-fold CV loss = 0.5721
[I 2025-08-07 23:51:51,237] Trial 1383 finished with value: 0.5720641732215881 and parameters: {'fp_type': 'morgan', 'morgan_only_radius': 2, 'morgan_only_nBits': 2048, 'num_hidden_layers': 3, 'hidden_dim_0': 512, 'hidden_dim_1': 128, 'hidden_dim_2': 512, 'kl_weight': 0.07023889467204501, 'lr': 0.0028398242635172865, 'batch_size': 32, 'dropout_rate': 0.49998928859681, 'prior_mu': 0.05822294469607488, 'prior_sigma': 0.06331803964359642, 'normalization': 'none'}. Best is trial 1281 with value: 0.5184582889080047.
Generating morgan fingerprints...
Generated fingerprints with 2048 features for 900 molecules
Data shape: X=(900, 2048), y=(900,)
Trial 1384: 5-fold CV loss = 0.5231
