[I 2025-08-07 16:29:24,977] Trial 175 finished with value: 0.5338530302047729 and parameters: {'fp_type': 'morgan_rdkit', 'combined_morgan_radius': 2, 'combined_morgan_nBits': 1024, 'combined_rdkit_maxPath': 5, 'combined_rdkit_nBits': 512, 'num_hidden_layers': 3, 'hidden_dim_0': 512, 'hidden_dim_1': 64, 'hidden_dim_2': 256, 'kl_weight': 0.00022554550901000202, 'lr': 0.006281773254966478, 'batch_size': 128, 'dropout_rate': 0.4928614288632478, 'prior_mu': -0.02012416243940447, 'prior_sigma': 0.07184018666992906, 'normalization': 'none'}. Best is trial 168 with value: 0.5297382354736329.
Generating morgan fingerprints...
Generated fingerprints with 1024 features for 900 molecules
Data shape: X=(900, 1024), y=(900,)
Trial 174: 5-fold CV loss = 0.5462
[I 2025-08-07 16:29:35,592] Trial 174 finished with value: 0.5461575329303742 and parameters: {'fp_type': 'morgan_rdkit', 'combined_morgan_radius': 2, 'combined_morgan_nBits': 1024, 'combined_rdkit_maxPath': 5, 'combined_rdkit_nBits': 512, 'num_hidden_layers': 3, 'hidden_dim_0': 512, 'hidden_dim_1': 64, 'hidden_dim_2': 256, 'kl_weight': 0.00023178557183909501, 'lr': 0.006159639473433574, 'batch_size': 128, 'dropout_rate': 0.4996992642253687, 'prior_mu': -0.025297153873840725, 'prior_sigma': 0.05021144704626143, 'normalization': 'none'}. Best is trial 168 with value: 0.5297382354736329.
Generating morgan fingerprints...
Generated fingerprints with 1024 features for 900 molecules
Data shape: X=(900, 1024), y=(900,)
Trial 178: 5-fold CV loss = 0.5513
[I 2025-08-07 16:29:53,218] Trial 178 finished with value: 0.5512763082981109 and parameters: {'fp_type': 'morgan', 'morgan_only_radius': 2, 'morgan_only_nBits': 1024, 'num_hidden_layers': 3, 'hidden_dim_0': 256, 'hidden_dim_1': 128, 'hidden_dim_2': 1024, 'kl_weight': 0.00022366340295994693, 'lr': 0.006131674471090168, 'batch_size': 64, 'dropout_rate': 0.28667657104510963, 'prior_mu': -0.017842277415201366, 'prior_sigma': 0.07016468797613408, 'normalization': 'none'}. Best is trial 168 with value: 0.5297382354736329.
Generating morgan fingerprints...
Generated fingerprints with 1024 features for 900 molecules
Data shape: X=(900, 1024), y=(900,)
Trial 179: 5-fold CV loss = 0.5528
[I 2025-08-07 16:29:56,997] Trial 179 finished with value: 0.5527804136276245 and parameters: {'fp_type': 'morgan', 'morgan_only_radius': 2, 'morgan_only_nBits': 1024, 'num_hidden_layers': 3, 'hidden_dim_0': 128, 'hidden_dim_1': 128, 'hidden_dim_2': 1024, 'kl_weight': 0.00027660908411610154, 'lr': 0.006325359654961259, 'batch_size': 64, 'dropout_rate': 0.2772448880162778, 'prior_mu': -0.019128105062222227, 'prior_sigma': 0.0705019526537114, 'normalization': 'none'}. Best is trial 168 with value: 0.5297382354736329.
Generating rdkit fingerprints...
Generated fingerprints with 1024 features for 900 molecules
Data shape: X=(900, 1024), y=(900,)
Trial 181: 5-fold CV loss = 0.5592
[I 2025-08-07 16:30:22,375] Trial 181 finished with value: 0.5591533839702606 and parameters: {'fp_type': 'morgan', 'morgan_only_radius': 2, 'morgan_only_nBits': 1024, 'num_hidden_layers': 3, 'hidden_dim_0': 256, 'hidden_dim_1': 128, 'hidden_dim_2': 1024, 'kl_weight': 0.0005607405655834799, 'lr': 0.007045969572312203, 'batch_size': 64, 'dropout_rate': 0.3321221083530921, 'prior_mu': 0.0026255330369296635, 'prior_sigma': 0.07208128353666406, 'normalization': 'none'}. Best is trial 168 with value: 0.5297382354736329.
Generating rdkit fingerprints...
Generated fingerprints with 512 features for 900 molecules
Data shape: X=(900, 512), y=(900,)
Trial 180: 5-fold CV loss = 0.5345
[I 2025-08-07 16:30:32,633] Trial 180 finished with value: 0.534517914056778 and parameters: {'fp_type': 'morgan', 'morgan_only_radius': 2, 'morgan_only_nBits': 1024, 'num_hidden_layers': 3, 'hidden_dim_0': 256, 'hidden_dim_1': 128, 'hidden_dim_2': 1024, 'kl_weight': 0.00027769200257632344, 'lr': 0.004547157197627292, 'batch_size': 64, 'dropout_rate': 0.33875793426779216, 'prior_mu': -0.005234742198433832, 'prior_sigma': 0.0707084624499198, 'normalization': 'none'}. Best is trial 168 with value: 0.5297382354736329.
Generating morgan fingerprints...
Generated fingerprints with 1024 features for 900 molecules
Data shape: X=(900, 1024), y=(900,)
Trial 183: 5-fold CV loss = 0.6641
[I 2025-08-07 16:30:37,117] Trial 183 finished with value: 0.6640699148178101 and parameters: {'fp_type': 'rdkit', 'rdkit_only_maxPath': 8, 'rdkit_only_nBits': 512, 'num_hidden_layers': 3, 'hidden_dim_0': 256, 'hidden_dim_1': 512, 'hidden_dim_2': 256, 'kl_weight': 0.0004241502129841329, 'lr': 0.004708278941283858, 'batch_size': 128, 'dropout_rate': 0.4662572018374682, 'prior_mu': -0.005720358924574023, 'prior_sigma': 0.06367819944226802, 'normalization': 'none'}. Best is trial 168 with value: 0.5297382354736329.
Generating morgan fingerprints...
Generated fingerprints with 1024 features for 900 molecules
Data shape: X=(900, 1024), y=(900,)
Trial 177: 5-fold CV loss = 0.5485
[I 2025-08-07 16:30:48,053] Trial 177 finished with value: 0.5485123455524444 and parameters: {'fp_type': 'morgan', 'morgan_only_radius': 2, 'morgan_only_nBits': 1024, 'num_hidden_layers': 3, 'hidden_dim_0': 256, 'hidden_dim_1': 128, 'hidden_dim_2': 1024, 'kl_weight': 0.0005226760543473266, 'lr': 0.006143065220581483, 'batch_size': 64, 'dropout_rate': 0.25824242943204734, 'prior_mu': 0.007943620776924891, 'prior_sigma': 0.06928171249928676, 'normalization': 'none'}. Best is trial 168 with value: 0.5297382354736329.
Generating morgan fingerprints...
Generated fingerprints with 1024 features for 900 molecules
Data shape: X=(900, 1024), y=(900,)
Trial 182: 5-fold CV loss = 0.6058
[I 2025-08-07 16:31:01,472] Trial 182 finished with value: 0.6057535529136657 and parameters: {'fp_type': 'rdkit', 'rdkit_only_maxPath': 8, 'rdkit_only_nBits': 1024, 'num_hidden_layers': 3, 'hidden_dim_0': 256, 'hidden_dim_1': 512, 'hidden_dim_2': 256, 'kl_weight': 0.00041474111544948227, 'lr': 0.007141579248928542, 'batch_size': 64, 'dropout_rate': 0.33272711248798026, 'prior_mu': -0.002385769584899604, 'prior_sigma': 0.06215718578133078, 'normalization': 'none'}. Best is trial 168 with value: 0.5297382354736329.
Generating morgan fingerprints...
Generated fingerprints with 1024 features for 900 molecules
Data shape: X=(900, 1024), y=(900,)
Trial 185: 5-fold CV loss = 0.5405
[I 2025-08-07 16:31:15,097] Trial 185 finished with value: 0.5404747366905213 and parameters: {'fp_type': 'morgan', 'morgan_only_radius': 2, 'morgan_only_nBits': 1024, 'num_hidden_layers': 3, 'hidden_dim_0': 256, 'hidden_dim_1': 128, 'hidden_dim_2': 1024, 'kl_weight': 0.00028122472615117733, 'lr': 0.004792228433931128, 'batch_size': 64, 'dropout_rate': 0.35443580714297845, 'prior_mu': 0.009906405410811638, 'prior_sigma': 0.06792171742239525, 'normalization': 'none'}. Best is trial 168 with value: 0.5297382354736329.
Generating morgan fingerprints...
Generated fingerprints with 1024 features for 900 molecules
Data shape: X=(900, 1024), y=(900,)
Trial 184: 5-fold CV loss = 0.5418
[I 2025-08-07 16:31:31,163] Trial 184 finished with value: 0.5417689323425293 and parameters: {'fp_type': 'morgan', 'morgan_only_radius': 2, 'morgan_only_nBits': 1024, 'num_hidden_layers': 3, 'hidden_dim_0': 256, 'hidden_dim_1': 128, 'hidden_dim_2': 1024, 'kl_weight': 0.00040096159040330017, 'lr': 0.004587190515495973, 'batch_size': 64, 'dropout_rate': 0.34159485839167225, 'prior_mu': -0.0034618434562733516, 'prior_sigma': 0.06254419341734761, 'normalization': 'none'}. Best is trial 168 with value: 0.5297382354736329.
Generating morgan fingerprints...
Generated fingerprints with 1024 features for 900 molecules
Data shape: X=(900, 1024), y=(900,)
Trial 187: 5-fold CV loss = 0.5375
[I 2025-08-07 16:31:40,130] Trial 187 finished with value: 0.5375135779380799 and parameters: {'fp_type': 'morgan', 'morgan_only_radius': 2, 'morgan_only_nBits': 1024, 'num_hidden_layers': 3, 'hidden_dim_0': 512, 'hidden_dim_1': 128, 'hidden_dim_2': 1024, 'kl_weight': 0.00028727202534236334, 'lr': 0.0032885005276167187, 'batch_size': 64, 'dropout_rate': 0.35987176283743755, 'prior_mu': -0.035854786897293794, 'prior_sigma': 0.07202370326153285, 'normalization': 'none'}. Best is trial 168 with value: 0.5297382354736329.
Generating morgan_rdkit fingerprints...
Generated fingerprints with 1536 features for 900 molecules
Data shape: X=(900, 1536), y=(900,)
Trial 188: 5-fold CV loss = 0.5579
[I 2025-08-07 16:31:58,678] Trial 188 finished with value: 0.5578646063804626 and parameters: {'fp_type': 'morgan', 'morgan_only_radius': 2, 'morgan_only_nBits': 1024, 'num_hidden_layers': 3, 'hidden_dim_0': 256, 'hidden_dim_1': 128, 'hidden_dim_2': 128, 'kl_weight': 0.0002581057415230982, 'lr': 0.003842841231546688, 'batch_size': 64, 'dropout_rate': 0.33865480751013943, 'prior_mu': -0.036544641678353466, 'prior_sigma': 0.053424248846395544, 'normalization': 'none'}. Best is trial 168 with value: 0.5297382354736329.
Generating morgan_rdkit fingerprints...
Generated fingerprints with 1536 features for 900 molecules
Data shape: X=(900, 1536), y=(900,)
Trial 189: 5-fold CV loss = 0.6218
[I 2025-08-07 16:32:02,202] Trial 189 finished with value: 0.6218343496322631 and parameters: {'fp_type': 'morgan', 'morgan_only_radius': 2, 'morgan_only_nBits': 1024, 'num_hidden_layers': 3, 'hidden_dim_0': 512, 'hidden_dim_1': 256, 'hidden_dim_2': 256, 'kl_weight': 0.0002537188577695724, 'lr': 0.005508433269773135, 'batch_size': 128, 'dropout_rate': 0.30644288143904685, 'prior_mu': 0.1531047959521255, 'prior_sigma': 0.07224193307816573, 'normalization': 'none'}. Best is trial 168 with value: 0.5297382354736329.
Generating morgan_rdkit fingerprints...
Generated fingerprints with 1536 features for 900 molecules
Data shape: X=(900, 1536), y=(900,)
Trial 191: 5-fold CV loss = 0.8488
[I 2025-08-07 16:32:07,221] Trial 191 finished with value: 0.848752248287201 and parameters: {'fp_type': 'morgan_rdkit', 'combined_morgan_radius': 2, 'combined_morgan_nBits': 1024, 'combined_rdkit_maxPath': 7, 'combined_rdkit_nBits': 512, 'num_hidden_layers': 0, 'kl_weight': 0.0001968314228576916, 'lr': 0.005620082292901245, 'batch_size': 128, 'dropout_rate': 0.49922938738048367, 'prior_mu': -0.02700137567128618, 'prior_sigma': 0.08048834346353535, 'normalization': 'none'}. Best is trial 168 with value: 0.5297382354736329.
Generating morgan_rdkit fingerprints...
Generated fingerprints with 1536 features for 900 molecules
Data shape: X=(900, 1536), y=(900,)
Trial 190: 5-fold CV loss = 0.8899
[I 2025-08-07 16:32:14,814] Trial 190 finished with value: 0.8899304509162903 and parameters: {'fp_type': 'morgan_rdkit', 'combined_morgan_radius': 2, 'combined_morgan_nBits': 1024, 'combined_rdkit_maxPath': 7, 'combined_rdkit_nBits': 512, 'num_hidden_layers': 3, 'hidden_dim_0': 512, 'hidden_dim_1': 256, 'hidden_dim_2': 128, 'kl_weight': 0.09624330234383048, 'lr': 0.005618217660921156, 'batch_size': 128, 'dropout_rate': 0.4912257509279619, 'prior_mu': 0.15671631660525345, 'prior_sigma': 0.05378210738127441, 'normalization': 'none'}. Best is trial 168 with value: 0.5297382354736329.
Generating morgan fingerprints...
Generated fingerprints with 1024 features for 900 molecules
Data shape: X=(900, 1024), y=(900,)
Trial 186: 5-fold CV loss = 0.5387
[I 2025-08-07 16:32:28,765] Trial 186 finished with value: 0.5387148022651672 and parameters: {'fp_type': 'morgan', 'morgan_only_radius': 2, 'morgan_only_nBits': 1024, 'num_hidden_layers': 3, 'hidden_dim_0': 256, 'hidden_dim_1': 128, 'hidden_dim_2': 1024, 'kl_weight': 0.0002818505914760478, 'lr': 0.004804234543643012, 'batch_size': 64, 'dropout_rate': 0.3486420372886513, 'prior_mu': -0.003950120623786534, 'prior_sigma': 0.07203165266828508, 'normalization': 'none'}. Best is trial 168 with value: 0.5297382354736329.
Generating morgan fingerprints...
Generated fingerprints with 1024 features for 900 molecules
Data shape: X=(900, 1024), y=(900,)
Trial 193: 5-fold CV loss = 0.5452
[I 2025-08-07 16:32:32,778] Trial 193 finished with value: 0.5452472865581512 and parameters: {'fp_type': 'morgan_rdkit', 'combined_morgan_radius': 2, 'combined_morgan_nBits': 1024, 'combined_rdkit_maxPath': 5, 'combined_rdkit_nBits': 512, 'num_hidden_layers': 3, 'hidden_dim_0': 512, 'hidden_dim_1': 64, 'hidden_dim_2': 256, 'kl_weight': 0.000654443507948792, 'lr': 0.007268851881860057, 'batch_size': 128, 'dropout_rate': 0.3250189172780685, 'prior_mu': 0.1426619711890187, 'prior_sigma': 0.08280529865724143, 'normalization': 'none'}. Best is trial 168 with value: 0.5297382354736329.
Generating morgan fingerprints...
Generated fingerprints with 1024 features for 900 molecules
Data shape: X=(900, 1024), y=(900,)
Trial 192: 5-fold CV loss = 0.5543
[I 2025-08-07 16:32:40,441] Trial 192 finished with value: 0.5543296217918396 and parameters: {'fp_type': 'morgan_rdkit', 'combined_morgan_radius': 2, 'combined_morgan_nBits': 1024, 'combined_rdkit_maxPath': 7, 'combined_rdkit_nBits': 512, 'num_hidden_layers': 3, 'hidden_dim_0': 512, 'hidden_dim_1': 64, 'hidden_dim_2': 256, 'kl_weight': 0.00020181647616868403, 'lr': 0.005694739668009027, 'batch_size': 128, 'dropout_rate': 0.4890098367772909, 'prior_mu': -0.027786086050575982, 'prior_sigma': 0.08066203022633055, 'normalization': 'none'}. Best is trial 168 with value: 0.5297382354736329.
Generating morgan fingerprints...
Generated fingerprints with 1024 features for 900 molecules
Data shape: X=(900, 1024), y=(900,)
Trial 194: 5-fold CV loss = 0.5338
[I 2025-08-07 16:33:00,426] Trial 194 finished with value: 0.5337770164012909 and parameters: {'fp_type': 'morgan', 'morgan_only_radius': 2, 'morgan_only_nBits': 1024, 'num_hidden_layers': 3, 'hidden_dim_0': 512, 'hidden_dim_1': 128, 'hidden_dim_2': 1024, 'kl_weight': 0.00032807319355519576, 'lr': 0.002441982499905114, 'batch_size': 64, 'dropout_rate': 0.35743024721645794, 'prior_mu': 0.1431130436998528, 'prior_sigma': 0.07420914344561255, 'normalization': 'none'}. Best is trial 168 with value: 0.5297382354736329.
Generating morgan fingerprints...
Generated fingerprints with 1024 features for 900 molecules
Data shape: X=(900, 1024), y=(900,)
Trial 196: 5-fold CV loss = 0.5326
[I 2025-08-07 16:33:10,970] Trial 196 finished with value: 0.5326043367385864 and parameters: {'fp_type': 'morgan', 'morgan_only_radius': 2, 'morgan_only_nBits': 1024, 'num_hidden_layers': 3, 'hidden_dim_0': 512, 'hidden_dim_1': 128, 'hidden_dim_2': 1024, 'kl_weight': 0.0003593840744193232, 'lr': 0.00370761580109701, 'batch_size': 64, 'dropout_rate': 0.37895906302681054, 'prior_mu': -0.01524960593463575, 'prior_sigma': 0.059068629143052075, 'normalization': 'none'}. Best is trial 168 with value: 0.5297382354736329.
Generating morgan fingerprints...
Generated fingerprints with 1024 features for 900 molecules
Data shape: X=(900, 1024), y=(900,)
Trial 197: 5-fold CV loss = 0.5616
[I 2025-08-07 16:33:12,451] Trial 197 finished with value: 0.561622154712677 and parameters: {'fp_type': 'morgan', 'morgan_only_radius': 2, 'morgan_only_nBits': 1024, 'num_hidden_layers': 3, 'hidden_dim_0': 512, 'hidden_dim_1': 128, 'hidden_dim_2': 1024, 'kl_weight': 0.0003560116611914264, 'lr': 0.006697845392018689, 'batch_size': 64, 'dropout_rate': 0.37880529463080503, 'prior_mu': -0.015502664135625479, 'prior_sigma': 0.07382786765436865, 'normalization': 'none'}. Best is trial 168 with value: 0.5297382354736329.
Generating morgan fingerprints...
Generated fingerprints with 1024 features for 900 molecules
Data shape: X=(900, 1024), y=(900,)
Trial 198: 5-fold CV loss = 0.5332
[I 2025-08-07 16:33:39,727] Trial 198 finished with value: 0.5331506192684173 and parameters: {'fp_type': 'morgan', 'morgan_only_radius': 2, 'morgan_only_nBits': 1024, 'num_hidden_layers': 3, 'hidden_dim_0': 512, 'hidden_dim_1': 128, 'hidden_dim_2': 1024, 'kl_weight': 0.0003236062966667949, 'lr': 0.0029747218813993654, 'batch_size': 64, 'dropout_rate': 0.3811936248796721, 'prior_mu': 0.12584407499538997, 'prior_sigma': 0.06657437632525925, 'normalization': 'none'}. Best is trial 168 with value: 0.5297382354736329.
Generating morgan fingerprints...
Generated fingerprints with 1024 features for 900 molecules
Data shape: X=(900, 1024), y=(900,)
Trial 199: 5-fold CV loss = 0.6022
[I 2025-08-07 16:34:03,475] Trial 199 finished with value: 0.6021911144256592 and parameters: {'fp_type': 'morgan', 'morgan_only_radius': 2, 'morgan_only_nBits': 1024, 'num_hidden_layers': 3, 'hidden_dim_0': 512, 'hidden_dim_1': 128, 'hidden_dim_2': 1024, 'kl_weight': 0.0003408966957390748, 'lr': 0.0024013292916826154, 'batch_size': 64, 'dropout_rate': 0.39502102737267925, 'prior_mu': -0.016049782526296807, 'prior_sigma': 0.06050454263858546, 'normalization': 'none'}. Best is trial 168 with value: 0.5297382354736329.
Generating morgan fingerprints...
Generated fingerprints with 1024 features for 900 molecules
Data shape: X=(900, 1024), y=(900,)
Trial 200: 5-fold CV loss = 0.5292
[I 2025-08-07 16:34:15,308] Trial 200 finished with value: 0.5292435944080353 and parameters: {'fp_type': 'morgan', 'morgan_only_radius': 2, 'morgan_only_nBits': 1024, 'num_hidden_layers': 3, 'hidden_dim_0': 512, 'hidden_dim_1': 128, 'hidden_dim_2': 1024, 'kl_weight': 0.0003316648657534367, 'lr': 0.003069484793813924, 'batch_size': 64, 'dropout_rate': 0.3968910003615797, 'prior_mu': 0.12633035149509741, 'prior_sigma': 0.05868863053287168, 'normalization': 'none'}. Best is trial 200 with value: 0.5292435944080353.
Generating morgan fingerprints...
Generated fingerprints with 1024 features for 900 molecules
Data shape: X=(900, 1024), y=(900,)
Trial 195: 5-fold CV loss = 0.5390
[I 2025-08-07 16:34:17,610] Trial 195 finished with value: 0.5390199899673462 and parameters: {'fp_type': 'morgan', 'morgan_only_radius': 2, 'morgan_only_nBits': 1024, 'num_hidden_layers': 3, 'hidden_dim_0': 512, 'hidden_dim_1': 128, 'hidden_dim_2': 1024, 'kl_weight': 0.00032062410162560104, 'lr': 0.0030922049066307578, 'batch_size': 64, 'dropout_rate': 0.3825298273961174, 'prior_mu': 0.1427096477411637, 'prior_sigma': 0.0739497899213071, 'normalization': 'none'}. Best is trial 200 with value: 0.5292435944080353.
Generating morgan fingerprints...
Generated fingerprints with 1024 features for 900 molecules
Data shape: X=(900, 1024), y=(900,)
Trial 201: 5-fold CV loss = 0.5516
[I 2025-08-07 16:34:21,540] Trial 201 finished with value: 0.5516438603401184 and parameters: {'fp_type': 'morgan', 'morgan_only_radius': 2, 'morgan_only_nBits': 1024, 'num_hidden_layers': 3, 'hidden_dim_0': 512, 'hidden_dim_1': 128, 'hidden_dim_2': 1024, 'kl_weight': 0.00032838769241246463, 'lr': 0.0026135000006394763, 'batch_size': 64, 'dropout_rate': 0.315515182817686, 'prior_mu': 0.13676870535472666, 'prior_sigma': 0.058748543275743054, 'normalization': 'none'}. Best is trial 200 with value: 0.5292435944080353.
Generating morgan fingerprints...
Generated fingerprints with 1024 features for 900 molecules
Data shape: X=(900, 1024), y=(900,)
Trial 202: 5-fold CV loss = 0.5625
[I 2025-08-07 16:34:39,854] Trial 202 finished with value: 0.562466311454773 and parameters: {'fp_type': 'morgan', 'morgan_only_radius': 2, 'morgan_only_nBits': 1024, 'num_hidden_layers': 3, 'hidden_dim_0': 512, 'hidden_dim_1': 128, 'hidden_dim_2': 1024, 'kl_weight': 0.0079944330682013, 'lr': 0.0034552356314112975, 'batch_size': 64, 'dropout_rate': 0.47523941035527795, 'prior_mu': 0.13725640964714525, 'prior_sigma': 0.06555017146473098, 'normalization': 'none'}. Best is trial 200 with value: 0.5292435944080353.
Generating morgan fingerprints...
Generated fingerprints with 1024 features for 900 molecules
Data shape: X=(900, 1024), y=(900,)
Trial 205: 5-fold CV loss = 0.5375
[I 2025-08-07 16:34:55,879] Trial 205 finished with value: 0.5375073730945588 and parameters: {'fp_type': 'morgan', 'morgan_only_radius': 2, 'morgan_only_nBits': 1024, 'num_hidden_layers': 3, 'hidden_dim_0': 512, 'hidden_dim_1': 128, 'hidden_dim_2': 1024, 'kl_weight': 0.00023137282188342295, 'lr': 0.0035414762674516793, 'batch_size': 64, 'dropout_rate': 0.3633007924106712, 'prior_mu': 0.1288626270001112, 'prior_sigma': 0.06763102456438924, 'normalization': 'none'}. Best is trial 200 with value: 0.5292435944080353.
Generating morgan fingerprints...
Generated fingerprints with 1024 features for 900 molecules
Data shape: X=(900, 1024), y=(900,)
Trial 203: 5-fold CV loss = 0.5293
[I 2025-08-07 16:35:23,800] Trial 203 finished with value: 0.5292940199375152 and parameters: {'fp_type': 'morgan', 'morgan_only_radius': 2, 'morgan_only_nBits': 1024, 'num_hidden_layers': 3, 'hidden_dim_0': 512, 'hidden_dim_1': 128, 'hidden_dim_2': 1024, 'kl_weight': 0.0004528356884247737, 'lr': 0.0028767886591260132, 'batch_size': 64, 'dropout_rate': 0.4778501410487641, 'prior_mu': 0.12390554932399463, 'prior_sigma': 0.05922635384096617, 'normalization': 'none'}. Best is trial 200 with value: 0.5292435944080353.
Generating morgan fingerprints...
Generated fingerprints with 1024 features for 900 molecules
Data shape: X=(900, 1024), y=(900,)
Trial 206: 5-fold CV loss = 0.5346
[I 2025-08-07 16:35:25,639] Trial 206 finished with value: 0.5345654964447022 and parameters: {'fp_type': 'morgan', 'morgan_only_radius': 2, 'morgan_only_nBits': 1024, 'num_hidden_layers': 3, 'hidden_dim_0': 512, 'hidden_dim_1': 128, 'hidden_dim_2': 1024, 'kl_weight': 0.00045048892190731554, 'lr': 0.002853389500467886, 'batch_size': 64, 'dropout_rate': 0.368401991967355, 'prior_mu': 0.12893256576956297, 'prior_sigma': 0.05686911080958574, 'normalization': 'none'}. Best is trial 200 with value: 0.5292435944080353.
Generating morgan fingerprints...
Generated fingerprints with 1024 features for 900 molecules
Data shape: X=(900, 1024), y=(900,)
Trial 207: 5-fold CV loss = 0.5384
