[I 2025-08-07 22:10:59,952] Trial 1101 finished with value: 0.5352643668651581 and parameters: {'fp_type': 'morgan', 'morgan_only_radius': 2, 'morgan_only_nBits': 1024, 'num_hidden_layers': 3, 'hidden_dim_0': 512, 'hidden_dim_1': 64, 'hidden_dim_2': 512, 'kl_weight': 0.00032019370299674407, 'lr': 0.0018284098230632393, 'batch_size': 32, 'dropout_rate': 0.4824825170599021, 'prior_mu': -0.033545126994013866, 'prior_sigma': 0.08457703838648142, 'normalization': 'none'}. Best is trial 272 with value: 0.5198344707489013.
Generating morgan_rdkit fingerprints...
Generated fingerprints with 768 features for 900 molecules
Data shape: X=(900, 768), y=(900,)
Trial 1100: 5-fold CV loss = 0.5349
[I 2025-08-07 22:11:34,758] Trial 1100 finished with value: 0.5348876237869262 and parameters: {'fp_type': 'morgan', 'morgan_only_radius': 2, 'morgan_only_nBits': 1024, 'num_hidden_layers': 3, 'hidden_dim_0': 512, 'hidden_dim_1': 128, 'hidden_dim_2': 512, 'kl_weight': 0.00020866646646008926, 'lr': 0.0018141684626043922, 'batch_size': 32, 'dropout_rate': 0.4817307751331928, 'prior_mu': -0.03001879494962581, 'prior_sigma': 0.08431683162112683, 'normalization': 'none'}. Best is trial 272 with value: 0.5198344707489013.
Generating morgan_rdkit fingerprints...
Generated fingerprints with 768 features for 900 molecules
Data shape: X=(900, 768), y=(900,)
Trial 1103: 5-fold CV loss = 0.5359
[I 2025-08-07 22:11:38,534] Trial 1103 finished with value: 0.5359238386154175 and parameters: {'fp_type': 'morgan', 'morgan_only_radius': 2, 'morgan_only_nBits': 1024, 'num_hidden_layers': 3, 'hidden_dim_0': 512, 'hidden_dim_1': 64, 'hidden_dim_2': 512, 'kl_weight': 0.0001728336449744826, 'lr': 0.0020638331594546823, 'batch_size': 32, 'dropout_rate': 0.47937995018633195, 'prior_mu': -0.033149809017542, 'prior_sigma': 0.08396842657703531, 'normalization': 'none'}. Best is trial 272 with value: 0.5198344707489013.
Generating morgan_rdkit fingerprints...
Generated fingerprints with 768 features for 900 molecules
Data shape: X=(900, 768), y=(900,)
Trial 1104: 5-fold CV loss = 0.6389
[I 2025-08-07 22:11:44,179] Trial 1104 finished with value: 0.6389204263687134 and parameters: {'fp_type': 'morgan_rdkit', 'combined_morgan_radius': 2, 'combined_morgan_nBits': 512, 'combined_rdkit_maxPath': 6, 'combined_rdkit_nBits': 256, 'num_hidden_layers': 3, 'hidden_dim_0': 512, 'hidden_dim_1': 64, 'hidden_dim_2': 256, 'kl_weight': 0.0002261250596058556, 'lr': 0.002067690130765976, 'batch_size': 32, 'dropout_rate': 0.4997436053883081, 'prior_mu': -0.029194887839965166, 'prior_sigma': 0.08129971095825894, 'normalization': 'none'}. Best is trial 272 with value: 0.5198344707489013.
Generating morgan fingerprints...
Generated fingerprints with 2048 features for 900 molecules
Data shape: X=(900, 2048), y=(900,)
Trial 1106: 5-fold CV loss = 0.6185
[I 2025-08-07 22:12:31,055] Trial 1106 finished with value: 0.6184676468372345 and parameters: {'fp_type': 'morgan_rdkit', 'combined_morgan_radius': 2, 'combined_morgan_nBits': 512, 'combined_rdkit_maxPath': 6, 'combined_rdkit_nBits': 256, 'num_hidden_layers': 3, 'hidden_dim_0': 512, 'hidden_dim_1': 64, 'hidden_dim_2': 256, 'kl_weight': 0.00017258679856112387, 'lr': 0.0026997702842635734, 'batch_size': 32, 'dropout_rate': 0.49181128728718193, 'prior_mu': -0.04008473611056394, 'prior_sigma': 0.06686325859119706, 'normalization': 'none'}. Best is trial 272 with value: 0.5198344707489013.
Generating morgan fingerprints...
Generated fingerprints with 2048 features for 900 molecules
Data shape: X=(900, 2048), y=(900,)
Trial 1107: 5-fold CV loss = 0.5340
[I 2025-08-07 22:12:53,593] Trial 1107 finished with value: 0.5339894235134125 and parameters: {'fp_type': 'morgan', 'morgan_only_radius': 2, 'morgan_only_nBits': 2048, 'num_hidden_layers': 3, 'hidden_dim_0': 512, 'hidden_dim_1': 64, 'hidden_dim_2': 512, 'kl_weight': 0.00013961604953066187, 'lr': 0.0026863122400244965, 'batch_size': 32, 'dropout_rate': 0.49987777902262454, 'prior_mu': -0.03911651044006272, 'prior_sigma': 0.0677016809917065, 'normalization': 'none'}. Best is trial 272 with value: 0.5198344707489013.
Generating morgan fingerprints...
Generated fingerprints with 2048 features for 900 molecules
Data shape: X=(900, 2048), y=(900,)
Trial 1108: 5-fold CV loss = 1.3679
[I 2025-08-07 22:13:15,367] Trial 1108 finished with value: 1.367933416366577 and parameters: {'fp_type': 'morgan', 'morgan_only_radius': 2, 'morgan_only_nBits': 2048, 'num_hidden_layers': 3, 'hidden_dim_0': 512, 'hidden_dim_1': 128, 'hidden_dim_2': 512, 'kl_weight': 0.00014772396173061815, 'lr': 0.0008179044446004773, 'batch_size': 32, 'dropout_rate': 0.4772944572042688, 'prior_mu': -0.026286870226782243, 'prior_sigma': 0.07526943832961322, 'normalization': 'none'}. Best is trial 272 with value: 0.5198344707489013.
Generating morgan fingerprints...
Generated fingerprints with 1024 features for 900 molecules
Data shape: X=(900, 1024), y=(900,)
Trial 1105: 5-fold CV loss = 0.6368
[I 2025-08-07 22:13:31,596] Trial 1105 finished with value: 0.6368040800094604 and parameters: {'fp_type': 'morgan_rdkit', 'combined_morgan_radius': 2, 'combined_morgan_nBits': 512, 'combined_rdkit_maxPath': 6, 'combined_rdkit_nBits': 256, 'num_hidden_layers': 3, 'hidden_dim_0': 512, 'hidden_dim_1': 64, 'hidden_dim_2': 512, 'kl_weight': 0.00017340816123396745, 'lr': 0.002073329269712412, 'batch_size': 32, 'dropout_rate': 0.49933098954466787, 'prior_mu': -0.03444082323976973, 'prior_sigma': 0.08044238262290943, 'normalization': 'none'}. Best is trial 272 with value: 0.5198344707489013.
Generating morgan fingerprints...
Generated fingerprints with 1024 features for 900 molecules
Data shape: X=(900, 1024), y=(900,)
Trial 1109: 5-fold CV loss = 0.5272
[I 2025-08-07 22:14:30,946] Trial 1109 finished with value: 0.5271686017513275 and parameters: {'fp_type': 'morgan', 'morgan_only_radius': 2, 'morgan_only_nBits': 2048, 'num_hidden_layers': 3, 'hidden_dim_0': 512, 'hidden_dim_1': 64, 'hidden_dim_2': 512, 'kl_weight': 0.0003498443087979801, 'lr': 0.0022278718051221835, 'batch_size': 32, 'dropout_rate': 0.47635274670778893, 'prior_mu': -0.0289228398075809, 'prior_sigma': 0.06309984756274477, 'normalization': 'none'}. Best is trial 272 with value: 0.5198344707489013.
Generating morgan fingerprints...
Generated fingerprints with 1024 features for 900 molecules
Data shape: X=(900, 1024), y=(900,)
Trial 1110: 5-fold CV loss = 0.5271
[I 2025-08-07 22:14:32,396] Trial 1110 finished with value: 0.5271049201488495 and parameters: {'fp_type': 'morgan', 'morgan_only_radius': 2, 'morgan_only_nBits': 1024, 'num_hidden_layers': 3, 'hidden_dim_0': 512, 'hidden_dim_1': 128, 'hidden_dim_2': 512, 'kl_weight': 0.00018357514680957188, 'lr': 0.0022908701242852813, 'batch_size': 32, 'dropout_rate': 0.4907449969749258, 'prior_mu': -0.025476535864295952, 'prior_sigma': 0.06249415119179288, 'normalization': 'none'}. Best is trial 272 with value: 0.5198344707489013.
Generating morgan fingerprints...
Generated fingerprints with 1024 features for 900 molecules
Data shape: X=(900, 1024), y=(900,)
Trial 1112: 5-fold CV loss = 0.6326
[I 2025-08-07 22:14:49,644] Trial 1112 finished with value: 0.6325629770755767 and parameters: {'fp_type': 'morgan', 'morgan_only_radius': 2, 'morgan_only_nBits': 1024, 'num_hidden_layers': 3, 'hidden_dim_0': 512, 'hidden_dim_1': 64, 'hidden_dim_2': 512, 'kl_weight': 0.00020589040541145606, 'lr': 0.0028911915930329886, 'batch_size': 128, 'dropout_rate': 0.4912401994970267, 'prior_mu': -0.024128690063115292, 'prior_sigma': 0.0588350761616898, 'normalization': 'layer'}. Best is trial 272 with value: 0.5198344707489013.
Generating morgan fingerprints...
Generated fingerprints with 2048 features for 900 molecules
Data shape: X=(900, 2048), y=(900,)
Trial 1113: 5-fold CV loss = 0.6578
[I 2025-08-07 22:14:53,449] Trial 1113 finished with value: 0.6578372359275818 and parameters: {'fp_type': 'morgan', 'morgan_only_radius': 2, 'morgan_only_nBits': 1024, 'num_hidden_layers': 3, 'hidden_dim_0': 512, 'hidden_dim_1': 64, 'hidden_dim_2': 512, 'kl_weight': 0.0002983442611633459, 'lr': 0.0006989088173108976, 'batch_size': 128, 'dropout_rate': 0.44329180547092584, 'prior_mu': -0.012014447567926403, 'prior_sigma': 0.05942859401195992, 'normalization': 'layer'}. Best is trial 272 with value: 0.5198344707489013.
Generating morgan fingerprints...
Generated fingerprints with 2048 features for 900 molecules
Data shape: X=(900, 2048), y=(900,)
Trial 1102: 5-fold CV loss = 0.5379
[I 2025-08-07 22:15:44,425] Trial 1102 finished with value: 0.537902319431305 and parameters: {'fp_type': 'morgan', 'morgan_only_radius': 2, 'morgan_only_nBits': 1024, 'num_hidden_layers': 3, 'hidden_dim_0': 512, 'hidden_dim_1': 64, 'hidden_dim_2': 512, 'kl_weight': 0.0009594812093136128, 'lr': 0.001785437572545643, 'batch_size': 32, 'dropout_rate': 0.49993739037036683, 'prior_mu': -0.02967073981736393, 'prior_sigma': 0.08177460325664004, 'normalization': 'none'}. Best is trial 272 with value: 0.5198344707489013.
Generating morgan fingerprints...
Generated fingerprints with 2048 features for 900 molecules
Data shape: X=(900, 2048), y=(900,)
Trial 1115: 5-fold CV loss = 0.5264
[I 2025-08-07 22:15:52,437] Trial 1115 finished with value: 0.5263604283332824 and parameters: {'fp_type': 'morgan', 'morgan_only_radius': 2, 'morgan_only_nBits': 2048, 'num_hidden_layers': 3, 'hidden_dim_0': 512, 'hidden_dim_1': 128, 'hidden_dim_2': 512, 'kl_weight': 0.00021081389552292604, 'lr': 0.002522322754597176, 'batch_size': 32, 'dropout_rate': 0.4829197397262591, 'prior_mu': 0.053407650155445845, 'prior_sigma': 0.06855725708449323, 'normalization': 'none'}. Best is trial 272 with value: 0.5198344707489013.
Generating morgan fingerprints...
Generated fingerprints with 2048 features for 900 molecules
Data shape: X=(900, 2048), y=(900,)
Trial 1114: 5-fold CV loss = 0.5250
[I 2025-08-07 22:16:01,458] Trial 1114 finished with value: 0.5250203132629394 and parameters: {'fp_type': 'morgan', 'morgan_only_radius': 2, 'morgan_only_nBits': 2048, 'num_hidden_layers': 3, 'hidden_dim_0': 512, 'hidden_dim_1': 128, 'hidden_dim_2': 512, 'kl_weight': 0.0002858000501814103, 'lr': 0.0025378312707843623, 'batch_size': 32, 'dropout_rate': 0.4427999574351168, 'prior_mu': 0.05244267952309173, 'prior_sigma': 0.06731999765527454, 'normalization': 'none'}. Best is trial 272 with value: 0.5198344707489013.
Generating morgan fingerprints...
Generated fingerprints with 1024 features for 900 molecules
Data shape: X=(900, 1024), y=(900,)
Trial 1111: 5-fold CV loss = 0.5268
[I 2025-08-07 22:16:09,930] Trial 1111 finished with value: 0.5268053114414215 and parameters: {'fp_type': 'morgan', 'morgan_only_radius': 2, 'morgan_only_nBits': 1024, 'num_hidden_layers': 3, 'hidden_dim_0': 512, 'hidden_dim_1': 64, 'hidden_dim_2': 512, 'kl_weight': 0.00021286731416362688, 'lr': 0.002267510778101521, 'batch_size': 32, 'dropout_rate': 0.48381786380258646, 'prior_mu': -0.024653800408420107, 'prior_sigma': 0.06211261530510572, 'normalization': 'none'}. Best is trial 272 with value: 0.5198344707489013.
Generating morgan fingerprints...
Generated fingerprints with 2048 features for 900 molecules
Data shape: X=(900, 2048), y=(900,)
Trial 1117: 5-fold CV loss = 0.6027
[I 2025-08-07 22:16:52,337] Trial 1117 finished with value: 0.6026726126670837 and parameters: {'fp_type': 'morgan', 'morgan_only_radius': 2, 'morgan_only_nBits': 2048, 'num_hidden_layers': 3, 'hidden_dim_0': 64, 'hidden_dim_1': 256, 'hidden_dim_2': 512, 'kl_weight': 0.0028125027118162194, 'lr': 0.0015435394714766887, 'batch_size': 32, 'dropout_rate': 0.47115715856723983, 'prior_mu': -0.04537486723763992, 'prior_sigma': 0.07692405024905585, 'normalization': 'none'}. Best is trial 272 with value: 0.5198344707489013.
Generating morgan fingerprints...
Generated fingerprints with 1024 features for 900 molecules
Data shape: X=(900, 1024), y=(900,)
Trial 1118: 5-fold CV loss = 0.5772
[I 2025-08-07 22:17:33,179] Trial 1118 finished with value: 0.5772469878196717 and parameters: {'fp_type': 'morgan', 'morgan_only_radius': 2, 'morgan_only_nBits': 1024, 'num_hidden_layers': 3, 'hidden_dim_0': 64, 'hidden_dim_1': 256, 'hidden_dim_2': 512, 'kl_weight': 0.003142901094817081, 'lr': 0.001595094195590284, 'batch_size': 32, 'dropout_rate': 0.47078812947587045, 'prior_mu': -0.04052796810678709, 'prior_sigma': 0.07396840158744922, 'normalization': 'none'}. Best is trial 272 with value: 0.5198344707489013.
Generating rdkit fingerprints...
Generated fingerprints with 512 features for 900 molecules
Data shape: X=(900, 512), y=(900,)
Trial 1120: 5-fold CV loss = 0.5749
[I 2025-08-07 22:17:51,789] Trial 1120 finished with value: 0.5749193668365479 and parameters: {'fp_type': 'morgan', 'morgan_only_radius': 2, 'morgan_only_nBits': 1024, 'num_hidden_layers': 3, 'hidden_dim_0': 512, 'hidden_dim_1': 128, 'hidden_dim_2': 512, 'kl_weight': 0.0005701759460845447, 'lr': 0.0020086405355089062, 'batch_size': 32, 'dropout_rate': 0.12239154299807897, 'prior_mu': -0.06220219183561603, 'prior_sigma': 0.07310365303726, 'normalization': 'none'}. Best is trial 272 with value: 0.5198344707489013.
Generating rdkit fingerprints...
Generated fingerprints with 512 features for 900 molecules
Data shape: X=(900, 512), y=(900,)
Trial 1121: 5-fold CV loss = 0.5737
[I 2025-08-07 22:18:26,343] Trial 1121 finished with value: 0.5737369179725647 and parameters: {'fp_type': 'rdkit', 'rdkit_only_maxPath': 5, 'rdkit_only_nBits': 512, 'num_hidden_layers': 1, 'hidden_dim_0': 512, 'kl_weight': 0.0025346764835589178, 'lr': 0.0019842236866029427, 'batch_size': 32, 'dropout_rate': 0.49020405291253977, 'prior_mu': -0.06123195167512616, 'prior_sigma': 0.056201748071980535, 'normalization': 'none'}. Best is trial 272 with value: 0.5198344707489013.
Generating morgan fingerprints...
Generated fingerprints with 2048 features for 900 molecules
Data shape: X=(900, 2048), y=(900,)
Trial 1122: 5-fold CV loss = 0.5792
[I 2025-08-07 22:18:32,663] Trial 1122 finished with value: 0.5791960418224334 and parameters: {'fp_type': 'rdkit', 'rdkit_only_maxPath': 5, 'rdkit_only_nBits': 512, 'num_hidden_layers': 1, 'hidden_dim_0': 512, 'kl_weight': 0.0013763358628132284, 'lr': 0.0024478477471447735, 'batch_size': 32, 'dropout_rate': 0.4911451826002184, 'prior_mu': 0.04042742327002803, 'prior_sigma': 0.056174046299834066, 'normalization': 'none'}. Best is trial 272 with value: 0.5198344707489013.
Generating morgan fingerprints...
Generated fingerprints with 2048 features for 900 molecules
Data shape: X=(900, 2048), y=(900,)
Trial 1119: 5-fold CV loss = 0.5340
[I 2025-08-07 22:18:50,841] Trial 1119 finished with value: 0.5339694261550904 and parameters: {'fp_type': 'morgan', 'morgan_only_radius': 2, 'morgan_only_nBits': 2048, 'num_hidden_layers': 3, 'hidden_dim_0': 512, 'hidden_dim_1': 128, 'hidden_dim_2': 512, 'kl_weight': 0.002610179279698618, 'lr': 0.0019312205225064493, 'batch_size': 32, 'dropout_rate': 0.47043514800927777, 'prior_mu': -0.03955708362103905, 'prior_sigma': 0.07576309533157183, 'normalization': 'none'}. Best is trial 272 with value: 0.5198344707489013.
Generating morgan fingerprints...
Generated fingerprints with 1024 features for 900 molecules
Data shape: X=(900, 1024), y=(900,)
Trial 1116: 5-fold CV loss = 0.5249
[I 2025-08-07 22:19:20,799] Trial 1116 finished with value: 0.5249405801296234 and parameters: {'fp_type': 'morgan', 'morgan_only_radius': 2, 'morgan_only_nBits': 2048, 'num_hidden_layers': 3, 'hidden_dim_0': 512, 'hidden_dim_1': 256, 'hidden_dim_2': 512, 'kl_weight': 0.0006202898520257283, 'lr': 0.002552555972487881, 'batch_size': 32, 'dropout_rate': 0.48233876495286077, 'prior_mu': 0.05271155252047725, 'prior_sigma': 0.06605986643794791, 'normalization': 'none'}. Best is trial 272 with value: 0.5198344707489013.
Generating morgan fingerprints...
Generated fingerprints with 1024 features for 900 molecules
Data shape: X=(900, 1024), y=(900,)
Trial 1123: 5-fold CV loss = 0.5320
[I 2025-08-07 22:19:32,301] Trial 1123 finished with value: 0.5319887876510621 and parameters: {'fp_type': 'morgan', 'morgan_only_radius': 2, 'morgan_only_nBits': 2048, 'num_hidden_layers': 3, 'hidden_dim_0': 512, 'hidden_dim_1': 128, 'hidden_dim_2': 512, 'kl_weight': 0.0014003536792940995, 'lr': 0.002903707420311665, 'batch_size': 32, 'dropout_rate': 0.47970007643795504, 'prior_mu': -0.011412249728394325, 'prior_sigma': 0.06567276318565378, 'normalization': 'none'}. Best is trial 272 with value: 0.5198344707489013.
Generating morgan fingerprints...
Generated fingerprints with 1024 features for 900 molecules
Data shape: X=(900, 1024), y=(900,)
Trial 1124: 5-fold CV loss = 0.5212
[I 2025-08-07 22:19:54,777] Trial 1124 finished with value: 0.5211815059185028 and parameters: {'fp_type': 'morgan', 'morgan_only_radius': 2, 'morgan_only_nBits': 2048, 'num_hidden_layers': 3, 'hidden_dim_0': 512, 'hidden_dim_1': 128, 'hidden_dim_2': 512, 'kl_weight': 0.001080340020401931, 'lr': 0.002237707951262466, 'batch_size': 32, 'dropout_rate': 0.48108593629406227, 'prior_mu': -0.012715429334605344, 'prior_sigma': 0.06504678295329785, 'normalization': 'none'}. Best is trial 272 with value: 0.5198344707489013.
Generating morgan fingerprints...
Generated fingerprints with 2048 features for 900 molecules
Data shape: X=(900, 2048), y=(900,)
Trial 1128: 5-fold CV loss = 0.5268
[I 2025-08-07 22:20:57,193] Trial 1128 finished with value: 0.5268265187740326 and parameters: {'fp_type': 'morgan', 'morgan_only_radius': 2, 'morgan_only_nBits': 2048, 'num_hidden_layers': 3, 'hidden_dim_0': 512, 'hidden_dim_1': 128, 'hidden_dim_2': 512, 'kl_weight': 0.0011486953703085622, 'lr': 0.0028361733208887153, 'batch_size': 32, 'dropout_rate': 0.4894967078295304, 'prior_mu': 0.08763862004785586, 'prior_sigma': 0.06267859050865515, 'normalization': 'none'}. Best is trial 272 with value: 0.5198344707489013.
Generating morgan fingerprints...
Generated fingerprints with 2048 features for 900 molecules
Data shape: X=(900, 2048), y=(900,)
Trial 1125: 5-fold CV loss = 0.5230
[I 2025-08-07 22:20:58,210] Trial 1125 finished with value: 0.5229907155036926 and parameters: {'fp_type': 'morgan', 'morgan_only_radius': 2, 'morgan_only_nBits': 1024, 'num_hidden_layers': 3, 'hidden_dim_0': 512, 'hidden_dim_1': 128, 'hidden_dim_2': 512, 'kl_weight': 0.001407481263887197, 'lr': 0.0022345494762279054, 'batch_size': 32, 'dropout_rate': 0.48083674516667463, 'prior_mu': -0.010689220035663973, 'prior_sigma': 0.06441491500809647, 'normalization': 'none'}. Best is trial 272 with value: 0.5198344707489013.
Generating morgan fingerprints...
Generated fingerprints with 2048 features for 900 molecules
Data shape: X=(900, 2048), y=(900,)
Trial 1127: 5-fold CV loss = 0.5296
[I 2025-08-07 22:21:03,249] Trial 1127 finished with value: 0.5295509159564972 and parameters: {'fp_type': 'morgan', 'morgan_only_radius': 2, 'morgan_only_nBits': 1024, 'num_hidden_layers': 3, 'hidden_dim_0': 512, 'hidden_dim_1': 128, 'hidden_dim_2': 512, 'kl_weight': 0.0010533669204118355, 'lr': 0.0022208377900160173, 'batch_size': 32, 'dropout_rate': 0.4608162642415428, 'prior_mu': 0.021665548910765043, 'prior_sigma': 0.07070581217489343, 'normalization': 'none'}. Best is trial 272 with value: 0.5198344707489013.
Generating morgan fingerprints...
Generated fingerprints with 2048 features for 900 molecules
Data shape: X=(900, 2048), y=(900,)
Trial 1129: 5-fold CV loss = 0.5305
[I 2025-08-07 22:22:09,521] Trial 1129 finished with value: 0.5305410325527191 and parameters: {'fp_type': 'morgan', 'morgan_only_radius': 2, 'morgan_only_nBits': 2048, 'num_hidden_layers': 3, 'hidden_dim_0': 512, 'hidden_dim_1': 128, 'hidden_dim_2': 512, 'kl_weight': 0.0008933423840977331, 'lr': 0.0023328896852164134, 'batch_size': 32, 'dropout_rate': 0.4918598011929513, 'prior_mu': -0.009753573070312537, 'prior_sigma': 0.05849712339918814, 'normalization': 'none'}. Best is trial 272 with value: 0.5198344707489013.
Generating morgan fingerprints...
Generated fingerprints with 2048 features for 900 molecules
Data shape: X=(900, 2048), y=(900,)
Trial 1131: 5-fold CV loss = 0.5303
[I 2025-08-07 22:22:16,889] Trial 1131 finished with value: 0.5303315818309784 and parameters: {'fp_type': 'morgan', 'morgan_only_radius': 2, 'morgan_only_nBits': 2048, 'num_hidden_layers': 3, 'hidden_dim_0': 512, 'hidden_dim_1': 128, 'hidden_dim_2': 512, 'kl_weight': 0.0010574883587177015, 'lr': 0.0026520735291784238, 'batch_size': 32, 'dropout_rate': 0.49103854337654185, 'prior_mu': -0.003488318180856164, 'prior_sigma': 0.058442332432837314, 'normalization': 'none'}. Best is trial 272 with value: 0.5198344707489013.
Generating morgan fingerprints...
Generated fingerprints with 2048 features for 900 molecules
Data shape: X=(900, 2048), y=(900,)
Trial 1126: 5-fold CV loss = 0.5311
[I 2025-08-07 22:22:58,147] Trial 1126 finished with value: 0.5310948193073273 and parameters: {'fp_type': 'morgan', 'morgan_only_radius': 2, 'morgan_only_nBits': 1024, 'num_hidden_layers': 3, 'hidden_dim_0': 512, 'hidden_dim_1': 128, 'hidden_dim_2': 512, 'kl_weight': 0.0011619680701491159, 'lr': 0.0029531436556553044, 'batch_size': 32, 'dropout_rate': 0.45820959735897265, 'prior_mu': -0.01113562401792696, 'prior_sigma': 0.06357948117619722, 'normalization': 'none'}. Best is trial 272 with value: 0.5198344707489013.
Generating morgan fingerprints...
Generated fingerprints with 2048 features for 900 molecules
Data shape: X=(900, 2048), y=(900,)
Trial 1132: 5-fold CV loss = 0.6145
