[I 2025-08-07 20:48:58,856] Trial 880 finished with value: 0.5274564802646637 and parameters: {'fp_type': 'morgan', 'morgan_only_radius': 2, 'morgan_only_nBits': 2048, 'num_hidden_layers': 3, 'hidden_dim_0': 512, 'hidden_dim_1': 128, 'hidden_dim_2': 512, 'kl_weight': 0.008570850944329859, 'lr': 0.0027092240012696277, 'batch_size': 32, 'dropout_rate': 0.48245390528220417, 'prior_mu': 0.021552435674387676, 'prior_sigma': 0.05891767784100693, 'normalization': 'none'}. Best is trial 272 with value: 0.5198344707489013.
Generating morgan fingerprints...
Generated fingerprints with 1024 features for 900 molecules
Data shape: X=(900, 1024), y=(900,)
Trial 877: 5-fold CV loss = 0.5375
[I 2025-08-07 20:49:02,839] Trial 877 finished with value: 0.5375431120395661 and parameters: {'fp_type': 'morgan', 'morgan_only_radius': 2, 'morgan_only_nBits': 2048, 'num_hidden_layers': 3, 'hidden_dim_0': 128, 'hidden_dim_1': 128, 'hidden_dim_2': 512, 'kl_weight': 0.005397567607792656, 'lr': 0.0027485709163353775, 'batch_size': 32, 'dropout_rate': 0.4910287392972081, 'prior_mu': 0.011301375674904884, 'prior_sigma': 0.06274697281305769, 'normalization': 'none'}. Best is trial 272 with value: 0.5198344707489013.
Generating morgan fingerprints...
Generated fingerprints with 1024 features for 900 molecules
Data shape: X=(900, 1024), y=(900,)
Trial 875: 5-fold CV loss = 0.5370
[I 2025-08-07 20:49:30,270] Trial 875 finished with value: 0.5370148241519928 and parameters: {'fp_type': 'morgan', 'morgan_only_radius': 2, 'morgan_only_nBits': 1024, 'num_hidden_layers': 3, 'hidden_dim_0': 512, 'hidden_dim_1': 128, 'hidden_dim_2': 512, 'kl_weight': 0.005853986124294826, 'lr': 0.0034285806280948015, 'batch_size': 32, 'dropout_rate': 0.4901103736723144, 'prior_mu': 0.010174623809573593, 'prior_sigma': 0.053510828479874505, 'normalization': 'none'}. Best is trial 272 with value: 0.5198344707489013.
Generating morgan fingerprints...
Generated fingerprints with 1024 features for 900 molecules
Data shape: X=(900, 1024), y=(900,)
Trial 881: 5-fold CV loss = 0.5299
[I 2025-08-07 20:49:43,231] Trial 881 finished with value: 0.5298707664012909 and parameters: {'fp_type': 'morgan', 'morgan_only_radius': 2, 'morgan_only_nBits': 2048, 'num_hidden_layers': 3, 'hidden_dim_0': 512, 'hidden_dim_1': 128, 'hidden_dim_2': 512, 'kl_weight': 0.008204549368081522, 'lr': 0.0026345402930610814, 'batch_size': 32, 'dropout_rate': 0.49966264349280864, 'prior_mu': -0.03931469667477, 'prior_sigma': 0.05982994930384755, 'normalization': 'none'}. Best is trial 272 with value: 0.5198344707489013.
Generating morgan fingerprints...
Generated fingerprints with 1024 features for 900 molecules
Data shape: X=(900, 1024), y=(900,)
Trial 882: 5-fold CV loss = 0.5282
[I 2025-08-07 20:50:08,035] Trial 882 finished with value: 0.5281757414340973 and parameters: {'fp_type': 'morgan', 'morgan_only_radius': 2, 'morgan_only_nBits': 1024, 'num_hidden_layers': 3, 'hidden_dim_0': 512, 'hidden_dim_1': 128, 'hidden_dim_2': 512, 'kl_weight': 0.004468897968304432, 'lr': 0.0030629463470999104, 'batch_size': 32, 'dropout_rate': 0.4919754062307316, 'prior_mu': -0.03567619094764857, 'prior_sigma': 0.06581571803200084, 'normalization': 'none'}. Best is trial 272 with value: 0.5198344707489013.
Generating morgan_rdkit fingerprints...
Generated fingerprints with 768 features for 900 molecules
Data shape: X=(900, 768), y=(900,)
Trial 886: 5-fold CV loss = 1.3942
[I 2025-08-07 20:50:38,709] Trial 886 finished with value: 1.3942392110824584 and parameters: {'fp_type': 'morgan_rdkit', 'combined_morgan_radius': 3, 'combined_morgan_nBits': 512, 'combined_rdkit_maxPath': 8, 'combined_rdkit_nBits': 256, 'num_hidden_layers': 3, 'hidden_dim_0': 512, 'hidden_dim_1': 128, 'hidden_dim_2': 512, 'kl_weight': 0.0017529210672235678, 'lr': 0.0007310010944075937, 'batch_size': 32, 'dropout_rate': 0.47071042836698385, 'prior_mu': 0.02505800332915031, 'prior_sigma': 0.06755913520178035, 'normalization': 'none'}. Best is trial 272 with value: 0.5198344707489013.
Generating morgan fingerprints...
Generated fingerprints with 1024 features for 900 molecules
Data shape: X=(900, 1024), y=(900,)
Trial 885: 5-fold CV loss = 0.5406
[I 2025-08-07 20:50:42,694] Trial 885 finished with value: 0.5405990958213807 and parameters: {'fp_type': 'morgan', 'morgan_only_radius': 2, 'morgan_only_nBits': 1024, 'num_hidden_layers': 3, 'hidden_dim_0': 512, 'hidden_dim_1': 128, 'hidden_dim_2': 512, 'kl_weight': 0.006966612436765065, 'lr': 0.0030664712770308326, 'batch_size': 32, 'dropout_rate': 0.4729061823460403, 'prior_mu': -0.026344951104151724, 'prior_sigma': 0.06824143455474418, 'normalization': 'none'}. Best is trial 272 with value: 0.5198344707489013.
Generating morgan fingerprints...
Generated fingerprints with 1024 features for 900 molecules
Data shape: X=(900, 1024), y=(900,)
Trial 883: 5-fold CV loss = 0.5279
[I 2025-08-07 20:51:04,675] Trial 883 finished with value: 0.5278746962547303 and parameters: {'fp_type': 'morgan', 'morgan_only_radius': 2, 'morgan_only_nBits': 1024, 'num_hidden_layers': 3, 'hidden_dim_0': 512, 'hidden_dim_1': 128, 'hidden_dim_2': 512, 'kl_weight': 0.004289614903225496, 'lr': 0.0025184523064936924, 'batch_size': 32, 'dropout_rate': 0.4731157586364825, 'prior_mu': -0.037751375435101805, 'prior_sigma': 0.06648236820786275, 'normalization': 'none'}. Best is trial 272 with value: 0.5198344707489013.
Generating morgan fingerprints...
Generated fingerprints with 1024 features for 900 molecules
Data shape: X=(900, 1024), y=(900,)
Trial 888: 5-fold CV loss = 0.5434
[I 2025-08-07 20:51:35,858] Trial 888 finished with value: 0.5433612585067749 and parameters: {'fp_type': 'morgan', 'morgan_only_radius': 2, 'morgan_only_nBits': 1024, 'num_hidden_layers': 3, 'hidden_dim_0': 512, 'hidden_dim_1': 128, 'hidden_dim_2': 512, 'kl_weight': 0.0016455569125888986, 'lr': 0.002463920749266291, 'batch_size': 32, 'dropout_rate': 0.4997762174480042, 'prior_mu': -0.000911921058342105, 'prior_sigma': 0.06358670159191297, 'normalization': 'layer'}. Best is trial 272 with value: 0.5198344707489013.
Generating morgan fingerprints...
Generated fingerprints with 2048 features for 900 molecules
Data shape: X=(900, 2048), y=(900,)
Trial 887: 5-fold CV loss = 0.5421
[I 2025-08-07 20:51:41,865] Trial 887 finished with value: 0.5420518636703491 and parameters: {'fp_type': 'morgan', 'morgan_only_radius': 2, 'morgan_only_nBits': 1024, 'num_hidden_layers': 3, 'hidden_dim_0': 512, 'hidden_dim_1': 128, 'hidden_dim_2': 512, 'kl_weight': 0.004556295004666971, 'lr': 0.002497793325768992, 'batch_size': 32, 'dropout_rate': 0.4751395649561858, 'prior_mu': -0.024812292967797, 'prior_sigma': 0.06431428532982802, 'normalization': 'layer'}. Best is trial 272 with value: 0.5198344707489013.
Generating morgan fingerprints...
Generated fingerprints with 2048 features for 900 molecules
Data shape: X=(900, 2048), y=(900,)
Trial 889: 5-fold CV loss = 0.5450
[I 2025-08-07 20:52:25,397] Trial 889 finished with value: 0.5449828863143921 and parameters: {'fp_type': 'morgan', 'morgan_only_radius': 2, 'morgan_only_nBits': 1024, 'num_hidden_layers': 3, 'hidden_dim_0': 512, 'hidden_dim_1': 128, 'hidden_dim_2': 512, 'kl_weight': 0.0001430286009765471, 'lr': 0.0023187795210471937, 'batch_size': 32, 'dropout_rate': 0.10424055134741039, 'prior_mu': -0.00014197207819504568, 'prior_sigma': 0.06268932767889855, 'normalization': 'layer'}. Best is trial 272 with value: 0.5198344707489013.
Generating morgan fingerprints...
Generated fingerprints with 2048 features for 900 molecules
Data shape: X=(900, 2048), y=(900,)
Trial 890: 5-fold CV loss = 0.5281
[I 2025-08-07 20:52:48,122] Trial 890 finished with value: 0.5280663907527924 and parameters: {'fp_type': 'morgan', 'morgan_only_radius': 2, 'morgan_only_nBits': 2048, 'num_hidden_layers': 3, 'hidden_dim_0': 512, 'hidden_dim_1': 128, 'hidden_dim_2': 512, 'kl_weight': 0.001385027838969904, 'lr': 0.002264114993832932, 'batch_size': 32, 'dropout_rate': 0.4835512922458001, 'prior_mu': -0.020570853394293168, 'prior_sigma': 0.06108041742946127, 'normalization': 'none'}. Best is trial 272 with value: 0.5198344707489013.
Generating morgan fingerprints...
Generated fingerprints with 2048 features for 900 molecules
Data shape: X=(900, 2048), y=(900,)
Trial 893: 5-fold CV loss = 0.9521
[I 2025-08-07 20:52:56,284] Trial 893 finished with value: 0.9520971775054932 and parameters: {'fp_type': 'morgan', 'morgan_only_radius': 2, 'morgan_only_nBits': 2048, 'num_hidden_layers': 3, 'hidden_dim_0': 512, 'hidden_dim_1': 128, 'hidden_dim_2': 512, 'kl_weight': 0.0010858241439323931, 'lr': 0.0013611791472969968, 'batch_size': 128, 'dropout_rate': 0.48244121201001344, 'prior_mu': 0.022925185869885928, 'prior_sigma': 0.07137170569737795, 'normalization': 'none'}. Best is trial 272 with value: 0.5198344707489013.
Generating morgan fingerprints...
Generated fingerprints with 1024 features for 900 molecules
Data shape: X=(900, 1024), y=(900,)
Trial 891: 5-fold CV loss = 0.5280
[I 2025-08-07 20:53:14,111] Trial 891 finished with value: 0.5280064702033996 and parameters: {'fp_type': 'morgan', 'morgan_only_radius': 2, 'morgan_only_nBits': 2048, 'num_hidden_layers': 3, 'hidden_dim_0': 512, 'hidden_dim_1': 128, 'hidden_dim_2': 512, 'kl_weight': 0.0013832736030734128, 'lr': 0.002279416314853545, 'batch_size': 32, 'dropout_rate': 0.4832992558178707, 'prior_mu': -0.021929939906964933, 'prior_sigma': 0.060121601499971616, 'normalization': 'none'}. Best is trial 272 with value: 0.5198344707489013.
Generating morgan fingerprints...
Generated fingerprints with 1024 features for 900 molecules
Data shape: X=(900, 1024), y=(900,)
Trial 884: 5-fold CV loss = 0.5316
[I 2025-08-07 20:53:23,596] Trial 884 finished with value: 0.5316431641578674 and parameters: {'fp_type': 'morgan', 'morgan_only_radius': 2, 'morgan_only_nBits': 1024, 'num_hidden_layers': 3, 'hidden_dim_0': 512, 'hidden_dim_1': 128, 'hidden_dim_2': 512, 'kl_weight': 0.0045674530288937, 'lr': 0.003067068534135901, 'batch_size': 32, 'dropout_rate': 0.49980428295305185, 'prior_mu': -0.038924753073348445, 'prior_sigma': 0.06691276592941514, 'normalization': 'none'}. Best is trial 272 with value: 0.5198344707489013.
Generating morgan fingerprints...
Generated fingerprints with 1024 features for 900 molecules
Data shape: X=(900, 1024), y=(900,)
Trial 895: 5-fold CV loss = 0.5481
[I 2025-08-07 20:54:10,749] Trial 895 finished with value: 0.5480816602706909 and parameters: {'fp_type': 'morgan', 'morgan_only_radius': 2, 'morgan_only_nBits': 1024, 'num_hidden_layers': 3, 'hidden_dim_0': 1024, 'hidden_dim_1': 128, 'hidden_dim_2': 256, 'kl_weight': 0.0037807941893450124, 'lr': 0.0028361283106469928, 'batch_size': 32, 'dropout_rate': 0.4669888214631851, 'prior_mu': 0.07007163202886078, 'prior_sigma': 0.08068860581340588, 'normalization': 'none'}. Best is trial 272 with value: 0.5198344707489013.
Generating morgan fingerprints...
Generated fingerprints with 1024 features for 900 molecules
Data shape: X=(900, 1024), y=(900,)
Trial 894: 5-fold CV loss = 0.5273
[I 2025-08-07 20:54:17,249] Trial 894 finished with value: 0.5273280084133148 and parameters: {'fp_type': 'morgan', 'morgan_only_radius': 2, 'morgan_only_nBits': 1024, 'num_hidden_layers': 3, 'hidden_dim_0': 512, 'hidden_dim_1': 128, 'hidden_dim_2': 256, 'kl_weight': 0.0038590555420669735, 'lr': 0.0022840214942307945, 'batch_size': 32, 'dropout_rate': 0.49971290757946074, 'prior_mu': -0.02869143050632391, 'prior_sigma': 0.0801821884288097, 'normalization': 'none'}. Best is trial 272 with value: 0.5198344707489013.
Generating morgan fingerprints...
Generated fingerprints with 1024 features for 900 molecules
Data shape: X=(900, 1024), y=(900,)
Trial 892: 5-fold CV loss = 0.5260
[I 2025-08-07 20:54:45,251] Trial 892 finished with value: 0.5259677052497864 and parameters: {'fp_type': 'morgan', 'morgan_only_radius': 2, 'morgan_only_nBits': 2048, 'num_hidden_layers': 3, 'hidden_dim_0': 512, 'hidden_dim_1': 128, 'hidden_dim_2': 512, 'kl_weight': 0.0014080958770612466, 'lr': 0.002281609567000058, 'batch_size': 32, 'dropout_rate': 0.48236403398967537, 'prior_mu': -0.020252007016568617, 'prior_sigma': 0.05751228614183698, 'normalization': 'none'}. Best is trial 272 with value: 0.5198344707489013.
Generating morgan fingerprints...
Generated fingerprints with 1024 features for 900 molecules
Data shape: X=(900, 1024), y=(900,)
Trial 898: 5-fold CV loss = 0.5345
[I 2025-08-07 20:55:20,918] Trial 898 finished with value: 0.5344735205173492 and parameters: {'fp_type': 'morgan', 'morgan_only_radius': 2, 'morgan_only_nBits': 1024, 'num_hidden_layers': 3, 'hidden_dim_0': 512, 'hidden_dim_1': 128, 'hidden_dim_2': 512, 'kl_weight': 0.001807400262531743, 'lr': 0.0025845373245797247, 'batch_size': 32, 'dropout_rate': 0.29435028593710866, 'prior_mu': -0.01547155492371441, 'prior_sigma': 0.07533970924051268, 'normalization': 'none'}. Best is trial 272 with value: 0.5198344707489013.
Generating rdkit fingerprints...
Generated fingerprints with 1024 features for 900 molecules
Data shape: X=(900, 1024), y=(900,)
Trial 897: 5-fold CV loss = 0.5715
[I 2025-08-07 20:55:26,962] Trial 897 finished with value: 0.5714612185955048 and parameters: {'fp_type': 'morgan', 'morgan_only_radius': 2, 'morgan_only_nBits': 1024, 'num_hidden_layers': 3, 'hidden_dim_0': 512, 'hidden_dim_1': 128, 'hidden_dim_2': 128, 'kl_weight': 0.001604127824904605, 'lr': 0.0022672052840771724, 'batch_size': 32, 'dropout_rate': 0.4997446062918563, 'prior_mu': -0.016904176191569205, 'prior_sigma': 0.057399686454052676, 'normalization': 'none'}. Best is trial 272 with value: 0.5198344707489013.
Generating rdkit fingerprints...
Generated fingerprints with 1024 features for 900 molecules
Data shape: X=(900, 1024), y=(900,)
Trial 900: 5-fold CV loss = 0.6157
[I 2025-08-07 20:56:02,705] Trial 900 finished with value: 0.6156588196754456 and parameters: {'fp_type': 'rdkit', 'rdkit_only_maxPath': 6, 'rdkit_only_nBits': 1024, 'num_hidden_layers': 3, 'hidden_dim_0': 512, 'hidden_dim_1': 128, 'hidden_dim_2': 128, 'kl_weight': 0.001569096895702119, 'lr': 0.002061250553623886, 'batch_size': 32, 'dropout_rate': 0.4911517654695505, 'prior_mu': -0.007371630786899952, 'prior_sigma': 0.0695123067408027, 'normalization': 'none'}. Best is trial 272 with value: 0.5198344707489013.
Generating morgan fingerprints...
Generated fingerprints with 1024 features for 900 molecules
Data shape: X=(900, 1024), y=(900,)
Trial 902: 5-fold CV loss = 1.1860
[I 2025-08-07 20:56:28,389] Trial 902 finished with value: 1.1859662294387818 and parameters: {'fp_type': 'morgan', 'morgan_only_radius': 2, 'morgan_only_nBits': 1024, 'num_hidden_layers': 3, 'hidden_dim_0': 512, 'hidden_dim_1': 64, 'hidden_dim_2': 512, 'kl_weight': 0.031034920771997227, 'lr': 0.000415383240195736, 'batch_size': 32, 'dropout_rate': 0.4665431803958511, 'prior_mu': 0.002713748536897001, 'prior_sigma': 0.0730989065218383, 'normalization': 'none'}. Best is trial 272 with value: 0.5198344707489013.
Generating morgan fingerprints...
Generated fingerprints with 2048 features for 900 molecules
Data shape: X=(900, 2048), y=(900,)
Trial 899: 5-fold CV loss = 0.5332
[I 2025-08-07 20:56:38,366] Trial 899 finished with value: 0.5331881880760193 and parameters: {'fp_type': 'morgan', 'morgan_only_radius': 2, 'morgan_only_nBits': 1024, 'num_hidden_layers': 3, 'hidden_dim_0': 512, 'hidden_dim_1': 128, 'hidden_dim_2': 512, 'kl_weight': 0.001665397393189181, 'lr': 0.00260419435463632, 'batch_size': 32, 'dropout_rate': 0.46920460068264525, 'prior_mu': -6.299670282651536e-05, 'prior_sigma': 0.07442012187711669, 'normalization': 'none'}. Best is trial 272 with value: 0.5198344707489013.
Generating morgan fingerprints...
Generated fingerprints with 2048 features for 900 molecules
Data shape: X=(900, 2048), y=(900,)
Trial 896: 5-fold CV loss = 0.5907
[I 2025-08-07 20:56:53,490] Trial 896 finished with value: 0.5907242298126221 and parameters: {'fp_type': 'morgan', 'morgan_only_radius': 2, 'morgan_only_nBits': 1024, 'num_hidden_layers': 3, 'hidden_dim_0': 1024, 'hidden_dim_1': 64, 'hidden_dim_2': 512, 'kl_weight': 0.0016319226701054501, 'lr': 0.0026990185387495143, 'batch_size': 32, 'dropout_rate': 0.46825303498582316, 'prior_mu': -0.031218670600078553, 'prior_sigma': 0.16065203768174588, 'normalization': 'none'}. Best is trial 272 with value: 0.5198344707489013.
Generating morgan fingerprints...
Generated fingerprints with 2048 features for 900 molecules
Data shape: X=(900, 2048), y=(900,)
Trial 901: 5-fold CV loss = 0.6373
[I 2025-08-07 20:56:59,132] Trial 901 finished with value: 0.6372518420219422 and parameters: {'fp_type': 'rdkit', 'rdkit_only_maxPath': 8, 'rdkit_only_nBits': 1024, 'num_hidden_layers': 3, 'hidden_dim_0': 512, 'hidden_dim_1': 1024, 'hidden_dim_2': 512, 'kl_weight': 0.0011164203380178526, 'lr': 0.0020539663552334854, 'batch_size': 32, 'dropout_rate': 0.4698799736943118, 'prior_mu': -0.1976166488898987, 'prior_sigma': 0.06972187307799052, 'normalization': 'none'}. Best is trial 272 with value: 0.5198344707489013.
Generating morgan fingerprints...
Generated fingerprints with 2048 features for 900 molecules
Data shape: X=(900, 2048), y=(900,)
Trial 903: 5-fold CV loss = 0.5763
[I 2025-08-07 20:57:18,281] Trial 903 finished with value: 0.5763112902641296 and parameters: {'fp_type': 'morgan', 'morgan_only_radius': 2, 'morgan_only_nBits': 2048, 'num_hidden_layers': 3, 'hidden_dim_0': 64, 'hidden_dim_1': 1024, 'hidden_dim_2': 512, 'kl_weight': 0.001930572075041238, 'lr': 0.0025335191419783277, 'batch_size': 32, 'dropout_rate': 0.4761488948367129, 'prior_mu': -0.031006315523823554, 'prior_sigma': 0.06836836475697687, 'normalization': 'none'}. Best is trial 272 with value: 0.5198344707489013.
Generating morgan fingerprints...
Generated fingerprints with 2048 features for 900 molecules
Data shape: X=(900, 2048), y=(900,)
Trial 906: 5-fold CV loss = 0.5643
[I 2025-08-07 20:58:17,497] Trial 906 finished with value: 0.5642817497253418 and parameters: {'fp_type': 'morgan', 'morgan_only_radius': 2, 'morgan_only_nBits': 2048, 'num_hidden_layers': 3, 'hidden_dim_0': 64, 'hidden_dim_1': 512, 'hidden_dim_2': 512, 'kl_weight': 0.0019688588175205916, 'lr': 0.0015325068228363937, 'batch_size': 32, 'dropout_rate': 0.19935522538887418, 'prior_mu': -0.10123405486260131, 'prior_sigma': 0.06480134789937934, 'normalization': 'none'}. Best is trial 272 with value: 0.5198344707489013.
Generating morgan fingerprints...
Generated fingerprints with 1024 features for 900 molecules
Data shape: X=(900, 1024), y=(900,)
Trial 904: 5-fold CV loss = 0.5648
[I 2025-08-07 20:58:33,032] Trial 904 finished with value: 0.5648151218891144 and parameters: {'fp_type': 'morgan', 'morgan_only_radius': 2, 'morgan_only_nBits': 2048, 'num_hidden_layers': 3, 'hidden_dim_0': 64, 'hidden_dim_1': 1024, 'hidden_dim_2': 512, 'kl_weight': 0.0010989343171308396, 'lr': 0.002033016908245165, 'batch_size': 32, 'dropout_rate': 0.4778719191296357, 'prior_mu': -0.03417718847920084, 'prior_sigma': 0.06903738091615609, 'normalization': 'none'}. Best is trial 272 with value: 0.5198344707489013.
Generating morgan fingerprints...
Generated fingerprints with 1024 features for 900 molecules
Data shape: X=(900, 1024), y=(900,)
Trial 907: 5-fold CV loss = 0.5905
[I 2025-08-07 20:58:40,101] Trial 907 finished with value: 0.5905053615570068 and parameters: {'fp_type': 'morgan', 'morgan_only_radius': 2, 'morgan_only_nBits': 2048, 'num_hidden_layers': 3, 'hidden_dim_0': 512, 'hidden_dim_1': 512, 'hidden_dim_2': 512, 'kl_weight': 0.0012647335821343584, 'lr': 0.0017780266113938154, 'batch_size': 32, 'dropout_rate': 0.19496987692923273, 'prior_mu': -0.04081853634008664, 'prior_sigma': 0.06348395623909904, 'normalization': 'none'}. Best is trial 272 with value: 0.5198344707489013.
Generating morgan_rdkit fingerprints...
Generated fingerprints with 768 features for 900 molecules
Data shape: X=(900, 768), y=(900,)
Trial 910: 5-fold CV loss = 0.5903
[I 2025-08-07 20:59:30,764] Trial 910 finished with value: 0.5902828454971314 and parameters: {'fp_type': 'morgan_rdkit', 'combined_morgan_radius': 3, 'combined_morgan_nBits': 512, 'combined_rdkit_maxPath': 8, 'combined_rdkit_nBits': 256, 'num_hidden_layers': 3, 'hidden_dim_0': 256, 'hidden_dim_1': 128, 'hidden_dim_2': 512, 'kl_weight': 0.005393996840818941, 'lr': 0.002400459866416881, 'batch_size': 32, 'dropout_rate': 0.48829124165948135, 'prior_mu': -0.003846552057911944, 'prior_sigma': 0.06084419081664391, 'normalization': 'none'}. Best is trial 272 with value: 0.5198344707489013.
Generating morgan fingerprints...
Generated fingerprints with 1024 features for 900 molecules
Data shape: X=(900, 1024), y=(900,)
Trial 908: 5-fold CV loss = 0.5536
[I 2025-08-07 20:59:55,274] Trial 908 finished with value: 0.553567498922348 and parameters: {'fp_type': 'morgan', 'morgan_only_radius': 2, 'morgan_only_nBits': 1024, 'num_hidden_layers': 3, 'hidden_dim_0': 512, 'hidden_dim_1': 128, 'hidden_dim_2': 512, 'kl_weight': 0.001134222525382864, 'lr': 0.0017634904347525256, 'batch_size': 32, 'dropout_rate': 0.490968677585013, 'prior_mu': -0.00828017797184563, 'prior_sigma': 0.06146026550485859, 'normalization': 'none'}. Best is trial 272 with value: 0.5198344707489013.
Generating morgan fingerprints...
Generated fingerprints with 1024 features for 900 molecules
Data shape: X=(900, 1024), y=(900,)
Trial 911: 5-fold CV loss = 0.5261
