[I 2025-08-08 07:05:56,546] Trial 2642 finished with value: 0.5358332991600037 and parameters: {'fp_type': 'morgan', 'morgan_only_radius': 2, 'morgan_only_nBits': 2048, 'num_hidden_layers': 3, 'hidden_dim_0': 512, 'hidden_dim_1': 128, 'hidden_dim_2': 512, 'kl_weight': 0.001007662695081291, 'lr': 0.0023260879680983243, 'batch_size': 32, 'dropout_rate': 0.44577803611432265, 'prior_mu': -0.06968757272627679, 'prior_sigma': 0.07953478819854878, 'normalization': 'none'}. Best is trial 2426 with value: 0.515486741065979.
Generating morgan fingerprints...
Generated fingerprints with 2048 features for 900 molecules
Data shape: X=(900, 2048), y=(900,)
Trial 2646: 5-fold CV loss = 0.5440
[I 2025-08-08 07:06:06,584] Trial 2646 finished with value: 0.5439846694469452 and parameters: {'fp_type': 'morgan', 'morgan_only_radius': 3, 'morgan_only_nBits': 2048, 'num_hidden_layers': 3, 'hidden_dim_0': 512, 'hidden_dim_1': 128, 'hidden_dim_2': 128, 'kl_weight': 0.0007192331832874653, 'lr': 0.0025646359666358777, 'batch_size': 32, 'dropout_rate': 0.43398465979181955, 'prior_mu': 0.0691084254218332, 'prior_sigma': 0.055119062997715615, 'normalization': 'none'}. Best is trial 2426 with value: 0.515486741065979.
Generating morgan fingerprints...
Generated fingerprints with 2048 features for 900 molecules
Data shape: X=(900, 2048), y=(900,)
Trial 2647: 5-fold CV loss = 0.5439
[I 2025-08-08 07:06:24,823] Trial 2647 finished with value: 0.54388827085495 and parameters: {'fp_type': 'morgan', 'morgan_only_radius': 3, 'morgan_only_nBits': 2048, 'num_hidden_layers': 3, 'hidden_dim_0': 512, 'hidden_dim_1': 128, 'hidden_dim_2': 512, 'kl_weight': 0.00021358389914398658, 'lr': 0.002314603439490271, 'batch_size': 32, 'dropout_rate': 0.43642152369148673, 'prior_mu': 0.030546130418189557, 'prior_sigma': 0.09898074758542941, 'normalization': 'none'}. Best is trial 2426 with value: 0.515486741065979.
Generating morgan fingerprints...
Generated fingerprints with 2048 features for 900 molecules
Data shape: X=(900, 2048), y=(900,)
Trial 2650: 5-fold CV loss = 0.5506
[I 2025-08-08 07:07:24,262] Trial 2650 finished with value: 0.5505987882614136 and parameters: {'fp_type': 'morgan', 'morgan_only_radius': 2, 'morgan_only_nBits': 2048, 'num_hidden_layers': 3, 'hidden_dim_0': 512, 'hidden_dim_1': 64, 'hidden_dim_2': 512, 'kl_weight': 0.00017611573813838276, 'lr': 0.0020790415587100233, 'batch_size': 32, 'dropout_rate': 0.3825618510537212, 'prior_mu': 0.015600632448453892, 'prior_sigma': 0.06917591487799897, 'normalization': 'none'}. Best is trial 2426 with value: 0.515486741065979.
Generating morgan fingerprints...
Generated fingerprints with 2048 features for 900 molecules
Data shape: X=(900, 2048), y=(900,)
Trial 2648: 5-fold CV loss = 0.5866
[I 2025-08-08 07:07:39,604] Trial 2648 finished with value: 0.5865677714347839 and parameters: {'fp_type': 'morgan', 'morgan_only_radius': 2, 'morgan_only_nBits': 2048, 'num_hidden_layers': 3, 'hidden_dim_0': 512, 'hidden_dim_1': 128, 'hidden_dim_2': 128, 'kl_weight': 0.0007274401063320636, 'lr': 0.0020202323238967747, 'batch_size': 32, 'dropout_rate': 0.436384447405889, 'prior_mu': 0.021567778388304336, 'prior_sigma': 0.055786258511811807, 'normalization': 'none'}. Best is trial 2426 with value: 0.515486741065979.
Generating morgan fingerprints...
Generated fingerprints with 2048 features for 900 molecules
Data shape: X=(900, 2048), y=(900,)
Trial 2651: 5-fold CV loss = 0.6694
[I 2025-08-08 07:07:41,160] Trial 2651 finished with value: 0.6694199442863464 and parameters: {'fp_type': 'morgan', 'morgan_only_radius': 2, 'morgan_only_nBits': 2048, 'num_hidden_layers': 1, 'hidden_dim_0': 512, 'kl_weight': 0.0007140522252809646, 'lr': 0.0016229465266315388, 'batch_size': 32, 'dropout_rate': 0.4534123421015741, 'prior_mu': 0.023582848870702833, 'prior_sigma': 0.058700227629131595, 'normalization': 'none'}. Best is trial 2426 with value: 0.515486741065979.
Generating rdkit fingerprints...
Generated fingerprints with 512 features for 900 molecules
Data shape: X=(900, 512), y=(900,)
Trial 2649: 5-fold CV loss = 0.5251
[I 2025-08-08 07:07:44,057] Trial 2649 finished with value: 0.525088232755661 and parameters: {'fp_type': 'morgan', 'morgan_only_radius': 2, 'morgan_only_nBits': 2048, 'num_hidden_layers': 3, 'hidden_dim_0': 512, 'hidden_dim_1': 64, 'hidden_dim_2': 512, 'kl_weight': 0.00021479967122121858, 'lr': 0.0020038991871599867, 'batch_size': 32, 'dropout_rate': 0.4351442330121085, 'prior_mu': 0.0177272832716895, 'prior_sigma': 0.07040085453337652, 'normalization': 'none'}. Best is trial 2426 with value: 0.515486741065979.
Generating rdkit fingerprints...
Generated fingerprints with 512 features for 900 molecules
Data shape: X=(900, 512), y=(900,)
Trial 2654: 5-fold CV loss = 0.6443
[I 2025-08-08 07:08:14,498] Trial 2654 finished with value: 0.6442596554756165 and parameters: {'fp_type': 'rdkit', 'rdkit_only_maxPath': 7, 'rdkit_only_nBits': 512, 'num_hidden_layers': 3, 'hidden_dim_0': 512, 'hidden_dim_1': 128, 'hidden_dim_2': 512, 'kl_weight': 0.0002820090287230212, 'lr': 0.002282686456118621, 'batch_size': 64, 'dropout_rate': 0.41482864249620227, 'prior_mu': 0.03597227265024072, 'prior_sigma': 0.07936981131493583, 'normalization': 'none'}. Best is trial 2426 with value: 0.515486741065979.
Generating morgan_rdkit fingerprints...
Generated fingerprints with 2048 features for 900 molecules
Data shape: X=(900, 2048), y=(900,)
Trial 2653: 5-fold CV loss = 0.6504
[I 2025-08-08 07:08:21,904] Trial 2653 finished with value: 0.6503807544708252 and parameters: {'fp_type': 'rdkit', 'rdkit_only_maxPath': 7, 'rdkit_only_nBits': 512, 'num_hidden_layers': 3, 'hidden_dim_0': 512, 'hidden_dim_1': 128, 'hidden_dim_2': 512, 'kl_weight': 0.0003389619617901876, 'lr': 0.001965693439904877, 'batch_size': 32, 'dropout_rate': 0.41207759686391987, 'prior_mu': 0.03599769600139258, 'prior_sigma': 0.07868628292213047, 'normalization': 'none'}. Best is trial 2426 with value: 0.515486741065979.
Generating morgan fingerprints...
Generated fingerprints with 2048 features for 900 molecules
Data shape: X=(900, 2048), y=(900,)
Trial 2656: 5-fold CV loss = 0.6903
[I 2025-08-08 07:08:58,235] Trial 2656 finished with value: 0.6903338551521301 and parameters: {'fp_type': 'morgan', 'morgan_only_radius': 2, 'morgan_only_nBits': 2048, 'num_hidden_layers': 3, 'hidden_dim_0': 512, 'hidden_dim_1': 128, 'hidden_dim_2': 64, 'kl_weight': 0.0008778368879789784, 'lr': 0.001652115500958475, 'batch_size': 32, 'dropout_rate': 0.4528630131958613, 'prior_mu': 0.06206263618059929, 'prior_sigma': 0.07469945678451351, 'normalization': 'none'}. Best is trial 2426 with value: 0.515486741065979.
Generating morgan_rdkit fingerprints...
Generated fingerprints with 2048 features for 900 molecules
Data shape: X=(900, 2048), y=(900,)
Trial 2655: 5-fold CV loss = 0.6362
[I 2025-08-08 07:09:08,890] Trial 2655 finished with value: 0.6361863374710083 and parameters: {'fp_type': 'morgan_rdkit', 'combined_morgan_radius': 2, 'combined_morgan_nBits': 1024, 'combined_rdkit_maxPath': 8, 'combined_rdkit_nBits': 1024, 'num_hidden_layers': 3, 'hidden_dim_0': 512, 'hidden_dim_1': 128, 'hidden_dim_2': 512, 'kl_weight': 0.00035263438120352426, 'lr': 0.0016598214029387133, 'batch_size': 32, 'dropout_rate': 0.4269478412403784, 'prior_mu': 0.0588144191706939, 'prior_sigma': 0.07536089546094946, 'normalization': 'none'}. Best is trial 2426 with value: 0.515486741065979.
Generating morgan fingerprints...
Generated fingerprints with 2048 features for 900 molecules
Data shape: X=(900, 2048), y=(900,)
Trial 2643: 5-fold CV loss = 0.5276
[I 2025-08-08 07:09:15,080] Trial 2643 finished with value: 0.5275636315345764 and parameters: {'fp_type': 'morgan', 'morgan_only_radius': 2, 'morgan_only_nBits': 2048, 'num_hidden_layers': 3, 'hidden_dim_0': 64, 'hidden_dim_1': 128, 'hidden_dim_2': 512, 'kl_weight': 0.0009620687928508923, 'lr': 0.0026667651860711977, 'batch_size': 32, 'dropout_rate': 0.4455590463700394, 'prior_mu': 0.06957040926770967, 'prior_sigma': 0.07933866429613973, 'normalization': 'none'}. Best is trial 2426 with value: 0.515486741065979.
Generating morgan fingerprints...
Generated fingerprints with 2048 features for 900 molecules
Data shape: X=(900, 2048), y=(900,)
Trial 2657: 5-fold CV loss = 0.5891
[I 2025-08-08 07:09:56,974] Trial 2657 finished with value: 0.5891483724117279 and parameters: {'fp_type': 'morgan_rdkit', 'combined_morgan_radius': 2, 'combined_morgan_nBits': 1024, 'combined_rdkit_maxPath': 8, 'combined_rdkit_nBits': 1024, 'num_hidden_layers': 3, 'hidden_dim_0': 512, 'hidden_dim_1': 128, 'hidden_dim_2': 256, 'kl_weight': 0.0006422213105617738, 'lr': 0.0025192600343280436, 'batch_size': 32, 'dropout_rate': 0.4253649694577437, 'prior_mu': 0.04808918424536426, 'prior_sigma': 0.0642142625775236, 'normalization': 'none'}. Best is trial 2426 with value: 0.515486741065979.
Generating morgan fingerprints...
Generated fingerprints with 2048 features for 900 molecules
Data shape: X=(900, 2048), y=(900,)
Trial 2658: 5-fold CV loss = 0.5254
[I 2025-08-08 07:10:12,954] Trial 2658 finished with value: 0.5254258930683136 and parameters: {'fp_type': 'morgan', 'morgan_only_radius': 2, 'morgan_only_nBits': 2048, 'num_hidden_layers': 3, 'hidden_dim_0': 512, 'hidden_dim_1': 64, 'hidden_dim_2': 256, 'kl_weight': 0.0006403359850167452, 'lr': 0.0034626595995821833, 'batch_size': 32, 'dropout_rate': 0.4457265216382834, 'prior_mu': 0.04999728445838135, 'prior_sigma': 0.066535900065291, 'normalization': 'none'}. Best is trial 2426 with value: 0.515486741065979.
Generating morgan fingerprints...
Generated fingerprints with 2048 features for 900 molecules
Data shape: X=(900, 2048), y=(900,)
Trial 2652: 5-fold CV loss = 0.5689
[I 2025-08-08 07:10:29,103] Trial 2652 finished with value: 0.5689452648162842 and parameters: {'fp_type': 'morgan', 'morgan_only_radius': 2, 'morgan_only_nBits': 2048, 'num_hidden_layers': 3, 'hidden_dim_0': 512, 'hidden_dim_1': 128, 'hidden_dim_2': 512, 'kl_weight': 0.00029238405006378095, 'lr': 0.0016752205057558687, 'batch_size': 32, 'dropout_rate': 0.00019777608656434964, 'prior_mu': 0.035184719529325066, 'prior_sigma': 0.07858334442085145, 'normalization': 'none'}. Best is trial 2426 with value: 0.515486741065979.
Generating morgan fingerprints...
Generated fingerprints with 2048 features for 900 molecules
Data shape: X=(900, 2048), y=(900,)
Trial 2661: 5-fold CV loss = 0.6568
[I 2025-08-08 07:10:31,582] Trial 2661 finished with value: 0.656758451461792 and parameters: {'fp_type': 'morgan', 'morgan_only_radius': 2, 'morgan_only_nBits': 2048, 'num_hidden_layers': 3, 'hidden_dim_0': 512, 'hidden_dim_1': 64, 'hidden_dim_2': 512, 'kl_weight': 0.00043672643206120866, 'lr': 0.002238290403398137, 'batch_size': 64, 'dropout_rate': 0.4640428101235313, 'prior_mu': 0.03071098232815292, 'prior_sigma': 0.05991943289658483, 'normalization': 'none'}. Best is trial 2426 with value: 0.515486741065979.
Generating morgan fingerprints...
Generated fingerprints with 2048 features for 900 molecules
Data shape: X=(900, 2048), y=(900,)
Trial 2660: 5-fold CV loss = 0.5308
[I 2025-08-08 07:10:49,232] Trial 2660 finished with value: 0.5308382689952851 and parameters: {'fp_type': 'morgan', 'morgan_only_radius': 2, 'morgan_only_nBits': 2048, 'num_hidden_layers': 3, 'hidden_dim_0': 512, 'hidden_dim_1': 64, 'hidden_dim_2': 512, 'kl_weight': 0.00014690261213559495, 'lr': 0.0034234570593666405, 'batch_size': 32, 'dropout_rate': 0.3538663241727736, 'prior_mu': 0.0320207192039526, 'prior_sigma': 0.06899259714561948, 'normalization': 'none'}. Best is trial 2426 with value: 0.515486741065979.
Generating morgan fingerprints...
Generated fingerprints with 2048 features for 900 molecules
Data shape: X=(900, 2048), y=(900,)
Trial 2662: 5-fold CV loss = 0.7200
[I 2025-08-08 07:11:20,622] Trial 2662 finished with value: 0.7199855804443359 and parameters: {'fp_type': 'morgan', 'morgan_only_radius': 2, 'morgan_only_nBits': 2048, 'num_hidden_layers': 3, 'hidden_dim_0': 512, 'hidden_dim_1': 64, 'hidden_dim_2': 512, 'kl_weight': 0.00015397715962370918, 'lr': 0.00217405099949571, 'batch_size': 64, 'dropout_rate': 0.39898586961396393, 'prior_mu': 0.02980065599544724, 'prior_sigma': 0.08493987471920154, 'normalization': 'none'}. Best is trial 2426 with value: 0.515486741065979.
Generating morgan fingerprints...
Generated fingerprints with 2048 features for 900 molecules
Data shape: X=(900, 2048), y=(900,)
Trial 2663: 5-fold CV loss = 0.5402
[I 2025-08-08 07:11:57,233] Trial 2663 finished with value: 0.5402350664138794 and parameters: {'fp_type': 'morgan', 'morgan_only_radius': 2, 'morgan_only_nBits': 2048, 'num_hidden_layers': 3, 'hidden_dim_0': 512, 'hidden_dim_1': 128, 'hidden_dim_2': 512, 'kl_weight': 0.0008062381145155998, 'lr': 0.0019952905980488616, 'batch_size': 32, 'dropout_rate': 0.31273673267838914, 'prior_mu': 0.041653827769018596, 'prior_sigma': 0.06996930717566352, 'normalization': 'none'}. Best is trial 2426 with value: 0.515486741065979.
Generating morgan fingerprints...
Generated fingerprints with 2048 features for 900 molecules
Data shape: X=(900, 2048), y=(900,)
Trial 2664: 5-fold CV loss = 0.5794
[I 2025-08-08 07:12:08,674] Trial 2664 finished with value: 0.5794270634651184 and parameters: {'fp_type': 'morgan', 'morgan_only_radius': 2, 'morgan_only_nBits': 2048, 'num_hidden_layers': 3, 'hidden_dim_0': 512, 'hidden_dim_1': 128, 'hidden_dim_2': 256, 'kl_weight': 0.0008013751307615673, 'lr': 0.0020017756907687407, 'batch_size': 32, 'dropout_rate': 0.31749911206175896, 'prior_mu': 0.041327735747048136, 'prior_sigma': 0.09444971609741631, 'normalization': 'none'}. Best is trial 2426 with value: 0.515486741065979.
Generating morgan fingerprints...
Generated fingerprints with 2048 features for 900 molecules
Data shape: X=(900, 2048), y=(900,)
Trial 2666: 5-fold CV loss = 0.6309
[I 2025-08-08 07:13:01,668] Trial 2666 finished with value: 0.6308777749538421 and parameters: {'fp_type': 'morgan', 'morgan_only_radius': 2, 'morgan_only_nBits': 2048, 'num_hidden_layers': 3, 'hidden_dim_0': 256, 'hidden_dim_1': 128, 'hidden_dim_2': 256, 'kl_weight': 0.000548235381176871, 'lr': 0.0018160766359778917, 'batch_size': 32, 'dropout_rate': 0.45573859095101527, 'prior_mu': 0.05305769191049869, 'prior_sigma': 0.06480722184341783, 'normalization': 'none'}. Best is trial 2426 with value: 0.515486741065979.
Generating morgan fingerprints...
Generated fingerprints with 2048 features for 900 molecules
Data shape: X=(900, 2048), y=(900,)
Trial 2665: 5-fold CV loss = 0.6505
[I 2025-08-08 07:13:03,879] Trial 2665 finished with value: 0.650466400384903 and parameters: {'fp_type': 'morgan', 'morgan_only_radius': 2, 'morgan_only_nBits': 2048, 'num_hidden_layers': 3, 'hidden_dim_0': 512, 'hidden_dim_1': 128, 'hidden_dim_2': 256, 'kl_weight': 0.0007914196454047619, 'lr': 0.0018117134570987908, 'batch_size': 32, 'dropout_rate': 0.4150975335750125, 'prior_mu': 0.041853190577171726, 'prior_sigma': 0.07123464363021331, 'normalization': 'none'}. Best is trial 2426 with value: 0.515486741065979.
Generating morgan fingerprints...
Generated fingerprints with 2048 features for 900 molecules
Data shape: X=(900, 2048), y=(900,)
Trial 2667: 5-fold CV loss = 0.5276
[I 2025-08-08 07:13:14,223] Trial 2667 finished with value: 0.5275506556034089 and parameters: {'fp_type': 'morgan', 'morgan_only_radius': 2, 'morgan_only_nBits': 2048, 'num_hidden_layers': 3, 'hidden_dim_0': 512, 'hidden_dim_1': 128, 'hidden_dim_2': 512, 'kl_weight': 0.0005160924198396153, 'lr': 0.002356640334046567, 'batch_size': 32, 'dropout_rate': 0.41663440604664975, 'prior_mu': 0.07994741618162488, 'prior_sigma': 0.06472072569070357, 'normalization': 'none'}. Best is trial 2426 with value: 0.515486741065979.
Generating morgan fingerprints...
Generated fingerprints with 2048 features for 900 molecules
Data shape: X=(900, 2048), y=(900,)
Trial 2659: 5-fold CV loss = 0.5241
[I 2025-08-08 07:13:40,702] Trial 2659 finished with value: 0.5241042613983155 and parameters: {'fp_type': 'morgan', 'morgan_only_radius': 2, 'morgan_only_nBits': 2048, 'num_hidden_layers': 3, 'hidden_dim_0': 512, 'hidden_dim_1': 64, 'hidden_dim_2': 256, 'kl_weight': 0.0006433464609319214, 'lr': 0.002304162554419378, 'batch_size': 32, 'dropout_rate': 0.4635968934089715, 'prior_mu': 0.048046369986723556, 'prior_sigma': 0.06546194131163144, 'normalization': 'none'}. Best is trial 2426 with value: 0.515486741065979.
Generating morgan fingerprints...
Generated fingerprints with 2048 features for 900 molecules
Data shape: X=(900, 2048), y=(900,)
Trial 2668: 5-fold CV loss = 0.5387
[I 2025-08-08 07:14:16,736] Trial 2668 finished with value: 0.5386813044548034 and parameters: {'fp_type': 'morgan', 'morgan_only_radius': 2, 'morgan_only_nBits': 2048, 'num_hidden_layers': 3, 'hidden_dim_0': 512, 'hidden_dim_1': 128, 'hidden_dim_2': 512, 'kl_weight': 0.030252011736570106, 'lr': 0.00233460288409274, 'batch_size': 32, 'dropout_rate': 0.4158700152894072, 'prior_mu': 0.062195163914840076, 'prior_sigma': 0.07317981498718695, 'normalization': 'none'}. Best is trial 2426 with value: 0.515486741065979.
Generating morgan fingerprints...
Generated fingerprints with 2048 features for 900 molecules
Data shape: X=(900, 2048), y=(900,)
Trial 2670: 5-fold CV loss = 0.5237
[I 2025-08-08 07:14:19,966] Trial 2670 finished with value: 0.5237018465995789 and parameters: {'fp_type': 'morgan', 'morgan_only_radius': 2, 'morgan_only_nBits': 2048, 'num_hidden_layers': 3, 'hidden_dim_0': 512, 'hidden_dim_1': 256, 'hidden_dim_2': 512, 'kl_weight': 0.000641569881077807, 'lr': 0.002661296711895074, 'batch_size': 32, 'dropout_rate': 0.43204965143925766, 'prior_mu': 0.06254478867066246, 'prior_sigma': 0.06115821918519364, 'normalization': 'none'}. Best is trial 2426 with value: 0.515486741065979.
Generating morgan fingerprints...
Generated fingerprints with 2048 features for 900 molecules
Data shape: X=(900, 2048), y=(900,)
Trial 2672: 5-fold CV loss = 0.6768
[I 2025-08-08 07:14:27,180] Trial 2672 finished with value: 0.6767526388168335 and parameters: {'fp_type': 'morgan', 'morgan_only_radius': 2, 'morgan_only_nBits': 2048, 'num_hidden_layers': 3, 'hidden_dim_0': 512, 'hidden_dim_1': 256, 'hidden_dim_2': 512, 'kl_weight': 0.0007133640459060413, 'lr': 0.0014823319704886234, 'batch_size': 128, 'dropout_rate': 0.431597044719678, 'prior_mu': 0.011728669381962, 'prior_sigma': 0.06101318181982902, 'normalization': 'none'}. Best is trial 2426 with value: 0.515486741065979.
Generating morgan fingerprints...
Generated fingerprints with 2048 features for 900 molecules
Data shape: X=(900, 2048), y=(900,)
Trial 2673: 5-fold CV loss = 0.5636
[I 2025-08-08 07:14:42,483] Trial 2673 finished with value: 0.5635937631130219 and parameters: {'fp_type': 'morgan', 'morgan_only_radius': 2, 'morgan_only_nBits': 2048, 'num_hidden_layers': 3, 'hidden_dim_0': 512, 'hidden_dim_1': 128, 'hidden_dim_2': 512, 'kl_weight': 0.00042822516493466723, 'lr': 0.004321525391423047, 'batch_size': 128, 'dropout_rate': 0.44237834631753237, 'prior_mu': 0.05579361378367667, 'prior_sigma': 0.058607817405004536, 'normalization': 'none'}. Best is trial 2426 with value: 0.515486741065979.
Generating morgan fingerprints...
Generated fingerprints with 2048 features for 900 molecules
Data shape: X=(900, 2048), y=(900,)
Trial 2669: 5-fold CV loss = 0.5332
[I 2025-08-08 07:15:01,432] Trial 2669 finished with value: 0.5332391738891602 and parameters: {'fp_type': 'morgan', 'morgan_only_radius': 2, 'morgan_only_nBits': 2048, 'num_hidden_layers': 3, 'hidden_dim_0': 512, 'hidden_dim_1': 256, 'hidden_dim_2': 512, 'kl_weight': 0.0006375192605197076, 'lr': 0.0023946581129820565, 'batch_size': 32, 'dropout_rate': 0.42797732436028063, 'prior_mu': 0.08084782940449846, 'prior_sigma': 0.06024531857413677, 'normalization': 'none'}. Best is trial 2426 with value: 0.515486741065979.
Generating morgan fingerprints...
Generated fingerprints with 2048 features for 900 molecules
Data shape: X=(900, 2048), y=(900,)
Trial 2674: 5-fold CV loss = 1.0618
[I 2025-08-08 07:15:12,130] Trial 2674 finished with value: 1.0618152976036073 and parameters: {'fp_type': 'morgan', 'morgan_only_radius': 2, 'morgan_only_nBits': 2048, 'num_hidden_layers': 3, 'hidden_dim_0': 512, 'hidden_dim_1': 1024, 'hidden_dim_2': 512, 'kl_weight': 0.00024654007478675395, 'lr': 0.003141408048098168, 'batch_size': 32, 'dropout_rate': 0.4442804845361112, 'prior_mu': -0.0966336810240159, 'prior_sigma': 0.07408623030608491, 'normalization': 'none'}. Best is trial 2426 with value: 0.515486741065979.
Generating morgan fingerprints...
Generated fingerprints with 2048 features for 900 molecules
Data shape: X=(900, 2048), y=(900,)
Trial 2675: 5-fold CV loss = 0.5306
[I 2025-08-08 07:15:35,217] Trial 2675 finished with value: 0.5306141674518585 and parameters: {'fp_type': 'morgan', 'morgan_only_radius': 2, 'morgan_only_nBits': 2048, 'num_hidden_layers': 3, 'hidden_dim_0': 512, 'hidden_dim_1': 128, 'hidden_dim_2': 512, 'kl_weight': 0.0008945908409808116, 'lr': 0.003174314413369713, 'batch_size': 32, 'dropout_rate': 0.4053878166282449, 'prior_mu': 0.02512069904005685, 'prior_sigma': 0.08295674049086202, 'normalization': 'none'}. Best is trial 2426 with value: 0.515486741065979.
Generating morgan fingerprints...
Generated fingerprints with 2048 features for 900 molecules
Data shape: X=(900, 2048), y=(900,)
Trial 2676: 5-fold CV loss = 1.4469
