[I 2025-08-08 06:00:05,118] Trial 2425 finished with value: 0.684188187122345 and parameters: {'fp_type': 'morgan', 'morgan_only_radius': 2, 'morgan_only_nBits': 2048, 'num_hidden_layers': 3, 'hidden_dim_0': 512, 'hidden_dim_1': 128, 'hidden_dim_2': 512, 'kl_weight': 0.0006734267495980708, 'lr': 0.0018895972087490478, 'batch_size': 64, 'dropout_rate': 0.4113895386723935, 'prior_mu': 0.08026237559082643, 'prior_sigma': 0.055707895518825164, 'normalization': 'none'}. Best is trial 2329 with value: 0.5157062888145447.
Generating morgan fingerprints...
Generated fingerprints with 2048 features for 900 molecules
Data shape: X=(900, 2048), y=(900,)
Trial 2424: 5-fold CV loss = 0.6873
[I 2025-08-08 06:00:06,627] Trial 2424 finished with value: 0.6872984111309052 and parameters: {'fp_type': 'morgan', 'morgan_only_radius': 2, 'morgan_only_nBits': 2048, 'num_hidden_layers': 3, 'hidden_dim_0': 512, 'hidden_dim_1': 128, 'hidden_dim_2': 256, 'kl_weight': 0.0006828520110912879, 'lr': 0.002460507117761418, 'batch_size': 64, 'dropout_rate': 0.4275907289404931, 'prior_mu': 0.08288010828941435, 'prior_sigma': 0.07620712783840504, 'normalization': 'none'}. Best is trial 2329 with value: 0.5157062888145447.
Generating morgan fingerprints...
Generated fingerprints with 2048 features for 900 molecules
Data shape: X=(900, 2048), y=(900,)
Trial 2428: 5-fold CV loss = 0.7105
[I 2025-08-08 06:00:29,798] Trial 2428 finished with value: 0.71045401096344 and parameters: {'fp_type': 'morgan', 'morgan_only_radius': 2, 'morgan_only_nBits': 2048, 'num_hidden_layers': 1, 'hidden_dim_0': 512, 'kl_weight': 0.00017830989459207422, 'lr': 0.0024272417750822194, 'batch_size': 32, 'dropout_rate': 0.4371862272847168, 'prior_mu': 0.010705139281280272, 'prior_sigma': 0.06380601750809875, 'normalization': 'none'}. Best is trial 2329 with value: 0.5157062888145447.
Generating morgan fingerprints...
Generated fingerprints with 2048 features for 900 molecules
Data shape: X=(900, 2048), y=(900,)
Trial 2426: 5-fold CV loss = 0.5155
[I 2025-08-08 06:00:45,178] Trial 2426 finished with value: 0.515486741065979 and parameters: {'fp_type': 'morgan', 'morgan_only_radius': 2, 'morgan_only_nBits': 2048, 'num_hidden_layers': 3, 'hidden_dim_0': 512, 'hidden_dim_1': 128, 'hidden_dim_2': 512, 'kl_weight': 0.00017605373157530214, 'lr': 0.0025078437525212624, 'batch_size': 64, 'dropout_rate': 0.41767452696526564, 'prior_mu': 0.08205577668941115, 'prior_sigma': 0.07712759401617858, 'normalization': 'none'}. Best is trial 2426 with value: 0.515486741065979.
Generating morgan fingerprints...
Generated fingerprints with 2048 features for 900 molecules
Data shape: X=(900, 2048), y=(900,)
Trial 2429: 5-fold CV loss = 0.8130
[I 2025-08-08 06:01:04,527] Trial 2429 finished with value: 0.8130235791206359 and parameters: {'fp_type': 'morgan', 'morgan_only_radius': 2, 'morgan_only_nBits': 2048, 'num_hidden_layers': 3, 'hidden_dim_0': 512, 'hidden_dim_1': 256, 'hidden_dim_2': 512, 'kl_weight': 0.0005625652951009618, 'lr': 0.002058122431949036, 'batch_size': 32, 'dropout_rate': 0.4194562627982446, 'prior_mu': 0.04464502594427145, 'prior_sigma': 0.07808621482366186, 'normalization': 'none'}. Best is trial 2426 with value: 0.515486741065979.
Generating morgan fingerprints...
Generated fingerprints with 2048 features for 900 molecules
Data shape: X=(900, 2048), y=(900,)
Trial 2420: 5-fold CV loss = 0.5647
[I 2025-08-08 06:01:25,579] Trial 2420 finished with value: 0.5646775603294373 and parameters: {'fp_type': 'morgan', 'morgan_only_radius': 2, 'morgan_only_nBits': 2048, 'num_hidden_layers': 3, 'hidden_dim_0': 512, 'hidden_dim_1': 64, 'hidden_dim_2': 512, 'kl_weight': 0.0007768502670555199, 'lr': 0.001685942664471838, 'batch_size': 32, 'dropout_rate': 0.25634237142932864, 'prior_mu': 0.03479872978061024, 'prior_sigma': 0.06970796706911335, 'normalization': 'none'}. Best is trial 2426 with value: 0.515486741065979.
Generating morgan fingerprints...
Generated fingerprints with 2048 features for 900 molecules
Data shape: X=(900, 2048), y=(900,)
Trial 2430: 5-fold CV loss = 0.5715
[I 2025-08-08 06:01:29,040] Trial 2430 finished with value: 0.5714792311191559 and parameters: {'fp_type': 'morgan', 'morgan_only_radius': 2, 'morgan_only_nBits': 2048, 'num_hidden_layers': 3, 'hidden_dim_0': 64, 'hidden_dim_1': 256, 'hidden_dim_2': 512, 'kl_weight': 0.00013998691755700348, 'lr': 0.0030348278739737752, 'batch_size': 64, 'dropout_rate': 0.40559643114925154, 'prior_mu': 0.08515384226233069, 'prior_sigma': 0.08170530085833899, 'normalization': 'none'}. Best is trial 2426 with value: 0.515486741065979.
Generating morgan fingerprints...
Generated fingerprints with 2048 features for 900 molecules
Data shape: X=(900, 2048), y=(900,)
Trial 2427: 5-fold CV loss = 0.5324
[I 2025-08-08 06:01:36,785] Trial 2427 finished with value: 0.5324014186859131 and parameters: {'fp_type': 'morgan', 'morgan_only_radius': 2, 'morgan_only_nBits': 2048, 'num_hidden_layers': 3, 'hidden_dim_0': 512, 'hidden_dim_1': 128, 'hidden_dim_2': 512, 'kl_weight': 0.00017445476243047172, 'lr': 0.0025108096445962125, 'batch_size': 32, 'dropout_rate': 0.43064451440835827, 'prior_mu': 0.011039780010320209, 'prior_sigma': 0.07739096578349416, 'normalization': 'none'}. Best is trial 2426 with value: 0.515486741065979.
Generating rdkit fingerprints...
Generated fingerprints with 512 features for 900 molecules
Data shape: X=(900, 512), y=(900,)
Trial 2433: 5-fold CV loss = 0.7197
[I 2025-08-08 06:01:40,864] Trial 2433 finished with value: 0.7196513533592224 and parameters: {'fp_type': 'morgan', 'morgan_only_radius': 2, 'morgan_only_nBits': 2048, 'num_hidden_layers': 2, 'hidden_dim_0': 512, 'hidden_dim_1': 128, 'kl_weight': 0.00015923329302755515, 'lr': 0.002801387974522135, 'batch_size': 64, 'dropout_rate': 0.38960821087679814, 'prior_mu': 0.08677588818159795, 'prior_sigma': 0.08123570047470012, 'normalization': 'none'}. Best is trial 2426 with value: 0.515486741065979.
Generating rdkit fingerprints...
Generated fingerprints with 512 features for 900 molecules
Data shape: X=(900, 512), y=(900,)
Trial 2431: 5-fold CV loss = 0.5701
[I 2025-08-08 06:01:48,475] Trial 2431 finished with value: 0.570085883140564 and parameters: {'fp_type': 'morgan', 'morgan_only_radius': 2, 'morgan_only_nBits': 2048, 'num_hidden_layers': 3, 'hidden_dim_0': 512, 'hidden_dim_1': 128, 'hidden_dim_2': 512, 'kl_weight': 0.00013620904437859044, 'lr': 0.0029221802534261884, 'batch_size': 64, 'dropout_rate': 0.4040338051238334, 'prior_mu': 0.08424901856178796, 'prior_sigma': 0.08608049802116167, 'normalization': 'none'}. Best is trial 2426 with value: 0.515486741065979.
Generating morgan fingerprints...
Generated fingerprints with 2048 features for 900 molecules
Data shape: X=(900, 2048), y=(900,)
Trial 2435: 5-fold CV loss = 0.6402
[I 2025-08-08 06:02:06,243] Trial 2435 finished with value: 0.6401929020881653 and parameters: {'fp_type': 'rdkit', 'rdkit_only_maxPath': 6, 'rdkit_only_nBits': 512, 'num_hidden_layers': 3, 'hidden_dim_0': 512, 'hidden_dim_1': 128, 'hidden_dim_2': 512, 'kl_weight': 0.00020067066574351708, 'lr': 0.0029706775376588516, 'batch_size': 64, 'dropout_rate': 0.3907180994051249, 'prior_mu': 0.06827404832231143, 'prior_sigma': 0.08385539041114219, 'normalization': 'none'}. Best is trial 2426 with value: 0.515486741065979.
Generating morgan fingerprints...
Generated fingerprints with 2048 features for 900 molecules
Data shape: X=(900, 2048), y=(900,)
Trial 2436: 5-fold CV loss = 0.9914
[I 2025-08-08 06:02:13,688] Trial 2436 finished with value: 0.9914435625076294 and parameters: {'fp_type': 'morgan', 'morgan_only_radius': 2, 'morgan_only_nBits': 2048, 'num_hidden_layers': 3, 'hidden_dim_0': 512, 'hidden_dim_1': 1024, 'hidden_dim_2': 256, 'kl_weight': 0.00018808250973533793, 'lr': 0.002697695394088982, 'batch_size': 64, 'dropout_rate': 0.41066235248296307, 'prior_mu': 0.08583576646715166, 'prior_sigma': 0.08433706554470213, 'normalization': 'none'}. Best is trial 2426 with value: 0.515486741065979.
Generating morgan fingerprints...
Generated fingerprints with 2048 features for 900 molecules
Data shape: X=(900, 2048), y=(900,)
Trial 2434: 5-fold CV loss = 0.6403
[I 2025-08-08 06:02:33,153] Trial 2434 finished with value: 0.6403437614440918 and parameters: {'fp_type': 'rdkit', 'rdkit_only_maxPath': 6, 'rdkit_only_nBits': 512, 'num_hidden_layers': 3, 'hidden_dim_0': 512, 'hidden_dim_1': 128, 'hidden_dim_2': 512, 'kl_weight': 0.0002282549116459061, 'lr': 0.0029101151532685493, 'batch_size': 64, 'dropout_rate': 0.40255200533445806, 'prior_mu': 0.07183313197851918, 'prior_sigma': 0.08538419994398767, 'normalization': 'none'}. Best is trial 2426 with value: 0.515486741065979.
Generating morgan_rdkit fingerprints...
Generated fingerprints with 1536 features for 900 molecules
Data shape: X=(900, 1536), y=(900,)
Trial 2438: 5-fold CV loss = 0.5457
[I 2025-08-08 06:02:58,605] Trial 2438 finished with value: 0.5456689596176147 and parameters: {'fp_type': 'morgan', 'morgan_only_radius': 2, 'morgan_only_nBits': 2048, 'num_hidden_layers': 3, 'hidden_dim_0': 512, 'hidden_dim_1': 128, 'hidden_dim_2': 1024, 'kl_weight': 0.0002275490255226268, 'lr': 0.002797862214392416, 'batch_size': 64, 'dropout_rate': 0.12502488945183426, 'prior_mu': 0.08241766059158635, 'prior_sigma': 0.07864031581762572, 'normalization': 'none'}. Best is trial 2426 with value: 0.515486741065979.
Generating morgan fingerprints...
Generated fingerprints with 2048 features for 900 molecules
Data shape: X=(900, 2048), y=(900,)
Trial 2432: 5-fold CV loss = 0.7039
[I 2025-08-08 06:03:05,443] Trial 2432 finished with value: 0.7039319217205048 and parameters: {'fp_type': 'morgan', 'morgan_only_radius': 2, 'morgan_only_nBits': 2048, 'num_hidden_layers': 3, 'hidden_dim_0': 512, 'hidden_dim_1': 128, 'hidden_dim_2': 512, 'kl_weight': 0.00013641936591904656, 'lr': 0.002769241890019464, 'batch_size': 64, 'dropout_rate': 0.3936188527022917, 'prior_mu': 0.0834554193739604, 'prior_sigma': 0.08281657589964282, 'normalization': 'none'}. Best is trial 2426 with value: 0.515486741065979.
Generating morgan_rdkit fingerprints...
Generated fingerprints with 1536 features for 900 molecules
Data shape: X=(900, 1536), y=(900,)
Trial 2440: 5-fold CV loss = 0.9166
[I 2025-08-08 06:03:20,846] Trial 2440 finished with value: 0.9165662884712219 and parameters: {'fp_type': 'morgan', 'morgan_only_radius': 2, 'morgan_only_nBits': 2048, 'num_hidden_layers': 3, 'hidden_dim_0': 512, 'hidden_dim_1': 512, 'hidden_dim_2': 512, 'kl_weight': 0.00015686641508696117, 'lr': 0.003284706637611261, 'batch_size': 64, 'dropout_rate': 0.39501921727911987, 'prior_mu': 0.07287175428936123, 'prior_sigma': 0.08074647835857798, 'normalization': 'none'}. Best is trial 2426 with value: 0.515486741065979.
Generating morgan_rdkit fingerprints...
Generated fingerprints with 1536 features for 900 molecules
Data shape: X=(900, 1536), y=(900,)
Trial 2437: 5-fold CV loss = 0.5244
[I 2025-08-08 06:03:28,275] Trial 2437 finished with value: 0.5243766605854034 and parameters: {'fp_type': 'morgan', 'morgan_only_radius': 2, 'morgan_only_nBits': 2048, 'num_hidden_layers': 3, 'hidden_dim_0': 512, 'hidden_dim_1': 128, 'hidden_dim_2': 256, 'kl_weight': 0.0001695011549950589, 'lr': 0.0025986080360648495, 'batch_size': 32, 'dropout_rate': 0.40886264673277184, 'prior_mu': 0.07778657105047446, 'prior_sigma': 0.08309526221972142, 'normalization': 'none'}. Best is trial 2426 with value: 0.515486741065979.
Generating morgan fingerprints...
Generated fingerprints with 2048 features for 900 molecules
Data shape: X=(900, 2048), y=(900,)
Trial 2439: 5-fold CV loss = 0.6438
[I 2025-08-08 06:03:43,289] Trial 2439 finished with value: 0.6438283324241638 and parameters: {'fp_type': 'morgan_rdkit', 'combined_morgan_radius': 3, 'combined_morgan_nBits': 512, 'combined_rdkit_maxPath': 8, 'combined_rdkit_nBits': 1024, 'num_hidden_layers': 3, 'hidden_dim_0': 512, 'hidden_dim_1': 128, 'hidden_dim_2': 1024, 'kl_weight': 0.00022564224449579434, 'lr': 0.0031794594639518647, 'batch_size': 64, 'dropout_rate': 0.03154878908896491, 'prior_mu': 0.09304309410144498, 'prior_sigma': 0.08070307083043925, 'normalization': 'none'}. Best is trial 2426 with value: 0.515486741065979.
Generating morgan fingerprints...
Generated fingerprints with 2048 features for 900 molecules
Data shape: X=(900, 2048), y=(900,)
Trial 2443: 5-fold CV loss = 0.5945
[I 2025-08-08 06:03:47,291] Trial 2443 finished with value: 0.5944949507713317 and parameters: {'fp_type': 'morgan', 'morgan_only_radius': 3, 'morgan_only_nBits': 2048, 'num_hidden_layers': 3, 'hidden_dim_0': 1024, 'hidden_dim_1': 64, 'hidden_dim_2': 512, 'kl_weight': 0.0001762217488178642, 'lr': 0.007827970353302665, 'batch_size': 64, 'dropout_rate': 0.3780445292783911, 'prior_mu': 0.08315320549379927, 'prior_sigma': 0.088127875575315, 'normalization': 'none'}. Best is trial 2426 with value: 0.515486741065979.
Generating morgan fingerprints...
Generated fingerprints with 2048 features for 900 molecules
Data shape: X=(900, 2048), y=(900,)
Trial 2442: 5-fold CV loss = 0.6335
[I 2025-08-08 06:03:56,836] Trial 2442 finished with value: 0.6334547638893128 and parameters: {'fp_type': 'morgan_rdkit', 'combined_morgan_radius': 3, 'combined_morgan_nBits': 512, 'combined_rdkit_maxPath': 8, 'combined_rdkit_nBits': 1024, 'num_hidden_layers': 3, 'hidden_dim_0': 512, 'hidden_dim_1': 64, 'hidden_dim_2': 256, 'kl_weight': 0.00017159516573097297, 'lr': 0.00260139364556427, 'batch_size': 64, 'dropout_rate': 0.3813569662261833, 'prior_mu': 0.09896834796497553, 'prior_sigma': 0.07635145063122731, 'normalization': 'none'}. Best is trial 2426 with value: 0.515486741065979.
Generating morgan fingerprints...
Generated fingerprints with 2048 features for 900 molecules
Data shape: X=(900, 2048), y=(900,)
Trial 2445: 5-fold CV loss = 0.5281
[I 2025-08-08 06:04:31,201] Trial 2445 finished with value: 0.5281260490417481 and parameters: {'fp_type': 'morgan', 'morgan_only_radius': 2, 'morgan_only_nBits': 2048, 'num_hidden_layers': 3, 'hidden_dim_0': 512, 'hidden_dim_1': 128, 'hidden_dim_2': 512, 'kl_weight': 0.00018896972102775322, 'lr': 0.0035701694512856093, 'batch_size': 64, 'dropout_rate': 0.41725206099197043, 'prior_mu': 0.06756967957259978, 'prior_sigma': 0.07902281501723131, 'normalization': 'none'}. Best is trial 2426 with value: 0.515486741065979.
Generating morgan fingerprints...
Generated fingerprints with 2048 features for 900 molecules
Data shape: X=(900, 2048), y=(900,)
Trial 2446: 5-fold CV loss = 0.5327
[I 2025-08-08 06:04:41,810] Trial 2446 finished with value: 0.5326736450195313 and parameters: {'fp_type': 'morgan', 'morgan_only_radius': 2, 'morgan_only_nBits': 2048, 'num_hidden_layers': 3, 'hidden_dim_0': 512, 'hidden_dim_1': 128, 'hidden_dim_2': 512, 'kl_weight': 0.00022541351355541658, 'lr': 0.00346488647483311, 'batch_size': 64, 'dropout_rate': 0.4072840392930529, 'prior_mu': 0.10113625382864586, 'prior_sigma': 0.07827142029482341, 'normalization': 'none'}. Best is trial 2426 with value: 0.515486741065979.
Generating morgan fingerprints...
Generated fingerprints with 2048 features for 900 molecules
Data shape: X=(900, 2048), y=(900,)
Trial 2447: 5-fold CV loss = 0.8063
[I 2025-08-08 06:04:46,153] Trial 2447 finished with value: 0.8062851428985596 and parameters: {'fp_type': 'morgan', 'morgan_only_radius': 2, 'morgan_only_nBits': 2048, 'num_hidden_layers': 3, 'hidden_dim_0': 128, 'hidden_dim_1': 128, 'hidden_dim_2': 512, 'kl_weight': 0.00020252914872401353, 'lr': 0.0005162193055149799, 'batch_size': 64, 'dropout_rate': 0.413280530582361, 'prior_mu': 0.06964947064534867, 'prior_sigma': 0.0777801363781167, 'normalization': 'none'}. Best is trial 2426 with value: 0.515486741065979.
Generating morgan fingerprints...
Generated fingerprints with 2048 features for 900 molecules
Data shape: X=(900, 2048), y=(900,)
Trial 2444: 5-fold CV loss = 0.5398
[I 2025-08-08 06:04:54,163] Trial 2444 finished with value: 0.5397996783256531 and parameters: {'fp_type': 'morgan', 'morgan_only_radius': 2, 'morgan_only_nBits': 2048, 'num_hidden_layers': 3, 'hidden_dim_0': 1024, 'hidden_dim_1': 64, 'hidden_dim_2': 512, 'kl_weight': 0.00020506871822130408, 'lr': 0.0036131661977176106, 'batch_size': 32, 'dropout_rate': 0.3813438219955866, 'prior_mu': 0.08021323857966517, 'prior_sigma': 0.07726294060682742, 'normalization': 'none'}. Best is trial 2426 with value: 0.515486741065979.
Generating morgan fingerprints...
Generated fingerprints with 2048 features for 900 molecules
Data shape: X=(900, 2048), y=(900,)
Trial 2441: 5-fold CV loss = 0.6215
[I 2025-08-08 06:05:10,374] Trial 2441 finished with value: 0.6215089440345765 and parameters: {'fp_type': 'morgan_rdkit', 'combined_morgan_radius': 3, 'combined_morgan_nBits': 512, 'combined_rdkit_maxPath': 8, 'combined_rdkit_nBits': 1024, 'num_hidden_layers': 3, 'hidden_dim_0': 512, 'hidden_dim_1': 64, 'hidden_dim_2': 256, 'kl_weight': 0.0001630580419467618, 'lr': 0.0031633945962722815, 'batch_size': 64, 'dropout_rate': 0.41167752827558285, 'prior_mu': 0.07554142013792076, 'prior_sigma': 0.08064911896434951, 'normalization': 'none'}. Best is trial 2426 with value: 0.515486741065979.
Generating morgan fingerprints...
Generated fingerprints with 2048 features for 900 molecules
Data shape: X=(900, 2048), y=(900,)
Trial 2448: 5-fold CV loss = 0.7091
[I 2025-08-08 06:05:17,189] Trial 2448 finished with value: 0.7090745091438293 and parameters: {'fp_type': 'morgan', 'morgan_only_radius': 2, 'morgan_only_nBits': 2048, 'num_hidden_layers': 3, 'hidden_dim_0': 512, 'hidden_dim_1': 128, 'hidden_dim_2': 512, 'kl_weight': 0.00014376943423695068, 'lr': 0.002550704873217127, 'batch_size': 64, 'dropout_rate': 0.4168068705111038, 'prior_mu': 0.07919238854750452, 'prior_sigma': 0.07532482711819763, 'normalization': 'none'}. Best is trial 2426 with value: 0.515486741065979.
Generating morgan fingerprints...
Generated fingerprints with 2048 features for 900 molecules
Data shape: X=(900, 2048), y=(900,)
Trial 2449: 5-fold CV loss = 0.9001
[I 2025-08-08 06:05:19,208] Trial 2449 finished with value: 0.9001015067100525 and parameters: {'fp_type': 'morgan', 'morgan_only_radius': 2, 'morgan_only_nBits': 2048, 'num_hidden_layers': 3, 'hidden_dim_0': 512, 'hidden_dim_1': 128, 'hidden_dim_2': 512, 'kl_weight': 0.00021291795641676552, 'lr': 0.002513939806883324, 'batch_size': 64, 'dropout_rate': 0.41542587571341144, 'prior_mu': 0.0969010052592056, 'prior_sigma': 0.09592288257671883, 'normalization': 'none'}. Best is trial 2426 with value: 0.515486741065979.
Generating morgan fingerprints...
Generated fingerprints with 2048 features for 900 molecules
Data shape: X=(900, 2048), y=(900,)
Trial 2452: 5-fold CV loss = 0.9710
[I 2025-08-08 06:05:39,221] Trial 2452 finished with value: 0.9709574580192566 and parameters: {'fp_type': 'morgan', 'morgan_only_radius': 2, 'morgan_only_nBits': 2048, 'num_hidden_layers': 3, 'hidden_dim_0': 512, 'hidden_dim_1': 128, 'hidden_dim_2': 512, 'kl_weight': 0.0002620295175667353, 'lr': 0.002525169240637914, 'batch_size': 64, 'dropout_rate': 0.4194085623442302, 'prior_mu': 0.06982605824728627, 'prior_sigma': 0.08964095697422521, 'normalization': 'none'}. Best is trial 2426 with value: 0.515486741065979.
Generating morgan fingerprints...
Generated fingerprints with 2048 features for 900 molecules
Data shape: X=(900, 2048), y=(900,)
Trial 2450: 5-fold CV loss = 0.6451
[I 2025-08-08 06:05:46,095] Trial 2450 finished with value: 0.6450661301612854 and parameters: {'fp_type': 'morgan', 'morgan_only_radius': 2, 'morgan_only_nBits': 2048, 'num_hidden_layers': 3, 'hidden_dim_0': 512, 'hidden_dim_1': 128, 'hidden_dim_2': 256, 'kl_weight': 0.00017270767343636985, 'lr': 0.002638840527996607, 'batch_size': 64, 'dropout_rate': 0.41705967986624387, 'prior_mu': 0.08716557390863489, 'prior_sigma': 0.0756567535374512, 'normalization': 'none'}. Best is trial 2426 with value: 0.515486741065979.
Generating morgan fingerprints...
Generated fingerprints with 2048 features for 900 molecules
Data shape: X=(900, 2048), y=(900,)
Trial 2453: 5-fold CV loss = 0.6672
[I 2025-08-08 06:05:47,647] Trial 2453 finished with value: 0.6672087669372558 and parameters: {'fp_type': 'morgan', 'morgan_only_radius': 2, 'morgan_only_nBits': 2048, 'num_hidden_layers': 3, 'hidden_dim_0': 512, 'hidden_dim_1': 128, 'hidden_dim_2': 512, 'kl_weight': 0.00018096201712603074, 'lr': 0.0023447903830245823, 'batch_size': 64, 'dropout_rate': 0.3946218261819968, 'prior_mu': 0.1225214483471266, 'prior_sigma': 0.13269141068642082, 'normalization': 'layer'}. Best is trial 2426 with value: 0.515486741065979.
Generating morgan fingerprints...
Generated fingerprints with 2048 features for 900 molecules
Data shape: X=(900, 2048), y=(900,)
Trial 2454: 5-fold CV loss = 0.7359
[I 2025-08-08 06:05:50,918] Trial 2454 finished with value: 0.735948121547699 and parameters: {'fp_type': 'morgan', 'morgan_only_radius': 2, 'morgan_only_nBits': 2048, 'num_hidden_layers': 3, 'hidden_dim_0': 512, 'hidden_dim_1': 128, 'hidden_dim_2': 256, 'kl_weight': 0.00016103125484332104, 'lr': 0.002379349474930954, 'batch_size': 128, 'dropout_rate': 0.4038499651870942, 'prior_mu': 0.0636646891918618, 'prior_sigma': 0.07456018425673817, 'normalization': 'none'}. Best is trial 2426 with value: 0.515486741065979.
Generating morgan fingerprints...
Generated fingerprints with 2048 features for 900 molecules
Data shape: X=(900, 2048), y=(900,)
Trial 2456: 5-fold CV loss = 0.6097
