[I 2025-08-07 21:11:53,116] Trial 939 finished with value: 0.5492732107639313 and parameters: {'fp_type': 'morgan', 'morgan_only_radius': 2, 'morgan_only_nBits': 2048, 'num_hidden_layers': 3, 'hidden_dim_0': 256, 'hidden_dim_1': 128, 'hidden_dim_2': 512, 'kl_weight': 0.004062864680339922, 'lr': 0.0021556977939860018, 'batch_size': 32, 'dropout_rate': 0.48429498197199367, 'prior_mu': -0.11426921823176178, 'prior_sigma': 0.05996894436869631, 'normalization': 'none'}. Best is trial 272 with value: 0.5198344707489013.
Generating morgan fingerprints...
Generated fingerprints with 2048 features for 900 molecules
Data shape: X=(900, 2048), y=(900,)
Trial 942: 5-fold CV loss = 0.5324
[I 2025-08-07 21:12:13,513] Trial 942 finished with value: 0.5324199259281158 and parameters: {'fp_type': 'morgan', 'morgan_only_radius': 2, 'morgan_only_nBits': 2048, 'num_hidden_layers': 3, 'hidden_dim_0': 512, 'hidden_dim_1': 128, 'hidden_dim_2': 512, 'kl_weight': 0.00337626567496047, 'lr': 0.003166764524076146, 'batch_size': 32, 'dropout_rate': 0.48432078357425623, 'prior_mu': -0.03355851258279204, 'prior_sigma': 0.06256460810085314, 'normalization': 'none'}. Best is trial 272 with value: 0.5198344707489013.
Generating morgan fingerprints...
Generated fingerprints with 2048 features for 900 molecules
Data shape: X=(900, 2048), y=(900,)
Trial 944: 5-fold CV loss = 0.8695
[I 2025-08-07 21:12:16,719] Trial 944 finished with value: 0.8695422887802124 and parameters: {'fp_type': 'morgan', 'morgan_only_radius': 2, 'morgan_only_nBits': 2048, 'num_hidden_layers': 3, 'hidden_dim_0': 512, 'hidden_dim_1': 128, 'hidden_dim_2': 512, 'kl_weight': 0.0013592903957886336, 'lr': 0.0013966950499743394, 'batch_size': 32, 'dropout_rate': 0.49994283666115014, 'prior_mu': -0.044722287932832124, 'prior_sigma': 0.06547446812774131, 'normalization': 'none'}. Best is trial 272 with value: 0.5198344707489013.
Generating rdkit fingerprints...
Generated fingerprints with 512 features for 900 molecules
Data shape: X=(900, 512), y=(900,)
Trial 945: 5-fold CV loss = 0.5469
[I 2025-08-07 21:12:42,492] Trial 945 finished with value: 0.546903657913208 and parameters: {'fp_type': 'morgan', 'morgan_only_radius': 2, 'morgan_only_nBits': 2048, 'num_hidden_layers': 3, 'hidden_dim_0': 512, 'hidden_dim_1': 128, 'hidden_dim_2': 512, 'kl_weight': 0.0014304899478170157, 'lr': 0.002371157742705714, 'batch_size': 32, 'dropout_rate': 0.491305675231914, 'prior_mu': 0.0008825429189655877, 'prior_sigma': 0.0654772228483384, 'normalization': 'layer'}. Best is trial 272 with value: 0.5198344707489013.
Generating rdkit fingerprints...
Generated fingerprints with 512 features for 900 molecules
Data shape: X=(900, 512), y=(900,)
Trial 947: 5-fold CV loss = 0.6539
[I 2025-08-07 21:13:01,915] Trial 947 finished with value: 0.6539365291595459 and parameters: {'fp_type': 'rdkit', 'rdkit_only_maxPath': 5, 'rdkit_only_nBits': 512, 'num_hidden_layers': 3, 'hidden_dim_0': 512, 'hidden_dim_1': 64, 'hidden_dim_2': 256, 'kl_weight': 0.0002196347722154926, 'lr': 0.002350812450147876, 'batch_size': 32, 'dropout_rate': 0.4753470276388804, 'prior_mu': 0.0030876854911636494, 'prior_sigma': 0.06725274033439829, 'normalization': 'layer'}. Best is trial 272 with value: 0.5198344707489013.
Generating morgan fingerprints...
Generated fingerprints with 2048 features for 900 molecules
Data shape: X=(900, 2048), y=(900,)
Trial 948: 5-fold CV loss = 0.7059
[I 2025-08-07 21:13:22,360] Trial 948 finished with value: 0.7058898687362671 and parameters: {'fp_type': 'rdkit', 'rdkit_only_maxPath': 5, 'rdkit_only_nBits': 512, 'num_hidden_layers': 3, 'hidden_dim_0': 512, 'hidden_dim_1': 128, 'hidden_dim_2': 256, 'kl_weight': 0.0011038750400724057, 'lr': 0.0019202051390642832, 'batch_size': 32, 'dropout_rate': 0.4374597979529515, 'prior_mu': -0.018260955834786395, 'prior_sigma': 0.09192573195634865, 'normalization': 'none'}. Best is trial 272 with value: 0.5198344707489013.
Generating morgan fingerprints...
Generated fingerprints with 2048 features for 900 molecules
Data shape: X=(900, 2048), y=(900,)
Trial 949: 5-fold CV loss = 0.6610
[I 2025-08-07 21:13:58,231] Trial 949 finished with value: 0.6610468029975891 and parameters: {'fp_type': 'morgan', 'morgan_only_radius': 2, 'morgan_only_nBits': 2048, 'num_hidden_layers': 3, 'hidden_dim_0': 1024, 'hidden_dim_1': 128, 'hidden_dim_2': 128, 'kl_weight': 0.0017913554316756335, 'lr': 0.0018562337535372529, 'batch_size': 32, 'dropout_rate': 0.32885502540676, 'prior_mu': -0.017532003996449025, 'prior_sigma': 0.07612612307722288, 'normalization': 'none'}. Best is trial 272 with value: 0.5198344707489013.
Generating morgan fingerprints...
Generated fingerprints with 1024 features for 900 molecules
Data shape: X=(900, 1024), y=(900,)
Trial 946: 5-fold CV loss = 0.5424
[I 2025-08-07 21:13:59,484] Trial 946 finished with value: 0.5423517048358917 and parameters: {'fp_type': 'morgan', 'morgan_only_radius': 2, 'morgan_only_nBits': 2048, 'num_hidden_layers': 3, 'hidden_dim_0': 512, 'hidden_dim_1': 64, 'hidden_dim_2': 256, 'kl_weight': 0.0013578030552335537, 'lr': 0.0023311138366103093, 'batch_size': 32, 'dropout_rate': 0.49946276433113246, 'prior_mu': 0.00260221132319181, 'prior_sigma': 0.06608618416279745, 'normalization': 'layer'}. Best is trial 272 with value: 0.5198344707489013.
Generating morgan fingerprints...
Generated fingerprints with 1024 features for 900 molecules
Data shape: X=(900, 1024), y=(900,)
Trial 950: 5-fold CV loss = 0.6212
[I 2025-08-07 21:14:28,670] Trial 950 finished with value: 0.6211944878101349 and parameters: {'fp_type': 'morgan', 'morgan_only_radius': 2, 'morgan_only_nBits': 2048, 'num_hidden_layers': 3, 'hidden_dim_0': 512, 'hidden_dim_1': 128, 'hidden_dim_2': 128, 'kl_weight': 0.0018369861903002062, 'lr': 0.0025141935195029928, 'batch_size': 32, 'dropout_rate': 0.16185451655305116, 'prior_mu': -0.007551811939725862, 'prior_sigma': 0.0757697575093233, 'normalization': 'none'}. Best is trial 272 with value: 0.5198344707489013.
Generating morgan fingerprints...
Generated fingerprints with 1024 features for 900 molecules
Data shape: X=(900, 1024), y=(900,)
Trial 951: 5-fold CV loss = 0.5245
[I 2025-08-07 21:15:16,793] Trial 951 finished with value: 0.5245039820671081 and parameters: {'fp_type': 'morgan', 'morgan_only_radius': 2, 'morgan_only_nBits': 1024, 'num_hidden_layers': 3, 'hidden_dim_0': 512, 'hidden_dim_1': 128, 'hidden_dim_2': 512, 'kl_weight': 0.001714930082243516, 'lr': 0.002688093248005912, 'batch_size': 32, 'dropout_rate': 0.46442648015933, 'prior_mu': -0.006379823085496348, 'prior_sigma': 0.05411053840535954, 'normalization': 'none'}. Best is trial 272 with value: 0.5198344707489013.
Generating morgan fingerprints...
Generated fingerprints with 1024 features for 900 molecules
Data shape: X=(900, 1024), y=(900,)
Trial 940: 5-fold CV loss = 0.5379
[I 2025-08-07 21:15:23,706] Trial 940 finished with value: 0.5378932118415832 and parameters: {'fp_type': 'morgan', 'morgan_only_radius': 2, 'morgan_only_nBits': 2048, 'num_hidden_layers': 3, 'hidden_dim_0': 256, 'hidden_dim_1': 128, 'hidden_dim_2': 512, 'kl_weight': 0.0016862050134994618, 'lr': 0.002201863684759135, 'batch_size': 32, 'dropout_rate': 0.4851448538626726, 'prior_mu': -0.006128083012165157, 'prior_sigma': 0.058996136290764965, 'normalization': 'none'}. Best is trial 272 with value: 0.5198344707489013.
Generating morgan fingerprints...
Generated fingerprints with 1024 features for 900 molecules
Data shape: X=(900, 1024), y=(900,)
Trial 953: 5-fold CV loss = 0.5334
[I 2025-08-07 21:15:31,973] Trial 953 finished with value: 0.5333703935146332 and parameters: {'fp_type': 'morgan', 'morgan_only_radius': 2, 'morgan_only_nBits': 1024, 'num_hidden_layers': 3, 'hidden_dim_0': 512, 'hidden_dim_1': 128, 'hidden_dim_2': 512, 'kl_weight': 0.004505991332818947, 'lr': 0.0026486915063504714, 'batch_size': 32, 'dropout_rate': 0.46170647307070206, 'prior_mu': 0.02299198843366803, 'prior_sigma': 0.05190661080266604, 'normalization': 'none'}. Best is trial 272 with value: 0.5198344707489013.
Generating morgan fingerprints...
Generated fingerprints with 1024 features for 900 molecules
Data shape: X=(900, 1024), y=(900,)
Trial 952: 5-fold CV loss = 0.5310
[I 2025-08-07 21:16:01,147] Trial 952 finished with value: 0.5309830904006958 and parameters: {'fp_type': 'morgan', 'morgan_only_radius': 2, 'morgan_only_nBits': 1024, 'num_hidden_layers': 3, 'hidden_dim_0': 512, 'hidden_dim_1': 128, 'hidden_dim_2': 512, 'kl_weight': 0.0016722361245679895, 'lr': 0.002645702769236804, 'batch_size': 32, 'dropout_rate': 0.46631348419830965, 'prior_mu': -0.009005899932593875, 'prior_sigma': 0.05213128367124289, 'normalization': 'none'}. Best is trial 272 with value: 0.5198344707489013.
Generating morgan fingerprints...
Generated fingerprints with 1024 features for 900 molecules
Data shape: X=(900, 1024), y=(900,)
Trial 957: 5-fold CV loss = 0.8443
[I 2025-08-07 21:16:21,856] Trial 957 finished with value: 0.844294798374176 and parameters: {'fp_type': 'morgan', 'morgan_only_radius': 2, 'morgan_only_nBits': 1024, 'num_hidden_layers': 3, 'hidden_dim_0': 512, 'hidden_dim_1': 128, 'hidden_dim_2': 512, 'kl_weight': 0.0020878607423475367, 'lr': 0.002984888106773229, 'batch_size': 128, 'dropout_rate': 0.47805133716916676, 'prior_mu': -0.028213684215368687, 'prior_sigma': 0.06898002472119882, 'normalization': 'none'}. Best is trial 272 with value: 0.5198344707489013.
Generating morgan fingerprints...
Generated fingerprints with 1024 features for 900 molecules
Data shape: X=(900, 1024), y=(900,)
Trial 954: 5-fold CV loss = 0.7599
[I 2025-08-07 21:16:24,054] Trial 954 finished with value: 0.7598724246025086 and parameters: {'fp_type': 'morgan', 'morgan_only_radius': 2, 'morgan_only_nBits': 1024, 'num_hidden_layers': 3, 'hidden_dim_0': 512, 'hidden_dim_1': 512, 'hidden_dim_2': 512, 'kl_weight': 0.002091680072975731, 'lr': 0.0020708205255820884, 'batch_size': 32, 'dropout_rate': 0.49983181497115575, 'prior_mu': -0.028712563735261428, 'prior_sigma': 0.05695591913066439, 'normalization': 'none'}. Best is trial 272 with value: 0.5198344707489013.
Generating morgan fingerprints...
Generated fingerprints with 1024 features for 900 molecules
Data shape: X=(900, 1024), y=(900,)
Trial 956: 5-fold CV loss = 0.5353
[I 2025-08-07 21:16:43,370] Trial 956 finished with value: 0.5352928936481476 and parameters: {'fp_type': 'morgan', 'morgan_only_radius': 2, 'morgan_only_nBits': 1024, 'num_hidden_layers': 3, 'hidden_dim_0': 512, 'hidden_dim_1': 128, 'hidden_dim_2': 512, 'kl_weight': 0.00649543388285233, 'lr': 0.00203927097699067, 'batch_size': 32, 'dropout_rate': 0.47791319294154844, 'prior_mu': -0.028817594879900283, 'prior_sigma': 0.07037990556612912, 'normalization': 'none'}. Best is trial 272 with value: 0.5198344707489013.
Generating morgan fingerprints...
Generated fingerprints with 1024 features for 900 molecules
Data shape: X=(900, 1024), y=(900,)
Trial 959: 5-fold CV loss = 0.6811
[I 2025-08-07 21:17:32,706] Trial 959 finished with value: 0.6811175346374512 and parameters: {'fp_type': 'morgan', 'morgan_only_radius': 2, 'morgan_only_nBits': 1024, 'num_hidden_layers': 3, 'hidden_dim_0': 512, 'hidden_dim_1': 128, 'hidden_dim_2': 512, 'kl_weight': 0.0011760924726794515, 'lr': 0.0019769704185775136, 'batch_size': 32, 'dropout_rate': 0.4781118068078132, 'prior_mu': -0.04059314651250223, 'prior_sigma': 0.1995725864782288, 'normalization': 'none'}. Best is trial 272 with value: 0.5198344707489013.
Generating morgan fingerprints...
Generated fingerprints with 2048 features for 900 molecules
Data shape: X=(900, 2048), y=(900,)
Trial 960: 5-fold CV loss = 0.5571
[I 2025-08-07 21:18:03,870] Trial 960 finished with value: 0.5571394622325897 and parameters: {'fp_type': 'morgan', 'morgan_only_radius': 2, 'morgan_only_nBits': 1024, 'num_hidden_layers': 3, 'hidden_dim_0': 512, 'hidden_dim_1': 128, 'hidden_dim_2': 512, 'kl_weight': 0.001147508032086831, 'lr': 0.0017521249064579975, 'batch_size': 32, 'dropout_rate': 0.4904292795136642, 'prior_mu': 0.012774498861706231, 'prior_sigma': 0.0628376463367676, 'normalization': 'none'}. Best is trial 272 with value: 0.5198344707489013.
Generating morgan fingerprints...
Generated fingerprints with 2048 features for 900 molecules
Data shape: X=(900, 2048), y=(900,)
Trial 958: 5-fold CV loss = 0.6477
[I 2025-08-07 21:18:39,502] Trial 958 finished with value: 0.6476741671562195 and parameters: {'fp_type': 'morgan', 'morgan_only_radius': 2, 'morgan_only_nBits': 1024, 'num_hidden_layers': 3, 'hidden_dim_0': 512, 'hidden_dim_1': 128, 'hidden_dim_2': 512, 'kl_weight': 0.0010973210245453595, 'lr': 0.0017187428948624865, 'batch_size': 32, 'dropout_rate': 0.4905897116915395, 'prior_mu': -0.03945689681718218, 'prior_sigma': 0.06408056927294895, 'normalization': 'none'}. Best is trial 272 with value: 0.5198344707489013.
Generating morgan fingerprints...
Generated fingerprints with 2048 features for 900 molecules
Data shape: X=(900, 2048), y=(900,)
Trial 955: 5-fold CV loss = 0.5383
[I 2025-08-07 21:18:58,420] Trial 955 finished with value: 0.5382696509361267 and parameters: {'fp_type': 'morgan', 'morgan_only_radius': 2, 'morgan_only_nBits': 1024, 'num_hidden_layers': 3, 'hidden_dim_0': 512, 'hidden_dim_1': 128, 'hidden_dim_2': 512, 'kl_weight': 0.006384273661659772, 'lr': 0.002997072157668333, 'batch_size': 32, 'dropout_rate': 0.476675768533876, 'prior_mu': -0.030067568381675996, 'prior_sigma': 0.0685724165017267, 'normalization': 'none'}. Best is trial 272 with value: 0.5198344707489013.
Generating morgan fingerprints...
Generated fingerprints with 2048 features for 900 molecules
Data shape: X=(900, 2048), y=(900,)
Trial 962: 5-fold CV loss = 0.5244
[I 2025-08-07 21:19:12,288] Trial 962 finished with value: 0.5244498014450073 and parameters: {'fp_type': 'morgan', 'morgan_only_radius': 2, 'morgan_only_nBits': 2048, 'num_hidden_layers': 3, 'hidden_dim_0': 512, 'hidden_dim_1': 128, 'hidden_dim_2': 512, 'kl_weight': 0.001396139315696885, 'lr': 0.002385454868231119, 'batch_size': 32, 'dropout_rate': 0.49981653043388274, 'prior_mu': -0.0200808221212975, 'prior_sigma': 0.06378679573993415, 'normalization': 'none'}. Best is trial 272 with value: 0.5198344707489013.
Generating morgan fingerprints...
Generated fingerprints with 2048 features for 900 molecules
Data shape: X=(900, 2048), y=(900,)
Trial 961: 5-fold CV loss = 0.5340
[I 2025-08-07 21:19:22,486] Trial 961 finished with value: 0.5339615523815155 and parameters: {'fp_type': 'morgan', 'morgan_only_radius': 2, 'morgan_only_nBits': 2048, 'num_hidden_layers': 3, 'hidden_dim_0': 512, 'hidden_dim_1': 128, 'hidden_dim_2': 512, 'kl_weight': 0.0014988746865967973, 'lr': 0.0017337760460846706, 'batch_size': 32, 'dropout_rate': 0.49122761640655477, 'prior_mu': 0.011188982982778775, 'prior_sigma': 0.0643291330721641, 'normalization': 'none'}. Best is trial 272 with value: 0.5198344707489013.
Generating morgan fingerprints...
Generated fingerprints with 2048 features for 900 molecules
Data shape: X=(900, 2048), y=(900,)
Trial 965: 5-fold CV loss = 0.9902
[I 2025-08-07 21:19:27,211] Trial 965 finished with value: 0.9902323126792908 and parameters: {'fp_type': 'morgan', 'morgan_only_radius': 2, 'morgan_only_nBits': 2048, 'num_hidden_layers': 3, 'hidden_dim_0': 512, 'hidden_dim_1': 128, 'hidden_dim_2': 512, 'kl_weight': 0.0014974984456467312, 'lr': 0.0012025265659750713, 'batch_size': 64, 'dropout_rate': 0.4992047534540706, 'prior_mu': -0.023212737036203523, 'prior_sigma': 0.058149487002631464, 'normalization': 'none'}. Best is trial 272 with value: 0.5198344707489013.
Generating morgan fingerprints...
Generated fingerprints with 2048 features for 900 molecules
Data shape: X=(900, 2048), y=(900,)
Trial 967: 5-fold CV loss = 0.5266
[I 2025-08-07 21:20:33,364] Trial 967 finished with value: 0.5266328930854798 and parameters: {'fp_type': 'morgan', 'morgan_only_radius': 2, 'morgan_only_nBits': 2048, 'num_hidden_layers': 3, 'hidden_dim_0': 512, 'hidden_dim_1': 128, 'hidden_dim_2': 512, 'kl_weight': 0.0013532492040046762, 'lr': 0.0024692399294610223, 'batch_size': 32, 'dropout_rate': 0.4919135135337066, 'prior_mu': -0.020295646546352186, 'prior_sigma': 0.062321815827053144, 'normalization': 'none'}. Best is trial 272 with value: 0.5198344707489013.
Generating morgan fingerprints...
Generated fingerprints with 2048 features for 900 molecules
Data shape: X=(900, 2048), y=(900,)
Trial 963: 5-fold CV loss = 0.5363
[I 2025-08-07 21:20:39,810] Trial 963 finished with value: 0.5363192617893219 and parameters: {'fp_type': 'morgan', 'morgan_only_radius': 2, 'morgan_only_nBits': 2048, 'num_hidden_layers': 3, 'hidden_dim_0': 512, 'hidden_dim_1': 128, 'hidden_dim_2': 512, 'kl_weight': 0.001452650150395369, 'lr': 0.0023727965313814475, 'batch_size': 32, 'dropout_rate': 0.49999592074713783, 'prior_mu': -0.01981429935899182, 'prior_sigma': 0.07449070163263306, 'normalization': 'none'}. Best is trial 272 with value: 0.5198344707489013.
Generating morgan fingerprints...
Generated fingerprints with 2048 features for 900 molecules
Data shape: X=(900, 2048), y=(900,)
Trial 966: 5-fold CV loss = 0.5323
[I 2025-08-07 21:20:46,068] Trial 966 finished with value: 0.5323241174221038 and parameters: {'fp_type': 'morgan', 'morgan_only_radius': 2, 'morgan_only_nBits': 2048, 'num_hidden_layers': 3, 'hidden_dim_0': 512, 'hidden_dim_1': 128, 'hidden_dim_2': 512, 'kl_weight': 0.0013367538621914432, 'lr': 0.002464006633816793, 'batch_size': 32, 'dropout_rate': 0.49252664313192596, 'prior_mu': -0.02257613024932012, 'prior_sigma': 0.05982292439758044, 'normalization': 'none'}. Best is trial 272 with value: 0.5198344707489013.
Generating morgan fingerprints...
Generated fingerprints with 2048 features for 900 molecules
Data shape: X=(900, 2048), y=(900,)
Trial 968: 5-fold CV loss = 0.5305
[I 2025-08-07 21:21:36,918] Trial 968 finished with value: 0.5305393695831299 and parameters: {'fp_type': 'morgan', 'morgan_only_radius': 2, 'morgan_only_nBits': 2048, 'num_hidden_layers': 3, 'hidden_dim_0': 512, 'hidden_dim_1': 128, 'hidden_dim_2': 512, 'kl_weight': 0.001291502708624962, 'lr': 0.002752026679236065, 'batch_size': 32, 'dropout_rate': 0.49994673521135347, 'prior_mu': -0.03594198758855823, 'prior_sigma': 0.0591040268455333, 'normalization': 'none'}. Best is trial 272 with value: 0.5198344707489013.
Generating morgan fingerprints...
Generated fingerprints with 2048 features for 900 molecules
Data shape: X=(900, 2048), y=(900,)
Trial 970: 5-fold CV loss = 0.5298
[I 2025-08-07 21:21:56,611] Trial 970 finished with value: 0.5298027098178864 and parameters: {'fp_type': 'morgan', 'morgan_only_radius': 2, 'morgan_only_nBits': 2048, 'num_hidden_layers': 3, 'hidden_dim_0': 512, 'hidden_dim_1': 128, 'hidden_dim_2': 512, 'kl_weight': 0.0013282063020725065, 'lr': 0.002804564984898128, 'batch_size': 32, 'dropout_rate': 0.4999596682995131, 'prior_mu': -0.04376642957795045, 'prior_sigma': 0.0555902230277533, 'normalization': 'none'}. Best is trial 272 with value: 0.5198344707489013.
Generating morgan fingerprints...
Generated fingerprints with 2048 features for 900 molecules
Data shape: X=(900, 2048), y=(900,)
Trial 969: 5-fold CV loss = 0.5352
[I 2025-08-07 21:22:27,896] Trial 969 finished with value: 0.5351684331893921 and parameters: {'fp_type': 'morgan', 'morgan_only_radius': 2, 'morgan_only_nBits': 2048, 'num_hidden_layers': 3, 'hidden_dim_0': 512, 'hidden_dim_1': 128, 'hidden_dim_2': 512, 'kl_weight': 0.0012848258745469944, 'lr': 0.0029012123972634073, 'batch_size': 32, 'dropout_rate': 0.4877412546260159, 'prior_mu': -0.04530333320953721, 'prior_sigma': 0.05914302172287987, 'normalization': 'none'}. Best is trial 272 with value: 0.5198344707489013.
Generating morgan_rdkit fingerprints...
Generated fingerprints with 768 features for 900 molecules
Data shape: X=(900, 768), y=(900,)
Trial 971: 5-fold CV loss = 0.5319
[I 2025-08-07 21:22:37,623] Trial 971 finished with value: 0.531928414106369 and parameters: {'fp_type': 'morgan', 'morgan_only_radius': 2, 'morgan_only_nBits': 2048, 'num_hidden_layers': 3, 'hidden_dim_0': 512, 'hidden_dim_1': 128, 'hidden_dim_2': 512, 'kl_weight': 0.0012279193376479177, 'lr': 0.002905007250313009, 'batch_size': 32, 'dropout_rate': 0.4859638749934666, 'prior_mu': -0.046868506327339174, 'prior_sigma': 0.054587280588537915, 'normalization': 'none'}. Best is trial 272 with value: 0.5198344707489013.
Generating morgan_rdkit fingerprints...
Generated fingerprints with 768 features for 900 molecules
Data shape: X=(900, 768), y=(900,)
Trial 964: 5-fold CV loss = 0.6484
[I 2025-08-07 21:22:46,758] Trial 964 finished with value: 0.6483869552612305 and parameters: {'fp_type': 'morgan', 'morgan_only_radius': 2, 'morgan_only_nBits': 2048, 'num_hidden_layers': 3, 'hidden_dim_0': 512, 'hidden_dim_1': 128, 'hidden_dim_2': 512, 'kl_weight': 0.001502057181904437, 'lr': 0.0022840703225748007, 'batch_size': 32, 'dropout_rate': 0.4856726739256601, 'prior_mu': -0.01952416314985965, 'prior_sigma': 0.18628817899258587, 'normalization': 'none'}. Best is trial 272 with value: 0.5198344707489013.
Generating morgan fingerprints...
Generated fingerprints with 2048 features for 900 molecules
Data shape: X=(900, 2048), y=(900,)
Trial 972: 5-fold CV loss = 0.5313
[I 2025-08-07 21:23:29,435] Trial 972 finished with value: 0.531267774105072 and parameters: {'fp_type': 'morgan', 'morgan_only_radius': 2, 'morgan_only_nBits': 2048, 'num_hidden_layers': 3, 'hidden_dim_0': 512, 'hidden_dim_1': 128, 'hidden_dim_2': 512, 'kl_weight': 0.0010535235817769847, 'lr': 0.0024198386787229204, 'batch_size': 32, 'dropout_rate': 0.485610561453013, 'prior_mu': -0.03300026937787863, 'prior_sigma': 0.06423772915653603, 'normalization': 'none'}. Best is trial 272 with value: 0.5198344707489013.
Generating morgan fingerprints...
Generated fingerprints with 2048 features for 900 molecules
Data shape: X=(900, 2048), y=(900,)
Trial 974: 5-fold CV loss = 0.5751
