[I 2025-08-08 02:32:26,978] Trial 1825 finished with value: 0.5686548233032227 and parameters: {'fp_type': 'morgan', 'morgan_only_radius': 2, 'morgan_only_nBits': 2048, 'num_hidden_layers': 3, 'hidden_dim_0': 512, 'hidden_dim_1': 128, 'hidden_dim_2': 512, 'kl_weight': 0.0010443498459162843, 'lr': 0.002360435576786504, 'batch_size': 32, 'dropout_rate': 0.3847939233509902, 'prior_mu': 0.04527925231590847, 'prior_sigma': 0.02800348848199609, 'normalization': 'none'}. Best is trial 1528 with value: 0.5170644640922546.
Generating morgan fingerprints...
Generated fingerprints with 2048 features for 900 molecules
Data shape: X=(900, 2048), y=(900,)
Trial 1824: 5-fold CV loss = 0.6335
[I 2025-08-08 02:32:30,735] Trial 1824 finished with value: 0.6334908127784729 and parameters: {'fp_type': 'rdkit', 'rdkit_only_maxPath': 6, 'rdkit_only_nBits': 512, 'num_hidden_layers': 3, 'hidden_dim_0': 512, 'hidden_dim_1': 128, 'hidden_dim_2': 512, 'kl_weight': 0.0007783144395921041, 'lr': 0.0017449899246306077, 'batch_size': 32, 'dropout_rate': 0.40439903348673284, 'prior_mu': 0.03232587005641068, 'prior_sigma': 0.07259671874497152, 'normalization': 'none'}. Best is trial 1528 with value: 0.5170644640922546.
Generating morgan fingerprints...
Generated fingerprints with 2048 features for 900 molecules
Data shape: X=(900, 2048), y=(900,)
Trial 1827: 5-fold CV loss = 0.5244
[I 2025-08-08 02:33:10,820] Trial 1827 finished with value: 0.5244069576263428 and parameters: {'fp_type': 'morgan', 'morgan_only_radius': 2, 'morgan_only_nBits': 2048, 'num_hidden_layers': 3, 'hidden_dim_0': 512, 'hidden_dim_1': 128, 'hidden_dim_2': 512, 'kl_weight': 0.0007179273885165973, 'lr': 0.0024312674612299197, 'batch_size': 32, 'dropout_rate': 0.4004737952810928, 'prior_mu': 0.04281568078792002, 'prior_sigma': 0.07286644363001182, 'normalization': 'none'}. Best is trial 1528 with value: 0.5170644640922546.
Generating morgan fingerprints...
Generated fingerprints with 2048 features for 900 molecules
Data shape: X=(900, 2048), y=(900,)
Trial 1829: 5-fold CV loss = 0.5660
[I 2025-08-08 02:34:08,874] Trial 1829 finished with value: 0.566038453578949 and parameters: {'fp_type': 'morgan', 'morgan_only_radius': 2, 'morgan_only_nBits': 2048, 'num_hidden_layers': 3, 'hidden_dim_0': 256, 'hidden_dim_1': 128, 'hidden_dim_2': 512, 'kl_weight': 0.0005397939629273922, 'lr': 0.0015263353838739404, 'batch_size': 32, 'dropout_rate': 0.28458403511171226, 'prior_mu': 0.03852889031850741, 'prior_sigma': 0.06663055922118856, 'normalization': 'none'}. Best is trial 1528 with value: 0.5170644640922546.
Generating morgan fingerprints...
Generated fingerprints with 2048 features for 900 molecules
Data shape: X=(900, 2048), y=(900,)
Trial 1828: 5-fold CV loss = 0.5272
[I 2025-08-08 02:34:17,265] Trial 1828 finished with value: 0.5272080838680268 and parameters: {'fp_type': 'morgan', 'morgan_only_radius': 2, 'morgan_only_nBits': 2048, 'num_hidden_layers': 3, 'hidden_dim_0': 512, 'hidden_dim_1': 128, 'hidden_dim_2': 512, 'kl_weight': 0.0007533244213271536, 'lr': 0.0016076703496098695, 'batch_size': 32, 'dropout_rate': 0.40376866449634846, 'prior_mu': 0.03489814461361053, 'prior_sigma': 0.0724087606681938, 'normalization': 'none'}. Best is trial 1528 with value: 0.5170644640922546.
Generating morgan fingerprints...
Generated fingerprints with 2048 features for 900 molecules
Data shape: X=(900, 2048), y=(900,)
Trial 1826: 5-fold CV loss = 0.5550
[I 2025-08-08 02:34:46,472] Trial 1826 finished with value: 0.5550208628177643 and parameters: {'fp_type': 'morgan', 'morgan_only_radius': 2, 'morgan_only_nBits': 2048, 'num_hidden_layers': 3, 'hidden_dim_0': 512, 'hidden_dim_1': 128, 'hidden_dim_2': 512, 'kl_weight': 0.001072253966198742, 'lr': 0.00239504533984429, 'batch_size': 32, 'dropout_rate': 0.1840733906730526, 'prior_mu': 0.0458295905018714, 'prior_sigma': 0.07285138873912331, 'normalization': 'none'}. Best is trial 1528 with value: 0.5170644640922546.
Generating morgan fingerprints...
Generated fingerprints with 2048 features for 900 molecules
Data shape: X=(900, 2048), y=(900,)
Trial 1830: 5-fold CV loss = 0.5262
[I 2025-08-08 02:35:06,331] Trial 1830 finished with value: 0.5261875808238983 and parameters: {'fp_type': 'morgan', 'morgan_only_radius': 2, 'morgan_only_nBits': 2048, 'num_hidden_layers': 3, 'hidden_dim_0': 512, 'hidden_dim_1': 128, 'hidden_dim_2': 512, 'kl_weight': 0.0005810513235511101, 'lr': 0.0019122846927742238, 'batch_size': 32, 'dropout_rate': 0.35341583441950125, 'prior_mu': 0.020063030857120488, 'prior_sigma': 0.06727290238603405, 'normalization': 'none'}. Best is trial 1528 with value: 0.5170644640922546.
Generating morgan fingerprints...
Generated fingerprints with 2048 features for 900 molecules
Data shape: X=(900, 2048), y=(900,)
Trial 1832: 5-fold CV loss = 0.5808
[I 2025-08-08 02:35:21,054] Trial 1832 finished with value: 0.5808470726013184 and parameters: {'fp_type': 'morgan', 'morgan_only_radius': 2, 'morgan_only_nBits': 2048, 'num_hidden_layers': 3, 'hidden_dim_0': 512, 'hidden_dim_1': 128, 'hidden_dim_2': 1024, 'kl_weight': 0.0008897109987888631, 'lr': 0.001872613386804313, 'batch_size': 32, 'dropout_rate': 0.4180704220669846, 'prior_mu': 0.15684825287391907, 'prior_sigma': 0.0787555510758211, 'normalization': 'none'}. Best is trial 1528 with value: 0.5170644640922546.
Generating morgan fingerprints...
Generated fingerprints with 2048 features for 900 molecules
Data shape: X=(900, 2048), y=(900,)
Trial 1834: 5-fold CV loss = 0.5304
[I 2025-08-08 02:35:58,398] Trial 1834 finished with value: 0.5304247319698334 and parameters: {'fp_type': 'morgan', 'morgan_only_radius': 2, 'morgan_only_nBits': 2048, 'num_hidden_layers': 3, 'hidden_dim_0': 512, 'hidden_dim_1': 128, 'hidden_dim_2': 1024, 'kl_weight': 0.000847027856181565, 'lr': 0.0030447066006653685, 'batch_size': 32, 'dropout_rate': 0.41905420744263905, 'prior_mu': 0.027508649291178074, 'prior_sigma': 0.06533204239541297, 'normalization': 'none'}. Best is trial 1528 with value: 0.5170644640922546.
Generating morgan fingerprints...
Generated fingerprints with 2048 features for 900 molecules
Data shape: X=(900, 2048), y=(900,)
Trial 1831: 5-fold CV loss = 0.5285
[I 2025-08-08 02:36:03,607] Trial 1831 finished with value: 0.5285189807415008 and parameters: {'fp_type': 'morgan', 'morgan_only_radius': 2, 'morgan_only_nBits': 2048, 'num_hidden_layers': 3, 'hidden_dim_0': 512, 'hidden_dim_1': 128, 'hidden_dim_2': 1024, 'kl_weight': 0.0009000181781874264, 'lr': 0.0019552075449279335, 'batch_size': 32, 'dropout_rate': 0.4151071212180722, 'prior_mu': 0.014124464203781155, 'prior_sigma': 0.06773951889528741, 'normalization': 'none'}. Best is trial 1528 with value: 0.5170644640922546.
Generating morgan fingerprints...
Generated fingerprints with 2048 features for 900 molecules
Data shape: X=(900, 2048), y=(900,)
Trial 1835: 5-fold CV loss = 0.5272
[I 2025-08-08 02:36:25,079] Trial 1835 finished with value: 0.5271992444992065 and parameters: {'fp_type': 'morgan', 'morgan_only_radius': 2, 'morgan_only_nBits': 2048, 'num_hidden_layers': 3, 'hidden_dim_0': 512, 'hidden_dim_1': 128, 'hidden_dim_2': 512, 'kl_weight': 0.0006598656312848998, 'lr': 0.002912962854718152, 'batch_size': 32, 'dropout_rate': 0.4206456358247767, 'prior_mu': 0.013342207476926646, 'prior_sigma': 0.06500393974608307, 'normalization': 'none'}. Best is trial 1528 with value: 0.5170644640922546.
Generating morgan fingerprints...
Generated fingerprints with 2048 features for 900 molecules
Data shape: X=(900, 2048), y=(900,)
Trial 1836: 5-fold CV loss = 0.6477
[I 2025-08-08 02:36:50,495] Trial 1836 finished with value: 0.647718471288681 and parameters: {'fp_type': 'morgan', 'morgan_only_radius': 2, 'morgan_only_nBits': 2048, 'num_hidden_layers': 3, 'hidden_dim_0': 512, 'hidden_dim_1': 128, 'hidden_dim_2': 64, 'kl_weight': 0.0006785570811174401, 'lr': 0.0019964061682377168, 'batch_size': 32, 'dropout_rate': 0.4317020413515288, 'prior_mu': 0.0142130224645465, 'prior_sigma': 0.06883280832887056, 'normalization': 'none'}. Best is trial 1528 with value: 0.5170644640922546.
Generating morgan fingerprints...
Generated fingerprints with 2048 features for 900 molecules
Data shape: X=(900, 2048), y=(900,)
Trial 1837: 5-fold CV loss = 0.5976
[I 2025-08-08 02:37:35,807] Trial 1837 finished with value: 0.5976271867752075 and parameters: {'fp_type': 'morgan', 'morgan_only_radius': 2, 'morgan_only_nBits': 2048, 'num_hidden_layers': 3, 'hidden_dim_0': 512, 'hidden_dim_1': 128, 'hidden_dim_2': 64, 'kl_weight': 0.0006649685084278251, 'lr': 0.0020290315322256747, 'batch_size': 32, 'dropout_rate': 0.4417177192135822, 'prior_mu': 0.04713880814481876, 'prior_sigma': 0.06135068383699503, 'normalization': 'none'}. Best is trial 1528 with value: 0.5170644640922546.
Generating morgan fingerprints...
Generated fingerprints with 2048 features for 900 molecules
Data shape: X=(900, 2048), y=(900,)
Trial 1838: 5-fold CV loss = 0.5501
[I 2025-08-08 02:37:38,580] Trial 1838 finished with value: 0.5501117408275604 and parameters: {'fp_type': 'morgan', 'morgan_only_radius': 2, 'morgan_only_nBits': 2048, 'num_hidden_layers': 3, 'hidden_dim_0': 512, 'hidden_dim_1': 128, 'hidden_dim_2': 64, 'kl_weight': 0.0005322022784541547, 'lr': 0.0020562361186521045, 'batch_size': 32, 'dropout_rate': 0.44416556484086545, 'prior_mu': 0.04921992189329873, 'prior_sigma': 0.0611003357178488, 'normalization': 'none'}. Best is trial 1528 with value: 0.5170644640922546.
Generating morgan fingerprints...
Generated fingerprints with 2048 features for 900 molecules
Data shape: X=(900, 2048), y=(900,)
Trial 1841: 5-fold CV loss = 0.9824
[I 2025-08-08 02:37:48,401] Trial 1841 finished with value: 0.9823876738548278 and parameters: {'fp_type': 'morgan', 'morgan_only_radius': 2, 'morgan_only_nBits': 2048, 'num_hidden_layers': 3, 'hidden_dim_0': 1024, 'hidden_dim_1': 128, 'hidden_dim_2': 512, 'kl_weight': 0.0008095117546419804, 'lr': 0.0017301205160376802, 'batch_size': 128, 'dropout_rate': 0.43173434120112525, 'prior_mu': 0.03694951688004407, 'prior_sigma': 0.06923807693022638, 'normalization': 'none'}. Best is trial 1528 with value: 0.5170644640922546.
Generating morgan fingerprints...
Generated fingerprints with 2048 features for 900 molecules
Data shape: X=(900, 2048), y=(900,)
Trial 1840: 5-fold CV loss = 0.6967
[I 2025-08-08 02:37:49,539] Trial 1840 finished with value: 0.6966993331909179 and parameters: {'fp_type': 'morgan', 'morgan_only_radius': 2, 'morgan_only_nBits': 2048, 'num_hidden_layers': 3, 'hidden_dim_0': 512, 'hidden_dim_1': 256, 'hidden_dim_2': 512, 'kl_weight': 0.0007999937202784046, 'lr': 0.0016855819774647094, 'batch_size': 128, 'dropout_rate': 0.443144471321026, 'prior_mu': 0.03718700545893132, 'prior_sigma': 0.06093535578388737, 'normalization': 'none'}. Best is trial 1528 with value: 0.5170644640922546.
Generating morgan fingerprints...
Generated fingerprints with 2048 features for 900 molecules
Data shape: X=(900, 2048), y=(900,)
Trial 1839: 5-fold CV loss = 0.6293
[I 2025-08-08 02:38:08,127] Trial 1839 finished with value: 0.6292895436286926 and parameters: {'fp_type': 'morgan', 'morgan_only_radius': 2, 'morgan_only_nBits': 2048, 'num_hidden_layers': 3, 'hidden_dim_0': 512, 'hidden_dim_1': 256, 'hidden_dim_2': 512, 'kl_weight': 0.0005545127953245545, 'lr': 0.0017380981451769607, 'batch_size': 32, 'dropout_rate': 0.4436246034632366, 'prior_mu': 0.049214540474878096, 'prior_sigma': 0.06069411780938105, 'normalization': 'none'}. Best is trial 1528 with value: 0.5170644640922546.
Generating morgan fingerprints...
Generated fingerprints with 2048 features for 900 molecules
Data shape: X=(900, 2048), y=(900,)
Trial 1833: 5-fold CV loss = 0.5228
[I 2025-08-08 02:38:46,158] Trial 1833 finished with value: 0.5228296101093293 and parameters: {'fp_type': 'morgan', 'morgan_only_radius': 2, 'morgan_only_nBits': 2048, 'num_hidden_layers': 3, 'hidden_dim_0': 512, 'hidden_dim_1': 128, 'hidden_dim_2': 1024, 'kl_weight': 0.000537115810171314, 'lr': 0.0019045592726415156, 'batch_size': 32, 'dropout_rate': 0.41431544799438247, 'prior_mu': 0.015573530475930387, 'prior_sigma': 0.06744935823699649, 'normalization': 'none'}. Best is trial 1528 with value: 0.5170644640922546.
Generating morgan fingerprints...
Generated fingerprints with 2048 features for 900 molecules
Data shape: X=(900, 2048), y=(900,)
Trial 1843: 5-fold CV loss = 0.8799
[I 2025-08-08 02:39:00,898] Trial 1843 finished with value: 0.8799446940422058 and parameters: {'fp_type': 'morgan', 'morgan_only_radius': 2, 'morgan_only_nBits': 2048, 'num_hidden_layers': 3, 'hidden_dim_0': 512, 'hidden_dim_1': 1024, 'hidden_dim_2': 512, 'kl_weight': 0.0005210857598540611, 'lr': 0.0023284072296987524, 'batch_size': 32, 'dropout_rate': 0.4339366592306431, 'prior_mu': 0.022463670744794176, 'prior_sigma': 0.06538040918853773, 'normalization': 'none'}. Best is trial 1528 with value: 0.5170644640922546.
Generating morgan fingerprints...
Generated fingerprints with 2048 features for 900 molecules
Data shape: X=(900, 2048), y=(900,)
Trial 1844: 5-fold CV loss = 0.7090
[I 2025-08-08 02:39:04,809] Trial 1844 finished with value: 0.7090288996696472 and parameters: {'fp_type': 'morgan', 'morgan_only_radius': 2, 'morgan_only_nBits': 2048, 'num_hidden_layers': 3, 'hidden_dim_0': 512, 'hidden_dim_1': 1024, 'hidden_dim_2': 512, 'kl_weight': 0.0009324561349386134, 'lr': 0.0027188453918472375, 'batch_size': 32, 'dropout_rate': 0.4275065494455314, 'prior_mu': 0.0261070786773067, 'prior_sigma': 0.06521424818699534, 'normalization': 'none'}. Best is trial 1528 with value: 0.5170644640922546.
Generating morgan fingerprints...
Generated fingerprints with 2048 features for 900 molecules
Data shape: X=(900, 2048), y=(900,)
Trial 1842: 5-fold CV loss = 0.5288
[I 2025-08-08 02:39:15,546] Trial 1842 finished with value: 0.5288495600223542 and parameters: {'fp_type': 'morgan', 'morgan_only_radius': 2, 'morgan_only_nBits': 2048, 'num_hidden_layers': 3, 'hidden_dim_0': 512, 'hidden_dim_1': 256, 'hidden_dim_2': 512, 'kl_weight': 0.0005300781075887339, 'lr': 0.002301898283856187, 'batch_size': 32, 'dropout_rate': 0.3883358247161433, 'prior_mu': 0.026743318826553706, 'prior_sigma': 0.06406671810051974, 'normalization': 'none'}. Best is trial 1528 with value: 0.5170644640922546.
Generating morgan fingerprints...
Generated fingerprints with 2048 features for 900 molecules
Data shape: X=(900, 2048), y=(900,)
Trial 1848: 5-fold CV loss = 0.6943
[I 2025-08-08 02:39:48,864] Trial 1848 finished with value: 0.6943399250507355 and parameters: {'fp_type': 'morgan', 'morgan_only_radius': 2, 'morgan_only_nBits': 2048, 'num_hidden_layers': 3, 'hidden_dim_0': 512, 'hidden_dim_1': 128, 'hidden_dim_2': 256, 'kl_weight': 0.0006989373043085785, 'lr': 0.0024964789950474276, 'batch_size': 64, 'dropout_rate': 0.3400357497884236, 'prior_mu': 0.03879111901513753, 'prior_sigma': 0.07932229170475769, 'normalization': 'none'}. Best is trial 1528 with value: 0.5170644640922546.
Generating morgan fingerprints...
Generated fingerprints with 2048 features for 900 molecules
Data shape: X=(900, 2048), y=(900,)
Trial 1847: 5-fold CV loss = 0.6842
[I 2025-08-08 02:39:49,597] Trial 1847 finished with value: 0.6841562271118165 and parameters: {'fp_type': 'morgan', 'morgan_only_radius': 2, 'morgan_only_nBits': 2048, 'num_hidden_layers': 3, 'hidden_dim_0': 512, 'hidden_dim_1': 128, 'hidden_dim_2': 512, 'kl_weight': 0.0007426437600937832, 'lr': 0.002229803334919228, 'batch_size': 64, 'dropout_rate': 0.3915296712586782, 'prior_mu': 0.030029315281982327, 'prior_sigma': 0.0781478842542449, 'normalization': 'none'}. Best is trial 1528 with value: 0.5170644640922546.
Generating morgan_rdkit fingerprints...
Generated fingerprints with 1024 features for 900 molecules
Data shape: X=(900, 1024), y=(900,)
Trial 1845: 5-fold CV loss = 0.9090
[I 2025-08-08 02:39:57,022] Trial 1845 finished with value: 0.9090138673782349 and parameters: {'fp_type': 'morgan', 'morgan_only_radius': 2, 'morgan_only_nBits': 2048, 'num_hidden_layers': 3, 'hidden_dim_0': 512, 'hidden_dim_1': 1024, 'hidden_dim_2': 512, 'kl_weight': 0.0007231672222724829, 'lr': 0.0023788605713990834, 'batch_size': 32, 'dropout_rate': 0.4257060992548431, 'prior_mu': 0.030167165014920373, 'prior_sigma': 0.06430143080265988, 'normalization': 'none'}. Best is trial 1528 with value: 0.5170644640922546.
Generating morgan_rdkit fingerprints...
Generated fingerprints with 1024 features for 900 molecules
Data shape: X=(900, 1024), y=(900,)
Trial 1846: 5-fold CV loss = 0.6444
[I 2025-08-08 02:40:08,631] Trial 1846 finished with value: 0.6444255292415619 and parameters: {'fp_type': 'morgan', 'morgan_only_radius': 2, 'morgan_only_nBits': 2048, 'num_hidden_layers': 3, 'hidden_dim_0': 128, 'hidden_dim_1': 128, 'hidden_dim_2': 512, 'kl_weight': 0.0007313381110049426, 'lr': 0.0026927579909280437, 'batch_size': 64, 'dropout_rate': 0.4281564852884032, 'prior_mu': 0.028988231642015683, 'prior_sigma': 0.07735187464234532, 'normalization': 'none'}. Best is trial 1528 with value: 0.5170644640922546.
Generating morgan fingerprints...
Generated fingerprints with 2048 features for 900 molecules
Data shape: X=(900, 2048), y=(900,)
Trial 1850: 5-fold CV loss = 0.6250
[I 2025-08-08 02:40:37,720] Trial 1850 finished with value: 0.6250177979469299 and parameters: {'fp_type': 'morgan_rdkit', 'combined_morgan_radius': 2, 'combined_morgan_nBits': 512, 'combined_rdkit_maxPath': 7, 'combined_rdkit_nBits': 512, 'num_hidden_layers': 3, 'hidden_dim_0': 512, 'hidden_dim_1': 128, 'hidden_dim_2': 512, 'kl_weight': 0.0006216399333551703, 'lr': 0.0020597307200488097, 'batch_size': 32, 'dropout_rate': 0.42433439230052744, 'prior_mu': 0.041440353232446325, 'prior_sigma': 0.07167544044948634, 'normalization': 'none'}. Best is trial 1528 with value: 0.5170644640922546.
Generating morgan fingerprints...
Generated fingerprints with 2048 features for 900 molecules
Data shape: X=(900, 2048), y=(900,)
Trial 1852: 5-fold CV loss = 0.7506
[I 2025-08-08 02:40:42,483] Trial 1852 finished with value: 0.7506378054618835 and parameters: {'fp_type': 'morgan', 'morgan_only_radius': 2, 'morgan_only_nBits': 2048, 'num_hidden_layers': 1, 'hidden_dim_0': 512, 'kl_weight': 0.0009124492076300096, 'lr': 0.0015310345604167997, 'batch_size': 32, 'dropout_rate': 0.40966386073580424, 'prior_mu': 0.03967396621373626, 'prior_sigma': 0.07012684708474111, 'normalization': 'none'}. Best is trial 1528 with value: 0.5170644640922546.
Generating morgan fingerprints...
Generated fingerprints with 2048 features for 900 molecules
Data shape: X=(900, 2048), y=(900,)
Trial 1849: 5-fold CV loss = 0.5207
[I 2025-08-08 02:41:04,219] Trial 1849 finished with value: 0.5207209646701813 and parameters: {'fp_type': 'morgan', 'morgan_only_radius': 2, 'morgan_only_nBits': 2048, 'num_hidden_layers': 3, 'hidden_dim_0': 512, 'hidden_dim_1': 128, 'hidden_dim_2': 512, 'kl_weight': 0.0007583780278237124, 'lr': 0.00221201999864812, 'batch_size': 32, 'dropout_rate': 0.4262993179432453, 'prior_mu': 0.029600004018752284, 'prior_sigma': 0.07003852191270135, 'normalization': 'none'}. Best is trial 1528 with value: 0.5170644640922546.
Generating morgan fingerprints...
Generated fingerprints with 2048 features for 900 molecules
Data shape: X=(900, 2048), y=(900,)
Trial 1853: 5-fold CV loss = 0.5563
[I 2025-08-08 02:41:50,424] Trial 1853 finished with value: 0.5563106000423431 and parameters: {'fp_type': 'morgan', 'morgan_only_radius': 2, 'morgan_only_nBits': 2048, 'num_hidden_layers': 3, 'hidden_dim_0': 512, 'hidden_dim_1': 128, 'hidden_dim_2': 512, 'kl_weight': 0.0010617254181063127, 'lr': 0.0014648205078608993, 'batch_size': 32, 'dropout_rate': 0.4424657053348115, 'prior_mu': 0.04841036566369343, 'prior_sigma': 0.06981068535944672, 'normalization': 'layer'}. Best is trial 1528 with value: 0.5170644640922546.
Generating morgan fingerprints...
Generated fingerprints with 2048 features for 900 molecules
Data shape: X=(900, 2048), y=(900,)
Trial 1854: 5-fold CV loss = 0.5392
[I 2025-08-08 02:42:23,137] Trial 1854 finished with value: 0.5391722023487091 and parameters: {'fp_type': 'morgan', 'morgan_only_radius': 2, 'morgan_only_nBits': 2048, 'num_hidden_layers': 3, 'hidden_dim_0': 256, 'hidden_dim_1': 512, 'hidden_dim_2': 512, 'kl_weight': 0.0010494941336319109, 'lr': 0.0018779455304640958, 'batch_size': 32, 'dropout_rate': 0.4373794837930629, 'prior_mu': 0.04744467717413965, 'prior_sigma': 0.069479215071751, 'normalization': 'layer'}. Best is trial 1528 with value: 0.5170644640922546.
Generating morgan fingerprints...
Generated fingerprints with 2048 features for 900 molecules
Data shape: X=(900, 2048), y=(900,)
Trial 1855: 5-fold CV loss = 0.6303
[I 2025-08-08 02:42:26,292] Trial 1855 finished with value: 0.6303033590316772 and parameters: {'fp_type': 'morgan', 'morgan_only_radius': 2, 'morgan_only_nBits': 2048, 'num_hidden_layers': 3, 'hidden_dim_0': 512, 'hidden_dim_1': 128, 'hidden_dim_2': 512, 'kl_weight': 0.0010462354962840102, 'lr': 0.0019025432958620192, 'batch_size': 32, 'dropout_rate': 0.41686845337711426, 'prior_mu': 0.044564943876596035, 'prior_sigma': 0.0744026211926893, 'normalization': 'none'}. Best is trial 1528 with value: 0.5170644640922546.
Generating morgan fingerprints...
Generated fingerprints with 2048 features for 900 molecules
Data shape: X=(900, 2048), y=(900,)
Trial 1856: 5-fold CV loss = 0.9535
