[I 2025-08-08 05:49:37,139] Trial 2388 finished with value: 0.578632265329361 and parameters: {'fp_type': 'morgan', 'morgan_only_radius': 2, 'morgan_only_nBits': 2048, 'num_hidden_layers': 3, 'hidden_dim_0': 512, 'hidden_dim_1': 128, 'hidden_dim_2': 256, 'kl_weight': 0.0009014359093385408, 'lr': 0.001836840802458027, 'batch_size': 32, 'dropout_rate': 0.42893327773872764, 'prior_mu': 0.031067834297983286, 'prior_sigma': 0.08025540397220447, 'normalization': 'none'}. Best is trial 2329 with value: 0.5157062888145447.
Generating morgan fingerprints...
Generated fingerprints with 2048 features for 900 molecules
Data shape: X=(900, 2048), y=(900,)
Trial 2392: 5-fold CV loss = 0.5968
[I 2025-08-08 05:49:50,998] Trial 2392 finished with value: 0.5968217432498932 and parameters: {'fp_type': 'morgan', 'morgan_only_radius': 2, 'morgan_only_nBits': 2048, 'num_hidden_layers': 3, 'hidden_dim_0': 512, 'hidden_dim_1': 128, 'hidden_dim_2': 512, 'kl_weight': 0.0005648124722561295, 'lr': 0.0017084581356040028, 'batch_size': 32, 'dropout_rate': 0.44587490209769753, 'prior_mu': 0.02775700345944314, 'prior_sigma': 0.07979594678909148, 'normalization': 'none'}. Best is trial 2329 with value: 0.5157062888145447.
Generating morgan fingerprints...
Generated fingerprints with 2048 features for 900 molecules
Data shape: X=(900, 2048), y=(900,)
Trial 2394: 5-fold CV loss = 0.6097
[I 2025-08-08 05:50:00,862] Trial 2394 finished with value: 0.6097080945968628 and parameters: {'fp_type': 'morgan', 'morgan_only_radius': 2, 'morgan_only_nBits': 2048, 'num_hidden_layers': 3, 'hidden_dim_0': 512, 'hidden_dim_1': 128, 'hidden_dim_2': 512, 'kl_weight': 0.0005875349732753932, 'lr': 0.001664107009180782, 'batch_size': 32, 'dropout_rate': 0.4121232762338935, 'prior_mu': 0.038452597846146214, 'prior_sigma': 0.05501695710886672, 'normalization': 'none'}. Best is trial 2329 with value: 0.5157062888145447.
Generating morgan fingerprints...
Generated fingerprints with 2048 features for 900 molecules
Data shape: X=(900, 2048), y=(900,)
Trial 2396: 5-fold CV loss = 0.6743
[I 2025-08-08 05:50:33,543] Trial 2396 finished with value: 0.6742837071418762 and parameters: {'fp_type': 'morgan', 'morgan_only_radius': 2, 'morgan_only_nBits': 2048, 'num_hidden_layers': 3, 'hidden_dim_0': 512, 'hidden_dim_1': 128, 'hidden_dim_2': 512, 'kl_weight': 0.0006636771916821905, 'lr': 0.0014184517904556407, 'batch_size': 32, 'dropout_rate': 0.3723342805535063, 'prior_mu': 0.043395778754759085, 'prior_sigma': 0.05514345257182835, 'normalization': 'none'}. Best is trial 2329 with value: 0.5157062888145447.
Generating morgan fingerprints...
Generated fingerprints with 2048 features for 900 molecules
Data shape: X=(900, 2048), y=(900,)
Trial 2397: 5-fold CV loss = 0.5343
[I 2025-08-08 05:51:08,708] Trial 2397 finished with value: 0.5342718601226807 and parameters: {'fp_type': 'morgan', 'morgan_only_radius': 2, 'morgan_only_nBits': 2048, 'num_hidden_layers': 3, 'hidden_dim_0': 128, 'hidden_dim_1': 128, 'hidden_dim_2': 512, 'kl_weight': 0.0006776180966639431, 'lr': 0.004001833796146541, 'batch_size': 32, 'dropout_rate': 0.415371374733897, 'prior_mu': 0.04935770468520272, 'prior_sigma': 0.06875472089492761, 'normalization': 'none'}. Best is trial 2329 with value: 0.5157062888145447.
Generating morgan fingerprints...
Generated fingerprints with 2048 features for 900 molecules
Data shape: X=(900, 2048), y=(900,)
Trial 2395: 5-fold CV loss = 0.6426
[I 2025-08-08 05:51:11,116] Trial 2395 finished with value: 0.6426163792610169 and parameters: {'fp_type': 'morgan', 'morgan_only_radius': 2, 'morgan_only_nBits': 2048, 'num_hidden_layers': 3, 'hidden_dim_0': 512, 'hidden_dim_1': 128, 'hidden_dim_2': 512, 'kl_weight': 0.0005539801262269498, 'lr': 0.001553734970086673, 'batch_size': 32, 'dropout_rate': 0.4156775994641423, 'prior_mu': 0.04205806417329998, 'prior_sigma': 0.0701114154613918, 'normalization': 'none'}. Best is trial 2329 with value: 0.5157062888145447.
Generating morgan fingerprints...
Generated fingerprints with 2048 features for 900 molecules
Data shape: X=(900, 2048), y=(900,)
Trial 2398: 5-fold CV loss = 0.5619
[I 2025-08-08 05:51:34,910] Trial 2398 finished with value: 0.5618770062923432 and parameters: {'fp_type': 'morgan', 'morgan_only_radius': 2, 'morgan_only_nBits': 2048, 'num_hidden_layers': 3, 'hidden_dim_0': 128, 'hidden_dim_1': 128, 'hidden_dim_2': 128, 'kl_weight': 0.0007119623349489838, 'lr': 0.0026033071568732167, 'batch_size': 32, 'dropout_rate': 0.4165867758626444, 'prior_mu': 0.05060373862292831, 'prior_sigma': 0.06948736662225445, 'normalization': 'none'}. Best is trial 2329 with value: 0.5157062888145447.
Generating morgan fingerprints...
Generated fingerprints with 2048 features for 900 molecules
Data shape: X=(900, 2048), y=(900,)
Trial 2399: 5-fold CV loss = 0.5590
[I 2025-08-08 05:52:07,350] Trial 2399 finished with value: 0.5589989125728607 and parameters: {'fp_type': 'morgan', 'morgan_only_radius': 2, 'morgan_only_nBits': 2048, 'num_hidden_layers': 3, 'hidden_dim_0': 512, 'hidden_dim_1': 128, 'hidden_dim_2': 128, 'kl_weight': 0.0011044286505885567, 'lr': 0.0019587087143801063, 'batch_size': 32, 'dropout_rate': 0.3877027667046252, 'prior_mu': 0.05170326803918522, 'prior_sigma': 0.06420446951261045, 'normalization': 'none'}. Best is trial 2329 with value: 0.5157062888145447.
Generating morgan fingerprints...
Generated fingerprints with 2048 features for 900 molecules
Data shape: X=(900, 2048), y=(900,)
Trial 2393: 5-fold CV loss = 0.7341
[I 2025-08-08 05:52:35,959] Trial 2393 finished with value: 0.7341417968273163 and parameters: {'fp_type': 'morgan', 'morgan_only_radius': 2, 'morgan_only_nBits': 2048, 'num_hidden_layers': 3, 'hidden_dim_0': 512, 'hidden_dim_1': 128, 'hidden_dim_2': 512, 'kl_weight': 0.0005659373251666647, 'lr': 0.0016515054183332282, 'batch_size': 32, 'dropout_rate': 0.4468528460334559, 'prior_mu': 0.0386998425479315, 'prior_sigma': 0.07808175108940663, 'normalization': 'none'}. Best is trial 2329 with value: 0.5157062888145447.
Generating morgan fingerprints...
Generated fingerprints with 2048 features for 900 molecules
Data shape: X=(900, 2048), y=(900,)
Trial 2401: 5-fold CV loss = 0.5316
[I 2025-08-08 05:53:04,465] Trial 2401 finished with value: 0.5316255629062653 and parameters: {'fp_type': 'morgan', 'morgan_only_radius': 2, 'morgan_only_nBits': 2048, 'num_hidden_layers': 3, 'hidden_dim_0': 512, 'hidden_dim_1': 64, 'hidden_dim_2': 512, 'kl_weight': 0.0008928969771400313, 'lr': 0.0019849996528341894, 'batch_size': 32, 'dropout_rate': 0.4011344428272548, 'prior_mu': 0.060382963078058835, 'prior_sigma': 0.0642174833244751, 'normalization': 'none'}. Best is trial 2329 with value: 0.5157062888145447.
Generating morgan fingerprints...
Generated fingerprints with 2048 features for 900 molecules
Data shape: X=(900, 2048), y=(900,)
Trial 2402: 5-fold CV loss = 0.5243
[I 2025-08-08 05:53:09,366] Trial 2402 finished with value: 0.5242775559425354 and parameters: {'fp_type': 'morgan', 'morgan_only_radius': 2, 'morgan_only_nBits': 2048, 'num_hidden_layers': 3, 'hidden_dim_0': 512, 'hidden_dim_1': 64, 'hidden_dim_2': 512, 'kl_weight': 0.0006869041126750273, 'lr': 0.0026945123403232466, 'batch_size': 32, 'dropout_rate': 0.4030070683932342, 'prior_mu': 0.03806133530032557, 'prior_sigma': 0.07515659558809717, 'normalization': 'none'}. Best is trial 2329 with value: 0.5157062888145447.
Generating morgan fingerprints...
Generated fingerprints with 2048 features for 900 molecules
Data shape: X=(900, 2048), y=(900,)
Trial 2405: 5-fold CV loss = 0.6344
[I 2025-08-08 05:53:24,316] Trial 2405 finished with value: 0.6343558430671692 and parameters: {'fp_type': 'morgan', 'morgan_only_radius': 2, 'morgan_only_nBits': 2048, 'num_hidden_layers': 0, 'kl_weight': 0.0007550768882057197, 'lr': 0.002094084924998756, 'batch_size': 32, 'dropout_rate': 0.439695222582637, 'prior_mu': 0.033200951492246, 'prior_sigma': 0.05927178740304692, 'normalization': 'none'}. Best is trial 2329 with value: 0.5157062888145447.
Generating morgan fingerprints...
Generated fingerprints with 2048 features for 900 molecules
Data shape: X=(900, 2048), y=(900,)
Trial 2400: 5-fold CV loss = 0.5441
[I 2025-08-08 05:53:25,909] Trial 2400 finished with value: 0.5441238462924958 and parameters: {'fp_type': 'morgan', 'morgan_only_radius': 2, 'morgan_only_nBits': 2048, 'num_hidden_layers': 3, 'hidden_dim_0': 512, 'hidden_dim_1': 128, 'hidden_dim_2': 128, 'kl_weight': 0.000736604974277997, 'lr': 0.0027138464671858614, 'batch_size': 32, 'dropout_rate': 0.40191497390901726, 'prior_mu': 0.052751428645215245, 'prior_sigma': 0.06344296164851518, 'normalization': 'none'}. Best is trial 2329 with value: 0.5157062888145447.
Generating morgan fingerprints...
Generated fingerprints with 2048 features for 900 molecules
Data shape: X=(900, 2048), y=(900,)
Trial 2404: 5-fold CV loss = 0.5262
[I 2025-08-08 05:54:09,602] Trial 2404 finished with value: 0.5261640012264251 and parameters: {'fp_type': 'morgan', 'morgan_only_radius': 2, 'morgan_only_nBits': 2048, 'num_hidden_layers': 3, 'hidden_dim_0': 512, 'hidden_dim_1': 64, 'hidden_dim_2': 512, 'kl_weight': 0.0006821906930358996, 'lr': 0.0027824268957788076, 'batch_size': 32, 'dropout_rate': 0.4399712860647838, 'prior_mu': 0.03762279244323061, 'prior_sigma': 0.07362401741740905, 'normalization': 'none'}. Best is trial 2329 with value: 0.5157062888145447.
Generating morgan fingerprints...
Generated fingerprints with 2048 features for 900 molecules
Data shape: X=(900, 2048), y=(900,)
Trial 2406: 5-fold CV loss = 0.6881
[I 2025-08-08 05:54:30,622] Trial 2406 finished with value: 0.6880986452102661 and parameters: {'fp_type': 'morgan', 'morgan_only_radius': 2, 'morgan_only_nBits': 2048, 'num_hidden_layers': 3, 'hidden_dim_0': 512, 'hidden_dim_1': 128, 'hidden_dim_2': 256, 'kl_weight': 0.0006533201061726488, 'lr': 0.0019241697304545745, 'batch_size': 32, 'dropout_rate': 0.4512576167813351, 'prior_mu': 0.07144158762562258, 'prior_sigma': 0.07279664186905231, 'normalization': 'none'}. Best is trial 2329 with value: 0.5157062888145447.
Generating morgan fingerprints...
Generated fingerprints with 2048 features for 900 molecules
Data shape: X=(900, 2048), y=(900,)
Trial 2408: 5-fold CV loss = 0.7110
[I 2025-08-08 05:54:55,147] Trial 2408 finished with value: 0.7109793782234192 and parameters: {'fp_type': 'morgan', 'morgan_only_radius': 2, 'morgan_only_nBits': 2048, 'num_hidden_layers': 3, 'hidden_dim_0': 512, 'hidden_dim_1': 128, 'hidden_dim_2': 256, 'kl_weight': 0.0006171982559096449, 'lr': 0.0018946172522646694, 'batch_size': 32, 'dropout_rate': 0.45117239742211046, 'prior_mu': 0.06477617514610962, 'prior_sigma': 0.06714389872297441, 'normalization': 'none'}. Best is trial 2329 with value: 0.5157062888145447.
Generating morgan fingerprints...
Generated fingerprints with 2048 features for 900 molecules
Data shape: X=(900, 2048), y=(900,)
Trial 2407: 5-fold CV loss = 0.7702
[I 2025-08-08 05:55:12,677] Trial 2407 finished with value: 0.7702497839927673 and parameters: {'fp_type': 'morgan', 'morgan_only_radius': 2, 'morgan_only_nBits': 2048, 'num_hidden_layers': 3, 'hidden_dim_0': 512, 'hidden_dim_1': 128, 'hidden_dim_2': 256, 'kl_weight': 0.0006410859103664569, 'lr': 0.0019359955094970162, 'batch_size': 32, 'dropout_rate': 0.45315480913464845, 'prior_mu': 0.029620002623210483, 'prior_sigma': 0.0732574471072759, 'normalization': 'none'}. Best is trial 2329 with value: 0.5157062888145447.
Generating morgan fingerprints...
Generated fingerprints with 2048 features for 900 molecules
Data shape: X=(900, 2048), y=(900,)
Trial 2411: 5-fold CV loss = 1.0382
[I 2025-08-08 05:55:26,070] Trial 2411 finished with value: 1.0382023572921752 and parameters: {'fp_type': 'morgan', 'morgan_only_radius': 2, 'morgan_only_nBits': 2048, 'num_hidden_layers': 3, 'hidden_dim_0': 512, 'hidden_dim_1': 512, 'hidden_dim_2': 512, 'kl_weight': 0.0009191749859356207, 'lr': 0.002269915087558031, 'batch_size': 128, 'dropout_rate': 0.4231391675287767, 'prior_mu': 0.04616018463274806, 'prior_sigma': 0.08462940657325806, 'normalization': 'none'}. Best is trial 2329 with value: 0.5157062888145447.
Generating morgan fingerprints...
Generated fingerprints with 2048 features for 900 molecules
Data shape: X=(900, 2048), y=(900,)
Trial 2409: 5-fold CV loss = 0.5283
[I 2025-08-08 05:55:33,669] Trial 2409 finished with value: 0.5283208608627319 and parameters: {'fp_type': 'morgan', 'morgan_only_radius': 2, 'morgan_only_nBits': 2048, 'num_hidden_layers': 3, 'hidden_dim_0': 512, 'hidden_dim_1': 128, 'hidden_dim_2': 512, 'kl_weight': 0.0009264627376341354, 'lr': 0.0022924287051887043, 'batch_size': 32, 'dropout_rate': 0.42414988077727456, 'prior_mu': 0.06262613680232089, 'prior_sigma': 0.06695926579832356, 'normalization': 'none'}. Best is trial 2329 with value: 0.5157062888145447.
Generating morgan fingerprints...
Generated fingerprints with 2048 features for 900 molecules
Data shape: X=(900, 2048), y=(900,)
Trial 2403: 5-fold CV loss = 0.5303
[I 2025-08-08 05:55:37,984] Trial 2403 finished with value: 0.5302639305591583 and parameters: {'fp_type': 'morgan', 'morgan_only_radius': 2, 'morgan_only_nBits': 2048, 'num_hidden_layers': 3, 'hidden_dim_0': 512, 'hidden_dim_1': 64, 'hidden_dim_2': 512, 'kl_weight': 0.0009121637964364426, 'lr': 0.0026920225593937436, 'batch_size': 32, 'dropout_rate': 0.4008644998257092, 'prior_mu': 0.05967949225516077, 'prior_sigma': 0.07370121904636492, 'normalization': 'none'}. Best is trial 2329 with value: 0.5157062888145447.
Generating morgan fingerprints...
Generated fingerprints with 2048 features for 900 molecules
Data shape: X=(900, 2048), y=(900,)
Trial 2410: 5-fold CV loss = 0.5320
[I 2025-08-08 05:56:09,390] Trial 2410 finished with value: 0.532033485174179 and parameters: {'fp_type': 'morgan', 'morgan_only_radius': 2, 'morgan_only_nBits': 2048, 'num_hidden_layers': 3, 'hidden_dim_0': 512, 'hidden_dim_1': 128, 'hidden_dim_2': 512, 'kl_weight': 0.0008974973174025197, 'lr': 0.002236801039843909, 'batch_size': 32, 'dropout_rate': 0.4221516212400598, 'prior_mu': 0.027017401454534455, 'prior_sigma': 0.08472924793818203, 'normalization': 'none'}. Best is trial 2329 with value: 0.5157062888145447.
Generating morgan fingerprints...
Generated fingerprints with 2048 features for 900 molecules
Data shape: X=(900, 2048), y=(900,)
Trial 2413: 5-fold CV loss = 0.5949
[I 2025-08-08 05:56:28,068] Trial 2413 finished with value: 0.5948896288871766 and parameters: {'fp_type': 'morgan', 'morgan_only_radius': 2, 'morgan_only_nBits': 2048, 'num_hidden_layers': 3, 'hidden_dim_0': 512, 'hidden_dim_1': 128, 'hidden_dim_2': 64, 'kl_weight': 0.0008007447929157918, 'lr': 0.002107217095413069, 'batch_size': 32, 'dropout_rate': 0.43905258438615213, 'prior_mu': 0.01910461295331078, 'prior_sigma': 0.05990640465519092, 'normalization': 'none'}. Best is trial 2329 with value: 0.5157062888145447.
Generating morgan fingerprints...
Generated fingerprints with 2048 features for 900 molecules
Data shape: X=(900, 2048), y=(900,)
Trial 2412: 5-fold CV loss = 0.6073
[I 2025-08-08 05:57:05,771] Trial 2412 finished with value: 0.6073382377624512 and parameters: {'fp_type': 'morgan', 'morgan_only_radius': 2, 'morgan_only_nBits': 2048, 'num_hidden_layers': 3, 'hidden_dim_0': 512, 'hidden_dim_1': 128, 'hidden_dim_2': 64, 'kl_weight': 0.0005432780134928366, 'lr': 0.00214136152413253, 'batch_size': 32, 'dropout_rate': 0.46133189267354846, 'prior_mu': 0.01932757340891456, 'prior_sigma': 0.06063385218187791, 'normalization': 'none'}. Best is trial 2329 with value: 0.5157062888145447.
Generating morgan fingerprints...
Generated fingerprints with 2048 features for 900 molecules
Data shape: X=(900, 2048), y=(900,)
Trial 2416: 5-fold CV loss = 0.5476
[I 2025-08-08 05:57:25,264] Trial 2416 finished with value: 0.5475513994693756 and parameters: {'fp_type': 'morgan', 'morgan_only_radius': 2, 'morgan_only_nBits': 2048, 'num_hidden_layers': 3, 'hidden_dim_0': 512, 'hidden_dim_1': 128, 'hidden_dim_2': 512, 'kl_weight': 0.000535677709008552, 'lr': 0.0033247043610579226, 'batch_size': 32, 'dropout_rate': 0.4345524988727919, 'prior_mu': 0.04543730244183028, 'prior_sigma': 0.08917800068042372, 'normalization': 'layer'}. Best is trial 2329 with value: 0.5157062888145447.
Generating morgan fingerprints...
Generated fingerprints with 2048 features for 900 molecules
Data shape: X=(900, 2048), y=(900,)
Trial 2415: 5-fold CV loss = 0.5489
[I 2025-08-08 05:57:38,374] Trial 2415 finished with value: 0.5488524436950684 and parameters: {'fp_type': 'morgan', 'morgan_only_radius': 2, 'morgan_only_nBits': 2048, 'num_hidden_layers': 3, 'hidden_dim_0': 512, 'hidden_dim_1': 128, 'hidden_dim_2': 64, 'kl_weight': 0.001103504590566875, 'lr': 0.0033088937052250106, 'batch_size': 32, 'dropout_rate': 0.4369025037958313, 'prior_mu': 0.047263297959024494, 'prior_sigma': 0.06098110471908311, 'normalization': 'none'}. Best is trial 2329 with value: 0.5157062888145447.
Generating morgan fingerprints...
Generated fingerprints with 2048 features for 900 molecules
Data shape: X=(900, 2048), y=(900,)
Trial 2414: 5-fold CV loss = 0.6277
[I 2025-08-08 05:58:23,290] Trial 2414 finished with value: 0.6277154803276062 and parameters: {'fp_type': 'morgan', 'morgan_only_radius': 2, 'morgan_only_nBits': 2048, 'num_hidden_layers': 3, 'hidden_dim_0': 512, 'hidden_dim_1': 128, 'hidden_dim_2': 64, 'kl_weight': 0.0011438917083265276, 'lr': 0.002100777838271793, 'batch_size': 32, 'dropout_rate': 0.4600025737304815, 'prior_mu': 0.0207412393673163, 'prior_sigma': 0.06116475020957333, 'normalization': 'none'}. Best is trial 2329 with value: 0.5157062888145447.
Generating morgan fingerprints...
Generated fingerprints with 2048 features for 900 molecules
Data shape: X=(900, 2048), y=(900,)
Trial 2418: 5-fold CV loss = 0.5651
[I 2025-08-08 05:58:29,732] Trial 2418 finished with value: 0.5650591015815735 and parameters: {'fp_type': 'morgan', 'morgan_only_radius': 2, 'morgan_only_nBits': 2048, 'num_hidden_layers': 3, 'hidden_dim_0': 512, 'hidden_dim_1': 64, 'hidden_dim_2': 512, 'kl_weight': 0.0008128977915776419, 'lr': 0.0016970850241759755, 'batch_size': 32, 'dropout_rate': 0.20353446023635705, 'prior_mu': 0.05419187893799005, 'prior_sigma': 0.06988515384812474, 'normalization': 'none'}. Best is trial 2329 with value: 0.5157062888145447.
Generating morgan fingerprints...
Generated fingerprints with 2048 features for 900 molecules
Data shape: X=(900, 2048), y=(900,)
Trial 2417: 5-fold CV loss = 0.5504
[I 2025-08-08 05:58:43,735] Trial 2417 finished with value: 0.5504165709018707 and parameters: {'fp_type': 'morgan', 'morgan_only_radius': 2, 'morgan_only_nBits': 2048, 'num_hidden_layers': 3, 'hidden_dim_0': 512, 'hidden_dim_1': 128, 'hidden_dim_2': 512, 'kl_weight': 0.000547141816077007, 'lr': 0.0017368541170353254, 'batch_size': 32, 'dropout_rate': 0.3463013799381566, 'prior_mu': 0.045533732065909306, 'prior_sigma': 0.06891602528555442, 'normalization': 'layer'}. Best is trial 2329 with value: 0.5157062888145447.
Generating morgan fingerprints...
Generated fingerprints with 2048 features for 900 molecules
Data shape: X=(900, 2048), y=(900,)
Trial 2421: 5-fold CV loss = 0.6646
[I 2025-08-08 05:59:09,075] Trial 2421 finished with value: 0.6646198391914367 and parameters: {'fp_type': 'morgan', 'morgan_only_radius': 2, 'morgan_only_nBits': 2048, 'num_hidden_layers': 3, 'hidden_dim_0': 512, 'hidden_dim_1': 128, 'hidden_dim_2': 512, 'kl_weight': 0.0006120462263192863, 'lr': 0.0008561573450259725, 'batch_size': 32, 'dropout_rate': 0.2579366272126652, 'prior_mu': 0.03536145112405018, 'prior_sigma': 0.06595073745725781, 'normalization': 'none'}. Best is trial 2329 with value: 0.5157062888145447.
Generating morgan fingerprints...
Generated fingerprints with 2048 features for 900 molecules
Data shape: X=(900, 2048), y=(900,)
Trial 2419: 5-fold CV loss = 0.5285
[I 2025-08-08 05:59:29,202] Trial 2419 finished with value: 0.5285085022449494 and parameters: {'fp_type': 'morgan', 'morgan_only_radius': 2, 'morgan_only_nBits': 2048, 'num_hidden_layers': 3, 'hidden_dim_0': 512, 'hidden_dim_1': 64, 'hidden_dim_2': 512, 'kl_weight': 0.0007665092344866456, 'lr': 0.001667661098396264, 'batch_size': 32, 'dropout_rate': 0.4499646302507866, 'prior_mu': 0.05440430493422312, 'prior_sigma': 0.06990969069248548, 'normalization': 'none'}. Best is trial 2329 with value: 0.5157062888145447.
Generating morgan fingerprints...
Generated fingerprints with 2048 features for 900 molecules
Data shape: X=(900, 2048), y=(900,)
Trial 2422: 5-fold CV loss = 0.7333
[I 2025-08-08 05:59:29,588] Trial 2422 finished with value: 0.7332531571388244 and parameters: {'fp_type': 'morgan', 'morgan_only_radius': 2, 'morgan_only_nBits': 2048, 'num_hidden_layers': 3, 'hidden_dim_0': 512, 'hidden_dim_1': 64, 'hidden_dim_2': 256, 'kl_weight': 0.0007744169893721308, 'lr': 0.0015117822203832656, 'batch_size': 32, 'dropout_rate': 0.4460227193340285, 'prior_mu': 0.03565558030399995, 'prior_sigma': 0.06526570419077089, 'normalization': 'none'}. Best is trial 2329 with value: 0.5157062888145447.
Generating morgan fingerprints...
Generated fingerprints with 2048 features for 900 molecules
Data shape: X=(900, 2048), y=(900,)
Trial 2423: 5-fold CV loss = 0.6526
[I 2025-08-08 05:59:51,578] Trial 2423 finished with value: 0.6525904059410095 and parameters: {'fp_type': 'morgan', 'morgan_only_radius': 2, 'morgan_only_nBits': 2048, 'num_hidden_layers': 3, 'hidden_dim_0': 512, 'hidden_dim_1': 64, 'hidden_dim_2': 256, 'kl_weight': 0.0007790485596488137, 'lr': 0.0014765357272398807, 'batch_size': 32, 'dropout_rate': 0.44779013559974723, 'prior_mu': 0.03623584158424958, 'prior_sigma': 0.05574657991559746, 'normalization': 'none'}. Best is trial 2329 with value: 0.5157062888145447.
Generating morgan fingerprints...
Generated fingerprints with 2048 features for 900 molecules
Data shape: X=(900, 2048), y=(900,)
Trial 2425: 5-fold CV loss = 0.6842
