[I 2025-08-08 07:27:28,666] Trial 2708 finished with value: 0.5204821825027466 and parameters: {'fp_type': 'morgan', 'morgan_only_radius': 2, 'morgan_only_nBits': 2048, 'num_hidden_layers': 3, 'hidden_dim_0': 512, 'hidden_dim_1': 128, 'hidden_dim_2': 512, 'kl_weight': 0.0005446563222759062, 'lr': 0.002123705437767598, 'batch_size': 32, 'dropout_rate': 0.4273117320053713, 'prior_mu': 0.02570970029767962, 'prior_sigma': 0.07280970774024074, 'normalization': 'none'}. Best is trial 2426 with value: 0.515486741065979.
Generating morgan fingerprints...
Generated fingerprints with 2048 features for 900 molecules
Data shape: X=(900, 2048), y=(900,)
Trial 2706: 5-fold CV loss = 0.5757
[I 2025-08-08 07:27:33,212] Trial 2706 finished with value: 0.5757185101509095 and parameters: {'fp_type': 'morgan', 'morgan_only_radius': 2, 'morgan_only_nBits': 2048, 'num_hidden_layers': 3, 'hidden_dim_0': 512, 'hidden_dim_1': 64, 'hidden_dim_2': 512, 'kl_weight': 0.0006759805485859471, 'lr': 0.0017450049656790902, 'batch_size': 32, 'dropout_rate': 0.4323228616825476, 'prior_mu': 0.039329308862900786, 'prior_sigma': 0.061908065551115464, 'normalization': 'none'}. Best is trial 2426 with value: 0.515486741065979.
Generating morgan fingerprints...
Generated fingerprints with 2048 features for 900 molecules
Data shape: X=(900, 2048), y=(900,)
Trial 2709: 5-fold CV loss = 0.5234
[I 2025-08-08 07:27:43,123] Trial 2709 finished with value: 0.5234250962734223 and parameters: {'fp_type': 'morgan', 'morgan_only_radius': 2, 'morgan_only_nBits': 2048, 'num_hidden_layers': 3, 'hidden_dim_0': 512, 'hidden_dim_1': 128, 'hidden_dim_2': 512, 'kl_weight': 0.000698727537854963, 'lr': 0.0021493922987741655, 'batch_size': 32, 'dropout_rate': 0.4210506663169208, 'prior_mu': 0.0760226472329811, 'prior_sigma': 0.07345339546953625, 'normalization': 'none'}. Best is trial 2426 with value: 0.515486741065979.
Generating morgan fingerprints...
Generated fingerprints with 2048 features for 900 molecules
Data shape: X=(900, 2048), y=(900,)
Trial 2703: 5-fold CV loss = 0.5559
[I 2025-08-08 07:27:54,482] Trial 2703 finished with value: 0.5559405565261841 and parameters: {'fp_type': 'morgan', 'morgan_only_radius': 2, 'morgan_only_nBits': 2048, 'num_hidden_layers': 3, 'hidden_dim_0': 512, 'hidden_dim_1': 128, 'hidden_dim_2': 512, 'kl_weight': 0.0005273421223838826, 'lr': 0.0018962631876618362, 'batch_size': 32, 'dropout_rate': 0.40311135247977364, 'prior_mu': 0.05946726146611952, 'prior_sigma': 0.06820169841837104, 'normalization': 'none'}. Best is trial 2426 with value: 0.515486741065979.
Generating morgan fingerprints...
Generated fingerprints with 2048 features for 900 molecules
Data shape: X=(900, 2048), y=(900,)
Trial 2712: 5-fold CV loss = 0.7185
[I 2025-08-08 07:28:14,369] Trial 2712 finished with value: 0.7185419797897339 and parameters: {'fp_type': 'morgan', 'morgan_only_radius': 2, 'morgan_only_nBits': 2048, 'num_hidden_layers': 3, 'hidden_dim_0': 512, 'hidden_dim_1': 128, 'hidden_dim_2': 256, 'kl_weight': 0.0005909607504145806, 'lr': 0.0014930435045716467, 'batch_size': 32, 'dropout_rate': 0.43924956891122374, 'prior_mu': 0.05471795810178278, 'prior_sigma': 0.05568278040439381, 'normalization': 'none'}. Best is trial 2426 with value: 0.515486741065979.
Generating morgan fingerprints...
Generated fingerprints with 2048 features for 900 molecules
Data shape: X=(900, 2048), y=(900,)
Trial 2710: 5-fold CV loss = 0.5861
[I 2025-08-08 07:28:39,220] Trial 2710 finished with value: 0.5861430168151855 and parameters: {'fp_type': 'morgan', 'morgan_only_radius': 2, 'morgan_only_nBits': 2048, 'num_hidden_layers': 3, 'hidden_dim_0': 512, 'hidden_dim_1': 128, 'hidden_dim_2': 256, 'kl_weight': 0.0006880400503296283, 'lr': 0.0022114113528215688, 'batch_size': 32, 'dropout_rate': 0.24706339785214115, 'prior_mu': 0.08881920380157435, 'prior_sigma': 0.0819789841421862, 'normalization': 'none'}. Best is trial 2426 with value: 0.515486741065979.
Generating morgan fingerprints...
Generated fingerprints with 2048 features for 900 molecules
Data shape: X=(900, 2048), y=(900,)
Trial 2711: 5-fold CV loss = 0.5267
[I 2025-08-08 07:29:20,076] Trial 2711 finished with value: 0.5266814947128295 and parameters: {'fp_type': 'morgan', 'morgan_only_radius': 2, 'morgan_only_nBits': 2048, 'num_hidden_layers': 3, 'hidden_dim_0': 512, 'hidden_dim_1': 128, 'hidden_dim_2': 256, 'kl_weight': 0.0007306749336838161, 'lr': 0.003061981786734339, 'batch_size': 32, 'dropout_rate': 0.4162629518156876, 'prior_mu': 0.07621932582723442, 'prior_sigma': 0.08189866382879074, 'normalization': 'none'}. Best is trial 2426 with value: 0.515486741065979.
Generating rdkit fingerprints...
Generated fingerprints with 256 features for 900 molecules
Data shape: X=(900, 256), y=(900,)
Trial 2715: 5-fold CV loss = 0.5305
[I 2025-08-08 07:29:32,129] Trial 2715 finished with value: 0.5305173575878144 and parameters: {'fp_type': 'morgan', 'morgan_only_radius': 2, 'morgan_only_nBits': 2048, 'num_hidden_layers': 3, 'hidden_dim_0': 512, 'hidden_dim_1': 128, 'hidden_dim_2': 512, 'kl_weight': 0.0010573023789521537, 'lr': 0.003060256962746254, 'batch_size': 32, 'dropout_rate': 0.4481539009237893, 'prior_mu': 0.03157152201878465, 'prior_sigma': 0.07580926569229092, 'normalization': 'none'}. Best is trial 2426 with value: 0.515486741065979.
Generating morgan fingerprints...
Generated fingerprints with 2048 features for 900 molecules
Data shape: X=(900, 2048), y=(900,)
Trial 2717: 5-fold CV loss = 0.6418
[I 2025-08-08 07:29:45,659] Trial 2717 finished with value: 0.6418117165565491 and parameters: {'fp_type': 'morgan', 'morgan_only_radius': 2, 'morgan_only_nBits': 2048, 'num_hidden_layers': 3, 'hidden_dim_0': 512, 'hidden_dim_1': 128, 'hidden_dim_2': 512, 'kl_weight': 0.000962347106138829, 'lr': 0.0037327113119910694, 'batch_size': 128, 'dropout_rate': 0.43670461644866815, 'prior_mu': 0.046287076070509484, 'prior_sigma': 0.06257874991137159, 'normalization': 'none'}. Best is trial 2426 with value: 0.515486741065979.
Generating rdkit fingerprints...
Generated fingerprints with 256 features for 900 molecules
Data shape: X=(900, 256), y=(900,)
Trial 2714: 5-fold CV loss = 0.5400
[I 2025-08-08 07:29:46,540] Trial 2714 finished with value: 0.5400447726249695 and parameters: {'fp_type': 'morgan', 'morgan_only_radius': 2, 'morgan_only_nBits': 2048, 'num_hidden_layers': 3, 'hidden_dim_0': 512, 'hidden_dim_1': 128, 'hidden_dim_2': 256, 'kl_weight': 0.0007537001427074397, 'lr': 0.002220471556878898, 'batch_size': 32, 'dropout_rate': 0.4139476002371516, 'prior_mu': 0.03313011429411568, 'prior_sigma': 0.0820129627792069, 'normalization': 'none'}. Best is trial 2426 with value: 0.515486741065979.
Generating rdkit fingerprints...
Generated fingerprints with 256 features for 900 molecules
Data shape: X=(900, 256), y=(900,)
Trial 2719: 5-fold CV loss = 0.6551
[I 2025-08-08 07:30:28,467] Trial 2719 finished with value: 0.6550500988960266 and parameters: {'fp_type': 'rdkit', 'rdkit_only_maxPath': 6, 'rdkit_only_nBits': 256, 'num_hidden_layers': 3, 'hidden_dim_0': 64, 'hidden_dim_1': 64, 'hidden_dim_2': 512, 'kl_weight': 0.0004568809979261261, 'lr': 0.0019817726486012783, 'batch_size': 32, 'dropout_rate': 0.28716910916724964, 'prior_mu': 0.024888908911667524, 'prior_sigma': 0.0714006821864557, 'normalization': 'none'}. Best is trial 2426 with value: 0.515486741065979.
Generating morgan fingerprints...
Generated fingerprints with 2048 features for 900 molecules
Data shape: X=(900, 2048), y=(900,)
Trial 2716: 5-fold CV loss = 0.6491
[I 2025-08-08 07:30:33,174] Trial 2716 finished with value: 0.6490869760513306 and parameters: {'fp_type': 'rdkit', 'rdkit_only_maxPath': 6, 'rdkit_only_nBits': 256, 'num_hidden_layers': 3, 'hidden_dim_0': 512, 'hidden_dim_1': 128, 'hidden_dim_2': 512, 'kl_weight': 0.0011472422669144735, 'lr': 0.001988732041951869, 'batch_size': 32, 'dropout_rate': 0.4367639181219055, 'prior_mu': 0.03203705880425114, 'prior_sigma': 0.07567813932903789, 'normalization': 'none'}. Best is trial 2426 with value: 0.515486741065979.
Generating morgan fingerprints...
Generated fingerprints with 2048 features for 900 molecules
Data shape: X=(900, 2048), y=(900,)
Trial 2718: 5-fold CV loss = 0.6432
[I 2025-08-08 07:30:50,017] Trial 2718 finished with value: 0.643234646320343 and parameters: {'fp_type': 'rdkit', 'rdkit_only_maxPath': 6, 'rdkit_only_nBits': 256, 'num_hidden_layers': 3, 'hidden_dim_0': 512, 'hidden_dim_1': 128, 'hidden_dim_2': 512, 'kl_weight': 0.00017085508484938666, 'lr': 0.0025854092951263083, 'batch_size': 32, 'dropout_rate': 0.42486480610450794, 'prior_mu': 0.025932675053631553, 'prior_sigma': 0.07124929345576307, 'normalization': 'none'}. Best is trial 2426 with value: 0.515486741065979.
Generating morgan fingerprints...
Generated fingerprints with 2048 features for 900 molecules
Data shape: X=(900, 2048), y=(900,)
Trial 2713: 5-fold CV loss = 0.5318
[I 2025-08-08 07:31:06,391] Trial 2713 finished with value: 0.5317670285701752 and parameters: {'fp_type': 'morgan', 'morgan_only_radius': 2, 'morgan_only_nBits': 2048, 'num_hidden_layers': 3, 'hidden_dim_0': 512, 'hidden_dim_1': 128, 'hidden_dim_2': 256, 'kl_weight': 0.00012014463795964208, 'lr': 0.003137234550261613, 'batch_size': 32, 'dropout_rate': 0.4400898326333644, 'prior_mu': 0.052411216041863495, 'prior_sigma': 0.08043679558700914, 'normalization': 'none'}. Best is trial 2426 with value: 0.515486741065979.
Generating morgan fingerprints...
Generated fingerprints with 2048 features for 900 molecules
Data shape: X=(900, 2048), y=(900,)
Trial 2722: 5-fold CV loss = 0.7860
[I 2025-08-08 07:31:10,483] Trial 2722 finished with value: 0.7860281229019165 and parameters: {'fp_type': 'morgan', 'morgan_only_radius': 2, 'morgan_only_nBits': 2048, 'num_hidden_layers': 1, 'hidden_dim_0': 512, 'kl_weight': 0.01358712434720473, 'lr': 0.001628851895519204, 'batch_size': 32, 'dropout_rate': 0.33054675650723137, 'prior_mu': 0.051798477903592946, 'prior_sigma': 0.06571648401017693, 'normalization': 'none'}. Best is trial 2426 with value: 0.515486741065979.
Generating morgan fingerprints...
Generated fingerprints with 2048 features for 900 molecules
Data shape: X=(900, 2048), y=(900,)
Trial 2720: 5-fold CV loss = 0.7393
[I 2025-08-08 07:31:18,889] Trial 2720 finished with value: 0.739283275604248 and parameters: {'fp_type': 'morgan', 'morgan_only_radius': 2, 'morgan_only_nBits': 2048, 'num_hidden_layers': 1, 'hidden_dim_0': 512, 'kl_weight': 0.0001734263806626254, 'lr': 0.0026527305393315398, 'batch_size': 32, 'dropout_rate': 0.3925618294415833, 'prior_mu': 0.0505028733152593, 'prior_sigma': 0.08632020755836053, 'normalization': 'none'}. Best is trial 2426 with value: 0.515486741065979.
Generating morgan fingerprints...
Generated fingerprints with 2048 features for 900 molecules
Data shape: X=(900, 2048), y=(900,)
Trial 2721: 5-fold CV loss = 0.5396
[I 2025-08-08 07:32:03,007] Trial 2721 finished with value: 0.5395800709724426 and parameters: {'fp_type': 'morgan', 'morgan_only_radius': 2, 'morgan_only_nBits': 2048, 'num_hidden_layers': 3, 'hidden_dim_0': 512, 'hidden_dim_1': 128, 'hidden_dim_2': 512, 'kl_weight': 0.00012976543602575449, 'lr': 0.002650634130751048, 'batch_size': 32, 'dropout_rate': 0.39349567646577055, 'prior_mu': 0.050996091758882034, 'prior_sigma': 0.08640503313915983, 'normalization': 'none'}. Best is trial 2426 with value: 0.515486741065979.
Generating morgan fingerprints...
Generated fingerprints with 2048 features for 900 molecules
Data shape: X=(900, 2048), y=(900,)
Trial 2724: 5-fold CV loss = 0.5476
[I 2025-08-08 07:32:16,836] Trial 2724 finished with value: 0.5475834667682647 and parameters: {'fp_type': 'morgan', 'morgan_only_radius': 2, 'morgan_only_nBits': 2048, 'num_hidden_layers': 3, 'hidden_dim_0': 512, 'hidden_dim_1': 64, 'hidden_dim_2': 512, 'kl_weight': 0.0006327552786950841, 'lr': 0.0023751556953289328, 'batch_size': 32, 'dropout_rate': 0.17402421872095136, 'prior_mu': 0.06308095148149141, 'prior_sigma': 0.12707432028004853, 'normalization': 'none'}. Best is trial 2426 with value: 0.515486741065979.
Generating morgan fingerprints...
Generated fingerprints with 2048 features for 900 molecules
Data shape: X=(900, 2048), y=(900,)
Trial 2725: 5-fold CV loss = 0.6461
[I 2025-08-08 07:32:31,498] Trial 2725 finished with value: 0.6461349844932556 and parameters: {'fp_type': 'morgan', 'morgan_only_radius': 2, 'morgan_only_nBits': 2048, 'num_hidden_layers': 2, 'hidden_dim_0': 512, 'hidden_dim_1': 64, 'kl_weight': 0.0006259047571912, 'lr': 0.002332572005630474, 'batch_size': 32, 'dropout_rate': 0.46389812961539995, 'prior_mu': 0.06171222591391479, 'prior_sigma': 0.059598024936413155, 'normalization': 'none'}. Best is trial 2426 with value: 0.515486741065979.
Generating morgan fingerprints...
Generated fingerprints with 2048 features for 900 molecules
Data shape: X=(900, 2048), y=(900,)
Trial 2727: 5-fold CV loss = 0.9008
[I 2025-08-08 07:32:42,323] Trial 2727 finished with value: 0.900763750076294 and parameters: {'fp_type': 'morgan', 'morgan_only_radius': 2, 'morgan_only_nBits': 2048, 'num_hidden_layers': 3, 'hidden_dim_0': 512, 'hidden_dim_1': 1024, 'hidden_dim_2': 512, 'kl_weight': 0.0003262161921906543, 'lr': 0.0018164284368571068, 'batch_size': 32, 'dropout_rate': 0.44626862481591667, 'prior_mu': 0.04242756744545145, 'prior_sigma': 0.058735873073974966, 'normalization': 'none'}. Best is trial 2426 with value: 0.515486741065979.
Generating morgan fingerprints...
Generated fingerprints with 2048 features for 900 molecules
Data shape: X=(900, 2048), y=(900,)
Trial 2728: 5-fold CV loss = 1.0225
[I 2025-08-08 07:33:05,014] Trial 2728 finished with value: 1.0225489258766174 and parameters: {'fp_type': 'morgan', 'morgan_only_radius': 2, 'morgan_only_nBits': 2048, 'num_hidden_layers': 3, 'hidden_dim_0': 512, 'hidden_dim_1': 1024, 'hidden_dim_2': 512, 'kl_weight': 0.00032767670753674593, 'lr': 0.001780194867089344, 'batch_size': 32, 'dropout_rate': 0.4483221998492686, 'prior_mu': 0.041757652728489913, 'prior_sigma': 0.06407278191947062, 'normalization': 'none'}. Best is trial 2426 with value: 0.515486741065979.
Generating morgan fingerprints...
Generated fingerprints with 2048 features for 900 molecules
Data shape: X=(900, 2048), y=(900,)
Trial 2729: 5-fold CV loss = 0.5407
[I 2025-08-08 07:33:58,385] Trial 2729 finished with value: 0.540734052658081 and parameters: {'fp_type': 'morgan', 'morgan_only_radius': 2, 'morgan_only_nBits': 2048, 'num_hidden_layers': 3, 'hidden_dim_0': 512, 'hidden_dim_1': 128, 'hidden_dim_2': 512, 'kl_weight': 0.000777239527071698, 'lr': 0.002056137079062629, 'batch_size': 32, 'dropout_rate': 0.4186710972246432, 'prior_mu': 0.038893015959575186, 'prior_sigma': 0.05254740347345856, 'normalization': 'none'}. Best is trial 2426 with value: 0.515486741065979.
Generating morgan fingerprints...
Generated fingerprints with 2048 features for 900 molecules
Data shape: X=(900, 2048), y=(900,)
Trial 2726: 5-fold CV loss = 0.5215
[I 2025-08-08 07:33:59,854] Trial 2726 finished with value: 0.5215145707130432 and parameters: {'fp_type': 'morgan', 'morgan_only_radius': 2, 'morgan_only_nBits': 2048, 'num_hidden_layers': 3, 'hidden_dim_0': 512, 'hidden_dim_1': 64, 'hidden_dim_2': 512, 'kl_weight': 0.0006102845681645796, 'lr': 0.00233801185120869, 'batch_size': 32, 'dropout_rate': 0.46430144555233627, 'prior_mu': 0.061661501838069184, 'prior_sigma': 0.05878098981563684, 'normalization': 'none'}. Best is trial 2426 with value: 0.515486741065979.
Generating morgan fingerprints...
Generated fingerprints with 2048 features for 900 molecules
Data shape: X=(900, 2048), y=(900,)
Trial 2730: 5-fold CV loss = 0.6259
[I 2025-08-08 07:34:16,277] Trial 2730 finished with value: 0.625900387763977 and parameters: {'fp_type': 'morgan', 'morgan_only_radius': 3, 'morgan_only_nBits': 2048, 'num_hidden_layers': 3, 'hidden_dim_0': 512, 'hidden_dim_1': 128, 'hidden_dim_2': 512, 'kl_weight': 0.00021856800330514043, 'lr': 0.002053578744288719, 'batch_size': 32, 'dropout_rate': 0.4155794132078854, 'prior_mu': 0.0206702384327298, 'prior_sigma': 0.06756199437740736, 'normalization': 'none'}. Best is trial 2426 with value: 0.515486741065979.
Generating morgan fingerprints...
Generated fingerprints with 2048 features for 900 molecules
Data shape: X=(900, 2048), y=(900,)
Trial 2731: 5-fold CV loss = 0.8089
[I 2025-08-08 07:34:23,127] Trial 2731 finished with value: 0.8088637232780457 and parameters: {'fp_type': 'morgan', 'morgan_only_radius': 3, 'morgan_only_nBits': 2048, 'num_hidden_layers': 3, 'hidden_dim_0': 512, 'hidden_dim_1': 128, 'hidden_dim_2': 512, 'kl_weight': 0.00020945496905416707, 'lr': 0.0014682527616310078, 'batch_size': 64, 'dropout_rate': 0.4307535149661076, 'prior_mu': 0.019335224345764845, 'prior_sigma': 0.06704150928888769, 'normalization': 'none'}. Best is trial 2426 with value: 0.515486741065979.
Generating morgan fingerprints...
Generated fingerprints with 2048 features for 900 molecules
Data shape: X=(900, 2048), y=(900,)
Trial 2723: 5-fold CV loss = 0.5242
[I 2025-08-08 07:34:26,973] Trial 2723 finished with value: 0.5242163598537445 and parameters: {'fp_type': 'morgan', 'morgan_only_radius': 2, 'morgan_only_nBits': 2048, 'num_hidden_layers': 3, 'hidden_dim_0': 512, 'hidden_dim_1': 64, 'hidden_dim_2': 512, 'kl_weight': 0.0003195653980858593, 'lr': 0.0023645555569839546, 'batch_size': 32, 'dropout_rate': 0.46210440494971267, 'prior_mu': 0.06417562147221725, 'prior_sigma': 0.06516199762222909, 'normalization': 'none'}. Best is trial 2426 with value: 0.515486741065979.
Generating morgan fingerprints...
Generated fingerprints with 2048 features for 900 molecules
Data shape: X=(900, 2048), y=(900,)
Trial 2732: 5-fold CV loss = 0.7059
[I 2025-08-08 07:34:30,754] Trial 2732 finished with value: 0.7058724641799927 and parameters: {'fp_type': 'morgan', 'morgan_only_radius': 2, 'morgan_only_nBits': 2048, 'num_hidden_layers': 3, 'hidden_dim_0': 512, 'hidden_dim_1': 128, 'hidden_dim_2': 256, 'kl_weight': 0.0004988562185955377, 'lr': 0.001432257267684445, 'batch_size': 64, 'dropout_rate': 0.42762945482448494, 'prior_mu': 0.020851420453394727, 'prior_sigma': 0.06802635208239491, 'normalization': 'none'}. Best is trial 2426 with value: 0.515486741065979.
Generating morgan fingerprints...
Generated fingerprints with 2048 features for 900 molecules
Data shape: X=(900, 2048), y=(900,)
Trial 2733: 5-fold CV loss = 0.5382
[I 2025-08-08 07:35:04,638] Trial 2733 finished with value: 0.5381564557552337 and parameters: {'fp_type': 'morgan', 'morgan_only_radius': 2, 'morgan_only_nBits': 2048, 'num_hidden_layers': 3, 'hidden_dim_0': 512, 'hidden_dim_1': 128, 'hidden_dim_2': 256, 'kl_weight': 0.0009502603658067548, 'lr': 0.0034951884278667878, 'batch_size': 64, 'dropout_rate': 0.42879681489136584, 'prior_mu': 0.0356646584788395, 'prior_sigma': 0.07005364079970791, 'normalization': 'none'}. Best is trial 2426 with value: 0.515486741065979.
Generating morgan fingerprints...
Generated fingerprints with 2048 features for 900 molecules
Data shape: X=(900, 2048), y=(900,)
Trial 2734: 5-fold CV loss = 0.5405
[I 2025-08-08 07:35:14,512] Trial 2734 finished with value: 0.5405362725257874 and parameters: {'fp_type': 'morgan', 'morgan_only_radius': 2, 'morgan_only_nBits': 2048, 'num_hidden_layers': 3, 'hidden_dim_0': 1024, 'hidden_dim_1': 512, 'hidden_dim_2': 256, 'kl_weight': 0.0005216573964986243, 'lr': 0.0028918522877868715, 'batch_size': 32, 'dropout_rate': 0.42865113582063197, 'prior_mu': 0.03325805311490293, 'prior_sigma': 0.0760834516547095, 'normalization': 'layer'}. Best is trial 2426 with value: 0.515486741065979.
Generating morgan fingerprints...
Generated fingerprints with 2048 features for 900 molecules
Data shape: X=(900, 2048), y=(900,)
Trial 2738: 5-fold CV loss = 0.5882
[I 2025-08-08 07:36:15,753] Trial 2738 finished with value: 0.5881855428218842 and parameters: {'fp_type': 'morgan', 'morgan_only_radius': 2, 'morgan_only_nBits': 2048, 'num_hidden_layers': 3, 'hidden_dim_0': 512, 'hidden_dim_1': 128, 'hidden_dim_2': 64, 'kl_weight': 0.0004045208368514175, 'lr': 0.0019185509511951222, 'batch_size': 32, 'dropout_rate': 0.4090775092089978, 'prior_mu': 0.044212667074757406, 'prior_sigma': 0.06329077603053976, 'normalization': 'none'}. Best is trial 2426 with value: 0.515486741065979.
Generating morgan fingerprints...
Generated fingerprints with 2048 features for 900 molecules
Data shape: X=(900, 2048), y=(900,)
Trial 2736: 5-fold CV loss = 0.5426
[I 2025-08-08 07:36:18,476] Trial 2736 finished with value: 0.5425773501396179 and parameters: {'fp_type': 'morgan', 'morgan_only_radius': 2, 'morgan_only_nBits': 2048, 'num_hidden_layers': 3, 'hidden_dim_0': 1024, 'hidden_dim_1': 128, 'hidden_dim_2': 256, 'kl_weight': 0.0009116325379291727, 'lr': 0.0018935000421615139, 'batch_size': 32, 'dropout_rate': 0.41059021114804073, 'prior_mu': 0.044226092810746076, 'prior_sigma': 0.0766842061043984, 'normalization': 'layer'}. Best is trial 2426 with value: 0.515486741065979.
Generating morgan fingerprints...
Generated fingerprints with 2048 features for 900 molecules
Data shape: X=(900, 2048), y=(900,)
Trial 2735: 5-fold CV loss = 0.7455
[I 2025-08-08 07:36:21,228] Trial 2735 finished with value: 0.745531290769577 and parameters: {'fp_type': 'morgan', 'morgan_only_radius': 2, 'morgan_only_nBits': 2048, 'num_hidden_layers': 3, 'hidden_dim_0': 512, 'hidden_dim_1': 512, 'hidden_dim_2': 256, 'kl_weight': 0.0005034817235377753, 'lr': 0.002848733794767499, 'batch_size': 32, 'dropout_rate': 0.42914362324926714, 'prior_mu': 0.03465678814080529, 'prior_sigma': 0.07566068358137949, 'normalization': 'none'}. Best is trial 2426 with value: 0.515486741065979.
Generating morgan fingerprints...
Generated fingerprints with 2048 features for 900 molecules
Data shape: X=(900, 2048), y=(900,)
Trial 2739: 5-fold CV loss = 1.0349
