[I 2025-08-08 04:05:23,889] Trial 2074 finished with value: 0.51775763630867 and parameters: {'fp_type': 'morgan', 'morgan_only_radius': 2, 'morgan_only_nBits': 2048, 'num_hidden_layers': 3, 'hidden_dim_0': 512, 'hidden_dim_1': 64, 'hidden_dim_2': 256, 'kl_weight': 0.0006194327671283934, 'lr': 0.002020120216206587, 'batch_size': 32, 'dropout_rate': 0.4078171658342201, 'prior_mu': 0.050207411973002165, 'prior_sigma': 0.08562076319273898, 'normalization': 'none'}. Best is trial 1528 with value: 0.5170644640922546.
Generating morgan fingerprints...
Generated fingerprints with 2048 features for 900 molecules
Data shape: X=(900, 2048), y=(900,)
Trial 2079: 5-fold CV loss = 0.5304
[I 2025-08-08 04:05:43,284] Trial 2079 finished with value: 0.530431067943573 and parameters: {'fp_type': 'morgan', 'morgan_only_radius': 2, 'morgan_only_nBits': 2048, 'num_hidden_layers': 3, 'hidden_dim_0': 1024, 'hidden_dim_1': 64, 'hidden_dim_2': 256, 'kl_weight': 0.0007228630548783413, 'lr': 0.0024095382230197443, 'batch_size': 32, 'dropout_rate': 0.4023906573303604, 'prior_mu': 0.04727409013179401, 'prior_sigma': 0.08758464610654136, 'normalization': 'none'}. Best is trial 1528 with value: 0.5170644640922546.
Generating morgan fingerprints...
Generated fingerprints with 2048 features for 900 molecules
Data shape: X=(900, 2048), y=(900,)
Trial 2078: 5-fold CV loss = 0.5241
[I 2025-08-08 04:05:55,844] Trial 2078 finished with value: 0.5241495728492737 and parameters: {'fp_type': 'morgan', 'morgan_only_radius': 2, 'morgan_only_nBits': 2048, 'num_hidden_layers': 3, 'hidden_dim_0': 512, 'hidden_dim_1': 64, 'hidden_dim_2': 256, 'kl_weight': 0.0005804572951110237, 'lr': 0.0023711280071609313, 'batch_size': 32, 'dropout_rate': 0.3719899322086249, 'prior_mu': 0.06157578601160323, 'prior_sigma': 0.08932182919575833, 'normalization': 'none'}. Best is trial 1528 with value: 0.5170644640922546.
Generating morgan fingerprints...
Generated fingerprints with 2048 features for 900 molecules
Data shape: X=(900, 2048), y=(900,)
Trial 2081: 5-fold CV loss = 0.9644
[I 2025-08-08 04:05:56,490] Trial 2081 finished with value: 0.9643864035606384 and parameters: {'fp_type': 'morgan', 'morgan_only_radius': 2, 'morgan_only_nBits': 2048, 'num_hidden_layers': 3, 'hidden_dim_0': 512, 'hidden_dim_1': 64, 'hidden_dim_2': 256, 'kl_weight': 0.0005645806433468938, 'lr': 0.0017052537490862398, 'batch_size': 128, 'dropout_rate': 0.400767175160759, 'prior_mu': 0.06534378364490431, 'prior_sigma': 0.09867649768853341, 'normalization': 'none'}. Best is trial 1528 with value: 0.5170644640922546.
Generating morgan fingerprints...
Generated fingerprints with 2048 features for 900 molecules
Data shape: X=(900, 2048), y=(900,)
Trial 2082: 5-fold CV loss = 0.9130
[I 2025-08-08 04:06:33,529] Trial 2082 finished with value: 0.9130499362945557 and parameters: {'fp_type': 'morgan', 'morgan_only_radius': 2, 'morgan_only_nBits': 2048, 'num_hidden_layers': 3, 'hidden_dim_0': 512, 'hidden_dim_1': 64, 'hidden_dim_2': 256, 'kl_weight': 0.0004823564085978005, 'lr': 0.00040427300342832915, 'batch_size': 32, 'dropout_rate': 0.40244739861728923, 'prior_mu': 0.06383183255201712, 'prior_sigma': 0.08757684633583801, 'normalization': 'none'}. Best is trial 1528 with value: 0.5170644640922546.
Generating morgan fingerprints...
Generated fingerprints with 2048 features for 900 molecules
Data shape: X=(900, 2048), y=(900,)
Trial 2073: 5-fold CV loss = 0.5356
[I 2025-08-08 04:06:47,163] Trial 2073 finished with value: 0.5355533838272095 and parameters: {'fp_type': 'morgan', 'morgan_only_radius': 2, 'morgan_only_nBits': 2048, 'num_hidden_layers': 3, 'hidden_dim_0': 512, 'hidden_dim_1': 64, 'hidden_dim_2': 256, 'kl_weight': 0.0005775167316842396, 'lr': 0.0020649653351649516, 'batch_size': 32, 'dropout_rate': 0.39795652329131564, 'prior_mu': 0.04985987712322597, 'prior_sigma': 0.0804298122170328, 'normalization': 'none'}. Best is trial 1528 with value: 0.5170644640922546.
Generating morgan fingerprints...
Generated fingerprints with 2048 features for 900 molecules
Data shape: X=(900, 2048), y=(900,)
Trial 2083: 5-fold CV loss = 0.5669
[I 2025-08-08 04:07:05,574] Trial 2083 finished with value: 0.5669235229492188 and parameters: {'fp_type': 'morgan', 'morgan_only_radius': 2, 'morgan_only_nBits': 2048, 'num_hidden_layers': 3, 'hidden_dim_0': 128, 'hidden_dim_1': 64, 'hidden_dim_2': 256, 'kl_weight': 0.0004562310230410472, 'lr': 0.0017432000676805078, 'batch_size': 32, 'dropout_rate': 0.40170166698529197, 'prior_mu': 0.056970710802210944, 'prior_sigma': 0.07637316753740714, 'normalization': 'none'}. Best is trial 1528 with value: 0.5170644640922546.
Generating rdkit fingerprints...
Generated fingerprints with 256 features for 900 molecules
Data shape: X=(900, 256), y=(900,)
Trial 2080: 5-fold CV loss = 0.5975
[I 2025-08-08 04:07:19,240] Trial 2080 finished with value: 0.597510141134262 and parameters: {'fp_type': 'morgan', 'morgan_only_radius': 2, 'morgan_only_nBits': 2048, 'num_hidden_layers': 3, 'hidden_dim_0': 1024, 'hidden_dim_1': 64, 'hidden_dim_2': 256, 'kl_weight': 0.011263856594552993, 'lr': 0.0017346369109198607, 'batch_size': 32, 'dropout_rate': 0.3784127157494222, 'prior_mu': 0.0665733337834123, 'prior_sigma': 0.09022813752347646, 'normalization': 'none'}. Best is trial 1528 with value: 0.5170644640922546.
Generating rdkit fingerprints...
Generated fingerprints with 256 features for 900 molecules
Data shape: X=(900, 256), y=(900,)
Trial 2086: 5-fold CV loss = 0.7768
[I 2025-08-08 04:07:23,793] Trial 2086 finished with value: 0.7767905950546264 and parameters: {'fp_type': 'rdkit', 'rdkit_only_maxPath': 6, 'rdkit_only_nBits': 256, 'num_hidden_layers': 3, 'hidden_dim_0': 512, 'hidden_dim_1': 64, 'hidden_dim_2': 256, 'kl_weight': 0.0005285252061793285, 'lr': 0.0017644667026961419, 'batch_size': 64, 'dropout_rate': 0.39038391904807745, 'prior_mu': 0.0698443612415642, 'prior_sigma': 0.09441017697193614, 'normalization': 'none'}. Best is trial 1528 with value: 0.5170644640922546.
Generating morgan fingerprints...
Generated fingerprints with 2048 features for 900 molecules
Data shape: X=(900, 2048), y=(900,)
Trial 2087: 5-fold CV loss = 0.7804
[I 2025-08-08 04:07:52,439] Trial 2087 finished with value: 0.7804019331932068 and parameters: {'fp_type': 'rdkit', 'rdkit_only_maxPath': 6, 'rdkit_only_nBits': 256, 'num_hidden_layers': 3, 'hidden_dim_0': 512, 'hidden_dim_1': 64, 'hidden_dim_2': 256, 'kl_weight': 0.0004091099657669597, 'lr': 0.0018654378783779584, 'batch_size': 64, 'dropout_rate': 0.4043180940509993, 'prior_mu': -0.09782875128159724, 'prior_sigma': 0.08591751980885277, 'normalization': 'none'}. Best is trial 1528 with value: 0.5170644640922546.
Generating morgan fingerprints...
Generated fingerprints with 2048 features for 900 molecules
Data shape: X=(900, 2048), y=(900,)
Trial 2084: 5-fold CV loss = 0.5646
[I 2025-08-08 04:08:02,835] Trial 2084 finished with value: 0.5645865261554718 and parameters: {'fp_type': 'morgan', 'morgan_only_radius': 2, 'morgan_only_nBits': 2048, 'num_hidden_layers': 3, 'hidden_dim_0': 128, 'hidden_dim_1': 64, 'hidden_dim_2': 256, 'kl_weight': 0.0004262743923448677, 'lr': 0.001768417506171125, 'batch_size': 32, 'dropout_rate': 0.40737028178526197, 'prior_mu': 0.05719298410506042, 'prior_sigma': 0.07831172729591185, 'normalization': 'none'}. Best is trial 1528 with value: 0.5170644640922546.
Generating morgan fingerprints...
Generated fingerprints with 2048 features for 900 molecules
Data shape: X=(900, 2048), y=(900,)
Trial 2088: 5-fold CV loss = 0.6963
[I 2025-08-08 04:08:32,681] Trial 2088 finished with value: 0.6962628841400147 and parameters: {'fp_type': 'morgan', 'morgan_only_radius': 2, 'morgan_only_nBits': 2048, 'num_hidden_layers': 3, 'hidden_dim_0': 512, 'hidden_dim_1': 64, 'hidden_dim_2': 256, 'kl_weight': 0.00038738369724186937, 'lr': 0.0015588924600772396, 'batch_size': 32, 'dropout_rate': 0.38191499505890103, 'prior_mu': 0.05299949562600928, 'prior_sigma': 0.08642860843413602, 'normalization': 'none'}. Best is trial 1528 with value: 0.5170644640922546.
Generating morgan fingerprints...
Generated fingerprints with 2048 features for 900 molecules
Data shape: X=(900, 2048), y=(900,)
Trial 2090: 5-fold CV loss = 0.7438
[I 2025-08-08 04:08:54,773] Trial 2090 finished with value: 0.743817412853241 and parameters: {'fp_type': 'morgan', 'morgan_only_radius': 2, 'morgan_only_nBits': 2048, 'num_hidden_layers': 3, 'hidden_dim_0': 512, 'hidden_dim_1': 64, 'hidden_dim_2': 256, 'kl_weight': 0.0006275704509180383, 'lr': 0.0015669509649233688, 'batch_size': 32, 'dropout_rate': 0.3832364519081755, 'prior_mu': 0.051964679440136524, 'prior_sigma': 0.08963903535365011, 'normalization': 'none'}. Best is trial 1528 with value: 0.5170644640922546.
Generating morgan fingerprints...
Generated fingerprints with 2048 features for 900 molecules
Data shape: X=(900, 2048), y=(900,)
Trial 2091: 5-fold CV loss = 0.8496
[I 2025-08-08 04:09:03,768] Trial 2091 finished with value: 0.8495597958564758 and parameters: {'fp_type': 'morgan', 'morgan_only_radius': 2, 'morgan_only_nBits': 2048, 'num_hidden_layers': 3, 'hidden_dim_0': 512, 'hidden_dim_1': 64, 'hidden_dim_2': 256, 'kl_weight': 0.0006150775003032792, 'lr': 0.0007999615504838849, 'batch_size': 32, 'dropout_rate': 0.41180001364413954, 'prior_mu': 0.05284596207218617, 'prior_sigma': 0.08599648359638465, 'normalization': 'none'}. Best is trial 1528 with value: 0.5170644640922546.
Generating morgan_rdkit fingerprints...
Generated fingerprints with 2048 features for 900 molecules
Data shape: X=(900, 2048), y=(900,)
Trial 2089: 5-fold CV loss = 0.6157
[I 2025-08-08 04:09:54,556] Trial 2089 finished with value: 0.6156948029994964 and parameters: {'fp_type': 'morgan', 'morgan_only_radius': 2, 'morgan_only_nBits': 2048, 'num_hidden_layers': 3, 'hidden_dim_0': 512, 'hidden_dim_1': 64, 'hidden_dim_2': 256, 'kl_weight': 0.0006263630258161045, 'lr': 0.001597422493493812, 'batch_size': 32, 'dropout_rate': 0.4140394501628965, 'prior_mu': 0.05540910286902641, 'prior_sigma': 0.0852360576434057, 'normalization': 'none'}. Best is trial 1528 with value: 0.5170644640922546.
Generating morgan_rdkit fingerprints...
Generated fingerprints with 2048 features for 900 molecules
Data shape: X=(900, 2048), y=(900,)
Trial 2085: 5-fold CV loss = 0.5968
[I 2025-08-08 04:09:59,031] Trial 2085 finished with value: 0.5968162417411804 and parameters: {'fp_type': 'morgan', 'morgan_only_radius': 2, 'morgan_only_nBits': 2048, 'num_hidden_layers': 3, 'hidden_dim_0': 128, 'hidden_dim_1': 64, 'hidden_dim_2': 256, 'kl_weight': 0.0004055968829588981, 'lr': 0.0016912738551763536, 'batch_size': 32, 'dropout_rate': 0.37645801554862424, 'prior_mu': 0.0571161190641457, 'prior_sigma': 0.09213365920569233, 'normalization': 'none'}. Best is trial 1528 with value: 0.5170644640922546.
Generating morgan_rdkit fingerprints...
Generated fingerprints with 2048 features for 900 molecules
Data shape: X=(900, 2048), y=(900,)
Trial 2093: 5-fold CV loss = 0.5779
[I 2025-08-08 04:10:23,130] Trial 2093 finished with value: 0.5778816223144532 and parameters: {'fp_type': 'morgan_rdkit', 'combined_morgan_radius': 2, 'combined_morgan_nBits': 1024, 'combined_rdkit_maxPath': 6, 'combined_rdkit_nBits': 1024, 'num_hidden_layers': 3, 'hidden_dim_0': 64, 'hidden_dim_1': 64, 'hidden_dim_2': 256, 'kl_weight': 0.0004980561912016071, 'lr': 0.0019016913887938594, 'batch_size': 32, 'dropout_rate': 0.4095038177124204, 'prior_mu': 0.04849710409433381, 'prior_sigma': 0.088820326068534, 'normalization': 'none'}. Best is trial 1528 with value: 0.5170644640922546.
Generating morgan fingerprints...
Generated fingerprints with 2048 features for 900 molecules
Data shape: X=(900, 2048), y=(900,)
Trial 2092: 5-fold CV loss = 0.5997
[I 2025-08-08 04:10:24,930] Trial 2092 finished with value: 0.5996861457824707 and parameters: {'fp_type': 'morgan', 'morgan_only_radius': 2, 'morgan_only_nBits': 2048, 'num_hidden_layers': 3, 'hidden_dim_0': 512, 'hidden_dim_1': 64, 'hidden_dim_2': 256, 'kl_weight': 0.0005521846004083586, 'lr': 0.001934915378550438, 'batch_size': 32, 'dropout_rate': 0.41496727701354924, 'prior_mu': 0.04725785988098702, 'prior_sigma': 0.08910700449133337, 'normalization': 'none'}. Best is trial 1528 with value: 0.5170644640922546.
Generating morgan fingerprints...
Generated fingerprints with 2048 features for 900 molecules
Data shape: X=(900, 2048), y=(900,)
Trial 2096: 5-fold CV loss = 0.5234
[I 2025-08-08 04:11:52,658] Trial 2096 finished with value: 0.523353922367096 and parameters: {'fp_type': 'morgan', 'morgan_only_radius': 2, 'morgan_only_nBits': 2048, 'num_hidden_layers': 3, 'hidden_dim_0': 512, 'hidden_dim_1': 64, 'hidden_dim_2': 256, 'kl_weight': 0.000546278180315354, 'lr': 0.001965441303714594, 'batch_size': 32, 'dropout_rate': 0.40073563353687064, 'prior_mu': 0.04492513613031937, 'prior_sigma': 0.09347603013658981, 'normalization': 'none'}. Best is trial 1528 with value: 0.5170644640922546.
Generating morgan fingerprints...
Generated fingerprints with 2048 features for 900 molecules
Data shape: X=(900, 2048), y=(900,)
Trial 2094: 5-fold CV loss = 0.5739
[I 2025-08-08 04:12:15,673] Trial 2094 finished with value: 0.5739031434059143 and parameters: {'fp_type': 'morgan_rdkit', 'combined_morgan_radius': 2, 'combined_morgan_nBits': 1024, 'combined_rdkit_maxPath': 6, 'combined_rdkit_nBits': 1024, 'num_hidden_layers': 3, 'hidden_dim_0': 64, 'hidden_dim_1': 64, 'hidden_dim_2': 256, 'kl_weight': 0.0005065158794927199, 'lr': 0.0019266033249030938, 'batch_size': 32, 'dropout_rate': 0.40309328664022565, 'prior_mu': 0.04661134333103791, 'prior_sigma': 0.08462304163557686, 'normalization': 'none'}. Best is trial 1528 with value: 0.5170644640922546.
Generating morgan fingerprints...
Generated fingerprints with 2048 features for 900 molecules
Data shape: X=(900, 2048), y=(900,)
Trial 2097: 5-fold CV loss = 0.5277
[I 2025-08-08 04:12:23,550] Trial 2097 finished with value: 0.527727872133255 and parameters: {'fp_type': 'morgan', 'morgan_only_radius': 2, 'morgan_only_nBits': 2048, 'num_hidden_layers': 3, 'hidden_dim_0': 512, 'hidden_dim_1': 64, 'hidden_dim_2': 256, 'kl_weight': 0.0005125219419390254, 'lr': 0.0020201191681641284, 'batch_size': 32, 'dropout_rate': 0.3875204177568288, 'prior_mu': 0.06987538286234961, 'prior_sigma': 0.08183602788768027, 'normalization': 'none'}. Best is trial 1528 with value: 0.5170644640922546.
Generating morgan fingerprints...
Generated fingerprints with 2048 features for 900 molecules
Data shape: X=(900, 2048), y=(900,)
Trial 2098: 5-fold CV loss = 0.5308
[I 2025-08-08 04:13:11,583] Trial 2098 finished with value: 0.530840528011322 and parameters: {'fp_type': 'morgan', 'morgan_only_radius': 2, 'morgan_only_nBits': 2048, 'num_hidden_layers': 3, 'hidden_dim_0': 512, 'hidden_dim_1': 64, 'hidden_dim_2': 256, 'kl_weight': 0.0007085093722195802, 'lr': 0.0020565191508875, 'batch_size': 32, 'dropout_rate': 0.4527696097725777, 'prior_mu': 0.07069627126780456, 'prior_sigma': 0.0934813216620852, 'normalization': 'none'}. Best is trial 1528 with value: 0.5170644640922546.
Generating morgan fingerprints...
Generated fingerprints with 2048 features for 900 molecules
Data shape: X=(900, 2048), y=(900,)
Trial 2095: 5-fold CV loss = 0.6255
[I 2025-08-08 04:13:45,225] Trial 2095 finished with value: 0.6254929184913636 and parameters: {'fp_type': 'morgan_rdkit', 'combined_morgan_radius': 2, 'combined_morgan_nBits': 1024, 'combined_rdkit_maxPath': 6, 'combined_rdkit_nBits': 1024, 'num_hidden_layers': 3, 'hidden_dim_0': 512, 'hidden_dim_1': 64, 'hidden_dim_2': 256, 'kl_weight': 0.0005513100208552193, 'lr': 0.001943186643314148, 'batch_size': 32, 'dropout_rate': 0.40424125378845455, 'prior_mu': 0.04631765319038731, 'prior_sigma': 0.0914829683171212, 'normalization': 'none'}. Best is trial 1528 with value: 0.5170644640922546.
Generating morgan fingerprints...
Generated fingerprints with 2048 features for 900 molecules
Data shape: X=(900, 2048), y=(900,)
Trial 2100: 5-fold CV loss = 0.5588
[I 2025-08-08 04:13:45,896] Trial 2100 finished with value: 0.5588320612907409 and parameters: {'fp_type': 'morgan', 'morgan_only_radius': 2, 'morgan_only_nBits': 2048, 'num_hidden_layers': 3, 'hidden_dim_0': 512, 'hidden_dim_1': 64, 'hidden_dim_2': 256, 'kl_weight': 0.0007058322600538327, 'lr': 0.002154490743872175, 'batch_size': 32, 'dropout_rate': 0.3360004356429369, 'prior_mu': 0.06174660802779782, 'prior_sigma': 0.08667288851030648, 'normalization': 'none'}. Best is trial 1528 with value: 0.5170644640922546.
Generating morgan fingerprints...
Generated fingerprints with 2048 features for 900 molecules
Data shape: X=(900, 2048), y=(900,)
Trial 2099: 5-fold CV loss = 0.6044
[I 2025-08-08 04:14:10,282] Trial 2099 finished with value: 0.6043666660785675 and parameters: {'fp_type': 'morgan', 'morgan_only_radius': 2, 'morgan_only_nBits': 2048, 'num_hidden_layers': 3, 'hidden_dim_0': 512, 'hidden_dim_1': 64, 'hidden_dim_2': 256, 'kl_weight': 0.00070824181704854, 'lr': 0.0021094880217201527, 'batch_size': 32, 'dropout_rate': 0.45319545326452226, 'prior_mu': 0.06386392314691298, 'prior_sigma': 0.09261596263858997, 'normalization': 'none'}. Best is trial 1528 with value: 0.5170644640922546.
Generating morgan fingerprints...
Generated fingerprints with 2048 features for 900 molecules
Data shape: X=(900, 2048), y=(900,)
Trial 2101: 5-fold CV loss = 0.5210
[I 2025-08-08 04:14:26,328] Trial 2101 finished with value: 0.5209916889667511 and parameters: {'fp_type': 'morgan', 'morgan_only_radius': 2, 'morgan_only_nBits': 2048, 'num_hidden_layers': 3, 'hidden_dim_0': 512, 'hidden_dim_1': 64, 'hidden_dim_2': 256, 'kl_weight': 0.0006576543446215414, 'lr': 0.0022072768788461805, 'batch_size': 32, 'dropout_rate': 0.41805979522354136, 'prior_mu': 0.061414773635159875, 'prior_sigma': 0.08485138655880917, 'normalization': 'none'}. Best is trial 1528 with value: 0.5170644640922546.
Generating morgan fingerprints...
Generated fingerprints with 2048 features for 900 molecules
Data shape: X=(900, 2048), y=(900,)
Trial 2105: 5-fold CV loss = 0.7517
[I 2025-08-08 04:14:38,313] Trial 2105 finished with value: 0.7516738176345825 and parameters: {'fp_type': 'morgan', 'morgan_only_radius': 2, 'morgan_only_nBits': 2048, 'num_hidden_layers': 3, 'hidden_dim_0': 512, 'hidden_dim_1': 64, 'hidden_dim_2': 256, 'kl_weight': 0.00034561305683092125, 'lr': 0.001807010640313908, 'batch_size': 128, 'dropout_rate': 0.41739606733518736, 'prior_mu': 0.03960240551374726, 'prior_sigma': 0.08224069481704935, 'normalization': 'none'}. Best is trial 1528 with value: 0.5170644640922546.
Generating morgan fingerprints...
Generated fingerprints with 2048 features for 900 molecules
Data shape: X=(900, 2048), y=(900,)
Trial 2103: 5-fold CV loss = 0.5462
[I 2025-08-08 04:15:27,949] Trial 2103 finished with value: 0.5461891889572144 and parameters: {'fp_type': 'morgan', 'morgan_only_radius': 2, 'morgan_only_nBits': 2048, 'num_hidden_layers': 3, 'hidden_dim_0': 512, 'hidden_dim_1': 64, 'hidden_dim_2': 256, 'kl_weight': 0.0006270577791869385, 'lr': 0.0017467001513959176, 'batch_size': 32, 'dropout_rate': 0.42071656684267894, 'prior_mu': 0.04212357804084634, 'prior_sigma': 0.09660579566276054, 'normalization': 'none'}. Best is trial 1528 with value: 0.5170644640922546.
Generating morgan fingerprints...
Generated fingerprints with 2048 features for 900 molecules
Data shape: X=(900, 2048), y=(900,)
Trial 2106: 5-fold CV loss = 0.5583
[I 2025-08-08 04:16:17,823] Trial 2106 finished with value: 0.5583467721939087 and parameters: {'fp_type': 'morgan', 'morgan_only_radius': 2, 'morgan_only_nBits': 2048, 'num_hidden_layers': 3, 'hidden_dim_0': 512, 'hidden_dim_1': 64, 'hidden_dim_2': 256, 'kl_weight': 0.0004552626615930948, 'lr': 0.00166918758474979, 'batch_size': 32, 'dropout_rate': 0.4416349678876569, 'prior_mu': 0.0370664641068426, 'prior_sigma': 0.0857800258681517, 'normalization': 'none'}. Best is trial 1528 with value: 0.5170644640922546.
Generating morgan fingerprints...
Generated fingerprints with 2048 features for 900 molecules
Data shape: X=(900, 2048), y=(900,)
Trial 2107: 5-fold CV loss = 0.5269
[I 2025-08-08 04:16:49,177] Trial 2107 finished with value: 0.5268723726272583 and parameters: {'fp_type': 'morgan', 'morgan_only_radius': 2, 'morgan_only_nBits': 2048, 'num_hidden_layers': 3, 'hidden_dim_0': 512, 'hidden_dim_1': 64, 'hidden_dim_2': 256, 'kl_weight': 0.00046809577058966106, 'lr': 0.0026141745080590028, 'batch_size': 32, 'dropout_rate': 0.4418686018857441, 'prior_mu': 0.03700318573763717, 'prior_sigma': 0.07742657707424844, 'normalization': 'none'}. Best is trial 1528 with value: 0.5170644640922546.
Generating morgan fingerprints...
Generated fingerprints with 2048 features for 900 molecules
Data shape: X=(900, 2048), y=(900,)
Trial 2104: 5-fold CV loss = 0.5308
[I 2025-08-08 04:17:01,567] Trial 2104 finished with value: 0.5307697772979736 and parameters: {'fp_type': 'morgan', 'morgan_only_radius': 2, 'morgan_only_nBits': 2048, 'num_hidden_layers': 3, 'hidden_dim_0': 512, 'hidden_dim_1': 64, 'hidden_dim_2': 256, 'kl_weight': 0.0006420324504340041, 'lr': 0.0017836061616872114, 'batch_size': 32, 'dropout_rate': 0.41886674920759437, 'prior_mu': 0.036960821732385574, 'prior_sigma': 0.08307325277808075, 'normalization': 'none'}. Best is trial 1528 with value: 0.5170644640922546.
Generating morgan fingerprints...
Generated fingerprints with 2048 features for 900 molecules
Data shape: X=(900, 2048), y=(900,)
Trial 2108: 5-fold CV loss = 0.5345
