[I 2025-08-07 21:59:14,308] Trial 1066 finished with value: 0.5351832747459412 and parameters: {'fp_type': 'morgan', 'morgan_only_radius': 2, 'morgan_only_nBits': 1024, 'num_hidden_layers': 3, 'hidden_dim_0': 256, 'hidden_dim_1': 128, 'hidden_dim_2': 512, 'kl_weight': 0.0015902417981750593, 'lr': 0.002245693032428764, 'batch_size': 32, 'dropout_rate': 0.4829601107770004, 'prior_mu': -0.03057749333561332, 'prior_sigma': 0.09736121136063222, 'normalization': 'none'}. Best is trial 272 with value: 0.5198344707489013.
Generating morgan fingerprints...
Generated fingerprints with 2048 features for 900 molecules
Data shape: X=(900, 2048), y=(900,)
Trial 1070: 5-fold CV loss = 0.8036
[I 2025-08-07 21:59:21,618] Trial 1070 finished with value: 0.803555965423584 and parameters: {'fp_type': 'morgan', 'morgan_only_radius': 2, 'morgan_only_nBits': 1024, 'num_hidden_layers': 3, 'hidden_dim_0': 512, 'hidden_dim_1': 256, 'hidden_dim_2': 512, 'kl_weight': 0.0018454632737829799, 'lr': 0.0011583637773425108, 'batch_size': 32, 'dropout_rate': 0.4703715158819381, 'prior_mu': -0.0688855283827519, 'prior_sigma': 0.08094793227711884, 'normalization': 'none'}. Best is trial 272 with value: 0.5198344707489013.
Generating morgan fingerprints...
Generated fingerprints with 2048 features for 900 molecules
Data shape: X=(900, 2048), y=(900,)
Trial 1071: 5-fold CV loss = 0.5460
[I 2025-08-07 21:59:33,437] Trial 1071 finished with value: 0.545978718996048 and parameters: {'fp_type': 'morgan', 'morgan_only_radius': 2, 'morgan_only_nBits': 1024, 'num_hidden_layers': 3, 'hidden_dim_0': 512, 'hidden_dim_1': 256, 'hidden_dim_2': 512, 'kl_weight': 0.0027475017542764983, 'lr': 0.003146616562511128, 'batch_size': 32, 'dropout_rate': 0.17947557672402203, 'prior_mu': -0.03220580619818207, 'prior_sigma': 0.06852346140326444, 'normalization': 'none'}. Best is trial 272 with value: 0.5198344707489013.
Generating morgan fingerprints...
Generated fingerprints with 2048 features for 900 molecules
Data shape: X=(900, 2048), y=(900,)
Trial 1073: 5-fold CV loss = 0.5388
[I 2025-08-07 22:00:20,117] Trial 1073 finished with value: 0.5387537539005279 and parameters: {'fp_type': 'morgan', 'morgan_only_radius': 2, 'morgan_only_nBits': 2048, 'num_hidden_layers': 3, 'hidden_dim_0': 512, 'hidden_dim_1': 128, 'hidden_dim_2': 512, 'kl_weight': 0.0001553695169866664, 'lr': 0.003071598253869669, 'batch_size': 32, 'dropout_rate': 0.455880959673808, 'prior_mu': -0.05919803253360312, 'prior_sigma': 0.05668982276125167, 'normalization': 'none'}. Best is trial 272 with value: 0.5198344707489013.
Generating morgan fingerprints...
Generated fingerprints with 2048 features for 900 molecules
Data shape: X=(900, 2048), y=(900,)
Trial 1072: 5-fold CV loss = 0.5430
[I 2025-08-07 22:00:58,101] Trial 1072 finished with value: 0.5429792821407318 and parameters: {'fp_type': 'morgan', 'morgan_only_radius': 2, 'morgan_only_nBits': 2048, 'num_hidden_layers': 3, 'hidden_dim_0': 512, 'hidden_dim_1': 256, 'hidden_dim_2': 512, 'kl_weight': 0.0022018616451199326, 'lr': 0.003150131311417333, 'batch_size': 32, 'dropout_rate': 0.46008756729714534, 'prior_mu': -0.06037633946539346, 'prior_sigma': 0.05681464461530082, 'normalization': 'none'}. Best is trial 272 with value: 0.5198344707489013.
Generating morgan fingerprints...
Generated fingerprints with 1024 features for 900 molecules
Data shape: X=(900, 1024), y=(900,)
Trial 1074: 5-fold CV loss = 0.5381
[I 2025-08-07 22:01:08,226] Trial 1074 finished with value: 0.5380671739578247 and parameters: {'fp_type': 'morgan', 'morgan_only_radius': 2, 'morgan_only_nBits': 2048, 'num_hidden_layers': 3, 'hidden_dim_0': 512, 'hidden_dim_1': 128, 'hidden_dim_2': 512, 'kl_weight': 0.00033300124010558936, 'lr': 0.0020271621444704216, 'batch_size': 32, 'dropout_rate': 0.4578297393282453, 'prior_mu': -0.0450340024946872, 'prior_sigma': 0.056894958474299394, 'normalization': 'none'}. Best is trial 272 with value: 0.5198344707489013.
Generating morgan fingerprints...
Generated fingerprints with 1024 features for 900 molecules
Data shape: X=(900, 1024), y=(900,)
Trial 1068: 5-fold CV loss = 0.5653
[I 2025-08-07 22:01:20,158] Trial 1068 finished with value: 0.5653225898742675 and parameters: {'fp_type': 'morgan', 'morgan_only_radius': 2, 'morgan_only_nBits': 1024, 'num_hidden_layers': 3, 'hidden_dim_0': 256, 'hidden_dim_1': 128, 'hidden_dim_2': 512, 'kl_weight': 0.0019919125029454125, 'lr': 0.002237835857207908, 'batch_size': 32, 'dropout_rate': 0.47303008881092684, 'prior_mu': -0.058795729122286054, 'prior_sigma': 0.07380298377789493, 'normalization': 'none'}. Best is trial 272 with value: 0.5198344707489013.
Generating morgan fingerprints...
Generated fingerprints with 1024 features for 900 molecules
Data shape: X=(900, 1024), y=(900,)
Trial 1076: 5-fold CV loss = 0.6477
[I 2025-08-07 22:01:24,327] Trial 1076 finished with value: 0.6477239251136779 and parameters: {'fp_type': 'morgan', 'morgan_only_radius': 2, 'morgan_only_nBits': 1024, 'num_hidden_layers': 0, 'kl_weight': 0.0015455887872277386, 'lr': 0.0019341025319149158, 'batch_size': 32, 'dropout_rate': 0.4769202379138748, 'prior_mu': -0.04720767674243703, 'prior_sigma': 0.06570273474307255, 'normalization': 'none'}. Best is trial 272 with value: 0.5198344707489013.
Generating morgan fingerprints...
Generated fingerprints with 1024 features for 900 molecules
Data shape: X=(900, 1024), y=(900,)
Trial 1075: 5-fold CV loss = 0.5513
[I 2025-08-07 22:01:30,718] Trial 1075 finished with value: 0.5513161182403564 and parameters: {'fp_type': 'morgan', 'morgan_only_radius': 2, 'morgan_only_nBits': 2048, 'num_hidden_layers': 3, 'hidden_dim_0': 512, 'hidden_dim_1': 128, 'hidden_dim_2': 512, 'kl_weight': 0.002193058006161933, 'lr': 0.0019229560872181036, 'batch_size': 32, 'dropout_rate': 0.28713550190911247, 'prior_mu': -0.01651547871488963, 'prior_sigma': 0.06546508078545657, 'normalization': 'none'}. Best is trial 272 with value: 0.5198344707489013.
Generating morgan fingerprints...
Generated fingerprints with 1024 features for 900 molecules
Data shape: X=(900, 1024), y=(900,)
Trial 1077: 5-fold CV loss = 0.6454
[I 2025-08-07 22:01:33,799] Trial 1077 finished with value: 0.6453869581222534 and parameters: {'fp_type': 'morgan', 'morgan_only_radius': 2, 'morgan_only_nBits': 1024, 'num_hidden_layers': 0, 'kl_weight': 0.0017079674252400165, 'lr': 0.0018691803673980911, 'batch_size': 32, 'dropout_rate': 0.4996337543376147, 'prior_mu': -0.0159075658427295, 'prior_sigma': 0.06585825304110288, 'normalization': 'none'}. Best is trial 272 with value: 0.5198344707489013.
Generating morgan fingerprints...
Generated fingerprints with 1024 features for 900 molecules
Data shape: X=(900, 1024), y=(900,)
Trial 1080: 5-fold CV loss = 0.5278
[I 2025-08-07 22:02:37,373] Trial 1080 finished with value: 0.5278370141983032 and parameters: {'fp_type': 'morgan', 'morgan_only_radius': 2, 'morgan_only_nBits': 1024, 'num_hidden_layers': 3, 'hidden_dim_0': 512, 'hidden_dim_1': 128, 'hidden_dim_2': 512, 'kl_weight': 0.0011781043403426721, 'lr': 0.002688518567931779, 'batch_size': 32, 'dropout_rate': 0.4914975584075265, 'prior_mu': -0.02451824464302107, 'prior_sigma': 0.06929441178995425, 'normalization': 'none'}. Best is trial 272 with value: 0.5198344707489013.
Generating morgan fingerprints...
Generated fingerprints with 2048 features for 900 molecules
Data shape: X=(900, 2048), y=(900,)
Trial 1081: 5-fold CV loss = 0.5387
[I 2025-08-07 22:02:43,383] Trial 1081 finished with value: 0.5387284457683563 and parameters: {'fp_type': 'morgan', 'morgan_only_radius': 2, 'morgan_only_nBits': 1024, 'num_hidden_layers': 3, 'hidden_dim_0': 512, 'hidden_dim_1': 128, 'hidden_dim_2': 512, 'kl_weight': 0.019221921155184285, 'lr': 0.0026630138946902976, 'batch_size': 32, 'dropout_rate': 0.4907661536421107, 'prior_mu': -0.024902710883081304, 'prior_sigma': 0.07040211430845618, 'normalization': 'none'}. Best is trial 272 with value: 0.5198344707489013.
Generating morgan fingerprints...
Generated fingerprints with 2048 features for 900 molecules
Data shape: X=(900, 2048), y=(900,)
Trial 1079: 5-fold CV loss = 0.5302
[I 2025-08-07 22:03:19,013] Trial 1079 finished with value: 0.5301718890666962 and parameters: {'fp_type': 'morgan', 'morgan_only_radius': 2, 'morgan_only_nBits': 1024, 'num_hidden_layers': 3, 'hidden_dim_0': 512, 'hidden_dim_1': 128, 'hidden_dim_2': 512, 'kl_weight': 0.001205288937486448, 'lr': 0.002669601507766001, 'batch_size': 32, 'dropout_rate': 0.4895991935720285, 'prior_mu': -0.01752852902915155, 'prior_sigma': 0.06804897519952541, 'normalization': 'none'}. Best is trial 272 with value: 0.5198344707489013.
Generating morgan fingerprints...
Generated fingerprints with 2048 features for 900 molecules
Data shape: X=(900, 2048), y=(900,)
Trial 1082: 5-fold CV loss = 0.5614
[I 2025-08-07 22:04:03,839] Trial 1082 finished with value: 0.5614356637001038 and parameters: {'fp_type': 'morgan', 'morgan_only_radius': 2, 'morgan_only_nBits': 2048, 'num_hidden_layers': 3, 'hidden_dim_0': 512, 'hidden_dim_1': 64, 'hidden_dim_2': 512, 'kl_weight': 0.08037159736744441, 'lr': 0.001684338565708395, 'batch_size': 32, 'dropout_rate': 0.4823749399712902, 'prior_mu': -0.0372069993115259, 'prior_sigma': 0.07730104908863361, 'normalization': 'none'}. Best is trial 272 with value: 0.5198344707489013.
Generating morgan fingerprints...
Generated fingerprints with 2048 features for 900 molecules
Data shape: X=(900, 2048), y=(900,)
Trial 1083: 5-fold CV loss = 0.5472
[I 2025-08-07 22:04:08,002] Trial 1083 finished with value: 0.5471805810928345 and parameters: {'fp_type': 'morgan', 'morgan_only_radius': 2, 'morgan_only_nBits': 2048, 'num_hidden_layers': 3, 'hidden_dim_0': 512, 'hidden_dim_1': 64, 'hidden_dim_2': 512, 'kl_weight': 0.0001831547686122336, 'lr': 0.0017109301961511247, 'batch_size': 32, 'dropout_rate': 0.34785122993551904, 'prior_mu': 0.03163035597426719, 'prior_sigma': 0.07788922645937219, 'normalization': 'none'}. Best is trial 272 with value: 0.5198344707489013.
Generating morgan fingerprints...
Generated fingerprints with 1024 features for 900 molecules
Data shape: X=(900, 1024), y=(900,)
Trial 1078: 5-fold CV loss = 0.5922
[I 2025-08-07 22:05:10,148] Trial 1078 finished with value: 0.5922430634498597 and parameters: {'fp_type': 'morgan', 'morgan_only_radius': 2, 'morgan_only_nBits': 1024, 'num_hidden_layers': 3, 'hidden_dim_0': 512, 'hidden_dim_1': 128, 'hidden_dim_2': 512, 'kl_weight': 0.0011872862858238588, 'lr': 0.001699503704429042, 'batch_size': 32, 'dropout_rate': 0.412060291420604, 'prior_mu': -0.02317132366020812, 'prior_sigma': 0.06470858274712926, 'normalization': 'none'}. Best is trial 272 with value: 0.5198344707489013.
Generating morgan fingerprints...
Generated fingerprints with 2048 features for 900 molecules
Data shape: X=(900, 2048), y=(900,)
Trial 1085: 5-fold CV loss = 0.6813
[I 2025-08-07 22:05:10,668] Trial 1085 finished with value: 0.6813010334968567 and parameters: {'fp_type': 'morgan', 'morgan_only_radius': 2, 'morgan_only_nBits': 2048, 'num_hidden_layers': 3, 'hidden_dim_0': 512, 'hidden_dim_1': 1024, 'hidden_dim_2': 512, 'kl_weight': 0.00931371997683796, 'lr': 0.002420990263493636, 'batch_size': 32, 'dropout_rate': 0.34542669052529945, 'prior_mu': 0.031233875991568585, 'prior_sigma': 0.0628946905360878, 'normalization': 'none'}. Best is trial 272 with value: 0.5198344707489013.
Generating morgan fingerprints...
Generated fingerprints with 1024 features for 900 molecules
Data shape: X=(900, 1024), y=(900,)
Trial 1084: 5-fold CV loss = 0.5235
[I 2025-08-07 22:05:20,556] Trial 1084 finished with value: 0.5235086560249329 and parameters: {'fp_type': 'morgan', 'morgan_only_radius': 2, 'morgan_only_nBits': 2048, 'num_hidden_layers': 3, 'hidden_dim_0': 512, 'hidden_dim_1': 64, 'hidden_dim_2': 512, 'kl_weight': 0.00022601598866257006, 'lr': 0.0023847123700939227, 'batch_size': 32, 'dropout_rate': 0.4997811325861595, 'prior_mu': -0.03470311047636207, 'prior_sigma': 0.06191106606569365, 'normalization': 'none'}. Best is trial 272 with value: 0.5198344707489013.
Generating morgan fingerprints...
Generated fingerprints with 1024 features for 900 molecules
Data shape: X=(900, 1024), y=(900,)
Trial 1086: 5-fold CV loss = 0.5558
[I 2025-08-07 22:05:35,193] Trial 1086 finished with value: 0.5558483064174652 and parameters: {'fp_type': 'morgan', 'morgan_only_radius': 2, 'morgan_only_nBits': 1024, 'num_hidden_layers': 3, 'hidden_dim_0': 128, 'hidden_dim_1': 1024, 'hidden_dim_2': 512, 'kl_weight': 0.00023401664417519233, 'lr': 0.0022415395922034255, 'batch_size': 32, 'dropout_rate': 0.46785442391149773, 'prior_mu': -0.033565337316792614, 'prior_sigma': 0.06356710982312669, 'normalization': 'none'}. Best is trial 272 with value: 0.5198344707489013.
Generating morgan fingerprints...
Generated fingerprints with 1024 features for 900 molecules
Data shape: X=(900, 1024), y=(900,)
Trial 1088: 5-fold CV loss = 0.5841
[I 2025-08-07 22:06:10,002] Trial 1088 finished with value: 0.5840567588806153 and parameters: {'fp_type': 'morgan', 'morgan_only_radius': 2, 'morgan_only_nBits': 1024, 'num_hidden_layers': 3, 'hidden_dim_0': 128, 'hidden_dim_1': 128, 'hidden_dim_2': 512, 'kl_weight': 0.05007440849510478, 'lr': 0.002099215670547112, 'batch_size': 32, 'dropout_rate': 0.46604349054632754, 'prior_mu': -0.008171816711230767, 'prior_sigma': 0.059319770521217015, 'normalization': 'none'}. Best is trial 272 with value: 0.5198344707489013.
Generating morgan fingerprints...
Generated fingerprints with 1024 features for 900 molecules
Data shape: X=(900, 1024), y=(900,)
Trial 1090: 5-fold CV loss = 0.5682
[I 2025-08-07 22:06:51,423] Trial 1090 finished with value: 0.5681706666946411 and parameters: {'fp_type': 'morgan', 'morgan_only_radius': 2, 'morgan_only_nBits': 1024, 'num_hidden_layers': 3, 'hidden_dim_0': 512, 'hidden_dim_1': 64, 'hidden_dim_2': 512, 'kl_weight': 0.0001971035747607558, 'lr': 0.0020933725536366656, 'batch_size': 32, 'dropout_rate': 0.49941934158668266, 'prior_mu': -0.04154894622085367, 'prior_sigma': 0.04898956936103617, 'normalization': 'none'}. Best is trial 272 with value: 0.5198344707489013.
Generating morgan fingerprints...
Generated fingerprints with 2048 features for 900 molecules
Data shape: X=(900, 2048), y=(900,)
Trial 1089: 5-fold CV loss = 0.5680
[I 2025-08-07 22:07:10,788] Trial 1089 finished with value: 0.5680237650871277 and parameters: {'fp_type': 'morgan', 'morgan_only_radius': 2, 'morgan_only_nBits': 1024, 'num_hidden_layers': 3, 'hidden_dim_0': 512, 'hidden_dim_1': 64, 'hidden_dim_2': 512, 'kl_weight': 0.0002442233851190037, 'lr': 0.0021181503248317453, 'batch_size': 32, 'dropout_rate': 0.09678067838633181, 'prior_mu': -0.04135458341474858, 'prior_sigma': 0.05067117864530071, 'normalization': 'none'}. Best is trial 272 with value: 0.5198344707489013.
Generating morgan fingerprints...
Generated fingerprints with 2048 features for 900 molecules
Data shape: X=(900, 2048), y=(900,)
Trial 1091: 5-fold CV loss = 0.5598
[I 2025-08-07 22:07:18,493] Trial 1091 finished with value: 0.5597500264644623 and parameters: {'fp_type': 'morgan', 'morgan_only_radius': 2, 'morgan_only_nBits': 1024, 'num_hidden_layers': 3, 'hidden_dim_0': 512, 'hidden_dim_1': 64, 'hidden_dim_2': 512, 'kl_weight': 0.00023518223445985448, 'lr': 0.0021017222551355705, 'batch_size': 32, 'dropout_rate': 0.49970473426253875, 'prior_mu': -0.040958126218479204, 'prior_sigma': 0.0528502385588346, 'normalization': 'none'}. Best is trial 272 with value: 0.5198344707489013.
Generating morgan fingerprints...
Generated fingerprints with 2048 features for 900 molecules
Data shape: X=(900, 2048), y=(900,)
Trial 1092: 5-fold CV loss = 0.5309
[I 2025-08-07 22:08:07,593] Trial 1092 finished with value: 0.5309354901313782 and parameters: {'fp_type': 'morgan', 'morgan_only_radius': 3, 'morgan_only_nBits': 2048, 'num_hidden_layers': 3, 'hidden_dim_0': 512, 'hidden_dim_1': 64, 'hidden_dim_2': 512, 'kl_weight': 0.00025354163765912746, 'lr': 0.0023575553077477265, 'batch_size': 32, 'dropout_rate': 0.49978882703463356, 'prior_mu': -0.050655802094514396, 'prior_sigma': 0.05397752194192734, 'normalization': 'none'}. Best is trial 272 with value: 0.5198344707489013.
Generating morgan fingerprints...
Generated fingerprints with 2048 features for 900 molecules
Data shape: X=(900, 2048), y=(900,)
Trial 1094: 5-fold CV loss = 0.5615
[I 2025-08-07 22:08:18,319] Trial 1094 finished with value: 0.5615095257759094 and parameters: {'fp_type': 'morgan', 'morgan_only_radius': 2, 'morgan_only_nBits': 2048, 'num_hidden_layers': 3, 'hidden_dim_0': 512, 'hidden_dim_1': 64, 'hidden_dim_2': 64, 'kl_weight': 0.00026422837656247524, 'lr': 0.002355215121071922, 'batch_size': 32, 'dropout_rate': 0.4924534679503572, 'prior_mu': -0.054262232391629396, 'prior_sigma': 0.06014305627864674, 'normalization': 'none'}. Best is trial 272 with value: 0.5198344707489013.
Generating morgan fingerprints...
Generated fingerprints with 1024 features for 900 molecules
Data shape: X=(900, 1024), y=(900,)
Trial 1087: 5-fold CV loss = 0.5691
[I 2025-08-07 22:08:37,880] Trial 1087 finished with value: 0.5690797984600067 and parameters: {'fp_type': 'morgan', 'morgan_only_radius': 2, 'morgan_only_nBits': 2048, 'num_hidden_layers': 3, 'hidden_dim_0': 128, 'hidden_dim_1': 1024, 'hidden_dim_2': 512, 'kl_weight': 0.00022749150421989158, 'lr': 0.002397324404918684, 'batch_size': 32, 'dropout_rate': 0.4997033266805612, 'prior_mu': -0.0351770802687836, 'prior_sigma': 0.06022529391440204, 'normalization': 'none'}. Best is trial 272 with value: 0.5198344707489013.
Generating morgan fingerprints...
Generated fingerprints with 1024 features for 900 molecules
Data shape: X=(900, 1024), y=(900,)
Trial 1093: 5-fold CV loss = 0.6008
[I 2025-08-07 22:08:42,405] Trial 1093 finished with value: 0.6007624089717865 and parameters: {'fp_type': 'morgan', 'morgan_only_radius': 3, 'morgan_only_nBits': 2048, 'num_hidden_layers': 3, 'hidden_dim_0': 512, 'hidden_dim_1': 64, 'hidden_dim_2': 64, 'kl_weight': 0.0002573192385762634, 'lr': 0.0023050460278820056, 'batch_size': 32, 'dropout_rate': 0.4922712485711632, 'prior_mu': -0.05151085700995515, 'prior_sigma': 0.05477857802159582, 'normalization': 'none'}. Best is trial 272 with value: 0.5198344707489013.
Generating morgan fingerprints...
Generated fingerprints with 1024 features for 900 molecules
Data shape: X=(900, 1024), y=(900,)
Trial 1096: 5-fold CV loss = 0.6938
[I 2025-08-07 22:08:51,117] Trial 1096 finished with value: 0.6937814354896545 and parameters: {'fp_type': 'morgan', 'morgan_only_radius': 2, 'morgan_only_nBits': 1024, 'num_hidden_layers': 3, 'hidden_dim_0': 512, 'hidden_dim_1': 64, 'hidden_dim_2': 512, 'kl_weight': 0.00020405166434794424, 'lr': 0.0019427483793588469, 'batch_size': 64, 'dropout_rate': 0.4903801279461174, 'prior_mu': -0.045892005079031295, 'prior_sigma': 0.07074391898114968, 'normalization': 'none'}. Best is trial 272 with value: 0.5198344707489013.
Generating morgan fingerprints...
Generated fingerprints with 1024 features for 900 molecules
Data shape: X=(900, 1024), y=(900,)
Trial 1098: 5-fold CV loss = 0.8207
[I 2025-08-07 22:09:11,050] Trial 1098 finished with value: 0.8207185864448547 and parameters: {'fp_type': 'morgan', 'morgan_only_radius': 2, 'morgan_only_nBits': 1024, 'num_hidden_layers': 3, 'hidden_dim_0': 512, 'hidden_dim_1': 64, 'hidden_dim_2': 512, 'kl_weight': 0.00028830671453756556, 'lr': 0.001514078872192151, 'batch_size': 64, 'dropout_rate': 0.48614622203691593, 'prior_mu': -0.04617306010065175, 'prior_sigma': 0.07185661746552813, 'normalization': 'none'}. Best is trial 272 with value: 0.5198344707489013.
Generating morgan fingerprints...
Generated fingerprints with 1024 features for 900 molecules
Data shape: X=(900, 1024), y=(900,)
Trial 1095: 5-fold CV loss = 0.5277
[I 2025-08-07 22:09:24,191] Trial 1095 finished with value: 0.5276958167552948 and parameters: {'fp_type': 'morgan', 'morgan_only_radius': 2, 'morgan_only_nBits': 2048, 'num_hidden_layers': 3, 'hidden_dim_0': 512, 'hidden_dim_1': 128, 'hidden_dim_2': 512, 'kl_weight': 0.0002788006543067067, 'lr': 0.002398490904913432, 'batch_size': 32, 'dropout_rate': 0.4903950606851502, 'prior_mu': -0.050242891628206984, 'prior_sigma': 0.058673318509469725, 'normalization': 'none'}. Best is trial 272 with value: 0.5198344707489013.
Generating morgan fingerprints...
Generated fingerprints with 1024 features for 900 molecules
Data shape: X=(900, 1024), y=(900,)
Trial 1097: 5-fold CV loss = 0.7365
[I 2025-08-07 22:10:10,257] Trial 1097 finished with value: 0.736510407924652 and parameters: {'fp_type': 'morgan', 'morgan_only_radius': 2, 'morgan_only_nBits': 1024, 'num_hidden_layers': 3, 'hidden_dim_0': 512, 'hidden_dim_1': 64, 'hidden_dim_2': 512, 'kl_weight': 0.0001913006116108231, 'lr': 0.0018623260841390214, 'batch_size': 64, 'dropout_rate': 0.4899554671999509, 'prior_mu': -0.04663093966777038, 'prior_sigma': 0.07017415608212536, 'normalization': 'none'}. Best is trial 272 with value: 0.5198344707489013.
Generating morgan fingerprints...
Generated fingerprints with 1024 features for 900 molecules
Data shape: X=(900, 1024), y=(900,)
Trial 1099: 5-fold CV loss = 0.5286
[I 2025-08-07 22:10:26,699] Trial 1099 finished with value: 0.5285703599452972 and parameters: {'fp_type': 'morgan', 'morgan_only_radius': 2, 'morgan_only_nBits': 1024, 'num_hidden_layers': 3, 'hidden_dim_0': 512, 'hidden_dim_1': 64, 'hidden_dim_2': 512, 'kl_weight': 0.0009597204713876365, 'lr': 0.001793380248156193, 'batch_size': 32, 'dropout_rate': 0.4847861699699087, 'prior_mu': -0.032877237596028695, 'prior_sigma': 0.07267740630743323, 'normalization': 'none'}. Best is trial 272 with value: 0.5198344707489013.
Generating morgan fingerprints...
Generated fingerprints with 1024 features for 900 molecules
Data shape: X=(900, 1024), y=(900,)
Trial 1101: 5-fold CV loss = 0.5353
