[I 2025-08-07 22:33:54,845] Trial 1164 finished with value: 0.6504637837409973 and parameters: {'fp_type': 'rdkit', 'rdkit_only_maxPath': 7, 'rdkit_only_nBits': 512, 'num_hidden_layers': 3, 'hidden_dim_0': 512, 'hidden_dim_1': 128, 'hidden_dim_2': 256, 'kl_weight': 0.000855689432083328, 'lr': 0.0021747809508729727, 'batch_size': 32, 'dropout_rate': 0.4816354708110127, 'prior_mu': -0.019371469534131717, 'prior_sigma': 0.06836393571852266, 'normalization': 'none'}. Best is trial 272 with value: 0.5198344707489013.
Generating morgan fingerprints...
Generated fingerprints with 2048 features for 900 molecules
Data shape: X=(900, 2048), y=(900,)
Trial 1165: 5-fold CV loss = 0.6441
[I 2025-08-07 22:34:32,253] Trial 1165 finished with value: 0.6441028118133545 and parameters: {'fp_type': 'rdkit', 'rdkit_only_maxPath': 7, 'rdkit_only_nBits': 512, 'num_hidden_layers': 3, 'hidden_dim_0': 512, 'hidden_dim_1': 128, 'hidden_dim_2': 256, 'kl_weight': 0.0006554373682796527, 'lr': 0.0021762469390062497, 'batch_size': 32, 'dropout_rate': 0.48267807223323494, 'prior_mu': 0.0016641747422084362, 'prior_sigma': 0.06823955128246753, 'normalization': 'none'}. Best is trial 272 with value: 0.5198344707489013.
Generating morgan fingerprints...
Generated fingerprints with 2048 features for 900 molecules
Data shape: X=(900, 2048), y=(900,)
Trial 1166: 5-fold CV loss = 0.5589
[I 2025-08-07 22:34:53,473] Trial 1166 finished with value: 0.5588503420352936 and parameters: {'fp_type': 'morgan', 'morgan_only_radius': 2, 'morgan_only_nBits': 2048, 'num_hidden_layers': 3, 'hidden_dim_0': 64, 'hidden_dim_1': 128, 'hidden_dim_2': 512, 'kl_weight': 0.0007939272175834196, 'lr': 0.0022393971513291586, 'batch_size': 32, 'dropout_rate': 0.484118606227856, 'prior_mu': 0.0010888245517324075, 'prior_sigma': 0.06442451849800651, 'normalization': 'none'}. Best is trial 272 with value: 0.5198344707489013.
Generating morgan fingerprints...
Generated fingerprints with 2048 features for 900 molecules
Data shape: X=(900, 2048), y=(900,)
Trial 1167: 5-fold CV loss = 0.5572
[I 2025-08-07 22:34:57,012] Trial 1167 finished with value: 0.5572041690349578 and parameters: {'fp_type': 'morgan', 'morgan_only_radius': 2, 'morgan_only_nBits': 2048, 'num_hidden_layers': 3, 'hidden_dim_0': 512, 'hidden_dim_1': 128, 'hidden_dim_2': 512, 'kl_weight': 0.000895741711010348, 'lr': 0.0022793062285483283, 'batch_size': 32, 'dropout_rate': 0.21002181962607186, 'prior_mu': 0.0005808130515099858, 'prior_sigma': 0.05423712201831847, 'normalization': 'none'}. Best is trial 272 with value: 0.5198344707489013.
Generating morgan fingerprints...
Generated fingerprints with 2048 features for 900 molecules
Data shape: X=(900, 2048), y=(900,)
Trial 1168: 5-fold CV loss = 0.5727
[I 2025-08-07 22:36:10,947] Trial 1168 finished with value: 0.5727304458618164 and parameters: {'fp_type': 'morgan', 'morgan_only_radius': 2, 'morgan_only_nBits': 2048, 'num_hidden_layers': 3, 'hidden_dim_0': 512, 'hidden_dim_1': 128, 'hidden_dim_2': 512, 'kl_weight': 0.0008608672442537726, 'lr': 0.0018217036961662909, 'batch_size': 32, 'dropout_rate': 0.4859082643565676, 'prior_mu': 0.008716107201414513, 'prior_sigma': 0.05055315877035715, 'normalization': 'none'}. Best is trial 272 with value: 0.5198344707489013.
Generating morgan_rdkit fingerprints...
Generated fingerprints with 768 features for 900 molecules
Data shape: X=(900, 768), y=(900,)
Trial 1170: 5-fold CV loss = 0.5608
[I 2025-08-07 22:36:14,825] Trial 1170 finished with value: 0.5608280658721924 and parameters: {'fp_type': 'morgan', 'morgan_only_radius': 2, 'morgan_only_nBits': 2048, 'num_hidden_layers': 3, 'hidden_dim_0': 256, 'hidden_dim_1': 128, 'hidden_dim_2': 512, 'kl_weight': 0.0009893546917216763, 'lr': 0.0019215877489040314, 'batch_size': 32, 'dropout_rate': 0.4534564534432999, 'prior_mu': 0.012551905767822134, 'prior_sigma': 0.06420792302758868, 'normalization': 'none'}. Best is trial 272 with value: 0.5198344707489013.
Generating morgan_rdkit fingerprints...
Generated fingerprints with 768 features for 900 molecules
Data shape: X=(900, 768), y=(900,)
Trial 1169: 5-fold CV loss = 0.5386
[I 2025-08-07 22:36:36,728] Trial 1169 finished with value: 0.5385611176490783 and parameters: {'fp_type': 'morgan', 'morgan_only_radius': 2, 'morgan_only_nBits': 2048, 'num_hidden_layers': 3, 'hidden_dim_0': 256, 'hidden_dim_1': 128, 'hidden_dim_2': 512, 'kl_weight': 0.0007914190370191145, 'lr': 0.001969324616307515, 'batch_size': 32, 'dropout_rate': 0.4732580630379066, 'prior_mu': -0.007032336739599597, 'prior_sigma': 0.06385565747956722, 'normalization': 'none'}. Best is trial 272 with value: 0.5198344707489013.
Generating morgan_rdkit fingerprints...
Generated fingerprints with 768 features for 900 molecules
Data shape: X=(900, 768), y=(900,)
Trial 1160: 5-fold CV loss = 0.5405
[I 2025-08-07 22:36:53,283] Trial 1160 finished with value: 0.5404953539371491 and parameters: {'fp_type': 'morgan', 'morgan_only_radius': 2, 'morgan_only_nBits': 2048, 'num_hidden_layers': 3, 'hidden_dim_0': 128, 'hidden_dim_1': 128, 'hidden_dim_2': 512, 'kl_weight': 0.0006731299478672724, 'lr': 0.002028271844267302, 'batch_size': 32, 'dropout_rate': 0.4706493971642946, 'prior_mu': -0.017875693153347246, 'prior_sigma': 0.06809676097086782, 'normalization': 'none'}. Best is trial 272 with value: 0.5198344707489013.
Generating morgan_rdkit fingerprints...
Generated fingerprints with 768 features for 900 molecules
Data shape: X=(900, 768), y=(900,)
Trial 1171: 5-fold CV loss = 0.7458
[I 2025-08-07 22:37:08,710] Trial 1171 finished with value: 0.7457993626594543 and parameters: {'fp_type': 'morgan_rdkit', 'combined_morgan_radius': 3, 'combined_morgan_nBits': 512, 'combined_rdkit_maxPath': 7, 'combined_rdkit_nBits': 256, 'num_hidden_layers': 3, 'hidden_dim_0': 256, 'hidden_dim_1': 128, 'hidden_dim_2': 512, 'kl_weight': 0.0003653957045792348, 'lr': 0.0009002721461282274, 'batch_size': 32, 'dropout_rate': 0.4522137018118578, 'prior_mu': -0.019562628683882394, 'prior_sigma': 0.06420374213868484, 'normalization': 'none'}. Best is trial 272 with value: 0.5198344707489013.
Generating morgan fingerprints...
Generated fingerprints with 2048 features for 900 molecules
Data shape: X=(900, 2048), y=(900,)
Trial 1172: 5-fold CV loss = 0.5650
[I 2025-08-07 22:37:41,185] Trial 1172 finished with value: 0.5649958789348603 and parameters: {'fp_type': 'morgan_rdkit', 'combined_morgan_radius': 3, 'combined_morgan_nBits': 512, 'combined_rdkit_maxPath': 7, 'combined_rdkit_nBits': 256, 'num_hidden_layers': 3, 'hidden_dim_0': 512, 'hidden_dim_1': 128, 'hidden_dim_2': 512, 'kl_weight': 0.001177616831636737, 'lr': 0.002333874690121438, 'batch_size': 32, 'dropout_rate': 0.47215810432699784, 'prior_mu': -0.020131046330333097, 'prior_sigma': 0.06449354896890196, 'normalization': 'none'}. Best is trial 272 with value: 0.5198344707489013.
Generating morgan fingerprints...
Generated fingerprints with 2048 features for 900 molecules
Data shape: X=(900, 2048), y=(900,)
Trial 1173: 5-fold CV loss = 0.5522
[I 2025-08-07 22:37:47,239] Trial 1173 finished with value: 0.5522222399711609 and parameters: {'fp_type': 'morgan_rdkit', 'combined_morgan_radius': 3, 'combined_morgan_nBits': 512, 'combined_rdkit_maxPath': 7, 'combined_rdkit_nBits': 256, 'num_hidden_layers': 3, 'hidden_dim_0': 512, 'hidden_dim_1': 128, 'hidden_dim_2': 512, 'kl_weight': 0.001305166170547547, 'lr': 0.002373260793352933, 'batch_size': 32, 'dropout_rate': 0.1443525573353608, 'prior_mu': -0.016439780416812683, 'prior_sigma': 0.06930120668669491, 'normalization': 'none'}. Best is trial 272 with value: 0.5198344707489013.
Generating morgan fingerprints...
Generated fingerprints with 2048 features for 900 molecules
Data shape: X=(900, 2048), y=(900,)
Trial 1176: 5-fold CV loss = 0.6522
[I 2025-08-07 22:38:13,865] Trial 1176 finished with value: 0.6522141575813294 and parameters: {'fp_type': 'morgan', 'morgan_only_radius': 2, 'morgan_only_nBits': 2048, 'num_hidden_layers': 2, 'hidden_dim_0': 512, 'hidden_dim_1': 256, 'kl_weight': 0.0005051521565396724, 'lr': 0.0003649536224775811, 'batch_size': 32, 'dropout_rate': 0.4902857045146677, 'prior_mu': -0.010514285742549334, 'prior_sigma': 0.07054582273654147, 'normalization': 'none'}. Best is trial 272 with value: 0.5198344707489013.
Generating morgan fingerprints...
Generated fingerprints with 2048 features for 900 molecules
Data shape: X=(900, 2048), y=(900,)
Trial 1178: 5-fold CV loss = 0.7171
[I 2025-08-07 22:38:22,849] Trial 1178 finished with value: 0.7171106338500977 and parameters: {'fp_type': 'morgan', 'morgan_only_radius': 2, 'morgan_only_nBits': 2048, 'num_hidden_layers': 3, 'hidden_dim_0': 512, 'hidden_dim_1': 128, 'hidden_dim_2': 512, 'kl_weight': 0.0007471879897896465, 'lr': 0.0018502966420395276, 'batch_size': 128, 'dropout_rate': 0.4907752061131527, 'prior_mu': 0.027155315386077968, 'prior_sigma': 0.06045287994685842, 'normalization': 'none'}. Best is trial 272 with value: 0.5198344707489013.
Generating morgan fingerprints...
Generated fingerprints with 2048 features for 900 molecules
Data shape: X=(900, 2048), y=(900,)
Trial 1177: 5-fold CV loss = 0.7931
[I 2025-08-07 22:38:48,607] Trial 1177 finished with value: 0.7931434869766235 and parameters: {'fp_type': 'morgan', 'morgan_only_radius': 2, 'morgan_only_nBits': 2048, 'num_hidden_layers': 3, 'hidden_dim_0': 512, 'hidden_dim_1': 256, 'hidden_dim_2': 512, 'kl_weight': 0.0007913345210300527, 'lr': 0.0017252811257034038, 'batch_size': 32, 'dropout_rate': 0.4908725864900735, 'prior_mu': 0.02454188484973699, 'prior_sigma': 0.06030619752307297, 'normalization': 'none'}. Best is trial 272 with value: 0.5198344707489013.
Generating morgan fingerprints...
Generated fingerprints with 2048 features for 900 molecules
Data shape: X=(900, 2048), y=(900,)
Trial 1179: 5-fold CV loss = 0.6953
[I 2025-08-07 22:39:01,584] Trial 1179 finished with value: 0.6953277587890625 and parameters: {'fp_type': 'morgan', 'morgan_only_radius': 2, 'morgan_only_nBits': 2048, 'num_hidden_layers': 3, 'hidden_dim_0': 512, 'hidden_dim_1': 128, 'hidden_dim_2': 512, 'kl_weight': 0.0010212801558678389, 'lr': 0.0013445689461307891, 'batch_size': 32, 'dropout_rate': 0.47964022213998075, 'prior_mu': -0.0011207558578994296, 'prior_sigma': 0.05378058844086857, 'normalization': 'none'}. Best is trial 272 with value: 0.5198344707489013.
Generating morgan fingerprints...
Generated fingerprints with 2048 features for 900 molecules
Data shape: X=(900, 2048), y=(900,)
Trial 1175: 5-fold CV loss = 0.5278
[I 2025-08-07 22:39:12,270] Trial 1175 finished with value: 0.5278266727924347 and parameters: {'fp_type': 'morgan', 'morgan_only_radius': 2, 'morgan_only_nBits': 2048, 'num_hidden_layers': 3, 'hidden_dim_0': 512, 'hidden_dim_1': 256, 'hidden_dim_2': 512, 'kl_weight': 0.0011085142650433262, 'lr': 0.002362602724563467, 'batch_size': 32, 'dropout_rate': 0.49035676681409096, 'prior_mu': -0.011158140686273348, 'prior_sigma': 0.07016545734856185, 'normalization': 'none'}. Best is trial 272 with value: 0.5198344707489013.
Generating morgan fingerprints...
Generated fingerprints with 2048 features for 900 molecules
Data shape: X=(900, 2048), y=(900,)
Trial 1180: 5-fold CV loss = 0.9980
[I 2025-08-07 22:39:20,267] Trial 1180 finished with value: 0.9980274319648743 and parameters: {'fp_type': 'morgan', 'morgan_only_radius': 2, 'morgan_only_nBits': 2048, 'num_hidden_layers': 3, 'hidden_dim_0': 512, 'hidden_dim_1': 1024, 'hidden_dim_2': 512, 'kl_weight': 0.00025225671405779143, 'lr': 0.0014201745117350172, 'batch_size': 32, 'dropout_rate': 0.46402031141461, 'prior_mu': -0.004503939033120379, 'prior_sigma': 0.053659069901417604, 'normalization': 'none'}. Best is trial 272 with value: 0.5198344707489013.
Generating morgan fingerprints...
Generated fingerprints with 2048 features for 900 molecules
Data shape: X=(900, 2048), y=(900,)
Trial 1182: 5-fold CV loss = 0.9341
[I 2025-08-07 22:39:32,099] Trial 1182 finished with value: 0.9340800404548645 and parameters: {'fp_type': 'morgan', 'morgan_only_radius': 2, 'morgan_only_nBits': 2048, 'num_hidden_layers': 3, 'hidden_dim_0': 512, 'hidden_dim_1': 128, 'hidden_dim_2': 512, 'kl_weight': 0.00026269395883006644, 'lr': 0.0021402952328476994, 'batch_size': 64, 'dropout_rate': 0.4623234398694742, 'prior_mu': 0.009282031906916606, 'prior_sigma': 0.06539008491918134, 'normalization': 'none'}. Best is trial 272 with value: 0.5198344707489013.
Generating morgan fingerprints...
Generated fingerprints with 2048 features for 900 molecules
Data shape: X=(900, 2048), y=(900,)
Trial 1183: 5-fold CV loss = 0.7910
[I 2025-08-07 22:39:50,392] Trial 1183 finished with value: 0.790994381904602 and parameters: {'fp_type': 'morgan', 'morgan_only_radius': 2, 'morgan_only_nBits': 2048, 'num_hidden_layers': 3, 'hidden_dim_0': 512, 'hidden_dim_1': 128, 'hidden_dim_2': 512, 'kl_weight': 0.0005875469913526584, 'lr': 0.0021476294774155093, 'batch_size': 64, 'dropout_rate': 0.478142941645439, 'prior_mu': -0.023141405162103713, 'prior_sigma': 0.06548365635264664, 'normalization': 'none'}. Best is trial 272 with value: 0.5198344707489013.
Generating morgan fingerprints...
Generated fingerprints with 2048 features for 900 molecules
Data shape: X=(900, 2048), y=(900,)
Trial 1181: 5-fold CV loss = 0.5234
[I 2025-08-07 22:40:17,403] Trial 1181 finished with value: 0.5234078586101532 and parameters: {'fp_type': 'morgan', 'morgan_only_radius': 2, 'morgan_only_nBits': 2048, 'num_hidden_layers': 3, 'hidden_dim_0': 512, 'hidden_dim_1': 128, 'hidden_dim_2': 512, 'kl_weight': 0.00023209420322972606, 'lr': 0.0021582517008620766, 'batch_size': 32, 'dropout_rate': 0.46165718583020626, 'prior_mu': -0.023556059766975092, 'prior_sigma': 0.06616052084606834, 'normalization': 'none'}. Best is trial 272 with value: 0.5198344707489013.
Generating morgan fingerprints...
Generated fingerprints with 2048 features for 900 molecules
Data shape: X=(900, 2048), y=(900,)
Trial 1184: 5-fold CV loss = 0.5521
[I 2025-08-07 22:41:12,417] Trial 1184 finished with value: 0.5520646333694458 and parameters: {'fp_type': 'morgan', 'morgan_only_radius': 2, 'morgan_only_nBits': 2048, 'num_hidden_layers': 3, 'hidden_dim_0': 512, 'hidden_dim_1': 128, 'hidden_dim_2': 512, 'kl_weight': 0.0005745251862450237, 'lr': 0.002523799929907554, 'batch_size': 32, 'dropout_rate': 0.4006601390499104, 'prior_mu': -0.023459410520945505, 'prior_sigma': 0.12748916472700328, 'normalization': 'none'}. Best is trial 272 with value: 0.5198344707489013.
Generating morgan fingerprints...
Generated fingerprints with 2048 features for 900 molecules
Data shape: X=(900, 2048), y=(900,)
Trial 1185: 5-fold CV loss = 0.5287
[I 2025-08-07 22:41:15,160] Trial 1185 finished with value: 0.5287074029445649 and parameters: {'fp_type': 'morgan', 'morgan_only_radius': 2, 'morgan_only_nBits': 2048, 'num_hidden_layers': 3, 'hidden_dim_0': 512, 'hidden_dim_1': 128, 'hidden_dim_2': 512, 'kl_weight': 0.005352294337037719, 'lr': 0.002512453615341077, 'batch_size': 32, 'dropout_rate': 0.48241992190409805, 'prior_mu': -0.012504099874220548, 'prior_sigma': 0.06060853735656546, 'normalization': 'none'}. Best is trial 272 with value: 0.5198344707489013.
Generating morgan fingerprints...
Generated fingerprints with 2048 features for 900 molecules
Data shape: X=(900, 2048), y=(900,)
Trial 1186: 5-fold CV loss = 0.5256
[I 2025-08-07 22:41:17,326] Trial 1186 finished with value: 0.5255854785442352 and parameters: {'fp_type': 'morgan', 'morgan_only_radius': 2, 'morgan_only_nBits': 2048, 'num_hidden_layers': 3, 'hidden_dim_0': 512, 'hidden_dim_1': 128, 'hidden_dim_2': 512, 'kl_weight': 0.0003005415055438498, 'lr': 0.002541050653732215, 'batch_size': 32, 'dropout_rate': 0.4482593194404149, 'prior_mu': -0.011201047985727176, 'prior_sigma': 0.061298207541066456, 'normalization': 'none'}. Best is trial 272 with value: 0.5198344707489013.
Generating morgan fingerprints...
Generated fingerprints with 2048 features for 900 molecules
Data shape: X=(900, 2048), y=(900,)
Trial 1188: 5-fold CV loss = 0.5469
[I 2025-08-07 22:41:50,754] Trial 1188 finished with value: 0.5468843042850494 and parameters: {'fp_type': 'morgan', 'morgan_only_radius': 2, 'morgan_only_nBits': 2048, 'num_hidden_layers': 3, 'hidden_dim_0': 512, 'hidden_dim_1': 128, 'hidden_dim_2': 512, 'kl_weight': 0.00021429290600220245, 'lr': 0.0027462190092359686, 'batch_size': 32, 'dropout_rate': 0.4506933878962271, 'prior_mu': -0.0018141681989887436, 'prior_sigma': 0.014332647052789388, 'normalization': 'layer'}. Best is trial 272 with value: 0.5198344707489013.
Generating morgan fingerprints...
Generated fingerprints with 2048 features for 900 molecules
Data shape: X=(900, 2048), y=(900,)
Trial 1174: 5-fold CV loss = 0.5645
[I 2025-08-07 22:42:18,669] Trial 1174 finished with value: 0.5644626200199128 and parameters: {'fp_type': 'morgan_rdkit', 'combined_morgan_radius': 3, 'combined_morgan_nBits': 512, 'combined_rdkit_maxPath': 7, 'combined_rdkit_nBits': 256, 'num_hidden_layers': 3, 'hidden_dim_0': 512, 'hidden_dim_1': 128, 'hidden_dim_2': 512, 'kl_weight': 0.0007394266932060851, 'lr': 0.0023657683835666497, 'batch_size': 32, 'dropout_rate': 0.49097332869861643, 'prior_mu': -0.021324559624452046, 'prior_sigma': 0.06146970962803722, 'normalization': 'none'}. Best is trial 272 with value: 0.5198344707489013.
Generating morgan fingerprints...
Generated fingerprints with 2048 features for 900 molecules
Data shape: X=(900, 2048), y=(900,)
Trial 1189: 5-fold CV loss = 0.5293
[I 2025-08-07 22:42:25,086] Trial 1189 finished with value: 0.5292876422405243 and parameters: {'fp_type': 'morgan', 'morgan_only_radius': 2, 'morgan_only_nBits': 2048, 'num_hidden_layers': 3, 'hidden_dim_0': 512, 'hidden_dim_1': 128, 'hidden_dim_2': 512, 'kl_weight': 0.00022339088066232005, 'lr': 0.0023777589639747292, 'batch_size': 32, 'dropout_rate': 0.43458389641735606, 'prior_mu': 0.0022746495391666047, 'prior_sigma': 0.05741486537468519, 'normalization': 'none'}. Best is trial 272 with value: 0.5198344707489013.
Generating morgan fingerprints...
Generated fingerprints with 2048 features for 900 molecules
Data shape: X=(900, 2048), y=(900,)
Trial 1187: 5-fold CV loss = 0.5251
[I 2025-08-07 22:43:04,499] Trial 1187 finished with value: 0.5250926673412323 and parameters: {'fp_type': 'morgan', 'morgan_only_radius': 2, 'morgan_only_nBits': 2048, 'num_hidden_layers': 3, 'hidden_dim_0': 512, 'hidden_dim_1': 128, 'hidden_dim_2': 512, 'kl_weight': 0.00023828635834913486, 'lr': 0.002506402052247282, 'batch_size': 32, 'dropout_rate': 0.4500377934893435, 'prior_mu': -0.01208928387953526, 'prior_sigma': 0.06084214685909055, 'normalization': 'none'}. Best is trial 272 with value: 0.5198344707489013.
Generating morgan fingerprints...
Generated fingerprints with 2048 features for 900 molecules
Data shape: X=(900, 2048), y=(900,)
Trial 1190: 5-fold CV loss = 0.5281
[I 2025-08-07 22:43:18,791] Trial 1190 finished with value: 0.5281082689762115 and parameters: {'fp_type': 'morgan', 'morgan_only_radius': 2, 'morgan_only_nBits': 2048, 'num_hidden_layers': 3, 'hidden_dim_0': 512, 'hidden_dim_1': 128, 'hidden_dim_2': 512, 'kl_weight': 0.0002204284335068382, 'lr': 0.0023292090133206606, 'batch_size': 32, 'dropout_rate': 0.4382367522908785, 'prior_mu': 0.0038783254065161005, 'prior_sigma': 0.05605182505855376, 'normalization': 'none'}. Best is trial 272 with value: 0.5198344707489013.
Generating morgan fingerprints...
Generated fingerprints with 2048 features for 900 molecules
Data shape: X=(900, 2048), y=(900,)
Trial 1192: 5-fold CV loss = 0.5247
[I 2025-08-07 22:43:38,880] Trial 1192 finished with value: 0.5246810019016266 and parameters: {'fp_type': 'morgan', 'morgan_only_radius': 2, 'morgan_only_nBits': 2048, 'num_hidden_layers': 3, 'hidden_dim_0': 512, 'hidden_dim_1': 128, 'hidden_dim_2': 512, 'kl_weight': 0.00024047976526667488, 'lr': 0.002151493444841565, 'batch_size': 32, 'dropout_rate': 0.4321752381070899, 'prior_mu': 0.01717257768434395, 'prior_sigma': 0.06400041618359689, 'normalization': 'none'}. Best is trial 272 with value: 0.5198344707489013.
Generating morgan fingerprints...
Generated fingerprints with 2048 features for 900 molecules
Data shape: X=(900, 2048), y=(900,)
Trial 1195: 5-fold CV loss = 0.5709
[I 2025-08-07 22:44:38,450] Trial 1195 finished with value: 0.570864349603653 and parameters: {'fp_type': 'morgan', 'morgan_only_radius': 2, 'morgan_only_nBits': 2048, 'num_hidden_layers': 3, 'hidden_dim_0': 64, 'hidden_dim_1': 128, 'hidden_dim_2': 512, 'kl_weight': 0.00016728530654467862, 'lr': 0.0019097424707402214, 'batch_size': 32, 'dropout_rate': 0.4577758778781318, 'prior_mu': -0.005391979283627335, 'prior_sigma': 0.06619028759864765, 'normalization': 'none'}. Best is trial 272 with value: 0.5198344707489013.
Generating morgan fingerprints...
Generated fingerprints with 2048 features for 900 molecules
Data shape: X=(900, 2048), y=(900,)
Trial 1194: 5-fold CV loss = 0.5255
[I 2025-08-07 22:44:58,026] Trial 1194 finished with value: 0.5255336284637451 and parameters: {'fp_type': 'morgan', 'morgan_only_radius': 2, 'morgan_only_nBits': 2048, 'num_hidden_layers': 3, 'hidden_dim_0': 512, 'hidden_dim_1': 128, 'hidden_dim_2': 512, 'kl_weight': 0.0002660836470052897, 'lr': 0.0019264776126166182, 'batch_size': 32, 'dropout_rate': 0.4595784157368639, 'prior_mu': 0.012378447839854364, 'prior_sigma': 0.06615272809569431, 'normalization': 'none'}. Best is trial 272 with value: 0.5198344707489013.
Generating morgan fingerprints...
Generated fingerprints with 2048 features for 900 molecules
Data shape: X=(900, 2048), y=(900,)
Trial 1193: 5-fold CV loss = 0.5213
