[I 2025-08-07 19:25:15,526] Trial 656 finished with value: 1.0181483507156373 and parameters: {'fp_type': 'morgan', 'morgan_only_radius': 2, 'morgan_only_nBits': 1024, 'num_hidden_layers': 3, 'hidden_dim_0': 512, 'hidden_dim_1': 128, 'hidden_dim_2': 512, 'kl_weight': 0.0018530339433935163, 'lr': 0.00018100116847662295, 'batch_size': 32, 'dropout_rate': 0.4607086747279397, 'prior_mu': -0.008567097124502553, 'prior_sigma': 0.07003903266095361, 'normalization': 'none'}. Best is trial 272 with value: 0.5198344707489013.
Generating morgan fingerprints...
Generated fingerprints with 1024 features for 900 molecules
Data shape: X=(900, 1024), y=(900,)
Trial 657: 5-fold CV loss = 1.1852
[I 2025-08-07 19:25:30,066] Trial 657 finished with value: 1.1851830720901488 and parameters: {'fp_type': 'morgan', 'morgan_only_radius': 2, 'morgan_only_nBits': 1024, 'num_hidden_layers': 3, 'hidden_dim_0': 512, 'hidden_dim_1': 128, 'hidden_dim_2': 512, 'kl_weight': 0.0015887239774313416, 'lr': 0.0003212103348771051, 'batch_size': 32, 'dropout_rate': 0.4890488787040128, 'prior_mu': -0.00978377369564842, 'prior_sigma': 0.06789591045648727, 'normalization': 'none'}. Best is trial 272 with value: 0.5198344707489013.
Generating morgan fingerprints...
Generated fingerprints with 1024 features for 900 molecules
Data shape: X=(900, 1024), y=(900,)
Trial 653: 5-fold CV loss = 0.5300
[I 2025-08-07 19:25:31,446] Trial 653 finished with value: 0.5300485074520112 and parameters: {'fp_type': 'morgan', 'morgan_only_radius': 2, 'morgan_only_nBits': 1024, 'num_hidden_layers': 3, 'hidden_dim_0': 512, 'hidden_dim_1': 128, 'hidden_dim_2': 512, 'kl_weight': 0.001438000931242016, 'lr': 0.002373674006526286, 'batch_size': 32, 'dropout_rate': 0.4894799708213842, 'prior_mu': -0.010457764385563631, 'prior_sigma': 0.07381534397977191, 'normalization': 'none'}. Best is trial 272 with value: 0.5198344707489013.
Generating morgan fingerprints...
Generated fingerprints with 1024 features for 900 molecules
Data shape: X=(900, 1024), y=(900,)
Trial 658: 5-fold CV loss = 0.9552
[I 2025-08-07 19:25:35,199] Trial 658 finished with value: 0.955176854133606 and parameters: {'fp_type': 'morgan', 'morgan_only_radius': 2, 'morgan_only_nBits': 1024, 'num_hidden_layers': 3, 'hidden_dim_0': 512, 'hidden_dim_1': 128, 'hidden_dim_2': 512, 'kl_weight': 0.001442458480155451, 'lr': 0.0013902335395786117, 'batch_size': 32, 'dropout_rate': 0.4891756877174633, 'prior_mu': -0.024777446771900906, 'prior_sigma': 0.06726385701100827, 'normalization': 'none'}. Best is trial 272 with value: 0.5198344707489013.
Generating morgan fingerprints...
Generated fingerprints with 1024 features for 900 molecules
Data shape: X=(900, 1024), y=(900,)
Trial 651: 5-fold CV loss = 0.6154
[I 2025-08-07 19:26:10,104] Trial 651 finished with value: 0.6154337763786316 and parameters: {'fp_type': 'morgan', 'morgan_only_radius': 2, 'morgan_only_nBits': 1024, 'num_hidden_layers': 3, 'hidden_dim_0': 512, 'hidden_dim_1': 128, 'hidden_dim_2': 512, 'kl_weight': 0.0002725461781717899, 'lr': 0.0013518561062077685, 'batch_size': 32, 'dropout_rate': 0.48937214863417533, 'prior_mu': -0.06795985752536839, 'prior_sigma': 0.06499109040591326, 'normalization': 'none'}. Best is trial 272 with value: 0.5198344707489013.
Generating morgan fingerprints...
Generated fingerprints with 1024 features for 900 molecules
Data shape: X=(900, 1024), y=(900,)
Trial 661: 5-fold CV loss = 0.5325
[I 2025-08-07 19:26:36,867] Trial 661 finished with value: 0.5325357735157012 and parameters: {'fp_type': 'morgan', 'morgan_only_radius': 2, 'morgan_only_nBits': 1024, 'num_hidden_layers': 3, 'hidden_dim_0': 512, 'hidden_dim_1': 128, 'hidden_dim_2': 512, 'kl_weight': 0.0027773505919132303, 'lr': 0.002739249240433096, 'batch_size': 32, 'dropout_rate': 0.47352715757818614, 'prior_mu': -0.01924494427111679, 'prior_sigma': 0.06258077937362069, 'normalization': 'none'}. Best is trial 272 with value: 0.5198344707489013.
Generating morgan fingerprints...
Generated fingerprints with 1024 features for 900 molecules
Data shape: X=(900, 1024), y=(900,)
Trial 660: 5-fold CV loss = 0.5675
[I 2025-08-07 19:26:56,616] Trial 660 finished with value: 0.5675127983093262 and parameters: {'fp_type': 'morgan', 'morgan_only_radius': 2, 'morgan_only_nBits': 1024, 'num_hidden_layers': 3, 'hidden_dim_0': 512, 'hidden_dim_1': 128, 'hidden_dim_2': 512, 'kl_weight': 0.07935247076847654, 'lr': 0.0027858142185374305, 'batch_size': 32, 'dropout_rate': 0.4747553968935806, 'prior_mu': -0.020764014890094336, 'prior_sigma': 0.06460344210395275, 'normalization': 'layer'}. Best is trial 272 with value: 0.5198344707489013.
Generating morgan fingerprints...
Generated fingerprints with 1024 features for 900 molecules
Data shape: X=(900, 1024), y=(900,)
Trial 659: 5-fold CV loss = 0.5285
[I 2025-08-07 19:26:57,390] Trial 659 finished with value: 0.5285001337528229 and parameters: {'fp_type': 'morgan', 'morgan_only_radius': 2, 'morgan_only_nBits': 1024, 'num_hidden_layers': 3, 'hidden_dim_0': 512, 'hidden_dim_1': 128, 'hidden_dim_2': 512, 'kl_weight': 0.0014427434897684272, 'lr': 0.00230020535436627, 'batch_size': 32, 'dropout_rate': 0.47465602529336276, 'prior_mu': -0.025540951443051255, 'prior_sigma': 0.06321839704928611, 'normalization': 'none'}. Best is trial 272 with value: 0.5198344707489013.
Generating morgan fingerprints...
Generated fingerprints with 1024 features for 900 molecules
Data shape: X=(900, 1024), y=(900,)
Trial 663: 5-fold CV loss = 0.5356
[I 2025-08-07 19:27:33,714] Trial 663 finished with value: 0.5356177091598511 and parameters: {'fp_type': 'morgan', 'morgan_only_radius': 2, 'morgan_only_nBits': 1024, 'num_hidden_layers': 3, 'hidden_dim_0': 128, 'hidden_dim_1': 128, 'hidden_dim_2': 512, 'kl_weight': 0.0008642182317752634, 'lr': 0.0022914561341050555, 'batch_size': 32, 'dropout_rate': 0.47908490605302445, 'prior_mu': -0.02576540335290879, 'prior_sigma': 0.06002441708338605, 'normalization': 'layer'}. Best is trial 272 with value: 0.5198344707489013.
Generating morgan fingerprints...
Generated fingerprints with 1024 features for 900 molecules
Data shape: X=(900, 1024), y=(900,)
Trial 665: 5-fold CV loss = 0.5642
[I 2025-08-07 19:28:13,289] Trial 665 finished with value: 0.5641688168048858 and parameters: {'fp_type': 'morgan', 'morgan_only_radius': 2, 'morgan_only_nBits': 1024, 'num_hidden_layers': 3, 'hidden_dim_0': 128, 'hidden_dim_1': 128, 'hidden_dim_2': 512, 'kl_weight': 0.0008983297313632083, 'lr': 0.0019818699509858984, 'batch_size': 32, 'dropout_rate': 0.46198639299864475, 'prior_mu': -0.04878140285798687, 'prior_sigma': 0.06954039794321795, 'normalization': 'none'}. Best is trial 272 with value: 0.5198344707489013.
Generating morgan fingerprints...
Generated fingerprints with 1024 features for 900 molecules
Data shape: X=(900, 1024), y=(900,)
Trial 666: 5-fold CV loss = 0.9594
[I 2025-08-07 19:28:35,220] Trial 666 finished with value: 0.9594175815582275 and parameters: {'fp_type': 'morgan', 'morgan_only_radius': 2, 'morgan_only_nBits': 1024, 'num_hidden_layers': 3, 'hidden_dim_0': 512, 'hidden_dim_1': 1024, 'hidden_dim_2': 512, 'kl_weight': 0.0009631105518373989, 'lr': 0.0019884179042407167, 'batch_size': 32, 'dropout_rate': 0.46558688521400554, 'prior_mu': -0.04792794006941379, 'prior_sigma': 0.06871886764098661, 'normalization': 'none'}. Best is trial 272 with value: 0.5198344707489013.
Generating morgan fingerprints...
Generated fingerprints with 1024 features for 900 molecules
Data shape: X=(900, 1024), y=(900,)
Trial 667: 5-fold CV loss = 0.6481
[I 2025-08-07 19:28:50,963] Trial 667 finished with value: 0.6480658769607544 and parameters: {'fp_type': 'morgan', 'morgan_only_radius': 2, 'morgan_only_nBits': 1024, 'num_hidden_layers': 2, 'hidden_dim_0': 512, 'hidden_dim_1': 128, 'kl_weight': 0.0018699093404587397, 'lr': 0.001721466010735893, 'batch_size': 32, 'dropout_rate': 0.49012886918910875, 'prior_mu': -0.036407796074345744, 'prior_sigma': 0.06780807042264772, 'normalization': 'none'}. Best is trial 272 with value: 0.5198344707489013.
Generating morgan fingerprints...
Generated fingerprints with 1024 features for 900 molecules
Data shape: X=(900, 1024), y=(900,)
Trial 668: 5-fold CV loss = 0.6698
[I 2025-08-07 19:29:16,155] Trial 668 finished with value: 0.6698179960250854 and parameters: {'fp_type': 'morgan', 'morgan_only_radius': 2, 'morgan_only_nBits': 1024, 'num_hidden_layers': 2, 'hidden_dim_0': 512, 'hidden_dim_1': 128, 'kl_weight': 0.0019030180678228205, 'lr': 0.001734848312136474, 'batch_size': 32, 'dropout_rate': 0.48420532842821173, 'prior_mu': -0.037483622199959016, 'prior_sigma': 0.061331090083128786, 'normalization': 'none'}. Best is trial 272 with value: 0.5198344707489013.
Generating morgan fingerprints...
Generated fingerprints with 1024 features for 900 molecules
Data shape: X=(900, 1024), y=(900,)
Trial 664: 5-fold CV loss = 0.5294
[I 2025-08-07 19:29:17,908] Trial 664 finished with value: 0.5294416069984436 and parameters: {'fp_type': 'morgan', 'morgan_only_radius': 2, 'morgan_only_nBits': 1024, 'num_hidden_layers': 3, 'hidden_dim_0': 512, 'hidden_dim_1': 128, 'hidden_dim_2': 512, 'kl_weight': 0.0009396612168056652, 'lr': 0.0022795433585191616, 'batch_size': 32, 'dropout_rate': 0.4652415535753845, 'prior_mu': -0.049385823796528026, 'prior_sigma': 0.06154982852258206, 'normalization': 'none'}. Best is trial 272 with value: 0.5198344707489013.
Generating morgan fingerprints...
Generated fingerprints with 1024 features for 900 molecules
Data shape: X=(900, 1024), y=(900,)
Trial 669: 5-fold CV loss = 0.5277
[I 2025-08-07 19:30:05,208] Trial 669 finished with value: 0.5276856124401093 and parameters: {'fp_type': 'morgan', 'morgan_only_radius': 2, 'morgan_only_nBits': 1024, 'num_hidden_layers': 3, 'hidden_dim_0': 512, 'hidden_dim_1': 128, 'hidden_dim_2': 512, 'kl_weight': 0.00029658788915921166, 'lr': 0.0025337392132242387, 'batch_size': 32, 'dropout_rate': 0.48491156006232533, 'prior_mu': -0.0005750311324076302, 'prior_sigma': 0.06048286578882913, 'normalization': 'none'}. Best is trial 272 with value: 0.5198344707489013.
Generating morgan fingerprints...
Generated fingerprints with 2048 features for 900 molecules
Data shape: X=(900, 2048), y=(900,)
Trial 670: 5-fold CV loss = 0.5350
[I 2025-08-07 19:30:24,561] Trial 670 finished with value: 0.5349734425544739 and parameters: {'fp_type': 'morgan', 'morgan_only_radius': 2, 'morgan_only_nBits': 1024, 'num_hidden_layers': 3, 'hidden_dim_0': 512, 'hidden_dim_1': 128, 'hidden_dim_2': 512, 'kl_weight': 0.0016069399382772458, 'lr': 0.0024831549246938723, 'batch_size': 32, 'dropout_rate': 0.4818228796893747, 'prior_mu': 0.0010873148838634527, 'prior_sigma': 0.08296465558874946, 'normalization': 'none'}. Best is trial 272 with value: 0.5198344707489013.
Generating morgan fingerprints...
Generated fingerprints with 2048 features for 900 molecules
Data shape: X=(900, 2048), y=(900,)
Trial 662: 5-fold CV loss = 0.5475
[I 2025-08-07 19:30:28,541] Trial 662 finished with value: 0.547485613822937 and parameters: {'fp_type': 'morgan', 'morgan_only_radius': 2, 'morgan_only_nBits': 1024, 'num_hidden_layers': 3, 'hidden_dim_0': 128, 'hidden_dim_1': 128, 'hidden_dim_2': 512, 'kl_weight': 0.0027830795062432495, 'lr': 0.002755349620554252, 'batch_size': 32, 'dropout_rate': 0.4751852810333032, 'prior_mu': -0.0282823211781564, 'prior_sigma': 0.061930992385619, 'normalization': 'none'}. Best is trial 272 with value: 0.5198344707489013.
Generating morgan fingerprints...
Generated fingerprints with 2048 features for 900 molecules
Data shape: X=(900, 2048), y=(900,)
Trial 671: 5-fold CV loss = 0.5303
[I 2025-08-07 19:31:19,807] Trial 671 finished with value: 0.5302784323692322 and parameters: {'fp_type': 'morgan', 'morgan_only_radius': 2, 'morgan_only_nBits': 1024, 'num_hidden_layers': 3, 'hidden_dim_0': 512, 'hidden_dim_1': 128, 'hidden_dim_2': 512, 'kl_weight': 0.0007276617443905003, 'lr': 0.002557186596769985, 'batch_size': 32, 'dropout_rate': 0.4833744902229148, 'prior_mu': -0.0028516216631153876, 'prior_sigma': 0.07248653180977761, 'normalization': 'none'}. Best is trial 272 with value: 0.5198344707489013.
Generating morgan fingerprints...
Generated fingerprints with 1024 features for 900 molecules
Data shape: X=(900, 1024), y=(900,)
Trial 673: 5-fold CV loss = 0.5312
[I 2025-08-07 19:31:36,828] Trial 673 finished with value: 0.5312267541885376 and parameters: {'fp_type': 'morgan', 'morgan_only_radius': 2, 'morgan_only_nBits': 2048, 'num_hidden_layers': 3, 'hidden_dim_0': 256, 'hidden_dim_1': 128, 'hidden_dim_2': 512, 'kl_weight': 0.0027104807001967386, 'lr': 0.003051841524315555, 'batch_size': 32, 'dropout_rate': 0.49294415940653186, 'prior_mu': -0.029797594095466274, 'prior_sigma': 0.05627746355408715, 'normalization': 'none'}. Best is trial 272 with value: 0.5198344707489013.
Generating morgan fingerprints...
Generated fingerprints with 1024 features for 900 molecules
Data shape: X=(900, 1024), y=(900,)
Trial 672: 5-fold CV loss = 0.5312
[I 2025-08-07 19:31:39,194] Trial 672 finished with value: 0.5312182664871216 and parameters: {'fp_type': 'morgan', 'morgan_only_radius': 2, 'morgan_only_nBits': 2048, 'num_hidden_layers': 3, 'hidden_dim_0': 512, 'hidden_dim_1': 128, 'hidden_dim_2': 512, 'kl_weight': 0.0026308072347965943, 'lr': 0.002116527873269349, 'batch_size': 32, 'dropout_rate': 0.4916446932958859, 'prior_mu': -0.030027017465750178, 'prior_sigma': 0.056194453521058195, 'normalization': 'none'}. Best is trial 272 with value: 0.5198344707489013.
Generating morgan fingerprints...
Generated fingerprints with 1024 features for 900 molecules
Data shape: X=(900, 1024), y=(900,)
Trial 677: 5-fold CV loss = 0.5491
[I 2025-08-07 19:32:41,597] Trial 677 finished with value: 0.5490856170654297 and parameters: {'fp_type': 'morgan', 'morgan_only_radius': 2, 'morgan_only_nBits': 1024, 'num_hidden_layers': 3, 'hidden_dim_0': 512, 'hidden_dim_1': 128, 'hidden_dim_2': 512, 'kl_weight': 0.001130325042654915, 'lr': 0.0018649913835458573, 'batch_size': 32, 'dropout_rate': 0.4579181989267721, 'prior_mu': -0.016224132926767776, 'prior_sigma': 0.034105011116917244, 'normalization': 'none'}. Best is trial 272 with value: 0.5198344707489013.
Generating morgan fingerprints...
Generated fingerprints with 1024 features for 900 molecules
Data shape: X=(900, 1024), y=(900,)
Trial 676: 5-fold CV loss = 0.5308
[I 2025-08-07 19:32:45,788] Trial 676 finished with value: 0.5308214843273162 and parameters: {'fp_type': 'morgan', 'morgan_only_radius': 2, 'morgan_only_nBits': 1024, 'num_hidden_layers': 3, 'hidden_dim_0': 512, 'hidden_dim_1': 128, 'hidden_dim_2': 512, 'kl_weight': 0.0011490380917090577, 'lr': 0.002066607146108578, 'batch_size': 32, 'dropout_rate': 0.4994218242730234, 'prior_mu': -0.014226102662358336, 'prior_sigma': 0.0754524438288971, 'normalization': 'none'}. Best is trial 272 with value: 0.5198344707489013.
Generating morgan fingerprints...
Generated fingerprints with 1024 features for 900 molecules
Data shape: X=(900, 1024), y=(900,)
Trial 675: 5-fold CV loss = 0.5264
[I 2025-08-07 19:33:24,177] Trial 675 finished with value: 0.5264422297477722 and parameters: {'fp_type': 'morgan', 'morgan_only_radius': 2, 'morgan_only_nBits': 1024, 'num_hidden_layers': 3, 'hidden_dim_0': 256, 'hidden_dim_1': 128, 'hidden_dim_2': 512, 'kl_weight': 0.0011572849404729157, 'lr': 0.003102201131196201, 'batch_size': 32, 'dropout_rate': 0.49139437095578076, 'prior_mu': -0.03956438031778469, 'prior_sigma': 0.055560347216806985, 'normalization': 'none'}. Best is trial 272 with value: 0.5198344707489013.
Generating morgan fingerprints...
Generated fingerprints with 1024 features for 900 molecules
Data shape: X=(900, 1024), y=(900,)
Trial 678: 5-fold CV loss = 0.5685
[I 2025-08-07 19:34:02,304] Trial 678 finished with value: 0.5685424268245697 and parameters: {'fp_type': 'morgan', 'morgan_only_radius': 2, 'morgan_only_nBits': 1024, 'num_hidden_layers': 3, 'hidden_dim_0': 512, 'hidden_dim_1': 128, 'hidden_dim_2': 512, 'kl_weight': 0.002047199790970533, 'lr': 0.0020856004367137797, 'batch_size': 32, 'dropout_rate': 0.02275946648143201, 'prior_mu': -0.06201920892404848, 'prior_sigma': 0.06552445312496774, 'normalization': 'none'}. Best is trial 272 with value: 0.5198344707489013.
Generating morgan fingerprints...
Generated fingerprints with 1024 features for 900 molecules
Data shape: X=(900, 1024), y=(900,)
Trial 674: 5-fold CV loss = 0.5630
[I 2025-08-07 19:34:03,511] Trial 674 finished with value: 0.5629876255989075 and parameters: {'fp_type': 'morgan', 'morgan_only_radius': 2, 'morgan_only_nBits': 2048, 'num_hidden_layers': 3, 'hidden_dim_0': 256, 'hidden_dim_1': 128, 'hidden_dim_2': 512, 'kl_weight': 0.0007469406424313088, 'lr': 0.0021034894997521304, 'batch_size': 32, 'dropout_rate': 0.19239788260757568, 'prior_mu': -0.061327859926979325, 'prior_sigma': 0.07261250680453973, 'normalization': 'none'}. Best is trial 272 with value: 0.5198344707489013.
Generating morgan fingerprints...
Generated fingerprints with 1024 features for 900 molecules
Data shape: X=(900, 1024), y=(900,)
Trial 679: 5-fold CV loss = 0.5347
[I 2025-08-07 19:34:06,081] Trial 679 finished with value: 0.5347050428390503 and parameters: {'fp_type': 'morgan', 'morgan_only_radius': 2, 'morgan_only_nBits': 1024, 'num_hidden_layers': 3, 'hidden_dim_0': 512, 'hidden_dim_1': 128, 'hidden_dim_2': 512, 'kl_weight': 0.0013325762298636522, 'lr': 0.0021531267082347274, 'batch_size': 32, 'dropout_rate': 0.46998018891726767, 'prior_mu': -0.058929812794481645, 'prior_sigma': 0.06555590931014384, 'normalization': 'none'}. Best is trial 272 with value: 0.5198344707489013.
Generating morgan fingerprints...
Generated fingerprints with 1024 features for 900 molecules
Data shape: X=(900, 1024), y=(900,)
Trial 680: 5-fold CV loss = 0.6433
[I 2025-08-07 19:35:21,183] Trial 680 finished with value: 0.6433251023292541 and parameters: {'fp_type': 'morgan', 'morgan_only_radius': 2, 'morgan_only_nBits': 1024, 'num_hidden_layers': 3, 'hidden_dim_0': 512, 'hidden_dim_1': 128, 'hidden_dim_2': 512, 'kl_weight': 0.002152282297484869, 'lr': 0.0021864894742919475, 'batch_size': 32, 'dropout_rate': 0.4733515769371403, 'prior_mu': -0.05960838115825057, 'prior_sigma': 0.1907841169884799, 'normalization': 'none'}. Best is trial 272 with value: 0.5198344707489013.
Generating morgan fingerprints...
Generated fingerprints with 1024 features for 900 molecules
Data shape: X=(900, 1024), y=(900,)
Trial 683: 5-fold CV loss = 0.5440
[I 2025-08-07 19:35:41,335] Trial 683 finished with value: 0.5439786553382874 and parameters: {'fp_type': 'morgan', 'morgan_only_radius': 2, 'morgan_only_nBits': 1024, 'num_hidden_layers': 3, 'hidden_dim_0': 512, 'hidden_dim_1': 128, 'hidden_dim_2': 512, 'kl_weight': 0.001646515061424048, 'lr': 0.0018377799537669507, 'batch_size': 32, 'dropout_rate': 0.49998332867415535, 'prior_mu': -0.040868397283992455, 'prior_sigma': 0.05125750559242156, 'normalization': 'none'}. Best is trial 272 with value: 0.5198344707489013.
Generating morgan fingerprints...
Generated fingerprints with 1024 features for 900 molecules
Data shape: X=(900, 1024), y=(900,)
Trial 681: 5-fold CV loss = 0.5279
[I 2025-08-07 19:35:47,797] Trial 681 finished with value: 0.5278695464134217 and parameters: {'fp_type': 'morgan', 'morgan_only_radius': 2, 'morgan_only_nBits': 1024, 'num_hidden_layers': 3, 'hidden_dim_0': 512, 'hidden_dim_1': 128, 'hidden_dim_2': 512, 'kl_weight': 0.001366717700598188, 'lr': 0.0022714317202218053, 'batch_size': 32, 'dropout_rate': 0.49987791592983905, 'prior_mu': -0.044609759446685604, 'prior_sigma': 0.05049893093580136, 'normalization': 'none'}. Best is trial 272 with value: 0.5198344707489013.
Generating morgan fingerprints...
Generated fingerprints with 1024 features for 900 molecules
Data shape: X=(900, 1024), y=(900,)
Trial 685: 5-fold CV loss = 0.5380
[I 2025-08-07 19:36:40,694] Trial 685 finished with value: 0.5380142211914063 and parameters: {'fp_type': 'morgan', 'morgan_only_radius': 2, 'morgan_only_nBits': 1024, 'num_hidden_layers': 3, 'hidden_dim_0': 1024, 'hidden_dim_1': 128, 'hidden_dim_2': 512, 'kl_weight': 0.00023778023537552437, 'lr': 0.0023773840427947705, 'batch_size': 32, 'dropout_rate': 0.48126180041164407, 'prior_mu': -0.01143507581584445, 'prior_sigma': 0.06912380168486003, 'normalization': 'none'}. Best is trial 272 with value: 0.5198344707489013.
Generating morgan fingerprints...
Generated fingerprints with 1024 features for 900 molecules
Data shape: X=(900, 1024), y=(900,)
Trial 686: 5-fold CV loss = 0.8614
[I 2025-08-07 19:37:04,373] Trial 686 finished with value: 0.8614432513713837 and parameters: {'fp_type': 'morgan', 'morgan_only_radius': 2, 'morgan_only_nBits': 1024, 'num_hidden_layers': 3, 'hidden_dim_0': 512, 'hidden_dim_1': 1024, 'hidden_dim_2': 512, 'kl_weight': 0.0017533083327133082, 'lr': 0.0024149925379159183, 'batch_size': 32, 'dropout_rate': 0.4997533147051478, 'prior_mu': -0.019085298743493857, 'prior_sigma': 0.06858983161622223, 'normalization': 'none'}. Best is trial 272 with value: 0.5198344707489013.
Generating rdkit fingerprints...
Generated fingerprints with 256 features for 900 molecules
Data shape: X=(900, 256), y=(900,)
Trial 684: 5-fold CV loss = 0.5751
[I 2025-08-07 19:37:05,023] Trial 684 finished with value: 0.5751072883605957 and parameters: {'fp_type': 'morgan', 'morgan_only_radius': 2, 'morgan_only_nBits': 1024, 'num_hidden_layers': 3, 'hidden_dim_0': 512, 'hidden_dim_1': 128, 'hidden_dim_2': 512, 'kl_weight': 0.00024594210177932295, 'lr': 0.0018517533692723057, 'batch_size': 32, 'dropout_rate': 0.4795159244263919, 'prior_mu': -0.04142344377246745, 'prior_sigma': 0.05135291917101517, 'normalization': 'none'}. Best is trial 272 with value: 0.5198344707489013.
Generating morgan fingerprints...
Generated fingerprints with 1024 features for 900 molecules
Data shape: X=(900, 1024), y=(900,)
Trial 688: 5-fold CV loss = 0.6425
