[I 2025-08-08 06:44:59,651] Trial 2580 finished with value: 0.5246432185173034 and parameters: {'fp_type': 'morgan', 'morgan_only_radius': 2, 'morgan_only_nBits': 2048, 'num_hidden_layers': 3, 'hidden_dim_0': 512, 'hidden_dim_1': 128, 'hidden_dim_2': 512, 'kl_weight': 0.0008519913183758288, 'lr': 0.002361907828792338, 'batch_size': 32, 'dropout_rate': 0.44473381385390753, 'prior_mu': 0.05889571408615758, 'prior_sigma': 0.07386473114622846, 'normalization': 'none'}. Best is trial 2426 with value: 0.515486741065979.
Generating morgan fingerprints...
Generated fingerprints with 2048 features for 900 molecules
Data shape: X=(900, 2048), y=(900,)
Trial 2581: 5-fold CV loss = 0.6285
[I 2025-08-08 06:45:06,330] Trial 2581 finished with value: 0.6284704685211182 and parameters: {'fp_type': 'morgan', 'morgan_only_radius': 2, 'morgan_only_nBits': 2048, 'num_hidden_layers': 3, 'hidden_dim_0': 512, 'hidden_dim_1': 128, 'hidden_dim_2': 512, 'kl_weight': 0.0008572515398214155, 'lr': 0.0015330860436810227, 'batch_size': 32, 'dropout_rate': 0.41920892285215366, 'prior_mu': 0.0563522980338739, 'prior_sigma': 0.07330200081249397, 'normalization': 'none'}. Best is trial 2426 with value: 0.515486741065979.
Generating morgan fingerprints...
Generated fingerprints with 2048 features for 900 molecules
Data shape: X=(900, 2048), y=(900,)
Trial 2583: 5-fold CV loss = 0.5954
[I 2025-08-08 06:45:51,263] Trial 2583 finished with value: 0.5954276323318481 and parameters: {'fp_type': 'morgan', 'morgan_only_radius': 2, 'morgan_only_nBits': 2048, 'num_hidden_layers': 3, 'hidden_dim_0': 512, 'hidden_dim_1': 64, 'hidden_dim_2': 512, 'kl_weight': 0.0008387391067500244, 'lr': 0.0015084250986641117, 'batch_size': 32, 'dropout_rate': 0.43181341467387024, 'prior_mu': 0.05942550540732553, 'prior_sigma': 0.07217366527521407, 'normalization': 'none'}. Best is trial 2426 with value: 0.515486741065979.
Generating morgan fingerprints...
Generated fingerprints with 2048 features for 900 molecules
Data shape: X=(900, 2048), y=(900,)
Trial 2585: 5-fold CV loss = 0.5359
[I 2025-08-08 06:45:57,721] Trial 2585 finished with value: 0.5358868181705475 and parameters: {'fp_type': 'morgan', 'morgan_only_radius': 2, 'morgan_only_nBits': 2048, 'num_hidden_layers': 3, 'hidden_dim_0': 512, 'hidden_dim_1': 64, 'hidden_dim_2': 256, 'kl_weight': 0.00036383893311255197, 'lr': 0.0029259162228345062, 'batch_size': 32, 'dropout_rate': 0.4302846885656099, 'prior_mu': 0.06776001529307074, 'prior_sigma': 0.06918729508561978, 'normalization': 'layer'}. Best is trial 2426 with value: 0.515486741065979.
Generating morgan fingerprints...
Generated fingerprints with 2048 features for 900 molecules
Data shape: X=(900, 2048), y=(900,)
Trial 2586: 5-fold CV loss = 0.8588
[I 2025-08-08 06:46:02,373] Trial 2586 finished with value: 0.8587825894355774 and parameters: {'fp_type': 'morgan', 'morgan_only_radius': 3, 'morgan_only_nBits': 2048, 'num_hidden_layers': 3, 'hidden_dim_0': 512, 'hidden_dim_1': 256, 'hidden_dim_2': 256, 'kl_weight': 0.0006771641345960349, 'lr': 0.0027846699189065585, 'batch_size': 128, 'dropout_rate': 0.46428087047040145, 'prior_mu': 0.0677430935835826, 'prior_sigma': 0.06784810501043659, 'normalization': 'none'}. Best is trial 2426 with value: 0.515486741065979.
Generating morgan fingerprints...
Generated fingerprints with 2048 features for 900 molecules
Data shape: X=(900, 2048), y=(900,)
Trial 2587: 5-fold CV loss = 0.6743
[I 2025-08-08 06:46:05,709] Trial 2587 finished with value: 0.6743483781814575 and parameters: {'fp_type': 'morgan', 'morgan_only_radius': 2, 'morgan_only_nBits': 2048, 'num_hidden_layers': 1, 'hidden_dim_0': 512, 'kl_weight': 0.0007246590277948739, 'lr': 0.002310278242546318, 'batch_size': 128, 'dropout_rate': 0.46550128718064826, 'prior_mu': 0.022823345125184274, 'prior_sigma': 0.058407888664041806, 'normalization': 'none'}. Best is trial 2426 with value: 0.515486741065979.
Generating morgan fingerprints...
Generated fingerprints with 2048 features for 900 molecules
Data shape: X=(900, 2048), y=(900,)
Trial 2584: 5-fold CV loss = 0.5674
[I 2025-08-08 06:46:33,750] Trial 2584 finished with value: 0.5674463748931885 and parameters: {'fp_type': 'morgan', 'morgan_only_radius': 2, 'morgan_only_nBits': 2048, 'num_hidden_layers': 3, 'hidden_dim_0': 512, 'hidden_dim_1': 64, 'hidden_dim_2': 512, 'kl_weight': 0.0006648905286262171, 'lr': 0.0015034972173285797, 'batch_size': 32, 'dropout_rate': 0.1913857046706853, 'prior_mu': 0.054686931952676605, 'prior_sigma': 0.06994402242499195, 'normalization': 'none'}. Best is trial 2426 with value: 0.515486741065979.
Generating rdkit fingerprints...
Generated fingerprints with 1024 features for 900 molecules
Data shape: X=(900, 1024), y=(900,)
Trial 2588: 5-fold CV loss = 0.5238
[I 2025-08-08 06:47:24,510] Trial 2588 finished with value: 0.5237954735755921 and parameters: {'fp_type': 'morgan', 'morgan_only_radius': 2, 'morgan_only_nBits': 2048, 'num_hidden_layers': 3, 'hidden_dim_0': 512, 'hidden_dim_1': 128, 'hidden_dim_2': 512, 'kl_weight': 0.0010988739362039067, 'lr': 0.002330896084328949, 'batch_size': 32, 'dropout_rate': 0.44953410168774055, 'prior_mu': 0.05051117224668815, 'prior_sigma': 0.05982355081595807, 'normalization': 'none'}. Best is trial 2426 with value: 0.515486741065979.
Generating rdkit fingerprints...
Generated fingerprints with 1024 features for 900 molecules
Data shape: X=(900, 1024), y=(900,)
Trial 2589: 5-fold CV loss = 0.5638
[I 2025-08-08 06:47:26,013] Trial 2589 finished with value: 0.5638091564178467 and parameters: {'fp_type': 'morgan', 'morgan_only_radius': 2, 'morgan_only_nBits': 2048, 'num_hidden_layers': 3, 'hidden_dim_0': 512, 'hidden_dim_1': 128, 'hidden_dim_2': 512, 'kl_weight': 0.001076930931733711, 'lr': 0.0018442911938564269, 'batch_size': 32, 'dropout_rate': 0.4521365052459195, 'prior_mu': 0.049754410773187034, 'prior_sigma': 0.06409809725117244, 'normalization': 'none'}. Best is trial 2426 with value: 0.515486741065979.
Generating morgan fingerprints...
Generated fingerprints with 2048 features for 900 molecules
Data shape: X=(900, 2048), y=(900,)
Trial 2592: 5-fold CV loss = 0.7630
[I 2025-08-08 06:47:47,696] Trial 2592 finished with value: 0.7630497694015503 and parameters: {'fp_type': 'morgan', 'morgan_only_radius': 2, 'morgan_only_nBits': 2048, 'num_hidden_layers': 3, 'hidden_dim_0': 512, 'hidden_dim_1': 128, 'hidden_dim_2': 128, 'kl_weight': 0.0006254116897111756, 'lr': 0.0017148966018351976, 'batch_size': 32, 'dropout_rate': 0.419442866314178, 'prior_mu': 0.03947663860435349, 'prior_sigma': 0.0784623746623967, 'normalization': 'none'}. Best is trial 2426 with value: 0.515486741065979.
Generating rdkit fingerprints...
Generated fingerprints with 1024 features for 900 molecules
Data shape: X=(900, 1024), y=(900,)
Trial 2590: 5-fold CV loss = 0.6569
[I 2025-08-08 06:47:54,041] Trial 2590 finished with value: 0.6568807601928711 and parameters: {'fp_type': 'rdkit', 'rdkit_only_maxPath': 8, 'rdkit_only_nBits': 1024, 'num_hidden_layers': 3, 'hidden_dim_0': 512, 'hidden_dim_1': 128, 'hidden_dim_2': 512, 'kl_weight': 0.00017989308860061465, 'lr': 0.0017981290753115442, 'batch_size': 32, 'dropout_rate': 0.4501529624123483, 'prior_mu': 0.042176672137845324, 'prior_sigma': 0.07735404241964955, 'normalization': 'none'}. Best is trial 2426 with value: 0.515486741065979.
Generating morgan fingerprints...
Generated fingerprints with 2048 features for 900 molecules
Data shape: X=(900, 2048), y=(900,)
Trial 2582: 5-fold CV loss = 0.6284
[I 2025-08-08 06:48:06,206] Trial 2582 finished with value: 0.6283611059188843 and parameters: {'fp_type': 'morgan', 'morgan_only_radius': 2, 'morgan_only_nBits': 2048, 'num_hidden_layers': 3, 'hidden_dim_0': 512, 'hidden_dim_1': 64, 'hidden_dim_2': 512, 'kl_weight': 0.0008759489306092908, 'lr': 0.0015347602452652452, 'batch_size': 32, 'dropout_rate': 0.4292686807755807, 'prior_mu': 0.057312199861034405, 'prior_sigma': 0.07445319257734162, 'normalization': 'none'}. Best is trial 2426 with value: 0.515486741065979.
Generating morgan fingerprints...
Generated fingerprints with 2048 features for 900 molecules
Data shape: X=(900, 2048), y=(900,)
Trial 2594: 5-fold CV loss = 1.2430
[I 2025-08-08 06:48:17,140] Trial 2594 finished with value: 1.2429691433906556 and parameters: {'fp_type': 'morgan', 'morgan_only_radius': 2, 'morgan_only_nBits': 2048, 'num_hidden_layers': 3, 'hidden_dim_0': 512, 'hidden_dim_1': 128, 'hidden_dim_2': 512, 'kl_weight': 0.0005704793640965873, 'lr': 0.0006160110533542731, 'batch_size': 64, 'dropout_rate': 0.4305300317605749, 'prior_mu': 0.029854817244298226, 'prior_sigma': 0.08520283296764826, 'normalization': 'none'}. Best is trial 2426 with value: 0.515486741065979.
Generating morgan fingerprints...
Generated fingerprints with 2048 features for 900 molecules
Data shape: X=(900, 2048), y=(900,)
Trial 2593: 5-fold CV loss = 0.6431
[I 2025-08-08 06:48:23,034] Trial 2593 finished with value: 0.6430587410926819 and parameters: {'fp_type': 'rdkit', 'rdkit_only_maxPath': 8, 'rdkit_only_nBits': 1024, 'num_hidden_layers': 3, 'hidden_dim_0': 512, 'hidden_dim_1': 128, 'hidden_dim_2': 512, 'kl_weight': 0.0004606987249769414, 'lr': 0.0021581856825161026, 'batch_size': 64, 'dropout_rate': 0.3988767035012278, 'prior_mu': 0.029948488418281502, 'prior_sigma': 0.08281814326180667, 'normalization': 'none'}. Best is trial 2426 with value: 0.515486741065979.
Generating morgan fingerprints...
Generated fingerprints with 2048 features for 900 molecules
Data shape: X=(900, 2048), y=(900,)
Trial 2591: 5-fold CV loss = 0.6440
[I 2025-08-08 06:48:24,990] Trial 2591 finished with value: 0.643982982635498 and parameters: {'fp_type': 'rdkit', 'rdkit_only_maxPath': 8, 'rdkit_only_nBits': 1024, 'num_hidden_layers': 3, 'hidden_dim_0': 512, 'hidden_dim_1': 128, 'hidden_dim_2': 128, 'kl_weight': 0.00017995285175643677, 'lr': 0.0017948205668298818, 'batch_size': 32, 'dropout_rate': 0.416243402282461, 'prior_mu': 0.0377618136124242, 'prior_sigma': 0.07709696903149992, 'normalization': 'none'}. Best is trial 2426 with value: 0.515486741065979.
Generating morgan fingerprints...
Generated fingerprints with 2048 features for 900 molecules
Data shape: X=(900, 2048), y=(900,)
Trial 2595: 5-fold CV loss = 0.7060
[I 2025-08-08 06:49:06,903] Trial 2595 finished with value: 0.7059841275215148 and parameters: {'fp_type': 'morgan', 'morgan_only_radius': 2, 'morgan_only_nBits': 2048, 'num_hidden_layers': 3, 'hidden_dim_0': 256, 'hidden_dim_1': 1024, 'hidden_dim_2': 256, 'kl_weight': 0.0004785947949910497, 'lr': 0.0006243412120930351, 'batch_size': 64, 'dropout_rate': 0.43856994331775295, 'prior_mu': 0.029720450118509736, 'prior_sigma': 0.06641808796246516, 'normalization': 'none'}. Best is trial 2426 with value: 0.515486741065979.
Generating morgan fingerprints...
Generated fingerprints with 2048 features for 900 molecules
Data shape: X=(900, 2048), y=(900,)
Trial 2597: 5-fold CV loss = 0.6038
[I 2025-08-08 06:49:30,644] Trial 2597 finished with value: 0.6037934124469757 and parameters: {'fp_type': 'morgan', 'morgan_only_radius': 2, 'morgan_only_nBits': 2048, 'num_hidden_layers': 3, 'hidden_dim_0': 512, 'hidden_dim_1': 128, 'hidden_dim_2': 256, 'kl_weight': 0.0007517883828879543, 'lr': 0.001950846220056211, 'batch_size': 32, 'dropout_rate': 0.44078096450073295, 'prior_mu': 0.04181345349486852, 'prior_sigma': 0.06585860267074332, 'normalization': 'none'}. Best is trial 2426 with value: 0.515486741065979.
Generating morgan fingerprints...
Generated fingerprints with 2048 features for 900 molecules
Data shape: X=(900, 2048), y=(900,)
Trial 2596: 5-fold CV loss = 0.5709
[I 2025-08-08 06:49:59,295] Trial 2596 finished with value: 0.5708676338195801 and parameters: {'fp_type': 'morgan', 'morgan_only_radius': 2, 'morgan_only_nBits': 2048, 'num_hidden_layers': 3, 'hidden_dim_0': 256, 'hidden_dim_1': 128, 'hidden_dim_2': 256, 'kl_weight': 0.00020649108595194413, 'lr': 0.0021582693131043233, 'batch_size': 32, 'dropout_rate': 0.40208641792384, 'prior_mu': 0.018809201252162525, 'prior_sigma': 0.06639869339763156, 'normalization': 'none'}. Best is trial 2426 with value: 0.515486741065979.
Generating morgan fingerprints...
Generated fingerprints with 2048 features for 900 molecules
Data shape: X=(900, 2048), y=(900,)
Trial 2598: 5-fold CV loss = 0.5366
[I 2025-08-08 06:50:03,936] Trial 2598 finished with value: 0.5366285264492034 and parameters: {'fp_type': 'morgan', 'morgan_only_radius': 2, 'morgan_only_nBits': 2048, 'num_hidden_layers': 3, 'hidden_dim_0': 256, 'hidden_dim_1': 128, 'hidden_dim_2': 256, 'kl_weight': 0.00047346417761401593, 'lr': 0.0024583573439883534, 'batch_size': 32, 'dropout_rate': 0.43473519767410285, 'prior_mu': 0.018700611690064754, 'prior_sigma': 0.06578435591340902, 'normalization': 'none'}. Best is trial 2426 with value: 0.515486741065979.
Generating morgan fingerprints...
Generated fingerprints with 2048 features for 900 molecules
Data shape: X=(900, 2048), y=(900,)
Trial 2600: 5-fold CV loss = 0.5254
[I 2025-08-08 06:50:34,905] Trial 2600 finished with value: 0.5254256904125214 and parameters: {'fp_type': 'morgan', 'morgan_only_radius': 2, 'morgan_only_nBits': 2048, 'num_hidden_layers': 3, 'hidden_dim_0': 512, 'hidden_dim_1': 128, 'hidden_dim_2': 512, 'kl_weight': 0.0005976303413460214, 'lr': 0.002505462888272212, 'batch_size': 32, 'dropout_rate': 0.40701864581826314, 'prior_mu': 0.01967048995138577, 'prior_sigma': 0.07011397239450066, 'normalization': 'none'}. Best is trial 2426 with value: 0.515486741065979.
Generating morgan fingerprints...
Generated fingerprints with 2048 features for 900 molecules
Data shape: X=(900, 2048), y=(900,)
Trial 2602: 5-fold CV loss = 0.6433
[I 2025-08-08 06:50:57,569] Trial 2602 finished with value: 0.6432855129241943 and parameters: {'fp_type': 'morgan', 'morgan_only_radius': 2, 'morgan_only_nBits': 2048, 'num_hidden_layers': 3, 'hidden_dim_0': 512, 'hidden_dim_1': 64, 'hidden_dim_2': 512, 'kl_weight': 0.0005909182325847493, 'lr': 0.0027070433536447655, 'batch_size': 32, 'dropout_rate': 0.41904617439075104, 'prior_mu': 0.07554708560203387, 'prior_sigma': 0.11987586147466764, 'normalization': 'layer'}. Best is trial 2426 with value: 0.515486741065979.
Generating morgan fingerprints...
Generated fingerprints with 2048 features for 900 molecules
Data shape: X=(900, 2048), y=(900,)
Trial 2603: 5-fold CV loss = 0.5663
[I 2025-08-08 06:51:42,955] Trial 2603 finished with value: 0.5663300633430481 and parameters: {'fp_type': 'morgan', 'morgan_only_radius': 2, 'morgan_only_nBits': 2048, 'num_hidden_layers': 3, 'hidden_dim_0': 512, 'hidden_dim_1': 64, 'hidden_dim_2': 512, 'kl_weight': 0.0007146492842352767, 'lr': 0.001307785742215863, 'batch_size': 32, 'dropout_rate': 0.4641562663353239, 'prior_mu': 0.0498049924238925, 'prior_sigma': 0.061155331875739474, 'normalization': 'layer'}. Best is trial 2426 with value: 0.515486741065979.
Generating morgan fingerprints...
Generated fingerprints with 2048 features for 900 molecules
Data shape: X=(900, 2048), y=(900,)
Trial 2601: 5-fold CV loss = 0.5235
[I 2025-08-08 06:51:59,508] Trial 2601 finished with value: 0.5234766364097595 and parameters: {'fp_type': 'morgan', 'morgan_only_radius': 2, 'morgan_only_nBits': 2048, 'num_hidden_layers': 3, 'hidden_dim_0': 512, 'hidden_dim_1': 64, 'hidden_dim_2': 512, 'kl_weight': 0.0005462708881915341, 'lr': 0.0024622820885238286, 'batch_size': 32, 'dropout_rate': 0.4637753797680389, 'prior_mu': 0.05032004847876664, 'prior_sigma': 0.061393324670348956, 'normalization': 'none'}. Best is trial 2426 with value: 0.515486741065979.
Generating morgan fingerprints...
Generated fingerprints with 2048 features for 900 molecules
Data shape: X=(900, 2048), y=(900,)
Trial 2604: 5-fold CV loss = 0.5709
[I 2025-08-08 06:52:03,725] Trial 2604 finished with value: 0.5709422528743744 and parameters: {'fp_type': 'morgan', 'morgan_only_radius': 2, 'morgan_only_nBits': 2048, 'num_hidden_layers': 3, 'hidden_dim_0': 128, 'hidden_dim_1': 64, 'hidden_dim_2': 512, 'kl_weight': 0.0007206242523915112, 'lr': 0.0019734539944876997, 'batch_size': 32, 'dropout_rate': 0.46083510664849203, 'prior_mu': 0.04700653640342585, 'prior_sigma': 0.06141990920102232, 'normalization': 'none'}. Best is trial 2426 with value: 0.515486741065979.
Generating morgan fingerprints...
Generated fingerprints with 2048 features for 900 molecules
Data shape: X=(900, 2048), y=(900,)
Trial 2605: 5-fold CV loss = 0.5553
[I 2025-08-08 06:52:38,395] Trial 2605 finished with value: 0.5553186655044555 and parameters: {'fp_type': 'morgan', 'morgan_only_radius': 2, 'morgan_only_nBits': 2048, 'num_hidden_layers': 3, 'hidden_dim_0': 128, 'hidden_dim_1': 128, 'hidden_dim_2': 512, 'kl_weight': 0.000942732287881238, 'lr': 0.0019722050570791, 'batch_size': 32, 'dropout_rate': 0.44198306683117305, 'prior_mu': 0.0634478837295325, 'prior_sigma': 0.05827485838952519, 'normalization': 'none'}. Best is trial 2426 with value: 0.515486741065979.
Generating morgan fingerprints...
Generated fingerprints with 2048 features for 900 molecules
Data shape: X=(900, 2048), y=(900,)
Trial 2599: 5-fold CV loss = 0.5645
[I 2025-08-08 06:52:55,529] Trial 2599 finished with value: 0.5645423769950867 and parameters: {'fp_type': 'morgan', 'morgan_only_radius': 2, 'morgan_only_nBits': 2048, 'num_hidden_layers': 3, 'hidden_dim_0': 512, 'hidden_dim_1': 128, 'hidden_dim_2': 256, 'kl_weight': 0.0007544717442579181, 'lr': 0.0024211204359356046, 'batch_size': 32, 'dropout_rate': 0.16315204712216036, 'prior_mu': 0.042661833187407315, 'prior_sigma': 0.06325031053531725, 'normalization': 'none'}. Best is trial 2426 with value: 0.515486741065979.
Generating morgan fingerprints...
Generated fingerprints with 2048 features for 900 molecules
Data shape: X=(900, 2048), y=(900,)
Trial 2607: 5-fold CV loss = 0.5421
[I 2025-08-08 06:53:08,042] Trial 2607 finished with value: 0.5420808851718902 and parameters: {'fp_type': 'morgan', 'morgan_only_radius': 2, 'morgan_only_nBits': 2048, 'num_hidden_layers': 3, 'hidden_dim_0': 512, 'hidden_dim_1': 128, 'hidden_dim_2': 512, 'kl_weight': 0.0009749585759924377, 'lr': 0.0022344516674171785, 'batch_size': 32, 'dropout_rate': 0.37140285180471805, 'prior_mu': 0.034242050589542286, 'prior_sigma': 0.0569789934171387, 'normalization': 'none'}. Best is trial 2426 with value: 0.515486741065979.
Generating morgan fingerprints...
Generated fingerprints with 2048 features for 900 molecules
Data shape: X=(900, 2048), y=(900,)
Trial 2608: 5-fold CV loss = 0.5264
[I 2025-08-08 06:53:51,937] Trial 2608 finished with value: 0.526394784450531 and parameters: {'fp_type': 'morgan', 'morgan_only_radius': 2, 'morgan_only_nBits': 2048, 'num_hidden_layers': 3, 'hidden_dim_0': 512, 'hidden_dim_1': 128, 'hidden_dim_2': 512, 'kl_weight': 0.0008050108335403754, 'lr': 0.0022197566209603953, 'batch_size': 32, 'dropout_rate': 0.42293130391670186, 'prior_mu': 0.03538188900002475, 'prior_sigma': 0.07035896199066063, 'normalization': 'none'}. Best is trial 2426 with value: 0.515486741065979.
Generating morgan fingerprints...
Generated fingerprints with 2048 features for 900 molecules
Data shape: X=(900, 2048), y=(900,)
Trial 2610: 5-fold CV loss = 0.5360
[I 2025-08-08 06:54:08,891] Trial 2610 finished with value: 0.5359518110752106 and parameters: {'fp_type': 'morgan', 'morgan_only_radius': 3, 'morgan_only_nBits': 2048, 'num_hidden_layers': 3, 'hidden_dim_0': 512, 'hidden_dim_1': 128, 'hidden_dim_2': 512, 'kl_weight': 0.0003793376005023871, 'lr': 0.002898867711354561, 'batch_size': 32, 'dropout_rate': 0.4193217166992759, 'prior_mu': 0.009897210731912052, 'prior_sigma': 0.07049042695275953, 'normalization': 'none'}. Best is trial 2426 with value: 0.515486741065979.
Generating morgan fingerprints...
Generated fingerprints with 2048 features for 900 molecules
Data shape: X=(900, 2048), y=(900,)
Trial 2606: 5-fold CV loss = 0.5395
[I 2025-08-08 06:54:21,547] Trial 2606 finished with value: 0.5394901514053345 and parameters: {'fp_type': 'morgan', 'morgan_only_radius': 2, 'morgan_only_nBits': 2048, 'num_hidden_layers': 3, 'hidden_dim_0': 128, 'hidden_dim_1': 128, 'hidden_dim_2': 512, 'kl_weight': 0.0009655643143358732, 'lr': 0.00197771054453283, 'batch_size': 32, 'dropout_rate': 0.4424889922857144, 'prior_mu': 0.0645316251864422, 'prior_sigma': 0.05779046717074031, 'normalization': 'none'}. Best is trial 2426 with value: 0.515486741065979.
Generating morgan fingerprints...
Generated fingerprints with 2048 features for 900 molecules
Data shape: X=(900, 2048), y=(900,)
Trial 2612: 5-fold CV loss = 1.1273
[I 2025-08-08 06:54:45,097] Trial 2612 finished with value: 1.1273215532302856 and parameters: {'fp_type': 'morgan', 'morgan_only_radius': 2, 'morgan_only_nBits': 2048, 'num_hidden_layers': 3, 'hidden_dim_0': 512, 'hidden_dim_1': 256, 'hidden_dim_2': 512, 'kl_weight': 0.0006337044286681353, 'lr': 0.0016332048875881706, 'batch_size': 32, 'dropout_rate': 0.44856582146837765, 'prior_mu': 0.05889396893550929, 'prior_sigma': 0.08105664294911322, 'normalization': 'none'}. Best is trial 2426 with value: 0.515486741065979.
Generating morgan fingerprints...
Generated fingerprints with 2048 features for 900 molecules
Data shape: X=(900, 2048), y=(900,)
Trial 2611: 5-fold CV loss = 0.6519
[I 2025-08-08 06:54:57,552] Trial 2611 finished with value: 0.651859027147293 and parameters: {'fp_type': 'morgan', 'morgan_only_radius': 2, 'morgan_only_nBits': 2048, 'num_hidden_layers': 3, 'hidden_dim_0': 512, 'hidden_dim_1': 128, 'hidden_dim_2': 512, 'kl_weight': 0.0006454437911952027, 'lr': 0.001606791468905059, 'batch_size': 32, 'dropout_rate': 0.39200297299444586, 'prior_mu': 0.009968325416741218, 'prior_sigma': 0.08130250715871518, 'normalization': 'none'}. Best is trial 2426 with value: 0.515486741065979.
Generating morgan fingerprints...
Generated fingerprints with 2048 features for 900 molecules
Data shape: X=(900, 2048), y=(900,)
Trial 2615: 5-fold CV loss = 0.9746
