[I 2025-08-07 22:45:12,262] Trial 1193 finished with value: 0.5213484466075897 and parameters: {'fp_type': 'morgan', 'morgan_only_radius': 2, 'morgan_only_nBits': 2048, 'num_hidden_layers': 3, 'hidden_dim_0': 512, 'hidden_dim_1': 128, 'hidden_dim_2': 512, 'kl_weight': 0.0002747106010594758, 'lr': 0.002201120003075717, 'batch_size': 32, 'dropout_rate': 0.46404392970825464, 'prior_mu': 0.016025536064701848, 'prior_sigma': 0.06648399119455609, 'normalization': 'none'}. Best is trial 272 with value: 0.5198344707489013.
Generating morgan fingerprints...
Generated fingerprints with 2048 features for 900 molecules
Data shape: X=(900, 2048), y=(900,)
Trial 1196: 5-fold CV loss = 0.5898
[I 2025-08-07 22:45:52,520] Trial 1196 finished with value: 0.5897593259811401 and parameters: {'fp_type': 'morgan', 'morgan_only_radius': 2, 'morgan_only_nBits': 2048, 'num_hidden_layers': 3, 'hidden_dim_0': 512, 'hidden_dim_1': 128, 'hidden_dim_2': 512, 'kl_weight': 0.00038901846074880584, 'lr': 0.0016807491736630115, 'batch_size': 32, 'dropout_rate': 0.4608777158230694, 'prior_mu': -0.022143120479053285, 'prior_sigma': 0.05158703769521833, 'normalization': 'none'}. Best is trial 272 with value: 0.5198344707489013.
Generating morgan fingerprints...
Generated fingerprints with 2048 features for 900 molecules
Data shape: X=(900, 2048), y=(900,)
Trial 1191: 5-fold CV loss = 0.5567
[I 2025-08-07 22:45:56,906] Trial 1191 finished with value: 0.5567114174365997 and parameters: {'fp_type': 'morgan', 'morgan_only_radius': 2, 'morgan_only_nBits': 2048, 'num_hidden_layers': 3, 'hidden_dim_0': 512, 'hidden_dim_1': 128, 'hidden_dim_2': 512, 'kl_weight': 0.00023932368560184193, 'lr': 0.0022472801229911615, 'batch_size': 32, 'dropout_rate': 0.43237068785167393, 'prior_mu': 0.009435272687498643, 'prior_sigma': 0.1322766278818501, 'normalization': 'none'}. Best is trial 272 with value: 0.5198344707489013.
Generating morgan fingerprints...
Generated fingerprints with 1024 features for 900 molecules
Data shape: X=(900, 1024), y=(900,)
Trial 1199: 5-fold CV loss = 0.7520
[I 2025-08-07 22:46:01,066] Trial 1199 finished with value: 0.7519567847251892 and parameters: {'fp_type': 'morgan', 'morgan_only_radius': 2, 'morgan_only_nBits': 2048, 'num_hidden_layers': 3, 'hidden_dim_0': 512, 'hidden_dim_1': 128, 'hidden_dim_2': 512, 'kl_weight': 0.00035364225307962674, 'lr': 0.002055998474658674, 'batch_size': 128, 'dropout_rate': 0.446487014450604, 'prior_mu': 0.034192838560568886, 'prior_sigma': 0.06859262562127032, 'normalization': 'none'}. Best is trial 272 with value: 0.5198344707489013.
Generating morgan fingerprints...
Generated fingerprints with 1024 features for 900 molecules
Data shape: X=(900, 1024), y=(900,)
Trial 1200: 5-fold CV loss = 0.8333
[I 2025-08-07 22:46:25,222] Trial 1200 finished with value: 0.8333155989646912 and parameters: {'fp_type': 'morgan', 'morgan_only_radius': 2, 'morgan_only_nBits': 1024, 'num_hidden_layers': 3, 'hidden_dim_0': 512, 'hidden_dim_1': 128, 'hidden_dim_2': 512, 'kl_weight': 0.0003450285184053895, 'lr': 0.001752240456829822, 'batch_size': 128, 'dropout_rate': 0.4432551298692401, 'prior_mu': 0.02200322182961313, 'prior_sigma': 0.07000425329303453, 'normalization': 'none'}. Best is trial 272 with value: 0.5198344707489013.
Generating morgan fingerprints...
Generated fingerprints with 1024 features for 900 molecules
Data shape: X=(900, 1024), y=(900,)
Trial 1197: 5-fold CV loss = 0.5265
[I 2025-08-07 22:46:29,738] Trial 1197 finished with value: 0.5265216112136841 and parameters: {'fp_type': 'morgan', 'morgan_only_radius': 2, 'morgan_only_nBits': 2048, 'num_hidden_layers': 3, 'hidden_dim_0': 512, 'hidden_dim_1': 128, 'hidden_dim_2': 512, 'kl_weight': 0.00019447265962456147, 'lr': 0.0021845476505469633, 'batch_size': 32, 'dropout_rate': 0.46705103300876627, 'prior_mu': -0.02085365426138537, 'prior_sigma': 0.05835985427536168, 'normalization': 'none'}. Best is trial 272 with value: 0.5198344707489013.
Generating morgan fingerprints...
Generated fingerprints with 1024 features for 900 molecules
Data shape: X=(900, 1024), y=(900,)
Trial 1198: 5-fold CV loss = 0.6659
[I 2025-08-07 22:46:58,764] Trial 1198 finished with value: 0.6658628582954407 and parameters: {'fp_type': 'morgan', 'morgan_only_radius': 2, 'morgan_only_nBits': 2048, 'num_hidden_layers': 3, 'hidden_dim_0': 512, 'hidden_dim_1': 128, 'hidden_dim_2': 512, 'kl_weight': 0.00034013062178126136, 'lr': 0.001685063688624135, 'batch_size': 32, 'dropout_rate': 0.4491749150267212, 'prior_mu': 0.03119707750246172, 'prior_sigma': 0.06830404776527776, 'normalization': 'none'}. Best is trial 272 with value: 0.5198344707489013.
Generating morgan fingerprints...
Generated fingerprints with 1024 features for 900 molecules
Data shape: X=(900, 1024), y=(900,)
Trial 1201: 5-fold CV loss = 0.5782
[I 2025-08-07 22:47:07,539] Trial 1201 finished with value: 0.5782460570335388 and parameters: {'fp_type': 'morgan', 'morgan_only_radius': 2, 'morgan_only_nBits': 1024, 'num_hidden_layers': 3, 'hidden_dim_0': 512, 'hidden_dim_1': 128, 'hidden_dim_2': 64, 'kl_weight': 0.00028255868455759705, 'lr': 0.0017975973875359716, 'batch_size': 32, 'dropout_rate': 0.45687633475106704, 'prior_mu': 0.030368533810635343, 'prior_sigma': 0.07055680110139752, 'normalization': 'none'}. Best is trial 272 with value: 0.5198344707489013.
Generating morgan fingerprints...
Generated fingerprints with 1024 features for 900 molecules
Data shape: X=(900, 1024), y=(900,)
Trial 1203: 5-fold CV loss = 0.5935
[I 2025-08-07 22:47:54,035] Trial 1203 finished with value: 0.5935391128063202 and parameters: {'fp_type': 'morgan', 'morgan_only_radius': 2, 'morgan_only_nBits': 1024, 'num_hidden_layers': 3, 'hidden_dim_0': 512, 'hidden_dim_1': 128, 'hidden_dim_2': 512, 'kl_weight': 0.0002603508124609843, 'lr': 0.0018785693095486823, 'batch_size': 32, 'dropout_rate': 0.4535375985006048, 'prior_mu': 0.027840206509076374, 'prior_sigma': 0.07075511248517115, 'normalization': 'none'}. Best is trial 272 with value: 0.5198344707489013.
Generating morgan fingerprints...
Generated fingerprints with 1024 features for 900 molecules
Data shape: X=(900, 1024), y=(900,)
Trial 1206: 5-fold CV loss = 0.9046
[I 2025-08-07 22:48:40,665] Trial 1206 finished with value: 0.9046204328536988 and parameters: {'fp_type': 'morgan', 'morgan_only_radius': 2, 'morgan_only_nBits': 1024, 'num_hidden_layers': 3, 'hidden_dim_0': 512, 'hidden_dim_1': 1024, 'hidden_dim_2': 512, 'kl_weight': 0.0002642792757947543, 'lr': 0.002033236307790484, 'batch_size': 32, 'dropout_rate': 0.46276142344707993, 'prior_mu': 0.02758829446201562, 'prior_sigma': 0.062479958534959995, 'normalization': 'none'}. Best is trial 272 with value: 0.5198344707489013.
Generating morgan fingerprints...
Generated fingerprints with 2048 features for 900 molecules
Data shape: X=(900, 2048), y=(900,)
Trial 1205: 5-fold CV loss = 0.5364
[I 2025-08-07 22:48:45,188] Trial 1205 finished with value: 0.5364313304424286 and parameters: {'fp_type': 'morgan', 'morgan_only_radius': 2, 'morgan_only_nBits': 1024, 'num_hidden_layers': 3, 'hidden_dim_0': 512, 'hidden_dim_1': 128, 'hidden_dim_2': 512, 'kl_weight': 0.000259174187774421, 'lr': 0.0019306551852128601, 'batch_size': 32, 'dropout_rate': 0.45517132248500813, 'prior_mu': 0.01967000437560592, 'prior_sigma': 0.06342231850424357, 'normalization': 'none'}. Best is trial 272 with value: 0.5198344707489013.
Generating morgan fingerprints...
Generated fingerprints with 2048 features for 900 molecules
Data shape: X=(900, 2048), y=(900,)
Trial 1204: 5-fold CV loss = 0.6085
[I 2025-08-07 22:48:46,242] Trial 1204 finished with value: 0.6084564805030823 and parameters: {'fp_type': 'morgan', 'morgan_only_radius': 2, 'morgan_only_nBits': 1024, 'num_hidden_layers': 3, 'hidden_dim_0': 512, 'hidden_dim_1': 128, 'hidden_dim_2': 64, 'kl_weight': 0.0003074115218381003, 'lr': 0.0018855950301728524, 'batch_size': 32, 'dropout_rate': 0.4579567650416782, 'prior_mu': 0.022082587015529172, 'prior_sigma': 0.07141309516995105, 'normalization': 'none'}. Best is trial 272 with value: 0.5198344707489013.
Generating morgan fingerprints...
Generated fingerprints with 2048 features for 900 molecules
Data shape: X=(900, 2048), y=(900,)
Trial 1202: 5-fold CV loss = 0.7313
[I 2025-08-07 22:48:47,393] Trial 1202 finished with value: 0.7313153624534607 and parameters: {'fp_type': 'morgan', 'morgan_only_radius': 2, 'morgan_only_nBits': 1024, 'num_hidden_layers': 3, 'hidden_dim_0': 512, 'hidden_dim_1': 1024, 'hidden_dim_2': 64, 'kl_weight': 0.0003201145987426162, 'lr': 0.0018893102612387797, 'batch_size': 32, 'dropout_rate': 0.4500371077450326, 'prior_mu': 0.018880395161626297, 'prior_sigma': 0.07013668709015468, 'normalization': 'none'}. Best is trial 272 with value: 0.5198344707489013.
Generating morgan fingerprints...
Generated fingerprints with 2048 features for 900 molecules
Data shape: X=(900, 2048), y=(900,)
Trial 1207: 5-fold CV loss = 0.5416
[I 2025-08-07 22:49:33,875] Trial 1207 finished with value: 0.5415810227394104 and parameters: {'fp_type': 'morgan', 'morgan_only_radius': 2, 'morgan_only_nBits': 2048, 'num_hidden_layers': 3, 'hidden_dim_0': 512, 'hidden_dim_1': 512, 'hidden_dim_2': 512, 'kl_weight': 0.00030917747008460405, 'lr': 0.00205133440212466, 'batch_size': 32, 'dropout_rate': 0.4661956815166432, 'prior_mu': 0.018265294231900073, 'prior_sigma': 0.0383860129694333, 'normalization': 'layer'}. Best is trial 272 with value: 0.5198344707489013.
Generating morgan fingerprints...
Generated fingerprints with 2048 features for 900 molecules
Data shape: X=(900, 2048), y=(900,)
Trial 1208: 5-fold CV loss = 0.6846
[I 2025-08-07 22:49:43,333] Trial 1208 finished with value: 0.6846270203590393 and parameters: {'fp_type': 'morgan', 'morgan_only_radius': 2, 'morgan_only_nBits': 2048, 'num_hidden_layers': 3, 'hidden_dim_0': 1024, 'hidden_dim_1': 512, 'hidden_dim_2': 512, 'kl_weight': 0.00022325293729828143, 'lr': 0.002118677995622312, 'batch_size': 32, 'dropout_rate': 0.4675177221596223, 'prior_mu': 0.01874694836911269, 'prior_sigma': 0.06646179394249338, 'normalization': 'none'}. Best is trial 272 with value: 0.5198344707489013.
Generating morgan fingerprints...
Generated fingerprints with 2048 features for 900 molecules
Data shape: X=(900, 2048), y=(900,)
Trial 1210: 5-fold CV loss = 1.0245
[I 2025-08-07 22:49:51,664] Trial 1210 finished with value: 1.0245237469673156 and parameters: {'fp_type': 'morgan', 'morgan_only_radius': 2, 'morgan_only_nBits': 2048, 'num_hidden_layers': 3, 'hidden_dim_0': 1024, 'hidden_dim_1': 512, 'hidden_dim_2': 512, 'kl_weight': 0.00019008569056660514, 'lr': 0.0021044048258279475, 'batch_size': 32, 'dropout_rate': 0.4699557145784702, 'prior_mu': 0.01048136748785995, 'prior_sigma': 0.0664814148689718, 'normalization': 'none'}. Best is trial 272 with value: 0.5198344707489013.
Generating morgan fingerprints...
Generated fingerprints with 2048 features for 900 molecules
Data shape: X=(900, 2048), y=(900,)
Trial 1209: 5-fold CV loss = 0.5407
[I 2025-08-07 22:50:06,729] Trial 1209 finished with value: 0.5406684756278992 and parameters: {'fp_type': 'morgan', 'morgan_only_radius': 2, 'morgan_only_nBits': 2048, 'num_hidden_layers': 3, 'hidden_dim_0': 1024, 'hidden_dim_1': 512, 'hidden_dim_2': 512, 'kl_weight': 0.00019334011768457431, 'lr': 0.0020927043873266754, 'batch_size': 32, 'dropout_rate': 0.4713160343103323, 'prior_mu': 0.04164901343963094, 'prior_sigma': 0.06603577049890537, 'normalization': 'layer'}. Best is trial 272 with value: 0.5198344707489013.
Generating morgan fingerprints...
Generated fingerprints with 1024 features for 900 molecules
Data shape: X=(900, 1024), y=(900,)
Trial 1212: 5-fold CV loss = 0.5280
[I 2025-08-07 22:50:46,704] Trial 1212 finished with value: 0.5279570996761322 and parameters: {'fp_type': 'morgan', 'morgan_only_radius': 2, 'morgan_only_nBits': 2048, 'num_hidden_layers': 3, 'hidden_dim_0': 512, 'hidden_dim_1': 128, 'hidden_dim_2': 512, 'kl_weight': 0.00019289388086605162, 'lr': 0.0023286104539148042, 'batch_size': 32, 'dropout_rate': 0.4713629000650168, 'prior_mu': 0.010839276993220803, 'prior_sigma': 0.05848027841865369, 'normalization': 'none'}. Best is trial 272 with value: 0.5198344707489013.
Generating morgan fingerprints...
Generated fingerprints with 1024 features for 900 molecules
Data shape: X=(900, 1024), y=(900,)
Trial 1211: 5-fold CV loss = 0.5291
[I 2025-08-07 22:50:49,422] Trial 1211 finished with value: 0.529136312007904 and parameters: {'fp_type': 'morgan', 'morgan_only_radius': 2, 'morgan_only_nBits': 2048, 'num_hidden_layers': 3, 'hidden_dim_0': 1024, 'hidden_dim_1': 128, 'hidden_dim_2': 512, 'kl_weight': 0.00041211286029915387, 'lr': 0.002222591733588352, 'batch_size': 32, 'dropout_rate': 0.47013088459882435, 'prior_mu': 0.008977472402080073, 'prior_sigma': 0.06583352654075063, 'normalization': 'none'}. Best is trial 272 with value: 0.5198344707489013.
Generating morgan fingerprints...
Generated fingerprints with 1024 features for 900 molecules
Data shape: X=(900, 1024), y=(900,)
Trial 1214: 5-fold CV loss = 0.5600
[I 2025-08-07 22:51:46,521] Trial 1214 finished with value: 0.5600319504737854 and parameters: {'fp_type': 'morgan', 'morgan_only_radius': 2, 'morgan_only_nBits': 1024, 'num_hidden_layers': 3, 'hidden_dim_0': 128, 'hidden_dim_1': 128, 'hidden_dim_2': 512, 'kl_weight': 0.00016210327789777904, 'lr': 0.00232134525625656, 'batch_size': 32, 'dropout_rate': 0.4411004971002837, 'prior_mu': 0.009373547295736806, 'prior_sigma': 0.057855223923610734, 'normalization': 'none'}. Best is trial 272 with value: 0.5198344707489013.
Generating morgan fingerprints...
Generated fingerprints with 1024 features for 900 molecules
Data shape: X=(900, 1024), y=(900,)
Trial 1215: 5-fold CV loss = 0.6837
[I 2025-08-07 22:51:49,752] Trial 1215 finished with value: 0.6836984872817993 and parameters: {'fp_type': 'morgan', 'morgan_only_radius': 3, 'morgan_only_nBits': 1024, 'num_hidden_layers': 3, 'hidden_dim_0': 128, 'hidden_dim_1': 128, 'hidden_dim_2': 512, 'kl_weight': 0.00015153376361479631, 'lr': 0.0010831038683874192, 'batch_size': 32, 'dropout_rate': 0.4391895810533784, 'prior_mu': 0.0078033200358262455, 'prior_sigma': 0.06322578869342733, 'normalization': 'none'}. Best is trial 272 with value: 0.5198344707489013.
Generating morgan fingerprints...
Generated fingerprints with 1024 features for 900 molecules
Data shape: X=(900, 1024), y=(900,)
Trial 1216: 5-fold CV loss = 0.6644
[I 2025-08-07 22:52:13,710] Trial 1216 finished with value: 0.6644272923469543 and parameters: {'fp_type': 'morgan', 'morgan_only_radius': 3, 'morgan_only_nBits': 1024, 'num_hidden_layers': 3, 'hidden_dim_0': 128, 'hidden_dim_1': 128, 'hidden_dim_2': 128, 'kl_weight': 0.0003060537027369032, 'lr': 0.002699378933232222, 'batch_size': 32, 'dropout_rate': 0.440102557314941, 'prior_mu': 0.0008766863039670319, 'prior_sigma': 0.19366342492556218, 'normalization': 'none'}. Best is trial 272 with value: 0.5198344707489013.
Generating morgan fingerprints...
Generated fingerprints with 1024 features for 900 molecules
Data shape: X=(900, 1024), y=(900,)
Trial 1218: 5-fold CV loss = 0.6876
[I 2025-08-07 22:52:24,499] Trial 1218 finished with value: 0.6876302838325501 and parameters: {'fp_type': 'morgan', 'morgan_only_radius': 2, 'morgan_only_nBits': 1024, 'num_hidden_layers': 3, 'hidden_dim_0': 512, 'hidden_dim_1': 256, 'hidden_dim_2': 128, 'kl_weight': 0.0002671605163329567, 'lr': 0.0015880020877388082, 'batch_size': 32, 'dropout_rate': 0.48033161958397363, 'prior_mu': 0.001983160526168558, 'prior_sigma': 0.061560646807021946, 'normalization': 'none'}. Best is trial 272 with value: 0.5198344707489013.
Generating morgan fingerprints...
Generated fingerprints with 2048 features for 900 molecules
Data shape: X=(900, 2048), y=(900,)
Trial 1217: 5-fold CV loss = 0.6439
[I 2025-08-07 22:52:38,128] Trial 1217 finished with value: 0.6439170956611633 and parameters: {'fp_type': 'morgan', 'morgan_only_radius': 3, 'morgan_only_nBits': 1024, 'num_hidden_layers': 3, 'hidden_dim_0': 512, 'hidden_dim_1': 128, 'hidden_dim_2': 128, 'kl_weight': 0.00029087606232961654, 'lr': 0.0027009426084997293, 'batch_size': 32, 'dropout_rate': 0.05295385468238106, 'prior_mu': -0.001937731831890029, 'prior_sigma': 0.06157587843682615, 'normalization': 'none'}. Best is trial 272 with value: 0.5198344707489013.
Generating morgan fingerprints...
Generated fingerprints with 2048 features for 900 molecules
Data shape: X=(900, 2048), y=(900,)
Trial 1219: 5-fold CV loss = 0.5843
[I 2025-08-07 22:53:10,946] Trial 1219 finished with value: 0.5843481183052063 and parameters: {'fp_type': 'morgan', 'morgan_only_radius': 2, 'morgan_only_nBits': 1024, 'num_hidden_layers': 3, 'hidden_dim_0': 512, 'hidden_dim_1': 256, 'hidden_dim_2': 512, 'kl_weight': 0.0002813725894231916, 'lr': 0.0015419289251842768, 'batch_size': 32, 'dropout_rate': 0.42101893352999, 'prior_mu': -0.004512771859666063, 'prior_sigma': 0.028063827923312898, 'normalization': 'none'}. Best is trial 272 with value: 0.5198344707489013.
Generating morgan fingerprints...
Generated fingerprints with 2048 features for 900 molecules
Data shape: X=(900, 2048), y=(900,)
Trial 1222: 5-fold CV loss = 0.7432
[I 2025-08-07 22:53:29,163] Trial 1222 finished with value: 0.7432327032089233 and parameters: {'fp_type': 'morgan', 'morgan_only_radius': 2, 'morgan_only_nBits': 2048, 'num_hidden_layers': 1, 'hidden_dim_0': 512, 'kl_weight': 0.00021164612592974586, 'lr': 0.0022891480993357458, 'batch_size': 32, 'dropout_rate': 0.4915904975724645, 'prior_mu': 0.07835932193790553, 'prior_sigma': 0.054863120739267184, 'normalization': 'none'}. Best is trial 272 with value: 0.5198344707489013.
Generating morgan fingerprints...
Generated fingerprints with 2048 features for 900 molecules
Data shape: X=(900, 2048), y=(900,)
Trial 1220: 5-fold CV loss = 0.5521
[I 2025-08-07 22:53:42,644] Trial 1220 finished with value: 0.5521489024162293 and parameters: {'fp_type': 'morgan', 'morgan_only_radius': 2, 'morgan_only_nBits': 2048, 'num_hidden_layers': 3, 'hidden_dim_0': 512, 'hidden_dim_1': 128, 'hidden_dim_2': 512, 'kl_weight': 0.00020744739493225198, 'lr': 0.0026645264009993587, 'batch_size': 32, 'dropout_rate': 0.4189064707297917, 'prior_mu': 0.04376923619458445, 'prior_sigma': 0.14080813437606438, 'normalization': 'none'}. Best is trial 272 with value: 0.5198344707489013.
Generating morgan fingerprints...
Generated fingerprints with 2048 features for 900 molecules
Data shape: X=(900, 2048), y=(900,)
Trial 1213: 5-fold CV loss = 0.5350
[I 2025-08-07 22:54:10,900] Trial 1213 finished with value: 0.5350152254104614 and parameters: {'fp_type': 'morgan', 'morgan_only_radius': 2, 'morgan_only_nBits': 2048, 'num_hidden_layers': 3, 'hidden_dim_0': 128, 'hidden_dim_1': 128, 'hidden_dim_2': 512, 'kl_weight': 0.00029095051644924426, 'lr': 0.0023149921977816523, 'batch_size': 32, 'dropout_rate': 0.4755040225970938, 'prior_mu': 0.008467913049844716, 'prior_sigma': 0.05891149323178627, 'normalization': 'none'}. Best is trial 272 with value: 0.5198344707489013.
Generating morgan fingerprints...
Generated fingerprints with 1024 features for 900 molecules
Data shape: X=(900, 1024), y=(900,)
Trial 1223: 5-fold CV loss = 0.5625
[I 2025-08-07 22:54:33,313] Trial 1223 finished with value: 0.5625387012958527 and parameters: {'fp_type': 'morgan', 'morgan_only_radius': 2, 'morgan_only_nBits': 2048, 'num_hidden_layers': 2, 'hidden_dim_0': 64, 'hidden_dim_1': 128, 'kl_weight': 0.00044549513134461223, 'lr': 0.0025013609735200348, 'batch_size': 32, 'dropout_rate': 0.49987142281279956, 'prior_mu': 0.042270214273568384, 'prior_sigma': 0.07250074413651696, 'normalization': 'none'}. Best is trial 272 with value: 0.5198344707489013.
Generating morgan fingerprints...
Generated fingerprints with 1024 features for 900 molecules
Data shape: X=(900, 1024), y=(900,)
Trial 1221: 5-fold CV loss = 0.5628
[I 2025-08-07 22:54:44,823] Trial 1221 finished with value: 0.5628058671951294 and parameters: {'fp_type': 'morgan', 'morgan_only_radius': 2, 'morgan_only_nBits': 2048, 'num_hidden_layers': 3, 'hidden_dim_0': 512, 'hidden_dim_1': 128, 'hidden_dim_2': 512, 'kl_weight': 0.00022422163883898676, 'lr': 0.002494011975303219, 'batch_size': 32, 'dropout_rate': 0.07765944543529879, 'prior_mu': -0.005304070448811572, 'prior_sigma': 0.15080687945676738, 'normalization': 'none'}. Best is trial 272 with value: 0.5198344707489013.
Generating morgan fingerprints...
Generated fingerprints with 1024 features for 900 molecules
Data shape: X=(900, 1024), y=(900,)
Trial 1226: 5-fold CV loss = 0.7007
[I 2025-08-07 22:55:07,860] Trial 1226 finished with value: 0.7007016897201538 and parameters: {'fp_type': 'morgan', 'morgan_only_radius': 2, 'morgan_only_nBits': 1024, 'num_hidden_layers': 3, 'hidden_dim_0': 512, 'hidden_dim_1': 128, 'hidden_dim_2': 512, 'kl_weight': 0.00021737618342406622, 'lr': 0.002032982454255336, 'batch_size': 64, 'dropout_rate': 0.46173305535872977, 'prior_mu': -0.006278640952557417, 'prior_sigma': 0.06818500560481679, 'normalization': 'none'}. Best is trial 272 with value: 0.5198344707489013.
Generating morgan fingerprints...
Generated fingerprints with 1024 features for 900 molecules
Data shape: X=(900, 1024), y=(900,)
Trial 1224: 5-fold CV loss = 0.5465
[I 2025-08-07 22:55:17,315] Trial 1224 finished with value: 0.5464612185955048 and parameters: {'fp_type': 'morgan', 'morgan_only_radius': 2, 'morgan_only_nBits': 2048, 'num_hidden_layers': 3, 'hidden_dim_0': 64, 'hidden_dim_1': 128, 'hidden_dim_2': 512, 'kl_weight': 0.00023666066456549362, 'lr': 0.0017443018834166358, 'batch_size': 32, 'dropout_rate': 0.4995907810337729, 'prior_mu': 0.00433778044554348, 'prior_sigma': 0.07237353189275053, 'normalization': 'none'}. Best is trial 272 with value: 0.5198344707489013.
Generating morgan fingerprints...
Generated fingerprints with 1024 features for 900 molecules
Data shape: X=(900, 1024), y=(900,)
Trial 1229: 5-fold CV loss = 0.5287
