[I 2025-08-07 20:13:41,158] Trial 782 finished with value: 0.5290315747261047 and parameters: {'fp_type': 'morgan', 'morgan_only_radius': 2, 'morgan_only_nBits': 2048, 'num_hidden_layers': 3, 'hidden_dim_0': 512, 'hidden_dim_1': 128, 'hidden_dim_2': 512, 'kl_weight': 0.0018708336308105916, 'lr': 0.0025376684232435776, 'batch_size': 32, 'dropout_rate': 0.48428169708267516, 'prior_mu': -0.020557828017986786, 'prior_sigma': 0.06885779400175937, 'normalization': 'none'}. Best is trial 272 with value: 0.5198344707489013.
Generating morgan fingerprints...
Generated fingerprints with 2048 features for 900 molecules
Data shape: X=(900, 2048), y=(900,)
Trial 785: 5-fold CV loss = 0.5237
[I 2025-08-07 20:14:27,308] Trial 785 finished with value: 0.5236757755279541 and parameters: {'fp_type': 'morgan', 'morgan_only_radius': 2, 'morgan_only_nBits': 2048, 'num_hidden_layers': 3, 'hidden_dim_0': 512, 'hidden_dim_1': 128, 'hidden_dim_2': 512, 'kl_weight': 0.0014192810622449543, 'lr': 0.002063927208418524, 'batch_size': 32, 'dropout_rate': 0.4849304571791058, 'prior_mu': -0.02048692553711844, 'prior_sigma': 0.06700334096923635, 'normalization': 'none'}. Best is trial 272 with value: 0.5198344707489013.
Generating morgan fingerprints...
Generated fingerprints with 2048 features for 900 molecules
Data shape: X=(900, 2048), y=(900,)
Trial 787: 5-fold CV loss = 1.4417
[I 2025-08-07 20:14:52,752] Trial 787 finished with value: 1.4416513204574586 and parameters: {'fp_type': 'morgan', 'morgan_only_radius': 2, 'morgan_only_nBits': 2048, 'num_hidden_layers': 3, 'hidden_dim_0': 512, 'hidden_dim_1': 1024, 'hidden_dim_2': 512, 'kl_weight': 0.0014101732614474004, 'lr': 0.002002650233603991, 'batch_size': 32, 'dropout_rate': 0.49899258744801905, 'prior_mu': -0.012259617745615422, 'prior_sigma': 0.07415719509118901, 'normalization': 'none'}. Best is trial 272 with value: 0.5198344707489013.
Generating morgan fingerprints...
Generated fingerprints with 2048 features for 900 molecules
Data shape: X=(900, 2048), y=(900,)
Trial 784: 5-fold CV loss = 0.5317
[I 2025-08-07 20:15:04,653] Trial 784 finished with value: 0.5317079782485962 and parameters: {'fp_type': 'morgan', 'morgan_only_radius': 2, 'morgan_only_nBits': 2048, 'num_hidden_layers': 3, 'hidden_dim_0': 512, 'hidden_dim_1': 128, 'hidden_dim_2': 512, 'kl_weight': 0.0018171978370095517, 'lr': 0.002043403465075136, 'batch_size': 32, 'dropout_rate': 0.49958928401551606, 'prior_mu': -0.02185449431140391, 'prior_sigma': 0.06678657247435632, 'normalization': 'none'}. Best is trial 272 with value: 0.5198344707489013.
Generating morgan fingerprints...
Generated fingerprints with 2048 features for 900 molecules
Data shape: X=(900, 2048), y=(900,)
Trial 786: 5-fold CV loss = 0.7942
[I 2025-08-07 20:15:13,337] Trial 786 finished with value: 0.7941589951515198 and parameters: {'fp_type': 'morgan', 'morgan_only_radius': 2, 'morgan_only_nBits': 2048, 'num_hidden_layers': 3, 'hidden_dim_0': 512, 'hidden_dim_1': 1024, 'hidden_dim_2': 512, 'kl_weight': 0.0013972857880382534, 'lr': 0.002052774310935289, 'batch_size': 32, 'dropout_rate': 0.4925805852518256, 'prior_mu': -0.012942314452044522, 'prior_sigma': 0.06719642333093866, 'normalization': 'none'}. Best is trial 272 with value: 0.5198344707489013.
Generating morgan fingerprints...
Generated fingerprints with 2048 features for 900 molecules
Data shape: X=(900, 2048), y=(900,)
Trial 788: 5-fold CV loss = 3.6458
[I 2025-08-07 20:15:27,784] Trial 788 finished with value: 3.64581298828125 and parameters: {'fp_type': 'morgan', 'morgan_only_radius': 2, 'morgan_only_nBits': 2048, 'num_hidden_layers': 3, 'hidden_dim_0': 1024, 'hidden_dim_1': 512, 'hidden_dim_2': 128, 'kl_weight': 0.0013607489164412438, 'lr': 0.002014340087256265, 'batch_size': 32, 'dropout_rate': 0.4996471157320159, 'prior_mu': -0.020980493041209664, 'prior_sigma': 0.14859769869707262, 'normalization': 'none'}. Best is trial 272 with value: 0.5198344707489013.
Generating morgan fingerprints...
Generated fingerprints with 2048 features for 900 molecules
Data shape: X=(900, 2048), y=(900,)
Trial 783: 5-fold CV loss = 0.5292
[I 2025-08-07 20:16:06,017] Trial 783 finished with value: 0.5291853606700897 and parameters: {'fp_type': 'morgan', 'morgan_only_radius': 2, 'morgan_only_nBits': 2048, 'num_hidden_layers': 3, 'hidden_dim_0': 512, 'hidden_dim_1': 128, 'hidden_dim_2': 512, 'kl_weight': 0.0017752323753391366, 'lr': 0.0024952418482953233, 'batch_size': 32, 'dropout_rate': 0.48621022236624434, 'prior_mu': -0.019771562067002306, 'prior_sigma': 0.06890794673695078, 'normalization': 'none'}. Best is trial 272 with value: 0.5198344707489013.
Generating morgan fingerprints...
Generated fingerprints with 2048 features for 900 molecules
Data shape: X=(900, 2048), y=(900,)
Trial 791: 5-fold CV loss = 0.5780
[I 2025-08-07 20:16:36,250] Trial 791 finished with value: 0.5780153274536133 and parameters: {'fp_type': 'morgan', 'morgan_only_radius': 2, 'morgan_only_nBits': 2048, 'num_hidden_layers': 3, 'hidden_dim_0': 512, 'hidden_dim_1': 256, 'hidden_dim_2': 256, 'kl_weight': 0.002718807426240751, 'lr': 0.002576490301839415, 'batch_size': 32, 'dropout_rate': 0.48262931915615337, 'prior_mu': -0.009626118308666283, 'prior_sigma': 0.06298815426733502, 'normalization': 'none'}. Best is trial 272 with value: 0.5198344707489013.
Generating rdkit fingerprints...
Generated fingerprints with 256 features for 900 molecules
Data shape: X=(900, 256), y=(900,)
Trial 789: 5-fold CV loss = 1.8667
[I 2025-08-07 20:16:44,075] Trial 789 finished with value: 1.8666868925094604 and parameters: {'fp_type': 'morgan', 'morgan_only_radius': 2, 'morgan_only_nBits': 2048, 'num_hidden_layers': 3, 'hidden_dim_0': 1024, 'hidden_dim_1': 256, 'hidden_dim_2': 128, 'kl_weight': 0.0012997127993673399, 'lr': 0.0018824125300440427, 'batch_size': 32, 'dropout_rate': 0.4905009689216178, 'prior_mu': -0.011301832185396932, 'prior_sigma': 0.15504474399060175, 'normalization': 'none'}. Best is trial 272 with value: 0.5198344707489013.
Generating rdkit fingerprints...
Generated fingerprints with 256 features for 900 molecules
Data shape: X=(900, 256), y=(900,)
Trial 790: 5-fold CV loss = 0.6246
[I 2025-08-07 20:16:51,690] Trial 790 finished with value: 0.6246456027030944 and parameters: {'fp_type': 'morgan', 'morgan_only_radius': 2, 'morgan_only_nBits': 2048, 'num_hidden_layers': 3, 'hidden_dim_0': 512, 'hidden_dim_1': 256, 'hidden_dim_2': 512, 'kl_weight': 0.0027377495851704553, 'lr': 0.0018790047655654484, 'batch_size': 32, 'dropout_rate': 0.49974963237474235, 'prior_mu': -0.0184393725262918, 'prior_sigma': 0.06270542281445911, 'normalization': 'none'}. Best is trial 272 with value: 0.5198344707489013.
Generating morgan fingerprints...
Generated fingerprints with 2048 features for 900 molecules
Data shape: X=(900, 2048), y=(900,)
Trial 793: 5-fold CV loss = 0.6162
[I 2025-08-07 20:17:44,142] Trial 793 finished with value: 0.6161625504493713 and parameters: {'fp_type': 'rdkit', 'rdkit_only_maxPath': 5, 'rdkit_only_nBits': 256, 'num_hidden_layers': 3, 'hidden_dim_0': 128, 'hidden_dim_1': 128, 'hidden_dim_2': 512, 'kl_weight': 0.002040491875878051, 'lr': 0.001799382280438475, 'batch_size': 32, 'dropout_rate': 0.45782654087777974, 'prior_mu': 0.000225223521989666, 'prior_sigma': 0.06224737683266787, 'normalization': 'none'}. Best is trial 272 with value: 0.5198344707489013.
Generating morgan fingerprints...
Generated fingerprints with 2048 features for 900 molecules
Data shape: X=(900, 2048), y=(900,)
Trial 795: 5-fold CV loss = 0.5319
[I 2025-08-07 20:18:10,962] Trial 795 finished with value: 0.5318676173686981 and parameters: {'fp_type': 'morgan', 'morgan_only_radius': 2, 'morgan_only_nBits': 2048, 'num_hidden_layers': 3, 'hidden_dim_0': 512, 'hidden_dim_1': 128, 'hidden_dim_2': 512, 'kl_weight': 0.0015892388850743283, 'lr': 0.0022006970488339674, 'batch_size': 32, 'dropout_rate': 0.4660139821830823, 'prior_mu': 0.0029585801788030545, 'prior_sigma': 0.07433977241006917, 'normalization': 'none'}. Best is trial 272 with value: 0.5198344707489013.
Generating morgan fingerprints...
Generated fingerprints with 2048 features for 900 molecules
Data shape: X=(900, 2048), y=(900,)
Trial 794: 5-fold CV loss = 0.6152
[I 2025-08-07 20:18:33,971] Trial 794 finished with value: 0.6151764631271363 and parameters: {'fp_type': 'rdkit', 'rdkit_only_maxPath': 5, 'rdkit_only_nBits': 256, 'num_hidden_layers': 3, 'hidden_dim_0': 128, 'hidden_dim_1': 128, 'hidden_dim_2': 512, 'kl_weight': 0.0016025720857692773, 'lr': 0.0017869113679309316, 'batch_size': 32, 'dropout_rate': 0.4585710748748674, 'prior_mu': 0.00266081428863044, 'prior_sigma': 0.062480896873544585, 'normalization': 'none'}. Best is trial 272 with value: 0.5198344707489013.
Generating morgan fingerprints...
Generated fingerprints with 2048 features for 900 molecules
Data shape: X=(900, 2048), y=(900,)
Trial 796: 5-fold CV loss = 0.5273
[I 2025-08-07 20:18:52,459] Trial 796 finished with value: 0.5273244798183441 and parameters: {'fp_type': 'morgan', 'morgan_only_radius': 2, 'morgan_only_nBits': 2048, 'num_hidden_layers': 3, 'hidden_dim_0': 512, 'hidden_dim_1': 128, 'hidden_dim_2': 512, 'kl_weight': 0.0016802749390079192, 'lr': 0.002229180388211872, 'batch_size': 32, 'dropout_rate': 0.47759449078601524, 'prior_mu': 0.014741862076297584, 'prior_sigma': 0.07458893213856312, 'normalization': 'none'}. Best is trial 272 with value: 0.5198344707489013.
Generating morgan fingerprints...
Generated fingerprints with 2048 features for 900 molecules
Data shape: X=(900, 2048), y=(900,)
Trial 799: 5-fold CV loss = 1.0025
[I 2025-08-07 20:19:23,443] Trial 799 finished with value: 1.0024799466133119 and parameters: {'fp_type': 'morgan', 'morgan_only_radius': 2, 'morgan_only_nBits': 2048, 'num_hidden_layers': 3, 'hidden_dim_0': 512, 'hidden_dim_1': 128, 'hidden_dim_2': 512, 'kl_weight': 0.0032530740746684324, 'lr': 0.00012011104383087139, 'batch_size': 32, 'dropout_rate': 0.48490405116746227, 'prior_mu': -0.010686690702935143, 'prior_sigma': 0.07186596747040461, 'normalization': 'none'}. Best is trial 272 with value: 0.5198344707489013.
Generating morgan fingerprints...
Generated fingerprints with 2048 features for 900 molecules
Data shape: X=(900, 2048), y=(900,)
Trial 797: 5-fold CV loss = 0.5342
[I 2025-08-07 20:19:25,601] Trial 797 finished with value: 0.534194391965866 and parameters: {'fp_type': 'morgan', 'morgan_only_radius': 2, 'morgan_only_nBits': 2048, 'num_hidden_layers': 3, 'hidden_dim_0': 512, 'hidden_dim_1': 128, 'hidden_dim_2': 512, 'kl_weight': 0.0023674960950039715, 'lr': 0.002274678087692029, 'batch_size': 32, 'dropout_rate': 0.478578930435845, 'prior_mu': 0.014387234743097034, 'prior_sigma': 0.08081211199728752, 'normalization': 'none'}. Best is trial 272 with value: 0.5198344707489013.
Generating morgan fingerprints...
Generated fingerprints with 2048 features for 900 molecules
Data shape: X=(900, 2048), y=(900,)
Trial 801: 5-fold CV loss = 0.6485
[I 2025-08-07 20:20:08,526] Trial 801 finished with value: 0.6485038161277771 and parameters: {'fp_type': 'morgan', 'morgan_only_radius': 3, 'morgan_only_nBits': 2048, 'num_hidden_layers': 3, 'hidden_dim_0': 64, 'hidden_dim_1': 128, 'hidden_dim_2': 512, 'kl_weight': 0.0020084428104296392, 'lr': 0.0027635966109750922, 'batch_size': 32, 'dropout_rate': 0.4461964159693325, 'prior_mu': -0.027317140088236727, 'prior_sigma': 0.11383611130908067, 'normalization': 'none'}. Best is trial 272 with value: 0.5198344707489013.
Generating morgan fingerprints...
Generated fingerprints with 2048 features for 900 molecules
Data shape: X=(900, 2048), y=(900,)
Trial 800: 5-fold CV loss = 0.5616
[I 2025-08-07 20:20:16,731] Trial 800 finished with value: 0.5616208553314209 and parameters: {'fp_type': 'morgan', 'morgan_only_radius': 2, 'morgan_only_nBits': 2048, 'num_hidden_layers': 3, 'hidden_dim_0': 64, 'hidden_dim_1': 128, 'hidden_dim_2': 512, 'kl_weight': 0.0024112769778488192, 'lr': 0.0027939892812233486, 'batch_size': 32, 'dropout_rate': 0.22461964700652062, 'prior_mu': -0.026333891423456247, 'prior_sigma': 0.08111578567094467, 'normalization': 'none'}. Best is trial 272 with value: 0.5198344707489013.
Generating morgan fingerprints...
Generated fingerprints with 2048 features for 900 molecules
Data shape: X=(900, 2048), y=(900,)
Trial 792: 5-fold CV loss = 0.5460
[I 2025-08-07 20:20:38,757] Trial 792 finished with value: 0.5459908604621887 and parameters: {'fp_type': 'morgan', 'morgan_only_radius': 2, 'morgan_only_nBits': 2048, 'num_hidden_layers': 3, 'hidden_dim_0': 128, 'hidden_dim_1': 256, 'hidden_dim_2': 512, 'kl_weight': 0.0027495753247889112, 'lr': 0.0018712933578279487, 'batch_size': 32, 'dropout_rate': 0.4583889672684775, 'prior_mu': -0.011201355049809828, 'prior_sigma': 0.062449066277487565, 'normalization': 'none'}. Best is trial 272 with value: 0.5198344707489013.
Generating morgan fingerprints...
Generated fingerprints with 2048 features for 900 molecules
Data shape: X=(900, 2048), y=(900,)
Trial 798: 5-fold CV loss = 0.5379
[I 2025-08-07 20:20:39,355] Trial 798 finished with value: 0.5378743588924408 and parameters: {'fp_type': 'morgan', 'morgan_only_radius': 2, 'morgan_only_nBits': 2048, 'num_hidden_layers': 3, 'hidden_dim_0': 512, 'hidden_dim_1': 128, 'hidden_dim_2': 512, 'kl_weight': 0.0031511760720994678, 'lr': 0.002218426978605913, 'batch_size': 32, 'dropout_rate': 0.47797845966621144, 'prior_mu': 0.015142055519251657, 'prior_sigma': 0.11385416387013819, 'normalization': 'none'}. Best is trial 272 with value: 0.5198344707489013.
Generating morgan fingerprints...
Generated fingerprints with 2048 features for 900 molecules
Data shape: X=(900, 2048), y=(900,)
Trial 803: 5-fold CV loss = 0.7339
[I 2025-08-07 20:20:45,693] Trial 803 finished with value: 0.7338708758354187 and parameters: {'fp_type': 'morgan', 'morgan_only_radius': 2, 'morgan_only_nBits': 2048, 'num_hidden_layers': 3, 'hidden_dim_0': 512, 'hidden_dim_1': 128, 'hidden_dim_2': 64, 'kl_weight': 0.0013113403501036293, 'lr': 0.0025578244234264903, 'batch_size': 32, 'dropout_rate': 0.4903840640089823, 'prior_mu': -0.006878290372030942, 'prior_sigma': 0.0670311887733657, 'normalization': 'none'}. Best is trial 272 with value: 0.5198344707489013.
Generating morgan fingerprints...
Generated fingerprints with 2048 features for 900 molecules
Data shape: X=(900, 2048), y=(900,)
Trial 802: 5-fold CV loss = 0.5210
[I 2025-08-07 20:21:47,278] Trial 802 finished with value: 0.5209780931472778 and parameters: {'fp_type': 'morgan', 'morgan_only_radius': 2, 'morgan_only_nBits': 2048, 'num_hidden_layers': 3, 'hidden_dim_0': 512, 'hidden_dim_1': 128, 'hidden_dim_2': 512, 'kl_weight': 0.0012456358860088983, 'lr': 0.002116872150834109, 'batch_size': 32, 'dropout_rate': 0.4908396339021266, 'prior_mu': -0.02579968125573692, 'prior_sigma': 0.06693964990995954, 'normalization': 'none'}. Best is trial 272 with value: 0.5198344707489013.
Generating morgan fingerprints...
Generated fingerprints with 2048 features for 900 molecules
Data shape: X=(900, 2048), y=(900,)
Trial 806: 5-fold CV loss = 0.5325
[I 2025-08-07 20:21:51,003] Trial 806 finished with value: 0.5324662983417511 and parameters: {'fp_type': 'morgan', 'morgan_only_radius': 2, 'morgan_only_nBits': 2048, 'num_hidden_layers': 3, 'hidden_dim_0': 512, 'hidden_dim_1': 128, 'hidden_dim_2': 512, 'kl_weight': 0.0018659296471894282, 'lr': 0.0024336784079170906, 'batch_size': 32, 'dropout_rate': 0.4998892865126853, 'prior_mu': -0.018400661688029125, 'prior_sigma': 0.06885989140544765, 'normalization': 'none'}. Best is trial 272 with value: 0.5198344707489013.
Generating morgan fingerprints...
Generated fingerprints with 2048 features for 900 molecules
Data shape: X=(900, 2048), y=(900,)
Trial 805: 5-fold CV loss = 0.5404
[I 2025-08-07 20:22:43,456] Trial 805 finished with value: 0.5404331386089325 and parameters: {'fp_type': 'morgan', 'morgan_only_radius': 2, 'morgan_only_nBits': 2048, 'num_hidden_layers': 3, 'hidden_dim_0': 512, 'hidden_dim_1': 128, 'hidden_dim_2': 512, 'kl_weight': 0.001248583831590195, 'lr': 0.002567825762674399, 'batch_size': 32, 'dropout_rate': 0.49094180254719866, 'prior_mu': -0.016660561810304432, 'prior_sigma': 0.0885828031003266, 'normalization': 'none'}. Best is trial 272 with value: 0.5198344707489013.
Generating morgan fingerprints...
Generated fingerprints with 2048 features for 900 molecules
Data shape: X=(900, 2048), y=(900,)
Trial 807: 5-fold CV loss = 0.5275
[I 2025-08-07 20:23:01,774] Trial 807 finished with value: 0.5274938583374024 and parameters: {'fp_type': 'morgan', 'morgan_only_radius': 2, 'morgan_only_nBits': 2048, 'num_hidden_layers': 3, 'hidden_dim_0': 512, 'hidden_dim_1': 128, 'hidden_dim_2': 512, 'kl_weight': 0.0019261194808400397, 'lr': 0.002359333246554358, 'batch_size': 32, 'dropout_rate': 0.46703381818864875, 'prior_mu': -0.02118617815898754, 'prior_sigma': 0.07154709339578602, 'normalization': 'none'}. Best is trial 272 with value: 0.5198344707489013.
Generating morgan fingerprints...
Generated fingerprints with 2048 features for 900 molecules
Data shape: X=(900, 2048), y=(900,)
Trial 808: 5-fold CV loss = 0.5258
[I 2025-08-07 20:23:05,854] Trial 808 finished with value: 0.5257900774478912 and parameters: {'fp_type': 'morgan', 'morgan_only_radius': 2, 'morgan_only_nBits': 2048, 'num_hidden_layers': 3, 'hidden_dim_0': 512, 'hidden_dim_1': 128, 'hidden_dim_2': 512, 'kl_weight': 0.0014821026360110497, 'lr': 0.0020921368783376557, 'batch_size': 32, 'dropout_rate': 0.47019849609871406, 'prior_mu': -0.02655652562531526, 'prior_sigma': 0.0780307144159165, 'normalization': 'none'}. Best is trial 272 with value: 0.5198344707489013.
Generating morgan fingerprints...
Generated fingerprints with 2048 features for 900 molecules
Data shape: X=(900, 2048), y=(900,)
Trial 804: 5-fold CV loss = 0.6482
[I 2025-08-07 20:23:40,458] Trial 804 finished with value: 0.6482019901275635 and parameters: {'fp_type': 'morgan', 'morgan_only_radius': 2, 'morgan_only_nBits': 2048, 'num_hidden_layers': 3, 'hidden_dim_0': 512, 'hidden_dim_1': 128, 'hidden_dim_2': 64, 'kl_weight': 0.001253530966092628, 'lr': 0.0025434490291330078, 'batch_size': 32, 'dropout_rate': 0.14703462886110524, 'prior_mu': -0.005509137336691722, 'prior_sigma': 0.06754489354894616, 'normalization': 'none'}. Best is trial 272 with value: 0.5198344707489013.
Generating morgan fingerprints...
Generated fingerprints with 2048 features for 900 molecules
Data shape: X=(900, 2048), y=(900,)
Trial 811: 5-fold CV loss = 0.5261
[I 2025-08-07 20:24:20,898] Trial 811 finished with value: 0.5261465668678283 and parameters: {'fp_type': 'morgan', 'morgan_only_radius': 2, 'morgan_only_nBits': 2048, 'num_hidden_layers': 3, 'hidden_dim_0': 512, 'hidden_dim_1': 128, 'hidden_dim_2': 512, 'kl_weight': 0.007595332436951619, 'lr': 0.002268308995892987, 'batch_size': 32, 'dropout_rate': 0.4825843721044515, 'prior_mu': -0.03018748266256164, 'prior_sigma': 0.0662999010953273, 'normalization': 'none'}. Best is trial 272 with value: 0.5198344707489013.
Generating morgan fingerprints...
Generated fingerprints with 2048 features for 900 molecules
Data shape: X=(900, 2048), y=(900,)
Trial 810: 5-fold CV loss = 0.5301
[I 2025-08-07 20:24:31,707] Trial 810 finished with value: 0.5300910949707032 and parameters: {'fp_type': 'morgan', 'morgan_only_radius': 2, 'morgan_only_nBits': 2048, 'num_hidden_layers': 3, 'hidden_dim_0': 512, 'hidden_dim_1': 128, 'hidden_dim_2': 512, 'kl_weight': 0.002176106234565256, 'lr': 0.002112100545189826, 'batch_size': 32, 'dropout_rate': 0.4721811773878444, 'prior_mu': -0.028538510634801405, 'prior_sigma': 0.07708775109584448, 'normalization': 'none'}. Best is trial 272 with value: 0.5198344707489013.
Generating morgan fingerprints...
Generated fingerprints with 2048 features for 900 molecules
Data shape: X=(900, 2048), y=(900,)
Trial 809: 5-fold CV loss = 0.5280
[I 2025-08-07 20:24:59,234] Trial 809 finished with value: 0.5280187606811524 and parameters: {'fp_type': 'morgan', 'morgan_only_radius': 2, 'morgan_only_nBits': 2048, 'num_hidden_layers': 3, 'hidden_dim_0': 512, 'hidden_dim_1': 128, 'hidden_dim_2': 512, 'kl_weight': 0.0021918159782287343, 'lr': 0.0021242105013286224, 'batch_size': 32, 'dropout_rate': 0.4724144116625829, 'prior_mu': -0.025249860942174806, 'prior_sigma': 0.07638051652886402, 'normalization': 'none'}. Best is trial 272 with value: 0.5198344707489013.
Generating morgan fingerprints...
Generated fingerprints with 2048 features for 900 molecules
Data shape: X=(900, 2048), y=(900,)
Trial 813: 5-fold CV loss = 0.5362
[I 2025-08-07 20:25:27,323] Trial 813 finished with value: 0.536246258020401 and parameters: {'fp_type': 'morgan', 'morgan_only_radius': 2, 'morgan_only_nBits': 2048, 'num_hidden_layers': 3, 'hidden_dim_0': 512, 'hidden_dim_1': 128, 'hidden_dim_2': 512, 'kl_weight': 0.0023558820513906657, 'lr': 0.0028511678463917895, 'batch_size': 32, 'dropout_rate': 0.47738288442187904, 'prior_mu': -0.01725964489671082, 'prior_sigma': 0.0759588170494226, 'normalization': 'none'}. Best is trial 272 with value: 0.5198344707489013.
Generating morgan fingerprints...
Generated fingerprints with 2048 features for 900 molecules
Data shape: X=(900, 2048), y=(900,)
Trial 814: 5-fold CV loss = 0.5390
[I 2025-08-07 20:25:37,757] Trial 814 finished with value: 0.5390076160430908 and parameters: {'fp_type': 'morgan', 'morgan_only_radius': 2, 'morgan_only_nBits': 2048, 'num_hidden_layers': 3, 'hidden_dim_0': 512, 'hidden_dim_1': 128, 'hidden_dim_2': 512, 'kl_weight': 0.0016559861451476885, 'lr': 0.0028896396635285084, 'batch_size': 32, 'dropout_rate': 0.45115753157166755, 'prior_mu': -0.01788582849728592, 'prior_sigma': 0.07276140773820804, 'normalization': 'none'}. Best is trial 272 with value: 0.5198344707489013.
Generating morgan fingerprints...
Generated fingerprints with 2048 features for 900 molecules
Data shape: X=(900, 2048), y=(900,)
Trial 816: 5-fold CV loss = 0.5742
