[I 2025-08-08 07:36:30,403] Trial 2739 finished with value: 1.0349444031715394 and parameters: {'fp_type': 'morgan', 'morgan_only_radius': 2, 'morgan_only_nBits': 2048, 'num_hidden_layers': 3, 'hidden_dim_0': 512, 'hidden_dim_1': 128, 'hidden_dim_2': 1024, 'kl_weight': 0.0007034961645286603, 'lr': 0.0015800107036547716, 'batch_size': 128, 'dropout_rate': 0.44747824012480353, 'prior_mu': 0.054853950436323046, 'prior_sigma': 0.07382893495399116, 'normalization': 'none'}. Best is trial 2426 with value: 0.515486741065979.
Generating morgan fingerprints...
Generated fingerprints with 2048 features for 900 molecules
Data shape: X=(900, 2048), y=(900,)
Trial 2737: 5-fold CV loss = 0.5786
[I 2025-08-08 07:36:32,096] Trial 2737 finished with value: 0.5785852789878845 and parameters: {'fp_type': 'morgan', 'morgan_only_radius': 2, 'morgan_only_nBits': 2048, 'num_hidden_layers': 3, 'hidden_dim_0': 1024, 'hidden_dim_1': 128, 'hidden_dim_2': 1024, 'kl_weight': 0.0004247297265166703, 'lr': 0.0018822999570496262, 'batch_size': 32, 'dropout_rate': 0.44738081403872004, 'prior_mu': 0.044293957040574865, 'prior_sigma': 0.07601421321511644, 'normalization': 'layer'}. Best is trial 2426 with value: 0.515486741065979.
Generating morgan_rdkit fingerprints...
Generated fingerprints with 2048 features for 900 molecules
Data shape: X=(900, 2048), y=(900,)
Trial 2742: 5-fold CV loss = 0.5260
[I 2025-08-08 07:37:36,281] Trial 2742 finished with value: 0.5260110378265381 and parameters: {'fp_type': 'morgan', 'morgan_only_radius': 2, 'morgan_only_nBits': 2048, 'num_hidden_layers': 3, 'hidden_dim_0': 512, 'hidden_dim_1': 128, 'hidden_dim_2': 512, 'kl_weight': 0.010467487744222332, 'lr': 0.002148815741314541, 'batch_size': 32, 'dropout_rate': 0.4553708025915923, 'prior_mu': 0.04622499558047775, 'prior_sigma': 0.0711818864680921, 'normalization': 'none'}. Best is trial 2426 with value: 0.515486741065979.
Generating morgan_rdkit fingerprints...
Generated fingerprints with 2048 features for 900 molecules
Data shape: X=(900, 2048), y=(900,)
Trial 2740: 5-fold CV loss = 0.5520
[I 2025-08-08 07:37:47,228] Trial 2740 finished with value: 0.5519932508468628 and parameters: {'fp_type': 'morgan', 'morgan_only_radius': 2, 'morgan_only_nBits': 2048, 'num_hidden_layers': 3, 'hidden_dim_0': 512, 'hidden_dim_1': 128, 'hidden_dim_2': 1024, 'kl_weight': 0.0007906139179874771, 'lr': 0.0021902772306085752, 'batch_size': 32, 'dropout_rate': 0.44730238016131496, 'prior_mu': 0.10561633918337736, 'prior_sigma': 0.07225172468086383, 'normalization': 'none'}. Best is trial 2426 with value: 0.515486741065979.
Generating morgan_rdkit fingerprints...
Generated fingerprints with 2048 features for 900 molecules
Data shape: X=(900, 2048), y=(900,)
Trial 2743: 5-fold CV loss = 0.6168
[I 2025-08-08 07:37:51,854] Trial 2743 finished with value: 0.6168233633041382 and parameters: {'fp_type': 'morgan_rdkit', 'combined_morgan_radius': 2, 'combined_morgan_nBits': 1024, 'combined_rdkit_maxPath': 8, 'combined_rdkit_nBits': 1024, 'num_hidden_layers': 3, 'hidden_dim_0': 512, 'hidden_dim_1': 128, 'hidden_dim_2': 512, 'kl_weight': 0.0007961641398269059, 'lr': 0.002168055789415093, 'batch_size': 32, 'dropout_rate': 0.4556377003956239, 'prior_mu': 0.10317219525604152, 'prior_sigma': 0.07030613979193748, 'normalization': 'none'}. Best is trial 2426 with value: 0.515486741065979.
Generating morgan fingerprints...
Generated fingerprints with 2048 features for 900 molecules
Data shape: X=(900, 2048), y=(900,)
Trial 2744: 5-fold CV loss = 0.6403
[I 2025-08-08 07:38:13,678] Trial 2744 finished with value: 0.6403241753578186 and parameters: {'fp_type': 'morgan_rdkit', 'combined_morgan_radius': 2, 'combined_morgan_nBits': 1024, 'combined_rdkit_maxPath': 8, 'combined_rdkit_nBits': 1024, 'num_hidden_layers': 3, 'hidden_dim_0': 512, 'hidden_dim_1': 64, 'hidden_dim_2': 512, 'kl_weight': 0.0007814779056706522, 'lr': 0.0022118175875474304, 'batch_size': 32, 'dropout_rate': 0.4397316508370521, 'prior_mu': 0.07148021139050029, 'prior_sigma': 0.054830084780951444, 'normalization': 'none'}. Best is trial 2426 with value: 0.515486741065979.
Generating morgan fingerprints...
Generated fingerprints with 2048 features for 900 molecules
Data shape: X=(900, 2048), y=(900,)
Trial 2746: 5-fold CV loss = 0.5332
[I 2025-08-08 07:39:01,486] Trial 2746 finished with value: 0.5331680297851562 and parameters: {'fp_type': 'morgan', 'morgan_only_radius': 2, 'morgan_only_nBits': 2048, 'num_hidden_layers': 3, 'hidden_dim_0': 512, 'hidden_dim_1': 64, 'hidden_dim_2': 512, 'kl_weight': 0.0005851779843352064, 'lr': 0.0025045311479587316, 'batch_size': 32, 'dropout_rate': 0.4391152183321202, 'prior_mu': 0.07019762292804785, 'prior_sigma': 0.055131941302815984, 'normalization': 'none'}. Best is trial 2426 with value: 0.515486741065979.
Generating morgan fingerprints...
Generated fingerprints with 2048 features for 900 molecules
Data shape: X=(900, 2048), y=(900,)
Trial 2745: 5-fold CV loss = 0.6091
[I 2025-08-08 07:39:09,568] Trial 2745 finished with value: 0.6091124653816223 and parameters: {'fp_type': 'morgan_rdkit', 'combined_morgan_radius': 2, 'combined_morgan_nBits': 1024, 'combined_rdkit_maxPath': 8, 'combined_rdkit_nBits': 1024, 'num_hidden_layers': 3, 'hidden_dim_0': 512, 'hidden_dim_1': 64, 'hidden_dim_2': 512, 'kl_weight': 0.0005813280072399962, 'lr': 0.0016091918070040537, 'batch_size': 32, 'dropout_rate': 0.41822327860299924, 'prior_mu': 0.010630709122880947, 'prior_sigma': 0.054263928816144835, 'normalization': 'none'}. Best is trial 2426 with value: 0.515486741065979.
Generating morgan fingerprints...
Generated fingerprints with 2048 features for 900 molecules
Data shape: X=(900, 2048), y=(900,)
Trial 2747: 5-fold CV loss = 0.5650
[I 2025-08-08 07:39:19,283] Trial 2747 finished with value: 0.5649860024452209 and parameters: {'fp_type': 'morgan', 'morgan_only_radius': 2, 'morgan_only_nBits': 2048, 'num_hidden_layers': 3, 'hidden_dim_0': 64, 'hidden_dim_1': 256, 'hidden_dim_2': 512, 'kl_weight': 0.0006019426778040275, 'lr': 0.001688237133826152, 'batch_size': 32, 'dropout_rate': 0.42041572216784107, 'prior_mu': 0.028883123502512976, 'prior_sigma': 0.06358338198529168, 'normalization': 'none'}. Best is trial 2426 with value: 0.515486741065979.
Generating morgan fingerprints...
Generated fingerprints with 2048 features for 900 molecules
Data shape: X=(900, 2048), y=(900,)
Trial 2741: 5-fold CV loss = 0.5397
[I 2025-08-08 07:40:03,826] Trial 2741 finished with value: 0.5396793246269226 and parameters: {'fp_type': 'morgan', 'morgan_only_radius': 2, 'morgan_only_nBits': 2048, 'num_hidden_layers': 3, 'hidden_dim_0': 512, 'hidden_dim_1': 128, 'hidden_dim_2': 1024, 'kl_weight': 0.0007749129120350424, 'lr': 0.0021540295662946054, 'batch_size': 32, 'dropout_rate': 0.44744727516767396, 'prior_mu': 0.05627028156292766, 'prior_sigma': 0.09486841960546472, 'normalization': 'none'}. Best is trial 2426 with value: 0.515486741065979.
Generating morgan fingerprints...
Generated fingerprints with 2048 features for 900 molecules
Data shape: X=(900, 2048), y=(900,)
Trial 2748: 5-fold CV loss = 0.5711
[I 2025-08-08 07:40:06,876] Trial 2748 finished with value: 0.5711250364780426 and parameters: {'fp_type': 'morgan', 'morgan_only_radius': 2, 'morgan_only_nBits': 2048, 'num_hidden_layers': 3, 'hidden_dim_0': 64, 'hidden_dim_1': 256, 'hidden_dim_2': 512, 'kl_weight': 0.00066063680878032, 'lr': 0.0016779453424599104, 'batch_size': 32, 'dropout_rate': 0.41779438229271837, 'prior_mu': 0.028358029487850496, 'prior_sigma': 0.06157422649181664, 'normalization': 'none'}. Best is trial 2426 with value: 0.515486741065979.
Generating morgan fingerprints...
Generated fingerprints with 2048 features for 900 molecules
Data shape: X=(900, 2048), y=(900,)
Trial 2750: 5-fold CV loss = 0.5282
[I 2025-08-08 07:40:43,063] Trial 2750 finished with value: 0.5281869351863862 and parameters: {'fp_type': 'morgan', 'morgan_only_radius': 2, 'morgan_only_nBits': 2048, 'num_hidden_layers': 3, 'hidden_dim_0': 512, 'hidden_dim_1': 128, 'hidden_dim_2': 512, 'kl_weight': 0.0006715330745756775, 'lr': 0.0020366748697668424, 'batch_size': 32, 'dropout_rate': 0.40180701342493536, 'prior_mu': 0.05514853129348919, 'prior_sigma': 0.0799846728774998, 'normalization': 'none'}. Best is trial 2426 with value: 0.515486741065979.
Generating morgan fingerprints...
Generated fingerprints with 2048 features for 900 molecules
Data shape: X=(900, 2048), y=(900,)
Trial 2749: 5-fold CV loss = 0.6479
[I 2025-08-08 07:40:50,436] Trial 2749 finished with value: 0.6479419827461242 and parameters: {'fp_type': 'morgan', 'morgan_only_radius': 2, 'morgan_only_nBits': 2048, 'num_hidden_layers': 3, 'hidden_dim_0': 64, 'hidden_dim_1': 128, 'hidden_dim_2': 512, 'kl_weight': 0.0006705072771186657, 'lr': 0.0012606173144459765, 'batch_size': 32, 'dropout_rate': 0.39653234183683167, 'prior_mu': 0.028594854421088688, 'prior_sigma': 0.13982740077839872, 'normalization': 'none'}. Best is trial 2426 with value: 0.515486741065979.
Generating morgan fingerprints...
Generated fingerprints with 2048 features for 900 molecules
Data shape: X=(900, 2048), y=(900,)
Trial 2752: 5-fold CV loss = 0.5151
[I 2025-08-08 07:41:42,146] Trial 2752 finished with value: 0.5150722622871399 and parameters: {'fp_type': 'morgan', 'morgan_only_radius': 2, 'morgan_only_nBits': 2048, 'num_hidden_layers': 3, 'hidden_dim_0': 512, 'hidden_dim_1': 128, 'hidden_dim_2': 512, 'kl_weight': 0.0009746018008541378, 'lr': 0.0019791965112726, 'batch_size': 32, 'dropout_rate': 0.3853744284884622, 'prior_mu': 0.03751670194750995, 'prior_sigma': 0.07991072381868229, 'normalization': 'none'}. Best is trial 2752 with value: 0.5150722622871399.
Generating morgan fingerprints...
Generated fingerprints with 2048 features for 900 molecules
Data shape: X=(900, 2048), y=(900,)
Trial 2753: 5-fold CV loss = 0.5245
[I 2025-08-08 07:41:54,344] Trial 2753 finished with value: 0.5244912683963776 and parameters: {'fp_type': 'morgan', 'morgan_only_radius': 2, 'morgan_only_nBits': 2048, 'num_hidden_layers': 3, 'hidden_dim_0': 512, 'hidden_dim_1': 128, 'hidden_dim_2': 512, 'kl_weight': 0.0009946044295068939, 'lr': 0.0025144947765745286, 'batch_size': 32, 'dropout_rate': 0.43728635982560526, 'prior_mu': 0.035048023112703025, 'prior_sigma': 0.06608126867779945, 'normalization': 'none'}. Best is trial 2752 with value: 0.5150722622871399.
Generating morgan fingerprints...
Generated fingerprints with 2048 features for 900 molecules
Data shape: X=(900, 2048), y=(900,)
Trial 2754: 5-fold CV loss = 0.5841
[I 2025-08-08 07:42:26,056] Trial 2754 finished with value: 0.5840984106063842 and parameters: {'fp_type': 'morgan', 'morgan_only_radius': 2, 'morgan_only_nBits': 2048, 'num_hidden_layers': 3, 'hidden_dim_0': 512, 'hidden_dim_1': 128, 'hidden_dim_2': 128, 'kl_weight': 0.0009973816238449196, 'lr': 0.0025343446062901856, 'batch_size': 32, 'dropout_rate': 0.4346722936222573, 'prior_mu': 0.03692742987635314, 'prior_sigma': 0.0656210981047844, 'normalization': 'none'}. Best is trial 2752 with value: 0.5150722622871399.
Generating morgan fingerprints...
Generated fingerprints with 2048 features for 900 molecules
Data shape: X=(900, 2048), y=(900,)
Trial 2755: 5-fold CV loss = 0.6634
[I 2025-08-08 07:42:51,370] Trial 2755 finished with value: 0.6634067893028259 and parameters: {'fp_type': 'morgan', 'morgan_only_radius': 2, 'morgan_only_nBits': 2048, 'num_hidden_layers': 3, 'hidden_dim_0': 512, 'hidden_dim_1': 128, 'hidden_dim_2': 128, 'kl_weight': 0.0011556533646032824, 'lr': 0.001731664038340871, 'batch_size': 32, 'dropout_rate': 0.39056357030340966, 'prior_mu': 0.04142199289707131, 'prior_sigma': 0.08349581153856407, 'normalization': 'none'}. Best is trial 2752 with value: 0.5150722622871399.
Generating morgan fingerprints...
Generated fingerprints with 2048 features for 900 molecules
Data shape: X=(900, 2048), y=(900,)
Trial 2756: 5-fold CV loss = 0.6602
[I 2025-08-08 07:42:56,082] Trial 2756 finished with value: 0.6601733505725861 and parameters: {'fp_type': 'morgan', 'morgan_only_radius': 2, 'morgan_only_nBits': 2048, 'num_hidden_layers': 3, 'hidden_dim_0': 512, 'hidden_dim_1': 128, 'hidden_dim_2': 128, 'kl_weight': 0.0009545926042953115, 'lr': 0.0017732651531294798, 'batch_size': 32, 'dropout_rate': 0.3957909210750975, 'prior_mu': 0.0830810194985335, 'prior_sigma': 0.08669931708146539, 'normalization': 'none'}. Best is trial 2752 with value: 0.5150722622871399.
Generating morgan fingerprints...
Generated fingerprints with 2048 features for 900 molecules
Data shape: X=(900, 2048), y=(900,)
Trial 2757: 5-fold CV loss = 0.9162
[I 2025-08-08 07:42:57,688] Trial 2757 finished with value: 0.9162323832511902 and parameters: {'fp_type': 'morgan', 'morgan_only_radius': 2, 'morgan_only_nBits': 2048, 'num_hidden_layers': 3, 'hidden_dim_0': 512, 'hidden_dim_1': 128, 'hidden_dim_2': 512, 'kl_weight': 0.0008606564004723777, 'lr': 0.0017416691822831276, 'batch_size': 64, 'dropout_rate': 0.3741530806923742, 'prior_mu': 0.048771365790755965, 'prior_sigma': 0.08343226370084, 'normalization': 'none'}. Best is trial 2752 with value: 0.5150722622871399.
Generating morgan fingerprints...
Generated fingerprints with 2048 features for 900 molecules
Data shape: X=(900, 2048), y=(900,)
Trial 2760: 5-fold CV loss = 0.6921
[I 2025-08-08 07:43:10,348] Trial 2760 finished with value: 0.6920627951622009 and parameters: {'fp_type': 'morgan', 'morgan_only_radius': 2, 'morgan_only_nBits': 2048, 'num_hidden_layers': 2, 'hidden_dim_0': 512, 'hidden_dim_1': 64, 'kl_weight': 0.0011217234422692176, 'lr': 0.0018840503039974376, 'batch_size': 128, 'dropout_rate': 0.3979018120692418, 'prior_mu': 0.017112558767153795, 'prior_sigma': 0.08950166760032198, 'normalization': 'none'}. Best is trial 2752 with value: 0.5150722622871399.
Generating morgan fingerprints...
Generated fingerprints with 2048 features for 900 molecules
Data shape: X=(900, 2048), y=(900,)
Trial 2759: 5-fold CV loss = 0.9015
[I 2025-08-08 07:43:20,956] Trial 2759 finished with value: 0.9015160918235778 and parameters: {'fp_type': 'morgan', 'morgan_only_radius': 2, 'morgan_only_nBits': 2048, 'num_hidden_layers': 3, 'hidden_dim_0': 512, 'hidden_dim_1': 64, 'hidden_dim_2': 512, 'kl_weight': 0.0011251036936101575, 'lr': 0.0018495474289016312, 'batch_size': 64, 'dropout_rate': 0.3917103319219811, 'prior_mu': 0.050120973091356665, 'prior_sigma': 0.09100002698244582, 'normalization': 'none'}. Best is trial 2752 with value: 0.5150722622871399.
Generating morgan fingerprints...
Generated fingerprints with 2048 features for 900 molecules
Data shape: X=(900, 2048), y=(900,)
Trial 2758: 5-fold CV loss = 0.8558
[I 2025-08-08 07:43:22,374] Trial 2758 finished with value: 0.855805104970932 and parameters: {'fp_type': 'morgan', 'morgan_only_radius': 2, 'morgan_only_nBits': 2048, 'num_hidden_layers': 3, 'hidden_dim_0': 512, 'hidden_dim_1': 64, 'hidden_dim_2': 512, 'kl_weight': 0.0011993142708055895, 'lr': 0.0018174482570231909, 'batch_size': 64, 'dropout_rate': 0.3601182678033338, 'prior_mu': 0.016384024980983, 'prior_sigma': 0.08712896082825367, 'normalization': 'none'}. Best is trial 2752 with value: 0.5150722622871399.
Generating morgan fingerprints...
Generated fingerprints with 2048 features for 900 molecules
Data shape: X=(900, 2048), y=(900,)
Trial 2763: 5-fold CV loss = 0.8312
[I 2025-08-08 07:43:50,831] Trial 2763 finished with value: 0.8311909556388855 and parameters: {'fp_type': 'morgan', 'morgan_only_radius': 2, 'morgan_only_nBits': 2048, 'num_hidden_layers': 3, 'hidden_dim_0': 512, 'hidden_dim_1': 128, 'hidden_dim_2': 256, 'kl_weight': 0.0009965736812461354, 'lr': 0.0015597819012953475, 'batch_size': 32, 'dropout_rate': 0.39842873241549015, 'prior_mu': 0.0639831951084886, 'prior_sigma': 0.08270463654812373, 'normalization': 'none'}. Best is trial 2752 with value: 0.5150722622871399.
Generating morgan fingerprints...
Generated fingerprints with 2048 features for 900 molecules
Data shape: X=(900, 2048), y=(900,)
Trial 2761: 5-fold CV loss = 0.7381
[I 2025-08-08 07:44:30,039] Trial 2761 finished with value: 0.7381334185600281 and parameters: {'fp_type': 'morgan', 'morgan_only_radius': 2, 'morgan_only_nBits': 2048, 'num_hidden_layers': 3, 'hidden_dim_0': 512, 'hidden_dim_1': 128, 'hidden_dim_2': 256, 'kl_weight': 0.000986289417107626, 'lr': 0.00193074118318664, 'batch_size': 32, 'dropout_rate': 0.37781192271298336, 'prior_mu': 0.025129229400895577, 'prior_sigma': 0.08585119447225943, 'normalization': 'none'}. Best is trial 2752 with value: 0.5150722622871399.
Generating morgan fingerprints...
Generated fingerprints with 2048 features for 900 molecules
Data shape: X=(900, 2048), y=(900,)
Trial 2762: 5-fold CV loss = 0.6503
[I 2025-08-08 07:44:31,269] Trial 2762 finished with value: 0.6502578377723693 and parameters: {'fp_type': 'morgan', 'morgan_only_radius': 2, 'morgan_only_nBits': 2048, 'num_hidden_layers': 3, 'hidden_dim_0': 512, 'hidden_dim_1': 128, 'hidden_dim_2': 256, 'kl_weight': 0.0010617213787492454, 'lr': 0.0019430932481287902, 'batch_size': 32, 'dropout_rate': 0.3746105097212625, 'prior_mu': 0.06115312011854035, 'prior_sigma': 0.08434502365305616, 'normalization': 'none'}. Best is trial 2752 with value: 0.5150722622871399.
Generating morgan fingerprints...
Generated fingerprints with 2048 features for 900 molecules
Data shape: X=(900, 2048), y=(900,)
Trial 2751: 5-fold CV loss = 0.5183
[I 2025-08-08 07:45:24,702] Trial 2751 finished with value: 0.518324875831604 and parameters: {'fp_type': 'morgan', 'morgan_only_radius': 2, 'morgan_only_nBits': 2048, 'num_hidden_layers': 3, 'hidden_dim_0': 512, 'hidden_dim_1': 128, 'hidden_dim_2': 512, 'kl_weight': 0.0002742010584589307, 'lr': 0.0017801406724782846, 'batch_size': 32, 'dropout_rate': 0.4661039682851727, 'prior_mu': 0.03640690997065152, 'prior_sigma': 0.0614514049079559, 'normalization': 'none'}. Best is trial 2752 with value: 0.5150722622871399.
Generating morgan fingerprints...
Generated fingerprints with 2048 features for 900 molecules
Data shape: X=(900, 2048), y=(900,)
Trial 2764: 5-fold CV loss = 0.5533
[I 2025-08-08 07:45:26,742] Trial 2764 finished with value: 0.5533192455768585 and parameters: {'fp_type': 'morgan', 'morgan_only_radius': 2, 'morgan_only_nBits': 2048, 'num_hidden_layers': 3, 'hidden_dim_0': 128, 'hidden_dim_1': 128, 'hidden_dim_2': 512, 'kl_weight': 0.0011798122466500278, 'lr': 0.0019343649908054236, 'batch_size': 32, 'dropout_rate': 0.3943837257506724, 'prior_mu': 0.026999918050298867, 'prior_sigma': 0.08472414076793608, 'normalization': 'none'}. Best is trial 2752 with value: 0.5150722622871399.
Generating morgan fingerprints...
Generated fingerprints with 2048 features for 900 molecules
Data shape: X=(900, 2048), y=(900,)
Trial 2766: 5-fold CV loss = 0.5297
[I 2025-08-08 07:46:13,383] Trial 2766 finished with value: 0.5296966552734375 and parameters: {'fp_type': 'morgan', 'morgan_only_radius': 2, 'morgan_only_nBits': 2048, 'num_hidden_layers': 3, 'hidden_dim_0': 512, 'hidden_dim_1': 128, 'hidden_dim_2': 512, 'kl_weight': 0.0011136760411394977, 'lr': 0.0015865707580710981, 'batch_size': 32, 'dropout_rate': 0.3847481181201469, 'prior_mu': 0.04564203019399218, 'prior_sigma': 0.08075496245425351, 'normalization': 'none'}. Best is trial 2752 with value: 0.5150722622871399.
Generating morgan fingerprints...
Generated fingerprints with 2048 features for 900 molecules
Data shape: X=(900, 2048), y=(900,)
Trial 2768: 5-fold CV loss = 0.6151
[I 2025-08-08 07:46:36,591] Trial 2768 finished with value: 0.6150727868080139 and parameters: {'fp_type': 'morgan', 'morgan_only_radius': 2, 'morgan_only_nBits': 2048, 'num_hidden_layers': 3, 'hidden_dim_0': 512, 'hidden_dim_1': 128, 'hidden_dim_2': 512, 'kl_weight': 0.0002610240936020501, 'lr': 0.0015386714918145955, 'batch_size': 32, 'dropout_rate': 0.45818605089001174, 'prior_mu': 0.024428206039535605, 'prior_sigma': 0.051445690231033445, 'normalization': 'none'}. Best is trial 2752 with value: 0.5150722622871399.
Generating morgan fingerprints...
Generated fingerprints with 2048 features for 900 molecules
Data shape: X=(900, 2048), y=(900,)
Trial 2765: 5-fold CV loss = 0.5647
[I 2025-08-08 07:46:51,223] Trial 2765 finished with value: 0.5647163331508637 and parameters: {'fp_type': 'morgan', 'morgan_only_radius': 2, 'morgan_only_nBits': 2048, 'num_hidden_layers': 3, 'hidden_dim_0': 128, 'hidden_dim_1': 128, 'hidden_dim_2': 512, 'kl_weight': 0.0011337406375978778, 'lr': 0.001952608576575119, 'batch_size': 32, 'dropout_rate': 0.3842170333207154, 'prior_mu': 0.05820446525897112, 'prior_sigma': 0.08163745607186712, 'normalization': 'none'}. Best is trial 2752 with value: 0.5150722622871399.
Generating morgan fingerprints...
Generated fingerprints with 2048 features for 900 molecules
Data shape: X=(900, 2048), y=(900,)
Trial 2769: 5-fold CV loss = 0.6379
[I 2025-08-08 07:47:13,805] Trial 2769 finished with value: 0.6378887474536896 and parameters: {'fp_type': 'morgan', 'morgan_only_radius': 2, 'morgan_only_nBits': 2048, 'num_hidden_layers': 3, 'hidden_dim_0': 512, 'hidden_dim_1': 128, 'hidden_dim_2': 512, 'kl_weight': 0.00026074792169842627, 'lr': 0.001397785101709176, 'batch_size': 32, 'dropout_rate': 0.468129844328126, 'prior_mu': 0.021700756054346314, 'prior_sigma': 0.04943464200971198, 'normalization': 'none'}. Best is trial 2752 with value: 0.5150722622871399.
Generating morgan fingerprints...
Generated fingerprints with 2048 features for 900 molecules
Data shape: X=(900, 2048), y=(900,)
Trial 2771: 5-fold CV loss = 0.7350
