[I 2025-08-08 01:01:22,884] Trial 1572 finished with value: 0.5357395112514496 and parameters: {'fp_type': 'morgan', 'morgan_only_radius': 2, 'morgan_only_nBits': 2048, 'num_hidden_layers': 3, 'hidden_dim_0': 512, 'hidden_dim_1': 128, 'hidden_dim_2': 512, 'kl_weight': 0.0005215029022279331, 'lr': 0.0024939862150531425, 'batch_size': 32, 'dropout_rate': 0.4255254501491098, 'prior_mu': 0.03258127417007595, 'prior_sigma': 0.046524060353437965, 'normalization': 'none'}. Best is trial 1528 with value: 0.5170644640922546.
Generating morgan fingerprints...
Generated fingerprints with 2048 features for 900 molecules
Data shape: X=(900, 2048), y=(900,)
Trial 1568: 5-fold CV loss = 0.5383
[I 2025-08-08 01:01:30,036] Trial 1568 finished with value: 0.5383091747760773 and parameters: {'fp_type': 'morgan', 'morgan_only_radius': 2, 'morgan_only_nBits': 2048, 'num_hidden_layers': 3, 'hidden_dim_0': 256, 'hidden_dim_1': 512, 'hidden_dim_2': 512, 'kl_weight': 0.0005053339028737637, 'lr': 0.0025738090040210147, 'batch_size': 32, 'dropout_rate': 0.43581333437238984, 'prior_mu': 0.02929401928622262, 'prior_sigma': 0.05359052868625537, 'normalization': 'none'}. Best is trial 1528 with value: 0.5170644640922546.
Generating morgan fingerprints...
Generated fingerprints with 2048 features for 900 molecules
Data shape: X=(900, 2048), y=(900,)
Trial 1575: 5-fold CV loss = 0.5704
[I 2025-08-08 01:02:20,221] Trial 1575 finished with value: 0.5703749835491181 and parameters: {'fp_type': 'morgan', 'morgan_only_radius': 2, 'morgan_only_nBits': 2048, 'num_hidden_layers': 3, 'hidden_dim_0': 512, 'hidden_dim_1': 128, 'hidden_dim_2': 128, 'kl_weight': 0.0005424935826949706, 'lr': 0.0025395308072763516, 'batch_size': 32, 'dropout_rate': 0.4283949765019965, 'prior_mu': 0.03445782769837924, 'prior_sigma': 0.05843296933603707, 'normalization': 'none'}. Best is trial 1528 with value: 0.5170644640922546.
Generating morgan fingerprints...
Generated fingerprints with 2048 features for 900 molecules
Data shape: X=(900, 2048), y=(900,)
Trial 1576: 5-fold CV loss = 0.5683
[I 2025-08-08 01:02:41,866] Trial 1576 finished with value: 0.5683239698410034 and parameters: {'fp_type': 'morgan', 'morgan_only_radius': 2, 'morgan_only_nBits': 2048, 'num_hidden_layers': 3, 'hidden_dim_0': 512, 'hidden_dim_1': 128, 'hidden_dim_2': 128, 'kl_weight': 0.0004001855828269984, 'lr': 0.002589363010411968, 'batch_size': 32, 'dropout_rate': 0.41442747860222157, 'prior_mu': 0.03737018824877044, 'prior_sigma': 0.057542864064001796, 'normalization': 'none'}. Best is trial 1528 with value: 0.5170644640922546.
Generating morgan fingerprints...
Generated fingerprints with 2048 features for 900 molecules
Data shape: X=(900, 2048), y=(900,)
Trial 1577: 5-fold CV loss = 0.6445
[I 2025-08-08 01:02:45,143] Trial 1577 finished with value: 0.6444629192352295 and parameters: {'fp_type': 'morgan', 'morgan_only_radius': 2, 'morgan_only_nBits': 2048, 'num_hidden_layers': 2, 'hidden_dim_0': 512, 'hidden_dim_1': 128, 'kl_weight': 0.00039258175191708857, 'lr': 0.0023181205752860596, 'batch_size': 32, 'dropout_rate': 0.4138489110323358, 'prior_mu': 0.02316156699770952, 'prior_sigma': 0.05872460137151617, 'normalization': 'none'}. Best is trial 1528 with value: 0.5170644640922546.
Generating morgan fingerprints...
Generated fingerprints with 2048 features for 900 molecules
Data shape: X=(900, 2048), y=(900,)
Trial 1578: 5-fold CV loss = 0.6621
[I 2025-08-08 01:02:58,265] Trial 1578 finished with value: 0.6621144235134124 and parameters: {'fp_type': 'morgan', 'morgan_only_radius': 2, 'morgan_only_nBits': 2048, 'num_hidden_layers': 2, 'hidden_dim_0': 512, 'hidden_dim_1': 128, 'kl_weight': 0.0005923467598489365, 'lr': 0.002232539414337121, 'batch_size': 32, 'dropout_rate': 0.4199054144361392, 'prior_mu': 0.03918872921683182, 'prior_sigma': 0.059368493049630065, 'normalization': 'none'}. Best is trial 1528 with value: 0.5170644640922546.
Generating morgan fingerprints...
Generated fingerprints with 2048 features for 900 molecules
Data shape: X=(900, 2048), y=(900,)
Trial 1579: 5-fold CV loss = 0.7028
[I 2025-08-08 01:03:21,245] Trial 1579 finished with value: 0.7028020262718201 and parameters: {'fp_type': 'morgan', 'morgan_only_radius': 2, 'morgan_only_nBits': 2048, 'num_hidden_layers': 2, 'hidden_dim_0': 512, 'hidden_dim_1': 128, 'kl_weight': 0.0005801273838000791, 'lr': 0.0022380514099085325, 'batch_size': 32, 'dropout_rate': 0.4394834135270024, 'prior_mu': 0.02220696172962601, 'prior_sigma': 0.05928469280747474, 'normalization': 'none'}. Best is trial 1528 with value: 0.5170644640922546.
Generating morgan fingerprints...
Generated fingerprints with 2048 features for 900 molecules
Data shape: X=(900, 2048), y=(900,)
Trial 1582: 5-fold CV loss = 0.7522
[I 2025-08-08 01:03:46,185] Trial 1582 finished with value: 0.7521784424781799 and parameters: {'fp_type': 'morgan', 'morgan_only_radius': 2, 'morgan_only_nBits': 2048, 'num_hidden_layers': 1, 'hidden_dim_0': 1024, 'kl_weight': 0.0007162472823817248, 'lr': 0.002299180747665672, 'batch_size': 32, 'dropout_rate': 0.4442273992508825, 'prior_mu': 0.04310325091194293, 'prior_sigma': 0.060636091212193426, 'normalization': 'none'}. Best is trial 1528 with value: 0.5170644640922546.
Generating morgan fingerprints...
Generated fingerprints with 2048 features for 900 molecules
Data shape: X=(900, 2048), y=(900,)
Trial 1581: 5-fold CV loss = 0.5678
[I 2025-08-08 01:04:01,954] Trial 1581 finished with value: 0.5677970886230469 and parameters: {'fp_type': 'morgan', 'morgan_only_radius': 2, 'morgan_only_nBits': 2048, 'num_hidden_layers': 3, 'hidden_dim_0': 1024, 'hidden_dim_1': 128, 'hidden_dim_2': 512, 'kl_weight': 0.000615720297053219, 'lr': 0.0022508199772726307, 'batch_size': 32, 'dropout_rate': 0.44031338871693637, 'prior_mu': -0.12952541453725536, 'prior_sigma': 0.0607721778697945, 'normalization': 'none'}. Best is trial 1528 with value: 0.5170644640922546.
Generating morgan fingerprints...
Generated fingerprints with 2048 features for 900 molecules
Data shape: X=(900, 2048), y=(900,)
Trial 1574: 5-fold CV loss = 0.5525
[I 2025-08-08 01:04:13,756] Trial 1574 finished with value: 0.552483069896698 and parameters: {'fp_type': 'morgan', 'morgan_only_radius': 2, 'morgan_only_nBits': 2048, 'num_hidden_layers': 3, 'hidden_dim_0': 512, 'hidden_dim_1': 128, 'hidden_dim_2': 128, 'kl_weight': 0.0005609078750177932, 'lr': 0.0024772984719856417, 'batch_size': 32, 'dropout_rate': 0.4202712134089522, 'prior_mu': 0.03538569411023347, 'prior_sigma': 0.05822701711749339, 'normalization': 'none'}. Best is trial 1528 with value: 0.5170644640922546.
Generating morgan fingerprints...
Generated fingerprints with 2048 features for 900 molecules
Data shape: X=(900, 2048), y=(900,)
Trial 1580: 5-fold CV loss = 0.5267
[I 2025-08-08 01:04:15,410] Trial 1580 finished with value: 0.5267042100429535 and parameters: {'fp_type': 'morgan', 'morgan_only_radius': 2, 'morgan_only_nBits': 2048, 'num_hidden_layers': 3, 'hidden_dim_0': 1024, 'hidden_dim_1': 128, 'hidden_dim_2': 512, 'kl_weight': 0.0005897354952299401, 'lr': 0.0022403656169919257, 'batch_size': 32, 'dropout_rate': 0.4219522134896622, 'prior_mu': 0.04133821821775551, 'prior_sigma': 0.06031990859762542, 'normalization': 'none'}. Best is trial 1528 with value: 0.5170644640922546.
Generating morgan fingerprints...
Generated fingerprints with 2048 features for 900 molecules
Data shape: X=(900, 2048), y=(900,)
Trial 1583: 5-fold CV loss = 0.6497
[I 2025-08-08 01:04:34,584] Trial 1583 finished with value: 0.6496640205383301 and parameters: {'fp_type': 'morgan', 'morgan_only_radius': 2, 'morgan_only_nBits': 2048, 'num_hidden_layers': 0, 'kl_weight': 0.0006905574041192862, 'lr': 0.00013960660947831378, 'batch_size': 32, 'dropout_rate': 0.31536730951102127, 'prior_mu': 0.04039553320107563, 'prior_sigma': 0.06271671291824735, 'normalization': 'none'}. Best is trial 1528 with value: 0.5170644640922546.
Generating morgan fingerprints...
Generated fingerprints with 2048 features for 900 molecules
Data shape: X=(900, 2048), y=(900,)
Trial 1584: 5-fold CV loss = 0.5226
[I 2025-08-08 01:05:19,241] Trial 1584 finished with value: 0.5225970387458801 and parameters: {'fp_type': 'morgan', 'morgan_only_radius': 2, 'morgan_only_nBits': 2048, 'num_hidden_layers': 3, 'hidden_dim_0': 512, 'hidden_dim_1': 128, 'hidden_dim_2': 512, 'kl_weight': 0.0004359272411355534, 'lr': 0.002154072386524596, 'batch_size': 32, 'dropout_rate': 0.44705786293997674, 'prior_mu': 0.025123058043036207, 'prior_sigma': 0.06320382516936224, 'normalization': 'none'}. Best is trial 1528 with value: 0.5170644640922546.
Generating morgan fingerprints...
Generated fingerprints with 2048 features for 900 molecules
Data shape: X=(900, 2048), y=(900,)
Trial 1587: 5-fold CV loss = 0.5573
[I 2025-08-08 01:05:47,221] Trial 1587 finished with value: 0.5572810173034668 and parameters: {'fp_type': 'morgan', 'morgan_only_radius': 2, 'morgan_only_nBits': 2048, 'num_hidden_layers': 3, 'hidden_dim_0': 128, 'hidden_dim_1': 128, 'hidden_dim_2': 512, 'kl_weight': 0.0004396066844797582, 'lr': 0.002091114518154243, 'batch_size': 32, 'dropout_rate': 0.43308525621457566, 'prior_mu': 0.024370762656719454, 'prior_sigma': 0.06390144483559629, 'normalization': 'none'}. Best is trial 1528 with value: 0.5170644640922546.
Generating morgan fingerprints...
Generated fingerprints with 2048 features for 900 molecules
Data shape: X=(900, 2048), y=(900,)
Trial 1586: 5-fold CV loss = 0.5543
[I 2025-08-08 01:05:49,645] Trial 1586 finished with value: 0.5543105363845825 and parameters: {'fp_type': 'morgan', 'morgan_only_radius': 2, 'morgan_only_nBits': 2048, 'num_hidden_layers': 3, 'hidden_dim_0': 128, 'hidden_dim_1': 128, 'hidden_dim_2': 512, 'kl_weight': 0.0004555245056561791, 'lr': 0.0021035839229647363, 'batch_size': 32, 'dropout_rate': 0.4337380995488414, 'prior_mu': 0.02323496792099406, 'prior_sigma': 0.05298573484756428, 'normalization': 'none'}. Best is trial 1528 with value: 0.5170644640922546.
Generating morgan_rdkit fingerprints...
Generated fingerprints with 1024 features for 900 molecules
Data shape: X=(900, 1024), y=(900,)
Trial 1588: 5-fold CV loss = 0.5477
[I 2025-08-08 01:06:21,844] Trial 1588 finished with value: 0.5476906836032868 and parameters: {'fp_type': 'morgan', 'morgan_only_radius': 2, 'morgan_only_nBits': 2048, 'num_hidden_layers': 3, 'hidden_dim_0': 128, 'hidden_dim_1': 128, 'hidden_dim_2': 512, 'kl_weight': 0.00043312107269516414, 'lr': 0.002178880213716859, 'batch_size': 32, 'dropout_rate': 0.4346062771059764, 'prior_mu': 0.022292987714231938, 'prior_sigma': 0.05212176740450555, 'normalization': 'none'}. Best is trial 1528 with value: 0.5170644640922546.
Generating morgan_rdkit fingerprints...
Generated fingerprints with 1024 features for 900 molecules
Data shape: X=(900, 1024), y=(900,)
Trial 1585: 5-fold CV loss = 0.6838
[I 2025-08-08 01:06:37,889] Trial 1585 finished with value: 0.6837778210639953 and parameters: {'fp_type': 'morgan', 'morgan_only_radius': 2, 'morgan_only_nBits': 2048, 'num_hidden_layers': 3, 'hidden_dim_0': 128, 'hidden_dim_1': 128, 'hidden_dim_2': 512, 'kl_weight': 0.00045105168669618294, 'lr': 0.0001354964686835374, 'batch_size': 32, 'dropout_rate': 0.43115499174332533, 'prior_mu': 0.025483754467663017, 'prior_sigma': 0.06316390769666416, 'normalization': 'none'}. Best is trial 1528 with value: 0.5170644640922546.
Generating morgan_rdkit fingerprints...
Generated fingerprints with 1024 features for 900 molecules
Data shape: X=(900, 1024), y=(900,)
Trial 1589: 5-fold CV loss = 0.5276
[I 2025-08-08 01:07:18,723] Trial 1589 finished with value: 0.5275986790657043 and parameters: {'fp_type': 'morgan', 'morgan_only_radius': 2, 'morgan_only_nBits': 2048, 'num_hidden_layers': 3, 'hidden_dim_0': 512, 'hidden_dim_1': 128, 'hidden_dim_2': 512, 'kl_weight': 0.0005121949288569837, 'lr': 0.0020933905449278885, 'batch_size': 32, 'dropout_rate': 0.44328349263186806, 'prior_mu': 0.020742869653503145, 'prior_sigma': 0.06390374975623404, 'normalization': 'none'}. Best is trial 1528 with value: 0.5170644640922546.
Generating morgan_rdkit fingerprints...
Generated fingerprints with 1024 features for 900 molecules
Data shape: X=(900, 1024), y=(900,)
Trial 1591: 5-fold CV loss = 0.5543
[I 2025-08-08 01:07:25,551] Trial 1591 finished with value: 0.5542864382266999 and parameters: {'fp_type': 'morgan_rdkit', 'combined_morgan_radius': 3, 'combined_morgan_nBits': 512, 'combined_rdkit_maxPath': 6, 'combined_rdkit_nBits': 512, 'num_hidden_layers': 3, 'hidden_dim_0': 512, 'hidden_dim_1': 128, 'hidden_dim_2': 64, 'kl_weight': 0.00042872351220304354, 'lr': 0.002073097163470933, 'batch_size': 32, 'dropout_rate': 0.4449292500980517, 'prior_mu': 0.06333386854173817, 'prior_sigma': 0.05557163310305824, 'normalization': 'none'}. Best is trial 1528 with value: 0.5170644640922546.
Generating morgan fingerprints...
Generated fingerprints with 2048 features for 900 molecules
Data shape: X=(900, 2048), y=(900,)
Trial 1590: 5-fold CV loss = 0.5559
[I 2025-08-08 01:08:02,381] Trial 1590 finished with value: 0.5558732748031616 and parameters: {'fp_type': 'morgan_rdkit', 'combined_morgan_radius': 3, 'combined_morgan_nBits': 512, 'combined_rdkit_maxPath': 6, 'combined_rdkit_nBits': 512, 'num_hidden_layers': 3, 'hidden_dim_0': 512, 'hidden_dim_1': 128, 'hidden_dim_2': 64, 'kl_weight': 0.0003885711239247619, 'lr': 0.0020961097816961137, 'batch_size': 32, 'dropout_rate': 0.44519070405561123, 'prior_mu': 0.0640377416998708, 'prior_sigma': 0.05523267539992735, 'normalization': 'none'}. Best is trial 1528 with value: 0.5170644640922546.
Generating morgan fingerprints...
Generated fingerprints with 2048 features for 900 molecules
Data shape: X=(900, 2048), y=(900,)
Trial 1594: 5-fold CV loss = 0.5565
[I 2025-08-08 01:08:25,680] Trial 1594 finished with value: 0.5565329015254974 and parameters: {'fp_type': 'morgan', 'morgan_only_radius': 3, 'morgan_only_nBits': 2048, 'num_hidden_layers': 3, 'hidden_dim_0': 512, 'hidden_dim_1': 128, 'hidden_dim_2': 512, 'kl_weight': 0.009975142132918686, 'lr': 0.0025648261403278896, 'batch_size': 32, 'dropout_rate': 0.204816982638172, 'prior_mu': 0.048263363486932886, 'prior_sigma': 0.06415559045054396, 'normalization': 'none'}. Best is trial 1528 with value: 0.5170644640922546.
Generating morgan fingerprints...
Generated fingerprints with 2048 features for 900 molecules
Data shape: X=(900, 2048), y=(900,)
Trial 1593: 5-fold CV loss = 0.5624
[I 2025-08-08 01:08:37,870] Trial 1593 finished with value: 0.5623654127120972 and parameters: {'fp_type': 'morgan_rdkit', 'combined_morgan_radius': 3, 'combined_morgan_nBits': 512, 'combined_rdkit_maxPath': 6, 'combined_rdkit_nBits': 512, 'num_hidden_layers': 3, 'hidden_dim_0': 512, 'hidden_dim_1': 1024, 'hidden_dim_2': 64, 'kl_weight': 0.000388086135418136, 'lr': 0.002096740946776205, 'batch_size': 32, 'dropout_rate': 0.44639761572581405, 'prior_mu': 0.06645876206277375, 'prior_sigma': 0.056301525716239614, 'normalization': 'none'}. Best is trial 1528 with value: 0.5170644640922546.
Generating morgan fingerprints...
Generated fingerprints with 2048 features for 900 molecules
Data shape: X=(900, 2048), y=(900,)
Trial 1596: 5-fold CV loss = 0.5382
[I 2025-08-08 01:09:33,755] Trial 1596 finished with value: 0.538218092918396 and parameters: {'fp_type': 'morgan', 'morgan_only_radius': 2, 'morgan_only_nBits': 2048, 'num_hidden_layers': 3, 'hidden_dim_0': 512, 'hidden_dim_1': 128, 'hidden_dim_2': 512, 'kl_weight': 0.0004953105425145669, 'lr': 0.002071608728756112, 'batch_size': 32, 'dropout_rate': 0.29924422194001066, 'prior_mu': 0.07297944635037357, 'prior_sigma': 0.06517724813686217, 'normalization': 'none'}. Best is trial 1528 with value: 0.5170644640922546.
Generating morgan fingerprints...
Generated fingerprints with 2048 features for 900 molecules
Data shape: X=(900, 2048), y=(900,)
Trial 1598: 5-fold CV loss = 0.6816
[I 2025-08-08 01:09:43,135] Trial 1598 finished with value: 0.6816003799438477 and parameters: {'fp_type': 'morgan', 'morgan_only_radius': 2, 'morgan_only_nBits': 2048, 'num_hidden_layers': 3, 'hidden_dim_0': 512, 'hidden_dim_1': 128, 'hidden_dim_2': 512, 'kl_weight': 0.00037639489991044906, 'lr': 0.0023648725665616787, 'batch_size': 128, 'dropout_rate': 0.03898825553302071, 'prior_mu': 0.04444425144635058, 'prior_sigma': 0.06106482689306091, 'normalization': 'none'}. Best is trial 1528 with value: 0.5170644640922546.
Generating morgan fingerprints...
Generated fingerprints with 2048 features for 900 molecules
Data shape: X=(900, 2048), y=(900,)
Trial 1595: 5-fold CV loss = 0.7439
[I 2025-08-08 01:09:50,639] Trial 1595 finished with value: 0.7438701152801513 and parameters: {'fp_type': 'morgan', 'morgan_only_radius': 3, 'morgan_only_nBits': 2048, 'num_hidden_layers': 3, 'hidden_dim_0': 512, 'hidden_dim_1': 1024, 'hidden_dim_2': 512, 'kl_weight': 0.0003791432450764648, 'lr': 0.0024370759331042093, 'batch_size': 32, 'dropout_rate': 0.45308693915889103, 'prior_mu': 0.052957648934999456, 'prior_sigma': 0.06486904752437424, 'normalization': 'none'}. Best is trial 1528 with value: 0.5170644640922546.
Generating morgan fingerprints...
Generated fingerprints with 2048 features for 900 molecules
Data shape: X=(900, 2048), y=(900,)
Trial 1597: 5-fold CV loss = 0.5268
[I 2025-08-08 01:09:54,828] Trial 1597 finished with value: 0.5268088459968567 and parameters: {'fp_type': 'morgan', 'morgan_only_radius': 2, 'morgan_only_nBits': 2048, 'num_hidden_layers': 3, 'hidden_dim_0': 512, 'hidden_dim_1': 128, 'hidden_dim_2': 512, 'kl_weight': 0.00037242862562547515, 'lr': 0.0023900827223654695, 'batch_size': 32, 'dropout_rate': 0.45265042955103046, 'prior_mu': 0.05732138108703076, 'prior_sigma': 0.06472896071809313, 'normalization': 'none'}. Best is trial 1528 with value: 0.5170644640922546.
Generating morgan fingerprints...
Generated fingerprints with 2048 features for 900 molecules
Data shape: X=(900, 2048), y=(900,)
Trial 1599: 5-fold CV loss = 0.5227
[I 2025-08-08 01:10:52,667] Trial 1599 finished with value: 0.5226795554161072 and parameters: {'fp_type': 'morgan', 'morgan_only_radius': 2, 'morgan_only_nBits': 2048, 'num_hidden_layers': 3, 'hidden_dim_0': 512, 'hidden_dim_1': 128, 'hidden_dim_2': 512, 'kl_weight': 0.0003652999435175841, 'lr': 0.002366329379099219, 'batch_size': 32, 'dropout_rate': 0.45269202515804785, 'prior_mu': 0.057814096972167064, 'prior_sigma': 0.06519156506842694, 'normalization': 'none'}. Best is trial 1528 with value: 0.5170644640922546.
Generating morgan fingerprints...
Generated fingerprints with 2048 features for 900 molecules
Data shape: X=(900, 2048), y=(900,)
Trial 1601: 5-fold CV loss = 0.5380
[I 2025-08-08 01:11:17,084] Trial 1601 finished with value: 0.5380026519298553 and parameters: {'fp_type': 'morgan', 'morgan_only_radius': 2, 'morgan_only_nBits': 2048, 'num_hidden_layers': 3, 'hidden_dim_0': 512, 'hidden_dim_1': 128, 'hidden_dim_2': 512, 'kl_weight': 0.0004854279167673461, 'lr': 0.0020151380186475974, 'batch_size': 32, 'dropout_rate': 0.45506305250977525, 'prior_mu': 0.037244661130275324, 'prior_sigma': 0.05906898988814651, 'normalization': 'none'}. Best is trial 1528 with value: 0.5170644640922546.
Generating morgan fingerprints...
Generated fingerprints with 2048 features for 900 molecules
Data shape: X=(900, 2048), y=(900,)
Trial 1592: 5-fold CV loss = 0.5539
[I 2025-08-08 01:11:31,169] Trial 1592 finished with value: 0.5538902938365936 and parameters: {'fp_type': 'morgan_rdkit', 'combined_morgan_radius': 3, 'combined_morgan_nBits': 512, 'combined_rdkit_maxPath': 6, 'combined_rdkit_nBits': 512, 'num_hidden_layers': 3, 'hidden_dim_0': 512, 'hidden_dim_1': 128, 'hidden_dim_2': 512, 'kl_weight': 0.0003493908058188545, 'lr': 0.0021673384666712958, 'batch_size': 32, 'dropout_rate': 0.4424864289710394, 'prior_mu': -0.18706838878354246, 'prior_sigma': 0.056720383052859744, 'normalization': 'none'}. Best is trial 1528 with value: 0.5170644640922546.
Generating morgan fingerprints...
Generated fingerprints with 2048 features for 900 molecules
Data shape: X=(900, 2048), y=(900,)
Trial 1600: 5-fold CV loss = 0.5263
[I 2025-08-08 01:11:49,384] Trial 1600 finished with value: 0.5263042747974396 and parameters: {'fp_type': 'morgan', 'morgan_only_radius': 2, 'morgan_only_nBits': 2048, 'num_hidden_layers': 3, 'hidden_dim_0': 512, 'hidden_dim_1': 128, 'hidden_dim_2': 512, 'kl_weight': 0.0004726107934638455, 'lr': 0.002371171429025477, 'batch_size': 32, 'dropout_rate': 0.45222749759614, 'prior_mu': 0.056853584221500844, 'prior_sigma': 0.059175608361638425, 'normalization': 'none'}. Best is trial 1528 with value: 0.5170644640922546.
Generating morgan fingerprints...
Generated fingerprints with 2048 features for 900 molecules
Data shape: X=(900, 2048), y=(900,)
Trial 1602: 5-fold CV loss = 0.5266
[I 2025-08-08 01:12:05,913] Trial 1602 finished with value: 0.5265833556652069 and parameters: {'fp_type': 'morgan', 'morgan_only_radius': 2, 'morgan_only_nBits': 2048, 'num_hidden_layers': 3, 'hidden_dim_0': 512, 'hidden_dim_1': 128, 'hidden_dim_2': 512, 'kl_weight': 0.0004822098598455637, 'lr': 0.0019756978075623857, 'batch_size': 32, 'dropout_rate': 0.4562426094413486, 'prior_mu': 0.03653720831990341, 'prior_sigma': 0.058766653470189445, 'normalization': 'none'}. Best is trial 1528 with value: 0.5170644640922546.
Generating morgan fingerprints...
Generated fingerprints with 2048 features for 900 molecules
Data shape: X=(900, 2048), y=(900,)
Trial 1603: 5-fold CV loss = 0.5306
