[I 2025-08-08 04:30:03,341] Trial 2140 finished with value: 0.5233985781669617 and parameters: {'fp_type': 'morgan', 'morgan_only_radius': 2, 'morgan_only_nBits': 2048, 'num_hidden_layers': 3, 'hidden_dim_0': 512, 'hidden_dim_1': 64, 'hidden_dim_2': 256, 'kl_weight': 0.0006739695493915386, 'lr': 0.002165504823044792, 'batch_size': 32, 'dropout_rate': 0.41768868910586526, 'prior_mu': 0.036653103497111136, 'prior_sigma': 0.08756538294691936, 'normalization': 'none'}. Best is trial 1528 with value: 0.5170644640922546.
Generating morgan fingerprints...
Generated fingerprints with 2048 features for 900 molecules
Data shape: X=(900, 2048), y=(900,)
Trial 2142: 5-fold CV loss = 0.7007
[I 2025-08-08 04:30:29,223] Trial 2142 finished with value: 0.700651478767395 and parameters: {'fp_type': 'morgan', 'morgan_only_radius': 2, 'morgan_only_nBits': 2048, 'num_hidden_layers': 2, 'hidden_dim_0': 512, 'hidden_dim_1': 64, 'kl_weight': 0.0006671679451249462, 'lr': 0.0016310752051144882, 'batch_size': 32, 'dropout_rate': 0.4184540011705311, 'prior_mu': 0.0361344818408919, 'prior_sigma': 0.07436496504580843, 'normalization': 'none'}. Best is trial 1528 with value: 0.5170644640922546.
Generating morgan fingerprints...
Generated fingerprints with 2048 features for 900 molecules
Data shape: X=(900, 2048), y=(900,)
Trial 2141: 5-fold CV loss = 0.5369
[I 2025-08-08 04:30:59,360] Trial 2141 finished with value: 0.5369275748729706 and parameters: {'fp_type': 'morgan', 'morgan_only_radius': 2, 'morgan_only_nBits': 2048, 'num_hidden_layers': 3, 'hidden_dim_0': 512, 'hidden_dim_1': 64, 'hidden_dim_2': 256, 'kl_weight': 0.0005609396896527325, 'lr': 0.002182007113081287, 'batch_size': 32, 'dropout_rate': 0.4169355508699944, 'prior_mu': 0.03470242763240558, 'prior_sigma': 0.08256004864468287, 'normalization': 'none'}. Best is trial 1528 with value: 0.5170644640922546.
Generating morgan fingerprints...
Generated fingerprints with 2048 features for 900 molecules
Data shape: X=(900, 2048), y=(900,)
Trial 2136: 5-fold CV loss = 0.5693
[I 2025-08-08 04:31:38,905] Trial 2136 finished with value: 0.5693271279335022 and parameters: {'fp_type': 'morgan', 'morgan_only_radius': 2, 'morgan_only_nBits': 2048, 'num_hidden_layers': 3, 'hidden_dim_0': 512, 'hidden_dim_1': 64, 'hidden_dim_2': 256, 'kl_weight': 0.0005247912654230871, 'lr': 0.0019210595805818588, 'batch_size': 32, 'dropout_rate': 0.43981579631997314, 'prior_mu': 0.051258684167592355, 'prior_sigma': 0.08116429437593795, 'normalization': 'none'}. Best is trial 1528 with value: 0.5170644640922546.
Generating morgan fingerprints...
Generated fingerprints with 2048 features for 900 molecules
Data shape: X=(900, 2048), y=(900,)
Trial 2143: 5-fold CV loss = 0.5696
[I 2025-08-08 04:31:40,615] Trial 2143 finished with value: 0.5695955634117127 and parameters: {'fp_type': 'morgan', 'morgan_only_radius': 2, 'morgan_only_nBits': 2048, 'num_hidden_layers': 2, 'hidden_dim_0': 512, 'hidden_dim_1': 64, 'kl_weight': 0.0008054705339007512, 'lr': 0.0025120125508069457, 'batch_size': 32, 'dropout_rate': 0.45102775222099123, 'prior_mu': 0.06349718865126974, 'prior_sigma': 0.10631021471727395, 'normalization': 'none'}. Best is trial 1528 with value: 0.5170644640922546.
Generating morgan fingerprints...
Generated fingerprints with 2048 features for 900 molecules
Data shape: X=(900, 2048), y=(900,)
Trial 2145: 5-fold CV loss = 0.6546
[I 2025-08-08 04:31:45,543] Trial 2145 finished with value: 0.6545714914798737 and parameters: {'fp_type': 'morgan', 'morgan_only_radius': 2, 'morgan_only_nBits': 2048, 'num_hidden_layers': 3, 'hidden_dim_0': 64, 'hidden_dim_1': 64, 'hidden_dim_2': 256, 'kl_weight': 0.000798442994651095, 'lr': 0.0010452289846616353, 'batch_size': 32, 'dropout_rate': 0.45403932556368554, 'prior_mu': 0.06272891353819943, 'prior_sigma': 0.07480315605266206, 'normalization': 'none'}. Best is trial 1528 with value: 0.5170644640922546.
Generating morgan fingerprints...
Generated fingerprints with 2048 features for 900 molecules
Data shape: X=(900, 2048), y=(900,)
Trial 2147: 5-fold CV loss = 0.7805
[I 2025-08-08 04:31:50,641] Trial 2147 finished with value: 0.780525803565979 and parameters: {'fp_type': 'morgan', 'morgan_only_radius': 2, 'morgan_only_nBits': 2048, 'num_hidden_layers': 3, 'hidden_dim_0': 512, 'hidden_dim_1': 64, 'hidden_dim_2': 256, 'kl_weight': 0.0003888310573018546, 'lr': 0.0024474048387048866, 'batch_size': 128, 'dropout_rate': 0.45281064610328264, 'prior_mu': 0.05956685280858231, 'prior_sigma': 0.07320993674350267, 'normalization': 'none'}. Best is trial 1528 with value: 0.5170644640922546.
Generating morgan fingerprints...
Generated fingerprints with 2048 features for 900 molecules
Data shape: X=(900, 2048), y=(900,)
Trial 2148: 5-fold CV loss = 0.7044
[I 2025-08-08 04:31:58,090] Trial 2148 finished with value: 0.7043679594993592 and parameters: {'fp_type': 'morgan', 'morgan_only_radius': 2, 'morgan_only_nBits': 2048, 'num_hidden_layers': 3, 'hidden_dim_0': 512, 'hidden_dim_1': 64, 'hidden_dim_2': 256, 'kl_weight': 0.0004667056913913053, 'lr': 0.0024040395725192397, 'batch_size': 128, 'dropout_rate': 0.3982609110846627, 'prior_mu': 0.042898505822331484, 'prior_sigma': 0.07201964479646232, 'normalization': 'none'}. Best is trial 1528 with value: 0.5170644640922546.
Generating morgan fingerprints...
Generated fingerprints with 2048 features for 900 molecules
Data shape: X=(900, 2048), y=(900,)
Trial 2144: 5-fold CV loss = 0.5219
[I 2025-08-08 04:32:50,182] Trial 2144 finished with value: 0.521895170211792 and parameters: {'fp_type': 'morgan', 'morgan_only_radius': 2, 'morgan_only_nBits': 2048, 'num_hidden_layers': 3, 'hidden_dim_0': 512, 'hidden_dim_1': 64, 'hidden_dim_2': 256, 'kl_weight': 0.0004699505858241489, 'lr': 0.002546098420280637, 'batch_size': 32, 'dropout_rate': 0.4537832659858283, 'prior_mu': 0.06389210154134976, 'prior_sigma': 0.07376405635178565, 'normalization': 'none'}. Best is trial 1528 with value: 0.5170644640922546.
Generating morgan fingerprints...
Generated fingerprints with 2048 features for 900 molecules
Data shape: X=(900, 2048), y=(900,)
Trial 2150: 5-fold CV loss = 0.6099
[I 2025-08-08 04:33:01,915] Trial 2150 finished with value: 0.6099498510360718 and parameters: {'fp_type': 'morgan', 'morgan_only_radius': 2, 'morgan_only_nBits': 2048, 'num_hidden_layers': 3, 'hidden_dim_0': 512, 'hidden_dim_1': 64, 'hidden_dim_2': 256, 'kl_weight': 0.0006131901216564066, 'lr': 0.001643261337686547, 'batch_size': 32, 'dropout_rate': 0.4332064858961762, 'prior_mu': 0.04205440342159675, 'prior_sigma': 0.07103884175493559, 'normalization': 'none'}. Best is trial 1528 with value: 0.5170644640922546.
Generating morgan fingerprints...
Generated fingerprints with 2048 features for 900 molecules
Data shape: X=(900, 2048), y=(900,)
Trial 2152: 5-fold CV loss = 0.7863
[I 2025-08-08 04:33:16,049] Trial 2152 finished with value: 0.7862937808036804 and parameters: {'fp_type': 'morgan', 'morgan_only_radius': 2, 'morgan_only_nBits': 2048, 'num_hidden_layers': 3, 'hidden_dim_0': 512, 'hidden_dim_1': 64, 'hidden_dim_2': 256, 'kl_weight': 0.0007269983055276552, 'lr': 0.0018072329310343655, 'batch_size': 64, 'dropout_rate': 0.4306846477044329, 'prior_mu': 0.03271945272424865, 'prior_sigma': 0.07704453223821821, 'normalization': 'none'}. Best is trial 1528 with value: 0.5170644640922546.
Generating morgan fingerprints...
Generated fingerprints with 2048 features for 900 molecules
Data shape: X=(900, 2048), y=(900,)
Trial 2149: 5-fold CV loss = 0.6394
[I 2025-08-08 04:33:37,702] Trial 2149 finished with value: 0.639378798007965 and parameters: {'fp_type': 'morgan', 'morgan_only_radius': 2, 'morgan_only_nBits': 2048, 'num_hidden_layers': 3, 'hidden_dim_0': 512, 'hidden_dim_1': 64, 'hidden_dim_2': 256, 'kl_weight': 0.04476077462678015, 'lr': 0.0016383801525708091, 'batch_size': 32, 'dropout_rate': 0.43273704611888303, 'prior_mu': 0.04295348536633482, 'prior_sigma': 0.07077801769423527, 'normalization': 'none'}. Best is trial 1528 with value: 0.5170644640922546.
Generating morgan fingerprints...
Generated fingerprints with 2048 features for 900 molecules
Data shape: X=(900, 2048), y=(900,)
Trial 2151: 5-fold CV loss = 0.6765
[I 2025-08-08 04:33:43,913] Trial 2151 finished with value: 0.67650887966156 and parameters: {'fp_type': 'morgan', 'morgan_only_radius': 2, 'morgan_only_nBits': 2048, 'num_hidden_layers': 3, 'hidden_dim_0': 512, 'hidden_dim_1': 64, 'hidden_dim_2': 256, 'kl_weight': 0.0005840784324645291, 'lr': 0.0016801910078305558, 'batch_size': 32, 'dropout_rate': 0.4321933212133806, 'prior_mu': 0.044266086671955154, 'prior_sigma': 0.07081114391743985, 'normalization': 'none'}. Best is trial 1528 with value: 0.5170644640922546.
Generating morgan fingerprints...
Generated fingerprints with 2048 features for 900 molecules
Data shape: X=(900, 2048), y=(900,)
Trial 2153: 5-fold CV loss = 0.6216
[I 2025-08-08 04:34:20,587] Trial 2153 finished with value: 0.6215790450572968 and parameters: {'fp_type': 'morgan', 'morgan_only_radius': 3, 'morgan_only_nBits': 2048, 'num_hidden_layers': 3, 'hidden_dim_0': 512, 'hidden_dim_1': 64, 'hidden_dim_2': 256, 'kl_weight': 0.000584324428503837, 'lr': 0.0021331274093812727, 'batch_size': 32, 'dropout_rate': 0.4439954406279003, 'prior_mu': 0.043864791602671635, 'prior_sigma': 0.0863209226756953, 'normalization': 'none'}. Best is trial 1528 with value: 0.5170644640922546.
Generating morgan_rdkit fingerprints...
Generated fingerprints with 1024 features for 900 molecules
Data shape: X=(900, 1024), y=(900,)
Trial 2154: 5-fold CV loss = 0.5299
[I 2025-08-08 04:35:12,360] Trial 2154 finished with value: 0.5299086153507233 and parameters: {'fp_type': 'morgan', 'morgan_only_radius': 3, 'morgan_only_nBits': 2048, 'num_hidden_layers': 3, 'hidden_dim_0': 512, 'hidden_dim_1': 64, 'hidden_dim_2': 256, 'kl_weight': 0.0005809118263641184, 'lr': 0.0021404361736721256, 'batch_size': 32, 'dropout_rate': 0.40890943737955865, 'prior_mu': 0.04792427259484551, 'prior_sigma': 0.07970850171040597, 'normalization': 'none'}. Best is trial 1528 with value: 0.5170644640922546.
Generating morgan fingerprints...
Generated fingerprints with 2048 features for 900 molecules
Data shape: X=(900, 2048), y=(900,)
Trial 2156: 5-fold CV loss = 0.6148
[I 2025-08-08 04:35:25,555] Trial 2156 finished with value: 0.6147509574890136 and parameters: {'fp_type': 'morgan_rdkit', 'combined_morgan_radius': 3, 'combined_morgan_nBits': 512, 'combined_rdkit_maxPath': 7, 'combined_rdkit_nBits': 512, 'num_hidden_layers': 3, 'hidden_dim_0': 512, 'hidden_dim_1': 64, 'hidden_dim_2': 256, 'kl_weight': 0.0008057399762197485, 'lr': 0.002015981445723649, 'batch_size': 32, 'dropout_rate': 0.40990166024924085, 'prior_mu': 0.05515587812100435, 'prior_sigma': 0.07624098775288558, 'normalization': 'none'}. Best is trial 1528 with value: 0.5170644640922546.
Generating morgan fingerprints...
Generated fingerprints with 2048 features for 900 molecules
Data shape: X=(900, 2048), y=(900,)
Trial 2146: 5-fold CV loss = 0.5252
[I 2025-08-08 04:36:01,048] Trial 2146 finished with value: 0.5251528143882751 and parameters: {'fp_type': 'morgan', 'morgan_only_radius': 2, 'morgan_only_nBits': 2048, 'num_hidden_layers': 3, 'hidden_dim_0': 512, 'hidden_dim_1': 64, 'hidden_dim_2': 256, 'kl_weight': 0.0008179866883015025, 'lr': 0.0024954136921221384, 'batch_size': 32, 'dropout_rate': 0.4525938013677438, 'prior_mu': 0.06398963941355608, 'prior_sigma': 0.07365861104276045, 'normalization': 'none'}. Best is trial 1528 with value: 0.5170644640922546.
Generating morgan fingerprints...
Generated fingerprints with 2048 features for 900 molecules
Data shape: X=(900, 2048), y=(900,)
Trial 2155: 5-fold CV loss = 0.5243
[I 2025-08-08 04:36:13,050] Trial 2155 finished with value: 0.5243233740329742 and parameters: {'fp_type': 'morgan', 'morgan_only_radius': 3, 'morgan_only_nBits': 2048, 'num_hidden_layers': 3, 'hidden_dim_0': 512, 'hidden_dim_1': 64, 'hidden_dim_2': 256, 'kl_weight': 0.000797705979683294, 'lr': 0.002167946543854851, 'batch_size': 32, 'dropout_rate': 0.4137925514558345, 'prior_mu': 0.032132258333709446, 'prior_sigma': 0.08530882197074145, 'normalization': 'none'}. Best is trial 1528 with value: 0.5170644640922546.
Generating morgan fingerprints...
Generated fingerprints with 2048 features for 900 molecules
Data shape: X=(900, 2048), y=(900,)
Trial 2157: 5-fold CV loss = 0.5720
[I 2025-08-08 04:36:23,037] Trial 2157 finished with value: 0.5720433413982391 and parameters: {'fp_type': 'morgan', 'morgan_only_radius': 2, 'morgan_only_nBits': 2048, 'num_hidden_layers': 3, 'hidden_dim_0': 512, 'hidden_dim_1': 64, 'hidden_dim_2': 256, 'kl_weight': 0.0008029106271307152, 'lr': 0.0018870247302198743, 'batch_size': 32, 'dropout_rate': 0.4185100653411557, 'prior_mu': 0.03253305962153616, 'prior_sigma': 0.0747973041149198, 'normalization': 'none'}. Best is trial 1528 with value: 0.5170644640922546.
Generating morgan fingerprints...
Generated fingerprints with 2048 features for 900 molecules
Data shape: X=(900, 2048), y=(900,)
Trial 2158: 5-fold CV loss = 0.5281
[I 2025-08-08 04:36:26,951] Trial 2158 finished with value: 0.5280631065368653 and parameters: {'fp_type': 'morgan', 'morgan_only_radius': 2, 'morgan_only_nBits': 2048, 'num_hidden_layers': 3, 'hidden_dim_0': 512, 'hidden_dim_1': 64, 'hidden_dim_2': 256, 'kl_weight': 0.0006914501360018233, 'lr': 0.0027699892706585937, 'batch_size': 32, 'dropout_rate': 0.4219266320477766, 'prior_mu': 0.035056362432457085, 'prior_sigma': 0.08357947095831407, 'normalization': 'none'}. Best is trial 1528 with value: 0.5170644640922546.
Generating morgan fingerprints...
Generated fingerprints with 2048 features for 900 molecules
Data shape: X=(900, 2048), y=(900,)
Trial 2161: 5-fold CV loss = 0.5685
[I 2025-08-08 04:37:21,336] Trial 2161 finished with value: 0.5684822261333465 and parameters: {'fp_type': 'morgan', 'morgan_only_radius': 2, 'morgan_only_nBits': 2048, 'num_hidden_layers': 3, 'hidden_dim_0': 128, 'hidden_dim_1': 64, 'hidden_dim_2': 256, 'kl_weight': 0.0006855763367447226, 'lr': 0.0028117678939886983, 'batch_size': 32, 'dropout_rate': 0.443836168368908, 'prior_mu': -0.16211597908359915, 'prior_sigma': 0.07014223800931171, 'normalization': 'none'}. Best is trial 1528 with value: 0.5170644640922546.
Generating morgan fingerprints...
Generated fingerprints with 2048 features for 900 molecules
Data shape: X=(900, 2048), y=(900,)
Trial 2162: 5-fold CV loss = 0.5661
[I 2025-08-08 04:37:33,383] Trial 2162 finished with value: 0.5660595536231995 and parameters: {'fp_type': 'morgan', 'morgan_only_radius': 2, 'morgan_only_nBits': 2048, 'num_hidden_layers': 3, 'hidden_dim_0': 128, 'hidden_dim_1': 64, 'hidden_dim_2': 256, 'kl_weight': 0.0006597875421623409, 'lr': 0.0022835901921210177, 'batch_size': 32, 'dropout_rate': 0.4429119639191873, 'prior_mu': 0.05583592902641558, 'prior_sigma': 0.07038156632593352, 'normalization': 'none'}. Best is trial 1528 with value: 0.5170644640922546.
Generating morgan fingerprints...
Generated fingerprints with 2048 features for 900 molecules
Data shape: X=(900, 2048), y=(900,)
Trial 2160: 5-fold CV loss = 0.5593
[I 2025-08-08 04:37:46,911] Trial 2160 finished with value: 0.5592760443687439 and parameters: {'fp_type': 'morgan', 'morgan_only_radius': 2, 'morgan_only_nBits': 2048, 'num_hidden_layers': 3, 'hidden_dim_0': 128, 'hidden_dim_1': 64, 'hidden_dim_2': 256, 'kl_weight': 0.0006867554519339547, 'lr': 0.0018503127516352647, 'batch_size': 32, 'dropout_rate': 0.3282672974490792, 'prior_mu': 0.03471977074925761, 'prior_sigma': 0.0694378421109639, 'normalization': 'none'}. Best is trial 1528 with value: 0.5170644640922546.
Generating morgan fingerprints...
Generated fingerprints with 2048 features for 900 molecules
Data shape: X=(900, 2048), y=(900,)
Trial 2163: 5-fold CV loss = 0.5252
[I 2025-08-08 04:38:52,968] Trial 2163 finished with value: 0.5252237260341645 and parameters: {'fp_type': 'morgan', 'morgan_only_radius': 2, 'morgan_only_nBits': 2048, 'num_hidden_layers': 3, 'hidden_dim_0': 512, 'hidden_dim_1': 64, 'hidden_dim_2': 256, 'kl_weight': 0.00046867633911110276, 'lr': 0.0023155677728402876, 'batch_size': 32, 'dropout_rate': 0.44423722549777406, 'prior_mu': 0.05632667417118223, 'prior_sigma': 0.07031294906616095, 'normalization': 'none'}. Best is trial 1528 with value: 0.5170644640922546.
Generating morgan fingerprints...
Generated fingerprints with 2048 features for 900 molecules
Data shape: X=(900, 2048), y=(900,)
Trial 2164: 5-fold CV loss = 0.5723
[I 2025-08-08 04:39:01,362] Trial 2164 finished with value: 0.5723405599594116 and parameters: {'fp_type': 'morgan', 'morgan_only_radius': 2, 'morgan_only_nBits': 2048, 'num_hidden_layers': 3, 'hidden_dim_0': 512, 'hidden_dim_1': 64, 'hidden_dim_2': 256, 'kl_weight': 0.00047994952328171865, 'lr': 0.0018420483643018814, 'batch_size': 32, 'dropout_rate': 0.4258489163638217, 'prior_mu': 0.048864040008001625, 'prior_sigma': 0.07882795600167383, 'normalization': 'none'}. Best is trial 1528 with value: 0.5170644640922546.
Generating morgan fingerprints...
Generated fingerprints with 2048 features for 900 molecules
Data shape: X=(900, 2048), y=(900,)
Trial 2167: 5-fold CV loss = 0.6639
[I 2025-08-08 04:39:50,422] Trial 2167 finished with value: 0.6639099776744842 and parameters: {'fp_type': 'morgan', 'morgan_only_radius': 2, 'morgan_only_nBits': 2048, 'num_hidden_layers': 3, 'hidden_dim_0': 512, 'hidden_dim_1': 256, 'hidden_dim_2': 256, 'kl_weight': 0.000549150173054779, 'lr': 0.001985566358143924, 'batch_size': 32, 'dropout_rate': 0.38471052061717254, 'prior_mu': 0.04020967062081526, 'prior_sigma': 0.07522573883480829, 'normalization': 'none'}. Best is trial 1528 with value: 0.5170644640922546.
Generating morgan fingerprints...
Generated fingerprints with 2048 features for 900 molecules
Data shape: X=(900, 2048), y=(900,)
Trial 2159: 5-fold CV loss = 0.5220
[I 2025-08-08 04:39:51,596] Trial 2159 finished with value: 0.5219545364379883 and parameters: {'fp_type': 'morgan', 'morgan_only_radius': 2, 'morgan_only_nBits': 2048, 'num_hidden_layers': 3, 'hidden_dim_0': 512, 'hidden_dim_1': 64, 'hidden_dim_2': 256, 'kl_weight': 0.0006840575104472296, 'lr': 0.002752409810581047, 'batch_size': 32, 'dropout_rate': 0.4209941234552596, 'prior_mu': 0.033879485921514636, 'prior_sigma': 0.07067361581856545, 'normalization': 'none'}. Best is trial 1528 with value: 0.5170644640922546.
Generating morgan fingerprints...
Generated fingerprints with 2048 features for 900 molecules
Data shape: X=(900, 2048), y=(900,)
Trial 2165: 5-fold CV loss = 0.5621
[I 2025-08-08 04:39:58,530] Trial 2165 finished with value: 0.5621371328830719 and parameters: {'fp_type': 'morgan', 'morgan_only_radius': 2, 'morgan_only_nBits': 2048, 'num_hidden_layers': 3, 'hidden_dim_0': 512, 'hidden_dim_1': 64, 'hidden_dim_2': 256, 'kl_weight': 0.00047390516135462313, 'lr': 0.0020110802889698846, 'batch_size': 32, 'dropout_rate': 0.3967505979019668, 'prior_mu': 0.06983852245658626, 'prior_sigma': 0.0755647075598572, 'normalization': 'none'}. Best is trial 1528 with value: 0.5170644640922546.
Generating morgan fingerprints...
Generated fingerprints with 2048 features for 900 molecules
Data shape: X=(900, 2048), y=(900,)
Trial 2166: 5-fold CV loss = 0.6071
[I 2025-08-08 04:40:25,503] Trial 2166 finished with value: 0.6071149587631226 and parameters: {'fp_type': 'morgan', 'morgan_only_radius': 2, 'morgan_only_nBits': 2048, 'num_hidden_layers': 3, 'hidden_dim_0': 512, 'hidden_dim_1': 256, 'hidden_dim_2': 256, 'kl_weight': 0.00039583281743417996, 'lr': 0.002007941999017089, 'batch_size': 32, 'dropout_rate': 0.43110748307246544, 'prior_mu': 0.07111814484028306, 'prior_sigma': 0.07869704133167355, 'normalization': 'none'}. Best is trial 1528 with value: 0.5170644640922546.
Generating morgan fingerprints...
Generated fingerprints with 2048 features for 900 molecules
Data shape: X=(900, 2048), y=(900,)
Trial 2171: 5-fold CV loss = 0.6553
[I 2025-08-08 04:40:46,360] Trial 2171 finished with value: 0.6553467392921448 and parameters: {'fp_type': 'morgan', 'morgan_only_radius': 2, 'morgan_only_nBits': 2048, 'num_hidden_layers': 0, 'kl_weight': 0.0006174746956567102, 'lr': 0.002300498187919168, 'batch_size': 32, 'dropout_rate': 0.45551965641608244, 'prior_mu': 0.04831884438646604, 'prior_sigma': 0.07298984902810969, 'normalization': 'none'}. Best is trial 1528 with value: 0.5170644640922546.
Generating rdkit fingerprints...
Generated fingerprints with 256 features for 900 molecules
Data shape: X=(900, 256), y=(900,)
Trial 2168: 5-fold CV loss = 0.5455
[I 2025-08-08 04:41:24,062] Trial 2168 finished with value: 0.5455055594444275 and parameters: {'fp_type': 'morgan', 'morgan_only_radius': 2, 'morgan_only_nBits': 2048, 'num_hidden_layers': 3, 'hidden_dim_0': 512, 'hidden_dim_1': 512, 'hidden_dim_2': 256, 'kl_weight': 0.0006152928097010533, 'lr': 0.002044641873497281, 'batch_size': 32, 'dropout_rate': 0.24914504459104928, 'prior_mu': 0.07226789558670035, 'prior_sigma': 0.07950684402036581, 'normalization': 'none'}. Best is trial 1528 with value: 0.5170644640922546.
Generating rdkit fingerprints...
Generated fingerprints with 256 features for 900 molecules
Data shape: X=(900, 256), y=(900,)
Trial 2172: 5-fold CV loss = 0.6441
[I 2025-08-08 04:41:30,010] Trial 2172 finished with value: 0.6441471815109253 and parameters: {'fp_type': 'rdkit', 'rdkit_only_maxPath': 5, 'rdkit_only_nBits': 256, 'num_hidden_layers': 3, 'hidden_dim_0': 64, 'hidden_dim_1': 64, 'hidden_dim_2': 256, 'kl_weight': 0.0005567071934742039, 'lr': 0.0018050123110554745, 'batch_size': 32, 'dropout_rate': 0.4097402105958325, 'prior_mu': 0.04317258524315429, 'prior_sigma': 0.08271056254201303, 'normalization': 'none'}. Best is trial 1528 with value: 0.5170644640922546.
Generating morgan fingerprints...
Generated fingerprints with 2048 features for 900 molecules
Data shape: X=(900, 2048), y=(900,)
Trial 2170: 5-fold CV loss = 0.7318
