[I 2025-08-07 18:33:19,692] Trial 526 finished with value: 0.5696371018886566 and parameters: {'fp_type': 'morgan', 'morgan_only_radius': 2, 'morgan_only_nBits': 1024, 'num_hidden_layers': 3, 'hidden_dim_0': 512, 'hidden_dim_1': 128, 'hidden_dim_2': 512, 'kl_weight': 0.0028005953840161434, 'lr': 0.0012383709720237013, 'batch_size': 32, 'dropout_rate': 0.4681088929092022, 'prior_mu': 0.014019584362382088, 'prior_sigma': 0.06411222848140335, 'normalization': 'layer'}. Best is trial 272 with value: 0.5198344707489013.
Generating morgan fingerprints...
Generated fingerprints with 1024 features for 900 molecules
Data shape: X=(900, 1024), y=(900,)
Trial 529: 5-fold CV loss = 0.5439
[I 2025-08-07 18:34:18,766] Trial 529 finished with value: 0.5438545048236847 and parameters: {'fp_type': 'morgan', 'morgan_only_radius': 2, 'morgan_only_nBits': 1024, 'num_hidden_layers': 3, 'hidden_dim_0': 512, 'hidden_dim_1': 128, 'hidden_dim_2': 512, 'kl_weight': 0.002085419776040975, 'lr': 0.002076791589800616, 'batch_size': 32, 'dropout_rate': 0.49012882879435493, 'prior_mu': -0.001960746988206393, 'prior_sigma': 0.10485908023900484, 'normalization': 'none'}. Best is trial 272 with value: 0.5198344707489013.
Generating morgan fingerprints...
Generated fingerprints with 1024 features for 900 molecules
Data shape: X=(900, 1024), y=(900,)
Trial 525: 5-fold CV loss = 0.5777
[I 2025-08-07 18:34:22,123] Trial 525 finished with value: 0.5776917576789856 and parameters: {'fp_type': 'morgan', 'morgan_only_radius': 2, 'morgan_only_nBits': 1024, 'num_hidden_layers': 3, 'hidden_dim_0': 512, 'hidden_dim_1': 128, 'hidden_dim_2': 512, 'kl_weight': 0.0029812141676043313, 'lr': 0.002181912719125898, 'batch_size': 32, 'dropout_rate': 0.43603876541769165, 'prior_mu': 0.014428665507024582, 'prior_sigma': 0.05886004963357016, 'normalization': 'none'}. Best is trial 272 with value: 0.5198344707489013.
Generating morgan fingerprints...
Generated fingerprints with 1024 features for 900 molecules
Data shape: X=(900, 1024), y=(900,)
Trial 530: 5-fold CV loss = 0.5335
[I 2025-08-07 18:34:42,881] Trial 530 finished with value: 0.5335303127765656 and parameters: {'fp_type': 'morgan', 'morgan_only_radius': 2, 'morgan_only_nBits': 1024, 'num_hidden_layers': 3, 'hidden_dim_0': 512, 'hidden_dim_1': 128, 'hidden_dim_2': 512, 'kl_weight': 0.005047383796974225, 'lr': 0.002103018353976408, 'batch_size': 32, 'dropout_rate': 0.48973567757117253, 'prior_mu': 0.002002247080434406, 'prior_sigma': 0.07455949572406864, 'normalization': 'none'}. Best is trial 272 with value: 0.5198344707489013.
Generating morgan fingerprints...
Generated fingerprints with 1024 features for 900 molecules
Data shape: X=(900, 1024), y=(900,)
Trial 528: 5-fold CV loss = 0.5245
[I 2025-08-07 18:35:12,269] Trial 528 finished with value: 0.5244799673557281 and parameters: {'fp_type': 'morgan', 'morgan_only_radius': 2, 'morgan_only_nBits': 1024, 'num_hidden_layers': 3, 'hidden_dim_0': 512, 'hidden_dim_1': 128, 'hidden_dim_2': 512, 'kl_weight': 0.0020367365681994284, 'lr': 0.0021060056162928113, 'batch_size': 32, 'dropout_rate': 0.4690819887515285, 'prior_mu': 0.004150892839169954, 'prior_sigma': 0.06500505419972251, 'normalization': 'none'}. Best is trial 272 with value: 0.5198344707489013.
Generating morgan fingerprints...
Generated fingerprints with 1024 features for 900 molecules
Data shape: X=(900, 1024), y=(900,)
Trial 531: 5-fold CV loss = 0.5665
[I 2025-08-07 18:35:34,752] Trial 531 finished with value: 0.5665100455284119 and parameters: {'fp_type': 'morgan', 'morgan_only_radius': 2, 'morgan_only_nBits': 1024, 'num_hidden_layers': 3, 'hidden_dim_0': 512, 'hidden_dim_1': 128, 'hidden_dim_2': 512, 'kl_weight': 0.003529233368970874, 'lr': 0.001857686223227871, 'batch_size': 32, 'dropout_rate': 0.4908452554961911, 'prior_mu': 0.002839606566736758, 'prior_sigma': 0.053695558995075846, 'normalization': 'none'}. Best is trial 272 with value: 0.5198344707489013.
Generating morgan fingerprints...
Generated fingerprints with 1024 features for 900 molecules
Data shape: X=(900, 1024), y=(900,)
Trial 533: 5-fold CV loss = 0.5697
[I 2025-08-07 18:35:59,891] Trial 533 finished with value: 0.5697080373764039 and parameters: {'fp_type': 'morgan', 'morgan_only_radius': 2, 'morgan_only_nBits': 1024, 'num_hidden_layers': 3, 'hidden_dim_0': 512, 'hidden_dim_1': 128, 'hidden_dim_2': 512, 'kl_weight': 0.003595811991759846, 'lr': 0.001823981380196989, 'batch_size': 32, 'dropout_rate': 0.46688971245719224, 'prior_mu': -0.05758414562609452, 'prior_sigma': 0.05291125731479134, 'normalization': 'none'}. Best is trial 272 with value: 0.5198344707489013.
Generating morgan fingerprints...
Generated fingerprints with 1024 features for 900 molecules
Data shape: X=(900, 1024), y=(900,)
Trial 535: 5-fold CV loss = 0.6049
[I 2025-08-07 18:36:40,793] Trial 535 finished with value: 0.6049202501773834 and parameters: {'fp_type': 'morgan', 'morgan_only_radius': 2, 'morgan_only_nBits': 1024, 'num_hidden_layers': 3, 'hidden_dim_0': 512, 'hidden_dim_1': 128, 'hidden_dim_2': 512, 'kl_weight': 0.002206063330766408, 'lr': 0.0017502480043399295, 'batch_size': 32, 'dropout_rate': 0.4642334414809478, 'prior_mu': 0.030169622082223152, 'prior_sigma': 0.07251449510705754, 'normalization': 'none'}. Best is trial 272 with value: 0.5198344707489013.
Generating morgan fingerprints...
Generated fingerprints with 1024 features for 900 molecules
Data shape: X=(900, 1024), y=(900,)
Trial 536: 5-fold CV loss = 0.5908
[I 2025-08-07 18:36:58,268] Trial 536 finished with value: 0.5908052682876587 and parameters: {'fp_type': 'morgan', 'morgan_only_radius': 2, 'morgan_only_nBits': 1024, 'num_hidden_layers': 3, 'hidden_dim_0': 512, 'hidden_dim_1': 128, 'hidden_dim_2': 512, 'kl_weight': 0.0021008451042355486, 'lr': 0.0024577266637241316, 'batch_size': 32, 'dropout_rate': 0.4623981482828498, 'prior_mu': 0.02878202897103134, 'prior_sigma': 0.14730233768345066, 'normalization': 'none'}. Best is trial 272 with value: 0.5198344707489013.
Generating morgan fingerprints...
Generated fingerprints with 1024 features for 900 molecules
Data shape: X=(900, 1024), y=(900,)
Trial 534: 5-fold CV loss = 0.5690
[I 2025-08-07 18:37:27,219] Trial 534 finished with value: 0.5689582824707031 and parameters: {'fp_type': 'morgan', 'morgan_only_radius': 2, 'morgan_only_nBits': 1024, 'num_hidden_layers': 3, 'hidden_dim_0': 512, 'hidden_dim_1': 128, 'hidden_dim_2': 512, 'kl_weight': 0.001419870504480657, 'lr': 0.001792497296305835, 'batch_size': 32, 'dropout_rate': 0.46461666169449206, 'prior_mu': 0.004338131983468618, 'prior_sigma': 0.06842021953817008, 'normalization': 'none'}. Best is trial 272 with value: 0.5198344707489013.
Generating morgan fingerprints...
Generated fingerprints with 1024 features for 900 molecules
Data shape: X=(900, 1024), y=(900,)
Trial 537: 5-fold CV loss = 0.5319
[I 2025-08-07 18:37:47,940] Trial 537 finished with value: 0.5318704962730407 and parameters: {'fp_type': 'morgan', 'morgan_only_radius': 2, 'morgan_only_nBits': 1024, 'num_hidden_layers': 3, 'hidden_dim_0': 512, 'hidden_dim_1': 128, 'hidden_dim_2': 512, 'kl_weight': 0.001807634838578106, 'lr': 0.002492508300870822, 'batch_size': 32, 'dropout_rate': 0.4823856903158355, 'prior_mu': -0.00451042917347188, 'prior_sigma': 0.06813601848357595, 'normalization': 'none'}. Best is trial 272 with value: 0.5198344707489013.
Generating morgan fingerprints...
Generated fingerprints with 1024 features for 900 molecules
Data shape: X=(900, 1024), y=(900,)
Trial 539: 5-fold CV loss = 0.6709
[I 2025-08-07 18:38:15,484] Trial 539 finished with value: 0.670908784866333 and parameters: {'fp_type': 'morgan', 'morgan_only_radius': 2, 'morgan_only_nBits': 1024, 'num_hidden_layers': 2, 'hidden_dim_0': 256, 'hidden_dim_1': 128, 'kl_weight': 0.002462317774659864, 'lr': 0.001974590886511878, 'batch_size': 32, 'dropout_rate': 0.48277449098375885, 'prior_mu': 0.00920781655504007, 'prior_sigma': 0.07701990790259569, 'normalization': 'none'}. Best is trial 272 with value: 0.5198344707489013.
Generating morgan fingerprints...
Generated fingerprints with 1024 features for 900 molecules
Data shape: X=(900, 1024), y=(900,)
Trial 538: 5-fold CV loss = 0.5231
[I 2025-08-07 18:38:45,917] Trial 538 finished with value: 0.5231080532073975 and parameters: {'fp_type': 'morgan', 'morgan_only_radius': 2, 'morgan_only_nBits': 1024, 'num_hidden_layers': 3, 'hidden_dim_0': 512, 'hidden_dim_1': 128, 'hidden_dim_2': 512, 'kl_weight': 0.0013782483320237432, 'lr': 0.002009082776633929, 'batch_size': 32, 'dropout_rate': 0.4841917845277554, 'prior_mu': 0.009374182502901843, 'prior_sigma': 0.06989261124731619, 'normalization': 'none'}. Best is trial 272 with value: 0.5198344707489013.
Generating morgan fingerprints...
Generated fingerprints with 1024 features for 900 molecules
Data shape: X=(900, 1024), y=(900,)
Trial 532: 5-fold CV loss = 0.6095
[I 2025-08-07 18:38:53,978] Trial 532 finished with value: 0.6094522297382354 and parameters: {'fp_type': 'morgan', 'morgan_only_radius': 2, 'morgan_only_nBits': 1024, 'num_hidden_layers': 3, 'hidden_dim_0': 512, 'hidden_dim_1': 128, 'hidden_dim_2': 512, 'kl_weight': 0.004945071728372218, 'lr': 0.0018265626285467545, 'batch_size': 32, 'dropout_rate': 0.48991907699627774, 'prior_mu': -0.05736297019646093, 'prior_sigma': 0.07558810394615113, 'normalization': 'none'}. Best is trial 272 with value: 0.5198344707489013.
Generating morgan fingerprints...
Generated fingerprints with 1024 features for 900 molecules
Data shape: X=(900, 1024), y=(900,)
Trial 540: 5-fold CV loss = 0.5265
[I 2025-08-07 18:39:29,453] Trial 540 finished with value: 0.5265013813972473 and parameters: {'fp_type': 'morgan', 'morgan_only_radius': 2, 'morgan_only_nBits': 1024, 'num_hidden_layers': 3, 'hidden_dim_0': 512, 'hidden_dim_1': 128, 'hidden_dim_2': 512, 'kl_weight': 0.0024896018948242764, 'lr': 0.0019909692793394045, 'batch_size': 32, 'dropout_rate': 0.47755954018762314, 'prior_mu': 0.009588635448769969, 'prior_sigma': 0.06421092079798198, 'normalization': 'none'}. Best is trial 272 with value: 0.5198344707489013.
Generating morgan fingerprints...
Generated fingerprints with 1024 features for 900 molecules
Data shape: X=(900, 1024), y=(900,)
Trial 542: 5-fold CV loss = 0.5328
[I 2025-08-07 18:40:01,753] Trial 542 finished with value: 0.5327852487564086 and parameters: {'fp_type': 'morgan', 'morgan_only_radius': 2, 'morgan_only_nBits': 1024, 'num_hidden_layers': 3, 'hidden_dim_0': 512, 'hidden_dim_1': 128, 'hidden_dim_2': 512, 'kl_weight': 0.001733196710961443, 'lr': 0.0027620866691331607, 'batch_size': 32, 'dropout_rate': 0.47578266104287514, 'prior_mu': 0.017385519787457136, 'prior_sigma': 0.07477412513232753, 'normalization': 'none'}. Best is trial 272 with value: 0.5198344707489013.
Generating morgan fingerprints...
Generated fingerprints with 1024 features for 900 molecules
Data shape: X=(900, 1024), y=(900,)
Trial 541: 5-fold CV loss = 0.5240
[I 2025-08-07 18:40:23,749] Trial 541 finished with value: 0.52398681640625 and parameters: {'fp_type': 'morgan', 'morgan_only_radius': 2, 'morgan_only_nBits': 1024, 'num_hidden_layers': 3, 'hidden_dim_0': 512, 'hidden_dim_1': 128, 'hidden_dim_2': 512, 'kl_weight': 0.0018789973072682936, 'lr': 0.002699754063825715, 'batch_size': 32, 'dropout_rate': 0.49969417027563484, 'prior_mu': -0.03901617838976542, 'prior_sigma': 0.06463648914005676, 'normalization': 'none'}. Best is trial 272 with value: 0.5198344707489013.
Generating morgan fingerprints...
Generated fingerprints with 1024 features for 900 molecules
Data shape: X=(900, 1024), y=(900,)
Trial 544: 5-fold CV loss = 0.5272
[I 2025-08-07 18:40:45,825] Trial 544 finished with value: 0.5272472023963928 and parameters: {'fp_type': 'morgan', 'morgan_only_radius': 2, 'morgan_only_nBits': 1024, 'num_hidden_layers': 3, 'hidden_dim_0': 512, 'hidden_dim_1': 128, 'hidden_dim_2': 512, 'kl_weight': 0.0020187171026141864, 'lr': 0.0020124136466277503, 'batch_size': 32, 'dropout_rate': 0.4763111171641553, 'prior_mu': 0.014668035893206552, 'prior_sigma': 0.07184639642134877, 'normalization': 'none'}. Best is trial 272 with value: 0.5198344707489013.
Generating morgan fingerprints...
Generated fingerprints with 1024 features for 900 molecules
Data shape: X=(900, 1024), y=(900,)
Trial 545: 5-fold CV loss = 0.5266
[I 2025-08-07 18:41:35,994] Trial 545 finished with value: 0.5266241073608399 and parameters: {'fp_type': 'morgan', 'morgan_only_radius': 2, 'morgan_only_nBits': 1024, 'num_hidden_layers': 3, 'hidden_dim_0': 512, 'hidden_dim_1': 128, 'hidden_dim_2': 512, 'kl_weight': 0.001980727389479385, 'lr': 0.002018876832007181, 'batch_size': 32, 'dropout_rate': 0.4507077474997621, 'prior_mu': 0.005872644275599815, 'prior_sigma': 0.07120156040191006, 'normalization': 'none'}. Best is trial 272 with value: 0.5198344707489013.
Generating morgan fingerprints...
Generated fingerprints with 1024 features for 900 molecules
Data shape: X=(900, 1024), y=(900,)
Trial 547: 5-fold CV loss = 0.5289
[I 2025-08-07 18:41:49,878] Trial 547 finished with value: 0.5289123952388763 and parameters: {'fp_type': 'morgan', 'morgan_only_radius': 2, 'morgan_only_nBits': 1024, 'num_hidden_layers': 3, 'hidden_dim_0': 512, 'hidden_dim_1': 128, 'hidden_dim_2': 512, 'kl_weight': 0.0016152109573672755, 'lr': 0.0027170956218536663, 'batch_size': 32, 'dropout_rate': 0.4999042318018249, 'prior_mu': 0.003020246452575528, 'prior_sigma': 0.06527594905671939, 'normalization': 'none'}. Best is trial 272 with value: 0.5198344707489013.
Generating morgan fingerprints...
Generated fingerprints with 1024 features for 900 molecules
Data shape: X=(900, 1024), y=(900,)
Trial 546: 5-fold CV loss = 0.5335
[I 2025-08-07 18:42:25,848] Trial 546 finished with value: 0.5334577798843384 and parameters: {'fp_type': 'morgan', 'morgan_only_radius': 2, 'morgan_only_nBits': 1024, 'num_hidden_layers': 3, 'hidden_dim_0': 512, 'hidden_dim_1': 128, 'hidden_dim_2': 512, 'kl_weight': 0.001951592722515126, 'lr': 0.0027553956156813482, 'batch_size': 32, 'dropout_rate': 0.4912524562677126, 'prior_mu': 0.004322413018760678, 'prior_sigma': 0.06590806110471953, 'normalization': 'none'}. Best is trial 272 with value: 0.5198344707489013.
Generating morgan fingerprints...
Generated fingerprints with 1024 features for 900 molecules
Data shape: X=(900, 1024), y=(900,)
Trial 543: 5-fold CV loss = 0.5402
[I 2025-08-07 18:42:43,304] Trial 543 finished with value: 0.5401523411273956 and parameters: {'fp_type': 'morgan', 'morgan_only_radius': 2, 'morgan_only_nBits': 1024, 'num_hidden_layers': 3, 'hidden_dim_0': 512, 'hidden_dim_1': 128, 'hidden_dim_2': 512, 'kl_weight': 0.0015218204841285095, 'lr': 0.0027332401812279732, 'batch_size': 32, 'dropout_rate': 0.4723175217776287, 'prior_mu': 0.019266073500178633, 'prior_sigma': 0.07222076432732119, 'normalization': 'none'}. Best is trial 272 with value: 0.5198344707489013.
Generating morgan fingerprints...
Generated fingerprints with 1024 features for 900 molecules
Data shape: X=(900, 1024), y=(900,)
Trial 548: 5-fold CV loss = 0.5288
[I 2025-08-07 18:42:47,253] Trial 548 finished with value: 0.5287876188755035 and parameters: {'fp_type': 'morgan', 'morgan_only_radius': 2, 'morgan_only_nBits': 1024, 'num_hidden_layers': 3, 'hidden_dim_0': 512, 'hidden_dim_1': 128, 'hidden_dim_2': 512, 'kl_weight': 0.0019677013845816596, 'lr': 0.0027336784210431975, 'batch_size': 32, 'dropout_rate': 0.49999451538663847, 'prior_mu': 0.0046518607543794555, 'prior_sigma': 0.06511658256547366, 'normalization': 'none'}. Best is trial 272 with value: 0.5198344707489013.
Generating morgan fingerprints...
Generated fingerprints with 1024 features for 900 molecules
Data shape: X=(900, 1024), y=(900,)
Trial 549: 5-fold CV loss = 0.5310
[I 2025-08-07 18:43:00,626] Trial 549 finished with value: 0.5310002565383911 and parameters: {'fp_type': 'morgan', 'morgan_only_radius': 2, 'morgan_only_nBits': 1024, 'num_hidden_layers': 3, 'hidden_dim_0': 512, 'hidden_dim_1': 128, 'hidden_dim_2': 512, 'kl_weight': 0.001973518186804039, 'lr': 0.002440216387173063, 'batch_size': 32, 'dropout_rate': 0.49347074012919023, 'prior_mu': 0.008569770074442706, 'prior_sigma': 0.06682927446847801, 'normalization': 'none'}. Best is trial 272 with value: 0.5198344707489013.
Generating morgan fingerprints...
Generated fingerprints with 1024 features for 900 molecules
Data shape: X=(900, 1024), y=(900,)
Trial 552: 5-fold CV loss = 0.5281
[I 2025-08-07 18:44:10,280] Trial 552 finished with value: 0.5280514180660247 and parameters: {'fp_type': 'morgan', 'morgan_only_radius': 2, 'morgan_only_nBits': 1024, 'num_hidden_layers': 3, 'hidden_dim_0': 512, 'hidden_dim_1': 128, 'hidden_dim_2': 512, 'kl_weight': 0.002358764622637762, 'lr': 0.002388418442669955, 'batch_size': 32, 'dropout_rate': 0.4911908980739126, 'prior_mu': -0.03795368737273058, 'prior_sigma': 0.06829746033721626, 'normalization': 'none'}. Best is trial 272 with value: 0.5198344707489013.
Generating morgan fingerprints...
Generated fingerprints with 1024 features for 900 molecules
Data shape: X=(900, 1024), y=(900,)
Trial 553: 5-fold CV loss = 0.5316
[I 2025-08-07 18:44:11,917] Trial 553 finished with value: 0.5316450357437134 and parameters: {'fp_type': 'morgan', 'morgan_only_radius': 2, 'morgan_only_nBits': 1024, 'num_hidden_layers': 3, 'hidden_dim_0': 512, 'hidden_dim_1': 128, 'hidden_dim_2': 512, 'kl_weight': 0.002200108827299837, 'lr': 0.0025094464128961576, 'batch_size': 32, 'dropout_rate': 0.4996128464366085, 'prior_mu': -0.042050504781225115, 'prior_sigma': 0.06814138978499726, 'normalization': 'none'}. Best is trial 272 with value: 0.5198344707489013.
Generating morgan fingerprints...
Generated fingerprints with 1024 features for 900 molecules
Data shape: X=(900, 1024), y=(900,)
Trial 550: 5-fold CV loss = 0.5226
[I 2025-08-07 18:44:44,122] Trial 550 finished with value: 0.5226494371891022 and parameters: {'fp_type': 'morgan', 'morgan_only_radius': 2, 'morgan_only_nBits': 1024, 'num_hidden_layers': 3, 'hidden_dim_0': 512, 'hidden_dim_1': 128, 'hidden_dim_2': 512, 'kl_weight': 0.0017531731352125755, 'lr': 0.0024680138235983183, 'batch_size': 32, 'dropout_rate': 0.49964748497545175, 'prior_mu': -0.03635003269817892, 'prior_sigma': 0.0678625504015512, 'normalization': 'none'}. Best is trial 272 with value: 0.5198344707489013.
Generating morgan fingerprints...
Generated fingerprints with 1024 features for 900 molecules
Data shape: X=(900, 1024), y=(900,)
Trial 555: 5-fold CV loss = 0.5369
[I 2025-08-07 18:45:30,764] Trial 555 finished with value: 0.5369235038757324 and parameters: {'fp_type': 'morgan', 'morgan_only_radius': 2, 'morgan_only_nBits': 1024, 'num_hidden_layers': 3, 'hidden_dim_0': 512, 'hidden_dim_1': 128, 'hidden_dim_2': 512, 'kl_weight': 0.0016165683856976033, 'lr': 0.002046220845185901, 'batch_size': 32, 'dropout_rate': 0.4855874170680507, 'prior_mu': -0.03514457729427863, 'prior_sigma': 0.06262023564143991, 'normalization': 'none'}. Best is trial 272 with value: 0.5198344707489013.
Generating morgan fingerprints...
Generated fingerprints with 1024 features for 900 molecules
Data shape: X=(900, 1024), y=(900,)
Trial 554: 5-fold CV loss = 0.5246
[I 2025-08-07 18:45:53,889] Trial 554 finished with value: 0.5246313631534576 and parameters: {'fp_type': 'morgan', 'morgan_only_radius': 2, 'morgan_only_nBits': 1024, 'num_hidden_layers': 3, 'hidden_dim_0': 512, 'hidden_dim_1': 128, 'hidden_dim_2': 512, 'kl_weight': 0.001757205921590979, 'lr': 0.0020741607742536623, 'batch_size': 32, 'dropout_rate': 0.4858487219169002, 'prior_mu': -0.006089185237294377, 'prior_sigma': 0.06255845027132664, 'normalization': 'none'}. Best is trial 272 with value: 0.5198344707489013.
Generating morgan fingerprints...
Generated fingerprints with 1024 features for 900 molecules
Data shape: X=(900, 1024), y=(900,)
Trial 557: 5-fold CV loss = 0.5433
[I 2025-08-07 18:46:53,801] Trial 557 finished with value: 0.5432822048664093 and parameters: {'fp_type': 'morgan', 'morgan_only_radius': 2, 'morgan_only_nBits': 1024, 'num_hidden_layers': 3, 'hidden_dim_0': 128, 'hidden_dim_1': 128, 'hidden_dim_2': 512, 'kl_weight': 0.001796752266418826, 'lr': 0.002325510201948623, 'batch_size': 32, 'dropout_rate': 0.4836398394340037, 'prior_mu': -0.03122006288383812, 'prior_sigma': 0.07911192898562598, 'normalization': 'none'}. Best is trial 272 with value: 0.5198344707489013.
Generating morgan fingerprints...
Generated fingerprints with 1024 features for 900 molecules
Data shape: X=(900, 1024), y=(900,)
Trial 551: 5-fold CV loss = 0.5233
[I 2025-08-07 18:47:14,042] Trial 551 finished with value: 0.5233267426490784 and parameters: {'fp_type': 'morgan', 'morgan_only_radius': 2, 'morgan_only_nBits': 1024, 'num_hidden_layers': 3, 'hidden_dim_0': 512, 'hidden_dim_1': 128, 'hidden_dim_2': 512, 'kl_weight': 0.0022534534880594044, 'lr': 0.002470814886636003, 'batch_size': 32, 'dropout_rate': 0.4999970459484439, 'prior_mu': -0.03269301094608465, 'prior_sigma': 0.06742204214012919, 'normalization': 'none'}. Best is trial 272 with value: 0.5198344707489013.
Generating morgan fingerprints...
Generated fingerprints with 1024 features for 900 molecules
Data shape: X=(900, 1024), y=(900,)
Trial 556: 5-fold CV loss = 0.5621
[I 2025-08-07 18:47:21,688] Trial 556 finished with value: 0.5620628237724304 and parameters: {'fp_type': 'morgan', 'morgan_only_radius': 2, 'morgan_only_nBits': 1024, 'num_hidden_layers': 3, 'hidden_dim_0': 128, 'hidden_dim_1': 128, 'hidden_dim_2': 512, 'kl_weight': 0.001741630433330611, 'lr': 0.0021093229316049757, 'batch_size': 32, 'dropout_rate': 0.4840928814389801, 'prior_mu': -0.03268394048614149, 'prior_sigma': 0.07956280455185051, 'normalization': 'none'}. Best is trial 272 with value: 0.5198344707489013.
Generating morgan fingerprints...
Generated fingerprints with 1024 features for 900 molecules
Data shape: X=(900, 1024), y=(900,)
Trial 558: 5-fold CV loss = 0.5503
