[I 2025-08-07 21:48:45,736] Trial 1032 finished with value: 0.5282790005207062 and parameters: {'fp_type': 'morgan', 'morgan_only_radius': 2, 'morgan_only_nBits': 2048, 'num_hidden_layers': 3, 'hidden_dim_0': 512, 'hidden_dim_1': 64, 'hidden_dim_2': 512, 'kl_weight': 0.0015744770979618237, 'lr': 0.001864692948754003, 'batch_size': 32, 'dropout_rate': 0.4536998491143289, 'prior_mu': -0.047864174911252444, 'prior_sigma': 0.06728871261475548, 'normalization': 'none'}. Best is trial 272 with value: 0.5198344707489013.
Generating morgan_rdkit fingerprints...
Generated fingerprints with 768 features for 900 molecules
Data shape: X=(900, 768), y=(900,)
Trial 1039: 5-fold CV loss = 0.5879
[I 2025-08-07 21:48:58,754] Trial 1039 finished with value: 0.5879404723644257 and parameters: {'fp_type': 'morgan_rdkit', 'combined_morgan_radius': 3, 'combined_morgan_nBits': 512, 'combined_rdkit_maxPath': 8, 'combined_rdkit_nBits': 256, 'num_hidden_layers': 3, 'hidden_dim_0': 512, 'hidden_dim_1': 512, 'hidden_dim_2': 512, 'kl_weight': 0.0016205853024231496, 'lr': 0.002120458179407145, 'batch_size': 32, 'dropout_rate': 0.49238089849025835, 'prior_mu': -0.07810401483723588, 'prior_sigma': 0.07116464784953379, 'normalization': 'none'}. Best is trial 272 with value: 0.5198344707489013.
Generating morgan fingerprints...
Generated fingerprints with 1024 features for 900 molecules
Data shape: X=(900, 1024), y=(900,)
Trial 1040: 5-fold CV loss = 0.6216
[I 2025-08-07 21:49:16,524] Trial 1040 finished with value: 0.6216017365455627 and parameters: {'fp_type': 'morgan_rdkit', 'combined_morgan_radius': 3, 'combined_morgan_nBits': 512, 'combined_rdkit_maxPath': 8, 'combined_rdkit_nBits': 256, 'num_hidden_layers': 3, 'hidden_dim_0': 512, 'hidden_dim_1': 64, 'hidden_dim_2': 512, 'kl_weight': 0.001722188899082423, 'lr': 0.0021174207275289148, 'batch_size': 32, 'dropout_rate': 0.4922705700641771, 'prior_mu': -0.05334534705301511, 'prior_sigma': 0.0653137739622613, 'normalization': 'none'}. Best is trial 272 with value: 0.5198344707489013.
Generating morgan fingerprints...
Generated fingerprints with 1024 features for 900 molecules
Data shape: X=(900, 1024), y=(900,)
Trial 1042: 5-fold CV loss = 0.5476
[I 2025-08-07 21:50:04,397] Trial 1042 finished with value: 0.5476123273372651 and parameters: {'fp_type': 'morgan', 'morgan_only_radius': 2, 'morgan_only_nBits': 1024, 'num_hidden_layers': 3, 'hidden_dim_0': 512, 'hidden_dim_1': 64, 'hidden_dim_2': 512, 'kl_weight': 0.0023040356858961804, 'lr': 0.0024862751619218085, 'batch_size': 32, 'dropout_rate': 0.47670290652344216, 'prior_mu': -0.032528991267485693, 'prior_sigma': 0.10794554741493079, 'normalization': 'none'}. Best is trial 272 with value: 0.5198344707489013.
Generating morgan fingerprints...
Generated fingerprints with 2048 features for 900 molecules
Data shape: X=(900, 2048), y=(900,)
Trial 1037: 5-fold CV loss = 0.6030
[I 2025-08-07 21:50:07,796] Trial 1037 finished with value: 0.6030463337898254 and parameters: {'fp_type': 'morgan', 'morgan_only_radius': 2, 'morgan_only_nBits': 1024, 'num_hidden_layers': 2, 'hidden_dim_0': 512, 'hidden_dim_1': 64, 'kl_weight': 0.0017300942555772214, 'lr': 0.002682224279712708, 'batch_size': 32, 'dropout_rate': 0.4673023459809649, 'prior_mu': -0.03411654210984696, 'prior_sigma': 0.07070281430051611, 'normalization': 'none'}. Best is trial 272 with value: 0.5198344707489013.
Generating morgan fingerprints...
Generated fingerprints with 2048 features for 900 molecules
Data shape: X=(900, 2048), y=(900,)
Trial 1041: 5-fold CV loss = 0.6586
[I 2025-08-07 21:50:09,343] Trial 1041 finished with value: 0.6585628509521484 and parameters: {'fp_type': 'morgan_rdkit', 'combined_morgan_radius': 3, 'combined_morgan_nBits': 512, 'combined_rdkit_maxPath': 8, 'combined_rdkit_nBits': 256, 'num_hidden_layers': 3, 'hidden_dim_0': 512, 'hidden_dim_1': 256, 'hidden_dim_2': 512, 'kl_weight': 0.002408236325804023, 'lr': 0.002094952925062157, 'batch_size': 32, 'dropout_rate': 0.4911827303070354, 'prior_mu': -0.032788299671796514, 'prior_sigma': 0.10909358119891546, 'normalization': 'none'}. Best is trial 272 with value: 0.5198344707489013.
Generating morgan fingerprints...
Generated fingerprints with 2048 features for 900 molecules
Data shape: X=(900, 2048), y=(900,)
Trial 1043: 5-fold CV loss = 0.5403
[I 2025-08-07 21:50:26,850] Trial 1043 finished with value: 0.5402800798416137 and parameters: {'fp_type': 'morgan', 'morgan_only_radius': 2, 'morgan_only_nBits': 1024, 'num_hidden_layers': 3, 'hidden_dim_0': 512, 'hidden_dim_1': 64, 'hidden_dim_2': 512, 'kl_weight': 0.0024495835069794558, 'lr': 0.0024998423709922456, 'batch_size': 32, 'dropout_rate': 0.3906323370247382, 'prior_mu': -0.03259169870237858, 'prior_sigma': 0.08224039248043802, 'normalization': 'none'}. Best is trial 272 with value: 0.5198344707489013.
Generating morgan fingerprints...
Generated fingerprints with 2048 features for 900 molecules
Data shape: X=(900, 2048), y=(900,)
Trial 1046: 5-fold CV loss = 0.8383
[I 2025-08-07 21:50:27,437] Trial 1046 finished with value: 0.8382754802703858 and parameters: {'fp_type': 'morgan', 'morgan_only_radius': 2, 'morgan_only_nBits': 2048, 'num_hidden_layers': 3, 'hidden_dim_0': 512, 'hidden_dim_1': 64, 'hidden_dim_2': 512, 'kl_weight': 0.00029915284934981033, 'lr': 0.0023671842827024995, 'batch_size': 128, 'dropout_rate': 0.4997549869518631, 'prior_mu': -0.024078687206189907, 'prior_sigma': 0.0621927319096891, 'normalization': 'none'}. Best is trial 272 with value: 0.5198344707489013.
Generating morgan fingerprints...
Generated fingerprints with 2048 features for 900 molecules
Data shape: X=(900, 2048), y=(900,)
Trial 1047: 5-fold CV loss = 0.6808
[I 2025-08-07 21:50:37,419] Trial 1047 finished with value: 0.6808044910430908 and parameters: {'fp_type': 'morgan', 'morgan_only_radius': 2, 'morgan_only_nBits': 2048, 'num_hidden_layers': 1, 'hidden_dim_0': 512, 'kl_weight': 0.00021933428446604505, 'lr': 0.002251936773976902, 'batch_size': 128, 'dropout_rate': 0.4818790525748037, 'prior_mu': -0.021770909179919994, 'prior_sigma': 0.07533930270765403, 'normalization': 'none'}. Best is trial 272 with value: 0.5198344707489013.
Generating morgan fingerprints...
Generated fingerprints with 1024 features for 900 molecules
Data shape: X=(900, 1024), y=(900,)
Trial 1045: 5-fold CV loss = 0.8840
[I 2025-08-07 21:50:40,372] Trial 1045 finished with value: 0.8839847326278687 and parameters: {'fp_type': 'morgan', 'morgan_only_radius': 2, 'morgan_only_nBits': 2048, 'num_hidden_layers': 3, 'hidden_dim_0': 512, 'hidden_dim_1': 64, 'hidden_dim_2': 512, 'kl_weight': 0.0024780730322950567, 'lr': 0.002357828453105247, 'batch_size': 128, 'dropout_rate': 0.4798366499787967, 'prior_mu': -0.02427130104333635, 'prior_sigma': 0.07604138268040095, 'normalization': 'none'}. Best is trial 272 with value: 0.5198344707489013.
Generating morgan fingerprints...
Generated fingerprints with 1024 features for 900 molecules
Data shape: X=(900, 1024), y=(900,)
Trial 1044: 5-fold CV loss = 0.5605
[I 2025-08-07 21:51:07,405] Trial 1044 finished with value: 0.5605158925056457 and parameters: {'fp_type': 'morgan', 'morgan_only_radius': 2, 'morgan_only_nBits': 2048, 'num_hidden_layers': 3, 'hidden_dim_0': 512, 'hidden_dim_1': 64, 'hidden_dim_2': 512, 'kl_weight': 0.0014649309950094415, 'lr': 0.0027648324887723946, 'batch_size': 32, 'dropout_rate': 0.47798240495133404, 'prior_mu': -0.1681027744659808, 'prior_sigma': 0.07597350894590112, 'normalization': 'none'}. Best is trial 272 with value: 0.5198344707489013.
Generating morgan fingerprints...
Generated fingerprints with 1024 features for 900 molecules
Data shape: X=(900, 1024), y=(900,)
Trial 1049: 5-fold CV loss = 0.5342
[I 2025-08-07 21:51:43,061] Trial 1049 finished with value: 0.5342030704021454 and parameters: {'fp_type': 'morgan', 'morgan_only_radius': 2, 'morgan_only_nBits': 1024, 'num_hidden_layers': 3, 'hidden_dim_0': 512, 'hidden_dim_1': 128, 'hidden_dim_2': 512, 'kl_weight': 0.0014427736445980267, 'lr': 0.00280974713220717, 'batch_size': 32, 'dropout_rate': 0.47630855090595536, 'prior_mu': 0.07133315578368005, 'prior_sigma': 0.0650672303929377, 'normalization': 'none'}. Best is trial 272 with value: 0.5198344707489013.
Generating morgan fingerprints...
Generated fingerprints with 1024 features for 900 molecules
Data shape: X=(900, 1024), y=(900,)
Trial 1051: 5-fold CV loss = 0.5360
[I 2025-08-07 21:52:16,922] Trial 1051 finished with value: 0.5359642386436463 and parameters: {'fp_type': 'morgan', 'morgan_only_radius': 2, 'morgan_only_nBits': 1024, 'num_hidden_layers': 3, 'hidden_dim_0': 512, 'hidden_dim_1': 128, 'hidden_dim_2': 256, 'kl_weight': 0.002100670536216123, 'lr': 0.0029506481519035797, 'batch_size': 32, 'dropout_rate': 0.49069903381899393, 'prior_mu': -0.05550709827459034, 'prior_sigma': 0.06512084360122676, 'normalization': 'none'}. Best is trial 272 with value: 0.5198344707489013.
Generating morgan fingerprints...
Generated fingerprints with 1024 features for 900 molecules
Data shape: X=(900, 1024), y=(900,)
Trial 1052: 5-fold CV loss = 0.5916
[I 2025-08-07 21:52:31,363] Trial 1052 finished with value: 0.5916109085083008 and parameters: {'fp_type': 'morgan', 'morgan_only_radius': 2, 'morgan_only_nBits': 1024, 'num_hidden_layers': 3, 'hidden_dim_0': 128, 'hidden_dim_1': 128, 'hidden_dim_2': 256, 'kl_weight': 0.002061752365840861, 'lr': 0.00210470068603363, 'batch_size': 32, 'dropout_rate': 0.4905549151395635, 'prior_mu': -0.042198045692093795, 'prior_sigma': 0.06011205135937275, 'normalization': 'none'}. Best is trial 272 with value: 0.5198344707489013.
Generating morgan fingerprints...
Generated fingerprints with 1024 features for 900 molecules
Data shape: X=(900, 1024), y=(900,)
Trial 1048: 5-fold CV loss = 0.6585
[I 2025-08-07 21:52:35,331] Trial 1048 finished with value: 0.6584503889083863 and parameters: {'fp_type': 'morgan', 'morgan_only_radius': 2, 'morgan_only_nBits': 2048, 'num_hidden_layers': 3, 'hidden_dim_0': 512, 'hidden_dim_1': 128, 'hidden_dim_2': 512, 'kl_weight': 0.0021620646201161707, 'lr': 0.0015141145551181992, 'batch_size': 32, 'dropout_rate': 0.47835973347269056, 'prior_mu': -0.021904493620109364, 'prior_sigma': 0.07785289517887548, 'normalization': 'none'}. Best is trial 272 with value: 0.5198344707489013.
Generating morgan fingerprints...
Generated fingerprints with 1024 features for 900 molecules
Data shape: X=(900, 1024), y=(900,)
Trial 1054: 5-fold CV loss = 1.0295
[I 2025-08-07 21:52:45,569] Trial 1054 finished with value: 1.0294538974761962 and parameters: {'fp_type': 'morgan', 'morgan_only_radius': 2, 'morgan_only_nBits': 1024, 'num_hidden_layers': 3, 'hidden_dim_0': 512, 'hidden_dim_1': 256, 'hidden_dim_2': 512, 'kl_weight': 0.0014697997682814247, 'lr': 0.0017718904003741673, 'batch_size': 64, 'dropout_rate': 0.4660984373077337, 'prior_mu': -0.02829132003346503, 'prior_sigma': 0.07103177528216335, 'normalization': 'none'}. Best is trial 272 with value: 0.5198344707489013.
Generating rdkit fingerprints...
Generated fingerprints with 1024 features for 900 molecules
Data shape: X=(900, 1024), y=(900,)
Trial 1055: 5-fold CV loss = 1.0294
[I 2025-08-07 21:53:05,915] Trial 1055 finished with value: 1.029371154308319 and parameters: {'fp_type': 'morgan', 'morgan_only_radius': 2, 'morgan_only_nBits': 1024, 'num_hidden_layers': 3, 'hidden_dim_0': 512, 'hidden_dim_1': 1024, 'hidden_dim_2': 512, 'kl_weight': 0.001771928861259647, 'lr': 0.001777405609069543, 'batch_size': 64, 'dropout_rate': 0.4554395459788789, 'prior_mu': -0.0377524694141516, 'prior_sigma': 0.07153314384733048, 'normalization': 'none'}. Best is trial 272 with value: 0.5198344707489013.
Generating rdkit fingerprints...
Generated fingerprints with 1024 features for 900 molecules
Data shape: X=(900, 1024), y=(900,)
Trial 1053: 5-fold CV loss = 0.6166
[I 2025-08-07 21:53:21,531] Trial 1053 finished with value: 0.6165595471858978 and parameters: {'fp_type': 'morgan', 'morgan_only_radius': 2, 'morgan_only_nBits': 1024, 'num_hidden_layers': 3, 'hidden_dim_0': 1024, 'hidden_dim_1': 128, 'hidden_dim_2': 512, 'kl_weight': 0.0018421083539742675, 'lr': 0.001564106315284741, 'batch_size': 32, 'dropout_rate': 0.4670696061138618, 'prior_mu': -0.039147244178903105, 'prior_sigma': 0.07228233284117908, 'normalization': 'none'}. Best is trial 272 with value: 0.5198344707489013.
Generating morgan fingerprints...
Generated fingerprints with 2048 features for 900 molecules
Data shape: X=(900, 2048), y=(900,)
Trial 1050: 5-fold CV loss = 0.5427
[I 2025-08-07 21:54:06,142] Trial 1050 finished with value: 0.5426980495452881 and parameters: {'fp_type': 'morgan', 'morgan_only_radius': 2, 'morgan_only_nBits': 1024, 'num_hidden_layers': 3, 'hidden_dim_0': 1024, 'hidden_dim_1': 128, 'hidden_dim_2': 512, 'kl_weight': 0.0014494037452930212, 'lr': 0.0027993094765989164, 'batch_size': 32, 'dropout_rate': 0.4731485510433758, 'prior_mu': -0.03985097560396378, 'prior_sigma': 0.06508295931645687, 'normalization': 'none'}. Best is trial 272 with value: 0.5198344707489013.
Generating morgan fingerprints...
Generated fingerprints with 2048 features for 900 molecules
Data shape: X=(900, 2048), y=(900,)
Trial 1058: 5-fold CV loss = 0.5410
[I 2025-08-07 21:54:10,155] Trial 1058 finished with value: 0.5409729421138764 and parameters: {'fp_type': 'morgan', 'morgan_only_radius': 2, 'morgan_only_nBits': 2048, 'num_hidden_layers': 3, 'hidden_dim_0': 512, 'hidden_dim_1': 128, 'hidden_dim_2': 128, 'kl_weight': 0.001380885036503706, 'lr': 0.0025234185042564104, 'batch_size': 32, 'dropout_rate': 0.49984629636597944, 'prior_mu': -0.020213580818676573, 'prior_sigma': 0.05324484056469392, 'normalization': 'layer'}. Best is trial 272 with value: 0.5198344707489013.
Generating rdkit fingerprints...
Generated fingerprints with 1024 features for 900 molecules
Data shape: X=(900, 1024), y=(900,)
Trial 1056: 5-fold CV loss = 0.6289
[I 2025-08-07 21:54:24,681] Trial 1056 finished with value: 0.6288614392280578 and parameters: {'fp_type': 'rdkit', 'rdkit_only_maxPath': 8, 'rdkit_only_nBits': 1024, 'num_hidden_layers': 3, 'hidden_dim_0': 1024, 'hidden_dim_1': 128, 'hidden_dim_2': 128, 'kl_weight': 0.001753967111285537, 'lr': 0.0025304425318114824, 'batch_size': 32, 'dropout_rate': 0.4520251069334048, 'prior_mu': -0.03832546617241532, 'prior_sigma': 0.06625471643053633, 'normalization': 'none'}. Best is trial 272 with value: 0.5198344707489013.
Generating morgan fingerprints...
Generated fingerprints with 2048 features for 900 molecules
Data shape: X=(900, 2048), y=(900,)
Trial 1060: 5-fold CV loss = 0.6440
[I 2025-08-07 21:54:47,799] Trial 1060 finished with value: 0.6440336465835571 and parameters: {'fp_type': 'rdkit', 'rdkit_only_maxPath': 8, 'rdkit_only_nBits': 1024, 'num_hidden_layers': 3, 'hidden_dim_0': 64, 'hidden_dim_1': 128, 'hidden_dim_2': 512, 'kl_weight': 0.0013012998273750182, 'lr': 0.0019864920110259964, 'batch_size': 32, 'dropout_rate': 0.44029461981428236, 'prior_mu': -0.026362577786043645, 'prior_sigma': 0.06014658457467877, 'normalization': 'none'}. Best is trial 272 with value: 0.5198344707489013.
Generating morgan fingerprints...
Generated fingerprints with 2048 features for 900 molecules
Data shape: X=(900, 2048), y=(900,)
Trial 1057: 5-fold CV loss = 0.6526
[I 2025-08-07 21:55:08,267] Trial 1057 finished with value: 0.652648663520813 and parameters: {'fp_type': 'rdkit', 'rdkit_only_maxPath': 8, 'rdkit_only_nBits': 1024, 'num_hidden_layers': 3, 'hidden_dim_0': 512, 'hidden_dim_1': 128, 'hidden_dim_2': 512, 'kl_weight': 0.00131948085852926, 'lr': 0.002488038404521263, 'batch_size': 32, 'dropout_rate': 0.4917093991573266, 'prior_mu': -0.018801491785253567, 'prior_sigma': 0.0521678364994837, 'normalization': 'layer'}. Best is trial 272 with value: 0.5198344707489013.
Generating morgan fingerprints...
Generated fingerprints with 2048 features for 900 molecules
Data shape: X=(900, 2048), y=(900,)
Trial 1062: 5-fold CV loss = 0.9898
[I 2025-08-07 21:55:40,549] Trial 1062 finished with value: 0.9898224949836731 and parameters: {'fp_type': 'morgan', 'morgan_only_radius': 2, 'morgan_only_nBits': 2048, 'num_hidden_layers': 3, 'hidden_dim_0': 512, 'hidden_dim_1': 512, 'hidden_dim_2': 512, 'kl_weight': 0.0009559419176690361, 'lr': 0.002256113976608582, 'batch_size': 32, 'dropout_rate': 0.49991801891882287, 'prior_mu': -0.05368247138833074, 'prior_sigma': 0.06792854084555118, 'normalization': 'none'}. Best is trial 272 with value: 0.5198344707489013.
Generating morgan fingerprints...
Generated fingerprints with 1024 features for 900 molecules
Data shape: X=(900, 1024), y=(900,)
Trial 1061: 5-fold CV loss = 0.5536
[I 2025-08-07 21:55:49,971] Trial 1061 finished with value: 0.5536033868789673 and parameters: {'fp_type': 'morgan', 'morgan_only_radius': 2, 'morgan_only_nBits': 2048, 'num_hidden_layers': 3, 'hidden_dim_0': 64, 'hidden_dim_1': 512, 'hidden_dim_2': 512, 'kl_weight': 0.0002564550623316721, 'lr': 0.0019549683384774575, 'batch_size': 32, 'dropout_rate': 0.49056295728645316, 'prior_mu': -0.029542588357222024, 'prior_sigma': 0.06128957159431399, 'normalization': 'none'}. Best is trial 272 with value: 0.5198344707489013.
Generating morgan fingerprints...
Generated fingerprints with 1024 features for 900 molecules
Data shape: X=(900, 1024), y=(900,)
Trial 1063: 5-fold CV loss = 1.0768
[I 2025-08-07 21:55:59,624] Trial 1063 finished with value: 1.0768390893936157 and parameters: {'fp_type': 'morgan', 'morgan_only_radius': 2, 'morgan_only_nBits': 2048, 'num_hidden_layers': 3, 'hidden_dim_0': 512, 'hidden_dim_1': 512, 'hidden_dim_2': 512, 'kl_weight': 0.000189978249603936, 'lr': 0.00010226361510342256, 'batch_size': 32, 'dropout_rate': 0.4996145504217009, 'prior_mu': -0.050197320372740925, 'prior_sigma': 0.06786810633239826, 'normalization': 'none'}. Best is trial 272 with value: 0.5198344707489013.
Generating morgan fingerprints...
Generated fingerprints with 1024 features for 900 molecules
Data shape: X=(900, 1024), y=(900,)
Trial 1064: 5-fold CV loss = 0.5277
[I 2025-08-07 21:57:05,646] Trial 1064 finished with value: 0.527680629491806 and parameters: {'fp_type': 'morgan', 'morgan_only_radius': 2, 'morgan_only_nBits': 1024, 'num_hidden_layers': 3, 'hidden_dim_0': 512, 'hidden_dim_1': 128, 'hidden_dim_2': 512, 'kl_weight': 0.0015543399672504816, 'lr': 0.0021372284447336264, 'batch_size': 32, 'dropout_rate': 0.4852722488396239, 'prior_mu': -0.028790022184358388, 'prior_sigma': 0.06177368034155493, 'normalization': 'none'}. Best is trial 272 with value: 0.5198344707489013.
Generating morgan fingerprints...
Generated fingerprints with 1024 features for 900 molecules
Data shape: X=(900, 1024), y=(900,)
Trial 1059: 5-fold CV loss = 0.5420
[I 2025-08-07 21:57:13,228] Trial 1059 finished with value: 0.5420468032360077 and parameters: {'fp_type': 'morgan', 'morgan_only_radius': 2, 'morgan_only_nBits': 2048, 'num_hidden_layers': 3, 'hidden_dim_0': 512, 'hidden_dim_1': 128, 'hidden_dim_2': 128, 'kl_weight': 0.0012924651207891224, 'lr': 0.002511090837981013, 'batch_size': 32, 'dropout_rate': 0.49064134656637065, 'prior_mu': -0.01729043014992101, 'prior_sigma': 0.06076544136962603, 'normalization': 'layer'}. Best is trial 272 with value: 0.5198344707489013.
Generating morgan fingerprints...
Generated fingerprints with 1024 features for 900 molecules
Data shape: X=(900, 1024), y=(900,)
Trial 1065: 5-fold CV loss = 0.5396
[I 2025-08-07 21:57:27,707] Trial 1065 finished with value: 0.5395976006984711 and parameters: {'fp_type': 'morgan', 'morgan_only_radius': 2, 'morgan_only_nBits': 1024, 'num_hidden_layers': 3, 'hidden_dim_0': 256, 'hidden_dim_1': 128, 'hidden_dim_2': 512, 'kl_weight': 0.007764374757456034, 'lr': 0.0022160242344277476, 'batch_size': 32, 'dropout_rate': 0.4843130751942114, 'prior_mu': -0.017951272041420177, 'prior_sigma': 0.06227881545309007, 'normalization': 'none'}. Best is trial 272 with value: 0.5198344707489013.
Generating morgan fingerprints...
Generated fingerprints with 1024 features for 900 molecules
Data shape: X=(900, 1024), y=(900,)
Trial 1067: 5-fold CV loss = 0.5321
[I 2025-08-07 21:58:09,782] Trial 1067 finished with value: 0.5321081519126892 and parameters: {'fp_type': 'morgan', 'morgan_only_radius': 2, 'morgan_only_nBits': 1024, 'num_hidden_layers': 3, 'hidden_dim_0': 256, 'hidden_dim_1': 128, 'hidden_dim_2': 512, 'kl_weight': 0.001123713680763594, 'lr': 0.0035053428709332394, 'batch_size': 32, 'dropout_rate': 0.48293121364110736, 'prior_mu': -0.14248940193888654, 'prior_sigma': 0.0732607880268548, 'normalization': 'none'}. Best is trial 272 with value: 0.5198344707489013.
Generating morgan fingerprints...
Generated fingerprints with 1024 features for 900 molecules
Data shape: X=(900, 1024), y=(900,)
Trial 1069: 5-fold CV loss = 0.8553
[I 2025-08-07 21:58:25,976] Trial 1069 finished with value: 0.8552639961242676 and parameters: {'fp_type': 'morgan', 'morgan_only_radius': 2, 'morgan_only_nBits': 1024, 'num_hidden_layers': 3, 'hidden_dim_0': 512, 'hidden_dim_1': 128, 'hidden_dim_2': 512, 'kl_weight': 0.0019533821866765918, 'lr': 0.001301987632488903, 'batch_size': 32, 'dropout_rate': 0.47092443604200585, 'prior_mu': -0.07259737544850588, 'prior_sigma': 0.07372010379813211, 'normalization': 'none'}. Best is trial 272 with value: 0.5198344707489013.
Generating morgan fingerprints...
Generated fingerprints with 1024 features for 900 molecules
Data shape: X=(900, 1024), y=(900,)
Trial 1066: 5-fold CV loss = 0.5352
