[I 2025-08-07 17:15:05,000] Trial 334 finished with value: 0.6147911071777343 and parameters: {'fp_type': 'rdkit', 'rdkit_only_maxPath': 5, 'rdkit_only_nBits': 256, 'num_hidden_layers': 3, 'hidden_dim_0': 512, 'hidden_dim_1': 512, 'hidden_dim_2': 512, 'kl_weight': 0.00019168519074063645, 'lr': 0.0027704006776348277, 'batch_size': 32, 'dropout_rate': 0.45662315157346683, 'prior_mu': -0.06478188746970803, 'prior_sigma': 0.05885593289927338, 'normalization': 'none'}. Best is trial 272 with value: 0.5198344707489013.
Generating morgan fingerprints...
Generated fingerprints with 1024 features for 900 molecules
Data shape: X=(900, 1024), y=(900,)
Trial 326: 5-fold CV loss = 0.5493
[I 2025-08-07 17:15:52,078] Trial 326 finished with value: 0.5492927670478821 and parameters: {'fp_type': 'morgan', 'morgan_only_radius': 3, 'morgan_only_nBits': 1024, 'num_hidden_layers': 3, 'hidden_dim_0': 128, 'hidden_dim_1': 256, 'hidden_dim_2': 512, 'kl_weight': 0.00020694606148913375, 'lr': 0.002546130045604065, 'batch_size': 32, 'dropout_rate': 0.4694912530263437, 'prior_mu': -0.06614032440669755, 'prior_sigma': 0.045191408883529516, 'normalization': 'none'}. Best is trial 272 with value: 0.5198344707489013.
Generating morgan fingerprints...
Generated fingerprints with 1024 features for 900 molecules
Data shape: X=(900, 1024), y=(900,)
Trial 337: 5-fold CV loss = 1.3950
[I 2025-08-07 17:16:09,238] Trial 337 finished with value: 1.3949527740478516 and parameters: {'fp_type': 'morgan', 'morgan_only_radius': 3, 'morgan_only_nBits': 1024, 'num_hidden_layers': 3, 'hidden_dim_0': 512, 'hidden_dim_1': 256, 'hidden_dim_2': 512, 'kl_weight': 0.0005941731602841184, 'lr': 0.002843761729082166, 'batch_size': 32, 'dropout_rate': 0.47381556334845987, 'prior_mu': -0.02954339848854817, 'prior_sigma': 0.11168711547779438, 'normalization': 'none'}. Best is trial 272 with value: 0.5198344707489013.
Generating morgan fingerprints...
Generated fingerprints with 1024 features for 900 molecules
Data shape: X=(900, 1024), y=(900,)
Trial 338: 5-fold CV loss = 0.5323
[I 2025-08-07 17:16:28,084] Trial 338 finished with value: 0.5323111951351166 and parameters: {'fp_type': 'morgan', 'morgan_only_radius': 3, 'morgan_only_nBits': 1024, 'num_hidden_layers': 3, 'hidden_dim_0': 512, 'hidden_dim_1': 256, 'hidden_dim_2': 512, 'kl_weight': 0.000613895020551158, 'lr': 0.0021882890647807545, 'batch_size': 32, 'dropout_rate': 0.47345916201076566, 'prior_mu': -0.08115958853481707, 'prior_sigma': 0.06667561600295747, 'normalization': 'none'}. Best is trial 272 with value: 0.5198344707489013.
Generating morgan fingerprints...
Generated fingerprints with 1024 features for 900 molecules
Data shape: X=(900, 1024), y=(900,)
Trial 336: 5-fold CV loss = 0.5316
[I 2025-08-07 17:16:48,033] Trial 336 finished with value: 0.5316093802452088 and parameters: {'fp_type': 'morgan', 'morgan_only_radius': 3, 'morgan_only_nBits': 1024, 'num_hidden_layers': 3, 'hidden_dim_0': 512, 'hidden_dim_1': 256, 'hidden_dim_2': 512, 'kl_weight': 0.00020360501412023616, 'lr': 0.0028084803595137763, 'batch_size': 32, 'dropout_rate': 0.47747139804904204, 'prior_mu': -0.05665331957564397, 'prior_sigma': 0.05921230846465206, 'normalization': 'none'}. Best is trial 272 with value: 0.5198344707489013.
Generating morgan fingerprints...
Generated fingerprints with 1024 features for 900 molecules
Data shape: X=(900, 1024), y=(900,)
Trial 340: 5-fold CV loss = 0.5325
[I 2025-08-07 17:17:23,631] Trial 340 finished with value: 0.5324955701828002 and parameters: {'fp_type': 'morgan', 'morgan_only_radius': 2, 'morgan_only_nBits': 1024, 'num_hidden_layers': 3, 'hidden_dim_0': 512, 'hidden_dim_1': 256, 'hidden_dim_2': 1024, 'kl_weight': 0.0008257350785229262, 'lr': 0.002215583680128962, 'batch_size': 32, 'dropout_rate': 0.49900190905267244, 'prior_mu': -0.054199375948229864, 'prior_sigma': 0.05601940943449758, 'normalization': 'none'}. Best is trial 272 with value: 0.5198344707489013.
Generating morgan fingerprints...
Generated fingerprints with 1024 features for 900 molecules
Data shape: X=(900, 1024), y=(900,)
Trial 341: 5-fold CV loss = 0.5313
[I 2025-08-07 17:17:48,971] Trial 341 finished with value: 0.5313236057758332 and parameters: {'fp_type': 'morgan', 'morgan_only_radius': 2, 'morgan_only_nBits': 1024, 'num_hidden_layers': 3, 'hidden_dim_0': 512, 'hidden_dim_1': 256, 'hidden_dim_2': 1024, 'kl_weight': 0.00023821166612277388, 'lr': 0.002212353482279274, 'batch_size': 32, 'dropout_rate': 0.4988452995350542, 'prior_mu': -0.04159358271823323, 'prior_sigma': 0.05614700662671342, 'normalization': 'none'}. Best is trial 272 with value: 0.5198344707489013.
Generating morgan fingerprints...
Generated fingerprints with 1024 features for 900 molecules
Data shape: X=(900, 1024), y=(900,)
Trial 343: 5-fold CV loss = 0.5314
[I 2025-08-07 17:18:33,309] Trial 343 finished with value: 0.5314158380031586 and parameters: {'fp_type': 'morgan', 'morgan_only_radius': 3, 'morgan_only_nBits': 1024, 'num_hidden_layers': 3, 'hidden_dim_0': 512, 'hidden_dim_1': 256, 'hidden_dim_2': 512, 'kl_weight': 0.00023519408574534332, 'lr': 0.0028716913286050295, 'batch_size': 32, 'dropout_rate': 0.49991459175281244, 'prior_mu': -0.040865220280607906, 'prior_sigma': 0.052602981027278096, 'normalization': 'none'}. Best is trial 272 with value: 0.5198344707489013.
Generating morgan fingerprints...
Generated fingerprints with 1024 features for 900 molecules
Data shape: X=(900, 1024), y=(900,)
Trial 342: 5-fold CV loss = 0.5317
[I 2025-08-07 17:18:52,070] Trial 342 finished with value: 0.5316882908344269 and parameters: {'fp_type': 'morgan', 'morgan_only_radius': 3, 'morgan_only_nBits': 1024, 'num_hidden_layers': 3, 'hidden_dim_0': 512, 'hidden_dim_1': 256, 'hidden_dim_2': 512, 'kl_weight': 0.00024060210598738467, 'lr': 0.0027898064489301068, 'batch_size': 32, 'dropout_rate': 0.49276626966485376, 'prior_mu': -0.05391617401340763, 'prior_sigma': 0.05577175352230854, 'normalization': 'none'}. Best is trial 272 with value: 0.5198344707489013.
Generating morgan fingerprints...
Generated fingerprints with 1024 features for 900 molecules
Data shape: X=(900, 1024), y=(900,)
Trial 345: 5-fold CV loss = 0.5337
[I 2025-08-07 17:19:28,525] Trial 345 finished with value: 0.5336500704288483 and parameters: {'fp_type': 'morgan', 'morgan_only_radius': 3, 'morgan_only_nBits': 1024, 'num_hidden_layers': 3, 'hidden_dim_0': 512, 'hidden_dim_1': 256, 'hidden_dim_2': 512, 'kl_weight': 0.00024072266404570852, 'lr': 0.0028711647544550126, 'batch_size': 32, 'dropout_rate': 0.49214803809319596, 'prior_mu': -0.039178151721091896, 'prior_sigma': 0.05054388125812229, 'normalization': 'none'}. Best is trial 272 with value: 0.5198344707489013.
Generating morgan fingerprints...
Generated fingerprints with 1024 features for 900 molecules
Data shape: X=(900, 1024), y=(900,)
Trial 344: 5-fold CV loss = 0.5447
[I 2025-08-07 17:19:38,454] Trial 344 finished with value: 0.5447298228740692 and parameters: {'fp_type': 'morgan', 'morgan_only_radius': 3, 'morgan_only_nBits': 1024, 'num_hidden_layers': 3, 'hidden_dim_0': 512, 'hidden_dim_1': 256, 'hidden_dim_2': 512, 'kl_weight': 0.00023908045251921862, 'lr': 0.001884419631238907, 'batch_size': 32, 'dropout_rate': 0.49103774227327407, 'prior_mu': -0.05347713857451282, 'prior_sigma': 0.050128091303043146, 'normalization': 'none'}. Best is trial 272 with value: 0.5198344707489013.
Generating morgan fingerprints...
Generated fingerprints with 1024 features for 900 molecules
Data shape: X=(900, 1024), y=(900,)
Trial 339: 5-fold CV loss = 0.5865
[I 2025-08-07 17:19:45,188] Trial 339 finished with value: 0.58650022149086 and parameters: {'fp_type': 'morgan', 'morgan_only_radius': 2, 'morgan_only_nBits': 1024, 'num_hidden_layers': 3, 'hidden_dim_0': 512, 'hidden_dim_1': 256, 'hidden_dim_2': 512, 'kl_weight': 0.0008706706870368699, 'lr': 0.0021789256176829247, 'batch_size': 32, 'dropout_rate': 0.4999009276343484, 'prior_mu': -0.031288164679969165, 'prior_sigma': 0.06743876390687205, 'normalization': 'none'}. Best is trial 272 with value: 0.5198344707489013.
Generating morgan fingerprints...
Generated fingerprints with 1024 features for 900 molecules
Data shape: X=(900, 1024), y=(900,)
Trial 347: 5-fold CV loss = 0.5323
[I 2025-08-07 17:20:27,543] Trial 347 finished with value: 0.532328462600708 and parameters: {'fp_type': 'morgan', 'morgan_only_radius': 3, 'morgan_only_nBits': 1024, 'num_hidden_layers': 3, 'hidden_dim_0': 512, 'hidden_dim_1': 256, 'hidden_dim_2': 512, 'kl_weight': 0.0002233116544408499, 'lr': 0.0027149113610221306, 'batch_size': 32, 'dropout_rate': 0.4812254890377375, 'prior_mu': -0.051608886041875024, 'prior_sigma': 0.05031828579275064, 'normalization': 'none'}. Best is trial 272 with value: 0.5198344707489013.
Generating morgan fingerprints...
Generated fingerprints with 1024 features for 900 molecules
Data shape: X=(900, 1024), y=(900,)
Trial 346: 5-fold CV loss = 0.5328
[I 2025-08-07 17:20:28,294] Trial 346 finished with value: 0.5327957093715667 and parameters: {'fp_type': 'morgan', 'morgan_only_radius': 3, 'morgan_only_nBits': 1024, 'num_hidden_layers': 3, 'hidden_dim_0': 512, 'hidden_dim_1': 256, 'hidden_dim_2': 512, 'kl_weight': 0.0002424497188028386, 'lr': 0.0028490905751890638, 'batch_size': 32, 'dropout_rate': 0.49944343449654877, 'prior_mu': -0.04032878815284429, 'prior_sigma': 0.06087175772245538, 'normalization': 'none'}. Best is trial 272 with value: 0.5198344707489013.
Generating morgan fingerprints...
Generated fingerprints with 1024 features for 900 molecules
Data shape: X=(900, 1024), y=(900,)
Trial 348: 5-fold CV loss = 0.5369
[I 2025-08-07 17:20:52,564] Trial 348 finished with value: 0.5368525981903076 and parameters: {'fp_type': 'morgan', 'morgan_only_radius': 3, 'morgan_only_nBits': 1024, 'num_hidden_layers': 3, 'hidden_dim_0': 512, 'hidden_dim_1': 256, 'hidden_dim_2': 512, 'kl_weight': 0.0002545660082065411, 'lr': 0.0027272085667438724, 'batch_size': 32, 'dropout_rate': 0.48036907511783616, 'prior_mu': -0.1414173868455916, 'prior_sigma': 0.06188765112580888, 'normalization': 'none'}. Best is trial 272 with value: 0.5198344707489013.
Generating morgan fingerprints...
Generated fingerprints with 1024 features for 900 molecules
Data shape: X=(900, 1024), y=(900,)
Trial 350: 5-fold CV loss = 0.5344
[I 2025-08-07 17:21:22,244] Trial 350 finished with value: 0.5344160318374633 and parameters: {'fp_type': 'morgan', 'morgan_only_radius': 3, 'morgan_only_nBits': 1024, 'num_hidden_layers': 3, 'hidden_dim_0': 512, 'hidden_dim_1': 256, 'hidden_dim_2': 512, 'kl_weight': 0.00025618087969247837, 'lr': 0.00294282693239603, 'batch_size': 32, 'dropout_rate': 0.48148104424037097, 'prior_mu': -0.04548687133417506, 'prior_sigma': 0.06145703867401858, 'normalization': 'none'}. Best is trial 272 with value: 0.5198344707489013.
Generating morgan fingerprints...
Generated fingerprints with 1024 features for 900 molecules
Data shape: X=(900, 1024), y=(900,)
Trial 352: 5-fold CV loss = 0.5596
[I 2025-08-07 17:22:15,649] Trial 352 finished with value: 0.5595961689949036 and parameters: {'fp_type': 'morgan', 'morgan_only_radius': 3, 'morgan_only_nBits': 1024, 'num_hidden_layers': 3, 'hidden_dim_0': 512, 'hidden_dim_1': 256, 'hidden_dim_2': 512, 'kl_weight': 0.00016448813628418455, 'lr': 0.002488279397869375, 'batch_size': 32, 'dropout_rate': 0.003973160355550953, 'prior_mu': -0.04624291828351578, 'prior_sigma': 0.05702167226482373, 'normalization': 'none'}. Best is trial 272 with value: 0.5198344707489013.
Generating morgan fingerprints...
Generated fingerprints with 1024 features for 900 molecules
Data shape: X=(900, 1024), y=(900,)
Trial 353: 5-fold CV loss = 0.5367
[I 2025-08-07 17:22:27,519] Trial 353 finished with value: 0.5367220044136047 and parameters: {'fp_type': 'morgan', 'morgan_only_radius': 3, 'morgan_only_nBits': 1024, 'num_hidden_layers': 3, 'hidden_dim_0': 512, 'hidden_dim_1': 256, 'hidden_dim_2': 512, 'kl_weight': 0.0001579911591093073, 'lr': 0.0024810643416381603, 'batch_size': 32, 'dropout_rate': 0.46852288838786205, 'prior_mu': -0.05647550839521387, 'prior_sigma': 0.05360254279850085, 'normalization': 'none'}. Best is trial 272 with value: 0.5198344707489013.
Generating morgan fingerprints...
Generated fingerprints with 1024 features for 900 molecules
Data shape: X=(900, 1024), y=(900,)
Trial 351: 5-fold CV loss = 0.5372
[I 2025-08-07 17:22:34,475] Trial 351 finished with value: 0.5371522545814514 and parameters: {'fp_type': 'morgan', 'morgan_only_radius': 3, 'morgan_only_nBits': 1024, 'num_hidden_layers': 3, 'hidden_dim_0': 512, 'hidden_dim_1': 256, 'hidden_dim_2': 512, 'kl_weight': 0.0001583157380621432, 'lr': 0.0025272514559868185, 'batch_size': 32, 'dropout_rate': 0.4807679610746512, 'prior_mu': -0.04481716178784733, 'prior_sigma': 0.06126831384034461, 'normalization': 'none'}. Best is trial 272 with value: 0.5198344707489013.
Generating morgan fingerprints...
Generated fingerprints with 1024 features for 900 molecules
Data shape: X=(900, 1024), y=(900,)
Trial 355: 5-fold CV loss = 0.5355
[I 2025-08-07 17:23:22,383] Trial 355 finished with value: 0.5355446398258209 and parameters: {'fp_type': 'morgan', 'morgan_only_radius': 3, 'morgan_only_nBits': 1024, 'num_hidden_layers': 3, 'hidden_dim_0': 512, 'hidden_dim_1': 256, 'hidden_dim_2': 512, 'kl_weight': 0.00020772787413523005, 'lr': 0.0030922741039343, 'batch_size': 32, 'dropout_rate': 0.49943056494459975, 'prior_mu': -0.09463830225491998, 'prior_sigma': 0.038052626042738645, 'normalization': 'none'}. Best is trial 272 with value: 0.5198344707489013.
Generating morgan fingerprints...
Generated fingerprints with 1024 features for 900 molecules
Data shape: X=(900, 1024), y=(900,)
Trial 349: 5-fold CV loss = 0.5337
[I 2025-08-07 17:23:38,009] Trial 349 finished with value: 0.5336897671222687 and parameters: {'fp_type': 'morgan', 'morgan_only_radius': 3, 'morgan_only_nBits': 1024, 'num_hidden_layers': 3, 'hidden_dim_0': 512, 'hidden_dim_1': 256, 'hidden_dim_2': 512, 'kl_weight': 0.00024507212498200965, 'lr': 0.002651036848583149, 'batch_size': 32, 'dropout_rate': 0.4804978177707157, 'prior_mu': -0.04405390781459535, 'prior_sigma': 0.062427645386719216, 'normalization': 'none'}. Best is trial 272 with value: 0.5198344707489013.
Generating morgan fingerprints...
Generated fingerprints with 1024 features for 900 molecules
Data shape: X=(900, 1024), y=(900,)
Trial 354: 5-fold CV loss = 0.5754
[I 2025-08-07 17:23:43,082] Trial 354 finished with value: 0.5754379451274871 and parameters: {'fp_type': 'morgan', 'morgan_only_radius': 3, 'morgan_only_nBits': 1024, 'num_hidden_layers': 3, 'hidden_dim_0': 512, 'hidden_dim_1': 256, 'hidden_dim_2': 512, 'kl_weight': 0.058132579587180606, 'lr': 0.002455790498916737, 'batch_size': 32, 'dropout_rate': 0.46008846639894363, 'prior_mu': -0.05569739416479619, 'prior_sigma': 0.05284384338097084, 'normalization': 'none'}. Best is trial 272 with value: 0.5198344707489013.
Generating morgan fingerprints...
Generated fingerprints with 1024 features for 900 molecules
Data shape: X=(900, 1024), y=(900,)
Trial 357: 5-fold CV loss = 0.6207
[I 2025-08-07 17:24:22,370] Trial 357 finished with value: 0.6207492589950562 and parameters: {'fp_type': 'morgan', 'morgan_only_radius': 3, 'morgan_only_nBits': 1024, 'num_hidden_layers': 3, 'hidden_dim_0': 512, 'hidden_dim_1': 256, 'hidden_dim_2': 512, 'kl_weight': 0.056261884619495654, 'lr': 0.0024319498429566833, 'batch_size': 32, 'dropout_rate': 0.45932389510699023, 'prior_mu': -0.038748227165718026, 'prior_sigma': 0.06827267987836914, 'normalization': 'none'}. Best is trial 272 with value: 0.5198344707489013.
Generating morgan fingerprints...
Generated fingerprints with 1024 features for 900 molecules
Data shape: X=(900, 1024), y=(900,)
Trial 356: 5-fold CV loss = 0.5359
[I 2025-08-07 17:24:27,489] Trial 356 finished with value: 0.5359345734119415 and parameters: {'fp_type': 'morgan', 'morgan_only_radius': 3, 'morgan_only_nBits': 1024, 'num_hidden_layers': 3, 'hidden_dim_0': 512, 'hidden_dim_1': 256, 'hidden_dim_2': 512, 'kl_weight': 0.00019217427251324524, 'lr': 0.0029311228164283125, 'batch_size': 32, 'dropout_rate': 0.4996588326581355, 'prior_mu': -0.035552432025639624, 'prior_sigma': 0.06726914124038812, 'normalization': 'none'}. Best is trial 272 with value: 0.5198344707489013.
Generating morgan fingerprints...
Generated fingerprints with 1024 features for 900 molecules
Data shape: X=(900, 1024), y=(900,)
Trial 359: 5-fold CV loss = 0.5335
[I 2025-08-07 17:24:47,740] Trial 359 finished with value: 0.5335257589817047 and parameters: {'fp_type': 'morgan', 'morgan_only_radius': 2, 'morgan_only_nBits': 1024, 'num_hidden_layers': 3, 'hidden_dim_0': 512, 'hidden_dim_1': 256, 'hidden_dim_2': 1024, 'kl_weight': 0.003179831658662152, 'lr': 0.0030765087587819647, 'batch_size': 32, 'dropout_rate': 0.4897234866095268, 'prior_mu': -0.03214956420602984, 'prior_sigma': 0.0672057061269668, 'normalization': 'none'}. Best is trial 272 with value: 0.5198344707489013.
Generating morgan fingerprints...
Generated fingerprints with 1024 features for 900 molecules
Data shape: X=(900, 1024), y=(900,)
Trial 361: 5-fold CV loss = 0.6935
[I 2025-08-07 17:24:56,129] Trial 361 finished with value: 0.6935389399528503 and parameters: {'fp_type': 'morgan', 'morgan_only_radius': 2, 'morgan_only_nBits': 1024, 'num_hidden_layers': 1, 'hidden_dim_0': 512, 'kl_weight': 0.00017823839575874102, 'lr': 0.003156739821331737, 'batch_size': 32, 'dropout_rate': 0.4896093312202401, 'prior_mu': -0.031290778833168366, 'prior_sigma': 0.05649538881108901, 'normalization': 'none'}. Best is trial 272 with value: 0.5198344707489013.
Generating morgan fingerprints...
Generated fingerprints with 1024 features for 900 molecules
Data shape: X=(900, 1024), y=(900,)
Trial 362: 5-fold CV loss = 0.7181
[I 2025-08-07 17:25:09,408] Trial 362 finished with value: 0.718106460571289 and parameters: {'fp_type': 'morgan', 'morgan_only_radius': 2, 'morgan_only_nBits': 1024, 'num_hidden_layers': 1, 'hidden_dim_0': 512, 'kl_weight': 0.00021667360084620037, 'lr': 0.002318309181526259, 'batch_size': 32, 'dropout_rate': 0.4884566697639004, 'prior_mu': -0.08019010151677938, 'prior_sigma': 0.057273168020824584, 'normalization': 'none'}. Best is trial 272 with value: 0.5198344707489013.
Generating morgan fingerprints...
Generated fingerprints with 1024 features for 900 molecules
Data shape: X=(900, 1024), y=(900,)
Trial 360: 5-fold CV loss = 0.5366
[I 2025-08-07 17:25:17,273] Trial 360 finished with value: 0.5366490542888641 and parameters: {'fp_type': 'morgan', 'morgan_only_radius': 2, 'morgan_only_nBits': 1024, 'num_hidden_layers': 3, 'hidden_dim_0': 512, 'hidden_dim_1': 256, 'hidden_dim_2': 1024, 'kl_weight': 0.00019722912474745162, 'lr': 0.0030412842863786994, 'batch_size': 32, 'dropout_rate': 0.4880820026009902, 'prior_mu': -0.03483544996773044, 'prior_sigma': 0.057450067674199405, 'normalization': 'none'}. Best is trial 272 with value: 0.5198344707489013.
Generating morgan fingerprints...
Generated fingerprints with 1024 features for 900 molecules
Data shape: X=(900, 1024), y=(900,)
Trial 365: 5-fold CV loss = 0.5329
[I 2025-08-07 17:26:16,971] Trial 365 finished with value: 0.53287952542305 and parameters: {'fp_type': 'morgan', 'morgan_only_radius': 2, 'morgan_only_nBits': 1024, 'num_hidden_layers': 3, 'hidden_dim_0': 512, 'hidden_dim_1': 256, 'hidden_dim_2': 1024, 'kl_weight': 0.0002687363128040298, 'lr': 0.0027631191657262505, 'batch_size': 32, 'dropout_rate': 0.4746246755024146, 'prior_mu': -0.06039534361276706, 'prior_sigma': 0.047862317276441066, 'normalization': 'none'}. Best is trial 272 with value: 0.5198344707489013.
Generating morgan fingerprints...
Generated fingerprints with 1024 features for 900 molecules
Data shape: X=(900, 1024), y=(900,)
Trial 364: 5-fold CV loss = 0.5579
[I 2025-08-07 17:26:21,322] Trial 364 finished with value: 0.5579489409923554 and parameters: {'fp_type': 'morgan', 'morgan_only_radius': 2, 'morgan_only_nBits': 1024, 'num_hidden_layers': 3, 'hidden_dim_0': 1024, 'hidden_dim_1': 256, 'hidden_dim_2': 1024, 'kl_weight': 0.00026176184491204756, 'lr': 0.0018290275011375212, 'batch_size': 32, 'dropout_rate': 0.47239267845515726, 'prior_mu': -0.061150797533093604, 'prior_sigma': 0.04808813567266579, 'normalization': 'none'}. Best is trial 272 with value: 0.5198344707489013.
Generating morgan fingerprints...
Generated fingerprints with 1024 features for 900 molecules
Data shape: X=(900, 1024), y=(900,)
Trial 363: 5-fold CV loss = 0.5369
[I 2025-08-07 17:26:24,027] Trial 363 finished with value: 0.5368662655353547 and parameters: {'fp_type': 'morgan', 'morgan_only_radius': 2, 'morgan_only_nBits': 1024, 'num_hidden_layers': 3, 'hidden_dim_0': 1024, 'hidden_dim_1': 256, 'hidden_dim_2': 1024, 'kl_weight': 0.00021014927477668944, 'lr': 0.002232722051119526, 'batch_size': 32, 'dropout_rate': 0.4735847896754183, 'prior_mu': -0.06029567404899673, 'prior_sigma': 0.05836884696399081, 'normalization': 'none'}. Best is trial 272 with value: 0.5198344707489013.
Generating morgan fingerprints...
Generated fingerprints with 1024 features for 900 molecules
Data shape: X=(900, 1024), y=(900,)
Trial 358: 5-fold CV loss = 0.5485
[I 2025-08-07 17:27:16,556] Trial 358 finished with value: 0.5484768629074097 and parameters: {'fp_type': 'morgan', 'morgan_only_radius': 3, 'morgan_only_nBits': 1024, 'num_hidden_layers': 3, 'hidden_dim_0': 512, 'hidden_dim_1': 256, 'hidden_dim_2': 512, 'kl_weight': 0.04893140820092552, 'lr': 0.002410514607432191, 'batch_size': 32, 'dropout_rate': 0.46325606200326114, 'prior_mu': -0.034689144062621774, 'prior_sigma': 0.06607081413585991, 'normalization': 'none'}. Best is trial 272 with value: 0.5198344707489013.
Generating morgan fingerprints...
Generated fingerprints with 1024 features for 900 molecules
Data shape: X=(900, 1024), y=(900,)
Trial 366: 5-fold CV loss = 0.8684
