[I 2025-08-08 07:48:00,142] Trial 2771 finished with value: 0.7350318908691407 and parameters: {'fp_type': 'morgan', 'morgan_only_radius': 3, 'morgan_only_nBits': 2048, 'num_hidden_layers': 3, 'hidden_dim_0': 512, 'hidden_dim_1': 128, 'hidden_dim_2': 512, 'kl_weight': 0.00028530412985008127, 'lr': 0.0014601997756848784, 'batch_size': 32, 'dropout_rate': 0.45380043388896835, 'prior_mu': 0.014755246121226424, 'prior_sigma': 0.05039351986975893, 'normalization': 'none'}. Best is trial 2752 with value: 0.5150722622871399.
Generating morgan fingerprints...
Generated fingerprints with 2048 features for 900 molecules
Data shape: X=(900, 2048), y=(900,)
Trial 2770: 5-fold CV loss = 0.6178
[I 2025-08-08 07:48:03,021] Trial 2770 finished with value: 0.6177833557128907 and parameters: {'fp_type': 'morgan', 'morgan_only_radius': 2, 'morgan_only_nBits': 2048, 'num_hidden_layers': 3, 'hidden_dim_0': 512, 'hidden_dim_1': 128, 'hidden_dim_2': 512, 'kl_weight': 0.00023228506991600196, 'lr': 0.0014785046229895949, 'batch_size': 32, 'dropout_rate': 0.4672398023916665, 'prior_mu': 0.009865301743225682, 'prior_sigma': 0.05723738449577661, 'normalization': 'none'}. Best is trial 2752 with value: 0.5150722622871399.
Generating morgan fingerprints...
Generated fingerprints with 2048 features for 900 molecules
Data shape: X=(900, 2048), y=(900,)
Trial 2772: 5-fold CV loss = 0.6706
[I 2025-08-08 07:48:24,052] Trial 2772 finished with value: 0.6705741047859192 and parameters: {'fp_type': 'morgan', 'morgan_only_radius': 3, 'morgan_only_nBits': 2048, 'num_hidden_layers': 3, 'hidden_dim_0': 512, 'hidden_dim_1': 128, 'hidden_dim_2': 512, 'kl_weight': 0.00022615970298156844, 'lr': 0.001366506931314285, 'batch_size': 32, 'dropout_rate': 0.46503479788367613, 'prior_mu': 0.030842398945816557, 'prior_sigma': 0.05935692005896582, 'normalization': 'none'}. Best is trial 2752 with value: 0.5150722622871399.
Generating morgan fingerprints...
Generated fingerprints with 2048 features for 900 molecules
Data shape: X=(900, 2048), y=(900,)
Trial 2767: 5-fold CV loss = 0.5702
[I 2025-08-08 07:49:01,889] Trial 2767 finished with value: 0.5701935172080994 and parameters: {'fp_type': 'morgan', 'morgan_only_radius': 2, 'morgan_only_nBits': 2048, 'num_hidden_layers': 3, 'hidden_dim_0': 128, 'hidden_dim_1': 128, 'hidden_dim_2': 512, 'kl_weight': 0.00020190891468007232, 'lr': 0.0016441001466528196, 'batch_size': 32, 'dropout_rate': 0.46110623756471214, 'prior_mu': 0.023062559357235925, 'prior_sigma': 0.0518879144445904, 'normalization': 'none'}. Best is trial 2752 with value: 0.5150722622871399.
Generating morgan fingerprints...
Generated fingerprints with 2048 features for 900 molecules
Data shape: X=(900, 2048), y=(900,)
Trial 2775: 5-fold CV loss = 0.6216
[I 2025-08-08 07:49:25,479] Trial 2775 finished with value: 0.6216149926185608 and parameters: {'fp_type': 'morgan', 'morgan_only_radius': 2, 'morgan_only_nBits': 2048, 'num_hidden_layers': 3, 'hidden_dim_0': 512, 'hidden_dim_1': 128, 'hidden_dim_2': 512, 'kl_weight': 0.0003377971803945278, 'lr': 0.001675326417500298, 'batch_size': 32, 'dropout_rate': 0.46062474144265747, 'prior_mu': 0.032215502486331156, 'prior_sigma': 0.05304855587511424, 'normalization': 'none'}. Best is trial 2752 with value: 0.5150722622871399.
Generating morgan fingerprints...
Generated fingerprints with 2048 features for 900 molecules
Data shape: X=(900, 2048), y=(900,)
Trial 2774: 5-fold CV loss = 0.5687
[I 2025-08-08 07:49:37,070] Trial 2774 finished with value: 0.5686946630477905 and parameters: {'fp_type': 'morgan', 'morgan_only_radius': 2, 'morgan_only_nBits': 2048, 'num_hidden_layers': 3, 'hidden_dim_0': 512, 'hidden_dim_1': 128, 'hidden_dim_2': 512, 'kl_weight': 0.00024146992712981301, 'lr': 0.001611919022430719, 'batch_size': 32, 'dropout_rate': 0.46985545678020224, 'prior_mu': 0.03321892288262899, 'prior_sigma': 0.05498849538510593, 'normalization': 'none'}. Best is trial 2752 with value: 0.5150722622871399.
Generating morgan fingerprints...
Generated fingerprints with 2048 features for 900 molecules
Data shape: X=(900, 2048), y=(900,)
Trial 2773: 5-fold CV loss = 0.6811
[I 2025-08-08 07:49:39,927] Trial 2773 finished with value: 0.6810936808586121 and parameters: {'fp_type': 'morgan', 'morgan_only_radius': 2, 'morgan_only_nBits': 2048, 'num_hidden_layers': 3, 'hidden_dim_0': 512, 'hidden_dim_1': 128, 'hidden_dim_2': 512, 'kl_weight': 0.0002385603584480464, 'lr': 0.0016047904458897104, 'batch_size': 32, 'dropout_rate': 0.4646723019815172, 'prior_mu': -0.0867038756011773, 'prior_sigma': 0.0575639426851682, 'normalization': 'none'}. Best is trial 2752 with value: 0.5150722622871399.
Generating morgan fingerprints...
Generated fingerprints with 2048 features for 900 molecules
Data shape: X=(900, 2048), y=(900,)
Trial 2778: 5-fold CV loss = 0.6360
[I 2025-08-08 07:49:58,734] Trial 2778 finished with value: 0.636010468006134 and parameters: {'fp_type': 'morgan', 'morgan_only_radius': 2, 'morgan_only_nBits': 2048, 'num_hidden_layers': 0, 'kl_weight': 0.0002629225161354265, 'lr': 0.001231407717549769, 'batch_size': 32, 'dropout_rate': 0.47085215779043105, 'prior_mu': 0.11689608938619714, 'prior_sigma': 0.057540586701439966, 'normalization': 'none'}. Best is trial 2752 with value: 0.5150722622871399.
Generating morgan fingerprints...
Generated fingerprints with 2048 features for 900 molecules
Data shape: X=(900, 2048), y=(900,)
Trial 2777: 5-fold CV loss = 0.6693
[I 2025-08-08 07:50:12,754] Trial 2777 finished with value: 0.6693170547485352 and parameters: {'fp_type': 'morgan', 'morgan_only_radius': 2, 'morgan_only_nBits': 2048, 'num_hidden_layers': 3, 'hidden_dim_0': 512, 'hidden_dim_1': 128, 'hidden_dim_2': 512, 'kl_weight': 0.00023848562873895302, 'lr': 0.0015868114153489913, 'batch_size': 32, 'dropout_rate': 0.4670535456518927, 'prior_mu': 0.03299252213816668, 'prior_sigma': 0.0570925360330761, 'normalization': 'none'}. Best is trial 2752 with value: 0.5150722622871399.
Generating morgan fingerprints...
Generated fingerprints with 2048 features for 900 molecules
Data shape: X=(900, 2048), y=(900,)
Trial 2779: 5-fold CV loss = 0.7600
[I 2025-08-08 07:50:14,253] Trial 2779 finished with value: 0.7599599838256836 and parameters: {'fp_type': 'morgan', 'morgan_only_radius': 2, 'morgan_only_nBits': 2048, 'num_hidden_layers': 3, 'hidden_dim_0': 512, 'hidden_dim_1': 128, 'hidden_dim_2': 512, 'kl_weight': 0.00027267116367190496, 'lr': 0.001343968455773406, 'batch_size': 32, 'dropout_rate': 0.4671267392851584, 'prior_mu': 0.024433010032043952, 'prior_sigma': 0.05797155495435535, 'normalization': 'none'}. Best is trial 2752 with value: 0.5150722622871399.
Generating rdkit fingerprints...
Generated fingerprints with 512 features for 900 molecules
Data shape: X=(900, 512), y=(900,)
Trial 2781: 5-fold CV loss = 0.6948
[I 2025-08-08 07:50:21,353] Trial 2781 finished with value: 0.6948171019554138 and parameters: {'fp_type': 'morgan', 'morgan_only_radius': 2, 'morgan_only_nBits': 2048, 'num_hidden_layers': 3, 'hidden_dim_0': 512, 'hidden_dim_1': 128, 'hidden_dim_2': 512, 'kl_weight': 0.00024030973812426908, 'lr': 0.0017363965503035348, 'batch_size': 128, 'dropout_rate': 0.46228817242543524, 'prior_mu': 0.020809789617260405, 'prior_sigma': 0.06285369838275144, 'normalization': 'none'}. Best is trial 2752 with value: 0.5150722622871399.
Generating morgan fingerprints...
Generated fingerprints with 2048 features for 900 molecules
Data shape: X=(900, 2048), y=(900,)
Trial 2780: 5-fold CV loss = 0.7653
[I 2025-08-08 07:51:00,435] Trial 2780 finished with value: 0.7652804851531982 and parameters: {'fp_type': 'morgan', 'morgan_only_radius': 2, 'morgan_only_nBits': 2048, 'num_hidden_layers': 3, 'hidden_dim_0': 512, 'hidden_dim_1': 128, 'hidden_dim_2': 512, 'kl_weight': 0.00031058064809451547, 'lr': 0.001732631537209819, 'batch_size': 32, 'dropout_rate': 0.4733135131239511, 'prior_mu': 0.026209228255964345, 'prior_sigma': 0.061507494695734306, 'normalization': 'none'}. Best is trial 2752 with value: 0.5150722622871399.
Generating morgan fingerprints...
Generated fingerprints with 2048 features for 900 molecules
Data shape: X=(900, 2048), y=(900,)
Trial 2782: 5-fold CV loss = 1.0781
[I 2025-08-08 07:51:13,186] Trial 2782 finished with value: 1.0780590057373047 and parameters: {'fp_type': 'rdkit', 'rdkit_only_maxPath': 5, 'rdkit_only_nBits': 512, 'num_hidden_layers': 3, 'hidden_dim_0': 512, 'hidden_dim_1': 128, 'hidden_dim_2': 512, 'kl_weight': 0.0002584214786660936, 'lr': 0.00014830340392454365, 'batch_size': 32, 'dropout_rate': 0.46441061761109564, 'prior_mu': 0.009014557811538494, 'prior_sigma': 0.05987929921605918, 'normalization': 'none'}. Best is trial 2752 with value: 0.5150722622871399.
Generating morgan fingerprints...
Generated fingerprints with 2048 features for 900 molecules
Data shape: X=(900, 2048), y=(900,)
Trial 2784: 5-fold CV loss = 1.0361
[I 2025-08-08 07:51:25,682] Trial 2784 finished with value: 1.036133360862732 and parameters: {'fp_type': 'morgan', 'morgan_only_radius': 2, 'morgan_only_nBits': 2048, 'num_hidden_layers': 3, 'hidden_dim_0': 512, 'hidden_dim_1': 128, 'hidden_dim_2': 512, 'kl_weight': 0.00026110035798148474, 'lr': 0.001763817875577519, 'batch_size': 64, 'dropout_rate': 0.46989920178585703, 'prior_mu': 0.03641486061161808, 'prior_sigma': 0.07854162126941068, 'normalization': 'none'}. Best is trial 2752 with value: 0.5150722622871399.
Generating morgan fingerprints...
Generated fingerprints with 2048 features for 900 molecules
Data shape: X=(900, 2048), y=(900,)
Trial 2783: 5-fold CV loss = 0.5700
[I 2025-08-08 07:51:29,479] Trial 2783 finished with value: 0.5699698388576507 and parameters: {'fp_type': 'morgan', 'morgan_only_radius': 2, 'morgan_only_nBits': 2048, 'num_hidden_layers': 3, 'hidden_dim_0': 512, 'hidden_dim_1': 128, 'hidden_dim_2': 512, 'kl_weight': 0.00029779435046390474, 'lr': 0.0017333312357831986, 'batch_size': 32, 'dropout_rate': 0.4697215628208736, 'prior_mu': 0.0378098365993103, 'prior_sigma': 0.06085610710978951, 'normalization': 'none'}. Best is trial 2752 with value: 0.5150722622871399.
Generating morgan fingerprints...
Generated fingerprints with 2048 features for 900 molecules
Data shape: X=(900, 2048), y=(900,)
Trial 2785: 5-fold CV loss = 1.0889
[I 2025-08-08 07:51:38,582] Trial 2785 finished with value: 1.0888986825942992 and parameters: {'fp_type': 'morgan', 'morgan_only_radius': 2, 'morgan_only_nBits': 2048, 'num_hidden_layers': 3, 'hidden_dim_0': 512, 'hidden_dim_1': 128, 'hidden_dim_2': 512, 'kl_weight': 0.00027449310843953936, 'lr': 0.0017428099413736783, 'batch_size': 64, 'dropout_rate': 0.4705607069179525, 'prior_mu': 0.0371674582686003, 'prior_sigma': 0.07786460448732585, 'normalization': 'none'}. Best is trial 2752 with value: 0.5150722622871399.
Generating morgan fingerprints...
Generated fingerprints with 2048 features for 900 molecules
Data shape: X=(900, 2048), y=(900,)
Trial 2776: 5-fold CV loss = 0.7303
[I 2025-08-08 07:51:41,415] Trial 2776 finished with value: 0.7303321123123169 and parameters: {'fp_type': 'morgan', 'morgan_only_radius': 2, 'morgan_only_nBits': 2048, 'num_hidden_layers': 3, 'hidden_dim_0': 512, 'hidden_dim_1': 128, 'hidden_dim_2': 512, 'kl_weight': 0.00026981033726298625, 'lr': 0.001615985112101885, 'batch_size': 32, 'dropout_rate': 0.4740986750303467, 'prior_mu': 0.03261102369058162, 'prior_sigma': 0.05639684285222106, 'normalization': 'none'}. Best is trial 2752 with value: 0.5150722622871399.
Generating morgan fingerprints...
Generated fingerprints with 2048 features for 900 molecules
Data shape: X=(900, 2048), y=(900,)
Trial 2787: 5-fold CV loss = 0.9360
[I 2025-08-08 07:51:51,179] Trial 2787 finished with value: 0.9360002398490905 and parameters: {'fp_type': 'morgan', 'morgan_only_radius': 2, 'morgan_only_nBits': 2048, 'num_hidden_layers': 3, 'hidden_dim_0': 512, 'hidden_dim_1': 128, 'hidden_dim_2': 512, 'kl_weight': 0.0002599149462284776, 'lr': 0.0014307313767836854, 'batch_size': 32, 'dropout_rate': 0.46916678914481436, 'prior_mu': 0.038198471109563294, 'prior_sigma': 0.07549164594318926, 'normalization': 'none'}. Best is trial 2752 with value: 0.5150722622871399.
Generating morgan fingerprints...
Generated fingerprints with 2048 features for 900 molecules
Data shape: X=(900, 2048), y=(900,)
Trial 2790: 5-fold CV loss = 0.5624
[I 2025-08-08 07:52:49,830] Trial 2790 finished with value: 0.5624145448207856 and parameters: {'fp_type': 'morgan', 'morgan_only_radius': 2, 'morgan_only_nBits': 2048, 'num_hidden_layers': 3, 'hidden_dim_0': 512, 'hidden_dim_1': 128, 'hidden_dim_2': 512, 'kl_weight': 0.00020009675313686746, 'lr': 0.00180904088585037, 'batch_size': 32, 'dropout_rate': 0.4689112050953355, 'prior_mu': 0.017224963330058424, 'prior_sigma': 0.0724716215890975, 'normalization': 'layer'}. Best is trial 2752 with value: 0.5150722622871399.
Generating morgan fingerprints...
Generated fingerprints with 2048 features for 900 molecules
Data shape: X=(900, 2048), y=(900,)
Trial 2786: 5-fold CV loss = 0.6137
[I 2025-08-08 07:53:13,277] Trial 2786 finished with value: 0.6136842012405396 and parameters: {'fp_type': 'morgan', 'morgan_only_radius': 2, 'morgan_only_nBits': 2048, 'num_hidden_layers': 3, 'hidden_dim_0': 512, 'hidden_dim_1': 128, 'hidden_dim_2': 512, 'kl_weight': 0.000277893256030524, 'lr': 0.0015060080595953307, 'batch_size': 32, 'dropout_rate': 0.471439775838579, 'prior_mu': 0.03773452002564605, 'prior_sigma': 0.07508482564019207, 'normalization': 'none'}. Best is trial 2752 with value: 0.5150722622871399.
Generating morgan fingerprints...
Generated fingerprints with 2048 features for 900 molecules
Data shape: X=(900, 2048), y=(900,)
Trial 2788: 5-fold CV loss = 0.8753
[I 2025-08-08 07:53:34,901] Trial 2788 finished with value: 0.8753239929676055 and parameters: {'fp_type': 'morgan', 'morgan_only_radius': 2, 'morgan_only_nBits': 2048, 'num_hidden_layers': 3, 'hidden_dim_0': 512, 'hidden_dim_1': 128, 'hidden_dim_2': 512, 'kl_weight': 0.00018375243205049643, 'lr': 0.001456109020423013, 'batch_size': 32, 'dropout_rate': 0.47015130809896705, 'prior_mu': 0.02930133326710501, 'prior_sigma': 0.07445576277422958, 'normalization': 'none'}. Best is trial 2752 with value: 0.5150722622871399.
Generating morgan fingerprints...
Generated fingerprints with 2048 features for 900 molecules
Data shape: X=(900, 2048), y=(900,)
Trial 2789: 5-fold CV loss = 0.9054
[I 2025-08-08 07:53:38,418] Trial 2789 finished with value: 0.9054222524166107 and parameters: {'fp_type': 'morgan', 'morgan_only_radius': 2, 'morgan_only_nBits': 2048, 'num_hidden_layers': 3, 'hidden_dim_0': 512, 'hidden_dim_1': 128, 'hidden_dim_2': 512, 'kl_weight': 0.00017375434848431975, 'lr': 0.0014508365137952358, 'batch_size': 32, 'dropout_rate': 0.45893806539206733, 'prior_mu': 0.040027195732670724, 'prior_sigma': 0.07540292843828182, 'normalization': 'none'}. Best is trial 2752 with value: 0.5150722622871399.
Generating morgan fingerprints...
Generated fingerprints with 2048 features for 900 molecules
Data shape: X=(900, 2048), y=(900,)
Trial 2791: 5-fold CV loss = 0.6691
[I 2025-08-08 07:53:39,090] Trial 2791 finished with value: 0.6691196322441101 and parameters: {'fp_type': 'morgan', 'morgan_only_radius': 2, 'morgan_only_nBits': 2048, 'num_hidden_layers': 3, 'hidden_dim_0': 512, 'hidden_dim_1': 128, 'hidden_dim_2': 512, 'kl_weight': 0.00027378828205230937, 'lr': 0.0015287983644685537, 'batch_size': 32, 'dropout_rate': 0.45920439750191505, 'prior_mu': 0.028973860683647615, 'prior_sigma': 0.061723435849071424, 'normalization': 'none'}. Best is trial 2752 with value: 0.5150722622871399.
Generating morgan fingerprints...
Generated fingerprints with 2048 features for 900 molecules
Data shape: X=(900, 2048), y=(900,)
Trial 2794: 5-fold CV loss = 0.8304
[I 2025-08-08 07:54:47,321] Trial 2794 finished with value: 0.8304033756256104 and parameters: {'fp_type': 'morgan', 'morgan_only_radius': 2, 'morgan_only_nBits': 2048, 'num_hidden_layers': 3, 'hidden_dim_0': 512, 'hidden_dim_1': 128, 'hidden_dim_2': 512, 'kl_weight': 0.00020243996079089983, 'lr': 0.0011073928329071385, 'batch_size': 32, 'dropout_rate': 0.452370743446939, 'prior_mu': 0.025863280351235814, 'prior_sigma': 0.06141386216053741, 'normalization': 'none'}. Best is trial 2752 with value: 0.5150722622871399.
Generating morgan fingerprints...
Generated fingerprints with 2048 features for 900 molecules
Data shape: X=(900, 2048), y=(900,)
Trial 2795: 5-fold CV loss = 0.6429
[I 2025-08-08 07:54:55,373] Trial 2795 finished with value: 0.6429082453250885 and parameters: {'fp_type': 'morgan', 'morgan_only_radius': 2, 'morgan_only_nBits': 2048, 'num_hidden_layers': 3, 'hidden_dim_0': 512, 'hidden_dim_1': 128, 'hidden_dim_2': 512, 'kl_weight': 0.00029906340207036964, 'lr': 0.0017556957350495217, 'batch_size': 32, 'dropout_rate': 0.45701000928133506, 'prior_mu': 0.008713883558497948, 'prior_sigma': 0.07859738003362127, 'normalization': 'none'}. Best is trial 2752 with value: 0.5150722622871399.
Generating morgan fingerprints...
Generated fingerprints with 2048 features for 900 molecules
Data shape: X=(900, 2048), y=(900,)
Trial 2792: 5-fold CV loss = 0.5258
[I 2025-08-08 07:55:09,599] Trial 2792 finished with value: 0.5258342981338501 and parameters: {'fp_type': 'morgan', 'morgan_only_radius': 2, 'morgan_only_nBits': 2048, 'num_hidden_layers': 3, 'hidden_dim_0': 512, 'hidden_dim_1': 128, 'hidden_dim_2': 512, 'kl_weight': 0.000240509817787322, 'lr': 0.0018389220552360178, 'batch_size': 32, 'dropout_rate': 0.45142909855115226, 'prior_mu': 0.027871609943742624, 'prior_sigma': 0.06032223531645935, 'normalization': 'none'}. Best is trial 2752 with value: 0.5150722622871399.
Generating morgan fingerprints...
Generated fingerprints with 2048 features for 900 molecules
Data shape: X=(900, 2048), y=(900,)
Trial 2793: 5-fold CV loss = 0.5753
[I 2025-08-08 07:55:25,035] Trial 2793 finished with value: 0.5752617061138153 and parameters: {'fp_type': 'morgan', 'morgan_only_radius': 2, 'morgan_only_nBits': 2048, 'num_hidden_layers': 3, 'hidden_dim_0': 512, 'hidden_dim_1': 128, 'hidden_dim_2': 512, 'kl_weight': 0.00023251703724226793, 'lr': 0.00181797332284773, 'batch_size': 32, 'dropout_rate': 0.4576709024620591, 'prior_mu': 0.02717610927146083, 'prior_sigma': 0.06071533136773796, 'normalization': 'none'}. Best is trial 2752 with value: 0.5150722622871399.
Generating morgan fingerprints...
Generated fingerprints with 2048 features for 900 molecules
Data shape: X=(900, 2048), y=(900,)
Trial 2797: 5-fold CV loss = 0.5681
[I 2025-08-08 07:56:02,788] Trial 2797 finished with value: 0.5680760085582733 and parameters: {'fp_type': 'morgan', 'morgan_only_radius': 2, 'morgan_only_nBits': 2048, 'num_hidden_layers': 3, 'hidden_dim_0': 256, 'hidden_dim_1': 128, 'hidden_dim_2': 512, 'kl_weight': 0.00022044640801982787, 'lr': 0.0018541689275832845, 'batch_size': 32, 'dropout_rate': 0.3639276924401711, 'prior_mu': 0.04287671263797557, 'prior_sigma': 0.07006416310238493, 'normalization': 'none'}. Best is trial 2752 with value: 0.5150722622871399.
Generating morgan fingerprints...
Generated fingerprints with 2048 features for 900 molecules
Data shape: X=(900, 2048), y=(900,)
Trial 2798: 5-fold CV loss = 0.6120
[I 2025-08-08 07:56:22,971] Trial 2798 finished with value: 0.6120482206344604 and parameters: {'fp_type': 'morgan', 'morgan_only_radius': 2, 'morgan_only_nBits': 2048, 'num_hidden_layers': 3, 'hidden_dim_0': 256, 'hidden_dim_1': 128, 'hidden_dim_2': 512, 'kl_weight': 0.00019668498275861594, 'lr': 0.0019732961024422724, 'batch_size': 32, 'dropout_rate': 0.4580373940481253, 'prior_mu': 0.16784889225607724, 'prior_sigma': 0.0710862649219072, 'normalization': 'none'}. Best is trial 2752 with value: 0.5150722622871399.
Generating morgan fingerprints...
Generated fingerprints with 2048 features for 900 molecules
Data shape: X=(900, 2048), y=(900,)
Trial 2801: 5-fold CV loss = 0.7277
[I 2025-08-08 07:56:39,976] Trial 2801 finished with value: 0.7277390837669373 and parameters: {'fp_type': 'morgan', 'morgan_only_radius': 2, 'morgan_only_nBits': 2048, 'num_hidden_layers': 3, 'hidden_dim_0': 512, 'hidden_dim_1': 128, 'hidden_dim_2': 512, 'kl_weight': 0.00023188615896600873, 'lr': 0.0016564050651195403, 'batch_size': 64, 'dropout_rate': 0.4560976871128543, 'prior_mu': 0.042058741330343236, 'prior_sigma': 0.06459894071421737, 'normalization': 'none'}. Best is trial 2752 with value: 0.5150722622871399.
Generating morgan fingerprints...
Generated fingerprints with 2048 features for 900 molecules
Data shape: X=(900, 2048), y=(900,)
Trial 2799: 5-fold CV loss = 0.6088
[I 2025-08-08 07:57:05,242] Trial 2799 finished with value: 0.6087596356868744 and parameters: {'fp_type': 'morgan', 'morgan_only_radius': 2, 'morgan_only_nBits': 2048, 'num_hidden_layers': 3, 'hidden_dim_0': 512, 'hidden_dim_1': 128, 'hidden_dim_2': 512, 'kl_weight': 0.0002053647779880762, 'lr': 0.0019269994018376484, 'batch_size': 32, 'dropout_rate': 0.45776537647498533, 'prior_mu': 0.04541087167097174, 'prior_sigma': 0.06963649122548508, 'normalization': 'none'}. Best is trial 2752 with value: 0.5150722622871399.
Generating morgan fingerprints...
Generated fingerprints with 2048 features for 900 molecules
Data shape: X=(900, 2048), y=(900,)
Trial 2800: 5-fold CV loss = 0.5606
[I 2025-08-08 07:57:25,687] Trial 2800 finished with value: 0.5605641782283783 and parameters: {'fp_type': 'morgan', 'morgan_only_radius': 2, 'morgan_only_nBits': 2048, 'num_hidden_layers': 3, 'hidden_dim_0': 512, 'hidden_dim_1': 128, 'hidden_dim_2': 512, 'kl_weight': 0.0001750776378049613, 'lr': 0.0019703581498370835, 'batch_size': 32, 'dropout_rate': 0.4571757065353211, 'prior_mu': -0.1869047534992012, 'prior_sigma': 0.06465165058868207, 'normalization': 'none'}. Best is trial 2752 with value: 0.5150722622871399.
Generating rdkit fingerprints...
Generated fingerprints with 1024 features for 900 molecules
Data shape: X=(900, 1024), y=(900,)
Trial 2802: 5-fold CV loss = 0.5263
