[I 2025-08-07 21:35:48,521] Trial 1005 finished with value: 0.5480924546718597 and parameters: {'fp_type': 'morgan', 'morgan_only_radius': 2, 'morgan_only_nBits': 1024, 'num_hidden_layers': 3, 'hidden_dim_0': 128, 'hidden_dim_1': 128, 'hidden_dim_2': 512, 'kl_weight': 0.00571273178515293, 'lr': 0.0023601575313451527, 'batch_size': 32, 'dropout_rate': 0.49093689842081834, 'prior_mu': -0.012067992010757672, 'prior_sigma': 0.07423523718851924, 'normalization': 'none'}. Best is trial 272 with value: 0.5198344707489013.
Generating morgan fingerprints...
Generated fingerprints with 2048 features for 900 molecules
Data shape: X=(900, 2048), y=(900,)
Trial 1009: 5-fold CV loss = 0.8898
[I 2025-08-07 21:36:29,500] Trial 1009 finished with value: 0.8897711396217346 and parameters: {'fp_type': 'morgan', 'morgan_only_radius': 2, 'morgan_only_nBits': 2048, 'num_hidden_layers': 3, 'hidden_dim_0': 512, 'hidden_dim_1': 128, 'hidden_dim_2': 512, 'kl_weight': 0.0021233635017766594, 'lr': 0.001557036345313325, 'batch_size': 64, 'dropout_rate': 0.46339447807840717, 'prior_mu': -0.04149936672597694, 'prior_sigma': 0.0787869688968843, 'normalization': 'none'}. Best is trial 272 with value: 0.5198344707489013.
Generating morgan fingerprints...
Generated fingerprints with 1024 features for 900 molecules
Data shape: X=(900, 1024), y=(900,)
Trial 1007: 5-fold CV loss = 0.5299
[I 2025-08-07 21:36:36,136] Trial 1007 finished with value: 0.5298739731311798 and parameters: {'fp_type': 'morgan', 'morgan_only_radius': 2, 'morgan_only_nBits': 1024, 'num_hidden_layers': 3, 'hidden_dim_0': 512, 'hidden_dim_1': 128, 'hidden_dim_2': 512, 'kl_weight': 0.005528780972530817, 'lr': 0.0016412279211144108, 'batch_size': 32, 'dropout_rate': 0.46260032655330946, 'prior_mu': -0.012800295370701566, 'prior_sigma': 0.08566294798669337, 'normalization': 'none'}. Best is trial 272 with value: 0.5198344707489013.
Generating morgan fingerprints...
Generated fingerprints with 2048 features for 900 molecules
Data shape: X=(900, 2048), y=(900,)
Trial 1006: 5-fold CV loss = 0.5366
[I 2025-08-07 21:36:50,628] Trial 1006 finished with value: 0.5366100668907166 and parameters: {'fp_type': 'morgan', 'morgan_only_radius': 2, 'morgan_only_nBits': 1024, 'num_hidden_layers': 3, 'hidden_dim_0': 512, 'hidden_dim_1': 128, 'hidden_dim_2': 512, 'kl_weight': 0.001213022680460643, 'lr': 0.0024050377407954095, 'batch_size': 32, 'dropout_rate': 0.4999560070907504, 'prior_mu': -0.024622485303765186, 'prior_sigma': 0.08520430210773164, 'normalization': 'none'}. Best is trial 272 with value: 0.5198344707489013.
Generating morgan fingerprints...
Generated fingerprints with 2048 features for 900 molecules
Data shape: X=(900, 2048), y=(900,)
Trial 1008: 5-fold CV loss = 1.0630
[I 2025-08-07 21:37:08,566] Trial 1008 finished with value: 1.0629700064659118 and parameters: {'fp_type': 'morgan', 'morgan_only_radius': 2, 'morgan_only_nBits': 1024, 'num_hidden_layers': 3, 'hidden_dim_0': 512, 'hidden_dim_1': 128, 'hidden_dim_2': 512, 'kl_weight': 0.0022064749305714905, 'lr': 0.001550680339549014, 'batch_size': 64, 'dropout_rate': 0.4610493310949362, 'prior_mu': -0.03979320486493829, 'prior_sigma': 0.08393831222832995, 'normalization': 'none'}. Best is trial 272 with value: 0.5198344707489013.
Generating morgan fingerprints...
Generated fingerprints with 2048 features for 900 molecules
Data shape: X=(900, 2048), y=(900,)
Trial 1011: 5-fold CV loss = 0.8942
[I 2025-08-07 21:37:42,813] Trial 1011 finished with value: 0.8941742658615113 and parameters: {'fp_type': 'morgan', 'morgan_only_radius': 2, 'morgan_only_nBits': 2048, 'num_hidden_layers': 3, 'hidden_dim_0': 512, 'hidden_dim_1': 128, 'hidden_dim_2': 512, 'kl_weight': 0.0024371792423059746, 'lr': 0.0014238472037167338, 'batch_size': 32, 'dropout_rate': 0.47496777740797913, 'prior_mu': -0.03744704073763792, 'prior_sigma': 0.08200676820166511, 'normalization': 'none'}. Best is trial 272 with value: 0.5198344707489013.
Generating morgan fingerprints...
Generated fingerprints with 2048 features for 900 molecules
Data shape: X=(900, 2048), y=(900,)
Trial 1010: 5-fold CV loss = 0.5887
[I 2025-08-07 21:38:15,276] Trial 1010 finished with value: 0.5887386441230774 and parameters: {'fp_type': 'morgan', 'morgan_only_radius': 2, 'morgan_only_nBits': 1024, 'num_hidden_layers': 3, 'hidden_dim_0': 512, 'hidden_dim_1': 128, 'hidden_dim_2': 512, 'kl_weight': 0.0019193260766686153, 'lr': 0.0016691040322748363, 'batch_size': 32, 'dropout_rate': 0.47251037607323476, 'prior_mu': -0.036876927759887816, 'prior_sigma': 0.07628625570081148, 'normalization': 'none'}. Best is trial 272 with value: 0.5198344707489013.
Generating morgan fingerprints...
Generated fingerprints with 2048 features for 900 molecules
Data shape: X=(900, 2048), y=(900,)
Trial 1014: 5-fold CV loss = 0.5540
[I 2025-08-07 21:39:04,190] Trial 1014 finished with value: 0.5540276527404785 and parameters: {'fp_type': 'morgan', 'morgan_only_radius': 2, 'morgan_only_nBits': 2048, 'num_hidden_layers': 3, 'hidden_dim_0': 512, 'hidden_dim_1': 128, 'hidden_dim_2': 512, 'kl_weight': 0.00214956866792993, 'lr': 0.0018183941486439536, 'batch_size': 32, 'dropout_rate': 0.47434570297352124, 'prior_mu': -0.04886801969458807, 'prior_sigma': 0.03144049346559575, 'normalization': 'none'}. Best is trial 272 with value: 0.5198344707489013.
Generating morgan fingerprints...
Generated fingerprints with 2048 features for 900 molecules
Data shape: X=(900, 2048), y=(900,)
Trial 1012: 5-fold CV loss = 0.5333
[I 2025-08-07 21:39:13,382] Trial 1012 finished with value: 0.5333000898361206 and parameters: {'fp_type': 'morgan', 'morgan_only_radius': 2, 'morgan_only_nBits': 2048, 'num_hidden_layers': 3, 'hidden_dim_0': 512, 'hidden_dim_1': 128, 'hidden_dim_2': 512, 'kl_weight': 0.002494601700628199, 'lr': 0.0017985133792983961, 'batch_size': 32, 'dropout_rate': 0.47418297487198896, 'prior_mu': -0.03922335266376506, 'prior_sigma': 0.07645730588190139, 'normalization': 'none'}. Best is trial 272 with value: 0.5198344707489013.
Generating morgan fingerprints...
Generated fingerprints with 1024 features for 900 molecules
Data shape: X=(900, 1024), y=(900,)
Trial 1015: 5-fold CV loss = 0.6942
[I 2025-08-07 21:39:29,482] Trial 1015 finished with value: 0.6941965758800507 and parameters: {'fp_type': 'morgan', 'morgan_only_radius': 2, 'morgan_only_nBits': 2048, 'num_hidden_layers': 3, 'hidden_dim_0': 512, 'hidden_dim_1': 128, 'hidden_dim_2': 512, 'kl_weight': 0.0023479672428026338, 'lr': 0.0018098512971996775, 'batch_size': 32, 'dropout_rate': 0.4477938119684291, 'prior_mu': -0.052930785531167104, 'prior_sigma': 0.07926030290317028, 'normalization': 'none'}. Best is trial 272 with value: 0.5198344707489013.
Generating morgan_rdkit fingerprints...
Generated fingerprints with 768 features for 900 molecules
Data shape: X=(900, 768), y=(900,)
Trial 1016: 5-fold CV loss = 0.6101
[I 2025-08-07 21:40:22,181] Trial 1016 finished with value: 0.6100579023361206 and parameters: {'fp_type': 'morgan', 'morgan_only_radius': 2, 'morgan_only_nBits': 2048, 'num_hidden_layers': 3, 'hidden_dim_0': 512, 'hidden_dim_1': 128, 'hidden_dim_2': 64, 'kl_weight': 0.0025843191532662797, 'lr': 0.0018558557919168665, 'batch_size': 32, 'dropout_rate': 0.4458743702694127, 'prior_mu': -0.05524747191683432, 'prior_sigma': 0.07566138079242407, 'normalization': 'none'}. Best is trial 272 with value: 0.5198344707489013.
Generating morgan fingerprints...
Generated fingerprints with 1024 features for 900 molecules
Data shape: X=(900, 1024), y=(900,)
Trial 1018: 5-fold CV loss = 0.5781
[I 2025-08-07 21:40:36,017] Trial 1018 finished with value: 0.5781356394290924 and parameters: {'fp_type': 'morgan_rdkit', 'combined_morgan_radius': 3, 'combined_morgan_nBits': 512, 'combined_rdkit_maxPath': 8, 'combined_rdkit_nBits': 256, 'num_hidden_layers': 3, 'hidden_dim_0': 512, 'hidden_dim_1': 128, 'hidden_dim_2': 64, 'kl_weight': 0.001999994504303661, 'lr': 0.001943694027238856, 'batch_size': 32, 'dropout_rate': 0.4816407855100664, 'prior_mu': -0.030297390971468968, 'prior_sigma': 0.07448283694393718, 'normalization': 'none'}. Best is trial 272 with value: 0.5198344707489013.
Generating morgan fingerprints...
Generated fingerprints with 1024 features for 900 molecules
Data shape: X=(900, 1024), y=(900,)
Trial 1013: 5-fold CV loss = 0.6749
[I 2025-08-07 21:40:44,432] Trial 1013 finished with value: 0.6749230146408081 and parameters: {'fp_type': 'morgan', 'morgan_only_radius': 2, 'morgan_only_nBits': 2048, 'num_hidden_layers': 3, 'hidden_dim_0': 512, 'hidden_dim_1': 128, 'hidden_dim_2': 64, 'kl_weight': 0.0023156608025656023, 'lr': 0.0014053491703777, 'batch_size': 32, 'dropout_rate': 0.4745075799089339, 'prior_mu': -0.05543102533659827, 'prior_sigma': 0.08120207445706648, 'normalization': 'none'}. Best is trial 272 with value: 0.5198344707489013.
Generating morgan fingerprints...
Generated fingerprints with 1024 features for 900 molecules
Data shape: X=(900, 1024), y=(900,)
Trial 1017: 5-fold CV loss = 0.5554
[I 2025-08-07 21:41:35,506] Trial 1017 finished with value: 0.555376410484314 and parameters: {'fp_type': 'morgan', 'morgan_only_radius': 2, 'morgan_only_nBits': 1024, 'num_hidden_layers': 3, 'hidden_dim_0': 512, 'hidden_dim_1': 128, 'hidden_dim_2': 512, 'kl_weight': 0.00017376750981693565, 'lr': 0.001868508762344682, 'batch_size': 32, 'dropout_rate': 0.447209503360567, 'prior_mu': -0.05595789650680903, 'prior_sigma': 0.08114448811266166, 'normalization': 'none'}. Best is trial 272 with value: 0.5198344707489013.
Generating morgan fingerprints...
Generated fingerprints with 1024 features for 900 molecules
Data shape: X=(900, 1024), y=(900,)
Trial 1020: 5-fold CV loss = 0.5869
[I 2025-08-07 21:41:41,690] Trial 1020 finished with value: 0.5869161903858184 and parameters: {'fp_type': 'morgan', 'morgan_only_radius': 2, 'morgan_only_nBits': 1024, 'num_hidden_layers': 2, 'hidden_dim_0': 512, 'hidden_dim_1': 128, 'kl_weight': 0.004825492877147707, 'lr': 0.0038985010758291207, 'batch_size': 32, 'dropout_rate': 0.4858024478523259, 'prior_mu': -0.0288187273006022, 'prior_sigma': 0.08772288917203054, 'normalization': 'none'}. Best is trial 272 with value: 0.5198344707489013.
Generating morgan fingerprints...
Generated fingerprints with 1024 features for 900 molecules
Data shape: X=(900, 1024), y=(900,)
Trial 1019: 5-fold CV loss = 0.5385
[I 2025-08-07 21:41:44,274] Trial 1019 finished with value: 0.5384913742542267 and parameters: {'fp_type': 'morgan', 'morgan_only_radius': 2, 'morgan_only_nBits': 1024, 'num_hidden_layers': 3, 'hidden_dim_0': 512, 'hidden_dim_1': 128, 'hidden_dim_2': 512, 'kl_weight': 0.0018941922675223292, 'lr': 0.0019783506195567365, 'batch_size': 32, 'dropout_rate': 0.484485344340344, 'prior_mu': -0.029657150107642347, 'prior_sigma': 0.08914678468936307, 'normalization': 'none'}. Best is trial 272 with value: 0.5198344707489013.
Generating morgan fingerprints...
Generated fingerprints with 1024 features for 900 molecules
Data shape: X=(900, 1024), y=(900,)
Trial 1024: 5-fold CV loss = 0.5305
[I 2025-08-07 21:42:59,175] Trial 1024 finished with value: 0.5304646074771882 and parameters: {'fp_type': 'morgan', 'morgan_only_radius': 2, 'morgan_only_nBits': 1024, 'num_hidden_layers': 3, 'hidden_dim_0': 512, 'hidden_dim_1': 64, 'hidden_dim_2': 512, 'kl_weight': 0.0016821496762377231, 'lr': 0.002080924058082939, 'batch_size': 32, 'dropout_rate': 0.46355956053852454, 'prior_mu': -0.04509589094692186, 'prior_sigma': 0.07301351093959743, 'normalization': 'none'}. Best is trial 272 with value: 0.5198344707489013.
Generating morgan fingerprints...
Generated fingerprints with 1024 features for 900 molecules
Data shape: X=(900, 1024), y=(900,)
Trial 1025: 5-fold CV loss = 0.8168
[I 2025-08-07 21:43:06,409] Trial 1025 finished with value: 0.8167564272880554 and parameters: {'fp_type': 'morgan', 'morgan_only_radius': 2, 'morgan_only_nBits': 1024, 'num_hidden_layers': 3, 'hidden_dim_0': 512, 'hidden_dim_1': 128, 'hidden_dim_2': 256, 'kl_weight': 0.0018746080545155596, 'lr': 0.0010340672873802618, 'batch_size': 128, 'dropout_rate': 0.483690800019733, 'prior_mu': 0.05744928168776281, 'prior_sigma': 0.06974929742235247, 'normalization': 'none'}. Best is trial 272 with value: 0.5198344707489013.
Generating morgan fingerprints...
Generated fingerprints with 1024 features for 900 molecules
Data shape: X=(900, 1024), y=(900,)
Trial 1023: 5-fold CV loss = 0.5240
[I 2025-08-07 21:43:23,652] Trial 1023 finished with value: 0.5240199446678162 and parameters: {'fp_type': 'morgan', 'morgan_only_radius': 2, 'morgan_only_nBits': 1024, 'num_hidden_layers': 3, 'hidden_dim_0': 512, 'hidden_dim_1': 64, 'hidden_dim_2': 512, 'kl_weight': 0.0018333836054191996, 'lr': 0.002085865912827541, 'batch_size': 32, 'dropout_rate': 0.462060423122638, 'prior_mu': -0.04438527800713672, 'prior_sigma': 0.07130333512785526, 'normalization': 'none'}. Best is trial 272 with value: 0.5198344707489013.
Generating morgan fingerprints...
Generated fingerprints with 2048 features for 900 molecules
Data shape: X=(900, 2048), y=(900,)
Trial 1022: 5-fold CV loss = 0.5561
[I 2025-08-07 21:43:39,962] Trial 1022 finished with value: 0.5561319231987 and parameters: {'fp_type': 'morgan', 'morgan_only_radius': 2, 'morgan_only_nBits': 1024, 'num_hidden_layers': 3, 'hidden_dim_0': 512, 'hidden_dim_1': 64, 'hidden_dim_2': 512, 'kl_weight': 0.0005356484195285908, 'lr': 0.002048713342481743, 'batch_size': 32, 'dropout_rate': 0.48455714714796194, 'prior_mu': -0.04506866630199355, 'prior_sigma': 0.04305632671587303, 'normalization': 'none'}. Best is trial 272 with value: 0.5198344707489013.
Generating morgan fingerprints...
Generated fingerprints with 2048 features for 900 molecules
Data shape: X=(900, 2048), y=(900,)
Trial 1026: 5-fold CV loss = 0.5660
[I 2025-08-07 21:44:32,758] Trial 1026 finished with value: 0.5660495102405548 and parameters: {'fp_type': 'morgan', 'morgan_only_radius': 2, 'morgan_only_nBits': 1024, 'num_hidden_layers': 3, 'hidden_dim_0': 512, 'hidden_dim_1': 128, 'hidden_dim_2': 512, 'kl_weight': 0.00013909598613818673, 'lr': 0.0016871253897100434, 'batch_size': 32, 'dropout_rate': 0.49999791658954706, 'prior_mu': 0.03884380654599415, 'prior_sigma': 0.06865631559604339, 'normalization': 'none'}. Best is trial 272 with value: 0.5198344707489013.
Generating morgan fingerprints...
Generated fingerprints with 2048 features for 900 molecules
Data shape: X=(900, 2048), y=(900,)
Trial 1027: 5-fold CV loss = 0.5414
[I 2025-08-07 21:44:37,823] Trial 1027 finished with value: 0.5413937211036682 and parameters: {'fp_type': 'morgan', 'morgan_only_radius': 2, 'morgan_only_nBits': 2048, 'num_hidden_layers': 3, 'hidden_dim_0': 1024, 'hidden_dim_1': 64, 'hidden_dim_2': 512, 'kl_weight': 0.002124148494190676, 'lr': 0.0016989603440230915, 'batch_size': 32, 'dropout_rate': 0.4567336085735325, 'prior_mu': -0.04463048696558937, 'prior_sigma': 0.0740415256638795, 'normalization': 'none'}. Best is trial 272 with value: 0.5198344707489013.
Generating morgan fingerprints...
Generated fingerprints with 2048 features for 900 molecules
Data shape: X=(900, 2048), y=(900,)
Trial 1021: 5-fold CV loss = 0.5531
[I 2025-08-07 21:44:58,824] Trial 1021 finished with value: 0.5531381785869598 and parameters: {'fp_type': 'morgan', 'morgan_only_radius': 2, 'morgan_only_nBits': 1024, 'num_hidden_layers': 3, 'hidden_dim_0': 512, 'hidden_dim_1': 128, 'hidden_dim_2': 512, 'kl_weight': 0.0019113596634372238, 'lr': 0.0020420974916737613, 'batch_size': 32, 'dropout_rate': 0.4835360962103319, 'prior_mu': -0.029840207154562988, 'prior_sigma': 0.04291748950007772, 'normalization': 'none'}. Best is trial 272 with value: 0.5198344707489013.
Generating morgan fingerprints...
Generated fingerprints with 2048 features for 900 molecules
Data shape: X=(900, 2048), y=(900,)
Trial 1028: 5-fold CV loss = 0.5538
[I 2025-08-07 21:45:50,171] Trial 1028 finished with value: 0.5537599563598633 and parameters: {'fp_type': 'morgan', 'morgan_only_radius': 3, 'morgan_only_nBits': 2048, 'num_hidden_layers': 3, 'hidden_dim_0': 512, 'hidden_dim_1': 64, 'hidden_dim_2': 512, 'kl_weight': 0.0019613365910064835, 'lr': 0.0016740120098351664, 'batch_size': 32, 'dropout_rate': 0.42552954375508784, 'prior_mu': -0.0654982898347307, 'prior_sigma': 0.07347376105381952, 'normalization': 'none'}. Best is trial 272 with value: 0.5198344707489013.
Generating morgan fingerprints...
Generated fingerprints with 2048 features for 900 molecules
Data shape: X=(900, 2048), y=(900,)
Trial 1029: 5-fold CV loss = 0.5643
[I 2025-08-07 21:46:05,061] Trial 1029 finished with value: 0.5643236756324768 and parameters: {'fp_type': 'morgan', 'morgan_only_radius': 3, 'morgan_only_nBits': 2048, 'num_hidden_layers': 3, 'hidden_dim_0': 512, 'hidden_dim_1': 64, 'hidden_dim_2': 512, 'kl_weight': 0.00201124893932274, 'lr': 0.0016447280871388953, 'batch_size': 32, 'dropout_rate': 0.45427984064016164, 'prior_mu': -0.06401903422344099, 'prior_sigma': 0.07324527697748365, 'normalization': 'none'}. Best is trial 272 with value: 0.5198344707489013.
Generating morgan fingerprints...
Generated fingerprints with 1024 features for 900 molecules
Data shape: X=(900, 1024), y=(900,)
Trial 1030: 5-fold CV loss = 0.5307
[I 2025-08-07 21:46:06,857] Trial 1030 finished with value: 0.5307470500469208 and parameters: {'fp_type': 'morgan', 'morgan_only_radius': 3, 'morgan_only_nBits': 2048, 'num_hidden_layers': 3, 'hidden_dim_0': 512, 'hidden_dim_1': 64, 'hidden_dim_2': 512, 'kl_weight': 0.0019374244848380324, 'lr': 0.002000824467164659, 'batch_size': 32, 'dropout_rate': 0.4347634999268066, 'prior_mu': -0.03795267027857824, 'prior_sigma': 0.07705143753488546, 'normalization': 'none'}. Best is trial 272 with value: 0.5198344707489013.
Generating morgan fingerprints...
Generated fingerprints with 1024 features for 900 molecules
Data shape: X=(900, 1024), y=(900,)
Trial 1034: 5-fold CV loss = 0.8417
[I 2025-08-07 21:46:43,686] Trial 1034 finished with value: 0.8417224407196044 and parameters: {'fp_type': 'morgan', 'morgan_only_radius': 2, 'morgan_only_nBits': 1024, 'num_hidden_layers': 3, 'hidden_dim_0': 512, 'hidden_dim_1': 64, 'hidden_dim_2': 512, 'kl_weight': 0.0016469832226139068, 'lr': 0.0005011445738832164, 'batch_size': 32, 'dropout_rate': 0.44071632116523474, 'prior_mu': -0.0473063649759147, 'prior_sigma': 0.0672423684825376, 'normalization': 'none'}. Best is trial 272 with value: 0.5198344707489013.
Generating morgan fingerprints...
Generated fingerprints with 1024 features for 900 molecules
Data shape: X=(900, 1024), y=(900,)
Trial 1033: 5-fold CV loss = 1.0682
[I 2025-08-07 21:46:44,417] Trial 1033 finished with value: 1.068160605430603 and parameters: {'fp_type': 'morgan', 'morgan_only_radius': 2, 'morgan_only_nBits': 1024, 'num_hidden_layers': 3, 'hidden_dim_0': 512, 'hidden_dim_1': 64, 'hidden_dim_2': 512, 'kl_weight': 0.0015300104788784857, 'lr': 0.0005151782924795531, 'batch_size': 32, 'dropout_rate': 0.4618911616124378, 'prior_mu': -0.03862919221045663, 'prior_sigma': 0.07862056085458294, 'normalization': 'none'}. Best is trial 272 with value: 0.5198344707489013.
Generating morgan fingerprints...
Generated fingerprints with 1024 features for 900 molecules
Data shape: X=(900, 1024), y=(900,)
Trial 1031: 5-fold CV loss = 0.8311
[I 2025-08-07 21:47:08,269] Trial 1031 finished with value: 0.831083357334137 and parameters: {'fp_type': 'morgan', 'morgan_only_radius': 2, 'morgan_only_nBits': 2048, 'num_hidden_layers': 3, 'hidden_dim_0': 512, 'hidden_dim_1': 64, 'hidden_dim_2': 512, 'kl_weight': 0.002063306535982536, 'lr': 0.00014920205045796924, 'batch_size': 32, 'dropout_rate': 0.4238581434414665, 'prior_mu': -0.04825693435034629, 'prior_sigma': 0.06718514748467246, 'normalization': 'none'}. Best is trial 272 with value: 0.5198344707489013.
Generating morgan fingerprints...
Generated fingerprints with 1024 features for 900 molecules
Data shape: X=(900, 1024), y=(900,)
Trial 1036: 5-fold CV loss = 0.5865
[I 2025-08-07 21:47:45,822] Trial 1036 finished with value: 0.58648841381073 and parameters: {'fp_type': 'morgan', 'morgan_only_radius': 2, 'morgan_only_nBits': 1024, 'num_hidden_layers': 3, 'hidden_dim_0': 256, 'hidden_dim_1': 1024, 'hidden_dim_2': 512, 'kl_weight': 0.0017005496653605104, 'lr': 0.0019179164329023789, 'batch_size': 32, 'dropout_rate': 0.4682296476516828, 'prior_mu': -0.04646703287364652, 'prior_sigma': 0.06719081787339301, 'normalization': 'none'}. Best is trial 272 with value: 0.5198344707489013.
Generating morgan fingerprints...
Generated fingerprints with 1024 features for 900 molecules
Data shape: X=(900, 1024), y=(900,)
Trial 1038: 5-fold CV loss = 0.5576
[I 2025-08-07 21:48:17,370] Trial 1038 finished with value: 0.5576348006725311 and parameters: {'fp_type': 'morgan', 'morgan_only_radius': 2, 'morgan_only_nBits': 1024, 'num_hidden_layers': 2, 'hidden_dim_0': 512, 'hidden_dim_1': 64, 'kl_weight': 0.011600467024739197, 'lr': 0.0028075434483915054, 'batch_size': 32, 'dropout_rate': 0.49029607457949215, 'prior_mu': -0.0374499741058962, 'prior_sigma': 0.07108134620310583, 'normalization': 'layer'}. Best is trial 272 with value: 0.5198344707489013.
Generating morgan_rdkit fingerprints...
Generated fingerprints with 768 features for 900 molecules
Data shape: X=(900, 768), y=(900,)
Trial 1035: 5-fold CV loss = 0.5491
[I 2025-08-07 21:48:21,823] Trial 1035 finished with value: 0.5491431474685669 and parameters: {'fp_type': 'morgan', 'morgan_only_radius': 2, 'morgan_only_nBits': 1024, 'num_hidden_layers': 3, 'hidden_dim_0': 512, 'hidden_dim_1': 64, 'hidden_dim_2': 512, 'kl_weight': 0.0015977956925106159, 'lr': 0.0018592654345584907, 'batch_size': 32, 'dropout_rate': 0.4646296334764269, 'prior_mu': -0.04233164610242595, 'prior_sigma': 0.06916886229998143, 'normalization': 'none'}. Best is trial 272 with value: 0.5198344707489013.
Generating morgan_rdkit fingerprints...
Generated fingerprints with 768 features for 900 molecules
Data shape: X=(900, 768), y=(900,)
Trial 1032: 5-fold CV loss = 0.5283
