[I 2025-08-07 18:20:27,980] Trial 493 finished with value: 0.5323454320430756 and parameters: {'fp_type': 'morgan', 'morgan_only_radius': 2, 'morgan_only_nBits': 1024, 'num_hidden_layers': 3, 'hidden_dim_0': 512, 'hidden_dim_1': 128, 'hidden_dim_2': 512, 'kl_weight': 0.0037072731838701245, 'lr': 0.0026233793599992573, 'batch_size': 32, 'dropout_rate': 0.4681110505353405, 'prior_mu': -0.01608893425952804, 'prior_sigma': 0.06952224774988187, 'normalization': 'none'}. Best is trial 272 with value: 0.5198344707489013.
Generating morgan fingerprints...
Generated fingerprints with 1024 features for 900 molecules
Data shape: X=(900, 1024), y=(900,)
Trial 496: 5-fold CV loss = 0.6421
[I 2025-08-07 18:21:01,191] Trial 496 finished with value: 0.642092251777649 and parameters: {'fp_type': 'morgan', 'morgan_only_radius': 2, 'morgan_only_nBits': 1024, 'num_hidden_layers': 3, 'hidden_dim_0': 512, 'hidden_dim_1': 128, 'hidden_dim_2': 64, 'kl_weight': 0.0012428966298666593, 'lr': 0.0025853943483767775, 'batch_size': 32, 'dropout_rate': 0.05884866324743093, 'prior_mu': -0.011837438379505124, 'prior_sigma': 0.07059747242970524, 'normalization': 'none'}. Best is trial 272 with value: 0.5198344707489013.
Generating morgan fingerprints...
Generated fingerprints with 1024 features for 900 molecules
Data shape: X=(900, 1024), y=(900,)
Trial 497: 5-fold CV loss = 0.5272
[I 2025-08-07 18:21:42,993] Trial 497 finished with value: 0.5272382378578186 and parameters: {'fp_type': 'morgan', 'morgan_only_radius': 2, 'morgan_only_nBits': 1024, 'num_hidden_layers': 3, 'hidden_dim_0': 512, 'hidden_dim_1': 128, 'hidden_dim_2': 512, 'kl_weight': 0.004458352282266124, 'lr': 0.0018365162912191237, 'batch_size': 32, 'dropout_rate': 0.4670596980444558, 'prior_mu': 0.05418111723127875, 'prior_sigma': 0.06994970863852913, 'normalization': 'none'}. Best is trial 272 with value: 0.5198344707489013.
Generating morgan fingerprints...
Generated fingerprints with 1024 features for 900 molecules
Data shape: X=(900, 1024), y=(900,)
Trial 498: 5-fold CV loss = 0.7726
[I 2025-08-07 18:21:45,604] Trial 498 finished with value: 0.7726315021514892 and parameters: {'fp_type': 'morgan', 'morgan_only_radius': 2, 'morgan_only_nBits': 1024, 'num_hidden_layers': 3, 'hidden_dim_0': 512, 'hidden_dim_1': 1024, 'hidden_dim_2': 128, 'kl_weight': 0.004524829839491783, 'lr': 0.0018121853265312697, 'batch_size': 32, 'dropout_rate': 0.47103292289695353, 'prior_mu': -0.03822947223221953, 'prior_sigma': 0.06929261471888158, 'normalization': 'none'}. Best is trial 272 with value: 0.5198344707489013.
Generating morgan fingerprints...
Generated fingerprints with 2048 features for 900 molecules
Data shape: X=(900, 2048), y=(900,)
Trial 499: 5-fold CV loss = 0.7209
[I 2025-08-07 18:22:12,793] Trial 499 finished with value: 0.720866572856903 and parameters: {'fp_type': 'morgan', 'morgan_only_radius': 2, 'morgan_only_nBits': 1024, 'num_hidden_layers': 3, 'hidden_dim_0': 512, 'hidden_dim_1': 1024, 'hidden_dim_2': 128, 'kl_weight': 0.004481751420165532, 'lr': 0.001812969232826437, 'batch_size': 32, 'dropout_rate': 0.4683931742710084, 'prior_mu': -0.03636615559828947, 'prior_sigma': 0.060552715341282475, 'normalization': 'none'}. Best is trial 272 with value: 0.5198344707489013.
Generating morgan fingerprints...
Generated fingerprints with 2048 features for 900 molecules
Data shape: X=(900, 2048), y=(900,)
Trial 500: 5-fold CV loss = 0.6331
[I 2025-08-07 18:22:28,224] Trial 500 finished with value: 0.6330761551856995 and parameters: {'fp_type': 'morgan', 'morgan_only_radius': 2, 'morgan_only_nBits': 1024, 'num_hidden_layers': 3, 'hidden_dim_0': 512, 'hidden_dim_1': 1024, 'hidden_dim_2': 128, 'kl_weight': 0.00441338439956376, 'lr': 0.0017930827381415475, 'batch_size': 32, 'dropout_rate': 0.188078462528292, 'prior_mu': 0.015825723518051074, 'prior_sigma': 0.07252869318539043, 'normalization': 'none'}. Best is trial 272 with value: 0.5198344707489013.
Generating morgan fingerprints...
Generated fingerprints with 1024 features for 900 molecules
Data shape: X=(900, 1024), y=(900,)
Trial 494: 5-fold CV loss = 0.5638
[I 2025-08-07 18:23:34,061] Trial 494 finished with value: 0.563811469078064 and parameters: {'fp_type': 'morgan', 'morgan_only_radius': 2, 'morgan_only_nBits': 1024, 'num_hidden_layers': 3, 'hidden_dim_0': 512, 'hidden_dim_1': 128, 'hidden_dim_2': 64, 'kl_weight': 0.004867645195129522, 'lr': 0.0026199683136304856, 'batch_size': 32, 'dropout_rate': 0.4664305487638155, 'prior_mu': -0.012370701148301117, 'prior_sigma': 0.07028543445849378, 'normalization': 'none'}. Best is trial 272 with value: 0.5198344707489013.
Generating morgan fingerprints...
Generated fingerprints with 2048 features for 900 molecules
Data shape: X=(900, 2048), y=(900,)
Trial 501: 5-fold CV loss = 0.5220
[I 2025-08-07 18:23:49,530] Trial 501 finished with value: 0.5219999611377716 and parameters: {'fp_type': 'morgan', 'morgan_only_radius': 2, 'morgan_only_nBits': 2048, 'num_hidden_layers': 3, 'hidden_dim_0': 512, 'hidden_dim_1': 128, 'hidden_dim_2': 512, 'kl_weight': 0.004907774660197013, 'lr': 0.0014809728846621336, 'batch_size': 32, 'dropout_rate': 0.45757775992310734, 'prior_mu': 0.0473131523799421, 'prior_sigma': 0.07241644285089585, 'normalization': 'none'}. Best is trial 272 with value: 0.5198344707489013.
Generating morgan fingerprints...
Generated fingerprints with 2048 features for 900 molecules
Data shape: X=(900, 2048), y=(900,)
Trial 503: 5-fold CV loss = 0.5403
[I 2025-08-07 18:24:30,906] Trial 503 finished with value: 0.5403211891651154 and parameters: {'fp_type': 'morgan', 'morgan_only_radius': 2, 'morgan_only_nBits': 1024, 'num_hidden_layers': 3, 'hidden_dim_0': 512, 'hidden_dim_1': 128, 'hidden_dim_2': 512, 'kl_weight': 0.023457568897775716, 'lr': 0.0015503958872457888, 'batch_size': 32, 'dropout_rate': 0.4993194526169167, 'prior_mu': 0.007595958158398464, 'prior_sigma': 0.07963680326782416, 'normalization': 'none'}. Best is trial 272 with value: 0.5198344707489013.
Generating morgan fingerprints...
Generated fingerprints with 2048 features for 900 molecules
Data shape: X=(900, 2048), y=(900,)
Trial 502: 5-fold CV loss = 0.5655
[I 2025-08-07 18:24:38,947] Trial 502 finished with value: 0.5654971480369568 and parameters: {'fp_type': 'morgan', 'morgan_only_radius': 2, 'morgan_only_nBits': 2048, 'num_hidden_layers': 3, 'hidden_dim_0': 128, 'hidden_dim_1': 128, 'hidden_dim_2': 512, 'kl_weight': 0.005401769992985297, 'lr': 0.0020087139563758297, 'batch_size': 32, 'dropout_rate': 0.4995719666754159, 'prior_mu': 0.043586578105767396, 'prior_sigma': 0.07203388000552567, 'normalization': 'none'}. Best is trial 272 with value: 0.5198344707489013.
Generating morgan fingerprints...
Generated fingerprints with 2048 features for 900 molecules
Data shape: X=(900, 2048), y=(900,)
Trial 504: 5-fold CV loss = 1.6427
[I 2025-08-07 18:24:48,932] Trial 504 finished with value: 1.6426966428756713 and parameters: {'fp_type': 'morgan', 'morgan_only_radius': 2, 'morgan_only_nBits': 2048, 'num_hidden_layers': 3, 'hidden_dim_0': 512, 'hidden_dim_1': 512, 'hidden_dim_2': 512, 'kl_weight': 0.0009992951273701865, 'lr': 0.0014626339429723919, 'batch_size': 32, 'dropout_rate': 0.49971743508104133, 'prior_mu': 0.06086447976397531, 'prior_sigma': 0.07868828819945431, 'normalization': 'none'}. Best is trial 272 with value: 0.5198344707489013.
Generating morgan fingerprints...
Generated fingerprints with 2048 features for 900 molecules
Data shape: X=(900, 2048), y=(900,)
Trial 505: 5-fold CV loss = 0.5903
[I 2025-08-07 18:25:10,260] Trial 505 finished with value: 0.590289855003357 and parameters: {'fp_type': 'morgan', 'morgan_only_radius': 2, 'morgan_only_nBits': 2048, 'num_hidden_layers': 3, 'hidden_dim_0': 128, 'hidden_dim_1': 128, 'hidden_dim_2': 512, 'kl_weight': 0.005029442268580987, 'lr': 0.0014870000450942897, 'batch_size': 32, 'dropout_rate': 0.4472432762386366, 'prior_mu': 0.0374262863619378, 'prior_sigma': 0.08181126503248737, 'normalization': 'none'}. Best is trial 272 with value: 0.5198344707489013.
Generating morgan fingerprints...
Generated fingerprints with 2048 features for 900 molecules
Data shape: X=(900, 2048), y=(900,)
Trial 506: 5-fold CV loss = 0.9757
[I 2025-08-07 18:25:32,704] Trial 506 finished with value: 0.9756806075572968 and parameters: {'fp_type': 'morgan', 'morgan_only_radius': 2, 'morgan_only_nBits': 2048, 'num_hidden_layers': 3, 'hidden_dim_0': 512, 'hidden_dim_1': 512, 'hidden_dim_2': 512, 'kl_weight': 0.0051670341480693684, 'lr': 0.0014292328975545618, 'batch_size': 32, 'dropout_rate': 0.45117512293562984, 'prior_mu': 0.04431337036779796, 'prior_sigma': 0.07451338364620999, 'normalization': 'none'}. Best is trial 272 with value: 0.5198344707489013.
Generating morgan fingerprints...
Generated fingerprints with 2048 features for 900 molecules
Data shape: X=(900, 2048), y=(900,)
Trial 507: 5-fold CV loss = 0.8262
[I 2025-08-07 18:26:14,551] Trial 507 finished with value: 0.8261795103549957 and parameters: {'fp_type': 'morgan', 'morgan_only_radius': 2, 'morgan_only_nBits': 2048, 'num_hidden_layers': 3, 'hidden_dim_0': 512, 'hidden_dim_1': 512, 'hidden_dim_2': 512, 'kl_weight': 0.007271192466462192, 'lr': 0.0013037905167128285, 'batch_size': 32, 'dropout_rate': 0.45524454935718395, 'prior_mu': 0.050712793026996154, 'prior_sigma': 0.0661661800849738, 'normalization': 'none'}. Best is trial 272 with value: 0.5198344707489013.
Generating morgan fingerprints...
Generated fingerprints with 2048 features for 900 molecules
Data shape: X=(900, 2048), y=(900,)
Trial 510: 5-fold CV loss = 0.5752
[I 2025-08-07 18:26:31,280] Trial 510 finished with value: 0.5751583337783813 and parameters: {'fp_type': 'morgan', 'morgan_only_radius': 2, 'morgan_only_nBits': 2048, 'num_hidden_layers': 3, 'hidden_dim_0': 64, 'hidden_dim_1': 128, 'hidden_dim_2': 512, 'kl_weight': 0.005761520287310037, 'lr': 0.0015968222910784722, 'batch_size': 32, 'dropout_rate': 0.43923026326790937, 'prior_mu': 0.02487689669930164, 'prior_sigma': 0.06591873470506203, 'normalization': 'none'}. Best is trial 272 with value: 0.5198344707489013.
Generating morgan fingerprints...
Generated fingerprints with 2048 features for 900 molecules
Data shape: X=(900, 2048), y=(900,)
Trial 509: 5-fold CV loss = 0.5970
[I 2025-08-07 18:27:00,081] Trial 509 finished with value: 0.5970022976398468 and parameters: {'fp_type': 'morgan', 'morgan_only_radius': 2, 'morgan_only_nBits': 2048, 'num_hidden_layers': 3, 'hidden_dim_0': 512, 'hidden_dim_1': 128, 'hidden_dim_2': 512, 'kl_weight': 0.006041966145605129, 'lr': 0.0016372192836450685, 'batch_size': 32, 'dropout_rate': 0.45860956235106437, 'prior_mu': 0.07923464349623897, 'prior_sigma': 0.06559902841270032, 'normalization': 'none'}. Best is trial 272 with value: 0.5198344707489013.
Generating morgan fingerprints...
Generated fingerprints with 2048 features for 900 molecules
Data shape: X=(900, 2048), y=(900,)
Trial 512: 5-fold CV loss = 0.5661
[I 2025-08-07 18:28:02,065] Trial 512 finished with value: 0.566056877374649 and parameters: {'fp_type': 'morgan', 'morgan_only_radius': 2, 'morgan_only_nBits': 2048, 'num_hidden_layers': 3, 'hidden_dim_0': 512, 'hidden_dim_1': 128, 'hidden_dim_2': 512, 'kl_weight': 0.0015722329425850573, 'lr': 0.0017276529737456567, 'batch_size': 32, 'dropout_rate': 0.4591903056110378, 'prior_mu': 0.05402122635682056, 'prior_sigma': 0.05556074426678911, 'normalization': 'none'}. Best is trial 272 with value: 0.5198344707489013.
Generating morgan fingerprints...
Generated fingerprints with 1024 features for 900 molecules
Data shape: X=(900, 1024), y=(900,)
Trial 513: 5-fold CV loss = 0.5851
[I 2025-08-07 18:28:06,944] Trial 513 finished with value: 0.5851145088672638 and parameters: {'fp_type': 'morgan', 'morgan_only_radius': 2, 'morgan_only_nBits': 2048, 'num_hidden_layers': 3, 'hidden_dim_0': 512, 'hidden_dim_1': 128, 'hidden_dim_2': 512, 'kl_weight': 0.0016729381905932785, 'lr': 0.0017252227741345661, 'batch_size': 32, 'dropout_rate': 0.4600347556480904, 'prior_mu': 0.022789862072543236, 'prior_sigma': 0.05645892293713301, 'normalization': 'none'}. Best is trial 272 with value: 0.5198344707489013.
Generating morgan fingerprints...
Generated fingerprints with 1024 features for 900 molecules
Data shape: X=(900, 1024), y=(900,)
Trial 511: 5-fold CV loss = 0.5673
[I 2025-08-07 18:28:26,902] Trial 511 finished with value: 0.5673349738121033 and parameters: {'fp_type': 'morgan', 'morgan_only_radius': 2, 'morgan_only_nBits': 2048, 'num_hidden_layers': 3, 'hidden_dim_0': 64, 'hidden_dim_1': 128, 'hidden_dim_2': 512, 'kl_weight': 0.005851742079099332, 'lr': 0.001746732135752, 'batch_size': 32, 'dropout_rate': 0.46229348701279893, 'prior_mu': 0.021929704158333358, 'prior_sigma': 0.05589635878408415, 'normalization': 'none'}. Best is trial 272 with value: 0.5198344707489013.
Generating morgan fingerprints...
Generated fingerprints with 1024 features for 900 molecules
Data shape: X=(900, 1024), y=(900,)
Trial 508: 5-fold CV loss = 0.5849
[I 2025-08-07 18:29:07,005] Trial 508 finished with value: 0.5849176228046418 and parameters: {'fp_type': 'morgan', 'morgan_only_radius': 2, 'morgan_only_nBits': 2048, 'num_hidden_layers': 3, 'hidden_dim_0': 512, 'hidden_dim_1': 128, 'hidden_dim_2': 512, 'kl_weight': 0.006124182178995224, 'lr': 0.0015579457416509427, 'batch_size': 32, 'dropout_rate': 0.4566995956429373, 'prior_mu': 0.022673053350528504, 'prior_sigma': 0.06621049648876545, 'normalization': 'none'}. Best is trial 272 with value: 0.5198344707489013.
Generating rdkit fingerprints...
Generated fingerprints with 512 features for 900 molecules
Data shape: X=(900, 512), y=(900,)
Trial 514: 5-fold CV loss = 0.5297
[I 2025-08-07 18:29:24,176] Trial 514 finished with value: 0.5297254621982574 and parameters: {'fp_type': 'morgan', 'morgan_only_radius': 2, 'morgan_only_nBits': 1024, 'num_hidden_layers': 3, 'hidden_dim_0': 512, 'hidden_dim_1': 128, 'hidden_dim_2': 512, 'kl_weight': 0.004215700926881926, 'lr': 0.0019907536272567453, 'batch_size': 32, 'dropout_rate': 0.47699826943618867, 'prior_mu': 0.06282254981769261, 'prior_sigma': 0.061248635027531945, 'normalization': 'none'}. Best is trial 272 with value: 0.5198344707489013.
Generating rdkit fingerprints...
Generated fingerprints with 512 features for 900 molecules
Data shape: X=(900, 512), y=(900,)
Trial 515: 5-fold CV loss = 0.5688
[I 2025-08-07 18:29:35,543] Trial 515 finished with value: 0.5687602818012237 and parameters: {'fp_type': 'morgan', 'morgan_only_radius': 2, 'morgan_only_nBits': 1024, 'num_hidden_layers': 3, 'hidden_dim_0': 512, 'hidden_dim_1': 128, 'hidden_dim_2': 512, 'kl_weight': 0.003993130981994064, 'lr': 0.0019224871368863456, 'batch_size': 32, 'dropout_rate': 0.47902763651554164, 'prior_mu': 0.053977608449899656, 'prior_sigma': 0.06151482259967389, 'normalization': 'none'}. Best is trial 272 with value: 0.5198344707489013.
Generating rdkit fingerprints...
Generated fingerprints with 512 features for 900 molecules
Data shape: X=(900, 512), y=(900,)
Trial 518: 5-fold CV loss = 0.6516
[I 2025-08-07 18:29:58,390] Trial 518 finished with value: 0.651578676700592 and parameters: {'fp_type': 'rdkit', 'rdkit_only_maxPath': 7, 'rdkit_only_nBits': 512, 'num_hidden_layers': 3, 'hidden_dim_0': 512, 'hidden_dim_1': 128, 'hidden_dim_2': 512, 'kl_weight': 0.0039588845910190655, 'lr': 0.002149885347301106, 'batch_size': 32, 'dropout_rate': 0.4810112485277592, 'prior_mu': 0.0530521072588722, 'prior_sigma': 0.07289294566529839, 'normalization': 'none'}. Best is trial 272 with value: 0.5198344707489013.
Generating morgan fingerprints...
Generated fingerprints with 1024 features for 900 molecules
Data shape: X=(900, 1024), y=(900,)
Trial 519: 5-fold CV loss = 0.6560
[I 2025-08-07 18:30:32,575] Trial 519 finished with value: 0.6559729695320129 and parameters: {'fp_type': 'rdkit', 'rdkit_only_maxPath': 7, 'rdkit_only_nBits': 512, 'num_hidden_layers': 3, 'hidden_dim_0': 512, 'hidden_dim_1': 128, 'hidden_dim_2': 512, 'kl_weight': 0.009525063154303114, 'lr': 0.002152725476094199, 'batch_size': 32, 'dropout_rate': 0.4837714955382815, 'prior_mu': 7.178686822458154e-05, 'prior_sigma': 0.11667382938242268, 'normalization': 'none'}. Best is trial 272 with value: 0.5198344707489013.
Generating morgan fingerprints...
Generated fingerprints with 1024 features for 900 molecules
Data shape: X=(900, 1024), y=(900,)
Trial 521: 5-fold CV loss = 0.7305
[I 2025-08-07 18:30:55,442] Trial 521 finished with value: 0.7305312275886535 and parameters: {'fp_type': 'morgan', 'morgan_only_radius': 2, 'morgan_only_nBits': 1024, 'num_hidden_layers': 1, 'hidden_dim_0': 512, 'kl_weight': 0.002608680541620712, 'lr': 0.002401238620750978, 'batch_size': 32, 'dropout_rate': 0.48871519875772973, 'prior_mu': 0.037597858528075304, 'prior_sigma': 0.07032240197310674, 'normalization': 'none'}. Best is trial 272 with value: 0.5198344707489013.
Generating morgan fingerprints...
Generated fingerprints with 1024 features for 900 molecules
Data shape: X=(900, 1024), y=(900,)
Trial 516: 5-fold CV loss = 0.5394
[I 2025-08-07 18:31:07,175] Trial 516 finished with value: 0.5394241452217102 and parameters: {'fp_type': 'morgan', 'morgan_only_radius': 2, 'morgan_only_nBits': 1024, 'num_hidden_layers': 3, 'hidden_dim_0': 512, 'hidden_dim_1': 128, 'hidden_dim_2': 512, 'kl_weight': 0.004091967135954645, 'lr': 0.0019368000614576586, 'batch_size': 32, 'dropout_rate': 0.47797515130995233, 'prior_mu': 0.06574366078601648, 'prior_sigma': 0.061783660932935615, 'normalization': 'none'}. Best is trial 272 with value: 0.5198344707489013.
Generating morgan fingerprints...
Generated fingerprints with 1024 features for 900 molecules
Data shape: X=(900, 1024), y=(900,)
Trial 520: 5-fold CV loss = 0.5325
[I 2025-08-07 18:31:10,360] Trial 520 finished with value: 0.5325309336185455 and parameters: {'fp_type': 'morgan', 'morgan_only_radius': 2, 'morgan_only_nBits': 1024, 'num_hidden_layers': 3, 'hidden_dim_0': 512, 'hidden_dim_1': 128, 'hidden_dim_2': 512, 'kl_weight': 0.001272007249817735, 'lr': 0.0023820373748777448, 'batch_size': 32, 'dropout_rate': 0.48686839684898225, 'prior_mu': -0.04874458017189164, 'prior_sigma': 0.06871495453863666, 'normalization': 'none'}. Best is trial 272 with value: 0.5198344707489013.
Generating morgan fingerprints...
Generated fingerprints with 1024 features for 900 molecules
Data shape: X=(900, 1024), y=(900,)
Trial 517: 5-fold CV loss = 0.6455
[I 2025-08-07 18:31:16,034] Trial 517 finished with value: 0.6455381393432618 and parameters: {'fp_type': 'rdkit', 'rdkit_only_maxPath': 7, 'rdkit_only_nBits': 512, 'num_hidden_layers': 3, 'hidden_dim_0': 512, 'hidden_dim_1': 128, 'hidden_dim_2': 512, 'kl_weight': 0.003989468625311388, 'lr': 0.0019106279568167667, 'batch_size': 32, 'dropout_rate': 0.47827376294394564, 'prior_mu': -0.049420561219160226, 'prior_sigma': 0.06122857499108225, 'normalization': 'none'}. Best is trial 272 with value: 0.5198344707489013.
Generating morgan fingerprints...
Generated fingerprints with 1024 features for 900 molecules
Data shape: X=(900, 1024), y=(900,)
Trial 522: 5-fold CV loss = 0.5292
[I 2025-08-07 18:32:03,610] Trial 522 finished with value: 0.5292193174362183 and parameters: {'fp_type': 'morgan', 'morgan_only_radius': 2, 'morgan_only_nBits': 1024, 'num_hidden_layers': 3, 'hidden_dim_0': 1024, 'hidden_dim_1': 128, 'hidden_dim_2': 512, 'kl_weight': 0.001174020326363576, 'lr': 0.0023330839492430974, 'batch_size': 32, 'dropout_rate': 0.4361262378933573, 'prior_mu': -0.050452909293951104, 'prior_sigma': 0.059317681702858435, 'normalization': 'none'}. Best is trial 272 with value: 0.5198344707489013.
Generating morgan fingerprints...
Generated fingerprints with 1024 features for 900 molecules
Data shape: X=(900, 1024), y=(900,)
Trial 524: 5-fold CV loss = 0.7111
[I 2025-08-07 18:32:12,347] Trial 524 finished with value: 0.7111155152320862 and parameters: {'fp_type': 'morgan', 'morgan_only_radius': 2, 'morgan_only_nBits': 1024, 'num_hidden_layers': 3, 'hidden_dim_0': 1024, 'hidden_dim_1': 128, 'hidden_dim_2': 512, 'kl_weight': 0.0030738719415128206, 'lr': 0.0012297208331697347, 'batch_size': 32, 'dropout_rate': 0.43798267943616553, 'prior_mu': -0.0486107160769707, 'prior_sigma': 0.05867285910942687, 'normalization': 'none'}. Best is trial 272 with value: 0.5198344707489013.
Generating morgan fingerprints...
Generated fingerprints with 1024 features for 900 molecules
Data shape: X=(900, 1024), y=(900,)
Trial 523: 5-fold CV loss = 0.5364
[I 2025-08-07 18:32:53,940] Trial 523 finished with value: 0.5364389717578888 and parameters: {'fp_type': 'morgan', 'morgan_only_radius': 2, 'morgan_only_nBits': 1024, 'num_hidden_layers': 3, 'hidden_dim_0': 1024, 'hidden_dim_1': 128, 'hidden_dim_2': 512, 'kl_weight': 0.0030204303325755476, 'lr': 0.0022994745312843864, 'batch_size': 32, 'dropout_rate': 0.43878530736990246, 'prior_mu': -0.04536441627520035, 'prior_sigma': 0.06803631974991059, 'normalization': 'none'}. Best is trial 272 with value: 0.5198344707489013.
Generating morgan fingerprints...
Generated fingerprints with 1024 features for 900 molecules
Data shape: X=(900, 1024), y=(900,)
Trial 527: 5-fold CV loss = 0.5466
[I 2025-08-07 18:33:07,801] Trial 527 finished with value: 0.5466042041778565 and parameters: {'fp_type': 'morgan', 'morgan_only_radius': 2, 'morgan_only_nBits': 1024, 'num_hidden_layers': 3, 'hidden_dim_0': 512, 'hidden_dim_1': 128, 'hidden_dim_2': 512, 'kl_weight': 0.004587520138655081, 'lr': 0.002128014580338728, 'batch_size': 32, 'dropout_rate': 0.472438934404205, 'prior_mu': 0.009368801919024308, 'prior_sigma': 0.0641891674036949, 'normalization': 'layer'}. Best is trial 272 with value: 0.5198344707489013.
Generating morgan fingerprints...
Generated fingerprints with 1024 features for 900 molecules
Data shape: X=(900, 1024), y=(900,)
Trial 526: 5-fold CV loss = 0.5696
