[I 2025-08-08 03:41:28,465] Trial 2014 finished with value: 0.5262902975082397 and parameters: {'fp_type': 'morgan', 'morgan_only_radius': 2, 'morgan_only_nBits': 2048, 'num_hidden_layers': 3, 'hidden_dim_0': 512, 'hidden_dim_1': 64, 'hidden_dim_2': 256, 'kl_weight': 0.00041532446274177915, 'lr': 0.003030938131644799, 'batch_size': 32, 'dropout_rate': 0.43195291719071516, 'prior_mu': 0.06768209589412975, 'prior_sigma': 0.0811437812447137, 'normalization': 'none'}. Best is trial 1528 with value: 0.5170644640922546.
Generating morgan fingerprints...
Generated fingerprints with 2048 features for 900 molecules
Data shape: X=(900, 2048), y=(900,)
Trial 2007: 5-fold CV loss = 0.5307
[I 2025-08-08 03:41:31,598] Trial 2007 finished with value: 0.5307046353816987 and parameters: {'fp_type': 'morgan', 'morgan_only_radius': 2, 'morgan_only_nBits': 2048, 'num_hidden_layers': 3, 'hidden_dim_0': 512, 'hidden_dim_1': 64, 'hidden_dim_2': 256, 'kl_weight': 0.0005176787375268766, 'lr': 0.0023790433429652573, 'batch_size': 32, 'dropout_rate': 0.4294815288394677, 'prior_mu': 0.06836710458555247, 'prior_sigma': 0.07324520972840266, 'normalization': 'none'}. Best is trial 1528 with value: 0.5170644640922546.
Generating morgan fingerprints...
Generated fingerprints with 2048 features for 900 molecules
Data shape: X=(900, 2048), y=(900,)
Trial 2015: 5-fold CV loss = 0.5308
[I 2025-08-08 03:41:57,957] Trial 2015 finished with value: 0.5307698786258698 and parameters: {'fp_type': 'morgan', 'morgan_only_radius': 2, 'morgan_only_nBits': 2048, 'num_hidden_layers': 3, 'hidden_dim_0': 512, 'hidden_dim_1': 64, 'hidden_dim_2': 256, 'kl_weight': 0.00046264608238946286, 'lr': 0.00263314468253179, 'batch_size': 32, 'dropout_rate': 0.4379910000999688, 'prior_mu': 0.06549962159888062, 'prior_sigma': 0.08800287524522994, 'normalization': 'none'}. Best is trial 1528 with value: 0.5170644640922546.
Generating morgan fingerprints...
Generated fingerprints with 2048 features for 900 molecules
Data shape: X=(900, 2048), y=(900,)
Trial 2017: 5-fold CV loss = 0.5337
[I 2025-08-08 03:42:38,990] Trial 2017 finished with value: 0.5337062358856202 and parameters: {'fp_type': 'morgan', 'morgan_only_radius': 2, 'morgan_only_nBits': 2048, 'num_hidden_layers': 3, 'hidden_dim_0': 512, 'hidden_dim_1': 64, 'hidden_dim_2': 64, 'kl_weight': 0.0004993402675257377, 'lr': 0.003512991251782196, 'batch_size': 32, 'dropout_rate': 0.4382116344708892, 'prior_mu': 0.05471810238966608, 'prior_sigma': 0.07586787841984141, 'normalization': 'none'}. Best is trial 1528 with value: 0.5170644640922546.
Generating morgan fingerprints...
Generated fingerprints with 2048 features for 900 molecules
Data shape: X=(900, 2048), y=(900,)
Trial 2019: 5-fold CV loss = 0.5335
[I 2025-08-08 03:43:02,794] Trial 2019 finished with value: 0.5335458874702453 and parameters: {'fp_type': 'morgan', 'morgan_only_radius': 2, 'morgan_only_nBits': 2048, 'num_hidden_layers': 3, 'hidden_dim_0': 512, 'hidden_dim_1': 64, 'hidden_dim_2': 256, 'kl_weight': 0.000491806053354968, 'lr': 0.0033819484243995386, 'batch_size': 32, 'dropout_rate': 0.44052771100095633, 'prior_mu': 0.05442428931806037, 'prior_sigma': 0.08767107856965839, 'normalization': 'none'}. Best is trial 1528 with value: 0.5170644640922546.
Generating morgan fingerprints...
Generated fingerprints with 2048 features for 900 molecules
Data shape: X=(900, 2048), y=(900,)
Trial 2020: 5-fold CV loss = 0.6907
[I 2025-08-08 03:43:03,660] Trial 2020 finished with value: 0.6907393097877502 and parameters: {'fp_type': 'morgan', 'morgan_only_radius': 2, 'morgan_only_nBits': 2048, 'num_hidden_layers': 3, 'hidden_dim_0': 512, 'hidden_dim_1': 64, 'hidden_dim_2': 256, 'kl_weight': 0.0003746659460692568, 'lr': 0.002836690175987741, 'batch_size': 64, 'dropout_rate': 0.42064095589592226, 'prior_mu': 0.05318502984098561, 'prior_sigma': 0.07895157315390532, 'normalization': 'none'}. Best is trial 1528 with value: 0.5170644640922546.
Generating morgan fingerprints...
Generated fingerprints with 2048 features for 900 molecules
Data shape: X=(900, 2048), y=(900,)
Trial 2016: 5-fold CV loss = 0.5354
[I 2025-08-08 03:43:25,456] Trial 2016 finished with value: 0.5354246616363525 and parameters: {'fp_type': 'morgan', 'morgan_only_radius': 2, 'morgan_only_nBits': 2048, 'num_hidden_layers': 3, 'hidden_dim_0': 512, 'hidden_dim_1': 256, 'hidden_dim_2': 256, 'kl_weight': 0.0004698909011173131, 'lr': 0.0033003647066346957, 'batch_size': 32, 'dropout_rate': 0.43838041564947394, 'prior_mu': 0.05272328927301009, 'prior_sigma': 0.08592131763919393, 'normalization': 'none'}. Best is trial 1528 with value: 0.5170644640922546.
Generating morgan fingerprints...
Generated fingerprints with 2048 features for 900 molecules
Data shape: X=(900, 2048), y=(900,)
Trial 2022: 5-fold CV loss = 0.5275
[I 2025-08-08 03:44:05,481] Trial 2022 finished with value: 0.5274995505809784 and parameters: {'fp_type': 'morgan', 'morgan_only_radius': 2, 'morgan_only_nBits': 2048, 'num_hidden_layers': 3, 'hidden_dim_0': 512, 'hidden_dim_1': 64, 'hidden_dim_2': 256, 'kl_weight': 0.0005473776381171602, 'lr': 0.002738898304009735, 'batch_size': 32, 'dropout_rate': 0.4191504658869431, 'prior_mu': 0.04735344916976959, 'prior_sigma': 0.08501288461475585, 'normalization': 'none'}. Best is trial 1528 with value: 0.5170644640922546.
Generating morgan fingerprints...
Generated fingerprints with 2048 features for 900 molecules
Data shape: X=(900, 2048), y=(900,)
Trial 2021: 5-fold CV loss = 0.5197
[I 2025-08-08 03:44:22,509] Trial 2021 finished with value: 0.5197199881076813 and parameters: {'fp_type': 'morgan', 'morgan_only_radius': 2, 'morgan_only_nBits': 2048, 'num_hidden_layers': 3, 'hidden_dim_0': 512, 'hidden_dim_1': 64, 'hidden_dim_2': 256, 'kl_weight': 0.0005561781339464835, 'lr': 0.002609833945967185, 'batch_size': 32, 'dropout_rate': 0.4226024372794745, 'prior_mu': 0.04901940732950171, 'prior_sigma': 0.08080796291509876, 'normalization': 'none'}. Best is trial 1528 with value: 0.5170644640922546.
Generating morgan fingerprints...
Generated fingerprints with 2048 features for 900 molecules
Data shape: X=(900, 2048), y=(900,)
Trial 2025: 5-fold CV loss = 0.6834
[I 2025-08-08 03:44:39,941] Trial 2025 finished with value: 0.6834189295768738 and parameters: {'fp_type': 'morgan', 'morgan_only_radius': 2, 'morgan_only_nBits': 2048, 'num_hidden_layers': 0, 'kl_weight': 0.0005957871335803175, 'lr': 0.0040974320895846815, 'batch_size': 32, 'dropout_rate': 0.4080589493228686, 'prior_mu': 0.05957101959356843, 'prior_sigma': 0.08172026090657576, 'normalization': 'layer'}. Best is trial 1528 with value: 0.5170644640922546.
Generating morgan fingerprints...
Generated fingerprints with 2048 features for 900 molecules
Data shape: X=(900, 2048), y=(900,)
Trial 2018: 5-fold CV loss = 0.5316
[I 2025-08-08 03:44:48,549] Trial 2018 finished with value: 0.5316034734249115 and parameters: {'fp_type': 'morgan', 'morgan_only_radius': 2, 'morgan_only_nBits': 2048, 'num_hidden_layers': 3, 'hidden_dim_0': 512, 'hidden_dim_1': 64, 'hidden_dim_2': 256, 'kl_weight': 0.0005009974510458182, 'lr': 0.002718999201273203, 'batch_size': 32, 'dropout_rate': 0.418358015887887, 'prior_mu': 0.05111932416348708, 'prior_sigma': 0.08573123133495106, 'normalization': 'none'}. Best is trial 1528 with value: 0.5170644640922546.
Generating morgan fingerprints...
Generated fingerprints with 2048 features for 900 molecules
Data shape: X=(900, 2048), y=(900,)
Trial 2024: 5-fold CV loss = 0.5383
[I 2025-08-08 03:44:53,546] Trial 2024 finished with value: 0.5382962942123413 and parameters: {'fp_type': 'morgan', 'morgan_only_radius': 2, 'morgan_only_nBits': 2048, 'num_hidden_layers': 3, 'hidden_dim_0': 512, 'hidden_dim_1': 1024, 'hidden_dim_2': 256, 'kl_weight': 0.0005326615998060603, 'lr': 0.0027083067935446533, 'batch_size': 32, 'dropout_rate': 0.4303883619251904, 'prior_mu': 0.04532153533621474, 'prior_sigma': 0.07492434807142816, 'normalization': 'layer'}. Best is trial 1528 with value: 0.5170644640922546.
Generating morgan fingerprints...
Generated fingerprints with 2048 features for 900 molecules
Data shape: X=(900, 2048), y=(900,)
Trial 2023: 5-fold CV loss = 0.5528
[I 2025-08-08 03:45:15,579] Trial 2023 finished with value: 0.5528054535388947 and parameters: {'fp_type': 'morgan', 'morgan_only_radius': 2, 'morgan_only_nBits': 2048, 'num_hidden_layers': 3, 'hidden_dim_0': 512, 'hidden_dim_1': 64, 'hidden_dim_2': 256, 'kl_weight': 0.0005635706918149266, 'lr': 0.0026614845522573973, 'batch_size': 32, 'dropout_rate': 0.4172778213582198, 'prior_mu': 0.048175329956197735, 'prior_sigma': 0.07583674328452267, 'normalization': 'none'}. Best is trial 1528 with value: 0.5170644640922546.
Generating morgan_rdkit fingerprints...
Generated fingerprints with 768 features for 900 molecules
Data shape: X=(900, 768), y=(900,)
Trial 2028: 5-fold CV loss = 0.5496
[I 2025-08-08 03:45:41,726] Trial 2028 finished with value: 0.5495527267456055 and parameters: {'fp_type': 'morgan', 'morgan_only_radius': 2, 'morgan_only_nBits': 2048, 'num_hidden_layers': 3, 'hidden_dim_0': 1024, 'hidden_dim_1': 64, 'hidden_dim_2': 256, 'kl_weight': 0.0006049649463653297, 'lr': 0.003255401219167938, 'batch_size': 32, 'dropout_rate': 0.4025863090259369, 'prior_mu': -0.0790739483501948, 'prior_sigma': 0.07986668863274538, 'normalization': 'none'}. Best is trial 1528 with value: 0.5170644640922546.
Generating morgan_rdkit fingerprints...
Generated fingerprints with 768 features for 900 molecules
Data shape: X=(900, 768), y=(900,)
Trial 2026: 5-fold CV loss = 0.5554
[I 2025-08-08 03:45:43,693] Trial 2026 finished with value: 0.5553588390350341 and parameters: {'fp_type': 'morgan', 'morgan_only_radius': 2, 'morgan_only_nBits': 2048, 'num_hidden_layers': 3, 'hidden_dim_0': 1024, 'hidden_dim_1': 64, 'hidden_dim_2': 256, 'kl_weight': 0.0005884826230292617, 'lr': 0.0032660023396261506, 'batch_size': 32, 'dropout_rate': 0.41225993943940875, 'prior_mu': -0.10312166709396992, 'prior_sigma': 0.07573230010992553, 'normalization': 'none'}. Best is trial 1528 with value: 0.5170644640922546.
Generating morgan_rdkit fingerprints...
Generated fingerprints with 768 features for 900 molecules
Data shape: X=(900, 768), y=(900,)
Trial 2030: 5-fold CV loss = 0.5742
[I 2025-08-08 03:46:39,760] Trial 2030 finished with value: 0.5742027997970581 and parameters: {'fp_type': 'morgan_rdkit', 'combined_morgan_radius': 3, 'combined_morgan_nBits': 512, 'combined_rdkit_maxPath': 8, 'combined_rdkit_nBits': 256, 'num_hidden_layers': 3, 'hidden_dim_0': 128, 'hidden_dim_1': 64, 'hidden_dim_2': 256, 'kl_weight': 0.0005829948141573634, 'lr': 0.002972797458000555, 'batch_size': 32, 'dropout_rate': 0.40914387120709006, 'prior_mu': 0.051923784982427064, 'prior_sigma': 0.07885747098608785, 'normalization': 'none'}. Best is trial 1528 with value: 0.5170644640922546.
Generating morgan fingerprints...
Generated fingerprints with 2048 features for 900 molecules
Data shape: X=(900, 2048), y=(900,)
Trial 2031: 5-fold CV loss = 0.5975
[I 2025-08-08 03:46:56,780] Trial 2031 finished with value: 0.5975146770477295 and parameters: {'fp_type': 'morgan_rdkit', 'combined_morgan_radius': 3, 'combined_morgan_nBits': 512, 'combined_rdkit_maxPath': 8, 'combined_rdkit_nBits': 256, 'num_hidden_layers': 3, 'hidden_dim_0': 512, 'hidden_dim_1': 64, 'hidden_dim_2': 256, 'kl_weight': 0.0003539410424616095, 'lr': 0.0028965025280848445, 'batch_size': 32, 'dropout_rate': 0.4027297090930767, 'prior_mu': 0.060981400638708036, 'prior_sigma': 0.08145359885873481, 'normalization': 'none'}. Best is trial 1528 with value: 0.5170644640922546.
Generating morgan fingerprints...
Generated fingerprints with 2048 features for 900 molecules
Data shape: X=(900, 2048), y=(900,)
Trial 2029: 5-fold CV loss = 0.5784
[I 2025-08-08 03:47:06,245] Trial 2029 finished with value: 0.5784272909164428 and parameters: {'fp_type': 'morgan_rdkit', 'combined_morgan_radius': 3, 'combined_morgan_nBits': 512, 'combined_rdkit_maxPath': 8, 'combined_rdkit_nBits': 256, 'num_hidden_layers': 3, 'hidden_dim_0': 128, 'hidden_dim_1': 64, 'hidden_dim_2': 256, 'kl_weight': 0.0006102054075654094, 'lr': 0.003305602691346056, 'batch_size': 32, 'dropout_rate': 0.399693211505272, 'prior_mu': 0.0616546736119109, 'prior_sigma': 0.07786842270689175, 'normalization': 'none'}. Best is trial 1528 with value: 0.5170644640922546.
Generating morgan fingerprints...
Generated fingerprints with 2048 features for 900 molecules
Data shape: X=(900, 2048), y=(900,)
Trial 2032: 5-fold CV loss = 0.5273
[I 2025-08-08 03:47:43,214] Trial 2032 finished with value: 0.5272856652736664 and parameters: {'fp_type': 'morgan', 'morgan_only_radius': 2, 'morgan_only_nBits': 2048, 'num_hidden_layers': 3, 'hidden_dim_0': 512, 'hidden_dim_1': 64, 'hidden_dim_2': 256, 'kl_weight': 0.0004931069512394117, 'lr': 0.002797919757087226, 'batch_size': 32, 'dropout_rate': 0.3100866756511176, 'prior_mu': 0.061869334516239126, 'prior_sigma': 0.0839520057635414, 'normalization': 'none'}. Best is trial 1528 with value: 0.5170644640922546.
Generating morgan fingerprints...
Generated fingerprints with 2048 features for 900 molecules
Data shape: X=(900, 2048), y=(900,)
Trial 2033: 5-fold CV loss = 0.5361
[I 2025-08-08 03:48:17,858] Trial 2033 finished with value: 0.5361025154590606 and parameters: {'fp_type': 'morgan', 'morgan_only_radius': 2, 'morgan_only_nBits': 2048, 'num_hidden_layers': 3, 'hidden_dim_0': 512, 'hidden_dim_1': 64, 'hidden_dim_2': 256, 'kl_weight': 0.0004429556183047784, 'lr': 0.0025233573045731314, 'batch_size': 32, 'dropout_rate': 0.4258648219351143, 'prior_mu': 0.06292608774520074, 'prior_sigma': 0.09420795651716864, 'normalization': 'none'}. Best is trial 1528 with value: 0.5170644640922546.
Generating morgan fingerprints...
Generated fingerprints with 2048 features for 900 molecules
Data shape: X=(900, 2048), y=(900,)
Trial 2027: 5-fold CV loss = 0.5222
[I 2025-08-08 03:48:18,985] Trial 2027 finished with value: 0.5222078859806061 and parameters: {'fp_type': 'morgan', 'morgan_only_radius': 2, 'morgan_only_nBits': 2048, 'num_hidden_layers': 3, 'hidden_dim_0': 512, 'hidden_dim_1': 64, 'hidden_dim_2': 256, 'kl_weight': 0.0005882642077150881, 'lr': 0.002846938412829469, 'batch_size': 32, 'dropout_rate': 0.4061344389589244, 'prior_mu': 0.060386601059005264, 'prior_sigma': 0.0750563755561598, 'normalization': 'none'}. Best is trial 1528 with value: 0.5170644640922546.
Generating morgan fingerprints...
Generated fingerprints with 2048 features for 900 molecules
Data shape: X=(900, 2048), y=(900,)
Trial 2035: 5-fold CV loss = 0.5231
[I 2025-08-08 03:48:56,734] Trial 2035 finished with value: 0.5230931103229522 and parameters: {'fp_type': 'morgan', 'morgan_only_radius': 2, 'morgan_only_nBits': 2048, 'num_hidden_layers': 3, 'hidden_dim_0': 512, 'hidden_dim_1': 64, 'hidden_dim_2': 256, 'kl_weight': 0.00042481403837143117, 'lr': 0.0024548093226966767, 'batch_size': 32, 'dropout_rate': 0.42508327241119387, 'prior_mu': 0.05499548701427743, 'prior_sigma': 0.07697931444196209, 'normalization': 'none'}. Best is trial 1528 with value: 0.5170644640922546.
Generating morgan fingerprints...
Generated fingerprints with 2048 features for 900 molecules
Data shape: X=(900, 2048), y=(900,)
Trial 2038: 5-fold CV loss = 0.7212
[I 2025-08-08 03:49:09,845] Trial 2038 finished with value: 0.721196711063385 and parameters: {'fp_type': 'morgan', 'morgan_only_radius': 2, 'morgan_only_nBits': 2048, 'num_hidden_layers': 3, 'hidden_dim_0': 512, 'hidden_dim_1': 64, 'hidden_dim_2': 256, 'kl_weight': 0.0005218766456207919, 'lr': 0.002609312771103808, 'batch_size': 128, 'dropout_rate': 0.41648078493940704, 'prior_mu': 0.04603691562964633, 'prior_sigma': 0.0739585595570923, 'normalization': 'none'}. Best is trial 1528 with value: 0.5170644640922546.
Generating morgan fingerprints...
Generated fingerprints with 2048 features for 900 molecules
Data shape: X=(900, 2048), y=(900,)
Trial 2034: 5-fold CV loss = 0.5539
[I 2025-08-08 03:49:25,200] Trial 2034 finished with value: 0.5538514792919159 and parameters: {'fp_type': 'morgan', 'morgan_only_radius': 2, 'morgan_only_nBits': 2048, 'num_hidden_layers': 3, 'hidden_dim_0': 512, 'hidden_dim_1': 64, 'hidden_dim_2': 1024, 'kl_weight': 0.000489555896471494, 'lr': 0.000975334647722582, 'batch_size': 32, 'dropout_rate': 0.4244868731067642, 'prior_mu': 0.0577043443918331, 'prior_sigma': 0.07699870622561208, 'normalization': 'none'}. Best is trial 1528 with value: 0.5170644640922546.
Generating morgan fingerprints...
Generated fingerprints with 2048 features for 900 molecules
Data shape: X=(900, 2048), y=(900,)
Trial 2036: 5-fold CV loss = 0.5243
[I 2025-08-08 03:49:38,323] Trial 2036 finished with value: 0.5243217408657074 and parameters: {'fp_type': 'morgan', 'morgan_only_radius': 2, 'morgan_only_nBits': 2048, 'num_hidden_layers': 3, 'hidden_dim_0': 512, 'hidden_dim_1': 64, 'hidden_dim_2': 256, 'kl_weight': 0.0005426884650918638, 'lr': 0.0024391767762620463, 'batch_size': 32, 'dropout_rate': 0.4214742162039223, 'prior_mu': 0.07285699064023216, 'prior_sigma': 0.08186582177902434, 'normalization': 'none'}. Best is trial 1528 with value: 0.5170644640922546.
Generating morgan fingerprints...
Generated fingerprints with 2048 features for 900 molecules
Data shape: X=(900, 2048), y=(900,)
Trial 2039: 5-fold CV loss = 0.7544
[I 2025-08-08 03:49:43,833] Trial 2039 finished with value: 0.7543833255767822 and parameters: {'fp_type': 'morgan', 'morgan_only_radius': 2, 'morgan_only_nBits': 2048, 'num_hidden_layers': 3, 'hidden_dim_0': 512, 'hidden_dim_1': 64, 'hidden_dim_2': 256, 'kl_weight': 0.0006094275968181688, 'lr': 0.00032692486295186115, 'batch_size': 32, 'dropout_rate': 0.42525577774127826, 'prior_mu': 0.04611575953933125, 'prior_sigma': 0.07604338656450892, 'normalization': 'none'}. Best is trial 1528 with value: 0.5170644640922546.
Generating morgan fingerprints...
Generated fingerprints with 2048 features for 900 molecules
Data shape: X=(900, 2048), y=(900,)
Trial 2042: 5-fold CV loss = 0.8666
[I 2025-08-08 03:49:56,614] Trial 2042 finished with value: 0.8666374444961548 and parameters: {'fp_type': 'morgan', 'morgan_only_radius': 2, 'morgan_only_nBits': 2048, 'num_hidden_layers': 3, 'hidden_dim_0': 512, 'hidden_dim_1': 64, 'hidden_dim_2': 256, 'kl_weight': 0.00035914089596089237, 'lr': 0.002347380920979133, 'batch_size': 64, 'dropout_rate': 0.4437721088099081, 'prior_mu': 0.0449260189571419, 'prior_sigma': 0.0812141400376333, 'normalization': 'none'}. Best is trial 1528 with value: 0.5170644640922546.
Generating morgan fingerprints...
Generated fingerprints with 2048 features for 900 molecules
Data shape: X=(900, 2048), y=(900,)
Trial 2041: 5-fold CV loss = 0.5740
[I 2025-08-08 03:50:41,824] Trial 2041 finished with value: 0.5739863693714142 and parameters: {'fp_type': 'morgan', 'morgan_only_radius': 2, 'morgan_only_nBits': 2048, 'num_hidden_layers': 3, 'hidden_dim_0': 64, 'hidden_dim_1': 64, 'hidden_dim_2': 128, 'kl_weight': 0.0006037467937111416, 'lr': 0.002323664993430523, 'batch_size': 32, 'dropout_rate': 0.44537895133678845, 'prior_mu': 0.04443339695465482, 'prior_sigma': 0.07950810219049669, 'normalization': 'none'}. Best is trial 1528 with value: 0.5170644640922546.
Generating morgan fingerprints...
Generated fingerprints with 2048 features for 900 molecules
Data shape: X=(900, 2048), y=(900,)
Trial 2043: 5-fold CV loss = 0.5987
[I 2025-08-08 03:50:59,433] Trial 2043 finished with value: 0.5987332701683045 and parameters: {'fp_type': 'morgan', 'morgan_only_radius': 2, 'morgan_only_nBits': 2048, 'num_hidden_layers': 2, 'hidden_dim_0': 512, 'hidden_dim_1': 64, 'kl_weight': 0.0006605135815615643, 'lr': 0.003884200695734755, 'batch_size': 32, 'dropout_rate': 0.3890481773199831, 'prior_mu': 0.07501011739457539, 'prior_sigma': 0.07285275171159408, 'normalization': 'none'}. Best is trial 1528 with value: 0.5170644640922546.
Generating morgan fingerprints...
Generated fingerprints with 2048 features for 900 molecules
Data shape: X=(900, 2048), y=(900,)
Trial 2040: 5-fold CV loss = 0.5759
[I 2025-08-08 03:51:32,893] Trial 2040 finished with value: 0.5758984088897705 and parameters: {'fp_type': 'morgan', 'morgan_only_radius': 2, 'morgan_only_nBits': 2048, 'num_hidden_layers': 3, 'hidden_dim_0': 64, 'hidden_dim_1': 64, 'hidden_dim_2': 256, 'kl_weight': 0.0006167352560143358, 'lr': 0.0023784413840873095, 'batch_size': 32, 'dropout_rate': 0.4426738999654811, 'prior_mu': 0.07296323766633099, 'prior_sigma': 0.079817466019527, 'normalization': 'none'}. Best is trial 1528 with value: 0.5170644640922546.
Generating morgan fingerprints...
Generated fingerprints with 2048 features for 900 molecules
Data shape: X=(900, 2048), y=(900,)
Trial 2044: 5-fold CV loss = 0.5284
[I 2025-08-08 03:52:02,737] Trial 2044 finished with value: 0.5284489631652832 and parameters: {'fp_type': 'morgan', 'morgan_only_radius': 2, 'morgan_only_nBits': 2048, 'num_hidden_layers': 3, 'hidden_dim_0': 512, 'hidden_dim_1': 64, 'hidden_dim_2': 256, 'kl_weight': 0.0006251276968701287, 'lr': 0.0025111069754037746, 'batch_size': 32, 'dropout_rate': 0.3890879929063757, 'prior_mu': 0.0759856168071983, 'prior_sigma': 0.07283693859792631, 'normalization': 'none'}. Best is trial 1528 with value: 0.5170644640922546.
Generating morgan fingerprints...
Generated fingerprints with 2048 features for 900 molecules
Data shape: X=(900, 2048), y=(900,)
Trial 2045: 5-fold CV loss = 0.5222
