[I 2025-08-07 19:48:23,186] Trial 719 finished with value: 0.5487101972103119 and parameters: {'fp_type': 'morgan', 'morgan_only_radius': 2, 'morgan_only_nBits': 1024, 'num_hidden_layers': 3, 'hidden_dim_0': 64, 'hidden_dim_1': 128, 'hidden_dim_2': 512, 'kl_weight': 0.0018418847280656067, 'lr': 0.002529484441088308, 'batch_size': 32, 'dropout_rate': 0.46465326212403285, 'prior_mu': -0.004288985294964584, 'prior_sigma': 0.05467792326355185, 'normalization': 'none'}. Best is trial 272 with value: 0.5198344707489013.
Generating morgan fingerprints...
Generated fingerprints with 1024 features for 900 molecules
Data shape: X=(900, 1024), y=(900,)
Trial 722: 5-fold CV loss = 0.5340
[I 2025-08-07 19:49:14,152] Trial 722 finished with value: 0.5340327143669128 and parameters: {'fp_type': 'morgan', 'morgan_only_radius': 2, 'morgan_only_nBits': 1024, 'num_hidden_layers': 3, 'hidden_dim_0': 512, 'hidden_dim_1': 128, 'hidden_dim_2': 512, 'kl_weight': 0.0022193526861547528, 'lr': 0.003491183878742679, 'batch_size': 32, 'dropout_rate': 0.47258715858351885, 'prior_mu': -0.01451022091079548, 'prior_sigma': 0.06624705976836386, 'normalization': 'none'}. Best is trial 272 with value: 0.5198344707489013.
Generating morgan fingerprints...
Generated fingerprints with 1024 features for 900 molecules
Data shape: X=(900, 1024), y=(900,)
Trial 721: 5-fold CV loss = 0.5749
[I 2025-08-07 19:49:21,495] Trial 721 finished with value: 0.5748571276664733 and parameters: {'fp_type': 'morgan', 'morgan_only_radius': 2, 'morgan_only_nBits': 1024, 'num_hidden_layers': 3, 'hidden_dim_0': 64, 'hidden_dim_1': 128, 'hidden_dim_2': 512, 'kl_weight': 0.002003840382601978, 'lr': 0.001458396988924441, 'batch_size': 32, 'dropout_rate': 0.46412400130593917, 'prior_mu': -0.012957340210703544, 'prior_sigma': 0.052100557747854014, 'normalization': 'none'}. Best is trial 272 with value: 0.5198344707489013.
Generating morgan fingerprints...
Generated fingerprints with 1024 features for 900 molecules
Data shape: X=(900, 1024), y=(900,)
Trial 720: 5-fold CV loss = 0.5798
[I 2025-08-07 19:50:01,233] Trial 720 finished with value: 0.579774272441864 and parameters: {'fp_type': 'morgan', 'morgan_only_radius': 2, 'morgan_only_nBits': 1024, 'num_hidden_layers': 3, 'hidden_dim_0': 64, 'hidden_dim_1': 128, 'hidden_dim_2': 512, 'kl_weight': 0.0017481763338852948, 'lr': 0.0014850707441613864, 'batch_size': 32, 'dropout_rate': 0.46136994304416445, 'prior_mu': -0.003416266597291136, 'prior_sigma': 0.052910188163310015, 'normalization': 'none'}. Best is trial 272 with value: 0.5198344707489013.
Generating morgan fingerprints...
Generated fingerprints with 1024 features for 900 molecules
Data shape: X=(900, 1024), y=(900,)
Trial 716: 5-fold CV loss = 0.5386
[I 2025-08-07 19:50:32,066] Trial 716 finished with value: 0.5385826468467713 and parameters: {'fp_type': 'morgan', 'morgan_only_radius': 2, 'morgan_only_nBits': 1024, 'num_hidden_layers': 3, 'hidden_dim_0': 512, 'hidden_dim_1': 128, 'hidden_dim_2': 512, 'kl_weight': 0.0015007136059941595, 'lr': 0.002498341251056736, 'batch_size': 32, 'dropout_rate': 0.4484169747921879, 'prior_mu': -0.005594030830502232, 'prior_sigma': 0.05387200665026753, 'normalization': 'none'}. Best is trial 272 with value: 0.5198344707489013.
Generating morgan fingerprints...
Generated fingerprints with 1024 features for 900 molecules
Data shape: X=(900, 1024), y=(900,)
Trial 723: 5-fold CV loss = 0.5347
[I 2025-08-07 19:50:41,504] Trial 723 finished with value: 0.534685093164444 and parameters: {'fp_type': 'morgan', 'morgan_only_radius': 2, 'morgan_only_nBits': 1024, 'num_hidden_layers': 3, 'hidden_dim_0': 512, 'hidden_dim_1': 128, 'hidden_dim_2': 512, 'kl_weight': 0.0008392223099961717, 'lr': 0.002200872385866608, 'batch_size': 32, 'dropout_rate': 0.4613747681374398, 'prior_mu': -0.017571473082429998, 'prior_sigma': 0.052510780875304114, 'normalization': 'none'}. Best is trial 272 with value: 0.5198344707489013.
Generating morgan fingerprints...
Generated fingerprints with 1024 features for 900 molecules
Data shape: X=(900, 1024), y=(900,)
Trial 724: 5-fold CV loss = 0.5259
[I 2025-08-07 19:50:43,159] Trial 724 finished with value: 0.5259096086025238 and parameters: {'fp_type': 'morgan', 'morgan_only_radius': 2, 'morgan_only_nBits': 1024, 'num_hidden_layers': 3, 'hidden_dim_0': 512, 'hidden_dim_1': 128, 'hidden_dim_2': 512, 'kl_weight': 0.0008804995951163632, 'lr': 0.0022321838100891377, 'batch_size': 32, 'dropout_rate': 0.4817868283685514, 'prior_mu': 0.0016675325822473226, 'prior_sigma': 0.07235969141372191, 'normalization': 'none'}. Best is trial 272 with value: 0.5198344707489013.
Generating morgan fingerprints...
Generated fingerprints with 1024 features for 900 molecules
Data shape: X=(900, 1024), y=(900,)
Trial 727: 5-fold CV loss = 0.5312
[I 2025-08-07 19:51:42,686] Trial 727 finished with value: 0.5312470972537995 and parameters: {'fp_type': 'morgan', 'morgan_only_radius': 2, 'morgan_only_nBits': 1024, 'num_hidden_layers': 3, 'hidden_dim_0': 512, 'hidden_dim_1': 128, 'hidden_dim_2': 512, 'kl_weight': 0.0012165831538197595, 'lr': 0.0028003796158775447, 'batch_size': 32, 'dropout_rate': 0.48249506782685997, 'prior_mu': 0.021702072798013138, 'prior_sigma': 0.07109247464174494, 'normalization': 'none'}. Best is trial 272 with value: 0.5198344707489013.
Generating morgan fingerprints...
Generated fingerprints with 1024 features for 900 molecules
Data shape: X=(900, 1024), y=(900,)
Trial 728: 5-fold CV loss = 0.5290
[I 2025-08-07 19:52:13,457] Trial 728 finished with value: 0.5290431201457977 and parameters: {'fp_type': 'morgan', 'morgan_only_radius': 2, 'morgan_only_nBits': 1024, 'num_hidden_layers': 3, 'hidden_dim_0': 512, 'hidden_dim_1': 128, 'hidden_dim_2': 512, 'kl_weight': 0.001180605034317128, 'lr': 0.0019855737239963035, 'batch_size': 32, 'dropout_rate': 0.47254238475490673, 'prior_mu': 0.0198419334095495, 'prior_sigma': 0.07841739371237334, 'normalization': 'none'}. Best is trial 272 with value: 0.5198344707489013.
Generating morgan fingerprints...
Generated fingerprints with 1024 features for 900 molecules
Data shape: X=(900, 1024), y=(900,)
Trial 725: 5-fold CV loss = 0.5597
[I 2025-08-07 19:52:19,685] Trial 725 finished with value: 0.559708571434021 and parameters: {'fp_type': 'morgan', 'morgan_only_radius': 2, 'morgan_only_nBits': 1024, 'num_hidden_layers': 3, 'hidden_dim_0': 512, 'hidden_dim_1': 128, 'hidden_dim_2': 512, 'kl_weight': 0.0012837640872272692, 'lr': 0.0022194172545275184, 'batch_size': 32, 'dropout_rate': 0.44215306169386, 'prior_mu': -0.020629236324817335, 'prior_sigma': 0.13436608745592615, 'normalization': 'none'}. Best is trial 272 with value: 0.5198344707489013.
Generating morgan fingerprints...
Generated fingerprints with 1024 features for 900 molecules
Data shape: X=(900, 1024), y=(900,)
Trial 729: 5-fold CV loss = 0.6267
[I 2025-08-07 19:52:53,607] Trial 729 finished with value: 0.6266648471355438 and parameters: {'fp_type': 'morgan', 'morgan_only_radius': 2, 'morgan_only_nBits': 1024, 'num_hidden_layers': 3, 'hidden_dim_0': 512, 'hidden_dim_1': 128, 'hidden_dim_2': 512, 'kl_weight': 0.001018142824555008, 'lr': 0.0019664684001855413, 'batch_size': 32, 'dropout_rate': 0.4397045255176021, 'prior_mu': 0.002464883116123273, 'prior_sigma': 0.07384419951395987, 'normalization': 'none'}. Best is trial 272 with value: 0.5198344707489013.
Generating morgan fingerprints...
Generated fingerprints with 1024 features for 900 molecules
Data shape: X=(900, 1024), y=(900,)
Trial 731: 5-fold CV loss = 0.6070
[I 2025-08-07 19:53:40,739] Trial 731 finished with value: 0.6070045709609986 and parameters: {'fp_type': 'morgan', 'morgan_only_radius': 2, 'morgan_only_nBits': 1024, 'num_hidden_layers': 3, 'hidden_dim_0': 512, 'hidden_dim_1': 128, 'hidden_dim_2': 512, 'kl_weight': 0.0009553924171550025, 'lr': 0.001846429604917049, 'batch_size': 32, 'dropout_rate': 0.23523507555474513, 'prior_mu': 0.005814784905763631, 'prior_sigma': 0.07472844202549127, 'normalization': 'none'}. Best is trial 272 with value: 0.5198344707489013.
Generating morgan fingerprints...
Generated fingerprints with 1024 features for 900 molecules
Data shape: X=(900, 1024), y=(900,)
Trial 730: 5-fold CV loss = 0.5295
[I 2025-08-07 19:53:45,906] Trial 730 finished with value: 0.5294505596160889 and parameters: {'fp_type': 'morgan', 'morgan_only_radius': 2, 'morgan_only_nBits': 1024, 'num_hidden_layers': 3, 'hidden_dim_0': 512, 'hidden_dim_1': 128, 'hidden_dim_2': 512, 'kl_weight': 0.0010036499191888183, 'lr': 0.0021208106928022144, 'batch_size': 32, 'dropout_rate': 0.47554887612821667, 'prior_mu': 0.0039032625540735932, 'prior_sigma': 0.0749795689182374, 'normalization': 'none'}. Best is trial 272 with value: 0.5198344707489013.
Generating morgan fingerprints...
Generated fingerprints with 1024 features for 900 molecules
Data shape: X=(900, 1024), y=(900,)
Trial 732: 5-fold CV loss = 0.5298
[I 2025-08-07 19:54:27,464] Trial 732 finished with value: 0.5297941207885742 and parameters: {'fp_type': 'morgan', 'morgan_only_radius': 2, 'morgan_only_nBits': 1024, 'num_hidden_layers': 3, 'hidden_dim_0': 512, 'hidden_dim_1': 128, 'hidden_dim_2': 512, 'kl_weight': 0.0010309662715061495, 'lr': 0.001833017237336575, 'batch_size': 32, 'dropout_rate': 0.47508791349736196, 'prior_mu': 0.0060865845627975585, 'prior_sigma': 0.07194114782089395, 'normalization': 'none'}. Best is trial 272 with value: 0.5198344707489013.
Generating morgan fingerprints...
Generated fingerprints with 1024 features for 900 molecules
Data shape: X=(900, 1024), y=(900,)
Trial 734: 5-fold CV loss = 0.6119
[I 2025-08-07 19:54:46,488] Trial 734 finished with value: 0.6118600606918335 and parameters: {'fp_type': 'morgan', 'morgan_only_radius': 2, 'morgan_only_nBits': 1024, 'num_hidden_layers': 3, 'hidden_dim_0': 1024, 'hidden_dim_1': 1024, 'hidden_dim_2': 512, 'kl_weight': 0.0028147321607281213, 'lr': 0.001715724946437899, 'batch_size': 32, 'dropout_rate': 0.4812624907175369, 'prior_mu': 0.010884174170923137, 'prior_sigma': 0.017886133237941387, 'normalization': 'none'}. Best is trial 272 with value: 0.5198344707489013.
Generating morgan fingerprints...
Generated fingerprints with 1024 features for 900 molecules
Data shape: X=(900, 1024), y=(900,)
Trial 726: 5-fold CV loss = 0.5391
[I 2025-08-07 19:55:25,595] Trial 726 finished with value: 0.5391384184360504 and parameters: {'fp_type': 'morgan', 'morgan_only_radius': 2, 'morgan_only_nBits': 1024, 'num_hidden_layers': 3, 'hidden_dim_0': 512, 'hidden_dim_1': 128, 'hidden_dim_2': 512, 'kl_weight': 0.03949867002936163, 'lr': 0.002189491921489191, 'batch_size': 32, 'dropout_rate': 0.4818664877704752, 'prior_mu': 0.00418195116555342, 'prior_sigma': 0.07140539404565834, 'normalization': 'none'}. Best is trial 272 with value: 0.5198344707489013.
Generating morgan fingerprints...
Generated fingerprints with 1024 features for 900 molecules
Data shape: X=(900, 1024), y=(900,)
Trial 735: 5-fold CV loss = 4.7155
[I 2025-08-07 19:55:39,981] Trial 735 finished with value: 4.71550463438034 and parameters: {'fp_type': 'morgan', 'morgan_only_radius': 2, 'morgan_only_nBits': 1024, 'num_hidden_layers': 3, 'hidden_dim_0': 1024, 'hidden_dim_1': 1024, 'hidden_dim_2': 512, 'kl_weight': 0.037279708483935775, 'lr': 0.002349000366681228, 'batch_size': 32, 'dropout_rate': 0.48303866415663566, 'prior_mu': 0.014360957794153141, 'prior_sigma': 0.17835657643625424, 'normalization': 'none'}. Best is trial 272 with value: 0.5198344707489013.
Generating morgan fingerprints...
Generated fingerprints with 1024 features for 900 molecules
Data shape: X=(900, 1024), y=(900,)
Trial 733: 5-fold CV loss = 0.5421
[I 2025-08-07 19:55:51,075] Trial 733 finished with value: 0.5421406090259552 and parameters: {'fp_type': 'morgan', 'morgan_only_radius': 2, 'morgan_only_nBits': 1024, 'num_hidden_layers': 3, 'hidden_dim_0': 512, 'hidden_dim_1': 128, 'hidden_dim_2': 512, 'kl_weight': 0.0027066711989260418, 'lr': 0.0021209541377140927, 'batch_size': 32, 'dropout_rate': 0.47586330035781577, 'prior_mu': 0.005205351562896259, 'prior_sigma': 0.09281831115622986, 'normalization': 'none'}. Best is trial 272 with value: 0.5198344707489013.
Generating morgan fingerprints...
Generated fingerprints with 1024 features for 900 molecules
Data shape: X=(900, 1024), y=(900,)
Trial 736: 5-fold CV loss = 0.5261
[I 2025-08-07 19:56:17,554] Trial 736 finished with value: 0.5260627329349518 and parameters: {'fp_type': 'morgan', 'morgan_only_radius': 2, 'morgan_only_nBits': 1024, 'num_hidden_layers': 3, 'hidden_dim_0': 512, 'hidden_dim_1': 128, 'hidden_dim_2': 512, 'kl_weight': 0.0025068032095077806, 'lr': 0.0023653210055691724, 'batch_size': 32, 'dropout_rate': 0.4649662575650356, 'prior_mu': -0.010039305868838392, 'prior_sigma': 0.06743699996431571, 'normalization': 'none'}. Best is trial 272 with value: 0.5198344707489013.
Generating morgan fingerprints...
Generated fingerprints with 1024 features for 900 molecules
Data shape: X=(900, 1024), y=(900,)
Trial 738: 5-fold CV loss = 0.6002
[I 2025-08-07 19:56:23,531] Trial 738 finished with value: 0.6002465307712554 and parameters: {'fp_type': 'morgan', 'morgan_only_radius': 2, 'morgan_only_nBits': 1024, 'num_hidden_layers': 3, 'hidden_dim_0': 512, 'hidden_dim_1': 128, 'hidden_dim_2': 128, 'kl_weight': 0.0016227098657002638, 'lr': 0.002050232641235764, 'batch_size': 32, 'dropout_rate': 0.45392724743739377, 'prior_mu': -0.009398090586055651, 'prior_sigma': 0.042331593384341934, 'normalization': 'none'}. Best is trial 272 with value: 0.5198344707489013.
Generating morgan fingerprints...
Generated fingerprints with 1024 features for 900 molecules
Data shape: X=(900, 1024), y=(900,)
Trial 740: 5-fold CV loss = 0.5677
[I 2025-08-07 19:57:41,967] Trial 740 finished with value: 0.5676851451396943 and parameters: {'fp_type': 'morgan', 'morgan_only_radius': 2, 'morgan_only_nBits': 1024, 'num_hidden_layers': 3, 'hidden_dim_0': 128, 'hidden_dim_1': 128, 'hidden_dim_2': 512, 'kl_weight': 0.00316826769460167, 'lr': 0.0019522512180722288, 'batch_size': 32, 'dropout_rate': 0.456210302767917, 'prior_mu': -0.010235168445181736, 'prior_sigma': 0.07831188486157846, 'normalization': 'none'}. Best is trial 272 with value: 0.5198344707489013.
Generating morgan fingerprints...
Generated fingerprints with 1024 features for 900 molecules
Data shape: X=(900, 1024), y=(900,)
Trial 741: 5-fold CV loss = 0.5772
[I 2025-08-07 19:57:46,846] Trial 741 finished with value: 0.5771992683410645 and parameters: {'fp_type': 'morgan', 'morgan_only_radius': 2, 'morgan_only_nBits': 1024, 'num_hidden_layers': 3, 'hidden_dim_0': 128, 'hidden_dim_1': 128, 'hidden_dim_2': 512, 'kl_weight': 0.003143867653093681, 'lr': 0.001629143874160431, 'batch_size': 32, 'dropout_rate': 0.46726257425979517, 'prior_mu': -0.0029629045571856506, 'prior_sigma': 0.0834248846811319, 'normalization': 'none'}. Best is trial 272 with value: 0.5198344707489013.
Generating morgan fingerprints...
Generated fingerprints with 1024 features for 900 molecules
Data shape: X=(900, 1024), y=(900,)
Trial 739: 5-fold CV loss = 0.6936
[I 2025-08-07 19:57:48,044] Trial 739 finished with value: 0.6935759603977203 and parameters: {'fp_type': 'morgan', 'morgan_only_radius': 2, 'morgan_only_nBits': 1024, 'num_hidden_layers': 3, 'hidden_dim_0': 512, 'hidden_dim_1': 128, 'hidden_dim_2': 128, 'kl_weight': 0.0031973164758784707, 'lr': 0.0019924226037602703, 'batch_size': 32, 'dropout_rate': 0.45527968077052366, 'prior_mu': -0.009962674326157467, 'prior_sigma': 0.08343215824597515, 'normalization': 'none'}. Best is trial 272 with value: 0.5198344707489013.
Generating morgan fingerprints...
Generated fingerprints with 1024 features for 900 molecules
Data shape: X=(900, 1024), y=(900,)
Trial 742: 5-fold CV loss = 0.8249
[I 2025-08-07 19:58:55,226] Trial 742 finished with value: 0.8249459803104401 and parameters: {'fp_type': 'morgan', 'morgan_only_radius': 3, 'morgan_only_nBits': 1024, 'num_hidden_layers': 3, 'hidden_dim_0': 512, 'hidden_dim_1': 128, 'hidden_dim_2': 512, 'kl_weight': 0.0011123358541557835, 'lr': 0.0016255879789190079, 'batch_size': 32, 'dropout_rate': 0.4693243379182135, 'prior_mu': 0.026155438897339556, 'prior_sigma': 0.0843334014164899, 'normalization': 'none'}. Best is trial 272 with value: 0.5198344707489013.
Generating morgan fingerprints...
Generated fingerprints with 2048 features for 900 molecules
Data shape: X=(900, 2048), y=(900,)
Trial 743: 5-fold CV loss = 0.5304
[I 2025-08-07 19:58:58,601] Trial 743 finished with value: 0.5303596675395965 and parameters: {'fp_type': 'morgan', 'morgan_only_radius': 3, 'morgan_only_nBits': 1024, 'num_hidden_layers': 3, 'hidden_dim_0': 512, 'hidden_dim_1': 128, 'hidden_dim_2': 512, 'kl_weight': 0.0008606430555227876, 'lr': 0.0023438183022950762, 'batch_size': 32, 'dropout_rate': 0.49014090925848075, 'prior_mu': 0.034779572066713005, 'prior_sigma': 0.06798167779582928, 'normalization': 'none'}. Best is trial 272 with value: 0.5198344707489013.
Generating morgan fingerprints...
Generated fingerprints with 2048 features for 900 molecules
Data shape: X=(900, 2048), y=(900,)
Trial 746: 5-fold CV loss = 0.6556
[I 2025-08-07 19:59:12,067] Trial 746 finished with value: 0.6555576324462891 and parameters: {'fp_type': 'morgan', 'morgan_only_radius': 2, 'morgan_only_nBits': 2048, 'num_hidden_layers': 0, 'kl_weight': 0.0020936002595429142, 'lr': 0.002455748083162905, 'batch_size': 32, 'dropout_rate': 0.486732349340503, 'prior_mu': -0.014478603476791564, 'prior_sigma': 0.06632886071357218, 'normalization': 'none'}. Best is trial 272 with value: 0.5198344707489013.
Generating morgan fingerprints...
Generated fingerprints with 1024 features for 900 molecules
Data shape: X=(900, 1024), y=(900,)
Trial 737: 5-fold CV loss = 0.5309
[I 2025-08-07 19:59:29,796] Trial 737 finished with value: 0.5309287488460541 and parameters: {'fp_type': 'morgan', 'morgan_only_radius': 2, 'morgan_only_nBits': 1024, 'num_hidden_layers': 3, 'hidden_dim_0': 512, 'hidden_dim_1': 128, 'hidden_dim_2': 512, 'kl_weight': 0.0008871313847277174, 'lr': 0.002296744817348002, 'batch_size': 32, 'dropout_rate': 0.45592906363414265, 'prior_mu': -0.00892881418675525, 'prior_sigma': 0.06751562252759058, 'normalization': 'none'}. Best is trial 272 with value: 0.5198344707489013.
Generating morgan fingerprints...
Generated fingerprints with 1024 features for 900 molecules
Data shape: X=(900, 1024), y=(900,)
Trial 744: 5-fold CV loss = 0.5295
[I 2025-08-07 20:00:01,375] Trial 744 finished with value: 0.5295167744159699 and parameters: {'fp_type': 'morgan', 'morgan_only_radius': 3, 'morgan_only_nBits': 1024, 'num_hidden_layers': 3, 'hidden_dim_0': 512, 'hidden_dim_1': 128, 'hidden_dim_2': 512, 'kl_weight': 0.0020708047141133903, 'lr': 0.002380372727829302, 'batch_size': 32, 'dropout_rate': 0.4871890028616102, 'prior_mu': -0.016758974200950932, 'prior_sigma': 0.06730826049362258, 'normalization': 'none'}. Best is trial 272 with value: 0.5198344707489013.
Generating morgan fingerprints...
Generated fingerprints with 1024 features for 900 molecules
Data shape: X=(900, 1024), y=(900,)
Trial 745: 5-fold CV loss = 0.5248
[I 2025-08-07 20:00:11,310] Trial 745 finished with value: 0.5247751593589782 and parameters: {'fp_type': 'morgan', 'morgan_only_radius': 2, 'morgan_only_nBits': 2048, 'num_hidden_layers': 3, 'hidden_dim_0': 512, 'hidden_dim_1': 128, 'hidden_dim_2': 512, 'kl_weight': 0.0013516404600795113, 'lr': 0.002358985201945702, 'batch_size': 32, 'dropout_rate': 0.4875070142073464, 'prior_mu': -0.021574344064508484, 'prior_sigma': 0.06692983909844853, 'normalization': 'none'}. Best is trial 272 with value: 0.5198344707489013.
Generating rdkit fingerprints...
Generated fingerprints with 1024 features for 900 molecules
Data shape: X=(900, 1024), y=(900,)
Trial 747: 5-fold CV loss = 0.5315
[I 2025-08-07 20:00:33,801] Trial 747 finished with value: 0.5315147995948791 and parameters: {'fp_type': 'morgan', 'morgan_only_radius': 2, 'morgan_only_nBits': 1024, 'num_hidden_layers': 3, 'hidden_dim_0': 512, 'hidden_dim_1': 128, 'hidden_dim_2': 512, 'kl_weight': 0.001281447019058449, 'lr': 0.002150296550429531, 'batch_size': 32, 'dropout_rate': 0.49056344856621364, 'prior_mu': -0.021237583812712398, 'prior_sigma': 0.07122240609344326, 'normalization': 'none'}. Best is trial 272 with value: 0.5198344707489013.
Generating rdkit fingerprints...
Generated fingerprints with 1024 features for 900 molecules
Data shape: X=(900, 1024), y=(900,)
Trial 751: 5-fold CV loss = 0.6164
[I 2025-08-07 20:01:08,182] Trial 751 finished with value: 0.6163655161857605 and parameters: {'fp_type': 'rdkit', 'rdkit_only_maxPath': 6, 'rdkit_only_nBits': 1024, 'num_hidden_layers': 3, 'hidden_dim_0': 256, 'hidden_dim_1': 128, 'hidden_dim_2': 512, 'kl_weight': 0.0014997825298534721, 'lr': 0.0026477181075758435, 'batch_size': 32, 'dropout_rate': 0.4928649625871063, 'prior_mu': -0.024508065285732912, 'prior_sigma': 0.059706676217803775, 'normalization': 'none'}. Best is trial 272 with value: 0.5198344707489013.
Generating morgan fingerprints...
Generated fingerprints with 2048 features for 900 molecules
Data shape: X=(900, 2048), y=(900,)
Trial 752: 5-fold CV loss = 0.5362
[I 2025-08-07 20:02:08,440] Trial 752 finished with value: 0.5362450659275055 and parameters: {'fp_type': 'morgan', 'morgan_only_radius': 2, 'morgan_only_nBits': 2048, 'num_hidden_layers': 3, 'hidden_dim_0': 512, 'hidden_dim_1': 128, 'hidden_dim_2': 512, 'kl_weight': 0.0015644841698732388, 'lr': 0.0028789213474824846, 'batch_size': 32, 'dropout_rate': 0.49975399512571406, 'prior_mu': -0.023571613545338443, 'prior_sigma': 0.06118692861991468, 'normalization': 'none'}. Best is trial 272 with value: 0.5198344707489013.
Generating morgan fingerprints...
Generated fingerprints with 2048 features for 900 molecules
Data shape: X=(900, 2048), y=(900,)
Trial 749: 5-fold CV loss = 0.7002
