[I 2025-08-08 08:29:15,017] Trial 2890 finished with value: 0.5294882893562317 and parameters: {'fp_type': 'morgan', 'morgan_only_radius': 2, 'morgan_only_nBits': 2048, 'num_hidden_layers': 3, 'hidden_dim_0': 512, 'hidden_dim_1': 128, 'hidden_dim_2': 512, 'kl_weight': 0.0009418185826011071, 'lr': 0.0021095483055512806, 'batch_size': 32, 'dropout_rate': 0.45162159958379905, 'prior_mu': 0.05203955320244042, 'prior_sigma': 0.07803553025014151, 'normalization': 'none'}. Best is trial 2752 with value: 0.5150722622871399.
Generating morgan fingerprints...
Generated fingerprints with 2048 features for 900 molecules
Data shape: X=(900, 2048), y=(900,)
Trial 2897: 5-fold CV loss = 0.5343
