[I 2025-08-08 06:22:05,518] Trial 2518 finished with value: 0.5351198613643646 and parameters: {'fp_type': 'morgan', 'morgan_only_radius': 2, 'morgan_only_nBits': 2048, 'num_hidden_layers': 3, 'hidden_dim_0': 512, 'hidden_dim_1': 128, 'hidden_dim_2': 1024, 'kl_weight': 0.000206526113014348, 'lr': 0.0035993966323871807, 'batch_size': 32, 'dropout_rate': 0.4281539504332362, 'prior_mu': 0.04344402241759978, 'prior_sigma': 0.06773996827324823, 'normalization': 'none'}. Best is trial 2426 with value: 0.515486741065979.
Generating morgan fingerprints...
Generated fingerprints with 2048 features for 900 molecules
Data shape: X=(900, 2048), y=(900,)
Trial 2520: 5-fold CV loss = 1.3763
[I 2025-08-08 06:22:08,300] Trial 2520 finished with value: 1.3763000249862671 and parameters: {'fp_type': 'morgan', 'morgan_only_radius': 2, 'morgan_only_nBits': 2048, 'num_hidden_layers': 3, 'hidden_dim_0': 512, 'hidden_dim_1': 128, 'hidden_dim_2': 512, 'kl_weight': 0.00021493607320306263, 'lr': 0.0016977908100917769, 'batch_size': 128, 'dropout_rate': 0.40149530425031227, 'prior_mu': 0.04420313954768735, 'prior_sigma': 0.10006659190453844, 'normalization': 'none'}. Best is trial 2426 with value: 0.515486741065979.
Generating rdkit fingerprints...
Generated fingerprints with 256 features for 900 molecules
Data shape: X=(900, 256), y=(900,)
Trial 2521: 5-fold CV loss = 0.7211
[I 2025-08-08 06:22:15,286] Trial 2521 finished with value: 0.7211377382278442 and parameters: {'fp_type': 'morgan', 'morgan_only_radius': 2, 'morgan_only_nBits': 2048, 'num_hidden_layers': 3, 'hidden_dim_0': 512, 'hidden_dim_1': 512, 'hidden_dim_2': 64, 'kl_weight': 0.0006079426910373463, 'lr': 0.001751243445687981, 'batch_size': 128, 'dropout_rate': 0.3964483819010795, 'prior_mu': 0.09089773374625745, 'prior_sigma': 0.07359279287057237, 'normalization': 'none'}. Best is trial 2426 with value: 0.515486741065979.
Generating morgan fingerprints...
Generated fingerprints with 2048 features for 900 molecules
Data shape: X=(900, 2048), y=(900,)
Trial 2513: 5-fold CV loss = 0.6142
[I 2025-08-08 06:22:37,284] Trial 2513 finished with value: 0.6142149329185486 and parameters: {'fp_type': 'morgan', 'morgan_only_radius': 2, 'morgan_only_nBits': 2048, 'num_hidden_layers': 3, 'hidden_dim_0': 256, 'hidden_dim_1': 64, 'hidden_dim_2': 512, 'kl_weight': 0.000704208620899482, 'lr': 0.0022542567343547242, 'batch_size': 64, 'dropout_rate': 0.4307714938645157, 'prior_mu': 0.04959005257748428, 'prior_sigma': 0.09051894744546327, 'normalization': 'none'}. Best is trial 2426 with value: 0.515486741065979.
Generating rdkit fingerprints...
Generated fingerprints with 256 features for 900 molecules
Data shape: X=(900, 256), y=(900,)
Trial 2522: 5-fold CV loss = 0.6353
[I 2025-08-08 06:22:54,303] Trial 2522 finished with value: 0.6352887153625488 and parameters: {'fp_type': 'rdkit', 'rdkit_only_maxPath': 6, 'rdkit_only_nBits': 256, 'num_hidden_layers': 3, 'hidden_dim_0': 512, 'hidden_dim_1': 512, 'hidden_dim_2': 64, 'kl_weight': 0.0006082520226959066, 'lr': 0.0020077606599273627, 'batch_size': 32, 'dropout_rate': 0.41325743468416787, 'prior_mu': 0.027365939880085496, 'prior_sigma': 0.07336691325098023, 'normalization': 'none'}. Best is trial 2426 with value: 0.515486741065979.
Generating morgan fingerprints...
Generated fingerprints with 2048 features for 900 molecules
Data shape: X=(900, 2048), y=(900,)
Trial 2519: 5-fold CV loss = 0.5716
[I 2025-08-08 06:23:13,125] Trial 2519 finished with value: 0.571634715795517 and parameters: {'fp_type': 'morgan', 'morgan_only_radius': 2, 'morgan_only_nBits': 2048, 'num_hidden_layers': 3, 'hidden_dim_0': 512, 'hidden_dim_1': 128, 'hidden_dim_2': 1024, 'kl_weight': 0.020228522249211223, 'lr': 0.002545140231454017, 'batch_size': 32, 'dropout_rate': 0.3679822770848299, 'prior_mu': 0.09005812537518638, 'prior_sigma': 0.07390646946097337, 'normalization': 'none'}. Best is trial 2426 with value: 0.515486741065979.
Generating morgan fingerprints...
Generated fingerprints with 2048 features for 900 molecules
Data shape: X=(900, 2048), y=(900,)
Trial 2523: 5-fold CV loss = 0.5702
[I 2025-08-08 06:23:35,815] Trial 2523 finished with value: 0.5702090680599212 and parameters: {'fp_type': 'morgan', 'morgan_only_radius': 2, 'morgan_only_nBits': 2048, 'num_hidden_layers': 3, 'hidden_dim_0': 512, 'hidden_dim_1': 128, 'hidden_dim_2': 256, 'kl_weight': 0.0007851105908785159, 'lr': 0.001981770970653057, 'batch_size': 32, 'dropout_rate': 0.44068752480362966, 'prior_mu': 0.026322595691881903, 'prior_sigma': 0.054975191493131875, 'normalization': 'none'}. Best is trial 2426 with value: 0.515486741065979.
Generating morgan fingerprints...
Generated fingerprints with 2048 features for 900 molecules
Data shape: X=(900, 2048), y=(900,)
Trial 2525: 5-fold CV loss = 0.5782
[I 2025-08-08 06:23:55,204] Trial 2525 finished with value: 0.5781581044197083 and parameters: {'fp_type': 'morgan', 'morgan_only_radius': 2, 'morgan_only_nBits': 2048, 'num_hidden_layers': 2, 'hidden_dim_0': 512, 'hidden_dim_1': 128, 'kl_weight': 0.0003435783493585378, 'lr': 0.00262352461443897, 'batch_size': 32, 'dropout_rate': 0.440451931087277, 'prior_mu': 0.04212021514933965, 'prior_sigma': 0.06177933737183088, 'normalization': 'none'}. Best is trial 2426 with value: 0.515486741065979.
Generating morgan fingerprints...
Generated fingerprints with 2048 features for 900 molecules
Data shape: X=(900, 2048), y=(900,)
Trial 2526: 5-fold CV loss = 1.6254
[I 2025-08-08 06:24:27,308] Trial 2526 finished with value: 1.6253824949264526 and parameters: {'fp_type': 'morgan', 'morgan_only_radius': 2, 'morgan_only_nBits': 2048, 'num_hidden_layers': 2, 'hidden_dim_0': 512, 'hidden_dim_1': 128, 'kl_weight': 0.0008176423118663895, 'lr': 0.0019426180484153333, 'batch_size': 32, 'dropout_rate': 0.4416338402015341, 'prior_mu': 0.04088182007187975, 'prior_sigma': 0.18234751506622277, 'normalization': 'none'}. Best is trial 2426 with value: 0.515486741065979.
Generating morgan fingerprints...
Generated fingerprints with 2048 features for 900 molecules
Data shape: X=(900, 2048), y=(900,)
Trial 2527: 5-fold CV loss = 0.5656
[I 2025-08-08 06:24:58,112] Trial 2527 finished with value: 0.5655874192714692 and parameters: {'fp_type': 'morgan', 'morgan_only_radius': 2, 'morgan_only_nBits': 2048, 'num_hidden_layers': 3, 'hidden_dim_0': 512, 'hidden_dim_1': 128, 'hidden_dim_2': 512, 'kl_weight': 0.000343522839196672, 'lr': 0.0018676830592860285, 'batch_size': 32, 'dropout_rate': 0.41399700899419684, 'prior_mu': 0.04084630938180703, 'prior_sigma': 0.0628459029646142, 'normalization': 'none'}. Best is trial 2426 with value: 0.515486741065979.
Generating morgan fingerprints...
Generated fingerprints with 2048 features for 900 molecules
Data shape: X=(900, 2048), y=(900,)
Trial 2528: 5-fold CV loss = 0.5554
[I 2025-08-08 06:25:16,639] Trial 2528 finished with value: 0.5554206728935241 and parameters: {'fp_type': 'morgan', 'morgan_only_radius': 2, 'morgan_only_nBits': 2048, 'num_hidden_layers': 3, 'hidden_dim_0': 128, 'hidden_dim_1': 128, 'hidden_dim_2': 512, 'kl_weight': 0.0007685605204673902, 'lr': 0.002358535825915412, 'batch_size': 32, 'dropout_rate': 0.462233891446316, 'prior_mu': 0.03385423320488098, 'prior_sigma': 0.08321635184317362, 'normalization': 'none'}. Best is trial 2426 with value: 0.515486741065979.
Generating morgan fingerprints...
Generated fingerprints with 2048 features for 900 molecules
Data shape: X=(900, 2048), y=(900,)
Trial 2524: 5-fold CV loss = 0.6135
[I 2025-08-08 06:25:20,399] Trial 2524 finished with value: 0.6134604811668396 and parameters: {'fp_type': 'rdkit', 'rdkit_only_maxPath': 6, 'rdkit_only_nBits': 256, 'num_hidden_layers': 2, 'hidden_dim_0': 512, 'hidden_dim_1': 128, 'kl_weight': 0.0006095569857092504, 'lr': 0.0019635892714231842, 'batch_size': 32, 'dropout_rate': 0.4413588372045817, 'prior_mu': 0.02826956929670957, 'prior_sigma': 0.06094821168475386, 'normalization': 'none'}. Best is trial 2426 with value: 0.515486741065979.
Generating morgan fingerprints...
Generated fingerprints with 2048 features for 900 molecules
Data shape: X=(900, 2048), y=(900,)
Trial 2531: 5-fold CV loss = 0.5622
[I 2025-08-08 06:26:31,887] Trial 2531 finished with value: 0.5621596872806549 and parameters: {'fp_type': 'morgan', 'morgan_only_radius': 2, 'morgan_only_nBits': 2048, 'num_hidden_layers': 3, 'hidden_dim_0': 512, 'hidden_dim_1': 64, 'hidden_dim_2': 256, 'kl_weight': 0.0005036965300214716, 'lr': 0.002112759701866727, 'batch_size': 32, 'dropout_rate': 0.4618308409364592, 'prior_mu': 0.081560717487606, 'prior_sigma': 0.06802730101174456, 'normalization': 'none'}. Best is trial 2426 with value: 0.515486741065979.
Generating morgan fingerprints...
Generated fingerprints with 2048 features for 900 molecules
Data shape: X=(900, 2048), y=(900,)
Trial 2530: 5-fold CV loss = 0.5381
[I 2025-08-08 06:26:33,742] Trial 2530 finished with value: 0.5380562603473663 and parameters: {'fp_type': 'morgan', 'morgan_only_radius': 2, 'morgan_only_nBits': 2048, 'num_hidden_layers': 3, 'hidden_dim_0': 128, 'hidden_dim_1': 128, 'hidden_dim_2': 512, 'kl_weight': 0.0006291715310080912, 'lr': 0.0023197038567756845, 'batch_size': 32, 'dropout_rate': 0.4603463513366306, 'prior_mu': 0.07769472125747216, 'prior_sigma': 0.0677078407680924, 'normalization': 'none'}. Best is trial 2426 with value: 0.515486741065979.
Generating morgan fingerprints...
Generated fingerprints with 2048 features for 900 molecules
Data shape: X=(900, 2048), y=(900,)
Trial 2529: 5-fold CV loss = 0.5334
[I 2025-08-08 06:27:25,245] Trial 2529 finished with value: 0.5333842694759369 and parameters: {'fp_type': 'morgan', 'morgan_only_radius': 2, 'morgan_only_nBits': 2048, 'num_hidden_layers': 3, 'hidden_dim_0': 128, 'hidden_dim_1': 128, 'hidden_dim_2': 512, 'kl_weight': 0.0005164387097590656, 'lr': 0.0023006316419826433, 'batch_size': 32, 'dropout_rate': 0.4613319709334197, 'prior_mu': 0.07515097569148592, 'prior_sigma': 0.066601983039991, 'normalization': 'none'}. Best is trial 2426 with value: 0.515486741065979.
Generating morgan fingerprints...
Generated fingerprints with 2048 features for 900 molecules
Data shape: X=(900, 2048), y=(900,)
Trial 2533: 5-fold CV loss = 0.5319
[I 2025-08-08 06:27:26,632] Trial 2533 finished with value: 0.5318528473377228 and parameters: {'fp_type': 'morgan', 'morgan_only_radius': 2, 'morgan_only_nBits': 2048, 'num_hidden_layers': 3, 'hidden_dim_0': 512, 'hidden_dim_1': 128, 'hidden_dim_2': 512, 'kl_weight': 0.0006466554550448137, 'lr': 0.002951206149531258, 'batch_size': 32, 'dropout_rate': 0.42327526568303153, 'prior_mu': 0.0711215775527928, 'prior_sigma': 0.07084650118581168, 'normalization': 'none'}. Best is trial 2426 with value: 0.515486741065979.
Generating morgan fingerprints...
Generated fingerprints with 2048 features for 900 molecules
Data shape: X=(900, 2048), y=(900,)
Trial 2534: 5-fold CV loss = 0.6225
[I 2025-08-08 06:27:55,116] Trial 2534 finished with value: 0.6224737584590911 and parameters: {'fp_type': 'morgan', 'morgan_only_radius': 2, 'morgan_only_nBits': 2048, 'num_hidden_layers': 3, 'hidden_dim_0': 512, 'hidden_dim_1': 128, 'hidden_dim_2': 512, 'kl_weight': 0.0005567670781460518, 'lr': 0.0016467683714690197, 'batch_size': 32, 'dropout_rate': 0.4219931710307497, 'prior_mu': 0.04725414552696158, 'prior_sigma': 0.07777078677537766, 'normalization': 'none'}. Best is trial 2426 with value: 0.515486741065979.
Generating morgan fingerprints...
Generated fingerprints with 2048 features for 900 molecules
Data shape: X=(900, 2048), y=(900,)
Trial 2536: 5-fold CV loss = 0.6604
[I 2025-08-08 06:28:15,631] Trial 2536 finished with value: 0.660418975353241 and parameters: {'fp_type': 'morgan', 'morgan_only_radius': 2, 'morgan_only_nBits': 2048, 'num_hidden_layers': 3, 'hidden_dim_0': 512, 'hidden_dim_1': 64, 'hidden_dim_2': 256, 'kl_weight': 0.00018613467293545136, 'lr': 0.0016879420335079193, 'batch_size': 32, 'dropout_rate': 0.4121647573903886, 'prior_mu': 0.04884795705378576, 'prior_sigma': 0.0802221941465632, 'normalization': 'none'}. Best is trial 2426 with value: 0.515486741065979.
Generating morgan fingerprints...
Generated fingerprints with 2048 features for 900 molecules
Data shape: X=(900, 2048), y=(900,)
Trial 2532: 5-fold CV loss = 0.5630
[I 2025-08-08 06:29:01,454] Trial 2532 finished with value: 0.5630442798137665 and parameters: {'fp_type': 'morgan', 'morgan_only_radius': 2, 'morgan_only_nBits': 2048, 'num_hidden_layers': 3, 'hidden_dim_0': 512, 'hidden_dim_1': 64, 'hidden_dim_2': 256, 'kl_weight': 0.04257248335012342, 'lr': 0.0021752212119059812, 'batch_size': 32, 'dropout_rate': 0.4223490586579699, 'prior_mu': 0.07915648455248338, 'prior_sigma': 0.06867823430396172, 'normalization': 'none'}. Best is trial 2426 with value: 0.515486741065979.
Generating morgan fingerprints...
Generated fingerprints with 2048 features for 900 molecules
Data shape: X=(900, 2048), y=(900,)
Trial 2538: 5-fold CV loss = 0.5466
[I 2025-08-08 06:29:38,415] Trial 2538 finished with value: 0.5466045558452606 and parameters: {'fp_type': 'morgan', 'morgan_only_radius': 2, 'morgan_only_nBits': 2048, 'num_hidden_layers': 3, 'hidden_dim_0': 512, 'hidden_dim_1': 128, 'hidden_dim_2': 128, 'kl_weight': 0.0008095832173293596, 'lr': 0.0013521872514686223, 'batch_size': 32, 'dropout_rate': 0.4505722900286075, 'prior_mu': 0.05913483226901886, 'prior_sigma': 0.055122976151094745, 'normalization': 'none'}. Best is trial 2426 with value: 0.515486741065979.
Generating morgan fingerprints...
Generated fingerprints with 2048 features for 900 molecules
Data shape: X=(900, 2048), y=(900,)
Trial 2537: 5-fold CV loss = 0.5291
[I 2025-08-08 06:29:42,671] Trial 2537 finished with value: 0.5290515899658204 and parameters: {'fp_type': 'morgan', 'morgan_only_radius': 2, 'morgan_only_nBits': 2048, 'num_hidden_layers': 3, 'hidden_dim_0': 512, 'hidden_dim_1': 64, 'hidden_dim_2': 256, 'kl_weight': 0.0008698193441067717, 'lr': 0.0020906486963034048, 'batch_size': 32, 'dropout_rate': 0.41221143114663295, 'prior_mu': 0.020233506335664547, 'prior_sigma': 0.08069261318024834, 'normalization': 'none'}. Best is trial 2426 with value: 0.515486741065979.
Generating morgan fingerprints...
Generated fingerprints with 2048 features for 900 molecules
Data shape: X=(900, 2048), y=(900,)
Trial 2535: 5-fold CV loss = 0.5413
[I 2025-08-08 06:29:47,601] Trial 2535 finished with value: 0.5412872970104218 and parameters: {'fp_type': 'morgan', 'morgan_only_radius': 2, 'morgan_only_nBits': 2048, 'num_hidden_layers': 3, 'hidden_dim_0': 512, 'hidden_dim_1': 64, 'hidden_dim_2': 512, 'kl_weight': 0.0006707446441123134, 'lr': 0.0016762976682231088, 'batch_size': 32, 'dropout_rate': 0.42363046388003117, 'prior_mu': 0.04959178350969026, 'prior_sigma': 0.07748735234566975, 'normalization': 'none'}. Best is trial 2426 with value: 0.515486741065979.
Generating morgan fingerprints...
Generated fingerprints with 2048 features for 900 molecules
Data shape: X=(900, 2048), y=(900,)
Trial 2540: 5-fold CV loss = 0.8563
[I 2025-08-08 06:29:52,494] Trial 2540 finished with value: 0.8563433527946472 and parameters: {'fp_type': 'morgan', 'morgan_only_radius': 2, 'morgan_only_nBits': 2048, 'num_hidden_layers': 3, 'hidden_dim_0': 512, 'hidden_dim_1': 128, 'hidden_dim_2': 512, 'kl_weight': 0.0006795420609684182, 'lr': 0.0018276647915345745, 'batch_size': 64, 'dropout_rate': 0.43407704289904714, 'prior_mu': 0.022663468099725203, 'prior_sigma': 0.07550116335567562, 'normalization': 'none'}. Best is trial 2426 with value: 0.515486741065979.
Generating morgan fingerprints...
Generated fingerprints with 2048 features for 900 molecules
Data shape: X=(900, 2048), y=(900,)
Trial 2541: 5-fold CV loss = 0.5295
[I 2025-08-08 06:30:31,914] Trial 2541 finished with value: 0.5294698417186737 and parameters: {'fp_type': 'morgan', 'morgan_only_radius': 2, 'morgan_only_nBits': 2048, 'num_hidden_layers': 3, 'hidden_dim_0': 512, 'hidden_dim_1': 128, 'hidden_dim_2': 512, 'kl_weight': 0.0002981389245013743, 'lr': 0.0034227127972447763, 'batch_size': 64, 'dropout_rate': 0.4363118501541954, 'prior_mu': 0.03191691084242644, 'prior_sigma': 0.07466200052927749, 'normalization': 'none'}. Best is trial 2426 with value: 0.515486741065979.
Generating morgan fingerprints...
Generated fingerprints with 2048 features for 900 molecules
Data shape: X=(900, 2048), y=(900,)
Trial 2542: 5-fold CV loss = 0.6770
[I 2025-08-08 06:30:49,145] Trial 2542 finished with value: 0.677023959159851 and parameters: {'fp_type': 'morgan', 'morgan_only_radius': 2, 'morgan_only_nBits': 2048, 'num_hidden_layers': 3, 'hidden_dim_0': 512, 'hidden_dim_1': 128, 'hidden_dim_2': 512, 'kl_weight': 0.00029310870050410447, 'lr': 0.002624684492638206, 'batch_size': 64, 'dropout_rate': 0.2203263499204279, 'prior_mu': 0.03325365168739161, 'prior_sigma': 0.19076376589702465, 'normalization': 'none'}. Best is trial 2426 with value: 0.515486741065979.
Generating morgan fingerprints...
Generated fingerprints with 2048 features for 900 molecules
Data shape: X=(900, 2048), y=(900,)
Trial 2543: 5-fold CV loss = 0.5284
[I 2025-08-08 06:30:55,853] Trial 2543 finished with value: 0.5283844411373139 and parameters: {'fp_type': 'morgan', 'morgan_only_radius': 2, 'morgan_only_nBits': 2048, 'num_hidden_layers': 3, 'hidden_dim_0': 512, 'hidden_dim_1': 128, 'hidden_dim_2': 512, 'kl_weight': 0.0005333021488269744, 'lr': 0.002642375905468145, 'batch_size': 32, 'dropout_rate': 0.2780943818571568, 'prior_mu': 0.03303849839647913, 'prior_sigma': 0.07273388244540445, 'normalization': 'none'}. Best is trial 2426 with value: 0.515486741065979.
Generating morgan fingerprints...
Generated fingerprints with 2048 features for 900 molecules
Data shape: X=(900, 2048), y=(900,)
Trial 2539: 5-fold CV loss = 0.6031
[I 2025-08-08 06:31:39,207] Trial 2539 finished with value: 0.6031060814857483 and parameters: {'fp_type': 'morgan', 'morgan_only_radius': 2, 'morgan_only_nBits': 2048, 'num_hidden_layers': 3, 'hidden_dim_0': 512, 'hidden_dim_1': 128, 'hidden_dim_2': 128, 'kl_weight': 0.0008175862165069743, 'lr': 0.001826518728808918, 'batch_size': 32, 'dropout_rate': 0.4506315479163705, 'prior_mu': 0.020686080327730862, 'prior_sigma': 0.05528123785168343, 'normalization': 'none'}. Best is trial 2426 with value: 0.515486741065979.
Generating morgan fingerprints...
Generated fingerprints with 2048 features for 900 molecules
Data shape: X=(900, 2048), y=(900,)
Trial 2546: 5-fold CV loss = 0.7669
[I 2025-08-08 06:31:58,934] Trial 2546 finished with value: 0.7669310569763184 and parameters: {'fp_type': 'morgan', 'morgan_only_radius': 3, 'morgan_only_nBits': 2048, 'num_hidden_layers': 3, 'hidden_dim_0': 512, 'hidden_dim_1': 1024, 'hidden_dim_2': 512, 'kl_weight': 0.0007677167656517234, 'lr': 0.0024010524759535425, 'batch_size': 32, 'dropout_rate': 0.3985074268924359, 'prior_mu': 0.05831518601706072, 'prior_sigma': 0.059074516462816896, 'normalization': 'none'}. Best is trial 2426 with value: 0.515486741065979.
Generating morgan fingerprints...
Generated fingerprints with 2048 features for 900 molecules
Data shape: X=(900, 2048), y=(900,)
Trial 2544: 5-fold CV loss = 5.5377
[I 2025-08-08 06:32:02,734] Trial 2544 finished with value: 5.537668895721436 and parameters: {'fp_type': 'morgan', 'morgan_only_radius': 2, 'morgan_only_nBits': 2048, 'num_hidden_layers': 3, 'hidden_dim_0': 512, 'hidden_dim_1': 1024, 'hidden_dim_2': 512, 'kl_weight': 0.0007944518549531367, 'lr': 0.0007380373456806619, 'batch_size': 32, 'dropout_rate': 0.4475536307770223, 'prior_mu': 0.03925950220144297, 'prior_sigma': 0.1921989771230015, 'normalization': 'none'}. Best is trial 2426 with value: 0.515486741065979.
Generating morgan fingerprints...
Generated fingerprints with 2048 features for 900 molecules
Data shape: X=(900, 2048), y=(900,)
Trial 2545: 5-fold CV loss = 0.5369
[I 2025-08-08 06:32:25,473] Trial 2545 finished with value: 0.5369158804416656 and parameters: {'fp_type': 'morgan', 'morgan_only_radius': 3, 'morgan_only_nBits': 2048, 'num_hidden_layers': 3, 'hidden_dim_0': 512, 'hidden_dim_1': 128, 'hidden_dim_2': 512, 'kl_weight': 0.00041492449485528994, 'lr': 0.002431780445613223, 'batch_size': 32, 'dropout_rate': 0.3964152935530575, 'prior_mu': 0.059405662763535316, 'prior_sigma': 0.05876984630425257, 'normalization': 'none'}. Best is trial 2426 with value: 0.515486741065979.
Generating morgan fingerprints...
Generated fingerprints with 2048 features for 900 molecules
Data shape: X=(900, 2048), y=(900,)
Trial 2548: 5-fold CV loss = 0.5489
[I 2025-08-08 06:33:03,132] Trial 2548 finished with value: 0.5488730132579803 and parameters: {'fp_type': 'morgan', 'morgan_only_radius': 2, 'morgan_only_nBits': 2048, 'num_hidden_layers': 3, 'hidden_dim_0': 512, 'hidden_dim_1': 128, 'hidden_dim_2': 512, 'kl_weight': 0.0003840303740418102, 'lr': 0.002085102267718811, 'batch_size': 32, 'dropout_rate': 0.44530040812604177, 'prior_mu': 0.038688245972167634, 'prior_sigma': 0.06178648000808988, 'normalization': 'none'}. Best is trial 2426 with value: 0.515486741065979.
Generating morgan fingerprints...
Generated fingerprints with 2048 features for 900 molecules
Data shape: X=(900, 2048), y=(900,)
Trial 2549: 5-fold CV loss = 0.5863
[I 2025-08-08 06:33:10,711] Trial 2549 finished with value: 0.5862732052803039 and parameters: {'fp_type': 'morgan', 'morgan_only_radius': 2, 'morgan_only_nBits': 2048, 'num_hidden_layers': 3, 'hidden_dim_0': 512, 'hidden_dim_1': 128, 'hidden_dim_2': 256, 'kl_weight': 0.01656760442228281, 'lr': 0.0021109275017756344, 'batch_size': 32, 'dropout_rate': 0.4054841333578737, 'prior_mu': 0.10567079492659935, 'prior_sigma': 0.06411672812469234, 'normalization': 'none'}. Best is trial 2426 with value: 0.515486741065979.
Generating morgan fingerprints...
Generated fingerprints with 2048 features for 900 molecules
Data shape: X=(900, 2048), y=(900,)
Trial 2550: 5-fold CV loss = 0.5680
