[I 2025-08-08 07:15:40,667] Trial 2676 finished with value: 1.4468986988067627 and parameters: {'fp_type': 'morgan', 'morgan_only_radius': 2, 'morgan_only_nBits': 2048, 'num_hidden_layers': 3, 'hidden_dim_0': 512, 'hidden_dim_1': 1024, 'hidden_dim_2': 512, 'kl_weight': 0.001117777565981006, 'lr': 0.002071440407643271, 'batch_size': 32, 'dropout_rate': 0.4538027524533307, 'prior_mu': 0.023634798813294278, 'prior_sigma': 0.08334924877382911, 'normalization': 'none'}. Best is trial 2426 with value: 0.515486741065979.
Generating morgan fingerprints...
Generated fingerprints with 2048 features for 900 molecules
Data shape: X=(900, 2048), y=(900,)
Trial 2677: 5-fold CV loss = 0.5433
[I 2025-08-08 07:16:17,842] Trial 2677 finished with value: 0.5433112144470215 and parameters: {'fp_type': 'morgan', 'morgan_only_radius': 2, 'morgan_only_nBits': 2048, 'num_hidden_layers': 3, 'hidden_dim_0': 512, 'hidden_dim_1': 128, 'hidden_dim_2': 512, 'kl_weight': 0.0010926259742586582, 'lr': 0.0038866448650016474, 'batch_size': 32, 'dropout_rate': 0.40259597599458924, 'prior_mu': 0.04769844278220267, 'prior_sigma': 0.08167120086485223, 'normalization': 'layer'}. Best is trial 2426 with value: 0.515486741065979.
Generating morgan fingerprints...
Generated fingerprints with 2048 features for 900 molecules
Data shape: X=(900, 2048), y=(900,)
Trial 2678: 5-fold CV loss = 0.5371
[I 2025-08-08 07:16:19,443] Trial 2678 finished with value: 0.5371464431285858 and parameters: {'fp_type': 'morgan', 'morgan_only_radius': 2, 'morgan_only_nBits': 2048, 'num_hidden_layers': 3, 'hidden_dim_0': 1024, 'hidden_dim_1': 128, 'hidden_dim_2': 512, 'kl_weight': 0.0005232479496625526, 'lr': 0.0020755075909221436, 'batch_size': 32, 'dropout_rate': 0.45249232272792084, 'prior_mu': 0.049738561936108414, 'prior_sigma': 0.05396534234580247, 'normalization': 'layer'}. Best is trial 2426 with value: 0.515486741065979.
Generating morgan fingerprints...
Generated fingerprints with 2048 features for 900 molecules
Data shape: X=(900, 2048), y=(900,)
Trial 2681: 5-fold CV loss = 1.0307
[I 2025-08-08 07:16:34,196] Trial 2681 finished with value: 1.0307267427444458 and parameters: {'fp_type': 'morgan', 'morgan_only_radius': 2, 'morgan_only_nBits': 2048, 'num_hidden_layers': 3, 'hidden_dim_0': 512, 'hidden_dim_1': 512, 'hidden_dim_2': 1024, 'kl_weight': 0.0007584198914499578, 'lr': 0.0017918326630541352, 'batch_size': 64, 'dropout_rate': 0.4350292962190914, 'prior_mu': 0.03693066931766377, 'prior_sigma': 0.06814563365663326, 'normalization': 'none'}. Best is trial 2426 with value: 0.515486741065979.
Generating morgan fingerprints...
Generated fingerprints with 2048 features for 900 molecules
Data shape: X=(900, 2048), y=(900,)
Trial 2680: 5-fold CV loss = 0.8959
[I 2025-08-08 07:16:45,222] Trial 2680 finished with value: 0.8959444761276245 and parameters: {'fp_type': 'morgan', 'morgan_only_radius': 2, 'morgan_only_nBits': 2048, 'num_hidden_layers': 3, 'hidden_dim_0': 1024, 'hidden_dim_1': 512, 'hidden_dim_2': 1024, 'kl_weight': 0.0005216695487496107, 'lr': 0.001829215529285457, 'batch_size': 64, 'dropout_rate': 0.4228935194528777, 'prior_mu': -0.11934341450463068, 'prior_sigma': 0.06854089743635476, 'normalization': 'none'}. Best is trial 2426 with value: 0.515486741065979.
Generating morgan fingerprints...
Generated fingerprints with 2048 features for 900 molecules
Data shape: X=(900, 2048), y=(900,)
Trial 2671: 5-fold CV loss = 0.5242
[I 2025-08-08 07:16:59,061] Trial 2671 finished with value: 0.5241955280303955 and parameters: {'fp_type': 'morgan', 'morgan_only_radius': 2, 'morgan_only_nBits': 2048, 'num_hidden_layers': 3, 'hidden_dim_0': 512, 'hidden_dim_1': 128, 'hidden_dim_2': 512, 'kl_weight': 0.00024655772552281403, 'lr': 0.002681136189823113, 'batch_size': 32, 'dropout_rate': 0.43267721193620945, 'prior_mu': 0.05542184340909245, 'prior_sigma': 0.060880888841738444, 'normalization': 'none'}. Best is trial 2426 with value: 0.515486741065979.
Generating morgan fingerprints...
Generated fingerprints with 2048 features for 900 molecules
Data shape: X=(900, 2048), y=(900,)
Trial 2679: 5-fold CV loss = 0.5377
[I 2025-08-08 07:17:33,385] Trial 2679 finished with value: 0.5376841306686402 and parameters: {'fp_type': 'morgan', 'morgan_only_radius': 2, 'morgan_only_nBits': 2048, 'num_hidden_layers': 3, 'hidden_dim_0': 128, 'hidden_dim_1': 128, 'hidden_dim_2': 64, 'kl_weight': 0.000508752671637086, 'lr': 0.001783858407264345, 'batch_size': 32, 'dropout_rate': 0.3958611064478414, 'prior_mu': 0.04719786978222219, 'prior_sigma': 0.06914672983871299, 'normalization': 'layer'}. Best is trial 2426 with value: 0.515486741065979.
Generating morgan fingerprints...
Generated fingerprints with 2048 features for 900 molecules
Data shape: X=(900, 2048), y=(900,)
Trial 2684: 5-fold CV loss = 0.6972
[I 2025-08-08 07:17:42,031] Trial 2684 finished with value: 0.6972020626068115 and parameters: {'fp_type': 'morgan', 'morgan_only_radius': 2, 'morgan_only_nBits': 2048, 'num_hidden_layers': 0, 'kl_weight': 0.0008949388706721391, 'lr': 0.004931245295443836, 'batch_size': 32, 'dropout_rate': 0.46514118336273313, 'prior_mu': 0.038671956773778424, 'prior_sigma': 0.07558526519991667, 'normalization': 'none'}. Best is trial 2426 with value: 0.515486741065979.
Generating morgan fingerprints...
Generated fingerprints with 2048 features for 900 molecules
Data shape: X=(900, 2048), y=(900,)
Trial 2682: 5-fold CV loss = 0.5447
[I 2025-08-08 07:17:42,933] Trial 2682 finished with value: 0.5447337925434113 and parameters: {'fp_type': 'morgan', 'morgan_only_radius': 2, 'morgan_only_nBits': 2048, 'num_hidden_layers': 3, 'hidden_dim_0': 128, 'hidden_dim_1': 128, 'hidden_dim_2': 64, 'kl_weight': 0.0005788985061729006, 'lr': 0.002655682353930045, 'batch_size': 32, 'dropout_rate': 0.42545631089304375, 'prior_mu': 0.03943586989671123, 'prior_sigma': 0.07062935055713841, 'normalization': 'none'}. Best is trial 2426 with value: 0.515486741065979.
Generating morgan fingerprints...
Generated fingerprints with 2048 features for 900 molecules
Data shape: X=(900, 2048), y=(900,)
Trial 2683: 5-fold CV loss = 0.5489
[I 2025-08-08 07:18:20,974] Trial 2683 finished with value: 0.548882657289505 and parameters: {'fp_type': 'morgan', 'morgan_only_radius': 2, 'morgan_only_nBits': 2048, 'num_hidden_layers': 3, 'hidden_dim_0': 128, 'hidden_dim_1': 128, 'hidden_dim_2': 256, 'kl_weight': 0.0007271131307991127, 'lr': 0.002576529053822377, 'batch_size': 32, 'dropout_rate': 0.4664588626418617, 'prior_mu': 0.038370983297122976, 'prior_sigma': 0.08795781465674199, 'normalization': 'none'}. Best is trial 2426 with value: 0.515486741065979.
Generating morgan fingerprints...
Generated fingerprints with 2048 features for 900 molecules
Data shape: X=(900, 2048), y=(900,)
Trial 2688: 5-fold CV loss = 0.7246
[I 2025-08-08 07:18:57,652] Trial 2688 finished with value: 0.7245993852615357 and parameters: {'fp_type': 'morgan', 'morgan_only_radius': 3, 'morgan_only_nBits': 2048, 'num_hidden_layers': 2, 'hidden_dim_0': 512, 'hidden_dim_1': 64, 'kl_weight': 0.0004380357510173531, 'lr': 0.002164595166835525, 'batch_size': 32, 'dropout_rate': 0.3774529873713207, 'prior_mu': 0.02908327526481575, 'prior_sigma': 0.07533497273960837, 'normalization': 'none'}. Best is trial 2426 with value: 0.515486741065979.
Generating morgan fingerprints...
Generated fingerprints with 2048 features for 900 molecules
Data shape: X=(900, 2048), y=(900,)
Trial 2687: 5-fold CV loss = 0.5290
[I 2025-08-08 07:19:13,845] Trial 2687 finished with value: 0.5290029764175415 and parameters: {'fp_type': 'morgan', 'morgan_only_radius': 3, 'morgan_only_nBits': 2048, 'num_hidden_layers': 3, 'hidden_dim_0': 512, 'hidden_dim_1': 64, 'hidden_dim_2': 256, 'kl_weight': 0.0007246219675940706, 'lr': 0.002174733445007288, 'batch_size': 32, 'dropout_rate': 0.4446683320951179, 'prior_mu': 0.02863826275307589, 'prior_sigma': 0.073718595073412, 'normalization': 'none'}. Best is trial 2426 with value: 0.515486741065979.
Generating morgan fingerprints...
Generated fingerprints with 2048 features for 900 molecules
Data shape: X=(900, 2048), y=(900,)
Trial 2685: 5-fold CV loss = 0.5335
[I 2025-08-08 07:19:50,278] Trial 2685 finished with value: 0.5334940135478974 and parameters: {'fp_type': 'morgan', 'morgan_only_radius': 2, 'morgan_only_nBits': 2048, 'num_hidden_layers': 3, 'hidden_dim_0': 512, 'hidden_dim_1': 64, 'hidden_dim_2': 256, 'kl_weight': 0.0009066568159259768, 'lr': 0.0021960152775859737, 'batch_size': 32, 'dropout_rate': 0.46683022231386034, 'prior_mu': 0.03527511827483755, 'prior_sigma': 0.0882042752914478, 'normalization': 'none'}. Best is trial 2426 with value: 0.515486741065979.
Generating morgan fingerprints...
Generated fingerprints with 2048 features for 900 molecules
Data shape: X=(900, 2048), y=(900,)
Trial 2689: 5-fold CV loss = 0.5481
[I 2025-08-08 07:20:12,171] Trial 2689 finished with value: 0.548065847158432 and parameters: {'fp_type': 'morgan', 'morgan_only_radius': 2, 'morgan_only_nBits': 2048, 'num_hidden_layers': 3, 'hidden_dim_0': 512, 'hidden_dim_1': 64, 'hidden_dim_2': 256, 'kl_weight': 0.0007080255618695013, 'lr': 0.001997470092956599, 'batch_size': 32, 'dropout_rate': 0.4433598359960121, 'prior_mu': 0.06794987773363118, 'prior_sigma': 0.05194247710886487, 'normalization': 'none'}. Best is trial 2426 with value: 0.515486741065979.
Generating morgan fingerprints...
Generated fingerprints with 2048 features for 900 molecules
Data shape: X=(900, 2048), y=(900,)
Trial 2690: 5-fold CV loss = 0.5275
[I 2025-08-08 07:20:41,421] Trial 2690 finished with value: 0.5275167226791382 and parameters: {'fp_type': 'morgan', 'morgan_only_radius': 2, 'morgan_only_nBits': 2048, 'num_hidden_layers': 3, 'hidden_dim_0': 512, 'hidden_dim_1': 128, 'hidden_dim_2': 512, 'kl_weight': 0.000621565403550433, 'lr': 0.001998909132899771, 'batch_size': 32, 'dropout_rate': 0.4389604041872337, 'prior_mu': 0.06842024194281443, 'prior_sigma': 0.06446141040371106, 'normalization': 'none'}. Best is trial 2426 with value: 0.515486741065979.
Generating morgan fingerprints...
Generated fingerprints with 2048 features for 900 molecules
Data shape: X=(900, 2048), y=(900,)
Trial 2693: 5-fold CV loss = 0.6647
[I 2025-08-08 07:21:10,322] Trial 2693 finished with value: 0.66473890542984 and parameters: {'fp_type': 'morgan', 'morgan_only_radius': 2, 'morgan_only_nBits': 2048, 'num_hidden_layers': 3, 'hidden_dim_0': 512, 'hidden_dim_1': 128, 'hidden_dim_2': 512, 'kl_weight': 0.00018782407257580348, 'lr': 0.0013358343231673244, 'batch_size': 32, 'dropout_rate': 0.4147166348475204, 'prior_mu': 0.05708127019431025, 'prior_sigma': 0.06524287498342003, 'normalization': 'none'}. Best is trial 2426 with value: 0.515486741065979.
Generating rdkit fingerprints...
Generated fingerprints with 256 features for 900 molecules
Data shape: X=(900, 256), y=(900,)
Trial 2692: 5-fold CV loss = 0.5781
[I 2025-08-08 07:21:40,367] Trial 2692 finished with value: 0.5781446278095246 and parameters: {'fp_type': 'morgan', 'morgan_only_radius': 2, 'morgan_only_nBits': 2048, 'num_hidden_layers': 3, 'hidden_dim_0': 512, 'hidden_dim_1': 128, 'hidden_dim_2': 512, 'kl_weight': 0.0006086188039537251, 'lr': 0.0016174043234270016, 'batch_size': 32, 'dropout_rate': 0.4125920385723198, 'prior_mu': 0.018743042090136965, 'prior_sigma': 0.06567719353574154, 'normalization': 'none'}. Best is trial 2426 with value: 0.515486741065979.
Generating morgan fingerprints...
Generated fingerprints with 2048 features for 900 molecules
Data shape: X=(900, 2048), y=(900,)
Trial 2686: 5-fold CV loss = 0.5522
[I 2025-08-08 07:22:05,678] Trial 2686 finished with value: 0.5522089660167694 and parameters: {'fp_type': 'morgan', 'morgan_only_radius': 2, 'morgan_only_nBits': 2048, 'num_hidden_layers': 3, 'hidden_dim_0': 512, 'hidden_dim_1': 64, 'hidden_dim_2': 256, 'kl_weight': 0.0007436490788192003, 'lr': 0.0021625456586543868, 'batch_size': 32, 'dropout_rate': 0.4435720714370366, 'prior_mu': 0.03150421769788556, 'prior_sigma': 0.07305675941467564, 'normalization': 'none'}. Best is trial 2426 with value: 0.515486741065979.
Generating morgan fingerprints...
Generated fingerprints with 2048 features for 900 molecules
Data shape: X=(900, 2048), y=(900,)
Trial 2694: 5-fold CV loss = 0.6244
[I 2025-08-08 07:22:16,697] Trial 2694 finished with value: 0.6244369983673096 and parameters: {'fp_type': 'rdkit', 'rdkit_only_maxPath': 5, 'rdkit_only_nBits': 256, 'num_hidden_layers': 3, 'hidden_dim_0': 512, 'hidden_dim_1': 128, 'hidden_dim_2': 512, 'kl_weight': 0.0008215139544542156, 'lr': 0.0015591714305978528, 'batch_size': 32, 'dropout_rate': 0.4233956600023194, 'prior_mu': 0.18961338786461518, 'prior_sigma': 0.05658983010198758, 'normalization': 'none'}. Best is trial 2426 with value: 0.515486741065979.
Generating morgan fingerprints...
Generated fingerprints with 2048 features for 900 molecules
Data shape: X=(900, 2048), y=(900,)
Trial 2691: 5-fold CV loss = 0.5245
[I 2025-08-08 07:22:21,977] Trial 2691 finished with value: 0.5245400607585907 and parameters: {'fp_type': 'morgan', 'morgan_only_radius': 2, 'morgan_only_nBits': 2048, 'num_hidden_layers': 3, 'hidden_dim_0': 512, 'hidden_dim_1': 128, 'hidden_dim_2': 512, 'kl_weight': 0.00018534718857683501, 'lr': 0.0019295159594719072, 'batch_size': 32, 'dropout_rate': 0.43880013711199223, 'prior_mu': 0.06974164832204498, 'prior_sigma': 0.0643926097965214, 'normalization': 'none'}. Best is trial 2426 with value: 0.515486741065979.
Generating morgan fingerprints...
Generated fingerprints with 2048 features for 900 molecules
Data shape: X=(900, 2048), y=(900,)
Trial 2695: 5-fold CV loss = 0.5336
[I 2025-08-08 07:22:45,407] Trial 2695 finished with value: 0.5336422741413116 and parameters: {'fp_type': 'morgan', 'morgan_only_radius': 2, 'morgan_only_nBits': 2048, 'num_hidden_layers': 3, 'hidden_dim_0': 512, 'hidden_dim_1': 128, 'hidden_dim_2': 512, 'kl_weight': 0.00038416246373917755, 'lr': 0.002869147972954871, 'batch_size': 32, 'dropout_rate': 0.42379051862384154, 'prior_mu': 0.04566323601861906, 'prior_sigma': 0.07142157040507761, 'normalization': 'none'}. Best is trial 2426 with value: 0.515486741065979.
Generating morgan fingerprints...
Generated fingerprints with 2048 features for 900 molecules
Data shape: X=(900, 2048), y=(900,)
Trial 2697: 5-fold CV loss = 0.5416
[I 2025-08-08 07:23:15,526] Trial 2697 finished with value: 0.5416016042232513 and parameters: {'fp_type': 'morgan', 'morgan_only_radius': 2, 'morgan_only_nBits': 2048, 'num_hidden_layers': 3, 'hidden_dim_0': 256, 'hidden_dim_1': 128, 'hidden_dim_2': 512, 'kl_weight': 0.0005886021240106668, 'lr': 0.0028233415770771487, 'batch_size': 64, 'dropout_rate': 0.45481487695907513, 'prior_mu': 0.04849905226700638, 'prior_sigma': 0.07098273002214783, 'normalization': 'none'}. Best is trial 2426 with value: 0.515486741065979.
Generating morgan_rdkit fingerprints...
Generated fingerprints with 1024 features for 900 molecules
Data shape: X=(900, 1024), y=(900,)
Trial 2699: 5-fold CV loss = 0.6514
[I 2025-08-08 07:23:16,987] Trial 2699 finished with value: 0.6513931274414062 and parameters: {'fp_type': 'morgan', 'morgan_only_radius': 2, 'morgan_only_nBits': 2048, 'num_hidden_layers': 3, 'hidden_dim_0': 256, 'hidden_dim_1': 128, 'hidden_dim_2': 128, 'kl_weight': 0.000460534849783299, 'lr': 0.0024267591567512436, 'batch_size': 64, 'dropout_rate': 0.45686983800758874, 'prior_mu': 0.052492545093730934, 'prior_sigma': 0.021491795413674075, 'normalization': 'none'}. Best is trial 2426 with value: 0.515486741065979.
Generating morgan fingerprints...
Generated fingerprints with 2048 features for 900 molecules
Data shape: X=(900, 2048), y=(900,)
Trial 2698: 5-fold CV loss = 0.6032
[I 2025-08-08 07:23:41,384] Trial 2698 finished with value: 0.6031904876232147 and parameters: {'fp_type': 'morgan', 'morgan_only_radius': 2, 'morgan_only_nBits': 2048, 'num_hidden_layers': 3, 'hidden_dim_0': 256, 'hidden_dim_1': 128, 'hidden_dim_2': 512, 'kl_weight': 0.0004013493982405201, 'lr': 0.002370486639567981, 'batch_size': 64, 'dropout_rate': 0.450638620971455, 'prior_mu': 0.047695867135822245, 'prior_sigma': 0.07770882855075692, 'normalization': 'none'}. Best is trial 2426 with value: 0.515486741065979.
Generating morgan_rdkit fingerprints...
Generated fingerprints with 1024 features for 900 molecules
Data shape: X=(900, 1024), y=(900,)
Trial 2696: 5-fold CV loss = 0.7061
[I 2025-08-08 07:23:52,371] Trial 2696 finished with value: 0.7061322093009949 and parameters: {'fp_type': 'morgan', 'morgan_only_radius': 2, 'morgan_only_nBits': 2048, 'num_hidden_layers': 3, 'hidden_dim_0': 256, 'hidden_dim_1': 128, 'hidden_dim_2': 512, 'kl_weight': 0.0008555222790466648, 'lr': 0.0024290353842577133, 'batch_size': 64, 'dropout_rate': 0.4562826274871542, 'prior_mu': 0.010993026432165817, 'prior_sigma': 0.057599244820163854, 'normalization': 'none'}. Best is trial 2426 with value: 0.515486741065979.
Generating morgan fingerprints...
Generated fingerprints with 2048 features for 900 molecules
Data shape: X=(900, 2048), y=(900,)
Trial 2700: 5-fold CV loss = 0.6097
[I 2025-08-08 07:24:05,457] Trial 2700 finished with value: 0.6097005724906921 and parameters: {'fp_type': 'morgan_rdkit', 'combined_morgan_radius': 3, 'combined_morgan_nBits': 512, 'combined_rdkit_maxPath': 6, 'combined_rdkit_nBits': 512, 'num_hidden_layers': 3, 'hidden_dim_0': 512, 'hidden_dim_1': 128, 'hidden_dim_2': 128, 'kl_weight': 0.0008574019003054088, 'lr': 0.0024593706430146296, 'batch_size': 32, 'dropout_rate': 0.4547169279334815, 'prior_mu': 0.05710412371982568, 'prior_sigma': 0.07826171581938204, 'normalization': 'none'}. Best is trial 2426 with value: 0.515486741065979.
Generating morgan fingerprints...
Generated fingerprints with 2048 features for 900 molecules
Data shape: X=(900, 2048), y=(900,)
Trial 2701: 5-fold CV loss = 0.5233
[I 2025-08-08 07:24:52,367] Trial 2701 finished with value: 0.5232967555522918 and parameters: {'fp_type': 'morgan', 'morgan_only_radius': 2, 'morgan_only_nBits': 2048, 'num_hidden_layers': 3, 'hidden_dim_0': 512, 'hidden_dim_1': 128, 'hidden_dim_2': 512, 'kl_weight': 0.0008417841193937275, 'lr': 0.0018715581816018125, 'batch_size': 32, 'dropout_rate': 0.40175476271522004, 'prior_mu': 0.011685891270485443, 'prior_sigma': 0.07800456559129791, 'normalization': 'none'}. Best is trial 2426 with value: 0.515486741065979.
Generating morgan fingerprints...
Generated fingerprints with 2048 features for 900 molecules
Data shape: X=(900, 2048), y=(900,)
Trial 2702: 5-fold CV loss = 0.6009
[I 2025-08-08 07:25:23,646] Trial 2702 finished with value: 0.6009358048439026 and parameters: {'fp_type': 'morgan_rdkit', 'combined_morgan_radius': 3, 'combined_morgan_nBits': 512, 'combined_rdkit_maxPath': 6, 'combined_rdkit_nBits': 512, 'num_hidden_layers': 3, 'hidden_dim_0': 512, 'hidden_dim_1': 128, 'hidden_dim_2': 512, 'kl_weight': 0.0008493012545679431, 'lr': 0.0019436265172788057, 'batch_size': 32, 'dropout_rate': 0.4044638245288203, 'prior_mu': 0.018261653492592508, 'prior_sigma': 0.06793111672639128, 'normalization': 'none'}. Best is trial 2426 with value: 0.515486741065979.
Generating morgan fingerprints...
Generated fingerprints with 2048 features for 900 molecules
Data shape: X=(900, 2048), y=(900,)
Trial 2704: 5-fold CV loss = 0.5230
[I 2025-08-08 07:25:29,938] Trial 2704 finished with value: 0.5229859232902527 and parameters: {'fp_type': 'morgan', 'morgan_only_radius': 2, 'morgan_only_nBits': 2048, 'num_hidden_layers': 3, 'hidden_dim_0': 512, 'hidden_dim_1': 64, 'hidden_dim_2': 512, 'kl_weight': 0.0006460505787118079, 'lr': 0.0019241648110959902, 'batch_size': 32, 'dropout_rate': 0.4069211787323134, 'prior_mu': 0.062219206385209315, 'prior_sigma': 0.06821400870541003, 'normalization': 'none'}. Best is trial 2426 with value: 0.515486741065979.
Generating morgan fingerprints...
Generated fingerprints with 2048 features for 900 molecules
Data shape: X=(900, 2048), y=(900,)
Trial 2707: 5-fold CV loss = 0.6403
[I 2025-08-08 07:26:13,658] Trial 2707 finished with value: 0.6403378844261169 and parameters: {'fp_type': 'morgan', 'morgan_only_radius': 2, 'morgan_only_nBits': 2048, 'num_hidden_layers': 3, 'hidden_dim_0': 512, 'hidden_dim_1': 64, 'hidden_dim_2': 256, 'kl_weight': 0.00048366820537644727, 'lr': 0.0017166216239281357, 'batch_size': 32, 'dropout_rate': 0.4323645893673428, 'prior_mu': 0.040703673624176054, 'prior_sigma': 0.06201209801786598, 'normalization': 'none'}. Best is trial 2426 with value: 0.515486741065979.
Generating morgan fingerprints...
Generated fingerprints with 2048 features for 900 molecules
Data shape: X=(900, 2048), y=(900,)
Trial 2705: 5-fold CV loss = 0.5598
[I 2025-08-08 07:26:17,199] Trial 2705 finished with value: 0.5597565174102783 and parameters: {'fp_type': 'morgan', 'morgan_only_radius': 2, 'morgan_only_nBits': 2048, 'num_hidden_layers': 3, 'hidden_dim_0': 512, 'hidden_dim_1': 64, 'hidden_dim_2': 512, 'kl_weight': 0.0005513749076936069, 'lr': 0.0017221629786379105, 'batch_size': 32, 'dropout_rate': 0.3868032791845509, 'prior_mu': 0.03995871053990771, 'prior_sigma': 0.06786532880528351, 'normalization': 'none'}. Best is trial 2426 with value: 0.515486741065979.
Generating morgan fingerprints...
Generated fingerprints with 2048 features for 900 molecules
Data shape: X=(900, 2048), y=(900,)
Trial 2708: 5-fold CV loss = 0.5205
