Using device: cuda
Starting comprehensive hyperparameter optimization with 5-fold CV...
Testing fingerprint types:
- Morgan (radius 2-3, nBits 1024/2048)
- RDKit (maxPath 5-8, nBits 256/512/1024)
- Morgan+RDKit combined
- Architecture: 0-3 hidden layers
- Cross-validation: 5-fold
Generating morgan_rdkit fingerprints...
Generating morgan_rdkit fingerprints...
Generating morgan fingerprints...
Generating morgan fingerprints...
Generated fingerprints with 1024 features for 900 molecules
Data shape: X=(900, 1024), y=(900,)
Generated fingerprints with 1024 features for 900 molecules
Data shape: X=(900, 1024), y=(900,)
Generated fingerprints with 2048 features for 900 molecules
Data shape: X=(900, 2048), y=(900,)
Generated fingerprints with 1536 features for 900 molecules
Data shape: X=(900, 1536), y=(900,)
Trial 1: 5-fold CV loss = 0.9863
[I 2025-08-07 16:02:39,571] Trial 1 finished with value: 0.9862967371940613 and parameters: {'fp_type': 'morgan_rdkit', 'combined_morgan_radius': 2, 'combined_morgan_nBits': 1024, 'combined_rdkit_maxPath': 8, 'combined_rdkit_nBits': 512, 'num_hidden_layers': 3, 'hidden_dim_0': 64, 'hidden_dim_1': 1024, 'hidden_dim_2': 512, 'kl_weight': 0.009758209311993655, 'lr': 0.0081461195371908, 'batch_size': 128, 'dropout_rate': 0.26119789181534175, 'prior_mu': 0.08214119375755113, 'prior_sigma': 0.010014003461083129, 'normalization': 'none'}. Best is trial 1 with value: 0.9862967371940613.
Generating morgan fingerprints...
Generated fingerprints with 2048 features for 900 molecules
Data shape: X=(900, 2048), y=(900,)
Trial 2: 5-fold CV loss = 0.6323
[I 2025-08-07 16:02:46,024] Trial 2 finished with value: 0.6323150634765625 and parameters: {'fp_type': 'morgan', 'morgan_only_radius': 3, 'morgan_only_nBits': 2048, 'num_hidden_layers': 2, 'hidden_dim_0': 128, 'hidden_dim_1': 1024, 'kl_weight': 0.03080967507315127, 'lr': 0.0046485861850122205, 'batch_size': 64, 'dropout_rate': 0.3382410545625206, 'prior_mu': 0.12042215804596873, 'prior_sigma': 0.057623990561710615, 'normalization': 'layer'}. Best is trial 2 with value: 0.6323150634765625.
Generating morgan fingerprints...
Generated fingerprints with 2048 features for 900 molecules
Data shape: X=(900, 2048), y=(900,)
Trial 0: 5-fold CV loss = 0.7503
[I 2025-08-07 16:03:00,412] Trial 0 finished with value: 0.7503278017044067 and parameters: {'fp_type': 'morgan', 'morgan_only_radius': 3, 'morgan_only_nBits': 1024, 'num_hidden_layers': 0, 'kl_weight': 0.00013371344335901024, 'lr': 0.0022397093293393786, 'batch_size': 32, 'dropout_rate': 0.4638096438707539, 'prior_mu': -0.08954386996738278, 'prior_sigma': 0.09544085525089113, 'normalization': 'layer'}. Best is trial 2 with value: 0.6323150634765625.
Generating rdkit fingerprints...
Generated fingerprints with 512 features for 900 molecules
Data shape: X=(900, 512), y=(900,)
Trial 5: 5-fold CV loss = 0.5665
[I 2025-08-07 16:03:08,224] Trial 5 finished with value: 0.5665355861186981 and parameters: {'fp_type': 'morgan', 'morgan_only_radius': 2, 'morgan_only_nBits': 2048, 'num_hidden_layers': 3, 'hidden_dim_0': 1024, 'hidden_dim_1': 256, 'hidden_dim_2': 128, 'kl_weight': 0.0004818103550674164, 'lr': 0.006724312022022071, 'batch_size': 128, 'dropout_rate': 0.4992376655762631, 'prior_mu': -0.0016089233259094782, 'prior_sigma': 0.11018711527099566, 'normalization': 'none'}. Best is trial 5 with value: 0.5665355861186981.
Generating rdkit fingerprints...
Generated fingerprints with 256 features for 900 molecules
Data shape: X=(900, 256), y=(900,)
Trial 4: 5-fold CV loss = 0.9218
[I 2025-08-07 16:03:27,609] Trial 4 finished with value: 0.9217510461807251 and parameters: {'fp_type': 'morgan', 'morgan_only_radius': 3, 'morgan_only_nBits': 2048, 'num_hidden_layers': 2, 'hidden_dim_0': 1024, 'hidden_dim_1': 512, 'kl_weight': 0.003637361644233109, 'lr': 0.00026048346403408237, 'batch_size': 32, 'dropout_rate': 0.25564956328028887, 'prior_mu': -0.055128595095088745, 'prior_sigma': 0.08848641030347032, 'normalization': 'none'}. Best is trial 5 with value: 0.5665355861186981.
Generating morgan fingerprints...
Generated fingerprints with 1024 features for 900 molecules
Data shape: X=(900, 1024), y=(900,)
Trial 7: 5-fold CV loss = 0.6763
[I 2025-08-07 16:03:38,537] Trial 7 finished with value: 0.6763057589530945 and parameters: {'fp_type': 'rdkit', 'rdkit_only_maxPath': 6, 'rdkit_only_nBits': 256, 'num_hidden_layers': 2, 'hidden_dim_0': 512, 'hidden_dim_1': 256, 'kl_weight': 0.0001836334136708072, 'lr': 0.0013137536847991106, 'batch_size': 64, 'dropout_rate': 0.20354215449038265, 'prior_mu': 0.1842714446319742, 'prior_sigma': 0.18651131191843925, 'normalization': 'layer'}. Best is trial 5 with value: 0.5665355861186981.
Generating morgan fingerprints...
Generated fingerprints with 1024 features for 900 molecules
Data shape: X=(900, 1024), y=(900,)
Trial 6: 5-fold CV loss = 0.7624
[I 2025-08-07 16:03:41,652] Trial 6 finished with value: 0.7623567342758178 and parameters: {'fp_type': 'rdkit', 'rdkit_only_maxPath': 8, 'rdkit_only_nBits': 512, 'num_hidden_layers': 0, 'kl_weight': 0.0001695117018557897, 'lr': 0.0006427523647934582, 'batch_size': 32, 'dropout_rate': 0.1108336336158744, 'prior_mu': 0.16080723910591516, 'prior_sigma': 0.09359729304752573, 'normalization': 'layer'}. Best is trial 5 with value: 0.5665355861186981.
Generating morgan_rdkit fingerprints...
Generated fingerprints with 1024 features for 900 molecules
Data shape: X=(900, 1024), y=(900,)
Trial 8: 5-fold CV loss = 0.5859
[I 2025-08-07 16:03:44,678] Trial 8 finished with value: 0.5859078645706177 and parameters: {'fp_type': 'morgan', 'morgan_only_radius': 3, 'morgan_only_nBits': 1024, 'num_hidden_layers': 1, 'hidden_dim_0': 128, 'kl_weight': 0.028938879069832415, 'lr': 0.0005335675188600571, 'batch_size': 64, 'dropout_rate': 0.08826823399715172, 'prior_mu': 0.03776721681775658, 'prior_sigma': 0.04029296656261552, 'normalization': 'layer'}. Best is trial 5 with value: 0.5665355861186981.
Generating morgan_rdkit fingerprints...
Generated fingerprints with 768 features for 900 molecules
Data shape: X=(900, 768), y=(900,)
Trial 3: 5-fold CV loss = 0.5802
[I 2025-08-07 16:03:51,758] Trial 3 finished with value: 0.5801960051059722 and parameters: {'fp_type': 'morgan_rdkit', 'combined_morgan_radius': 3, 'combined_morgan_nBits': 512, 'combined_rdkit_maxPath': 6, 'combined_rdkit_nBits': 512, 'num_hidden_layers': 1, 'hidden_dim_0': 1024, 'kl_weight': 0.016201621191654643, 'lr': 0.003543227697714654, 'batch_size': 32, 'dropout_rate': 0.01435686047382323, 'prior_mu': -0.02446542780188471, 'prior_sigma': 0.0979975833694343, 'normalization': 'none'}. Best is trial 5 with value: 0.5665355861186981.
Generating morgan fingerprints...
Generated fingerprints with 1024 features for 900 molecules
Data shape: X=(900, 1024), y=(900,)
Trial 11: 5-fold CV loss = 0.6230
[I 2025-08-07 16:04:10,392] Trial 11 finished with value: 0.6230338096618653 and parameters: {'fp_type': 'morgan_rdkit', 'combined_morgan_radius': 3, 'combined_morgan_nBits': 512, 'combined_rdkit_maxPath': 7, 'combined_rdkit_nBits': 256, 'num_hidden_layers': 1, 'hidden_dim_0': 256, 'kl_weight': 0.0009618492237216452, 'lr': 0.00012148015404292628, 'batch_size': 64, 'dropout_rate': 0.04372656663293473, 'prior_mu': 0.19733352633185952, 'prior_sigma': 0.016446606399752522, 'normalization': 'layer'}. Best is trial 5 with value: 0.5665355861186981.
Generating morgan fingerprints...
Generated fingerprints with 2048 features for 900 molecules
Data shape: X=(900, 2048), y=(900,)
Trial 12: 5-fold CV loss = 0.6644
[I 2025-08-07 16:04:14,158] Trial 12 finished with value: 0.6643607258796692 and parameters: {'fp_type': 'morgan', 'morgan_only_radius': 2, 'morgan_only_nBits': 1024, 'num_hidden_layers': 3, 'hidden_dim_0': 128, 'hidden_dim_1': 128, 'hidden_dim_2': 64, 'kl_weight': 0.0009375446135730244, 'lr': 0.0038901290310206864, 'batch_size': 128, 'dropout_rate': 0.12936953751510955, 'prior_mu': -0.035196742734601105, 'prior_sigma': 0.16394957017430506, 'normalization': 'layer'}. Best is trial 5 with value: 0.5665355861186981.
Generating morgan_rdkit fingerprints...
Generated fingerprints with 1024 features for 900 molecules
Data shape: X=(900, 1024), y=(900,)
Trial 10: 5-fold CV loss = 0.6287
[I 2025-08-07 16:04:34,984] Trial 10 finished with value: 0.6286668062210083 and parameters: {'fp_type': 'morgan_rdkit', 'combined_morgan_radius': 2, 'combined_morgan_nBits': 512, 'combined_rdkit_maxPath': 5, 'combined_rdkit_nBits': 512, 'num_hidden_layers': 1, 'hidden_dim_0': 256, 'kl_weight': 0.008413721995095564, 'lr': 0.0003432246859068694, 'batch_size': 64, 'dropout_rate': 0.2877611903027238, 'prior_mu': -0.10973531622747462, 'prior_sigma': 0.09279556388407025, 'normalization': 'layer'}. Best is trial 5 with value: 0.5665355861186981.
Generating morgan_rdkit fingerprints...
Generated fingerprints with 1536 features for 900 molecules
Data shape: X=(900, 1536), y=(900,)
Trial 13: 5-fold CV loss = 0.8163
[I 2025-08-07 16:04:41,278] Trial 13 finished with value: 0.8162718176841736 and parameters: {'fp_type': 'morgan', 'morgan_only_radius': 2, 'morgan_only_nBits': 2048, 'num_hidden_layers': 3, 'hidden_dim_0': 1024, 'hidden_dim_1': 256, 'hidden_dim_2': 128, 'kl_weight': 0.0007862711870994615, 'lr': 0.009381680065598638, 'batch_size': 128, 'dropout_rate': 0.49922705952299257, 'prior_mu': -0.19661574890130182, 'prior_sigma': 0.15433418948422342, 'normalization': 'none'}. Best is trial 5 with value: 0.5665355861186981.
Generating morgan_rdkit fingerprints...
Generated fingerprints with 1536 features for 900 molecules
Data shape: X=(900, 1536), y=(900,)
Trial 14: 5-fold CV loss = 0.6758
[I 2025-08-07 16:04:46,980] Trial 14 finished with value: 0.6757962584495545 and parameters: {'fp_type': 'morgan_rdkit', 'combined_morgan_radius': 3, 'combined_morgan_nBits': 512, 'combined_rdkit_maxPath': 6, 'combined_rdkit_nBits': 512, 'num_hidden_layers': 1, 'hidden_dim_0': 1024, 'kl_weight': 0.0009620869435694734, 'lr': 0.009789265962894724, 'batch_size': 128, 'dropout_rate': 0.4892413686924566, 'prior_mu': -0.16257719670636261, 'prior_sigma': 0.13233836381931835, 'normalization': 'none'}. Best is trial 5 with value: 0.5665355861186981.
Generating morgan_rdkit fingerprints...
Generated fingerprints with 2048 features for 900 molecules
Data shape: X=(900, 2048), y=(900,)
Trial 16: 5-fold CV loss = 0.8347
[I 2025-08-07 16:05:04,706] Trial 16 finished with value: 0.8346898198127747 and parameters: {'fp_type': 'morgan_rdkit', 'combined_morgan_radius': 3, 'combined_morgan_nBits': 512, 'combined_rdkit_maxPath': 6, 'combined_rdkit_nBits': 1024, 'num_hidden_layers': 1, 'hidden_dim_0': 1024, 'kl_weight': 0.08047731205403512, 'lr': 0.002622831245730631, 'batch_size': 128, 'dropout_rate': 0.37897906270293524, 'prior_mu': 0.004138372933919879, 'prior_sigma': 0.12947265040960163, 'normalization': 'none'}. Best is trial 5 with value: 0.5665355861186981.
Generating rdkit fingerprints...
Generated fingerprints with 1024 features for 900 molecules
Data shape: X=(900, 1024), y=(900,)
Trial 9: 5-fold CV loss = 0.6606
[I 2025-08-07 16:05:13,014] Trial 9 finished with value: 0.660594928264618 and parameters: {'fp_type': 'morgan', 'morgan_only_radius': 3, 'morgan_only_nBits': 1024, 'num_hidden_layers': 3, 'hidden_dim_0': 64, 'hidden_dim_1': 256, 'hidden_dim_2': 128, 'kl_weight': 0.00038051856493099477, 'lr': 0.0014022034015562128, 'batch_size': 32, 'dropout_rate': 0.4593052323921875, 'prior_mu': -0.1146023506128508, 'prior_sigma': 0.16925746161968136, 'normalization': 'layer'}. Best is trial 5 with value: 0.5665355861186981.
Generating rdkit fingerprints...
Generated fingerprints with 1024 features for 900 molecules
Data shape: X=(900, 1024), y=(900,)
Trial 15: 5-fold CV loss = 0.8579
[I 2025-08-07 16:05:34,244] Trial 15 finished with value: 0.8579048991203309 and parameters: {'fp_type': 'morgan_rdkit', 'combined_morgan_radius': 3, 'combined_morgan_nBits': 512, 'combined_rdkit_maxPath': 6, 'combined_rdkit_nBits': 1024, 'num_hidden_layers': 3, 'hidden_dim_0': 1024, 'hidden_dim_1': 256, 'hidden_dim_2': 128, 'kl_weight': 0.07991945038822974, 'lr': 0.00869947461606526, 'batch_size': 128, 'dropout_rate': 0.49615525630669105, 'prior_mu': -0.19262519090529195, 'prior_sigma': 0.13702028711894731, 'normalization': 'none'}. Best is trial 5 with value: 0.5665355861186981.
Generating rdkit fingerprints...
Generated fingerprints with 1024 features for 900 molecules
Data shape: X=(900, 1024), y=(900,)
Trial 17: 5-fold CV loss = 0.5524
[I 2025-08-07 16:06:51,208] Trial 17 finished with value: 0.5523960530757904 and parameters: {'fp_type': 'morgan_rdkit', 'combined_morgan_radius': 3, 'combined_morgan_nBits': 1024, 'combined_rdkit_maxPath': 6, 'combined_rdkit_nBits': 1024, 'num_hidden_layers': 2, 'hidden_dim_0': 1024, 'hidden_dim_1': 64, 'kl_weight': 0.06397256778878643, 'lr': 0.0028940695615822048, 'batch_size': 32, 'dropout_rate': 0.3864068832883912, 'prior_mu': 0.009408757381566546, 'prior_sigma': 0.12672219809471236, 'normalization': 'none'}. Best is trial 17 with value: 0.5523960530757904.
Generating rdkit fingerprints...
Generated fingerprints with 1024 features for 900 molecules
Data shape: X=(900, 1024), y=(900,)
Trial 18: 5-fold CV loss = 0.5742
[I 2025-08-07 16:06:59,481] Trial 18 finished with value: 0.5741787612438202 and parameters: {'fp_type': 'rdkit', 'rdkit_only_maxPath': 7, 'rdkit_only_nBits': 1024, 'num_hidden_layers': 2, 'hidden_dim_0': 1024, 'hidden_dim_1': 64, 'kl_weight': 0.0023695406316561287, 'lr': 0.0015541011734945985, 'batch_size': 32, 'dropout_rate': 0.1855046033447141, 'prior_mu': 0.04800972397403745, 'prior_sigma': 0.12642116547473653, 'normalization': 'none'}. Best is trial 17 with value: 0.5523960530757904.
Generating rdkit fingerprints...
Generated fingerprints with 512 features for 900 molecules
Data shape: X=(900, 512), y=(900,)
Trial 19: 5-fold CV loss = 0.5682
[I 2025-08-07 16:07:08,716] Trial 19 finished with value: 0.5681696236133575 and parameters: {'fp_type': 'rdkit', 'rdkit_only_maxPath': 7, 'rdkit_only_nBits': 1024, 'num_hidden_layers': 2, 'hidden_dim_0': 1024, 'hidden_dim_1': 64, 'kl_weight': 0.0028466099086785, 'lr': 0.004450324793476531, 'batch_size': 32, 'dropout_rate': 0.1818933124336623, 'prior_mu': 0.027596691318371332, 'prior_sigma': 0.12047337021639981, 'normalization': 'none'}. Best is trial 17 with value: 0.5523960530757904.
Generating morgan_rdkit fingerprints...
Generated fingerprints with 2048 features for 900 molecules
Data shape: X=(900, 2048), y=(900,)
Trial 23: 5-fold CV loss = 0.5396
[I 2025-08-07 16:07:30,499] Trial 23 finished with value: 0.5396385014057159 and parameters: {'fp_type': 'morgan_rdkit', 'combined_morgan_radius': 2, 'combined_morgan_nBits': 1024, 'combined_rdkit_maxPath': 5, 'combined_rdkit_nBits': 1024, 'num_hidden_layers': 3, 'hidden_dim_0': 512, 'hidden_dim_1': 64, 'hidden_dim_2': 256, 'kl_weight': 0.0004380479715805122, 'lr': 0.006103211985872507, 'batch_size': 128, 'dropout_rate': 0.40315123543119097, 'prior_mu': 0.10271582144278849, 'prior_sigma': 0.07121457603332552, 'normalization': 'none'}. Best is trial 23 with value: 0.5396385014057159.
Generating morgan_rdkit fingerprints...
Generated fingerprints with 2048 features for 900 molecules
Data shape: X=(900, 2048), y=(900,)
Trial 24: 5-fold CV loss = 0.5438
[I 2025-08-07 16:07:50,863] Trial 24 finished with value: 0.5438179492950439 and parameters: {'fp_type': 'morgan_rdkit', 'combined_morgan_radius': 2, 'combined_morgan_nBits': 1024, 'combined_rdkit_maxPath': 5, 'combined_rdkit_nBits': 1024, 'num_hidden_layers': 3, 'hidden_dim_0': 512, 'hidden_dim_1': 64, 'hidden_dim_2': 256, 'kl_weight': 0.0003587824363387526, 'lr': 0.005713165879409161, 'batch_size': 128, 'dropout_rate': 0.40680358664827665, 'prior_mu': 0.09395120637848446, 'prior_sigma': 0.06935496655067963, 'normalization': 'none'}. Best is trial 23 with value: 0.5396385014057159.
Generating morgan_rdkit fingerprints...
Generated fingerprints with 2048 features for 900 molecules
Data shape: X=(900, 2048), y=(900,)
Trial 22: 5-fold CV loss = 0.5748
[I 2025-08-07 16:07:54,561] Trial 22 finished with value: 0.5747814357280732 and parameters: {'fp_type': 'rdkit', 'rdkit_only_maxPath': 5, 'rdkit_only_nBits': 512, 'num_hidden_layers': 2, 'hidden_dim_0': 512, 'hidden_dim_1': 64, 'kl_weight': 0.0025568153802077898, 'lr': 0.005451284922088961, 'batch_size': 32, 'dropout_rate': 0.3688824980003374, 'prior_mu': 0.030940693167699138, 'prior_sigma': 0.06680606478165588, 'normalization': 'none'}. Best is trial 23 with value: 0.5396385014057159.
Generating morgan_rdkit fingerprints...
Generated fingerprints with 2048 features for 900 molecules
Data shape: X=(900, 2048), y=(900,)
Trial 26: 5-fold CV loss = 0.7173
[I 2025-08-07 16:08:12,775] Trial 26 finished with value: 0.7173277080059052 and parameters: {'fp_type': 'morgan_rdkit', 'combined_morgan_radius': 2, 'combined_morgan_nBits': 1024, 'combined_rdkit_maxPath': 5, 'combined_rdkit_nBits': 1024, 'num_hidden_layers': 3, 'hidden_dim_0': 512, 'hidden_dim_1': 64, 'hidden_dim_2': 256, 'kl_weight': 0.00031329151193219243, 'lr': 0.002607570537574383, 'batch_size': 128, 'dropout_rate': 0.42860470758990643, 'prior_mu': 0.10913616980434314, 'prior_sigma': 0.07019728227358021, 'normalization': 'none'}. Best is trial 23 with value: 0.5396385014057159.
Generating morgan_rdkit fingerprints...
Generated fingerprints with 2048 features for 900 molecules
Data shape: X=(900, 2048), y=(900,)
Trial 25: 5-fold CV loss = 0.5372
[I 2025-08-07 16:08:23,664] Trial 25 finished with value: 0.5371967017650604 and parameters: {'fp_type': 'morgan_rdkit', 'combined_morgan_radius': 2, 'combined_morgan_nBits': 1024, 'combined_rdkit_maxPath': 5, 'combined_rdkit_nBits': 1024, 'num_hidden_layers': 3, 'hidden_dim_0': 512, 'hidden_dim_1': 64, 'hidden_dim_2': 256, 'kl_weight': 0.0003466414846245188, 'lr': 0.005470649548820473, 'batch_size': 128, 'dropout_rate': 0.3975580495862156, 'prior_mu': 0.099964874047392, 'prior_sigma': 0.07011867214645498, 'normalization': 'none'}. Best is trial 25 with value: 0.5371967017650604.
Generating morgan_rdkit fingerprints...
Generated fingerprints with 2048 features for 900 molecules
Data shape: X=(900, 2048), y=(900,)
Trial 20: 5-fold CV loss = 0.5827
[I 2025-08-07 16:08:31,025] Trial 20 finished with value: 0.5826537489891053 and parameters: {'fp_type': 'rdkit', 'rdkit_only_maxPath': 7, 'rdkit_only_nBits': 1024, 'num_hidden_layers': 2, 'hidden_dim_0': 512, 'hidden_dim_1': 64, 'kl_weight': 0.003070453390842895, 'lr': 0.00435580684715641, 'batch_size': 32, 'dropout_rate': 0.012812153684247488, 'prior_mu': 0.060741613523920775, 'prior_sigma': 0.05861460613195301, 'normalization': 'none'}. Best is trial 25 with value: 0.5371967017650604.
Generating morgan_rdkit fingerprints...
Generated fingerprints with 2048 features for 900 molecules
Data shape: X=(900, 2048), y=(900,)
Trial 27: 5-fold CV loss = 0.5783
[I 2025-08-07 16:08:32,942] Trial 27 finished with value: 0.5782968521118164 and parameters: {'fp_type': 'morgan_rdkit', 'combined_morgan_radius': 2, 'combined_morgan_nBits': 1024, 'combined_rdkit_maxPath': 5, 'combined_rdkit_nBits': 1024, 'num_hidden_layers': 3, 'hidden_dim_0': 512, 'hidden_dim_1': 64, 'hidden_dim_2': 256, 'kl_weight': 0.0016904638293522675, 'lr': 0.0028959200660642957, 'batch_size': 128, 'dropout_rate': 0.4010841635068066, 'prior_mu': 0.09155626901289268, 'prior_sigma': 0.04257147912855697, 'normalization': 'none'}. Best is trial 25 with value: 0.5371967017650604.
Generating morgan_rdkit fingerprints...
Generated fingerprints with 2048 features for 900 molecules
Data shape: X=(900, 2048), y=(900,)
Trial 28: 5-fold CV loss = 0.5405
[I 2025-08-07 16:08:50,318] Trial 28 finished with value: 0.5405160069465638 and parameters: {'fp_type': 'morgan_rdkit', 'combined_morgan_radius': 2, 'combined_morgan_nBits': 1024, 'combined_rdkit_maxPath': 5, 'combined_rdkit_nBits': 1024, 'num_hidden_layers': 3, 'hidden_dim_0': 512, 'hidden_dim_1': 64, 'hidden_dim_2': 256, 'kl_weight': 0.0002533281253829506, 'lr': 0.006213107927249572, 'batch_size': 128, 'dropout_rate': 0.3189606906880942, 'prior_mu': 0.1299113345997025, 'prior_sigma': 0.0454301520539124, 'normalization': 'none'}. Best is trial 25 with value: 0.5371967017650604.
Generating morgan_rdkit fingerprints...
Generated fingerprints with 2048 features for 900 molecules
Data shape: X=(900, 2048), y=(900,)
Trial 21: 5-fold CV loss = 0.5721
[I 2025-08-07 16:08:51,284] Trial 21 finished with value: 0.5720518827438354 and parameters: {'fp_type': 'rdkit', 'rdkit_only_maxPath': 7, 'rdkit_only_nBits': 1024, 'num_hidden_layers': 2, 'hidden_dim_0': 512, 'hidden_dim_1': 64, 'kl_weight': 0.0028336347165408998, 'lr': 0.005228655590080813, 'batch_size': 32, 'dropout_rate': 0.39866506814541575, 'prior_mu': 0.04781232941521162, 'prior_sigma': 0.06445453256074243, 'normalization': 'none'}. Best is trial 25 with value: 0.5371967017650604.
Generating morgan_rdkit fingerprints...
Generated fingerprints with 2048 features for 900 molecules
Data shape: X=(900, 2048), y=(900,)
Trial 30: 5-fold CV loss = 0.5358
[I 2025-08-07 16:08:56,239] Trial 30 finished with value: 0.5358302295207977 and parameters: {'fp_type': 'morgan_rdkit', 'combined_morgan_radius': 2, 'combined_morgan_nBits': 1024, 'combined_rdkit_maxPath': 5, 'combined_rdkit_nBits': 1024, 'num_hidden_layers': 3, 'hidden_dim_0': 512, 'hidden_dim_1': 128, 'hidden_dim_2': 256, 'kl_weight': 0.00032199663988890555, 'lr': 0.005958498870926857, 'batch_size': 128, 'dropout_rate': 0.32850580011822617, 'prior_mu': 0.1464566163949282, 'prior_sigma': 0.07611872056850391, 'normalization': 'none'}. Best is trial 30 with value: 0.5358302295207977.
Generating morgan_rdkit fingerprints...
Generated fingerprints with 1280 features for 900 molecules
Data shape: X=(900, 1280), y=(900,)
Trial 32: 5-fold CV loss = 0.6616
