[I 2025-08-07 19:37:48,751] Trial 688 finished with value: 0.6424812078475952 and parameters: {'fp_type': 'rdkit', 'rdkit_only_maxPath': 5, 'rdkit_only_nBits': 256, 'num_hidden_layers': 3, 'hidden_dim_0': 512, 'hidden_dim_1': 128, 'hidden_dim_2': 512, 'kl_weight': 0.002314285771059899, 'lr': 0.0018426775053808817, 'batch_size': 32, 'dropout_rate': 0.48157489897680494, 'prior_mu': -0.005802012014408865, 'prior_sigma': 0.0643926890919825, 'normalization': 'none'}. Best is trial 272 with value: 0.5198344707489013.
Generating morgan fingerprints...
Generated fingerprints with 1024 features for 900 molecules
Data shape: X=(900, 1024), y=(900,)
Trial 687: 5-fold CV loss = 0.5310
[I 2025-08-07 19:37:58,319] Trial 687 finished with value: 0.5310058414936065 and parameters: {'fp_type': 'morgan', 'morgan_only_radius': 2, 'morgan_only_nBits': 1024, 'num_hidden_layers': 3, 'hidden_dim_0': 512, 'hidden_dim_1': 128, 'hidden_dim_2': 512, 'kl_weight': 0.019544464718014628, 'lr': 0.0019124675010003915, 'batch_size': 32, 'dropout_rate': 0.4998570806406203, 'prior_mu': -0.01964243799295966, 'prior_sigma': 0.06531435291937555, 'normalization': 'none'}. Best is trial 272 with value: 0.5198344707489013.
Generating morgan fingerprints...
Generated fingerprints with 1024 features for 900 molecules
Data shape: X=(900, 1024), y=(900,)
Trial 682: 5-fold CV loss = 0.5359
[I 2025-08-07 19:38:13,489] Trial 682 finished with value: 0.5359469711780548 and parameters: {'fp_type': 'morgan', 'morgan_only_radius': 2, 'morgan_only_nBits': 1024, 'num_hidden_layers': 3, 'hidden_dim_0': 512, 'hidden_dim_1': 128, 'hidden_dim_2': 512, 'kl_weight': 0.0016869456266761357, 'lr': 0.0023248253615744457, 'batch_size': 32, 'dropout_rate': 0.4995670331481325, 'prior_mu': -0.04114749414336094, 'prior_sigma': 0.049959456002040645, 'normalization': 'none'}. Best is trial 272 with value: 0.5198344707489013.
Generating morgan fingerprints...
Generated fingerprints with 1024 features for 900 molecules
Data shape: X=(900, 1024), y=(900,)
Trial 689: 5-fold CV loss = 0.6053
[I 2025-08-07 19:38:39,851] Trial 689 finished with value: 0.6053206205368042 and parameters: {'fp_type': 'morgan', 'morgan_only_radius': 2, 'morgan_only_nBits': 1024, 'num_hidden_layers': 3, 'hidden_dim_0': 512, 'hidden_dim_1': 128, 'hidden_dim_2': 512, 'kl_weight': 0.0010052150610718332, 'lr': 0.001942143623824355, 'batch_size': 32, 'dropout_rate': 0.46001565599226396, 'prior_mu': -0.006845867061659022, 'prior_sigma': 0.06471230829584425, 'normalization': 'none'}. Best is trial 272 with value: 0.5198344707489013.
Generating morgan fingerprints...
Generated fingerprints with 1024 features for 900 molecules
Data shape: X=(900, 1024), y=(900,)
Trial 691: 5-fold CV loss = 0.5802
[I 2025-08-07 19:39:03,221] Trial 691 finished with value: 0.5802409589290619 and parameters: {'fp_type': 'morgan', 'morgan_only_radius': 2, 'morgan_only_nBits': 1024, 'num_hidden_layers': 3, 'hidden_dim_0': 512, 'hidden_dim_1': 512, 'hidden_dim_2': 512, 'kl_weight': 0.000989428143092106, 'lr': 0.0027358607171968207, 'batch_size': 32, 'dropout_rate': 0.4573094535089293, 'prior_mu': -0.03340742639888013, 'prior_sigma': 0.05912597052137102, 'normalization': 'none'}. Best is trial 272 with value: 0.5198344707489013.
Generating morgan fingerprints...
Generated fingerprints with 1024 features for 900 molecules
Data shape: X=(900, 1024), y=(900,)
Trial 690: 5-fold CV loss = 0.5275
[I 2025-08-07 19:39:13,931] Trial 690 finished with value: 0.5274933874607086 and parameters: {'fp_type': 'morgan', 'morgan_only_radius': 2, 'morgan_only_nBits': 1024, 'num_hidden_layers': 3, 'hidden_dim_0': 512, 'hidden_dim_1': 128, 'hidden_dim_2': 512, 'kl_weight': 0.0010122014978574151, 'lr': 0.002712099548634713, 'batch_size': 32, 'dropout_rate': 0.46091803691561145, 'prior_mu': -0.031936369107200234, 'prior_sigma': 0.05879536972525576, 'normalization': 'none'}. Best is trial 272 with value: 0.5198344707489013.
Generating morgan fingerprints...
Generated fingerprints with 1024 features for 900 molecules
Data shape: X=(900, 1024), y=(900,)
Trial 694: 5-fold CV loss = 0.6896
[I 2025-08-07 19:39:28,350] Trial 694 finished with value: 0.689638352394104 and parameters: {'fp_type': 'morgan', 'morgan_only_radius': 2, 'morgan_only_nBits': 1024, 'num_hidden_layers': 3, 'hidden_dim_0': 512, 'hidden_dim_1': 128, 'hidden_dim_2': 64, 'kl_weight': 0.0012553749214553398, 'lr': 0.001647399606223234, 'batch_size': 32, 'dropout_rate': 0.11337392928227369, 'prior_mu': -0.05022894543512726, 'prior_sigma': 0.07633562993640863, 'normalization': 'none'}. Best is trial 272 with value: 0.5198344707489013.
Generating morgan fingerprints...
Generated fingerprints with 1024 features for 900 molecules
Data shape: X=(900, 1024), y=(900,)
Trial 695: 5-fold CV loss = 0.7047
[I 2025-08-07 19:39:39,637] Trial 695 finished with value: 0.7046951174736023 and parameters: {'fp_type': 'morgan', 'morgan_only_radius': 2, 'morgan_only_nBits': 1024, 'num_hidden_layers': 3, 'hidden_dim_0': 512, 'hidden_dim_1': 128, 'hidden_dim_2': 64, 'kl_weight': 0.00029454340625930075, 'lr': 0.0016103272862215284, 'batch_size': 32, 'dropout_rate': 0.4891840750674615, 'prior_mu': 0.07337554257227537, 'prior_sigma': 0.07258490311662846, 'normalization': 'none'}. Best is trial 272 with value: 0.5198344707489013.
Generating morgan fingerprints...
Generated fingerprints with 1024 features for 900 molecules
Data shape: X=(900, 1024), y=(900,)
Trial 693: 5-fold CV loss = 0.5712
[I 2025-08-07 19:40:09,866] Trial 693 finished with value: 0.5712066411972045 and parameters: {'fp_type': 'morgan', 'morgan_only_radius': 2, 'morgan_only_nBits': 1024, 'num_hidden_layers': 3, 'hidden_dim_0': 512, 'hidden_dim_1': 128, 'hidden_dim_2': 64, 'kl_weight': 0.0002932642603806488, 'lr': 0.0026407740574572805, 'batch_size': 32, 'dropout_rate': 0.4898250051881283, 'prior_mu': -0.03069543986179133, 'prior_sigma': 0.05939339437453504, 'normalization': 'none'}. Best is trial 272 with value: 0.5198344707489013.
Generating morgan fingerprints...
Generated fingerprints with 1024 features for 900 molecules
Data shape: X=(900, 1024), y=(900,)
Trial 696: 5-fold CV loss = 0.5354
[I 2025-08-07 19:40:32,345] Trial 696 finished with value: 0.5354161560535431 and parameters: {'fp_type': 'morgan', 'morgan_only_radius': 2, 'morgan_only_nBits': 1024, 'num_hidden_layers': 3, 'hidden_dim_0': 512, 'hidden_dim_1': 128, 'hidden_dim_2': 512, 'kl_weight': 0.0015392642338584825, 'lr': 0.0025425001709790656, 'batch_size': 32, 'dropout_rate': 0.4885770500326794, 'prior_mu': 0.005163091331431471, 'prior_sigma': 0.07194444627329713, 'normalization': 'none'}. Best is trial 272 with value: 0.5198344707489013.
Generating morgan fingerprints...
Generated fingerprints with 1024 features for 900 molecules
Data shape: X=(900, 1024), y=(900,)
Trial 697: 5-fold CV loss = 0.5391
[I 2025-08-07 19:40:52,349] Trial 697 finished with value: 0.5390689492225647 and parameters: {'fp_type': 'morgan', 'morgan_only_radius': 2, 'morgan_only_nBits': 1024, 'num_hidden_layers': 3, 'hidden_dim_0': 512, 'hidden_dim_1': 128, 'hidden_dim_2': 512, 'kl_weight': 0.00201937211119655, 'lr': 0.0025801634921468752, 'batch_size': 32, 'dropout_rate': 0.4716967821875585, 'prior_mu': 0.0014768962027280272, 'prior_sigma': 0.08768384484929138, 'normalization': 'none'}. Best is trial 272 with value: 0.5198344707489013.
Generating morgan fingerprints...
Generated fingerprints with 1024 features for 900 molecules
Data shape: X=(900, 1024), y=(900,)
Trial 699: 5-fold CV loss = 0.5500
[I 2025-08-07 19:41:17,094] Trial 699 finished with value: 0.5499519586563111 and parameters: {'fp_type': 'morgan', 'morgan_only_radius': 2, 'morgan_only_nBits': 1024, 'num_hidden_layers': 3, 'hidden_dim_0': 512, 'hidden_dim_1': 128, 'hidden_dim_2': 512, 'kl_weight': 0.0007656959722519721, 'lr': 0.0033466262675994553, 'batch_size': 32, 'dropout_rate': 0.4694816873415662, 'prior_mu': -0.0219357450905163, 'prior_sigma': 0.025746404668780275, 'normalization': 'none'}. Best is trial 272 with value: 0.5198344707489013.
Generating morgan fingerprints...
Generated fingerprints with 1024 features for 900 molecules
Data shape: X=(900, 1024), y=(900,)
Trial 692: 5-fold CV loss = 0.5643
[I 2025-08-07 19:41:32,847] Trial 692 finished with value: 0.5642753481864929 and parameters: {'fp_type': 'morgan', 'morgan_only_radius': 2, 'morgan_only_nBits': 1024, 'num_hidden_layers': 3, 'hidden_dim_0': 512, 'hidden_dim_1': 128, 'hidden_dim_2': 64, 'kl_weight': 0.0014618412310274575, 'lr': 0.002658746696732924, 'batch_size': 32, 'dropout_rate': 0.4589096215111533, 'prior_mu': -0.03028753671870558, 'prior_sigma': 0.059052512497692305, 'normalization': 'none'}. Best is trial 272 with value: 0.5198344707489013.
Generating morgan fingerprints...
Generated fingerprints with 1024 features for 900 molecules
Data shape: X=(900, 1024), y=(900,)
Trial 698: 5-fold CV loss = 0.5543
[I 2025-08-07 19:41:33,477] Trial 698 finished with value: 0.5542768955230712 and parameters: {'fp_type': 'morgan', 'morgan_only_radius': 2, 'morgan_only_nBits': 1024, 'num_hidden_layers': 3, 'hidden_dim_0': 512, 'hidden_dim_1': 128, 'hidden_dim_2': 512, 'kl_weight': 0.0015745903983504321, 'lr': 0.002924577212157808, 'batch_size': 32, 'dropout_rate': 0.061277872789883725, 'prior_mu': -0.05262371367671329, 'prior_sigma': 0.07002428079318897, 'normalization': 'layer'}. Best is trial 272 with value: 0.5198344707489013.
Generating morgan fingerprints...
Generated fingerprints with 1024 features for 900 molecules
Data shape: X=(900, 1024), y=(900,)
Trial 700: 5-fold CV loss = 0.5394
[I 2025-08-07 19:41:49,475] Trial 700 finished with value: 0.5393790185451508 and parameters: {'fp_type': 'morgan', 'morgan_only_radius': 2, 'morgan_only_nBits': 1024, 'num_hidden_layers': 3, 'hidden_dim_0': 512, 'hidden_dim_1': 128, 'hidden_dim_2': 128, 'kl_weight': 0.00020138759701611884, 'lr': 0.0029620740864560965, 'batch_size': 32, 'dropout_rate': 0.4789014540524998, 'prior_mu': -0.05353569336647106, 'prior_sigma': 0.06851788535435863, 'normalization': 'layer'}. Best is trial 272 with value: 0.5198344707489013.
Generating morgan fingerprints...
Generated fingerprints with 1024 features for 900 molecules
Data shape: X=(900, 1024), y=(900,)
Trial 704: 5-fold CV loss = 0.7400
[I 2025-08-07 19:42:12,385] Trial 704 finished with value: 0.7399585127830506 and parameters: {'fp_type': 'morgan', 'morgan_only_radius': 2, 'morgan_only_nBits': 1024, 'num_hidden_layers': 1, 'hidden_dim_0': 512, 'kl_weight': 0.0031450493166317916, 'lr': 0.002025802839197017, 'batch_size': 32, 'dropout_rate': 0.4841369301739713, 'prior_mu': -0.014942210555212049, 'prior_sigma': 0.08127255716252899, 'normalization': 'none'}. Best is trial 272 with value: 0.5198344707489013.
Generating morgan fingerprints...
Generated fingerprints with 1024 features for 900 molecules
Data shape: X=(900, 1024), y=(900,)
Trial 701: 5-fold CV loss = 0.5568
[I 2025-08-07 19:42:47,757] Trial 701 finished with value: 0.5568294107913971 and parameters: {'fp_type': 'morgan', 'morgan_only_radius': 2, 'morgan_only_nBits': 1024, 'num_hidden_layers': 3, 'hidden_dim_0': 512, 'hidden_dim_1': 128, 'hidden_dim_2': 512, 'kl_weight': 0.00019489784480497253, 'lr': 0.0009664926596528244, 'batch_size': 32, 'dropout_rate': 0.47874549186516774, 'prior_mu': -0.04933148474698161, 'prior_sigma': 0.0681951964314522, 'normalization': 'layer'}. Best is trial 272 with value: 0.5198344707489013.
Generating morgan fingerprints...
Generated fingerprints with 1024 features for 900 molecules
Data shape: X=(900, 1024), y=(900,)
Trial 705: 5-fold CV loss = 0.5296
[I 2025-08-07 19:43:27,099] Trial 705 finished with value: 0.5296115696430206 and parameters: {'fp_type': 'morgan', 'morgan_only_radius': 2, 'morgan_only_nBits': 1024, 'num_hidden_layers': 3, 'hidden_dim_0': 512, 'hidden_dim_1': 128, 'hidden_dim_2': 512, 'kl_weight': 0.0011634242918730775, 'lr': 0.0022601698239936878, 'batch_size': 32, 'dropout_rate': 0.49995025792922176, 'prior_mu': 0.01390186336501502, 'prior_sigma': 0.06276328773132399, 'normalization': 'none'}. Best is trial 272 with value: 0.5198344707489013.
Generating rdkit fingerprints...
Generated fingerprints with 512 features for 900 molecules
Data shape: X=(900, 512), y=(900,)
Trial 703: 5-fold CV loss = 0.5374
[I 2025-08-07 19:43:50,090] Trial 703 finished with value: 0.5373929500579834 and parameters: {'fp_type': 'morgan', 'morgan_only_radius': 2, 'morgan_only_nBits': 1024, 'num_hidden_layers': 3, 'hidden_dim_0': 512, 'hidden_dim_1': 128, 'hidden_dim_2': 512, 'kl_weight': 0.0001954405548042186, 'lr': 0.002193613398142642, 'batch_size': 32, 'dropout_rate': 0.4789589363395757, 'prior_mu': -0.01024973532348708, 'prior_sigma': 0.0805299187144227, 'normalization': 'none'}. Best is trial 272 with value: 0.5198344707489013.
Generating rdkit fingerprints...
Generated fingerprints with 512 features for 900 molecules
Data shape: X=(900, 512), y=(900,)
Trial 706: 5-fold CV loss = 0.5243
[I 2025-08-07 19:44:00,000] Trial 706 finished with value: 0.5243461430072784 and parameters: {'fp_type': 'morgan', 'morgan_only_radius': 2, 'morgan_only_nBits': 1024, 'num_hidden_layers': 3, 'hidden_dim_0': 512, 'hidden_dim_1': 128, 'hidden_dim_2': 512, 'kl_weight': 0.0012790629377209962, 'lr': 0.0022511547992793614, 'batch_size': 32, 'dropout_rate': 0.4918982455060031, 'prior_mu': -0.007589259516710519, 'prior_sigma': 0.06304241778739887, 'normalization': 'none'}. Best is trial 272 with value: 0.5198344707489013.
Generating morgan fingerprints...
Generated fingerprints with 2048 features for 900 molecules
Data shape: X=(900, 2048), y=(900,)
Trial 707: 5-fold CV loss = 0.6620
[I 2025-08-07 19:44:51,148] Trial 707 finished with value: 0.6619898557662964 and parameters: {'fp_type': 'rdkit', 'rdkit_only_maxPath': 8, 'rdkit_only_nBits': 512, 'num_hidden_layers': 3, 'hidden_dim_0': 512, 'hidden_dim_1': 128, 'hidden_dim_2': 512, 'kl_weight': 0.0018633997492848735, 'lr': 0.0023399017495989716, 'batch_size': 32, 'dropout_rate': 0.4916148915046926, 'prior_mu': -0.007070666666077157, 'prior_sigma': 0.06266387090574142, 'normalization': 'none'}. Best is trial 272 with value: 0.5198344707489013.
Generating morgan fingerprints...
Generated fingerprints with 2048 features for 900 molecules
Data shape: X=(900, 2048), y=(900,)
Trial 708: 5-fold CV loss = 0.6650
[I 2025-08-07 19:45:06,862] Trial 708 finished with value: 0.6650115728378296 and parameters: {'fp_type': 'rdkit', 'rdkit_only_maxPath': 8, 'rdkit_only_nBits': 512, 'num_hidden_layers': 3, 'hidden_dim_0': 512, 'hidden_dim_1': 128, 'hidden_dim_2': 512, 'kl_weight': 0.002410252784032974, 'lr': 0.0017493781657194909, 'batch_size': 32, 'dropout_rate': 0.48899060565318175, 'prior_mu': -0.036695091270349624, 'prior_sigma': 0.06265960931601046, 'normalization': 'none'}. Best is trial 272 with value: 0.5198344707489013.
Generating morgan fingerprints...
Generated fingerprints with 2048 features for 900 molecules
Data shape: X=(900, 2048), y=(900,)
Trial 709: 5-fold CV loss = 0.5287
[I 2025-08-07 19:45:09,061] Trial 709 finished with value: 0.5287033677101135 and parameters: {'fp_type': 'morgan', 'morgan_only_radius': 2, 'morgan_only_nBits': 2048, 'num_hidden_layers': 3, 'hidden_dim_0': 1024, 'hidden_dim_1': 128, 'hidden_dim_2': 512, 'kl_weight': 0.001283632863072526, 'lr': 0.0020291617164912247, 'batch_size': 32, 'dropout_rate': 0.4902428580782336, 'prior_mu': 0.0010804229234164112, 'prior_sigma': 0.062346192383726726, 'normalization': 'none'}. Best is trial 272 with value: 0.5198344707489013.
Generating morgan fingerprints...
Generated fingerprints with 1024 features for 900 molecules
Data shape: X=(900, 1024), y=(900,)
Trial 711: 5-fold CV loss = 0.7957
[I 2025-08-07 19:46:00,547] Trial 711 finished with value: 0.795654547214508 and parameters: {'fp_type': 'morgan', 'morgan_only_radius': 2, 'morgan_only_nBits': 2048, 'num_hidden_layers': 3, 'hidden_dim_0': 512, 'hidden_dim_1': 1024, 'hidden_dim_2': 512, 'kl_weight': 0.0012967891810228434, 'lr': 0.0020094605224483847, 'batch_size': 32, 'dropout_rate': 0.46848381573392905, 'prior_mu': -0.0010468552867606857, 'prior_sigma': 0.05630239371634919, 'normalization': 'none'}. Best is trial 272 with value: 0.5198344707489013.
Generating morgan fingerprints...
Generated fingerprints with 1024 features for 900 molecules
Data shape: X=(900, 1024), y=(900,)
Trial 710: 5-fold CV loss = 0.5770
[I 2025-08-07 19:46:12,158] Trial 710 finished with value: 0.576968640089035 and parameters: {'fp_type': 'morgan', 'morgan_only_radius': 2, 'morgan_only_nBits': 2048, 'num_hidden_layers': 3, 'hidden_dim_0': 512, 'hidden_dim_1': 128, 'hidden_dim_2': 512, 'kl_weight': 0.0013866060279068206, 'lr': 0.0017625797771815494, 'batch_size': 32, 'dropout_rate': 0.468513714222115, 'prior_mu': 0.0016546874732306736, 'prior_sigma': 0.05660381948673393, 'normalization': 'none'}. Best is trial 272 with value: 0.5198344707489013.
Generating morgan fingerprints...
Generated fingerprints with 1024 features for 900 molecules
Data shape: X=(900, 1024), y=(900,)
Trial 712: 5-fold CV loss = 0.5225
[I 2025-08-07 19:46:17,140] Trial 712 finished with value: 0.5225066900253296 and parameters: {'fp_type': 'morgan', 'morgan_only_radius': 2, 'morgan_only_nBits': 1024, 'num_hidden_layers': 3, 'hidden_dim_0': 512, 'hidden_dim_1': 128, 'hidden_dim_2': 512, 'kl_weight': 0.0012496922094509687, 'lr': 0.0024225935662192674, 'batch_size': 32, 'dropout_rate': 0.4717931817958212, 'prior_mu': -0.004023132812693738, 'prior_sigma': 0.05461996921864655, 'normalization': 'none'}. Best is trial 272 with value: 0.5198344707489013.
Generating morgan fingerprints...
Generated fingerprints with 1024 features for 900 molecules
Data shape: X=(900, 1024), y=(900,)
Trial 702: 5-fold CV loss = 0.5814
[I 2025-08-07 19:46:28,748] Trial 702 finished with value: 0.5814069092273713 and parameters: {'fp_type': 'morgan', 'morgan_only_radius': 2, 'morgan_only_nBits': 1024, 'num_hidden_layers': 3, 'hidden_dim_0': 512, 'hidden_dim_1': 128, 'hidden_dim_2': 512, 'kl_weight': 0.00019284915877175883, 'lr': 0.0009914106807228404, 'batch_size': 32, 'dropout_rate': 0.4797905754011501, 'prior_mu': -0.04879335220888223, 'prior_sigma': 0.06841044873811558, 'normalization': 'layer'}. Best is trial 272 with value: 0.5198344707489013.
Generating morgan fingerprints...
Generated fingerprints with 1024 features for 900 molecules
Data shape: X=(900, 1024), y=(900,)
Trial 714: 5-fold CV loss = 1.3507
[I 2025-08-07 19:46:36,076] Trial 714 finished with value: 1.3507152318954467 and parameters: {'fp_type': 'morgan', 'morgan_only_radius': 2, 'morgan_only_nBits': 1024, 'num_hidden_layers': 3, 'hidden_dim_0': 512, 'hidden_dim_1': 128, 'hidden_dim_2': 512, 'kl_weight': 0.0011389653542984044, 'lr': 0.0007353928260418962, 'batch_size': 32, 'dropout_rate': 0.4996276754301089, 'prior_mu': -0.008339735471060119, 'prior_sigma': 0.07632162131887273, 'normalization': 'none'}. Best is trial 272 with value: 0.5198344707489013.
Generating morgan fingerprints...
Generated fingerprints with 1024 features for 900 molecules
Data shape: X=(900, 1024), y=(900,)
Trial 717: 5-fold CV loss = 0.6679
[I 2025-08-07 19:47:17,470] Trial 717 finished with value: 0.6679202079772949 and parameters: {'fp_type': 'morgan', 'morgan_only_radius': 2, 'morgan_only_nBits': 1024, 'num_hidden_layers': 3, 'hidden_dim_0': 512, 'hidden_dim_1': 512, 'hidden_dim_2': 512, 'kl_weight': 0.0014280605921306192, 'lr': 0.002440449570225277, 'batch_size': 32, 'dropout_rate': 0.45143306095432095, 'prior_mu': 0.011217077869297166, 'prior_sigma': 0.055139584449028216, 'normalization': 'none'}. Best is trial 272 with value: 0.5198344707489013.
Generating morgan fingerprints...
Generated fingerprints with 1024 features for 900 molecules
Data shape: X=(900, 1024), y=(900,)
Trial 715: 5-fold CV loss = 0.5377
[I 2025-08-07 19:47:20,982] Trial 715 finished with value: 0.5377302527427673 and parameters: {'fp_type': 'morgan', 'morgan_only_radius': 2, 'morgan_only_nBits': 1024, 'num_hidden_layers': 3, 'hidden_dim_0': 512, 'hidden_dim_1': 512, 'hidden_dim_2': 512, 'kl_weight': 0.001468775369875749, 'lr': 0.002955517059090456, 'batch_size': 32, 'dropout_rate': 0.4518873016577544, 'prior_mu': 0.013148453972069886, 'prior_sigma': 0.04677222439279419, 'normalization': 'none'}. Best is trial 272 with value: 0.5198344707489013.
Generating morgan fingerprints...
Generated fingerprints with 1024 features for 900 molecules
Data shape: X=(900, 1024), y=(900,)
Trial 713: 5-fold CV loss = 0.5368
[I 2025-08-07 19:47:58,546] Trial 713 finished with value: 0.5368156909942627 and parameters: {'fp_type': 'morgan', 'morgan_only_radius': 2, 'morgan_only_nBits': 1024, 'num_hidden_layers': 3, 'hidden_dim_0': 512, 'hidden_dim_1': 128, 'hidden_dim_2': 512, 'kl_weight': 0.001415397119432791, 'lr': 0.0024474813323428833, 'batch_size': 32, 'dropout_rate': 0.4718137413356937, 'prior_mu': 0.0073992772746815745, 'prior_sigma': 0.07500358155739306, 'normalization': 'none'}. Best is trial 272 with value: 0.5198344707489013.
Generating morgan fingerprints...
Generated fingerprints with 1024 features for 900 molecules
Data shape: X=(900, 1024), y=(900,)
Trial 718: 5-fold CV loss = 0.5512
[I 2025-08-07 19:48:12,846] Trial 718 finished with value: 0.5511944234371186 and parameters: {'fp_type': 'morgan', 'morgan_only_radius': 2, 'morgan_only_nBits': 1024, 'num_hidden_layers': 3, 'hidden_dim_0': 512, 'hidden_dim_1': 128, 'hidden_dim_2': 512, 'kl_weight': 0.0016786166492021898, 'lr': 0.0030708793481685655, 'batch_size': 32, 'dropout_rate': 0.28075122624834314, 'prior_mu': -0.004799327426102802, 'prior_sigma': 0.04543076913165139, 'normalization': 'none'}. Best is trial 272 with value: 0.5198344707489013.
Generating morgan fingerprints...
Generated fingerprints with 1024 features for 900 molecules
Data shape: X=(900, 1024), y=(900,)
Trial 719: 5-fold CV loss = 0.5487
