[I 2025-08-07 17:41:46,762] Trial 400 finished with value: 0.529834371805191 and parameters: {'fp_type': 'morgan', 'morgan_only_radius': 2, 'morgan_only_nBits': 1024, 'num_hidden_layers': 3, 'hidden_dim_0': 512, 'hidden_dim_1': 128, 'hidden_dim_2': 512, 'kl_weight': 0.00405684471044474, 'lr': 0.0023004871153470175, 'batch_size': 32, 'dropout_rate': 0.4721463384263162, 'prior_mu': -0.016488382360146023, 'prior_sigma': 0.07238026135355421, 'normalization': 'none'}. Best is trial 272 with value: 0.5198344707489013.
Generating morgan fingerprints...
Generated fingerprints with 1024 features for 900 molecules
Data shape: X=(900, 1024), y=(900,)
Trial 394: 5-fold CV loss = 0.5280
[I 2025-08-07 17:42:24,013] Trial 394 finished with value: 0.5279723584651947 and parameters: {'fp_type': 'morgan', 'morgan_only_radius': 2, 'morgan_only_nBits': 1024, 'num_hidden_layers': 3, 'hidden_dim_0': 512, 'hidden_dim_1': 128, 'hidden_dim_2': 512, 'kl_weight': 0.004420043272934547, 'lr': 0.002204601440671163, 'batch_size': 32, 'dropout_rate': 0.474534408491662, 'prior_mu': -0.016866386544412876, 'prior_sigma': 0.06111512592237879, 'normalization': 'none'}. Best is trial 272 with value: 0.5198344707489013.
Generating morgan fingerprints...
Generated fingerprints with 1024 features for 900 molecules
Data shape: X=(900, 1024), y=(900,)
Trial 399: 5-fold CV loss = 0.5283
[I 2025-08-07 17:42:36,288] Trial 399 finished with value: 0.5282881438732148 and parameters: {'fp_type': 'morgan', 'morgan_only_radius': 2, 'morgan_only_nBits': 1024, 'num_hidden_layers': 3, 'hidden_dim_0': 512, 'hidden_dim_1': 128, 'hidden_dim_2': 512, 'kl_weight': 0.0035264593189745443, 'lr': 0.002253247259431666, 'batch_size': 32, 'dropout_rate': 0.4710100820790042, 'prior_mu': -0.018194633463615672, 'prior_sigma': 0.06137505395685471, 'normalization': 'none'}. Best is trial 272 with value: 0.5198344707489013.
Generating morgan fingerprints...
Generated fingerprints with 1024 features for 900 molecules
Data shape: X=(900, 1024), y=(900,)
Trial 401: 5-fold CV loss = 0.5243
[I 2025-08-07 17:42:37,156] Trial 401 finished with value: 0.5242506086826324 and parameters: {'fp_type': 'morgan', 'morgan_only_radius': 2, 'morgan_only_nBits': 1024, 'num_hidden_layers': 3, 'hidden_dim_0': 512, 'hidden_dim_1': 128, 'hidden_dim_2': 512, 'kl_weight': 0.004164250358260838, 'lr': 0.002228957608135303, 'batch_size': 32, 'dropout_rate': 0.47152738594923077, 'prior_mu': 0.004906554404561912, 'prior_sigma': 0.07022817351834058, 'normalization': 'none'}. Best is trial 272 with value: 0.5198344707489013.
Generating morgan fingerprints...
Generated fingerprints with 1024 features for 900 molecules
Data shape: X=(900, 1024), y=(900,)
Trial 402: 5-fold CV loss = 0.5331
[I 2025-08-07 17:43:11,907] Trial 402 finished with value: 0.5331468224525452 and parameters: {'fp_type': 'morgan', 'morgan_only_radius': 2, 'morgan_only_nBits': 1024, 'num_hidden_layers': 3, 'hidden_dim_0': 512, 'hidden_dim_1': 128, 'hidden_dim_2': 512, 'kl_weight': 0.004896446187132947, 'lr': 0.002302298808580791, 'batch_size': 32, 'dropout_rate': 0.4671203779274429, 'prior_mu': -0.0008443519590878128, 'prior_sigma': 0.07214012987685808, 'normalization': 'none'}. Best is trial 272 with value: 0.5198344707489013.
Generating morgan fingerprints...
Generated fingerprints with 1024 features for 900 molecules
Data shape: X=(900, 1024), y=(900,)
Trial 403: 5-fold CV loss = 0.6817
[I 2025-08-07 17:43:19,271] Trial 403 finished with value: 0.6817203044891358 and parameters: {'fp_type': 'morgan', 'morgan_only_radius': 2, 'morgan_only_nBits': 1024, 'num_hidden_layers': 0, 'kl_weight': 0.004519689012051136, 'lr': 0.002311204071363214, 'batch_size': 32, 'dropout_rate': 0.23921354185633875, 'prior_mu': -0.0003580902885094526, 'prior_sigma': 0.07216677907836865, 'normalization': 'none'}. Best is trial 272 with value: 0.5198344707489013.
Generating morgan fingerprints...
Generated fingerprints with 1024 features for 900 molecules
Data shape: X=(900, 1024), y=(900,)
Trial 406: 5-fold CV loss = 0.6708
[I 2025-08-07 17:43:31,745] Trial 406 finished with value: 0.6707806706428527 and parameters: {'fp_type': 'morgan', 'morgan_only_radius': 2, 'morgan_only_nBits': 1024, 'num_hidden_layers': 0, 'kl_weight': 0.005773401085063979, 'lr': 0.0018730103221363517, 'batch_size': 32, 'dropout_rate': 0.44322891452990476, 'prior_mu': -0.010039972782111276, 'prior_sigma': 0.07229103042475347, 'normalization': 'none'}. Best is trial 272 with value: 0.5198344707489013.
Generating morgan fingerprints...
Generated fingerprints with 1024 features for 900 molecules
Data shape: X=(900, 1024), y=(900,)
Trial 405: 5-fold CV loss = 0.5324
[I 2025-08-07 17:43:48,518] Trial 405 finished with value: 0.5323961555957795 and parameters: {'fp_type': 'morgan', 'morgan_only_radius': 2, 'morgan_only_nBits': 1024, 'num_hidden_layers': 3, 'hidden_dim_0': 512, 'hidden_dim_1': 128, 'hidden_dim_2': 512, 'kl_weight': 0.004682437845416874, 'lr': 0.0023001931611124978, 'batch_size': 32, 'dropout_rate': 0.4481350387158603, 'prior_mu': -0.008005010485712248, 'prior_sigma': 0.07196146114462534, 'normalization': 'none'}. Best is trial 272 with value: 0.5198344707489013.
Generating morgan fingerprints...
Generated fingerprints with 1024 features for 900 molecules
Data shape: X=(900, 1024), y=(900,)
Trial 408: 5-fold CV loss = 0.9435
[I 2025-08-07 17:43:56,164] Trial 408 finished with value: 0.9434930920600891 and parameters: {'fp_type': 'morgan', 'morgan_only_radius': 2, 'morgan_only_nBits': 1024, 'num_hidden_layers': 3, 'hidden_dim_0': 512, 'hidden_dim_1': 128, 'hidden_dim_2': 512, 'kl_weight': 0.004310178347375587, 'lr': 0.0008601071326704362, 'batch_size': 32, 'dropout_rate': 0.45633542313271613, 'prior_mu': -0.014891095049918202, 'prior_sigma': 0.06801882657444033, 'normalization': 'none'}. Best is trial 272 with value: 0.5198344707489013.
Generating morgan fingerprints...
Generated fingerprints with 1024 features for 900 molecules
Data shape: X=(900, 1024), y=(900,)
Trial 410: 5-fold CV loss = 0.6343
[I 2025-08-07 17:44:43,841] Trial 410 finished with value: 0.6342926621437073 and parameters: {'fp_type': 'morgan', 'morgan_only_radius': 2, 'morgan_only_nBits': 1024, 'num_hidden_layers': 3, 'hidden_dim_0': 512, 'hidden_dim_1': 128, 'hidden_dim_2': 512, 'kl_weight': 0.006846405936701024, 'lr': 0.0018980168471696027, 'batch_size': 32, 'dropout_rate': 0.0312212535126436, 'prior_mu': -0.017591578372340568, 'prior_sigma': 0.0675630553493295, 'normalization': 'none'}. Best is trial 272 with value: 0.5198344707489013.
Generating rdkit fingerprints...
Generated fingerprints with 1024 features for 900 molecules
Data shape: X=(900, 1024), y=(900,)
Trial 409: 5-fold CV loss = 0.5762
[I 2025-08-07 17:45:01,564] Trial 409 finished with value: 0.5762168526649475 and parameters: {'fp_type': 'morgan', 'morgan_only_radius': 2, 'morgan_only_nBits': 1024, 'num_hidden_layers': 3, 'hidden_dim_0': 512, 'hidden_dim_1': 128, 'hidden_dim_2': 512, 'kl_weight': 0.006971144981441061, 'lr': 0.001865293987929992, 'batch_size': 32, 'dropout_rate': 0.45421790420589125, 'prior_mu': -0.014003676568412766, 'prior_sigma': 0.06563841450373194, 'normalization': 'none'}. Best is trial 272 with value: 0.5198344707489013.
Generating rdkit fingerprints...
Generated fingerprints with 1024 features for 900 molecules
Data shape: X=(900, 1024), y=(900,)
Trial 404: 5-fold CV loss = 0.5272
[I 2025-08-07 17:45:22,954] Trial 404 finished with value: 0.5272317111492157 and parameters: {'fp_type': 'morgan', 'morgan_only_radius': 2, 'morgan_only_nBits': 1024, 'num_hidden_layers': 3, 'hidden_dim_0': 512, 'hidden_dim_1': 128, 'hidden_dim_2': 512, 'kl_weight': 0.0050119854824886585, 'lr': 0.002223231217617884, 'batch_size': 32, 'dropout_rate': 0.4659530963016631, 'prior_mu': 0.0011954405494631762, 'prior_sigma': 0.07238620106798727, 'normalization': 'none'}. Best is trial 272 with value: 0.5198344707489013.
Generating rdkit fingerprints...
Generated fingerprints with 1024 features for 900 molecules
Data shape: X=(900, 1024), y=(900,)
Trial 412: 5-fold CV loss = 0.6740
[I 2025-08-07 17:45:35,197] Trial 412 finished with value: 0.6740437030792237 and parameters: {'fp_type': 'rdkit', 'rdkit_only_maxPath': 8, 'rdkit_only_nBits': 1024, 'num_hidden_layers': 3, 'hidden_dim_0': 512, 'hidden_dim_1': 128, 'hidden_dim_2': 512, 'kl_weight': 0.0052109418055109715, 'lr': 0.0021358769381132577, 'batch_size': 32, 'dropout_rate': 0.466684207324919, 'prior_mu': -0.001003165443278796, 'prior_sigma': 0.06170936044810337, 'normalization': 'layer'}. Best is trial 272 with value: 0.5198344707489013.
Generating morgan fingerprints...
Generated fingerprints with 1024 features for 900 molecules
Data shape: X=(900, 1024), y=(900,)
Trial 411: 5-fold CV loss = 0.6649
[I 2025-08-07 17:45:44,143] Trial 411 finished with value: 0.6648702144622802 and parameters: {'fp_type': 'rdkit', 'rdkit_only_maxPath': 7, 'rdkit_only_nBits': 1024, 'num_hidden_layers': 3, 'hidden_dim_0': 512, 'hidden_dim_1': 128, 'hidden_dim_2': 512, 'kl_weight': 0.0036845594137104062, 'lr': 0.0006121190436775283, 'batch_size': 32, 'dropout_rate': 0.45153847225219046, 'prior_mu': 0.01321822728601791, 'prior_sigma': 0.06107567124968883, 'normalization': 'layer'}. Best is trial 272 with value: 0.5198344707489013.
Generating morgan fingerprints...
Generated fingerprints with 1024 features for 900 molecules
Data shape: X=(900, 1024), y=(900,)
Trial 414: 5-fold CV loss = 0.6857
[I 2025-08-07 17:46:01,481] Trial 414 finished with value: 0.6856834530830384 and parameters: {'fp_type': 'morgan', 'morgan_only_radius': 2, 'morgan_only_nBits': 1024, 'num_hidden_layers': 2, 'hidden_dim_0': 512, 'hidden_dim_1': 128, 'kl_weight': 0.0060163012258939675, 'lr': 0.002377666561140812, 'batch_size': 32, 'dropout_rate': 0.4624205297212112, 'prior_mu': 0.0006900315228986452, 'prior_sigma': 0.069734110346834, 'normalization': 'none'}. Best is trial 272 with value: 0.5198344707489013.
Generating morgan fingerprints...
Generated fingerprints with 1024 features for 900 molecules
Data shape: X=(900, 1024), y=(900,)
Trial 413: 5-fold CV loss = 0.8799
[I 2025-08-07 17:46:14,388] Trial 413 finished with value: 0.879944896697998 and parameters: {'fp_type': 'rdkit', 'rdkit_only_maxPath': 8, 'rdkit_only_nBits': 1024, 'num_hidden_layers': 3, 'hidden_dim_0': 512, 'hidden_dim_1': 128, 'hidden_dim_2': 512, 'kl_weight': 0.0036431558106427074, 'lr': 0.0006457947833561694, 'batch_size': 32, 'dropout_rate': 0.4646707042352433, 'prior_mu': 0.002587715868289686, 'prior_sigma': 0.07575644013620884, 'normalization': 'none'}. Best is trial 272 with value: 0.5198344707489013.
Generating morgan fingerprints...
Generated fingerprints with 1024 features for 900 molecules
Data shape: X=(900, 1024), y=(900,)
Trial 415: 5-fold CV loss = 0.6251
[I 2025-08-07 17:46:36,860] Trial 415 finished with value: 0.6251166522502899 and parameters: {'fp_type': 'morgan', 'morgan_only_radius': 2, 'morgan_only_nBits': 1024, 'num_hidden_layers': 2, 'hidden_dim_0': 512, 'hidden_dim_1': 128, 'kl_weight': 0.003960518581541107, 'lr': 0.0023099473567523626, 'batch_size': 32, 'dropout_rate': 0.47239248859465943, 'prior_mu': 0.007111313373219082, 'prior_sigma': 0.0733854781133411, 'normalization': 'none'}. Best is trial 272 with value: 0.5198344707489013.
Generating morgan fingerprints...
Generated fingerprints with 1024 features for 900 molecules
Data shape: X=(900, 1024), y=(900,)
Trial 416: 5-fold CV loss = 0.5356
[I 2025-08-07 17:47:06,682] Trial 416 finished with value: 0.5355672955513 and parameters: {'fp_type': 'morgan', 'morgan_only_radius': 2, 'morgan_only_nBits': 1024, 'num_hidden_layers': 3, 'hidden_dim_0': 512, 'hidden_dim_1': 128, 'hidden_dim_2': 512, 'kl_weight': 0.0039691741624381695, 'lr': 0.0022624447072615078, 'batch_size': 32, 'dropout_rate': 0.4690550708532742, 'prior_mu': 0.009318169382417217, 'prior_sigma': 0.07327526385748546, 'normalization': 'none'}. Best is trial 272 with value: 0.5198344707489013.
Generating morgan fingerprints...
Generated fingerprints with 1024 features for 900 molecules
Data shape: X=(900, 1024), y=(900,)
Trial 418: 5-fold CV loss = 0.5245
[I 2025-08-07 17:48:16,570] Trial 418 finished with value: 0.5244643926620484 and parameters: {'fp_type': 'morgan', 'morgan_only_radius': 2, 'morgan_only_nBits': 1024, 'num_hidden_layers': 3, 'hidden_dim_0': 512, 'hidden_dim_1': 128, 'hidden_dim_2': 512, 'kl_weight': 0.0033357714631991717, 'lr': 0.0020351193271905856, 'batch_size': 32, 'dropout_rate': 0.47381951436082687, 'prior_mu': -0.005435410177955145, 'prior_sigma': 0.06877521644852067, 'normalization': 'none'}. Best is trial 272 with value: 0.5198344707489013.
Generating morgan fingerprints...
Generated fingerprints with 1024 features for 900 molecules
Data shape: X=(900, 1024), y=(900,)
Trial 419: 5-fold CV loss = 0.5331
[I 2025-08-07 17:48:20,779] Trial 419 finished with value: 0.5330676257610321 and parameters: {'fp_type': 'morgan', 'morgan_only_radius': 2, 'morgan_only_nBits': 1024, 'num_hidden_layers': 3, 'hidden_dim_0': 512, 'hidden_dim_1': 128, 'hidden_dim_2': 512, 'kl_weight': 0.0032845393072984544, 'lr': 0.0020185278191111487, 'batch_size': 32, 'dropout_rate': 0.474041670462242, 'prior_mu': -0.00426132517845223, 'prior_sigma': 0.06885021371849775, 'normalization': 'none'}. Best is trial 272 with value: 0.5198344707489013.
Generating morgan fingerprints...
Generated fingerprints with 1024 features for 900 molecules
Data shape: X=(900, 1024), y=(900,)
Trial 417: 5-fold CV loss = 0.5345
[I 2025-08-07 17:48:41,360] Trial 417 finished with value: 0.5345061421394348 and parameters: {'fp_type': 'morgan', 'morgan_only_radius': 2, 'morgan_only_nBits': 1024, 'num_hidden_layers': 3, 'hidden_dim_0': 512, 'hidden_dim_1': 128, 'hidden_dim_2': 512, 'kl_weight': 0.004258735133870301, 'lr': 0.0023010657078197405, 'batch_size': 32, 'dropout_rate': 0.47179706356018697, 'prior_mu': 0.021276627670019508, 'prior_sigma': 0.07444159397642225, 'normalization': 'none'}. Best is trial 272 with value: 0.5198344707489013.
Generating morgan fingerprints...
Generated fingerprints with 1024 features for 900 molecules
Data shape: X=(900, 1024), y=(900,)
Trial 407: 5-fold CV loss = 0.5449
[I 2025-08-07 17:48:51,174] Trial 407 finished with value: 0.5448952317237854 and parameters: {'fp_type': 'morgan', 'morgan_only_radius': 2, 'morgan_only_nBits': 1024, 'num_hidden_layers': 3, 'hidden_dim_0': 512, 'hidden_dim_1': 128, 'hidden_dim_2': 512, 'kl_weight': 0.003843115589175667, 'lr': 0.0018688216534176046, 'batch_size': 32, 'dropout_rate': 0.45668171423944054, 'prior_mu': -0.010588353287098621, 'prior_sigma': 0.07030281507266659, 'normalization': 'none'}. Best is trial 272 with value: 0.5198344707489013.
Generating morgan fingerprints...
Generated fingerprints with 1024 features for 900 molecules
Data shape: X=(900, 1024), y=(900,)
Trial 421: 5-fold CV loss = 0.5728
[I 2025-08-07 17:49:33,748] Trial 421 finished with value: 0.5727543652057647 and parameters: {'fp_type': 'morgan', 'morgan_only_radius': 2, 'morgan_only_nBits': 1024, 'num_hidden_layers': 3, 'hidden_dim_0': 512, 'hidden_dim_1': 128, 'hidden_dim_2': 512, 'kl_weight': 0.0029003994154023632, 'lr': 0.001767976604732724, 'batch_size': 32, 'dropout_rate': 0.45295343341414684, 'prior_mu': 0.01568192829129644, 'prior_sigma': 0.06700261683407047, 'normalization': 'none'}. Best is trial 272 with value: 0.5198344707489013.
Generating morgan fingerprints...
Generated fingerprints with 1024 features for 900 molecules
Data shape: X=(900, 1024), y=(900,)
Trial 420: 5-fold CV loss = 0.5246
[I 2025-08-07 17:49:46,099] Trial 420 finished with value: 0.524605143070221 and parameters: {'fp_type': 'morgan', 'morgan_only_radius': 2, 'morgan_only_nBits': 1024, 'num_hidden_layers': 3, 'hidden_dim_0': 512, 'hidden_dim_1': 128, 'hidden_dim_2': 512, 'kl_weight': 0.0027315772033843135, 'lr': 0.00199682251319197, 'batch_size': 32, 'dropout_rate': 0.45621412283318596, 'prior_mu': -0.007353513801602018, 'prior_sigma': 0.06799127983442846, 'normalization': 'none'}. Best is trial 272 with value: 0.5198344707489013.
Generating morgan fingerprints...
Generated fingerprints with 1024 features for 900 molecules
Data shape: X=(900, 1024), y=(900,)
Trial 422: 5-fold CV loss = 0.5771
[I 2025-08-07 17:51:01,655] Trial 422 finished with value: 0.5771498680114746 and parameters: {'fp_type': 'morgan', 'morgan_only_radius': 2, 'morgan_only_nBits': 1024, 'num_hidden_layers': 3, 'hidden_dim_0': 512, 'hidden_dim_1': 128, 'hidden_dim_2': 512, 'kl_weight': 0.0027924015608223897, 'lr': 0.001977684952602797, 'batch_size': 32, 'dropout_rate': 0.4590675971112942, 'prior_mu': -0.008906679041003108, 'prior_sigma': 0.13642440280640178, 'normalization': 'none'}. Best is trial 272 with value: 0.5198344707489013.
Generating morgan fingerprints...
Generated fingerprints with 1024 features for 900 molecules
Data shape: X=(900, 1024), y=(900,)
Trial 424: 5-fold CV loss = 0.5337
[I 2025-08-07 17:51:04,178] Trial 424 finished with value: 0.533717256784439 and parameters: {'fp_type': 'morgan', 'morgan_only_radius': 2, 'morgan_only_nBits': 1024, 'num_hidden_layers': 3, 'hidden_dim_0': 512, 'hidden_dim_1': 128, 'hidden_dim_2': 512, 'kl_weight': 0.005037460598738713, 'lr': 0.0020724761083028447, 'batch_size': 32, 'dropout_rate': 0.4619790599272165, 'prior_mu': -0.006771778027717657, 'prior_sigma': 0.061153554224732204, 'normalization': 'none'}. Best is trial 272 with value: 0.5198344707489013.
Generating morgan fingerprints...
Generated fingerprints with 1024 features for 900 molecules
Data shape: X=(900, 1024), y=(900,)
Trial 425: 5-fold CV loss = 0.5730
[I 2025-08-07 17:51:10,160] Trial 425 finished with value: 0.5729962646961212 and parameters: {'fp_type': 'morgan', 'morgan_only_radius': 2, 'morgan_only_nBits': 1024, 'num_hidden_layers': 3, 'hidden_dim_0': 512, 'hidden_dim_1': 128, 'hidden_dim_2': 512, 'kl_weight': 0.002549387743213412, 'lr': 0.0019909204728923687, 'batch_size': 32, 'dropout_rate': 0.4652448561980023, 'prior_mu': -0.007890235744128988, 'prior_sigma': 0.06029330198632998, 'normalization': 'none'}. Best is trial 272 with value: 0.5198344707489013.
Generating morgan fingerprints...
Generated fingerprints with 1024 features for 900 molecules
Data shape: X=(900, 1024), y=(900,)
Trial 427: 5-fold CV loss = 0.5426
[I 2025-08-07 17:52:33,728] Trial 427 finished with value: 0.5425811588764191 and parameters: {'fp_type': 'morgan', 'morgan_only_radius': 2, 'morgan_only_nBits': 1024, 'num_hidden_layers': 3, 'hidden_dim_0': 128, 'hidden_dim_1': 128, 'hidden_dim_2': 512, 'kl_weight': 0.0024566285797078397, 'lr': 0.0018443557334205645, 'batch_size': 32, 'dropout_rate': 0.4755195996252916, 'prior_mu': -0.004744287302354852, 'prior_sigma': 0.06603321417743181, 'normalization': 'none'}. Best is trial 272 with value: 0.5198344707489013.
Generating morgan fingerprints...
Generated fingerprints with 1024 features for 900 molecules
Data shape: X=(900, 1024), y=(900,)
Trial 428: 5-fold CV loss = 0.5505
[I 2025-08-07 17:52:40,755] Trial 428 finished with value: 0.5504751920700073 and parameters: {'fp_type': 'morgan', 'morgan_only_radius': 2, 'morgan_only_nBits': 1024, 'num_hidden_layers': 3, 'hidden_dim_0': 128, 'hidden_dim_1': 128, 'hidden_dim_2': 512, 'kl_weight': 0.0019607407424817847, 'lr': 0.0018281693592966523, 'batch_size': 32, 'dropout_rate': 0.4401361653715666, 'prior_mu': -0.019122758842344552, 'prior_sigma': 0.06643387033131291, 'normalization': 'none'}. Best is trial 272 with value: 0.5198344707489013.
Generating morgan fingerprints...
Generated fingerprints with 1024 features for 900 molecules
Data shape: X=(900, 1024), y=(900,)
Trial 426: 5-fold CV loss = 0.5556
[I 2025-08-07 17:53:13,606] Trial 426 finished with value: 0.5555749833583832 and parameters: {'fp_type': 'morgan', 'morgan_only_radius': 2, 'morgan_only_nBits': 1024, 'num_hidden_layers': 3, 'hidden_dim_0': 128, 'hidden_dim_1': 128, 'hidden_dim_2': 512, 'kl_weight': 0.0023903003521758455, 'lr': 0.002030993042234024, 'batch_size': 32, 'dropout_rate': 0.44372024348780575, 'prior_mu': -0.001881555317402871, 'prior_sigma': 0.06080139750135599, 'normalization': 'none'}. Best is trial 272 with value: 0.5198344707489013.
Generating morgan fingerprints...
Generated fingerprints with 1024 features for 900 molecules
Data shape: X=(900, 1024), y=(900,)
Trial 429: 5-fold CV loss = 0.5325
[I 2025-08-07 17:53:46,547] Trial 429 finished with value: 0.5325473248958588 and parameters: {'fp_type': 'morgan', 'morgan_only_radius': 2, 'morgan_only_nBits': 1024, 'num_hidden_layers': 3, 'hidden_dim_0': 512, 'hidden_dim_1': 128, 'hidden_dim_2': 512, 'kl_weight': 0.003298104196490399, 'lr': 0.0021407477942660055, 'batch_size': 32, 'dropout_rate': 0.4462585956204788, 'prior_mu': 0.004680769423549523, 'prior_sigma': 0.06839370564794751, 'normalization': 'none'}. Best is trial 272 with value: 0.5198344707489013.
Generating morgan fingerprints...
Generated fingerprints with 1024 features for 900 molecules
Data shape: X=(900, 1024), y=(900,)
Trial 423: 5-fold CV loss = 0.5397
[I 2025-08-07 17:53:49,267] Trial 423 finished with value: 0.539658921957016 and parameters: {'fp_type': 'morgan', 'morgan_only_radius': 2, 'morgan_only_nBits': 1024, 'num_hidden_layers': 3, 'hidden_dim_0': 512, 'hidden_dim_1': 128, 'hidden_dim_2': 512, 'kl_weight': 0.002972183459706228, 'lr': 0.0020573183518554543, 'batch_size': 32, 'dropout_rate': 0.46333035763480507, 'prior_mu': -0.005408475220075452, 'prior_sigma': 0.061127129890430114, 'normalization': 'none'}. Best is trial 272 with value: 0.5198344707489013.
Generating morgan fingerprints...
Generated fingerprints with 1024 features for 900 molecules
Data shape: X=(900, 1024), y=(900,)
Trial 431: 5-fold CV loss = 0.7650
