[I 2025-08-07 18:59:28,457] Trial 585 finished with value: 0.5441590666770935 and parameters: {'fp_type': 'morgan', 'morgan_only_radius': 2, 'morgan_only_nBits': 1024, 'num_hidden_layers': 3, 'hidden_dim_0': 512, 'hidden_dim_1': 128, 'hidden_dim_2': 512, 'kl_weight': 0.0022802518115343116, 'lr': 0.0028668892684392657, 'batch_size': 32, 'dropout_rate': 0.48407222134299466, 'prior_mu': -0.015279981169726484, 'prior_sigma': 0.07742705943007572, 'normalization': 'none'}. Best is trial 272 with value: 0.5198344707489013.
Generating morgan fingerprints...
Generated fingerprints with 1024 features for 900 molecules
Data shape: X=(900, 1024), y=(900,)
Trial 592: 5-fold CV loss = 0.5272
[I 2025-08-07 18:59:41,611] Trial 592 finished with value: 0.5272096037864685 and parameters: {'fp_type': 'morgan', 'morgan_only_radius': 2, 'morgan_only_nBits': 1024, 'num_hidden_layers': 3, 'hidden_dim_0': 512, 'hidden_dim_1': 128, 'hidden_dim_2': 512, 'kl_weight': 0.0021382616039678417, 'lr': 0.0017947848156844935, 'batch_size': 32, 'dropout_rate': 0.4999487587623046, 'prior_mu': 0.00932642980360642, 'prior_sigma': 0.06288281099148434, 'normalization': 'none'}. Best is trial 272 with value: 0.5198344707489013.
Generating morgan fingerprints...
Generated fingerprints with 1024 features for 900 molecules
Data shape: X=(900, 1024), y=(900,)
Trial 591: 5-fold CV loss = 0.5315
[I 2025-08-07 18:59:51,769] Trial 591 finished with value: 0.5314548254013062 and parameters: {'fp_type': 'morgan', 'morgan_only_radius': 2, 'morgan_only_nBits': 1024, 'num_hidden_layers': 3, 'hidden_dim_0': 512, 'hidden_dim_1': 128, 'hidden_dim_2': 512, 'kl_weight': 0.0019128354103447494, 'lr': 0.002980828937616409, 'batch_size': 32, 'dropout_rate': 0.42246277121530856, 'prior_mu': -0.04666832936767966, 'prior_sigma': 0.06278357237513867, 'normalization': 'none'}. Best is trial 272 with value: 0.5198344707489013.
Generating morgan fingerprints...
Generated fingerprints with 1024 features for 900 molecules
Data shape: X=(900, 1024), y=(900,)
Trial 593: 5-fold CV loss = 0.8165
[I 2025-08-07 19:00:01,140] Trial 593 finished with value: 0.8164711236953736 and parameters: {'fp_type': 'morgan', 'morgan_only_radius': 2, 'morgan_only_nBits': 1024, 'num_hidden_layers': 3, 'hidden_dim_0': 256, 'hidden_dim_1': 128, 'hidden_dim_2': 512, 'kl_weight': 0.0012979925271948615, 'lr': 0.0009112439477693556, 'batch_size': 32, 'dropout_rate': 0.49966423322072956, 'prior_mu': 0.010042908616116012, 'prior_sigma': 0.06309255721873519, 'normalization': 'none'}. Best is trial 272 with value: 0.5198344707489013.
Generating morgan fingerprints...
Generated fingerprints with 1024 features for 900 molecules
Data shape: X=(900, 1024), y=(900,)
Trial 597: 5-fold CV loss = 0.9806
[I 2025-08-07 19:00:46,857] Trial 597 finished with value: 0.9805822491645813 and parameters: {'fp_type': 'morgan', 'morgan_only_radius': 2, 'morgan_only_nBits': 1024, 'num_hidden_layers': 3, 'hidden_dim_0': 512, 'hidden_dim_1': 1024, 'hidden_dim_2': 512, 'kl_weight': 0.0017891397616675827, 'lr': 0.002318835111106384, 'batch_size': 32, 'dropout_rate': 0.46882127275932417, 'prior_mu': -0.031746711132097344, 'prior_sigma': 0.07109984006284976, 'normalization': 'none'}. Best is trial 272 with value: 0.5198344707489013.
Generating morgan fingerprints...
Generated fingerprints with 1024 features for 900 molecules
Data shape: X=(900, 1024), y=(900,)
Trial 595: 5-fold CV loss = 0.5396
[I 2025-08-07 19:01:01,609] Trial 595 finished with value: 0.5395700454711914 and parameters: {'fp_type': 'morgan', 'morgan_only_radius': 2, 'morgan_only_nBits': 1024, 'num_hidden_layers': 3, 'hidden_dim_0': 256, 'hidden_dim_1': 128, 'hidden_dim_2': 512, 'kl_weight': 0.001182914026265295, 'lr': 0.002317845309219227, 'batch_size': 32, 'dropout_rate': 0.4999247831575028, 'prior_mu': -0.0006590344260284861, 'prior_sigma': 0.06298675359649415, 'normalization': 'none'}. Best is trial 272 with value: 0.5198344707489013.
Generating morgan fingerprints...
Generated fingerprints with 1024 features for 900 molecules
Data shape: X=(900, 1024), y=(900,)
Trial 596: 5-fold CV loss = 0.6425
[I 2025-08-07 19:01:31,689] Trial 596 finished with value: 0.6425239443778992 and parameters: {'fp_type': 'morgan', 'morgan_only_radius': 2, 'morgan_only_nBits': 1024, 'num_hidden_layers': 3, 'hidden_dim_0': 512, 'hidden_dim_1': 1024, 'hidden_dim_2': 512, 'kl_weight': 0.0016944743359854208, 'lr': 0.002275068123791799, 'batch_size': 32, 'dropout_rate': 0.25326666975738654, 'prior_mu': -0.03165891047492743, 'prior_sigma': 0.06695061089682978, 'normalization': 'none'}. Best is trial 272 with value: 0.5198344707489013.
Generating morgan fingerprints...
Generated fingerprints with 1024 features for 900 molecules
Data shape: X=(900, 1024), y=(900,)
Trial 599: 5-fold CV loss = 0.5265
[I 2025-08-07 19:02:32,441] Trial 599 finished with value: 0.5265495777130127 and parameters: {'fp_type': 'morgan', 'morgan_only_radius': 2, 'morgan_only_nBits': 1024, 'num_hidden_layers': 3, 'hidden_dim_0': 512, 'hidden_dim_1': 128, 'hidden_dim_2': 512, 'kl_weight': 0.00210027270494758, 'lr': 0.0020019918597684776, 'batch_size': 32, 'dropout_rate': 0.4855796854650826, 'prior_mu': -0.033518383243628075, 'prior_sigma': 0.06686393308982655, 'normalization': 'none'}. Best is trial 272 with value: 0.5198344707489013.
Generating morgan fingerprints...
Generated fingerprints with 1024 features for 900 molecules
Data shape: X=(900, 1024), y=(900,)
Trial 598: 5-fold CV loss = 0.5257
[I 2025-08-07 19:02:41,524] Trial 598 finished with value: 0.525674021244049 and parameters: {'fp_type': 'morgan', 'morgan_only_radius': 2, 'morgan_only_nBits': 1024, 'num_hidden_layers': 3, 'hidden_dim_0': 512, 'hidden_dim_1': 128, 'hidden_dim_2': 512, 'kl_weight': 0.0012360337665300448, 'lr': 0.002034715719287078, 'batch_size': 32, 'dropout_rate': 0.48915740780807976, 'prior_mu': -0.003510266565318318, 'prior_sigma': 0.06673265495595819, 'normalization': 'none'}. Best is trial 272 with value: 0.5198344707489013.
Generating morgan fingerprints...
Generated fingerprints with 1024 features for 900 molecules
Data shape: X=(900, 1024), y=(900,)
Trial 594: 5-fold CV loss = 0.5823
[I 2025-08-07 19:02:56,676] Trial 594 finished with value: 0.5822917819023132 and parameters: {'fp_type': 'morgan', 'morgan_only_radius': 2, 'morgan_only_nBits': 1024, 'num_hidden_layers': 3, 'hidden_dim_0': 256, 'hidden_dim_1': 128, 'hidden_dim_2': 512, 'kl_weight': 0.0012284056624390428, 'lr': 0.0017931914136303457, 'batch_size': 32, 'dropout_rate': 0.4219640628076712, 'prior_mu': 0.007518565099261985, 'prior_sigma': 0.0630895833117284, 'normalization': 'none'}. Best is trial 272 with value: 0.5198344707489013.
Generating morgan fingerprints...
Generated fingerprints with 1024 features for 900 molecules
Data shape: X=(900, 1024), y=(900,)
Trial 601: 5-fold CV loss = 0.5463
[I 2025-08-07 19:03:55,687] Trial 601 finished with value: 0.5463009417057038 and parameters: {'fp_type': 'morgan', 'morgan_only_radius': 2, 'morgan_only_nBits': 1024, 'num_hidden_layers': 3, 'hidden_dim_0': 512, 'hidden_dim_1': 128, 'hidden_dim_2': 512, 'kl_weight': 0.002360945113443986, 'lr': 0.0019614961949038752, 'batch_size': 32, 'dropout_rate': 0.48355920068524405, 'prior_mu': -0.037810816717856646, 'prior_sigma': 0.059068592995618896, 'normalization': 'none'}. Best is trial 272 with value: 0.5198344707489013.
Generating morgan fingerprints...
Generated fingerprints with 1024 features for 900 molecules
Data shape: X=(900, 1024), y=(900,)
Trial 602: 5-fold CV loss = 0.5270
[I 2025-08-07 19:04:02,360] Trial 602 finished with value: 0.5269613683223724 and parameters: {'fp_type': 'morgan', 'morgan_only_radius': 2, 'morgan_only_nBits': 1024, 'num_hidden_layers': 3, 'hidden_dim_0': 512, 'hidden_dim_1': 128, 'hidden_dim_2': 512, 'kl_weight': 0.001176787757591236, 'lr': 0.002567395699052174, 'batch_size': 32, 'dropout_rate': 0.4918927272771186, 'prior_mu': -0.0031743632863042675, 'prior_sigma': 0.05913320284348436, 'normalization': 'none'}. Best is trial 272 with value: 0.5198344707489013.
Generating morgan fingerprints...
Generated fingerprints with 1024 features for 900 molecules
Data shape: X=(900, 1024), y=(900,)
Trial 600: 5-fold CV loss = 0.5293
[I 2025-08-07 19:04:22,212] Trial 600 finished with value: 0.5292737245559692 and parameters: {'fp_type': 'morgan', 'morgan_only_radius': 2, 'morgan_only_nBits': 1024, 'num_hidden_layers': 3, 'hidden_dim_0': 512, 'hidden_dim_1': 128, 'hidden_dim_2': 512, 'kl_weight': 0.00205383701674457, 'lr': 0.0019808707930127974, 'batch_size': 32, 'dropout_rate': 0.4840016353161199, 'prior_mu': -0.0005390129050500394, 'prior_sigma': 0.06805112048952301, 'normalization': 'none'}. Best is trial 272 with value: 0.5198344707489013.
Generating morgan fingerprints...
Generated fingerprints with 1024 features for 900 molecules
Data shape: X=(900, 1024), y=(900,)
Trial 604: 5-fold CV loss = 0.5343
[I 2025-08-07 19:04:53,200] Trial 604 finished with value: 0.5342866897583007 and parameters: {'fp_type': 'morgan', 'morgan_only_radius': 2, 'morgan_only_nBits': 1024, 'num_hidden_layers': 3, 'hidden_dim_0': 1024, 'hidden_dim_1': 128, 'hidden_dim_2': 512, 'kl_weight': 0.000999101109001421, 'lr': 0.0024836028917201917, 'batch_size': 32, 'dropout_rate': 0.48928358955573137, 'prior_mu': -0.004554850354317706, 'prior_sigma': 0.05888890672085127, 'normalization': 'none'}. Best is trial 272 with value: 0.5198344707489013.
Generating morgan fingerprints...
Generated fingerprints with 1024 features for 900 molecules
Data shape: X=(900, 1024), y=(900,)
Trial 605: 5-fold CV loss = 0.5444
[I 2025-08-07 19:05:01,920] Trial 605 finished with value: 0.5443917751312256 and parameters: {'fp_type': 'morgan', 'morgan_only_radius': 2, 'morgan_only_nBits': 1024, 'num_hidden_layers': 3, 'hidden_dim_0': 1024, 'hidden_dim_1': 128, 'hidden_dim_2': 512, 'kl_weight': 0.0013724545379217273, 'lr': 0.002465185734672462, 'batch_size': 32, 'dropout_rate': 0.4898975835793987, 'prior_mu': -0.022166261313542778, 'prior_sigma': 0.06656329349638951, 'normalization': 'none'}. Best is trial 272 with value: 0.5198344707489013.
Generating morgan fingerprints...
Generated fingerprints with 1024 features for 900 molecules
Data shape: X=(900, 1024), y=(900,)
Trial 607: 5-fold CV loss = 0.9645
[I 2025-08-07 19:05:22,668] Trial 607 finished with value: 0.9645224571228027 and parameters: {'fp_type': 'morgan', 'morgan_only_radius': 2, 'morgan_only_nBits': 1024, 'num_hidden_layers': 3, 'hidden_dim_0': 512, 'hidden_dim_1': 128, 'hidden_dim_2': 512, 'kl_weight': 0.0012972162778396989, 'lr': 0.00046739752532001425, 'batch_size': 32, 'dropout_rate': 0.47429118172230644, 'prior_mu': -0.020492586904452825, 'prior_sigma': 0.06533677957616568, 'normalization': 'none'}. Best is trial 272 with value: 0.5198344707489013.
Generating morgan fingerprints...
Generated fingerprints with 1024 features for 900 molecules
Data shape: X=(900, 1024), y=(900,)
Trial 609: 5-fold CV loss = 0.5604
[I 2025-08-07 19:06:18,339] Trial 609 finished with value: 0.5604013442993164 and parameters: {'fp_type': 'morgan', 'morgan_only_radius': 2, 'morgan_only_nBits': 1024, 'num_hidden_layers': 3, 'hidden_dim_0': 512, 'hidden_dim_1': 128, 'hidden_dim_2': 512, 'kl_weight': 0.0010707473307335464, 'lr': 0.0022208805739701806, 'batch_size': 32, 'dropout_rate': 0.08289195169891134, 'prior_mu': -0.011802781682583365, 'prior_sigma': 0.06158306203109575, 'normalization': 'none'}. Best is trial 272 with value: 0.5198344707489013.
Generating morgan fingerprints...
Generated fingerprints with 1024 features for 900 molecules
Data shape: X=(900, 1024), y=(900,)
Trial 608: 5-fold CV loss = 0.5348
[I 2025-08-07 19:06:31,297] Trial 608 finished with value: 0.534755003452301 and parameters: {'fp_type': 'morgan', 'morgan_only_radius': 2, 'morgan_only_nBits': 1024, 'num_hidden_layers': 3, 'hidden_dim_0': 512, 'hidden_dim_1': 128, 'hidden_dim_2': 512, 'kl_weight': 0.0010901738116522292, 'lr': 0.0021592624832890155, 'batch_size': 32, 'dropout_rate': 0.472081700665114, 'prior_mu': -0.01364534961170093, 'prior_sigma': 0.06073796376436177, 'normalization': 'none'}. Best is trial 272 with value: 0.5198344707489013.
Generating morgan fingerprints...
Generated fingerprints with 1024 features for 900 molecules
Data shape: X=(900, 1024), y=(900,)
Trial 610: 5-fold CV loss = 1.0715
[I 2025-08-07 19:06:37,848] Trial 610 finished with value: 1.0715150117874146 and parameters: {'fp_type': 'morgan', 'morgan_only_radius': 2, 'morgan_only_nBits': 1024, 'num_hidden_layers': 3, 'hidden_dim_0': 512, 'hidden_dim_1': 128, 'hidden_dim_2': 512, 'kl_weight': 0.00147108237162029, 'lr': 0.0011206710429767794, 'batch_size': 32, 'dropout_rate': 0.4700003522987994, 'prior_mu': -0.02811505806166998, 'prior_sigma': 0.07363893635424522, 'normalization': 'none'}. Best is trial 272 with value: 0.5198344707489013.
Generating morgan fingerprints...
Generated fingerprints with 1024 features for 900 molecules
Data shape: X=(900, 1024), y=(900,)
Trial 606: 5-fold CV loss = 0.5257
[I 2025-08-07 19:06:38,968] Trial 606 finished with value: 0.5256638646125793 and parameters: {'fp_type': 'morgan', 'morgan_only_radius': 2, 'morgan_only_nBits': 1024, 'num_hidden_layers': 3, 'hidden_dim_0': 512, 'hidden_dim_1': 128, 'hidden_dim_2': 512, 'kl_weight': 0.001018416565407187, 'lr': 0.002500833924721932, 'batch_size': 32, 'dropout_rate': 0.49133541210935794, 'prior_mu': -0.022299007907652185, 'prior_sigma': 0.05999294549242726, 'normalization': 'none'}. Best is trial 272 with value: 0.5198344707489013.
Generating morgan fingerprints...
Generated fingerprints with 1024 features for 900 molecules
Data shape: X=(900, 1024), y=(900,)
Trial 603: 5-fold CV loss = 0.5298
[I 2025-08-07 19:07:00,593] Trial 603 finished with value: 0.5297545909881591 and parameters: {'fp_type': 'morgan', 'morgan_only_radius': 2, 'morgan_only_nBits': 1024, 'num_hidden_layers': 3, 'hidden_dim_0': 512, 'hidden_dim_1': 128, 'hidden_dim_2': 512, 'kl_weight': 0.0011267047336190686, 'lr': 0.0024832629241000547, 'batch_size': 32, 'dropout_rate': 0.48982389171025986, 'prior_mu': -0.022023081016917592, 'prior_sigma': 0.06002362859517873, 'normalization': 'none'}. Best is trial 272 with value: 0.5198344707489013.
Generating morgan fingerprints...
Generated fingerprints with 1024 features for 900 molecules
Data shape: X=(900, 1024), y=(900,)
Trial 611: 5-fold CV loss = 0.5843
[I 2025-08-07 19:08:06,076] Trial 611 finished with value: 0.5843375980854034 and parameters: {'fp_type': 'morgan', 'morgan_only_radius': 2, 'morgan_only_nBits': 1024, 'num_hidden_layers': 3, 'hidden_dim_0': 512, 'hidden_dim_1': 128, 'hidden_dim_2': 512, 'kl_weight': 0.0014913459183402888, 'lr': 0.0017365197906482092, 'batch_size': 32, 'dropout_rate': 0.4796277909437103, 'prior_mu': -0.0404686574305793, 'prior_sigma': 0.07347359287817676, 'normalization': 'none'}. Best is trial 272 with value: 0.5198344707489013.
Generating morgan fingerprints...
Generated fingerprints with 1024 features for 900 molecules
Data shape: X=(900, 1024), y=(900,)
Trial 612: 5-fold CV loss = 0.5436
[I 2025-08-07 19:08:18,494] Trial 612 finished with value: 0.5435710847377777 and parameters: {'fp_type': 'morgan', 'morgan_only_radius': 2, 'morgan_only_nBits': 1024, 'num_hidden_layers': 3, 'hidden_dim_0': 512, 'hidden_dim_1': 128, 'hidden_dim_2': 512, 'kl_weight': 0.0015095021281014136, 'lr': 0.001726029404588646, 'batch_size': 32, 'dropout_rate': 0.48298308115178135, 'prior_mu': -0.04038615949880032, 'prior_sigma': 0.06919218219614313, 'normalization': 'none'}. Best is trial 272 with value: 0.5198344707489013.
Generating morgan fingerprints...
Generated fingerprints with 1024 features for 900 molecules
Data shape: X=(900, 1024), y=(900,)
Trial 613: 5-fold CV loss = 0.5295
[I 2025-08-07 19:08:38,410] Trial 613 finished with value: 0.5295105874538422 and parameters: {'fp_type': 'morgan', 'morgan_only_radius': 2, 'morgan_only_nBits': 1024, 'num_hidden_layers': 3, 'hidden_dim_0': 512, 'hidden_dim_1': 128, 'hidden_dim_2': 512, 'kl_weight': 0.0009252291100383266, 'lr': 0.0025963588380733494, 'batch_size': 32, 'dropout_rate': 0.4916810374621777, 'prior_mu': -0.02260814919501969, 'prior_sigma': 0.05655501943563634, 'normalization': 'none'}. Best is trial 272 with value: 0.5198344707489013.
Generating morgan fingerprints...
Generated fingerprints with 1024 features for 900 molecules
Data shape: X=(900, 1024), y=(900,)
Trial 616: 5-fold CV loss = 0.5288
[I 2025-08-07 19:09:16,358] Trial 616 finished with value: 0.5288307070732117 and parameters: {'fp_type': 'morgan', 'morgan_only_radius': 2, 'morgan_only_nBits': 1024, 'num_hidden_layers': 3, 'hidden_dim_0': 512, 'hidden_dim_1': 128, 'hidden_dim_2': 512, 'kl_weight': 0.0009411867384651239, 'lr': 0.0027196521617242862, 'batch_size': 32, 'dropout_rate': 0.49336316085685294, 'prior_mu': -0.027769649356804735, 'prior_sigma': 0.05820245071870754, 'normalization': 'none'}. Best is trial 272 with value: 0.5198344707489013.
Generating morgan fingerprints...
Generated fingerprints with 1024 features for 900 molecules
Data shape: X=(900, 1024), y=(900,)
Trial 615: 5-fold CV loss = 0.5282
[I 2025-08-07 19:09:27,851] Trial 615 finished with value: 0.5282260239124298 and parameters: {'fp_type': 'morgan', 'morgan_only_radius': 2, 'morgan_only_nBits': 1024, 'num_hidden_layers': 3, 'hidden_dim_0': 512, 'hidden_dim_1': 128, 'hidden_dim_2': 512, 'kl_weight': 0.0008873799796864649, 'lr': 0.0028730870220900436, 'batch_size': 32, 'dropout_rate': 0.4995917063138676, 'prior_mu': -0.028521984471076862, 'prior_sigma': 0.05648859756949925, 'normalization': 'none'}. Best is trial 272 with value: 0.5198344707489013.
Generating morgan fingerprints...
Generated fingerprints with 1024 features for 900 molecules
Data shape: X=(900, 1024), y=(900,)
Trial 618: 5-fold CV loss = 0.5463
[I 2025-08-07 19:10:10,396] Trial 618 finished with value: 0.5462774753570556 and parameters: {'fp_type': 'morgan', 'morgan_only_radius': 2, 'morgan_only_nBits': 1024, 'num_hidden_layers': 3, 'hidden_dim_0': 512, 'hidden_dim_1': 128, 'hidden_dim_2': 512, 'kl_weight': 0.0008636526691292539, 'lr': 0.003220265310673299, 'batch_size': 32, 'dropout_rate': 0.4933547654318224, 'prior_mu': -0.015099334561414867, 'prior_sigma': 0.11022815236798796, 'normalization': 'none'}. Best is trial 272 with value: 0.5198344707489013.
Generating morgan fingerprints...
Generated fingerprints with 1024 features for 900 molecules
Data shape: X=(900, 1024), y=(900,)
Trial 617: 5-fold CV loss = 0.5294
[I 2025-08-07 19:10:36,539] Trial 617 finished with value: 0.5293988943099975 and parameters: {'fp_type': 'morgan', 'morgan_only_radius': 2, 'morgan_only_nBits': 1024, 'num_hidden_layers': 3, 'hidden_dim_0': 512, 'hidden_dim_1': 128, 'hidden_dim_2': 512, 'kl_weight': 0.00127458195957242, 'lr': 0.002771753451279595, 'batch_size': 32, 'dropout_rate': 0.4991791197414404, 'prior_mu': -0.033859222101005226, 'prior_sigma': 0.05499244157445645, 'normalization': 'none'}. Best is trial 272 with value: 0.5198344707489013.
Generating morgan fingerprints...
Generated fingerprints with 1024 features for 900 molecules
Data shape: X=(900, 1024), y=(900,)
Trial 619: 5-fold CV loss = 0.5473
[I 2025-08-07 19:10:56,724] Trial 619 finished with value: 0.547345906496048 and parameters: {'fp_type': 'morgan', 'morgan_only_radius': 2, 'morgan_only_nBits': 1024, 'num_hidden_layers': 3, 'hidden_dim_0': 512, 'hidden_dim_1': 128, 'hidden_dim_2': 512, 'kl_weight': 0.0013059779652479506, 'lr': 0.0023272878530444328, 'batch_size': 32, 'dropout_rate': 0.49197356552045873, 'prior_mu': -0.014770881651518873, 'prior_sigma': 0.12367721181787905, 'normalization': 'none'}. Best is trial 272 with value: 0.5198344707489013.
Generating morgan fingerprints...
Generated fingerprints with 1024 features for 900 molecules
Data shape: X=(900, 1024), y=(900,)
Trial 614: 5-fold CV loss = 0.5251
[I 2025-08-07 19:10:59,484] Trial 614 finished with value: 0.5250941812992096 and parameters: {'fp_type': 'morgan', 'morgan_only_radius': 2, 'morgan_only_nBits': 1024, 'num_hidden_layers': 3, 'hidden_dim_0': 512, 'hidden_dim_1': 128, 'hidden_dim_2': 512, 'kl_weight': 0.0009314366423085199, 'lr': 0.0026957638449987466, 'batch_size': 32, 'dropout_rate': 0.49214865795579943, 'prior_mu': -0.04145573149135787, 'prior_sigma': 0.05702486156394884, 'normalization': 'none'}. Best is trial 272 with value: 0.5198344707489013.
Generating morgan fingerprints...
Generated fingerprints with 1024 features for 900 molecules
Data shape: X=(900, 1024), y=(900,)
Trial 622: 5-fold CV loss = 0.6525
[I 2025-08-07 19:11:16,959] Trial 622 finished with value: 0.6524776816368103 and parameters: {'fp_type': 'morgan', 'morgan_only_radius': 2, 'morgan_only_nBits': 1024, 'num_hidden_layers': 0, 'kl_weight': 0.0010116055765060513, 'lr': 0.0023282077978840324, 'batch_size': 32, 'dropout_rate': 0.48125441479429826, 'prior_mu': -0.0546538446529858, 'prior_sigma': 0.06358261138939235, 'normalization': 'layer'}. Best is trial 272 with value: 0.5198344707489013.
Generating morgan fingerprints...
Generated fingerprints with 1024 features for 900 molecules
Data shape: X=(900, 1024), y=(900,)
Trial 620: 5-fold CV loss = 0.5645
[I 2025-08-07 19:11:18,816] Trial 620 finished with value: 0.5645470440387725 and parameters: {'fp_type': 'morgan', 'morgan_only_radius': 2, 'morgan_only_nBits': 1024, 'num_hidden_layers': 3, 'hidden_dim_0': 512, 'hidden_dim_1': 128, 'hidden_dim_2': 64, 'kl_weight': 0.001330711063640307, 'lr': 0.002285622305712919, 'batch_size': 32, 'dropout_rate': 0.4833925522359872, 'prior_mu': -0.048834962848491766, 'prior_sigma': 0.06382844617138335, 'normalization': 'none'}. Best is trial 272 with value: 0.5198344707489013.
Generating rdkit fingerprints...
Generated fingerprints with 1024 features for 900 molecules
Data shape: X=(900, 1024), y=(900,)
Trial 625: 5-fold CV loss = 0.5664
