[I 2025-08-07 16:17:10,991] Trial 91 finished with value: 1.2184468030929565 and parameters: {'fp_type': 'morgan_rdkit', 'combined_morgan_radius': 3, 'combined_morgan_nBits': 1024, 'combined_rdkit_maxPath': 5, 'combined_rdkit_nBits': 1024, 'num_hidden_layers': 0, 'kl_weight': 0.0001819181878605571, 'lr': 0.00018136636944731258, 'batch_size': 128, 'dropout_rate': 0.4561362326001215, 'prior_mu': 0.08484308251008288, 'prior_sigma': 0.10348962952448107, 'normalization': 'none'}. Best is trial 85 with value: 0.5345884144306183.
Generating morgan_rdkit fingerprints...
Generated fingerprints with 2048 features for 900 molecules
Data shape: X=(900, 2048), y=(900,)
Trial 87: 5-fold CV loss = 0.5523
[I 2025-08-07 16:17:15,671] Trial 87 finished with value: 0.5523139595985412 and parameters: {'fp_type': 'morgan_rdkit', 'combined_morgan_radius': 2, 'combined_morgan_nBits': 1024, 'combined_rdkit_maxPath': 8, 'combined_rdkit_nBits': 256, 'num_hidden_layers': 3, 'hidden_dim_0': 512, 'hidden_dim_1': 64, 'hidden_dim_2': 256, 'kl_weight': 0.000203519734988623, 'lr': 0.009230596047405372, 'batch_size': 128, 'dropout_rate': 0.451640027266435, 'prior_mu': 0.030730357519727015, 'prior_sigma': 0.09408035859601216, 'normalization': 'none'}. Best is trial 85 with value: 0.5345884144306183.
Generating morgan fingerprints...
Generated fingerprints with 2048 features for 900 molecules
Data shape: X=(900, 2048), y=(900,)
Trial 89: 5-fold CV loss = 0.5398
[I 2025-08-07 16:17:17,043] Trial 89 finished with value: 0.5397837102413178 and parameters: {'fp_type': 'morgan_rdkit', 'combined_morgan_radius': 3, 'combined_morgan_nBits': 1024, 'combined_rdkit_maxPath': 5, 'combined_rdkit_nBits': 1024, 'num_hidden_layers': 3, 'hidden_dim_0': 512, 'hidden_dim_1': 64, 'hidden_dim_2': 256, 'kl_weight': 0.00014413137115398906, 'lr': 0.008995872576910056, 'batch_size': 128, 'dropout_rate': 0.45348403982470936, 'prior_mu': 0.10619997316649252, 'prior_sigma': 0.09265288655496033, 'normalization': 'none'}. Best is trial 85 with value: 0.5345884144306183.
Generating morgan_rdkit fingerprints...
Generated fingerprints with 2048 features for 900 molecules
Data shape: X=(900, 2048), y=(900,)
Trial 90: 5-fold CV loss = 0.6307
[I 2025-08-07 16:17:23,126] Trial 90 finished with value: 0.6306796431541443 and parameters: {'fp_type': 'morgan_rdkit', 'combined_morgan_radius': 3, 'combined_morgan_nBits': 1024, 'combined_rdkit_maxPath': 8, 'combined_rdkit_nBits': 256, 'num_hidden_layers': 3, 'hidden_dim_0': 128, 'hidden_dim_1': 64, 'hidden_dim_2': 256, 'kl_weight': 0.00013743502035455497, 'lr': 0.008957849887197321, 'batch_size': 128, 'dropout_rate': 0.4534254896543456, 'prior_mu': 0.0838044997440513, 'prior_sigma': 0.09524888957516248, 'normalization': 'none'}. Best is trial 85 with value: 0.5345884144306183.
Generating morgan_rdkit fingerprints...
Generated fingerprints with 2048 features for 900 molecules
Data shape: X=(900, 2048), y=(900,)
Trial 94: 5-fold CV loss = 0.6025
[I 2025-08-07 16:17:29,879] Trial 94 finished with value: 0.6025162458419799 and parameters: {'fp_type': 'morgan_rdkit', 'combined_morgan_radius': 3, 'combined_morgan_nBits': 1024, 'combined_rdkit_maxPath': 5, 'combined_rdkit_nBits': 1024, 'num_hidden_layers': 3, 'hidden_dim_0': 128, 'hidden_dim_1': 64, 'hidden_dim_2': 256, 'kl_weight': 0.00010257312400972741, 'lr': 0.007654764426396999, 'batch_size': 128, 'dropout_rate': 0.44094636688530603, 'prior_mu': 0.10000781376691677, 'prior_sigma': 0.07618104283213106, 'normalization': 'none'}. Best is trial 85 with value: 0.5345884144306183.
Generating morgan_rdkit fingerprints...
Generated fingerprints with 2048 features for 900 molecules
Data shape: X=(900, 2048), y=(900,)
Trial 92: 5-fold CV loss = 0.5844
[I 2025-08-07 16:17:32,689] Trial 92 finished with value: 0.5844202399253845 and parameters: {'fp_type': 'morgan_rdkit', 'combined_morgan_radius': 2, 'combined_morgan_nBits': 1024, 'combined_rdkit_maxPath': 5, 'combined_rdkit_nBits': 1024, 'num_hidden_layers': 3, 'hidden_dim_0': 128, 'hidden_dim_1': 64, 'hidden_dim_2': 256, 'kl_weight': 0.00016541411249198032, 'lr': 0.00779453867011236, 'batch_size': 128, 'dropout_rate': 0.44709349204322085, 'prior_mu': 0.03746591285005009, 'prior_sigma': 0.06900885960511681, 'normalization': 'none'}. Best is trial 85 with value: 0.5345884144306183.
Generating morgan_rdkit fingerprints...
Generated fingerprints with 2048 features for 900 molecules
Data shape: X=(900, 2048), y=(900,)
Trial 96: 5-fold CV loss = 0.5477
[I 2025-08-07 16:17:49,136] Trial 96 finished with value: 0.5476767897605896 and parameters: {'fp_type': 'morgan_rdkit', 'combined_morgan_radius': 3, 'combined_morgan_nBits': 1024, 'combined_rdkit_maxPath': 5, 'combined_rdkit_nBits': 1024, 'num_hidden_layers': 3, 'hidden_dim_0': 512, 'hidden_dim_1': 64, 'hidden_dim_2': 256, 'kl_weight': 0.00024548094275002286, 'lr': 0.009986269525273688, 'batch_size': 128, 'dropout_rate': 0.49222495565617097, 'prior_mu': 0.10799927598434347, 'prior_sigma': 0.07833733507064981, 'normalization': 'none'}. Best is trial 85 with value: 0.5345884144306183.
Generating morgan fingerprints...
Generated fingerprints with 2048 features for 900 molecules
Data shape: X=(900, 2048), y=(900,)
Trial 97: 5-fold CV loss = 0.5617
[I 2025-08-07 16:18:13,016] Trial 97 finished with value: 0.5617068529129028 and parameters: {'fp_type': 'morgan_rdkit', 'combined_morgan_radius': 3, 'combined_morgan_nBits': 1024, 'combined_rdkit_maxPath': 5, 'combined_rdkit_nBits': 1024, 'num_hidden_layers': 3, 'hidden_dim_0': 512, 'hidden_dim_1': 512, 'hidden_dim_2': 512, 'kl_weight': 0.0002534230177722961, 'lr': 0.006173170523352581, 'batch_size': 128, 'dropout_rate': 0.4719342423905185, 'prior_mu': 0.1085928158661986, 'prior_sigma': 0.07776206582402292, 'normalization': 'none'}. Best is trial 85 with value: 0.5345884144306183.
Generating morgan fingerprints...
Generated fingerprints with 1024 features for 900 molecules
Data shape: X=(900, 1024), y=(900,)
Trial 93: 5-fold CV loss = 0.5417
[I 2025-08-07 16:18:15,367] Trial 93 finished with value: 0.5416813790798187 and parameters: {'fp_type': 'morgan', 'morgan_only_radius': 3, 'morgan_only_nBits': 2048, 'num_hidden_layers': 3, 'hidden_dim_0': 128, 'hidden_dim_1': 64, 'hidden_dim_2': 256, 'kl_weight': 0.00016144938212939668, 'lr': 0.0074915863564870115, 'batch_size': 64, 'dropout_rate': 0.4324824911476884, 'prior_mu': 0.10137731023633734, 'prior_sigma': 0.07815575976467773, 'normalization': 'none'}. Best is trial 85 with value: 0.5345884144306183.
Generating morgan_rdkit fingerprints...
Generated fingerprints with 2048 features for 900 molecules
Data shape: X=(900, 2048), y=(900,)
Trial 98: 5-fold CV loss = 0.5732
[I 2025-08-07 16:18:18,645] Trial 98 finished with value: 0.5732301652431488 and parameters: {'fp_type': 'morgan', 'morgan_only_radius': 3, 'morgan_only_nBits': 2048, 'num_hidden_layers': 3, 'hidden_dim_0': 512, 'hidden_dim_1': 128, 'hidden_dim_2': 512, 'kl_weight': 0.0002512587372361395, 'lr': 0.006389079504570917, 'batch_size': 64, 'dropout_rate': 0.4762026869881296, 'prior_mu': 0.1615213312277164, 'prior_sigma': 0.10339298693245746, 'normalization': 'none'}. Best is trial 85 with value: 0.5345884144306183.
Generating morgan_rdkit fingerprints...
Generated fingerprints with 2048 features for 900 molecules
Data shape: X=(900, 2048), y=(900,)
Trial 95: 5-fold CV loss = 0.5386
[I 2025-08-07 16:18:29,573] Trial 95 finished with value: 0.5385949671268463 and parameters: {'fp_type': 'morgan_rdkit', 'combined_morgan_radius': 3, 'combined_morgan_nBits': 1024, 'combined_rdkit_maxPath': 5, 'combined_rdkit_nBits': 1024, 'num_hidden_layers': 3, 'hidden_dim_0': 512, 'hidden_dim_1': 64, 'hidden_dim_2': 256, 'kl_weight': 0.00010503790745978892, 'lr': 0.007758845239574158, 'batch_size': 128, 'dropout_rate': 0.49977245433114265, 'prior_mu': 0.1006801197314097, 'prior_sigma': 0.07626325034183767, 'normalization': 'none'}. Best is trial 85 with value: 0.5345884144306183.
Generating morgan_rdkit fingerprints...
Generated fingerprints with 2048 features for 900 molecules
Data shape: X=(900, 2048), y=(900,)
Trial 101: 5-fold CV loss = 0.6800
[I 2025-08-07 16:18:35,082] Trial 101 finished with value: 0.679957389831543 and parameters: {'fp_type': 'morgan_rdkit', 'combined_morgan_radius': 2, 'combined_morgan_nBits': 1024, 'combined_rdkit_maxPath': 5, 'combined_rdkit_nBits': 1024, 'num_hidden_layers': 3, 'hidden_dim_0': 512, 'hidden_dim_1': 64, 'hidden_dim_2': 256, 'kl_weight': 0.04003453868941405, 'lr': 0.004852572308240308, 'batch_size': 128, 'dropout_rate': 0.40797685938357675, 'prior_mu': 0.12521369739853525, 'prior_sigma': 0.08447093988929365, 'normalization': 'none'}. Best is trial 85 with value: 0.5345884144306183.
Generating morgan_rdkit fingerprints...
Generated fingerprints with 2048 features for 900 molecules
Data shape: X=(900, 2048), y=(900,)
Trial 99: 5-fold CV loss = 0.5566
[I 2025-08-07 16:18:50,714] Trial 99 finished with value: 0.5566252171993256 and parameters: {'fp_type': 'morgan', 'morgan_only_radius': 3, 'morgan_only_nBits': 1024, 'num_hidden_layers': 3, 'hidden_dim_0': 512, 'hidden_dim_1': 128, 'hidden_dim_2': 256, 'kl_weight': 0.0001601594610046079, 'lr': 0.00648066473263439, 'batch_size': 64, 'dropout_rate': 0.4285425338509985, 'prior_mu': 0.09963024262558115, 'prior_sigma': 0.10308372982032415, 'normalization': 'none'}. Best is trial 85 with value: 0.5345884144306183.
Generating morgan_rdkit fingerprints...
Generated fingerprints with 2048 features for 900 molecules
Data shape: X=(900, 2048), y=(900,)
Trial 100: 5-fold CV loss = 0.7370
[I 2025-08-07 16:18:55,634] Trial 100 finished with value: 0.7370101630687713 and parameters: {'fp_type': 'morgan_rdkit', 'combined_morgan_radius': 2, 'combined_morgan_nBits': 1024, 'combined_rdkit_maxPath': 5, 'combined_rdkit_nBits': 1024, 'num_hidden_layers': 3, 'hidden_dim_0': 512, 'hidden_dim_1': 128, 'hidden_dim_2': 256, 'kl_weight': 0.00020229596840160672, 'lr': 0.006484214084467512, 'batch_size': 128, 'dropout_rate': 0.48171105670810965, 'prior_mu': -0.1491534057640664, 'prior_sigma': 0.1149440703571447, 'normalization': 'none'}. Best is trial 85 with value: 0.5345884144306183.
Generating morgan_rdkit fingerprints...
Generated fingerprints with 2048 features for 900 molecules
Data shape: X=(900, 2048), y=(900,)
Trial 103: 5-fold CV loss = 0.5765
[I 2025-08-07 16:18:57,199] Trial 103 finished with value: 0.5764917969703675 and parameters: {'fp_type': 'morgan_rdkit', 'combined_morgan_radius': 3, 'combined_morgan_nBits': 1024, 'combined_rdkit_maxPath': 5, 'combined_rdkit_nBits': 1024, 'num_hidden_layers': 3, 'hidden_dim_0': 512, 'hidden_dim_1': 1024, 'hidden_dim_2': 256, 'kl_weight': 0.00012018922023310432, 'lr': 0.008358564134378443, 'batch_size': 128, 'dropout_rate': 0.48277224969559535, 'prior_mu': 0.0634628345845345, 'prior_sigma': 0.0671736918048737, 'normalization': 'none'}. Best is trial 85 with value: 0.5345884144306183.
Generating morgan_rdkit fingerprints...
Generated fingerprints with 2048 features for 900 molecules
Data shape: X=(900, 2048), y=(900,)
Trial 104: 5-fold CV loss = 0.5376
[I 2025-08-07 16:19:17,013] Trial 104 finished with value: 0.5375825881958007 and parameters: {'fp_type': 'morgan_rdkit', 'combined_morgan_radius': 3, 'combined_morgan_nBits': 1024, 'combined_rdkit_maxPath': 5, 'combined_rdkit_nBits': 1024, 'num_hidden_layers': 3, 'hidden_dim_0': 512, 'hidden_dim_1': 64, 'hidden_dim_2': 256, 'kl_weight': 0.00010096543044170139, 'lr': 0.008260275186052844, 'batch_size': 128, 'dropout_rate': 0.48649640074627254, 'prior_mu': 0.09044494204067335, 'prior_sigma': 0.06737878443151035, 'normalization': 'none'}. Best is trial 85 with value: 0.5345884144306183.
Generating morgan_rdkit fingerprints...
Generated fingerprints with 2048 features for 900 molecules
Data shape: X=(900, 2048), y=(900,)
Trial 106: 5-fold CV loss = 0.5391
[I 2025-08-07 16:19:20,841] Trial 106 finished with value: 0.5391452431678772 and parameters: {'fp_type': 'morgan_rdkit', 'combined_morgan_radius': 3, 'combined_morgan_nBits': 1024, 'combined_rdkit_maxPath': 5, 'combined_rdkit_nBits': 1024, 'num_hidden_layers': 3, 'hidden_dim_0': 512, 'hidden_dim_1': 64, 'hidden_dim_2': 256, 'kl_weight': 0.00014456438906157014, 'lr': 0.008293052655369166, 'batch_size': 128, 'dropout_rate': 0.4909960490355553, 'prior_mu': 0.08887978368268463, 'prior_sigma': 0.0888003276288264, 'normalization': 'none'}. Best is trial 85 with value: 0.5345884144306183.
Generating morgan_rdkit fingerprints...
Generated fingerprints with 2048 features for 900 molecules
Data shape: X=(900, 2048), y=(900,)
Trial 105: 5-fold CV loss = 0.5362
[I 2025-08-07 16:19:36,054] Trial 105 finished with value: 0.5362322151660919 and parameters: {'fp_type': 'morgan_rdkit', 'combined_morgan_radius': 3, 'combined_morgan_nBits': 1024, 'combined_rdkit_maxPath': 5, 'combined_rdkit_nBits': 1024, 'num_hidden_layers': 3, 'hidden_dim_0': 512, 'hidden_dim_1': 64, 'hidden_dim_2': 256, 'kl_weight': 0.00011676886579338565, 'lr': 0.008342474723722551, 'batch_size': 128, 'dropout_rate': 0.4981779578111181, 'prior_mu': 0.0922076033999765, 'prior_sigma': 0.0720763138604985, 'normalization': 'none'}. Best is trial 85 with value: 0.5345884144306183.
Generating morgan_rdkit fingerprints...
Generated fingerprints with 2048 features for 900 molecules
Data shape: X=(900, 2048), y=(900,)
Trial 107: 5-fold CV loss = 0.5421
[I 2025-08-07 16:19:39,917] Trial 107 finished with value: 0.5421335577964783 and parameters: {'fp_type': 'morgan_rdkit', 'combined_morgan_radius': 3, 'combined_morgan_nBits': 1024, 'combined_rdkit_maxPath': 5, 'combined_rdkit_nBits': 1024, 'num_hidden_layers': 3, 'hidden_dim_0': 512, 'hidden_dim_1': 64, 'hidden_dim_2': 64, 'kl_weight': 0.0001329278375099727, 'lr': 0.008351433872533707, 'batch_size': 128, 'dropout_rate': 0.49678978813008606, 'prior_mu': 0.094180106168956, 'prior_sigma': 0.09055100041102514, 'normalization': 'none'}. Best is trial 85 with value: 0.5345884144306183.
Generating morgan_rdkit fingerprints...
Generated fingerprints with 1536 features for 900 molecules
Data shape: X=(900, 1536), y=(900,)
Trial 108: 5-fold CV loss = 0.5514
[I 2025-08-07 16:19:48,142] Trial 108 finished with value: 0.5514245450496673 and parameters: {'fp_type': 'morgan_rdkit', 'combined_morgan_radius': 3, 'combined_morgan_nBits': 1024, 'combined_rdkit_maxPath': 5, 'combined_rdkit_nBits': 1024, 'num_hidden_layers': 3, 'hidden_dim_0': 512, 'hidden_dim_1': 64, 'hidden_dim_2': 64, 'kl_weight': 0.00010045490049059947, 'lr': 0.008278744266081457, 'batch_size': 128, 'dropout_rate': 0.49585535461476526, 'prior_mu': 0.08763379518658287, 'prior_sigma': 0.07337312424373725, 'normalization': 'none'}. Best is trial 85 with value: 0.5345884144306183.
Generating morgan_rdkit fingerprints...
Generated fingerprints with 1536 features for 900 molecules
Data shape: X=(900, 1536), y=(900,)
Trial 102: 5-fold CV loss = 0.5316
[I 2025-08-07 16:20:00,862] Trial 102 finished with value: 0.5316388070583343 and parameters: {'fp_type': 'morgan_rdkit', 'combined_morgan_radius': 3, 'combined_morgan_nBits': 1024, 'combined_rdkit_maxPath': 5, 'combined_rdkit_nBits': 1024, 'num_hidden_layers': 3, 'hidden_dim_0': 512, 'hidden_dim_1': 64, 'hidden_dim_2': 256, 'kl_weight': 0.00012003506613660886, 'lr': 0.004841335677153669, 'batch_size': 128, 'dropout_rate': 0.48654147967033595, 'prior_mu': -0.03456738773782303, 'prior_sigma': 0.08430723806217377, 'normalization': 'none'}. Best is trial 102 with value: 0.5316388070583343.
Generating morgan_rdkit fingerprints...
Generated fingerprints with 1536 features for 900 molecules
Data shape: X=(900, 1536), y=(900,)
Trial 111: 5-fold CV loss = 0.6576
[I 2025-08-07 16:20:02,556] Trial 111 finished with value: 0.6575677871704102 and parameters: {'fp_type': 'morgan_rdkit', 'combined_morgan_radius': 3, 'combined_morgan_nBits': 512, 'combined_rdkit_maxPath': 5, 'combined_rdkit_nBits': 1024, 'num_hidden_layers': 3, 'hidden_dim_0': 256, 'hidden_dim_1': 64, 'hidden_dim_2': 256, 'kl_weight': 0.00011591390694704328, 'lr': 0.007326028991793767, 'batch_size': 128, 'dropout_rate': 0.46585398677460405, 'prior_mu': 0.017988186914573736, 'prior_sigma': 0.06666666877866836, 'normalization': 'layer'}. Best is trial 102 with value: 0.5316388070583343.
Generating morgan_rdkit fingerprints...
Generated fingerprints with 2048 features for 900 molecules
Data shape: X=(900, 2048), y=(900,)
Trial 110: 5-fold CV loss = 0.6236
[I 2025-08-07 16:20:04,429] Trial 110 finished with value: 0.6236397624015808 and parameters: {'fp_type': 'morgan_rdkit', 'combined_morgan_radius': 3, 'combined_morgan_nBits': 512, 'combined_rdkit_maxPath': 5, 'combined_rdkit_nBits': 1024, 'num_hidden_layers': 3, 'hidden_dim_0': 256, 'hidden_dim_1': 64, 'hidden_dim_2': 256, 'kl_weight': 0.00011526514806963368, 'lr': 0.007413769935976567, 'batch_size': 128, 'dropout_rate': 0.48856298150547584, 'prior_mu': 0.07771998814048015, 'prior_sigma': 0.07267509912771478, 'normalization': 'layer'}. Best is trial 102 with value: 0.5316388070583343.
Generating morgan_rdkit fingerprints...
Generated fingerprints with 2048 features for 900 molecules
Data shape: X=(900, 2048), y=(900,)
Trial 113: 5-fold CV loss = 0.5396
[I 2025-08-07 16:20:22,542] Trial 113 finished with value: 0.5395632088184357 and parameters: {'fp_type': 'morgan_rdkit', 'combined_morgan_radius': 3, 'combined_morgan_nBits': 1024, 'combined_rdkit_maxPath': 5, 'combined_rdkit_nBits': 1024, 'num_hidden_layers': 3, 'hidden_dim_0': 512, 'hidden_dim_1': 64, 'hidden_dim_2': 256, 'kl_weight': 0.00011167300571642386, 'lr': 0.009880164553682128, 'batch_size': 128, 'dropout_rate': 0.4875984669205061, 'prior_mu': -0.028299756990864587, 'prior_sigma': 0.08592832765760701, 'normalization': 'none'}. Best is trial 102 with value: 0.5316388070583343.
Generating morgan_rdkit fingerprints...
Generated fingerprints with 2048 features for 900 molecules
Data shape: X=(900, 2048), y=(900,)
Trial 109: 5-fold CV loss = 0.5324
[I 2025-08-07 16:20:25,496] Trial 109 finished with value: 0.5324367582798004 and parameters: {'fp_type': 'morgan_rdkit', 'combined_morgan_radius': 3, 'combined_morgan_nBits': 1024, 'combined_rdkit_maxPath': 5, 'combined_rdkit_nBits': 1024, 'num_hidden_layers': 3, 'hidden_dim_0': 512, 'hidden_dim_1': 64, 'hidden_dim_2': 64, 'kl_weight': 0.00010036856803255467, 'lr': 0.008241644053930174, 'batch_size': 128, 'dropout_rate': 0.493186429644218, 'prior_mu': 0.09029558073054532, 'prior_sigma': 0.07350884342996036, 'normalization': 'none'}. Best is trial 102 with value: 0.5316388070583343.
Generating morgan_rdkit fingerprints...
Generated fingerprints with 2048 features for 900 molecules
Data shape: X=(900, 2048), y=(900,)
Trial 112: 5-fold CV loss = 0.6696
[I 2025-08-07 16:20:32,199] Trial 112 finished with value: 0.6696433067321778 and parameters: {'fp_type': 'morgan_rdkit', 'combined_morgan_radius': 3, 'combined_morgan_nBits': 512, 'combined_rdkit_maxPath': 5, 'combined_rdkit_nBits': 1024, 'num_hidden_layers': 3, 'hidden_dim_0': 512, 'hidden_dim_1': 64, 'hidden_dim_2': 256, 'kl_weight': 0.00011510066093628753, 'lr': 0.007214511781713038, 'batch_size': 128, 'dropout_rate': 0.46827776837100704, 'prior_mu': -0.05496315591372689, 'prior_sigma': 0.08619732414431162, 'normalization': 'layer'}. Best is trial 102 with value: 0.5316388070583343.
Generating morgan_rdkit fingerprints...
Generated fingerprints with 2048 features for 900 molecules
Data shape: X=(900, 2048), y=(900,)
Trial 114: 5-fold CV loss = 0.5385
[I 2025-08-07 16:20:34,657] Trial 114 finished with value: 0.5385300874710083 and parameters: {'fp_type': 'morgan_rdkit', 'combined_morgan_radius': 3, 'combined_morgan_nBits': 1024, 'combined_rdkit_maxPath': 5, 'combined_rdkit_nBits': 1024, 'num_hidden_layers': 3, 'hidden_dim_0': 512, 'hidden_dim_1': 64, 'hidden_dim_2': 256, 'kl_weight': 0.00017522853006879358, 'lr': 0.009459174228569307, 'batch_size': 128, 'dropout_rate': 0.4983988377962517, 'prior_mu': -0.04822130375672424, 'prior_sigma': 0.0848672982042128, 'normalization': 'none'}. Best is trial 102 with value: 0.5316388070583343.
Generating morgan_rdkit fingerprints...
Generated fingerprints with 2048 features for 900 molecules
Data shape: X=(900, 2048), y=(900,)
Trial 115: 5-fold CV loss = 0.5873
[I 2025-08-07 16:20:45,030] Trial 115 finished with value: 0.587327778339386 and parameters: {'fp_type': 'morgan_rdkit', 'combined_morgan_radius': 3, 'combined_morgan_nBits': 1024, 'combined_rdkit_maxPath': 5, 'combined_rdkit_nBits': 1024, 'num_hidden_layers': 3, 'hidden_dim_0': 512, 'hidden_dim_1': 64, 'hidden_dim_2': 256, 'kl_weight': 0.0001752855612560835, 'lr': 0.005166085153147086, 'batch_size': 128, 'dropout_rate': 0.49913876297188164, 'prior_mu': -0.02037342696652896, 'prior_sigma': 0.061126754528616184, 'normalization': 'none'}. Best is trial 102 with value: 0.5316388070583343.
Generating morgan_rdkit fingerprints...
Generated fingerprints with 2048 features for 900 molecules
Data shape: X=(900, 2048), y=(900,)
Trial 119: 5-fold CV loss = 0.9717
[I 2025-08-07 16:20:56,354] Trial 119 finished with value: 0.9716843605041504 and parameters: {'fp_type': 'morgan_rdkit', 'combined_morgan_radius': 3, 'combined_morgan_nBits': 1024, 'combined_rdkit_maxPath': 5, 'combined_rdkit_nBits': 1024, 'num_hidden_layers': 3, 'hidden_dim_0': 512, 'hidden_dim_1': 512, 'hidden_dim_2': 64, 'kl_weight': 0.00013133649572775829, 'lr': 0.0016725315428594628, 'batch_size': 128, 'dropout_rate': 0.4737036770851263, 'prior_mu': -0.052103786670767586, 'prior_sigma': 0.08194934887850343, 'normalization': 'none'}. Best is trial 102 with value: 0.5316388070583343.
Generating morgan_rdkit fingerprints...
Generated fingerprints with 2048 features for 900 molecules
Data shape: X=(900, 2048), y=(900,)
Trial 116: 5-fold CV loss = 0.5559
