[I 2025-08-08 05:42:30,563] Trial 2360 finished with value: 0.7152887225151062 and parameters: {'fp_type': 'morgan', 'morgan_only_radius': 2, 'morgan_only_nBits': 2048, 'num_hidden_layers': 2, 'hidden_dim_0': 512, 'hidden_dim_1': 128, 'kl_weight': 0.0008007648136283241, 'lr': 0.0030508330279295933, 'batch_size': 64, 'dropout_rate': 0.411108649693401, 'prior_mu': 0.041286428825548525, 'prior_sigma': 0.0686561633038019, 'normalization': 'none'}. Best is trial 2329 with value: 0.5157062888145447.
Generating morgan fingerprints...
Generated fingerprints with 2048 features for 900 molecules
Data shape: X=(900, 2048), y=(900,)
Trial 2355: 5-fold CV loss = 0.5658
[I 2025-08-08 05:42:43,495] Trial 2355 finished with value: 0.5658291101455688 and parameters: {'fp_type': 'morgan', 'morgan_only_radius': 2, 'morgan_only_nBits': 2048, 'num_hidden_layers': 3, 'hidden_dim_0': 64, 'hidden_dim_1': 256, 'hidden_dim_2': 64, 'kl_weight': 0.000684234120381218, 'lr': 0.003388687543377188, 'batch_size': 64, 'dropout_rate': 0.4098109286448237, 'prior_mu': 0.013907641837170727, 'prior_sigma': 0.06381718436134173, 'normalization': 'none'}. Best is trial 2329 with value: 0.5157062888145447.
Generating morgan fingerprints...
Generated fingerprints with 2048 features for 900 molecules
Data shape: X=(900, 2048), y=(900,)
Trial 2362: 5-fold CV loss = 0.5784
[I 2025-08-08 05:42:58,195] Trial 2362 finished with value: 0.5784282803535461 and parameters: {'fp_type': 'morgan', 'morgan_only_radius': 2, 'morgan_only_nBits': 2048, 'num_hidden_layers': 3, 'hidden_dim_0': 512, 'hidden_dim_1': 128, 'hidden_dim_2': 512, 'kl_weight': 0.0008763027884719661, 'lr': 0.003309674492265972, 'batch_size': 64, 'dropout_rate': 0.41065541671164535, 'prior_mu': 0.04177859324589066, 'prior_sigma': 0.0680234943570673, 'normalization': 'none'}. Best is trial 2329 with value: 0.5157062888145447.
Generating morgan fingerprints...
Generated fingerprints with 2048 features for 900 molecules
Data shape: X=(900, 2048), y=(900,)
Trial 2363: 5-fold CV loss = 0.5568
[I 2025-08-08 05:43:09,170] Trial 2363 finished with value: 0.5568489313125611 and parameters: {'fp_type': 'morgan', 'morgan_only_radius': 2, 'morgan_only_nBits': 2048, 'num_hidden_layers': 3, 'hidden_dim_0': 512, 'hidden_dim_1': 128, 'hidden_dim_2': 512, 'kl_weight': 0.0008247994189932094, 'lr': 0.004241948595787644, 'batch_size': 64, 'dropout_rate': 0.15122316058295088, 'prior_mu': 0.04051218740656874, 'prior_sigma': 0.06053236717421781, 'normalization': 'none'}. Best is trial 2329 with value: 0.5157062888145447.
Generating morgan fingerprints...
Generated fingerprints with 2048 features for 900 molecules
Data shape: X=(900, 2048), y=(900,)
Trial 2364: 5-fold CV loss = 0.5292
[I 2025-08-08 05:43:24,798] Trial 2364 finished with value: 0.5291504383087158 and parameters: {'fp_type': 'morgan', 'morgan_only_radius': 2, 'morgan_only_nBits': 2048, 'num_hidden_layers': 3, 'hidden_dim_0': 512, 'hidden_dim_1': 128, 'hidden_dim_2': 512, 'kl_weight': 0.0008512157049993037, 'lr': 0.0038551851765268198, 'batch_size': 64, 'dropout_rate': 0.39210468961388834, 'prior_mu': 0.028774051101434425, 'prior_sigma': 0.0597009850977897, 'normalization': 'none'}. Best is trial 2329 with value: 0.5157062888145447.
Generating rdkit fingerprints...
Generated fingerprints with 1024 features for 900 molecules
Data shape: X=(900, 1024), y=(900,)
Trial 2366: 5-fold CV loss = 0.5667
[I 2025-08-08 05:43:35,361] Trial 2366 finished with value: 0.5666792035102844 and parameters: {'fp_type': 'morgan', 'morgan_only_radius': 2, 'morgan_only_nBits': 2048, 'num_hidden_layers': 3, 'hidden_dim_0': 512, 'hidden_dim_1': 128, 'hidden_dim_2': 512, 'kl_weight': 0.0007701818691578032, 'lr': 0.003295514718677659, 'batch_size': 64, 'dropout_rate': 0.44514059568302816, 'prior_mu': 0.029265051852863322, 'prior_sigma': 0.05743776890301915, 'normalization': 'none'}. Best is trial 2329 with value: 0.5157062888145447.
Generating rdkit fingerprints...
Generated fingerprints with 1024 features for 900 molecules
Data shape: X=(900, 1024), y=(900,)
Trial 2367: 5-fold CV loss = 0.5312
[I 2025-08-08 05:43:52,448] Trial 2367 finished with value: 0.5312468647956848 and parameters: {'fp_type': 'morgan', 'morgan_only_radius': 2, 'morgan_only_nBits': 2048, 'num_hidden_layers': 3, 'hidden_dim_0': 1024, 'hidden_dim_1': 64, 'hidden_dim_2': 512, 'kl_weight': 0.0006318714805282641, 'lr': 0.0031212776920961955, 'batch_size': 64, 'dropout_rate': 0.4472284209276513, 'prior_mu': 0.031230563183565607, 'prior_sigma': 0.05627049701832996, 'normalization': 'none'}. Best is trial 2329 with value: 0.5157062888145447.
Generating rdkit fingerprints...
Generated fingerprints with 1024 features for 900 molecules
Data shape: X=(900, 1024), y=(900,)
Trial 2370: 5-fold CV loss = 0.8499
[I 2025-08-08 05:44:12,953] Trial 2370 finished with value: 0.8498870372772217 and parameters: {'fp_type': 'rdkit', 'rdkit_only_maxPath': 8, 'rdkit_only_nBits': 1024, 'num_hidden_layers': 3, 'hidden_dim_0': 128, 'hidden_dim_1': 128, 'hidden_dim_2': 256, 'kl_weight': 0.0006204776770094373, 'lr': 0.0006689749144761664, 'batch_size': 64, 'dropout_rate': 0.4588172188539979, 'prior_mu': 0.043513635425801556, 'prior_sigma': 0.07616072554212729, 'normalization': 'none'}. Best is trial 2329 with value: 0.5157062888145447.
Generating morgan fingerprints...
Generated fingerprints with 2048 features for 900 molecules
Data shape: X=(900, 2048), y=(900,)
Trial 2369: 5-fold CV loss = 0.6218
[I 2025-08-08 05:44:17,375] Trial 2369 finished with value: 0.6217504501342773 and parameters: {'fp_type': 'rdkit', 'rdkit_only_maxPath': 8, 'rdkit_only_nBits': 1024, 'num_hidden_layers': 3, 'hidden_dim_0': 1024, 'hidden_dim_1': 64, 'hidden_dim_2': 512, 'kl_weight': 0.0006331946056017711, 'lr': 0.0015152375602876843, 'batch_size': 64, 'dropout_rate': 0.46070753540397963, 'prior_mu': 0.04436793855896648, 'prior_sigma': 0.07597619644911041, 'normalization': 'none'}. Best is trial 2329 with value: 0.5157062888145447.
Generating morgan fingerprints...
Generated fingerprints with 2048 features for 900 molecules
Data shape: X=(900, 2048), y=(900,)
Trial 2365: 5-fold CV loss = 0.5332
[I 2025-08-08 05:44:25,357] Trial 2365 finished with value: 0.5332456529140472 and parameters: {'fp_type': 'morgan', 'morgan_only_radius': 2, 'morgan_only_nBits': 2048, 'num_hidden_layers': 3, 'hidden_dim_0': 512, 'hidden_dim_1': 128, 'hidden_dim_2': 512, 'kl_weight': 0.0008309843332725329, 'lr': 0.003995521187076064, 'batch_size': 64, 'dropout_rate': 0.45210456053336784, 'prior_mu': 0.04231506354104692, 'prior_sigma': 0.05833940865615335, 'normalization': 'none'}. Best is trial 2329 with value: 0.5157062888145447.
Generating morgan fingerprints...
Generated fingerprints with 2048 features for 900 molecules
Data shape: X=(900, 2048), y=(900,)
Trial 2368: 5-fold CV loss = 0.6231
[I 2025-08-08 05:44:33,355] Trial 2368 finished with value: 0.6230904579162597 and parameters: {'fp_type': 'rdkit', 'rdkit_only_maxPath': 8, 'rdkit_only_nBits': 1024, 'num_hidden_layers': 3, 'hidden_dim_0': 1024, 'hidden_dim_1': 64, 'hidden_dim_2': 512, 'kl_weight': 0.0006169575784547563, 'lr': 0.0034542868032118035, 'batch_size': 64, 'dropout_rate': 0.4509893876521033, 'prior_mu': 0.03140452914805661, 'prior_sigma': 0.07628590250841003, 'normalization': 'none'}. Best is trial 2329 with value: 0.5157062888145447.
Generating morgan fingerprints...
Generated fingerprints with 2048 features for 900 molecules
Data shape: X=(900, 2048), y=(900,)
Trial 2372: 5-fold CV loss = 0.5623
[I 2025-08-08 05:44:54,694] Trial 2372 finished with value: 0.5622790396213532 and parameters: {'fp_type': 'morgan', 'morgan_only_radius': 2, 'morgan_only_nBits': 2048, 'num_hidden_layers': 3, 'hidden_dim_0': 512, 'hidden_dim_1': 128, 'hidden_dim_2': 512, 'kl_weight': 0.0009708999163784598, 'lr': 0.002884351697850938, 'batch_size': 64, 'dropout_rate': 0.4201462900336187, 'prior_mu': 0.03585708321557502, 'prior_sigma': 0.06549058204297044, 'normalization': 'none'}. Best is trial 2329 with value: 0.5157062888145447.
Generating morgan fingerprints...
Generated fingerprints with 2048 features for 900 molecules
Data shape: X=(900, 2048), y=(900,)
Trial 2371: 5-fold CV loss = 0.5485
[I 2025-08-08 05:45:05,156] Trial 2371 finished with value: 0.5485455572605134 and parameters: {'fp_type': 'morgan', 'morgan_only_radius': 2, 'morgan_only_nBits': 2048, 'num_hidden_layers': 3, 'hidden_dim_0': 512, 'hidden_dim_1': 64, 'hidden_dim_2': 512, 'kl_weight': 0.0010084540000665334, 'lr': 0.00290748879716884, 'batch_size': 64, 'dropout_rate': 0.4211542945898422, 'prior_mu': 0.021866738059487092, 'prior_sigma': 0.07536061577494353, 'normalization': 'none'}. Best is trial 2329 with value: 0.5157062888145447.
Generating morgan fingerprints...
Generated fingerprints with 2048 features for 900 molecules
Data shape: X=(900, 2048), y=(900,)
Trial 2376: 5-fold CV loss = 0.7243
[I 2025-08-08 05:45:23,265] Trial 2376 finished with value: 0.724291980266571 and parameters: {'fp_type': 'morgan', 'morgan_only_radius': 2, 'morgan_only_nBits': 2048, 'num_hidden_layers': 3, 'hidden_dim_0': 512, 'hidden_dim_1': 128, 'hidden_dim_2': 256, 'kl_weight': 0.0007491880367206192, 'lr': 0.0002878823353490995, 'batch_size': 64, 'dropout_rate': 0.4345710200137884, 'prior_mu': 0.0214365548282775, 'prior_sigma': 0.07006646512500608, 'normalization': 'none'}. Best is trial 2329 with value: 0.5157062888145447.
Generating morgan_rdkit fingerprints...
Generated fingerprints with 1280 features for 900 molecules
Data shape: X=(900, 1280), y=(900,)
Trial 2375: 5-fold CV loss = 0.5366
[I 2025-08-08 05:45:32,992] Trial 2375 finished with value: 0.5365590989589691 and parameters: {'fp_type': 'morgan', 'morgan_only_radius': 2, 'morgan_only_nBits': 2048, 'num_hidden_layers': 3, 'hidden_dim_0': 512, 'hidden_dim_1': 128, 'hidden_dim_2': 256, 'kl_weight': 0.000747214529790392, 'lr': 0.004329356605089297, 'batch_size': 64, 'dropout_rate': 0.43083074734107685, 'prior_mu': 0.020688341171576873, 'prior_sigma': 0.07089024571652758, 'normalization': 'none'}. Best is trial 2329 with value: 0.5157062888145447.
Generating morgan_rdkit fingerprints...
Generated fingerprints with 1280 features for 900 molecules
Data shape: X=(900, 1280), y=(900,)
Trial 2374: 5-fold CV loss = 0.5563
[I 2025-08-08 05:45:53,900] Trial 2374 finished with value: 0.5562679827213287 and parameters: {'fp_type': 'morgan', 'morgan_only_radius': 2, 'morgan_only_nBits': 2048, 'num_hidden_layers': 3, 'hidden_dim_0': 512, 'hidden_dim_1': 128, 'hidden_dim_2': 256, 'kl_weight': 0.0009930753961395775, 'lr': 0.0029839752453557676, 'batch_size': 64, 'dropout_rate': 0.4226197983966836, 'prior_mu': 0.023128801027220387, 'prior_sigma': 0.06542461921064936, 'normalization': 'none'}. Best is trial 2329 with value: 0.5157062888145447.
Generating morgan_rdkit fingerprints...
Generated fingerprints with 1280 features for 900 molecules
Data shape: X=(900, 1280), y=(900,)
Trial 2377: 5-fold CV loss = 0.5931
[I 2025-08-08 05:46:03,229] Trial 2377 finished with value: 0.593106997013092 and parameters: {'fp_type': 'morgan_rdkit', 'combined_morgan_radius': 2, 'combined_morgan_nBits': 1024, 'combined_rdkit_maxPath': 7, 'combined_rdkit_nBits': 256, 'num_hidden_layers': 3, 'hidden_dim_0': 512, 'hidden_dim_1': 128, 'hidden_dim_2': 512, 'kl_weight': 0.0007195550411587096, 'lr': 0.003118957495410278, 'batch_size': 64, 'dropout_rate': 0.43970758904071894, 'prior_mu': 0.047853415331534435, 'prior_sigma': 0.07110922039035963, 'normalization': 'none'}. Best is trial 2329 with value: 0.5157062888145447.
Generating morgan fingerprints...
Generated fingerprints with 2048 features for 900 molecules
Data shape: X=(900, 2048), y=(900,)
Trial 2378: 5-fold CV loss = 0.5969
[I 2025-08-08 05:46:09,403] Trial 2378 finished with value: 0.5969345808029175 and parameters: {'fp_type': 'morgan_rdkit', 'combined_morgan_radius': 2, 'combined_morgan_nBits': 1024, 'combined_rdkit_maxPath': 7, 'combined_rdkit_nBits': 256, 'num_hidden_layers': 3, 'hidden_dim_0': 512, 'hidden_dim_1': 128, 'hidden_dim_2': 512, 'kl_weight': 0.000598094475853285, 'lr': 0.0031784330425403003, 'batch_size': 64, 'dropout_rate': 0.4398759095863522, 'prior_mu': 0.047905788497127455, 'prior_sigma': 0.06639314876624632, 'normalization': 'none'}. Best is trial 2329 with value: 0.5157062888145447.
Generating morgan fingerprints...
Generated fingerprints with 2048 features for 900 molecules
Data shape: X=(900, 2048), y=(900,)
Trial 2380: 5-fold CV loss = 0.7087
[I 2025-08-08 05:46:13,224] Trial 2380 finished with value: 0.7086594223976135 and parameters: {'fp_type': 'morgan', 'morgan_only_radius': 2, 'morgan_only_nBits': 2048, 'num_hidden_layers': 3, 'hidden_dim_0': 512, 'hidden_dim_1': 128, 'hidden_dim_2': 512, 'kl_weight': 0.0005906624194498293, 'lr': 0.0017492065122129924, 'batch_size': 128, 'dropout_rate': 0.39500125961991833, 'prior_mu': 0.0364282258012575, 'prior_sigma': 0.06790075114082458, 'normalization': 'none'}. Best is trial 2329 with value: 0.5157062888145447.
Generating morgan fingerprints...
Generated fingerprints with 2048 features for 900 molecules
Data shape: X=(900, 2048), y=(900,)
Trial 2373: 5-fold CV loss = 0.5267
[I 2025-08-08 05:46:15,889] Trial 2373 finished with value: 0.5266645908355713 and parameters: {'fp_type': 'morgan', 'morgan_only_radius': 2, 'morgan_only_nBits': 2048, 'num_hidden_layers': 3, 'hidden_dim_0': 512, 'hidden_dim_1': 128, 'hidden_dim_2': 512, 'kl_weight': 0.0009752898229503115, 'lr': 0.003588030563129561, 'batch_size': 64, 'dropout_rate': 0.42148682251007175, 'prior_mu': 0.022598727392310745, 'prior_sigma': 0.06476467244968856, 'normalization': 'none'}. Best is trial 2329 with value: 0.5157062888145447.
Generating morgan fingerprints...
Generated fingerprints with 2048 features for 900 molecules
Data shape: X=(900, 2048), y=(900,)
Trial 2381: 5-fold CV loss = 0.6582
[I 2025-08-08 05:46:28,007] Trial 2381 finished with value: 0.658225166797638 and parameters: {'fp_type': 'morgan', 'morgan_only_radius': 2, 'morgan_only_nBits': 2048, 'num_hidden_layers': 3, 'hidden_dim_0': 256, 'hidden_dim_1': 1024, 'hidden_dim_2': 512, 'kl_weight': 0.0006682514127352041, 'lr': 0.0027616173563639688, 'batch_size': 128, 'dropout_rate': 0.29161055009328524, 'prior_mu': 0.036891546404925674, 'prior_sigma': 0.06040588162404045, 'normalization': 'none'}. Best is trial 2329 with value: 0.5157062888145447.
Generating morgan fingerprints...
Generated fingerprints with 2048 features for 900 molecules
Data shape: X=(900, 2048), y=(900,)
Trial 2379: 5-fold CV loss = 0.9345
[I 2025-08-08 05:46:28,958] Trial 2379 finished with value: 0.9345152735710144 and parameters: {'fp_type': 'morgan_rdkit', 'combined_morgan_radius': 2, 'combined_morgan_nBits': 1024, 'combined_rdkit_maxPath': 7, 'combined_rdkit_nBits': 256, 'num_hidden_layers': 3, 'hidden_dim_0': 512, 'hidden_dim_1': 128, 'hidden_dim_2': 512, 'kl_weight': 0.0006025810376832018, 'lr': 0.0013124681740209927, 'batch_size': 64, 'dropout_rate': 0.44078934619229854, 'prior_mu': 0.047941577780172245, 'prior_sigma': 0.06723893037587045, 'normalization': 'none'}. Best is trial 2329 with value: 0.5157062888145447.
Generating morgan fingerprints...
Generated fingerprints with 2048 features for 900 molecules
Data shape: X=(900, 2048), y=(900,)
Trial 2382: 5-fold CV loss = 0.7816
[I 2025-08-08 05:46:35,085] Trial 2382 finished with value: 0.7815985083580017 and parameters: {'fp_type': 'morgan', 'morgan_only_radius': 2, 'morgan_only_nBits': 2048, 'num_hidden_layers': 3, 'hidden_dim_0': 256, 'hidden_dim_1': 1024, 'hidden_dim_2': 1024, 'kl_weight': 0.0007687269731496451, 'lr': 0.0003942188290376413, 'batch_size': 64, 'dropout_rate': 0.4018898875449206, 'prior_mu': 0.013137010430071042, 'prior_sigma': 0.06140284136285955, 'normalization': 'none'}. Best is trial 2329 with value: 0.5157062888145447.
Generating morgan fingerprints...
Generated fingerprints with 2048 features for 900 molecules
Data shape: X=(900, 2048), y=(900,)
Trial 2384: 5-fold CV loss = 1.0655
[I 2025-08-08 05:46:48,477] Trial 2384 finished with value: 1.0654767274856567 and parameters: {'fp_type': 'morgan', 'morgan_only_radius': 3, 'morgan_only_nBits': 2048, 'num_hidden_layers': 3, 'hidden_dim_0': 512, 'hidden_dim_1': 64, 'hidden_dim_2': 512, 'kl_weight': 0.00017030070036920558, 'lr': 0.00010374007254838735, 'batch_size': 64, 'dropout_rate': 0.45907110958919245, 'prior_mu': 0.04250513563071777, 'prior_sigma': 0.07354800621326661, 'normalization': 'none'}. Best is trial 2329 with value: 0.5157062888145447.
Generating morgan fingerprints...
Generated fingerprints with 2048 features for 900 molecules
Data shape: X=(900, 2048), y=(900,)
Trial 2385: 5-fold CV loss = 1.0064
[I 2025-08-08 05:47:09,137] Trial 2385 finished with value: 1.0063568353652954 and parameters: {'fp_type': 'morgan', 'morgan_only_radius': 2, 'morgan_only_nBits': 2048, 'num_hidden_layers': 3, 'hidden_dim_0': 512, 'hidden_dim_1': 64, 'hidden_dim_2': 512, 'kl_weight': 0.0007676219181270806, 'lr': 0.0015524400618824874, 'batch_size': 64, 'dropout_rate': 0.4604547360023512, 'prior_mu': 0.01154538821187365, 'prior_sigma': 0.08526145983081018, 'normalization': 'none'}. Best is trial 2329 with value: 0.5157062888145447.
Generating morgan fingerprints...
Generated fingerprints with 2048 features for 900 molecules
Data shape: X=(900, 2048), y=(900,)
Trial 2383: 5-fold CV loss = 0.6558
[I 2025-08-08 05:47:09,658] Trial 2383 finished with value: 0.6558358252048493 and parameters: {'fp_type': 'morgan', 'morgan_only_radius': 3, 'morgan_only_nBits': 2048, 'num_hidden_layers': 3, 'hidden_dim_0': 256, 'hidden_dim_1': 64, 'hidden_dim_2': 1024, 'kl_weight': 0.0007845572859618124, 'lr': 0.0027406103760405256, 'batch_size': 128, 'dropout_rate': 0.4605005933712825, 'prior_mu': 0.010120116137809245, 'prior_sigma': 0.06190036278352615, 'normalization': 'none'}. Best is trial 2329 with value: 0.5157062888145447.
Generating morgan fingerprints...
Generated fingerprints with 2048 features for 900 molecules
Data shape: X=(900, 2048), y=(900,)
Trial 2386: 5-fold CV loss = 1.1709
[I 2025-08-08 05:47:22,674] Trial 2386 finished with value: 1.1708661913871765 and parameters: {'fp_type': 'morgan', 'morgan_only_radius': 3, 'morgan_only_nBits': 2048, 'num_hidden_layers': 3, 'hidden_dim_0': 512, 'hidden_dim_1': 64, 'hidden_dim_2': 512, 'kl_weight': 0.0001380408671020639, 'lr': 0.00010428213246224384, 'batch_size': 32, 'dropout_rate': 0.43088861808734147, 'prior_mu': 0.03553443193401266, 'prior_sigma': 0.09254763687682452, 'normalization': 'none'}. Best is trial 2329 with value: 0.5157062888145447.
Generating morgan fingerprints...
Generated fingerprints with 2048 features for 900 molecules
Data shape: X=(900, 2048), y=(900,)
Trial 2387: 5-fold CV loss = 3.0645
[I 2025-08-08 05:48:16,697] Trial 2387 finished with value: 3.064524793624878 and parameters: {'fp_type': 'morgan', 'morgan_only_radius': 2, 'morgan_only_nBits': 2048, 'num_hidden_layers': 3, 'hidden_dim_0': 512, 'hidden_dim_1': 128, 'hidden_dim_2': 256, 'kl_weight': 0.0008809201989360999, 'lr': 0.00016481058677947136, 'batch_size': 32, 'dropout_rate': 0.4305346600036965, 'prior_mu': 0.13300053206332998, 'prior_sigma': 0.19925997520778024, 'normalization': 'none'}. Best is trial 2329 with value: 0.5157062888145447.
Generating morgan fingerprints...
Generated fingerprints with 2048 features for 900 molecules
Data shape: X=(900, 2048), y=(900,)
Trial 2390: 5-fold CV loss = 0.6388
[I 2025-08-08 05:48:25,405] Trial 2390 finished with value: 0.6387604296207428 and parameters: {'fp_type': 'morgan', 'morgan_only_radius': 2, 'morgan_only_nBits': 2048, 'num_hidden_layers': 3, 'hidden_dim_0': 512, 'hidden_dim_1': 128, 'hidden_dim_2': 256, 'kl_weight': 0.0001931724403384854, 'lr': 0.001852950953916909, 'batch_size': 32, 'dropout_rate': 0.43094829427314046, 'prior_mu': 0.048277048565170295, 'prior_sigma': 0.07224720471759777, 'normalization': 'none'}. Best is trial 2329 with value: 0.5157062888145447.
Generating morgan fingerprints...
Generated fingerprints with 2048 features for 900 molecules
Data shape: X=(900, 2048), y=(900,)
Trial 2389: 5-fold CV loss = 0.9813
[I 2025-08-08 05:49:09,895] Trial 2389 finished with value: 0.9812635660171509 and parameters: {'fp_type': 'morgan', 'morgan_only_radius': 2, 'morgan_only_nBits': 2048, 'num_hidden_layers': 3, 'hidden_dim_0': 512, 'hidden_dim_1': 512, 'hidden_dim_2': 256, 'kl_weight': 0.0008529003916318188, 'lr': 0.0018317611605246564, 'batch_size': 32, 'dropout_rate': 0.42921268735833196, 'prior_mu': 0.03022996661315404, 'prior_sigma': 0.07994958940584868, 'normalization': 'none'}. Best is trial 2329 with value: 0.5157062888145447.
Generating morgan fingerprints...
Generated fingerprints with 2048 features for 900 molecules
Data shape: X=(900, 2048), y=(900,)
Trial 2391: 5-fold CV loss = 0.7001
[I 2025-08-08 05:49:11,888] Trial 2391 finished with value: 0.7000549793243408 and parameters: {'fp_type': 'morgan', 'morgan_only_radius': 2, 'morgan_only_nBits': 2048, 'num_hidden_layers': 3, 'hidden_dim_0': 512, 'hidden_dim_1': 128, 'hidden_dim_2': 512, 'kl_weight': 0.0002006657924737875, 'lr': 0.0018169542970024612, 'batch_size': 32, 'dropout_rate': 0.4463427829888129, 'prior_mu': 0.027928415624155677, 'prior_sigma': 0.07717846615734288, 'normalization': 'none'}. Best is trial 2329 with value: 0.5157062888145447.
Generating morgan fingerprints...
Generated fingerprints with 2048 features for 900 molecules
Data shape: X=(900, 2048), y=(900,)
Trial 2388: 5-fold CV loss = 0.5786
