[I 2025-08-07 16:49:48,863] Trial 271 finished with value: 0.5690727531909943 and parameters: {'fp_type': 'morgan', 'morgan_only_radius': 2, 'morgan_only_nBits': 1024, 'num_hidden_layers': 3, 'hidden_dim_0': 512, 'hidden_dim_1': 128, 'hidden_dim_2': 512, 'kl_weight': 0.0002436131760828482, 'lr': 0.0020922266836993137, 'batch_size': 32, 'dropout_rate': 0.177421163577455, 'prior_mu': -0.04234247277396207, 'prior_sigma': 0.0628808019236319, 'normalization': 'none'}. Best is trial 268 with value: 0.5260788023471832.
Generating morgan fingerprints...
Generated fingerprints with 1024 features for 900 molecules
Data shape: X=(900, 1024), y=(900,)
Trial 273: 5-fold CV loss = 0.9552
[I 2025-08-07 16:50:51,262] Trial 273 finished with value: 0.955183333158493 and parameters: {'fp_type': 'morgan', 'morgan_only_radius': 2, 'morgan_only_nBits': 1024, 'num_hidden_layers': 3, 'hidden_dim_0': 512, 'hidden_dim_1': 512, 'hidden_dim_2': 1024, 'kl_weight': 0.00022405139972833148, 'lr': 0.0016412757403601668, 'batch_size': 32, 'dropout_rate': 0.4924792096544888, 'prior_mu': -0.038994184874649646, 'prior_sigma': 0.061763303684637796, 'normalization': 'none'}. Best is trial 268 with value: 0.5260788023471832.
Generating morgan fingerprints...
Generated fingerprints with 2048 features for 900 molecules
Data shape: X=(900, 2048), y=(900,)
Trial 274: 5-fold CV loss = 0.5328
[I 2025-08-07 16:50:59,768] Trial 274 finished with value: 0.5327865839004516 and parameters: {'fp_type': 'morgan', 'morgan_only_radius': 2, 'morgan_only_nBits': 1024, 'num_hidden_layers': 3, 'hidden_dim_0': 512, 'hidden_dim_1': 256, 'hidden_dim_2': 1024, 'kl_weight': 0.001130880446517454, 'lr': 0.002270068859422255, 'batch_size': 32, 'dropout_rate': 0.4994288155472476, 'prior_mu': -0.041327744068828894, 'prior_sigma': 0.06249550031403764, 'normalization': 'none'}. Best is trial 268 with value: 0.5260788023471832.
Generating morgan fingerprints...
Generated fingerprints with 1024 features for 900 molecules
Data shape: X=(900, 1024), y=(900,)
Trial 272: 5-fold CV loss = 0.5198
[I 2025-08-07 16:51:24,698] Trial 272 finished with value: 0.5198344707489013 and parameters: {'fp_type': 'morgan', 'morgan_only_radius': 2, 'morgan_only_nBits': 1024, 'num_hidden_layers': 3, 'hidden_dim_0': 512, 'hidden_dim_1': 128, 'hidden_dim_2': 512, 'kl_weight': 0.0002188904692215837, 'lr': 0.0022398460969806568, 'batch_size': 32, 'dropout_rate': 0.49984562176777764, 'prior_mu': -0.0367902793528424, 'prior_sigma': 0.06352834714068305, 'normalization': 'none'}. Best is trial 272 with value: 0.5198344707489013.
Generating morgan fingerprints...
Generated fingerprints with 1024 features for 900 molecules
Data shape: X=(900, 1024), y=(900,)
Trial 275: 5-fold CV loss = 0.5320
[I 2025-08-07 16:51:59,962] Trial 275 finished with value: 0.5320460975170136 and parameters: {'fp_type': 'morgan', 'morgan_only_radius': 2, 'morgan_only_nBits': 2048, 'num_hidden_layers': 3, 'hidden_dim_0': 512, 'hidden_dim_1': 256, 'hidden_dim_2': 1024, 'kl_weight': 0.00021491888282522742, 'lr': 0.002223385852571305, 'batch_size': 32, 'dropout_rate': 0.4989206856222939, 'prior_mu': -0.042782389221316976, 'prior_sigma': 0.05721411121094764, 'normalization': 'none'}. Best is trial 272 with value: 0.5198344707489013.
Generating morgan fingerprints...
Generated fingerprints with 1024 features for 900 molecules
Data shape: X=(900, 1024), y=(900,)
Trial 276: 5-fold CV loss = 0.5299
[I 2025-08-07 16:52:11,026] Trial 276 finished with value: 0.5299248695373535 and parameters: {'fp_type': 'morgan', 'morgan_only_radius': 2, 'morgan_only_nBits': 1024, 'num_hidden_layers': 3, 'hidden_dim_0': 512, 'hidden_dim_1': 256, 'hidden_dim_2': 1024, 'kl_weight': 0.0002128920603451879, 'lr': 0.0021092411337068893, 'batch_size': 32, 'dropout_rate': 0.4910310497798023, 'prior_mu': -0.05977856544975624, 'prior_sigma': 0.057820952865956225, 'normalization': 'none'}. Best is trial 272 with value: 0.5198344707489013.
Generating morgan fingerprints...
Generated fingerprints with 2048 features for 900 molecules
Data shape: X=(900, 2048), y=(900,)
Trial 270: 5-fold CV loss = 0.5476
[I 2025-08-07 16:52:15,631] Trial 270 finished with value: 0.547636067867279 and parameters: {'fp_type': 'morgan', 'morgan_only_radius': 2, 'morgan_only_nBits': 1024, 'num_hidden_layers': 3, 'hidden_dim_0': 512, 'hidden_dim_1': 128, 'hidden_dim_2': 512, 'kl_weight': 0.00023702131145820855, 'lr': 0.002329479748753796, 'batch_size': 32, 'dropout_rate': 0.47745975069485047, 'prior_mu': -0.03969972454669634, 'prior_sigma': 0.06190083519689733, 'normalization': 'none'}. Best is trial 272 with value: 0.5198344707489013.
Generating morgan fingerprints...
Generated fingerprints with 2048 features for 900 molecules
Data shape: X=(900, 2048), y=(900,)
Trial 279: 5-fold CV loss = 0.5927
[I 2025-08-07 16:53:15,435] Trial 279 finished with value: 0.5926777005195618 and parameters: {'fp_type': 'morgan', 'morgan_only_radius': 2, 'morgan_only_nBits': 2048, 'num_hidden_layers': 3, 'hidden_dim_0': 512, 'hidden_dim_1': 256, 'hidden_dim_2': 512, 'kl_weight': 0.00021535668524907983, 'lr': 0.002208862658089438, 'batch_size': 32, 'dropout_rate': 0.4998456876120005, 'prior_mu': -0.04743290901621268, 'prior_sigma': 0.058604945723214306, 'normalization': 'none'}. Best is trial 272 with value: 0.5198344707489013.
Generating morgan fingerprints...
Generated fingerprints with 2048 features for 900 molecules
Data shape: X=(900, 2048), y=(900,)
Trial 278: 5-fold CV loss = 0.5261
[I 2025-08-07 16:53:40,814] Trial 278 finished with value: 0.5260760962963105 and parameters: {'fp_type': 'morgan', 'morgan_only_radius': 2, 'morgan_only_nBits': 1024, 'num_hidden_layers': 3, 'hidden_dim_0': 512, 'hidden_dim_1': 128, 'hidden_dim_2': 512, 'kl_weight': 0.0011562440297080753, 'lr': 0.002204882806086476, 'batch_size': 32, 'dropout_rate': 0.497040460576271, 'prior_mu': -0.053380021554771444, 'prior_sigma': 0.06152444653390838, 'normalization': 'none'}. Best is trial 272 with value: 0.5198344707489013.
Generating morgan fingerprints...
Generated fingerprints with 2048 features for 900 molecules
Data shape: X=(900, 2048), y=(900,)
Trial 277: 5-fold CV loss = 0.5248
[I 2025-08-07 16:53:51,176] Trial 277 finished with value: 0.5248455762863159 and parameters: {'fp_type': 'morgan', 'morgan_only_radius': 2, 'morgan_only_nBits': 1024, 'num_hidden_layers': 3, 'hidden_dim_0': 512, 'hidden_dim_1': 256, 'hidden_dim_2': 512, 'kl_weight': 0.0010849820880552187, 'lr': 0.001981523591491282, 'batch_size': 32, 'dropout_rate': 0.4989027002078863, 'prior_mu': -0.047861327067265425, 'prior_sigma': 0.06293321196866286, 'normalization': 'none'}. Best is trial 272 with value: 0.5198344707489013.
Generating morgan fingerprints...
Generated fingerprints with 2048 features for 900 molecules
Data shape: X=(900, 2048), y=(900,)
Trial 281: 5-fold CV loss = 0.5351
[I 2025-08-07 16:54:28,681] Trial 281 finished with value: 0.5351362109184266 and parameters: {'fp_type': 'morgan', 'morgan_only_radius': 2, 'morgan_only_nBits': 2048, 'num_hidden_layers': 3, 'hidden_dim_0': 512, 'hidden_dim_1': 256, 'hidden_dim_2': 1024, 'kl_weight': 0.001124558568019311, 'lr': 0.0021808599503238698, 'batch_size': 32, 'dropout_rate': 0.49934456648165193, 'prior_mu': -0.05931238509592743, 'prior_sigma': 0.054865744886888244, 'normalization': 'none'}. Best is trial 272 with value: 0.5198344707489013.
Generating morgan fingerprints...
Generated fingerprints with 2048 features for 900 molecules
Data shape: X=(900, 2048), y=(900,)
Trial 282: 5-fold CV loss = 0.5327
[I 2025-08-07 16:55:33,719] Trial 282 finished with value: 0.5327261745929718 and parameters: {'fp_type': 'morgan', 'morgan_only_radius': 2, 'morgan_only_nBits': 2048, 'num_hidden_layers': 3, 'hidden_dim_0': 512, 'hidden_dim_1': 256, 'hidden_dim_2': 512, 'kl_weight': 0.0012192869661157722, 'lr': 0.002059535776728076, 'batch_size': 32, 'dropout_rate': 0.4912495285318339, 'prior_mu': -0.056024717538201825, 'prior_sigma': 0.055026731270949175, 'normalization': 'none'}. Best is trial 272 with value: 0.5198344707489013.
Generating morgan fingerprints...
Generated fingerprints with 2048 features for 900 molecules
Data shape: X=(900, 2048), y=(900,)
Trial 280: 5-fold CV loss = 0.5312
[I 2025-08-07 16:55:50,358] Trial 280 finished with value: 0.5311747312545776 and parameters: {'fp_type': 'morgan', 'morgan_only_radius': 2, 'morgan_only_nBits': 2048, 'num_hidden_layers': 3, 'hidden_dim_0': 512, 'hidden_dim_1': 256, 'hidden_dim_2': 1024, 'kl_weight': 0.0002007077994951633, 'lr': 0.0021022785599436014, 'batch_size': 32, 'dropout_rate': 0.4988897054248964, 'prior_mu': -0.05789466174253794, 'prior_sigma': 0.05664257917361713, 'normalization': 'none'}. Best is trial 272 with value: 0.5198344707489013.
Generating morgan fingerprints...
Generated fingerprints with 2048 features for 900 molecules
Data shape: X=(900, 2048), y=(900,)
Trial 284: 5-fold CV loss = 0.5278
[I 2025-08-07 16:56:07,945] Trial 284 finished with value: 0.5277871668338776 and parameters: {'fp_type': 'morgan', 'morgan_only_radius': 2, 'morgan_only_nBits': 2048, 'num_hidden_layers': 3, 'hidden_dim_0': 512, 'hidden_dim_1': 256, 'hidden_dim_2': 512, 'kl_weight': 0.0011436612732346869, 'lr': 0.001779886408702931, 'batch_size': 32, 'dropout_rate': 0.48959939162678856, 'prior_mu': -0.05475709976765108, 'prior_sigma': 0.0569052100245849, 'normalization': 'none'}. Best is trial 272 with value: 0.5198344707489013.
Generating morgan fingerprints...
Generated fingerprints with 2048 features for 900 molecules
Data shape: X=(900, 2048), y=(900,)
Trial 283: 5-fold CV loss = 0.5319
[I 2025-08-07 16:56:14,458] Trial 283 finished with value: 0.5319239914417266 and parameters: {'fp_type': 'morgan', 'morgan_only_radius': 2, 'morgan_only_nBits': 2048, 'num_hidden_layers': 3, 'hidden_dim_0': 512, 'hidden_dim_1': 256, 'hidden_dim_2': 512, 'kl_weight': 0.0011527946282474109, 'lr': 0.00199246893101519, 'batch_size': 32, 'dropout_rate': 0.48986416320276027, 'prior_mu': -0.0648858769796499, 'prior_sigma': 0.05424734927265397, 'normalization': 'none'}. Best is trial 272 with value: 0.5198344707489013.
Generating morgan fingerprints...
Generated fingerprints with 2048 features for 900 molecules
Data shape: X=(900, 2048), y=(900,)
Trial 285: 5-fold CV loss = 0.5890
[I 2025-08-07 16:57:20,574] Trial 285 finished with value: 0.5890245497226715 and parameters: {'fp_type': 'morgan', 'morgan_only_radius': 2, 'morgan_only_nBits': 2048, 'num_hidden_layers': 3, 'hidden_dim_0': 512, 'hidden_dim_1': 256, 'hidden_dim_2': 512, 'kl_weight': 0.0013767856579289463, 'lr': 0.001792390013612711, 'batch_size': 32, 'dropout_rate': 0.48961622203374017, 'prior_mu': -0.05635287665376491, 'prior_sigma': 0.05688021852947858, 'normalization': 'none'}. Best is trial 272 with value: 0.5198344707489013.
Generating morgan fingerprints...
Generated fingerprints with 2048 features for 900 molecules
Data shape: X=(900, 2048), y=(900,)
Trial 287: 5-fold CV loss = 0.5355
[I 2025-08-07 16:57:39,996] Trial 287 finished with value: 0.5354605257511139 and parameters: {'fp_type': 'morgan', 'morgan_only_radius': 2, 'morgan_only_nBits': 2048, 'num_hidden_layers': 3, 'hidden_dim_0': 512, 'hidden_dim_1': 256, 'hidden_dim_2': 512, 'kl_weight': 0.0013971537668606322, 'lr': 0.0017762011293368993, 'batch_size': 32, 'dropout_rate': 0.4886404525930205, 'prior_mu': -0.0673246222910793, 'prior_sigma': 0.05711328964423499, 'normalization': 'none'}. Best is trial 272 with value: 0.5198344707489013.
Generating morgan fingerprints...
Generated fingerprints with 2048 features for 900 molecules
Data shape: X=(900, 2048), y=(900,)
Trial 288: 5-fold CV loss = 0.5427
[I 2025-08-07 16:58:44,254] Trial 288 finished with value: 0.5427193522453309 and parameters: {'fp_type': 'morgan', 'morgan_only_radius': 2, 'morgan_only_nBits': 2048, 'num_hidden_layers': 3, 'hidden_dim_0': 512, 'hidden_dim_1': 256, 'hidden_dim_2': 512, 'kl_weight': 0.0014613179119054628, 'lr': 0.0018102261585909456, 'batch_size': 32, 'dropout_rate': 0.4921086999648149, 'prior_mu': -0.06699024466782208, 'prior_sigma': 0.05415894606574873, 'normalization': 'none'}. Best is trial 272 with value: 0.5198344707489013.
Generating morgan fingerprints...
Generated fingerprints with 2048 features for 900 molecules
Data shape: X=(900, 2048), y=(900,)
Trial 289: 5-fold CV loss = 0.7331
[I 2025-08-07 16:58:53,883] Trial 289 finished with value: 0.7331240773200989 and parameters: {'fp_type': 'morgan', 'morgan_only_radius': 2, 'morgan_only_nBits': 2048, 'num_hidden_layers': 3, 'hidden_dim_0': 512, 'hidden_dim_1': 256, 'hidden_dim_2': 512, 'kl_weight': 0.0011470982637129764, 'lr': 0.0013937894075906467, 'batch_size': 32, 'dropout_rate': 0.49106231985097304, 'prior_mu': -0.06005289511854237, 'prior_sigma': 0.052724937207095944, 'normalization': 'none'}. Best is trial 272 with value: 0.5198344707489013.
Generating rdkit fingerprints...
Generated fingerprints with 512 features for 900 molecules
Data shape: X=(900, 512), y=(900,)
Trial 290: 5-fold CV loss = 0.5366
[I 2025-08-07 16:59:00,586] Trial 290 finished with value: 0.5366001665592194 and parameters: {'fp_type': 'morgan', 'morgan_only_radius': 2, 'morgan_only_nBits': 2048, 'num_hidden_layers': 3, 'hidden_dim_0': 512, 'hidden_dim_1': 256, 'hidden_dim_2': 512, 'kl_weight': 0.0011026515243448007, 'lr': 0.0020365904532061605, 'batch_size': 32, 'dropout_rate': 0.4915751412684725, 'prior_mu': -0.06443950549530605, 'prior_sigma': 0.052782938844878696, 'normalization': 'none'}. Best is trial 272 with value: 0.5198344707489013.
Generating rdkit fingerprints...
Generated fingerprints with 512 features for 900 molecules
Data shape: X=(900, 512), y=(900,)
Trial 293: 5-fold CV loss = 0.6461
[I 2025-08-07 16:59:41,229] Trial 293 finished with value: 0.6461223423480987 and parameters: {'fp_type': 'rdkit', 'rdkit_only_maxPath': 6, 'rdkit_only_nBits': 512, 'num_hidden_layers': 3, 'hidden_dim_0': 512, 'hidden_dim_1': 256, 'hidden_dim_2': 512, 'kl_weight': 0.0009062735815613939, 'lr': 0.0020869594011384378, 'batch_size': 32, 'dropout_rate': 0.49989253163480674, 'prior_mu': -0.045911001725178244, 'prior_sigma': 0.059073282051396704, 'normalization': 'layer'}. Best is trial 272 with value: 0.5198344707489013.
Generating morgan fingerprints...
Generated fingerprints with 2048 features for 900 molecules
Data shape: X=(900, 2048), y=(900,)
Trial 291: 5-fold CV loss = 0.6001
[I 2025-08-07 17:00:49,385] Trial 291 finished with value: 0.600118774175644 and parameters: {'fp_type': 'morgan', 'morgan_only_radius': 2, 'morgan_only_nBits': 2048, 'num_hidden_layers': 3, 'hidden_dim_0': 512, 'hidden_dim_1': 256, 'hidden_dim_2': 512, 'kl_weight': 0.0010869382126978404, 'lr': 0.002025792323556797, 'batch_size': 32, 'dropout_rate': 0.49971676251816777, 'prior_mu': -0.051842988513611986, 'prior_sigma': 0.05195676572212546, 'normalization': 'none'}. Best is trial 272 with value: 0.5198344707489013.
Generating morgan fingerprints...
Generated fingerprints with 2048 features for 900 molecules
Data shape: X=(900, 2048), y=(900,)
Trial 292: 5-fold CV loss = 0.5811
[I 2025-08-07 17:00:53,252] Trial 292 finished with value: 0.5810536205768585 and parameters: {'fp_type': 'rdkit', 'rdkit_only_maxPath': 6, 'rdkit_only_nBits': 512, 'num_hidden_layers': 3, 'hidden_dim_0': 512, 'hidden_dim_1': 256, 'hidden_dim_2': 512, 'kl_weight': 0.0008590086734963541, 'lr': 0.0020312623288893084, 'batch_size': 32, 'dropout_rate': 0.4745987637164367, 'prior_mu': -0.05031619458999187, 'prior_sigma': 0.05896809351878275, 'normalization': 'layer'}. Best is trial 272 with value: 0.5198344707489013.
Generating morgan fingerprints...
Generated fingerprints with 2048 features for 900 molecules
Data shape: X=(900, 2048), y=(900,)
Trial 286: 5-fold CV loss = 0.5409
[I 2025-08-07 17:00:57,735] Trial 286 finished with value: 0.5409478068351745 and parameters: {'fp_type': 'morgan', 'morgan_only_radius': 2, 'morgan_only_nBits': 2048, 'num_hidden_layers': 3, 'hidden_dim_0': 512, 'hidden_dim_1': 256, 'hidden_dim_2': 512, 'kl_weight': 0.001224004155224526, 'lr': 0.0017570421886447683, 'batch_size': 32, 'dropout_rate': 0.4900628275930813, 'prior_mu': -0.06165876481376936, 'prior_sigma': 0.053256628515825424, 'normalization': 'none'}. Best is trial 272 with value: 0.5198344707489013.
Generating morgan fingerprints...
Generated fingerprints with 2048 features for 900 molecules
Data shape: X=(900, 2048), y=(900,)
Trial 294: 5-fold CV loss = 0.5336
[I 2025-08-07 17:01:12,770] Trial 294 finished with value: 0.533610463142395 and parameters: {'fp_type': 'morgan', 'morgan_only_radius': 2, 'morgan_only_nBits': 2048, 'num_hidden_layers': 3, 'hidden_dim_0': 512, 'hidden_dim_1': 256, 'hidden_dim_2': 512, 'kl_weight': 0.0016784432828115972, 'lr': 0.0019522430432529034, 'batch_size': 32, 'dropout_rate': 0.47299810217054955, 'prior_mu': -0.05442396345379855, 'prior_sigma': 0.05994156869185623, 'normalization': 'none'}. Best is trial 272 with value: 0.5198344707489013.
Generating morgan fingerprints...
Generated fingerprints with 2048 features for 900 molecules
Data shape: X=(900, 2048), y=(900,)
Trial 295: 5-fold CV loss = 0.8092
[I 2025-08-07 17:01:22,208] Trial 295 finished with value: 0.8092318654060364 and parameters: {'fp_type': 'morgan', 'morgan_only_radius': 2, 'morgan_only_nBits': 2048, 'num_hidden_layers': 1, 'hidden_dim_0': 512, 'kl_weight': 0.0008970288464530428, 'lr': 0.0015268739631507744, 'batch_size': 32, 'dropout_rate': 0.46987150342392286, 'prior_mu': -0.05153933153601065, 'prior_sigma': 0.06040895498033412, 'normalization': 'none'}. Best is trial 272 with value: 0.5198344707489013.
Generating morgan fingerprints...
Generated fingerprints with 2048 features for 900 molecules
Data shape: X=(900, 2048), y=(900,)
Trial 296: 5-fold CV loss = 0.5406
[I 2025-08-07 17:02:28,194] Trial 296 finished with value: 0.5405913770198822 and parameters: {'fp_type': 'morgan', 'morgan_only_radius': 2, 'morgan_only_nBits': 2048, 'num_hidden_layers': 3, 'hidden_dim_0': 512, 'hidden_dim_1': 256, 'hidden_dim_2': 512, 'kl_weight': 0.0017089521787747427, 'lr': 0.0022388480207877455, 'batch_size': 32, 'dropout_rate': 0.4745806128120363, 'prior_mu': -0.07626716239285197, 'prior_sigma': 0.05608154346341284, 'normalization': 'none'}. Best is trial 272 with value: 0.5198344707489013.
Generating morgan fingerprints...
Generated fingerprints with 2048 features for 900 molecules
Data shape: X=(900, 2048), y=(900,)
Trial 298: 5-fold CV loss = 0.5349
[I 2025-08-07 17:02:37,618] Trial 298 finished with value: 0.5349439740180969 and parameters: {'fp_type': 'morgan', 'morgan_only_radius': 2, 'morgan_only_nBits': 2048, 'num_hidden_layers': 3, 'hidden_dim_0': 512, 'hidden_dim_1': 256, 'hidden_dim_2': 512, 'kl_weight': 0.002247754205553409, 'lr': 0.0022267958268542697, 'batch_size': 32, 'dropout_rate': 0.46020329385045833, 'prior_mu': -0.07984851103073376, 'prior_sigma': 0.05578286912088942, 'normalization': 'none'}. Best is trial 272 with value: 0.5198344707489013.
Generating morgan fingerprints...
Generated fingerprints with 2048 features for 900 molecules
Data shape: X=(900, 2048), y=(900,)
Trial 299: 5-fold CV loss = 0.5329
[I 2025-08-07 17:03:20,582] Trial 299 finished with value: 0.5329159259796142 and parameters: {'fp_type': 'morgan', 'morgan_only_radius': 2, 'morgan_only_nBits': 2048, 'num_hidden_layers': 3, 'hidden_dim_0': 512, 'hidden_dim_1': 256, 'hidden_dim_2': 512, 'kl_weight': 0.0012104127831005479, 'lr': 0.002282890467049467, 'batch_size': 32, 'dropout_rate': 0.4814617312178053, 'prior_mu': -0.04245336514573746, 'prior_sigma': 0.0568504201183128, 'normalization': 'none'}. Best is trial 272 with value: 0.5198344707489013.
Generating morgan fingerprints...
Generated fingerprints with 2048 features for 900 molecules
Data shape: X=(900, 2048), y=(900,)
Trial 300: 5-fold CV loss = 0.5770
[I 2025-08-07 17:03:41,484] Trial 300 finished with value: 0.577045202255249 and parameters: {'fp_type': 'morgan', 'morgan_only_radius': 2, 'morgan_only_nBits': 2048, 'num_hidden_layers': 3, 'hidden_dim_0': 512, 'hidden_dim_1': 256, 'hidden_dim_2': 512, 'kl_weight': 0.0009932389443082117, 'lr': 0.0022343706651644394, 'batch_size': 32, 'dropout_rate': 0.4829356878689377, 'prior_mu': -0.04188400742355561, 'prior_sigma': 0.06277714226574313, 'normalization': 'none'}. Best is trial 272 with value: 0.5198344707489013.
Generating morgan fingerprints...
Generated fingerprints with 2048 features for 900 molecules
Data shape: X=(900, 2048), y=(900,)
Trial 301: 5-fold CV loss = 0.6590
[I 2025-08-07 17:03:54,431] Trial 301 finished with value: 0.6590169847011567 and parameters: {'fp_type': 'morgan', 'morgan_only_radius': 2, 'morgan_only_nBits': 2048, 'num_hidden_layers': 3, 'hidden_dim_0': 512, 'hidden_dim_1': 256, 'hidden_dim_2': 512, 'kl_weight': 0.0009890395316807306, 'lr': 0.0019233375309843331, 'batch_size': 32, 'dropout_rate': 0.4842681428534419, 'prior_mu': -0.04137447196603627, 'prior_sigma': 0.062908180757144, 'normalization': 'none'}. Best is trial 272 with value: 0.5198344707489013.
Generating morgan fingerprints...
Generated fingerprints with 2048 features for 900 molecules
Data shape: X=(900, 2048), y=(900,)
Trial 297: 5-fold CV loss = 0.7400
[I 2025-08-07 17:04:16,418] Trial 297 finished with value: 0.7400232315063476 and parameters: {'fp_type': 'morgan', 'morgan_only_radius': 2, 'morgan_only_nBits': 2048, 'num_hidden_layers': 3, 'hidden_dim_0': 512, 'hidden_dim_1': 256, 'hidden_dim_2': 512, 'kl_weight': 0.0009896877969299697, 'lr': 0.0016057660420605159, 'batch_size': 32, 'dropout_rate': 0.4747255240068303, 'prior_mu': -0.073569018156461, 'prior_sigma': 0.06147236712559463, 'normalization': 'none'}. Best is trial 272 with value: 0.5198344707489013.
Generating morgan fingerprints...
Generated fingerprints with 1024 features for 900 molecules
Data shape: X=(900, 1024), y=(900,)
Trial 304: 5-fold CV loss = 0.5502
