[I 2025-08-08 00:49:43,639] Trial 1540 finished with value: 0.6369904994964599 and parameters: {'fp_type': 'rdkit', 'rdkit_only_maxPath': 8, 'rdkit_only_nBits': 1024, 'num_hidden_layers': 3, 'hidden_dim_0': 64, 'hidden_dim_1': 128, 'hidden_dim_2': 512, 'kl_weight': 0.0009435239999769899, 'lr': 0.0015294601785044697, 'batch_size': 32, 'dropout_rate': 0.44190859670279464, 'prior_mu': 0.06815121132057603, 'prior_sigma': 0.05456199088246249, 'normalization': 'none'}. Best is trial 1528 with value: 0.5170644640922546.
Generating morgan fingerprints...
Generated fingerprints with 2048 features for 900 molecules
Data shape: X=(900, 2048), y=(900,)
Trial 1542: 5-fold CV loss = 0.5625
[I 2025-08-08 00:50:23,923] Trial 1542 finished with value: 0.5625045895576477 and parameters: {'fp_type': 'morgan', 'morgan_only_radius': 2, 'morgan_only_nBits': 2048, 'num_hidden_layers': 3, 'hidden_dim_0': 64, 'hidden_dim_1': 128, 'hidden_dim_2': 512, 'kl_weight': 0.000949560458308704, 'lr': 0.0020184246665058947, 'batch_size': 32, 'dropout_rate': 0.44494270850592393, 'prior_mu': 0.18091876378493157, 'prior_sigma': 0.053180287959129685, 'normalization': 'none'}. Best is trial 1528 with value: 0.5170644640922546.
Generating morgan fingerprints...
Generated fingerprints with 2048 features for 900 molecules
Data shape: X=(900, 2048), y=(900,)
Trial 1541: 5-fold CV loss = 0.6380
[I 2025-08-08 00:51:02,523] Trial 1541 finished with value: 0.6380450844764709 and parameters: {'fp_type': 'rdkit', 'rdkit_only_maxPath': 8, 'rdkit_only_nBits': 1024, 'num_hidden_layers': 3, 'hidden_dim_0': 64, 'hidden_dim_1': 128, 'hidden_dim_2': 512, 'kl_weight': 0.0008968004139514656, 'lr': 0.0015571437675639408, 'batch_size': 32, 'dropout_rate': 0.4437833534260223, 'prior_mu': 0.06678844948665094, 'prior_sigma': 0.05325139135397678, 'normalization': 'none'}. Best is trial 1528 with value: 0.5170644640922546.
Generating morgan fingerprints...
Generated fingerprints with 2048 features for 900 molecules
Data shape: X=(900, 2048), y=(900,)
Trial 1545: 5-fold CV loss = 0.5444
[I 2025-08-08 00:51:26,136] Trial 1545 finished with value: 0.5443867325782776 and parameters: {'fp_type': 'morgan', 'morgan_only_radius': 2, 'morgan_only_nBits': 2048, 'num_hidden_layers': 3, 'hidden_dim_0': 512, 'hidden_dim_1': 128, 'hidden_dim_2': 512, 'kl_weight': 0.0006859079551202665, 'lr': 0.0022908372747127434, 'batch_size': 32, 'dropout_rate': 0.44856694504321676, 'prior_mu': 0.040534463154468965, 'prior_sigma': 0.06215345824894544, 'normalization': 'none'}. Best is trial 1528 with value: 0.5170644640922546.
Generating morgan fingerprints...
Generated fingerprints with 2048 features for 900 molecules
Data shape: X=(900, 2048), y=(900,)
Trial 1544: 5-fold CV loss = 0.5410
[I 2025-08-08 00:51:36,120] Trial 1544 finished with value: 0.5409998059272766 and parameters: {'fp_type': 'morgan', 'morgan_only_radius': 2, 'morgan_only_nBits': 2048, 'num_hidden_layers': 3, 'hidden_dim_0': 512, 'hidden_dim_1': 128, 'hidden_dim_2': 512, 'kl_weight': 0.0006446647020023553, 'lr': 0.002022871032711462, 'batch_size': 32, 'dropout_rate': 0.4442057151618114, 'prior_mu': 0.030806728422739862, 'prior_sigma': 0.06127088771132036, 'normalization': 'none'}. Best is trial 1528 with value: 0.5170644640922546.
Generating morgan fingerprints...
Generated fingerprints with 2048 features for 900 molecules
Data shape: X=(900, 2048), y=(900,)
Trial 1543: 5-fold CV loss = 0.5634
[I 2025-08-08 00:51:42,169] Trial 1543 finished with value: 0.56343874335289 and parameters: {'fp_type': 'morgan', 'morgan_only_radius': 2, 'morgan_only_nBits': 2048, 'num_hidden_layers': 3, 'hidden_dim_0': 512, 'hidden_dim_1': 128, 'hidden_dim_2': 512, 'kl_weight': 0.0009504958383225683, 'lr': 0.0020353365151271354, 'batch_size': 32, 'dropout_rate': 0.42528915969420383, 'prior_mu': 0.030236184605813253, 'prior_sigma': 0.051688722537049536, 'normalization': 'none'}. Best is trial 1528 with value: 0.5170644640922546.
Generating morgan fingerprints...
Generated fingerprints with 2048 features for 900 molecules
Data shape: X=(900, 2048), y=(900,)
Trial 1547: 5-fold CV loss = 0.5659
[I 2025-08-08 00:52:37,132] Trial 1547 finished with value: 0.5658597111701965 and parameters: {'fp_type': 'morgan', 'morgan_only_radius': 2, 'morgan_only_nBits': 2048, 'num_hidden_layers': 3, 'hidden_dim_0': 512, 'hidden_dim_1': 128, 'hidden_dim_2': 512, 'kl_weight': 0.0005373023264666043, 'lr': 0.001985391954991153, 'batch_size': 32, 'dropout_rate': 0.4495857467286321, 'prior_mu': 0.029802890521698176, 'prior_sigma': 0.04663929884928368, 'normalization': 'none'}. Best is trial 1528 with value: 0.5170644640922546.
Generating morgan fingerprints...
Generated fingerprints with 2048 features for 900 molecules
Data shape: X=(900, 2048), y=(900,)
Trial 1548: 5-fold CV loss = 0.5264
[I 2025-08-08 00:52:56,017] Trial 1548 finished with value: 0.5263589739799499 and parameters: {'fp_type': 'morgan', 'morgan_only_radius': 2, 'morgan_only_nBits': 2048, 'num_hidden_layers': 3, 'hidden_dim_0': 512, 'hidden_dim_1': 128, 'hidden_dim_2': 512, 'kl_weight': 0.0005123641868000616, 'lr': 0.0023009004935931744, 'batch_size': 32, 'dropout_rate': 0.45090851182247266, 'prior_mu': 0.058106793309256416, 'prior_sigma': 0.060787830741690516, 'normalization': 'none'}. Best is trial 1528 with value: 0.5170644640922546.
Generating morgan fingerprints...
Generated fingerprints with 2048 features for 900 molecules
Data shape: X=(900, 2048), y=(900,)
Trial 1550: 5-fold CV loss = 0.6649
[I 2025-08-08 00:53:31,528] Trial 1550 finished with value: 0.6649375796318054 and parameters: {'fp_type': 'morgan', 'morgan_only_radius': 2, 'morgan_only_nBits': 2048, 'num_hidden_layers': 3, 'hidden_dim_0': 512, 'hidden_dim_1': 128, 'hidden_dim_2': 512, 'kl_weight': 0.0007764885045523041, 'lr': 0.002174823665235965, 'batch_size': 32, 'dropout_rate': 0.4533616303946239, 'prior_mu': 0.05673572403197537, 'prior_sigma': 0.17238363313101704, 'normalization': 'layer'}. Best is trial 1528 with value: 0.5170644640922546.
Generating morgan fingerprints...
Generated fingerprints with 2048 features for 900 molecules
Data shape: X=(900, 2048), y=(900,)
Trial 1549: 5-fold CV loss = 0.5249
[I 2025-08-08 00:53:37,508] Trial 1549 finished with value: 0.5249038577079773 and parameters: {'fp_type': 'morgan', 'morgan_only_radius': 2, 'morgan_only_nBits': 2048, 'num_hidden_layers': 3, 'hidden_dim_0': 512, 'hidden_dim_1': 128, 'hidden_dim_2': 512, 'kl_weight': 0.0005125096039367405, 'lr': 0.0022859079348911846, 'batch_size': 32, 'dropout_rate': 0.45259054621775197, 'prior_mu': 0.043216386190093804, 'prior_sigma': 0.06252394282278452, 'normalization': 'none'}. Best is trial 1528 with value: 0.5170644640922546.
Generating morgan fingerprints...
Generated fingerprints with 2048 features for 900 molecules
Data shape: X=(900, 2048), y=(900,)
Trial 1551: 5-fold CV loss = 0.6964
[I 2025-08-08 00:53:40,200] Trial 1551 finished with value: 0.6963579773902893 and parameters: {'fp_type': 'morgan', 'morgan_only_radius': 2, 'morgan_only_nBits': 2048, 'num_hidden_layers': 3, 'hidden_dim_0': 512, 'hidden_dim_1': 128, 'hidden_dim_2': 512, 'kl_weight': 0.0007913274065916116, 'lr': 0.0013419306459137837, 'batch_size': 32, 'dropout_rate': 0.425762134947891, 'prior_mu': 0.04047359639729239, 'prior_sigma': 0.06258602497041661, 'normalization': 'none'}. Best is trial 1528 with value: 0.5170644640922546.
Generating morgan fingerprints...
Generated fingerprints with 2048 features for 900 molecules
Data shape: X=(900, 2048), y=(900,)
Trial 1552: 5-fold CV loss = 0.6973
[I 2025-08-08 00:53:42,462] Trial 1552 finished with value: 0.6973159432411193 and parameters: {'fp_type': 'morgan', 'morgan_only_radius': 2, 'morgan_only_nBits': 2048, 'num_hidden_layers': 3, 'hidden_dim_0': 512, 'hidden_dim_1': 128, 'hidden_dim_2': 512, 'kl_weight': 0.00082190177410802, 'lr': 0.002304414234948575, 'batch_size': 128, 'dropout_rate': 0.42436956442423684, 'prior_mu': 0.04163114522532351, 'prior_sigma': 0.06390132340471802, 'normalization': 'none'}. Best is trial 1528 with value: 0.5170644640922546.
Generating morgan fingerprints...
Generated fingerprints with 2048 features for 900 molecules
Data shape: X=(900, 2048), y=(900,)
Trial 1554: 5-fold CV loss = 0.7718
[I 2025-08-08 00:53:49,322] Trial 1554 finished with value: 0.7718035936355591 and parameters: {'fp_type': 'morgan', 'morgan_only_radius': 3, 'morgan_only_nBits': 2048, 'num_hidden_layers': 3, 'hidden_dim_0': 512, 'hidden_dim_1': 128, 'hidden_dim_2': 512, 'kl_weight': 0.0006969412397523501, 'lr': 0.001862143971297676, 'batch_size': 128, 'dropout_rate': 0.4336898376151368, 'prior_mu': 0.058691152534230843, 'prior_sigma': 0.06308412410776486, 'normalization': 'none'}. Best is trial 1528 with value: 0.5170644640922546.
Generating morgan fingerprints...
Generated fingerprints with 2048 features for 900 molecules
Data shape: X=(900, 2048), y=(900,)
Trial 1556: 5-fold CV loss = 0.5825
[I 2025-08-08 00:54:56,960] Trial 1556 finished with value: 0.5825108408927917 and parameters: {'fp_type': 'morgan', 'morgan_only_radius': 2, 'morgan_only_nBits': 2048, 'num_hidden_layers': 3, 'hidden_dim_0': 512, 'hidden_dim_1': 128, 'hidden_dim_2': 64, 'kl_weight': 0.0006509211536176877, 'lr': 0.0018983226823283007, 'batch_size': 32, 'dropout_rate': 0.45143038282018844, 'prior_mu': 0.049129271345900234, 'prior_sigma': 0.05744781380466355, 'normalization': 'none'}. Best is trial 1528 with value: 0.5170644640922546.
Generating morgan fingerprints...
Generated fingerprints with 2048 features for 900 molecules
Data shape: X=(900, 2048), y=(900,)
Trial 1555: 5-fold CV loss = 0.5416
[I 2025-08-08 00:55:01,427] Trial 1555 finished with value: 0.5415665984153748 and parameters: {'fp_type': 'morgan', 'morgan_only_radius': 2, 'morgan_only_nBits': 2048, 'num_hidden_layers': 3, 'hidden_dim_0': 512, 'hidden_dim_1': 128, 'hidden_dim_2': 512, 'kl_weight': 0.000659260674224485, 'lr': 0.0018917901063834164, 'batch_size': 32, 'dropout_rate': 0.4427671803844357, 'prior_mu': 0.04995598406346691, 'prior_sigma': 0.0979394855547702, 'normalization': 'none'}. Best is trial 1528 with value: 0.5170644640922546.
Generating morgan fingerprints...
Generated fingerprints with 2048 features for 900 molecules
Data shape: X=(900, 2048), y=(900,)
Trial 1546: 5-fold CV loss = 0.5227
[I 2025-08-08 00:55:09,277] Trial 1546 finished with value: 0.5227033495903015 and parameters: {'fp_type': 'morgan', 'morgan_only_radius': 2, 'morgan_only_nBits': 2048, 'num_hidden_layers': 3, 'hidden_dim_0': 512, 'hidden_dim_1': 128, 'hidden_dim_2': 512, 'kl_weight': 0.0007731511036356855, 'lr': 0.0022874092432867963, 'batch_size': 32, 'dropout_rate': 0.44943994894320727, 'prior_mu': 0.030994830036090337, 'prior_sigma': 0.06227554722816567, 'normalization': 'none'}. Best is trial 1528 with value: 0.5170644640922546.
Generating morgan fingerprints...
Generated fingerprints with 2048 features for 900 molecules
Data shape: X=(900, 2048), y=(900,)
Trial 1553: 5-fold CV loss = 0.6973
[I 2025-08-08 00:55:45,559] Trial 1553 finished with value: 0.6972699463367462 and parameters: {'fp_type': 'morgan', 'morgan_only_radius': 3, 'morgan_only_nBits': 2048, 'num_hidden_layers': 3, 'hidden_dim_0': 512, 'hidden_dim_1': 128, 'hidden_dim_2': 512, 'kl_weight': 0.0006987938476460204, 'lr': 0.0012608585261808295, 'batch_size': 32, 'dropout_rate': 0.417519368631976, 'prior_mu': 0.04291032767405852, 'prior_sigma': 0.06272656844172703, 'normalization': 'none'}. Best is trial 1528 with value: 0.5170644640922546.
Generating morgan fingerprints...
Generated fingerprints with 2048 features for 900 molecules
Data shape: X=(900, 2048), y=(900,)
Trial 1558: 5-fold CV loss = 0.5803
[I 2025-08-08 00:55:53,361] Trial 1558 finished with value: 0.5802504360675812 and parameters: {'fp_type': 'morgan', 'morgan_only_radius': 2, 'morgan_only_nBits': 2048, 'num_hidden_layers': 3, 'hidden_dim_0': 512, 'hidden_dim_1': 128, 'hidden_dim_2': 1024, 'kl_weight': 0.000979301761611642, 'lr': 0.0021285394328663387, 'batch_size': 64, 'dropout_rate': 0.456184478649437, 'prior_mu': 0.0756688572582544, 'prior_sigma': 0.05669903107087909, 'normalization': 'none'}. Best is trial 1528 with value: 0.5170644640922546.
Generating morgan fingerprints...
Generated fingerprints with 2048 features for 900 molecules
Data shape: X=(900, 2048), y=(900,)
Trial 1557: 5-fold CV loss = 0.5241
[I 2025-08-08 00:56:16,732] Trial 1557 finished with value: 0.5241287410259247 and parameters: {'fp_type': 'morgan', 'morgan_only_radius': 2, 'morgan_only_nBits': 2048, 'num_hidden_layers': 3, 'hidden_dim_0': 512, 'hidden_dim_1': 128, 'hidden_dim_2': 512, 'kl_weight': 0.0004154076428880159, 'lr': 0.002351097045868665, 'batch_size': 32, 'dropout_rate': 0.43932599098702724, 'prior_mu': 0.05421368933421923, 'prior_sigma': 0.0561486916373976, 'normalization': 'none'}. Best is trial 1528 with value: 0.5170644640922546.
Generating morgan fingerprints...
Generated fingerprints with 2048 features for 900 molecules
Data shape: X=(900, 2048), y=(900,)
Trial 1560: 5-fold CV loss = 0.5644
[I 2025-08-08 00:56:49,513] Trial 1560 finished with value: 0.564448744058609 and parameters: {'fp_type': 'morgan', 'morgan_only_radius': 2, 'morgan_only_nBits': 2048, 'num_hidden_layers': 3, 'hidden_dim_0': 512, 'hidden_dim_1': 128, 'hidden_dim_2': 1024, 'kl_weight': 0.0009681728846910403, 'lr': 0.0024232742058134128, 'batch_size': 64, 'dropout_rate': 0.44000055749495537, 'prior_mu': 0.02253543549378348, 'prior_sigma': 0.056117896157759604, 'normalization': 'none'}. Best is trial 1528 with value: 0.5170644640922546.
Generating morgan fingerprints...
Generated fingerprints with 2048 features for 900 molecules
Data shape: X=(900, 2048), y=(900,)
Trial 1561: 5-fold CV loss = 0.5299
[I 2025-08-08 00:57:01,171] Trial 1561 finished with value: 0.5299198567867279 and parameters: {'fp_type': 'morgan', 'morgan_only_radius': 2, 'morgan_only_nBits': 2048, 'num_hidden_layers': 3, 'hidden_dim_0': 512, 'hidden_dim_1': 128, 'hidden_dim_2': 512, 'kl_weight': 0.000412359861729986, 'lr': 0.0023682753671479943, 'batch_size': 32, 'dropout_rate': 0.43020466778365085, 'prior_mu': 0.025340928036312976, 'prior_sigma': 0.05628823468104716, 'normalization': 'none'}. Best is trial 1528 with value: 0.5170644640922546.
Generating morgan fingerprints...
Generated fingerprints with 2048 features for 900 molecules
Data shape: X=(900, 2048), y=(900,)
Trial 1559: 5-fold CV loss = 0.5859
[I 2025-08-08 00:57:04,817] Trial 1559 finished with value: 0.585884553194046 and parameters: {'fp_type': 'morgan', 'morgan_only_radius': 2, 'morgan_only_nBits': 2048, 'num_hidden_layers': 3, 'hidden_dim_0': 512, 'hidden_dim_1': 128, 'hidden_dim_2': 1024, 'kl_weight': 0.0004574847218174836, 'lr': 0.0024606710822311028, 'batch_size': 64, 'dropout_rate': 0.43756637879363675, 'prior_mu': 0.025915131933232447, 'prior_sigma': 0.05760619493786616, 'normalization': 'none'}. Best is trial 1528 with value: 0.5170644640922546.
Generating morgan fingerprints...
Generated fingerprints with 2048 features for 900 molecules
Data shape: X=(900, 2048), y=(900,)
Trial 1562: 5-fold CV loss = 0.5365
[I 2025-08-08 00:57:39,594] Trial 1562 finished with value: 0.5364608764648438 and parameters: {'fp_type': 'morgan', 'morgan_only_radius': 2, 'morgan_only_nBits': 2048, 'num_hidden_layers': 3, 'hidden_dim_0': 512, 'hidden_dim_1': 128, 'hidden_dim_2': 512, 'kl_weight': 0.000590174276129141, 'lr': 0.0023886355916777962, 'batch_size': 32, 'dropout_rate': 0.4349745669193353, 'prior_mu': 0.025276250888060202, 'prior_sigma': 0.04958448573984815, 'normalization': 'none'}. Best is trial 1528 with value: 0.5170644640922546.
Generating morgan fingerprints...
Generated fingerprints with 2048 features for 900 molecules
Data shape: X=(900, 2048), y=(900,)
Trial 1564: 5-fold CV loss = 0.5328
[I 2025-08-08 00:58:04,575] Trial 1564 finished with value: 0.5328311741352081 and parameters: {'fp_type': 'morgan', 'morgan_only_radius': 2, 'morgan_only_nBits': 2048, 'num_hidden_layers': 3, 'hidden_dim_0': 512, 'hidden_dim_1': 128, 'hidden_dim_2': 512, 'kl_weight': 0.00062147319759098, 'lr': 0.002423526428510092, 'batch_size': 32, 'dropout_rate': 0.4498994308642839, 'prior_mu': 0.03633559244745106, 'prior_sigma': 0.0509565590652846, 'normalization': 'none'}. Best is trial 1528 with value: 0.5170644640922546.
Generating morgan fingerprints...
Generated fingerprints with 2048 features for 900 molecules
Data shape: X=(900, 2048), y=(900,)
Trial 1563: 5-fold CV loss = 0.5209
[I 2025-08-08 00:58:40,602] Trial 1563 finished with value: 0.5209422469139099 and parameters: {'fp_type': 'morgan', 'morgan_only_radius': 2, 'morgan_only_nBits': 2048, 'num_hidden_layers': 3, 'hidden_dim_0': 512, 'hidden_dim_1': 128, 'hidden_dim_2': 512, 'kl_weight': 0.0005367164532976603, 'lr': 0.0024274988119996673, 'batch_size': 32, 'dropout_rate': 0.4342454561406029, 'prior_mu': 0.028156309637525377, 'prior_sigma': 0.06009146957057023, 'normalization': 'none'}. Best is trial 1528 with value: 0.5170644640922546.
Generating morgan fingerprints...
Generated fingerprints with 2048 features for 900 molecules
Data shape: X=(900, 2048), y=(900,)
Trial 1567: 5-fold CV loss = 0.5747
[I 2025-08-08 00:59:10,302] Trial 1567 finished with value: 0.5746626019477844 and parameters: {'fp_type': 'morgan', 'morgan_only_radius': 2, 'morgan_only_nBits': 2048, 'num_hidden_layers': 3, 'hidden_dim_0': 512, 'hidden_dim_1': 512, 'hidden_dim_2': 512, 'kl_weight': 0.000925830400557528, 'lr': 0.0021927022077501248, 'batch_size': 32, 'dropout_rate': 0.3951685542467149, 'prior_mu': 0.026733772460822536, 'prior_sigma': 0.06036516667186421, 'normalization': 'none'}. Best is trial 1528 with value: 0.5170644640922546.
Generating morgan fingerprints...
Generated fingerprints with 2048 features for 900 molecules
Data shape: X=(900, 2048), y=(900,)
Trial 1566: 5-fold CV loss = 0.5406
[I 2025-08-08 00:59:24,578] Trial 1566 finished with value: 0.5406024754047394 and parameters: {'fp_type': 'morgan', 'morgan_only_radius': 2, 'morgan_only_nBits': 2048, 'num_hidden_layers': 3, 'hidden_dim_0': 256, 'hidden_dim_1': 128, 'hidden_dim_2': 512, 'kl_weight': 0.0008950304338302125, 'lr': 0.002224015134577121, 'batch_size': 32, 'dropout_rate': 0.45128105909555644, 'prior_mu': 0.02933080392674387, 'prior_sigma': 0.05976808098907253, 'normalization': 'none'}. Best is trial 1528 with value: 0.5170644640922546.
Generating morgan fingerprints...
Generated fingerprints with 2048 features for 900 molecules
Data shape: X=(900, 2048), y=(900,)
Trial 1569: 5-fold CV loss = 0.5406
[I 2025-08-08 01:00:06,450] Trial 1569 finished with value: 0.5406327486038208 and parameters: {'fp_type': 'morgan', 'morgan_only_radius': 2, 'morgan_only_nBits': 2048, 'num_hidden_layers': 3, 'hidden_dim_0': 512, 'hidden_dim_1': 128, 'hidden_dim_2': 512, 'kl_weight': 0.0004505511979891397, 'lr': 0.002497959924634021, 'batch_size': 32, 'dropout_rate': 0.42667436346737037, 'prior_mu': 0.027561620415470924, 'prior_sigma': 0.05462461746468232, 'normalization': 'none'}. Best is trial 1528 with value: 0.5170644640922546.
Generating morgan fingerprints...
Generated fingerprints with 2048 features for 900 molecules
Data shape: X=(900, 2048), y=(900,)
Trial 1570: 5-fold CV loss = 0.5446
[I 2025-08-08 01:00:16,934] Trial 1570 finished with value: 0.5446336805820465 and parameters: {'fp_type': 'morgan', 'morgan_only_radius': 2, 'morgan_only_nBits': 2048, 'num_hidden_layers': 3, 'hidden_dim_0': 512, 'hidden_dim_1': 128, 'hidden_dim_2': 512, 'kl_weight': 0.0004889557201540758, 'lr': 0.0025347851639801514, 'batch_size': 32, 'dropout_rate': 0.4155300205342873, 'prior_mu': 0.03276528907927516, 'prior_sigma': 0.05425185595183291, 'normalization': 'layer'}. Best is trial 1528 with value: 0.5170644640922546.
Generating morgan fingerprints...
Generated fingerprints with 2048 features for 900 molecules
Data shape: X=(900, 2048), y=(900,)
Trial 1571: 5-fold CV loss = 0.5417
[I 2025-08-08 01:00:45,103] Trial 1571 finished with value: 0.5417145013809204 and parameters: {'fp_type': 'morgan', 'morgan_only_radius': 2, 'morgan_only_nBits': 2048, 'num_hidden_layers': 3, 'hidden_dim_0': 512, 'hidden_dim_1': 128, 'hidden_dim_2': 512, 'kl_weight': 0.0005372806597933031, 'lr': 0.0025297142169195645, 'batch_size': 32, 'dropout_rate': 0.43370361394880164, 'prior_mu': 0.034032903144311843, 'prior_sigma': 0.045179709877921165, 'normalization': 'layer'}. Best is trial 1528 with value: 0.5170644640922546.
Generating morgan fingerprints...
Generated fingerprints with 2048 features for 900 molecules
Data shape: X=(900, 2048), y=(900,)
Trial 1565: 5-fold CV loss = 0.5527
[I 2025-08-08 01:00:52,812] Trial 1565 finished with value: 0.5527380466461181 and parameters: {'fp_type': 'morgan', 'morgan_only_radius': 2, 'morgan_only_nBits': 2048, 'num_hidden_layers': 3, 'hidden_dim_0': 256, 'hidden_dim_1': 128, 'hidden_dim_2': 512, 'kl_weight': 0.0008772048896411584, 'lr': 0.0023521365595524416, 'batch_size': 32, 'dropout_rate': 0.4495124201885205, 'prior_mu': 0.03081481571939442, 'prior_sigma': 0.04915352754108618, 'normalization': 'none'}. Best is trial 1528 with value: 0.5170644640922546.
Generating morgan fingerprints...
Generated fingerprints with 2048 features for 900 molecules
Data shape: X=(900, 2048), y=(900,)
Trial 1573: 5-fold CV loss = 0.6561
[I 2025-08-08 01:01:16,348] Trial 1573 finished with value: 0.6560794115066528 and parameters: {'fp_type': 'morgan', 'morgan_only_radius': 2, 'morgan_only_nBits': 2048, 'num_hidden_layers': 3, 'hidden_dim_0': 512, 'hidden_dim_1': 128, 'hidden_dim_2': 512, 'kl_weight': 0.0005679425407452058, 'lr': 0.00016957758715831626, 'batch_size': 32, 'dropout_rate': 0.4068922034087032, 'prior_mu': 0.03327055657124557, 'prior_sigma': 0.050954865453876584, 'normalization': 'none'}. Best is trial 1528 with value: 0.5170644640922546.
Generating morgan fingerprints...
Generated fingerprints with 2048 features for 900 molecules
Data shape: X=(900, 2048), y=(900,)
Trial 1572: 5-fold CV loss = 0.5357
