[I 2025-08-07 22:23:09,543] Trial 1132 finished with value: 0.6144686937332153 and parameters: {'fp_type': 'morgan', 'morgan_only_radius': 2, 'morgan_only_nBits': 2048, 'num_hidden_layers': 3, 'hidden_dim_0': 512, 'hidden_dim_1': 128, 'hidden_dim_2': 128, 'kl_weight': 0.0010613770724004577, 'lr': 0.0026100517795463823, 'batch_size': 32, 'dropout_rate': 0.4827739411871958, 'prior_mu': -0.003622702559432739, 'prior_sigma': 0.06088879373606205, 'normalization': 'none'}. Best is trial 272 with value: 0.5198344707489013.
Generating morgan fingerprints...
Generated fingerprints with 2048 features for 900 molecules
Data shape: X=(900, 2048), y=(900,)
Trial 1130: 5-fold CV loss = 0.5275
[I 2025-08-07 22:23:10,653] Trial 1130 finished with value: 0.5275471270084381 and parameters: {'fp_type': 'morgan', 'morgan_only_radius': 2, 'morgan_only_nBits': 2048, 'num_hidden_layers': 3, 'hidden_dim_0': 512, 'hidden_dim_1': 128, 'hidden_dim_2': 512, 'kl_weight': 0.001047984672691301, 'lr': 0.002398873024473906, 'batch_size': 32, 'dropout_rate': 0.4910775601629769, 'prior_mu': -0.0052944198004961016, 'prior_sigma': 0.0581638897496535, 'normalization': 'none'}. Best is trial 272 with value: 0.5198344707489013.
Generating morgan fingerprints...
Generated fingerprints with 2048 features for 900 molecules
Data shape: X=(900, 2048), y=(900,)
Trial 1133: 5-fold CV loss = 0.5296
[I 2025-08-07 22:23:44,895] Trial 1133 finished with value: 0.5295518398284912 and parameters: {'fp_type': 'morgan', 'morgan_only_radius': 2, 'morgan_only_nBits': 2048, 'num_hidden_layers': 3, 'hidden_dim_0': 512, 'hidden_dim_1': 128, 'hidden_dim_2': 128, 'kl_weight': 0.0009687464660038132, 'lr': 0.003042564554855474, 'batch_size': 32, 'dropout_rate': 0.4999664050458248, 'prior_mu': -0.005637275525022321, 'prior_sigma': 0.06172667086053243, 'normalization': 'none'}. Best is trial 272 with value: 0.5198344707489013.
Generating morgan fingerprints...
Generated fingerprints with 2048 features for 900 molecules
Data shape: X=(900, 2048), y=(900,)
Trial 1135: 5-fold CV loss = 0.5324
[I 2025-08-07 22:24:06,448] Trial 1135 finished with value: 0.5323758959770203 and parameters: {'fp_type': 'morgan', 'morgan_only_radius': 3, 'morgan_only_nBits': 2048, 'num_hidden_layers': 3, 'hidden_dim_0': 512, 'hidden_dim_1': 128, 'hidden_dim_2': 512, 'kl_weight': 0.0009380989018816941, 'lr': 0.0024078181817148705, 'batch_size': 32, 'dropout_rate': 0.4759551509491701, 'prior_mu': -0.001831418480706469, 'prior_sigma': 0.05282433754678889, 'normalization': 'none'}. Best is trial 272 with value: 0.5198344707489013.
Generating morgan fingerprints...
Generated fingerprints with 2048 features for 900 molecules
Data shape: X=(900, 2048), y=(900,)
Trial 1136: 5-fold CV loss = 0.5344
[I 2025-08-07 22:24:47,907] Trial 1136 finished with value: 0.5343615233898162 and parameters: {'fp_type': 'morgan', 'morgan_only_radius': 3, 'morgan_only_nBits': 2048, 'num_hidden_layers': 3, 'hidden_dim_0': 512, 'hidden_dim_1': 128, 'hidden_dim_2': 512, 'kl_weight': 0.0013040513432804651, 'lr': 0.0024714475708799526, 'batch_size': 32, 'dropout_rate': 0.4763471119131646, 'prior_mu': -0.0024494046510119523, 'prior_sigma': 0.05287681407336091, 'normalization': 'none'}. Best is trial 272 with value: 0.5198344707489013.
Generating morgan fingerprints...
Generated fingerprints with 2048 features for 900 molecules
Data shape: X=(900, 2048), y=(900,)
Trial 1137: 5-fold CV loss = 0.5326
[I 2025-08-07 22:24:55,533] Trial 1137 finished with value: 0.5325924158096313 and parameters: {'fp_type': 'morgan', 'morgan_only_radius': 3, 'morgan_only_nBits': 2048, 'num_hidden_layers': 3, 'hidden_dim_0': 512, 'hidden_dim_1': 128, 'hidden_dim_2': 512, 'kl_weight': 0.0008551306753213783, 'lr': 0.002423231312614475, 'batch_size': 32, 'dropout_rate': 0.4999671307309349, 'prior_mu': -0.002222854295424098, 'prior_sigma': 0.05545438949513344, 'normalization': 'none'}. Best is trial 272 with value: 0.5198344707489013.
Generating morgan fingerprints...
Generated fingerprints with 2048 features for 900 molecules
Data shape: X=(900, 2048), y=(900,)
Trial 1138: 5-fold CV loss = 0.5310
[I 2025-08-07 22:25:11,859] Trial 1138 finished with value: 0.5310356020927429 and parameters: {'fp_type': 'morgan', 'morgan_only_radius': 2, 'morgan_only_nBits': 2048, 'num_hidden_layers': 3, 'hidden_dim_0': 512, 'hidden_dim_1': 128, 'hidden_dim_2': 512, 'kl_weight': 0.0013653269845497825, 'lr': 0.0026903339323631013, 'batch_size': 32, 'dropout_rate': 0.4998384829890088, 'prior_mu': -0.0130315814719397, 'prior_sigma': 0.0632370588884059, 'normalization': 'none'}. Best is trial 272 with value: 0.5198344707489013.
Generating morgan fingerprints...
Generated fingerprints with 2048 features for 900 molecules
Data shape: X=(900, 2048), y=(900,)
Trial 1140: 5-fold CV loss = 0.5688
[I 2025-08-07 22:26:00,394] Trial 1140 finished with value: 0.5688104510307312 and parameters: {'fp_type': 'morgan', 'morgan_only_radius': 2, 'morgan_only_nBits': 2048, 'num_hidden_layers': 3, 'hidden_dim_0': 1024, 'hidden_dim_1': 128, 'hidden_dim_2': 512, 'kl_weight': 0.0012141112733347367, 'lr': 0.002748969233788615, 'batch_size': 32, 'dropout_rate': 0.482716188250456, 'prior_mu': -0.017160209245265373, 'prior_sigma': 0.12148959282979072, 'normalization': 'none'}. Best is trial 272 with value: 0.5198344707489013.
Generating morgan fingerprints...
Generated fingerprints with 2048 features for 900 molecules
Data shape: X=(900, 2048), y=(900,)
Trial 1134: 5-fold CV loss = 0.5823
[I 2025-08-07 22:26:05,058] Trial 1134 finished with value: 0.5822516560554505 and parameters: {'fp_type': 'morgan', 'morgan_only_radius': 3, 'morgan_only_nBits': 2048, 'num_hidden_layers': 3, 'hidden_dim_0': 1024, 'hidden_dim_1': 128, 'hidden_dim_2': 128, 'kl_weight': 0.0009574070102427313, 'lr': 0.0024011174393642567, 'batch_size': 32, 'dropout_rate': 0.47689182236401767, 'prior_mu': -0.0020057619557034313, 'prior_sigma': 0.022053865079145377, 'normalization': 'none'}. Best is trial 272 with value: 0.5198344707489013.
Generating morgan fingerprints...
Generated fingerprints with 2048 features for 900 molecules
Data shape: X=(900, 2048), y=(900,)
Trial 1141: 5-fold CV loss = 0.5315
[I 2025-08-07 22:26:07,884] Trial 1141 finished with value: 0.5315276443958282 and parameters: {'fp_type': 'morgan', 'morgan_only_radius': 2, 'morgan_only_nBits': 2048, 'num_hidden_layers': 3, 'hidden_dim_0': 512, 'hidden_dim_1': 128, 'hidden_dim_2': 512, 'kl_weight': 0.0011821677526872377, 'lr': 0.0032669077635775726, 'batch_size': 32, 'dropout_rate': 0.4830848764181818, 'prior_mu': -0.018108746174802674, 'prior_sigma': 0.06432971481814667, 'normalization': 'none'}. Best is trial 272 with value: 0.5198344707489013.
Generating morgan fingerprints...
Generated fingerprints with 2048 features for 900 molecules
Data shape: X=(900, 2048), y=(900,)
Trial 1139: 5-fold CV loss = 0.5330
[I 2025-08-07 22:26:37,503] Trial 1139 finished with value: 0.5329502046108245 and parameters: {'fp_type': 'morgan', 'morgan_only_radius': 2, 'morgan_only_nBits': 2048, 'num_hidden_layers': 3, 'hidden_dim_0': 1024, 'hidden_dim_1': 128, 'hidden_dim_2': 512, 'kl_weight': 0.0008519680152281079, 'lr': 0.0022434886171531342, 'batch_size': 32, 'dropout_rate': 0.4814105323464088, 'prior_mu': -0.013404366660221554, 'prior_sigma': 0.06198211976130909, 'normalization': 'none'}. Best is trial 272 with value: 0.5198344707489013.
Generating morgan fingerprints...
Generated fingerprints with 2048 features for 900 molecules
Data shape: X=(900, 2048), y=(900,)
Trial 1142: 5-fold CV loss = 0.5347
[I 2025-08-07 22:26:58,867] Trial 1142 finished with value: 0.5347150921821594 and parameters: {'fp_type': 'morgan', 'morgan_only_radius': 2, 'morgan_only_nBits': 2048, 'num_hidden_layers': 3, 'hidden_dim_0': 512, 'hidden_dim_1': 128, 'hidden_dim_2': 512, 'kl_weight': 0.0012087440713998, 'lr': 0.0033534094406122983, 'batch_size': 32, 'dropout_rate': 0.4759201781667793, 'prior_mu': -0.014727883673794795, 'prior_sigma': 0.0643406793312465, 'normalization': 'none'}. Best is trial 272 with value: 0.5198344707489013.
Generating morgan fingerprints...
Generated fingerprints with 2048 features for 900 molecules
Data shape: X=(900, 2048), y=(900,)
Trial 1144: 5-fold CV loss = 0.5267
[I 2025-08-07 22:27:24,400] Trial 1144 finished with value: 0.5266988396644592 and parameters: {'fp_type': 'morgan', 'morgan_only_radius': 2, 'morgan_only_nBits': 2048, 'num_hidden_layers': 3, 'hidden_dim_0': 512, 'hidden_dim_1': 128, 'hidden_dim_2': 512, 'kl_weight': 0.0007616497271653006, 'lr': 0.002222477228128103, 'batch_size': 32, 'dropout_rate': 0.4917476936416779, 'prior_mu': -0.012071507347082537, 'prior_sigma': 0.06107879244520442, 'normalization': 'none'}. Best is trial 272 with value: 0.5198344707489013.
Generating morgan fingerprints...
Generated fingerprints with 2048 features for 900 molecules
Data shape: X=(900, 2048), y=(900,)
Trial 1146: 5-fold CV loss = 0.5648
[I 2025-08-07 22:28:04,671] Trial 1146 finished with value: 0.5648193478584289 and parameters: {'fp_type': 'morgan', 'morgan_only_radius': 2, 'morgan_only_nBits': 2048, 'num_hidden_layers': 3, 'hidden_dim_0': 512, 'hidden_dim_1': 128, 'hidden_dim_2': 64, 'kl_weight': 0.0012896322862168768, 'lr': 0.002195919622042859, 'batch_size': 32, 'dropout_rate': 0.49084374003508136, 'prior_mu': 0.010778641007366275, 'prior_sigma': 0.057997781420327923, 'normalization': 'none'}. Best is trial 272 with value: 0.5198344707489013.
Generating morgan fingerprints...
Generated fingerprints with 2048 features for 900 molecules
Data shape: X=(900, 2048), y=(900,)
Trial 1145: 5-fold CV loss = 0.5505
[I 2025-08-07 22:28:28,511] Trial 1145 finished with value: 0.5504999756813049 and parameters: {'fp_type': 'morgan', 'morgan_only_radius': 2, 'morgan_only_nBits': 2048, 'num_hidden_layers': 3, 'hidden_dim_0': 512, 'hidden_dim_1': 128, 'hidden_dim_2': 512, 'kl_weight': 0.0012600570798002992, 'lr': 0.002190655024587341, 'batch_size': 32, 'dropout_rate': 0.302553161466595, 'prior_mu': 0.0054656679650293616, 'prior_sigma': 0.06540894024039329, 'normalization': 'none'}. Best is trial 272 with value: 0.5198344707489013.
Generating morgan fingerprints...
Generated fingerprints with 2048 features for 900 molecules
Data shape: X=(900, 2048), y=(900,)
Trial 1148: 5-fold CV loss = 0.6943
[I 2025-08-07 22:28:29,559] Trial 1148 finished with value: 0.6942968845367432 and parameters: {'fp_type': 'morgan', 'morgan_only_radius': 2, 'morgan_only_nBits': 2048, 'num_hidden_layers': 2, 'hidden_dim_0': 512, 'hidden_dim_1': 128, 'kl_weight': 0.001126632382027296, 'lr': 0.0026329627676650214, 'batch_size': 32, 'dropout_rate': 0.2753402454385956, 'prior_mu': 0.0034102434995073906, 'prior_sigma': 0.04744060017893413, 'normalization': 'none'}. Best is trial 272 with value: 0.5198344707489013.
Generating morgan fingerprints...
Generated fingerprints with 2048 features for 900 molecules
Data shape: X=(900, 2048), y=(900,)
Trial 1147: 5-fold CV loss = 0.6105
[I 2025-08-07 22:28:37,149] Trial 1147 finished with value: 0.6104764103889465 and parameters: {'fp_type': 'morgan', 'morgan_only_radius': 2, 'morgan_only_nBits': 2048, 'num_hidden_layers': 3, 'hidden_dim_0': 512, 'hidden_dim_1': 128, 'hidden_dim_2': 64, 'kl_weight': 0.0012982079825170293, 'lr': 0.0022020761097055965, 'batch_size': 32, 'dropout_rate': 0.22895045788226442, 'prior_mu': 0.0018315552463036456, 'prior_sigma': 0.047840172158305605, 'normalization': 'none'}. Best is trial 272 with value: 0.5198344707489013.
Generating morgan fingerprints...
Generated fingerprints with 2048 features for 900 molecules
Data shape: X=(900, 2048), y=(900,)
Trial 1151: 5-fold CV loss = 0.5403
[I 2025-08-07 22:29:25,720] Trial 1151 finished with value: 0.5403306603431701 and parameters: {'fp_type': 'morgan', 'morgan_only_radius': 2, 'morgan_only_nBits': 2048, 'num_hidden_layers': 3, 'hidden_dim_0': 512, 'hidden_dim_1': 128, 'hidden_dim_2': 512, 'kl_weight': 0.0014343447004216295, 'lr': 0.002874951761967328, 'batch_size': 32, 'dropout_rate': 0.4997533308635989, 'prior_mu': 0.016787552419899876, 'prior_sigma': 0.06659941153955642, 'normalization': 'layer'}. Best is trial 272 with value: 0.5198344707489013.
Generating morgan fingerprints...
Generated fingerprints with 2048 features for 900 molecules
Data shape: X=(900, 2048), y=(900,)
Trial 1150: 5-fold CV loss = 0.5458
[I 2025-08-07 22:29:32,008] Trial 1150 finished with value: 0.54579838514328 and parameters: {'fp_type': 'morgan', 'morgan_only_radius': 2, 'morgan_only_nBits': 2048, 'num_hidden_layers': 3, 'hidden_dim_0': 512, 'hidden_dim_1': 128, 'hidden_dim_2': 512, 'kl_weight': 0.0014387624882514886, 'lr': 0.0025233980766039194, 'batch_size': 32, 'dropout_rate': 0.47066817003307637, 'prior_mu': 0.015581028679846178, 'prior_sigma': 0.06756439318814439, 'normalization': 'layer'}. Best is trial 272 with value: 0.5198344707489013.
Generating morgan fingerprints...
Generated fingerprints with 2048 features for 900 molecules
Data shape: X=(900, 2048), y=(900,)
Trial 1149: 5-fold CV loss = 0.5303
[I 2025-08-07 22:30:08,685] Trial 1149 finished with value: 0.5303261578083038 and parameters: {'fp_type': 'morgan', 'morgan_only_radius': 2, 'morgan_only_nBits': 2048, 'num_hidden_layers': 3, 'hidden_dim_0': 512, 'hidden_dim_1': 128, 'hidden_dim_2': 512, 'kl_weight': 0.001078223429424441, 'lr': 0.002565533569138004, 'batch_size': 32, 'dropout_rate': 0.47272806724972044, 'prior_mu': 0.002491232039212643, 'prior_sigma': 0.06623464350170451, 'normalization': 'none'}. Best is trial 272 with value: 0.5198344707489013.
Generating morgan fingerprints...
Generated fingerprints with 2048 features for 900 molecules
Data shape: X=(900, 2048), y=(900,)
Trial 1143: 5-fold CV loss = 0.5232
[I 2025-08-07 22:30:20,232] Trial 1143 finished with value: 0.5232498526573182 and parameters: {'fp_type': 'morgan', 'morgan_only_radius': 2, 'morgan_only_nBits': 2048, 'num_hidden_layers': 3, 'hidden_dim_0': 512, 'hidden_dim_1': 128, 'hidden_dim_2': 512, 'kl_weight': 0.0007640873102535837, 'lr': 0.0021590100657551785, 'batch_size': 32, 'dropout_rate': 0.48515091527837956, 'prior_mu': -0.01404324916772531, 'prior_sigma': 0.06442177871285906, 'normalization': 'none'}. Best is trial 272 with value: 0.5198344707489013.
Generating morgan fingerprints...
Generated fingerprints with 2048 features for 900 molecules
Data shape: X=(900, 2048), y=(900,)
Trial 1154: 5-fold CV loss = 0.7402
[I 2025-08-07 22:30:21,925] Trial 1154 finished with value: 0.7401708602905274 and parameters: {'fp_type': 'morgan', 'morgan_only_radius': 2, 'morgan_only_nBits': 2048, 'num_hidden_layers': 3, 'hidden_dim_0': 512, 'hidden_dim_1': 128, 'hidden_dim_2': 512, 'kl_weight': 0.00011629701317083182, 'lr': 0.0023217658342578173, 'batch_size': 128, 'dropout_rate': 0.490222390456279, 'prior_mu': -0.00980437196423681, 'prior_sigma': 0.05749124392733302, 'normalization': 'none'}. Best is trial 272 with value: 0.5198344707489013.
Generating morgan fingerprints...
Generated fingerprints with 2048 features for 900 molecules
Data shape: X=(900, 2048), y=(900,)
Trial 1152: 5-fold CV loss = 0.5265
[I 2025-08-07 22:30:39,067] Trial 1152 finished with value: 0.5265214443206787 and parameters: {'fp_type': 'morgan', 'morgan_only_radius': 2, 'morgan_only_nBits': 2048, 'num_hidden_layers': 3, 'hidden_dim_0': 512, 'hidden_dim_1': 128, 'hidden_dim_2': 512, 'kl_weight': 0.0010671684950535132, 'lr': 0.0025017396329971957, 'batch_size': 32, 'dropout_rate': 0.49995563005570876, 'prior_mu': -0.019296977405580618, 'prior_sigma': 0.05775441416394693, 'normalization': 'none'}. Best is trial 272 with value: 0.5198344707489013.
Generating morgan fingerprints...
Generated fingerprints with 2048 features for 900 molecules
Data shape: X=(900, 2048), y=(900,)
Trial 1153: 5-fold CV loss = 0.5304
[I 2025-08-07 22:30:45,160] Trial 1153 finished with value: 0.5304265439510345 and parameters: {'fp_type': 'morgan', 'morgan_only_radius': 2, 'morgan_only_nBits': 2048, 'num_hidden_layers': 3, 'hidden_dim_0': 512, 'hidden_dim_1': 128, 'hidden_dim_2': 1024, 'kl_weight': 0.0010692733985260903, 'lr': 0.002337516879166738, 'batch_size': 32, 'dropout_rate': 0.48538695185421304, 'prior_mu': 0.06647884083393799, 'prior_sigma': 0.05742953078593339, 'normalization': 'none'}. Best is trial 272 with value: 0.5198344707489013.
Generating morgan fingerprints...
Generated fingerprints with 2048 features for 900 molecules
Data shape: X=(900, 2048), y=(900,)
Trial 1157: 5-fold CV loss = 0.5289
[I 2025-08-07 22:31:49,776] Trial 1157 finished with value: 0.528920578956604 and parameters: {'fp_type': 'morgan', 'morgan_only_radius': 2, 'morgan_only_nBits': 2048, 'num_hidden_layers': 3, 'hidden_dim_0': 512, 'hidden_dim_1': 128, 'hidden_dim_2': 1024, 'kl_weight': 0.0006658115791490383, 'lr': 0.0020761440992513817, 'batch_size': 32, 'dropout_rate': 0.46661015433503683, 'prior_mu': -0.008310090271035249, 'prior_sigma': 0.06027459655903091, 'normalization': 'none'}. Best is trial 272 with value: 0.5198344707489013.
Generating morgan fingerprints...
Generated fingerprints with 2048 features for 900 molecules
Data shape: X=(900, 2048), y=(900,)
Trial 1155: 5-fold CV loss = 0.9059
[I 2025-08-07 22:31:50,523] Trial 1155 finished with value: 0.9059217810630799 and parameters: {'fp_type': 'morgan', 'morgan_only_radius': 2, 'morgan_only_nBits': 2048, 'num_hidden_layers': 3, 'hidden_dim_0': 512, 'hidden_dim_1': 128, 'hidden_dim_2': 1024, 'kl_weight': 0.0005434472693954845, 'lr': 0.00021669975071927493, 'batch_size': 32, 'dropout_rate': 0.46243350764201124, 'prior_mu': -0.008120193125820165, 'prior_sigma': 0.05588204390598643, 'normalization': 'none'}. Best is trial 272 with value: 0.5198344707489013.
Generating morgan fingerprints...
Generated fingerprints with 2048 features for 900 molecules
Data shape: X=(900, 2048), y=(900,)
Trial 1156: 5-fold CV loss = 0.5278
[I 2025-08-07 22:32:06,423] Trial 1156 finished with value: 0.5278076231479645 and parameters: {'fp_type': 'morgan', 'morgan_only_radius': 2, 'morgan_only_nBits': 2048, 'num_hidden_layers': 3, 'hidden_dim_0': 512, 'hidden_dim_1': 128, 'hidden_dim_2': 1024, 'kl_weight': 0.0009682851045806258, 'lr': 0.00207778935208513, 'batch_size': 32, 'dropout_rate': 0.46531156224924647, 'prior_mu': -0.007285770532891034, 'prior_sigma': 0.05975405616142872, 'normalization': 'none'}. Best is trial 272 with value: 0.5198344707489013.
Generating morgan fingerprints...
Generated fingerprints with 2048 features for 900 molecules
Data shape: X=(900, 2048), y=(900,)
Trial 1158: 5-fold CV loss = 0.5264
[I 2025-08-07 22:32:11,146] Trial 1158 finished with value: 0.5264037013053894 and parameters: {'fp_type': 'morgan', 'morgan_only_radius': 2, 'morgan_only_nBits': 2048, 'num_hidden_layers': 3, 'hidden_dim_0': 512, 'hidden_dim_1': 128, 'hidden_dim_2': 512, 'kl_weight': 0.0006334448291660786, 'lr': 0.0020482277570613495, 'batch_size': 32, 'dropout_rate': 0.46916333346447303, 'prior_mu': -0.010490214125701513, 'prior_sigma': 0.06098603274786321, 'normalization': 'none'}. Best is trial 272 with value: 0.5198344707489013.
Generating morgan fingerprints...
Generated fingerprints with 2048 features for 900 molecules
Data shape: X=(900, 2048), y=(900,)
Trial 1162: 5-fold CV loss = 0.6563
[I 2025-08-07 22:32:48,618] Trial 1162 finished with value: 0.6562846899032593 and parameters: {'fp_type': 'morgan', 'morgan_only_radius': 2, 'morgan_only_nBits': 2048, 'num_hidden_layers': 3, 'hidden_dim_0': 128, 'hidden_dim_1': 512, 'hidden_dim_2': 512, 'kl_weight': 0.00042392269226830667, 'lr': 0.0019380085559910609, 'batch_size': 64, 'dropout_rate': 0.475248459937524, 'prior_mu': -0.01832756575683912, 'prior_sigma': 0.1037705296235287, 'normalization': 'none'}. Best is trial 272 with value: 0.5198344707489013.
Generating rdkit fingerprints...
Generated fingerprints with 512 features for 900 molecules
Data shape: X=(900, 512), y=(900,)
Trial 1159: 5-fold CV loss = 0.5276
[I 2025-08-07 22:33:14,556] Trial 1159 finished with value: 0.5276477217674256 and parameters: {'fp_type': 'morgan', 'morgan_only_radius': 2, 'morgan_only_nBits': 2048, 'num_hidden_layers': 3, 'hidden_dim_0': 512, 'hidden_dim_1': 128, 'hidden_dim_2': 512, 'kl_weight': 0.0004951906152752408, 'lr': 0.002009925837978184, 'batch_size': 32, 'dropout_rate': 0.4678191159417956, 'prior_mu': -0.007696971080928695, 'prior_sigma': 0.061993386188251294, 'normalization': 'none'}. Best is trial 272 with value: 0.5198344707489013.
Generating rdkit fingerprints...
Generated fingerprints with 512 features for 900 molecules
Data shape: X=(900, 512), y=(900,)
Trial 1161: 5-fold CV loss = 0.8260
[I 2025-08-07 22:33:21,299] Trial 1161 finished with value: 0.8259825825691223 and parameters: {'fp_type': 'morgan', 'morgan_only_radius': 2, 'morgan_only_nBits': 2048, 'num_hidden_layers': 3, 'hidden_dim_0': 512, 'hidden_dim_1': 512, 'hidden_dim_2': 512, 'kl_weight': 0.006675777521793099, 'lr': 0.002007138386152321, 'batch_size': 32, 'dropout_rate': 0.47347283207305724, 'prior_mu': -0.015498757057371753, 'prior_sigma': 0.06823268345545772, 'normalization': 'none'}. Best is trial 272 with value: 0.5198344707489013.
Generating rdkit fingerprints...
Generated fingerprints with 512 features for 900 molecules
Data shape: X=(900, 512), y=(900,)
Trial 1163: 5-fold CV loss = 0.6448
[I 2025-08-07 22:33:32,574] Trial 1163 finished with value: 0.6447917342185974 and parameters: {'fp_type': 'rdkit', 'rdkit_only_maxPath': 7, 'rdkit_only_nBits': 512, 'num_hidden_layers': 3, 'hidden_dim_0': 512, 'hidden_dim_1': 128, 'hidden_dim_2': 256, 'kl_weight': 0.0006722347361945209, 'lr': 0.002170936444462766, 'batch_size': 32, 'dropout_rate': 0.48149005905447234, 'prior_mu': -0.017577818028042716, 'prior_sigma': 0.06830363349818726, 'normalization': 'none'}. Best is trial 272 with value: 0.5198344707489013.
Generating morgan fingerprints...
Generated fingerprints with 2048 features for 900 molecules
Data shape: X=(900, 2048), y=(900,)
Trial 1164: 5-fold CV loss = 0.6505
