[I 2025-08-08 04:53:13,805] Trial 2202 finished with value: 0.5887062907218933 and parameters: {'fp_type': 'morgan', 'morgan_only_radius': 2, 'morgan_only_nBits': 2048, 'num_hidden_layers': 3, 'hidden_dim_0': 64, 'hidden_dim_1': 64, 'hidden_dim_2': 256, 'kl_weight': 0.000882495121202325, 'lr': 0.0016168538465744155, 'batch_size': 32, 'dropout_rate': 0.43542656258397405, 'prior_mu': 0.04188228269393539, 'prior_sigma': 0.08710567347584917, 'normalization': 'none'}. Best is trial 1528 with value: 0.5170644640922546.
Generating morgan fingerprints...
Generated fingerprints with 2048 features for 900 molecules
Data shape: X=(900, 2048), y=(900,)
Trial 2198: 5-fold CV loss = 0.5772
[I 2025-08-08 04:53:20,228] Trial 2198 finished with value: 0.5771871089935303 and parameters: {'fp_type': 'morgan', 'morgan_only_radius': 2, 'morgan_only_nBits': 2048, 'num_hidden_layers': 3, 'hidden_dim_0': 64, 'hidden_dim_1': 512, 'hidden_dim_2': 256, 'kl_weight': 0.0005613755361600566, 'lr': 0.0016591318386004793, 'batch_size': 32, 'dropout_rate': 0.4466525280186872, 'prior_mu': 0.062367745474644895, 'prior_sigma': 0.06840301750892971, 'normalization': 'none'}. Best is trial 1528 with value: 0.5170644640922546.
Generating morgan fingerprints...
Generated fingerprints with 2048 features for 900 molecules
Data shape: X=(900, 2048), y=(900,)
Trial 2205: 5-fold CV loss = 0.5991
[I 2025-08-08 04:53:25,898] Trial 2205 finished with value: 0.5990898489952088 and parameters: {'fp_type': 'morgan', 'morgan_only_radius': 2, 'morgan_only_nBits': 2048, 'num_hidden_layers': 3, 'hidden_dim_0': 512, 'hidden_dim_1': 64, 'hidden_dim_2': 256, 'kl_weight': 0.0005979959606703203, 'lr': 0.0020525395486163957, 'batch_size': 32, 'dropout_rate': 0.42614789413975174, 'prior_mu': 0.05244342459165317, 'prior_sigma': 0.06600305988042458, 'normalization': 'none'}. Best is trial 1528 with value: 0.5170644640922546.
Generating morgan fingerprints...
Generated fingerprints with 2048 features for 900 molecules
Data shape: X=(900, 2048), y=(900,)
Trial 2204: 5-fold CV loss = 0.5384
[I 2025-08-08 04:53:40,852] Trial 2204 finished with value: 0.5383809566497803 and parameters: {'fp_type': 'morgan', 'morgan_only_radius': 2, 'morgan_only_nBits': 2048, 'num_hidden_layers': 3, 'hidden_dim_0': 512, 'hidden_dim_1': 64, 'hidden_dim_2': 256, 'kl_weight': 0.000843512061074707, 'lr': 0.0020829339607830294, 'batch_size': 32, 'dropout_rate': 0.42576629091360474, 'prior_mu': 0.05433170011132863, 'prior_sigma': 0.0661558122470415, 'normalization': 'none'}. Best is trial 1528 with value: 0.5170644640922546.
Generating morgan fingerprints...
Generated fingerprints with 2048 features for 900 molecules
Data shape: X=(900, 2048), y=(900,)
Trial 2208: 5-fold CV loss = 0.6006
[I 2025-08-08 04:54:41,108] Trial 2208 finished with value: 0.6006392359733581 and parameters: {'fp_type': 'morgan', 'morgan_only_radius': 2, 'morgan_only_nBits': 2048, 'num_hidden_layers': 3, 'hidden_dim_0': 512, 'hidden_dim_1': 64, 'hidden_dim_2': 64, 'kl_weight': 0.0006667266404485665, 'lr': 0.0017988496354182733, 'batch_size': 32, 'dropout_rate': 0.4130764711321111, 'prior_mu': 0.0544599424163682, 'prior_sigma': 0.0729960132957382, 'normalization': 'none'}. Best is trial 1528 with value: 0.5170644640922546.
Generating morgan fingerprints...
Generated fingerprints with 2048 features for 900 molecules
Data shape: X=(900, 2048), y=(900,)
Trial 2209: 5-fold CV loss = 0.5291
[I 2025-08-08 04:54:44,257] Trial 2209 finished with value: 0.5290504038333893 and parameters: {'fp_type': 'morgan', 'morgan_only_radius': 2, 'morgan_only_nBits': 2048, 'num_hidden_layers': 3, 'hidden_dim_0': 512, 'hidden_dim_1': 64, 'hidden_dim_2': 512, 'kl_weight': 0.0006656896091866592, 'lr': 0.002446986746555268, 'batch_size': 32, 'dropout_rate': 0.4563554364352218, 'prior_mu': 0.032880173425574116, 'prior_sigma': 0.07300008581026145, 'normalization': 'none'}. Best is trial 1528 with value: 0.5170644640922546.
Generating morgan fingerprints...
Generated fingerprints with 2048 features for 900 molecules
Data shape: X=(900, 2048), y=(900,)
Trial 2211: 5-fold CV loss = 0.5623
[I 2025-08-08 04:55:42,785] Trial 2211 finished with value: 0.5623255431652069 and parameters: {'fp_type': 'morgan', 'morgan_only_radius': 2, 'morgan_only_nBits': 2048, 'num_hidden_layers': 3, 'hidden_dim_0': 512, 'hidden_dim_1': 256, 'hidden_dim_2': 256, 'kl_weight': 0.00047717252865723094, 'lr': 0.002838815055728201, 'batch_size': 32, 'dropout_rate': 0.40553470617809434, 'prior_mu': 0.04310567119955718, 'prior_sigma': 0.07646425786224262, 'normalization': 'none'}. Best is trial 1528 with value: 0.5170644640922546.
Generating morgan fingerprints...
Generated fingerprints with 2048 features for 900 molecules
Data shape: X=(900, 2048), y=(900,)
Trial 2206: 5-fold CV loss = 0.5454
[I 2025-08-08 04:55:50,162] Trial 2206 finished with value: 0.5453916370868683 and parameters: {'fp_type': 'morgan', 'morgan_only_radius': 2, 'morgan_only_nBits': 2048, 'num_hidden_layers': 3, 'hidden_dim_0': 512, 'hidden_dim_1': 64, 'hidden_dim_2': 256, 'kl_weight': 0.0005914163620836528, 'lr': 0.0020503208707769245, 'batch_size': 32, 'dropout_rate': 0.4249307029187953, 'prior_mu': 0.05660040226097111, 'prior_sigma': 0.06666897387790925, 'normalization': 'none'}. Best is trial 1528 with value: 0.5170644640922546.
Generating morgan fingerprints...
Generated fingerprints with 2048 features for 900 molecules
Data shape: X=(900, 2048), y=(900,)
Trial 2212: 5-fold CV loss = 0.7505
[I 2025-08-08 04:55:53,965] Trial 2212 finished with value: 0.7505032181739807 and parameters: {'fp_type': 'morgan', 'morgan_only_radius': 2, 'morgan_only_nBits': 2048, 'num_hidden_layers': 3, 'hidden_dim_0': 512, 'hidden_dim_1': 1024, 'hidden_dim_2': 512, 'kl_weight': 0.0008515485677151239, 'lr': 0.0022253786728772566, 'batch_size': 128, 'dropout_rate': 0.4220504981253233, 'prior_mu': 0.026183086846136926, 'prior_sigma': 0.06565284800437939, 'normalization': 'none'}. Best is trial 1528 with value: 0.5170644640922546.
Generating morgan fingerprints...
Generated fingerprints with 2048 features for 900 molecules
Data shape: X=(900, 2048), y=(900,)
Trial 2210: 5-fold CV loss = 0.5680
[I 2025-08-08 04:55:57,656] Trial 2210 finished with value: 0.5680491030216217 and parameters: {'fp_type': 'morgan', 'morgan_only_radius': 2, 'morgan_only_nBits': 2048, 'num_hidden_layers': 3, 'hidden_dim_0': 512, 'hidden_dim_1': 256, 'hidden_dim_2': 512, 'kl_weight': 0.00047958772556172253, 'lr': 0.0024787823614586045, 'batch_size': 32, 'dropout_rate': 0.36925075773854416, 'prior_mu': 0.030916377550136893, 'prior_sigma': 0.07604975989070181, 'normalization': 'none'}. Best is trial 1528 with value: 0.5170644640922546.
Generating morgan fingerprints...
Generated fingerprints with 2048 features for 900 molecules
Data shape: X=(900, 2048), y=(900,)
Trial 2213: 5-fold CV loss = 1.0300
[I 2025-08-08 04:56:02,853] Trial 2213 finished with value: 1.030033326148987 and parameters: {'fp_type': 'morgan', 'morgan_only_radius': 2, 'morgan_only_nBits': 2048, 'num_hidden_layers': 3, 'hidden_dim_0': 512, 'hidden_dim_1': 1024, 'hidden_dim_2': 512, 'kl_weight': 0.000843356226440257, 'lr': 0.0022813621539746897, 'batch_size': 128, 'dropout_rate': 0.4553427157491796, 'prior_mu': 0.02840235743428917, 'prior_sigma': 0.07554788516915911, 'normalization': 'none'}. Best is trial 1528 with value: 0.5170644640922546.
Generating morgan fingerprints...
Generated fingerprints with 2048 features for 900 molecules
Data shape: X=(900, 2048), y=(900,)
Trial 2207: 5-fold CV loss = 0.5859
[I 2025-08-08 04:56:52,574] Trial 2207 finished with value: 0.5858825087547302 and parameters: {'fp_type': 'morgan', 'morgan_only_radius': 2, 'morgan_only_nBits': 2048, 'num_hidden_layers': 3, 'hidden_dim_0': 512, 'hidden_dim_1': 64, 'hidden_dim_2': 64, 'kl_weight': 0.0006367884655150474, 'lr': 0.0020570407856689427, 'batch_size': 32, 'dropout_rate': 0.22739222314978813, 'prior_mu': 0.05534802684972357, 'prior_sigma': 0.06552670783164587, 'normalization': 'none'}. Best is trial 1528 with value: 0.5170644640922546.
Generating morgan fingerprints...
Generated fingerprints with 2048 features for 900 molecules
Data shape: X=(900, 2048), y=(900,)
Trial 2215: 5-fold CV loss = 0.5387
[I 2025-08-08 04:57:16,540] Trial 2215 finished with value: 0.538738465309143 and parameters: {'fp_type': 'morgan', 'morgan_only_radius': 3, 'morgan_only_nBits': 2048, 'num_hidden_layers': 3, 'hidden_dim_0': 512, 'hidden_dim_1': 64, 'hidden_dim_2': 512, 'kl_weight': 0.0007278177406596811, 'lr': 0.001848487605147433, 'batch_size': 32, 'dropout_rate': 0.3983140814512631, 'prior_mu': 0.06712897394893641, 'prior_sigma': 0.09156816252169821, 'normalization': 'none'}. Best is trial 1528 with value: 0.5170644640922546.
Generating rdkit fingerprints...
Generated fingerprints with 1024 features for 900 molecules
Data shape: X=(900, 1024), y=(900,)
Trial 2214: 5-fold CV loss = 0.5487
[I 2025-08-08 04:57:22,871] Trial 2214 finished with value: 0.5486583054065705 and parameters: {'fp_type': 'morgan', 'morgan_only_radius': 2, 'morgan_only_nBits': 2048, 'num_hidden_layers': 3, 'hidden_dim_0': 512, 'hidden_dim_1': 64, 'hidden_dim_2': 512, 'kl_weight': 0.00015054635149380107, 'lr': 0.0018082849103959802, 'batch_size': 32, 'dropout_rate': 0.45326682114517963, 'prior_mu': 0.07074824571784899, 'prior_sigma': 0.07090715077881764, 'normalization': 'none'}. Best is trial 1528 with value: 0.5170644640922546.
Generating rdkit fingerprints...
Generated fingerprints with 1024 features for 900 molecules
Data shape: X=(900, 1024), y=(900,)
Trial 2219: 5-fold CV loss = 0.6529
[I 2025-08-08 04:57:50,768] Trial 2219 finished with value: 0.6529357433319092 and parameters: {'fp_type': 'rdkit', 'rdkit_only_maxPath': 6, 'rdkit_only_nBits': 1024, 'num_hidden_layers': 3, 'hidden_dim_0': 512, 'hidden_dim_1': 128, 'hidden_dim_2': 512, 'kl_weight': 0.0005589972467876489, 'lr': 0.0019183243032324466, 'batch_size': 64, 'dropout_rate': 0.17747195789551948, 'prior_mu': 0.038866747278242714, 'prior_sigma': 0.07001923149734737, 'normalization': 'none'}. Best is trial 1528 with value: 0.5170644640922546.
Generating morgan fingerprints...
Generated fingerprints with 2048 features for 900 molecules
Data shape: X=(900, 2048), y=(900,)
Trial 2220: 5-fold CV loss = 0.5343
[I 2025-08-08 04:58:46,355] Trial 2220 finished with value: 0.5342635810375214 and parameters: {'fp_type': 'morgan', 'morgan_only_radius': 2, 'morgan_only_nBits': 2048, 'num_hidden_layers': 3, 'hidden_dim_0': 512, 'hidden_dim_1': 128, 'hidden_dim_2': 512, 'kl_weight': 0.0007459513788024164, 'lr': 0.003151386426265659, 'batch_size': 32, 'dropout_rate': 0.4392228441348492, 'prior_mu': 0.04494708596794879, 'prior_sigma': 0.0821128024244132, 'normalization': 'none'}. Best is trial 1528 with value: 0.5170644640922546.
Generating morgan fingerprints...
Generated fingerprints with 2048 features for 900 molecules
Data shape: X=(900, 2048), y=(900,)
Trial 2216: 5-fold CV loss = 0.5254
[I 2025-08-08 04:58:48,811] Trial 2216 finished with value: 0.5253987669944763 and parameters: {'fp_type': 'morgan', 'morgan_only_radius': 3, 'morgan_only_nBits': 2048, 'num_hidden_layers': 3, 'hidden_dim_0': 512, 'hidden_dim_1': 64, 'hidden_dim_2': 512, 'kl_weight': 0.0007488800814336912, 'lr': 0.0018550643361829634, 'batch_size': 32, 'dropout_rate': 0.39969385681252395, 'prior_mu': 0.06737435767165814, 'prior_sigma': 0.07110065709467148, 'normalization': 'none'}. Best is trial 1528 with value: 0.5170644640922546.
Generating morgan fingerprints...
Generated fingerprints with 2048 features for 900 molecules
Data shape: X=(900, 2048), y=(900,)
Trial 2218: 5-fold CV loss = 0.5755
[I 2025-08-08 04:59:06,779] Trial 2218 finished with value: 0.5754859745502472 and parameters: {'fp_type': 'rdkit', 'rdkit_only_maxPath': 6, 'rdkit_only_nBits': 1024, 'num_hidden_layers': 3, 'hidden_dim_0': 512, 'hidden_dim_1': 128, 'hidden_dim_2': 512, 'kl_weight': 0.000559848051053893, 'lr': 0.0031852099777556504, 'batch_size': 32, 'dropout_rate': 0.44313820703073326, 'prior_mu': -0.19916426981632954, 'prior_sigma': 0.07105906436675725, 'normalization': 'none'}. Best is trial 1528 with value: 0.5170644640922546.
Generating morgan fingerprints...
Generated fingerprints with 2048 features for 900 molecules
Data shape: X=(900, 2048), y=(900,)
Trial 2221: 5-fold CV loss = 0.5345
[I 2025-08-08 04:59:51,868] Trial 2221 finished with value: 0.5344689011573791 and parameters: {'fp_type': 'morgan', 'morgan_only_radius': 2, 'morgan_only_nBits': 2048, 'num_hidden_layers': 3, 'hidden_dim_0': 512, 'hidden_dim_1': 128, 'hidden_dim_2': 256, 'kl_weight': 0.000391089393377284, 'lr': 0.0022822669317452923, 'batch_size': 32, 'dropout_rate': 0.41184461299361996, 'prior_mu': 0.04619328901316769, 'prior_sigma': 0.07106110402279422, 'normalization': 'none'}. Best is trial 1528 with value: 0.5170644640922546.
Generating morgan fingerprints...
Generated fingerprints with 2048 features for 900 molecules
Data shape: X=(900, 2048), y=(900,)
Trial 2222: 5-fold CV loss = 0.6798
[I 2025-08-08 05:00:04,423] Trial 2222 finished with value: 0.6798442125320434 and parameters: {'fp_type': 'morgan', 'morgan_only_radius': 2, 'morgan_only_nBits': 2048, 'num_hidden_layers': 3, 'hidden_dim_0': 512, 'hidden_dim_1': 128, 'hidden_dim_2': 256, 'kl_weight': 0.0004982523066595141, 'lr': 0.0001874881603689424, 'batch_size': 32, 'dropout_rate': 0.4098125947432794, 'prior_mu': 0.043741151379709006, 'prior_sigma': 0.06421906461060739, 'normalization': 'none'}. Best is trial 1528 with value: 0.5170644640922546.
Generating morgan fingerprints...
Generated fingerprints with 2048 features for 900 molecules
Data shape: X=(900, 2048), y=(900,)
Trial 2223: 5-fold CV loss = 0.5716
[I 2025-08-08 05:00:21,899] Trial 2223 finished with value: 0.5715524077415466 and parameters: {'fp_type': 'morgan', 'morgan_only_radius': 2, 'morgan_only_nBits': 2048, 'num_hidden_layers': 3, 'hidden_dim_0': 256, 'hidden_dim_1': 128, 'hidden_dim_2': 256, 'kl_weight': 0.0008867610788107762, 'lr': 0.0022239109272794108, 'batch_size': 32, 'dropout_rate': 0.41350856548919745, 'prior_mu': 0.04608383530183752, 'prior_sigma': 0.06530936016062462, 'normalization': 'none'}. Best is trial 1528 with value: 0.5170644640922546.
Generating morgan fingerprints...
Generated fingerprints with 2048 features for 900 molecules
Data shape: X=(900, 2048), y=(900,)
Trial 2224: 5-fold CV loss = 0.6730
[I 2025-08-08 05:00:47,141] Trial 2224 finished with value: 0.6729562759399415 and parameters: {'fp_type': 'morgan', 'morgan_only_radius': 2, 'morgan_only_nBits': 2048, 'num_hidden_layers': 3, 'hidden_dim_0': 512, 'hidden_dim_1': 128, 'hidden_dim_2': 512, 'kl_weight': 0.0004979479049480023, 'lr': 0.0014778705332081012, 'batch_size': 32, 'dropout_rate': 0.43363294940627356, 'prior_mu': 0.03699766438687281, 'prior_sigma': 0.06437621836898422, 'normalization': 'none'}. Best is trial 1528 with value: 0.5170644640922546.
Generating morgan fingerprints...
Generated fingerprints with 2048 features for 900 molecules
Data shape: X=(900, 2048), y=(900,)
Trial 2226: 5-fold CV loss = 0.5333
[I 2025-08-08 05:01:27,767] Trial 2226 finished with value: 0.5333216428756714 and parameters: {'fp_type': 'morgan', 'morgan_only_radius': 2, 'morgan_only_nBits': 2048, 'num_hidden_layers': 3, 'hidden_dim_0': 512, 'hidden_dim_1': 128, 'hidden_dim_2': 512, 'kl_weight': 0.0006929956924181709, 'lr': 0.0026723717051574153, 'batch_size': 32, 'dropout_rate': 0.4293264086331408, 'prior_mu': 0.03549957753511339, 'prior_sigma': 0.08150394662337175, 'normalization': 'none'}. Best is trial 1528 with value: 0.5170644640922546.
Generating morgan fingerprints...
Generated fingerprints with 2048 features for 900 molecules
Data shape: X=(900, 2048), y=(900,)
Trial 2227: 5-fold CV loss = 0.8575
[I 2025-08-08 05:01:32,437] Trial 2227 finished with value: 0.8575162291526794 and parameters: {'fp_type': 'morgan', 'morgan_only_radius': 2, 'morgan_only_nBits': 2048, 'num_hidden_layers': 3, 'hidden_dim_0': 512, 'hidden_dim_1': 512, 'hidden_dim_2': 512, 'kl_weight': 0.0006467399117379566, 'lr': 0.002669766387098495, 'batch_size': 32, 'dropout_rate': 0.4573731002726741, 'prior_mu': 0.02093678917564865, 'prior_sigma': 0.07478033984795036, 'normalization': 'none'}. Best is trial 1528 with value: 0.5170644640922546.
Generating morgan fingerprints...
Generated fingerprints with 2048 features for 900 molecules
Data shape: X=(900, 2048), y=(900,)
Trial 2217: 5-fold CV loss = 0.5262
[I 2025-08-08 05:01:56,700] Trial 2217 finished with value: 0.5261807203292846 and parameters: {'fp_type': 'morgan', 'morgan_only_radius': 3, 'morgan_only_nBits': 2048, 'num_hidden_layers': 3, 'hidden_dim_0': 512, 'hidden_dim_1': 128, 'hidden_dim_2': 512, 'kl_weight': 0.000747283133072562, 'lr': 0.001796160831399627, 'batch_size': 32, 'dropout_rate': 0.4415508467970731, 'prior_mu': 0.06947621917969268, 'prior_sigma': 0.07058375600911618, 'normalization': 'none'}. Best is trial 1528 with value: 0.5170644640922546.
Generating morgan fingerprints...
Generated fingerprints with 2048 features for 900 molecules
Data shape: X=(900, 2048), y=(900,)
Trial 2225: 5-fold CV loss = 0.5283
[I 2025-08-08 05:02:08,395] Trial 2225 finished with value: 0.5283470988273621 and parameters: {'fp_type': 'morgan', 'morgan_only_radius': 2, 'morgan_only_nBits': 2048, 'num_hidden_layers': 3, 'hidden_dim_0': 256, 'hidden_dim_1': 128, 'hidden_dim_2': 512, 'kl_weight': 0.0006535080997667343, 'lr': 0.0026372542603853334, 'batch_size': 32, 'dropout_rate': 0.43148101363941144, 'prior_mu': 0.033945072115780496, 'prior_sigma': 0.08264118626185002, 'normalization': 'none'}. Best is trial 1528 with value: 0.5170644640922546.
Generating morgan fingerprints...
Generated fingerprints with 2048 features for 900 molecules
Data shape: X=(900, 2048), y=(900,)
Trial 2229: 5-fold CV loss = 0.5389
[I 2025-08-08 05:02:37,037] Trial 2229 finished with value: 0.5389376282691956 and parameters: {'fp_type': 'morgan', 'morgan_only_radius': 2, 'morgan_only_nBits': 2048, 'num_hidden_layers': 3, 'hidden_dim_0': 512, 'hidden_dim_1': 128, 'hidden_dim_2': 512, 'kl_weight': 0.0007508541502295394, 'lr': 0.002020962483429217, 'batch_size': 32, 'dropout_rate': 0.44655317582280346, 'prior_mu': 0.05101123664802363, 'prior_sigma': 0.06833273364413252, 'normalization': 'layer'}. Best is trial 1528 with value: 0.5170644640922546.
Generating morgan fingerprints...
Generated fingerprints with 2048 features for 900 molecules
Data shape: X=(900, 2048), y=(900,)
Trial 2228: 5-fold CV loss = 0.5245
[I 2025-08-08 05:02:43,815] Trial 2228 finished with value: 0.5245098233222961 and parameters: {'fp_type': 'morgan', 'morgan_only_radius': 2, 'morgan_only_nBits': 2048, 'num_hidden_layers': 3, 'hidden_dim_0': 512, 'hidden_dim_1': 128, 'hidden_dim_2': 512, 'kl_weight': 0.0006170096209537734, 'lr': 0.0024663728498908783, 'batch_size': 32, 'dropout_rate': 0.44697645733694186, 'prior_mu': 0.021552579164622936, 'prior_sigma': 0.0757575421301236, 'normalization': 'none'}. Best is trial 1528 with value: 0.5170644640922546.
Generating morgan fingerprints...
Generated fingerprints with 2048 features for 900 molecules
Data shape: X=(900, 2048), y=(900,)
Trial 2233: 5-fold CV loss = 0.6731
[I 2025-08-08 05:03:28,177] Trial 2233 finished with value: 0.673133111000061 and parameters: {'fp_type': 'morgan', 'morgan_only_radius': 2, 'morgan_only_nBits': 2048, 'num_hidden_layers': 2, 'hidden_dim_0': 512, 'hidden_dim_1': 128, 'kl_weight': 0.0008991660088667953, 'lr': 0.0020947419130924547, 'batch_size': 32, 'dropout_rate': 0.4213829955902712, 'prior_mu': 0.0619522755935186, 'prior_sigma': 0.06319385538415685, 'normalization': 'none'}. Best is trial 1528 with value: 0.5170644640922546.
Generating morgan fingerprints...
Generated fingerprints with 2048 features for 900 molecules
Data shape: X=(900, 2048), y=(900,)
Trial 2232: 5-fold CV loss = 0.6192
[I 2025-08-08 05:03:36,717] Trial 2232 finished with value: 0.6192043900489808 and parameters: {'fp_type': 'morgan', 'morgan_only_radius': 2, 'morgan_only_nBits': 2048, 'num_hidden_layers': 2, 'hidden_dim_0': 512, 'hidden_dim_1': 128, 'kl_weight': 0.0008984385481088156, 'lr': 0.0024522611556964755, 'batch_size': 32, 'dropout_rate': 0.4217802915420683, 'prior_mu': 0.061645961112653795, 'prior_sigma': 0.07667720496709982, 'normalization': 'none'}. Best is trial 1528 with value: 0.5170644640922546.
Generating morgan fingerprints...
Generated fingerprints with 2048 features for 900 molecules
Data shape: X=(900, 2048), y=(900,)
Trial 2230: 5-fold CV loss = 0.6793
[I 2025-08-08 05:04:02,616] Trial 2230 finished with value: 0.6793406963348388 and parameters: {'fp_type': 'morgan', 'morgan_only_radius': 2, 'morgan_only_nBits': 2048, 'num_hidden_layers': 2, 'hidden_dim_0': 512, 'hidden_dim_1': 128, 'kl_weight': 0.0008898653395434642, 'lr': 0.0020913483059334637, 'batch_size': 32, 'dropout_rate': 0.4210185545501726, 'prior_mu': 0.05330718399313919, 'prior_sigma': 0.07764269392386536, 'normalization': 'none'}. Best is trial 1528 with value: 0.5170644640922546.
Generating morgan fingerprints...
Generated fingerprints with 2048 features for 900 molecules
Data shape: X=(900, 2048), y=(900,)
Trial 2231: 5-fold CV loss = 0.5288
[I 2025-08-08 05:04:18,036] Trial 2231 finished with value: 0.5287732720375061 and parameters: {'fp_type': 'morgan', 'morgan_only_radius': 2, 'morgan_only_nBits': 2048, 'num_hidden_layers': 3, 'hidden_dim_0': 512, 'hidden_dim_1': 128, 'hidden_dim_2': 512, 'kl_weight': 0.0005607759605310942, 'lr': 0.002067010235647457, 'batch_size': 32, 'dropout_rate': 0.4496362122614052, 'prior_mu': 0.05232546061760789, 'prior_sigma': 0.07775763593412742, 'normalization': 'none'}. Best is trial 1528 with value: 0.5170644640922546.
Generating morgan fingerprints...
Generated fingerprints with 2048 features for 900 molecules
Data shape: X=(900, 2048), y=(900,)
Trial 2234: 5-fold CV loss = 0.5563
