[I 2025-08-07 18:07:36,995] Trial 457 finished with value: 0.6436373353004455 and parameters: {'fp_type': 'morgan', 'morgan_only_radius': 2, 'morgan_only_nBits': 1024, 'num_hidden_layers': 3, 'hidden_dim_0': 512, 'hidden_dim_1': 128, 'hidden_dim_2': 512, 'kl_weight': 0.008266122570073467, 'lr': 0.0018724484540781465, 'batch_size': 32, 'dropout_rate': 0.4628060645072408, 'prior_mu': 0.0175768785400178, 'prior_sigma': 0.17510501885532453, 'normalization': 'none'}. Best is trial 272 with value: 0.5198344707489013.
Generating morgan fingerprints...
Generated fingerprints with 1024 features for 900 molecules
Data shape: X=(900, 1024), y=(900,)
Trial 464: 5-fold CV loss = 0.5435
[I 2025-08-07 18:08:35,861] Trial 464 finished with value: 0.5434513866901398 and parameters: {'fp_type': 'morgan', 'morgan_only_radius': 2, 'morgan_only_nBits': 1024, 'num_hidden_layers': 3, 'hidden_dim_0': 256, 'hidden_dim_1': 128, 'hidden_dim_2': 512, 'kl_weight': 0.004700787619487583, 'lr': 0.0022014083257953713, 'batch_size': 32, 'dropout_rate': 0.48186630942993214, 'prior_mu': -0.044202707224889906, 'prior_sigma': 0.06326387116435939, 'normalization': 'none'}. Best is trial 272 with value: 0.5198344707489013.
Generating morgan fingerprints...
Generated fingerprints with 1024 features for 900 molecules
Data shape: X=(900, 1024), y=(900,)
Trial 465: 5-fold CV loss = 0.5384
[I 2025-08-07 18:09:18,573] Trial 465 finished with value: 0.5383921802043915 and parameters: {'fp_type': 'morgan', 'morgan_only_radius': 2, 'morgan_only_nBits': 1024, 'num_hidden_layers': 3, 'hidden_dim_0': 256, 'hidden_dim_1': 128, 'hidden_dim_2': 512, 'kl_weight': 0.004138582940715824, 'lr': 0.0022311203159091388, 'batch_size': 32, 'dropout_rate': 0.4795598230468121, 'prior_mu': -0.04364284391715728, 'prior_sigma': 0.07171075867195142, 'normalization': 'none'}. Best is trial 272 with value: 0.5198344707489013.
Generating morgan fingerprints...
Generated fingerprints with 1024 features for 900 molecules
Data shape: X=(900, 1024), y=(900,)
Trial 463: 5-fold CV loss = 0.5449
[I 2025-08-07 18:09:33,635] Trial 463 finished with value: 0.5448707222938538 and parameters: {'fp_type': 'morgan', 'morgan_only_radius': 2, 'morgan_only_nBits': 1024, 'num_hidden_layers': 3, 'hidden_dim_0': 256, 'hidden_dim_1': 128, 'hidden_dim_2': 512, 'kl_weight': 0.003954627910261286, 'lr': 0.00219524802526507, 'batch_size': 32, 'dropout_rate': 0.4889126858429669, 'prior_mu': 0.029329860710860453, 'prior_sigma': 0.06321228466622233, 'normalization': 'none'}. Best is trial 272 with value: 0.5198344707489013.
Generating morgan fingerprints...
Generated fingerprints with 1024 features for 900 molecules
Data shape: X=(900, 1024), y=(900,)
Trial 467: 5-fold CV loss = 0.5325
[I 2025-08-07 18:09:37,122] Trial 467 finished with value: 0.532470703125 and parameters: {'fp_type': 'morgan', 'morgan_only_radius': 2, 'morgan_only_nBits': 1024, 'num_hidden_layers': 3, 'hidden_dim_0': 512, 'hidden_dim_1': 128, 'hidden_dim_2': 512, 'kl_weight': 0.004195483027470887, 'lr': 0.002269145734871263, 'batch_size': 32, 'dropout_rate': 0.48886534133563514, 'prior_mu': 0.03002446575564371, 'prior_sigma': 0.07191368045940841, 'normalization': 'none'}. Best is trial 272 with value: 0.5198344707489013.
Generating morgan fingerprints...
Generated fingerprints with 1024 features for 900 molecules
Data shape: X=(900, 1024), y=(900,)
Trial 468: 5-fold CV loss = 0.5261
[I 2025-08-07 18:10:52,967] Trial 468 finished with value: 0.5261358618736267 and parameters: {'fp_type': 'morgan', 'morgan_only_radius': 2, 'morgan_only_nBits': 1024, 'num_hidden_layers': 3, 'hidden_dim_0': 512, 'hidden_dim_1': 128, 'hidden_dim_2': 512, 'kl_weight': 0.0015327762854711324, 'lr': 0.0022916774910954852, 'batch_size': 32, 'dropout_rate': 0.4901374496229827, 'prior_mu': -0.03487222098468243, 'prior_sigma': 0.05989960771418709, 'normalization': 'none'}. Best is trial 272 with value: 0.5198344707489013.
Generating morgan fingerprints...
Generated fingerprints with 1024 features for 900 molecules
Data shape: X=(900, 1024), y=(900,)
Trial 470: 5-fold CV loss = 0.5517
[I 2025-08-07 18:11:06,128] Trial 470 finished with value: 0.5516723155975342 and parameters: {'fp_type': 'morgan', 'morgan_only_radius': 2, 'morgan_only_nBits': 1024, 'num_hidden_layers': 3, 'hidden_dim_0': 512, 'hidden_dim_1': 128, 'hidden_dim_2': 512, 'kl_weight': 0.001814180518421155, 'lr': 0.0017235594634956025, 'batch_size': 32, 'dropout_rate': 0.49997043137944264, 'prior_mu': -0.034818350919288414, 'prior_sigma': 0.059499995176725426, 'normalization': 'none'}. Best is trial 272 with value: 0.5198344707489013.
Generating morgan fingerprints...
Generated fingerprints with 1024 features for 900 molecules
Data shape: X=(900, 1024), y=(900,)
Trial 466: 5-fold CV loss = 0.5479
[I 2025-08-07 18:11:18,382] Trial 466 finished with value: 0.5478833079338074 and parameters: {'fp_type': 'morgan', 'morgan_only_radius': 2, 'morgan_only_nBits': 1024, 'num_hidden_layers': 3, 'hidden_dim_0': 512, 'hidden_dim_1': 128, 'hidden_dim_2': 512, 'kl_weight': 0.003942778419546402, 'lr': 0.0022281897874252992, 'batch_size': 32, 'dropout_rate': 0.21673344758302987, 'prior_mu': 0.02901247684141931, 'prior_sigma': 0.07242208936283588, 'normalization': 'none'}. Best is trial 272 with value: 0.5198344707489013.
Generating morgan fingerprints...
Generated fingerprints with 1024 features for 900 molecules
Data shape: X=(900, 1024), y=(900,)
Trial 472: 5-fold CV loss = 0.6326
[I 2025-08-07 18:11:36,656] Trial 472 finished with value: 0.6326210916042327 and parameters: {'fp_type': 'morgan', 'morgan_only_radius': 2, 'morgan_only_nBits': 1024, 'num_hidden_layers': 2, 'hidden_dim_0': 512, 'hidden_dim_1': 128, 'kl_weight': 0.0010803905042248716, 'lr': 0.002423312785082681, 'batch_size': 32, 'dropout_rate': 0.48971706284480226, 'prior_mu': -0.01826550222240938, 'prior_sigma': 0.059225387556458994, 'normalization': 'none'}. Best is trial 272 with value: 0.5198344707489013.
Generating morgan fingerprints...
Generated fingerprints with 1024 features for 900 molecules
Data shape: X=(900, 1024), y=(900,)
Trial 469: 5-fold CV loss = 0.5482
[I 2025-08-07 18:11:46,141] Trial 469 finished with value: 0.5482303321361541 and parameters: {'fp_type': 'morgan', 'morgan_only_radius': 2, 'morgan_only_nBits': 1024, 'num_hidden_layers': 3, 'hidden_dim_0': 512, 'hidden_dim_1': 128, 'hidden_dim_2': 512, 'kl_weight': 0.001792306519495146, 'lr': 0.0024305987828625885, 'batch_size': 32, 'dropout_rate': 0.2165721098523145, 'prior_mu': -0.03527310182907639, 'prior_sigma': 0.06025219815660236, 'normalization': 'none'}. Best is trial 272 with value: 0.5198344707489013.
Generating morgan fingerprints...
Generated fingerprints with 1024 features for 900 molecules
Data shape: X=(900, 1024), y=(900,)
Trial 471: 5-fold CV loss = 0.5299
[I 2025-08-07 18:12:24,952] Trial 471 finished with value: 0.5298713326454163 and parameters: {'fp_type': 'morgan', 'morgan_only_radius': 2, 'morgan_only_nBits': 1024, 'num_hidden_layers': 3, 'hidden_dim_0': 512, 'hidden_dim_1': 128, 'hidden_dim_2': 512, 'kl_weight': 0.002014898849314046, 'lr': 0.002406072794408611, 'batch_size': 32, 'dropout_rate': 0.49136643165359845, 'prior_mu': -0.019797002305269918, 'prior_sigma': 0.05983089281947376, 'normalization': 'none'}. Best is trial 272 with value: 0.5198344707489013.
Generating rdkit fingerprints...
Generated fingerprints with 512 features for 900 molecules
Data shape: X=(900, 512), y=(900,)
Trial 474: 5-fold CV loss = 0.8826
[I 2025-08-07 18:12:28,014] Trial 474 finished with value: 0.8826409876346588 and parameters: {'fp_type': 'morgan', 'morgan_only_radius': 2, 'morgan_only_nBits': 1024, 'num_hidden_layers': 3, 'hidden_dim_0': 512, 'hidden_dim_1': 1024, 'hidden_dim_2': 512, 'kl_weight': 0.001513250828133188, 'lr': 0.0023304364788588124, 'batch_size': 32, 'dropout_rate': 0.49087034414327946, 'prior_mu': -0.0005934213250575653, 'prior_sigma': 0.06701956474993866, 'normalization': 'none'}. Best is trial 272 with value: 0.5198344707489013.
Generating rdkit fingerprints...
Generated fingerprints with 256 features for 900 molecules
Data shape: X=(900, 256), y=(900,)
Trial 477: 5-fold CV loss = 0.6449
[I 2025-08-07 18:13:05,727] Trial 477 finished with value: 0.6448730230331421 and parameters: {'fp_type': 'rdkit', 'rdkit_only_maxPath': 6, 'rdkit_only_nBits': 256, 'num_hidden_layers': 3, 'hidden_dim_0': 512, 'hidden_dim_1': 128, 'hidden_dim_2': 128, 'kl_weight': 0.001514964200318221, 'lr': 0.0020626458799648797, 'batch_size': 32, 'dropout_rate': 0.4779283650711568, 'prior_mu': -0.01330551721690712, 'prior_sigma': 0.06580666162672799, 'normalization': 'none'}. Best is trial 272 with value: 0.5198344707489013.
Generating morgan fingerprints...
Generated fingerprints with 2048 features for 900 molecules
Data shape: X=(900, 2048), y=(900,)
Trial 476: 5-fold CV loss = 0.6348
[I 2025-08-07 18:13:06,810] Trial 476 finished with value: 0.6347526431083679 and parameters: {'fp_type': 'rdkit', 'rdkit_only_maxPath': 6, 'rdkit_only_nBits': 512, 'num_hidden_layers': 3, 'hidden_dim_0': 512, 'hidden_dim_1': 128, 'hidden_dim_2': 512, 'kl_weight': 0.0013363510409750852, 'lr': 0.002050657170231222, 'batch_size': 32, 'dropout_rate': 0.4785861888614131, 'prior_mu': -0.0028991557361123512, 'prior_sigma': 0.06625457558271738, 'normalization': 'none'}. Best is trial 272 with value: 0.5198344707489013.
Generating morgan fingerprints...
Generated fingerprints with 2048 features for 900 molecules
Data shape: X=(900, 2048), y=(900,)
Trial 478: 5-fold CV loss = 0.5288
[I 2025-08-07 18:14:06,920] Trial 478 finished with value: 0.5288424372673035 and parameters: {'fp_type': 'morgan', 'morgan_only_radius': 2, 'morgan_only_nBits': 2048, 'num_hidden_layers': 3, 'hidden_dim_0': 512, 'hidden_dim_1': 128, 'hidden_dim_2': 512, 'kl_weight': 0.001275950459603212, 'lr': 0.002601804758236623, 'batch_size': 32, 'dropout_rate': 0.49992445378862793, 'prior_mu': -0.004926597060178437, 'prior_sigma': 0.0558222420209906, 'normalization': 'none'}. Best is trial 272 with value: 0.5198344707489013.
Generating morgan fingerprints...
Generated fingerprints with 1024 features for 900 molecules
Data shape: X=(900, 1024), y=(900,)
Trial 479: 5-fold CV loss = 0.5313
[I 2025-08-07 18:14:27,170] Trial 479 finished with value: 0.5312837958335876 and parameters: {'fp_type': 'morgan', 'morgan_only_radius': 2, 'morgan_only_nBits': 2048, 'num_hidden_layers': 3, 'hidden_dim_0': 512, 'hidden_dim_1': 128, 'hidden_dim_2': 512, 'kl_weight': 0.0023813873300560042, 'lr': 0.0025749668021967124, 'batch_size': 32, 'dropout_rate': 0.49972424729525067, 'prior_mu': -0.04776371574669627, 'prior_sigma': 0.05723662260774855, 'normalization': 'none'}. Best is trial 272 with value: 0.5198344707489013.
Generating morgan fingerprints...
Generated fingerprints with 1024 features for 900 molecules
Data shape: X=(900, 1024), y=(900,)
Trial 475: 5-fold CV loss = 0.5312
[I 2025-08-07 18:14:33,588] Trial 475 finished with value: 0.531225061416626 and parameters: {'fp_type': 'morgan', 'morgan_only_radius': 2, 'morgan_only_nBits': 1024, 'num_hidden_layers': 3, 'hidden_dim_0': 512, 'hidden_dim_1': 128, 'hidden_dim_2': 512, 'kl_weight': 0.0024566272654151524, 'lr': 0.002102287950013453, 'batch_size': 32, 'dropout_rate': 0.49100959231350894, 'prior_mu': -0.0015861712485192997, 'prior_sigma': 0.05664639190718721, 'normalization': 'none'}. Best is trial 272 with value: 0.5198344707489013.
Generating morgan fingerprints...
Generated fingerprints with 1024 features for 900 molecules
Data shape: X=(900, 1024), y=(900,)
Trial 481: 5-fold CV loss = 0.6961
[I 2025-08-07 18:14:47,398] Trial 481 finished with value: 0.6961337685585022 and parameters: {'fp_type': 'morgan', 'morgan_only_radius': 2, 'morgan_only_nBits': 1024, 'num_hidden_layers': 1, 'hidden_dim_0': 512, 'kl_weight': 0.0028305343057134363, 'lr': 0.0021481600643884972, 'batch_size': 32, 'dropout_rate': 0.47115768760766563, 'prior_mu': 0.0071692903016446685, 'prior_sigma': 0.06199217512541754, 'normalization': 'none'}. Best is trial 272 with value: 0.5198344707489013.
Generating morgan fingerprints...
Generated fingerprints with 1024 features for 900 molecules
Data shape: X=(900, 1024), y=(900,)
Trial 473: 5-fold CV loss = 0.5330
[I 2025-08-07 18:15:12,580] Trial 473 finished with value: 0.5330331265926361 and parameters: {'fp_type': 'morgan', 'morgan_only_radius': 2, 'morgan_only_nBits': 1024, 'num_hidden_layers': 3, 'hidden_dim_0': 512, 'hidden_dim_1': 128, 'hidden_dim_2': 512, 'kl_weight': 0.0015110777587490087, 'lr': 0.0024225665718131044, 'batch_size': 32, 'dropout_rate': 0.49130766827348527, 'prior_mu': -0.01794345881067265, 'prior_sigma': 0.05965121553202284, 'normalization': 'none'}. Best is trial 272 with value: 0.5198344707489013.
Generating morgan fingerprints...
Generated fingerprints with 1024 features for 900 molecules
Data shape: X=(900, 1024), y=(900,)
Trial 480: 5-fold CV loss = 0.5380
[I 2025-08-07 18:15:17,001] Trial 480 finished with value: 0.5379934728145599 and parameters: {'fp_type': 'morgan', 'morgan_only_radius': 2, 'morgan_only_nBits': 1024, 'num_hidden_layers': 3, 'hidden_dim_0': 512, 'hidden_dim_1': 128, 'hidden_dim_2': 512, 'kl_weight': 0.006198416930622966, 'lr': 0.0025695130419649687, 'batch_size': 32, 'dropout_rate': 0.4728635080228513, 'prior_mu': -0.04919000891252528, 'prior_sigma': 0.06195329144095764, 'normalization': 'none'}. Best is trial 272 with value: 0.5198344707489013.
Generating morgan fingerprints...
Generated fingerprints with 1024 features for 900 molecules
Data shape: X=(900, 1024), y=(900,)
Trial 483: 5-fold CV loss = 0.9707
[I 2025-08-07 18:15:37,013] Trial 483 finished with value: 0.9707060217857361 and parameters: {'fp_type': 'morgan', 'morgan_only_radius': 2, 'morgan_only_nBits': 1024, 'num_hidden_layers': 3, 'hidden_dim_0': 512, 'hidden_dim_1': 512, 'hidden_dim_2': 512, 'kl_weight': 0.003090673776324805, 'lr': 0.0023316321574016405, 'batch_size': 32, 'dropout_rate': 0.48448769439558187, 'prior_mu': -0.027523948949965557, 'prior_sigma': 0.07012939840578625, 'normalization': 'none'}. Best is trial 272 with value: 0.5198344707489013.
Generating morgan fingerprints...
Generated fingerprints with 1024 features for 900 molecules
Data shape: X=(900, 1024), y=(900,)
Trial 485: 5-fold CV loss = 0.5609
[I 2025-08-07 18:16:37,432] Trial 485 finished with value: 0.5609303653240204 and parameters: {'fp_type': 'morgan', 'morgan_only_radius': 2, 'morgan_only_nBits': 1024, 'num_hidden_layers': 3, 'hidden_dim_0': 512, 'hidden_dim_1': 128, 'hidden_dim_2': 512, 'kl_weight': 0.0009937859673173905, 'lr': 0.0019956592068902978, 'batch_size': 32, 'dropout_rate': 0.48165427742314937, 'prior_mu': -0.027998855348399583, 'prior_sigma': 0.07613525862163907, 'normalization': 'none'}. Best is trial 272 with value: 0.5198344707489013.
Generating morgan fingerprints...
Generated fingerprints with 1024 features for 900 molecules
Data shape: X=(900, 1024), y=(900,)
Trial 482: 5-fold CV loss = 0.5300
[I 2025-08-07 18:16:47,393] Trial 482 finished with value: 0.5300232410430908 and parameters: {'fp_type': 'morgan', 'morgan_only_radius': 2, 'morgan_only_nBits': 1024, 'num_hidden_layers': 3, 'hidden_dim_0': 512, 'hidden_dim_1': 128, 'hidden_dim_2': 512, 'kl_weight': 0.00301327162159273, 'lr': 0.002270550610349323, 'batch_size': 32, 'dropout_rate': 0.47052673936493655, 'prior_mu': 0.0069811898878887595, 'prior_sigma': 0.07547753353531977, 'normalization': 'none'}. Best is trial 272 with value: 0.5198344707489013.
Generating morgan fingerprints...
Generated fingerprints with 1024 features for 900 molecules
Data shape: X=(900, 1024), y=(900,)
Trial 486: 5-fold CV loss = 0.5667
[I 2025-08-07 18:16:54,006] Trial 486 finished with value: 0.5667246460914612 and parameters: {'fp_type': 'morgan', 'morgan_only_radius': 2, 'morgan_only_nBits': 1024, 'num_hidden_layers': 3, 'hidden_dim_0': 512, 'hidden_dim_1': 128, 'hidden_dim_2': 512, 'kl_weight': 0.0010410023237777356, 'lr': 0.00197216783378797, 'batch_size': 32, 'dropout_rate': 0.4842085313235453, 'prior_mu': -0.030706372012412074, 'prior_sigma': 0.07585010020434993, 'normalization': 'none'}. Best is trial 272 with value: 0.5198344707489013.
Generating morgan fingerprints...
Generated fingerprints with 1024 features for 900 molecules
Data shape: X=(900, 1024), y=(900,)
Trial 488: 5-fold CV loss = 0.8342
[I 2025-08-07 18:17:40,440] Trial 488 finished with value: 0.8341861605644226 and parameters: {'fp_type': 'morgan', 'morgan_only_radius': 2, 'morgan_only_nBits': 1024, 'num_hidden_layers': 3, 'hidden_dim_0': 512, 'hidden_dim_1': 128, 'hidden_dim_2': 512, 'kl_weight': 0.002238052983047345, 'lr': 0.0010491820086516558, 'batch_size': 32, 'dropout_rate': 0.48294218231826963, 'prior_mu': -0.010180925057392003, 'prior_sigma': 0.06755356436576192, 'normalization': 'none'}. Best is trial 272 with value: 0.5198344707489013.
Generating morgan fingerprints...
Generated fingerprints with 1024 features for 900 molecules
Data shape: X=(900, 1024), y=(900,)
Trial 487: 5-fold CV loss = 0.5338
[I 2025-08-07 18:18:16,001] Trial 487 finished with value: 0.5338083684444428 and parameters: {'fp_type': 'morgan', 'morgan_only_radius': 2, 'morgan_only_nBits': 1024, 'num_hidden_layers': 3, 'hidden_dim_0': 512, 'hidden_dim_1': 128, 'hidden_dim_2': 512, 'kl_weight': 0.0032895272779534133, 'lr': 0.001749368432075786, 'batch_size': 32, 'dropout_rate': 0.4503464527005386, 'prior_mu': -0.04171936200099492, 'prior_sigma': 0.06617661794016741, 'normalization': 'none'}. Best is trial 272 with value: 0.5198344707489013.
Generating morgan fingerprints...
Generated fingerprints with 1024 features for 900 molecules
Data shape: X=(900, 1024), y=(900,)
Trial 489: 5-fold CV loss = 0.6035
[I 2025-08-07 18:18:17,038] Trial 489 finished with value: 0.6034726440906525 and parameters: {'fp_type': 'morgan', 'morgan_only_radius': 2, 'morgan_only_nBits': 1024, 'num_hidden_layers': 3, 'hidden_dim_0': 512, 'hidden_dim_1': 128, 'hidden_dim_2': 512, 'kl_weight': 0.004830018854414924, 'lr': 0.0016036347624273294, 'batch_size': 32, 'dropout_rate': 0.4503507073238853, 'prior_mu': -0.042506156160719094, 'prior_sigma': 0.06530467560568483, 'normalization': 'none'}. Best is trial 272 with value: 0.5198344707489013.
Generating morgan fingerprints...
Generated fingerprints with 1024 features for 900 molecules
Data shape: X=(900, 1024), y=(900,)
Trial 492: 5-fold CV loss = 0.5408
[I 2025-08-07 18:19:18,597] Trial 492 finished with value: 0.5408474564552307 and parameters: {'fp_type': 'morgan', 'morgan_only_radius': 2, 'morgan_only_nBits': 1024, 'num_hidden_layers': 3, 'hidden_dim_0': 512, 'hidden_dim_1': 128, 'hidden_dim_2': 512, 'kl_weight': 0.005844807682030966, 'lr': 0.0022202725904102425, 'batch_size': 32, 'dropout_rate': 0.49114932858145566, 'prior_mu': -0.021351260416700824, 'prior_sigma': 0.06248541081434506, 'normalization': 'layer'}. Best is trial 272 with value: 0.5198344707489013.
Generating morgan fingerprints...
Generated fingerprints with 1024 features for 900 molecules
Data shape: X=(900, 1024), y=(900,)
Trial 484: 5-fold CV loss = 0.6085
[I 2025-08-07 18:19:28,351] Trial 484 finished with value: 0.6085178315639496 and parameters: {'fp_type': 'morgan', 'morgan_only_radius': 2, 'morgan_only_nBits': 1024, 'num_hidden_layers': 3, 'hidden_dim_0': 512, 'hidden_dim_1': 128, 'hidden_dim_2': 512, 'kl_weight': 0.006207246810642472, 'lr': 0.0019651393093234656, 'batch_size': 32, 'dropout_rate': 0.48137757277984833, 'prior_mu': -0.02798816325913845, 'prior_sigma': 0.07561814519592219, 'normalization': 'none'}. Best is trial 272 with value: 0.5198344707489013.
Generating morgan fingerprints...
Generated fingerprints with 1024 features for 900 molecules
Data shape: X=(900, 1024), y=(900,)
Trial 491: 5-fold CV loss = 0.5408
[I 2025-08-07 18:19:34,861] Trial 491 finished with value: 0.5407784044742584 and parameters: {'fp_type': 'morgan', 'morgan_only_radius': 2, 'morgan_only_nBits': 1024, 'num_hidden_layers': 3, 'hidden_dim_0': 512, 'hidden_dim_1': 128, 'hidden_dim_2': 512, 'kl_weight': 0.0049252130521967585, 'lr': 0.0013527030925800992, 'batch_size': 32, 'dropout_rate': 0.49197242753969583, 'prior_mu': -0.02236684721231993, 'prior_sigma': 0.06363681245449435, 'normalization': 'layer'}. Best is trial 272 with value: 0.5198344707489013.
Generating morgan fingerprints...
Generated fingerprints with 1024 features for 900 molecules
Data shape: X=(900, 1024), y=(900,)
Trial 490: 5-fold CV loss = 0.6480
[I 2025-08-07 18:19:42,840] Trial 490 finished with value: 0.6480088591575622 and parameters: {'fp_type': 'morgan', 'morgan_only_radius': 2, 'morgan_only_nBits': 1024, 'num_hidden_layers': 3, 'hidden_dim_0': 512, 'hidden_dim_1': 128, 'hidden_dim_2': 512, 'kl_weight': 0.003493310850325766, 'lr': 0.001653733301721935, 'batch_size': 32, 'dropout_rate': 0.4510973608960507, 'prior_mu': 0.04150281213267629, 'prior_sigma': 0.06479098579490837, 'normalization': 'none'}. Best is trial 272 with value: 0.5198344707489013.
Generating morgan fingerprints...
Generated fingerprints with 1024 features for 900 molecules
Data shape: X=(900, 1024), y=(900,)
Trial 495: 5-fold CV loss = 0.6074
[I 2025-08-07 18:20:15,771] Trial 495 finished with value: 0.6073932886123657 and parameters: {'fp_type': 'morgan', 'morgan_only_radius': 2, 'morgan_only_nBits': 1024, 'num_hidden_layers': 3, 'hidden_dim_0': 1024, 'hidden_dim_1': 128, 'hidden_dim_2': 64, 'kl_weight': 0.003699056561099401, 'lr': 0.002610218753342583, 'batch_size': 32, 'dropout_rate': 0.499757279136728, 'prior_mu': -0.010482020245622293, 'prior_sigma': 0.057748173234092634, 'normalization': 'none'}. Best is trial 272 with value: 0.5198344707489013.
Generating morgan fingerprints...
Generated fingerprints with 1024 features for 900 molecules
Data shape: X=(900, 1024), y=(900,)
Trial 493: 5-fold CV loss = 0.5323
