[I 2025-08-08 06:11:35,924] Trial 2487 finished with value: 0.6798899173736572 and parameters: {'fp_type': 'morgan', 'morgan_only_radius': 2, 'morgan_only_nBits': 2048, 'num_hidden_layers': 0, 'kl_weight': 0.0006460977306880749, 'lr': 0.0017611612260052282, 'batch_size': 32, 'dropout_rate': 0.23436404580365508, 'prior_mu': 0.05820914035311857, 'prior_sigma': 0.0756638116377927, 'normalization': 'none'}. Best is trial 2426 with value: 0.515486741065979.
Generating morgan fingerprints...
Generated fingerprints with 2048 features for 900 molecules
Data shape: X=(900, 2048), y=(900,)
Trial 2489: 5-fold CV loss = 0.5445
[I 2025-08-08 06:12:08,268] Trial 2489 finished with value: 0.5444704413414001 and parameters: {'fp_type': 'morgan', 'morgan_only_radius': 2, 'morgan_only_nBits': 2048, 'num_hidden_layers': 3, 'hidden_dim_0': 512, 'hidden_dim_1': 128, 'hidden_dim_2': 1024, 'kl_weight': 0.00023938707033721273, 'lr': 0.0031518207491175758, 'batch_size': 32, 'dropout_rate': 0.41975148505528354, 'prior_mu': 0.06140949311482738, 'prior_sigma': 0.0791416927106379, 'normalization': 'none'}. Best is trial 2426 with value: 0.515486741065979.
Generating morgan fingerprints...
Generated fingerprints with 2048 features for 900 molecules
Data shape: X=(900, 2048), y=(900,)
Trial 2471: 5-fold CV loss = 0.5253
[I 2025-08-08 06:12:15,508] Trial 2471 finished with value: 0.5253249347209931 and parameters: {'fp_type': 'morgan', 'morgan_only_radius': 2, 'morgan_only_nBits': 2048, 'num_hidden_layers': 3, 'hidden_dim_0': 512, 'hidden_dim_1': 128, 'hidden_dim_2': 512, 'kl_weight': 0.000271700023049977, 'lr': 0.0020865656737340177, 'batch_size': 32, 'dropout_rate': 0.4264139506877902, 'prior_mu': 0.11462267851182842, 'prior_sigma': 0.0760230953789784, 'normalization': 'none'}. Best is trial 2426 with value: 0.515486741065979.
Generating morgan fingerprints...
Generated fingerprints with 2048 features for 900 molecules
Data shape: X=(900, 2048), y=(900,)
Trial 2490: 5-fold CV loss = 0.5350
[I 2025-08-08 06:12:41,327] Trial 2490 finished with value: 0.5349780917167664 and parameters: {'fp_type': 'morgan', 'morgan_only_radius': 2, 'morgan_only_nBits': 2048, 'num_hidden_layers': 3, 'hidden_dim_0': 512, 'hidden_dim_1': 128, 'hidden_dim_2': 512, 'kl_weight': 0.00019540752905027693, 'lr': 0.0031563121517443693, 'batch_size': 32, 'dropout_rate': 0.40625602506630254, 'prior_mu': 0.042103841390757235, 'prior_sigma': 0.08020671979656953, 'normalization': 'none'}. Best is trial 2426 with value: 0.515486741065979.
Generating morgan fingerprints...
Generated fingerprints with 2048 features for 900 molecules
Data shape: X=(900, 2048), y=(900,)
Trial 2488: 5-fold CV loss = 0.5291
[I 2025-08-08 06:12:47,784] Trial 2488 finished with value: 0.5291430592536926 and parameters: {'fp_type': 'morgan', 'morgan_only_radius': 2, 'morgan_only_nBits': 2048, 'num_hidden_layers': 3, 'hidden_dim_0': 512, 'hidden_dim_1': 128, 'hidden_dim_2': 512, 'kl_weight': 0.0002549447524898091, 'lr': 0.0031397162765575953, 'batch_size': 32, 'dropout_rate': 0.4091890556200806, 'prior_mu': 0.061532824316263564, 'prior_sigma': 0.08004522432863019, 'normalization': 'none'}. Best is trial 2426 with value: 0.515486741065979.
Generating morgan fingerprints...
Generated fingerprints with 2048 features for 900 molecules
Data shape: X=(900, 2048), y=(900,)
Trial 2491: 5-fold CV loss = 0.5407
[I 2025-08-08 06:12:58,504] Trial 2491 finished with value: 0.5407067000865936 and parameters: {'fp_type': 'morgan', 'morgan_only_radius': 2, 'morgan_only_nBits': 2048, 'num_hidden_layers': 3, 'hidden_dim_0': 512, 'hidden_dim_1': 128, 'hidden_dim_2': 512, 'kl_weight': 0.00038270801734097484, 'lr': 0.002459689082838413, 'batch_size': 32, 'dropout_rate': 0.4055118503773987, 'prior_mu': 0.04179449861885975, 'prior_sigma': 0.06609370329520835, 'normalization': 'layer'}. Best is trial 2426 with value: 0.515486741065979.
Generating morgan fingerprints...
Generated fingerprints with 2048 features for 900 molecules
Data shape: X=(900, 2048), y=(900,)
Trial 2495: 5-fold CV loss = 0.7512
[I 2025-08-08 06:13:43,765] Trial 2495 finished with value: 0.7512449383735657 and parameters: {'fp_type': 'morgan', 'morgan_only_radius': 2, 'morgan_only_nBits': 2048, 'num_hidden_layers': 3, 'hidden_dim_0': 512, 'hidden_dim_1': 128, 'hidden_dim_2': 256, 'kl_weight': 0.0001130240463927024, 'lr': 0.001058882923369797, 'batch_size': 32, 'dropout_rate': 0.46034278408794693, 'prior_mu': 0.051072664158150066, 'prior_sigma': 0.0693518197415484, 'normalization': 'none'}. Best is trial 2426 with value: 0.515486741065979.
Generating morgan fingerprints...
Generated fingerprints with 2048 features for 900 molecules
Data shape: X=(900, 2048), y=(900,)
Trial 2493: 5-fold CV loss = 0.5377
[I 2025-08-08 06:13:47,416] Trial 2493 finished with value: 0.5376641869544982 and parameters: {'fp_type': 'morgan', 'morgan_only_radius': 2, 'morgan_only_nBits': 2048, 'num_hidden_layers': 3, 'hidden_dim_0': 64, 'hidden_dim_1': 128, 'hidden_dim_2': 512, 'kl_weight': 0.00039604543330754087, 'lr': 0.0024521134561188624, 'batch_size': 32, 'dropout_rate': 0.4430146674730355, 'prior_mu': 0.04398982046330521, 'prior_sigma': 0.06677457179778705, 'normalization': 'layer'}. Best is trial 2426 with value: 0.515486741065979.
Generating morgan fingerprints...
Generated fingerprints with 2048 features for 900 molecules
Data shape: X=(900, 2048), y=(900,)
Trial 2494: 5-fold CV loss = 0.5411
[I 2025-08-08 06:14:09,647] Trial 2494 finished with value: 0.5411283314228058 and parameters: {'fp_type': 'morgan', 'morgan_only_radius': 2, 'morgan_only_nBits': 2048, 'num_hidden_layers': 3, 'hidden_dim_0': 512, 'hidden_dim_1': 128, 'hidden_dim_2': 256, 'kl_weight': 0.0004888191601668284, 'lr': 0.0024363281655695517, 'batch_size': 32, 'dropout_rate': 0.44581259013215196, 'prior_mu': 0.04285155909054285, 'prior_sigma': 0.06866725905410768, 'normalization': 'layer'}. Best is trial 2426 with value: 0.515486741065979.
Generating morgan fingerprints...
Generated fingerprints with 2048 features for 900 molecules
Data shape: X=(900, 2048), y=(900,)
Trial 2496: 5-fold CV loss = 0.5591
[I 2025-08-08 06:14:41,385] Trial 2496 finished with value: 0.5590795338153839 and parameters: {'fp_type': 'morgan', 'morgan_only_radius': 2, 'morgan_only_nBits': 2048, 'num_hidden_layers': 3, 'hidden_dim_0': 64, 'hidden_dim_1': 64, 'hidden_dim_2': 512, 'kl_weight': 0.0006846676140238382, 'lr': 0.001975654872570644, 'batch_size': 32, 'dropout_rate': 0.38840168606011416, 'prior_mu': 0.04634677948049024, 'prior_sigma': 0.07086730410758034, 'normalization': 'none'}. Best is trial 2426 with value: 0.515486741065979.
Generating morgan fingerprints...
Generated fingerprints with 2048 features for 900 molecules
Data shape: X=(900, 2048), y=(900,)
Trial 2499: 5-fold CV loss = 0.6728
[I 2025-08-08 06:14:52,292] Trial 2499 finished with value: 0.6727802395820618 and parameters: {'fp_type': 'morgan', 'morgan_only_radius': 2, 'morgan_only_nBits': 2048, 'num_hidden_layers': 3, 'hidden_dim_0': 1024, 'hidden_dim_1': 128, 'hidden_dim_2': 512, 'kl_weight': 0.000582068892773599, 'lr': 0.001490982497182977, 'batch_size': 128, 'dropout_rate': 0.089877218717689, 'prior_mu': 0.05506561645438531, 'prior_sigma': 0.06377707347360927, 'normalization': 'none'}. Best is trial 2426 with value: 0.515486741065979.
Generating morgan fingerprints...
Generated fingerprints with 2048 features for 900 molecules
Data shape: X=(900, 2048), y=(900,)
Trial 2497: 5-fold CV loss = 0.5232
[I 2025-08-08 06:15:23,389] Trial 2497 finished with value: 0.5231507182121277 and parameters: {'fp_type': 'morgan', 'morgan_only_radius': 2, 'morgan_only_nBits': 2048, 'num_hidden_layers': 3, 'hidden_dim_0': 1024, 'hidden_dim_1': 64, 'hidden_dim_2': 512, 'kl_weight': 0.0004984547138621197, 'lr': 0.0015643569810011252, 'batch_size': 32, 'dropout_rate': 0.3889056366110144, 'prior_mu': 0.05107115640321307, 'prior_sigma': 0.07136007901854179, 'normalization': 'none'}. Best is trial 2426 with value: 0.515486741065979.
Generating morgan fingerprints...
Generated fingerprints with 2048 features for 900 molecules
Data shape: X=(900, 2048), y=(900,)
Trial 2492: 5-fold CV loss = 0.5349
[I 2025-08-08 06:15:41,119] Trial 2492 finished with value: 0.5349370658397674 and parameters: {'fp_type': 'morgan', 'morgan_only_radius': 2, 'morgan_only_nBits': 2048, 'num_hidden_layers': 3, 'hidden_dim_0': 64, 'hidden_dim_1': 128, 'hidden_dim_2': 512, 'kl_weight': 0.00011614880713852019, 'lr': 0.002471429501614986, 'batch_size': 32, 'dropout_rate': 0.40864147465667056, 'prior_mu': 0.041866783801562175, 'prior_sigma': 0.06938401540482908, 'normalization': 'layer'}. Best is trial 2426 with value: 0.515486741065979.
Generating morgan fingerprints...
Generated fingerprints with 2048 features for 900 molecules
Data shape: X=(900, 2048), y=(900,)
Trial 2498: 5-fold CV loss = 0.5743
[I 2025-08-08 06:16:01,365] Trial 2498 finished with value: 0.5743130683898926 and parameters: {'fp_type': 'morgan', 'morgan_only_radius': 2, 'morgan_only_nBits': 2048, 'num_hidden_layers': 3, 'hidden_dim_0': 1024, 'hidden_dim_1': 64, 'hidden_dim_2': 512, 'kl_weight': 0.0006904734654690809, 'lr': 0.0015995014326932652, 'batch_size': 32, 'dropout_rate': 0.3869344798634856, 'prior_mu': 0.05356933489863462, 'prior_sigma': 0.07227623188326236, 'normalization': 'none'}. Best is trial 2426 with value: 0.515486741065979.
Generating morgan_rdkit fingerprints...
Generated fingerprints with 1536 features for 900 molecules
Data shape: X=(900, 1536), y=(900,)
Trial 2500: 5-fold CV loss = 0.5737
[I 2025-08-08 06:16:05,424] Trial 2500 finished with value: 0.5736790478229523 and parameters: {'fp_type': 'morgan', 'morgan_only_radius': 2, 'morgan_only_nBits': 2048, 'num_hidden_layers': 3, 'hidden_dim_0': 128, 'hidden_dim_1': 64, 'hidden_dim_2': 512, 'kl_weight': 0.0006568982055123293, 'lr': 0.0015664867906351907, 'batch_size': 32, 'dropout_rate': 0.4199063232582934, 'prior_mu': 0.038427277570244736, 'prior_sigma': 0.07154780685086218, 'normalization': 'none'}. Best is trial 2426 with value: 0.515486741065979.
Generating morgan_rdkit fingerprints...
Generated fingerprints with 1536 features for 900 molecules
Data shape: X=(900, 1536), y=(900,)
Trial 2501: 5-fold CV loss = 0.5276
[I 2025-08-08 06:16:35,485] Trial 2501 finished with value: 0.5276490092277527 and parameters: {'fp_type': 'morgan', 'morgan_only_radius': 2, 'morgan_only_nBits': 2048, 'num_hidden_layers': 3, 'hidden_dim_0': 512, 'hidden_dim_1': 128, 'hidden_dim_2': 256, 'kl_weight': 0.00016140888328877584, 'lr': 0.002791249278667278, 'batch_size': 32, 'dropout_rate': 0.4204260383783585, 'prior_mu': 0.06495992242276707, 'prior_sigma': 0.05941168353417845, 'normalization': 'none'}. Best is trial 2426 with value: 0.515486741065979.
Generating morgan_rdkit fingerprints...
Generated fingerprints with 1536 features for 900 molecules
Data shape: X=(900, 1536), y=(900,)
Trial 2504: 5-fold CV loss = 0.5706
[I 2025-08-08 06:16:52,731] Trial 2504 finished with value: 0.5705533981323242 and parameters: {'fp_type': 'morgan_rdkit', 'combined_morgan_radius': 2, 'combined_morgan_nBits': 1024, 'combined_rdkit_maxPath': 6, 'combined_rdkit_nBits': 512, 'num_hidden_layers': 3, 'hidden_dim_0': 512, 'hidden_dim_1': 128, 'hidden_dim_2': 256, 'kl_weight': 0.0001602836855617059, 'lr': 0.0021717462069185353, 'batch_size': 32, 'dropout_rate': 0.06445173784438979, 'prior_mu': 0.06602620254725569, 'prior_sigma': 0.057719217154123655, 'normalization': 'none'}. Best is trial 2426 with value: 0.515486741065979.
Generating morgan fingerprints...
Generated fingerprints with 2048 features for 900 molecules
Data shape: X=(900, 2048), y=(900,)
Trial 2505: 5-fold CV loss = 0.9669
[I 2025-08-08 06:17:59,310] Trial 2505 finished with value: 0.9668727159500122 and parameters: {'fp_type': 'morgan_rdkit', 'combined_morgan_radius': 2, 'combined_morgan_nBits': 1024, 'combined_rdkit_maxPath': 6, 'combined_rdkit_nBits': 512, 'num_hidden_layers': 3, 'hidden_dim_0': 512, 'hidden_dim_1': 128, 'hidden_dim_2': 256, 'kl_weight': 0.0005939975195608426, 'lr': 0.0021759527225121505, 'batch_size': 32, 'dropout_rate': 0.4358064534712308, 'prior_mu': 0.028235943878244126, 'prior_sigma': 0.16860233913021688, 'normalization': 'none'}. Best is trial 2426 with value: 0.515486741065979.
Generating morgan fingerprints...
Generated fingerprints with 2048 features for 900 molecules
Data shape: X=(900, 2048), y=(900,)
Trial 2506: 5-fold CV loss = 0.5355
[I 2025-08-08 06:18:28,402] Trial 2506 finished with value: 0.5355029761791229 and parameters: {'fp_type': 'morgan', 'morgan_only_radius': 2, 'morgan_only_nBits': 2048, 'num_hidden_layers': 3, 'hidden_dim_0': 512, 'hidden_dim_1': 128, 'hidden_dim_2': 512, 'kl_weight': 0.0005776889364759652, 'lr': 0.0019119348761640325, 'batch_size': 32, 'dropout_rate': 0.46297609931738243, 'prior_mu': 0.02970907328076789, 'prior_sigma': 0.11379826087775297, 'normalization': 'none'}. Best is trial 2426 with value: 0.515486741065979.
Generating morgan fingerprints...
Generated fingerprints with 2048 features for 900 molecules
Data shape: X=(900, 2048), y=(900,)
Trial 2503: 5-fold CV loss = 0.5415
[I 2025-08-08 06:18:35,726] Trial 2503 finished with value: 0.5414620697498321 and parameters: {'fp_type': 'morgan_rdkit', 'combined_morgan_radius': 2, 'combined_morgan_nBits': 1024, 'combined_rdkit_maxPath': 6, 'combined_rdkit_nBits': 512, 'num_hidden_layers': 3, 'hidden_dim_0': 512, 'hidden_dim_1': 128, 'hidden_dim_2': 256, 'kl_weight': 0.0005775675896991292, 'lr': 0.0027709271783195005, 'batch_size': 32, 'dropout_rate': 0.42132472619903955, 'prior_mu': 0.06614495100979031, 'prior_sigma': 0.05859146657605809, 'normalization': 'none'}. Best is trial 2426 with value: 0.515486741065979.
Generating morgan fingerprints...
Generated fingerprints with 2048 features for 900 molecules
Data shape: X=(900, 2048), y=(900,)
Trial 2502: 5-fold CV loss = 0.5409
[I 2025-08-08 06:18:49,231] Trial 2502 finished with value: 0.540903902053833 and parameters: {'fp_type': 'morgan', 'morgan_only_radius': 2, 'morgan_only_nBits': 2048, 'num_hidden_layers': 3, 'hidden_dim_0': 512, 'hidden_dim_1': 128, 'hidden_dim_2': 256, 'kl_weight': 0.00015762705427084823, 'lr': 0.0028340373468393448, 'batch_size': 32, 'dropout_rate': 0.4191831979572196, 'prior_mu': 0.06506437670941223, 'prior_sigma': 0.1167144681410483, 'normalization': 'none'}. Best is trial 2426 with value: 0.515486741065979.
Generating morgan fingerprints...
Generated fingerprints with 2048 features for 900 molecules
Data shape: X=(900, 2048), y=(900,)
Trial 2507: 5-fold CV loss = 0.5680
[I 2025-08-08 06:19:20,210] Trial 2507 finished with value: 0.5679758965969086 and parameters: {'fp_type': 'morgan', 'morgan_only_radius': 2, 'morgan_only_nBits': 2048, 'num_hidden_layers': 3, 'hidden_dim_0': 512, 'hidden_dim_1': 128, 'hidden_dim_2': 512, 'kl_weight': 0.0004294550922019519, 'lr': 0.0018941898906436763, 'batch_size': 32, 'dropout_rate': 0.46175386527309725, 'prior_mu': 0.03480867804542912, 'prior_sigma': 0.06470147235916675, 'normalization': 'none'}. Best is trial 2426 with value: 0.515486741065979.
Generating morgan fingerprints...
Generated fingerprints with 2048 features for 900 molecules
Data shape: X=(900, 2048), y=(900,)
Trial 2508: 5-fold CV loss = 0.6313
[I 2025-08-08 06:19:36,601] Trial 2508 finished with value: 0.6313045799732209 and parameters: {'fp_type': 'morgan', 'morgan_only_radius': 2, 'morgan_only_nBits': 2048, 'num_hidden_layers': 3, 'hidden_dim_0': 512, 'hidden_dim_1': 256, 'hidden_dim_2': 512, 'kl_weight': 0.00045226859402828986, 'lr': 0.0017877914230538003, 'batch_size': 32, 'dropout_rate': 0.452130913482248, 'prior_mu': 0.03656607804996364, 'prior_sigma': 0.06461087888798281, 'normalization': 'none'}. Best is trial 2426 with value: 0.515486741065979.
Generating morgan fingerprints...
Generated fingerprints with 2048 features for 900 molecules
Data shape: X=(900, 2048), y=(900,)
Trial 2510: 5-fold CV loss = 0.7243
[I 2025-08-08 06:19:46,825] Trial 2510 finished with value: 0.7243247389793396 and parameters: {'fp_type': 'morgan', 'morgan_only_radius': 2, 'morgan_only_nBits': 2048, 'num_hidden_layers': 1, 'hidden_dim_0': 512, 'kl_weight': 0.0004510521418305064, 'lr': 0.002005485057182341, 'batch_size': 32, 'dropout_rate': 0.4526316109854022, 'prior_mu': 0.03645239700190889, 'prior_sigma': 0.0642148063590855, 'normalization': 'none'}. Best is trial 2426 with value: 0.515486741065979.
Generating morgan fingerprints...
Generated fingerprints with 2048 features for 900 molecules
Data shape: X=(900, 2048), y=(900,)
Trial 2509: 5-fold CV loss = 0.7044
[I 2025-08-08 06:19:54,473] Trial 2509 finished with value: 0.7044310510158539 and parameters: {'fp_type': 'morgan', 'morgan_only_radius': 2, 'morgan_only_nBits': 2048, 'num_hidden_layers': 3, 'hidden_dim_0': 512, 'hidden_dim_1': 256, 'hidden_dim_2': 512, 'kl_weight': 0.000447811050127625, 'lr': 0.0018014467371834093, 'batch_size': 32, 'dropout_rate': 0.4502565309152895, 'prior_mu': 0.036135839626708174, 'prior_sigma': 0.06419542535988704, 'normalization': 'none'}. Best is trial 2426 with value: 0.515486741065979.
Generating morgan fingerprints...
Generated fingerprints with 2048 features for 900 molecules
Data shape: X=(900, 2048), y=(900,)
Trial 2511: 5-fold CV loss = 0.5311
[I 2025-08-08 06:20:42,251] Trial 2511 finished with value: 0.5310634315013886 and parameters: {'fp_type': 'morgan', 'morgan_only_radius': 2, 'morgan_only_nBits': 2048, 'num_hidden_layers': 3, 'hidden_dim_0': 512, 'hidden_dim_1': 64, 'hidden_dim_2': 512, 'kl_weight': 0.0007124656976785251, 'lr': 0.0021260564608577164, 'batch_size': 32, 'dropout_rate': 0.45087517921016773, 'prior_mu': 0.05137565890062832, 'prior_sigma': 0.08355125726248994, 'normalization': 'none'}. Best is trial 2426 with value: 0.515486741065979.
Generating morgan fingerprints...
Generated fingerprints with 2048 features for 900 molecules
Data shape: X=(900, 2048), y=(900,)
Trial 2514: 5-fold CV loss = 0.6948
[I 2025-08-08 06:20:44,696] Trial 2514 finished with value: 0.6948190569877625 and parameters: {'fp_type': 'morgan', 'morgan_only_radius': 2, 'morgan_only_nBits': 2048, 'num_hidden_layers': 3, 'hidden_dim_0': 256, 'hidden_dim_1': 64, 'hidden_dim_2': 512, 'kl_weight': 0.0007075130826285059, 'lr': 0.0022974341746853037, 'batch_size': 64, 'dropout_rate': 0.44037881084059327, 'prior_mu': 0.050818128886837316, 'prior_sigma': 0.08772689599234915, 'normalization': 'none'}. Best is trial 2426 with value: 0.515486741065979.
Generating morgan fingerprints...
Generated fingerprints with 2048 features for 900 molecules
Data shape: X=(900, 2048), y=(900,)
Trial 2512: 5-fold CV loss = 0.5396
[I 2025-08-08 06:20:51,529] Trial 2512 finished with value: 0.5395881533622742 and parameters: {'fp_type': 'morgan', 'morgan_only_radius': 2, 'morgan_only_nBits': 2048, 'num_hidden_layers': 3, 'hidden_dim_0': 256, 'hidden_dim_1': 64, 'hidden_dim_2': 512, 'kl_weight': 0.0006921134909610416, 'lr': 0.002089695267515522, 'batch_size': 32, 'dropout_rate': 0.44195046548546946, 'prior_mu': 0.05297146275296976, 'prior_sigma': 0.08867807090304815, 'normalization': 'none'}. Best is trial 2426 with value: 0.515486741065979.
Generating morgan fingerprints...
Generated fingerprints with 2048 features for 900 molecules
Data shape: X=(900, 2048), y=(900,)
Trial 2515: 5-fold CV loss = 0.8327
[I 2025-08-08 06:21:16,066] Trial 2515 finished with value: 0.832736998796463 and parameters: {'fp_type': 'morgan', 'morgan_only_radius': 2, 'morgan_only_nBits': 2048, 'num_hidden_layers': 3, 'hidden_dim_0': 512, 'hidden_dim_1': 128, 'hidden_dim_2': 512, 'kl_weight': 0.0007171815263971671, 'lr': 0.002255471646222163, 'batch_size': 64, 'dropout_rate': 0.4303819726481103, 'prior_mu': 0.05628133989038285, 'prior_sigma': 0.07840696394491276, 'normalization': 'none'}. Best is trial 2426 with value: 0.515486741065979.
Generating morgan fingerprints...
Generated fingerprints with 2048 features for 900 molecules
Data shape: X=(900, 2048), y=(900,)
Trial 2516: 5-fold CV loss = 0.8141
[I 2025-08-08 06:21:41,407] Trial 2516 finished with value: 0.8141461968421936 and parameters: {'fp_type': 'morgan', 'morgan_only_radius': 2, 'morgan_only_nBits': 2048, 'num_hidden_layers': 3, 'hidden_dim_0': 512, 'hidden_dim_1': 128, 'hidden_dim_2': 512, 'kl_weight': 0.0005187172574467461, 'lr': 0.0002412108647756641, 'batch_size': 32, 'dropout_rate': 0.428581741525829, 'prior_mu': 0.05838302018073088, 'prior_sigma': 0.06777824034859192, 'normalization': 'none'}. Best is trial 2426 with value: 0.515486741065979.
Generating morgan fingerprints...
Generated fingerprints with 2048 features for 900 molecules
Data shape: X=(900, 2048), y=(900,)
Trial 2517: 5-fold CV loss = 0.5206
[I 2025-08-08 06:21:58,326] Trial 2517 finished with value: 0.5205875515937806 and parameters: {'fp_type': 'morgan', 'morgan_only_radius': 2, 'morgan_only_nBits': 2048, 'num_hidden_layers': 3, 'hidden_dim_0': 512, 'hidden_dim_1': 128, 'hidden_dim_2': 512, 'kl_weight': 0.0005200022619256086, 'lr': 0.0026001077652006333, 'batch_size': 32, 'dropout_rate': 0.43039618624362036, 'prior_mu': 0.057311161971086585, 'prior_sigma': 0.07755474210526084, 'normalization': 'none'}. Best is trial 2426 with value: 0.515486741065979.
Generating morgan fingerprints...
Generated fingerprints with 2048 features for 900 molecules
Data shape: X=(900, 2048), y=(900,)
Trial 2518: 5-fold CV loss = 0.5351
