[I 2025-08-07 16:35:35,020] Trial 207 finished with value: 0.5384355306625366 and parameters: {'fp_type': 'morgan', 'morgan_only_radius': 2, 'morgan_only_nBits': 1024, 'num_hidden_layers': 3, 'hidden_dim_0': 512, 'hidden_dim_1': 128, 'hidden_dim_2': 1024, 'kl_weight': 0.0004442194774262077, 'lr': 0.003005077231760949, 'batch_size': 64, 'dropout_rate': 0.375466761823458, 'prior_mu': 0.12163915881819765, 'prior_sigma': 0.057857980926112246, 'normalization': 'none'}. Best is trial 200 with value: 0.5292435944080353.
Generating morgan fingerprints...
Generated fingerprints with 1024 features for 900 molecules
Data shape: X=(900, 1024), y=(900,)
Trial 209: 5-fold CV loss = 0.5402
[I 2025-08-07 16:36:05,905] Trial 209 finished with value: 0.5401621580123901 and parameters: {'fp_type': 'morgan', 'morgan_only_radius': 2, 'morgan_only_nBits': 1024, 'num_hidden_layers': 3, 'hidden_dim_0': 512, 'hidden_dim_1': 128, 'hidden_dim_2': 1024, 'kl_weight': 0.0005016382015197929, 'lr': 0.002967961131831034, 'batch_size': 64, 'dropout_rate': 0.3676381036800709, 'prior_mu': 0.12206894016789832, 'prior_sigma': 0.05905312227787781, 'normalization': 'none'}. Best is trial 200 with value: 0.5292435944080353.
Generating morgan fingerprints...
Generated fingerprints with 1024 features for 900 molecules
Data shape: X=(900, 1024), y=(900,)
Trial 210: 5-fold CV loss = 0.5386
[I 2025-08-07 16:36:18,195] Trial 210 finished with value: 0.5385635912418365 and parameters: {'fp_type': 'morgan', 'morgan_only_radius': 2, 'morgan_only_nBits': 1024, 'num_hidden_layers': 3, 'hidden_dim_0': 512, 'hidden_dim_1': 128, 'hidden_dim_2': 1024, 'kl_weight': 0.0005065516616874842, 'lr': 0.0025424835501445336, 'batch_size': 64, 'dropout_rate': 0.4021270662545073, 'prior_mu': 0.12679157766085014, 'prior_sigma': 0.056870243553114874, 'normalization': 'layer'}. Best is trial 200 with value: 0.5292435944080353.
Generating morgan fingerprints...
Generated fingerprints with 1024 features for 900 molecules
Data shape: X=(900, 1024), y=(900,)
Trial 204: 5-fold CV loss = 0.5485
[I 2025-08-07 16:36:20,263] Trial 204 finished with value: 0.5484527111053467 and parameters: {'fp_type': 'morgan', 'morgan_only_radius': 2, 'morgan_only_nBits': 1024, 'num_hidden_layers': 3, 'hidden_dim_0': 512, 'hidden_dim_1': 128, 'hidden_dim_2': 1024, 'kl_weight': 0.00045568187035400885, 'lr': 0.002613597532504571, 'batch_size': 64, 'dropout_rate': 0.3724652337430317, 'prior_mu': 0.12666020105694517, 'prior_sigma': 0.059593822470127886, 'normalization': 'none'}. Best is trial 200 with value: 0.5292435944080353.
Generating morgan fingerprints...
Generated fingerprints with 1024 features for 900 molecules
Data shape: X=(900, 1024), y=(900,)
Trial 208: 5-fold CV loss = 0.5270
[I 2025-08-07 16:36:41,365] Trial 208 finished with value: 0.5269739389419555 and parameters: {'fp_type': 'morgan', 'morgan_only_radius': 2, 'morgan_only_nBits': 1024, 'num_hidden_layers': 3, 'hidden_dim_0': 512, 'hidden_dim_1': 128, 'hidden_dim_2': 1024, 'kl_weight': 0.0003979014992763915, 'lr': 0.002759970629125937, 'batch_size': 64, 'dropout_rate': 0.49975093399199777, 'prior_mu': 0.11990545074932793, 'prior_sigma': 0.0579946644142903, 'normalization': 'none'}. Best is trial 208 with value: 0.5269739389419555.
Generating morgan fingerprints...
Generated fingerprints with 1024 features for 900 molecules
Data shape: X=(900, 1024), y=(900,)
Trial 211: 5-fold CV loss = 0.5547
[I 2025-08-07 16:36:44,046] Trial 211 finished with value: 0.5547335028648377 and parameters: {'fp_type': 'morgan', 'morgan_only_radius': 2, 'morgan_only_nBits': 1024, 'num_hidden_layers': 3, 'hidden_dim_0': 512, 'hidden_dim_1': 128, 'hidden_dim_2': 1024, 'kl_weight': 0.00047105952705327967, 'lr': 0.0027451318909591524, 'batch_size': 64, 'dropout_rate': 0.3506605952689093, 'prior_mu': 0.12613477900190403, 'prior_sigma': 0.048012540054889565, 'normalization': 'none'}. Best is trial 208 with value: 0.5269739389419555.
Generating morgan fingerprints...
Generated fingerprints with 1024 features for 900 molecules
Data shape: X=(900, 1024), y=(900,)
Trial 212: 5-fold CV loss = 0.5607
[I 2025-08-07 16:36:53,366] Trial 212 finished with value: 0.5606818974018097 and parameters: {'fp_type': 'morgan', 'morgan_only_radius': 2, 'morgan_only_nBits': 1024, 'num_hidden_layers': 3, 'hidden_dim_0': 512, 'hidden_dim_1': 128, 'hidden_dim_2': 1024, 'kl_weight': 0.00041932376255598064, 'lr': 0.0022060482270083222, 'batch_size': 64, 'dropout_rate': 0.34403520262309717, 'prior_mu': 0.1491378937608836, 'prior_sigma': 0.046128762241864484, 'normalization': 'none'}. Best is trial 208 with value: 0.5269739389419555.
Generating morgan fingerprints...
Generated fingerprints with 1024 features for 900 molecules
Data shape: X=(900, 1024), y=(900,)
Trial 215: 5-fold CV loss = 0.6987
[I 2025-08-07 16:37:01,280] Trial 215 finished with value: 0.6986681461334229 and parameters: {'fp_type': 'morgan', 'morgan_only_radius': 2, 'morgan_only_nBits': 1024, 'num_hidden_layers': 3, 'hidden_dim_0': 512, 'hidden_dim_1': 128, 'hidden_dim_2': 1024, 'kl_weight': 0.0003672066036866197, 'lr': 0.0021040033309126594, 'batch_size': 64, 'dropout_rate': 0.47842315360350224, 'prior_mu': 0.11440145479437192, 'prior_sigma': 0.05304044430372234, 'normalization': 'none'}. Best is trial 208 with value: 0.5269739389419555.
Generating morgan fingerprints...
Generated fingerprints with 1024 features for 900 molecules
Data shape: X=(900, 1024), y=(900,)
Trial 216: 5-fold CV loss = 0.5386
[I 2025-08-07 16:37:27,989] Trial 216 finished with value: 0.5386306881904602 and parameters: {'fp_type': 'morgan', 'morgan_only_radius': 2, 'morgan_only_nBits': 1024, 'num_hidden_layers': 3, 'hidden_dim_0': 512, 'hidden_dim_1': 128, 'hidden_dim_2': 1024, 'kl_weight': 0.0003617630011092613, 'lr': 0.0035609725742812006, 'batch_size': 64, 'dropout_rate': 0.4815256332802859, 'prior_mu': 0.115589247619563, 'prior_sigma': 0.06400838395507219, 'normalization': 'none'}. Best is trial 208 with value: 0.5269739389419555.
Generating morgan fingerprints...
Generated fingerprints with 1024 features for 900 molecules
Data shape: X=(900, 1024), y=(900,)
Trial 217: 5-fold CV loss = 0.5525
[I 2025-08-07 16:37:31,339] Trial 217 finished with value: 0.5524704813957214 and parameters: {'fp_type': 'morgan', 'morgan_only_radius': 2, 'morgan_only_nBits': 1024, 'num_hidden_layers': 3, 'hidden_dim_0': 1024, 'hidden_dim_1': 128, 'hidden_dim_2': 1024, 'kl_weight': 0.0003674636121831925, 'lr': 0.003749343481632575, 'batch_size': 64, 'dropout_rate': 0.4896258720675825, 'prior_mu': 0.11646579300793729, 'prior_sigma': 0.06674851455644334, 'normalization': 'none'}. Best is trial 208 with value: 0.5269739389419555.
Generating morgan fingerprints...
Generated fingerprints with 1024 features for 900 molecules
Data shape: X=(900, 1024), y=(900,)
Trial 214: 5-fold CV loss = 0.5335
[I 2025-08-07 16:37:44,469] Trial 214 finished with value: 0.5335309624671936 and parameters: {'fp_type': 'morgan', 'morgan_only_radius': 2, 'morgan_only_nBits': 1024, 'num_hidden_layers': 3, 'hidden_dim_0': 512, 'hidden_dim_1': 128, 'hidden_dim_2': 1024, 'kl_weight': 0.0004113725103420687, 'lr': 0.003236029780063417, 'batch_size': 64, 'dropout_rate': 0.4796173297615263, 'prior_mu': 0.11187705173667298, 'prior_sigma': 0.04704493435500061, 'normalization': 'none'}. Best is trial 208 with value: 0.5269739389419555.
Generating morgan fingerprints...
Generated fingerprints with 1024 features for 900 molecules
Data shape: X=(900, 1024), y=(900,)
Trial 213: 5-fold CV loss = 0.5615
[I 2025-08-07 16:37:46,940] Trial 213 finished with value: 0.5614815652370453 and parameters: {'fp_type': 'morgan', 'morgan_only_radius': 2, 'morgan_only_nBits': 1024, 'num_hidden_layers': 3, 'hidden_dim_0': 1024, 'hidden_dim_1': 128, 'hidden_dim_2': 1024, 'kl_weight': 0.0003733033962196553, 'lr': 0.0027562384192788146, 'batch_size': 64, 'dropout_rate': 0.35342519840211317, 'prior_mu': 0.1492977034264009, 'prior_sigma': 0.04629736014236602, 'normalization': 'none'}. Best is trial 208 with value: 0.5269739389419555.
Generating morgan fingerprints...
Generated fingerprints with 1024 features for 900 molecules
Data shape: X=(900, 1024), y=(900,)
Trial 218: 5-fold CV loss = 0.5378
[I 2025-08-07 16:38:00,708] Trial 218 finished with value: 0.5378432929515838 and parameters: {'fp_type': 'morgan', 'morgan_only_radius': 2, 'morgan_only_nBits': 1024, 'num_hidden_layers': 3, 'hidden_dim_0': 1024, 'hidden_dim_1': 128, 'hidden_dim_2': 1024, 'kl_weight': 0.0003859076745348608, 'lr': 0.003111142300885213, 'batch_size': 64, 'dropout_rate': 0.48977046192281076, 'prior_mu': -0.011187013257154592, 'prior_sigma': 0.06369246996691781, 'normalization': 'none'}. Best is trial 208 with value: 0.5269739389419555.
Generating morgan fingerprints...
Generated fingerprints with 1024 features for 900 molecules
Data shape: X=(900, 1024), y=(900,)
Trial 219: 5-fold CV loss = 0.5320
[I 2025-08-07 16:38:11,947] Trial 219 finished with value: 0.5319788217544555 and parameters: {'fp_type': 'morgan', 'morgan_only_radius': 2, 'morgan_only_nBits': 1024, 'num_hidden_layers': 3, 'hidden_dim_0': 512, 'hidden_dim_1': 128, 'hidden_dim_2': 1024, 'kl_weight': 0.0003027953120905057, 'lr': 0.0032244039927482207, 'batch_size': 64, 'dropout_rate': 0.4908017438557636, 'prior_mu': 0.16816709774697408, 'prior_sigma': 0.05619388662250875, 'normalization': 'none'}. Best is trial 208 with value: 0.5269739389419555.
Generating morgan fingerprints...
Generated fingerprints with 1024 features for 900 molecules
Data shape: X=(900, 1024), y=(900,)
Trial 222: 5-fold CV loss = 0.6885
[I 2025-08-07 16:38:12,236] Trial 222 finished with value: 0.6885338068008423 and parameters: {'fp_type': 'morgan', 'morgan_only_radius': 2, 'morgan_only_nBits': 1024, 'num_hidden_layers': 2, 'hidden_dim_0': 512, 'hidden_dim_1': 128, 'kl_weight': 0.00030169906214189964, 'lr': 0.0031914955079722874, 'batch_size': 64, 'dropout_rate': 0.3915309548671264, 'prior_mu': 0.13298772559709385, 'prior_sigma': 0.054166028956398, 'normalization': 'none'}. Best is trial 208 with value: 0.5269739389419555.
Generating morgan fingerprints...
Generated fingerprints with 1024 features for 900 molecules
Data shape: X=(900, 1024), y=(900,)
Trial 223: 5-fold CV loss = 0.7441
[I 2025-08-07 16:38:27,196] Trial 223 finished with value: 0.7441140055656433 and parameters: {'fp_type': 'morgan', 'morgan_only_radius': 2, 'morgan_only_nBits': 1024, 'num_hidden_layers': 2, 'hidden_dim_0': 512, 'hidden_dim_1': 128, 'kl_weight': 0.00030610308230381985, 'lr': 0.002377927393948023, 'batch_size': 64, 'dropout_rate': 0.47124951991804004, 'prior_mu': 0.16802946753085748, 'prior_sigma': 0.05309349722590543, 'normalization': 'none'}. Best is trial 208 with value: 0.5269739389419555.
Generating morgan fingerprints...
Generated fingerprints with 1024 features for 900 molecules
Data shape: X=(900, 1024), y=(900,)
Trial 220: 5-fold CV loss = 0.5567
[I 2025-08-07 16:38:41,109] Trial 220 finished with value: 0.5567087471485138 and parameters: {'fp_type': 'morgan', 'morgan_only_radius': 2, 'morgan_only_nBits': 1024, 'num_hidden_layers': 3, 'hidden_dim_0': 512, 'hidden_dim_1': 128, 'hidden_dim_2': 1024, 'kl_weight': 0.0006075359136555286, 'lr': 0.002890911501617772, 'batch_size': 64, 'dropout_rate': 0.49117731837191553, 'prior_mu': 0.1327783997637773, 'prior_sigma': 0.03942280755239316, 'normalization': 'none'}. Best is trial 208 with value: 0.5269739389419555.
Generating morgan fingerprints...
Generated fingerprints with 2048 features for 900 molecules
Data shape: X=(900, 2048), y=(900,)
Trial 224: 5-fold CV loss = 0.5442
[I 2025-08-07 16:38:52,964] Trial 224 finished with value: 0.5441516280174256 and parameters: {'fp_type': 'morgan', 'morgan_only_radius': 2, 'morgan_only_nBits': 1024, 'num_hidden_layers': 3, 'hidden_dim_0': 512, 'hidden_dim_1': 128, 'hidden_dim_2': 1024, 'kl_weight': 0.0006495426675255676, 'lr': 0.002888382277919194, 'batch_size': 64, 'dropout_rate': 0.49284079126338104, 'prior_mu': 0.16665752373285808, 'prior_sigma': 0.04218909316067841, 'normalization': 'none'}. Best is trial 208 with value: 0.5269739389419555.
Generating morgan fingerprints...
Generated fingerprints with 2048 features for 900 molecules
Data shape: X=(900, 2048), y=(900,)
Trial 225: 5-fold CV loss = 0.5304
[I 2025-08-07 16:39:14,392] Trial 225 finished with value: 0.5303920924663543 and parameters: {'fp_type': 'morgan', 'morgan_only_radius': 2, 'morgan_only_nBits': 1024, 'num_hidden_layers': 3, 'hidden_dim_0': 512, 'hidden_dim_1': 128, 'hidden_dim_2': 1024, 'kl_weight': 0.00043812913074056225, 'lr': 0.0028156358988292007, 'batch_size': 64, 'dropout_rate': 0.4947356002626236, 'prior_mu': 0.10531254577245762, 'prior_sigma': 0.060524473381165324, 'normalization': 'none'}. Best is trial 208 with value: 0.5269739389419555.
Generating morgan fingerprints...
Generated fingerprints with 2048 features for 900 molecules
Data shape: X=(900, 2048), y=(900,)
Trial 227: 5-fold CV loss = 0.5482
[I 2025-08-07 16:39:17,940] Trial 227 finished with value: 0.5481892168521881 and parameters: {'fp_type': 'morgan', 'morgan_only_radius': 3, 'morgan_only_nBits': 2048, 'num_hidden_layers': 3, 'hidden_dim_0': 512, 'hidden_dim_1': 128, 'hidden_dim_2': 1024, 'kl_weight': 0.00043953844676034324, 'lr': 0.004174322454819541, 'batch_size': 64, 'dropout_rate': 0.48202555334306146, 'prior_mu': 0.10656238255470574, 'prior_sigma': 0.05571897857171525, 'normalization': 'none'}. Best is trial 208 with value: 0.5269739389419555.
Generating morgan fingerprints...
Generated fingerprints with 1024 features for 900 molecules
Data shape: X=(900, 1024), y=(900,)
Trial 226: 5-fold CV loss = 0.5509
[I 2025-08-07 16:39:23,793] Trial 226 finished with value: 0.5509004771709443 and parameters: {'fp_type': 'morgan', 'morgan_only_radius': 2, 'morgan_only_nBits': 2048, 'num_hidden_layers': 3, 'hidden_dim_0': 512, 'hidden_dim_1': 128, 'hidden_dim_2': 1024, 'kl_weight': 0.0004282039292024384, 'lr': 0.0041945441114601785, 'batch_size': 64, 'dropout_rate': 0.4993997766107218, 'prior_mu': 0.10754366220222852, 'prior_sigma': 0.0561904431887601, 'normalization': 'none'}. Best is trial 208 with value: 0.5269739389419555.
Generating morgan fingerprints...
Generated fingerprints with 1024 features for 900 molecules
Data shape: X=(900, 1024), y=(900,)
Trial 221: 5-fold CV loss = 0.5364
[I 2025-08-07 16:39:32,546] Trial 221 finished with value: 0.5364333689212799 and parameters: {'fp_type': 'morgan', 'morgan_only_radius': 2, 'morgan_only_nBits': 1024, 'num_hidden_layers': 3, 'hidden_dim_0': 512, 'hidden_dim_1': 128, 'hidden_dim_2': 1024, 'kl_weight': 0.00031951907671797154, 'lr': 0.0031391951176197304, 'batch_size': 64, 'dropout_rate': 0.49961170044205805, 'prior_mu': 0.13149886604392122, 'prior_sigma': 0.04244443071744372, 'normalization': 'none'}. Best is trial 208 with value: 0.5269739389419555.
Generating morgan fingerprints...
Generated fingerprints with 1024 features for 900 molecules
Data shape: X=(900, 1024), y=(900,)
Trial 228: 5-fold CV loss = 0.6093
[I 2025-08-07 16:39:44,320] Trial 228 finished with value: 0.6093373894691467 and parameters: {'fp_type': 'morgan', 'morgan_only_radius': 2, 'morgan_only_nBits': 2048, 'num_hidden_layers': 3, 'hidden_dim_0': 512, 'hidden_dim_1': 128, 'hidden_dim_2': 1024, 'kl_weight': 0.0004411922592866156, 'lr': 0.004078280564648871, 'batch_size': 64, 'dropout_rate': 0.4813236738531256, 'prior_mu': 0.19059665918820698, 'prior_sigma': 0.05677082757080185, 'normalization': 'none'}. Best is trial 208 with value: 0.5269739389419555.
Generating morgan fingerprints...
Generated fingerprints with 1024 features for 900 molecules
Data shape: X=(900, 1024), y=(900,)
Trial 229: 5-fold CV loss = 0.5317
[I 2025-08-07 16:39:54,676] Trial 229 finished with value: 0.5316934049129486 and parameters: {'fp_type': 'morgan', 'morgan_only_radius': 2, 'morgan_only_nBits': 1024, 'num_hidden_layers': 3, 'hidden_dim_0': 512, 'hidden_dim_1': 128, 'hidden_dim_2': 1024, 'kl_weight': 0.0004675476627079712, 'lr': 0.0032990905502030448, 'batch_size': 64, 'dropout_rate': 0.4649307699256767, 'prior_mu': 0.10856675869097024, 'prior_sigma': 0.05955218657558174, 'normalization': 'none'}. Best is trial 208 with value: 0.5269739389419555.
Generating morgan fingerprints...
Generated fingerprints with 1024 features for 900 molecules
Data shape: X=(900, 1024), y=(900,)
Trial 233: 5-fold CV loss = 0.5580
[I 2025-08-07 16:40:25,989] Trial 233 finished with value: 0.5580386161804199 and parameters: {'fp_type': 'morgan', 'morgan_only_radius': 2, 'morgan_only_nBits': 1024, 'num_hidden_layers': 3, 'hidden_dim_0': 128, 'hidden_dim_1': 128, 'hidden_dim_2': 1024, 'kl_weight': 0.0005355876091359321, 'lr': 0.0035899528591738974, 'batch_size': 64, 'dropout_rate': 0.4767404443973081, 'prior_mu': 0.10882206059470682, 'prior_sigma': 0.049519324775935014, 'normalization': 'none'}. Best is trial 208 with value: 0.5269739389419555.
Generating morgan fingerprints...
Generated fingerprints with 1024 features for 900 molecules
Data shape: X=(900, 1024), y=(900,)
Trial 232: 5-fold CV loss = 0.5435
[I 2025-08-07 16:40:34,871] Trial 232 finished with value: 0.5434602439403534 and parameters: {'fp_type': 'morgan', 'morgan_only_radius': 2, 'morgan_only_nBits': 1024, 'num_hidden_layers': 3, 'hidden_dim_0': 128, 'hidden_dim_1': 128, 'hidden_dim_2': 1024, 'kl_weight': 0.000543871792805821, 'lr': 0.003315507629681024, 'batch_size': 64, 'dropout_rate': 0.46412272529038134, 'prior_mu': 0.13762949409389807, 'prior_sigma': 0.050712374875016605, 'normalization': 'none'}. Best is trial 208 with value: 0.5269739389419555.
Generating morgan fingerprints...
Generated fingerprints with 1024 features for 900 molecules
Data shape: X=(900, 1024), y=(900,)
Trial 230: 5-fold CV loss = 0.5481
[I 2025-08-07 16:40:41,824] Trial 230 finished with value: 0.5480591654777527 and parameters: {'fp_type': 'morgan', 'morgan_only_radius': 2, 'morgan_only_nBits': 1024, 'num_hidden_layers': 3, 'hidden_dim_0': 128, 'hidden_dim_1': 128, 'hidden_dim_2': 1024, 'kl_weight': 0.0005441221986481812, 'lr': 0.0033862893855716803, 'batch_size': 64, 'dropout_rate': 0.4811922213943822, 'prior_mu': 0.12153082644228821, 'prior_sigma': 0.061000800566455654, 'normalization': 'none'}. Best is trial 208 with value: 0.5269739389419555.
Generating morgan fingerprints...
Generated fingerprints with 1024 features for 900 molecules
Data shape: X=(900, 1024), y=(900,)
Trial 234: 5-fold CV loss = 0.5525
[I 2025-08-07 16:40:55,609] Trial 234 finished with value: 0.5525099456310272 and parameters: {'fp_type': 'morgan', 'morgan_only_radius': 2, 'morgan_only_nBits': 1024, 'num_hidden_layers': 3, 'hidden_dim_0': 512, 'hidden_dim_1': 128, 'hidden_dim_2': 1024, 'kl_weight': 0.0005111795876211678, 'lr': 0.0033129518941315927, 'batch_size': 64, 'dropout_rate': 0.4868185389131597, 'prior_mu': 0.14392816045453538, 'prior_sigma': 0.03373349562606687, 'normalization': 'none'}. Best is trial 208 with value: 0.5269739389419555.
Generating morgan fingerprints...
Generated fingerprints with 1024 features for 900 molecules
Data shape: X=(900, 1024), y=(900,)
Trial 231: 5-fold CV loss = 0.5363
[I 2025-08-07 16:41:12,806] Trial 231 finished with value: 0.536276388168335 and parameters: {'fp_type': 'morgan', 'morgan_only_radius': 2, 'morgan_only_nBits': 1024, 'num_hidden_layers': 3, 'hidden_dim_0': 512, 'hidden_dim_1': 128, 'hidden_dim_2': 1024, 'kl_weight': 0.0005079481949570182, 'lr': 0.003456824521093859, 'batch_size': 64, 'dropout_rate': 0.481989714820464, 'prior_mu': 0.1878814369730633, 'prior_sigma': 0.04860532128499646, 'normalization': 'none'}. Best is trial 208 with value: 0.5269739389419555.
Generating morgan fingerprints...
Generated fingerprints with 1024 features for 900 molecules
Data shape: X=(900, 1024), y=(900,)
Trial 235: 5-fold CV loss = 0.5389
[I 2025-08-07 16:41:14,779] Trial 235 finished with value: 0.538866925239563 and parameters: {'fp_type': 'morgan', 'morgan_only_radius': 2, 'morgan_only_nBits': 1024, 'num_hidden_layers': 3, 'hidden_dim_0': 512, 'hidden_dim_1': 128, 'hidden_dim_2': 1024, 'kl_weight': 0.00033649130578901424, 'lr': 0.003255053643147967, 'batch_size': 64, 'dropout_rate': 0.4874889258432186, 'prior_mu': 0.17410969454104552, 'prior_sigma': 0.06134008770090195, 'normalization': 'none'}. Best is trial 208 with value: 0.5269739389419555.
Generating morgan fingerprints...
Generated fingerprints with 1024 features for 900 molecules
Data shape: X=(900, 1024), y=(900,)
Trial 237: 5-fold CV loss = 0.5881
[I 2025-08-07 16:41:37,471] Trial 237 finished with value: 0.5880864083766937 and parameters: {'fp_type': 'morgan', 'morgan_only_radius': 2, 'morgan_only_nBits': 1024, 'num_hidden_layers': 3, 'hidden_dim_0': 512, 'hidden_dim_1': 128, 'hidden_dim_2': 1024, 'kl_weight': 0.0003319137063410115, 'lr': 0.002524200502280547, 'batch_size': 64, 'dropout_rate': 0.4906566036604689, 'prior_mu': 0.11308821194310766, 'prior_sigma': 0.06812385379750942, 'normalization': 'none'}. Best is trial 208 with value: 0.5269739389419555.
Generating morgan fingerprints...
Generated fingerprints with 1024 features for 900 molecules
Data shape: X=(900, 1024), y=(900,)
Trial 236: 5-fold CV loss = 0.5460
[I 2025-08-07 16:41:56,443] Trial 236 finished with value: 0.5460152387619018 and parameters: {'fp_type': 'morgan', 'morgan_only_radius': 2, 'morgan_only_nBits': 1024, 'num_hidden_layers': 3, 'hidden_dim_0': 512, 'hidden_dim_1': 128, 'hidden_dim_2': 1024, 'kl_weight': 0.000333579518094615, 'lr': 0.002485477516339057, 'batch_size': 64, 'dropout_rate': 0.4897418145760046, 'prior_mu': 0.11187903838922952, 'prior_sigma': 0.0414916677600795, 'normalization': 'none'}. Best is trial 208 with value: 0.5269739389419555.
Generating morgan fingerprints...
Generated fingerprints with 1024 features for 900 molecules
Data shape: X=(900, 1024), y=(900,)
Trial 239: 5-fold CV loss = 0.5501
