[I 2025-08-07 16:13:01,591] Trial 61 finished with value: 0.7940345525741577 and parameters: {'fp_type': 'rdkit', 'rdkit_only_maxPath': 8, 'rdkit_only_nBits': 256, 'num_hidden_layers': 2, 'hidden_dim_0': 256, 'hidden_dim_1': 256, 'kl_weight': 0.00020056443808124494, 'lr': 0.00048269036707483757, 'batch_size': 128, 'dropout_rate': 0.47458971339538514, 'prior_mu': 0.18212026648427193, 'prior_sigma': 0.19991113702419355, 'normalization': 'none'}. Best is trial 30 with value: 0.5358302295207977.
Generating morgan_rdkit fingerprints...
Generated fingerprints with 1024 features for 900 molecules
Data shape: X=(900, 1024), y=(900,)
Trial 59: 5-fold CV loss = 0.5544
[I 2025-08-07 16:13:10,553] Trial 59 finished with value: 0.5544346868991852 and parameters: {'fp_type': 'morgan_rdkit', 'combined_morgan_radius': 2, 'combined_morgan_nBits': 512, 'combined_rdkit_maxPath': 5, 'combined_rdkit_nBits': 1024, 'num_hidden_layers': 3, 'hidden_dim_0': 512, 'hidden_dim_1': 256, 'hidden_dim_2': 256, 'kl_weight': 0.00018739666916369672, 'lr': 0.008252393801227036, 'batch_size': 128, 'dropout_rate': 0.3843701481741263, 'prior_mu': 0.06141250095869933, 'prior_sigma': 0.08782638083732205, 'normalization': 'none'}. Best is trial 30 with value: 0.5358302295207977.
Generating morgan_rdkit fingerprints...
Generated fingerprints with 1024 features for 900 molecules
Data shape: X=(900, 1024), y=(900,)
Trial 63: 5-fold CV loss = 0.5723
[I 2025-08-07 16:13:28,610] Trial 63 finished with value: 0.5722605586051941 and parameters: {'fp_type': 'morgan_rdkit', 'combined_morgan_radius': 3, 'combined_morgan_nBits': 512, 'combined_rdkit_maxPath': 7, 'combined_rdkit_nBits': 512, 'num_hidden_layers': 3, 'hidden_dim_0': 512, 'hidden_dim_1': 128, 'hidden_dim_2': 64, 'kl_weight': 0.0013956996487641505, 'lr': 0.006689438763119868, 'batch_size': 128, 'dropout_rate': 0.3830447623182603, 'prior_mu': 0.14682048555307511, 'prior_sigma': 0.06086938546365776, 'normalization': 'none'}. Best is trial 30 with value: 0.5358302295207977.
Generating morgan_rdkit fingerprints...
Generated fingerprints with 1536 features for 900 molecules
Data shape: X=(900, 1536), y=(900,)
Trial 62: 5-fold CV loss = 0.7136
[I 2025-08-07 16:13:33,959] Trial 62 finished with value: 0.7136042594909668 and parameters: {'fp_type': 'rdkit', 'rdkit_only_maxPath': 5, 'rdkit_only_nBits': 256, 'num_hidden_layers': 2, 'hidden_dim_0': 256, 'hidden_dim_1': 256, 'kl_weight': 0.01626726269699091, 'lr': 0.00035861579509029374, 'batch_size': 128, 'dropout_rate': 0.46411860005547007, 'prior_mu': 0.17804589532609574, 'prior_sigma': 0.06445343462855149, 'normalization': 'none'}. Best is trial 30 with value: 0.5358302295207977.
Generating morgan_rdkit fingerprints...
Generated fingerprints with 1536 features for 900 molecules
Data shape: X=(900, 1536), y=(900,)
Trial 64: 5-fold CV loss = 0.5524
[I 2025-08-07 16:13:36,394] Trial 64 finished with value: 0.5523813009262085 and parameters: {'fp_type': 'morgan_rdkit', 'combined_morgan_radius': 3, 'combined_morgan_nBits': 512, 'combined_rdkit_maxPath': 7, 'combined_rdkit_nBits': 512, 'num_hidden_layers': 3, 'hidden_dim_0': 512, 'hidden_dim_1': 64, 'hidden_dim_2': 64, 'kl_weight': 0.0162236213919533, 'lr': 0.006481528497113775, 'batch_size': 128, 'dropout_rate': 0.36393857754488074, 'prior_mu': 0.01718052921150858, 'prior_sigma': 0.0620270345915174, 'normalization': 'none'}. Best is trial 30 with value: 0.5358302295207977.
Generating morgan_rdkit fingerprints...
Generated fingerprints with 1536 features for 900 molecules
Data shape: X=(900, 1536), y=(900,)
Trial 67: 5-fold CV loss = 0.6467
[I 2025-08-07 16:13:50,913] Trial 67 finished with value: 0.6467455506324769 and parameters: {'fp_type': 'morgan_rdkit', 'combined_morgan_radius': 2, 'combined_morgan_nBits': 1024, 'combined_rdkit_maxPath': 6, 'combined_rdkit_nBits': 512, 'num_hidden_layers': 3, 'hidden_dim_0': 512, 'hidden_dim_1': 64, 'hidden_dim_2': 128, 'kl_weight': 0.00011619088320834252, 'lr': 0.00429116279427054, 'batch_size': 128, 'dropout_rate': 0.4161014855605063, 'prior_mu': 0.05257485116769817, 'prior_sigma': 0.07374084773600253, 'normalization': 'none'}. Best is trial 30 with value: 0.5358302295207977.
Generating morgan_rdkit fingerprints...
Generated fingerprints with 1536 features for 900 molecules
Data shape: X=(900, 1536), y=(900,)
Trial 60: 5-fold CV loss = 0.5597
[I 2025-08-07 16:13:56,839] Trial 60 finished with value: 0.5597403168678283 and parameters: {'fp_type': 'morgan_rdkit', 'combined_morgan_radius': 3, 'combined_morgan_nBits': 512, 'combined_rdkit_maxPath': 7, 'combined_rdkit_nBits': 512, 'num_hidden_layers': 3, 'hidden_dim_0': 512, 'hidden_dim_1': 256, 'hidden_dim_2': 1024, 'kl_weight': 0.0001859101492098101, 'lr': 0.004506481225424864, 'batch_size': 128, 'dropout_rate': 0.3733600839002797, 'prior_mu': 0.18058178228228988, 'prior_sigma': 0.06319449537998936, 'normalization': 'none'}. Best is trial 30 with value: 0.5358302295207977.
Generating morgan_rdkit fingerprints...
Generated fingerprints with 1536 features for 900 molecules
Data shape: X=(900, 1536), y=(900,)
Trial 65: 5-fold CV loss = 0.5844
[I 2025-08-07 16:13:58,834] Trial 65 finished with value: 0.5844102442264557 and parameters: {'fp_type': 'morgan_rdkit', 'combined_morgan_radius': 2, 'combined_morgan_nBits': 1024, 'combined_rdkit_maxPath': 6, 'combined_rdkit_nBits': 512, 'num_hidden_layers': 3, 'hidden_dim_0': 512, 'hidden_dim_1': 64, 'hidden_dim_2': 256, 'kl_weight': 0.00011881994026874778, 'lr': 0.00446533193343985, 'batch_size': 128, 'dropout_rate': 0.35516943212483965, 'prior_mu': -0.011569811302262756, 'prior_sigma': 0.0705136337968072, 'normalization': 'none'}. Best is trial 30 with value: 0.5358302295207977.
Generating morgan_rdkit fingerprints...
Generated fingerprints with 1536 features for 900 molecules
Data shape: X=(900, 1536), y=(900,)
Trial 68: 5-fold CV loss = 0.5393
[I 2025-08-07 16:14:12,440] Trial 68 finished with value: 0.5393461585044861 and parameters: {'fp_type': 'morgan_rdkit', 'combined_morgan_radius': 2, 'combined_morgan_nBits': 1024, 'combined_rdkit_maxPath': 5, 'combined_rdkit_nBits': 512, 'num_hidden_layers': 3, 'hidden_dim_0': 512, 'hidden_dim_1': 64, 'hidden_dim_2': 256, 'kl_weight': 0.00028811511986363543, 'lr': 0.005638351505257217, 'batch_size': 128, 'dropout_rate': 0.34813240847459503, 'prior_mu': 0.11862195842573531, 'prior_sigma': 0.044971588266675175, 'normalization': 'none'}. Best is trial 30 with value: 0.5358302295207977.
Generating morgan_rdkit fingerprints...
Generated fingerprints with 1536 features for 900 molecules
Data shape: X=(900, 1536), y=(900,)
Trial 70: 5-fold CV loss = 0.5540
[I 2025-08-07 16:14:20,697] Trial 70 finished with value: 0.5540481925010681 and parameters: {'fp_type': 'morgan_rdkit', 'combined_morgan_radius': 2, 'combined_morgan_nBits': 1024, 'combined_rdkit_maxPath': 5, 'combined_rdkit_nBits': 512, 'num_hidden_layers': 3, 'hidden_dim_0': 512, 'hidden_dim_1': 64, 'hidden_dim_2': 256, 'kl_weight': 0.0002993122416441627, 'lr': 0.009069148467942555, 'batch_size': 128, 'dropout_rate': 0.2834190157527806, 'prior_mu': 0.07906518734402496, 'prior_sigma': 0.04608929276645202, 'normalization': 'none'}. Best is trial 30 with value: 0.5358302295207977.
Generating morgan_rdkit fingerprints...
Generated fingerprints with 1280 features for 900 molecules
Data shape: X=(900, 1280), y=(900,)
Trial 69: 5-fold CV loss = 0.5409
[I 2025-08-07 16:14:31,774] Trial 69 finished with value: 0.5409222304821014 and parameters: {'fp_type': 'morgan_rdkit', 'combined_morgan_radius': 2, 'combined_morgan_nBits': 1024, 'combined_rdkit_maxPath': 5, 'combined_rdkit_nBits': 512, 'num_hidden_layers': 3, 'hidden_dim_0': 512, 'hidden_dim_1': 64, 'hidden_dim_2': 256, 'kl_weight': 0.0002744608994548363, 'lr': 0.005592408008519668, 'batch_size': 128, 'dropout_rate': 0.33856833480504234, 'prior_mu': 0.11821621382321841, 'prior_sigma': 0.04488858852645179, 'normalization': 'none'}. Best is trial 30 with value: 0.5358302295207977.
Generating morgan fingerprints...
Generated fingerprints with 2048 features for 900 molecules
Data shape: X=(900, 2048), y=(900,)
Trial 66: 5-fold CV loss = 0.6052
[I 2025-08-07 16:14:36,106] Trial 66 finished with value: 0.6051933646202088 and parameters: {'fp_type': 'morgan_rdkit', 'combined_morgan_radius': 2, 'combined_morgan_nBits': 1024, 'combined_rdkit_maxPath': 6, 'combined_rdkit_nBits': 512, 'num_hidden_layers': 3, 'hidden_dim_0': 512, 'hidden_dim_1': 64, 'hidden_dim_2': 256, 'kl_weight': 0.0001264651987849055, 'lr': 0.004259853907057452, 'batch_size': 128, 'dropout_rate': 0.3594773440151996, 'prior_mu': 0.05985839759541001, 'prior_sigma': 0.0745189915872689, 'normalization': 'none'}. Best is trial 30 with value: 0.5358302295207977.
Generating morgan_rdkit fingerprints...
Generated fingerprints with 1536 features for 900 molecules
Data shape: X=(900, 1536), y=(900,)
Trial 72: 5-fold CV loss = 0.5921
[I 2025-08-07 16:14:52,387] Trial 72 finished with value: 0.5921073198318482 and parameters: {'fp_type': 'morgan_rdkit', 'combined_morgan_radius': 2, 'combined_morgan_nBits': 1024, 'combined_rdkit_maxPath': 5, 'combined_rdkit_nBits': 256, 'num_hidden_layers': 1, 'hidden_dim_0': 64, 'kl_weight': 0.0004288524944280846, 'lr': 0.005640975225025047, 'batch_size': 32, 'dropout_rate': 0.33088238715641344, 'prior_mu': 0.11625473982701072, 'prior_sigma': 0.03377210023960127, 'normalization': 'none'}. Best is trial 30 with value: 0.5358302295207977.
Generating morgan_rdkit fingerprints...
Generated fingerprints with 1536 features for 900 molecules
Data shape: X=(900, 1536), y=(900,)
Trial 73: 5-fold CV loss = 0.6923
[I 2025-08-07 16:14:59,722] Trial 73 finished with value: 0.6922648906707763 and parameters: {'fp_type': 'morgan', 'morgan_only_radius': 3, 'morgan_only_nBits': 2048, 'num_hidden_layers': 1, 'hidden_dim_0': 64, 'kl_weight': 0.00046288820595668747, 'lr': 0.00281894695230952, 'batch_size': 32, 'dropout_rate': 0.3259244612852498, 'prior_mu': 0.14625029566598838, 'prior_sigma': 0.021131080856967452, 'normalization': 'none'}. Best is trial 30 with value: 0.5358302295207977.
Generating morgan_rdkit fingerprints...
Generated fingerprints with 1536 features for 900 molecules
Data shape: X=(900, 1536), y=(900,)
Trial 71: 5-fold CV loss = 0.5432
[I 2025-08-07 16:15:00,903] Trial 71 finished with value: 0.5432431936264038 and parameters: {'fp_type': 'morgan_rdkit', 'combined_morgan_radius': 2, 'combined_morgan_nBits': 1024, 'combined_rdkit_maxPath': 5, 'combined_rdkit_nBits': 512, 'num_hidden_layers': 3, 'hidden_dim_0': 64, 'hidden_dim_1': 64, 'hidden_dim_2': 256, 'kl_weight': 0.00031144395593430844, 'lr': 0.005637832880040589, 'batch_size': 32, 'dropout_rate': 0.3296631727436129, 'prior_mu': 0.11922581160920988, 'prior_sigma': 0.04422754465750024, 'normalization': 'none'}. Best is trial 30 with value: 0.5358302295207977.
Generating morgan_rdkit fingerprints...
Generated fingerprints with 1536 features for 900 molecules
Data shape: X=(900, 1536), y=(900,)
Trial 75: 5-fold CV loss = 0.5805
[I 2025-08-07 16:15:12,418] Trial 75 finished with value: 0.5805376529693603 and parameters: {'fp_type': 'morgan_rdkit', 'combined_morgan_radius': 2, 'combined_morgan_nBits': 1024, 'combined_rdkit_maxPath': 5, 'combined_rdkit_nBits': 512, 'num_hidden_layers': 3, 'hidden_dim_0': 512, 'hidden_dim_1': 64, 'hidden_dim_2': 256, 'kl_weight': 0.0002892152127658297, 'lr': 0.005813762541786185, 'batch_size': 128, 'dropout_rate': 0.31765975018602755, 'prior_mu': 0.1405326823933513, 'prior_sigma': 0.02325445290834933, 'normalization': 'none'}. Best is trial 30 with value: 0.5358302295207977.
Generating morgan_rdkit fingerprints...
Generated fingerprints with 1536 features for 900 molecules
Data shape: X=(900, 1536), y=(900,)
Trial 77: 5-fold CV loss = 0.5526
[I 2025-08-07 16:15:22,747] Trial 77 finished with value: 0.5526179134845733 and parameters: {'fp_type': 'morgan_rdkit', 'combined_morgan_radius': 2, 'combined_morgan_nBits': 1024, 'combined_rdkit_maxPath': 5, 'combined_rdkit_nBits': 512, 'num_hidden_layers': 3, 'hidden_dim_0': 512, 'hidden_dim_1': 64, 'hidden_dim_2': 128, 'kl_weight': 0.0007219243327742198, 'lr': 0.006767693662372678, 'batch_size': 128, 'dropout_rate': 0.3459567226603477, 'prior_mu': 0.15294107141128488, 'prior_sigma': 0.03703204981882506, 'normalization': 'none'}. Best is trial 30 with value: 0.5358302295207977.
Generating morgan_rdkit fingerprints...
Generated fingerprints with 2048 features for 900 molecules
Data shape: X=(900, 2048), y=(900,)
Trial 76: 5-fold CV loss = 0.5530
[I 2025-08-07 16:15:30,217] Trial 76 finished with value: 0.5529965877532959 and parameters: {'fp_type': 'morgan_rdkit', 'combined_morgan_radius': 2, 'combined_morgan_nBits': 1024, 'combined_rdkit_maxPath': 5, 'combined_rdkit_nBits': 512, 'num_hidden_layers': 3, 'hidden_dim_0': 512, 'hidden_dim_1': 64, 'hidden_dim_2': 256, 'kl_weight': 0.00028131912186307723, 'lr': 0.005735620598384629, 'batch_size': 128, 'dropout_rate': 0.24864988702471358, 'prior_mu': 0.13490849946777977, 'prior_sigma': 0.04376102201516868, 'normalization': 'none'}. Best is trial 30 with value: 0.5358302295207977.
Generating morgan_rdkit fingerprints...
Generated fingerprints with 2048 features for 900 molecules
Data shape: X=(900, 2048), y=(900,)
Trial 78: 5-fold CV loss = 0.5874
[I 2025-08-07 16:15:34,731] Trial 78 finished with value: 0.5873565554618836 and parameters: {'fp_type': 'morgan_rdkit', 'combined_morgan_radius': 2, 'combined_morgan_nBits': 1024, 'combined_rdkit_maxPath': 5, 'combined_rdkit_nBits': 512, 'num_hidden_layers': 3, 'hidden_dim_0': 512, 'hidden_dim_1': 128, 'hidden_dim_2': 128, 'kl_weight': 0.00021947779746550334, 'lr': 0.0032313477059065245, 'batch_size': 128, 'dropout_rate': 0.34808091442528943, 'prior_mu': 0.13246916156157557, 'prior_sigma': 0.05637692629371473, 'normalization': 'none'}. Best is trial 30 with value: 0.5358302295207977.
Generating morgan_rdkit fingerprints...
Generated fingerprints with 2048 features for 900 molecules
Data shape: X=(900, 2048), y=(900,)
Trial 79: 5-fold CV loss = 0.5772
[I 2025-08-07 16:15:40,925] Trial 79 finished with value: 0.5772214651107788 and parameters: {'fp_type': 'morgan_rdkit', 'combined_morgan_radius': 2, 'combined_morgan_nBits': 1024, 'combined_rdkit_maxPath': 5, 'combined_rdkit_nBits': 1024, 'num_hidden_layers': 3, 'hidden_dim_0': 1024, 'hidden_dim_1': 128, 'hidden_dim_2': 256, 'kl_weight': 0.00035849024260628493, 'lr': 0.007337749274058893, 'batch_size': 128, 'dropout_rate': 0.24616596763122167, 'prior_mu': 0.12999536857671004, 'prior_sigma': 0.05622140240115297, 'normalization': 'none'}. Best is trial 30 with value: 0.5358302295207977.
Generating rdkit fingerprints...
Generated fingerprints with 512 features for 900 molecules
Data shape: X=(900, 512), y=(900,)
Trial 81: 5-fold CV loss = 0.5922
[I 2025-08-07 16:15:57,779] Trial 81 finished with value: 0.5921765506267548 and parameters: {'fp_type': 'morgan_rdkit', 'combined_morgan_radius': 2, 'combined_morgan_nBits': 1024, 'combined_rdkit_maxPath': 5, 'combined_rdkit_nBits': 1024, 'num_hidden_layers': 3, 'hidden_dim_0': 1024, 'hidden_dim_1': 128, 'hidden_dim_2': 256, 'kl_weight': 0.00034517801858732663, 'lr': 0.007080001277210442, 'batch_size': 128, 'dropout_rate': 0.2857532929993384, 'prior_mu': 0.10919239436681938, 'prior_sigma': 0.05128322441931441, 'normalization': 'layer'}. Best is trial 30 with value: 0.5358302295207977.
Generating rdkit fingerprints...
Generated fingerprints with 512 features for 900 molecules
Data shape: X=(900, 512), y=(900,)
Trial 80: 5-fold CV loss = 0.5614
[I 2025-08-07 16:16:00,072] Trial 80 finished with value: 0.5613856792449952 and parameters: {'fp_type': 'morgan_rdkit', 'combined_morgan_radius': 2, 'combined_morgan_nBits': 1024, 'combined_rdkit_maxPath': 5, 'combined_rdkit_nBits': 1024, 'num_hidden_layers': 3, 'hidden_dim_0': 1024, 'hidden_dim_1': 128, 'hidden_dim_2': 256, 'kl_weight': 0.00035983479119250486, 'lr': 0.007084199631901658, 'batch_size': 128, 'dropout_rate': 0.4189651899377834, 'prior_mu': 0.11629719418457514, 'prior_sigma': 0.05443421917165836, 'normalization': 'none'}. Best is trial 30 with value: 0.5358302295207977.
Generating morgan_rdkit fingerprints...
Generated fingerprints with 1536 features for 900 molecules
Data shape: X=(900, 1536), y=(900,)
Trial 82: 5-fold CV loss = 0.6750
[I 2025-08-07 16:16:00,863] Trial 82 finished with value: 0.6750304222106933 and parameters: {'fp_type': 'rdkit', 'rdkit_only_maxPath': 6, 'rdkit_only_nBits': 512, 'num_hidden_layers': 3, 'hidden_dim_0': 512, 'hidden_dim_1': 64, 'hidden_dim_2': 256, 'kl_weight': 0.0010568888051053125, 'lr': 0.003830413966364514, 'batch_size': 128, 'dropout_rate': 0.3903680258426536, 'prior_mu': 0.08278039691429853, 'prior_sigma': 0.0519478627432918, 'normalization': 'layer'}. Best is trial 30 with value: 0.5358302295207977.
Generating morgan_rdkit fingerprints...
Generated fingerprints with 1536 features for 900 molecules
Data shape: X=(900, 1536), y=(900,)
Trial 85: 5-fold CV loss = 0.5346
[I 2025-08-07 16:16:23,151] Trial 85 finished with value: 0.5345884144306183 and parameters: {'fp_type': 'morgan_rdkit', 'combined_morgan_radius': 2, 'combined_morgan_nBits': 1024, 'combined_rdkit_maxPath': 5, 'combined_rdkit_nBits': 512, 'num_hidden_layers': 3, 'hidden_dim_0': 512, 'hidden_dim_1': 64, 'hidden_dim_2': 256, 'kl_weight': 0.00014644974278720134, 'lr': 0.008824251691190471, 'batch_size': 128, 'dropout_rate': 0.4825863380267194, 'prior_mu': 0.03652706844943756, 'prior_sigma': 0.08520772495808777, 'normalization': 'none'}. Best is trial 85 with value: 0.5345884144306183.
Generating morgan_rdkit fingerprints...
Generated fingerprints with 1536 features for 900 molecules
Data shape: X=(900, 1536), y=(900,)
Trial 84: 5-fold CV loss = 0.5374
[I 2025-08-07 16:16:32,020] Trial 84 finished with value: 0.5374400377273559 and parameters: {'fp_type': 'morgan_rdkit', 'combined_morgan_radius': 2, 'combined_morgan_nBits': 1024, 'combined_rdkit_maxPath': 5, 'combined_rdkit_nBits': 512, 'num_hidden_layers': 3, 'hidden_dim_0': 512, 'hidden_dim_1': 64, 'hidden_dim_2': 256, 'kl_weight': 0.00014821330299152416, 'lr': 0.009013008501384439, 'batch_size': 128, 'dropout_rate': 0.3849786282864597, 'prior_mu': 0.08366134998464064, 'prior_sigma': 0.08486701850265864, 'normalization': 'none'}. Best is trial 85 with value: 0.5345884144306183.
Generating morgan_rdkit fingerprints...
Generated fingerprints with 1280 features for 900 molecules
Data shape: X=(900, 1280), y=(900,)
Trial 83: 5-fold CV loss = 0.5758
[I 2025-08-07 16:16:34,012] Trial 83 finished with value: 0.5757875919342041 and parameters: {'fp_type': 'rdkit', 'rdkit_only_maxPath': 6, 'rdkit_only_nBits': 512, 'num_hidden_layers': 3, 'hidden_dim_0': 512, 'hidden_dim_1': 64, 'hidden_dim_2': 256, 'kl_weight': 0.0002167160883774868, 'lr': 0.005044666886350431, 'batch_size': 128, 'dropout_rate': 0.39403862014165586, 'prior_mu': 0.07035634381454998, 'prior_sigma': 0.08528710203727713, 'normalization': 'none'}. Best is trial 85 with value: 0.5345884144306183.
Generating morgan_rdkit fingerprints...
Generated fingerprints with 1280 features for 900 molecules
Data shape: X=(900, 1280), y=(900,)
Trial 86: 5-fold CV loss = 0.5445
[I 2025-08-07 16:16:48,952] Trial 86 finished with value: 0.5444580376148224 and parameters: {'fp_type': 'morgan_rdkit', 'combined_morgan_radius': 2, 'combined_morgan_nBits': 1024, 'combined_rdkit_maxPath': 5, 'combined_rdkit_nBits': 512, 'num_hidden_layers': 3, 'hidden_dim_0': 512, 'hidden_dim_1': 64, 'hidden_dim_2': 1024, 'kl_weight': 0.0005022727373167835, 'lr': 0.008886744001525046, 'batch_size': 128, 'dropout_rate': 0.48349796029457853, 'prior_mu': 0.07104015385135941, 'prior_sigma': 0.08378978351035488, 'normalization': 'none'}. Best is trial 85 with value: 0.5345884144306183.
Generating morgan_rdkit fingerprints...
Generated fingerprints with 2048 features for 900 molecules
Data shape: X=(900, 2048), y=(900,)
Trial 74: 5-fold CV loss = 0.5455
[I 2025-08-07 16:16:52,053] Trial 74 finished with value: 0.5454554557800293 and parameters: {'fp_type': 'morgan_rdkit', 'combined_morgan_radius': 2, 'combined_morgan_nBits': 1024, 'combined_rdkit_maxPath': 5, 'combined_rdkit_nBits': 512, 'num_hidden_layers': 3, 'hidden_dim_0': 512, 'hidden_dim_1': 64, 'hidden_dim_2': 256, 'kl_weight': 0.0004488816568273744, 'lr': 0.005480023093152344, 'batch_size': 32, 'dropout_rate': 0.3331255254286616, 'prior_mu': 0.1380912320406239, 'prior_sigma': 0.03633578679152077, 'normalization': 'none'}. Best is trial 85 with value: 0.5345884144306183.
Generating morgan_rdkit fingerprints...
Generated fingerprints with 1280 features for 900 molecules
Data shape: X=(900, 1280), y=(900,)
Trial 88: 5-fold CV loss = 0.5672
[I 2025-08-07 16:16:59,251] Trial 88 finished with value: 0.5672355711460113 and parameters: {'fp_type': 'morgan_rdkit', 'combined_morgan_radius': 2, 'combined_morgan_nBits': 1024, 'combined_rdkit_maxPath': 8, 'combined_rdkit_nBits': 256, 'num_hidden_layers': 3, 'hidden_dim_0': 512, 'hidden_dim_1': 64, 'hidden_dim_2': 1024, 'kl_weight': 0.0001398053033660341, 'lr': 0.00887709081054889, 'batch_size': 128, 'dropout_rate': 0.42768778712746675, 'prior_mu': 0.04249224678238252, 'prior_sigma': 0.09371332559279044, 'normalization': 'none'}. Best is trial 85 with value: 0.5345884144306183.
Generating morgan_rdkit fingerprints...
Generated fingerprints with 2048 features for 900 molecules
Data shape: X=(900, 2048), y=(900,)
Trial 91: 5-fold CV loss = 1.2184
