[I 2025-08-08 07:57:56,336] Trial 2802 finished with value: 0.5263454198837281 and parameters: {'fp_type': 'morgan', 'morgan_only_radius': 2, 'morgan_only_nBits': 2048, 'num_hidden_layers': 3, 'hidden_dim_0': 512, 'hidden_dim_1': 128, 'hidden_dim_2': 512, 'kl_weight': 0.00020271008411980941, 'lr': 0.0019815403973594712, 'batch_size': 32, 'dropout_rate': 0.45282290325376956, 'prior_mu': 0.04435870711129306, 'prior_sigma': 0.07789039336859527, 'normalization': 'none'}. Best is trial 2752 with value: 0.5150722622871399.
Generating rdkit fingerprints...
Generated fingerprints with 1024 features for 900 molecules
Data shape: X=(900, 1024), y=(900,)
Trial 2804: 5-fold CV loss = 0.6332
[I 2025-08-08 07:58:05,036] Trial 2804 finished with value: 0.6331579685211182 and parameters: {'fp_type': 'rdkit', 'rdkit_only_maxPath': 7, 'rdkit_only_nBits': 1024, 'num_hidden_layers': 3, 'hidden_dim_0': 512, 'hidden_dim_1': 128, 'hidden_dim_2': 512, 'kl_weight': 0.00019712263105537212, 'lr': 0.0019806714221078862, 'batch_size': 32, 'dropout_rate': 0.46917045561042686, 'prior_mu': 0.01895653107019719, 'prior_sigma': 0.06772792757128616, 'normalization': 'none'}. Best is trial 2752 with value: 0.5150722622871399.
Generating morgan fingerprints...
Generated fingerprints with 2048 features for 900 molecules
Data shape: X=(900, 2048), y=(900,)
Trial 2805: 5-fold CV loss = 0.6294
[I 2025-08-08 07:58:45,779] Trial 2805 finished with value: 0.6294349789619446 and parameters: {'fp_type': 'rdkit', 'rdkit_only_maxPath': 7, 'rdkit_only_nBits': 1024, 'num_hidden_layers': 3, 'hidden_dim_0': 512, 'hidden_dim_1': 128, 'hidden_dim_2': 512, 'kl_weight': 0.000988867683177662, 'lr': 0.0016508509378322278, 'batch_size': 32, 'dropout_rate': 0.464883886916003, 'prior_mu': -0.1342868907454151, 'prior_sigma': 0.06737823276205081, 'normalization': 'none'}. Best is trial 2752 with value: 0.5150722622871399.
Generating morgan fingerprints...
Generated fingerprints with 2048 features for 900 molecules
Data shape: X=(900, 2048), y=(900,)
Trial 2796: 5-fold CV loss = 0.5728
[I 2025-08-08 07:58:57,040] Trial 2796 finished with value: 0.5728387475013733 and parameters: {'fp_type': 'morgan', 'morgan_only_radius': 2, 'morgan_only_nBits': 2048, 'num_hidden_layers': 3, 'hidden_dim_0': 512, 'hidden_dim_1': 128, 'hidden_dim_2': 512, 'kl_weight': 0.00019281581356746244, 'lr': 0.0018086529890725745, 'batch_size': 32, 'dropout_rate': 0.3626350893954463, 'prior_mu': 0.04348189103282695, 'prior_sigma': 0.06984321433001238, 'normalization': 'none'}. Best is trial 2752 with value: 0.5150722622871399.
Generating morgan_rdkit fingerprints...
Generated fingerprints with 1024 features for 900 molecules
Data shape: X=(900, 1024), y=(900,)
Trial 2806: 5-fold CV loss = 0.5633
[I 2025-08-08 07:59:17,242] Trial 2806 finished with value: 0.563270366191864 and parameters: {'fp_type': 'morgan', 'morgan_only_radius': 2, 'morgan_only_nBits': 2048, 'num_hidden_layers': 3, 'hidden_dim_0': 512, 'hidden_dim_1': 128, 'hidden_dim_2': 512, 'kl_weight': 0.0002413188430527951, 'lr': 0.0018644012009715785, 'batch_size': 32, 'dropout_rate': 0.20874384752836783, 'prior_mu': 0.0363688140234542, 'prior_sigma': 0.07201169569700808, 'normalization': 'none'}. Best is trial 2752 with value: 0.5150722622871399.
Generating morgan_rdkit fingerprints...
Generated fingerprints with 1024 features for 900 molecules
Data shape: X=(900, 1024), y=(900,)
Trial 2803: 5-fold CV loss = 0.5318
[I 2025-08-08 07:59:20,371] Trial 2803 finished with value: 0.5317680537700653 and parameters: {'fp_type': 'morgan', 'morgan_only_radius': 2, 'morgan_only_nBits': 2048, 'num_hidden_layers': 3, 'hidden_dim_0': 512, 'hidden_dim_1': 128, 'hidden_dim_2': 512, 'kl_weight': 0.00021133642628942074, 'lr': 0.00199359575639293, 'batch_size': 32, 'dropout_rate': 0.4681305682811843, 'prior_mu': 0.014696232294676034, 'prior_sigma': 0.07838980499806916, 'normalization': 'none'}. Best is trial 2752 with value: 0.5150722622871399.
Generating morgan_rdkit fingerprints...
Generated fingerprints with 1024 features for 900 molecules
Data shape: X=(900, 1024), y=(900,)
Trial 2809: 5-fold CV loss = 0.6737
[I 2025-08-08 07:59:30,117] Trial 2809 finished with value: 0.6737424731254578 and parameters: {'fp_type': 'morgan_rdkit', 'combined_morgan_radius': 3, 'combined_morgan_nBits': 512, 'combined_rdkit_maxPath': 6, 'combined_rdkit_nBits': 512, 'num_hidden_layers': 3, 'hidden_dim_0': 512, 'hidden_dim_1': 128, 'hidden_dim_2': 512, 'kl_weight': 0.0002943887308705224, 'lr': 0.0016551785742602203, 'batch_size': 128, 'dropout_rate': 0.3822515708916348, 'prior_mu': -0.10478284991113834, 'prior_sigma': 0.0555123355557777, 'normalization': 'layer'}. Best is trial 2752 with value: 0.5150722622871399.
Generating morgan fingerprints...
Generated fingerprints with 2048 features for 900 molecules
Data shape: X=(900, 2048), y=(900,)
Trial 2810: 5-fold CV loss = 0.6738
[I 2025-08-08 07:59:45,414] Trial 2810 finished with value: 0.6738216280937195 and parameters: {'fp_type': 'morgan_rdkit', 'combined_morgan_radius': 3, 'combined_morgan_nBits': 512, 'combined_rdkit_maxPath': 6, 'combined_rdkit_nBits': 512, 'num_hidden_layers': 3, 'hidden_dim_0': 1024, 'hidden_dim_1': 128, 'hidden_dim_2': 512, 'kl_weight': 0.0003134991316746746, 'lr': 0.0017131427830954574, 'batch_size': 64, 'dropout_rate': 0.44868100989215975, 'prior_mu': 0.034052502326329746, 'prior_sigma': 0.05358544442493025, 'normalization': 'layer'}. Best is trial 2752 with value: 0.5150722622871399.
Generating morgan fingerprints...
Generated fingerprints with 2048 features for 900 molecules
Data shape: X=(900, 2048), y=(900,)
Trial 2807: 5-fold CV loss = 0.6121
[I 2025-08-08 07:59:55,450] Trial 2807 finished with value: 0.6120923459529877 and parameters: {'fp_type': 'morgan', 'morgan_only_radius': 2, 'morgan_only_nBits': 2048, 'num_hidden_layers': 3, 'hidden_dim_0': 512, 'hidden_dim_1': 128, 'hidden_dim_2': 512, 'kl_weight': 0.0002291558693984287, 'lr': 0.0017498393677518244, 'batch_size': 32, 'dropout_rate': 0.44881954872514956, 'prior_mu': 0.03534142690407874, 'prior_sigma': 0.05520732355798627, 'normalization': 'none'}. Best is trial 2752 with value: 0.5150722622871399.
Generating morgan fingerprints...
Generated fingerprints with 2048 features for 900 molecules
Data shape: X=(900, 2048), y=(900,)
Trial 2811: 5-fold CV loss = 0.6203
[I 2025-08-08 08:00:01,454] Trial 2811 finished with value: 0.6202957272529602 and parameters: {'fp_type': 'morgan', 'morgan_only_radius': 2, 'morgan_only_nBits': 2048, 'num_hidden_layers': 3, 'hidden_dim_0': 1024, 'hidden_dim_1': 128, 'hidden_dim_2': 64, 'kl_weight': 0.0010716122361652065, 'lr': 0.0020425543655191365, 'batch_size': 64, 'dropout_rate': 0.44300399014507963, 'prior_mu': 0.03212215285426465, 'prior_sigma': 0.06386211762865855, 'normalization': 'none'}. Best is trial 2752 with value: 0.5150722622871399.
Generating morgan fingerprints...
Generated fingerprints with 2048 features for 900 molecules
Data shape: X=(900, 2048), y=(900,)
Trial 2813: 5-fold CV loss = 0.7474
[I 2025-08-08 08:00:20,893] Trial 2813 finished with value: 0.7473899006843567 and parameters: {'fp_type': 'morgan', 'morgan_only_radius': 2, 'morgan_only_nBits': 2048, 'num_hidden_layers': 1, 'hidden_dim_0': 512, 'kl_weight': 0.001165595257629729, 'lr': 0.0020310328586710022, 'batch_size': 32, 'dropout_rate': 0.4478619482497576, 'prior_mu': 0.04643063820629671, 'prior_sigma': 0.06377074728423049, 'normalization': 'none'}. Best is trial 2752 with value: 0.5150722622871399.
Generating morgan fingerprints...
Generated fingerprints with 2048 features for 900 molecules
Data shape: X=(900, 2048), y=(900,)
Trial 2814: 5-fold CV loss = 0.8729
[I 2025-08-08 08:00:38,418] Trial 2814 finished with value: 0.8729033529758453 and parameters: {'fp_type': 'morgan', 'morgan_only_radius': 2, 'morgan_only_nBits': 2048, 'num_hidden_layers': 3, 'hidden_dim_0': 512, 'hidden_dim_1': 128, 'hidden_dim_2': 512, 'kl_weight': 0.0009359410355484258, 'lr': 0.001612236725370833, 'batch_size': 32, 'dropout_rate': 0.4549542532880675, 'prior_mu': 0.020578105072663107, 'prior_sigma': 0.07251710222206081, 'normalization': 'none'}. Best is trial 2752 with value: 0.5150722622871399.
Generating morgan fingerprints...
Generated fingerprints with 2048 features for 900 molecules
Data shape: X=(900, 2048), y=(900,)
Trial 2815: 5-fold CV loss = 1.5545
[I 2025-08-08 08:00:57,974] Trial 2815 finished with value: 1.5544994831085206 and parameters: {'fp_type': 'morgan', 'morgan_only_radius': 3, 'morgan_only_nBits': 2048, 'num_hidden_layers': 3, 'hidden_dim_0': 512, 'hidden_dim_1': 128, 'hidden_dim_2': 512, 'kl_weight': 0.0009070396240415653, 'lr': 0.0002053446181761166, 'batch_size': 32, 'dropout_rate': 0.4705000471299285, 'prior_mu': 0.09047973395525497, 'prior_sigma': 0.07447520033734925, 'normalization': 'none'}. Best is trial 2752 with value: 0.5150722622871399.
Generating morgan fingerprints...
Generated fingerprints with 2048 features for 900 molecules
Data shape: X=(900, 2048), y=(900,)
Trial 2812: 5-fold CV loss = 0.5324
[I 2025-08-08 08:01:32,905] Trial 2812 finished with value: 0.5323610901832581 and parameters: {'fp_type': 'morgan', 'morgan_only_radius': 2, 'morgan_only_nBits': 2048, 'num_hidden_layers': 3, 'hidden_dim_0': 512, 'hidden_dim_1': 128, 'hidden_dim_2': 512, 'kl_weight': 0.00022223688181114313, 'lr': 0.0020714270583521363, 'batch_size': 32, 'dropout_rate': 0.4490942380496305, 'prior_mu': 0.09082087085593167, 'prior_sigma': 0.06346579729816228, 'normalization': 'none'}. Best is trial 2752 with value: 0.5150722622871399.
Generating morgan fingerprints...
Generated fingerprints with 2048 features for 900 molecules
Data shape: X=(900, 2048), y=(900,)
Trial 2816: 5-fold CV loss = 0.5296
[I 2025-08-08 08:02:03,892] Trial 2816 finished with value: 0.5295892477035522 and parameters: {'fp_type': 'morgan', 'morgan_only_radius': 3, 'morgan_only_nBits': 2048, 'num_hidden_layers': 3, 'hidden_dim_0': 512, 'hidden_dim_1': 128, 'hidden_dim_2': 512, 'kl_weight': 0.0009001966683386118, 'lr': 0.00186217847641836, 'batch_size': 32, 'dropout_rate': 0.46063044726658686, 'prior_mu': 0.04087464111516029, 'prior_sigma': 0.05836289024081441, 'normalization': 'none'}. Best is trial 2752 with value: 0.5150722622871399.
Generating morgan fingerprints...
Generated fingerprints with 2048 features for 900 molecules
Data shape: X=(900, 2048), y=(900,)
Trial 2817: 5-fold CV loss = 0.5550
[I 2025-08-08 08:02:26,468] Trial 2817 finished with value: 0.5550320982933045 and parameters: {'fp_type': 'morgan', 'morgan_only_radius': 2, 'morgan_only_nBits': 2048, 'num_hidden_layers': 3, 'hidden_dim_0': 512, 'hidden_dim_1': 128, 'hidden_dim_2': 512, 'kl_weight': 0.0009069329811448533, 'lr': 0.0018373926179260525, 'batch_size': 32, 'dropout_rate': 0.45845960411293113, 'prior_mu': 0.15155888468149434, 'prior_sigma': 0.059898075733076206, 'normalization': 'none'}. Best is trial 2752 with value: 0.5150722622871399.
Generating morgan fingerprints...
Generated fingerprints with 2048 features for 900 molecules
Data shape: X=(900, 2048), y=(900,)
Trial 2819: 5-fold CV loss = 0.5537
[I 2025-08-08 08:03:08,221] Trial 2819 finished with value: 0.5536602139472961 and parameters: {'fp_type': 'morgan', 'morgan_only_radius': 2, 'morgan_only_nBits': 2048, 'num_hidden_layers': 3, 'hidden_dim_0': 512, 'hidden_dim_1': 128, 'hidden_dim_2': 512, 'kl_weight': 0.0009117426628485822, 'lr': 0.0018166470012187191, 'batch_size': 32, 'dropout_rate': 0.37952819406260124, 'prior_mu': 0.04996069531607278, 'prior_sigma': 0.07749507108173655, 'normalization': 'none'}. Best is trial 2752 with value: 0.5150722622871399.
Generating morgan fingerprints...
Generated fingerprints with 2048 features for 900 molecules
Data shape: X=(900, 2048), y=(900,)
Trial 2808: 5-fold CV loss = 0.5459
[I 2025-08-08 08:03:17,063] Trial 2808 finished with value: 0.5459118127822876 and parameters: {'fp_type': 'morgan_rdkit', 'combined_morgan_radius': 3, 'combined_morgan_nBits': 512, 'combined_rdkit_maxPath': 6, 'combined_rdkit_nBits': 512, 'num_hidden_layers': 3, 'hidden_dim_0': 512, 'hidden_dim_1': 128, 'hidden_dim_2': 512, 'kl_weight': 0.0009282313685970967, 'lr': 0.0017474784925980045, 'batch_size': 32, 'dropout_rate': 0.3844197529688484, 'prior_mu': 0.03229358508444938, 'prior_sigma': 0.054469163665357825, 'normalization': 'layer'}. Best is trial 2752 with value: 0.5150722622871399.
Generating morgan fingerprints...
Generated fingerprints with 2048 features for 900 molecules
Data shape: X=(900, 2048), y=(900,)
Trial 2818: 5-fold CV loss = 0.5551
[I 2025-08-08 08:03:39,158] Trial 2818 finished with value: 0.5550703048706055 and parameters: {'fp_type': 'morgan', 'morgan_only_radius': 2, 'morgan_only_nBits': 2048, 'num_hidden_layers': 3, 'hidden_dim_0': 512, 'hidden_dim_1': 128, 'hidden_dim_2': 512, 'kl_weight': 0.0002990057558477588, 'lr': 0.0018023461387670604, 'batch_size': 32, 'dropout_rate': 0.3845118945476602, 'prior_mu': 0.04030329893369685, 'prior_sigma': 0.05788214667283777, 'normalization': 'none'}. Best is trial 2752 with value: 0.5150722622871399.
Generating morgan fingerprints...
Generated fingerprints with 2048 features for 900 molecules
Data shape: X=(900, 2048), y=(900,)
Trial 2820: 5-fold CV loss = 0.5944
[I 2025-08-08 08:04:04,343] Trial 2820 finished with value: 0.5944067597389221 and parameters: {'fp_type': 'morgan', 'morgan_only_radius': 2, 'morgan_only_nBits': 2048, 'num_hidden_layers': 3, 'hidden_dim_0': 512, 'hidden_dim_1': 128, 'hidden_dim_2': 512, 'kl_weight': 0.0010561406748578483, 'lr': 0.001546462221414104, 'batch_size': 32, 'dropout_rate': 0.44748557840679076, 'prior_mu': 0.04730927080742129, 'prior_sigma': 0.0773557542132144, 'normalization': 'none'}. Best is trial 2752 with value: 0.5150722622871399.
Generating morgan fingerprints...
Generated fingerprints with 2048 features for 900 molecules
Data shape: X=(900, 2048), y=(900,)
Trial 2821: 5-fold CV loss = 0.5268
[I 2025-08-08 08:04:33,626] Trial 2821 finished with value: 0.5267633974552155 and parameters: {'fp_type': 'morgan', 'morgan_only_radius': 2, 'morgan_only_nBits': 2048, 'num_hidden_layers': 3, 'hidden_dim_0': 512, 'hidden_dim_1': 128, 'hidden_dim_2': 512, 'kl_weight': 0.00015735731552217683, 'lr': 0.0020784449985859193, 'batch_size': 32, 'dropout_rate': 0.4448297995628994, 'prior_mu': 0.02446115815044705, 'prior_sigma': 0.06771931710572938, 'normalization': 'none'}. Best is trial 2752 with value: 0.5150722622871399.
Generating morgan fingerprints...
Generated fingerprints with 2048 features for 900 molecules
Data shape: X=(900, 2048), y=(900,)
Trial 2825: 5-fold CV loss = 1.1654
[I 2025-08-08 08:04:58,959] Trial 2825 finished with value: 1.165377712249756 and parameters: {'fp_type': 'morgan', 'morgan_only_radius': 2, 'morgan_only_nBits': 2048, 'num_hidden_layers': 3, 'hidden_dim_0': 512, 'hidden_dim_1': 1024, 'hidden_dim_2': 512, 'kl_weight': 0.000253145958609253, 'lr': 0.0021025862473186023, 'batch_size': 32, 'dropout_rate': 0.4705882386913553, 'prior_mu': 0.020621166954834284, 'prior_sigma': 0.07155013447550981, 'normalization': 'none'}. Best is trial 2752 with value: 0.5150722622871399.
Generating morgan fingerprints...
Generated fingerprints with 2048 features for 900 molecules
Data shape: X=(900, 2048), y=(900,)
Trial 2826: 5-fold CV loss = 0.6459
[I 2025-08-08 08:05:14,368] Trial 2826 finished with value: 0.6459397673606873 and parameters: {'fp_type': 'morgan', 'morgan_only_radius': 2, 'morgan_only_nBits': 2048, 'num_hidden_layers': 3, 'hidden_dim_0': 64, 'hidden_dim_1': 128, 'hidden_dim_2': 512, 'kl_weight': 0.00022457057004277945, 'lr': 0.0020260218682719025, 'batch_size': 128, 'dropout_rate': 0.053658282515026245, 'prior_mu': 0.05150242809127098, 'prior_sigma': 0.04773373740373505, 'normalization': 'none'}. Best is trial 2752 with value: 0.5150722622871399.
Generating morgan fingerprints...
Generated fingerprints with 2048 features for 900 molecules
Data shape: X=(900, 2048), y=(900,)
Trial 2823: 5-fold CV loss = 0.5847
[I 2025-08-08 08:05:28,319] Trial 2823 finished with value: 0.5846562445163727 and parameters: {'fp_type': 'morgan', 'morgan_only_radius': 2, 'morgan_only_nBits': 2048, 'num_hidden_layers': 3, 'hidden_dim_0': 64, 'hidden_dim_1': 1024, 'hidden_dim_2': 512, 'kl_weight': 0.0010967298855035154, 'lr': 0.0015561846798974968, 'batch_size': 32, 'dropout_rate': 0.47196426527284824, 'prior_mu': 0.02156880172065778, 'prior_sigma': 0.06841361505670303, 'normalization': 'none'}. Best is trial 2752 with value: 0.5150722622871399.
Generating morgan fingerprints...
Generated fingerprints with 2048 features for 900 molecules
Data shape: X=(900, 2048), y=(900,)
Trial 2824: 5-fold CV loss = 0.5689
[I 2025-08-08 08:05:46,040] Trial 2824 finished with value: 0.5689158082008362 and parameters: {'fp_type': 'morgan', 'morgan_only_radius': 2, 'morgan_only_nBits': 2048, 'num_hidden_layers': 3, 'hidden_dim_0': 64, 'hidden_dim_1': 1024, 'hidden_dim_2': 512, 'kl_weight': 0.00025949079177193943, 'lr': 0.0020592426511068006, 'batch_size': 32, 'dropout_rate': 0.47113579268476874, 'prior_mu': 0.023416385229203487, 'prior_sigma': 0.07035022342872413, 'normalization': 'none'}. Best is trial 2752 with value: 0.5150722622871399.
Generating morgan fingerprints...
Generated fingerprints with 2048 features for 900 molecules
Data shape: X=(900, 2048), y=(900,)
Trial 2828: 5-fold CV loss = 1.1746
[I 2025-08-08 08:05:54,720] Trial 2828 finished with value: 1.1745821237564087 and parameters: {'fp_type': 'morgan', 'morgan_only_radius': 2, 'morgan_only_nBits': 2048, 'num_hidden_layers': 3, 'hidden_dim_0': 512, 'hidden_dim_1': 128, 'hidden_dim_2': 512, 'kl_weight': 0.0008490327654466918, 'lr': 0.0007841998090950855, 'batch_size': 64, 'dropout_rate': 0.45619709669157804, 'prior_mu': 0.0406878860825309, 'prior_sigma': 0.07442839141355508, 'normalization': 'none'}. Best is trial 2752 with value: 0.5150722622871399.
Generating morgan fingerprints...
Generated fingerprints with 2048 features for 900 molecules
Data shape: X=(900, 2048), y=(900,)
Trial 2829: 5-fold CV loss = 1.2137
[I 2025-08-08 08:06:03,894] Trial 2829 finished with value: 1.2136979818344116 and parameters: {'fp_type': 'morgan', 'morgan_only_radius': 2, 'morgan_only_nBits': 2048, 'num_hidden_layers': 3, 'hidden_dim_0': 512, 'hidden_dim_1': 128, 'hidden_dim_2': 512, 'kl_weight': 0.000877014352740588, 'lr': 0.00035168753490633347, 'batch_size': 64, 'dropout_rate': 0.45580356777134035, 'prior_mu': -0.1456757418557475, 'prior_sigma': 0.07361588882133555, 'normalization': 'none'}. Best is trial 2752 with value: 0.5150722622871399.
Generating morgan fingerprints...
Generated fingerprints with 2048 features for 900 molecules
Data shape: X=(900, 2048), y=(900,)
Trial 2827: 5-fold CV loss = 0.5435
[I 2025-08-08 08:06:38,697] Trial 2827 finished with value: 0.5435451388359069 and parameters: {'fp_type': 'morgan', 'morgan_only_radius': 2, 'morgan_only_nBits': 2048, 'num_hidden_layers': 3, 'hidden_dim_0': 512, 'hidden_dim_1': 512, 'hidden_dim_2': 512, 'kl_weight': 0.00016887039759160322, 'lr': 0.004170564930079088, 'batch_size': 32, 'dropout_rate': 0.456600268712194, 'prior_mu': 0.03910682395926564, 'prior_sigma': 0.06687795657861567, 'normalization': 'none'}. Best is trial 2752 with value: 0.5150722622871399.
Generating morgan fingerprints...
Generated fingerprints with 2048 features for 900 molecules
Data shape: X=(900, 2048), y=(900,)
Trial 2822: 5-fold CV loss = 0.5664
[I 2025-08-08 08:06:59,389] Trial 2822 finished with value: 0.566376006603241 and parameters: {'fp_type': 'morgan', 'morgan_only_radius': 2, 'morgan_only_nBits': 2048, 'num_hidden_layers': 3, 'hidden_dim_0': 64, 'hidden_dim_1': 128, 'hidden_dim_2': 512, 'kl_weight': 0.00015725204937478465, 'lr': 0.0015544860661905076, 'batch_size': 32, 'dropout_rate': 0.4454419659151892, 'prior_mu': 0.020263307973330334, 'prior_sigma': 0.06753952513090816, 'normalization': 'none'}. Best is trial 2752 with value: 0.5150722622871399.
Generating morgan fingerprints...
Generated fingerprints with 2048 features for 900 molecules
Data shape: X=(900, 2048), y=(900,)
Trial 2832: 5-fold CV loss = 0.6882
[I 2025-08-08 08:07:07,963] Trial 2832 finished with value: 0.6882218480110168 and parameters: {'fp_type': 'morgan', 'morgan_only_radius': 2, 'morgan_only_nBits': 2048, 'num_hidden_layers': 2, 'hidden_dim_0': 512, 'hidden_dim_1': 128, 'kl_weight': 0.0010131692966691202, 'lr': 0.0019189724702794442, 'batch_size': 32, 'dropout_rate': 0.4421493640483925, 'prior_mu': 0.03211799002018678, 'prior_sigma': 0.06244658649786416, 'normalization': 'none'}. Best is trial 2752 with value: 0.5150722622871399.
Generating morgan fingerprints...
Generated fingerprints with 2048 features for 900 molecules
Data shape: X=(900, 2048), y=(900,)
Trial 2831: 5-fold CV loss = 0.6036
[I 2025-08-08 08:07:21,241] Trial 2831 finished with value: 0.6036325752735138 and parameters: {'fp_type': 'morgan', 'morgan_only_radius': 2, 'morgan_only_nBits': 2048, 'num_hidden_layers': 3, 'hidden_dim_0': 512, 'hidden_dim_1': 128, 'hidden_dim_2': 512, 'kl_weight': 0.0001734124057509622, 'lr': 0.0019292626795764638, 'batch_size': 32, 'dropout_rate': 0.4448238428664047, 'prior_mu': 0.03171481458201473, 'prior_sigma': 0.06498031418585667, 'normalization': 'none'}. Best is trial 2752 with value: 0.5150722622871399.
Generating morgan fingerprints...
Generated fingerprints with 2048 features for 900 molecules
Data shape: X=(900, 2048), y=(900,)
Trial 2833: 5-fold CV loss = 0.6944
