[I 2025-08-08 00:15:24,814] Trial 1447 finished with value: 0.5624995648860931 and parameters: {'fp_type': 'morgan', 'morgan_only_radius': 2, 'morgan_only_nBits': 2048, 'num_hidden_layers': 3, 'hidden_dim_0': 512, 'hidden_dim_1': 128, 'hidden_dim_2': 512, 'kl_weight': 0.0004262338900310507, 'lr': 0.0018483783502597705, 'batch_size': 32, 'dropout_rate': 0.4608252470702183, 'prior_mu': 0.043216045278574755, 'prior_sigma': 0.06911329435439428, 'normalization': 'none'}. Best is trial 1400 with value: 0.5178181529045105.
Generating morgan fingerprints...
Generated fingerprints with 2048 features for 900 molecules
Data shape: X=(900, 2048), y=(900,)
Trial 1450: 5-fold CV loss = 0.7498
[I 2025-08-08 00:15:44,118] Trial 1450 finished with value: 0.7497634053230285 and parameters: {'fp_type': 'morgan', 'morgan_only_radius': 3, 'morgan_only_nBits': 2048, 'num_hidden_layers': 3, 'hidden_dim_0': 512, 'hidden_dim_1': 128, 'hidden_dim_2': 1024, 'kl_weight': 0.0004641257029660065, 'lr': 0.002004423865972408, 'batch_size': 64, 'dropout_rate': 0.42278271980497256, 'prior_mu': 0.034463304313036104, 'prior_sigma': 0.06279413398026484, 'normalization': 'none'}. Best is trial 1400 with value: 0.5178181529045105.
Generating morgan fingerprints...
Generated fingerprints with 2048 features for 900 molecules
Data shape: X=(900, 2048), y=(900,)
Trial 1448: 5-fold CV loss = 0.5315
[I 2025-08-08 00:16:03,305] Trial 1448 finished with value: 0.5314653158187866 and parameters: {'fp_type': 'morgan', 'morgan_only_radius': 3, 'morgan_only_nBits': 2048, 'num_hidden_layers': 3, 'hidden_dim_0': 512, 'hidden_dim_1': 128, 'hidden_dim_2': 512, 'kl_weight': 0.0004569176653147716, 'lr': 0.001878762786686939, 'batch_size': 32, 'dropout_rate': 0.4612966524230028, 'prior_mu': 0.04327288024606987, 'prior_sigma': 0.08149516896558617, 'normalization': 'none'}. Best is trial 1400 with value: 0.5178181529045105.
Generating morgan fingerprints...
Generated fingerprints with 2048 features for 900 molecules
Data shape: X=(900, 2048), y=(900,)
Trial 1446: 5-fold CV loss = 0.8266
[I 2025-08-08 00:16:31,719] Trial 1446 finished with value: 0.8266247630119323 and parameters: {'fp_type': 'morgan', 'morgan_only_radius': 3, 'morgan_only_nBits': 2048, 'num_hidden_layers': 3, 'hidden_dim_0': 512, 'hidden_dim_1': 1024, 'hidden_dim_2': 512, 'kl_weight': 0.0005700401605274367, 'lr': 0.001772296795748116, 'batch_size': 32, 'dropout_rate': 0.4447453655937996, 'prior_mu': 0.05453263490600127, 'prior_sigma': 0.06519470929769317, 'normalization': 'none'}. Best is trial 1400 with value: 0.5178181529045105.
Generating morgan fingerprints...
Generated fingerprints with 2048 features for 900 molecules
Data shape: X=(900, 2048), y=(900,)
Trial 1451: 5-fold CV loss = 0.5276
[I 2025-08-08 00:17:03,203] Trial 1451 finished with value: 0.52758868932724 and parameters: {'fp_type': 'morgan', 'morgan_only_radius': 2, 'morgan_only_nBits': 2048, 'num_hidden_layers': 3, 'hidden_dim_0': 512, 'hidden_dim_1': 128, 'hidden_dim_2': 512, 'kl_weight': 0.0006181765620240465, 'lr': 0.002040140498291881, 'batch_size': 32, 'dropout_rate': 0.43194005308974315, 'prior_mu': 0.025857295935851333, 'prior_sigma': 0.08009234205410051, 'normalization': 'none'}. Best is trial 1400 with value: 0.5178181529045105.
Generating morgan fingerprints...
Generated fingerprints with 2048 features for 900 molecules
Data shape: X=(900, 2048), y=(900,)
Trial 1452: 5-fold CV loss = 0.5772
[I 2025-08-08 00:17:10,308] Trial 1452 finished with value: 0.577158522605896 and parameters: {'fp_type': 'morgan', 'morgan_only_radius': 2, 'morgan_only_nBits': 2048, 'num_hidden_layers': 3, 'hidden_dim_0': 128, 'hidden_dim_1': 128, 'hidden_dim_2': 64, 'kl_weight': 0.0006994082363923468, 'lr': 0.0020297905018395457, 'batch_size': 32, 'dropout_rate': 0.436483939975333, 'prior_mu': 0.026647534451148633, 'prior_sigma': 0.06360570294294034, 'normalization': 'none'}. Best is trial 1400 with value: 0.5178181529045105.
Generating morgan_rdkit fingerprints...
Generated fingerprints with 1024 features for 900 molecules
Data shape: X=(900, 1024), y=(900,)
Trial 1449: 5-fold CV loss = 0.5262
[I 2025-08-08 00:17:21,397] Trial 1449 finished with value: 0.5262215375900269 and parameters: {'fp_type': 'morgan', 'morgan_only_radius': 2, 'morgan_only_nBits': 2048, 'num_hidden_layers': 3, 'hidden_dim_0': 512, 'hidden_dim_1': 128, 'hidden_dim_2': 1024, 'kl_weight': 0.0004952891906013242, 'lr': 0.0019708829252488617, 'batch_size': 32, 'dropout_rate': 0.4599222849173907, 'prior_mu': 0.02633663784561124, 'prior_sigma': 0.06378631350681156, 'normalization': 'none'}. Best is trial 1400 with value: 0.5178181529045105.
Generating morgan fingerprints...
Generated fingerprints with 2048 features for 900 molecules
Data shape: X=(900, 2048), y=(900,)
Trial 1455: 5-fold CV loss = 0.6398
[I 2025-08-08 00:18:05,709] Trial 1455 finished with value: 0.6398497939109802 and parameters: {'fp_type': 'morgan_rdkit', 'combined_morgan_radius': 3, 'combined_morgan_nBits': 512, 'combined_rdkit_maxPath': 6, 'combined_rdkit_nBits': 512, 'num_hidden_layers': 3, 'hidden_dim_0': 512, 'hidden_dim_1': 128, 'hidden_dim_2': 512, 'kl_weight': 0.0008212451797339232, 'lr': 0.0014973538988222092, 'batch_size': 32, 'dropout_rate': 0.46040888141362046, 'prior_mu': 0.060438253797478504, 'prior_sigma': 0.07110286114826796, 'normalization': 'layer'}. Best is trial 1400 with value: 0.5178181529045105.
Generating morgan fingerprints...
Generated fingerprints with 2048 features for 900 molecules
Data shape: X=(900, 2048), y=(900,)
Trial 1454: 5-fold CV loss = 0.5647
[I 2025-08-08 00:18:16,730] Trial 1454 finished with value: 0.564691811800003 and parameters: {'fp_type': 'morgan', 'morgan_only_radius': 2, 'morgan_only_nBits': 2048, 'num_hidden_layers': 3, 'hidden_dim_0': 128, 'hidden_dim_1': 128, 'hidden_dim_2': 512, 'kl_weight': 0.0008169643262550569, 'lr': 0.0020094176988022286, 'batch_size': 32, 'dropout_rate': 0.4619357352419474, 'prior_mu': 0.060165230848964475, 'prior_sigma': 0.0711157816336193, 'normalization': 'none'}. Best is trial 1400 with value: 0.5178181529045105.
Generating morgan fingerprints...
Generated fingerprints with 2048 features for 900 molecules
Data shape: X=(900, 2048), y=(900,)
Trial 1458: 5-fold CV loss = 2.3296
[I 2025-08-08 00:18:52,675] Trial 1458 finished with value: 2.329559564590454 and parameters: {'fp_type': 'morgan', 'morgan_only_radius': 2, 'morgan_only_nBits': 2048, 'num_hidden_layers': 3, 'hidden_dim_0': 256, 'hidden_dim_1': 128, 'hidden_dim_2': 512, 'kl_weight': 0.0006549837663242491, 'lr': 0.0016825935559349231, 'batch_size': 32, 'dropout_rate': 0.4500180535930802, 'prior_mu': 0.036107548912280775, 'prior_sigma': 0.18695751770445493, 'normalization': 'none'}. Best is trial 1400 with value: 0.5178181529045105.
Generating morgan fingerprints...
Generated fingerprints with 2048 features for 900 molecules
Data shape: X=(900, 2048), y=(900,)
Trial 1456: 5-fold CV loss = 0.5445
[I 2025-08-08 00:19:14,222] Trial 1456 finished with value: 0.5445311486721038 and parameters: {'fp_type': 'morgan', 'morgan_only_radius': 2, 'morgan_only_nBits': 2048, 'num_hidden_layers': 3, 'hidden_dim_0': 512, 'hidden_dim_1': 128, 'hidden_dim_2': 512, 'kl_weight': 0.0008334520571738664, 'lr': 0.0015944885786373084, 'batch_size': 32, 'dropout_rate': 0.4485895996704336, 'prior_mu': 0.05695335318952572, 'prior_sigma': 0.06991103621676259, 'normalization': 'layer'}. Best is trial 1400 with value: 0.5178181529045105.
Generating morgan fingerprints...
Generated fingerprints with 2048 features for 900 molecules
Data shape: X=(900, 2048), y=(900,)
Trial 1457: 5-fold CV loss = 0.6341
[I 2025-08-08 00:19:19,089] Trial 1457 finished with value: 0.6340541124343873 and parameters: {'fp_type': 'morgan', 'morgan_only_radius': 2, 'morgan_only_nBits': 2048, 'num_hidden_layers': 3, 'hidden_dim_0': 256, 'hidden_dim_1': 128, 'hidden_dim_2': 512, 'kl_weight': 0.0009419484018336387, 'lr': 0.0016656996857968415, 'batch_size': 32, 'dropout_rate': 0.44933309936731297, 'prior_mu': 0.04902588556398763, 'prior_sigma': 0.06887934135160542, 'normalization': 'none'}. Best is trial 1400 with value: 0.5178181529045105.
Generating morgan fingerprints...
Generated fingerprints with 2048 features for 900 molecules
Data shape: X=(900, 2048), y=(900,)
Trial 1461: 5-fold CV loss = 0.8132
[I 2025-08-08 00:19:47,466] Trial 1461 finished with value: 0.8131914019584656 and parameters: {'fp_type': 'morgan', 'morgan_only_radius': 2, 'morgan_only_nBits': 2048, 'num_hidden_layers': 3, 'hidden_dim_0': 512, 'hidden_dim_1': 128, 'hidden_dim_2': 512, 'kl_weight': 0.0010060533739778034, 'lr': 0.0004281673836175588, 'batch_size': 32, 'dropout_rate': 0.46242581024043167, 'prior_mu': 0.037098598866045995, 'prior_sigma': 0.06047319862828132, 'normalization': 'none'}. Best is trial 1400 with value: 0.5178181529045105.
Generating morgan fingerprints...
Generated fingerprints with 2048 features for 900 molecules
Data shape: X=(900, 2048), y=(900,)
Trial 1453: 5-fold CV loss = 0.6071
[I 2025-08-08 00:20:06,281] Trial 1453 finished with value: 0.6071484565734864 and parameters: {'fp_type': 'morgan', 'morgan_only_radius': 2, 'morgan_only_nBits': 2048, 'num_hidden_layers': 3, 'hidden_dim_0': 128, 'hidden_dim_1': 128, 'hidden_dim_2': 512, 'kl_weight': 0.0006689917143319553, 'lr': 0.0016229395064865434, 'batch_size': 32, 'dropout_rate': 0.4362503317328464, 'prior_mu': 0.02579734316245093, 'prior_sigma': 0.07067125403860801, 'normalization': 'none'}. Best is trial 1400 with value: 0.5178181529045105.
Generating morgan fingerprints...
Generated fingerprints with 2048 features for 900 molecules
Data shape: X=(900, 2048), y=(900,)
Trial 1459: 5-fold CV loss = 0.5285
[I 2025-08-08 00:20:24,732] Trial 1459 finished with value: 0.5285329818725586 and parameters: {'fp_type': 'morgan', 'morgan_only_radius': 2, 'morgan_only_nBits': 2048, 'num_hidden_layers': 3, 'hidden_dim_0': 512, 'hidden_dim_1': 128, 'hidden_dim_2': 512, 'kl_weight': 0.0008969435360549309, 'lr': 0.00185190105220528, 'batch_size': 32, 'dropout_rate': 0.44660425567466705, 'prior_mu': 0.049989433806412756, 'prior_sigma': 0.060274341039617665, 'normalization': 'none'}. Best is trial 1400 with value: 0.5178181529045105.
Generating morgan fingerprints...
Generated fingerprints with 2048 features for 900 molecules
Data shape: X=(900, 2048), y=(900,)
Trial 1462: 5-fold CV loss = 0.5401
[I 2025-08-08 00:21:34,828] Trial 1462 finished with value: 0.5401159167289734 and parameters: {'fp_type': 'morgan', 'morgan_only_radius': 2, 'morgan_only_nBits': 2048, 'num_hidden_layers': 3, 'hidden_dim_0': 512, 'hidden_dim_1': 128, 'hidden_dim_2': 512, 'kl_weight': 0.0006970368124602348, 'lr': 0.0018318555117137472, 'batch_size': 32, 'dropout_rate': 0.4645401512248325, 'prior_mu': 0.05070905470244281, 'prior_sigma': 0.0604649764688676, 'normalization': 'none'}. Best is trial 1400 with value: 0.5178181529045105.
Generating morgan fingerprints...
Generated fingerprints with 2048 features for 900 molecules
Data shape: X=(900, 2048), y=(900,)
Trial 1464: 5-fold CV loss = 0.5250
[I 2025-08-08 00:21:47,460] Trial 1464 finished with value: 0.5250173270702362 and parameters: {'fp_type': 'morgan', 'morgan_only_radius': 2, 'morgan_only_nBits': 2048, 'num_hidden_layers': 3, 'hidden_dim_0': 512, 'hidden_dim_1': 128, 'hidden_dim_2': 512, 'kl_weight': 0.0007323643128611439, 'lr': 0.002081456923433338, 'batch_size': 32, 'dropout_rate': 0.4659566767817792, 'prior_mu': 0.07221509186300605, 'prior_sigma': 0.07424168241331887, 'normalization': 'none'}. Best is trial 1400 with value: 0.5178181529045105.
Generating morgan fingerprints...
Generated fingerprints with 2048 features for 900 molecules
Data shape: X=(900, 2048), y=(900,)
Trial 1460: 5-fold CV loss = 0.5311
[I 2025-08-08 00:22:04,515] Trial 1460 finished with value: 0.5311417043209076 and parameters: {'fp_type': 'morgan', 'morgan_only_radius': 2, 'morgan_only_nBits': 2048, 'num_hidden_layers': 3, 'hidden_dim_0': 512, 'hidden_dim_1': 128, 'hidden_dim_2': 512, 'kl_weight': 0.0009606305447027053, 'lr': 0.0018771230283589715, 'batch_size': 32, 'dropout_rate': 0.46350566207492455, 'prior_mu': 0.05149729183248128, 'prior_sigma': 0.06044254152821542, 'normalization': 'none'}. Best is trial 1400 with value: 0.5178181529045105.
Generating morgan fingerprints...
Generated fingerprints with 2048 features for 900 molecules
Data shape: X=(900, 2048), y=(900,)
Trial 1466: 5-fold CV loss = 0.5688
[I 2025-08-08 00:22:50,755] Trial 1466 finished with value: 0.5687702775001526 and parameters: {'fp_type': 'morgan', 'morgan_only_radius': 2, 'morgan_only_nBits': 2048, 'num_hidden_layers': 3, 'hidden_dim_0': 512, 'hidden_dim_1': 128, 'hidden_dim_2': 512, 'kl_weight': 0.0004986002946726863, 'lr': 0.002056432004412423, 'batch_size': 32, 'dropout_rate': 0.4626515450879092, 'prior_mu': 0.06323477793437095, 'prior_sigma': 0.06598194606855204, 'normalization': 'none'}. Best is trial 1400 with value: 0.5178181529045105.
Generating morgan fingerprints...
Generated fingerprints with 2048 features for 900 molecules
Data shape: X=(900, 2048), y=(900,)
Trial 1465: 5-fold CV loss = 0.5231
[I 2025-08-08 00:23:03,650] Trial 1465 finished with value: 0.5231029450893402 and parameters: {'fp_type': 'morgan', 'morgan_only_radius': 2, 'morgan_only_nBits': 2048, 'num_hidden_layers': 3, 'hidden_dim_0': 512, 'hidden_dim_1': 128, 'hidden_dim_2': 512, 'kl_weight': 0.0010209714827831816, 'lr': 0.002055822634259457, 'batch_size': 32, 'dropout_rate': 0.4619710086039097, 'prior_mu': 0.0658920824763319, 'prior_sigma': 0.07532967753774335, 'normalization': 'none'}. Best is trial 1400 with value: 0.5178181529045105.
Generating morgan fingerprints...
Generated fingerprints with 2048 features for 900 molecules
Data shape: X=(900, 2048), y=(900,)
Trial 1469: 5-fold CV loss = 0.6879
[I 2025-08-08 00:23:22,435] Trial 1469 finished with value: 0.6878742218017578 and parameters: {'fp_type': 'morgan', 'morgan_only_radius': 2, 'morgan_only_nBits': 2048, 'num_hidden_layers': 0, 'kl_weight': 0.000815084182274175, 'lr': 0.0020847354164448867, 'batch_size': 32, 'dropout_rate': 0.4501624565957861, 'prior_mu': 0.07196402387851156, 'prior_sigma': 0.08353028084717955, 'normalization': 'none'}. Best is trial 1400 with value: 0.5178181529045105.
Generating morgan fingerprints...
Generated fingerprints with 2048 features for 900 molecules
Data shape: X=(900, 2048), y=(900,)
Trial 1470: 5-fold CV loss = 1.1406
[I 2025-08-08 00:23:41,344] Trial 1470 finished with value: 1.1406335234642029 and parameters: {'fp_type': 'morgan', 'morgan_only_radius': 2, 'morgan_only_nBits': 2048, 'num_hidden_layers': 3, 'hidden_dim_0': 512, 'hidden_dim_1': 128, 'hidden_dim_2': 512, 'kl_weight': 0.0009730459366684062, 'lr': 0.0013074316491339484, 'batch_size': 64, 'dropout_rate': 0.42806663290966374, 'prior_mu': 0.08377943513406003, 'prior_sigma': 0.07965451078561823, 'normalization': 'none'}. Best is trial 1400 with value: 0.5178181529045105.
Generating rdkit fingerprints...
Generated fingerprints with 256 features for 900 molecules
Data shape: X=(900, 256), y=(900,)
Trial 1468: 5-fold CV loss = 0.5603
[I 2025-08-08 00:23:42,223] Trial 1468 finished with value: 0.5603362679481506 and parameters: {'fp_type': 'morgan', 'morgan_only_radius': 2, 'morgan_only_nBits': 2048, 'num_hidden_layers': 3, 'hidden_dim_0': 512, 'hidden_dim_1': 128, 'hidden_dim_2': 512, 'kl_weight': 0.0010220802006576765, 'lr': 0.0020129802501336015, 'batch_size': 32, 'dropout_rate': 0.22060013357158764, 'prior_mu': 0.04005254740861941, 'prior_sigma': 0.06715059986548251, 'normalization': 'none'}. Best is trial 1400 with value: 0.5178181529045105.
Generating rdkit fingerprints...
Generated fingerprints with 256 features for 900 molecules
Data shape: X=(900, 256), y=(900,)
Trial 1467: 5-fold CV loss = 0.5236
[I 2025-08-08 00:24:03,812] Trial 1467 finished with value: 0.5236117482185364 and parameters: {'fp_type': 'morgan', 'morgan_only_radius': 2, 'morgan_only_nBits': 2048, 'num_hidden_layers': 3, 'hidden_dim_0': 512, 'hidden_dim_1': 128, 'hidden_dim_2': 512, 'kl_weight': 0.0005407055467450174, 'lr': 0.0021011139871404596, 'batch_size': 32, 'dropout_rate': 0.4686020335736543, 'prior_mu': 0.06550876788707707, 'prior_sigma': 0.06563294598181559, 'normalization': 'none'}. Best is trial 1400 with value: 0.5178181529045105.
Generating rdkit fingerprints...
Generated fingerprints with 256 features for 900 molecules
Data shape: X=(900, 256), y=(900,)
Trial 1472: 5-fold CV loss = 0.6688
[I 2025-08-08 00:24:24,311] Trial 1472 finished with value: 0.6687719821929932 and parameters: {'fp_type': 'rdkit', 'rdkit_only_maxPath': 7, 'rdkit_only_nBits': 256, 'num_hidden_layers': 3, 'hidden_dim_0': 512, 'hidden_dim_1': 128, 'hidden_dim_2': 512, 'kl_weight': 0.0007711174905771319, 'lr': 0.002092534138428446, 'batch_size': 32, 'dropout_rate': 0.45236431894283224, 'prior_mu': 0.07745582688480634, 'prior_sigma': 0.07942463032360836, 'normalization': 'none'}. Best is trial 1400 with value: 0.5178181529045105.
Generating morgan fingerprints...
Generated fingerprints with 2048 features for 900 molecules
Data shape: X=(900, 2048), y=(900,)
Trial 1471: 5-fold CV loss = 0.6669
[I 2025-08-08 00:24:37,181] Trial 1471 finished with value: 0.6668878793716431 and parameters: {'fp_type': 'rdkit', 'rdkit_only_maxPath': 7, 'rdkit_only_nBits': 256, 'num_hidden_layers': 3, 'hidden_dim_0': 512, 'hidden_dim_1': 128, 'hidden_dim_2': 512, 'kl_weight': 0.0010005056824287518, 'lr': 0.0020645760915557, 'batch_size': 32, 'dropout_rate': 0.45103797804270807, 'prior_mu': 0.08149495317143568, 'prior_sigma': 0.07798630227735506, 'normalization': 'none'}. Best is trial 1400 with value: 0.5178181529045105.
Generating morgan fingerprints...
Generated fingerprints with 2048 features for 900 molecules
Data shape: X=(900, 2048), y=(900,)
Trial 1463: 5-fold CV loss = 0.5226
[I 2025-08-08 00:25:00,962] Trial 1463 finished with value: 0.5226102292537689 and parameters: {'fp_type': 'morgan', 'morgan_only_radius': 2, 'morgan_only_nBits': 2048, 'num_hidden_layers': 3, 'hidden_dim_0': 512, 'hidden_dim_1': 128, 'hidden_dim_2': 512, 'kl_weight': 0.0010141961902299212, 'lr': 0.0019018717982537169, 'batch_size': 32, 'dropout_rate': 0.46376276777126624, 'prior_mu': 0.07512733521797066, 'prior_sigma': 0.060560942440405725, 'normalization': 'none'}. Best is trial 1400 with value: 0.5178181529045105.
Generating morgan fingerprints...
Generated fingerprints with 2048 features for 900 molecules
Data shape: X=(900, 2048), y=(900,)
Trial 1473: 5-fold CV loss = 0.6596
[I 2025-08-08 00:25:24,371] Trial 1473 finished with value: 0.6595764279365539 and parameters: {'fp_type': 'rdkit', 'rdkit_only_maxPath': 7, 'rdkit_only_nBits': 256, 'num_hidden_layers': 2, 'hidden_dim_0': 512, 'hidden_dim_1': 128, 'kl_weight': 0.0007785657263671212, 'lr': 0.0017838034699566795, 'batch_size': 32, 'dropout_rate': 0.45267532590068704, 'prior_mu': 0.07907106798826635, 'prior_sigma': 0.07779727637524779, 'normalization': 'none'}. Best is trial 1400 with value: 0.5178181529045105.
Generating morgan fingerprints...
Generated fingerprints with 2048 features for 900 molecules
Data shape: X=(900, 2048), y=(900,)
Trial 1474: 5-fold CV loss = 0.7267
[I 2025-08-08 00:25:28,194] Trial 1474 finished with value: 0.7266736149787902 and parameters: {'fp_type': 'morgan', 'morgan_only_radius': 2, 'morgan_only_nBits': 2048, 'num_hidden_layers': 3, 'hidden_dim_0': 512, 'hidden_dim_1': 128, 'hidden_dim_2': 512, 'kl_weight': 0.0010124702371859169, 'lr': 0.0017285587561562167, 'batch_size': 32, 'dropout_rate': 0.43395222865974825, 'prior_mu': 0.0790098848722225, 'prior_sigma': 0.07600159584584881, 'normalization': 'none'}. Best is trial 1400 with value: 0.5178181529045105.
Generating morgan fingerprints...
Generated fingerprints with 2048 features for 900 molecules
Data shape: X=(900, 2048), y=(900,)
Trial 1475: 5-fold CV loss = 0.5657
[I 2025-08-08 00:26:19,344] Trial 1475 finished with value: 0.5656782388687134 and parameters: {'fp_type': 'morgan', 'morgan_only_radius': 2, 'morgan_only_nBits': 2048, 'num_hidden_layers': 3, 'hidden_dim_0': 1024, 'hidden_dim_1': 128, 'hidden_dim_2': 512, 'kl_weight': 0.0008696824262784888, 'lr': 0.0017246679230149282, 'batch_size': 32, 'dropout_rate': 0.4388859210044282, 'prior_mu': 0.06985223928751567, 'prior_sigma': 0.1158497635665929, 'normalization': 'none'}. Best is trial 1400 with value: 0.5178181529045105.
Generating morgan_rdkit fingerprints...
Generated fingerprints with 1024 features for 900 molecules
Data shape: X=(900, 1024), y=(900,)
Trial 1478: 5-fold CV loss = 0.6239
[I 2025-08-08 00:26:31,600] Trial 1478 finished with value: 0.6238595724105835 and parameters: {'fp_type': 'morgan', 'morgan_only_radius': 2, 'morgan_only_nBits': 2048, 'num_hidden_layers': 3, 'hidden_dim_0': 1024, 'hidden_dim_1': 128, 'hidden_dim_2': 64, 'kl_weight': 0.0006334400553099565, 'lr': 0.001498337921264584, 'batch_size': 32, 'dropout_rate': 0.4417772385615737, 'prior_mu': 0.06995407817853845, 'prior_sigma': 0.055469498207499746, 'normalization': 'none'}. Best is trial 1400 with value: 0.5178181529045105.
Generating morgan fingerprints...
Generated fingerprints with 2048 features for 900 molecules
Data shape: X=(900, 2048), y=(900,)
Trial 1477: 5-fold CV loss = 0.6440
[I 2025-08-08 00:26:53,206] Trial 1477 finished with value: 0.6439895153045654 and parameters: {'fp_type': 'morgan', 'morgan_only_radius': 2, 'morgan_only_nBits': 2048, 'num_hidden_layers': 3, 'hidden_dim_0': 1024, 'hidden_dim_1': 128, 'hidden_dim_2': 64, 'kl_weight': 0.00040359462207048406, 'lr': 0.0014993010011873974, 'batch_size': 32, 'dropout_rate': 0.43706181709110287, 'prior_mu': 0.07495551685000723, 'prior_sigma': 0.050954636196668145, 'normalization': 'none'}. Best is trial 1400 with value: 0.5178181529045105.
Generating morgan_rdkit fingerprints...
Generated fingerprints with 1024 features for 900 molecules
Data shape: X=(900, 1024), y=(900,)
Trial 1480: 5-fold CV loss = 0.6650
