[I 2025-08-08 00:04:59,257] Trial 1416 finished with value: 0.5893444299697876 and parameters: {'fp_type': 'morgan', 'morgan_only_radius': 2, 'morgan_only_nBits': 2048, 'num_hidden_layers': 3, 'hidden_dim_0': 512, 'hidden_dim_1': 128, 'hidden_dim_2': 512, 'kl_weight': 0.0005869122990582295, 'lr': 0.0016883325416536588, 'batch_size': 32, 'dropout_rate': 0.4508353862725985, 'prior_mu': 0.047805508121463426, 'prior_sigma': 0.07751127613522861, 'normalization': 'none'}. Best is trial 1400 with value: 0.5178181529045105.
Generating morgan fingerprints...
Generated fingerprints with 2048 features for 900 molecules
Data shape: X=(900, 2048), y=(900,)
Trial 1412: 5-fold CV loss = 0.6244
[I 2025-08-08 00:05:00,797] Trial 1412 finished with value: 0.6244200885295867 and parameters: {'fp_type': 'morgan_rdkit', 'combined_morgan_radius': 2, 'combined_morgan_nBits': 512, 'combined_rdkit_maxPath': 8, 'combined_rdkit_nBits': 256, 'num_hidden_layers': 3, 'hidden_dim_0': 512, 'hidden_dim_1': 128, 'hidden_dim_2': 512, 'kl_weight': 0.0004988769276999662, 'lr': 0.001625898532435399, 'batch_size': 32, 'dropout_rate': 0.43433697214635336, 'prior_mu': 0.04311132383986339, 'prior_sigma': 0.07756557333163086, 'normalization': 'none'}. Best is trial 1400 with value: 0.5178181529045105.
Generating morgan fingerprints...
Generated fingerprints with 2048 features for 900 molecules
Data shape: X=(900, 2048), y=(900,)
Trial 1420: 5-fold CV loss = 0.9687
[I 2025-08-08 00:05:23,424] Trial 1420 finished with value: 0.9686977863311768 and parameters: {'fp_type': 'morgan', 'morgan_only_radius': 2, 'morgan_only_nBits': 2048, 'num_hidden_layers': 3, 'hidden_dim_0': 512, 'hidden_dim_1': 1024, 'hidden_dim_2': 1024, 'kl_weight': 0.0005902779364114516, 'lr': 0.0018447923184085082, 'batch_size': 128, 'dropout_rate': 0.44068782288622477, 'prior_mu': 0.05559141627717061, 'prior_sigma': 0.07279626757739471, 'normalization': 'none'}. Best is trial 1400 with value: 0.5178181529045105.
Generating morgan fingerprints...
Generated fingerprints with 2048 features for 900 molecules
Data shape: X=(900, 2048), y=(900,)
Trial 1418: 5-fold CV loss = 0.5844
[I 2025-08-08 00:05:32,571] Trial 1418 finished with value: 0.5843650102615356 and parameters: {'fp_type': 'morgan', 'morgan_only_radius': 2, 'morgan_only_nBits': 2048, 'num_hidden_layers': 3, 'hidden_dim_0': 512, 'hidden_dim_1': 128, 'hidden_dim_2': 512, 'kl_weight': 0.0006411613931972367, 'lr': 0.001812951158354867, 'batch_size': 32, 'dropout_rate': 0.4391981035615182, 'prior_mu': 0.05422054740063238, 'prior_sigma': 0.07741919020019916, 'normalization': 'layer'}. Best is trial 1400 with value: 0.5178181529045105.
Generating morgan fingerprints...
Generated fingerprints with 2048 features for 900 molecules
Data shape: X=(900, 2048), y=(900,)
Trial 1417: 5-fold CV loss = 0.6123
[I 2025-08-08 00:06:03,121] Trial 1417 finished with value: 0.6123286724090576 and parameters: {'fp_type': 'morgan', 'morgan_only_radius': 2, 'morgan_only_nBits': 2048, 'num_hidden_layers': 3, 'hidden_dim_0': 512, 'hidden_dim_1': 128, 'hidden_dim_2': 512, 'kl_weight': 0.000624051764650586, 'lr': 0.001688069891814073, 'batch_size': 32, 'dropout_rate': 0.44140915893954513, 'prior_mu': 0.04733443406022383, 'prior_sigma': 0.07344284414579595, 'normalization': 'none'}. Best is trial 1400 with value: 0.5178181529045105.
Generating morgan fingerprints...
Generated fingerprints with 2048 features for 900 molecules
Data shape: X=(900, 2048), y=(900,)
Trial 1419: 5-fold CV loss = 0.5274
[I 2025-08-08 00:06:24,937] Trial 1419 finished with value: 0.5273574590682983 and parameters: {'fp_type': 'morgan', 'morgan_only_radius': 2, 'morgan_only_nBits': 2048, 'num_hidden_layers': 3, 'hidden_dim_0': 512, 'hidden_dim_1': 128, 'hidden_dim_2': 512, 'kl_weight': 0.0006026508679685204, 'lr': 0.0018051177637144287, 'batch_size': 32, 'dropout_rate': 0.44312784923895904, 'prior_mu': 0.05714524975645473, 'prior_sigma': 0.07525854825730453, 'normalization': 'none'}. Best is trial 1400 with value: 0.5178181529045105.
Generating morgan fingerprints...
Generated fingerprints with 2048 features for 900 molecules
Data shape: X=(900, 2048), y=(900,)
Trial 1422: 5-fold CV loss = 0.5281
[I 2025-08-08 00:06:49,888] Trial 1422 finished with value: 0.5280719220638275 and parameters: {'fp_type': 'morgan', 'morgan_only_radius': 2, 'morgan_only_nBits': 2048, 'num_hidden_layers': 3, 'hidden_dim_0': 1024, 'hidden_dim_1': 128, 'hidden_dim_2': 512, 'kl_weight': 0.000574418373997871, 'lr': 0.0018859869795697258, 'batch_size': 32, 'dropout_rate': 0.44060184838995947, 'prior_mu': 0.037397336260974696, 'prior_sigma': 0.07471282727600961, 'normalization': 'none'}. Best is trial 1400 with value: 0.5178181529045105.
Generating morgan fingerprints...
Generated fingerprints with 2048 features for 900 molecules
Data shape: X=(900, 2048), y=(900,)
Trial 1424: 5-fold CV loss = 0.7151
[I 2025-08-08 00:07:30,219] Trial 1424 finished with value: 0.7151392161846161 and parameters: {'fp_type': 'morgan', 'morgan_only_radius': 2, 'morgan_only_nBits': 2048, 'num_hidden_layers': 3, 'hidden_dim_0': 1024, 'hidden_dim_1': 128, 'hidden_dim_2': 512, 'kl_weight': 0.0005042538691748272, 'lr': 0.001488125794440073, 'batch_size': 32, 'dropout_rate': 0.4176334442462699, 'prior_mu': 0.032851178315014586, 'prior_sigma': 0.07210618450167118, 'normalization': 'none'}. Best is trial 1400 with value: 0.5178181529045105.
Generating morgan fingerprints...
Generated fingerprints with 2048 features for 900 molecules
Data shape: X=(900, 2048), y=(900,)
Trial 1426: 5-fold CV loss = 0.8776
[I 2025-08-08 00:07:42,032] Trial 1426 finished with value: 0.8775785446166993 and parameters: {'fp_type': 'morgan', 'morgan_only_radius': 2, 'morgan_only_nBits': 2048, 'num_hidden_layers': 3, 'hidden_dim_0': 512, 'hidden_dim_1': 128, 'hidden_dim_2': 512, 'kl_weight': 0.000701578076228649, 'lr': 0.0019423128432661933, 'batch_size': 64, 'dropout_rate': 0.45277554102759865, 'prior_mu': 0.03596641050072036, 'prior_sigma': 0.07047376445989284, 'normalization': 'none'}. Best is trial 1400 with value: 0.5178181529045105.
Generating rdkit fingerprints...
Generated fingerprints with 512 features for 900 molecules
Data shape: X=(900, 512), y=(900,)
Trial 1425: 5-fold CV loss = 0.5652
[I 2025-08-08 00:08:22,583] Trial 1425 finished with value: 0.5652346432209014 and parameters: {'fp_type': 'morgan', 'morgan_only_radius': 2, 'morgan_only_nBits': 2048, 'num_hidden_layers': 3, 'hidden_dim_0': 512, 'hidden_dim_1': 128, 'hidden_dim_2': 512, 'kl_weight': 0.0004517793320524811, 'lr': 0.0019585425134882135, 'batch_size': 32, 'dropout_rate': 0.41202040799881523, 'prior_mu': 0.028719585378400733, 'prior_sigma': 0.0712890795767154, 'normalization': 'none'}. Best is trial 1400 with value: 0.5178181529045105.
Generating rdkit fingerprints...
Generated fingerprints with 512 features for 900 molecules
Data shape: X=(900, 512), y=(900,)
Trial 1427: 5-fold CV loss = 0.6635
[I 2025-08-08 00:08:28,162] Trial 1427 finished with value: 0.6635451078414917 and parameters: {'fp_type': 'rdkit', 'rdkit_only_maxPath': 8, 'rdkit_only_nBits': 512, 'num_hidden_layers': 3, 'hidden_dim_0': 512, 'hidden_dim_1': 128, 'hidden_dim_2': 512, 'kl_weight': 0.0008879330841250027, 'lr': 0.0013839999798417088, 'batch_size': 32, 'dropout_rate': 0.4514039596980811, 'prior_mu': 0.05630283310169388, 'prior_sigma': 0.06854339425704745, 'normalization': 'none'}. Best is trial 1400 with value: 0.5178181529045105.
Generating morgan fingerprints...
Generated fingerprints with 2048 features for 900 molecules
Data shape: X=(900, 2048), y=(900,)
Trial 1423: 5-fold CV loss = 0.6388
[I 2025-08-08 00:08:35,366] Trial 1423 finished with value: 0.6387688219547272 and parameters: {'fp_type': 'morgan', 'morgan_only_radius': 2, 'morgan_only_nBits': 2048, 'num_hidden_layers': 3, 'hidden_dim_0': 512, 'hidden_dim_1': 128, 'hidden_dim_2': 512, 'kl_weight': 0.000457238495045758, 'lr': 0.0013879863637680013, 'batch_size': 32, 'dropout_rate': 0.41432375965496654, 'prior_mu': 0.03491892357236973, 'prior_sigma': 0.07240999079481922, 'normalization': 'none'}. Best is trial 1400 with value: 0.5178181529045105.
Generating morgan fingerprints...
Generated fingerprints with 2048 features for 900 molecules
Data shape: X=(900, 2048), y=(900,)
Trial 1421: 5-fold CV loss = 0.5475
[I 2025-08-08 00:08:44,552] Trial 1421 finished with value: 0.5474940538406372 and parameters: {'fp_type': 'morgan', 'morgan_only_radius': 2, 'morgan_only_nBits': 2048, 'num_hidden_layers': 3, 'hidden_dim_0': 512, 'hidden_dim_1': 128, 'hidden_dim_2': 512, 'kl_weight': 0.0006634688607665804, 'lr': 0.001819123831484764, 'batch_size': 32, 'dropout_rate': 0.4400432775403246, 'prior_mu': 0.05583013731151123, 'prior_sigma': 0.07398772138553607, 'normalization': 'layer'}. Best is trial 1400 with value: 0.5178181529045105.
Generating morgan fingerprints...
Generated fingerprints with 2048 features for 900 molecules
Data shape: X=(900, 2048), y=(900,)
Trial 1428: 5-fold CV loss = 0.6618
[I 2025-08-08 00:09:23,427] Trial 1428 finished with value: 0.6617740631103516 and parameters: {'fp_type': 'rdkit', 'rdkit_only_maxPath': 8, 'rdkit_only_nBits': 512, 'num_hidden_layers': 3, 'hidden_dim_0': 512, 'hidden_dim_1': 128, 'hidden_dim_2': 512, 'kl_weight': 0.0007816400692332187, 'lr': 0.0013876410109852407, 'batch_size': 32, 'dropout_rate': 0.4533385160827794, 'prior_mu': 0.04871286101682674, 'prior_sigma': 0.06769653337716265, 'normalization': 'none'}. Best is trial 1400 with value: 0.5178181529045105.
Generating morgan fingerprints...
Generated fingerprints with 2048 features for 900 molecules
Data shape: X=(900, 2048), y=(900,)
Trial 1429: 5-fold CV loss = 0.5229
[I 2025-08-08 00:09:54,740] Trial 1429 finished with value: 0.5228624939918518 and parameters: {'fp_type': 'morgan', 'morgan_only_radius': 2, 'morgan_only_nBits': 2048, 'num_hidden_layers': 3, 'hidden_dim_0': 512, 'hidden_dim_1': 128, 'hidden_dim_2': 512, 'kl_weight': 0.0007828921719526986, 'lr': 0.0017671050005651702, 'batch_size': 32, 'dropout_rate': 0.45667679020187874, 'prior_mu': 0.047826701491249436, 'prior_sigma': 0.0682700194832169, 'normalization': 'none'}. Best is trial 1400 with value: 0.5178181529045105.
Generating morgan fingerprints...
Generated fingerprints with 2048 features for 900 molecules
Data shape: X=(900, 2048), y=(900,)
Trial 1430: 5-fold CV loss = 0.6073
[I 2025-08-08 00:10:38,726] Trial 1430 finished with value: 0.6073287844657898 and parameters: {'fp_type': 'morgan', 'morgan_only_radius': 2, 'morgan_only_nBits': 2048, 'num_hidden_layers': 3, 'hidden_dim_0': 512, 'hidden_dim_1': 128, 'hidden_dim_2': 256, 'kl_weight': 0.0007737027577029508, 'lr': 0.0019199618587410021, 'batch_size': 32, 'dropout_rate': 0.4475458337646287, 'prior_mu': 0.05006333380153356, 'prior_sigma': 0.06749585941723532, 'normalization': 'none'}. Best is trial 1400 with value: 0.5178181529045105.
Generating morgan fingerprints...
Generated fingerprints with 2048 features for 900 molecules
Data shape: X=(900, 2048), y=(900,)
Trial 1433: 5-fold CV loss = 0.5720
[I 2025-08-08 00:11:11,319] Trial 1433 finished with value: 0.5720065891742706 and parameters: {'fp_type': 'morgan', 'morgan_only_radius': 2, 'morgan_only_nBits': 2048, 'num_hidden_layers': 3, 'hidden_dim_0': 64, 'hidden_dim_1': 128, 'hidden_dim_2': 256, 'kl_weight': 0.0008674907956559646, 'lr': 0.0016333881289977128, 'batch_size': 32, 'dropout_rate': 0.4298686917721887, 'prior_mu': 0.05880974467509249, 'prior_sigma': 0.0789294319876205, 'normalization': 'none'}. Best is trial 1400 with value: 0.5178181529045105.
Generating morgan fingerprints...
Generated fingerprints with 2048 features for 900 molecules
Data shape: X=(900, 2048), y=(900,)
Trial 1432: 5-fold CV loss = 0.5250
[I 2025-08-08 00:11:14,500] Trial 1432 finished with value: 0.5250076651573181 and parameters: {'fp_type': 'morgan', 'morgan_only_radius': 2, 'morgan_only_nBits': 2048, 'num_hidden_layers': 3, 'hidden_dim_0': 512, 'hidden_dim_1': 128, 'hidden_dim_2': 512, 'kl_weight': 0.0008866871089672443, 'lr': 0.0019968736825051433, 'batch_size': 32, 'dropout_rate': 0.44995076967038944, 'prior_mu': 0.047713878721636606, 'prior_sigma': 0.06719489830123217, 'normalization': 'none'}. Best is trial 1400 with value: 0.5178181529045105.
Generating morgan fingerprints...
Generated fingerprints with 2048 features for 900 molecules
Data shape: X=(900, 2048), y=(900,)
Trial 1431: 5-fold CV loss = 0.6829
[I 2025-08-08 00:11:31,131] Trial 1431 finished with value: 0.6828659117221832 and parameters: {'fp_type': 'morgan', 'morgan_only_radius': 2, 'morgan_only_nBits': 2048, 'num_hidden_layers': 3, 'hidden_dim_0': 512, 'hidden_dim_1': 128, 'hidden_dim_2': 256, 'kl_weight': 0.000757478812196231, 'lr': 0.0019819585486345074, 'batch_size': 32, 'dropout_rate': 0.4526675383288181, 'prior_mu': 0.048212836309643986, 'prior_sigma': 0.06798178412527515, 'normalization': 'none'}. Best is trial 1400 with value: 0.5178181529045105.
Generating morgan fingerprints...
Generated fingerprints with 2048 features for 900 molecules
Data shape: X=(900, 2048), y=(900,)
Trial 1436: 5-fold CV loss = 0.7841
[I 2025-08-08 00:11:36,385] Trial 1436 finished with value: 0.7841413140296936 and parameters: {'fp_type': 'morgan', 'morgan_only_radius': 2, 'morgan_only_nBits': 2048, 'num_hidden_layers': 1, 'hidden_dim_0': 512, 'kl_weight': 0.0009345977914845664, 'lr': 0.001492325031474475, 'batch_size': 32, 'dropout_rate': 0.45582308150734535, 'prior_mu': 0.06566636258519344, 'prior_sigma': 0.07549885881843707, 'normalization': 'none'}. Best is trial 1400 with value: 0.5178181529045105.
Generating morgan fingerprints...
Generated fingerprints with 2048 features for 900 molecules
Data shape: X=(900, 2048), y=(900,)
Trial 1435: 5-fold CV loss = 0.6121
[I 2025-08-08 00:12:31,557] Trial 1435 finished with value: 0.61209437251091 and parameters: {'fp_type': 'morgan', 'morgan_only_radius': 2, 'morgan_only_nBits': 2048, 'num_hidden_layers': 3, 'hidden_dim_0': 512, 'hidden_dim_1': 128, 'hidden_dim_2': 512, 'kl_weight': 0.0008201380051224749, 'lr': 0.0016006251046575876, 'batch_size': 32, 'dropout_rate': 0.45522388439630435, 'prior_mu': 0.06765598043736057, 'prior_sigma': 0.07471967054500951, 'normalization': 'none'}. Best is trial 1400 with value: 0.5178181529045105.
Generating morgan fingerprints...
Generated fingerprints with 2048 features for 900 molecules
Data shape: X=(900, 2048), y=(900,)
Trial 1438: 5-fold CV loss = 0.5931
[I 2025-08-08 00:12:51,785] Trial 1438 finished with value: 0.5930515408515931 and parameters: {'fp_type': 'morgan', 'morgan_only_radius': 2, 'morgan_only_nBits': 2048, 'num_hidden_layers': 3, 'hidden_dim_0': 512, 'hidden_dim_1': 128, 'hidden_dim_2': 128, 'kl_weight': 0.0008870098724228423, 'lr': 0.0015786561147734396, 'batch_size': 32, 'dropout_rate': 0.40128300278521406, 'prior_mu': 0.06975332677802698, 'prior_sigma': 0.07205996689834893, 'normalization': 'none'}. Best is trial 1400 with value: 0.5178181529045105.
Generating morgan fingerprints...
Generated fingerprints with 2048 features for 900 molecules
Data shape: X=(900, 2048), y=(900,)
Trial 1434: 5-fold CV loss = 0.5731
[I 2025-08-08 00:12:53,346] Trial 1434 finished with value: 0.5731474220752716 and parameters: {'fp_type': 'morgan', 'morgan_only_radius': 2, 'morgan_only_nBits': 2048, 'num_hidden_layers': 3, 'hidden_dim_0': 64, 'hidden_dim_1': 128, 'hidden_dim_2': 512, 'kl_weight': 0.0009230872994916557, 'lr': 0.0014964844523902144, 'batch_size': 32, 'dropout_rate': 0.43012352376887736, 'prior_mu': 0.06068832302512323, 'prior_sigma': 0.0777316456601512, 'normalization': 'none'}. Best is trial 1400 with value: 0.5178181529045105.
Generating morgan fingerprints...
Generated fingerprints with 2048 features for 900 molecules
Data shape: X=(900, 2048), y=(900,)
Trial 1440: 5-fold CV loss = 1.0575
[I 2025-08-08 00:13:15,993] Trial 1440 finished with value: 1.0575175881385803 and parameters: {'fp_type': 'morgan', 'morgan_only_radius': 2, 'morgan_only_nBits': 2048, 'num_hidden_layers': 3, 'hidden_dim_0': 512, 'hidden_dim_1': 128, 'hidden_dim_2': 512, 'kl_weight': 0.0009472178118158398, 'lr': 0.0011226440811058856, 'batch_size': 32, 'dropout_rate': 0.45876981716547527, 'prior_mu': 0.05842685417372992, 'prior_sigma': 0.07088849572243675, 'normalization': 'none'}. Best is trial 1400 with value: 0.5178181529045105.
Generating morgan fingerprints...
Generated fingerprints with 2048 features for 900 molecules
Data shape: X=(900, 2048), y=(900,)
Trial 1439: 5-fold CV loss = 0.6756
[I 2025-08-08 00:13:24,237] Trial 1439 finished with value: 0.6756195724010468 and parameters: {'fp_type': 'morgan', 'morgan_only_radius': 2, 'morgan_only_nBits': 2048, 'num_hidden_layers': 3, 'hidden_dim_0': 512, 'hidden_dim_1': 128, 'hidden_dim_2': 128, 'kl_weight': 0.0009495484482582921, 'lr': 0.0017566672850477475, 'batch_size': 32, 'dropout_rate': 0.45847843020747786, 'prior_mu': 0.05926678732761955, 'prior_sigma': 0.07143197611216223, 'normalization': 'none'}. Best is trial 1400 with value: 0.5178181529045105.
Generating morgan fingerprints...
Generated fingerprints with 2048 features for 900 molecules
Data shape: X=(900, 2048), y=(900,)
Trial 1442: 5-fold CV loss = 0.7855
[I 2025-08-08 00:13:27,963] Trial 1442 finished with value: 0.7855123043060303 and parameters: {'fp_type': 'morgan', 'morgan_only_radius': 2, 'morgan_only_nBits': 2048, 'num_hidden_layers': 3, 'hidden_dim_0': 512, 'hidden_dim_1': 128, 'hidden_dim_2': 512, 'kl_weight': 0.0007154972474118404, 'lr': 0.0017396715877849233, 'batch_size': 128, 'dropout_rate': 0.4586037736083414, 'prior_mu': 0.04174502657897726, 'prior_sigma': 0.06345070018661084, 'normalization': 'none'}. Best is trial 1400 with value: 0.5178181529045105.
Generating morgan fingerprints...
Generated fingerprints with 2048 features for 900 molecules
Data shape: X=(900, 2048), y=(900,)
Trial 1443: 5-fold CV loss = 0.7092
[I 2025-08-08 00:13:34,888] Trial 1443 finished with value: 0.7091553688049317 and parameters: {'fp_type': 'morgan', 'morgan_only_radius': 2, 'morgan_only_nBits': 2048, 'num_hidden_layers': 3, 'hidden_dim_0': 512, 'hidden_dim_1': 128, 'hidden_dim_2': 512, 'kl_weight': 0.0007352656657887779, 'lr': 0.0017226707423721483, 'batch_size': 128, 'dropout_rate': 0.4456361834095607, 'prior_mu': 0.04317559776914855, 'prior_sigma': 0.0641340113145399, 'normalization': 'none'}. Best is trial 1400 with value: 0.5178181529045105.
Generating morgan fingerprints...
Generated fingerprints with 2048 features for 900 molecules
Data shape: X=(900, 2048), y=(900,)
Trial 1437: 5-fold CV loss = 0.9200
[I 2025-08-08 00:14:02,188] Trial 1437 finished with value: 0.92000892162323 and parameters: {'fp_type': 'morgan', 'morgan_only_radius': 2, 'morgan_only_nBits': 2048, 'num_hidden_layers': 3, 'hidden_dim_0': 512, 'hidden_dim_1': 128, 'hidden_dim_2': 512, 'kl_weight': 0.0009286368392011268, 'lr': 0.0015668932926258183, 'batch_size': 32, 'dropout_rate': 0.4549648259980462, 'prior_mu': 0.0654714439453593, 'prior_sigma': 0.0754250762160509, 'normalization': 'none'}. Best is trial 1400 with value: 0.5178181529045105.
Generating morgan fingerprints...
Generated fingerprints with 2048 features for 900 molecules
Data shape: X=(900, 2048), y=(900,)
Trial 1445: 5-fold CV loss = 1.0327
[I 2025-08-08 00:14:05,738] Trial 1445 finished with value: 1.0326648473739624 and parameters: {'fp_type': 'morgan', 'morgan_only_radius': 2, 'morgan_only_nBits': 2048, 'num_hidden_layers': 3, 'hidden_dim_0': 512, 'hidden_dim_1': 1024, 'hidden_dim_2': 512, 'kl_weight': 0.0005486186211945249, 'lr': 0.0017767339270643484, 'batch_size': 32, 'dropout_rate': 0.4421175104312839, 'prior_mu': 0.05214486689415381, 'prior_sigma': 0.06576210238704092, 'normalization': 'none'}. Best is trial 1400 with value: 0.5178181529045105.
Generating morgan fingerprints...
Generated fingerprints with 2048 features for 900 molecules
Data shape: X=(900, 2048), y=(900,)
Trial 1444: 5-fold CV loss = 0.9846
[I 2025-08-08 00:14:35,710] Trial 1444 finished with value: 0.9846361875534058 and parameters: {'fp_type': 'morgan', 'morgan_only_radius': 2, 'morgan_only_nBits': 2048, 'num_hidden_layers': 3, 'hidden_dim_0': 512, 'hidden_dim_1': 1024, 'hidden_dim_2': 512, 'kl_weight': 0.0005669169230236187, 'lr': 0.0013095962898850627, 'batch_size': 32, 'dropout_rate': 0.44255689054280983, 'prior_mu': 0.051787632740514955, 'prior_sigma': 0.06614099267146513, 'normalization': 'none'}. Best is trial 1400 with value: 0.5178181529045105.
Generating morgan fingerprints...
Generated fingerprints with 2048 features for 900 molecules
Data shape: X=(900, 2048), y=(900,)
Trial 1441: 5-fold CV loss = 0.5804
[I 2025-08-08 00:15:12,352] Trial 1441 finished with value: 0.5804224848747254 and parameters: {'fp_type': 'morgan', 'morgan_only_radius': 2, 'morgan_only_nBits': 2048, 'num_hidden_layers': 3, 'hidden_dim_0': 512, 'hidden_dim_1': 128, 'hidden_dim_2': 512, 'kl_weight': 0.0007401925906246154, 'lr': 0.0017988976231405743, 'batch_size': 32, 'dropout_rate': 0.4557767398807662, 'prior_mu': 0.043896921240935166, 'prior_sigma': 0.07018079486959877, 'normalization': 'none'}. Best is trial 1400 with value: 0.5178181529045105.
Generating morgan fingerprints...
Generated fingerprints with 2048 features for 900 molecules
Data shape: X=(900, 2048), y=(900,)
Trial 1447: 5-fold CV loss = 0.5625
