[I 2025-08-08 01:46:32,853] Trial 1701 finished with value: 0.7184588670730591 and parameters: {'fp_type': 'morgan', 'morgan_only_radius': 2, 'morgan_only_nBits': 2048, 'num_hidden_layers': 1, 'hidden_dim_0': 512, 'kl_weight': 0.0006918004126053957, 'lr': 0.002066916205974865, 'batch_size': 32, 'dropout_rate': 0.4141571012118453, 'prior_mu': 0.023543624134103325, 'prior_sigma': 0.06483299006470385, 'normalization': 'none'}. Best is trial 1528 with value: 0.5170644640922546.
Generating morgan fingerprints...
Generated fingerprints with 2048 features for 900 molecules
Data shape: X=(900, 2048), y=(900,)
Trial 1699: 5-fold CV loss = 0.5179
[I 2025-08-08 01:46:59,950] Trial 1699 finished with value: 0.5178873300552368 and parameters: {'fp_type': 'morgan', 'morgan_only_radius': 2, 'morgan_only_nBits': 2048, 'num_hidden_layers': 3, 'hidden_dim_0': 512, 'hidden_dim_1': 128, 'hidden_dim_2': 512, 'kl_weight': 0.0006462473768425016, 'lr': 0.0020832829814088905, 'batch_size': 32, 'dropout_rate': 0.4305611718265422, 'prior_mu': 0.04350189000801355, 'prior_sigma': 0.06618437938250717, 'normalization': 'none'}. Best is trial 1528 with value: 0.5170644640922546.
Generating morgan fingerprints...
Generated fingerprints with 2048 features for 900 molecules
Data shape: X=(900, 2048), y=(900,)
Trial 1702: 5-fold CV loss = 0.6931
[I 2025-08-08 01:47:44,660] Trial 1702 finished with value: 0.6930526614189148 and parameters: {'fp_type': 'morgan', 'morgan_only_radius': 2, 'morgan_only_nBits': 2048, 'num_hidden_layers': 3, 'hidden_dim_0': 512, 'hidden_dim_1': 128, 'hidden_dim_2': 512, 'kl_weight': 0.0007800270163994266, 'lr': 0.0016897545377669452, 'batch_size': 32, 'dropout_rate': 0.40446265163764095, 'prior_mu': 0.043290412483305424, 'prior_sigma': 0.10521005413610407, 'normalization': 'none'}. Best is trial 1528 with value: 0.5170644640922546.
Generating morgan fingerprints...
Generated fingerprints with 2048 features for 900 molecules
Data shape: X=(900, 2048), y=(900,)
Trial 1698: 5-fold CV loss = 0.5500
[I 2025-08-08 01:47:49,435] Trial 1698 finished with value: 0.5499686360359192 and parameters: {'fp_type': 'morgan', 'morgan_only_radius': 2, 'morgan_only_nBits': 2048, 'num_hidden_layers': 3, 'hidden_dim_0': 512, 'hidden_dim_1': 128, 'hidden_dim_2': 512, 'kl_weight': 0.0006796865790802048, 'lr': 0.002075008506901781, 'batch_size': 32, 'dropout_rate': 0.41389001247998414, 'prior_mu': 0.027408286133301218, 'prior_sigma': 0.06572320229810505, 'normalization': 'none'}. Best is trial 1528 with value: 0.5170644640922546.
Generating morgan fingerprints...
Generated fingerprints with 2048 features for 900 molecules
Data shape: X=(900, 2048), y=(900,)
Trial 1703: 5-fold CV loss = 0.6562
[I 2025-08-08 01:48:14,771] Trial 1703 finished with value: 0.6562304139137268 and parameters: {'fp_type': 'morgan', 'morgan_only_radius': 2, 'morgan_only_nBits': 2048, 'num_hidden_layers': 3, 'hidden_dim_0': 512, 'hidden_dim_1': 128, 'hidden_dim_2': 512, 'kl_weight': 0.000530819548585913, 'lr': 0.0017168148434612937, 'batch_size': 32, 'dropout_rate': 0.4183501038741559, 'prior_mu': 0.020478017322085817, 'prior_sigma': 0.0696829239978669, 'normalization': 'none'}. Best is trial 1528 with value: 0.5170644640922546.
Generating morgan fingerprints...
Generated fingerprints with 2048 features for 900 molecules
Data shape: X=(900, 2048), y=(900,)
Trial 1704: 5-fold CV loss = 0.5469
[I 2025-08-08 01:48:33,853] Trial 1704 finished with value: 0.5469214618206024 and parameters: {'fp_type': 'morgan', 'morgan_only_radius': 2, 'morgan_only_nBits': 2048, 'num_hidden_layers': 3, 'hidden_dim_0': 512, 'hidden_dim_1': 128, 'hidden_dim_2': 512, 'kl_weight': 0.0005514562928954756, 'lr': 0.004882020468991588, 'batch_size': 32, 'dropout_rate': 0.41544068131705625, 'prior_mu': 0.025620769788492936, 'prior_sigma': 0.06954048723399678, 'normalization': 'none'}. Best is trial 1528 with value: 0.5170644640922546.
Generating morgan fingerprints...
Generated fingerprints with 2048 features for 900 molecules
Data shape: X=(900, 2048), y=(900,)
Trial 1700: 5-fold CV loss = 0.5689
[I 2025-08-08 01:48:39,461] Trial 1700 finished with value: 0.5688985586166382 and parameters: {'fp_type': 'morgan', 'morgan_only_radius': 2, 'morgan_only_nBits': 2048, 'num_hidden_layers': 3, 'hidden_dim_0': 512, 'hidden_dim_1': 128, 'hidden_dim_2': 512, 'kl_weight': 0.00077146252281849, 'lr': 0.0020642976371245004, 'batch_size': 32, 'dropout_rate': 0.41120598133290065, 'prior_mu': 0.024704163892776403, 'prior_sigma': 0.06556278649123214, 'normalization': 'none'}. Best is trial 1528 with value: 0.5170644640922546.
Generating morgan fingerprints...
Generated fingerprints with 2048 features for 900 molecules
Data shape: X=(900, 2048), y=(900,)
Trial 1706: 5-fold CV loss = 0.5485
[I 2025-08-08 01:49:03,683] Trial 1706 finished with value: 0.5485142230987549 and parameters: {'fp_type': 'morgan', 'morgan_only_radius': 2, 'morgan_only_nBits': 2048, 'num_hidden_layers': 3, 'hidden_dim_0': 512, 'hidden_dim_1': 128, 'hidden_dim_2': 512, 'kl_weight': 0.0006044339010251243, 'lr': 0.0036441921868458666, 'batch_size': 32, 'dropout_rate': 0.43172851374920035, 'prior_mu': 0.04105923092119055, 'prior_sigma': 0.07000835614461766, 'normalization': 'layer'}. Best is trial 1528 with value: 0.5170644640922546.
Generating morgan fingerprints...
Generated fingerprints with 2048 features for 900 molecules
Data shape: X=(900, 2048), y=(900,)
Trial 1707: 5-fold CV loss = 0.6839
[I 2025-08-08 01:49:29,623] Trial 1707 finished with value: 0.6838619351387024 and parameters: {'fp_type': 'morgan', 'morgan_only_radius': 2, 'morgan_only_nBits': 2048, 'num_hidden_layers': 3, 'hidden_dim_0': 512, 'hidden_dim_1': 128, 'hidden_dim_2': 512, 'kl_weight': 0.0006019551592966173, 'lr': 0.000289177984769771, 'batch_size': 32, 'dropout_rate': 0.43249565623010855, 'prior_mu': 0.04056535427933127, 'prior_sigma': 0.06947197785256194, 'normalization': 'layer'}. Best is trial 1528 with value: 0.5170644640922546.
Generating morgan fingerprints...
Generated fingerprints with 2048 features for 900 molecules
Data shape: X=(900, 2048), y=(900,)
Trial 1705: 5-fold CV loss = 0.5396
[I 2025-08-08 01:49:46,045] Trial 1705 finished with value: 0.539575457572937 and parameters: {'fp_type': 'morgan', 'morgan_only_radius': 2, 'morgan_only_nBits': 2048, 'num_hidden_layers': 3, 'hidden_dim_0': 512, 'hidden_dim_1': 128, 'hidden_dim_2': 512, 'kl_weight': 0.0005513392681324242, 'lr': 0.001760405002806416, 'batch_size': 32, 'dropout_rate': 0.4349441174269734, 'prior_mu': 0.02046140823288766, 'prior_sigma': 0.07108327227332928, 'normalization': 'layer'}. Best is trial 1528 with value: 0.5170644640922546.
Generating morgan fingerprints...
Generated fingerprints with 2048 features for 900 molecules
Data shape: X=(900, 2048), y=(900,)
Trial 1710: 5-fold CV loss = 0.5466
[I 2025-08-08 01:50:11,712] Trial 1710 finished with value: 0.5465646862983704 and parameters: {'fp_type': 'morgan', 'morgan_only_radius': 2, 'morgan_only_nBits': 2048, 'num_hidden_layers': 3, 'hidden_dim_0': 512, 'hidden_dim_1': 128, 'hidden_dim_2': 512, 'kl_weight': 0.0004712568902139489, 'lr': 0.004480949320625832, 'batch_size': 32, 'dropout_rate': 0.37588968960457736, 'prior_mu': 0.037012761004425715, 'prior_sigma': 0.0713857943752116, 'normalization': 'none'}. Best is trial 1528 with value: 0.5170644640922546.
Generating morgan fingerprints...
Generated fingerprints with 2048 features for 900 molecules
Data shape: X=(900, 2048), y=(900,)
Trial 1709: 5-fold CV loss = 0.6056
[I 2025-08-08 01:50:28,918] Trial 1709 finished with value: 0.6055696904659271 and parameters: {'fp_type': 'morgan', 'morgan_only_radius': 2, 'morgan_only_nBits': 2048, 'num_hidden_layers': 3, 'hidden_dim_0': 512, 'hidden_dim_1': 128, 'hidden_dim_2': 512, 'kl_weight': 0.0004390406896464585, 'lr': 0.0017492826432173043, 'batch_size': 32, 'dropout_rate': 0.4328780100263696, 'prior_mu': 0.03946349496136737, 'prior_sigma': 0.0709972214233352, 'normalization': 'none'}. Best is trial 1528 with value: 0.5170644640922546.
Generating morgan fingerprints...
Generated fingerprints with 2048 features for 900 molecules
Data shape: X=(900, 2048), y=(900,)
Trial 1712: 5-fold CV loss = 0.6843
[I 2025-08-08 01:50:34,306] Trial 1712 finished with value: 0.6843481659889221 and parameters: {'fp_type': 'morgan', 'morgan_only_radius': 2, 'morgan_only_nBits': 2048, 'num_hidden_layers': 3, 'hidden_dim_0': 512, 'hidden_dim_1': 128, 'hidden_dim_2': 512, 'kl_weight': 0.0006698332857446392, 'lr': 0.0019501651289152713, 'batch_size': 64, 'dropout_rate': 0.3676534169688575, 'prior_mu': 0.04714635592314185, 'prior_sigma': 0.06568630941804297, 'normalization': 'none'}. Best is trial 1528 with value: 0.5170644640922546.
Generating morgan fingerprints...
Generated fingerprints with 2048 features for 900 molecules
Data shape: X=(900, 2048), y=(900,)
Trial 1711: 5-fold CV loss = 0.5526
[I 2025-08-08 01:51:38,093] Trial 1711 finished with value: 0.5525788247585297 and parameters: {'fp_type': 'morgan', 'morgan_only_radius': 2, 'morgan_only_nBits': 2048, 'num_hidden_layers': 3, 'hidden_dim_0': 512, 'hidden_dim_1': 128, 'hidden_dim_2': 512, 'kl_weight': 0.0004475550268708412, 'lr': 0.0018666081101256636, 'batch_size': 32, 'dropout_rate': 0.4255439028319425, 'prior_mu': 0.0382231717284778, 'prior_sigma': 0.06654756577577851, 'normalization': 'none'}. Best is trial 1528 with value: 0.5170644640922546.
Generating morgan fingerprints...
Generated fingerprints with 2048 features for 900 molecules
Data shape: X=(900, 2048), y=(900,)
Trial 1713: 5-fold CV loss = 0.5360
[I 2025-08-08 01:51:57,467] Trial 1713 finished with value: 0.5359898149967194 and parameters: {'fp_type': 'morgan', 'morgan_only_radius': 2, 'morgan_only_nBits': 2048, 'num_hidden_layers': 3, 'hidden_dim_0': 512, 'hidden_dim_1': 128, 'hidden_dim_2': 512, 'kl_weight': 0.0006364657046876076, 'lr': 0.00188575830560535, 'batch_size': 32, 'dropout_rate': 0.4254245940356378, 'prior_mu': 0.045643209084622785, 'prior_sigma': 0.06562425480172339, 'normalization': 'none'}. Best is trial 1528 with value: 0.5170644640922546.
Generating morgan fingerprints...
Generated fingerprints with 2048 features for 900 molecules
Data shape: X=(900, 2048), y=(900,)
Trial 1714: 5-fold CV loss = 0.5464
[I 2025-08-08 01:52:01,275] Trial 1714 finished with value: 0.5464129269123077 and parameters: {'fp_type': 'morgan', 'morgan_only_radius': 2, 'morgan_only_nBits': 2048, 'num_hidden_layers': 3, 'hidden_dim_0': 512, 'hidden_dim_1': 128, 'hidden_dim_2': 512, 'kl_weight': 0.0006236450352003266, 'lr': 0.0018515546176218196, 'batch_size': 32, 'dropout_rate': 0.42460857726401297, 'prior_mu': 0.056148147212629104, 'prior_sigma': 0.06575680812979806, 'normalization': 'none'}. Best is trial 1528 with value: 0.5170644640922546.
Generating morgan fingerprints...
Generated fingerprints with 2048 features for 900 molecules
Data shape: X=(900, 2048), y=(900,)
Trial 1708: 5-fold CV loss = 0.6130
[I 2025-08-08 01:52:17,841] Trial 1708 finished with value: 0.6129524648189545 and parameters: {'fp_type': 'morgan', 'morgan_only_radius': 2, 'morgan_only_nBits': 2048, 'num_hidden_layers': 3, 'hidden_dim_0': 512, 'hidden_dim_1': 128, 'hidden_dim_2': 512, 'kl_weight': 0.0006305816996564251, 'lr': 0.0006662969593012026, 'batch_size': 32, 'dropout_rate': 0.42867221157332885, 'prior_mu': 0.04026323561134045, 'prior_sigma': 0.0702622917155998, 'normalization': 'layer'}. Best is trial 1528 with value: 0.5170644640922546.
Generating morgan fingerprints...
Generated fingerprints with 2048 features for 900 molecules
Data shape: X=(900, 2048), y=(900,)
Trial 1716: 5-fold CV loss = 0.5317
[I 2025-08-08 01:53:08,005] Trial 1716 finished with value: 0.5317217588424683 and parameters: {'fp_type': 'morgan', 'morgan_only_radius': 2, 'morgan_only_nBits': 2048, 'num_hidden_layers': 3, 'hidden_dim_0': 512, 'hidden_dim_1': 128, 'hidden_dim_2': 512, 'kl_weight': 0.0008971843160137597, 'lr': 0.0021008873383299353, 'batch_size': 32, 'dropout_rate': 0.40582256294260366, 'prior_mu': 0.05445024868210734, 'prior_sigma': 0.06739936864609739, 'normalization': 'none'}. Best is trial 1528 with value: 0.5170644640922546.
Generating morgan fingerprints...
Generated fingerprints with 2048 features for 900 molecules
Data shape: X=(900, 2048), y=(900,)
Trial 1719: 5-fold CV loss = 0.7194
[I 2025-08-08 01:53:28,527] Trial 1719 finished with value: 0.7194306135177613 and parameters: {'fp_type': 'morgan', 'morgan_only_radius': 3, 'morgan_only_nBits': 2048, 'num_hidden_layers': 2, 'hidden_dim_0': 512, 'hidden_dim_1': 128, 'kl_weight': 0.0007239805105959247, 'lr': 0.001656945064416035, 'batch_size': 32, 'dropout_rate': 0.39643070535410974, 'prior_mu': 0.017058737711220906, 'prior_sigma': 0.07492107737320992, 'normalization': 'none'}. Best is trial 1528 with value: 0.5170644640922546.
Generating morgan fingerprints...
Generated fingerprints with 2048 features for 900 molecules
Data shape: X=(900, 2048), y=(900,)
Trial 1717: 5-fold CV loss = 0.5240
[I 2025-08-08 01:53:50,720] Trial 1717 finished with value: 0.5240155339241028 and parameters: {'fp_type': 'morgan', 'morgan_only_radius': 2, 'morgan_only_nBits': 2048, 'num_hidden_layers': 3, 'hidden_dim_0': 512, 'hidden_dim_1': 128, 'hidden_dim_2': 512, 'kl_weight': 0.0008917677213794292, 'lr': 0.0020609410361838833, 'batch_size': 32, 'dropout_rate': 0.39381748837143327, 'prior_mu': 0.03319854278792566, 'prior_sigma': 0.07394560111146758, 'normalization': 'none'}. Best is trial 1528 with value: 0.5170644640922546.
Generating morgan fingerprints...
Generated fingerprints with 2048 features for 900 molecules
Data shape: X=(900, 2048), y=(900,)
Trial 1715: 5-fold CV loss = 0.5225
[I 2025-08-08 01:54:03,427] Trial 1715 finished with value: 0.522476589679718 and parameters: {'fp_type': 'morgan', 'morgan_only_radius': 2, 'morgan_only_nBits': 2048, 'num_hidden_layers': 3, 'hidden_dim_0': 512, 'hidden_dim_1': 128, 'hidden_dim_2': 512, 'kl_weight': 0.0006686200902721008, 'lr': 0.002079924337760343, 'batch_size': 32, 'dropout_rate': 0.4219198192296257, 'prior_mu': 0.054668531081888745, 'prior_sigma': 0.06513138910497182, 'normalization': 'none'}. Best is trial 1528 with value: 0.5170644640922546.
Generating morgan fingerprints...
Generated fingerprints with 2048 features for 900 molecules
Data shape: X=(900, 2048), y=(900,)
Trial 1720: 5-fold CV loss = 2.2584
[I 2025-08-08 01:54:22,022] Trial 1720 finished with value: 2.258433151245117 and parameters: {'fp_type': 'morgan', 'morgan_only_radius': 2, 'morgan_only_nBits': 2048, 'num_hidden_layers': 3, 'hidden_dim_0': 512, 'hidden_dim_1': 512, 'hidden_dim_2': 512, 'kl_weight': 0.0005664922849491379, 'lr': 0.003911328894042867, 'batch_size': 32, 'dropout_rate': 0.4363951345825846, 'prior_mu': 0.03376996650053851, 'prior_sigma': 0.15687577348937118, 'normalization': 'none'}. Best is trial 1528 with value: 0.5170644640922546.
Generating morgan fingerprints...
Generated fingerprints with 2048 features for 900 molecules
Data shape: X=(900, 2048), y=(900,)
Trial 1721: 5-fold CV loss = 2.7915
[I 2025-08-08 01:54:40,501] Trial 1721 finished with value: 2.7914822578430174 and parameters: {'fp_type': 'morgan', 'morgan_only_radius': 2, 'morgan_only_nBits': 2048, 'num_hidden_layers': 3, 'hidden_dim_0': 512, 'hidden_dim_1': 512, 'hidden_dim_2': 512, 'kl_weight': 0.0005282733371536965, 'lr': 0.001582318514699471, 'batch_size': 32, 'dropout_rate': 0.4335998709906209, 'prior_mu': 0.04868649755564912, 'prior_sigma': 0.15776509843253872, 'normalization': 'none'}. Best is trial 1528 with value: 0.5170644640922546.
Generating morgan fingerprints...
Generated fingerprints with 2048 features for 900 molecules
Data shape: X=(900, 2048), y=(900,)
Trial 1723: 5-fold CV loss = 0.5681
[I 2025-08-08 01:55:33,917] Trial 1723 finished with value: 0.5680927217006684 and parameters: {'fp_type': 'morgan', 'morgan_only_radius': 2, 'morgan_only_nBits': 2048, 'num_hidden_layers': 3, 'hidden_dim_0': 64, 'hidden_dim_1': 128, 'hidden_dim_2': 512, 'kl_weight': 0.0004959936233998028, 'lr': 0.0015311114875454573, 'batch_size': 32, 'dropout_rate': 0.4354801183039398, 'prior_mu': 0.04681495525444774, 'prior_sigma': 0.06343575487477968, 'normalization': 'none'}. Best is trial 1528 with value: 0.5170644640922546.
Generating morgan fingerprints...
Generated fingerprints with 2048 features for 900 molecules
Data shape: X=(900, 2048), y=(900,)
Trial 1718: 5-fold CV loss = 0.7655
[I 2025-08-08 01:55:43,201] Trial 1718 finished with value: 0.7654658555984497 and parameters: {'fp_type': 'morgan', 'morgan_only_radius': 2, 'morgan_only_nBits': 2048, 'num_hidden_layers': 3, 'hidden_dim_0': 512, 'hidden_dim_1': 128, 'hidden_dim_2': 512, 'kl_weight': 0.0005216082564106904, 'lr': 0.002131045574962594, 'batch_size': 32, 'dropout_rate': 0.43576531916198785, 'prior_mu': 0.018899179362237395, 'prior_sigma': 0.12470256021415684, 'normalization': 'none'}. Best is trial 1528 with value: 0.5170644640922546.
Generating morgan fingerprints...
Generated fingerprints with 2048 features for 900 molecules
Data shape: X=(900, 2048), y=(900,)
Trial 1722: 5-fold CV loss = 0.6207
[I 2025-08-08 01:55:59,511] Trial 1722 finished with value: 0.6206723392009735 and parameters: {'fp_type': 'morgan', 'morgan_only_radius': 2, 'morgan_only_nBits': 2048, 'num_hidden_layers': 3, 'hidden_dim_0': 512, 'hidden_dim_1': 512, 'hidden_dim_2': 512, 'kl_weight': 0.0005171628934420101, 'lr': 0.0015892891461114992, 'batch_size': 32, 'dropout_rate': 0.4362377071744066, 'prior_mu': 0.030331469070861105, 'prior_sigma': 0.06310435041896617, 'normalization': 'none'}. Best is trial 1528 with value: 0.5170644640922546.
Generating morgan fingerprints...
Generated fingerprints with 2048 features for 900 molecules
Data shape: X=(900, 2048), y=(900,)
Trial 1724: 5-fold CV loss = 0.5490
[I 2025-08-08 01:56:13,583] Trial 1724 finished with value: 0.5489823937416076 and parameters: {'fp_type': 'morgan', 'morgan_only_radius': 2, 'morgan_only_nBits': 2048, 'num_hidden_layers': 3, 'hidden_dim_0': 256, 'hidden_dim_1': 128, 'hidden_dim_2': 512, 'kl_weight': 0.00048313702900303464, 'lr': 0.0021883698818124997, 'batch_size': 32, 'dropout_rate': 0.43586482223561684, 'prior_mu': -0.10691422886340535, 'prior_sigma': 0.06317590887807682, 'normalization': 'none'}. Best is trial 1528 with value: 0.5170644640922546.
Generating morgan fingerprints...
Generated fingerprints with 2048 features for 900 molecules
Data shape: X=(900, 2048), y=(900,)
Trial 1725: 5-fold CV loss = 0.5681
[I 2025-08-08 01:56:40,417] Trial 1725 finished with value: 0.56805220246315 and parameters: {'fp_type': 'morgan', 'morgan_only_radius': 2, 'morgan_only_nBits': 2048, 'num_hidden_layers': 3, 'hidden_dim_0': 512, 'hidden_dim_1': 128, 'hidden_dim_2': 512, 'kl_weight': 0.0007911204274260921, 'lr': 0.002186123487461825, 'batch_size': 32, 'dropout_rate': 0.4186935139912439, 'prior_mu': 0.029749692834708685, 'prior_sigma': 0.06869440592485876, 'normalization': 'none'}. Best is trial 1528 with value: 0.5170644640922546.
Generating morgan fingerprints...
Generated fingerprints with 2048 features for 900 molecules
Data shape: X=(900, 2048), y=(900,)
Trial 1729: 5-fold CV loss = 0.5527
[I 2025-08-08 01:57:47,522] Trial 1729 finished with value: 0.5527005672454834 and parameters: {'fp_type': 'morgan', 'morgan_only_radius': 2, 'morgan_only_nBits': 2048, 'num_hidden_layers': 3, 'hidden_dim_0': 512, 'hidden_dim_1': 128, 'hidden_dim_2': 512, 'kl_weight': 0.0008987170851753091, 'lr': 0.0018792363206534862, 'batch_size': 32, 'dropout_rate': 0.4046197144444166, 'prior_mu': 0.044506941124979535, 'prior_sigma': 0.06852249765307925, 'normalization': 'none'}. Best is trial 1528 with value: 0.5170644640922546.
Generating morgan fingerprints...
Generated fingerprints with 2048 features for 900 molecules
Data shape: X=(900, 2048), y=(900,)
Trial 1728: 5-fold CV loss = 0.5395
[I 2025-08-08 01:57:49,394] Trial 1728 finished with value: 0.5395075619220734 and parameters: {'fp_type': 'morgan', 'morgan_only_radius': 2, 'morgan_only_nBits': 2048, 'num_hidden_layers': 3, 'hidden_dim_0': 512, 'hidden_dim_1': 128, 'hidden_dim_2': 512, 'kl_weight': 0.0007980750268234432, 'lr': 0.0018610707301602572, 'batch_size': 32, 'dropout_rate': 0.41987440177150076, 'prior_mu': 0.026203230491522234, 'prior_sigma': 0.07067809429469468, 'normalization': 'none'}. Best is trial 1528 with value: 0.5170644640922546.
Generating morgan fingerprints...
Generated fingerprints with 2048 features for 900 molecules
Data shape: X=(900, 2048), y=(900,)
Trial 1730: 5-fold CV loss = 0.7519
[I 2025-08-08 01:57:54,187] Trial 1730 finished with value: 0.7518723249435425 and parameters: {'fp_type': 'morgan', 'morgan_only_radius': 2, 'morgan_only_nBits': 2048, 'num_hidden_layers': 1, 'hidden_dim_0': 512, 'kl_weight': 0.0007063852818607974, 'lr': 0.0018596517284845107, 'batch_size': 128, 'dropout_rate': 0.4195928494278351, 'prior_mu': 0.055131093479821806, 'prior_sigma': 0.0724884516556333, 'normalization': 'none'}. Best is trial 1528 with value: 0.5170644640922546.
Generating morgan fingerprints...
Generated fingerprints with 2048 features for 900 molecules
Data shape: X=(900, 2048), y=(900,)
Trial 1731: 5-fold CV loss = 0.7957
[I 2025-08-08 01:58:00,757] Trial 1731 finished with value: 0.7957043766975402 and parameters: {'fp_type': 'morgan', 'morgan_only_radius': 2, 'morgan_only_nBits': 2048, 'num_hidden_layers': 3, 'hidden_dim_0': 512, 'hidden_dim_1': 128, 'hidden_dim_2': 512, 'kl_weight': 0.0007134563844570403, 'lr': 0.0017214916653254867, 'batch_size': 128, 'dropout_rate': 0.42205998669876765, 'prior_mu': 0.057451364139806255, 'prior_sigma': 0.07321958772544215, 'normalization': 'none'}. Best is trial 1528 with value: 0.5170644640922546.
Generating morgan fingerprints...
Generated fingerprints with 2048 features for 900 molecules
Data shape: X=(900, 2048), y=(900,)
Trial 1727: 5-fold CV loss = 0.5213
