[I 2025-08-08 03:18:19,200] Trial 1950 finished with value: 0.6170393824577332 and parameters: {'fp_type': 'morgan', 'morgan_only_radius': 2, 'morgan_only_nBits': 2048, 'num_hidden_layers': 3, 'hidden_dim_0': 512, 'hidden_dim_1': 128, 'hidden_dim_2': 512, 'kl_weight': 0.0009537711327431949, 'lr': 0.0016841706252097425, 'batch_size': 32, 'dropout_rate': 0.008760667427843594, 'prior_mu': 0.0524079325239219, 'prior_sigma': 0.06622634118735031, 'normalization': 'none'}. Best is trial 1528 with value: 0.5170644640922546.
Generating morgan fingerprints...
Generated fingerprints with 2048 features for 900 molecules
Data shape: X=(900, 2048), y=(900,)
Trial 1954: 5-fold CV loss = 0.6828
[I 2025-08-08 03:18:31,174] Trial 1954 finished with value: 0.6828315377235412 and parameters: {'fp_type': 'morgan', 'morgan_only_radius': 2, 'morgan_only_nBits': 2048, 'num_hidden_layers': 1, 'hidden_dim_0': 128, 'kl_weight': 0.0006902158463470906, 'lr': 0.0018869478883423237, 'batch_size': 64, 'dropout_rate': 0.42682082734502513, 'prior_mu': 0.03179149733835775, 'prior_sigma': 0.07304937582033777, 'normalization': 'none'}. Best is trial 1528 with value: 0.5170644640922546.
Generating rdkit fingerprints...
Generated fingerprints with 1024 features for 900 molecules
Data shape: X=(900, 1024), y=(900,)
Trial 1953: 5-fold CV loss = 0.6626
[I 2025-08-08 03:18:51,697] Trial 1953 finished with value: 0.6626005649566651 and parameters: {'fp_type': 'rdkit', 'rdkit_only_maxPath': 7, 'rdkit_only_nBits': 1024, 'num_hidden_layers': 1, 'hidden_dim_0': 128, 'kl_weight': 0.0006894728539908532, 'lr': 0.0013835828500068628, 'batch_size': 64, 'dropout_rate': 0.4274984005765819, 'prior_mu': 0.06074155550843211, 'prior_sigma': 0.1090615745818992, 'normalization': 'none'}. Best is trial 1528 with value: 0.5170644640922546.
Generating morgan fingerprints...
Generated fingerprints with 2048 features for 900 molecules
Data shape: X=(900, 2048), y=(900,)
Trial 1948: 5-fold CV loss = 0.5542
[I 2025-08-08 03:19:05,491] Trial 1948 finished with value: 0.5542046844959259 and parameters: {'fp_type': 'morgan', 'morgan_only_radius': 3, 'morgan_only_nBits': 2048, 'num_hidden_layers': 3, 'hidden_dim_0': 1024, 'hidden_dim_1': 128, 'hidden_dim_2': 512, 'kl_weight': 0.0009766115450336888, 'lr': 0.0013985348401092592, 'batch_size': 32, 'dropout_rate': 0.008995011872044711, 'prior_mu': 0.05253219229224227, 'prior_sigma': 0.06608189509916199, 'normalization': 'layer'}. Best is trial 1528 with value: 0.5170644640922546.
Generating morgan fingerprints...
Generated fingerprints with 2048 features for 900 molecules
Data shape: X=(900, 2048), y=(900,)
Trial 1955: 5-fold CV loss = 0.5778
[I 2025-08-08 03:19:46,168] Trial 1955 finished with value: 0.577822494506836 and parameters: {'fp_type': 'rdkit', 'rdkit_only_maxPath': 7, 'rdkit_only_nBits': 1024, 'num_hidden_layers': 3, 'hidden_dim_0': 512, 'hidden_dim_1': 512, 'hidden_dim_2': 512, 'kl_weight': 0.0007745838862251959, 'lr': 0.0014236474779778182, 'batch_size': 32, 'dropout_rate': 0.4374606092985438, 'prior_mu': 0.06017230582177606, 'prior_sigma': 0.03542600831629565, 'normalization': 'none'}. Best is trial 1528 with value: 0.5170644640922546.
Generating morgan fingerprints...
Generated fingerprints with 2048 features for 900 molecules
Data shape: X=(900, 2048), y=(900,)
Trial 1956: 5-fold CV loss = 0.7183
[I 2025-08-08 03:19:48,344] Trial 1956 finished with value: 0.7182761073112488 and parameters: {'fp_type': 'morgan', 'morgan_only_radius': 2, 'morgan_only_nBits': 2048, 'num_hidden_layers': 3, 'hidden_dim_0': 512, 'hidden_dim_1': 512, 'hidden_dim_2': 512, 'kl_weight': 0.0010957976555269284, 'lr': 0.0021157991549127903, 'batch_size': 32, 'dropout_rate': 0.39437260243288486, 'prior_mu': 0.04178657151293763, 'prior_sigma': 0.06333711759528149, 'normalization': 'none'}. Best is trial 1528 with value: 0.5170644640922546.
Generating morgan fingerprints...
Generated fingerprints with 2048 features for 900 molecules
Data shape: X=(900, 2048), y=(900,)
Trial 1952: 5-fold CV loss = 0.5878
[I 2025-08-08 03:20:10,887] Trial 1952 finished with value: 0.587833458185196 and parameters: {'fp_type': 'morgan', 'morgan_only_radius': 2, 'morgan_only_nBits': 2048, 'num_hidden_layers': 3, 'hidden_dim_0': 128, 'hidden_dim_1': 1024, 'hidden_dim_2': 512, 'kl_weight': 0.0008474407086070722, 'lr': 0.002082718004462693, 'batch_size': 32, 'dropout_rate': 0.39324689014191966, 'prior_mu': 0.059836252267416914, 'prior_sigma': 0.07791923177906397, 'normalization': 'none'}. Best is trial 1528 with value: 0.5170644640922546.
Generating morgan_rdkit fingerprints...
Generated fingerprints with 1024 features for 900 molecules
Data shape: X=(900, 1024), y=(900,)
Trial 1958: 5-fold CV loss = 0.5262
[I 2025-08-08 03:21:00,758] Trial 1958 finished with value: 0.5262460350990296 and parameters: {'fp_type': 'morgan', 'morgan_only_radius': 2, 'morgan_only_nBits': 2048, 'num_hidden_layers': 3, 'hidden_dim_0': 512, 'hidden_dim_1': 128, 'hidden_dim_2': 512, 'kl_weight': 0.0011285685476491076, 'lr': 0.002144227672259645, 'batch_size': 32, 'dropout_rate': 0.44551494107540707, 'prior_mu': 0.042365354426919445, 'prior_sigma': 0.06244289189695368, 'normalization': 'none'}. Best is trial 1528 with value: 0.5170644640922546.
Generating morgan fingerprints...
Generated fingerprints with 2048 features for 900 molecules
Data shape: X=(900, 2048), y=(900,)
Trial 1959: 5-fold CV loss = 0.5249
[I 2025-08-08 03:21:17,197] Trial 1959 finished with value: 0.5248537421226501 and parameters: {'fp_type': 'morgan', 'morgan_only_radius': 2, 'morgan_only_nBits': 2048, 'num_hidden_layers': 3, 'hidden_dim_0': 512, 'hidden_dim_1': 128, 'hidden_dim_2': 512, 'kl_weight': 0.0005853136415986343, 'lr': 0.0021242504241076473, 'batch_size': 32, 'dropout_rate': 0.4456892751177967, 'prior_mu': 0.03511746964363605, 'prior_sigma': 0.07210561753773922, 'normalization': 'none'}. Best is trial 1528 with value: 0.5170644640922546.
Generating morgan_rdkit fingerprints...
Generated fingerprints with 1024 features for 900 molecules
Data shape: X=(900, 1024), y=(900,)
Trial 1957: 5-fold CV loss = 0.7076
[I 2025-08-08 03:21:19,951] Trial 1957 finished with value: 0.7075544834136963 and parameters: {'fp_type': 'morgan', 'morgan_only_radius': 2, 'morgan_only_nBits': 2048, 'num_hidden_layers': 3, 'hidden_dim_0': 512, 'hidden_dim_1': 512, 'hidden_dim_2': 512, 'kl_weight': 0.0008076172049860672, 'lr': 0.002115458708418226, 'batch_size': 32, 'dropout_rate': 0.4387170495010326, 'prior_mu': 0.042536122173594856, 'prior_sigma': 0.06267313581035956, 'normalization': 'none'}. Best is trial 1528 with value: 0.5170644640922546.
Generating morgan_rdkit fingerprints...
Generated fingerprints with 1024 features for 900 molecules
Data shape: X=(900, 1024), y=(900,)
Trial 1960: 5-fold CV loss = 0.6321
[I 2025-08-08 03:21:22,971] Trial 1960 finished with value: 0.6321393251419067 and parameters: {'fp_type': 'morgan_rdkit', 'combined_morgan_radius': 2, 'combined_morgan_nBits': 512, 'combined_rdkit_maxPath': 7, 'combined_rdkit_nBits': 512, 'num_hidden_layers': 3, 'hidden_dim_0': 512, 'hidden_dim_1': 128, 'hidden_dim_2': 512, 'kl_weight': 0.000574783723389376, 'lr': 0.0018593562016111023, 'batch_size': 32, 'dropout_rate': 0.4438879130736164, 'prior_mu': 0.03411904891599562, 'prior_sigma': 0.07189244625895302, 'normalization': 'none'}. Best is trial 1528 with value: 0.5170644640922546.
Generating morgan fingerprints...
Generated fingerprints with 2048 features for 900 molecules
Data shape: X=(900, 2048), y=(900,)
Trial 1961: 5-fold CV loss = 0.5550
[I 2025-08-08 03:22:09,586] Trial 1961 finished with value: 0.5550040125846862 and parameters: {'fp_type': 'morgan', 'morgan_only_radius': 2, 'morgan_only_nBits': 2048, 'num_hidden_layers': 3, 'hidden_dim_0': 512, 'hidden_dim_1': 128, 'hidden_dim_2': 512, 'kl_weight': 0.0005632900324124981, 'lr': 0.0018571620648083257, 'batch_size': 32, 'dropout_rate': 0.43757405284775697, 'prior_mu': 0.0343146738070576, 'prior_sigma': 0.05872815677814455, 'normalization': 'none'}. Best is trial 1528 with value: 0.5170644640922546.
Generating morgan fingerprints...
Generated fingerprints with 2048 features for 900 molecules
Data shape: X=(900, 2048), y=(900,)
Trial 1962: 5-fold CV loss = 0.5652
[I 2025-08-08 03:22:25,449] Trial 1962 finished with value: 0.5651502966880798 and parameters: {'fp_type': 'morgan_rdkit', 'combined_morgan_radius': 2, 'combined_morgan_nBits': 512, 'combined_rdkit_maxPath': 7, 'combined_rdkit_nBits': 512, 'num_hidden_layers': 3, 'hidden_dim_0': 512, 'hidden_dim_1': 128, 'hidden_dim_2': 128, 'kl_weight': 0.0007924080235589117, 'lr': 0.0018485165020821312, 'batch_size': 32, 'dropout_rate': 0.42327693396364424, 'prior_mu': 0.030337017475250916, 'prior_sigma': 0.05879266772942579, 'normalization': 'none'}. Best is trial 1528 with value: 0.5170644640922546.
Generating morgan fingerprints...
Generated fingerprints with 2048 features for 900 molecules
Data shape: X=(900, 2048), y=(900,)
Trial 1965: 5-fold CV loss = 0.5664
[I 2025-08-08 03:23:03,869] Trial 1965 finished with value: 0.5664459049701691 and parameters: {'fp_type': 'morgan', 'morgan_only_radius': 2, 'morgan_only_nBits': 2048, 'num_hidden_layers': 3, 'hidden_dim_0': 64, 'hidden_dim_1': 128, 'hidden_dim_2': 128, 'kl_weight': 0.0006889050145649566, 'lr': 0.0016043082458579074, 'batch_size': 32, 'dropout_rate': 0.42389132948958586, 'prior_mu': 0.029388796689960566, 'prior_sigma': 0.06638509273760382, 'normalization': 'none'}. Best is trial 1528 with value: 0.5170644640922546.
Generating morgan fingerprints...
Generated fingerprints with 2048 features for 900 molecules
Data shape: X=(900, 2048), y=(900,)
Trial 1964: 5-fold CV loss = 0.5596
[I 2025-08-08 03:23:20,561] Trial 1964 finished with value: 0.5595617711544036 and parameters: {'fp_type': 'morgan', 'morgan_only_radius': 2, 'morgan_only_nBits': 2048, 'num_hidden_layers': 3, 'hidden_dim_0': 64, 'hidden_dim_1': 128, 'hidden_dim_2': 128, 'kl_weight': 0.0006559124754118112, 'lr': 0.0015425543149469596, 'batch_size': 32, 'dropout_rate': 0.42552288899554014, 'prior_mu': -0.14134363533264235, 'prior_sigma': 0.05833679305299537, 'normalization': 'none'}. Best is trial 1528 with value: 0.5170644640922546.
Generating morgan fingerprints...
Generated fingerprints with 2048 features for 900 molecules
Data shape: X=(900, 2048), y=(900,)
Trial 1966: 5-fold CV loss = 0.5610
[I 2025-08-08 03:23:52,877] Trial 1966 finished with value: 0.56100212931633 and parameters: {'fp_type': 'morgan', 'morgan_only_radius': 2, 'morgan_only_nBits': 2048, 'num_hidden_layers': 3, 'hidden_dim_0': 64, 'hidden_dim_1': 128, 'hidden_dim_2': 512, 'kl_weight': 0.0006624480026858337, 'lr': 0.0015827735366683233, 'batch_size': 32, 'dropout_rate': 0.42712861185655, 'prior_mu': 0.042766903548506645, 'prior_sigma': 0.06653015360854662, 'normalization': 'none'}. Best is trial 1528 with value: 0.5170644640922546.
Generating morgan fingerprints...
Generated fingerprints with 2048 features for 900 molecules
Data shape: X=(900, 2048), y=(900,)
Trial 1967: 5-fold CV loss = 0.5232
[I 2025-08-08 03:24:05,812] Trial 1967 finished with value: 0.5231790781021118 and parameters: {'fp_type': 'morgan', 'morgan_only_radius': 2, 'morgan_only_nBits': 2048, 'num_hidden_layers': 3, 'hidden_dim_0': 512, 'hidden_dim_1': 128, 'hidden_dim_2': 512, 'kl_weight': 0.0006438002549388572, 'lr': 0.0022896424804116178, 'batch_size': 32, 'dropout_rate': 0.4059864498662559, 'prior_mu': 0.04632694602737928, 'prior_sigma': 0.07003332103116866, 'normalization': 'none'}. Best is trial 1528 with value: 0.5170644640922546.
Generating morgan fingerprints...
Generated fingerprints with 2048 features for 900 molecules
Data shape: X=(900, 2048), y=(900,)
Trial 1963: 5-fold CV loss = 0.5972
[I 2025-08-08 03:24:07,564] Trial 1963 finished with value: 0.5972083210945129 and parameters: {'fp_type': 'morgan_rdkit', 'combined_morgan_radius': 2, 'combined_morgan_nBits': 512, 'combined_rdkit_maxPath': 7, 'combined_rdkit_nBits': 512, 'num_hidden_layers': 3, 'hidden_dim_0': 512, 'hidden_dim_1': 128, 'hidden_dim_2': 128, 'kl_weight': 0.0005184266964516581, 'lr': 0.001860844953004463, 'batch_size': 32, 'dropout_rate': 0.4232735632126788, 'prior_mu': 0.03495542752380075, 'prior_sigma': 0.07197376569569355, 'normalization': 'none'}. Best is trial 1528 with value: 0.5170644640922546.
Generating morgan fingerprints...
Generated fingerprints with 2048 features for 900 molecules
Data shape: X=(900, 2048), y=(900,)
Trial 1969: 5-fold CV loss = 0.5260
[I 2025-08-08 03:25:14,150] Trial 1969 finished with value: 0.5259729146957397 and parameters: {'fp_type': 'morgan', 'morgan_only_radius': 2, 'morgan_only_nBits': 2048, 'num_hidden_layers': 3, 'hidden_dim_0': 512, 'hidden_dim_1': 128, 'hidden_dim_2': 512, 'kl_weight': 0.0004859440862022928, 'lr': 0.0022900031780646044, 'batch_size': 32, 'dropout_rate': 0.40186588368342685, 'prior_mu': 0.044816440190545405, 'prior_sigma': 0.07074715263034478, 'normalization': 'none'}. Best is trial 1528 with value: 0.5170644640922546.
Generating morgan fingerprints...
Generated fingerprints with 2048 features for 900 molecules
Data shape: X=(900, 2048), y=(900,)
Trial 1968: 5-fold CV loss = 0.5208
[I 2025-08-08 03:25:18,719] Trial 1968 finished with value: 0.520789635181427 and parameters: {'fp_type': 'morgan', 'morgan_only_radius': 2, 'morgan_only_nBits': 2048, 'num_hidden_layers': 3, 'hidden_dim_0': 512, 'hidden_dim_1': 128, 'hidden_dim_2': 512, 'kl_weight': 0.000498863210153061, 'lr': 0.002265548817608024, 'batch_size': 32, 'dropout_rate': 0.4314101556386081, 'prior_mu': 0.04482189120319914, 'prior_sigma': 0.06966046030875507, 'normalization': 'none'}. Best is trial 1528 with value: 0.5170644640922546.
Generating morgan fingerprints...
Generated fingerprints with 2048 features for 900 molecules
Data shape: X=(900, 2048), y=(900,)
Trial 1970: 5-fold CV loss = 0.5261
[I 2025-08-08 03:25:30,503] Trial 1970 finished with value: 0.5261062741279602 and parameters: {'fp_type': 'morgan', 'morgan_only_radius': 2, 'morgan_only_nBits': 2048, 'num_hidden_layers': 3, 'hidden_dim_0': 512, 'hidden_dim_1': 128, 'hidden_dim_2': 512, 'kl_weight': 0.0009464781276754989, 'lr': 0.0019629989714466003, 'batch_size': 32, 'dropout_rate': 0.45132816535342574, 'prior_mu': 0.025651903342950873, 'prior_sigma': 0.0760616973380125, 'normalization': 'none'}. Best is trial 1528 with value: 0.5170644640922546.
Generating morgan fingerprints...
Generated fingerprints with 2048 features for 900 molecules
Data shape: X=(900, 2048), y=(900,)
Trial 1972: 5-fold CV loss = 2.4820
[I 2025-08-08 03:25:32,494] Trial 1972 finished with value: 2.4820276260375977 and parameters: {'fp_type': 'morgan', 'morgan_only_radius': 2, 'morgan_only_nBits': 2048, 'num_hidden_layers': 3, 'hidden_dim_0': 512, 'hidden_dim_1': 128, 'hidden_dim_2': 512, 'kl_weight': 0.000954719360409527, 'lr': 0.0019927278327393754, 'batch_size': 128, 'dropout_rate': 0.3615909883834466, 'prior_mu': 0.025658521590225615, 'prior_sigma': 0.1882050027082398, 'normalization': 'none'}. Best is trial 1528 with value: 0.5170644640922546.
Generating morgan fingerprints...
Generated fingerprints with 2048 features for 900 molecules
Data shape: X=(900, 2048), y=(900,)
Trial 1973: 5-fold CV loss = 0.7874
[I 2025-08-08 03:25:36,544] Trial 1973 finished with value: 0.78739914894104 and parameters: {'fp_type': 'morgan', 'morgan_only_radius': 2, 'morgan_only_nBits': 2048, 'num_hidden_layers': 3, 'hidden_dim_0': 512, 'hidden_dim_1': 128, 'hidden_dim_2': 512, 'kl_weight': 0.00044920539315021176, 'lr': 0.0026849998561123967, 'batch_size': 128, 'dropout_rate': 0.4489571183156629, 'prior_mu': 0.05844729530632571, 'prior_sigma': 0.07756496167900107, 'normalization': 'none'}. Best is trial 1528 with value: 0.5170644640922546.
Generating morgan fingerprints...
Generated fingerprints with 2048 features for 900 molecules
Data shape: X=(900, 2048), y=(900,)
Trial 1974: 5-fold CV loss = 0.7690
[I 2025-08-08 03:25:39,892] Trial 1974 finished with value: 0.768962299823761 and parameters: {'fp_type': 'morgan', 'morgan_only_radius': 2, 'morgan_only_nBits': 2048, 'num_hidden_layers': 3, 'hidden_dim_0': 512, 'hidden_dim_1': 256, 'hidden_dim_2': 512, 'kl_weight': 0.0004037917527579019, 'lr': 0.0025380447092474465, 'batch_size': 128, 'dropout_rate': 0.448536903960876, 'prior_mu': 0.06403896672142113, 'prior_sigma': 0.06359672660052339, 'normalization': 'none'}. Best is trial 1528 with value: 0.5170644640922546.
Generating morgan fingerprints...
Generated fingerprints with 2048 features for 900 molecules
Data shape: X=(900, 2048), y=(900,)
Trial 1977: 5-fold CV loss = 0.6410
[I 2025-08-08 03:26:17,932] Trial 1977 finished with value: 0.6410208702087402 and parameters: {'fp_type': 'morgan', 'morgan_only_radius': 2, 'morgan_only_nBits': 2048, 'num_hidden_layers': 3, 'hidden_dim_0': 512, 'hidden_dim_1': 128, 'hidden_dim_2': 64, 'kl_weight': 0.00041420898285175235, 'lr': 0.0024000368142271388, 'batch_size': 32, 'dropout_rate': 0.43424768205728437, 'prior_mu': 0.05430760241417591, 'prior_sigma': 0.07958242103686339, 'normalization': 'none'}. Best is trial 1528 with value: 0.5170644640922546.
Generating morgan fingerprints...
Generated fingerprints with 2048 features for 900 molecules
Data shape: X=(900, 2048), y=(900,)
Trial 1975: 5-fold CV loss = 0.6131
[I 2025-08-08 03:26:38,777] Trial 1975 finished with value: 0.6130668818950653 and parameters: {'fp_type': 'morgan', 'morgan_only_radius': 2, 'morgan_only_nBits': 2048, 'num_hidden_layers': 3, 'hidden_dim_0': 512, 'hidden_dim_1': 128, 'hidden_dim_2': 64, 'kl_weight': 0.0004128560382314376, 'lr': 0.0027703895999218408, 'batch_size': 32, 'dropout_rate': 0.4479416262311592, 'prior_mu': 0.05575409624803292, 'prior_sigma': 0.07710986972716567, 'normalization': 'none'}. Best is trial 1528 with value: 0.5170644640922546.
Generating morgan fingerprints...
Generated fingerprints with 2048 features for 900 molecules
Data shape: X=(900, 2048), y=(900,)
Trial 1976: 5-fold CV loss = 1.2069
[I 2025-08-08 03:27:00,865] Trial 1976 finished with value: 1.206914234161377 and parameters: {'fp_type': 'morgan', 'morgan_only_radius': 2, 'morgan_only_nBits': 2048, 'num_hidden_layers': 3, 'hidden_dim_0': 512, 'hidden_dim_1': 128, 'hidden_dim_2': 64, 'kl_weight': 0.00040591899209883544, 'lr': 0.0028460830236220727, 'batch_size': 32, 'dropout_rate': 0.4357926576493124, 'prior_mu': 0.06541851153073967, 'prior_sigma': 0.18259914949239714, 'normalization': 'none'}. Best is trial 1528 with value: 0.5170644640922546.
Generating morgan fingerprints...
Generated fingerprints with 2048 features for 900 molecules
Data shape: X=(900, 2048), y=(900,)
Trial 1978: 5-fold CV loss = 0.5269
[I 2025-08-08 03:27:18,848] Trial 1978 finished with value: 0.5268735229969025 and parameters: {'fp_type': 'morgan', 'morgan_only_radius': 2, 'morgan_only_nBits': 2048, 'num_hidden_layers': 3, 'hidden_dim_0': 512, 'hidden_dim_1': 128, 'hidden_dim_2': 512, 'kl_weight': 0.00046122850667557324, 'lr': 0.0028049661997437123, 'batch_size': 32, 'dropout_rate': 0.4383643295868207, 'prior_mu': 0.06503043504198401, 'prior_sigma': 0.0651729973651228, 'normalization': 'none'}. Best is trial 1528 with value: 0.5170644640922546.
Generating morgan fingerprints...
Generated fingerprints with 2048 features for 900 molecules
Data shape: X=(900, 2048), y=(900,)
Trial 1971: 5-fold CV loss = 0.6830
[I 2025-08-08 03:27:37,817] Trial 1971 finished with value: 0.6830381274223327 and parameters: {'fp_type': 'morgan', 'morgan_only_radius': 2, 'morgan_only_nBits': 2048, 'num_hidden_layers': 3, 'hidden_dim_0': 512, 'hidden_dim_1': 256, 'hidden_dim_2': 512, 'kl_weight': 0.0009568689400280627, 'lr': 0.0019931483850051906, 'batch_size': 32, 'dropout_rate': 0.4496191646612948, 'prior_mu': 0.02582619866631527, 'prior_sigma': 0.07668391138171726, 'normalization': 'none'}. Best is trial 1528 with value: 0.5170644640922546.
Generating morgan fingerprints...
Generated fingerprints with 2048 features for 900 molecules
Data shape: X=(900, 2048), y=(900,)
Trial 1979: 5-fold CV loss = 0.5578
[I 2025-08-08 03:28:30,009] Trial 1979 finished with value: 0.5577549040317535 and parameters: {'fp_type': 'morgan', 'morgan_only_radius': 2, 'morgan_only_nBits': 2048, 'num_hidden_layers': 3, 'hidden_dim_0': 512, 'hidden_dim_1': 128, 'hidden_dim_2': 512, 'kl_weight': 0.00047511257301243495, 'lr': 0.0024144401475331605, 'batch_size': 32, 'dropout_rate': 0.43744687121794684, 'prior_mu': 0.067539145698051, 'prior_sigma': 0.13811513388287872, 'normalization': 'none'}. Best is trial 1528 with value: 0.5170644640922546.
Generating morgan fingerprints...
Generated fingerprints with 2048 features for 900 molecules
Data shape: X=(900, 2048), y=(900,)
Trial 1981: 5-fold CV loss = 0.5218
[I 2025-08-08 03:28:37,912] Trial 1981 finished with value: 0.5217832922935486 and parameters: {'fp_type': 'morgan', 'morgan_only_radius': 2, 'morgan_only_nBits': 2048, 'num_hidden_layers': 3, 'hidden_dim_0': 512, 'hidden_dim_1': 128, 'hidden_dim_2': 512, 'kl_weight': 0.000521513238929967, 'lr': 0.0023265141314749048, 'batch_size': 32, 'dropout_rate': 0.44990731179163385, 'prior_mu': 0.049523448850016014, 'prior_sigma': 0.06159754886927691, 'normalization': 'none'}. Best is trial 1528 with value: 0.5170644640922546.
Generating morgan fingerprints...
Generated fingerprints with 2048 features for 900 molecules
Data shape: X=(900, 2048), y=(900,)
Trial 1980: 5-fold CV loss = 0.5217
