[I 2025-08-08 02:09:19,204] Trial 1753 finished with value: 0.5446799755096435 and parameters: {'fp_type': 'morgan', 'morgan_only_radius': 2, 'morgan_only_nBits': 2048, 'num_hidden_layers': 3, 'hidden_dim_0': 64, 'hidden_dim_1': 128, 'hidden_dim_2': 512, 'kl_weight': 0.0009778955236849811, 'lr': 0.001970303758935244, 'batch_size': 32, 'dropout_rate': 0.41807746147514746, 'prior_mu': 0.042687433732608006, 'prior_sigma': 0.07302400806733594, 'normalization': 'none'}. Best is trial 1528 with value: 0.5170644640922546.
Generating morgan fingerprints...
Generated fingerprints with 2048 features for 900 molecules
Data shape: X=(900, 2048), y=(900,)
Trial 1761: 5-fold CV loss = 0.5940
[I 2025-08-08 02:10:06,453] Trial 1761 finished with value: 0.5940317034721374 and parameters: {'fp_type': 'rdkit', 'rdkit_only_maxPath': 7, 'rdkit_only_nBits': 1024, 'num_hidden_layers': 3, 'hidden_dim_0': 512, 'hidden_dim_1': 128, 'hidden_dim_2': 64, 'kl_weight': 0.00042650565739292556, 'lr': 0.001610073140491325, 'batch_size': 32, 'dropout_rate': 0.41717195336943425, 'prior_mu': 0.04795337691646364, 'prior_sigma': 0.0672226920180608, 'normalization': 'none'}. Best is trial 1528 with value: 0.5170644640922546.
Generating morgan fingerprints...
Generated fingerprints with 2048 features for 900 molecules
Data shape: X=(900, 2048), y=(900,)
Trial 1763: 5-fold CV loss = 0.6097
[I 2025-08-08 02:10:08,377] Trial 1763 finished with value: 0.609662139415741 and parameters: {'fp_type': 'morgan', 'morgan_only_radius': 2, 'morgan_only_nBits': 2048, 'num_hidden_layers': 3, 'hidden_dim_0': 512, 'hidden_dim_1': 128, 'hidden_dim_2': 512, 'kl_weight': 0.00080507674228943, 'lr': 0.00160555041571713, 'batch_size': 32, 'dropout_rate': 0.40376488479749767, 'prior_mu': 0.032630695885947573, 'prior_sigma': 0.06768486374154206, 'normalization': 'none'}. Best is trial 1528 with value: 0.5170644640922546.
Generating morgan fingerprints...
Generated fingerprints with 2048 features for 900 molecules
Data shape: X=(900, 2048), y=(900,)
Trial 1764: 5-fold CV loss = 0.5179
[I 2025-08-08 02:10:30,694] Trial 1764 finished with value: 0.5179389238357544 and parameters: {'fp_type': 'morgan', 'morgan_only_radius': 2, 'morgan_only_nBits': 2048, 'num_hidden_layers': 3, 'hidden_dim_0': 512, 'hidden_dim_1': 128, 'hidden_dim_2': 512, 'kl_weight': 0.0007804932049460013, 'lr': 0.002239907982499177, 'batch_size': 32, 'dropout_rate': 0.44052178360655064, 'prior_mu': 0.031840251204876276, 'prior_sigma': 0.06877583981665751, 'normalization': 'none'}. Best is trial 1528 with value: 0.5170644640922546.
Generating morgan fingerprints...
Generated fingerprints with 2048 features for 900 molecules
Data shape: X=(900, 2048), y=(900,)
Trial 1768: 5-fold CV loss = 1.2432
[I 2025-08-08 02:11:02,914] Trial 1768 finished with value: 1.2431721806526184 and parameters: {'fp_type': 'morgan', 'morgan_only_radius': 2, 'morgan_only_nBits': 2048, 'num_hidden_layers': 3, 'hidden_dim_0': 512, 'hidden_dim_1': 128, 'hidden_dim_2': 512, 'kl_weight': 0.0007636282233709674, 'lr': 0.0005725254878430862, 'batch_size': 32, 'dropout_rate': 0.4338248147651231, 'prior_mu': 0.01738898903762796, 'prior_sigma': 0.07980597305473329, 'normalization': 'none'}. Best is trial 1528 with value: 0.5170644640922546.
Generating morgan fingerprints...
Generated fingerprints with 2048 features for 900 molecules
Data shape: X=(900, 2048), y=(900,)
Trial 1767: 5-fold CV loss = 0.5237
[I 2025-08-08 02:11:20,995] Trial 1767 finished with value: 0.5236795961856842 and parameters: {'fp_type': 'morgan', 'morgan_only_radius': 2, 'morgan_only_nBits': 2048, 'num_hidden_layers': 3, 'hidden_dim_0': 512, 'hidden_dim_1': 128, 'hidden_dim_2': 512, 'kl_weight': 0.0005718757264794501, 'lr': 0.002329803062598694, 'batch_size': 32, 'dropout_rate': 0.433538910947557, 'prior_mu': 0.024528232607431547, 'prior_sigma': 0.06282103630528763, 'normalization': 'none'}. Best is trial 1528 with value: 0.5170644640922546.
Generating morgan fingerprints...
Generated fingerprints with 2048 features for 900 molecules
Data shape: X=(900, 2048), y=(900,)
Trial 1766: 5-fold CV loss = 0.5174
[I 2025-08-08 02:12:04,316] Trial 1766 finished with value: 0.517433762550354 and parameters: {'fp_type': 'morgan', 'morgan_only_radius': 2, 'morgan_only_nBits': 2048, 'num_hidden_layers': 3, 'hidden_dim_0': 512, 'hidden_dim_1': 128, 'hidden_dim_2': 512, 'kl_weight': 0.0007828589317992752, 'lr': 0.002192486614137813, 'batch_size': 32, 'dropout_rate': 0.4014282291930867, 'prior_mu': 0.018175196248952655, 'prior_sigma': 0.06280114475942532, 'normalization': 'none'}. Best is trial 1528 with value: 0.5170644640922546.
Generating morgan fingerprints...
Generated fingerprints with 2048 features for 900 molecules
Data shape: X=(900, 2048), y=(900,)
Trial 1769: 5-fold CV loss = 0.5269
[I 2025-08-08 02:12:09,800] Trial 1769 finished with value: 0.5268979847431183 and parameters: {'fp_type': 'morgan', 'morgan_only_radius': 2, 'morgan_only_nBits': 2048, 'num_hidden_layers': 3, 'hidden_dim_0': 512, 'hidden_dim_1': 128, 'hidden_dim_2': 512, 'kl_weight': 0.0009313471506578198, 'lr': 0.0022947252469422003, 'batch_size': 32, 'dropout_rate': 0.4361040973312307, 'prior_mu': 0.0245412327243135, 'prior_sigma': 0.07590864395736965, 'normalization': 'none'}. Best is trial 1528 with value: 0.5170644640922546.
Generating morgan fingerprints...
Generated fingerprints with 2048 features for 900 molecules
Data shape: X=(900, 2048), y=(900,)
Trial 1770: 5-fold CV loss = 0.5219
[I 2025-08-08 02:12:50,658] Trial 1770 finished with value: 0.5219113051891326 and parameters: {'fp_type': 'morgan', 'morgan_only_radius': 2, 'morgan_only_nBits': 2048, 'num_hidden_layers': 3, 'hidden_dim_0': 512, 'hidden_dim_1': 128, 'hidden_dim_2': 512, 'kl_weight': 0.0009323911652131036, 'lr': 0.0022678865011481492, 'batch_size': 32, 'dropout_rate': 0.43697423874332614, 'prior_mu': 0.017385607181570485, 'prior_sigma': 0.07068717941864189, 'normalization': 'none'}. Best is trial 1528 with value: 0.5170644640922546.
Generating morgan fingerprints...
Generated fingerprints with 2048 features for 900 molecules
Data shape: X=(900, 2048), y=(900,)
Trial 1772: 5-fold CV loss = 0.7044
[I 2025-08-08 02:13:24,191] Trial 1772 finished with value: 0.704432338476181 and parameters: {'fp_type': 'morgan', 'morgan_only_radius': 2, 'morgan_only_nBits': 2048, 'num_hidden_layers': 3, 'hidden_dim_0': 512, 'hidden_dim_1': 1024, 'hidden_dim_2': 512, 'kl_weight': 0.0008520899581076515, 'lr': 0.0024314672851177724, 'batch_size': 32, 'dropout_rate': 0.3888887940773473, 'prior_mu': 0.01791133743898937, 'prior_sigma': 0.0698448230452044, 'normalization': 'none'}. Best is trial 1528 with value: 0.5170644640922546.
Generating morgan fingerprints...
Generated fingerprints with 2048 features for 900 molecules
Data shape: X=(900, 2048), y=(900,)
Trial 1771: 5-fold CV loss = 0.5287
[I 2025-08-08 02:13:45,919] Trial 1771 finished with value: 0.5287387728691101 and parameters: {'fp_type': 'morgan', 'morgan_only_radius': 2, 'morgan_only_nBits': 2048, 'num_hidden_layers': 3, 'hidden_dim_0': 512, 'hidden_dim_1': 128, 'hidden_dim_2': 512, 'kl_weight': 0.000955538155064925, 'lr': 0.0023591562293271994, 'batch_size': 32, 'dropout_rate': 0.38887675073400957, 'prior_mu': 0.019050210123234622, 'prior_sigma': 0.07004756980186216, 'normalization': 'none'}. Best is trial 1528 with value: 0.5170644640922546.
Generating morgan fingerprints...
Generated fingerprints with 2048 features for 900 molecules
Data shape: X=(900, 2048), y=(900,)
Trial 1773: 5-fold CV loss = 0.8087
[I 2025-08-08 02:13:58,954] Trial 1773 finished with value: 0.8086623907089233 and parameters: {'fp_type': 'morgan', 'morgan_only_radius': 2, 'morgan_only_nBits': 2048, 'num_hidden_layers': 3, 'hidden_dim_0': 512, 'hidden_dim_1': 1024, 'hidden_dim_2': 512, 'kl_weight': 0.0007983031842309076, 'lr': 0.0022928763200149604, 'batch_size': 32, 'dropout_rate': 0.3959402680792197, 'prior_mu': 0.015440274882835336, 'prior_sigma': 0.06953055681606728, 'normalization': 'none'}. Best is trial 1528 with value: 0.5170644640922546.
Generating morgan fingerprints...
Generated fingerprints with 2048 features for 900 molecules
Data shape: X=(900, 2048), y=(900,)
Trial 1775: 5-fold CV loss = 0.6852
[I 2025-08-08 02:14:01,203] Trial 1775 finished with value: 0.6851521730422974 and parameters: {'fp_type': 'morgan', 'morgan_only_radius': 2, 'morgan_only_nBits': 2048, 'num_hidden_layers': 3, 'hidden_dim_0': 512, 'hidden_dim_1': 128, 'hidden_dim_2': 512, 'kl_weight': 0.0007812078790795892, 'lr': 0.002251822190925345, 'batch_size': 128, 'dropout_rate': 0.40909132684548455, 'prior_mu': 0.018626188845174127, 'prior_sigma': 0.06470234793506287, 'normalization': 'none'}. Best is trial 1528 with value: 0.5170644640922546.
Generating morgan fingerprints...
Generated fingerprints with 2048 features for 900 molecules
Data shape: X=(900, 2048), y=(900,)
Trial 1776: 5-fold CV loss = 0.6819
[I 2025-08-08 02:14:11,635] Trial 1776 finished with value: 0.6819419503211975 and parameters: {'fp_type': 'morgan', 'morgan_only_radius': 2, 'morgan_only_nBits': 2048, 'num_hidden_layers': 3, 'hidden_dim_0': 512, 'hidden_dim_1': 128, 'hidden_dim_2': 512, 'kl_weight': 0.000775636468249333, 'lr': 0.00224572427940718, 'batch_size': 128, 'dropout_rate': 0.4093974156046406, 'prior_mu': 0.014793067786117052, 'prior_sigma': 0.06447121671416974, 'normalization': 'none'}. Best is trial 1528 with value: 0.5170644640922546.
Generating morgan fingerprints...
Generated fingerprints with 2048 features for 900 molecules
Data shape: X=(900, 2048), y=(900,)
Trial 1765: 5-fold CV loss = 0.5281
[I 2025-08-08 02:14:27,608] Trial 1765 finished with value: 0.5280667185783386 and parameters: {'fp_type': 'morgan', 'morgan_only_radius': 2, 'morgan_only_nBits': 2048, 'num_hidden_layers': 3, 'hidden_dim_0': 512, 'hidden_dim_1': 128, 'hidden_dim_2': 512, 'kl_weight': 0.0007596365703082559, 'lr': 0.0016556725876359774, 'batch_size': 32, 'dropout_rate': 0.4383714031529833, 'prior_mu': 0.03247885474634343, 'prior_sigma': 0.06825825267240193, 'normalization': 'none'}. Best is trial 1528 with value: 0.5170644640922546.
Generating morgan fingerprints...
Generated fingerprints with 2048 features for 900 molecules
Data shape: X=(900, 2048), y=(900,)
Trial 1774: 5-fold CV loss = 0.5257
[I 2025-08-08 02:14:45,566] Trial 1774 finished with value: 0.5256616532802582 and parameters: {'fp_type': 'morgan', 'morgan_only_radius': 2, 'morgan_only_nBits': 2048, 'num_hidden_layers': 3, 'hidden_dim_0': 512, 'hidden_dim_1': 128, 'hidden_dim_2': 512, 'kl_weight': 0.0007935721939926728, 'lr': 0.0023376168422327022, 'batch_size': 32, 'dropout_rate': 0.4027243800143145, 'prior_mu': 0.018052573209221753, 'prior_sigma': 0.06954454639192245, 'normalization': 'none'}. Best is trial 1528 with value: 0.5170644640922546.
Generating morgan fingerprints...
Generated fingerprints with 2048 features for 900 molecules
Data shape: X=(900, 2048), y=(900,)
Trial 1778: 5-fold CV loss = 0.5935
[I 2025-08-08 02:15:11,449] Trial 1778 finished with value: 0.5934574127197265 and parameters: {'fp_type': 'morgan', 'morgan_only_radius': 2, 'morgan_only_nBits': 2048, 'num_hidden_layers': 3, 'hidden_dim_0': 512, 'hidden_dim_1': 128, 'hidden_dim_2': 512, 'kl_weight': 0.0009563022191015151, 'lr': 0.0025182514002173658, 'batch_size': 32, 'dropout_rate': 0.4049432391034385, 'prior_mu': 0.02746004619953373, 'prior_sigma': 0.15046813095058292, 'normalization': 'none'}. Best is trial 1528 with value: 0.5170644640922546.
Generating morgan fingerprints...
Generated fingerprints with 2048 features for 900 molecules
Data shape: X=(900, 2048), y=(900,)
Trial 1780: 5-fold CV loss = 0.6905
[I 2025-08-08 02:15:13,292] Trial 1780 finished with value: 0.6904896140098572 and parameters: {'fp_type': 'morgan', 'morgan_only_radius': 2, 'morgan_only_nBits': 2048, 'num_hidden_layers': 3, 'hidden_dim_0': 512, 'hidden_dim_1': 128, 'hidden_dim_2': 512, 'kl_weight': 0.0009030951623090997, 'lr': 0.0024986774401689685, 'batch_size': 64, 'dropout_rate': 0.4019827291354831, 'prior_mu': 0.02375733872737138, 'prior_sigma': 0.07439553241944831, 'normalization': 'none'}. Best is trial 1528 with value: 0.5170644640922546.
Generating morgan fingerprints...
Generated fingerprints with 2048 features for 900 molecules
Data shape: X=(900, 2048), y=(900,)
Trial 1781: 5-fold CV loss = 0.6801
[I 2025-08-08 02:15:48,641] Trial 1781 finished with value: 0.68011514544487 and parameters: {'fp_type': 'morgan', 'morgan_only_radius': 2, 'morgan_only_nBits': 2048, 'num_hidden_layers': 3, 'hidden_dim_0': 512, 'hidden_dim_1': 128, 'hidden_dim_2': 512, 'kl_weight': 0.0007252334635084371, 'lr': 0.002150173963287439, 'batch_size': 64, 'dropout_rate': 0.41148727133825, 'prior_mu': 0.024801488467766548, 'prior_sigma': 0.07630706324842096, 'normalization': 'none'}. Best is trial 1528 with value: 0.5170644640922546.
Generating morgan fingerprints...
Generated fingerprints with 2048 features for 900 molecules
Data shape: X=(900, 2048), y=(900,)
Trial 1782: 5-fold CV loss = 0.5299
[I 2025-08-08 02:16:27,261] Trial 1782 finished with value: 0.5298512279987335 and parameters: {'fp_type': 'morgan', 'morgan_only_radius': 3, 'morgan_only_nBits': 2048, 'num_hidden_layers': 3, 'hidden_dim_0': 512, 'hidden_dim_1': 128, 'hidden_dim_2': 512, 'kl_weight': 0.00102254298701991, 'lr': 0.002107769322528018, 'batch_size': 32, 'dropout_rate': 0.37694183774756757, 'prior_mu': 0.028331688728809236, 'prior_sigma': 0.06342310635008068, 'normalization': 'none'}. Best is trial 1528 with value: 0.5170644640922546.
Generating morgan fingerprints...
Generated fingerprints with 2048 features for 900 molecules
Data shape: X=(900, 2048), y=(900,)
Trial 1777: 5-fold CV loss = 0.5340
[I 2025-08-08 02:16:29,260] Trial 1777 finished with value: 0.5340191006660462 and parameters: {'fp_type': 'morgan', 'morgan_only_radius': 2, 'morgan_only_nBits': 2048, 'num_hidden_layers': 3, 'hidden_dim_0': 512, 'hidden_dim_1': 128, 'hidden_dim_2': 512, 'kl_weight': 0.000988422294021984, 'lr': 0.0022017300122691283, 'batch_size': 32, 'dropout_rate': 0.4047893842741661, 'prior_mu': 0.02521504553619987, 'prior_sigma': 0.06431315123257379, 'normalization': 'none'}. Best is trial 1528 with value: 0.5170644640922546.
Generating morgan fingerprints...
Generated fingerprints with 2048 features for 900 molecules
Data shape: X=(900, 2048), y=(900,)
Trial 1783: 5-fold CV loss = 0.5401
[I 2025-08-08 02:16:59,083] Trial 1783 finished with value: 0.5400644183158875 and parameters: {'fp_type': 'morgan', 'morgan_only_radius': 3, 'morgan_only_nBits': 2048, 'num_hidden_layers': 3, 'hidden_dim_0': 512, 'hidden_dim_1': 128, 'hidden_dim_2': 512, 'kl_weight': 0.001053738750564723, 'lr': 0.002159894055959265, 'batch_size': 32, 'dropout_rate': 0.4182779603190383, 'prior_mu': 0.03305888442015336, 'prior_sigma': 0.06352306152802413, 'normalization': 'layer'}. Best is trial 1528 with value: 0.5170644640922546.
Generating morgan fingerprints...
Generated fingerprints with 2048 features for 900 molecules
Data shape: X=(900, 2048), y=(900,)
Trial 1779: 5-fold CV loss = 0.5410
[I 2025-08-08 02:17:22,757] Trial 1779 finished with value: 0.5410353064537048 and parameters: {'fp_type': 'morgan', 'morgan_only_radius': 2, 'morgan_only_nBits': 2048, 'num_hidden_layers': 3, 'hidden_dim_0': 512, 'hidden_dim_1': 128, 'hidden_dim_2': 512, 'kl_weight': 0.00102356102819284, 'lr': 0.00244494877723889, 'batch_size': 32, 'dropout_rate': 0.40245128535903585, 'prior_mu': 0.025976556942108996, 'prior_sigma': 0.07449885029907263, 'normalization': 'layer'}. Best is trial 1528 with value: 0.5170644640922546.
Generating morgan fingerprints...
Generated fingerprints with 2048 features for 900 molecules
Data shape: X=(900, 2048), y=(900,)
Trial 1784: 5-fold CV loss = 0.5441
[I 2025-08-08 02:17:31,899] Trial 1784 finished with value: 0.5441067934036254 and parameters: {'fp_type': 'morgan', 'morgan_only_radius': 2, 'morgan_only_nBits': 2048, 'num_hidden_layers': 3, 'hidden_dim_0': 512, 'hidden_dim_1': 128, 'hidden_dim_2': 512, 'kl_weight': 0.0006781893370898302, 'lr': 0.003312150382400422, 'batch_size': 32, 'dropout_rate': 0.4203003278851998, 'prior_mu': 0.03359662112203806, 'prior_sigma': 0.09565258619705853, 'normalization': 'layer'}. Best is trial 1528 with value: 0.5170644640922546.
Generating morgan fingerprints...
Generated fingerprints with 2048 features for 900 molecules
Data shape: X=(900, 2048), y=(900,)
Trial 1785: 5-fold CV loss = 0.5478
[I 2025-08-08 02:17:51,109] Trial 1785 finished with value: 0.5478411972522735 and parameters: {'fp_type': 'morgan', 'morgan_only_radius': 2, 'morgan_only_nBits': 2048, 'num_hidden_layers': 3, 'hidden_dim_0': 512, 'hidden_dim_1': 128, 'hidden_dim_2': 512, 'kl_weight': 0.0007278319413230984, 'lr': 0.0033142168128162523, 'batch_size': 32, 'dropout_rate': 0.42515134699667606, 'prior_mu': 0.01465091794816311, 'prior_sigma': 0.07275112422646457, 'normalization': 'layer'}. Best is trial 1528 with value: 0.5170644640922546.
Generating morgan fingerprints...
Generated fingerprints with 2048 features for 900 molecules
Data shape: X=(900, 2048), y=(900,)
Trial 1786: 5-fold CV loss = 0.5255
[I 2025-08-08 02:18:24,556] Trial 1786 finished with value: 0.5254757285118103 and parameters: {'fp_type': 'morgan', 'morgan_only_radius': 2, 'morgan_only_nBits': 2048, 'num_hidden_layers': 3, 'hidden_dim_0': 512, 'hidden_dim_1': 128, 'hidden_dim_2': 512, 'kl_weight': 0.0006700070302610304, 'lr': 0.0018916078508358627, 'batch_size': 32, 'dropout_rate': 0.42116995207517643, 'prior_mu': 0.031169503941083313, 'prior_sigma': 0.0721492078106692, 'normalization': 'none'}. Best is trial 1528 with value: 0.5170644640922546.
Generating morgan fingerprints...
Generated fingerprints with 2048 features for 900 molecules
Data shape: X=(900, 2048), y=(900,)
Trial 1788: 5-fold CV loss = 0.5312
[I 2025-08-08 02:18:58,482] Trial 1788 finished with value: 0.5311881363391876 and parameters: {'fp_type': 'morgan', 'morgan_only_radius': 2, 'morgan_only_nBits': 2048, 'num_hidden_layers': 3, 'hidden_dim_0': 512, 'hidden_dim_1': 128, 'hidden_dim_2': 512, 'kl_weight': 0.0006861569298788967, 'lr': 0.001887079389112861, 'batch_size': 32, 'dropout_rate': 0.42700900553736054, 'prior_mu': 0.032165577898846075, 'prior_sigma': 0.06771330971244253, 'normalization': 'none'}. Best is trial 1528 with value: 0.5170644640922546.
Generating morgan fingerprints...
Generated fingerprints with 2048 features for 900 molecules
Data shape: X=(900, 2048), y=(900,)
Trial 1789: 5-fold CV loss = 0.5232
[I 2025-08-08 02:19:27,000] Trial 1789 finished with value: 0.5232278764247894 and parameters: {'fp_type': 'morgan', 'morgan_only_radius': 2, 'morgan_only_nBits': 2048, 'num_hidden_layers': 3, 'hidden_dim_0': 512, 'hidden_dim_1': 128, 'hidden_dim_2': 512, 'kl_weight': 0.000673170770913768, 'lr': 0.002836546904526419, 'batch_size': 32, 'dropout_rate': 0.4272076050178952, 'prior_mu': 0.032047281218769055, 'prior_sigma': 0.06724556009976189, 'normalization': 'none'}. Best is trial 1528 with value: 0.5170644640922546.
Generating morgan fingerprints...
Generated fingerprints with 2048 features for 900 molecules
Data shape: X=(900, 2048), y=(900,)
Trial 1791: 5-fold CV loss = 0.5322
[I 2025-08-08 02:19:49,833] Trial 1791 finished with value: 0.5322194397449493 and parameters: {'fp_type': 'morgan', 'morgan_only_radius': 2, 'morgan_only_nBits': 2048, 'num_hidden_layers': 3, 'hidden_dim_0': 512, 'hidden_dim_1': 128, 'hidden_dim_2': 512, 'kl_weight': 0.0008779285852421183, 'lr': 0.0027919493589342636, 'batch_size': 32, 'dropout_rate': 0.4142043025558233, 'prior_mu': 0.014266003981266064, 'prior_sigma': 0.08040794682743116, 'normalization': 'none'}. Best is trial 1528 with value: 0.5170644640922546.
Generating morgan fingerprints...
Generated fingerprints with 2048 features for 900 molecules
Data shape: X=(900, 2048), y=(900,)
Trial 1790: 5-fold CV loss = 0.5428
[I 2025-08-08 02:19:51,108] Trial 1790 finished with value: 0.5427616715431214 and parameters: {'fp_type': 'morgan', 'morgan_only_radius': 2, 'morgan_only_nBits': 2048, 'num_hidden_layers': 3, 'hidden_dim_0': 512, 'hidden_dim_1': 128, 'hidden_dim_2': 512, 'kl_weight': 0.0008341546323555493, 'lr': 0.0019338021432989592, 'batch_size': 32, 'dropout_rate': 0.4264905532534211, 'prior_mu': 0.0333671803779152, 'prior_sigma': 0.06781339643282669, 'normalization': 'none'}. Best is trial 1528 with value: 0.5170644640922546.
Generating morgan fingerprints...
Generated fingerprints with 2048 features for 900 molecules
Data shape: X=(900, 2048), y=(900,)
Trial 1787: 5-fold CV loss = 0.5381
[I 2025-08-08 02:20:23,717] Trial 1787 finished with value: 0.5380836725234985 and parameters: {'fp_type': 'morgan', 'morgan_only_radius': 2, 'morgan_only_nBits': 2048, 'num_hidden_layers': 3, 'hidden_dim_0': 512, 'hidden_dim_1': 128, 'hidden_dim_2': 512, 'kl_weight': 0.0006818576402200629, 'lr': 0.0028679706624440723, 'batch_size': 32, 'dropout_rate': 0.27078688602839474, 'prior_mu': 0.013467380943914808, 'prior_sigma': 0.06811845487783685, 'normalization': 'none'}. Best is trial 1528 with value: 0.5170644640922546.
Generating morgan fingerprints...
Generated fingerprints with 2048 features for 900 molecules
Data shape: X=(900, 2048), y=(900,)
Trial 1792: 5-fold CV loss = 0.5382
[I 2025-08-08 02:20:58,186] Trial 1792 finished with value: 0.538226056098938 and parameters: {'fp_type': 'morgan', 'morgan_only_radius': 2, 'morgan_only_nBits': 2048, 'num_hidden_layers': 3, 'hidden_dim_0': 1024, 'hidden_dim_1': 128, 'hidden_dim_2': 512, 'kl_weight': 0.000858270359729185, 'lr': 0.0023917769170799905, 'batch_size': 32, 'dropout_rate': 0.3938574811940986, 'prior_mu': 0.014846305437018571, 'prior_sigma': 0.08145082415690524, 'normalization': 'none'}. Best is trial 1528 with value: 0.5170644640922546.
Generating morgan fingerprints...
Generated fingerprints with 2048 features for 900 molecules
Data shape: X=(900, 2048), y=(900,)
Trial 1793: 5-fold CV loss = 0.5289
