[I 2025-08-08 04:17:18,811] Trial 2108 finished with value: 0.5344699740409851 and parameters: {'fp_type': 'morgan', 'morgan_only_radius': 2, 'morgan_only_nBits': 2048, 'num_hidden_layers': 3, 'hidden_dim_0': 512, 'hidden_dim_1': 64, 'hidden_dim_2': 256, 'kl_weight': 0.000732569037436291, 'lr': 0.002575641840555436, 'batch_size': 32, 'dropout_rate': 0.36599746630829877, 'prior_mu': 0.05464370379388107, 'prior_sigma': 0.10114537854266473, 'normalization': 'none'}. Best is trial 1528 with value: 0.5170644640922546.
Generating morgan fingerprints...
Generated fingerprints with 2048 features for 900 molecules
Data shape: X=(900, 2048), y=(900,)
Trial 2109: 5-fold CV loss = 0.5311
[I 2025-08-08 04:18:13,625] Trial 2109 finished with value: 0.5310733795166016 and parameters: {'fp_type': 'morgan', 'morgan_only_radius': 2, 'morgan_only_nBits': 2048, 'num_hidden_layers': 3, 'hidden_dim_0': 512, 'hidden_dim_1': 64, 'hidden_dim_2': 256, 'kl_weight': 0.0007406615752161742, 'lr': 0.0023224132560887064, 'batch_size': 32, 'dropout_rate': 0.4498832543942667, 'prior_mu': 0.05305327702288084, 'prior_sigma': 0.08919803563026191, 'normalization': 'none'}. Best is trial 1528 with value: 0.5170644640922546.
Generating morgan fingerprints...
Generated fingerprints with 2048 features for 900 molecules
Data shape: X=(900, 2048), y=(900,)
Trial 2102: 5-fold CV loss = 0.5272
[I 2025-08-08 04:18:46,813] Trial 2102 finished with value: 0.5271558642387391 and parameters: {'fp_type': 'morgan', 'morgan_only_radius': 2, 'morgan_only_nBits': 2048, 'num_hidden_layers': 3, 'hidden_dim_0': 512, 'hidden_dim_1': 64, 'hidden_dim_2': 256, 'kl_weight': 0.000649178300846925, 'lr': 0.0021613050542453652, 'batch_size': 32, 'dropout_rate': 0.4527004819001191, 'prior_mu': 0.05983804231313294, 'prior_sigma': 0.08580424494315887, 'normalization': 'none'}. Best is trial 1528 with value: 0.5170644640922546.
Generating morgan fingerprints...
Generated fingerprints with 2048 features for 900 molecules
Data shape: X=(900, 2048), y=(900,)
Trial 2111: 5-fold CV loss = 0.6705
[I 2025-08-08 04:18:55,196] Trial 2111 finished with value: 0.6704669237136841 and parameters: {'fp_type': 'morgan', 'morgan_only_radius': 2, 'morgan_only_nBits': 2048, 'num_hidden_layers': 3, 'hidden_dim_0': 512, 'hidden_dim_1': 64, 'hidden_dim_2': 256, 'kl_weight': 0.0005987865496695393, 'lr': 0.001264680568820377, 'batch_size': 32, 'dropout_rate': 0.44925470649016236, 'prior_mu': -0.08997446819379645, 'prior_sigma': 0.08789946709865352, 'normalization': 'none'}. Best is trial 1528 with value: 0.5170644640922546.
Generating morgan fingerprints...
Generated fingerprints with 2048 features for 900 molecules
Data shape: X=(900, 2048), y=(900,)
Trial 2114: 5-fold CV loss = 0.8265
[I 2025-08-08 04:19:13,884] Trial 2114 finished with value: 0.826496958732605 and parameters: {'fp_type': 'morgan', 'morgan_only_radius': 3, 'morgan_only_nBits': 2048, 'num_hidden_layers': 1, 'hidden_dim_0': 512, 'kl_weight': 0.0005662277668804554, 'lr': 0.001464152630320877, 'batch_size': 32, 'dropout_rate': 0.41235821840466513, 'prior_mu': 0.04686816031498405, 'prior_sigma': 0.0831428833266235, 'normalization': 'none'}. Best is trial 1528 with value: 0.5170644640922546.
Generating morgan fingerprints...
Generated fingerprints with 2048 features for 900 molecules
Data shape: X=(900, 2048), y=(900,)
Trial 2112: 5-fold CV loss = 0.6675
[I 2025-08-08 04:19:17,562] Trial 2112 finished with value: 0.6674816727638244 and parameters: {'fp_type': 'morgan', 'morgan_only_radius': 2, 'morgan_only_nBits': 2048, 'num_hidden_layers': 3, 'hidden_dim_0': 512, 'hidden_dim_1': 64, 'hidden_dim_2': 256, 'kl_weight': 0.0005780276292488764, 'lr': 0.0015034295629999426, 'batch_size': 32, 'dropout_rate': 0.4118566894822596, 'prior_mu': 0.046406749744115086, 'prior_sigma': 0.0834586082976425, 'normalization': 'none'}. Best is trial 1528 with value: 0.5170644640922546.
Generating morgan fingerprints...
Generated fingerprints with 2048 features for 900 molecules
Data shape: X=(900, 2048), y=(900,)
Trial 2110: 5-fold CV loss = 0.7763
[I 2025-08-08 04:19:32,665] Trial 2110 finished with value: 0.77631316781044 and parameters: {'fp_type': 'morgan', 'morgan_only_radius': 2, 'morgan_only_nBits': 2048, 'num_hidden_layers': 3, 'hidden_dim_0': 512, 'hidden_dim_1': 64, 'hidden_dim_2': 256, 'kl_weight': 0.000736827959080556, 'lr': 0.0012788807244111782, 'batch_size': 32, 'dropout_rate': 0.45168025173264265, 'prior_mu': 0.05414683078910222, 'prior_sigma': 0.10150438622178028, 'normalization': 'none'}. Best is trial 1528 with value: 0.5170644640922546.
Generating morgan fingerprints...
Generated fingerprints with 2048 features for 900 molecules
Data shape: X=(900, 2048), y=(900,)
Trial 2115: 5-fold CV loss = 0.5924
[I 2025-08-08 04:20:12,534] Trial 2115 finished with value: 0.5923848628997803 and parameters: {'fp_type': 'morgan', 'morgan_only_radius': 2, 'morgan_only_nBits': 2048, 'num_hidden_layers': 3, 'hidden_dim_0': 512, 'hidden_dim_1': 64, 'hidden_dim_2': 256, 'kl_weight': 0.000484176159907774, 'lr': 0.0018896586619459126, 'batch_size': 32, 'dropout_rate': 0.3918837859419541, 'prior_mu': 0.04452999558989602, 'prior_sigma': 0.07979701643411083, 'normalization': 'none'}. Best is trial 1528 with value: 0.5170644640922546.
Generating morgan fingerprints...
Generated fingerprints with 2048 features for 900 molecules
Data shape: X=(900, 2048), y=(900,)
Trial 2113: 5-fold CV loss = 0.8065
[I 2025-08-08 04:20:13,649] Trial 2113 finished with value: 0.8064965009689331 and parameters: {'fp_type': 'morgan', 'morgan_only_radius': 3, 'morgan_only_nBits': 2048, 'num_hidden_layers': 1, 'hidden_dim_0': 512, 'kl_weight': 0.0005816938088691497, 'lr': 0.0014890832722574399, 'batch_size': 32, 'dropout_rate': 0.2775960990736871, 'prior_mu': 0.04760006851405471, 'prior_sigma': 0.08034679562663141, 'normalization': 'none'}. Best is trial 1528 with value: 0.5170644640922546.
Generating morgan fingerprints...
Generated fingerprints with 2048 features for 900 molecules
Data shape: X=(900, 2048), y=(900,)
Trial 2116: 5-fold CV loss = 0.6438
[I 2025-08-08 04:20:42,906] Trial 2116 finished with value: 0.6438227474689484 and parameters: {'fp_type': 'morgan', 'morgan_only_radius': 2, 'morgan_only_nBits': 2048, 'num_hidden_layers': 3, 'hidden_dim_0': 512, 'hidden_dim_1': 64, 'hidden_dim_2': 256, 'kl_weight': 0.0007368583791210685, 'lr': 0.0018899874622842097, 'batch_size': 32, 'dropout_rate': 0.3942165674116885, 'prior_mu': 0.03838618597895864, 'prior_sigma': 0.11747058089006852, 'normalization': 'none'}. Best is trial 1528 with value: 0.5170644640922546.
Generating morgan fingerprints...
Generated fingerprints with 2048 features for 900 molecules
Data shape: X=(900, 2048), y=(900,)
Trial 2117: 5-fold CV loss = 0.5793
[I 2025-08-08 04:20:51,067] Trial 2117 finished with value: 0.5793168485164643 and parameters: {'fp_type': 'morgan', 'morgan_only_radius': 2, 'morgan_only_nBits': 2048, 'num_hidden_layers': 3, 'hidden_dim_0': 512, 'hidden_dim_1': 64, 'hidden_dim_2': 256, 'kl_weight': 0.0005091289107723686, 'lr': 0.001984167590623551, 'batch_size': 32, 'dropout_rate': 0.38978408509422324, 'prior_mu': 0.03897642142573986, 'prior_sigma': 0.0810974738595687, 'normalization': 'layer'}. Best is trial 1528 with value: 0.5170644640922546.
Generating morgan fingerprints...
Generated fingerprints with 2048 features for 900 molecules
Data shape: X=(900, 2048), y=(900,)
Trial 2118: 5-fold CV loss = 0.5421
[I 2025-08-08 04:21:17,925] Trial 2118 finished with value: 0.5421117126941681 and parameters: {'fp_type': 'morgan', 'morgan_only_radius': 2, 'morgan_only_nBits': 2048, 'num_hidden_layers': 3, 'hidden_dim_0': 512, 'hidden_dim_1': 64, 'hidden_dim_2': 256, 'kl_weight': 0.0007390288524268865, 'lr': 0.0020745658906063088, 'batch_size': 32, 'dropout_rate': 0.4365202771244588, 'prior_mu': 0.03695561889492651, 'prior_sigma': 0.0805147622391443, 'normalization': 'layer'}. Best is trial 1528 with value: 0.5170644640922546.
Generating morgan fingerprints...
Generated fingerprints with 2048 features for 900 molecules
Data shape: X=(900, 2048), y=(900,)
Trial 2120: 5-fold CV loss = 0.5383
[I 2025-08-08 04:21:56,560] Trial 2120 finished with value: 0.538298350572586 and parameters: {'fp_type': 'morgan', 'morgan_only_radius': 2, 'morgan_only_nBits': 2048, 'num_hidden_layers': 3, 'hidden_dim_0': 256, 'hidden_dim_1': 64, 'hidden_dim_2': 256, 'kl_weight': 0.0004996496592495065, 'lr': 0.0023054810936053, 'batch_size': 32, 'dropout_rate': 0.4401780097347523, 'prior_mu': 0.07459005411265676, 'prior_sigma': 0.07741700756952899, 'normalization': 'layer'}. Best is trial 1528 with value: 0.5170644640922546.
Generating morgan fingerprints...
Generated fingerprints with 2048 features for 900 molecules
Data shape: X=(900, 2048), y=(900,)
Trial 2122: 5-fold CV loss = 0.5505
[I 2025-08-08 04:22:43,066] Trial 2122 finished with value: 0.550512146949768 and parameters: {'fp_type': 'morgan', 'morgan_only_radius': 2, 'morgan_only_nBits': 2048, 'num_hidden_layers': 3, 'hidden_dim_0': 256, 'hidden_dim_1': 64, 'hidden_dim_2': 256, 'kl_weight': 0.00035097062228714053, 'lr': 0.0022817511371036373, 'batch_size': 32, 'dropout_rate': 0.42848705439213935, 'prior_mu': 0.0769511928653455, 'prior_sigma': 0.11302107687255009, 'normalization': 'none'}. Best is trial 1528 with value: 0.5170644640922546.
Generating morgan fingerprints...
Generated fingerprints with 2048 features for 900 molecules
Data shape: X=(900, 2048), y=(900,)
Trial 2121: 5-fold CV loss = 0.5819
[I 2025-08-08 04:22:46,754] Trial 2121 finished with value: 0.581899893283844 and parameters: {'fp_type': 'morgan', 'morgan_only_radius': 2, 'morgan_only_nBits': 2048, 'num_hidden_layers': 3, 'hidden_dim_0': 256, 'hidden_dim_1': 64, 'hidden_dim_2': 256, 'kl_weight': 0.0006579770982239253, 'lr': 0.0023457532667725337, 'batch_size': 32, 'dropout_rate': 0.4384591378278404, 'prior_mu': 0.07446591459975425, 'prior_sigma': 0.08164812771020845, 'normalization': 'none'}. Best is trial 1528 with value: 0.5170644640922546.
Generating morgan fingerprints...
Generated fingerprints with 2048 features for 900 molecules
Data shape: X=(900, 2048), y=(900,)
Trial 2123: 5-fold CV loss = 0.5253
[I 2025-08-08 04:23:14,200] Trial 2123 finished with value: 0.5253280401229858 and parameters: {'fp_type': 'morgan', 'morgan_only_radius': 2, 'morgan_only_nBits': 2048, 'num_hidden_layers': 3, 'hidden_dim_0': 512, 'hidden_dim_1': 64, 'hidden_dim_2': 256, 'kl_weight': 0.0003515710409260441, 'lr': 0.0024099486230832034, 'batch_size': 32, 'dropout_rate': 0.4252740699897005, 'prior_mu': 0.05782672287023006, 'prior_sigma': 0.08979389300417727, 'normalization': 'none'}. Best is trial 1528 with value: 0.5170644640922546.
Generating morgan fingerprints...
Generated fingerprints with 2048 features for 900 molecules
Data shape: X=(900, 2048), y=(900,)
Trial 2119: 5-fold CV loss = 0.5450
[I 2025-08-08 04:23:17,541] Trial 2119 finished with value: 0.5449832916259766 and parameters: {'fp_type': 'morgan', 'morgan_only_radius': 2, 'morgan_only_nBits': 2048, 'num_hidden_layers': 3, 'hidden_dim_0': 256, 'hidden_dim_1': 64, 'hidden_dim_2': 256, 'kl_weight': 0.0007426229992770272, 'lr': 0.0023481809104072705, 'batch_size': 32, 'dropout_rate': 0.19630040326992507, 'prior_mu': 0.07939574837795198, 'prior_sigma': 0.09065883391816457, 'normalization': 'layer'}. Best is trial 1528 with value: 0.5170644640922546.
Generating morgan fingerprints...
Generated fingerprints with 2048 features for 900 molecules
Data shape: X=(900, 2048), y=(900,)
Trial 2124: 5-fold CV loss = 0.6196
[I 2025-08-08 04:23:38,160] Trial 2124 finished with value: 0.6196098446846008 and parameters: {'fp_type': 'morgan', 'morgan_only_radius': 2, 'morgan_only_nBits': 2048, 'num_hidden_layers': 3, 'hidden_dim_0': 512, 'hidden_dim_1': 64, 'hidden_dim_2': 256, 'kl_weight': 0.000651639818509089, 'lr': 0.0016434296813212124, 'batch_size': 32, 'dropout_rate': 0.42164531884335277, 'prior_mu': 0.058703397970722396, 'prior_sigma': 0.07858739687054855, 'normalization': 'none'}. Best is trial 1528 with value: 0.5170644640922546.
Generating morgan fingerprints...
Generated fingerprints with 2048 features for 900 molecules
Data shape: X=(900, 2048), y=(900,)
Trial 2128: 5-fold CV loss = 0.5782
[I 2025-08-08 04:24:21,242] Trial 2128 finished with value: 0.5781792104244232 and parameters: {'fp_type': 'morgan', 'morgan_only_radius': 2, 'morgan_only_nBits': 2048, 'num_hidden_layers': 3, 'hidden_dim_0': 512, 'hidden_dim_1': 64, 'hidden_dim_2': 256, 'kl_weight': 0.00043404926750537066, 'lr': 0.0031800233424351247, 'batch_size': 64, 'dropout_rate': 0.40446629871913586, 'prior_mu': 0.05042100432563269, 'prior_sigma': 0.07898785443731107, 'normalization': 'none'}. Best is trial 1528 with value: 0.5170644640922546.
Generating morgan fingerprints...
Generated fingerprints with 2048 features for 900 molecules
Data shape: X=(900, 2048), y=(900,)
Trial 2129: 5-fold CV loss = 0.9816
[I 2025-08-08 04:24:30,259] Trial 2129 finished with value: 0.9816390872001648 and parameters: {'fp_type': 'morgan', 'morgan_only_radius': 2, 'morgan_only_nBits': 2048, 'num_hidden_layers': 3, 'hidden_dim_0': 512, 'hidden_dim_1': 64, 'hidden_dim_2': 256, 'kl_weight': 0.0005694131281304129, 'lr': 0.0020943210216365147, 'batch_size': 128, 'dropout_rate': 0.45365389733827766, 'prior_mu': 0.0667156252433439, 'prior_sigma': 0.08461720982384478, 'normalization': 'none'}. Best is trial 1528 with value: 0.5170644640922546.
Generating morgan fingerprints...
Generated fingerprints with 2048 features for 900 molecules
Data shape: X=(900, 2048), y=(900,)
Trial 2125: 5-fold CV loss = 0.5269
[I 2025-08-08 04:24:35,542] Trial 2125 finished with value: 0.5268882632255554 and parameters: {'fp_type': 'morgan', 'morgan_only_radius': 2, 'morgan_only_nBits': 2048, 'num_hidden_layers': 3, 'hidden_dim_0': 512, 'hidden_dim_1': 64, 'hidden_dim_2': 256, 'kl_weight': 0.00042644292656570667, 'lr': 0.0029616928379370155, 'batch_size': 32, 'dropout_rate': 0.42153389621269244, 'prior_mu': 0.05873002437992715, 'prior_sigma': 0.09224707082115938, 'normalization': 'none'}. Best is trial 1528 with value: 0.5170644640922546.
Generating morgan fingerprints...
Generated fingerprints with 2048 features for 900 molecules
Data shape: X=(900, 2048), y=(900,)
Trial 2126: 5-fold CV loss = 0.5251
[I 2025-08-08 04:24:58,598] Trial 2126 finished with value: 0.525089704990387 and parameters: {'fp_type': 'morgan', 'morgan_only_radius': 2, 'morgan_only_nBits': 2048, 'num_hidden_layers': 3, 'hidden_dim_0': 512, 'hidden_dim_1': 64, 'hidden_dim_2': 256, 'kl_weight': 0.0006105267352383185, 'lr': 0.0020757525257128306, 'batch_size': 32, 'dropout_rate': 0.4059214785331279, 'prior_mu': 0.0664601095304776, 'prior_sigma': 0.08509348417312079, 'normalization': 'none'}. Best is trial 1528 with value: 0.5170644640922546.
Generating rdkit fingerprints...
Generated fingerprints with 1024 features for 900 molecules
Data shape: X=(900, 1024), y=(900,)
Trial 2130: 5-fold CV loss = 0.6278
[I 2025-08-08 04:25:28,442] Trial 2130 finished with value: 0.6278048396110535 and parameters: {'fp_type': 'morgan', 'morgan_only_radius': 2, 'morgan_only_nBits': 2048, 'num_hidden_layers': 3, 'hidden_dim_0': 512, 'hidden_dim_1': 64, 'hidden_dim_2': 256, 'kl_weight': 0.0006238508884761215, 'lr': 0.0017958305288331184, 'batch_size': 32, 'dropout_rate': 0.44263623706403527, 'prior_mu': 0.04342036297590003, 'prior_sigma': 0.07707038780932729, 'normalization': 'none'}. Best is trial 1528 with value: 0.5170644640922546.
Generating rdkit fingerprints...
Generated fingerprints with 1024 features for 900 molecules
Data shape: X=(900, 1024), y=(900,)
Trial 2132: 5-fold CV loss = 0.6362
[I 2025-08-08 04:26:11,488] Trial 2132 finished with value: 0.6362314462661743 and parameters: {'fp_type': 'rdkit', 'rdkit_only_maxPath': 7, 'rdkit_only_nBits': 1024, 'num_hidden_layers': 3, 'hidden_dim_0': 512, 'hidden_dim_1': 64, 'hidden_dim_2': 256, 'kl_weight': 0.0007622696949699577, 'lr': 0.0017604129518658071, 'batch_size': 32, 'dropout_rate': 0.2132214900642947, 'prior_mu': 0.044364378742281343, 'prior_sigma': 0.07736320357370632, 'normalization': 'none'}. Best is trial 1528 with value: 0.5170644640922546.
Generating morgan fingerprints...
Generated fingerprints with 2048 features for 900 molecules
Data shape: X=(900, 2048), y=(900,)
Trial 2133: 5-fold CV loss = 0.5598
[I 2025-08-08 04:26:42,783] Trial 2133 finished with value: 0.5598241031169892 and parameters: {'fp_type': 'rdkit', 'rdkit_only_maxPath': 7, 'rdkit_only_nBits': 1024, 'num_hidden_layers': 3, 'hidden_dim_0': 1024, 'hidden_dim_1': 64, 'hidden_dim_2': 256, 'kl_weight': 0.0008025096041170731, 'lr': 0.0026091076305607415, 'batch_size': 32, 'dropout_rate': 0.4533862350801566, 'prior_mu': 0.03544834671065806, 'prior_sigma': 0.07620789107638326, 'normalization': 'none'}. Best is trial 1528 with value: 0.5170644640922546.
Generating morgan fingerprints...
Generated fingerprints with 2048 features for 900 molecules
Data shape: X=(900, 2048), y=(900,)
Trial 2127: 5-fold CV loss = 0.5413
[I 2025-08-08 04:26:44,800] Trial 2127 finished with value: 0.5412947714328766 and parameters: {'fp_type': 'morgan', 'morgan_only_radius': 2, 'morgan_only_nBits': 2048, 'num_hidden_layers': 3, 'hidden_dim_0': 512, 'hidden_dim_1': 64, 'hidden_dim_2': 256, 'kl_weight': 0.00044436040151558297, 'lr': 0.003026735142924177, 'batch_size': 32, 'dropout_rate': 0.4083167130959029, 'prior_mu': 0.1475824662814338, 'prior_sigma': 0.077766110202327, 'normalization': 'none'}. Best is trial 1528 with value: 0.5170644640922546.
Generating morgan fingerprints...
Generated fingerprints with 2048 features for 900 molecules
Data shape: X=(900, 2048), y=(900,)
Trial 2131: 5-fold CV loss = 0.5314
[I 2025-08-08 04:27:00,301] Trial 2131 finished with value: 0.5314258635044098 and parameters: {'fp_type': 'morgan', 'morgan_only_radius': 2, 'morgan_only_nBits': 2048, 'num_hidden_layers': 3, 'hidden_dim_0': 512, 'hidden_dim_1': 64, 'hidden_dim_2': 256, 'kl_weight': 0.0006311596560266827, 'lr': 0.0018061768309528682, 'batch_size': 32, 'dropout_rate': 0.4423310392116456, 'prior_mu': 0.046352334551187646, 'prior_sigma': 0.09695173372432744, 'normalization': 'none'}. Best is trial 1528 with value: 0.5170644640922546.
Generating morgan fingerprints...
Generated fingerprints with 2048 features for 900 molecules
Data shape: X=(900, 2048), y=(900,)
Trial 2134: 5-fold CV loss = 0.5363
[I 2025-08-08 04:27:17,488] Trial 2134 finished with value: 0.5362666428089142 and parameters: {'fp_type': 'morgan', 'morgan_only_radius': 2, 'morgan_only_nBits': 2048, 'num_hidden_layers': 3, 'hidden_dim_0': 1024, 'hidden_dim_1': 64, 'hidden_dim_2': 256, 'kl_weight': 0.0005246165953317359, 'lr': 0.0027458971310450864, 'batch_size': 32, 'dropout_rate': 0.44060479568610234, 'prior_mu': 0.03606524930611302, 'prior_sigma': 0.0800877656545404, 'normalization': 'none'}. Best is trial 1528 with value: 0.5170644640922546.
Generating morgan fingerprints...
Generated fingerprints with 2048 features for 900 molecules
Data shape: X=(900, 2048), y=(900,)
Trial 2135: 5-fold CV loss = 0.5288
[I 2025-08-08 04:28:16,944] Trial 2135 finished with value: 0.5287874400615692 and parameters: {'fp_type': 'morgan', 'morgan_only_radius': 2, 'morgan_only_nBits': 2048, 'num_hidden_layers': 3, 'hidden_dim_0': 512, 'hidden_dim_1': 64, 'hidden_dim_2': 256, 'kl_weight': 0.0005205873750761153, 'lr': 0.0019375186096326766, 'batch_size': 32, 'dropout_rate': 0.43963022911247623, 'prior_mu': 0.05108699312117774, 'prior_sigma': 0.09757970053291293, 'normalization': 'none'}. Best is trial 1528 with value: 0.5170644640922546.
Generating morgan fingerprints...
Generated fingerprints with 2048 features for 900 molecules
Data shape: X=(900, 2048), y=(900,)
Trial 2138: 5-fold CV loss = 0.5708
[I 2025-08-08 04:28:30,686] Trial 2138 finished with value: 0.570828890800476 and parameters: {'fp_type': 'morgan', 'morgan_only_radius': 2, 'morgan_only_nBits': 2048, 'num_hidden_layers': 3, 'hidden_dim_0': 512, 'hidden_dim_1': 64, 'hidden_dim_2': 256, 'kl_weight': 0.0007769421028837151, 'lr': 0.001963687540851763, 'batch_size': 32, 'dropout_rate': 0.42728113911799215, 'prior_mu': 0.05195711561896795, 'prior_sigma': 0.0756515747651343, 'normalization': 'none'}. Best is trial 1528 with value: 0.5170644640922546.
Generating morgan fingerprints...
Generated fingerprints with 2048 features for 900 molecules
Data shape: X=(900, 2048), y=(900,)
Trial 2139: 5-fold CV loss = 0.5431
[I 2025-08-08 04:29:40,083] Trial 2139 finished with value: 0.5431484997272491 and parameters: {'fp_type': 'morgan', 'morgan_only_radius': 2, 'morgan_only_nBits': 2048, 'num_hidden_layers': 3, 'hidden_dim_0': 512, 'hidden_dim_1': 64, 'hidden_dim_2': 256, 'kl_weight': 0.0007011752945255428, 'lr': 0.0021555239414540166, 'batch_size': 32, 'dropout_rate': 0.42760488541382596, 'prior_mu': 0.053151917033969515, 'prior_sigma': 0.07339447239542693, 'normalization': 'none'}. Best is trial 1528 with value: 0.5170644640922546.
Generating morgan fingerprints...
Generated fingerprints with 2048 features for 900 molecules
Data shape: X=(900, 2048), y=(900,)
Trial 2137: 5-fold CV loss = 0.5490
[I 2025-08-08 04:29:46,776] Trial 2137 finished with value: 0.549026620388031 and parameters: {'fp_type': 'morgan', 'morgan_only_radius': 2, 'morgan_only_nBits': 2048, 'num_hidden_layers': 3, 'hidden_dim_0': 512, 'hidden_dim_1': 64, 'hidden_dim_2': 256, 'kl_weight': 0.000533751783537047, 'lr': 0.0020096553822260754, 'batch_size': 32, 'dropout_rate': 0.43199024662678487, 'prior_mu': 0.051434631333806394, 'prior_sigma': 0.08073485389995186, 'normalization': 'none'}. Best is trial 1528 with value: 0.5170644640922546.
Generating morgan fingerprints...
Generated fingerprints with 2048 features for 900 molecules
Data shape: X=(900, 2048), y=(900,)
Trial 2140: 5-fold CV loss = 0.5234
