[I 2025-08-07 20:02:23,194] Trial 749 finished with value: 0.7001910626888275 and parameters: {'fp_type': 'morgan', 'morgan_only_radius': 2, 'morgan_only_nBits': 1024, 'num_hidden_layers': 3, 'hidden_dim_0': 512, 'hidden_dim_1': 128, 'hidden_dim_2': 512, 'kl_weight': 0.0012533515836696135, 'lr': 0.0018475966561069175, 'batch_size': 32, 'dropout_rate': 0.48971381963874905, 'prior_mu': -0.17211067327146057, 'prior_sigma': 0.07161391137528503, 'normalization': 'none'}. Best is trial 272 with value: 0.5198344707489013.
Generating morgan fingerprints...
Generated fingerprints with 2048 features for 900 molecules
Data shape: X=(900, 2048), y=(900,)
Trial 750: 5-fold CV loss = 0.5518
[I 2025-08-07 20:02:26,469] Trial 750 finished with value: 0.5518435895442962 and parameters: {'fp_type': 'rdkit', 'rdkit_only_maxPath': 6, 'rdkit_only_nBits': 1024, 'num_hidden_layers': 3, 'hidden_dim_0': 512, 'hidden_dim_1': 128, 'hidden_dim_2': 512, 'kl_weight': 0.0013825484885347373, 'lr': 0.002705187183068251, 'batch_size': 32, 'dropout_rate': 0.4910250565903414, 'prior_mu': -0.022929319585009957, 'prior_sigma': 0.05965679856349883, 'normalization': 'none'}. Best is trial 272 with value: 0.5198344707489013.
Generating morgan fingerprints...
Generated fingerprints with 2048 features for 900 molecules
Data shape: X=(900, 2048), y=(900,)
Trial 753: 5-fold CV loss = 0.7253
[I 2025-08-07 20:02:30,675] Trial 753 finished with value: 0.7253039956092835 and parameters: {'fp_type': 'morgan', 'morgan_only_radius': 2, 'morgan_only_nBits': 2048, 'num_hidden_layers': 1, 'hidden_dim_0': 512, 'kl_weight': 0.0017854560546722706, 'lr': 0.0017950330328177955, 'batch_size': 32, 'dropout_rate': 0.47346891938511027, 'prior_mu': -0.021683218711735206, 'prior_sigma': 0.05863610640068502, 'normalization': 'none'}. Best is trial 272 with value: 0.5198344707489013.
Generating morgan fingerprints...
Generated fingerprints with 2048 features for 900 molecules
Data shape: X=(900, 2048), y=(900,)
Trial 755: 5-fold CV loss = 0.7046
[I 2025-08-07 20:02:48,096] Trial 755 finished with value: 0.7046207189559937 and parameters: {'fp_type': 'morgan', 'morgan_only_radius': 2, 'morgan_only_nBits': 2048, 'num_hidden_layers': 1, 'hidden_dim_0': 512, 'kl_weight': 0.0017110013595431357, 'lr': 0.0013224500992746343, 'batch_size': 32, 'dropout_rate': 0.4740218623550956, 'prior_mu': -0.017253446471361053, 'prior_sigma': 0.06430928392199714, 'normalization': 'none'}. Best is trial 272 with value: 0.5198344707489013.
Generating morgan fingerprints...
Generated fingerprints with 2048 features for 900 molecules
Data shape: X=(900, 2048), y=(900,)
Trial 756: 5-fold CV loss = 0.5240
[I 2025-08-07 20:03:35,753] Trial 756 finished with value: 0.5240280091762543 and parameters: {'fp_type': 'morgan', 'morgan_only_radius': 2, 'morgan_only_nBits': 2048, 'num_hidden_layers': 3, 'hidden_dim_0': 512, 'hidden_dim_1': 128, 'hidden_dim_2': 512, 'kl_weight': 0.001699007187530708, 'lr': 0.002494126262807939, 'batch_size': 32, 'dropout_rate': 0.47688111480697853, 'prior_mu': -0.017675120187945183, 'prior_sigma': 0.06433588030093454, 'normalization': 'none'}. Best is trial 272 with value: 0.5198344707489013.
Generating morgan fingerprints...
Generated fingerprints with 2048 features for 900 molecules
Data shape: X=(900, 2048), y=(900,)
Trial 754: 5-fold CV loss = 0.5287
[I 2025-08-07 20:04:04,419] Trial 754 finished with value: 0.5286832749843597 and parameters: {'fp_type': 'morgan', 'morgan_only_radius': 2, 'morgan_only_nBits': 2048, 'num_hidden_layers': 3, 'hidden_dim_0': 512, 'hidden_dim_1': 128, 'hidden_dim_2': 512, 'kl_weight': 0.0019324808726805735, 'lr': 0.0026299251358841962, 'batch_size': 32, 'dropout_rate': 0.47715917085259985, 'prior_mu': -0.01842862182351601, 'prior_sigma': 0.06365775224304464, 'normalization': 'none'}. Best is trial 272 with value: 0.5198344707489013.
Generating morgan fingerprints...
Generated fingerprints with 2048 features for 900 molecules
Data shape: X=(900, 2048), y=(900,)
Trial 757: 5-fold CV loss = 0.5239
[I 2025-08-07 20:04:11,227] Trial 757 finished with value: 0.5238924860954285 and parameters: {'fp_type': 'morgan', 'morgan_only_radius': 2, 'morgan_only_nBits': 2048, 'num_hidden_layers': 3, 'hidden_dim_0': 512, 'hidden_dim_1': 128, 'hidden_dim_2': 512, 'kl_weight': 0.0013521856891897807, 'lr': 0.0024482116043757335, 'batch_size': 32, 'dropout_rate': 0.4825478783859338, 'prior_mu': -0.02724356167730698, 'prior_sigma': 0.0638678829659378, 'normalization': 'none'}. Best is trial 272 with value: 0.5198344707489013.
Generating morgan fingerprints...
Generated fingerprints with 2048 features for 900 molecules
Data shape: X=(900, 2048), y=(900,)
Trial 758: 5-fold CV loss = 0.5321
[I 2025-08-07 20:04:33,714] Trial 758 finished with value: 0.5320891559123992 and parameters: {'fp_type': 'morgan', 'morgan_only_radius': 2, 'morgan_only_nBits': 2048, 'num_hidden_layers': 3, 'hidden_dim_0': 512, 'hidden_dim_1': 128, 'hidden_dim_2': 512, 'kl_weight': 0.0019455904855770938, 'lr': 0.003146150953434569, 'batch_size': 32, 'dropout_rate': 0.4653094719658246, 'prior_mu': -0.02449094255391655, 'prior_sigma': 0.05701068288343068, 'normalization': 'none'}. Best is trial 272 with value: 0.5198344707489013.
Generating morgan fingerprints...
Generated fingerprints with 2048 features for 900 molecules
Data shape: X=(900, 2048), y=(900,)
Trial 748: 5-fold CV loss = 0.5235
[I 2025-08-07 20:05:03,515] Trial 748 finished with value: 0.5235315501689911 and parameters: {'fp_type': 'morgan', 'morgan_only_radius': 2, 'morgan_only_nBits': 1024, 'num_hidden_layers': 3, 'hidden_dim_0': 512, 'hidden_dim_1': 128, 'hidden_dim_2': 512, 'kl_weight': 0.0012579847997312768, 'lr': 0.0018455333861156764, 'batch_size': 32, 'dropout_rate': 0.49062247722492464, 'prior_mu': -0.017472796429631232, 'prior_sigma': 0.07080043439993151, 'normalization': 'none'}. Best is trial 272 with value: 0.5198344707489013.
Generating morgan fingerprints...
Generated fingerprints with 2048 features for 900 molecules
Data shape: X=(900, 2048), y=(900,)
Trial 760: 5-fold CV loss = 0.5339
[I 2025-08-07 20:05:09,287] Trial 760 finished with value: 0.5339302778244018 and parameters: {'fp_type': 'morgan', 'morgan_only_radius': 2, 'morgan_only_nBits': 2048, 'num_hidden_layers': 3, 'hidden_dim_0': 512, 'hidden_dim_1': 128, 'hidden_dim_2': 512, 'kl_weight': 0.0016691324008682089, 'lr': 0.0032679767962384676, 'batch_size': 32, 'dropout_rate': 0.4656479580448556, 'prior_mu': -0.028780139026034837, 'prior_sigma': 0.06450429280046877, 'normalization': 'none'}. Best is trial 272 with value: 0.5198344707489013.
Generating morgan fingerprints...
Generated fingerprints with 2048 features for 900 molecules
Data shape: X=(900, 2048), y=(900,)
Trial 761: 5-fold CV loss = 0.5271
[I 2025-08-07 20:05:34,543] Trial 761 finished with value: 0.527106088399887 and parameters: {'fp_type': 'morgan', 'morgan_only_radius': 2, 'morgan_only_nBits': 2048, 'num_hidden_layers': 3, 'hidden_dim_0': 512, 'hidden_dim_1': 128, 'hidden_dim_2': 512, 'kl_weight': 0.0017688250519990296, 'lr': 0.002821493958569234, 'batch_size': 32, 'dropout_rate': 0.4651743183718164, 'prior_mu': -0.02985796775624449, 'prior_sigma': 0.06570874689128149, 'normalization': 'none'}. Best is trial 272 with value: 0.5198344707489013.
Generating morgan fingerprints...
Generated fingerprints with 2048 features for 900 molecules
Data shape: X=(900, 2048), y=(900,)
Trial 759: 5-fold CV loss = 0.5339
[I 2025-08-07 20:05:39,539] Trial 759 finished with value: 0.5339129507541657 and parameters: {'fp_type': 'morgan', 'morgan_only_radius': 2, 'morgan_only_nBits': 2048, 'num_hidden_layers': 3, 'hidden_dim_0': 512, 'hidden_dim_1': 128, 'hidden_dim_2': 512, 'kl_weight': 0.002287047506839045, 'lr': 0.003071712887427227, 'batch_size': 32, 'dropout_rate': 0.47020375128942465, 'prior_mu': -0.029170610329533234, 'prior_sigma': 0.05563739591300655, 'normalization': 'none'}. Best is trial 272 with value: 0.5198344707489013.
Generating morgan fingerprints...
Generated fingerprints with 2048 features for 900 molecules
Data shape: X=(900, 2048), y=(900,)
Trial 764: 5-fold CV loss = 1.3232
[I 2025-08-07 20:06:19,030] Trial 764 finished with value: 1.3232304573059082 and parameters: {'fp_type': 'morgan', 'morgan_only_radius': 2, 'morgan_only_nBits': 2048, 'num_hidden_layers': 3, 'hidden_dim_0': 512, 'hidden_dim_1': 512, 'hidden_dim_2': 512, 'kl_weight': 0.0014996944284628448, 'lr': 0.0015197013744751155, 'batch_size': 32, 'dropout_rate': 0.44957174790404664, 'prior_mu': -0.13008320273725085, 'prior_sigma': 0.07062193214753427, 'normalization': 'none'}. Best is trial 272 with value: 0.5198344707489013.
Generating morgan fingerprints...
Generated fingerprints with 2048 features for 900 molecules
Data shape: X=(900, 2048), y=(900,)
Trial 763: 5-fold CV loss = 0.6955
[I 2025-08-07 20:06:35,466] Trial 763 finished with value: 0.6955091655254364 and parameters: {'fp_type': 'morgan', 'morgan_only_radius': 2, 'morgan_only_nBits': 2048, 'num_hidden_layers': 3, 'hidden_dim_0': 512, 'hidden_dim_1': 128, 'hidden_dim_2': 512, 'kl_weight': 0.0016730989737968778, 'lr': 0.001687016196472261, 'batch_size': 32, 'dropout_rate': 0.4652302230350427, 'prior_mu': -0.016197129905585646, 'prior_sigma': 0.06901403599623689, 'normalization': 'none'}. Best is trial 272 with value: 0.5198344707489013.
Generating morgan fingerprints...
Generated fingerprints with 2048 features for 900 molecules
Data shape: X=(900, 2048), y=(900,)
Trial 766: 5-fold CV loss = 0.7271
[I 2025-08-07 20:06:45,427] Trial 766 finished with value: 0.7270992398262024 and parameters: {'fp_type': 'morgan', 'morgan_only_radius': 2, 'morgan_only_nBits': 2048, 'num_hidden_layers': 2, 'hidden_dim_0': 512, 'hidden_dim_1': 128, 'kl_weight': 0.0015799871686580627, 'lr': 0.0016761037482451368, 'batch_size': 32, 'dropout_rate': 0.47757527096057706, 'prior_mu': -0.013675584886363855, 'prior_sigma': 0.07443473636629766, 'normalization': 'none'}. Best is trial 272 with value: 0.5198344707489013.
Generating morgan fingerprints...
Generated fingerprints with 2048 features for 900 molecules
Data shape: X=(900, 2048), y=(900,)
Trial 762: 5-fold CV loss = 1.0487
[I 2025-08-07 20:06:46,429] Trial 762 finished with value: 1.0486722350120545 and parameters: {'fp_type': 'morgan', 'morgan_only_radius': 2, 'morgan_only_nBits': 2048, 'num_hidden_layers': 3, 'hidden_dim_0': 512, 'hidden_dim_1': 128, 'hidden_dim_2': 512, 'kl_weight': 0.0016102221737695772, 'lr': 0.001101814314214626, 'batch_size': 32, 'dropout_rate': 0.4654774743146399, 'prior_mu': -0.01533875662839769, 'prior_sigma': 0.06957457241070689, 'normalization': 'none'}. Best is trial 272 with value: 0.5198344707489013.
Generating morgan fingerprints...
Generated fingerprints with 2048 features for 900 molecules
Data shape: X=(900, 2048), y=(900,)
Trial 767: 5-fold CV loss = 0.7364
[I 2025-08-07 20:07:01,349] Trial 767 finished with value: 0.7363584637641907 and parameters: {'fp_type': 'morgan', 'morgan_only_radius': 2, 'morgan_only_nBits': 2048, 'num_hidden_layers': 2, 'hidden_dim_0': 512, 'hidden_dim_1': 128, 'kl_weight': 0.001481172120761026, 'lr': 0.0018991273278868004, 'batch_size': 32, 'dropout_rate': 0.47858600781185445, 'prior_mu': -0.012091045451319421, 'prior_sigma': 0.07899866636582806, 'normalization': 'none'}. Best is trial 272 with value: 0.5198344707489013.
Generating morgan fingerprints...
Generated fingerprints with 2048 features for 900 molecules
Data shape: X=(900, 2048), y=(900,)
Trial 765: 5-fold CV loss = 0.7828
[I 2025-08-07 20:07:07,079] Trial 765 finished with value: 0.7828395366668701 and parameters: {'fp_type': 'morgan', 'morgan_only_radius': 2, 'morgan_only_nBits': 2048, 'num_hidden_layers': 3, 'hidden_dim_0': 512, 'hidden_dim_1': 128, 'hidden_dim_2': 512, 'kl_weight': 0.0016338610390377543, 'lr': 0.0015379690296112606, 'batch_size': 32, 'dropout_rate': 0.4484193034333398, 'prior_mu': -0.015433616467842595, 'prior_sigma': 0.07047187339185633, 'normalization': 'none'}. Best is trial 272 with value: 0.5198344707489013.
Generating morgan fingerprints...
Generated fingerprints with 2048 features for 900 molecules
Data shape: X=(900, 2048), y=(900,)
Trial 770: 5-fold CV loss = 0.6206
[I 2025-08-07 20:08:17,423] Trial 770 finished with value: 0.6205805361270904 and parameters: {'fp_type': 'morgan', 'morgan_only_radius': 2, 'morgan_only_nBits': 2048, 'num_hidden_layers': 3, 'hidden_dim_0': 512, 'hidden_dim_1': 256, 'hidden_dim_2': 512, 'kl_weight': 0.0018659276742448955, 'lr': 0.002115029598497017, 'batch_size': 32, 'dropout_rate': 0.4822177958380753, 'prior_mu': -0.023972019345231226, 'prior_sigma': 0.06589759939076627, 'normalization': 'none'}. Best is trial 272 with value: 0.5198344707489013.
Generating morgan fingerprints...
Generated fingerprints with 2048 features for 900 molecules
Data shape: X=(900, 2048), y=(900,)
Trial 768: 5-fold CV loss = 0.5280
[I 2025-08-07 20:08:24,069] Trial 768 finished with value: 0.5280261695384979 and parameters: {'fp_type': 'morgan', 'morgan_only_radius': 2, 'morgan_only_nBits': 2048, 'num_hidden_layers': 3, 'hidden_dim_0': 512, 'hidden_dim_1': 128, 'hidden_dim_2': 512, 'kl_weight': 0.0014773812223530497, 'lr': 0.0019188756852317, 'batch_size': 32, 'dropout_rate': 0.48182831935008114, 'prior_mu': -0.014750986650740108, 'prior_sigma': 0.07723338035318052, 'normalization': 'none'}. Best is trial 272 with value: 0.5198344707489013.
Generating morgan fingerprints...
Generated fingerprints with 2048 features for 900 molecules
Data shape: X=(900, 2048), y=(900,)
Trial 771: 5-fold CV loss = 0.5240
[I 2025-08-07 20:09:23,409] Trial 771 finished with value: 0.5239688932895661 and parameters: {'fp_type': 'morgan', 'morgan_only_radius': 2, 'morgan_only_nBits': 2048, 'num_hidden_layers': 3, 'hidden_dim_0': 512, 'hidden_dim_1': 128, 'hidden_dim_2': 512, 'kl_weight': 0.002270197716079434, 'lr': 0.0020894952293557044, 'batch_size': 32, 'dropout_rate': 0.4822760884253959, 'prior_mu': -0.026887327847278077, 'prior_sigma': 0.077126893900861, 'normalization': 'none'}. Best is trial 272 with value: 0.5198344707489013.
Generating morgan fingerprints...
Generated fingerprints with 2048 features for 900 molecules
Data shape: X=(900, 2048), y=(900,)
Trial 772: 5-fold CV loss = 0.5344
[I 2025-08-07 20:09:39,910] Trial 772 finished with value: 0.5343652963638306 and parameters: {'fp_type': 'morgan', 'morgan_only_radius': 2, 'morgan_only_nBits': 2048, 'num_hidden_layers': 3, 'hidden_dim_0': 512, 'hidden_dim_1': 128, 'hidden_dim_2': 512, 'kl_weight': 0.0023362807163705875, 'lr': 0.002202157398783079, 'batch_size': 32, 'dropout_rate': 0.45747259539829654, 'prior_mu': -0.02739580997131888, 'prior_sigma': 0.07630608835276725, 'normalization': 'none'}. Best is trial 272 with value: 0.5198344707489013.
Generating morgan fingerprints...
Generated fingerprints with 2048 features for 900 molecules
Data shape: X=(900, 2048), y=(900,)
Trial 769: 5-fold CV loss = 0.7084
[I 2025-08-07 20:09:47,472] Trial 769 finished with value: 0.7084094107151031 and parameters: {'fp_type': 'morgan', 'morgan_only_radius': 2, 'morgan_only_nBits': 2048, 'num_hidden_layers': 3, 'hidden_dim_0': 512, 'hidden_dim_1': 256, 'hidden_dim_2': 512, 'kl_weight': 0.002014072810917294, 'lr': 0.0019544964865243716, 'batch_size': 32, 'dropout_rate': 0.48034816539462444, 'prior_mu': -0.02565121268912699, 'prior_sigma': 0.07756372387861561, 'normalization': 'none'}. Best is trial 272 with value: 0.5198344707489013.
Generating morgan fingerprints...
Generated fingerprints with 2048 features for 900 molecules
Data shape: X=(900, 2048), y=(900,)
Trial 773: 5-fold CV loss = 0.5394
[I 2025-08-07 20:09:51,916] Trial 773 finished with value: 0.5394106209278107 and parameters: {'fp_type': 'morgan', 'morgan_only_radius': 2, 'morgan_only_nBits': 2048, 'num_hidden_layers': 3, 'hidden_dim_0': 256, 'hidden_dim_1': 128, 'hidden_dim_2': 512, 'kl_weight': 0.0023011532511704215, 'lr': 0.0021776068504090387, 'batch_size': 32, 'dropout_rate': 0.45730648041329525, 'prior_mu': -0.004488467890723331, 'prior_sigma': 0.06407190805765164, 'normalization': 'none'}. Best is trial 272 with value: 0.5198344707489013.
Generating morgan fingerprints...
Generated fingerprints with 2048 features for 900 molecules
Data shape: X=(900, 2048), y=(900,)
Trial 777: 5-fold CV loss = 0.5363
[I 2025-08-07 20:10:51,379] Trial 777 finished with value: 0.5363277196884155 and parameters: {'fp_type': 'morgan', 'morgan_only_radius': 2, 'morgan_only_nBits': 2048, 'num_hidden_layers': 3, 'hidden_dim_0': 512, 'hidden_dim_1': 128, 'hidden_dim_2': 512, 'kl_weight': 0.002438527645213694, 'lr': 0.0021175298844198086, 'batch_size': 32, 'dropout_rate': 0.43495166779966, 'prior_mu': -0.03318981693052032, 'prior_sigma': 0.07212618845595536, 'normalization': 'layer'}. Best is trial 272 with value: 0.5198344707489013.
Generating morgan fingerprints...
Generated fingerprints with 2048 features for 900 molecules
Data shape: X=(900, 2048), y=(900,)
Trial 775: 5-fold CV loss = 0.5266
[I 2025-08-07 20:10:54,439] Trial 775 finished with value: 0.5265668570995331 and parameters: {'fp_type': 'morgan', 'morgan_only_radius': 2, 'morgan_only_nBits': 2048, 'num_hidden_layers': 3, 'hidden_dim_0': 512, 'hidden_dim_1': 128, 'hidden_dim_2': 512, 'kl_weight': 0.0020664131037077273, 'lr': 0.00239731183075784, 'batch_size': 32, 'dropout_rate': 0.4368279576817259, 'prior_mu': -0.004978795938159301, 'prior_sigma': 0.07416746800204295, 'normalization': 'none'}. Best is trial 272 with value: 0.5198344707489013.
Generating morgan fingerprints...
Generated fingerprints with 2048 features for 900 molecules
Data shape: X=(900, 2048), y=(900,)
Trial 774: 5-fold CV loss = 0.5471
[I 2025-08-07 20:11:03,127] Trial 774 finished with value: 0.5471243500709534 and parameters: {'fp_type': 'morgan', 'morgan_only_radius': 2, 'morgan_only_nBits': 2048, 'num_hidden_layers': 3, 'hidden_dim_0': 512, 'hidden_dim_1': 128, 'hidden_dim_2': 512, 'kl_weight': 0.0021335769358789463, 'lr': 0.002250438859921812, 'batch_size': 32, 'dropout_rate': 0.43802058861096244, 'prior_mu': -0.003747380432088096, 'prior_sigma': 0.0764126741099097, 'normalization': 'layer'}. Best is trial 272 with value: 0.5198344707489013.
Generating morgan fingerprints...
Generated fingerprints with 2048 features for 900 molecules
Data shape: X=(900, 2048), y=(900,)
Trial 778: 5-fold CV loss = 0.5269
[I 2025-08-07 20:12:03,525] Trial 778 finished with value: 0.5269431948661805 and parameters: {'fp_type': 'morgan', 'morgan_only_radius': 2, 'morgan_only_nBits': 2048, 'num_hidden_layers': 3, 'hidden_dim_0': 512, 'hidden_dim_1': 128, 'hidden_dim_2': 512, 'kl_weight': 0.0021277556796617113, 'lr': 0.0023765816968054155, 'batch_size': 32, 'dropout_rate': 0.46964554104030637, 'prior_mu': -0.005123254621507806, 'prior_sigma': 0.07344908333727786, 'normalization': 'none'}. Best is trial 272 with value: 0.5198344707489013.
Generating morgan fingerprints...
Generated fingerprints with 2048 features for 900 molecules
Data shape: X=(900, 2048), y=(900,)
Trial 779: 5-fold CV loss = 0.5360
[I 2025-08-07 20:12:21,522] Trial 779 finished with value: 0.535991758108139 and parameters: {'fp_type': 'morgan', 'morgan_only_radius': 2, 'morgan_only_nBits': 2048, 'num_hidden_layers': 3, 'hidden_dim_0': 512, 'hidden_dim_1': 128, 'hidden_dim_2': 512, 'kl_weight': 0.002714725882979555, 'lr': 0.0022897140245318522, 'batch_size': 32, 'dropout_rate': 0.472899435417626, 'prior_mu': -0.03012718973467969, 'prior_sigma': 0.08074383434343246, 'normalization': 'none'}. Best is trial 272 with value: 0.5198344707489013.
Generating morgan fingerprints...
Generated fingerprints with 2048 features for 900 molecules
Data shape: X=(900, 2048), y=(900,)
Trial 776: 5-fold CV loss = 0.5389
[I 2025-08-07 20:12:50,921] Trial 776 finished with value: 0.5388968348503113 and parameters: {'fp_type': 'morgan', 'morgan_only_radius': 2, 'morgan_only_nBits': 2048, 'num_hidden_layers': 3, 'hidden_dim_0': 256, 'hidden_dim_1': 128, 'hidden_dim_2': 512, 'kl_weight': 0.002310533484269053, 'lr': 0.0023765440246740666, 'batch_size': 32, 'dropout_rate': 0.4712809994764319, 'prior_mu': -0.002871559233697375, 'prior_sigma': 0.07077755294592887, 'normalization': 'layer'}. Best is trial 272 with value: 0.5198344707489013.
Generating morgan fingerprints...
Generated fingerprints with 2048 features for 900 molecules
Data shape: X=(900, 2048), y=(900,)
Trial 780: 5-fold CV loss = 0.5305
[I 2025-08-07 20:12:59,089] Trial 780 finished with value: 0.5305120348930359 and parameters: {'fp_type': 'morgan', 'morgan_only_radius': 2, 'morgan_only_nBits': 2048, 'num_hidden_layers': 3, 'hidden_dim_0': 512, 'hidden_dim_1': 128, 'hidden_dim_2': 512, 'kl_weight': 0.002609790686710436, 'lr': 0.0024393137933472887, 'batch_size': 32, 'dropout_rate': 0.47274625542064724, 'prior_mu': -0.03138450155594108, 'prior_sigma': 0.07009990150595116, 'normalization': 'none'}. Best is trial 272 with value: 0.5198344707489013.
Generating morgan fingerprints...
Generated fingerprints with 2048 features for 900 molecules
Data shape: X=(900, 2048), y=(900,)
Trial 781: 5-fold CV loss = 0.5317
[I 2025-08-07 20:13:02,988] Trial 781 finished with value: 0.531712657213211 and parameters: {'fp_type': 'morgan', 'morgan_only_radius': 2, 'morgan_only_nBits': 2048, 'num_hidden_layers': 3, 'hidden_dim_0': 512, 'hidden_dim_1': 128, 'hidden_dim_2': 512, 'kl_weight': 0.0017940340204076713, 'lr': 0.0024502669936167522, 'batch_size': 32, 'dropout_rate': 0.4734385330546298, 'prior_mu': -0.035011252062552324, 'prior_sigma': 0.06945658674463279, 'normalization': 'none'}. Best is trial 272 with value: 0.5198344707489013.
Generating morgan fingerprints...
Generated fingerprints with 2048 features for 900 molecules
Data shape: X=(900, 2048), y=(900,)
Trial 782: 5-fold CV loss = 0.5290
