[I 2025-08-07 23:07:01,298] Trial 1258 finished with value: 0.5512751638889313 and parameters: {'fp_type': 'morgan', 'morgan_only_radius': 2, 'morgan_only_nBits': 2048, 'num_hidden_layers': 3, 'hidden_dim_0': 512, 'hidden_dim_1': 128, 'hidden_dim_2': 512, 'kl_weight': 0.0003131940690278615, 'lr': 0.001946579782226218, 'batch_size': 32, 'dropout_rate': 0.42488893198963146, 'prior_mu': 0.06370462990468297, 'prior_sigma': 0.05747085479268471, 'normalization': 'none'}. Best is trial 272 with value: 0.5198344707489013.
Generating morgan fingerprints...
Generated fingerprints with 2048 features for 900 molecules
Data shape: X=(900, 2048), y=(900,)
Trial 1253: 5-fold CV loss = 0.5478
[I 2025-08-07 23:07:33,898] Trial 1253 finished with value: 0.5478087663650513 and parameters: {'fp_type': 'morgan', 'morgan_only_radius': 2, 'morgan_only_nBits': 2048, 'num_hidden_layers': 3, 'hidden_dim_0': 512, 'hidden_dim_1': 128, 'hidden_dim_2': 512, 'kl_weight': 0.00043469312825353875, 'lr': 0.0017425716679139495, 'batch_size': 32, 'dropout_rate': 0.43215030858090475, 'prior_mu': 0.08049258380664517, 'prior_sigma': 0.04568339611799814, 'normalization': 'none'}. Best is trial 272 with value: 0.5198344707489013.
Generating morgan fingerprints...
Generated fingerprints with 2048 features for 900 molecules
Data shape: X=(900, 2048), y=(900,)
Trial 1260: 5-fold CV loss = 0.5686
[I 2025-08-07 23:07:37,902] Trial 1260 finished with value: 0.5685505390167236 and parameters: {'fp_type': 'morgan_rdkit', 'combined_morgan_radius': 2, 'combined_morgan_nBits': 512, 'combined_rdkit_maxPath': 8, 'combined_rdkit_nBits': 256, 'num_hidden_layers': 3, 'hidden_dim_0': 512, 'hidden_dim_1': 128, 'hidden_dim_2': 512, 'kl_weight': 0.0003190323281399598, 'lr': 0.0019661668212696054, 'batch_size': 32, 'dropout_rate': 0.45300495917261613, 'prior_mu': 0.05985513599901788, 'prior_sigma': 0.0577476739841366, 'normalization': 'none'}. Best is trial 272 with value: 0.5198344707489013.
Generating morgan fingerprints...
Generated fingerprints with 2048 features for 900 molecules
Data shape: X=(900, 2048), y=(900,)
Trial 1261: 5-fold CV loss = 0.5347
[I 2025-08-07 23:08:15,016] Trial 1261 finished with value: 0.5347418129444123 and parameters: {'fp_type': 'morgan', 'morgan_only_radius': 2, 'morgan_only_nBits': 2048, 'num_hidden_layers': 3, 'hidden_dim_0': 512, 'hidden_dim_1': 128, 'hidden_dim_2': 512, 'kl_weight': 0.0005012402300818779, 'lr': 0.0019976658211809358, 'batch_size': 32, 'dropout_rate': 0.4562194135741552, 'prior_mu': 0.0628403115387393, 'prior_sigma': 0.057692743263828214, 'normalization': 'none'}. Best is trial 272 with value: 0.5198344707489013.
Generating morgan fingerprints...
Generated fingerprints with 2048 features for 900 molecules
Data shape: X=(900, 2048), y=(900,)
Trial 1262: 5-fold CV loss = 0.5287
[I 2025-08-07 23:08:37,485] Trial 1262 finished with value: 0.5286576390266419 and parameters: {'fp_type': 'morgan', 'morgan_only_radius': 2, 'morgan_only_nBits': 2048, 'num_hidden_layers': 3, 'hidden_dim_0': 512, 'hidden_dim_1': 128, 'hidden_dim_2': 512, 'kl_weight': 0.00027828852015461677, 'lr': 0.0020405072108017753, 'batch_size': 32, 'dropout_rate': 0.45730306251961234, 'prior_mu': 0.07658752823567301, 'prior_sigma': 0.0593349725595845, 'normalization': 'none'}. Best is trial 272 with value: 0.5198344707489013.
Generating morgan fingerprints...
Generated fingerprints with 2048 features for 900 molecules
Data shape: X=(900, 2048), y=(900,)
Trial 1264: 5-fold CV loss = 0.5614
[I 2025-08-07 23:09:08,933] Trial 1264 finished with value: 0.561441445350647 and parameters: {'fp_type': 'morgan', 'morgan_only_radius': 2, 'morgan_only_nBits': 2048, 'num_hidden_layers': 3, 'hidden_dim_0': 512, 'hidden_dim_1': 128, 'hidden_dim_2': 1024, 'kl_weight': 0.0002795328025770046, 'lr': 0.0021794210632751793, 'batch_size': 32, 'dropout_rate': 0.45883831338422104, 'prior_mu': 0.07702004505563255, 'prior_sigma': 0.05974404439473629, 'normalization': 'layer'}. Best is trial 272 with value: 0.5198344707489013.
Generating morgan fingerprints...
Generated fingerprints with 2048 features for 900 molecules
Data shape: X=(900, 2048), y=(900,)
Trial 1266: 5-fold CV loss = 0.5654
[I 2025-08-07 23:09:10,446] Trial 1266 finished with value: 0.5654283106327057 and parameters: {'fp_type': 'morgan', 'morgan_only_radius': 2, 'morgan_only_nBits': 2048, 'num_hidden_layers': 3, 'hidden_dim_0': 512, 'hidden_dim_1': 128, 'hidden_dim_2': 1024, 'kl_weight': 0.00023052417694335278, 'lr': 0.0022410715828505025, 'batch_size': 128, 'dropout_rate': 0.4397059719720137, 'prior_mu': 0.060936786005474086, 'prior_sigma': 0.05029502397154178, 'normalization': 'layer'}. Best is trial 272 with value: 0.5198344707489013.
Generating morgan fingerprints...
Generated fingerprints with 2048 features for 900 molecules
Data shape: X=(900, 2048), y=(900,)
Trial 1267: 5-fold CV loss = 0.7030
[I 2025-08-07 23:09:24,271] Trial 1267 finished with value: 0.7029525756835937 and parameters: {'fp_type': 'morgan', 'morgan_only_radius': 2, 'morgan_only_nBits': 2048, 'num_hidden_layers': 3, 'hidden_dim_0': 512, 'hidden_dim_1': 128, 'hidden_dim_2': 512, 'kl_weight': 0.00024556083036298066, 'lr': 0.002247345022298705, 'batch_size': 128, 'dropout_rate': 0.44098147394476955, 'prior_mu': 0.06950949739561595, 'prior_sigma': 0.06330228061705599, 'normalization': 'none'}. Best is trial 272 with value: 0.5198344707489013.
Generating morgan fingerprints...
Generated fingerprints with 2048 features for 900 molecules
Data shape: X=(900, 2048), y=(900,)
Trial 1265: 5-fold CV loss = 0.5425
[I 2025-08-07 23:09:27,616] Trial 1265 finished with value: 0.5424598395824433 and parameters: {'fp_type': 'morgan', 'morgan_only_radius': 2, 'morgan_only_nBits': 2048, 'num_hidden_layers': 3, 'hidden_dim_0': 512, 'hidden_dim_1': 128, 'hidden_dim_2': 1024, 'kl_weight': 0.00025366830785125867, 'lr': 0.002180803657376563, 'batch_size': 32, 'dropout_rate': 0.43595464438498827, 'prior_mu': 0.015797791947165876, 'prior_sigma': 0.06214063289714604, 'normalization': 'layer'}. Best is trial 272 with value: 0.5198344707489013.
Generating morgan fingerprints...
Generated fingerprints with 2048 features for 900 molecules
Data shape: X=(900, 2048), y=(900,)
Trial 1268: 5-fold CV loss = 0.7139
[I 2025-08-07 23:10:14,758] Trial 1268 finished with value: 0.7138529002666474 and parameters: {'fp_type': 'morgan', 'morgan_only_radius': 2, 'morgan_only_nBits': 2048, 'num_hidden_layers': 3, 'hidden_dim_0': 512, 'hidden_dim_1': 128, 'hidden_dim_2': 512, 'kl_weight': 0.005724976373394785, 'lr': 0.0014732668423332277, 'batch_size': 32, 'dropout_rate': 0.4653048481763377, 'prior_mu': 0.015222424296653225, 'prior_sigma': 0.06346269102013351, 'normalization': 'none'}. Best is trial 272 with value: 0.5198344707489013.
Generating morgan fingerprints...
Generated fingerprints with 2048 features for 900 molecules
Data shape: X=(900, 2048), y=(900,)
Trial 1270: 5-fold CV loss = 0.5231
[I 2025-08-07 23:10:50,690] Trial 1270 finished with value: 0.5230559825897216 and parameters: {'fp_type': 'morgan', 'morgan_only_radius': 2, 'morgan_only_nBits': 2048, 'num_hidden_layers': 3, 'hidden_dim_0': 512, 'hidden_dim_1': 128, 'hidden_dim_2': 512, 'kl_weight': 0.001370105218213949, 'lr': 0.001921946594818955, 'batch_size': 32, 'dropout_rate': 0.4692326261084408, 'prior_mu': 0.055338198650425906, 'prior_sigma': 0.06859976668904699, 'normalization': 'none'}. Best is trial 272 with value: 0.5198344707489013.
Generating morgan fingerprints...
Generated fingerprints with 2048 features for 900 molecules
Data shape: X=(900, 2048), y=(900,)
Trial 1263: 5-fold CV loss = 0.5242
[I 2025-08-07 23:11:01,075] Trial 1263 finished with value: 0.5242323458194733 and parameters: {'fp_type': 'morgan', 'morgan_only_radius': 2, 'morgan_only_nBits': 2048, 'num_hidden_layers': 3, 'hidden_dim_0': 512, 'hidden_dim_1': 128, 'hidden_dim_2': 1024, 'kl_weight': 0.00021069543959015968, 'lr': 0.002061177064183684, 'batch_size': 32, 'dropout_rate': 0.4556818888579297, 'prior_mu': 0.06188222422800875, 'prior_sigma': 0.059478682315531634, 'normalization': 'none'}. Best is trial 272 with value: 0.5198344707489013.
Generating morgan fingerprints...
Generated fingerprints with 2048 features for 900 molecules
Data shape: X=(900, 2048), y=(900,)
Trial 1271: 5-fold CV loss = 0.5661
[I 2025-08-07 23:11:43,885] Trial 1271 finished with value: 0.5661178827285767 and parameters: {'fp_type': 'morgan', 'morgan_only_radius': 2, 'morgan_only_nBits': 2048, 'num_hidden_layers': 3, 'hidden_dim_0': 512, 'hidden_dim_1': 128, 'hidden_dim_2': 512, 'kl_weight': 0.0012466233157267445, 'lr': 0.0019382552826399172, 'batch_size': 32, 'dropout_rate': 0.4632419900941843, 'prior_mu': -0.004789615516881924, 'prior_sigma': 0.06915681801514899, 'normalization': 'none'}. Best is trial 272 with value: 0.5198344707489013.
Generating morgan fingerprints...
Generated fingerprints with 2048 features for 900 molecules
Data shape: X=(900, 2048), y=(900,)
Trial 1272: 5-fold CV loss = 0.6056
[I 2025-08-07 23:11:59,691] Trial 1272 finished with value: 0.6055536568164825 and parameters: {'fp_type': 'morgan', 'morgan_only_radius': 2, 'morgan_only_nBits': 2048, 'num_hidden_layers': 3, 'hidden_dim_0': 512, 'hidden_dim_1': 128, 'hidden_dim_2': 512, 'kl_weight': 0.0011892607426514216, 'lr': 0.0016173411499850441, 'batch_size': 32, 'dropout_rate': 0.4706254916106486, 'prior_mu': 0.0869859572248995, 'prior_sigma': 0.06605408528230126, 'normalization': 'none'}. Best is trial 272 with value: 0.5198344707489013.
Generating morgan fingerprints...
Generated fingerprints with 2048 features for 900 molecules
Data shape: X=(900, 2048), y=(900,)
Trial 1269: 5-fold CV loss = 0.5314
[I 2025-08-07 23:12:09,054] Trial 1269 finished with value: 0.5313603162765503 and parameters: {'fp_type': 'morgan', 'morgan_only_radius': 2, 'morgan_only_nBits': 2048, 'num_hidden_layers': 3, 'hidden_dim_0': 512, 'hidden_dim_1': 128, 'hidden_dim_2': 512, 'kl_weight': 0.005853865426027665, 'lr': 0.0020752790020483777, 'batch_size': 32, 'dropout_rate': 0.46788010514682343, 'prior_mu': -0.003926636001660034, 'prior_sigma': 0.06491422828215795, 'normalization': 'none'}. Best is trial 272 with value: 0.5198344707489013.
Generating morgan fingerprints...
Generated fingerprints with 2048 features for 900 molecules
Data shape: X=(900, 2048), y=(900,)
Trial 1275: 5-fold CV loss = 0.6139
[I 2025-08-07 23:13:00,421] Trial 1275 finished with value: 0.6139340400695801 and parameters: {'fp_type': 'morgan', 'morgan_only_radius': 2, 'morgan_only_nBits': 2048, 'num_hidden_layers': 3, 'hidden_dim_0': 256, 'hidden_dim_1': 128, 'hidden_dim_2': 512, 'kl_weight': 0.0013778408294652727, 'lr': 0.0017129064532022625, 'batch_size': 32, 'dropout_rate': 0.47384664339880134, 'prior_mu': 0.05245015931538382, 'prior_sigma': 0.06449775779123168, 'normalization': 'none'}. Best is trial 272 with value: 0.5198344707489013.
Generating morgan fingerprints...
Generated fingerprints with 2048 features for 900 molecules
Data shape: X=(900, 2048), y=(900,)
Trial 1274: 5-fold CV loss = 0.5824
[I 2025-08-07 23:13:08,922] Trial 1274 finished with value: 0.5823987066745758 and parameters: {'fp_type': 'morgan', 'morgan_only_radius': 2, 'morgan_only_nBits': 2048, 'num_hidden_layers': 3, 'hidden_dim_0': 256, 'hidden_dim_1': 128, 'hidden_dim_2': 512, 'kl_weight': 0.0001574604842143647, 'lr': 0.0016308263234290044, 'batch_size': 32, 'dropout_rate': 0.47170926318950934, 'prior_mu': 0.049829679520534985, 'prior_sigma': 0.06575794433162652, 'normalization': 'none'}. Best is trial 272 with value: 0.5198344707489013.
Generating morgan fingerprints...
Generated fingerprints with 2048 features for 900 molecules
Data shape: X=(900, 2048), y=(900,)
Trial 1276: 5-fold CV loss = 1.2139
[I 2025-08-07 23:13:24,100] Trial 1276 finished with value: 1.213890504837036 and parameters: {'fp_type': 'morgan', 'morgan_only_radius': 2, 'morgan_only_nBits': 2048, 'num_hidden_layers': 3, 'hidden_dim_0': 512, 'hidden_dim_1': 1024, 'hidden_dim_2': 512, 'kl_weight': 0.0011544742170646715, 'lr': 0.0016908061303725127, 'batch_size': 32, 'dropout_rate': 0.47734551071938364, 'prior_mu': 0.0719033549765045, 'prior_sigma': 0.06742617856810972, 'normalization': 'none'}. Best is trial 272 with value: 0.5198344707489013.
Generating morgan fingerprints...
Generated fingerprints with 2048 features for 900 molecules
Data shape: X=(900, 2048), y=(900,)
Trial 1277: 5-fold CV loss = 1.0761
[I 2025-08-07 23:13:26,284] Trial 1277 finished with value: 1.0760984897613526 and parameters: {'fp_type': 'morgan', 'morgan_only_radius': 2, 'morgan_only_nBits': 2048, 'num_hidden_layers': 3, 'hidden_dim_0': 512, 'hidden_dim_1': 1024, 'hidden_dim_2': 512, 'kl_weight': 0.0001551255483951538, 'lr': 0.0015194096268716067, 'batch_size': 32, 'dropout_rate': 0.47984683245524057, 'prior_mu': 0.05966714320694094, 'prior_sigma': 0.06913975604370745, 'normalization': 'none'}. Best is trial 272 with value: 0.5198344707489013.
Generating morgan fingerprints...
Generated fingerprints with 2048 features for 900 molecules
Data shape: X=(900, 2048), y=(900,)
Trial 1278: 5-fold CV loss = 1.4859
[I 2025-08-07 23:13:39,708] Trial 1278 finished with value: 1.4858835339546204 and parameters: {'fp_type': 'morgan', 'morgan_only_radius': 3, 'morgan_only_nBits': 2048, 'num_hidden_layers': 3, 'hidden_dim_0': 512, 'hidden_dim_1': 1024, 'hidden_dim_2': 512, 'kl_weight': 0.0011906875698066857, 'lr': 0.001821706659830734, 'batch_size': 32, 'dropout_rate': 0.4825571564116595, 'prior_mu': 0.06939489040517861, 'prior_sigma': 0.06819907104944735, 'normalization': 'none'}. Best is trial 272 with value: 0.5198344707489013.
Generating morgan fingerprints...
Generated fingerprints with 2048 features for 900 molecules
Data shape: X=(900, 2048), y=(900,)
Trial 1273: 5-fold CV loss = 0.7412
[I 2025-08-07 23:14:56,692] Trial 1273 finished with value: 0.7411998867988586 and parameters: {'fp_type': 'morgan', 'morgan_only_radius': 2, 'morgan_only_nBits': 2048, 'num_hidden_layers': 3, 'hidden_dim_0': 512, 'hidden_dim_1': 128, 'hidden_dim_2': 512, 'kl_weight': 0.001187074073711449, 'lr': 0.0016210898287750816, 'batch_size': 32, 'dropout_rate': 0.4724737874734042, 'prior_mu': 0.05958201788862793, 'prior_sigma': 0.06755306551530364, 'normalization': 'none'}. Best is trial 272 with value: 0.5198344707489013.
Generating morgan fingerprints...
Generated fingerprints with 2048 features for 900 molecules
Data shape: X=(900, 2048), y=(900,)
Trial 1280: 5-fold CV loss = 0.5253
[I 2025-08-07 23:15:04,964] Trial 1280 finished with value: 0.5253347396850586 and parameters: {'fp_type': 'morgan', 'morgan_only_radius': 2, 'morgan_only_nBits': 2048, 'num_hidden_layers': 3, 'hidden_dim_0': 512, 'hidden_dim_1': 128, 'hidden_dim_2': 512, 'kl_weight': 0.0014535328410557173, 'lr': 0.0017979517220579944, 'batch_size': 32, 'dropout_rate': 0.4832347451835346, 'prior_mu': 0.06486865985885322, 'prior_sigma': 0.06115700914236681, 'normalization': 'none'}. Best is trial 272 with value: 0.5198344707489013.
Generating morgan fingerprints...
Generated fingerprints with 2048 features for 900 molecules
Data shape: X=(900, 2048), y=(900,)
Trial 1283: 5-fold CV loss = 0.7376
[I 2025-08-07 23:15:20,897] Trial 1283 finished with value: 0.7375551700592041 and parameters: {'fp_type': 'morgan', 'morgan_only_radius': 2, 'morgan_only_nBits': 2048, 'num_hidden_layers': 1, 'hidden_dim_0': 512, 'kl_weight': 0.00029588551012684416, 'lr': 0.0018579713852301622, 'batch_size': 32, 'dropout_rate': 0.4996167454889841, 'prior_mu': 0.051164191053453836, 'prior_sigma': 0.06171508637658165, 'normalization': 'none'}. Best is trial 272 with value: 0.5198344707489013.
Generating morgan fingerprints...
Generated fingerprints with 2048 features for 900 molecules
Data shape: X=(900, 2048), y=(900,)
Trial 1281: 5-fold CV loss = 0.5185
[I 2025-08-07 23:15:46,608] Trial 1281 finished with value: 0.5184582889080047 and parameters: {'fp_type': 'morgan', 'morgan_only_radius': 2, 'morgan_only_nBits': 2048, 'num_hidden_layers': 3, 'hidden_dim_0': 512, 'hidden_dim_1': 128, 'hidden_dim_2': 512, 'kl_weight': 0.00019216818648849993, 'lr': 0.0018138302678182032, 'batch_size': 32, 'dropout_rate': 0.4856202240349632, 'prior_mu': 0.05315083323710485, 'prior_sigma': 0.06216962419750861, 'normalization': 'none'}. Best is trial 1281 with value: 0.5184582889080047.
Generating morgan fingerprints...
Generated fingerprints with 2048 features for 900 molecules
Data shape: X=(900, 2048), y=(900,)
Trial 1279: 5-fold CV loss = 0.5296
[I 2025-08-07 23:15:53,820] Trial 1279 finished with value: 0.5296254098415375 and parameters: {'fp_type': 'morgan', 'morgan_only_radius': 3, 'morgan_only_nBits': 2048, 'num_hidden_layers': 3, 'hidden_dim_0': 512, 'hidden_dim_1': 128, 'hidden_dim_2': 512, 'kl_weight': 0.0014476835419094203, 'lr': 0.0018856020962820762, 'batch_size': 32, 'dropout_rate': 0.4835379061360604, 'prior_mu': 0.062184409142735486, 'prior_sigma': 0.061027271737846715, 'normalization': 'none'}. Best is trial 1281 with value: 0.5184582889080047.
Generating morgan fingerprints...
Generated fingerprints with 2048 features for 900 molecules
Data shape: X=(900, 2048), y=(900,)
Trial 1284: 5-fold CV loss = 0.5501
[I 2025-08-07 23:16:45,955] Trial 1284 finished with value: 0.5501307010650635 and parameters: {'fp_type': 'morgan', 'morgan_only_radius': 2, 'morgan_only_nBits': 2048, 'num_hidden_layers': 3, 'hidden_dim_0': 512, 'hidden_dim_1': 128, 'hidden_dim_2': 512, 'kl_weight': 0.00018794590783138547, 'lr': 0.001932720081278464, 'batch_size': 32, 'dropout_rate': 0.48574968655173867, 'prior_mu': 0.04518731463998378, 'prior_sigma': 0.05098142090722063, 'normalization': 'none'}. Best is trial 1281 with value: 0.5184582889080047.
Generating morgan fingerprints...
Generated fingerprints with 2048 features for 900 molecules
Data shape: X=(900, 2048), y=(900,)
Trial 1285: 5-fold CV loss = 0.5806
[I 2025-08-07 23:16:58,941] Trial 1285 finished with value: 0.5805670380592346 and parameters: {'fp_type': 'morgan', 'morgan_only_radius': 2, 'morgan_only_nBits': 2048, 'num_hidden_layers': 3, 'hidden_dim_0': 512, 'hidden_dim_1': 128, 'hidden_dim_2': 64, 'kl_weight': 0.0001960850490892277, 'lr': 0.0014924535217671676, 'batch_size': 32, 'dropout_rate': 0.49999725616583707, 'prior_mu': 0.05515377730405071, 'prior_sigma': 0.05179525529658659, 'normalization': 'none'}. Best is trial 1281 with value: 0.5184582889080047.
Generating morgan fingerprints...
Generated fingerprints with 2048 features for 900 molecules
Data shape: X=(900, 2048), y=(900,)
Trial 1287: 5-fold CV loss = 0.6208
[I 2025-08-07 23:17:23,730] Trial 1287 finished with value: 0.6207925796508789 and parameters: {'fp_type': 'morgan', 'morgan_only_radius': 2, 'morgan_only_nBits': 2048, 'num_hidden_layers': 3, 'hidden_dim_0': 512, 'hidden_dim_1': 128, 'hidden_dim_2': 64, 'kl_weight': 0.0001856594533187835, 'lr': 0.0014346501028598409, 'batch_size': 32, 'dropout_rate': 0.4914331532323231, 'prior_mu': 0.05574435681895213, 'prior_sigma': 0.05375216534643712, 'normalization': 'none'}. Best is trial 1281 with value: 0.5184582889080047.
Generating morgan fingerprints...
Generated fingerprints with 2048 features for 900 molecules
Data shape: X=(900, 2048), y=(900,)
Trial 1288: 5-fold CV loss = 0.6368
[I 2025-08-07 23:18:08,623] Trial 1288 finished with value: 0.6367594480514527 and parameters: {'fp_type': 'morgan', 'morgan_only_radius': 2, 'morgan_only_nBits': 2048, 'num_hidden_layers': 3, 'hidden_dim_0': 512, 'hidden_dim_1': 128, 'hidden_dim_2': 512, 'kl_weight': 0.00018854013478731595, 'lr': 0.0015555743236405802, 'batch_size': 32, 'dropout_rate': 0.16437933124580595, 'prior_mu': 0.07425132760031984, 'prior_sigma': 0.05574730296873466, 'normalization': 'none'}. Best is trial 1281 with value: 0.5184582889080047.
Generating morgan fingerprints...
Generated fingerprints with 2048 features for 900 molecules
Data shape: X=(900, 2048), y=(900,)
Trial 1286: 5-fold CV loss = 0.5985
[I 2025-08-07 23:18:21,429] Trial 1286 finished with value: 0.5984800696372986 and parameters: {'fp_type': 'morgan', 'morgan_only_radius': 2, 'morgan_only_nBits': 2048, 'num_hidden_layers': 3, 'hidden_dim_0': 512, 'hidden_dim_1': 128, 'hidden_dim_2': 512, 'kl_weight': 0.00018056957537765687, 'lr': 0.0016206468869729906, 'batch_size': 32, 'dropout_rate': 0.4914313516914877, 'prior_mu': 0.04972740107475803, 'prior_sigma': 0.05522049586477529, 'normalization': 'none'}. Best is trial 1281 with value: 0.5184582889080047.
Generating morgan fingerprints...
Generated fingerprints with 1024 features for 900 molecules
Data shape: X=(900, 1024), y=(900,)
Trial 1282: 5-fold CV loss = 0.5660
[I 2025-08-07 23:18:25,552] Trial 1282 finished with value: 0.5659964442253113 and parameters: {'fp_type': 'morgan', 'morgan_only_radius': 2, 'morgan_only_nBits': 2048, 'num_hidden_layers': 3, 'hidden_dim_0': 512, 'hidden_dim_1': 128, 'hidden_dim_2': 512, 'kl_weight': 0.0002976064062877061, 'lr': 0.0018351481054103458, 'batch_size': 32, 'dropout_rate': 0.4858503423998712, 'prior_mu': 0.05464589944211383, 'prior_sigma': 0.060864032609491, 'normalization': 'none'}. Best is trial 1281 with value: 0.5184582889080047.
Generating morgan fingerprints...
Generated fingerprints with 1024 features for 900 molecules
Data shape: X=(900, 1024), y=(900,)
Trial 1289: 5-fold CV loss = 0.5764
