[I 2025-08-07 23:52:04,346] Trial 1384 finished with value: 0.5231375157833099 and parameters: {'fp_type': 'morgan', 'morgan_only_radius': 2, 'morgan_only_nBits': 2048, 'num_hidden_layers': 3, 'hidden_dim_0': 512, 'hidden_dim_1': 128, 'hidden_dim_2': 512, 'kl_weight': 0.0006577447849375513, 'lr': 0.0019788327040255933, 'batch_size': 32, 'dropout_rate': 0.4553683560667466, 'prior_mu': 0.03671340259764534, 'prior_sigma': 0.06662773680001924, 'normalization': 'none'}. Best is trial 1281 with value: 0.5184582889080047.
Generating morgan fingerprints...
Generated fingerprints with 2048 features for 900 molecules
Data shape: X=(900, 2048), y=(900,)
Trial 1385: 5-fold CV loss = 0.5210
[I 2025-08-07 23:52:37,595] Trial 1385 finished with value: 0.5209993541240692 and parameters: {'fp_type': 'morgan', 'morgan_only_radius': 2, 'morgan_only_nBits': 2048, 'num_hidden_layers': 3, 'hidden_dim_0': 512, 'hidden_dim_1': 128, 'hidden_dim_2': 512, 'kl_weight': 0.0008152101708882276, 'lr': 0.00197902868047609, 'batch_size': 32, 'dropout_rate': 0.4530665856542191, 'prior_mu': 0.03743476589341668, 'prior_sigma': 0.06692915724547997, 'normalization': 'none'}. Best is trial 1281 with value: 0.5184582889080047.
Generating morgan fingerprints...
Generated fingerprints with 2048 features for 900 molecules
Data shape: X=(900, 2048), y=(900,)
Trial 1381: 5-fold CV loss = 0.5220
[I 2025-08-07 23:53:16,604] Trial 1381 finished with value: 0.5220301747322083 and parameters: {'fp_type': 'morgan', 'morgan_only_radius': 2, 'morgan_only_nBits': 2048, 'num_hidden_layers': 3, 'hidden_dim_0': 512, 'hidden_dim_1': 128, 'hidden_dim_2': 512, 'kl_weight': 0.0009296879165514276, 'lr': 0.0020413241851053162, 'batch_size': 32, 'dropout_rate': 0.4828686553081178, 'prior_mu': 0.06217110022071246, 'prior_sigma': 0.06386921762852758, 'normalization': 'none'}. Best is trial 1281 with value: 0.5184582889080047.
Generating morgan fingerprints...
Generated fingerprints with 2048 features for 900 molecules
Data shape: X=(900, 2048), y=(900,)
Trial 1387: 5-fold CV loss = 0.6007
[I 2025-08-07 23:53:22,988] Trial 1387 finished with value: 0.6007105827331543 and parameters: {'fp_type': 'morgan', 'morgan_only_radius': 2, 'morgan_only_nBits': 2048, 'num_hidden_layers': 3, 'hidden_dim_0': 512, 'hidden_dim_1': 128, 'hidden_dim_2': 512, 'kl_weight': 0.0005810856285182244, 'lr': 0.0017588700515357586, 'batch_size': 32, 'dropout_rate': 0.43200706625440494, 'prior_mu': 0.04109109351089425, 'prior_sigma': 0.0667351657525748, 'normalization': 'none'}. Best is trial 1281 with value: 0.5184582889080047.
Generating morgan fingerprints...
Generated fingerprints with 2048 features for 900 molecules
Data shape: X=(900, 2048), y=(900,)
Trial 1388: 5-fold CV loss = 0.5741
[I 2025-08-07 23:53:31,964] Trial 1388 finished with value: 0.5741284370422364 and parameters: {'fp_type': 'morgan', 'morgan_only_radius': 2, 'morgan_only_nBits': 2048, 'num_hidden_layers': 3, 'hidden_dim_0': 512, 'hidden_dim_1': 128, 'hidden_dim_2': 512, 'kl_weight': 0.0006551150011083072, 'lr': 0.0015857799754392982, 'batch_size': 32, 'dropout_rate': 0.43207246998232307, 'prior_mu': 0.039608399493375294, 'prior_sigma': 0.018566006342610464, 'normalization': 'none'}. Best is trial 1281 with value: 0.5184582889080047.
Generating morgan fingerprints...
Generated fingerprints with 2048 features for 900 molecules
Data shape: X=(900, 2048), y=(900,)
Trial 1386: 5-fold CV loss = 0.5234
[I 2025-08-07 23:54:11,668] Trial 1386 finished with value: 0.5233571708202363 and parameters: {'fp_type': 'morgan', 'morgan_only_radius': 2, 'morgan_only_nBits': 2048, 'num_hidden_layers': 3, 'hidden_dim_0': 512, 'hidden_dim_1': 128, 'hidden_dim_2': 512, 'kl_weight': 0.0006029540541053523, 'lr': 0.0020267928648198532, 'batch_size': 32, 'dropout_rate': 0.45546918088150257, 'prior_mu': 0.025826009379323667, 'prior_sigma': 0.06665735961140712, 'normalization': 'none'}. Best is trial 1281 with value: 0.5184582889080047.
Generating morgan fingerprints...
Generated fingerprints with 2048 features for 900 molecules
Data shape: X=(900, 2048), y=(900,)
Trial 1391: 5-fold CV loss = 0.6133
[I 2025-08-07 23:54:55,135] Trial 1391 finished with value: 0.6132985472679138 and parameters: {'fp_type': 'morgan', 'morgan_only_radius': 2, 'morgan_only_nBits': 2048, 'num_hidden_layers': 3, 'hidden_dim_0': 512, 'hidden_dim_1': 128, 'hidden_dim_2': 512, 'kl_weight': 0.000684122377138049, 'lr': 0.0017725627506049292, 'batch_size': 32, 'dropout_rate': 0.4394622017499054, 'prior_mu': 0.03482464861359779, 'prior_sigma': 0.06814809525429288, 'normalization': 'none'}. Best is trial 1281 with value: 0.5184582889080047.
Generating morgan fingerprints...
Generated fingerprints with 2048 features for 900 molecules
Data shape: X=(900, 2048), y=(900,)
Trial 1390: 5-fold CV loss = 0.6097
[I 2025-08-07 23:55:19,287] Trial 1390 finished with value: 0.609655213356018 and parameters: {'fp_type': 'morgan', 'morgan_only_radius': 2, 'morgan_only_nBits': 2048, 'num_hidden_layers': 3, 'hidden_dim_0': 512, 'hidden_dim_1': 128, 'hidden_dim_2': 512, 'kl_weight': 0.0006892124588383487, 'lr': 0.0016026693846862105, 'batch_size': 32, 'dropout_rate': 0.4435882345103532, 'prior_mu': 0.03189152092717456, 'prior_sigma': 0.06857318286870234, 'normalization': 'none'}. Best is trial 1281 with value: 0.5184582889080047.
Generating morgan fingerprints...
Generated fingerprints with 2048 features for 900 molecules
Data shape: X=(900, 2048), y=(900,)
Trial 1393: 5-fold CV loss = 0.5259
[I 2025-08-07 23:56:15,424] Trial 1393 finished with value: 0.5258798420429229 and parameters: {'fp_type': 'morgan', 'morgan_only_radius': 2, 'morgan_only_nBits': 2048, 'num_hidden_layers': 3, 'hidden_dim_0': 512, 'hidden_dim_1': 128, 'hidden_dim_2': 512, 'kl_weight': 0.000781153525060524, 'lr': 0.0018751591599020512, 'batch_size': 32, 'dropout_rate': 0.4329251896268101, 'prior_mu': 0.037697717265677895, 'prior_sigma': 0.07019625823476411, 'normalization': 'none'}. Best is trial 1281 with value: 0.5184582889080047.
Generating morgan fingerprints...
Generated fingerprints with 2048 features for 900 molecules
Data shape: X=(900, 2048), y=(900,)
Trial 1392: 5-fold CV loss = 0.6156
[I 2025-08-07 23:56:37,780] Trial 1392 finished with value: 0.6155640482902527 and parameters: {'fp_type': 'morgan', 'morgan_only_radius': 2, 'morgan_only_nBits': 2048, 'num_hidden_layers': 3, 'hidden_dim_0': 512, 'hidden_dim_1': 128, 'hidden_dim_2': 512, 'kl_weight': 0.0006848218799708395, 'lr': 0.0017641520592643594, 'batch_size': 32, 'dropout_rate': 0.4126470915300372, 'prior_mu': 0.02931016990193739, 'prior_sigma': 0.0693024849613849, 'normalization': 'none'}. Best is trial 1281 with value: 0.5184582889080047.
Generating morgan fingerprints...
Generated fingerprints with 2048 features for 900 molecules
Data shape: X=(900, 2048), y=(900,)
Trial 1394: 5-fold CV loss = 0.5513
[I 2025-08-07 23:56:49,282] Trial 1394 finished with value: 0.5512912690639495 and parameters: {'fp_type': 'morgan', 'morgan_only_radius': 2, 'morgan_only_nBits': 2048, 'num_hidden_layers': 3, 'hidden_dim_0': 512, 'hidden_dim_1': 128, 'hidden_dim_2': 512, 'kl_weight': 0.0007380751003926539, 'lr': 0.001805694244927785, 'batch_size': 32, 'dropout_rate': 0.41782213436850674, 'prior_mu': 0.03053781179156548, 'prior_sigma': 0.07169446581739432, 'normalization': 'none'}. Best is trial 1281 with value: 0.5184582889080047.
Generating morgan fingerprints...
Generated fingerprints with 2048 features for 900 molecules
Data shape: X=(900, 2048), y=(900,)
Trial 1397: 5-fold CV loss = 0.6032
[I 2025-08-07 23:57:13,135] Trial 1397 finished with value: 0.6031537532806397 and parameters: {'fp_type': 'morgan', 'morgan_only_radius': 2, 'morgan_only_nBits': 2048, 'num_hidden_layers': 3, 'hidden_dim_0': 512, 'hidden_dim_1': 128, 'hidden_dim_2': 512, 'kl_weight': 0.0007904652850690178, 'lr': 0.0019233728008135856, 'batch_size': 128, 'dropout_rate': 0.44783580058941197, 'prior_mu': 0.03981132208310209, 'prior_sigma': 0.06721427563459385, 'normalization': 'layer'}. Best is trial 1281 with value: 0.5184582889080047.
Generating morgan fingerprints...
Generated fingerprints with 2048 features for 900 molecules
Data shape: X=(900, 2048), y=(900,)
Trial 1395: 5-fold CV loss = 0.7509
[I 2025-08-07 23:57:14,885] Trial 1395 finished with value: 0.7508759796619415 and parameters: {'fp_type': 'morgan', 'morgan_only_radius': 2, 'morgan_only_nBits': 2048, 'num_hidden_layers': 3, 'hidden_dim_0': 512, 'hidden_dim_1': 128, 'hidden_dim_2': 512, 'kl_weight': 0.0007073301645188064, 'lr': 0.0017619540294574387, 'batch_size': 32, 'dropout_rate': 0.44455616348926075, 'prior_mu': 0.03411565998565049, 'prior_sigma': 0.09301839895525887, 'normalization': 'none'}. Best is trial 1281 with value: 0.5184582889080047.
Generating morgan fingerprints...
Generated fingerprints with 2048 features for 900 molecules
Data shape: X=(900, 2048), y=(900,)
Trial 1389: 5-fold CV loss = 0.6259
[I 2025-08-07 23:57:22,580] Trial 1389 finished with value: 0.6258527636528015 and parameters: {'fp_type': 'morgan', 'morgan_only_radius': 2, 'morgan_only_nBits': 2048, 'num_hidden_layers': 3, 'hidden_dim_0': 512, 'hidden_dim_1': 128, 'hidden_dim_2': 512, 'kl_weight': 0.0006980970477624859, 'lr': 0.0015602002824926628, 'batch_size': 32, 'dropout_rate': 0.446299532816726, 'prior_mu': 0.027609898474449612, 'prior_sigma': 0.068040645410925, 'normalization': 'none'}. Best is trial 1281 with value: 0.5184582889080047.
Generating morgan fingerprints...
Generated fingerprints with 2048 features for 900 molecules
Data shape: X=(900, 2048), y=(900,)
Trial 1399: 5-fold CV loss = 0.6642
[I 2025-08-07 23:58:27,249] Trial 1399 finished with value: 0.6641631782054901 and parameters: {'fp_type': 'morgan', 'morgan_only_radius': 2, 'morgan_only_nBits': 2048, 'num_hidden_layers': 3, 'hidden_dim_0': 512, 'hidden_dim_1': 128, 'hidden_dim_2': 512, 'kl_weight': 0.0005284060428355193, 'lr': 0.0015963228912875549, 'batch_size': 32, 'dropout_rate': 0.4514173472477456, 'prior_mu': 0.04730839662926545, 'prior_sigma': 0.06725575816755025, 'normalization': 'none'}. Best is trial 1281 with value: 0.5184582889080047.
Generating morgan fingerprints...
Generated fingerprints with 2048 features for 900 molecules
Data shape: X=(900, 2048), y=(900,)
Trial 1398: 5-fold CV loss = 0.7495
[I 2025-08-07 23:58:43,383] Trial 1398 finished with value: 0.7494723558425903 and parameters: {'fp_type': 'morgan', 'morgan_only_radius': 2, 'morgan_only_nBits': 2048, 'num_hidden_layers': 3, 'hidden_dim_0': 512, 'hidden_dim_1': 128, 'hidden_dim_2': 512, 'kl_weight': 0.0006079146866167214, 'lr': 0.0016553577192591337, 'batch_size': 32, 'dropout_rate': 0.4432463770451983, 'prior_mu': 0.03480504602854934, 'prior_sigma': 0.07516104874902643, 'normalization': 'none'}. Best is trial 1281 with value: 0.5184582889080047.
Generating morgan fingerprints...
Generated fingerprints with 2048 features for 900 molecules
Data shape: X=(900, 2048), y=(900,)
Trial 1396: 5-fold CV loss = 0.5245
[I 2025-08-07 23:59:05,158] Trial 1396 finished with value: 0.524498438835144 and parameters: {'fp_type': 'morgan', 'morgan_only_radius': 2, 'morgan_only_nBits': 2048, 'num_hidden_layers': 3, 'hidden_dim_0': 512, 'hidden_dim_1': 128, 'hidden_dim_2': 512, 'kl_weight': 0.0007977401334192995, 'lr': 0.0018433246749684387, 'batch_size': 32, 'dropout_rate': 0.44414528794865815, 'prior_mu': 0.03860705370173855, 'prior_sigma': 0.07396290947152398, 'normalization': 'none'}. Best is trial 1281 with value: 0.5184582889080047.
Generating morgan fingerprints...
Generated fingerprints with 2048 features for 900 molecules
Data shape: X=(900, 2048), y=(900,)
Trial 1403: 5-fold CV loss = 0.8318
[I 2025-08-07 23:59:27,778] Trial 1403 finished with value: 0.8317637085914612 and parameters: {'fp_type': 'morgan', 'morgan_only_radius': 3, 'morgan_only_nBits': 2048, 'num_hidden_layers': 3, 'hidden_dim_0': 512, 'hidden_dim_1': 128, 'hidden_dim_2': 256, 'kl_weight': 0.0008560408961558886, 'lr': 0.0019707364928978023, 'batch_size': 64, 'dropout_rate': 0.452040505685893, 'prior_mu': 0.04089426789859086, 'prior_sigma': 0.06514987966053451, 'normalization': 'none'}. Best is trial 1281 with value: 0.5184582889080047.
Generating morgan fingerprints...
Generated fingerprints with 2048 features for 900 molecules
Data shape: X=(900, 2048), y=(900,)
Trial 1401: 5-fold CV loss = 0.5184
[I 2025-08-07 23:59:41,943] Trial 1401 finished with value: 0.5183773458003997 and parameters: {'fp_type': 'morgan', 'morgan_only_radius': 2, 'morgan_only_nBits': 2048, 'num_hidden_layers': 3, 'hidden_dim_0': 512, 'hidden_dim_1': 128, 'hidden_dim_2': 512, 'kl_weight': 0.0008727225903507229, 'lr': 0.0019664892014146624, 'batch_size': 32, 'dropout_rate': 0.43777554874064534, 'prior_mu': 0.03484930522310839, 'prior_sigma': 0.07188484915555127, 'normalization': 'none'}. Best is trial 1401 with value: 0.5183773458003997.
Generating morgan fingerprints...
Generated fingerprints with 2048 features for 900 molecules
Data shape: X=(900, 2048), y=(900,)
Trial 1402: 5-fold CV loss = 0.6181
[I 2025-08-07 23:59:48,439] Trial 1402 finished with value: 0.6181438267230988 and parameters: {'fp_type': 'morgan', 'morgan_only_radius': 3, 'morgan_only_nBits': 2048, 'num_hidden_layers': 3, 'hidden_dim_0': 512, 'hidden_dim_1': 128, 'hidden_dim_2': 512, 'kl_weight': 0.0008758416959156903, 'lr': 0.0019446462589845057, 'batch_size': 32, 'dropout_rate': 0.45325146297847335, 'prior_mu': 0.050577229821093105, 'prior_sigma': 0.07372588974338214, 'normalization': 'none'}. Best is trial 1401 with value: 0.5183773458003997.
Generating rdkit fingerprints...
Generated fingerprints with 512 features for 900 molecules
Data shape: X=(900, 512), y=(900,)
Trial 1406: 5-fold CV loss = 0.6624
[I 2025-08-08 00:00:32,430] Trial 1406 finished with value: 0.6623703837394714 and parameters: {'fp_type': 'rdkit', 'rdkit_only_maxPath': 8, 'rdkit_only_nBits': 512, 'num_hidden_layers': 3, 'hidden_dim_0': 256, 'hidden_dim_1': 128, 'hidden_dim_2': 512, 'kl_weight': 0.0008398940646750465, 'lr': 0.0017182972365272166, 'batch_size': 32, 'dropout_rate': 0.4496765181304998, 'prior_mu': 0.029976384748237328, 'prior_sigma': 0.07582083729359286, 'normalization': 'none'}. Best is trial 1401 with value: 0.5183773458003997.
Generating morgan fingerprints...
Generated fingerprints with 2048 features for 900 molecules
Data shape: X=(900, 2048), y=(900,)
Trial 1405: 5-fold CV loss = 0.5321
[I 2025-08-08 00:01:18,827] Trial 1405 finished with value: 0.5321277141571045 and parameters: {'fp_type': 'morgan', 'morgan_only_radius': 2, 'morgan_only_nBits': 2048, 'num_hidden_layers': 3, 'hidden_dim_0': 256, 'hidden_dim_1': 128, 'hidden_dim_2': 512, 'kl_weight': 0.0008447035202013296, 'lr': 0.0019176203993305292, 'batch_size': 32, 'dropout_rate': 0.4355081356571816, 'prior_mu': 0.03230691283490138, 'prior_sigma': 0.0757643471587312, 'normalization': 'none'}. Best is trial 1401 with value: 0.5183773458003997.
Generating morgan fingerprints...
Generated fingerprints with 2048 features for 900 molecules
Data shape: X=(900, 2048), y=(900,)
Trial 1404: 5-fold CV loss = 0.5195
[I 2025-08-08 00:01:48,039] Trial 1404 finished with value: 0.5195273756980896 and parameters: {'fp_type': 'morgan', 'morgan_only_radius': 2, 'morgan_only_nBits': 2048, 'num_hidden_layers': 3, 'hidden_dim_0': 512, 'hidden_dim_1': 128, 'hidden_dim_2': 512, 'kl_weight': 0.0005997688599346851, 'lr': 0.0019121929402164176, 'batch_size': 32, 'dropout_rate': 0.45585148293657535, 'prior_mu': 0.04719938532032437, 'prior_sigma': 0.06422013093143152, 'normalization': 'none'}. Best is trial 1401 with value: 0.5183773458003997.
Generating morgan fingerprints...
Generated fingerprints with 2048 features for 900 molecules
Data shape: X=(900, 2048), y=(900,)
Trial 1408: 5-fold CV loss = 0.6986
[I 2025-08-08 00:01:55,119] Trial 1408 finished with value: 0.6986342787742614 and parameters: {'fp_type': 'morgan', 'morgan_only_radius': 2, 'morgan_only_nBits': 2048, 'num_hidden_layers': 3, 'hidden_dim_0': 512, 'hidden_dim_1': 128, 'hidden_dim_2': 128, 'kl_weight': 0.0006338589091403168, 'lr': 0.001456952109051651, 'batch_size': 32, 'dropout_rate': 0.42715128503567373, 'prior_mu': 0.05047581376829663, 'prior_sigma': 0.07167567852260091, 'normalization': 'none'}. Best is trial 1401 with value: 0.5183773458003997.
Generating morgan fingerprints...
Generated fingerprints with 2048 features for 900 molecules
Data shape: X=(900, 2048), y=(900,)
Trial 1407: 5-fold CV loss = 0.5242
[I 2025-08-08 00:02:11,922] Trial 1407 finished with value: 0.5241504013538361 and parameters: {'fp_type': 'morgan', 'morgan_only_radius': 2, 'morgan_only_nBits': 2048, 'num_hidden_layers': 3, 'hidden_dim_0': 512, 'hidden_dim_1': 128, 'hidden_dim_2': 512, 'kl_weight': 0.0007380456298809137, 'lr': 0.0019350751385064622, 'batch_size': 32, 'dropout_rate': 0.4355296850691088, 'prior_mu': 0.047258504239540956, 'prior_sigma': 0.07699606590020117, 'normalization': 'none'}. Best is trial 1401 with value: 0.5183773458003997.
Generating morgan fingerprints...
Generated fingerprints with 2048 features for 900 molecules
Data shape: X=(900, 2048), y=(900,)
Trial 1400: 5-fold CV loss = 0.5178
[I 2025-08-08 00:02:20,890] Trial 1400 finished with value: 0.5178181529045105 and parameters: {'fp_type': 'morgan', 'morgan_only_radius': 2, 'morgan_only_nBits': 2048, 'num_hidden_layers': 3, 'hidden_dim_0': 512, 'hidden_dim_1': 128, 'hidden_dim_2': 512, 'kl_weight': 0.0005242444724147641, 'lr': 0.0019328675317556718, 'batch_size': 32, 'dropout_rate': 0.4510944038829551, 'prior_mu': 0.046537691988493064, 'prior_sigma': 0.07392594871376547, 'normalization': 'none'}. Best is trial 1400 with value: 0.5178181529045105.
Generating morgan_rdkit fingerprints...
Generated fingerprints with 768 features for 900 molecules
Data shape: X=(900, 768), y=(900,)
Trial 1409: 5-fold CV loss = 0.8965
[I 2025-08-08 00:02:26,082] Trial 1409 finished with value: 0.89649738073349 and parameters: {'fp_type': 'morgan', 'morgan_only_radius': 2, 'morgan_only_nBits': 2048, 'num_hidden_layers': 3, 'hidden_dim_0': 512, 'hidden_dim_1': 128, 'hidden_dim_2': 512, 'kl_weight': 0.0005175258532616844, 'lr': 0.001517671422240521, 'batch_size': 32, 'dropout_rate': 0.4412012480380363, 'prior_mu': 0.048205143733812406, 'prior_sigma': 0.07033066918871206, 'normalization': 'none'}. Best is trial 1400 with value: 0.5178181529045105.
Generating morgan_rdkit fingerprints...
Generated fingerprints with 768 features for 900 molecules
Data shape: X=(900, 768), y=(900,)
Trial 1413: 5-fold CV loss = 0.6520
[I 2025-08-08 00:03:00,635] Trial 1413 finished with value: 0.6519602537155151 and parameters: {'fp_type': 'morgan_rdkit', 'combined_morgan_radius': 2, 'combined_morgan_nBits': 512, 'combined_rdkit_maxPath': 8, 'combined_rdkit_nBits': 256, 'num_hidden_layers': 0, 'kl_weight': 0.0005289304728139242, 'lr': 0.001798834824759562, 'batch_size': 32, 'dropout_rate': 0.42658513608865356, 'prior_mu': 0.03762713618227832, 'prior_sigma': 0.0787864266389487, 'normalization': 'none'}. Best is trial 1400 with value: 0.5178181529045105.
Generating morgan fingerprints...
Generated fingerprints with 2048 features for 900 molecules
Data shape: X=(900, 2048), y=(900,)
Trial 1411: 5-fold CV loss = 0.6799
[I 2025-08-08 00:03:16,783] Trial 1411 finished with value: 0.6799224495887757 and parameters: {'fp_type': 'morgan', 'morgan_only_radius': 2, 'morgan_only_nBits': 2048, 'num_hidden_layers': 3, 'hidden_dim_0': 512, 'hidden_dim_1': 128, 'hidden_dim_2': 512, 'kl_weight': 0.0004965093116224636, 'lr': 0.001583937239350466, 'batch_size': 32, 'dropout_rate': 0.4265281511857438, 'prior_mu': 0.04191212961717146, 'prior_sigma': 0.0695835103790398, 'normalization': 'none'}. Best is trial 1400 with value: 0.5178181529045105.
Generating morgan fingerprints...
Generated fingerprints with 2048 features for 900 molecules
Data shape: X=(900, 2048), y=(900,)
Trial 1410: 5-fold CV loss = 0.5834
[I 2025-08-08 00:03:24,970] Trial 1410 finished with value: 0.5833654999732971 and parameters: {'fp_type': 'morgan', 'morgan_only_radius': 2, 'morgan_only_nBits': 2048, 'num_hidden_layers': 3, 'hidden_dim_0': 512, 'hidden_dim_1': 128, 'hidden_dim_2': 512, 'kl_weight': 0.0006445050748668781, 'lr': 0.0016233395793387947, 'batch_size': 32, 'dropout_rate': 0.4416509927337527, 'prior_mu': 0.041017838972222796, 'prior_sigma': 0.07117089477025258, 'normalization': 'none'}. Best is trial 1400 with value: 0.5178181529045105.
Generating morgan fingerprints...
Generated fingerprints with 2048 features for 900 molecules
Data shape: X=(900, 2048), y=(900,)
Trial 1414: 5-fold CV loss = 0.8021
[I 2025-08-08 00:03:58,728] Trial 1414 finished with value: 0.8020791113376617 and parameters: {'fp_type': 'morgan', 'morgan_only_radius': 2, 'morgan_only_nBits': 2048, 'num_hidden_layers': 3, 'hidden_dim_0': 512, 'hidden_dim_1': 128, 'hidden_dim_2': 512, 'kl_weight': 0.0005288427870828303, 'lr': 0.0016986283333474549, 'batch_size': 32, 'dropout_rate': 0.4293102677814341, 'prior_mu': 0.04383203843339409, 'prior_sigma': 0.07389258926229517, 'normalization': 'none'}. Best is trial 1400 with value: 0.5178181529045105.
Generating morgan fingerprints...
Generated fingerprints with 2048 features for 900 molecules
Data shape: X=(900, 2048), y=(900,)
Trial 1415: 5-fold CV loss = 0.6058
[I 2025-08-08 00:04:32,115] Trial 1415 finished with value: 0.6058391034603119 and parameters: {'fp_type': 'morgan', 'morgan_only_radius': 2, 'morgan_only_nBits': 2048, 'num_hidden_layers': 3, 'hidden_dim_0': 512, 'hidden_dim_1': 128, 'hidden_dim_2': 512, 'kl_weight': 0.0005583783069773959, 'lr': 0.0016649352920840763, 'batch_size': 32, 'dropout_rate': 0.4331969504746866, 'prior_mu': 0.046523030035832746, 'prior_sigma': 0.07801738935831652, 'normalization': 'none'}. Best is trial 1400 with value: 0.5178181529045105.
Generating morgan fingerprints...
Generated fingerprints with 2048 features for 900 molecules
Data shape: X=(900, 2048), y=(900,)
Trial 1416: 5-fold CV loss = 0.5893
