[I 2025-08-08 03:29:06,735] Trial 1980 finished with value: 0.5217256367206573 and parameters: {'fp_type': 'morgan', 'morgan_only_radius': 2, 'morgan_only_nBits': 2048, 'num_hidden_layers': 3, 'hidden_dim_0': 512, 'hidden_dim_1': 128, 'hidden_dim_2': 512, 'kl_weight': 0.0004773994862340639, 'lr': 0.0023383275875279988, 'batch_size': 32, 'dropout_rate': 0.435994227540706, 'prior_mu': 0.04828864612144272, 'prior_sigma': 0.06491177788460906, 'normalization': 'none'}. Best is trial 1528 with value: 0.5170644640922546.
Generating morgan fingerprints...
Generated fingerprints with 2048 features for 900 molecules
Data shape: X=(900, 2048), y=(900,)
Trial 1984: 5-fold CV loss = 0.5435
[I 2025-08-08 03:29:31,561] Trial 1984 finished with value: 0.5435331165790558 and parameters: {'fp_type': 'morgan', 'morgan_only_radius': 2, 'morgan_only_nBits': 2048, 'num_hidden_layers': 3, 'hidden_dim_0': 512, 'hidden_dim_1': 128, 'hidden_dim_2': 512, 'kl_weight': 0.0004227860685314547, 'lr': 0.0024977812048405414, 'batch_size': 32, 'dropout_rate': 0.43504182269588615, 'prior_mu': 0.04500329481729265, 'prior_sigma': 0.067589334359339, 'normalization': 'layer'}. Best is trial 1528 with value: 0.5170644640922546.
Generating morgan fingerprints...
Generated fingerprints with 2048 features for 900 molecules
Data shape: X=(900, 2048), y=(900,)
Trial 1983: 5-fold CV loss = 0.5232
[I 2025-08-08 03:29:39,818] Trial 1983 finished with value: 0.5232164561748505 and parameters: {'fp_type': 'morgan', 'morgan_only_radius': 2, 'morgan_only_nBits': 2048, 'num_hidden_layers': 3, 'hidden_dim_0': 512, 'hidden_dim_1': 128, 'hidden_dim_2': 512, 'kl_weight': 0.0005553692574638822, 'lr': 0.0023158715748131573, 'batch_size': 32, 'dropout_rate': 0.45103731773223493, 'prior_mu': 0.0497046591382847, 'prior_sigma': 0.06153852216128378, 'normalization': 'none'}. Best is trial 1528 with value: 0.5170644640922546.
Generating morgan fingerprints...
Generated fingerprints with 2048 features for 900 molecules
Data shape: X=(900, 2048), y=(900,)
Trial 1986: 5-fold CV loss = 0.5189
[I 2025-08-08 03:30:36,496] Trial 1986 finished with value: 0.5189260005950928 and parameters: {'fp_type': 'morgan', 'morgan_only_radius': 2, 'morgan_only_nBits': 2048, 'num_hidden_layers': 3, 'hidden_dim_0': 512, 'hidden_dim_1': 128, 'hidden_dim_2': 512, 'kl_weight': 0.0005542693112480645, 'lr': 0.0021234827977940213, 'batch_size': 32, 'dropout_rate': 0.4510707186804983, 'prior_mu': 0.0567587605724077, 'prior_sigma': 0.07325605532886646, 'normalization': 'none'}. Best is trial 1528 with value: 0.5170644640922546.
Generating morgan fingerprints...
Generated fingerprints with 2048 features for 900 molecules
Data shape: X=(900, 2048), y=(900,)
Trial 1985: 5-fold CV loss = 0.5418
[I 2025-08-08 03:30:39,691] Trial 1985 finished with value: 0.5418462455272675 and parameters: {'fp_type': 'morgan', 'morgan_only_radius': 2, 'morgan_only_nBits': 2048, 'num_hidden_layers': 3, 'hidden_dim_0': 512, 'hidden_dim_1': 128, 'hidden_dim_2': 512, 'kl_weight': 0.0005278127545200569, 'lr': 0.0026165425670481566, 'batch_size': 32, 'dropout_rate': 0.4328062944726844, 'prior_mu': 0.05100873766218971, 'prior_sigma': 0.0724734690688282, 'normalization': 'layer'}. Best is trial 1528 with value: 0.5170644640922546.
Generating morgan fingerprints...
Generated fingerprints with 2048 features for 900 molecules
Data shape: X=(900, 2048), y=(900,)
Trial 1982: 5-fold CV loss = 0.5523
[I 2025-08-08 03:31:04,706] Trial 1982 finished with value: 0.5523274600505829 and parameters: {'fp_type': 'morgan', 'morgan_only_radius': 2, 'morgan_only_nBits': 2048, 'num_hidden_layers': 3, 'hidden_dim_0': 512, 'hidden_dim_1': 128, 'hidden_dim_2': 512, 'kl_weight': 0.0005139439370777885, 'lr': 0.0022564241276765698, 'batch_size': 32, 'dropout_rate': 0.26227174334971015, 'prior_mu': 0.050753180959926564, 'prior_sigma': 0.06154963542570168, 'normalization': 'none'}. Best is trial 1528 with value: 0.5170644640922546.
Generating morgan fingerprints...
Generated fingerprints with 2048 features for 900 molecules
Data shape: X=(900, 2048), y=(900,)
Trial 1987: 5-fold CV loss = 0.5208
[I 2025-08-08 03:31:23,301] Trial 1987 finished with value: 0.5208256959915161 and parameters: {'fp_type': 'morgan', 'morgan_only_radius': 2, 'morgan_only_nBits': 2048, 'num_hidden_layers': 3, 'hidden_dim_0': 512, 'hidden_dim_1': 64, 'hidden_dim_2': 256, 'kl_weight': 0.0005417696052476369, 'lr': 0.0022165902380732994, 'batch_size': 32, 'dropout_rate': 0.43315122968074954, 'prior_mu': 0.055426880841679335, 'prior_sigma': 0.0730468674300881, 'normalization': 'none'}. Best is trial 1528 with value: 0.5170644640922546.
Generating morgan fingerprints...
Generated fingerprints with 2048 features for 900 molecules
Data shape: X=(900, 2048), y=(900,)
Trial 1988: 5-fold CV loss = 0.7288
[I 2025-08-08 03:31:32,938] Trial 1988 finished with value: 0.7287662088871002 and parameters: {'fp_type': 'morgan', 'morgan_only_radius': 2, 'morgan_only_nBits': 2048, 'num_hidden_layers': 3, 'hidden_dim_0': 512, 'hidden_dim_1': 128, 'hidden_dim_2': 256, 'kl_weight': 0.0005023697437786022, 'lr': 0.0021614410656713933, 'batch_size': 32, 'dropout_rate': 0.44861469734557863, 'prior_mu': 0.06710990063993906, 'prior_sigma': 0.0907618401299493, 'normalization': 'none'}. Best is trial 1528 with value: 0.5170644640922546.
Generating morgan fingerprints...
Generated fingerprints with 2048 features for 900 molecules
Data shape: X=(900, 2048), y=(900,)
Trial 1989: 5-fold CV loss = 0.6040
[I 2025-08-08 03:32:20,821] Trial 1989 finished with value: 0.6040273547172547 and parameters: {'fp_type': 'morgan', 'morgan_only_radius': 2, 'morgan_only_nBits': 2048, 'num_hidden_layers': 3, 'hidden_dim_0': 256, 'hidden_dim_1': 64, 'hidden_dim_2': 256, 'kl_weight': 0.0004939154635730075, 'lr': 0.0021706119093520093, 'batch_size': 32, 'dropout_rate': 0.44771444647045594, 'prior_mu': 0.06455847034966328, 'prior_sigma': 0.07936916140185546, 'normalization': 'none'}. Best is trial 1528 with value: 0.5170644640922546.
Generating morgan fingerprints...
Generated fingerprints with 2048 features for 900 molecules
Data shape: X=(900, 2048), y=(900,)
Trial 1991: 5-fold CV loss = 0.5461
[I 2025-08-08 03:33:02,340] Trial 1991 finished with value: 0.5460891008377076 and parameters: {'fp_type': 'morgan', 'morgan_only_radius': 2, 'morgan_only_nBits': 2048, 'num_hidden_layers': 3, 'hidden_dim_0': 256, 'hidden_dim_1': 64, 'hidden_dim_2': 256, 'kl_weight': 0.000507845510232377, 'lr': 0.0025955408427301672, 'batch_size': 32, 'dropout_rate': 0.4299303142397667, 'prior_mu': 0.07035345014513586, 'prior_sigma': 0.08934125574063853, 'normalization': 'none'}. Best is trial 1528 with value: 0.5170644640922546.
Generating morgan fingerprints...
Generated fingerprints with 2048 features for 900 molecules
Data shape: X=(900, 2048), y=(900,)
Trial 1992: 5-fold CV loss = 0.5803
[I 2025-08-08 03:33:10,493] Trial 1992 finished with value: 0.5802924394607544 and parameters: {'fp_type': 'morgan', 'morgan_only_radius': 2, 'morgan_only_nBits': 2048, 'num_hidden_layers': 3, 'hidden_dim_0': 256, 'hidden_dim_1': 1024, 'hidden_dim_2': 256, 'kl_weight': 0.00040682611681311707, 'lr': 0.0024945436231886423, 'batch_size': 32, 'dropout_rate': 0.42958285895847736, 'prior_mu': 0.06790229818656407, 'prior_sigma': 0.08167560231712147, 'normalization': 'none'}. Best is trial 1528 with value: 0.5170644640922546.
Generating morgan fingerprints...
Generated fingerprints with 2048 features for 900 molecules
Data shape: X=(900, 2048), y=(900,)
Trial 1993: 5-fold CV loss = 0.5289
[I 2025-08-08 03:34:08,578] Trial 1993 finished with value: 0.5288903892040253 and parameters: {'fp_type': 'morgan', 'morgan_only_radius': 2, 'morgan_only_nBits': 2048, 'num_hidden_layers': 3, 'hidden_dim_0': 512, 'hidden_dim_1': 64, 'hidden_dim_2': 256, 'kl_weight': 0.00043619334464746067, 'lr': 0.002589468161749452, 'batch_size': 32, 'dropout_rate': 0.4301777810456087, 'prior_mu': 0.06215319661321607, 'prior_sigma': 0.08152514574528807, 'normalization': 'none'}. Best is trial 1528 with value: 0.5170644640922546.
Generating morgan fingerprints...
Generated fingerprints with 2048 features for 900 molecules
Data shape: X=(900, 2048), y=(900,)
Trial 1994: 5-fold CV loss = 0.6757
[I 2025-08-08 03:34:13,074] Trial 1994 finished with value: 0.675651752948761 and parameters: {'fp_type': 'morgan', 'morgan_only_radius': 2, 'morgan_only_nBits': 2048, 'num_hidden_layers': 3, 'hidden_dim_0': 512, 'hidden_dim_1': 1024, 'hidden_dim_2': 256, 'kl_weight': 0.0004650897687015595, 'lr': 0.0024833228594008574, 'batch_size': 32, 'dropout_rate': 0.13365418923583633, 'prior_mu': 0.06053964275156747, 'prior_sigma': 0.0821413069040933, 'normalization': 'none'}. Best is trial 1528 with value: 0.5170644640922546.
Generating morgan fingerprints...
Generated fingerprints with 2048 features for 900 molecules
Data shape: X=(900, 2048), y=(900,)
Trial 1995: 5-fold CV loss = 0.5338
[I 2025-08-08 03:34:33,112] Trial 1995 finished with value: 0.5338476240634918 and parameters: {'fp_type': 'morgan', 'morgan_only_radius': 2, 'morgan_only_nBits': 2048, 'num_hidden_layers': 3, 'hidden_dim_0': 512, 'hidden_dim_1': 64, 'hidden_dim_2': 256, 'kl_weight': 0.00045863310599237933, 'lr': 0.00238522672723804, 'batch_size': 32, 'dropout_rate': 0.43820354469301076, 'prior_mu': 0.06131073799707588, 'prior_sigma': 0.07752360227659404, 'normalization': 'none'}. Best is trial 1528 with value: 0.5170644640922546.
Generating morgan fingerprints...
Generated fingerprints with 2048 features for 900 molecules
Data shape: X=(900, 2048), y=(900,)
Trial 1990: 5-fold CV loss = 0.5870
[I 2025-08-08 03:34:48,956] Trial 1990 finished with value: 0.5869527995586395 and parameters: {'fp_type': 'morgan', 'morgan_only_radius': 2, 'morgan_only_nBits': 2048, 'num_hidden_layers': 3, 'hidden_dim_0': 512, 'hidden_dim_1': 128, 'hidden_dim_2': 256, 'kl_weight': 0.00044657139393278157, 'lr': 0.002107811086345683, 'batch_size': 32, 'dropout_rate': 0.4473350735997989, 'prior_mu': 0.0669377322824444, 'prior_sigma': 0.0825900052261368, 'normalization': 'none'}. Best is trial 1528 with value: 0.5170644640922546.
Generating rdkit fingerprints...
Generated fingerprints with 512 features for 900 molecules
Data shape: X=(900, 512), y=(900,)
Trial 1998: 5-fold CV loss = 0.5258
[I 2025-08-08 03:35:16,852] Trial 1998 finished with value: 0.5257823050022126 and parameters: {'fp_type': 'morgan', 'morgan_only_radius': 2, 'morgan_only_nBits': 2048, 'num_hidden_layers': 3, 'hidden_dim_0': 512, 'hidden_dim_1': 64, 'hidden_dim_2': 512, 'kl_weight': 0.0003982415524795733, 'lr': 0.0029753399999002694, 'batch_size': 64, 'dropout_rate': 0.4180530276812494, 'prior_mu': 0.05523544898970155, 'prior_sigma': 0.08267436925596691, 'normalization': 'none'}. Best is trial 1528 with value: 0.5170644640922546.
Generating rdkit fingerprints...
Generated fingerprints with 512 features for 900 molecules
Data shape: X=(900, 512), y=(900,)
Trial 1997: 5-fold CV loss = 0.5279
[I 2025-08-08 03:35:26,794] Trial 1997 finished with value: 0.5278902590274811 and parameters: {'fp_type': 'morgan', 'morgan_only_radius': 2, 'morgan_only_nBits': 2048, 'num_hidden_layers': 3, 'hidden_dim_0': 512, 'hidden_dim_1': 64, 'hidden_dim_2': 256, 'kl_weight': 0.00046535813906759113, 'lr': 0.0030387068806358455, 'batch_size': 32, 'dropout_rate': 0.4368210467748694, 'prior_mu': 0.06022557090220254, 'prior_sigma': 0.07692669103392219, 'normalization': 'none'}. Best is trial 1528 with value: 0.5170644640922546.
Generating rdkit fingerprints...
Generated fingerprints with 512 features for 900 molecules
Data shape: X=(900, 512), y=(900,)
Trial 1996: 5-fold CV loss = 0.5311
[I 2025-08-08 03:35:54,991] Trial 1996 finished with value: 0.5311175644397735 and parameters: {'fp_type': 'morgan', 'morgan_only_radius': 2, 'morgan_only_nBits': 2048, 'num_hidden_layers': 3, 'hidden_dim_0': 512, 'hidden_dim_1': 64, 'hidden_dim_2': 256, 'kl_weight': 0.0004657974714209549, 'lr': 0.0028555628128257254, 'batch_size': 32, 'dropout_rate': 0.4403605686252824, 'prior_mu': 0.050990476571010156, 'prior_sigma': 0.08512194546919537, 'normalization': 'none'}. Best is trial 1528 with value: 0.5170644640922546.
Generating rdkit fingerprints...
Generated fingerprints with 512 features for 900 molecules
Data shape: X=(900, 512), y=(900,)
Trial 2000: 5-fold CV loss = 0.6616
[I 2025-08-08 03:36:05,971] Trial 2000 finished with value: 0.6615758419036866 and parameters: {'fp_type': 'rdkit', 'rdkit_only_maxPath': 8, 'rdkit_only_nBits': 512, 'num_hidden_layers': 3, 'hidden_dim_0': 512, 'hidden_dim_1': 64, 'hidden_dim_2': 256, 'kl_weight': 0.000556813152823405, 'lr': 0.002260554172359317, 'batch_size': 32, 'dropout_rate': 0.0472797434664739, 'prior_mu': 0.05740321411074008, 'prior_sigma': 0.07911350584553047, 'normalization': 'none'}. Best is trial 1528 with value: 0.5170644640922546.
Generating morgan fingerprints...
Generated fingerprints with 2048 features for 900 molecules
Data shape: X=(900, 2048), y=(900,)
Trial 2001: 5-fold CV loss = 0.6643
[I 2025-08-08 03:36:15,265] Trial 2001 finished with value: 0.6643164396286011 and parameters: {'fp_type': 'rdkit', 'rdkit_only_maxPath': 8, 'rdkit_only_nBits': 512, 'num_hidden_layers': 3, 'hidden_dim_0': 512, 'hidden_dim_1': 64, 'hidden_dim_2': 256, 'kl_weight': 0.0005867620281914505, 'lr': 0.002228484127988051, 'batch_size': 32, 'dropout_rate': 0.4238204594368002, 'prior_mu': 0.05819615998516787, 'prior_sigma': 0.0784903126427159, 'normalization': 'none'}. Best is trial 1528 with value: 0.5170644640922546.
Generating morgan fingerprints...
Generated fingerprints with 2048 features for 900 molecules
Data shape: X=(900, 2048), y=(900,)
Trial 2004: 5-fold CV loss = 0.7891
[I 2025-08-08 03:36:49,640] Trial 2004 finished with value: 0.7890835285186768 and parameters: {'fp_type': 'morgan', 'morgan_only_radius': 2, 'morgan_only_nBits': 2048, 'num_hidden_layers': 3, 'hidden_dim_0': 512, 'hidden_dim_1': 64, 'hidden_dim_2': 256, 'kl_weight': 0.0005597621746638373, 'lr': 0.0007139905533165374, 'batch_size': 32, 'dropout_rate': 0.41616393742010466, 'prior_mu': 0.06900932563877024, 'prior_sigma': 0.07350964777171586, 'normalization': 'none'}. Best is trial 1528 with value: 0.5170644640922546.
Generating morgan fingerprints...
Generated fingerprints with 2048 features for 900 molecules
Data shape: X=(900, 2048), y=(900,)
Trial 2003: 5-fold CV loss = 0.5385
[I 2025-08-08 03:37:00,787] Trial 2003 finished with value: 0.5384636342525482 and parameters: {'fp_type': 'morgan', 'morgan_only_radius': 2, 'morgan_only_nBits': 2048, 'num_hidden_layers': 3, 'hidden_dim_0': 512, 'hidden_dim_1': 64, 'hidden_dim_2': 1024, 'kl_weight': 0.0005486704053127054, 'lr': 0.002204769443770301, 'batch_size': 32, 'dropout_rate': 0.4219269918363886, 'prior_mu': 0.05734321466645164, 'prior_sigma': 0.0756422197447169, 'normalization': 'none'}. Best is trial 1528 with value: 0.5170644640922546.
Generating morgan fingerprints...
Generated fingerprints with 2048 features for 900 molecules
Data shape: X=(900, 2048), y=(900,)
Trial 1999: 5-fold CV loss = 0.6605
[I 2025-08-08 03:37:08,264] Trial 1999 finished with value: 0.660548734664917 and parameters: {'fp_type': 'rdkit', 'rdkit_only_maxPath': 8, 'rdkit_only_nBits': 512, 'num_hidden_layers': 3, 'hidden_dim_0': 512, 'hidden_dim_1': 64, 'hidden_dim_2': 256, 'kl_weight': 0.0003880987484669012, 'lr': 0.002819086883861919, 'batch_size': 32, 'dropout_rate': 0.2410120970209072, 'prior_mu': 0.05866860806384476, 'prior_sigma': 0.07629767221554444, 'normalization': 'none'}. Best is trial 1528 with value: 0.5170644640922546.
Generating morgan fingerprints...
Generated fingerprints with 2048 features for 900 molecules
Data shape: X=(900, 2048), y=(900,)
Trial 2002: 5-fold CV loss = 0.6665
[I 2025-08-08 03:37:17,936] Trial 2002 finished with value: 0.6665077447891236 and parameters: {'fp_type': 'rdkit', 'rdkit_only_maxPath': 8, 'rdkit_only_nBits': 512, 'num_hidden_layers': 3, 'hidden_dim_0': 512, 'hidden_dim_1': 64, 'hidden_dim_2': 256, 'kl_weight': 0.0005543804513095877, 'lr': 0.002248583953167453, 'batch_size': 32, 'dropout_rate': 0.4213462206184231, 'prior_mu': 0.05833361076235, 'prior_sigma': 0.07872763029457013, 'normalization': 'none'}. Best is trial 1528 with value: 0.5170644640922546.
Generating morgan fingerprints...
Generated fingerprints with 2048 features for 900 molecules
Data shape: X=(900, 2048), y=(900,)
Trial 2005: 5-fold CV loss = 0.5726
[I 2025-08-08 03:38:13,751] Trial 2005 finished with value: 0.5725517988204956 and parameters: {'fp_type': 'morgan', 'morgan_only_radius': 2, 'morgan_only_nBits': 2048, 'num_hidden_layers': 3, 'hidden_dim_0': 512, 'hidden_dim_1': 64, 'hidden_dim_2': 256, 'kl_weight': 0.0005147954948090472, 'lr': 0.0022189529039391385, 'batch_size': 32, 'dropout_rate': 0.4386747439681338, 'prior_mu': 0.05712201434306757, 'prior_sigma': 0.07537646660952102, 'normalization': 'none'}. Best is trial 1528 with value: 0.5170644640922546.
Generating morgan fingerprints...
Generated fingerprints with 2048 features for 900 molecules
Data shape: X=(900, 2048), y=(900,)
Trial 2006: 5-fold CV loss = 0.5248
[I 2025-08-08 03:38:20,665] Trial 2006 finished with value: 0.5248173236846924 and parameters: {'fp_type': 'morgan', 'morgan_only_radius': 2, 'morgan_only_nBits': 2048, 'num_hidden_layers': 3, 'hidden_dim_0': 512, 'hidden_dim_1': 64, 'hidden_dim_2': 256, 'kl_weight': 0.0003740754563657662, 'lr': 0.002487918278031447, 'batch_size': 32, 'dropout_rate': 0.42684967554020153, 'prior_mu': 0.05234403730264623, 'prior_sigma': 0.07458162429904996, 'normalization': 'none'}. Best is trial 1528 with value: 0.5170644640922546.
Generating morgan fingerprints...
Generated fingerprints with 2048 features for 900 molecules
Data shape: X=(900, 2048), y=(900,)
Trial 2008: 5-fold CV loss = 0.5204
[I 2025-08-08 03:39:27,489] Trial 2008 finished with value: 0.5204144895076752 and parameters: {'fp_type': 'morgan', 'morgan_only_radius': 2, 'morgan_only_nBits': 2048, 'num_hidden_layers': 3, 'hidden_dim_0': 512, 'hidden_dim_1': 64, 'hidden_dim_2': 256, 'kl_weight': 0.000500282215350549, 'lr': 0.002460051709198176, 'batch_size': 32, 'dropout_rate': 0.4309943923115996, 'prior_mu': 0.053167480992030794, 'prior_sigma': 0.07500835842757896, 'normalization': 'none'}. Best is trial 1528 with value: 0.5170644640922546.
Generating morgan fingerprints...
Generated fingerprints with 2048 features for 900 molecules
Data shape: X=(900, 2048), y=(900,)
Trial 2010: 5-fold CV loss = 0.5571
[I 2025-08-08 03:39:29,402] Trial 2010 finished with value: 0.5571237564086914 and parameters: {'fp_type': 'morgan', 'morgan_only_radius': 2, 'morgan_only_nBits': 2048, 'num_hidden_layers': 3, 'hidden_dim_0': 512, 'hidden_dim_1': 64, 'hidden_dim_2': 256, 'kl_weight': 0.0005834117677742651, 'lr': 0.0020622183403949243, 'batch_size': 32, 'dropout_rate': 0.4095463197196129, 'prior_mu': 0.07245292541064319, 'prior_sigma': 0.07377964330190889, 'normalization': 'none'}. Best is trial 1528 with value: 0.5170644640922546.
Generating morgan fingerprints...
Generated fingerprints with 2048 features for 900 molecules
Data shape: X=(900, 2048), y=(900,)
Trial 2009: 5-fold CV loss = 0.5272
[I 2025-08-08 03:39:46,388] Trial 2009 finished with value: 0.5272373259067535 and parameters: {'fp_type': 'morgan', 'morgan_only_radius': 2, 'morgan_only_nBits': 2048, 'num_hidden_layers': 3, 'hidden_dim_0': 512, 'hidden_dim_1': 64, 'hidden_dim_2': 256, 'kl_weight': 0.00037931052114495624, 'lr': 0.0024657170922027724, 'batch_size': 32, 'dropout_rate': 0.41254354892002504, 'prior_mu': 0.048356358242476825, 'prior_sigma': 0.07441301080601224, 'normalization': 'none'}. Best is trial 1528 with value: 0.5170644640922546.
Generating morgan fingerprints...
Generated fingerprints with 2048 features for 900 molecules
Data shape: X=(900, 2048), y=(900,)
Trial 2012: 5-fold CV loss = 0.5332
[I 2025-08-08 03:40:22,956] Trial 2012 finished with value: 0.5331815600395202 and parameters: {'fp_type': 'morgan', 'morgan_only_radius': 3, 'morgan_only_nBits': 2048, 'num_hidden_layers': 3, 'hidden_dim_0': 512, 'hidden_dim_1': 64, 'hidden_dim_2': 256, 'kl_weight': 0.00041012082101705077, 'lr': 0.0026830686061976154, 'batch_size': 32, 'dropout_rate': 0.4297452209470596, 'prior_mu': 0.07068987278869869, 'prior_sigma': 0.07939171956764725, 'normalization': 'none'}. Best is trial 1528 with value: 0.5170644640922546.
Generating morgan fingerprints...
Generated fingerprints with 2048 features for 900 molecules
Data shape: X=(900, 2048), y=(900,)
Trial 2013: 5-fold CV loss = 0.5380
[I 2025-08-08 03:40:44,112] Trial 2013 finished with value: 0.5379783391952515 and parameters: {'fp_type': 'morgan', 'morgan_only_radius': 3, 'morgan_only_nBits': 2048, 'num_hidden_layers': 3, 'hidden_dim_0': 512, 'hidden_dim_1': 64, 'hidden_dim_2': 256, 'kl_weight': 0.00043891093118782177, 'lr': 0.0030579178615536867, 'batch_size': 32, 'dropout_rate': 0.4294134942610694, 'prior_mu': 0.06926508360309545, 'prior_sigma': 0.08192878283670305, 'normalization': 'none'}. Best is trial 1528 with value: 0.5170644640922546.
Generating morgan fingerprints...
Generated fingerprints with 2048 features for 900 molecules
Data shape: X=(900, 2048), y=(900,)
Trial 2011: 5-fold CV loss = 0.5271
[I 2025-08-08 03:41:26,866] Trial 2011 finished with value: 0.527098947763443 and parameters: {'fp_type': 'morgan', 'morgan_only_radius': 2, 'morgan_only_nBits': 2048, 'num_hidden_layers': 3, 'hidden_dim_0': 512, 'hidden_dim_1': 64, 'hidden_dim_2': 256, 'kl_weight': 0.0004400320767673848, 'lr': 0.003020052061317781, 'batch_size': 32, 'dropout_rate': 0.4110613219196266, 'prior_mu': 0.06284381739905143, 'prior_sigma': 0.08025414892768742, 'normalization': 'none'}. Best is trial 1528 with value: 0.5170644640922546.
Generating morgan fingerprints...
Generated fingerprints with 2048 features for 900 molecules
Data shape: X=(900, 2048), y=(900,)
Trial 2014: 5-fold CV loss = 0.5263
