[I 2025-08-08 05:35:12,545] Trial 2327 finished with value: 0.6183081567287445 and parameters: {'fp_type': 'morgan', 'morgan_only_radius': 2, 'morgan_only_nBits': 2048, 'num_hidden_layers': 3, 'hidden_dim_0': 512, 'hidden_dim_1': 64, 'hidden_dim_2': 256, 'kl_weight': 0.0007480779403207118, 'lr': 0.0031004581066814197, 'batch_size': 64, 'dropout_rate': 0.3908311526588927, 'prior_mu': 0.042606133003934746, 'prior_sigma': 0.06603703019113692, 'normalization': 'none'}. Best is trial 1528 with value: 0.5170644640922546.
Generating morgan fingerprints...
Generated fingerprints with 2048 features for 900 molecules
Data shape: X=(900, 2048), y=(900,)
Trial 2330: 5-fold CV loss = 0.5310
[I 2025-08-08 05:35:49,174] Trial 2330 finished with value: 0.5309549152851105 and parameters: {'fp_type': 'morgan', 'morgan_only_radius': 2, 'morgan_only_nBits': 2048, 'num_hidden_layers': 3, 'hidden_dim_0': 512, 'hidden_dim_1': 64, 'hidden_dim_2': 256, 'kl_weight': 0.0007360148609724834, 'lr': 0.0033618304183026973, 'batch_size': 32, 'dropout_rate': 0.4312616395543459, 'prior_mu': 0.0317774941728137, 'prior_sigma': 0.07816062969897514, 'normalization': 'none'}. Best is trial 1528 with value: 0.5170644640922546.
Generating morgan fingerprints...
Generated fingerprints with 2048 features for 900 molecules
Data shape: X=(900, 2048), y=(900,)
Trial 2333: 5-fold CV loss = 0.5363
[I 2025-08-08 05:36:24,406] Trial 2333 finished with value: 0.5362883031368255 and parameters: {'fp_type': 'morgan', 'morgan_only_radius': 2, 'morgan_only_nBits': 2048, 'num_hidden_layers': 3, 'hidden_dim_0': 512, 'hidden_dim_1': 64, 'hidden_dim_2': 256, 'kl_weight': 0.0006227960668253494, 'lr': 0.00544597659665046, 'batch_size': 32, 'dropout_rate': 0.409544799796612, 'prior_mu': 0.0605916590316406, 'prior_sigma': 0.06907585749664989, 'normalization': 'none'}. Best is trial 1528 with value: 0.5170644640922546.
Generating morgan fingerprints...
Generated fingerprints with 2048 features for 900 molecules
Data shape: X=(900, 2048), y=(900,)
Trial 2332: 5-fold CV loss = 0.5375
[I 2025-08-08 05:36:45,991] Trial 2332 finished with value: 0.537494671344757 and parameters: {'fp_type': 'morgan', 'morgan_only_radius': 2, 'morgan_only_nBits': 2048, 'num_hidden_layers': 3, 'hidden_dim_0': 512, 'hidden_dim_1': 64, 'hidden_dim_2': 256, 'kl_weight': 0.0006319270277460134, 'lr': 0.0036084542660648413, 'batch_size': 32, 'dropout_rate': 0.4319094680625366, 'prior_mu': 0.030749502976371614, 'prior_sigma': 0.09411564031396481, 'normalization': 'none'}. Best is trial 1528 with value: 0.5170644640922546.
Generating morgan fingerprints...
Generated fingerprints with 2048 features for 900 molecules
Data shape: X=(900, 2048), y=(900,)
Trial 2331: 5-fold CV loss = 0.5953
[I 2025-08-08 05:37:01,001] Trial 2331 finished with value: 0.5953328430652618 and parameters: {'fp_type': 'morgan', 'morgan_only_radius': 2, 'morgan_only_nBits': 2048, 'num_hidden_layers': 3, 'hidden_dim_0': 512, 'hidden_dim_1': 64, 'hidden_dim_2': 256, 'kl_weight': 0.0007232740806069839, 'lr': 0.001771794909102007, 'batch_size': 32, 'dropout_rate': 0.4304546591956301, 'prior_mu': 0.03169079880862523, 'prior_sigma': 0.08002502849924922, 'normalization': 'none'}. Best is trial 1528 with value: 0.5170644640922546.
Generating morgan fingerprints...
Generated fingerprints with 2048 features for 900 molecules
Data shape: X=(900, 2048), y=(900,)
Trial 2334: 5-fold CV loss = 0.5899
[I 2025-08-08 05:37:28,535] Trial 2334 finished with value: 0.5898693799972534 and parameters: {'fp_type': 'morgan', 'morgan_only_radius': 2, 'morgan_only_nBits': 2048, 'num_hidden_layers': 3, 'hidden_dim_0': 512, 'hidden_dim_1': 64, 'hidden_dim_2': 256, 'kl_weight': 0.00100598241740754, 'lr': 0.0017168030915296767, 'batch_size': 32, 'dropout_rate': 0.4387407269358831, 'prior_mu': 0.03353810839425851, 'prior_sigma': 0.15299615500376007, 'normalization': 'none'}. Best is trial 1528 with value: 0.5170644640922546.
Generating morgan fingerprints...
Generated fingerprints with 2048 features for 900 molecules
Data shape: X=(900, 2048), y=(900,)
Trial 2329: 5-fold CV loss = 0.5157
[I 2025-08-08 05:37:41,266] Trial 2329 finished with value: 0.5157062888145447 and parameters: {'fp_type': 'morgan', 'morgan_only_radius': 2, 'morgan_only_nBits': 2048, 'num_hidden_layers': 3, 'hidden_dim_0': 512, 'hidden_dim_1': 64, 'hidden_dim_2': 256, 'kl_weight': 0.0007438909289583374, 'lr': 0.0031987207970578897, 'batch_size': 64, 'dropout_rate': 0.4317761235893083, 'prior_mu': 0.0316501635981116, 'prior_sigma': 0.07782979704413434, 'normalization': 'none'}. Best is trial 2329 with value: 0.5157062888145447.
Generating morgan fingerprints...
Generated fingerprints with 2048 features for 900 molecules
Data shape: X=(900, 2048), y=(900,)
Trial 2336: 5-fold CV loss = 0.5407
[I 2025-08-08 05:37:46,865] Trial 2336 finished with value: 0.5407404482364655 and parameters: {'fp_type': 'morgan', 'morgan_only_radius': 2, 'morgan_only_nBits': 2048, 'num_hidden_layers': 3, 'hidden_dim_0': 512, 'hidden_dim_1': 64, 'hidden_dim_2': 256, 'kl_weight': 0.0010125416921890206, 'lr': 0.004104130636337463, 'batch_size': 32, 'dropout_rate': 0.443483446557591, 'prior_mu': 0.05830956448339546, 'prior_sigma': 0.056143741650462736, 'normalization': 'none'}. Best is trial 2329 with value: 0.5157062888145447.
Generating morgan fingerprints...
Generated fingerprints with 2048 features for 900 molecules
Data shape: X=(900, 2048), y=(900,)
Trial 2337: 5-fold CV loss = 0.5379
[I 2025-08-08 05:38:09,737] Trial 2337 finished with value: 0.5379106163978576 and parameters: {'fp_type': 'morgan', 'morgan_only_radius': 2, 'morgan_only_nBits': 2048, 'num_hidden_layers': 3, 'hidden_dim_0': 512, 'hidden_dim_1': 64, 'hidden_dim_2': 1024, 'kl_weight': 0.0005087539620884125, 'lr': 0.0034803690362584564, 'batch_size': 32, 'dropout_rate': 0.4152586008898981, 'prior_mu': 0.05554760892134256, 'prior_sigma': 0.0723472704312228, 'normalization': 'none'}. Best is trial 2329 with value: 0.5157062888145447.
Generating morgan fingerprints...
Generated fingerprints with 2048 features for 900 molecules
Data shape: X=(900, 2048), y=(900,)
Trial 2339: 5-fold CV loss = 0.5392
[I 2025-08-08 05:38:29,913] Trial 2339 finished with value: 0.5391630232334137 and parameters: {'fp_type': 'morgan', 'morgan_only_radius': 2, 'morgan_only_nBits': 2048, 'num_hidden_layers': 3, 'hidden_dim_0': 1024, 'hidden_dim_1': 64, 'hidden_dim_2': 1024, 'kl_weight': 0.0008402523059887492, 'lr': 0.0029044173857738047, 'batch_size': 64, 'dropout_rate': 0.41587669269807004, 'prior_mu': 0.015999290818875765, 'prior_sigma': 0.08625746634926544, 'normalization': 'none'}. Best is trial 2329 with value: 0.5157062888145447.
Generating morgan fingerprints...
Generated fingerprints with 2048 features for 900 molecules
Data shape: X=(900, 2048), y=(900,)
Trial 2335: 5-fold CV loss = 0.5836
[I 2025-08-08 05:38:43,319] Trial 2335 finished with value: 0.5836423635482788 and parameters: {'fp_type': 'morgan', 'morgan_only_radius': 2, 'morgan_only_nBits': 2048, 'num_hidden_layers': 3, 'hidden_dim_0': 512, 'hidden_dim_1': 64, 'hidden_dim_2': 256, 'kl_weight': 0.0005038095613980492, 'lr': 0.0015719055085176355, 'batch_size': 32, 'dropout_rate': 0.4408548148705337, 'prior_mu': 0.057006126528332195, 'prior_sigma': 0.05629878404906658, 'normalization': 'none'}. Best is trial 2329 with value: 0.5157062888145447.
Generating morgan fingerprints...
Generated fingerprints with 2048 features for 900 molecules
Data shape: X=(900, 2048), y=(900,)
Trial 2340: 5-fold CV loss = 0.6154
[I 2025-08-08 05:38:45,213] Trial 2340 finished with value: 0.6153658628463745 and parameters: {'fp_type': 'morgan', 'morgan_only_radius': 2, 'morgan_only_nBits': 2048, 'num_hidden_layers': 3, 'hidden_dim_0': 512, 'hidden_dim_1': 64, 'hidden_dim_2': 256, 'kl_weight': 0.0008429435615178714, 'lr': 0.0033260364768364, 'batch_size': 64, 'dropout_rate': 0.45319589646097724, 'prior_mu': 0.023061478829774815, 'prior_sigma': 0.0850597166256306, 'normalization': 'none'}. Best is trial 2329 with value: 0.5157062888145447.
Generating morgan fingerprints...
Generated fingerprints with 2048 features for 900 molecules
Data shape: X=(900, 2048), y=(900,)
Trial 2338: 5-fold CV loss = 0.5383
[I 2025-08-08 05:39:03,195] Trial 2338 finished with value: 0.5383019983768463 and parameters: {'fp_type': 'morgan', 'morgan_only_radius': 2, 'morgan_only_nBits': 2048, 'num_hidden_layers': 3, 'hidden_dim_0': 512, 'hidden_dim_1': 64, 'hidden_dim_2': 1024, 'kl_weight': 0.0008403152034299197, 'lr': 0.0043340383470686335, 'batch_size': 64, 'dropout_rate': 0.4491414451769545, 'prior_mu': 0.014203608859846777, 'prior_sigma': 0.08733686947628438, 'normalization': 'none'}. Best is trial 2329 with value: 0.5157062888145447.
Generating morgan fingerprints...
Generated fingerprints with 2048 features for 900 molecules
Data shape: X=(900, 2048), y=(900,)
Trial 2341: 5-fold CV loss = 0.6153
[I 2025-08-08 05:39:07,536] Trial 2341 finished with value: 0.6153047740459442 and parameters: {'fp_type': 'morgan', 'morgan_only_radius': 2, 'morgan_only_nBits': 2048, 'num_hidden_layers': 3, 'hidden_dim_0': 512, 'hidden_dim_1': 64, 'hidden_dim_2': 256, 'kl_weight': 0.0008549462699321142, 'lr': 0.0031992023620118883, 'batch_size': 64, 'dropout_rate': 0.4488512561980671, 'prior_mu': 0.021481461873765914, 'prior_sigma': 0.09110494689378537, 'normalization': 'layer'}. Best is trial 2329 with value: 0.5157062888145447.
Generating morgan fingerprints...
Generated fingerprints with 2048 features for 900 molecules
Data shape: X=(900, 2048), y=(900,)
Trial 2343: 5-fold CV loss = 0.5419
[I 2025-08-08 05:39:17,280] Trial 2343 finished with value: 0.5419438183307648 and parameters: {'fp_type': 'morgan', 'morgan_only_radius': 2, 'morgan_only_nBits': 2048, 'num_hidden_layers': 3, 'hidden_dim_0': 512, 'hidden_dim_1': 1024, 'hidden_dim_2': 128, 'kl_weight': 0.0009149303654242408, 'lr': 0.003325708949651918, 'batch_size': 64, 'dropout_rate': 0.4004068330228893, 'prior_mu': 0.023547011293595717, 'prior_sigma': 0.08286871270345049, 'normalization': 'layer'}. Best is trial 2329 with value: 0.5157062888145447.
Generating morgan fingerprints...
Generated fingerprints with 2048 features for 900 molecules
Data shape: X=(900, 2048), y=(900,)
Trial 2346: 5-fold CV loss = 0.7966
[I 2025-08-08 05:39:37,006] Trial 2346 finished with value: 0.7965946435928345 and parameters: {'fp_type': 'morgan', 'morgan_only_radius': 2, 'morgan_only_nBits': 2048, 'num_hidden_layers': 3, 'hidden_dim_0': 512, 'hidden_dim_1': 1024, 'hidden_dim_2': 256, 'kl_weight': 0.0010290544457051728, 'lr': 0.0029749419003157534, 'batch_size': 64, 'dropout_rate': 0.4210910660725152, 'prior_mu': 0.02473703449263941, 'prior_sigma': 0.08074661274780232, 'normalization': 'none'}. Best is trial 2329 with value: 0.5157062888145447.
Generating morgan fingerprints...
Generated fingerprints with 2048 features for 900 molecules
Data shape: X=(900, 2048), y=(900,)
Trial 2342: 5-fold CV loss = 0.5431
[I 2025-08-08 05:39:37,578] Trial 2342 finished with value: 0.543091094493866 and parameters: {'fp_type': 'morgan', 'morgan_only_radius': 2, 'morgan_only_nBits': 2048, 'num_hidden_layers': 3, 'hidden_dim_0': 512, 'hidden_dim_1': 1024, 'hidden_dim_2': 256, 'kl_weight': 0.0008768839855842203, 'lr': 0.0037387856788490092, 'batch_size': 64, 'dropout_rate': 0.452368490865051, 'prior_mu': 0.020652631074078078, 'prior_sigma': 0.08312107786268691, 'normalization': 'layer'}. Best is trial 2329 with value: 0.5157062888145447.
Generating morgan fingerprints...
Generated fingerprints with 2048 features for 900 molecules
Data shape: X=(900, 2048), y=(900,)
Trial 2345: 5-fold CV loss = 0.5806
[I 2025-08-08 05:39:51,461] Trial 2345 finished with value: 0.5805733919143676 and parameters: {'fp_type': 'morgan', 'morgan_only_radius': 2, 'morgan_only_nBits': 2048, 'num_hidden_layers': 3, 'hidden_dim_0': 512, 'hidden_dim_1': 64, 'hidden_dim_2': 128, 'kl_weight': 0.000998118503131082, 'lr': 0.0036169545592264056, 'batch_size': 64, 'dropout_rate': 0.39956052718933976, 'prior_mu': 0.02610646530151025, 'prior_sigma': 0.08295044941494936, 'normalization': 'none'}. Best is trial 2329 with value: 0.5157062888145447.
Generating morgan fingerprints...
Generated fingerprints with 2048 features for 900 molecules
Data shape: X=(900, 2048), y=(900,)
Trial 2347: 5-fold CV loss = 0.9586
[I 2025-08-08 05:40:06,045] Trial 2347 finished with value: 0.9585764169692993 and parameters: {'fp_type': 'morgan', 'morgan_only_radius': 2, 'morgan_only_nBits': 2048, 'num_hidden_layers': 3, 'hidden_dim_0': 512, 'hidden_dim_1': 64, 'hidden_dim_2': 256, 'kl_weight': 0.000806651566958926, 'lr': 0.0004521417120041732, 'batch_size': 32, 'dropout_rate': 0.45775838337214014, 'prior_mu': 0.026975385481685217, 'prior_sigma': 0.08098308170273788, 'normalization': 'none'}. Best is trial 2329 with value: 0.5157062888145447.
Generating morgan fingerprints...
Generated fingerprints with 2048 features for 900 molecules
Data shape: X=(900, 2048), y=(900,)
Trial 2350: 5-fold CV loss = 0.8773
[I 2025-08-08 05:40:19,843] Trial 2350 finished with value: 0.8773140549659729 and parameters: {'fp_type': 'morgan', 'morgan_only_radius': 2, 'morgan_only_nBits': 2048, 'num_hidden_layers': 3, 'hidden_dim_0': 512, 'hidden_dim_1': 512, 'hidden_dim_2': 256, 'kl_weight': 0.0007466960436280093, 'lr': 0.002993312030640309, 'batch_size': 64, 'dropout_rate': 0.4246391782077341, 'prior_mu': 0.03220995143091554, 'prior_sigma': 0.07803011318512844, 'normalization': 'none'}. Best is trial 2329 with value: 0.5157062888145447.
Generating morgan_rdkit fingerprints...
Generated fingerprints with 1280 features for 900 molecules
Data shape: X=(900, 1280), y=(900,)
Trial 2351: 5-fold CV loss = 0.5741
[I 2025-08-08 05:40:41,474] Trial 2351 finished with value: 0.5741205632686615 and parameters: {'fp_type': 'morgan_rdkit', 'combined_morgan_radius': 3, 'combined_morgan_nBits': 1024, 'combined_rdkit_maxPath': 7, 'combined_rdkit_nBits': 256, 'num_hidden_layers': 3, 'hidden_dim_0': 256, 'hidden_dim_1': 64, 'hidden_dim_2': 256, 'kl_weight': 0.0007878803063980524, 'lr': 0.004176681618983248, 'batch_size': 64, 'dropout_rate': 0.43917442320345573, 'prior_mu': 0.03564177851384561, 'prior_sigma': 0.06133034750553208, 'normalization': 'none'}. Best is trial 2329 with value: 0.5157062888145447.
Generating morgan fingerprints...
Generated fingerprints with 2048 features for 900 molecules
Data shape: X=(900, 2048), y=(900,)
Trial 2349: 5-fold CV loss = 0.5223
[I 2025-08-08 05:40:45,986] Trial 2349 finished with value: 0.5223027348518372 and parameters: {'fp_type': 'morgan', 'morgan_only_radius': 2, 'morgan_only_nBits': 2048, 'num_hidden_layers': 3, 'hidden_dim_0': 512, 'hidden_dim_1': 64, 'hidden_dim_2': 256, 'kl_weight': 0.0007340691611576888, 'lr': 0.003431892443435492, 'batch_size': 64, 'dropout_rate': 0.42707415406752847, 'prior_mu': 0.029869824373425224, 'prior_sigma': 0.07848568161663365, 'normalization': 'none'}. Best is trial 2329 with value: 0.5157062888145447.
Generating morgan fingerprints...
Generated fingerprints with 2048 features for 900 molecules
Data shape: X=(900, 2048), y=(900,)
Trial 2348: 5-fold CV loss = 0.5830
[I 2025-08-08 05:40:47,694] Trial 2348 finished with value: 0.5829692184925079 and parameters: {'fp_type': 'morgan', 'morgan_only_radius': 2, 'morgan_only_nBits': 2048, 'num_hidden_layers': 3, 'hidden_dim_0': 512, 'hidden_dim_1': 64, 'hidden_dim_2': 256, 'kl_weight': 0.0007621260965606627, 'lr': 0.0036059954685403826, 'batch_size': 64, 'dropout_rate': 0.45916594352847884, 'prior_mu': 0.02907762374087435, 'prior_sigma': 0.0790540856769697, 'normalization': 'none'}. Best is trial 2329 with value: 0.5157062888145447.
Generating morgan fingerprints...
Generated fingerprints with 2048 features for 900 molecules
Data shape: X=(900, 2048), y=(900,)
Trial 2344: 5-fold CV loss = 0.5341
[I 2025-08-08 05:41:06,877] Trial 2344 finished with value: 0.5341276168823242 and parameters: {'fp_type': 'morgan', 'morgan_only_radius': 2, 'morgan_only_nBits': 2048, 'num_hidden_layers': 3, 'hidden_dim_0': 512, 'hidden_dim_1': 64, 'hidden_dim_2': 128, 'kl_weight': 0.0009979093449910788, 'lr': 0.003695009483031422, 'batch_size': 64, 'dropout_rate': 0.4239791689201307, 'prior_mu': 0.025203238493137135, 'prior_sigma': 0.08261822740559185, 'normalization': 'layer'}. Best is trial 2329 with value: 0.5157062888145447.
Generating morgan fingerprints...
Generated fingerprints with 2048 features for 900 molecules
Data shape: X=(900, 2048), y=(900,)
Trial 2352: 5-fold CV loss = 0.5711
[I 2025-08-08 05:41:18,375] Trial 2352 finished with value: 0.5710749685764313 and parameters: {'fp_type': 'morgan', 'morgan_only_radius': 2, 'morgan_only_nBits': 2048, 'num_hidden_layers': 3, 'hidden_dim_0': 64, 'hidden_dim_1': 64, 'hidden_dim_2': 256, 'kl_weight': 0.0006998732909558641, 'lr': 0.0037744830429135533, 'batch_size': 64, 'dropout_rate': 0.42619940437439774, 'prior_mu': 0.010641508095341277, 'prior_sigma': 0.06302070564187293, 'normalization': 'none'}. Best is trial 2329 with value: 0.5157062888145447.
Generating morgan fingerprints...
Generated fingerprints with 2048 features for 900 molecules
Data shape: X=(900, 2048), y=(900,)
Trial 2353: 5-fold CV loss = 0.5309
[I 2025-08-08 05:41:23,375] Trial 2353 finished with value: 0.5309266209602356 and parameters: {'fp_type': 'morgan', 'morgan_only_radius': 2, 'morgan_only_nBits': 2048, 'num_hidden_layers': 3, 'hidden_dim_0': 512, 'hidden_dim_1': 64, 'hidden_dim_2': 256, 'kl_weight': 0.000695260927437227, 'lr': 0.004604114175078392, 'batch_size': 64, 'dropout_rate': 0.4080208581145299, 'prior_mu': 0.016886476306843895, 'prior_sigma': 0.06343837770819225, 'normalization': 'none'}. Best is trial 2329 with value: 0.5157062888145447.
Generating morgan fingerprints...
Generated fingerprints with 2048 features for 900 molecules
Data shape: X=(900, 2048), y=(900,)
Trial 2356: 5-fold CV loss = 0.8221
[I 2025-08-08 05:41:34,927] Trial 2356 finished with value: 0.8220771193504334 and parameters: {'fp_type': 'morgan', 'morgan_only_radius': 2, 'morgan_only_nBits': 2048, 'num_hidden_layers': 3, 'hidden_dim_0': 512, 'hidden_dim_1': 512, 'hidden_dim_2': 64, 'kl_weight': 0.0006932068970479593, 'lr': 0.0033988590832293125, 'batch_size': 64, 'dropout_rate': 0.383938251619929, 'prior_mu': 0.01975163122970782, 'prior_sigma': 0.0990125275068923, 'normalization': 'none'}. Best is trial 2329 with value: 0.5157062888145447.
Generating morgan fingerprints...
Generated fingerprints with 2048 features for 900 molecules
Data shape: X=(900, 2048), y=(900,)
Trial 2354: 5-fold CV loss = 0.5594
[I 2025-08-08 05:41:49,526] Trial 2354 finished with value: 0.5594306528568268 and parameters: {'fp_type': 'morgan', 'morgan_only_radius': 2, 'morgan_only_nBits': 2048, 'num_hidden_layers': 3, 'hidden_dim_0': 64, 'hidden_dim_1': 256, 'hidden_dim_2': 256, 'kl_weight': 0.0006773442790440826, 'lr': 0.0035253165787422036, 'batch_size': 64, 'dropout_rate': 0.35947221666184004, 'prior_mu': 0.01815788143462048, 'prior_sigma': 0.06397806278555858, 'normalization': 'none'}. Best is trial 2329 with value: 0.5157062888145447.
Generating morgan fingerprints...
Generated fingerprints with 2048 features for 900 molecules
Data shape: X=(900, 2048), y=(900,)
Trial 2359: 5-fold CV loss = 0.6629
[I 2025-08-08 05:42:08,406] Trial 2359 finished with value: 0.6628714561462402 and parameters: {'fp_type': 'morgan', 'morgan_only_radius': 2, 'morgan_only_nBits': 2048, 'num_hidden_layers': 0, 'kl_weight': 0.0009092576728133605, 'lr': 0.0033476830179763706, 'batch_size': 64, 'dropout_rate': 0.4384735983865168, 'prior_mu': 0.03637911363755894, 'prior_sigma': 0.07245255345965593, 'normalization': 'none'}. Best is trial 2329 with value: 0.5157062888145447.
Generating morgan fingerprints...
Generated fingerprints with 2048 features for 900 molecules
Data shape: X=(900, 2048), y=(900,)
Trial 2357: 5-fold CV loss = 0.5882
[I 2025-08-08 05:42:10,519] Trial 2357 finished with value: 0.5882098317146301 and parameters: {'fp_type': 'morgan', 'morgan_only_radius': 2, 'morgan_only_nBits': 2048, 'num_hidden_layers': 3, 'hidden_dim_0': 512, 'hidden_dim_1': 256, 'hidden_dim_2': 512, 'kl_weight': 0.0006725503843658589, 'lr': 0.003252077053178682, 'batch_size': 64, 'dropout_rate': 0.43819693540372223, 'prior_mu': 0.03778158730623023, 'prior_sigma': 0.0717307821749657, 'normalization': 'none'}. Best is trial 2329 with value: 0.5157062888145447.
Generating morgan fingerprints...
Generated fingerprints with 2048 features for 900 molecules
Data shape: X=(900, 2048), y=(900,)
Trial 2358: 5-fold CV loss = 0.5260
[I 2025-08-08 05:42:22,280] Trial 2358 finished with value: 0.5259536683559418 and parameters: {'fp_type': 'morgan', 'morgan_only_radius': 2, 'morgan_only_nBits': 2048, 'num_hidden_layers': 3, 'hidden_dim_0': 512, 'hidden_dim_1': 128, 'hidden_dim_2': 512, 'kl_weight': 0.0011040040627444097, 'lr': 0.003287653788689117, 'batch_size': 64, 'dropout_rate': 0.4342877224868274, 'prior_mu': 0.03395666436465134, 'prior_sigma': 0.07256343778753897, 'normalization': 'none'}. Best is trial 2329 with value: 0.5157062888145447.
Generating morgan fingerprints...
Generated fingerprints with 2048 features for 900 molecules
Data shape: X=(900, 2048), y=(900,)
Trial 2361: 5-fold CV loss = 0.7280
[I 2025-08-08 05:42:25,270] Trial 2361 finished with value: 0.7279798150062561 and parameters: {'fp_type': 'morgan', 'morgan_only_radius': 2, 'morgan_only_nBits': 2048, 'num_hidden_layers': 2, 'hidden_dim_0': 512, 'hidden_dim_1': 128, 'kl_weight': 0.0010710145753690527, 'lr': 0.0035724778064977307, 'batch_size': 64, 'dropout_rate': 0.40986629529136503, 'prior_mu': 0.037198304075640586, 'prior_sigma': 0.06780323581262845, 'normalization': 'none'}. Best is trial 2329 with value: 0.5157062888145447.
Generating morgan fingerprints...
Generated fingerprints with 2048 features for 900 molecules
Data shape: X=(900, 2048), y=(900,)
Trial 2360: 5-fold CV loss = 0.7153
