[I 2025-08-07 21:00:50,886] Trial 911 finished with value: 0.5261356174945832 and parameters: {'fp_type': 'morgan', 'morgan_only_radius': 2, 'morgan_only_nBits': 1024, 'num_hidden_layers': 3, 'hidden_dim_0': 512, 'hidden_dim_1': 128, 'hidden_dim_2': 512, 'kl_weight': 0.003446658908296036, 'lr': 0.0021764243505662533, 'batch_size': 32, 'dropout_rate': 0.49190738144096985, 'prior_mu': 0.013950271794059384, 'prior_sigma': 0.055326183578325076, 'normalization': 'none'}. Best is trial 272 with value: 0.5198344707489013.
Generating morgan fingerprints...
Generated fingerprints with 1024 features for 900 molecules
Data shape: X=(900, 1024), y=(900,)
Trial 912: 5-fold CV loss = 0.5287
[I 2025-08-07 21:01:06,971] Trial 912 finished with value: 0.5286798417568207 and parameters: {'fp_type': 'morgan', 'morgan_only_radius': 2, 'morgan_only_nBits': 1024, 'num_hidden_layers': 3, 'hidden_dim_0': 512, 'hidden_dim_1': 128, 'hidden_dim_2': 512, 'kl_weight': 0.003707541354835709, 'lr': 0.0028849897296873944, 'batch_size': 32, 'dropout_rate': 0.48213725114853134, 'prior_mu': 0.009160333223263602, 'prior_sigma': 0.05614599958861427, 'normalization': 'none'}. Best is trial 272 with value: 0.5198344707489013.
Generating morgan fingerprints...
Generated fingerprints with 1024 features for 900 molecules
Data shape: X=(900, 1024), y=(900,)
Trial 909: 5-fold CV loss = 0.5498
[I 2025-08-07 21:01:08,569] Trial 909 finished with value: 0.5498369455337524 and parameters: {'fp_type': 'morgan', 'morgan_only_radius': 2, 'morgan_only_nBits': 1024, 'num_hidden_layers': 3, 'hidden_dim_0': 512, 'hidden_dim_1': 128, 'hidden_dim_2': 512, 'kl_weight': 0.0012710211200637686, 'lr': 0.0017841983871048224, 'batch_size': 32, 'dropout_rate': 0.48922231801152893, 'prior_mu': -0.04205004362419506, 'prior_sigma': 0.06298395699133254, 'normalization': 'none'}. Best is trial 272 with value: 0.5198344707489013.
Generating morgan fingerprints...
Generated fingerprints with 1024 features for 900 molecules
Data shape: X=(900, 1024), y=(900,)
Trial 914: 5-fold CV loss = 0.7629
[I 2025-08-07 21:01:16,784] Trial 914 finished with value: 0.7628733038902282 and parameters: {'fp_type': 'morgan', 'morgan_only_radius': 2, 'morgan_only_nBits': 1024, 'num_hidden_layers': 3, 'hidden_dim_0': 512, 'hidden_dim_1': 128, 'hidden_dim_2': 512, 'kl_weight': 0.0013163270781432982, 'lr': 0.002428183983918641, 'batch_size': 128, 'dropout_rate': 0.48223050127270667, 'prior_mu': -0.014669975935754904, 'prior_sigma': 0.06580301578883344, 'normalization': 'none'}. Best is trial 272 with value: 0.5198344707489013.
Generating morgan fingerprints...
Generated fingerprints with 1024 features for 900 molecules
Data shape: X=(900, 1024), y=(900,)
Trial 915: 5-fold CV loss = 0.7414
[I 2025-08-07 21:01:22,480] Trial 915 finished with value: 0.741364324092865 and parameters: {'fp_type': 'morgan', 'morgan_only_radius': 2, 'morgan_only_nBits': 1024, 'num_hidden_layers': 3, 'hidden_dim_0': 512, 'hidden_dim_1': 128, 'hidden_dim_2': 512, 'kl_weight': 0.0018568728353039517, 'lr': 0.00244378135318247, 'batch_size': 128, 'dropout_rate': 0.4574524120425666, 'prior_mu': 0.05901229541031261, 'prior_sigma': 0.06637771205098972, 'normalization': 'none'}. Best is trial 272 with value: 0.5198344707489013.
Generating morgan fingerprints...
Generated fingerprints with 2048 features for 900 molecules
Data shape: X=(900, 2048), y=(900,)
Trial 905: 5-fold CV loss = 0.5279
[I 2025-08-07 21:01:24,407] Trial 905 finished with value: 0.5279110968112946 and parameters: {'fp_type': 'morgan', 'morgan_only_radius': 2, 'morgan_only_nBits': 2048, 'num_hidden_layers': 3, 'hidden_dim_0': 512, 'hidden_dim_1': 128, 'hidden_dim_2': 512, 'kl_weight': 0.0011277642917601187, 'lr': 0.00203279193161657, 'batch_size': 32, 'dropout_rate': 0.4792771417806564, 'prior_mu': -0.040591622484491705, 'prior_sigma': 0.06895666566058285, 'normalization': 'none'}. Best is trial 272 with value: 0.5198344707489013.
Generating morgan fingerprints...
Generated fingerprints with 1024 features for 900 molecules
Data shape: X=(900, 1024), y=(900,)
Trial 913: 5-fold CV loss = 0.5321
[I 2025-08-07 21:01:52,317] Trial 913 finished with value: 0.5320648968219757 and parameters: {'fp_type': 'morgan', 'morgan_only_radius': 2, 'morgan_only_nBits': 1024, 'num_hidden_layers': 3, 'hidden_dim_0': 512, 'hidden_dim_1': 128, 'hidden_dim_2': 512, 'kl_weight': 0.0013014583620097142, 'lr': 0.0029540289712727806, 'batch_size': 32, 'dropout_rate': 0.4847589862818926, 'prior_mu': -0.025402408313442475, 'prior_sigma': 0.06619899542861402, 'normalization': 'none'}. Best is trial 272 with value: 0.5198344707489013.
Generating morgan fingerprints...
Generated fingerprints with 2048 features for 900 molecules
Data shape: X=(900, 2048), y=(900,)
Trial 917: 5-fold CV loss = 0.7884
[I 2025-08-07 21:01:55,936] Trial 917 finished with value: 0.7883967757225037 and parameters: {'fp_type': 'morgan', 'morgan_only_radius': 2, 'morgan_only_nBits': 2048, 'num_hidden_layers': 1, 'hidden_dim_0': 512, 'kl_weight': 0.004553538601695969, 'lr': 0.001969452644243256, 'batch_size': 32, 'dropout_rate': 0.4764104207876511, 'prior_mu': -0.026948402660213144, 'prior_sigma': 0.07005810511522725, 'normalization': 'none'}. Best is trial 272 with value: 0.5198344707489013.
Generating morgan fingerprints...
Generated fingerprints with 1024 features for 900 molecules
Data shape: X=(900, 1024), y=(900,)
Trial 916: 5-fold CV loss = 0.5289
[I 2025-08-07 21:02:51,997] Trial 916 finished with value: 0.5289465248584747 and parameters: {'fp_type': 'morgan', 'morgan_only_radius': 2, 'morgan_only_nBits': 1024, 'num_hidden_layers': 3, 'hidden_dim_0': 512, 'hidden_dim_1': 128, 'hidden_dim_2': 512, 'kl_weight': 0.0019146238034972723, 'lr': 0.0019863621876315476, 'batch_size': 32, 'dropout_rate': 0.4568020873908517, 'prior_mu': -0.024064985344639335, 'prior_sigma': 0.07220963158675445, 'normalization': 'none'}. Best is trial 272 with value: 0.5198344707489013.
Generating morgan fingerprints...
Generated fingerprints with 1024 features for 900 molecules
Data shape: X=(900, 1024), y=(900,)
Trial 919: 5-fold CV loss = 0.5237
[I 2025-08-07 21:03:01,934] Trial 919 finished with value: 0.5237164437770844 and parameters: {'fp_type': 'morgan', 'morgan_only_radius': 2, 'morgan_only_nBits': 2048, 'num_hidden_layers': 3, 'hidden_dim_0': 512, 'hidden_dim_1': 128, 'hidden_dim_2': 512, 'kl_weight': 0.0015033435691794305, 'lr': 0.0022075858592308, 'batch_size': 32, 'dropout_rate': 0.45392218994966843, 'prior_mu': 0.021121394078816504, 'prior_sigma': 0.07303779557862912, 'normalization': 'none'}. Best is trial 272 with value: 0.5198344707489013.
Generating morgan fingerprints...
Generated fingerprints with 2048 features for 900 molecules
Data shape: X=(900, 2048), y=(900,)
Trial 922: 5-fold CV loss = 0.5327
[I 2025-08-07 21:03:56,008] Trial 922 finished with value: 0.5326947450637818 and parameters: {'fp_type': 'morgan', 'morgan_only_radius': 2, 'morgan_only_nBits': 2048, 'num_hidden_layers': 3, 'hidden_dim_0': 512, 'hidden_dim_1': 128, 'hidden_dim_2': 512, 'kl_weight': 0.0016079737404418246, 'lr': 0.002724079870743087, 'batch_size': 32, 'dropout_rate': 0.49971824219025973, 'prior_mu': 0.0245873990951221, 'prior_sigma': 0.0795263757471828, 'normalization': 'none'}. Best is trial 272 with value: 0.5198344707489013.
Generating morgan fingerprints...
Generated fingerprints with 2048 features for 900 molecules
Data shape: X=(900, 2048), y=(900,)
Trial 920: 5-fold CV loss = 0.5285
[I 2025-08-07 21:04:11,278] Trial 920 finished with value: 0.5285244762897492 and parameters: {'fp_type': 'morgan', 'morgan_only_radius': 2, 'morgan_only_nBits': 1024, 'num_hidden_layers': 3, 'hidden_dim_0': 512, 'hidden_dim_1': 128, 'hidden_dim_2': 512, 'kl_weight': 0.0015533211672748386, 'lr': 0.0021599423040977958, 'batch_size': 32, 'dropout_rate': 0.46030033008248605, 'prior_mu': 0.027983761969697693, 'prior_sigma': 0.07692957830685024, 'normalization': 'none'}. Best is trial 272 with value: 0.5198344707489013.
Generating morgan fingerprints...
Generated fingerprints with 2048 features for 900 molecules
Data shape: X=(900, 2048), y=(900,)
Trial 921: 5-fold CV loss = 0.5357
[I 2025-08-07 21:04:16,576] Trial 921 finished with value: 0.5356585562229157 and parameters: {'fp_type': 'morgan', 'morgan_only_radius': 2, 'morgan_only_nBits': 1024, 'num_hidden_layers': 3, 'hidden_dim_0': 512, 'hidden_dim_1': 128, 'hidden_dim_2': 512, 'kl_weight': 0.001546704456253967, 'lr': 0.0022512222536362433, 'batch_size': 32, 'dropout_rate': 0.49191136732858654, 'prior_mu': 0.002307031495608073, 'prior_sigma': 0.038652863213068184, 'normalization': 'none'}. Best is trial 272 with value: 0.5198344707489013.
Generating morgan fingerprints...
Generated fingerprints with 2048 features for 900 molecules
Data shape: X=(900, 2048), y=(900,)
Trial 923: 5-fold CV loss = 0.5296
[I 2025-08-07 21:04:51,305] Trial 923 finished with value: 0.5296254634857178 and parameters: {'fp_type': 'morgan', 'morgan_only_radius': 2, 'morgan_only_nBits': 2048, 'num_hidden_layers': 3, 'hidden_dim_0': 512, 'hidden_dim_1': 128, 'hidden_dim_2': 512, 'kl_weight': 0.0014315472109478185, 'lr': 0.0023158532517640927, 'batch_size': 32, 'dropout_rate': 0.4560106115418304, 'prior_mu': 0.03681674063885464, 'prior_sigma': 0.0759041780157393, 'normalization': 'none'}. Best is trial 272 with value: 0.5198344707489013.
Generating morgan fingerprints...
Generated fingerprints with 2048 features for 900 molecules
Data shape: X=(900, 2048), y=(900,)
Trial 918: 5-fold CV loss = 0.5339
[I 2025-08-07 21:05:20,100] Trial 918 finished with value: 0.533859270811081 and parameters: {'fp_type': 'morgan', 'morgan_only_radius': 2, 'morgan_only_nBits': 1024, 'num_hidden_layers': 3, 'hidden_dim_0': 512, 'hidden_dim_1': 128, 'hidden_dim_2': 512, 'kl_weight': 0.0014677742718875156, 'lr': 0.0021786907744857065, 'batch_size': 32, 'dropout_rate': 0.4601575546489662, 'prior_mu': -0.025243815479575816, 'prior_sigma': 0.07774944966558872, 'normalization': 'none'}. Best is trial 272 with value: 0.5198344707489013.
Generating morgan fingerprints...
Generated fingerprints with 2048 features for 900 molecules
Data shape: X=(900, 2048), y=(900,)
Trial 925: 5-fold CV loss = 0.5313
[I 2025-08-07 21:06:00,943] Trial 925 finished with value: 0.531339579820633 and parameters: {'fp_type': 'morgan', 'morgan_only_radius': 2, 'morgan_only_nBits': 2048, 'num_hidden_layers': 3, 'hidden_dim_0': 128, 'hidden_dim_1': 128, 'hidden_dim_2': 512, 'kl_weight': 0.0014132059830194272, 'lr': 0.0026025863347051, 'batch_size': 32, 'dropout_rate': 0.44295925641875794, 'prior_mu': 0.01568077886561356, 'prior_sigma': 0.0765842040731693, 'normalization': 'none'}. Best is trial 272 with value: 0.5198344707489013.
Generating morgan fingerprints...
Generated fingerprints with 2048 features for 900 molecules
Data shape: X=(900, 2048), y=(900,)
Trial 924: 5-fold CV loss = 0.5386
[I 2025-08-07 21:06:09,015] Trial 924 finished with value: 0.5385872662067414 and parameters: {'fp_type': 'morgan', 'morgan_only_radius': 3, 'morgan_only_nBits': 2048, 'num_hidden_layers': 3, 'hidden_dim_0': 512, 'hidden_dim_1': 128, 'hidden_dim_2': 512, 'kl_weight': 0.0014503947384225573, 'lr': 0.002297557435990624, 'batch_size': 32, 'dropout_rate': 0.4514078370503065, 'prior_mu': 0.04089228979334186, 'prior_sigma': 0.08090393094525651, 'normalization': 'none'}. Best is trial 272 with value: 0.5198344707489013.
Generating morgan fingerprints...
Generated fingerprints with 2048 features for 900 molecules
Data shape: X=(900, 2048), y=(900,)
Trial 926: 5-fold CV loss = 0.5451
[I 2025-08-07 21:06:19,739] Trial 926 finished with value: 0.5451220691204071 and parameters: {'fp_type': 'morgan', 'morgan_only_radius': 2, 'morgan_only_nBits': 2048, 'num_hidden_layers': 3, 'hidden_dim_0': 128, 'hidden_dim_1': 128, 'hidden_dim_2': 512, 'kl_weight': 0.0012077023942504846, 'lr': 0.0024802748091042348, 'batch_size': 32, 'dropout_rate': 0.44965718530768356, 'prior_mu': 0.019326030612928414, 'prior_sigma': 0.07874309958565892, 'normalization': 'none'}. Best is trial 272 with value: 0.5198344707489013.
Generating morgan_rdkit fingerprints...
Generated fingerprints with 768 features for 900 molecules
Data shape: X=(900, 768), y=(900,)
Trial 928: 5-fold CV loss = 0.5344
[I 2025-08-07 21:07:03,776] Trial 928 finished with value: 0.5343591392040252 and parameters: {'fp_type': 'morgan', 'morgan_only_radius': 3, 'morgan_only_nBits': 2048, 'num_hidden_layers': 3, 'hidden_dim_0': 512, 'hidden_dim_1': 128, 'hidden_dim_2': 512, 'kl_weight': 0.0011701318474031342, 'lr': 0.0024856020383722008, 'batch_size': 32, 'dropout_rate': 0.44735676560661286, 'prior_mu': 0.013471561009385659, 'prior_sigma': 0.08154393690191436, 'normalization': 'none'}. Best is trial 272 with value: 0.5198344707489013.
Generating morgan_rdkit fingerprints...
Generated fingerprints with 768 features for 900 molecules
Data shape: X=(900, 768), y=(900,)
Trial 927: 5-fold CV loss = 0.7359
[I 2025-08-07 21:07:07,654] Trial 927 finished with value: 0.7358961939811707 and parameters: {'fp_type': 'morgan', 'morgan_only_radius': 3, 'morgan_only_nBits': 2048, 'num_hidden_layers': 2, 'hidden_dim_0': 128, 'hidden_dim_1': 128, 'kl_weight': 0.00016574658917414313, 'lr': 0.002565304898429284, 'batch_size': 32, 'dropout_rate': 0.07206826009722284, 'prior_mu': 0.04611927163047311, 'prior_sigma': 0.08199266699887332, 'normalization': 'none'}. Best is trial 272 with value: 0.5198344707489013.
Generating morgan fingerprints...
Generated fingerprints with 2048 features for 900 molecules
Data shape: X=(900, 2048), y=(900,)
Trial 930: 5-fold CV loss = 0.6070
[I 2025-08-07 21:07:12,727] Trial 930 finished with value: 0.6070356607437134 and parameters: {'fp_type': 'morgan_rdkit', 'combined_morgan_radius': 3, 'combined_morgan_nBits': 512, 'combined_rdkit_maxPath': 6, 'combined_rdkit_nBits': 256, 'num_hidden_layers': 3, 'hidden_dim_0': 512, 'hidden_dim_1': 128, 'hidden_dim_2': 512, 'kl_weight': 0.007081280802021913, 'lr': 0.002815742921222863, 'batch_size': 32, 'dropout_rate': 0.49138439623308877, 'prior_mu': 0.04937254581658579, 'prior_sigma': 0.07383595243122831, 'normalization': 'none'}. Best is trial 272 with value: 0.5198344707489013.
Generating morgan fingerprints...
Generated fingerprints with 2048 features for 900 molecules
Data shape: X=(900, 2048), y=(900,)
Trial 929: 5-fold CV loss = 0.6416
[I 2025-08-07 21:07:36,792] Trial 929 finished with value: 0.6416457772254944 and parameters: {'fp_type': 'morgan', 'morgan_only_radius': 2, 'morgan_only_nBits': 2048, 'num_hidden_layers': 2, 'hidden_dim_0': 512, 'hidden_dim_1': 128, 'kl_weight': 0.0012383532461986103, 'lr': 0.002527113656231453, 'batch_size': 32, 'dropout_rate': 0.499476383132574, 'prior_mu': 0.01813161127692907, 'prior_sigma': 0.08406033373801819, 'normalization': 'none'}. Best is trial 272 with value: 0.5198344707489013.
Generating morgan fingerprints...
Generated fingerprints with 2048 features for 900 molecules
Data shape: X=(900, 2048), y=(900,)
Trial 931: 5-fold CV loss = 0.6324
[I 2025-08-07 21:07:43,091] Trial 931 finished with value: 0.6323917508125305 and parameters: {'fp_type': 'morgan_rdkit', 'combined_morgan_radius': 3, 'combined_morgan_nBits': 512, 'combined_rdkit_maxPath': 6, 'combined_rdkit_nBits': 256, 'num_hidden_layers': 3, 'hidden_dim_0': 512, 'hidden_dim_1': 128, 'hidden_dim_2': 512, 'kl_weight': 0.00016314386661420122, 'lr': 0.0028097218810153065, 'batch_size': 32, 'dropout_rate': 0.49247856277276864, 'prior_mu': 0.04863033780469441, 'prior_sigma': 0.07310589130314205, 'normalization': 'none'}. Best is trial 272 with value: 0.5198344707489013.
Generating morgan fingerprints...
Generated fingerprints with 2048 features for 900 molecules
Data shape: X=(900, 2048), y=(900,)
Trial 933: 5-fold CV loss = 0.5629
[I 2025-08-07 21:08:41,680] Trial 933 finished with value: 0.5628699660301208 and parameters: {'fp_type': 'morgan', 'morgan_only_radius': 2, 'morgan_only_nBits': 2048, 'num_hidden_layers': 3, 'hidden_dim_0': 512, 'hidden_dim_1': 128, 'hidden_dim_2': 512, 'kl_weight': 0.0012651968429881015, 'lr': 0.001599322105847525, 'batch_size': 32, 'dropout_rate': 0.0357897969818764, 'prior_mu': 0.06163949655134902, 'prior_sigma': 0.07215651318377818, 'normalization': 'none'}. Best is trial 272 with value: 0.5198344707489013.
Generating morgan fingerprints...
Generated fingerprints with 2048 features for 900 molecules
Data shape: X=(900, 2048), y=(900,)
Trial 934: 5-fold CV loss = 0.6337
[I 2025-08-07 21:08:49,102] Trial 934 finished with value: 0.6337386488914489 and parameters: {'fp_type': 'morgan', 'morgan_only_radius': 2, 'morgan_only_nBits': 2048, 'num_hidden_layers': 3, 'hidden_dim_0': 512, 'hidden_dim_1': 128, 'hidden_dim_2': 512, 'kl_weight': 0.005264603280207564, 'lr': 0.001895189382683328, 'batch_size': 32, 'dropout_rate': 0.005167847195269082, 'prior_mu': -0.015317763086180878, 'prior_sigma': 0.07302454202166286, 'normalization': 'none'}. Best is trial 272 with value: 0.5198344707489013.
Generating morgan fingerprints...
Generated fingerprints with 2048 features for 900 molecules
Data shape: X=(900, 2048), y=(900,)
Trial 935: 5-fold CV loss = 0.6308
[I 2025-08-07 21:08:52,384] Trial 935 finished with value: 0.6307913184165954 and parameters: {'fp_type': 'morgan', 'morgan_only_radius': 2, 'morgan_only_nBits': 2048, 'num_hidden_layers': 3, 'hidden_dim_0': 512, 'hidden_dim_1': 128, 'hidden_dim_2': 64, 'kl_weight': 0.005061476644059269, 'lr': 0.0016205451497648983, 'batch_size': 32, 'dropout_rate': 0.47770404910118625, 'prior_mu': 0.028028165034978826, 'prior_sigma': 0.07170302476707593, 'normalization': 'none'}. Best is trial 272 with value: 0.5198344707489013.
Generating morgan fingerprints...
Generated fingerprints with 2048 features for 900 molecules
Data shape: X=(900, 2048), y=(900,)
Trial 936: 5-fold CV loss = 0.5259
[I 2025-08-07 21:10:14,006] Trial 936 finished with value: 0.5259028732776642 and parameters: {'fp_type': 'morgan', 'morgan_only_radius': 2, 'morgan_only_nBits': 2048, 'num_hidden_layers': 3, 'hidden_dim_0': 512, 'hidden_dim_1': 128, 'hidden_dim_2': 512, 'kl_weight': 0.005371290699235692, 'lr': 0.0018491592820386892, 'batch_size': 32, 'dropout_rate': 0.47382568240737316, 'prior_mu': -0.016638427275045574, 'prior_sigma': 0.07079401302777816, 'normalization': 'none'}. Best is trial 272 with value: 0.5198344707489013.
Generating morgan fingerprints...
Generated fingerprints with 2048 features for 900 molecules
Data shape: X=(900, 2048), y=(900,)
Trial 932: 5-fold CV loss = 0.5517
[I 2025-08-07 21:10:14,900] Trial 932 finished with value: 0.5516924977302551 and parameters: {'fp_type': 'morgan', 'morgan_only_radius': 2, 'morgan_only_nBits': 2048, 'num_hidden_layers': 3, 'hidden_dim_0': 512, 'hidden_dim_1': 128, 'hidden_dim_2': 512, 'kl_weight': 0.004070453654022697, 'lr': 0.0028211350033119525, 'batch_size': 32, 'dropout_rate': 0.1289088608153228, 'prior_mu': 0.03409594942334997, 'prior_sigma': 0.07330971814844707, 'normalization': 'none'}. Best is trial 272 with value: 0.5198344707489013.
Generating morgan fingerprints...
Generated fingerprints with 2048 features for 900 molecules
Data shape: X=(900, 2048), y=(900,)
Trial 938: 5-fold CV loss = 0.5422
[I 2025-08-07 21:10:22,282] Trial 938 finished with value: 0.5421610295772552 and parameters: {'fp_type': 'morgan', 'morgan_only_radius': 2, 'morgan_only_nBits': 2048, 'num_hidden_layers': 3, 'hidden_dim_0': 256, 'hidden_dim_1': 128, 'hidden_dim_2': 512, 'kl_weight': 0.0016724852087717187, 'lr': 0.0021917357889988825, 'batch_size': 32, 'dropout_rate': 0.47039004412884977, 'prior_mu': -0.0033774876962429884, 'prior_sigma': 0.06882226814037508, 'normalization': 'none'}. Best is trial 272 with value: 0.5198344707489013.
Generating morgan fingerprints...
Generated fingerprints with 2048 features for 900 molecules
Data shape: X=(900, 2048), y=(900,)
Trial 937: 5-fold CV loss = 0.5633
[I 2025-08-07 21:10:43,554] Trial 937 finished with value: 0.5632925212383271 and parameters: {'fp_type': 'morgan', 'morgan_only_radius': 2, 'morgan_only_nBits': 2048, 'num_hidden_layers': 3, 'hidden_dim_0': 256, 'hidden_dim_1': 128, 'hidden_dim_2': 64, 'kl_weight': 0.0017113784920288944, 'lr': 0.0021976558880070457, 'batch_size': 32, 'dropout_rate': 0.46822371792025486, 'prior_mu': -0.007733120590014684, 'prior_sigma': 0.07018733298908136, 'normalization': 'none'}. Best is trial 272 with value: 0.5198344707489013.
Generating morgan fingerprints...
Generated fingerprints with 2048 features for 900 molecules
Data shape: X=(900, 2048), y=(900,)
Trial 941: 5-fold CV loss = 0.5266
[I 2025-08-07 21:11:18,870] Trial 941 finished with value: 0.5265935659408569 and parameters: {'fp_type': 'morgan', 'morgan_only_radius': 2, 'morgan_only_nBits': 2048, 'num_hidden_layers': 3, 'hidden_dim_0': 512, 'hidden_dim_1': 128, 'hidden_dim_2': 512, 'kl_weight': 0.0010415807956663291, 'lr': 0.0032128246529377355, 'batch_size': 32, 'dropout_rate': 0.4842709504964714, 'prior_mu': 0.007916852041384672, 'prior_sigma': 0.05821306208839094, 'normalization': 'none'}. Best is trial 272 with value: 0.5198344707489013.
Generating morgan fingerprints...
Generated fingerprints with 2048 features for 900 molecules
Data shape: X=(900, 2048), y=(900,)
Trial 943: 5-fold CV loss = 1.0753
[I 2025-08-07 21:11:33,118] Trial 943 finished with value: 1.075265073776245 and parameters: {'fp_type': 'morgan', 'morgan_only_radius': 2, 'morgan_only_nBits': 2048, 'num_hidden_layers': 3, 'hidden_dim_0': 512, 'hidden_dim_1': 128, 'hidden_dim_2': 512, 'kl_weight': 0.003495715440606574, 'lr': 0.0020400900298942963, 'batch_size': 64, 'dropout_rate': 0.49081834815468106, 'prior_mu': -0.033843545364178836, 'prior_sigma': 0.06075762543671729, 'normalization': 'none'}. Best is trial 272 with value: 0.5198344707489013.
Generating morgan fingerprints...
Generated fingerprints with 2048 features for 900 molecules
Data shape: X=(900, 2048), y=(900,)
Trial 939: 5-fold CV loss = 0.5493
