[I 2025-08-08 02:21:08,660] Trial 1793 finished with value: 0.5289488077163697 and parameters: {'fp_type': 'morgan', 'morgan_only_radius': 2, 'morgan_only_nBits': 2048, 'num_hidden_layers': 3, 'hidden_dim_0': 1024, 'hidden_dim_1': 128, 'hidden_dim_2': 512, 'kl_weight': 0.0008433418567465101, 'lr': 0.0020357615772120885, 'batch_size': 32, 'dropout_rate': 0.41229549175541674, 'prior_mu': 0.014015849929171428, 'prior_sigma': 0.06178667076394872, 'normalization': 'none'}. Best is trial 1528 with value: 0.5170644640922546.
Generating morgan fingerprints...
Generated fingerprints with 2048 features for 900 molecules
Data shape: X=(900, 2048), y=(900,)
Trial 1794: 5-fold CV loss = 0.5312
[I 2025-08-08 02:21:12,353] Trial 1794 finished with value: 0.5311648547649384 and parameters: {'fp_type': 'morgan', 'morgan_only_radius': 2, 'morgan_only_nBits': 2048, 'num_hidden_layers': 3, 'hidden_dim_0': 512, 'hidden_dim_1': 128, 'hidden_dim_2': 512, 'kl_weight': 0.0008381427054587601, 'lr': 0.0024348710168988017, 'batch_size': 32, 'dropout_rate': 0.41110942129708794, 'prior_mu': 0.014421242649329657, 'prior_sigma': 0.06319607610128322, 'normalization': 'none'}. Best is trial 1528 with value: 0.5170644640922546.
Generating morgan fingerprints...
Generated fingerprints with 2048 features for 900 molecules
Data shape: X=(900, 2048), y=(900,)
Trial 1797: 5-fold CV loss = 0.6939
[I 2025-08-08 02:21:58,333] Trial 1797 finished with value: 0.6938820838928222 and parameters: {'fp_type': 'morgan', 'morgan_only_radius': 2, 'morgan_only_nBits': 2048, 'num_hidden_layers': 3, 'hidden_dim_0': 512, 'hidden_dim_1': 512, 'hidden_dim_2': 512, 'kl_weight': 0.000745859146887182, 'lr': 0.0021921761071667066, 'batch_size': 32, 'dropout_rate': 0.4282233670878691, 'prior_mu': 0.02570072485612086, 'prior_sigma': 0.06395188607237152, 'normalization': 'none'}. Best is trial 1528 with value: 0.5170644640922546.
Generating morgan fingerprints...
Generated fingerprints with 2048 features for 900 molecules
Data shape: X=(900, 2048), y=(900,)
Trial 1798: 5-fold CV loss = 0.6473
[I 2025-08-08 02:22:08,209] Trial 1798 finished with value: 0.6473207712173462 and parameters: {'fp_type': 'morgan', 'morgan_only_radius': 2, 'morgan_only_nBits': 2048, 'num_hidden_layers': 3, 'hidden_dim_0': 512, 'hidden_dim_1': 512, 'hidden_dim_2': 512, 'kl_weight': 0.0006209188296081597, 'lr': 0.002136289226212139, 'batch_size': 32, 'dropout_rate': 0.42734718837790797, 'prior_mu': 0.0245007536706727, 'prior_sigma': 0.0627356685853773, 'normalization': 'none'}. Best is trial 1528 with value: 0.5170644640922546.
Generating morgan fingerprints...
Generated fingerprints with 2048 features for 900 molecules
Data shape: X=(900, 2048), y=(900,)
Trial 1799: 5-fold CV loss = 0.7051
[I 2025-08-08 02:22:56,683] Trial 1799 finished with value: 0.7051068127155304 and parameters: {'fp_type': 'morgan', 'morgan_only_radius': 2, 'morgan_only_nBits': 2048, 'num_hidden_layers': 3, 'hidden_dim_0': 512, 'hidden_dim_1': 128, 'hidden_dim_2': 512, 'kl_weight': 0.0006300302719908973, 'lr': 0.0018316138668144416, 'batch_size': 32, 'dropout_rate': 0.3953290281122076, 'prior_mu': 0.03759518553210959, 'prior_sigma': 0.0774439364897185, 'normalization': 'none'}. Best is trial 1528 with value: 0.5170644640922546.
Generating morgan fingerprints...
Generated fingerprints with 2048 features for 900 molecules
Data shape: X=(900, 2048), y=(900,)
Trial 1796: 5-fold CV loss = 0.5404
[I 2025-08-08 02:22:58,225] Trial 1796 finished with value: 0.5403936982154847 and parameters: {'fp_type': 'morgan', 'morgan_only_radius': 2, 'morgan_only_nBits': 2048, 'num_hidden_layers': 3, 'hidden_dim_0': 512, 'hidden_dim_1': 128, 'hidden_dim_2': 512, 'kl_weight': 0.0008279735261370385, 'lr': 0.0020473930164207855, 'batch_size': 32, 'dropout_rate': 0.42676976320076876, 'prior_mu': 0.025854382691360575, 'prior_sigma': 0.06203546185297994, 'normalization': 'none'}. Best is trial 1528 with value: 0.5170644640922546.
Generating morgan fingerprints...
Generated fingerprints with 2048 features for 900 molecules
Data shape: X=(900, 2048), y=(900,)
Trial 1800: 5-fold CV loss = 0.5615
[I 2025-08-08 02:23:37,226] Trial 1800 finished with value: 0.5615283191204071 and parameters: {'fp_type': 'morgan', 'morgan_only_radius': 2, 'morgan_only_nBits': 2048, 'num_hidden_layers': 3, 'hidden_dim_0': 512, 'hidden_dim_1': 128, 'hidden_dim_2': 512, 'kl_weight': 0.0010590146544014426, 'lr': 0.001812597508044403, 'batch_size': 32, 'dropout_rate': 0.397472549318028, 'prior_mu': 0.03718954683092568, 'prior_sigma': 0.07058736066613266, 'normalization': 'none'}. Best is trial 1528 with value: 0.5170644640922546.
Generating morgan fingerprints...
Generated fingerprints with 2048 features for 900 molecules
Data shape: X=(900, 2048), y=(900,)
Trial 1801: 5-fold CV loss = 0.5232
[I 2025-08-08 02:24:05,661] Trial 1801 finished with value: 0.5232187032699585 and parameters: {'fp_type': 'morgan', 'morgan_only_radius': 2, 'morgan_only_nBits': 2048, 'num_hidden_layers': 3, 'hidden_dim_0': 512, 'hidden_dim_1': 128, 'hidden_dim_2': 512, 'kl_weight': 0.0010223944291116256, 'lr': 0.002085310138451725, 'batch_size': 32, 'dropout_rate': 0.43937069755144437, 'prior_mu': 0.03684540090745661, 'prior_sigma': 0.07070985529907164, 'normalization': 'none'}. Best is trial 1528 with value: 0.5170644640922546.
Generating morgan fingerprints...
Generated fingerprints with 2048 features for 900 molecules
Data shape: X=(900, 2048), y=(900,)
Trial 1795: 5-fold CV loss = 0.5240
[I 2025-08-08 02:24:14,780] Trial 1795 finished with value: 0.5239673614501953 and parameters: {'fp_type': 'morgan', 'morgan_only_radius': 2, 'morgan_only_nBits': 2048, 'num_hidden_layers': 3, 'hidden_dim_0': 512, 'hidden_dim_1': 128, 'hidden_dim_2': 512, 'kl_weight': 0.0008136143876848644, 'lr': 0.0023601782286962088, 'batch_size': 32, 'dropout_rate': 0.4287590247351517, 'prior_mu': 0.02262759678143413, 'prior_sigma': 0.062381199345157776, 'normalization': 'none'}. Best is trial 1528 with value: 0.5170644640922546.
Generating morgan fingerprints...
Generated fingerprints with 2048 features for 900 molecules
Data shape: X=(900, 2048), y=(900,)
Trial 1802: 5-fold CV loss = 0.5731
[I 2025-08-08 02:24:51,045] Trial 1802 finished with value: 0.5730670094490051 and parameters: {'fp_type': 'morgan', 'morgan_only_radius': 2, 'morgan_only_nBits': 2048, 'num_hidden_layers': 3, 'hidden_dim_0': 64, 'hidden_dim_1': 128, 'hidden_dim_2': 512, 'kl_weight': 0.0009925435078636294, 'lr': 0.0018194627299524674, 'batch_size': 32, 'dropout_rate': 0.43835707257110595, 'prior_mu': 0.035878414129611326, 'prior_sigma': 0.07107862652664282, 'normalization': 'none'}. Best is trial 1528 with value: 0.5170644640922546.
Generating morgan fingerprints...
Generated fingerprints with 2048 features for 900 molecules
Data shape: X=(900, 2048), y=(900,)
Trial 1803: 5-fold CV loss = 0.5529
[I 2025-08-08 02:24:59,789] Trial 1803 finished with value: 0.5528648614883422 and parameters: {'fp_type': 'morgan', 'morgan_only_radius': 2, 'morgan_only_nBits': 2048, 'num_hidden_layers': 3, 'hidden_dim_0': 64, 'hidden_dim_1': 128, 'hidden_dim_2': 512, 'kl_weight': 0.0007471140236033055, 'lr': 0.002294840946699594, 'batch_size': 32, 'dropout_rate': 0.4171053889971604, 'prior_mu': 0.038798454149051476, 'prior_sigma': 0.07195720860524404, 'normalization': 'none'}. Best is trial 1528 with value: 0.5170644640922546.
Generating morgan_rdkit fingerprints...
Generated fingerprints with 768 features for 900 molecules
Data shape: X=(900, 768), y=(900,)
Trial 1804: 5-fold CV loss = 0.5284
[I 2025-08-08 02:25:11,378] Trial 1804 finished with value: 0.5284090399742126 and parameters: {'fp_type': 'morgan', 'morgan_only_radius': 2, 'morgan_only_nBits': 2048, 'num_hidden_layers': 3, 'hidden_dim_0': 512, 'hidden_dim_1': 128, 'hidden_dim_2': 512, 'kl_weight': 0.0007368829510497601, 'lr': 0.002378939825419518, 'batch_size': 32, 'dropout_rate': 0.4186073747780973, 'prior_mu': 0.023698922961560624, 'prior_sigma': 0.0660271788764541, 'normalization': 'none'}. Best is trial 1528 with value: 0.5170644640922546.
Generating morgan fingerprints...
Generated fingerprints with 2048 features for 900 molecules
Data shape: X=(900, 2048), y=(900,)
Trial 1808: 5-fold CV loss = 0.5264
[I 2025-08-08 02:26:12,994] Trial 1808 finished with value: 0.526419860124588 and parameters: {'fp_type': 'morgan', 'morgan_only_radius': 2, 'morgan_only_nBits': 2048, 'num_hidden_layers': 3, 'hidden_dim_0': 512, 'hidden_dim_1': 128, 'hidden_dim_2': 512, 'kl_weight': 0.0006051637716313742, 'lr': 0.002595169115521975, 'batch_size': 32, 'dropout_rate': 0.3684667777126289, 'prior_mu': 0.030865619617800714, 'prior_sigma': 0.06633893151273215, 'normalization': 'none'}. Best is trial 1528 with value: 0.5170644640922546.
Generating morgan_rdkit fingerprints...
Generated fingerprints with 768 features for 900 molecules
Data shape: X=(900, 768), y=(900,)
Trial 1807: 5-fold CV loss = 0.5846
[I 2025-08-08 02:26:17,479] Trial 1807 finished with value: 0.5846210658550263 and parameters: {'fp_type': 'morgan_rdkit', 'combined_morgan_radius': 2, 'combined_morgan_nBits': 512, 'combined_rdkit_maxPath': 6, 'combined_rdkit_nBits': 256, 'num_hidden_layers': 3, 'hidden_dim_0': 512, 'hidden_dim_1': 128, 'hidden_dim_2': 512, 'kl_weight': 0.0007061253385711203, 'lr': 0.002567330987443194, 'batch_size': 32, 'dropout_rate': 0.43837034334605535, 'prior_mu': 0.021669265259993513, 'prior_sigma': 0.06644772153147536, 'normalization': 'none'}. Best is trial 1528 with value: 0.5170644640922546.
Generating morgan fingerprints...
Generated fingerprints with 2048 features for 900 molecules
Data shape: X=(900, 2048), y=(900,)
Trial 1806: 5-fold CV loss = 0.5220
[I 2025-08-08 02:26:31,060] Trial 1806 finished with value: 0.5220438063144683 and parameters: {'fp_type': 'morgan', 'morgan_only_radius': 2, 'morgan_only_nBits': 2048, 'num_hidden_layers': 3, 'hidden_dim_0': 512, 'hidden_dim_1': 128, 'hidden_dim_2': 512, 'kl_weight': 0.0007003536730922433, 'lr': 0.002611529294447042, 'batch_size': 32, 'dropout_rate': 0.4146570166395049, 'prior_mu': 0.040312909581796605, 'prior_sigma': 0.06538858454660003, 'normalization': 'none'}. Best is trial 1528 with value: 0.5170644640922546.
Generating morgan fingerprints...
Generated fingerprints with 2048 features for 900 molecules
Data shape: X=(900, 2048), y=(900,)
Trial 1809: 5-fold CV loss = 0.8151
[I 2025-08-08 02:26:49,821] Trial 1809 finished with value: 0.8150863170623779 and parameters: {'fp_type': 'morgan_rdkit', 'combined_morgan_radius': 2, 'combined_morgan_nBits': 512, 'combined_rdkit_maxPath': 6, 'combined_rdkit_nBits': 256, 'num_hidden_layers': 3, 'hidden_dim_0': 512, 'hidden_dim_1': 128, 'hidden_dim_2': 512, 'kl_weight': 0.0006433970727225255, 'lr': 0.0013387049093134284, 'batch_size': 32, 'dropout_rate': 0.44046083785479856, 'prior_mu': 0.04178478146369813, 'prior_sigma': 0.07574141325480307, 'normalization': 'none'}. Best is trial 1528 with value: 0.5170644640922546.
Generating morgan fingerprints...
Generated fingerprints with 2048 features for 900 molecules
Data shape: X=(900, 2048), y=(900,)
Trial 1810: 5-fold CV loss = 0.5287
[I 2025-08-08 02:27:44,151] Trial 1810 finished with value: 0.5287128925323487 and parameters: {'fp_type': 'morgan', 'morgan_only_radius': 2, 'morgan_only_nBits': 2048, 'num_hidden_layers': 3, 'hidden_dim_0': 512, 'hidden_dim_1': 128, 'hidden_dim_2': 512, 'kl_weight': 0.017878051371322458, 'lr': 0.001946816210136327, 'batch_size': 32, 'dropout_rate': 0.40804378780667594, 'prior_mu': 0.038279632685793395, 'prior_sigma': 0.07609963885876346, 'normalization': 'none'}. Best is trial 1528 with value: 0.5170644640922546.
Generating morgan fingerprints...
Generated fingerprints with 2048 features for 900 molecules
Data shape: X=(900, 2048), y=(900,)
Trial 1805: 5-fold CV loss = 0.5539
[I 2025-08-08 02:27:45,912] Trial 1805 finished with value: 0.5538705885410309 and parameters: {'fp_type': 'morgan', 'morgan_only_radius': 2, 'morgan_only_nBits': 2048, 'num_hidden_layers': 3, 'hidden_dim_0': 64, 'hidden_dim_1': 128, 'hidden_dim_2': 512, 'kl_weight': 0.0007140370952246953, 'lr': 0.0025889433085944415, 'batch_size': 32, 'dropout_rate': 0.41438724359296586, 'prior_mu': 0.037715222254253056, 'prior_sigma': 0.06650558572273718, 'normalization': 'none'}. Best is trial 1528 with value: 0.5170644640922546.
Generating morgan fingerprints...
Generated fingerprints with 2048 features for 900 molecules
Data shape: X=(900, 2048), y=(900,)
Trial 1812: 5-fold CV loss = 0.5215
[I 2025-08-08 02:28:10,195] Trial 1812 finished with value: 0.5215064883232117 and parameters: {'fp_type': 'morgan', 'morgan_only_radius': 2, 'morgan_only_nBits': 2048, 'num_hidden_layers': 3, 'hidden_dim_0': 512, 'hidden_dim_1': 128, 'hidden_dim_2': 512, 'kl_weight': 0.0009284223737722133, 'lr': 0.0019369383893944588, 'batch_size': 32, 'dropout_rate': 0.40595875820091265, 'prior_mu': 0.0312299380709112, 'prior_sigma': 0.07512474373003179, 'normalization': 'none'}. Best is trial 1528 with value: 0.5170644640922546.
Generating morgan fingerprints...
Generated fingerprints with 2048 features for 900 molecules
Data shape: X=(900, 2048), y=(900,)
Trial 1811: 5-fold CV loss = 0.5215
[I 2025-08-08 02:28:43,202] Trial 1811 finished with value: 0.5214949190616608 and parameters: {'fp_type': 'morgan', 'morgan_only_radius': 2, 'morgan_only_nBits': 2048, 'num_hidden_layers': 3, 'hidden_dim_0': 512, 'hidden_dim_1': 128, 'hidden_dim_2': 512, 'kl_weight': 0.0008848076625006914, 'lr': 0.001955923242758358, 'batch_size': 32, 'dropout_rate': 0.4407368266393409, 'prior_mu': 0.03283855649511001, 'prior_sigma': 0.07558742180933177, 'normalization': 'none'}. Best is trial 1528 with value: 0.5170644640922546.
Generating morgan fingerprints...
Generated fingerprints with 2048 features for 900 molecules
Data shape: X=(900, 2048), y=(900,)
Trial 1813: 5-fold CV loss = 0.6651
[I 2025-08-08 02:28:56,130] Trial 1813 finished with value: 0.6651231944561005 and parameters: {'fp_type': 'morgan', 'morgan_only_radius': 2, 'morgan_only_nBits': 2048, 'num_hidden_layers': 3, 'hidden_dim_0': 512, 'hidden_dim_1': 128, 'hidden_dim_2': 512, 'kl_weight': 0.0009019808058687421, 'lr': 0.001738385537033831, 'batch_size': 32, 'dropout_rate': 0.43672290987117895, 'prior_mu': 0.029117849569709912, 'prior_sigma': 0.06897319624529442, 'normalization': 'none'}. Best is trial 1528 with value: 0.5170644640922546.
Generating morgan fingerprints...
Generated fingerprints with 2048 features for 900 molecules
Data shape: X=(900, 2048), y=(900,)
Trial 1815: 5-fold CV loss = 0.7162
[I 2025-08-08 02:29:00,919] Trial 1815 finished with value: 0.7161782264709473 and parameters: {'fp_type': 'morgan', 'morgan_only_radius': 2, 'morgan_only_nBits': 2048, 'num_hidden_layers': 3, 'hidden_dim_0': 512, 'hidden_dim_1': 128, 'hidden_dim_2': 512, 'kl_weight': 0.0005725157158480812, 'lr': 0.0016623612207505244, 'batch_size': 32, 'dropout_rate': 0.4398027005269874, 'prior_mu': 0.022889573276706866, 'prior_sigma': 0.062270363753521824, 'normalization': 'none'}. Best is trial 1528 with value: 0.5170644640922546.
Generating morgan fingerprints...
Generated fingerprints with 2048 features for 900 molecules
Data shape: X=(900, 2048), y=(900,)
Trial 1818: 5-fold CV loss = 0.6517
[I 2025-08-08 02:29:14,399] Trial 1818 finished with value: 0.6517490863800048 and parameters: {'fp_type': 'morgan', 'morgan_only_radius': 2, 'morgan_only_nBits': 2048, 'num_hidden_layers': 3, 'hidden_dim_0': 512, 'hidden_dim_1': 128, 'hidden_dim_2': 256, 'kl_weight': 0.0005956603281659599, 'lr': 0.0021800623696069036, 'batch_size': 128, 'dropout_rate': 0.4286953633617994, 'prior_mu': 0.0434862695344468, 'prior_sigma': 0.06082797974234504, 'normalization': 'none'}. Best is trial 1528 with value: 0.5170644640922546.
Generating morgan fingerprints...
Generated fingerprints with 2048 features for 900 molecules
Data shape: X=(900, 2048), y=(900,)
Trial 1819: 5-fold CV loss = 0.5782
[I 2025-08-08 02:30:29,437] Trial 1819 finished with value: 0.5782050013542175 and parameters: {'fp_type': 'morgan', 'morgan_only_radius': 2, 'morgan_only_nBits': 2048, 'num_hidden_layers': 3, 'hidden_dim_0': 128, 'hidden_dim_1': 1024, 'hidden_dim_2': 512, 'kl_weight': 0.0007670520322447687, 'lr': 0.0014470898117035728, 'batch_size': 32, 'dropout_rate': 0.42515718495940197, 'prior_mu': 0.015265904178143917, 'prior_sigma': 0.07032436661204652, 'normalization': 'none'}. Best is trial 1528 with value: 0.5170644640922546.
Generating morgan fingerprints...
Generated fingerprints with 2048 features for 900 molecules
Data shape: X=(900, 2048), y=(900,)
Trial 1817: 5-fold CV loss = 0.5641
[I 2025-08-08 02:30:32,112] Trial 1817 finished with value: 0.5640731632709504 and parameters: {'fp_type': 'morgan', 'morgan_only_radius': 2, 'morgan_only_nBits': 2048, 'num_hidden_layers': 3, 'hidden_dim_0': 512, 'hidden_dim_1': 128, 'hidden_dim_2': 512, 'kl_weight': 0.0005941931716469346, 'lr': 0.0021811736746777067, 'batch_size': 32, 'dropout_rate': 0.4255872419249263, 'prior_mu': -0.15180394222558613, 'prior_sigma': 0.06204626657226113, 'normalization': 'none'}. Best is trial 1528 with value: 0.5170644640922546.
Generating morgan fingerprints...
Generated fingerprints with 2048 features for 900 molecules
Data shape: X=(900, 2048), y=(900,)
Trial 1820: 5-fold CV loss = 0.7118
[I 2025-08-08 02:30:47,387] Trial 1820 finished with value: 0.7118391036987305 and parameters: {'fp_type': 'morgan', 'morgan_only_radius': 2, 'morgan_only_nBits': 2048, 'num_hidden_layers': 1, 'hidden_dim_0': 512, 'kl_weight': 0.0010123362434060475, 'lr': 0.0021983619550887644, 'batch_size': 32, 'dropout_rate': 0.42648221991297086, 'prior_mu': 0.02198859468885264, 'prior_sigma': 0.06637393348297281, 'normalization': 'none'}. Best is trial 1528 with value: 0.5170644640922546.
Generating morgan fingerprints...
Generated fingerprints with 2048 features for 900 molecules
Data shape: X=(900, 2048), y=(900,)
Trial 1822: 5-fold CV loss = 0.7196
[I 2025-08-08 02:31:02,084] Trial 1822 finished with value: 0.7195736289024353 and parameters: {'fp_type': 'morgan', 'morgan_only_radius': 3, 'morgan_only_nBits': 2048, 'num_hidden_layers': 3, 'hidden_dim_0': 512, 'hidden_dim_1': 128, 'hidden_dim_2': 128, 'kl_weight': 0.0008429312999224824, 'lr': 0.0020519910761111443, 'batch_size': 64, 'dropout_rate': 0.4417971776273306, 'prior_mu': 0.04649799231783261, 'prior_sigma': 0.07049711623291906, 'normalization': 'none'}. Best is trial 1528 with value: 0.5170644640922546.
Generating rdkit fingerprints...
Generated fingerprints with 512 features for 900 molecules
Data shape: X=(900, 512), y=(900,)
Trial 1816: 5-fold CV loss = 0.5233
[I 2025-08-08 02:31:15,348] Trial 1816 finished with value: 0.5233495175838471 and parameters: {'fp_type': 'morgan', 'morgan_only_radius': 2, 'morgan_only_nBits': 2048, 'num_hidden_layers': 3, 'hidden_dim_0': 512, 'hidden_dim_1': 128, 'hidden_dim_2': 512, 'kl_weight': 0.0006165200462153472, 'lr': 0.0022068897698367808, 'batch_size': 32, 'dropout_rate': 0.42866742035808963, 'prior_mu': 0.021724683090858895, 'prior_sigma': 0.061861363135060715, 'normalization': 'none'}. Best is trial 1528 with value: 0.5170644640922546.
Generating rdkit fingerprints...
Generated fingerprints with 512 features for 900 molecules
Data shape: X=(900, 512), y=(900,)
Trial 1823: 5-fold CV loss = 0.6459
[I 2025-08-08 02:31:48,133] Trial 1823 finished with value: 0.6459191322326661 and parameters: {'fp_type': 'rdkit', 'rdkit_only_maxPath': 6, 'rdkit_only_nBits': 512, 'num_hidden_layers': 3, 'hidden_dim_0': 512, 'hidden_dim_1': 128, 'hidden_dim_2': 512, 'kl_weight': 0.0006638992422992995, 'lr': 0.0017831326668977254, 'batch_size': 32, 'dropout_rate': 0.4411205901411037, 'prior_mu': 0.030064583776011053, 'prior_sigma': 0.08426744646884686, 'normalization': 'none'}. Best is trial 1528 with value: 0.5170644640922546.
Generating morgan fingerprints...
Generated fingerprints with 2048 features for 900 molecules
Data shape: X=(900, 2048), y=(900,)
Trial 1814: 5-fold CV loss = 0.5227
[I 2025-08-08 02:31:55,629] Trial 1814 finished with value: 0.5227383315563202 and parameters: {'fp_type': 'morgan', 'morgan_only_radius': 2, 'morgan_only_nBits': 2048, 'num_hidden_layers': 3, 'hidden_dim_0': 512, 'hidden_dim_1': 128, 'hidden_dim_2': 512, 'kl_weight': 0.0008610603877129061, 'lr': 0.0021455108253433477, 'batch_size': 32, 'dropout_rate': 0.4352387868301938, 'prior_mu': 0.030863424098658575, 'prior_sigma': 0.061591065925731214, 'normalization': 'none'}. Best is trial 1528 with value: 0.5170644640922546.
Generating morgan fingerprints...
Generated fingerprints with 2048 features for 900 molecules
Data shape: X=(900, 2048), y=(900,)
Trial 1821: 5-fold CV loss = 0.6076
[I 2025-08-08 02:31:57,290] Trial 1821 finished with value: 0.607610684633255 and parameters: {'fp_type': 'morgan', 'morgan_only_radius': 3, 'morgan_only_nBits': 2048, 'num_hidden_layers': 3, 'hidden_dim_0': 512, 'hidden_dim_1': 128, 'hidden_dim_2': 128, 'kl_weight': 0.0010138473011636246, 'lr': 0.0021055429107120966, 'batch_size': 32, 'dropout_rate': 0.44126328638831547, 'prior_mu': 0.04520426760434162, 'prior_sigma': 0.08593847349626126, 'normalization': 'none'}. Best is trial 1528 with value: 0.5170644640922546.
Generating morgan fingerprints...
Generated fingerprints with 2048 features for 900 molecules
Data shape: X=(900, 2048), y=(900,)
Trial 1825: 5-fold CV loss = 0.5687
