[I 2025-08-08 02:53:35,024] Trial 1887 finished with value: 0.7143017411231994 and parameters: {'fp_type': 'morgan', 'morgan_only_radius': 2, 'morgan_only_nBits': 2048, 'num_hidden_layers': 3, 'hidden_dim_0': 512, 'hidden_dim_1': 128, 'hidden_dim_2': 512, 'kl_weight': 0.0004919554254760472, 'lr': 0.0012940694711867334, 'batch_size': 32, 'dropout_rate': 0.3947326565578855, 'prior_mu': 0.049740512403249074, 'prior_sigma': 0.07087278892593343, 'normalization': 'none'}. Best is trial 1528 with value: 0.5170644640922546.
Generating morgan fingerprints...
Generated fingerprints with 2048 features for 900 molecules
Data shape: X=(900, 2048), y=(900,)
Trial 1891: 5-fold CV loss = 0.5456
[I 2025-08-08 02:54:39,643] Trial 1891 finished with value: 0.5455926597118378 and parameters: {'fp_type': 'morgan', 'morgan_only_radius': 2, 'morgan_only_nBits': 2048, 'num_hidden_layers': 3, 'hidden_dim_0': 512, 'hidden_dim_1': 128, 'hidden_dim_2': 512, 'kl_weight': 0.0008316730301351687, 'lr': 0.0024568472134464943, 'batch_size': 32, 'dropout_rate': 0.1180026917820779, 'prior_mu': 0.028405476039683696, 'prior_sigma': 0.08938743082947793, 'normalization': 'layer'}. Best is trial 1528 with value: 0.5170644640922546.
Generating morgan fingerprints...
Generated fingerprints with 2048 features for 900 molecules
Data shape: X=(900, 2048), y=(900,)
Trial 1889: 5-fold CV loss = 0.5234
[I 2025-08-08 02:54:42,842] Trial 1889 finished with value: 0.5234391391277313 and parameters: {'fp_type': 'morgan', 'morgan_only_radius': 2, 'morgan_only_nBits': 2048, 'num_hidden_layers': 3, 'hidden_dim_0': 512, 'hidden_dim_1': 128, 'hidden_dim_2': 512, 'kl_weight': 0.0007725831106655864, 'lr': 0.0019837468832546302, 'batch_size': 32, 'dropout_rate': 0.43269003445458953, 'prior_mu': 0.04761167493046254, 'prior_sigma': 0.05953042610738884, 'normalization': 'none'}. Best is trial 1528 with value: 0.5170644640922546.
Generating morgan fingerprints...
Generated fingerprints with 2048 features for 900 molecules
Data shape: X=(900, 2048), y=(900,)
Trial 1890: 5-fold CV loss = 0.5251
[I 2025-08-08 02:55:09,866] Trial 1890 finished with value: 0.5250998675823212 and parameters: {'fp_type': 'morgan', 'morgan_only_radius': 2, 'morgan_only_nBits': 2048, 'num_hidden_layers': 3, 'hidden_dim_0': 512, 'hidden_dim_1': 128, 'hidden_dim_2': 512, 'kl_weight': 0.0008223802967433451, 'lr': 0.002469848546830379, 'batch_size': 32, 'dropout_rate': 0.41484751675995923, 'prior_mu': 0.04735889837291643, 'prior_sigma': 0.05979455725367875, 'normalization': 'none'}. Best is trial 1528 with value: 0.5170644640922546.
Generating morgan fingerprints...
Generated fingerprints with 2048 features for 900 molecules
Data shape: X=(900, 2048), y=(900,)
Trial 1892: 5-fold CV loss = 0.6635
[I 2025-08-08 02:55:49,824] Trial 1892 finished with value: 0.6635226130485534 and parameters: {'fp_type': 'morgan', 'morgan_only_radius': 2, 'morgan_only_nBits': 2048, 'num_hidden_layers': 3, 'hidden_dim_0': 512, 'hidden_dim_1': 128, 'hidden_dim_2': 512, 'kl_weight': 0.0005760549112213123, 'lr': 0.0015304312018441105, 'batch_size': 32, 'dropout_rate': 0.41219013497967516, 'prior_mu': 0.046307236950302325, 'prior_sigma': 0.060491607227101084, 'normalization': 'none'}. Best is trial 1528 with value: 0.5170644640922546.
Generating morgan_rdkit fingerprints...
Generated fingerprints with 768 features for 900 molecules
Data shape: X=(900, 768), y=(900,)
Trial 1893: 5-fold CV loss = 0.6927
[I 2025-08-08 02:56:04,565] Trial 1893 finished with value: 0.6926881790161132 and parameters: {'fp_type': 'morgan', 'morgan_only_radius': 2, 'morgan_only_nBits': 2048, 'num_hidden_layers': 3, 'hidden_dim_0': 512, 'hidden_dim_1': 128, 'hidden_dim_2': 512, 'kl_weight': 0.0006149503949776, 'lr': 0.0015601895858772417, 'batch_size': 32, 'dropout_rate': 0.41532633785180123, 'prior_mu': 0.02280244452289179, 'prior_sigma': 0.07552292749368597, 'normalization': 'none'}. Best is trial 1528 with value: 0.5170644640922546.
Generating morgan fingerprints...
Generated fingerprints with 2048 features for 900 molecules
Data shape: X=(900, 2048), y=(900,)
Trial 1895: 5-fold CV loss = 0.6213
[I 2025-08-08 02:56:34,621] Trial 1895 finished with value: 0.6212527871131897 and parameters: {'fp_type': 'morgan_rdkit', 'combined_morgan_radius': 3, 'combined_morgan_nBits': 512, 'combined_rdkit_maxPath': 8, 'combined_rdkit_nBits': 256, 'num_hidden_layers': 3, 'hidden_dim_0': 512, 'hidden_dim_1': 128, 'hidden_dim_2': 512, 'kl_weight': 0.000992337848892483, 'lr': 0.0022005610946721496, 'batch_size': 32, 'dropout_rate': 0.4425736309164884, 'prior_mu': 0.02262710633811689, 'prior_sigma': 0.07594429178885657, 'normalization': 'none'}. Best is trial 1528 with value: 0.5170644640922546.
Generating morgan fingerprints...
Generated fingerprints with 2048 features for 900 molecules
Data shape: X=(900, 2048), y=(900,)
Trial 1888: 5-fold CV loss = 0.5287
[I 2025-08-08 02:56:59,754] Trial 1888 finished with value: 0.5287009239196777 and parameters: {'fp_type': 'morgan', 'morgan_only_radius': 2, 'morgan_only_nBits': 2048, 'num_hidden_layers': 3, 'hidden_dim_0': 512, 'hidden_dim_1': 128, 'hidden_dim_2': 512, 'kl_weight': 0.0008301638366208968, 'lr': 0.002259631194066897, 'batch_size': 32, 'dropout_rate': 0.43232115223220474, 'prior_mu': 0.02140123252384165, 'prior_sigma': 0.06012361173422222, 'normalization': 'none'}. Best is trial 1528 with value: 0.5170644640922546.
Generating morgan fingerprints...
Generated fingerprints with 2048 features for 900 molecules
Data shape: X=(900, 2048), y=(900,)
Trial 1894: 5-fold CV loss = 0.5220
[I 2025-08-08 02:57:11,044] Trial 1894 finished with value: 0.521998929977417 and parameters: {'fp_type': 'morgan', 'morgan_only_radius': 2, 'morgan_only_nBits': 2048, 'num_hidden_layers': 3, 'hidden_dim_0': 512, 'hidden_dim_1': 128, 'hidden_dim_2': 512, 'kl_weight': 0.0005729180136117319, 'lr': 0.002208853896939242, 'batch_size': 32, 'dropout_rate': 0.43465381307917406, 'prior_mu': 0.023461228116383088, 'prior_sigma': 0.06285525246436886, 'normalization': 'none'}. Best is trial 1528 with value: 0.5170644640922546.
Generating morgan fingerprints...
Generated fingerprints with 2048 features for 900 molecules
Data shape: X=(900, 2048), y=(900,)
Trial 1896: 5-fold CV loss = 0.5265
[I 2025-08-08 02:57:26,731] Trial 1896 finished with value: 0.5264826416969299 and parameters: {'fp_type': 'morgan', 'morgan_only_radius': 2, 'morgan_only_nBits': 2048, 'num_hidden_layers': 3, 'hidden_dim_0': 512, 'hidden_dim_1': 128, 'hidden_dim_2': 512, 'kl_weight': 0.000963464027319988, 'lr': 0.002245233557077459, 'batch_size': 32, 'dropout_rate': 0.43261031487307966, 'prior_mu': 0.03379752751347827, 'prior_sigma': 0.07826675734994386, 'normalization': 'none'}. Best is trial 1528 with value: 0.5170644640922546.
Generating morgan fingerprints...
Generated fingerprints with 2048 features for 900 molecules
Data shape: X=(900, 2048), y=(900,)
Trial 1897: 5-fold CV loss = 0.5247
[I 2025-08-08 02:57:55,911] Trial 1897 finished with value: 0.5246694505214691 and parameters: {'fp_type': 'morgan', 'morgan_only_radius': 2, 'morgan_only_nBits': 2048, 'num_hidden_layers': 3, 'hidden_dim_0': 512, 'hidden_dim_1': 128, 'hidden_dim_2': 512, 'kl_weight': 0.0006774386580090547, 'lr': 0.0020683706507441256, 'batch_size': 32, 'dropout_rate': 0.43027879893372495, 'prior_mu': 0.032495745382773764, 'prior_sigma': 0.0673659934437644, 'normalization': 'none'}. Best is trial 1528 with value: 0.5170644640922546.
Generating morgan fingerprints...
Generated fingerprints with 2048 features for 900 molecules
Data shape: X=(900, 2048), y=(900,)
Trial 1898: 5-fold CV loss = 0.6525
[I 2025-08-08 02:59:15,797] Trial 1898 finished with value: 0.6524540662765503 and parameters: {'fp_type': 'morgan', 'morgan_only_radius': 2, 'morgan_only_nBits': 2048, 'num_hidden_layers': 3, 'hidden_dim_0': 512, 'hidden_dim_1': 512, 'hidden_dim_2': 512, 'kl_weight': 0.0006720293376615544, 'lr': 0.003096720731847105, 'batch_size': 32, 'dropout_rate': 0.1556068629140908, 'prior_mu': 0.031083221650774175, 'prior_sigma': 0.06663465804633839, 'normalization': 'none'}. Best is trial 1528 with value: 0.5170644640922546.
Generating morgan fingerprints...
Generated fingerprints with 2048 features for 900 molecules
Data shape: X=(900, 2048), y=(900,)
Trial 1900: 5-fold CV loss = 0.5406
[I 2025-08-08 02:59:16,296] Trial 1900 finished with value: 0.5405500710010529 and parameters: {'fp_type': 'morgan', 'morgan_only_radius': 2, 'morgan_only_nBits': 2048, 'num_hidden_layers': 3, 'hidden_dim_0': 512, 'hidden_dim_1': 128, 'hidden_dim_2': 512, 'kl_weight': 0.0007244773574641642, 'lr': 0.0017455741749495082, 'batch_size': 32, 'dropout_rate': 0.446209922423678, 'prior_mu': 0.03305287835589504, 'prior_sigma': 0.06807340874647154, 'normalization': 'none'}. Best is trial 1528 with value: 0.5170644640922546.
Generating morgan fingerprints...
Generated fingerprints with 2048 features for 900 molecules
Data shape: X=(900, 2048), y=(900,)
Trial 1901: 5-fold CV loss = 0.5675
[I 2025-08-08 02:59:22,035] Trial 1901 finished with value: 0.567521584033966 and parameters: {'fp_type': 'morgan', 'morgan_only_radius': 2, 'morgan_only_nBits': 2048, 'num_hidden_layers': 3, 'hidden_dim_0': 128, 'hidden_dim_1': 512, 'hidden_dim_2': 512, 'kl_weight': 0.0007242825194164203, 'lr': 0.0017545767213458152, 'batch_size': 32, 'dropout_rate': 0.44404707321549225, 'prior_mu': 0.05459051900231862, 'prior_sigma': 0.06732565301509408, 'normalization': 'none'}. Best is trial 1528 with value: 0.5170644640922546.
Generating morgan fingerprints...
Generated fingerprints with 2048 features for 900 molecules
Data shape: X=(900, 2048), y=(900,)
Trial 1899: 5-fold CV loss = 0.5375
[I 2025-08-08 02:59:28,510] Trial 1899 finished with value: 0.5374763429164886 and parameters: {'fp_type': 'morgan', 'morgan_only_radius': 2, 'morgan_only_nBits': 2048, 'num_hidden_layers': 3, 'hidden_dim_0': 128, 'hidden_dim_1': 128, 'hidden_dim_2': 512, 'kl_weight': 0.0006779106573394655, 'lr': 0.003105586599586061, 'batch_size': 32, 'dropout_rate': 0.44419220860114794, 'prior_mu': 0.03255563091119685, 'prior_sigma': 0.06728759819525924, 'normalization': 'none'}. Best is trial 1528 with value: 0.5170644640922546.
Generating morgan fingerprints...
Generated fingerprints with 2048 features for 900 molecules
Data shape: X=(900, 2048), y=(900,)
Trial 1903: 5-fold CV loss = 0.5916
[I 2025-08-08 03:00:27,108] Trial 1903 finished with value: 0.5915919661521911 and parameters: {'fp_type': 'morgan', 'morgan_only_radius': 2, 'morgan_only_nBits': 2048, 'num_hidden_layers': 3, 'hidden_dim_0': 512, 'hidden_dim_1': 128, 'hidden_dim_2': 512, 'kl_weight': 0.0005075102269140096, 'lr': 0.0019717177215308967, 'batch_size': 32, 'dropout_rate': 0.40472170694003295, 'prior_mu': 0.05524883060057284, 'prior_sigma': 0.07270706981868495, 'normalization': 'none'}. Best is trial 1528 with value: 0.5170644640922546.
Generating morgan fingerprints...
Generated fingerprints with 2048 features for 900 molecules
Data shape: X=(900, 2048), y=(900,)
Trial 1904: 5-fold CV loss = 0.5439
[I 2025-08-08 03:00:41,618] Trial 1904 finished with value: 0.5438740015029907 and parameters: {'fp_type': 'morgan', 'morgan_only_radius': 2, 'morgan_only_nBits': 2048, 'num_hidden_layers': 3, 'hidden_dim_0': 512, 'hidden_dim_1': 128, 'hidden_dim_2': 512, 'kl_weight': 0.05030820613584757, 'lr': 0.0019929026656160683, 'batch_size': 32, 'dropout_rate': 0.4207169848679526, 'prior_mu': 0.05821696688509369, 'prior_sigma': 0.07230802507090489, 'normalization': 'none'}. Best is trial 1528 with value: 0.5170644640922546.
Generating morgan fingerprints...
Generated fingerprints with 2048 features for 900 molecules
Data shape: X=(900, 2048), y=(900,)
Trial 1905: 5-fold CV loss = 0.5780
[I 2025-08-08 03:01:33,767] Trial 1905 finished with value: 0.5780288279056549 and parameters: {'fp_type': 'morgan', 'morgan_only_radius': 2, 'morgan_only_nBits': 2048, 'num_hidden_layers': 3, 'hidden_dim_0': 512, 'hidden_dim_1': 128, 'hidden_dim_2': 512, 'kl_weight': 0.0005002350749522962, 'lr': 0.0019851104461685487, 'batch_size': 32, 'dropout_rate': 0.4210071726121097, 'prior_mu': 0.06010141838289997, 'prior_sigma': 0.0730730068686306, 'normalization': 'none'}. Best is trial 1528 with value: 0.5170644640922546.
Generating morgan fingerprints...
Generated fingerprints with 2048 features for 900 molecules
Data shape: X=(900, 2048), y=(900,)
Trial 1907: 5-fold CV loss = 0.5250
[I 2025-08-08 03:01:42,592] Trial 1907 finished with value: 0.5250211775302887 and parameters: {'fp_type': 'morgan', 'morgan_only_radius': 2, 'morgan_only_nBits': 2048, 'num_hidden_layers': 3, 'hidden_dim_0': 512, 'hidden_dim_1': 128, 'hidden_dim_2': 512, 'kl_weight': 0.0009337130882716397, 'lr': 0.0025288255025278255, 'batch_size': 32, 'dropout_rate': 0.4223644209992073, 'prior_mu': 0.04360083601643571, 'prior_sigma': 0.06351552583951345, 'normalization': 'none'}. Best is trial 1528 with value: 0.5170644640922546.
Generating morgan fingerprints...
Generated fingerprints with 2048 features for 900 molecules
Data shape: X=(900, 2048), y=(900,)
Trial 1906: 5-fold CV loss = 0.5594
[I 2025-08-08 03:01:46,856] Trial 1906 finished with value: 0.5593701601028442 and parameters: {'fp_type': 'morgan', 'morgan_only_radius': 2, 'morgan_only_nBits': 2048, 'num_hidden_layers': 3, 'hidden_dim_0': 512, 'hidden_dim_1': 64, 'hidden_dim_2': 512, 'kl_weight': 0.0009709495592336273, 'lr': 0.0019456922078165749, 'batch_size': 32, 'dropout_rate': 0.42641768208768605, 'prior_mu': 0.05831356146443105, 'prior_sigma': 0.06362675145190368, 'normalization': 'none'}. Best is trial 1528 with value: 0.5170644640922546.
Generating morgan fingerprints...
Generated fingerprints with 2048 features for 900 molecules
Data shape: X=(900, 2048), y=(900,)
Trial 1910: 5-fold CV loss = 0.5672
[I 2025-08-08 03:02:35,431] Trial 1910 finished with value: 0.5672355532646179 and parameters: {'fp_type': 'morgan', 'morgan_only_radius': 2, 'morgan_only_nBits': 2048, 'num_hidden_layers': 3, 'hidden_dim_0': 256, 'hidden_dim_1': 128, 'hidden_dim_2': 512, 'kl_weight': 0.0005706354313157153, 'lr': 0.0014181532149188652, 'batch_size': 64, 'dropout_rate': 0.41011437818609253, 'prior_mu': 0.04131609431481693, 'prior_sigma': 0.06334705339482105, 'normalization': 'layer'}. Best is trial 1528 with value: 0.5170644640922546.
Generating morgan fingerprints...
Generated fingerprints with 2048 features for 900 molecules
Data shape: X=(900, 2048), y=(900,)
Trial 1909: 5-fold CV loss = 0.6221
[I 2025-08-08 03:02:41,745] Trial 1909 finished with value: 0.622121924161911 and parameters: {'fp_type': 'morgan', 'morgan_only_radius': 2, 'morgan_only_nBits': 2048, 'num_hidden_layers': 3, 'hidden_dim_0': 512, 'hidden_dim_1': 64, 'hidden_dim_2': 512, 'kl_weight': 0.0008616582723109871, 'lr': 0.0014074421503794793, 'batch_size': 32, 'dropout_rate': 0.4342659351385574, 'prior_mu': 0.042568650590107275, 'prior_sigma': 0.06361006574643181, 'normalization': 'none'}. Best is trial 1528 with value: 0.5170644640922546.
Generating morgan fingerprints...
Generated fingerprints with 2048 features for 900 molecules
Data shape: X=(900, 2048), y=(900,)
Trial 1908: 5-fold CV loss = 0.5275
[I 2025-08-08 03:03:29,002] Trial 1908 finished with value: 0.5275007605552673 and parameters: {'fp_type': 'morgan', 'morgan_only_radius': 2, 'morgan_only_nBits': 2048, 'num_hidden_layers': 3, 'hidden_dim_0': 512, 'hidden_dim_1': 64, 'hidden_dim_2': 512, 'kl_weight': 0.0009070444859288862, 'lr': 0.002532498302223352, 'batch_size': 32, 'dropout_rate': 0.42675339459245076, 'prior_mu': 0.042730158748361294, 'prior_sigma': 0.06373138195532363, 'normalization': 'none'}. Best is trial 1528 with value: 0.5170644640922546.
Generating morgan fingerprints...
Generated fingerprints with 2048 features for 900 molecules
Data shape: X=(900, 2048), y=(900,)
Trial 1912: 5-fold CV loss = 0.5991
[I 2025-08-08 03:03:32,072] Trial 1912 finished with value: 0.5990618348121644 and parameters: {'fp_type': 'morgan', 'morgan_only_radius': 2, 'morgan_only_nBits': 2048, 'num_hidden_layers': 3, 'hidden_dim_0': 512, 'hidden_dim_1': 128, 'hidden_dim_2': 512, 'kl_weight': 0.001095074757225314, 'lr': 0.0017943339686938074, 'batch_size': 32, 'dropout_rate': 0.10285193746115734, 'prior_mu': 0.02086194538105738, 'prior_sigma': 0.07027479659468903, 'normalization': 'none'}. Best is trial 1528 with value: 0.5170644640922546.
Generating morgan fingerprints...
Generated fingerprints with 2048 features for 900 molecules
Data shape: X=(900, 2048), y=(900,)
Trial 1911: 5-fold CV loss = 0.5258
[I 2025-08-08 03:03:55,344] Trial 1911 finished with value: 0.5257559359073639 and parameters: {'fp_type': 'morgan', 'morgan_only_radius': 2, 'morgan_only_nBits': 2048, 'num_hidden_layers': 3, 'hidden_dim_0': 512, 'hidden_dim_1': 128, 'hidden_dim_2': 512, 'kl_weight': 0.0008180465694806138, 'lr': 0.002409402874399432, 'batch_size': 32, 'dropout_rate': 0.4448452439277579, 'prior_mu': 0.018632707054065327, 'prior_sigma': 0.05966825876283355, 'normalization': 'none'}. Best is trial 1528 with value: 0.5170644640922546.
Generating morgan_rdkit fingerprints...
Generated fingerprints with 768 features for 900 molecules
Data shape: X=(900, 768), y=(900,)
Trial 1902: 5-fold CV loss = 0.5192
[I 2025-08-08 03:04:26,051] Trial 1902 finished with value: 0.5192472815513611 and parameters: {'fp_type': 'morgan', 'morgan_only_radius': 2, 'morgan_only_nBits': 2048, 'num_hidden_layers': 3, 'hidden_dim_0': 512, 'hidden_dim_1': 128, 'hidden_dim_2': 512, 'kl_weight': 0.0007447983223520791, 'lr': 0.0017906402385205733, 'batch_size': 32, 'dropout_rate': 0.4458485488138182, 'prior_mu': 0.05500638162664845, 'prior_sigma': 0.07321538919787482, 'normalization': 'none'}. Best is trial 1528 with value: 0.5170644640922546.
Generating morgan fingerprints...
Generated fingerprints with 2048 features for 900 molecules
Data shape: X=(900, 2048), y=(900,)
Trial 1914: 5-fold CV loss = 0.5215
[I 2025-08-08 03:04:50,323] Trial 1914 finished with value: 0.5215071260929107 and parameters: {'fp_type': 'morgan', 'morgan_only_radius': 2, 'morgan_only_nBits': 2048, 'num_hidden_layers': 3, 'hidden_dim_0': 512, 'hidden_dim_1': 128, 'hidden_dim_2': 512, 'kl_weight': 0.0007683727751881251, 'lr': 0.0023267968939743476, 'batch_size': 32, 'dropout_rate': 0.4457384816939882, 'prior_mu': 0.027831100709856494, 'prior_sigma': 0.059465528268572584, 'normalization': 'none'}. Best is trial 1528 with value: 0.5170644640922546.
Generating morgan_rdkit fingerprints...
Generated fingerprints with 768 features for 900 molecules
Data shape: X=(900, 768), y=(900,)
Trial 1915: 5-fold CV loss = 0.5537
[I 2025-08-08 03:05:26,346] Trial 1915 finished with value: 0.5536798655986785 and parameters: {'fp_type': 'morgan_rdkit', 'combined_morgan_radius': 3, 'combined_morgan_nBits': 512, 'combined_rdkit_maxPath': 6, 'combined_rdkit_nBits': 256, 'num_hidden_layers': 3, 'hidden_dim_0': 512, 'hidden_dim_1': 128, 'hidden_dim_2': 64, 'kl_weight': 0.00058781779257816, 'lr': 0.002106423822338669, 'batch_size': 32, 'dropout_rate': 0.40612861751930546, 'prior_mu': 0.031109901864679518, 'prior_sigma': 0.07809322081694836, 'normalization': 'none'}. Best is trial 1528 with value: 0.5170644640922546.
Generating morgan fingerprints...
Generated fingerprints with 2048 features for 900 molecules
Data shape: X=(900, 2048), y=(900,)
Trial 1917: 5-fold CV loss = 0.6333
[I 2025-08-08 03:05:38,236] Trial 1917 finished with value: 0.6333354592323304 and parameters: {'fp_type': 'morgan_rdkit', 'combined_morgan_radius': 3, 'combined_morgan_nBits': 512, 'combined_rdkit_maxPath': 6, 'combined_rdkit_nBits': 256, 'num_hidden_layers': 3, 'hidden_dim_0': 512, 'hidden_dim_1': 256, 'hidden_dim_2': 512, 'kl_weight': 0.001079581180362832, 'lr': 0.001564122237959267, 'batch_size': 32, 'dropout_rate': 0.3843246339453511, 'prior_mu': 0.060710686564524524, 'prior_sigma': 0.08620684828112538, 'normalization': 'none'}. Best is trial 1528 with value: 0.5170644640922546.
Generating morgan fingerprints...
Generated fingerprints with 2048 features for 900 molecules
Data shape: X=(900, 2048), y=(900,)
Trial 1913: 5-fold CV loss = 0.5666
[I 2025-08-08 03:05:42,844] Trial 1913 finished with value: 0.566557514667511 and parameters: {'fp_type': 'morgan', 'morgan_only_radius': 2, 'morgan_only_nBits': 2048, 'num_hidden_layers': 3, 'hidden_dim_0': 512, 'hidden_dim_1': 128, 'hidden_dim_2': 512, 'kl_weight': 0.000747429161868959, 'lr': 0.0017848429589045916, 'batch_size': 32, 'dropout_rate': 0.4390742331411914, 'prior_mu': 0.014471196676509774, 'prior_sigma': 0.0587499483416428, 'normalization': 'none'}. Best is trial 1528 with value: 0.5170644640922546.
Generating morgan fingerprints...
Generated fingerprints with 2048 features for 900 molecules
Data shape: X=(900, 2048), y=(900,)
Trial 1916: 5-fold CV loss = 0.7189
[I 2025-08-08 03:06:09,025] Trial 1916 finished with value: 0.7188562512397766 and parameters: {'fp_type': 'morgan', 'morgan_only_radius': 2, 'morgan_only_nBits': 2048, 'num_hidden_layers': 3, 'hidden_dim_0': 512, 'hidden_dim_1': 128, 'hidden_dim_2': 64, 'kl_weight': 0.0010583028048246712, 'lr': 0.0015693117697466964, 'batch_size': 32, 'dropout_rate': 0.44816632589373406, 'prior_mu': 0.06097816544531169, 'prior_sigma': 0.07544967255841886, 'normalization': 'none'}. Best is trial 1528 with value: 0.5170644640922546.
Generating morgan fingerprints...
Generated fingerprints with 2048 features for 900 molecules
Data shape: X=(900, 2048), y=(900,)
Trial 1918: 5-fold CV loss = 0.7813
