[I 2025-08-07 20:26:36,766] Trial 816 finished with value: 0.5741762578487396 and parameters: {'fp_type': 'morgan', 'morgan_only_radius': 2, 'morgan_only_nBits': 2048, 'num_hidden_layers': 3, 'hidden_dim_0': 512, 'hidden_dim_1': 128, 'hidden_dim_2': 512, 'kl_weight': 0.001630375772104382, 'lr': 0.002357041773378697, 'batch_size': 32, 'dropout_rate': 0.4610603549047633, 'prior_mu': -0.001317233532635756, 'prior_sigma': 0.14024994408074787, 'normalization': 'none'}. Best is trial 272 with value: 0.5198344707489013.
Generating morgan fingerprints...
Generated fingerprints with 2048 features for 900 molecules
Data shape: X=(900, 2048), y=(900,)
Trial 815: 5-fold CV loss = 0.5287
[I 2025-08-07 20:26:59,866] Trial 815 finished with value: 0.5286673426628112 and parameters: {'fp_type': 'morgan', 'morgan_only_radius': 2, 'morgan_only_nBits': 2048, 'num_hidden_layers': 3, 'hidden_dim_0': 512, 'hidden_dim_1': 128, 'hidden_dim_2': 512, 'kl_weight': 0.013562907369399404, 'lr': 0.00264106800753509, 'batch_size': 32, 'dropout_rate': 0.45200997998076997, 'prior_mu': -0.016981258396158497, 'prior_sigma': 0.07185510759368123, 'normalization': 'none'}. Best is trial 272 with value: 0.5198344707489013.
Generating morgan fingerprints...
Generated fingerprints with 2048 features for 900 molecules
Data shape: X=(900, 2048), y=(900,)
Trial 817: 5-fold CV loss = 0.5230
[I 2025-08-07 20:27:03,035] Trial 817 finished with value: 0.5230210065841675 and parameters: {'fp_type': 'morgan', 'morgan_only_radius': 2, 'morgan_only_nBits': 2048, 'num_hidden_layers': 3, 'hidden_dim_0': 512, 'hidden_dim_1': 128, 'hidden_dim_2': 512, 'kl_weight': 0.0014677105019829067, 'lr': 0.002322981551777892, 'batch_size': 32, 'dropout_rate': 0.4854662288919827, 'prior_mu': -0.008997087100778949, 'prior_sigma': 0.07031537114392439, 'normalization': 'none'}. Best is trial 272 with value: 0.5198344707489013.
Generating morgan fingerprints...
Generated fingerprints with 2048 features for 900 molecules
Data shape: X=(900, 2048), y=(900,)
Trial 820: 5-fold CV loss = 1.1380
[I 2025-08-07 20:27:28,486] Trial 820 finished with value: 1.1379587650299072 and parameters: {'fp_type': 'morgan', 'morgan_only_radius': 2, 'morgan_only_nBits': 2048, 'num_hidden_layers': 3, 'hidden_dim_0': 512, 'hidden_dim_1': 128, 'hidden_dim_2': 512, 'kl_weight': 0.0019067277577697684, 'lr': 0.0005711270768521123, 'batch_size': 32, 'dropout_rate': 0.4840250957174108, 'prior_mu': 0.006256747339723818, 'prior_sigma': 0.07096068125690372, 'normalization': 'none'}. Best is trial 272 with value: 0.5198344707489013.
Generating morgan fingerprints...
Generated fingerprints with 2048 features for 900 molecules
Data shape: X=(900, 2048), y=(900,)
Trial 812: 5-fold CV loss = 0.5287
[I 2025-08-07 20:27:40,313] Trial 812 finished with value: 0.5287161707878113 and parameters: {'fp_type': 'morgan', 'morgan_only_radius': 2, 'morgan_only_nBits': 2048, 'num_hidden_layers': 3, 'hidden_dim_0': 512, 'hidden_dim_1': 128, 'hidden_dim_2': 512, 'kl_weight': 0.002362184927718552, 'lr': 0.0021579777429426247, 'batch_size': 32, 'dropout_rate': 0.48211575087647973, 'prior_mu': -0.030526767687334908, 'prior_sigma': 0.07211985652072542, 'normalization': 'none'}. Best is trial 272 with value: 0.5198344707489013.
Generating morgan fingerprints...
Generated fingerprints with 2048 features for 900 molecules
Data shape: X=(900, 2048), y=(900,)
Trial 818: 5-fold CV loss = 0.6589
[I 2025-08-07 20:27:43,405] Trial 818 finished with value: 0.6589498341083526 and parameters: {'fp_type': 'morgan', 'morgan_only_radius': 2, 'morgan_only_nBits': 2048, 'num_hidden_layers': 3, 'hidden_dim_0': 512, 'hidden_dim_1': 128, 'hidden_dim_2': 256, 'kl_weight': 0.0018379706665641183, 'lr': 0.0019758000784548635, 'batch_size': 32, 'dropout_rate': 0.48871209089195544, 'prior_mu': -0.009641403102998103, 'prior_sigma': 0.10630026081849209, 'normalization': 'none'}. Best is trial 272 with value: 0.5198344707489013.
Generating morgan fingerprints...
Generated fingerprints with 2048 features for 900 molecules
Data shape: X=(900, 2048), y=(900,)
Trial 821: 5-fold CV loss = 0.5462
[I 2025-08-07 20:29:04,090] Trial 821 finished with value: 0.5462162911891937 and parameters: {'fp_type': 'morgan', 'morgan_only_radius': 2, 'morgan_only_nBits': 2048, 'num_hidden_layers': 3, 'hidden_dim_0': 512, 'hidden_dim_1': 128, 'hidden_dim_2': 512, 'kl_weight': 0.0015566717398931738, 'lr': 0.0019747942019461276, 'batch_size': 32, 'dropout_rate': 0.4643144258216144, 'prior_mu': -0.006033632433294796, 'prior_sigma': 0.07028102607034745, 'normalization': 'none'}. Best is trial 272 with value: 0.5198344707489013.
Generating morgan fingerprints...
Generated fingerprints with 2048 features for 900 molecules
Data shape: X=(900, 2048), y=(900,)
Trial 823: 5-fold CV loss = 0.5292
[I 2025-08-07 20:29:05,557] Trial 823 finished with value: 0.5291616678237915 and parameters: {'fp_type': 'morgan', 'morgan_only_radius': 3, 'morgan_only_nBits': 2048, 'num_hidden_layers': 3, 'hidden_dim_0': 512, 'hidden_dim_1': 128, 'hidden_dim_2': 512, 'kl_weight': 0.001516107294984007, 'lr': 0.001979406757796206, 'batch_size': 32, 'dropout_rate': 0.46427311283336237, 'prior_mu': 0.008165568272367115, 'prior_sigma': 0.06514385945098064, 'normalization': 'none'}. Best is trial 272 with value: 0.5198344707489013.
Generating morgan fingerprints...
Generated fingerprints with 2048 features for 900 molecules
Data shape: X=(900, 2048), y=(900,)
Trial 819: 5-fold CV loss = 0.9657
[I 2025-08-07 20:29:17,793] Trial 819 finished with value: 0.9657151341438294 and parameters: {'fp_type': 'morgan', 'morgan_only_radius': 2, 'morgan_only_nBits': 2048, 'num_hidden_layers': 3, 'hidden_dim_0': 512, 'hidden_dim_1': 128, 'hidden_dim_2': 256, 'kl_weight': 0.0018476859332126811, 'lr': 0.002039347460791445, 'batch_size': 32, 'dropout_rate': 0.48707372046282305, 'prior_mu': -0.0074445057250724905, 'prior_sigma': 0.12704860415329317, 'normalization': 'none'}. Best is trial 272 with value: 0.5198344707489013.
Generating morgan fingerprints...
Generated fingerprints with 2048 features for 900 molecules
Data shape: X=(900, 2048), y=(900,)
Trial 825: 5-fold CV loss = 0.6791
[I 2025-08-07 20:29:30,476] Trial 825 finished with value: 0.6790881395339966 and parameters: {'fp_type': 'morgan', 'morgan_only_radius': 2, 'morgan_only_nBits': 2048, 'num_hidden_layers': 2, 'hidden_dim_0': 512, 'hidden_dim_1': 64, 'kl_weight': 0.0028996934974052837, 'lr': 0.0017089018562285669, 'batch_size': 32, 'dropout_rate': 0.478213821669328, 'prior_mu': -0.0003277816958798946, 'prior_sigma': 0.06535200221645866, 'normalization': 'none'}. Best is trial 272 with value: 0.5198344707489013.
Generating morgan fingerprints...
Generated fingerprints with 2048 features for 900 molecules
Data shape: X=(900, 2048), y=(900,)
Trial 822: 5-fold CV loss = 0.6156
[I 2025-08-07 20:30:03,790] Trial 822 finished with value: 0.6155844092369079 and parameters: {'fp_type': 'morgan', 'morgan_only_radius': 2, 'morgan_only_nBits': 2048, 'num_hidden_layers': 3, 'hidden_dim_0': 512, 'hidden_dim_1': 64, 'hidden_dim_2': 256, 'kl_weight': 0.001485509787024491, 'lr': 0.001964344783851116, 'batch_size': 32, 'dropout_rate': 0.4646704252107145, 'prior_mu': 0.008414073252506437, 'prior_sigma': 0.06528637400524186, 'normalization': 'none'}. Best is trial 272 with value: 0.5198344707489013.
Generating morgan fingerprints...
Generated fingerprints with 2048 features for 900 molecules
Data shape: X=(900, 2048), y=(900,)
Trial 824: 5-fold CV loss = 0.7018
[I 2025-08-07 20:30:24,534] Trial 824 finished with value: 0.7017994940280914 and parameters: {'fp_type': 'morgan', 'morgan_only_radius': 3, 'morgan_only_nBits': 2048, 'num_hidden_layers': 3, 'hidden_dim_0': 512, 'hidden_dim_1': 128, 'hidden_dim_2': 512, 'kl_weight': 0.003528678635804461, 'lr': 0.0016645171427206121, 'batch_size': 32, 'dropout_rate': 0.49017122363224863, 'prior_mu': 0.009466477297896802, 'prior_sigma': 0.06520295579672047, 'normalization': 'none'}. Best is trial 272 with value: 0.5198344707489013.
Generating morgan fingerprints...
Generated fingerprints with 2048 features for 900 molecules
Data shape: X=(900, 2048), y=(900,)
Trial 827: 5-fold CV loss = 0.5302
[I 2025-08-07 20:31:01,647] Trial 827 finished with value: 0.5301920890808105 and parameters: {'fp_type': 'morgan', 'morgan_only_radius': 2, 'morgan_only_nBits': 2048, 'num_hidden_layers': 3, 'hidden_dim_0': 256, 'hidden_dim_1': 128, 'hidden_dim_2': 512, 'kl_weight': 0.0035799486506233867, 'lr': 0.002568804044546427, 'batch_size': 32, 'dropout_rate': 0.49153498502751297, 'prior_mu': 0.025927364905529812, 'prior_sigma': 0.06081300013442828, 'normalization': 'none'}. Best is trial 272 with value: 0.5198344707489013.
Generating morgan fingerprints...
Generated fingerprints with 2048 features for 900 molecules
Data shape: X=(900, 2048), y=(900,)
Trial 829: 5-fold CV loss = 0.5294
[I 2025-08-07 20:31:28,685] Trial 829 finished with value: 0.5293714821338653 and parameters: {'fp_type': 'morgan', 'morgan_only_radius': 2, 'morgan_only_nBits': 2048, 'num_hidden_layers': 3, 'hidden_dim_0': 512, 'hidden_dim_1': 128, 'hidden_dim_2': 512, 'kl_weight': 0.0034932284730859915, 'lr': 0.0025540032502448214, 'batch_size': 32, 'dropout_rate': 0.47546171166138046, 'prior_mu': 0.026832852803917815, 'prior_sigma': 0.0751404172822431, 'normalization': 'none'}. Best is trial 272 with value: 0.5198344707489013.
Generating morgan fingerprints...
Generated fingerprints with 2048 features for 900 molecules
Data shape: X=(900, 2048), y=(900,)
Trial 826: 5-fold CV loss = 0.5734
[I 2025-08-07 20:31:51,812] Trial 826 finished with value: 0.573430848121643 and parameters: {'fp_type': 'morgan', 'morgan_only_radius': 2, 'morgan_only_nBits': 2048, 'num_hidden_layers': 3, 'hidden_dim_0': 512, 'hidden_dim_1': 128, 'hidden_dim_2': 512, 'kl_weight': 0.0037532587202943352, 'lr': 0.0016611967426765637, 'batch_size': 32, 'dropout_rate': 0.47569662709009425, 'prior_mu': 0.0001207656967343435, 'prior_sigma': 0.06466096934465408, 'normalization': 'none'}. Best is trial 272 with value: 0.5198344707489013.
Generating morgan fingerprints...
Generated fingerprints with 2048 features for 900 molecules
Data shape: X=(900, 2048), y=(900,)
Trial 830: 5-fold CV loss = 0.5436
[I 2025-08-07 20:32:02,200] Trial 830 finished with value: 0.5435718894004822 and parameters: {'fp_type': 'morgan', 'morgan_only_radius': 2, 'morgan_only_nBits': 2048, 'num_hidden_layers': 3, 'hidden_dim_0': 512, 'hidden_dim_1': 128, 'hidden_dim_2': 512, 'kl_weight': 0.002144669714660211, 'lr': 0.0022987664497428305, 'batch_size': 32, 'dropout_rate': 0.4742355010593514, 'prior_mu': 0.000828077341763653, 'prior_sigma': 0.07452254617571971, 'normalization': 'layer'}. Best is trial 272 with value: 0.5198344707489013.
Generating morgan fingerprints...
Generated fingerprints with 2048 features for 900 molecules
Data shape: X=(900, 2048), y=(900,)
Trial 831: 5-fold CV loss = 0.5371
[I 2025-08-07 20:32:38,631] Trial 831 finished with value: 0.5370669424533844 and parameters: {'fp_type': 'morgan', 'morgan_only_radius': 2, 'morgan_only_nBits': 2048, 'num_hidden_layers': 3, 'hidden_dim_0': 512, 'hidden_dim_1': 128, 'hidden_dim_2': 512, 'kl_weight': 0.0021168043478355446, 'lr': 0.0022815151563478314, 'batch_size': 32, 'dropout_rate': 0.47337122959823974, 'prior_mu': -0.002025813787464803, 'prior_sigma': 0.06971592535518616, 'normalization': 'layer'}. Best is trial 272 with value: 0.5198344707489013.
Generating morgan fingerprints...
Generated fingerprints with 2048 features for 900 molecules
Data shape: X=(900, 2048), y=(900,)
Trial 833: 5-fold CV loss = 0.8370
[I 2025-08-07 20:33:13,250] Trial 833 finished with value: 0.8369983196258545 and parameters: {'fp_type': 'morgan', 'morgan_only_radius': 2, 'morgan_only_nBits': 2048, 'num_hidden_layers': 3, 'hidden_dim_0': 512, 'hidden_dim_1': 512, 'hidden_dim_2': 512, 'kl_weight': 0.0017157531965166168, 'lr': 0.002203549663320231, 'batch_size': 32, 'dropout_rate': 0.4997523297872147, 'prior_mu': -0.00695120117044426, 'prior_sigma': 0.0690643595498936, 'normalization': 'none'}. Best is trial 272 with value: 0.5198344707489013.
Generating rdkit fingerprints...
Generated fingerprints with 256 features for 900 molecules
Data shape: X=(900, 256), y=(900,)
Trial 832: 5-fold CV loss = 0.5415
[I 2025-08-07 20:33:27,810] Trial 832 finished with value: 0.5415380477905274 and parameters: {'fp_type': 'morgan', 'morgan_only_radius': 2, 'morgan_only_nBits': 2048, 'num_hidden_layers': 3, 'hidden_dim_0': 512, 'hidden_dim_1': 512, 'hidden_dim_2': 512, 'kl_weight': 0.0021365677325136927, 'lr': 0.002277947177463044, 'batch_size': 32, 'dropout_rate': 0.4911777092802985, 'prior_mu': -0.011978754310497556, 'prior_sigma': 0.06969069422688887, 'normalization': 'layer'}. Best is trial 272 with value: 0.5198344707489013.
Generating rdkit fingerprints...
Generated fingerprints with 256 features for 900 molecules
Data shape: X=(900, 256), y=(900,)
Trial 828: 5-fold CV loss = 0.5234
[I 2025-08-07 20:33:41,546] Trial 828 finished with value: 0.5234302282333374 and parameters: {'fp_type': 'morgan', 'morgan_only_radius': 2, 'morgan_only_nBits': 2048, 'num_hidden_layers': 3, 'hidden_dim_0': 512, 'hidden_dim_1': 128, 'hidden_dim_2': 512, 'kl_weight': 0.003634684070877399, 'lr': 0.002343984677256799, 'batch_size': 32, 'dropout_rate': 0.4912591089667126, 'prior_mu': -0.0011666920481124047, 'prior_sigma': 0.06062589878078797, 'normalization': 'none'}. Best is trial 272 with value: 0.5198344707489013.
Generating rdkit fingerprints...
Generated fingerprints with 512 features for 900 molecules
Data shape: X=(900, 512), y=(900,)
Trial 834: 5-fold CV loss = 0.9301
[I 2025-08-07 20:33:44,745] Trial 834 finished with value: 0.930142617225647 and parameters: {'fp_type': 'morgan', 'morgan_only_radius': 2, 'morgan_only_nBits': 2048, 'num_hidden_layers': 3, 'hidden_dim_0': 512, 'hidden_dim_1': 512, 'hidden_dim_2': 512, 'kl_weight': 0.002549677934030642, 'lr': 0.0018183577425720065, 'batch_size': 32, 'dropout_rate': 0.41117028716194476, 'prior_mu': -0.011062545066639666, 'prior_sigma': 0.0787535614391294, 'normalization': 'none'}. Best is trial 272 with value: 0.5198344707489013.
Generating morgan fingerprints...
Generated fingerprints with 2048 features for 900 molecules
Data shape: X=(900, 2048), y=(900,)
Trial 835: 5-fold CV loss = 0.6708
[I 2025-08-07 20:34:01,638] Trial 835 finished with value: 0.6708056211471558 and parameters: {'fp_type': 'rdkit', 'rdkit_only_maxPath': 7, 'rdkit_only_nBits': 256, 'num_hidden_layers': 3, 'hidden_dim_0': 512, 'hidden_dim_1': 128, 'hidden_dim_2': 512, 'kl_weight': 0.0013878401024632304, 'lr': 0.0018004618937218113, 'batch_size': 32, 'dropout_rate': 0.4999046466936192, 'prior_mu': -0.012007635932589442, 'prior_sigma': 0.06069410233284173, 'normalization': 'none'}. Best is trial 272 with value: 0.5198344707489013.
Generating morgan fingerprints...
Generated fingerprints with 2048 features for 900 molecules
Data shape: X=(900, 2048), y=(900,)
Trial 839: 5-fold CV loss = 0.6516
[I 2025-08-07 20:34:15,563] Trial 839 finished with value: 0.6515918374061584 and parameters: {'fp_type': 'morgan', 'morgan_only_radius': 2, 'morgan_only_nBits': 2048, 'num_hidden_layers': 0, 'kl_weight': 0.003126236991530197, 'lr': 0.0029227262664339136, 'batch_size': 32, 'dropout_rate': 0.44569427264797357, 'prior_mu': 0.015075218141905855, 'prior_sigma': 0.05856536916949659, 'normalization': 'none'}. Best is trial 272 with value: 0.5198344707489013.
Generating morgan fingerprints...
Generated fingerprints with 2048 features for 900 molecules
Data shape: X=(900, 2048), y=(900,)
Trial 836: 5-fold CV loss = 0.6707
[I 2025-08-07 20:34:49,066] Trial 836 finished with value: 0.6707245111465454 and parameters: {'fp_type': 'rdkit', 'rdkit_only_maxPath': 7, 'rdkit_only_nBits': 256, 'num_hidden_layers': 3, 'hidden_dim_0': 512, 'hidden_dim_1': 128, 'hidden_dim_2': 512, 'kl_weight': 0.002628713566469544, 'lr': 0.0028953543707657303, 'batch_size': 32, 'dropout_rate': 0.4464137523631817, 'prior_mu': -0.013437867961266954, 'prior_sigma': 0.07930585907166626, 'normalization': 'none'}. Best is trial 272 with value: 0.5198344707489013.
Generating morgan fingerprints...
Generated fingerprints with 2048 features for 900 molecules
Data shape: X=(900, 2048), y=(900,)
Trial 838: 5-fold CV loss = 0.5282
[I 2025-08-07 20:34:51,565] Trial 838 finished with value: 0.5282010078430176 and parameters: {'fp_type': 'morgan', 'morgan_only_radius': 2, 'morgan_only_nBits': 2048, 'num_hidden_layers': 3, 'hidden_dim_0': 512, 'hidden_dim_1': 128, 'hidden_dim_2': 512, 'kl_weight': 0.0031455518884206746, 'lr': 0.002915500457567961, 'batch_size': 32, 'dropout_rate': 0.49970288693298365, 'prior_mu': 0.013310483177001666, 'prior_sigma': 0.06115167721845488, 'normalization': 'none'}. Best is trial 272 with value: 0.5198344707489013.
Generating morgan fingerprints...
Generated fingerprints with 2048 features for 900 molecules
Data shape: X=(900, 2048), y=(900,)
Trial 837: 5-fold CV loss = 0.6760
[I 2025-08-07 20:35:04,622] Trial 837 finished with value: 0.6760450720787048 and parameters: {'fp_type': 'rdkit', 'rdkit_only_maxPath': 7, 'rdkit_only_nBits': 512, 'num_hidden_layers': 0, 'kl_weight': 0.0033599366818131446, 'lr': 0.00285077948977696, 'batch_size': 32, 'dropout_rate': 0.4925197466867897, 'prior_mu': 0.045050376136422515, 'prior_sigma': 0.059839060342123954, 'normalization': 'none'}. Best is trial 272 with value: 0.5198344707489013.
Generating morgan fingerprints...
Generated fingerprints with 2048 features for 900 molecules
Data shape: X=(900, 2048), y=(900,)
Trial 840: 5-fold CV loss = 0.5292
[I 2025-08-07 20:35:15,837] Trial 840 finished with value: 0.5292014181613922 and parameters: {'fp_type': 'morgan', 'morgan_only_radius': 2, 'morgan_only_nBits': 2048, 'num_hidden_layers': 3, 'hidden_dim_0': 512, 'hidden_dim_1': 128, 'hidden_dim_2': 512, 'kl_weight': 0.0042431128628337735, 'lr': 0.0027117565772668715, 'batch_size': 32, 'dropout_rate': 0.4999118954247562, 'prior_mu': -0.03611916331396607, 'prior_sigma': 0.06080484732211023, 'normalization': 'none'}. Best is trial 272 with value: 0.5198344707489013.
Generating morgan_rdkit fingerprints...
Generated fingerprints with 768 features for 900 molecules
Data shape: X=(900, 768), y=(900,)
Trial 842: 5-fold CV loss = 0.5354
[I 2025-08-07 20:35:55,443] Trial 842 finished with value: 0.5354262351989746 and parameters: {'fp_type': 'morgan', 'morgan_only_radius': 2, 'morgan_only_nBits': 2048, 'num_hidden_layers': 3, 'hidden_dim_0': 1024, 'hidden_dim_1': 128, 'hidden_dim_2': 512, 'kl_weight': 0.004691328837360372, 'lr': 0.0027104314711062266, 'batch_size': 32, 'dropout_rate': 0.48377294708047147, 'prior_mu': 0.04114049460139492, 'prior_sigma': 0.06808836302191877, 'normalization': 'none'}. Best is trial 272 with value: 0.5198344707489013.
Generating morgan_rdkit fingerprints...
Generated fingerprints with 768 features for 900 molecules
Data shape: X=(900, 768), y=(900,)
Trial 845: 5-fold CV loss = 0.7905
[I 2025-08-07 20:36:44,618] Trial 845 finished with value: 0.7905064463615418 and parameters: {'fp_type': 'morgan_rdkit', 'combined_morgan_radius': 3, 'combined_morgan_nBits': 512, 'combined_rdkit_maxPath': 6, 'combined_rdkit_nBits': 256, 'num_hidden_layers': 3, 'hidden_dim_0': 512, 'hidden_dim_1': 128, 'hidden_dim_2': 128, 'kl_weight': 0.0041151078839013365, 'lr': 0.002487725972181624, 'batch_size': 32, 'dropout_rate': 0.4583993505445307, 'prior_mu': 0.019594416344207482, 'prior_sigma': 0.11866917627031562, 'normalization': 'none'}. Best is trial 272 with value: 0.5198344707489013.
Generating morgan fingerprints...
Generated fingerprints with 2048 features for 900 molecules
Data shape: X=(900, 2048), y=(900,)
Trial 844: 5-fold CV loss = 0.5384
[I 2025-08-07 20:36:45,555] Trial 844 finished with value: 0.5384496450424194 and parameters: {'fp_type': 'morgan_rdkit', 'combined_morgan_radius': 3, 'combined_morgan_nBits': 512, 'combined_rdkit_maxPath': 6, 'combined_rdkit_nBits': 256, 'num_hidden_layers': 3, 'hidden_dim_0': 1024, 'hidden_dim_1': 128, 'hidden_dim_2': 512, 'kl_weight': 0.0039700191985095855, 'lr': 0.0024804195345810177, 'batch_size': 32, 'dropout_rate': 0.48507099475469934, 'prior_mu': 0.002809754370279067, 'prior_sigma': 0.07348052948641173, 'normalization': 'none'}. Best is trial 272 with value: 0.5198344707489013.
Generating morgan fingerprints...
Generated fingerprints with 2048 features for 900 molecules
Data shape: X=(900, 2048), y=(900,)
Trial 841: 5-fold CV loss = 0.5267
[I 2025-08-07 20:36:47,056] Trial 841 finished with value: 0.5266857087612152 and parameters: {'fp_type': 'morgan', 'morgan_only_radius': 2, 'morgan_only_nBits': 2048, 'num_hidden_layers': 3, 'hidden_dim_0': 512, 'hidden_dim_1': 128, 'hidden_dim_2': 512, 'kl_weight': 0.004026047746062706, 'lr': 0.0026241400795968418, 'batch_size': 32, 'dropout_rate': 0.4894976306170833, 'prior_mu': 0.020641261029038613, 'prior_sigma': 0.06125069174964702, 'normalization': 'none'}. Best is trial 272 with value: 0.5198344707489013.
Generating morgan fingerprints...
Generated fingerprints with 2048 features for 900 molecules
Data shape: X=(900, 2048), y=(900,)
Trial 847: 5-fold CV loss = 0.5335
[I 2025-08-07 20:38:00,104] Trial 847 finished with value: 0.5334562718868255 and parameters: {'fp_type': 'morgan', 'morgan_only_radius': 2, 'morgan_only_nBits': 2048, 'num_hidden_layers': 3, 'hidden_dim_0': 512, 'hidden_dim_1': 128, 'hidden_dim_2': 512, 'kl_weight': 0.005750277187457552, 'lr': 0.0023771947082295956, 'batch_size': 32, 'dropout_rate': 0.4664943011535007, 'prior_mu': -0.034818027772861575, 'prior_sigma': 0.0719269180289838, 'normalization': 'none'}. Best is trial 272 with value: 0.5198344707489013.
Generating morgan fingerprints...
Generated fingerprints with 2048 features for 900 molecules
Data shape: X=(900, 2048), y=(900,)
Trial 846: 5-fold CV loss = 0.5472
