[I 2025-08-07 20:38:08,629] Trial 846 finished with value: 0.547219431400299 and parameters: {'fp_type': 'morgan', 'morgan_only_radius': 2, 'morgan_only_nBits': 2048, 'num_hidden_layers': 3, 'hidden_dim_0': 512, 'hidden_dim_1': 128, 'hidden_dim_2': 512, 'kl_weight': 0.00373936985644737, 'lr': 0.002451439103153918, 'batch_size': 32, 'dropout_rate': 0.4807491191386422, 'prior_mu': -0.03478681728613412, 'prior_sigma': 0.09583444606460113, 'normalization': 'none'}. Best is trial 272 with value: 0.5198344707489013.
Generating morgan fingerprints...
Generated fingerprints with 2048 features for 900 molecules
Data shape: X=(900, 2048), y=(900,)
Trial 843: 5-fold CV loss = 0.5340
[I 2025-08-07 20:38:21,590] Trial 843 finished with value: 0.5339920878410339 and parameters: {'fp_type': 'morgan', 'morgan_only_radius': 2, 'morgan_only_nBits': 2048, 'num_hidden_layers': 3, 'hidden_dim_0': 512, 'hidden_dim_1': 128, 'hidden_dim_2': 512, 'kl_weight': 0.004184635994678534, 'lr': 0.0026187936527970156, 'batch_size': 32, 'dropout_rate': 0.4839499154427181, 'prior_mu': -0.03560359561027629, 'prior_sigma': 0.07288190423349498, 'normalization': 'none'}. Best is trial 272 with value: 0.5198344707489013.
Generating morgan fingerprints...
Generated fingerprints with 2048 features for 900 molecules
Data shape: X=(900, 2048), y=(900,)
Trial 848: 5-fold CV loss = 0.5308
[I 2025-08-07 20:38:47,654] Trial 848 finished with value: 0.5307623147964478 and parameters: {'fp_type': 'morgan', 'morgan_only_radius': 2, 'morgan_only_nBits': 2048, 'num_hidden_layers': 3, 'hidden_dim_0': 512, 'hidden_dim_1': 128, 'hidden_dim_2': 512, 'kl_weight': 0.005353508143371075, 'lr': 0.002322623957993215, 'batch_size': 32, 'dropout_rate': 0.46801642872659527, 'prior_mu': -0.02434745081238345, 'prior_sigma': 0.06812200052079247, 'normalization': 'none'}. Best is trial 272 with value: 0.5198344707489013.
Generating morgan fingerprints...
Generated fingerprints with 2048 features for 900 molecules
Data shape: X=(900, 2048), y=(900,)
Trial 849: 5-fold CV loss = 0.5318
[I 2025-08-07 20:38:54,047] Trial 849 finished with value: 0.5317562460899353 and parameters: {'fp_type': 'morgan', 'morgan_only_radius': 2, 'morgan_only_nBits': 2048, 'num_hidden_layers': 3, 'hidden_dim_0': 512, 'hidden_dim_1': 128, 'hidden_dim_2': 512, 'kl_weight': 0.00293424203966358, 'lr': 0.0032138952974875416, 'batch_size': 32, 'dropout_rate': 0.48006155012191903, 'prior_mu': -0.02309230104829537, 'prior_sigma': 0.06621449742261966, 'normalization': 'none'}. Best is trial 272 with value: 0.5198344707489013.
Generating morgan fingerprints...
Generated fingerprints with 2048 features for 900 molecules
Data shape: X=(900, 2048), y=(900,)
Trial 853: 5-fold CV loss = 0.7854
[I 2025-08-07 20:39:02,506] Trial 853 finished with value: 0.7854227662086487 and parameters: {'fp_type': 'morgan', 'morgan_only_radius': 2, 'morgan_only_nBits': 2048, 'num_hidden_layers': 3, 'hidden_dim_0': 512, 'hidden_dim_1': 128, 'hidden_dim_2': 512, 'kl_weight': 0.0028698091947726985, 'lr': 0.002184096555917762, 'batch_size': 128, 'dropout_rate': 0.4911934935547798, 'prior_mu': 0.0060561936027208815, 'prior_sigma': 0.057460133884649274, 'normalization': 'none'}. Best is trial 272 with value: 0.5198344707489013.
Generating morgan fingerprints...
Generated fingerprints with 2048 features for 900 molecules
Data shape: X=(900, 2048), y=(900,)
Trial 850: 5-fold CV loss = 0.5325
[I 2025-08-07 20:39:12,994] Trial 850 finished with value: 0.5324970781803131 and parameters: {'fp_type': 'morgan', 'morgan_only_radius': 2, 'morgan_only_nBits': 2048, 'num_hidden_layers': 3, 'hidden_dim_0': 512, 'hidden_dim_1': 128, 'hidden_dim_2': 512, 'kl_weight': 0.0029547642018677403, 'lr': 0.0031754856656620815, 'batch_size': 32, 'dropout_rate': 0.47623532521023715, 'prior_mu': -0.023176750663634362, 'prior_sigma': 0.06696286766129142, 'normalization': 'none'}. Best is trial 272 with value: 0.5198344707489013.
Generating morgan fingerprints...
Generated fingerprints with 2048 features for 900 molecules
Data shape: X=(900, 2048), y=(900,)
Trial 852: 5-fold CV loss = 0.6051
[I 2025-08-07 20:39:13,446] Trial 852 finished with value: 0.605096060037613 and parameters: {'fp_type': 'morgan', 'morgan_only_radius': 2, 'morgan_only_nBits': 2048, 'num_hidden_layers': 3, 'hidden_dim_0': 64, 'hidden_dim_1': 1024, 'hidden_dim_2': 512, 'kl_weight': 0.002819747820720439, 'lr': 0.002117333097384058, 'batch_size': 128, 'dropout_rate': 0.4898562597757839, 'prior_mu': 0.006804428974211924, 'prior_sigma': 0.06540024000518162, 'normalization': 'none'}. Best is trial 272 with value: 0.5198344707489013.
Generating morgan fingerprints...
Generated fingerprints with 2048 features for 900 molecules
Data shape: X=(900, 2048), y=(900,)
Trial 855: 5-fold CV loss = 0.9076
[I 2025-08-07 20:39:46,003] Trial 855 finished with value: 0.9075937151908875 and parameters: {'fp_type': 'morgan', 'morgan_only_radius': 2, 'morgan_only_nBits': 2048, 'num_hidden_layers': 3, 'hidden_dim_0': 256, 'hidden_dim_1': 1024, 'hidden_dim_2': 512, 'kl_weight': 0.0012306130492365085, 'lr': 0.0008647051562072086, 'batch_size': 32, 'dropout_rate': 0.4558195250888275, 'prior_mu': -0.0027678352028287943, 'prior_sigma': 0.06357660763900984, 'normalization': 'none'}. Best is trial 272 with value: 0.5198344707489013.
Generating morgan fingerprints...
Generated fingerprints with 2048 features for 900 molecules
Data shape: X=(900, 2048), y=(900,)
Trial 854: 5-fold CV loss = 0.5716
[I 2025-08-07 20:40:14,665] Trial 854 finished with value: 0.5715567409992218 and parameters: {'fp_type': 'morgan', 'morgan_only_radius': 2, 'morgan_only_nBits': 2048, 'num_hidden_layers': 3, 'hidden_dim_0': 64, 'hidden_dim_1': 128, 'hidden_dim_2': 512, 'kl_weight': 0.0034315585119594214, 'lr': 0.0012509799602946777, 'batch_size': 32, 'dropout_rate': 0.4551288997076594, 'prior_mu': -0.002118018375465054, 'prior_sigma': 0.06420986212378738, 'normalization': 'none'}. Best is trial 272 with value: 0.5198344707489013.
Generating morgan fingerprints...
Generated fingerprints with 2048 features for 900 molecules
Data shape: X=(900, 2048), y=(900,)
Trial 851: 5-fold CV loss = 0.5913
[I 2025-08-07 20:40:24,162] Trial 851 finished with value: 0.5913183093070984 and parameters: {'fp_type': 'morgan', 'morgan_only_radius': 2, 'morgan_only_nBits': 2048, 'num_hidden_layers': 3, 'hidden_dim_0': 512, 'hidden_dim_1': 128, 'hidden_dim_2': 512, 'kl_weight': 0.0027743006963464236, 'lr': 0.0032908350538610673, 'batch_size': 32, 'dropout_rate': 0.4695743976140699, 'prior_mu': -0.020073499674422568, 'prior_sigma': 0.010949093730513795, 'normalization': 'none'}. Best is trial 272 with value: 0.5198344707489013.
Generating morgan fingerprints...
Generated fingerprints with 2048 features for 900 molecules
Data shape: X=(900, 2048), y=(900,)
Trial 856: 5-fold CV loss = 0.6634
[I 2025-08-07 20:40:28,720] Trial 856 finished with value: 0.663351309299469 and parameters: {'fp_type': 'morgan', 'morgan_only_radius': 2, 'morgan_only_nBits': 2048, 'num_hidden_layers': 3, 'hidden_dim_0': 256, 'hidden_dim_1': 128, 'hidden_dim_2': 64, 'kl_weight': 0.0012381995635270477, 'lr': 0.002138788600202199, 'batch_size': 32, 'dropout_rate': 0.4998303406630721, 'prior_mu': -0.0016494498403145795, 'prior_sigma': 0.0763379261439253, 'normalization': 'none'}. Best is trial 272 with value: 0.5198344707489013.
Generating morgan fingerprints...
Generated fingerprints with 2048 features for 900 molecules
Data shape: X=(900, 2048), y=(900,)
Trial 858: 5-fold CV loss = 0.8527
[I 2025-08-07 20:40:44,103] Trial 858 finished with value: 0.8526966094970703 and parameters: {'fp_type': 'morgan', 'morgan_only_radius': 2, 'morgan_only_nBits': 2048, 'num_hidden_layers': 3, 'hidden_dim_0': 512, 'hidden_dim_1': 128, 'hidden_dim_2': 64, 'kl_weight': 0.001141374013789513, 'lr': 0.002149379310297587, 'batch_size': 32, 'dropout_rate': 0.4996932982862245, 'prior_mu': -0.01624719832482069, 'prior_sigma': 0.0859087373485862, 'normalization': 'none'}. Best is trial 272 with value: 0.5198344707489013.
Generating morgan fingerprints...
Generated fingerprints with 2048 features for 900 molecules
Data shape: X=(900, 2048), y=(900,)
Trial 857: 5-fold CV loss = 0.5461
[I 2025-08-07 20:41:17,334] Trial 857 finished with value: 0.5461170196533203 and parameters: {'fp_type': 'morgan', 'morgan_only_radius': 2, 'morgan_only_nBits': 2048, 'num_hidden_layers': 3, 'hidden_dim_0': 512, 'hidden_dim_1': 128, 'hidden_dim_2': 512, 'kl_weight': 0.001171411103781558, 'lr': 0.002134071744392774, 'batch_size': 32, 'dropout_rate': 0.4700457292609442, 'prior_mu': -0.15585612739695864, 'prior_sigma': 0.07004825519502839, 'normalization': 'none'}. Best is trial 272 with value: 0.5198344707489013.
Generating morgan fingerprints...
Generated fingerprints with 2048 features for 900 molecules
Data shape: X=(900, 2048), y=(900,)
Trial 861: 5-fold CV loss = 0.5296
[I 2025-08-07 20:42:13,899] Trial 861 finished with value: 0.5296276390552521 and parameters: {'fp_type': 'morgan', 'morgan_only_radius': 2, 'morgan_only_nBits': 2048, 'num_hidden_layers': 3, 'hidden_dim_0': 512, 'hidden_dim_1': 128, 'hidden_dim_2': 512, 'kl_weight': 0.002418630091019195, 'lr': 0.0019382899207854945, 'batch_size': 32, 'dropout_rate': 0.48075685839431587, 'prior_mu': -0.028371375967463378, 'prior_sigma': 0.06989224661509366, 'normalization': 'none'}. Best is trial 272 with value: 0.5198344707489013.
Generating morgan fingerprints...
Generated fingerprints with 2048 features for 900 molecules
Data shape: X=(900, 2048), y=(900,)
Trial 859: 5-fold CV loss = 0.7259
[I 2025-08-07 20:42:17,335] Trial 859 finished with value: 0.7259041666984558 and parameters: {'fp_type': 'morgan', 'morgan_only_radius': 2, 'morgan_only_nBits': 2048, 'num_hidden_layers': 3, 'hidden_dim_0': 512, 'hidden_dim_1': 128, 'hidden_dim_2': 64, 'kl_weight': 0.0012286033377873868, 'lr': 0.0021419375909126257, 'batch_size': 32, 'dropout_rate': 0.4908640176860086, 'prior_mu': -0.01598986550277008, 'prior_sigma': 0.0763341988065477, 'normalization': 'none'}. Best is trial 272 with value: 0.5198344707489013.
Generating morgan fingerprints...
Generated fingerprints with 2048 features for 900 molecules
Data shape: X=(900, 2048), y=(900,)
Trial 860: 5-fold CV loss = 0.5428
[I 2025-08-07 20:42:22,068] Trial 860 finished with value: 0.5428106367588044 and parameters: {'fp_type': 'morgan', 'morgan_only_radius': 2, 'morgan_only_nBits': 2048, 'num_hidden_layers': 3, 'hidden_dim_0': 512, 'hidden_dim_1': 128, 'hidden_dim_2': 512, 'kl_weight': 0.0015066945149526346, 'lr': 0.0019025166917691397, 'batch_size': 32, 'dropout_rate': 0.4897178986248962, 'prior_mu': 0.08034354027128617, 'prior_sigma': 0.08533679088987427, 'normalization': 'none'}. Best is trial 272 with value: 0.5198344707489013.
Generating morgan fingerprints...
Generated fingerprints with 1024 features for 900 molecules
Data shape: X=(900, 1024), y=(900,)
Trial 862: 5-fold CV loss = 0.5684
[I 2025-08-07 20:42:41,516] Trial 862 finished with value: 0.5684256255626678 and parameters: {'fp_type': 'morgan', 'morgan_only_radius': 2, 'morgan_only_nBits': 2048, 'num_hidden_layers': 3, 'hidden_dim_0': 512, 'hidden_dim_1': 128, 'hidden_dim_2': 512, 'kl_weight': 0.002490829680978654, 'lr': 0.0018894935264380463, 'batch_size': 32, 'dropout_rate': 0.483522923494374, 'prior_mu': -0.012510697075042166, 'prior_sigma': 0.05772104970736747, 'normalization': 'none'}. Best is trial 272 with value: 0.5198344707489013.
Generating morgan fingerprints...
Generated fingerprints with 1024 features for 900 molecules
Data shape: X=(900, 1024), y=(900,)
Trial 863: 5-fold CV loss = 0.7089
[I 2025-08-07 20:42:43,154] Trial 863 finished with value: 0.7089363932609558 and parameters: {'fp_type': 'morgan', 'morgan_only_radius': 2, 'morgan_only_nBits': 2048, 'num_hidden_layers': 3, 'hidden_dim_0': 512, 'hidden_dim_1': 128, 'hidden_dim_2': 512, 'kl_weight': 0.006772387104581182, 'lr': 0.0001995038136929602, 'batch_size': 32, 'dropout_rate': 0.427000122966384, 'prior_mu': -0.01070410753419512, 'prior_sigma': 0.05793562110970119, 'normalization': 'none'}. Best is trial 272 with value: 0.5198344707489013.
Generating morgan fingerprints...
Generated fingerprints with 1024 features for 900 molecules
Data shape: X=(900, 1024), y=(900,)
Trial 867: 5-fold CV loss = 0.5294
[I 2025-08-07 20:43:45,667] Trial 867 finished with value: 0.5294442772865295 and parameters: {'fp_type': 'morgan', 'morgan_only_radius': 3, 'morgan_only_nBits': 1024, 'num_hidden_layers': 3, 'hidden_dim_0': 512, 'hidden_dim_1': 128, 'hidden_dim_2': 512, 'kl_weight': 0.0035422863470492257, 'lr': 0.0024115552058229057, 'batch_size': 32, 'dropout_rate': 0.46225493662513395, 'prior_mu': -0.029385616863619627, 'prior_sigma': 0.0728681756393098, 'normalization': 'none'}. Best is trial 272 with value: 0.5198344707489013.
Generating morgan fingerprints...
Generated fingerprints with 1024 features for 900 molecules
Data shape: X=(900, 1024), y=(900,)
Trial 866: 5-fold CV loss = 0.5320
[I 2025-08-07 20:44:04,838] Trial 866 finished with value: 0.5320029556751251 and parameters: {'fp_type': 'morgan', 'morgan_only_radius': 2, 'morgan_only_nBits': 1024, 'num_hidden_layers': 3, 'hidden_dim_0': 512, 'hidden_dim_1': 128, 'hidden_dim_2': 512, 'kl_weight': 0.004891259293684623, 'lr': 0.002396670633597044, 'batch_size': 32, 'dropout_rate': 0.46318916507808816, 'prior_mu': -0.0333190614906068, 'prior_sigma': 0.07193246290356109, 'normalization': 'none'}. Best is trial 272 with value: 0.5198344707489013.
Generating morgan fingerprints...
Generated fingerprints with 1024 features for 900 molecules
Data shape: X=(900, 1024), y=(900,)
Trial 865: 5-fold CV loss = 0.5294
[I 2025-08-07 20:44:32,468] Trial 865 finished with value: 0.5293947458267212 and parameters: {'fp_type': 'morgan', 'morgan_only_radius': 3, 'morgan_only_nBits': 1024, 'num_hidden_layers': 3, 'hidden_dim_0': 512, 'hidden_dim_1': 128, 'hidden_dim_2': 512, 'kl_weight': 0.004701908520369602, 'lr': 0.0024353715072553002, 'batch_size': 32, 'dropout_rate': 0.4617492304164532, 'prior_mu': -0.009496504201769496, 'prior_sigma': 0.06041565749569626, 'normalization': 'none'}. Best is trial 272 with value: 0.5198344707489013.
Generating morgan fingerprints...
Generated fingerprints with 1024 features for 900 molecules
Data shape: X=(900, 1024), y=(900,)
Trial 868: 5-fold CV loss = 0.5232
[I 2025-08-07 20:44:55,349] Trial 868 finished with value: 0.5231534004211426 and parameters: {'fp_type': 'morgan', 'morgan_only_radius': 2, 'morgan_only_nBits': 1024, 'num_hidden_layers': 3, 'hidden_dim_0': 512, 'hidden_dim_1': 128, 'hidden_dim_2': 512, 'kl_weight': 0.005264392118071708, 'lr': 0.0026957497147948916, 'batch_size': 32, 'dropout_rate': 0.4743885946388381, 'prior_mu': 0.009243490221577088, 'prior_sigma': 0.06312231036793989, 'normalization': 'none'}. Best is trial 272 with value: 0.5198344707489013.
Generating morgan fingerprints...
Generated fingerprints with 1024 features for 900 molecules
Data shape: X=(900, 1024), y=(900,)
Trial 869: 5-fold CV loss = 0.5444
[I 2025-08-07 20:45:36,145] Trial 869 finished with value: 0.5443979263305664 and parameters: {'fp_type': 'morgan', 'morgan_only_radius': 2, 'morgan_only_nBits': 1024, 'num_hidden_layers': 3, 'hidden_dim_0': 512, 'hidden_dim_1': 128, 'hidden_dim_2': 128, 'kl_weight': 0.001378154481223165, 'lr': 0.002700277481109255, 'batch_size': 32, 'dropout_rate': 0.47452250179796435, 'prior_mu': 0.006471713696516245, 'prior_sigma': 0.06305434728555535, 'normalization': 'none'}. Best is trial 272 with value: 0.5198344707489013.
Generating morgan fingerprints...
Generated fingerprints with 1024 features for 900 molecules
Data shape: X=(900, 1024), y=(900,)
Trial 871: 5-fold CV loss = 0.5321
[I 2025-08-07 20:45:44,891] Trial 871 finished with value: 0.5320994257926941 and parameters: {'fp_type': 'morgan', 'morgan_only_radius': 2, 'morgan_only_nBits': 1024, 'num_hidden_layers': 3, 'hidden_dim_0': 512, 'hidden_dim_1': 128, 'hidden_dim_2': 512, 'kl_weight': 0.006337580300612239, 'lr': 0.0029122422407095705, 'batch_size': 32, 'dropout_rate': 0.4759454954628112, 'prior_mu': 0.01699489537946985, 'prior_sigma': 0.05637027023688007, 'normalization': 'none'}. Best is trial 272 with value: 0.5198344707489013.
Generating morgan fingerprints...
Generated fingerprints with 1024 features for 900 molecules
Data shape: X=(900, 1024), y=(900,)
Trial 872: 5-fold CV loss = 0.6766
[I 2025-08-07 20:45:56,887] Trial 872 finished with value: 0.6766144037246704 and parameters: {'fp_type': 'morgan', 'morgan_only_radius': 2, 'morgan_only_nBits': 1024, 'num_hidden_layers': 1, 'hidden_dim_0': 512, 'kl_weight': 0.006270300782536825, 'lr': 0.0028619323054232164, 'batch_size': 32, 'dropout_rate': 0.4816791983559804, 'prior_mu': 0.016393004531052427, 'prior_sigma': 0.049404496012823595, 'normalization': 'none'}. Best is trial 272 with value: 0.5198344707489013.
Generating morgan fingerprints...
Generated fingerprints with 2048 features for 900 molecules
Data shape: X=(900, 2048), y=(900,)
Trial 864: 5-fold CV loss = 0.5382
[I 2025-08-07 20:46:09,590] Trial 864 finished with value: 0.538154536485672 and parameters: {'fp_type': 'morgan', 'morgan_only_radius': 3, 'morgan_only_nBits': 2048, 'num_hidden_layers': 3, 'hidden_dim_0': 512, 'hidden_dim_1': 128, 'hidden_dim_2': 512, 'kl_weight': 0.0014576919315235552, 'lr': 0.0023833704184775422, 'batch_size': 32, 'dropout_rate': 0.4281158350586423, 'prior_mu': -0.008544186447989127, 'prior_sigma': 0.049224179337108875, 'normalization': 'none'}. Best is trial 272 with value: 0.5198344707489013.
Generating morgan fingerprints...
Generated fingerprints with 1024 features for 900 molecules
Data shape: X=(900, 1024), y=(900,)
Trial 873: 5-fold CV loss = 0.5398
[I 2025-08-07 20:46:37,831] Trial 873 finished with value: 0.5397807955741882 and parameters: {'fp_type': 'morgan', 'morgan_only_radius': 2, 'morgan_only_nBits': 1024, 'num_hidden_layers': 3, 'hidden_dim_0': 512, 'hidden_dim_1': 64, 'hidden_dim_2': 512, 'kl_weight': 0.006026954191130348, 'lr': 0.0033889198636690566, 'batch_size': 32, 'dropout_rate': 0.49071183663081974, 'prior_mu': 0.013121798974975174, 'prior_sigma': 0.05121808050065662, 'normalization': 'none'}. Best is trial 272 with value: 0.5198344707489013.
Generating morgan fingerprints...
Generated fingerprints with 1024 features for 900 molecules
Data shape: X=(900, 1024), y=(900,)
Trial 870: 5-fold CV loss = 0.5309
[I 2025-08-07 20:46:42,702] Trial 870 finished with value: 0.5309310674667358 and parameters: {'fp_type': 'morgan', 'morgan_only_radius': 2, 'morgan_only_nBits': 1024, 'num_hidden_layers': 3, 'hidden_dim_0': 512, 'hidden_dim_1': 128, 'hidden_dim_2': 512, 'kl_weight': 0.001401907154431084, 'lr': 0.0026621633435576415, 'batch_size': 32, 'dropout_rate': 0.47746390727516674, 'prior_mu': 0.004201773268849225, 'prior_sigma': 0.04795351961107673, 'normalization': 'none'}. Best is trial 272 with value: 0.5198344707489013.
Generating morgan fingerprints...
Generated fingerprints with 2048 features for 900 molecules
Data shape: X=(900, 2048), y=(900,)
Trial 874: 5-fold CV loss = 0.6912
[I 2025-08-07 20:47:01,703] Trial 874 finished with value: 0.691194725036621 and parameters: {'fp_type': 'morgan', 'morgan_only_radius': 2, 'morgan_only_nBits': 2048, 'num_hidden_layers': 3, 'hidden_dim_0': 128, 'hidden_dim_1': 128, 'hidden_dim_2': 512, 'kl_weight': 0.005223803449216076, 'lr': 0.0030908399419159495, 'batch_size': 32, 'dropout_rate': 0.4922771094994834, 'prior_mu': 0.03345996621783961, 'prior_sigma': 0.17137397565842277, 'normalization': 'none'}. Best is trial 272 with value: 0.5198344707489013.
Generating morgan fingerprints...
Generated fingerprints with 1024 features for 900 molecules
Data shape: X=(900, 1024), y=(900,)
Trial 876: 5-fold CV loss = 0.5310
[I 2025-08-07 20:47:44,410] Trial 876 finished with value: 0.5310169517993927 and parameters: {'fp_type': 'morgan', 'morgan_only_radius': 2, 'morgan_only_nBits': 1024, 'num_hidden_layers': 3, 'hidden_dim_0': 512, 'hidden_dim_1': 128, 'hidden_dim_2': 512, 'kl_weight': 0.005740996942451841, 'lr': 0.0026714461749175666, 'batch_size': 32, 'dropout_rate': 0.4910660518492648, 'prior_mu': 0.03441222063553596, 'prior_sigma': 0.06321210368944244, 'normalization': 'none'}. Best is trial 272 with value: 0.5198344707489013.
Generating morgan fingerprints...
Generated fingerprints with 1024 features for 900 molecules
Data shape: X=(900, 1024), y=(900,)
Trial 878: 5-fold CV loss = 0.6027
[I 2025-08-07 20:47:53,150] Trial 878 finished with value: 0.6027498245239258 and parameters: {'fp_type': 'morgan', 'morgan_only_radius': 2, 'morgan_only_nBits': 1024, 'num_hidden_layers': 2, 'hidden_dim_0': 512, 'hidden_dim_1': 128, 'kl_weight': 0.005024213962229221, 'lr': 0.0036121369178093938, 'batch_size': 32, 'dropout_rate': 0.24516860326247356, 'prior_mu': 0.007531091172364642, 'prior_sigma': 0.05535198709335714, 'normalization': 'none'}. Best is trial 272 with value: 0.5198344707489013.
Generating morgan fingerprints...
Generated fingerprints with 2048 features for 900 molecules
Data shape: X=(900, 2048), y=(900,)
Trial 879: 5-fold CV loss = 0.5361
[I 2025-08-07 20:48:35,005] Trial 879 finished with value: 0.5361085295677185 and parameters: {'fp_type': 'morgan', 'morgan_only_radius': 2, 'morgan_only_nBits': 1024, 'num_hidden_layers': 3, 'hidden_dim_0': 512, 'hidden_dim_1': 128, 'hidden_dim_2': 512, 'kl_weight': 0.0048912490512223235, 'lr': 0.0036163734897325943, 'batch_size': 32, 'dropout_rate': 0.48385906697707476, 'prior_mu': 0.008127091446028065, 'prior_sigma': 0.054416881834149104, 'normalization': 'none'}. Best is trial 272 with value: 0.5198344707489013.
Generating morgan fingerprints...
Generated fingerprints with 2048 features for 900 molecules
Data shape: X=(900, 2048), y=(900,)
Trial 880: 5-fold CV loss = 0.5275
