[I 2025-08-07 16:25:03,901] Trial 146 finished with value: 0.5408405840396882 and parameters: {'fp_type': 'morgan_rdkit', 'combined_morgan_radius': 3, 'combined_morgan_nBits': 1024, 'combined_rdkit_maxPath': 5, 'combined_rdkit_nBits': 1024, 'num_hidden_layers': 3, 'hidden_dim_0': 512, 'hidden_dim_1': 64, 'hidden_dim_2': 256, 'kl_weight': 0.00011455370283166162, 'lr': 0.0077830455412261, 'batch_size': 128, 'dropout_rate': 0.45618997384575477, 'prior_mu': -0.045602849085773715, 'prior_sigma': 0.07601938771602436, 'normalization': 'none'}. Best is trial 102 with value: 0.5316388070583343.
Generating morgan_rdkit fingerprints...
Generated fingerprints with 2048 features for 900 molecules
Data shape: X=(900, 2048), y=(900,)
Trial 148: 5-fold CV loss = 0.5423
[I 2025-08-07 16:25:17,591] Trial 148 finished with value: 0.5422505736351013 and parameters: {'fp_type': 'morgan_rdkit', 'combined_morgan_radius': 3, 'combined_morgan_nBits': 1024, 'combined_rdkit_maxPath': 5, 'combined_rdkit_nBits': 1024, 'num_hidden_layers': 3, 'hidden_dim_0': 512, 'hidden_dim_1': 64, 'hidden_dim_2': 256, 'kl_weight': 0.0001354873929419979, 'lr': 0.0076624213123992, 'batch_size': 128, 'dropout_rate': 0.46983500213901375, 'prior_mu': -0.04498191385594725, 'prior_sigma': 0.07669415618743206, 'normalization': 'none'}. Best is trial 102 with value: 0.5316388070583343.
Generating morgan_rdkit fingerprints...
Generated fingerprints with 1280 features for 900 molecules
Data shape: X=(900, 1280), y=(900,)
Trial 151: 5-fold CV loss = 0.5487
[I 2025-08-07 16:25:35,049] Trial 151 finished with value: 0.5487167775630951 and parameters: {'fp_type': 'morgan_rdkit', 'combined_morgan_radius': 2, 'combined_morgan_nBits': 1024, 'combined_rdkit_maxPath': 5, 'combined_rdkit_nBits': 256, 'num_hidden_layers': 3, 'hidden_dim_0': 512, 'hidden_dim_1': 64, 'hidden_dim_2': 256, 'kl_weight': 0.00022629115763753152, 'lr': 0.009335874112446027, 'batch_size': 128, 'dropout_rate': 0.43560198706663333, 'prior_mu': -0.0862270613862334, 'prior_sigma': 0.06866831427420939, 'normalization': 'none'}. Best is trial 102 with value: 0.5316388070583343.
Generating morgan_rdkit fingerprints...
Generated fingerprints with 2048 features for 900 molecules
Data shape: X=(900, 2048), y=(900,)
Trial 149: 5-fold CV loss = 0.5541
[I 2025-08-07 16:25:42,639] Trial 149 finished with value: 0.5541113555431366 and parameters: {'fp_type': 'morgan_rdkit', 'combined_morgan_radius': 3, 'combined_morgan_nBits': 1024, 'combined_rdkit_maxPath': 8, 'combined_rdkit_nBits': 1024, 'num_hidden_layers': 3, 'hidden_dim_0': 512, 'hidden_dim_1': 64, 'hidden_dim_2': 256, 'kl_weight': 0.00013489824349185233, 'lr': 0.007545411736220282, 'batch_size': 128, 'dropout_rate': 0.45645743101264213, 'prior_mu': 0.07594142352031216, 'prior_sigma': 0.07563105612375709, 'normalization': 'none'}. Best is trial 102 with value: 0.5316388070583343.
Generating morgan_rdkit fingerprints...
Generated fingerprints with 1536 features for 900 molecules
Data shape: X=(900, 1536), y=(900,)
Trial 150: 5-fold CV loss = 0.5529
[I 2025-08-07 16:25:45,072] Trial 150 finished with value: 0.5528651595115661 and parameters: {'fp_type': 'morgan_rdkit', 'combined_morgan_radius': 2, 'combined_morgan_nBits': 1024, 'combined_rdkit_maxPath': 8, 'combined_rdkit_nBits': 1024, 'num_hidden_layers': 3, 'hidden_dim_0': 512, 'hidden_dim_1': 64, 'hidden_dim_2': 256, 'kl_weight': 0.00014014016096290183, 'lr': 0.009554697799994056, 'batch_size': 128, 'dropout_rate': 0.2129783284431241, 'prior_mu': -0.08738232130004092, 'prior_sigma': 0.06884484283582255, 'normalization': 'none'}. Best is trial 102 with value: 0.5316388070583343.
Generating morgan_rdkit fingerprints...
Generated fingerprints with 1536 features for 900 molecules
Data shape: X=(900, 1536), y=(900,)
Trial 147: 5-fold CV loss = 0.5438
[I 2025-08-07 16:25:50,531] Trial 147 finished with value: 0.5438367366790772 and parameters: {'fp_type': 'morgan_rdkit', 'combined_morgan_radius': 3, 'combined_morgan_nBits': 1024, 'combined_rdkit_maxPath': 5, 'combined_rdkit_nBits': 1024, 'num_hidden_layers': 3, 'hidden_dim_0': 512, 'hidden_dim_1': 64, 'hidden_dim_2': 256, 'kl_weight': 0.004262496586434463, 'lr': 0.00811676896559045, 'batch_size': 128, 'dropout_rate': 0.47038516702776195, 'prior_mu': -0.0873434592402084, 'prior_sigma': 0.07704658584954838, 'normalization': 'none'}. Best is trial 102 with value: 0.5316388070583343.
Generating morgan_rdkit fingerprints...
Generated fingerprints with 1536 features for 900 molecules
Data shape: X=(900, 1536), y=(900,)
Trial 152: 5-fold CV loss = 0.5312
[I 2025-08-07 16:25:57,890] Trial 152 finished with value: 0.5312090873718261 and parameters: {'fp_type': 'morgan_rdkit', 'combined_morgan_radius': 2, 'combined_morgan_nBits': 1024, 'combined_rdkit_maxPath': 5, 'combined_rdkit_nBits': 1024, 'num_hidden_layers': 3, 'hidden_dim_0': 512, 'hidden_dim_1': 64, 'hidden_dim_2': 256, 'kl_weight': 0.00014581474985533892, 'lr': 0.00722758332811026, 'batch_size': 128, 'dropout_rate': 0.4842932350326312, 'prior_mu': -0.01754589803680901, 'prior_sigma': 0.06261685321458824, 'normalization': 'none'}. Best is trial 152 with value: 0.5312090873718261.
Generating morgan_rdkit fingerprints...
Generated fingerprints with 2048 features for 900 molecules
Data shape: X=(900, 2048), y=(900,)
Trial 154: 5-fold CV loss = 0.5828
[I 2025-08-07 16:26:12,678] Trial 154 finished with value: 0.5828181564807892 and parameters: {'fp_type': 'morgan_rdkit', 'combined_morgan_radius': 2, 'combined_morgan_nBits': 1024, 'combined_rdkit_maxPath': 5, 'combined_rdkit_nBits': 512, 'num_hidden_layers': 3, 'hidden_dim_0': 512, 'hidden_dim_1': 64, 'hidden_dim_2': 256, 'kl_weight': 0.00028093762755640667, 'lr': 0.005502744129445157, 'batch_size': 128, 'dropout_rate': 0.4841080816350933, 'prior_mu': 0.11380993393687025, 'prior_sigma': 0.1425601907328849, 'normalization': 'none'}. Best is trial 152 with value: 0.5312090873718261.
Generating morgan_rdkit fingerprints...
Generated fingerprints with 2048 features for 900 molecules
Data shape: X=(900, 2048), y=(900,)
Trial 153: 5-fold CV loss = 0.5559
[I 2025-08-07 16:26:15,806] Trial 153 finished with value: 0.5559190392494202 and parameters: {'fp_type': 'morgan_rdkit', 'combined_morgan_radius': 2, 'combined_morgan_nBits': 1024, 'combined_rdkit_maxPath': 5, 'combined_rdkit_nBits': 512, 'num_hidden_layers': 3, 'hidden_dim_0': 512, 'hidden_dim_1': 64, 'hidden_dim_2': 256, 'kl_weight': 0.00031393803685446023, 'lr': 0.0065149033090820055, 'batch_size': 128, 'dropout_rate': 0.20438198637631616, 'prior_mu': -0.10620348856460081, 'prior_sigma': 0.06229903676721241, 'normalization': 'none'}. Best is trial 152 with value: 0.5312090873718261.
Generating morgan_rdkit fingerprints...
Generated fingerprints with 2048 features for 900 molecules
Data shape: X=(900, 2048), y=(900,)
Trial 156: 5-fold CV loss = 0.5869
[I 2025-08-07 16:26:22,012] Trial 156 finished with value: 0.5869257807731628 and parameters: {'fp_type': 'morgan_rdkit', 'combined_morgan_radius': 2, 'combined_morgan_nBits': 1024, 'combined_rdkit_maxPath': 5, 'combined_rdkit_nBits': 1024, 'num_hidden_layers': 3, 'hidden_dim_0': 512, 'hidden_dim_1': 64, 'hidden_dim_2': 256, 'kl_weight': 0.00017531018918032142, 'lr': 0.006487983437852186, 'batch_size': 128, 'dropout_rate': 0.48311218349807333, 'prior_mu': -0.013406854900373646, 'prior_sigma': 0.14494043939984674, 'normalization': 'none'}. Best is trial 152 with value: 0.5312090873718261.
Generating morgan_rdkit fingerprints...
Generated fingerprints with 2048 features for 900 molecules
Data shape: X=(900, 2048), y=(900,)
Trial 159: 5-fold CV loss = 0.5367
[I 2025-08-07 16:26:42,675] Trial 159 finished with value: 0.536730694770813 and parameters: {'fp_type': 'morgan_rdkit', 'combined_morgan_radius': 2, 'combined_morgan_nBits': 1024, 'combined_rdkit_maxPath': 5, 'combined_rdkit_nBits': 1024, 'num_hidden_layers': 3, 'hidden_dim_0': 512, 'hidden_dim_1': 64, 'hidden_dim_2': 256, 'kl_weight': 0.00011529832387436893, 'lr': 0.007191973941466072, 'batch_size': 128, 'dropout_rate': 0.49928629501955807, 'prior_mu': -0.019139796047256293, 'prior_sigma': 0.06419078863278051, 'normalization': 'none'}. Best is trial 152 with value: 0.5312090873718261.
Generating morgan fingerprints...
Generated fingerprints with 1024 features for 900 molecules
Data shape: X=(900, 1024), y=(900,)
Trial 157: 5-fold CV loss = 0.5372
[I 2025-08-07 16:26:46,248] Trial 157 finished with value: 0.5371692478656769 and parameters: {'fp_type': 'morgan_rdkit', 'combined_morgan_radius': 2, 'combined_morgan_nBits': 1024, 'combined_rdkit_maxPath': 5, 'combined_rdkit_nBits': 1024, 'num_hidden_layers': 3, 'hidden_dim_0': 512, 'hidden_dim_1': 64, 'hidden_dim_2': 256, 'kl_weight': 0.00018202263909386813, 'lr': 0.006518516975698483, 'batch_size': 128, 'dropout_rate': 0.4999576515016317, 'prior_mu': -0.02433915589124286, 'prior_sigma': 0.08273652682015849, 'normalization': 'none'}. Best is trial 152 with value: 0.5312090873718261.
Generating morgan fingerprints...
Generated fingerprints with 1024 features for 900 molecules
Data shape: X=(900, 1024), y=(900,)
Trial 158: 5-fold CV loss = 0.5321
[I 2025-08-07 16:26:57,061] Trial 158 finished with value: 0.5321307301521301 and parameters: {'fp_type': 'morgan_rdkit', 'combined_morgan_radius': 2, 'combined_morgan_nBits': 1024, 'combined_rdkit_maxPath': 5, 'combined_rdkit_nBits': 1024, 'num_hidden_layers': 3, 'hidden_dim_0': 512, 'hidden_dim_1': 64, 'hidden_dim_2': 256, 'kl_weight': 0.0001830972782085292, 'lr': 0.0070833841022203345, 'batch_size': 128, 'dropout_rate': 0.48612239939979573, 'prior_mu': -0.011407633282922013, 'prior_sigma': 0.06412895001516307, 'normalization': 'none'}. Best is trial 152 with value: 0.5312090873718261.
Generating morgan fingerprints...
Generated fingerprints with 1024 features for 900 molecules
Data shape: X=(900, 1024), y=(900,)
Trial 155: 5-fold CV loss = 0.5367
[I 2025-08-07 16:26:59,336] Trial 155 finished with value: 0.5366957128047943 and parameters: {'fp_type': 'morgan_rdkit', 'combined_morgan_radius': 2, 'combined_morgan_nBits': 1024, 'combined_rdkit_maxPath': 5, 'combined_rdkit_nBits': 512, 'num_hidden_layers': 3, 'hidden_dim_0': 512, 'hidden_dim_1': 64, 'hidden_dim_2': 256, 'kl_weight': 0.00031593747289236174, 'lr': 0.005760671058549138, 'batch_size': 128, 'dropout_rate': 0.3079760062099561, 'prior_mu': 0.12000596524272508, 'prior_sigma': 0.0592859194581251, 'normalization': 'none'}. Best is trial 152 with value: 0.5312090873718261.
Generating morgan fingerprints...
Generated fingerprints with 1024 features for 900 molecules
Data shape: X=(900, 1024), y=(900,)
Trial 160: 5-fold CV loss = 0.5445
[I 2025-08-07 16:27:03,446] Trial 160 finished with value: 0.5445308327674866 and parameters: {'fp_type': 'morgan', 'morgan_only_radius': 2, 'morgan_only_nBits': 1024, 'num_hidden_layers': 3, 'hidden_dim_0': 256, 'hidden_dim_1': 64, 'hidden_dim_2': 1024, 'kl_weight': 0.00015115003548261821, 'lr': 0.007091075262317163, 'batch_size': 64, 'dropout_rate': 0.36717565148033493, 'prior_mu': -0.020411949497843848, 'prior_sigma': 0.05891368998821525, 'normalization': 'none'}. Best is trial 152 with value: 0.5312090873718261.
Generating morgan_rdkit fingerprints...
Generated fingerprints with 1536 features for 900 molecules
Data shape: X=(900, 1536), y=(900,)
Trial 164: 5-fold CV loss = 0.5458
[I 2025-08-07 16:27:24,133] Trial 164 finished with value: 0.5457571446895599 and parameters: {'fp_type': 'morgan_rdkit', 'combined_morgan_radius': 2, 'combined_morgan_nBits': 1024, 'combined_rdkit_maxPath': 5, 'combined_rdkit_nBits': 512, 'num_hidden_layers': 3, 'hidden_dim_0': 512, 'hidden_dim_1': 64, 'hidden_dim_2': 256, 'kl_weight': 0.000371920314317042, 'lr': 0.004948070597422426, 'batch_size': 128, 'dropout_rate': 0.2746846161636795, 'prior_mu': -0.032703279519581054, 'prior_sigma': 0.06318577843051217, 'normalization': 'none'}. Best is trial 152 with value: 0.5312090873718261.
Generating morgan_rdkit fingerprints...
Generated fingerprints with 1536 features for 900 molecules
Data shape: X=(900, 1536), y=(900,)
Trial 161: 5-fold CV loss = 0.5449
[I 2025-08-07 16:27:33,266] Trial 161 finished with value: 0.5449400782585144 and parameters: {'fp_type': 'morgan', 'morgan_only_radius': 2, 'morgan_only_nBits': 1024, 'num_hidden_layers': 3, 'hidden_dim_0': 512, 'hidden_dim_1': 128, 'hidden_dim_2': 256, 'kl_weight': 0.00019311819750069198, 'lr': 0.004102975079529258, 'batch_size': 64, 'dropout_rate': 0.37170676130565583, 'prior_mu': -0.023267768939148996, 'prior_sigma': 0.06046738482854, 'normalization': 'none'}. Best is trial 152 with value: 0.5312090873718261.
Generating morgan_rdkit fingerprints...
Generated fingerprints with 1536 features for 900 molecules
Data shape: X=(900, 1536), y=(900,)
Trial 162: 5-fold CV loss = 0.5486
[I 2025-08-07 16:27:42,152] Trial 162 finished with value: 0.5486192107200623 and parameters: {'fp_type': 'morgan', 'morgan_only_radius': 2, 'morgan_only_nBits': 1024, 'num_hidden_layers': 3, 'hidden_dim_0': 256, 'hidden_dim_1': 128, 'hidden_dim_2': 1024, 'kl_weight': 0.00019270870052555958, 'lr': 0.006930836071699066, 'batch_size': 64, 'dropout_rate': 0.3083647973363371, 'prior_mu': -0.021714362905009162, 'prior_sigma': 0.05919070495270094, 'normalization': 'none'}. Best is trial 152 with value: 0.5312090873718261.
Generating morgan_rdkit fingerprints...
Generated fingerprints with 1536 features for 900 molecules
Data shape: X=(900, 1536), y=(900,)
Trial 165: 5-fold CV loss = 0.5598
[I 2025-08-07 16:27:45,887] Trial 165 finished with value: 0.5598278224468232 and parameters: {'fp_type': 'morgan_rdkit', 'combined_morgan_radius': 2, 'combined_morgan_nBits': 1024, 'combined_rdkit_maxPath': 5, 'combined_rdkit_nBits': 512, 'num_hidden_layers': 3, 'hidden_dim_0': 512, 'hidden_dim_1': 128, 'hidden_dim_2': 256, 'kl_weight': 0.0002531927393302181, 'lr': 0.004045919466900224, 'batch_size': 128, 'dropout_rate': 0.2963174952283608, 'prior_mu': 8.246296155836608e-05, 'prior_sigma': 0.056913304855948775, 'normalization': 'none'}. Best is trial 152 with value: 0.5312090873718261.
Generating morgan_rdkit fingerprints...
Generated fingerprints with 1536 features for 900 molecules
Data shape: X=(900, 1536), y=(900,)
Trial 166: 5-fold CV loss = 0.5453
[I 2025-08-07 16:27:57,998] Trial 166 finished with value: 0.5452978670597076 and parameters: {'fp_type': 'morgan_rdkit', 'combined_morgan_radius': 2, 'combined_morgan_nBits': 1024, 'combined_rdkit_maxPath': 5, 'combined_rdkit_nBits': 512, 'num_hidden_layers': 3, 'hidden_dim_0': 512, 'hidden_dim_1': 64, 'hidden_dim_2': 256, 'kl_weight': 0.000217606471261257, 'lr': 0.005891143324088694, 'batch_size': 128, 'dropout_rate': 0.310955041579359, 'prior_mu': -0.001221604909730608, 'prior_sigma': 0.05542281813916561, 'normalization': 'none'}. Best is trial 152 with value: 0.5312090873718261.
Generating morgan_rdkit fingerprints...
Generated fingerprints with 1536 features for 900 molecules
Data shape: X=(900, 1536), y=(900,)
Trial 167: 5-fold CV loss = 0.5454
[I 2025-08-07 16:28:11,614] Trial 167 finished with value: 0.5453632593154907 and parameters: {'fp_type': 'morgan_rdkit', 'combined_morgan_radius': 2, 'combined_morgan_nBits': 1024, 'combined_rdkit_maxPath': 5, 'combined_rdkit_nBits': 512, 'num_hidden_layers': 3, 'hidden_dim_0': 512, 'hidden_dim_1': 64, 'hidden_dim_2': 256, 'kl_weight': 0.00025330765884547837, 'lr': 0.005854169641574413, 'batch_size': 128, 'dropout_rate': 0.29808134196150504, 'prior_mu': -0.008645120985572508, 'prior_sigma': 0.05542734283843159, 'normalization': 'none'}. Best is trial 152 with value: 0.5312090873718261.
Generating morgan_rdkit fingerprints...
Generated fingerprints with 1536 features for 900 molecules
Data shape: X=(900, 1536), y=(900,)
Trial 168: 5-fold CV loss = 0.5297
[I 2025-08-07 16:28:14,036] Trial 168 finished with value: 0.5297382354736329 and parameters: {'fp_type': 'morgan_rdkit', 'combined_morgan_radius': 2, 'combined_morgan_nBits': 1024, 'combined_rdkit_maxPath': 5, 'combined_rdkit_nBits': 512, 'num_hidden_layers': 3, 'hidden_dim_0': 512, 'hidden_dim_1': 64, 'hidden_dim_2': 256, 'kl_weight': 0.00022504733312366724, 'lr': 0.005962488498369355, 'batch_size': 128, 'dropout_rate': 0.4997844388184508, 'prior_mu': -0.014943583486966377, 'prior_sigma': 0.05292616812996548, 'normalization': 'none'}. Best is trial 168 with value: 0.5297382354736329.
Generating morgan_rdkit fingerprints...
Generated fingerprints with 1024 features for 900 molecules
Data shape: X=(900, 1024), y=(900,)
Trial 169: 5-fold CV loss = 0.6025
[I 2025-08-07 16:28:35,341] Trial 169 finished with value: 0.6025081098079681 and parameters: {'fp_type': 'morgan_rdkit', 'combined_morgan_radius': 2, 'combined_morgan_nBits': 512, 'combined_rdkit_maxPath': 5, 'combined_rdkit_nBits': 1024, 'num_hidden_layers': 3, 'hidden_dim_0': 512, 'hidden_dim_1': 64, 'hidden_dim_2': 64, 'kl_weight': 0.00016392305982823406, 'lr': 0.005352683106415426, 'batch_size': 128, 'dropout_rate': 0.47574943848986245, 'prior_mu': -0.012297457428696867, 'prior_sigma': 0.0659077082178055, 'normalization': 'none'}. Best is trial 168 with value: 0.5297382354736329.
Generating morgan_rdkit fingerprints...
Generated fingerprints with 1536 features for 900 molecules
Data shape: X=(900, 1536), y=(900,)
Trial 171: 5-fold CV loss = 0.5639
[I 2025-08-07 16:28:40,327] Trial 171 finished with value: 0.5638503551483154 and parameters: {'fp_type': 'morgan_rdkit', 'combined_morgan_radius': 2, 'combined_morgan_nBits': 512, 'combined_rdkit_maxPath': 6, 'combined_rdkit_nBits': 512, 'num_hidden_layers': 3, 'hidden_dim_0': 512, 'hidden_dim_1': 64, 'hidden_dim_2': 64, 'kl_weight': 0.00031360645532006547, 'lr': 0.00516576147463923, 'batch_size': 128, 'dropout_rate': 0.3195293204661136, 'prior_mu': -0.011942359005260495, 'prior_sigma': 0.06430643171832495, 'normalization': 'none'}. Best is trial 168 with value: 0.5297382354736329.
Generating morgan_rdkit fingerprints...
Generated fingerprints with 1536 features for 900 molecules
Data shape: X=(900, 1536), y=(900,)
Trial 170: 5-fold CV loss = 0.5556
[I 2025-08-07 16:28:54,282] Trial 170 finished with value: 0.5555648565292358 and parameters: {'fp_type': 'morgan_rdkit', 'combined_morgan_radius': 2, 'combined_morgan_nBits': 512, 'combined_rdkit_maxPath': 5, 'combined_rdkit_nBits': 1024, 'num_hidden_layers': 3, 'hidden_dim_0': 512, 'hidden_dim_1': 64, 'hidden_dim_2': 64, 'kl_weight': 0.0003508324039830661, 'lr': 0.00526831525632153, 'batch_size': 128, 'dropout_rate': 0.3177308615192997, 'prior_mu': -0.031716779470518514, 'prior_sigma': 0.06531408397672725, 'normalization': 'none'}. Best is trial 168 with value: 0.5297382354736329.
Generating morgan_rdkit fingerprints...
Generated fingerprints with 1536 features for 900 molecules
Data shape: X=(900, 1536), y=(900,)
Trial 173: 5-fold CV loss = 0.5856
[I 2025-08-07 16:28:58,425] Trial 173 finished with value: 0.5856284081935883 and parameters: {'fp_type': 'morgan_rdkit', 'combined_morgan_radius': 2, 'combined_morgan_nBits': 1024, 'combined_rdkit_maxPath': 5, 'combined_rdkit_nBits': 512, 'num_hidden_layers': 3, 'hidden_dim_0': 512, 'hidden_dim_1': 64, 'hidden_dim_2': 512, 'kl_weight': 0.00039144230143669953, 'lr': 0.004600179248121236, 'batch_size': 128, 'dropout_rate': 0.48647008911748757, 'prior_mu': 0.02188300758294832, 'prior_sigma': 0.049839027555307044, 'normalization': 'none'}. Best is trial 168 with value: 0.5297382354736329.
Generating morgan_rdkit fingerprints...
Generated fingerprints with 1536 features for 900 molecules
Data shape: X=(900, 1536), y=(900,)
Trial 172: 5-fold CV loss = 0.6092
[I 2025-08-07 16:29:02,259] Trial 172 finished with value: 0.609188836812973 and parameters: {'fp_type': 'morgan_rdkit', 'combined_morgan_radius': 2, 'combined_morgan_nBits': 1024, 'combined_rdkit_maxPath': 5, 'combined_rdkit_nBits': 512, 'num_hidden_layers': 3, 'hidden_dim_0': 512, 'hidden_dim_1': 64, 'hidden_dim_2': 512, 'kl_weight': 0.00033004799299881445, 'lr': 0.006360961649074343, 'batch_size': 128, 'dropout_rate': 0.4877916165177966, 'prior_mu': 0.014951528741493681, 'prior_sigma': 0.05034316570759146, 'normalization': 'layer'}. Best is trial 168 with value: 0.5297382354736329.
Generating morgan_rdkit fingerprints...
Generated fingerprints with 2048 features for 900 molecules
Data shape: X=(900, 2048), y=(900,)
Trial 163: 5-fold CV loss = 0.5356
[I 2025-08-07 16:29:05,535] Trial 163 finished with value: 0.5356227457523346 and parameters: {'fp_type': 'morgan', 'morgan_only_radius': 2, 'morgan_only_nBits': 1024, 'num_hidden_layers': 3, 'hidden_dim_0': 256, 'hidden_dim_1': 128, 'hidden_dim_2': 1024, 'kl_weight': 0.0004063467171879536, 'lr': 0.004153122350534875, 'batch_size': 64, 'dropout_rate': 0.2970320525990154, 'prior_mu': -0.004243694491556732, 'prior_sigma': 0.0655025262740833, 'normalization': 'none'}. Best is trial 168 with value: 0.5297382354736329.
Generating morgan fingerprints...
Generated fingerprints with 1024 features for 900 molecules
Data shape: X=(900, 1024), y=(900,)
Trial 176: 5-fold CV loss = 0.5345
[I 2025-08-07 16:29:24,374] Trial 176 finished with value: 0.5344703793525696 and parameters: {'fp_type': 'morgan_rdkit', 'combined_morgan_radius': 2, 'combined_morgan_nBits': 1024, 'combined_rdkit_maxPath': 5, 'combined_rdkit_nBits': 1024, 'num_hidden_layers': 3, 'hidden_dim_0': 512, 'hidden_dim_1': 64, 'hidden_dim_2': 256, 'kl_weight': 0.00012125040411188644, 'lr': 0.007243327975664154, 'batch_size': 128, 'dropout_rate': 0.4972374918880814, 'prior_mu': -0.019164140022407804, 'prior_sigma': 0.07042261132039647, 'normalization': 'none'}. Best is trial 168 with value: 0.5297382354736329.
Generating morgan fingerprints...
Generated fingerprints with 1024 features for 900 molecules
Data shape: X=(900, 1024), y=(900,)
Trial 175: 5-fold CV loss = 0.5339
