[I 2025-08-08 04:41:33,829] Trial 2170 finished with value: 0.7318244695663452 and parameters: {'fp_type': 'morgan', 'morgan_only_radius': 2, 'morgan_only_nBits': 2048, 'num_hidden_layers': 3, 'hidden_dim_0': 512, 'hidden_dim_1': 512, 'hidden_dim_2': 256, 'kl_weight': 0.0005939626922667797, 'lr': 0.002297030514837233, 'batch_size': 32, 'dropout_rate': 0.45476321035700007, 'prior_mu': 0.04925653161960718, 'prior_sigma': 0.06939773621357732, 'normalization': 'none'}. Best is trial 1528 with value: 0.5170644640922546.
Generating morgan fingerprints...
Generated fingerprints with 2048 features for 900 molecules
Data shape: X=(900, 2048), y=(900,)
Trial 2175: 5-fold CV loss = 0.7270
[I 2025-08-08 04:42:11,299] Trial 2175 finished with value: 0.7269683241844177 and parameters: {'fp_type': 'morgan', 'morgan_only_radius': 2, 'morgan_only_nBits': 2048, 'num_hidden_layers': 3, 'hidden_dim_0': 512, 'hidden_dim_1': 64, 'hidden_dim_2': 128, 'kl_weight': 0.012601536514478172, 'lr': 0.0015394356480406368, 'batch_size': 64, 'dropout_rate': 0.43462898178334614, 'prior_mu': 0.05713946802612825, 'prior_sigma': 0.06916141018375492, 'normalization': 'none'}. Best is trial 1528 with value: 0.5170644640922546.
Generating morgan fingerprints...
Generated fingerprints with 2048 features for 900 molecules
Data shape: X=(900, 2048), y=(900,)
Trial 2174: 5-fold CV loss = 0.5784
[I 2025-08-08 04:42:17,227] Trial 2174 finished with value: 0.5784309148788452 and parameters: {'fp_type': 'morgan', 'morgan_only_radius': 2, 'morgan_only_nBits': 2048, 'num_hidden_layers': 3, 'hidden_dim_0': 512, 'hidden_dim_1': 64, 'hidden_dim_2': 128, 'kl_weight': 0.0008464855415022542, 'lr': 0.003581510626093432, 'batch_size': 64, 'dropout_rate': 0.4018993585154398, 'prior_mu': 0.05696640897134056, 'prior_sigma': 0.07049623281994535, 'normalization': 'none'}. Best is trial 1528 with value: 0.5170644640922546.
Generating morgan fingerprints...
Generated fingerprints with 2048 features for 900 molecules
Data shape: X=(900, 2048), y=(900,)
Trial 2173: 5-fold CV loss = 0.6354
[I 2025-08-08 04:42:29,732] Trial 2173 finished with value: 0.6354299902915954 and parameters: {'fp_type': 'rdkit', 'rdkit_only_maxPath': 5, 'rdkit_only_nBits': 256, 'num_hidden_layers': 3, 'hidden_dim_0': 512, 'hidden_dim_1': 64, 'hidden_dim_2': 256, 'kl_weight': 0.000829927647045248, 'lr': 0.0015205560200356961, 'batch_size': 32, 'dropout_rate': 0.4036326292650644, 'prior_mu': 0.042279344973788324, 'prior_sigma': 0.068938296029408, 'normalization': 'none'}. Best is trial 1528 with value: 0.5170644640922546.
Generating morgan fingerprints...
Generated fingerprints with 2048 features for 900 molecules
Data shape: X=(900, 2048), y=(900,)
Trial 2169: 5-fold CV loss = 0.5644
[I 2025-08-08 04:43:19,914] Trial 2169 finished with value: 0.5644129395484925 and parameters: {'fp_type': 'morgan', 'morgan_only_radius': 2, 'morgan_only_nBits': 2048, 'num_hidden_layers': 3, 'hidden_dim_0': 512, 'hidden_dim_1': 64, 'hidden_dim_2': 256, 'kl_weight': 0.0004242634925769236, 'lr': 0.002238469200928316, 'batch_size': 32, 'dropout_rate': 0.4063624462586661, 'prior_mu': 0.047561125373742505, 'prior_sigma': 0.07938444192226475, 'normalization': 'none'}. Best is trial 1528 with value: 0.5170644640922546.
Generating morgan_rdkit fingerprints...
Generated fingerprints with 1536 features for 900 molecules
Data shape: X=(900, 1536), y=(900,)
Trial 2178: 5-fold CV loss = 3.5164
[I 2025-08-08 04:43:36,297] Trial 2178 finished with value: 3.51639084815979 and parameters: {'fp_type': 'morgan', 'morgan_only_radius': 2, 'morgan_only_nBits': 2048, 'num_hidden_layers': 3, 'hidden_dim_0': 512, 'hidden_dim_1': 1024, 'hidden_dim_2': 1024, 'kl_weight': 0.08837038330107264, 'lr': 0.002598962702360089, 'batch_size': 32, 'dropout_rate': 0.4396793441870478, 'prior_mu': 0.029909385345868258, 'prior_sigma': 0.17356867737910003, 'normalization': 'none'}. Best is trial 1528 with value: 0.5170644640922546.
Generating morgan_rdkit fingerprints...
Generated fingerprints with 1536 features for 900 molecules
Data shape: X=(900, 1536), y=(900,)
Trial 2177: 5-fold CV loss = 1.2709
[I 2025-08-08 04:43:48,216] Trial 2177 finished with value: 1.2709193348884582 and parameters: {'fp_type': 'morgan', 'morgan_only_radius': 2, 'morgan_only_nBits': 2048, 'num_hidden_layers': 3, 'hidden_dim_0': 512, 'hidden_dim_1': 1024, 'hidden_dim_2': 1024, 'kl_weight': 0.09009562998384638, 'lr': 0.0025948978281189797, 'batch_size': 32, 'dropout_rate': 0.44202194140315737, 'prior_mu': 0.030455081740741297, 'prior_sigma': 0.07459288211654404, 'normalization': 'none'}. Best is trial 1528 with value: 0.5170644640922546.
Generating morgan_rdkit fingerprints...
Generated fingerprints with 1536 features for 900 molecules
Data shape: X=(900, 1536), y=(900,)
Trial 2176: 5-fold CV loss = 0.5245
[I 2025-08-08 04:44:24,688] Trial 2176 finished with value: 0.5244968950748443 and parameters: {'fp_type': 'morgan', 'morgan_only_radius': 2, 'morgan_only_nBits': 2048, 'num_hidden_layers': 3, 'hidden_dim_0': 512, 'hidden_dim_1': 64, 'hidden_dim_2': 256, 'kl_weight': 0.0008469798081447357, 'lr': 0.002595205533972928, 'batch_size': 32, 'dropout_rate': 0.44129440152598914, 'prior_mu': 0.040529522767144006, 'prior_sigma': 0.075657614341062, 'normalization': 'none'}. Best is trial 1528 with value: 0.5170644640922546.
Generating morgan_rdkit fingerprints...
Generated fingerprints with 1536 features for 900 molecules
Data shape: X=(900, 1536), y=(900,)
Trial 2180: 5-fold CV loss = 0.6304
[I 2025-08-08 04:44:40,108] Trial 2180 finished with value: 0.6304326176643371 and parameters: {'fp_type': 'morgan_rdkit', 'combined_morgan_radius': 3, 'combined_morgan_nBits': 1024, 'combined_rdkit_maxPath': 8, 'combined_rdkit_nBits': 512, 'num_hidden_layers': 3, 'hidden_dim_0': 512, 'hidden_dim_1': 64, 'hidden_dim_2': 64, 'kl_weight': 0.0007070106789756749, 'lr': 0.0013575876105406295, 'batch_size': 32, 'dropout_rate': 0.4279904516229023, 'prior_mu': 0.08224923318735819, 'prior_sigma': 0.07360980492057384, 'normalization': 'none'}. Best is trial 1528 with value: 0.5170644640922546.
Generating morgan fingerprints...
Generated fingerprints with 2048 features for 900 molecules
Data shape: X=(900, 2048), y=(900,)
Trial 2181: 5-fold CV loss = 0.6108
[I 2025-08-08 04:44:48,920] Trial 2181 finished with value: 0.6107604622840881 and parameters: {'fp_type': 'morgan_rdkit', 'combined_morgan_radius': 3, 'combined_morgan_nBits': 1024, 'combined_rdkit_maxPath': 8, 'combined_rdkit_nBits': 512, 'num_hidden_layers': 3, 'hidden_dim_0': 512, 'hidden_dim_1': 64, 'hidden_dim_2': 64, 'kl_weight': 0.0007573702232737321, 'lr': 0.001710775071337557, 'batch_size': 32, 'dropout_rate': 0.42218675785155163, 'prior_mu': 0.0835906911862901, 'prior_sigma': 0.0898018182891608, 'normalization': 'none'}. Best is trial 1528 with value: 0.5170644640922546.
Generating morgan fingerprints...
Generated fingerprints with 2048 features for 900 molecules
Data shape: X=(900, 2048), y=(900,)
Trial 2183: 5-fold CV loss = 0.6601
[I 2025-08-08 04:45:25,560] Trial 2183 finished with value: 0.6601215243339539 and parameters: {'fp_type': 'morgan', 'morgan_only_radius': 2, 'morgan_only_nBits': 2048, 'num_hidden_layers': 3, 'hidden_dim_0': 512, 'hidden_dim_1': 256, 'hidden_dim_2': 256, 'kl_weight': 0.0005071007538009373, 'lr': 0.0017882039902207252, 'batch_size': 32, 'dropout_rate': 0.021229194125222672, 'prior_mu': 0.05778988671629111, 'prior_sigma': 0.06889268648364845, 'normalization': 'none'}. Best is trial 1528 with value: 0.5170644640922546.
Generating morgan fingerprints...
Generated fingerprints with 2048 features for 900 molecules
Data shape: X=(900, 2048), y=(900,)
Trial 2184: 5-fold CV loss = 0.5627
[I 2025-08-08 04:46:02,361] Trial 2184 finished with value: 0.5626652896404266 and parameters: {'fp_type': 'morgan', 'morgan_only_radius': 2, 'morgan_only_nBits': 2048, 'num_hidden_layers': 3, 'hidden_dim_0': 512, 'hidden_dim_1': 512, 'hidden_dim_2': 256, 'kl_weight': 0.00051730128477509, 'lr': 0.005088726715518887, 'batch_size': 32, 'dropout_rate': 0.453328838139764, 'prior_mu': 0.057635864249094566, 'prior_sigma': 0.0680092759113567, 'normalization': 'none'}. Best is trial 1528 with value: 0.5170644640922546.
Generating morgan fingerprints...
Generated fingerprints with 2048 features for 900 molecules
Data shape: X=(900, 2048), y=(900,)
Trial 2185: 5-fold CV loss = 0.5349
[I 2025-08-08 04:46:44,577] Trial 2185 finished with value: 0.5349308907985687 and parameters: {'fp_type': 'morgan', 'morgan_only_radius': 2, 'morgan_only_nBits': 2048, 'num_hidden_layers': 3, 'hidden_dim_0': 1024, 'hidden_dim_1': 64, 'hidden_dim_2': 256, 'kl_weight': 0.0005380547459074654, 'lr': 0.0021987531774310476, 'batch_size': 32, 'dropout_rate': 0.4570093205146084, 'prior_mu': 0.038643430943013556, 'prior_sigma': 0.08355076908571198, 'normalization': 'none'}. Best is trial 1528 with value: 0.5170644640922546.
Generating morgan fingerprints...
Generated fingerprints with 2048 features for 900 molecules
Data shape: X=(900, 2048), y=(900,)
Trial 2179: 5-fold CV loss = 0.6029
[I 2025-08-08 04:46:49,971] Trial 2179 finished with value: 0.6028662085533142 and parameters: {'fp_type': 'morgan_rdkit', 'combined_morgan_radius': 3, 'combined_morgan_nBits': 1024, 'combined_rdkit_maxPath': 8, 'combined_rdkit_nBits': 512, 'num_hidden_layers': 3, 'hidden_dim_0': 512, 'hidden_dim_1': 1024, 'hidden_dim_2': 1024, 'kl_weight': 0.0007078580294489982, 'lr': 0.0026163506700926553, 'batch_size': 32, 'dropout_rate': 0.4382309700005499, 'prior_mu': 0.030403279466883662, 'prior_sigma': 0.07396840063787252, 'normalization': 'none'}. Best is trial 1528 with value: 0.5170644640922546.
Generating morgan fingerprints...
Generated fingerprints with 2048 features for 900 molecules
Data shape: X=(900, 2048), y=(900,)
Trial 2182: 5-fold CV loss = 0.5537
[I 2025-08-08 04:47:21,256] Trial 2182 finished with value: 0.5536899983882904 and parameters: {'fp_type': 'morgan_rdkit', 'combined_morgan_radius': 3, 'combined_morgan_nBits': 1024, 'combined_rdkit_maxPath': 8, 'combined_rdkit_nBits': 512, 'num_hidden_layers': 3, 'hidden_dim_0': 512, 'hidden_dim_1': 256, 'hidden_dim_2': 64, 'kl_weight': 0.0007602397036682479, 'lr': 0.0013580762141057888, 'batch_size': 32, 'dropout_rate': 0.42440328302679664, 'prior_mu': 0.05758965912643298, 'prior_sigma': 0.07193971477752083, 'normalization': 'none'}. Best is trial 1528 with value: 0.5170644640922546.
Generating morgan fingerprints...
Generated fingerprints with 2048 features for 900 molecules
Data shape: X=(900, 2048), y=(900,)
Trial 2186: 5-fold CV loss = 0.5279
[I 2025-08-08 04:47:24,577] Trial 2186 finished with value: 0.5279462933540344 and parameters: {'fp_type': 'morgan', 'morgan_only_radius': 2, 'morgan_only_nBits': 2048, 'num_hidden_layers': 3, 'hidden_dim_0': 1024, 'hidden_dim_1': 64, 'hidden_dim_2': 256, 'kl_weight': 0.000751415160380246, 'lr': 0.0021355960773140024, 'batch_size': 32, 'dropout_rate': 0.41779989720082267, 'prior_mu': 0.04005111776175682, 'prior_sigma': 0.08300531724837944, 'normalization': 'none'}. Best is trial 1528 with value: 0.5170644640922546.
Generating morgan fingerprints...
Generated fingerprints with 2048 features for 900 molecules
Data shape: X=(900, 2048), y=(900,)
Trial 2187: 5-fold CV loss = 0.6610
[I 2025-08-08 04:47:39,117] Trial 2187 finished with value: 0.6609859585762023 and parameters: {'fp_type': 'morgan', 'morgan_only_radius': 2, 'morgan_only_nBits': 2048, 'num_hidden_layers': 3, 'hidden_dim_0': 512, 'hidden_dim_1': 64, 'hidden_dim_2': 256, 'kl_weight': 0.000352315531539082, 'lr': 0.0019021782575026679, 'batch_size': 32, 'dropout_rate': 0.42164418092426154, 'prior_mu': 0.0303180446762329, 'prior_sigma': 0.07287869264530585, 'normalization': 'none'}. Best is trial 1528 with value: 0.5170644640922546.
Generating morgan fingerprints...
Generated fingerprints with 2048 features for 900 molecules
Data shape: X=(900, 2048), y=(900,)
Trial 2190: 5-fold CV loss = 0.8659
[I 2025-08-08 04:48:03,248] Trial 2190 finished with value: 0.8659467577934266 and parameters: {'fp_type': 'morgan', 'morgan_only_radius': 2, 'morgan_only_nBits': 2048, 'num_hidden_layers': 3, 'hidden_dim_0': 512, 'hidden_dim_1': 256, 'hidden_dim_2': 256, 'kl_weight': 0.00034549768395979603, 'lr': 0.0018825079011996792, 'batch_size': 32, 'dropout_rate': 0.4314845554009997, 'prior_mu': 0.0491475412472996, 'prior_sigma': 0.07934384446595256, 'normalization': 'none'}. Best is trial 1528 with value: 0.5170644640922546.
Generating morgan fingerprints...
Generated fingerprints with 2048 features for 900 molecules
Data shape: X=(900, 2048), y=(900,)
Trial 2192: 5-fold CV loss = 0.5895
[I 2025-08-08 04:48:24,642] Trial 2192 finished with value: 0.5895446360111236 and parameters: {'fp_type': 'morgan', 'morgan_only_radius': 2, 'morgan_only_nBits': 2048, 'num_hidden_layers': 3, 'hidden_dim_0': 512, 'hidden_dim_1': 64, 'hidden_dim_2': 256, 'kl_weight': 0.0006310140194586087, 'lr': 0.0030696372611906607, 'batch_size': 128, 'dropout_rate': 0.4463573039437802, 'prior_mu': 0.06776921943167774, 'prior_sigma': 0.06734750972886665, 'normalization': 'layer'}. Best is trial 1528 with value: 0.5170644640922546.
Generating morgan fingerprints...
Generated fingerprints with 2048 features for 900 molecules
Data shape: X=(900, 2048), y=(900,)
Trial 2191: 5-fold CV loss = 0.5601
[I 2025-08-08 04:48:49,194] Trial 2191 finished with value: 0.56010582447052 and parameters: {'fp_type': 'morgan', 'morgan_only_radius': 2, 'morgan_only_nBits': 2048, 'num_hidden_layers': 3, 'hidden_dim_0': 512, 'hidden_dim_1': 64, 'hidden_dim_2': 256, 'kl_weight': 0.0006074296535394574, 'lr': 0.002033714030539224, 'batch_size': 32, 'dropout_rate': 0.4329472574123885, 'prior_mu': 0.05009458189516284, 'prior_sigma': 0.07913852136199068, 'normalization': 'layer'}. Best is trial 1528 with value: 0.5170644640922546.
Generating morgan fingerprints...
Generated fingerprints with 2048 features for 900 molecules
Data shape: X=(900, 2048), y=(900,)
Trial 2189: 5-fold CV loss = 0.6244
[I 2025-08-08 04:49:27,199] Trial 2189 finished with value: 0.6244043350219727 and parameters: {'fp_type': 'morgan', 'morgan_only_radius': 2, 'morgan_only_nBits': 2048, 'num_hidden_layers': 3, 'hidden_dim_0': 512, 'hidden_dim_1': 64, 'hidden_dim_2': 256, 'kl_weight': 0.00034256862791286034, 'lr': 0.0019327361216597253, 'batch_size': 32, 'dropout_rate': 0.35122819755633733, 'prior_mu': 0.0485851837113421, 'prior_sigma': 0.07913638243023567, 'normalization': 'none'}. Best is trial 1528 with value: 0.5170644640922546.
Generating morgan fingerprints...
Generated fingerprints with 2048 features for 900 molecules
Data shape: X=(900, 2048), y=(900,)
Trial 2194: 5-fold CV loss = 0.5319
[I 2025-08-08 04:49:33,184] Trial 2194 finished with value: 0.5319218277931214 and parameters: {'fp_type': 'morgan', 'morgan_only_radius': 2, 'morgan_only_nBits': 2048, 'num_hidden_layers': 3, 'hidden_dim_0': 512, 'hidden_dim_1': 64, 'hidden_dim_2': 256, 'kl_weight': 0.0008658338949098322, 'lr': 0.004521552781554651, 'batch_size': 32, 'dropout_rate': 0.4114530849335466, 'prior_mu': 0.03923669005587569, 'prior_sigma': 0.06755622831555276, 'normalization': 'none'}. Best is trial 1528 with value: 0.5170644640922546.
Generating morgan fingerprints...
Generated fingerprints with 2048 features for 900 molecules
Data shape: X=(900, 2048), y=(900,)
Trial 2193: 5-fold CV loss = 0.5760
[I 2025-08-08 04:49:47,705] Trial 2193 finished with value: 0.5760260105133057 and parameters: {'fp_type': 'morgan', 'morgan_only_radius': 2, 'morgan_only_nBits': 2048, 'num_hidden_layers': 3, 'hidden_dim_0': 512, 'hidden_dim_1': 64, 'hidden_dim_2': 256, 'kl_weight': 0.0004336257831583402, 'lr': 0.002356590276483225, 'batch_size': 32, 'dropout_rate': 0.392410052219528, 'prior_mu': 0.04924857991613437, 'prior_sigma': 0.07688562038432513, 'normalization': 'none'}. Best is trial 1528 with value: 0.5170644640922546.
Generating morgan fingerprints...
Generated fingerprints with 2048 features for 900 molecules
Data shape: X=(900, 2048), y=(900,)
Trial 2188: 5-fold CV loss = 0.6667
[I 2025-08-08 04:49:59,735] Trial 2188 finished with value: 0.666667765378952 and parameters: {'fp_type': 'morgan', 'morgan_only_radius': 2, 'morgan_only_nBits': 2048, 'num_hidden_layers': 3, 'hidden_dim_0': 512, 'hidden_dim_1': 64, 'hidden_dim_2': 256, 'kl_weight': 0.000660084347446041, 'lr': 0.0019262265948887952, 'batch_size': 32, 'dropout_rate': 0.41611009817394284, 'prior_mu': 0.04835305511444435, 'prior_sigma': 0.07813758893767775, 'normalization': 'none'}. Best is trial 1528 with value: 0.5170644640922546.
Generating morgan fingerprints...
Generated fingerprints with 2048 features for 900 molecules
Data shape: X=(900, 2048), y=(900,)
Trial 2197: 5-fold CV loss = 0.8593
[I 2025-08-08 04:50:16,811] Trial 2197 finished with value: 0.8592546582221985 and parameters: {'fp_type': 'morgan', 'morgan_only_radius': 2, 'morgan_only_nBits': 2048, 'num_hidden_layers': 3, 'hidden_dim_0': 512, 'hidden_dim_1': 512, 'hidden_dim_2': 128, 'kl_weight': 0.0006334293504343219, 'lr': 0.0017171833857049855, 'batch_size': 32, 'dropout_rate': 0.4554353918891682, 'prior_mu': 0.06251320759839694, 'prior_sigma': 0.06824213542677353, 'normalization': 'none'}. Best is trial 1528 with value: 0.5170644640922546.
Generating morgan fingerprints...
Generated fingerprints with 2048 features for 900 molecules
Data shape: X=(900, 2048), y=(900,)
Trial 2196: 5-fold CV loss = 0.5484
[I 2025-08-08 04:50:34,721] Trial 2196 finished with value: 0.5484430611133575 and parameters: {'fp_type': 'morgan', 'morgan_only_radius': 2, 'morgan_only_nBits': 2048, 'num_hidden_layers': 3, 'hidden_dim_0': 512, 'hidden_dim_1': 64, 'hidden_dim_2': 128, 'kl_weight': 0.0004281137983562842, 'lr': 0.002353968865299724, 'batch_size': 32, 'dropout_rate': 0.3883473011918331, 'prior_mu': 0.06419454263243393, 'prior_sigma': 0.06791418020166573, 'normalization': 'none'}. Best is trial 1528 with value: 0.5170644640922546.
Generating morgan fingerprints...
Generated fingerprints with 2048 features for 900 molecules
Data shape: X=(900, 2048), y=(900,)
Trial 2200: 5-fold CV loss = 0.9399
[I 2025-08-08 04:51:05,158] Trial 2200 finished with value: 0.9398632645606995 and parameters: {'fp_type': 'morgan', 'morgan_only_radius': 2, 'morgan_only_nBits': 2048, 'num_hidden_layers': 3, 'hidden_dim_0': 512, 'hidden_dim_1': 1024, 'hidden_dim_2': 256, 'kl_weight': 0.0005362818378183977, 'lr': 0.002158292971733823, 'batch_size': 32, 'dropout_rate': 0.44770174426230563, 'prior_mu': 0.03214885306124519, 'prior_sigma': 0.07219762222062022, 'normalization': 'none'}. Best is trial 1528 with value: 0.5170644640922546.
Generating morgan fingerprints...
Generated fingerprints with 2048 features for 900 molecules
Data shape: X=(900, 2048), y=(900,)
Trial 2195: 5-fold CV loss = 0.6694
[I 2025-08-08 04:51:07,855] Trial 2195 finished with value: 0.6693726897239685 and parameters: {'fp_type': 'morgan', 'morgan_only_radius': 2, 'morgan_only_nBits': 2048, 'num_hidden_layers': 3, 'hidden_dim_0': 512, 'hidden_dim_1': 512, 'hidden_dim_2': 128, 'kl_weight': 0.0004265440912028874, 'lr': 0.002384447401846847, 'batch_size': 32, 'dropout_rate': 0.3905417919858153, 'prior_mu': 0.038586520747352006, 'prior_sigma': 0.06902001824193699, 'normalization': 'none'}. Best is trial 1528 with value: 0.5170644640922546.
Generating morgan fingerprints...
Generated fingerprints with 2048 features for 900 molecules
Data shape: X=(900, 2048), y=(900,)
Trial 2199: 5-fold CV loss = 0.6561
[I 2025-08-08 04:51:10,377] Trial 2199 finished with value: 0.6561296224594116 and parameters: {'fp_type': 'morgan', 'morgan_only_radius': 2, 'morgan_only_nBits': 2048, 'num_hidden_layers': 3, 'hidden_dim_0': 64, 'hidden_dim_1': 64, 'hidden_dim_2': 128, 'kl_weight': 0.0005247593194542399, 'lr': 0.0021837218862707296, 'batch_size': 32, 'dropout_rate': 0.44534577074405624, 'prior_mu': 0.03527604776007057, 'prior_sigma': 0.14505504592575036, 'normalization': 'none'}. Best is trial 1528 with value: 0.5170644640922546.
Generating morgan fingerprints...
Generated fingerprints with 2048 features for 900 molecules
Data shape: X=(900, 2048), y=(900,)
Trial 2201: 5-fold CV loss = 0.5797
[I 2025-08-08 04:52:12,346] Trial 2201 finished with value: 0.5796917736530304 and parameters: {'fp_type': 'morgan', 'morgan_only_radius': 2, 'morgan_only_nBits': 2048, 'num_hidden_layers': 3, 'hidden_dim_0': 64, 'hidden_dim_1': 64, 'hidden_dim_2': 1024, 'kl_weight': 0.0007436901104338372, 'lr': 0.0016251475391204828, 'batch_size': 32, 'dropout_rate': 0.4355701766928523, 'prior_mu': 0.04128825420813121, 'prior_sigma': 0.07295541336069593, 'normalization': 'none'}. Best is trial 1528 with value: 0.5170644640922546.
Generating morgan fingerprints...
Generated fingerprints with 2048 features for 900 molecules
Data shape: X=(900, 2048), y=(900,)
Trial 2203: 5-fold CV loss = 0.5331
[I 2025-08-08 04:52:29,732] Trial 2203 finished with value: 0.5330753684043884 and parameters: {'fp_type': 'morgan', 'morgan_only_radius': 2, 'morgan_only_nBits': 2048, 'num_hidden_layers': 3, 'hidden_dim_0': 512, 'hidden_dim_1': 64, 'hidden_dim_2': 1024, 'kl_weight': 0.0007389912161230228, 'lr': 0.0016447681449596552, 'batch_size': 32, 'dropout_rate': 0.43324482579332807, 'prior_mu': 0.026740719923692192, 'prior_sigma': 0.08626192281128808, 'normalization': 'none'}. Best is trial 1528 with value: 0.5170644640922546.
Generating morgan fingerprints...
Generated fingerprints with 2048 features for 900 molecules
Data shape: X=(900, 2048), y=(900,)
Trial 2202: 5-fold CV loss = 0.5887
