[I 2025-08-07 21:24:05,543] Trial 974 finished with value: 0.5750730276107788 and parameters: {'fp_type': 'morgan_rdkit', 'combined_morgan_radius': 3, 'combined_morgan_nBits': 512, 'combined_rdkit_maxPath': 7, 'combined_rdkit_nBits': 256, 'num_hidden_layers': 3, 'hidden_dim_0': 1024, 'hidden_dim_1': 1024, 'hidden_dim_2': 512, 'kl_weight': 0.001077089772505041, 'lr': 0.002348063274959011, 'batch_size': 32, 'dropout_rate': 0.48489963151145127, 'prior_mu': -0.033079050864210355, 'prior_sigma': 0.06429663338555745, 'normalization': 'none'}. Best is trial 272 with value: 0.5198344707489013.
Generating morgan fingerprints...
Generated fingerprints with 2048 features for 900 molecules
Data shape: X=(900, 2048), y=(900,)
Trial 976: 5-fold CV loss = 0.5261
[I 2025-08-07 21:24:40,282] Trial 976 finished with value: 0.5261372208595276 and parameters: {'fp_type': 'morgan', 'morgan_only_radius': 2, 'morgan_only_nBits': 2048, 'num_hidden_layers': 3, 'hidden_dim_0': 512, 'hidden_dim_1': 128, 'hidden_dim_2': 512, 'kl_weight': 0.001827789072748247, 'lr': 0.0026138305895172546, 'batch_size': 32, 'dropout_rate': 0.48366521046740535, 'prior_mu': -0.014766465320317845, 'prior_sigma': 0.06701165969311058, 'normalization': 'none'}. Best is trial 272 with value: 0.5198344707489013.
Generating morgan fingerprints...
Generated fingerprints with 2048 features for 900 molecules
Data shape: X=(900, 2048), y=(900,)
Trial 973: 5-fold CV loss = 0.5691
[I 2025-08-07 21:24:49,675] Trial 973 finished with value: 0.5691328704357147 and parameters: {'fp_type': 'morgan_rdkit', 'combined_morgan_radius': 3, 'combined_morgan_nBits': 512, 'combined_rdkit_maxPath': 7, 'combined_rdkit_nBits': 256, 'num_hidden_layers': 3, 'hidden_dim_0': 512, 'hidden_dim_1': 1024, 'hidden_dim_2': 512, 'kl_weight': 0.0010407606286288043, 'lr': 0.0023479222310233013, 'batch_size': 32, 'dropout_rate': 0.4833998170460452, 'prior_mu': -0.0349152662704914, 'prior_sigma': 0.06310173383352037, 'normalization': 'none'}. Best is trial 272 with value: 0.5198344707489013.
Generating morgan fingerprints...
Generated fingerprints with 2048 features for 900 molecules
Data shape: X=(900, 2048), y=(900,)
Trial 979: 5-fold CV loss = 0.8118
[I 2025-08-07 21:25:00,162] Trial 979 finished with value: 0.8117663741111756 and parameters: {'fp_type': 'morgan', 'morgan_only_radius': 2, 'morgan_only_nBits': 2048, 'num_hidden_layers': 3, 'hidden_dim_0': 512, 'hidden_dim_1': 512, 'hidden_dim_2': 512, 'kl_weight': 0.0015461299837420841, 'lr': 0.0033187412340051235, 'batch_size': 128, 'dropout_rate': 0.49108475635608456, 'prior_mu': -0.012666940848641499, 'prior_sigma': 0.06112062711880912, 'normalization': 'none'}. Best is trial 272 with value: 0.5198344707489013.
Generating morgan fingerprints...
Generated fingerprints with 2048 features for 900 molecules
Data shape: X=(900, 2048), y=(900,)
Trial 977: 5-fold CV loss = 0.5322
[I 2025-08-07 21:25:13,082] Trial 977 finished with value: 0.5321929395198822 and parameters: {'fp_type': 'morgan', 'morgan_only_radius': 2, 'morgan_only_nBits': 2048, 'num_hidden_layers': 3, 'hidden_dim_0': 512, 'hidden_dim_1': 128, 'hidden_dim_2': 512, 'kl_weight': 0.0018494234004922774, 'lr': 0.0025886408104645524, 'batch_size': 32, 'dropout_rate': 0.4992573709254942, 'prior_mu': -0.01273248013470189, 'prior_sigma': 0.06744327644277978, 'normalization': 'none'}. Best is trial 272 with value: 0.5198344707489013.
Generating morgan fingerprints...
Generated fingerprints with 2048 features for 900 molecules
Data shape: X=(900, 2048), y=(900,)
Trial 975: 5-fold CV loss = 0.5371
[I 2025-08-07 21:25:27,577] Trial 975 finished with value: 0.5371125340461731 and parameters: {'fp_type': 'morgan', 'morgan_only_radius': 2, 'morgan_only_nBits': 2048, 'num_hidden_layers': 3, 'hidden_dim_0': 1024, 'hidden_dim_1': 128, 'hidden_dim_2': 512, 'kl_weight': 0.0010367427774346045, 'lr': 0.0024129128868851176, 'batch_size': 32, 'dropout_rate': 0.4915488507915727, 'prior_mu': -0.03415581367273384, 'prior_sigma': 0.06439304412189084, 'normalization': 'none'}. Best is trial 272 with value: 0.5198344707489013.
Generating morgan fingerprints...
Generated fingerprints with 2048 features for 900 molecules
Data shape: X=(900, 2048), y=(900,)
Trial 978: 5-fold CV loss = 0.5393
[I 2025-08-07 21:25:48,154] Trial 978 finished with value: 0.5393258035182953 and parameters: {'fp_type': 'morgan', 'morgan_only_radius': 2, 'morgan_only_nBits': 2048, 'num_hidden_layers': 3, 'hidden_dim_0': 512, 'hidden_dim_1': 512, 'hidden_dim_2': 512, 'kl_weight': 0.00159251667904373, 'lr': 0.0033283461121806266, 'batch_size': 32, 'dropout_rate': 0.49210234161751704, 'prior_mu': -0.012493752674195627, 'prior_sigma': 0.06212195271791063, 'normalization': 'none'}. Best is trial 272 with value: 0.5198344707489013.
Generating morgan fingerprints...
Generated fingerprints with 2048 features for 900 molecules
Data shape: X=(900, 2048), y=(900,)
Trial 981: 5-fold CV loss = 0.5296
[I 2025-08-07 21:26:32,723] Trial 981 finished with value: 0.529621171951294 and parameters: {'fp_type': 'morgan', 'morgan_only_radius': 2, 'morgan_only_nBits': 2048, 'num_hidden_layers': 3, 'hidden_dim_0': 512, 'hidden_dim_1': 128, 'hidden_dim_2': 512, 'kl_weight': 0.0016092959039072294, 'lr': 0.002138285444211721, 'batch_size': 32, 'dropout_rate': 0.49190680170423484, 'prior_mu': -0.02331638966528383, 'prior_sigma': 0.07053859179166976, 'normalization': 'none'}. Best is trial 272 with value: 0.5198344707489013.
Generating morgan fingerprints...
Generated fingerprints with 2048 features for 900 molecules
Data shape: X=(900, 2048), y=(900,)
Trial 980: 5-fold CV loss = 0.5291
[I 2025-08-07 21:26:40,299] Trial 980 finished with value: 0.5290921092033386 and parameters: {'fp_type': 'morgan', 'morgan_only_radius': 2, 'morgan_only_nBits': 2048, 'num_hidden_layers': 3, 'hidden_dim_0': 512, 'hidden_dim_1': 128, 'hidden_dim_2': 512, 'kl_weight': 0.0016407826235519153, 'lr': 0.002671304237260791, 'batch_size': 32, 'dropout_rate': 0.49208579164097566, 'prior_mu': -0.014219554188605743, 'prior_sigma': 0.06849333635475918, 'normalization': 'none'}. Best is trial 272 with value: 0.5198344707489013.
Generating morgan fingerprints...
Generated fingerprints with 2048 features for 900 molecules
Data shape: X=(900, 2048), y=(900,)
Trial 984: 5-fold CV loss = 0.6356
[I 2025-08-07 21:26:47,218] Trial 984 finished with value: 0.6356476783752442 and parameters: {'fp_type': 'morgan', 'morgan_only_radius': 2, 'morgan_only_nBits': 2048, 'num_hidden_layers': 0, 'kl_weight': 0.001954543389806625, 'lr': 0.0022322918238344013, 'batch_size': 32, 'dropout_rate': 0.47503989588078277, 'prior_mu': -0.025724603025408847, 'prior_sigma': 0.04878853333679268, 'normalization': 'none'}. Best is trial 272 with value: 0.5198344707489013.
Generating morgan fingerprints...
Generated fingerprints with 2048 features for 900 molecules
Data shape: X=(900, 2048), y=(900,)
Trial 983: 5-fold CV loss = 0.5624
[I 2025-08-07 21:27:01,167] Trial 983 finished with value: 0.5623994648456574 and parameters: {'fp_type': 'morgan', 'morgan_only_radius': 2, 'morgan_only_nBits': 2048, 'num_hidden_layers': 3, 'hidden_dim_0': 64, 'hidden_dim_1': 128, 'hidden_dim_2': 512, 'kl_weight': 0.001617981421770203, 'lr': 0.002197779945653584, 'batch_size': 32, 'dropout_rate': 0.47411272409229094, 'prior_mu': 0.031250352575212255, 'prior_sigma': 0.04752420503470919, 'normalization': 'none'}. Best is trial 272 with value: 0.5198344707489013.
Generating morgan fingerprints...
Generated fingerprints with 2048 features for 900 molecules
Data shape: X=(900, 2048), y=(900,)
Trial 986: 5-fold CV loss = 0.7754
[I 2025-08-07 21:27:21,640] Trial 986 finished with value: 0.7753785014152527 and parameters: {'fp_type': 'morgan', 'morgan_only_radius': 3, 'morgan_only_nBits': 2048, 'num_hidden_layers': 3, 'hidden_dim_0': 64, 'hidden_dim_1': 128, 'hidden_dim_2': 512, 'kl_weight': 0.09901949412856738, 'lr': 0.0021483060274019063, 'batch_size': 64, 'dropout_rate': 0.4693095799653193, 'prior_mu': -0.04044119997817884, 'prior_sigma': 0.05589553996076852, 'normalization': 'none'}. Best is trial 272 with value: 0.5198344707489013.
Generating morgan fingerprints...
Generated fingerprints with 2048 features for 900 molecules
Data shape: X=(900, 2048), y=(900,)
Trial 985: 5-fold CV loss = 0.5645
[I 2025-08-07 21:28:01,722] Trial 985 finished with value: 0.5645016372203827 and parameters: {'fp_type': 'morgan', 'morgan_only_radius': 2, 'morgan_only_nBits': 2048, 'num_hidden_layers': 3, 'hidden_dim_0': 64, 'hidden_dim_1': 128, 'hidden_dim_2': 64, 'kl_weight': 0.001957617938366757, 'lr': 0.0022115302109154775, 'batch_size': 32, 'dropout_rate': 0.26219838951499896, 'prior_mu': -0.026670045555208237, 'prior_sigma': 0.057851903403504615, 'normalization': 'none'}. Best is trial 272 with value: 0.5198344707489013.
Generating rdkit fingerprints...
Generated fingerprints with 256 features for 900 molecules
Data shape: X=(900, 256), y=(900,)
Trial 987: 5-fold CV loss = 0.5320
[I 2025-08-07 21:28:12,487] Trial 987 finished with value: 0.531982147693634 and parameters: {'fp_type': 'morgan', 'morgan_only_radius': 3, 'morgan_only_nBits': 2048, 'num_hidden_layers': 3, 'hidden_dim_0': 512, 'hidden_dim_1': 128, 'hidden_dim_2': 512, 'kl_weight': 0.0002482907913292086, 'lr': 0.0025750261771061624, 'batch_size': 32, 'dropout_rate': 0.4640256344267983, 'prior_mu': -0.04157114652080915, 'prior_sigma': 0.05618073077936372, 'normalization': 'none'}. Best is trial 272 with value: 0.5198344707489013.
Generating morgan fingerprints...
Generated fingerprints with 2048 features for 900 molecules
Data shape: X=(900, 2048), y=(900,)
Trial 988: 5-fold CV loss = 0.5376
[I 2025-08-07 21:28:22,438] Trial 988 finished with value: 0.5376488447189331 and parameters: {'fp_type': 'morgan', 'morgan_only_radius': 2, 'morgan_only_nBits': 2048, 'num_hidden_layers': 3, 'hidden_dim_0': 512, 'hidden_dim_1': 128, 'hidden_dim_2': 512, 'kl_weight': 0.0012414461180186675, 'lr': 0.00258850795879488, 'batch_size': 32, 'dropout_rate': 0.49960145285932456, 'prior_mu': -0.02672071936260248, 'prior_sigma': 0.07400677105950818, 'normalization': 'none'}. Best is trial 272 with value: 0.5198344707489013.
Generating morgan fingerprints...
Generated fingerprints with 2048 features for 900 molecules
Data shape: X=(900, 2048), y=(900,)
Trial 991: 5-fold CV loss = 0.5313
[I 2025-08-07 21:29:14,033] Trial 991 finished with value: 0.5312636315822601 and parameters: {'fp_type': 'morgan', 'morgan_only_radius': 2, 'morgan_only_nBits': 2048, 'num_hidden_layers': 3, 'hidden_dim_0': 512, 'hidden_dim_1': 128, 'hidden_dim_2': 512, 'kl_weight': 0.0003391596075363402, 'lr': 0.0031047355434290057, 'batch_size': 32, 'dropout_rate': 0.49973861922709584, 'prior_mu': -0.0022791058154322495, 'prior_sigma': 0.07133743997044438, 'normalization': 'none'}. Best is trial 272 with value: 0.5198344707489013.
Generating rdkit fingerprints...
Generated fingerprints with 256 features for 900 molecules
Data shape: X=(900, 256), y=(900,)
Trial 990: 5-fold CV loss = 0.5315
[I 2025-08-07 21:29:20,954] Trial 990 finished with value: 0.531533831357956 and parameters: {'fp_type': 'morgan', 'morgan_only_radius': 2, 'morgan_only_nBits': 2048, 'num_hidden_layers': 3, 'hidden_dim_0': 512, 'hidden_dim_1': 128, 'hidden_dim_2': 512, 'kl_weight': 0.0011993212563211214, 'lr': 0.00297588497174206, 'batch_size': 32, 'dropout_rate': 0.49984630963789767, 'prior_mu': 0.0194568295213893, 'prior_sigma': 0.07294132141347967, 'normalization': 'none'}. Best is trial 272 with value: 0.5198344707489013.
Generating rdkit fingerprints...
Generated fingerprints with 256 features for 900 molecules
Data shape: X=(900, 256), y=(900,)
Trial 982: 5-fold CV loss = 0.5236
[I 2025-08-07 21:29:28,531] Trial 982 finished with value: 0.5235639691352845 and parameters: {'fp_type': 'morgan', 'morgan_only_radius': 2, 'morgan_only_nBits': 2048, 'num_hidden_layers': 3, 'hidden_dim_0': 512, 'hidden_dim_1': 128, 'hidden_dim_2': 512, 'kl_weight': 0.0015095540036142972, 'lr': 0.00218557563067241, 'batch_size': 32, 'dropout_rate': 0.49978986890378724, 'prior_mu': -0.0238633773510383, 'prior_sigma': 0.06991988223092155, 'normalization': 'none'}. Best is trial 272 with value: 0.5198344707489013.
Generating morgan fingerprints...
Generated fingerprints with 1024 features for 900 molecules
Data shape: X=(900, 1024), y=(900,)
Trial 989: 5-fold CV loss = 0.6124
[I 2025-08-07 21:29:41,017] Trial 989 finished with value: 0.6123607635498047 and parameters: {'fp_type': 'rdkit', 'rdkit_only_maxPath': 6, 'rdkit_only_nBits': 256, 'num_hidden_layers': 1, 'hidden_dim_0': 512, 'kl_weight': 0.0002692326111362241, 'lr': 0.0025998340305210597, 'batch_size': 32, 'dropout_rate': 0.48136858482685857, 'prior_mu': -0.004299008054329019, 'prior_sigma': 0.07506277191290928, 'normalization': 'none'}. Best is trial 272 with value: 0.5198344707489013.
Generating morgan fingerprints...
Generated fingerprints with 1024 features for 900 molecules
Data shape: X=(900, 1024), y=(900,)
Trial 992: 5-fold CV loss = 0.6606
[I 2025-08-07 21:29:56,081] Trial 992 finished with value: 0.6606361865997314 and parameters: {'fp_type': 'rdkit', 'rdkit_only_maxPath': 6, 'rdkit_only_nBits': 256, 'num_hidden_layers': 3, 'hidden_dim_0': 512, 'hidden_dim_1': 128, 'hidden_dim_2': 512, 'kl_weight': 0.0013740479409960601, 'lr': 0.0019345322738643185, 'batch_size': 32, 'dropout_rate': 0.48025965086310113, 'prior_mu': 0.021520889704834092, 'prior_sigma': 0.06669822622318287, 'normalization': 'none'}. Best is trial 272 with value: 0.5198344707489013.
Generating morgan fingerprints...
Generated fingerprints with 1024 features for 900 molecules
Data shape: X=(900, 1024), y=(900,)
Trial 993: 5-fold CV loss = 0.6567
[I 2025-08-07 21:30:05,640] Trial 993 finished with value: 0.6567262053489685 and parameters: {'fp_type': 'rdkit', 'rdkit_only_maxPath': 6, 'rdkit_only_nBits': 256, 'num_hidden_layers': 3, 'hidden_dim_0': 512, 'hidden_dim_1': 128, 'hidden_dim_2': 512, 'kl_weight': 0.0014160401319626074, 'lr': 0.001953328050214409, 'batch_size': 32, 'dropout_rate': 0.478299169740954, 'prior_mu': -0.019068836549644825, 'prior_sigma': 0.06067353703407315, 'normalization': 'none'}. Best is trial 272 with value: 0.5198344707489013.
Generating morgan fingerprints...
Generated fingerprints with 1024 features for 900 molecules
Data shape: X=(900, 1024), y=(900,)
Trial 996: 5-fold CV loss = 0.5277
[I 2025-08-07 21:31:36,792] Trial 996 finished with value: 0.5277268171310425 and parameters: {'fp_type': 'morgan', 'morgan_only_radius': 2, 'morgan_only_nBits': 1024, 'num_hidden_layers': 3, 'hidden_dim_0': 512, 'hidden_dim_1': 128, 'hidden_dim_2': 512, 'kl_weight': 0.0022781002252626366, 'lr': 0.002014617250227533, 'batch_size': 32, 'dropout_rate': 0.45524826581390987, 'prior_mu': -0.03434451463633653, 'prior_sigma': 0.07731914022373677, 'normalization': 'none'}. Best is trial 272 with value: 0.5198344707489013.
Generating morgan fingerprints...
Generated fingerprints with 1024 features for 900 molecules
Data shape: X=(900, 1024), y=(900,)
Trial 997: 5-fold CV loss = 0.5288
[I 2025-08-07 21:31:53,935] Trial 997 finished with value: 0.5287946999073029 and parameters: {'fp_type': 'morgan', 'morgan_only_radius': 2, 'morgan_only_nBits': 1024, 'num_hidden_layers': 3, 'hidden_dim_0': 512, 'hidden_dim_1': 128, 'hidden_dim_2': 512, 'kl_weight': 0.0021956962030094175, 'lr': 0.0020259300501038148, 'batch_size': 32, 'dropout_rate': 0.4540676361983763, 'prior_mu': -0.03047524349782718, 'prior_sigma': 0.07869899601044529, 'normalization': 'none'}. Best is trial 272 with value: 0.5198344707489013.
Generating morgan fingerprints...
Generated fingerprints with 1024 features for 900 molecules
Data shape: X=(900, 1024), y=(900,)
Trial 995: 5-fold CV loss = 0.5311
[I 2025-08-07 21:32:27,803] Trial 995 finished with value: 0.5310636758804321 and parameters: {'fp_type': 'morgan', 'morgan_only_radius': 2, 'morgan_only_nBits': 1024, 'num_hidden_layers': 3, 'hidden_dim_0': 512, 'hidden_dim_1': 128, 'hidden_dim_2': 512, 'kl_weight': 0.0022073257298749578, 'lr': 0.0019184303969209577, 'batch_size': 32, 'dropout_rate': 0.4772586658060894, 'prior_mu': -0.03401722650279041, 'prior_sigma': 0.07802898508382028, 'normalization': 'none'}. Best is trial 272 with value: 0.5198344707489013.
Generating morgan fingerprints...
Generated fingerprints with 1024 features for 900 molecules
Data shape: X=(900, 1024), y=(900,)
Trial 998: 5-fold CV loss = 0.5689
[I 2025-08-07 21:33:04,023] Trial 998 finished with value: 0.5688985764980317 and parameters: {'fp_type': 'morgan', 'morgan_only_radius': 2, 'morgan_only_nBits': 1024, 'num_hidden_layers': 3, 'hidden_dim_0': 512, 'hidden_dim_1': 64, 'hidden_dim_2': 512, 'kl_weight': 0.0018699445608615882, 'lr': 0.0015004360660836142, 'batch_size': 32, 'dropout_rate': 0.46951641725155857, 'prior_mu': -0.04799359244696974, 'prior_sigma': 0.07911387795452637, 'normalization': 'none'}. Best is trial 272 with value: 0.5198344707489013.
Generating morgan fingerprints...
Generated fingerprints with 2048 features for 900 molecules
Data shape: X=(900, 2048), y=(900,)
Trial 999: 5-fold CV loss = 0.5395
[I 2025-08-07 21:33:10,437] Trial 999 finished with value: 0.5394955635070801 and parameters: {'fp_type': 'morgan', 'morgan_only_radius': 2, 'morgan_only_nBits': 1024, 'num_hidden_layers': 3, 'hidden_dim_0': 512, 'hidden_dim_1': 256, 'hidden_dim_2': 512, 'kl_weight': 0.0018223507259907915, 'lr': 0.0017966579181431738, 'batch_size': 32, 'dropout_rate': 0.4685179168494724, 'prior_mu': -0.04837868863800344, 'prior_sigma': 0.07092745255897039, 'normalization': 'layer'}. Best is trial 272 with value: 0.5198344707489013.
Generating morgan fingerprints...
Generated fingerprints with 2048 features for 900 molecules
Data shape: X=(900, 2048), y=(900,)
Trial 1001: 5-fold CV loss = 0.6671
[I 2025-08-07 21:33:15,961] Trial 1001 finished with value: 0.6670764923095703 and parameters: {'fp_type': 'morgan', 'morgan_only_radius': 2, 'morgan_only_nBits': 2048, 'num_hidden_layers': 3, 'hidden_dim_0': 512, 'hidden_dim_1': 256, 'hidden_dim_2': 512, 'kl_weight': 0.0015165330831122328, 'lr': 0.0021712541407074314, 'batch_size': 128, 'dropout_rate': 0.44364757530157434, 'prior_mu': 0.008720405964089246, 'prior_sigma': 0.07038216623305162, 'normalization': 'layer'}. Best is trial 272 with value: 0.5198344707489013.
Generating morgan fingerprints...
Generated fingerprints with 2048 features for 900 molecules
Data shape: X=(900, 2048), y=(900,)
Trial 1003: 5-fold CV loss = 1.0618
[I 2025-08-07 21:33:43,053] Trial 1003 finished with value: 1.0618409752845763 and parameters: {'fp_type': 'morgan', 'morgan_only_radius': 2, 'morgan_only_nBits': 2048, 'num_hidden_layers': 3, 'hidden_dim_0': 512, 'hidden_dim_1': 128, 'hidden_dim_2': 512, 'kl_weight': 0.00021404506812573298, 'lr': 0.0003114950515370359, 'batch_size': 32, 'dropout_rate': 0.48460950773479117, 'prior_mu': 0.004337439969367418, 'prior_sigma': 0.0677118791402474, 'normalization': 'none'}. Best is trial 272 with value: 0.5198344707489013.
Generating morgan fingerprints...
Generated fingerprints with 1024 features for 900 molecules
Data shape: X=(900, 1024), y=(900,)
Trial 1002: 5-fold CV loss = 0.6500
[I 2025-08-07 21:34:07,547] Trial 1002 finished with value: 0.6500499844551086 and parameters: {'fp_type': 'morgan', 'morgan_only_radius': 2, 'morgan_only_nBits': 2048, 'num_hidden_layers': 3, 'hidden_dim_0': 512, 'hidden_dim_1': 128, 'hidden_dim_2': 128, 'kl_weight': 0.0016556755042211081, 'lr': 0.0021848997596541006, 'batch_size': 32, 'dropout_rate': 0.4844131397002703, 'prior_mu': 0.008552228720819129, 'prior_sigma': 0.06989632982550956, 'normalization': 'none'}. Best is trial 272 with value: 0.5198344707489013.
Generating morgan fingerprints...
Generated fingerprints with 1024 features for 900 molecules
Data shape: X=(900, 1024), y=(900,)
Trial 1000: 5-fold CV loss = 0.5344
[I 2025-08-07 21:34:42,831] Trial 1000 finished with value: 0.5344249904155731 and parameters: {'fp_type': 'morgan', 'morgan_only_radius': 2, 'morgan_only_nBits': 1024, 'num_hidden_layers': 3, 'hidden_dim_0': 512, 'hidden_dim_1': 256, 'hidden_dim_2': 512, 'kl_weight': 0.0018119207056836075, 'lr': 0.0022281719886448692, 'batch_size': 32, 'dropout_rate': 0.31175515375833907, 'prior_mu': 0.005760922865745524, 'prior_sigma': 0.07140075591975462, 'normalization': 'none'}. Best is trial 272 with value: 0.5198344707489013.
Generating morgan fingerprints...
Generated fingerprints with 1024 features for 900 molecules
Data shape: X=(900, 1024), y=(900,)
Trial 1004: 5-fold CV loss = 0.5855
[I 2025-08-07 21:34:44,352] Trial 1004 finished with value: 0.5854936242103577 and parameters: {'fp_type': 'morgan', 'morgan_only_radius': 2, 'morgan_only_nBits': 1024, 'num_hidden_layers': 3, 'hidden_dim_0': 128, 'hidden_dim_1': 128, 'hidden_dim_2': 128, 'kl_weight': 0.0017603439864512338, 'lr': 0.0022971752355859898, 'batch_size': 32, 'dropout_rate': 0.4908013165120996, 'prior_mu': -0.02332271964325531, 'prior_sigma': 0.07356024366884875, 'normalization': 'none'}. Best is trial 272 with value: 0.5198344707489013.
Generating morgan fingerprints...
Generated fingerprints with 1024 features for 900 molecules
Data shape: X=(900, 1024), y=(900,)
Trial 994: 5-fold CV loss = 0.5240
[I 2025-08-07 21:35:35,246] Trial 994 finished with value: 0.5239868283271789 and parameters: {'fp_type': 'morgan', 'morgan_only_radius': 2, 'morgan_only_nBits': 1024, 'num_hidden_layers': 3, 'hidden_dim_0': 512, 'hidden_dim_1': 128, 'hidden_dim_2': 512, 'kl_weight': 0.0020763615643559297, 'lr': 0.0019086860412442545, 'batch_size': 32, 'dropout_rate': 0.48309996340491246, 'prior_mu': -0.034448738634500216, 'prior_sigma': 0.07574659038603268, 'normalization': 'none'}. Best is trial 272 with value: 0.5198344707489013.
Generating morgan fingerprints...
Generated fingerprints with 1024 features for 900 molecules
Data shape: X=(900, 1024), y=(900,)
Trial 1005: 5-fold CV loss = 0.5481
