[I 2025-08-08 05:25:42,293] Trial 2298 finished with value: 0.5386498272418976 and parameters: {'fp_type': 'morgan', 'morgan_only_radius': 2, 'morgan_only_nBits': 2048, 'num_hidden_layers': 3, 'hidden_dim_0': 512, 'hidden_dim_1': 128, 'hidden_dim_2': 512, 'kl_weight': 0.0008009696270198988, 'lr': 0.0038455924947205446, 'batch_size': 32, 'dropout_rate': 0.4209037185401704, 'prior_mu': 0.046473295800201195, 'prior_sigma': 0.06815644201220718, 'normalization': 'none'}. Best is trial 1528 with value: 0.5170644640922546.
Generating morgan fingerprints...
Generated fingerprints with 2048 features for 900 molecules
Data shape: X=(900, 2048), y=(900,)
Trial 2300: 5-fold CV loss = 0.7117
[I 2025-08-08 05:25:52,795] Trial 2300 finished with value: 0.7116650462150573 and parameters: {'fp_type': 'morgan', 'morgan_only_radius': 2, 'morgan_only_nBits': 2048, 'num_hidden_layers': 3, 'hidden_dim_0': 512, 'hidden_dim_1': 64, 'hidden_dim_2': 256, 'kl_weight': 0.00037135631771161373, 'lr': 0.0030756470875003285, 'batch_size': 128, 'dropout_rate': 0.442111607646691, 'prior_mu': 0.01344314756745808, 'prior_sigma': 0.06700639005012318, 'normalization': 'none'}. Best is trial 1528 with value: 0.5170644640922546.
Generating morgan fingerprints...
Generated fingerprints with 2048 features for 900 molecules
Data shape: X=(900, 2048), y=(900,)
Trial 2296: 5-fold CV loss = 0.5324
[I 2025-08-08 05:26:15,250] Trial 2296 finished with value: 0.5323623180389404 and parameters: {'fp_type': 'morgan', 'morgan_only_radius': 2, 'morgan_only_nBits': 2048, 'num_hidden_layers': 3, 'hidden_dim_0': 512, 'hidden_dim_1': 128, 'hidden_dim_2': 512, 'kl_weight': 0.0006398677929886344, 'lr': 0.0019890745744343226, 'batch_size': 32, 'dropout_rate': 0.4449954151789227, 'prior_mu': -0.08252813300718459, 'prior_sigma': 0.07530782515667304, 'normalization': 'none'}. Best is trial 1528 with value: 0.5170644640922546.
Generating morgan fingerprints...
Generated fingerprints with 2048 features for 900 molecules
Data shape: X=(900, 2048), y=(900,)
Trial 2297: 5-fold CV loss = 0.5381
[I 2025-08-08 05:26:21,188] Trial 2297 finished with value: 0.5381431579589844 and parameters: {'fp_type': 'morgan', 'morgan_only_radius': 2, 'morgan_only_nBits': 2048, 'num_hidden_layers': 3, 'hidden_dim_0': 512, 'hidden_dim_1': 128, 'hidden_dim_2': 512, 'kl_weight': 0.0008078316894846116, 'lr': 0.002683504858069215, 'batch_size': 32, 'dropout_rate': 0.41712387144287205, 'prior_mu': -0.07828780547834151, 'prior_sigma': 0.06616107111366801, 'normalization': 'none'}. Best is trial 1528 with value: 0.5170644640922546.
Generating morgan fingerprints...
Generated fingerprints with 2048 features for 900 molecules
Data shape: X=(900, 2048), y=(900,)
Trial 2301: 5-fold CV loss = 0.5290
[I 2025-08-08 05:26:45,251] Trial 2301 finished with value: 0.529031765460968 and parameters: {'fp_type': 'morgan', 'morgan_only_radius': 2, 'morgan_only_nBits': 2048, 'num_hidden_layers': 3, 'hidden_dim_0': 512, 'hidden_dim_1': 64, 'hidden_dim_2': 256, 'kl_weight': 0.0003509835994231731, 'lr': 0.0032889415649556574, 'batch_size': 32, 'dropout_rate': 0.449574426567708, 'prior_mu': 0.022727802051407498, 'prior_sigma': 0.08334940916136181, 'normalization': 'none'}. Best is trial 1528 with value: 0.5170644640922546.
Generating morgan fingerprints...
Generated fingerprints with 2048 features for 900 molecules
Data shape: X=(900, 2048), y=(900,)
Trial 2304: 5-fold CV loss = 0.5337
[I 2025-08-08 05:27:14,798] Trial 2304 finished with value: 0.5337430894374847 and parameters: {'fp_type': 'morgan', 'morgan_only_radius': 2, 'morgan_only_nBits': 2048, 'num_hidden_layers': 3, 'hidden_dim_0': 64, 'hidden_dim_1': 64, 'hidden_dim_2': 256, 'kl_weight': 0.000399381689280087, 'lr': 0.004662168294634665, 'batch_size': 64, 'dropout_rate': 0.43607294436892124, 'prior_mu': 0.013526961031649142, 'prior_sigma': 0.06069089853535115, 'normalization': 'layer'}. Best is trial 1528 with value: 0.5170644640922546.
Generating morgan fingerprints...
Generated fingerprints with 2048 features for 900 molecules
Data shape: X=(900, 2048), y=(900,)
Trial 2303: 5-fold CV loss = 0.5461
[I 2025-08-08 05:27:20,881] Trial 2303 finished with value: 0.5460853517055512 and parameters: {'fp_type': 'morgan', 'morgan_only_radius': 2, 'morgan_only_nBits': 2048, 'num_hidden_layers': 3, 'hidden_dim_0': 64, 'hidden_dim_1': 64, 'hidden_dim_2': 256, 'kl_weight': 0.026344853808253143, 'lr': 0.003847816201513829, 'batch_size': 32, 'dropout_rate': 0.4471883900552472, 'prior_mu': 0.016568162856536436, 'prior_sigma': 0.08408011501107437, 'normalization': 'layer'}. Best is trial 1528 with value: 0.5170644640922546.
Generating rdkit fingerprints...
Generated fingerprints with 256 features for 900 molecules
Data shape: X=(900, 256), y=(900,)
Trial 2302: 5-fold CV loss = 0.5295
[I 2025-08-08 05:27:56,629] Trial 2302 finished with value: 0.5294611096382141 and parameters: {'fp_type': 'morgan', 'morgan_only_radius': 2, 'morgan_only_nBits': 2048, 'num_hidden_layers': 3, 'hidden_dim_0': 512, 'hidden_dim_1': 64, 'hidden_dim_2': 256, 'kl_weight': 0.00031429046054716876, 'lr': 0.003099191350217464, 'batch_size': 32, 'dropout_rate': 0.4495991311777381, 'prior_mu': 0.013657995484179519, 'prior_sigma': 0.056601709615335574, 'normalization': 'none'}. Best is trial 1528 with value: 0.5170644640922546.
Generating rdkit fingerprints...
Generated fingerprints with 256 features for 900 molecules
Data shape: X=(900, 256), y=(900,)
Trial 2305: 5-fold CV loss = 0.5297
[I 2025-08-08 05:28:16,101] Trial 2305 finished with value: 0.5297088325023651 and parameters: {'fp_type': 'morgan', 'morgan_only_radius': 2, 'morgan_only_nBits': 2048, 'num_hidden_layers': 3, 'hidden_dim_0': 512, 'hidden_dim_1': 64, 'hidden_dim_2': 256, 'kl_weight': 0.0003220801185659827, 'lr': 0.003092903383853033, 'batch_size': 32, 'dropout_rate': 0.4312079426316054, 'prior_mu': 0.0144080921279661, 'prior_sigma': 0.08881227334170462, 'normalization': 'none'}. Best is trial 1528 with value: 0.5170644640922546.
Generating rdkit fingerprints...
Generated fingerprints with 256 features for 900 molecules
Data shape: X=(900, 256), y=(900,)
Trial 2306: 5-fold CV loss = 0.6223
[I 2025-08-08 05:28:42,591] Trial 2306 finished with value: 0.6222892761230469 and parameters: {'fp_type': 'rdkit', 'rdkit_only_maxPath': 5, 'rdkit_only_nBits': 256, 'num_hidden_layers': 3, 'hidden_dim_0': 512, 'hidden_dim_1': 64, 'hidden_dim_2': 256, 'kl_weight': 0.0003231825677293005, 'lr': 0.0037978494203528917, 'batch_size': 32, 'dropout_rate': 0.4287517547552863, 'prior_mu': 0.02235210077646601, 'prior_sigma': 0.08903434277598253, 'normalization': 'none'}. Best is trial 1528 with value: 0.5170644640922546.
Generating morgan fingerprints...
Generated fingerprints with 2048 features for 900 molecules
Data shape: X=(900, 2048), y=(900,)
Trial 2299: 5-fold CV loss = 0.5233
[I 2025-08-08 05:28:52,738] Trial 2299 finished with value: 0.5232994854450226 and parameters: {'fp_type': 'morgan', 'morgan_only_radius': 2, 'morgan_only_nBits': 2048, 'num_hidden_layers': 3, 'hidden_dim_0': 512, 'hidden_dim_1': 64, 'hidden_dim_2': 256, 'kl_weight': 0.00039881204257860315, 'lr': 0.002817118337300469, 'batch_size': 32, 'dropout_rate': 0.45118973415039704, 'prior_mu': 0.024637002122047523, 'prior_sigma': 0.06734512452655424, 'normalization': 'none'}. Best is trial 1528 with value: 0.5170644640922546.
Generating morgan fingerprints...
Generated fingerprints with 2048 features for 900 molecules
Data shape: X=(900, 2048), y=(900,)
Trial 2308: 5-fold CV loss = 0.6082
[I 2025-08-08 05:29:35,776] Trial 2308 finished with value: 0.6082347393035888 and parameters: {'fp_type': 'rdkit', 'rdkit_only_maxPath': 5, 'rdkit_only_nBits': 256, 'num_hidden_layers': 3, 'hidden_dim_0': 512, 'hidden_dim_1': 64, 'hidden_dim_2': 256, 'kl_weight': 0.0001756475999967441, 'lr': 0.004297492015451804, 'batch_size': 32, 'dropout_rate': 0.427025628959527, 'prior_mu': 0.0263201324401787, 'prior_sigma': 0.07919201636068687, 'normalization': 'none'}. Best is trial 1528 with value: 0.5170644640922546.
Generating morgan fingerprints...
Generated fingerprints with 2048 features for 900 molecules
Data shape: X=(900, 2048), y=(900,)
Trial 2309: 5-fold CV loss = 0.5290
[I 2025-08-08 05:29:43,523] Trial 2309 finished with value: 0.5290059685707093 and parameters: {'fp_type': 'morgan', 'morgan_only_radius': 2, 'morgan_only_nBits': 2048, 'num_hidden_layers': 3, 'hidden_dim_0': 512, 'hidden_dim_1': 64, 'hidden_dim_2': 256, 'kl_weight': 0.0003225856426788733, 'lr': 0.0034499954418378913, 'batch_size': 32, 'dropout_rate': 0.45734837863471484, 'prior_mu': 0.047285716699507506, 'prior_sigma': 0.06911311286498904, 'normalization': 'none'}. Best is trial 1528 with value: 0.5170644640922546.
Generating morgan fingerprints...
Generated fingerprints with 2048 features for 900 molecules
Data shape: X=(900, 2048), y=(900,)
Trial 2312: 5-fold CV loss = 0.5351
[I 2025-08-08 05:30:32,999] Trial 2312 finished with value: 0.5350718915462493 and parameters: {'fp_type': 'morgan', 'morgan_only_radius': 2, 'morgan_only_nBits': 2048, 'num_hidden_layers': 3, 'hidden_dim_0': 512, 'hidden_dim_1': 64, 'hidden_dim_2': 256, 'kl_weight': 0.0003170479110217324, 'lr': 0.004656509632772495, 'batch_size': 32, 'dropout_rate': 0.4388935019821188, 'prior_mu': 0.06753753657875035, 'prior_sigma': 0.07312529696404428, 'normalization': 'none'}. Best is trial 1528 with value: 0.5170644640922546.
Generating morgan fingerprints...
Generated fingerprints with 2048 features for 900 molecules
Data shape: X=(900, 2048), y=(900,)
Trial 2311: 5-fold CV loss = 0.5248
[I 2025-08-08 05:30:34,510] Trial 2311 finished with value: 0.5248048067092895 and parameters: {'fp_type': 'morgan', 'morgan_only_radius': 2, 'morgan_only_nBits': 2048, 'num_hidden_layers': 3, 'hidden_dim_0': 512, 'hidden_dim_1': 64, 'hidden_dim_2': 256, 'kl_weight': 0.0002984642141518919, 'lr': 0.0028651182637419595, 'batch_size': 32, 'dropout_rate': 0.43835342324709536, 'prior_mu': 0.049069272258530174, 'prior_sigma': 0.07251276870271156, 'normalization': 'none'}. Best is trial 1528 with value: 0.5170644640922546.
Generating morgan fingerprints...
Generated fingerprints with 2048 features for 900 molecules
Data shape: X=(900, 2048), y=(900,)
Trial 2314: 5-fold CV loss = 0.5343
[I 2025-08-08 05:31:12,968] Trial 2314 finished with value: 0.5343122005462646 and parameters: {'fp_type': 'morgan', 'morgan_only_radius': 2, 'morgan_only_nBits': 2048, 'num_hidden_layers': 3, 'hidden_dim_0': 512, 'hidden_dim_1': 64, 'hidden_dim_2': 256, 'kl_weight': 0.0009304207776230497, 'lr': 0.00399536984333982, 'batch_size': 32, 'dropout_rate': 0.4105280416785255, 'prior_mu': 0.058176436820521094, 'prior_sigma': 0.0644298796397738, 'normalization': 'none'}. Best is trial 1528 with value: 0.5170644640922546.
Generating morgan fingerprints...
Generated fingerprints with 2048 features for 900 molecules
Data shape: X=(900, 2048), y=(900,)
Trial 2307: 5-fold CV loss = 0.6037
[I 2025-08-08 05:31:18,583] Trial 2307 finished with value: 0.6036784291267395 and parameters: {'fp_type': 'rdkit', 'rdkit_only_maxPath': 5, 'rdkit_only_nBits': 256, 'num_hidden_layers': 3, 'hidden_dim_0': 512, 'hidden_dim_1': 64, 'hidden_dim_2': 256, 'kl_weight': 0.00030355593795347173, 'lr': 0.003140069388476575, 'batch_size': 32, 'dropout_rate': 0.4307854831953566, 'prior_mu': 0.02071725149888779, 'prior_sigma': 0.08768199961967525, 'normalization': 'none'}. Best is trial 1528 with value: 0.5170644640922546.
Generating morgan fingerprints...
Generated fingerprints with 2048 features for 900 molecules
Data shape: X=(900, 2048), y=(900,)
Trial 2313: 5-fold CV loss = 0.5337
[I 2025-08-08 05:31:33,588] Trial 2313 finished with value: 0.5336919546127319 and parameters: {'fp_type': 'morgan', 'morgan_only_radius': 2, 'morgan_only_nBits': 2048, 'num_hidden_layers': 3, 'hidden_dim_0': 512, 'hidden_dim_1': 64, 'hidden_dim_2': 256, 'kl_weight': 0.0003122092067434921, 'lr': 0.0035455825911799607, 'batch_size': 32, 'dropout_rate': 0.4091173608429249, 'prior_mu': 0.05827587635233359, 'prior_sigma': 0.10449745543648964, 'normalization': 'none'}. Best is trial 1528 with value: 0.5170644640922546.
Generating morgan fingerprints...
Generated fingerprints with 2048 features for 900 molecules
Data shape: X=(900, 2048), y=(900,)
Trial 2310: 5-fold CV loss = 0.5584
[I 2025-08-08 05:31:34,771] Trial 2310 finished with value: 0.5583895802497864 and parameters: {'fp_type': 'morgan', 'morgan_only_radius': 2, 'morgan_only_nBits': 2048, 'num_hidden_layers': 3, 'hidden_dim_0': 512, 'hidden_dim_1': 64, 'hidden_dim_2': 256, 'kl_weight': 0.00032399855770904196, 'lr': 0.0038053939861436626, 'batch_size': 32, 'dropout_rate': 0.4361840808743079, 'prior_mu': 0.17607739111555087, 'prior_sigma': 0.07930723888823629, 'normalization': 'none'}. Best is trial 1528 with value: 0.5170644640922546.
Generating morgan fingerprints...
Generated fingerprints with 2048 features for 900 molecules
Data shape: X=(900, 2048), y=(900,)
Trial 2315: 5-fold CV loss = 0.5386
[I 2025-08-08 05:31:55,430] Trial 2315 finished with value: 0.5385959327220917 and parameters: {'fp_type': 'morgan', 'morgan_only_radius': 2, 'morgan_only_nBits': 2048, 'num_hidden_layers': 3, 'hidden_dim_0': 512, 'hidden_dim_1': 64, 'hidden_dim_2': 256, 'kl_weight': 0.0003190870947368851, 'lr': 0.005123731948978425, 'batch_size': 32, 'dropout_rate': 0.4192286889297755, 'prior_mu': 0.040103776904705395, 'prior_sigma': 0.10547319971475716, 'normalization': 'none'}. Best is trial 1528 with value: 0.5170644640922546.
Generating morgan fingerprints...
Generated fingerprints with 2048 features for 900 molecules
Data shape: X=(900, 2048), y=(900,)
Trial 2317: 5-fold CV loss = 0.5373
[I 2025-08-08 05:32:30,358] Trial 2317 finished with value: 0.5372726023197174 and parameters: {'fp_type': 'morgan', 'morgan_only_radius': 2, 'morgan_only_nBits': 2048, 'num_hidden_layers': 3, 'hidden_dim_0': 512, 'hidden_dim_1': 64, 'hidden_dim_2': 256, 'kl_weight': 0.00034470363060024414, 'lr': 0.0041112620297863375, 'batch_size': 32, 'dropout_rate': 0.4237970250895244, 'prior_mu': 0.040210838348192654, 'prior_sigma': 0.05886312546619699, 'normalization': 'none'}. Best is trial 1528 with value: 0.5170644640922546.
Generating morgan fingerprints...
Generated fingerprints with 2048 features for 900 molecules
Data shape: X=(900, 2048), y=(900,)
Trial 2316: 5-fold CV loss = 0.5292
[I 2025-08-08 05:32:41,268] Trial 2316 finished with value: 0.529247784614563 and parameters: {'fp_type': 'morgan', 'morgan_only_radius': 2, 'morgan_only_nBits': 2048, 'num_hidden_layers': 3, 'hidden_dim_0': 512, 'hidden_dim_1': 64, 'hidden_dim_2': 256, 'kl_weight': 0.00035711092568088665, 'lr': 0.0036406409901819266, 'batch_size': 32, 'dropout_rate': 0.41992452348875087, 'prior_mu': 0.03498344919602399, 'prior_sigma': 0.06121643980314291, 'normalization': 'none'}. Best is trial 1528 with value: 0.5170644640922546.
Generating morgan fingerprints...
Generated fingerprints with 2048 features for 900 molecules
Data shape: X=(900, 2048), y=(900,)
Trial 2319: 5-fold CV loss = 0.5295
[I 2025-08-08 05:32:43,200] Trial 2319 finished with value: 0.5294857680797577 and parameters: {'fp_type': 'morgan', 'morgan_only_radius': 2, 'morgan_only_nBits': 2048, 'num_hidden_layers': 3, 'hidden_dim_0': 512, 'hidden_dim_1': 64, 'hidden_dim_2': 256, 'kl_weight': 0.0001680882351750503, 'lr': 0.003885098897647586, 'batch_size': 32, 'dropout_rate': 0.45085285716605256, 'prior_mu': 0.030469013273759817, 'prior_sigma': 0.05692196034963695, 'normalization': 'none'}. Best is trial 1528 with value: 0.5170644640922546.
Generating morgan fingerprints...
Generated fingerprints with 2048 features for 900 molecules
Data shape: X=(900, 2048), y=(900,)
Trial 2320: 5-fold CV loss = 0.6843
[I 2025-08-08 05:33:19,724] Trial 2320 finished with value: 0.6843126654624939 and parameters: {'fp_type': 'morgan', 'morgan_only_radius': 3, 'morgan_only_nBits': 2048, 'num_hidden_layers': 1, 'hidden_dim_0': 512, 'kl_weight': 0.0003712287042363509, 'lr': 0.0038410606731960712, 'batch_size': 32, 'dropout_rate': 0.45804248430941347, 'prior_mu': 0.09119616281569963, 'prior_sigma': 0.061470022652399536, 'normalization': 'none'}. Best is trial 1528 with value: 0.5170644640922546.
Generating morgan fingerprints...
Generated fingerprints with 2048 features for 900 molecules
Data shape: X=(900, 2048), y=(900,)
Trial 2323: 5-fold CV loss = 0.7193
[I 2025-08-08 05:33:28,207] Trial 2323 finished with value: 0.7192573189735413 and parameters: {'fp_type': 'morgan', 'morgan_only_radius': 2, 'morgan_only_nBits': 2048, 'num_hidden_layers': 3, 'hidden_dim_0': 512, 'hidden_dim_1': 64, 'hidden_dim_2': 256, 'kl_weight': 0.0004571854181645885, 'lr': 0.0034334129232536084, 'batch_size': 128, 'dropout_rate': 0.40144226984227016, 'prior_mu': 0.051399743703435405, 'prior_sigma': 0.06964276358396991, 'normalization': 'none'}. Best is trial 1528 with value: 0.5170644640922546.
Generating morgan fingerprints...
Generated fingerprints with 2048 features for 900 molecules
Data shape: X=(900, 2048), y=(900,)
Trial 2322: 5-fold CV loss = 0.5375
[I 2025-08-08 05:33:31,034] Trial 2322 finished with value: 0.5374895513057709 and parameters: {'fp_type': 'morgan', 'morgan_only_radius': 3, 'morgan_only_nBits': 2048, 'num_hidden_layers': 3, 'hidden_dim_0': 512, 'hidden_dim_1': 64, 'hidden_dim_2': 256, 'kl_weight': 0.0008955835810425616, 'lr': 0.003814042262639987, 'batch_size': 32, 'dropout_rate': 0.45977591066242796, 'prior_mu': 0.05184379720042256, 'prior_sigma': 0.06443108408019553, 'normalization': 'none'}. Best is trial 1528 with value: 0.5170644640922546.
Generating morgan fingerprints...
Generated fingerprints with 2048 features for 900 molecules
Data shape: X=(900, 2048), y=(900,)
Trial 2325: 5-fold CV loss = 0.5325
[I 2025-08-08 05:34:14,380] Trial 2325 finished with value: 0.5324750602245331 and parameters: {'fp_type': 'morgan', 'morgan_only_radius': 2, 'morgan_only_nBits': 2048, 'num_hidden_layers': 3, 'hidden_dim_0': 512, 'hidden_dim_1': 64, 'hidden_dim_2': 256, 'kl_weight': 0.0008733948131988386, 'lr': 0.0037282664980406045, 'batch_size': 32, 'dropout_rate': 0.4378497522539196, 'prior_mu': 0.0660571159189218, 'prior_sigma': 0.07411545787240514, 'normalization': 'none'}. Best is trial 1528 with value: 0.5170644640922546.
Generating morgan fingerprints...
Generated fingerprints with 2048 features for 900 molecules
Data shape: X=(900, 2048), y=(900,)
Trial 2321: 5-fold CV loss = 0.5318
[I 2025-08-08 05:34:21,635] Trial 2321 finished with value: 0.5318139612674713 and parameters: {'fp_type': 'morgan', 'morgan_only_radius': 3, 'morgan_only_nBits': 2048, 'num_hidden_layers': 3, 'hidden_dim_0': 512, 'hidden_dim_1': 64, 'hidden_dim_2': 256, 'kl_weight': 0.0004557636946997905, 'lr': 0.0029550004069823802, 'batch_size': 32, 'dropout_rate': 0.457962180949352, 'prior_mu': 0.05043767895850258, 'prior_sigma': 0.0697933290939224, 'normalization': 'none'}. Best is trial 1528 with value: 0.5170644640922546.
Generating morgan fingerprints...
Generated fingerprints with 2048 features for 900 molecules
Data shape: X=(900, 2048), y=(900,)
Trial 2324: 5-fold CV loss = 0.5347
[I 2025-08-08 05:34:25,140] Trial 2324 finished with value: 0.5347072064876557 and parameters: {'fp_type': 'morgan', 'morgan_only_radius': 2, 'morgan_only_nBits': 2048, 'num_hidden_layers': 3, 'hidden_dim_0': 512, 'hidden_dim_1': 64, 'hidden_dim_2': 256, 'kl_weight': 0.0009201235149347004, 'lr': 0.003585266761726331, 'batch_size': 32, 'dropout_rate': 0.44541385621941815, 'prior_mu': 0.07022318909359695, 'prior_sigma': 0.06545124931808739, 'normalization': 'none'}. Best is trial 1528 with value: 0.5170644640922546.
Generating morgan fingerprints...
Generated fingerprints with 2048 features for 900 molecules
Data shape: X=(900, 2048), y=(900,)
Trial 2318: 5-fold CV loss = 0.5304
[I 2025-08-08 05:34:35,238] Trial 2318 finished with value: 0.530353981256485 and parameters: {'fp_type': 'morgan', 'morgan_only_radius': 2, 'morgan_only_nBits': 2048, 'num_hidden_layers': 3, 'hidden_dim_0': 512, 'hidden_dim_1': 64, 'hidden_dim_2': 256, 'kl_weight': 0.0003859242677823922, 'lr': 0.0029285027471700554, 'batch_size': 32, 'dropout_rate': 0.41850423363023836, 'prior_mu': 0.039259564139638145, 'prior_sigma': 0.06041573578329724, 'normalization': 'none'}. Best is trial 1528 with value: 0.5170644640922546.
Generating morgan fingerprints...
Generated fingerprints with 2048 features for 900 molecules
Data shape: X=(900, 2048), y=(900,)
Trial 2326: 5-fold CV loss = 0.5789
[I 2025-08-08 05:34:51,048] Trial 2326 finished with value: 0.5789452493190765 and parameters: {'fp_type': 'morgan', 'morgan_only_radius': 2, 'morgan_only_nBits': 2048, 'num_hidden_layers': 3, 'hidden_dim_0': 512, 'hidden_dim_1': 64, 'hidden_dim_2': 256, 'kl_weight': 0.0007563928618859659, 'lr': 0.003219266037078795, 'batch_size': 64, 'dropout_rate': 0.44726734465977447, 'prior_mu': 0.04500112467002215, 'prior_sigma': 0.06711846761762585, 'normalization': 'none'}. Best is trial 1528 with value: 0.5170644640922546.
Generating morgan fingerprints...
Generated fingerprints with 2048 features for 900 molecules
Data shape: X=(900, 2048), y=(900,)
Trial 2328: 5-fold CV loss = 0.5610
[I 2025-08-08 05:35:10,597] Trial 2328 finished with value: 0.5609900712966919 and parameters: {'fp_type': 'morgan', 'morgan_only_radius': 2, 'morgan_only_nBits': 2048, 'num_hidden_layers': 3, 'hidden_dim_0': 512, 'hidden_dim_1': 64, 'hidden_dim_2': 256, 'kl_weight': 0.0007229359211243121, 'lr': 0.0031118606994140837, 'batch_size': 64, 'dropout_rate': 0.2684805176794006, 'prior_mu': 0.044088565845140724, 'prior_sigma': 0.0752334282788945, 'normalization': 'none'}. Best is trial 1528 with value: 0.5170644640922546.
Generating morgan fingerprints...
Generated fingerprints with 2048 features for 900 molecules
Data shape: X=(900, 2048), y=(900,)
Trial 2327: 5-fold CV loss = 0.6183
