[I 2025-08-07 19:12:28,159] Trial 625 finished with value: 0.5664279580116272 and parameters: {'fp_type': 'rdkit', 'rdkit_only_maxPath': 6, 'rdkit_only_nBits': 1024, 'num_hidden_layers': 3, 'hidden_dim_0': 512, 'hidden_dim_1': 512, 'hidden_dim_2': 512, 'kl_weight': 0.0007965653364848435, 'lr': 0.00319832459184883, 'batch_size': 32, 'dropout_rate': 0.4903439421815917, 'prior_mu': -0.043573989884428704, 'prior_sigma': 0.052861687710429074, 'normalization': 'none'}. Best is trial 272 with value: 0.5198344707489013.
Generating morgan fingerprints...
Generated fingerprints with 2048 features for 900 molecules
Data shape: X=(900, 2048), y=(900,)
Trial 624: 5-fold CV loss = 0.5795
[I 2025-08-07 19:12:33,841] Trial 624 finished with value: 0.5794614017009735 and parameters: {'fp_type': 'morgan', 'morgan_only_radius': 2, 'morgan_only_nBits': 1024, 'num_hidden_layers': 3, 'hidden_dim_0': 512, 'hidden_dim_1': 512, 'hidden_dim_2': 64, 'kl_weight': 0.0008219196566712759, 'lr': 0.00301635707322846, 'batch_size': 32, 'dropout_rate': 0.4913847203177785, 'prior_mu': -0.04576998409240615, 'prior_sigma': 0.05264864341124352, 'normalization': 'none'}. Best is trial 272 with value: 0.5198344707489013.
Generating morgan fingerprints...
Generated fingerprints with 2048 features for 900 molecules
Data shape: X=(900, 2048), y=(900,)
Trial 621: 5-fold CV loss = 0.5672
[I 2025-08-07 19:12:35,565] Trial 621 finished with value: 0.5671711206436157 and parameters: {'fp_type': 'morgan', 'morgan_only_radius': 2, 'morgan_only_nBits': 1024, 'num_hidden_layers': 3, 'hidden_dim_0': 512, 'hidden_dim_1': 128, 'hidden_dim_2': 64, 'kl_weight': 0.001026892922657663, 'lr': 0.002329448494465194, 'batch_size': 32, 'dropout_rate': 0.48057706576935544, 'prior_mu': -0.05267294379289653, 'prior_sigma': 0.06324958799535356, 'normalization': 'none'}. Best is trial 272 with value: 0.5198344707489013.
Generating morgan fingerprints...
Generated fingerprints with 2048 features for 900 molecules
Data shape: X=(900, 2048), y=(900,)
Trial 623: 5-fold CV loss = 0.5456
[I 2025-08-07 19:13:11,756] Trial 623 finished with value: 0.5455675005912781 and parameters: {'fp_type': 'morgan', 'morgan_only_radius': 2, 'morgan_only_nBits': 1024, 'num_hidden_layers': 3, 'hidden_dim_0': 512, 'hidden_dim_1': 512, 'hidden_dim_2': 512, 'kl_weight': 0.0010495478271620282, 'lr': 0.003180614294648955, 'batch_size': 32, 'dropout_rate': 0.48349037257335303, 'prior_mu': -0.05079422890913695, 'prior_sigma': 0.052741542999353457, 'normalization': 'layer'}. Best is trial 272 with value: 0.5198344707489013.
Generating morgan fingerprints...
Generated fingerprints with 2048 features for 900 molecules
Data shape: X=(900, 2048), y=(900,)
Trial 626: 5-fold CV loss = 0.5304
[I 2025-08-07 19:13:28,808] Trial 626 finished with value: 0.5303510367870331 and parameters: {'fp_type': 'morgan', 'morgan_only_radius': 2, 'morgan_only_nBits': 2048, 'num_hidden_layers': 3, 'hidden_dim_0': 512, 'hidden_dim_1': 128, 'hidden_dim_2': 512, 'kl_weight': 0.0009822013274521657, 'lr': 0.002895482469584796, 'batch_size': 32, 'dropout_rate': 0.4898036699801983, 'prior_mu': -0.03721542151525697, 'prior_sigma': 0.056288648531234046, 'normalization': 'none'}. Best is trial 272 with value: 0.5198344707489013.
Generating morgan fingerprints...
Generated fingerprints with 1024 features for 900 molecules
Data shape: X=(900, 1024), y=(900,)
Trial 627: 5-fold CV loss = 0.5348
[I 2025-08-07 19:13:44,423] Trial 627 finished with value: 0.5347682774066925 and parameters: {'fp_type': 'morgan', 'morgan_only_radius': 2, 'morgan_only_nBits': 2048, 'num_hidden_layers': 3, 'hidden_dim_0': 512, 'hidden_dim_1': 128, 'hidden_dim_2': 512, 'kl_weight': 0.0010860202431712766, 'lr': 0.0026295207438059693, 'batch_size': 32, 'dropout_rate': 0.49938103804338735, 'prior_mu': -0.034519143336966526, 'prior_sigma': 0.05779851896195511, 'normalization': 'none'}. Best is trial 272 with value: 0.5198344707489013.
Generating morgan fingerprints...
Generated fingerprints with 1024 features for 900 molecules
Data shape: X=(900, 1024), y=(900,)
Trial 630: 5-fold CV loss = 0.5277
[I 2025-08-07 19:14:35,391] Trial 630 finished with value: 0.5277181684970855 and parameters: {'fp_type': 'morgan', 'morgan_only_radius': 2, 'morgan_only_nBits': 1024, 'num_hidden_layers': 3, 'hidden_dim_0': 512, 'hidden_dim_1': 128, 'hidden_dim_2': 512, 'kl_weight': 0.0009022265529106088, 'lr': 0.002712437022625305, 'batch_size': 32, 'dropout_rate': 0.4934914345602022, 'prior_mu': -0.06301371281275121, 'prior_sigma': 0.05901172907737161, 'normalization': 'none'}. Best is trial 272 with value: 0.5198344707489013.
Generating morgan fingerprints...
Generated fingerprints with 1024 features for 900 molecules
Data shape: X=(900, 1024), y=(900,)
Trial 628: 5-fold CV loss = 0.5293
[I 2025-08-07 19:14:35,857] Trial 628 finished with value: 0.529292231798172 and parameters: {'fp_type': 'morgan', 'morgan_only_radius': 2, 'morgan_only_nBits': 2048, 'num_hidden_layers': 3, 'hidden_dim_0': 512, 'hidden_dim_1': 128, 'hidden_dim_2': 512, 'kl_weight': 0.0010602293009221169, 'lr': 0.002633618054010469, 'batch_size': 32, 'dropout_rate': 0.49927729194542525, 'prior_mu': -0.03634859950460058, 'prior_sigma': 0.05790500821963139, 'normalization': 'none'}. Best is trial 272 with value: 0.5198344707489013.
Generating morgan fingerprints...
Generated fingerprints with 1024 features for 900 molecules
Data shape: X=(900, 1024), y=(900,)
Trial 631: 5-fold CV loss = 0.5474
[I 2025-08-07 19:14:55,984] Trial 631 finished with value: 0.5474292576313019 and parameters: {'fp_type': 'morgan', 'morgan_only_radius': 2, 'morgan_only_nBits': 1024, 'num_hidden_layers': 3, 'hidden_dim_0': 512, 'hidden_dim_1': 128, 'hidden_dim_2': 128, 'kl_weight': 0.0012111962770251442, 'lr': 0.002587305431179468, 'batch_size': 32, 'dropout_rate': 0.4722383934437451, 'prior_mu': -0.060840661995326756, 'prior_sigma': 0.05909407855766914, 'normalization': 'none'}. Best is trial 272 with value: 0.5198344707489013.
Generating morgan fingerprints...
Generated fingerprints with 1024 features for 900 molecules
Data shape: X=(900, 1024), y=(900,)
Trial 632: 5-fold CV loss = 0.5551
[I 2025-08-07 19:15:37,302] Trial 632 finished with value: 0.5550962090492249 and parameters: {'fp_type': 'morgan', 'morgan_only_radius': 2, 'morgan_only_nBits': 1024, 'num_hidden_layers': 3, 'hidden_dim_0': 512, 'hidden_dim_1': 128, 'hidden_dim_2': 128, 'kl_weight': 0.0011568880022052132, 'lr': 0.0025274670258408492, 'batch_size': 32, 'dropout_rate': 0.4732240519533063, 'prior_mu': -0.0281813831027945, 'prior_sigma': 0.059995352061034964, 'normalization': 'none'}. Best is trial 272 with value: 0.5198344707489013.
Generating morgan fingerprints...
Generated fingerprints with 1024 features for 900 molecules
Data shape: X=(900, 1024), y=(900,)
Trial 635: 5-fold CV loss = 0.6848
[I 2025-08-07 19:15:54,933] Trial 635 finished with value: 0.6847763180732727 and parameters: {'fp_type': 'morgan', 'morgan_only_radius': 2, 'morgan_only_nBits': 1024, 'num_hidden_layers': 1, 'hidden_dim_0': 128, 'kl_weight': 0.0015829364513665935, 'lr': 0.0021869252706075565, 'batch_size': 32, 'dropout_rate': 0.49924241790849416, 'prior_mu': -0.046800041901787826, 'prior_sigma': 0.06702504144855864, 'normalization': 'none'}. Best is trial 272 with value: 0.5198344707489013.
Generating morgan fingerprints...
Generated fingerprints with 1024 features for 900 molecules
Data shape: X=(900, 1024), y=(900,)
Trial 634: 5-fold CV loss = 0.5270
[I 2025-08-07 19:16:26,152] Trial 634 finished with value: 0.5270248293876648 and parameters: {'fp_type': 'morgan', 'morgan_only_radius': 2, 'morgan_only_nBits': 1024, 'num_hidden_layers': 3, 'hidden_dim_0': 512, 'hidden_dim_1': 128, 'hidden_dim_2': 512, 'kl_weight': 0.0015976030757729942, 'lr': 0.0024439839685446883, 'batch_size': 32, 'dropout_rate': 0.4800011008846573, 'prior_mu': -0.024457495288910183, 'prior_sigma': 0.061881178850103837, 'normalization': 'none'}. Best is trial 272 with value: 0.5198344707489013.
Generating morgan fingerprints...
Generated fingerprints with 1024 features for 900 molecules
Data shape: X=(900, 1024), y=(900,)
Trial 633: 5-fold CV loss = 0.5749
[I 2025-08-07 19:16:38,256] Trial 633 finished with value: 0.5748539924621582 and parameters: {'fp_type': 'morgan', 'morgan_only_radius': 2, 'morgan_only_nBits': 1024, 'num_hidden_layers': 3, 'hidden_dim_0': 512, 'hidden_dim_1': 128, 'hidden_dim_2': 128, 'kl_weight': 0.0011218882740688697, 'lr': 0.002479856799464221, 'batch_size': 32, 'dropout_rate': 0.4999640465003959, 'prior_mu': -0.02579128730180491, 'prior_sigma': 0.06062031556170726, 'normalization': 'none'}. Best is trial 272 with value: 0.5198344707489013.
Generating morgan fingerprints...
Generated fingerprints with 1024 features for 900 molecules
Data shape: X=(900, 1024), y=(900,)
Trial 636: 5-fold CV loss = 0.5268
[I 2025-08-07 19:16:58,621] Trial 636 finished with value: 0.5268156230449677 and parameters: {'fp_type': 'morgan', 'morgan_only_radius': 2, 'morgan_only_nBits': 1024, 'num_hidden_layers': 3, 'hidden_dim_0': 512, 'hidden_dim_1': 128, 'hidden_dim_2': 512, 'kl_weight': 0.0013914675401661115, 'lr': 0.002454117691932213, 'batch_size': 32, 'dropout_rate': 0.4997590869505517, 'prior_mu': -0.042164644365428695, 'prior_sigma': 0.06302368525581645, 'normalization': 'none'}. Best is trial 272 with value: 0.5198344707489013.
Generating morgan fingerprints...
Generated fingerprints with 1024 features for 900 molecules
Data shape: X=(900, 1024), y=(900,)
Trial 629: 5-fold CV loss = 0.5291
[I 2025-08-07 19:17:01,059] Trial 629 finished with value: 0.5291309058666229 and parameters: {'fp_type': 'morgan', 'morgan_only_radius': 2, 'morgan_only_nBits': 2048, 'num_hidden_layers': 3, 'hidden_dim_0': 512, 'hidden_dim_1': 128, 'hidden_dim_2': 512, 'kl_weight': 0.0011713230425551538, 'lr': 0.002621744413361818, 'batch_size': 32, 'dropout_rate': 0.4991282752584302, 'prior_mu': -0.035913971480786414, 'prior_sigma': 0.058187883825270396, 'normalization': 'none'}. Best is trial 272 with value: 0.5198344707489013.
Generating morgan fingerprints...
Generated fingerprints with 1024 features for 900 molecules
Data shape: X=(900, 1024), y=(900,)
Trial 637: 5-fold CV loss = 0.5300
[I 2025-08-07 19:17:49,830] Trial 637 finished with value: 0.5299900591373443 and parameters: {'fp_type': 'morgan', 'morgan_only_radius': 2, 'morgan_only_nBits': 1024, 'num_hidden_layers': 3, 'hidden_dim_0': 512, 'hidden_dim_1': 128, 'hidden_dim_2': 512, 'kl_weight': 0.0013212255695377155, 'lr': 0.002144320533332765, 'batch_size': 32, 'dropout_rate': 0.48268438638322847, 'prior_mu': -0.04389639880069872, 'prior_sigma': 0.06637637631753521, 'normalization': 'none'}. Best is trial 272 with value: 0.5198344707489013.
Generating morgan fingerprints...
Generated fingerprints with 1024 features for 900 molecules
Data shape: X=(900, 1024), y=(900,)
Trial 639: 5-fold CV loss = 0.5302
[I 2025-08-07 19:18:15,883] Trial 639 finished with value: 0.5302004277706146 and parameters: {'fp_type': 'morgan', 'morgan_only_radius': 2, 'morgan_only_nBits': 1024, 'num_hidden_layers': 3, 'hidden_dim_0': 512, 'hidden_dim_1': 128, 'hidden_dim_2': 512, 'kl_weight': 0.0007821253403323408, 'lr': 0.002147713932302168, 'batch_size': 32, 'dropout_rate': 0.4837519668290685, 'prior_mu': -0.042956302638923534, 'prior_sigma': 0.06695713743890261, 'normalization': 'none'}. Best is trial 272 with value: 0.5198344707489013.
Generating morgan fingerprints...
Generated fingerprints with 1024 features for 900 molecules
Data shape: X=(900, 1024), y=(900,)
Trial 641: 5-fold CV loss = 0.5441
[I 2025-08-07 19:18:52,041] Trial 641 finished with value: 0.5441194713115692 and parameters: {'fp_type': 'morgan', 'morgan_only_radius': 2, 'morgan_only_nBits': 1024, 'num_hidden_layers': 3, 'hidden_dim_0': 512, 'hidden_dim_1': 128, 'hidden_dim_2': 512, 'kl_weight': 0.000945010600971299, 'lr': 0.002847658332738217, 'batch_size': 32, 'dropout_rate': 0.26818375910363007, 'prior_mu': -0.0572405387321812, 'prior_sigma': 0.06776972675918308, 'normalization': 'none'}. Best is trial 272 with value: 0.5198344707489013.
Generating morgan fingerprints...
Generated fingerprints with 1024 features for 900 molecules
Data shape: X=(900, 1024), y=(900,)
Trial 638: 5-fold CV loss = 0.5249
[I 2025-08-07 19:19:06,600] Trial 638 finished with value: 0.5249314904212952 and parameters: {'fp_type': 'morgan', 'morgan_only_radius': 2, 'morgan_only_nBits': 1024, 'num_hidden_layers': 3, 'hidden_dim_0': 512, 'hidden_dim_1': 128, 'hidden_dim_2': 512, 'kl_weight': 0.001394293688660213, 'lr': 0.002109198725224671, 'batch_size': 32, 'dropout_rate': 0.4841121104712857, 'prior_mu': -0.039322361044118, 'prior_sigma': 0.06605025209750509, 'normalization': 'none'}. Best is trial 272 with value: 0.5198344707489013.
Generating rdkit fingerprints...
Generated fingerprints with 1024 features for 900 molecules
Data shape: X=(900, 1024), y=(900,)
Trial 642: 5-fold CV loss = 0.5306
[I 2025-08-07 19:19:10,332] Trial 642 finished with value: 0.5306340098381043 and parameters: {'fp_type': 'morgan', 'morgan_only_radius': 2, 'morgan_only_nBits': 1024, 'num_hidden_layers': 3, 'hidden_dim_0': 512, 'hidden_dim_1': 128, 'hidden_dim_2': 512, 'kl_weight': 0.0009187760464762117, 'lr': 0.002921812848000075, 'batch_size': 32, 'dropout_rate': 0.4714291668836034, 'prior_mu': -0.01739439548795558, 'prior_sigma': 0.054552198283555266, 'normalization': 'none'}. Best is trial 272 with value: 0.5198344707489013.
Generating rdkit fingerprints...
Generated fingerprints with 1024 features for 900 molecules
Data shape: X=(900, 1024), y=(900,)
Trial 645: 5-fold CV loss = 0.6293
[I 2025-08-07 19:19:44,053] Trial 645 finished with value: 0.6293306827545166 and parameters: {'fp_type': 'rdkit', 'rdkit_only_maxPath': 7, 'rdkit_only_nBits': 1024, 'num_hidden_layers': 3, 'hidden_dim_0': 64, 'hidden_dim_1': 1024, 'hidden_dim_2': 512, 'kl_weight': 0.0016824608941229501, 'lr': 0.0020611994797621797, 'batch_size': 32, 'dropout_rate': 0.46614366478444724, 'prior_mu': -0.055627181588812684, 'prior_sigma': 0.07081192230794296, 'normalization': 'none'}. Best is trial 272 with value: 0.5198344707489013.
Generating morgan fingerprints...
Generated fingerprints with 1024 features for 900 molecules
Data shape: X=(900, 1024), y=(900,)
Trial 644: 5-fold CV loss = 0.6242
[I 2025-08-07 19:20:08,158] Trial 644 finished with value: 0.6241665363311768 and parameters: {'fp_type': 'rdkit', 'rdkit_only_maxPath': 7, 'rdkit_only_nBits': 1024, 'num_hidden_layers': 3, 'hidden_dim_0': 64, 'hidden_dim_1': 128, 'hidden_dim_2': 512, 'kl_weight': 0.0008159489549873864, 'lr': 0.00210008864199455, 'batch_size': 32, 'dropout_rate': 0.4675459154705282, 'prior_mu': -0.053952000917777916, 'prior_sigma': 0.07076785401129214, 'normalization': 'none'}. Best is trial 272 with value: 0.5198344707489013.
Generating morgan fingerprints...
Generated fingerprints with 1024 features for 900 molecules
Data shape: X=(900, 1024), y=(900,)
Trial 643: 5-fold CV loss = 0.5451
[I 2025-08-07 19:20:19,422] Trial 643 finished with value: 0.5451432883739471 and parameters: {'fp_type': 'morgan', 'morgan_only_radius': 2, 'morgan_only_nBits': 1024, 'num_hidden_layers': 3, 'hidden_dim_0': 64, 'hidden_dim_1': 128, 'hidden_dim_2': 512, 'kl_weight': 0.001763288054267564, 'lr': 0.0021435426866149346, 'batch_size': 32, 'dropout_rate': 0.466350029728781, 'prior_mu': -0.020558868949558193, 'prior_sigma': 0.05457878426778283, 'normalization': 'none'}. Best is trial 272 with value: 0.5198344707489013.
Generating morgan fingerprints...
Generated fingerprints with 1024 features for 900 molecules
Data shape: X=(900, 1024), y=(900,)
Trial 646: 5-fold CV loss = 0.5278
[I 2025-08-07 19:21:13,055] Trial 646 finished with value: 0.5278489768505097 and parameters: {'fp_type': 'morgan', 'morgan_only_radius': 2, 'morgan_only_nBits': 1024, 'num_hidden_layers': 3, 'hidden_dim_0': 512, 'hidden_dim_1': 128, 'hidden_dim_2': 512, 'kl_weight': 0.0012482477259369604, 'lr': 0.0018406097255737875, 'batch_size': 32, 'dropout_rate': 0.47799824982334976, 'prior_mu': -0.030947873554471147, 'prior_sigma': 0.06959186093943157, 'normalization': 'none'}. Best is trial 272 with value: 0.5198344707489013.
Generating morgan fingerprints...
Generated fingerprints with 1024 features for 900 molecules
Data shape: X=(900, 1024), y=(900,)
Trial 648: 5-fold CV loss = 0.5448
[I 2025-08-07 19:21:56,130] Trial 648 finished with value: 0.5448086798191071 and parameters: {'fp_type': 'morgan', 'morgan_only_radius': 2, 'morgan_only_nBits': 1024, 'num_hidden_layers': 3, 'hidden_dim_0': 512, 'hidden_dim_1': 128, 'hidden_dim_2': 512, 'kl_weight': 0.0012407954120036762, 'lr': 0.0018809863342971447, 'batch_size': 32, 'dropout_rate': 0.480090663816731, 'prior_mu': -0.033797604381755456, 'prior_sigma': 0.06482370443855764, 'normalization': 'none'}. Best is trial 272 with value: 0.5198344707489013.
Generating morgan fingerprints...
Generated fingerprints with 1024 features for 900 molecules
Data shape: X=(900, 1024), y=(900,)
Trial 640: 5-fold CV loss = 0.5402
[I 2025-08-07 19:21:56,920] Trial 640 finished with value: 0.5401505172252655 and parameters: {'fp_type': 'morgan', 'morgan_only_radius': 2, 'morgan_only_nBits': 1024, 'num_hidden_layers': 3, 'hidden_dim_0': 512, 'hidden_dim_1': 128, 'hidden_dim_2': 512, 'kl_weight': 0.0008269751888903237, 'lr': 0.002128497106183572, 'batch_size': 32, 'dropout_rate': 0.4827038698000168, 'prior_mu': -0.05605914478578719, 'prior_sigma': 0.10031817586399375, 'normalization': 'none'}. Best is trial 272 with value: 0.5198344707489013.
Generating morgan fingerprints...
Generated fingerprints with 1024 features for 900 molecules
Data shape: X=(900, 1024), y=(900,)
Trial 649: 5-fold CV loss = 0.5520
[I 2025-08-07 19:22:30,460] Trial 649 finished with value: 0.551996785402298 and parameters: {'fp_type': 'morgan', 'morgan_only_radius': 2, 'morgan_only_nBits': 1024, 'num_hidden_layers': 3, 'hidden_dim_0': 512, 'hidden_dim_1': 128, 'hidden_dim_2': 512, 'kl_weight': 0.00027098896451865207, 'lr': 0.001880554420486745, 'batch_size': 32, 'dropout_rate': 0.4890288078943, 'prior_mu': -0.06921809808291743, 'prior_sigma': 0.06482989544919288, 'normalization': 'none'}. Best is trial 272 with value: 0.5198344707489013.
Generating morgan fingerprints...
Generated fingerprints with 1024 features for 900 molecules
Data shape: X=(900, 1024), y=(900,)
Trial 647: 5-fold CV loss = 0.5516
[I 2025-08-07 19:23:27,800] Trial 647 finished with value: 0.551600307226181 and parameters: {'fp_type': 'morgan', 'morgan_only_radius': 2, 'morgan_only_nBits': 1024, 'num_hidden_layers': 3, 'hidden_dim_0': 512, 'hidden_dim_1': 128, 'hidden_dim_2': 512, 'kl_weight': 0.0012173803901997886, 'lr': 0.0015303659173046776, 'batch_size': 32, 'dropout_rate': 0.48005850161408586, 'prior_mu': -0.03378245708307406, 'prior_sigma': 0.06575290265476949, 'normalization': 'none'}. Best is trial 272 with value: 0.5198344707489013.
Generating morgan fingerprints...
Generated fingerprints with 1024 features for 900 molecules
Data shape: X=(900, 1024), y=(900,)
Trial 650: 5-fold CV loss = 0.5390
[I 2025-08-07 19:23:30,083] Trial 650 finished with value: 0.5389818012714386 and parameters: {'fp_type': 'morgan', 'morgan_only_radius': 2, 'morgan_only_nBits': 1024, 'num_hidden_layers': 3, 'hidden_dim_0': 512, 'hidden_dim_1': 128, 'hidden_dim_2': 512, 'kl_weight': 0.0010540232813803297, 'lr': 0.0016024700424808968, 'batch_size': 32, 'dropout_rate': 0.4904194136950599, 'prior_mu': -0.012894037961495722, 'prior_sigma': 0.1006079670404284, 'normalization': 'none'}. Best is trial 272 with value: 0.5198344707489013.
Generating morgan fingerprints...
Generated fingerprints with 1024 features for 900 molecules
Data shape: X=(900, 1024), y=(900,)
Trial 652: 5-fold CV loss = 0.6643
[I 2025-08-07 19:23:59,622] Trial 652 finished with value: 0.6642840921878814 and parameters: {'fp_type': 'morgan', 'morgan_only_radius': 2, 'morgan_only_nBits': 1024, 'num_hidden_layers': 3, 'hidden_dim_0': 512, 'hidden_dim_1': 128, 'hidden_dim_2': 512, 'kl_weight': 0.001082628169861491, 'lr': 0.0015758860830783004, 'batch_size': 32, 'dropout_rate': 0.4902538146628265, 'prior_mu': -0.047882491927454196, 'prior_sigma': 0.07407278404523598, 'normalization': 'none'}. Best is trial 272 with value: 0.5198344707489013.
Generating morgan fingerprints...
Generated fingerprints with 1024 features for 900 molecules
Data shape: X=(900, 1024), y=(900,)
Trial 655: 5-fold CV loss = 0.5457
[I 2025-08-07 19:24:46,028] Trial 655 finished with value: 0.5456832647323608 and parameters: {'fp_type': 'morgan', 'morgan_only_radius': 2, 'morgan_only_nBits': 1024, 'num_hidden_layers': 3, 'hidden_dim_0': 1024, 'hidden_dim_1': 128, 'hidden_dim_2': 512, 'kl_weight': 0.0013557117045622329, 'lr': 0.003387055997688255, 'batch_size': 32, 'dropout_rate': 0.47285692929427553, 'prior_mu': -0.04063548375646704, 'prior_sigma': 0.062071336323501834, 'normalization': 'none'}. Best is trial 272 with value: 0.5198344707489013.
Generating morgan fingerprints...
Generated fingerprints with 1024 features for 900 molecules
Data shape: X=(900, 1024), y=(900,)
Trial 654: 5-fold CV loss = 0.5333
[I 2025-08-07 19:24:55,667] Trial 654 finished with value: 0.5332976996898651 and parameters: {'fp_type': 'morgan', 'morgan_only_radius': 2, 'morgan_only_nBits': 1024, 'num_hidden_layers': 3, 'hidden_dim_0': 512, 'hidden_dim_1': 128, 'hidden_dim_2': 512, 'kl_weight': 0.0018103390839720632, 'lr': 0.0023909965702857226, 'batch_size': 32, 'dropout_rate': 0.4999879685916913, 'prior_mu': -0.043856648717522206, 'prior_sigma': 0.07299548737252468, 'normalization': 'none'}. Best is trial 272 with value: 0.5198344707489013.
Generating morgan fingerprints...
Generated fingerprints with 1024 features for 900 molecules
Data shape: X=(900, 1024), y=(900,)
Trial 656: 5-fold CV loss = 1.0181
