[I 2025-08-08 03:52:15,029] Trial 2045 finished with value: 0.5221982717514038 and parameters: {'fp_type': 'morgan', 'morgan_only_radius': 2, 'morgan_only_nBits': 2048, 'num_hidden_layers': 3, 'hidden_dim_0': 512, 'hidden_dim_1': 64, 'hidden_dim_2': 256, 'kl_weight': 0.0006263867550934585, 'lr': 0.002521252511653818, 'batch_size': 32, 'dropout_rate': 0.4323517816839567, 'prior_mu': 0.05403533522471342, 'prior_sigma': 0.07412071112499843, 'normalization': 'none'}. Best is trial 1528 with value: 0.5170644640922546.
Generating morgan fingerprints...
Generated fingerprints with 2048 features for 900 molecules
Data shape: X=(900, 2048), y=(900,)
Trial 2037: 5-fold CV loss = 0.5234
[I 2025-08-08 03:52:56,793] Trial 2037 finished with value: 0.5234412252902985 and parameters: {'fp_type': 'morgan', 'morgan_only_radius': 2, 'morgan_only_nBits': 2048, 'num_hidden_layers': 3, 'hidden_dim_0': 512, 'hidden_dim_1': 64, 'hidden_dim_2': 256, 'kl_weight': 0.00042918775315657984, 'lr': 0.0024100057958210477, 'batch_size': 32, 'dropout_rate': 0.416472678659496, 'prior_mu': 0.07837480812312606, 'prior_sigma': 0.0808003983222927, 'normalization': 'none'}. Best is trial 1528 with value: 0.5170644640922546.
Generating morgan fingerprints...
Generated fingerprints with 2048 features for 900 molecules
Data shape: X=(900, 2048), y=(900,)
Trial 2048: 5-fold CV loss = 0.5335
[I 2025-08-08 03:53:10,899] Trial 2048 finished with value: 0.5334686934947968 and parameters: {'fp_type': 'morgan', 'morgan_only_radius': 2, 'morgan_only_nBits': 2048, 'num_hidden_layers': 3, 'hidden_dim_0': 512, 'hidden_dim_1': 64, 'hidden_dim_2': 1024, 'kl_weight': 0.00042566417343672236, 'lr': 0.0021063008929657575, 'batch_size': 32, 'dropout_rate': 0.4155301926363409, 'prior_mu': 0.053071262654553836, 'prior_sigma': 0.07259634289819436, 'normalization': 'none'}. Best is trial 1528 with value: 0.5170644640922546.
Generating morgan fingerprints...
Generated fingerprints with 2048 features for 900 molecules
Data shape: X=(900, 2048), y=(900,)
Trial 2047: 5-fold CV loss = 0.5648
[I 2025-08-08 03:53:20,933] Trial 2047 finished with value: 0.5648178219795227 and parameters: {'fp_type': 'morgan', 'morgan_only_radius': 2, 'morgan_only_nBits': 2048, 'num_hidden_layers': 3, 'hidden_dim_0': 512, 'hidden_dim_1': 64, 'hidden_dim_2': 256, 'kl_weight': 0.0004613008576526251, 'lr': 0.0021442757106470618, 'batch_size': 32, 'dropout_rate': 0.41204999262211495, 'prior_mu': 0.056983325501989035, 'prior_sigma': 0.07463311411611191, 'normalization': 'none'}. Best is trial 1528 with value: 0.5170644640922546.
Generating morgan fingerprints...
Generated fingerprints with 2048 features for 900 molecules
Data shape: X=(900, 2048), y=(900,)
Trial 2046: 5-fold CV loss = 0.5258
[I 2025-08-08 03:54:00,159] Trial 2046 finished with value: 0.5258176684379577 and parameters: {'fp_type': 'morgan', 'morgan_only_radius': 2, 'morgan_only_nBits': 2048, 'num_hidden_layers': 3, 'hidden_dim_0': 512, 'hidden_dim_1': 64, 'hidden_dim_2': 256, 'kl_weight': 0.00046140488760055843, 'lr': 0.0025563447872902732, 'batch_size': 32, 'dropout_rate': 0.41244609021463896, 'prior_mu': 0.051309001340544544, 'prior_sigma': 0.07275647365007139, 'normalization': 'none'}. Best is trial 1528 with value: 0.5170644640922546.
Generating morgan fingerprints...
Generated fingerprints with 2048 features for 900 molecules
Data shape: X=(900, 2048), y=(900,)
Trial 2051: 5-fold CV loss = 0.8385
[I 2025-08-08 03:54:35,159] Trial 2051 finished with value: 0.8385405778884888 and parameters: {'fp_type': 'morgan', 'morgan_only_radius': 2, 'morgan_only_nBits': 2048, 'num_hidden_layers': 3, 'hidden_dim_0': 512, 'hidden_dim_1': 512, 'hidden_dim_2': 256, 'kl_weight': 0.0006139821102527843, 'lr': 0.0027468733523848318, 'batch_size': 32, 'dropout_rate': 0.43142823996688795, 'prior_mu': -0.08625674046367343, 'prior_sigma': 0.08741481806758959, 'normalization': 'none'}. Best is trial 1528 with value: 0.5170644640922546.
Generating morgan fingerprints...
Generated fingerprints with 2048 features for 900 molecules
Data shape: X=(900, 2048), y=(900,)
Trial 2050: 5-fold CV loss = 0.5485
[I 2025-08-08 03:54:39,402] Trial 2050 finished with value: 0.5485179960727692 and parameters: {'fp_type': 'morgan', 'morgan_only_radius': 2, 'morgan_only_nBits': 2048, 'num_hidden_layers': 3, 'hidden_dim_0': 512, 'hidden_dim_1': 64, 'hidden_dim_2': 256, 'kl_weight': 0.0005063268043744581, 'lr': 0.00213463950275578, 'batch_size': 32, 'dropout_rate': 0.43124227448294405, 'prior_mu': 0.04714957713671538, 'prior_sigma': 0.07219830088279147, 'normalization': 'none'}. Best is trial 1528 with value: 0.5170644640922546.
Generating morgan fingerprints...
Generated fingerprints with 2048 features for 900 molecules
Data shape: X=(900, 2048), y=(900,)
Trial 2052: 5-fold CV loss = 0.8818
[I 2025-08-08 03:54:52,858] Trial 2052 finished with value: 0.8817677021026611 and parameters: {'fp_type': 'morgan', 'morgan_only_radius': 3, 'morgan_only_nBits': 2048, 'num_hidden_layers': 3, 'hidden_dim_0': 512, 'hidden_dim_1': 64, 'hidden_dim_2': 256, 'kl_weight': 0.0005168115627000548, 'lr': 0.0011924444084072889, 'batch_size': 32, 'dropout_rate': 0.43580571148729175, 'prior_mu': 0.04280774633704801, 'prior_sigma': 0.0776051894363855, 'normalization': 'none'}. Best is trial 1528 with value: 0.5170644640922546.
Generating morgan fingerprints...
Generated fingerprints with 2048 features for 900 molecules
Data shape: X=(900, 2048), y=(900,)
Trial 2053: 5-fold CV loss = 0.8040
[I 2025-08-08 03:55:06,259] Trial 2053 finished with value: 0.8039788246154785 and parameters: {'fp_type': 'morgan', 'morgan_only_radius': 3, 'morgan_only_nBits': 2048, 'num_hidden_layers': 1, 'hidden_dim_0': 512, 'kl_weight': 0.0005281402493389824, 'lr': 0.002089072855862718, 'batch_size': 32, 'dropout_rate': 0.439600250820449, 'prior_mu': 0.04459176563073579, 'prior_sigma': 0.07749428912868345, 'normalization': 'none'}. Best is trial 1528 with value: 0.5170644640922546.
Generating morgan fingerprints...
Generated fingerprints with 2048 features for 900 molecules
Data shape: X=(900, 2048), y=(900,)
Trial 2056: 5-fold CV loss = 0.5584
[I 2025-08-08 03:55:51,352] Trial 2056 finished with value: 0.5583519339561462 and parameters: {'fp_type': 'morgan', 'morgan_only_radius': 2, 'morgan_only_nBits': 2048, 'num_hidden_layers': 3, 'hidden_dim_0': 512, 'hidden_dim_1': 64, 'hidden_dim_2': 256, 'kl_weight': 0.00037310394178108645, 'lr': 0.00996366396918611, 'batch_size': 32, 'dropout_rate': 0.4489899067338945, 'prior_mu': 0.06594343220612772, 'prior_sigma': 0.07129285428348531, 'normalization': 'none'}. Best is trial 1528 with value: 0.5170644640922546.
Generating morgan fingerprints...
Generated fingerprints with 2048 features for 900 molecules
Data shape: X=(900, 2048), y=(900,)
Trial 2054: 5-fold CV loss = 0.5945
[I 2025-08-08 03:55:52,465] Trial 2054 finished with value: 0.594509071111679 and parameters: {'fp_type': 'morgan', 'morgan_only_radius': 3, 'morgan_only_nBits': 2048, 'num_hidden_layers': 3, 'hidden_dim_0': 512, 'hidden_dim_1': 64, 'hidden_dim_2': 256, 'kl_weight': 0.0005303913888388354, 'lr': 0.00203564095071903, 'batch_size': 32, 'dropout_rate': 0.44335711022225327, 'prior_mu': 0.04310711871556408, 'prior_sigma': 0.0771114179749935, 'normalization': 'none'}. Best is trial 1528 with value: 0.5170644640922546.
Generating morgan fingerprints...
Generated fingerprints with 2048 features for 900 molecules
Data shape: X=(900, 2048), y=(900,)
Trial 2055: 5-fold CV loss = 0.5324
[I 2025-08-08 03:56:59,783] Trial 2055 finished with value: 0.5323663949966431 and parameters: {'fp_type': 'morgan', 'morgan_only_radius': 2, 'morgan_only_nBits': 2048, 'num_hidden_layers': 3, 'hidden_dim_0': 512, 'hidden_dim_1': 64, 'hidden_dim_2': 256, 'kl_weight': 0.000534675439857805, 'lr': 0.0020320107405689147, 'batch_size': 32, 'dropout_rate': 0.4480742233588212, 'prior_mu': 0.06588302036511728, 'prior_sigma': 0.09729422990741533, 'normalization': 'none'}. Best is trial 1528 with value: 0.5170644640922546.
Generating morgan fingerprints...
Generated fingerprints with 2048 features for 900 molecules
Data shape: X=(900, 2048), y=(900,)
Trial 2058: 5-fold CV loss = 0.5247
[I 2025-08-08 03:57:21,319] Trial 2058 finished with value: 0.5246703922748566 and parameters: {'fp_type': 'morgan', 'morgan_only_radius': 2, 'morgan_only_nBits': 2048, 'num_hidden_layers': 3, 'hidden_dim_0': 512, 'hidden_dim_1': 64, 'hidden_dim_2': 256, 'kl_weight': 0.0006503965121532874, 'lr': 0.0022154908926818786, 'batch_size': 32, 'dropout_rate': 0.42500264501138335, 'prior_mu': 0.05528272817680171, 'prior_sigma': 0.07263336226844286, 'normalization': 'none'}. Best is trial 1528 with value: 0.5170644640922546.
Generating morgan fingerprints...
Generated fingerprints with 2048 features for 900 molecules
Data shape: X=(900, 2048), y=(900,)
Trial 2057: 5-fold CV loss = 0.5173
[I 2025-08-08 03:57:32,243] Trial 2057 finished with value: 0.5173132002353669 and parameters: {'fp_type': 'morgan', 'morgan_only_radius': 2, 'morgan_only_nBits': 2048, 'num_hidden_layers': 3, 'hidden_dim_0': 512, 'hidden_dim_1': 64, 'hidden_dim_2': 256, 'kl_weight': 0.0006440939881123845, 'lr': 0.0022527128625575254, 'batch_size': 32, 'dropout_rate': 0.4477196852734514, 'prior_mu': 0.04019347447372374, 'prior_sigma': 0.07368685270327956, 'normalization': 'none'}. Best is trial 1528 with value: 0.5170644640922546.
Generating morgan fingerprints...
Generated fingerprints with 2048 features for 900 molecules
Data shape: X=(900, 2048), y=(900,)
Trial 2061: 5-fold CV loss = 0.9012
[I 2025-08-08 03:57:41,788] Trial 2061 finished with value: 0.901247787475586 and parameters: {'fp_type': 'morgan', 'morgan_only_radius': 2, 'morgan_only_nBits': 2048, 'num_hidden_layers': 3, 'hidden_dim_0': 512, 'hidden_dim_1': 64, 'hidden_dim_2': 256, 'kl_weight': 0.0006771959815600119, 'lr': 0.0029403634637943567, 'batch_size': 128, 'dropout_rate': 0.4512851511387702, 'prior_mu': 0.03964984061268812, 'prior_sigma': 0.08569172707411604, 'normalization': 'none'}. Best is trial 1528 with value: 0.5170644640922546.
Generating morgan fingerprints...
Generated fingerprints with 2048 features for 900 molecules
Data shape: X=(900, 2048), y=(900,)
Trial 2049: 5-fold CV loss = 0.5199
[I 2025-08-08 03:58:12,655] Trial 2049 finished with value: 0.5199169635772705 and parameters: {'fp_type': 'morgan', 'morgan_only_radius': 2, 'morgan_only_nBits': 2048, 'num_hidden_layers': 3, 'hidden_dim_0': 512, 'hidden_dim_1': 64, 'hidden_dim_2': 256, 'kl_weight': 0.0005000362157351086, 'lr': 0.0021163840019269922, 'batch_size': 32, 'dropout_rate': 0.4123331430768727, 'prior_mu': 0.05205831343093138, 'prior_sigma': 0.08628346776035224, 'normalization': 'none'}. Best is trial 1528 with value: 0.5170644640922546.
Generating morgan fingerprints...
Generated fingerprints with 2048 features for 900 molecules
Data shape: X=(900, 2048), y=(900,)
Trial 2060: 5-fold CV loss = 0.5469
[I 2025-08-08 03:58:49,585] Trial 2060 finished with value: 0.5468506276607513 and parameters: {'fp_type': 'morgan', 'morgan_only_radius': 2, 'morgan_only_nBits': 2048, 'num_hidden_layers': 3, 'hidden_dim_0': 512, 'hidden_dim_1': 64, 'hidden_dim_2': 256, 'kl_weight': 0.01557390991308046, 'lr': 0.00225839416313577, 'batch_size': 32, 'dropout_rate': 0.429162753076315, 'prior_mu': 0.052012055841229234, 'prior_sigma': 0.07151731927310456, 'normalization': 'none'}. Best is trial 1528 with value: 0.5170644640922546.
Generating morgan fingerprints...
Generated fingerprints with 2048 features for 900 molecules
Data shape: X=(900, 2048), y=(900,)
Trial 2062: 5-fold CV loss = 0.5377
[I 2025-08-08 03:59:01,776] Trial 2062 finished with value: 0.5377326905727386 and parameters: {'fp_type': 'morgan', 'morgan_only_radius': 2, 'morgan_only_nBits': 2048, 'num_hidden_layers': 3, 'hidden_dim_0': 512, 'hidden_dim_1': 64, 'hidden_dim_2': 256, 'kl_weight': 0.0006661646333355801, 'lr': 0.002280083378922036, 'batch_size': 32, 'dropout_rate': 0.44973948060686453, 'prior_mu': 0.040165099529254324, 'prior_sigma': 0.08371172077450414, 'normalization': 'layer'}. Best is trial 1528 with value: 0.5170644640922546.
Generating morgan fingerprints...
Generated fingerprints with 2048 features for 900 molecules
Data shape: X=(900, 2048), y=(900,)
Trial 2059: 5-fold CV loss = 0.5432
[I 2025-08-08 03:59:08,806] Trial 2059 finished with value: 0.543165135383606 and parameters: {'fp_type': 'morgan', 'morgan_only_radius': 2, 'morgan_only_nBits': 2048, 'num_hidden_layers': 3, 'hidden_dim_0': 512, 'hidden_dim_1': 64, 'hidden_dim_2': 256, 'kl_weight': 0.000644928166653259, 'lr': 0.0022175283746091036, 'batch_size': 32, 'dropout_rate': 0.4230234295231966, 'prior_mu': 0.05304435501553614, 'prior_sigma': 0.084317489369016, 'normalization': 'none'}. Best is trial 1528 with value: 0.5170644640922546.
Generating morgan fingerprints...
Generated fingerprints with 2048 features for 900 molecules
Data shape: X=(900, 2048), y=(900,)
Trial 2064: 5-fold CV loss = 0.6193
[I 2025-08-08 03:59:23,793] Trial 2064 finished with value: 0.6192502915859223 and parameters: {'fp_type': 'morgan', 'morgan_only_radius': 2, 'morgan_only_nBits': 2048, 'num_hidden_layers': 3, 'hidden_dim_0': 512, 'hidden_dim_1': 64, 'hidden_dim_2': 256, 'kl_weight': 0.03536001204311389, 'lr': 0.0019436616982166266, 'batch_size': 64, 'dropout_rate': 0.4012219762876432, 'prior_mu': 0.03932017718224616, 'prior_sigma': 0.09015667096888069, 'normalization': 'layer'}. Best is trial 1528 with value: 0.5170644640922546.
Generating morgan fingerprints...
Generated fingerprints with 2048 features for 900 molecules
Data shape: X=(900, 2048), y=(900,)
Trial 2065: 5-fold CV loss = 0.5783
[I 2025-08-08 04:00:13,704] Trial 2065 finished with value: 0.5782835483551025 and parameters: {'fp_type': 'morgan', 'morgan_only_radius': 2, 'morgan_only_nBits': 2048, 'num_hidden_layers': 3, 'hidden_dim_0': 512, 'hidden_dim_1': 64, 'hidden_dim_2': 256, 'kl_weight': 0.000648100417549173, 'lr': 0.0018987817228301425, 'batch_size': 32, 'dropout_rate': 0.3827345068017278, 'prior_mu': 0.039815553374983194, 'prior_sigma': 0.08298207777653918, 'normalization': 'none'}. Best is trial 1528 with value: 0.5170644640922546.
Generating morgan fingerprints...
Generated fingerprints with 2048 features for 900 molecules
Data shape: X=(900, 2048), y=(900,)
Trial 2067: 5-fold CV loss = 0.5859
[I 2025-08-08 04:00:23,216] Trial 2067 finished with value: 0.5859003901481629 and parameters: {'fp_type': 'morgan', 'morgan_only_radius': 2, 'morgan_only_nBits': 2048, 'num_hidden_layers': 3, 'hidden_dim_0': 256, 'hidden_dim_1': 64, 'hidden_dim_2': 256, 'kl_weight': 0.00068112043861878, 'lr': 0.001925175799925132, 'batch_size': 32, 'dropout_rate': 0.39628770233210425, 'prior_mu': 0.04064728101695685, 'prior_sigma': 0.08354163283321234, 'normalization': 'none'}. Best is trial 1528 with value: 0.5170644640922546.
Generating morgan fingerprints...
Generated fingerprints with 2048 features for 900 molecules
Data shape: X=(900, 2048), y=(900,)
Trial 2066: 5-fold CV loss = 0.6363
[I 2025-08-08 04:00:26,289] Trial 2066 finished with value: 0.636305570602417 and parameters: {'fp_type': 'morgan', 'morgan_only_radius': 2, 'morgan_only_nBits': 2048, 'num_hidden_layers': 3, 'hidden_dim_0': 256, 'hidden_dim_1': 64, 'hidden_dim_2': 256, 'kl_weight': 0.0006837008514336894, 'lr': 0.0019190046769062075, 'batch_size': 32, 'dropout_rate': 0.411106350755528, 'prior_mu': 0.0399029944192268, 'prior_sigma': 0.08209813848294822, 'normalization': 'none'}. Best is trial 1528 with value: 0.5170644640922546.
Generating morgan fingerprints...
Generated fingerprints with 2048 features for 900 molecules
Data shape: X=(900, 2048), y=(900,)
Trial 2069: 5-fold CV loss = 0.5506
[I 2025-08-08 04:01:39,483] Trial 2069 finished with value: 0.5505820393562317 and parameters: {'fp_type': 'morgan', 'morgan_only_radius': 2, 'morgan_only_nBits': 2048, 'num_hidden_layers': 3, 'hidden_dim_0': 512, 'hidden_dim_1': 64, 'hidden_dim_2': 256, 'kl_weight': 0.0006970682924362951, 'lr': 0.0017969843552124336, 'batch_size': 32, 'dropout_rate': 0.39388379820447594, 'prior_mu': 0.04541821181484289, 'prior_sigma': 0.10364084078165368, 'normalization': 'none'}. Best is trial 1528 with value: 0.5170644640922546.
Generating morgan fingerprints...
Generated fingerprints with 2048 features for 900 molecules
Data shape: X=(900, 2048), y=(900,)
Trial 2068: 5-fold CV loss = 0.6040
[I 2025-08-08 04:01:49,200] Trial 2068 finished with value: 0.6039636373519898 and parameters: {'fp_type': 'morgan', 'morgan_only_radius': 2, 'morgan_only_nBits': 2048, 'num_hidden_layers': 3, 'hidden_dim_0': 512, 'hidden_dim_1': 64, 'hidden_dim_2': 256, 'kl_weight': 0.0006802000351224671, 'lr': 0.0017711135062128257, 'batch_size': 32, 'dropout_rate': 0.4066303039224975, 'prior_mu': 0.039487516914097645, 'prior_sigma': 0.0935757337745261, 'normalization': 'none'}. Best is trial 1528 with value: 0.5170644640922546.
Generating morgan fingerprints...
Generated fingerprints with 2048 features for 900 molecules
Data shape: X=(900, 2048), y=(900,)
Trial 2063: 5-fold CV loss = 0.5354
[I 2025-08-08 04:02:12,297] Trial 2063 finished with value: 0.5354098200798034 and parameters: {'fp_type': 'morgan', 'morgan_only_radius': 2, 'morgan_only_nBits': 2048, 'num_hidden_layers': 3, 'hidden_dim_0': 512, 'hidden_dim_1': 64, 'hidden_dim_2': 256, 'kl_weight': 0.000670538567697206, 'lr': 0.0019158704915406063, 'batch_size': 32, 'dropout_rate': 0.39387894408063734, 'prior_mu': 0.04050872898464726, 'prior_sigma': 0.08177678916497709, 'normalization': 'layer'}. Best is trial 1528 with value: 0.5170644640922546.
Generating morgan fingerprints...
Generated fingerprints with 2048 features for 900 molecules
Data shape: X=(900, 2048), y=(900,)
Trial 2070: 5-fold CV loss = 0.6331
[I 2025-08-08 04:02:27,765] Trial 2070 finished with value: 0.6330625534057617 and parameters: {'fp_type': 'morgan', 'morgan_only_radius': 2, 'morgan_only_nBits': 2048, 'num_hidden_layers': 3, 'hidden_dim_0': 512, 'hidden_dim_1': 64, 'hidden_dim_2': 64, 'kl_weight': 0.0006974036953679293, 'lr': 0.0017358603904700997, 'batch_size': 32, 'dropout_rate': 0.3933615440232358, 'prior_mu': 0.046283519697411506, 'prior_sigma': 0.09444703028968517, 'normalization': 'none'}. Best is trial 1528 with value: 0.5170644640922546.
Generating morgan fingerprints...
Generated fingerprints with 2048 features for 900 molecules
Data shape: X=(900, 2048), y=(900,)
Trial 2071: 5-fold CV loss = 0.5345
[I 2025-08-08 04:03:06,181] Trial 2071 finished with value: 0.5344830214977264 and parameters: {'fp_type': 'morgan', 'morgan_only_radius': 2, 'morgan_only_nBits': 2048, 'num_hidden_layers': 3, 'hidden_dim_0': 512, 'hidden_dim_1': 64, 'hidden_dim_2': 256, 'kl_weight': 0.0005990481260464811, 'lr': 0.0020086452048196208, 'batch_size': 32, 'dropout_rate': 0.39407942141872204, 'prior_mu': 0.05039310626692114, 'prior_sigma': 0.08675481299177472, 'normalization': 'none'}. Best is trial 1528 with value: 0.5170644640922546.
Generating morgan fingerprints...
Generated fingerprints with 2048 features for 900 molecules
Data shape: X=(900, 2048), y=(900,)
Trial 2072: 5-fold CV loss = 0.5689
[I 2025-08-08 04:03:32,653] Trial 2072 finished with value: 0.5688526451587677 and parameters: {'fp_type': 'morgan', 'morgan_only_radius': 2, 'morgan_only_nBits': 2048, 'num_hidden_layers': 3, 'hidden_dim_0': 512, 'hidden_dim_1': 64, 'hidden_dim_2': 256, 'kl_weight': 0.0005956681142259138, 'lr': 0.0020150066861773213, 'batch_size': 32, 'dropout_rate': 0.3942490054667476, 'prior_mu': 0.05151153244834261, 'prior_sigma': 0.08210484641409298, 'normalization': 'none'}. Best is trial 1528 with value: 0.5170644640922546.
Generating morgan fingerprints...
Generated fingerprints with 2048 features for 900 molecules
Data shape: X=(900, 2048), y=(900,)
Trial 2076: 5-fold CV loss = 0.6673
[I 2025-08-08 04:03:50,773] Trial 2076 finished with value: 0.6672949194908142 and parameters: {'fp_type': 'morgan', 'morgan_only_radius': 2, 'morgan_only_nBits': 2048, 'num_hidden_layers': 0, 'kl_weight': 0.0007202153697454229, 'lr': 0.0020735302220038273, 'batch_size': 32, 'dropout_rate': 0.41185440678420937, 'prior_mu': 0.058831683245242204, 'prior_sigma': 0.0773076436613171, 'normalization': 'none'}. Best is trial 1528 with value: 0.5170644640922546.
Generating morgan fingerprints...
Generated fingerprints with 2048 features for 900 molecules
Data shape: X=(900, 2048), y=(900,)
Trial 2077: 5-fold CV loss = 0.7390
[I 2025-08-08 04:04:24,504] Trial 2077 finished with value: 0.7389652132987976 and parameters: {'fp_type': 'morgan', 'morgan_only_radius': 2, 'morgan_only_nBits': 2048, 'num_hidden_layers': 2, 'hidden_dim_0': 512, 'hidden_dim_1': 64, 'kl_weight': 0.0005871977934533953, 'lr': 0.002672566590652257, 'batch_size': 32, 'dropout_rate': 0.38030779966369777, 'prior_mu': 0.038001567263232366, 'prior_sigma': 0.09037219472773443, 'normalization': 'none'}. Best is trial 1528 with value: 0.5170644640922546.
Generating morgan fingerprints...
Generated fingerprints with 2048 features for 900 molecules
Data shape: X=(900, 2048), y=(900,)
Trial 2075: 5-fold CV loss = 0.5223
[I 2025-08-08 04:04:39,406] Trial 2075 finished with value: 0.5222594141960144 and parameters: {'fp_type': 'morgan', 'morgan_only_radius': 2, 'morgan_only_nBits': 2048, 'num_hidden_layers': 3, 'hidden_dim_0': 512, 'hidden_dim_1': 64, 'hidden_dim_2': 256, 'kl_weight': 0.0005892296407190246, 'lr': 0.002063390792151196, 'batch_size': 32, 'dropout_rate': 0.44926314696571995, 'prior_mu': 0.06173664529421124, 'prior_sigma': 0.08029236008802021, 'normalization': 'none'}. Best is trial 1528 with value: 0.5170644640922546.
Generating morgan fingerprints...
Generated fingerprints with 2048 features for 900 molecules
Data shape: X=(900, 2048), y=(900,)
Trial 2074: 5-fold CV loss = 0.5178
