[I 2025-08-08 05:04:51,915] Trial 2234 finished with value: 0.5562831342220307 and parameters: {'fp_type': 'morgan', 'morgan_only_radius': 2, 'morgan_only_nBits': 2048, 'num_hidden_layers': 3, 'hidden_dim_0': 512, 'hidden_dim_1': 128, 'hidden_dim_2': 512, 'kl_weight': 0.00038785907386004184, 'lr': 0.002262148022840849, 'batch_size': 32, 'dropout_rate': 0.30583222799256304, 'prior_mu': -0.11218481251123427, 'prior_sigma': 0.07768072054451441, 'normalization': 'none'}. Best is trial 1528 with value: 0.5170644640922546.
Generating morgan fingerprints...
Generated fingerprints with 2048 features for 900 molecules
Data shape: X=(900, 2048), y=(900,)
Trial 2235: 5-fold CV loss = 0.5213
[I 2025-08-08 05:05:05,198] Trial 2235 finished with value: 0.5213454604148865 and parameters: {'fp_type': 'morgan', 'morgan_only_radius': 2, 'morgan_only_nBits': 2048, 'num_hidden_layers': 3, 'hidden_dim_0': 512, 'hidden_dim_1': 64, 'hidden_dim_2': 512, 'kl_weight': 0.00040073265488024676, 'lr': 0.001980668135674894, 'batch_size': 32, 'dropout_rate': 0.45733572215322255, 'prior_mu': 0.051147818444203776, 'prior_sigma': 0.06834885991535448, 'normalization': 'none'}. Best is trial 1528 with value: 0.5170644640922546.
Generating morgan fingerprints...
Generated fingerprints with 2048 features for 900 molecules
Data shape: X=(900, 2048), y=(900,)
Trial 2238: 5-fold CV loss = 0.7366
[I 2025-08-08 05:05:07,569] Trial 2238 finished with value: 0.7365800619125367 and parameters: {'fp_type': 'morgan', 'morgan_only_radius': 2, 'morgan_only_nBits': 2048, 'num_hidden_layers': 1, 'hidden_dim_0': 128, 'kl_weight': 0.00045073246204479605, 'lr': 0.0017281384417081893, 'batch_size': 64, 'dropout_rate': 0.43368439945934445, 'prior_mu': 0.04110280228073338, 'prior_sigma': 0.08767367924410241, 'normalization': 'none'}. Best is trial 1528 with value: 0.5170644640922546.
Generating morgan fingerprints...
Generated fingerprints with 2048 features for 900 molecules
Data shape: X=(900, 2048), y=(900,)
Trial 2239: 5-fold CV loss = 1.0693
[I 2025-08-08 05:05:27,091] Trial 2239 finished with value: 1.069342041015625 and parameters: {'fp_type': 'morgan', 'morgan_only_radius': 2, 'morgan_only_nBits': 2048, 'num_hidden_layers': 3, 'hidden_dim_0': 1024, 'hidden_dim_1': 256, 'hidden_dim_2': 256, 'kl_weight': 0.0005323058099702306, 'lr': 0.001732645214284392, 'batch_size': 64, 'dropout_rate': 0.43914597685307616, 'prior_mu': 0.029085879096387674, 'prior_sigma': 0.0868602207675707, 'normalization': 'none'}. Best is trial 1528 with value: 0.5170644640922546.
Generating morgan fingerprints...
Generated fingerprints with 2048 features for 900 molecules
Data shape: X=(900, 2048), y=(900,)
Trial 2236: 5-fold CV loss = 0.5421
[I 2025-08-08 05:05:43,368] Trial 2236 finished with value: 0.5421498596668244 and parameters: {'fp_type': 'morgan', 'morgan_only_radius': 2, 'morgan_only_nBits': 2048, 'num_hidden_layers': 3, 'hidden_dim_0': 512, 'hidden_dim_1': 64, 'hidden_dim_2': 512, 'kl_weight': 0.0003878601542685543, 'lr': 0.006299922515777942, 'batch_size': 32, 'dropout_rate': 0.45493780532645495, 'prior_mu': 0.02782473072953249, 'prior_sigma': 0.06755887238085843, 'normalization': 'none'}. Best is trial 1528 with value: 0.5170644640922546.
Generating morgan fingerprints...
Generated fingerprints with 2048 features for 900 molecules
Data shape: X=(900, 2048), y=(900,)
Trial 2240: 5-fold CV loss = 1.1279
[I 2025-08-08 05:05:51,008] Trial 2240 finished with value: 1.127891516685486 and parameters: {'fp_type': 'morgan', 'morgan_only_radius': 2, 'morgan_only_nBits': 2048, 'num_hidden_layers': 3, 'hidden_dim_0': 512, 'hidden_dim_1': 256, 'hidden_dim_2': 256, 'kl_weight': 0.0005273736180032699, 'lr': 0.001877071374618095, 'batch_size': 32, 'dropout_rate': 0.43774597757926775, 'prior_mu': 0.02712470204349337, 'prior_sigma': 0.09593447688612111, 'normalization': 'none'}. Best is trial 1528 with value: 0.5170644640922546.
Generating morgan fingerprints...
Generated fingerprints with 2048 features for 900 molecules
Data shape: X=(900, 2048), y=(900,)
Trial 2241: 5-fold CV loss = 0.6398
[I 2025-08-08 05:06:17,825] Trial 2241 finished with value: 0.6397724628448487 and parameters: {'fp_type': 'morgan', 'morgan_only_radius': 2, 'morgan_only_nBits': 2048, 'num_hidden_layers': 3, 'hidden_dim_0': 512, 'hidden_dim_1': 64, 'hidden_dim_2': 512, 'kl_weight': 0.0006434751498935211, 'lr': 0.0015173318785851463, 'batch_size': 32, 'dropout_rate': 0.4011569496321049, 'prior_mu': 0.03695524790882598, 'prior_sigma': 0.0626919848486328, 'normalization': 'none'}. Best is trial 1528 with value: 0.5170644640922546.
Generating morgan fingerprints...
Generated fingerprints with 2048 features for 900 molecules
Data shape: X=(900, 2048), y=(900,)
Trial 2237: 5-fold CV loss = 0.6364
[I 2025-08-08 05:06:22,076] Trial 2237 finished with value: 0.6364115357398987 and parameters: {'fp_type': 'morgan', 'morgan_only_radius': 2, 'morgan_only_nBits': 2048, 'num_hidden_layers': 3, 'hidden_dim_0': 1024, 'hidden_dim_1': 64, 'hidden_dim_2': 256, 'kl_weight': 0.0004520737631319225, 'lr': 0.0016985683821685502, 'batch_size': 32, 'dropout_rate': 0.43687940781617185, 'prior_mu': 0.028143888283488995, 'prior_sigma': 0.06774578387740623, 'normalization': 'none'}. Best is trial 1528 with value: 0.5170644640922546.
Generating morgan fingerprints...
Generated fingerprints with 2048 features for 900 molecules
Data shape: X=(900, 2048), y=(900,)
Trial 2243: 5-fold CV loss = 0.5262
[I 2025-08-08 05:07:02,255] Trial 2243 finished with value: 0.5261767387390137 and parameters: {'fp_type': 'morgan', 'morgan_only_radius': 2, 'morgan_only_nBits': 2048, 'num_hidden_layers': 3, 'hidden_dim_0': 512, 'hidden_dim_1': 128, 'hidden_dim_2': 1024, 'kl_weight': 0.000776273442813701, 'lr': 0.002314338731072192, 'batch_size': 32, 'dropout_rate': 0.4145101913669363, 'prior_mu': 0.041558496669900254, 'prior_sigma': 0.06285761732948461, 'normalization': 'none'}. Best is trial 1528 with value: 0.5170644640922546.
Generating morgan fingerprints...
Generated fingerprints with 2048 features for 900 molecules
Data shape: X=(900, 2048), y=(900,)
Trial 2244: 5-fold CV loss = 0.5302
[I 2025-08-08 05:07:22,415] Trial 2244 finished with value: 0.5301683902740478 and parameters: {'fp_type': 'morgan', 'morgan_only_radius': 2, 'morgan_only_nBits': 2048, 'num_hidden_layers': 3, 'hidden_dim_0': 512, 'hidden_dim_1': 128, 'hidden_dim_2': 512, 'kl_weight': 0.0007580499309451565, 'lr': 0.0023813894650009876, 'batch_size': 32, 'dropout_rate': 0.41111890897569314, 'prior_mu': 0.04389763818860582, 'prior_sigma': 0.0726282264866353, 'normalization': 'none'}. Best is trial 1528 with value: 0.5170644640922546.
Generating morgan fingerprints...
Generated fingerprints with 2048 features for 900 molecules
Data shape: X=(900, 2048), y=(900,)
Trial 2245: 5-fold CV loss = 0.5370
[I 2025-08-08 05:07:50,442] Trial 2245 finished with value: 0.537009334564209 and parameters: {'fp_type': 'morgan', 'morgan_only_radius': 2, 'morgan_only_nBits': 2048, 'num_hidden_layers': 3, 'hidden_dim_0': 512, 'hidden_dim_1': 128, 'hidden_dim_2': 1024, 'kl_weight': 0.0007484888736892273, 'lr': 0.002383171820181115, 'batch_size': 32, 'dropout_rate': 0.41320209355434956, 'prior_mu': 0.04422494270678949, 'prior_sigma': 0.07178874101609925, 'normalization': 'none'}. Best is trial 1528 with value: 0.5170644640922546.
Generating morgan fingerprints...
Generated fingerprints with 2048 features for 900 molecules
Data shape: X=(900, 2048), y=(900,)
Trial 2246: 5-fold CV loss = 0.5266
[I 2025-08-08 05:08:07,091] Trial 2246 finished with value: 0.5266277670860291 and parameters: {'fp_type': 'morgan', 'morgan_only_radius': 2, 'morgan_only_nBits': 2048, 'num_hidden_layers': 3, 'hidden_dim_0': 512, 'hidden_dim_1': 128, 'hidden_dim_2': 512, 'kl_weight': 0.0006004830945781895, 'lr': 0.0029864673110121466, 'batch_size': 32, 'dropout_rate': 0.4274761655390083, 'prior_mu': 0.04361886357274001, 'prior_sigma': 0.07309874328366962, 'normalization': 'none'}. Best is trial 1528 with value: 0.5170644640922546.
Generating morgan fingerprints...
Generated fingerprints with 2048 features for 900 molecules
Data shape: X=(900, 2048), y=(900,)
Trial 2247: 5-fold CV loss = 0.5397
[I 2025-08-08 05:08:08,898] Trial 2247 finished with value: 0.5397013366222382 and parameters: {'fp_type': 'morgan', 'morgan_only_radius': 2, 'morgan_only_nBits': 2048, 'num_hidden_layers': 3, 'hidden_dim_0': 512, 'hidden_dim_1': 128, 'hidden_dim_2': 64, 'kl_weight': 0.0006110305899313681, 'lr': 0.002969442352182405, 'batch_size': 32, 'dropout_rate': 0.4274825080649943, 'prior_mu': 0.04818692977169679, 'prior_sigma': 0.0730603661269359, 'normalization': 'layer'}. Best is trial 1528 with value: 0.5170644640922546.
Generating morgan fingerprints...
Generated fingerprints with 2048 features for 900 molecules
Data shape: X=(900, 2048), y=(900,)
Trial 2249: 5-fold CV loss = 0.5478
[I 2025-08-08 05:09:14,522] Trial 2249 finished with value: 0.5478082418441772 and parameters: {'fp_type': 'morgan', 'morgan_only_radius': 2, 'morgan_only_nBits': 2048, 'num_hidden_layers': 3, 'hidden_dim_0': 512, 'hidden_dim_1': 128, 'hidden_dim_2': 512, 'kl_weight': 0.0006725968568442459, 'lr': 0.0019322735462713998, 'batch_size': 32, 'dropout_rate': 0.37865655379207785, 'prior_mu': 0.058977376888138644, 'prior_sigma': 0.0576713000869538, 'normalization': 'layer'}. Best is trial 1528 with value: 0.5170644640922546.
Generating morgan fingerprints...
Generated fingerprints with 2048 features for 900 molecules
Data shape: X=(900, 2048), y=(900,)
Trial 2248: 5-fold CV loss = 0.6647
[I 2025-08-08 05:09:14,966] Trial 2248 finished with value: 0.6647367000579834 and parameters: {'fp_type': 'morgan', 'morgan_only_radius': 2, 'morgan_only_nBits': 2048, 'num_hidden_layers': 3, 'hidden_dim_0': 512, 'hidden_dim_1': 1024, 'hidden_dim_2': 512, 'kl_weight': 0.00065805945870863, 'lr': 0.0019565959395211755, 'batch_size': 32, 'dropout_rate': 0.3773432885008523, 'prior_mu': -0.12659051674025057, 'prior_sigma': 0.17763516116689348, 'normalization': 'layer'}. Best is trial 1528 with value: 0.5170644640922546.
Generating morgan fingerprints...
Generated fingerprints with 2048 features for 900 molecules
Data shape: X=(900, 2048), y=(900,)
Trial 2250: 5-fold CV loss = 0.5663
[I 2025-08-08 05:09:25,524] Trial 2250 finished with value: 0.5663163542747498 and parameters: {'fp_type': 'morgan', 'morgan_only_radius': 2, 'morgan_only_nBits': 2048, 'num_hidden_layers': 3, 'hidden_dim_0': 512, 'hidden_dim_1': 128, 'hidden_dim_2': 512, 'kl_weight': 0.0006859662774548985, 'lr': 0.0019523398236835842, 'batch_size': 32, 'dropout_rate': 0.4571820464238437, 'prior_mu': 0.1988752813445981, 'prior_sigma': 0.06570502774196049, 'normalization': 'none'}. Best is trial 1528 with value: 0.5170644640922546.
Generating morgan fingerprints...
Generated fingerprints with 2048 features for 900 molecules
Data shape: X=(900, 2048), y=(900,)
Trial 2242: 5-fold CV loss = 0.5274
[I 2025-08-08 05:09:36,102] Trial 2242 finished with value: 0.5274208307266235 and parameters: {'fp_type': 'morgan', 'morgan_only_radius': 2, 'morgan_only_nBits': 2048, 'num_hidden_layers': 3, 'hidden_dim_0': 512, 'hidden_dim_1': 128, 'hidden_dim_2': 512, 'kl_weight': 0.0006562425298884065, 'lr': 0.0022905815392265053, 'batch_size': 32, 'dropout_rate': 0.40877841530983994, 'prior_mu': 0.04202579008111466, 'prior_sigma': 0.06265844813341163, 'normalization': 'none'}. Best is trial 1528 with value: 0.5170644640922546.
Generating morgan fingerprints...
Generated fingerprints with 2048 features for 900 molecules
Data shape: X=(900, 2048), y=(900,)
Trial 2252: 5-fold CV loss = 1.1838
[I 2025-08-08 05:09:51,480] Trial 2252 finished with value: 1.1838345408439637 and parameters: {'fp_type': 'morgan', 'morgan_only_radius': 2, 'morgan_only_nBits': 2048, 'num_hidden_layers': 3, 'hidden_dim_0': 512, 'hidden_dim_1': 512, 'hidden_dim_2': 512, 'kl_weight': 0.0008508485571476621, 'lr': 0.002187510205464168, 'batch_size': 32, 'dropout_rate': 0.44706961603589407, 'prior_mu': 0.07523546310056438, 'prior_sigma': 0.06611634404937748, 'normalization': 'none'}. Best is trial 1528 with value: 0.5170644640922546.
Generating morgan fingerprints...
Generated fingerprints with 2048 features for 900 molecules
Data shape: X=(900, 2048), y=(900,)
Trial 2253: 5-fold CV loss = 0.8076
[I 2025-08-08 05:10:00,498] Trial 2253 finished with value: 0.8075701475143433 and parameters: {'fp_type': 'morgan', 'morgan_only_radius': 2, 'morgan_only_nBits': 2048, 'num_hidden_layers': 3, 'hidden_dim_0': 512, 'hidden_dim_1': 512, 'hidden_dim_2': 512, 'kl_weight': 0.0008760257080774008, 'lr': 0.002194117151592367, 'batch_size': 32, 'dropout_rate': 0.44736602877169196, 'prior_mu': 0.07809111131752253, 'prior_sigma': 0.06085109192260781, 'normalization': 'none'}. Best is trial 1528 with value: 0.5170644640922546.
Generating morgan fingerprints...
Generated fingerprints with 2048 features for 900 molecules
Data shape: X=(900, 2048), y=(900,)
Trial 2251: 5-fold CV loss = 0.8329
[I 2025-08-08 05:10:45,486] Trial 2251 finished with value: 0.83292436003685 and parameters: {'fp_type': 'morgan', 'morgan_only_radius': 2, 'morgan_only_nBits': 2048, 'num_hidden_layers': 3, 'hidden_dim_0': 512, 'hidden_dim_1': 1024, 'hidden_dim_2': 512, 'kl_weight': 0.0004895723468796764, 'lr': 0.0021625973493852504, 'batch_size': 32, 'dropout_rate': 0.4583164143241553, 'prior_mu': 0.07811166721350445, 'prior_sigma': 0.06524630116704921, 'normalization': 'none'}. Best is trial 1528 with value: 0.5170644640922546.
Generating morgan fingerprints...
Generated fingerprints with 2048 features for 900 molecules
Data shape: X=(900, 2048), y=(900,)
Trial 2257: 5-fold CV loss = 1.1576
[I 2025-08-08 05:10:54,602] Trial 2257 finished with value: 1.1575603246688844 and parameters: {'fp_type': 'morgan', 'morgan_only_radius': 2, 'morgan_only_nBits': 2048, 'num_hidden_layers': 3, 'hidden_dim_0': 512, 'hidden_dim_1': 128, 'hidden_dim_2': 256, 'kl_weight': 0.0005499155355796309, 'lr': 0.001575937055805522, 'batch_size': 128, 'dropout_rate': 0.3982417088652391, 'prior_mu': 0.0596701261882592, 'prior_sigma': 0.11040159967349375, 'normalization': 'none'}. Best is trial 1528 with value: 0.5170644640922546.
Generating morgan fingerprints...
Generated fingerprints with 2048 features for 900 molecules
Data shape: X=(900, 2048), y=(900,)
Trial 2256: 5-fold CV loss = 0.7202
[I 2025-08-08 05:11:12,671] Trial 2256 finished with value: 0.7201599180698395 and parameters: {'fp_type': 'morgan', 'morgan_only_radius': 2, 'morgan_only_nBits': 2048, 'num_hidden_layers': 3, 'hidden_dim_0': 512, 'hidden_dim_1': 128, 'hidden_dim_2': 256, 'kl_weight': 0.0005068795125720869, 'lr': 0.0016034281761682602, 'batch_size': 32, 'dropout_rate': 0.4282342261760139, 'prior_mu': 0.01863920068720773, 'prior_sigma': 0.08194859516109079, 'normalization': 'none'}. Best is trial 1528 with value: 0.5170644640922546.
Generating rdkit fingerprints...
Generated fingerprints with 512 features for 900 molecules
Data shape: X=(900, 512), y=(900,)
Trial 2255: 5-fold CV loss = 0.6703
[I 2025-08-08 05:11:38,285] Trial 2255 finished with value: 0.6703173756599426 and parameters: {'fp_type': 'morgan', 'morgan_only_radius': 2, 'morgan_only_nBits': 2048, 'num_hidden_layers': 3, 'hidden_dim_0': 512, 'hidden_dim_1': 128, 'hidden_dim_2': 256, 'kl_weight': 0.0005064000975351124, 'lr': 0.0021067426786551637, 'batch_size': 32, 'dropout_rate': 0.44540636494063074, 'prior_mu': 0.018487859957061984, 'prior_sigma': 0.08097068422990657, 'normalization': 'none'}. Best is trial 1528 with value: 0.5170644640922546.
Generating rdkit fingerprints...
Generated fingerprints with 512 features for 900 molecules
Data shape: X=(900, 512), y=(900,)
Trial 2258: 5-fold CV loss = 0.5325
[I 2025-08-08 05:11:57,619] Trial 2258 finished with value: 0.5325053870677948 and parameters: {'fp_type': 'morgan', 'morgan_only_radius': 2, 'morgan_only_nBits': 2048, 'num_hidden_layers': 3, 'hidden_dim_0': 512, 'hidden_dim_1': 128, 'hidden_dim_2': 512, 'kl_weight': 0.0005571599338504326, 'lr': 0.002554394713187497, 'batch_size': 32, 'dropout_rate': 0.42665474221445593, 'prior_mu': 0.03345990283902256, 'prior_sigma': 0.08145944775357777, 'normalization': 'none'}. Best is trial 1528 with value: 0.5170644640922546.
Generating morgan fingerprints...
Generated fingerprints with 2048 features for 900 molecules
Data shape: X=(900, 2048), y=(900,)
Trial 2259: 5-fold CV loss = 0.6348
[I 2025-08-08 05:12:11,374] Trial 2259 finished with value: 0.6347980737686157 and parameters: {'fp_type': 'rdkit', 'rdkit_only_maxPath': 7, 'rdkit_only_nBits': 512, 'num_hidden_layers': 3, 'hidden_dim_0': 512, 'hidden_dim_1': 64, 'hidden_dim_2': 512, 'kl_weight': 0.0008207144893326204, 'lr': 0.0027813172198994213, 'batch_size': 32, 'dropout_rate': 0.4369555168531565, 'prior_mu': 0.03438548580998856, 'prior_sigma': 0.12375951883975148, 'normalization': 'none'}. Best is trial 1528 with value: 0.5170644640922546.
Generating morgan fingerprints...
Generated fingerprints with 2048 features for 900 molecules
Data shape: X=(900, 2048), y=(900,)
Trial 2261: 5-fold CV loss = 0.7763
[I 2025-08-08 05:12:26,428] Trial 2261 finished with value: 0.7763334155082703 and parameters: {'fp_type': 'morgan', 'morgan_only_radius': 2, 'morgan_only_nBits': 2048, 'num_hidden_layers': 3, 'hidden_dim_0': 512, 'hidden_dim_1': 64, 'hidden_dim_2': 512, 'kl_weight': 0.000782862627508545, 'lr': 0.000578867302966851, 'batch_size': 32, 'dropout_rate': 0.4375563861443286, 'prior_mu': 0.05205760113847228, 'prior_sigma': 0.0687967266909619, 'normalization': 'none'}. Best is trial 1528 with value: 0.5170644640922546.
Generating morgan fingerprints...
Generated fingerprints with 2048 features for 900 molecules
Data shape: X=(900, 2048), y=(900,)
Trial 2260: 5-fold CV loss = 0.6462
[I 2025-08-08 05:13:16,854] Trial 2260 finished with value: 0.6461686968803406 and parameters: {'fp_type': 'rdkit', 'rdkit_only_maxPath': 7, 'rdkit_only_nBits': 512, 'num_hidden_layers': 3, 'hidden_dim_0': 512, 'hidden_dim_1': 64, 'hidden_dim_2': 512, 'kl_weight': 0.0008066446943691666, 'lr': 0.0025319478938663504, 'batch_size': 32, 'dropout_rate': 0.42023985439438505, 'prior_mu': 0.051927733350560536, 'prior_sigma': 0.06966748321729029, 'normalization': 'none'}. Best is trial 1528 with value: 0.5170644640922546.
Generating morgan fingerprints...
Trial 2262: 5-fold CV loss = 0.5808
[I 2025-08-08 05:13:17,216] Trial 2262 finished with value: 0.5808074235916137 and parameters: {'fp_type': 'morgan', 'morgan_only_radius': 2, 'morgan_only_nBits': 2048, 'num_hidden_layers': 3, 'hidden_dim_0': 512, 'hidden_dim_1': 128, 'hidden_dim_2': 512, 'kl_weight': 0.0007537529129731483, 'lr': 0.0017980094449591472, 'batch_size': 32, 'dropout_rate': 0.07930233073862641, 'prior_mu': 0.05342530102189623, 'prior_sigma': 0.06968768775627267, 'normalization': 'none'}. Best is trial 1528 with value: 0.5170644640922546.
Generated fingerprints with 2048 features for 900 molecules
Data shape: X=(900, 2048), y=(900,)
Generating morgan_rdkit fingerprints...
Generated fingerprints with 768 features for 900 molecules
Data shape: X=(900, 768), y=(900,)
Trial 2254: 5-fold CV loss = 0.6035
[I 2025-08-08 05:13:41,221] Trial 2254 finished with value: 0.6034886837005615 and parameters: {'fp_type': 'morgan', 'morgan_only_radius': 2, 'morgan_only_nBits': 2048, 'num_hidden_layers': 3, 'hidden_dim_0': 512, 'hidden_dim_1': 512, 'hidden_dim_2': 512, 'kl_weight': 0.0008573655419217154, 'lr': 0.0021683468412075587, 'batch_size': 32, 'dropout_rate': 0.44783733369663814, 'prior_mu': 0.07756361529221277, 'prior_sigma': 0.0691666557325072, 'normalization': 'none'}. Best is trial 1528 with value: 0.5170644640922546.
Generating morgan fingerprints...
Generated fingerprints with 2048 features for 900 molecules
Data shape: X=(900, 2048), y=(900,)
Trial 2265: 5-fold CV loss = 0.6794
[I 2025-08-08 05:13:45,555] Trial 2265 finished with value: 0.6794383525848389 and parameters: {'fp_type': 'morgan_rdkit', 'combined_morgan_radius': 2, 'combined_morgan_nBits': 512, 'combined_rdkit_maxPath': 7, 'combined_rdkit_nBits': 256, 'num_hidden_layers': 3, 'hidden_dim_0': 512, 'hidden_dim_1': 128, 'hidden_dim_2': 128, 'kl_weight': 0.0009603750188306858, 'lr': 0.0011394957625998085, 'batch_size': 32, 'dropout_rate': 0.45896283670757787, 'prior_mu': -0.0939030025850929, 'prior_sigma': 0.07467289077840579, 'normalization': 'none'}. Best is trial 1528 with value: 0.5170644640922546.
Generating morgan fingerprints...
Generated fingerprints with 2048 features for 900 molecules
Data shape: X=(900, 2048), y=(900,)
Trial 2263: 5-fold CV loss = 0.5841
[I 2025-08-08 05:13:50,748] Trial 2263 finished with value: 0.5841129839420318 and parameters: {'fp_type': 'morgan', 'morgan_only_radius': 2, 'morgan_only_nBits': 2048, 'num_hidden_layers': 3, 'hidden_dim_0': 512, 'hidden_dim_1': 128, 'hidden_dim_2': 512, 'kl_weight': 0.0006070472514383454, 'lr': 0.0018722757169553053, 'batch_size': 32, 'dropout_rate': 0.41649134376596136, 'prior_mu': 0.06469175119107773, 'prior_sigma': 0.05810614744769084, 'normalization': 'none'}. Best is trial 1528 with value: 0.5170644640922546.
Generating morgan fingerprints...
Generated fingerprints with 2048 features for 900 molecules
Data shape: X=(900, 2048), y=(900,)
Trial 2267: 5-fold CV loss = 0.5719
